url,title
https://blog.naver.com/prejiii/223257476305,홍대 LP카페 하우스오브바이닐 연남점 홍시 디저트도 맛있게
https://blog.naver.com/na-ja/223260345892,[홍대/연남] 연남동 신상 LP카페 하우스오브바이닐 연남점
https://blog.naver.com/everyday_28/223273487443,하우스 오브 바이닐 연남점
https://blog.naver.com/hong_cess/223262063344,[연남동 카페] 하우스오브바이닐
https://blog.naver.com/sososay2/223272635922,연남동 감성LP카페 하우스오브바이닐 홍시파블로바...
https://blog.naver.com/jww0523/223257381917,하우스오브바이닐 귀만 녹을 줄 알았는데 입도 녹은 미친 홍시...
https://blog.naver.com/gbhyeon2/223264657550,"연남 하우스오브바이닐, 분위기 좋고 편안한 감성 LP 카페에서..."
https://blog.naver.com/kimyounggeoroo/223276050052,일하고 놀고 뻗고 그냥 행복한 대학생 일상. 내일은 없어...
https://blog.naver.com/soyeah520_/223250173104,홍대 연남 연희동 무료 팝업스토어 상품 받기 그린칩스 페스티벌
https://blog.naver.com/njh0526/223244603447,연남동 연희동 동대문 데이트코스로 2023그린칩스페스티벌
