title,content
세빠띠 연남동 디저트 카페 & 디저트샵,"어느 날씨 좋은 날 방문한 연남동의 프랑스 디저트 카페 세빠띠 입니다 그동안 근처 카페 이미는 종종 갔어도 가까운 곳에 이런 곳이 있는 줄은 몰랐었어요 연남동 중에서도 대충유원지가 있는 한적한 골목에 아담하게 자리하고 있습니다 세빠띠 Cestparti _Seoul • 12:30 ~ 19:00 (화, 수 휴무) • 서울 마포구 연남동 570-25 하얀색 외벽의 깨끗한 외관입니다 전체적인 샷을 담고 싶었는데 양쪽으로 주차가 되어있는 관계로 간판 사진만 남길 수 있었어요 그리 크지 않은 내부에는 2인석 5개가 놓여있습니다 반대편에서 바라본 모습입니다 카운터와 쇼케이스, 아담한 커피 머신이 있어요 사실 사진 찍기 굉장히 어려운 조명이었는데요 아이폰 사용하시는 분들 아시겠지만 푸른 조명에서 검은 줄이 생기는 현상이 있죠 그런 현상이 일어나는 조명이었습니다 예쁜 사진 찍고 싶으신 분들은 참고하시고요 세빠띠의 쇼케이스입니다 무스케이크 위주의 디저트 카페 & 디저트 샵으로 보기만 해도 기분이 좋아지는 영롱한 비주얼의 무스 케이스가 가득이에요 🥰 아쉬웠던 점이 '아보카도'와 '밀크'를 먹으러 방문했는데 아보카도는 주말만, 밀크는 봄, 여름 시즌에는 만들지 않을 것이라 하시더라고요 저처럼 헛걸음하지 않도록 메뉴의 변동은 sns에 공지하셨으면 좋겠다는 생각이 듭니다 콕 집어 드시고 싶은 무스 케이크가 있다면 매장에 있는지 문의하시고 방문 추천입니다 마들렌, 휘낭시에, 티그레 등 구움과자류도 있어요 구움과자 보니 재인이 떠오르는군요 연희동에 있을 때 참 좋았는데! 한남동으로 이전해서 이후 저는 디저트 유목민이 되었지요😥 세빠띠의 음료 메뉴입니다 간단한 커피류와 마리아쥬 프레르의 티 메뉴를 갖추고 있습니다 음료는 대체로 저렴한 편인 것 같아요 세빠띠는 프랑스에서 디저트를 공부하고 경험을 쌓은 셰프님이 작년 5월에 오픈하셨다 하는군요 디저트 클래스를 운영하신다고 하는데 마침 이날도 바로 옆 공간에서 열정적으로 수업 중이시더라고요 관심 있으신 분들은 세빠띠 sns 계정을 참고하시기 바랍니다 (내돈내산에 클라스 홍보까지 😁) 사진 백 장 각 비주얼이죠 비록 정하고 온 디저트는 없었지만 충분히 예쁘고 맛있어 보이는 무스 케이크에요 비트 바닐라 무스 크림과 산딸기 베리가 조화로운 '비바'입니다 색소를 사용하지 않고 비트로 색을 낸 바닐라 무스라고 하는군요 그래서 이렇게 컬러가 자연스럽고 예쁜가 봐요 산딸기 콩포트가 새콤달콤 맛있었습니다 상큼한 살구 무스에 루바브 살구가 인서트로 들어간 무스케이크 '루바브 살구'입니다 살구 과육이 들어간 달콤하고 부드러운 맛으로 개인적으로는 비바보다 더 취향에 맞았어요 😄 그 외에 주문하지 않은 나머지 케이크들입니다 특히 저 '검은토끼'는 끝까지 고민되었어요 흑임자였으면 바로 골랐을 텐데 말이죠 ㅎㅎ 산뜻한 무스 케이크 좋아하시면 방문 추천입니다 그다지 붐비지도 않아 여유롭게 머물기에도 좋았어요 저도 조만간 티그레와 마들렌 먹으러 재방문 해야겠습니다 😊 50m © NAVER Corp. 세빠띠 서울특별시 마포구 동교로25길 53 1층 세빠띠"
연남동디저트카페 세빠띠 무스케이크 이뽀,연남동디저트카페 세빠띠 무스케이크 이뽀 곧 있을 지방 일정을 앞두고 일처리 한다고 정신이 없는 요즘.. 오늘은 잠깐 일정 사이에 짬이 나길래 연남동디저트카페 세빠띠에 방문해 보았어요 여기 무스 케이크가 넘넘 이뻐가지구 한 번 가보고 싶었거든요 물론 제가 좋아하는 무스케이크들도 한가득이던 곳!!! 매장도 깔끔하고 앞쪽에 주차도 가능했고 넘넘 좋았답니다. 50m © NAVER Corp. 세빠띠 서울특별시 마포구 동교로25길 53 1층 세빠띠 연남동디저트카페 세빠띠 위치는 요기! 좀 한적한 골목 쪽이라서 쉬기 좋아요 근데 또 어찌나 소문이 자자한지 ㅋㅋㅋ 외국인 분들도 많이 오시더라고요? 매장 오른쪽에는 디저트들이 보이구요 왼편으로 테이블이 있어요 안쪽에는 클래스 공간이 있더라구요 나두 여기서 무스케이크 만드는 거 배우고 싶당 ㅋ 카페 메뉴판은 요기! 엄훠.. 제가 좋아하는 마리아쥬 프레르네요 간만에 웨딩 임페리얼을 마셔봅니다 짝꿍은 뜨아로 주문쓰 음료부터 고르고 찬찬히 디저트를 보는데요 엄훠.. 여기 제가 좋아하는 구움 과자는다 오였더라구요 제 최애 꺄눌레부터 플로랑떙 (요거 파느넫가 생각보다 별로 없음) 그리고 티그레도 있구요 휘낭시에와 마들렌도 당연 있었어요 그리고 무스케이크들을 보면요? 크앙 이 비주얼 뭔가요~~~~ 대박 귀여움!!! 서양배도 궁금했는데 전 아보카도로 일단 만나봅니당 ㅋ 오.. 일단 케이스에서 꺼내도 아보카도 무스 케이크는 크네요 쪼꼬미일 줄 알았는데 맘에 드는! 그리고 커피 양이 아주 제 취향!!! 꽉 채워주셨더라구요 커피 맛도 오랜만에 마신 마리아쥬 프레르도 다 좋았구요 티그레 순삭하면서 ㅋㅋㅋ 여기 왤케 손님 많은지 먹어보니 알겠다며 속닥속닥 했또요 그리고 아보카도 케이크 커팅! 요런 디자인은 귀여우니깐 선물로도 좋은 듯...!! 연남동디저트카페 재생 0 좋아요 0 00:00 00:00  접기/펴기 연남동디저트카페 속 안은 요렇게 되어 있구요 겉은 초콜릿이구 안에 맛은 아보카도랑 바나나 맛이 나요 비주얼부터 맛까지 굉장히 색다른 디저트였구.... 먹어볼만 하더라구요 전 다른 것도 맛보러 또 가보려구요 무튼 연남동디저트카페 세빠디 강추쓰!!!
"일상 : 강민주의들밥 본점 · 연남동 세빠띠 · 더현대서울 나들이 · 포터(PORTER), 오빠 생일선물","@ 강민주의들밥 본점 요즘엔 이천으로 외근이 잦았다 😅 이번주에 또 갈 예정 지난번부터 가보고 싶었던 곳이었는데 이번에서야 드디어 가보게 됬네? (이천 외근가면 꼭 저기 가보고 싶었는데) 생각보다 사람도 엄청 많고 (심지어 우리 웨이팅해서 들어감) 음식도 제법 맛이 있었다 나중에 또 가고 싶은데 갈 수 있을랑가 모르겠네 호호 오빠랑 예전에는 자주 갔던 곳 @ 광장동 옛집 매번 여기서 김치찌개만 먹고, 남들이 먹는 삼겹살이 그렇게 맛있어보여서 군침을 흘리곤 했었는데, 이날은 우리도 삼겹살을 먹었다 사실 1차 메차쿠차 실패, 2차 전화로 만두전골 전화했는데 실패, 3차 콩예원까지 실패하고 겨우겨우 밥을 먹을 수 있었던 곳 오빠가 예전부터 다니던 곳이라 사장님이 얼굴 알아보시곤 고기 쪼꼼 더 주셨다 😊 (감사합니당) 진짜 맛있게 먹었던 저녁 (이렇게 또 나의 다욧은 바이바이) 소라엄마의 추천으로 가본 @ 연남동 세빠띠 지난번에 까눌레에 대한 이야기를 했는데, 엄마가 추천한 최고의 까눌레집이길래 가보았다 마침 오빠가 연남동을 가자길래 얼른 데리고 갔지요- 일단 구움과자들부터 먹어보기로 했다 내가 좋아하는 녀석들이 막 눈에 보인다 일단 까눌레는 무조건 먹기로 하고, 내눈에 들어온 시트롱 마들렌, 오빠 눈에 들어온 쇼콜라 아망드 피낭시에를 골랐고 아니! 😮 요 예뿌니들은!! 하면서 여기서는 딱 하나만 골라보기로 했다 오빠는 윗줄 가운데에 있는 샤를르뜨 시트러스를, 난 한여름 밤을 먹고 싶어서 결국엔 한여름 밤으로 초이스! (살구무스도, 청사과 케일 무스도 넘나 궁금하긴 했지만) 밥을 먹고 왔지만 한상차림 거하게 일단 내입맛에는, 시트롱 마들렌-한여름 밤 → 쇼콜라 아망드 피낭시에 → 까눌레 순으로 입맛에 맞았다 (미안, 까눌레는 내 입맛이 아니어따!) 특히 시트롱 마들렌과 한여름밤 와, 진짜 또 먹고 싶고 심지어 포장도 해가고 싶었다 요건 다 먹고난 접시 위에 올려진 마카롱 방금 만든 마카롱이라면서 테이블 당 하나씩 나눠주셨다 🙂 감사합니당 맛있게 잘 마무리-! @ 합정 키티버니포니 키티버니포니는 별도 포스팅 예정! 아무리 생각해도 평일에는 어려울 것 같고, 아님 주말인데 토요일은 오빠랑 가기 어려울거라 생각하고 나 혼자라도 가야하나 싶었던 곳인데 마침 딱 가게 됬네!? 잔-뜩 사오고 싶은걸 못사게 아주 팍팍 기를 꺾어주신 우리 남편님, 지갑을 지켜주셔서 감사하긴 한데 생각해보면 난 더현대서울에서 암것도 못샀는데 여기서라도 뭘 좀 왕창 살껄 그랬나봐요 하하 😳 그래도 공금으로 휴지케이스와 파우치를 살 수 있게 해주셔서 감사링 연남, 합정에 이은 마지막 코스는 @ 더현대서울 내가 가고싶은 곳이 다 몰려있어서 가자고 했다 일단 밥부터 먹고 다니기 시작- 무슨 떡볶이랬는데 까먹어따! 엄청 매콤한 떡볶이었는데 그 매움이 오래가지 않았던 기억 올라가는 길에 사진 한컷- 난 가고싶은데 딱 몇군데 밖에 없었다 메종키츠네, 아르켓, 쿠에른 셋다 구매 실패 😱 마지막으로 보테가베네타 가방 들어보고 싶어서 갔는데 살까말까 한참 고민하다가 그냥 나왔다 저 뚜껑도 없는 바구니 같은게 120만원이라니! 하면서 아닛! VESPA 946 CHRISTIAN DIOR 오빠랑 요고 보자마자 예뿌다고 했었는데 실물 영접! 에밀리 파리에 다가에서 보고 너무 예쁘다며 오빠랑 막 갖고싶다고 했었는데 이렇게 보니까 더 예뿌닷 오빠 카메라 가방 보러 들어간 포터 세상에나 여기 들어갈라고 웨이팅이라니요-! 기다리던 중 만난 귀요미- 뭐에 그렇게 꽂혀서 보고 있나 했더니 다른 댕댕이가 있었다 무슨 헤어진 연인마냥 애틋하게 쳐다보고 있는게 마냥 귀욤 나도 살짝쿵 귀여운 가방 하나 봤는데 12만원인가 그래서 빠이 🖐🏻 (요즘 긴축정책 중) 그리고 울 오빠의 카메라 가방은, 내가 오빠 생일선물로 사드렸지요오 🙂 원래 지갑사주려고 했는데 어쩌다 가방으로 사게 된거람? 어쨌든 오빠가 예쁘게 잘 매고 댕겼으면 좋겠어 🤍 (따로 포스팅 해볼까 고민듕) 우리 동네에 있는 레몬그라스가 드디어 오픈했다 @ 레몬그라스 다산지금점 일요일 저녁은 레몬그라스! 조금 미숙해보이는 직원분들이 있고, 사람이 많고 시끄러웠지만 음식은 맛있었다 그래도 저희 또 갈게요 🙂 나중엔 조금 더 나은 모습이길"
🧡🎃사르르녹는호박무스와 샤벳의 만남😋 무스케이크 맛집 연남동 세빠띠 🥑,"세빠띠 휘낭시에와 마들렌 베이킹클래스 전 아메리카노에 예쁜 호박무스케이크 넘 맛있게 한그릇 싹 비운 후기😋 50m © NAVER Corp. 세빠띠 서울특별시 마포구 동교로25길 53 1층 세빠띠 금,토,일 12:30-19:00 월,화,수,목은 정기휴무 하얀색 주택 1층 왼쪽이 카페, 오른쪽은 베이킹클래스 주차 가게 전화 문의 📞0507-1334-8372 세빠띠 마들렌&휘낭시에 클래스를 신청했는데 다른 무스케이크도 먹어보고싶어서 조금 빨리 도착했어용😋 덕이가 홍대까지 태워줘서 편하게 왔쪄용 ❤️ㅅㄹㅎ❤️ 가는 길이 익숙하다 했더니 2년전인가... 홍대 가죽공방 정규클래스를 1년정도 들었었는데 가는길이었더라구요!😉 그때만 해도 이 건물이 비어있었나 다른가게였는데 공간에 넘 잘어울리던 세빠띠 ..❤️ 건물이 하얗고 예뻐서 지나갈때마다 흘깃거리던 기억이 나서 신기했어요😊 2층의 다이어트클리닉도 궁금해지는...🤣 세빠띠 뜻은 불어로 시작, 출발이라는 뜻이래요🇫🇷 뭔가 멋있는 이름👍 1층 저 주차된 차 뒤쪽으로 가면 카페로 통하는 문이 있어요😉 오른쪽의 통창 공간도 궁금해서 흘깃 구경했는데 이 곳이 베이킹클래스 진행하시는 공간이었어요👍 얼른 듣고 싶은 베이킹클래스...❤️ 간판도 멋있는데, 위쪽에서 저렇게 조명을 비춰주니 더 예쁘고 분위기 있더라구용😘 검정색글씨와 황금색 간판& 따뜻한 느낌의 조명이 더해져서 나도 창업하면 저렇게 하고 싶은 고런 느낌😂 <무스케이크> 밀크 9,000 (우유 리큐르가 들어간 부드러운 무스크림의 베이스와 커피인서트) 인서트가 시나리오 용어라는데 만약 맞다면 맛을 강조하기위해 커피맛을 중간에 넣으셨다는 것 같아요! 한여름밤 8,800 (몽블랑의 밤크림, 바닐라무스, 크루스티앙의 조화) 크루스티앙이 불어로 바삭바삭한이라는 뜻이래요 호박 8,800 (깊고 진한 호박 콩포트와 은은한 호박 무스의 조화) 카라멜 8,800 (진한 100% 카라멜 무스크림과 카라멜 인서트) 아보카도 9,000 (아보카도와 바나나의 만남) 원래는 몽블랑 먹을거라고 외치면서 다짐하고 갔거등요..?! 몽블랑 귀신이라서 몽블랑 보이는 족족 먹던 시기거든요...ㅎ... 친규가 몽블랑에 한 맺혔냐고 할 정도로🤣 근데 뭔가 다 먹어보고싶어서 고민하던 중에 호박무스케이크가 넘 끌려서 호박에 아메리카노를 주문했어요💕 담에 몽블랑도 꼭 먹어봐야지 다짐...👍 무스케이크들 다 예쁘고 궁금하게 생겨서 마음같아서는 다 먹어보고 싶었어용... 쉽게 올 수 없는 홍대이기에 더 고민했던... 세상 맛있어 보이죠...? 츄릅.... 구움과자 러버..💕 <구움과자> -마들렌- 쇼콜라 밀크 마들렌 3,600 (쇼콜라 가나슈 몽떼의 밀크한 마들렌) 피스타치오 마들렌 3,700 (피스타치오 페이스트의 깊은맛의 마들렌) 바닐라 마들렌 3,500 (100% 바닐라 가나슈 몽떼 마들렌) *몽떼: 오르다, 상승하다 라는 의미로 가나슈 몽떼는 가나슈에 생크림을 섞어서 만든 크림. 레몬 마들렌 3,600 (상큼한 레몬과 부드러운 식감의 마들렌) -휘낭시에- 망코 피낭시에 2,800 (망고와 코코넛의 만남) 솔티클래식 피낭시에 2,600 (클래식 피낭시에와 말돈소금) 콘레드 피낭시에 2,800 (옥수수와 아몬드 크럼블의 쫀득한 휘낭시에) -구움과자- 플로랑탱 3,400 (달지 않은 카라멜과 고소한 아몬드) 샤블레 브르통 3,400 (프랑스 브루티뉴 지방 사블레 ) -까눌레- 보르도 까눌레 3,300 (럼의 향기 프랑스 보르도 클래식 까눌레) 마들렌과 휘낭시에 베이킹클래스에서 만들어 볼거라서 패스했습니당 <음료> -커피- 에스프레소 / 아메리카노 4,500 바닐라 아메리카노 / 헤이즐넛 아메리카노 / 카페라떼5,000 바닐라 라떼 / 헤이즐넛 라떼 5,500 -차- 6,000 마르코폴로 (베리류의 달콤한 과일 맛과 꽃향) 베르 프로방스 (장미의 은은함과 라벤더향) 바닐라 데 질 (달콤한 부르봉 바닐라와 코코아 향) 파리 얼그레이 (묵직하고 진한 베르가못 향) -음료- 5,000 골드메달 애플주스 레몬 탄산수 언젠가부터 단 맛이 강한 디저트들과는 아메리카노가 넘 깔끔하고 맛나더라구요! 아메리카노 누가 사줘도 잘 안마셨었는데 어느새 아메의 맛을 알아버린 사회인... 그래도 아직은 아메에 두려움이 있어서 바닐라시럽 들어간 바닐라 아메리카노로! 전체적으로 깔끔하게 정돈된 느낌의 매장이에요! 화장실도 카페 내부에 있는데 완전 깔끔하답니다👍 테이블은 4개 정도로 넓은 매장은 아니지만 제가 갔을 때는 다들 나가시던 타이밍이어서 조용히 먹을 수 있었어요🥰 세빠띠 호박 호박 무스케이크와 바닐라 아메리카노가 나왔어요😍 넘 귀엽게 생긴 호박무스케이크🧡 꽃모양의 접시에 얹어져 나와서 그런지 더 귀엽더라구용🌸 세빠띠 바닐라아메리카노 수저와 나이프, 포크도 앤틱한 느낌이어서 정말 호박 잘라먹는 느낌이었어요☺️ 연남동 디저트카페 스릉...! 호박아 좀 자를게...😱 가까이서 보니 호박 텍스처가 살아있어서 정말 진짜 호박 같은 느낌🤔 안쪽은 어떻게 생겼을지, 어떤맛일지 넘 궁금했어요! 쨔란-! 부서지는 느낌의 초콜릿이 아니라 꾸덕한 느낌의 초콜릿이라서 깔끔하게 잘리더라구요- 꽉꽉 들어차 있는 무스케이크라 군침 좔좔..🧡 제가 주황색을 그렇게 좋아하는 편이 아닌데 호박은 좋아해요(...?!)🧡 홍대 케이크 얼른 얼른 먹어보자!!💛🧡 저 찐주황부분은 호박콩포트인 것 같은데 약간 아이스홍시느낌이라서 맛도 궁금했어요🤨 와앙😱 저 진한 부분이 샤벳트 같은 느낌이고 노란부분이 크리미한 느낌의 호박무스인데 약간 그릭요거트 질감(?!)이고 입에서 은은하게 호박맛을 남기고 사르륵 녹더라구요! 크리미한 호박무스만 있었다면 자칫 무거울 수 있는 느낌이었는데, 아삭한 느낌의 호박콩포트가 샤벳처럼 같이 사르르 녹아서 무겁지 않더라구요!🥰 음.. 단호박보다는 정말 찐 주황호박의 담백한 맛이랄까요🧡 맨 아래쪽에는 초코크런키 느낌의 과자가 있는데🍫 이 부분도 넘 맛있더라구용😋 아메리카노도 홀짝 홀짝 다 마신거 보이시죠😍 호박무스 먹으면서 호박 맛 음미하다가 바닐라 아메리카노로 입가심하고 또 먹고 했어요🍸😋 얼른 구움과자들도 만들어서 먹고 싶더라는..🍪 조명 위의 천장도 넘 세련됐고 로고도 CPt가 다 보여서 정말 잘 만들었다 생각이 들었어요🥰 정말 깔끔하면서도 아늑한 느낌의 세빠띠❤️ 다 먹으니 베이킹클래스 들을 시간이 됐어요🤩 자 이제 가보실까나😉❤️"
"세빠띠, 연남동 프랑스 구움과자 디저트 카페 추천 (아몬드플로라탱/사블레브르통/밀크)","홍대-연남동은 주말에 사람이 정말 많다 아니 평일에도 많다😂 가끔 운 좋게 길거리에 사람이 없는 순간도 있긴 한데 그때마다 드는 생각은... 카페조차 진짜 엄~청 많아서 신기할 정도라는 것! 심지어 주말이 되면 그 많은 카페에 앉을 자리가 없다는 걸 알고도 갔다가 이미 1일 1카페를 마치고 걷던 길에 희한하게 눈에 띄어 홀린 듯 들어간, 세빠띠 #세빠띠 #프랑스디저트 #연남동카페 50m © NAVER Corp. 세빠띠 서울특별시 마포구 동교로25길 53 1층 세빠띠 영업시간 월-목요일 정기휴무(베이킹클래스) 금-일요일 12:30-19:00 기타사항 주차, 포장, 예약, 무선 인터넷 여자/남자 공용 화장실 (청결함) 인스타그램 @cestparti_seoul 블로그 @cestparti_seoul 메뉴정보 음료 종류는 간단한 편! 한~~~창 까눌레에 빠져서 전국 카페에서 파는 까눌레는 다~ 먹어볼 기세였었는데 정작 세빠띠의 까눌레들을 아직 못 먹어본걸 포스팅하면서 깨달았댜 맙소사? (빠른 날 가서 먹어 보겠다는 말) 나름 고민하며 디저트를 고르고 있는데 다른 테이블의 손님분들이 남아 있던 대부분의 케이크를 다 주문하고 임채익 파티셰님께 싸인도 받는 걸 보고 아 유명한 곳이구나! 뒤늦게 깨달아서 후에 2번째 방문했을 때 찍은 사진들👍 #먹을줄만아는사람 세빠띠 외관 한국어로도 설명이 돼있어서 좋았음!👍👍👍 프랑스 디저트 클레스 장소 프랑스 디저트 카페 임채익 파티셰님 ’세빠띠‘ 정보 프랑스 리옹과 파리에서 프랑스 전통 디저트를 공부하고 직접 경험한 후 한국으로 돌아와 2022년 5월 19일 목요일부터 가오픈 중인 연남동 프랑스 디저트 카페! 카페 이름이 C'est parti(세빠띠)인데 그 의미가 '시작하다, 출발하다'라고 한다 그러니 ""세빠띠에 가자""라고 하면 [시작하러 가자]도 되는 건가? #아무말대잔치 세빠띠 내부 카페가 그리 넓진 않지만 환하고 깨끗하게 관리되는 화장실부터 베이킹 클래스 공간까지 쾌적해 보였다! 앉을 수 있는 테이블은 4개 정도뿐이고 이마저도 항상 손님들이 앉아있어서 보통은 포장 손님들이 많아 보였댜🤗 처음 갔을 때 주문했었던 구움과자에 밀크 케이크를 추가 주문했다 카라멜 아몬드 플로랑탱 / 3,400원 Florentin Caramel Aamnde 달지 않은 카라멜과 고소한 아몬드 조합 사블레 브르통 / 3,400원 Sable Breton 프랑스 브루타뉴 지방의 사블레 밀크 9,000원 Le Lait 우유 리큐르가 들어간 부드러운 무스 크림 베이스와 커피의 조합 얼어있어서 30분 정도 기다렸어야 했는데 30분 땡!하기도 전에 먹기 바빴던 나... 우리... 케이크 속이 진짜 예술이었지만 사진이 없... 독특했던 커틀러리🤗 먹기 전, 항상 분주한 내 상태🥹 블로그를 시작하기 전부터 매번 이래서 왜 블로그 안 하냐는 말을 종종 들었댜🤭 마지막 사진 2장은 친구인 언니가 갤럭시s23로 촬영한 것! ㅋㅋㅋ👍 #갑자기친구폰자랑 세빠띠의 디저트는 흔하게 먹을 수 없는 고급진 맛이라 다른 메뉴도 궁금하다 수업도 궁금하지만 넘 어려울 거 같고🙄 빨리 꼭 재방문해서 까눌레와 다른 구움 과자들도 먹어 보고 싶다, 뿅!"
