title,content
"연남동 모리노팡 , 빵순이 울엉","모리노팡 서울특별시 마포구 연남로3길 22-16 101호 모리노팡 👀 연남동 모리노팡 홍대입구에 내려서 연트럴파크를 지나 연남동에 꽤 애매한 주택단지에 위치해있다 저 입간판 없으면 여기가 맞나? 싶을듯 ㅎ 줄서는 맛집은 왠만하면 찾아가지 않지만 현재는 줄서거나 빵이 빨리 소진되지않는 신규 맛집이라 후다닥 가보았다. (인스타 홍보를 슬슬 시작하는듯하니 혹시라도 입소문 나기전에 가봐야함) 모리노팡 연남동 빵집 지금 일본여행이 너무나도 가고싶은 나에게 알고리즘이 추천해준건지 우연히 모리노팡 야키소바팡 사진을 보게되었다 동경제과학교를 수석 졸업한 브레드 아티스트가 직접 만드는 것이라고 함 일본여행도 못가는데 당장 고고 🙋🏻‍♀️ (사실 일본에서 빵 사먹어 본적 없음 그냥 일본은 빵 장인이 많은 것 같다) 여하튼 내가 구매한 빵 몇가지를 소개해보려한다 연남동 모리노팡 🤎 시오바타 (소금빵) 1800원 소금빵 다른빵은 나눠먹어도 되는데 소금빵은 1인 1개 필수라서 2개 구매함 (양보 못해) 맛있다! 소금빵 좋아하는 편이고 몇군데 다른 빵집에서 소금빵을 먹어본 자로 여기 소금빵 맛있다! 참고로 소금빵은 카운터에서 구매한다고 말해야 챙겨주신다! 야키소바팡 (야끼소바빵) 3300원 야끼소바빵 이것도 맛있다! 빵이 일단 보드랍다 예상가는 맛이지만 면에 빵을 먹는 느낌 생강이 올라가 있어 새롭다 일본에서 제대로 먹어보고싶다 (일본에서 먹나 여기서 먹나 맛은 왠지 같을 것 같다) 카레-팡 (카레빵) 3600원 카레빵 구매할땐 별 생각이 없었는데 크기에 비해 좀 비싼편같다 근데 어쩜 이것도 맛있다 남편도 맛있다고 함 일단 빵 부드럽고 카레가 맛있다 갠적으로 고로케 타입 빵은 좋아하지 않는데 이빵은 겉면에만 빵튀김가루? 가 붙어있어서 느끼하지 않아 순삭이다. 멘타이바겟토(명란바게트빵) 3800원 명란바게트빵 이건 따뜻하게 먹으면 맛있을 것 같다. 감태가 올라가 있는게 정성스럽지만 나는 또 생각날 정도의 빵은 아닐듯 하다 그렇다고 맛없는건 아니다 먹을만하다 (내스타일은 아님) 메롬팡 (메론빵) 2200원 메론빵 요놈!! 맛있네? 모리노팡은 빵이 참 부드럽다 이것도 그런빵에 속하는데 내가 메론빵을 제대로 먹어본적 없는데 아 이게 메론빵 인가 싶다! 우리나라 소보로빵은 퍽퍽하고 딱딱하다면 메론빵은 아주 부드러운 맛! 메론맛은 안나고 그냥 달콤하고 부드러운 소보로 느낌! 남편도 좋아함 단팥빵 가격 까먹음 단팥빵 평범한 팥빵이다! (자칭 팥순이라 단팥빵 많이 먹어봤음) 팥이 많이 달지 않아 좋았다 but, 특별하진 않다!soso! 너어어어무 많이 유명해지지만 않음 좋겠다 요즘 왠만한 맛집 오픈런 하는거 극혐인데 ㅜ 적당히 인기있는 연남동빵집으로 오래 있어주면 좋겠다 집근처였다면 자주 갔을듯 싶다 오빠랑 연남동 가게되면 슬렁슬렁 들러 먹어보지 못한 다른 빵 구매해 봐야지! 빵순이 내돈내산 취향저격 연남동 모리노팡 빵집 굿굿 🤭"
"연남동 빵집｜일본 디저트 맛집 ""모리노팡""","모리노팡 ⏰️ 화-일 11:00-20:00 ⏰️ 월 휴무 📍 1월 방문 잠시나마 일본 여행 온듯한 기분을 낼 수 있는 곳 아기자기한 디저트가 많은 일본식 빵 전문점 but 테이크아웃 매장이라 실내 좌석이 없는 게 다소 아쉬움 모리노팡 서울특별시 마포구 연남로3길 22-16 101호 森のパン 모리노팡 J-style Bakery(@morinopan_bakery) • Instagram 사진 및 동영상 팔로워 515명, 팔로잉 25명, 게시물 10개 - 森のパン 모리노팡 J-style Bakery(@morinopan_bakery)님의 Instagram 사진 및 동영상 보기 www.instagram.com 메뉴&가격 딸기산도(이치고쟈므산도), 초코빵(나마초코), 크림팥빵(나마앙팡) 연남동 모리노팡 메뉴 너무나 귀여운 토끼(우사기팡)와 고양이(코로네코), 코알라빵(도부츠팡) 그리고 모리노팡의 시그니처 메뉴인 소금빵(시오바타)🥐 연남동 모리노팡 메뉴 크림빵(크리므팡), 팥앙금빵(앙팡), 카레빵(카레팡), 메론빵(메론팡) 연남동 모리노팡 메뉴 야끼소바빵(야키소바팡), 돈까스샌드위치(카츠산도) 새우레몬크림빵(에비레몬크리므마요), 새우커리빵(에비치리) 명란치즈빵(타라못치즈), 소세지빵(소세지팡) 연남동 모리노팡 메뉴 명란바게트(멘타이바겟토), 프렌치토스트(하므치흐렌치) 연남동 모리노팡 메뉴 메이플시럽프렌치바게트(메프르흐렌치), 바나나머핀(바나나마휘인) 연남동 모리노팡 메뉴 사과빵(링고팡), 밤파이(마롱파이) 연남동 모리노팡 메뉴 핫도그빵(독크팡), 메이플시럽호두빵(메프르라운도), 식빵(키와메쇼쿠팡) 연남동 모리노팡 메뉴 크루통, 마카다미아쿠키(마키다미아크록캉), 메론빵러스크(메롬팡라스크) 음료 메뉴-커피 주문 시 토스트(+버터) 한 조각 무료(선착순 15명 한정) 연남동 모리노팡 메뉴 내부 좌석 테이크 아웃 전용 매장으로 취식 공간 없음 주문 메뉴 링고팡, 메프르흐렌치, 야키소바팡, 멘타이바겟토, 카레팡, 마롱파이, 타라못치즈 메롬팡라스크, 코로네코, 우사기팡, 마키다미아크록캉, 크리므팡, 시오바타 빵 가격이 생각보다 너무 착하기도 하고 다 너무 맛있어 보여서 이것저것 담으니까 45,000원어치 플렉스💸💸 근데 또 막상 펼쳐놓고 보니 그렇게 많아 보이지도 않는 제가 먹은 빵들만 간단하게 후기 써 볼게요😋 연남동 모리노팡 시오바타 모리노팡의 시그니처 메뉴인 시오바타, 소금빵 지금껏 먹어본 소금빵 중 바닥부분이 가장 바삭👍🏻 아무런 조리 없이 먹어도 맛있게 먹긴 했는데 아무래도 렌지나 에프에 살짝 돌려먹어야 그 맛이 배가 됐을 것 같은 아쉬움이😂 연남동 모리노팡 시오바타 마롱파이 리치몬드 밤파이 맛보고 난 뒤로 밤 디저트만 보이면 무조건 사 먹는데 모리노팡에도 마침 밤파이가 있길래 사봤어요 리치몬드는 밤 본연의 단맛만 느껴진다면 모리노팡은 위에 코팅된 설탕 때문에 밤+설탕 단맛이 섞인 느낌 맛있게 먹었지만 개인적으로 리치몬드가 입에 더 잘 맞았어요 연남동 모리노팡 마롱파이 🔍🔍🔍 연남동 모리노팡 마롱파이 우사기팡 보자마자 너무 귀여워서 안 살 수가 없던 토끼빵 심지어 안에 초코 잼까지 초코 잼이 더 듬뿍 있었으면 좋았겠다는 아쉬움이 있지만 향긋한 빵 냄새 덕분에 맛있게 먹었어요 우사기팡 3단 변화〰️🐰 연남동 모리노팡 우사기팡 크리므팡 봉투 열자마자 향긋한 빵 냄새가 굿 생크림이 아니고 커스터드 크림이라 좋았어요 연남동 모리노팡 크리므팡 🔍🔍🔍 연남동 모리노팡 크리므팡 타라못치즈 치즈 때문에 짭조름한 맛이 강할 줄 알았는데 오히려 단맛이 강해서 놀랐어요 진한 단맛+끝에 살짝 짠맛이 스쳐 지나가는 빵 연남동 모리노팡 타라못치즈 🔍🔍🔍 연남동 모리노팡 타라못치즈 메롬팡라스크 너무 먹음직스럽게 생겨서 사본 건데 역시나 보기 좋은 빵이 맛도 좋죠👍🏻 러스크가 딱딱하다는 생각은 버려주세요! 입에 넣자마자 사르르 녹아서 진짜 강추! 러스크 잘못 먹으면 너무 딱딱해서 입안에 상처 나는데 이건 전혀 그렇지 않아서 굿👍🏻 연남동 모리노팡 메롬팡라스크 🔍🔍🔍 연남동 모리노팡 메롬팡라스크"
홍대 / 연남동 / 빵집 / 모리노팡 森のパン,"모리노팡 森のパン 주소 : 서울 마포구 연남로5길 42 1층 모리노팡 2공항경의중앙홍대입구역 2번 출구에서 671m 영업시간 : 일, 화, 수, 목, 금, 토 11:00 ~ 20:00 / 정기휴무 (매주 월요일) / 제품 소진 시 마감 안녕하세요. Cosmos_이름입니다! 오늘 소개해 드릴 빵집은 연남동 모리노팡 森のパン 이라는 빵집입니다! 모리노팡 森のパン은 홍대입구역 2번 출구에서 671m 거리 위치합니다. 모리노팡 森のパン 의 모든빵은 동경제학교를 수석 졸업한 브레드 아티스트가 직접 만들며 모리노팡 森のパン은 숲의 빵이라는 뜻이라고 합니다! 연남동에 일본 빵을 판매한다고 하여 바로 가봤습니다! 출발!! 출발하기 전에! 며칠 전 포스팅했던 후아유(WHO.A.U) '와이드 벌룬 데님' 바지 착샷입니다! (사진을 워낙 못 찍어 죄송함돠!!,, 다음에 다시 올릴게요!) 후아유(WHO.A.U) / DENIM STYLE / '와이드 벌룬 데님' 바지 안녕하세요. Cosmos_이름입니다. 오늘은 제가 구매한 후아유(WHO.A.U) '와이드 벌룬 데님'... blog.naver.com 바지 정보는 바로 아래 링크로 들어가시면 됩니다! 진짜 출발!! 가게 외부는 정말 일본에 온 거처럼 아기자기하며 이쁩니다. 특히 테라스 벽에 그려져있는 숲 그림들이 너무 이쁘더라고요! 가게랑 너무 찰떡인 거 같았습니다! 가게 외부에는 앉을 수 있는 테라스가 있는데 방문한 날 너무 더웠어요,, 날씨가 많이 안 더웠으면 커피 한잔하면서 테라스에 앉고 싶었는데 무진장 더운 날이라,, 포기,, 가게 내부에 들어가시면 정말 아기자기하고 진짜 일본 빵집인 거 같았어요! 우드 톤에 초록색 포스터, 바구니 때문에 숲의 배경이라는 게 확실히 느껴졌어요! 너무 이쁘지 않나요!? 그리고 쿠로네코팡(검은고양이빵) 너무 귀엽지 않나요? 블랙 카카오와 진한 가나슈가 만난 빵이라고 하는데 가격도 괜찮았고 비주얼도 먹으면 아까울 정도로 귀여웠어요! 저는 이 야키소바팡이 제일 궁금했어요! 야키소바가 들어가 있는? 빵?? 맛이 너무 궁금해 바로 바구니에 담았습니다! 그 외 塩バター 시오바타 라는 소금빵, カレーパン카레-팡, 케이크, 에비치리(칠리새우 샌드) 등 빵 종류가 엄청 많았는데! 사진에 못 담았어요,, 저희가 3명이서 갔는데 사장님이 너무 정신없어 하실까 봐 저는 쓱 자리로 빠졌어요,,, 인프피란,,, 저희는 塩バター 시오바타, 에비치리(칠리새우 샌드), 야끼소바팡을 주문했습니다! 저희가 먹고 간다고 하니 이렇게 이쁜 나무 트레이에 담아주셨어요! 친구한테 릴스찍을거라고 짤라달라했어욬ㅋㅋ 야끼소바팡은 솔직히 제 입맛에는 맛있었는데 호불호가 갈릴 거 같았어요! 소금빵은 당연 맛있고! 에비치리(칠리새우 샌드)는 레몬향이 확 나면서 단맛이 크게 났어요! 생각보다 엄청 맛있더라고요! 다른 메뉴도 먹어보고 싶었는데 그전에 카페 한번 갔다 오기도 했고 너무 더운 날씨라 다음에 한번 더 와야지 생각하고 금방 먹고 나갔습니다! 빵 가격도 너무 괜찮았고 일본 빵 종류를 좋아하신다면 꼭 추천드립니다! 모리노팡 서울특별시 마포구 연남로5길 42 1층 모리노팡"
연남동 일본 빵집 모리노팡,"연남동 일본 빵집 모리노팡 꿍이랑 연남동 데이토~ 밥먹으러 갈 곳 브레이크 타임 걸려서 커피랑 빵 간단하게 먹으러 방문한 빵집! 모리노팡 서울특별시 마포구 연남로5길 42 1층 모리노팡 홍대에 일본 빵집 여러군데 있는데 매번 아오이토리 가다가 이번엔 새로운 곳 도전해봤다. 이름부터 귀여운 모리노팡! 매주 월요일 휴무 영업시간 11 00 - 20 00 재료 소진시 마감 안에도 테이블이 4개 이상 있어서 먹고 갈수도 있는 빵집이다. 모리노팡 이름에 어울리는 인테리어와 그린그린함 ㅎㅎㅎ 식빵이나 메론빵 종류도 있고! 미니잼도 판매하고 있다. 소금빵도 있었고 블루베리 크림치즈빵도 완전 맛있어 보였음 ㅠㅠ 이거 카드캡터 체리 케로인가,,?? 핵귀엽자너,, 야키소바 빵이랑 고양이 얼굴 모양의 빵도 있었음 ㅠㅠㅠㅠ 핵귀,, 먹고 싶은 빵이 많아서 구냥 밥 먹지 말고 여기서 식사할까..? 생각도 함 ㅠㅠㅋㅋㅋㅋ 노스망처럼 생긴 크림 빵도 있고 생초코 빵도 맛있어보임 ㅠㅠㅠㅠ 포장도 깔끔하고 예쁘게 되어 있어서 선물하기에도 좋은 것 같다. 일본 느낌 냥냥한 연남동 일본 빵집 모리노팡 내부! 음료 메뉴는 심플하게~ 평일 한정 토스트는 나중에 오픈 맞춰서 오면 먹을 수 있을듯. 모리노팡에서 토토로 발견 ㅎㅎㅎ 가게 내부도 우드로 되어 있어서 따뜻한 분위기가 예쁘다. 우리가 주문한 라떼, 아메리카노랑 야키소바빵, 소금빵! 친절한 꿍이씨 사진 찍으라고 비닐도 벗겨주심 ㅎㅎㅎ 소금빵 안에 카라멜 있어서 단짠 단짠 맛있었고 야키소바빵도 간단하게 먹기 좋았다. 소금빵 모양도 너무 옙흐네,, 연남동 모리노팡 야키소바 토핑까지 비주얼 짱귀,, 빵종류도 꽤 많아서 다음에 못 먹어본 다른 메뉴 더 먹으러 가보고 싶다. #연남동빵집 #연남동모리노팡 #연남동일본빵집 #연남동카페 #연남동일본카페 #모리노팡"
연남동 일본식 빵집 모리노팡 소금빵 사냥한 후기,"일본식 소금빵이 맛있는 연남동 빵집, 모리노팡 서울 마포구 연남로3길 22-16 101호 안녕하세요 밍듀예요 :) 오늘은 오랜만에(?) 소금빵 사냥을 다녀왔어요 2022년에 이어 2023년에도 식지 않은 밍듀의 소금빵 사랑은 쭉 - 이어갈 예정이예요!! 2023년 첫 소금빵 사냥을 다녀온 일본식 빵집인 연남동에 위치한 '모리노팡'을 소개할게요 모리노팡은 숲의 빵이라는 뜻을 담고있어요 동경제과를 수석으로 졸업하고, 일본의 유명 셰프 쿠라타 히로카즈의 수제자인 브레드 아티스트가 직접 만들어요! 모리노팡 서울특별시 마포구 연남로3길 22-16 101호 주소 : 연남동 561-51 홍대입구역 3번출구에서 664m (도보 10분) 화-일 11:00-20:00 매주 월요일 휴무(정기휴무) 📞0507-1334-1360 *제품 소진 시 조기마감 포장, 제로페이, 네이버페이 - 모리노팡 단체주문은 최소 2일전에 예약가능해요 한적한 골목에 위치한 연남동 빵집 '모리노팡' 일본 동경제과를 수석으로 졸업하신 브레드 아티스트가 직접 구워 판매한다는 일본식 빵집이예요! 내부는 깔끔하면서 고소한 빵냄새가 가득했어요! 일본식 베이커리라서 일본 느낌의 분위기🤎 냉장쇼케이스에는 크림이 든 빵이 진열되어 있어요 겨울 제철과일인 딸기로 만든 이치고 쟈므 산도❤️ 상큼한 딸기와 부드러운 생크림의 조화인 후르츠샌드 포장도 하나하나 꼼꼼하게 되어 있고, 사장님께서 직접 메모지에 작성한 빵이름과 설명까지..감동ㅜㅜ 테이크 아웃으로 가능한 커피도 판매하고 있어요 커피를 주문하시면 버터 한 조각을 올린 토스트를 즉석에서 구워 함께 주신다고해요!!! 아침마다 정성스럽게 구운 빵들이 가득 진열되어있어요 하나하나 포장이 되어 있어서 위생적으로도 굿👍🏻 귀여운 모양의 빵들과 일본식 베이커리들🤎 눈.호.강!!! 모리노팡만의 귀여운 동물모양의 빵들도 있어요 계묘년을 맞이해 출시했다는 토끼빵인 우사기팡 🐰귀 사이에 복을 담고 있는 토끼빵🐰 후쿠오카 명물인 '멘 타이 바겟토' 바게트 사이에 오리지날 명란과 그 위에 가득 뿌려진 감태 이거쥐~~~~~ 모리노팡의 시그니처팡인 '시오바타' 아티스트의 추천빵이자 밍듀의 픽인 시오바타🤎 극강의 부드러움과 고소함과 짭쪼롬함의 조화의 정석!! 카라멜 소금빵, 초코 소금빵, 연유크림 소금빵도 다양하게 있어요!!! 비주얼부터 JMT🧤🧤🧤 🥐파우치같이 포장되어 있는 시오바타🥐 모리노팡의 시그니처팡인 시오바타🤎 한개당 1,800원으로 가성비까지 있는 소금빵 바삭함보다는 전체적으로 부드러운 식감이예요! 소금빵 속은 고소하고 버터풍미가 강해서 맛있어요!! 겉을 바삭한 소금빵을 좋아하는 밍듀 입맛에는 살~짝 아쉬웠지만 가격대비 맛있게 뇸뇸✌🏻 일본식 베이커리 맛집인 연남동 빵집 모리노팡 귀여운 빵도 많고 일본 특유의 빵들도 다양해서 연남동 빵 맛집 찾으시는 분들께 '모리노팡' 추천해요 :D"
"매일매일두에세이 - 우쥬라이크 연남동 빵투어? 빵투어오시라예~ 두툼보쓰 식빵을 만날수있는 모리노팡, 연남동 미니파리 파리구르멍 크로와상","- 하룻밤 사이에 이게 무슨 일인가요.. 마음이 무겁습니다.. 삼가고인의 명복을 빕니다. 모든 것의 시작은 해쨍쨍 어느 여름 날, 식빵사러 쿄베이커리를 갔던 제리. (두둥) 안합니다.. 잠정 휴무.. 없어지는건가효..?? 8ㅅ8 족굼 멘붕이었지만 차선책을 찾아봅니다 그런데 모르는 빵집이 생겨있던게 아닙니까??? 당장 고고합니다 이렇게 모리노팡야와의 만남이 시작되고요 그거슨 현재 가장 만족스러운 식빵과의 만남이 되었네예 *_* #연남동 #연남동베이커리 #모리노팡 #빵순이집합 #빵투어 모든 빵 이름이 일본어표기인점은 략간 당황했지만은,, 홍대 아오이토리의 수제자분이 오픈하셔서 그런것같고요 일단은 일본동네빵집st 좋아하는 분이라면 싫어할수없는 라인업을 자랑하고있고요 코알라형상의 동물빵의 커여움에 무릎꿇고 일단 먹어보기로합니다 힣힣 완죠니 커여움 식빵덕후로서 새로운 식빵과의 만남, 너모나 설레이고요♡ 당장 동물부터 죠져줍니다 아쉽게도 귀에는 초코없고요 얼굴에만 초코들었어예 그른데 커여움대비는 략간 평범하여 아쉬울뻔하였으나...... ☆뚠뚠식빵☆ 갱장한 녀석과의 만남 ^___^ 두께보소 거의 왠만한 식빵 2장이 1장 힣힣 전에 아오이토리식빵도 뜻밖에 마딛게먹었었는데 모리노팡 식빵은 아오이토리식빵의 업그레이드버전 넉김 지금 딸기잼만 발라도 맛있는 애한테 화려한 퍼포먼스를 더해주니까 환상의 맛으로 완성~ 바로 또 식빵 사러 날라옴 아무래도 소금빵을 주력하시는것같아 소금빵도 추라이함 굽굽 혹은 생으로 잼만 발라도 즥임 역시 맨빵이 마딛는 곳은 소금빵도 마딛음 요건 감자든 빵이었던거같은데 요런건 어슬라이스가 죅금 더 맛맛 넉김 자꾸만 식빵이야기를 하게되지만 진짜 프렌치토스트하면 작살남 무족권 프렌치토스트해드시길 권장하고예★ 룡이랑 식빵사러 또옴 신중하게 고른 라인업 식빵에 이어 모리노팡 잘하는거 발견요 크림 맛집bb 처음부터 끝까지 크림인거 보이쥬?? 우유맛은 덤 크림팥방도 먹어본결과 크림팥빵도 빵나무끕으로 맛이 죠음 물론 야키소바빵도 맛이가 죻스므니다 그리고 뜻밖의 중독템은 메론빵러스크 달달한 버터쿡희같음 소금빵들도 다 무난하게 마딛고요 모리노팡에서 채고를 꼽자면 무조건 식빵하고 크림든 빵 쉬어가는 코너, 룡이가 굽굽한 아몬드키토쿡희 키토베이킹은 요런 쿡희들이 마딛는거같고예 컵희마시면서 주워먹기죠음 *_* #홈베이킹 #키토쿠키 안가본 빵집 지나칠수없어 들러봤숩니다 파리구르멍에도 와봅니다 (맞은편 헬로인디아 인도카레 마딛고요, 런치춫천) #파리구르멍 #크로와상 지나다니면서 봤을때 하는지 안하는지 약간 헷갈릴때가 많았는데 아쥬 섬세하고 고운 빵들과 케이크를 파는 곳이었네예 오 뺑오쇼콜라 먹으니까 넉김 옵니다 이곳은 크로와상이 보물입니다 크로와상 땡길때 꼭 올라고예 포근한 맛의 사과파이(주말한정) 도 맘에 쏙-든건 물론이고요 약간 요즘 크로와상계열 마음 둘곳을 없어 략간 쓸쓸했는데 (역시나) 등잔밑이어두웠던,,, 파리구르멍 / 모리노팡 근처는 조용한 디저트 일짱들이 많으니까예, 빵순이자매님들 오시면 즐거운 투어 가능합니닷 근처에 페블스-푸딩맛있고 / 코코로카라-바나나푸딩 , 코코로카라 옆집 피포커피 휘낭시에도 소소하게 마딛구예 양손무겁고 보람찬 연남동 빵투어 오시라예♥ ciao"
