title,content
"[연남동 나들이]맥코이 연남, 숲길곱창, 단단, 청춘소년",전 직장동료 언니와 오랜만에 만나 연남동 나들이를 다녀왔다. 평일이라 사람이 많이 없을 줄 알았는데 따스한 봄날씨를 즐기러 나온 사람들이 꽤나 많았다. 우리가 처음 접선한 곳은 맥코이 연남 이라는 카페이다. 길건너 보이는 오두막같은 카페 맥코이 오홍~~ 오랜만의 핫한 연남동 나들이에 설렘을 가득 안고 들어간 맥코이 빛번짐 어쩔...?ㅎ 내부는 그렇게 넓지 않다. 그래도 평일이라 그런 지 자리는 넉넉하게 있었다. 여기도 원목 저기도 원목 원목 그 자체인 맥코이 빈티지 그 자체인 쇼파ㅎㅎ 중간에 입구를 닫으시던데 열어놓는게 훠얼씬 좋아요 사장님ㅜㅜ 카페 분위기는 뭔가 가을 겨울에 오면 더 걤성 돋을 것 같음... 화창한 날씨를 즐기기엔 다소 어두운 분위기~~ 우리가 앉은 자리! 테이블이 독특했다! 메뉴판 투척! 시그니처 메뉴인 맥코이 커피가 있지만..! 깔끔하게 아아가 땡겨쓰~~ 인테리어 소품 구경하는 재미도 쏠쏠~~ 수다 삼매경에 빠져 카페에서 거의 2시간을 있었다. 아 그리고 카페 선곡이 매우 좋았다. 얘기하다 말고 음악 듣고 다시 얘기하다 음악 듣고를 반복했다ㅎㅎ 카페에서 나와 이른 저녁을 먹으러 간 곳은 연남동에서 유명한 숲길곱창! 쨔잔~~ 다섯시 전에 갔더니 사람이 음서용~~ 다 먹고 나올 땐 거의 만석이었다 가기 전 사진으로 봤던 야외 테이블이 없어서 여쭤보니 신고가 들어와 현재는 야외테이블 운영은 안하신다고 한다. 우리는 모듬구이를 주문했다 옆에 지나가는 사람들이랑 너무 가까워 쵸큼은 부담스러웠지만 창가자리는 포기할 수 없지! 어머낫 곱창 없이 소주가 먼저 나왔네? 어머낫 소주양을 보니 한잔씩 먼저 마셨네? 초벌되어 나온 모듬구이! 맛은 헐 존맛탱....까진 아니었으나 적당한 가격대에 괜찮게 먹을만한 정도였다 내 인생곱창집은 어디서 나를 기다리고 있는것인가....! 시간은 초저녁이었지만 해가 길어진 덕에 낮술 느낌지대로 내고 감질나게 딱! 한 병 클리어 한 후 다음 술집으로 고고!! 알콜 부스터 시동걸렸다...부릉부릉!! 다음으로 간 곳은 숲길곱창에서 그리 멀지 않은 곳에 있는 이자카야 단단 일단 입구입니다~ 오~~ 그냥 하이볼이 먹고싶어서 근처에 있는 아무 이자카야 검색해서 왔는데 손님이 많이 있었다 메에뉴우~! 하이볼이 먹고 싶어 갔지만 생맥이 더 먹고싶었던 보바리ㅎㅎ 우리는 감바스 주문~! 뭐 특별하지 않은 모두가 알고있는 감바스 맛ㅎㅎㅎ 이젠 너무 흔하디 흔한 안주가 되어버린 바스바스 감바스~ 바 테이블에 앉아서 바로 앞에 이쁘게 줄 서 있는 술병들도 구경하고 사장님 요리하는 것도 구경하며 하이볼 한 잔씩 더 마시고 집으로 귀가! 는 무슨....ㅎ 와인을 마시고 싶으니 와인집으로 ㄱㄱ 마지막에는 원래 언니가 추천한 포도알을 가려했지만 만석이라 기후니랑 연남동 오면 종종 갔던 청춘소년 이라는 와인집으로 향했다. 이곳의 특징은 이곳저곳 휘황찬란하게 장식되어 있는 생화들이다 꽃은 뭔가 글자도 꽃처럼 생김ㅎㅎ 가게 들어가면 생화향이 은은~~~하게 난다 메뉴판 투척! 직원분의 추천을 받고 주문한 본자 머시기 까베르넷 쇼미뇽 달지않고 바디감 있는 와인을 선호한다 했더니 추천해주셨다ㅎ 나 원래 이런 사진 잘 안찍는데 솔찌키 술도 먹었겠다 와인 맛있겠다 와인잔 부딪히는 소리 청량하겠다 안찍을래야 안찍을수가 없는 샷 후 블로그 한다고 부지런해졌다 보바리... 가볍게 먹기좋은 부라타치즈 샐러드 나 왜 이 날 부라타치즈 태어나서 첨 먹어봄....? 짠맛은 없고 우유크림같은 꼬소~~~한 치즈에 튀지 않고 잘 어울리는 망고 드레싱이 뿌려진 샐러드는 와인 안주로 안.성.맞.춤 (근데 가격에 비해 양은 좀 적어....ㅆ...다..부라타 치즈가 비싼 치즈인가...?) 요기가 오디나면 꽃밭 아니구 화장실ㅎㅎㅎ 와인이 넉넉하게 남아서 주문한 치즈 플레이트 이미 몇 조각 먹고 찍은거라 듬성듬성하네..?ㅎㅎ 이렇게 세상 알차게 연남동 나들이를 마무리하고 결국 막차 놓쳐서 택시타고 귀가....ㅎ 기후니 살짝 언짢.....헤헿 언제와도 즐거운 연남동 안녕~~~~ 담에 또 봐~~👋 맥코이 연남 서울특별시 마포구 성미산로 147 숲길곱창 본점 서울특별시 마포구 동교로 256 단단 서울특별시 마포구 동교로 266-5 예약 청춘소년 서울특별시 마포구 동교로46길 42-8 1층 예약
[카페] 맥코이 연남 / 연남동 커피맛집 추천,"동화속에 나오는 집같은 연남동 맥코이 그동안 지나다니면서 가볼생각 안한거 후회 엄청난 커피맛집이였다 시그니처 맥코이커피 안마셔본 사람은 있어도 한잔만 마셔본 사람은 없을듯 너무 맛있다 왜 이제야 안거야?! 맛본 이후로 가끔씩 너무나 생각나는 맛 주말에 급나갔던 날인듯 급출동의 묘미 그리고 또 요약 카페기록 맥코이 연남 서울특별시 마포구 성미산로 147 맥코이(@mccoys_coffee) • Instagram 사진 및 동영상 팔로워 2,432명, 게시물 3개 - ⠀⠀⠀⠀⠀⠀⠀⠀⠀⠀⠀⠀⠀⠀ 연남 9:00 - 21:00 한남 9:00 - 21:00 신사 8:00 - 20:00 ⠀⠀⠀⠀⠀⠀⠀⠀ 연중무휴입니다. instagram.com"
서울 맥코이 | 연남맥코이/연남동카페추천/연남카페/연암카페추천/맥코이/맥코이커피/서울카페추천,"안녕하세요 ◡̈ 연남에서 카페찾다가 친구가 다음 일정을 소화하기 좋게 카페 두개를 알려줬는데 그 중에 맥코이커피 먹고싶어서 다녀온 맥코이 연남! 소개해드릴께요! 카카오맵으로 찾아가는데 어,,? 어라...? 카페,,,? 이런 느낌이랄까요,,,??? 맥코이 서울 마포구 성미산로 147 매일 9:00-21:00 070-8648-2210 맥코이커피 메뉴판 맥코이 커피 메뉴판이에요 역시 시그니쳐 먹어줘야죠 맥코이커피로 주문을 했습니다! 맥코이 커피에서 귀엽게 인증샷남기는 우리 둘이서 자리잡고 앉아서 작은거울로 인증샷 남기는 귀여운 우리 ㅎ 이 날은 바로바로 제 디올 지갑을 사러다녀오고 최고심 팝업스토어를 다녀온 날이였어요 ! 친구가 선물해준 저는 귀엽고 착해요 키링도 에어팟에 달아주고, 깜찍이 앙큼이 자격증도 사진으로 남겨뒀어요,,,! 전주에 있는 앙큼이친구한테 얼른 선물해줘야하는데 :( 아직도 선물해주지 못했네용ㅠㅠ 제 영롱하고 귀엽고 사랑스러운 지갑도 구경해주세요 😀 디올 LADY DIOR LOTUS 지갑 블랙 까나쥬 양가죽 | 롯데백화점본점/디올/레이디디올지갑/디올지갑/디올반지갑 안녕하세요 ◡̈ 2년동안 고생하며 일했던 저에게 선물하나쯤은 하고싶어서 많이 낡은 카드지갑을 보내주기... blog.naver.com 맥코이커피 내부 맥코이커피 내부는 그렇게 넓진 않아요! 2인테이블 4테이블 정도에 크게 테이블 하나가 있어요 테이크아웃해가시는 분들도 많더라구요! 휴대폰하는 친구와 함께 찍어본 맥코이 커피 연남 내부 사진입니당 ㅎㅎ 맥코이커피 맥코이커피 6,000원 시그니쳐 메뉴가 괜히 시그니쳐 메뉴가 아니죠! 크림과 커피 조합이 진짜,,,,,이것은,,, 다시 먹으러 올만한 맛이다! 비록,,,지하철여행1시간 30분을 해서 와야하는 연남이지만 너무 맛있어서 재방문하고 싶을정도의 맛이였어요! 꾸덕한 크림의 크림커피 좋아하시는 분들이 좋아하실꺼 같아요 😉 연남에서 카페 찾고계신다면 맥코이 연남 추천드려요! #서울카페 #카페투어 #서울카페추천 #연남카페 #연남카페추천 #서이추 #소통 #연남동카페추천 #카페추천"
연남동[맥코이 커피]/연남오두막커피집/연남동카페/연남동카페추천/McCoy's,"안녕하세요?유리에요!오늘은 독특하게 오른쪽에서 시작할거에요-! 인생의 따분한 시기가 찾아온거같거든요,,? 아무튼 거두절미하고 카페 다녀왔어요! 여 어딘지 아시죠? 맞아요-! 그 오두막 카페컨셉이랍니다-! 이미 별그램에서 한번뜬적있어요-! 전에 연남동 왔다가 그냥 지나가기만해서 -이번엔 들어가봤어요 여 문을 열고 들어왔어요! 바로 정면에서 보이는 커피머신들과 각종 커피도구들! 이거 지금 업로드 하면서 느낀건데 전 처음에 인테리언줄 알았거든요? 근데 목도리 상태를 보아하니 그냥 주인장이 오늘 입고온 패션인가봐요 허허 인테리언줄 알고 속으로 오,,독특하구만 이랬거든요 약간 심지어 여기 컨셉이랑 색감도 잘어울림;아무튼ㅋㅋㅋㅋㅋㅋㅋ 여 메뉴판이고요 여기저기 벽이 허전하지 않게 꾸며져있었어요! 완벽한 산장 분위기,, 여기에 모닥불 하나만 피웠으면 더 완벽 할 것 같았음,, 여기 분위기가 어떠냐면, 되게 여유로우면서 편하고, 은근 낭만적이였어요 자신이 가장 좋아하는일을 하는 것 같은, 인테리어나 커피만드는 사장님의 분위기가 그대로 녹아있는 느낌이랄까? 한5-6시에 오면 더 좋은 분위기를 느낄 수 있을 것 같아요! 그래서 딸기라떼랑 에스프레소,그리고 전에 휘낭시에 진짜 왕맛있는거에 빠져서 휘낭시에 노래부르고 한번도 못먹었던 휘낭시에를 먹었어요! 뭐야 휘낭시에 존맛탱ㅠㅜㅠ진짜 거기있는 휘낭시에 다사오고 싶었음 겉바속촉임 갓만든건 진짜 미쳤을듯!!! 맛있었으니까 휘낭시에 한컷 더 찍어주고 화장 1도 안한 나의 휴무날의 페이스도 찍어주고 휴무의 시간은 항상 빠르게 지나가는 이날의 휴무도 안녕-! 그래도 나름 행벅하게 만들어줘서 고맙다 휘낭시에-! . . 50m © NAVER Corp. 맥코이 서울특별시 마포구 성미산로 147 #맥코이커피 #연남동맥코이 #연남동맥코이커피 #연남카페추천 #연남동카페추천 #연남동카페 #연남동맥코이카페 #맥코이카페 #연남동오두막커피집 #연남나들이 #연남동데이트 #연남데이트 #연남동놀거리 #연남동카페내돈내산 #연남동내돈내산 #마포구카페추천 #마포카페추천 #연남산장분위기카페 #연남산장카페 #마포구산장카페"
연남동 주민 단골 찐커피 맛집 - 커피가 정말 맛있는 빈티지한 분위기의 통나무 오두막집의 이국적인 카페: 맥코이 연남,"오늘은 제가 연남동에서 좋아하는 카페 중 하나인 맥코이 연남을 다녀왔어요. 작은 통나무 오두막집같이 생긴 맥코이는 풀과 나무들에 가려져 숨어 있답니다. 그래서 이곳에 카페가 있는지 모르고 많이 지나갔었어요. 그러다 우연히 눈에 띄어 방문하게 된 이후로 완전히 팬이 되어버렸어요. 분위기도 너무 좋은데 커피도 너무 맛있었거든요. 맥코이는 강아지 동반 가능 카페입니다. 커피를 마시고 있으면 종종 동네분들이 귀여운 댕댕이와 산책길에 들리시곤 한답니다. 커피뿐 아니라 칵테일도 판매하고 있답니다. 에스프레소 마티니와 핸드릭스 진토닉 정말 제 최애 칵테일인데 이젠 더 이상 술을 마실 수 없어 너무 슬플 뿐입니다. 시그니처 메뉴는 맥코이 커피입니다. 맥코이 커피는 솔트 캐러멜 크림이 올려져 있는 크림 라테인데요 정말 맛있어요. >.< 하지만 오늘은 점심을 너무 짜게 먹어서, 아이스 아메리카노를 시켰어요. 제 친구는 카페라테를 시켰네요. 역시 커피 맛집!! 맥코이는 자리에 앉아 있으면 바리스타 분께서 가져다주십니다. 평소 맥코이는 차분한 분위기에 다들 커피를 마시며 편히 쉬다가는 분위기예요. 오늘은 주말이라 그런지 만석에 다소 소란스럽더라고요. 진정한 맥코이를 즐기시려면 평일에 방문하시는 것을 추천드립니다. 아무래도 매장이 큰 편은 아니라 문을 닫아놓으면 소리가 울려서 큰 소리로 대화 나누시는 테이블이 있으면 자연스럽게 다른 테이블도 목소리가 높아져서 음악소리도 잘 안 들이더라고요. 오늘 방문한 맥코이는 만석이었기 때문에 봄에 찍었던 사진을 첨부할게요. 난로가 있는 것 빼고는 현재 인테리어는 변한 것 이 없거든요. 맥코이는 아주 빈티지한 외국의 산장 같은 분위기예요. 입구 쪽에 2인용 소파가 있고 궤짝 테이블 옆에 좌석을 펼치면 4인까지 이용할 수 있어요. 그리고 홀 가운데 가장 큰 테이블이 있습니다. 여기 가운데 큰 테이블에 물이 배치되어 있어서 물이 필요하시면 준비된 종이컵에 따라 드시면 됩니다. 전 주로 혼자서 커피 마실 때 종종 찾아오는데요. 혼자 시간 보내기 좋은 카페인 것 같아요. 직원분도 다들 엄청 친절하시고 제가 좋아하는 음식에 아늑하고 차분한 분위기가 굉장히 편안한 느낌을 주거든요. 연남동에 들렸을 때, 맛있는 커피를 마시고 싶으시거나, 이국적인 분위기에서 차분하게 시간을 보낼 수 있는 편안한 느낌의 공간을 찾고 계신다면 맥코이 연남 강력하게 추천해 드립니다. 50m © NAVER Corp. 맥코이 연남 서울특별시 마포구 성미산로 147 영업시간 | 매일 09:00 ~ 21:00"
22.09.17 연남동 나들이 <정소바 | 맥코이 연남 | 포토그레이 연남2호점>,"원래 연남동 가기로 한게 연남필름 가서 필름 인화 맡기려 한건데 필름을 집에 두고 나왔다ㅎㅎ.. 사랑니 뽑은지 5일째라 실밥도 있어서 술을 못마셔서 이른 저녁으로 #정소바 들렀다가 #포토그레이 에서 네컷사진 찍고 카페 가는 코스로 정해뒀다. 블로그랑 네이버 정보에는 평일만 브레이크타임이 있고 주말은 없다고 써있어서 4시반쯤 정소바에 들렀는데 브레이크 타임이라고 5시에 다시 오라고 해서 포토그레이를 젤 먼저 감! 정소바 브레이크타임은 15시30분부터 17시! 근데 브레이크타임 끝나자마자 자리가 다 차기 때문에 17시 되기 전에 가서 기다리는 걸 추천함. 네컷사진관이 되게 많았는데 여기만 사람이 하나도 없어서 들어갔다. 근데 엄청 쾌적하고 시원한데 왜 사람이 적었는지 모르겠음 포토그레이 연남2호점 서울특별시 마포구 연희로1길 38 사진 찍는 공간은 4개가 있었고 다 차있어서 기다렸다. 이 날 옷이랑 어울리는 이브이 머리띠로 결정ㅎ 정소바 서울특별시 마포구 동교로38길 38 1층 정소바 사진 찍고 5시 10분쯤? 갔는데 한테이블 뺴고 전부 꽉 차있었다. 이렇게 사람 금방 찰 줄 알았으면 와서 기다렸을텐데ㅎ 입구 바로 앞인 다찌 자리밖에 없어서 여기 앉았는데 앞에 스피커가 바로 있어서 좀 시끄러웠던 거 빼고는 쏘쏘? 가게는 많이 좁은 편이다. 빈솔은 전복, 단새우 냉소바 (\17,000) 나는 단새우 냉소바 (\16,000) 그리고 치즈멘치가츠 시키고 싶었는데 재료 소진이라 치킨가라아케로 시켰다. 맛은 생각했던 맛!? 맛있었고 가끔 생각나면 또 재방문 할 듯! 그땐 하이볼 마셔야지 ㅎㅎ 자리가 불편해서 얼른 먹고 나왔다. 맥코이 연남 서울특별시 마포구 성미산로 147 원래 빈솔이 가고 싶어했던 카페가 웨이팅 2시간 하래서 ㅋㅋㅋㅋ 바로 찾아본 카페! 약간 힙한 분위기인데 시끄럽지 않고 아늑했던 #맥코이연남 한남동에도 매장이 있는 듯하다. 심플한 오픈식. 빈솔은 시그니처인 맥코이커피, 난 아아 아아는 가볍고 산미가 좀 있는 편. 캬라멜 크림라뗴 시켜볼 걸 그랬당ㅎ 포토그레이에서 찍은 사진도 다시 보고 새로한 네일 인증샷도 찍어 보고 ( #광교바이비네일 ♥ ) ㅄ이랑 이런 저런 이야기들도 많이 했다. ㅄ이 술 마시고 싶어 했는데 못마셔서 아쉬워 했지만 담날 전주 여행이라 늦지 않게 빠빠이함."
"연남동 카페, 맥코이커피 McCOY'S","서울 | 연남동 카페 맥코이커피 (McCOY'S) 서울 마포구 성미산로 147 MON - SUN 09:00 - 21:00 ( @jan.zeon ) 연남동 카페 | 맥코이 커피 연남동, 서울 한복판에 마치 기묘한 산장을 연상케 하는 곳. 맥코이커피 위 말 그대로다. 썸네일 사진만 본다면 이곳이 서울 도심 한복판이 맞나? 하는 생각이 든다. 강원도 어딘가에 길 굽이굽이 너머 존재할 것 같은 카페랄까. 이런 카페의 독보적인 분위기도 분위기지만 사실 커피 맛이 정말 좋다는 얘기를 많이 들어서 꼭 가보고 싶던 곳이었다. 그래서 남편의 소중한 생일날 연남동 맥코이커피를 픽! 맥코이는 홍대입구 역에서 연남동 방향으로 경의선 숲길을 따라 쭉 가다보면 보인다. 연남동 상권에서 거의 끝 쪽이라고 할 수 있는 골목 정도에 위치해 있다. (연남파출소도 한참을 지나.. 연남동주민센터 부근이다.) 그러다보면 고요하게 조용히 자리를 잡고 숨어있는 카페가 보인다. 우선 예쁘고 예쁘고 예쁜 곳. 맥코이 감성.. 마치 일본 교토에 존재할 것 같은 공간이다. 더욱 궁금해지는 중 ..! 문 바로 앞 착석. 밖을 내다보면 이런 풍경을 마주하게 된다. 사진으로는 별 거 없어 보일 수 있지만? 눈으로 보이는 모든 물체들이 조화를 이루고 있는 이 분위기가 정말 좋았다. 이제 마샬 없는 카페가 없다. 인테리어 필수템 되어버렸어. (난 제네바가 좋아 !) 지금 메뉴 사진을 보며 깨달은 사실, 원두를 이용한 칵테일도 있었다는 거. 맥코이 왔으니 맥코이커피 마셔줘야지! 바라보고 있으니 마음이 다 평온해진다. 안은 좁게 긴 형태의 구조이고 평일이지만 생각보다 사람이 가득이라 더이상 내부 사진은 찍지 않았다. 아메리카노 5.0 맥코이커피 6.0 진하다 진해 아메리. 남편은 어딜가다 거의 10번 중 9번은 아메리카노 드시는 분. 맥코이 커피 역시 맛 좋네! 캬 맥코이커피 맛있네 맛있어. 이렇게 황홀하게 맛있다는 기분을 커피를 마시고 언제 느꼈는지 바로 생각이 났다. 망원동 커피가게동경에서 처음 동경 아인슈페너를 마시고 머리를 딱 치는 맛이었다. 바로 그때 그 기분을 맥코이에서 다시 느꼈다. 좋은 건 더 크게 한번 더.. 양이 적어서 더 더 맛있게 느껴지는 것도 있다고 봅니다만. 시그니처커피 정말 맛있게 잘 마시고 갑니다 ! 아인슈페너 맛집 탕탕 ! 그리고 저 맥코이 커피잔 파시는지는 잘 모르겠지만 듀라렉스 잔일텐데 폰트며 무척 귀엽다! 연남에 가서는 맥코이, 맥코이에 가서는 맥코이커피를 드세요! @맥코이커피 - @jan.zeon 맥코이 연남 서울특별시 마포구 성미산로 147"
"[서울,연남동]카페-간판없는 카페맥코이연남",간판없는 가게 본적있나요? 서울 연남동 에 간판없는 카페맥코이연남이란 가게가 있더라구요. 첨에는 지나가면서 여기 뭐하는곳이지 라는생각으로 들어갔던거 같습니다. 가게이름을 몰라 사장님한테 가게 이름뭐여요? 라고 물어봤답니다. 이번에 2번째 왔던 곳인데 여기 라떼가 정말 괜찮아요. 분위기 좋지않나요? 다소 좁기도 하지만 이곳은 아는사람만 오는 그런 곳인거 같아요. 간판도 없고 다소 소심한 사람이면 여기가 뭐하는곳인지 쳐다도 안보고 그냥 지나칠수 있는 그런곳입니다. 흔디 자주 가는 스벅이나 브랜드 커피들은 테이블도 쇼파로 되어있거나 편한곳 많이 있잖아요. 이곳에서는 그런거는 포기하셔야될듯 합니다. 자리는 좀 불편하거나 나름 고풍스럽고 유럽풍한 인테리어라 은은한 조명아래 사진정도 찍고 맛난 전문가의 솜씨가 느껴지는 라떼한잔 마시며 가기 좋은 그런곳입니다. 흔하디 흔한 요즘 브래든커피 가게 인테리어는 다 비슷비슷한거 같아요. 근데 여기는 그런 지겨운 인테리어가 아니라 요즘 도전하지 못하는 느낌이랄까 앉아있는동안 여성분들 테이크아웃 하러 자주 들어오네요. 확실히 까다로운 여성분들 입맛에 맞게 커피 하나는 맛이 일품인거 같네요. 커피 아트 어떠신가요? 요즘 이렇게 예쁘게 나오는곳 보신적 있나요? 어딜가나 요즘 테이크아웃으로 그냥 가져가는 경우 많아서 홀에서 먹는다고 해도 아트까지 나온곳이 없던데 연남동 여기 한번 가보세요.괜찮습니다. 참~반려동물 동반이 가능하다고 합니다. 50m © NAVER Corp. 맥코이 연남 서울특별시 마포구 성미산로 147 맥코이 연남 서울 마포구 성미산로 147 070-8648-2210 영업시간:9시~21시까지 반려동물 동반
"연남동 핫한 카페, 맥코이 연남","50m © NAVER Corp. 맥코이 연남 서울특별시 마포구 성미산로 147 * OPEN 09:00 - CLOSE 21:00 때는 2022년 7월 1일 금요일 낮 13시... 홍대 또보겠지떡볶이(아직 리뷰 안 씀)를 흡입 후 무더운 날씨를 뚫고 맥코이 커피로 향하였다 ... 거리는 대략 매우 멀다 ... 걸어갔다... 너무 뜨거워서 우산을 썼다. 연트럴파크를 지나 ... 아직 한참 멀었다 또 지나고 ... 나이스!!! 드디어 도착!! 하자마자 사진 한방 찍구요 내부 사진 찍기 전에 주문 먼저 하겠읍니다. 매우 더웠기 때문에 아이스아메리카노 그리고 항상 카페에 가면 그 카페의 시그니처 메뉴를 맛봐야 하기에 맥코이 커피를 시켰습니다. 아 그리고 휘낭시에도 시켰습니다. 음 마치, 유럽의 전통 있는 오래된 카페 같은 느낌( 유럽 카페를 직접 가보진 않았지만, TV에서 본거 같음) 나무 테이블도 너무 이쁘구요 영화에서 보던 통인데 뭐라 부르는 거였더라 이것도 마음에 들구요 특히 커피를 굉장히 정성을 다해 만든다는 느낌을 받았음... 살짝 오래 걸린다는 느낌과 동시에 정성을 다해 만드는 느낌 직접 가보면 무슨 느낌인지 알 것이다. 또 맥코이커피 특이점을 발견했따 포스기가 없다 어디에 숨어 있을지도 모르겠지만 일단 보이진 않고 매출 정리를 감각적인 디자인의 계산기와 노트에 수기로 적는다. 이제 나왔다 나의 아이스아메리카노 정성을 다한다고 속으로 느꼈기 때문에 커피 맛이 좋았따 이것이 바로 시그니처 메뉴 맥코이커피가 되겠다. 주문한 메뉴를 다 같이 사이좋게 찍어 보았다. 둘 다 잘 나온 거 같아서 두 개 다 올릴 거다 이것도 잘 나왔다.. 세 장 올리겠다. 자 그럼 커피를 들고 밖에 있는 포토존으로 이동한다. 음 ... 이렇게 찍는 게 아닌데 .. 여자친구를 인스타그램 스타일로 찍어 보았습니다. 맥코이커피 연남점 반려동물 동반이 돼서 강아지를 같이 데리고 오시는 분도 3팀이나 보았다.(너무 귀여웠다.) 자리는 많지는 않지만 평일 낮에 가서 충분히 여유롭게 앉아 있다가 왔다 내부의 유니크하고 심플한 디자인이 마음에 들었다. 물론 커피 맛도! 한남동에도 있다고 하니 다음에는 한남동도 가보고 싶다. #서울 #서울카페 #서울핫플 #연남동카페 #연남동핫플 #맥코이 #맥코이커피 #맥코이커피연남 #연남동맥코이카페 #연남동맥코이커피 #연남동맥코이 #연트럴파크 #연트럴파크카페 #연남동가볼만한곳 #연남동커피 #홍대입구역 #홍대입구역커피"
