title,content
연남동 브런치 @썸모어델리,"썸모어델리 서울특별시 마포구 동교로51길 131 1층 구월동의 썸모어 방문했었고 남편과 나 둘 다 커피가 별로였다? 그래서 연남동에 오픈했다고 봤을 때 어라???? 했지 https://m.blog.naver.com/sooooong-/221457673569 [구월동 카페] 송도에 이어 구월동에 - 카페썸모어 가구팠는데 하필 월화 휴무라 휴무가 같으니 방법이 없었다 애가 타게 카페썸모어 노래를 불러따 오늘 낮에... m.blog.naver.com 근데 집 근처기도 하고 제가 브런치도 좋아하고? 이웃님들이 자꾸 가시니까 저도 가요 ㅋㅋㅋㅋㅋㅋㅋ 브런치는 맛있다고 계속 그러시니까 힛 재도전!!!! 오픈런! 비가와서 대기가 없었다 야호 생각해보니 이 근처를 주말마다 갔어서 처음 공사부터 지켜봤었다 3명이라 앉을 수 있는 테이블은 2개였어요 1등으로 와서 빨리 먹으니까 좋네요 데일리 슾은 옥수수였고 넵, 주문 고고 에그인헬! 토마토 라구 라자냐 매콤하게! 가을밤! 블랙커피 따듯한거 2잔 아이스 1잔 ! 라자냐 매콤버전! 와 건고추 엄청 들어가서 씹는 순간 으악!!!!!!!! ㅋㅋㅋㅋㅋㅋ너무 매웡 고추 조심 에그인헬 깜장색이 바게트인데 엄청 달고 바사삭 찍어 먹을 빵은 따로 주셨당 라자냐랑 에그인헬 나왔고! 못 기다리니까 먼저 먹었다 오! 생각보다 강한 맛이 아니다 너무 좋네 가을밤! 난 역시 빵이 좋구나 프렌치토스트보다 이게 더 땡겼다 밤이 한 가득이야 썸모어델리 가을밤 추천 빵에 크림에 토핑에 좋다 찍어 먹으라고 사과랑 블루베리 콩포트 주셨는데 없는게 더 좋았어요~ 너무 달아져서! 무화과 큼지막해서 최고 의외로 슾이 제일 늦게 나왔어요 우린 슾부터 나올거라고 생각했는데 옥수수슾 와 맛있어요 집에서 만든 소중한 맛 솔직히 말해서 편견 살짝 가지고 갔지만 만족도 아주 커요 메뉴들 다 맛있네요 커피는 아주 평범했어요 괜찮다 맛있다는 말 안 나오는ㅎㅎ 그래도 브런치로는 재방문 의사 있어용 연남동 브런치 썸모어델리 영업 시간: 오전 11시~ 오후 7시 월요일 휴무 주차 노노 2명은 네이버로 예약 가능!"
[ 연남동 ] 찾았다 인생 브런치 맛집 ' 썸모어델리 ',"썸모어델리 영업시간 화 - 목요일 11:00 - 19:00 (l.o 18:00) 금 - 일요일 11:00 - 21:00 (l.o 20:00) 매주 월요일 정기휴무 안녕하세요 HH입니다 오늘은 제가 진짜 오랜만에 인생 브런치 맛집을 찾아서 소개해 보려고 합니다 연남동 끝에 있는 썸모어델리 라는 브런치 맛집인데요 가게도 너무 예쁘고 진짜 먹는 내내 맛있고 행복해서 기분이 너무 좋았던 곳이랍니다 제 연남동 원픽 브런치 카페 하려고요 썸모어델리 | 연남동카페 | 브런치 | 커피 | 와인(@somemore.deli) • Instagram 사진 및 동영상 팔로워 1,407명, 팔로잉 4명, 게시물 523개 - 썸모어델리 | 연남동카페 | 브런치 | 커피 | 와인(@somemore.deli)님의 Instagram 사진 및 동영상 보기 www.instagram.com 썸모어델리 서울특별시 마포구 동교로51길 131 1층 외관 외관 되게 예쁘죠? 각진 형태의 붉은 벽돌 카페인데 연남동 끝에 있어서 되게 한적하고 좋더라고요 그리고 야외공간 조경도 너무 잘 되어 있었어요 요 작은 입간판 쪽으로도 골목 같은 입구가 있는데요 테이블도 조금 있었고 웨이팅 보드가 입구 바로 앞에 있었답니다 저희는 토요일 1시쯤 도착했는데요 다행히 내부 테이블이 딱 하나 남아있어서 운 좋게 바로 들어갔어요 내부 공간 썸모어델리 창이 전부 통창이라서 내부가 좀 작은 편인데도 답답한 느낌 하나도 없고요 짐 둘 수 있는 예비용 의자도 있어서 좋았어요 매장이 되게 따뜻한 분위기였는데요 귀여운 포스터들과 와인, 인형들로 잘 꾸며져 있더라고요 너무나 제 취향!! 테이블마다 메뉴판이 올라가 있고요 2인용 테이블 4개 4인용 테이블 1개 이렇게 내부에 있었는데 테이블을 붙여서 단체석으로도 만들어주시는 것 같더라고요 요 자리도 사각형의 창이라 너무 잘 어울렸고요 한쪽이 아예 통창이라서 밖에 조경이랑 연남동의 푸릇한 담벼락이 보여서 너무너무 기분이 좋았답니다 이날 진짜 더웠지만 날씨가 너무 좋았거든요 덕분에 시원한 곳에서 맑은 날씨까지 구경할 수 있어서 좋았어요 자리에 앉으면 테이블 세팅을 해주시고 저는 언니보다 조금 빠르게 도착해서 블랙커피 (5.0) 주문해서 먼저 마셨어요 콜드브루인 것 같은데 깔끔하니 맛있었고 양이 어마어마했답니다 대용량 가성비 카페 안 부러운 사이즈 메뉴 썸모어델리 메뉴판입니다 아니 메뉴판 내용이 왜 이렇게 많아..? 했는데 다 메뉴 설명이더라고요 저는 언니 기다리면서 하나씩 읽어봤는데요 내용이 너무너무 귀엽고 일기나 동화 읽는 느낌이라서 좋았어요 동물 친구들을 위한 우유가 있는 것 보니깐 반려동물도 입장 가능한 것 같더라고요 귀엽다 귀여워! 아무튼 언니가 와서 메뉴 한참 고민하다가 주문했는데요 진짜 어쩜 이렇게 다 맛있어보이는지ㅠㅠㅠ 그리고 메뉴 나오는 데 조금 걸리긴 하지만 메뉴들이 한 번에 나와서 좋았답니다 저희가 주문한 메뉴는요 트러플 크림 프렌치 토스트 (18.0) 올리브크림치즈를 넣어 구운 양송이 (14.0) +빵 추가 (2.5) 여름의 맛 (14.0) 이렇게 주문했답니다 올리브크림치즈를 넣어 구운 양송이 (14.0) +빵 추가 (2.5) 개인적으로 가장 맛있게 먹었던 메뉴에요 다음에 가면 꼭 다시 먹을 메뉴!! 양송이 안에 올리브 크림치즈가 들어있어서 감칠맛이 장난 없더라고요 완전 와인 안주 각인 느낌에요 가운데에 달달한 크림치즈도 있어서 단짠 조합이 너무너무너무너무 맛있었고요 올리브크림치즈를 넣어 구운 양송이 (14.0) +빵 추가 (2.5) 메뉴 설명에 오일이 그렇게 맛있다고 해서 바게트로 빵 추가를 했는데요 진짜 무조건 하세요 빵추가ㅠㅠㅠㅠㅠㅠ 크림치즈랑 같이 오일 찍어드시면 환상의 맛이랍니다 하나도 안 느끼하고 맛있어요 맛있음 그 자체! 진짜 나 침고여...ㅠㅠㅠㅠㅠ 트러플 크림 프렌치 토스트 (18.0) 일단 프렌치토스트가 겉은 바삭 속은 촉촉하면서 약간 달콤했는데요 그래서 크림이랑 너무 잘 어울렸고요 소스랑 같이 찍어 먹으면 또 너무 맛있더라고요ㅠㅠ 트러플 향도 은은하게 나면서 너무 맛있었어요 여름의 맛 (14.0) 원래는 코코넛 칩이 올라가는 메뉴인데요 제가 코코넛 별로 안 좋아해서 따로 주실 수 있냐고 했는데 흔쾌히 따로 주셔서 너무 감사했답니다 안에 부라타 치즈가 있어서 고소한 맛과 달콤한 망고, 소스는 상큼해서 조화가 좋았어요 진짜.. 아니 어떻게 이렇게 다 맛있담...ㅠㅠㅠㅠ 전체적으로 상큼한 맛이라 마무리로 좋았답니다 후기 아니.. 진짜 어떻게 이렇게 다 맛있담ㅠㅠㅠ 언니가 한번 다녀와서 맛있다고 한 메뉴들로 주문하기는 했는데요 진짜 너무너무 맛있어서 행복했답니다 공간이 주는 여유로움과 뷰, 맛까지 완벽했어요 이번 주말에는 썸모어델리로 브런치 어떠세요? #썸모어델리 #썸모어델리브런치 #연남동브런치 #연희동브런치 #가좌역브런치 #여름의맛 #망고샐러드 #부라타치즈망고 #올리브크림치즈 #양송이브런치 #연남동썸모어델리 #트러플크림프렌치토스트 #인생브런치 #연남동인생브런치맛집 #썸모어델리웨이팅 썸모어델리 서울특별시 마포구 동교로51길 131 1층 썸모어델리 서울특별시 마포구 동교로51길 131 1층"
가본 브런치카페 중 1등 연남동 맛집 썸모어델리,"썸모어델리 🍳연남동 브런치 맛집 썸모어델리 썸모어델리는 송도에서 시작한 브런치카페로 그 후 구월동으로 이사하고, 지금 서울 연남동에 새로 자리 잡았어요. 송도 오픈때부터 쭉~~ 인생 브런치로 불릴만큼 인기있고 유명했어요!! 사장님 쫓아다니기.. 연남동 썸모어델리도 안 가볼 수 없죠!! (근데 최근에 송도에도 다시 카페썸모어로 돌아오셨더라구요!!) 연남동 끝자락에 위치한 브런치카페 썸모어델리 가좌역에서 도보 가깝고 날 좋으면 홍대입구역에 내려서 구경하면서 걸어오기도 멀지않아요!! 주소 서울 마포구 동교로51길 131 1층 영업시간 11시오픈, 19시마감 18시 라스트오더 매주 월요일 정기휴무 주차 도로변 공영주차장 이용 포장, 반려동물 동반 외관부터.. 갬성 뿜뿜 썸모어 사장님 감성 진짜 내 스탈 ㅜㅜ 썸모어델리는 건물 양 옆으로 테라스 좌석이 있어요. 봄 가을에 야외테라스 분위기 있게 즐기기 딱!!! 저는 바로 요 자리에 앉았어요. 연남동 끝자락에 위치하니깐 지나가는 차도 없고 조용하니 너무 좋았어요 !!! 실내에는 테이블이 3개 있어요 2인,4인테이블이 있는데 인원에 맞게 붙여주시거나 하시는거같아요!! 애플&케일주스 메뉴판을 못 찍었어요 ㅜㅜ.. 브런치 먹고 커피마시러 카페 또 갈거라서 일부러 커피 아닌 주스로 시켰는데 아주 건강한 맛이에요 ㅎㅎ 사과 맛 보다는 케일 맛이 강해요!! 예쁜 맛집에서 사진도 냄기기~~~ 토마토 라구 라자냐 트러플 크림 프렌치 토스트 올리브크림치즈를 넣어 구운 양송이 야외 테라스석에 앉으니 푸릇푸릇한 배경에 비쥬얼 맛집!! 예쁘고 먹음직스러운 음식에 사진 안 찍을 수가 없는 ..!!! 토마토 라구 라자냐 19.0 고기, 치즈가 꿀처럼 겹겹히 흐르는 라자냐에요 오랜시간 토마토와 고기를 끓여 녹진해진 토마토 라구소스와 라자냐면, 3가지의 치즈와 소스를 켜켜이 쌓아 만들었어요. 올리브크림치즈를 넣어 구운 양송이 15.0 통통한 양송이에 올리브 크림치즈를 가득 채워 넣어 오븐에 구워낸 메뉴에요. 세상 어디에도 없고 썸모에어사만 먹을 수 있는 메뉴!!! 양송이 밑에 자작자작하게 끓어올라있는 오일에 빵 추가해서 찍어먹어 보시는 걸 추천!!! 트러플크림프렌치토스트 18.0 우유와 크림, 트러플오일을 듬뿍 넣어 약불에 끓여 진득하게 졸여진 우유크림을 계란물을 입혀 부드럽게 구워진 프토에요. 짭짤하게 절여진 케이퍼, 노릇하게 익혀진 베이컨 조합 대존맛!!!!!!!! 썸모어의 시그니처메뉴이기도 한 프렌치토스트 촉촉하면서 부드럽고 진짜 와구와구 순삭입니다 ㅜㅜ 썸모어 메뉴 하나하나 대존맛이고 여태 먹어본 브런치카페 중 정말 최고여요!!!!!! 송도썸모어때부터 너무너무 좋아한 곳!!!!! 썸모어델리 서울특별시 마포구 동교로51길 131 1층"
"[연남동] 썸모어델리, 아기자기한 공간에서 즐기는 굉장한 브런치!","날 좋은 5월의 토요일, 친구 공연을 보러 오랜만에 #연트럴파크 에 가기로한 날. 그 전에 다른 친구들과 너무 헤비하지 않게 브런치 같은 느낌으로~~ 먹기로했다. 공연장 근처에 정말 여러 브런치집이 있었는데, 다 너무 이미 유명한 핫플이었고 그 중 상대적으로 덜 유명하지만, 음식사진이 제일 맘에 들었던 #썸모어델리 라는 곳을 방문했다. 썸모어델리 서울특별시 마포구 동교로51길 131 1층 서울시 마포구 동교로51길 131 1층 / 010-2835-0126 화~일 11:00 - 19:00 (18시 라스트오더) / 반려동물동반, 포장 가능 somemore deli & wine(@somemore.deli) | Instagram 팔로워 1,276명, 팔로잉 4명, 게시물 454개 - somemore deli & wine(@somemore.deli)님의 Instagram 사진 및 동영상 보기 www.instagram.com 정말로 오랜만에 연트럴파크의 끝까지 왔는데, 여기 뭐가 엄청 많이 생겼다. 마치 유럽의 작은 마을을 보는 것만 같았던 곳! 그 길의 끝에 내가 방문한 #썸모어델리 가 있다. 작은 간판과 사랑스러운 손글씨가 쓰여진 입구를 지나쳐서 안으로 들어가면, 작고 아담한 공간이 나온다. 매장이 협소하다보니 예약을 미리 받으시는데, 2명까지만 예약을 받으시고, 3명이상은 워크인으로만 이용가능하다. 우리는 세명인데 부지런한 친구가 먼저 도착해 테이블자리를 맡아주었다 ^_^ 가게의 양 옆으로 아주 아담한 테라스공간이 있는데, 2인 5팀정도만 수용가능한 테이블들이 있다. 썸모어델리는 일반적인 브런치메뉴보단 썸모어의 방식으로 재해석한 메뉴들을 선보이는데, 그 메뉴들을 소개하기 위해 직접 타이핑해서 만드신 듯한 메뉴판은 정성스런 메뉴설명과 사진이있어 보기만해도 기분이 좋아지게 만들었다. 약 10가지의 브런치메뉴들과 음료들이 준비되어있는데, 설명이 아주 자세하게 써져있어서 보고 끌리는 메뉴 두개와 모두가 추천하는 트러플크림 프렌치 토스트를 주문했다. 알고보니 인천의 유명한 #브런치카페 #카페썸모어 가 이 썸모어델리의 원조격이고, 썸모어만의 색으로 요리해서 서울 핫플 연남동까지 진출하셨다니. 그 맛이 무척 기대됐다. 주문한 썸모어 아이스티와 아메리카노가 먼저 나오고 트러플 크림 프렌치 토스트, 올리브크림치즈를 넣어 구운 양송이 +바게트빵, 토마토 라구 라자냐 가 나왔다. 아이스티도 직접 만드신 베리아이스티였는데, 각종 베리 종류가 가득 들어있어서 맛있음! 요리하실 때부터 코 끝을 자극하는 트러플냄새에 정신을 못 차릴 지경이었는데, 음식이 나오고나니 더 그랬다. 플레이팅도 예쁘고, 냄새도 미쳤고, 채광이 잘 들어서 사진도 잘 나오고... 아 이게 브런치의 매력인가...? 시킨 메뉴들 중 단연 1등이었던 트러플 크림 프렌치 토스트. 일반적인 프렌치토스트는 아닐거라고 생각했지만 생각보다도 훨씬 더 맛있었다. 계란물 입은 프렌치토스트에 졸여진 트러플우유크림을 찍어만 먹어도 맛있는데 짠 맛의 케이퍼와 베이컨이 어우러지고 루꼴라 향까지 더해지니.. 극락 그 다음으론 올리브크림치즈를 넣어 구운 양송이! 처음엔 시킨 메뉴도 잊어버려서 웬 통감자가 나왔나.. 했다. 크고 통통한 양송이 버섯 안에 올리브 크림치즈를 가득 채워넣고 오븐에 구워낸 메뉴인데, 사실 설명을 보기 전까지는 ㅇ0ㅇ! 이게 무슨 맛이지? 너무 맛있어! 이런 느낌.. 어디서도 먹을 수 없고 썸모어에만 먹을 수 있는 메뉴라는 말에 동의한다. 먹다보면 아래에 양송이 향이 배인 올리브오일이 가득하고, 크림치즈도 살짝씩 떨어져있어서 거기에 추가한 바게트빵을 찍어먹으면! 이 역시 극락... 셋 중 마지막이라곤하지만 먹어본 라자냐 중에 제일 맛있었던 토마토 라구 라자냐. 매콤하게도 가능하다고하셔서 살짝 매콤하게 해달라고 부탁드렸는데, 앞의 두 메뉴가 조금 크리미했기에 중간 중간 라자냐를 먹어주니 궁합도 좋았던 것 같다. 오랜시간 끓여 깊은 맛이 나는 토마토라구소스와 라자냐면, 3가지 치즈&소스를 켜켜히 쌓아 올린 라자냐. 토마토소스를 좋아하시는 분이라면 너무너무 맛있게 먹을 것 같고, 밀가루 + 치즈 + 고기 조합이다보니 배를 채우기에도 너무! 좋았던 메뉴. 이렇게 한상이 마련되고... 정말 너무 예뻐서 사진도 진짜 많이 찍었다. 플레이팅이 예뻐서 그런가 '간단한' 브런치를 먹기로 하고 만난 것 치곤 테이블을 꽉 채운 음식들.. 그치만, 옆 테이블이 시킨 스프가 맛있어보여서 추가로 스프도 주문했다. 오늘의 스프는 단호박/토마토/감자크림 등 날마다 바뀌는데 오늘의 스프였던 고구마 스프! 생크림이 귀엽게 올라가있고, 계피가루가 살짝 뿌려져있어서 향도 맛도 좋았던. 적당히 단 맛에 계피향이 어우러지고 뭉근한 식감이 추가로 주문한 바게트빵을 여기에 찍어먹어도 맛있었다. 색감도 어찌나 잘 쓰시는지 플레이팅을 허물 때도 자꾸 침이 고여 혼났다. 먹기 좋게 다 잘라두고 베이컨, 버섯, 토마토 등 어우러지게 올려놓으니 또 예뻐보여서 한 컷. 근데 정말 이 프렌치토스트는 미쳤다. 일단 트러플 크림 소스가 정말 미쳤다. 크림소스하면 좀 되직한걸 좋아하는 편인데, 트러플오일과 어우러져서 묽게 깔려있어 오히려 빵을 찍어먹기에 딱 좋았다. 근데 또 그 빵이 약간의 단맛나는 브리오슈빵인데다 고소한 계란물을 먹고있음... 적당히 달고 크리미한게 아주 추천할만한 메뉴였다. 크림이 느끼할 땐 깊은 맛의 라자냐 한입하고, 올리브크림치즈 녹아내리는 양송이 버섯도 한입하고 감바스에 빵추가는 국룰이듯 이 양송이버섯메뉴에 빵추가는 꼭 필수다. 양송이를 다 먹고 나면 아래에 깔린 오일이 또 그렇게 진하고 맛있어서 반드시 찍어먹어야하기때문...! 브런치다운 브런치를 거의 처음 먹은건데, 이렇게 맛있는 곳에서 먹게되다니. 이런 브런치를 먹은건 행운이지만, 앞으로 먹는 모든 브런치들이 와닿지 않는 불행이 될수도... 이쯤되면 #썸세권 에 사는 연남동 사람들이 너무 부럽다. 위치한 곳도 너무 예뻐서 옆의 카페나 음식점들도 나중에 방문해보고싶고, 이 곳과 같은 음식에 더 많은 메뉴들이 있는 인천의 카페 썸모어도 방문해보고싶다. 친구들끼리 소소하게 만나는 것도 좋지만, 무엇보다 데이트 장소로 완전 추천한다."
"브런치 하면 연남동 ""썸모어델리""(솔직한 맛 평가)","평일, 토요일: 11시 - 19시 일요일: 11시 19시 매주 월요일 휴무 전화: 010-2835-0126 포장 가능, 반려동물 동반 -가좌역 4번 출구에서 8분거리- 썸모어델리 서울특별시 마포구 동교로51길 131 1층 야외 자석 11시쯤 갔었는데 이미 야외는 꽈악.. 차있어서 아쉽게도 안에서 먹었어요🥲 또 하필 운이 안좋았던게 메뉴 주문하자마자 야외자리가 생겼는데,, 자리 이동은 안된다고 합니다😅 다음에는 더 일찍 오든가 해야겠어요,, 그보다 야외자리 너무 이쁘죠 요즘 같이 선선한 날씨에 야외에서 시원한 바람 맞으면서 맛있는 음식 먹기 너무 좋을 거 같아요!! 내부 좌석 매장은 작고 아담한 편인데 창이 전부 통창이라서 답답한 느낌이 없어서 더 좋았어요!! 그리구 햇살이 잘 들어 와서 따스한 느낌도 들었어요🙃 조금만한 셀프바도 있어요 셀프바도 분위기 있게 해놓으셨구 전체적으로 깔끔했어요!! 메뉴판 올리브크림치즈를 넣어 구운 양송이(바게트 추가) 트로플 크림 프렌치 토스트 에그인헬 블랙커피 썸모어 아이스티 이렇게 주문했어요!! 블랙커피(5,000원) 산미가 있는 커피이고 깔끔하니 맛있었어요! 역시 브런치엔 커피를 빼먹을 순 없죠:) 썸모어 아이스티(7,000원) 주스를 먹을까 아이스티를 먹을까 고민하다 썸모어 아이스티를 선택하길 잘했단 생각이 들었어요!! 많이 달지 않고 상큼하니 제 입맛에 너무 잘 맞았어요😋 브런치에 커피도 잘 어울리지만 요 아이스티도 너무 잘어울렸어요 시키고 나서 우리 너무 많이 시켰나..? (뒤늦게 후회하는 스타일..) 사실 이렇게 시켰지만 더 먹고 싶었던 음식이 있었다는..🤣 일단 맛 순서로는 구운양송이1등 프렌치 토스트 2등 에그인헬 3등 맛 설명은 아래에서 자세히 해드릴게요👇🏻 메뉴판에도 적혀있지만 어디에서도 먹어보지 못한 맛이라고 적혀있길래 그정도로라고? 한입 먹자마자 바로 이해가 되는 맛이에요..!!!!🫨 통통한 양송이에 올리브 크림치즈를 가득 채워 넣어 오븐에 구워낸 메뉴라고 해요 그리고 빵 추가도 있는데 바게트 or 잡곡식빵 선택하시면 되세요! 저는 바게트로 했는데 잡곡식빵도 잘어울릴거같아요 바삭한 바게트를 양송이 밑에 자작자작하게 끓어올라 있는 오일을 듬뿍 찍어서 양송이를 올려 먹으면 진~~~짜 맛있어요😋 비주얼만 봤을땐 느끼하고 금방 물릴 거 같은데 전~혀 그렇지 않아요!! 바게트에 오일 꼭 찍어먹어 보세요!! 일단 요 구운 양송이 강력추천!!!!!! 에그인헬: 16,000원 메콤하게 끓인 로제소스와 달걀 노른자가 들어 있고 약간의 향신료가 사알짝 들어깄다고 해요!! 그리고 주변에 둘러 싸인 먹물러스크는 썸모어 에그인헬의 시그니처이자 상징이라고 합니다 바게트에도 올려 먹어도 맛있지만 먹물러스크가 확실히 더 잘어울리고 더 맛있었어요! 부드러운 에그인헬에 바사삭 하는 식감인 먹물러스크가 달달하니 너무너무 맛있었답니다!! 트러플 크림 프렌치 토스트: 18,000원 우유와 크림 그리고 트러플오일을 듬뿍 넣어 약불에 보글보글 끓여 반으로 졸여 진득하게 졸여진 우유크림을 계란물을 입혀 부드럽게 구워진 프렌치 토스트라고 해요! 사실 여기 오기 전에 어떤 음식이 제일 맛있고 꼭 먹어야하는 메뉴가 뭘까? 봤는데 다들 요 메뉴는 꼭 먹으라고 계속 생각난다고 하시길래 시켰는데,, 흐음,, 맛은 있었지만 양송이가 너무 맛있어서 그런가,,❓ 생각보다 그냥 그랬던? 한번 먹을만한 정도었어요 은은하게 올라오는 트러플 향도 좋구 토스트가 엄청 촉촉하고 부드러웠어요 그리구 달콤한 크림과 짭조름한 케이퍼와 베이컨 조합도 너무 잘어울렸답니다 확실히 일반적인 프토는 아니라는 것! 브런치를 여기저기 먹으러 가봤지만 브런치다운 브런치를 드디어 먹어본 거 같다는 생각이 들었던 곳이에요🥳 사진만 보셔도 아시겠지만,, 배터지게 먹었네요 케케 연남동 브런치 카페 찾고 계신다면 썸모어 추천드려요! 재방문 의사 1000000% - - -"
