title,content
홍대 연남동 카페 / 비포블루밍 경의선숲길 연말 기념일 케이크 맛집,"안녕하세요, 산호양입니다! 홍대입구역에서 가까운 연남동 케이크 맛집으로 가서 수다를 잔뜩 떨다가 왔어요. 🏡 ""비포블루밍"" <영업시간> : 낮 12시 ~ 오후 10시 <정기휴무일> : 매주 수요일 <문의> : 0507-1302-5517 2호선, 공항철도, 경의중앙 홍대입구역 3번출구에서 약 2분 거리에 위치해있습니다. 위치 서울 마포구 양화로23길 28 3층 비포블루밍 서울특별시 마포구 양화로23길 28 3층 '비포블루밍'은 경의선숲길 바로 옆 길가에 있는 건물에 있어 찾기가 수월했어요. 3층에 있는데 엘레베이터가 없어 계단을 사용하셔야 합니다! 건물 아래 입구에는 여기에 제가 찾던 케이크 맛집이 있다는 걸 알려주는 듯 수많은 포스터들이 있었어요! 3층으로 올라가는 계단도 감성넘치게 꾸며놓으셨네요. 곧 다가올 크리스마스 시즌에 맞춰 가져다놓은 장식도 있었어요! 어떤 케이크를 먹을까 기대하면서 들어갔어요! 직전에 밥을 먹은지라 배가 터질듯이 배부른데 메인 배랑 디저트 배는 따로 있잖아요? 들어가자마자 귀여운 산타모자가 잔뜩 씌워진 화분도 있어요! 분명 평일 저녁이었지만, 역이랑 가까운데다 유명한 케이크 맛집이라 그런지 이미 손님들로 북적이고 있었어요. 이 날, 1시간 반동안 테이크 아웃으로 케이크를 사가시는 일행을 꽤 많이 봤네요! 창가쪽에는 큰 트리가 세워져있어요.🎄 마침 바로 옆 자리가 비어있어서 바로 자리잡았네요. 메뉴판 🍽️ 후다닥 주문부터 해볼까요? 현금결제는 카운터에서 하면 되지만, 카드결제는 키오스크를 이용하면 됩니다! '비포블루밍'에서는 원두도 선택가능했어요! [ 고소한 원두 / 산미가 느껴지는 원두 / 디카페인 / 연한 커피 ] 남자친구는 바닐라 라떼를 주문할 때, 고소한 원두로 선택했네요! 케이크도 하나 시켜줘야겠죠? 저희는 --- 제주생귤탱귤 케이크 바닐라라떼 뉴욕멜로에이드 --- 을 주문했습니다! 메뉴 시작!!🙌🏻 메뉴가 나올 때까지 얼마 걸리지 않았어요! 분명 저 배불렀는데.. 왜 다시 입맛이 도는 거죠.🤤 '바닐라 라떼' 남자친구는 달달한 라떼를 좋아하는 편이라 혹시 쓴 편일까봐 일부러 시럽 추가를 한 번 했어요. 혹시, 살짝 달달한 라떼를 좋아하시는 분들이라면, 굳이 시럽 추가는 안하시는 걸 추천드립니다! '뉴욕멜로에이드' 에이드 중에 어떤 걸 선택할지 고민하다가 블루베리가 들어간 에이드로 골랐어요. 여기서는 과일 진액을 따로 작은 비커에 담아서 주스와 함께 주셨어요. 아래까지 충분히 섞어야 진한 시럽맛을 안 느끼실 수 있어요..🥹 안에 들어있는 베리도 꺼내서 알차게 먹었네요! 마지막으로 '생귤탱귤 케이크' 입니다!🍊 맨 위에는 반쪽짜리 귤이 얹어져 있고, 시트 사이에 있는 크림에 귤이 잔뜩 들어있는게 보여요! 케이크 뒷편에서 보아도 크림보다 귤이 더 많은게 보이시죠! 시트 중간마다 들춰보니 크림이 꽤 가득 들어있네요! 크림은 너무 달지 않으면서 귤은 이름 그대로 새콤달콤한 맛이라 질리지가 않았어요! 문제는 따로 먹을 때는 맛있었는데... 같이 먹으니까 잘 어울리는지 잘 모르겠어요..🥹 하지만... 워낙 크림맛도 좋고, 과일도 신선해보여서 '다음에는 다른 케이크를 도전해보고 싶다' 는 생각이 들었네요! 홍대 연남동 케이크 카페 / 비포블루밍 경의선숲길 연말 기념일 디저트 맛집 🚗 주차 🚗 연남 2 공영주차장 접근성 경의선 숲길 바로 옆에 있어서 홍대입구역이랑도 가까워요! 맛 생귤탱귤 케이크... 다시 고르지는 않을 듯 하지만 다른 케이크는 어떤 맛일지 궁금해졌어요! 비포블루밍 : 네이버 방문자리뷰 1,160 · 블로그리뷰 637 m.place.naver.com 이 글은 내돈내산으로 작성한 솔직한 리뷰입니다. ※사진 무단 도용 금지※ 협찬이나 문의는 비밀 댓글로 부탁드려요..!"
연남동디저트 팬케이크 밀크티는 비포블루밍,"연남동 가면 맨날 가던곳만 가다가 이번에 #버터팬케이크 맛집을 알게되어서 맛있는 밀크티에 팬케이크 먹으로 #비포블루밍 에 들려봤다. 연남동 비포블루밍 화이트톤의 깔끔한 매장 이미 밀크티랑 팬케이크가 맛있다고 소문이 났는지 생각보다 테이블이 많이 차 있었다. 차는 이렇게 향을 맡아보고 고를수도 있는지 한쪽 공간에 차 샘플이 놓여있었다. 커피, 티 메뉴가 있는 메뉴판 아무래도 밀크티 맛집이라 그런지 모든 테이블에는 밀크티가 하나씩 올라와있던 연남동 디저트 비포블루밍 우리도 밀크티 하나, 시원한 에이드 하나 음료를 2개 주문하고 맛있는 프로슈토에그버터팬 하나 시켰다. 팬케이크 비주얼 좀 보세용 ㅠㅠ 안시키고는 못베기는 비주얼 주문 후 조리가 시작되기 때문에 한 10분 정도 시간이 소요된다고 하셨다. 물론 기다릴 수 있는 시간 다양한 밀크티들은 이렇게 티플럼으로도 판매중이라 테이크아웃은 물론이고 선물하기에도 너무 좋게 잘 포장이 되어 진열대에 놓여져있다. 당연히 선물포장도 가능하고 1회분, 4회분 분량도 나눠서 판매하고 있으니까 맛보기용으로도 좋고 선물하기에는 더더욱 좋다. 매장에서 판매중인 밀크티 시럽 티플럼은 네이버스마트스토어에서도 판매하고 있으니까 나중에 집에서도 주문해 먹기 좋을듯 우유만 호로록 타먹으면 된다구여! 히비스커스 티 살구홍차 티 말차티 블랙티 호지티 총 5가지 종류로 다양하게 준비 되어있는 연남 비포블루밍의 밀크티 시럽 그리고 집에서도 홈카페로 밀크티를 만들어 먹을 수 있는 밀크티 키트 밀킷도 밀크티시럽처럼 네이버스마트스토어에서 함께 판매하고 있으니까 집에서도 직접 밀크티 시럽을 만들어서 먹을 수 있다. 요 밀크티 키트 밀킷은 비포블루밍의 시그니처 살구홍차 밀크티를 직접 만들 수 있는 밀키트 키트라고 함 오 요고 신기방기! (❁´◡`❁) 그리고 팬케이크랑 밀크티는 물론이고 이렇게 귀여운 타르트도 디저트로 준비되어 있다. 퍼플베리 타르트 레드베리 타르트 올망졸망 올라가있는 딸기랑 블루베리가 넘 귀엽다. 어디에 앉을까 고민하다가 아무래도 비오는 날에는 바깥이 보이는 창가가 운치 있을 것 같아서 창가쪽에 자리를 잡고 우리의 프로슈토 에그 버터팬케이크가 나올때까지 천천히 기다려 보았다. 10분 정도 기다렸더니 내가 주문한 베리에이드랑 남편이 주문한 스트로베리 밀크티 그리고 프로슈토 에그 버터팬케이크가 예쁘게 플레이팅 되어 나왔다. 주물팬에 구워져 나온 팬케이크는 주물팬까지 뜨끈뜨끈 하니까 조심! 안에는 팬케이크가 있고 그 주변으로 프로슈토 선드라이토마토랑 치즈가 둘러져있는 먹음직스러운 비주얼 그리고 센스있는 영자신문 덕분에 괜시리 뉴요커가 된 기분이다. 메이플시럽저그도 넘 귀엽 가운데 들어있는 달걀은 넘 탱글탱글해서 치즈 같아 보인다 ㅋㅋ 프로슈토, 선드라이토마토에 치즈, 계란까지 들어있고 바닥은 팬케이크로 되어있으니까 디저트로 먹어도 좋지만 든든한 브런치메뉴로도 딱일듯 비가 내리는 창으로 경의선숲길 보면서 맛있는 브런치랑 밀크티 타임이라니 힐링이 따로 없는 시간 시원한 베리에이드는 새콤함 달콤함 가득이라 살짝 짭쪼름한 프로슈토 에그 버터팬이랑 갱장히 찰떡궁합! 남편이 주문한 스트로베리 밀크티는 부드러움과 상큼함이 공존해서 역시나 맛있게 먹을 수 있었다. 스트로베리 밀크티가 맛있으니까 담에는 시그니처인 살구홍차 밀크티도 먹어보고 싶은 맘 연남동 비포블루밍은 한국티소믈리에 챔피언이 운영하는 TEA 전문 매장이니까 담에는 티 메뉴들을 먹어봐도 참 좋을 것 같다는 생각이 들었다. 호지티나 블랙티도 넘 맛있을듯! 치즈같은 가운데 계란을 칼로 슥슥 잘라서 아랫쪽에 팬케이크랑 프로슈토까지 올려 먹으면 을매나 맛있게요? 자르자마자 안에 고여있던 노른자가 주르륵 흘러나와서 더 완벽한 비주얼 디저트로도 좋지만 브런치 메뉴로 더 좋을 것 같았던 맛있는 프로슈토 에그 버터팬케이크였다. 뇸뇸 프로슈토 에그 버터팬케이크랑 상큼달콤 에이드도 그렇고 부드럽고 진한 스트로베리 밀크티까지 맛있게 잘 먹었습니다! 다 먹고 내려오는 길에 계단이 예뻐서 찰칵 비포블루밍 서울특별시 마포구 양화로23길 28 3층"
"홍대팬케이크 카페, 연남동밀크티 맛집 비포블루밍","비포블루밍 서울특별시 마포구 양화로23길 28 3층 당연히 1층에 있을 거라고 생각했는데 3층에 위치해 있던 비포블루밍. 요즘 연남동과 홍대의 카페들이 1층에서 점점 위로 올라가는 거 같다 내 느낌인가?ㅎ 무튼! 분위기도 맛도 좋은 홍대 팬케이크 카페 비포블루밍. 밀크티 덕후 인데 왜 이제야 이 카페를 알았을까 싶을 정도로 너무 내 취향 가득인 카페였다😌 비포블루밍 영업시간 매일 12:00 ~ 23:00 *매달 3번째 월요일 정기휴무 홍대입구역 3번 출구에서 굉장히 가까운 곳에 위치해 있어서 금세 찾을 수 있었다:) 올라가는 계단부터 아주 느낌 있네🙂 들어서자마자 빠른 주문ㅎㅎㅎ 오픈하고 얼마 안 있다 갔더니 자리가 좀 있어서 주문 먼저 하고 앉기로 했다. 살구홍차 밀크티 8,000 베리 에이드 7,800 아이스 바나나 버터팬 12800 시그니처 메뉴들 위주로 주문해 봄ㅎ 밀크티와 시럽인 티 플럼이 담겨진 쇼케이스. 너무 예쁘게 진열되어 있어서 자꾸만 시선이 갔다. 병이 플라스틱인가 했는데 유리병이더란~!!!😮 선물로도 너무 좋을 거 같다 생각하고 쇼케이스 위를 보니 선물포장이 딱~!!!! 생각한 데로 이루어졌다며(?)ㅎ 진짜 특별한 선물이 될 거 같았다. 티 플럼은 이렇게 50ml(1회)와 200ml(4회)로 나뉘어 있어서 구성이 너무 괜찮았다. 50ml로 구매시 맛별로 구매해도 좋을 듯!😋 히비스커스 밀크티도 엄청 마셔보고 싶었는데 처음 간 곳이라 시그니처 메뉴를 안 마셔 볼 수 없어 요건 다음에 마셔보기로 했다. 버터팬 외의 디저트인 레드베리와 퍼플 베리. 이거 사 온다는 거 깜빡했다....... 울 아들이 너무 좋아할 거 같은 비주얼인데 다음번에 홍대 가면 꼭 사가지고 오는걸로~ 그나저나 반가운 이 밀킷! 나도 한번 접해본 적이 있다ㅎ 그때 굉장히 재밌게 또 맛있게 먹었던 기억인데~ 여기서 보니 세상 반가웠다♡ 이번에 신상 루비호박차도 나왔다고~ 임산부들에게 좋은 차로 알고 있는데 주변에 임산부가 있다면 선물로 줘도 좋을 듯싶다. 이건 밀크티 키트. 만드는 방법을 올려뒀던 거라 링크도 달아본다ㅎ https://blog.naver.com/cchicer/222693302012 선물하기 좋은 밀크티 만들기 세트 비포블루밍 오늘은 독특한 밀크티 키트를 소개해 볼까 한다. 밀크티 참 여럿 먹어봤는데 비포블루밍의 밀크티 키트는 ... blog.naver.com 비포블루밍은 한국 티소믈리에 챔피언이 운영하는 TEA 전문 카페이다. 희소성이 있는 카페라 티 좋아하는 사람들이 방문하면 좋을 거 같다♡ 티 전문매장의 포스~! 커피 추출할 때와 느낌이 비슷한 거 같다. 나중에 이거 사용해서 마셔 볼 수 있는 티도 마셔봐야지ㅎㅎ 카페가 이색적이러 해보고 싶은 거 투성~~ 매장 내부 느낌. 3층이라 전망이 정말 좋다♡ 밤에 방문하면 야경이 정말 끝내줄 듯😆 곳곳에 사진들이 걸려 있었는데 카페 분위기와 굉장히 잘 어울렸다. 주문한 메뉴 영접♡ 오랜만에 너무 예쁜 비주얼에 아 여기 연남동 디저트 카페지 싶었다ㅎㅎ 너무 마음에 들어ㅠㅠㅠ 유리창에 경의선 숲길 보이는 것도 좋았고 오늘 카페 방문 완전 성공!! ◆살구홍차 밀크티 비포블루밍의 시그니처 메뉴. 밀킷을 먹어 볼 때와 같은 맛이 났다ㅎㅎ 상큼 달달한 맛에 먹자마자 이마를 탁 쳤다. 많이 달지 않고 깔끔한 맛이라 입안에 내내 감돌아 끝까지 음미 할 수 있어 좋았다. 락 잔에 얼음 담아 주셔서 소분해서 즐겨봤다~ 병째로 마셔도 상관 없겠지만...ㅋㅋㅋㅋ 아무래도 비주얼이?ㅎㅎㅎ 진하게 드시고 싶은 분들은 병째로 드셔도 좋을 듯. 아무래도 얼음이 녹으면서 희석되니 기호에 맞춰 드셔보시길~ ◆베리 에이드 또 다른 시그니처 메뉴. 비주얼이 진짜 심쿵사🥰 여자분들이 딱 좋아할 거 같은 비주얼인데다 맛도 상큼한 과일 맛이 강해서 과일 좋아하는 분들께 추천하고 싶은 음료였다:) 음료 다 마시고 딸기 콕콕 찍어 먹는 재미도 있었다ㅎ 잘 섞으면 이런 느낌~ 많이 먹어 본 듯한 맛인데 친구와 맛 헤매다 내린 결론은 외쿡 사탕맛?ㅎ 동그란 케이스에 들은 사탕 맛이 났던 거 같다ㅎ ◆아이스 바나나 버터팬 왐마...버터팬♡ 진짜 비주얼에 치인다ㅎㅎㅎ 홍대에 갈 일이 또 하나 늘어났다ㅎ 시럽 잔도 귀염뽀작하고 버터팬안에 바나나 아이스크림 그리고 사과잼의 구성이 너무 좋았다😘 너무 탐나던 시럽 잔. 앙증맞게 ml도 적혀 있었는데 이거 폭풍 검색해 봐야 할 듯ㅎ 우리집에 함 오자ㅎ 사과잼 많이 안 달고 과육 씹히는 맛 때문에 버터팬케이크 맛을 한층 업그레이드해준 거 같다. 요 사과잼이 꼭 들어가야 버터팬케이크가 완성되는 듯한 느낌이었다ㅎ 버터팬과 함께 나온 메이플 시럽 무심한듯 휘휘 뿌려주고 어디 한번 먹어보자~! 아이스크림이랑 사과잼의 조합도 굳굳!👍👍 바나나에 크림 브륄레를 한 듯?ㅎ 달달함이 더 살아나서 바나나가 배로 맛이 좋았다. 3가지를 한꺼번에 먹어보기!ㅎㅎㅎ 각각 고유의 맛을 즐겨준 뒤 마지막으로 이렇게 즐겨주면 버터팬케이크를 100% 즐겨 줄 수 있는 거 같다:) 왜 이제야 알았나 싶을 정도로 마음에 든 카페. 연남동 홍대 카페 투어를 그렇게 다녔는데도 아직도 화수분처럼 나오는 카페들에 그저 신기할 따름ㅎ 언젠가 다 정복할 수 있으려나?ㅎ 무튼 홍대입구역에서 너무 가까워서 가끔 밀크티 먹고 싶은데 시간 없을 땐 티 플럼이라도 구매하러 가보고 싶은 곳이다. 자주 이용할 거 같은 이 느낌~!!! 조만간 또 밀크티와 버터팬 먹으러 들러봐야겠다♡ 비포블루밍 카페에서 판매되는 밀크티 밀킷과 밀크티 시럽인 티플럼은 이렇게 네이버 스토어에서도 구매 가능하니 멀어서 못 가시거나 맛이 궁금한 분들은 이용해 보면 좋을 거 같다:) 비포블루밍 : 네이버쇼핑 스마트스토어 ""TEA to trend , Drink in style"" 트렌드를 선도하는 TEA 브랜드 smartstore.naver.com #연남동카페 #연남동팬케이크 #연남동밀크티 #연남동디저트 #홍대팬케이크 #비포블루밍"
연남동케이크 비포블루밍 홍대케이크 여기예요,"홍대 연남동 바로 거기! 홍대 연트럴파크 ㅋㅋ 바로 옆 통유리의 높은뷰가 인상적이였던 무엇보다 맛이 좋았던 비포블루밍에 다녀왔답니다! 저도 그랬지만, 지나가다 들렸다기보단 시간내서 여기 가봐야지! 하고 오시는 분들이 많으신것 같았어요!! 비포블루밍 서울특별시 마포구 양화로23길 28 3층 0507-1302-5517 매일 12:00 ~ 22:00 날 좋았던 어느날! 연트럴파크 바로 옆! 홍대입구역 초입부에 위치해 있는 비포블루밍에 방문했어요!! 홍대는 언제나 참 사람이 많아여 ㅋㅋ 요렇게 생긴 건물! 3층에 위치해 있습니다! 계단을 통해서 올라가시면 되요! 입구부터 케이크 사진 낭낭~ 여기 딸기 홀케이크가 그렇게 맛있다고 하더라구요! https://naver.me/FbR06Lsg 비포블루밍 : 네이버 방문자리뷰 600 · 블로그리뷰 462 naver.me 요기! 네이버 예약으로 미리 예약하시고 날짜체크하시는게 좋습니다 이번에 또 크리스마스 시즌이라 크리스마스케이크 예약오픈이 됐더라구요! 미리미리 해두는 센스! 건물이 엄청 옛날? 스타일이라고 해야되나 그 계단 간격에서 느껴지는 오래된 느낌? ㅋㅋ 오히려 느낌있고 좋았어요! ㅋㅋㅋ 올라가다보이는 빵카로드 포스터에 싸인이 가득 +_+ 3층에 올라가자마자 날 반기는건 대기명단...;ㅁ; .... 헉 어쩌지 했는데 운이 진짜 좋았던게 어떡하지? 하고있는 중에 안에 한테이블이 나와서 바로 그자리에 앉을수 있었어요 초 럭키~ 그리고 나올때보니 다시 대기명단이 더 늘어났더라구요;ㅁ; 영상으로 샤라락 훑어본 쇼케이스! 케이크가 가득가득 했고 여기가 또 밀크티 맛집이거든여 밀크티 종류도 엄청 다양해요!! 뭘 시킬지 모를땐 시그니처를 선택하면 실패가 없지요!! 살구홍차 밀크티와 커피를 못마시는 친구는 베리에이드 그리고 베리머치 미니케이크도 한개 주문하였습니닷! 커피를 선택할땐 원두도 함께 선택할수 있어서 넘 좋더라구요! 담엔 커피 먹어야징 ㅋㅋ 식사도 될수 있는? 버터팬 메뉴도 판매중이였어서 디저트와 간단한 식사도 즐길수 있는 곳! 밀크티가 진짜 다양하게 준비되어 있어요!! 티 플럼 이라고 해가지구 단순하게 말하면 원액? 도 판매되고 있어서 요거 사서 집에서 밀크티 만들어먹음 꿀맛 'ㅁ' 엄청 고민했는데 이날 짐이 많아서 눈으로 잘 담아두고 왔네요 호지차 밀크티 혹하더라구요 +_+ 케이크류도 가득가득!! 간단하게 대중소 사이즈 ㅋㅋ 라고 하고 중간사이즈인 베리머치 미니케이크로 선택했는데 대꿀맛 이였어요!! 홀케이크 비쥬얼 보이시나요? ㅋㅋㅋ 예약 하셔서 원하시는 날짜에 픽하실수 있길 바랍니다 비쥬얼 진짜 최고예요 ㅠㅠ 여기 오기전에 이것저것 찾아봤는데 티소믈리에 분이라고 하시더라구요 그래서 티 이런것도 다시보이던 +_+ 3층뷰로 내려다보이는 연트럴 파크!!! 통유리라서 매장안쪽으로 햇빛도 쫙~ 들어오구 내려다보이는 연트럴파크도 또 위로 보이는 파란하늘도 너무너무 좋았어요 요새 카페들은 뷰도 어쩜 이리 좋은지 만석이라 ... 손님들이 너무 많이계셔서 ;ㅁ; 매장내부 사진은 작게 올려봅니다!!!! 건물자체 계단 이런건 옛 건물같은데 매장안쪽은 엄청 세련된 느낌! 통유리도 넘 매력적이구 곧 크리스마스라 트리까지 'ㅁ' 트리아래 저 빨간통은 뭐지 했는데 티 였어요 ㅋㅋㅋ 찻잎들 ㅋㅋㅋㅋ 너무 예뻐서 장식품인줄 알았는데!!! ㅋㅋㅋ 비포블루밍 네이버스마트스토어가 있더라구요 거기서 파는 밀크티 밀키트? ㅋㅋㅋ 넘 예뻐서 찾아봤지요 또 ㅋㅋㅋ 딴얘기가 많았습니닷! 짠! 나왔어여!! 밀크티, 에이드, 케이쿠~ 베리에이드 넘 맛있고 넘 예쁘더라구요!! 가운데 과일도 막 콕콕 있구! 윗쪽에 꽃잎까지 넘 예쁨!!! 케이크는 말모~ 너무 예쁘고 너무 부드럽고 촉촉 ㅠ ㅠ 밀크티는 남으면 가져가야지 했는데 계속 먹다보니 순삭 ㅋㅋ 너무 맛있는거에요 ㅋㅋㅋ 살구홍차 밀크티라고 해서 무슨맛일까 궁금했는데 넘 맛있었음 빨대로 먹으니 따로 뒤섞지 않아도 아랫쪽부터 먹게되는데 넘 상콤 달콤 밀크티도 따라서 맛있게 먹기!!!! 밀크티 진짜 강추예요 너무 맛있음 ㅠ 케이크는 아직 딸기가 제철이 아니라고 생각해서 크게 기대안했는데 너무 맛있고!!! 일단 시트가 완전 부드럽고 크림이 너무 맛있었어요 조합 완벽! 정말 순식간에 클리어 ㅠㅠ 담엔 홀케이크 사먹어도 되겠어요 ㅋㅋㅋ 시트가 버터시트라고 하는데 그래서 이렇게 촉촉하구나! 깨달았구, 크림은 순우유 생크림 동물성 100%라고 합니다 시트가 진짜 확실히 너무 부드럽고 너무 잘 어우러져서 넘 좋았어요!! 강추강추!!! 연남동케이크 찾고 계신다면 추천드려 봅니다!! 카페 분위기도 넘 좋아서 카페이용도 츄천!!! 밀크티 맛집 뷰맛집 케이크 맛집 세개다하는 맛있는곳이예용 그럼 이만! 비포블루밍 방문기를 마치겠습니다! 뿅!"
