title,content
홍대 연남동 귀여운 카페 & 소품샵 대추천👍 [카페테틈],"카페테틈 영업시간 : 오후 12시 ~ 오후 8시 휴무일 : 월요일 (공휴일 정상운영) 카페테틈 서울특별시 마포구 동교로36길 15 1-2층 카페테틈은 테이크아웃 시 1,000원 할인이 가능하다. 캐릭터가 너무너무 귀여워서 예전부터 저장해뒀던 카페테틈. 쭈랑 홍대에 오게되면서 방문하게 됐다. 외관 연남동 카페 테틈은 귀여운 곰돌이와 화이트 & 레드가 메인 컬러로 꾸며져있다. 우측 사진에 입구는 카페이용자들(픽업 또는 반납)을 위한 문이다. 그래서 처음 들어가거나 소품샵 이용 시엔 정문으로 이용해야한다. 2층은 카페손님들들 위한 공간! 주문은 1층에서 해야한다. 1층 내부 (소품샵) 카운터 또한 화이트, 레드로 꾸며져있다. 쟁반, 컵 모두 컨셉에 진심인 카페테틈. 그래서 또 좋다. 색감이 너무 내 취향이었다. 카운터 건너편에는 카페테틈 캐릭터 소품들이 있다. 모두 미친듯이 귀엽다. 소품샵이니 만큼 포토존도 준비되어있다. 왕크니까 왕귀엽다. (최고임) 2층 (카페) 2층도 레드 & 화이트! 그래서 사진도 잘 나오는..!! 테이블은 총 10 테이블이 있다. 간격이 널찍하 편이고, 음료 만드는 곳이 1층에 있어서 시끄럽지도 않아서 좋았다. 2층으로 입장하자 마자 뭔가 습한 느낌이 있었다. 2층에는 거울에서 사진찍기 딱 좋다. 귀여워서 또 최고임. 소품도 하나하나 귀엽고 컨셉에 진심이다. 액자들도 미친듯이 귀여운 캐릭터로 꾸며져있다. 진짜 모든게 최고다. 셀프바 셀프바에는 냅킨, 물티슈가 준비되어있고, 식기 반납 방법도 적혀있다. 물은 카운터에 부탁하면 주신다. #홍대카페 카페테틈은 반려견 동반 가능 카페인데 주의사항이 있으니 견주분들은 한번씩 읽고 방문하시는게 좋을 것 같다. 음료 메뉴판 #연남동카페 카페테틈의 시그니처 메뉴인 팬케이프 플레이트는 오늘의 과일이 적혀있다. 제철과일을 사용해서 오늘의 과일이라고 위쪽에 적어둔다. #홍대디저트맛집 카페테틈의 여름 시즌 메뉴는 재고 소진시까지 진행한다고 하니 알아두시면 좋다. 시그니처 메뉴인 큐브라떼는 먹는법이 따로 적혀있다. 참고하면 좋다. (지금 읽어보니 우유를 조금씩 넣어야했네...... 어쩐지......) 디저트 메뉴판 연남동카페 카페테틈은 요즘 유행하는 버터샌드도 있다. 귀여워서 충동구매할 뻔했다. 케익은 오레오 우유 케익, 체리 초코 케익, 얼그레이 쉬폰케익, 바스크 치즈케익이 있었다. 쇼핑백 및 영수증 쇼핑백 구매시 300원! 영수증이 필요하면 말씀드려야 한다. 주문후 진동벨. 걍 귀여워서 찍었다. 팬케이크 플레이트 & 큐브라떼 & 카페라떼 팬케이크 플레이트 - 15,000원 카페테틈의 시그니처 메뉴 중하나인 팬케이크 플레이트. 제철과일을 사용해 한층 신선하게 먹을 수 있어 좋고, 하겐다즈 바닐라 아이스크림이 들어간다. 메이플 시럽까지 주니 그야말로 맛없없! 팬케이크는 부드럽기만한 팬케익이 아닌 겉바속촉한 팬케익이어서 식감부분에서 내 취향이었다. 딱 구워진 부분만 바삭해서 얇은 바삭함이었다. 두께는 두꺼워서 속은 촉촉할 수 밖에! 거기다 귀여우기까지하니 두말할 것 없는 메뉴. 카페라떼 - 6,000원 / 큐브라떼 - 8,000원 커피는 고소한 맛이다. 라떼나 크림 올라가는 커피에 고소한 원두를 선호해서 맛있게 먹었다. 홍대카페 카페테틈 시그니처 메뉴 중 하나인 큐브라떼 큐브라떼는 연유가 따로 제공돼 살짝 넣으면 단맛이 잘 느껴지진 않지만 우유가 좀 더 진하게 느껴졌다. 당도조절이 가능해서 매우 마음에 드는 메뉴였다. 얼음에 연유가 닿으면 그대로 굳어버린다는 단점이 있었다. (라떼 설명을 제대로 안 보고 우유 그냥 넣어서 얼음이 녹을 기미가 보이지 않았다.) 이 글을 보시는 분들은 부디 우유를 조금씩 넣어가며 드시길... 연남동 카페, 홍대 카페로 추천하는 디저트맛집 카페테틈. [인스타그램] https://www.instagram.com/cafe.teteum/ 카페테틈(@cafe.teteum) • Instagram 사진 및 동영상 팔로워 4,700명, 팔로잉 4명, 게시물 138개 - 카페테틈(@cafe.teteum)님의 Instagram 사진 및 동영상 보기 www.instagram.com [홍대 속전속결 원데이클래스] https://blog.naver.com/reyan334/223228994680 홍대 연남동 가성비 향수 공방 원데이클래스 [뤼미에르 퍼퓸] 뤼미에르 퍼퓸 연남 영업시간 : 오후 1시 ~ 오후 8시 영업일 : 매일 주차 : X 쭈와 방문한 #홍대향수공방 ... blog.naver.com [홍대 스프카레 맛집 추천] https://blog.naver.com/reyan334/223226445976 홍대 스프카레 혼밥 내돈내산 맛집 추천 [스아게] (하와이안 새우, 야채 카레) 스아게 영업시간 (평일) : 오전 11시 30분 ~ 오후 9시 30분 영업시간 (주말 및 공휴일) : 오후 12시 ~ 오후... blog.naver.com"
[연남동 카페] 귀엽고 하찮은 베베 테마카페 『카페테틈』,"귀여운 캐릭터들이 반기는 소품샵 테마카페 연남동 카페테틈 카페테틈 주소: 서울 마포구 동교로36길 15 1-2층 운영시간: 화요일~ 일요일 12:00~21:00 라스트 오더 20:00 월요일 정기휴무 ※하절기 9시마감(1시간 연장) 카페테틈 서울특별시 마포구 동교로36길 15 1-2층 오랜만에 친구들을 만나서 놀기로 한 날! 전부터 가고싶었던 카페가 있어서 같이 가기로 했다! 홍대입구 3번출구에서 조금 걸어야 나오는 곳인데 골목에 위치해있어서 맵 어플을 켜고 가기로 했다..ㅜㅜ 하얀색 2층짜리 건물에 곰돌이 하나가 입구에 앉아있는데 밖에서도 베베가 앉아있는 것을 볼 수 있다 귀욤 뽀작한 베베..(하트) 베베 옆에는 모니터 하나가 마련되어있는데 사진을 찍을 수 있는 공간이라 많은 사람들이 사진을 찍고 있었다 카페테틈은 1층은 소품샵이 있고 2층이 카페로 되어있다 (1층에서 결제 후에 2층으로 올라가야하는 단점ㅜㅜ) 베베말고도 다른 캐릭터들도 많은데 베베 그림이 그려진 액자들로 1층은 인테리어가 되어있다 노트, 슬리퍼, 폰케이스, 컵, 파우치 등 다양한 소품들이 판매되고 있는데 가장 인기있는 캐릭터가 베베인듯하다 카페테틈 제공 메뉴판을 찍었는데 빛번짐이 너무 심해서 카페테틈에서 메뉴판을 가져왔다 가장 인기있는 메뉴는 베베 모양의 팬케이크가 올라가있는 팬케이크 플레이트랑 베베 얼음이 올라가는 시그니처 음료인 것 같았다 (베베 얼음은 시그니처 음료에만 제공이 되고 선착순으로 제공이 되고 있다) 시그니처 음료는 큐브라테와 밀크티 우리가 시킨 메뉴는 초코 컵케이크와 얼그레이 컵케이크와 컵빙수, 밀크티였다 음료가 준비되는 동안 1층에서 소품들을 구경하기로 했다 카페에서 사용하는 컵도 판매하고 있어서 손님들 중에 카페 이용 후 컵을 구매하시는 분들도 계셨다 컵빙수는 생각보다 밍밍한 맛이었다 뭔가 달지도 않고 고소하지도 않고 되게 밍밍한 맛이었는데 케이크랑 같이 먹으면 딱 맞아서 케이크 한 입 컵빙수 한 입 먹어야했다..ㅋㅋㅋㅋ 시그니처 음료인 밀크티 베베 컵에 베베 얼음이 올라간 밀크티! 일반 얼음이 아니라 밀크티를 얼린 얼음이라 녹아도 밍밍하지 않아서 좋았다 너무 달지도 않고 너무 쌉싸름한 맛도 아니고 너무 인공적인 맛도 아니라서 너무 맛있었다! 약간 공차처럼 펄 넣어서 먹고 싶어지는 맛 컵케이크 위에 올라간 크림이 일반 생크림이 아니라 크림치즈인가? 생각보다 시큼한 맛이라서 얼그레이 컵케이크는 못 먹고 초코 컵케이크만 먹었다ㅜㅜ 꾸덕꾸덕한 크림이 진짜 맛있긴했는데 크림치즈를 못 먹어서 조금 힘들었다 초코 컵케이크도 크림에서 살짝 치즈 맛이 나서 힘들긴 했는데 빵이랑 같이 먹으면 그래도 먹을만 했다 진짜 달달 그 자체라서 컵빙수랑 먹으면 뭐랄까 간이 맞는다고 해야하나..ㅋㅋㅋㅋ 진짜 컵빙수 먹자마자 음... 뭐지 뭔가 부족한데... 너무 밍밍한 맛인데 했는데 컵케이크랑 같이 먹으면 아 딱 먹기 좋네!? 베베를.... 이렇게 처참하게 만들 생각은 없었는데 얼음이 조금씩 녹고 있어서...빨대로 긁었는데 너무 처참해졌다... 홍게가 너무 잔인하다고 사진 찍어줬다ㅋㅋㅋㅋㅋ 인증샷 다 찍었다고 바로 애를 너무 처참하게 죽였다면서.. 잔인한 결말이라며 사진 찍어줬더랩지...ㅎ 보고 가장 탐났던 코스터! 베베 컵에는 베베 코스터로 봉봉이 컵에는 봉봉이 코스터가 같이 오는데 너무 귀여워서 집에 가기 전에 하나 구매하기로 했다 테두리가 약간의 높이 차가 있어서 물이 흐르지 않아서 좋았다 티 코스터 중에서 가끔 물이 그대로 흐르는 제품이 있어서 사용을 안하게 되는데 이 제품은 그런 단점이 보완되어 있어서 좋았다 2층으로 올라가는 문이 매장 안에 있는 것이 아니라 뒷쪽 문을 이용해서 밖으로 나가야하는데 계산이 생각보다 경사가 있었고 음료를 들고 오르락 내리락하기엔 조금 힘들었다 2층도 매장이 넓은 편이 아니라 10개 테이블 미만으로 있어서 금방 웨이팅이 생기는 것 같았다 1시쯤 방문해서 손님들도 적었고 오픈한지 얼마 안된 시간이라 품절된 것은 없었지만 우리가 집에 갈 때쯤엔 매장에 손님이 정말 많았다 티 코스터는 구매 안하고 결국 베베 파우치를 구매했는데 뽀글뽀글한 것이 너무 귀여웠다 오프라인 외에도 온라인에서 소품들을 구매할 수 있다 TETEUM warm in your mind, deep in your life teteum.com"
"연남동 카페테틈, 미쁘동, 도토리 캐리커쳐","연남동 나들이를 하나의 포스팅으로 몰아몰아 올려볼 예정! 연남동 미쁘동 미쁘동 서울특별시 마포구 동교로38길 33-21 2층 연어국수로 핫플핫플이라는 미쁘동! 엄청 빠르게 준비하고 왔는데도 웨이팅이 있어서 큰일이다ㅠ 싶었는데 2인석이라 그런지 바로 입장! 대박 렄키 ㅠㅠ! 미쁘동이랑 연어국수를 시켜따 내 연어국수~! 새우튀김 완전 오동통하고 실했고 토마토 살사소스는 소바 국물이랑 상큼하게 잘 어우러져서 넘 죠앗슴! 느끼하면 먹으라고 준 와사비 찍어먹으면 더더 맛있음! 와사비 없었으면 조금 힘들뻔ㅋㅋㅋㅋ 인스타 올리고 서비스로 받은 우니 크림 고로케! 소스가 넘 묽어서 씹는데 후두둑 다 흘러 넘쳤던ㅋㅋㅋㅋ 우니 크림은 살짝 비릿하긴 했지만 이 집이 튀김을 참 잘 하네...... 도토리 캐리커쳐, 화가삼춘 도토리 캐리커쳐 서울특별시 마포구 동교로38길 34 1층 도토리 캐리커쳐 밥먹고 카페 찾으러 가는 길에 1분 캐리커쳐 라는 글귀가 보여서 홀린듯 직진! 솔직히 캐리커쳐에 큰 관심 없는 편인데 여기는 그림체가 너무 취향저격이라 진짜 0.1초의 고민도 없이 ""우아! 여기 가보자!""라고 ㅋㅋㅋ 가격도 적당했던듯~ 색상 들어간 캔버스가 확실히 분위기 살리는 데 한 몫 하는듯! 우영우 그새 정 들었다곸ㅋㅋ 위에 우영우 그림 보고 냉큼 찍어봄 현금결제를 하면 이렇게 귀여운 티켓을 주시는데 가질순 없고 바로 앞에 계신 작가님께 드리면 된당 건 바이 건 체크하는 용도인가? 눈 깜짝할 사이에 내 그림 먼저 완성! 이 날의 착장 그대로 그려주셔서 넘모 깜놀하고 귀엽고 센스,,, 웨딩사진 주문제작 해볼까 생각ㅋㅋ 나 그리고 난 뒤에 칭구도 바로 시작! 몬가 신기방기,, 아이키 진짜 넘 똑같은거 같음 ㅠㅠ 귀여워 쥬거용 ㅠㅠㅠ 똑바로 읽어도 거꾸로 읽어도 우영우 입니다 친구것까지 완성! 진쨔 너모 똑같아,,,,,, 예쁘닷,,,,,,,, 명함까지 야무지게 챙겨서 이제 진짜 카페로 고고싱! 카페 테틈 카페테틈 서울특별시 마포구 동교로36길 15 1-2층 소품샵 여러곳 지나쳤는데 너무 슬프게 다 문 닫혀있어서 빠르게 이동해 본 카페테틈~ (오류 뜬줄 몰랐음 제길) 문구류, 소품류가 넘 많고 하나같이 귀여웠ㅇ므.... 근데......... 이동진 곰돌이 같다는 생각을 한번 한 후로 계속 뭔가 곰돌이 탈 쓴 이동진 같아서.......... ㅋㅋㅋㅋㅋㅋㅋㅋㅋㅋㅋㅋㅋㅋ 컵케익 짱귀엽 아기자기한거 진짜 넘 많당 공부 잘할것 같이 생긴 곰돌이 카페 테틈은 반려견 동반이 된다고 하는데 캐리어 어쩌구 하는걸 보니 걍 소형견만 가능하다고 보면 될듯,,,ㅎ 컵케잌이랑 밀크티, 앙버터 쿠키 시켰음! 밀크티 귀엽따 얼음 뿌숴서 슬러시로 먹었당 왜케 귀엽니?ㅋㅋㅋ 간만에 쌍콤하게 외출해본지라 셀카도 찍어보기 ㅎㅎ 올해 다섯손가락 안에 꼽는 셀카일듯ㅎ 마지막으론 소품샵에서 거울 셀카를 남기며 아쉬웟던 짧은 연남 나들이 끗"
[연남동 카페] 카페테틈 :: 홍대 귀여운 캐릭터 소품샵 디저트 카페 (케이크 맛있음),"연남동 카페 / 홍대 디저트 카페테틈 카페테틈 📍 위치 : 서울 마포구 동교로36길 15 1-2층 ⏰ 영업시간 : 12:00~20:00 매주 월요일 정기휴무 안녕하세요~! 딩귤입니다 :^D 오늘은 홍대 카페 테틈에 다녀온 후기입니다 귀염뽀짝한 캐릭터 소품과 음료로 가득한 홍대 카페 리뷰 시작합니다~! 외부 위치는 연남동에 위치해있었고 홍대입구역 3번 출구에서 약 400m 걸어가면 나왔어요 연남동 카페 테틈은 1층은 소품샵 2층은 카페로 운영하고 있어서 귀여운 소품들도 구경할 수 있었어요 내부 내부에 딱 들어가자마자 귀여운 곰돌이가 저를 반겨주고 있었는데요 이곳에서 사진 찍기에는 입구 폭이 너무 짧아서 사진이 너무 크게 나와서 아쉬웠어요,, 1층에는 귀여운 소품들 파우치, 컵, 문구류 등을 판매하고 있어서 좋았어요 귀여운 테틈 캐릭터가 있는 소품들이라서 탐이 났는데 구매하기에는 가격이 후덜덜해서 내려놓고 나왔습니다 ㅎㅎ 사진을 찍을 수 있는 pc도 있었고요 메뉴 캐릭터 카페에서 빠질 수 없는 귀여운 디저트들! 테틈 캐릭터 얼음을 추가하면 천 원이 붙는데요 사진 찍기는 귀여운데 마실 때 얼음이 안 녹아서 나중에는 곰돌이 얼음만 남아있었어요.. ㅎㅎ 주문 시 참고하세요 그리고 디저트도 하나 먹으려고 바스크 치즈케이크도 주문했어요 케이크는 특별한 건 없고 그림이 그려진 종이 하나가 꽂혀있었습니다 2층 음료를 주문하고 받아서 2층으로 올라오시면 되는데요 계단이 외부에 있어서 뒤쪽에 있는 계단을 이용해 주시면 됩니다 2층으로 올라오니까 꽤 사람들이 많이 있었어요 빨간색으로 포인트 준 인테리어가 눈에 들어왔습니다 ㅎㅎ 음식 저희가 주문한 음식은 #베베밀크티 (8,000원) #아메리카노 (5,000원) (베베 얼음추가 +1,000원) #바스크치즈케이크 (5,500원) 귀여운 안경쓴곰돌이 얼음에 안경쓴곰돌이컵까지 아기자기하게 나온 음료! 맛은 딱 무난한 밀크티였어요 다만 캐릭터 얼음이 안 녹아서 마지막에는 종이 빨대로 깨부셔서 녹여줬어요 ㅎㅎ 아메리카노보다는 얼음이 덜 단단해서 부서졌는데 아메리카노 곰돌이 얼음은 걍 돌덩어리였어요 고소한 아메리카노와 위에서 반신욕 중인 곰돌이 ㅎㅎ 넘 귀엽죠 이렇게 음료를 다 마실 때까지도 곰돌이 얼음이 안 녹아서 정말 장식품이었어요;; ㅎㅎ 귀엽지만 정말 사진 찍기용 +천 원 카페에서 빨리 마시고 나가셔야 하는 분들은 곰돌이 얼음 추가하지 마세욥;; 귀여운 캐릭터 종이가 꽂혀있는 바스크치즈케이크 솔직히 맛 기대 안 했거든요 근데 반전으로 엄청 꾸덕꾸덕하고 맛있는 치즈케이크였고 진한 치즈 맛이 나서 정말 맛있게 먹었어요! 카페테틈 서울특별시 마포구 동교로36길 15 1-2층 총평 구분 리뷰 별점 맛 치즈케이크가 맛있었던 연남동 카페테틈 ★★★★ 분위기 2층이 조금 답답하다고 해야 할까 환기가 안 되는 느낌이었지만 귀여운 캐릭터도 구경하고 카페가 아기자기함 ★★★★ 가격 비싸지만 연남동 카페면 무난한 가격 ★★★ 재방문 의사 또 가고 싶다는 느낌은 아니지만 한번 가볼 만한 카페 ★★★ #딩귤맛_별4점 #딩귤_별3점 #연남동카페 #홍대카페 #카페테틈 #캐릭터카페 #귀여운카페 #내돈내산 #솔직리뷰"
연남동/카페테틈/연남동카페/ 연남카페/홍대카페/소품샵/밀크티/블루소다/버터샌드/메뉴판,"안녕하세요 윤로그입니다~~ 연남동은 맛집도 많고 카페도 많아서 주말엔 항상 웨이팅이 있는 것 같아요 ㅠㅠ 카페가 많아서 어디를 가면 좋을까 둘러보다가 예쁜 인테리어에 빨간색 안경을 쓴 귀여운 곰돌이가 딱 눈에 띄어서 바로 들어갔습니다 ㅎㅎ 카페테틈 서울특별시 마포구 동교로36길 15 1-2층 위치: 서울특별시 마포구 동교로 36길 15 (홍대입구역 3번 출구에서 419m) 영업시간: 화 수 목 금 토 일 12:00-20:00 월요일 휴무, 공휴일 정상 운영 외부는 이렇게 화이트 + 레드로 돼있고 창문에 귀여운 캐릭터들이 붙어있어요! 비가 많이 와서 날씨가 흐렸는데도 내부가 밝아 뭐가 있는 게 보이니까 뭐가 있나 호기심이 들더라구요 ㅎㅎ 들어가면 종류도 다양하게 노트, 케이스, 편지 등에 귀여운 캐릭터가 그려져있어서 종류별로 다 사고 싶게 만드네요,, 지비츠, 에어팟 케이스, 볼펜 도 있고 아이패드•노트북 케이스, 컵, 슬리퍼 등 전체적으로 깔끔하게 진열돼있고 배경이 화이트라 물건들이 더 돋보이는 것 같아요!! “테틈” 사이트에서도 아이패드 케이스, 스티커, 컵 받침, 컵, 지비츠,인형 등을 판매하고 있네용 ㅎㅎ 카운터에도 크게 테틈(TETEUM) 이 있네용 ㅎㅎ 시그니처 메뉴가 큐브 라테, 밀크티, 팬케이크가 있는데 저는 밀크티 하나랑 상큼한 게먹고 싶어서 블루 소다를 주문했고 베베 버터 샌드가 있는데 또 안 먹어 볼 순 없죠 ㅎㅎ 비 안 왔으면 한 박스로 사 가고 싶은데 ... 아쉬운 대로 맛만 보게 한 개만 시켰어요 베베 버터 샌드 가격 1개 2,200원 1Box(10개,보냉백 포함)20,000원 보냉백 1,000원 종이백은 (200원)유상 판매하고 있어서 필요하시면 계산 전에 말씀해 주시고 영수증은 환경보호를 위해 필요하신 경우에만 출력해 드린다고 하네요!! 주문하고 나서는 2층으로 올라가야 되는데 계단이 밖에 있어서 후문으로 나와서 계단으로 올라가면 되용 ㅎㅎ 2층으로 올라오면 귀여운 테틈 포토존(?) 거울이 있는데 테이블하고 가까워서 그 테이블에 사람 없으면 찍을 수 있고 있으면 찍기 좀 부담스러운 것 같아요 ㅋㅋㅋㅋㅋㅋ🤭 다 드신 후 식기는 픽업하신 곳으로 반납하시면 되고 테틈 휴지랑 물티슈가 따로 있네요 음료는 1층에서 주문하고 기다렸다가 바로 받고 올라오면 되용 ㅎㅎ 귀여운 테틈 밀크티랑 색감이 너무 예쁜 블루소다가 나왔네용 먼저 밀크티는 그냥 맛있는 밀크티였고 베베 곰돌이도 밀크티를 얼려놓은 거라 밀크티 맛이에용 눈이 즐겁고 사진이 잘 나오는 ..? 근데 음 .. 가격이 8,000원이라 좀 비싼 것 같아요 .. 사실 어딜 가나 시그니처 메뉴들은 비싸게 팔아서 자주는 아니지만 한 번씩 시켜 먹는 것 같아요 ㅎㅎ 블루소다도 상큼하고 탄산도 세고 딱 블루레몬 맛이어서 맛있었는데 일단 색이 메뉴판에 있는 색 그대로 너무 예쁜 파랑이여서 신기하구 너무 예뻤어요 ,, 위에 아이스크림이 있는데 스푼은 없어서 섞어 먹는 건가 하고 섞었더니 진짜 이렇게 소다 색이 되더라구요! 섞으면 탄산이 연해지고 소다 맛이 나서 너무 신기해요 ㅎㅎ 😮 왜 이름이 블루소단지 알겠더라고요,, 다음에 가면 절반은 그냥 블루레몬으로 먹고 반은 섞어서 소다로 먹으면 좋을 것 같아요 베베 버터 샌드는 곰돌이 베베 모양에 프랑스산 고메 버터&우유버터로 진한 버터 반죽에 수제 캐러멜과 크림치즈가 더해진 핸드메이드 쿠키인데 바삭하고 버터 향에 캐러멜과 크림치즈 조합이 잘 어울리고 퀄리티가 좋아서 너무 맛있었어요! 냉동 보관 후 드시기 3~5분 전에 꺼내서 자연해동해서 차갑게 드시면 맛있게 드실 수 있습니다 ㅎㅎ 테이블마다 이렇게 개인 소지품 보관용 바구니가 있어서 가방 두기 좋았어요 ㅎㅎ 화장실은 2층에 있는데 예쁜 카페에 화장실도 예쁘고 조명이 잘 돼있으면 좋은데 화장실 조명이 너무 어두워서 얼굴이 잘 안 보여서 아쉬웠어요ㅠㅠ 여자분들은 화장실 거울 중요하지 않나요 !? 저만 그런가요 ..?! 마지막은 귀여운 베베로 마무리할게요 🥰 긴 글 읽어주셔서 감사합니다 맛있는 거 많이 드시고 행복한 하루 보내세용🤍 #연남동카페 #홍대카페 #테틈 #밀크티 #블루소다 #베베버터샌드 #소품샵"
