title,content
"서울 연남동 빵지순례 인생빵집, 모리노팡! 기본에 충실하니 맛있을 수밖에... (식빵, 소금빵, 명란빵)","서울 연남동 빵지순례 인생빵집, 모리노팡! 기본에 충실하니 맛있을 수밖에... (식빵, 소금빵, 명란빵) 서울빵집, 연남동빵집, 서울빵지순례, 동경제과학교 수석졸업 브레드 아티스트가 직접 운영하는 모리노팡 세상에서 가장 어려운 일 중 하나는 '기본에 충실하기'입니다. 기본 (基本)의 사전적 의미는 '사물이나 현상, 이론, 시설 따위를 이루는 바탕'이라고 되어있지만 개인적으로 기본은 '지속적으로 하기 힘든, 고수들은 절대 빼먹지 않고 하는, 몸에 배면 무엇보다 쉬운'이라고 정의합니다. 그래서 무언가를 평가할 때 기본이 되는 것을 보면 실력을 미루어 짐작할 수 있는 것이지요. 한식집에 가서 본식을 먹기 전에 나온 밑반찬 중 김치(특히 백김치)를 맛보면 이 집의 실력을 알 수 있습니다. 중식에선 짜장면을 맛보면 답이 나옵니다. 기본인 짜장면이 별론데 탕수육, 양장피가 맛있을 수 없습니다. (꼭은 아니지만...) 맛만 두고 보자면 그렇다는 것입니다. 저희 회사가 인테리어를 하다 보니 흥하고 망하는 곳을 종종 보게 됩니다. 기본이 제대로 된 곳은 성장하고, 그렇지 못한 곳은 망합니다. 옷가게는 옷이 예뻐야 하고, 음식점은 맛이 있어야 하는데 옷이 별로고, 맛이 없는데도 인테리어로 커버를 하려는 곳들이 있습니다. 본질이 뒤바뀌었기 때문에 장사가 잘 될 리 없습니다. 저희가 금속인테리어를 진행했던 곳 중 하나인 아크메드라비(acmé de la vie)는 '인생의 정점'이라는 뜻을 가진 프랑스어로 좋은 원단과 최신 트렌드에 맞춘 감각적인 디자인과 합리적인 가격으로 K패션 브랜드를 선도하고 있습니다. 결국 좋은 원단, 감각적인 디자인, 합리적인 가격에 독특한 인테리어까지 더해지며 호주 매장에서 줄서기 진풍경까지 연출하게 됩니다. 옷가게의 본질인 감각적인 스트리트 캐주얼로 인기를 얻은 상태에서 독특한 인테리어까지 더해지니 베스트가 되는 것입니다. 이래서 기본이 중요합니다. 아크메드라비, 인생의 정점 디자인! 니즈디자인랩 옷가게인테리어 (feat. 금속인테리어, 금속집기 제작 예맥금속) 아크메드라비, 인생의 정점 디자인! 니즈디자인랩 옷가게인테리어 feat. 금속인테리어, 금속집기 제작 예맥... blog.naver.com 무슨 얘기를 하려고 이렇게 서론이 길어졌느냐 하면요. 모리노팡(森のパン)이라는 빵집 얘기를 좀 하려고 그럽니다. 저는 개인적으로 빵보다 밥을 좋아합니다. 밥은 언제 먹어도 맛있지만 빵은 남들이 맛있다 해도 그냥 빵이구나 하는 정도의 감정밖에 느끼지 못합니다. 그런데 얼마 전 늦게 퇴근 후 집에 갔는데 밥은 없고 먹다만 식빵 한 조각이 있습니다. 남은 것 처리한다는 심정으로 식빵을 한입 물었는데... 촉촉합니다. 씹으면 씹을수록 맛있습니다. ""아니, 이거 뭥미?"" 나머지 하나를 마저 꺼내 먹었습니다. 평소 제가 먹던 82바게뜨 식빵의 느낌이 아닙니다. 제 텅(tongue)은 고급지니까요.ㅎㅎ 마나님을 부릅니다. ""이 식빵 어디꺼야?"" ""재영이네꺼."" ""가게 오픈했어?"" ""어."" ""어디에?"" ""연남동에."" ""식빵 진짜 맛있네. 원래 먹던 거랑 다르다~"" ""재영이가 동경제과학교 수석졸업이잖아."" blabla, blabla, blabla... 울 마나님 절친인 진영씨의 동생 재영씨가 연남동에 빵집을 오픈했다는 것입니다. 보통 친구 남편이 인테리어라도 한다 치면 뭐 좀 도움을 받을 게 없나 부탁도 할 텐데 그런 것이 없고 울 마나님 또한 해주겠다는 말도 안 합니다. ""아니 다른 친구도 아니고 진영씨 동생인데 가게 오픈하면 말이라도 좀 하지 그랬어?"" 하고 물으니 알아서 잘하는데 뭔 말을 하냡니다. ""참 시크하니 좋것다들..."" 그래서 식빵 맛에 반한 제가 주말에 한 번 가자고 했습니다. 부드럽고 쫀듯한 맛의 원인이 궁금했기 때문입니다. 모리노팡 전경과 동경제과학교 수석졸업 상장데쓰.ㅋㅋ 모리노팡 서울특별시 마포구 연남로3길 22-16 101호 모리노팡 인스타에서 퍼 옴. 모리노팡은 경의선 숲길공원에서 멀지 않은 한 골목에 위치하고 있습니다. 일본 여행을 갔다가 마주칠법한 동네의 작은 가게 느낌이랄까요? 이곳은 동경제과를 수석 졸업하고, 독일 IBA제빵 월드컵 및 세계 대회를 섭렵한 일본의 유명 셰프 쿠라타 히로카즈 倉田博和 (くらた　ひろかず)의 수제자인 재영씨가 쥔장입니다. 가게 이름이 모리노팡 (森のパン, 숲속의 빵이라는 뜻) 수풀 삼(森) 정도는 읽고, 고등학교 때 제2외국어로 일본어를 한 (아리가또, 스미마셍 정도 하는 수준.ㅎㅎ) 제가 아는 척 좀 해보려고 물었습니다. ""혹시 숲속의빵이라 지은 것이 자연지향 제품을 만들기 위해 컨셉으로 잡은 거예요?"" ""ㅋㅋ 아니, 그런 심오한 뜻은 없고 그냥 일본식 제과 제빵을 선보이니 일본식 이름 중 발음하기 쉬운 것으로 지었어요. 언니가 이 정도면 좋을 것 같다고..."" 하여간 아는 체를 말아야지 ㅠ.ㅠ 모리노팡의 대표 상품, 키와메쇼쿠팡 ""그럼 모리노팡을 대표하는 빵은 뭐예요?"" ""식빵이에요."" 역시나!! '여기 쥔장도 나처럼 식빵이구나'라는 생각을 했습니다. 그러고 보니 카운터 쪽에 붙어 있는 글귀가 눈에 들어옵니다. 고유의 탕종법과 고수율, 장시간 저온숙성으로 만들어낸 극강의 쫀득함과 촉촉함~ 살아 숨 쉬는 식빵의 결을 느껴보세요!! 은은한 단맛이 전해지는 모리노팡의 식빵 강추!! 아무것도 더하지 않아도 맛있다~ 뭘 해도 맛있다~ 모리노팡 식빵 is 뭔들 탕종법이란 말을 몰라 특별한 비법이냐 물으니... 82바게뜨, 뚜레쥬르는 물론 삼립의 김연경식빵도 탕종법을 적용하고 있다고 합니다. ""그런데 왜 내가 평소 먹던 느낌과 달라요"" 하고 쥔장에게 물으니... ""저도 왜 이렇게 탕종법과 저온숙성으로 빵을 만든다고 하는데 쫀득함과 촉촉함이 덜한지 모르겠어요""라고 반문합니다. ""아마도 좋은 원재료, 단계별 반죽 상태 등을 보는 노하우와 감각, 저온숙성의 시간이 달라서 그런 것은 아닐까라고 생각해요. 숙성도 오랜 시간 숙성하면 좋은 것처럼 생각할 수 있는데 고기든, 반죽이든 최적의 시간을 찾아내는 것이 더 중요하거든요. 결국 좋은 원재료를 쓰고 단계별 반죽 상태를 꼼꼼히 체크하고, 저온숙성 시간을 제대로 지키는 등의 기본을 제대로 해내는 것이 맛의 비결이라 생각해요."" 탕종법 탕종을 이용해 빵을 만드는 방법이다. 탕종은 밀가루에 섭씨 65℃ 정도의 따뜻한 물을 약 1:5 비율로 섞어 만든다. 탕종법으로 만든 반죽은 일반 반죽보다 말랑하고 축축하며 구운 후의 식감 또한 촉촉하고 쫄깃하다. | 외국어 표기 | 湯種法(한자) tangzhong-(영어) | 출처: 게티이미지 코리아 따뜻한 물로 소량의 밀가루를 반죽한 탕종(湯種)을 이용해 빵을 만드는 방법이다. 1875년 일본의 기무라 야수베라는 전직 사무라이 출신 제빵사에 의해 개발됐다. 그는 당시 시큼하거나 짠 외국 빵 대신 일본인의 입맛에 맞는 빵을 만들기... terms.naver.com 그렇습니다. 기본에 충실하면 맛은 따라옵니다. 한국인으로서 동경제과학교를 수석으로 졸업하고, 일본 3대 제과명장이라 불리는 쿠라타 히로카즈가 장, 장(쥔장 이름이 장재영) 해가며 수제자라 칭해지기까지... 이 기본이란 것에 충실했기 때문에 따라온 결과가 아닐까요? 때문에 빵알못이었던 저에게도 살아 숨 쉬는 식빵의 결이 느껴졌던 것이겠지요. '아무것도 더하지 않아도 맛있다'라고 자신하는 이 식빵의 맛을 어찌 전해야 할지 몰라... 이렇게 장황하게 설명이 길어졌습니다. 제가 방문했을 때 빵을 구매하시는 분들에게 식빵 반장을 샘플로 제공하고 있었는데 마케팅 관점에서 ""딱 좋다""란 생각을 했습니다. 맛보면 사지 않을 수 없는 그런 식빵이었기 때문입니다. 그리고 이 촉촉함이 얼마나 유지될까 궁금해 빵을 사 온 당일에 다 먹지 않고 일부를 남겨두었습니다. 이틀이 지나고 삼일이 지나서도 맛을 봤는데 보들보들하고 쫄깃합니다. ""와~ 이거 정말 대박인데..."" 오늘은 밥(밥식, 食) 대신 빵 어떠세요? 이번엔 순삭의 끝판왕(?)이라 불리는 소금빵 시오바타입니다. 손님 중에 딸이 사가지고 온 식빵 맛을 보고 '넌 왜 식빵 하나만 사 왔냐'면서 (이 글을 쓰고 있는 6월 12일 아침에는) 오픈하자마자 모든 시오바타를 한 분이 사가셨다고 합니다. 극강의 부드러움과 고짠의 정석이란 소개처럼 프랑스산 토판염 게랑드 소금에 버터의 풍미가 더해지면서 고짠(고소짭잘)이 완성됩니다. 소금과 버터로 순삭 시킬 수 있는 빵집이라면... 팥앙금, 치즈, 메이플 시럽, 카레, 바나나 등이 들어간 빵은 얼마나 맛이 있을까요? 먹어보지 않아도 느낌이 딱 오지 않나요? 모리노팡에 있는 빵들을 잠시 소개하겠습니다. 볶음면이 빵 속으로~ 이것이 바로 면빵~ 이국적인 맛으로 한 번 맛보면 자꾸 생각난다는 ""야키소바팡"" 엄선한 팥앙금과 저온 숙성한 반죽으로 만든 영원한 레트로. 할미템! ""앙팡"" 아침엔 이빵, 오후에도 요빵. 모리노팡의 고수율 식빵으로 만든 햄치즈 흐렌치 토스트, ""하무치-흐렌치"" 메이플 시럽이 줄줄, 바게뜨 프렌치 토스트. ""메-프르 흐렌치"" 통밀과 진짜 바나나가 만난 바나나 머핀. ""바나나 마휘인"" J들의 소~울 브레드. ""카레-팡"" 향긋한 바질이 부드러운 빵속으로~ 브레드 디렉터 추천템. ""못짜 안도 바지르"" 표면의 비스킷 부분에 줄무늬가 멜론 모양을 닮았기 때문에 멜론빵이라고 불리는 ""메롬팡"" 붕어빵에는 붕어가 없고, 메롬팡에 메론은 없지만 맛있다는 게 핵심. 달기만 한 생크림은 저리 가라~ 프렌치 생크림의 풍미와 맛을 그대로 느낄 수 있는 생크림 단팥빵 ""나마앙팡"" 개인적으로 모리노팡에서 특이했던 빵 하나를 꼽으라면 단연 ""타라못 치-즈""였습니다. 수제모찌와 짭조름한 명란이 들어갔다고 해서 나름 명란의 뻔한 맛이 느껴질 것이라 생각했는데... 오히려 명란이 들어갔다는 말을 듣지 못했다면 명란이란 생각은 아예 못했을 것입니다. 정말 말로 표현이 안되는 (맛있게) 독특한 맛입니다. 어떤 손님은 맛있는 된장 맛이 난다고도 했다는... 저에게 모리노팡의 빵을 한마디로 정의하라 한다면... '집밥 같은 빵'이라 말하고 싶습니다. 너무 달지도 짜지도 그렇다고 느끼하지도 않은... 그래서 씹으면 씹을수록 맛이 나는 집 밥 같은 그런 빵입니다. 빵은 두 개 이상 먹지 못하는 제가 다 맛을 볼 수 있었던 것은 그만큼 물리지 않고 맛있었다는 것입니다. 이렇게 칭찬만 늘어놓으면 누군가는 '지인 가게이니 맛있다고 하는 것 아니냐'라고 말씀하실 수도 있겠지만... 내돈내산에 아니다 싶으면 식구가 부탁해도 포스팅하지 않습니다. 자신 없이 권했다 무슨 욕을 먹을라구요. 모리노팡같은 곳은 굳이 홍보를 안 해줘도 입소문을 탈 것이지만... 기본에 충실해 멋지게 성장하고 있는 한 젊은 친구를 응원하는 마음에 포스팅해 봅니다. 빵맛집 찾아 빵지순례 중이신 빵순이, 빵돌이 분들이 계시다면... 모리노팡에 한 번 방문해 보세요. 인생빵집 하나 추가될 것이라 확신합니다. 이 글을 읽은 모든 분들께... 돈복이 빵빵하게 터지길 바랍니다.^^ 森のパン J-style Bakery(@morinopan_bakery) • Instagram 사진 및 동영상 팔로워 61명, 팔로잉 22명, 게시물 7개 - 森のパン J-style Bakery(@morinopan_bakery)님의 Instagram 사진 및 동영상 보기 www.instagram.com"
지브리감성 연남동 모리노팡 연남동 베이커리 카페 🍥🥐,"지브리 덕후로써 일본 느낌 뿜뿜 베이커리카페는 지나칠 수 없었어요..! 가게 이름은 ‘모리노팡’ <영업 시간> Mon off Tue-Sun 11:00-20:00 음료 종류가 아메리카노, 라떼가 끝이더라구요 얼죽아인 저는 노상관!! 곳곳에 보이는 토토로.... 마녀배달부 키키보다도 토토로를 좋아하시나봐요 빵 종류가 엄청 다양했어요!! 내부 공간은 이렇습니다! 야끼소바빵 너무 귀엽죠.. 🍥 토토로!!! 귀여운빵 한가득 🥧🍪🍩🍰🧁🥖🥐🥯🍞🥞 토토로는 덤 ♥ 밖에도 자리가 있어요! 커피가 지인짜 맛있어요..! 산미 없는 커피 좋아하시면 추천드려요 이거 존맛탱 ㅜㅜ 과하게 달지 않고 쫀득쫀득 식감이 너무 너무 매력적... 다음엔 184749292개 시켜서 먹으려구요 ㅎㅎ 보니까 다들 한가득 빵을 사가시던데 이유가 있었다..! 👍🏻 노래도 일본 지브리감성으로 틀어주셔서 편하게 쉬다 왔습니다 ~! 모리노팡 서울특별시 마포구 연남로5길 42 1층 모리노팡 #연남동카페 #연남동맛집 #연남동빵집 #연남동베이커리"
"연남동 맛집 모리노팡, 귀여운 빵과 맛있는 멜론빵이 있는 베이커리","모리노팡 동경제과를 수석으로 졸업하고 독일 IBA제빵 월드컵 등을 섭렵한 일본의 유명 셰프 쿠라타 히로카즈의 수제자인 브레드 아티스트의 빵을 즐길 수 있는 연남동 베이커리 맛집 모리노팡 > info. 모리노팡 서울특별시 마포구 연남로5길 42 1층 모리노팡 * 서울특별시 마포구 연남로5길 42 1층 * 영업시간 화 - 일 11:00 - 20:00 매주 월요일 정기 휴무 * 추천메뉴 메론팡러스크 2,800원 마카다미아크록캉 3,200원 안녕하세요 루루입니다 하염없이 연남동을 걷다가 친구가 어..! 여기....! 하길래 따라 들어갔다가 발견한 나만 몰랐던 존맛탱 베이커리 모리노팡 소개해드릴게요~! #연남베이커리 #연남동맛집 메론빵이 유명하다는 모리노팡 메론빵뿐만 아니라 맛있어 보이는 빵으로 가득했어요 마카다미아크록캉 참내 마카다미아 이빠이데스 아그작아그작ㅋㅋㅋㅋ큐ㅠㅠ 마카다미아 조아하는 저는 또 일단 집어..! #연남베이커리 #연남동맛집 아니 빵이 이렇게 귀여워도 돼요 ??? 이렇게 귀여운걸 어떻게 먹어ㅠ 뇸,, 표정 다른 것두 귀엽고,, 하트코도 귀야워요,,❤ #연남베이커리 #연남동맛집 카라멜 소금빵 ?!?!! 안 먹어도 맛있는데요;; 탕종식빵 요것두 먹어보고 싶었는데.. 넌 다음에 두고보자 #연남베이커리 #연남동맛집 냉장고에 초코가 곱게 코팅된 반질반질한 빵들도 있었어요 여기.. 천국인가 ? 귀엽다.. 빵집이 이렇게 귀여울 일인가 어떡하지 ? 정말 너무 귀엽다... #연남베이커리 #연남동맛집 제가 골라온 메론빵 러스크와 마카다미아 이빠이데스 와그작와스작 멜론빵 러스크는 제대로 파사삭한 느낌이 살아있고 달달한 멜론빵이라 일반 러스크와는 다르게 즐길 수 있었어요 마카다미아크록캉은 눈으로 보시는 것처럼,, 찐득한 느낌과 마카다미아의 오도독함이 잘 어우러져 견과류 조아 설탕 조아 인간에게 아주 최적화된 맛이었습니다 친구 따라 들어갔다가 존맛탱 빵집 발견해서 왕 신나요 담에 가서 또 사야지 !! 마카다미아 이빠이데스,, 와그작,, 와그작,,,!!! #모리노팡 #멜론빵 #멜론빵맛집 #연남빵집 #연남동빵집 #연남빵집추천 #연남베이커리추천 #연남베이커리 #연남동맛집 #연남동맛집추천 森のパン 모리노팡 J-style Bakery(@morinopan_bakery) • Instagram 사진 및 동영상 팔로워 670명, 게시물 12개 - ▪️동경제과학교를 수석 졸업한 브레드 아티스트가 직접 만듭니다 ▫️서울시 마포구 연남로 5길 42 1층 모리노팡 ▫️영업시간: 오전 11시부터 오후 8시 (빵 소진시 조기 마감) ▫️단체 주문은 최소 2일 전 예약 바랍니다 ▫️매 주 월요일 휴무입니다 www.instagram.com > instagram; @morinopan_bakery"
"연남동 일본식 빵집, 시오바타(소금빵) 맛집: 모리노팡 森のパン","塩バター 시오바타(소금빵) 맛집 연남동 일본식 빵집 모리노팡 森のパン 모리노팡 : 네이버 방문자리뷰 184 · 블로그리뷰 66 m.place.naver.com 모리노팡 주소: 서울 마포구 연남로3길 22-16 101호 영업시간 11:00-20:00 *매주 월요일 정기휴무 (제품 소진 시 마감) 0507-1334-1360 연남동에 일본 감성 뿜뿜한 빵집이 있다고 해서 방문했어요! 인테리어도 니혼스럽게 꾸며놓은 모리노팡 음료는 아메리카노와 라떼가 있었어요! (저희는 빵만 사들고 가기 위해 음료는 먹지 않았어욧) 정말 다양한 종류의 빵이 많아서 행복했어요 ♥ 바구니를 하나씩 들고 먹고 싶은 거 담기 !! (모리노팡은 앉아서 먹을 공간은 없어 보였어요 ㅠㅠ) 키와메쇼쿠팡(きわめ食パン) 베스트 라고 별 세개나 있어요! 빵집이면 식빵이 기본적으로 맛있으니깐요 멘타이 바겟트(メンタイバケット) 오리지널 명란의 맛을 느끼고 싶다면 멘타이 바겟트 먹어보시면 좋을 것 같아요!! (친구꺼 한입 뺏어 먹었는뎅.. 맛있었음) 카레팡(カレーパン), 메론팡(メロンパン)도 있어요 !! 사과빵인 링고팡(りんごパン) 앙팡(あんパン), 크리-므팡(クリームパン) 일본 편의점에서 많이 봤던 야키소바팡(やきそばパン) 귀여운 동물빵 도-부츠팡(どうぶつパン) 코알라와 고양이 중에 고양이를 데려가기로 결정 ! 친구가 소금빵 시오바타(しおバター)은 꼭 먹어야 한다며 !! * 모리노팡의 시그니처 메뉴에요!! 꼭 먹기 소금빵, 사과빵, 동물빵으로 골랐어요~ 너무 귀염뽀짝하고 다 먹고 싶었음.. 친구랑 같이 산 거 세팅~~ 모리노팡의 시그니처 메뉴인 소금빵 ㅎㅎ 저는 소금빵 처음 먹어봐서 이게 뭐가 맛있을까 했는뎅..존맛탱이었어요 !! 일본 감성+맛있는 빵을 먹을 수 있는 모리노팡 완전 맘에 들었어요~ 모리노팡 서울특별시 마포구 연남로3길 22-16 101호 #모리노팡 #연남동빵집 #연남동디저트 #연남동일본 #연남동일본빵집 #연남동소금빵"
"[홍대/연남동 카페] 모리노팡, 연남동 일본 빵집! 이쁘고 귀엽고 맛있다 (내돈내산)","연남동 안쪽 골목에 있는 모리노팡! [모리노팡은 숲의 빵이라는 뜻] 우리 앞에 있는 여성 몇 분이 막 달려가서 들어갔던... 그.. 그 정도야?! [재료 소진 시 마감이다] 친구가 연남동에 있는 빵집을 꼭 가야 한다고 해서 카페 갔다가 들린 곳인데 내가 너무 좋아하는 분위기잖아?! > < 나도 모르게 스르륵 줄을 서버렸다 유명하다고 하니.. 온 김에 나도 먹고! 선물로 주고 해야지~ 이 식빵이 뭔데.. 그렇게 유명한 건가.. 식빵이 5,800원이나 ?! [키와메쇼쿠팡] 하지만.. 먹어보면 일반 식빵과 정말 맛이 달랐다 두께도 좋고... 푹신? 쫄깃? 한 느낌이 강하다! 토스트나 구워서 먹으려 했는데 식감이 너무 좋아서 그냥 잼 없이 냠냠냠 다 먹어버림............ ㅎ 중독성이 어마어마하다 이거 처음 보고 얼마나 유명하면 식빵을... 1조각씩 판매를?.. 이 정도인가?..! 했었는데...ㅋㅋㅋㅋ 나중에 이유를 알았지 뭐야.. ㅎ 다른 빵들도 인기가 많은 것 같다 가게가 조금 협소해서 사람이 많으니 북적북적~ 야키소바 빵 장난감처럼 색감이 너무 이쁘길래 궁금해서 구매했는데 맛은.. 음.. 그냥저냥? 사이즈에 비해 가격이 좀 나가는 것 같다 일본에서 먹었던 느낌인 토끼 빵..>< 너무 귀엽잖아 인기가 많은 소금 빵! 스티커 색상 달라서.. 뭔가 싶었는데 동일한 빵이라고 한다 소금 빵은 사진 처럼 하나씩 개별 포장되어 있다 [오른쪽은 집에서 찍은 사진!] 크림, 초코, 캐러멜이 있는 소금 빵! 명란 바게트 [멘타이바겟토] 는 끝..! 친구가 마지막으로 구매했길래 친구 장바구니에 있는 사진 찍었다 ㅋㅋㅋㅋㅋ 요즘 일본 여행 가고 싶었는데 빵 이름에 일본어가 써져있고 일본에서 갔던 카페 분위기가 비슷해서 뭔가 잠시 일본 여행 온 느낌이 들었다 커피도 판매 중이지만 자리가 협소 + 사람이 많이 오니 빵만 사는 것을 추천드림 ㅎ 개인적으로 소금 빵, 야키소바 빵보다는 식빵만 2-3개 더 사 오고 싶다 헤헿 다음에는... 메롬 팡이랑... 식빵.. 더 사 와야겠다..!! 적립금 적립도 가능하지만... 서울이라 자주 못 올 것 같아서 친구 폰 번으로 적립 몰빵 ㅎㅎㅎㅎ 일본 유명 셰프 수제자가 만드신다고 하시던데 일본 분이 사장님이실까?..? 궁금 내 돈 주고 내가 사 먹은 후기! 모리노팡 서울특별시 마포구 연남로5길 42 1층 모리노팡 모리노팡 주소 서울 마포구 연남로5길 42 1층 모리노팡 영업시간 번호 0507-1334-1360 [23년 05월 기준]"
[연남동 빵집투어13] 모리노팡(일본빵집),"#230115 모리노팡 Morinopan 모리노팡 서울특별시 마포구 연남로3길 22-16 101호 주소 서울특별시 마포구 연남로 3길 22-16 1층 운영시간 화~일 : 오전11시 ~ 오후8시 월 : 휴무 (모든빵 나오는 시간 : 오픈시간) 기타 ☎0507-1334-1360 森のパン 모리노팡 J-style Bakery(@morinopan_bakery) • Instagram 사진 및 동영상 팔로워 497명, 팔로잉 25명, 게시물 9개 - 森のパン 모리노팡 J-style Bakery(@morinopan_bakery)님의 Instagram 사진 및 동영상 보기 www.instagram.com 저 멀리서 입간판이 보이네요. 모리노팡은 숲의 빵이라는 뜻이라고 합니다. 외관이 참 심플하네요. 앞에 놓인 자전거와 나무들이 일본틱하네요 ㅎㅎ 모리노팡의 쉐프는 동경제과를 수석으로 졸업하고 독일 IBA제빵 월드컵 및 세계대회를 섭렵한 일본의 유명 셰프, 쿠라타 히로카즈의 수제자인 브레드 아티스트가 만든다고 합니다. 빵 종류가 아담하게 있어요. 하나씩 볼까요? 키와메 쇼쿠팡 1장 1,000원 카레팡 3,600원 메롱팡 2,200원 BEST! 키와메 쇼쿠팡 5,300원 핫도그빵 3개 1,800원 메프르 라운도 5,800원 BEST! 타라못치즈 3,800원 소세지팡 3,800원 커스터드 크림빵 2,200원 앙팡 1,800원 밤파이 3,600원 링고팡 3,600원 야키소바빵 3,300원 카츠산도 4,600원 에비 레몬 크리므 마요 4,600원 에비치리 4,600원 캐러멜 시오바타 3,500원 초코 시오바타 3,500원 연유크림 시오버터 2,700원 쿠로네코 4,200원 도부츠팡 3,800원 시그니처! 시오바타 1,800원 멘타이 바겟토 3,800원 하무치 흐렌치 3,600원 메프르 흐렌치 3,200원 바나나 머핀 2,600원 크루통 2,200원 마카다미아 크록캉 2,800원 메론빵 러스크 2,700원 빵 종류가 참 다양하고 저렴해서 좋으네요 ㅎㅎ 일본빵집은 가본적 없는데 이렇게 연남동에서 즐길 수 있다니 좋네요! 직원 추천메뉴는 키와메 쇼쿠팡입니다. 식빵종류라고 하네요^^ 저는 일본애니에 많이 나오는 야키소바빵을 구매했습니다. 이치코 쟈므 산도 4,900원 나마초코 3,600원 생크림 단팥빵 3,400원 요렇게 쇼케이스 안에 들어있는 것도 있었어요^^ 지브리 감성 너무 좋아요 ㅎㅎ 테이크아웃으로 음료도 주문가능합니다. 계산하고 나오니 요런 나무가 있어 비록 크리스마스는 지났지만 크리스마스느낌이 물씬 나네요 ㅎㅎ 상품 리뷰 비주얼이 죽이죠? 일본 애니에서 튀어나온 것 같은 비주얼이에요. 먹어보니 짭쪼롬한 야끼소바를 먹는 느낌이었어요. 빵을 부드럽더라고요. 총평 일본빵집 모리노팡에 왔는데요. 한국에서 접해보지 않는 빵을 즐길 수 있어 좋은 것 같아요. 특히 야끼소바빵이 일본애니에 많이 나오는데 맛이 궁금했는데, 이렇게 맛을 볼 수 있어 좋았어요. 야끼소바빵은 특별한 맛은 아니었던 것 같아요. 먹어본 걸로 만족하려구요. 재방문은 하지 않을 것 같습니다."
