title,content
[연남동 카페]나만의 비밀의 숲속 다락방 같은 빈티지한 분위기가 장난 아닌 커피 맛집_맥코이 연남:) 힐링힐링🪵🍃,"안녕하세요:) 제가 연남동에 있는 맥코이 연남 카페를 갔다왔습니다 일 끝나고 밤에 방문했는데,, 진짜 너무 분위기가 좋아서 반하고 왔어요@ 예전부터 가보려고 저장해 뒀는데 드디어 방문하게 되었답니다 자칫! 그냥 지나칠 뻔 했어요 어두컴컴해서 잘 안보였어요👀 진짜 이 분위기 실물을 못담았어요ㅠ 숲속에서 만난 오두막같은 느낌이 가득해요 사람이 많지는 않아서 시끄럽고 정신 없거나 하지 않아서 더 좋았습니다:) 카페 샤케라토 맥코이 커피 오른쪽의 커피가 맥코이 커피이고, 이 카페의 시그니쳐입니다:) 카라멜크림이 올라간 아인슈페너? 넘넘 맛나용:) 분위기에 한번 취하구, 맛에 한번 취하는 크으~.~ 마시쪙 냠냠 한 잔씩 맛나게 먹어쬬ㅎㅎ 다음에 또 가자➰🫨 알찌??!? 야간모드가 베려버린 내부 사진,,,,, 내부는 빈티지한 소품들과 인테리어로 꾸며져있고, 벽시계가 정각이 되면 울린답니다🕰️ 맥코이 연남 월-일 09:00~21:00 서울 마포구 성미산로 147 070-8648-2210 맥코이 연남 : 네이버 방문자리뷰 524 · 블로그리뷰 665 m.place.naver.com"
[연남동 카페] 맥코이 연남,연남동 맥코이에 다녀왔다. 밤에 가면 이런 무드 … 가을 바람 솔솔 부는 요즘과도 너무 잘 어울리는곳 간판이 없지만 이 외관을 찾으면 된다. 카페 내부 카페 안에 걸려있던 시계인데 카페 마감 시간에 가보니 시계 안에 날짜를 직접 바꾸고 계셨다. 메뉴판 사진 음료 쿠폰도 심플하고 예쁘다 아늑하고 차분한 느낌 저 김현식 엘피 우리집에도 있는거라 괜히 반가웠다 ㅋ 처음 가는 카페에 가면 무조건 시그니처 커피로 시켜보는데 맥코이 커피가 시그니처 커피ㅎㅎ 찐한 크림이 올라간 커피인데 적당히 단크림이랑 커피가 조화롭다. 단커피 매니아인 나는 연남동 가면 무조건 맥코이 커피 🖤 영업시간은 오전 9시부터 밤 9시까지인데 라스트오더 시간이 정해져 있지 않아 8시 50분에 가도 커피 주문이 가능 하다는 장점! 안에서 마시지 않고 테이크아웃 하면 되니까 커피 들고 연트럴 파크 산책하면 너무 좋을듯 하다 ☺️ 50m © NAVER Corp. 맥코이 연남 서울특별시 마포구 성미산로 147 #맥코이 #맥코이연남 #연남동카페 #연남동핫플 #연남동 #연남동맛집 #연남동데이트 #연트럴파크 #연트럴파크데이트 #크림커피 #커피맛집 #카페투어 #데이트코스 #데이트 #홍대카페 #홍대맛집
"연남동 카페 맥코이 연남, 산속 작은 오두막 같은 맛있는 커피집","맥코이 연남 서울특별시 마포구 성미산로 147 안녕하세요. 글로리아디자인 입니다:) 오늘은 요즘 젊은이들에게 핫한 동네 연남동의 카페 방문후기를 써보려 합니다! 인테리어가 굉장히 독특했던 연남동의 '맥코이'! 맥코이 연남 영업시간 매일 9:00~21:00 맥코이 인스타그램 https://www.instagram.com/mccoys_coffee 맥코이(@mccoys_coffee) • Instagram 사진 및 동영상 팔로워 2,117명, 팔로잉 0명, 게시물 5개 - 맥코이(@mccoys_coffee)님의 Instagram 사진 및 동영상 보기 www.instagram.com 외관이 정말 독특했던 맥코이 연남카페! 외관을 보니 들어가고 싶은 욕구가 마구 생기더라구요!ㅎㅎ 왠지 맛집일 것 같아!! 빈티지한 나무로 만든 입간판 컨셉이 정말 좋다! 맥코이카페는 연남,한남에 있는 카페인데 포스팅하면서 인스타그램을 보니 이번에 맥코이 신사에도 오픈하셨나 봅니다! 인스타그램보니까 눈내리는 겨울에 오면 정말 분위기 좋을 것 같은 느낌이 들어요 ^^ 커피 맛집, 분위기 맛집! 인테리어가 빈티지하고 정말 산속 산장에 와있는듯한 기분이 들게하는 연남동카페 맥코이카페! 집에서 가깝다면 정말 자주 가고 싶은 카페! 그치만 커피맛집으로 유명한 만큼 손님들도 많답니다! 맥코이 연남 메뉴판 ▼▼▼ 메뉴판은 제가 사진을 못찍어서 네이버에서 퍼왔어요. 이건 좀 예전것 같아요. 지금은 조금 달랐답니다 ㅠㅠ 저희는 아메리카노, 시그니처메뉴인 맥코이커피 주문하였습니다! Next image 열심히 커피를 만들어 주시는 직원분들! 친절하십니다^^ 빈티지함을 더욱 돋보여 주는 소품들 영롱한 맥코이커피 비쥬얼~~ 카라멜향의 부드러운 크림에 반할 수 밖에 없는 맛! 커피랑 너무 잘 어울리는 맛있는 크림! 분위기도 좋지만 커피 또한 맛있어서 인기 많을 수 밖에 없는 연남동 커피맛집 맥코이! 다음번엔 디저트도 시켜 볼것! 재방문의사 200%!!! *내돈 내산 후기입니다.*"
연남동 카페 맥코이 연남 산장분위기에서 맛있는 커피 한잔,"안녕하세요 :) 오늘은 저번에 연남동 나들이갔을때 가본 카페 한군데 소개해보려합니다. 어디에선가 한번보고나서 가보고싶다라는 생각이 들어서 저장해놨던곳인데 확실히 가보길 잘한것같아요 히히 맥코이는 한남, 신사, 연남 총 이렇게 3군데 지점이 있더라구요. 제가 가본건 맥코이 연남. 연남동 카페 맥코이 연남에서 커피한잔 먹어본 후기 시작해볼께요♪ #연남동카페 #연남동커피 #연남동커피맛집 #맥코이 #맥코이연남 #맥코이연남메뉴 #맥코이커피 연남동 카페 맥코이 연남 산장분위기에서 맛있는 커피 한잔 주소 : 서울 마포구 성미산로 147 지번 : 연남동 250-5 영업시간 : 09:00 ~ 21:00 전화번호 : 070-8648-2210 반려동물 동반 연남동 카페인 맥코이 연남. 여기는 커피가 맛있다고하시는분들이 많아 맛있는 커피를 맛보고싶어 간곳인데요. 맥코이연남 들어가는 외관부터 하......이 분위기 대체 무엇... 산속에 있는 산장느낌 가~득이에요. 들어가는 입구에서부터 아 좋다. 라는 소리가 절로 나왔던것같아요. 나 여기 오길 잘했네. 연남동 카페 맥코이 연남의 나무문을 열고 들어가면 안에도 이렇게나 멋드러지게 꾸며져있습니다. 제일 눈에 띄는건 가운데에 놓여진 커다란 나무 테이블. 나무의 결? 나이테? 요런것들이 고스란히 느껴지는 느낌이라 오히려 빈티지스러움도 함께 가지고있어 멋지더라구요. 내가 만약 나이가 들고 나중에 산속에 산장을 갖게된다면 이런식으로 해놓고싶다. 라는 생각이 들기도했어요^^ 벽면도 나무 그리고 턱하니 놓여져있는 드럼통. 저 드럼통이 테이블역할인데 저것도 참 기발한 아이디어인것같고 이 공간과 아주 찰떡입니다. 연남동 카페인 맥코이 연남에 오기전에 먹을 메뉴를 미리 정해오긴했습니다. 구지 정하지않았어도 저 메뉴를 먹었을것같기는해요. ㅋㅋㅋㅋㅋㅋㅋㅋㅋㅋㅋㅋ 맥코이연남에는 에스프레소 메뉴들도있어서 에스프레소 드시는 분들도 많더라구요. 시그니쳐로 보이는 맥코이커피 6,000원 요걸로 주문합니다. 스탬프카드도 하나 받아왔어요. 연남동 카페 맥코이 연남의 내부는 그리 넓지 않구요. 또 너무 밝지않아요. 오히려 너무 밝지않아 더 좋은듯한 느낌이 드는곳이고 아늑하기도했어요. 뭔가 여기 딱 앉아있는데 장작타는소리가 들린다면 찰떡이겠다 싶었어요. 맥코이 연남에서 사실 먹어보고싶은 커피 종류가 꽤 많았는데요. 이 전에 이미 두군데를 다녀온 후라 한잔만 먹어보기로. 제가 주문한 맥코이커피는 카라멜크림라떼라고 보시면 될 듯 합니다. 잔에도 맥코이 쓰여져있는데 예쁘더라구요. 그리고 사이즈는 작은편-! (요즘 맛있는 커피들은 다 크기가 작아..) 연남동 카페 맥코이 연남 산장분위기에서 맛있는 커피 한잔 재생 3 좋아요 1 00:00 00:14  연남동 카페 맥코이 연남 산장분위기에서 맛있는 커피 한잔 생각보다 내부 공간이 좋아서 동영상도 스리슬쩍 찍어와봤습니다 :) 연남동 카페 맥코이 연남의 맥코이 커피. 안그래도 크림러버라 크림올라간 커피를 좋아하는 제 입맛에 아주 취향저격이었던 그런 커피였어요. 달콤하고 고소하고 맛있어요 ㅠㅠ 위에 올라간 크림은 달콤하면서 동시에 카라멜향이 스윽~ 크림 자체가 묽은편이라 호로록 커피랑 입안에 쓰윽 들어오는편-! 아래 커피는 진하면서 고소하니... 이렇게 작은 커피잔인데 맛있어서 나름 애껴먹는다고 홀짝홀짝 마셨네요. ㅋㅋㅋㅋㅋㅋㅋㅋㅋㅋㅋㅋㅋㅋㅋㅋ 만약 이 날 이곳이 첫 카페였다면 이것저것 더 시켜서 먹었을것같습니다. 또 한번 말하지만, 이 집 커피 잘하고 오길 잘했네. 커피도 맛있고 분위기도 좋으니 안올이유가없었네요. ㅋㅋㅋㅋ 연남동 카페 맥코이 연남 다녀온 후기는 여기까지구요. 오늘도 제 글 읽어주셔서 감사하고 좋은하루되세요♡ 50m © NAVER Corp. 맥코이 연남 서울특별시 마포구 성미산로 147"
맥코이 연남. 분위기 조명 감성카페 추천. 연남동 애견동반가능,"연남동 카페 맥코이 분위기 맛집.. 조명 맛집.. 감성가득 커피 맛집.. 🤎 입구부터 조명이 너무너무 예쁜 맥코이 연남 밤에 갔더니 입구부터 완전 취향저격이여따 지난 번에 차타고 지나가면서 내가 예뿌다고 했던 걸 기억하고 데려왔다규,, 난 기억이 안나지만. 기특하군 ^^ 연남동 카페 맥코이 메뉴 시그니처인 맥코이커피랑 밤이니까 카페인 없는 초코라떼 주문했다 ㅎㅎ 내부 조명도 은은하면서 분위기가 너무 좋았당 흘러나오는 노래도 좋았다 주문한 초코라떼랑 맥코이커피 ㅎㅎ 맥코이 연남은 강아지도 같이 갈 수 있는 애견동반가능 카페라 좋았다 ㅎㅎ 내부가 넓은 편이 아니라 안고 있거나 가방에 데리고 있는게 좋을 것 같당ㅎㅎ 시그니처인 맥코이커피 카라멜크림이 올라가 있어서 적당히 달면서 진해서 아주 맛있었다.🤎 초코라떼도 초코맛이 입안 가득 음료 자체가 진하게 나와서 맛있었당 ㅎ 맥코이 연남. 분위기 조명 감성카페 추천. 연남동 애견동반가능 재생 2 좋아요 1  접기/펴기 맥코이 연남. 분위기 조명 감성카페 추천. 연남동 애견동반가능 연남동 분위기 맛집 조명맛집 커피맛집 맥코이 ⭐️ 50m © NAVER Corp. 맥코이 연남 서울특별시 마포구 성미산로 147"
"@맥코이 연남 (연남동 분위기 좋은 카페,,) /McCoy","#맥코이커피 #맥코이 #맥코이연남 #연남카페 #연남동 좋아하는 연남동 - 별다른 이유는 없으나, 그냥 이 동네의 분위기가 너무 좋다. 홍대랑은 너무나도 다른 분위기 지인짜 오랜만에 만난 친구들과 합정에서 연남동으로 넘어와서 카페에 갔다. #맥코이카페 는 친구들 중 한명이 좋아하는 카페라며 소개해줬다. #동교로41길 요즘 유행하는 카페들이 많은 곳이다. #얼스어스 도 있고, #티크닉 도 있고 날씨가 좀 흐리고 이날은 또 야외에서 먹기엔 추운 날씨였는데도 불구하고 많은 사람들이 테라스 좌석에서 음료를 마시고 있었다. 역시 사람들 대단,, 멕코이 연남 매일 9:00 - 21:00 헤헤 감성 감성파인 나한테 취향저격이었다. 작은 오두막, 갑자기 숲속에 들어와있는 것 같은 느낌 약간 우중충하고 비올 것 같은 날씨였어서 그런가 더 고즈넉해보이고 분위기 있어보였다. 내부는 큰 편이 아니라 사실 자리잡기가 되게 어려울 것 같다. 평일도 그럴 거 같고.. 주말엔 더.. 우리는 일요일 딱 오후 타임에 왔더니 정말 사람들로 꽉꽉 차있었다. 다른 카페를 가야하나 어떡하나 하는데, 사장님이 대기걸어놓으셔도 된다고 해서 대기 걸어놓고 주변 산책하고 구경하고 왔다. 생각보다 일찍 자리가 나서, 금방 들어갈 수 있었다. (우리 이후로도 대기 걸어놓은 사람들도 있고, 카페 밖에서 자리나길 기다리는 사람들도 있었다.) 내부도 다 나무로 된 인테리어라 정말 산장 느낌이 났다. #맥코이한남 도 있다는데, 궁금했다. 한남동도 참 좋아하는 동네 중 하나인데 다음에 가봐야겠다. 마침 옆에 있던 분들이 나가서 사진을 찍을 수 있었던 쇼파자리. 창문넘어 보이는 바깥 풍경들이 되게 예뻤다. 사계절 다 예쁜 풍경일듯.. 예전에 정말 이 동네에서 살아보면 어떤 느낌일까 싶었는데, 구석구석 좋은 카페들이 많아서 나만의 아지트 찾는 기분도 들고 좋을 것 같다. 그치만 연남동은 나의 환경범위에서 너무 멀,,,어,,, ㅠㅠ 친구가 극찬했던 커피 #아메리카노 원두가 참 좋다며 여기를 꼭 소개해주고 싶어했다. 궁금궁금 - 아메리카노 마셔봤는데 산미가 강하지도 않고 적당해서 다크한 아메리카노를 좋아하는 나한테도 딱 맞았다. 여기는 오전에 혼자 쓰윽- 와서 커피 한잔 하면서 할일도 하고 휴식하고 가기 참 좋은 곳 같다. 우리 집주변에도 이런 아늑한 곳이 있으면 좋으련만,, 50m © NAVER Corp. 맥코이 연남 서울특별시 마포구 성미산로 147 #홍대카페 #마포카페 #연남동카페 #연남카페 #맥코이 #mccoy #연남커피맛집 #연남카페추천"
"[연남동/홍대입구역] 맥코이 연남 - 숲 속 작은 집, 맥코이 커피","연남동 카페 맥코이 연남 숲 속 작은 집 창가에- 있는 것 같은 우드재질 카페 맥코이 연남에 다녀왔어요 작은 오두막집 느낌의 맥코이 연남 맥코이 커피와 미숫 라떼, 그리고 휘낭시에 주문- 맥코이커피 6.0 휘낭시에 2.5 먼저 나온 휘낭시에와 맥코이 커피 마지막 하나 남았던 휘낭시에를 주문했는데 바삭해 씹는 맛이 좋았고 속은 촉촉해서 순식간에 다먹어버렸어요 사라져라 내 뱃속으로- 미숫 라떼 6.0 커피를 이미 마신 뭉개가 시킨 논커피 메뉴 한 줄로 맛을 설명해달라고 하였더니 꿀맛! 그러하다- 카라멜 크림이 올라간 달콤한 라떼 맥코이커피는 정말 너무 맛있어서 순식간에 마셨어요 달콤한 음료 좋아하시면 추천 :) 아바라 좋아하는♡ 우리 커피 아장이들 랑싸랑 수비니가 마시면 반할 맛 아담한 사이즈에 나무로 꾸며진 아늑한 분위기- 봄날씨 만끽하기 좋은 야외자리도 있어요 음악 들으면서 바람소리 듣기 좋은 문 앞 자리- 카페에서 나오는 음악이 좋아 가만히 밖을 바라보는 것만으로도 힐링이 되고 좋았어요 저녁에 다시 찾은 맥코이 연남 오후에 왔을 때와는 또 다른 느낌 낮에 마신 맥코이 커피가 맛있어서 다시 찾은 맥코이 토마스랑 또 마실 생각에 신바람 났는데 카페 비엔나도 맛있다고 하셔서 토마스 기다리며 비엔나 한 잔- 낮에 앉았던 자리 바라보기 카페비엔나 5.0 사장님 추천의 따뜻한 카페비엔나 카페비엔나랑 맥코이커피 둘 다 왜 인기메뉴인지 알겠더라구요 따신것도 너무나 맛있었어요 아이스만 마시다 뜨거운걸 시켰더니 감을 잃어서 후루룩 마시다 깜짝 놀랐뜨..거워- 카페비엔나는 부드럽게 달콤하고 맥코이커피는 조금 더 달달하니 맛있어요 맥코이 커피 6.0 토마스에게도 이 맛있는 음료를 마실 수 있는 기회를 선사하노라- 토마스는 맥코이 아이스로 시켰는데 달콤한 캬라멜크림이 역시는 역시- 하마터면 또 시킬 뻔 했어요 또 마셔도 맛있는 맥코이 커피 덕분에 오랜만에 커피를 마구 마셔버렸어요 맛있는 커피 만들어주셔서 감사합니다 :) 음악도 좋고 우드재질 분위기도 좋고 커피도 맛있던 반짝 빛난 시간으로 가득한 하루- 맥코이 연남 재생 0 좋아요 0 00:00 00:00  접기/펴기 맥코이연남 맥코이 연남 매일 09:00-21:00 반려동물 동반 50m © NAVER Corp. 맥코이 연남 서울특별시 마포구 성미산로 147 #맥코이 #맥코이연남 #연남동카페 #연남카페 #홍대입구역카페 #홍대입구카페 #커피맛집 #내돈내산"
맥코이 연남 ; 롱블랙이 맛잇었던 연남동 카페,"50m © NAVER Corp. 맥코이 연남 서울특별시 마포구 성미산로 147 맥코이(@mccoys_coffee) • Instagram 사진 및 동영상 팔로워 2,237명, 팔로잉 0명, 게시물 5개 - 맥코이(@mccoys_coffee)님의 Instagram 사진 및 동영상 보기 instagram.com 맥코이 연남 매일 09:00-21:00 221217 맛 커피를 찾아 떠나온 오두막집 같은 외관의 연남동 카페 맥코이 메뉴판 원두 설명 오두막집 같은 외관과 이어지는 느낌의 내부 슬쩍 보이는 크리스마스 느낌 🎄 이태원에서 갔던 코지빌라 커피와 비슷한 인상을 받았다. 가운데는 큰 쉐어 테이블이 있고 쇼파테이블 하나, 2인 테이블이 4개 정도 있는 크지 않은 공간이었다. 연남, 한남, 신사 총 세 지점이 있는 맥코이 롱블랙 미숫라떼 롱블랙 롱블랙 마시자마자 알게되었다. 연남동 카페 맥코이는 커피 맛집이구나 ಠ_ಠ 여기다 믿고 오는 커피집 롱블랙과 아메리카노가 별 차이가 없는 카페가 종종 있었는데 여긴 확실하게 다른것이 느껴졌다. 산미적고 진하고 무거운 맛으로 너무 맛있다. (⸝⸝⸝ᵒ̴̶̷ ⌑ ᵒ̴̶̷⸝⸝⸝)✨ 빨대 없이 주셔서 그냥 마시기는 했는데 치아에 닿으면 안 될 것같이 진한 그런 느낌 ꉂꉂ(ᵔᗜᵔ*) 미숫라떼 저녁이라 밍끄는 카페인이 없는 메뉴로 주문했다. 우유에 타주신 진한 미숫가루는 달지 않고 고숩고 어릴때 먹었던 맛보다 고급스러운 느낌으로 맛있는 맛 아이스아메리카노 롱블랙이 너무 맛있었으니 당연히 추가 주문해야겠져 아이스아메리카노는 롱블랙보다 조금 더 연한 느낌이지만 역시나 묵직한 느낌의 커피로 너무 취향에 알맞음 커피 맛집 롱블랙 맛집 아메리카노 맛집 연남동카페 맥코이 연남 #맥코이연남 #맥코이 #연남동카페 #연남동롱블랙 #연남동커피맛집 #롱블랙 #미숫라떼 #아이스아메리카노 #맛있다"
주말 데이트 산장분위기 연남동카페 맥코이 연남,"#주말데이트 #연남동데이트 #청수당 요기도 유명하다던데~ 역시나 사람이 많았음,, 근데 진짜 주말에 #홍대카페 #연남동카페 는 헬존~ 사람 너무 많음,, #산장 분위기 아주작고 자전거가 놓여져 있고 간판도,, ㅋㅋ 거의 다지워져 가서,, 카페인가 싶을 정도인 #맥코이연남 50m © NAVER Corp. 맥코이 연남 서울특별시 마포구 성미산로 147 맥코이 연남 여기도 사람너무 많고 해서 #마녀배달부키키카페 갔는데,, 거긴뭐 넘사벽 ㅋㅋㅋ 대기가 백명인가라,, 갔다가 다시 오니깐 한팀 있어서,, 기다림,, 맥코이 연남 내부,, #빈티지소품 들과 고재나무들 취향저격!! 사실 내부가 크면 사진도 찍고 하면 좋은데,, 사람도 너무많고,, 장소도 너무 좁아서,, 사진찍기가,, 연남동 카페 메뉴!! 난 커피 못먹으니깐 레몬에이드 먹고 언니는 사케라토 요기 주문하는곳 옆에서 한사람이나,, 두사람 정도 먹을 수 있는데,, 여긴 너무 ㅋㅋ 불편해서 다행히,, 큰테이블 말고 개인테이블 있어서 운좋게 착석!! #마샬스피커 ~ 오오~ 산장은 안가봤지만,, 진짜 산장에 있는 느낌이고~ 난로에~ 뭔가 주말아닌 #평일데이트 에 사람이 없다면 너무 좋을것같은 공간!! 레몬에이드는 잘 저어드시고~ 언니말론 맛있다고 했던듯,, 사케라토 근데,, 여기 맥코이커피 그 크림이 맛있다고 하는데,, 커피를 못먹으니 ㅋㅋㅋ 알수는 없음 암튼 분위기 좋고~ #갬성카페 찾으신다면,, 맥코이 연남 추천해 드립니다~ #연남동데이트장소 #연남데이트"
[연남동] 아늑한 느낌 가득한 ‘맥코이 연남’,연남동 가면 핫한 카페들이 많은데 그중 저의 최애 카페인 ‘맥코이’ 제가 갔던 날 눈이 쌓여있어서 정말 겨울날 숲속 별장 느낌이었어요 맥코이 연남 📍 서울 마포구 성미산로 147 🕐 매일 9:00 ~ 21:00 🚗 주차시설 X 오두막 같은 아기자기한 외관에 눈까지 더해지니까 더 포근한 느낌이 나던 맥코이 주전자 말고 고구마를 올리고 싶었던 난로 북유럽 느낌 가득한 내부에요 우드들과 브라운 계열의 아이템들로 따뜻한 느낌을 주는 카페라서 노래 들으면서 커피 한잔해주면 힐링 되는데 이 맛에 제가 맥코이를 좋아합니다 ㅎㅎㅎ 맥코이 커피가 시그니처 메뉴인데 플랫화이트 위에 카라멜 크림이 올라간 커피로 가장 인기가 많은 커피에요 맥코이에 오면 항상 맥코이 커피를 마시는데 너무 추워서 이날은 라떼 마셨어요 ㅎㅎㅎ 맥코이에서 라떼는 처음 마셔봤는데 원두가 좋은지 고소하면서 부드럽게 마셨어요 끝 맛이 텁텁한 느낌이 없어서 너무 좋았어요 동생이 주문한 콜롬비아 핀카 라프라데라 이름 너무 어렵다........ 맥코이에서 핸드드립 커피도 판매하는데 신기한 맛이 나던 커피였어요! 딸기맛이 나서 오묘한 맛을 자랑하는 핸드드립 커피 제 스타일은 아니지만 동생은 맥코이 오면 이 커피를 자주 마신다고해요 역시 디저트가 빠지면 아쉽죠!! 티라미수랑 딸기 티라미수가 있는데 티라미수가 솔드아웃이라서 딸기 티라미수 먹어봤어요 크림의 달콤함과 딸기의 상큼함 맛이 잘 어울렸던 디저트에요 역시 겨울에는 딸기로 만든 디저트가 쵝오에요
연남동 카페/맥코이 커피/맥코이 연남,"경의선 숲길 따라 걷다 보니 어느새 맥코이 연남. 커피 맛있고 분위기 좋은 카페 맥코이는 연남동 외에도 한남동과 성수동, 가로수길에서도 만날 수 있는데요, 각 카페마다 조금씩 다른 모습이라 더 재미있어요. 내부는 아담하고 조명이 어두워 더 아늑한 느낌. 앞에서 주문을 하면 자리로 가져다주세요. 공간과 잘 어울리는 음악과 겨울 감성 돋는 난로. 옹성거리는 대화와 웃음소리까지 더해져 작은 산장에 온듯한 맥코이 연남👍🏻 저희가 주문한 맥코이 커피(6000원)는 카라멜크림이 올려진 카페 맥코이의 시그니처 커피예요. 쫀득한 크림의 진한 커피. 정말 맛있어요:-) 분위기 좋고 커피도 맛있는 연남동 카페 맥코이 연남은 매일 오전 9시부터 저녁 9시까지 영업해요. 50m © NAVER Corp. 맥코이 연남 서울특별시 마포구 성미산로 147"
연남동 카페 :: 연트럴파크 숨겨진 산장 분위기의 라떼 맛집 맥코이연남,"안녕하세요 느루입니다! 오늘은 무더운 햇빛을 헤치고(?) 간 커피 맛집 소개해볼게요 총총 간판도 없는데 사람이 끊이질 않았던 카페 감성 최고 가게 내부 넓지 않았는데 그래서 사람들이 들락날락 테이크아웃도 많이 하더라 맥코이 연남 메뉴판 필터 커피도 있었는데 첫 방문이니까 시그니처 맥코이라떼로 🤍 맥코이에는 커피 뿐만 아니라 알코올도 있어서 다양한 사람들이 마실 수 있는 음료들 이 있었다 필터카페로 디카페인도 있었음! :) 맥코이라떼 크림 정말 맛있더라 티라미수도 하나 시켰는데 두입정도 맛만봤다 시트는 없고 크림이랑 가루만 먹었는데.. 중간에 시트 있었으려나..? 카페 곳곳에 예쁜 소품들 뭔가 아쉬워서 아메리카노 한잔 더 쿠폰도 만듦 4개 찍어주셨다 음료만 찍어주는 듯 크림이 정말 맛있었던 맥코이라떼 추천 🤍 아메리카노는 쏘쏘였다 자리가 많지 않아서 잘못하면 웨이팅할 듯 주말엔 웨이팅 있다고 하덩데.. 평일 낮인데도 이정도였으니 말 다했다 😅 50m © NAVER Corp. 맥코이 연남 서울특별시 마포구 성미산로 147 총평 -감성 카페, 작업하기는 좀 힘들듯 (가능하긴 한데 자리잡기가 어려워보이고 좀 눈치보이는 카페) -맥코이 카페, 티라미수 추천! 영업시간 매일 9:00 - 21:00 주차 x"
