title,content
"[마포/연남동] 맥코이 연남 그리고 빈티지샵 AdHouse, 또보겠지 떡볶이","안냐세요- 헤헤 지난 주에 짝꿍이랑 연남동에서 데이트 했고든요. 여전히 갈 때마다 새로워지는 연남동.. #연남동데이트 #연남동카페 #연남동맛집 #연남동빈티지샵 300m © NAVER Corp. 맥코이 연남 서울특별시 마포구 성미산로 147 또보겠지떡볶이집 스마일보이점 서울특별시 마포구 와우산로29길 14-8 101호 또보겠지떡볶이집 스마일보이점 예약 adhouse 서울특별시 마포구 포은로 87 2층 사실 오늘의 목적지는 맥코이 연남이었다고 해도 과언이 아닐 것....! 보통 홍대입구에서 많이들 연남동에 가는데 그러면 맥코이 연남이랑 너무 멀어서용 버스타고 가서 연희104고지에서 내려서 굴다리로 들어가면 연남동이 짜란하고 나타난답니당! 오빠가 뭔가 저 굴다리 분위기 좋다고 거기서 나오는 척 해보래서 ㅋㅋㅋㅋ 파워 어색.jpg 아 이날 흐렸구 이제 9월이니까 위에 린넨 셔츠 하나 가볍게 입고 갔는데 너-무 푹푹 찌는 거에요.. 더워 죽을 뻔 했어요ㅠㅠ 한여름인 줄 알았어요. 이상기온 요즘 진짜 문제있죠. 일회용품 사용 최소화 해야해요 진짜! 가는 길에 만난 마가렛! 다음엔 오빠가 꼭 여기 가보자구. 테라스를 예쁘게 꾸며두어서 다음에 날 선선할 때 가보려구요. 케이크가 유명한 것 같더라구요? 여름의 능소화도 그 옆에 예쁘게 늘어져있어요. 날씨는 흐렸지만 연남동에 예쁜 가게들 보며 산책하니까 좋더라구요 그리고 대망의 맥코이! 사실 여기는 두번째 방문인데요. 지난 번에 친구랑 방문했을 때 너무 좋았어서 짝꿍이를 데려오고 싶었어요. 이 특유의 분위기가 맥코이의 '간판'이나 다름없는 것 같아요. 좁지만 커다란 테이블을 과감하게 놓고 벽면을 분리해서 오크통 테이블을 비치해 두었구요. 창가 쪽 자리가 예쁜데 못 담아왔어요. 아쉽.. 저는 창가와 커다란 테이블 사이의 낡고 오래된 소파에 앉았어요. 친한 온니가 신행 선물로 사다준 랄프커피 모자가 이 사진의 쥔공..(언냐 사랑햐..) 그리고 미친 감성의 포인트.. 적어서 계산해주시더라고요ㅠㅠ 이런 아날로그 감성 갈수록 더 좋지않나요? 나만 그뤠? 왠지 자주 올 것 같아서 쿠폰도 찍어달라고 그랬는데 쿠폰 마저 감성있어.. 맘에 들어.. 짝꿍이는 아이스 라떼, 저는 따뜻한 카페 비엔나를 먹었어요. 지난 번에도 카페 비엔나를 먹었는데 맛있어서 또 먹고 싶었어요! 근데 짝꿍이의 아이스 라떼를 먹어본 순간.... 아 요기 다음엔 그냥 따뜻한 라떼도 먹어보고 싶다! 완전 꼬숩다! 우유를 따로 블랜딩해서 쓰는 것 같았어요! 호랑이 커피의 밀도와 바디감을 갖고 있는데 달지 않았어요. 헷 그리고 Adhouse. 요기는 사실 그 전날도 다녀갔는데요! (전날은 망원>연남, 이날은 연남>홍대 의 루트로 엄청 싸돌아다님) 전날에는 빈티지샵만 엄청 돌아다니고 뭘 먹으러는 안가서 이날 포스팅에 잠시 끼워 넣어봅미댜... 헷 입구부터 정말 힙하죠! 빈티지샵 정말 좋아하는데, 근래 다녀온 곳 중에 가장 인상깊은 곳이에요. 영업시간 확인하고 가실게여 들어가면 엄청나게 큰 거울도 있어요. 거울 그냥 못 지나치져^^ 섹션이 크게 4군데? 정도 있는데 나 또 찍고싶은 것만 찍어왔네 아무튼 크고 빈티지샵 특유의 눅눅한 냄새가 아-예 안나요. 그리고 옷이 관리가 참 잘되어있더라고요!! 빈티지 입문용으로 방문하기 좋을 것 같아요. 왠지 거부감이 없어.. 하지만 저희는 망원에 독백을 가장 좋아해용.. 이날도 독백 다녀와서 돌아다니다가 오? 하고 빨려들어간 곳 ㅋㅋ 입구는 요로케 생겼어요. 저 까만 양반은 신경쓰지 않으셔도 됩니다.. 그리고 또보겠지 떡볶이도 다녀왔는데요! 원래 연남동 붕붕허니비점을 가려고 했는데요. 이날 휴무여서 산울림 소극장 쪽에 있는 스마일보이점으로 다녀왔어요. 또떡은 지점이름도 귀엽게 지어 증맬.. 디폴트져 뭐.. 즉떡 기본에 버터갈릭감자를 시켰어요. 사리 안시켜도 기본으로 충분히 들어가있어서 좋아요. 헷 그리구 마지막 K-디저트까지 뇸뇸뇸 맛있게 먹고 왔어요! 후 진짜 또떡 너무 맛있어. 또 먹고싶네 드릉드릉 양화대교 재생 0 좋아요 0  양화대교 버스타고 집에 가는길에 노을이 예뻐서.. 그리고 홍대 간김에 노티드 가서 도넛 가볍게 3개 사와봤어요^_^ 근래 부지런히 먹었더니 무려 4kg가 쪘드라고요? 당분간 블로그랑 멀어질지도 몰라요. 그럼 안녕.."
[마포 연남동 카페] ‘맥코이 연남’ 숲속 오두막 느낌의 연트럴파크 커피 맛집,"당직 끝난 아침 퇴근길, 잇츠워니의 내돈내산 커피투어는 계속된다. 이번에 방문한 곳은 맥코이 연남! 여기 또한 커피 맛집 전문가 친구의 추천으로 네이버 지도 즐겨찾기에 저장해두고는 평일 아침 출근길 차가 너무 많아서 도전하지 못했는데 주말 아침이라 한산해서 방문했다. 맥코이 연남 주소 : 서울 마포구 성미산로 147 (연남동 250-5번지) 영업시간 : 매일 09:00 - 21:00 주차장 : 없음, 인근 공영주차장 이용 대중교통 : 홍대입구역 3번 출구에서 도보로 10분 정도 소요 ※ 반려동물 동반 가능 50m © NAVER Corp. 맥코이 연남 서울특별시 마포구 성미산로 147 주말 아침, 문을 열지 않은 상점들이 많아서 성미산로 노상 주차장에 주차를 했다. 지정주차 자리이기 때문에 아마 상점들이 오픈하고 난 뒤에는 주차를 못 할 것 같다. 주변 공영주차장을 이용하거나 대중교통을 이용해야 할 듯. 뭔가 일본 교토 아라시야마에 놀러 갔을 때 느낌이 생각났다. 오두막 같기도 하고 작은 산장 같기도 한 나무 익스테리어. 따뜻하면서도 초록 초록 자연친화적인 느낌의 카페, 맥코이 연남. 바구니 달린 자전거와 오크통이 포인트. 맥코이 연남 메뉴판. 오호 칵테일도 있네? 디저트류는 티라미슈 네 종류가 있었다. 맥코이 커피가 시그니처 같아서 주문하고, 에스프레소도 궁금해서 콘판나 한 잔도 시켰다. 필터 커피 메뉴판도 따로 있었다. 커피 메뉴는 나름 가격이 괜찮았는데, 에스프레소는 다른 에소바보다 가격이 천 원 정도 비싼 것 같기도 했다. 다른 에소바는 자리가 불편하거나 협소한데 여기는 그만큼 자릿값도 포함일 테니까?(갑자기 너그러운 나.) 그래도 맛은 보장! 오픈형 주방(?) 산장 느낌의 인테리어. 처음엔 감성을 위해 잡지를 붙인 건가? 했는데, 맥코이 커피 관련 잡지 내용이 벽에 붙어 있다. 뭔가 저렇게 누가 내 가게를 인터뷰해주고 글로 담아준다면 너무 뿌듯할 것 같다. 사장님 저도 적고 있어요, 혹쉬 맥코이 연남 카페를 방문했던 블로거들의 포스팅을 보며 행복하신가요? 뭔가 레트로한 세이코 시계. 6일 일요일, 아침 9시 15분. 맥코이 연남 오픈 시간이 오전 9시인데 거의 오픈하고 바로 갔네. 호호, 부지런해보이쥬? 오른쪽은 나무 벽에 붙어 있는 따뜻한 느낌의 조명. 어두운 맥코이 연남 카페 실내를 따스한 색의 조명들이 아늑하게 밝혀주고 있다. 낡은 소파. 왠지 통기타 잘 치는 사람 자리 일 것 같다. 어두운 카페 실내에 들어오는 맑은 햇빛이 따스하고 기분 좋다. 빛과 어둠의 대비 좋아하는 편. 마샬 스피커로 클래식 재즈가 흘러나오고 있었고, 가운데에는 큰 테이블이 하나 놓여있다. 테이블 가운데에는 마실 물이 주전자에 세팅되어 있다. 콘판나와 맥코이 커피. 맥코이 커피 달달쌉쌀 존맛탱! 원샷각! (๑❛ڡ❛๑) 콘판나는 넘 깔끔 귀염 비주얼, 맛도 좋당. 호로록 마시면 하얀 휘핑크림이 호로록 이동함. 조로코롬 입고 갔다는 사진과 손잡이에 종이 달려있다는 사진. 다 마시고 나가면서 한 번 더 외부 포인트들을 사진으로 담아봤다. 한 시간도 안 머물렀지만, 머무른 잠깐의 시간 동안 잔잔히 흐르는 노래와 따뜻하고 아늑한 인테리어, 맛난 커피로 충분히 힐링 되었다. 마포 연남동 카페 맥코이 연남 재생 0 좋아요 0 00:00 00:00  접기/펴기 마포 연남동 카페 맥코이 연남 마포 홍대 연남동 맥코이 연남 카페 후기 끝!"
연남동/ 홍대입구 카페 :: 맥코이 연남 McCOY'S,"McCOY'S 맥코이 연남 서울 마포구 성미산로 147 매일 09:00 - 21:00 070-8648-2210 맥코이 인스타그램 @mccoys_coffee 홍대입구역 3번출구에서 도보로 11분거리에 위치한 홍대 연남동 카페 맥코이 연남 ! 맥코이는 연남, 한남, 신사, 성수 지점이 네 곳이다 맥코이 인스타그램을 들어갔더니 이렇게 네 개의 지점 외관 사진만 딱 3장 있는 정말 심플함 ㅋㅋㅋㅋㅋㅋㅋㅋㅋ 이런 계정은 처음봐서 정말 신박했다 지점마다 외관도 다 특색있게 달라서 외관 구경하는 재미가 있었넴,, 깊은 산 속의 오두막 같은 외관의 연남동 카페 맥코이 연남 내부도 오두막처럼 생겼다 분명 대낮에 들어온건데 해질녘에 방문한 것 처럼 카페 내부는 약간 어두운 편 어둡다고해서 그게 너무 인위적으로 어두침침한건 아니고 분위기 있게 무드가 다른 느낌이었다 연남동 카페 맥코이 메뉴판 맥코이 커피 (6,000원) 주문 야외 테라스 석도 있었는데 더 추워지기 전에 저기 밖에 앉는 것도 좋을 것 같다 근데 단점은 바로 인도랑 붙어 있어서 모든 사람들의 관심을 받을 수도.. 워낙 많은 손님이 있는데다가 매장 내부는 협소한 편이라 전체적인 사진을 담을 수가 없었다 그치만 마음에 들었던 맥코이 연남 근데 손님들이 다덜 힙하셨다 나만 그냥 일반인1 됨.. ㅋㅋㅋㅋㅋㅋㅋ 둘이서 와서 둘 다 똑같이 맥코이커피 주문하기 ㅎㅎㅎㅎㅎ 사실 딱 비주얼만 봐도 맛이 상상가는 맛이었는데 딱 그냥 맛있는 맛 근데 굉장히 달아서 찔끔찔끔 마셨다 조금씩 빈 자리가 나서 찍어본 사진 헐 시진 보니까 머신이 두 대나 있네? 뭐지 두 대나 사용하시는 건가? 싱기방기.. 문 창문으로 보이는 풍경 덕에 더욱 더 산 속의 오두막 같은 느낌 ㅎㅎ 잔잔한 분위기의 연남동 카페, 맥코이 커피 연남 브이로그 많관부 드립니다,,, 🥹 50m © NAVER Corp. 맥코이 연남 서울특별시 마포구 성미산로 147 #마포카페 #마포데이트 #연남동카페 #연남카페 #연남동데이트 #홍대입구카페 #홍대카페 #홍대데이트 #맥코이 #맥코이연남 #McCOYS"
홍대 연남동 조용한 카페 ㅣ 인생커피 ㅣ 맥코이 연남,"단골 카페가 없어졌다면 기운내서 다시 찾아보자 연남동 참 좋아하는데 익숙한 가게가 어느새 사라지고 갑자기 새로운 가게가 생기는 게 연남동을 갈 때마다 체감이 될 정도로 변화가 많고 빨라요 흥망성쇠가 눈에 훤히 보여서 그만큼 사람들도 많으니 주말에 붐비는 시간대면 밥집도 카페도 가기 너무 힘들거든요 그래서 저도 갈 곳을 검색할 때 조용한 고요한 가오픈 등을 꼭 넣어서 검색합니다ㅋㅋㅋㅋ 그사람 적고 웨이팅 없는 곳으로 가기위해! 맥코이 연남 50m © NAVER Corp. 맥코이 연남 서울특별시 마포구 성미산로 147 - 영업시간 9:00 ~ 21:00 - 휴무없음 - 주차공간 별도 없음 - 칵테일 주류 주문가능 ☎️ 070-8648-2210 커피가 맛있는 곳을 찾아보니 가장 많이 뜨는 곳이었습니다 알고보니 서울 여러 동네에 있는 카페였어요 한남 성수 신사 최근에 생긴 연남까지 총 네군데 지점이 있는 카페! 간판이 따로 없어서 한번 지나쳤다가 자전거를 보고 여기구나 했습니다 자그만한 규모라서 조용하고 고즈넉한 분위기었는데 조명 자체도 어둡고 최소한이라 더 잔잔한 느낌이었습니다 긴 원테이블이 중앙에 놓여있고 창가와 벽쪽에 2인 좌석이 총 4자리 정도와 유일한 소파자리까지 공간에 비해 깨알같이 야무지게 마련되있는 좌석들이었어요 밖에 긴 나무벤치가 있었는데 여기서 커피를 마셔도 관계없어보였습니다 오픈형 카운터에 커피 내리는 곳 커피향이 가득히 퍼지고 눈에 카페로서 필요한 것들만 들어오니 눈과 마음이 편안한 느낌이었습니다 사장님과 직원분들도 다 조용하셔서 우리가 제일 시끄러운 듯했어요,, 소곤소근 대화했습니다ㅋㅋㅋㅋ 사실 배가 조오금 고파서 커피에 베이글 먹으려고 갔는데 베이글을 더 이상 안한다는 충격적 사실,, 티라미수와 같은 디저트말고 베이커리가 먹고싶어서 티라미수는 패스하고 커피만 시켰어요 메뉴만 봐도 커피에 진심인 게 느껴졌구요 논커피 메뉴도 제 취향이었습니다 카페인 노약자는 에스프레소 도전하려다 기꺼이 참았습니다 맥코이 커피 6,000원 일단 컵이 너무 아담하고 이뻐서 사진 마구 찍었습니다 무언가 추억과 향수를 불러일으키는 반투명 갈색인 컵의 컬러와 빈티지하게 새겨진 로고 거기에 시작된 년도까지 2020년이면 4살이구나? 어머 우리 누누랑 동갑이네 (팔불출 이모) 테이크아웃 컵도 이뻤어요 여러잔 먹고싶었던 거 안 비밀 근데 하찮게도 이미 심장이 마구 뛰었습니다 위에 크림이 너무 달지 않고 기름맛이 나는 생크림이 아니라 엄청나게 부드럽고 커피와 잘 섞이는 고소한 느낌의 적당한 무게의 크림이었어요 커피맛도 카페인 노약자가 먹기에 쓰지않고 하루에 커피 할당량이 한잔이다보니 최고로 맛있는 커피로 먹어야하거든요 그런 제가 선택한 커피맛집일 정도,, 한모금할 때마다 감탄하면서 마셨어요 단맛 쓴맛 고소한맛 커피맛 등이 모든 게 과하지도 부족하지도 않은 맛! 여러 지점이 있어서 좋은 점은 꼭 한 곳을 찾아가지않아도 여러 동네를 갈 때마다 해당 카페가 있는 곳이라면 인생커피를 맛볼 수 있다는 것 라떼 추가로 시켰습니다 카페라떼 5,000원 커피맛집이면 커피메뉴 중 뭘 시켜도 맛있나봅니다,, 그리고 공통적으로 느끼는 게 비율이 기가 막히다는 겁니다 크림과 샷의 비율이라던가 우유와 샷의 비율이 최고의 비율로 제조되니 모든 맛이 조화로울 수 밖에요! 연남동에 자주 가던 곳의 사장님이 바뀌어 그 곳 특유의 감성이나 맛이 변해서 연남동 카페 떠돌이었는데 맥코이로 정착하려고합니다 이제 새로운 곳보다는 익숙하게 발걸음이 향하는 곳이 좋아요"
홍대 연남동 카페 맥코이 연남,"50m © NAVER Corp. 맥코이 연남 서울특별시 마포구 성미산로 147 맥코이 연남 서울 마포구 성미산로 147 영업시간 매일 9:00 - 21:00 전화번호 070-8648-2210 간판은 따로 없지만 그냥 지나갈 순 없을 것 같은 평범하게 들어선 건물들 사이로 눈에 띄는 카페! 숲속에 분위기 있는 산장에 온 것 같은 기분을 느끼게 해주는 외관이다 처서도 지났다고 하는데 왜 이렇게 더운 건지 그래서 야외 좌석도 탐났지만 아직은 무리.. 근데 이제 곧 진짜 테라스의 계절이 올테니 그때 이 자리를 노려보고 싶다! 내부 사장님들 스타일이 굉장히 멋지셨는데 바버샵에서 일할 것 같이 힙하다고 해야 할까 여기 인테리어 그대로 바버샵으로 만들었어도 잘 어울렸겠다는 생각이 들었다ㅋㅋ 원테이블과 단독 테이블이 4개 있는 협소한 공간 단독 테이블은 당연히 만석이었고 특히 창가 옆 테이블은 다들 탐내하는 것 같았다 주말 오후였기 때문에 빈자리만 있어도 감사한 상황 다행히 웨이팅은 안했다ㅎㅎ 짙은 벽과 곳곳에 있는 아이템들마저 진짜 산장스러운 느낌..! 메뉴 다른 카페와 다른 점이 있다면 에스프레소 전문점만큼이나 종류가 다양하다는 것! 디저트는 티라미수가 주력인 듯했는데 나 왜 디저트 안 시켰냐...ㅠㅠ 주문메뉴 맥코이커피 ₩6,000 메뉴판에 이것만 별 표시가 되어있길래 무슨 커피냐고 여쭤봤는데 카페라떼에 카라멜 크림을 올린 커피라고 한다 그냥 크림도 아니고 카라멜 크림이라는데 어떻게 안 시켜요..? 찾아보니 이 메뉴를 거의 필수로 마시더라ㅎㅎ 카라멜 크림이 진한데도 커피 맛을 해치지 않고 잘 어우러진다 크림 커피 좋아하는 분들이라면 무조건 좋아할 맛! 총평 - 연남을 제외하고 한남, 신사, 성수에 매장이 있는데 다른 지점은 어떨지 방문해 보고 싶어지는 멋드러진 분위기 - 힙하면서 커피도 맛있는 연남동 핫플"
연남동 카페 연남 맥코이 커피 맛집 이네,"맥코이 연남 연남동카페 내가 사랑하는 동네 연남동 연남동카페 맛집들을 찾아보면 좋은 곳이 너무나 많아서 갈 때마다 도장깨기 하듯 새로운 곳을 다녀보지만 아직도 못가본 좋은 곳들이 너무 많다. 이번에는 전부터 한 번 가봐야지 하고 눈여겨봤었던 연남동커피맛집 한 곳을 소개해보려고 한다. 아마 이 동네 많이 다녀본 분들은 다 가보지 않았을까? 생각되는 그런 곳. 바로 맥코이 연남 이다 :) 다른 분들이 다녀와서 찍은 사진들 보면 엄청 초록 초록 하고 멋있던데 내 사진은 을씨년스럽기 그지 없네! 겨울에 가면 외관이 이렇습니다. 연남동카페 맥코이 연남 영업시간은 아침 9시부터 밤 9시까지. 비교적 이른 시간부터 영업을 시작해서 아침 시간 커피를 원했던 분들에게는 너무나 좋을 것 같다. 밖에서 봤을 때도 작아보였는데 역시나 내부도 작았다. 공간이 작기 때문에 타이밍 못 맞추면 안에서 먹지 못하고 대기를 해야할 것 같았지만 역시 평일 버프 받아서 편하게 앉았다 :) 근데 여유있던 공간도 잠시였고, 손님들이 끊임없이 오더라! 진짜 인기 많은 연남동커피맛집 이다.👍 들어오면 보이는 큰 테이블이 괜찮길래 이 쪽에 앉았다. 튼튼한 나무 테이블 넘 멋져부러! 테이블 위에는 소품도 있었고 물과 컵도 있었다. 물이 필요한 분들은 여기로~ 분위기 있던 외관 덕분에 내부 역시 궁금했었는데 오오! 들어오자마자 느낀 건 어? 🌳 숲 속 산장 같다! 진짜 어디 산장에 온 것 같은 느낌? 그 어느 곳보다도 더더더 찐이었던 우드 인테리어. 이런 곳에서 마시는 커피라니! ㅋㅋㅋ 너무 짜릿해!😆 이 자리는 따로 앉지는 않았으나 분위기 있고요! 세월의 흔적을 고스란히 담고 있는 소파가 참 인상적이었다........!! 나도 겨울에 방문한거였지만, 다가오는 겨울 연남동카페 맥코이 연남은 꼭 가야하지 않을까! 특히 눈오는 겨울날 저 창밖으로 내리는 눈을 감상하면서 맥코이커피 한 잔 한다면? 우와..... 진짜 대박이야. 상상하다보니까 너무 좋을 것 같아서.. 나도 다음에 눈 오는 날 시간 잘 맞춰서 한 번 방문을 해봐야할 것 같다. 대박 아닙니까? 난로까지 있었다구요! 이 때 작동은 하지 않았던 것 같긴한데.. 그냥 그 자리에 있어주는 것만으로도 난로 너는 너의 역할을 다 했다. 연남동카페 맥코이 연남 메뉴판 ✨ 에스프레소부터 필터커피까지! 다양한 커피를 맛볼 수 있는 연남동커피맛집 ! 무얼 먹을까 하다가 시그니처인 맥코이커피 마시기로. 디저트도 있긴 있었는데 많지는 않았다. 휘낭시에와 티라미수2가지가 전부. 근데 후기 보니까 다 맛있다고 하더라. 디저트는 따로 주문하지 않고 커피만 마셨는데 사진 보니까 먹어보고 싶네. 분명 맛있을거야. 여기 사장님인지는 모르겠지만 아주 나이스하셨던 바리스타님! 이분 한분이 모든 걸 하기 때문에 조금 기다려야함. 아주 긴 기다림은 아니었지만 혹시 빠르게 커피가 나오길 원한다면 이 부분 미리 알아두면 좋을 것 같다. 그리고 내가 마셨던 맥코이커피 와우..... 너무 맛나. 카라멜 크림이 올라간 커피인데 크림 자체도 너무 맛있고 ~ 달달하게 먹을 수 있는 커피라서 더 좋았다. 근래 먹었던 커피 중 가장 맛있게 먹은 커피가 아닐런지. 진짜 나만 마시기 아까운? 다들 드셔보세욧!!!!!!! 연남동카페 검색해보면 진짜 좋은 곳 예쁜 곳 많이 나온다. 여기는 예쁘면서 커피 맛도 좋은 연남동커피맛집 ! 진짜 눈 올때 또 가고싶다ㅎㅎㅎㅎ + 아, 그리고 이쪽이 멀어서 못오는 분들은 한남점도 있다고 하니 그 쪽으로 가보는 것도 좋을 것 같다! 맥코이 연남 ▪️ 영업시간 09:00 - 21:00 ▪️ 근처 공영주차장/유료주차장 이용해야함 50m © NAVER Corp. 맥코이 연남 서울특별시 마포구 성미산로 147 #연남동카페 #연남카페 #연남동커피맛집 #연남동맥코이 #연남맥코이 #맥코이연남 #맥코이 #맥코이커피 #연남동맥코이커피 #연남맥코이커피"
