title,content
[서울] 카페테틈(CAFE TETEUM) | 연남동 소품샵 | 마포구 소품샵,"카페테틈 CAFE TETEUM 📌주소:서울 마포구 동교로36길 15 1-2층 ⏰️영업시간:화~일_12:00~20:00 정기 휴무_매주 월요일 🚗주차:골목 주차 연남동에 간 김에 갔다 온 카페테틈 골목에 카페테틈이 있어서 길을 찾기가 좀 어려웠지만, 건물 벽에 있는 포스터를 보고 찾았다. 1층에서는 카페 주문을 받고 테틈 소품샵이 있고, 2층에는 카페가 있다. 카페에 가고 싶은 사람들은 1층에서 메뉴를 주문하고 2층으로 올라가야 한다. 그리고 사진에는 없지만 2층으로 가는 길에 테틈 배경의 네 컷 사진을 찍을 수 있는 부스도 있다. 들어가는 문도 동글동글하고 귀엽다. 들어가는 문 옆에 엄청 큰 테틈이 앉아있는데 거기가 포토존이었다. (나는 뒤의 일정 때문에 찍을 수 없었지만...) 창가 쪽에는 스티커들이 진열되어 있었다. 기존 스티커 외에 새로 나온 스티커들도 같이 진열되어 있었다. 벽 쪽에는 공책, 핸드폰 케이스, 컵, 노트북 케이스 등이 진열되어 있었고 반대편에는 다이어리, 뽀글이 파우치 메모지, 새로 나온 인형이 진열되어 있었다. 크록스의 지비츠로 사용할 수 있는 참도 있고 사이즈가 좀 더 큰 스티커들도 있었다. 키링은 가격이 저렴하고, 내가 원하는 모양들을 골라서 키링을 만들 수 있었다. 키링 위쪽에는 그립톡들도 있었다. 진짜 다양한 상품들이 많았고, 테틈과 관련된 모든 것을 사고 싶을 정도였다. 이번에는 시간이 맞지 않아서 카페는 못 갔지만, 다음번에 재방문하게 된다면 카페도 가보고 싶었다. 테틈에서 구매한 상품 #국내여행 #후기 #국내여행후기 #서울여행 #서울여행후기 #서울여행추천 #서울여행코스 #서울가볼만한곳 #서울소품샵 #연남동소품샵 #테틈 #카페테틈 #연남동테틈 #테틈후기 #연남동테틈후기 #소품샵 #CAFETETEUM #TETEUM"
"[연남] 연남동 카페, 카페테틈","참 신기한 mz식 카페 이렇게 나와주는 곳은 카페테틈이라고 합니다. 카페테틈 서울특별시 마포구 동교로36길 15 1-2층 하나는 목욕 중인 곰돌이, 하나는 직접 목욕을 시켜야 하는 곰돌이다. 아주 귀엽고 웃기고 하찮은 쿠키 곰돌이의 샤워시간 곰돌이의 최후 .. 참 재미있었다."
"연남동 캐릭터 카페 소품샵 , 카페테틈","연남동 캐릭터 카페 소품샵 , 카페테틈 #연남동캐릭터카페 #연남동소품샵 #카페테틈 에 방문했습니다 :) 카페테틈은 1층은 소품샵 2층은 카페로 운영되고 있어요! 귀여운 소품들이 가득한 #연남동소품샵 #연남동카페테틈 아이패드케이스 아이폰케이스 카페테틈 유리컵,머그컵 ,필통,파우치 등등 다양한 종류의 소품들을 판매하고 있어요!! #연남동선물 사러가기도 좋은 곳 같아요 >< 귀여운 #카페테틈 스티커 배달의민족 느낌의 카페테틈 스티커 왜이렇게 귀엽냐구여 ㅋㅋㅋ #연남동소품샵구경 하러 가기 좋은 곳이니까 고고하세요 ㅎㅎㅎ 저는 소품샵도 구경하고 카페테틈의 카페도 이용해보았습니다 >,< ㅎㅎㅎ 카페테틈 가격 및 메뉴판 아이스아메리카노와 자몽에이드 그리고 초코컵케이크 주문했어요 :) 귀여운 카페테틈의 베베종이컵 ㅎㅎ #연남동디저트 #연남동귀여운카페 카페테틈 디저트 종류! 참고하세요 ㅎㅎ 하나하나 너무 귀여운 ㅋㅋ 귀여운 컵케이크들 !! 귀여우니까 안먹을 수 없다며 ㅋㅋㅋㅋ 카페테틈 2층으로 올라갔습니다 ㅎㅎ 테이블은 7-8개?정도 있었던 것 같아요! 평일 저녁에 갔는데 사람들이 많더라구요 ㅠㅠ 거울셀카존도 있구 ㅋㅋㅋ ㅎㅎ 주문한 메뉴 나왔습니다 :) 연남동 카페 카페테틈 초코컵케이크/ 아이스아메리카노 자몽에이드 ♡ 초코컵케이크 위에 베베쿠키 너무 귀여운거 아니냐며 >< 항공샷도 찍어주고요 ㅎㅎㅎ 아메리카노 위에 귀여운 샷얼음ㅎㅎㅎ 먹으면서도 연해지지 않아서 좋았습니다! ㅎㅎ 같이 간 동생이 구매한 카페테틈 핸드폰케이스!!! 넘 귀여운거 아니냐며 >< 키링은 제 가방에 달아두었습니당 ㅎㅎ 연남동 귀여운 카페 / 연남동 캐릭터 카페를 찾으신다면, 연남동 카페테틈 추천해드려요!! 카페테틈 서울특별시 마포구 동교로36길 15 1-2층 연남동 카페테틈 위치는 지도 참고해주세요 :)"
연남동카페 / 연남동소품샵 : 카페테틈,"카페테틈 서울특별시 마포구 동교로36길 15 1-2층 카페테틈 @cafe.teteum 영업시간 화-일 12:00 - 20:00 (매주 월요일 휴무) #카페테틈 #테틈 #테틈카페 #연남동테틈 #연남동카페테틈 #연남동테틈카페 #연남동카페 #연남동맛집 #연남동소품샵 평소에 내가 귀여워하는 곰돌이 테틈 🧸 연남동에 카페 겸 오프라인 스토어가 있다니 가봐야죠 !! 바쁘지만 할건 다하는편 ㅎ 골목길에 있어서 사진찍기 너무 위험하지만 안찍을순 x,, 테틈 글씨체 마저 귀여워 ,,,, 짱큰테틈 움직일것만 같아서 너무 귀엽다 ,,, 들어가면 감성 돋는 포토존도 있는데 몰골이 말이 아니라 잘 가려봤어요 ,, 감쪽같죠 다사고싶어 ㅠㅠㅠㅠㅠㅠ 그저 안경 삐뚤어진 곰돌인데 왜이렇게 귀엽지 아린이가 예전에 생일 선물로 사준 테틈 파우치 그때부터였나요 ,, 테틈한테 눈이간게 ,,,,, 다이어리도 있네 ,,? 2023년은 너구나 스티커도 수첩도 필통도 다 하나씩 집어오고싶지만 참아야지 나는 어른이니까 ,,,,,,, 보니까 #테틈페리페라 콜라보한 제품들도 있어서 신기했다 귤쓴 테틈,,,, 그건 반칙이지 음료 주문했는데 시간 없어서 테이크아웃,,,,,, 근데 코스터 너무 귀여워서 잠깐 사진찍으라고 빌려주심 ㅎㅎㅎ 다음에 오면 2층에서 꼭 먹고갈거야 ,,, 밀크티위에 누워있는 테틈 너무귀여웍 ㅠㅠㅠㅠㅠ 커피도 밀크티도 생각보다 너무 맛있어서 또와야되는 이유는 확실해 ,,, 담에 기분이 꾸리한날 귀여운거 보러가야지 ㅎㅎㅎ"
"[연남동 나들이] 서양면옥, 카페테틈, 아오이토리",오랜만에 친구와 아는 언니를 만났다ㅎㅎㅎ 친구와는 이주만 언니랑은 삼개월만 친구가 또 맛난 가게를 찾아주어서 룰루라랄 신나게 출동!! 약속시간보다 10분 빠르게 왔는데! 웨이팅이! 하지만 더 일찍 온 언니가 웨이팅 걸어줘서 2시에 바로 들어감 ㅎㅎ 이번에 온 가게는 서양면옥 개존맛탱!!!!!! 바질냉바스타 !!!!! 배추샐러드!!! 상큼한 쯔유소스? 느낌인데 끝맛이 마라맛같은 고추맛이 살짞 나는데 개존맛 ㄷ포크크림리조또 개존맛 보리알탱탱탱구리 연어오픈치즈토스트!!!! 냉파스타는 치즈를 찢어ㅓ 먹어야함 진짜 맛있음 아름답게 잘라준 모양 진짜 짱 맛있는 가게였음 또 오고싶음 단점은 오픈키친이라 입장했을때 업장안에 뿌연 음식 연기가 좀 신경쓰임! 하지만 맛이 모든것을 이겨냈다 #연남동찐맛집 #연남냉파스타 밥 먹었으니 이제 커피 마셔야지 바로 근처에 겁나 귀여운 카페가 있었다 앗 가기전에 고양이 샵 구경 강아지 샵은 왜 없는지?ㅠㅠㅠㅠ 애견인의 목소리도 들어달라.. 암튼 들어온 카페는 #카페테틈 여길 온 이유 겁나 귀여운 커피가 있다 갸악 귀여워!!!!!!!! 곰돌이 커피! 디자트도 귀엽다 널 먹어주리라 아 오더는 1층에서 햇다 1층엔 이런 귀여운 굿즈샵이.. 정신 안차리면 지갑털림 후후 아름다운 샷 초코머핀도 농후하고 맛낫다 그리고 집가기 전에 들린 #아오이토리 #홍대빵집 #야끼소바빵 여기 다닌지 한 10년 되는거같은데? 오랜만에 들렀더니 아직 그자리 그대로라 감동 메론빵 ㅎ 새우카츠버거 ㅎ 내가 오면 항상 사는 빵 두개~~~ 담날 아침으로 잘 먹었다 냠냔ㅁ구리 ㅋㅋㅋ 이건 신랑이 준 요술봉 밤에 데리러 왔는데 갑자기 꺼내줌 귀여워
"연남동 파스타 맛집 <더다이닝랩>, 귀여운 카페 <카페테틈>","더다이닝랩 평일 : 11:30~22:00 (라스트오더 21시) 주말 : 12:00~22:00 (라스트오더 20시30분) 브레이크타임 : 15:00~17:00 9월에 폭염주의보가 내려진 주말^_^...새벽에 비가 왔음에도 불구하고 엄청 더운 날이였다 친구랑 주말에 연남동에 가기로 했다 희희 파워J들 또 일주일 전에 카페랑 맛집 폭풍 검색함 네이버 예약을 통해 12시로 미리 예약해놨다 12시 조금 전에 도착했다 건물 앞에 메뉴판이 있었다 건물 통째로 식당인 줄 알았는데 2층은 다른데였다는 점..! 예약자 이름 확인 후 자리로 안내해주셨다 12시 좀 전에 도착한 터라 12시 되면 주문받기 시작한다고 말씀해주셨다 가게 내부사진이랑 메뉴판 사진 찍으면서 친구 기다라기!ㅎ 사진에는 안나왔지만 안쪽까지 자리가 있던거같았다 와인 메뉴도 있었는데 우리는 와인은 안마시니...그래서 사진도 안찍음ㅎㅅㅎ 나는 비프라구파스타, 친구는 봉골레 파스타를 시켰다 메뉴 나오기 전에 식전빵도 나왔다 빵이 은근 맛있었고 파스타도 양이 괜찮고 맛있었다 다 먹고 내가 카페 보냈던 리스트들 중에 카페테틈을 가기로 결정했다 지난번부터 가고싶었는데 사람이 많아서 계속 못갔었다ㅠ 카페테틈 영업시간 : 12:00~20:00 월요일 정기휴무 입구부터 귀여움에 장악당했다 으악 1층은 메뉴 주문하는 곳과 굿즈를 팔고있었다. 2층으로 가서 자리를 잡고 1층으로 다시 내려와서 굿즈 구경하고 메뉴를 주문했다 보통 메뉴를 주문하고 메뉴를 주문할텐데 응 아니구요~^^ 귀여운거에 미쳐서 구경부터 함 그치만 사진은 메뉴판 사진부터..! 인형, 노트북/아이패드 파우치, 스티커, 컵 등등 다양한 굿즈가 있었다. 진짜 너무 귀여워서 다 사고싶었지만 나는야 돈없는 직장인! 안그래도 회사에서 쓰는 마우스패드 바꿨어야했어서 친구랑 마우스패드 두개 들고 주문할 때 같이 결제했다 아이스 아메리카노와 메론소다 레몬컵케이크 시켰다 컵도 케이크도 귀여움 그 잡채...! ㅋㅋㅋㅋㅋㅋㅋㅋㅋㅋㅋㅋ커플로 사버린 마우스패드 작지만 귀여워서 용서되는 그것 우리는 밥을 일찍 먹어서 그런가 카페에 도착했을때 (12시 45분...쯤...?) 2팀밖에 없었다 그마저도 금방 나가시는...그래서 자리가 텅텅 비어있었다 맨날 여기 지나갈때 사람 많아서 못갔는데 일찍 왔어야했던거구나...! 1시 30분쯤 되니 만석이더라 카페테틈에 가고싶다면 점심시간을 노려서 가보는게 좋을듯하다 카페테틈 서울특별시 마포구 동교로36길 15 1-2층"
[연남동카페]카페테틈,내가 조아하는 테틈 카페는 이번에 첨 방문 22.6.11 또 가고싶다⭐️ 여러분 홍대가면 꼭 가보세효 입구 반대쪽에 스티커 사진기도 있음! 배경이쀼 펜케이크 넘 마시따 ㅠㅠ 플레이팅도 이쁘고 밀크티 맛있는게 찾기 쉽지 않은데 밀크티도 존맛 밀크티 얼린거라 녹아도 맛 유지 되고 마시땅 후딱 마시고 베베 얼음 포크로 파먹었는데 그것도 그거대로 맛있었음ㅋㅋㅋ 슬러쉬처럼 그냥 지나칠수 없쥬~ 파우치는 첫번째꺼 보유중 근데 딴것도 이뻐서 혹했음 선물용으로 마우스패드는 꾸준히 사는중ㅋㅋㅋ 이모티콘도 있어요~~~~~ 애용하는중>_< 마우스 패드는 종류가 세갠데 하나씩 사서 선물 물론 난 베베 카페테틈 서울특별시 마포구 동교로36길 15 1-2층 #테틈 #카페테틈 #연남동카페 #홍대카페 #연남동
[연남동 맛집] 커피가 이렇게 이렇게 귀여울 수 있을까_카페테틈,"연남동을 왔으면 예쁜 카페를 가는 게 진리! 맛도 챙기고 비주얼도 챙긴 카페를 찾아서 '카페테틈'을 방문했다 골목에 있는데 간판에는 'CAFE TETEUM'이라고 영어로 적혀있음 (아니 왜 외관 사진은 안 찍은거야ㅠㅠ) 들어가자마자 예쁜 소품들이 반겼다 쇼핑욕구 폭발ㅎㅎㅎ 1층에는 카페테틈의 캐릭터로 만든 파우치, 스티커, 볼펜 등등 다양한 소품들을 팔고 있다 커피랑 디저트도 여기서 주문할 수 있다 커피를 마실 수 있는 공간은 외부계단을 통해 2층으로 올라가야하는데 이게 좀 불편하다(최대 단점!) 1층에서 커피를 받아서 2층으로 올라갔다가 갈때는 다시 쟁반을 가지고 1층으로 내려와 반납해야한다 시그니처메뉴인 큐브연유라떼(베베 큐브라떼)가 제일 귀여워 보여서 이걸로 결정! 사실 이 메뉴만 곰돌이 큐브가 나오는 줄 알았는데 다른 사람들을 보니 다른 메뉴들도 큐브가 나오는 것 같다 (주문할 때 물어보고 시키면 좋을 듯!) 커피 기다리는 동안 큐브라떼 마시는 방법 정독하기 ㅋㅋㅋ 커피 하나 시켰는데 곰돌이가 든 유리잔과 우유, 연유까지 트레이 한 가득 나왔다ㅋㅋㅋ 점심먹고 온 거라 배가 불렀지만 황치즈와 앙버터 맛의 귀여운 쿠키도 하나씩 시켰다(귀여우니까^^) 시선강탈 귀여운 큐브 아니 이거 너무 귀여워서 어떻게 먹겠냐고ㅎㅎㅎ 우유를 이렇게 살살 부으면 곰돌이가 우유목욕을 하면서 녹는다 한번에 많이 부으면 곰돌이가 그냥 잠기고 큐브도 덜 녹아서 우유만 마시게 된다.. 연유까지 부어주면 달달한 큐브라떼 완성^^ ㅋㅋㅋㅋㅋㅋㅋㅋㅋ 목욕 즐기는 곰돌이 넘나 귀엽^^ 곰돌이는 이제 목욕이 아니라 커피물에 떠다니는 중ㅋㅋㅋㅋㅋ 비주얼도 맛있는데 커피맛도 좋았다 연유를 원하는만큼 조절할 수 있다는 점도 장점! 너무 단맛은 싫어하는 편인데 적당한 당도로 마실 수 있다 카페테틈은 인테리어가 예뻐서 셀카찍기에도 좋고 포토존도 여러곳있다 1층에는 이렇게 촬영할 수 있는 곳도 있고 옆에 커다란 곰돌이도 사진 같이 찍자고 앉아있다 ㅋㅋㅋ (사람이 많아서 따로 찍지는 못했다ㅠ) 소품샵에서 건져온 귀여운 아이들 커피마실 때 있었던 코스터가 너무 귀여웠는데 집에서도 즐길 수 있다니ㅎㅎㅎ 스티커도 몇장 사와서 친구들 나눠줬다 아쉬운 점은 곰돌이 큐브를 만들 수 있는 틀은 팔지 않았다는 거ㅠ 있었으면 분명히 사왔을 텐데...... 예쁜 카페인데 맛있는 커피, 디저트도 즐길 수 있는 곳으로 추천! 인생샷 남길 수 있는 곳으로도 추천! 스티커, 컵, 파우치 등등 귀여운 소품샵으로도 추천! 꿀팁! 2층에 자리부터 잡기 1층에서 주문하지만 카페에 사람이 많아서 자리가 없을 수도 있다 커피는 1층에서 픽업하고 반납도 1층에서 해야한다 유리잔 들고 계단 이용할 때 조심조심"
[홍대/연남동] 귀여운 카페테틈(밀크티/메론소다/라즈베리컵케이크/앙버터쿠키),"인터넷에서 테틈카페를 봤는데, 원래도 좋아하던 캐틱터 소품인 테틈!이 카페로도 있길래 오랜만에 연남동에 갔다. 몇 년 만에 간 듯,, 예전에는 자주 갔는데, 요즘에는 홍대까지 갈 힘이 없다.ꙩ_ꙩ 진짜 귀엽다아아ʕ·ᴥ·ʔ 포토존에서 사진 찍었당! 곰돌이 얼음이 들어간 밀크티가 제일 유명한 메뉴인 듯!! 배고파서 앙버터쿠키랑 라즈베리컵케이크까지 골랐다. 이미 가지고 있는 필통도 있었다! 문구류, 케이스, 그립톡, 슬리퍼, 파우치, 지비츠, 컵 등등 엄청 다양한 물건들이 있다. 지비츠 하나 고르고 뽑기로 고리 뽑았다. 귀여운 거 한가득˃ᴗ˂ 뽑기로 뽑은 고리들 먹을 수 있는 공간은 2층에 있다. 라즈베리컵케이크 앙버터 쿠키 생각보다 크고 버터랑 팥이 실하게 들어가 있다. 컵케이크보다 이게 더 맛있었다! 곰돌이 밀크티 티코스터도 졸귀탱! 뒤에는 메론소다~ 곰돌이 밀크에 있는 얼음은 모양도 귀엽지만 밀크티로 얼린 얼음이라 밀크티가 안 밍밍해져서 좋았다. 밀크티를 더 기대했는데, 맛은 메론소다가 더 맛있었다!ʕᵔᴥᵔʔ 모양때문에 다들 밀크티를 주문하겠지만,, 메론소다에 올라간 아이스크림도 맛있고 음료수도 짱맛이다! 고르고 골라서 이 지비츠로 골랐는데, 맘에 든다ღ˘⌣˘ღ 크록스 색이랑 잘 어울림!! #연남동카페 #홍대카페 #연남소품샵 #카페테틈 #카페테틈메뉴 #테틈지비츠"
"모든 게 완벽했던 연남동 데이트(초이다이닝, 카페테틈, 도토리 캐리커처, 니엘 실물영접, Are&am, 쇼핑)","올해 벚꽃 개화 시기는 4월 3일이라고 했는데 그 전주에 이미 만개해버렸다ㅠㅠ 매년 갈수록 벚꽃 개화시기가 빠르게 앞당겨지네 흐음,, 날씨도 좋길래 연남 데이트하러 갔지이- 230401 일상기록 시작! ❤️ 초이다이닝 이날의 점심은 #초이다이닝! 웨이팅 하기 싫어서 오픈 30분 전에 도착했는데 그래도 4번째 순서라니.. 역시 대한민국 사람들 부지런해 여기는 무조건 #연어후토마키 또 먹고 싶다.. 와구와구 #뼈돈가츠 평이 좋길래 기대했는데 그냥 일반 돈가스.. #마제소바 도 쏘쏘,, #딸기하이볼 은 비싸기만 하고 굳이,, 송파점에서 파스타 먹었는데 그건 넘 맛있어서 담에 여기 또 오게 되면 후토마키랑 파스타 시켜 먹어야겠다 🧡 카페테틈 점심 먹고 지나가다가 발견한 #카페테틈 ! 아기자기 귀여운 게 많아서 자꾸 하이톤이 나왔다 너무 귀여워~~~~~~! 내 맘에 쏙 드는 핸드폰케이스 발견해서 바로 카드 긁긁- 연남 소품샵 가볼만한곳 놀거리 데이트코스, 카페테틈 c a f e 🐻 연남 소품샵 카페 카페테틈 —INFO— • 운영시간 • 화-일 12:00-20:00 매주 월요일 휴... m.blog.naver.com 💛 도토리 캐리커쳐 소품샵 쇼핑하고 지나가는데 우연히 인스타에서 보던 #도토리캐리커쳐 발견! 너무 맘에 들어서 담에 또 올구야🥰 That's my jam! 연남동 이색데이트로 딱이야, 도토리 캐리커쳐 a t e l i e r 🎨 연남동 이색데이트코스 도토리 캐리커쳐 —INFO— • 운영시간 • 매일 12:00-21:0... blog.naver.com 💚 그믐달 셀프스튜디오 내가 갔던 셀프 사진관 중에 젤 맘에 들었던 곳 #그믐달셀프스튜디오 요즘 데이트하면 무조건 사진 찍는다 네컷앨범도 샀으니까 열심히 채워가야지💖 욕먹을 걸 알지만,, 노제스타일 노리고 쓴 거다ㅎ 뭔가 힙쟁이된 것 같은 기분😝 셀프스튜디오 마무리는 역시 거울샷 아입니꽈~ 카페 가는 길에 본 #니엘 #카피추 #신현희 최근에 놀면뭐하니에 틴탑 나온 거 봐서 그런지 넘 반가웠다 니엘은 실물이 훨 잘생겼다! 남자친구가 와 저렇게 생겨야 연예인 하는구나 하면서 감탄하니까 앞에 있던 스태프분이 엄청 웃으셨다ㅋㅋㅋㅋ 연예인 극한 직업 실감 수많은 눈동자가 바라보고 있는 상황에서 혼자 춤도 추고 빡세다,, 💙 Are&am (카페 알앤엠) 비주얼만 보고 찾아간 Are&am #알앤엠 당 충전하기에 딱이다 당 수치와 나의 행복 지수는 정비례 카페 분위기 무엇,, 인테리어 소품들로 잘 꾸며놨네에 신나서 사진 찍고 또 찍고ㅎ 인스타에 올려줘야 한다구요! 💜 쇼핑 벚꽃 사진 찍을 때 입을 옷이 없어서 쇼핑도 했다 쉬폰 롱 원피스만 찾아다녔다 열 군데도 넘게 돌아다닌 것 같다ㅋㅋㅋ 휴,, 분홍이 너로 정했다! 벚꽃 사진은 역시 분홍이지! 같이 쇼핑 다녀준 남자친구에게 감사 인사를 올립니다 총총,, 힘들었을 텐데 내색도 안 하고 고맙습니데이❣️ 룰루 행복하고 모든 게 완벽했던 연남동 데이트 끝!"
"[연남동] 덮밥집- 단디, 카페- 오르트(OORT), 카페테틈(TETEUM), 와인바- 디벨롭(DEVEROP)","맛있게 먹는법 ! 음식은 주문하자마자 거의 바로 나왔다 우리는 다 호르몬동을 먹었다 국은 좀 칼칼한 편이다 대창은 진짜 부드러움.. 먹다보면 느끼한 감이 있어서 칼칼한 국과 깍두기 조합이 좋음 양은 적어보였는데 먹다보면 배부름 카페는 청수당공명, 멜팅오브 갔었는데 둘다 웨이팅 있어서 오르트(OORT) 로 갔다 전체적인 분위기와 메뉴판 3층과 4층으로 나눠져있다 그릭피치 -안에 요거트가 들어가있음 -복숭아는 딱복 -사실 예상할수있는 맛,, 내 친구는 집에서 만들어 먹어봤다고함 애플망고소다 -안에 아이스크림 들어가있음 -애플망고 적절히 섞여있음. 씹히는 맛이 맛있음 구름 받침대 귀여움 가다가 귀여워보여서 들른곳 카페테틈 1층은 소품샵 2층은 카페로 운영된다 귀여운거 한가득 친구가 키링 뽑기도 했다 가격은 2000원 카운터에서 동전으로 바꾸고 해봅니다 넘귀여운 친구가 나왔다 😆😆 칵테일 피치크러쉬, 김렛 을 시켰다 김렛은 처음 먹어봤는데 알콜맛이 확 올라와서 놀람 (물론 내가 달달한걸 좋아해서 그런걸수도.. 나는 그냥 피치크러쉬나 마셔야겠다) 뇨끼 멜론 프로슈토 -이거 넘맛있 분위기, 음악 맛집 가격과 양은 아쉽"
[일상로그] 연남동 데이트코스 : 무겐스위치 라멘맛집+카페테틈 소품샵/빠다너스 포토이즘박스/카페데코믹스홍대점 고양이만화카페 귀멸의칼날,"직장인의 휴일 알차게 보내기 시작 -! 먼저 연남동에서 만난다. 점심부터 먹기 위해 #무젠스위치 앞에서 만난다. 센스있게 먼저 온 사람이 웨이팅 걸기❤️ 무겐스위치 서울특별시 마포구 동교로 242-13 무젠스위치 연남 가장 깔끔한 라멘집인 듯 이전한 지 얼마 안돼서 깔끔하다 맛도 깔끔 혹쉬 웨이팅 있다구요? 그럼.. 카페테틈 서울특별시 마포구 동교로36길 15 1-2층 카페테틈 그 바로 옆 소품샵 구경을 해야한다. 제주점 연남점 단 2곳 ! 카페도 운영 중이다 라멘 먹고 후식으로도 괜찮을 듯 스티커나 각종 굿즈들이 판매 중이니 귀여운 거 좋아하는 여자친구는 좋아할 코스🧚🏻‍♂️ 다시 돌아온 무겐스위치 라멘 종류는 2개. 매운 거 돈코츠 라멘 사이좋게 나눠드시길 라멘으로는 아쉬우니 가라아게도 뇸 튀김이 얇고 후추후추 양념이라 든든한 한 끼 끝! 포토이즘 박스 연남점 서울특별시 마포구 동교로 230 빠다너스 상훈님 프레임 찍어봐야 한다며 휴일에 웨이팅하면서 찍었다... 무려 7000원 아깝지 않아서 다른 프레임으로 2번 찍었다 실로 보니 넘 귀엽 사진 엄청 잘나온다 프레임에 맞춰 찍는 것도 신선한 유잼 아쥬 맘에 들군〰️ 카페데코믹스 홍대점 서울특별시 마포구 어울마당로 96 3층 귀칼보러 만화카페 왔다 외국인도 있는 고양이 만화카페였다 개인적으로 한 번 이용으로 만족,,, 이번 귀칼 영화 대아쉽 3기 1화만 공개하고 얼른 2화부터 공개해라..!! 일본에 고양이료칸도 있던데 홍대엔 고양이만화카페 캣타워까지 1층을 이용해야 냥이들이 와서 빵구워준다 카운터 쪽이 아주 명당 음료는 좀 특이한 맛이다 아아만 시키는 것으로 그럼 이만 총=33 마지막으로 방문했던 스파 소개는 따로 해보겠다 😶‍🌫️ 모두 휴일 알차게 잘 보내시길 바라면서 오늘도 읽어주셔서 감사해요"
