title,content
"썸모어델리, 연남동 테라스 있는 브런치 맛집 강추 !","안녕하세요 ! 골드레인이에요! 제가 원래 한번 가본 곳은 잘 안가는 편인데요. 올 해 몇개월 사이 3번이나 방문한 브런치 카페가 있어서 소개해드리려고 합니다 : ) 연남동카페 연남동브런치 연남동테라스 썸모어델리 1. 썸모어델리 연남동 @출처 - 썸모어델리 공식 인스타그램 https://www.instagram.com/somemore.deli/ 썸모어델리 | 연남동카페 | 브런치 | 커피 | 와인(@somemore.deli) • Instagram 사진 및 동영상 팔로워 1,679명, 팔로잉 6명, 게시물 586개 - 썸모어델리 | 연남동카페 | 브런치 | 커피 | 와인(@somemore.deli)님의 Instagram 사진 및 동영상 보기 www.instagram.com 연남동에 위치한 테라스 브런치카페 썸모어델리! 다른 곳에서도 썸모어라는 이름으로 카페 등을 운영하는 사장님이 연남동에 세번째로 오픈한 매장이에요 ! 델리라는 이름을 붙여 접근하기 쉽고, 포장이 용이한 식사 메뉴가 많이 준비되어 있어요. 테라스가 있고 애견동반이 가능해서 애견인들이 많이 찾는 곳입니다 : ) 썸모어델리 서울특별시 마포구 동교로51길 131 1층 연남동카페 썸모어델리는 연트럴파크의 끝에 위치해 있어요!! 연남동을 산책하면서 걸어 내려오다보면 끝자락에 작은 벽돌 카페를 발견하실 수 있어요 : ) 썸모어델리 서울특별시 마포구 동교로 51길 131 1층 화수일 11:00 - 19:00 목금토 11:00 - 21:00 매주 월요일 정기휴무 화수일, 목금토 마감시간이 다르기 때문에 오후에 방문하시는 분들은 마감시간 꼭 확인하고 가세요! 매주 월요일은 정기휴무입니다 : ) 공휴일에 따라서 가끔 휴무일이 바뀔수도 있으니 인스타그램에서 공지사항 확인하고 가시는 것을 추천드립니다 ! 2. 외관 및 인테리어 연남동브런치 썸모어델리! 붉은색 벽돌로 되어 있는 작은 건물에 썸모어델리라는 간판이 붙어 있어요~ 안에 좌석은 10석 내외이고 건물 옆을 둘러싸고 테라스가 있는데요. 테라스 석도 10석 내외? 정도 되는듯해요. 자리가 협소하기 때문에 다인원이 가는것보다 2-3명 정도 함께하기에 딱 적당해요 ! 나무색 벽돌로 꾸며진 정갈한 공간에 자그마한 테라스가 있어요! 요즘 같은 날씨에 햇살받으며 브런치 즐기기에 좋습니다~ 3. 메뉴 연남동브런치 썸모러델리! 메뉴판이에요. 메뉴판 색도 넘넘 이쁘고 감성적이에요~ 스프, 토스트, 라자냐 등의 메뉴가 있고 계절마다 바뀌는 디저트류도 있어요. 전 개인적으로 후무스를 제일 좋아 했는데 얼마 전에 가니 후무스는 없어졌더라구요ㅠㅠ 비프후무스 16,000원 연남동브런치 썸모어델리에서 제가 제일 좋아한 메뉴에요! 시즌성이라 언제 돌아올런지는 모르겠지만, 최근 갔을땐 없어져있었어요ㅜㅠ 진짜 먹어본 후무스 중 손에 꼽힐만큼 넘넘 맛있었는데..! 혹시나 다시 메뉴에 생긴다면 정말 꼭 드셔보세요~ 강력 추천입니다 ㅎㅎ 로스티드 머쉬룸 14,000원 올리브오일에 구운 버섯과 크림치즈가 굉장히 잘 어울리는 메뉴에요! 따끈하게 준비되어서 같이 나오는 빵이랑 같이 먹으면 정말 꾸울맛입니다. 낮이여서 커피와 함께 먹었지만, 저녁에 와인과 함께 하기에도 정말 좋을 것 같더라구요 : ) 근데 계속 먹으면 혀가 미끄덩해서 조금 느끼할수도 있어요. 그래서 라자냐 같이 조큼 매콤한 맛이 가미된 메뉴와 함께하시길 추천해요 ㅎㅎ 4. 요약 연남동 브런치 썸모어델리!! 코지한 분위기의 인테리어에 맛있는 브런치를 즐기기에 너무 좋은 곳이에요. 연남동 주민으로 근처 브런치 카페 여기저기 많이 가봤지만, 썸모어델리가 손에 꼽을 만큼 맛있는것같아요. 강추입니다 : ) 꼭 들려보세요 ~~!! *공감,댓글,서이추는 힘이 됩니다 :) *본 포스팅은 내돈내산, 솔직후기 입니다 #연남동브런치 #연남동브런치카페 #연남동카페 #연남동카페추천 #연남동맛집 #연남동빵집 #연남동데이트 #연남동모임"
"[맛집] 기름진 브런치, 연남동 썸모어델리","썸모어델리 서울특별시 마포구 동교로51길 131 1층 서울살이의 대부분을 차지한 신촌 일대. 특히 애경 백화점 맞은편 연트럴 파크엔 내 20대가 잠들어 있다. 아직 20대긴 하나 아무튼. 연트럴 파크에는 감각적이지만 좀처럼 가게 되진 않는 카페가 많은데, 썸모어델리도 그중 하나다. 23년 8월 기준 애플루꼴라샌드위치 제외, 모두 판매 중 마라탕을 먹고 싶다는 내게 꽁이가 보내온 메뉴판. 마라탕과 괴리가 있지만 꽤나 맛있어 보여 바로 오케이 했다. 올리브크림치즈를 넣어 구운 양송이와 트러플크림 프렌치토스트를 주문하기로 약속하고 취침. 마라탕은 결국 빡이와 먹었다. ◇ 제로콜라 *0.3만 원 2만 원의 예약금을 내고 예약까지 해놓은 꽁이. 배은망덕하게도 본인은 배차간격 이슈로 15분이나 늦었다. 꽁이가 미리 메뉴 주문을 넣어둔 덕에 앉자마자 음식을 맛볼 수 있었다. 아쉽게도 양송이는 이미 품절이라 에그인헬로 변경했다. 일요일 1시 15분 기준 웨이팅이 3팀이었다. 회전율이 그리 빠르지 않아 찜통더위에 대기할 뻔. ◇ 에그인헬 *1.6만 원 에그 베네딕트와 쌍벽을 이루는 브런치계 대모. 내겐 샥슈카라는 다이어트 음식으로 좀 더 친근한 한 그릇 요리이다. 물론 이곳의 에그인헬은 체중 감량에는 도움이 되지 않는다. 그릇 정중앙의 하얀 것은 흰자가 아니라 크림소스다. 잘 만든 로제파스타 뺨을 후려친다. 크림소스가 충분히 섞이지 않은 부분에서는 싱싱시큼 토마토 향만 올라오는 걸 보아, 크림만 빼면 건강식일지도. 주재료는 계란, 완두콩, 바질, 방울토마토, 먹물 바게트. 먹물 바게트는 바삭하게 구워 설탕 등으로 코팅을 한 모양인데, 모양 탓에 처음엔 홍합이라고 생각했다. 달고 짜고 자극적인 맛에 흰 빵보다 손이 더 많이 간다. ◇ 트러플크림 프렌치토스트 *1.8만 원 후술할 몇 가지 이유에도 불구하고 이곳을 다시 찾는다면 아마 이 프렌치토스트 때문일 것이다. 본인은 평소 프렌치토스트를 그다지 찾지 않는다. 잘 만들지 못한 프렌치토스트는 식빵계란전과 다를 바가 없으며, 프렌치토스트를 기가 막히게 하는 집을 찾는 게 쉽지 않기 때문이다. 익힌 계란에 엉겨 붙은 퍽퍽한 식빵의 식감은 정말 최악이다. 그러나 썸모어 델리의 프렌치토스트는 수플레 팬케이크 마냥 몽글몽글 퐁신퐁신 부드러운 식감을 자랑한다. 계란이 아니라 버터에 지졌나 싶을 정도로 계란의 고소한 맛만 남았다. 구성은 두툼한 브리오슈 식빵 2쪽, 베이컨 2줄, 양송이버섯 3쪽, 루꼴라, 방울토마토, 크림소스에 트러플 오일. 빵과 더불어 크림소스 또한 난놈인데, 메뉴에 면 추가가 있다면 하고 싶을 정도. 맥 앤치즈와 같이 공격적인 감칠맛은 아니다. 의아할 정도의 슴슴-한 간이 이곳의 매력. 묽은 크림소스에 트러플오일의 향이 더해져 빵을 적셔먹기 그만이다. ◇ 서비스 꽁이도 말했다만 이곳의 고객 응대 방침은 일관성이 없다. 편하고 좋은 것만 취사선택해 가져왔달까. 손님이 직접 해야 하는 것 : 계산대에서 주문과 계산, 밖에서 얼음물 떠오기, 냅킨 가져오기 직원이 해주는 것 : 메뉴판 설명, 음식 서빙, 여벌의 수저와 그릇 갖다 주기 좁은 내부에 비해 테이블 개수가 많은 상황에서 손님들이 계산대에 왔다 갔다 해야 한다. 손 하나 까딱 안 하겠다는 진상 심보가 아니라 정말 효율성에 의문이 들어서 그런다. (하지만 테이블마다 돌아다니며 품절 메뉴는 설명해 주는) 제일 이상한 건 물이다. 꽁이의 증언에 의하면 냉수는 가게 밖 테라스 테이블에 있어 직접 떠와야 한단다. 이 더운 날 식당의 유일한 냉수를 굳이 바깥에 두는 이유가 진심으로 궁금해졌다. 가게 컨셉이 서브웨이 등 패스트푸드점처럼 '무조건 셀프'라면 오히려 나았을 것이다. 중구난방의 기준은 이곳이 손님한테 지나치게 방어적이란 인상만 준다. 직원분들의 상냥함이 이런 모순에 가려져 안타까울 뿐. 아무튼 이런 게 인스타 감성이라면.. 그런가 보다. ◇ 총평 ☆☆☆ 꽁이랑은 아니고 여자인 친구들과 한 번은 다시 올 것 같다. 리한나와 융이와 가기로 한 곳은 이미 메모장 3장은 넘은지 오래다. 야외 테이블도 서너 개 있어 선선한 가을에는 밖에서 식사해도 좋겠다. 식사 후 연트럴 파크 산책을 할 수 있는 것도 장점. 서로를 알아가는 시기의 커플에게 추천합니다."
[맛집탐방] 연남동 썸모어델리 - 색다른 브런치 맛집,"일주일에 2번 이상은 꼭 브런치를 먹는데 그런 내게 어느날 친구가 소개해준 연남동 브런치 맛집! 원래는 인천에 있는 곳인데 서울 연남동에도 가게를 냈다고 하면서 추천해줬다. 인천 썸모어를 자주 다녔던 친구라서 연남동 썸모어델리도 가보고 싶다고 노래를 불렀고 결국 먼저 갔다 왔었는데 나보고 안가면 후회한다면서 꼭 가보라고 추천해준 곳! 그리고 처음 가봤던 그날 이후로 자주 방문하고 있고 애정하는 곳이기도 하다. 이번에 방문 했을 때는 썸모어의 시그니처인 트러플 크림 프렌치토스트 올리브 크림치즈를 넣어 구운 양송이 크림치즈 당근케이크 이렇게 3가지 메뉴를 맛봄! 트러플 크림 프렌치토스트와 올리브 크림치즈 넣어 구운 양송이 음식 2가지를 먼저 받고 디저트는 식후에 받기로 했다. 조금 기다리니 음식이 거의 동시에 나왔고, 밑받침을 코르크로 사용하시던데 뜨거운 그릇도 받치고 썸모어만의 감성도 제대로 살린 느낌?! 전체적으로 따뜻하고 깨끗한 분위기라 잘 어울렸다. 먼저 올리브 크림치즈 넣어 구운 양송이! 이름이 왜 이렇게 긴가 싶었는데 메뉴이름 그대로 요리가 나오기 때문ㅋㅋ 이 메뉴는 올때마다 먹는 썸모어의 대표 메뉴인데 양송이를 반으로 갈라보니 크림치즈가 가득 담겨 있었고, 한입 베어무니 고소함+담백함+오일 풍미까지.. 갑자기 복합적인 향이 한번에 밀려 들어오면서 @_@ 약간 오바하면 정신 못차리게 만드는 그런 맛. 맨 처음 썸모어에 왔을 때 친구가 이 메뉴 안먹으면 안된다고 극찬을 했었어서 왜그런가 했는데.. 진짜 맛있다ㅎㅎㅎ 사진을 보면 그릇에 오일이 가득 들어있는데 올리브 오일이라 빵에 찍어 먹으면 아주 별미이다ㅋㅋ 바게뜨 빵을 추가주문해서 (2번이나....) 오일까지 싹싹 긁어 먹기! 다음은 아주아주 좋아하는 트러플 크림 프렌치토스트!!!! 트러플향이 진하게 녹아든 프렌치토스트이고, 양송이+베이컨+루꼴라+토마토+치즈+크림+오일.. 눈에 보이는 재료만 해도 어마어마하다 내 기준 크림치즈 양송이보다 이 메뉴를 처음 먹었을 때 충격이 더 컸고 만족감도 더 높았다. 처음 느껴보는 묵직한 크림맛? 프렌치토스트와 어울리는 크림에 푹 빠져서 한동안 이것만 엄청 먹었을 정도ㅋㅋㅋ 그리고 프렌치토스트 빵이 일반 식빵이 아니라 부드러운 바게뜨라서 더 색달랐다. 바게뜨는 딱딱해서 먹을 때 불편하진 않을까 걱정했었는데 엄청 부드럽고 나이프로 썰었을 때 잘 잘려서 편하게 먹었다. 좋아하는 메뉴이니까 상세샷 몇장 더 추가@ 식사 맛있게 먹고 후식으로 주문한 당근 케이크! 원래 먹고 싶었던 다른 케익이 있었는데 품절이었었나.. 주문이 안된대서 이 케이크를 시켰다. 건강한 맛이 나는 당근 시트에 엄청 묵직한 크림치즈가 올라가 있는데 물만 마시려다가 크림맛이 너무 묵직하고 무거워서 아이스 아메리카노를 추가주문해서 같이 마셨..다ㅋㅋㅋㅋ 크림은 반 정도 남겼고 케익은 다 먹음ㅎㅎ 토핑으로 올라간 코코넛칩도 맛있었다. 썸모어 외관 (초봄에 찍은 것...) 썸모어델리의 외관. 첫방문했을 때 초봄이었는데 외관을 그때만 찍어둬서 그 사진으로 대체한다ㅋㅋㅋ 지금은 여름이라 푸릇푸릇 싱그러운 분위기가 난다. 총평 ★★★★☆ 4.2/5 연남동 깊숙이 위치해있어서 조용하고 깔끔한 분위기를 풍기는 브런치 맛집. 조용한 곳을 찾는다면 이곳으로! 다만 좌석이 6~8석 정도이기 때문에 점심, 저녁 피크타임에는 웨이팅이 있을 것으로 생각된다. 운 좋게 애매한 시간대에만 가서 웨이팅은 안했었는데 인기가 많아진 요즘은 웨이팅이 있는 듯하다. 바로 옆 골목도 예뻐서 연예인들이 드라마, 영화 촬영하러 가끔 오는데 그럴 때마다 우연치 않게 연예인을 보기도 한다. 촬영하는 장면을 보면서 브런치도 즐기면 일석이조. 그리고 깔끔한 화장실도 가게 옆에 있어서 식사하고 편하게 다녀오면 좋다. 가끔 없는 곳 갈때마다 당황스러운데.. 여기는 정말 편하고 좋았다. 썸모어에는 에그인헬, 샌드위치 등 다양한 메뉴도 있으니 브런치 좋아하시는 분들이 방문하면 좋을 듯하다. 집에서 만들어 먹을 때의 느낌과는 확실히 다른 전문적인 맛이 느껴지니 색다른 맛을 느끼고 싶다면 추천! *고대에 있는 '미뇽 브런치'와 분위기가 비슷하다. 오픈된 주방과 바로 옆에서 즐기는 식사가 익숙한 분은 썸모어를 방문했을 때 편하게 즐길 수 있을 듯하다."
연남동 브런치 맛집 인생 프렌치토스트 썸모어델리,"안녕하세요. 유리달빛이에요! 저 = 프렌치토스트 광인 ㅋㅋ 한번 꽂히면 일주일에 5번 이상 먹을 때도 있는데요~ 얼마 전 발견한 인생 프렌치토스트 맛집!! 애견 동반도 가능한 연남동 브런치 맛집 썸모어델리 내돈내산 포스팅 해봐요. 여기 맛있어서 6월에만 벌써 2번 다녀온... ㅎㅎㅎ 썸모어델리 서울특별시 마포구 동교로51길 131 1층 #연남동브런치맛집 #썸모어델리 위치는 홍대입구역에서 걸어서 13분, 가좌역에서 걸어서 12분 ㅎㅎ 딱 중간에 있어요~~!! 썸모어델리는 실내에는 테이블 3~4개, 테라스 테이블 2개 정도 있는 것 같은데 요즘은 날씨가 더워서... ^_ㅠ 실내에서 드시는 걸 추천해드려요. 이날도 한낮에 32도였나? 엄청 더웠었는데 점심 시간에는 웨이팅이 있더라고요. 연남동 브런치 맛집 대표 메뉴 그랜마 라자냐 (19,000원) 트러플 크림 프렌치 토스트 (18,000원) 하나씩 주문했고요~ 애플 루꼴라 샌드위치 (13,000원) 함께 주문했어요. 전에도 연남동 브런치 먹으러 연남동 맛집 몇 군데는 가봤었는데... 그 뒤로 재방문한 곳은 0곳이었거든요. (집 근처 일산 밤리단길에 유럽 분위기에 테라스 있는 브런치 맛집이 워낙 많고 하나같이 맛있고, 분위기도 좋아서 굳이 연남동까지 갈 일이 없어요.) 근데 썸모어델리는 트러플 크림 프렌치토스트가 너무너무너무 맛있어서 ㅠㅠ 6월이 다 가기도 전에 또 갔어요!! ㅋㅋㅋㅋㅋㅋ 아... 그리고 사진은 같이 갔던 동생 다지가 찍은 건데 저한테 없는 인스타 감성이 낭낭~~ ㅋㅋㅋ 얼마 전 샤넬뷰티 성수 팝업 때문에 성수역까지 갔었는데... 오는 길에 썸모어델리 프렌치토스트 먹고 싶어서 굳이 홍대역에서 내려서 썸모어델리까지 걸어간...!! (이 정도면 찐 사랑 ㅋㅋ) 그리고 이날 샤넬 팝업 드레스코드가 컬러풀 세미 캐주얼이라서 ZARA에서 핫핑크 바지 샀는데 저 태어나서 핫핑크색 바지 진짜 처음 입어보거든요? 아니... 이렇게 맘에 쏙 들 줄 알았으면 미리 사놓을 걸 ㅋㅋㅋㅋ 자라 세일 때 샀더니 작은 사이즈만 남아서 완전 숨 참고 입어야 함 ^_ㅠ 연남동 브런치 맛집 재방문한 이유는 바로 이 트러플 크림 프렌치토스트 !!! 고민도 안하고 바로 시켰고요 ㅋㅋ (썸모어델리 가시면 이 메뉴는 꼭... 제발...!!! 드셔보시길 ㅠㅠㅠb) 그리고 쏭군님은 여름의 맛(14,000원) 이라는 부라타치즈 + 냉동 망고 샐러드를 주문했어요~~ 결론은... 둘다 트러플 크림 프렌치토스트 완전 순삭 ㅋㅋㅋㅋㅋ 쏭군님도 이 메뉴 진짜 맛있다고 인정했어요. ㅋㅋ 프렌치토스트가 트러플 크림, 베이컨이랑 같이 나오는 조합은 썸모어델리에서 처음 봤는데 이상할 줄 알았는데 진짜 너무너무너무 맛있다는 거... 트러플 오일 향이랑 폭신하고 부드럽고 달달한 프렌치토스트가 넘넘 잘 어울려요!! 연남동 브런치 맛집 찾으신다면 썸모어델리 추천해드릴게요:) #연남동브런치 #연남동맛집 #프렌치토스트 + 내돈내산 내돈내먹"
"[썸모어델리] 연남동 끝자락, 소중한 브런치","연남동 썸모어델리에 다녀왔습니다. 경의선 숲길 끝자락에 있어 홍대입구역에선 좀 거리가 있어요. 연남동은 산책하기 좋은 곳이니 지하철에서 걸어오기도 좋은 듯해요. 아담하고 따듯한 실내 좌석은 많이 없습니다. 4테이블 정도인 작은 매장이에요. 2인은 네이버 예약을 하고 방문하시는게, 3인 이상은 워크인으로만 가능합니다. 저희는 이 날 셋이라 평일 오전 11시 오픈런 했답니다. 데일리 스프 오늘은 양송이 스프입니다~ 빵 추가는 2,500원이에요. 오랜만에 맛있는 스프를 먹으니 좋네요. 사과 캐일 주스 올리브 크림치즈 양송이 오븐에 올리브 오일과 크림 치즈, 양송이를 넣고 조리했습니다. 달콤한 크림 치즈가 잘 어울리네요. 아래 오일에 빵을 찍어먹어도 좋아요. 큼지막한 양송이와 위에 올라간 루꼴라 라자냐, 매콤하게 요청했습니다. 라구에 크림이 조금 섞여인는 듯해요. 로제 정도는 아니지만 풍부한 맛이 잘 맞더라구요. 매운 버전도 그리 맵지 않으니 매운 것 추천! 라자냐면도 잘 익어서 좋았어요. 트러플 크림 프렌치 토스트 루꼴라, 베이컨 그리고 트러플 플레이버가 참 잘 어울리는 메뉴입니다. 오늘 메뉴에 탄수화물이 많지만 이 메뉴는 부드러운 식감으로 같이 시켜도 좋단 생각이 들어요. 아기자기한 테이블 웨어 Ready for Christmas 크리스마스가 한 달 앞으로 다가왔어요. 양이 부족해서 시켜본 에그인헬 바게트 빵을 기본으로 조금 주시고 음식 위에도 달콤한 먹물빵 러스크가 올라갑니다. 맛있는 접시 와인도 준비되어 있는데 리스트는 못봤어요. 가볍게 글라스 와인 마시면 좋았을텐데-! 다음 일정이 또 있어서 또르르 메뉴가 많지 않아 지인들이랑 가서 큰 고민 없이 맛있게 먹고오기 추천. 다소 작은 실내 공간으로 두 분이서 방문하시고 예약하면 좋을 것 같아요! 썸모어델리 서울특별시 마포구 동교로51길 131 1층"
"[연남동] 연남동 브런치 카페 ""썸모어델리""",썸모어델리 연남동브런치 오늘은 연남동 갔다가 헤매고헤매다 그냥 들어간 맛집입니당 연남동 구경하는데 생각보다 사람이 너무 많고 브레이크타임 간당간당하고 어디 갈지 정하질 않았어서 헤매던중 발견하고 에잇 들어가보자 하고 들어간 브런치집입니다ㅎㅎ 브런치를 먹게될 줄도 몰랐어요 그치만 매우 만족했던 집 주차는 아시겠지만 연남동 눈치싸움 해야도구요ㅎㅎ 위치는 요기 썸모어델리 서울특별시 마포구 동교로51길 131 1층 가게앞 모습이에요 입구가 어딘지 잘 모르겠지만.. 테라스에도 사람이 많았어요~ 가게 내부가 워낙 작아서 사진 찍기도 쉽지 않았어요 잠시 대기했다가 운좋게 들어갈 수 있었어요 저희는 요기 입구로 들어왔어요 위 사진에 바로 오른쪽에 위치! 진짜 들어가기 전까지만해도 뭔집인지 몰랐음 안쪽이 주방으로 되어있구요 약 2인 테이블이 7-8테이블 있었던 것 같아요 주로 여성분에 3-4인 구성도 많았음 메뉴판입니다ㅎㅎ 구구절절 설명을 써주심 재밌는게 가게 스토리도 중간중간 넣어줘서 읽는 재미가..ㅋㅋㅋ 그냥 들어왔기에 인기메뉴가 뭔지도 몰라서 땡기는거 시켰어요 그랜마라자냐 트러플크림 프렌치토스트 오렌지주스 맥주 크림과 매콤한 토마토의 적절한 조화 먼저 음료부터 등장! 오렌지주스는 정말 바로 착즙인지 시원하지 않았어요 얼음 마니주세요 라자냐 등장! 너무 맛있어요.... 프렌치토스트 너무너무 맛있어요.. 브런치 치고 매우 푸짐해요 프렌치 토스트 감덩 또 느끼네여 식전빵을 주셨었나... 기억이 잘 안나네 라자냐를 먹다가 빵을 더 추가했습니다. 메뉴판엔 없지만 빵추가 가능해요! 두가지였던것 같네요 배고팠지만 떠나서 오랜만에 매우 맛있게 먹었던 브런치였습니다! 연남동 멀지만 않으면 또 가고싶네요 날 좋을때 테라스에서 와인먹기 딱 좋은집 직원분들도 친절하고 매우 좋앗습니당! 오늘도 잘 먹었어요! 썸모어델리 11:00-19:00 (월요일 휴무) 네이버예약가능
