title,content
[홍대/연남]수제 생콤부차 카페 연남동콤부차,"#홍대 #홍대카페 #연남동 #연남동카페 #연남동데이트 #연남동카페추천 #연남동콤부차 #콤부차 #콤부차맛집 #카페추천 #서울카페추천 #마포카페 #서이추 #생콤부차 #연남동데이트코스 #홍대카페추천 #홍대데이트 #홍대주말 #아인슈페너 연남동콤부차 서울 마포구 동교로46길 42 1 매주 월요일 정기 휴무 평일 12:00-20:00 토 13:00-20:00 일 15:00-21:00 주차X 연남동에 콤부차 카페가 생겼다고 해서 얼른 다녀왔어요 :) 연남동 핫한 골목길 사이에 작게 위치해 있어요! 지나가다 테이크아웃하기도 넘 좋을 것 같아요 :) Next image 외관부터 감성 뿜뿜~ 아기자기한 분위기와 공간이 참 마음에 들었어요! 가게에 들어서면 다양한 종류의 콤부차가 놓여 있는 모습을 볼 수 있어요! 가루콤부차랑 시중 병에든 콤부차는 멸균공정이 여러차례 들어가서 유익균들이 거의 살아남을수 없는 구조인데 생콩부차는 100% 살아있는 찐 유산균덩어리!! 내부에 테이블은 총 3좌석으로 작고 아담한 공간이지만 그만큼 아늑함을 느낄 수 있답니다! 무엇보다 바깥을 볼 수 있는 창가자리가 갠적으로 넘 좋았어요! 제가 앉은 자리는 4인까지도 가능해요 :) Next image <주문메뉴> 크림콤부차 7.0 흑임자10곡라떼 6.5 레몬콤부차 6.5 찹쌀떡구이 5.5 르방듬뿍 바게트 6.5 메뉴를 주문하면 이렇게 눈앞에서 콤부차를 직접 만들어주세요 :) 오픈형 키친 믿먹이죠★ 정~말 푸짐한 한상! 식기부터 플레이팅까지 사장님의 섬세함을 느낄 수 있었어요! 넘 예뻐서 먹기 전부터 기분 좋아지는...♥ 찹쌀떡구이! 보기 좋은 떡이 먹기에도 좋다.... 떡을.. 정말 잘 구우시는!! 겉바속촉에 떡의 쫄깃함이 완전 살아 있었어요! 조리 후 바로 내어주셔서 따끈하게 먹을 수 있어서 더 좋았습니다! 찹쌀떡 구이는 구성이 김+기름장+유자청+꿀 이렇게 나오는데... 모든 조합이 완벽했어요! 르방듬뿍 바게트! 속이 정말 촉촉하고 다섯조각 정도가 나왔어요~! :) 곁들일 수 있는 잼으로는 자두와 살구가 나오고 진하고 고소한 풍미가 가득한 엘앤비르 발효버터도 같이 준비됩니다! 흑임자10곡라떼! 프리미엄 방앗간 10곡 미숫가루에 국산검정깨 흑임자~ 락토프리우유로 만들어서 속도 편하게 드실 수 있어요 :) 10곡라떼에 고소함이 열배!! 아침마다 호로록 한잔씩하고 출근하고 싶어지는 맛... 회사 근처라면 아침마다 든든하게 한잔씩 할 것 같아요~! 레몬콤부차! 오리지날 콤부차에 레몬청을 넣어 2차 발효한 콤부차에요 :) 레몬에이드 같은 달콤상큼한 맛에 콤부차 처음이신 분들은 쉽게 접할 수 있는 메뉴입니다~! 크림콤부차! 시그니처 메뉴로 아인슈페너 대신 마실 수 있는 크림콤부차에요 >< 부드럽고 달콤한 맛! 시나몬 가루가 올라가고 푸른 바다가 연상되는 색감에 비주얼까지 완벽했던 메뉴에요~! 올라가 있는 크림이... 대박적으로 맛있어요 시그니처 메뉴는 빼놓지 말아주세요 ><※ 50m © NAVER Corp. 연남동콤부차 서울특별시 마포구 동교로46길 42 1층 연남동 오고가며 들리기 넘 좋은 곳이에요! 특히 직장인, 연남주민분들은 자주 애용할 것 같은 곳! 식단 관리시 커피 대신 먹기 좋을 것 같아요~! 계절마다 제철과일로 메뉴가 계속 업그레이드되고 원액도 판매하고 있으니 콤부차가 생각나시면 꼭 한번 들러보세요! 본 포스팅은 소정의 원고료를 받아 작성되었습니다."
연남동콤부차,"연남동콤부차 연남동에서 직접 만드시는 제대로된 콤부차를 맛볼 수 있었던 연남동콤부차. 매일 콤부차를 마시는 콤부차 마니아인 나, 연남동콤부차에서 직접 발효시켜 만드시는 콤부차와 가래떡구이 디저트를 맛보고 왔다! 연남동의 연남동콤부차! 연남동콤부차는 연남동 동진시장 쪽 아담한 골목에 위치한 아담한 규모의 카페이다. 화이트와 우드톤의 깔끔한 매장 외관도 돋보이는 곳! 연남동콤부차의 영업시간은 화요일부터 금요일까지는 오후 12시부터 오후 8시까지. 토요일은 오후 1시부터 오후 8시까지 일요일은 오후 3시부터 오후 9시까지. 매주 월요일은 정기휴무이다. 연남동콤부차 간판의 닥터훈트 강아지 캐릭터처럼 반려동물 동반 가능 카페이기도 하다! 매장에서 사장님께서 직접 만드는 콤부차! 콤부차는 설탕을 넣은 녹차나 홍차에 유익한 박테리아를 넣어 발효시킨 전통적인 발효 음료! 콤부차를 조절된 환경에서 발효되도록 두면, 박테리아와 효모가 음료에 축적되어 콤부차는 유익한 프로바이오틱 박테리아의 공급원이 되어 천연 발효 또는 인공적으로 탄산화되는 음료라고 한다. 콤부차는 시큼하면서도 달콤한 맛과, 발효 과정에서 생성된 탄산 때문에 청량감이 들며 자양강장, 소화 기능을 증진, 면역 체계 강화, 혈액과 기관에서 불순물을 제거, 만성변비, 당뇨예방, 다이어트 및 피부미용 등에 도움이 된다고 한다! 사장님께서 직접 만드시는 콤부차! 콤부차를 워낙 좋아해서 매일 마시고 있지만 시중에서 판매하고 있는 가루 콤부차 및 병 콤부차는 멸균 공정 과정을 거쳐야 하기 때문에 유익균이 살아남기 어려운데에 비하여 직접 만드는 수제 콤부차는 유익균이 살아있는 그만큼 콤부차의 찐 효능을 볼 수 있다고 한다! 또 직접 만드신 콤부차이기 때문에 카페인에 민감하신 분들이나 어린아이들도 마실 수 있는 카페인 프리에 가까운 수제 음료, 연남동콤부차!! 진짜 콤부차를 마실 수 있어서 마시기 전부터 신남~~ 귀엽고 아담한 규모의 연남동콤부차! 4인까지 이용할 수 있는 창가석, 2인 테이블 석, 간이 바테이블 석까지 총 3개의 테이블이 마련되어 있다. 사장님께서 만드시는 콤부차의 종류는 홍차 발효 생콤부차 커피 발효 콤부차 2차 발효 콤부차 크림 콤부차 10곡 라떼 까지 이렇게 5가지 부류의 콤부차! 기본적으로 오리지널 콤부차에 수제청을 넣은 레몬, 자몽 청귤차가 있고 비트 색을 넣은 비트 콤부차, 커피 베이스를 넣은 콤부차, 크림을 올린 콤부차 등등 그야말로 콤부차에 진심이신 사장님께서 직접 개발하시고 만드신 다양한 종류의 콤부차를 맛볼 수 있는 연남동콤부차! 테이크 아웃시에는 300원 정도 할인된 금액으로 주문이 가능하다! 청귤콤부차 / 비트콤부차 / 레몬콤부차 / 커피콤부차 / 오리지널콤부차 발효 음료인 콤부차의 맛 특성상 시큼한 맛과 향이 있다보니 다소 호불호가 있을 수가 있어 직접 만드신 청귤청 혹은 레몬청을 첨가하여 달달한 맛의 콤부차를 맛볼 수 있도록 만드신 콤부차까지! 연남동콤부차에서 콤부차와 맛볼 수 있는 디저트로는 찹쌀떡구이와 바게트! 크림 콤부차 7,000원 비트 콤부차 6,500원 찹쌀떡 구이 5,500원 쨍한 색감의 넘 이쁜 콤부차! 그리고 정갈한 플레이팅의 찹쌀떡구이 디저트까지!!ㅎ 먹기 아까울 정도로 파랑&빨강 색감이 너무나도 이쁜 크림 콤부차와 비트 콤부차! 비트의 색을 입힌 쨍한 빨간색의 비트 콤부차. 오리지널 콤부차 본연의 새콤달콤함에 비트의 약간 씁쓸한 향과 그 색이 더해져 보는 재미까지 더한 비트 콤부차! 연남동콤부차의 시그니처 메뉴, 크림 콤부차! 파란색의 콤부차 위의 부드러운 크림, 그리고 시나몬가루까지 톡톡톡!!! 마치 바다가 연상 되는 듯한 시원한 비주얼의 특별한 콤부차였다. 다른 카페에서 판매하는 아인슈페너처럼 콤부차에 부드럽게 휘핑한 크림을 올린 콤부차로 콤부차의 새콤함과 크림의 부드럽고 달달한 조화가 색다르면서도 기분좋게 느껴졌다! 역시 시그니처 메뉴는 꼭 마셔봐야돼용~~ 바삭하게 잘 구워주신 찹쌀떡구이, 찹쌀떡구이에는 바삭쫀득한 찹쌀 모찌 두덩어리와 유자청, 꿀, 그리고 간장들기름 소스를 함께 주신다. 주문 즉시 구워주셔서 그야말로 겉바속촉! 바삭한 찹쌀모찌를 식기 전에 가위로 잘라서 유자청과 꿀을 듬뿍 곁들여 먹어보라고 권해주셨다. 바삭 쫀득했던 찹쌀 모찌에 유자청으로 새콤달콤하게 꿀로 달달하게 혹은 간장기름장으로 고소하게! 가지각색 색다른 매력으로 즐길 수 있는 든든한 디저트. 식사 대용으로도 괜찮았고 새콤한 콤부차와도 넘 잘 어울리는 찹쌀떡구이 디저트! 커피대신 콤부차, 맥주대신 콤부차, 콜라대신 콤부차, 카페인 걱정없이 즐길 수 있는 수제 콤부차! 콤부차를 좋아하시는 분들, 콤부차에 진심이신 사장님께서 직접 만드시는 다양한 종류의 수제 콤부차를 경험하러 연남동의 아담하고도 여유로운 분위기의 연남동콤부차에 방문해보세용 :-) 50m © NAVER Corp. 연남동콤부차 서울특별시 마포구 동교로46길 42 1층 <연남동콤부차> 영업시간 화요일 ~ 금요일 12:00 - 20:00 토요일 13:00 - 20:00 일요일 15:00 - 21:00 (매주 월요일 정기휴무) 매장연락처 010-4280-8244"
생콤부차 전문점 연남동 콤부차에 다녀왔어요.,"#연남동다람쥐 이번엔 #생콤부차 전문점인 연남동 콤부차에 다녀왔어요. 이름 너무 직접적인 거 아뉘니~? 연남동 콤부차는 동진시장의 (구)카페리브레 맞은편에 위치해 있어요. 연남동콤부차 서울특별시 마포구 동교로46길 42 1층 아기자기한 느낌이 드는 #연남동콤부차 리본이 요즘 유행이라는데 빨간 리본과 라이트가 살짝 크리스마스 느낌이 드네요. 내부는 식물과 나무로 인테리어되어 있어서 따뜻한 느낌이 들었어요. 먹고 갈 수 있는 자리도 조금 있었어요. 딱 콤부차만 판매할 것 같았는데, 의외로 여러 메뉴가 있어서 신기했어요. 메인 메뉴인 오리지널콤부차, 그리고 청을 넣은 콤부차 특이해보이는 크림콤부차, 건강라인인가? 10곡라떼와 흑임자10곡라떼도 있어요. 콤부차를 선호하지 않는 친구와 같이 와도 먹을 수 있는 메뉴가 있어서 좋아요. 같이 곁들여 먹을 수 있는 찹쌀떡구이나 바게트, 구운 치즈도 있어요. 제가 구매한 원액은 500ml, 1000ml 로 구매할 수 있어요. 포장 콤부차는 원액은 커다란 패트병에, 1잔씩 주문하면 비닐팩에 넣어줘요. 비닐팩 오랜만이네요...ㅎㅎ 저는 오리지널 원액을 1000ml 주문해봅니다. 포장을 기다리면서 연남동콤부차의 하이라이트, 발표중인 콤부차를 구경했는데 모든 메뉴가 시음이 가능하다고 하더라구요. 그래서 제가 주문한 원액과 청귤콤부차를 시음해보았는데... 원액이 발효가 조금 덜된 상태라 단맛이 더 강해서 아쉬웠고, 재대로 발효된 청귤콤부차는 새콤하게 진쫘 맛있더라구요! 이미 오리지널로 주문한 상태라 번복하기 싫어서 이번엔 오리지널로 주문했는데, 다음엔 시음해서 확인하고 구매하는걸로~ 제가 주문한 오리지널 콤부차~ 집에와서 먹어보니 역시 시음한 것과 같은 단맛이 강해서 발효되라고 상온에 놔두었어요. 먹는 방법이 적혀있는 종이를 예쁘게 걸어주시는데, 설명서에 따르면 이 콤부차를 이용해 콤부차를 만들 수도 있다고 하네요. 뭘 어떻게 하는지 모르겠어서 패스 ㅋㅋㅋㅋ 구하기 힘든 #생콤부차 연남동에서 구매할 수 있어 행복한 연남동다람쥐 앞으로 종종 이용하게 될 것 같아요. #내돈내산 #내돈내산생콤부차 #연남동생콤부차 #콤부차파는곳"
"[연남동 카페 추천] 요즘 핫한 콤부차를 직접 발효, 제작하는 '연남동콤부차'","안녕하세요 ㅎㅎ 규리로드 맛집 추천입니다! :D 오늘 소개드릴 맛집은 연남동에 식당, 소품샵이 많은 곳에 위치한 ""연남동콤부차""입니다! 연남동콤부차 [ 주소 ] 서울 마포구 동교로46길 42 1층 [ 영업시간 ] 화 ~ 금 12:00 ~ 20:00 토요일 13:00 ~ 20:00 일요일 15:00 ~ 21:00 매주 월요일 정기 휴무 [ 연락처 ] 010-4280-8244 연남동 카페 추천 연남동콤부차 주말에 연남동에 수동 카메라 체험하러 가서 하루 종일 돌아다니면서 사진을 찍었거든요 ㅎㅎ 계속 돌아다니다 보니 허기가 져서 저녁 먹긴 이르고.. 간식거리를 파는 카페를 급하게 찾다가 떡을 구워서 파는 곳을 발견하고 바로 찾아갔습니다 ㅎㅎ 안 그래도 요즘 콤부차에 미쳐있어서 이름만 보고 확 끌리긴 했어요 ㅎㅎ 외관이 아이보리색 벽에 우드 마감이라 되게 아늑해 보이고 예뻤어요 연남동 카페 추천 연남동콤부차 가게 옆에 창이 있고 크리스마스 장식이 예뻤는데 사진은 왜 장식이 다 잘렸을까요.. 이놈의 똥 손.. Next image 연남동 카페 추천 연남동콤부차 연남동 콤부차 메뉴판입니다! 간식 메뉴는 세 가지가 있었고 콤부차는 되게 종류가 많았어요 ㅎㅎ 신기함 원액도 판매하시던데 선물로 되게 좋을 것 같아요 ㅎㅎ 음료는 콤부차와 곡물 라테가 있는데 커피는 없더라고요 커피 메뉴를 하려면 그라인더나 머신이 부피가 커서 아예 콤부차에 집중했구나 했어요 ㅎㅎ 연남동 카페 추천 연남동콤부차 메뉴를 주문하고 자리를 잡았는데 이렇게 주방 가벽 쪽에 귀여운 수저받침? 도자기 인형?들이 있었어요 제가 귀여워서 막 사진을 찍으니까 일본에서 직접 사 오신 거라고 설명해 주셨어요 ㅎㅎ 연남동 카페 추천 연남동콤부차 그리고 카운터 옆쪽에 포장 샘플이 있었어요 ㅎㅎ 콤부차는 맛도 있지만 건강한 음료라서 누군가에게 선물할 일이 생기면 이렇게 포장해서 선물해도 좋겠어요 ㅎㅎ 연남동 카페 추천 연남동콤부차 연남동콤부차 내부를 좀 찍어봤어요 다른 자리에는 손님들이 앉아계셔서 사진을 많이 못 찍었네요 ㅠㅠ 내부가 많이 넓진 않고 창가 쪽 바 테이블과 2인 테이블이 두 개 있어요! 연남동 카페 추천 연남동콤부차 판매 중인 콤부차들이에요 ㅎㅎ 저랑 동생이 고민하고 있는데 시음도 가능하다고 하시더라고요! 살짝 고민했지만 시음은 따로 안 했어요 ㅎㅎ 연남동 카페 추천 연남동콤부차 저와 동생이 앉은 자리입니다 가게 내부, 외부가 같은 톤으로 되어있어서 차분해지는 느낌이 들었어요 ㅎㅎ 연남동 카페 추천 연남동콤부차 주문한 메뉴가 나왔습니다 찹쌀떡 구이 5,500원 제주 감귤 콤부차(HOT) 6,500원 청귤 콤부차(ICE) 6,500원 그릇들이 너무 아기자기하고 귀엽죠 ㅠㅠ 음료 시킬 때 따뜻한 거랑 시원한 거랑 엄청 고민하다가 결국 아이스로 시켰는데 너무 맛있었지만 마지막에 조금 후회했어요 따뜻한 거 마실걸... ㅎㅎㅎ 연남동 카페 추천 연남동콤부차 찹쌀떡 구이에 유자청도 나오고 소스는 꿀과 간장&참기름 장이 나왔는데 진짜 맛있었어요 ㅠㅠㅠ 간장소스에 찍어 먹으면 짭조름, 고소하고 유자청을 올려서 꿀을 듬뿍 찍어 먹으면 새콤달콤하고 ㅠㅠ 굽기도 겉은 바삭하고 안은 엄청 쫄깃해서 하나 더 시켜 먹고 싶을 정도로 맛있었어요 ㅎㅎ 연남동 카페 추천 연남동콤부차 사장님이 닥스훈트를 키우시는지 가게 곳곳에 닥스훈트 그림이 그려져있는데 잘 안 보이지만 자세히 보면 컵에도 닥스훈트가 그려져있어요 ㅎㅎ 심지어 젓가락 받침도 닥스훈트..! 콤부차도 새콤달콤해서 너무 맛있고 고소한 찹쌀떡 구이하고 조합도 찰떡이었어요 ㅎㅎ 꼭 재방문해서 따뜻한 콤부차도 마셔보고 싶네요! 이상 규리로드 카페 추천이었습니다! 읽어주셔서 감사합니다 :D 50m © NAVER Corp. 연남동콤부차 서울특별시 마포구 동교로46길 42 1층"
[연남동 카페] 연남동 콤부차 방문 후기,"오늘은 카페 방문 후기로 인사드리네요! 약속이 있어서 연남동에 방문했는데요, 조용하고 컨셉 있는 카페를 찾다가 ""연남동 콤부차""를 방문하게 되었습니다 건물 외관 모습 마침 함께 있던 분이 커피를 못 드사기도 했고 ""콤부차""라는 타이틀이 신선하기도 했어요! 간판에 닥스훈트로 추정되는 강아지 로고나, 입구에 쓰여있는 멈무손님환영 같은 강아지 친화적 멘트 때문에 방문하게 된 것도 있는 것 같아요. 연남동 콤부차 내외부 모습 입구에 들어설 때 비닐팩에 콤부차가 걸려있는데요 아마 테이크아웃 하면 저렇게 주는 것 같아요. 내부가 앉을 수 있는 테이블(?) 이 한 3개 정도 있었는데요, 좌석이 편한 좌석은 아니어서 방문하신다면 테이트 아웃 또는 가볍게 삼사십분 내로 이동하시는 분들에게 추천드립니다. 연남동 콤부차 메뉴판 En. Ver 연남동에 외국인이 많아서 일까요? 외국인 메뉴판도 이렇게 준비되어 있었습니다. 콤부차라는 메뉴와 동양적 카페 분위기를 느껴보니 외국인 친구와 함께 방문하면 좋겠다는 생각이 들었습니다. Next image 처음으로 시킨 메뉴 크림 콤부차 7,000 원 *시그니처 메뉴 생콤부차 6,300 원 찹쌀떡구이 5,500 원 이렇게 세 가지 메뉴를 시켜보았는데요 저는 찹싹떡구이가 가장 맛있었습니다 떡과 유자청, 꿀, 기름장 이렇게 주시는데 조합이 좋았고 떡을 딱 좋은 겉바속초로 너무 잘 익혀 주셨어요!! 음료는 색감이 너무 이뻐서 인스타그램하시는 분들의 성지가 되지 않을까? 하는 생각을 잠깐 했습니다ㅋㅋ 두 번째 방문했을 찍은 사진 마음에 들어서 다음에 한 번 더 방문했는데요, 비터 콤부차 6,500원 레몬 콤부차 6,500원(불확실) 르방등뿍바게트 6,500원 이렇게 주문을 하였습니다. 바게트를 살구, 자두 쨈에 찍어 먹는 구성이었는데요, 동행인하고 이야기하다가 에너지 떨어질 때 먹기 좋은 구성이었습니다. 이곳의 만의 유니크함과 분위기가 좋아서 앞으로도 꽤 여러 번 더 방문할 거 같아요. 50m © NAVER Corp. 연남동콤부차 서울특별시 마포구 동교로46길 42 1층 홍대입구역 3번 출구 도보 15분 거리 화-토 12:00 ~ 20:00 일요일 15:00 ~ 21:00 *반려동물 동반 가능 연남동 가실 일 있으시면 이곳도 한번 고려해 보세요 :) 커피집이 아닌 차를 마시는 것도 나름 괜찮은 경험이었어요 그럼 오늘도 좋은 하루 보내세요!"
연남동 카페 : 연남동 콤부차,"서울 연남동 연남동 콤부차 서울 마포구 동교로46길 42 (@yeonnamdong_kombucha) • Instagram 사진 및 동영상 팔로워 84명, 팔로잉 25명, 게시물 34개 - (@yeonnamdong_kombucha)님의 Instagram 사진 및 동영상 보기 www.instagram.com 콤부차에 빠진 요즘 마침 연남동에 또 콤부차 가게가 생겨버림 연남동 카페 연남동 콤부차는 진짜 콤부차 메뉴를 중심으로 하는데 그래서 자두, 패션후르츠 콤부차, 청귤 콤부차 등 다양한 맛의 콤부차가 있는 콤부차 천국 그리고 콤부차랑 잘 어울리는 디저트까지! 찹쌀떡구이 못 참지 그래서 크림 콤부차, 커피 콤부차, 찹쌀떡구이를 주문했다! 완전 K-디저트 그 자체 완전 정갈하게 플레이팅한 콤부차 한상차림 너무 내 취향 먼저 처음 보는 비주얼의 크림 콤부차는 연남동 콤부차의 시그니쳐 ⚡️ 아인슈페너랑 비슷한데 커피 대신 콤부차인 그런 느낌 위에는 시나몬 파우더가 잔뜩 올라간 비주얼 커피의 텁텁함이 없어서 더 깔끔하고 시원한 맛이었고 왜 파란색인지는 잘 모르겠지만? 크림 콤부차라는 메뉴 자체가 신기했음 다음은 무려 세 가지 소스와 같이 나오는 찹쌀떡구이 완전 바삭바삭하고 쫀뜩해서 뜨거울 때 바로 먹어줘야 함 가위까지 같이 주셔서 간편하게 잘라먹었다 ㅎ 먼저 유자청은 상큼한 맛이 괜찮았고 유자향이 세게 나서 담백함은 좀 사라지는 느낌 이렇게 꽃까지 예쁘게 플레이팅 된 게 조청이었는데 역시 떡+조청 조합은 말해 뭐해 누구나 아는 맛있는 맛 그리고 진짜 맛잘알이신 분들 김에 기름장 조합? 너무 좋아 김도 엄청 많이 나와서 참기름+간장 고소한 맛에 짭짤한 맛까지 이게 원픽 소스 🫶 먹으면서 느꼈던 점은 진짜 외국인들이 많이 와서 떡의 매력을 알았으면 하는 맘 . . 이런 쫄깃쫄깃한 식감이 호불호가 많이 갈린다고 하지만 김에 싸먹으면 또 다를지도 ~ 그리고 나머지 커피 콤부차도 테이크아웃 했는데 이렇게 지퍼백에 담아주셔서 편하게 들고 갈 수 있었다. 커피 콤부차는 아메리카노 같은 건 줄 알았는데 커피의 원두향?이 살짝 나는 콤부차라고 하셔서 오히려 좋아 달지 않고 오리지널 콤부차를 원한다면 이 메뉴 트라이 🙌 직접 콤부차 만드는 것도 보이고 신기했던 카페 색다른 연남동 카페를 찾는다면 추천! 50m © NAVER Corp. 연남동콤부차 서울특별시 마포구 동교로46길 42 1층"
