title,content
연남동 빵집 모리노팡 :: 일본식 빵이 가득한 곳,"안녕하세요, 블링쏭입니다 :) 홍대 연남동에 일본식 빵을 파는 곳이 생겼길래 연트럴파크 가는김에 찾아가 봤답니다. 연남동 빵집 모리노팡 매장은 메인거리가 아니라 골목 안에 위치해 있는데요. 조용한 분위기, 간판, 외관까지 일본 도쿄 골목에 온 것 같은 이국적인 분위기가 물씬 나더라고요~! 안으로 들어가면 아늑한 베이커리 공간이 딱! 나와요. 일본식 빵이 가득가득해서 즐거운 빵쇼핑을 할 수 있는 곳이랍니다♥ 연남동 빵집 모리노팡을 찾은 이유가 바로 야키소바팡 때문이었어요. 일본여행 가면 꼭 사먹는 야끼소바빵을 파는 곳이라서 요거 맛보려고 냉큼 방문한거랍니다. 빵 안에 볶음면이 들어간거라서 든든한 식사빵으로도 좋은데요. 면과 빵을 둘 다 맛볼 수 있으니 일석이조죠 :) 시오바타 설명에는 모리노팡의 시그니쳐 메뉴라고 적혀있길래 냉큼 바구니에 담았어요. 가게의 시그니처는 꼭 먹어봐야 하잖아요! 직접 먹어보니깐, 요건 소금빵과 크로와상의 중간 버젼이라고 생각하면 된답니다. 이외에도 귀여운 캐틱터 빵도 있었고 소금빵, 소세지빵, 식빵, 카레빵, 메론빵 등등 베이커리 종류가 엄청 다양했어요. 취향껏 골라먹는 재미도 있는 연남동 빵집이니깐 이것저것 다양하게 골라보세요 :) 멘타이바게트도 맛있어 보이던데 다음에 모리노팡 가면 이거 사올거에요 전♥ 바로 먹어야 더 맛있으니깐 욕심없이 먹을만큼만 사왔는데 조만간 다시 가서 새로운 종류의 빵을 맛봐야겠어요. 창가쪽 말고 카운터쪽에도 이렇게 또다른 빵이 있으니깐, 놓치지 마세요. 모리노팡 서울특별시 마포구 연남로3길 22-16 101호 연남동 빵집 모리노팡의 위치는 위의 지도로 확인해주시고요. 경의선숲길공원에서 살짝 골목안으로 들어가면 조용한 곳에 매장이 있답니다. 너무너무너무 좋아하는 야끼소바빵! 일본 못간지 오래되었는데 연남동에서라도 맛볼 수 있으니 참 좋네요. 단면을 보면 볶음면으로 가득 채워져있어요. 소스는 생각보다 더 이국적인 맛이 나서 새로운 맛의 빵을 찾는 분들에게도 좋을거랍니다. 아래 빵은 모리노팡의 시그니쳐인 시오바타인데 쫄깃하고 부드러우면서도 담백한 맛이라서 너무 맛있게 먹었어요. 요건 꼭! 필수로 드셔보세요 :) 홍대 연남동에서 맛보는 일본식 빵! 새로운 맛을 느껴보세요."
"11월 2nd 주간일기 [명동분지로, 연남동식빵 모리노팡, 쿄다이텐동, v122sam]","한국에 단 한곳뿐이라는 분지로 명동본점 ㅎㅎ 여백의 미 느껴지는 내 주먹만한 등심돈까스 . . 돈까스 먹고 아쉬움에 배 문지른건 첨인 듯 샐러드 소스가 독특하니 맛이 아주 좋았다. (오리엔탈에 유자섞었나 ?) 분지로 한국본점 서울특별시 중구 남대문로 81 롯데백화점 본점 13층 #명동맛집 #명동돈까스 #명동분위기맛집 . . 근처 카페서 도란도란 ㅎㅎ 얻어먹어서 무슨까페였는지 기억이 안남 ;; #명동나들이 . . 노패킹 수경으로 바꿨따. #v122sam #블레이드수경 이렇게 영롱할 일인가 #수영일기 #수영도템빨 사용후기 아주 만족스럽 ㅠ 시야가 탁 트이고, 코걸이 잘 맞추니 물 안들어온다. 역시 운동은 템빨 ㅎ . . 내가 만든 고오오급 포도잼은 고오오급 식빵에 발라 먹어야 그 맛이 극대화가 되기 때문에 동네 식빵맛집 열심히 서칭했당!! 연남동 모리노팡 연남동 골목 구석탱이에 숨어있어서 겨우 찾음 ;; 마감 직전인데 빵이 많이 남아있었다. 일본 빵집 그대로 옮겨놓은 것 같당. (연남동 첫인상 골목골목 일본스런 느낌이 있다 싶었는데 역시나 일본풍 맛집이 계속해서 들어서고 있다는) . . 우왕 식빵 한장씩도 팜!! 시식용으로 딱임 촉촉~하고 결대로 죽죽 찢어먹는 맛이 일품임. 모리노팡 서울특별시 마포구 연남로3길 22-16 101호 #연남동식빵 #연남동빵맛집 #연남동주민추천 . . 치킨마루에서 치킨 픽업해가는데 줄이 어마어마;; 젊은사람들이 방어회를 그렇게 좋아했었나 ?! . . 홍대 프리모바치 첫방문 (언제적 맛집 ?..) 여기가 맞나 싶은 허름한 건물에 들어서니 맛집은 맛집인지 손님이 가득했다는 빠네크림파스타 명불허전.. 얼마전에 류수영님 원팬크림파스타 따라 만들어먹고 이제 안사먹어도 되겠다 했지만 역시 그 생각은 취소하기로 했다. 프리모바치오바치 홍대본점 서울특별시 마포구 와우산로23길 44 식후 산책 은행잎이 많이 떨어졌다. 잠시 앉아 커피도 마시고 .. 이제 가게마다 성탄절 분위기 물씬 올해 하반기는 역대급으로 시간이 빨리간 듯 하다. . . 텐동 먹으러 왔다. 요리 직관 꿀잼 ㅎㅎ 주방이 정말정말 깔끔했음 ! . . 오 생맥주가 3,000원 이날 첫손님 버프도 있겠지마는 퀄리티 최상 재료를 깨끗한기름에 튀겨놓는데 결정적인 요리하시는 분 포스가 보통이 아니었다 ;; 연남동 텐동은 이제 여기로 가세여 ㅠㅠ 머지않아 줄서서 먹는 대박맛집이 될 듯 쿄다이텐동 서울특별시 마포구 동교로38길 33 지1층 2호 #연남동맛집 #연남동내돈내산 #연남동텐동 #홍대맛집 #홍대텐동"
연남동 모리노팡 🐨,"평화로운 일요일 🌵 언니가 집에 왔다. (반찬가지러) 우리 가지 산책 시킬 겸 나왔는데 전에 지나가다 여러번 본 곳, 모리노팡 🥐 빵집이다. 며칠 전에 왔다가 문닫어서 집에 돌아감 ㅠㅠㅠ.. 연남동 모리노팡 일본 빵집에 온 듯 한 느낌 🇯🇵 도그빵보고 강아지 빵이라고 생각했던 나 ㅋㅋㅋㅋㅋㅋㅋ 직원분이 핫도그 전용빵이라고.. ㅎㅎ🌭 나 빵 살 때 까지 기다리는 언니와 가지💜 미용하러 갈 때 됬네.. 더벅머리보소 모리노팡 언니가 집 올 때 빵을 가져와서 많이 사긴 그렇고 딱 하나만 골랐다 .. 모리노팡 스토리에 오사카 도톤보리 위치태그하기 ㅋㅋㅋㅋㅋㅋㅋㅋ 일본인척하기 😎 안에 초코 들어있다길래 이걸로 고름 ! 코알라 졸귀 결제는 언니가 ㅎㅎ 사랑행~ 💳 🤟🏼 모리노팡 내일 출근 전에 먹어야지 집와서 냉장고에 넣어버렸다 내일 보장🐨"
연남동 맛집 모리노팡 내돈내산 후기 - 소금빵 맛집으로 인정 탕탕!,"연남동 맛집 모리노팡 내돈내산 후기 영업시간: 화-목 11:00-20:00(월요일 휴무) 추천메뉴: 시오바타 한줄평: 담백하고 부드러운 맛이 가득한 빵들! 연남동 소금빵 맛집으로 인정! 연남동 맛집 모리노팡 외관 회사분께서 회사 근처에 빵집이 생겼는데, 맛있다고 하셔서 점심시간에 후딱 다녀왔다! 외관에는 일본어로 모리노팡이라 쓰여있는데, 일본어를 모르는 나에겐 간판이 눈에 잘 안띄었다 ㅎㅎㅎ 그냥 일본어 쓰여있음 모리노팡에 맞게 오신 것입니다 ㅎㅎㅎ 연남동 맛집 모리노팡 메뉴들 모리노팡은 내가 갔을땐 가오픈 기간이었는데 처음 가서 먹고 맛있어서 다음날 또 가서 구매했다 ㅎㅎ 진짜 담백하고 짭쪼롬하고 맛있어서 천편일률적으로 달기만 했던 빵이 지겨워질 찰나에 굿굿! 모리노팡 내부에 가게 규모에 비해 식빵과 디저트 빵을 비롯해 여러 종류의 빵을 판매하도 있어서 눈도 재밌도 다양한 맛을 맛보기 좋다!! 감태가 올라간 남편과 나의 최애 명란바게트도 구매하고~ 요즘 대세라는 소금빵(시오바타)도 구매! 또 그 옆에 요즘 보기 힘들었던 메론빵도 구매! 엄마를 위해선 단팥빵구매! 그외에 내가 사지 않은 (앞으로 구매할)빵들 ㅎㅎㅎ 이곳이 식빵이 추천 메뉴던데 집에 베이글이 쌓여있어서 베이글 다 먹으면 사기로 ㅎㅎㅎ 그외에도 여러 사고싶은 빵들이 짱 많다 여긴 디저트류~ 이렇게 몇몇개 사서 집으로 귀가 ㅎㅎ 먹느라 바빠서 구매한 빵들을 모두 사진으로 담지 못했다!! 메론빵 옛날에 유행했었던 메론빵! 겉이 소보로빵처럼 바삭바삭하고 한입물면 메로나향(?)이 부드럽게 입안가득 퍼져 맛있다! 소금빵(시오바타) 진짜 맛있는데 가격도 혜자임! 처음 가서 사먹고 짭쪼름하면서도 담백, 심지어 부드럽기까지 해서 꽂혀버렸다! 다음날 또 가서 사먹었을 정도로 마성의 메뉴! 진짜 소금빵 맛집으로 강력 추천이다! 그외에 명란바게트도 맛잇어서 다음에 또 어떤 메뉴를 먹어볼까 궁금한 집이다! 연남동 맛집, 소금빵 맛집으로 인정~~ 모리노팡 서울특별시 마포구 연남로3길 22-16 101호"
"망원동 가족모임/연남동 빵집 모리노팡/연남동 주막 털레기수제비,쭈꾸미볶음","지난 12월 24일 오랜만에 외가식구들과 가족모임을 했다. 코로나며 개인일정이며 매번 모임때마다 부득이하게 빠지다가 오랜만에 가족모임 참석! 망원 수산시장에서 방어, 광어, 육회도 떼어오고 치킨도 종류별로 시키고, 바지락술찜도 해먹구 배 터지는줄~ 먹다가 2차전을 앞두고 사촌동생이 갑자기 소금빵 타령;;;;; 근처에 맛있는 소금빵 집이 있다길래 맥주, 바게트 심부름 겸 심부름비 이만원 받고 나갔다옴 개이득 모리노팡 서울특별시 마포구 연남로3길 22-16 101호 연남동 빵지순례로 유명하다는 모리노팡 일본식 베이커리로 동네에서 유명하다고 한다. 늦은 시간이 방문해서 빵 종류가 많지는 않았는데 대부분 클래식한 기본빵이 주력인듯? 음료메뉴 소금빵 있는거 다집어오는 큰손;;; 야 이걸 다 산다고!!!!??? 이랬더니 지가 내일 다 먹을꺼란다. 하나 까서 먹어봤는데 엥? 이것보다 맛있는 소금빵이 올마나 많은데,, 뭐지 왜 찔기고 기름지지 저는 실망이였습니다... 2차전 마왕족발이랑 피자 가실께여~~~ 그리고 새벽까지 이어진 수다;; 네시까지 조잘조잘 다음 날 목아파 죽는쥴 연남동주막 서울특별시 마포구 월드컵북로6길 56 메뉴판 성산동 오면 식사하러 자주 가는 주막 아침 이른 시간인데 진짜 앉을 자리가 없을 정도로 북적북적 딱 운좋게 우리 가족 일행이 앉을 자리만큼만 남아있었다. 털레기수제비는 진짜 양이 엄청 많아서 인원보다 적게 시켜야할듯. 건새우가 가득 들어가있어서 맛이 깔끔하고 맛있었다. 그리고 쭈꾸미정식 얘도 미쳤늠. 불맛나고 엄청 맛있다ㅜㅜ 밥을 주문해서 그릇에 밥이랑 콩나물이랑 쭈꾸미랑 참기름 넣고 챡챡챡챡 비벼먹으면 꿀맛탱 다 먹고 까페에서 커피 테카웃하고 다시 또 수다삼매경 그리고 인계동 와서 또 먹었는디... 666버거 본점 경기도 수원시 영통구 매영로 112 666버거 본점 666버거라고 나만 몰랐샤? 미쳤넹 엄청 맛있네~~ 피티는 가지도 않고 먹기만 드럽게 먹고 역시 돼지가 될 상인가,,,"
[빵지순례] 진짜 일본느낌의 소금빵 맛집 연남동 모리노팡,"#모리노팡 #모리노팡소금빵 #소금빵맛집 #연남동빵집 #연남맛집 #소금빵연남동 #연남소금빵 #연남동일본식빵집 (2022.07월 방문) 일본은 해산물과 디저트가 맛있다는 이미지가 있다 보니 일본식 빵을 좋아하는 사람도 많은 듯. 게다가 요새 인기있는 소금빵도 일본이 유명한데, 연남동 근처를 지나가다가 근처에 소금빵을 파는 일본느낌 빵집을 발견해서 들어가 보았다. 모리노팡 서울특별시 마포구 연남로5길 42 1층 모리노팡 위치는 골목이라 잘 안보이니 저 간판을 찾아보자 오픈은 11시인데 난 이날12시쯤 방문했다 #모리노팡 #모리노팡소금빵 #소금빵맛집 #연남동빵집 #연남맛집 #소금빵연남동 #연남소금빵 #연남동일본식빵집 일본식 빵집이었는데 꽤 본격적인 구성으로 소금빵, 명란바게뜨, 메론빵, 야끼소바빵 등을 팔고 있었다 #모리노팡 #모리노팡소금빵 #소금빵맛집 #연남동빵집 #연남맛집 #소금빵연남동 #연남소금빵 #연남동일본식빵집 야끼소바빵은 파는곳을 잘 못봤는데, 신선한 생강과 짭짤한 면과 고소한 빵이 잘 어울렸고 소금빵(시오버터빵)은 최근 먹은것중 제일 괜찮았다. 소금빵은 속은 쫄깃하고 겉은 바삭해서 맛있었음 #모리노팡 #모리노팡소금빵 #소금빵맛집 #연남동빵집 #연남맛집 #소금빵연남동 #연남소금빵 #연남동일본식빵집 크림시오빵도 굿 하지만 최고 맛있었던건 아래의명란바게뜨! 짭쪼롬한 맛에 감태? 까지 올려져 있어서 베스트 #모리노팡 #모리노팡소금빵 #소금빵맛집 #연남동빵집 #연남맛집 #소금빵연남동 #연남소금빵 #연남동일본식빵집 이날 모임이 있어서 빵만 5만원치 샀다ㅋㅋㅋ 식빵샌드위치도 제법 괜찮음 #모리노팡 #모리노팡소금빵 #소금빵맛집 #연남동빵집 #연남맛집 #소금빵연남동 #연남소금빵 #연남동일본식빵집 팥빵,야끼소바빵 등이 일본느낌 베스트였던 명란바게뜨 대추천 #모리노팡 #모리노팡소금빵 #소금빵맛집 #연남동빵집 #연남맛집 #소금빵연남동 #연남소금빵 #연남동일본식빵집 전체적으로 기본기 좋고 맛있으니 근처 갈 일 있으심 도전해보시길 이상 내돈내산 후기였음 [네이버 지도] 모리노팡 서울 마포구 연남로3길 22-16 http://naver.me/xGbjKoKU 네이버 지도 모리노팡 naver.me #모리노팡 #모리노팡소금빵 #소금빵맛집 #연남동빵집 #연남맛집 #소금빵연남동 #연남소금빵 #연남동일본식빵집"
"[마포구] 연남동 빵지순례, 일본식 빵집, 모리노팡 / 건강한 빵집, 코코리코 / 연남동 빵맛집 / 연남동 베이커리 추천","안녕하세요, 구찌입니다! 오늘은 연남동에 있는 신상 빵집을 알려 드립니다! 빵 맛집 두 곳, <모리노팡>과 <코코리코> 입니다. 방문시기 : 2023년 2월 12일(코코리코) 2023년 5월 6일(모리노팡) 모리노팡 영업시간 : 11:00~20:00 매주 월요일 휴무 제품 소진 시 조기 마감 information 🚙 주차장 : 없음 ☎️ 문의전화 : 0507-1334-1360 🏠 주소 : 서울 마포구 연남로5길 42 1층 모리노팡 모리노팡은 동경제과를 수석으로 졸업하고 독일 세계 제빵 월드컵 등 세계대회를 섭렵한 일본의 유명 셰프 쿠라타 히로카즈의 수제자인 브레드 아티스트가 만든 빵을 판매하는 곳이라고 합니다. 이름이 너무 마음에 들어요, 모리노팡. '숲의 빵'이라니...! 💖 모리노팡은 2023년 3월 22일, 현재 위치로 이전 한 거라고 해요. 어쩐지 처음 본다 했어...ㅎ 모리노팡, 외관만 봐도 일본 스러운 느낌! 나무나무 입간판과 일본어, 그리고 귀여운 로고까지. 모리노팡의 입간판이 나와 있는 외관 / 모리노 팡 카운터 쪽 결국 궁금해서 모리노팡으로 들어가서 빵을 구입해 봤어요. 모리노팡 내부 모리노팡은 입구에 들어서자마자 왼쪽과 정면에 쭉 빵이 진열 되어 있고, 왼쪽 진열장 너머로 작은 테이블석이 4개 정도 있어요. (아득합니다!) 모리노팡의 빵 진열대를 둘러 볼까요? 모리노팡은 빵들이 모두 위생적으로 비닐 포장 되어 진열 되어 있어 안심!!! 귀여운 토끼, 코알라, 고양이 얼굴 모양의 빵들은 모두 초코 크림을 베이스로 한 빵들이라고 해요. 일본스러운 빵인 야끼소바 빵, 카레빵을 먹었는데요, 카레빵이 맛있었어요! 야끼소바빵은 제 스타일은 아님....ㅋㅋㅋㅋ 너무 짜요. 예전에 일본에서도 먹어봤는데, 이렇게 똑같이 짰어요 ㅋㅋㅋㅋㅋㅋㅋ 모리노팡에서 초코 베이스의 토끼빵을 못 사먹어봐서 조금 아쉬웠어요! 다음에 모리노팡에 또 가서 토끼빵과 카레빵을 사 와야겠어요 ㅎㅎㅎ 좀 더 다양한 일본식 빵메뉴를 찍었어야 하는데 귀여워서 그랬는지 동물 빵만 잔뜩 찍었네요 ㅋㅋㅋ 낭패닷 ㅎㅎㅎ 아무튼, 모리노팡은 조용하고 아기자기 한 느낌의 빵집인데다가 테이블석도 있어서 좋았어요. 일본은 빵 스타일이 굉장히....먹을 때 가벼운(?) 느낌이고, 크기가 아담해요. 이번엔 연남동 식사빵 맛집 소개합니다! 코코리코 영업시간 : 11:00~20:00 매주 월요일 휴무 information 🚙 주차장 : 없음 ☎️ 문의전화 : 0507-1447-0734 🏠 주소 : 서울 마포구 동교로39길 4 1층 코코리코가 '꼬끼오'라는 뜻이래요 ㅎㅎㅎㅎㅎ 신선하고 건강한 빵으로 아침을 맞이하겠다는 뜻이라고 합니다. 천연발효종으로 저온 숙성하여 빵을 만들어 감칠맛 나고 풍미가 뛰어나며, 긴 숙성과정을 통해 유산균이 생성되어 밀의 당과 전분을 분해하기 때문에 먹어도 속이 편한 빵이라고 합니다. 빵맛집 코코리코 작은 빵집 코코리코, 신상 빵집입니다! 코코리코는 빵 비주얼이 어마무시해요 ㅎㅎ 진짜인지 아닌지 모르겠지만, 벽 쪽에 빵이 진열되어 있어요. 실제 판매하는 빵은 따로 앞에 진열되 있고, 높은 유리막으로 막혀있어 위생적인 편. 작지만 먹음직스러운 빵들 만으로도 충분히 멋진 인테리어가 된 신기한 빵집! ㅎㅎㅎㅎ 전체적으로 아주 따뜻하고 고소한(???) ㅋㅋㅋ 분위기입니다 ㅋㅋㅋㅋㅋㅋㅋㅋㅋ 코코리코 내부 곳곳 코코리코에서 일하는 분이 남자 분 한 분, 여자분 한 분 계셨는데, 친절 하셨어요~!! 인스타 보니까 남자분이 사장님이신 듯? 코코리코 포카치아도 너무 맛있어 보이고, 잠봉뵈르도 궁금...! 이런저런 식사빵들도 다~~ 맛있어 보이는데요, 치즈 브레첼 사 먹었는데 맛있더라고요! 뭔가 우오오....! 너무 맛있어...! 이런 느낌이라기 보다는, 한 입 먹고 나니 계속 먹게되는 그런 느낌이랄까? ㅎㅎㅎ 바게트도 사서 그냥 우적우적 먹었는데, 맛있었어요. ㅎㅎㅎ 근데 식사랑 곁들여 슬쩍 버터에 구워 먹으면? 세상 맛있을 듯.....꺄악 오호.....식사빵 맛집 찾기 어려운데.... 찾았다..!! 빵 봉지 찰칵 ㅋㅋ 유러피안 베이커리 코코리코, 라고 써 있네요 ㅎㅎ 여러분도 식사빵 맛집 찾고 계시다면, 건강한 빵집 코코리코, 한 번 들러 보세요!!! 여기 식사빵 진짜 강추!!!! 모리노팡 서울특별시 마포구 연남로5길 42 1층 모리노팡 코코리코 서울특별시 마포구 동교로39길 4 1층 유투버 블로거 구찌 빵 사랑 디저트 사랑"
[연남동/베이커리] 나만 알고 싶지만 공익을 위해 공유 - 모리노팡베이커리,"진심 나만 알고 싶은데 공익을 위해 공유함 알려주기 싫은 사유 : 빵 사기 빡세질까봐 알려주고 싶은 사유 : 그래도 한국인의 정으로 공익을 위해 공유함 모리노팡베이커리. 동경제과학교 졸업하신 분이 연남동에 만드신 빵집 원래 근처에 있었는데 확장이전! 하셨다고 함. 매주 월요일 휴무 11시 오픈, 빵 조기소진되면 마감.. 🥲 여러분 메이를 위해 빵 살살 사주기야 약속 나도 사야되니까.... 매장이 확장이전되며 앉아서 먹을 수 있는 자리가 생김 작고 귀엽다 난 맨날 테이크아웃함 빵 라인업 약간 간식빵 종류가 많음! 야끼소바빵도 팔아욤 맛있음 굿~ 나는 여기 메론팡을 좋아해. 맛있음 소보로빵이랑 뭐가다르냐고? 달라 다르다고요 여기 소금빵두 맛있음 굿임 다양한 종류의 소금빵이 있음 뭐가 하나씩 비어보이죠? 당연함 메이가 삼 동물빵! 안엔 초코가 들어있구 원래는 코알라만 나왔는데 고양이도 나오기 시작함 토끼도 있음 또 고양이가 비어보인다고요? 당연함 메이가 삼 언젠간 카츠산도 등등도 사볼 것이다 이 글을 읽고 가서 사볼 사람들 메이를 생각해서 살살 사주셨으면 좋겠어여... 나도 사야할 거 아니겟읍니까..? ㅜㅜ 냉장고엔 크림 종류 빵이 준비되어 있음 매장 전경. 작고 아담하고 귀엽고 아늑함 모리노팡 영원하라 여기는 진짜 식빵이 미친놈임 트위터 호들갑 인스타 호들갑 블로그 호들갑이 아님 나는 식믈리에임 (식빵 소믈리에) 특히 아무것도 안 바르고 생으로 먹는 사람임 그래서 식빵 퍽퍽하고 맛없으면 입도 안 댐 근데 여긴 찐임 걍 생으로 뜯어먹어도 하나도 안아쉬움 굿임 진심 식빵을 드셔야됨 알겠죠? 한칸씩도 파니까 일단 드셔봐 근데 중요한거 메이 생각해서 조금만 사시기 나도 먹어야 할 거 아니에요... ㅠ 모리노팡 베이커리에서는 커피도 팔아요 커피 굿~ 종종 사감 아이스 아메리카노. 마싯슴 굿~ 고소한 원두 산미 좋아하는 사람들은 다른 데 가서 드세여 난 먹을거임 평일에는 토스트도 서비스로 주심 15명 한정이니까 제발 메이꺼 남겨주기 약속 표창장도 받으신 듯함 동경제과학교 졸업장 있으면 난 일단 믿고 먹는다 오늘도 커피를 한 잔 사갑니다 맛있겟죠? 맛있음 ㅇㅇ 아 5월 21일까지 신촌현백에서도 팝업한다니까 들러봐도 될듯 여튼 오늘의 마지막 전언 가셔서 드시더라도 메이꺼 남겨두기"
[연남동 베이커리] 일본감성이 가득한 빵에 진심인 베이커리 ‘모리노팡’ 내돈내산 솔직후기,"서울 연남동 베이커리 추천 모리노팡 모리노팡 서울특별시 마포구 연남로5길 42 1층 모리노팡 날이 너무 좋은 날 점심시간에 연남동 베이커라 모리노팡에 다녀왔습니다. 너무 자주가는 단골집이라 많은 분들께 소개해드리고 싶어 이 포스팅을 쓰게 되었습니다! 전국의 빵순이, 빵돌이 여러분들 주목하세욧 로고가 너무 귀엽지 않나요? 모리노팡 만의 일본감성을 듬뿍 담은 입간판입니다. 야외에는 작은 테이블 좌석이 있어 날 좋을때 야외에서 빵과 커피를 즐겨보셔도 좋을 것 같습니다! 매장안에는 지브리 소품이 여기저기 놓여 있습니다! 토토로 안뇨옹 귀여운 그래픽의 빙수 포스터와 뽀인츠로 빙수 피규어까즤 이건 카운터 근처에 있던 지브리 피규어인데요.. 너무 감성적이고 이뻐서 저도 하나 장만하고 싶었네요 🥹 전체적으로 카운터쪽과 입구쪽 두가지 구역으로 디피되어 있습니다! 저기 뒷부분에 자리 테이블 있어요…! 초보 블로거는 아직 손님들 계실때 사진찍기 부끄러워 소심하게..찰칵 입구쪽에도 작게 좌석이 있습니다! 생각보가 앉아서 먹을 공간이 많습니당 이건 그냥 우산꽂이도 귀여워서..❣️ 회사 근처라 자주 와서 자주 먹어봐서 아는데요.. 모리노팡 식빵은 진짜 정말 완전!!!! 맛있습니다… 꼭 드셔보셔야해요 ㅜㅜㅜ 촉촉하고.. 결대로 사르르 찢어지는 식감의 식빵입니다.. 야키소바빵은 일본의 맛 그대로! 너무 맛나용 메이플 프렌치 토스트와 명란 바게트는 제 최애..😘 동물 모양 빵도 많은데요 비주얼도 귀엽구 맛도 좋답니당 아직은 먹어보지 못했지만 너무 맛있어보이는 빵들 생크림이 낭낭하게 들어가있는 빵은 냉장보관 되고 있습니당! 모리노팡은 커피도 함께 판매하고 있습니다! 음료 메뉴 옆에 깨알 음료 자판기 피규어가 너무 귀여워요 ㅋㅋ큐ㅠㅠ 평일한정 커피를 구입하시는 분들에게 선착순 15분께 식빵을 구워주신다네요! 저도 그 이벤트 한번 참여해 보았는데용.. 노릇노릇 구워진 식빵위에 버터 한조각도 올려주시는 센스 ㅠㅜㅜ 커피랑 너무 잘 어울려서 행복하게 먹었답니다. 빵을 좋아하신다면 연남동 들르실때 꼭 들르셔야 할 일본감성 낭낭한 베이커리 모리노팡 리뷰였습니다! 모리노팡 서울특별시 마포구 연남로5길 42 1층 모리노팡 위치는 이곳입니다★彡"
