title,content
홍대 연남동카페 하나부터 열까지 모든게 귀여운 카페테틈,"홍대 연남동카페 하나부터 열까지 모든게 귀여운 카페테틈 🐻 내일로 KTX 기차 예약이 다 차서 혼자 먼저 서울에 오게 되었는데..... 어디가지 고민하다가 예전에 저장해둔 카페테틈에 가기로 결정!!! 진짜 너무너무너무너무 귀여워서 오길 잘했다고 생각했다 아마 이번 포스팅에 귀엽다는 말 999번 할듯... ㅎㅎ 홍대입구역에 내려서 캐리어 질질 끌고 도착한 이곳 카페테틈!!!!! 딱 도착하자마자 햇살 드는거 뭐냐구,,,,, 입간판부터 귀여워 카페테틈 영업시간 12:00 ~ 20:00 매주 월요잉 정기휴무 서울 마포구 동교로36길 15 1-2층 홍대입구역 3번출구에서 419m 12시 오픈인데 12시 딱 맞춰서 도착했다~~~! 테이크아웃 하면 천원 할인! 하지만 너무너무너무 귀여우니 앉아서 귀여운거 가득가득 구경하고 가세욥 누구랑 같이 갔으면 여기 앉아서 ... 사진찍어달라고 했을텐데 혼자라서 그냥 배경만 찍기... 유리창도 귀엽기 있냐구 ㅠㅠ 깔끔한 카페테틈 내부 주문하고 음료만드는 공간과 옆에는 굿즈를 판다! 굿즈는 나중에 다시 내려와서 구경함~~~ 카페테틈 메뉴 가격 곰돌이 얼음인 밀크티, 카페라떼 도 많이 먹던데 나는 커피를 안먹으니 패쓰,, 팬케이크 플레이트도 너무 귀엽던데!!! 혼자 먹기엔 부담스러워서 흡 ㅠㅠㅠㅠ 담에 또 가면 누군가와 함께. 팬케이크도. 먹어주게써. 진짜 컵들도 음료도 디저트도 다 넘 귀엽다 ㅠㅠㅠ 귀여운 조각케이크도 있어요~~ 테틈 쿠키도 꼽혀 있어요~~~! 앙버터도 테틈 모양이라 엄청 귀엽던데......!!! 하지만 치케 먹고 싶어서 바스크치즈케이크 시켰다 메뉴 주문해두고 옆에 애플 모니터가 있길래~~~ 이런게 아이맥인가....? 사과로고 완전 간지나~~~ 사진 찍히는건줄 알고 촬영 버튼을 막 눌러봤는데 촬영은 안되는것 같았다 아이맥 주위로 테틈 액자 걸려있는거...... 너무 귀여운거 아니냐고요 ㅠㅠㅠㅠㅠㅠ 산타테틈과 루돌프테틈이 손흔들어주자나~~~~ 사진이 안찍히는것 같으니 일단 내 카메라로 라도 찍어보자 ㅋㅋㅋㅋ (... 알고보니 나 다 찍혀서 저장 되어 있는거 아녀...? ㅋㅋㅋㅋ큐ㅠㅠ) 입구쪽에는 귀여운 테틈이! 산타망토를 두르고 산타모자를 쓰고 앉아있다 너모 귀엽자나 ㅠㅠㅠㅠㅠ 트리에도 테틈 인형 걸려있음,,,,, 너무너무너무 귀여워 유ㅠㅠㅠㅠㅠㅠㅠㅠ 사장님은 좋겠다...... 이렇게 귀여운거 많을거 아니야..... 2층에는 이렇게 심플한 자리들이 있다! 항상 카페나 식당에 가면 사람들이 앉아있어서 매장 사진 찍기가 어려웠는데 아무도 없어서 편하게 찍었다~~~! 오픈런의 효과인가 ☆ 깔끔한 2층! 화이트 인테리어에 빨간 포인트가 넘 이뻤음! 빨간 곰돌이도 넘 귀엽자나! 그래서 내가 혼자서 시킨 메뉴는!! 메론소다 바스크치즈케이크 메론소다 파는곳 잘 없는데~~ 아주 조와 메론소다에 바닐라 아이스크림 국룰. 데코 체리까지 딱이당 너무 귀여워!!!! 🍒 처음에 자리잡은곳도 좋았지만 뭔가 아쉬워서 안쪽으로 옮겨 앉았다 아무도 없어서 ... 편하게 자리 옮기기 가능~~ 이 자리 넘 이뿌다.... 여기 앉아서 사진찍으면 이쁠것같은데 아쉽게도 찍어줄사람이 없군....! 카페에서 삼각대는 무리쓰...ㅋㅋㅋㅋㅋ 귀여운 메론소다, 치즈케이크와 함께 테틈 컵 코스터 너무 귀여운거 아니냐구 ㅠㅠㅠㅠ엉엉 구냥... 다 귀엽다..... 올라가있는 체리마저 귀엽다... 테틈인형이랑 컵들이 놓여져 있는 반대쪽 벽 그냥 컵이 아니라 테틈이 새겨져있는 컵이라 짱귀여움 테틈 그자체 고개를 여기로 돌려도 테틈 저기로 돌려도 테틈 테틈테틈테틈테틈귀여워!!!!! 이렇게 넓은 4인석 테이블도 있다~~ 너모 귀여워서 여기다 놓고도 찰칵 너무 열심히 찍은탓에 점점 아이스크림이 녹아서... 결국 체리 사망 ㅋㅋㅋㅋㅋㅋ 🍒 : 살려줘........ 사실 나는.... 사진이 더 중요하기 떄문에 아이스크림이 녹든 말든 뜨거운 음식이 식든 말든 상관이 없다... (아 물론 아이스크림이 녹아 피사체가 망가지는건 상관 있다) 근데 같이 간 사람이 그걸 중요하게 생각한다면....!?!! 후다닥 찍고 먹어야 하는데 혼자니까 그런거 신경 쓸 필요없이 맘껏 찍어도 되니 그건 좋당ㅎㅁㅎ 다찍고 이젠 음료랑 케이크 먹기~~~! 포크를 집고 있는 내 손톱이 너무 귀여버성 ㅎ 오른쪽 엄지 손톱이 포크랑 색이 맞아서 너무 귀여웠는데 차마 왼손만으로 카메라를 들고 사진을 찍을수가 없어서,,, 산타는 폰카로 찍음 ㅠㅠ 아쉬워 오른손으로는 한손만으로 왼쪽 루돌프 엄지 찍었다 물론 초점이 자꾸 안맞아서 수동초점 해두고 찍음!!! 혼자 먹고 있으니 슬슬 손님들이 오더라 이건 옆테이블에서 시킨 팬케이크 슬쩍 찍어봤다 카페테틈은 반려견 동반 가능 카페라서 귀여운 멍멍이들과 함께 온 손님들도 계셨다!! 푸들친구 너무 귀여워서 혹시 사진을 찍어도 되는지 허락 맡고 몇 장 찍었다! 너무너무 귀여웡 ㅠㅠㅠㅠ 인스타 아이디 받아서 DM으로 사진도 보내드렸는데 이쁘다고 감사하다고 해주셔서 괜히 뿌듯... 이쁜 멍뭉이 담게 해주셔서 제가 더 감사합니다😍 같이 온 시츄도 너무 귀여웠다!!! 눈 색깔이 너무 매력적이야 넘 이뻐 ㅠㅠㅠㅠ 멍뭉이들 옷입은것도 가방 맨것도 정말 다 귀엽다 ㅠㅠ 그러고 난 혼자 거울샷도 찍어주고,,, 테틈인생네컷 프레임 찍으러 내려왔다 2층에서 1층으로 연결된 계단을 내려와서 코너를 돌면 옆에 포토이즘 부스 있다! 처음에 인생네컷 부스가 안보여서 이 매장이 아닌가 싶었는데 직원분께 여쭤보니 부스 위치를 알려주셨다! 매장 뒤쪽에 있으니 꼭꼭 찍고가세요! 넘 귀여버 포토이즘 X 테틈 테틈 프레임 종류도 진짜 많고 다 귀여워서 고르기 어려웠다 ㅠㅠㅠ 테틈 인스타그램에 프레임 나와있으니 미리 보고 가는것도 좋을듯!! 혼자서 처음 찍어본 인생네컷 ㅋㅋㅋㅋ 근데 부스 안이 좁고 내가 키가 너무 작아서 그냥 서서 찍으니 이상하더랔ㅋㅋㅋ 결국 한컷찍고 이건 아니다 싶어 의자에 올라가서 스쿼트하는 자세로 찍음 엉거주춤 ㅋㅋㅋㅋㅋ 허벅지 터진다.. 동영상보면 허벅지 아파서 자꾸 내려갔다 올라갔다 하는게 보임 ㅋㅋㅋㅋㅋㅋ 그래도 이러나 저러나 사진 잘나왔으니 만족! 테틈 프레임!!!!!! 너모 귀여워 ㅠㅠㅠㅠㅠ 이것 말고도 진짜 이쁜 프레임 많았는데... 고르기 힘들었다 굿즈 구경하러 1층 내려왔는데 아까보다 빛이 이뻐서 다시 찍은 산타테틈 귀여운 선물상자까지! 크리스마스 느낌 뿜뿜이다 ㅠㅠㅠ warm inyour mind, deep in your life - 테틈과 함께하는 일상, 카페로도 만나보세요 :-) 카페테틈 소개글인데 좋아서~~~! 꾸며져 있는 테틈 다이어리 나 다이어리 안쓴지 오래됐는데... 이거 보고 뽐뿌옴 1월 1일부터 다시 도전...? 귀여운 엽서랑 편지지도 있구 리무버블 스티커도 많다 귤테틈 진짜 귀여운거 아니냐고 ㅠㅠㅠㅠ 제주도에도 카페테틈 생겼던데.... 거기도 너무 예쁘던데 ㅠㅠㅠ 담에 제주도 가면 가봐야겠다 스티커도 넘나 귀욥 문구 덕후들 눈 돌아가는 소리 들린다 내 눈도 핑핑 돌아감 ㅠㅠㅠㅠ 결국 테틈 다이어리, 스티커, 엽서 사버렸다 귀여움 앞에 장사없지 미세 오염, 미세 스크래치 등으로 B급 다이어리 싸게 팔길래 바로 줍줍 다태기 심하게 왔지만... 내년부터 다시 열심히 써보는걸로! 귀여운 스티커들 사지만 말고 쫌 써보자!! 테틈 맨 처음에 겨울이야기로 스티커 나왔을때부터 알고 샀었는데 이제는 안경쓴 곰돌이로 자리잡고 카페도 생기고 여러 브랜드랑 협업하는 모습을 보니 넘 신기하고 멋있다!!! 귀여운 굿즈들도 많이 탄생해서 좋구,,, 이런 귀여운 카페가 생긴것도 넘 좋구,,,, 역시 귀여운게 나라를 구한다 테틈 최고! 카페테틈 서울특별시 마포구 동교로36길 15 1-2층 #연남동카페 #카페테틈 #홍대테틈 #홍대카페 #홍대놀거리 #연남동놀거리 #홍대데이트 #테틈 #홍대메론소다"
"카페테틈 / 연남동 카페 겸 소품샵, 아기자기한 귀여운 감성 가득 ♪","안녕하세요, 냠밍 입니다 😋 오늘은 서울에 다녀온 카페 기록을 남겨볼까 합니다 ♪♪ 연남동에 위치한 카페 테틈 에 다녀왔어요 ! #내돈내산 #솔직후기 s t a r t - 𖤐 카페 테틈 연남점 📍 서울 마포구 동교로36길 15 1-2층 ⏰ 12:00 - 20:00 / 정기휴무 매주 월요일 ❤️ instagram @cafe.teteum , 전화문의 x 빨간 안경을 쓴 곰돌이 캐릭터, 테틈을 아시나요? 제가 정말정말 좋아하는 캐릭터인데요, 인스타에서 유명한 캐릭터에요! 테틈(@te.teum) • Instagram 사진 및 동영상 팔로워 58K명, 팔로잉 3명, 게시물 428개 - 테틈(@te.teum)님의 Instagram 사진 및 동영상 보기 instagram.com 이 사진은 제가 충동구매 한 화장품과 사은품들 이랍니다 ♪♪ 제가 얼마나 테틈에 미쳐있는지 보이시죠 ❓ 너무 애정하는 테틈 컵!!! 제가 찍은 이 사진은 무려 5.6만 팔로워를 보유한 테틈 인스타그램에도 올라가있답니다 ♡ 아무튼 제가 애정하는 이 테틈 캐릭터가 카페로 탄생-했었는데요, 드디어!! 가보게 되었답니다 𖤐 카페테틈은 연남점, 제주점이 있어요! cafe & store 카페 겸 소품샵인 이곳, 카페테틈 들어가기 전부터 크리스마스 감성 가득했어요! 1층은 카페 주문을 할 수 있는 공간이에요 2층이 커피 마시는 공간이라서 일단 2층에서 자리를 잡고 왔습니다 :) 2층 올라가는게 귀찮지만.. 괜찮아요 귀여우니까 ^◡^ 생각보다 자리는 꽤 있었는데, 사람이 가득했어요 다행히도 제가 딱 갔을때쯤이 사람 빠지는 타이밍이라 자리를 고민해서 앉았어요 (평일 4-5시 쯤 갔어요) 2층 방 안 공간(?)으로 자리 잡았어요 여긴 4인석도 있더라구요! 자리마다 있었던 소지품 보관함은 테이블이 작은데 가방 보관하기 좋았어요 ꒰⍢ ꒱ 자리 맡아놓고 다시 1층 가기.. ♪♪ 카페 테틈 연남점의 1층 내부입니다 4시 넘도록 아무것도 안먹은 불쌍한 둘이 주문하러 내려왔어요 극한의 배고픔을 느꼈습니다 -` 메뉴판 ´- 카페 테틈 메뉴판 입니다 와이파이 비밀번호, 펜케이크 과일 변경 등에 대한 정보도 담겨있어요 대표메뉴는 팬케이크 플레이트 / 베베밀크티 / 베베 큐브라떼 팬케이크는 겨울과일 딸기로 제공된대요 🍓 밀크티와 라떼 모두 8천원 이에요...! 엄청난 가격이지만 귀여우니까요.. (ᯅ̈ ) 시즌메뉴 메뉴판도 가져왔어요! 겨울 시즌메뉴로는 고구마라떼 / 쑥떡라떼 / 딸기에이드 가 있어요! 카페테틈에는 귀엽고 맛있는 음료가 다양하게 있어서 좋은 것 같아요 다만 가격은 비싼 편 .. 𖤐 디저트 메뉴는 이렇게 들어있었어요! 로투스맛 산타 컵케이크 너무 예쁘네요 크리스마스가 온 테틈카페 🎄 대표메뉴를 안시켜볼 수 없었던 우리는 ꔛ 큐브라떼 & 밀크티 를 시키고 디저트는 바스크치즈케이크 를 시켰어요! 동글동글 귀여운 컨셉의 카페 테틈과 잘 어울리는 카페였어요! 음료와 디저트가 준비되는 것을 기다리며 1층에서 소품 구경을 했어요 ♡ 파우치, 필통, 크록스 지비츠, 인형, 에어팟 케이스, 포스터, 편지지, 스티커 등 엄청나게 다양한 소품이 가득했던 카페테틈! 특히 다꾸하시는 분, 문구류 덕후라면 연남동 소품샵으로 추천드려요!! 귀염뽀짝한 스티커가 가득해요 ♡ 1층 소품샵만 둘러보고 가도 되니까요ꔛ 편지지 너무 예뻐서 사고싶었는데 까먹었다. . . 𖤐 포스트잇도 작고 소중해요 ♪♪ 다가오는 2023년이 검은 토끼의 해인거 아시나요?! 테틈이 검은 토끼 들고있는 디테일,, 반해버렸어요 ㅋㅋㅋ (๑・ω-) ❤︎ 자중이랑 사진도 찰칵 찍으면서 구경구경 쓸데 없지만 갖고싶던 것 열쇠고리 인형까지 -!! 주문한 음료가 나와서 가지고 2층에 올라왔어요! 그리고 각잡고 사진찍기 🤳 너무너무 귀여워 큐브라떼 는 연유가 함께 나오는 라떼라서, 연유 뿌리는 동영상도 넣어보았어요 커피 얼음이 녹는데 시간이 걸려서 애매했던(?) 음료 우유도 따로 부먹해야하는 DIY (???) 우유에 잠기는 불쌍한 테틈..은 저희 제작진이 맛있게 먹었습니다.. 밀크티 는 깔끔하고 맛있었어요 그리고 무엇보다 귀엽죠 ! ? ! ? 밀크티 얼음도 사각사각 맛있었어요 큐브라떼보다는 밀크티 추천! 다만 조금 잔인했다 . . . ? 갈려나가는 테틈 머리 … 바스크치즈 케이크 절대 실패없는 디저트 ◡̈ ෆ 촉촉 꾸덕한 맛 최고에요 다른 디저트는 크림이 많아보여서 느끼할까봐 이걸로 시켰는데, 완전 만족! 다른 디저트 6,500원 가격에 비해 천원 더 저렴했던 것도 좋았어요 빨간색 안경이 포인트인 테틈처럼 카페도 빨간색 포인트가 돋보였어요 ^◡^ 안쪽자리는 콘센트도 있어 좋았어요! 귀여운 테틈 사진과 셀카도 찍어보았어요 ꒰⍢ ꒱ 그리고 이걸 빼먹을 수 없죠! 포토이즘 박스에서 사진을 찍었어요 ꔛ 프레임이 테틈이라 너무 귀여워서 좋았어요 !!! 그러나 !!! 겨울이고 외부에 있고 문도 없다보니.. 매우 추워서 힘들었어요 또 내부가 매우 좁아서 저렇게 벽에 밀착해서 찍어도 얼굴이 꽉차게 담깁니다 ^_^ Make it to christmas ! 안녕하세요 여러분의 자중입니다 블챌 끝나니까 영 쓰기 귀찮더라고요 .. 기다렸다고요 ? 감사합니다 이번 ... m.blog.naver.com 모자이크 없는 사진이 궁금하다면 울 자중이 블로그로 - ♪ # 내사랑 조자중 블로그 많관부 # 여기서 찍는거보다는 포토그레이나 인생네컷 등 다른 곳에서 찍는 것을 추천해요! 포토그레이 얼굴크기 줄이는거 보고 세상 반했잖아요,, 개인적인 픽은 포토그레이 ♪♪ 행복했던 자중이와의 연남동 데이트 - ♡ 귀여운 것을 좋아하시는 분이라면 한번쯤 갈만한 카페로 카페테틈 추천드려요! 오늘도 글 봐주셔서 감사합니다 모두 행복한 하루 되세요 ♪ ♡ ♪ 카페테틈 서울특별시 마포구 동교로36길 15 1-2층 / / / 근처 연남동 카페 리뷰 ෆ ෆ ෆ 매버릭스퀘어 / 연남동 카페, 커피와 칵테일을 동시에 즐기는 공간🍹 안녕하세요 ꒰⍢ ꒱♡ 오늘은 리뷰를 미뤄왔던 카페 매버릭스퀘어를 소개할게요! #매버릭스퀘어 는 𖤐 카... m.blog.naver.com ෆ ෆ ෆ PITC / 크리스마스 트리가 예쁜 연남동 카페 𖤐 안녕하세요, 냠밍 입니다 ෆ 오늘은 크리스마스 트리로 아주 유명한 연남동 카페, PITC 에 다녀왔어요 ... m.blog.naver.com"
"연남동 식당&카페 추천 :: 파스타 맛집(오마), 카페테틈","🤍연남동 데이트 코스로 추천하는 식당 카페🤍 내돈내산 방문 후 맛있어서 기록해봅니다📝 연남동 오마 파스타맛집 오마 서울특별시 마포구 동교로 262-6 2층 레스토랑 오마 “오마”는 저번에 나은이네 만났을때 너무 맛있게 먹어서 이번에 또 방문한 레스토랑이에요. 트러플과 파기름이 인상 깊었던 곳 ✔️트러플 크림 파스타(22,000원) ✔️관자 새우 알리오 올리오(22,000원) ✔️이베리코 갈비 리조또(22,000원) 식전빵이 나오는데 저 노란 소스?가 정말 맛있어요 레몬+버터 느낌? 뭔지는 모르지만 ㅎㅎ 트러플 파스타를 여기서 먹고 피렌체에서 먹었는데 너무 느끼했거든요 ㅎㅎ 이태리 트러플파스타 느낌을 살리면서 한국식으로 잘 표현한 파스타라고 생각해요! 진짜 쪼오오온맛탱ㅋㅋ 맛이 엄청 깊어요 ㅠㅠ 글쓰면서 또 땡기네요.. 이거는 갈비리조또인데 파기름이 장난아니에요 맛이 없을수가 없는 맛!! 저의 최애 알리오올리오 입니당~~ 세가지 메뉴 전부 맛있어요!! 내부 분위기도 좋아서 데이트코스로도 적합하고, 요리들이 진짜 맛있어서 후회 안할거에요! 카페테틈 연남동은 사람이 정말 많고 카페도 많고 갈곳은 없고! 지나가다가 귀여운 카페를 발견했어요💕 카페테틈 서울특별시 마포구 동교로36길 15 1-2층 1층은 기프트샵 2층이 카페에요! 1층에 아주 귀여운거 천지였습니다 ㅎㅎ 이렇게 귀여운 팬케이크를 주문 안 할수가 없죠! 달달한 꿀 바르고 과일이랑 아슈크림까지 음료는 에이드류를 마셨어요 컵받침도 너무 귀여워요 🐻 이런 핫플에서는 카페찾다가 귀찮아서 아무데나 들어가고 파스타도 인스타스럽기만하고 맛없는곳이 많은데 이 날은 모두 성공해서 기분이 좋았어요 연남동 데이트코스로 추천합니당~"
연남동 카페테틈 / 베베인형 출시 / 소품샵과 카페 이용하기! TETEUM,"안녕하세요 ~ 혜원입니다 ! 제가 좋아하는 곰돌이 인형이 출시됐다고해서 혼자 사러 다녀왔어요 ~ 매장 좀 보세요 ! 멀리서 봐도 귀욤 ~ 홍대 옆 경의선숲길 연남동에 있어요. 저는 2번째 방문하는 거예요 ! 매일 12:00 ~ 20:00 매주 월요일 정기 휴무일 들어가서 둘러보니 바로 베베가 보여서 찍었어요 ~ 바로 보이시죠 !! 안 보일 수도 있음 :) 허걱 진짜 귀욤 ~ #쪼꼬미베베 #작은베베 원래 16,000원인데 출시기념 할인으로 12,800원 ! #리무버블스티커 1개 1,000원 5개 4,000원 짜잔 ~ #보들이베베 오후에 갔는데 매장에 없었어요. 다 팔렸나봐요. 저는 미리 예약을 해서 어디선가 꺼내주셨어요 ! 원래 35,000원인데 출시기념 세일로 28,000원에 구매했어요 ~ 왼쪽은 저 혼자 베베 구매기념 사진 찍었어요 ! 오른쪽은 지난 번에 애인이랑 갔을때 ~ 베베와 베베 !! 왕크고 왕 귀엽다 ~ 제가 귀여운 거 좋아하는데, 마침 서울이라 후다닥 다녀왔답니다. 1층은 소품샵과 카페 음료 주문하는 곳 2층은 카페 테이블이 있답니다. 여기는 1층 소품샵이에요. 스티커, 파우치, 필통 등 테틈홈페이지에 판매하는 온갖 귀여운 게 다 ~ 있어요 !! 귀욤뽀짝 컵들 ! 실제로 어느 정도 크기인지 보고 살 수 있어서 좋은 거 같아요 ~ 여기는 1층 카페 음료 주문하는 곳 ! 메뉴판 입니다 ~ 여기는 메뉴판도 귀엽다. 옆에 판매 중인 디저트 ~ 디저트도 귀엽당 ! 아이스아메리카노 5,000원 테이크아웃 하니까 1,000원 할인해 주셔서 4.000원에 구매했어요 ! 여기는 2층 카페예요. 저번에 애인이랑 왔을 때 먹은 거 ~ 자리도 많고 넓고 귀여운 포스터도 많아요. #베베분양 받았다 ! #내돈내산 완전 완전 귀여워서 보기만해도 행복 ~ 사은품으로 주신 스티커 3장 ~ 안 찌그러지게 조심히 잘 데려왔다 ! 카페테틈 서울특별시 마포구 동교로36길 15 1-2층 카페는 경의선숲길, 연남동에 있고 따로 주차할 곳은 없어요 !"
[연남동 카페 추천] 귀여운 캐릭터 카페테틈 후기,"안녕하세요! 젬쥬부부입니다! 이번엔 동생추천으로 다녀온 카페테틈을 소개해보려고 합니다. 카페테틈 주소 : 서울 마포구 동교로36길 15 1-2층 (홍대입구역 3번출구 419M) 영업시간 : 12:00-20:00 (매주 월요일 정기휴무) 카페테틈 서울특별시 마포구 동교로36길 15 1-2층 1층 2층이 카페 및 소품샵이 있습니다! 그 위에는 게스트 하우스 인것 같아용 테틈이라는 브랜드는 제 동생이 완전 애정하는 브랜드라고 해요. 근데 왠만한 상품들은 다 온라인 주문해서,, 살게 없다고 하네요 ㅎㅎㅎ 커피 주문하겠습니당 캐릭터 얼음이 들어있는 음료.. 너무 귀엽당 ㅠㅠㅠ 2층에 올라가서 드시면 되요! 2층에 좌석이 그래도 많이 있습니다! 평일 점심때는 한가하네요~ 주말에는 사람들이 좀 많다고 해요!! 우리가 시킨 메뉴 두둥 ! 너무 귀엽자낭!! 아메리카노 / 밀크티 / 큐브라떼 주문했습니담!! (밀크티, 큐브라떼 만 캐릭터얼음 포함) 큐브라떼는 먹는 법이 따로 있어요 이 설명대로 한번 도전~~!! ㅎㅎㅎㅎ 설명은 소품샵 벽면에 붙여 있습니다. 마실때 참고용! 다 마시고 카페 밖에 설치되어 있는 네컷사진! PHOTO BOOTH 너무 귀여우니 그냥 지나갈수 없자나요?!?! 촬영 하고 갈거에요!! 귀여운 카페에서 구경 잘하고 , 잘 먹고 갑니담 ^^ 테틈이라는 브랜드 좋아하시는 분들은 추천!! 곰탱이 너 은근 귀엽다 ? ♥ #연남동카페 #홍대카페 #홍대데이트 #연남동데이트 #카페테틈 #베베와봉봉 #소품샵"
