title,content
연남동 소품샵 : 귀염뽀짝한 카페테틈,"오늘은 연남동에 있는 소품샵을 소개해 드리려고 합니다! 귀여운 소품샵은 그냥 지나칠 수 없는 거 다들 아시죠😯 저만 자꾸 들어가서 돈쓰는 거 아니자나여~! 입구를 찍지 못해서 거리뷰에서 캡쳐해왔어요! 저는 정문을 못 보고 후문으로 들어가버렸어요🥲 정문으로 들어가면 바로 보이는 카페테틈 마스코트! 보자마자 너무 기여워서 같이 사진 찍었어요😆 바로 옆에 있던 맥에 우리가 보여서 여기서도 남자친구랑 한컷!💗 들어가면 엄청 귀염뽀짝뽀짝한 소품이 잔뜩-! 다 갖고싶었어요ㅠㅠ 내 맘대로 만드는 키링 너무 기엽죵 ㅠㅠ 저두 결국 삿답니당😆 자국이 남지 않는 스티커와 패드, 노트북 파우치도 있었어요~ 인형, 파우치, 달력, 메모지, 컵, 마우스패드, 케이스, 공책, 에코백 등 여러 소품이 많았어요! 파우치나 필통 종류도 많이 있었어요ㅠㅠ 돈만 많다면 모조리 갖고싶은 비주얼..👀 마스킹 테이프와 스티커들의 종류도 많았어요🧸 제가 만약 다이어리를 적었다면 다꾸를 위해 아마 잔뜩 사왔을 거 같아요👀🫶🏻 수첩과 포스트잇, 에어팟 케이스, 그립톡, 지비츠세트, 필통, 슬리퍼까지 없는게 없었어요😀 또 안쪽에는 꽝 없는 뽑기 기계가 있었어요~ 뽑기는 하나 뽑으실 때 2천원으로 500원 짜리 동전 4개를 넣어주셔야 해요! 현금이 없으신 분들은 카운터에서 계좌이체 해주시면 동전으로 교환해 드림다고 해요🪙🪙 1층은 소품과 함께 카페 메뉴를 주문하는 곳이 있었어요! 카페 음료의 메뉴판과 종이백, 영수증에 관련된 안내판이 있었어요~ 종이가방은 200원에 유상판매 중이며 계산 전에 미리 말씀하시면 됩니당🛍 영수증은 환경보호를 위해 필요한 경우에만 출력해 주신다고하니 영수증이 필요하신 분들도 미리 말씀하시면 될 거 같아요🧾 음료 외에도 컵케이크도 판매했는데 컵케이크 마저 너무 기여웠어요🧁아까워서 오째 먹오.. 저는 다음 일정이 있어서 카페는 이용 못했지만 카페 좌석은 2층에 마련되어 있다구 해요~ 직접 음료 트레이를 들고 후문으로 나가셔서 2층 외부 계단으로 올라가야 해요! 계단 사용이 어려우신 고객님께서는 스태프분께 말씀해주시면 도와 드린다고 해요💁‍♀️ 저는 정문을 못 보고 후문으로 들어갔지만 후문은 카페 픽업과 리턴을 위한 문이니 최초 방문시에는 정문을 이용해주시면 됩니다~🚪 베베 큐브라떼 맛있게 즐기는 법도 붙어 있으니 베베 큐브라떼 주문하신 분들은 한번 읽어보시고 더 맛있게 드시면 좋을 거 같아요😆 그리고 카페테틈은 캐리어가 있을 경우 반려견 동반이 가능하다고 합니다! 사랑하는 반려견과 함께 세상 구경 나오셔서 귀여운 소품도 구경하시고 맛있는 음료도 드시면 좋을 것 같아용 ㅎㅎ🐾 남자친구에게 맥북을 선물 받았는데 마음에 드는 맥북 파우치가 없어서 매일 불안불안하게 들고 다녔던 나의 소듕한 맥북..💻 저도 카페테틈에서 반해서 깜찍한 맥북 파우치와 키링을 샀어요😆🫶🏻 카페테틈 서울특별시 마포구 동교로36길 15 1-2층 ✅ 주소 : 서울특별시 마포구 동교로36길 15 1-2층 ✅ 문의사항 : 카카오톡 플러스채널 @카페테틈 *전화 문의는 받지 않음 ✅ 운영시간 : 화요일~일요일 12:00 ~ 20:00 *매주 월요일 휴무 *하절기(7~8월) 운영시간은 21:00 마감"
[서울/마포] 연남동 소품샵과 카페를 동시에 즐길 수 있는 곳 :: 카페테틈,"카페와 소품샵을 한 곳에서 CAFE TETEUM 홍대 연남 주변에 소품샵들이 많아서 구경도 하고 쇼핑을 하기로 했죠. 귀여운 소품들과 카페를 한 번에 이용할 수 있는 곳이 있다길래 방문해 보았습니다. 카페테틈 서울특별시 마포구 동교로36길 15 1-2층 연남2 공영주차장 서울특별시 마포구 동교동 147-74 전화번호 : 문의사항은 카카오톡 플러스 @카페테틈 영업시간 : 12:00-20:00 휴무 : 매주 월요일(공휴일 정상 운영) 주차 : 전용 주차장 없음, 인근 공영주차장 이용 1층 소품샵 2023년 2월에 방문했을 당시의 카페 테틈 입구의 모습입니다. 카페 테틈은 1층은 소품샵, 2층은 카페입니다. 1층에서 소품을 둘러보고, 2층 카페로 이동해서 음료를 마시며 쉬는 시간도 갖고 일석이조의 공간입니다! 카페 이용 시, 1층에서 메뉴를 주문하고 2층에 마련된 좌석을 이용하면 됩니다. 본격적으로 1층 소품샵을 둘러보도록 할게요^^ 가장 먼저 눈에 띈 것은 안경 쓴 곰돌이 캐릭터입니다. 의자에 앉아있는 곰돌이 조형물! 바로 이곳이 포토존입니다. 사람들이 많이들 사진을 찍더라고요^^ 곰돌이 캐릭터가 그려진 소품들이 가득했어요. 노트, 핸드폰 케이스, 파우치, 볼펜, 에어팟 케이스 등이 보이네요. 노트북 파우치도 캐릭터 디자인과 색상 소재별로 디피해 두었어요. 최근에는 다시 다이어리 꾸미기 유행하고 있잖아요! 다꾸 할 때 사용할 수 있는 귀여운 스티커들도 많이 있었어요^^ 저도 귀여움에 눈을 떼지 못하고 스티커 몇 장 구매했어요. 학생들 공부할 때 사용하기 좋은 귀여운 메모패드도 보였어요. 공부할 맛 듬뿍 날 것 같아요^^ 저는 나이가 들어도 아직도 필기구 욕심 많아요ㅋㅋㅋ 컵도 종류별로 있더라고요. 가운데 위치한 내열 컵이 너무 마음에 들었지만 자제했습니다. 컵이 너무 귀여워서 선물용으로도 정말 좋을 것 같아요^^ 각종 생활용품과 굿즈들도 많이 있으니 한 번쯤 구경 가도 좋을 거 같아요. 또 하나의 포토존입니다. 귀여운 그림의 액자와 함께 사진을 찍으면서 카페 테틈을 더욱 재밌게 즐길 수 있었어요. 2층 카페 카페 메뉴 주문은 1층 소품샵에서 먼저 하면 되고요, 음료와 디저트 픽업 후 2층으로 올라가서 마련된 좌석을 이용하면 됩니다. 카페테틈은 반려견 동반 가능 카페입니다. 펫 티켓을 지키면서 카페를 이용한다면 모두가 행복하겠죠?^^ 사실 저는 카페테틈 소품샵에서 쇼핑만 하고, 카페는 이용하지 않았어요. 그런데 베베 큐브라떼가 인기 있는 음료 같더라고요. 매장에 큐브라떼를 맛있게 즐기는 방법을 공지해 두었기에 공유해 봅니다! 2층 카페의 모습입니다. 테이블 간격이 넓어서 답답하지 않았어요. 별다른 인테리어 없이 화이트로 공간을 만들었고, 통일감 있게 화이트의 원형 테이블과 의자를 배치해 두었어요. 포인트라고 하면 색감이 있는 조명 정도 였어요. 테이블 아래는 소지품을 보관할 수 있는 상자도 준비되어 있었어요. 거울을 보면 맞은편의 테틈 포스터가 보여요. 거울 배치가 센스 있고, 너무 귀엽더라고요^^ 개인적으로는 인테리어가 엄청 예쁜 카페는 아니지만, 1층 소품샵과 연계하여 이용하기 좋은 카페이고, 편안하게 담소를 나누기에 나쁘지 않은 카페라는 생각이 들었습니다. 2층에서 발견한 포토존입니다. 카페테틈 안경 쓴 곰돌이 캐릭터 진짜 귀엽네요! 맘에 쏙 들어요^^ 함께 사진을 찍고 싶었지만 보는 눈이 많아서ㅠㅠ 아쉽지만 다음에 재방문하게 된다면 포토존 야무지게 활용해서 와야겠네요! ●●●○○ 귀여운 소품이 한가득 테틈 스토어 소품샵과 카페 이용이 한 번에 가능함 전용 주차장 없음"
[먹거리]_연남동카페/귀여운카페_카페테틈(TE.TEUM),"1층은 카페메뉴주문과 굿즈판매를 하고있고 2층이 카페 좌석이다. 테틈 굿즈구경하고 사진찍는 편! 카페테틈2편-카페편 카페테틈 서울특별시 마포구 동교로36길 15 1-2층 자세한건 1편 참고하시고~ https://blog.naver.com/wjsvldzmf/222979103198 [놀거리]_홍대소품샵/연남동소품샵_귀여운거최고_카페테틈(TE.TEUM) 으하하 드디어 왔다! 내가 좋아하는 테틈! 너무 멀어서 늘 인스타만 봤는데 드디어 와봤네 다들 인스타 한... blog.naver.com 카페테틈은 강쥐도 함께 와도 된다고 합니다! 큐브라떼 맛잇게 먹는법과 올라가는 길이라고 설명이 벽에 붙어있다. 옆으로 가보면 주문하고 밖으로 나오면 이렇게 올라갈수있는 계단이 나온다. 밖으로 연결되어 있어서 일반적이진 않았다. 아무래도 음료를 들고 올라가야하니 문 여닫는게 조금 더 불편하다. 그래도 귀여운디요? ㅎ 딸기에이드와 큐브라떼 주문! 딸기에이드 \7,500 큐브라떼 \8,000 대충보고 귀여운걸로 시켜서 연유를 함께 주는지 몰랐다. 괜찮음 연유 안넣어먹으면 그냥 라떼인거야~~ 메뉴판도 안찍었어 멍청해 ㅠㅠ 베베얼음으로 귀여운 메뉴는 큐브라떼와 밀크티가 있습니다! 밀크티는 안마셔서 큐브라떼로 선택 깜장 에스프레소 베베 너무 귀엽다 ㅎㅎ 컵 코스터도 대존귀탱탱탱 아 컵 살껄그랫나? 너무 이쁘다 컵에 우유를 졸졸졸 부어주고 마구마구마구마구 섞어주면 라떼가 된다 베베살려~~~~@.@ 빙글빙글돌아가는 베베의하루 나랑 같은거 마시는구나! 벽에는 이런식으로 카페 시그니처 메뉴를 마시는 베베들이 그려져있다. 이거 하나만 찍었네.. 멍청해2222 2층 입구에 이쁜 거울도 있다. 아마 포토존으로 좋을꺼같은데 사람 없을때 열심ㅎ ㅣ찍었어야 했는데 이런식으로 찍음 멍청해333333 사진을 이쁘게 찍어야한다고 깨달았을땐 이미 만석이라서 사진을 찍기 어려웠다 ㅋㅋ 사실 음료만 먹으려고 했는데 여기의 시그니처는 팬케이크다. 베베랑 봉봉이 얼굴로 나오는 케이꾸 대졸귀 그래서 시켰음 팬케이크 플레이트 \15,000 과일은 계절에 따라 바뀌는거 같다. 지금은 겨울이라고 제철과일 딸기 라고 카운터에 적어두심! 그렇게 써주신거치곤 딸기가 매우 적은편 ^^히히 팬케이크 두 개, 메이플시럽, 하겐다즈아이스크림+시나몬(?)가루, 과일 아이스크림 위에 가루는 시나몬인지 모르겠는데 향이 그랬던거같음 메이플로 적신 베베 귀를 자르다. 칼에 비친 휴지도 귀엽군요. 끄아아아ㅏ앙ㅇ 귀여워서 자르기 아깝지만 먹으려면 잘라야죠 ㅇㅅㅇ 카페에서 오래 있으려면 제일 중요한건?! 화장실! 화장실은 2층 계단을 올라오면 입구 왼쪽으로 바로 보인다. 베베가 화장지를 들고 있네 남여공용이고 변기랑 문 거리가 멀어서 문 꼭 잠그시구요 노크해도 같이 문을 두드릴수 없으니 사람있다고 소리치세요 사람이써여~~~~~~~~~~ 한 장소에서 사진도 찍고 음료도 먹고 귀여운것도 사고 넘 귀엽고 알찼던 카페테틈 방문기 끗-!"
연남동 귀여운 곰돌이 소품샵 카페 추천 ’카페테틈‘,"안녕하세요 :) 오늘은 엄청 귀여운 캐릭터 소품샵 겸 카페인 ‘카페테틈’을 소개해드리려고 합니다💛 우선 캐릭터에 관심 있으신 분들이라면, 인스타에서도 핫한 이 안경 쓴 곰돌이 캐릭터 '테틈'의 베베 한번쯤 본 적 있으실 것 같아요! 저도 이 캐릭터를 알고 있었고, 마침 지인 분께서 연남동에 '카페테틈'이 있다고 알려주셔서 기대되는 마음을 안고 방문하게 되었습니다. * 운영 요일 및 시간: 화~일 - 12:00~20:00(월 - 정기휴무, 공휴일 정상 운영)(2023.08 기준) 카페테틈 서울특별시 마포구 동교로36길 15 1-2층 '카페테틈'은 전국에 서울시 마포구 연남동, 제주 제주시 한림읍 이렇게 두 곳에 위치하고 있습니다. 제주점도 정말 가보고 싶지만, 이번에는 연남동에 있는 곳을 방문하게 되었습니다! 다음에 제주도 가게 되면 제주점도 꼭 가보고 싶어요🫶 1층에는 이렇게 '테틈'의 굿즈들을 살 수 있는 소품샵 공간이 마련되어 있어요! 제품들이 다 너무 귀여워서 계속 사게 되더라고요ㅎㅎ 제가 뭘 샀는지는 다음에 기회가 되면 리뷰해볼게요! 진짜 너무 너무 귀여움🥰 저희가 주문한 메뉴는요, '베베 밀크티(8,000원)'와 '베베 큐브라떼(8,000원)'입니다. 다른 카페들에 비해 가격대는 좀 있어도, 충분히 그 값을 하는 귀엽고, 맛있는 카페였어요. 아래에서 음료 자세하게 소개해드릴게요! 첫 번째, '베베밀크티(8,000원)'부터 소개해드릴게요! 밀크티 원액으로 얼린 베베 얼음이 올라간 테틈의 시그니처 메뉴라고 해요! 아이스만 가능하고요! 저는 사실 이 음료 가장 마셔보고 싶었어요~ 그런데 너무 귀여워서 한참을 못 먹고, 녹을 때 까지 사진만 찍으며 바라봤던 메뉴네요💛 두 번째, '베베 큐브라떼(8,000원)'입니다. 이 메뉴도 '베베 밀크티' 못지 않게 인기가 많은 음료인데요, 에스프레소 2샷으로 얼린 얼음에 우유와 연유를 부어 마시는 테틈의 시그니처 메뉴라고 합니다. 성격 급한 저는 이미 부어버리고 사진을 찍어버렸네요ㅎㅎ 이 음료도 베베가 너무 귀여워서 녹을 때까지 바라만 보다가 다 녹고 나서야 먹기 시작했어요😂 '베베 큐브라떼' 맛있게 즐기는 법도 친절하게 소개되어 있더라고요! 이제부터는 '카페테틈'에서 제가 예쁘게 찍어 온 사진들을 쭉 보여드릴게요! 연남동 '카페테틈' 2층은 이렇게 편하게 음료와 디저트 즐길 수 있는 테이블들이 배치되어 있습니다. 곳곳에는 귀여운 '테틈'의 ‘베베’와 ‘봉봉’ 캐릭터로 인테리어 되어 있고요. 평일 낮에 방문했는데도 손님들이 꽤 많았어요! 연남동 방문하여 캐릭터, 소품 샵, 예쁜, 이색 카페 찾으신다면, '카페테틈'을 추천합니다! '테틈'의 '베베', '봉봉' 캐릭터가 누구나 좋아할 만한 세련되고 귀여운 캐릭터라 구경하는 재미도 있고, 또 구경하다 이것저것 하나씩 필요한 것들 사게 되고, 음료와 디저트도 맛있어서 만족하실 것 같아요 #연남동카페 #연남동카페추천 #카페테틈 #테틈 #베베 #봉봉 #테틈캐릭터 #연남동테틈 #연남동카페테틈 #연남동캐릭터샵 #연남동캐릭터카페 #연남카페테틈 #연남귀여운카페 #연남소품샵 #연남캐릭터샵 #연남이색카페 #연남카페맛집 #연남놀거리 #연남동놀거리 #연남동카페테틈 #베베밀크티 #베베큐브라떼 #연남캐릭터샵겸카페 #연남소품샵겸카페 #경의선숲길공원카페 #경의선숲길공원근처카페 #홍대입구역카페 #홍대입구카페 #홍대카페 #홍대카페맛집 #홍대카페추천 #경의선숲길카페 #경의선숲길카페추천"
홍대 데이트카페 추천 소품샵이 있는 연남동 감성카페 카페테틈 TETEUM,"#연남동카페 #카페테틈 #TETEUM 주말 연남동 나들이하면서 갔었던 분위기 좋은 카페 테틈 사실 연남동가면 맛집엔 관심 많아도 분위기 좋은 이자카야나 카페는 검색 잘 안하고 그냥 가는데 카페잘알 상미씨의 500가지 카페목록중 선택된 이곳... 카페테틈 서울특별시 마포구 동교로36길 15 1-2층 홍대 연남동 카페테틈 위치 홍대입구역 3번출구로 나와서 오른쪽 방향으로 조금만 걸으면 위치해있다 3번출구랑 가까워서 금방 찾을수 있는 거리에 있음! 주차공간은 따로 못봄. 주말에 홍대 연남동 놀러간다면 대중교통 이용 추천해요 주차하기 어렵고 공간도 없고 주차비도 비쌉니다,, 영업시간 및 휴무정보 화~일 PM 12:00 ~ PM 21:00 라스트오더 PM 20:30 / 브레이크타임 없음 매주 월요일 정기휴무 아기자기한 느낌이 나는 외관 1층은 소품샵, 2층은 카페로 구성되어있다 2층 카페 입구에 테이블링 키오스크가 있는데 카페에서도 웨이팅을 하나 ?! 했지만 토요일 오후 5시정도 쯤 갔는데 앞에 4팀정도 웨이팅이 있었다 ( •︠ˍ•︡ ) 테이블링 해놓고 1층 소품샵에서 이거저거 구경하니 나름 시간이 금방갔음 카페테틈 메뉴판 (글씨가 매우 작아서 눌러서 봐주세요) 아이스아메리카노 5,000 베베밀크티 8,000 초코베베 컵케이크 5,500 주문 밥먹고 가서 베이커리 종류는 하나만 시켰는데, 다음에 가면 맨 왼쪽 하단에 있는 팬케이크랑 과일 먹어봐야겠다고 생각했다 카운터 옆에 있던 귀여운 컵케이크 빨간 안경쓴 곰돌이 귀여워서 안시킬수가 없었음,, 1층 소품샵 겸 카운터 연남동가면 소품샵 구경하는 재미가 있는데 카페테틈 소품샵엔 다꾸 스티커부터 파우치, 화장품, 인형 등 여러가지 아기자기한 소품들이 많아서 구경하는 재미가 있었다 귀여운 엽서랑 편지지, 컵까지 아기자기한 소품들 한가득 소품샵 구경하다보니 시간이 금방갔다 에어팟 케이스, 파우치, 필통, 다이어리꾸미기 테이프도 온통 안경쓴 곰탱이로 도배되어있는 소품샵 그리고 에코백까지,, 페리페라랑 콜라보한 화장품도 몇가지 있었는데 없는거 빼고 다있는 소품샵 상미씨는 원래 이런 귀여운거에 관심 없는데 자기가 점점 이런게 귀엽다면서 나이들었다면서 . ... ㅋ 우리도 늙었어 임마 1층 구경하다보니 순서가 와서 주문하고 받은 진동벨 진동벨에도 곰탱이 그림이 그려져있었다 근데 쟤 이름이 테틈인건가..? 2층 카페 2층 카페도 화이트톤 인테리어에 아기자기한 곰탱이 그림이 그려진 장소 테이블은 몇 없는편이다 총 9테이블 정도.. 그래서 웨이팅 키오스크가 있을 법도 하다고 생각 귀여운 곰돌이들이 커피, 케익먹는 그림 1층 소품샵 가면 그림들도 판매하고있다 자취하면 집에 꾸미기 소품으로 괜찮을거 같기도하고~ 얼마 안기다리고 나온 음료랑 컵케익 컵이랑 접시랑 포크마저 귀여움이 한가득... 컵 그림에 맞춰서 받침대까지 센스 굿 밀크티 위에 안경쓴 곰탱이가 올려져있는데 녹으면서 슬러쉬처럼 살얼음이 된다 커피맛은 그냥 저냥 아메리카노.. (사실 커피맛 모름 시원해서 먹음) 밀크티는 맛있었다 컵케익은 위에 초코가 너무너무 달았다,, 보는 귀여움은 있었지만 단걸 별로 안좋아해서 다음에 간다면 다른 사이드를 시키지않을까 싶다 저거 귀여워서 어떻게먹어~~! 하고 바로 귀부터 뜯어먹어본 곰돌이 쿠키.. 쿠키는 그냥 귀엽고 별맛없다 고딩때 미오뜨 (미니오븐이뜨거워지는시간ㅋ) 했었는데 그때 내가 만든 쿠키와 맛이 비슷.. 홍대 연남동 소품샵이 있는 귀여운 감성카페 테틈 홍대입구역 3번출구에서 꽤 가까운 거리에 위치해있어서 찾기도 쉽고, 소품샵이랑 카페가 같이 있어서 그런지 이거저거 볼거리가 많았던 카페 데이트 장소로도 좋고 귀여운 소품 좋아하는 친구들끼리 와서 구경하고 커피마시기에도 좋은 연남동 감성카페 테틈 카페 귀여워서 홍대 연남동 이쪽 들리면 재방문 의사 있는 카페 주말에 귀여운 연남동 카페를 찾는다면 추천하는 홍대 연남동 카페테틈 #연남동카페 #연남동소품샵 #연남동감성카페 #연남동데이트"
연남동소품샵 카페테틈 리뷰,"오늘은 연남동소품샵 카페테틈 리뷰를 가지고 왔어요 귀여운 티코스터를 구하기 위해서 요즘 소품샵이 보이기만 하면 들어가고 있어요 그래서 앞으로도 소품샵 리뷰가 자주 올라올 것 같습니다 연남동소품샵 카페테틈 위치입니다 홍대입구역 3번 출구와 가까워서 도보로 이동하기 좋았어요 카페테틈 서울특별시 마포구 동교로36길 15 1-2층 연남동소품샵 카페테틈 외관입니다 매주 월요일 휴무이고 화~일은 12시부터 8시까지 운영된다고 해요 카페테틈 인스타그램도 봤는데 매장 외관에 포토존이 있어 사진 찍기 좋아 보였습니다 내부에도 들어가자마자 테틈캐릭터가 있는 포토존이 있었습니다 연남동소품샵 카페테틈에서 판매되는 제품들로 꾸며져 있는 곳도 있었습니다 연남동소품샵 카페테틈 카페 메뉴입니다 1층은 소품샵 2층은 카페로 되어있더라구요 저는 모르고 가서 카페를 이용해야 하나 했는데 1층 2층으로 나눠져 있어서 소품샵만 들려도 괜찮아 보였습니다 카페테틈에서는 작은 수첩부터 넉넉한 크기의 노트, 스티커도 사이즈가 다양하게 있어 구경하기 좋았어요 다이어리에 그날 하루 뭐 했는지 스티커 하나만 붙여도 알아볼 수 있는 캐릭터 스티커들이 많았어요 안쪽에는 더 다양한 스티커들이 있었습니다 개인적으로 큰 노트를 좋아하는데 카페테틈에서 판매되는 노트들 사이즈가 다양해서 한눈에 보고 고르기 좋았습니다 위쪽에는 A3 사이즈의 포스터들도 있으니 방 꾸밀 때 좋아 보였어요 휴대폰 케이스도 다양하게 있었습니다 정말 구매하고 싶었는데 핸드폰 링과 케이스의 일체형인 링 케이스 편함을 이미 맛봐서 구매는 안했어요ㅠㅠ 그립 톡 너무 귀여운데 제 손에만 불편한가요ㅠ.. 카페테틈에서 판매되는 컵 종류들입니다 개인적으로 용량이 큰 컵들부터 따뜻한 차 담기에 좋은 머그컵까지 컵 종류가 다양하고 음료 담고 사진 찍으면 정말 귀여울 것 같은 디자인들이라 선물하기에도 좋아 보였습니다 마음에 드는 컵이 있으면 직접 담는 게 아닌 직원분께 요청하면 됩니다! 테틈캐릭터와 콜라보 한 것도 눈에 띄더라구요 테스터가 아닌 전시물품이라 눈으로만 봐야 하지만 너무 귀여웠어요 놓칠 수 없는 노트북, 아이패드 파우치 디피 공간입니다 가격은 옆부분에 다 쓰여 있어서 편했어요 아이패드는 없지만 이런 파우치는 귀여워서 지나칠 수 없는 것 같아요 옆에는 뽑기도 있더라구요 현금 2,000원을 들고 카운터로 가면 500원으로 바꿀 수 있어요! 연남동소품샵 카페테틈에서 디피된 컵을 요청하면 여기에서 꺼내주는 형식이었습니다 진짜 스티커들과 메모지들은 사도 귀여운 것들이 끊임없이 보이는 것 같아요 하지만 집에 있던 떡메도 아직 다 못썼기 때문에.... 뇌에 힘주고 참았습니다 작은 탁상용 달력이 있었어요 내년 거는 꼭 이 제품으로 사고 싶었습니다 파우치와 에코백도 디피되어 있었는데 인터넷에서 본 것보다 훨씬 더 괜찮아 보여서 연남동소품샵 카페테틈에 직접 와서 구경하는 걸 추천해요 큰 스티커들도 있었는데 다이어리 꾸밀 때 사용하거나 선물 포장할 때 좋아 보였습니다 파우치, 마테, 볼펜, 필통 등 내부 가운데에 정렬되어 있어서 구경하기 좋았어요! 테틈 그립톡과 에어팟 케이스들입니다 특히 첫 줄에 있는 테틈에어팟케이스가 귀여웠어요 자비츠있는 곳에 내부 중앙에 있는 파우치들이 새 제품으로 있어서 이걸 가져가서 계산하게 되어있었어요 뽑기도 해보기로 했어요 500원 2개씩 양쪽에 넣고 돌리면 바로 볼이 나오는데 볼 안에 있는 쪽지를 보고 카운터에 주면 상품을 교환하는 형식이었어요 저는 이 캠핑테틈스티커를 받았습니다 재미로 하기 좋은 것 같아요! 이상 연남동소품샵 카페테틈 리뷰 였습니다"
