title,content
연남동 브런치 '썸모어델리',"썸모어델리 서울 마포구 동교로51길 131 매주 월,화 정기휴무 수-일 _ 11:00 - 19:00 (라스트오더 _ 18:15) 오랜만에 친구들과 만나러 연남동에 왔다. 파워 J형 친구 덕분에 알게 된 브런치 맛집 #썸모어델리 웨이팅이 조금 있었는데 친구가 기다려줘서 덕분에 빠른 입장! 다양한 메뉴를 시켜봤다 메뉴판 총 4가지의 메뉴를 주문했고 제일 먼저 나온 여름의 맛 14.0 플레이팅부터 여름이다~ 🥭 망고 색감이 미쳐버림 부라타치즈 애플망고 리슬링드레싱 리슬링드레싱이 뭔지 모르겠지만 드레싱 맛있었다 메뉴명이 찰떡이다 부라타치즈와 애플망고가 너무 잘 어울렸고 시원한 망고 덕분에 더위를 잠깐 식혔다. 두 번째 메뉴는 트러플 크림 프렌치토스트 18.0 대표메뉴답게 가격도 가장 비싸다 느끼할 줄 알았는데 생각보다 느끼하지 않다 트러플 크림&오일 베이컨 브리오슈프렌치토스트 빵을 먹을 때 굉장히 달고 찐득한 느낌이었는데 나중에 찾아보니 브리오슈는 버터가 많이 들어간다고 한다 트러플 크림에 찍어 먹으면 풍미가 확 산다. 계속해서 나온 메뉴 애플 루꼴라 샌드위치 13.0 🍎 사과 에멘탈치즈 루꼴라 햄 잡곡식빵 톰과 제리 치즈라고 더 잘 알려진 에멘탈치즈 샌드위치 안에도 루꼴라가 가득 접시에 루꼴라도 가득 사과가 아삭아삭 씹혀서 향이 더 좋다. 마지막 메뉴는 에그 과콰몰리 오픈 토스트 15.0 고수 페스토 하바타치즈 호밀빵 🥑 아보카도를 으깨 만든 과콰몰리 계란 프라이 고수 다 먹고 메뉴판 보며 블로그 정리하다 알았다! 아니 아니 고수가 들어갔었어...?? 고수불호자인데 고수 생각지도 못함 맛있는 것들로 둘러싸여서 그런가 야외에도 앉을 수 있는 테이블은 있던데 날 더울 때는 힘들 듯 내부에 테이블은 2인 테이블 기준 6개 정도 4명이 가서 테이블 붙여주셨다. 공간은 조금 협소한 느낌은 나지만 맛과 분위기가 한몫함 http://naver.me/F31zaC0U 썸모어델리 : 네이버 방문자리뷰 7 · 블로그리뷰 6 naver.me 지하철 이용할 경우 가좌역에서 도보로 10분 정도 (4번 출구로 나오세요) 홍대입구역에서 도보로 17분 정도 (3번 출구로 나오세요) 썸모어델리 서울특별시 마포구 동교로51길 131"
서울 연남동 썸모어델리,"오랜만에 연남동을 찾았다. 잘 가지 않는 곳인데 날도 좋고 해서 외출한 어느 날! 원래는 요거트 집을 가려했는데 이미 가게 안이 사람으로 가득한 게 아닌가ㅠㅠ 그래서 찾은 다른 곳!! 오히려 좋아💕 예쁘고 맛있는 가게를 하나 찾았다. 썸모어델리 서울특별시 마포구 동교로51길 131 1층 외관 다 먹고 나와서 찍은 사진이다. 따뜻하고 아늑한 공간의 가게다. 오빠가 찍은 내부 사진 테이블은 4개-5개가 다였다. (외부 좌석도 있긴 하나.. 이젠 추워서 이용 못할 듯?!) 그래서 단체로 오면 좀 곤란함 ㅜㅜ.. 짜라란 우리가 시킨 먹부림들😇🤩 왼쪽부터 프렌치토스트 오늘의 스프(고구마!), 라쟈냐!! 먼저 고구마 스프로 몸을 데우고 있으니까 곧이어 라쟈냐와 프렌치토스트가 나왔다. 고구마 스프 진짜 따숩고 달콤💕 그리고 뒤이어 나온 라쟈냐는 부드럽고 짜지 않은 토마토 소스와 궁합 최고 그리고 거의 오늘의 주인공 급인 프렌치 토스트⭐️⭐️⭐️ 빵, 베이컨, 양송이, 특제 소스(?!) 프렌치 토스트 짱 존 맛 또 먹고 싶어.. 츄베릅 추가)아! 여긴 인천 구월동에 있던 썸모어 가게 사장님이 구월동을 정리하고 서울로 오신 모양이었다!!!! 인천에서 못먹어 봤는데 여기서 우연히 이렇게 만나다니🤍쏘 럭키🤍"
"기분전환 하고플땐, 연남동 브런치 [ 썸모어델리 ]","연남동 트리플 크림 프렌치 토스트 와앙-! [썸모어델리] 썸모어델리 서울특별시 마포구 동교로51길 131 오늘 소개할 브런치 맛집은 연남동 썸모어델리 입니다 오랜만에 치팅+기분전환 겸 브런치 가게를 방문했습니다 (해당 사진은 네이버 썸모어델리 가게 사진입니다) 가게 내부에 손님이 만석이라 사진을 찍지 못했어요! 기억상 좌석은 5테이블 10-15명 정도가 들어갈 수 있는 10평 남짓 한 공간이였어요! 점심시간에 가면 웨이팅이 항상 존재하니 ⭐️예약 추천드려요!⭐️ ----------------------------------------- 썸모어델리 메뉴 드디어 가게에 입장하고! 메뉴를 시켰는데요 저희는 트러플 크림 프렌치 토스트와 B.L.P.T 를 시켰습니다 왼쪽 주문표 , 오른쪽은 예뻐서 찍은 화분 메뉴를 시키면 왼쪽 사진과 같이 영수증과 주문표를 주더라구요! 예뻐서 다이어리에 소장하기 딱 좋아요 🥨 15분 정도 기다리니 메뉴가 나왔어요! 먼저 나온건 트러플 크림 토스트와 망고 코코넛 샐러드 망고 코코넛 샐러드는 저희가 웨이팅을 길게해서 🫶사장님 께서 주신 써비스🫶 그리고 곧바로 BLPT 샌드위치가 나왔습니다 (하..포스팅 하면서 다시 먹고싶은 ㅠ) 🔽후기🔽 트러플 크림 프렌치 토스트 맛 ⭐️⭐️⭐️⭐️ 빵 : 달달하면서 버터 풍미가 가득한 폭신한 빵 브리오슈 번과 유사한 맛! 하지만 겉은 그릴드 되어 파니니의 식감과 비슷 합니다! 말그대로 겉바속촉 크림소스: 크림과 치즈가 잘 어우러지는 흐르는 소스 (꾸덕 하지 않아요!) 하나도 안 느끼하고 중간에 들어간 토마토가 크림의 달달한 맛을 새콤하게 중화시켜줍니다 중간에 들어간 야채와 베이컨, 양송이를 얹어 먹으면 진짜 레전드 양 ⭐️⭐️⭐️ 엄청 많다는 아닌데 혼자먹으면 배부를 정도에요 하지만 가격이 쎄다는 점에서 별은 세개 정도. BLPT샌드 맛 ⭐️⭐️ 양파 소스 베이스에 홀그레인 머스타드 + 베이컨+ 감자(슬라이드 감자로 두툼해요) + 토마토 + 샐러드 조합에 그릴드된 빵 빵 : 일반 통식빵 맛. 평범해요 버터향이나 고소 달달한 맛이 나진 않아요. 평범한 식빵 속재료: 토마토 베이컨에 양파소스가 잘 어울리지만 감자는 약간 따로노는 듯 한 느낌이 있었어요. 감자보단 고구마가 더 어울렸을 것 같기도.. 단짠 조화를 좋아하시는 분에게는 조금 심심한 토스트 같아요! 하지만 구황작물 덕후인 저에게는 괜찮은 맛이였습니다 양 ⭐️⭐️ 가격 대비... 이하 생략 망고 코코넛 샐러드 서비스 메뉴로 원래는 여기에 뭐가 더 들어간다고 하셨던 것 같은데.. 기억이 잘 안나는,, 일단 뿌려진 오일은 발사믹 식초맛. 망고랑 은근 잘 어울리더라구요! 새콤한 망고에 코코넛으로 달게 마무리해주면 완벽-! 토스트먹고 입가심으로 좋아요🫶 요건 서비스라 맛과 양은 생략 그냥 아는 망고 맛이에요 그렇게 둘이서 야무지게~ 클리어 했습니다 총 평은 가격대비 비싼 메뉴들. 하지만 프리플 크림 프렌치 토스트는 꼭 꼭 꼭 드셔보세요!! 다른 토스트들은 뭔가 맛이 예상돼서 프리플 토스트에 에그 과콰몰리나 양송이 메뉴를 다음에 같이 먹어봐야 겠어요🤔 - 추가로 연남동 오는 길에 산책로나 인근 카페, 소품가게 등 먹고 볼 거리들이 너무 잘 되어 있어요 데이트 코스로 강추 합니다. 🫶 #연남동 #연남동맛집 #브런치 #연남동브런치 #썸모어델리 #연남동썸모어델리 #데이트코스 #연남동가게 #연남동밥집 #서울데이트 #브런치카페"
"연남동 분좋카 ,, 썸모어델리","속도를 줄이시오 연남동 방향으로 뛰어갑니다 퐁당퐁당 평지두고 일부러 선택한 징검다리 길 좋은 날의 하늘색! 전기줄가리려고 크레용으로 색칠해보았어요~ 갈색, 연노랑, 초록색, 흰색, 하늘색, 분홍색 이런 색감 싫어하는 사람 많지 않겠죠?~ 넘나 선호합니다! 오늘의 명언 행복은 접시 위에..✍🏼 여기는 테라스 자리가 좋다 몽돌몽돌 영화 에에올 생각나는 돌맹이 인천이 본점이라는 썸모어 추워지면 안으로 들어와야죠 은근 쌀쌀한 요즈음-! 썸모어델리 서울특별시 마포구 동교로51길 131 1층 야외테이블 사용기한이 짧습니다 추워지기 전에 맘껏 누려요! 올해의 책으로 선정해드려 문장 하나하나 읽어보는 재미가 있던 메뉴판 우리 모두 건강하고 귀여운 할머니가 되어봅시다 🧚‍♀️ 돌맹쓰 놓치않아요 엘에이에서 마신 팬케이크집 커피맛이랑 같던 아.아 홀짝홀짝 마시다보니 부족해서 민영이꺼 뺏어먹기 빵산빵상 두가지 빵종류를 추가했다는데, 이렇게나 많을 줄이야? 가장 기대하지 않았지만, 오일이 이렇게 맛있는 거였나 나한텐 제일 맛있었던 버섯요리 완전 오일맛집••• 빵을 찍어먹으면 환상입니다 메뉴이름은 ‘올리브크림에 구운 양송이 버섯요리’ 아마도.. 어디서도 먹어보지 못했지만 주기적으로 생각날 것 같음 아무래도 이 레시피를 뺏어와야겠는걸요.. 사장님을 꼬셔볼게요.. 👩🏻‍🍳 주말 오후 늦잠자고 아침에 집에서 먹고 싶은 재질 단호박스프는 안타깝게 4등을 해서 프레임 밖입니다 (다른게 정말 맛있었고 얘는 무난했을뿐⸝⸝⸝) 트러플 크림 프렌치토스트 이것도 역시나 특색있는 크림오일로 맛있었지요 앞메뉴랑 겹치는 듯하지만 또 이건 달달한 맛도 있으니까..다릅니다!!! 💅🏻진희는 손톱기르는 중 요즘 이런 샷이 좋아 뭔가.. 인셉셥같잖아?.. 나자나 라자냐 마지막으로 나온 라자냐..! 매콤하게 부탁드렸더니 느끼한 친구들을 잡아주는 역할을 톡톡히 했습죠 이곳이 더 좋았던 이유는 요 순하면서 귀여운 생명체.. 어쩜.. 좋아 ?! 나랑 사진 찍어줘서 고마워 ㅅㅣ바친구! 또 갈래요,,"
[연남동] 썸모어델리,"썸모어델리 서울특별시 마포구 동교로51길 131 1층 이전 인천 남동구에 있던 “카페썸모어”가 연남동에 “썸모어델리”로 오픈한지도 꽤나 오래 되었다. 인천이 아닌 서울로 와서 오히려 좋아 🤍🫶🏻 현재 연남동 썸모어델리에는 없는 메뉴 오픈샌드위치 참으로 맛있는데 아쉽다. 양송이 한송이송이,.마다 이렇게 맛있기 있냐.. 뭔지모를 소스와 양송이를 딱 한입 베어물면 양송이 즙이 딱! 지옥에서 온 계란이요 에그인헬,, 토마토스튜같은 로제소스에 바싹 익지 않은 계란이랑 같이 끓여서 바게트 빵에 올려 먹으면 입 속에 토마토 농장이 펼쳐짐. 익은 토마토 좋아~~~❤️ 카페썸모어 브런치 메뉴는 장인의 손길이 느껴진다. 소세지, 후라이, 식빵 덜렁 있는 시크한 미국 브런치가 아니라 오히려 소스, 플레이팅, 질감 하나하나 다 신경 쓴 손이 많이 가는 k브런치. 너무 장황한 표현인가 ㅎ ㅎ 떼샷 잘먹었습니다. 꺼억 끝"
강아지 동반이 가능한 연남동 브런치 카페 / 썸모어델리 (양송이 구이가 끝내줘요 ^^),"저의 최애 브런치 카페, 썸모어를 소개해 드릴게요 ^^ 썸모어델리 서울특별시 마포구 동교로51길 131 1층 인천 구월동에 2호점이 있고 연남동의 썸모어델리는 3호점이에요! 최근에 다녀와서 (두 번째 방문) 또 한 번 감동받아 블로그에 남기게 되었습니다 ㅎㅎ 썸모어는 시즌마다 메뉴가 바뀌는데요 ^^ 이건 작년 10월에 방문했을 때 메뉴, 이건 최근 방문했을 때 메뉴에요. ✔️ 할머니가 끓이는 데일리 스프 ✔️ 올리브크림치즈를 넣어 구운 양송이 ✔️ 트러플 크림 프렌치토스트 ✔️ 비엘피티 B.L.P.T (베이컨, 레터스, 포테이토, 토마토) 요렇게 4가지 메뉴는 지난가을과 동일했고 그 외는 조금씩 바뀌었어요. 날씨 좋은 날 가면 환상적인 썸모어! (특히 야외 자리) 다만 더운 날에는 꼭 네이버로 예약하고 가세요! 저희는 평일 12시에 갔는데도 실내가 모두 만석이라 밖에서 1시간 정도 기다렸어요. 얼굴이 새빨갛게 익어버렸었다는 ㅎㅎ 여기가 한국인가요 유럽인가요 ㅎㅎ (가본 적 없지만) 이탈리아나 프랑스 남부가 떠올랐어요. 올리브크림치즈를 넣어 구운 양송이 (14,000원) 지난번에도 먹고 이번에도 주문한 양송이 구이 개인적으로 썸모어에서 가장 맛있는 요리였어요. 양송이 식감이 아삭아삭하면서도 크림소스가 듬뿍 베여있어요. 소스 한 방울까지도 남기고 싶지 않았던 요리 ㅠㅠ 양송이가 어떻게 고기보다 맛있을 수 있나요!!!! 트러플 크림 프렌치토스트 (18,000원) 프렌치토스트는 메이플 시럽을 뿌린 것만 생각해왔는데 크림소스와의 조합은 신선했어요! 소스 자체는 트러플향이 가득해서 너무 맛있었지만 개인적으로 토스트와 어울리는지는 잘 모르겠어요. 양송이 구이 또는 프렌치토스트 중 하나만 주문하고 다른 메인 메뉴를 고르는 것도 좋겠네요 ^^ 토마토 라구 라자냐 (19,000원) 토마토 + 치즈 + 라자냐는 믿고 먹을 수 있는 조합이죠? ㅎㅎ 예상했던 것만큼 맛있었어요! 썸모어 아이스티 (7,000원) 건더기도 많고 상큼 달콤했던 음료! 맛있었어요! 이건 지난가을에 먹었던 라따뚜이인데요. (왼쪽, 오른쪽은 양송이 구이) 썸모어 라따뚜이는 식빵 위에 야채와 치즈가 올려져 있어 신선했던 기억이 나네요 ^^ 분위기, 맛, 친절함 어느 하나 부족한 게 없었던 연남동 썸모어델리 마음 같아서는 자주 가고 싶지만.. 그렇지 못하더라도 계절에 한 번씩은 꼭 가보고 싶어요 ^^ 아!! 강아지 동반이 가능한 곳이라 날이 선선해지면 우리 집 포미와 또 한 번 와야겠습니다 ㅎㅎ #연남동브런치카페 #연남동맛집 #경의선숲길브런치카페 #연남동강아지동반 #경의선숲길강아지동반카페 #강아지동반브런치카페 #썸모어 #내돈내산"
연남동 브런치 맛집 썸모어델리 SOMEMOREdeli,"썸모어델리 SOMEMORE deli 한번 먹어보고 맛있고 분위기도 좋고 연속으로 찾아간 브런치집 ! 날씨가 가을가을 맑고 너무 선선하고 해도 좋았다 홍대입구역에서 내려서 걸러가면 좀 멀긴하지만 그래도 날씨가 좋아서 산책하기도 좋았다 경의선숲길 따라서 쭉 내려가면된다 썸모어델리 도착 밖이 좋긴한데 일행들이 안에 먼저 자리잡고있어서 안쪽자리에 앉았다 가게는 아담하다 실내에 테이블 4개정도 있고 실외에 4개정도 있다 경의선 숲길 가장 끝에 안쪽 골목에 위치해서 한적하고 좋았다 메뉴판 스프는 그날그날 바뀌는 메뉴더라 데일리스프 + 빵추가 올리브크림치즈를 넣어 구운 양송이 트러플 크림 프렌치 토스트 비엘피티 블랙커피 1, 썸모어아이스티 2 주문했다 주문완료 후 셀프코너에서 물을 챙겨갔다 주문하고 음료와 그릇부터 나왔다 이게 썸모어아이스티 베리 여러종류와 홍차가 우려졌는데 상큼 달달 맛있었다 이 날의 데일리스프는 컬리플라워스프 였다 그리고 추가한 바게트빵 충분히 맛있어보이는 비쥬얼 비엘피티 감자가 으깨져들어가 있는 샌드위치 크림치즈 들어간 구운양송이 아직 하나 덜나왔지만 전체샷 ! 스프부터 먹어보자 맛은 버터맛이 많이 나는 고소한 맛이었다 크루통과 함께 한입해도 맛있다 크림치즈의 상큼함과 오일듬뿍 구워진 양송이 조합은 칭찬한다 처음먹었을때 오 ?! 맛있다 하며 야무지게 먹었지 스프에 찍어먹어도되지만 크림치즈 양송이의 그 올리브기름에 찍어먹어도 맛있다 빵은 :) 감자를 으깨 샐러드된거랑 겨자잎이랑 홀그레인머스타드랑 통밀빵이랑 조합이 너무 좋다 마지막으로 나온 트러플크림프렌치토스트 단짠단짠의 조합은 맛없없 이지 크림소스는 사랑입니다 야무지게 잘먹었다 간만에 맘에 드는 브런치집을 발견 ! 상큼이 음료수와 버터&크림맛이 풍부한 곳 :) Copyright ⓒ 코알라J. All rights reserved."
"연남동 브런치 맛집, 썸모어델리","내가 좋아하던 구월동 썸모어가 송도로 이사를 갔는데 송도점 방문전에 다녀와본 연남동 맛집 썸모어델리 가좌역에서 도보 10분정도 거리에 위치해 있었다 연남동 브런치 카페 썸모어델리 영업시간 매일 11:00 - 19:00 / 매주 월요일 휴무 썸모어델리 | 연남동카페 | 브런치 | 커피 | 와인(@somemore.deli) • Instagram 사진 및 동영상 팔로워 1,762명, 팔로잉 6명, 게시물 630개 - 썸모어델리 | 연남동카페 | 브런치 | 커피 | 와인(@somemore.deli)님의 Instagram 사진 및 동영상 보기 www.instagram.com 썸모어델리 서울특별시 마포구 동교로51길 131 1층 운좋게 사람이 없는 시간에 방문했던 가좌 썸모어델리 내부가 넓진 않았지만 층고가 높고 통창이라 답답한 느낌이 들지 않아서 좋았다 썸모어델리에서 오늘의스프, 구운양송이와 에그인헬을 주문했다 이날 주문했던 메뉴중에서 가장 맛있었던 올리브 크림 치즈를 넣어 구운 양송이 크림소스가 너무 맛있고 빵이랑 먹으면 진짜 꿀맛 .. ! 쉬림프 브리치즈 샌드위치 먹고 싶었는데 송도점하고 연남점하고 주문할 수 있는 메뉴가 조금 다른 것 같았다 에그인헬은 그냥 평범했고 다음에 새로 오픈한 송도점 꼭 가봐야겠다 연남동에서 브런치 맛있는 썸모어델리 추천해요 - : )"
(연남동) 까페썸모어 (썸모어델리),"카페썸모어 서울특별시 마포구 동교로51길 131 연남동 끝자락에 위치해서일까 그렇게 복잡하지 않은 느낌이 가게와도 잘 어울린다고 생각되는 '카페썸모어' 주차는 가게 근처에 요령껏 해보도록 하자 메뉴판 각 음식마다 스토리텔링이 있다. ㅋㅋㅋㅋㅋ 마치 미술관의 작품설명같이 깨알같은 설명과 외국인손님들을 위한 영어번역까지! 메뉴판 메뉴 사진들은 인스타 감성이 아닌 극사실주의에 메뉴 이름에 그랜마 그랜파가 등장해서 뭔가 따뜻한 느낌을 준다. 내부는 넓지 않다. 테이블 4개정도 그마저도 꽉 찬다면 엄청 비좁게 느껴질 수 있을 것 같다. 외부테이블도 있긴 하지만 엄동설한엔 쉽지 않겠지요? 아기자기하면서 따뜻한 느낌의 인테리어 그렌마 데일리스프 \6,000 스프 설명해주셨는데 까먹^^;;; 맛있었음 할머니가 주시는 이런 스프를 먹으면서 컸다면 눈물 한 방울 쏟지 않을까 트러플크림 프렌치 토스트 \18,000 우리가 좋아하는 트러플과 루꼴라와 메이플 시럽이 들어간 맛이 나는 토스트 그리고 상큼한 방울토마토까지 굿굿 맛있었다. 이쁜이도 맛있게 먹다가 막판에는 조금 물려하는 것 같긴 했지만. Grandma Lasagne \19,000 그랜마로 가자아 그랜마 라자냐 먹은지 얼마 되지 않았는데 기억이 안나는가보면 특별하진 않았는듯^^; 따스한 할머니의 맛? 당큰케이크 - 서비스 의외로 손님이 없었다. 그래서 였을까 곧 마감시간이기도 해서인지 당근케이크를 서비스로 주셨다. 하지만 이쁜이는 시나몬을 좋아하지 않아.. 나는 당근케이크 좋아하긴함 하지만 너무 배불렀음ㅜㅜ"
서울 연남동 썸모어델리( 브런치 맛집),"연남동 썸모어델리! 인천에서 먹어보고 맛있어서 서울에 방문한김에 다녀왔어요. 생각보다 정말 작았던 썸모어 델리 일주일전부터 예약을 했는데 ,, 정말 좁은 문앞자리라서,,,불편..... 예약안하고 방문하신 손님 두분에게는 사진속 넓은 테이블에 앉게 해주시는걸 보며,, 기분이 좀... 뭐.. 어쩔수 없었겠지만 문앞테이블은 뒷자리와 간격이 너무 좁아 불편했어요. 네이버예약 시 예약금이 따로 있고, 방문하면 예약금은 돌려주십니다. 메뉴판 ㅎㅎ 뭔가가 빠진것 같은데 토마토스프와 빵! 빵은 잡곡빵으로 추가했어요. 잡곡빵or 바게트 선택 가능해요 ㅎㅎ 토마토 수프에 +치즈 ㅎㅎ 빵 찍어 먹으면 맛있습니다! 양송이 크림치즈와 트러플크림프렌치토스트 먹어봤던 맛있는 걸로 주문했는데, 두개만 먹기에는 조금 느끼했습니다. 다른 상큼한걸 같이 주문하는게 좋을 것 같아요 양송이 버섯 속에는 크림치즈! 위에는루꼴라 ㅎㅎ 빵과 함께 먹으면 더 맛있습니다. 썸모어 처음 가서 먹어봤을때는 진짜 너무 맛있다 했었는데,, 오랜만에 가서 그런지 자리가 불편해서 그런지 그저 그랬습니다 ㅎㅎ 진한 트러플 크림소스에 촉촉하고 달달한 프렌치토스트 ㅎㅎ 베이컨과 루꼴라와 함께 먹으면 맛있습니다! 서비스로 주신 당근케이크 ㅎㅎ 맛있었습니다. 다음에 간다면 다른 메뉴를 먹어봐야겠어요 ㅎㅎ 연남동 브런치 맛집을 찾고 계신다면 브런치를 좋아하신다면 좋아할만한 곳!! 카페썸모어 서울특별시 마포구 동교로51길 131"
[연남동/썸모어델리],"블로그 친구(라고 하기엔 나이차가..) 만났던 날. 갑자기 온도 훅훅 떨어져서 한 마리의 곰이 돼서 나갔다. 전부터 눈여겨 뒀던 연남동 브런치 맛집 썸모어델리. 생각보다 작은 규모에 놀랬.. 나보다 먼저 도착한 블친이 주문을 해놨다. 결제는 선결제였던. 음료는 아이스티, 음식은 B.L.P.T, 트러플크림프렌치토스트, 라자냐. B.L.P.T 는 베이컨 레터스 포테이토 토마토의 약자다. 담백하고 무난했던 샌드위치. 레터스의 맛이 강했는데 꼭 케일맛 같은 풀냄새가 강했다. 트러플크림프렌치토스트. 브리오슈라고 되어 있던데 난 바게트인 줄 알았다. 트러플향 진하고 크림도 진하고 토스트 부드럽고 맛있고 ㅠㅠ 라자냐. 요거 물건.. 중간에 사워크림 들어가는데 상콤하고, 고기냄새 1도 없고, 토마토소스 막 상큼하지 않으면서도 싱싱한 맛. 정말 너무 맛있었다. 햇살 맛집.. 동생친구 덕분에 맛있고, 즐거운 시간 보냈던 연남동 맛집 썸모어델리. 곧 조만간 또 방문해야지!"
