title,content
"서울) 연남동 주말에만 맛볼 수 있는 파리 디저트 맛집 파티스리 카페, ""세빠띠""","안녕하세요 소소한 기록쟁이 기마림이에요. 오늘의 기록, 연남동에 디저트 맛집이 있다고 해서 호다닥 다녀온 ""세빠띠"" 함께 보실게요! 시간 금,토,일 12:00 - 19:00 맛 ⭐️⭐️⭐️ + 반 주차공간 주변 길가에 댈 수 있었어요. 바로 옆 공간은 주차금지 베이킹클래스 예약 c'est parti 세빠띠 : 네이버 블로그 c'est parti 세빠띠 프랑스 디저트 수업 베이킹 클래스 / 원데이 클래스 서울특별시 마포구 연남동 570-25 1층 m.blog.naver.com 카페 옆쪽 공간은 베이킹 클래스 공간이었어요. 위의 블로그를 타고 들어가시면 신청 가능하니 한번 이용해보시길 바라요! 다음에는 저도 베이킹을 하러 가봐야겠어요 ㅎㅎ 세빠띠 서울특별시 마포구 동교로25길 53 1층 세빠띠 친구랑 할로윈 전 주에 갔었던 ""세빠띠"" 연남동에서 어딜 갈까 고민하던중에 친구가 여기 디저트가 그렇게 맛있기로 유명하다고 해서 같이 왔답니다. 주택을 개조한 카페였어요. 1층만 카페와 베이킹 공간으로 사용중이고 2층은 다른 곳이니 참고해주세요! 계단쪽 창문으로 보이는 공간이 베이킹 클래스가 이뤄지는 곳이었어요. 카페 들어서서는 조금 당황 헤헤 지금 보이는 공간이 다이기 때문이었죠. 자리는 4자리정도 있는 아담한 카페였어요. 가장 아쉬웠던 점은 그래서인지 소리 울림도 크고 자리 공간이 좁아서 좀 많이 시끄러웠답니다🥲 옆에 계셨던 분들이 너무 크게 대화를 하셔서 더 그렇게 느껴졌을지도 몰라요ㅠㅠ 화장실은 1인 사용 가능하고 매우 깔끔했어요. 직원분들도 너무 친절하셔서 좋았어요. 작지만 깔끔하고 고급스러운 느낌의 카페였답니다. 카페 바로 옆에는 클래스를 할 수 있는 넓은 베이킹 공간이 있었어요. 정말 밝은 분위기였고 베이킹 도구들도 정말 깔끔하게 정리되어 있어서 디저트 맛있으면 꼭 베이킹도 해보러 와야겠다 싶었답니다. 우리집에선 이런 화이트톤 주방 있을 수 없으니 이런 곳에서 한번쯤 베이킹 해보면 진짜 좋겠다 싶었어요 ""Today's menu"" 아보카도 애플주스 아이스아메리카노 (호박 & 휘낭시에) (service) 너무 귀여운 디저트 종류들🥺🥺 고급진 모양부터 누가봐도 귀여운 디저트까지. 이름과 함께 어떤 맛인지도 밑에 설명이 있어서 고르는데에 도움이 많이 되었어요. 쇼케이스 위에는 구움과자들도 있었답니다. 휘낭시에 마들렌 등 먹음직스러운 디저트 천지. 여기 까눌레가 맛있다고 들었는데 따로 못먹어서 다음에는 까눌레 먹어보려구요. 예전에 파리에서 먹었던 까눌레 진짜 감명 받을 정도로 맛있었어서 그 이후로 까눌레 한국 와서 먹었는데 돈아까워서 안먹었었거든요 ㅋㅋㅋㅋㅋㅋ 임채익(@chaeik_lim) • Instagram 사진 및 동영상 팔로워 13K명, 팔로잉 866명, 게시물 1,104개 - 임채익(@chaeik_lim)님의 Instagram 사진 및 동영상 보기 www.instagram.com 메뉴판은 벽에 크게 붙어있었고 확대를 원하신다면 사진 클릭해주세요✔️ 세빠띠와 임채익님의 소개가 간략하게 써있었답니다. 인스타 링크도 걸어놓을게요! 클래스 관련 사진들도 많으니까 구경해보세요~ 드디어 나온 우리의 음료와 디저트. 사실 시킨건 아보카도뿐인데 이때 할로윈 전 주여서 할로윈 주간까지는 호박 디저트를 서비스로 제공해주셨어요. 증말 센스...🎃❤️ 휘낭시에는 포크가 모자른 바람에 저희가 일회용을 쓰게 되었었는데 그게 죄송하다며 서비스로 제공해주셨어요😭 큰 문제 아니었는데 이렇게 해주시니 더 감사했답니다. 요리보고 저리봐도 너무 귀엽고 먹음직스러운 디저트들 맛이 너무너무 궁금해서 빨리 먹어 보고 싶었답니다! 우선 “호박”은 진짜 호박맛이 나요 ㅋㅋㅋㅋㅋㅋㅋㅋㅋㅋ 호박을 그다지 좋아하지 않은데 그래도 제가 안좋아하는 맛이 덜해서 먹기 좋았답니다. 너무 귀여워서 조그맣게 자르고 잘라 아껴 먹었어요. “휘낭시에”는 너무너무 딱딱해서 잘라먹기가 힘들긴했어요.. 헤헤 확실히 많이 달고 꾸덕한 느낌이 확 드는 디저트였어요. 커피랑 마시면 딱인듯한 디저트였답니다. 저는 주스를 시킨 바람에 달아서 많이는 못먹었어요. 그리고 대망의 “아보카도” 신세계였어요 진짜로 아이스크림 같이 차가운 식감에 연두색 부분은 아보카도맛 안에 들어있는 속재료는 바바나 바깥 껍질부분은 달지않은 초콜렛이었답니다. 식감이 부드러워서 일단 너무 좋았고 맛이 이게 어우러질 수 있구나에 신기했어요. 대신 많이 먹기엔 아보카도의 맛이 있다보니 느끼해져서 천천히 먹게 되었답니다. 이번에 인스타보니 아보카도도 클래스 하는 것 같더라구요. 직접 만들어 먹는 것도 재밌을 것 같아요."
"[마포/연남동] 세빠띠, 프랑스 쁘띠갸또 맛이 미쳐돌아가는 빵앗간","세빠띠 @cestparti_seoul Next image 레몬 타르트 6.0 산미 높은 썅콤앙큼 레몬 크림 위로 탱굴팅굴 레몬 젤리 보석함이 열렸다 🍋💎👑 스치는 약간의 달걀 향도 잊게 만드는 레몬 그 잡채 검은토끼 9.0 피스타치오, 산딸기, 크랜베리, 흑임자 킥 맞고 나 쥬금뭬 😇 계묘년 상징하는 것 넘어 엄청난 맛까지 안겨주는 씽크빅들!! Next image 호두 타르트 6.0 꽃이 피었습니다 🤎💛🧡 지방 오른 오동통 호두들 사이좋게 엮어주는 최강 접착제 진득쫜득 캐러멜 사랑혀 🫶🏻 버터 풍미 작렬하는 타르트지와 꼬숩 아몬드 크림 뽀시래기 긁어 호로록 🤤 아몬드 플로랑탱 3.4 사블레 브르통 3.4 호지차 콩고물 피낭시에 2.8 보르도 까눌레 3.3 호박 8.8 ⬇️ [암밍아웃] 주간일기 ep.12 21日 日曜日 🚴🏻♀️🏋🏻♀️ 세빠띠 @cestparti_seoul 호박 8.8 깊고 진한 호박 콩포트와 은은... m.blog.naver.com 아보카도 바난느 8.8 ⬇️ [암밍아웃] 주간일기 ep.05 3日 日曜日 🥛🚴🏻♀️ 프롬딥그린 @from.deepgreen 고르곤졸라 휘낭시에 2.9 얼그레이 마들렌 2.9 ... m.blog.naver.com 캐러멜 8.8 밀크 8.8 피스타치오 파리브레스트 8.8 ⬇️⬇️⬇️ [암밍아웃] 주간일기 ep.18 9日 日曜日 🚴🏻♀️ 세빠띠 @cestparti_seoul 카라멜 8.8 식감 몰랑쫜득탱굴. 탱글 아니고 탱굴. 탱... m.blog.naver.com 항시 신기하고 맛있어 🎃 🥑 🐰 소개하고픈 메뉴가 넘모 많아서 곤란 🤔🙃🙄 원물 맛 극상으로 끌어올리는 주특기를 무스와 인서트에 꽉꽉 담아 쫌쫌따리 킥과 함께 풀어내는 #세빠띠 이제 목 금 토 일 월 만날 수 있어!! 50m © NAVER Corp. 세빠띠 서울특별시 마포구 동교로25길 53 1층 세빠띠"
연남동 프랑스 디저트 카페 | 세빠띠,"디저트 맛집이라면 사족을 못쓰는 지니,, 우연히 사진을 보고 맛있어보여서 먹으러가자 했다가 드디어 방문하게 된 매장! 세빠띠 서울특별시 마포구 동교로25길 53 1층 세빠띠 사진 속 왼쪽은 매장 입구고 오른쪽은 베이킹클래스 룸이더라구요! 저도 나중에 기회가 된다면 꼭 한번 해보고싶어요. 1층이라고 적혀있지만 약간 반지하 같은 층고가 낮은? 매장이라서 키가 크시다면 불편하실 수도 있을 것 같다는 생각을 했어요! 매장은 전체적으로 화이트 톤이였어요. 넓지는 않았고 테이블 5개정도 있었는데 테이블 자체가 넓어서 좋긴 했습니다😉 세빠띠 매장의 로고 예뻐서 함 찍어봤어요 하하 아무래도 디저트 전문점이다 보니 머신도 그리 크진 않았어요. 하지만 난 디저트를 먹으러 온거니 상관없다! 약간 이 마인드 ? ㅎㅎ 한쪽에는 화장실, 한쪽에는 베이킹 클래스 룸 화장실도 엄청 깨끗해 보였는데 사용해보진 않았슴니돳,, 왜냐면 쓰고 나올까!? 이랬지만 까먹었다는,,(?) 세빠띠의 음료 가격은 4,500~6,000원 선으로 연남동 물가에 비하면 그리 비싼거 같지는 않다고 생각했습니다. 그냥 그럭저럭 하는 느낌이에요. 여기가 또 구움과자 맛집이라고 하더라구요! 마들렌/휘낭시에/까눌레/티그레/플로랑탱 5가지 종류로 있었는데 저는 아래 있는 무스케이크가 더 궁금해서 구움과자는 아쉽게도 패스ㅠ.ㅠ 구움과자 가격은 2,600원~3,800원 선 정도입니다. 대망의 무스케이크!!!!!!! 너무.. 예쁘잖아요🥰 사과, 오탕쥬, 복숭아 9,500원 살구, 아보카도, 청사과 케일, 밀크 9,000원 아무래도 무스케잌은 정성이 듬뿍 들어간 케이크인지라 가격대는 조금 있는 편이였습니다! 너무 예쁘지 않나요..?! 예쁘게 사진 찍으려고 정말 노력했던 것 같아요 ㅋㅋㅋㅋ 노력한 만큼 결과물이 나온 것 같아 뿌듯🤫 아이스 아메리카노는 정말 산미는 찾아볼 수 없을 만큼 무난한 원두의 커피였어요. 더운 날씨에 산미 싫어하신다면 부담없이 즐길 수 있을 것 같아요! ‘바닐라 데 질’ 달콤한 부르봉 바닐라와 코코아 향 사실 비염인인 저는 먹자마자 응..? 아무맛이 안나는데..? 했는데 몇번 먹다보면 코코아 향이 나는 것 같더라구요. 저는 티 종류는 별로 좋아하진 않는 편이라.. 제 취향은 아니였지만 남자친구는 정말 잘 먹더라구용!? 청사과 케일 무스 9,000원 여름과 잘 어울리는 청사과 케일 무스 왜 여름과 잘 어울린다고 하는지 알 것 같은 맛이에요. 청사과가 상큼하니 여름에 아이스 아메리카노랑 먹으면 정말 굿 안에 필링도 너무 맛있어서 호로록 해버렸습니다.. 밑에는 화이트초코로 덮인 비스켓이 있었는데 바삭한 편은 아니고 부드러운 식감의 비스켓이에요. 저는 타르트지의 식감을 좋아해서 제 취향은 아니였지만 전체 무스케잌의 맛은 너무 맛있어서 저는 완전 강추✔️ 아보카도 9,000원 아보카도와 바나나의 만남 딱 보자마자 그냥 아보카도 아니야? 할 정도로 싱크로율 100% 겉에는 초콜릿인데 초록색 색소를 넣은 거겠죠? 겉에 아몬드가 다닥다닥 붙어있어서 전 더 좋았어요. 안에는 바나나로 이루어져 있는데 바나나를 좋아하신다면 아보카도를 강추드립니다. 씨앗도 초콜릿으로 표현했는데 요거는 딱딱해서 한입에 녹여 드셔야해요 ㅋㅋㅋ 기대한 만큼 맛있는 디저트를 먹고 나와서 좋았습니다✨"
연남동 디저트 카페 세빠띠,"탐스러운 사과를 파는 곳 연남동 디저트 카페 세빠띠 안녕하세요~!~! 초코브레드입니다. 오늘은 연남동에 위치한 프랑스 디저트샵 '세빠띠'를 소개하겠습니다! 세빠띠에는 '쁘띠갸또'라고 하는 사과 디저트가 있는데요! 과연 어떤 디저트일지 무척 궁금하지 않으신가요?! 사과 말고도 아보카도, 복숭아 등의 다양한 쁘띠갸또를 만나볼 수 있는 곳! 세빠띠 지금 바로 함께 보시죠~! 세빠띠 🚪 서울 마포구 동교로25길 53 1층 🕰 목~월 12:30-19:00 (화,수 휴무) 📞 0507-1334-8372 세빠띠 서울특별시 마포구 동교로25길 53 1층 세빠띠 세빠띠는 홍대입구역 인근에 위치한 프랑스 디저트샵으로 하얀 주택 1층에 자리 잡고 있어요 오른쪽에는 베이킹 클래스가 진행되는 공간이 있고, 왼쪽에 매장으로 들어가는 문이 있어요 연남동 디저트 카페 세빠띠는 작년 5월에 오픈했다고 보았는데, 확실히 깔끔하고 아늑한 공간이었어요 로고마저 고급지고 세련된 카페 세빠띠였어요 세빠띠는 프랑스어로 시작, 출발을 뜻한다고 해요! 디저트와의 설렘이 시작되는 공간이었죠~ㅎㅎㅎ 디저트 하나하나 다 미친 비주얼이었어요 고급 호텔 가서나 볼법한 쁘띠갸또들! 마음 같아선 다 주문해 먹고 싶었네요 여기서 쁘띠갸또란 프랑스 정통 디저트로 작은 케이크를 이야기한다고 해요 나갈 때 보니까 예쁜 복숭아 쁘띠갸또도 있었어요 꼭 먹어보고 싶은 비주얼... 다음엔 복숭아 먹으러 가보렵니닷! 쁘띠갸또 말고도 평소 즐겨 먹던 휘낭시에와 마들렌, 티그레, 플로랑탱, 사블레 브르통 등 평소 많이 접해보지 못했던 프랑스 과자들도 있었어요 저는 이중, 콘레드 휘낭시에를 먹어보았는데, 먹자마자 '와 이거다' 유레카를 외쳤어요ㅋㅋㅋ 프랑스 리옹과 파리에서 디저트를 공부하시고, 가게를 오픈하셨다고 하는데, 정말 다르다 싶었어요 전에 프랑스 갔을 땐, 디저트를 잘 몰라서 마카롱만 냅다 먹었는데, 다음엔 제대로 한번 디저트 여행 떠나고 싶네요~! 다시 본론으로 돌아가서 행복을 곁들여 줄 음료도 주문하고~ 두근대는 마음으로 디저트를 기다립니당 저는 과연 무엇을 주문했을까요? 네! 저는 얼그레이 티랑 콘레드 휘낭시에, 사과 쁘띠갸또를 주문했어요 더 디저트 보고 난 이후에, 파티시에 분들 계정을 팔로우하였더니 알고리즘에 쁘띠갸또 카페들이 엄청 뜨더라구요 그중 한 곳이 세빠띠였는데, 사과 보고 냅다 방문하게 되었습니다 그리고 사과를 마주한 순간 너무나도 설레는 거 있죠 아주 탐스러운 사과예요 보기도 좋고 맛도 좋은 게 포인트 아래 크루스티앙과 사과 무스, 사과 콩포트가 너무나도 밸런스 있게 어우러지며 환상적인 맛을 내더라구요 음료도 아주 나이스 초이스 파리 얼그레이 아주 깔끔하고 시원해 추천합니다 콘레드 휘낭시에도 너무 맛있었어요 겉은 되게 단단하고, 쫀쫀한데, 안은 완전 부드럽고 촉촉했어요 세빠띠는 다른 쁘띠갸또랑 구움과자들도 다 맛있을 거 같아요 진짜 디저트 찐맛집... 다음에 또 다른 쁘띠갸또 먹으러 방문하겠습니당 지금까지 초코브레드의 연남동 디저트 카페 세빠띠 포스팅이었습니다! 감사합니다."
[연남동카페] 디저트카페 세빠띠/ 프랑스 디저트샵,"50m © NAVER Corp. 세빠띠 서울특별시 마포구 동교로25길 53 1층 세빠띠 운영시간 목 금 토 일 월 pm 12:30 ~ 19:00 세빠띠 인스타그램 세빠띠 c’est parti(@cestparti_seoul) | Instagram 팔로워 6,664명, 팔로잉 1명, 게시물 349개 - 세빠띠 c’est parti(@cestparti_seoul)님의 Instagram 사진 및 동영상 보기 instagram.com 안녕하세요 오늘도 다녀온 디저트샵!!! 연남동에 있는 세빠띠 라는 곳인데요 지하철에서 도보 15~20분 정도 소요되지만 그만큼 값어치가 있어 인기가 많은 카페랍니다!! 홍대입구역 1번출구로 나오셔서 직진인데요! 가게는 깔끔한 화이트톤에 잘 보일 수 있게 입간판도 있었습니다 테이블은 5팀정도 앉을 수 있었으며 테이크 아웃으로도 많이들 포장해가시더라구요 늦으면 무스케이크 종류가 많이 없어요 ㅠㅠ 세빠띠 공식 인스타로 예약할 수 있으니 드시고 싶으신게 있다면 ⭐예약 필수⭐ 구움과자류와 무스케이크가 있는 쇼케이스입니다! 여러가지 메뉴를 먹어보았지만 그중 하나만 꼽자면 아보카도가 대표메뉴라고 해서 먹었는데 너무 맛있었어요!! 프랑그 디저트를 좋아하는 저로써는 다른 종류의 케이크도 맛있게 잘 먹었지만 아보카도를 좋아하지 않는데 이 무스케이크는 아보카도의 맛이 느껴지면서도 바나나콩포트가 적절하게 어우러져 정말 맛있었습니다!! 구움과자류던 무스던 거를타선이 없었지만 구움과자에서는 특히 까눌레가 맛있었는데요! 겉바속촉에 한입 먹는 순간 럼 향이 확 퍼지는 그런 까눌레였습니다 다른 곳 까눌레를 먹다보면 기름 맛이 너무 많이 날 때가 있는데 세빠띠는 전혀 그런 것이 없어서 좋았습니다!! 클래스도 오픈하고 있으니 관심이 있다면 한번 배워보러 가시는 것도 추천드립니다!!"
연남동 파티세리 _ 프랑스디저트 전문점 세빠띠,연남동에 위치한 쎄빠띠에 다녀왔어요. 올리커 파티쉐로 활약하셨던 임채익 쉐프님이 오픈한 가게인데- 가봐야지 하다가 이제서야 다녀왔습니다. 인기 구움과자들이 반기고 있네요:-) 마들렌과 휘낭시에 쿠키와 까늘레까지- 플로랑땡과 사블레브루통도 있습니다. 쁘띠갸또들도 쇼케이스에 진열되어 있어요. 호박 뇨녀석도 먹어보고 싶었는데- 다른 메뉴 픽하느라 못 먹어봤네요- 한여름밤 개인적으로 너무 좋아하는 몽블랑을 선택했어요! 다음에 방문했을 때 새로운 갸또들 먹어볼겁니다- 몰드를 이용해 이쁘게 만들어진 제품들도 좋지만 이렇게 다양한 식감의 조화로 쌓아올린 제품들도 좋은 것 같아요 :) 기회가 되면 만들어보고픈 몽블랑🤎 그리고 몇 가지 구움과자를 골랐습니다. 공주와 같이 카페에 가면 꼭 케이크나 빵을 하나 고르는데- 요맘때는 갈레트에 꽂혀서 노래를 부르길래 갈레트부르통을 주었습니다. ㅎㅎ 언제나 즐거운 디저트투어 세빠띠 서울특별시 마포구 동교로25길 53 1층 세빠띠 디저트일기 ©윤예담
구움 과자도 케이크도 맛있는 연남동 세빠띠,"오랜만에 찾은 연남동 강력한 추천을 받고 찾은 세빠띠! 세빠띠는 1층에 위치하고 있다 들어가자마자 반겨주는 구움 과자와 케이크들 사진이 좀 얼룩 거리게 나온 건 여기 조명이 좀 특이해서..ㅋㅋ 실제로는 밝고 예쁘다 음료는 커피와 차, 주스, 탄산수가 있다 어둑..하게 나왔지만 실제로는 밝다!! 저 줄 모양 형광등(?)이 사진 찍을 때만 어둑..하게 나오는 효과가 있나봄ㅎㅎ 미리 말하지만 이날 거의 10만 원어치 먹어서 사진이 많음ㅋㅋㅋㅋㅋ 여러 개를 시키면 먹는 순서도 알려주신다 첫 번째는 피스타치오! 구수한 피스타치오가 아낌없이 들어가서 풍성한 맛.. 밀크! 자르면 초코가 우르르 쏟아지니 동영상 찍기에 좋은 케이크ㅎㅎ 밀크 초콜릿이 깔끔하고 산뜻해서 좋았다 루바브 살구! 아주 새콤해서 여름에 아주 잘 어울리는 무스 케이크! 난 살구를 넘 좋아해서 넘 맛있게 먹음 추천해 주신 순서의 마지막! 이름이 기억 안 남....ㅋㅋ 근데 이게 제일 맛있었다! 오렌지+초코 조합의 찐~한 조합! 아 이름이 오랑쥬였나..? 구움 과자도 한 바가지(?) 먹음 나는 플로랑땡이 원픽! 피낭시에랑 마들렌도 평소에 먹던 것보다 더 꾸덕꾸덕하고 압축된 느낌이라 맛있었다 마들렌 마이쪄 커피도 맛있습니다 구움 과자 한 판 더....ㅋㅋ 세빠띠에서는 메뉴를 눈 감고 골라도 다 맛있게 먹을 수 있을 듯ㅋㅋㅋ 쇼케이스에 아까 못 본 복숭아가 들어와서 마지막으로 먹어봤다 해동이 덜 되어서 안내해 주신 대로 좀 더 녹여 먹었는데 더 녹여 먹었어야... 복숭아 아이스크림처럼 먹음ㅋㅋ 그러고 보니 여름 한정으로 아이스크림 해보시는 것도 괜찮을 것 같다ㅎㅎ 친구들과 달콤한 시간을 보내고 온 세빠띠! 여름이 가기 전에 다른 무스 케이크도 또 먹고 싶다..! 50m © NAVER Corp. 세빠띠 서울특별시 마포구 동교로25길 53 1층 세빠띠"
