title,content
홍대 연남동 귀여운 일본빵집 ; 모리노팡,"안녕하세요 B오다 입니다! 연남동에서 일정을 마무리 하기 아쉬워서 일본빵집을 한 곳 더 방문했습니다₍ᐢɞ̴̶̷.̮ɞ̴̶̷ᐢ₎ 원래 자주 가던 아오이토리를 가려다가 근처에 처음 보는 곳이 있길래 거기로 고고! 바로 포스팅 시작할게요. 홍대 연남동 모리노팡 ☎ 0507-1334-1360 ✔ 가게 위치 : 서울 마포구 연남로5길 42 1층 (홍대입구역 2번 출구에서 671m) ✔ 영업 시간 : 매주 월요일 정기휴무 11시 오픈, 20시 마감 ✨재료 소진시 조기 마감 모리노팡의 모든 빵은 동경제과를 수석 졸업하신 사장님이 직접 만드신다고 하네요. 참고로 모리노팡은 숲의 빵이라는 뜻이래요. 이제 그럼 빵구경 해볼게요👀 모리노팡 내부 및 빵종류 들어가자마자 빵이 되게 많아서 행복했습니다₍ᐢɞ̴̶̷.̮ɞ̴̶̷ᐢ₎ 일단 메론빵 무덤이 눈에 띄네요. ㅋㅋㅋㅋㅋㅋㅋㅋㅋㅋㅋㅋㅋ 내부에 테이블도 있어서 먹고 갈 수 있어요! 음료는 아메리카노와 라떼 딱 2가지 그리고 평일 한정, 선착순 15명에게 커피를 주문하면 버터가 올라간 토스트 한 조각을 증정하시네요₍ᐢɞ̴̶̷.̮ɞ̴̶̷ᐢ₎ 입구 바로 옆에도 빵이 있습니다₍ᐢɞ̴̶̷.̮ɞ̴̶̷ᐢ₎ 여긴 담백한 빵 위주로 식빵과 도그빵, 러스크가 있습니다. 야키소바빵(짱구의 소울빵) 3.7 카레빵 3.9 앙팡(단팥빵) 2.2 소세지빵 3.9 네임택도 일본어로 적혀있어서 일본 빵집에 온 느낌이에요. 제일 먼저 눈에 띄는 야키소바빵은 짱구가 좋아하는 빵인데 저는 야키소바를 안 좋아해서... 카레빵만 집었습니다(∗❛⌄❛∗)ᕗ 메이플프렌치토스트 3.4 명란모찌치즈빵 3.9 햄피즈프렌치토스트 3.8 후기에 프렌치토스트가 맛있다는 얘기가 있어서 프렌치토스트도 하나 겟(∗❛⌄❛∗)ᕗ 명란바게트 4.2 메론빵 2.2 연유크림 소금빵 2.9 카라멜 소금빵 3.6 초콜렛 소금빵 3.6 메론빵과 명란바게트가 있고, 소금빵 종류가 되게 다양했어요! 모리노팡의 특징 중 하나 이렇게 귀여운 동물모양 빵이 있습니다. 맛은 평범하고 가격은 비싸지만 너무 귀여워서...저도 모르게 집었어요 (〃⌒▽⌒〃)ゝ 소금빵 기본맛은 종이개별포장 가격도 되게 저렴해요 1.8!!!!!! (욕한거 아님) 마지막 링고팡(사과빵) 3.8 이렇게 진열된 빵소개는 끝입니다. 저도 모르게 하나 둘 집다보니 바구니가 꽉 찼어요 ㅋㅋㅋㅋㅋㅋㅋㅋㅋㅋ 생크림 딸기샌드 4.9 몽쉘통통 3.8 생크림단팥빵 3.6 쇼케이스에는 크림류 빵이 있습니다. 지금 딸기샌드 안사온걸 후회하고 있어요. 짐이 너무 많아서..크림빵은 포기했는데🤣 머리에라도 이고 올걸...흑흑 모리노팡의 빵 소개는 끝! 종류가 생각보다 많죠? 고민하고 고민하다가 제가 구매한 빵, 소개해드릴게요₍ᐢɞ̴̶̷.̮ɞ̴̶̷ᐢ₎ 모리노팡 쿠로네코 4.3 고양이가 너무 귀여워서 구매한 쿠로네코 맛은 평범한 초코빵이에요 ㅋㅋㅋㅋㅋㅋㅋ 제가 고른 빵 중에서 제일 비싸지만,,, 귀여워서 포기모태₍ᐢɞ̴̶̷.̮ɞ̴̶̷ᐢ₎ 소금빵 1.8 메이플프렌치토스트 3.4 카레빵 3.9 차례대로 소금빵/프렌치토스트/카레빵 에프를 너무 돌려서 빵이 넘 바짝해졌어요🤣 딱 2~3분 정도만 돌리면 될 것 같아요. 후기가 좋아서 기대했던 메이플프렌치토스트 메이플향이 솔솔 나서 되게 좋았는데, 프렌치토스트 맛은 쏘쏘..그냥 일반빵 느낌 프렌치토스트의 촉촉함이 더 강했더라면 좋았을텐데 아쉬움이 들었습니다🥺 카레 향이 진하게 났던 카레빵 이건 추천드립니다!!! 진짜 맛있어요. 카레가 은근 매콤해서 빵이랑 잘 어울려요₍ᐢɞ̴̶̷.̮ɞ̴̶̷ᐢ₎ 카레빵은 재구매의사 있습니다. 초승달 모양의 소금빵 소금빵도 너무 담백해서 제 취향은 아니었어요. 전 소금의 짭쪼름함이 느껴지는 빵을 좋아하는데 모리노팡 소금빵은 담백 그 자체 약간 버터 향이 강하게 나는 모닝빵 느낌..? 저는 다음에 방문한다면 딸기샌드랑 카레빵만 구매할 것 같습니다₍ᐢɞ̴̶̷.̮ɞ̴̶̷ᐢ₎ 담백한 빵을 좋아하신다면 추천드려요."
연남동베이커리 - 모리노팡,"연남동 갔을때 하드빵 쇼핑은 코코리코에서 했다면 여긴 일본식 베이커리를 만날 수 있는 모리노팡. 예전에 딸아이가 여기서 아빠 좋아할것 같다며 단팥크림빵을 사왔는데 넘 맛있다고.. 그때 사온 식빵이랑 야끼소바빵도 맛이 좋았던 기억이 나서. 연남동 온김에 저도 구경하려고 방문했죠. 동경제과를 수석으로 졸업한 일본의 유명 셰프 쿠라타 히로카즈의 수제아인 브레드 아티스트가 만든다고 네이버에 소개되어 있더라구요. 숲의 빵이라는 모리노팡. 앉아서 드시고 갈 테이블도 있구요. 일본식 빵은 또 특유의 그 맛이 있잖아요. 얄밉도록 입에 착 붙는... 촉촉하고 쫀득했던 키와메쇼크빵. 그때 기억이 나서 담아오고, 일본 현지에 온듯한 비주얼을 자랑하는 야끼소바빵^^ 카레빵도 사올껄... 일본베이커리 하면 카레빵도 맛봐야 했는데. 이래서 또 다음을 기약하는 ㅎㅎ 흑임자 올려진 앙팡(단팥빵) 감태 한장에 홀리듯이 담은 명란 바게트. 그 옆에 멜론빵도 있네요^^ 소금빵 애정하는 아이라 시오빵 사러 온거죠^^ 아우.. 이름참 일본시려워 ㅎㅎ 캬라메르 시오바타~ 읽으면서 다나카 되는 기분 ㅋㅋ 딱 일본 베이커리를 맛 볼 수 있는 곳이죠? 아이고 앙증맞아라 ㅎㅎㅎ 남편이 맛보고 반한 나마앙팡~ 단팥에 달지 않은 부드러운 크림이 가득. 계산대에 미니 자판기.. 아.. 또 여행가고프다..ㅠㅠ;; 빵순이라서 행복했던 연남동 투어였죠 ㅎㅎㅎ 오후엔 품절되는 빵 많다고 하더라구요. 일본식 부드럽고 촉촉한 식빵맛이 그리운 분들이라면 요기도 들려 보세요^^ 명란바게트는 명란 맛이 좀 약해서 so so.. 신제품이었던 아부리치즈팡 꼭 드세요. 아주 고소하고 쫀득하고 난리 ㅎㅎㅎ 모리노팡 서울특별시 마포구 연남로5길 42 1층 모리노팡 #모리노팡 #연남동베이커리 #빵맛집 #연남동맛집"
"[마포/연남동]연트럴파크베이커리/연남동빵집/일본식베이커리""모리노팡""","[마포/연남동]이브네일(EVE)젤네일맛집/봄맞이네일추천 연남동 미소식빵 옆에 위치한 이브네일. 별안간 네일을 받고 싶다는 3호. 소개받은 네일 가게가 있는데 가... m.blog.naver.com 네일을 받다 우연히 알게된 동네 유명빵집. 네일가게 대각선 방향에 위치하고 있다. 난 이런 동네 소소하게 유명한 빵집을 좋아하는데 얼핏봐서는 빵집인지 잘 분간이 안간다. 웨이팅 빵집을 가보면 고급 버터냄새가 진동을 하는데 이곳은 그런 느낌은 없고 눈에 띄지 않고 소박한 느낌이다. '숲의 빵' 이라는 뜻을 가진 모리노팡. 숲의 빵이라는 이름처럼 연트럴파크에서 그다지 멀지 않은곳에 있는 모리노팡. 모리노팡의 모든 빵은 동경제과를 수석졸업한 일본의 유명 셰프인 쿠라타 히로카즈의 수제자인 브레드 아티스트가 만든다. 모리노팡 서울특별시 마포구 연남로5길 42 1층 모리노팡 홍대입구역 2번출구에서 671m 화요일 - 일요일 11:00 -20:00 매주 월요일 정기휴무 📞 0507-1334-1360 토토로가 사는 숲을 재현해놓은 디피가 귀엽다. 한쪽구석에 살포시 얹어져 있는 이끼까지 완벽 재현. 모리노팡의 시그니처중 하나인 키와메 쇼쿠팡. 프리미엄 탕종식빵이라고 하는데 탕종법으로 빵을 만들면 부드럽고 더욱 촉촉하다고 한다. 음료는 아메리카노 / 라떼 두종류만 구비되어 있는데 , 커피 주문시 고소한 버터 한조각을 올린 토스트를 구워준다고 한다 ★ 평일 한정 (선착순 15명) 우린 선착순에 밀려 키와메 쇼쿠팡을 맛볼 기회를 놓쳤다 ! 0℃ 에서 보관중인 나마초코 & 나마앙팡 당일 재구매 1위라는 나마앙팡은 사진의 단면같이 폭신한 빵안에 생크림과 단팥이 어우러진 인기빵이다.한국에서는 생크림빵이 크게 인기있진 않은데 일본빵집에서는 과일샌드같이 생크림을 이용한 빵이 아주 많다. 동물빵 시리즈 (검은 고양이 / 코알라 / 토끼 ) 디테일의 끝판왕인 일본답게 귀여운 동물시리즈의 빵도 놓치지 않았다. 아이들도 좋아하겠지만 디테일이 귀여워서 어른들도 좋아할것 같은 비쥬얼. 일본 드라마나 만화에 등장할법한 야키소바빵과 카레빵. 일본에서야 흔하겠지만, 한국에서는 살짝 도전이다. 식사 대신해서 먹어도 될것 같다. 약간 피자빵같이 든든한 느낌이다. 카레빵도 일본 카레는 살짝 매운 하이라이스 맛이라 거부감 없이 먹을수 있다. 이곳의 시그니처중 하나라는 소금빵. 내가 갔을땐 베이직한 맛은 보이지 않았고,연유크림맛과 카라멜 소금빵만이 있었다. 단짠단짠의 정석인 카라멜 소금빵은 좀 궁금했다. 우리나라 소보로 빵과 비슷한 비쥬얼의 메론빵. 일본 청소년물 드라마를 보면 이 메론빵을 거의 복용(?) 하는 수준이던데 그만큼 무난무난한 맛이다. 곁에 다소곳이 자리 잡은 칠리새우 샌드. 한개만 남아 있어서 배만 안불렀으면 너무 먹어보고 싶었다. 핫도그빵에 넣은것이 더욱 맛나 보였다. 빵 파도 영상🌊 일찍 가면 원하는걸 ~ 담을수 ~있다 매장이나 바깥에 먹고 갈수 있는 좌석이 5곳 정도 되는데 테이블과 의자가 특이해서 이 분위기를 느껴보고자 잠시 머무르기로 했다. 빵을 몇가지 사고 자리에 앉아 나마앙팡을 맛보기로 했다. 사실 베이커리 전문점이라 커피는 별기대가 없었는데 아메리카노도 꽤 맛있었다. 생크림이 듬뿍 들어 맛없을수 없었던 나마앙팡 (생크림 단팥빵) 다음에 가면 소금빵과 칠리새우 샌드를 맛보리라 다짐했다. 매장에서 먹고 간다고 하니 작은 상에 귀엽게 담아 주셨다. 크게 물리지 않고 디저트로 한입 먹으면 충분한 느낌이다. 디저트,간식,식사대용으로 먹을 곳이 많은 모리노팡. 나만 알고 싶은 빵집을 소개하며 이만. #모리노팡 #연남모리노팡 #베이커리 #빵지순례 #일본식빵집 #morinopanbakery #홍대빵집 #동네빵집 #데이트 #연트럴파크베이커리 #나마앙팡 #마포빵집 #힐링 #디저트 #빵순이 #연남동가볼만한빵집 + 다시찾은 모리노팡. 전에 사려다 못산 궁금한 빵들 다사봄. 먹었을때 우와 ~하는 맛은 없었지만 어느새 순삭한 나 . 요즘은 강한 버터향 보다 은은한 향의 순한맛이 입맛을 자극하는것 같다."
모리노팡 ··· 날 빵순이로 만들려는 연남동 빵집,"모리노팡 ··· 날 빵순이로 만들려는 연남동 빵집 모리노팡 서울특별시 마포구 연남로3길 22-16 101호 모리노팡 5가지의 빵을 먹은 후 느낀건 '아 그냥 기본빵 자체가 다 맛있구나.' 였다. 나는 빵순이가 아니다. 밀가루는 좋아하지만 국수를 더 좋아하는 것 같기도 하다. 그리고 빵순이가 아니라는 사실 중 가장 큰 이유는 나는 밥파-이다. 간식도 그리 찾아먹는 스타일은 아니지만 옆에 있으면 조금 맛은 본다. 그래도 빵은 싫어할 수 없는 그 자체가 아닌가. 내 친구 구씨가 정말 빵순이인데, 이 곳을 추천해주면 어떨까.라는 생각이 스쳐지나갔다. 남편이 아는 동생과 약속이 있어서 연남동에서 점심을 먹는다고 했다. 그리고는 그 동생이 제빵하는 친구여서 연남동 온 김에 꼭 가보고 싶은 빵집이 있다고 했다. 나는 궁금해서 그 곳이 어디인지 물어보았다. ""모리노팡 이라는 빵집이라는데 들어봤어?""라고 말했는데 생소한 이름이었다. 처음 듣는 곳이었다. 그 날 남편은 제빵하는 동생의 추천으로 빵 5가지를 포장해왔다. 정말 개인적인 입맛으로 5가지를 순서대로 소개해 볼 예정이다. 야끼소바빵 3,300원 한번 맛 보면 자꾸 생각나는 그 빵. 볶음면이 빵 속으로 들어간 이국적인 맛. 나는 이미 야끼소바빵을 다른 빵집에서 먹어본 경험이 있고, 남편은 처음 먹어보는 상황이었다. 처음에 나도 빵에 면이? 이게 어울려?라는 입장이었는데 ""오 생각보다 괜찮은데?""라는 반응으로 마무리가 되었다. 그리고 실제로 식사대용으로도 좋은 든든함이 더 크다고 생각했다. 그때 점심식사 대신 야끼소바빵을 먹은 것이 좋은 기억으로 남아있어서 그런 것 같다. 연남동 빵집 모리노팡의 야끼소바빵을 먹은 나의 반응은 이 빵 뭐야? 였다. 분명 야끼소바빵인데 기본 빵이 너무 내스타일로 맛있어서 야끼소바랑 따로 먹고 싶었다. 왜냐면 나는 개인적으로 정말 부드럽고 촉촉한 핫도그 빵을 좋아하는데 이 빵이 딱 그랬다. 푸석함 전혀 없는 밀도 높은 맛. 멘 타이 바겟토 (명란바게트 + 감태) 3,800원 후쿠오카 명물. 오리지날 명란의 맛. 명란 바게트는 사실 익숙한 맛이었다. 남편은 이 빵을 정말 맛있어했다. 나도 물론 맛있었지만 다른 빵이 더 강하게 다가왔다. 근데 명란과 감태가 생각보다 엄청난 시너지효과를 냈다. 감태와 이렇게 잘 어울릴지 몰랐는데 명란바게트의 맛을 더 올려주는 역할을 톡톡히 한 느낌이었다. 연남동 빵집 모리노팡의 명란바게트는 먹기 좋게 조각 조각 나눠져있었다. 바게트와 명란의 만남은 누가 처음에 발견했을까. 이 조화가 정말 중독성있게 다가온다. 짭쪼롬한 명란과 감태만의 바다향 그리고 쫄깃한 이 곳의 바게트 맛이 하나의 조화로운 빵을 만들어버렸다. 렌뉴 크리-므 시오바타 (연유크림 소금빵) 2,700원 달콤한 연유가 들어간 소금빵(시오버터). 나는 소금빵을 정말 좋아한다. 근데 그런 소금빵안에 연유가? 무조건 단짠의 빵이라는 것을 느꼈다. 귀여운 사이즈의 소금빵 안에 연유가 가득하게 들어있는것이 보인다. 이거 한 입 먹으면 연유가 밖으로 나오겠는데?라는 생각을 적중한 연남동 빵집 모리노팡의 연유크림 소금빵이다. 내가 먹어 본 소금빵 중 가장 짭쪼롬한 맛이 많이 난 빵이었다. 연유가 들어있어서 단짠의 맛을 더 극대화하기위한 이유여서였을까. 오리지널 기본 소금빵이 궁금해졌다. 남편이 포장해오면서 안그래도 그냥 소금빵을 여쭤봤는데 디피 되어있지는 않고 미리 요청하면 주신다고는 했던 것 같다고했다. 다음에 오리지널 소금빵을 먹으러 가야겠다. 타라못치-즈 3,800원 모리노팡 아티스트가 직접 만든 수제모찌와 짭쪼롬한 오리지널 명란의 조화 연남동 빵집 모리노팡의 타라못치즈는 BEST라는 표시와 별 3개가 그려져있던 빵이었다고 한다. 그리고 ""이런 빵 보셨어요?""라는 멘트가 적혀있다. 그래서 남편도 궁금해서 사와봤다고 했는데 정말 처음 먹어보는 맛이었다. 기본 빵은 약간의 부드러운 바게트빵 같은 식감이었다. 촉촉함 보다는 약간의 바삭함에 가깝다고 해야하나 아주 약간 푸석한 빵이었다. 그리고 그 안에 이 곳 아티스트가 직접 만든 수제모찌와 명란이 들어있다. 수제모찌의 쫀-득함이 이 빵의 엄청난 포인트로 다가왔다. 그 양 옆으로 명란과 빵의 식감이 하나의 타라못치즈를 만들었다. 이 빵은 남편과 하나를 반으로 나눠먹으며 더 먹고 싶은 빵이 되었다. 조만간 가서 이건 또 사오지않을까-라는 확신이 들었다. 이 곳의 BEST 답다. 메롱팡 (메론빵) 2,200원 주의 : 메론빵에서 메론을 찾으시면 안됩니다. 개인적으로 빵 5가지를 쭈욱- 보았을때 제일 기대가 없었던 빵이었다. 나는 메론빵에 관심이 없었기 때문이다. 남편이 메론빵을 즐겨먹기에 한입씩 먹어보았을때 메로나는 정말 사랑하지만 메론빵은 사랑... 까지는 할 수 없는 존재였다. 내 입맛에는 그랬다. 그래서 ""메론빵은 오빠꺼구나."" 라는 당연한 생각이었는데 연남동 빵집 모리노팡의 메론빵은 달랐다. 내가 그동안 먹었던 메론빵은 메론의 향이 인위적으로 느껴지는 기분이었는데 이 곳의 메론빵은 그 향이 훨씬 은은했다. 그래서 내 입맛에는 아주 잘 맞았던 것 같다. 그리고 무엇보다 나는 소보로빵을 정말 좋아하는데 소보로빵의 그 약간의 푸석함이 항상 아쉬웠다. 근데 이 메론빵이 소보로빵 같으면서도 엄청난 촉촉함과 쫀득함을 지니고있었다. 일단 푸석하지 않았다고 말하면 소보로빵 좋아하는 분들은 딱 알지않을까 싶다. 오빠와 메론빵을 먹고는 둘 다 ""맛있다.""라는 눈빛을 주고받을 수 있었다. 이 곳의 스테디 셀러 빵 다운 맛이었다. ●영업시간 : 11:00 - 20:00 (빵 소진시 조기 마감) / 매주 월요일 휴무 단체 주문은 최소 2일 전 예약해야함. 홍대입구역 3번 출구에서 도보 17분정도 예상한다. 연트럴파크를 걷다가 연남파출소쪽으로 빠져서 유명한 감나무집이 있는 쪽에 위치 하고있다. 모리노팡은 동경제과학교를 수석 졸업한 브레드 아티스트가 직접 만든 빵이라고 한다. 그리고 최근에 오픈한 곳이기도하다. 이번에는 남편이 빵을 포장해왔지만 다음번에는 직접 가서 빵을 구경 해보고싶다. 더 인기가 많아지기 전, 그리고 무엇보다 빵이 소진되기 전에 빠르게 다녀와야겠다. :-) #모리노팡 #연남동빵집"
"먹을까 말까/ 빵순이 취향 저격! 야키소바 빵이 맛있는 연남동 일본식 베이커리 맛집 ""모리노팡""","모든 빵이 다 취향 저격!! 연남동 빵 맛집 ""모리노팡"" 모리노팡 서울특별시 마포구 연남로5길 42 1층 모리노팡 영업시간 화 - 일/ 11:00 - 20:00 제품 소진 시 마감이라고 하며 매주 월요일은 정기 휴무라고 합니다! 맛있는 일본 빵집이 있다고 해서 찾아갔던 연남동의 ""모리노팡"" 예전에 자주 갔었던 도쿄팡야가 생각나더라구요~ 어머어머 소품부터 제 취향♥ 토토로 넘 귀엽쟈낭 빵도 어쩜 이리 귀엽게 만드시나요오 탕종식빵도 조금씩 맛볼 수 있게 소포장되어 있는 게 좋더라구요 식빵 하나 사가면 다 못 먹고 오래돼서 버리게 되고 그러잖아요 요건 아이디어 좋은 듯! 야키소바 빵 없을까 봐 조마조마했는데 다행히 있더라구요ㅋㅋ 신나게 이것저것 또 골라왔어요 신난당!! 빵 먹으러 가자~~~~~ 집에 오자마자 바로 먹어봄ㅋㅋㅋ 아부리치즈팡 4,500원 치즈케이크 빵 같은 느낌이었는데 달콤하고 부드러워서 계속 손이 가더라구요! 시오바타 1,800원 작고 길쭉했던 소금빵 고소하고 담백한 맛! 에어프라이기에 돌려먹었으면 더 맛있었을 듯! 멘타이바겟토 4,200원 감태와 매콤한 명란이 들어있는 바게트 짭조름한 명란과 감태의 조합이 킬포였어요 비주얼도 훌륭하고 맛있었음 나마초코 3,800원 차갑게 먹어야 맛있을 듯! 저는 오자마자 먹어재꼈기 때문에 요건 좀 그냥 그랬어요 고급 진 몽쉘 맛ㅎㅎ 제일 기대했던 야키소바빵 3,700원 한입 먹었을 땐 음? 좀 심심한데? 싶었는데 마요네즈를 얹어먹으라는 친구의 추천으로 그렇게 먹어보니 맛있음!!! 원래 야끼소바 먹을 때 마요네즈 잔뜩 뿌려서 먹으면 더 맛있잖아요 딱 그런 맛!ㅎㅎㅎㅎ 마요네즈가 신의 한 수 였음ㅋㅋ 특이한 빵을 먹고 싶으시거나 맛있는 일본식 베이커리 맛집을 찾으신다면 연남동 ""모리노팡"" 추천드려요! 구입해 온 모든 빵들이 모두 다 맛있었으면 할 말 다 했죠 뭐ㅋㅋㅋㅋ 그럼 맛생하십쇼 여러분~~~ * 광고 아님! 내돈 내먹입니다요!*"
