title,content
연남동 랜디스 도넛 / 맥코이 연남 / 씨스터브레드 / 페리카나 매운양념 반 간장 반 꼬들목 추가,페리카나 매운양념 반 간장 반 + 꼬들목 간장은 별로였고 매운양념이랑 꼬들목이 존맛이었다 연차 쓴 날 연남동 랜디스도넛 오픈 시간에 맞춰 가서 애플프리터 글레이즈 크론디 슈가 크론디 초콜렛 크론디 버터크럼 도넛 여유롭게 구입 포장하고 맥코이커피 가서 맥코이커피 마셨음 존맛 두 잔 먹고 싶었는데 참았다 연남동 씨스터브레드 여기도 오픈 시간 맞춰 가서 소금빵 세 개 샀다 못참고 길빵함 맛있었다 집에서 아메리카노랑 먹고 남은 건 냉동보관했다 막상 사온 당일엔 별로 안 땡겼는데 이 다음날부터 너무 맛있게 하루에 두 개씩 먹어치움 연차 쓰고 또 사러갈까 고민중이다
연남동의 맛있는 커피가 먹고싶다면 맥코이커피,"#맥코이연남 주소 서울 마포구 성마산로 147 영업시간 매일 09:00 - 21:00 전화번호 070 - 8648 - 2210 배가 부르다면 배를 두드리며 찾아주어야 하는것은? 바로 카페입니다. 한국에 이런문화가 있는것은 한국에 광장이 없기때문이라는 말을 보았지만 지금도 한국에는 광장이 없으니 어쩔 수 없습니다. 걸어가다가 헐? 분위기 무엇? 하고 멈춰선 이곳 연남동의 맥코이커피입니다. 딱 가로수들이 상해에 있는 큰 나무들처럼 크고 높았고 뭔가 그 분위기에 딱 맞는 나무로 된 인테리어 칭찬합니다. 저곳이 좋다며 가리켰더니 지인도 이 곳 좋다며 들어가게 되었습니다. 매장은 넓지 않았습니다. 지금 이렇게 보이는 큰 테이블과 사이드로 좌석 3개 그리고 앞으로 쇼파에 2명이 앉을 수 있습니다. 평일이라 북적이지 않아서 큰테이블의 귀퉁이에 자리를 잡고 앉았습니다. 마치 상해에 와있는듯한 느낌을 느낍니다. 리틀상해 ㅠ 앞으로 보이는 유리창도 영화에서나 보는 그런 갬성 아니던가요? 우리나라의 카페갬성은 무릇 아무것도 없는 유리통창인데 말이죠 이런 나무나무 저는 너무 사랑합니다. 대체적으로 의자가 편하거나 테이블이 편하지는 않습니다. 그치만 갬성입니다. 2032년의 그 유튜브짤은 말도 안된다고 생각하지만 이건 정말 갬성입니다. 그리고 나온 커피 맥코이커피 (6,000원 - 시그니처메뉴) 아메리카노 (5,000원) 진짜 친구의 맥코이커피를 한 입 먹고 위에 올라와있는 폼이 무엇일까 한참 이야기를 했습니다. 결론은 모르겠고 맛있습니다. 짭짤하면서도 생크림만으로 만들어진것 같지는 않고 짜기만 한게 아닌 달고 그위에 더해지는 쌉쌀한 커피향까지 완벽한 조화입니다. 그래서 다른날 다시 방문한 맥코이커피 초코라떼 아이스(6,000원) 맥코이커피(6,000원) 위에는 아메리카노가 제것이었으나 여기서는 맥코이커피가 제것입니다. 이것만 보아도 얼마나 맛있는지 아시겠죠? 시골에서는 맛볼 수 없는 크림에 시그니처메뉴를 선택했습니다만 아메리카노 또한 구수하면서도 커피향이 제대로나는 그런 원두였습니다. 이쯤되면 커피칭찬에 인테리어가 잊혀졌으니 내가 지금 어디에서 커피를 마시고 있는지 주변을 둘러봐줍니다. 마지막 아이폰갬성의 마무리사진 한장과 정말 맛있는 커피가 한 잔 마시고 싶다면 꼭 방문해주세요 연남동의 맥코이커피 50m © NAVER Corp. 맥코이 연남 서울특별시 마포구 성미산로 147"
연남동카페 McCOY’S (맥코이 연남점),"McCOY’S 맥코이연남점 연남동카페 연남카페추천 서울카페추천 연남동카페추천 50m © NAVER Corp. 맥코이 연남 서울특별시 마포구 성미산로 147 주소 서울특별시 마포구 성미산로 147 1층 시간 매일 9:00 ~ 21:00 인스타그램 맥코이(@mccoys_coffee) • Instagram 사진 및 동영상 팔로워 2,318명, 팔로잉 0명, 게시물 5개 - 맥코이(@mccoys_coffee)님의 Instagram 사진 및 동영상 보기 www.instagram.com 맥코이 연남은 홍대 입구 3번 출구에서 10분 정도? 얼스어스, 티크닉 그 사거리에 위치해있다 도로가에 바로 위치해 있는 맥코이. 생긴 건 시골 오두막 숲속에 있을 것 같은 느낌인데 말이야 맥코이는 체인점인데 예전부터 지도에 저장을 해뒀었는데 왜 한 번을 안 갔을까 이렇게 좋은데! !!! 맥코이 중에 가장 방문해 보고 싶었던 연남점 맥코이 연남에 간다면 꼭 야외 테이블에 앉고 싶었다 이 자리는 합석이 힘든 자리라 안에 자리가 있었지만 우리는 기다렸다가 앉았다 완전 길바닥 옆이라 지나가는 사람들과 다 눈이 마주치긴 하지만 ◠‿◠ 예뻐서 좋아 … 만족해 맥코이 메뉴 안에는 약간은 어두운 느낌에 따뜻한 공간이다 안에도 그렇게 큰 공간은 아니라서 계속 자리 없어서 나가는 손님들이 있었다 아아를 벌컥벌컥 들이켜고 싶었지만 맥코이가 처음인데 또 맥코이 커피는 마셔야 하니까 맥코이 커피로 두 잔 주문! 의자는 편하지 않아 … 얇고 나무니까 … 그리만 여기서 사진 찍으면 이렇게 예쁩니다 🫶🏻 겨울에는 추워서 테라스 자리는 힘들 것 같고 어느 곳이나 그렇겠지만 늦여름에서 가을로 넘어가는 그 계절에 정말 좋다 (내가 바로 그때 방문해서 너무 좋았던 기억) 햇살이 이렇게 예쁘게 쏟아지는 맥코이 연남 우리는 오후에 갔는데 지는 해가 있을 때 예쁘게 사진에 담기는 것 같다 💫✨ 맥코이 커피 6.0 진한 플랫 화이트에 캐러멜 크림이 올라간 맥코이 시그니처. 맛있다. 딱 첫 입 먹고 언니랑 똑같은 반응이었다 보통 크림이 올라간 커피를 잘 먹지 않는 편이다 첫입은 맛있어도 곧 텁텁해지고 더 목이 타기 때문에. 맥코이커피는 분명 달달한데 맛있게 계속 먹었다 물론 크림이다 보니 아아를 마실 때의 상쾌함은 없었지만! 섞지말고 쭈욱 들이키는 맥코이커피 크기가 작아서 금방 다 마실 수 있다룽 ♡ (@limmmming) • Instagram 사진 및 동영상 팔로워 1,165명, 팔로잉 475명, 게시물 1,427개 - (@limmmming)님의 Instagram 사진 및 동영상 보기 www.instagram.com Copyright 2023. 리미 All rights reserved. 본 포스팅의 모든 이미지와 글의 저작권은 리미에게 있습니다. 따라서 불펌 및 무단 도용, 업로드, 재 포스팅을 금합니다."
연남동 카페 맥코이 커피 러버들이 좋아하는 곳,요새 날이 많이 선선해진 거 같아요 벌써 가을이 성큼 비도 추적추적 오고 금방 추워질 것 같아요 저는 벌써 긴팔과 가디건을 꺼내 입었어요 감기에 걸리지 않게 일교차 조심! 추워진 날에는 카페에서 따듯한 커피와 독서를 하는 것도 하나의 힐링이라고 생각해요 또는 친구와 함께 도란도란 이야기만 나눠도 좋구요 제가 이번에 연남동을 방문했는데 커피를 엄청 좋아하는 친구가 소개해준 곳이에요 커피를 좋아하시는 리친님들께 소개해드리려고 해요 (리예 친구들 ㅋㅋㅋㅋㅋ 이상한가요 ) 아 이곳은 지점이 한남점도 있다고하니까 한남동 갈 일이 생기면 꼭 그봐야겠어요 ㅎㅎ 맥코이 연남점 영업 시간 09:00-2100 맥코이 연남 서울특별시 마포구 성미산로 147 맥코이 연남의 첫인상은 뭔가 오두막집 느낌이었어요 연남동이 아니라 왠지 숲속에 있어야 할 것 같은 느낌 에구 귀요미도 봤어요 반려견도 함께 들어 올 수 있는 거 같더라구요 들어오는 입구에서 사진들을 많이 찍으시는 것 같아요 아니 정말 산장에 있는 오두막 카페에 온 느낌이에요 분위기 정말 좋아요 ㅠㅠ 정말 가을 겨울에 오면 너무나 좋을 카페를 찾앗다 우드우드 ~ 우드느낌 너무 좋아요 그리고 너무 깔끔하고 나무 느낌들은 심적으로도 편안한 감정을 느끼게 해주는 거 같아요 맥코이 메뉴판 제가 주문한 카푸치노 ~ 친구가 주문한 아메리카노 ~ 와 함께 여름에서 가을 넘어가며 마지막 반팔이었던 🥹
"[연남]<맥코이커피>-연남동 신상카페,감성카페,메뉴,가격","안녕하세요.뭉이맘입니다. ☕️ 오늘의 포스팅은 맥코이커피입니다. 🍵 홍대입구역3번출구에서 도보14분거리에 위치합니다. 저희가 방문한 날에 비가 왔는데, 카페 외관이 날씨와 너무 잘 어울렸어요 ! :) ☂️ 내부는 오두막에 들어온 것처럼 아늑했어요. 소품 하나하나 감성 가득했던 맥코이 커피 ☕️ 저희는 라떼(5000원)와 아메리카노(4000원)를 주문했어요 ! 테이블이 통나무였는데, 너무 귀여웠어요 ✨ 비오는 날 따뜻한 라떼 한잔과 감성 가득 카페 ~ 오늘도 카페 힐링 성공했네요 ! 🙃 시간 나실때, 연남동 신상카페 맥코이커피 어떠신가요 ~ ? 그럼 다들 오늘도 good day - ! ✨💖 #연남카페 #신상카페 #연남동 #맥코이커피 #감성카페 #라떼 #일상 #소통 #카페 #카페추천 #홍대카페 #서이추"
연남동 데이트코스 카페추천 맥코이,연남동엔 카페가 엄청 많지만 사람도많고ㅜ 맛있는 커피는 드물어서.. 가는곳만 가게되는거같아요 그중 한곳 맥코이 연남점!! <출처: 네이버 맥코이연남> 주문한커피는 맥코이커피에요! 엄청 찐해보이죠 땅콩크림? 이랑 커피 너무맛있어요 걸쭉한맛 크기가 좀더컷더라면.. 너무좋앗을.. 맛있어서 양이 부족해요.. 보니까 또 마시고싶네요🥹 보이는거처럼 맛도찐해요 카페인도 약간 쎈느낌.. 원래 카페인에 약해서..쪼꼼 어지러웠어요 그치망 맛있으니까.. 쇼파자리 마시기는 불편한 자리지만 맛있으니까.. 크림이 계속 입에묻는건 감수 예전에 어디 카페가서 봤는데 크림위에 올라간 커피는 크림먹고 빨대로먹듯이 흡입하면 커피나온다고 했어요 아주조은팁이죻ㅎㅎ 저녁시간 7시 넘어가니 손님이 다빠지더라구요 창가자리도 예쁘공ㅎㅎ 가운데 큰 테이블도 있어요 ㅎㅎ 이건 작년에 갔다왔을때 오른쪽이 비엔나커피인데 제입맛엔 맥코이가 더 맛났어요! 연남동 카페 적극추천합니당 카페많은 거리에 있어요 ㅎㅎ 50m © NAVER Corp. 맥코이 연남 서울특별시 마포구 성미산로 147 #연남동카페 #연남카페맛집 #홍대카페 #맥코이연남 #홍대카페추천 #커피맛집 #데이트코스
[연남동 카페 추천 / 애완동물 동반 가능] 빈티지한 분위기의 도시속 산장 같았던 커피 맛집 맥코이 (Maccoy),"맥코이 (Maccoy) 연남점 서울 마포구 성미산로 147 *운영 시간: 일-월 09:00~21:00 *주차 가능 여부: x (주변 연남 공영주차장 이용) *반려 동물 동반 카페 *홍대 역에서 도보 10분 거리 위치 연남동에 위치한 맥코이, 이 다소 아담한 크기의 카페는 협소한 공간을 감안하더라도 충분히 다시 재방문 하고 싶어지는 곳이였어요 연남 본점 뿐만아니라 성수점, 한남점 등 서울에는 이미 다수의 지점이 있더라구요 카페 외관의 첫느낌은 푸릇푸릇한 느낌과 통나무 테이블, 건물 외관이 더해져 마치 도시속 산장 같은 느낌이었습니다. 입구에 들어서면 보이는 맥코이 연남점의 내부, 조명이 다소 어둡고 아늑한느낌에 다소 투박한 재질의 나무 인테리어로 미국 서부 7080년대 한 바에 들어선 느낌이 들었어요. 메뉴판 음료는 에스프레소,커피,필터커피,Non 커피, Tea로 구성 디저트 류는 티라미수 (클래식,딸기,말차,사과) 4종류 입니다. 카라멜 크림 아인슈페너인 맥코이 커피가 가장 대표 메뉴 인듯 했어요 주문하고 가게 내부를 천천히 둘러보니 공간이 크진않지만 어둑한 조명과 원목 디테일로 아늑하고 따듯한 느낌이 들었는데 재즈 음악이 잔잔히 깔려 분위기를 한층 더해주더라구요, 내부가 조용해서 작업하시는 분들도 꽤 있었고 애완 동반 카페여서 애완견 데려오신분들도 종종 보였답니다. 저는 카페를 선택할 때 맛뿐만아니라 ‘그 공간의 음악 인테리어등 전반적인 분위기’나 ‘너무 시끄럽지는 않은지, 편안하게 머무를 수있는 장소인가’ 등의 요소도 중요하게 생각하는편인데 모든 점이 조화로웠던것 같아요. 특히나 조용한 분위기에서 흘러나오는 올드 재즈가 오로지 음악과 커피에만 집중할수 있게 해주어 간만에 주말의 여유로움을 제대로 느낄 수있었습니다. 건물 한벽은 통창으로 이루어져 공간이 훨씬 트인 듯한 느낌이 들었고 가만히 앉아 창밖 구경하기 딱 좋을 것만 같더라구요 저희는 아침 식사를 한지 얼마 되지 않아 가장 기본 커피메뉴를 주문했는데, 원두의 풍미가 깊고 진해 커피의 향과 맛또한 아주 만족스러웠어요. 최근 방문했던 카페 중 분위기와 공간, 커피 맛 또한 인상깊었던 맥코이, 다음에 방문한다면 맥코이 커피 도전해보고 싶네요! 애완 동반 카페를 찾으시거나 조용하게 작업할 수있는 곳을 찾으시는 분, 친구들이나 연인과 함께 분위기 좋은 카페를 찾으시는 분들이라면 맥코이 연남점 한번 방문해보시길 추천 드립니다 !👍🏻 #서울 카페 추천 #연남동 카페 #애견동반 #작업하기 좋은 카페 #서울 데이트 장소 추천 #연남동 #맥코이 #분위기 좋은 카페"
"[연남동] 맛들이_매덕스피자,맥코이,김밥레코즈","50m © NAVER Corp. 매덕스피자 연남점 서울특별시 마포구 성미산로 153 1층 맛드러진 미국피자 가게인 매덕스피자! 연남동에 생겼다고 해서 총총총 방문하였다.!.! 그나저나 연하장 이후로 만나버린 작가릠~ 깔끔한 내부! 생각보다 분주한 느낌이 없어서 좋았달까~ 주문은 치즈,하와이안,페퍼로니~ 일인 이조각 정돈 해줘야 하지만.. 스트레스가 위쪽으로 와버려서 작아져버린 나..( ･᷄д･᷅ )상당히 슬프다.. 암튼 피맥할 예정이라 블랑과 블루문도 주문주문🍕🍺 분위기 좋구만. 버드와이저를 좋아해서 기대했지만.!.!. 미국식피자집에 버드와이저가 없는 건 아쉬웠지만~!~! 블랑도 짱 좋아하는 맥주라서 좋았당!-! 꽤 빠르게 나온 핏쟈~와 맥쥬~ 한 조각도 큰데 한 번 더 잘라주시기도 해서 좋았다~ 먹기도 편하고, 다른 맛으로 노나먹기도 편하고오~ 재료들이 실하다고 느껴진게, 얄팍한 베이컨이 아닝 비계가 쫄깃하게 살아있는 ‘고기’스러운 베이컨이었다.!.!.츄릅 하와이안 핏쟈 넘 좋다니깐..🍍🍕 일반피자는 도우는 안먹는 편이고, 화덕피자를 좋아하는 편인데 화덕피자 특유의 구움에서 오는 고소함과 담백함도 느낄수 있고, 도우 자체가 워낙 얇고 잘 구워져서 바삭한 식감까지 있어서 좋았다!-! 가끔 화덕피자중에 엄청 물컹거리는 피자가 있는데 그런건 별로 선호하지 않는편이라 도우까지 맛나게 먹었다능!-! 챱챱챱 50m © NAVER Corp. 맥코이 연남 서울특별시 마포구 성미산로 147 다음으로 간 맥코이 연남!-! 커피를 되게 잘하는 카페라고 하셨지만, 카페인 찐따는 레몬에이드를 시켜버렸고, 레몬에이드는 찍지않았다. 어흑.!.! 연남동와서 언젠간 아침해뜰때 자고싶은날에 한 번 진득하게 먹어볼 예정..‧⁺◟( ᵒ̴̶̷̥́ ·̫ ᵒ̴̶̷̣̥̀ ) 사진엔 없지만 레몬에이드 되게 맛있었다. 레몬특유의 상큼함은 물론이고, 레몬 속껍질 향과 맛이 은은하게 나는 것이 신선했다. 무엇보다 제일 마음에 든 점.!.!. 달지 않다.!.!.!.! 쮸압 쮸압 마무리감으로 시원하고 깔끔하게 먹기 좋았당~🍋 커피메이커스 라는 책에 있는 디자인과 삽화들. 고욍자앙히이 취향이었다. 후.. 아직 완전히 내마음에 쏘옥, 후벼파는 그림을 스스로 그리지 못하고 있어서 그런가 이런 시각적자극을 받으면 뭔가 기분이 좋다. 은은하게 좋은 양분이 되어주는 것 만 같달까╭( ･ㅂ･)و 50m © NAVER Corp. 김밥레코즈 서울특별시 마포구 신촌로4길 22-8 3층 작가님이랑 좋아하는 영화가 두개정도 겹쳐서 영화나 애니이야기, 바이닐 이야기 좀 하다가 마침 김밥레코즈 리뉴얼 된 곳을 안가봐서 가보기로 했다~ 위치는 경의선책길 옆 꼬마빌딩 3층으로 이전~!~! 이야 상당하게 잘 꾸려놓으셨다. 예전 연남동에 위치했을때보다 깔끔..! 후에에ㅠㅠ나카모리 아키나를 발견해버린 나ㅠㅠ 힝.. 진짜진짜 사고싶었는데 충동적으로 사는게 아닌가 싶어서 참았다 후우.. 최애곡인 CARIBBEAN, OH NO, OH YES!,LIAR TATTOO,DESIRE.. 후앙.. 베스트 앨범이라 알차게도 들어있는 것… 그치만.. 잘참은거지..! 그치만.. 아니야 잘 참은거야 그래! 그런걸로 탕탕탕!!! 오랜만에 검정치마 반가워땅 고등학생때 브로콜리너마저,가을방학,검정치마,요조 참 좋아라 했는데.. 인디밴드 특유의 가사전개나 잔잔한 느낌들이 넘 좋았달까~ 그때 저 검치앨범에 있는 강아지 라는 노래 신나서 참나리 좋아했었당. 가사는 외설적이긴했지만 지금 보면 발칙한것이 귀여운걸(ゝ◡∂｀)☆ 레코즈스토어 오니까 공연도 보러가고 싶고, 학생때 들었던 노래도 찾아듣기도 하고 좋았당ʕ·ᴥ·ʔ 좋은 카메라로 찍혀본 나.. 사진슨물 감사합니다 껄껄 사실 이때 재즈 바이닐을 고민했다… 후우… 좀 더 알아보고 잘 사야지! 부러질때까지 들어주겠어! 보사노바도 꼭.!.! #김밥레코즈 #매덕스피자연남 #맥코이연남 #연남동 #연남동피자 #홍대바이닐 #홍대엘피"
"연남동 분위기 좋은 카페, 맥코이 커피 / 힙한 피자집, 아노브연남","맥코이커피 서울특별시 마포구 성미산로 147 매일 11:00 - 21:00 목요일 휴무 서울에서 떠나는 친구의 송별파티,,?를 위해 친구들과 연남에서 모였어요:) 이래저래 찾아보다 연남 맥코이 커피를 발견했어요! 맥코이 커피는 외부에서 본 카페 모습이 너무 예쁜데, 수다떠느라 바빠서 내부만 앉아서 찰칵 찍었습니당 :) 좌석 배치가 깔끔하고, 나무가 대부분이라 편안했어요. 저는 드립커피를 좋아해서 맥코이에서도 필터커피를 주문했습니다! 부드럽고 맛있었어요! 비가 오는 날이었는데도 손님이 항상 가득차있었고, 웨이팅도 생기는 곳이었어요! 시간대 잘 맞춰서 방문하길 바래봅니당 :) 필터커피 | 6,000 아노브 연남 서울특별시 마포구 동교로 267 2층 예약 매일 | 12:00 - 22:00 B.T | 15:00 - 17:00 L.O | 21:00 이 날 저녁은 피자로 먹기로 했어요. 원래는 다른 피자집으로 갈 예정이었으나, 가는 길에 아노브연남의 간판을 보고 아노브 연남으로 저녁 식사 장소를 변경했어요. 아노브 연남은 소이연남 2층에 자리잡고 있어요 :) 아마도 바깥은 웨이팅을 위한 공간인 것 같았어요. 큰 나무가 자리하고 있어서 웨이팅을 해도 편안할 것 같은 느낌,,? 내부가 넓고 깔끔했어요! 아노브는 주문한 메뉴를 가져다주는 것만 직원분이 하시고, 대부분 셀프였습니다. 배치된 소품들까지 더해져서 빈티지한 무드가 느껴져요. 화장실 사인 디테일까지! 강박이 있어서 아노브의 쇼케이스를 보니 마음이 편안,, 셀프바에서 물, 수저, 물티슈, 칠리소스, 파마산 등을 가지고 갈 수 있어요! 피클 통 주변엔 아이스팩을 넣어두는 세심함까지! 피자는 반반피자로 화이트트러플머쉬룸과 투머치 페퍼로니를 주문하기로 했고, 사이드에선 핫윙과 바질갈릭브레드를 주문하기로 했어요. 키오스크에서 주문을 할 수 있어요. 주문 방법은 키오스크 앞과 테이블에 붙인 종이로 확인할 수 있어요. 각자 취향껏 음료도 주문하고요. 핫윙은 나오자마자 친구가 후다닥 가져가버려서 양이 저래욬ㅋㅋㅋ 갈릭브레드가 생각보다 맛있었고, 핫윙은 타바스코에서 나는 신 맛 같은 맛이 너무 강하게 나서 별로였어요ㅠㅠ 피자는 도우까지 정말 맛있었어요! 저는 개인적으로는 머쉬룸 피자 추천드려요! 버섯 양도 많고, 트러플 향도 강하지 않아서 좋았습니당:) + 스리라차 소스 500원 추가하면 먹을 수 있는데, 스리라차와 피자 조합 생각보다 너무 맛있어요! 꼭 추가해서 드세요 반반피자 | 23,000 핫윙 4조각 | 11,000 바질갈릭브레드 | 2,000 스리라차 소스 | 500 음료 | 3,000"
[연남동] 카페 맥코이 McCoy : 진짜 진짜,"배뚜들기면서 나온 눈톢과 하마 커피를 좀 마셔줘야 하겠는데 어디를 갈까? 하다가 카멜로연남 근처에 대놓은 차를 빼기가 너무 힘들었어가지고 ㅋㅋㅋㅋ 정최로드 중 하나였던 브래들리 커피와 YD로드 중 맥코이커피가 있었는데 (그외에도 리브레나 카멜커피 등등 선택지는 무수했음) 그나마 넓은 길에 있던 맥코이가 가깝고 제일 적합해서 오늘의 카페로 낙찰되었다. 땅땅 그와중에 YD님은 분명 한남동 맥코이 리뷰를 쓰셨는데 한남점 익스테리어가 너무 기억에 남아버렸는지 맥코이커피 앞에는 그 뭐시기 판자같은거(?) 붙어있는데! 하면서 연남점 앞을 빙빙 헤맸다는 거 ㅋㅋㅋㅋ 그치만 연남점에도 간판은 딱히 없고요? 이것이 간판의 전부 하마는 건물을 한바퀴 돌더니 이 뒤에 에스프레소 바도 좋아보이는데? 하면서 정신이 팔려있었다 그치만 눈톢은 어림없지 뒤에 있는 피프 에스프레소 바 다음에 보자 오늘의 목적지 맥코이 연남, 들어갑니다. 건너편에 보호색을 띄고 있는 눈톢C 차 잘 안보이쥬? 딱지 안뗐을거라 믿어 의심치 않음...! 그나저나 요거 사진찍다가 우리보다 뒤에 오신 커플분들이 마지막 남은 테이블을 차지하셨다 흑흑 내부 이렇게 생겼습니다 카메라로 찍었더니 약간 영화같은 느낌 그나저나 맥코이커피 네이밍 유래가 궁금한데 진짜 맥코이라는 의미의 밈으로 the real McCoy, 뭐라하지, 전설의 레전드 이런 느낌이랄까 암튼 McCoy는 genuine 의 의미가 있슴다 그래서 오늘의 제목도 진짜 '진짜'가 된 거고요 그리고 커피도 찐맛 존맛 내부를 찍어본다 사실 저 빈자리는 눈톢네 가기 전에 난거고 ㅋㅋㅋ 계속 다른분들이 앉아계셨다 분위기 너무 좋아서 막판이지만 찍어봄 일단 끝자리에 앉아서 주문했다 플랫화이트와 맥코이커피, 휘낭시에 1개 맛집의 조건 : 커피 계량 맥코이 연남 재생 19 좋아요 1  접기/펴기 It's the real McCoy, subject to the real coffee! 그리고 자리가 나서 소파로 옮겼다 커피는 자리로 갖다주심 어휴 크림이 아주 맛있는데요? 카메라로 잡은 맥코이커피 휘낭시에는 사실 눈톢스타일은 아니었지만 그래도 플랫화이트와 즐기기엔 나쁘지 않다 맥코이커피 넘 맛있는데 YD님이 말씀하신 것처럼 커피가 한입거리여서 ㅋㅋㅋ 그게 조금 아쉬울 뿐 그치만 크림도 쫀득하니 진하게 달달하다 아주 마음에 듦 플랫화이트는 예.. 사실 라떼랑 무슨차이인지 잘 모르는 커알못 암튼 맥코이 연남도 분위기가 다 했다 온도, 습도, 그리고 조명 조명의 중요성은 역시 아무리 강조해도 모자라지 않는다 연남에서 분위기 좋은 커피 맛집 찾으면 맥코이 연남 추천😍💕 맥코이 연남 서울특별시 마포구 성미산로 147 맥코이커피 서울 마포구 성미산로 147 map.kakao.com 주차 : 능력껏 눈톢 카멜로연남에서 여기 올때 홍대입구역까지 돌고 다시 들어왔습니다. 네."
연남동 맥코이커피,50m © NAVER Corp. 맥코이 연남 서울특별시 마포구 성미산로 147 계속 생각나서 이틀만에 또 먹으러온 맛있는 커피 맥코이연남의 맥코이커피! 적당히 낮은 조도에 밖은 푸릇푸릇하고 부에나비스타소셜클럽이 흐른다 완벽! #블챌 #블로그챌린지 #체크인챌린지 #경의선숲길카페 #연남동카페 #홍대카페
