title,content
연남동맛집 홍대 브런치카페 썸모어델리 라자냐 맛집발견❣️,내돈내산!! 급 땡겨서 근처에서 파스타랑 샐러드로 검색해서 찾아갔던 썸모어델리 날은 우중충하였지만 넘좋았따 여기저기 동글동글 귀여운 느낌 의자도 동글동글 우드느낌 좋아하는데 전체적으로 우디해서 아주 따수운 느낌이에요 뜬금없는 꼼돌이도 기여워 문에 달려있는 딸랑이도 귀여워!!!! 저 딸랑이 너무 탐났어요 내부에는 테이블이 많지않은데 야외아닌 야외같은 야외자리도 있어요 날씨 좋은날 가시면 좋을거 같아요❣️ 이름 때문에 헷갈렸던 여름의 맛 샐러드가 먹고싶어서 갔었는데 여름의맛 밖에 없어요ㅠㅠ 하셔서 여름에만 하신다는줄 다행히도 온고잉 메뉴 상콤한 발사믹 느낌 드레싱과 부라타치즈+망고 조합이 아쥬우 좋았습니다 상콤 달달 개운한 느낌 메뉴마다 적혀있는 문구도 귀여워 재료에 대한 설명도 되어있어서 더 좋았어요 요 메뉴는 집에서 도전해볼만한 메뉴라서 찍어옴 바로 먹을 때보다는 살짝 녹았다가 먹으니까 더 맛이 좋더라구요 처음 내어주실 때는 망고가 약간 단단했는데 조금 더 말캉해지니까 드레싱과 더 잘어울렸어요 이날의 스프도 쫀맛이었는데 함께 나오는 빵이랑 (빵추가 했던듯...?) 스프에 푹 담갔다 먹었어요 찐하고 고소한 맛이라 빵이랑 잘어울리더라구요 뜨끈한 메뉴여서 망고샐러드먹고 시린 입속을 달래주기 좋았어요 다음에 나온 의외의 존맛탱 메뉴 맛있어보여서 시키긴했지만 이정도로 맛있을 줄은! 병아리콩후무스와 소스와 또띠아가 너무 잘어울렸어요 결국 또띠아도 추가...★ 정말정말 맛있었던 메뉴 그리고 모두를 띠용하게 했던 라자냐♥ 지글지글하게 나와서 따뜻하게 즐길 수 있었구요 라자냐 안에 꼬불꼬불한 층과 납작한 층이 있는데 사이사이에 꼬소한 치즈같은 크림이 들어있어서 더 풍미가 좋았어요 소스도 너무 맛있어서 남은 소스까지 싹싹 긁어서 타코에 나온 또띠아랑도 즐겨봤는데요 뭐랑 먹어도 맛있는 쏘오쓰! 사장님? 직원분도 넘 친절하시구 모든 메뉴가 예쁘고 맛있었던 썸모어델리 연남동 맛집으로 추천합니당♥ 썸모어델리 서울특별시 마포구 동교로51길 131 1층 #연남동맛집 #홍대맛집 #연트럴파크맛집 #연남동라자냐 #홍대라자냐 #연남동데이트코스 #홍대데이트코스 #홍대파스타 #연남동파스타 #내돈내산맛집
연남동 브런치카페-썸모어델리,"연남동 브런치 카페 썸모어델리 ♡내돈으로 먹고 마신 찐 후기♡ 인천 구월동에 있던 썸모어가 연남동에도 오픈했어요~~~ 썸모어에 진심인 사람.. 저 송도에서 카페하실때부터 구월동 오픈하고 4번이상 간 곳이에요. 연남점은 썸모어델리입니다. 연남동 오픈소식에 빠르게 오고싶었지만..그럴수가 없었네요. 육아맘의 고된 삶이란.... 그래도 최대한 빠르게 움직여 봅니다. 친한 동생이랑 잠시 바람쐴겸 후다닥 다녀왔는데, 너무 아기자기하고 예쁜 건물을 지으셔서 인테리어 하셨더라구요. 따뜻한 분위기~~ 구월동 썸모어의 느낌과는 조금 다르지만 아늑한 분위기는 변함없이 유지하고 있네요. 큰 창과 함께 야외를 온전히 느낄수있는 예쁜 인테리어에요. 다람쥐 넘 귀엽구만요♡♡♡ 실내 좌석은 5테이블정도 있고 야외로 양쪽에 몇개씩 더 있어요. 여러명보다는 2~3명이서 오셔서 오붓하게 드시는 걸 추천드려요. 날씨가 좋아서 야외에 앉을까하다가 미세먼지가 있는 듯 해서 실내로 앉았는데~~~ 날 좋은 날 야외에서 커피한잔 다시 해야겠어요. 분위기 무엇~~~캬 봄에도 좋지만 가을에 와도 분위기가 너무 좋을 것 같아요. 작은 가게지만 알차게 감각적으로 꾸며놓으신 듯해요. 일단 썸모어델리의 벽돌집이 너무 마음에 든다는 ㅋㅋㅋㅋㅋ 취향이 확실한 사람입니다. 작은 골목감성의 야외테이블... 골목갬성이 물씬 풍기는 것이 유러피안 감성이에요. 꼬숩한 아아~~ 날이 갑자기 더워져서 아아가 절실했답니다. 썸모어의 시그니처 메뉴~ 트러플 크림향이 진하게 들어간 프렌치 토스트랍니다. 그리고 감자 스프~ 아쉽게도 구월동 썸모어에 비해서 메뉴 라인업이 다소 아쉽긴했어요. 그래도 서울에서 먹을 수 있는 게 어디냐며~~ 맛나게 싹싹 긁어 먹었답니다. 나오면서 아쉬움에 한 컷 더~~ 구월동 썸모어와 비슷한 느낌으로 분위기를 잘 살리신것 같아요. 여기도 유명한 카페인데... 사람이 너무 많아서 발걸음을 돌렸어요. 아쉽네요~~여기까기 오기 쉽지않지만... 다음기회에.... 길가에 라일락이 너무 이쁘게 펴서 한 컷 남겨봤어요. 봄은 봄인가봐요~~~ 꽃과 향기가 가득하니 기분이 좋습니다. 썸모어델리 서울특별시 마포구 동교로51길 131 1층 오늘도 행복한 하루되시고 하트 꾸욱~~~해주세요."
[연남동 브런치] 썸모어델리_유럽에 온 듯한 느낌이야!_반려견 동반 & 테라스브런치 즐길 수 있는 감각적인 곳!_메뉴추천_내돈내산_솔직후기_네이버예약추천,"썸모어 델리 위치 서울 마포구 동교로51길 131 1층 영업시간 매일 11:00 - 21:00, 20:00 라스트오더 매주 월요일 정기휴무 전화 010-2835-0126 썸모어델리 서울특별시 마포구 동교로51길 131 1층 여러분 제가 연남동을 뚜벅이로 갈 수 있는 곳으로 이사를 오면서 매일 같이 연남동을 다니고 있는데요ㅎㅎ 그 중에서도 제가 요즈음 제일 애정하는 썸모어델리 솔직리뷰시작할게요! 이 날, 하늘도 너무너무 이쁘지 않나요? 파란하늘의 가을 계절이 다가오고있어요! 저는 사실 썸모어델리를 잘 몰랐었는 데 같이 일하는 치료사쌤이 가보고싶은 곳이 있다고해서 찾아보니 글쎄 우리집에서 5분거리에 있던 곳이였던 거 있죠~? 외관도 뭔가 외국스러워 저는 참 북유럽스러운 느낌 좋아하는데요! 뭔가 테라스도 있고 또 이렇게 벽돌로 되어있으니 진짜 북유럽스러워요^^ 11시 오픈인 데 11시 오픈시간 맞춰 예약을 해서 방문했어요! 너무너무 제가 좋아하는 우드톤 오픈시간인데에도 이렇게 사람이 많은 거 있죠!? 진짜 연남동 핫플인가봐욤♥ 이 날 되게 새로운 메뉴를 도전했었는데 둘다 성공적이였어서 메뉴추천을 슬쩍 해볼게요! 트러플크림 프렌치토스트(18,000) 올리브크림치즈를 넣어 구운 양송이(15,000) 저의 최애메뉴는 저 양송이예요! 아니 이게 뜨거운 팬에 나오는 데 정말 너무너무 새로운 맛이였어요!! 트러플크림 프렌치토스트도 진짜 맛있었는데 메뉴 2개를 다 크림이 많은 걸 시켜서 그런 지 살짝 느끼했어요ㅠㅠ 그래서 다음 방문시에는 올리브크림치즈를 넣어 구운 양송이 + 다른 메뉴! 이렇게 도전할꺼예요 딱 한가지 아쉬웠던 점은 아이스라떼가 메뉴에 없다는 점ㅠㅠ 아이스 아메리카노 말고 아이스라떼 한잔 같이 먹고 싶었는 데 아쉬웠어요ㅠ 내돈내산/개인적인 리뷰입니다!♥"
"[서울] 연남동 기록(썸모어델리,PITC,스아게)","안녕하세요! 날희에요 :) 오랜만에 연남동에 다녀왔어요 요즘 날씨가 무척이나 더워서 걸어 다니기가 너무 힘들었지만 맛있어 보이는 브런치 가게와 신상 카페를 가보고자 출발했습니다 썸모어델리 서울특별시 마포구 동교로51길 131 1층 급 브런치가 먹고 싶어서 검색! 검색했을 때 브런치 비주얼도 좋고 밖에 뷰가 좋아서 찾아갔어요! 지하철역이랑 거리가 조금 있는데 더위로 도저히 걸을 수가 없어서 버스 환승해서 시원하게 도착 ~~! 매장 옆에 작게 테라스 공간이 있어요! 봄이나 가을이면 무조건 앉았을 텐데 이럴 땐 여름이 너무 싫어요 ㅠㅠ 매장 안에는 5테이블 정도..? 생각보다 공간이 협소했어요 봄&가을이면 야외에도 테이블이 있어서 회전율에 큰 상관이 없을 것 같은데 여름엔 에어컨 실내가 최고라 타이밍 잘 못 맞으면.. 아찔하죵 ㅋㅋㅋ 매장은 아담하지만 분위기는 좋았습니다.. 이 자리 마음에 들었는데 예약석이라 아쉽 ㅠㅠ 창가 자리 앉고 싶으면 예약하세요 썸모어델리 베스트 메뉴를 주문했습니다 1. 트러플 크림 프렌치토스트 2. 올리브 크림치즈를 넣어 구운 양송이 (+바게트 빵 추가) 비주얼도 너무 예쁘고 향도 좋더라고요! 저의 픽은 구운 양송이! 스타벅스 토마토바질베이글 맛이 나서 맛있게 먹었어요!! 오일 소스가 맛있어서 빵을 푹푹 찍어 먹어서 국물 한 점 남기지 않고 완그릇!! 프렌치토스트는 트러플 향이 솔솔~ 트러플 오일과 크림소스가 꽤 좋았어요 토스트도 적당히 달고 괜찮았는데 제 입맛엔 구운 양송이가 최고 ⸝⸝ʚ̴̶̷̆ ̯ʚ̴̶̷̆⸝⸝ 브런치 가게를 잘 안가지만 양송이는 또 먹으러 오고 싶어요 PITC 서울특별시 마포구 성미산로11길 13 (성산동) 연남동에 대형 카페가 생겼길래 궁금해서 더위를 뚫고 ㅜㅜ 지쳐서 왔지만 예쁜 분위기 덕에 힘이 났어요 이국적인 느낌이 팍팍 나는 인테리어와 분위기 휴양지에 온 느낌이라 너무 좋았어요!! 길게 놓여있는 쉐어 테이블! 단체로 오면 좋을 것 같네용 테라스가 너무 잘 되어 있어서 봄&가을에 만석일 것 같은 느낌!! 감성 독채 펜션 온 느낌도 들어요 2층으로 올라왔는데 여기가 메인 공간 같은 느낌! 1층과 마찬가지로 긴 쉐어 테이블이 있어요 쉐어테이블 뿐만 아니라 1,2층 모두 이런 프라이빗한 공간도 있습니다!! 아아 두 잔과 중동식 디저트 ‘쿠나파’ 안에 치즈가 있어서 달달 짭짤 왼쪽에 문을 열고 나가면 창밖 공간이 나오는데 진짜 휴양지 숙소 온 것 같아요 🥺 왼쪽에는 3층 테라스로 가는 계단이 있습니다 3층 올라왔는데 무슨 행사장 포토월 같은 벽이 있어서 놀랬어요 ㅋㅋㅋㅋ 못참고 한 장 찍었습니다 ⸝⸝ʚ̴̶̷̆ ̯ʚ̴̶̷̆⸝⸝ 인플루언서 놀이 가능합니다 ^,^ 아 그리고 제 팔은 잘 있습니다~ 시간이 지날수록 너무 만족스러워서 조만간 다시 생생후기 남겨보려구용!! 연남동 대형카페답게 3층 테라스도 테이블이 많고 공간 모든 곳이 포토존이라 사진 좋아하시는 분들 성지가 되지 않을까.. 저는 공간 넓은 카페를 좋아해서 넘 맘에 들었고, 가을에 다시 오려고요 스아게 서울특별시 마포구 와우산로29라길 7 1층 카페 갔다가 영화 보고 스프카레를 먹으러 왔습니다 스프카레가 너무 궁금했습니다 삿포로 스프카레 유명하잖아요 현지에서 안 먹어봐서 비교는 못하지만 대충 구실은 비슷하니 맛도 비슷하지 않을까.. 웨이팅 기다리는 동안 검색하고 튀긴닭다리카레 + 맵기 5단계 주문했습니다 국같이 생겨서 생소했는데 맛있어요!! 매운 걸 좋아해서 5단계 무리 없이 술술 들어갔고 고명으로 나온 가지, 당근, 브로콜리들.. 안 좋아하는 채소인데 먹고 띠용했습니다 스프카레는 야채카레가 찐이라는 말을 들었는데 진짜 닭다리 보다 맛있었어요!! ⸝⸝ʚ̴̶̷̆ ̯ʚ̴̶̷̆⸝⸝ 현지 스프 카레는 얼마나 맛있을지 ㅠㅠ 나중에 꼭 삿포로 가서 스프카레 먹기! 버킷리스트에 담고 하루를 마무리 했습니다 오랜만에 간 연남동인데 알차게 돌아다니고 먹은 보람찬 하루! 잇님들도 연남동 방문하시면 꼭 들려보세요 :) 모두 남은 주말 잘 보내시고 오늘도 방문해주셔서 감사합니다"
[연남카페] 연남동 끝에 보석같이 숨어있는 곳 : 썸모어델리,"환상적인 가을 즐기기 🍂 썸모어델리 수-일 11:00-19:00(마지막주문 18:30) 월,화 휴무, 주차불가, 반려견 가능 연남동에 너무 맛있는 브런치집이 생겼다고 해서 방문했는데 지금 딱 테라스 앉기 좋은 시원한 날씨라서 행복 만끽하고 왔습니다 메뉴판 트러플크림 프렌치토스트 여름의 맛 냉동망고라서 살짝 아쉬웠지만 시원하게 먹기 좋았던 망고 부라타 샐러드 여름에만 준비되는거 같아서 방문하실분들은 인스타 참고하셔야 해요~ 꾸르맛 애플 샌드위치 당근라페도 너무 맛있어서 호로록 먹었어요 트러플크림 프렌치토스트 진짜 트러플 소스 좋아하면 무조건 맛있게 먹을 수 있는 메뉴에요 수저 달라고 해서 싹싹 긁어먹을뻔 했어요 웨이팅은 테이블링으로 가능해요 줄서서 기다리지 않아도 되서 너무 좋아요 썸모어 서울특별시 마포구 동교로51길 131 #가을테라스 #서울브런치 #브런치 #연남동맛집 #연남동카페 #카페 #마포맛집 #마포카페 #썸모어델리 #서울썸모어 #연남동브런치맛집 #망고샐러드 #여름의맛 #프렌치토스트 #연남동가볼만한곳 #경의선숲길 #경의선숲길맛집 #서울카페추천"
연남동 연트럴파크 브런치카페 썸모어델리 방문후기,화창한 평일 낮 마침 친구도 쉬는 날이라 급 브런치 약속을 잡았다! 장소는 둘 다 가까운 연남동으로 결정하고 연남동 브런치로 엄청나게 검색 후 야외 테라스 자리가 너무 마음에 드는 썸모어델리로 결정했다. 요즘처럼 날씨가 좋은 계절에는 무조건 테라스지!!! 썸모어델리는 연남동 연트럴파크 가장 끝에 위치해 있다. 위치가 안쪽이라 그런지 조용한 분위기에서 브런치 즐기기에는 안성맞춤! 운영시간 매주 월요일 휴무 화/수/일 11:00 ~ 19:00 목/금/토 11:00 ~ 21:00 후.. 날씨도 도왔던 이날의 브런치. 사진도 너무 잘나오고 바람 솔솔 부는 테라스에서 좋아하는 친구와 즐겁게 수다 떨며 맛있는 음식 먹으니 절로 힐링이 되던 날이었다. 썸모어델리 안쪽 자리도 너무 좋았다. 우리 뒤로 들어오는 손님들은 거의 안쪽에서 식사 하시던..ㅎㅎ 라자냐(19.0) 비프후무스 타코(16.0) 아이스아메리카노 2잔 (5.0) 라자냐 진짜 존맛 후무스도 고소하고 진짜 맛있었다. 아이스아메리카노는 드립 형식인건지 깔끔하고 좋았다. 요즘은 드립커피가 더 좋음.ㅎㅎ 날씨 좋은 날 테라스자리에서 인생샷 건질 수 있는 썸모어델리에서의 브런치 강추!!!!!!!!!!!!!! 썸모어델리 서울특별시 마포구 동교로51길 131 1층
연남동 브런치 맛집 : 썸모어델리 (애견동반 가능),"안녕하세요 윤슬입니다:) 오늘은 제가 제일 좋아하는 브런치 맛집을 소개해드리려고 해요 Review start ! 썸모어 델리(🐶댕댕이 동반 가능🐶) 서울 마포구 동교로51길 131 매주 월,화 정기휴무 / 11:00 - 19:00 혹시 기억해주시는 분이 계실까요 이전에 썸모어 구월점을 최애 브런치 맛집이라고 포스팅 했었는데요 '◡'✿ 이번에 연남동에 썸모어델리란 이름으로 새로운 공간을 오픈 하셨더라구요 ! 구월점이 훨씬 가깝지만 새로운 공간은 어떻게 꾸며놓으셨을까 하는 궁금증에 왜 가까운곳을 두고 먼곳을 가냐고 궁시렁거리는 짝꿍을 끌고 연남점을 다녀와봤어요 (궁시렁 거려봤자 소용 읎다구🤷‍♀️) [내부] 전체적인 분위기는 구월점과 같이 우드톤 으로 꾸며 놓으신거 같았어요 저는 썸모어 만의 따뜻한 느낌이 너무 좋아요 💛 (테이블마다 손님이 있어서 내부 공간은 달랑 사진 두장이네요😭😭) [야외 테라스] 야외 테라스는 날이 더워서 인지 다 먹고 나갈때 앉아 계신 분이 없어서 찍기 성공 이날 테라스에서 먹으면 🫠 이렇게 될 날씨였어요 메뉴판을 안찍어와서 네이버에 등록된 메뉴판을 첨부 했어요😭 여름의맛 14,000원 애플루꼴라샌드위치 13,000원 시즌프룻주스 8,000원 35,000원 여름의 맛은 부라타치즈 & 애플망고 & 리슬링 와인으로 만든 드레싱 조합인데요 ! 이 메뉴 만드신분 누구예요ㅠㅠㅠㅠ 애플망고랑 치즈를 리슬링드레싱에 촉촉히 적셔서 먹으니 너무 맛있는거 아니겠어요🥺 차가운 애플망고에 더위도 싹 날라가는 기분이고 리슬링와인은 잘 모르지만ㅎ 쌍큼 하니 진짜 맛있었던 메뉴예요 이름도 찰떡같이 너무 잘 지으신거 같아요 여름의 맛이라니 🌿 에피타이저나 와인 안주로 꼭 드셔보세요 ! 애플 루꼴라 샌드위치 당근라페 좋아하시는분 ? 저요 루꼴라 좋아하시는분 ? 저요 일단 샌드위치 위에 올려주신 당근라페가 너무 맛있었고 루꼴라랑 샌드위치 조합도 좋았어요 근데 메인인 사과는 달지 않더라구요ㅠ ㅠ 그치만 사과와 상관없이 맛있게 먹었던 샌드위치 ! 시즌 푸릇주스는 오렌지 주스 였는데 주스도 맛있으니 드셔보세요 샌드위치랑 주스 드셔보세요 (강요) (강요) 개인적인 후기 저는 믿고먹는 썸모어 이기 때문에 먹은 메뉴들은 모두 맛있었어요 (아는 사람들 맨날 다 데리고 가고싶다고 생각하는곳) 공간이 협소해서 놀랐어요 ㅠ 공간에 비해 테이블이 많이 들어가있는 느낌,, 테이블 사이의 간격이 좁아요 댕댕이를 유모차에 데리고 오신 분이 계셨는데 공간이 좁아서 나갈때 테이블을 한쪽으로 밀어야 나갈수 있더라구요 저는 그래서 한번으로 만족하고 넓은 구월점을 갈것 같아요 썸모어 서울특별시 마포구 동교로51길 131 #카페썸모어 #썸모어 #연남동 썸모어 #썸모어델리 #연남동브런치 #연남동브런치맛집 #연남동맛집 #연남동맛집추천 #가좌역맛집 #가좌역브런치 #연남동애견동반카페 #연남동애견동반브런치 #연남동애견동반식당 #연남동데이트 #경의선숲길카페 #경의선숲길브런치"
연남동 브런치하기 좋은 테라스 맛집 추천 썸모어델리,"날씨가 너무 좋은 날 오빠랑 다녀왔던 연남동 썸모어델리 ! 썸모어델리 서울특별시 마포구 동교로51길 131 1층 전에 경의선숲길 을 걷다가 #테라스 좌석이 있어 꼭 가봐야지 했었다 ㅎㅎ 내가 찾던 테라스 #브런치가게 느낌 ! 내부에 들어와서 반대편 문으로 나가면 또다른 공간이 있다 우리는 그늘이 형성된 곳에 자리를 잡았다 :) 벽돌도 느낌 있구 햇볕도 뜨겁지 않아 여름에도 좋은 자리인듯 ! 카페 내부 & 반대쪽 테라스 썸모어 델리 반대쪽 외부 여름 느낌 낭낭 ✨ 사진 찍고 기다리는 사이 주문한 음식들 등장 ! 우리는 #그랜마라자냐 #트러플크림프렌치토스트 #수프 를 주문했당 사진 왤케 이쁘게 나오냐구 ,,, 전반적으로 음식은 괜찮았당 (다만 수프가 약간 짜다고 느껴졌고 라자냐도 넘 맛있었지만 그릇만 뜨겁고 내부는 그렇게 뜨겁지않아 아쉬웠다 ..) 트러플크림 프렌치토스트는 소스랑 다양한 재료들로 맛도 좋고 보기에도 넘 이뻤당 그래도 연남동 데이트하기엔 참 이쁘고 감성적인 테라스 카페인것같당 ! #썸모어델리 #연남동데이트 #연남동맛집 #연남동브런치 #연남동테라스 #경의선숲길 #내돈내산"
서울 연남동 애견동반 브런치! '썸모어델리',"헬로우~ 연트럴파크! 친구&친구멍멍이와 함께 올만에 #연남동 에 갔다. 멍멍이 산책겸 #연트럴파크 를 쭈욱 걷다가 지하철역 반대방향으로 쭈욱~~ 거의 공원 끝까지 걷다보면 #애견동반식당 #썸모어델리 가 나온다! (바로 오기엔 가좌역 4번출구가 더 빠름!) 썸모어델리 서울특별시 마포구 동교로51길 131 1층 애견동반 식당 중 카레집도 있었는데 비도 미스트처럼 내리고 분위기가 좋아 보여서 썸모어델리에 갔다. 입구앞 골목길이 넘나 이뻐보여서 촬칵! 고층 건물이 많은 곳보다 요즘은 이런 주택가가 더 좋다. 건물은 벽돌로 되어있었고 야외테라스에서도 식사가 가능한데 비가 오락가락해서 우리는 실내로 총총~~ 식당이 넓진 않지만 분위기가 정말 좋았다. 본점이 인천에 있는지 인천에 매장두개, 그리고 연남동에 하나 이렇게 세곳이 운영중인것 같다. #그랜마라자냐 는 매운맛으로 주문했는데 엄청 매운맛이 아니라 부담없이 먹을 수 있었고, 나중에는 소스까지 싹싹 긁어 먹었다. (19000원) #BLPT샌드위치 는 베이컨, 상추, 감자, 토마토가 들어가 있었는데 두툼한것이 라자냐와 같이 먹기에 조합이 정말 좋았다! (15000원) 샌드위치가 큰건지 라자냐가 작은건지,,😱 솔.직.히. 가격대비 양이 많지 않아 좀 아쉬웠다... 끄억.. 하지만 강아지 물도 따로 챙겨주시고 재료들이 신선하고, 식당 분위기가 바깥 풍경과 잘 어울려서 좋았다! #분위기맛집 😆🤣 연남동에서 브런치를 먹어봤으니 다음엔 더 맛있는 밥집을 찾아 가봐야겠다 🤪 #내돈내산 #서울식당 #서울맛집 #연남동맛집 #홍대맛집 #합정맛집 #브런치 #연남브런치카페 #홍대브런치 #연남동썸모어 #가좌역브런치"
[썸모어델리] 연남동 끝자락 브런치 맛집 리뷰,"SOMEMORE deli 영업시간 월요일 정기휴무 화요일~일요일 11:00~19:00 우리팀 소비요정 남대리님께서 팀점으로 찾아주신 썸모어델리 너무나 만족 매번 맛집과 좋은 장소를 찾아주시는데 미리 파악하지 못하는 P 막내에게는 너무 감사하다.히..히 이 날 날씨는 을메나 좋던지.. 아! 썸모어델리는 2명 이상부터 워크인만 가능하다는 점! 2명은 네이버예약으로 미리 예약할 수 있다. 막 도착했을땐 한참 봄맞이 식물 심기와 물주기를 하고 계셨다 !.! 햇살 가득한 브런치집이라 외국에 온거 같은 기분이였다. 음식 기다리다가 엄청 작은 새가 들어왔는데, 위 이미지 중에 숨어있으니 찾아보랏!.! 음식 주문은 이사님과 함께니까 많고 다양하게 히..히 Truffle cream french toast Hummus taco grandma Lasagna Apple rucola sandwich Egg in hell 아이스티 진짜 다 맛있었다. 그래도 추천한다면, 트러플 크림 프렌치 토스트 이건 진짜 존맛탱 !..! 가서 꼭 먹어야하는 메뉴 그리고 아이스티 사실 아이스티했을때 립톤 아이스티 생각했는데 홈메이드 블루베리 아이스티였다. 맛있어..또 먹고싶다 알수 있다면 집에서 해먹고 싶다. 날씨도 분위기도 음식도 3박자가 완벽했던 하루. . 좋은 날에 좋은 사람과 다시 방문할 예정이다. 마지막은 귀여운 연남동 의자 픽"
