title,content
한남동 제주감성 비건 코스메틱 | 아이엠랑데자뷰 한남비자림점,"주말에 한남동에 있는 아이엠랑데자뷰 한남비자림점에 다녀왔어요~ ESG라는 단어 이제는 많이 아실거라 생각되는데요. 환경, 사회, 지배구조등 비재무적요소들을 뜻하는 단어인데요. 갑자기 웬 ESG냐고요? ㅎㅎ 바로 오늘 소개해드릴 업체가 이러한 윤리경영을 하고있는 곳이라고 해요. 아이엠랑데자뷰는 제주감성 비건 뷰티 & 코스메틱 브랜드에요. 1. 비건 친화적 제품: 세계적인 동물보호단체인 PETA에서 인증을 받은만큼 동물성 원료를 전혀 사용하지 않았다고 해요. 2. 친환경 시스템: 재활용측면에 유리한 바이오페트를 사용하고 심지어 택배상자도 비닐테이프를 사용하지 않고 에코박스를 사용한다고 해요. 3. 사회적 책임경영: 판매수익금의 일부를 제주환경과 취약계층을 위해 기부를 한다고 하네요. 그럼 아이엠랑데자뷰 같이 알아보실까요? 아이엠랑데자뷰 한남비자림점 서울 용산구 대사관로5길 17 1층 0507-1323-7918 영업시간 일~목 11:00-20:30 금 토 11:00-21:00 50m © NAVER Corp. 아이엠랑데자뷰 한남비자림점 서울특별시 용산구 대사관로5길 17 1층 외부, 주차 한남에서 제일 핫한 샵들이 모여있는 거리가 있는데요. 여기서 가장 눈에 띄는 곳을 안 가볼수가 없겠죠?ㅎㅎㅎ 한남다운타우너 맞은편, 한남주민센터 바로 옆에 있습니다. 그리고 2분 거리에 한남공영주차장이 있어 차를 갖고 오신 분들은 이 곳에 주차하시면 됩니다. 내부 아이엠랑데자뷰의 모든 제품들이 Vegan-Friendly 제품이에요. - 피부에 유해하다고 의심되는 성분은 일절 배제한 클린 뷰티 코스메틱 브랜드입니다. 보기만 해도 믿음직스런 아이엠랑데자뷰 제품들~ 핸드크림 세럼 제주 보호종으로 인위적인 채취가 금지된 제주 카멜리아꽃잎이 자연 낙화할 때만을 기다려 1년에 한번 얻을 수 있는 귀하고 순수한 업사이클링 카멜리아 성분을 사용한 오일세럼이에요. 바디로션 핸드워시와 바디워시를 체험해 볼 수 있어요. 체험하고 핸드크림도 발라보았는데 어찌나 향도 좋고 부드러운지요😍 아이엠랑데자뷰에서는 제주도 곳곳을 떠올릴 수 있는 5가지 시그니처 향이 있는데요. 포레드비자 제주 천년 비자림의 신비함을 담아 마음을 차분하게 가라앉혀 주고 우리 몸의 감각을 일깨워주는 비자림의 풀, 나무, 흙내음의 조화로운 블렌드. 가슴 깊이 청량감을 주는 그윽한 프레시 아로마틱 우디향. 라비앙카멜리아 제주의 차가운 겨울 바람 아래 홀로 피어난 화려한 카멜리아의 향긋함과 허브의 싱그러움이 어우러진 블렌드. 세상에 존재감을 알리는 당당하면서도 시크함을 주는 달콤하고 화사한 스위트 플로럴향. 매그놀리아퍼르 한반도에서 오직 제주 한라산에서만 자생하는 화이트 매그놀리아. 순백의 매그놀리아가 간직한 순수함과 우아함을 따뜻한 포근함으로 감싸 품위있는 내면의 아름다움을 깨끗하게 표현한 블렌드. 당신의 기품을 세련되게 표현해줄 화이트 플로랄 머스크향. 살루아라메르 제주 바다 끝 대자연이 만들어낸 아름다운 협재해변. 에메랄드 물감을 풀어 놓은 듯 청량한 물빛과 눈부신 은빛 모래의 만남, 상쾌함을 온전히 느낄 수 있는 마린향과 활기 넘치는 꽃들의 조화로운 블렌드. 따분한 일상에 활력을 주는 프레시 그린 마린향. 테루아르만다린 여름 제주의 눈부신 햇살을 받고 자라난 탱글탱글 제주 황금하귤의 상큼하고 싱그러움을 톡 쏘는 깨끗한 제주 암반수의 느낌으로 독특하게 블렌딩하여 밝고 긍정적인 에너지를 선사하는 향긋한 프루티 시트러스향. 바디워시를 사고 싶었는데 향이 고민이었어요. 다 좋은걸요ㅎㅎㅎㅎ 하나하나 다 시향해 보았습니다. 원래 플로럴머스크향을 좋아하는데 프레시한 우디향이 너무 땡기지 뭐에요 ㅎㅎㅎ 제주도가 생각나는 향이에요😍 계속 고민하다가 포레드비자로 선택했습니다!!ㅎㅎㅎ 바로 너다!ㅎㅎㅎ 포레드비자향 바디 워시 29,000원 예쁜 봉투에 담아서 가지고 왔습니다. 바로 옆에서는 테이크아웃 카페도 운영하고 있어요. 바디워시 후기 거품이 많이나고 몸에 바르는데 민트향 같이 상쾌한 느낌이 들었어요~ 요즘 날씨가 춥잖아요. 바디워시 잘못쓰면 몸이 굉장히 건조해지는데 이건 정말 순했어요. 부드럽고 향도 정말 맘에 들었어요. 디자인도 예뻐서 지인에게 선물하기도 좋아요ㅎㅎ 친환경 코스메틱 아이엠랑데자뷰로 피부도, 환경도 소중히 하는건 어떠신가요? 아이엠랑데자뷰 제주비건 코스메틱 브랜드 아이엠랑데자뷰입니다. m.iamrendejavous.com"
한남동 팝업스토어 비건 코스메틱 제주 감성 가득한 아이엠랑데자뷰 한남비자림점 제품 추천,"주말 저녁에 오빠랑 이태원으로 놀러갔어요~ 맛있는 저녁도 먹고 사진도 찍고 스토어도 구경하고 거리를 걷다가 눈에 띄는 나무와 이쁜 스토어를 발견해서 들어갔어요~ 한남동 팝업스토어 아이엠랑데자뷰 한남비자림점 입니다! 한남동 다운타우너 맞은편에 위치한 핫한 골목이라 바로 보인답니다! 어두운 저녁인데도 눈에 띄는 팝업스토어! 한눈에 보이더라구요 건물에 나무라니, 친환경을 강조하는 걸까요? 궁금해서 물어보니 비자나무라고 합니다! 50m © NAVER Corp. 아이엠랑데자뷰 한남비자림점 서울특별시 용산구 대사관로5길 17 1층 아이엠랑데자뷰 한남비자림점 월-목 11:00-20:00 금-토 11:00-21:00 일 11:00-20:30 브레이크타임 16:00-17:00 동일 0507-1323-7918 아이엠랑데자뷰는 자속가능한 환경을 위한 일과 동물복지에 진심을 다하고 사람과 동물, 자연이 조화롭게 함께 사는 세상을 꿈꾸는 윤리적인 브랜드라고 합니다! 친환경, 윤리적인 브랜드가 늘어나는 추세라 너무 좋은 것 같아요! 제주스러운 느낌이 가득한 내부에요! 자연자연한 인테리어에 내부에도 나무가!!! 들어가자마자 보이는 제품 체험존! 핸드워시, 바디워시, 바디로션, 샴푸, 헤어팩 등 제품 체험할 수 있도록 비치되어 있었어요! 포레드비자 핸드워시와 라비앙카멜리아 바디워시로 손을 씻어봤는데요 진짜 비자나무향 가득해서 시트러스향 계열 좋아하는 사람이면 무조건 좋아할 향! 그리고 카멜리아향은 진짜 너무 좋은 플로럴 향이라 기분이 좋아지는 향이었어요 손 씻고나서 은은한 향 + 건조하지않게 촉촉한 마무리도 너무 좋았어요! 지속가능한 환경을 위해 준비된 면 100%손수건! 자연을 생각하는 마음이 느껴졌답니다 뽀송한 손수건으로 손을 닦고! 바로 뒤쪽에 핸드크림이 있어서 핸드크림 구경하기! 여러가지 향을 테스트해봤는데 저의 원픽은 라비앙카멜리아 핸드크림이에요! 라비앙카멜리아 바디워시 향도 너무 좋았는데 핸드크림까지,,, 너무 좋잖아!! 뷰티 업사이클링 제주 카멜리아로 만든 스위트 플로럴 향의 핸드크림인데요 진짜 제주 카멜리아 느낌 그대로 인위적이지 않고 너무 좋은 향이에요! 그리고 보습도 짱짱하니 겨울에 관리해줘도 손이 트는 나에겐 진짜 엄청난 아이템..!!! 진짜 핸드크림 발림성도 좋고 보습도 짱짱하고 향도 너무 좋아요! 나의 픽들~~ 제주 컨셉의 비건 코스메틱 브랜드 답게 제주제주 향을 너무 잘 표현 한 것 같아요! 전 완전 아이엠랑데자뷰의 라비앙카멜리아 향에 꽂혔어요 바디로션도 있었는데 보습도 되면서 산뜻한 마무리감에 향기도 너무 좋으니~ 진짜 겨울의 제주가 느껴졌어요 디퓨저도 3개의 향으로 준비되어 있었어요 근처를 가니 아주 청량한 향이 느껴졌는데 포레드 비자 디퓨져였네요! 신비한 제주 비자림 청량하고 깊은 우디향이라고 쓰여있는데 전 제주가면 비자림 무조건! 들리거든요! 해가 쨍쨍해도, 비가 와도 좋은 비자림인데 제주의 비자림을 가득 담은 향이라 너무 좋았어요! 완전 힐링! 바디로션, 바디워시 등 여러 제품이 전시되어 있어요! 그리고 친환경 고체치약과 대나무 칫솔도 판매중이에요 선물세트도 잘 구성되어있어서 집들이 선물로도 너무 좋을 것 같아요! 친환경 패키지 굿! 드레스 퍼퓸도 있어서 시향해봤는데요! 매그놀리아퍼르 / 포레드비자 / 살루아라메르 3가지 향이 준비되어 있었어요 저는 매그놀리아퍼르를 시향했는데 제주 메그놀리아 화이트 플로럴 부케향의 오드뜨왈렛급 섬유향수답게 지속력도 좋고 화이트 플로럴향이 기분좋아지는 향이라 좋았어요-! 제주 자연 그대로를 느낄수 있는 시그니처 향들 진짜 아이엠랑데자뷰 향 구현 무슨일이냐구요!!! 스킨케어 제품도 있어서 테스트 해봤는데요! 은은하게 올라오는 라비앙카멜리아 향 그리고 정말 꽃잎으로 만듬 오일세럼이라 보습도 좋았고 흡수력도 좋았어요! 제형과 안에 든 꽃잎을 담고싶어서 영상도 첨부했답니다! 제주 비건 코스메틱답게 인테리어도 정말 제주 뿜뿜하고 곳곳에 친환경을 신경쓴 부분이 느껴졌어요! 아이엠랑데쟈뷰는 사회적 책임을 다하고, 판매 수익금 일부는 제주 환경을 보존하는 일과 사회적 취약계층을 돕는 일에 기부한다고 하던데 제품도 좋고 브랜드도 너무 좋은 취지가 가득해서 더 좋았던 제품체험이었어요! 지금 승무원님과 함께하는 오픈 이벤트도 있고 금액대별로 제품 추가 증정까지 있으니! 해당된다면 꼭꼭 이용해보세요! 그리고 커피나 음료 테이크아웃하면 제품 구매시 추가 10% 할인도 해주네요!! 굿굿 카페 메뉴에요! 메뉴도 다양하고 가격도 괜찮아보여요 매장에 들어가자마자 좋은 향기가 난다 생각했는데 여기에 이렇게 디퓨저가 비치되어 있었어요 나갈때 발견한 핸드크림 미니어처! 미니미니한 사이즈라 미니백 사용시에 가지고 다니기 좋은 사이즈네요! 기존 핸드크림과 똑같은 향이 작은 사이즈로! 다른 제품이랑 같이 선물하기에도 좋을 것 같아요~ 핸드크림 구매하니 향에 맞는 엽서도 같이 챙겨줬어요! 핸드크림 패키지랑 선물하기 너무 좋은 센스있는 엽서네요! 지금 손이랑 손톱 빤질빤질 보습 잘된거 보이시나용! 큐티클도 다 잠재우는 보습력 만족! 다음날 호캉스에서 개시한 핸드크림! 다른 향들도 너어무 좋았지만 나의 픽은 요 두개!!! 라비앙카멜리아 핸드크림 테루아르만다린 핸드크림 맡으면 기분 좋아지는 그런 향들! 정말 인위적이지않고 너무 향이 좋아서 평소에 귤향을 좋아하지 않았는데도 구매하게 되었어요! 상큼한 제주 황금하귤을 블렌딩한 프루티 시트러스향을 가득담은 테루아르만다린 핸드크림 그리고 계속 언급한 라비앙카멜리아 핸드크림 나에게 주는 선물로 구매했는데 친구나 애인, 지인에게도 선물하기 좋은 제품들이 너무 많았어요! 나에게 주는 선물 , 그리고 선물하기 너무 좋아서 추천추천합니다! 이태원 한남동 가면 꼭 방문해보세요! 집가려면 한참남았어서 가벼운 제품으로 샀는데 바디워시랑 퍼퓸 계속 생각나잖아...! 오픈이벤트때 혜택받고 구매할걸 그랬어요 뒤늦게 저는 홈페이지 구매 갑니다,,ㅎ 팝업에 있는 모든 제품은 아이엠랑데자뷰 홈페이지에서도 구매가능해요! 아이엠랑데자뷰 제주비건 코스메틱 브랜드 아이엠랑데자뷰입니다. iamrendejavous.com 아이엠랑데자뷰 인스타그램 아이엠랑데자뷰 IAMRENDEJAVOUS(@iam_rendejavous) • Instagram 사진 및 동영상 팔로워 46명, 팔로잉 1명, 게시물 40개 - 아이엠랑데자뷰 IAMRENDEJAVOUS(@iam_rendejavous)님의 Instagram 사진 및 동영상 보기 www.instagram.com"
[서울] 11월 일기 - 한남동 골목투어(& 비건 코스메틱 아이엠랑데자뷰 한남비자림점),"2023. 11. 18. 늘보 어젠 진짜 눈이 펑펑 내렸다. 여전히 하늘은 흐리고 늘어지고 싶은 그런 주말 오늘은 우리가 좋아하는 구 건축물과 진짜 핫플이 공존하는 한남동으로 그리고 아직까지 여운이 깊게 남아있는 제주 한 달 살기의 향수를 자극하는 아이엠랑데자뷰 한남비자림점까지. 한남동 투어 다운타우너, 관광객이 많은 브랜드 쇼룸, 맛집이 많은 한남동 카페거리는 걷는 재미도 있고 커플끼리 데이트하기도 좋은 곳이다. 드파운드 쇼룸》 요거 예뻤는데, 브랜드가 뭐였더라... 오늘 전반적으로 동네랑 깔맞춤? 아이엠랑데자뷰 한남비자림점 아이엠랑데자뷰 한남비자림점은 담쟁이넝쿨과 빨간 벽돌, 진짜인가 싶은 초록 나무까지 골목에 들어설 때 부터 은은히 베어있는 향기와 매장 안까지 이어진 커다란 나무가 먼저 시선을 끌었다. 골목에 들어서면 눈에 딱, 이미 포토존인듯 내부 모습> 아이엠랑데자뷰는 제주 컨셉의 비건 코스메틱 브랜드로 섬세하게 재현한 제주 자연 고유의 5가지 향을 전시하고 있다. 라비앙카멜리아, 테루아르만다린, 매그놀리아퍼르, 포레드비자, 살루아라메르까지 각기 다른 매력의 꽃, 귤, 숲, 바다향을 하나하나 직접 향을 맡아보며 제주를 다시 추억할 수 있다. 카멜리아로 만든 스위트 플로럴 향, 제주 귤의 상큼함과 시트러스 향, 매그놀리아의 우아하고 기품 있는 화이트 플로랄 부케향 비자림의 청량하고 깊이 있는 우디향, 제주 바다의 마린, 시솔트, 그린 플로럴 향까지 극 건조한 피부라 환절기엔 손을 씻을 때마다 핸드크림을 매번 발라줘야 해서 진짜 은근 귀찮음 ㅜㆍㅜ 핸드크림을 바를 때마다 촉촉함도 오래 유지되고 향이 지속될 때 더 기분이 좋을 텐데.. 오~촉촉하고 오래간다(종일 촉촉했음) 아이엠랑데자뷰 제품은 무지개색, 눈이 즐거운 예쁜 디자인은 물론 패키지와 원료로 업사이클링 성분까지, 친환경을 상당히 고려했다고 해서 좋았다. 특히, 라비앙카멜리아는 순수 뷰티 업사이클링 방식으로 채취하여 꽃잎, 줄기, 뿌리까지 활용했다고. 무지개 색깔 중 어떤 걸 고를지 고민하는 재미가 있다. 늘보는 비자림 숲이 연상되는 초록색 포레드비자가 가장 끌려서 그걸로 선택. 핸드크림은 휴대하기 좋은 10ml (6,000원), 선물하기 좋은 60ml (16,000원)로 구성. 또, 샴푸와 바디워시, 바디로션, 디퓨저 등 다른 방식으로 5가지 향을 깊이 있게 느낄 수 있다. 드레스 퍼퓸은 외출 전 옷에, 잠들기 전 침구에 뿌리고 몸에 직접 뿌리지 않아도 옷에서 충분히 지속된다고 해서, 집 오자마자 여기저기 뿌려봄. 항시 은은하게 향이 배어 있는 게 좋아서 포레드비자 드레스 퍼퓸을 선택했다. 더 특별한 건 없나? 그럴 땐, 한라산을 닮은 탄산 입욕제, 입욕제는 선물하기 좋을 것 같다. 알록달록한 색과 예쁜 디자인이 사고 싶은 욕구 뿜뿜, 나에게 주는, 가족, 친구들에게 크리스마스 선물로 🎁 [서울] 한남동 골목투어 & 제주를 담은 아이엠랑데자뷰 한남비자림점까지 재생 0 좋아요 0 00:00 00:00  [서울] 한남동 골목투어 & 제주를 담은 아이엠랑데자뷰 한남비자림점까지 섬유 향수로 취향을 채운 포레드비자 핸드워시로 직접 손을 씻고 어떤 향이 나와 어울릴지 오감으로 체험하며 선택할 수 있다. 매장이 넓진 않지만, 한쪽에 커피와 제주 녹차, 한라봉, 땅콩을 원료로 한 테이크아웃 카페도 있어 쉬엄쉬엄. 오늘은 아이엠랑데자뷰 체험단으로 참여했지만 오랜만에 다시 제주와 곶자왈을 느낄 수 있었다. 내부와 외관까지 매력적인 포인트가 많고, 자연의 아름다운 색을 향으로 풀어낸 제품들이 가득한 아이엠랑데자뷰 한남비자림점 위치는 한남동주민센터, 한남동도서관 바로 옆(공용주차장)이라 자차 이용 시 공용주차장에 주차할 수 있어, 편하다. 주차요금은 시간당 3,000원이라 다른 곳보단 저렴하고 한남동 카페거리, 쇼룸도 둘러 보고 저녁까지 먹고 갈 거라 우린 3시간 주차했다. (공용주차장 만차라 20분 정도 대기) 타일과 자개로 꾸며진 카페 목단가옥 쇼룸도 가고 카페, 사진전도 보고 골목 골목 소소한 포인트를 찾아 걸었다. 저녁은 뭘 먹을까 하다가 <산카레>에서 볼카츠토마토 카레와 온우동으로 먹었다. 산카레 아이엠랑데자뷰 상품정보는 홈페이지 참고 👇👇👇 https://iamrendejavous.com 아이엠랑데자뷰 제주비건 코스메틱 브랜드 아이엠랑데자뷰입니다. iamrendejavous.com [이 포스팅은 업체에서 제품을 제공받고 작성하였습니다.] 500m © NAVER Corp. 아이엠랑데자뷰 한남비자림점 서울특별시 용산구 대사관로5길 17 1층 용산2가동 주민센터공영주차장 서울특별시 용산구 신흥로 90 한남동 주민센터 서울특별시 용산구 대사관로5길 1 한남동주민센터, 어린이집 한남동도서관 서울특별시 용산구 이태원로 224-19 산카레 서울특별시 용산구 이태원로54길 58-5 지층 #한남동데이트 #산카레 #한남동맛집 #한남동공용주차장 #한남동주민센터 #한남동카페거리 #한남동팝업스토어 #한남동쇼룸 #아이엠랑데자뷰한남비자림점 #깔맞춤 #이태원 아이엠랑데자뷰 제주비건 코스메틱 브랜드 아이엠랑데자뷰입니다. iamrendejavous.com"
"한남동 코스메틱 아이엠랑데자뷰 한남비자림점, 실제로 가봤더니..","오늘은 화장품 사러가는날! 한남동에서 제일 핫한 거리에 비건 화장품 샵이 생겼다고 해서 방문해보았어요! 사실 원래 비건에 관심있는 편은 아닌데 한남동에서 꼭 가봐야할 포토존이라고 해서 가봤어요ㅋㅋ (어쩔수없는 인스타그래머..ㅋ) 아 이런 핫플 너무 오랜만인데 뭘입어야하나~~ 간만에 코트를 입고 한남동에서 제일 핫하다는 화장품샵에 가보았습니다! 이름하여 아이엠랑데자뷰! 한남동 코스메틱 아이엠랑데자뷰 한남비자림점 가는 길&실내 인테리어 이태원역에서 10분정도 들어오면 있는 이 핫한 거리 다들아시죵? 한남에서 제일 핫한 샵들만 모여있다는 그곳이요 길가는 사람들의 패션부터 예사롭지 않네요ㅎㅎ (코트 입길 잘했다..ㅋㅋ) 랑데자뷰 보이시나요? 완전고급지게 생겼네요! 외관이 예뻐서 나무를 배경으로 사진 많이들 찍으시더라구요! (처음에는 카페인줄 알고 지나칠뻔 했다는 건 안비밀..ㅎ) 벌써 크리스마스 분위기를 내는 건지 사진찍기 좋은 선물 상자들도 있더라구요 내부는 이렇게 생겼어요! 저 조명과 분위기 한남동 답네요 역시 부자들의 동네에서만 볼수 있는 고급진 느낌 로드샵이라고는 믿어지지 않는 인테리어네요 손을 씻고 제품을 체험해 볼 수 있는 곳도 따로 마련되어 있어요. 여기가 바로 그 유명하다는 포토존이구나! 사람들이 사진을 엄청 많이 찍더라구요 앉아서도 찍고 뒷모습도 찍고 근데 이쁘긴 이뻐요. 한남동 코스메틱 아이엠랑데자뷰 한남비자림점 제품 정보 및 가격 이렇게 귀여운 바구니를 들고 본격적으로 쇼핑에 나서보아요~~ 오오 디퓨저뿐만 아니라 드레스 퍼퓸이 있어요! 옷에다가 칙칙 뿌리면 은은~하게 향배는 그거 있잖아요 요거 없는 매장도 많은데 횡재했네요ㅎㅎ 향이 어디선가 맡아본 향이아니라 좀 특이하네요! 근데 좋아요 제주자연을 모티브로 했다더니 약간 숲의 달콤한 향? 느낌이에요! 요렇게 핸드크림 제품도 다양하게 있구요 요 희한하게 생긴 물체는 무엇인고? 했더니 향을 담고 있는 그릇이었어요! 너무 신기하죠? 바디로션을 꼭 써보지 않아도 저 그릇에 코를 가져다 대면 향을 알 수 있더라구요 싱기싱기 디퓨저랑 세럼 그리고 배쓰밤도 있네요! 저는 바디로션, 바디워시에 진심인 편이라서 그쪽 위주로 봤어요 바디로션 제형이 별로 끈적하지도 않고 산뜻한게 제가 딱 좋아하는 타입이었어요. 요렇게 물처럼 발리지만 촉촉한 느낌! 바디워시도 종류가 참 많더라구요 저는 그중에서도 '라비앙카멜리아 바디워시'가 제일 궁금하더라구요 손씻는 곳 옆에 보니까 면 100% 손수건도 제공해주고 있어요 이 브랜드가 피부에 유해하다고 의심되는 성분으 전부다 배제했다는데 역시 지속가능한 환경을 생각하는 기업답게 손수건까지 신경쓰네요ㅎㅎ 몸을 씻을 순 없으니 바디워시로 손을 씻어보았어요. 손 씻고 나니까 향이 너무 좋더라구요 달콤하면서도 고급진 향이랄까? 어디서 맡아본 향은 아니었어요 이거 향이 너무 좋아서 점원분께 따로 여쭤봤더니 라비앙카멜리아라는게 제주 카멜리아꽃잎이 자연 낙화할 때만을 기다려 1년에 한번만 얻을 수 있는 귀한 원료라네요! 요렇게 선물 포장된건 뭐지? 친환경 고체치약하고 대나무 칫솔이래요 고체치약은 예쁜 병에 담겨있는 알약같아요. 입에 넣고 씹어서 가글만 해도 되고, 양치를 해도 된다네요! 오픈한지 얼마 안되서 이렇게 이벤트를 많이 하네요! 만원이상만 구매해도 칫솔하고 고체치약샘플을 주고 3만원이상 구매하면 무려 핸드크림이랑 고체치약샘플을 준네요! 7만원 이상은 치약 본품을 아예 주는군요! 치약 14,000원인데 완전 개이득ㅎㅎ 저 밑에 있는 카드는 뭐지? 궁금해서 봤더니 아이엠랑데자뷰의 시그니쳐 향들을 엽서로 만들었네요 아름다운 제주의 자연을 모티브로 했다더니 이거 하나씩 다 맡아보면 진짜 그런 느낌이 나요ㅎㅎ 저는 그중에서도 라비앙카멜리아가 원픽! 그래서 라비앙카멜리아 바디워시를 구매했더랬죠ㅎㅎ 한남동 핫플샵이라서 비싸줄 알았더니 의외로 29,000원 밖에 안하더라구요! 실제로 이걸로 씻고 회사를 갔더니 다들 저한테 좋은 냄새난다면서ㅎㅎ 뭐쓰냐고 혼자쓰지말라고ㅋㅋ 요렇게 쇼핑백으로 포장까지 하면 디자인이 너무 예뻐서 선물용으로도 충분히 괜찮더라구요! 다음에 친구 생일선물로 이거 사줘야겠다 그리고 서비스로 주신 고체치약 샘플! 이거 집에가서 써보니까 민트향인데 엄청 상쾌해요! 치약 전문가 울오빠도 같이 써봤는데 진짜 상쾌하다하더라구요 (시중제품이랑은 완전히 달라요) 아 참 그리고! 매장 한쪽 구석에 이렇게 카페도 있답니다 쇼핑끝나고 커피한잔씩 겟하실 분들은 참고하셔용~ 집에와서 라비앙카멜리아 바디워시로 샤워하니 너무 기분이 좋네요>< 50m © NAVER Corp. 아이엠랑데자뷰 한남비자림점 서울특별시 용산구 대사관로5길 17 1층 한남동에서 비건 화장품 제품 찾으신다면 한남동 코스메틱 아이엠랑데자뷰 강력 추천합니다! 다음에 더 좋은 포스팅으로 돌아올께요! #아이엠랑데자뷰 #한남동코스메틱 #비건코스메틱 #한남동화장품 #한남동뷰티 #제주도화장품 #제주비건"
