title,content
"선물하기 좋은 디저트 수제캐러멜, 한남동 리메이크 캐러멜","급 선물용 디저트가 필요해 한남동에서 검색하던 중 수제 캐러멜이 눈에 띄었다. 보기에도 좋고 먹을때 손에 묻지 않으며 개별로 포장되어 있고, 여유있는 갯수 등을 고려해 고르게 되었다. 📍리메이크 캐러멜 50m © NAVER Corp. 리메이크 캐러멜 서울특별시 용산구 독서당로20길 9-13 1층 검색해보니 충주에서 답례품과 수험생 선물 등으로 이미 유명했고, 한남동에 쇼룸을 오픈했다고 한다. 우리은행을 지나 파리크라상 안쪽으로 들어가면 쇼룸이 나온다. 골목 안쪽에 위치해 주차는 어려워 보였다. 포장 전문으로 하는 쇼룸이라 따로 커피를 팔거나 앉아서 먹을 공간은 없다. 깔끔한 인테리어와 캐러멜과 선물박스, 수제 캐러멜 스프레드들을 볼 수 있었다. 캐러멜 종류만 12가지였다 ჱ̒ ｰ̀֊ｰ́ ) 합성착색료,착향료,보존료 없이 100% 유크림으로 만들어졌다고한다. 다음엔 스프레드도 사러 와보고싶다. 나는 6개입 / 12개입 한박스씩 구매했다. 가격은 두박스와 봉투 합 3만원정도로 가격대비 고급스러운 느낌을 줄 수 있었다ㅎ 6개입 선물박스까지는 맛을 고를 수 있어서 나는 아래와 같이 골랐다. SALT RUMFIG LEMON PEEL COFFEE EARL GREY VANILLA 개인적으로 무화과인 RUMFIG 맛이 궁금했다ㅎ 후기들이 대부분 호불호 없이 좋아서 12개입도 걱정없었다. 다 고르면 박스에 넣어 포장해주신다. 로이스 처럼 박스에서 오는 느낌이 깔끔하고 좋았다. 날이 더워 녹진 않을까 고민했는데 다행히 아이스팩을 함께 넣어주셔서 밥먹고 선물 주러 갔는데도 충분했다! 박스 내부 사진은 못찍어서 매장 인스타에서 가져왔다. 선물 후기는 박스를 열기 전과 후 반응이 달랐다 열기 전 캐러멜이라고만 들었을땐 그냥저냥이었는데 열자마자 고급져보인다는 반응이 가장 컸다ㅋㅋㅋ 무화과나 과일맛도 인기가 좋았으며 다들 만족스러워했다. 내가 원했던 대로 개별포장 되어있음과 여유있는 갯수 모든것을 충족한 선물이여서 뿌듯했다 ꕤ 나는 솔트 하나를 먹어봤는데, 정말 진하고 깔끔하게 맛있었다ㅠ 위스키나 와인과 곁들여도 좋다고해서 다음엔 함께 먹어봐야겠다! 주위에 선물할 일이 있다면 백번 추천할것같다. 온라인을 통해 배송 주문도 가능하다고 한다. https://m.smartstore.naver.com/remakecaramel 리메이크 캐러멜 : 네이버쇼핑 스마트스토어 수제 캐러멜 / 수제 캐러멜스프레드 m.smartstore.naver.com #디저트 #선물 #답례품 #한남동 #리메이크캐러멜 #쇼룸"
한남동 리메이크 캐러멜,"한남동으로 쇼룸을 옮겼습니다! 계속 바쁘단 핑계로 블로그를 못해서 쇼룸 옮기면서는 꼭 과정을 기록해야지 했는데 마음 먹은대로 안됐어요; 예상치 못했던 일들이 정말 많았거든요 ㅎㅎ; 근데 왜 한남동이냐구요?! 한남동은 브랜드를 시작하면서부터 쇼룸 자리로 생각했던 곳입니다. 한남동에 있는 가죽공방을 2년 남짓 다니면서 일주일에 한두번은 한남동에 왔었는데, 그때 한남동 구석구석을 다니면서 동네의 매력을 알게 됐죠. 그런 익숙함이 당연하듯 자연스레 저를 이곳으로 이끈거 같습니다 ㅎㅎ 사실 브랜드의 시작도 한남동과 관련이 있습니다! 수제 캐러멜을 처음 접한 곳이 가죽공방이기 때문인데요, 가죽공방 메이트 지호씨가 일본 여행을 다녀오면서 수제 캐러멜을 선물로 사왔는데, 그때 처음 수제 캐러멜이라는 신세계를 알게됐죠. 물론 그때는 제가 이 일을 하게 될지는 꿈에도 몰랐지만요 ㅎㅎ; 여러가지 맛의 캐러멜을 잘라서 나눠먹으며 재밌어 했던 기억이 제가 여기까지 오도록 만든게 아닌가 싶습니다 ㅎㅎ 그런 의미에서 고마워요 지호씨!♥ 현재 매장은 한남오거리 근처에 있어요. 파리크라상이 있는 골목에 있다고 말씀드리면 참 편했는데 그렇게 오랜시간 자리잡고 있던 파리크라상이 불과 며칠 전에 문을 닫았습니다 ㅎㅎ; 하필 제가 오고 말이죠 ㅠㅠ 그래도 아시는 분들은 아실거라 생각합니다. 한남오거리에서 우리은행 쪽으로 오시다 예전 파리크라상이 있던 곳에서 오른쪽 골목으로 들어오시면 됩니다. '라도집'이 보이실텐데요, 라도집과 포르멘테라 테일러숍 사이로 주욱 들어오시다 골목 끝자락에서 왼쪽을 보시면 막다른 곳이 보일거예요. ""여기에 있는게 맞아?"" 라고 생각이 드실텐데요, 그럼 맞게 찾아오신겁니다 ㅎㅎ 그 골목 끝자락에 쇼룸이 있습니다! 이렇게 설명하고 나니 며칠 전 캐러멜을 사러 오셨던 이웃분이 생각이 납니다. 근처에서 일하시는 분들이셨는데 여기엔 누가 들어올까 궁금했다고 하시더라구요 ㅋㅋㅋ 네, 그게 접니다 ㅎㅎ 안쪽에 있기 때문에 눈에 띄는 곳에 있는 곳들처럼 복잡하지 않은데요, 저는 오히려 그런 점이 좋더라구요 ㅎㅎ; 50m © NAVER Corp. 리메이크 캐러멜 서울특별시 용산구 독서당로20길 9-13 1층 예약 쇼룸을 연지 이제 한 달이 조금 지났어요. 아직은 모든 것이 자리잡아가는 단계인 듯 합니다. 놀러만 오던 곳이 일하는 곳이 되어 다 낯설기만 한데요 그래도 좋은 이웃들이 생겼습니다. 같은 건물에 있는 분들도, 앞 건물에 사시는 이웃분도, 그리고 근처 밥집과 테일러숍, 와인바까지 ㅎㅎ 그리고 여기로 이사오는데 많은 도움 준 중개사분들도요!!! 큰 결심을 하고 온 이상 이곳에서 정말 열심히, 잘해보려고 합니다. 그런 의미에서 많이 찾아와주세요^^ 아직 쇼룸을 옮긴지 얼마되지 않아서인지 예전 매장으로 찾아가시는 손님들이 꽤 계시는거 같더라구요 ㅜㅜ 괜히 죄송스런 마음이 들고 그렇습니다. 제가 옮겼다고 더 열심히 알려야 할거 같아요(사실 블로그를 제대로 해야겠다 마음먹는데 그게 크게 한몫했답니다ㅎㅎ;) 쇼룸은 옮겼지만 네이버스토어로 온라인 판매는 계속 이어가고 있으니 필요하신 분들은 온라인으로 주문주세요 :)"
WELL.COME to 리메이크 캐러멜,"얼마 전 쇼룸에 그동안 눈여겨 보던 트리를 설치했어요🎄 전 크리스마스를 기다리며 준비하는 날들이 크리스마스보다 더 설레고 좋더라구요😊 트리를 설치하고 나니 더 많은 분들과 크리스마스 분위기를 함께 나누고 싶다는 생각이 듭니다. 어제 쇼룸에 다녀가신 분들이 찾아오기 어려웠다고 하시더라구요. 차를 타고 오신 분도 걸어서 오신 분들도요…😅 그럼에도 이렇게 저렇게 찾아와주시니 신기(?)하고도 감사할 따름입니다🙏🏼 쇼룸은 한남오거리 근처에 있습니다. 한남오거리에서 우리은행 방면으로 오시다 라도집이 있는 골목으로 들어오신 후 라도집과 포르멘테라 테일러숍 사이 골목으로 들어오시면 됩니다. 그 길 끝에서 왼쪽 골목으로 끝까지 들어오시면 쇼룸이 있어요! “어 이런 곳에?”라고 생각이 드는 곳까지 들어오시면 되는게 맞습니다 ㅎㅎ 얼마 전에도 방문해주셨던 고객분이 사진을 보면 대로변에 있을거 같은데 안쪽에 숨어있다고 하셔서 사진이라도 그래보여 다행이라며 웃었는데 ㅎㅎ; 요즘 방문해주신 고객분들께 계속 그런 얘기를 들으니 죄송한 마음마저 듭니다. 그래서 내일부터 2023년 마지막 날까지 쇼룸에 방문하시어 구매하시는 분들께 감사의 마음을 담아, 또 잘 찾아오시길 바라는 마음으로 WELL.COME to RE:MAKE CARAMEL 이벤트를 하려고 합니다. 낱개 캐러멜 한 개를 무료로 증정해 드리는 소소한 이벤트예요. 구매 금액과 관계없이 구매하시는 모든 고객분들께 제공해드리니 편하게 들러주세요🤗 쇼룸 앞에 별도의 주차 공간은 없으나 잠시 주차는 가능합니다. 막다른 골목이라 주차하고 나가시기 조금 번거로울 수 있으나 구매하실 동안 세워두시는 것은 가능하니 참고해주세요. 급격하게 추워진 날씨에 움츠러들기만 하는데요 마음만은 따뜻한 하루 보내시길 바랍니다🙏🏼 #캐러멜증정이벤트 #한남동캐러멜#한남동카라멜 #한남동디저트#한남동맛집 #한남동선물#크리스마스선물#연말선물 #연말파티음식#파티플레이팅#크리스마스파티 #caramel#dessert#gift#hannamdong #christmas#christmastree"
"수험생들에게 응원을, 리메이크 캐러멜","2024 수능 시험이 이제 열흘 앞으로 다가왔습니다. 대학 진학을 위한 그간의 노력이 수학능력시험이라는 단 한 번의 시험으로 결정지어진다 생각하면 대학입시 제도가 참으로 잔혹하다고 느껴지기도 하는데요, 그래서 매년 수능날이 다가오면 모두가 온 마음으로 수험생들을 응원하게 되는 듯 합니다. 그 시간들의 간절함과 떨림을 알아서겠죠. 떠올려보면 예전에는 시험 잘보라며 엿이나 찹쌀떡, 초콜릿을 준비하고, 예쁘게 포장한 포크를 함께 건네며 행운을 빌어주기도 했죠 ㅎㅎ 지금 생각해보면 유치하기도 하지만, 선물을 받았던 순간만큼은 긴장한 마음을 내려놓고 잠시나마 미소를 지을 수 있었던 것 같습니다 :) 수험생과는 이제 거리가 멀어졌다 생각했는데 브랜드를 운영하며 오히려 그 반대가 됐습니다. 덕분에 일년 중 11월이 제게는 가장 바쁜 달이 되었죠. 해가 지날수록 수험생에게 전하는 선물로 찾아주시는 분들이 점점 많아지다 보니 어떻게 하면 수험생들에게 힘이 되는 응원을 전해줄 수 있을까 고민하게 됐습니다. 그러다 떠올린 것이 북마크 카드였어요! 책을 볼 때 사용하는 북마크에 응원 메시지를 담아, 문득문득 보이는 메시지에 잠시나마 응원의 기운을 얻으면 좋겠다는 생각이 들었죠. ""누구보다 빛날 너의 미래를 응원해""라는 문구는 아이들에게 부담을 주지 않으면서 온전한 지지의 마음을 전하고 싶어 고민하다 완성했습니다. 시험 결과와 상관없이 너를 믿기에 너의 미래가 빛날 것이라 믿고, 그렇게 나아가고 있는 너를 항상 응원한다는 마음을 담은 거랍니다. 이 메시지 카드의 문구를 볼 때마다 울컥하는걸 보면 이건 어쩌면 이미 어른이 된 지금의 제가 제 자신에게 보내는 응원일 수도 있겠습니다 ㅎㅎ; 누구보다 빛날 너의 미래를 응원해! 리메이크 캐러멜 with 응원북마크카드 재생 0 좋아요 0 00:00 00:00  리메이크 캐러멜 with 응원북마크카드 제품을 만들면서 늘 정성을 다하지만 수험생들에게 전달된다 생각하면 모든 것이 더 조심스럽습니다. 선물하시는 분들이 보내주시는 응원하는 마음이 잘 전해지도록 정성스레 포장해서 보내드리겠습니다. 그간의 여정에 후회를 남기지 않도록 고생한 수험생들 모두 좋은 결실을 맺길 바랍니다🙏🏻 #수능선물#수험생선물#응원선물 #수능캐러멜#수능초콜릿#수제캐러멜 #한남동디저트#한남동캐러멜#한남동카라멜 #한남동맛집#한남동선물 #caramel#dessert#gift#remakecaramel#hannamdong"
2017.08 ~ 10,"핸드폰 앨범을 보고 급하게 밀린 사진 기록하기 향수랑 세포라 쇼핑짤 사봉 바디스크럽이랑 버터는 아직까지 한 번도 안 써봤다 이 날 샴푸만 사러 갔다가 팔랑귀에 넘어가서 불당동에 토끼정 있어서 갔던 날 힘겹게 케이크를 받치고 있는 토끼.. 옷보다 화장품 쇼핑이 기분전환에 더 좋은 이유가 뭘까 플라잉 타이거 코펜하겐에서 취향 저격 당함 작지만 예쁘다 감격의 날 블루레이가 뭔지도 모르는 기계치였는데..블루레이 플레이어랑 오페라의 유령 2004년 영화, 25주년 라이브 공연 블루레이 사서 행복했다! 지금은 잘 안보지만 이때는 하루에 서너 번씩 보고 너무 행복했다 ㅠ-ㅠ 25주년 라이브 시작하는 초반 연출 언제 봐도 심장 떨려 본도시락 다이아몬드 파우더 내용물이 항상 잘 분출되는 것 같아 ? 제라드 버틀러 보려고 본 드라큐라 2000 17년 전 영화라지만 자막 상태가 돼지 본 갈비 정식 맛있어서 한동안 고메이 가면 이것만 먹었다 내가 일주일에 한 번 이상은 먹었던 아티제 브런치 중 오믈렛 아티제 브런치 좋아! 필라테스 하면서 자세 교정에 도움이 된 것 같다 쉬면서 다시 돌아왔지만 지방이 많아서 원장님이 맨날 피티 끝나면 런닝 하라고 하셨다 남성복인지 모르고 사 왔는데 집에서 입어보니 팔꿈치가 한참 아래로 내려와서 알았다 그래도 색상은 예쁘다 오랜만에 페어링룸 항정살 메주 파스타는 항상 맛있다 여긴 기대했는데 맛이 별로.. 저 햄토리도 귀엽고 울 엄마도 귀여버~~ 꽃 좋아하는 편은 아닌데 갑자기 빨간 장미 가지고 싶어서 집 근처 열심히 찾아다니다가 사장님께 급 주문해서 받은 장미 빨간 장미 안 좋아했는데 오페라의 유령에서 팬텀의 가면과 함께 빨간 장미가 상징적인 느낌이라 좋아진 덕후 예전부터 유화 배워보고 싶어서 취미 화실 넘 좋았다 내 손이 못 따라줘서 속상했지만 놀리는 것도 귀여운 울 엄마 오페라의 유령에 나오는 페르시안 원숭이 오르골인데 살까 고민했다 근데 너무 못생겼어 아티제 브런치2 구찌 조르단 로퍼 사이즈도 맞고 발도 편하지만 굽이 낮아서 잘 안 신게 된다 평소 운동화도 비교적 굽 있는 것만 찾아서 내 사랑(중 하나) 이자벨 아자니 당신의 연기와 미모와 분위기와 모든 걸 사랑해 흡혈귀 영화의 시초 노스페라투 리메이크 영화의 이자벨 아자니 사랑해 호무랑 가면 꼭 먹는 우니단새우롤♥️ 르 라보 시티 익스클루시브 도쿄에서만 판매하는 가이악 9월에 한국 매장에서도 시티 익스클루시브 향수들을 판매한다고 해서 기다렸다 매장에 딱 하나 남은 거 사 와서 짜릿 찡콜이랑 캐러멜 팝콘 행복 아름다운 내 핸드폰 배경화면 (내가 직접 찍은 거ㅎㅎ) 10년 전에 잃어버린 내 침대야 내놔 자주 테이블 ㅌ ㅣ 없이 맑은 마르지엘라 블라우스 겨울까지 잘 입고 다니는 중 오징어 떡볶이 학교 축제 패션쇼 옷 만들다가 구하기 힘들다던데 운 좋게 바로 산 에어팟 나는 내 모습을 거울로만 봐서 몰랐는데 남이 낀 거 보니까 조금 어색해 보이는 건 확실 메종 드 라 카테고리 프렌치 코스 혼자 창밖 바라보며 먹었는데 좀 지루하고 쓸쓸했다 혼밥 마스터의 권태 발렌티노 락스터드 클러치 몇 번 들고나니 너덜너덜 해져서 슬프다 마지막 축제 패션쇼 끝 (좋다) 엄마 보러 내려가는 길에 창밖이 예뻐서 굽네 고추바사삭 너무 맛있다 빈속에 필라테스 피티 받다가 쓰러진 날 단대 병원에서 벚꽃 보는 줄 알았다 저혈압 저혈당 저질체력 너무 위험하다 사진 방해꾼들 잘 찍었다 에릭 테디베어 가지고 싶다 ~평화로운 점심 시간 다람쥐들~ 그 와중에 나만 시꺼멓고 올해 졸업 패션쇼 하는 친구들에게 줄 꽃다발 너무 예뻤다 평화로운 식물 생활 누가 나 향수 그만 사게 기절시켜줘 집 앞에 매드 포 갈릭 사서 그 자리에서 다 까먹은 라뒤레 내 팬텀존(?) 향수 그만 사야지 생각하고 가지고 싶었던 거 몇 개만 더 사고 Sc컬 펌이랑 뿌리볼륨펌 하러 해도 별 차이가 없어서 슬프다 닷츠 먹고 수다 떨러 꼬르소꼬모 그 사이에 쇼핑도 톰 포드 비슷한 컬러 립글로스도 있지만 립스틱도 예쁘니까 샀다 준야 와타나베 블라우스 너무너무 마음에 들어 체형 커버도 되고 귀엽고 예쁘고 깔끔하고 다 한다  비스트로 드 욘트빌 런치 코스 프렌치 코스는 혼자 먹으면 지루하지만 같이 먹을 사람이 없으니까^^ 금방 추워져서 사 놓고 몇 번 못 입었다 화실 옆에 뼈해장국집 최고 맛있었다 방해꾼2 디대에서 보는 하늘은 예쁘지만 슬프네 이태원 구경 단골집 육회도 먹고 주먹밥도 먹고 파스타도 먹고 먹고 먹고 수다 떨러 한남동 에타 요 몇 달간 내 고정템들 빨간색 사랑해 마쥬에서 예쁜 코트 샀는데 살 때문에 핏이 슬프다 더샵 2년 정도 살면서 산책로 처음 와본 것 같다 신부동 파스타 최고 존엄 도노마르코  첫 유화 완성작 중간부터 흥미를 조금 잃음 마이 테레사 상자는 정말 예쁘다 아크네 스웨이드 부츠랑 코트 첫 개시 전부터 가지고 싶었던 생로랑 삭드쥬르 금장 가죽이 더 마음에 들어서 금장으로   엄마가 자취방 근처 경복궁 상품권? 끊어주셔서(감동) 갈비탕"
