title,content
타르틴베이커리 - [한남동] 샌드위치가 맛있다는.. 샌프란시스코의 유명 베이커리..,"2019년 1월 12일 시원한 평양냉면 한그릇 잘 먹고.. 오랜만에 커피도 한잔 마시러.. 차도 탔겠다.. 살짝 한남대교 넘어서 한남동으로.. ""타르틴 (TARTINE) 베이커리"" 샌프란시스코의 유명한 타르틴 베이커리의 한남점이라고.. 근데.. 장소를 찾아가보니.. 예전 이곳에서 식사했던 생각이.. 세컨드키친 - [한남동] Hot한 한남동안에서.. 더더욱 Hot한 뉴아메리칸 다이닝.. 2013년 12월 20일 휴가 3일차.. 둘이서 약 열흔간 신나게 놀아야 하는.. 그 첫번째 시작은.. ""세컨드키친"" ... hjjhlee.blog.me 암튼.. 안으로 들어가 보는걸로.. 점심시간쯤 도착했는데.. 사람 엄청 많음.. 자리 맡기가 너무나도 어려운.. 우린 다행히 좋은 자리에.. 일단 디저트부터 집어온.. 방금 냉면 먹고 왔는데.. 그래도 매너는 지켜줘야.. 1인 1메뉴 주문.. 그리고 커피도 한잔씩.. 라떼 아트 아주 잘 나온.. 첫번째 디저트는.. 불티나게 팔리던.. 레몬 티 케이크.. 정말 순식간에 팔리는지라.. 급하게 하나 집은.. 딱 어울리는 부드러운 라떼 한잔.. 달달함의 극치.. 모닝번.. 커피와도 잘 어울리는.. 나도 한번 배워볼까나.. 사람이 정말 많은.. 인기가 인기가.. 4군데의 점포가 있다고.. 가장 최근의 도산공원점으로.. 시간 잘 맞춰서.. 샌드위치 한번 먹어보는걸로.. 전화번호 792-2423 50m © NAVER Corp. 타르틴베이커리서울 서울특별시 용산구 한남대로18길 22"
타르틴의 시작 한남동에 다녀왔다. 타르틴 베이커리 브런치(feat.파전),"안녕 예전부터 지이이ㅣ인짜 가보고 싶었던 곳이 있었걸랑요 이제서야 와보다니 꺼이꺼이 ( ˃̣̣̣̣o˂̣̣̣̣ ) #타르틴한남 홍대, 용산, 도산공원 등등 타르틴이 흔해진 요즘 사실 굳이 타르틴 한남을 와볼 필요는 없지만 타르틴 한남은 직접 빵을 굽는 매장이기도 하고 타르틴 첫매장이기도 해서 꼭 와보고 싶었어요 예쁜 외관 별장에 놀러가는 느낌이다 1,2층 으로 나뉘어져 있어요 2층은 인기 많아서 앉지 못함 ㅎㅜㅜ 천장에 창문이 있다니. 들어와서 구경해보면 더욱 뭔가 캠핑팬션같은 느낌이 들어요 ㅎㅎㅎ이뿌다 ㅎㅎㅎ 저는 무려 작년 크리스마스에 방문했지만 .. 글은 이제서야 쓰고 있기 때문에 분위기는 이랬습니다 예쁘쥬? 크리스마스 시즌의 타르틴은 한정판매로 크리스마스 진저맨쿠키도 있었는데 역시나 인기폭팔이라서 당근 매진...또르륵 자고로 빵순이 심장 울리는 포인트는 매대에 빵이 꽉꽉 차 있는 모습인데 타르틴은 웅장한 라인업을 자랑하는 느낌은 아니었지만 타르틴의 대표메뉴들이 다 있어서 구경하는 재미가 쏠솔했어요 크리스마스 시즌 미니케이크들 또한 맛있어보였다 바나나크림타르트 9,500 이건 디저트쪽에서 타르틴 시그니쳐메뉴임 비싸서 도전 못하고 있는데 나중에 누가 나랑 좀 먹으러 가쥬라 요즘 바나나디저트에 미쳐있거든요 매장 한벽이 몽땅 타르틴 굿즈로 가득차 있어요 사실 이건 타르틴만의 굿즈라기보단,,, 그냥 빵 좋아하면 귀여워할만한 굿즈들 귀엽지만 ...제 지갑속이 더 작고 귀여운 관계로 참았슴..ㅎ.. 타르틴을 알게 된 메뉴 #컨트리 도 있네요 이거 처음에 먹어봤을때 그 감격을 ....잊지 못해요 수연언니네 집에 놀러갔다가 처음 먹었는데 맛잘알 언니는 오일을 같이 내어주셨구,,, (그때 아마 맛있다고 내가 거의 다 먹었음..ㅎ..지송..) '와... 세상에 이런 맛이 있구나...' 라는 생각을 했어요 아직도 그 순간을 기억하고 있을 정도롴ㅋㅋㅋㅋ 진짜 맛있었음 = 타르틴 컨트리를 처음 만났던 그날의 나 타르틴 컨트리빵 맛설명을 해보자면 겉은 딱딱바삭, 속은 떡 직전으로 쪼온득 ! 한데 묘하게 새콤한 맛이 중독적이에요 꼬옥 에어프라이에 살짝 돌려서 오일에 찍어먹어야함. 그때부터인가요... 시큼한 빵을 좋아하게 된 게 .... 변태처럼 사워도우빵을 찾아다니기 시작했고 ㅋㅋㅋㅋㅋㅋㅋㅋㅋㅋㅋㅋㅋㅋㅋㅋㅋ 시골빵만 사오면 오일에 찍어먹기 시작했다능,,,, 한남동 타르틴 베이커리 영업시간 10:00~ 22:00 주차 발렛가능 서울 용산구 한남대로18길 22 컨트리 홀 14,000/ 하프 8,000 크루아상 4,600 바나나크림타르트 9,500 타르틴 브런치타임 10:00~16:00 분명 예전에 볼땐 타르틴베이커리마다 조금씩 브런치메뉴가 달랐는데 점점 브런치메뉴가 통일되는 느낌이네요 시즌마다 메뉴는 조금씩 바뀌는 듯 합니다 그릴치즈 샌드위치 11,000 그릴치즈 샌드위치를 브런치메뉴로 주문했는데 2가지 옵션이 있었어요 1. 그릴치즈 샌드위치 (파) 2. 그릴치즈 샌드위치 (토마토) 파로 주문했어요 우리가 생각하는 한국파 = 대파 는 아니고 쪽파임! 파가 진짜 많아섴ㅇㅌㅋ 처음엔 당황함 ㅋㅋㅋㅋㅋㅋ약간 파전재질 ㅋㅋㅋㅋㅋㅋㅋ 이거 파전맛 ㅇㅇ 하면서 먹었는데 먹다보니 중독됨.. 맛있어요 치즈,,, 쪽파,,, 그리고 쫄깃빵,,,알러뷰 음뫔마 빵은 컨트리빵의 그 컨트리빵이에요 !! 컨트리빵으로 샌드위치라니 좋아서 기절함… 당근라페가 기본으로 나오는데 상콤해서 같이 올려먹기 좋아요 약간 피클처럼 먹기 좋은 느낌 오이 싫어해 인간들이 피클은 먹을 수 있듯이 당근 싫어해 인간들도 당근라페는 먹을 수 있어욧 넵. 맛있다는 뜻입니다 리틀넥에서 브런치 뿌시고 2차로 또 브런치먹은거라서 감흥없이 먹지 않을까 …싶었는데 배불렀는데도 불구하고 맛있었으면 진짜 맛있었다는 뜻 아닐까요? 따뜻한 크리스마스에 맛있는 타르틴에 마음이 듬뿍 담긴 선물까지 또둥둥 이날 행복해서 뒤진날 타르틴에 대한 좋은 기억이 또 쌓였네요 #타르틴베이커리 #타르틴한남 #타르틴베이커리한남점 #타르틴브런치 #그릴치즈샌드위치 #쪽파 #타르틴컨트리브레드 #컨트리빵 #사워도우 #타르틴사워도우"
[한남동베이커리] 커피와 빵 갓벽한 '타르틴베이커리',"부첼리하우스에서 커피까지 주지만.. 임신 34주차.. 별이가 태어나면 이제 우리에게 카페조차 사치라는걸 알기에 ㅋㅋㅋ 갈 수 있을 때 가자고 해서 타르틴 베이커리를 찾았다. 발렛주차 가능하고 발렛비는 3천원이다. 타르틴베이커리 예전에 오픈하고 얼마 안되서 줄 빙 둘러서 서서 겨우 샀던 기억이 있는데 이제는 마켓컬리에 배송도 되고 평일이라 더욱 여유로웠다. 빵 종류는 크게 달라지지 않은 것 같았다. 패스츄리류가 맛있는 걸 알기에 커피번과 아몬드 크로아상을 골랐다. 식빵, 단팥빵, 넛츠카라멜 페이스트리, 제주 녹차 티케이크, 키쉬, 그리고 시그니처인 브레드푸딩이 있었는데 시즌메뉴로 무화과가 들어간 것 같았다. 월넛아몬드티케이크, 레몬티케이크, 바나나월넛머핀, 피스타치오마들렌, 초콜릿칩쿠키, 오트다이제스티브쿠키, 브라우니 등 구움과자류도 진열되어 있다. 빵 자체가 맛있으니까 프렌치토스트나 샌드위치 등 아점으로 브런치 먹으러 와도 참 좋을 것 같다. 케이크도 미국식 테이크처럼 높이도 높고 먹음직스럽게 생겼는데 당근 테프케이크, 치즈케이크, 초콜릿수플레케이크, 데블스푸드케이크가 홀사이즈로 진열되어 있었다. 남편은 호밀빵, 통밀빵 스타일을 선호해서 컨트리브레드 하프를 골랐다. 버터와 같이 포장된 것도 있고 빵만 따로 판매도 하고 있다. 쇼케이스에는 시그니처인 레몬크림타르트, 피칸타르트, 펌킨파이, 애플파이, 바나나크림타르트, 에끌레르, 밀크롤, 그리고 베스트셀러인 레몬머랭케이크 등이 있었다. 커피는 필터커피 제외하고 디카페인으로 무료로 변경이 가능해서 좋았다. 매장이 널긴 한데 층고가 높아서 탁 트이긴 하였지만 생각보다 자리가 많지 않다. 남편은 비도 추적추적 내려서 그런지 간만에 에스프레소를 주문했다. ☕ 빵은 포장해서 집에 가져왔는데 그냥 먹어도 고소하고 특유의 시큼한 맛이 느껴져서 맛있었고 가염버터를 발라 먹어도 맛있고 버터에 살짝 구워 먹어도 맛있었다. 다만, 당일날 먹지 않으면 시간이 지날수록 수분이 날라가서 딱딱해지니 냉동보관하는 것이 좋다. 커피번이랑 아몬드 크로아상은 당일날 먹지 않고 다음날 먹었는데 그래도 바삭함이 살아있었다. 시나몬 덕후인 나는 커피번은 너무 취향저격인 빵이다. 참 임신하면 입맛이 변하기도 한다는데 나는 꾸준히 빵순이다. 🥐🍞🥖🫓🥨🥯 별이 나오면.. 마켓컬리로 주문해야지 ㅋㅋㅋㅋ 좋은 세상 * 영업시간 : 매일 10:00-21:00 50m © NAVER Corp. 타르틴 베이커리 한남점 서울특별시 용산구 한남대로18길 22 예약"
[한남동/한남오거리] Gnocchi bar 여러종류의 뇨끼를 맛볼 수 있는 뇨끼바+타르틴베이커리,[한남동/한남오거리] Gnocchi bar 뇨끼바 타르틴베이커리 둘다 뇨끼를 좋아해서 친한 언니랑 갔던 뇨끼바! 들어가자마자 긴테이블에 착석 뇨끼바 메뉴 와인을 한잔 주문하려고 추천부탁드렸더니 시음가능하다고해서 두 가지를 맛보고 당첨! 긴테이블 하나에 손님들이 다 앉아야하니 옆자리에 일행이 아니여도 앉을 수 밖에 없는점은 알고 가셔야해요! 주문한 메뉴와 식전빵 와인 재료도 신선하고 식감도 나쁘지 않았어요 그치만 기대를 많이해서그런지 조금 애매한집 가장 유명한 시그니쳐 메뉴도 주문해보았어요 트러플크림뇨끼 그럭저럭 먹을만 재방문의사는 없음 밥을 먹고나와서 근처에 타르틴베이커리로 갔어요 오픈했을때 이후로 처음인데 메뉴들이 대채로 다 먹을만한거같아요! 예전보다는 사람이 줄었지만 그래도 여전히 인기가 좋아보였던 우리는 재빠르게 먹고 나왔어요
[빵지순례] 한남동 타르틴 베이커리 서울,"샌프란시스코의 유명 베이커리 #타르틴 베이커리 2017 년 뉴욕타임즈가 선정한 세계 최고의 빵 이자 죽기 전 먹어야할 미국 25 대 음식 에 뽑혔다는 곳 한국에 오픈한지 1년도 안됐는데 벌써 홍대에 2호점이 생길만큼 인기가 대단한 타르틴 베이커리 소문으로만 듣던 한남동 카페 타르틴 베이커리를 왔습니다:) 발렛 파킹이 가능하고요- 발렛비용 3,000원 입니다. 주차는 2시간 가능 50m © NAVER Corp. 타르틴베이커리서울 서울특별시 용산구 한남대로18길 22 매일 09:00 - 21:00 정말 사람이 많더군요 오픈때 비하면 양반이라는데 그래도 많더이다요 매장 면적이 넓은 편인데도 북적 북적 인기 짱인 한남 타르틴 베이커리 원래는 영업시간이 오전 9시부터 오후 7시까지 였는데 5월19일부터 오후 9시까지 연장 1층에 커피를 만드는 공간과 빵 쇼케이스가 있고, 테이블이 조금 있고요 픽업을 해서 위쪽 2층 테이블에서 먹고 갈 수 있게 되어 있더라고요. 위층에 자리가 없을 수 있으니 꼭 자리부터 먼저 맡으신 후 여유롭게 빵 사세요-❤️ 우리도 한참 기다린 후에야 자리가 났다고요! 꺄 빵천국 빵헤븐 줄을 서서 차례대로 빵 구경하다가? 주문 하는 곳에 먹고 싶은 빵 이야기 하고 결제하고 먹고가거나 포장해가는 시스템 다들 하나씩 구매하던 갈비소스 차돌박이 반미 무려 17,000원 우리도 갈비소스 차돌박이 반미 픽 한남 멀티그레인 왠지 보기만 해도 꼬숩해보임 스콘도 맛있다길래 세이버리스콘 하나 픽 유명한 모닝번도 하나 뭔놈의 빵들이 이렇게 비싸다냐..... 많은빵들이 있으니 눈이 휙휙 돌아가고 누군가 치즈누룽지맛이라길래 궁금함에 사보기로한 구제르 손바닥 보다 작은데 4,500원 세서미 참깨 나 완전 좋아하는뎁 크로와상도 먹어야지 쿠키,브라우니도 있고 케이크랑 타르트 종류들도 다양 계산대에 와서 빵 말하고 계산 완료 분주하게 돌아가는 타르틴 베이커리 먹고 갈 반미샌드위치랑 크로와상 그리고 아이스라떼 기달기달 나머지는 포장이요- 높은 천장 대롱대롱 동글동글 조명 2층에서 바라본 타르틴 베이커리 분주하게 쉴새없이 돌아가는 타르틴 2층 좌석이 부족해서 자리를 쟁탈하기 위한 눈치싸움이 치열합니다 아이스카페라떼 한잔 카페라떼 맛있다 먹기위해 바삐 움직이는 손 밥 먹었는데 빵 배는 따로 있는 듯 빨리 좀 찍어라 봉구야 좀 먹자 아주 속이 그득한 갈비소스 차돌박이 반미 부재료가 폭발한다!!! 칼로 잘라보려했지만 실패 살짝살짝 느껴지는 고수의 향 퐁퐁의 향이 올라오는구나 고수와 차돌의 조합이 아주 좋앗 먹어도 먹어도 없어지지 않는듯한 기분 빵 바삭바삭 또 먹고싶다 갓 구웠을때 먹었음 맛있었을듯? 맛 없는건 아닌데 흔히 아는 크로와상 맛 칼질도 제대로 못하는 내남자 적당히 버터리 하고 꼬소하고 겉은 파스락 나머지는 포장하고 발렛 기다리면서 이번에 같이 맞춘 꺌랑 기절로퍼 한 컷 손바닥 보다 조금 작은 사이즈 사악한 가격 타르틴 베이커리의 구제르 이렇게 사진으로만 보면 속이 꽉찬 빵 같지만 공갈빵이답 :) 치즈 공갈빵 이라고 해두자요! 전체적으로 에멘탈 치즈의 짭쪼롬함이 상당히 마음에 들고요 사이사이 후추맛이 후추후추 하게 납니다 그리고 끝맛이 묘하게 달달함? 난 뭐 치즈덕후니께 맛있게 먹었고- 하지만 한번 사먹은걸로 충분하다! 세이버리스콘 감칠맛이 좋았던 스콘 베이컨도 총총 씹히고 치즈맛도 나고 암튼 야채맛 슴슴 :p 짭짤하고 폭신한 식감의 스콘 부드럽고 촉촉 밀도 있는 스콘이라 마음에 듭니다 모닝번은 주말에 오븐에 구워 먹으려고 냉동실에 보관 중 전체적으로 빵은 맛있었는데 가격이 일단 넘 비싸고 줄서서 먹을정도인지는 잘...... 이상 타르틴베이커리였습니다"
맛있는 브런치와 빵을 맛볼수 있는 한남동 타르틴베이커리,"한남동에 위치한 타르틴 베이커리 한참 줄서서 먹는 빵집이었는데 이제 청담, 한남 뿐만 아니라 엄청 많은 곳에 지점이 생기고 배달로도 만나볼수 있게되었죠! 샌프란이 고향인 미국의 빵집입니다 빵, 브런치, 커피 모두 맛있는 곳이죠 뇨끼바에서 메뉴 4개 부시고 2차로 방문 ㅋㅋ 외관입니다. 주차는 발렛가능 천장에 달린 조명도 넘 예쁘고 천고가 높아 아주 시원시원하죠 엄청 넓은 공간은 아닌데 천고 덕분에 아주 시원한 느낌 한쪽으로 가면 이렇게 굿즈도 판매 크로와상 에코백 ㅋㅋㅋ 머그도 귀여워요 전 요게 맘에드는데 꾹 참고 사지 않았습니다 ㅋㅋㅋ 다양한 빵이 준비되어 있어요 타르틴의 대표메뉴 컨트리브레드 쫄깃한 식감과 시큼한 매력적인 맛 컨트리브레드 쿼터+버터 7천원에 판매하는데 컨트리브레드 하프도 7천원 빵만 많이 사고싶으신 경우는 하프를 추천 저도 하프 하나 포장해왔어요 ㅋㅋ 배만 부르지 않았더라면 많이 샀을텐데 ㅋㅋㅋ 샌드위치도 맛나보이고 케익도 준비되어 있고 키쉬도 맛잇겠네요 그러나 저의 선택은 두구두구 프렌치 토스트! 메뉴 네개 먹고 온거 맞냐며 ㅋㅋ 계란물도 아주 촉촉하고 적당히 달달한게 아주 만족스럽습니다 커피는 디카페인도 준비되어 있어요! 브런치로 방문하기에도 커피한잔 마시기에도, 가볍게 빵을 사러 들르기에도 좋은 곳이네요! #타르틴베이커리 #한남동빵집 #한남동브런치 #한남동카페 #채드로버트슨 #한남동크로아상 #컨트리브레드 #한남동맛집 #한남동커피 #한남동디카페인커피"
"한남동 타르틴 베이커리 (주차,발렛,메뉴)",한남동 카페 ::타르틴 베이커리:: 50m © NAVER Corp. 타르틴 베이커리 한남점 서울특별시 용산구 한남동 263-2 예약 혜정이랑 한남동에서 데이트를 하기 위해 왔지만 놀기 전에 미리 수업 준비나 좀 할라고 타르틴 베이커리에 왔다 밥도 먹고 ! ㅎㅎ 빵메뉴가 많아용 (베이커리 가게니까 당연한 얘기하기) 샐러드도 판다 딱 봐도 엄청나게 찔깃해 보이는 건강빵 케이크류도 판다 요즘은 굿즈를 안파는 카페가 없네 나도 여기서 스티커를 하나 삼 ㅎㅎ 일층 자리는 이 정도?! 다음에는 창문쪽에 앉아보고싶다 계산하는 혜정이가 보이네 나의 메뉴 메뉴 전체샷 투 아잇스아메리카노 감자스프 반미 뭔 타르트..? 내가 엄청 좋아하는 반미~~!! 짱맛입니다요ㅠㅠ 저 타르트도 나름 맛났다 트러플오일이 솔솔 뿌려진 맛있는 돼지감자 스프 요즘 트러플이 많이 먹고 싶었는데 이날 정말 점심 저녁 둘 다 트러플을 실컷 먹었다 이건 뭔 필터냐 혜정아 빵 다 먹고는 열심히 쉅준비하고 나머지 시간은 한남동에서 잼나게 놀아따 ❤️ 나오면서 인증샷도~~^^ 자 이제 그만 찍으렴 ~~^^ 됐다~~ 주차는 발렛이 바로 앞에 가능한데 3천원에 2시간이 기본이고 그 후는 추가비용이 붙는다 발렛이 되니 참 편하네용 ㅎㅎ 여윽시 한남쵝오! 담에도 또 널러와야징~~ 언젠가 이 동네에 살아보는 날까지^^ 그럼 타르틴베이커리 훅이 끝 !
한남동 타르틴베이커리 브런치 먹기 딱이에요 :),"안녕하세요 쿠키테리입니다👶🏻🐶 오늘은 제가 출산전 마지막 브런치타임을 가진 한남동 타르틴베이커리를 소개해드리려고 해요. 지금 조리원에 들어와있는데 시원한 커피 한잔에 브런치가 그립네요 너무너무 먹고싶어요😭😭 건물이 굉장히 큰데 전체적인 외관을 담지는 못했어요 커다란 세모집 모양이랍니다! 바로 앞 발렛부스에서 주차도 가능합니다. 한남동 타르틴베이커리는 베이커리류와 함께 브런치가 유명한 맛집인데요, 1층과 2층으로 된 복층구조이며 매장은 꽤 넓었던 곳이라 좌석 여유있었어요 1층에도 다양한 스타일의 좌석들이 있어요. 일반 우드테이블부터 원형 테이블과 체어, 길다란 스퀘어테이블까지 다양했답니다. 한남동 타르틴베이커리 내부 컨셉은 아주 우드우드해서 베이커리류와 참 잘 어울렸던 것 같네요 :) 1층 창가자리 하이부동산 뷰ㅎㅎㅎ 선선한 날 여기 앉아서 커피에 브런치 먹음 주말 여유를 아주 느긋하게 만끽하는 느낌❤️ 저희는 1층에 앉고싶은 자리가 없어서 조금 더 여유있는 2층으로 올라왔어요. 저기 보이는 창가자리가 비어서 앉았구요, 남녀 화장실도 2층에 같이 있었답니다! 빵은 정~말 다양하게 준비가 되어있구요. 역시 막달에 당을 조절하느라 먹고싶어도 다 먹지 못하고 참았고, 시킨 브런치메뉴만 조금씩 조심해서 먹었던 것 같아요 ㅠ 그래도 배부르게 먹긴 했습니다...ㅋㅋㅋ 제가 정말 먹고싶었던건 쇼케이스 너머로 보이는 달달구리 케익류들이었어요. 이건 아쉽게 먹지 못했지만 담엔 꼭 먹을래요! 한남동 타르틴베이커리는 브런치류에도 그렇고 비건 메뉴들이 좀 많더라구요 :) 요즘에 베이커리쪽에서 비건이 정말 핫한데 그런 흐름을 따라가는건지 원래 그런지는 잘 모르겠지만, 누구나 와서 선택할 수 있는 메뉴가 있다는 건 정말 좋은 듯 합니다. 타르트나 파운드케익, 쿠키와 간단한 요깃거리들까지 먹을 수 있다면 정말 고르기 힘들었을만큼 많은 종류가 보였어요. 저희는 타르틴베이커리 브런치를 먹으러 갔기때문에 위에 보이는 메뉴에서 골랐어요! 렌틸 코코넛 커리 스프, 에그 샌드위치, 프로마쥬 잠봉 샌드위치, 아이스 아메리카노 이렇게 주문했던 것 같아요 푸짐하게~~ 가격대는 그냥저냥 괜찮은 듯 합니다. 프로마쥬 잠봉 샌드위치 요즘 잠봉뵈르라는게 정말 핫하죠??? 바게트 안에 햄이랑 치즈만 간단히 넣어 만든 바게트 샌드위치라고 생각하심 되는데 저도 궁금했던 차에 여기 있어서 먹어봤어요 먹어보지 않아도 겉이 아주 바삭해보이는 길다란 바게트에 치즈와 햄만 들었는데요, 겉이 조금 단단해서 칼로 썰어드시는걸 추천! 막상 전체적으로 씹어 먹을 때는 딱히 단단해서 불편하단 생각은 못했네요. 옆 단면을 봐도 딱 핑크색 햄이랑 노란색 치즈만 보이는데 정말 그게 전부! 그러면 햄과 치즈 퀄리티가 굉장히 중요하겠죠? 열었더니 팍팍 뿌려진 후추도 눈에 띄네요. 먹어보니 그냥 깔끔하면서도 약간 햄의 짠맛이 느껴지는 투박한 바게트 샌드위치인데, 막 굳이 찾아서 먹을 맛은 아니었던 것 같아요. 그냥 커피랑 즐기기 부담없는 스타일 :) 약간 산미가 느껴졌던 아메리카노이구요, 전 산미있는 커피는 별로 안 좋아하는데 그렇게 많이 느껴지지는 않아 잘 마셨어요. 그냥 누구나 무난하게 마실 수 있는 커피 타르틴베이커리 커피 자체가 유명하다 하는데 전 그냥 고소한 원두 취향이라 ^^; 왼쪽이 에그 샌드위치, 오른쪽이 비건 브런치 메뉴 중 하나였던 렌틸 코코넛 커리 스프 렌틸 코코넛 커리 스프에는 바게트 두쪽과 함께 나와서 든든한 브런치 메뉴예요. 스프 위에 고수가 많이 올라가기때문에 저는 먹기 전에 전부 빼고 먹었답니다! 싫어해요 고수를... 고수를 빼고 먹어본 렌틸 코코넛 스프는 비건메뉴임에도 굉장히 건강하면서 맛있어서 좋았어요 간도 은근 있는 편! 이 바게트는 생바게트 그대로가 아이라 오븐에 구운건지 뭔지 되게 고소하고 겉은 부드러운데 겉은 바삭한 맛있게 조리된 바게트여서 좋았네요. 이렇게 스프를 살짝 올려서 먹거나 아니면 푹 담궈 먹어도 맛있었답니다! 빵 자체가 워낙 맛있어서 그냥 먹어도 맛있고, 올려 먹어도 너무 맛있었네요. 비건 메뉴라 호불호 있을 듯 하지만(스프) 저희 입맛엔 새로우면서도 괜찮았던 것 같아요. 가격대비 굉장히 괜찮은 메뉴라고 생각했던 한남동 타르틴베이커리 브런치 중 하나인 에그샌드위치인데요, 에그버거라 불러도 될 듯 햄버거 번 보다 훨씬 더 라이트한 느낌의 번을 이용해서 버거의 묵직함을 버렸고, 산뜻한 채소들과 달걀 베이컨만 들어간 아주 깔끔하고 신선한 맛의 에그샌드위치예요 빵 자체가 굉장히 폭닥하고 포송한 식감이라서 많이 먹어도 부담없을 듯! 재료를 푸짐하게 가득 가득 넣어두어서 빵맛 보다 속재료 맛을 제대로 느낄 수 있어요. 이제는 가기가 어려울 것 같아서 더 그리운 한남동 타르틴베이커리 브런치 카페ㅠㅠ 주말에 여유있게 브런치 먹을 곳 찾으심 여기 추천드리고 싶어요~~❤️ 50m © NAVER Corp. 타르틴 베이커리 한남점 서울특별시 용산구 한남대로18길 22 예약"
[한남동] 인테리어 멋진 <타르틴베이커리 서울> TARTINE,"한남동 예쁜 빵집 타르틴 베이커리 지나가다 빨리듯 들어간 타르틴 베이커리. 예쁘고 먹음직스런 빵이 유혹하고 높은 천장이 눈에 띄는 곳. 오픈한지 1년정도 되었다고 하니, 이곳에 오랜만에 오긴 했나보다. 윤기나는 크라와상, 스콘 등 다음에 오면 꼭 먹어보고픈 샌드위치. 커피가격도 빵도 조금 비싼편이나 커피와 빵을 주문해 꼭 앉아서 먹고가고 픈 집이다. 컨트리보울차우더도 다음에 먹으러 와야겠다. 타르트와 에끌레어도 있고 널찍한 조리대가 인상적이다. 타르틴 굿즈도 판매하고 있다. 비니, 틴케이스, 아기옷, 텀블러, 폰케이스, 스티커 등.. 커피와 빵 주문 후 2층에 자리를 잡았다. 거의 만석. 어쩜 이렇게 깔끔하게 해놓았을까. 너무 마음에 드는 곳이다. 식사 후라 간단히 차와 빵 아메리카노는 산미가 좀 있는 원두. 시큼시큼. 따뜻해진 날씨에 시원한 아이스아메리카노를 벌컥벌컥 들이켰다. 또 오고싶은 곳. 브런치먹으러 오고싶은 곳. 50m © NAVER Corp. 타르틴베이커리서울 서울특별시 용산구 한남동 263-2"
