title,content
서울디저트코스 맛집 한남동 고든즈 gordons,"한남동 | 치즈케이크 맛집 덱스터고든 한남동에 작은 미니케이크를 사고싶어 찾아보던 도중에 발견한 덱스터고든 사러 가보겠습니다 찾는길이 좀 ... m.blog.naver.com 여러분 작년에 다녀왔던 고든즈!!! 이번엔 고든즈에서 디저트코스 를 맛 볼 수 있다고 하여 방문했어요 고든즈 godons 매주 월,화 정기휴무 입니다 영업시간 수,목,금 11:30-19:00 토,일 12:00-17:30 고든즈 디저트 팝업 영업시간 매주 토요일/ 일요일에 2부제로 운영합니다. 가능하신 시간에 맞추어 예약 부탁드립니다. * 매주 토요일, 일요일 1부 1:00PM ~2:30PM 2부 3:30PM~5:00PM 장소: 고든즈 서울시 용산구 독서당로 14길 43-2, 2층 문의: 02-792-0106 *주차는 근처 공영 주차장을 이용해주세요. 네이버 예약 :: 고든즈 스튜디오 디저트 팝업 고든즈 디저트 팝업은 예약제로 진행되며 고든즈의 시그니처 메뉴들로 구성되어 있습니다. 4가지 디쉬가 제공되며 같이 즐길 수 있는 음료(커피, 티, 주류)도 함께 준비되어 있습니다. 고든즈 스튜디오는 베이킹을 하거나 작업을 하는 공간으로 주로 사용됩니다. 이번 팝업을 위해 따스한 주말 오후, 고든즈 스튜디오에 초대 드립니다. * 매주 토요일/ 일요일에 2부제로 운영합니다. 가능하신 시간에 맞추어 예약 부탁드립니다. * 매주 토요일, 일요일 1부 1:00PM ~2:30PM 2부 3:30PM~5:00PM 장소: 고든즈 서울시 용산구 독서... m.booking.naver.com 네이버 예약을 통하여 예약했어요 6월23일 까지 디저트 팝업 기간이지만 계속하여 디저트 메뉴가 바뀌면서 지속 될 예정이라고 해요 위치 고든즈 서울특별시 용산구 독서당로14길 43-2 2층 골목 사이의 건물에 2층에 있어요 들어가 보도록 하겠습니다 디저트 코스 라니 너무너무 기대되요 ( ˘ ³˘)♥︎( ˘ ³˘)♥︎ 제가 전에는 고든즈 치즈케이크를 먹어본 기억이 있는데 진짜 맛있었어요 이 날은 운이 좋게 같이 간 친구들 끼리만 프라이빗 하게 디저트코스 요리를 즐길 수 있었습니다 오늘의 코스를 봐볼게요❤︎︎ 6월23일 이후엔 새메뉴 코스로 바뀔듯 합니다 Coffee or tea 중에서 저는 tea 선택했어요 그리고 후에 화이트와인 한병 (62,000/bottle) 추가해서 마셨어요 홍차가 가볍게 준비 되었어요 씁쓸한 맛의 티가 아니라서 디저트와의 페어링이 좋았어요 Godons dessert 1 course 파스타랄리 매콤한 맛이 맴도는 크레커 제철과일쿠키 (pic❤︎︎) 개인적으로 부드럽고 맛있었던 체리와 블루베리가 올라간 부드러운 쿠키 호밀초코쿠키 호밀로 만들어진 초코쿠키 망고 입가심용 맛있는 망고㋛ 고든즈의 디저트는 딱 먹자마자 와인에 먹으면 맛있겠다!!! 생각했는데 고든즈에서 주신 와인 너무 완벽했어요( ˘ ³˘)♥︎ 페어링이 완벽해요 상큼하고 여름과일 같은 향기를 풍기고 맛을 내는 와인은 모든 코스가 끝날때 까지 너무 좋았어요 ♡´･ᴗ･`♡ 와인 꼭꼭 시켜드세요(강추) Dessert 2 course 토마토 바질 파블로바 토마토의 상큼함과 머랭으로 만든 파블로바의 조합❤︎︎ 거기에 바질크림 이거 진짜 산뜻하니 맛있어요 토마토는 또 너무 싱싱하니 달달하고 산뜻하고 싱싱한 맛이에요 다들 이거 먹고 “이거 모야? 빨리 먹어봐!” 했던 디저트에요 어른들도 좋아할 맛의 디저트 한입먹으면 토마토와 바질맛이 느껴지면서 토마토와 바질이 연상 되요 초여름을 먹는 느낌 ᕕ( ᐛ )ᕗ❀ 웃음꽃을 피우는 수다를 떨며 3번째 순서로 넘어갑니다 Dessert 3 course 고든즈 안주 고든즈 바스크체즈케이크/구제르/ 스모크드 토마토 +데낄라 데낄라와 먹는 디저트 순서입니다 데낄라는 바닐라향이 가득한 술이었어요 고든즈의 다양함에 반합니다( ˘ ³˘)♥︎ 술을 못드시는 분들은 커피or 티 로 대체 가능하지만 저희는 전원 데낄라 선택했어요 데낄라와 디저트라니!!! 음식 코스 요리도 참 즐겁지만 디저트 코스는 재밌는 것 같아요 달달하면서도 새롭고 디저트가 이렇게 다양하게 다가올 수 있구나 느낄 수 있어서 너무 재밌어요 그리고 일단 플레이팅이 너무 예뻐요✿ 순서는 치즈케이크-구제르-스모크드 토마토 하나씩 먹으며 데낄라도 같이 마셔주세요 요 디저트는 크게 달지 않고 짭쪼름한 느낌의 디저트로 디저트 코스를 질리지 않고 먹을 수 있어요 밑에 소스도 쓰윽쓰윽 발라서 드셔주시면 훨씬 맛있어요 그리고 디저트 만드는 과정을 볼 수 있어서 또 재밌어요 오픈주방의 묘미인 것 같아요 마지막 디저트 코스 순서에 이제 접어듭니다 디저트의 속도는 먹는 사람의 속도에 맞춰주시기 때문에 급하지 않으셔도 되요 토치로 럼을 날려주고 토치로 단 맛을 더 극대화 해줍니다 Dessert 4 course 프로즌 캐리비안 이탈리안 머랭, 수제 코코넛 파인애플 아이스크림 머랭 아이스크림을 럼 소스에 묻혀서 엄청나게 부드러운 케이크를 먹는 듯 한 듯 상큼하고 달달한 아이스크림 머랭의 부드럽고 달달함을 살그머니 뚫고 나오는 파인애플의 상큼함과 코코넛의 맛 마지막 4번째로 있는 이유가 너무나도 잘 느껴지는 디저트였어요 부드럽고 상큼하고 달달하고 맛 자체가 행복함이에요 그리고 고든즈 파티쉐 분들이 다들 친절하시고 배려도 잘 해주셔서 더 즐거웠던 것 같아요❤︎︎ 고든즈 팝업 디저트코스 먹으러 잘 온 것 같아서 행복해요☺︎︎ 친구들도 너무 즐겁고 맛있다고 하더라고요 디저트 코스도 이렇게 재밌구나 생각했어요❣︎ 다들 미소가 그득그득 단조로운 일상에 지겨우신 분들 추천드려요 저희 3명도 디저트 코스는 처음 접한 것인데 즐겁고 디저트에 관심이 생기더라고요 그리고 치즈케이크도 구매하실 수 있어요 혹은 미리 예약하시면 큰 사이즈도 구매 후 픽업해 가실 수 있어요 고든즈 바스크 치즈케이크도 너무 달지도 않고 맛있는 치즈 맛이 나요 이거 진짜 먹어봐야 해요 ㅠㅠ 그리고 조만간 다른 공간에서 팝업도 하신다고 해요 맛도 여러가지 있어요 그리고 쿠키 종류도 추가 되었다고 해요 선물용으로 구매해서 가기도 좋을 듯 해요 쿠키 종류도 다양하더라고요 패키지 박스도 예뻤고요 그리고 고든즈 쿠폰도!!! 받을 수 있었어요❤︎︎❤︎︎❤︎︎ 고든즈 넘 완벽하다…( ˘ ³˘)♥︎ 고든즈 진짜 행복한 시간이었습니다 저는 후에 치즈케이크 구매 하러도 가고싶고 메뉴가 바뀌는 디저트코스 먹으러도 재방문 하고 싶어요!!!!!!!"
한남동｜고든즈,"고든즈 평일 11:30 - 19:00 주말 12:00 - 17:30 정기휴무 (매주 월요일, 화요일) 고든즈 서울특별시 용산구 독서당로14길 43-2 2층 GORDONS(고든즈): 덱스터고든/쿠키고든 🍪🎂한남동디저트(@shop.gordons) • Instagram 사진 및 동영상 팔로워 1,651명, 팔로잉 88명, 게시물 272개 - GORDONS(고든즈): 덱스터고든/쿠키고든 🍪🎂한남동디저트(@shop.gordons)님의 Instagram 사진 및 동영상 보기 www.instagram.com 고든즈 : 네이버쇼핑 스마트스토어 고든즈에는 바스크 치즈케이크 브랜드인 덱스터고든, 쿠키 브랜드인 쿠키고든이 있습니다. smartstore.naver.com 친구 덕분에 디저트 팝업, 디저트 오마카세 맛보러 다녀온 한남동 '고든즈' 바스크 치즈케이크로 유명한거 익히 알고 있어서 더 기대하면서 방문했어요 가보실까요 ~!~! 건물 2층에 위치한 고든즈 입니다 엘리베이터가 있으닉 타주세요 ㅎ_ㅎ 저희는 예약하고 갔는데 미리 세팅 되있었고 이 날, 이 시간대 저희만 예약해서 프라이빗하게 즐길 수 있었어요 🧡~ 네이버 예약 :: 고든즈 스튜디오 디저트 팝업 고든즈 디저트 팝업은 예약제로 진행되며 고든즈의 시그니처 메뉴들로 구성되어 있습니다. 4가지 디쉬가 제공되며 같이 즐길 수 있는 음료(커피, 티, 주류)도 함께 준비되어 있습니다. 고든즈 스튜디오는 베이킹을 하거나 작업을 하는 공간으로 주로 사용됩니다. 이번 팝업을 위해 따스한 주말 오후, 고든즈 스튜디오에 초대 드립니다. * 매주 토요일/ 일요일에 2부제로 운영합니다. 가능하신 시간에 맞추어 예약 부탁드립니다. * 매주 토요일, 일요일 1부 1:00PM ~2:30PM 2부 3:30PM~5:00PM 장소: 고든즈 서울시 용산구 독서... m.booking.naver.com 저희는 네이버로 예약하고 방문했습니다 디저트 코스는 이렇게 됩니다 ① 웰컴 드링크 ( 커피 or 티 ) ② 쿠키고든 플래터 ( 파스타랄리 / 제철 과일 쿠키케이크 / 호밀 초코 쿠키 / 제철 과일 ) ③ 토마토 바질 파블로바 ( 머랭쿠키, 바질 생크림, 마리네드 토마토, 제철 토마토, 토마토 꿀리, 페타치즈 ) ④ 고든즈 안주 ( 덱스터고든 바스크 치즈케이크 / 구제르 / 스모크드 토마토 ) ⑤ 드링크 ( 데낄라 ) ⑥ 프로즌 캐리비안 ( 이탈리안 머랭, 수제 코코넛 파인애플 아이스크림, 럼비바 ) 이 날 너무 더웠고 달달한 디저트들이랑 아아 마시면 좋을것 같아서 아이스아메리카노로 주문 픽 (!) 앞에서 바로 디저트 준비해주시는거 재미가 쏠쏠 (다음에 뭐가 나올까 - ) 사실 친구 생일 겸 약속이라 기분 좋게 화이트 와인도 시켜봤어요 🍸🍸🍸 ② 쿠키고든 플래터 ( 파스타랄리 / 제철 과일 쿠키케이크 / 호밀 초코 쿠키 / 제철 과일 ) 위에서 부터 살짝 매콤했던 파스타랄리, 체리와 블루베리가 올라간 쿠키케이크 꾸덕한 호밀 초코 쿠키 망고 큐브와 식용 설탕 장미 개인적으로 꾸덕한 쿠키케이크가 너무 맛있었어요 바로 요놈 되시겠다 ~! 와인이랑 꿀조합데쓰 ~! ③ 토마토 바질 파블로바 ( 머랭쿠키, 바질 생크림, 마리네드 토마토, 제철 토마토, 토마토 꿀리, 페타치즈 ) 하 .. 제가 또 토마토 바질.. 환장하거든요 . .💚💓 제일 맛있었고 제 마음에 쏙든 디저트 머랭쿠키 너무 부드럽고 전체적으로 맛이 진하지않고 연해서 부담없이 먹기 좋았어요 은은한 상큼함이랄까 .. ~ ⑤ 드링크 ( 데낄라 ) 다음 디저트랑 같이 먹으면 궁합이 좋은 데낄라를 준비해 주셨어요 주류가 땡기지않으신분들은 드시지않아도 된다고 하셨어요 ④ 고든즈 안주 ( 덱스터고든 바스크 치즈케이크 / 구제르 / 스모크드 토마토 ) 데낄리와 함께하는 고든즈 안주 소문으로만 들었던 덱스터고든 바스크 치즈케이크, 역시나 너무 맛있다 .. !!! 구제르는 안이 비어서 부셔서 먹어야했어요 와인과 데낄라 .. 행복한 시간이다 .. 💘 ⑥ 프로즌 캐리비안 ( 이탈리안 머랭, 수제 코코넛 파인애플 아이스크림, 럼비바 ) 여기 안에 시원한 아이스크림이 있다고 하면 믿으시겠습니까 시원하게 마무리 싸악 - 그냥 너무 맛있. 두말 할 필요가 없습니다. 배도 채웠으니 이제서야 구경하는 팝업.. ㅎ 볼거리도 많고 사고싶은것도 잔뜩이었어요 이 날을 추억하고싶어서 사진도 한장 찍어보고 ㅎ_ㅎ ✌ 이번 디저트코스 팝업은 6월까지 진행한다고 하셨고 7월부턴 다른 코스로 바뀌는것 같아요 하루를 달달하게 기념하고 싶으신분들께 추천드리면서 :) ~"
[한남동 디저트] 고든즈 스튜디오 디저트 팝업에 다녀오다 !,"고든즈 디저트 팝업 내가 진짜 애정하는 고든즈 스튜디오에서 디저트 팝업을 한다는 소식을 들었다 ! 내가 지금껏 먹었던 바스크 치즈 케이크 중에 고든즈꺼가 제일 맛있어서 내가 먹으려고, 친구 주려고 몇 번 예약해서 픽업을 갔었었지🏃🏻‍♀️ 고든즈 쿠키도 나온걸 알고는 있었는데 항상 바치케만 먹다가 이번에 디저트 팝업을 한다고 해서 냉큼! (아니 사실 냉큼은 아니긴한데...) 다녀왔다. ㅋㅋㅋ왜 냉큼이 아니냐면,, 나랑 모씨는 디저트를 많이는 못 먹는 스타일이라 작년 말에 파르나스에서 애프터눈티 먹고 속이 매우 니글거렸기 때문...😖 우리가 잘 먹을 수 있을까 고민을 하느라고 냉큼 결정하진 못했다. 조금 고민하다가 결국 예약하고 왔다 히히 고든즈니까! 맛있을테니까! 새로운 디저트가 기대가 되니까! 고든즈라서 안 올 수가 없었다. 2층으로 올라오니까 갈아신을 슬리퍼가 준비되어 있었다. 토요일, 일요일 1,2부로 나눠서 준비가 되는데 우리는 일요일 2부에 왔다 오랜만이야 고든즈 ! 예전에 픽업하러 왔을 때는 딱 픽업만 할 수 있는 공간이었었는데 디저트 팝업을 하면서 앉을 자리가 생겼다. 한 타임에 6명 정원이고 시간이 되니까 오늘의 디저트에 대해서 설명을 해주셨다. 그리고 중간에 주류가 포함이 되어있는데 미리 말씀 드리면 빼주신다. 우리는 차를 가지고 와서 미리 말씀 드렸다! 아아 등장🖤 아아는 진짜 연하면서 향이 좋아서 시원하게 마시기 넘 좋았다. 아아 홀짝거리면서 앞에서 준비하고 계신 첫번째 메뉴 엿보기👀 내 자리가 딱 엿보기 좋은 자리여서 처음엔 엿보다가 나중엔 대놓고 사진 찍고 동영상 찍고 그랬다ㅋㅋㅋㅋㅋ 쿠키고든 플래터 파스타랄리 / 제철 과일 쿠키케이크 / 호밀 초코 쿠키 / 제철 과일 아니 진짜 너무 예쁘네................ 예뻐서 못 먹겠다 정말............. 그래놓고 다 먹었지만 ㅎ 파스타랄리는 매콤한 쿠키이다. 처음에는 몰랐는데 입 안에서 매콤함이 싹 퍼짐 중간에 노란색 점 점 찍혀있는건 망고 드레싱이라고 설명해주셨다. 이게 진짜 상콤하고 맛있어서 다 찍어먹음ㅋㅋㅋ 제철과일은 메론이었다🍈 마지막 한 입으로 싹 먹으니까 이렇게 입가심이 될 수가 없어~ 플래터 먹으면서 두번째 디저트가 만들어지는거 구경하는데 거의 예술작품이 탄생하는거 같았다. 토마토 바질 파블로바 머랭쿠키, 바질 생크림, 마리네르 토마토, 제철 토마토, 토마토 꿀리, 페타치즈 두번째 디저트가 놓이는 순간 눈사람 마을 같은 느낌이 들었다⛄️ 이건 진짜 먹기가 너무 아까워서 한참 못 먹고 있었다ㅋㅋㅋ 그에 반해 벌써 숟가락에 열심히 담고계신 모씨 ㅎ 이렇게 한 번에 싹 퍼서 먹으면 된다고 알려주셨다. 나는 머랭쿠키와 생크림을 별로 좋아하지 않는 1인이라... 그리고 입에 안 맞는건 억지로 삼키지 못하는 사람이라 걱정을 좀 했는데 나는 두번째가 제일 맛있었다!!!! 모든 것의 조화가 너무 잘 이뤄지고 바질 생크림 진짜 맛있어ㅠㅠ 조금도 안 남기고 싹싹 긁어 먹을 정도로 너무 맛있었다. 행복함을 만끽하며 세번째 디저트 준비되는거 보는중 세번째 디저트는 2년 이상 숙성된 아네호라는 데낄라를 함께 주신다. 처음에 우리는 차 때문에 주류는 못 마신다고 말씀 드려서 향만 맡아볼 수 있도록 작은 잔에 준비해주셨다! 고든즈 안주 덱스터고든 바스크 치즈케이크 / 구제르 / 스모크드 토마토 내 사랑 바치케가 등장했다..!! 모씨도 예전에 내가 사다준 적이 있어서 먹으면서 음~ 이 맛이지 했다 ㅎ 데낄라를 마시지는 못했고 나는 술도 잘 모르지만 디저트를 한 입 먹고 향을 맡았는데 향이 너무 좋았다. 향 맡으라고 주신 데낄라 모씨가 다 마심 ㅋㅋ.. 내 접시랑 모씨 접시랑 달랐는데 둘 다 이뻐서 찍어봄 데낄라잔도 너무 영롱하니 귀엽잖아.....🔮 그 때 마지막 디저트가 준비가 되면서 토치가 나타났다 디저트에 토치라니ㅋㅋㅋ!! 너무 기대중 프로즌 캐리비안 스위스 머랭, 수제 코코넛 파인애플 아이스크림, 럼바바 메뉴 하나 하나가 다 너무 정성스럽게 만들어지는걸 직접 봐서 더 소중하고 먹기 아깝고 그래.... 모씨는 바로 한 입 퍼드심 ㅎㅅㅎ 망가뜨리고 싶지 않았지만 그래도 내가 맛있게 먹어주겠서!!!! 부드러운 머랭과 안에 시원한 아이스림이 너무 잘 어울리면서 마지막에 코에 코코넛향이 싸악 지나가는게 너무 맛있었다🍍🥥 마지막 접시까지 clear~ 난 내가 이렇게 디저트를 싹싹 다 긁어서 잘 먹는 사람인지 몰랐어...ㅎ 맛있는건 ssap 가능!!!! 바치케까지 야무지게 포장해야지이~~~~~~💝 6월 셋째주 주말까지 팝업이 운영되는데 다들 빨리 예약하고 달려가세유!! 👇🏻예약 링크👇🏻 고든즈 : 네이버 방문자리뷰 82 · 블로그리뷰 15 m.place.naver.com GORDONS(고든즈): 덱스터고든/쿠키고든 🍪🎂한남동디저트(@shop.gordons) • Instagram 사진 및 동영상 팔로워 1,675명, 팔로잉 85명, 게시물 270개 - GORDONS(고든즈): 덱스터고든/쿠키고든 🍪🎂한남동디저트(@shop.gordons)님의 Instagram 사진 및 동영상 보기 instagram.com 고든즈 서울특별시 용산구 독서당로14길 43-2 2층 #한남디저트 #고든즈 #고든즈디저트팝업 #바스크치즈케이크"
[한남동 고든즈],[한남동 고든즈] #캐치테이블 또는 #네이버예약 으로 예약 가능 ^^....이거 픽업하느라 지각해서 지민이 개빡침... 근데 이미 늦었는데 어쩔래미~~~~?ㅗㅗㅗㅗ 힛 지각해서 사온 보람이 있는 꾸덕하고 치지치지한 맛 ❤️ 녹차딸기도 있길래 사보았는데 집에 가져가서 잘 묵었닝~~~~?~?~?~? 다음 모임은 언제~~~~~???? 고든즈 서울특별시 용산구 독서당로14길 43-2 2층
잠실 고든즈 팝업스토어 롯데백화점 한남동에서 유명한 치즈케이크,"잠실 롯데백화점에 '고든즈' 팝업스토어가 열렸습니다. 기간은 6월 30일부터 7월 6일까지예요. 딱 일주일이더라고요. 위치는 잠실역 지하 광장 분수대와 이성당 사이에 있는 롯데백화점 입구로 들어가시면 팝업스토어가 바로 보여요. '고든즈'는 바스크 치즈케이크를 파는 곳인데 한남동에서는 유명한 맛집이라고 직원분께서 설명해 주셨어요. 고든즈의 바스크 치즈케이크는 밀가루를 사용하지 않는다고 해요. 필라델피아 치즈를 사용해서 진하고 부드럽게 만드는 치즈케이크래요. 바스크 치즈케이크는 원래 고온에 살짝 구워 탄 듯이 만드는 거라고 해요. 오리지널 말고도 라임모히또, 말차, 솔티드카라멜, 트러플&초콜릿 등의 바스크 치즈케이크가 준비되어 있었어요. 특히 미니 사이즈도 있어서 조금 맛보기 용으로 사보기도 부담 없겠더라고요. 오리지널 미니 사이즈는 11500원이고 다른 종류 미니 사이즈는 13500원이었어요. 기본 사이즈는 오리지널 25000원, 다른 메뉴들은 28000원입니다. 고든즈 치즈케이크에 제철 과일을 함께 올려드려도 좋다고 안내가 되어있어요. 고든즈에서 바스크 치즈케이크 구매하시면 포장해 주시는 상자도 예뻐서 가볍게 선물하기에도 좋겠어요. 잠실 고든즈 팝업스토어에서는 쿠키도 있었어요. 이건 봉투로 포장된 헤이즐넛 쿠키입니다. 제가 갔을 때는 스모어 쿠키, 피넛버터 쿠키, 오트밀 쿠키도 있었어요. 각 4300원이었고, 4개가 들어가는 포장 상자는 따로 1000원이에요. 답례품 쿠키 4종 세트는 9800원이었고, 20개 이상 주문하면 배송비가 무료예요. 바스크 치즈케이크에 비하면 쿠키는 조금 비싸게 느껴지더라고요. 그렇지만 받으면 기분 좋을 선물인 건 확실하니까 답례품으로는 괜찮은 아이디어라고 생각했어요. 팝업스토어 첫날이라서 그런지 시식도 진행하고 있었어요. 그리고 직원분들이 고든즈의 메뉴들에 대해서 정말 열심히 설명해 주시더라고요. 바스크 치즈케이크 식감이 정말 부드럽고 촉촉해요. 다른 치즈케이크보다 더 사르르 녹는 식감이었어요. 그리고 많이 달지 않고 치즈의 고소함도 부담스럽지 않아서 호불호 없이 드실 수 있겠더라고요. 개인적으로는 팝업스토어 흥하셔서 잠실에도 매장 내주셨으면 좋겠다 싶었어요. 부드럽고 고소한 디저트 원하시는 분들에게 고든즈 바스크 치즈케이크 추천드려요! 고든즈 서울특별시 용산구 독서당로14길 43-2 2층"
[한남동 고든즈],[한남동 고든즈] 고든즈 : 네이버 방문자리뷰 79 · 블로그리뷰 14 naver.me 누가 사준 케이크 얻어먹어봤다가 넘흐 맛있어서 담에 또 먹기 위해 기록용으로 네이버 혹은 캐치테이블로 예약하고 바로 픽업ㄱ_ㄱ #바스크치즈케이크 존엄한 맛... 내가 다 먹은 듯...히히.. 한남동 갈 일 있음 꼭 또 무야지 😇 고든즈 서울특별시 용산구 독서당로14길 43-2 2층
