title,content
"[한남동데이트] 아기자기 예쁘고 맛있는 요리 ""소브스한남"" (feat. 키에리)","#한남동맛집 #이테원맛집 #소브스한남 뾰로롱 오늘은 날씨가 너무 좋았던 어느 날 좋아하는 친구와 함께 한 시간을 데꾸왔어요 그나저나 벌써 포스팅이 밀리기 시작하네요ㅠㅎㅎ 요새 많이 바빠서 피곤할 때마다 쪼금씩 작성중이랍니다 소브스 한남 ⭐️⭐️⭐️.🤚 분위기도 좋고 눈도 즐거운 한남동 맛집 가게 앞에 요로코롬 기여운 표지판이 붙어있고~ 가게 앞에 메뉴판이 놓여있어요! 저흰 따로 예약하지 않아서 웨이팅을 잠깐 했기 떄문에 밖에 메뉴 열심히 골라보았답당 물론...! 다 맛나보여섴ㅋㅋㅋㅋ 20분 기다렸는데 20분 내내 리뷰 뒤적이고 열띤 토론했어요 예쁜 내부 모습 테이블이 7개정도 밖에 없는 크지 않은 가게에요! 그래도 햇살이 들어오니까 너무 이쁜 가게였어요♥️ 정갈하게 준비되어있는! 원래 예상 대기시간보다 조금 길어서 사장님께서 서비스로 음료 한캔 주셨어요!! 덕분에 더 추천~~~사장님 체거에여!!!! 시원한 자몽음료 한잔 드링킹하고 메인 메뉴 기다리는 중~ 하...와... 비줠 미쳤죠? 왤케 영롱하지? 이럴 때 좋은 폰으로 바꾼 보람이 있다니까요! 저희가 시킨 메뉴는 스파이스 연어롤 (17.0) 소브스 뇨끼 (16.0) 사장님이 주문한 연어가 양이 부족한 약간 타파스 느낌의 메뉴라 부족할 거라고 하시더라구요 대부분 두명 손님분들이 그래서 3개 메뉴를 시키시는 거 같았습다 끝나고 디저트 먹기로 했기 떄문에 조금만 시킨 것!!! 같이 간 친구가 입이 짧은 편이어도 둘한테 양이 좀 부족하긴 했으니 참고 부탁드려요ㅎㅎ😎 세상 영롱한 이친구는 이 식당의 시그니처 메뉴인 '스파이시 연어롤' 일단 플레이팅 미쳤죠...! 쪼꼬매서 한입 쏙~인 것도 완전 취적이에여💕 앗 너무 현실짤인가요..ㅎㅎ 위에가 연어인 줄 알았는데 위에는 매콤한 사과/배? 절임이 안에 있는 미니 연어김밥~ 한입에 연어 쏙 넘 좋아요>.<♥️ 두번째는 소브스 뇨끼 얘도 참 비줠 맘에 든당😎 전 뇨끼 되게 좋아해서 요새 엄청 자주 먹는거 같아요! 떡같기도 밥같기도 말랑말랑 쫀득쫀득 양념이 잘 스며들면 더 좋아하는~ 친구는 뇨끼가 첨이라고 하는데 다행히 매우 맘에 들어해줬어요~ 소스 맛있어서 싹싹 긁어먹은 건 안 비밀! 스파이스한 메뉴 하나 크리미 메뉴하나는 좋은 조합입니당🔥 뇨끼 해체한 비주엃ㅎㅎㅎㅎ 왜 찍 었는지 모르겠지만 안에 부드럽고 쫀득해서 맛있다는 걸 강조하고 팠나 봅니당ㅎㅎ 0507-1335-0140 주소 서울 용산구 이태원로42길 19 6이태원역 3번 출구에서538m 한강진역, 이태원역에서 찾아오기 편하며 제일기획에서 한강진 방향으로 내려가는 골목에 위치해 있습니다. 영업시간 월요일 11:30 - 15:00 화-금요일 11:30 - 23:00 Break time 15:00~17:00 주말 11:30 - 23:00 Break time 16:00~17:00 소브스 한남 소브스한남 서울특별시 용산구 이태원로42길 19 식사 후에 친구랑 소화시킬 겸 걸어서 이태원역에 있는 키에리까지 갔어요! 랜만에 키에리라 더 반가웠던>.<♥️ 언제 또 오겠어 싶어서 두개나 시켜버린! 네모네모한 친구가 애플크럼블 치즈케이크 동그란 통안에 있는게 코코넛스프레소 치즈케이크 매장 내 취식은 1시간 제한이 있어서 카페에서 먹었습니당 (아...저흰 반정도 먹고 안 먹었는데 원래는 취식이 안된다고 했어요!!ㅠㅠ) 뭐 키에리 이즈 뭔들이지만 치즈케이크 두개 먹으려하니 속이 더부룩하더라구요ㅠㅠㅋㅋㅋㅋ🤣🤣 코코넛에스프레스도 코코넛향이 가득해서 좋았는데 개인적으론 애플 크럼블 사과 큼직큼직 씹히는게 더 취향!! 아무쪼록 아쉬워도 또 가고 싶다는건 안 비밀... 담엔 안 치케도 사야겠어욤😁 오늘 기록 리뷰 여기서 끝!"
"[한남동] 노티드도넛 한남, 남산타워 루프탑 카페 서울루덴스, 이태원 케이크 맛집 키에리","화창 쨍쨍한 날씨에 맞춰 서울의 랜드마크 남산타워를 기가 막히게 볼 수 있는 루프탑 카페, 서울 루덴스에 다녀왔다. 네이버에는 12시 오픈이라고 적혀있는데 실제 오픈 시간은 13시였다!! 오늘 주제는 이태원 빵투어였기 때문에!! 가 장 첫 번째로 노티드도넛 한남에 들렀다. 웨이팅이 있기는 했지만 금방 빠져서 한 10분 정도 기다렸다. 나는 우유 생크림 도넛을 골랐다!!! 그리고 크로플도 너무 맛있어 보여서 티라미슈 크로플도 먹기로 했다. ㅎㅎㅎㅎ 포장도 완전 예쁘게 해주셨다. 광교에서 레몬 크림의 좋지 않은 추억이 있지만,,, 우유 생크림을 다를 것 같아서 신나는 마음으로 사 왔다>_< 러쉬에서 구경도 하고 체험도 하고 ㅋㅋㅋㅋㅋ 어마어마하게 비싼 소품들만 팔았던 소품샵 구경도 하다가 드디어 서울 루덴스에 도착했다!!! 뷰 하나만 보고 찾아왔는데, 정말 뷰가 다했다. ㅋㅋㅋㅋㅋㅋㅋㅋ 아아가 어메이징 하게 비쌌지만,, 이것 또한 뷰값이라고 생각하기로 했다. ㅋㅋㅋㅋㅋㅋㅋㅋㅋㅋ 꺄 정말 마음에 들었다. 근데 갑자기 직원분이 오셔서 외부 음식을 먹으려면 테이블링 만 원을 추가로 지불해야 한다고 말씀하셨다. 조금 많이 당황스러웠다.. 테이블링 비용,, ㅎ,, 만 원,, 안 먹었다!!!!! 아아만 마시고 수다만 왕창 떨다가 나왔다. 자주 가지는 않을 것 같지만 뭐 한 번쯤은 뷰 때문에 가볼 만한 그런 카페다. 근데 인스타에 속지 말자!!! 정말 사진이 다였다. 나는 루프탑이 따로 있을 줄 알았는데,, 그건 아니었고 단층에 야외 확장 공간이 있었다. rooftop은 아니지만,, 뭐 루프탑 뷰이긴 하다. ㅋㅋㅋㅋㅋㅋㅋㅋㅋ 날씨가 정말 다했다. 화창한 한남동을 산책하다가 같이 갔던 칭구가 예전부터 가보고 싶다고 했던 카페가 있어서 들렀다. 그곳은 바로 키에리. 이태원 케이크 맛집으로도 유명했다. 흥미로운 사실은 비건 베이커리라는 사실이었다. 동물성 버터가 아닌 식물성 버터를 사용한다는 점이 과연 맛있을까..?하는 걱정으로 이어졌지만 상대는 빵 잘 알 챙이었기 때문에 그녀만 믿고 따라갔다. 애매한 시간에 갔음에도 불구하고 사람들이 많은 핫한 곳이었다. 키에리에는 정말 맛있는 케이크가 많았다. 그래서 정말이지 한 개만 고르는 것이 너무 어려웠다. ㅠㅠㅠ 근데 신기하게도 약속이나 한거마냥 통했다!!!! 꿀 고구마 치즈케이크로. 크. 솔직히 이건 안 고를 수가 없었다. 건강한 케이크답게 크림은 하나도 달지 않았고 고구마 자체의 맛도 많이 느껴졌다. 건강 건강하다 보니 목이 막힐 수 있었는데 또 그렇지는 않았다. 그리고 케이크 가장 밑부분의 시트가 타르트 식감이라 맛있었다. 나쁘지 않았지만 그렇다고 엄청 엄청 맛있는 건 아니었던,, 그래도 이태원에 왔다면 먹으러 가볼 만한 케이크였다. 노티드 도넛은!! 왜 사진을 안 찍었는지는 모르겠지만 ㅋㅋㅋㅋㅋㅋㅋ 우유 생크림 도넛은 실패할 수 없는 부드러운 크림과 튀긴 도넛의 조화가 잘 이뤄졌고 크로플은!! 티라미슈 크로플은!! 맛있었다!! 크림이 정말 맛있었다. 사실 어쩌면 노티드는 크로플 맛집이었을지도 모른다. 나중에 또 노티드에 가면 나는 크로플을 먹을 것 같다."
한남동 이태원 방문기 : 미니마이즈 / 스틸북스/ 키에리케이크,"오랜만에 서연이랑 만나서 한남동에 다녀왔어요! 한남동 = 부자동네 라는 느뀜쓰 hoxy 나만 ? 하늘이 유독 더 예뻤던 날 한남오거리를 간 이유는 ? 외관도 예쁘다 바로 '미니마이즈' 를 가기 위함이었지 ! 미니마이즈는 빵어니스타 사장님이 내신 베이커리 카페다 당을 낮추고 건강을 좀 더 생각한 식재료를 사용한 빵들과 음료가 있는 곳 *이 근처에 '밥한끼'라고 이영자 맛집이 있는데 미니마이즈를 가게 된다면 그 곳을 다녀오는 것을 추천합니다 (왜냐면 내가 가려고 열심히 서칭했는데 못 갔기 때문에 😭) 외관도 심플하니 예쁘다 :) 유리로 되어있어서 밖에서 내부가 다 보인다 그리고 베이커리류를 지나오면 이렇게 음료 메뉴판과 미니마이즈 명함이 있다 맛있게 생긴 빵들이 정말 많았다 그 중에서도 빨미까레 (추천메뉴) 화이트를 먹어보고 싶었는데 다른 메뉴들도 많아서 못 먹었다 다음엔 꼭 ! 오른쪽 모카빵은 빵어니스타 사장님 남편 분이 좋아하는 빵이라고 인스타에서 봤다 :) 아우어베이커리 더티초코를 연상시키는 이 초코빵도 프랑스산 발로나 다크초콜릿 스틱을 넣고 벨기에산 카카오매스, 카카오버터, 코코넛슈가, 에리스리톨 만으로 직접 만들었다고 한다 (+당함량이 매우 낮은 초콜릿 + 무가당 발로나 카카오파우더 !) 짠 우리가 시킨 메뉴 ! 통밀대파에그크림치즈빵과 통밀크림치즈딸기빵을 고민하다가 대파빵으로 결정 >_< 그리고 커스터드크로핀도 시켰당 38번째 손님이었고 이고 너무 예쁘다 미니마이즈에 대해 설명한 작은 팜플렛 느낌이다 최소한의 설탕을 사용하는 것을 목표로 하다 재료보단 맛을 추구하는 빵집이 아직 많긴 하지만 점차 변화하는 걸 몸소 체험중 ✨ 나갈 때 바닥에 미니마이즈라고 써있는게 마음이 들었다 인테리어에 신경쓴 느낌쓔 서연등장 ✨ 실디과는 달라 역시 하나의 포인트도 놓치지 않는구나 ? 한남동을 돌아다니다가 간 곳 #스틸북스 #서점 카테고리를 잘 나눠놓아서 보고싶은 책을 쉽게 찾을 수 있었다 그동안 서점하고는 뭔가 다른 느낌이랄까 아주 마음에 들었다 :) 사소하지만 쓸모 있는 건강법 이 책 집에 들이고 싶었다 이 책은 나중에 내 아이를 낳게 된다면 읽어주고 싶은 책 헤헤 설정샷 같다 ^_^.. 할말생략 나도 잘 몰랐는데 내가 어떤 분야의 책을 관심있어 하는지 스틸북스에서 찾을 수 있었다 이 책들은 다 읽어보고 싶었어! 1995년은 내가 태어나기 전이지만, 삼풍백화점 사건은 살아가며 종종 들었던 큰 사건이었기에 이 책도 꼭 읽어보고 싶었다 이곳저곳 돌아다니다가 간 키에리 카페! 비건 케이크집으로 유명한 곳이다 #키에리케이크 진짜 비주얼 미쳤어 인스타그램에서만 보던 비주얼을 실물로 확인하다니 ! 드 ! 디! 어 ! 출처 서연 카메라>_< 우리가 시킨건 고구마치즈케이크와 딸기케이크 가격은 있는 편이다 9500씩 그래도 퀄리티가 좋고 건강한 케이크라는 네이밍이 있기에 감수하고 먹을 수 있는 맛이랄까 사진 찍을 때 억지미소 짓는게 익숙한데 케이크를 드니깐 표정이 달라진다 ,, 부담 짤로 마무리 하기 >_< 이태원역 인근에 있어서 거리도 좋고 우리가 방문한 날은 사람도 많지 않았다 한가지 아쉬운 점은 입장시간이 정해져 있다는거! 그 점만 빼면 만족한다 :) 한남역 - 이태원역 - 한강진역 이렇게 주위를 빙빙 돌면 구경할 곳과 맛집 카페도 많지만 사실 홍대 상수 연남 이쪽이 아직까진 부동의 1위 코스다 ❣️ #한남 #한남동 #한남동데이트 #이태원 #한남동카페 #미니마이즈 #미니마이즈카페 #이태원카페 #이태원키에리 #키에리 #이태원케이크 #비건케이크 #스틸북스#한남동서점 #서울데이트"
[한남동] 빵과 브런치! 라라브레드 (+ 키에리),"1월 5일 방문. #키에리 오픈 시간 맞춰 케이크 픽업해야 해서, 이태원 부근에서 약속을 잡았다. 한남동 #라라브레드 에서 만나기로. 쇼케이스에 제품이 남아 있어도 포장용 수량은 따로 있어서 픽업 못할 수 있다. ㅜㅠ 키에리는 웨이팅도 있지만, 가게 영업 스타일이 서두르지 않는 분위기. 1시 정각에 갔지만 픽업해서 나오는 데 30분이 걸렸다. 8피스 구매하러 갔다가 미리 예약하지 않으면 포장 주문은 4피스까지만 가능하다고 거절당했다. 게다가 이미 녹차 케이크는 포장 수량 끝나버려서 당황. 홀케익이나 4피스 이상 구매 시에는 미리 연락해서 예약해야 하는 것 같다. 암튼 결론 '라라브레드'에서 1시 30분에 친구랑 만나기로 했는데 지각ㅜㅠㅠ 여기 외관도 귀여웠는데 다급해서 사진 못 찍었다. 빵만 실컷 찍음. 튜브 형태 잼도 판다. 시식해 보았지만 좀 밋밋해서 내 취향은 아니었음. 빵을 하나 더 드세요. 이미 털린 빵도 있었다 ㅜㅠ 시식용 빵이 넉넉하니 맛보고 고르시오. 난 올리브 빵이랑 앙버터 프레첼이 맛났다! 리얼 고구마도 신기한 맛. 2층 소파 자리 착석. 구매한 빵 늘어놓고! 더블 쉬림프 파스타와 커피도 픽업해온다! 소세지 페스트리 맛나! 먹고 남은 빵을 포장할 비닐이 비치되어 있음. 파스타는 그냥 그랬다. 커피는 1000원에 리필 가능. 구석에 색연필과 칠할 수 있는 엽서도 비치. 애들 데리고 오시는 분들도 많다. 노력의 결과물. 화장실 문은 자개장?! 화장실 작지만 깨끗. 매장 내부! 생각나는 곳 없으면 다시 갈 듯한데 브런치 말고 빵이랑 간단하게 커피 마시러 갈듯. 샌드위치는 먹어볼 생각은 있다. #라라브레드 #이태원 #브런치 #빵 #빵지순례 #한남동 #내평점3.2"
한남동한방통닭 태어나서 처음으로 1인1닭+평일 웨이팅과 포장(ft.키에리),"안녕하세요 쏠트에요!(✿◡‿◡) 자격증 시험을 날려버리고 맞이한 평일은 무거운 책따위 던지고 묵직한 케이크를 먹기 위해 이태원을 다녀왔어요 이태원+케이크 = #키에리 정말 오랜만에 온 #이태원키에리 신메뉴가 나왔었기 때문에 먹어주는 것이 인지상정 역시 기대를 져버리지 않는 키에리 무야호~~ ヽ(✿ﾟ▽ﾟ)ノ 저기 숨어있는 저 아인 누구냐구요? 선물받은 #쿼카 랍니다🤎비오는 날 이 아일 굳이 제게 너무 사주고싶었다며 사러갔다온 솔자친구 ㅋㅋㅋㅋㅋㅋㅋㅋ 키에리 먹고 하도 돌아댕겨서 소화는 너무 잘되었지만 이영자님의 소화제를 먹으러 가기로 탕탕탕 이영자님 소화제를 모르시는 분은 없을거라 믿고 싶지만 행여나 있으시다면 오늘부터 알면 돼쥬!! 똑띠 기억하십쇼잉! 🍗한남동 한방통닭🍗 참고로 저는 평일에 다녀왔어요 5시 정도쯤 #한남동한방통닭 앞을 지나쳐가는데 이미 사람들이 봉다리를 주고받고 있더라구요 부지런히 포장해가시는 분들 많데요 그것도 한, 두 마리도 아니고 세, 네봉지씩 들고 가심 ※한남동 한방통닭 포장※ 평일엔 포장 예약 가능 주말(일요일 휴업)엔 포장 예약 불가능 전화로 포장 예약이 가능하다고 하니 포장하실 분들은 미리 예약하고 오시는걸 추천드려요 예약하지 않고 포장만 해가려고 해도 웨이팅은 해야한다는 점 참고하세요!!! 그래도 5시는 너무 이른 것 같아서 6시 15분에 다시 왔어요 아니나 다를까 이미 만석이고 웨이팅을 해야했죵 웨이팅 리스트에 전화번호를 적는데 자기 순번이 되면 전화를 해주시기 때문에 굳이 앞에서 기다릴 필요가 없어요 한남동 한방통닭은 딱 한남동 여기 하나밖에 없데요 워낙 잘 나가다보니 막 사칭하는 곳들이 있나봐요! 앞으로 나란히 한 채 돌아가는 통닭들 불쌍하지만 그래도 맛있어 보이는 것을 우짜노 어쩜 저렇게 윤기가 좌르르 흐를까나 사실 저 이날 전기통닭구이? 여튼 이거 태어나서 27년 만에 처음 먹어보는 거였어요,,,┌( ಠ_ಠ)┘ 어린시절 한 번 쯤은 트럭에서 파는 통닭구이 사먹었을 법도 한데 저희 집은 안사먹,,,,,,ㅠㅠ 평일 저녁 50분 웨이팅하고 입성! 아무래도 딱 저녁시간이다 보니 빠질 때 한 번에 우르르 빠졌어요:) 내부 벽이 온통 사인들로 덮여있는데 정용진 회장님 real 찐단골이신가바여 사진이 여기도 저기도 붙어있어요 ㅋㅋㅋㅋㅋㅋㅋㅋㅋ 내부는 좁은 것 같으면서 또 그렇게 좁진 않은 거 같고? ㅋㅋㅋㅋㅋ 술집이다 보니 시끄럽긴 하지만 테이블 수가 많지 않아서 편하게 먹을 수 있어서 굳굳 출처 :: 네이버 이미지 한남동한방통닭 메뉴판이니 참고하세요:) 대부분 겨자소스랑 김치가 그리 찰떡궁합이라고 하시던데 (사전조사가 철저한 편) 한남동 한방통닭 1마리 18,000원 앉으면 통닭 나오는 것은 한 순 간 태어나서 통닭구이를 처음 먹어본 날이기도 하지만 처음으로 1인 1닭 해본 날이기도 해요(*/ω＼*) 후기들을 찾아보니 한 마리가 크지 않다는 말이 많아서 평소 1인 1닭을 하는 솔자친구를 생각해 2마리 시켰어요 근데 갠적으로 저는 그렇게 작게 느껴지진 않았어요 하지만 둘이서 한 마리만 시키면 확실히 부족할 것 같긴 하더라구요 (참고로 메뉴에 닭똥집도 있움!) 기름기가 쪽 빠지고 닭껍질은 살에 쬭!하고 달라붙어서 질기면서 바삭할 듯한 비주얼 아직 뚜껑을 까보지도 않았지만 보여지는 속살은 옴총옴총 도톰하고 안에 찰밥ㄲㅏ지 보임 연기 폴폴폴 닭아 미얀해 가를 수 밖에 없다(˘･_･˘) ㅋㅋㅋㅋㅋㅋ이모티콘에서 보이는 듯한 정직한 닭다리의 모습ㅋㅋㅋㅋㅋㅋ 둘이서 곱게 누워있네ㅋㅋㅋㅋㅋ 맥주 먹으면 배부르다면서 고민하다가 결국엔 시키신 솔자친구 답정너였으면서 너도 나 닮아서 고민하는 척만 하는게지? 닭다리 이리온 커뭔!!!! 겨자랑 머스타드소르를 섞은 듯한 맛인데 여튼 JMT 저 원래 치킨무 잘 안먹는데 겨자소스+치킨무 조합 아주 기똥차요👍추천👍 양념소스도 이렇게 찍어먹으니까 옛날에 후라이드치킨 시켜먹으면 이런 양념 소스 같이 와서 많이 찍어먹었는데 옛날 생각이 새록새록 삼계탕처럼 찰밥이 뙇..!ಠ_ಠ 괜히 맛만 있다고 18,000원인게 아니었네 찰밥은 찰기가 느껴지면서 쫀득쫀득하고 안에 대추, 삼, 은행까지 들어서 이건 소화제를 떠나 자양강장제인걸요??? 보이기엔 무척이나 퍽퍽해 보이지만 전혀요,,, 솔자친구랑 둘이서 얼마나 감탄하면서 먹었게요ㅋㅋ 어느 부위라고 해서 퍽퍽하고 어느 부위라고 해서 야들야들하고 이런거 따질 생각도 안나요 이 껍질 놓칠 수 없어서 껍질은 다 뜯어먹고 왔어요 껍질이 기가 멕히고 코가 멕히고~ 이 맛에 통닭구이를 먹는구나 처음 알았다니까요🧡 하루에 도대체 몇 마리의 닭들이 나가는지 먹는 내내 궁금할 정도로 장사가 허벌나게 잘 되는 한남동 한방통닭 잘되는데엔 그만한 이유가 있는 것 남녀노소 가리지 않고 추천하는 찐맛집 탕탕탕! 한남동한방통닭 서울특별시 용산구 대사관로34길 38 【 한남동한방통닭 】 영업시간 매일 16:50 - 02:00 (일요일 휴무) 전화번호 02-797-8677 #한남동한방통닭 #이영자한방통닭 #한남동맛집 #한남동한방통닭포장"
[한남동 맛집] 다운타우너 수제버거 쫀맛 (+키에리),"2021.06.16 와 너무 오래되서 기억도 안난다.. 대충써야지 아마 이날 매우 더웠던걸로 기억 뭘 쓰려해도 이날 기억이안나냐 ㅋㅋㅋㅋ 요기는 #다운타우너 !! 역시 웨이팅이 있었다 밖에서 먹기엔 너무 더울거같아서 직원분께 좀더 기다리겠다고 함 근데 밖에 선풍기 있어서 좋더라,,, 이래야 웨이팅할 맛 나지ㅠㅠㅠ 저 사실 아보카도 안좋아해여 진짜 목숨걸고 시킨 햄버거임 그리고 다음에 또온다면 절대 치즈프라이 안먹을것 아보카도랑 해쉬브라운버거였나? 역시 햄버거는 수제로 먹어야한다.. 입에 넣자마자 여긴 인정 진짜 맛있다ㅠㅠㅠ 치즈프라이는 느끼해서 많이 못먹겠다 근데 다 먹었다 ㅎ 다운타우너 한남 서울특별시 용산구 대사관로5길 12 1층 다운타우너 한남점 다먹고 노티드나 갈까 했는데 다품절 ㅋ 실화냐 요긴 길가다가 그냥 귀엽길래 노티드 가는건 포기하고 그러면 키에리가자! 해서 갔는데 마감이라 포장밖에 안된다그래서 울면서 나옴 그러다가 고양이를 보고 어어엄청 이쁜하늘도 보고 그러다 결심함 키에리를 포장해서 다른 곳으로가서 먹기로 결국 다시 키에리 키에리를 겟 해서 나왔습니다 와 뭐먹었는지도 기억이안난다 팥이랑 쑥이 합쳐진거였는데,, 다음엔 꼭 블로그 바로바로 써야지 정말 이번껀 허접한 리뷰였다 양한샘(@hansaemme) • Instagram 사진 및 동영상 팔로워 402명, 팔로잉 291명, 게시물 39개 - 양한샘(@hansaemme)님의 Instagram 사진 및 동영상 보기 www.instagram.com"
