title,content
"2020.07.15::오늘 밖에 못 나간 그대, 불쌍해요(한남동 위클리캐비닛, 컨시더, 이태원, 키에리, etc.)","또 새벽까지 뒹굴거리다가 늦잠 잤다... 게다가 아침 준비하는데도 시간이 꽤 걸림 한 40분? 이것만 준비하는데 시간이 왜 그렇게나 많이 걸리는거죠 아침 준비하는 동안 시간이 훌쩍 지나 브런치가 되어버린 나의 첫 끼니 사실 오늘 아침의 메뉴는 간단하다 우프의 깜빠뉴바게트 2조각과 복숭아 리코타치즈 이렇게 한 세트. 그리고 스크램블 에그, 그린올리브 토마토 오이 복숭아 샐러드 드레싱은 올리브유와 화이트와인비니거 소금, 후추. 요리학원 다닐 때도 내가 제일 늦게 마쳤는데 집에서도 매한가지다. 그냥 느긋하다 ㅋㅋㅋㅋㅋ 아침을 또 거하게 먹은 후 (사실 난 언제나 아침을 거하게 먹을 생각이 없다. 그러나 어느새 정신을 차려보면 한가득 준비되어있는 아침식사) 우유가 잔에 남았다는 핑계로 내가 만들어놓은 바나나브레드 한 조각 꺼내어서 먹고. 투닥투닥 갈 준비를 한 30분 정도하고 드디어 한남동으로 출발! 근데 날씨가 진짜 미쳤다 일단 이게 대한민국 7월 중순의 날씨라니..! 하늘이 이렇게 파랗다니! 게다가 그렇게 파란 날 중에서 내가 맘대로 움직일 수 있는 날은 지금까지 얼마나 됐던가. 지금까지의 여름은 언제나 학원 에어컨 밑에서 흰색 벽과 좁디좁은 나무패턴의 책상을 보는 게 전부였는데 말이다. 단순히 아파트 현관문을 나선 것 뿐인데 벌써부터 가슴이 쿵쾅두근거렸다 그리고 하늘이 이렇게 맑아서야 덥지 않을까..? 걱정했지만 그건 기우일뿐 산뜻한 바람이 하늘의 청명함을 옮겨주는 듯했다 모든 게 다 아름다워보이는 푸른 여름날 여름의 분위기를 사랑해 아침점심저녁 모든 시간의 여름을 사랑해 위클리캐비닛 서울특별시 용산구 한남동 257-10 한강빌딩 102호 이 모든 것의 시작이었던 우나스의 인스타 사실 한남동에 갈 계획이 저번주까진 전혀 없었다. 그러나 오랜만에 이젠 클래스만 진행하는 우나스 인스타나 들어갈까? 해서 들어갔더니 우나스 파운드 케이크 팝업! 작년에 재수하느라 우나스도 못 가고 닭 쫓던 개 지붕쳐다보는 마냥 허망했다.. 그래서 꼭 한 번 먹어보리! 생각하고 있었다. 진행되는 konsider 팝업스토어? 프로젝트?포스터. 라인업은 뭐..ㅋㅋㅋ 내가 아는 것만 얘기해보자면 우나스 껠끄쇼즈 젠제로 밀라논나 고도 등등 한남동엔 1시 30분 경 도착했고 열심히 맑고 푸른 하늘을 만끽하며 한 2바퀴? 정도 돈 다음에 위클리캐비닛으로 향했다. Next image 그러나 사람은 꽤..많았다. 내 앞으로 한 6팀?정도 웨이팅. 내 차례가 오기까지 한 40분 정도 기다렸던 것 같다. 티켓은 A-1, A-2등등이 있었다. A-1이 기본티켓으로 12,000원. (디저트1+음료1) 뭐 디저트 옵션은 5,000원짜리가 있고 8,000원 짜리도 있고 뭐..하여튼 설명은 길었다. 서비스를 받는 사람 입장에선 가격 설명표를 판매자의 방향이 아닌 고객의 방향으로 돌려주면 참 좋았을텐데 싶었다. 말은 계속 하는데 머릿속에는 하나도 안 들어오고. 첫날의 어수선함이었던걸까? 현금과 계좌이체만 가능한 걸 봐선.. 무슨 의도인진 알겠으나 불편하다. 매우. B는 젠제로 젤라또+고도 크럼블로 9,000원이었다. 그 당시, 아! 9,000원 현금 없는데! 하며 아차차 싶었는데 결과적으론 다행이었다. 내 앞 테이블 팀이 젤라또 시켰는데 사이즈 보고 잉?하는 표정을 봤다. 젠제로가 5,000원이고 크럼블과 콩피츄르를 포함해서 9000원이라는 것인가? 9,000원을 주고 먹을 건 아니라는 생각이 들었다.ㅎㅎ 그리고 음료는 커피, 티, 그리고 무엇(사과주스..였나..??) 이 있었는데 나는 티를 주문했다. 티는 A.C 퍼치스 핸들사의 루이보스 바닐라, SEA BREEZE, 얼그레이 이렇게 3종류가 있었는데 이 때 햇볕이 쨍쨍 내리쬐는 한낮에 한남동 2바퀴 돌고 또 웨이팅 40분 동안이나 기다리며 체력적으로 지쳐있는 상태라 제일 상큼한 향을 가진 (시향 가능) SEA BREEZE를 택했다. 그리고 신기했던 점은 여기 운영진과 손님이 서로 아는 경우도 있었다. 사람들 옷차림도 다 비슷비슷했다. 여자는 요즘 유행하는 스타일의 검정색 바지등 깔끔한 옷차림에 남자는 다 검정색 펑퍼짐 스타일.. 인스타그램용 옷 쇼핑몰에서 흔히 볼 수 있을 법한 그런.. 전체적인 분위기가 내겐 익숙치 않았다. 언제나 사람없는 고즈넉한 곳을 찾아다니고 있던 나여서. 그 때 내 심정은 도시의 풍경에 적응하지 못하는 수능문학 작품 속 주인공과 같았다. 인위적인 한가함의 모습 친구한테 카톡보내서 한남동 같이 갈까? 하려고 했는데 친구 안 데려오길 잘했다는 생각이 들었다. 만약 내가 권해서 같이 갔다면 친구가 1주일간 내 카톡 씹어도 할 말 없음.. 디저트 목록 오늘 내가 시킨 디저트는 UNAS의 유자 치즈 크림 프로스팅과 보늬밤과 함께하는 말차 파운드와 SEA BREEZE. 향이 제일 상큼향긋해서 골랐건만 미스매치였다. 파운드와는 커피가 더 잘 어울릴 듯했다. 쌉싸름함이 필요한 파운드여서. 그거지. 말차와 같이 차분한 애는 그와 비슷한 조용하고 무거운 분위기의 친구가 필요한데 맞지 않는 발랄한 애가 주위에서 방방거리는 꼴. 그게 오늘 내 디저트의 조화였다. Next image 말차파운드 위엔 크림치즈고 그 사이사이에 유자필링이 자리잡고 있다. 파운드 자체 식감은 내가 저번에 먹은 오흐뒤구떼가 더 좋았다. 나는 쫀쫀한 식감의 파운드를 좋아하기 때문이다. (쫀쫀한 걸 좋아한다면 카카오 아이리쉬 기모브 파운드가 더 나았을지도) 치즈 형태는 겉면의 화이트초콜렛(?)이 잡아주고 있다. 이 부분에서 느끼할 수도 있겠지만 유자향이 이를 잡아준다. 파운드는 계속 먹어도 퍽퍽.. 쪼매..내 입맛 기준으론 많이 퍽퍽했다. 오늘 우나스만 보고 온 것이니 우나스의 맛을 느꼈다는 것에 의의두기. 다양한 사람들이 모인 이 곳 위클리 캐비닛. 먹으면서 그냥 아~차라리 근처 세시셀라에서 당근케이크나 먹을 걸~하는 생각이 들었다. 거기서 8,000원? 8,800원으로 맛난 당근케이크를 먹을 수 있는데! 12,000원에 비해 좀 아쉽다? 하는 생각이 들었다. [오늘의 교훈] 디저트를 다양하게 모아놓은 팝업스토어 +인스타 감성 은 피하자. 답이 없다. 이 팝업스토어가 한 달 유지가 될까? 하는 의문을 품은 채 (유지는 되는데 간 사람은 두 번 다신 안 갈 듯) 밖을 나와 하늘을 보니 다 먹고 나와도 하늘은 쾌청했다. 근처 돌아다니기 다시 시작 그냥 막 찍어도 되는 날씨 친구랑 한강조깅하면서 걔는 한남동에서 나는 동부이촌동에서 사는 꿈을 꼭 이루자는 다짐을 했는데ㅋㅋㅋㅋ 우리 꼭 그 꿈 이루자 으흑흑 쭉쭉 가다보니 어, 여기 좀 집이 괜찮다? 싶었다. 알고보니 한남 더 힐. 좋네 좋아 쭉쭉 가다보니 오지힐 주택 하나가 다 디저트 카페다. 바깥 테라스에서 먹어도 괜찮을 것 같다. Next image 오지힐의 디저트 목록(사실 이것말고 더 있음) 동생이 퐁신퐁신한 슈크림이 잔뜩 들어간 디저트를 원했는데 여기선 안 보였네ㅠㅠ 다음번에 다시 와서여기 케이크 한 조각 맛 본 후 맛나면 모든 종류를 섭렵해보기로. 담번을 기약하며. 나도 지인들과 디저트 뽀개기하며 놀고싶어 어디없나요 그런 지인 하늘을 바라보며. 사실 내가 생각한 한남동 분위기와는 좀 달랐다. 난 한적한 부촌 정도를 떠올렸는데 어딜가나 사람 많아.. 조용하게 동네산책을 해보려고 했는데 의도완 다르게 인스타 피드 한가운데에 온 것 같았다. 그렇게 갑작스럽게 도시에 살고있건만 도시부적응자처럼 되어버렸다. 그래서 이상의 「날개」가 떠올랐다. 도시에 대해 느끼는 전체적인 분위기가 비슷하다고 생각했기 때문이다. 하지만, 나는 수능 공부하며 「날개」의 일부만 배워서 정말 내가 느꼈던 「날개」와 그 작품의 전체적인 내용이 같을까? 하는 의문이 들었다. 그래서 구글신에 이상, 「날개」, 도시, 부정적 이라고 검색했더니 <날개>에 나타난 도시의 아비투스와 내·외면적 풍경 이 나왔다. 이상이 동경하던 세계는 개성이 발화된 도시문명이었으며 세련된 도회지의 센슈얼한 향기의 공간이었다. 그러나 그가 체험한 도시는 기형적인 식민 자본주의 사회였으며 얼룩진 도회지의 아비투스가 식민지 시대상황과 긴밀하게 조응관계를 함축하고 있는 곳이었다. 김정희, 「<날개>에 나타난 도시의 아비투스와 내·외면적 풍경」, 2010. 나는 도시의 화려하고 번잡스러운 모습을 싫어해서 도시 속 고즈넉한 곳을 찾아다니는데 이상은 세련되고 센슈얼한 곳을 동경했으니 약간 결이 다르다. 따라서 도시에 대해 내가 느끼는 기분과 이상이 느끼는 기분은 다르다. 그러나 수확은 의외의 곳에서 나타났다. '플라뇌르(flâneur)'라는 단어를 알게된 것. '도시의 거리 산책자'라는 의미로 프랑스어 사전은 '한가롭게 거니는 사람'으로 해석한다. 딱 나를 표현하기 적합한 단어를 찾아낸 것이다. 내 삶의 낙 중 하나는 아무 목적없이 그저 한가롭게 도시를 돌아다니며 사람들을 관찰하고 마음가는대로 가게에 들어가고 가끔씩은 하늘도 바라보며 주변 건물, 식물, 구름을 같이 보는 것이다. 핸드폰은 잠시 꺼두고 오로지 내 감을 믿으며 목적지 없이 주변을 거닐며 그 여정, 과정을 즐긴다. 이집트 대사관 이와 관련해 보그 코리아에서 내 마음에 쏙 드는 구절이 있었다. 에르메스 아티스틱 디렉터 피에르 알렉시 뒤마가 한 말인데 ""대도시 거리를 걷다 보면, 아무 목적 없이 어슬렁거리는 아트가 실종된 것 같다. 카페타 벤치에 앉아있는 게 제일 멋지다. 모두가 몹시 바쁠 때 아무것도 하지 않으면서 시간이 가는 것만 보고있는 것. 이것이 오늘날 럭셔리다."" 뒤마의 말에 전적으로 공감하는 게 한남동~이태원을 거닐다보니 많은 사람들이 딱 어느 한 지점에 가기 위해 핸드폰만 보면서 주변 풍경을 놓치고 있는 모습을 보았다. 한남동과 이태원이 그 장소 자체로서 의미를 지니는 게 아니라 단순히 어떤 특정한 지점을 포함하는 곳 의 기능만 지니게 된 것이다. 나는 그래서 일부러 다른 동네에 산책을 오거나, 아니 그냥 집을 떠나 자유를 느끼고 싶을 때면 최대한 핸드폰을 가방에 넣어두고 정처없이 돌아다닌다. 아니면, 가고싶은 장소의 위치만 딱 확인한 다음 핸드폰을 넣어두고 즉흥적으로 발이 가는 곳이 그 경로가 되게 한다. 핸드폰이 내 시야를 빼앗아 자유도 뺏어버리지 않게끔. 그런 의미에서 지금까지 핸드폰만 보면서 거리를 거닐던 당신! 핸드폰은 잠시 꺼두고 주변을 보며 길을 헤매는 재미를 되찾아봅시다 그렇게 요즘 사람들이란.. 하는 꼰대같은 생각에 빠져 쭉쭉쭉 걸으니 이태원에 도착. 수많은 케밥집이 보여서 아, 이태원에 왔구나 하는 생각이 들었다. 키에리에 가는 도중 와플대학도 있고 쟈니스덤플링도 있고 면사무소도 있었는데 나중에 다 가보고 싶다! 진짜 키에리 와보고 싶었는데 드디어 와봤다! no버터라는 문구를 보고 에..? 내사랑 버터가 없다구요..? 싶었지만 버터를 사용하지 않는데도 불구하고 인기가 많은 건 맛이 보장되어 있겠지~라는 생각에 동생에게 전화를 걸었다. 내가 우리집 디저트 셔틀이다 물론 자발적이어서 별 불만은 없다ㅋㅋㅋㅋ 동생은 쉬폰 케이크 또는 크림이 잔뜩 들어간 케이크를 원했다. 그러면서 단호박, 고구마, 당근 같은 건 싫어하니.. 그리고 포장불가인 디저트들도 있어서 오늘의 픽업 디저트는 얼그레이 케이크가 되겠다 땅땅!! 일단 저 시트 사이의 투박한 크림이 마음에 들었다. 인간적으로 보여 얼그레이는 나도 좋아하는 것이니 내일 아침에 같이 먹기로 동생과 협의봤다. 다음번엔 살구&살구콤포트 치즈케이크도 먹어보고 싶다 살구 디저트 제대로 즐기고 싶어~~~~ 그렇게 디저트 픽업까지 해서 집에 오니 14,000보가 찍혀 있었다ㅋㅋㅋㅋ 그리고 그 다음날은 초복이라 진짜 복날에 지친 강아지처럼 추욱 쳐져 있었다. (이 말은 우리 동생이 내게 한 말이었다) 날 좋을 때 이렇게 마음껏 돌아다니고 디저트까지 사고 행복했다!! 다음주는 성북동과 선정릉입니다~"
2021.04. 이태원 키에리 한남동 디저트 카페 케이크 추천 #내돈내산,"키에리 서울특별시 용산구 이태원로26길 16-8 1층 영업시간 매일 13:00 ~ 20:00 코로나 아니여도 4인 안돼요 시끄러우니까 3인까지만 돼요 키에리는 이태원의 대표적인 디저트 카페입니다 날이 좋았던 일요일에는 어김없이 대기가 있는 곳이에요 여기 안내문 보듯이 코로나 방역을 철저히 하려고 정말 노력하고 윗층은 주거생활 공간이기 때문에 조용히 영업하기 위해 노력하고있는거 같아요 코로나 때문에 4인이상 집합금지이지만 여긴 원래 3인까지만 가능한 곳입니다 공간이 생각보다 협소해요 그래서 포장 손님아니면 꽤 오래 기다려야 하는것 같아요 이런식으로 케익 이외 스콘과 에그타르트 종류가 비치되어있습니다 냉장고케이스에는 메인인 케이크가 있는데요 눌러서 보시면 가격이 보일거에요 9,500원 정도로 가격이 상당해요 저는 코코넛에스프레소치즈케익과 얼그레이 스콘을 구매했습니다 스콘과 케익 보관 방법도 같이 주시네요 생각보다 맛이.....음... 추천하긴 그렇네요 #내돈내산 이니까 이런 말 할 수 있겠죠? 코코넛 과자처럼 위에 올려있는 과육 부분이 좀 더 바삭하면 좋을 거 같은데 이건 너무 질긴 느낌... 기대가 크고 가격도 쎄서 실망도 큰거 같습니다 얼그레이 스콘 역시 뭔가 비건 위한 노유제품 빵 처럼 퍽퍽 ㅠ.ㅠ 인기 엄청 많은 곳인데 왜 맛은 기대이하일까요 ㅠ.ㅠ 그래도 사람은 참 많더라구요 이태원 나들이 카페 #키에라 리뷰 끝 뿅!! #이태원카페 #이태원케이크 #한남동케이크 #카페키에라 #이캐원키에라 #코코넛케이크 #이태원얼그레이스콘"
"2021.06. @약수 오버트서울, 합정 카페 컨택트, 이태원 키에리, 한남동 오지힐","#오버트서울 요즘 날이 흐리다, 조금 갰다가 난리도 아니다. 이제 우리나라도 기후 변화때문에 동남아 스콜 같은 국지성 호우가 잦을 거라고 하더니 그래서 그런지 소나기 소식도 잦다. 안그래도 코로나때문에 마스크 안에 습기 차는데 여름 습기에, 비 오는 날의 습기까지 더해지면 찝찝하다는 말로 부족한 습함. 약수 오버트서울은 시원한 통창으로 꾸며진 카페이다. 어디를 갈지 모르겠는데, 집에 있기는 싫고 버스로 한방에 갈 수 있는 역에 약수역이 있었다. 안암 살 때부터 환승도 많이 하고, 그리 멀지 않은 동네라 심리적 거리감이 멀지 않았던 약수였지만 막상 그 곳에 내려 카페를 가본 건 처음. 젊은이들이 나처럼 책도 읽고, 노트북도 하는 카페였다. 창밖으로도 대학생처럼 보이는 젊은이들이 걸어다니는 게 보였다. 어디로 향하고 있는 건지는 모르겠지만. 아인슈페너 크림이 아주 두껍... 커피 양 어마무시하다. 혜자. 이런 카페 요즘 찾기 쉽지 않은데. 에그타르트는 굳이 안 시켜도 됐었는데... 06.19. 달렸다 오랜만에. 원래도 러닝머신에서 러닝하던 타입이라, 밖에서 달리는 건 꽤나 힘든 일. 걷뛰 걷뛰 인터벌 러닝했음. 어디로 가야할지 몰라 정처없이 뛰다가 여의도 한강공원까진 가보자 해서 갔는데 샛강 정도인지 아마 초입이겠지, 찍고 바로 돌아감. 어떤 쪼마난 강아지를 자전거에 태운 할아버지가 계셨는데 내가 지나칠 때도 쪼매니가 깽꺵 짖더니 다시 돌아가면서 마주칠 때도 깽꺵 짖어서 할아버지가 때찌했다. 갱얼쥐들,, 무섭다. 최근 무서운 뉴스들도 많았어서. 열 오른 피부를 위해 마스크팩도 겟... #101마리달마시안 크루엘라 보기 전에 예습하는 마음가짐으로 101마리 달마시안을 복습. 어릴 때 막내고모 집 가서 바닐라 아이스크림에 초코 시럽 뿌려 먹으면서 보던 기억이 있는데... 어릴 땐 공주 이야기만 좋아하는 아이였어서 동물을 미친 듯이 사랑하는 아이도 아니었고 별 감흥 없었다. 초코 시럽이 너무 맛있었을 뿐. 통째로 들이키지 못하니까 아쉬웠을 뿐. 그 와중에도 크루엘라 라는 악녀는 무서웠어. 모델 송경아 보면 크루엘라 기억 나는데,, 멋진 광대와 스키니한 몸매, 멋진 차 실사영화에서 그녀의 꿈이 패션 디자인으로 설정됐는지 이해 가는 부분. #합정컨택트 디제이가 음악 틀어주기도 한다던 카페 컨택트. 저번에 들렸을 때는 만석이라 자리 없었는데... 알라딘 중고 서점에서 구매했다. 꿀... 송씨가 손민수했다던 머쉬룸 조명 특정 시간이 되면 곳곳에 틀어주러 다니심. 그게 더 귀여움. 전날 야심차게 외출했지만, 기분도, 상황도 야심차게 나간 바이브를 맞추지 못했다. 역시 극한의 재미는 하늘이 점지해주는 날이 있다. 즐겁지 않았단 말은 아니고. #키에리 디저트 가게를 준비하는 큰지를 위해서 나도 오랜만에 가보는 키에리. 얼그레이 치즈케이크. 얼그레이 향이 강해서 좋았다. 그리고 키에리는 역시 담백하다. 오랜만에 먹는 할머니 케이크. 너무 부서져서 약간 옛날에 먹었을 때 느꼈던 감동이 없었다. 요즘 형형색색의 케어베어, 저 토끼, 트롤 같은 캐릭터 인형이 너무 귀엽게 느껴진다. 무채색의 코로나 시국이라 그런가. #오지힐 호주식 디저트 카페가 컨셉인 오지힐. 화장실을 가든, 포스터를 보든, 호주 컨셉의 디스플레이가 눈에 띈다. 호주 디저트라고 파블로브라는 걸 먹어 봤는데 머랭쿠키 큰 버전에 과일같은 걸 올린 거라고 큰지가 설명해줬다. 엄.. 내 스타일은 아니었던 걸로 과일이 제일 맛있었다....ㅋㅋㅋㅋㅋㅋㅋㅋㅋㅋ 잘가요."
[이태원 카페] 카페 키에리/한남동카페/수요미식회 맛집/비건케이크/디저트맛집,도이루~ 포스팅이 아주 밀리고 밀렸어요 ㅠㅠ 오늘 소개해드릴 곳은~~ 이태원에 위치한 카페 KYERI !! 골목 안쪽에 있어서 길을 잘 찾아가야해요~ 여기서 사진한장 찍을껄 넘나 후회하능즁이에요ㅠ 입구는 이쪽~ 들어가자마자 디저트들이 반겨주는거 실화인가요 ㅎㅎㅎ 넘나 행보쿠 ㅠㅠ 케잌은 시즌별로 나오는게 다른데 쇼케이스안에 명찰이 있으면 주문할 수 있는 케이쿠라고 합니당~ 저희는 아메리카노 세잔이랑 녹차케이크 시켰어요! 우유와 달걀을 사용해서 건강한 디저트를 만드는 곳이라구 하네욥 •u• 내부는 이렇게 약간 인스타 갬성너낌이에요 ㅋㅋ 웨이팅이 있을때는 이용시간이 두시간으로 제한되는 곳인데 저희가 간 날은 다행히 사람이 별로 없어서 오래 있을 수 있었어요! 제일 좋은건 화장실이 내부에 있어서 깨끗하다는점! 소곤소곤~ 조용히 담소를 나눠요오 사실상 텐션이높은 우리들에겐 불가능..😅 여기서 사진찍어두 잘 나올 것 같아요 ㅎㅎ 가시는 분들은 도전해보세요~ 쨘! 드디어 나온 말차케이쿠와 아메리카노~~ 역시 케이쿠엔 아.아가 진리에요 ㅎㅎ 갬성있게 찍구싶었는데 약간 애매해서 속상 ㅠ 말차케이쿠 진짜 찌-----인하구 맛있어요 녹차 안좋아하시는 분들이 드시기엔 너무 진해서 호불호가 갈릴것같긴하지만!! 저희는 만족❤️ 근데 친구가 약먹어야해서 물있냐고 물어봤는데 물은 사먹어야한다고하네요😢 참고하세요~ 한참 오래 수다떨다가 사진 몇장 건지구 나왔어요 ! 요즘 아주 과제의 노예들이라 다음을 기약하며 빠빠잉😭😭 위치 보실까요?? 키에리 서울특별시 용산구 이태원동 73-7 1층 카페 가기 전엔 아래 링크인 루트에브리데이에서 밥먹었는데 맛있더라구요 ㅎㅎ 추천합니당~~ [한남동맛집]루트에브리데이/샐러드김밥/볼샐러드/스프/토스트/건강한밥상/비건맛집 도이루~~오늘 소개해드릴 곳은!!한남동에 위치한 루트 에브리데이!!ROOT EVERYDAY밖에서부터 ... m.blog.naver.com 오랜만에 이태원 나들이했던 포스팅이에요 요즘 한남동쪽에 확진자가 많이 나와서 당분간 이태원은 못 갈 것 같아용 ㅠㅠㅠㅠ 여러분들도 코로나끝나면 카페 키에리로 나들이 어떠신가요오 ㅎㅎ 그럼 다음 포스팅에서 만나요~ 안녕! #이태원맛집 #이태원카페 #이태원디저트 #이태원감성카페 #이태원비건디저트 #한남동맛집 #한남동카페 #한남동디저트 #한남동감성카페 #한남동비건디저트 #서이추
"이태원 한남동 맛집 _ 없어진 가게들 feat. 키에리, 민혁이네 외국포차",언제나 와도 좋은 한남동 :) 늦게서야 올리는데 지금은 없어진... 없어져버림.... 한남동 분짜라붐 웨이팅 엄청 해서 들어왔었눈데 이제는 지점이 너무 많이 생겨서 인지 망했나바아 ㅠㅠ 마늘 볶음밥 맛났눈디.... 모닝글로리는 그냥 모닝글로리 다 깔꿈하고 챱챱 셋이서와서 기다린만큼 싹싹 왕창 먹움 비이커 입구에 있던 팝업 아이스크림 가게에서 후식을 챱챱하구 비이커 한남 플래그십 스토어 서울특별시 용산구 한남동 738-36 2차 후식은 항상 키에리에서 ㅋㅋㅋㅋ 건강하면서 달콤한 좋아하는 케익집 여전히 줄서서 먹눈댜.... 키에리 서울특별시 용산구 이태원동 73-7 1층 무슨 새우 벌집 퐁듀를 먹어보자며 캐주얼한듯한 포장마차? 분위기는 또 펍 같은데 와인도 파는 곳으로 저녁 먹으러~ 가볍게 불금 보내기 좋은 느낌! 민혁이네 외국포차 이태원점 서울특별시 용산구 이태원동 454-1 1층 하지만 역시나 웨이팅 그래서 사진찍고 놀기 여기두 프랑스 음식점 루틴 옆에 있던 작은 가게인데 이제 없어진것 같......음 찍어 놓은 사진이 아까워서 올리긴 하눈데 ㅎㅎㅎ 귀엽고 예뻤는데 ㅠㅜ 왜 없어졌을까나아 Sunday Pale 을 처음으로 맛봤던 곳인데 ㅠㅠ 음식도 나쁘진 않았지만.... 다시 갈정도는 아니긴했따 하하 여기두 없어졌나부다 ㅋㅋㅋㅋㅋㅋㅋ 한남동 순환률이 장난아니구나아...... 그래도 내 추억이 담긴 장소니까 업로드 뿅
