title,content
[한남동/용산] 한남작업실 / 이태리국시 / 쏠티캐빈화이트,"이번주 토요일에는 #한남동 방문했어요~! #한남작업실 입구에서 사진찍어봤어요~!! 여기는 커피잔이 너무 이쁘더라구요!! 예뻐서 찍어봄 50m © NAVER Corp. 한남작업실 서울특별시 용산구 이태원로55나길 7 1층 한남작업실 그리고 저녁먹으러 #이태리국시 갔어요 가장동양적인파스타 라고 하던데 정말 그렇더라구요!! 전체적으로 약간 음식이 달달했지만? 그래도 평타이상이었어요!! 회사근처라 담에는 회사친구들이랑 와바야겠어요~!ㅋㅋ 50m © NAVER Corp. 이태리국시 한남 서울특별시 용산구 이태원로 234 2층 예약 일요일에는 #용산 #쏠티캐빈화이트 용리단길점을 다녀왔어요~! 지하1층부터 2층까지 사용 할 수 있는 대형카페더라구요~! 사람없는 틈을 타서 사진찍어봤어요 ㅋㅋㅋㅋㅋ 알찬주말 끝 쏠티캐빈 화이트 용리단길점 서울특별시 용산구 한강대로40길 9 1층, 2층 쏠티캐빈 화이트 용리단길점"
"한남동 카페, 한남작업실","@ 한남 작업실 한강진에서 이태원 가는 방향으로, 골목골목 들어가 만날 수 있는 카페. 몇년전까지만해도 이 부근에 별것도 없었는데 최근에 카페며 편집샵이고 많이도 생겼다. 카페 두탕뛰고 이래저래 구경도 할 수 있는 곳이라 조으네. - 주택문같이 생긴 입구 지나 계단길 올라가면 2층에 위치 해 있는 한남동 카페, 한남작업실. 야외테라스 자리도 있고 꽤 예쁜데 요즘같은 날씨에는 더워서 패스... 음료값은 6-8천원선인데 쪼고만 디저트류가 꽤 비싸다. 9천원 정도. 직접 만드는 것도 아닌 것 같은데 왜때문에 비싼건지. 어디 유명한 곳에서 가져온다는 말이라도 쓰여있으면 납득이라도 하겠건만. 카페 중간중간 놓여져있는아톰. (왜때문에...?) 카페전경 날이 좋아 창가 자리에 앉아요. 동으로 만든 컵을 사용해서 끝까지 시원. 쑥라떼는 진한맛이 꽤 맛있고 좋았는데 커피류는 되려 너무 진해서 먹기 힘들정도. 카페인에 약한 분들은 먹으면 안될듯 싶다. +옻칠트레이 관심있었는데 사고싶어졌네...?"
[한남동/한강진역] 한남작업실 / 한남동 카페 / 이태원 데이트코스 추천,"오늘은 한남동 데이트코스 가져왔어요💗 7월에 갔었는데 초콤 늦은 리뷰..♡ 시작! 50m © NAVER Corp. 한남작업실 서울특별시 용산구 이태원로55나길 7 한남동 가면 오빠랑 저랑 무조건 들르는 카페 한남작업실. #리움미술관 가기 전에 또 들렀어요!! 한남작업실 서울 용산구 이태원로55나길 7 click @heekoos 분위기 넘 이쁘죠♡ 흑임자케잌(9,000원) 시켰는데 고소하니 괜찮았어요:) 사실 제 최애 디저트는 이것! 애플 르바부 스콘 (8,000원) 제가 한남작업실 가면 항상 시키는 디저트에요!! 스콘 위에 올려져있는게 사과절임(?)인데 진짜 맛있어요...♡♡ 시나몬 향 싫어하는데도 이 디저트는 진짜 찐...🧡 저번에 갔던 한남작업실 말차바스크케이크 (9,000원) & 흑임자크림라떼 (8,000원) 여기는 진짜 커피맛도 일품, 디저트도 일품, 분위기도 일품인 곳이에요... 커피도 진짜 짱짱 맛있음... 접시 하나, 컵 하나 한남작업실 만의 특색이 듬뿍 듬뿍이에요🤍 한남동 가면 꼭 들러보세요!♡ #한남작업실 #한남동카페 #한남동디저트 #한강진역카페 #이태원카페 #한남동카페추천 #한남동디저트추천 #한강진역카페추천 #이태원카페추천 #한남작업실메뉴추천 #한남동데이트 #한강진데이트 #이태원데이트"
한남동 • 클랩피자 • Partez! 파르테즈 쇼룸 • 한남작업실,@클랩피자 한남 리움미술관에서 전시를 관람하고 밥 먹으러 넘어왔다 정말 오랜만에 오는 클랩피자 가끔 트러플 피자가 생각이 났지 항상 주문하는 시그니처 트러플 고르곤졸라랑 갈릭 쉬림프 반반 주문 역시 트러플 향과 달콤한 꿀이 더해진 대표 메뉴가 제일 맛있다 마침 지나가는 길에 파르테즈 쇼룸이 있어서 홀린듯이 들어갑니다 온라인으로만 구경하다가 오프라인에서 액세사리 실물은 처음 보는데 심플하니 예쁜 게 많았다 중지에 껴본 꼬임링도 귀여웠음 @한남작업실 낮에 한번 와보고 싶었던 카페였는데 밤에 오게 되었다 날씨가 선선하고 좋아서 창문을 다 개방해 놓고 내부에 앉는 사람보단 밖 테라스에 앉는 사람이 많았다 외부에는 등이 없어서 많이 어두웠음 TWG티와 아이스라떼 주문 여기 커피 맛집이네 라떼가 고소함 합격 저 컵이 스테인리스 재질이라서 그런지 커피가 잘 안 녹았다 이 점 하나는 마음에 든다 오후보다는 오전에 오는 게 더 좋은 것 같다 밤에는 너무 어두워서 뷰를 볼 수 가 없음 하지만 재방문은 하지 않을 듯ㅎ 아톰이 많았던 카페 #한남동피자맛집 #클랩피자한남점 #클랩피자 #한남동카페 #한남작업실 #한남동가볼만한곳 #파르테즈쇼룸 #한남동쇼룸 #파르테즈반지
"한남동 고급 정원 카페에서 마시는 커피, 맛있을 수 밖에 없지...<한남작업실> 다녀온 후기","주말을 활용해 한남동 나들이 다녀왔습니다. 약수순대국에서 낮술을 했기에 약수역에서부터 한강진역까지 걸어 왔드랬죠...! 한남에 도착했더니 얼굴은 홍당무... 근데 주변을 둘러보니 핵인싸들의 줄지어 돌아다니고 너무나도 부끄럽... 마블코리아 행사도 하더라구요? 여길 지나서 한남 꼼데가르송 골목길로 들어가 '한남작업실'에 도착!!! 고급 저택을 개조한 듯한 느낌, 도심 속 정원 카페 느낌의 이 곳을 소개해볼게요! 한남작업실 Everyday 11:00-22:00 50m © NAVER Corp. 한남작업실 서울특별시 용산구 이태원로55나길 7 이 부근은 대사관 등 국가 주요 기관들이 모여 있고, 무엇보다도 부자들이 많음. 주택이 아니라 저택들이 즐비해있죠. 여기도 처음에 저택인줄 알았어요. 외관만 봐도 딱 그렇죠? 강아지 쥔님 저택인줄 입구가 아주 예쁩니다. 요 계단을 오르면 이렇게 아름다운 뷰가 나와요. 이마이 이쁜 뷰에서 사진을 안 찍을 수 없죠? 똥폼 좀 잡아봤습니다^^^^* 입구도 보여드릴게요! 벽돌의 붉은색과 푸른 잎사귀들 그리고 그 공간을 통해 보여지는 거울세상도 아름답..! 메뉴판이에요. 메뉴가 많지는 않았는데 커피를 마셔본 결과 뭘 마셔도 존맛이라는 걸 바로 알 수 있었어요..! 원두 진짜 신선함 음료와 디저트를 주문하고, 내부 사진을 찍기 시작. 캔버스를 조명이 비춰주니까 붓이 하나도 안 지나갔는데 멋진 작품이 되네요. 예술은 정말 해석하기 나름이지만 이런 해석을 하게 만들어주는 게 대단쓰 내부는 전체가 통창이라 시원스럽더라구요! 그리고 아톰인형들이 진짜 많더라구요. 아마도 이것들은 한정판 피규어일 듯. 크기도 장난 아니던데 사장님 붖아... 주문한 커피와 디저트! 저 검은 벽돌같은 건 흑임자 휘낭시에?였는데 어르신들이 좋아할만한 맛...ㅋㅋㅋ 자, 그럼 카메라 한 번 들어보겠습니다. 색 조합이 너무 예쁨... 어디서 찍더라도 예쁘더라구요. 야외 테라스에서 먹었는데, 야외도 한 번 보여드릴게요:) 진심 인테리어 너무 이쁘지 않나요...? 이 멋진 사진들을 찍는 모습도 찍히고ㅋㅋㅋ 그리고 착석해서 드디어 커피 한 모금합니다. 술이 덜 깨서 온 몸이 홍당무... 앉아서 수다 떨면서 주변 구경하다보니 2시간이 그냥 후딱 지나가더라구요. 그러다가 반대편에 손님들이 나가길래 반대편에서 바라보는 카페도 찍었어요! 구름만 좀 더 걷히면 진심 예쁜 풍경들이 보였을텐데 그게 조금 아쉽. 화창한 날에 다시 와서 찍어보려구요! 한남동에 방문하시면 <한남작업실> 들러서 고급 저택에서 맛있는 커피도 마시고, 도심 속 정원 느낌 만끽하고 가시길 :) #daily #dailycafe #dailycoffee #cafe #coffee #데일리 #데일리카페 #데일리커피 #카페투어 #cafetour #커피 #카페 #일상 #한남작업실 #한남동카페 #한남동커피 #한남카페 #한강진역카페 #한강진역커피 #한남커피"
"한남동 카페, 테라스가 있는 한남작업실","저번에 한남동에서 다녀온 한남작업실, 아직 카페 포스팅 엄청 남아있는데 ... 언제 다하지 ㅎ-ㅎ ...ㅎㅎㅎㅎ 한남작업실 친구가 예전에 다녀왔는데 좋았다고 해서 같이 가봤당 헷 50m © NAVER Corp. 한남작업실 서울특별시 용산구 이태원로55나길 7 우리는 이태원부터 쭉 돌아다니느라 요리조리 다녔지만 지하철로 오려면 한강진역 1번출구로 나와서 찾아오면 된다 ;> 이런 자연+돌계단 좋ㅇㅏ 부잣집 들어가는 기분이잖ㅇㅏ.. 갬성 ,, ㅠㅠㅠ넘 예뻤다 잘 꾸며진 정원 느낌도 나고 ! 푸릇푸릇 들어가봅니다 밖은 자연에 둘러싸인 여유로운 분위기였는데, 내부는 또 세련됐다.. 그렇게 밝지 않은데 작업실 느낌과 넘 잘어울렸다 메뉴판 갬성도 넘 좋음⏝̊̈ 나는 바닐라빈라떼, 친구는 두유로 바꾼 카페라떼로 마셨다 ㅎ-ㅎ 베이커리도 전시용품처럼 넘 정갈하게 준비되어 있잖아 ㅋ ㅋ ㅋㅋㅋ 모양이겠지만 넘 예뻤다 .. 진짜 작업실 느낌 물씬 풍김! 깔끔한데 엄청 잘 꾸며져있었다 .. 좋구나 여기 원목 테이블과 의자가 있어서 더 깊어보였달까 .. 우린 오후에 갔는데, 저녁에 가면 또 다른 분위기가 보일 것 같다 컵 예쁘다~ 했는데 작가님의 작업물인 것 같았다 따로 판매도 하고 있었는데, 가격이 안붙어있어서 ,, 가격 들으면 슬플 것 같아서 눈으로만 담았다^..^... 왜 모자이크 뚫고 나오는 것 같지..? ㅋㅋㅋㅋ 얼굴이 놀라운 술톤이라 넘 슬펐다 ... 술도 안마셨는데 왜.. 우리는 실내 끝 자리에 앉았는데, 뒤로 바로 테라스가 있었다! 조금만 덜 더웠으면 당연히 저기 앉았을 것 같은데 이날은 이태원을 하도 걸어다녀서 ㅋㅋㅋ땀이 삐질삐질 났기 때문에 안전하게 실내착석함.. 테라스에서 내려다보는 한남동도 넘 여유롭고 좋을 것 같당 우리도 창가자리라 한남동이 보이긴 했다 .. 근데 한남동 동네는 여유로운데, 사람들이 항상 많은 느낌이라 ㅋㅋㅋ 여기 10분만 앉아있ㅇㅓ도 밖에서 사진찍는 사람들 여덟 팀은 볼 수 있을 것 같아.. (우리같은 사람들^^) 컵이 뭔가 예술적이야 작업실이라는 말을 듣고 컵을 봐서 그런지 예술작품같았다,, 색감이 넘 예쁘다 음료는 평범했다 사실 수다떠느라 음료 맛이 어땠는지 잘 기억이 안남ㅋㅋㅋ 여기가 2차 카페였는데 아직도 할 말이 남았다니. .. 나 5차카페까지 가능할 것 같아 여기가 내 주택이었으면 좋겠다는 생각을 하고 나왔다 , ㅋㅋㅋㅋ 한남동 감성 듬뿍담은 한남작업실 담에 또 갈 것 같다 (＊’͜’ )"
한남작업실 한남동 이색 카페 주차,"한남동 이색 카페인 한남작업실을 소개합니다. 한남동 분위기 좋은 카페입니다 예술가가 만든 카페답게 간판이 멋집니다. 입구 풍경 도심 속 그것도 한남동이라는 고급 주택가에 이런 푸르름을 대놓고 자랑이라도 하듯 오고 가는 이의 발길을 사로잡는 정원이 눈에 띕니다. 어떤 공간이 펼쳐질지 기대하는 마음으로 계단을 올라갑니다. 역시 기대를 저버리지 않는 럭셔리한 정원과 카페가 등장합니다. 입구문 루프탑에는 4인 테이블이 있는데, 야외에서는 이 위치가 한남작업실 핫 풀입니다. 오고 가는 행인들도 볼 수 있고 독립적으로 다른 테이블과 떨어져 있어 옆에서 대화하는 소리에는 거슬리지 않습니다. 주방 한남작업실 디저트류는 심플하면서도 고급 지게 세팅되어 있습니다. 안 먹어 볼 수가 없는 비주얼입니다. 오픈된 주방이라 공간이 훨씬 넓어 보이는 효과가 있었습니다. 협소한 주택을 개조해서 카페를 했기 때문에 최대한 개방감을 유지하는 인테리어를 했습니다. 내부 풍경 허명욱 작가님의 작품들이 곳곳에 전시되어 있습니다. 왜 간판이 한남작업실인지 이해가 됐습니다. 작품에 쓰이는 도구들도 이렇게 인테리어에 한몫을 하고 있습니다. 이런 이유로 이색 카페로 손색이 없습니다. 화장실로 향하는 통로입니다. 저 의자가 궁금하시죠? 조명과 더불어 설치미술 작품으로 착각할 정도입니다. 그러나 정답은 화장실 대기 의자입니다. 기발한 사고로 공간을 연출한 이색 카페 한남작업실입니다. 작가님이 만드신 컵과 접시들 그리고 피겨들도 전시돼 있습니다. 세련되면서도 모던한 스피커가 저의 눈을 사로잡습니다. 수제 커스텀 스피크로 보입니다. 외부 풍경 실내에서 야외 정원으로 이어지는 통로입니다. 저희는 야외 테이블에 자리를 잡고 여유롭게 한낮의 티타임을 즐겨봅니다. 도심 속의 작은 정원이 이렇게 훌륭한 휴식처를 안겨줌에 고맙기까지 합니다. 주택의 마당 같기도 한 한남작업실이라 정감이 있고 편안한 느낌을 받습니다. 단체 손님도 앉을 수 있는 긴 테이블이 야외에 비치돼 있습니다. 한여름의 더위도 가고 푸르름은 이제 곧 가을을 선사하겠지요. 주문 메뉴 레몬향 가득한 케이크와 아이스 아메리카노는 함께하는 우리를 더욱더 행복하게 합니다. 작가님의 작품 위에 담긴 케이크라 그런지 더욱더 상큼하게 느껴지는군요.ㅎㅎ 기타 메인 출입문에는 한남작업실의 아우라를 듬뿍 집어넣었습니다. 정보 1. 위치 50m © NAVER Corp. 한남작업실 서울특별시 용산구 이태원로55나길 7 1층 한남작업실 2. 화장실 독립된 화장실 있음 남녀 화장실 구분됨 3. 정원이 이쁜 카페 4. 영업 시간 오전 11시 오픈 오후 10시 마감 라스트 오더 오후 9시 30분 5. 주차 독립 주차장 없음 발레파킹 가능 6. 기타 와이파이 가능 반려동물 동반 도심 속의 이색 카페 한남작업실은 이색 카페의 면모를 갖추고 있으며, 또 오고 싶은 곳입니다."
한남동카페추천 이태원카페추천 한남작업실,"한남작업실 서울 용산구 이태원로55나길 7 한강진역 1번출구에서 555m 매일 11:00 ~ 22:00 발렛파킹 간판이 따로 없어서 지나칠뻔 ! 했다는 한남작업실 ㅋㅋㅋㅋㅋㅋㅋㅋㅋㅋㅋㅋㅋ 한남동에서 점심먹고 블로그로 찾아간 한남작업실인데 앞에있는 다른카페갈뻔 ! 했다구요 ㅋㅋㅋㅋㅋㅋㅋㅋㅋㅋ 요깄네요 간판 한남작업실 ! 사실 요거말구 주소보구알았어요 ㅋㅋㅋㅋㅋㅋㅋㅋㅋㅋ 이날 이상하게 쫌 추웠던날이에요 지금 블로그쓰는 지금보다도 더 추웠던 더 가을가을했던 한남작업실 실내 스캔 쫙 ~ 한번 해주고 실내 앉을까 밖에 나갈까하다가 아톰 구경도 하고 걍 밖에 나가기로했죠 레몬크림케익을 하나 주문하고 친구는 한남작업실 시그니쳐인 애플시나몬라떼를 주문하고 저는 곧죽어도 아메리카노! 를 주문했어요 그리고 나와서 식물 구경도 하고 저멀리 경치가 보이는 자리에 착석 ! 저 벽 반대편으로는 리움미술관이 바로 보인답니다 짠 ! 어머멋 컵 슬리브 완전 맘에들어 ^^ 한남작업실 아메리카노 진짜 맛있어요 방금 막 부자식당에서 점심을 먹고 온 우리지만 ^^ 레몬크림케익 컷팅식이 있겠습니다 우왕 맛있겠당 ㅋㅋㅋㅋㅋㅋㅋㅋ 애플시나몬라떼, 아메리카노 이날 추웠어요 ;; 그래서 커피가 얼마나 더 맛있었게요 ~ ^^ 부직포 컵 슬리브가 이렇게 코지코지 해 보일수가 ㅋㅋㅋㅋㅋㅋㅋㅋ 미쿡에서 온 친구가 저 멀리 바라보더니 저긴 어디냐며 네 리움미술관이었어요 수다도 떨었으니 리움미술관 잠시 방문하기로 하고 자리를 뜨는데 와 우리 들어올때만해도 테라스에 사람 없었는데 ;; 언제 이렇게 가득 찼지 ㅋㅋㅋㅋㅋㅋㅋㅋㅋㅋㅋ 집에가며서도 한남작업실 구경 ㅋㅋㅋㅋㅋㅋㅋㅋㅋ 낙엽낙엽한 하루였어요 ^^ 리움미술관에서 도자기 구경하고 그림의 그자도 모르는 그림 구경도하고 오늘 미쿡에서 온 친구랑 아주 알차게 놀았네요 50m © NAVER Corp. 한남작업실 서울특별시 용산구 이태원로55나길 7 한남동카페 한남작업실 재생 2 좋아요 1  접기/펴기 한남동카페 한남작업실 한남동카페추천 이태원카페추천 한남작업실 (1) 재생 2 좋아요 1  접기/펴기 한남동카페추천 이태원카페추천 한남작업실 (1) 한남동카페추천 이태원카페추천 한남작업실 (2) 재생 2 좋아요 1  접기/펴기 한남동카페추천 이태원카페추천 한남작업실 (2)"
"한남작업실_작가의 작업실에서 커피 한 잔 어때요?(한남동 카페 추천, 주차정보)","내가 자주 올 거라고 했찌요? 그래서 왔어요꙳꒰ ੭⑅•͈ ·̮ •͈꒱੭ ☀︎ 오늘은 한남동 카페 추천합니다. 한남작업실 작가의 작업실에서 커피 한 잔 어때요?(한남동 카페 추천) ☕서울 용산구 이태원로 55나길 7 1층 한남작업실☕ 한강진역 1번출구에서 555m ☕매일 11:00-22:00☕ ☕전화 0507-1320-5620☕ ☕발렛파킹, 무선인터넷, 남/녀 화장실 구분☕ 🚘주차정보🚘 한남작업실에서 조금 밑으로 가면 DOTZ(다츠)라는 음식점이 있어요. 야외 대기 천막 뒤편에 발레파킹 사무실 있습니다. 1시간 30분 기준 4,000원 초과 30분당 2,000원입니다. 여기가 입구인가? 두리번거리다 입간판 발견! 건물 외관 한남작업실은 1층에 위치해있답니다. 야외공간 내부는 1층밖에 없어서 생각보다 협소했는데요. 야외 테라스가 있었어요. 날씨 좋으면 참 좋겠네요. 귀여운 디저트들 디저트 굉장히 귀엽더라고요. 먹어보고 싶었는데 배불러서 못 먹었어요ㅜㅜ 아쉽쓰.. 음료 메뉴판 사진도 깜빡했어요ㅋㅋㅋㅋ 아톰이 자주 보이네요. 감각적인 내부 모습. 그릇들이 되게 특이하고 예스러운데 되게 세련되었다고 생각하면서 멋지다고 생각했어요. 한남작업실은 허명욱 작가님이 많은 사람들에게 커피 한 잔의 가격으로 그 작품의 경험을 살 수 있도록 한 카페라고 해요. (출처: 롯데호텔 메거진.) 진짜 멋진 말이네요! 음료가 나왔는데 너무 예쁜 거 있죠! 저희는 시나몬 라테와 딸기 라테를 주문했어요. 시나몬은 역시 따뜻하게 먹어야 잘 어울려요. 시나몬도 커피도 아주 진한 향~ 딸기 라테는 무겁지 않고 적당히 달달하고 맛있었어요. 유기 잔 멋지다 그쵸? 위에 옻칠을 하셨나 봐요. 허명욱 작가님은 사진, 설치미술, 금속공예 등 다양한 장르에서 활동하신다고 해요. 그중에서도 옻칠화로 유명하시다고 하네요. 옻칠로 구리가 이렇게 다른 느낌을 가지게 되다니 너무 아름다워요. 금속재료는 차갑기만 하다고 느꼈는데 옻칠을 하니 따뜻하기도 하고 귀엽기도 하네요. 손님이 많아서 사진촬영을 하기가 어려웠어요. 하지만 내부 공간 하나하나 작가님의 작품이 잘 어우러져 있었어요. 여러분도 한남동에서 작가님의 작업실에서 커피 한 잔의 여유와 감성을 느끼시는 건 어떠세요? 생각보다 너무 좋았던 공간이었어요. 느림보가 강추합니다!"
이태원/한남동 카페 :: 한남작업실 :: 야외석 추천,"한남동 카페 한남작업실 20210918 이태원/한강진역/한남동 맛집 :: 리틀넥 한남 한남동 맛집 리틀넥 한남 오랜만에 친구와 함께 브런치를 즐기고 싶어서 이태원에서 유명한 브런치카페 꾸... blog.naver.com 한남동 맛집 리틀넥 한남점에서 간단하게 배 채우고 맛있는 커피 마시러 한남동작업실로 ~!! 이태원/한강진역/한남동 카페 한남작업실 주소 서울 용산구 이태원로55나길 7 (한남동 745-2 1층) 영업시간 매일 11:00 - 22:00 50m © NAVER Corp. 한남작업실 서울특별시 용산구 이태원로55나길 7 한남동 카페 한남작업실 야외석이 참 좋더라~ 혼자와서 노트북 하는 사람들도 많고 분위기가 참 좋았던 한남작업실 야외석은 역시나.. 만석으로 내부석도 없어서 방황하다가 자리 생겨서 내부에 착석. 한남동 카페 한남작업실 사장님께서 아톰을 좋아하시나~? 아톰 피규어 전시가 되어 있었음. 여기에 테이블 하나 가져다 둬도 좋을텐데ㅋ 수다 떨고 나갈때 찍은 한남동작업실 내부. 낮에는 만석 만석 만석!! 이태원 한남동 카페 한남작업실 메뉴 여기에도 흑임자크림라떼가 있네 ?! 그럼 흑임자라떼 마셔줘야지♥ 근데 가격 너무 쎄.. 아메리카노부터 6천원..ㅎ 이태원 한남동 카페 한남작업실 진한 흑임자크림 올려있는 우유 & 에스프레소는 따로 담겨 나왔다. 직접 부어 마시면 되는 한남동작업실 흑임자크림라떼 이태원 한남동 카페 한남작업실 흑임자크림라떼 완성~ㅋㅋ 한남동 흑임자크림라떼 맛있다~ 근데 8,000원은 너무 비싸네열...ㅠㅠ 예쁜 테라스 야외석 카페 찾는 분들께는 딱 좋을 이태원 한남동 카페 한남작업실 가격이 비싼건 체크하고 가세열~ㅋㅋ"
한남동 한남작업실 테라스 작업하기 좋은 카페 햇살 맛집,입구부터 분위기 너무 예쁜 카페 한남동 한남작업실 한남작업실이라는 이름이 참 마음에 들었어요 마치 아뜰리에 같은 공간에 개인 작업 하러 가는 느낌도 들고 (허세) 입구에서 계단을 올라가면 보이는 푸릇푸릇한 나무들 계단 아래서 본 한남작업실 풍경이 너무 예쁘더라구요 ㅎㅎ 한남동 카페 한남작업실 테라스예요 카페 라기보다 주택에 있는 정원 같은 느낌이 들어 포근했어요 날씨가 엄청 화창했는데 이 사진은 왜 때문인지 흐리게 나왔네요 한남작업실 실내로 들어가니 곳곳에 아톰 캐릭터가 있더라구요 ㅋㅋ 야외 테라스도 있고 실내에도 창가쪽에 커다란 창문이 열려 있어 그 쪽도 테라스로 이용 가능해 한남작업실은 진정한 테라스 맛집이었습니다 한남작업실이라는 이름답게 정말 작업실처럼 미술 물품들이 있어요 작업실이면서 동시에 갤러리같은 느낌을 주는 한남동 카페 한남작업실 그리고 여긴 아톰맛집이라능.. 팔짱낀 아톰 시커먼 아톰 여기도 아톰 저기도 아톰(들) 커피컵이 깔별로 있는게 예쁘더라구요 날이 너무 더워 갈증이 나서 메뉴를 제대로 보지도 못하고 아아로 호다닥 주문했어요 여기가 제가 앉은 한남작업실 2층 창가 자리예요 엄청 큰 창문이 활짝 열려있어 햇살이 가득 들어오고 바람도 살랑사랑 불어 기분이 좋았어요 테라스에 앉는 거랑 같은 느낌이었어요 한남작업실에서 바라 본 바깥 풍경 모습 조용한 동네 분위기도 좋고 무엇보다 하늘이 너무 예뻤어요 주문한 아이스 아메리카노가 나왔어요 테이블과 트레이 색과 질감이 마치 유화 물감으로 그려놓은 거 같죠? 더워서 급한대로 시킨 건데 생각보다 커피가 너무 맛있어서 깜짝 놀랐습니다 한남작업실은 아톰 맛집이 아니라 커피 맛집이군요! 커피를 다 마시고 나가면서 다시 본 테라스 너무 예뻤어요 더 더워지면 테라스 앉기 힘들 거 같아 얼른 조만간 또 가려구요! 커다란 나무들이 많아 보고 있으면 눈이 편하고 기분도 싱그러워집니다 한남작업실 서울특별시 용산구 이태원로55나길 7 조용한 한남동 골목길에 위치한 카페 한남작업실 혼자서 작업하러 가기 딱 좋은 곳이에요
