title,content
"2022.09.18 (한남동, 이태원, 뚝섬한강공원, 워니피크닉, 키에리, 베베베, 세르클한남)","#첫글 #한남동 #이태원 #키에리 #뚝섬한강공원 #워니피크닉 #세르클한남 #베베베 #카페투어 #일상 차근차근히 작년꺼부터 시작해서 올릴 예정 ! 다 할 수 있을란지 ,, ? 일단 시작 해 보자구 ㄱㄱ 세르클한남 오늘은 실장님(현 부원장님) 이랑 한남동 데이트 ! 9월인데도 많이 더웠던 기억이,,, 둘다 브런치 좋아해서 만나자 마자 바로 먹으러오기 ㅋㅋ 역시 한남동,, 언덕 때문에 땀 뻘뻘 운동 된다 ,, 세르클 한남 서울특별시 용산구 이태원로 223-5 4F 외관 너무 이쁜거아니냐고 ㅠㅠ 취저 유럽풍 분위기 물신 느껴지는 건물 도착하자마자 벌써 설레버림 )) 1층,2층,테라스로 2층은 카페만 이용할 수 있음! 도착했을땐 이미 대기줄이 .. 그렇다고 포기? ㄴㄴ 그냥 기다림 우리는 갬성충이라 테라스 빠질때까지 기다렸다 ㅋㅋㅋㅋ 기다림 끝에 자리 착석! 선결제라 주문하러 총총 요 계란빵 처럼 생긴 애들이 시그니처란다 작고 귀여워.. ""뺑뒤프"" 버터의 풍미가 가득한 반죽에 계란을 넣고 구운 ""계란빵""으로, 익숙한 듯 특별한 세르클만의 브런치 라고 함 (메뉴판 참고) 우리는 나중에 디저트도 먹으러 가야하기 때문에 얼그레이뺑뒤프, 어니언스프, 연어 뺑뒤프 이렇게 시켰당 나는 무조건 얼죽아 ☆ 실장님은 오렌지쥬스 ☆ 음료랑 어니언스프가 먼저 나왔당 마쉿게탕 그리곤 나온 뺑뒤프들! 넘 이쁜 플레이팅 ㅠㅠ 폰 들고 사진찍느라 바쁨 안에 계란이 들어있는 뺑뒤프 위에 연어랑 소스랑 양파! 연어는 맛없없이지 .. 얼그레이 뺑뒤프는 그냥 얼그레이향 은은하게 나는 빵맛 나는 지금.. 고급스러운 계란빵을 먹고이따 어니언스프가 제일 맛있었음 츄릅 한두번 올만한 곳! 외관이랑 내부랑 음식도 다 나쁘지 않아서 아주 성공적 ᕦ( ᐛ )ᕡ 이태원 키에리 한남동 돌아다니면서 팔찌도 사고 구경하다 이태원으로 넘어옴 ! 전 부터 와보고 싶었던 키에리 이때부터였나보다 .. 글루텐프리, 비건에 빠지기 시작한게 ㅋㅋ,, 노버터, 계란, 유제품에 100%자연재료로 만드는 치즈케이크 맛집! 키에리 서울특별시 용산구 이태원로26길 16-8 여기는 가게 규칙? 이 존재함 무작정 들어가면 안되고 밖에 벨을 눌러서 직원이 나올때까지 기다려야한다)) 처음부터 범상치 않음을 느낌... 다행히 웨이팅 없이 바로 입장! 꺄아아아 너무 맛있어보이는 케이크들에 눈돌아감 ㅠㅠ 근데 요즘 물가가 미친건지 여기 가격이 미친건지 케이크 한조각에 만원이 넘어감 ㅎ... 가장 기본일꺼같은 블루베리 클래식 치즈케이크 (9800) 픽 ! 이용시간은 1시간 20분! 도착한 시간이 적힌 종이와함께 케이크랑 음료 나옴 냠냠 웬 애기고양이가 돌아다니길래 뭔가 했더니 키에리 마스코트 아리 ㅠㅠ 너무 귀여워서 깨물어 트리고싶어 ( • ˃̶͈̀□˂̶͈́)੭ु⁾⁾ 여기는 3인까지만 입장이 가능하고 조용한 힐링공간을 만들기 위한 가게 원칙으로 시끄럽게 떠들면 안되고 소근소근 이야기 해야한다 (진짜 괜히 더 작게 말하기..) 케이크는 처음에 먹었을때 응? 정말 단백한 치즈케이크? 물음표가 가득한 맛 글루텐프리라고 생각하면 괜찮지만 약간 나랑은 안맞는거 같음 ㅎ 호불호가 많이 갈린다곤 하던데 나는 그 중간 @@@ BBB 우리의 빵 투어는 끝나지 않았다 (?) 한남동 화덕에 구운 베이글로 유명한 곳! 한남동은 외관들이 전부 예뻐서 좋음 ㅠㅠ 여기는 붉은 벽돌의 독일풍! 베베베 서울특별시 용산구 이태원로42길 46-12 안에 내부가 전부 베이글로 가득가득 ε=ε=(ง ˃̶͈̀ᗨ˂̶͈́)۶ 여기가 천국인가요..? 사진은 많이 못 찍었지만 화덕에 베이글 굽는것도 볼 수 있고 크림치즈나 베이글 종류가 상당히 많았다)) 베이글 뿐만 아니라 샌드위치랑 생맥주도 같이 판매하고 있움 다음에는 샌드위치도 먹어봐야징 너무 배불러서 오늘은 시금치바질 베이글 한개만 pick! 그렇게 런던베이글 뮤지엄 다음으로 좋아하는 베이글집이 됐다,, 왜 한개만 샀어 ? 베이글 한개 사들고 뚝섬한강공원으로 피크닉 하러 ㄱㄱ 도대체 얼마나 싸돌아 다니는지 ㅋㅋㅋㅋㅋㅋㅋㅋㅋㅋㅋ 워니 피크닉 뚝섬점 도착하기 전 미리 워니 피크닉에서 내추럴SET로 예약 해서 받았당 ! 급발진으로 예약한거라 원하는 세트는 못함 ㅠㅠ 가격은 주말가격으로 3시간에 \35,000원! 구성품 : ( 바구니+ 매트 + 꽃다발 + 플레이팅 도마+ 접시 + 트레이 + 일회용 와인잔 2개 + 칠링백 + 글라스펜 + 엽서 + 피크닉 가방 ) 뚝섬 입구 배달존에서 직접 가져다주시기에 엄청 편리했당 여기서만 2번 이용함 ㅋㅋㅋ 갬성충 이지련은 이런거 못참아 넘 조녜자나 ✿ 워니피크닉 뚝섬점 서울특별시 광진구 능동로3라길 13 102호 이때가 지금 피티샵 다니기 바로 전날이라 마지막 만찬))으로 먹움 ˙Ꙫ˙ 존맛 존맛 한강 + 피크닉 + 치맥 + 라면 = 햄볶 그 잡채 ;; 해가 서서히 지는게 보이는 뚝섬.. 나.. 뚝섬에 빠져들어쒀 ,,☆ 얘기하는데 시간 가는줄 몰랐슴 그렇게 실장님이랑은 밤 까지 수다 떨다가 지하철 안에서 둘다 반 지친 상태로 집갔다 .. 취향이 둘다 너무 잘 맞았고 오늘 하루 너무 만족 ㅎㅎ 실장님 따랑해 ෆ⸒⸒⸜( ˶'ᵕ'˶)⸝ 현실은 담날 출근 잼 .. ● ● ● ps. 블로그 이거 하나 쓰는데 2일걸림 *^* 열심히 하나하나 올려보자 아좌좌"
이태원-한남동-빵지순례::키에리/듣던대로 굉장히 굉장한 문화,"키에리는 내가 한 6개월 전 부터 그러니까 바프 준비중일 때 부터 바프 끝나자마자 가야지!하고 점 찍어둔 베이커리 카페 키에리 서울특별시 용산구 이태원로26길 16-8 이태원으로 놀러갔지만 결국 뭐 다른데만 실컷 돌아다니고 못 갔고 그 이후로는 다들 알고있는 그런 시기라 못갔고. 오늘은 겸사겸사 이태원에 오랜만에 갔다가 오늘은 가볼까? 하고 방문했다. 다행히 웨이팅 안하고 먹을 수 있었다. 한남 키에리 키에리는 찐중에 찐 먹스타그램 좀 하는 특히 디저트그램을 한다면 그렇게나 찬양글이 많은 곳이다 홀케이크 퍼먹는 내가 안가볼 수 없지 않나,, 그래서 오늘 간김에 메뉴 세개! KYERI: We serve Love & Dessert 그래요? 조용한 카페라는 개념이 사실 신기했는데 근로자를 아주 소중히 생각하는 업주가 계시는 듯한 입구 근데 나도 문장 자체에서는 딱히 이상한걸 못느꼈다 맞는 말 맞긴 하니까 나는 너무 시끄러우면 맛을 못느낀다 그래사 시끄러운 식당을 정말 싫어하고 푸드코트도 잘 안가게 되는 편 맛을 느끼는 환경적 요소에 조용함 또는 적당한 소음이 있을 것 같긴 하달까? 그런데 미분당(말하지 않고 먹는 쌀국수집) 이후로 조용히 하라는 카페는 처음봐서 신기했다. 그리고 저 엄청 단호한 문체의 근로자 보호 문구도. 근데 넷이와서 둘씩 앉는건 왜 안돼요,,? 가서 핮석하고 난리칠까봐? 여기서부터 ‘안되는게 좀 많네?’라고생각했다. 암튼 자세히 두루두루 안내받고 입장 이거봐요 눈 안뒤집어지게 생겼나 내가 당연히 세개는 먹어야지 둘이 왔는데. 내가 고른건 피스타치오크림이 들어간 떠먹케 그리고 얼그레이초코 그리고 뽕,,루,,뭐더라 이렇게 써있어서 조용한 편이긴했는데 그래도 대화를 작게 많은 인원들이 나누다보니 웅성웅성 정도는 들렸다 생각해보니까 평수대비 테이블이 많아 빽빽했던거같다 다들 시끄러우면 또 나같은 예민러는 짜증냈겠네 그리고 뭐 아무튼 안된다 안된다 주의 조심 이런 문장 투성이라 들어가자마자 부정적인 느낌을 많이 받았다 그래도 어쩌겠어? 내 가게야? 아니니까 하라는대로 해☺️ 효소: 아침에 효 / 딥톡스 / 순수효소 그리고 오늘 뭘 먹어도 소화시키겠다는 의지 왼쪽 세개는 내 효소 오른쪽에 엠티자임큐는 친구가 가져온 효소 나는 많이 먹는만큼 효소에 굉장히 의존적인데, 하루 세번까지도 먹고 일단 외식할때 배터져라 먹는 스타일이라 꼭 챙겨다닌다 근데 먹는다고 살이 빠지지는 않고요 아무튼요 그냥 뭐랄까 내 장기가 덜 힘들어하게 하려는 의도? 얼그레이라벤더치즈 뽕루비브치즈 피스타치오트리플 을 먹었다 어쩐지 얼그레이치즈가 향이 엄청 특이했다 키에리 이태원 그리고 나는 루이보스티를 시켰는데 차가 식어가니까 물비린내같은게 났다 그리고 멀쩡한 머그컵도 있던데 굳이 따듯한(뜨거운)차를 투명한 유리컵에 주시는 이유는 뭐랄까.. 아무튼 별게 다 이해 안되던 곳 그렇다고 웃으면서 친절한 사람도 아무도 없고 누가 중간에 하핫!하고 조금 크게 웃었는데 갑분싸 되던 그 순간 잊지 못해.. 그렇다 나는 내돈내산에 돈을 펑펑쓰고 열심히 비판하는 편이다 한시간반 이용시간제한있음 원래 디저트 먹을때 한시간도 안걸리는데 괜히 안나가고 싶달까 매장은 작은데 오고싶은 사람은 많으니까 그럴만하네요 그럴수있죠 그리고 이게 마음에 안든다는 사람도 와서 시비걸일없아 입장을 못하게 하는거니까 아무튼 고객중심의 친절한 문화는 아니어서 당황스럽다 근데 이해는 된다~ 키에리 세개 조합이 좋았어요 얼그레이라벤더치즈는 비누냄새같을정도의 진한 차향이 나는데 안에 초코칩이 자잘하게 씹히고 뽕루비브는 상큼한 콩포트?에 생각보다 가벼운 크림 그리고 구수한 이게 뽕이야?싶은 초록색 꾸덕한 무언가 개인적으로는 다른것들 먹다가 질릴때 한입씩 먹어서 마지막에 얘는 좀 남았다 키에리 케이크 보기엔 완벽하다 동네에 있으면 꽤 자주갔을 것 같다 많이 좋아하는 잇다제과랑 다른 느낌인데 매력있다 근데 잇다도 테잌아웃 전문에 키오스크 판매라 단골이거나 아니거나 뭣도 없는 분위기 저는 젊꼰인가봐요🌞 이태원케이크 키에리 피스타치오트리플 아무튼 피스타치오트리플 이게 진짜 싹싹 긁어먹었는데 피스타치오가 들어간 피스타치오크림 그리고 가벼운 빵 그리고 가벼운 우유로 직접 만든건가? 좀 묽은듯한 크림+크럼블 +애플잼인지 뭔지 많이 달지는 않아서 좋았던 잼 떠먹는케이크? 떠먹는푸딩? 뭘까 아무튼 사이즈가 꽤 큰데 가벼워서 한그릇 금방 뚝딱했다 테이크아웃용은 작은걸로 가격 조금 낮춰서 만들어주면 집 갈 때 열개쯤 싸갈텐데 요즘 푸딩맛집 열심히 돌아다니는데 크림 좋아하면 푸딩이 맛없기도 힘들지.. 맛있었어.. 암튼 먹으면서 생각한게 맛은있다. 인스타에서 먹스타그래머들이 찬양하던 메뉴들이 생각안나서 이름보고 땡기는대로 시켰는데 어디 얼마나 맛있나보자 이런느낌이라 ㅋㅋㅋ 화이팅! 맛있었어요 이게뭐게요 고양이가 지붕에 널부러져있어요 걸어가는거 보고 숨멎을뻔 여기.. 고양이 천국이었어,,? 이태원카패 키에리 고양이 이 친구는 키에리 안방마님인지 제일 위에서 모두를 내려다보는,,이것이 군림인가 아주 갑오즈갑 같았다 근데 너 좀 통통하더라 얘 미묘네 예쁘게 생겼어..핑크코 사진 첨부되는대로 대충 쓰는 포스팅이라 산만해서 미안한데 갑자기 근접샷이 나와서 ㅎ 근접샷을 보면 다시 먹는 기분이 난다고 해야하나 어제 진짜 몇천칼로리 순삭하고 오늘 발레하는데 엉덩이만큼 튀어나온 내 배를 보며,, 드디어 미룰수없게 다이어트해야하는 날이 왔구나,,^^ 후회는 없어요 케이크 처음 만든 사람 누굴까 작년부터 너무 궁금한데 우유로 크림 만들생각한건 누굴까 너무 맛있어 밸런스 맞추면서 먹어야하는 병이 있어요 여기가 키에리 포토존인가 채광이 예쁘게 들어와서 좋았다 다음에 이태원 갈일이 생긴다면 또 가고싶긴하다 못먹은 메뉴가 많아서 근데 예민하거나 나같은 젊꼰인 친구면 다시 생각해봐야할 것 같기두ㅋㅋㅋ 내돈내산 키에리 리뷰 끝-"
"[맛집] 한남동 부자피자, 이태원 키에리","안녕하세요! 저는 어제 한남동을 다녀왔는데요! 원래 가기로 했었던 #오로마로마로시니 #장진우쉐프 전 날 DM으로 예약했었는데 안 읽더라구요? 도착했더니 문을 닫았네 하하하 날씨는 추워졌지만 미세먼지가 없어서 쾌청하게 맑은 하늘! 요며칠 미세먼지 때문에 눈도 아프고 재채기 계속하고 아주 비염환자는 댕고생했답니다,,,, (댕 신조어 사용해보고 싶었음) 한강진 공영주차장 한강진역공영주차장 서울특별시 용산구 한남동 728-27 경기도 안산에서 출발한 저는 요즘 차끌고 서울 여기저기 다니는것을 좋아하는데요! 이태원~한남동 이쪽 운전+주차는 진짜 답이없는것같아요? ^^;;; ? 특히나 한강진역 공영주차장은 서울 시내 다른 공영주차장보다 너어어어무 비싸더라구요,,, 비싼데 다 외부고,,,,공간도 부족하고,,,, 6시간 좀 넘어서 주차했더니 3만원 넘게 나옴 후아^^..... 외제차가 너어어어어무 많아서 후덜덜 거리면서 주차했어요ㅠ 차라리 좀 더 가셔서 한남동공영주차장에 주차하는게 나을것같아요! 시설도 훨씬 깨끗하고 실내랍니다! ◆ 한강진역 공영주차장 가격정보입니다! 30분 2,400원 60분 4,800원 120분 9,600원 240분 19,200원 부자피자 1호점 부자피자 1호점 서울특별시 용산구 이태원로55가길 28 1층 부자피자 ☎ 02-794-9474 영업시간 : 11:30~22:00 한강진 공영주차장에서 걸어서 8~10분 정도 거리에 있는 #부자피자 사실 말로만 많이 듣고 딱히 가볼 기회가 없었는데 드디어 방문했습니다!!! 후후후 평일(수요일) 기준 웨이팅이 있더라구요! 운좋게 한방에 들어옴 후후 내부는 복작복작하고 아늑한 분위기라 소개팅용 장소로도 좋을 것 같아요! 저기 안쪽 화덕에서 피자가 생성되는중!!! 기본세팅...? 아쉬운점은 피클은 제공이 안되고, 각 테이블마다 페퍼론치노, 파마산치즈가 있는게 아니라 요로코롬 접시에다가 분배(?)되어서 나오더라구요 사실 첨봤음ㅋㅋㅋㅋㅋㅋㅋ 처음에 소금인줄알았쟈나여,,,,,스테이크 찍어먹는거처럼 코로나때문에 각 테이블마다 비치 안해놓으신거일까요? 상콤한 자몽에이드로 입을 축이고~~~ 주차하느라 기빨려서 쭉 들이켰더니 반이나 사라짐ㅋㅋㅋ 공포의 서울 주차여,,,,★ 드디어 나온 피자!!!!!! #부자클라시카 19,600원 루꼴라피자를 주문했어요! 상큼하면서 가벼운 피자가 땡기더라구요! 아마 루꼴라피자 유명해진게 아주 예전부터 부자피자에서 먼저 시작해서 그런것 같았는데 오히려 다른데서 많이 먹어본 루꼴라피자 드디어 부자피자에서 먹어보다....! 크게 4조각으로만 나오는데 이유가 있더라구요! 세로로 접어서 먹으면 되는데 피자 풍부한 맛 폭발! 아주 산더미처럼 쌓여진 푸름푸름 루꼴라 먹어서 건강해지는 것 같구요 ㅋㅋㅋ 도우가 아주 쫄깃쫄깃해서 확실히 일반 양식 레스토랑은 다른 레벨이다 느꼈어요 토핑도 많고 재료도 신선!!! 두번째 메뉴는 #라자냐클라시카 볼로냐 지방 스타일의 진한 미트소스가 일품이라는데요! 라자냐 위에 치즈가 아주 폭탄마냥 있는데요! 제가 라자냐를 진짜 진짜 좋아하거든요!!! 고기와 탄수화물과 토마토소스의 조합이란,,,♥ 미트가 다른 라자냐랑 다르게 더 잘 갈려져있는 느낌? 커팅되어 있는게 아니니 칼로 슥슥 잘라서 접시로 가져오면 됩니당 사진은 좀 더러워보이는데,,,치즈 흘러넘치는거 보여드릴라고 ㅎㅎ 맛있는게 느끼하지않아,,,!(피클이 있었으면 좋았겠지만) #부자피자 한남동에서 아주 오래된 맛집으로 알고 있는데 이태원쪽부터 쭉 걸어오는데 공실이 진짜 많더라구요ㅠ 여기는 오래오래 남아있었으면 하는 바램이에유,,,! 자영업자 화이팅!!!! 키에리 키에리 서울특별시 용산구 이태원로26길 16-8 1층 ☎ 02-798-3441 영업시간 : 13:00~20:00 요즘 인스타로 디저트 서칭을 많이하는데!!! 치즈케이크가 일품이라는 #키에리 왔어요! 가는길은 약간 골목쪽으로 가야하니 네이버지도 키고 가는것을 추천드립니다 케익은 정말 맛있었지만 다른 디저트 카페랑 비교했을 때 영업지침이 특이한 점을 느꼈는데요 길냥이를 돌봐주시는데 매장안까지 왔다갔다해요 고양이 무서워하는분이라면 깜짝깜짝 놀랠수도 있을것같은? 저는 넘나 좋았지만유 그리고 노키즈존! 참고하시기 바랍니다 그리고 큐알체크하고 벨을 딩동~ 하면 아래와 같은 협조문에 싸인을 합니다 부페에서는 이용시간 제한 걸어놓는것을 많이 보긴했는데 일반 카페에서는 사실 처음 봤어서 1차 당황,,,! 그리고 시간제한이 있다는 것에 2차 당황,,,!! 작은 목소리 필수 협조 동의에 싸인하는것에 3차 당황,,,,!!! 이와중에 직원분들은 친절하셔서 4차 당황,,,!!!! 하지만 프렌차이즈도 아니고 사장님이 정해놓은 매장 규칙~ 방문하는 손님이라면 리스펙!해야하는게 맞다고 생각해서 싸인하고 입장을 했습니다 평일 오후 3시 정도였는데 포장하는 손님도 많더라구요 웨이팅은 없었습니다 확실히 매장 사이즈가 작고 테이블이 옹기종기 가까이 붙어있어서 조금이라도 시끄러우면 옆에 대화도 다 들리고 울릴것같고 그런 분위기에요! 시국도 시국이니 시끄럽게 침 튀기면서 얘기하지말고 소곤소곤 조용하게 얘기를 해야겠죠? 키에리 케이크 종류에요! 의외로 메뉴가 심플해서 금방 고르겠거니 했는데 다 너무 맛있어보여서 뭘 먹어야할지 후후후 한조각씩 사서 한판으로 만들어서 수저로 퍼먹고싶다 후후후 키에리 음료 메뉴에요! 케익과 잘 어울리는 커피종류와 티, 밀크티, 에이드 종류가 다양하게 있어요 다시 보니 연잎차, 감잎차랑 뽕잎차가 아주 특이하네요? 일반 카페에서는 보기 힘든 메뉴 저는 요렇게 아메리카노와 얼그레이라벤더치즈케이크, 피넛크림초콜릿케이크를 주문했답니다 치즈케익을 2개 시키면 물릴 수도 있을 것 같아 고심끝에 초콜릿케이크를 세컨 메뉴로 주문! 결제하고 아까 작성한 협조동의문에 번호를 적어주시는데 번호 불러주면 카운터로 가서 받아오면 됩니다! 케익 가격이 비싼만큼 사이즈도 매우 BIG!!!! ㅋㅋㅋㅋㅋㅋ 보자마자 와 이거 제한된 시간내에 다 먹을 수 있을까 싶었는데 역시나 다 못먹고 포장을 했답니다 #피넛버터초콜릿케이크 엄청 단맛이아니라 초코 자체에 깊은 맛! 아래 시트는 초코 브라우니구요 오히려 초콜렛 자체 특유의 쌉싸름한맛이 났는데 그게 또 취향저격! 피넛버터때문에 고소~~~한 맛도 있고 저 크림이랑 초코가 아주아주 잘 어울리더라구요 #얼그레이라벤더치즈케이크 블랙티 안 좋아하시면 약간 낯설수도 있어요! 아래 치즈케익 당연히 엄청 꾸덕꾸덕하고 코로 숨쉬면 느껴지는 라벤더향이랑 얼그레이크림이 은근히 잘 어울리더라구요 뭔가 미국가정집 증조할머니가 만들어준 것 같은, 조상님으로부터 대대손손 내려오는 레시피로 만든것 같은 그런 맛,,,★ 나만의 상상,,,,★ 아까 케익 사이즈가 어마어마하다고 했쥬? 2명이 가시면 1개는 드시고 1개는 포장하는걸로 추천을 드려요 저도 빨리 먹는편인데 절대 2개 시간내에 못먹음,,,! 아 그리고 중간에 좀 크게 웃었었는데,,,, 바로 오셔서 조용히해달라고(^^) 부끄,,,, * 절대 무례하게 말씀 안하시고 조심스럽게 요청하셨었어요 종료시간 5분전에 자리로 오셔서 이제 시간 다 됐다고 알려주시더라구요 완전 칼같음,,,,! 직원분은 또 친절하게 조심스럽게 알려주시는데 아 사실 너무 아쉬운 시스템이더라구요 테이블 자리도 비어져있고 여유로웠었거든요 영업지침이니 어쩔수없지만 그래도 아쉬운 마음 그리고 남은거 포장하려고 했더니 포장박스비 추가로 받으시고 위생상? 비닐봉지를 주시면서 손님이 직접 가져가야한다고,,,? (먹던거라 찝찝해서 그러신건가?) 사실 이해하기 조금 어려웠어요ㅠ 비닐봉지도 세로로 길쭉한거라 케익 다 뭉개지고 움,,,,, 암튼 케이크는 정말 맛있었는데 그래서 포장손님들이 그득그득했었나~~~~~~~~~~~ 하는 생각을 했었답니다 오늘도 이렇게 한남동나들이 끗!"
