title,content
한남동카페 한남작업실 흑임자타르트 대박,"흑임자타르트 강력추천 한남동카페 한남작업실 Copyright ⓒDAILY JIMONG. All rights reserved. #내돈내산 한남동카페 '한남작업실' 영업시간 : 오전 11시 ~ 밤 10시(라스트오더 9시 30분) 주소 : 서울 용산구 이태원로55나길 7 1층 한남작업실 안녕하세요. 지몽입니다. 한남동에서 피자 먹고 티타임 가지러 카페도 다녀왔습니다. 날씨가 너무너무 더워서 멀리는 못가겠고 가까운 이태원카페로 가기로 했어요 원래 가려던 한남동 카페가 있었는데 거기가 디저트 수가 확 줄어가지고 먹을게 없더라구요..? 저는 카페를 디저트때문에 가는 편인데 종류가 한 두가지 밖에 없길래 바로 나옴..ㅋㅋㅋㅋ 그 다음 후보지였던 한남동카페 한남작업실 동생 남자친구가 전에 가보고 괜찮았다고 해서 와봤어요 근데 한남동은 경사가 왤케 심한지...... 거의 암벽등반? 수준 ...ㅎ 여기도 조금 경사진 곳이더라구요 여튼 계단을 올라가면 카페가 나옵니다 한남작업실이 수국 테라스로 유명한 곳이더라구요 야외 테라스가 인상적인 한남동카페 한남작업실 근데.. 지금은 너무 더워서 엄두가 안납니다 바로 실내로 들어갔어요 여기는 가을에 다시오는걸로 ㅋㅋㅋㅋㅋ 한남동카페 한남작업실 메뉴판/가격 메뉴판이 좀 특이하더라구요. 철판에다가 글을 써놨네 한참 휴가시즌에 갔던터라 제일 더울때 움직인 우리들ㅋㅋㅋㅋㅋㅋ 더위에 지친 우리들은 오자마자 음료부터 시키기로 했습니다 점심으로 먹은 피자가 양이 작아서 여기서 디저트도 하나 먹기로 했습니다 디저트 비주얼이 압구정 누데이크와 비슷하네요 힙한 디저트도 하나 주문해봤습니다. 가격은 크기에 비해 살벌하네요 입구에 이런곳도 있었는데 여기가 한남작업실 포토존일까요.....? 더워서 진짜 아무 생각 없이 사진만 찍고 나왔네ㅋㅋㅋㅋㅋ 한남작업실 평일 대낮이였는데 사람많았어요 사실 서울은 평일, 주말 할 것 없이 어딜가나 사람이 많아서... 이제 놀랍지도 않음 여기 인기 있는 한남동 카페인지 사람이 많더라구요 좋아 보이는 자리는 다 앉아 있어서 카운터 앞에 넓은 테이블있는 자리로 앉았어요. 카페가면 좋은자리, 좋은 포토존부터 물색하는데 여기선 살짝 포기했었음 ^^; 정말 작업실 느낌의 한남동카페 한남작업실 미술작업실 하는?? 그런 분위기의 이색카페였어요. 창원에 있는 카페와는 사뭇 다른 모습 서울은 이런 다양한 컨셉의 카페가 많아서 좋아요 올때마다 다른느낌이예요 아이스 아메리카노 \7,000 애플시나몬라떼 \8,500 밀크티 \9,000 흑임자 타르트 \9,000 주문한음료와 디저트 받았어요. 컵이 특이하더라구요. 무슨 물감통? 마냥ㅋㅋㅋㅋ 심지어 컵이 무거워요. 재질은 모르겠는데 컵이 엄청 차가워서 보냉되는 컵 같았어요 아 아이폰 사진 자동보정되서 진짜 뿌옇게 나왔네ㅜㅜ 이런 모습아니였는데.... 내가 앉은자리가 사진 잘나오는 자리가 아니였나봐요 죄다 이런 몽환적인 느낌으로 나왔네 아이스 아메리카노, 애플시나몬라떼 애플시나몬라떼 , 밀크티 음료는 아이스 아메리카노, 애플시나몬라떼 ,밀크티 시켰어요 밀크티빼고는 다 먹어봤는데 애플시나몬라떼는 시나몬 좋아하는 사람들이라면 무조건 좋아할맛 사과 청? 같은것 땜에 약간 달아요 아메리카노는 무난하게 맛있는 맛. 괜찮더라구요 ! 무엇보다 저 컵이 보냉이 진짜 잘되서 다 마실때까지 엄청 차가웠어요ㅋㅋㅋㅋ 너무 시원하게 잘 마셔서 마음에 들었어요 아 그리고 젓가락을 주셨는데, 컵 색깔에 맞춰서 주셨더라구요 이거 캐치 못했는데 친한 동생이 캐치 ㅋㅋㅋㅋ 기념으로 찍자고 블로그에 올린댔더니 괜히 얘기했다고 또시작이라고 ㅋㅋㅋㅋㅋㅋㅋㅋㅋ ^^ 갑자기 그만둔 잠탱구님 블로그 활동 다시 돌아와~~~~~~ㅠ ㅠㅠㅠㅠ내가 거의 다 키워준 블로그인데 다시 안하고 뭐하뉘 흑임자 타르트 \9,000 이거 이때까지만해도 진짜 별생각 없었어요. 비주얼은 그저 그랬었는데 먹기전까지 엄청난 디저트인줄 상상이나 했겠음 ... ?🤔 디저트 비주얼이 진짜 압구정에나 있을 것 같은 타르트였어요ㅋㅋㅋㅋㅋ 칼로 반 잘랐는데 안에 크림 크림치즈급으로 굉장히 꾸덕했었음ㅋㅋㅋㅋ 그냥 진짜 대박... 너무너무너무 맛있었어요. 많이 달아서 약간 호불호있을 것 같긴한데 단것 좋아하는 저로써는 최애 디저트 ...🩷 입맛이 확도는 맛이였어요. 너무 맛있었음ㅋㅋㅋㅋㅋㅋ 타르트지는 눅눅할 줄 알았늗네 생각보다 바삭하더라구요 안에 흑임자 크림이 앙금수준으로 꾸덕해서 치아에 잘 묻긴한데 너무 맛있어요. 강력추천 ! 크기에 비해 가격은 비싼 것 같아요 타르트는 넘나 내스타일이라서 남은거 제가 해결 🩷 여기 있다가 파이브가이즈 버거 먹어야한다고 ㅋㅋㅋㅋㅋㅋ 애들 자제함.... ☺️ 덕분에 개이득 나가기 전에 찍은 포샷 내가 너무도 애정하는 아이들 💕 오래가자 얘드라 ❤️ 동생 남자친구가 저랑 입맛이 비슷해서 추천하길래 믿고 와본건데 역시 잘맞아 ㅋㅋㅋㅋㅋㅋ 꽤나 만족스러웠던 이태원카페 한남동작업실! 이런 곳이 있었다니👀 그동안 이태원 한남동은 자주 왔었는데 이런 한남동카페가 있는줄은 몰랐네요 이미 인기 좋던데 난 왜 몰랐을까 ~.~ 디저트도 내스타일이고, 재방문 의사 있음! ▼한남동맛집 부자피자 후기▼ 한남동맛집 부자피자 1호점 웨이팅, 테이블링 예약, 메뉴 웨이팅, 테이블링 예약, 메뉴 한남동맛집 부자피자 1호점 Copyright ⓒDAILY JIMONG. All rig... blog.naver.com ▼ 강남역 파이브가이즈 버거 후기▼ 파이브가이즈 강남 평일 웨이팅, 추천메뉴, 가격 어마어마한 웨이팅, 추천메뉴, 가격 파이브가이즈 강남 Copyright ⓒDAILY JIMONG. All right... blog.naver.com 한남동카페 한남작업실 재생 1 좋아요 0  접기/펴기 이태원 한남동카페 한남작업실 #한남동카페 #한남작업실 #이태원카페 #한남동감성카페 50m © NAVER Corp. 한남작업실 서울특별시 용산구 이태원로55나길 7 1층 한남작업실"
한남동 카페 : 한남작업실 (내돈내산),가을의 정취를 느낄 수 있는 서울 테라스 카페를 찾다가 발견한 한남동 카페 한남작업실 올라가는 계단부터 초록초록한 것이 벌써 맘에 듦 나무 아래에 위치한 야외 테라스석도 있고 탁트인 창문 바로 옆 창가좌석도 있음 창가에는 2-3인석만 있는게 아니도 5인까지의 단체석이 있어서 푸릇푸릇한 야외 바라보며 단체모임 가능 창가에서 바라본 한남동 골목길.jpg 실내에도 좌석이 꽤나 많았는데 2인 테이블이 여기저기 있고 8명은 거뜬히 앉을 수 있는 긴 테이블이 있어서 혼자서 노트북 작업하는 손님도 둘이 와서 대화를 나누는 손님도 모두 어우러지던 부분 한남동 카페 한남작업실 메뉴판 커피는 대략 아메리카노 7천원 라떼 7.5천원 그 외에 티랑 에이드 종류가 꽤나 많아서 카페인 피하는 사람에게 고르는 즐거움을 주던 곳 애플시나몬티 9천원 복숭아 에이드 9천원 디저트도 소담스럽게 전시돼있음 흑임자가 시그니처인지 흑임자 양갱 흑임자 타르트 흑임자 크림 케익까지 흑임자가 들어간 먹을 거리가 많았고 그와중에 여기 아톰이 지배하는지 눈을 두는 모든 곳에 아톰이 있음 동상이몽 아톰 황금 아톰 일렬횡대 아톰 바이크 타야되는데 카페에 불시착한 것 같은 아톰까지 여기가 바로 월드 오브 아톰 그리고 수령한 한 상 차림 세상 정성가득한 한 상 저렇게 케이크를 상전모시듯 서빙해주는 곳은 또 처음 식기류도 신경 엄청 썼다 싶었던게 포크 하나 달랑 주는게 아니고 나무로 된 나이프와 젓가락을 줘서 나이프로 슥슥 자른다음 젓가락으로 집어 먹는 시스템 그리고 이 유니크한 그릇과 식기류는 한 켠에서 판매중 아이스 애플 시나몬티를 마셨는데 수정과에 사과의 단맛을 즙짜서 추가한 맛 흑임자 크림케이크는 리치하지 않은 크림치즈에 흑임자 특유의 고소한 맛이 곁들여져서 달달한 애플시나몬티랑도 잘 어울렸고 아아랑 먹어도 잘 어울렸겠다 싶었던 맛 이 날의 목표가 연차를 완전히 누리자는 미명하에 선선한 가을바람 느끼며 ✔️ 케이크와 음료 쫍쫍대면서 ✔️ 시간 가는 줄 모르게 소설 읽는 거였는데 ✔️ 세 개 다 미션 클리어 데이트하거나 친구들끼리와서 대화하는 손님도 많았지만 나처럼 혼자와서 독서하거나 노트북으로 작업하는 손님들도 꽤나 많았어서 한남동에서 혼자 시간 보내기에 좋았던 카페 날이 더 오들오들 추워지기 전에 책 하나 들고 테라스로 재방문하고 싶은 곳 + 화장실 카페 내부에 (남녀분리 / 깨끗) 50m © NAVER Corp. 한남작업실 서울특별시 용산구 이태원로55나길 7 1층 한남작업실 #한남작업실 #한남동카페 #이태원카페 #한남동테라스카페 #이태원테라스카페
"한남동카페추천, 한남작업실 재방문후기","2023.7.8. 한남동 한남작업실 재방문 1년만에 재방문한 한남작업실! 카페들이 워낙 다양하니 재방문한다는것 자체가 드문일인데 기억이 좋았어서 오랫만에 다시 들러봤어요~ 날 좋은날 한남동데이트~한남작업실 2022.05.15. 한남동 한남작업실 한남동 데이투하러 느긋하게 나가서 오아시스 가보려다 대기가 역시 많아서... blog.naver.com 첫방문때 후기는 요기! 이때는 날씨가 더 시원하고 좋았어서 테라스석에 앉았던 날~ 영업시간 연중무휴 오전 11시~오후 10시 라스트오더 오후 9시 30 단체석 가능⭕ 포장 가능⭕ 반려동물 가능⭕ 주차 가능⭕ 발렛파킹인점 유의 저희는 카페만 들렸다 갈꺼라 근처에 잠시 골목주차했어여 실내로 자리할까 실외 테라스석으로 할까 고민고민 푸릇푸릇한 자리에서 사진 먼저 찍어보구여~ 기부니가 매우 좋았던것 같은 낰ㅋㅋㅋ 근데 역시 너무 덥다 더웡 7월초에 야외자리 앉기는 힘든것 같쥬? 얼른 투샷셀카만 남기고 실내로 도망~ 수박쥬스 9,000원 살구에이드 9,000원 더우니까 시원한 과일맛들이 땡겼어여~ 카페인도 안먹을겸 힛 얼음소리만 들어도 캬하 시원! 동으로 된 잔이라 더 차가운 느낌 여름에 수박쥬스는 거의 실패불가! 전 제가 주문한게 더 맛있었어영 오빠가 주문한 살구에이드는 톡톡 탄산과 살구가 아주 상큼하니 청량감 퍽발~ 주차한 곳은 알고보니 옆건물과 통로가 이어져 있었구요.. 한바퀴 돌아온 우리는 빵터지구 빠른 귀가에 즐거워짐 날 선선하고 햇살 좋을때 한남동에 테라스 있는 카페 찾으신다면 한남작업실 추천해봐용 실내에 창가자리고 인기에여~ 50m © NAVER Corp. 한남작업실 서울특별시 용산구 이태원로55나길 7 1층 한남작업실"
이태원 한남동 카페 한남작업실 허명욱 작가 옻칠,"안녕하세요, 쮜여사입니다. 바로 어제 친한 언니가 이태원 나들이를 제안했고 언니가 꼭 찍어 둔 편집샵, 맛집, 카페를 거치며 감각기관 제대로 호강하는 시간을 가졌어요. 대부분의 시간을 회사 주변 또는 서식지에서 보내기에 이태원 출격은 너무나 흥미진진했으며 오랫만에 이태원 카페에서 여유로움을 만끽했습니다. 한남작업실 50m © NAVER Corp. 한남작업실 서울특별시 용산구 이태원로55나길 7 주소: 서울 용산구 이태원로55나길 7 전화번호: 050-71320-5620 영업시간: 11:00~22:00 주차: 발렛서비스 조만간 소개할 퓨전 중식 맛집 닷츠에서 신박한 메뉴를 한껏 섭취한 다음 언니가 바로 건너편 카페로 고고씽을 외쳤는데 쮜여사는 그저 그녀의 계획에 발만 담근 상황이라 어떤 카페인지도 모른채 그냥 들어갔습니다. 돌계단을 하나씩 하나씩 오를수록 미지의 공간이 드러나기 시작했고 초록 식물로 채워진 정원은 자연친화적인 감성이 지배적이네요. 사실 싱그러운 풀내음과 찬란한 햇살을 누리는 테라스 자리에 앉고 싶어지만 후덥지근한 날씨에 3초 고민끝에 안으로 들어갔습니다. 매장 내부는 전반적으로 깔끔하고 모던한 느낌이며 각기 다른 모양과 색을 지닌 테이블로 믹스 앤 매치를 이루고 있더라구요. 게다가 한남작업실이라는 상호처럼 매장 군데 군데 작업 도구들이 진열되어 있어 마치 누군가의 작업실에 놀러온 기분도 들었습니다. 매장 이곳 저곳을 둘러보다가 아톰이 줄지어 놓여있는 진열장으로 눈길이 갔어요. 일본을 대표하는 캐릭터 1952년생 아톰은 텐마 박사가 죽은 아들을 대신해 만든 로봇으로 악으로부터 세상을 구하는 영웅이었으며 어린 시절 즐겨 본 만화영화 중 하나였습니다. 너무 깜찍해 소장하고 싶을 정도였는데 아톰 조형물에 칠해진 것이 단순한 물감이 아니라 옻칠이라고 언니가 알려주었어요. 내가 알고 있는 옻칠은 좀 옛스러운 느낌 쪽이 강했는데 이 날 마주한 작품들은 매우 감각적이고 옻칠에 대한 선입견을 깨버리는 계기를 제공했습니다. 검색을 통해 이태원 카페 한남작업실은 허명욱 작가님의 작품세계를 엿볼수 있는 공간임을 알게 되었어요. 사진가, 금속공예가, 화가, 설치미술가 이렇게 다양한 재능을 지닌 분이지만 스스로 그냥 작업하는 사람이라 칭하고 있으며 옻을 물감 삼아 다양한 작품활동을 펼치고 계신다고 합니다. 알록 달록한 컵은 색감도 곱고 단아했으며 은연중 우리네 전통스러운 느낌이 감돌아 신구의 적절한 결합이 아닌가 싶었구요. 이태원 카페 메뉴로는 커피, 티, abc 에이드 수박주스, 살구에이드 등이 있지만 작가님 이니셜을 따서 만든 1인 1.5만원 셋트에 관심이 쏠렸습니다. 음료와 함께 6가지 구움 과자를 판매중이었는데 우리는 셋트와 그 중 보늬밤 말차케이크를 선택했어요. 개방형 매장 안에서 가장 은밀한 공간으로 진입했으며 여러 버전의 아톰과 마주할 수 있었습니다. H.M.W 셋트(15,000원) 흑임자 티그레, 과일, 아메리카노로 구성된 세트로 포크가 아닌 옷칠한 젓가락을 사용한다는 점이 색달랐어요. 세트에 등장한 식기 모두 작가님의 작품으로 고급지고 단아한 느낌이 강했습니다. 뜨거운 아메리카노 또는 아이스 아메리카노 중 선택이 가능했으며 아아인 경우 얼음이 담긴 컵에 샷을 스스로 투입시키면 됩니다. 보늬밤 말차케이크(6,000원) 밤의 존재는 눈으로 확인 못했지만 진한 말차의 깊은 내음은 입 안을 지배했어요. 고소한 흑임자 티그레도 부드럽고 촉촉했으며 너무 금새 사라진 것 같아 여운이 남았습니다. 과일 대표로 나온 자몽은 달콤한 코팅으로 인해 특유의 쌉싸르함이 감소된 상태였으며 옻칠한 그릇 위에서 반짝 반짝 빛나는 듯 보였어요. 이태원 카페에서 허명욱 작가님의 작품을 만끽할 수 있어 즐거웠으며 옻칠에 대해 새로운 시각을 가지게 되는 의미있는 시간이었습니다. 모두 맛점하세요~☆ #이태원카페 #한남동카페 #한남작업실 #허영욱작가 #이태원핫플 #한남동핫플 #이태원데이트 #한남동데이트 #옻칠"
[서울 한남동] 한남작업실,"안녕하세요~ 해삐 주말이에요🫶🏻 오랜만에 서울 카페 가져왔어요 크크 50m © NAVER Corp. 한남작업실 서울특별시 용산구 이태원로55나길 7 1층 한남작업실 이태원역과 녹사평역 사이에 위치한 한남작업실! 매일 11:00-22:00 (라스트오더 21:30) 연락처: 0507-1320-5620 가을에 너무나 어울리는?! 외관 모습🤎 상당히 힙한 간판이에요,,,!!! 올라가볼께요~ (그냥 괜히 찍어보았습니다 크크💚) 매장 내부 모습이에요! 이날은 10월 초라 날씨가 정말 좋았어요~ 모두 테라스 시즌을 만끽하는 모습이었어요💚 메뉴판이에요!! (가격대는 좀 있더라구요~) 아톰에 상당히 진심인 인테리어! 야외에도 좌석이 많았어요~ (좀만 천천히 와줘라 겨울아,,,🥹🥹🥹) 뭔데 이렇게 예쁘게 나올 일이냐구요💙 인스타 각도로도 찍어보았습니다 히히 이때만 해도 장염이라ㅎㅎ노커피😰 애플시나몬티 진짜 사과가 씹히더라구요!!! 덕분에 넘 맛있게 먹었답니다~🫶🏻 레몬케이크도 넘 상큼하고 버터바도 달달&꾸덕! 더 추워지기 전에 어서들 다녀오세요🥰 #한남작업실 #한남동 #이태원 #녹사평 #카페 #카페인테리어 #테라스 #가을 #한남동카페 #이태원카페 #데이트 #데이트코스 #한남동데이트"
한남동 테라스 카페 한강진역 한남작업실,일교차가 심하지만 요즘 낮에는 햇살이 너무 좋죠!! 이런 날씨에 테라스 카페를 찾게되는데 좋았던 한강진역 테라스 카페 한남작업실 소개해 봐요 가정집을 개조해서 만든 것 같은 한남동 카페 한남작업실 입구에 입간판이 놓여있고 계단을 올라가면 매장이 나와요 계단을 올라가면 테라스가 먼저 나오는데 이렇게 큰 테이블이 하나 놓여있어요 사람이 많으면 같이 앉아야하는게 좀 그렇지만…ㅋㅋ 한 쪽엔 이렇게 둥근 테이블도 있어요 일단 테라스 자리를 잡고 주문을 하러 안으로 들어갔어요 이렇게 예쁜 컵들이 진열되어 있었는데 이건 허명욱 작가님의 작품이라고 해요 작가님의 한남작업실인가봐요 색감이 참 예쁘죠 커피 뿐만 아니라 디저트도 판매하고 있는데 흑임자 메뉴가 있어서 할매입맛 빵순이 취향저격이었어요 한 쪽 공간에는 영상과 작품도 놓여있었는데 아마 작가님이시겠죠? 반짝 반짝 예쁘다- 내부에도 테이블이 놓여있어요 하지만 테라스 좌석 놓칠 수 없어 ㅠㅠ 소중한 이 계절 색색의 컵이 예뻐서 계속 찍어봤어요 그리고 테라스로 나가는 길 손 씻는 공간도 따로 마련되어 있어요 잠시 뒤 등장 한 한남작업실의 음료와 디저트 민트색 쟁반에 디저트 놓은 트레이까지 마음에 쏙 들었어요 일단 예뻐서 사진 열심히 찍기 ㅋㅋ 여긴 디저트를 주문했더니 신기하게 젓가락을 주더라고요 옆에서 보면 디저트 트레이가 이렇게 생겼어요 젓가락도 알록달록해요 햇살 받아서 사진도 잘나와요 아이스 아메리카노와 다른 음료도 있어서 커피 안 먹는 사람들이 가기 좋아요 이리저리 사진 엄청 찍었어요 ㅋㅋㅋ 빛 받으면 더 반짝이는 컵 음료 먹고 디저트도 먹어봤어요 반을 잘라보니 안에도 꽉 차있죠 적당히 달달하고 고소한 흑임자 디저트 아메리카노랑 찰떡궁합이었어요 저는 봄 시즌에 가서 나무가 푸릇푸릇해요 햇살 좋아서 사진 찍기도 좋아요 ㅋㅋ 한남동에서 맛있는 커피와 디저트를 즐길 테라스 카페를 찾는다면 한남작업실 가보세요! 50m © NAVER Corp. 한남작업실 서울특별시 용산구 이태원로55나길 7 1층 한남작업실 내돈내먹 후기 끝
