title,content
타르틴 베이커리_한남동맛집,"타르틴 베이커리 서울 용산구 한남대로18길 22 매일 10:00 - 21:00 02 792 2423 50m © NAVER Corp. 타르틴 베이커리 한남점 서울특별시 용산구 한남대로18길 22 예약 안녕하세요 낭소티입니다 :) 저번 포스팅에 이어 빵지순례 2번째 빵집입니다 ㅎㅎ ✔️ 오늘의 포스팅 순서 1. 타르틴 베이커리 한남점 위치 2. 빵 종류 / 브런치 3. 사워도우 (+아이스 아메리카노) 4. 전체적인 후기 1. 타르틴 베이커리 한남점 위치 타르틴 베이커리 한남점은 한남역, 한강진역과 그나마 가까워요 지난번에 포스팅한 '아티장 베이커스' 바로 옆에 있어요 2. 빵 종류 / 브런치 평일 오후 12시쯤 방문했어요 사람들은 많지 않았고 빵 종류도 다 남아있었어요 매일 오전 10시부터 오후 4시까지 다양한 브런치 메뉴들도 있어요 브런치 메뉴들 정말 다양하더라구요! 브런치메뉴 중 사워도우 1/4 + 버터 가격은 7.000원이에요 사워도우 1/2도 가격은 7000원! 하지만 버터는 포함되어있지 않아용 월넛 사워도우를 먹어보고 싶었는데 이 날은 없다고 하셨어요 ㅠ_ㅠ 그래서 기본 사워도우 1/2 와 커피를 주문했답니다 3. 사워도우 (ft. 아이스 아메리카노) 사워도우 (sour dough) 산성반죽이라고도 하는 사워도우는 독특한 풍미가 있어 특히 호밀빵을 만들 때 필요한 반죽이다. 신맛의 주성분은 젖산균과 초산균이 만드는 젖산과 초산이다. 출처: 네이버 식품과학기술대사전 먹고간다고 하니 먹기 좋게 잘라주셨어요 안이 엄청 쫄깃 촉촉 해보이죠? 사워도우도 처음 먹어봤어요 ( 거의 모든 빵이 처음... ㅎㅎ ) 산성반죽이라고 해서 시큼한 맛이 특징인데 저에게는 굉장히 부담스러운 맛이였어요 ㅎㅎ 겉은 딱딱하고 속은 엄청 촉촉쫄깃해요 먹을 수록 시큼한 맛이 적응이 되기는 하는데 저에게는..... 다시는 찾지 않을 맛...ㅎㅎㅎ 타르틴 베이커리 한남점의 커피는 맛이... 없어요.... ㅠ_ㅠ 너무 연하기도 하고 특색없는 원두맛에 가격도 착하지 않아요 커피 실망 🥲 4. 전체적인 후기 사워도우 맛집? 나는 모르겠다 사워도우 맛집이라고 다들 그래서 가봤는데 빵린이(?ㅋㅋㅋ)인 저는 잘 모르겠어요... 사워도우는 시큼한 맛의 독특한 풍미로 먹는다고 하는데 저는 잘 모르겠어요... 하지만 식감은 좋았어요 사워도우 좋아하시는 분들에게는 추천! 처음 맛보시는 분들에게도 1/4 크기로 드시는 거 추천! 천고 높은 분위기 좋은 실내 마음에 들었던 카페 내부 2층 자리가 정말 아늑하고 좋았어요 천장도 높고 데롱데롱 달려있는 조명들도 예쁘고 천장의 창문으로 비치는 하늘이 보기 좋더라구요! 여기ㅣ까지 타르틴 베이커리 한남점 후기를 마치겠습니다 :)"
[한남동 카페] 타르틴 베이커리 한남점,"타르틴 베이커리 한남점 2020.03.22 오랜만에 만난 언니랑 첫번째 장소는 타르틴베이커리 한남점. 둘다 한남동은 먼편이여서 큰맘 먹고 와야하는 곳ㅋㅋ 1층은 스탠딩 좌석과 큰 쉐어테이블이 있었다. 생각보다 내부가 협소한 편인듯? 베이커리 굽는 공간으로 빵냄새가~~ 원래 샌드위치가 먹고 싶었는데 고수가 있다는 말에 패스.. 고수 싫음😑 다른 베이커리점에서는 보지 못한 다양한 베이커리들이 있었다. 비쥬얼 좋은 케이크, 에끌레어도 있고~ 샌드위치 말고도 간단하게 식사 할 수 있는 브런치 메뉴도 있음! 베스트 메뉴 이기도 하고 궁금했던 메뉴 중 하나! 선물용으로도 좋을꺼 같은 쿠키류도 판매하고 있고! 메뉴 정보 브런치 메뉴도 다양하고 베이커리와 어울리는 커피와 티 종류가 꽤 있었던편. 1층 내부 한켠에 있던 타르틴 굿즈. 알록달록하니 시선 강탈😍 토트백도 귀여운거 같아서 혹 했다 정신차리기 ㅎㅎ 알록달록하니 엽서도 이뿜~ 잠깐 자리 비여서 찍어본 2층 창가 자리. 언니가 먼저 도착해 우리는 2층 바테이블에 자리잡았다. 시야가 확 트여있어서 개인적으로 여기 자리가 제일 좋운거 같음. 너무 늦게 포스팅 올리는 바람에 이름 까먹은 요 베이커리.. 크림이 들어가있고 겉은 바삭 속은 뻑뻑(?) 했던 다음에는 다른 빵을 선택할꺼 같읂ㅎㅎㅎ 언니가 아직도 나한테 사진 찍는 열정 대단하다고 햇다^^;; 생각보다 사진에 잘 안 담기는 한상😭 따듯한 아메리카노 5.0 콜드블루 5.0 에그샌드위치 8.0 이름 모를 빵 ??? 비쥬얼만 봐서는 구냥그런 에그샌드위치~ 과연맛은 빵이랑 계란이랑 베이컨까지 함께 먹어야 맛난다 ㅎㅎㅎ 베이컨의 짭쪼롬함이👍🏻 빨간 소스랑 감자튀김은 별로.. 넘나 먹기 힘들ㅎㅎㅎ... 먹기 좋게 짤라준 언니 다른 포스팅을 보니 더 맛있는 베이커리가 많은거 같음! 우리가 시킨 2메뉴는 구지 안 시켜봐도 될꺼 같음 ㅎㅎㅎㅎㅎ 50m © NAVER Corp. 타르틴 베이커리 한남점 서울특별시 용산구 한남동 263-2 예약 *영업시간* 매일 09:00 - 21:30 #한남동카페 #한남동베이커리 #후암동카페"
한남동 카페 타르틴베이커리 한남점,"한남오거리쪽에 있는 타르틴 베이커리 한남점에 다녀왔어요 전에 도산공원점갔다가 사람이 너무 많아서 토할뻔 했는데 한남점은 도산공원점에 비해서 공간도 작고 사람도 없을 것 같아서 갔는데 사람이 많더라구요........ 외관이 역시 멋진 타르틴베이커리 발렛 주차도 된다고 해요 가격은 3,000원 2층 건물이고 천장이 높고 큰 조명이 달려있어서 분위기가 정말정말 예뻐요 위치때문인지 가격은 비싼편이구요 ㅠㅠ 그치만 저는 빵순이니깐 맘껏 고를거에요!! 홀케이크 주문도 받고 있어요 다음에 부모님 생신때 구입해볼까 생각하고 있어용 케이크종류도 많고 빵종류도 많은데 오후에 가서 그런지 종류는 많이 없었어요 저희가 사진보고 먹고 싶었던 빵이 하나도 안보여서 조금 실망.. 그래서 베스트셀러라고 써있는 빵들 위주로 고른 것 같아요 타르트 먹어봐야된다고 해서 가운데 있는 코코넛크림타르트 골랐어요 9.5 바나나크림타르트가 유명하다고 했는데 없더라구요 사실 저는 바나나맛나는거 싫어해서 다행이었어욬ㅋ 타르틴베이커리에서 꼭 먹어봐야한다는 샌드위치도 베스트셀러로 골랐어요 타이레드커리치킨샌드위치 12.0 아몬드크로와상도 고르고.. 6.2 2층으로 올라가는 계단에 바나나크림타르트 포스터도 붙어있는데 포스터가 예뻐서 갖고싶더라구요,, 1층이 넓은데 2층이 분위기가 더 예뻐서 저희는 2층에 앉았어요 지붕모양이랑 큰 창문이랑 조명이 너무 예뻐서 계속 두리번두리번거리면서 구경했어요 언니가 주문한 카페라떼랑 아닌가.. 바닐라라떼인가 제가 주문한 복숭아에이드 너무 더워서 안섞고 그냥 마셨다가 복숭아원액 빨아들였어요 ㅋㅋㅋㅋㅋㅋㅋㅋㅋㅋㅋㅋㅋ 코로 나올뻔.. 빵은 저희가 잘라먹으라고 칼이랑 포크를 주고 저희는 빵자르다가 너무 힘들었어요 ㅠㅠ 빵이 다 너무 딱딱해요 ㅠㅠ 포크가 플라스틱인데 빵에 포크가 안들어갔어요 ㅋㅋㅋㅋㅋㅋㅋ 그래서 손으로 먹었어요 화장실이 바로 옆이라 깨끗이 손씻고.. 제일 먼저 먹은 샌드위치는 제일 딱딱했어요 맛있었는데 예상치못한 고수가 듬뿍 들어있어서 빼고 먹었어요 고수먹기 또 도전해봤는데 또 실패.. 제일 맛있었던 아몬드크로와상 크기도 엄청 크고 엄청 바삭바삭해서 언니랑 저랑 둘 다 제일 맛있게 먹었어요 마지막으로 먹은 코코넛크림타르트는 언니가 못먹겠다고 포장해가라고 했는데 집에 가면 안먹을 것 같아서 그냥 먹어봤거든요... 저는 코코넛좋아해서 맛있엇는데 조금 느끼해서 그런지 많이 못먹고 거의 남겼어요 근데 좀 지난 후에 생각나는 맛이에요 다음에 또 가면 또 시킬수도 있을 것 같은데 잘 모르겠는 맛 ㅋㅋㅋㅋㅋㅋ 저희가 있는 동안에 포장손님이 꽤 많이 오시던데 대부분 주민인것 같았어요 부럽더라구요 ㅋㅋㅋㅋㅋㅋㅋㅋㅋㅋㅋ 50m © NAVER Corp. 타르틴 베이커리 한남점 서울특별시 용산구 한남대로18길 22 예약 + 영업시간 매일 9:00 ~ 21:30"
한남동카페_ 브런치가 맛있는 타르틴베이커리(TARTINE),"한남동카페 - 브런치가 맛있는 타르틴베이커리 (TARTINE) 롬이가 브런치 먹으러 자주가는 단골 카페라며 타르틴베이커리에 데리고갔다. 타르틴베이커리 브런치가 다 존맛이라며 브런치 매뉴 한개씩 다 먹어보면서 도장깨기를 한다고 했음,, ㅋㅋㅋㅋㅋㅋㅋ 빵순이 롬이 얼마나 맛있길래 저러나 싶었고 계속 듣다보니까 타르틴베이커리 브런치 맛이 궁금해졌다 : ) 위치 타르틴베이커리는 한남오거리쪽에 위치해 있었다. 지하철 타고오면 한남역에서 도보 13분, 버스를 타고 온다면 순천향대병원 정류장에서 도보 6분 거리! 타르틴베이커리에 가는데 비가 엄청와서 신발이랑 양말이 다 젖어버렸다,, 넘나 찝찝 ㅠㅠ 드디어 도착..!! 타르틴 베이커리는 복층이라서 천장이 높았고 엄청 넓어보였다. 한쪽 공간에서는 바리스타가 커피를 만들고 다른 공간에서는 제빵사가 빵을 만들고 있었다. 오픈된 공간이라서 구경하기에 좋았음! 크로와상에 크림 올려주는거 넘 귀여웠다 ㅠㅠ 타르틴베이커리 한남점은 조명이 원형이라서 심플하면서 귀여운 느낌! 1층에 사람이 많아서 2층으로 자리를 잡았다. 2층에서 내려다 본 1층 뷰 : ) 타르틴베이커리 한남점에 1시반쯤 도착했는데 사람들이 적당히 있어서 여유있고 굿굿! 타르틴 브런치 메뉴! 타르틴 브런치 메뉴가 한눈에 보기 쉽게 그림으로 표현해놔서 좋았당 : ) 롬이가 타르킨베이커리에서 브런치 메뉴 도장깨기를 하는데 프렌치토스르랑 그릴키즈 샌드위치?랑 그릴치즈 토마토 샌드위치?를 먹어봤다고해서 롬이 안먹어본 브런치 메뉴인 차돌박이 반미 샌드위치로 결정! 메뉴 결정하고 빵 구경하기. ㅋㅋㅋㅋㅋㅋ (빵도 맛있다고해서 집갈때 사갈 생각했는데 급하게 나가다가 까먹어버림,,,ㅎㅎ) 차돌박이 반미 샌드위치가 앞에 있길래 바로 가지고 왔음! ㅋㅋㅋㅋㅋㅋ 차돌박이 반미 샌드위치 14,000 아아 5.5 *2 샌드위치는 2개를 주문하면 양이 많고 2인이서 한개를 나눠 먹으면 딱 좋다고 해서 차돌박이 반미 샌드위치랑 아아 두잔을 주문했다. ㅋㅋㅋㅋㅋ 타르틴베이커리에서 파는 케익도 맛있을 것 같았다. 다 맛있다고해서 진짜 한개씩 다 맛보고 싶었음,,, ㅋㅋㅋㅋㅋㅋㅋㅋ 타르틴베이커리 한남점의 깔끔한 우드톤의 인테리어가 넘나 감성적이었다 ㅠㅠ 포스터도 너무 귀엽고 난리 ㅠㅠ 타르틴베이커리는 천장도 감성적..!! 드디어 우리가 주문한 차돌박이 반미 샌드위치와 아아 두잔이 나왔다..!! 배고파 죽는 줄,,,ㅠㅠㅠ 주문한 샌드위치랑 커피 나오자마자 일단 사진부터 찍기 ㅋㅋㅋㅋㅋㅋㅋ 컵에 있는 로고가 넘 귀여웠다. 찍고 또 찍고 ㅋㅋㅋㅋㅋㅋㅋ 나 같은 애 한명이 함께해서 덜 민망했음,,,ㅎㅎㅎ 차돌박이 반미 샌드위치의 빵은 겉바속촉이었는데 빵이 엄청 쫀득해서 맛있었다. 그리고 안에는 차돌박이랑 오이,당근 등이 많이 들어가있었는데 고수....도 들어가있었다. 차돌박이 반미 샌드위치 안에 고수가 들어있을 줄은,,, 생각도 못해서 먹다가 좀,,,놀랬음,,, 근데 생각보다 고수맛이 안나서 그냥 먹었는데 맛있었다. ㅋㅋㅋㅋㅋㅋㅋㅋㅋ 원래 고수 한번 씹기만해도 입이 그대로 멈추고 뱉어버리는데,, ㅋㅋㅋㅋㅋㅋㅋㅋ 이상하게 차돌박이 반미 샌드위치 안에 들어간 고수는 먹을만해서 놀랬다,,, 그래서 고수랑 함께 싹 다 먹었음,, 롬이는 고수 다 빼고 먹고,,, ㅋㅋㅋㅋㅋㅋㅋ 고수 싫어하는 사람은 참고...!! 타르틴베이커리의 커피는 맛있었는데 양이 너무 적었다. 마시다보니 좀 부족했음,,,ㅠㅠ 타르틴베이커리의 조명이 너무 귀여움ㅠㅠ 타르틴베이커리 한남점은 복층이라 시원하게 뻥 뚫린 느낌이라 좋았고 차돌박이 샌드위치랑 아아가 맛있어서 다음에는 다른 브런치를 먹으러 오고 싶었던 곳이었다. ㅋㅋㅋㅋㅋㅋㅋ 다음엔 프렌치토스트 예약..!! ㅋㅋㅋㅋㅋㅋㅋㅋㅋ 맛있는 브런치를 먹고싶다면 타르틴베이커리 한남점 추천! 타르틴베이커리 한남점 영업시간_ 매일 10:00 - 19:00 휴무_ 10월 1일 추석 번호_ 02-792-2423 주소_ 서울특별시 용산구 한남대로18길 22 방문날짜_ 210403(토) 50m © NAVER Corp. 타르틴 베이커리 한남점 서울특별시 용산구 한남대로18길 22 예약"
"타르틴베이커리 / 한남동베이커리카페, 한남동카페 (tartine)","점심먹구 타르틴베이커리 한남점으로 이동했어요 슝슝 이동은 택시로 했습니다 차없이는 불편한 한남동라이프 도산공원점도 한남점도 이미 유메이하네요 타르틴베이커리 🍞🥖🥯🥨🥞🧇🥐 맛있는빵들이 많-이 있어요 씬나 크루아상부터 픽 4.6 ✔️ 힙한느낌의 @타르틴베이커리 타르틴베이커리의 1층 안쪽에는 베이킹클래스를 할 것만 같은 예쁜 공간이예요 💙💙 화장실도 1층에 위치하고있어요 통유리로 되어있어서 밖이 잘 보여서 좋았어요 타르틴베이커리의 케이크메뉴 선물용 쿠키도 너무 고급지고 예쁘네요 🍪🍪🍪 코히는 아아로 셋다 통일해요 5.5 ✔️ 타르틴베이커리니까 타르트를 먹어줘야겠다는 생각뿐 🥧🥧🥧 베스트셀러이자 시그니처메뉴인 바나나크림타르트 9.5 ✔️ 선배인죄로 제가 사기로해요 거절을 모르는 애들 아주 잘 키웠어요 😊😊 주문한 음료와 타르트 크로아상 기다리면서 구경해요 🧡🧡 2층으로 가는 계단 타르틴베이커리 타르틴베이커리서울 타르틴한남 타르틴커피 다 태그해줄궤 빵구경 더하다가 진동벨울리자마자 받고 2층행 자리는 많았지만 보시는 것 처럼 갬성카페 느낌은 아니예요 그냥 베이커리카페 느낌이랄까 인스타갬성 풍기는 화이트톤의 테이블 아니고요 심플한 기본템 테이블느낌 아아 세잔 쪼르르 ☕️☕️☕️ 크루아상 🥐 바나나크림타르트 🍌 제일 기대했던 바나나크림타르트예요 시그니처메뉴이기도하고 베스트셀러이기도 한 타르틴베이커리의 대표작 하지만 배가불렀는지 존맛까지는 아니고 그냥 먹을만 했다는 보짱이의 평이 이어졌고요 이어서 후배님들은 맛있다고하네요 얻어먹는거라 맛있나요 크루아상도 그저그랬던 실망이 큰 타르틴베이커리 뒷배경은 참 맘에들었어요 일단 지붕모양이 맘에들었고 저 땡글땡글 조명이 귀엽고 느낌있어요 💡💡💡 @조명사랑 이 집 등맛집, 조명맛집 참 이뿌죠 소품들도 팔고있네요 한남동 베이커리카페 @타르틴베이커리 기다리는동안 찍어준 사진들 머리색 무엇 계속봐도 적응못하는 나 @라떼녀 젊은피들과 만나니까 핫플도 가고 조쿠나 호호 타르틴베이커리 넓어서 좋았어요 천장도 높아서 더 넓은느낌을 주는 것 같아요 나중에 배 안부를때와서 시그니처메뉴 재도전해야게쒀요 100만장 찍은 셀카중에 베스트컷으로 마무리하며 타르틴베이커리 포스팅 마칠게요 (제 입맛에는) 쏘쏘였던 @타르틴베이커리 한남점 50m © NAVER Corp. 타르틴 베이커리 한남점 서울특별시 용산구 한남동 263-2 예약 (한남역 1번출구에서 708m) 매일 9:00 - 21:30"
[용산/한남동] 타르틴 베이커리,"한남동에 있는 타르틴 베이커리 다녀왔어요. 매장입구 샌드위치 너무 맛있어 보이지 않나요.....? 시그니처 메뉴인 바나나크림 타르트 (9,500) 후기에 매우 달다고 하는데 궁금해서 주문했어요. 맛있어 보이는 메뉴 너~~~무 많은데ㅠㅠ 매장은 크고, 2층으로 되어있는데 사람이 워낙 많아서 앉을자리가 없을수도 있어요.. 브루셜 버섯 샌드위치 바나나 크림 타르트 우선 바나나 크림 타르트, 크루셜 버섯 샌드위치 둘다 자르기가 너무 힘들었어요 ㅠㅠ 바나나 크림 타르트는 엄청~! 달다고 했는데 제 입맛엔 그냥 달고 맛있었어요 ㅎㅎ 크루셜 버섯 샌드위치는 정말 맛있게 먹었는데 빵이 쫄깃(+단단)하고 버섯+야채들이 간이 딱 알맞게 되어 있어서 좋았어요... 샌드위치는 저렇게 집에서 만들어 먹고 싶을 정도 ㅠㅠ 50m © NAVER Corp. 타르틴 베이커리 한남점 서울특별시 용산구 한남대로18길 22 예약 08:00~22:00 02-792-2423"
[한남동 카페] 타르틴 베이커리,"타르틴 베이커리 한남점 서울특별시 용산구 한남동 263-2 예약 엄청 자주 오는구 같은 느낌적인 느낌 한남동에 갈때마다 뭐가 바껴있는거 같다. 나인원가려다가 사람도 너무 많고 웨이팅도 많아서 한남동 뒷골목 쪽으로 이동했다. 이 골목 지나갈때마다 여기 진짜 유명한가보네 사람이 가득가득하다. 이 생각을 많이 했었는데 드디어 가보게 되었다. 빵이나 디저트로 유명한 타르틴 베이커리 끼니를 떼우려고 브런치도 같이 주문했다. 프렌치 토스트 ₩10,000 아이스 아메리카노 ₩5,500 바나나크림 타르트 ₩9,500 1층에는 자리가 바테이블 형식으로 있고, 베이커리 만드는 곳이 있어서 자리가 많이 없다. 그래서 우리는 2층 자리로 올라왔다. 아메리카노랑 바나나 크림 타르트🍌🍌 바나나 크림 타르트가 베스트메뉴여서 먹어봤는데 진짜,,, 인정👍🏻👍🏻 가면 무족권 바나나 드시는 걸루 사람들 조금 빠졌길래 남겨보는 2층의 뷰 2층도 그렇게 막 자리가 많지는 않아요 그렇지만 테이블이 다다다닥 붙어있어서 자리가 많아 보여요 좀 시끄러운 느낌 ㅠㅡㅠ 천장 전등이 예뻐서 남겨봤어요. 예쁜건 두번 찍기:) 앉아서 수다 떨고 기다리고 있으니 프렌치 토스트 등장! 저 복숭아 옆에 아이스크림인줄 알았는데 치즈였긔... 배는 고팠지만 느끼한거 두번 먹는건 안되었나봐요 프렌치 토스트 치즈까지 먹으니까 물려서... 먹다 못먹었어요 ㅠㅡㅠ 근데 저 크림만 아이스크림이었다면 더 맛있었을 느낌 빵 자체는 엄청 맛있었어요.(제 생각) 바나나 크림 타르트는 꼭 드세욤 #한남동카페 #타르틴베이커리 #한남베이커리 #한남타르틴 #한남타르틴베이커리 #한남카페"
[한남동/이태원 카페] 타르틴 베이커리,"안녕하세요. 오늘은 한남동에 위치한 타르틴 베이커리에 다녀와봤어요! 한줄평 남기겠습니다 맛이 별로였다… 저의 한줄평입니다…! 시작해볼게요 :) 입구에 크게 타르틴이라고 적혀있어요 :) Next image 들어가면 이렇게 많은 종류의 빵이 배치되어있어요 :) 근데 원래 빵집에서 나는 맛있는 빵냄새 (다들 아시죠..?) 는 전혀 안나서 딱히 빵을 사고 싶다는 생각은 안들어요… 그래서 그냥 커피 마시려고 했는데 요 옆에 있는 라임~~ 푸딩비주얼을 보고 호의를 가지고 있던 저희는 시그니처라길래 시켜 보았습니다 ㅎㅎ 이렇게 에코백도 판매하더라구요 :) 딱히 사고싶었던건 없… 었던건 비밀로 해요! 1층 이에요! 1층은 적당한 테이블과 많은 종류의 빵을 셋팅해 놓았어요! 그럼 저는 이층으로 슝슝~ Next image 이층은 아늑하고 좀 더 조용해서 좋았어요 :) 메뉴가 나왔어요! 저 시그니처라는 푸딩 맛 보았는데, 너무 시어요… 인상을 팍찡그리게 만들정도로 시어요..🥺 맛도 별로네요.. 커피는 soso… 입니당 ㅠㅠ 분위기가 조용하고 매장이 널찍해서 카공족들에게는 괜찮은 장소이지만, 굳이 여길 오실 필요는 없을 것 같아요! 화장실 화장실이에요! 깔끔해서 좋았고, 층마다 있어서 좋았어요 :) 이렇게 한남동 카페 타르틴 베이커리 리뷰를 마칠게요 :) 긴글 읽어주셔서 감사합니다!"
<용산한남동> 빵도 맛있고 풍등같은 조명이 인상깊은 한남동 빵집 '타르틴베이커리',"한남동까지 갔으니 신상 카페를 가보고 싶었는데 대부분 한강진역쪽이라서 없었다ㅜㅜ 날이 좋았으면 걸어갔을텐데 하필 너무 추워서🥲 급하게 한남역 근처 카페를 찾아서 방문한 타르틴 베이커리~~ 검색해보니 빵지순례 다녀왔다는 말이 많길래 을매나 맛좋은가 싶어서ㅎㅎ! <타르틴베이커리> 매일 10:00 - 21:00 50m © NAVER Corp. 타르틴 베이커리 한남점 서울특별시 용산구 한남대로18길 22 예약 외부 빨간 벽돌집 느낌의 외부! 왠지 굴뚝도 달려있을것만 같은 느낌이다 내부 바깥은 벽돌인데 내부는 나무로 돼있었다. 그래서 그런지 더욱 아늑한 느낌~ 노란조명과 나무테이블들도 잘 어울린다 2층으로 돼있고 높은 천장으로 개방감을 주면서 길게 내려오는 동그란 종이조명(?)이 아주 인상깊음! 자리는 1층에 많고 2층엔 7테이블 정도ㅎㅎ 매장 한켠에 다양한 굿즈도 팔고 있었다 메뉴 베이커리 답게 빵 종류가 꽤 있었고 중간에 배터리가 나가서 못찍었지만 케이크 종류도 다양했다! 그리고 브런치 메뉴들도 매장 내에서 많이들 드시는 것 같았음ㅠㅠ 다음엔 브런치도 먹어보고 싶드... 브런치랑 음료 메뉴판은 이미지로 대체ㅎㅎㅎㅎ 아이스 아메리카노 5,500 바닐라라떼 6,300 아몬드 크루아상 6,200 1개 남아있길래 집어왔는데 맛이 아주 좋았음! 아몬드도 얇게 슬라이스해서 올라가있고 속에 아몬드잼인지 뭔지 ( 카야잼 너낌,,?) 들어있어서 촉촉하게 먹을 수 있었다! 속에 뭐 들어간거 좋아하는 서타일...ㅎ 커피는 그냥 커피였다^^! 바닐라라떼에 바닐라파우더 들어가는걸 선호해서 주문할 때 물어보는 편인데 여기는 시럽을 쓴다고 했다. 그래도 먹고싶어서 주문했지만 역시 난 파우더쓰는 바닐라라떼가 좋은걸로~~~ 총평 맛 ❤🧡💛 분위기 ❤🧡💛 화장실 ❤🧡💛 (내부) 굳이 찾아갈 정도의 맛은 아니었지만 나쁘지 않았음!! 풍등같던 조명들 남기고 이만,, 총총🎈"
한남동 타르틴 베이커리,한남동 타르틴 베이커리 옛날옛적에 갔던 한남동 타르틴 베이커리 크로와상 때깔 보소... 스콘굽기 완벽하넴 에끌레어랑 바나나크림타르트도 존맛탱일 듯.. 이때 배불러서 빵 얼마 못먹었는데 지금 가면 다 먹을 수 있을 거 같다. 위에서 뚫린 느낌 너무 좋고요 샀던 빵이 다 뭔가 칙칙 스타일에 조명이 별로라 사진이 잘 안나왔다. 친구네 부부랑 같이 감 바나나크림 타르트 맛있었던 거 같은데 맛이 기억이 안나.... ㅋㅋㅋㅋㅋㅋ 이건 친구가 자기가 찍은 사진 좀 보라며 보내준 겈ㅋㅋㅋㅋㅋㅋㅋㅋ 너무 맛없게 나왔다고 ㅋㅋㅋㅋㅋㅋ 사람 끊임없이 많이 온다 자리가 계속 없다 샌드위치도 너무 맛있을 듯 또 와야지 해놓고 여태 한번도 못간거 함정 타르틴 베이커리.. 조만간 또 갈게여 약속
