title,content
"서울 한남동 빵 투어 타르틴 베이커리 한남점 (TARTINE), 아티장베이커스 한남 (Artisan bakers) 다녀왔어요","[서울] 한남동 타르틴 베이커리 & 아티장베이커스 빵순이 코스 추천 안녕하세요오 오늘은 한남동 타르틴 베이커리와 아티장 베이커스에 다녀온 후기 남길게요 이전 글에 남겼던 오스테리아 오르조 식당을 다녀온 뒤 근처 한남동 골목을 산책하며, 베이커리들을 탐방하고 왔어요 이전부터 유명했던 베이커리들인데, 한남동 온 김에 들릴 수 있어서 좋았네요 🤩🤩 타르틴 베이커리 한남점 (TARTINE) 50m © NAVER Corp. 타르틴 베이커리 한남점 서울특별시 용산구 한남대로18길 22 예약 먼저, 타르틴 베이커리 한남점입니다 한남오거리 뒤쪽 골목에 있습니다 주차는 발렛으로만 가능하고, 유료입니다 자차 가져오시는 분들은 근처 공영주차장 주차하시는 게 더 좋을 듯해요 타르틴 베이커리는 미국 샌프란시스코가 본점인 베이커리인데, 미국 외 매장 1호점이 바로 이 한남점이라고 합니다 그래서 더 기대를 안고 방문해 보았어요 운영시간 매일 10:00-21:00 외관은 따뜻한 느낌을 주는 벽돌집이었고, 큰 간판 없이 벽에 TARTINE라고 작게 적혀있었어요 실내는 들어가자마자 한눈에 복층 구조가 눈에 들어왔어요 높은 층고 덕분에 확 트인 느낌도 들었어요 주말이라 그런지 사람들로 붐비는 편이었고, 2층 테이블은 다 차서 1층 테이블에 앉아야 했습니다 아무래도 1층은 빵을 고르고 주문하는 손님들과 동선이 겹쳐서 좀 더 복잡한 느낌이에요 친구들과 이야기를 나누시거나, 혼자 책을 읽으신다거나 하실 거라면 2층 가시는 게 좋을 듯합니다! 카페 안쪽에는 와인이 진열된 공간이 있고, 이 오른쪽으로 가면 화장실이 나옵니다 이제 메뉴판을 보면요, 샌드위치, 샐러드, 커리, 요거트 등 다양한 브런치 메뉴가 있고, 커피, 차, 에이드 등 음료 메뉴도 다양했어요 빵 오 잠봉, 빵 오 쇼콜라, 크루아상, 모닝 번, 여러 샌드위치류, 호두파이, 브라우니 등등 빵 종류가 매우 다양해요 또, 인상적인 건 에코백과 머그컵, 텀블러가 너무 귀엽다는 거... 특히 미니 에코백이 핑크, 노랑, 화이트, 블루 등 색이 다양했는데 각기 다른 디저트가 그려져있어서 너무 귀여웠네요 여기서는 같이 온 언니만 빵을 사고 저는 다음 베이커리까지 구경하기로 했어요 😀 아티장베이커스 한남 (Artisane bakers) 그다음으로 향한 곳은 아티장베이커스 한남입니다! 50m © NAVER Corp. 아티장베이커스 한남 서울특별시 용산구 한남대로18길 26 1층 앞서갔던 타르틴과 같은 골목에 있어서 같이 들리기 좋았어요 아티장베이커스 한남은 심플한 빵을 위주로 만드는 베이커리로 ‘수요미식회’에 소개되기도 했어요 운영시간 화-일 08:30-20:00 매주 월요일 정기휴무 ** 빵 나오는 시간 (네이버 플레이스 참고) (수~일) 오전 10시 크루아상, 사워도우 11시 치아바타, 바게트, 대니쉬 12시 단팥빵, 시오 13시 식빵 화요일은 전날 월요일 휴무인 관계로 빵 나오는 시간이 다를 수 있다고 합니다 갓나온 빵이 맛있는 건 진리... 빵 나오는 시간에 맞춰 먹을 수 있으면 정말 좋겠네요 아기자기한 동네 빵집 같은 분위기의 외관이고, 수요미식회 출현 정보가 쓰인 안내문이 앞에 놓여있었어요 아티장 베이커스는 사워도우가 시그니처라고 해요 매일 아침 직접 빵을 굽고, 건강한 빵이라고 안내되어 있네요 가게 안쪽에는 빵을 굽는 공간이 있었고, 빵들이 나오고 있었어요! 베스트 메뉴 베스트 메뉴 7가 클래식 사워도우, 호밀 사워도우, 통밀 사워도우, 플레인 크루아상, 라우겐 크루아상, 감자 양파 치아바타라고 하네요 이제 전체적인 빵 종류를 살펴보면, 바게트, 식빵, 치아바타 러스크와 초코칩 피넛버터 쿠키, 사블레가 있고요 소금 빵, 고르곤졸라 플람쿠헨, 우유크림빵, 단팥빵, 바게트가 있습니다 진열장 안에는 인기 메뉴들이 들어있었어요 (좌측) 무화과 헤이즐넛 사워도우, 치즈 올리브 사워도우, 감자 양파 치아바타, 플레인 치아바타, 라우겐 크루아상 (우측) 아티장 크루아상, 초코 크루아상, 햄 치즈 크루아상, 빵 스위스, 아몬드 라즈베리 크루아상, 몽블랑 다니쉬, 뉴욕 롤, 애플파이, 통밀 100% 식빵 (없음), 탕종 식빵, 생크림 식빵, 밤 식빵이 있고, 냉장 칸 안에는 파운드케이크들, 샌드위치류들이 있었어요 쓰다 보니 종류가 엄청 많네요 미니멀한 공간이지만 빵 종류가 컴팩트하게 꽉꽉 들어차 있습니다 커피/티류도 함께 판매 중이니 관심 있으신 분들은 함께 드셔도 좋을 듯해요 매장 내 취식 공간은 따로 없어요! 저는 이 베이커리에서 빵을 간단히 pick 했답니다 집까지 들어가기까지 시간이 많이 남아서 짐될까바 간단히 다음날 아침거리만 샀네요 근처 사시는 분들 부러워요 저는 라우겐 크루아상과 무화과 헤이즐넛 사워 도우를 샀어요 라우겐 크루아상은 처음 먹어보는데, 크루아상의 소금 빵 버전..? 짭쪼름하고 쫄깃하니 맛있더라고요 그래도 개인적인 취향은 플레인이 더 조하요 무화과 헤이즐넛 사워도우는 와... 무화과가 정말 많아요! 무화과 사워도우는 먹어본 적이 있는데 이렇게 많이 들어간 건 처음 봤어요 향도 좋고 만족했습니다 무화과 좋아하시는 분들께 추천해요 덕분에 한동안 생각날 때마다 꺼내 잘라먹었네요 빵순이로서 베이커리를 그냥 지나칠 수 없죠 집 앞이라면 뭉텅이로 샀을 텐데, 먹고 싶던 거 다 못 사 먹은 게 넘 아쉽습니다 이 근처 사시는 분들, 아티장 베이커리 빵 나오는 시간 맞춰서 사서 드셔보시는 거 추천드려요 저는 시간 지나서 먹었는데도 맛있었거든요 맛있는 빵도 먹으면서 친구분들이랑 앉아서 얘기 나눌 공간이 필요하신 분들께는 타르틴 베이커리를 추천드려요 그럼 이만 글 마치겠습니다 방문해 주신 분들 모두 감사드려요!"
한남동 타르틴 베이커리에서 크루아상 부수기,한남동에서 맛있는 저녁을 먹고 후식으로 빵을 먹기로 하여 베이커리를 찾아보기로 했다 한남동의 대부분 카페나 빵집들은 일찍 닫는 편이어서 찾기가 쉽지 않았다 그래서 만만한 체인점 베이커리로 가게 되었고 그게 한남동 타르틴이었다 주차와 발렛도 가능하고 한남동 담게 고급 차량들이 즐비해있었다 이쁘고 부럽다.. 타르틴베이커리는 샌프란시스코 3대 빵집 중에 하나로 유명하고 미국 여행 가면 꼭 들르는 베이커리라고 한다 나는 도산공원 근처에 있는 지점을 먼저 가봤었는데 거기는 인테리어도 엄청 화려하고 예쁘고 넓고 포토스팟이 많아서 빵집이라고만 불리기엔 아까운 곳이어서 좋은 기억이 남았었다 그래서 도산점은 확실히 사람이 많았는데 내가 저녁에 방문하기도 해서 그런지 한남점은 조용한 편이었다 내부는 우드 인테리어로 따뜻하고 포근한 느낌이 들었고 복층 구조였다 무릎이 쑤시기 때문에 복층으론 올라가진 않았다 저기서 먹어도 색다른 느낌이 들겠지만 늙은 몸뚱어리가 올라가질 못했다 천장에 동그란 조명들은 카페를 더 포근한 느낌으로 만드는 거 같았다 하지만 전에 갔던 지점이 너무 고급스럽고 웅장해서 약간 비교되긴 했다 한남점은 동네 베이커리 느낌에 가깝다 내가 마감시간 직전에 와서 유명한 빵들은 다 없고 크루아상과 몇몇 빵들만 남아있었다 고를 수 있는 선택지가 많지 않아서 빵은 크루아상(5100원)만 골랐다 다양하게 먹어보고 싶었는데 아쉬웠다 늦게 온 내 잘못이지.. 근데 늦게 온 걸 잘한 거 같기도 한 게 생각보다 가격대가 있었다 많이 골랐으면 3~4만 원은 그냥 넘었을 거 같다 물론 유명한 베이커리기도 하고 위치도 좋은 곳이긴 한데 그래도 너무 비쌌다.. 빵 말고도 선물하기 좋은 잼이나 쿠키를 팔고 있었고 다양한 소품들도 같이 팔고 있었다 생각보다 아기자기해서 여자인 사람들이나 동생들에게 선물하기 좋아 보였고 메뉴를 주문하고 기다리면서 구경하기도 좋았다 한남동 타르틴에는 브런치도 팔고 있는데 신기하게 반미 같은 것도 있었고 주문이 들어오면 그때 조리를 해서 시간이 오래 걸릴 수 있다고 한다 그리고 브런치라 오전 10시부터 오후 4시까지만 주문을 받는다고 하니 꼭 알아보고 시간에 맞춰 방문해서 주문하는 게 좋다 음료는 바닐라라떼(6800원)랑 키위봉봉에이드(7000원)를 주문했다 역시 음료도 비싸다.. 한남동 타르틴 베이커리 재생 3 좋아요 0 00:00 00:11  접기/펴기 한남동 타르틴 베이커리 크루아상은 한번 따뜻하게 데워서 주셨고 별다른 플레이팅은 없었다 크루아상과 음료가 양은 많은 편이어서 그나마 다행이었다 비싼데 양까지 적으면 정말 슬플 뻔했다 ^^... 크로와상은 내 주먹 두 개 합친 크기보다 큰 느낌이었다 ㅋㅋㅎㅋ 빵 종류가 별로 없어서 다행이었지 2~3개 시켰으면 큰일 날뻔했다 크루아상이 바삭하기도 하고 크기도 커서 그런가 잘라먹다 보면 흘리는 게 반이다 ㅠㅠ 물론 주워 먹어도 별 탈은 없겠지만 바깥에서 사람들이 많은 곳에서 흘린 걸 주워 먹기도 그렇고 너무 아깝다 크로와상의 맛은 바삭바삭하고 담백하고 딱 적당한 맛이었다 엄청 맛있고 맛없고 이런 게 아닌 정말 딱 기본이었다 그래서 가볍게 먹기엔 좋은 거 같지만 달달하고 맛있는 빵을 원하면 추천하진 않는다 바닐라라떼도 별다른 특이한 건 없었고 평범했다 원래 평범한 것도 힘들다고 ㅋㅋㅎㅋ 중간이라도 가는 게 어디냐 싶다 마시면서 바닐라 향도 살짝 났고 적당히 달달해서 플레인 크루아상 같은 거랑 먹기엔 잘 어울리고 좋았다 달달한 빵이나 초코가 들어간 빵 같은 거랑 먹으면 너무 무거울 거 같아서 가벼운 빵이랑 먹는 게 좋을 거 같다 이건 키위봉봉에이드인데 키위에이드에 봉봉 알맹이를 넣은 음료 같았다 생각보다 연해서 조금은 아쉬웠다 빵도 담백한데 음료마저 담백하니 자극적인 걸 좋아하는 나로서는 용납 못한다 ㅋㅋㅋ 하지만 뭐든지 싱겁게 먹는 게 좋다고 이런 게 더 건강에 좋긴 할 거 같다 내가 도산점을 다녀와서 눈높이가 높아져서 그런지 한남동 타르틴에서는 약간 실망을 한 거 같다 집이나 회사가 근처라면 가볍게 빵 먹기는 좋은데 SNS용 사진을 찍기에는 약간은 부족했다 다음에는 다시 도산으로 가거나 일찍 와서 맛있는 빵을 먹어봐야겠다 <2022. 09. 23. 금요일> 📍 [위치 및 주소] 50m © NAVER Corp. 타르틴 베이커리 한남점 서울특별시 용산구 한남대로18길 22 예약 서울특별시 용산구 한남대로18길 22 📞 [전화번호] 02-792-2423 🕙 [영업시간] 매일 10:00 ~ 21:00 🅿️ [주차] 주차 가능 발렛 가능
한남동 타르틴 베이커리 핫플 방문후기,"한남대교를 건너 이태원 전에 있는 한남동 나들이를 다녀왔어요 이미 날씨 풀린 계절따라서 멋쟁이들이 많이 보이는 곳이네요~ 한남동 타르틴 베이커리 서울 용산구 한남대로18길 22 오전 10:00-21:00 발렛파킹 가능 50m © NAVER Corp. 타르틴 베이커리 한남점 서울특별시 용산구 한남대로18길 22 예약 한남동 핫플을 잘 알고 있는 친구 따라서 타르틴 베이커리 한남점을 방문했어요~ 타프틴 베이커리는 백화점에 입점해 있는 경우는 많이 봤는데 이렇게 매장으로 있는지는 저는 처음알았네요 빵이 맛있는 집인가? 하고 들어갔는데 한남동 타르틴 카페 반전! 실내가 굉장히 많이 넓고 커서 놀랐습니다 겉에서 보던 벽돌느낌보다 훨씬 우아하고 아늑했네요 천장이 굉장히 높게 뚫려있고 이 땅위에 타르틴 베이커리 하나만 존재하고 있는 카페네요 한남동 베이커리 맛집인 만큼 많은 빵들이 진열해 있네요 종류가 너무많아 어떤걸 고를지 고민했네요 그동안 아기육아랑 직장만 왔다갔다하다가 꽤 오랜만에 한남 브런치 카페를 오니 혼자 감동을 가득했네요 사실 이날 친구 생일이었는데 조용하게 생일 케익 초 불면서 이야기나 하자는 취지에서 온 카페 였는데 이날 대성공한 느낌입니다. 저는 저녁에 왔는데 타르틴 베이커리 한남점에서 브런치는 오전10-오후4시 까지라 식사하러 오시는 분들에게도 추천드려요~ 저는 씨 브리즈(디카페인) 친구는 자몽차 를 시켰습니다 타르틴 베이커리는 빵은 기본적으로 맛있지만 그에 맞춰서 커피나 마시는 음료에도 신경을 많이 썼네요 카페에서도 꼭 커피말고도 즐길수 있는 무언가가 필요한데 이럴때 디카페인 차나 음료는 선택권이 넓어져서 좋더라구요~ 타르틴 베이커리 한남점 케익들이 진열되어있는데 생각보다 크기가 많이 크더라구요 주변에서 파는 케익 가격보다 가성비 대비 합리적이더라구요 이날 배부르지 않았으면 하나 먹었을 텐데...ㅠㅠ 슬픕니다.. 다음에 브런치 하러 제대로 들려볼까해요 이곳저곳 돌아다니기 힘드신 분들은 한남 타르틴 에서 식사 커피 디저트 까지 한번에 해결하시는 것도 좋을꺼같아요~ 백화점에서 봤던 타르틴 베이커리기념품과 에코백들이 진열해 있네요 가볍게 하나씩 가지고 다녀도 좋을만한 디자인이예요 한남, 이태원, 강남 등 분위기 좋고 퀄리티 있는 커피를 가지고 있는 카페들은 ""La Marzocco(라마르조꼬)"" 를 가지고 있더라구요 저는 커피를 잘 모르지만 이 기계에 내려진 커피의 맛은 항상 끝맛이 부드럽더라구요~ 라마즈조꼬 설명 Time! 라마르 조꼬는 이탈리아 피렌체에서 1927년 쥬세빼, 브루노 밤비 형제에 의해 만들어진 브랜드입니다 기계를 하나하나 수작업으로 만들고 있으며, 장인정신으로 디자인,품질과 섬세함의 3가지를 균형지게 유지하고 있는 세계적인 에스프레소 머신를 만드는 회사입니다. 2층으로 올라갑니다 2층으로 올라갈수록 원목과 조명의 디자인으로 이루어진 카페의 분위기를 즐길수 있습니다. 넓은데 아늑한 느낌을 받아요~ 한남동 평일 저녁이라도 북적일까봐 걱정했는데 여유로웠어요^^ 벽 곳곳에도 타르틴 베이커리의 철학을 느낄 수있는 그림을 배치해놓았네요 자몽차와 씨 브리즈(디카페인)가 나왔네요 자몽차는 일반적인 달달한 자몽차가 아니라 적당한 맛 배치로 마시기 딱좋았네요 씨 브리즈는 과일티로 녹차나 차를 좋아하시는 분들이라면 추천드려요 (난 커피 못마신다 하시는분들?) 이날 저는 타르틴 베이커리를 갈지모르고 친구 케익을 사갔는데 직원분께 양해구하고 케익에 초만 꽂고 성냥 불은 안하는 조건으로 조용하게 생일축하 했습니다^^ 친구야 다시한번 생일축하해~! 타르틴 베이커리는 층고가 높고 조용하기 때문에 지인분들과 한남동에서 차분하게 대화하실 분들에게 추천드려요 단독 건물을 사용하고 있기 때문에 전체적으로 정돈된 한남동 카페라는 걸 알수 있었습니다 (발렛도 신속하게 해주심)"
바나나 크림 타르트 & 언제 가도 좋을 분좋카 [한남동] 타르틴 베이커리,"서울에는 다양한 멋진 동네들이 있지만 그중 한남동은 제가 출근하는 회사 바로 근처에 있는데요! 오늘은 한남동에는 멋진 카페가 많지만 그중 베이커리로 나름 유명한 타르티니 베이커리 한남점을 소개해 드릴까 합니다!! 50m © NAVER Corp. 타르틴 베이커리 한남점 서울특별시 용산구 한남대로18길 22 예약 타르티니 베이커리 한남점 📍서울 용산구 한남대로 18길 22 ⏰ 월-일 : 10:00-21:00 📞 02-792-2423 ✅ 발렛파킹, 무선인터넷, 베이커리, 커피, 와인 타르티니 베이커리는 이태원과도 가까이 있습니다~ 건물 전체가 베이커리인데요! 이렇게 비싼 동네에 건물 전체가 카페라니 ~ 기대감을 한가득 담고 들어가 봅니다. 촌스럽지 않게 깔끔하게 타르트니로 끝 들어가자마자 층고가 굉장히 높은 내부가 보이는데요. 밖에서 보았을 때 보다 굉장히 높다는 거!! 베이커리가 유명한 곳답게 다양한 빵을 고를 수도 있는데요. 또 가게 한편에는 와인들이 진열되어 있는데요. 와인 좋아하시는 분들은 구매하셔도 좋을 것 같아요. 그럼 메뉴를 골라볼까요? 브런치도 판매하고 있고, 빵도 팔고, 술 메뉴도 팔고 진짜 이것저것 팔고 있어서 하루 3끼 여기서 쌉가능 하지만 저는 회사 동료들과 함께 갔기 때문에 음료와 다양한? 타르트를 주문해 봅니다! 왜냐하면 타르트니는 크루아상과 타르트가 유명하기 때문이죠! 타르티니랑 타르트는 이름이 비슷하기도 ㅎㅎ 사장님의 법카로 먹는 거지만 적당하게 디저트를 골라봅니다~ 먹음직스러운 디저트를 주문하고 2층으로 올라가 봅니다. 타르티니 한남점은 전체 등이 너무 이쁜 것 같아요. 푸른 하늘 유리천장을 통해 잘 보이는데 너무 멋지답니다. 주문한 디저트들은 바나나 크림 타르트와 아래 타르트를 주문했는데 (죄송해요 이름이 생각이 안나요...) 다른 곳에서 먹어보지 못하는 타르트라 이색적이면서 너무 달지도 않아 좋았답니다. 그리고 다양한 음료와 치즈케이크도 주문해 먹었는데 고소한 카페라테도 좋았습니다~ 타르트니 한남동은 조용한 분위기라 공부하시는 분들도 많이 계셨어요. 또 발레파킹도 가능해서 차를 가져오셔도 좋을 듯합니다. 사실 교통이 조금 애매해요. 언제 가도 고소한 크루아상과 달달한 타르트 분좋카를 가고 싶다면 한남동 타르트니 추천드립니다!!"
한남동 브런치 맛집 ‘타르틴 베이커리’ 한남점,"뺑오쇼콜라 맛집 타르틴 베이커리 이미 너무 유명한 베이커리죠? 하지만 저희 남편씨는 이번에 처음 알았다고해요ㅋ 본인처럼 아직도 모르는 사람이 있을테니 포스팅을 해달라는 미션을 주었어요 ㅋ 4년 전 타르틴 베이커리 한남점이 한참 핫할 때 왔었는데 지금은 도산점이 더 핫해진 것 같아요. 그래도 여전히 매력적인 공간, 타르틴 한남점 방문후기를 기록해볼게요.✏️ 타르틴 베이커리 한남점 📌서울 용산구 한남대로18길 22 ☎️02-792-2423 🚗주차는 발렛파킹 가능 (4,000원) ⏰매일10:00 - 21:00 타르틴 베이커리는 서울에 지점이 몇개 있는데요, 한남점은 그중에 첫 지점이에요. 대사관들이 많은 유엔빌리지 근처에 자리해서 인지 외국인 손님들이 많은 곳이랍니다. 건물이 박공형태로 천고가 높은 건물이에요. 베이커리와 브런치도 유명하지만 공간적으로도 머물기 좋은 곳이라고 생각되요. 들어서면 시원하게 높은 천고와 복층형 구조가 눈에 들어옵니다. 캐쥬얼 하면서도 아늑한 분위기가 있어요. 복층 아랫쪽 공간은 직원분들이 열심히 베이킹 하는 모습이 보이는 오픈 키친이에요. 낮은테이블, 높은테이블, 창가의 바 테이블 등 자리배치가 다양하게 구성되어 있습니다. 이 자리는 제가 좋아하는 엄정화 언니가 머물다 가신 자리에요 ㅋㅋ 몸매가 어찌나 날씬하신지 나가는 뒷모습을 한참 바라봤지모에요😍 타르틴 베이커리는 빵사진을 실사진으로 사용하지 않고 예쁜 일러스트 그림을 사용해요. 타르틴만의 아이덴티티 인 것 같아요! 복층 위에서 내려려다본 1층의 모습이에요. 이런 시원한 공간감 너무 좋습니다. 복층이라고 해서 2층이 답답할 것 같지만 전혀 그렇지 않아요. 2층도 천고가 꽤 높거든요. 타르틴 베이커리 한남점의 분위기에 한 몫하는 이 팬던트 조명. 공간과 찰떡으로 어울리는 둥근 팬던트등들이 다양한 높낮이로 배치되어 율동적인 미를 보여주고 있어요. 천고에 자연광이 들어오는 창이 있어 멋졌습니다. 공간얘긴 이정도 하고, 타르틴의 베이커리를 보여드릴게요?! 크로아상,사워도우, 식빵, 베이글, 티케이크,까눌레 꼭 있어야 할 것들만 야무지게 준비되어 있어요! 까눌레 세트(11,0)는 4가지 맛으로 모양도 정성스러워서 가볍게 친구 만날 때 선물하기 좋아 보였어요! 타르틴베이커리 홀 케이크는 네이버 플레이스에서도 예약이 가능하다고 해요. 크기가 크진 않지만 맛이 고급질 것 같아요! 🔽🔽🔽 타르틴 베이커리 한남점 : 네이버 방문자리뷰 803 · 블로그리뷰 5 naver.me 진열된 사워도우가 굉장히 컷어요. (18,0) 마치 모형같은 사워도우, 하나 사가면 한 2주동안은 먹을 수 있을 것 같습니다. 아침에 사워도우를 스프에 찍어먹으면 너무 좋죠! 샌드위치 종류도 다양한데요, 그중 타이레드커리치킨 샌드위치를 먹어봤는데 눈 똥그래지는 깜짝 놀랄 맛이었어요 ㅎㅎ 흔하지 않은 맛이라 더 추천드리고픈 메뉴입니다. 타르틴베이커리 한남점 브런치 메뉴 브런치 메뉴가 정말 다양합니다. 비건 메뉴도있고 스프, 요거트&그래놀라 샌드위치 미트볼 등 선택의 폭이 넓어요. 좀 가까운 곳에 산다면 주말마다 종종 먹으러 올것 같아요. 타르틴베이커리 메뉴 혼자 먹기엔 양이 좀 부담스러운 사이즈의 타이레드커리치킨 샌드위치(14,5) 와 타르틴 베이커리의 명물 뺑오쇼콜라(7,3)를 주문했어요. 주스는 바틀음료 노아 당근 진저주스(6,0)를 시켰는데, 진저가 함유된건지 잘 느껴지진 않았습니다 ㅎㅎ 타르틴 베이커리의 뺑오쇼콜라 안의 쇼콜라는 다른 초컬릿들처럼 달지 않아요. 고급진 초코맛이 느껴져서 인기가 있는 것 같습니다. 유명한 이유가 있는거죠~ 따뜻한 아메리카노와 조화가 베리굿!☕️ 겉으로 보기에 당근만 많아보이지만 안에 샐러리, 고수도 들어있구요, 커리치킨도 큼직하게 들어있어요. 향이 정말 독특하고 특별한 맛이에요. 꼭 한번씩 드셔보시길 추천추천 입니다!👍🏻 타르틴의 귀여운 굿즈들도 보여드릴게요! 타르틴 재생 4 좋아요 1 00:00 00:13  타르틴 타르틴베이커리 한남점은 한남동의 조금은 한적한 위치에서 여유로운 공간감과 함께 브런치를 즐기고 싶은 분들께 추천드리는 공간입니다.⭐️⭐️⭐️ 아! 발렛비는 좀 비쌌어요! 4,000원 🥲 50m © NAVER Corp. 타르틴 베이커리 한남점 서울특별시 용산구 한남대로18길 22 예약"
