title,content
한남동 데이트 코스③ 예술적 감성 충만한 테라스 카페 ‘한남작업실’,"한남동 데이트 코스③ 예술적 감성 충만한 테라스 카페 ‘한남작업실’ 마치 다른 세상에 와있는 것 같은 기분이 드는 여유로운 분위기가 가득한 카페로 초대합니다. 예술적 감성 가득한 한남동 카페로 결혼해듀오와 함께 가볼까요~ [사진출처: 듀오] 유심하게 보지 않으면 그냥 지나쳐 버릴지도 모르는 조용한 골목 사이에 위치한 어느 주택 같은 이곳이 바로 카페 ‘한남작업실’입니다. 입구 앞에 세워진 작은 간판을 봐도 카페가 아닌 정말 작업실 같은 느낌을 주는 이곳. [사진출처: 듀오] 사실은 여유로운 분위기가 가득한 한남동에 숨겨진 보물 같은 테라스 카페랍니다. [사진출처: 듀오] [사진출처: 듀오] 느긋한 오후의 감성으로 가득 채워진 이곳은 사실 건축 사무실에서 함께 운영하는 카페라고 해요. 그래서인지 무심하면서도 감각적인 인테리어가 돋보였어요. 그리고 왠지 모르게 발을 들이자마자 마음이 편안해졌어요~ [사진출처: 듀오] 테라스를 구경했으니 이제 실내 공간을 구경할 차례. [사진출처: 듀오] 실내는 탁 트인 공간이 돋보였는데요. 높은 천장과 함께 크게 난 창문이 어우러져 시원한 느낌이 들었어요. [사진출처: 듀오] 그리고 카페 이름대로 정말 작업실 같은 느낌을 풍겼는데요. 곳곳에 위치한 예술 작업에 필요한 도구들과 아기자기한 소품들이 돋보여 정말 누군가의 작업실에 놀러 온듯한 기분이었어요. [사진출처: 듀오] 카페 구경도 마쳤으니, 이제 주문해볼까요~ [사진출처: 듀오] 여느 카페들처럼 커피, 음료들과 함께 스콘, 케익 등의 디저트가 있었는데요. 메뉴에 특이하게 ‘통영 꿀빵’이 있었어요. 이렇게 평범한 듯하면서도 절대 평범하지 않은 것이 ‘한남작업실’의 매력인 것 같아요! [사진출처: 듀오] ‘H.M.W SET’예요. 이 세트 메뉴는 허병욱 작가의 테이블 웨어를 한 번에 즐길 수 있는 1인 플레이팅 세트라고 하는데요. 통영 꿀빵과 계절과일, 아메리카노로 구성된 세트예요. 음료 컵과 컵 받침, 트레이, 접시, 젓가락 등 모두가 예술 작품인 거죠~ [사진출처: 듀오] 그리고 ‘한남작업실’만의 또 다른 이색 포인트! 아메리카노를 시키면 샷이 잔에 따로 담겨 나와서 직접 에스프레소 샷을 부어서 커피를 즐길 수 있어요! 갓 나와서 부드러운 크레마가 가득한 에스프레소의 향이 정말 풍부하게 느껴졌답니다. [사진출처: 듀오] ‘연유 라떼’와 ‘애플시나몬 라떼’입니다. 애플시나몬 라떼는 적당히 달달한 맛에 사과 과육이 계피 향과 어우러져 정말 맛있었어요! 그리고 ‘한남작업실’의 컵들은 보냉이 엄청 잘 되는 것 같더라구요~ 태어나서 먹어본 아이스 음료 중에 제일 시원했답니다 >< [사진출처: 듀오] [사진출처: 듀오] 주말 오후 같은 느긋한 감성으로 탁 트인 공간에서 마음 편한 데이트를 즐기고 싶다면, ‘한남작업실’로 놀러 가보세요~! 여유로움을 만끽할 수 있는 데이트가 될 거예요~ 이상, 결혼해듀오였습니다. 듀오 공식 블로그 결혼해듀오: 데이트 코스 추천 한남동 데이트② 예술적 감성 가득한 힙한 전시 카페 '16p' 한남동 데이트① 서울 속 작은 뉴욕 브런치 카페 '리특넥 한남' 코로나에 데이트 하기 좋은 자동차극장 추천 남양주 데이트⑥ 한강 노을 보며 피맥 즐기기 '피맥컴퍼니' 남양주 데이트⑤ 팔당 베이커리 카페 '브레드쏭'"
[이태원/한남동] 한남작업실,"인스타에 한남동 디저트 맛집 검색해서 찾아보다가 가고싶은 카페 있어서 왔는데 디저트도 없고 자리도 불편해서 어디갈지 구경하다 발견한 카페 한남작업실 입구 테라스가 예쁜 카페 이태원 한남작업실 주택을 개조해서 만든 카페라 덩쿨 사이 빨간 벽돌이 눈에 띈다 계단을 올라와서 카페입구 입구로 들어오자 마자 보이는 아톰 위층은 허명욱 작가님의 작업실이라고 하는데, 카페에도 작업과정이 담긴 영상과 작업물들이 곳곳에 있다 야외에 앉아서 놀기 좋은 날씨 야외 테이블 자리가 없어서 실내 자리에 착석 폴딩도어를 열 수 있어서 야외석이나 마찬가지였다 메뉴에 핸드드립은 없는 것 같은데 판매용으로 있는 듯한 옻칠 핸드드립 세트 카운터, 픽업대 작업공간 한남작업실 메뉴판 한남 작업실 디저트 메뉴 트러플 바스크 치즈케이크 9,000 흑임자 크림케이크 9,000 트러플향 이 강해서 호불호 갈릴 듯한 맛 흑임자는 진한데 짠맛이 살짝 강하게 나는 편 못먹을 정도는 아닌데 천천히 음미하며 시간두고 먹게 되는 맛 바닐라빈 라떼 6,500 바닐라빈으로 시럽을 직접 만드는건지 향이 좋고 달달함 바닐라라떼 맛집 콤부차 애플베리 7,000 적당히 탄산있고 새콤달콤한 맛 유리병이 작아보였는데 의외로 양이 많았다 오미베리 7,000 유자차랑 오미자청을 따뜻한 물에 녹이고 얼음을 넣은듯 미지근하고 밍밍했다 오미자?는 모르겠고 그냥 유자차 맛 가장 빨리 얼음이 녹아서 이거 마시는 친구가 오미베리는 왜 얼음을 안 넣어 주냐며 처음부터 얼음 없는줄 알았닼ㅋㅋㅋㅋㅋㅋ 옻칠 쟁반 옻칠 플레이트 옻칠 젓가락 옻칠 컵 디저트에 젓가락 나오는 카페는 처음 사탕수수 빨대 같은데 아무튼 친환경 빨대 종이 빨대보다 만족도 높은 빨대였다 https://instagram.com/hannam_atelier 팔로워 1,690명, 팔로잉 64명, 게시물 155개 - 한남작업실(Hannam Atelier)(@hannam_atelier)님의 Instagram 사진 및 동영상 보기 instagram.com #이태원카페 #한남동카페 #한남작업실 50m © NAVER Corp. 한남작업실 서울특별시 용산구 이태원로55나길 7 주소: 서울 용산구 한남동 745-2 1층 한남작업실 영업시간: 매일 11:00 - 22:00 전화번호 : 02 792 5620"
도심속에 푸릇푸릇한 카페 : 이태원(한남동) 한남작업실,"여기는 친구들이랑 4월말인가 5월초에 갔던 곳!! 보자마자 나중에 또 가봐야겠다고 생각했던 곳이다ㅎㅎ 한남작업실 영업시간 매일 11:00 - 22:00 (라스트오더 21:30) 50m © NAVER Corp. 한남작업실 서울특별시 용산구 이태원로55나길 7 1층 한남작업실 아 이름부터 맘에 들어.. 한남작업실 입구 입구부터 너무 이쁘다😍 한남작업실 입구 계단을 올라가보면 바로 식물이 푸릇푸릇한게 보인다. 한남작업실 입구2 저 꽃은 수국인가?? 아시는분~~🙌 한남작업실 입구3 밖에서 보면 자리가 내부가 좁을 것 같지만, 외부&내부에 은근 구석구석 테이블이 있다. 한남작업실 내부1 하지만, 사람이 너무 많아서 앉을 자리가 없다ㅜㅜ 그래서 우리는 카운터 앞에 조그만 2인석에 일단 앉았다. (친구 한 명이 더 와야했기에 매의 눈으로 일어나시는 분들 쳐다봄....) 한남작업실 내부2 여기 카페 사장님이 아톰(?)을 좋아하시나부다 위 사진에도 있듯이 큰 피규가 2개나 있다ㅎㅎㅎ 한남작업실 내부3 일단 아이스아메리카노로 시작..!! 나는 웬만하면 커피맛 다 거기서 거기라고 생각하는데,(신맛 제외) 여기 커피는 맛있다👍👍 친구도 나랑 똑같이 생각함!! 한남작업실 외부1 드디어 3인 자리를 겟✔ 바깥자리에 앉으니 또 느낌이 색다르다. 한남작업실 외부2 이 날은 정말 날씨가 다 했다... 밖에 앉기 딱 좋은 날씨~~ 한남작업실 외부3 위 사진만 보면 제주도 같다..(?) (흐흐 머쓱타드;;) 물론 내가 사진을 잘 찍었다는 건 아니구, 푸른게 너무 이쁘다는 뜻ㅎㅎㅎ 한남작업실 외부4 와,,나 진짜 사진실력 언제 늘지???ㅋㅋㅋㅋ 무튼 친구 한명 더 와서 커피 시켰다! 커피 뒤쪽에 보면 검은색 돌(?)같은거 있는데, 말차 디저트였던거 같다ㅎㅎㅎ 신기하게 저거 겉에도 다 먹는거!!! 한남작업실 커피뿐만 아니라 디저트맛도 굳이다🫢 여기 너무 좋아서 2주뒤쯤 오빠랑 한번 더 가봤는데, 이때는 자리를 차지하지 못해 들어갔다가 나왔다ㅠㅠ 한남작업실 가시려는 분들은 시간대를 잘 선택해서 방문하시길~~"
"한남동 노트북 작업하기 좋은 테라스 카페, 한남작업실","한남동 뉴욕식 타코, 타크 tac 안녕핫세요, 탐옹입니다😆 오랜만에 한남동 데이트를 했는데요..! 예전부터 가보고 싶어서 저장해둔 곳인... m.blog.naver.com 타코를 야무지게 먹고 주변 옷 가게도 구경하고 카페로 갔습니다-! 한남작업실 서울 용산구 이태원로55나길 7 1층 한남작업실 다음 달에 갈 여행계획을 짜기 위해 조용히 작업할 수 있는 카페를 찾아왔습니다😊 뭐가 급하다고.. 흔들린 입구컷 ㅋ 🅿️주차공간은 따로 없습니다! 대신 발레 부스가 있어요:) 한남작업실 앞쪽에 도착하면 발레 부스에 계신 분이 어디 왔냐고 물으시고 차에서 내리라고 하십니닷,,ㅎ 계단을 올라 2층으로 가면 진짜 입구가 나옵니다! 운영시간 매일 11:00 - 22:00 라스트 오더 21:30 한남작업실(HannamAtelier)(@hannam_atelier) • Instagram 사진 및 동영상 팔로워 2,540명, 팔로잉 132명, 게시물 197개 - 한남작업실(HannamAtelier)(@hannam_atelier)님의 Instagram 사진 및 동영상 보기 www.instagram.com 메뉴판 커피뿐만 아니라 논 커피류도 다양하게 있습니다! 디저트도 많이 있어요! 배불러서 포기했지만요... ㅜ 📋주문한 메뉴 말차크림라떼 9.0 복숭아 에이드 9.0 주문 후 카페 구경하기👀 평일 저녁이라 그런지 사람도 많이 없고 엄청 조용했어요! 노트북 작업하시는 분들도 계셨구요! 내부도 넓어서 마음 놓고 작업하기 딱 좋은 카페인 것 같아요! 아톰이 왜 이리 많나 했더니 실제 허명욱 작가님이 사용하시던 작업실을 개조해서 카페로 만든 곳이라고 합니다..! 영상도 함께 전시되어 있어요! 카페 곳곳에도 작품들이 많이 보이던데 작은 미술관에 온 것 같은 느낌이었어요!!🖼️ 허명욱(@huhmyoungwook) • Instagram 사진 및 동영상 팔로워 8,840명, 팔로잉 510명, 게시물 66개 - 허명욱(@huhmyoungwook)님의 Instagram 사진 및 동영상 보기 www.instagram.com 내부 화장실도 엄청 깨끗하게 되어있어요! 열심히 무언가를 보는 그 말차크림라떼 9.0 에스프레소는 직접 넣어 마시라고 했습니다! 말차크림라떼 재생 1 좋아요 0  말차크림라떼 ""동영상 찍어야 하는 거 아니야?"" 왜 동영상 안 찍냐며,, 내 블로그 영상 컨텐츠도 생각해 주는 남친쓰,,🥹🥲🙊 찔끔찔끔 에스프레소를 붓더니....🫨 웃음만 남은 영상... 그래도 고마워, 덕분에 동영상 찍었다... 복숭아 에이드 9.0 낮에 커피를 마셔서 에이드를 시켜보았어요. 자몽이나 오렌지에이드는 많이 봤는데 복숭아 에이드는 처음 먹어봤어요! 잘 저어 먹어야 합니다🤓 제 입맛에 딱 맞았어요 ㅋㅋㅋ! 인공적인 시럽 맛이 아닌 자연스러운 달달한 맛 ㅋㅋㅋㅋㅋㅋㅋ마지막에 복숭아도 먹으니 맛있더라구요?!? 야외 테라스에도 자리가 되게 많아요! 단체석도 있구요! 저녁이라 어둡지만 조명이 있어 잔잔한 분위기였어요-!💡 테라스는 낮에 오면 초록초록한 느낌을 더 잘 느낄 수 있을 것 같아요!💚🌿 정말 빠르고 간단하게 여행계획을 끝냈습니다. 솔직히 비행기랑 숙소만 예약하면 다한 거잖아요..?🥹 다음달 여행 포스팅에 저희의 계획표를 공개하도록 하겠습니다. (J이신 분들은 눈을 감아주세요... ㅎ) 한남동에서 노트북 작업하실 분들! 조용히 이야기하실 분들! 한남작업실 추천드립니다🖤 공간도 넓고 분위기도 좋아서 작업이 더 잘 될 것 같아요..! 참고로 낮에는 사람들이 은근(?) 많다고 합니다! 50m © NAVER Corp. 한남작업실 서울특별시 용산구 이태원로55나길 7 1층 한남작업실"
"[한남동 놀거리]미술관에 온 듯한 느낌을 받았던 카페, 한남작업실","한남작업실(@hannam_atelier) 영업시간: 11 AM ~ 10 PM ( 9:30 PM Last Order) 전화번호: 02-792-5620 주차: X 한남작업실(HannamAtelier)(@hannam_atelier) | Instagram 팔로워 2,511명, 게시물 192개 - 한남작업실 카페 @프롬나드 Open Everyday 11-22 02 792 5620 www.instagram.com 50m © NAVER Corp. 한남작업실 서울특별시 용산구 이태원로55나길 7 1층 한남작업실 이태원역이나 한강진역에서 걸어서 5분 정도 걸으면 위치한 카페 한남동엔 미술관 같이 뭐가 많아서 기왕 가는 김에 전시도 봤음 했는데 월요일은 신기하게 다 휴무였다..;( 그래서 그나마 전시 대신해서 공간 디자인이 예쁘게 잘 되어있는 카페를 찾다가 여길 방문!! 1층은 작업실이고 2층이 카페라고 한다. 마침 비도 내리고 있어 식물들의 내음이 더 잘 느껴졌다. 워크샵 겸 방문하게 되었는데 입구부터 펼쳐진 식물들에 압도당함 올라와서 둘러보니 이렇게 테라스 좌석도 있었다. 근데 비와서 요즘은 애매할듯ㅠㅠ 이렇게 입구를 지나면 내부에 꽤나 좌석이 많다. 월요일이었는데도 사람들 바글바글.... 다행히 일자로 길게 뻗은 테이블이 하나 있어서 거기 구석에 빠르게 자리를 잡고 주문부터 하러 갔다. 카페 메뉴판!! 여기는 신기하게 플레이팅 세트를 판매한다. HMW set 라고해서 15,000원에 양갱 + 과일 + 아메리카노 조합.. 딱히 끌리진 않아서 그냥 우리는 각자 음료만 시켰다. 워크샵 출발 전에 이미 아메리카노를 마시고 와서 조금 달달하고 무난한 바닐라라테! 디저트.... 디저트도 다양하게 있던데 솔직히 눈치보여서 못 시킴.. 나중에 다시 간다면 꼭 한 번 시켜보고 싶다. 옆을 보니까 홈메이드청도 판매 중이었다. 청 관심있으면 나중에 살펴봐도 좋을듯! 근데 가격이 어떤지는..🤔 기다리면서 간단하게 수다좀 떨었다. 밖에 부슬부슬 비가 내리고 있어서 사람 없을 줄 알았는데 사람 많아서 놀랐고 생각보다 마실 게 없어서 놀람ㅋㅋ 곳곳에 꾸며져있는 기물들 카페를 둘러보면 요샌 공간 디자인한다고 이곳 저곳에 기물들이 많던데 너무 많으면 오히려 난잡하고 통행에 방해되는 경우도 있는 것 같다. 나는 그래서 요즘엔 좀 정돈되어있고 미니멀한 곳이 더 끌리는 듯 하다. 아무래도 나는 카페를 마음이 쉬기 위한 곳으로 바라보는 편이어서 더 그런듯~~! 같이 방문한 분들은 이곳저곳 흥미로운 눈으로 관찰하셨다ㅎㅎ 잔이 독특하다 트레이부터 잔까지 독특하다는 느낌을 많이 받았다. 허명욱 작가님께서 카페까지 같이 하시는 것 같은데 잔도 그렇고 트레이도 직접 만드신 건지...🤔 어쨌든 음료는 무난 무난 했다. 근데 솔직히 전시같은 거에 별 관심없고 음료와 디저트 오롯이 그걸로 카페를 찾는 사람은 여기 굳이 저 돈 내고 올 거 같지는 않다만... 전시회가 없는 월요일날 마치 미술관에 방문한 듯한 느낌을 받고 싶다면 여길 오는 것도 괜찮은 선택일 것 같다 😊😊 #한남동카페 #한남카페 #한남동 #한강진역카페 #이태원역카페 #한남동가볼만한곳 #한남동놀거리 #한남동갈만한곳 #한남동갈만한카페 #한남동가볼만한카페"
맛부림- 한남동 한남작업실,"한남동 카페 한남작업실 감성있는 한남동 카페 #한남작업실 다녀왔어요 *발렛은 써머레인, 다츠, 그쪽 발렛부스에서 다 해주시더라구용 한남작업실의 갬성있는 입구모습. 요런 느낌. 약간 가을 감성 🥰 한남작업실 내부모습. 열두시쯤 방문했나? 그랬는데 점심시간이라 다들 식사하시는지 카페에는 사람이 두분정도 밖에 안계셨어요 이렇게 작업 공방의 느낌이 나는 갬성있는 #한남작업실 한남작업실의 메뉴판 이렇게 아주 쁘띠한 디저트도 있어요 사진보다 더 작은 모습이었는데 ㅎㅎ 가격대비 너무 작다는 생각을 했습니다 ㅋㅋ 이렇게 애플시나몬청도 팔고 디저트도 이쁘게 포장되어서 판매되어요 포장, 컵 이런 색상들이 다 너무 감성있어요💜 커피뽑아주시는 공간. 쟁반도 색감이 알록달록 이뻐용 제가 주문한 밀크티(8,000원), TWG루이보스티 (8,000원) 컵 색감이랑 느낌이 참 좋아요 하지만 좀 비싼느낌..(?) 뱅쇼도 만원이나 하니까 .. 저번에 한남동에 카페 아분드다녀왔을때보다 금액대가 조금 더 세더라구요 디저트도 사이즈에 비해 비싼거 같구 .., 물론 인테리어에 신경을 많이 쓴 느낌은 나용 아 그리고 아톰도 전시되어 있어요 멋져부려~~ 😊 가격대는 초큼 있지만 비오는 날 조용히 책읽고 싶을때 다시 방문해봐도 좋을 거 같다는 생각이에요 단, 조용한 날 !! ㅎㅎㅎ 복불복이겠지만용? 담에 커피한 번 마셔볼게요!! 50m © NAVER Corp. 한남작업실 서울특별시 용산구 이태원로55나길 7 #한남동카페#한남맛집#발렛카페#TWG#한남데이트#이태원카페#이태원데이트"
"맛집이 가득한 이상한 군자 나라 여행과 한남동 뇨끼바, 한남작업실.","50m © NAVER Corp. 체리커피 군자점 서울특별시 광진구 능동로 284 비가 추적추적 장마가 무섭게 오래가던 때, 아빠가 서울에 올라와서 같이 군자 #체리커피 를 갔다 비가 추적추적 빨간색과 초록색의 대비가 참 예쁘다 예쁜 웨지우드 잔에 싱글 오리진 드립 체리커피 오면 크루아상도 먹어줘야 된다 50m © NAVER Corp. 금성칡냉면 서울특별시 광진구 능동로 285 평냉도 좋지만 어렸을 때부터 좋아하던 칡냉면도 좋다 집 근처에 있는 #금성칡냉면 냉육수를 주기 때문에 무적권 비빔냉면이다 50m © NAVER Corp. 뇨끼바 서울특별시 용산구 한남대로20길 41-4 1층 언니랑 형부랑 아빠랑 #한남동뇨끼바 성큼성큼 오묘한 색감 조아 여기저기 신경 쓴 디테일이 살아있다 접시도 너무 예쁨 뇨끼바 오면 여기서 사진 찍는게 국룰이라면서 언니가 찍어줌 고르곤졸라 크림 뇨끼, 스파이시 라구 고르곤졸라 크림 뇨끼가 제일 맛있었고 스파이시 라구는 느끼할 수 있는 뇨끼 사이에서 나름의 역할을 한다 오른쪽 위에 트러플 크림 뇨끼 기대보단 평범했다 해산물 오일 파스타인데 해산물이 정말 실하게 들어있다 딱새우도 잔뜩 생각보다 비리지 않아서 조금 먹을 수 있었다 뭔가~ 아쉬워서 무화과 프로슈토 메뉴에는 없지만 이제 무화과 철이라 나온 듯 했는데 역시 8월 중순이라 무화과는 아직 맛이 들지 않았다 50m © NAVER Corp. 한남작업실 서울특별시 용산구 이태원로55나길 7 카페는 #한남작업실 해가 엄청 뜨거웠는데 그 햇빛이 사진에서 잘 표현된 너낌 건축 관련한 여러가지 서적이 있어서 구경도 하고 잔도 직접 만든 거라는데 너무 예쁘고 너무 시원했다 그러고 언니 집가서 쿠키도 오랫만에 보고 사랑둥이 50m © NAVER Corp. 스시교센 군자점 서울특별시 광진구 능동로31길 14 얼마 전 집 근처에 생긴 #스시교센군자점 머선일이고 으찌나 푸짐하던지 50m © NAVER Corp. 서북면옥 서울특별시 광진구 자양로 199-1 서북면옥 저녁에는 #서북면옥 접근성이 좋아서 자주 가는 것도 있지만 넘모 마시썽 이 날은 수육과 편육을 다 시켜버렸다 개인적으로는 편육이 훨씬 맛있다! 여기는 만두도 시켜야되는데 이 날은 수육 시키느라 패스 지나가다 색이 너무 예뻐서 찍어본 과일 가게 좌판 그리고 밤에 이상한 군자 나라 여행을 시작하는데.. 웬 가정집같은 곳에 간판이 있어 보니 1567억+80억 ???? 느낌표 갯수 ???? 머선 일이고 작은 예수 수도회!!!!!!!!!!! 를 지나... 세상 힙한 고물 트럭을 만났고 사장님의 닭발 사랑을 느낄 수 있었고 이 피카츄는 머선 일로 여기에... 피카츄 근처에서 임신한 삼색이 맘마 먹고 있는 것도 구경 50m © NAVER Corp. 솔티드 서울특별시 광진구 능동로32길 5 1층 애정하는 #군자카페 #솔티드카페 이로케 귀여운 라떼가 기다리고 있거든 *매우 수줍음 많음 *남자를 무서워함 *친해지기까지 시간이 필요함 그래도 이 날은 사장님이 까까 주셔서 조금 친해질 수 있었다 ^0^ 이렇게 라떼(강아지)와 라떼(커피)로 야밤의 이상한 군자 나라 여행은 마무리"
한남동 카페 추천 테라스가 이쁜 곳 한남작업실,"다츠에서 간단한 식사 후 한남동 한바퀴 쭉 둘러보고 카페나 들렀다 집에 갑시다 해서 다츠 쪽으로 다시 돌아와 바로 앞에 있던 한남동 테라스 카페 한남작업실에 갔어요 사실 언니랑 저랑은 다츠 건물과 연결? 되어있던 바로 옆에 있는 카페를 가고싶었지만 엄마가 여기가 더 맘에드신다고 하셔서 한남작업실로 방문해보았어요 :) 한남동 테라스카페 한남작업실 메뉴판 1인1메뉴 주문해야한다고 함! 여기에 방문한게 3시쯤인데 오전부터 벌써 스타벅스, 슬로우치즈, 카시나카페, 다츠까지 부시고와서 배가 너무나도 불러있는 상태 ..... 디저트는 먹어보고싶지만 음료는 흠... 인 상태였는데 디저트도 1메뉴에 포함가능하다고 하셔서 음료 2잔과 디저트 1개를 시켰어용 디저트 종류는 이렇게 있었슴니당 흑임자나 말차 디저트 먹고싶었지만 엄마가 레몬크림케익 드시고 싶다셔서 러몬크림케익으로 주문해보긔 홈메이드청도 판매하고 있었어용 뭔가 딱 어머니들 좋아하실 것 같은 분위기 한남동 테라스 카페 한남작업실 넘모 긔여웠던 왕아톰도 있었어요 카페의 전체적인 분위기는 요런 너낌 뭔가 예술가의 공간에 놀러간 듯했어요 한남동 테라스 카페 한남작업실 야외테라스도 분위기 너무 좋고 이쁘더라구요 날도 좋았어서인지 테라스 테이블은 거의 만석 카페가 2층에 위치하고 있어서 테라스 앉아서 여유즐기기 딱 좋은 분위기 아쉽지만 여기저기 너무 많이 돌아다니기도했고 밖은 3명이 앉을 수 있는 자리도 안남아있어서 그냥 안에 앉아서 편하게 먹기로 했어용 밀크티와 바닐라라떼와 레몬크림케익 서울 여행 내내 밀크티 뿌시기 퀘스트 중 배부르지만 달달한 디저트는 못참지 >_< 너무 많이 돌아다녀서인지 당이 뚝뚝 떨어져서 레몬크림케이크부터 언능 잘라봤어요 한남동 테라스가 이쁜 카페 한남작업실 재생 2 좋아요 0  접기/펴기 한남동 테라스가 이쁜 카페 한남작업실 케이쿠 자르기엔 넘 둔탁했던 나무칼 칼이 쏙 안나와서 당황해찌만 당황하지 않은 척 자연스럽게 자르기 근데 저는 케이크가 아래쪽 빵이 얇고 위엔 다 크림인줄 알았는데 빵이 봉긋하게 올라와있는 모양이더라구요 맛은 그냥 딱 상큼한 크림+빵맛이었슴니다 개인적으로 밀크티 넘 밍밍하고 별로였습니다 .. 근데 커피는 맛있더라구요 :) 커피 좋아하시는 분들에겐 좋을 듯해요 근데 커피 안먹는 저같은 사람들은 살짝 아쉬울 듯 창가 앉으니 은은하게 빛도 들어오고 카페가 막 요란하고 시끄러운 분위기가 아니라서 조용히 여유즐기기엔 딱이었어요 분위기 좋은 조용한 카페 찾으시는 분들은 한남동 테라스 카페 한남작업실 방문해보세용 50m © NAVER Corp. 한남작업실 서울특별시 용산구 이태원로55나길 7 서울 용산구 한남동 745-2 영업시간 11:00~22:00 방문시 참고하세용 :)"
