title,content
"카페 투어 한남동 [맥심플랜트, 원인어밀리언, 보닐라츄러스, 비욘드문, 핏제리아오]","몇 년 전부터 돋이 언니와 가끔 카페를 놀러 간다 평소에 커피 마시러 가는 카페와는 다르게 이런 날은 언니가 미리 알아놓은 인테리어 예쁜 카페를 하루에 2-3개 정도 놀러 가 사진을 찍는다 보통 우리의 주된 활동지는 카페의 메카 성수지만 이번엔 한남동으로 다녀왔다 평일인데도 여기저기 사람이 굉장히 많아서 핫플은 핫플이군.. 이라는 생각이 들었다 한강진 역 근처에 언니가 찾은 예쁜 카페들이 모여있었다 맥심플랜트 서울특별시 용산구 이태원로 250 이름에 맥심이 들어가서 설마 했는데 진짜 그 커피 브랜드 맥심에서 하는 곳인가 보다 카페 리뷰 사진에 이런 게 많아서 가보니 사람이 엄청 많아서 찍을게 이거밖에 없다..ㅎ 층도 많고 공간도 넓은데 사람도 정말 많았음 나는 다크 블랜드 원두로 아메리카노를 마셨는데 쓰지 않고 괜찮았다 채광이 좋고 자리도 널찍해서 진짜 카페를 즐기러 가기는 나쁘지 않을 듯! 그치만 사진이 예쁘게 나온다거나 사진 찍기 좋은 분위기는 아니다 공부하고 수다 떨러 가기는 좋음 원인어밀리언 서울특별시 용산구 이태원로54길 31 다음으로 향한 곳은 이곳 원인어밀리언이었다 맥심플랜트에서 멀진 않았지만 공포의 계단이 있어서 올라올 때 빡셀 것 같아 무서웠다.. 원인어밀리언은 가게 근처부터 예쁘게 꾸며져있고 포토존도 꽤 많은 편 가게 바로 앞 예쁜 포토존에서 사진 찍기 딱 좋다 이미 커피를 마시고 와서 여기서는 플랫 화이트 한 잔과 리에쥬와플을 먹었다 둘 다 허기진 상태라 그런지 와플이 순삭 됨 플랫 화이트 진짜 작게 나오는데 둘 다 커피를 가득 채우고 온 터라 남았다 맛은 부드럽고 맛있음 MZ 샷 (얼마 전에 배움) 리에쥬와플은 아이스크림이 정말 맛있고 와플이 딱딱하거나 질기지 않고 포크로 부드럽게 부서진다 전체적으로 맛있었음 건물 안과 밖 모두 인테리어가 예쁘고 카페 공간도 안쪽으로 나름 나눠져있어서 사진 찍기 편하고 잘 나온다 한남동 자체가 여기저기 길거리에서 사진 찍는 사람도 많고 인스타 핫걸들이 많아 보여서 사진 찍기 부담스러운 느낌은 아닌 듯 채광, 식물, 조명 다 너무 좋은 곳 원래는 중간에 콘하스 한남점을 가려고 했는데 해가 떠 있을 때 다음 카페를 가고 싶어서 건너뛰었다 다음에 가보자규 보닐라츄러스 한남점 서울특별시 용산구 이태원로54가길 12 1층 마지막 종착지 비욘드문에 가기 전에 보닐라 츄러스 한남점에 가서 츄러스를 먹기로 했다 원인어밀리언과 아주 가까운 보닐라 츄러스 여기는 사진 찍으러 간 건 아니었지만 공간도 협소하고 사람도 너무 많아서 사진 찍는 건 어려울 것 같다 테이크아웃도 대기가 있어서 예약하고 매장 안에서 잠깐 기다리다가 제품을 구매했다 언니가 감자칩을 먹어보고 너무 맛있었다고 해서 나는 캔에 들은 감자칩을 샀고 언니는 츄러스를 샀다 츄러스를 나눠먹었는데 이미 원인어밀리언에서 와플로 배를 채웠음에도 불구하고 굉장히 맛있었다 겉 부분이 엄청 바삭하고 안은 부드럽다 배가 불러서 충분히 느끼지 못한 게 아쉬웠지만 그래도 만족스럽게 맛있는 맛! 따뜻하고 바삭해서 더 맛있었다 내가 산 캔 감자칩 츄러스를 먹으면서 비욘드문으로 가기 위해 버스를 탔다 해도 강하고 기온도 꽤나 높아서 좀 더웠다 비욘드문 서울특별시 용산구 회나무로13길 14-10 1층 카페 비욘드문 오늘 일정의 마지막 카페인 비욘드문 버스에서 내려서도 10분이 넘게 걸어야 했다 양산을 가져오지 않은 게 후회가 많이 되는 하루였다 그래도 내리막길이라 걸을만했다 경리단길을 따라 쭉 내려가다가 골목으로 들어가면 비욘드문을 찾을 수 있다 언니가 꼭 오고 싶어 했던 카페 주택을 개조한 것처럼 생겼다 꽤 걷다 보니 더워서 아이스 아메리카노를 시켰다 난 산미 있는 커피를 싫어해서 여기서도 다크 원두로 마셨는데 커피가 좀 쓴맛이 났다 그래도 시큼한 것보다는 낫다 직원분이 친절했다 여기는 유난히 모기가 많았다 주택 건물이라 그런가... 테이블 옆 벽에 떡하니 모기가 앉아있어서 언니가 잡아줬다 ㅋㅋ 카페 내부는 넓은 편이 아니라 옆 테이블과 많이 붙어있고 전체적으로 조용하고 작아서 내부에서 사진 찍기는 어렵다 카운터 앞에 벽으로 살짝 분리되어 있는 테이블이 있긴 한데 거기도 너무 카운터 정면이라 사진 찍기는 부끄부끄 할 듯 여기는 건물 밖에 있는 테이블과 대문 쪽에서 사진 찍기가 좋았다 오늘 간 곳 중 유일하게 콘센트가 있었다 잠시 핸드폰 충전을 할 수 있었따ㅋ-ㅋ 거의 한두 달에 한 번 꼴로 사진을 찍으니 처음엔 카메라랑 낯을 많이 가린다 그래서 여기쯤 오니까 적응이 됐다 해가 떠있어서 시간이 가늠이 잘 안됐는데 벌써 8시 가까이 돼서 저녁을 먹으러 갔다 핏제리아오 경리단길점 서울특별시 용산구 회나무로 72 돋이 언니가 알아본 화덕피자집 특이한 게 한 공간에서 60계 치킨과 같이 운영되는 것 같다 우리는 오피자를 시켰는데 루꼴라가 정말 왕창 올라가 있었다 도우가 진짜 쫄깃하고 맛있음 둘이서 한 판을 싹 비우고 나왔다 다음에 또 와서 다른 피자 먹고 싶다 피자를 먹고 나오니 어둑어둑해져 있었다 예쁜 사진을 많이 찍어서 뿌듯했던 하루~"
이태원 프렌치토스트 경리단길 비욘드문 / 한남동 나들이 아스티에드빌라트,"이태원 다녀온 포스팅은 마무리 해야지. 밥 묵고 다녀온 이태원 유럽풍 카페 #비욘드문 을 비롯 한남동으로 넘어가서 딱히 한 건 없지만 나름 인생샷만 건지고 온 ssul을 한 번 풀어볼까 함미다 이태원 유럽풍 카페 비욘드문 이국적인 따스함이 느껴지는 외관 이미 동생이 한 번 가본 곳이라던데, 좋다길래 따라와봤어요. #비욘드문 달 너머 뭐 이런 뜻의 카페입니다. 주거용으로 건축되었을 자그마한 주택을 카페로 개조하여 활용하고 있는 곳이에요. 외관보다 내부가 훨씬 예뻤어요. 따사로운 햇살과 너무 잘 어울리는 공간 무심하고 투박한 느낌에서 괜한 고급짐이 느껴짐 나는 깍두기 나는 카메오 아마 웜톤분들이 좋아하실(ㅋ지송), 전체적으로 베이지 계열 색감의 공간인데 청량한 블루와 식물들로 포인트를 줘서 더 눈길이 가는 곳이 많아요. 들어오는 입구가 앞,뒷문 두 군데 더라고요. 제가 들어온 곳은 진입로가 너무 골목이고 좁아서 도대체 여기를 사람들이 어떻게 알고 오냐- 했는데 반대편은 그래도 너무 숨어 있는 느낌은 아니었어요. 앞쪽, 뒷쪽 모두 야외 자리가 있긴 했으나 이 뒷쪽(내 기준)은 딱히 예쁘지 않고 앞쪽은 이미 자리를 다른 손님들이 차지하셨어요. 한 주택을 지하, 1층, 2층으로 나누어서 공간을 다른 용도로 사용하고 계신 것 같더라고요. 사진으로 담고 싶은 구간이 많아서 사진이 많아,, TMP Too Many Photos,,🥴 비욘드문 메뉴 주문 받는 곳 앞에 세워져있는 메뉴판 사진 담아보았습니다 :-) 참고하세욧 레어토스트(=프렌치토스트 재질)와 함께 각자 커피를 주문했습니다. 비주얼이 너무 이뻐버리네? 요즘 한동안 아이폰 인물사진모드를 사용 안했는데 동생 덕에 다시 인물모드를 가동하여 나름대로 정성들여 사진을 담아보았습니다. 레어토스트(프렌치토스트)는 딱히 제가 좋아하는 스타일은 아니지만, 이태원이나 경리단길에서 프렌치토스트를 드시고 싶은 분들이라면 비욘드문을 찾아도 좋겠다는 생각을 했습니다. 저에게는 not bad, 동생이 맛있다고 했어요! 갑자기 내 사진 투척해버리기 😏 동생 자식이가 사진을 너무 잘 찍어줌,,ㅋ캬 자그마한 화장실에 놓여있던 선반 동네에서는 흔히 볼 수 없는 스타일의 카페라서 더 인상 깊었고 만족스러웠습니다. 사람이 그리 많지 않았던 점도 너무 좋았구요, (아무래도 평일 오후라서?) 주차 공간은 예상하시다시피 따로 구비 X 주택가에 댔다가 주차단속 고지서 날라왔네여 할렐루야 ^_^,, 한남동 아스티에드빌라트 이곳 역시 유럽 향기 폴폴 나는 외관이 독특한, 한남동 #아스티에드빌라트 라는 곳이에요. 원래는 2차 카페를 갈 생각이었는데 굳이 그러지 않고 쇼룸처럼 꾸며져 있는 공간만 구경을 하고 나온 곳이에요. 인테리어 일을 한참 할 때는 이런 수입 브랜드 이름 다 꿰고 있었는데 기억이 하나뚜 안남😅 곧 다가오는 친구네 집들이 선물로 캔들이나 컵 2개 정도 살까 싶었는데 가격대가 확실히 최큼 있습니다 :) 현재 내 핸드폰 배경화면 조화를 너무 이쁘게 잘 배치해두었네- 했드니만 이거 하나하나가 다 판매 중인 작품이라대요. 400만원? 했던 것 같은데 수에 약해서 금액이 정확히 기억이 나지는 않습니다만,, 손등으로 슥 터치했더니 직원 분이 바로 엄하게 경고하셔서 민망쓰,, 여러분덜 만지지 마세요. 작품입니다!!! 작품!!! 🤨 딱히 사지 않더라도 구경하는 분들이 많았고, 구경하는 재미만으로도 매우 쏠쏠했어요. 윗층으로 올라가니 가구들도 있더라고요. 트랜디한 느낌보다는 클래식한 무드로, 고급스러움을 찾는 분들이 너무 좋아하실 듯.. 또 내 사진 투척>.< 아스띠에드빌라트는 감사하게도 건물 뒷편으로 주차공간이 마련되어 있습니다. 물론 발렛비는 발생하구요! 그래도 골목 천지인 한남동에서 뱅뱅 돌지 않고 쉽게 주차를 한다는 것만으로도 매우 만족 현재 내 카카오톡 프사 나와서 카페를 갈까 말까 고민하며 주변을 찾고 있는데 동생이 찍어준 사진,, 마음에 들어버령🫶 논픽션 매장은 처음 가보는데 한국인보다 외국 관광객이 더 많았던 것 같았다. 브랜드 이미지가 너무 트랜디해서 궁금한 마음에 핸드워시도, 크림도 사용해봤는데 딱히 내 취향의 향을 찾지는 못했다. 🙄 무튼, 의외의 예쁜 사진도 많이 건지로 한 때 무지 좋아했던 동네로 나들이를 나오게 되어 매우매우 행복했던 하루 야호 비욘드문 서울특별시 용산구 회나무로13길 14-10 1층 카페 비욘드문 아스티에드빌라트 서울플래그십스토어 서울특별시 용산구 이태원로49길 13"
"한남동 나들이 (feat. 비욘드문 카페, 용산공원)","2022년 3월 9일 토요일 3월의 지난 기록을 남겨보자 겨울을 보내준 뒤 새싹이 올라오기 시작하는 봄의 시작🌿 3월은 내가 좋아하는 달이기도 하다 이 날은 2022년 대통령 선거일이였고 투표로 하루를 시작하며 약속 장소인 한남동으로 이동하였다 2022 대통령 선거 투표 카페로 향해 가던 길, 날씨는 너무 맑았고 한남동 골목 골목 감성이 너무 좋았다 한남동 골목길 남산타워 그림자 찍기 좋아함 한남동 골목투어를 하며 도착한 곳은 비욘드문, 들어서는 문마저 내가 좋아하는 감성 그 자체였다 왠지 사람들이 많이 올 것 같아서 점심도 안먹고 오후 12시에 카페로 달려 갔더니 한적하니 딱 좋았다 비욘드문 서울특별시 용산구 회나무로13길 14-10 비욘드문 입구 따뜻한 우드톤 저 버섯조명 진짜 탐났다,,, 파는거였으면 진작에 우리집에 데려갔을 수도,,, 곳곳에 놓인 식물이들과 따뜻한 우드톤의 카페 너무 너무 내 취향이라 사진 백만장 찍기 나도 이런 공간에서 일하고 싶다,,🙃 *카페 내부모습 구경하기 앉고 싶었던 곳에 자리를 잡고, 딸기프렌치토스트와 커피를 주문했다 아 너무 맛있어 ,, 행복한 맛 탁자랑 잘 어울리길래 찍어본 사진들 르라보 바질 핸드크림 향 너무 좋다 :-) 거울은 내 방에 있는거랑 비슷하다 오랜만에 만난 언니랑 카페에서 실컷 수다 떨고 다시 한남동 골목 길을 걸으며 사진 한번 찍어준 뒤 굉장히 핫하다는 용산 공원 미군기지로 향했다 도착했을 때 사람들이 줄을 서고 있어서 순간 놀이공원 온줄 알았다 이렇게나 많이 줄을 서있다고 ,,,? 아니 여기를 이렇게 줄 서서 들어갈 만한 가치가 있을까 순간 고민하며 그냥 돌아설까 하다가 이왕 온거 한번 기다려보자 마음 먹고 기다리다보니 어느새 난 출입증을 받고 입장하고 있었다 😀 용산가족공원 서울특별시 용산구 서빙고로 137 국립중앙박물관 내가 생각하는 용산공원 베스트컷 1위, 2위 미국을 가보진 않았지만 (꼭 가보고싶다) 아주 잠깐 미국의 작은 마을을 경험 한듯한 느낌 주황색 벽돌로 둘러쌓인 건물들이 줄지어 있었고 한바퀴 쭉 돌면서 산책하기 좋았다 그리고 포토존이 많았던 용산공원 이 표지판 있는 곳이 사람들 줄 서서 찍는 포토존 포토존이면 또 그냥 지나칠순 없지 근데 줄 서 있는 사람들의 시선이 다 느껴져서 굉장히 민망했다 😅 호다다닥 찍고 도망쳤다 나 사진 되게 많이 찍었네 하하 굉장히 오랜만의 외출이라 엄청 신났었다 다 맘에 드는걸 ,,,? 용산공원에서 열심히 사진 찍고 돌아다니고 사람 구경하며 여유를 부리다가 저녁 먹으러 이동! JARI 서울특별시 용산구 이태원로54길 5-5 우리의 주문은 차돌짬뽕과 크림새우 진짜완전 맛있어 ㅠㅠㅠㅠ 이 글을 쓰고 있는 지금 또 먹고싶다 여기 목화솜 탕수육을 진짜 많이 시켜먹던데 탕수육이 동글동글하니 되게 귀여웠다 나중에 가면 탕수육 먹어봐야지 아주 든든히 배부르게 먹고 난 뒤 마지막 목적지인 한강으로 이동하였다 한강 가는길에 찍은 거울샷 히히 📸 언니랑 한강에서 두시간 가량을 걸으며 얘기했다 둘 다 진짜 잘 걷는다 ,,, 그래서 너무 좋아 정말 오랜만에 만나서 수도 없이 많은 대화가 오고갔다 너무나도 많은 일들을 겪으며 비교적 더 단단해진 지금의 나와 언니로 만날 수 있음에 감사했다 우리 둘다 정말 대견해 -! 정말 행복하고 감사하고 즐거웠던 하루의 기록 끝 #일상 #기록 #일기 #3월 #한남동 #비욘드문 #용산공원 #한강"
이태원 한남동 카페 '비욘드문' 유럽감성 카페,"비욘드문 서울특별시 용산구 회나무로13길 14-10 1층 카페 비욘드문 오늘 제가 소개할 곳은 한남동의 유럽감성 낭낭한 화이트톤의 카페에요 입구부터 너무 예쁘죠 📸 내부는 이렇게 10테이블 정도이지만 바깥쪽 테라스 공간까지 자리가 꽤 있으니 날씨 좋은 날은 테라스 추천드려요 비욘드문 메뉴판 비욘드문 메뉴판 비욘드문 메뉴판 시그니처 음식들 같은 경우엔 메뉴판에 사진이 붙어있는 점이 좋았어요 👍👍 비욘드문 시그니처 말차, 바질라임유자 에이드, 웰던 토스트 시그니처 말차 6,000원 바질라임유자 에이드 7,000원 웰던 토스트(제철과일+아이스크림) 14,900원 비욘드문 시그니처 말차, 바질라임유자 에이드, 웰던 토스트 음식에 푸릇푸릇한게 많아서 신선해보이기도 하고 빨간 토마토가 완전 먹음직-💗 비욘드문 시그니처말차, 바질라임유자에이드 시그니처 말차 6,000원 바질라임유자 에이드 7,000원 친구가 먹은 바질라임유자에이드는 상큼한 맛이 났다고하고 시그니처 말차는 일반 말차라떼 메뉴와 달리 교토의 특AAA급 말차를 사용하고, 비욘드문 생크림이 올라간 라떼에요 깊은 말차+부드러운 크림의 조화가 인상적이었어서 완전 대-만족스러웠던 맛이니 말차러버들은 주문 필수 ! ! ! 비욘드문 웰던토스트 웰던 토스트 (제철과일+아이스크림) 14,900원 이거는 비욘드문의 시그니처 토스트로, 3가지 버전이 있는데 저희는 제철과일+아이스크림 PICK ! 그런데 이름이 왜 웰턴 토스트인가 했더니 숙성시킨 토스트의 겉면을 카라멜라이징한 모습이 언뜻 보면 '고기'로 착각할정도로 싱크로율이 유사하기 때문에 지어진 이름이라고 해요 듣고보니 토스트 색이며 잘리는 모습이 진짜 고기 같기도 하고?! 아니 애초에 토스트를 카라멜라이징해서 고기처럼 표현할 생각을 하셨다는게 넘 대단하셔요 사댱님 ,, 웰던 토스트 맛있게 먹는 법 1. 같이 나온 꿀을 먹음직스럽게 뿌려준다 2. 웰던 고기처럼 칼로 슥슥 잘라준다 (?) 3. 크게 잘라 한 입 왕 ~~ 베어먹으면 진짜 꿀맛 👍 어느정도냐면 당시에 배부르다고 디저트 안땡긴다는 애가 너무 맛있다고 순삭했을정도 ㅎㅎ 한남동에서 토스트가 맛있는 유럽 감성카페를 찾는다면 '비욘드문' 완전 추천드려용 지극히 개인적인 나의 솔직리뷰 맛 : ★★★★★+★ 분위기 : ★★★★★ 음식 비주얼 : ★★★★★+★ 가격 : ★★★☆☆ 친절도 : ★★★★★ 한남동의 다른 감성카페는 요기 https://blog.naver.com/dbtjfghk3199/222817509878 이태원 한남동 브런치카페 세르클 한남 주말 오픈런 오늘 제가 소개할 곳은 요즘 한남동에서 어어엄~청 핫한 브런치카페에요 얼마나 핫하냐면 이 사진이 바로 ... blog.naver.com https://blog.naver.com/dbtjfghk3199/222797746855 한남동 한강진역 카페 예쁜 파블로바가 있는 오지힐 오늘 제가 소개할 곳은 한남동 에서파블로바로 유명한 디저트 카페에요 매일 11:30-21:00 라스트오더 20:30... blog.naver.com"
"서울 비건 식당, 한남동 몽크스부처 비욘드버거 X 비욘드미트","몽크스부처 서울 용산구 이태원로 228-1 3층 4층 한남동 683-126 영업시간 11:00 - 22:30 브레이크타임 15:00 - 17:00 주차장 없음 (주변 공영 주차장 이용) 캐치테이블 어플로 예약 가능. 비욘드미트 주주님과 함께한 몽크스부처 방문기. 평소 채식 고기에 관심이 많아서 비욘드미트를 직접 구매해서 먹어보기도 했는데 요리하는 사람이 문제인건가 정말 맛이 없었다.😭 몽크스부처에는 비욘드미트를 사용한 비욘드버거가 시그니처 메뉴로 있어서 그걸 먹어보러 방문했다. 몽크스부처 서울특별시 용산구 이태원로 228-1 대로변 3층 4층 지하철 6호선 이태원, 한강진역에서 모두 걸어갈 수 있는 위치. 주차가 힘든 지역이라 대중교통 이용 추천한다. 특이한 입구 자세히 보지 않으면 입구가 어디야? 할 수 있는 좁은 문. 올라가는 길도 굉장히 어둡고 경사가 있어 넘어지지 않도록 조심조심 올라가야 한다. 올라오자마자 의외로 예쁜 공간에 놀랐고, 진한 향 냄새가 느껴진다. 절간 느낌🍃 여기가 3층 테이블 좌석 4층은 바 자리뿐! 2인은 보통 바 자리로 예약해주시는 거 같은데 테이블 자리를 원한다면 미리 확인이 필요해보인다. 토요일 11시 오픈 시간에 맞추어 예약했더니 원하는 자리에 앉을 수 있었다. (캐치테이블 예약) 우린 3층으로. 어머나, 이럴 수가 점심 / 저녁 메뉴가 다르다. (가격 차이도 있음) 원래 먹으려고 했던 메뉴들이 거의 없었다. 단호박 감자 뇨끼와 노루궁뎅이 버섯 강정, 미나리크림파스타까지 전부... 사실 버거보다 다른게 더 먹고싶었는데. 잘 찾아보고 올걸 많이 속상했다. 비욘드버거 & 프렌치프라이 15,000원 참나물 피스타치오 파스타 16,000원 이런 어두운 인테리어지만 채광이 좋아서 낮에는 창문으로 나무가 푸릇푸릇하게 보인다. 먹고 싶은 게 없어서 슬프지만,, 또 오면 된다 또 오자 100번 얘기했다... 서울 오기 참 쉽지 않아.... 먼저 등장한 비욘드버거와 프렌치프라이 참나물 피스타치오 파스타 양이 왜 이렇게 적나 화가 날뻔 했지만 먹다 보니 배가 불렀던.... ㅋㅋㅋㅋㅋ 바질 페스토보다는 조금 향이 덜 강하고 순한 맛인데 큰 차이점은 못 느꼈다. 무난 무난했던 메뉴. 대망의 비욘드 버거! 비욘드 패티가 정말 고기 같았다. 특히 바삭거리는 식감과 (튀긴 팽이버섯인 듯?) 잘 양념된 소스와 양파, 토마토, 양파 덕분에 비욘드 미트 특유의 향이 거의 느껴지지 않았다. 고기만 따로 먹어봤을 땐 아주 살짝 느껴지지만 질감은 거의 고기와 유사함. 결론적으로, 비건이라는 요소를 생각하지 않더라도 정말 맛있다!! 1인 1버거 할 걸 후회함ㅋㅋㅋㅋㅋㅋ 비욘드미트 주주님은 평소 고기를 좋아하는 입맛에도 불구하고 맛있다고 매우 흡족하셨다. 비욘드미트의 가능성을 보았다며... 하지만 손실률에 대해서는 입을 다물었다고 한다... 다음엔 꼭 저녁시간에 방문하기로 했다. 물론 날이 따뜻해지는내년 봄에. #몽크스부처 #비건식당 #비건맛집 #비욘드미트 #비욘드버거 #한남동맛집 #한강진맛집 #서울비건 #채식식당"
[이태원/경리단길/용산/한남동 카페] 비욘드문_주택을 개조한 경리단길 남산뷰 카페,"오트밀라떼가 맛있는 경리단길 카페_비욘드문 이태원 경리단길에 위치한 카페 비욘드문. 아인슈페너, 프렌치토스트 맛집으로 유명한 무려 네이버 평점 4.8에 빛나는 카페 맛집인데 호지차로 직접 끓여내는 밀크티와 버터바도 아주 구미를 당긴다 비욘드문은 투더문이랑 같은 뜻인가요? 달넘어 가보자고~!! 전반적으로 화이트 인테리어로 마치 넷플릭스에서 본 해외 주택가에 와 있는 느낌 내부도 화이트와 원목 인테리어로 따뜻하고 세련된 느낌이 물씬이다 창문 디자인도 너무 독특하고 예쁘다 앉아서 창밖 바라보고 광합성 하면 그것이 바로 힐링 통창뷰로 보이는 주택가로 빌딩 숲을 벗어나 아늑하고 쉬어가는 기분 만끽하자구요 구석구석 사장님의 취향이 반영된 감각적인 소품들 디저트 처돌이에게 딱 좋은 버터바, 토스트, 아이스크림 토스트, 까눌레에 말차치즈케이크, 바스크치즈케이크까지 여기서부터 저기까지 다 주세요 커피는 4,500원부터 화이트 우드톤 조합의 인테리어로 이런 카페에서 몇시간이고 있으면 행복감이 점점 차오른다 취향에 맞는 공간에서 맛있는 커피 한 잔이면 인생 살 만 한 것 아니겠어요! 아인슈페너와 밀크티가 유명하지만 역시 아메리카노는 포기할 수 없어 그리고 오늘의 원픽은 아몬드오트밀라떼 이 친구가 아주 고소하고 달달하니 미쳤습니다 저 이거 매일 마실래요!!! 주방도 오픈 주방이라 빵 굽는 모습과 향도 맡을 수 있고 역시 이런 더운 여름엔 시원한 카페투어가 행복 🥹 카페투어 하는 사람들이라면 놓칠 수 없는 비욘드문 카페 비욘드문 서울특별시 용산구 회나무로13길 14-10 1층 카페 비욘드문 #비욘드문 #비욘드문카페 #경리단길카페 #이태원카페 #이태원오트밀라떼 #경리단길오트밀라떼 #한남동카페 #한남동라떼 #이태원라떼 #경리단길라떼 #경리단길아인슈페너 #경리단길버터바 #경리단길프렌치토스트 #경리단길호지차 #경리단길밀크티 #이태원버터바 #이태원프렌치토스트 #이태원호지차 #이태원밀크티 #경리단길데이트 #이태원데이트"
