title,content
"1일 1눈물의 이상한 한 주 | 지킬앤하이드 은지킬🧡, 모던샤브하우스, 한남동 라신반, 송리단길 리프커피바","월요일 아침 2주전 나와 비슷하게 입사한 동료분이 lte 퇴사하신 소식 알고나서 조금 착잡한 기분으로 바로 점심먹으러 ㅜ 보쌈 정식 갑자기 소집된 갑분미팅 그리고 갑분 야근,, 끝나지 않고 답 보이지 않는 프로젝트 끝이 보이지 않는 숫자들 이날 이쁜 셔츠 입고 왔는데 아무 소용이 없었고요 야무지게 밥에 전통주까지 먹고 집감 이날 집가는 택시에서 갑분 오열했음;; 입사하고 역대급 월요일이었던게 너무 unexpected things happened in a day 였고.. 머 뭐랄까 사실 울일 아니였는데 세상만사 다 서럽고 그런 날이길래 시원하게 택시에서 오열.. 타운홀 미팅 끝난게 이번주 가장 큰 성취였다 하나의 과제가 끝나면 새로운 과제가 던져지네 @양재 쿠니라멘 퇴근하자마자 국물에 라면 너무 땡겨서 라멘으로 핫쿠니? 시켰는데 진짜 맛있었다 비가 부슬부슬 오길래 맥주 때리고 싶어서 계획에 없던 맥주도 때리구 지인짜 오랜만에 세컨브레스도 갔는데 예전의 그 느낌은 아니고, 마스코트였던 고양이도 없어서 허전했다 하지만 양재천 특유의 고즈넉함은 밤에 가도 여전했다 티라미수 퍽퍽하다해놓고 내가 다먹음 평일 밤에 저녁먹고 2차로 라멘 조지고, 그리고 커피에 디저트까지 마시다니 이렇게 계획되지 않은 즉흥 나들이가 날 요즘 제일 들뜨게 하는 것 같다 이날 집가는데 진짜 느무 느무 피곤하고 비가 와서 그런가 온몸이 으슬대길래 바로 뻗어서 잤다.. 알고보니 생리 전날이여서 그랬던거였다.. 월요일 화요일 수도꼭지처럼 우는것도 다 심각한 pms 때문이였다 ㅋㅋ 이번 생리 직전엔 꼭 약을 잘 챙겨먹어야겠음,, ㅜ 수요일 회사 나갈까했는데 그냥 못일어나겠어서 집에서 일하다가 먹은 아점 요즘 명란젓이 너무 먹고싶어서 엄마한테 명란넣고 계란밥 해달라했는데 진짜 세젤맛.. 집에서 대충 먹는 밥중에 계란밥만큼 맛잇는건 없다ㅜ 역시 난 계란밥 덕후 29센치 이번에 대대적인 마케팅 캠페인하는데 모델로 죠지쓴것도 찰떡이고 캐치프레이즈 너무 잘정한거 같길래 저장해뒀다 당신 29하던 삶.. 강남역 지하철에서 얘네 브랜드 이미지에 맞게 되게 잘했다~~ (적당히 젊고 트렌드 하면서도 억지 청춘 신파 감성 아니라서 더 좋은듯) 싶으면서도 내가 구하던 삶은 키워드가 뭔지 출근길에 진지하게 생각해봄 ㅋㅋ.. 출근중.. 어휴 모자이크로 가릴것도 없네 먼말인지 못알아보겠는 미팅쓴,, 제일 ;; 노답인 플젝.. 글로벌 쪽이랑 미팅 진짜 했는데 인도사람들 발음 나만 못알아듣는건지 ㅋㅋ 힘들었다 근데 재밌기도 했음! 나도 싱가폴 출장 가고싶단 말이야.. 이 회사에서 나의 유일한 야망이랄까 ya리스타가 타주는 초코라떼 요즘 아이스초코 일주일에 세번씩 마심 @비야게레로 회사사람들과 어쩌다 타코 웬즈데이.. 타코인데 넘 특이한 재료가 들어가있어서 신기했다 살코기 위.. 껍데기 ㅋㅋㅋㅋ 엄청난 맛집이라고 소개해주셔서 왔는데 진짜 맛있긴했다 회사분들이랑 좋은~~ 시간~~~~~ 담날 그냥 혼자 스트레스 받아서 아점으로 리조또에 커피 시킨날 브라우니.. 요즘 자주시키네 분당 거점가서 또 일하고 혼자 역전우동가서 저녁도 먹었다.. 오 다른날 같겠지만 같은 날임 야근했고 이번주 테니스 못갔다.. 그렇게 테니스파크에서의 두달 훈련은 안녕 ㅠㅠ 퇴근길 ㅠㅠ 유독 이번주는 체력적으로도 지쳤고만 너무 술마시고싶은데 술마시기 싫어서 혼자 하이트 무알콜 때렸다 이거 기분 내기 딱임 ㅋㅋㅋㅋ 우리집 최애 과자인 바닐라꼬북까지.. 헤일리 비버 여름 룩북.. 언니 나도 저런 파란색 스크런치 있는데 왜 저런 느낌 안나는거야? 다리근육 머선일 넘 이뿌다.. 근데 더 이쁜건 오렌지색 머리의 제니.. 충격적인 아름다움 홀린듯이 바로 저장했다 아 그리고 대박인게 아빠가 출장이 다 끝나서 이제 다시 컴백홈 할수있게 됐다,,😍 서울로 다시 돌아온 아빠는 직원들이 사줬다는 여수 유명 소고기집 소고기 어쩌고를 진짜 많이 가져와서 나도 그덕에 바로 꾸워먹음 한우 추베릅.. 금요일.. 찌들어 일하다가 약속장소로 출발~~ 금요일의 해지지 않은 한남동 진심 아름답다.. 내가 젤 늦어서 빨리 후딱 가는길 @한남동 라신반 전직장에서 연이 닿은 그녀들인데 왜 다들 오랜만에 봐도 어제보고 오늘 보는거 같은지 암튼 내 이직 이후 근황 업데이트만 하는것으로도 시간이 아주 빨리 지나가벌여.. 음식 다 맛있었다.. 깔꼼 + 정갈 특히나 이 수비드 항정살이 맛있었네 후토마끼도 아묻따.. 1차에서 적당히 끝내고 요즘 핫하다는 하루필름가서 사진도 찍었다 ㅋㅋ 그녀들은 내가 철저히 가려줌 2차는 소주 달리러 @영이네 다들 내가 소주만 달리는거 보고 감탄했다.. 아 28년동안 소주 단독으로는 입에도 못댔는데 요즘 소주만 단독으로 마시기 가능 심지어 달다.. 이게 참어른인가 나의 에인젤이 또 데려다줘서 뻗어서 집옴.. 오랜만에 행복한 술자리~~~ 다음날 드디어 지킬앤하이드보러 샤롯데로!!!!! 아아아아아아아 은지킬!!!! 이날 덥고 정신없고 사람도 많고해서 막 방방 뜨진 않았는데 공연 직전이 되어서야 뮤지컬 본다는게 실감이 났다 시카고 이후 이게 얼마만이냐.. 와 s석 너무 잘보여서 이때부터 신이 났다.. 진짜 개존멋.. 박은태 지킬 장난아니란 말은 들었지만 진짜 존멋이다ㅠㅠ 흑흑 이날 오페라 글래스 안사서 간거 조금 후회됨 뮤지컬 볼때마다 이상한 방식으로 좋은 자극이 된다 ㅋㅋㅋ 돈 벌고 버는만큼 자주 보러 와야지! 한몫하지만, 뮤지컬은 올림픽처럼 탤런트를 가진 사람이 수천번 연습한 결과물이라는게 느껴져서 거기서 오는 희열이 있다. (스토리 자체나 음악 자체의 여운도 있지만..) 그래서 항상 커튼콜때 배우들 인사해주는게 더더 감동인듯 이번 커튼콜은 찢킬로 마무리해서 진짜 더 팔에 소름.. ㅠ 코시국만 아니였다면 더 소리지르고 배우들도 호응 유도했을텐데 그것만이 아쉬울뿐.. 젤리베어인지 나도 지나가다 봤다.. 계획되지 않은 첫끼에 둘다 배고파서 바로 소피텔 건물왔고 @모던샤브하우스 입장 샤브샤브 중에 젤 깔끔하고 좋아하는 식당 트러플 리조또에다가 나중에 매콤된장으로 육수 바꿔서 먹고 끝냈다 이날 오랜만에 입은 드레스 ㅋㅋㅋ 뒤에서 사진찍어주심🥺 석촌호수 한바퀴 걷고 한강과는 다른 쏘 피스풀한 이 풍경.. @송리단길 리프커피바 아 오랜만에 이런.. 감성진 카페오는거 같아서 또 기분이 많이 업됐네 심지어 내가 좋아하는 고느적한 바 자리~~~! 욕심내서 바나나푸딩도 시키고 치즈케익도 시켰는데 다 먹진 못했지만 디저트가 너무 고팠던 지라 그저 행복했다.. 커피도 산미 높은 내가 좋아하는 맛 ㅠㅠ.. 나 돌이켜보니 이때가 제일 행복했네.. 아 그리고 h님이 선물로 준 책! 이 책 너무 읽고싶었는데 감사했다 요즘.. 열심히 일도 하고 열심히 스트레스풀러 놀기도 해야해서 책과는 부쩍 거리가 멀어졌지만 다시 나만을 위한 시간을 갖는걸로! 담날 오랜만에 스팸 구워서 흰밥 먹고싶었던 그런 날 그런 일요일 아빠 겨울옷 모두 처분 내 겨울옷 드라이클리닝 모두 맡겨.. 봄옷 중에 반절은 행거로.. 스팀 다리미까지 열심히 했다 봄맞이 대청소 하니까 너무우 마음도 산뜻해졌다 별거 아닌거 같지만 진짜 많이 버리고 털 떼고 힘들었다 그리고 로또도 오천원 당첨됨 ㅋㅋㅋㅋ 저녁은 오랜만에 우리 가족 추억이 깃든 백청우 칼국수로.. 요즘 비조리도 기가막히다 식당가서 먹는거랑 같은 맛 ㅠㅠ 나 고딩때먹던 그 맛 그대로다 진짜.. 칼제비 존맛 얼큰하고~~~ 만두는 촉촉하고~~~~~~ 밥먹자마자 월요병 퇴치하려고 또 사봉 꺼내서 반신욕 이번주 지친 내 심신에 큰 위로 ㅋㅋ 사봉 ~~ 자스민 향 너무 좋다!!! 진짜 너무 고맙다.. 열심히 반신욕하고나와서 바르는 뉴 네일~~ 롬앤꺼 색상이 너무 이쁘길래 바로 사버렸다 색깔 존.예. 내가 원하는 바로 그 하늘색. 제가 거지같이 바르긴 했는데 암튼 개이쁘네요.. 아 그리고 ㅋㅋㅋㅋㅋㅋㅋ 러브이즈블라인드 리유니언 릴리즈 됐길래 바로 봤는데 세상 자극적이고 셰이크 너무 트롤이라 웃기다 걍 그놈의 sexual appeal.. 넷플릭스 가뭄속에 유일하게 볼만했던 오랜만의 예능.. 후 존잼 이번주 너무 이상할정도로 울어제끼고 감정 컨트롤이 안됐던 한주였다 다 망할놈의 생리때문에.. 체력적 버든도 있었지만 자꾸 괜찮다고 스스로 자기주문 외우는 4주동안 쌓이던게 나도 모르게 큰 fear가 되어서 터진거 같기도 하다 근데 먼일 생길때마다 족족 울었더니 그때마다 기분이 좀 이상하게 정화되긴 했다 갑자기 블로그 쓰다보니 또 생각드는건 어치피 다 먹고 살자고 하는건데 또 너무 진지해지지말자 은서야.. 그냥~~~~~~~ 내가~~~~~~제일 중요해.. only me.. 내 인생은 내가 알아서 나만 중요하게 생각하믄 된다ㅜ 한낱 사회의 이러쿵저러쿵에 휘둘리지 말자.. 아 나 다시 또 잊고 있었네 너무! 진지해지지! 말자!"
전지적 참견시점 손연재 아파트 브런치 카페 어디 에그베네딕트 알리오올리오 파스타 리프 챌린지컵 황윤정 강사 한남동 리듬체조 학원 촬영지 장소 전참시 193회 4월 2일,전지적 참견시점 손연재 아파트 브런치 카페 어디 에그베네딕트 알리오올리오 파스타 리프 챌린지컵 황윤정 강사 한남동 리듬체조 학원 촬영지 장소 전참시 193회 4월 2일 자세한 이야기 https://dktkrdl.tistory.com/9112 전지적 참견시점 손연재 아파트 브런치 카페 어디 에그베네딕트 알리오올리오 파스타 리프 챌린지컵 황윤정 강사 한남동 리듬체조 학원 촬영지 장소 전참시 193회 4월 2일 전지적 참견시점 손연재 아파트 브런치 카페 어디 에그베네딕트 알리오올리오 파스타 리프 챌린지컵 황윤정 강사 한남동 리듬체조 학원 촬영지 장소 전참시 193회 4월 2일 MBC 전지적 참견시점 193회 2022년 4.. dktkrdl.tistory.com MBC 전지적 참견시점 193회 2022년 4월 2일 방송 시간 옷 모자 가방 선글라스 티셔츠 바지 운동화 신발 자동차 사는 곳 동네 집 아파트 식당 맛집 촬영지 위치 어디 촬영장소 출연진 나이 인스타 손연재 나이 29세 1994년생 키 165cm 前 국가대표 체조 선수 인스타그램 @yeonjae_son/유튜브 UCOqkjNENaEv3VrErgE7P_kQ 손연재 리듬체조 학원 용산 한남동 리프스튜디오 02-792-2019 손연재 매니저 김수연 브런치 카페 상호 : 오아시스 한남점 주소 : 서울 용산구 한남동 745-10 이태원로45길 30 전화 : 02-790-8906 에그베네딕트 알리오올리오 파스타 반려견 손두부 화장품 모닝 드립 커피 자동차 리듬체조 아카데미이자 회사 용산 한남동 리프스튜디오 황윤정 강사 리프 챌린지컵 .. 국내에서 개최하는 국제대회 자세한 이야기 https://dktkrdl.tistory.com/9112
약수역카페 분위기 좋은 데이트코스 💚 리프커피,"오늘 나들이는~~ 감성 가득한 약수역카페 리프커피💚💛  한남동에 약속 있어서 외출했는데 시간이 좀 떠서 잠깐 커피충전하러 나들이^ㅁ^.. 저녁인데도.. ㅇㅖ쁘네 여기? 들 어 가 볼 까 👀🤍 주말에는 핫플 각이라 평일에 무조건 카페투어 하는 사람 여기 있습니당...😙 벽돌감성 모냐고요 두근두근하게~ 신당동카페💛 따스한 우드감성 가득한 리프커피! 저녁 먹을 시간이라 한산하다..! 는 나도 저녁 먹어야 하지만..그래서 커피만 마셔야지 해놓고 쿠키 하나 먹음ㅋ 카페 분위기도 좋고 직원분들 다 친절하셔서 기분 좋았던 곳..! 여기 케이크 맛있다고 소문 났던데..근데 프랜치토스트도 맛있는지 벌써 품절이라고 하셨다..ㅎ..다행이야 저녁 약속이 있어서..🥹 낮에 또 와야지~ 리프커피 할인 이벤트도 하다니요..? 갓리프 인정입니다악💚🤭 약수역카페! 리프커피는 뭐가 맛있을까아 🫠 시그니쳐랑 콜드브루가 맛있나보다 ㅠ 큐..근데 나는.. 따아로 주문..! 저녁 약속이 하필 모임입니다^^..🔥🔥 회식 할 배는 남겨놓기..메모.. 신당동케이크 맛집 리프커피..! 평일인데도 많이 솔드아웃된 상황🔥 호오 오늘은 그냥 귀여운 쿠키 하나 주문해야지~~ 초코숲💚🤎 당첨입니당!! 다음엔 브런치타임을 꼭 가져보는걸로...😘 프렌치토스트도 심플한 비쥬얼인데..저런게 더 무서운 내공을 가진 맛이라고요..후욱 후욱..☺️ 빵순이 피셜!!! 쪽파크림치즈도 뭐..ㅡ 근데 블루베리잼도 준다니..무섭네 아기자기한 감성이 가득하다! 메뉴 기다리는 동안 구경하기~😉 신당동카페! 리프커피는 케이크맛집이라 그런지 초도 다양하게 판다! 약수역케이크 맛집 왜..아니야 이제 곧 연말이니까 여기서 연말 파티케이크 알아봐야겠다 후후 🥰 케이크 꼭 먹겠다는 의지..👊👊 나른한 이 분위기...🫠🩵🩷 마음에 든다 여기 낮에 와도 예쁠 거 같은데..? 언제 나의 데이트코스로 한번 가볼까아? 뀨우😚😙 약수역카페! 헤헤 커피랑 디저트가 나왔습니다아🥰 접시가 제 스타일 입니다...🌸 작은 디저트지만.. 넓은 꽃무늬 접시에 플레이팅 해주시니 기분이 좋아졌어요..살 안 찔 거 같아...응...내마음..ㅎ 기어코..따뜻한 아메리카노의 계절이 돌아왔습니다🤭 그 머야..나 이제 위장 진짜 할매라 그런지 아이스 마시면 체끼 오려고 해서..^^.. 환절기에 따아 마셔야 한다고요🥹 슬프니까 쿠키..주문하길..잘했다...😇 가운데에 쫀득한 필링같은 텍스쳐가 ㅇㅏ메랑 너무 잘 어울린다..! 옴뇸뇸..퍼지같은 느낌인데 한 입 넣고요~~ 따뜻한 아메리카노 같이 마시면 피곤함 물리쳐버려..^^..❤️🧡 오후에 일 쉬는데 요즘..너무 놀아서 피곤한 상황ㅇㅇ.. 헤헤 내가 좋아하는 맛이다 이 쿠키...😙😚 찐득하게 안 단데 풍미는 진한 그런 쿠키..🫶 우유에 먹어도 맛있겠다 ㅠ..우유에 적셔서 냐미~~ 신당동케이크! 감성 충전은 리프커피에서🤭💚🤍 https://instagram.com/leaf_coffe.e?igshid=MzRlODBiNWFlZA== 약수역카페/ 약수카페/ 약수역케이크 /리프커피(@leaf_coffe.e) • Instagram 사진 및 동영상 팔로워 627명, 팔로잉 2명, 게시물 443개 - 약수역카페/ 약수카페/ 약수역케이크 /리프커피(@leaf_coffe.e)님의 Instagram 사진 및 동영상 보기 instagram.com 리프커피 서울특별시 중구 동호로 195-15 1층 리프커피 #약수역카페 #약수역케이크 #신당동카페 #신당동케이크 #리프커피 #약수역카페 #중구디저트카페 #약수역감성카페 #약수역데이트 #중구데이트코스 #약수역맛집 #약수역가볼만한곳 #감성카페 #서울디저트카페 #서울핫플레이스 #서울감성카페추천"
"[서산] 플라워 카페 ‘리프커피’, 💚","’리프커피’ (LEAF COFFEE) 📍충남 서산시 예천7로 22-10 1층. 📍서산 신상 ‘플라워 카페’. 📍유럽 갬성st 디저트 카페. 어느 날과 다름없이 서치하다가 발견한 예천동의 새로운 카페. 서산에도 점점 예쁘고, 감성적인 카페가 하나씩 늘고있는 듯해서 카페처돌이 빵순이는 기분이 좋다, 🌿 민트색 외관에 반해서 호다닥 오픈런했다. 서울에 사는 사람이라 그런지 왠지 연남동이나 한남동의 브런치 카페 느낌이 났다. 너무 예뻐 … ✨ 들어가자마자 보이는 귀여운 스콘들, 🥐 아이스 아메리카노랑 같이 먹으려고 빅토리아 스콘? 정확한 명칭은 기억이 나지 않는데, 아무튼 하나 주문했다. 사장님도 친절하셨고, 주문하면 직접 자리로 가져다 주신다! 오픈런이라 내가 첫 손님 같았다. 인스타에 스콘 메뉴가 올라오는 것 같았는데, 참고하면 좋을 듯 하다. 스콘은 종류별로 많이 있었고,생각보다 더 큰 느낌! 오히려 좋아. 카페 외관만큼이나 예쁜 스콘이들, 👩🏻‍🍳♥️! 맛도 궁금해진다. 대부분이 통유리에다가 층고도 높은 편이라서 … 또 넓고, 깨끗해서 카페가 너무 마음에 들었다. 진심 내 최애 카페가 될 것 같다. 바람도 살랑살랑 불어오고, 창가에서 혼자 갬성 놀이 zZ-🍃 저 문 옆에 공용 화장실이 하나 있는데, 신상카페라 그런지 엄-청 깨끗했다. 약간 깔끔이 성격인 나에게 카페에서 중요한 것 중 하나가 화장실인데, 리프커피는 쾌적+깨끗했다! 빈티지 갬성 … 존예 … 🪵 TMI인데, 이런 우드&화이트 인테리어 완전 내 스타일. 실제로 보니까 더 예쁘고, 갬성있잖아 ? 오랜만의 카페 투어이기도 하고, 혼자 와서 사진도 열심히 찍어줬다. 다음에는 엄마나 친구랑 또 방문해야지, 🌿 개인적인 의견이지만, 테이블도 많은 편인 것 같았다. 내가 주문한 아메리카노와 스콘! 창가에 앉았는데, 약간 역광이라 슬펐는데! 이렇게 저렇게 잘 찍어서 대만족. 스콘도 촉촉+부드러워서 JMT … 사진보다 실제로 더 큰 느낌이었다. 아메리카노는 약간의 산미가 있는 정도라서 산미 불호자인 나에게는 딱 좋았다. 산미 별로 안 심함 ◡̈ ☕️! 진짜 오랜만에 내 취향인 예쁜 카페에서 쉬니까 너무 힐링인 것 … 🫶🏻 리프커피 완전 강추 … 디저트도 맛있고, 친절하셔서 좋음. 플라워 카페라서 꽃도 판매하시는 것 같았다, 🪴 플라워 카페라고 하면 왠지 꽃향기 많이 날 것 같아서 냄새에 예민한 나같은 사람들은 걱정할 수도 있을 것 같은데 꽃 향도 많이 안나고! 문이 열려져 있어서 환기도 잘 되어있음! 예쁘다는 말을 몇 번 하는지 모르겠지만, 진짜 넘 예쁘구요 … 여기 진짜 또 오고싶어짐. 다른 스콘도 먹어보고 싶다, 💚 확실히 신상 카페라 진짜 깨끗하긴 하더라. 식탁, 의자, 탁자 등 다 먼지나 스콘 부스러기 같은 것 하나 없이 깰끔깰끔. 이 사진도 되게 잘 나왔다! 뭔가 마음에 드는 사진 중 하나! 날도 좋았어서 그런지, 사진도 다 선명하게 잘 나와서 행-복. 소소하지만 확실한 나의 행복 … 💛 엄마한테도 찍은 사진 카톡으로 보내줬는데, 카페 예쁘다고 하셨다! 내가 앉은 창가 자리! 오늘은 햇빛이 그리 강하지는 않았어서 혼자 잘 먹고, 잘 놀다갔다. 혼놀의 고수 … 카페 처돌이 … 오늘도 좋은 곳 하나 더 알아갑니다 춍춍-🍰 서산에서 갬성 카페를 찾는다면? 리프커피로~ 떠나기 전에 한 컷 더! 아무리봐도 외관 넘 유럽 갬성이고, 푸릇푸릇하니 색도 사랑스러움 ㅋㅋㅋㅋㅋ 민초단이기도 하다 … (어쩔티비) … 🪴 오늘 다녀와서 바로 쓰는 매우 따끈따끈한 카페후기. 그만큼 마음에 들어서 얼른 작성하고 싶었다! 이거는 오늘 내 착샷 … 오랜만에 데일리룩 찍어봤다. (저 꽃은 엄마, 아빠 주려고 미리 산 카네이션🌷) 암튼 서산 예천동 ‘리프커피’ 좋아요~ 더 자세한 내용이나 스콘 라인업은 @인스타 LEAF COFFEE 참고, ✨ 오늘도 잘 다녀왔습니다. 카페투어 후기 하나 끝〰️💚"
