title,content
신사 가로수길 카페 분위기 있고 조용한 파치노 에스프레소 바 Ver.2,"안녕하세요! 인플루언서 솔직한 여자 미쁘미예요 :D 오늘은 가로수길 조용한 카페 찾으시는 분들께 추천하고 싶은 분위기 최강 신사 카페 파치노 에스프레소 바 Ver.2 리뷰를 들고 왔어요! 흔하지 않은 새로운 감성이 가득한데 차분한 분위기 덕분에 카페 자체가 조용해서 마음에 드실거예요ㅎㅎ 심지어 커피랑 디저트도 맛있답니다😆 1. 외관 일단 이 외관을 잘 기억하세요! 지도를 보고 찾아가더라도 큰 간판이 따로 없어서 지나치기 쉽더라고요 저희도 지나쳐서 다시 돌아갔어요...ㅎㅎ 파치노 에스프레소 바 Ver.2는 파치노 에스프레소 바 건너편이자 사진 속 멋진 건물의 2층에 위치하고 있답니다😉 2. 영업시간 및 주차 정보 가로수길 카페 파치노 에스프레소 바 Ver.2의 영업시간은 매일 12시부터 9시까지인데요 라스트 오더는 8시 45분이고 주차장은 따로 마련되어 있지 않아서 주변 유료 주차장을 이용해야 하니 이 점 참고해 주세요! 3. 인테리어 분위기 인테리어가 정말 멋지지 않나요? 영화배우 알파치노를 모티브로 한 신사 카페로 알고 있었는데 사실 저는 알파치노를 잘 모르거든요? 근데도 이 공간에 입장한 순간에 영화 속 한 장면에 들어갔다는 느낌을 받았어요 확실히 무게감 있는 분위기가 수많은 다른 카페들과는 다른 새로운 매력을 선사하더라고요👍 4. 내부 좌석 내부 좌석 수는 그리 많지 않아 보였지만 그래도 20석 넘게 마련되어 있었는데요 좌석이 편한 스타일은 아니었지만 오히려 무게감 있고 심플한 의자와 테이블이 컨셉과 일체감 있고 카페를 답답하지 않게 만들어줬던 것 같아요 5. 굿즈 카운터 옆에서는 예쁜 찻잔과 머그잔 그리고 티셔츠 굿즈도 판매하고 있었네요😊 6. 메뉴 정보 메뉴는 타 카페들에 비해서는 적은 편이었지만 오히려 군더더기 없이 딱 메인들만 남겨둔 느낌이었어요 특히 위스키와 칵테일도 있는 것이 인상 깊었답니다ㅎㅎ 확실히 해가 저문 후에는 분위기 있게 위스키나 칵테일 한잔할만한 그런 인테리어긴해요🤭 7. 주문 메뉴 저희는 해가 아주 열심히 떠 있을 때 방문했기 때문에 술은 패스하고ㅋㅋㅋ 파치노 크림라떼와 리치용과 에이드, 파치노 치즈케이크 더블치즈, 휘낭시에를 주문했는데요 커피 메뉴가 주력인 곳이지만 에이드도 정말 예쁘게 나오더라고요! 에이드는 친구 메뉴지만 한 모금 뺏어 먹어봤는데 너무 달지 않고 맛있었어요ㅎㅎ 리치용과 에이드는 처음 마셔보는 맛이라 특별해서 마음에 들다 보니 망고바나나 밀크랑 민트 머스캣 에이드도 궁금해졌네요🤩 물론 제가 주문한 파치노 크림라떼 역시 그에 못지않게 정말 맛있었는데요! 맨 아래는 우유가 깔리고 그 위에 에스프레소 그 위에 크림이 올라가 있었는데 크림이 정말 쫀쫀하고 맛있었어요🙊 레시피에 시그니처 크림이라고 쓰여있던데 그렇게 소개할만 하더라고요ㅎㅎ 그리고 그 시그니처 크림을 찍어 먹어서 더 맛있었던 휘낭시에!!! 여긴 음료도 맛집이지만 정말 디저트 맛집이에요 여러분👍 휘낭시에 너무 맛있어서 친구랑 각자 집에도 사 갔는데 양쪽 신랑들까지 극찬을 했답니다ㅎㅎ 쫀쫀하고 진짜 맛있어요! 커피는 집까지 들고 가지 못하기 때문에 신랑들은 이렇게 크림과 함께 하진 못했지만 여러분들은 직접 방문하신다면 꼭 이 조합도 경험해 보시길 바래요😝 그리고 치즈케이크 좋아하시는 분들이라면 파치노 치즈케이크 더블치즈는 진짜 필수 코스입니다🙊 빵 케이크보다 짭짤한 치즈 조각을 크리미하게 먹는다는 느낌이 드는 그런 치즈케이크인데요 이거 정말 제 취향 저격이었어요! 빵 식감은 완전 겉 부분에만 살짝 있고 가운데는 전체가 다 진득한 치즈 크림 느낌이라고 보시면 될 것 같아요ㅎㅎ 8. 테이크아웃 치즈케이크 식감에 호불호가 있을 수도 있지만 저는 완전 호였기 때문에 카라멜쇼콜라도 테이크아웃 해왔는데요 집에 오는 동안 녹을까 걱정도 살짝 있었지만 이 귀여운 상자 아래 작은 아이스팩도 들어있었고 오자마자 냉장고에 넣었더니 아주 멀쩡했어요! 카페에서 나와서 3시간 후에 냉장고에 넣은 건데 그래도 멀쩡했으니 테이크아웃 생각하시는 분들은 참고해주세요ㅎㅎ 카라멜쇼콜라는 역시 짭짤한 맛보다 달달한 맛이 가득한 치즈케이크였는데요 저는 이것도 정말 맛있었지만 굳이 둘 중 하나만 선택하라면 개인적으로는 좀 더 진한 치즈의 짭짤한 맛이 강했던 더블치즈 치즈케이크에 한 표 주고 싶네요ㅎㅎ 왜냐하면 그 본연의 깊은 치즈맛이 인상 깊었거든요😁 맛있는 커피와 디저트를 좀 더 조용한 가로수길 카페에서 즐기고 싶으시다면 파치노 에스프레소 바 Ver.2에서 분위기 있게 즐겨보시길 바랄게요💕 50m © NAVER Corp. 파치노 에스프레소 바 Ver.2 서울특별시 강남구 강남대로162길 40 2층"
[서울/신사] 파치노에스프레소바 ver.2. 카페,"서울 / 신사 파치노에스프레소바 ver.2 카페 여자친구와 한성돈까스에서 밥을 먹고는 어디 카페를 가 있자고 이야기한다. 여자친구가 예전에 친구들과 가 본 곳이라고 하던데, 치즈케이크가 너무 맛있었다고, 전 날 통화할 때부터 나랑 가고 싶다고 이야기했던 곳이어서 여기로 가게 된다. 조금 거리가 있어 걸어서 가 보게 된 곳이 파치노에스프레소바. 길 건너에 1호점이 있는데 1호점은 자리가 조금은 불편해 보여서 옆 건물 2층에 있는 2호점으로 올라가보게 된다. https://naver.me/FWP8V3sI 파치노 에스프레소 바 Ver.2 : 네이버 방문자리뷰 96 · 블로그리뷰 84 naver.me Google Maps : 5.0 / 5.0점 (13 Reviews) Kakao Maps : 4.5 / 5.0점 (4 Reviews) 원목으로 분위기를 낸 인테리어가 느낌이 있다. 마치 유럽의 일상적인 바 내지는 미국에 있는 어떤 허름한, 클래식한 느낌이 조금은 섞여 있다는 생각이 드는 인테리어를 하고 있다. 그 와중에 색을 맞춘 테이블과 의자들이 줄 지어 있는 것도 포인트인 곳이다. 의자가 높고 테이블이 낮아 다소 불편하긴 하지만 감성 카페라면 뭐... 벽 한 켠 있는 대부라든지, 알파치노의 포스터 등이 그런 클래식함을 좀 더 더하는 느낌이다. 커피는 좀 더 고소함이 도드라지는 커피였고, 파치노 에스프레소라고 적힌 머그가 인상적이었다. 건너편에 편집샵이 있었는데 그 곳에서도 이 디자인의 머그컵을 팔고 있더라. 하지만 정말 인상적이었던 것은 치즈 케이크이다. 카라멜 초코 어쩌고 치즈 케이크도 있었고 이 더블 치즈 케이크도 있었는데 이 더블 치즈 케이크가 인상적이었다. 질감은 중간으로 갈수록 반쯤 액체스러운 흐물거리는 식감이 특징이었다. 치즈향이 굉장히 진하게 나는데 이게 블루치즈의 꼬릿꼬릿한 향까지 은은하게 섞여 있다. 치즈 케이크라 하면 모름지기 좀 더 단맛을 강조하는데 이런 치즈의 특징을 살린다는 것 자체가 나에게는 꽤 재밌는 포인트였던 듯. 여자친구는 두 번째 와 보는 것이었는데 원래는 아니었던 것인지, 아니면 내가 이 말을 했기 때문에 그런 생각을 가진 채로 먹기 때문인지 꼬릿꼬릿한 블루치즈의 향이 난다는 이야기를 하면서 먹는다. 조금 자리는 불편하긴 하지만 분위기도 좋고, 커피와 케이크의 맛도 좋다. 그래서 생각보다 꽤 앉아 있으면서 커피와 케이크를 먹으며 시간을 보낸다. 50m © NAVER Corp. 파치노 에스프레소 바 Ver.2 서울특별시 강남구 강남대로162길 40 2층"
[신사동 가로수길 힙한 카페] 파치노 에스프레소 바 Ver2,"신사동 가로수길에 가면 현대카드에서도 소개한 힙한 에스프레소 바를 만날 수 있어요. 오늘 소개해드릴 파치노 에스프레소 바는 1호점과 2호점이 있어요. 오늘은 2호점을 방문할 거에요. 시간 없는 분은 유튜브 쇼츠로 보고 가세요. https://www.youtube.com/shorts/J7AH17sUgMQ 1호점의 외관을 보면 고급스러움 그 자체에요. 1층에 위치하고 있어요. 건너편에는 파치노 에스프레소 바 2호점이 위치해있어요. 건물 입구 입주사들 소개에서도 2층 오른쪽에 파치노 에스프레소 바 2호점이 위치해있다고 표시되어 있어요. 계단을 올라가면 파치노 에스프레소 바 2호점을 만날 수 있어요. 앞에 문을 힘치게 밀면 돼요. 처음엔 문이 열리지 않아 잠긴 줄 알았는데 힘을 줘서 문을 밀면 되니 당황하지 마세요. 메뉴판 신사역 가로수길 힙한 카페 파치노 에스프레소 바 2호점에서는 다양한 에스프레소 메뉴를 만날 수 있어요. 에스프레소 바라서 에스프레소와 콘판나를 주문했어요. 콘판나는 에스프레소, 밀크 크림, 카카오파우더가 들어있어요. 파치노 치즈케이크는 2종류에요. 더블치즈와 카라멜쇼콜라가 있는데 더블치즈를 주문했어요. 휘낭시에는 선물세트로 구매할 거에요. 시가 모양으로 멋스럽게 생겼기 때문이에요. 휘낭시에 세트도 있고, 치즈케이크 세트도 있으니 둘 다 드실 분들은 세트메뉴로 드시는 걸 추천해요. 위스키나 칵테일도 주문할 수 있어요. 메뉴 이름을 보니 영화 대부가 생각나요. 신사역 가로수길 힙한 카페 파치노 에스프레소 바 2호점의 치즈케이크는 버터와 밀가루, 글루텐을 사용하지 않았어요. 조각 케이크 1개는 6,500원, 케이크 완전체는 26,000원이에요. 에스프레소 바 이름에서 나타났듯이 파치노 에스프레소 바는 배우 알 파치노에게 영감을 받아 만들었어요. 휘낭시에 4개 세트 패키지 디자인 한 번 보세요. 구매할 수 밖에 없어요. 이렇게 힙한 패키지 디자인의 휘낭시에는 본 적이 없어요. 선주문 할 수 있는 가죽벨트도 걸려있었는데 파격적인 디자인이에요. 유리창 너머로 건너편 1호점이 보여요. 1호점 맞은 편에 2호점이 있다는 점이 독특했어요. 영화 히트에서 가져갔던 돈뭉치 소품도 진열되어 있었어요. 주문한 에스프레소와 콘판나를 열심히 제조 중이에요. 파치노 에스프레소 로고도 멋스러워요. 굿즈 전시공간도 화장실 가는 통로에 배치되어 있어요. 작은 공간을 알뜰하게 사용하고 있어요. 왼쪽은 화장실로 들어가는 입구에요. 남녀 공용이에요. 실내를 녹화하는 CCTV도 있고, 앉아서 먹을 수 있는 좌석 테이블도 5개 테이블 정도가 위치해있어 2인이 즐기기에도 좋았어요. 주문한 에스프레소와 콘판나, 더블치즈케이크가 나왔어요. 1열이 에스프레소와 설탕, 2열이 콘판나, 더블치즈케이크에요. 에스프레소가 낯선 친구도 한 모금 마시더니 쓰지 않고 고소한 맛이 일품이라고 했어요. 에스프레소 하면 쓰고 텁텁한 맛이라고 생각하는 분들이 아직도 있는데 그런 분들은 신사 가로수길 힙한 카페 파치노 에스프레소 바에 오면 생각이 바뀔거에요. 주문한 메뉴를 한 곳에 모아놓고 사진을 촬영한 후에 본격적으로 마셔볼게요. 콘판나의 에스프레소와 우유크림, 카카오 파우더의 조화가 잘 어울려요. 부드러운 우유크림과 달콤한 카카오파우더의 조합은 매력적이에요. 더블치즈케이크를 포크로 자르는 순간 깜짝 놀랐어요. 포크로도 부드럽게 자를 수 있는 점도에요. 한 입 먹어보니 지금까지 카페에서 먹어본 맛있는 치즈 케이크 중 세 손가락 안에 들어요. 알 파치노가 주연을 했던 작품의 비디오 테이프를 장식장에 넣어놨어요. 바리스타 분이 다른 테이블의 주문을 받아 제조하고 있었어요. 유리창 너머로 보이는 풍경에 파치노 에스프레소 바 1호점과 아우어 베이커리가 눈에 들어와요. 알 파치노 영화 중에 다먹어라이언이 본 영화를 생각해보니 '대부','스카페이스', '데블스에드버킷', '히트' 가 생각나요. 알 파치노에서 영감을 받은 탓인지 커피 원두백에도 알 파치노 일러스트가 프린트되어 있어요. 네 종류의 스페셜티급 원두를 적절히 섞은 파치노 시그니처 블렌딩 원두도 판매하고 있어요. 마이클만 감독의 영화 히트에 출연한 알 파치노 모습을 담은 피규어도 진열되어 있어요. 지갑이 열릴만큼 굿즈 퀄리티가 상당했어요. 더블치즈케이크 먹고나니 포장하고 싶을 정도로 매력적이에요. 발킬머, 로버트드니로와 함께 출연한 알 파치노의 모습은 카리스마 그 자체였어요. 은행강도를 추격하는 형사 역할을 멋지게 수행했었어요. 신사 가로수길 힙한 카페 근처에는 힙한 빵집도 있어요. 힙함은 서로 끌어당기는 힘이 있나봐요. 파치노 에스프레소 굿즈는 일반 카페에서 보던 굿즈 퀄리티를 넘었다고 생각해요. 근처 나이스웨더에서 판매할 정도로 퀄리티가 좋아요. 파치노 에스프레소 2호점에서 구매한 휘낭시에 세트에요. 알 파치노가 생각나는 지폐와 사진이 들어있고, 시가처럼 생긴 휘낭시에 4개가 한 팩에 들어있어요. 파치노 에스프레소 휘낭시에에 금테를 두르니 시가 느낌으로 변신했어요. 신사동 가로수길 힙한까페 파치노 에스프레소 바 2호점은 알 파치노에서 영감을 받았다는 걸 매장에 방문하자마자 알 수 있어요. 고풍스런 인테리어에 잠시 취했다가 에스프레소와 콘판나, 더블치즈케이크까지 주문해서 먹어봤어요. 에스프레소는 고소하고 콘판나는 달달하고 더블치즈케이크는 달콤하면서도 꾸덕한 깊은 치즈맛이 나요. 1호점과 2호점이 마주보고 있고 에스프레소 좋아하지 않는 친구도 가서 반하고 오는 에스프레소 바로 인정해요! 신사동 가로수길 힙한카페 파치노 에스프레소 바 2호점에서 에스프레소와 더블치즈케이크를 먹고 반한 다먹어라이언의 방문기 50m © NAVER Corp. 파치노 에스프레소 바 Ver.2 서울특별시 강남구 강남대로162길 40 2층 본 포스팅은 업체로부터 서비스를 지원받아 작성하였습니다. #파치노에스프레소바 #알파치노 #에스프레소맛집 #콘판나맛집 #더블치즈케이크 #신사동가로수힙한카페 #파치노에스프레소바ver2 #파치노에스프레소바2호점"
가로수길: 이국적인 분위기가 매력적인! 파치노 에스프레소바 Ver 2.,"오랜만에 가로수길 나들이! 안가본 카페에 가보고 싶어서, 파치노 에스프레소바 2호점 방문. #파치노에스프레소바 #파치노에스프레소바ver2 #파치노에스프레소바2호점 파치노 에스프레소바 1호점. 작은 테라스가 있는 공간. 바로 맞은편, 2층이 파치노 에스프레소바 버젼 2. 1호점은 가봤어서, 오늘은 2호점으로ㅎㅎㅎ 요런 문을 열고 들어서면~ 이런 공간이~~ 외국 오페라 극장 같기도 하고. #파치노에스프레소바메뉴 1호점이 에스프레소 메뉴는 더 다양하다. 시그니처 메뉴는 동일. 치즈케이크랑 판나코타도 있다! 시그니처 메뉴가 궁금해서 주문한 파치노 크림라떼 6,000 평일 오후에 방문했더니, 손님이 2팀뿐이라 참 조용하고 좋았다! 라떼 베이스에 카카오 파우더가 들어가서 그런지, 초코 크림라떼 맛이랄까? 커피 맛보다는 초콜렛 맛이 강해서, 내입맛엔 전에 마신 에스프레소가 더 맛있긴 했다. 크림은 매우 쫀쫀~ 파치노 크림라떼. 재생 0 좋아요 0  접기/펴기 파치노 크림라떼. 통창으로 보이는 1호점. 처음에 바 자리에 앉았다가, 사진이 역광이라 자리 옮긴이ㅎㅎ 이 극장자리 앞에서 사진 찍으면 너무 멋질것 같다! 물론 난 혼자여서 못찍었지만...🙄 스타일리시한 바리스타분이 매우 친절하셨고^^ 무엇보다 여기 음악이 너무 취저🤎 올드 힙합?인가. 파치노 에스프레소 바 VER 2. 재생 1 좋아요 0  접기/펴기 파치노 에스프레소 바 VER 2. 독특한 분위기와 맛있는 에스프레소를 즐길 수 있는 곳! 1호점 테라스도 좋지만, 이곳만의 분위기랑 음악이 너무 매력있다. 파치노 에스프레소 바 Ver 2 0507-1450-4453 매일: 12:00 ~ 21:00 라스트 오더: 20:45 주차: 불가 / 테이크아웃 -1,000 50m © NAVER Corp. 파치노 에스프레소 바 Ver.2 서울특별시 강남구 강남대로162길 40 2층 파치노 에스프레소바 가는 길목에 있는 #누데이크신사 여전히 웨이팅이 길었다. 조만간 가봐야지! #템버린즈신사 핸드워시 사고 싶어서 들른 템버린즈. 심플한 패키지가 맘에 든 바디워시 & 바디크림. 바디워시지만 NIMBUS 님버스라는 향이 맘에 들어서 구입! 외쿡 관광객들 필수 코스인듯! 나도 괜시리 제니앞에서 찍어봤다ㅎㅎㅎ 지금도 핸드워시로, 때로는 바디워시로 잘 쓰고 있다! 별거 없지만, 즐거웠던 가로수길 나들이 끝~"
신사역 놀거리 카페 파치노 에스프레소 바 Ver.2,"50m © NAVER Corp. 파치노 에스프레소 바 Ver.2 서울특별시 강남구 강남대로162길 40 2층 신사역 놀거리 카페 파치노 에스프레소 바 Ver.2 🏠 서울 강남구 강남대로 162길 40. 2층 ⏰ 매일 12:00 ~ 21:00 / 20:45 라스트 오더 📞 0507-1450-4453 📍 단체 이용 가능, 포장, 무선 인터넷 🚇 지하철 3호선 , 신분당선 신사역 6번 출구에서 613m 🚘 주차 근처 주차장 이용. 주말 데이트 코스 겸 가로수길 나들이를 다녀왔다. 그 길에 방문해 본 카페 파치노 에스프레소 바 Ver.2 매장이다. 1호점 바로 앞에 건물 2층에 위치해 있는데 나는 2호점으로 방문을 해본 것이다! 매장을 찾아가는 길은 어렵지 않다. 가로수길 쪽으로 쭉 들어오면서 네이버 지도를 참고하면 쉽게 매장을 찾아올 수 있다. 건물 2층에 SONA 옆에 위치해 있다고 쓰여 있다 PACINO espresso 매장 이름에서부터 풍겨오는 느낌을 보면 눈치가 빠른 사람들은 바로 알아차릴 수 있을 텐데 배우 알 파치노 에게서 영감을 받아서 만들었다고 한다! 매장 내부를 보면 딱 알 수 있다 아! 찐 알파치노 마니아 사장님의 느낌! 파치노 에스프레소 바에서 맛있기로 소문난 디저트가 있는데 이 포스터를 보면서 힌트를 얻을 수 있다. 내가 먹어본 치즈케이크 중에서 가장 맛과 매력이 있는 파치노의 치즈케이크다. 아래서 본격적인 이미지로 비주얼 올 보여줄 예정이니 일단 매장 안으로 들어가 준다. 매장 내부는 전체적으로 분위기가 앤티크함과 힙함이 공존한다고 해야 하나 매우 멋스럽게 꾸며져 있는 에스프레소 바 였다. 영화 <스카페이스>의 한 장면을 콘셉트로 만든 카페라고 한다. 매장 공간은 정말 알차게 꾸며져 있었다. 여러 포스터들이 있고 앤티크 한 목재들로 정말 깔끔하게 인테리어 되어 있는데 딱 매장 안에 들어갔을 때 느껴지는 분위기는 아늑하면서도 무게감이 느껴진달까 스피커?에도 파치노 에스프레소 바 라고 쓰여 있고 그 주변에서 은은한 조명도 나오던데 이런 조명으로 인해 매장 안 분위기가 더욱더 합하게 느껴지는 것 같았다. 1호점이 보이는 통창 근처에는 이렇게 돈다발 탑 모형이 있다! 탐나지만 모형이다 눈으로만 구경하길 :) 근처에서 사진을 찍는다면 재밌는 사진을 한 장 찍어 올 수 있을 것 같긴 하다. 매장 곳곳에서 느껴지는 무게감 하지만 그 무게감이 부담스럽지 않다. 최적의 방문 인원은 2~4인 정도의 구성으로 매장을 방문한다면 정말 편안하면서도 아늑하게 쉬고 올 수 있는 공간이라고 보면 될 것 같다. 파치노 에스프레소 바 Ver.2 의 메뉴판이다. 주문은 위에 보이는 곳에서 주문을 해주면 된다 우리가 주문한 음료와 디저트 메뉴들은 아래와 같이 주문했다. 에스프레소 - 4,500원 파치노 크림 라떼 - 6,000원 망고바나나 밀크 - 7,000원 휘낭시에 - 2,800원 파치노 치즈케이크(더블치즈) - 6,500원 이렇게 주문 완료. 나는 통유리 쪽 공간에 자리를 잡고 앉았다. 저기서 창문 너머로 보이는 1호점을 보는 재미도 쏠쏠했다. 가로수길 핫플레이스라서 그런지 1호점, 2호점 모두 사람들이 끊임없이 찾아왔다. 우리가 주문한 음료와 디저트를 준비해 주시는 뒷모습도 사진으로 한 장 담아보기. 매장에 계신 직원분들이 모두 다 너무나도 친절하셨다. 메뉴에 대한 설명도 해주시고 주문한 메뉴도 직접 가져다주셨다. 우리가 주문한 음료와 디저트 메뉴들이 다 세팅되어 나왔다. 시가를 연상케 하는 모양의 휘낭시에가 정말 인상 깊었는데 사진은 없지만 4개짜리 휘낭시에 세트 패키지 박스는 더 힙하게 생겼다. NO 버터, NO 밀가루 글루텐 프리로 파치노의 시그니처 치즈케이크 - 더블치즈 이건 정말 무조건 시켜보고 주변에 선물용으로도 포장해가는 걸 추천한다. 포장 패키지에는 섬세하게 미니 아이스팩까지 박스 바닥에 깔려져 있어서 싱. 싱. 한 파치노의 더블치즈 케이크를 선물해 줄 수 있다. 신사역 놀거리 카페 파치노 에스프레소 바 Ver.2 재생 2 좋아요 0 00:00 00:06  신사역 놀거리 카페 파치노 에스프레소 바 Ver.2 정말로 꾸덕꾸덕한 더블 치즈 케이크를 포크로 떠먹는 모습을 찍어 봤다. 나이프가 아닌 포크를 이용해서도 손쉽게 잘릴 정도로 매우 부드러운 치즈 케이크라고 볼 수 있다. 여자친구도 매우 만족스러워해서 카페 나오는 길에 치즈케이크를 하나 더 포장해서 나올 정도로 매우 만족스러운 맛이었다. 신사동 가로수길에 이런 힙한 카페가 어디 또 있을까..!!! 이건 파치노 크림라떼의 비주얼이다. 에스프레소, 시그니처 크림, 우유, 카카오 파우더가 들어간 음료 메뉴로 적당한 카페인도 섭취할 수 있고 달달한 시그니처 크림과 재료들의 조화가 찰떡같이 어우러져서 정말 밸런스 있는 음료 메뉴였다. 에스프레소의 맛은 상당히 묵직하면서도 맛있었다. 에스프레소에 최적화된 미디엄 다크로 볶아진 원두는 고소 하면서도 풍부한 원두의 향이 느껴지는 것 같았다. 그다음 가볍게 마시기 좋았던 망고바나나 밀크 메뉴다. 망고와 바나나의 단맛이 우유의 부드러움이 잘 섞인 메뉴인데 가벼우면서 달달한 음료를 마시고 싶은 사람들이 주문하기 좋은 음료였다. 정말 맛있게 먹었던 치즈케이크까지 하나 포장해서 집으로 복귀! 정말 독특한 분위기의 가로수길 카페 파치노 에스프레소 바 Ver.2 마치 알파치노 영화 세계관에 들어온 듯한 클래식한 감성과 분위기를 느낄 수 있는 카페 이상의 문화와 공간의 조화를 경험할 수 있는 아주 매력적인 카페였다. 개인적으로 에스프레소와 치즈케이크를 너무 맛있게 먹어서 무조건 재방문 의사가 있는 곳이다."
