title,content
[한남동카페]테라스가 예쁜 카페 한남작업실,"최근에 친구와 약속이 있어 다녀왔던 #한남동 골목 구석구석 언제 이렇게 예쁜 곳들이 많아졌는지, 구경하는 재미가 있더라구요 이 날 저희가 들른 곳은 한남작업실이라는 카페인데~ 허명욱 작가님이 운영하는 곳이라고 합니다 그런만큼 카페 내부에 시선을 끄는 볼거리들이 많았습니다:) 한남작업실은 주택을 개조해서 만든 카페인지라 주택가에 위치해 있는데 그럼에도 눈에 확 띄어 그냥 지나칠 일은 없으실 것 같아요 입구에서 얼핏 보이는 테라스가 너무 예쁜 곳이었거든요! 저흰 이날 덥기도 하고, 비까지 와서 안쪽에 자리잡긴 했지만 더 선선해질때 다시 온다면 테라스에 앉고싶더라구요 더욱이 조명이 켜진 테라스는 정말 분위기 있었습니다!!! 비가 온 뒤라, 초록이들도 더욱 싱그러워 보이네요~ 맨 처음 카페에 들어서면 추억의 아톰이 반겨줍니다 그리고 아톰이 있는 쪽으로 더 들어가면 이렇게 카운터가 나옵니다 한남작업실은 디저트류도 유명한 것 같던데~ 특히 말차와 흑임자로 된 디저트가 많더라구요 가격은 좀 있는 편이었어요!! 저흰 이 날 이미 파이프그라운드에서 피자와 파스타를 먹고 배를 두둑히 채운 상태라 디저트는 패스하고~ 음료는 둘 다 흑임자크림라떼를 주문해보았습니다 그리고는 본격적인 카페 구경에 나섰는데요 작가님이 아톰을 좋아하시는 걸까요? 한쪽 구석에 이렇게 귀여운 대왕 아톰과 꼬마 아톰들의 조형물도 보이고, 실제 작업 때 사용되었던 도구들인지는 모르겠지만~ 한남작업실이라는 이름과 잘 어우러지는 작업대와 도구들이 눈에 띄었습니다 분위기가 좋다보니 여기서 소개팅 하시는 분들도 많더라구요! 저희가 있는 동안만해도 두 테이블에서 소개팅을 하고 계셨습니다ㅎ 오른쪽 사진에 보이는 테이블은 창밖뷰가 예뻐서 탐났던 자리인데~ 자리가 나면 옮기고 싶었지만 아쉽게도 역시나 자리가 안나더라구요 그렇게 친구랑 둘이서 카페 구경도 하고 사진도 찍고~ 하다보니 금새 흑임자크림라떼가 나왔습니다!! #한남작업실 은 테이블도 그렇고 이런 식기류까지 참 감각적이더라구요 특히 색감이 정말 예쁘죠? 흑임자크림라떼는 이렇게 에스프레소를 직접 넣어서 마시는데요~ 흑임자 농도가 진해서 고소한데다 적당한 단맛이 좋았습니다!! 그런데 마시다보면 흑임자 먼저 다 먹고 에스프레소만 남게되어 흑임자크림라떼의 정체성을 잃어버리게 될 수 있어요:) 그래서 제 친구는 직원분께 흑임자만 조금 더 주실 수 있는지 여쭤보았는데 감사하게도 조금 더 가져다주시더라구요!! 하지만 또 흑임자를 너무 많이 넣게 되면 음료가 굉장히 걸쭉해지니 맛보면서 조절하시면 좋을 것 같아요~~ 전 다음에 한남작업실을 가게되도 #흑임자크림라떼 주문할 것 같네요^^ 아!! 다만 흑임자는 소개팅 하시는 분들이라면 조심 또 조심:) 이유는 다들 아시죠?ㅎㅎ 마음껏 웃지 못하실 수 있어요~ 모처럼 친구와의 데이트였는데 좋은 곳에서 기분좋게 수다떨고 폭풍 사진찍으며 즐거운 시간 보내고 왔네요!! 다음에는 남편 한 번 데리고 가야겠어요:) 50m © NAVER Corp. 한남작업실 서울특별시 용산구 이태원로55나길 7 #한남동카페 찾으시면 한남작업실 한 번 들러보셔요:) 이상, Sotong이었습니다!!"
한남작업실/한남동 카페 추천/ 한남작업실 메뉴,#한남동카페추천#한남작업실메뉴#한남카페#카페추천#한남작업실#이태원카페 50m © NAVER Corp. 한남작업실 서울특별시 용산구 이태원로55나길 7 안녕하세요 애플이입니다🤨 한남동 카페 추천할게요 #한남작업실 이라는 곳인데요 11시 오픈 한다고 합니다 주말이라 사람들이 많았어요 야외 테라스와 마당도 가득 매장안에도 사람들이 많아요 매장안에는 다양한 작품들이 있는데 옷칠로 유명하신 #허명욱작가 작업실이자 개인카페라고 해요 아톰 작품 너무 맘에 들어서 엄청 찍었어요🖤 🙊 카페도 다양한 작품이 있어요 아메리카노/애플시나몬라떼 흑임자 케잌 컵과 트레이 손잡는 부분까지 직접 만드신건가? 하는 느낌 뭔가 특이 했어요 흑임자 케이크는 처음이었는데 의외로 엄청 맛있었어요 크림도 많구 근데 느끼하지 않고 아메리카노랑 완죤 맛있어요 보통은 포크 쥬는데 젓가락을 주시더라구요 그거도 엄청 이색적이었습니다 창가쪽 테이블 자리에 앉아서 골목에 해가 지는 모습을 보며 힐링 했답니다🧡 멋진 작품도 보고 분위기도 맛도 핫한 좋은 카페 추천 할게요 ☕️☕️☕️ #한남동카페추천 #한남작업실 #이태원카페 #한남동카페 #허명욱작가 #허명욱아톰 #애플시나몬라떼 #흑임자케이크 #핫한카페 #카페분위기좋은곳 #한남동야외테라스 #한남동데이트코스 #한남동핫플레이스 #한남동갤러리카페
용산구 한남동 카페 한남작업실,"안녕하세요 ! 이번 주는 한남동에 위치한 카페 ""한남작업실""을 다녀왔습니다. 이번에도 용산에서 미용을 하고 있는 친구와 같이 가게 되었는데요 ㅎㅎ 지난번 다녀왔던 콘하스 바로 옆에 위치해있었습니다. . . . 이번에도 입구 샷 먼저!!!! #한남동 #카페 #한남작업실 #한남작업실 영업시간 ! 한남작업실 한남점 : 0507-1320-5620 주소 : 서울 용산구 이태원로55나길 7 영업시간 : 매일 11:00 - 22:00 주문하고 입구부터 사진 찍기!!!!!!! 입구부터 조명의 분위기가 좋았던거 같아요ㅎㅎㅎ저 사진 찍는다고 음료가 나온지도 몰랐어요.. 메뉴판 사진 이쁘게 찍고 싶은데,,자꾸 위쪽에 빛이 반사돼서 휴대폰 돌려가며 찍어버리기ㅠ 이게 가장 최선이였어요.... 주방은 옆으로 널찍해서 좋았던 거 같은데 동선이 조금 불편할 거 같았어요. (별걸 다 신경 쓰네^^) 저는 사실 어딜 가도 아아로 통일.... 친구는 딸기라떼로 주문했는데 생각보다 맛있어서 내가 다 먹어버리기 구석구석 인테리어 좋았어 이미 우리가 들어갔을 때 자리가 거의 만석이었어요,,야외도 있어서 밖에 앉았다가 바람이 너무 불어서 5분 만에 후회하고 바로 들어오기ㅋㅋㅋㅋ 화장실 가는 길도 이쁘게 해뒀네,,우리가 계속 탐내던 자린데 저희 일어나니깐 같이 일어나셨어요ㅎ 저 자리는 다음 기회에 ʕʘ̅͜ʘ̅ʔ 사진 하나도 못 찍어서 후다닥 찍어버리기 ! 조명 때문에 몸에 반딧불이 붙은 줄.... 다음에 더 멋지게 찍어줄게 너무 추워서 손 떨렸어 한남작업실 ! 야외까지 합치면 좌석도 많았고 커피도 맛있었고 내부도 깔끔하고 이쁘게 인테리어한거 같아요. 여름에는 야외에 앉아서 얘기 나눠도 좋을 거 같아요 다음에 또 방문해야겠어요~~ . . . 그럼20000👋 50m © NAVER Corp. 한남작업실 서울특별시 용산구 이태원로55나길 7"
한남동 카페 추천 - 초록초록한 외부 테라스석이 너무 예쁜 한남작업실,"50m © NAVER Corp. 한남작업실 서울특별시 용산구 이태원로55나길 7 1층 한남작업실 본격 무더위 전에 다녀왔던 한남작업실 입구부터 식물들 빼곡한게 증맬로 제 스타일이어요 계단을 올라오면 보이는 스탠디 간판 녹슨 느낌마저도 갬성으로 포장 가넝.. 📦 완조니 여름이어따... 사진 아입니까 막 찍어도 일단 밝고 초록초록 사진 진짜 잘나오는 한남작업실 넘나 맴쏙들💚 자자 일단 메뉴부터 시켜놓고 잠깐 에어컨 바람 쐴게여 카페 들어오기 전에 살짝 돌아다녔더니 얼굴 벌개지고 더운 상태🔥🔥 카페 내부도 슬렁슬렁 구경 하고욤 이런 결 살린 나무 테이블 너무 조아요 집에도 두고싶지만 먼가 이 감성 안나올거같아서 고민만 수백번...🥲 이런 작품? 오브제?들은 진짜 작업을 누가 하신건지 아님 기성품을 갖다놓은건지는 모르겄지만 ‘한남 작업실’ 이라는 이름에 넘 잘 어울리는 느낌 내부 한쪽 공간에 요렇게 마치 전시회처럼 꾸며진 곳도 있고요 주문한 커피 나오기 전, 일단 야외석에 자리 잡았어요! 평일 낮이었지만 은근 자리가 없어서 사알짝 눈치싸움..👀 아 맞다 한남작업실에는 고영희들이 자주 출몰 삼색고양이 사랑해 🧡🐱🧡 시원한 아이스 바닐라빈라떼와 애플시나몬 디저트 ☕️🧁 아 근데 저 트레이랑 플레이트 맘에 들어서 찾아봤는데 옴마야 가격 너무 비싸서 바로 내려놓았읍니다 암튼 갠적으로 플레이팅도 넘나 맴에 들었어요 아잇 허지만 조금 아쉬웠던건.. 요 빵은 솔직히 기대만큼 맛있진 않았고요 그냥 나쁘지 않은 수준🙊 커피는 너무 맛있었어요 🫶 특히나 저 컵!!! 저 메탈인지 뭔지 저저저 아무튼 저 컵까지도 너무너무 시원해서 음료도 더더 차갑고 맛있는 느낌! 먹지도 않고 대체 사진만 몇장을 찍은거시여 껄껄 그늘에 앉아 있으니 바람 살랑살랑 불고 커피는 맛있고,, 와 진짜 이 감성이지 🍃 갠적으로 식물을 진짜 조아해서 집에도 열심히 식물 들이고 있는 중인데,, 내가 만약에 정원이 있다면 한남작업실 요 야외 느낌으로다가 꾸미고 싶은 느낌 봄-초여름 이때 감성 아시쥬.. 막 파릇파릇 초록초록 해는 따뜻하지만 바람은 시원해 머 이런 느낌적임 느낌 대문자 T에게도 갬성 주는 너란 공간.. L O V E 🫶 재방문 의사는 뭐 이만프로고요%%% 무더위가 식은 후 가을쯤 다시 오겄어요 저는 그럼 이만.. 🍃"
"한남동, 이태원 자연친화 분위기 좋은 카페 [한남작업실]","7월초. 내가 블로그를 맘먹기전에 친구들의 생일파티가 있어서 가벼운 모임을 가졌었다. 한남동에서 만나 점심식사를 하고 갈만한 카페를 물색하다가 요기 [한남작업실]을 발견했다. 한남작업실 한남동 745-2 02-792-5620 11:00~22:00 생일자 두분 공주님으로 모시겠다!! 아웃핏도 아주 걸맞게 예쁘게들 하고오셨다. 이때는 블로그 시작하기 전이라 전체적인 외관사진이 없다ㅜㅜ 아쉽.. 옛 고택을 용도변경하여서 운영하는 것같다. 입구의 계단은 뭔가 영화 기생충을 떠올리게 한다. 요사진은 먼가 필카처럼 나왔다. 녹음이 푸르러 기분전환하러 오기 딱 좋은 곳이다. 예쁜 인테리어가 돋보인다. '작업실'이란 이름이 걸맞게 여기서 컵을 직접 제작하시는 듯한 연출이 되어 있다. 전신샷 한컷! 키가 조금만 더클수 있다면 영혼이라도 팔거같다. ㅋㅋㅋㅋ 야외테라스쪽에 자리를 잡았더니 멀리 리움이 보인다. 대학교 근대건축사 시간에 나는 건축가 '마리오보타' 조사를 했었는데 리움의 저 보타 건물은 벽돌로 한국의 도자기를 빗대었다고 했던거 같은게 어렴풋이 기억난다. 학생땐 우와 했었는데 건축쟁이가 되고나니 피식 하게된다.. 음료가 나왔다. 내껀 #살구에이드. 오후2시가 넘으면 왠만하면 커피를 안마시기로했다. 보다보니 도자기보단 컵이랑 더 잘어울린다.. 리움, 한잔하자! 짠~ 나른한 사진들.. 이때는 날씨도 이렇게 덥지않았고.. 곧 코로나 4단계라니 우리에게 당연했던 일상은 언제 돌아오는걸까? 친구들과 한바탕 왁자지껄 놀면서 까르르까르르 웃고나니 금방 해가 진다. 이날도 재밌는 하루가 끝났다. (아재감성 블로그 끝!) #한남작업실 #한남동 #한남동카페 #한남카페 #이태원 #이태원카페 #카페추천 #리움 #리움근처카페 #한강진역 #이태원역 #야외테라스 #카페"
앙카라피크닉 한남작업실 리움미술관 마우리치오 카텔란 전시 한남동 이태원 나들이,여러분 안니옹하세요 돈 준다니까 헐레벌떡 글 쓰기 시작하는 뇨자 이리링입니다 마우리치오 카텔란 : WE 장르 전시 장소 리움미술관 기간 2023.01.31. ~ 07.16 4월에 친구들과 다녀온 마우리치오 카텔란 전시 후기를 써봅니다. 리움미술관 홈페이지에서 2주전 저녁 6시부터 예약할 수 있어요. 마침 노트북 앞이어서 티켓팅 해봤는데 성공! 1인당 4장까지라 일단 해놓고 같이 갈 사람을 구했답니다ㅎㅎ 리움미술관 온라인 예약·예매 리움미술관 온라인 예약·예매 ticket.leeum.org 교환학생 같이 샀던 언니야들이 오랜만에 겸사겸사 만나기로 했어요 근처에서 밥 먹고 커피마시고 전시회 가는 스케줄!! 친구가 케밥이 먹고 싶대서 ... 앙카라피크닉 이태원역 바로 앞에 있어요 감자튀김 탄산음료 세트까지 하면 거의 뭐 만삼천원... 케밥 가성비 음식 아녔냐고 ㅠ.ㅜ 친구는 또띠아랩을 시켰고 저는 샌드위치로 시켰어요. 샌드위치가 배는 더 부르긴 한데 되너(dönner) 스타일이 먹고 싶어서 시켰어요ㅠㅜㅠ 제가 생각한 느낌은 아니어서 다시 갈 일은...x 그냥 동선이 맞아서 갔다... 이정도... 아아 저는 진짜 되너가 먹고 시퍼염 ㅠㅜㅠ 50m © NAVER Corp. 앙카라 피크닉 서울특별시 용산구 이태원로 182 2차로 카페는 리움 미술관 걸어가는 길에 있던 한남작업실 인테리어가 감각적인 곳이었어요. 디저트도 왠지 독특... 맛도 그럭저럭... (당연히 그래야지 9천원인데) 애플시나몬라떼가 있어서 궁금해서 시켜봤어요. 오렌지라떼 이런 거 맛있자나용 ㅎㅎ 이건 생각보다 무난한 맛... 애플은 모르겠고 시나몬 향만 좀 첨가된 느낌... 주말이라 사람 많았는데 운 좋게 명당 구석자리에서 잘 놀다갔습니다ㅎㅎ 50m © NAVER Corp. 한남작업실 서울특별시 용산구 이태원로55나길 7 1층 한남작업실 리움 도착! 신분증을 맡기면 무료로 오디오를 빌릴 수 있어요. 작품이 꽤나 많고 회화에서부터 박제까지 다양했습니다. 3층을 계단으로 왔다갔다... 저 이날 거의 만오천보 채웠습니다. 사진촬영도 자유롭게 가넝~~ 예약제이기도 하고 워낙 넓어서 편하게 감상할 수 있었어요 작품 보고 이런 밈이나 생각함... 입구 작품있다는 거 알았는데도 까먹고 진짜 사람인 줄 알고 안 본 척 지나침... 50m © NAVER Corp. 리움미술관 서울특별시 용산구 이태원로55길 60-16 즐거운 나들이~~~ 써야지써야지해놓고 돈 준다니까 이제야 쓰네요 하하하 그럼 앞으로도 좀좀따리 계속됩니다...
[오엠쥐별록] 오랜만의 나잇아웃 @ 한남동 다츠 (Dotz) + 한남작업실,"오늘도 오엠쥐별록 히위고우 🎶 최근에 육테기 +블테기 + 위기의 부부(!?) 시즌1 (!!!?) 쓰리콤보로 겪으며, 스트레스 해소한답시고 자유부인 타임을 좀 많이 가졌다. 간만에 친구들이랑 저녁에 다 시간 맞춰서 이태원으로 출도옹 . 원래 나는 심양에 가서 양꼬치 앤 칭따오 플러스 옥수수국수를 먹으면서 뭔가 스트레스 퐈이아!!!! 하고 싶었는데. 갑자기 너무 팬시하게 닷츠로 가자는것,,,,???? 초큼 아쉬웠지만 뭐 어디든 좋구나. 예약 없이 토요일 저녁 7시 도착. 대략 5팀 정도 웨이팅있구. 30분은 기다린 것 같다. DOTZ 서울특별시 용산구 한남동 744-5 발렛 가능한 닷츠. 여기는 나리식당 있는 골목에서 조금 올라와야 하는데, 운전 미숙한 사람이 들어오기는 조-금 부담스러운 위치. 난 요날 맥주를 꼭 한잔 마셔야겠길래 차를 아예 두고 갔따, ㅋㅋㅋㅋ 아주 길쭉길쭉해서 좋겠다 친구야 열심히 훠이훠이 모기를 쫓아가며 30분 정도 기다리다보니 , 아주 허기지고 좋더구만요. 맛있게 먹을 준비 완료 !!!!!! 저녁엔 가츠산도가 안된다길래 다른 곳으로 갈까,,,하다가 - 여기 저녁 메뉴도 맛있대서 한번 먹어보기로 스.테.이. !!! 메뉴를 무엇을 시킬까 고민하다가. 친구의 미식가 구남친의 인스타를 훔쳐보며 ㅋㅋㅋㅋㅋㅋㅋ 우리 셀프로 추천메뉴를 골라 주문완료 !!!!! 짜잔. 첫 번째 메뉴는 멘보샤. 개인적으로 멘보샤를 좋아하지 않는 나인데, 여기 멘보샤는 어떨지 궁금해서 한번 시켜봤다. 내 눈이 침침한 것인가,,, 진짜 사진이 그런것인가,,,, 멘보샤가 뿌옇게 보이네요? 애 낳고 나니 눈이 그리도 침침햐,,,,,, 두 번째로 나온건 홍콩식 돼지 등갈비 튀김. 처.음. 먹어보는 메뉴라 기대감이 컸다. 등갈비를 튀겼다니요.??? 하나씩 잡아 들구 뜯어보았다. 새콤한 맛이 가장 입에 맴돌던 양념이었다. 그리고 다행히도 등갈비를 아-주 살짝 튀긴것인지 내가 상상한 것처럼 과하게 느끼한 맛이 아니라 천만다행이었다. 양념만으로 이미 내 입에 딱히 맞지 않았는데, 느끼하기까지 했으면 큰일날뻔?^^^^ 오-랜만에 먹고 싶었던 덕누들. 고수를 좋아하지 않는 친구가 있어서, 고수는 따로 내어달라고 요청했다. 누들 위의 계란자를 톡! 터뜨려서 다 같이 비벼서 먹으면 된다. 나는 요집 누들 중에는 요게 제일 맛있습디다. 멘보샤가 제일 먼저 나오고, 나머지 메뉴는 좀 더 기다려야 했다. 무.튼. 이게 얼마만인가!? 각자 칭따오 맥주 하나씩 시켜서 치얼쓰!!!! 하고 바로 먹부림 시작! 밖도 어둑어둑한데 실내도 어두컴컴하고 노래는 막 둥칫둥칫 신나고 🎶 다 먹고 수다 떠는데 무슨 라운지클럽같았다. 이걸로 애줌마 기분 일단 아-주 많이 좋아졌구요 ? ^^^^ 2차로 어딜 갈까 고민하기도 귀찮아 바로 앞에 있는 한남작업실로 자리를 옮겼다. 한남작업실 서울특별시 용산구 한남동 745-2 1층 한남작업실 영업시간이 10시까지라길래 고때까지 파이팅 넘치게 수다 떨고 각자 집으로 빠이 하기로 했다. 언제 이렇게 더위가 다 지나가고 밤에 테라스 앉기 좋은 때가 되었는지. 불과 하루이틀 사이에 여름이 갑자기 멀어진 것 같다. 바람이 좋으니 주문하고 바로 밖으로 나가 자리를 잡았다. 이런 밤공기 오랜만이다, ㅋㅋㅋ ㅋㅋㅋㅋㅋ 자리잡고 앉은 나를 찍어주는 미혼 친구들이여,..... ㅋㅋㅋㅋㅋ 맨날 오월이 사진만 찍어주다보니 이제는 내 사진 찍히는 건 세상 어색하다.. 그래도 활짝 웃어도 봤구요, ㅋㅋㅋㅋㅋ ㅋㅋㅋㅋ 얘랑도 찍어보고 쟤랑도 찍어보고 다 같이도 찍어보고, ㅋㅋㅋㅋㅋ 초상권 때문에 죄다 동물농장이지만, 참 다 같이 웃으며 잘 나온 사진들 📷📷 결혼하고 오월이 낳아 키우며 정신 없이 2년을 달렸는데, 가끔 이런 사진들을 다시 볼 때마다 기분전환이 되더라. 친구들과의 사진을 잘 남겨둬야지 🎈 나를 찍는 친구들도 내가 찍어보고, ㅋㅋㅋㅋㅋ 고마웠다 애들아 🧡 밀크티 미숫가루 자두에이드 이렇게 시켜보았는데, 미숫가루가 정-말 맛있었다. 어릴 때 엄마가 집에서 타주던 맛이랑 똑.같.았.다. 자두에이드는 뭐랄까.... 나 어릴 때 팔았던 왕 자두사탕을 녹여놓은 맛이었다. 뭔가 입맛이 개운하게 리프레쉬 되지 않길래 몇모금 마시다가 거의 다 남겼다는 사실.... 주변에서 콜드블러드라고 했지만, 오월이 백일부터 수면교육해둔 덕에 이렇게 맘 편히 저녁에 나와서 친구들이랑 자유시간도 가질 수 있어 너무 뿌듯한 것. 그리고 와이프 기분 전환 하라고 집에서 혼자 오월이 지킴이 하는 우로빠 💛 (나 없는 집에서 골목식당 다운 받아 보는것이 세상 꿀잼이라며,,,,?ㅋㅋㅋㅋㅋ) 다음번엔 심양에서 다시 나잇아웃 해야지 ㅋㅋㅋㅋㅋ 심양을 가줘야지 나의 소울 푸드를 먹을 수 있음... 주절주절 오늘의 오엠쥐별록 여기서 끄읕. 다음 일기도 또 옵니다 오끼,? #오엠쥐별록 #오엠쥐칫챗 #다츠 #DOTZ #한남작업실 #주말일기 #나잇아웃 #자유부인 #한남동맛집"
"🤜🏻한남동 뿌시기🤛🏻 마우리치오 카텔란 전시회, 한남작업실, 솔솥, 네로우 패스","한남동 리움미술관 (마우리치오 카텔란) / 한남작업실 / 솔솥 / Narrow path 네로우 패스 마우리치오 카텔란 전시회를 가고 싶어서 열심히 예약을 하려고 노력하다가 예약을 했어용 주말에 가기에는 표가 안 나오더라구용ㅠㅠ 리움미술관 서울특별시 용산구 이태원로55길 60-16 미술관 들어가기 전에 길 잘못 찾았는데 사진찍기ㅋㅋㅋㅋㅋㅋㅋㅋㅋ 미술관 들어가기 바로 전 여기서도 촬칵📸 우리 2010 바티칸 시스티나 성당 재현 여기 너무 이쁘지 않나요? 동영상으로 찍어도 너무 잘 나와요!! 이거 찍으려고 줄을 좀 오래 섰던 기억이ㅎㅎ 기다릴만하죵!!👍🏻👍🏻 Bidibidobidiboo 보이드 마우리치오 카텔란의 작품들을 모아서 축소해놨다는데 너무 신박하고 작품 하나하나 찾아보기 재밌어용👀 박제 병아리 진짜 움직일 것만 같은 뵹알이🐥 무제 2008 저도 검정 부츠를 신고 가서 같이 찍어봤어용 헤헿 무제 2001 제일 유명해서 안 찍을 수가 없었죵ㅎㅎㅎ 한남작업실 서울특별시 용산구 이태원로55나길 7 1층 한남작업실 ⏰ 오픈 11 : 00 ~ 22 : 00 라스트 오더 21 : 30 입구 메뉴판 내부 애플시나몬티와🍏 애플시나몬티🍎 저는 애플시나몬티 좋아해용🫶🏻 밖에 테라스에서 찍었는데 정면샷은 카메라를 봐야 해서 어색하게 나와가지구 잘 안 찍는데 너무 오랜만이었어용,,,ㅎㅎ 이날은 날씨가 다 해버렸지 모에용☀️ 화장실 사진 맛쥡~~ 동생인데 사진을 잘 찍어서 너무 만족스러운 한남동 데이트 였어용 솔솥 한남점 서울특별시 용산구 이태원로54가길 26 지1층 ⏰ 오픈 11 : 30 ~ 마감 21 : 00 입구 테이블링 제가 갔을 때에는 오후 3시쯤이어서 대기가 별로 없어가지고 15분?! 정도 기다렸어용 위에 거가 전복 솥밥 아래가 스테이크 솥밥입니다 솥에 나온 밥들을 섞어서 오른쪽에 있는 그릇에 담아 뜨거운 물을 부어주시고 뚜껑을 덮어 놓고 담아놓은 밥을 다 먹고 난 후 후식으로 누룽지~~ 국룰이죵 건강하게 맛있게 먹었숩니당~~😁😁 유린기 입니둉 네로우 패스 서울특별시 용산구 이태원로42길 38-4 예약 ⏰ 오픈 11 : 30 ~ 마감 22 : 00 입구 메뉴판 원두 선택 2층 2층 아이스 아메리카노와 파인애플 주스🍍 리얼 생과일 갈아서 주셨어용 JMT♥️ 여기는 디저트 맛집이었는데 배가 너무 불러가지고 못 먹어서 다음에 또 갈거에용 #디자인 #맛집추천 #여름 #겨울 #가을 #봄 #건강 #날씨 #행복 #마우리치오전시회 #전시회 #전시 #미술 #미술관 #극현실주의 #현실 #이색데이트 #데이트 #데이트코스 #카페 #음료 #한남동 #커피 #여행 #ootd #패션 #daily #dailylook #데일리룩 #데일리 #데일리코디 #추천 #서이추환영 #서이추 #좋은글 #좋은생각 #좋은글모음 #좋은말 #좋아요"
