title,content
[용산구 / 한남동] 망고빙수🥭 @그랜드하얏트서울 갤러리,"그랜드하얏트 서울 갤러리 영업시간: 매일 09:00 ~ 24:00 50m © NAVER Corp. 그랜드하얏트서울 갤러리 서울특별시 용산구 소월로 322 그랜드하얏트서울 로비1층 예약 친구랑 망고빙수 먹으러 그랜드 하얏트로 고우고우 서울 차막혀서 차 안타고 가는데 요근래 흉흉한 일이 많아서 .. (역시나 차막히는건 여전했다 하하) 하늘 끝내주고 ☁️ 웨이팅 분명 많을 걸 예상하고 발렛 맡기고 호다닥 달려왔다 당시 웨이팅 많지 않아서 5팀정도?? 약 20분 정도 기다린것 같다 아 그리고 대기인원이 많아서 이용시간 2시간 제한이 있었습니다 꺄 끝내주는 하늘이다 날이 더워서 그런가 진짜 청명한 하늘 그랜드 하얏트 서울 갤러리는 망고빙수뿐만 아니라 식사, 음료 등 다양한 메뉴가 준비되어 있다 자리도 좋은 곳으로 안내 받아서 앉아있는 내내 하늘 감상하기 바빴다 🤭 예쁜건 한번 더 🤍 망고빙수 (65.0) 작년에 비해 가격이 2만원정도 오른것 같다 물가상승률 어마하네 망고빙수 플레이팅도 조금씩 달라졌다 그랜드하얏트 시그니처 우유푸딩이 사라지고 망고와 코코넛 푸딩이 들어간 화이트 초콜릿으로 장식했다 그리고 연유, 망고샤베트, 그리고 큐브치즈! 망고가 덜 익은건지 생각보다 달지 않아서 연유 한가득 부어먹어도 괜찮았다 눈꽃우유빙수에 아이스크림, 망고가 사이사이 들어있었구요 앞전에 워낙 맛있는 애플망고빙수를 먹어서 그런지 그에비해 조금 아쉬웠습니다 [용산구 / 한남동] 망고빙수🥭 @그랜드하얏트서울 갤러리 (1) 재생 12 좋아요 0  접기/펴기 [용산구 / 한남동] 망고빙수🥭 @그랜드하얏트서울 갤러리 (1) [용산구 / 한남동] 망고빙수🥭 @그랜드하얏트서울 갤러리 (2) 재생 10 좋아요 0  접기/펴기 [용산구 / 한남동] 망고빙수🥭 @그랜드하얏트서울 갤러리 (2) 재즈공연 기대하고 있었는데 올해는 안하는가 싶더니 뙇 ! 맑은 날씨에 맛난 빙수와 멋진 연주까지 들으니 이보다 행복할 수 없었따ㅏ 사람들이 많았지만 정신없는 그런 분위기는 아님 시간대별로 하늘 감상하기 ☁️ 딸리올리니 해산물 (38.0) 갑자기 배고프다며 주문한 파스타 갑분식사 ㅋㅋ 양도많고 해산물도 가득 들어있어 둘이서 하나먹기에 충분했다 게다가 빙수로 베이스를 깔았으니 .. 식사를 주문하면 식전빵과 버터도 같이 나옵니다 넘모조와 모닝빵과 치아바타? 였는데 둘다 부드럽고 맛있었다 보통은 식사 후에 빙수를 먹기 마련인데 빙수 후에 식사를 먹는 것도 그리 나쁘지 않네..? 오히려 달달한 속을 달래주기 좋았다 굿초이스 🍝 시간지나니까 노을져가는 하늘도 볼 수 있었다 핑크빛이 살 도니 더 예뻤다 💗 무지개다 !!!!!!!!!!!!!!!!! 돔 형식이 아닌 일직선 무지개는 처음이야 완전 신기해 🌈🌈🌈🌈 [용산구 / 한남동] 망고빙수🥭 @그랜드하얏트서울 갤러리 (3) 재생 3 좋아요 0  접기/펴기 [용산구 / 한남동] 망고빙수🥭 @그랜드하얏트서울 갤러리 (3) 날은 무진장 더웠지만 행복하고 즐겁고 럭키바이러스 가득한 하루 <33 식사를 마치고 델리로 향했다 그냥 지나칠 수 없지 친구랑 깨알 거울샷 찍어주구 빵, 초콜릿, 케이크 진짜 없는게 없는 천국 게다가 하나하나 다 작품같았다 선물로도 넘 좋을 것 같다 와인 종류도 다양하고 그랜드 하얏트 오면 여기도 꼭 들러보세요 빵 쇼핑 마치고 나가는 길에 한컷더 아쉬워 〰️ 발렛 서비스 이용 요금 안내 기본 2만5천원 신용카드 무료발렛 서비스도 있으니 확인해보세요 (업장 이용필수) 들어올땐 한산했는데 이 시간대가 오히려 더 붐비네 그래도 금방 차 나와서 다행쓰 멋진 노을과 남산타워도 감상하구 소월로 드라이브도 해주구 집와서도 끝나지 않은 빵파티 여기 저 바닐라 밀푀유 정말 맛있어요 브리오슈 식빵도 진짜 맛있어요 특히 구워먹음 깨꼬닥 photo by SY 더운 여름날 데이트 코스로 딱인 호텔 데이뚜 맛난 것도 먹고 에쁜 하늘과 멋진 서울뷰도 감상하고 즐거운 시간 보냈읍니다 💛"
6.[서울/한남동] 그랜드하얏트서울 갤러리,"🧭서울 용산구 소월로 322 로비 1층 ☎️매일 09:00-24:00 🚙 주차가능 - 주차장 있음 🏃🏻‍♀️한강진역 도보 18분 #대기안내 하얏트 갤러리에 많이 와보진 않았는데 4번정도 왔을때 주말 저녁, 평일 저녁은 3번 정도 대기가 있었어요 ! 대기가 심하진 않고 1-2팀 정도 기다리셨어요. 평일 저녁엔 식사 이용 하실 분들은 대기 없이 들어가도록 배려해주셔서 저희는 바로 들어갈 수 있었어요 :) 아무래도 뷰가 워낙 좋다보니 저녁에 많이 방문 하시는 것 같아요. #주차 발렛은 따로 지원이 안되고 2시간 주차 지원이 됩니다 :) 메뉴판을 먼저 가져왔어요 ! (네이버 참조) 오빠랑 두번 하얏트 갤러리에 왔었는데 두번다 여기서 식사를 했어요 :) 처음엔 창가자리에 앉았고 두번째는 창가자리엔 앉지 못했는데 창을 바라 볼 수 있어서 무척이나 분위기가 좋았어요. 창가자리는 지정 할 수 없고 순서대로 배정됩니다 :) #메뉴추천 치킨 가라아게 38,000원 별 기대 안했는데 치킨 가라아게 너무 맛있었어요. 따뜻하고 속살은 보드럽고 :) 이때 너무 맛있어서 다음에 갔을때도 또 주문했어요. 볼로네이즈 파스타 38,000원 볼로네제 파스타는 무난한 맛이었어요. 엄청 맛있지도 그렇다고 부족하지도 않는 딱 호텔에서 나오는 맛 ! 랍스터 샌드위치 40,000원 기대하고 시켰던 랍스터 샌드위치…^^ 한입먹고 이도 저도 아닌 맛이여서 오빠랑 후회했던 기억이… 다시 방문했을땐 메뉴에서 사라졌더라구요… 역시 사람 입맛은 똑같나봐요 (ㅎㅎ) 그랜드하얏트 재생 0 좋아요 0  접기/펴기 하얏트 6.[서울/한남동] 그랜드하얏트서울 갤러리 재생 0 좋아요 0  접기/펴기 6.[서울/한남동] 그랜드하얏트서울 갤러리 저녁엔 라이브연주가 없으면 섭섭하죠? 너무나 아름다운 선율로 분위기에 취하는 날이었습니다. 최근에 방문했을 때 입니다 :) 생맥주 330ml 19,000원 오빠는 운전해야 하니까 못 마시고 저는 퇴근 하고 한잔 마셔야 할 것 같아서 시켰어요. 술을 잘 먹지 못하지만 퇴근 후에 맥주 한두모금은 너무 시원하고 아찔한 맛이에요! 같이 나온 식전빵과 기본안주로 배 떼우기.. 오빠는 기본스낵에 있는 김부각이 너무 맛있다며.. 맥주 한잔 하고 있는 저를 무척이나 부럽게 바라봄 토마토 펜네 38,000원 무난하게 계속 들어가는 맛이에요. 개인적으로 볼로네제 파스타보다 펜네가 더 맛있었어요 :) 호텔에서 시키기 무난한 맛입니다. 치킨 가라아게 38,000원 하얏트 와서 처음 먹어보고 너무 맛있어서 이번에 왔을때도 또 시킨 치킨 가라아게 :) 저 소스에 치킨을 찍어서 맥주랑 먹으면 그냥 아무 생각이 안나요. 소고기 김치 볶음밥 28,000원 오빠가 시킨 메뉴 :) 김치볶음밥 뿐만이 아니라 배추된장국두 나오고 양도 맛도 괜찮다며 가성비 제일 좋은 메뉴인 것 같다고 하더라구요. 제가 먹었을때 맛은 그냥 무난했어요. 분위기가 너무 좋은 그랜드 하얏트 서울. 무난한 맛도 좋지만 친절한 서비스와 아름다운 서울 야경을 보러 가는게 맞는 말인 것 같아요. 이건 제가 간건 아니고 얼마전에 오빠가 사촌이랑 갤러리 다녀왔다고 보내준 사진인데 낮에 미세먼지 없는 날씨가 너무 좋고 뷰가 너무 멋있어서 같이 게시합니당💙 #툐슐랭가이드 3.5/5.0 그랜드 하얏트 서울 호텔(@grandhyattseoul) • Instagram 사진 및 동영상 팔로워 86K명, 팔로잉 1,764명, 게시물 1,086개 - 그랜드 하얏트 서울 호텔(@grandhyattseoul)님의 Instagram 사진 및 동영상 보기 instagram.com"
한남동/그랜드하얏트서울 갤러리/호텔 카페/망고빙수,"추석 명절 온 가족이 모여 이태원에서 식사 후 인근에 있는 그랜드하얏트서울 갤러리로 갔어요 몇 년 전 송년의 밤 행사에 초대되어 식사와 함께 공연을 본 이후 처음 가보았네요 비온 후의 고즈넉함이 올드 한 건물 전경과 딱 맞아떨어지는 느낌 수목도 좋고 로비 입구도 옛정스럽네요 돌아가신 엄마 아빠 생각이.... 함께 했으면 좋았을 텐데 😭 로비는 외국인 관광객과 카페 손님들로 가득했어요 오후 1시 정도 도착, 연휴라 손님들이 더 많네요 저희 일행은 모두 11명이라 자리 잡기 더 힘들었어요 30여 분 대기 후 드디어 입장 어른 6명과 아이들5명은 따로 착석했어요 맘 같아선 요 창가에 앉고 싶었지만 안쪽으로는 뷔페 식사 손님 자리라 들어갈 수 없어요 부러워하며 멀리서 사진만 몇 컷 찍었어요 멀리서 보기만 해도 시내가 한눈에 보여요 창가 빛 때문에 사진이 어둡지만 나름 운치 있어 보임요 ❤️ 바깥 가을 풍경을 배경으로 멋진 연주와 함께 차를 마시니 연휴가 이렇게 즐거울 수가 없네요 🏩 메뉴판 펌1 메뉴판 펌2 어른들은 티라미슈와 치즈케이크 그리고 음료 5잔을 아이들은 망고 빙수와 치즈케이크 그리고 음료 2잔 주문함요 망고 빙수는 다른 5성급 호텔보다는 저렴하네요 나름 커피 맛에 냉정한 평가를 내리는 편이라 원두 선택 없는 커피 맛이 어떨까 궁금했는데 풍미는 크게 없었지만 과하지 않는 다크함과 진한 향이 나름 좋았고요 티라미슈와 치즈케이크는 크게 달지 않고 굉장히 소프트한 느낌의 맛이었어요 치즈와 셔벗 그리고 연유와 함께 등장한 망고 빙수 토핑으로 올라간 애플망고모양의 초콜릿이 인상적이네요 일명 망품초 맛은.... 흠.... 빙수 전문점에 길들여져서인지 하얏트 망고 맛이 별로인 건지 헷갈려욬ㅋ 또 먹겠냐고 하면? 그냥 경험으로 만족해요 🤣 멋진 뷰와 음악 그리고 좋은 사람들과 즐길 수 있는 최적의 장소인 것은 맞는 것 같아요 호텔 바로 앞 조금만 걸으면 남산 야외식물원이 있어 모두 걷고 걸으며 수다 수다 떨 수 있어서 너무 좋았어요 야경을 볼 수 있는 저녁 시간에 와도 너무 좋을 것 같네요 50m © NAVER Corp. 그랜드하얏트서울 갤러리 서울특별시 용산구 소월로 322 그랜드하얏트서울 로비1층 예약"
[한남동] 그랜드하얏트서울 갤러리 애프터눈티 후기,"그랜드 하얏트 서울 갤러리 애프터눈티 후기 정말 오랜만에 블로그 쓰는듯. 1일 1포스팅 하기로 했으면서 그 결심은 오래가지 못했다... 4월이 끝나기전에 후딱 업데이트 하는 그랜드 하얏트 서울 (제주 컨셉) 애프터눈티 후기. 하얏트 주차장 쪽에 이렇게 예쁜 벚꽃길이 있었던 아셨나요? (사실 차 다니는 길이라 오면 안됌...ㅋㅋ) 사진만 후딱 찍고 들어감. 올해도 한발 늦은 벚꽃 구경. 이날 저녁에 바로 비와서 그 뒤로 벚꽃 구경은 끝이났다... 사실 이날 애프터눈티를 먹기 위해 온건 아니고 그냥 점심 먹으러 왔는데 애프터눈티 구성이 좋길래 그냥 그걸로 먹기로 함 (즉흥적인 P 맞습니다....) 블로그에 올리려고 잊지 않고 찍은 애프터눈티 메뉴판. (2인 98,000원) 생각보다 구성이 괜찮죠? 그랜드 하얏트 라운지에서 늘 하는 라이브 공연 보면서 먹을 수 있으니 더 좋은 것 같다. 핑거푸드 위주로 뷔페식으로 가져다가 먹을 수 있다. 디저트는 이 정도 있고, 아래 사진 보다보면 2단 트레이로 따로 가져다 주는디저트들도 있는데 이건 리필X 저땐 디저트위에 왜 돌하르방 얼굴이 있지? 했는데 제주 컨셉인걸 나중에 알게 됌ㅋㅋ 예쁘게 하나씩 담아 온 메인 핑거푸드. 크래커 위에 노란색 살사랑 (커리맛 남) 바삭한 아란치니 그리고 오동통한 감바스 새우가 특히 맛있었다. 훈제연어도 맛있었는데 아래 깔려있던 팬케이크는 쏘쏘. [한남동] 그랜드하얏트서울 갤러리 애프터눈티 후기 재생 7 좋아요 0  접기/펴기 [한남동] 그랜드하얏트서울 갤러리 애프터눈티 후기 동영상으로도 담아 봄. 디저트류도 하나씩 담아 봄. 뷔페를 즐기다보면 이런 2단 트레이를 따로 가져다준다 : 한라봉 자스민 피나코다 제주 애플 망고 타르트 구좌 당근 케익 유채꿀 리찌 바바로와즈 마지막으로 까먹고 못먹을뻔한 아이스크림. 갈색은 제주 말차 맛, 흰색은 백년초 소르베 맛. 뷔페 옆에 있으니 꼭 까먹지 말고 매그넘 아이스크림 드세요! 입가심으로 너무 좋음. 애프터눈티 세트에 음료 1회 리필인데 나같이 한 음료로 오래 드시는 분들을 위해 나갈때 원하는 음료로 테이크아웃까지 해주는 센스👍 아까 라떼 먹어서 이번엔 차종류로 테이크아웃 했다. 잘 먹고 잘 놀았다. 레쓰고~ 영업시간 평일/주말 9:00 ~ 00:00 애프터눈티 이용금액: 98,000원 (2인기준, 세금포함) 타파스 뷔페 (금요일, 토요일에 한하여 운영) 운영시간 : 18:00-21:00 이용금액 : 65,000원 50m © NAVER Corp. 그랜드하얏트서울 갤러리 서울특별시 용산구 소월로 322 그랜드하얏트서울 로비1층 예약"
[한남동] '그랜드하얏트서울 갤러리' 망고빙수,"50m © NAVER Corp. 그랜드하얏트서울 갤러리 서울특별시 용산구 소월로 322 그랜드하얏트서울 로비1층 예약 망고빙수 먹으러 그랜드하얏트 서울 왔습니당 ~ 주차장이 만차라 빙글빙글 돌다가 겨우 들어 왔댜 ... 식사손님 또는 보틀 주문 손님은 아래 창가석에 앉을 수 있고 , 일반 음료 주문 손님은 윗층에 앉게 되어있습니닷 #그랜드하얏트서울갤러리메뉴판 메뉴 구경하다가 우리는 망고빙수 (65,000원) 주문 작년보다 또 올랐규만~?~?~? 날씨가 흐려서 약간 아쉬웠지만 그래도 운치있쥬? 앞접시랑 스푼 셋팅해주시고 가쉼 녜뿌네오 망고빙수 입장~ 치즈, 망고샤베트, 연유 별도로 나온다. 요 위에 망고모형은 초콜릿이라 먹어도 된다고 합니당! 예뾰.. [한남동] '그랜드하얏트서울 갤러리' 망고빙수 내돈내산 후기 (1) 재생 8 좋아요 0 00:00 00:11  [한남동] '그랜드하얏트서울 갤러리' 망고빙수 내돈내산 후기 (1) 연유 뿌리구 초콜릿 안에도 가득한 망고쓰 [한남동] '그랜드하얏트서울 갤러리' 망고빙수 내돈내산 후기 (2) 재생 5 좋아요 0 00:00 00:04  [한남동] '그랜드하얏트서울 갤러리' 망고빙수 내돈내산 후기 (2) 얼음 안에는 망고 젤리(?) 같은게 들어있다 치즈도 맛있오 순식간에 다 먹어버림 키키 7시 되니까 라이브공연도 했다! 요즘 다른호텔은 망고빙수 9만원 넘어가는 곳도 많은데 가성비 있었던 #그랜드하얏트망고빙수 자리에서 결제 해주시고 차량등록까지 완료 맛있게 먹고 갑니다아 안뇽~~🖤"
[한남동맛집] 가을시즌 에프터눈티 그랜드하얏트서울 갤러리,"여기도 생일기념 다녀온곳 ㅎㅎㅎㅎ 10월9일에 방문했어여 그랜드하얏트서울 갤러리에서는 9월중순부터 11월중순까지 가을시즌 에프터눈티를 진행하는데 이번 테마는 마누카꿀,밤,무화과라고한다. 세개 다 내가 좋아하는거얌,,,ㅎㅎㅎ @그랜드하얏트서울 갤러리 ㅇ주소 - 서울 용산구 소월로 322 그랜드하얏트서울 로비1층 ㅇ시간 - 1부 13:30-15:00 / 2부 15:30-17:00 ㅇ주차지원 2시간 50m © NAVER Corp. 그랜드하얏트서울 갤러리 서울특별시 용산구 소월로 322 그랜드하얏트서울 로비1층 예약 뚜벅이로 가긴 조금 어려운곳 자차이용하세용 이틀연속으로 간 하얏트 매일가도되는데 ㅋㅋ 전날엔 뷔페로 이날은 에프터눈티먹으러~~ 입구 들어가자마자 중앙에 있고 에프터눈티 예약했다고 말씀드리면 자리 안내 해 주신다. 우리는 피아노 옆 창가자리 ~_~ 하얏트는 창가 자리 아니믄 의미엄서,,, ㅎㅎㅎㅎㅎ 종류는 이렇게 있구요 2인 12만원 음료는 두가지 고를 수 있다 우리는 아아로 스따뜨 초ㅓ컬릿분수 사진한번 찍어주고요 먹을거 담으러 가 봅니다 왼쪽에 있던 음식들 식사 대용으로도 가능 한 핑거푸드들이고 반대편엔 디저트들~~ 난 한번에 둘다 먹지 우리의 첫 접시 지난번에 왔을 때 보다 식사용 핑거푸드가 더 알차게 바뀐 것 같기도 하구~~~ 먹다보면 2단 트레이도 가져다주십니당 트레이에 있던 디저트 다 못먹음 ㅠㅠ 아까웡,,따흑 지난번엔 막대아이스크림 주셨는데 이번엔 떠먹는 아이스크림 주셨다 요거트랑 망고 또 하나 뭐였지,, 세가지중에 고르면됐고 나는 요거트 언니는 망고 고름! 저녁에 울프강 갈 예정이라 페이스 조절 해야해서 그만먹으려다가 한번만 먹고 끝내긴 아쉬워서 또 가져다먹었다. 무화과랑 골드키위가 너무 맛있어서 이것만 집중적으로 먹었지 ㅎㅎㅎㅎㅎ 골드키위 별로 안 좋아하는데 여기서 먹은 골드키위 진짜 엄청 달고 맛있었음! 아아 다 마시고 카모마일티로 리필! 남는건 사진뿐이라 사진도 마이 찍었다,,,ㅎㅎㅎ 창가자리는 보는건 예쁜데 사진색감은 째금 이상하긴 해유 그래도 하얏투 창가뷰 최고오 갤러리 가시는분들 일층 화장실 조명맛집이에여 사진 잘나와여 ㅎㅎㅎㅎㅎ (그런데 내사진은 왜저러지?ㅎㅎㅎㅎㅎ) 발렛 기다리면서 하얏트앞에서 한컷 ㅋㅋㅋㅋㅋㅋㅋㅋㅋㅋㅋ 같이 간 지희언니도 언니랑 엄마랑 다시 올거라고 한 하얏트 가을시즌 에프터눈티 ! 에프터눈티를 즐길거라면 다른 호텔보다는 그랜드하얏트서울 갤러리 추천합니다(하트) 더불어 창가자리 꼬옥,,,!"
[한남동] 그랜드하얏트서울 갤러리 : 날씨가 좋으면 생각나는 곳,"📍When : 2023.6 & 8 📍Concept : 낮엔 테라스에서, 저녁엔 공연과 함께 50m © NAVER Corp. 그랜드하얏트서울 갤러리 서울특별시 용산구 소월로 322 그랜드하얏트서울 로비1층 예약 그랜드하얏트서울 갤러리 feat. 초여름 예약 : 워크인 (애프터눈 티&선셋 아워만 예약 가능) 영업시간 : 09:00~24:00 주차 : 발렛 날씨가 좋아지면 어김없이 생각나는 곳. 음식의 맛을 즐긴다보다는 가볍게 뷰와 분위기를 즐기기 좋아서 찾게 되는 곳이다. 겨울에 크리스마스 시즌도 좋지만, 겨울이 지나고 테라스의 시즌이 오기 시작하면 이곳 부터 생각난다. 작년에 확장 및 새 단장 후 오픈한 갤러리 파티오는 테이블 수도 늘어나고 분위기도 조금 바뀌었다. 아래는 확장 전 테라스에서 에프너눈티를 즐겼던 시간. Next image 바람 솔솔 부는 테라스의 계절에 방문했던 올해 6월. 1시쯤에 가서 더운 감도 없지 않아 실내 창가 자리에 앉으려고 했으나, 에프터눈티 예약 고객으로 자리가 만석이었다. 로비와 가까운 쪽에 2인석 밖에 남지 않아 테라스로 나왔다. 다행히 파라솔이 해를 가려주고 바람이 불어 온도는 적당했다. 확장 후 한결 나아진 테라스. 이곳에서 바라보는 파란 수영장 뷰는 파란 하늘과 함께 눈 호강을 하게 해준다. 탁 트인 뷰 자체가 힐링이라서 기분이 절로 좋아진다. 갤러리 파티오의 경우, 식사 메뉴는 주문할 수 없고 스낵 메뉴만 주문 가능이 가능하다고 했다. 클럽 샌드위치가 별로였던 기억이 있어서 한우 쇠고기 버거와 치킨을 주문했다. 버거는 감자튀김과 함께 나왔는데, 도톰한 패티와 반숙란까지 올라가서 맛이었다. 치킨이야 뭐 기본은 하는 맛이고, 양념 소스는 그냥 칠리소스가 아닌 고추장이 가미된 맛의 소스였다. 흘러가는 시간이 아쉬워 디저트까지 먹고 일어났다. 사과 크럼블 치즈 케잌을 주문했는데, 바닐라 아이스크림과 쏠티드 카라멜 소스가 올라간 조합은 맛이 없을 수가 없지. 테라스&야장 성애자의 즐거웠던 테라스에서의 시간. 그랜드하얏트서울 갤러리 feat. 한여름 거의 브런치나 에프터눈티를 먹으러 낮 시간대에 주로 왔었는데, 얼마 전 저녁시간대에 방문했더니 또 다른 느낌이었다. 6시쯤 방문했더니 아직 해가 지기 전의 모습. 라이브 공연 바로 앞 테이블 자리가 남아있어서 그 자리에 앉았다. 일주일에 한번은 치킨을 먹어야 하는 짝꿍 덕에 치킨을 시켰는데 오늘 치킨의 상태는 조금 아쉬웠다ㅠ 그래도 보통 평타 이상은 했었는데… 아쉽지만 남기지 않고 다 먹기^^;; 여름이 가기 전 망고 빙수는 먹어야 하니까 빙수도 주문. 너무 사악해진 신라의 망고 빙수 가격에 올해는 하얏트로 왔는데 먹을만했다. (사실 망고가 맛있으면 되는 거니까) 빙수 위에 망고 과육이 올라간 케이스는 장식용인 줄 알았는데 초코렛이었고, 함께 나온 치즈케이크 조각도 잘 어울렸다. 7시가 지나니 라이브 공연이 시작되었다. 해 질 녘의 분위기와 공연이 더해지니 낮과는 또 다른 느낌이었다. 여러 곡들 중 좋아하는 곡이 나와 살짝 동영상도! [한남동] 그랜드하얏트서울 갤러리 : 날씨가 좋으면 생각나는 곳 재생 0 좋아요 0  접기/펴기 [한남동] 그랜드하얏트서울 갤러리 : 날씨가 좋으면 생각나는 곳 야경과 은은한 조명이 함께하니 따스한 느낌의 저녁이었다. 음악을 들으며, 도란도란 수다 떨기 좋았던 시간! 그랜드하얏트 라운지는 낮과 밤 모두 좋았다."
