title,content
[한남동] 오스테리아 오르조 & 타르틴 베이커리,"점심 조퇴를 하고 식사하러 한남동으로 궈궈~ 오늘은 #오스테리아오르조 에 가보기로 했다. 여기 예약이 정말 빡세다고 해서...사실 예약 못할 줄 알았는데, 다행히 전화로 예약을 하니 가능! 아마도 우리가 2명이 아닌 3명 이상 좌석이었어서 예약이 가능했던게 아닐까 싶기도 하다. 30m © NAVER Corp. 오스테리아 오르조 서울특별시 용산구 한남대로20길 47 타르틴 베이커리 한남점 서울특별시 용산구 한남대로18길 22 예약 오스테리아 오르조는 한남오거리 근처에 있어서... 지하철보다는 버스를 타고 가는게 편리하다. 식당 옆에 발렛주차도 되기 때문에 차를 가지고 가도 된다. 하지만 나는 뚜벅이이므로...ㅋㅋ버스를 타고 갔다. 가는 길에 노티드에 들러서 도넛도 사고 쿄쿄 오스테리아 오르조 도착! 입구가 어디쥬? 이미 식당 안은 거의 만석이었다. 우리테이블 빼고 2테이블 정도 남아있었나? 여기 파스타가 그렇게 맛있다던데 두근두근 메뉴는 이렇게 준비되어 있다. 우리 옆자리는 6인이 앉을 수 있는 큰 테이블이 있었다. 근처가 회사라면 이런 곳에서 회식을 해도 참 좋겠다. 하지만 나의 직장은.....ㅠㅠ저 멀리 구석에 여기 사진이 넘 이쁘게 잘 나왔다. 오늘 채광이 좋아서 더 예쁘게 찍힌듯! 주문한 카르파쵸가 먼저 나왔다. 이 날 점심, 저녁으로 카르파쵸 먹은날 사실 난 별로 육류 좋아하는 사람도 아닌데... 이 날은 왜그랬을까 ㅠ 사진을 먼저 찍을 수 있게 시간을 주신 다음 이렇게 예쁘게 돌돌 말아서 썰어주셨다. 먹기 좋은 사이즈로 한입! 다음으로 나온 가지요리 가지구이 넘 맛있다. 어릴땐 가지가 그렇게 싫었는데.... 우리나라가 가지요리를 참 맛없게 하는듯 가지를 구우면 더 맛있는데 왜 물렁거리게 볶아서만 먹냐고요 다음으로 나온 파스타! 라구파스타였는데 이건 오스테리아 오르조의 인기 메뉴인 것 같아서 주문해보았다. 왜 인기메뉴인지 알겠다. 특별히 호불호 없이 모두가 맛있게 먹을 수 있을 맛이당 다음으로 나온 우니파스타!!! 난 이거 진짜 너무너무 맛이있었다. 그런데 함께 식사한 일행은 우니의 향이 강해서 많이 먹지는 못할 것 같다고 했다. 약간 호불호가 갈릴 수 있는 맛일 것 같긴하다. 하지만 나는 매우매우매우 맛있었음 오스테리아 오르조 재생 0 좋아요 0  오스테리아 오르조 이렇게 맛있게 직원분이 비벼주신다. 성게에게 미안 ㅠㅠ 하지만 우니가 이렇게 크게 올라가다니!!!! 우니파스타 좋아하는 사람들에게 강추다. 식사를 마치고, 커피 마시기 위해 근처 카페를 찾았다. 다른 카페를 가려고 했는데, 하필이면 오늘이 휴일이라서 그 옆에 '타르틴 베이커리'에 가보기로 함 타르틴은 샌프란시스코에서 유명한 빵집인데 요샌 쓱배송으로도 베이커리 주문이 가능하다. 나도 몇 번 배달로 먹었는데 다 맛있음! 커피마시면서 즐겁게 수다떨고~~~ 쉬다가 다시 나는 다음 약속 장소로 출봘"
[한남동 디저트]Tartine Bakery 타르틴 베이커리 한남,"50m © NAVER Corp. 타르틴 베이커리 한남점 서울특별시 용산구 한남동 263-2 예약 * 영업시간 매일 10:00 - 19:00(추석 당일 휴무) 발렛 주차도 된다고 해요 (한남역 1번출구에서 708m) * BELLALOG 벨라로그 * 오픈 때 인기가 많았던 타르틴 베이커리(Tartine Bakery) 한남동 타르틴 베이커리는 1, 2층 복층으로 되어있고 천고가 높다보니 가게 안으로 들어가자마자 탁 트인공간이 더 넓어보이고 답답해 보이지 않아서 좋았어요 오픈 키친으로 베이커리류 만드는 과정도 볼 수 있고 한남동 타르틴 베이커리에서 직접 만들어서 따끈한 빵을 먹을수 있어요 가게들어서면 버터향이 나는데 넘나 좋고요🥰 이런 향수 가지고 싶어요💜 조명도 하나하나 다 이쁘고 복층으로 되어 있어서 답답하지 않아서 좋았어요 #한남동빵집 #타르틴 #타르틴베이커리 한남동 타르틴 베이커리에서는 오전 10시부터 4시까지는 타르틴 브런치가 있어요 프렌치토스트나 그릴샌드위치는 한번쯤 먹어보고 싶은 메뉴 고수가 있을수가 있데요 언니가 말해줬어요😅 저는 고수를 못먹기 때문에... 체크하고 주문해야겠어요💜 모닝번은 바삭하기 보다는 생각보다 딱딱했고 쪼끔 달아요😅 보기보다 설탕이 조금 많아서 살살털어내고 먹었어요🥰 🌟고수주의🌟 한남동베이커리 카페 #타르틴 한남동 데이트중 다녀왔던카페 테이크아웃하러 잠시 들렸어요🥰 #TARTINE 의 #라떼와 #크로아상 #치즈케이크 #아몬드크로아상 ✨먹고싶어요✨ 한남동 타르틴 베이커리 크로아상은 바삭하고 버터향이 풍부한 크로아상 이에요...?! 먼말이지?? 하지만 드셔보시면 아실거에요💖 (두 번드세요💜) 제일 맛있었던건 ✨아몬드크로와상✨ 크기도 엄청 크고 엄청 바삭바삭해서 오빠랑 저랑 둘 다 제일 맛있게 먹었어요 홀케이크도 있었는데 홀케이크는 3일전에 주문해야한데요 생일되면 구입해볼까 생각하고 있어용 체크체크 빵수니는 오늘도 픽업해갑니당🥐 감사합니다 * BELLALOG 벨라로그 * #빵수니 #한남동맛집 #한남동베이커리 #모닝번 #크로아상맛집 #이태원빵집 #타르틴베이커리 #타르틴베이커리한남 #타르틴베이커리한남점 #타르틴베이커리서울 #타르틴한남 #타르틴커피 #한남동베이커리카페 #한남베이커리 #한남베이커리카페 #한남동핫플 #한남핫플 #한남동카페 #한남카페 #한남역카페 #한남역데이트 #한남동데이트 #한남데이트 #한남동가볼만한곳 #이태원베이커리 #이태원베이커리카페 #tartinebakery #tartine #한남동빵집 #한남맛집 #한남동맛집"
"타르틴 베이커리, 한남동 브런치 카페에서 노트북하며 주말에 시간 보내기","타르틴 베이커리 한남점 서울특별시 용산구 한남대로18길 22 예약 한남동에서 브런치나 빵집을 찾는다면 타르틴 베이커리 한남점 일요이 아침에 간만에 노트북을 들고 개인 업무를 좀 하고자 한남오거리로 나갔는데 한~적한 곳까지는 아니더라도, 바깥에 차나 사람 지나가는 거 보면서 하고 싶어서 분~위기 있게 블루보틀 가려고 했는데... 와우 🤨 자리 꽉꽉 아주 여유가 하나도 없어서 다른 카페로 도망갔다 타르틴 베이커리 오픈 10;00-21:00 용산에 있는 타르틴 베이커리도 여러번 가보고 여기 한남점 타르틴 베이커리도 한 번 가봤는데 아주 오랜만에 다시 방문해봤다! 오후 3시쯤 방문했는데, 아주 다행히 2층에 자리가 있어서 냉큼 가방 놓고 앉았다! 😁 타르틴 베이커리 2층 1층은 사람들이 왔다갔다 조금 정신이 없고 2층은 그나마 자리도 많고 여유 있는 느낌이다! 그리고 화장실도 2층 모퉁이에 있는데 아주 깔끔쓰!! 원래 화장실을 자주 가서 편하게 많이 들락날락했다 😊 타르틴 베이커리 한남점 공간 곳곳에 이런 빵 포스터들이 있는데 왠지 믓찌다! 그리고 천장이 높아서 널찍하고 속이 뻥 뚫리는 기분도 든다. 타르틴 베이커리 빵과 커피 내가 산 거는 저게.. 호두견과파운드?이고 그리고 커피는 '코르타도' ☕ 코르타도는 에스프레소와 스팀우유를 1:1 비율로 만들어서 다소 쓴 맛이 있다! 스페인에서 시작된 커피로, 커피의 맛을 제대로 느낄 수 있다고나 할까! 확실히 따뜻했을 때는 쓴 맛이 강하지 않았는데 막상 조금 식고 나서 한 모금 하니까 쓴맛이 확 올라오긴 했다.. 그래도 커피맛 지대로! 타르틴베이커리 굿즈 그리고 빵집답지 않게 빵과 관려된 굿즈를 생각보다 많이 찾아볼 수 있다 빵 모양의 그립톡이랑, 엽서, 가방, 컵까지 아주 다양하게 🥐 타르틴 베이커리 메뉴 한 번도 먹어본 적 없는데 타르틴 베이커리는 사실 브런치로 유명한 듯 하다! 매일매일 오전 10시부터 4시까지 먹을 수 있는 메뉴들이 착- 있는데 아주 종류도 다양하고 먹음직스러워 보였다 다음에는 주말 오전에 일찍 브런치 한 번 제대로 즐기러 가야짓 😁 커피값은 그래도 평균적으로 스타벅스보다는 저렴한 듯!하다 타르틴베이커리 빵 입구에 들어가면 빵들이 착 진열되어 있고 한 켠에는 케이크도 있고 음료도 있고! 내가 간 시간은 오후 4시다 보니 빵 종류가 많이 빠지고 없었다! 좀 더 일찍 가면 다양하게 먹을 수 있지 않을까 타르틴 베이커리 내부 만약 한남오거리에 있는 다른 커피숍에서 자리가 없어 허탕을 치거나, 브런치를 즐기고 싶으신 분이라면 한남동 타르틴 추천 드립니당! 나머지 메뉴들은 먹어보질 못해서 제대로 맛 평가를 하기는 어렵지만 그래도 기본적인 빵들이 맛있으니 메뉴들도 맛나지 않을까 기대한다! 코로나로 인해서 이전만큼 서울 카페투어를 제대로 하고 다니지는 못하지만, 가끔 이렇게 카페에서 시간을 보내고 오는 시간이 더 기억에 남고 몇 배로 좋기도 하다 🥰"
한남동 :: 타르틴 베이커리,"타르틴 베이커리에 다녀왔어요 워낙 유명한 베이커리집이라 가기전에 뭐먹지 행복한 고민.. 타르틴은 크로와상, 바나나크림 타르트, 컨트리 빵이 유명하다고 하네요 🤩 📍위치/정보 50m © NAVER Corp. 타르틴 베이커리 한남점 서울특별시 용산구 한남대로18길 22 예약 매일 10:00-21:00 브런치나 샌드위치 샐러드, 커피도 판매중이에요 2층도 있어서 매장에서 먹고가면 더 좋을것 같아요 메뉴판 첨부하니 가격 참고하세요! 크로와상 4,600원 빵 오 쇼콜라 5,300원 컨트리 브레드 14,000원 (하프 7,000원) 바나나 크림 타르트 9,500원 조금 비싸다고 생각할 수 있겠지만 크기가 보통 빵집의 두배는 되는것 같아요 10am-4pm 브런치도 판매중이에요 잠봉뵈르도 팔길래 고민 했는데 기본 먹어보고 싶어서 컨트리 하프로 구매~~ 컨트리 하프 7,000원 겉바속쫀 진짜 기대 이상으로 넘넘 맛있었어요 손을 멈출 수가 없었다는.. 버터와 올리브오일이 같이 들어있는데 이게 빵이랑 정말 찰떡궁합이에요 푹 빠져버렸어요... 밥먹으러 가야되는데 반 이상 순삭💦 마켓컬리에도 입점해있어요 가격은 매장과 동일하네요 물론 가서 바로 먹는 빵 만큼은 아니겠지만 직접 가기 귀찮을때는 새벽배송으로 시켜서 아침으로 먹으면 좋을거같아요 샌프란시스코에서 갔던 타르틴 베이커리 후기도 간단히 남겨요 한국과 마찬가지로 손님이 많아요 5분정도 기다렸던거같아요 한국이랑 거의 똑같죠 가격도 거의 비슷하거나 환율 생각하면 샌프란이 더 비싼것도 있어요! 크로와상과 라떼~~ 그리고 요거트랑 샐러드까지 사서 근처 돌로레스 공원에서 여유 듬뿍 피크닉했어요 코로나 끝나면 다시 한번 가고싶어요 🥐"
타르틴베이커리한남점/한남동디저트카페,"50m © NAVER Corp. 타르틴 베이커리 한남점 서울특별시 용산구 한남대로18길 22 예약 #타르틴베이커리한남점 타르틴은 이태원 해밀턴호텔 쪽 골목 구석에서 타르트만 팔 때부터 좋아했다 지금은 없어진거 같고 타르틴베이커리만 있는 듯 개인적으론 타르틴의 베이커리류보다는 타르트와 케이크가 더 맘에 든다 지점이 여러개인데 인테리어가 꽤 좋더라고? 모던하고 깔끔 굿즈가 아주 탐났던 타르틴 가격이 무지막지함 ㅋ 머그 18,000원 색상이 너무 이쁘당 타르틴베이커리한남점/한남동디저트카페 재생 0 좋아요 0  접기/펴기 타르틴베이커리한남점/한남동디저트카페 오후에 가서 빵은 많이 품절 마켓컬리에도 있으니 너무 탐내지 말고~ 타르트 가격. 후덜덜 ㅋㅋ 타르트류가 비싸지만 확실히 맛있으니. 타르트로 픽 아~ 담엔 브런치 메뉴 도전해봐야겠다 오후 늦은 시간이라 라떼가 마시고 싶었지만 얼그레이 주문 타르트와 음료 #프랑지판크림타르트 오우 이거 너무 맘에 들었다 아몬드와, 크림과, 딸기가 잘 어우러짐 파삭파삭한 식감도 #레몬타르트 상큼한 레몬크림과 딱딱한 타르트바닥 구웃~ 밥 가격만큼 나온 타르틴베이커리의 디저트 ㅋㅋ 간만에 서울나들이~ 구두 신고 차없이 나갔더니 허리 나갈 뻔 ㅠㅠ"
[한남동 맛집] 타르틴베이커리 한남점,"안녕하세요-! 오늘은 제친구 민돌이와함께 한남동 타르틴 베이커리에 다녀왔어용 ㅎㅎ 50m © NAVER Corp. 타르틴 베이커리 한남점 서울특별시 용산구 한남동 263-2 예약 출발 ~ 타르틴 베이커리한남점은 주차장과 발렛파킹서비스가 가능해요~ 저희는 1시간 남짓이용했는데 이용료는 3,000원이었구요, 만약 주차를 해놓고 외부에 다녀올 시 시간당 6,000원이 추가된다고하니 참고하시면 좋을 것 같아요 ^~^ 짠 도착했습니당 ㅎㅎ 타르틴 베이커리 한남점 영업시간 코로나 바이러스로 안해 영업시간이 변경된 것 같아요 ㅠㅠ 참고하세용~ 메뉴판 왼쪽이 당근케익 오른쪽이 치즈케익 이에용ㅎ 너무 맛있고 꾸덕해보인댱,, 타르틴 베이커리의 시그니처 메뉴는 바로 이 바나나크림 타르트라고 해서 저희는 이걸루 주문해보았어용 건강해보이는 통밀빵! 이것도 시그니처 메뉴라고하네요 ㅎ 이런 아기자기한 쿠키세트도 있어요 ㅎ 선물하기 딱이네용 저희는 2층에 자리를 잡았어용 영롱해보이는 바나나크림 타르트님,, *주먹으로 친거아님* 안에는 바나나가 겹겹이 쌓아져있고 커스터드 크림이 필링되어있어서 너무 맛있었어요😋 타르틴 베이커리 한남점 2층 구조 2층에서 내려다보이는 뷰에용 ㅎ 굿즈 애기들 타르틴 베이커리 한남점 리뷰는 여기까지💜 다음 포스팅에서 만나요~"
"성수동 낫저스트북스, 한남동 타르틴베이커리, 가지 알리오올리오 파스타 만들기, 짜파게티로 짜장면 만들기","요즘 너무 예쁜 하늘 혼자 시간이 남아 가고싶던 책방가기 성수동 Not just Books 커피를 파는줄 모르고 책구경갔다가 반가운 마음에 라떼를 시켰는데 달달 꼬수한게 맛있었당*_* 포르투 책은 생각나는 친구에게 선물 하려고 샀구💙 조용하니 책읽고 쉬다가기 좋은 공간 한동안 면 중독이여서 3일 연속 해먹은 가지 알리오올리오 파스타 * 삡시피 오일에 마늘을 먼저 볶다가 양파를 넣어같이 볶는다 가지와 시판용 알리오올리오 소스가있다면 넣어준다 페퍼론치노 2개 넣고 삶은 면넣고 소금 후추로 마무리 다시 시작한 꽃 내가 제일 좋아하는 꽃은 카푸치노, 카페라떼 장미 이날은 카페라떼를 쓰는날이었다 이름 마저 내스타일이넹 Ore에서 구입한 샌들 편하고 넘 맘에들어서 아껴신는중 닳지말아다오 이날 꽃 색감 너무 좋았다 내스타일 ..💖 내사랑 쁘띠의 시선..💓 오랜만에 꽃 만지는데 꽃태기가 올것같은 요즘이지만 꽃은 그래도 여전히 좋다 ㅎㅎㅎㅎㅎㅎ 뒤죽박죽 사진첩에 있는대로 기록 2달전에 산 샤넬 팔레트 잊고있다가 가을이 차츰 다가와서 뜯었더니 집에있는 색이랑 거의 비슷한걸..?데칼코마니세용? 그래도 둘다 예쁘다ㅠㅠ💛 여행 가기 일주일전이라 오랜만에 네일 했당 (두서없는 글이 이번 포스팅의 컨셉) 댕댕이들이 넘넘 귀여워서ㅠㅠ 붙여줬는데 쵸큼 무겁네엥 그래두 손톱 볼때마다ㅠ귀여웡 ㅠㅠ♥️♥️♥️ 다음 집밥 삡선생은 짜파게티로 짜장면 만들기 1. 집에 남아있던 고기(삼겹살을 썼다)와 양파를 기름에 볶는다 2. 짜파게티 분말 스프를 넣고 섞어준다 (면수도 조금 넣어준다) 3. 삶은 면을 넣어주고 휘뚜루 마뚜루 섞는다 분말 가루를 1.5개 넣으면 더 맛있을것같다 이날 해먹고 저녁에 아는형님을 봤는데 이연복 쉐프님도 짜장라면으로 짜장면만드는걸 선보이심-! Anyway, 아침부터 짜장면 해먹고 한남동 타르틴베이커리로 세영언니 만나러 고고💛 요 과일 올라간 푸딩이 맛있는 타르틴 몇달만에 만나서 수다삼매경💛 꽃 얘기와 결혼얘기가 대부분이었던 언니와 나의 대화 언니가 동네살아서 좋다 흐흐 끝,"
타르틴 베이커리ㅣ한남동의 분위기맛집 브런치카페,"한남동만의 한적한 분위기가 있죠 분위기 맛집 브런치 카페 타르틴 베이커리 한남점 소개해 드립니다 50m © NAVER Corp. 타르틴 베이커리 한남점 서울특별시 용산구 한남대로18길 22 예약 위치: 서울 용산구 한남대로 18길 22 전화: 02-792-2423 영업시간: 연중무휴, 월~일 10:00~21:00 발렛파킹, 무선인터넷 위치는 경의중앙선 한남역 1번 출구에서 도보로 11분 거리에 위치해 있어요 건물 하나를 통째로 쓰고 있었어요 독채 베이커리! 빨간 벽돌이 너무 예쁘죠 복층 구조로 되어있더라구요 주말 3시쯤 방문했는데 인기가 많은 빵은 비어있더라구요 저와 친구가 고르는 동안에도 옆에서 5만원씩 빵을 사 가고 계셨습니다 그래서 골라놨던 한 조각 남은 케이크를 눈앞에서 뺏기고 말았어요..ㅎㅎ 2층 아랫부분을 주방으로 쓰고 있더라구요 구조가 안정적이고 좋아 보였어요 카운터 오른쪽으로는 이렇게 와인을 진열해 둔 공간이 있었는데요 바스켓에 아무렇게나 담아둔 듯한 디스플레이가 이곳만의 분위기를 만들어주고 있었어요 천정은 정말 제가 들어오자마자 잘 찾아왔다고 느낀 요소였는데요 동그란 조명들이 구름처럼 떠있었어요 1층 출입구 쪽으로는 이렇게 MD 상품을 진열해두고 있더라구요 텀블러 미니사이즈 너무 귀엽지 않나요ㅎㅎ 1층에 자리가 없어서 2층으로 올라가 보았습니다 2층 올라가는 계단 벽에도 동글동글한 벽부등 조명이 달려있었어요 조명이 통일감이 있어서 좋았습니다 포슬포슬해 보이는 식감에 4가지 맛이 들어있는 '사워도우빵'을 기대하며 골랐습니다 빵과 함께 들어있던 버터+올리브오일과 추가로 산 쪽파 크림치즈! 편하게 집어먹기 위해 하나씩 조각내기 시작했어요ㅋㅋ 점심을 먹고 디저트로 달달한 걸 먹으러 온거였는데 빵도, 버터도, 크림치즈도 먹다 보니 너무 느끼했어요 당황했죠.. 메뉴선택을 잘못한 거 같다 mbti 'T'인 친구가 해결책을 줬어요 ㅋㅋ 서비스 테이블에 있는 각설탕을 물을 살짝 부어 으깨서 버터와 섞어서 새로운 잼을 만들었어요 즉석에서 만든 건데 생각보다 너무 맛있어서 놀랬어요 역시 달달한 게 들어가야 한다고 다음 부터는 메뉴선택에 신중을 기하자며 다짐했죠ㅎㅎ 2층에서 본 조명들은 노출 콘크리트의 박공지붕천장과 창을 통해 들어오는 햇빛과 어우러지며 카페 같지 않은 엄숙한 분위기를 만들어주고 있었어요 또 아래를 내려다면 분주하고 매력이 있는 공간이었습니다 화장실 세면대인데 수전이 조이스틱처럼 되어있어서 신기했어요 콘크리트 베이스에 섬세한 배색과 재료들이 너무 예쁘게 꾸며진 베이커리인 거 같아요ㅎㅎ 바깥은 한참 벚꽃비가 내리던 때였어요 가로수로 벚꽃들이 심어져있어서 바람 불 때마다 이곳저곳에서 찰칵거리는 소리가 들렸어요 - 타르틴베이커리 한남점 한남동은 자주 가보진 않았었는데, 모든 가게에 발렛파킹이 있는 신기한 동네에요 주말이었는데도 동네가 한적하고 여유 있는 느낌이 들었습니다 빵은 조금 비싼 느낌이었지만 사워도우빵 식감이 괜찮았습니다 영어 단어에서 사워(sour)가 '시다'라는 뜻이라고 해요 이스트를 쓰지 않고 천연발효종을 사용해서 만들어지는데 약간의 신맛이 나는 게 특징이라고 합니다 시간이 많이 들어가는 식빵인 만큼 자주 볼 수 없는 식빵인 것 같아요 한남동의 맛있는 빵과 여유로운 분위기 감각적인 예쁜 인테리어를 원하는 분들이 방문하면 좋을 거 같아요ㅎㅎ"
"[한남동 타르틴 베이커리] 코코넛 크림 타르트 추천, 뺑오쇼콜라 비추천","한남동 빵집 / 한남동 카페 / 타르틴 추천메뉴 슬리퍼를 신고 오신 한남동 유엔빌리지 주민이랑 타르틴 베이커리에서 접선..ㅋㅋ 배는 별로 안고프고 당떨어져서 케이크 먹으러 왔다. 얘가 아침에 가서 갓구운 크라상 먹어보라고 했는데 아침부터 갈 힘이 없구요 ^ㅡㅠ 난 5분컷 거리가 아님 여기 모닝번 극찬하던데 담번엔 꼭 모닝타임에 먹어봐야지!! 아님 브런치타임에라두 :> 맨날 저녁에 가니까 빵이 다 식어서 감흥이 없다. 샌프란시스코 타르틴 베이커리가 본점이고 서울에 상륙했는데(물론 본점을 가본적은 없음^^) 여기 한남 멀티그레인, 제주 녹차 아몬드 티케이크같은 코리안 메뉴도 있다 우왕 신기해 ㅋㅋ 케이크 비주얼 정말 굿~ㅎㅎ 미쿡스타일로 묵직하고 밀도있는 느낌이다. 들면 엄청 무거울거 같은..?ㅋㅋ 한남동 주민이 저 샌드위치도 먹어보라고 아침에 먹었는데 저녁까지 배 안고프다고 했다. 솔직히 샌드위치가 엄청 크긴 한거 같다..ㅋㅋㅋ 타르틴 식빵은 그저 그랬다. 걍 쫄깃한 정도? 아몬드 vs. 바나나 vs. 코코넛 크림 타르트 중에 고민하다가 코코넛으로!! >< 이게 시그니처 메뉴라고 하는데 정말 이거 짱맛있다♥ 코코넛 크림이 차가운데 느끼하지도 않고 너무 너무 내 스타일 쿠키도 팔고 브라우니도 팔고 굿즈도 판다. 솔직히 굿즈 가격은 사악함 이 날은 동생이랑 한남동 장어덮밥먹고 후식으로 타르틴 방문 again...★ 뺑오쇼콜라 시켰다. 너무 퍽퍽하고 차가워서 데워달라고 했다. 데워옴... 왠지 느낌이 불길했다. 와우 진짜 맛없어서 놀란 뺑오쇼콜라 ㅋㅋㅋㅋㅋㅋㅋㅋㅋㅋㅋㅋㅋㅋㅋㅋㅋㅋㅋㅋㅋ 푸석하고 초코도 얼마 없고 결대로 찢어지지도 않고... 곤트란쉐리에 크라상도 실망실망 대실망이었는데 이 정도는 아니었는데... 타르틴 뺑오쇼콜라 ㄹㅇ 심각했다. 다음엔 각성하고 아침에 눈뜨자마자 가보기로^^ 타르틴 베이커리 추천메뉴는 무조건 코코넛 크림 타르트!!!!!!!!!!!! 50m © NAVER Corp. 타르틴베이커리서울 서울특별시 용산구 한남대로18길 22"
