title,content
매머드커피 익스프레스 8월 신규 오픈 매장 안내,"우리 동네에도 갓성비 매머드커피가 생겼다! 우리 지역도 이제 맴세권❤ 23년도 8월 새롭게 오픈한 매머드커피 익스프레스 지점을 알아볼까요? (˵ •̀ ᴗ - ˵ ) ✧ *맴세권이란, 매머드커피+세권의 합성어로, 매머드커피를 이용할 수 있는 곳을 말합니다. 8월 신규 오픈한 매머드커피 익스프레스 [서울] BYC사옥점, 관악센츄리타워점, 동소문점, 보라매공원점, 서울강서경찰서점, 서울역서부점, 서초호반점, 성대중문점, 숙대점, 역삼역한라빌딩점, 연신내역점, 오금역점, 학동역사거리점, 한남순천향병원점, 황학동점, 후암시장점 [경기] 군포IT밸리점, 삼육대후문점, 성남이마트점, 안산자유센터점 [인천] 모래내시장점, 인천구세청점 [대전] 대전오류동점 [울산] 울산대학로점 매머드익스프레스 BYC사옥점 -주소 : 서울 영등포구 디지털로38길 27 1층 105호 -영업시간 : (평일) 08:30 - 17:00 (주말 및 공휴일) 휴무 -매장전화 : 02) 840-8076 -구로디지털단지역 5번출구에서 도보 약 6분거리 -BYC 신사옥 내 로비 1층 위치 -외부고객 이용가능 -건물 주차가능 -키오스크 및 모바일오더 사용으로 비대면 주문 등 편리한 서비스 이용 가능 Next image 매머드익스프레스 BYC사옥점 서울특별시 영등포구 디지털로38길 27 1층 105호 매머드익스프레스 관악센츄리타워점 -주소 : 서울 관악구 남부순환로 1808 관악센츄리타워 1층 3호 -영업시간 : (평일) 08:00 - 20:00 (주말) 08:00 - 20:00 -매장전화 : 02) 877-7727 -서울대입구역 4번출구에서 2분거리 (116m) -건물 4층 관악 CBT센터(토익•토플 시험장), 인근 KT 관악지점, 현대해상 관악센터, 주거 및 병원•오피스빌딩 위치 -키오스크 및 모바일 오더 사용으로 비대면 주문 등 편리한 서비스 이용 가능 Next image 매머드익스프레스 관악센츄리타워점 서울특별시 관악구 남부순환로 1808 관악센츄리타워 1층 3호 매머드익스프레스 동소문점 -주소 : 서울 성북구 아리랑로 15, 1층 -영업시간 : (평일) 07:00 - 23:00 (주말 및 공휴일) 07:00 - 23:00 -매장전화 : 0507-1397-5573 -성신여대역 5번출구에서 2분거리 (163m) -주변 여러 병원 및 약국 위치 -많은 좌석 구비로 편리한 이용 가능 -키오스크 및 모바일 오더 사용으로 비대면 주문 등 편리한 서비스 이용 가능 Next image 매머드익스프레스 동소문점 서울특별시 성북구 아리랑로 15 1층 매머드익스프레스 보라매공원점 -주소 : 서울 동작구 보라매로5길 43, 보라매삼성쉐르빌아파트 1층 105호 -영업시간 : (평일) 07:00 - 19:00 (주말 및 공휴일) 09:00 - 18:00 -보라매병원역 2번출구에서 2분거리 (251m) -도보 2분거리에 보라매공원 위치 -키오스크 및 모바일오더 사용으로 비대면 주문 등 편리한 서비스 이용 가능 -이용 고객 카드키 통해 건물 1층 공용 화장실 사용 가능 -방문 시, 삼성쉐르빌아파트 전용 지하주차장 3시간까지 무료주차 가능 Next image 매머드익스프레스 보라매공원점 서울특별시 동작구 보라매로5길 43 보라매삼성쉐르빌 1층 매머드익스프레스 서울강서경찰서점 -주소 : 서울 강서구 화곡로 318 1층 -영업시간 : (평일) 08:00 - 22:00 (주말 및 공휴일) 09:00 - 21:00 -매장전화 : 02) 2602-1820 -화곡역 3번출구, 가양역 7번출구에서 도보20분, 대중교통10분거리 (1.4km)에 위치 -주변 서울강서경찰서, 강서구청 위치 -주차 불가 Next image 매머드익스프레스 서울강서경찰서점 서울특별시 강서구 화곡로 318 1층 매머드익스프레스 서울역서부점 -주소 : 서울 용산구 청파로 395 102호 -영업시간 : (평일) 07:30 - 19:30 (주말 및 공휴일) 휴무 -매장전화 : 02) 707-2504 -서울역 15번출구에서 도보 5분(176m)거리에 위치 -주변 코레일 한국철도공사본부, 서울역도심공항터미널 위치 -주차 가능 -키오스크 및 모바일 오더 사용으로 비대면 주문 등 편리한 서비스 이용 가능 Next image 매머드익스프레스 서울역서부점 서울특별시 용산구 청파로 395 매머드익스프레스 서초호반점 -주소 : 서울 서초구 양재대로2길 8, 서초리슈빌s글로벌 1층 108호 -영업시간 : (평일) 07:30 - 19:00 (주말) 09:00 - 18:00 -매장전화 : 070-8657-2666 -lh서초아파트 정류장에서 도보 2분(157m) -주변 호반건설, 서초참요양병원 위치 및 lh서초아파트 위치 -키오스크 및 모바일오더 사용으로 비대면 주문 등 편리한 서비스 이용 가능 Next image 매머드익스프레스 서초호반점 서울특별시 서초구 양재대로2길 8 서초리슈빌S글로벌 1층 108호 매머드익스프레스 성대중문점 -주소 : 서울 종로구 명륜길 40-1 -영업시간 : (평일) 08:00 - 20:00 (주말) 08:00 - 20:00 -혜화역 1번출구에서 종로8번 마을버스 탑승 후 “명륜시장,성대중문역” 하차 -인근 식당가 및 성균관대학교 중문 위치해 있어 학생 및 유동인구 유입이 많음 -키오스크 및 모바일 오더 사용으로 비대면 주문 등 편리한 서비스 이용 가능 Next image 매머드익스프레스성대중문점 서울특별시 종로구 명륜길 40 매머드익스프레스 숙대점 -주소 : 서울 용산구 청파로47길 67, 1층 -영업시간 : (평일) 08:00 - 20:00 (주말) 10:00 - 19:00 -숙대입구역 9번 출구에서 도보 7분 (520m) -근처 효창공원, 효창운동장 및 숙명여대 정문에 위치해 있으며 학생 및 유동인구 많음 -키오스크 및 모바일 오더 사용으로 비대면 주문 등 편리한 서비스 이용 가능 Next image 매머드익스프레스숙대점 서울특별시 용산구 청파로47길 67 매머드익스프레스 역삼역한라빌딩점 -주소 : 서울 강남구 테헤란로25길 30 지상1층 -영업시간 : (평일) 07:30 - 21:00 (주말 및 공휴일) 08:00 - 21:00 -매장전화 : 070-8770-0928 -역삼역 6번출구에서 도보 4분 -인근 AC 호텔 바이 메리어트 서울 강남 위치 -좌석 구비로 편리한 이용 가능 -키오스크 및 모바일 오더 사용으로 비대면 주문 등 편리한 서비스 이용 가능 -주차 불가 Next image 매머드익스프레스 역삼역한라빌딩점 서울특별시 강남구 테헤란로25길 30 지상1층 예약 매머드익스프레스 연신내역점 -주소 : 서울시 은평구 통일로 80길 1 1층 101호 -영업시간 : (평일) 08:00 - 22:00 (주말) 08:00 - 22:00 -3,6호선 연신내역 1번 출구에서 도보 1분 거리 ( 32m ) -주변 연신내 로데오거리, 국민은행, 농협 등 은행 및 병원, 주택 다수 위치 -키오스크 (현금없는 매장) 및 모바일오더 사용으로, 비대면주문 등 편리한 서비스 이용 가능 Next image 매머드익스프레스 연신내역점 서울특별시 은평구 통일로80길 1 1층 101호 매머드익스프레스 오금역점 -주소 : 서울 송파구 오금로 307, 르네상스빌아파트 1층 101호 -영업시간 : (평일) 07:30 - 21:00 (주말) 07:30 - 21:00 -오금역 7번 출구에서 도보 1분 (130m) -인근 서울병원, 오금중/고등학교, 송파우체국, 오금동 주민센터 위치 -좌석 구비로 편리한 이용 가능 -주차 30분 무료 Next image 매머드익스프레스 오금역점 서울특별시 송파구 오금로 307 1층 101호 매머드익스프레스 학동역사거리점 -주소 : 서울 강남구 논현로131길 12, B1층 -영업시간 : (평일) 07:30 - 19:00 (주말 및 공휴일) 09:00 - 17:00 -매장전화 : 02) 6953-1323 -학동역 7번 출구에서 도보 약 130M 거리에 위치 -주변 중소기업,먹거리상권 위치 -키오스크 및 모바일오더 사용으로 빠른 주문 및 픽업으로 편리한 서비스 이용 가능 Next image 매머드익스프레스 학동역사거리점 서울특별시 강남구 논현로131길 12 지하1층 매머드익스프레스 한남순천향병원점 -주소 : 서울 용산구 대사관로 66, 1층 -영업시간 : (평일) 06:30 - 22:00 (주말 및 공휴일) 07:00 - 22:00 -한남역 1번출구에서 약 도보 12분거리 (748m) -순천향대학교 부속 서울병원 약 도보 3분거리 (198m) -이태원거리에서 약 도보 14분거리 (949m) -키오스크 및 모바일오더 사용으로 비대면 주문 등 편리한 서비스 이용 가능 Next image 매머드익스프레스 한남순천향병원점 서울특별시 용산구 대사관로 66 지상1층 매머드익스프레스 황학동점 -주소 : 서울 중구 마장로9길 42 -영업시간 : (평일) 08:00 - 21:00 (주말 및 공휴일) 08:00 - 21:00 -매장전화 : 02) 3298-6641 -동묘앞역 3번출구에서 7분거리 (438m) -도보 3분거리에 청계천 이용가능 -황학동 주방거리에 위치 및 이마트와 인접 -좌석 구비로 편리한 이용 가능 -키오스크 및 모바일 오더 사용으로 비대면 주문 등 편리한 서비스 이용 가능 Next image 매머드 익스프레스 황학동점 서울특별시 중구 마장로9길 42 1층 매머드익스프레스 후암시장점 -주소 : 서울 용산구 후암로 48, 1층 제6호 -영업시간 : (평일) 10:00 - 22:00 (주말) 10:00 - 22:00 -서울역 12번 출구에서 도보 8분 (674m) -인근 남산공원, 남산도서관 및 롯데마트, 롯데아울렛 위치 -키오스크 및 모바일 오더 사용으로 (현금 없는 매장) 비대면 주문 이용 가능 -주차 불가능 Next image 매머드익스프레스 후암시장점 서울특별시 용산구 후암로 48 1층 6호 매머드익스프레스 군포IT밸리점 -주소 : 경기 군포시 고산로 148번길17,1층 상가 105호(당정동, 군포IT밸리) -영업시간 : (평일) 07:30 - 17:30 (주말 및 공휴일) 휴무 -군포IT밸리 B동 1층에 위치 -군포역 2번출구에서 약 도보 15분거리 (866m) -한세대학교에서 약 도보 10분거리 (565m) -당정중학교에서 약 도보 8분거리 (447m) -키오스크 및 모바일오더 사용으로 비대면 주문 등 편리한 서비스 이용 가능 Next image 매머드익스프레스군포IT밸리점 경기도 군포시 고산로148번길 17 군포IT밸리 매머드익스프레스 삼육대후문점 -주소 : 경기 남양주시 불암로 41-70, 1층 -영업시간 : (평일) 08:00 - 19:00 (주말 및 공휴일) 08:00 - 17:00 -인앤아웃 매장 -별내역 2번 출구에서 도보 약 26분거리 (1.8km) -도보 1분거리 내 삼육대학교 후문이 위치하고 삼육대학교 부지 내 삼육유치원, 삼육 초/중/고등학교 위치 (약 200m 내외) -반대편으로는 아파트 단지(미리내, 꿈에그린 등) 위치 (약 600m 내외) -8 좌석 구비로 편리한 이용 가능 -키오스크 및 모바일오더 사용으로 비대면 주문 등 편리한 서비스 이용 가능 Next image 매머드익스프레스 삼육대후문점 경기도 남양주시 불암로 41-70 1층 매머드익스프레스 성남이마트점 -주소 : 경기 성남시 수정구 수정로 205 -영업시간 : (평일) 08:00 - 20:00 (토요일) 08:00 - 20:00 (일요일) 09:00 - 20:00 -매장전화 : 031) 752-1237 -8호선 신흥역 3번출구에서 716m (도보 약 15분) -이마트 성남점 앞 숯골사거리에 위치 -약 12석의 좌석 구비로 편리한 이용 가능 -건물 뒷편 무료 주차 30분 가능 -키오스크 및 모바일 오더 사용으로 비대면 주문 등 편리한 서비스 이용 가능 Next image 매머드익스프레스 성남이마트점 경기도 성남시 수정구 수정로 205 매머드익스프레스 안산자유센터점 -주소 : 경기 안산시 단원구 화랑로 358 , 1층 126호,127호 -영업시간 : (평일) 07:30 - 21:00 (주말 및 공휴일) 휴무 -매장전화 : 070-8862-5274 -안산자유센터 건물 1층에 위치, 고잔역 1번 출구에서 도보 약 15분거리 (846m) -도보 6분거리 내 안산시청, 안산경찰서, 국민건강공단 외국인민원센터 등 공기업 다수 위치(약 400m 내외) -고잔롯데캐슬(총 9동) 도보 약 5분 거리(257m) -안산세무소 바로 옆 건물, 입점 건물 내 세무사 사무실 다수 위치 -현금 결제 가능 매장(OK POS) -좌석 구비로 편리한 이용 가능 -키오스크 및 모바일오더 사용으로 비대면 주문 등 편리한 서비스 이용 가능 Next image 매머드익스프레스 안산자유센터점 경기도 안산시 단원구 화랑로 358 1층 26, 27호 매머드익스프레스 모래내시장점 -주소 : 인천 남동구 구월로276번길 40 -영업시간 : (평일) 08:30 - 21:00 (주말) 08:30 - 21:00 -매장전화 : 010-3054-4453 -모래내시장역 3번출구에서 도보 6분 (400m) -시장 내에 위치해있어 평일에 비해 주말 유동인구 많은 편 -시장상권 / 고객 연령층 높은 편으로 현금결제 가능 -이용 고객 시장 내에 공용화장실 사용 -외부테라스 사용가능 Next image 매머드익스프레스 모래내시장점 인천광역시 남동구 구월로276번길 40 1층 106호 매머드익스프레스 인천국세청점 -주소 : 인천 남동구 남동대로765번길 26 -영업시간 : (평일) 07:30 - 19:00 (토요일) 07:30 - 19:00 (일요일) 휴무 -인천1호선 예술회관역 도보 12분 (750m) -인근 인천시청, 인천국세청 등 공기업 위치 -현금 결제 가능 -키오스크 및 모바일오더 사용으로 비대면 주문 등 편리한 서비스 이용 가능 Next image 매머드익스프레스 인천국세청점 인천광역시 남동구 남동대로765번길 26 105호 매머드익스프레스 대전오류동점 -주소 : 대전 중구 계룡로816번길 11, 1층 -영업시간 : (평일) 08:00 - 21:00 (주말 및 공휴일) 09:00 - 21:00 -오룡역 2번 출구에서 도보 약 4분거리 -주변으로 서대전역, 코스트코 대전점, 을지대학교 대전캠퍼스 위치 -좌석 구비로 편리한 이용 가능 -키오스크 및 모바일오더 사용으로 비대면 주문 등 편리한 서비스 이용 가능 Next image 매머드익스프레스 대전오류동점 대전광역시 중구 계룡로816번길 11 1층 101호 매머드익스프레스 울산대학로점 -주소 : 울산 남구 대학로 33번길 16, 1층 -영업시간 : (평일) 08:00 - 21:00 (주말 및 공휴일) 09:00 - 21:00 -매장전화 : 052) 975-7380 -울산과학대학교 서부캠퍼스에서 도보 7분 (450m) -인근 울산과학대학교, 울산대학교, 문수중학교, 월계초등학교 위치 -좌석 구비로 편리한 이용 가능 -키오스크 및 모바일오더 사용으로 비대면 주문 등 편리한 서비스 이용 가능 Next image 매머드익스프레스 울산대학로점 울산광역시 남구 대학로33번길 16 1층 8월에 신규 오픈한 매머드커피 익스프레스 오늘은 8월에 오픈한 매머드 익스프레스 소식을 전해드렸습니다✨ 앞으로도 전국 다양한 지역에서 매머드커피를 만나보실 수 있도록 노력하겠습니다 ⸜( •ᴗ• )⸝ MAMMOTH COFFEE MAMMOTH COFFEE EXPRESS *위 이미지 클릭 시, 홈페이지로 이동합니다."
이태원상권회복상품권 서울페이 사용 가능한 한남동 음식점 카페 사용처 가맹점 같이 알아봐요~,"안녕하세요 빵떡이에요:0 지난 10월 이태원 할로윈데이 때 안타까운 사고가 있었죠 저도 인근 동네에 살고있어서 그 소식을 듣고 마음이 많이 아팠답니다 그 후로 이태원 근처에 가보면 주말에 시끌벅적했던 이태원이 다니는 사람 없이 확실히 조용해서 상권 회복이 안되는걸 몸소 느껴왔는데요 소상공인들의 근심도 크겠다 생각했어요 그러던 중 서울시에서 2023년3월8일 오전 10시에 서울페이에서 소상공인들의 근심을 덜어줄 이태원상권회복상품권을 판매했고 무려 20%라는 할인률로 엄청난 인기를 끌었어요 발행 규모는 총 300억원이고 유효 기간은 상품권 발행일로부터 1년이며 용산구 6개동(이태원,한남동,보광동,서빙고동,용산2가동)에서 쓸 수 있는 상품권이에요 인당 최대 구매 금액은 70만원이었고 보유금액은 150만원까지 가능했어요 (가족,친구들에게 대리 구매해달라고해서 선물 받기 해서 150만원까지 채울 수 있어요) 저도 150만원치 구매했답니당:) 할인률 덕인지 2023년4월1일 현재는 판매 종료되었어요 300억원치가 전부 판매되었다는데 놀라웠네요 자,이제 150만원치 구매했으니 사용처를 찾아 열심히 쓰고 다녀야겠죠! 핸드폰에 서울 페이 어플을 깔고 들어가면 이런 화면이 나와요 화면 중간에 보면 내 주변 가맹점이 보이실텐데 눌러주세요! 이렇게나 많은 업종들이 나와요 가구,가전,교육,레저/스포츠,마트,병원/약국, 뷰티/미용,반려동물,사우나,음식점,제과점,커피, 주유,패션/잡화 등 다양한 곳에서 사용가능해요 저는 제가 살고있는 한남동부터 검색해보았어요 음식점 밖에서 외식 할 때 비용도 무시 못하잖아요 주말에 남편과 외식하기 위해 음식점을 검색해봅니당 잭슨 피자 한남동에서 유명하쥬?슈퍼 잭슨 피자도 맛있고 멜팅 치즈 피자도 맛있답니다:) 잭슨피자 한남점 서울특별시 용산구 독서당로 46 1층 107호 사계 사계 서울특별시 용산구 대사관로34길 22 THE VIII(갈2:20) 시실리 한남점 조개 구이 맛집! 시실리 서울특별시 용산구 한남대로21길 33 시실리한남점 두유테이블 흑돼지 맛집! 두유테이블 서울특별시 용산구 대사관로30길 11-9 2층 한남동 노포 1982 노포된장전골 먹으러 가는 맛집 노포1982 서울특별시 용산구 한남대로21길 33 1층 한남동 노포1982 한남동 한우 꽃등심,등심,갈비살 등 부위별로 고기를 즐길 수 있는 맛집 한남동한우 서울특별시 용산구 대사관로34길 25 1층,2층 피자스쿨 한남점 저렴하게 즐길 수 있는 누구나 아는 피자집이죠:) 피자스쿨 한남점 서울특별시 용산구 독서당로 22 동원 베네스트 101동 105호 예약 나주서서갈비 갈비 땡길 때 가는 집 나주서서갈비 서울특별시 용산구 대사관로34길 11 2층 북촌손만두 만두 포장해서 냠냠 북촌손만두 한남점 서울특별시 용산구 대사관로 76 넘버원 양꼬치 양꼬치 훠궈가 미쳐따...!재방문 몇 번째인지 모를 맛집 넘버원양꼬치 서울특별시 용산구 대사관로 76 2층 파리바게뜨 파리바게뜨 한남점 서울특별시 용산구 대사관로 73 예약 배스킨라빈스 한남 배스킨라빈스 한남점 서울특별시 용산구 대사관로 66-1 제일빌딩 예약 컴포즈 커피 한남순천향점 컴포즈커피 한남순천향점 서울특별시 용산구 대사관로 64 피자헛한남역점 피자헛 못참지 주말에 피자 테이크아웃 각 피자헛 한남역점 서울특별시 용산구 독서당로 29 바어바 한남동 분위기 있는 바 바어바 서울특별시 용산구 대사관로 73 2층 한냄비 자작한 국물의 스키야끼 맛집 한냄비 서울특별시 용산구 대사관로30길 17 외 다양한 음식점들이 있어요 더 많은 음식점 찾으실 땐 서울 페이 참고해주세용 베이커리/카페 한스앤그래텔 치즈,꿀,햄 등 와인 안주 맛집 한스앤그레텔 서울특별시 용산구 한남동 93 아이파크상가 212-1호 메가MGC커피 한남오거리점 저렴한 가격으로 커피 즐기자 테이크아웃 각 메가MGC커피 한남오거리점 서울특별시 용산구 한남대로21길 33 이디야 커피 순천향병원점 항상 곁에 있는 이디야 이디야커피 순천향병원점 서울특별시 용산구 대사관로 72 예약 SABE 사베 서울특별시 용산구 한남대로20길 47-6 1층 빵 맛집:내슈빌 치킨 대표 메뉴 가격대는 좀 있어요 까페 더브레이브 CAFE THE BRAVE 서울특별시 용산구 녹사평대로 170 1층 더베이크드바이셰프리 더베이크드 바이셰프리 동빙고점 서울특별시 용산구 녹사평대로 66 용산푸르지오파크타운 상가동 7호 리엠커피 리엠커피 서울특별시 용산구 우사단로 6 1층 리엠커피 릴리언 릴리언 서울특별시 용산구 한남대로27가길 15 1층(한남동) 릴리언 방문 포스팅도 보러오세요♥ ↓ 이태원상권회복상품권 서울페이 한남동 카페 릴리안ㅣ애견동반가능,야외 테이블 안녕하세요 빵떡이에요:0 지난번 서울페이에서 이태원상권회복상품권을 무려 20%할인해주어 구매했다고 포... blog.naver.com 매머드익스프레스 용산구청점 매머드익스프레스 용산구청점 서울특별시 용산구 녹사평대로32길 51 아티장베이커스 아티장베이커스 한남 서울특별시 용산구 한남대로18길 26 1층 올어바웃미 올어바웃미 서울특별시 용산구 회나무로6길 19 20%나 할인해주니 내가 필요한 매장에서 사용할 때 정말 잘 샀다는 생각이 들었어요 하지만,서울페이 이태원상권회복상품권 결제 가능한 사용처 매장이라고 써놓고 가서 결제하려고보면 안되는 경우도 있어서 매장에 확인 전화 후 방문드리길 추천드립니다:)"
