title,content
강남 파치노 에스프레소 바 Ver.2,"안녕하십니까 팥죽입니다 이것은 묵히다 겨우 구출한 포스팅 파치노 에스프레소 바 입니다 파치노 에스프레소 바 pacino espresso bar Ver.2 영업시간 및 기본정보 📍 서울 강남구 강남대로162길 40 2층 ⏰ 12:00 - 21:00 🚫 정기휴무 없음 🚗 주차 불가능 📞 0507-1450-4453 신사역 인근에 위치한 파치노 에스프레소 바 주차 불가능이고 역근처라 대중교통을 추천드려요 ((아우어베이커리 완전 근처임!! 읭 기여워 1 • 2호점 붙어있어서 취향인 곳으로 방문하면 될 듯 제가 방문한 곳은 2호점입니다 ❗️ 내부공간 완전 힙하죠잉 채도높은 우드톤에 분위기 좋지만 형벌의자임 ^^ 메뉴판 메뉴는 요렇습니댜 모바일 메뉴판엔 이미지도 같이 있어서 보기 편하네욤 커피류는 4,500 - 6,000 선입니댜 빠밤 고민하다 에스프레소 / 그래도 여까지 왔으니 파치노 크림 라떼 주문-! 에스프레소 4,500 잔 색감 넘 이뿌고~ 에스프레소부터 마셔봤심댜 이게 뭐꼬,, 에쏘 설탕없이 먹는 편인데 겁~~~나 진하고 꼬~~~숩해서 민첩하게 넣음 ㅋㅋㅋㅋㅋㅋㅋㅋ 맛있는데 여러분들은 꼭 설탕넣으십셔. 필수임. 파치노 크림 라떼 홀 - 6,000 / 테이크아웃 - 5,000 에쏘 / 시그니처 크림 / 우유 / 카카오파우더 먹은지 좀 되서리,, 직후에 먹고 겁나 달다라고 생각했던 기억밖에,, 달다구리 음료, 크림라떼 러버분들께 추천함댜 좌 : 1호점 / 우 : 2호점 분위기도 좋고 커피도 맛나서 신사쪽오면 들르기 좋을 듯 당옥도 근처던디 담에 또 올까봐유~~ 5m © NAVER Corp. 파치노 에스프레소 바 서울특별시 강남구 강남대로162길 37 1층(신사동) 파치노 에스프레소 바 Ver.2 서울특별시 강남구 강남대로162길 40 2층"
신사역 가로수길 핫한카페 파치노 에스프레소바 ver.2 나만의 또갈집,"파치노 에스프레소 바 ver.2 신사역 가로수길 나만의 또갈집 핫하디 핫한 에스프레소바 카페를 발견..‼️ ‘파치노 에스프레소 바 ver.2‘ 컨셉과 분위기 확실한 가로수길카페 추천 아메리카노도 마신지 얼마 안되어서 에스프레소를 마시진 못하지만 커피 못마시는 나와 내 친구도 완전 만족하고 온 신사동 핫한 카페 50m © NAVER Corp. 파치노 에스프레소 바 Ver.2 서울특별시 강남구 강남대로162길 40 2층 파치노 에스프레소 바 ver.2 위치는 요기! 파치노 에스프레소 바 본점은 바로 앞에 있고 버전 2는 맞은편 2층에 위치하구 있댜 두 곳 다 조용하고 가볍게 에스프레소 즐기기 좋은 위치와 분위기🤎 파치노 에스프레소바 2호점은 바로 요 계단을 올라가면 바로 보임댱 근데,,, 역시 신사 핫한 카페로 소문나서 그런지 사람 진짜 바글바글 내부가 넓은 편은 아니었는데 웨이팅하는 사람들도 있어서 아예 이른시간에 가거나 식사시간에 가는게 죠을둣 카페 내부 및 메뉴 파치노 에스프레소 바 ver.2 카페 내부 분위기가 정말 영화의 한 장면을 가져온듯한 느낌이었는데 사람이 너무 많아수 제대로는 못 찍었구 인테리어만 조금 찍어봄 ㅠ 에스프레소바 답게 다양한 에스프레소와 커피류, 음료도 다양해서 에스프레소 못 마시는 사람이나 커피 못 마시는 분들도 와서 충분히 분위기에 즐길 수 있을듯 ! 그리고 무엇보다 디저트가 생각보다 너무너무 맛있어서 디저트 먹으러두 올둣,,🫶🏻 노버터 노밀가루 글루텐프리 더블치즈케이크 강추 살도 안찌고 건강에도 좋겠지?^^ 휘낭시에도 독특하구 맛났음 ㅠㅠㅠㅠ 한 쪽에 이렇게 파치노 에스프레소바 굿즈? 상품도 있둠 힙한카페의 상징.. 컬러가 너무 예뿐 에스프레소잔도 팔고 있다 나중에,, 에스프레소 잔을 쌓으며 마실 수 있는 찐어른이 되면,,, 사야징,,,헷 벽에 걸려진 액자도 힙하고 영화의 한장면을 가져온건가 나중에 아마 인기가 젤 많을듯한 창가자리 앉으면 저렇게 힙하면서,,, 분위기 잡으면서,,, 뷰 보면서 !여유롭게 ! 에스프레소 마셔봐야지! 메뉴 소개 파치노 에스프레소 바 ver.2 후훟 내가 먹은 메뉴는 바로바로 파치노 크림라떼 민트머스캣 에이드 파치노 치즈케이크-더블치즈 휘낭시에/초코휘낭시에 진짜 음료 커피 디저트 뭐 하나 별로였던게 없던 가로수길 힙한 카페 파치노 에스프레소바 친구랑 나랑 둘 다 한입 씩 먹을 때마다 다 맛있다고 감탄함 시그니처 음료인듯한 파치노 크림 라떼 평소에 크림 쫀쫀하게 올라간 크림라떼를 좋아해서 기대 가득하고 마심 약간은 쌉쌀한 코코아 가루에 달달하고 부드러운 크림 쫀쫀하다기보다 부드러움이 더 느껴졌음! 아래 커피와 한 입 쭈욱 마셔주면 묵직하지만 부드럽고 쌉쌀하지만 달달한 크림라떼의 매력을 가득 느낄 수 있던 커피 민트러버라면 눈길이 갈 수 밖에 없는 민트머스캣 에이드 민트와 샤인머스캣이 들어간 메뉴겠지..?!! 생각한 맛이긴한데 알로에 같은 알맹이가 씹혀서 봉봉 같았닼ㅋㅋㅋㅋㅋ 시원하고 청량하게 마시기 좋았던 음료 완전 디저트 맛집 직접 만든 치즈케이크 안먹어볼 수가 없자나유? 6,500원 가격도 착한듯..! 요즘 물가가 미쳐서 손바닥만한 케이크에 7-8000원하는디 그리고 치즈케이크가 아니라 치즈무스라고 해도 될정도로 엄청 부드럽고 크림질감이 엄청 잘 느껴짐! 신사역 가로수길 핫한카페 파치노 에스프레소바 ver.2 나만의 또갈집 (1) 재생 1 좋아요 1 00:00 00:07  신사역 가로수길 핫한카페 파치노 에스프레소바 ver.2 나만의 또갈집 (1) 움짤에서도 느껴지는 부드러움과 밀도,,, 시트는 엄청 얇게 테두리에 있는듯 없는듯한데 그래서그런지 진한 치즈맛을 더욱 온전히 느낄 수 있었댜 독특한 모양의 휘낭시에 알고보니 시가 모양이라구..! 역시 가로수길 힙한카페 다움,, 요건 기본 휘낭시에 너무 달지 않고 너무 퍽퍽 팍팍하지 않아 먹기도 편했댜 은근한 매력이 있던 초코 휘낭시에 빼빼로같기도하고 기본 휘나시에보다 더 달달하고 바삭한 느낌 겉바속촉! 빼빼로데이에 선물 주기 조을거같댜 포장(테이크아웃) 갱장히 부드러웠던 치즈케이크 테이크아웃 포장도 된다는 사실 헷 감각적이고 힙한 스티커도 함께주심 바로 먹어야 제일 맛있지만 포장해서 한강이나 밖에서 먹어도 맛날거같구 친구들 생일에 다이소에서 초코펜 하나 산 다움 HBD 휘리릭 써주고 귀염뽀짝하게 축하해줘도 조을듯 너무 달기만한 치즈케이크가 아니라 더 맛있게 먹었던 치케 더 포장해서 집에 쌓아두고 먹고팠음 신사역 가로수길 핫한카페 파치노 에스프레소바 ver.2 나만의 또갈집 (2) 재생 0 좋아요 0 00:00 00:00  신사역 가로수길 핫한카페 파치노 에스프레소바 ver.2 나만의 또갈집 (2) 신사동 가로수길 힙한 카페 파치노에스프레소바 에스프레소를 즐기는 분들 감성 넘치는 카페 디저트 맛집 음료맛집 카페를 찾고 있었다면 추천🌟 👇🏻👇🏻👇🏻👇🏻👇🏻👇🏻👇🏻 ‘메뉴를 제공받아 솔직하게 잘성된 리뷰입니다.’ #파치노에스프레소바 #에스프레소바 #신사카페 #신사동카페 #가로수길카페"
신사역 조용한 카페 파치노 에스프레소 바 Ver.2,"파치노 에스프레소 바 Ver.2 서울 강남구 강남대로162길 40 2층 0507-1450-4453 12:00 - 21:00 라스트 오더 20:45 50m © NAVER Corp. 파치노 에스프레소 바 Ver.2 서울특별시 강남구 강남대로162길 40 2층 3호선, 신분당선 신사역 6번 출구에서 613m 떨어져 도보로 15분 거리에 위치한 신사역 카페 파치노 에스프레소 바 2호점에 다녀왔어요 나이스 웨더 마켓 바로 옆에 위치한 신사역 조용한 카페 파치노 에스프레소 바 2호점 신사역 카페 파치노 에스프레소 바는 가게 바로 앞에 1호점과 2호점이 붙어있어서 둘 중 마음에 드는 곳으로 선택하면 되는데 저는 더 신식인 2호점으로 ㅎㅎㅎ 건물 2층에 위치한 신사역 카페 파치노 에스프레소 바 외관의 새하얀 건물과는 다르게 들어가자마자 첫 느낌은 클래식한 분위기였어요 알파치노의 영화 포스터들이 여기저기 붙어있더라고요 돈뭉치 소품까지 딱 있으니 대부의 한 장면 같은 느낌도 들고 알고 보니 에스프레소 바 이름에서 나타났듯이 신사역 카페 파치노 에스프레소 바는 배우 알 파치노에게 영감을 받아 만들었다고 해요. 그래서 그런지 알파치노 피겨, 포스터들이 많더라고요. 마치 알파치노의 세상에 온 거 같은 ㅎㅎㅎㅎㅎ 가게 한쪽은 통창유리로 쾌적해서 그쪽 자리는 경쟁이 치열하니 눈치 보고 바로 일어나시면 앉아야 해요 CCTV까지 세상 힙하다니?!!?! 한쪽에는 굿즈 공간이 있는데 반팔이랑 컵이 뭔가 심플한 게 딱 제 스타일로 사고 싶게 만들더라고요 카운터도 무슨 옛날 영화에서 보던 전당포랄까 카운터 옆에 디저트가 어떻게 생겼나 볼 수 있는데 휘낭시에가 이렇게 힙한거 보신 분 있나요?? 허리띠도 살 수 있나보더라고요ㅎㅎㅎㅎ 세상 신기한 ㅎㅎ 통창유리 밖에 보면 바로 1호점이 보이고 사람들이 지나다니는데 한편의 다큐영화를 보는 것 같은 기분이 들더라고요 메뉴판 신사역 카페 파치노 에스프레소 바 2호점은 휘낭시에 세트, 치즈케이크 세트뿐만 아니라 다양한 에스프레소 커피 종류와 에이드 그리고 위스키나 칵테일도 주문이 가능해요. 거기에 테이크 아웃 시에는 할인도 가능해요 저희는 망고바나나 밀크, 시그니처 파치노 크림 라테, 휘낭시에를, 더블치즈 파치노 치즈케이크를 주문했어요. 에스프레소 라테 베이스에 초콜릿 파우더 같은 게 올라가서 크림 라테에 초코맛이 첨가된 맛이라서 처음 에스프레소 먹는 사람뿐만 아니라 누구나 맛있게 호불호 없이 먹을 맛이에요 진짜 완전 말 안 하면 그냥 시가 모양 그대로인 휘낭시에 그 느낌처럼 한번 잡아주는데 노담이라서 어색 ㅎㅎㅎ 직원분께서 휘낭시에를 시그니처 파치노 크림 라테의 크림에 찍어 먹으면 맛있다는 꿀팁을 듣고 바로 따라 해봤어요 달달한 초코맛 덕분에 휘낭시에가 초코맛으로 변하니 달달한 게 맛있고 기분이 좋아지게 하더라고요 망고바나나 밀크는 딱 뚱바나나우유에 망고 시럽이 들어가 있는 느낌으로 정말 달달한 게 맛있고 목욕 갔다가 먹으면 두 배로 맛있을 거 같아요 ㅎㅎㅎ 에스프레소 바 2호점의 치즈케이크는 버터와 밀가루, 글루텐을 사용하지 않으며 종류는 더블치즈와 카라멜쇼콜라 2종류가 있어요. 저는 근본인 더블치즈로 주문했어요 포크로 딱 자르는데 정말 세상 부드럽게 포크가 빨려 들어가더라고요 ㅎㅎㅎ 그 맛은 정말 세상 꾸덕꾸덕한게 진짜를 만났다는 느낌이었어요ㅎㅎㅎㅎ 본토 그대로의 치즈케이크라서 세상 고소했어요 치즈케이크 너무 맛있게 먹어서 하나 포장해서 집 가서 커피랑 아침에 먹고 싶어서 포장 가능 한지 물어봤더니 당연히 된다고 해서 바로 하나 포장해서 집 와서 아침에 먹었어요 ㅎㅎㅎㅎㅎㅎ 신사역 카페 파치노 에스프레소 바 Ver.2 재생 0 좋아요 0  접기/펴기 신사역 카페 파치노 에스프레소 바 Ver.2"
신사역 가로수길 조용한 카페 ‘파치노 에스프레소 바 Ver2’ 감성 커피 한 잔,"안녕하세요 준스 입니다 신사역 가로수길을 갈 일이 근래에 좀 많았는데요 친구와 크림라떼로 분위기도 내고 한적하게 시간도 보냈습니다 너무 유명한 파치노 에스프레소 바 리뷰 시작할게요 제가 다녀온 곳은 ver2로 리뷰 보는데 참고해 주세요 파치노 에스프레소 바 Ver.2 위치: 서울시 강남구 강남대로162길 40 2층 운영시간: 매일 12시-21시 연락처: 0507-1450-4453 단체 이용 가능, 포장, 무선 인터넷 50m © NAVER Corp. 파치노 에스프레소 바 Ver.2 서울특별시 강남구 강남대로162길 40 2층 위치 가로수길 카페가 찐으로 모여있는 메인 거리는 아니고 살짝 들어와야 합니다 신사역 기준으로 약 7분 정도 걸어야 하니 여유를 갖고 주변을 걸으면서 방문하는 걸 추천합니다 그리고 파치노 에스프레소 바 버전 1과 바로 양옆을 두고 있습니다 다른 포스팅도 보시고 조금 더 가보고 싶은 파치노 에스프레소 바로 방문하길 바랍니다 전 2층에서 가로수길 감성을 느낄 수 있어 ver2로 선택했습니다 내부 입구부터 커다란 알파치노의 포스터가 보입니다 파치노가 무슨 뜻일까 했지만 아무리 찾아도 영화배우 밖에 안 뜹니다 파치노는 알았을까요 신사역 커피 맛집에 메인을 장식했을지! 포스터 쪽으로 푹신한 좌석이 준비되어 있습니다 분위기를 느낄 수 있으니 이 자리를 꼭 추천드립니다 가로수길 조용한 카페로 여유를 즐기는 분들이 꽤 있었습니다 전체적으로 조명과 우드 감성의 테이블들이 고급스러움을 더해줘서 여유 즐기기에도 좋습니다 (창가 자리는 꽤 얻기 어렵습니다 사람들은 모두 창가를 원하기 때문이죠) 에스프레소 바임에도 불구하고 좌석들이 많습니다 가로수길 카페는 늘 사람들이 붐비기 때문에 전략을 잘 세운 것 같기도 합니다 두 명이 앉을 수 있는 좌석이 주를 이루지만 4명이 앉을 수 있는 자리도 있으니 일행 많아도 한 번 방문해 보시길 바랍니다 메뉴 커피와 위스키를 같이 판매하는 파치노 에스프레소 바에요 대낮이라 위스키를 먹을 순 없어서 커피를 주문했습니다 파치노 에스프레소 바는 크림 라떼가 시그니처입니다 버터스카치 사케라또 아이스 아메리카노 파치노 치즈케이크-더블치즈 버터스카치는 저희가 아는 스카치 사탕 맛 맞습니다 달달함 극대치니 꼭꼭 먹어보세요 라떼와 커피 그리고 케이크 즉석에서 만드는 것을 바라볼 수 있습니다 특히나 가로수길 조용한 카페라 만들어지는 소리를 듣고 있으니 그마저도 힐링이 되네요 주문한 커피와 치즈 케이크가 준비되었습니다 파치노 에스프레소가 영어로 큼직하게 적혀있어 감성 한가득입니다 그럼 하나하나 먹어볼게요 모두가 원했던 그 감성 맞습니다 컵에 적힌 글자가 이렇게 예쁘다니 계속 보고 싶어지네요! 양은 톨 사이즈 정도로 많지는 않지만 잘 갈린 얼음과 거품이 먹음직스러워 보여요 한입 먹으면 정말 저희가 아는 스카치 사탕의 맛이 퍼지면서 시원함이 맴돕니다 크림이 부드러워서 잘 넘어가기도 하고 너무 진하지도 않아서 부담스럽지 않습니다 가로수길 카페에서도 크림라떼로 유명한 이유가 있었네요 (아메리카노는 평범해서 패스할게요) 파치노 에스프레소 바에서 크림라떼 외 꼭 먹어봐야 하는 케이크입니다 식빵 한 조각 같이 보이지만 사실 저 안에 모든 게 크림입니다 꾸덕꾸덕한 크림치즈가 가득 찼어요!! 포크로 조금씩 떠서 먹어도 됩니다 입안에서 사르르 녹아서 그런지 치즈의 향을 온전히 느낄 수 있었어요 단짠단짠의 정석이라고나 할까요? 신사역 커피 마시러 왔다가 크림치즈 케이크에 반해버릴 맛입니다 포즈를 잡아보는데 생각보다 안되네요 친구의 코칭이 들어가도 어색한 건 어쩔 수 없나 봐요 어쨌든 이렇게 인생 샷도 찍을 수 있는 가로수길 카페 파치노 에스프레소 바입니다 에스프레소 좋아하는 분들은 잔도 구매할 수 있습니다 가격대도 높지 않아 하나씩 수집하는 분들에겐 안성맞춤이에요 신사역에는 이런 아기자기한 소품들이 많아 구경하기 좋습니다 휴가에 열심히 즐겨본 가로수길 조용한 카페 파치노 에스프레소 바 ver2 한적하면서도 감성을 느끼기에 충분하니 가로수길 방문한다면 추천드리고 싶어요"
신사 가로수길 카페ㅣ파치노 에스프레소 바 Ver.2 · 에스프레소 전문점인데 이제 글루텐프리 치즈케이크를 곁들인....,"제목이 세상 길어져버렷. ㅋㅋㅋㅋㅋㅋㅋㅋㅋㅋㅋㅋㅋㅋㅋㅋㅋㅋ 오늘 일이 있어 신사동에 갔는데 그냥 올 수가 있나! 멋드러진 카페는 한군데 가봐야지... 사실 오늘 #누데이크신사 오픈날이라 거길 갈까 했는데... 줄이... 줄이..........ㅠㅠㅠ 아깝다리 오늘 뭐 이벤트도 하던데..... 📍파치노 에스프레소 바 Ver.2 Pacino espresso Ver.2 #가로수길카페 #신사역카페 #신사가로수길카페 #신사동에스프레소 #신사카페맛집 #가로수길카페맛집 #파치노에스프레소바 #파치노에스프레소바2호점 하필 파치노에스프레소바 가려면 어쩔수 없이 여길 지나가야함ㅋㅋㅋ 줄이 이쪽만 있는게 아니었삼33 오픈날 치고는 금요일이라 그런가 사람이 적긴 했는데.... 혼자라 괜히 쭈구리 돼가지거..... 패스.... 분하다......후... 사실 파치노에스프레소바는 1호점이 유명한데 2호점하고는 정말 바~~~로 마주보고 있다. 서로 완전히 잘 보이는 자리에 있음 ㅎㅎ 난 인테리어가 멋드러진 2호점으로 갔다. 인테리어 진짜 멋지당 아니 근데 평일 낮시간이었는데도 사람 왜케 많은지.. 혼자 쭈굴쭈굴 입장함 ㅠㅠㅠ 사람 없을줄 알고 왔는데 완전 많고 사람이 계~~속 들어온다. 그래도 다행히 창가쪽 자리가 비어 호다닥 자리맡고 주문하러 고고! 에스프레소 전문점이라... 에스프레소를 마실까 했지만 치즈케이크를 필수로 주문할거기 때문에.. 결국 고민끝에 아이스아메리카노로 ㅎㅎ 그나저나 치즈케이크 글루텐프리라니!! 다이어터는 행벅합니다🩷 미리.. 주문할거 생각하고 와서 걍 뭐 볼새도 없이 바로 주문 ㅎㅎ 주문한 메뉴☕️ 더블치즈케이크 6.5 아이스아메리카노 5.5 주문하는곳이 진짜 멋지다. 크으~~~~~ 근데 사람이 넘 많아서 제대로 못찍었쟈나ㅠㅠ 너무 슬프쟈나~~~~ ㅋ ㅑ 진짜 멋지다. 여기 주문하는 곳과 픽업하는 곳이 다른데 걍 말로 불러주시니까 잘 듣고 있어야 함. 여기 시가렛 모양의 휘낭시에도 많이들 먹던데 치즈케이크가 있으니... 이건 포기! 그래도 창가가 비어있어서 다행있쟈나 >< 건너편에 바로 보이는 1호점과 아우어 베이커리🥐🥖 역시나 1호점에도 사람이 계~~속 들어가더라는. 저기 만석이라 다들 2호점으로 오는데 2호점도 사람 많아서 그냥 나가는 사람들 꽤 있었음 ㄷㄷ 꺄아~~~ 운동하고 와서 목 진짜 말랐는데 시원한 아아와 글루텐프리 치즈케이크라니 아이스아메리카노는 산미가 있는 원두! 근데 막 셔서 맛없는 산미 아니고 적당해서 오히려 완전 상쾌한 느낌이라 맛있게 잘 마셨다. 근데 컵이 아랫부분이 넓어서 운동하고 팔이 호달달달 거려서 꽉 잡느라 힘들었지모야.ㅎ.... #글루텐프리치즈케이크 #글루텐프리베이커리 치즈케이크 맛집... 역시... 사진으로만 봐도 먹고싶게 생겼더라니.. 어떻게 이게 no버터, no밀가루일까. 바닐라빈도 엄청 들어갔는지 많이 씹히고 완전 크리미크리미~~~ 빵의 느낌없이 크림을 떠먹는 느낌이랄까. 이거슨 아아와 찰떡궁합✨ 사진은 왜케 더러워보이쥬... 이렇게 걍 크림덩어리라고 봐도 된다. 근데 난 너무 맛있게 먹었음 >< 다이어트 중엔 안먹는게 당연히 좋겠지만 디저트 포기모태!!!!!!!! 혼자 핑계고 보면서 히죽거리면서 디저트타임을 즐겼다. 너무 좋은거~~~~~ 근데 넓지 않은 공간에 사람이 많으니까 혼자 온 나는 맴이 편치 않았달까.. (물론 아무도 뭐라 안함. 대문자 I라 그래....) 곳곳에 이런 디테일이 숨겨져있었네. 인테리어맛집이다 여기. 케이크랑 커피 호다닥 먹고 빠지기💫 여기 인테리어도 멋있고 치즈케이크&커피 다 맛있어서 나중에도 방문할 의사 완전 있음! 나중에 와서는 에스프레소를 마셔봐야겠다. 신사 가로수길에서 맛있는 커피 먹고싶으면 파치노 에스프레소바 추천추천🧡 50m © NAVER Corp. 파치노 에스프레소 바 Ver.2 서울특별시 강남구 강남대로162길 40 2층"
