title,content
희희로드 / 서울 이태원 한남동 맛집 팻캣 그랜드하얏트서울갤러리 그랜드하얏트서울델리 파이프그라운드 네키드윙즈 더테라스,"서울 2탄은 바로바로 이태원 한남동 사실 이날은 그랜드하얏트서울 호캉스가 예정에 있었어용 그래서 배달 포장을 다해온거가 많지만 그래두 이태원 한남 맛집들 호텔 내부 좋은곳들 소개 많이 해드릴게용 50m © NAVER Corp. 팻캣 서울특별시 용산구 신흥로 28 먼저 너무 맛있었던 샌드위치!! #팻캣 지인이 배달시켰는데 먼저 가야해서 가지고 가라고 해서 갖구왔는데 이런 출출해서 먹었더니 쫀맛탱 담백하니 깔끔하니 너무 맛있더라구용 검색해보니 샌드위치 맛집이지 뭐에용 다음에는 가서 다른것도 먹어보려구용 50m © NAVER Corp. 그랜드하얏트서울 델리 서울특별시 용산구 소월로 322 그랜드하얏트서울 L층 예약 헤헤 이제 그랜드하얏트서울 내부에 있는 델리 제일 떨렸던곳 빵이랑 디저트 사랑하는 사람으로서 지나칠수없는곳이지 않나요? 전국의 빵순이들아 여기 케이크 너무 맛있어 꼭 와보세용!! 와인도 종류가 많고 가격도 합리적이었던것같아용 저렴이부터 고렴이까지 그리고 투숙객은 델리 10%할인 어예오예 (일부제외) 이거는 다음날 아침 가득가득채워져있는 델리의 모습이고 우리가 갔을때는 하나하나가 간절했던 다 텅텅 비어있을때라ㅠㅠ 우리는 걍 통크게 홀케이크로 가즈아~~~ 씐나 소리질러~~ 홀케이크 포장해서 파리투나잇 300m © NAVER Corp. 파이프그라운드 서울특별시 용산구 한남대로27길 66 지하1층 예약 네키드윙즈 서울특별시 용산구 녹사평대로 174-11 흐엉 그리고 넘 맛있었던 #옥수수피자 #파이프그라운드 랑 #네키드윙즈 닭봉이랑 윙 소스 찹찹 소스를 여러개 선택할수있어서 너무 좋은곳 옥수수피자는 너무 맛있었어용 강추드려용 달달구리하면서 살짝 매콤한맛도 나고 옥수수알갱이 통으로 들어있는 씹히는 맛도 너무 좋고 위에 감자칩 뿌려져있는게 히든카드 냐미냐미 지금 또 먹고싶네용 음,,, 화이트라구는 ㅜ 엑스 실패 내가 광주에서 먹은 화이트라구 맛이 아니야 친구는 기내식맛이라고 이거는 비추드려용!! 하지만 피자는 너무 인정 맛집인정 쫀맛탱 50m © NAVER Corp. 그랜드하얏트서울 갤러리 서울특별시 용산구 소월로 322 그랜드하얏트서울 로비1층 예약 룸으로 가려다가 호텔왔으니 라운지도 즐겨보자 밤이 길다~~~ #그랜드하얏트서울라운지 #그랜드하얏트서울갤러리 갤러리 라운지에서 칵테일 한잔씩 하기로 했어용 >_< 여기는 카페가 좋다고 했는데 저는 뭔가 저녁에가 더 좋은것 같아용 칵테일 한잔씩 하고 재즈라이브도 들으면서 너무 좋았어용 나중에 짝꿍이랑 한달 마무리를 이렇게 호텔라운지서 칵테일 한잔하면서 하는것두 너무 좋을것같다고 잠시 미래를 상상했답니당 상상은 자유~~~ 꺅 내 친구 생일 축하해 친구 생일이기도 하니 홀케이크로 가봅니당 #계절베리케이크 였나? 하얏트 델리 케이크 맛집이었습니당 비주얼도 맛도 합격 넘나리 인생 케이크 딸기양이랑 단면좀 봐보세용!!!! 난리나용 진짜 진짜 크림도 너무 맛있고 시트도 촉촉 그자체 딸기랑 크림이랑 시트랑 잘 어울리는 조화 진짜 둘이서 다 먹을뻔 자제하고 멈추고 그 다음날 한강가서 또 먹었어용 ㅋㅋㅋㅋㅋㅋㅋㅋㅋㅋㅋㅋㅋㅋ 살치조던가 이름 까먹었는데 델리에서 와인이랑 같이 먹으려고 사온건데 짜지도 않고 너무 맛있었어용 다 너무 성공적 >_< 델리 체고 케이크야 잊지못할거야 또 한번 데리러 갈게 ~~~~~~ 50m © NAVER Corp. 그랜드하얏트서울 테라스 서울특별시 용산구 소월로 322 그랜드 하얏트 서울 호텔 예약 다음날 아침 호캉스의 꽃은 조식이랬던가 #그랜드하얏트서울조식 #더테라스조식 하지만 돼지런한 어제를 보낸 나의 위는 받아들일 준비가 안되어있었어용 ㅠㅠㅠ 하지만 여기 팬케이크 맛집 그리고 저 에그포카치아가 넘 맛있어용 그리고 미니베이글도 너무 귀엽고 크림치즈 맛집이었어용 하지만 나의 배야 그때 왜그랬니 흐엉 지금 보니 그리운 조식들 이렇게 저의 순간같은 서울 나들이는 안농 한번들 가보세용 믿가믿먹 희희로드 그럼안농 #서울맛집 #서울카페 #서울라운지 #서울호텔 #그랜드하얏트서울 #그랜드하얏트서울갤러리 #그랜드하얏트서울라운지 #호캉스 #이태원맛집 #이태원카페 #한남동맛집 #한남동카페 #그랜드하얏트서울델리 #하얏트델리 #인생케이크 #칵테일 #희희로드 #희희로그 #희캉스"
[용산구/한남동] 그랜드하얏트서울갤러리 : 뷰 좋은 호텔라운지 카페,"망고빙수🥭를 먹기 위해 방문했던 용산 그랜드하얏트 호텔 로비에 위치한 #그랜드하얏트서울갤러리 입니다 서울 용산구 소월로 322 그랜드하얏트서울 로비1층 영업시간 09:00 - 21:00 📞 02-797-1234 🅿️ 발렛 가능 그랜드하얏트서울 갤러리 서울특별시 용산구 소월로 322 그랜드하얏트서울 로비1층 예약 이 날 호캉스를 위해서 하얏트에 간건데 체크인까지 시간이 남아서 방문했었어요 웨이팅은 없이 바로 입장 가능했습니다:) 식사로 방문하면 창가쪽으로 자리를 안내하더라구요~ 저는 카페로 방문해서 입구쪽으로 안내받았어요 저녁에는 로비에서 라이브공연도 하더라구요~ 분위기가 진짜 좋았어서 저녁에 가는 것도 추천해요 #그랜드하얏트서울갤러리메뉴 #그랜드하얏트서울갤러리 가격 망고빙수 하나를 주문해요 그랜드하얏트는 트랜디하진 않지만 클래식한 호텔 분위기가 주는 멋스러움이 있어요 짜란 망고빙수 등장⭐️ 밀크아이스크림, 우유푸딩, 망고소스, 망고샤벳, 라임과 펄이 올라간 다채로운 빙수였어요 위에 올라간 푸딩이 부드러워서 상콤한 라임과 조화가 잘 맞았어요:) 망고샤베트아이스크림도 꽂아서?ㅋㅋㅋ 사진 많이 찍으시더라구요! 팥을 원래 좋아하진 않는데~ 여기에 함께 나온 팥은 포실포실 맛있는 팥이라 곁들여 먹으니 맛있었어요 먹다가 중간에 꽂아서 비주얼이 볼품없어요ㅋㅋㅋㅋ🤣 처음 나왔을때 이쁘게 세팅해서 사진 필수로 찍으세요!! 총평 브런치, 카페, 식사, 간단한 칵테일까지! 다양한 메뉴가 있어 방문하기에 좋은 분위기의 장소에요! 빙수자체의 맛보다는 좋은 장소에서 디저트 먹는다~ 생각하고 방문하시면 너무 좋을 것 같네요:) 또 서버분들이 엄청 노련해보이셔서 더욱 편안한 시간을 보냈어요 하얏트 방문하신다면 갤러리카페 추천해요 #호텔망고빙수 #하얏트호텔카페 #하얏트호텔빙수 #하얏트호텔망고빙수 #그랜드하얏트호텔카페 #그랜드하얏트서울호텔카페 50m © NAVER Corp. 그랜드하얏트서울 갤러리 서울특별시 용산구 소월로 322 그랜드하얏트서울 로비1층 예약"
[한남동] 그랜드하얏트서울 로비라운지 갤러리 🌟🌟🌟,"아니 근데 여기 이름 언제부터 갤러리였음? 그냥 로비 라운지 바 뭐 이런거 아니였음? 예전부터 종종 왔고 최근에도 왔었는데 충격적인 사실 하나 알고 간다... 충격적인 사실만큼이나 충격적인 화질로 찍힌 사진. 고풍스러운 인테리어와 통창이 멋들어지게 어울리는 로비 라운지 바 아니 갤러리... 여러 호텔의 라운지를 가 봤지만, 그랜드 하얏트 서울의 아늑하면서도 웅장한(이게 무슨 패러독스) 라운지는 따라갈 자가 없는 것 같다. 예스러운 느낌이 있지만 전혀 후지지(?) 않은 느낌이랄까. 애초부터 이 라운지를 중점으로 1층을 설비한 듯, 1층 분위기는 이 라운지가 다 가져간다. 희한하게 음악이 있을 때는 웨이팅이 있다가, 음악이 끊기면 또 웨이팅이 없다. 물론 금토일 이럴 때는 웨이팅 기본 30분이라고 생각하고 오시는 것이 정신 건강에 좋다. [한남동] 그랜드하얏트서울 로비라운지 갤러리 🌟🌟🌟 (1) 재생 9 좋아요 0  접기/펴기 [한남동] 그랜드하얏트서울 로비라운지 갤러리 🌟🌟🌟 (1) 우리가 그랬듯 많은 사람들이 음악에 이끌려서 오는 것 같고, 또 우리가 그랬듯 앞에서 한창 공연 중이실 때에는 떠날 마음이 잘 안 드는 것 같다. (좌) 쌍화차(21,000) / (상) 생강차(21,000) 차를 시키니 유과가 곁들여져 나온다. 재즈에 웬 전통차냐 싶지만, 안 그래도 방쇼 마시고 싶었는데 스테이크하우스에도 없어, 아이스링크에도 없어, 로비 라운지 아니 갤러리에도 안 판대서, 감기 걸린 자들로서 최선의 선택이었다. 그런데 약국에 파는 쌍화탕은 많이 마셔 봤어도 쌍화차는 처음 마셔 보는데, 원래 이렇게 밍밍한 것..? 꿀을 넣어도 밍밍하길래 죄다 부어 버리니까 또 꿀맛이 너무 강해져서 이상했다. 쌍화차도 꿀도 몸에 좋겠지 하며 억지로 마셨다. 쌍화탕 압승ㅠㅠ [한남동] 그랜드하얏트서울 로비라운지 갤러리 🌟🌟🌟 (2) 재생 21 좋아요 0  접기/펴기 [한남동] 그랜드하얏트서울 로비라운지 갤러리 🌟🌟🌟 (2) Just the Two of Us 노래가 나와서 괜시리 반가웠다. 외국 노래지만 학창 시절에 어반 자카파 노래로 처음 접했어서, 또 그때 기억이 몽글몽글... (기억아 멈춰) #그랜드하얏트서울 #그랜드하얏트서울갤러리 #그랜드하얏트서울로비라운지 #남산하얏트 #남산하얏트갤러리 #남산하얏트로비라운지 #하얏트 #하얏트갤러리 #하얏트로비라운지"
[한남동/그랜드하얏트서울] 그랜드하얏트 호텔 갤러리 라운지 애프터눈티 후기 (지미추 콜라보),"롯데 프레스티지 카드 혜택으로 호텔 애프터눈티 바우처 제공이 있어 그랜드 하얏트 서울 호텔의 갤러리를 방문하였다. 다른 선택지는 여의도 콘래드 호텔의 37그릴앤바 애프터눈티가 있었다. 전에 가봤을 때 뷰와 분위기가 좋았던 기억이 있어 고민했으나 그랜드하얏트 갤러리에서 지미추 콜라보 애프터눈티를 제공하고 있다고 해서 하얏트로 픽! 👈 설레는 남산타워 직접 가지는 않지만 자주 본다 서울 어디서나 보이는 랜드마크 연말 분위기가 물씬 나는 호텔 로비 체크인 시간 즈음에 갔더니 체크인 하는 사람도 바글바글 갤러리에도 대기하는 사람들이 바글바글 포인세티아 생화인가?? 자세히 못봤다 ㅠ 갤러리는 통창이 참 예쁘다. 남산 중턱에 위치한 호텔이라 서울 시내가 한 눈에 내려다보이는 뷰! 남편과 이런 꿀자리에 신라호텔이 들어왔어야 하는데 외국계 호텔이 들어와 있는게 안타깝다며 궁시렁 궁시렁 ㅋㅋ 창가 자리가 멋진 뷰를 즐길 수 있어 좋긴 하지만 햇빛이 강해서 좀 더워보였다 사진속 저 분은 아실까 내가 인생샷을 찍어드렸다는걸... 예뽀 지미추 콜라보라 지미추 구두와 백이 곳곳에 있었다 블링블링 요런 일러스트도 줌 예뻐서 데려옴 우리집 냉장고로 가랏 핑거푸드를 먹을 수 있는 세미뷔페가 준비되어있다. 메뉴와 맛이 꽤 괜찮다. 좋아하는 치즈류가 많아서 샴페인 땡김 🤧 헿 뷔페 외에 미니 디저트 박스와 스콘, 음료가 제공된다. 스콘이 따뜻하고 너~무 맛있었음! 지미추 컬렉션이라 구두 모양의 쿠키가 있다. 귀여워 솔직히 뷔페랑 스콘을 먹고 나면 너무 물려서 쿠키와 케이크에는 손이 안감 ㅠ 거의 다 남김 너무 아까워서 ""싸달라고 해도 될까?"" 라고 남편에게 물었으나 그가 제발 그러지 말라고 함....ㅎㅎ 아이스크림도 마음껏 골라 먹을 수 있다 가격이 인당 50000원이라니 이정도면 가성비가 넘침 지금껏 갔던 애프터눈티 중 가장 만족스러웠다. 트리 앞에서 한 컷 🥰 그러나 너무 달고 느끼해서 저녁에 얼큰한게 땡기는게 함정... 20m © NAVER Corp. 그랜드 하얏트 서울 서울특별시 용산구 소월로 322 예약 그랜드하얏트서울 갤러리 서울특별시 용산구 소월로 322 그랜드하얏트서울 로비1층 #그랜드하얏트서울 #애프터눈티 #호텔애프터눈티 #기념일 #기념일에갈만한곳 #호텔뷔페 #갤러리 #한남동 #한남동맛집"
[한남동카페] 그랜드하얏트서울 갤러리 리뷰,"다녀온 지는 조금 되었지만 한남동에서 주차도 잘 되고 분위기도 너무 좋은 카페 추천드립니다. 50m © NAVER Corp. 그랜드하얏트서울 갤러리 서울특별시 용산구 소월로 322 그랜드하얏트서울 로비1층 예약 그랜드하얏트 서울 로비 1층에 위치해 있어서 쉽게 찾을 수 있고 저 멀리 한강뷰를 볼 수 있습니다. 저녁에는 라이브공연을 많이 해서 사람들이 많고 대기도 조금 해야 합니다. 저는 친구를 기다리느라 저녁에 잠시 방문했고 차를 가져갔기 때문에 위스키는 마시지 못했습니다. 아메리카노 한 잔에 15000원 아아주 비싼 것 같지만 뷰와 주차장 이용을 따지면 저는 만족스러웠습니다. 근처 한남동 카페들은 아메리카노 만원이면서 주차도 힘들고 오래 이용하면 눈치도 주기 때문입니다. 인테리어, 조명 다 너무 고급스럽습니다. 커피를 주문하면 작은 쿠키도 주시는데 이것도 너무 맛있습니다. 그 날 보던 책에서 나온 페이지와 한 컷 만약 한남동 갔는데 : 발렛 맡기기 싫고 분위기도 느끼고 싶고 하는 날이면 추천드립니다."
"한남동 맛집 (오아시스, 닷츠, 콘하스, 그랜드하얏트서울 갤러리)","하나둘씩 청첩장 모임을 하고 있는 요즘 💌 어쩌다 보니(?) 주로 한남동에 있는 레스토랑들을 자주 가게 되었다 한남동 오아시스 Oasis 오아시스 한남점 서울특별시 용산구 이태원로45길 30 한남동 터줏대감 브런치 맛집으로 자리 잡은 오아시스! 특별할 거 없는 메뉴들이지만 하나하나 다 너무 맛난 찐 브런치 맛집 💛 분위기도 아늑하니 너무 좋다 ☀️ 샐몬에그베네딕트 + 햄에그베네딕트 베리프렌치토스트 + 풀잉글리쉬브렉퍼스트 메뉴 하나하나 거를 것 없이 맛있게 먹을 수 있는 곳! 사진 찍기 좋게 예쁘기만 하고 맛은 별로인 브런치 정말 싫어하는데 오아시스는 정말 믿고 먹는 맛 ㅎㅎ 콘하스 한남 콘하스 한남점 서울특별시 용산구 이태원로55나길 22 콘하스 한남점 오아시스와 도보 30초 거리에 있는 콘하스 한남점! ㅋㅋ 풀 인테리어 덕에 여름이 제격이지만 채광이 잘 들어와 분위기는 항상 좋은 듯?ㅎㅎ 이렇게 보니 우리 아무도 커피 안 마셨네?ㅎㅎ 케익도 괜찮고 무난했던 콘하스 (다만 시간제한 2시간이 있어 긴 긴 수다를 나누기엔 무리!ㅎㅎ) 닷츠 DOTZ DOTZ 서울특별시 용산구 이태원로55나길 6 오아시스와 함께 또 하나의 한남동 믿먹 닷츠 ㅠㅠ 런치 디너 모두 맛있는 곳! 디너에는 가츠 샌드가 없고 바오번에 나오는 가츠바오번이 있는데 최근에 단품이 없어지고 세트로만 나오는 가츠바오번 퀄리티가 조금 부실해져 실망했는데 런치는 여전히 괜찮더라는 ㅎㅎ 김치볶음밥 + 가츠산도 + 시추안핫치킨 +마파라구소스에그누들 + 마라피클 메뉴 하나하나 정말 다 맛있다! 하지만 간이 강한 편이라 싱겁게 먹는 분들은 별로일 수도 ㅎㅎ 프라운 토스트(멘보샤) 후식으로 홍콩 토스트와 커피까지 야무지게! ☕️ 그랜드하얏트서울 갤러리 그랜드하얏트서울 갤러리 서울특별시 용산구 소월로 322 그랜드하얏트서울 로비1층 예약 개인적으로 느지막하니 수다 떨기 너무 괜찮은 하얏트 갤러리! 애프터눈티로 이용 가능한 뷔페 형식도 너무 괜찮지만 이날은 밥을 먹고 간 터라 차만 마시기로! 다즐링, 잉글리쉬브렉퍼스트 티와 케일 건강 주스 3명이서 가도 티 시킨 2명만 쿠키 주는 야박한 하얏트 ㅠㅎ ㅋㅋㅋㅋㅋㅋ 그래도 친구들과 라이브 음악 들으며 🎼 수다 떨기 좋은 곳 믿먹이 많은 한남동 추천 추천 🤍"
[이태원/한남동] 그랜드하얏트서울 갤러리(4.1/5) | 주말 | 딸기 애프터눈티 2022,"@grandhyattseoul님이 Instagram을 사용 중입니다 • 5.7만명이 @grandhyattseoul님의 계정을 팔로우합니다 팔로워 5.7만명, 팔로잉 1,493명, 게시물 964개 - 그랜드 하얏트 서울 호텔(@grandhyattseoul)님의 Instagram 사진 및 동영상 보기 www.instagram.com 📍 위치: 서울특별시 용산구 소월로 322 로비 📍 영업시간: 13:30~15:00 / 15:30~17:00 | 휴무 없음 ⭐⭐⭐⭐ 재방문의사 O 📌주차: 호텔 내 주차(2시간무료), 발렛파킹 📌예약: 예약가능 | 전화(02-797-1234), 네이버예약 그랜드하얏트서울 갤러리 : 네이버 방문자리뷰 1,179 · 블로그리뷰 377 naver.me 발렌타인데이 선물로 준비한 딸기 애프터눈티(50.0)! 토요일 1부 1시 30분 타임에 다녀왔다. 사진도 찍고 여유롭게 있으려고 30분 정도 일찍 왔는데, 정말 좋은 선택이었음. 딸기젤리 얼그레이 산딸기 크림 케이크, 딸기 치즈 무스 케이크, 발로나 딸기 크림 타르트, 딸기 라즈베리 봉봉 한 테이블에 하나씩 서브되는 트레이. 우선 비주얼이 너무 예쁘다. 맛도 고급스러움. 특히 맨 왼쪽과 세번째 디저트가 가장 맛있었다. 연어알이 올라간 연어 베이글 아는 맛이지만 너무 잘먹음. 아란치니 안에는 새우가 들어있어 꽤 알차다. 푸아그라 타르트랑 브리오슈는 그냥 그랬고, 사워도우 참깨칩이 의외의 복병. 딸기젤리는 맛없어요.. 딸기 레밍턴은 딸기잼이 샌드되어있어 산뜻하고 맛있음! 브레이징한 돼지고기 롤 맛있어요. 남자친구가 꼽은 베스트 닭간 에클레어는 임팩트 없었고, 연어테린도 넘 흐믈해서 쏘쏘. 샤퀴테리랑 치즈(브리, 트러플 고다, 라그레스)는 진짜 많이 먹음! ++빵에 샤퀴테리+치즈+견과류+잼 올려서 먹어보세요.. 최고.. 스콘 맛있음. 레몬커드랑 클로티드 크림이랑 같이 먹어야함.. 롤리팝 너무 달아서 별로 바닐라쿠키는 괜찮다. 초코칩 쿠키 초코칩이 진짜 많이 박혀있어서 맛있게 먹음! 생딸기 사이즈는 작은데 달다 계속 리필해서 한팩은 먹었습니다.. 스카치에그 너무 맛있음.. 이날 베스트 매그넘바 2종은 별로.. 두꺼운 화이트초콜릿 커버는 맛있는데, 안에 너무 상큼한 셔벗 재질이라..NOPE.. PHOTO DUMP.. 그랜드하얏트 앺터눈티 꿀팁. - 30분 정도 일찍 와서 여유롭게 구경 + 사진찍기 - 애프터눈티 메인트레이 먼저 맛보기 (뷔페만 먹다보면 배불러서 충분히 즐기기 어려움) - 치즈+샤퀴테리+견과류+잼+빵 조합 꼭. - 커피, 차 하나씩 시키기 (리필 시 커피는 커피로만, 차는 차로만 가능) - 주말엔 1시 30분 타임 추천. (체크인 인파 너무 많아 로비 복잡, 앺터눈티 입장줄도 길더라구요) 주말 오후 평온하고 여유롭게 즐기기 딱 좋았다. 피아노&바이올린 라이브 연주도 있고, 천고도 높고 테이블 간격도 넓고! 만족! 50m © NAVER Corp. 그랜드하얏트서울 갤러리 서울특별시 용산구 소월로 322 그랜드하얏트서울 로비1층 예약"
한남동 그랜드하얏트서울 로비라운지 갤러리:카페 메뉴&가격,"안녕하세요 :) 오늘은 한남동 이태원에 위치한 그랜드하얏트 서울 로비라운지 후기를 써보려고 해요 유독 날씨도 좋은 주말을 맞이하여 호캉스를 즐기는 손님들이 정말 많았던 날~ 그랜드하얏트 서울 로비라운지 갤러리는 높은 천고와 고풍스러운 기둥, 넓디 넓은 창 덕분에 무척 고급스러우면서도 시원시원한 분위기가 인상적이랍니다. 특히 로비엔 예술 작품들도 많이 걸려있어서 갤러리라는 이름처럼 정말이지 미술관에 들어온 느낌이 들기도 했어요. 이날은 주말이라 가족 단위 손님들이 정말 많이보였어요 :) 참고로 영업시간은 일-목 오전9시부터 11시반, 피크인 금토는 9시에서 새벽1시까지 운영하기에 낮부터 밤까지 멋진 서울 도심의 뷰를 감상하기에 좋은 장소랍니다! 따로 조명이 필요없을 정도로 낮에는 무척 넓은 통유리창에서부터 쏟아지는 채광 덕분에 내부가 환했고 전체적으로 클래식한 감성이 느껴지는 분위기였어요. 중앙 무대에서는 피아노와 바이올린 연주를 해주셔서 한층 차분하고 고급진 분위기를 연출해준답니다 저녁에는 라이브 밴드 공연도 이루어진다고 해요 :) 로비라운지의 매력은 뭐니뭐니해도 통유리창 넘어 보이는 파노라믹한 도심뷰! 미세먼지가 없어서 이 날 뷰도 꽤 깨끗하고 청명하게 잘 보였어요 ~ 메뉴를 소개할게요. 우선 점심엔 애프터눈티 뷔페 저녁엔 타파스 뷔페가 유명한 곳이죠. 1인당 주말기준 5만원으로 가격은 비싼 편이지만 나중에 한번 꼭 애프터눈티는 먹어보고 싶었어요 :D 그외 음료류는 커피, 쥬스, 탄산 및 차류 등이 있었는데 대부분 만원 중후반대로 2만원 내에서 베버리지는 주문할 수 있어요 최근엔 여름을 맞아 싱그러운 감성을 담은 그린 애프터눈티 뷔페와 상콤한 갤러리 빙수를 계절 특별메뉴로 내세우고 있으니 참고하세요! 주문한 메뉴는 아이리쉬 커피와 비엔나 커피! 둘 다 가격은 만구천원 되시겠습니당~ 일단 한눈에 보아도 포근하고 부드러워 보이는 비주얼이었어요. 특히 아이리쉬 커피는 보통 다른 곳에서 맛보기 힘든 메뉴라 주문해보았는데 아이리시 위스키의 쌉싸름한 맛이 생각보다는 더 진하게 느껴졌답니다 그래도 잔 위에 묻은 설탕이 어느정도 그 독하고 쓴 맛을 소거해주긴 해요~! 커피를 주문하면 옆에 자그마한 귀요미 머핀도 함께 나와요! 당연히 coffee와 무척 잘 어울리지만 조금 사이즈가 작은점이 아쉽 ㅠ 비엔나커피는 상상그대로 크림과 스팀밀크의 부드러움이 느껴지지만 휘핑크림 덕분에 살짝은 느끼함이 강하게 느껴지는 면도 있었어요 아무튼 이 곳은 맛보다는 멋진 파노라믹뷰와 특유의 클래식하고 예술적인 분위기를 느끼러 오는 곳이니 만큼 편안하고 즐거운 휴식을 취하다 왔답니당 ♡ 지도 첨부할게요 50m © NAVER Corp. 그랜드 하얏트 서울 서울특별시 용산구 소월로 322 예약 직접 사먹은 후기"
