title,content
"[한남동/이태원 비건 카페 : 키에리] 노버터 케이크 맛집 ! (비건 X, 이용 조건 필독!)","Kyeri, 키에리 노버터 케이크 디저트 전문점, NOT VEGUN 키에리 서울특별시 용산구 이태원로26길 16-8 안녕하세요! axvy입니다. 이태원/한남동 근처 노버터 케이크 맛집 카페 키에리에 다녀왔어용. 이용조건이 있으니 꼭 확인해주세요! | 스크롤! ☁️ 정보 영업시간: 매일 13:00 - 20:00 위 치: 이태원로 26길 16-8 - 위치는 이태원역에서 가깝고 용산구청에서 한 10분 정도..? 걸어가면 나왔어요! 가는 길에 오르막은 없어서 가는 길이 힘들진 않았답니당 ㅎㅎ 전 용산구청 쪽에서 버스 내려 걸어갔는데 날씨가 좋고 골목도 예뻐서 기분좋게 걸어갔슴니당 🌹 주 차: 별도 주차공간 X 한남동공영주차장 / 한강진역공영주차장 이용 ☁️ 메뉴 - 여기는 지이이인짜 유명한 비건 케이크 맛집이었어요! 단 케이크나 디저트를 별로 안 좋아하는 저도 알고 있었거든요 게다가 메뉴까지 완전 내 취향.. 👾 얼그레이? 하아 최고에요. 도착하니가 친구들이 주문해 놓은 얼그레이 케이크! 도착하기 전에 밥을 먹고 와서 ㅜ 조금만 맛 봤는데 .. 얼그레이 향이 진하고 맛있었음.. 사실 앵간한 얼그레이 케이크 다 좋아하긴 하는데 얼그레이 향 쬐금 곁들이고 단맛만 많이 나는 케이크들.. 정맬 안조와해요 ㅠㅅㅠ(취향) 사진진짜저딴것만 남음 제송합니다 ㅜ 속삭이면서 잘도 얘기함 얘기하다가 스스로 입술 때림 시끄러울까봐 재채기하고 눈치봄 웃기고 재밌었음 생소하지만.. 웃긴 경험 키에리가 지향하는 생소하지만 (좋은) 경험 어쪄면 하고 온 걸지도 어쩄든..! 얼그레이 좋아하시고 말차나 홍차의 향이나 쌉싸름한 맛을 좋아하시면 취향에 맞으실 거 같아요 ☕️ ☁️ 이용 조건 ⭐️ 근데 여기 진짜진짜진짜짖ㄴ자 중요한 점 잇슴.. 바로 조건 사항! 조 건 ・ ・ ・ 1. 카페 입구에서 '벨' 눌러야 입장 가능 2. 조용한 대화 2. 합석 불가 4. 노키즈존 5. 최대 3인까지만 이용가능 (4인- 2인씩 나눠 앉기 불가) 6. 이용 시간 최대 1시간 30분 7. 남은 케이크 포장 불가 (상자구매 후 셀프 포장) 제가 카페에 갔을 때 겪었던 건 바로바로 ""속삭이는 대화"" 그리고 ""합석 금지"" 아니.. 카페에서 합석을 한다고? 라고 생각하실 수 있겠지만 그 합석이 아니고 입장 인원대로만 착석해야하는 거에요! ㅎㅎ 사실 노버터 케이크 맛집인 것만 알고 갔었어요 친구들이 도착했을 때보다 2-30분? 정도 늦게 도착했거든요 원래 만날 예정이 아니었고 급만남이라성.. 친구 한 명이 입장할 때 2명이라고 말하고 입장했고 뒤늦게 와서 같이 앉아서 케이크 먹고 얘기하고 잇눈데 직원분 한 분과 자꾸 눈이 마주쳤슴 왜.. 왜 그러실까 우리 속삭여서 말하고 있는데,, 서로 목소리 도 잘 못 듣고 있눈데 ㅜ 근데 조금 이따 오셔서 '혹시 나중에 오셨나요?'라고 하시길래 그렇다고 하닊가 '저희 카페가 합석이 안 돼서요..' 나진차 그때 머리가 띵했음 어이건모지? '아 .. 그럼 ?' 진짜 몰라서 물어봣어요 진짜로 몰라서 그럼 따로 앉으라는 건가 나가라는 겅가? 근데 계속 저희 카페는 합석이 안된다는 말만 하시더라구여 ㅎ.. 그래서 나왓어요 어차피 속삭이며 이야기 하기 적당한 카페는 아닌 것 같아서 다른 카페로 옮기려고 하기도 했구.. ㅎㅎ 나중에 후기 보니까 이 두 가지 말고도 제약조건이 있더라구요 ☁️ 후기 혼케하기 좋은 곳 - ! 모임장소 또는 친구들과 편안하게 만나기보다 혼자 독서하고 싶으신 분들에게 츄천! 하지만 내부가 안락하거나 깔끔+모던한 스타일은 아니에요! 약간 .. 서양식 주택의 베란다 느낌! 제가 앉은 좌석은 그랬습니당 ㅎ.ㅎ 카페 내부나 시설의 장점보다는 >>노버터 케이크를 먹고 싶다!<< 하시는 분들께 추천드려요. 하지만 카페 내부 분위기나 실내 시설이 시간을 오래 보내기에 적합하지는 않다고 느꼈어요 (제 주관에는요!!) ㅎㅎ 그래서 키에리의 케이크를 경험하고 싶으시다면 혼자 혹은 조용...!!히 (생각보다 더 조용해야해요!) 담소나눌 수 있는 한 분과 같이 가시는 걸 추천드려요 ✨ 끗! #키에리 #맛있는녀석들 #카페추천 #디저트카페 #노버터카페 #용산구청카페 #용산구청 #이태원카페 #이태원디저트카페 #이태원카페추천 #한남동카페 #한남동카페추천 #이태원디저트 #이태원디저트추천 #한남동디저트 #케이크"
"한남동 : 챔프커피, 한나주얼리, 야상해, 키에리","오랜만에 한남동 나들이. #챔프커피 커피 맛집이라는 챔프커피부터 들렀다. 총 3개정도의 작업실이 있고 3형제가 각각 한다고 함. 우리도 나중에 카페 하나씩 하면 좋겄네 ㅎㅎ 원두선택 가능. 되게 아담한 카페였는데 핫플 답게 사람이 많았다. 그래도 역시 자리운은 있어서(?) 바로 좋은 자리 득템. 가게 분위기는 유럽에 있는 동네카페 같았다. 이때는 종강 전 시즌. 얼굴에 왕 뾰루지 났음. 챔프커피 2잔 시켰는데 챔프커피=플랫화이트였다. 한남동 골목길~ 요즘 커피들이 상향 평준화 되서 우와~ 할정도는 아니였지만 이 정도면 굳. 플랫화이트답게 양은 쥐콩이었다. 이 날의 뽀물쓰. 앞머리 자름. 한적한 한남동 오후를 맘껏 즐김. 아유 좋아. 나 숏컷하면 이럴 듯 ?ㅋㅋㅋ 뽀물쓰 앞머리가 꽤나 맘에 들었나 봄. 상의는 유니클로와 질샌더 콜라보 셔츠인데 동생이랑 하나씩 샀음. 핏 굉장히 깔끔, 무난하니 이뻤다. 그렇게 챔프커피 마무리! Feat. 테이크아웃 할 사람들은 앞에 10분정도 주차가능하다고 한다. 선커피 후, 반지 구경하러 #한나주얼리 벌써 해가 졌다. 한나주얼리 유명하다고 해서 와봄. 그리고 결국 ㅋㅋㅋ 반지 쇼핑 각자 반지 2개씩 샀다~ 데일리로, 항상 끼고 다닐 수 있는 패션반지 산다면 추천. 가격도 괜찮고, 디자인도 다양함. 다만 사이즈 없는 건 주문해서 배송으로 받음. #야상해만두 #야상해 딤섬 딤섬맛집 야상해. 여기 별 것 아닌 것 같은데 웨이팅 작렬... ㅎㅎㅎㅎㅎㅎ 딤섬이 땡겨서 갔는데 꽤 기다렸지만 먹고나니 기다린게 아깝지 않았다. 소룡포와 새우만두 그리고 사천소면을 시켰다. 소룡포,, 사실 소룡표와 샤오롱바오의 차이를 잘 모르겠지만, 숟가락에 올려서 젖가락으로 콕 찍어 국물 먼저 호로록하고 그 다음 한입에 얌얌 먹으면 넘 맛. 새우만두. 소룡포도 맛있고 새우만두도 맛있어서 둘다 시키길 추천. 먹다보면 순삭이라 여자 둘이와도 거뜬히 먹을 수 있다. 딤섬 너무 죻아. 사천소면은 마라탕 국수라고 보면 될 듯. 매콤했는데 딤섬이랑 같이 먹기엔 밸런스가 좋았다. 약간의 느끼함을 잡아 줌. 넘 맛있게 먹은 야샹해!!!! 다음에도 또 올 의향 있음. 히히 다음엔 맥주안주 삼아 쭉 먹고 싶다. 그리고 후식으로 다시 카페 2차. #키에리 #kyeri 키에리에 왔다. 여기도 이미 엄청난 핫플이자 맛집. 정말 다양한 케이크를 판다. 말차케이크를 시켰다. 사실 키에리에 대한 정보가 아무것도 없이 갔는데 비건케이크 집이었다... 어쩐지 처음에 한 입먹고 나는 ""맛이 왜이래?"" 했는데 동생은 자기가 추천해서 ㅋㅋㅋㅋ ""이게 진짜 말차잖아~~ ""하다가 점차..ㅋㅋㅋㅋ 확실히 비건 케이크라 우리가 상상하는 케이크로 생각하면 안될 듯. 교대에서 파는 무염빵이 생각났다...그 빵 먹고 우리는 그걸 시체빵이라고 명명했는데 이것도 사실 비슷했다.케이크는 케이큰데 뭔가 빠져있음. but 맛이 희귀했음에도 눈살이 찌푸려지는 맛이라기 보단 그냥 다음에 한번 더 와서 다시 먹어보고 싶긴 했다. 그 점이 특이했음. 그리고 몸에 굉장히 좋을 것 같은 맛... ㅋㅋㅋ 건강 못 잃어... 다음에 와서 또 먹어볼래~~ 커피는 무난. 앞머리 짜르고 회춘+힙 해진 뽀물쓰 이날 이뻐서 사진 많이 찍음. 나와서 외관에서 전체샷 한 컷. 다들 찍고가는 포토존으로 마무리 . 그리고.. 한나 주얼리에서 배송 온 반지들 꺄악>< 이쁘당!!! 추천추천. 넘 재밌던 한남동 나들이 끄읏. 이 날 뽀물이랑 재밌게 놀고 다음 날 바로 또 한남동 갔음 ㅋㅋ 그건 다음 포스팅에 ..."
"한남동, 성수 그리고 여의나루- 서울앵무새/솔솥/키에리","6/18 토요일 설희가 서울 놀러와서 이틀 동안 놀러 다녔당 용산공원 사진 찍어주려구 데꼬감 직원분께 핫플 어디냐고 물어봤더니 바로 알려주셨다 ㅋㅋㅋㅋ히 4월에는 내부 구경이 안됐던거같은데 이제 내부도 볼수있음!!!!!! 좀 더 볼 거리가 많아져서 좋았던 용산공원 네이버지도에 용산공원 검색하면 여러개 나오는데 서빙고역 바로 앞(부분개방)으로 가묜된당~ 한남동 버스타고 한남동 넘어와서 하루필름 찍었당 아침 10시쯤 갔는데 사람이 별로 없어서 좋아씀 ㅎㅅㅎ 11시쯤 밥 뭐먹을지 탐색!!! 항상 점심시간에 먹어보고싶었지만 매일 매일 웨이팅이 길어서 못먹어본 #솔솥 예약하깅 11시쯤 가니깐 대기가 5-6팀 정두 있었당 내부는 생각보다 넓어서 좋았고~~~!! 나는 스테이크, 설희는 도미 그릇에 밥 퍼고 누룽지 불려두면 됨요 청어알젓 + 와사비 + 스테이크고기 + 소스 = ♥️ 특히 누룽지에 넣는 물이 비법이 있어 보였다 켘ㅋㅋㅋ 엄청 마싯서 디저트 = #키에리 두번째 방문인디 올때마다 사람이 많으,,, 오픈 5분 전에 갔는데두 대기가 길~었~다 뭐 먹을지 엄청 고민하다가 고른 두가지 망구살구하고 레몬 두개 맛이 비슷했는데 나는 망고가 더 조와 ^_^ 양도 적으면서 비싸긴 엄청 비싼 키에리! 심지어 이용시간도 1:20으로 제한이 있었당 ㅠㅠ아숩 지하철 타고 성수 이동🚋 사실 목적지는 #서울앵무새 였당 택배도 하고 오픈한지도 오래됐길래 웨이팅 있나 싶었는데 포장은 바로 가능하지만 ! 매장이용은 줄이 기이이일다 그려서 우리는 포장을 했지여 입 쩍 비주얼 뭘 먹어야하나 엄청 고민했다 흑 우리가 좋아하는 바질 + 얼그레이(내픽) + 딸기 포장해서 서울숲으로 ㄱ ㄱ 걸어서 10분 정도인데 사실 중간에 쉬었음ㅋ 폰충전때맹 이러케 이쁘게 포장해주시는ㄷㅣ 후다닥 뜯음 개봉 박두 두박 봉개 !!!!!!! 퀸아망은 전체적으로 엄청 달달달달 시나몬롤은 엄청 부드럽고 바질향 나서 좋았으나 나는 두번째 방문할때 퀸아망만 먹을듯 싶다 집가면서 여의나루 들렸다 돗자리 대여해서 자리깔고 앉았는디 비가 조금 와서 집으로 복귀염~~ 이날 걸음수 저녁 8시에 25000보 ‘0’"
[한남동데이트] 눈이 호강하고 입이 건강한 한남동 브런치 맛집 “써머레인” (feat. 키에리),12/5 엄청 오랜만에 남기는 기록💞 이날은 한남동 데이투를 하러가는 날! 아침은 이너글로우요거트볼에 김영모 바게트 샌디치로 간단하게 챙겨주고 공부 좀 하다 약속 나가러😎 머리 덜 말려서...아주 개판이군 셀카 이쁘게 찍고싶다! 멩 언니 만나서 들어온 식당 화장실에 맴에 들어서 찰칵 이날 날씨가 진짜 따땃한 편이라 좋았다♥️ #써머레인 써머레인이란 곳에 왔다 요건 #스매쉬드아보카도-훈제연어&스크램블 에그 특별한 맛은 아니지만 무난하게 맛있게 먹었다 우리 언니 사진 역시 잘 찍어♥️ 요건 #버섯샐러드 진짜 풀밖에 안 보이는 거 실화냐고... 풀을 옆으로 잘 미니까 아래 보이는 버섯과 수란 소스가 맛난 편+버섯 수란 조합 좋다 다만 내용물 좀 늘리고 풀이 줄었으면..😂 #키에리 다음코스는 키에리다잉 언니가 안에서 먹는건 첨이라는데 나도 오랜만이라 쬐끔 설렜다 시즌메뉴로 두가지 시켰다 #흑임자콩치즈케이크 #당근호두시트케이크 흑임자친구는 흑임자 치즈 짱맛 크림 취적 슴슴하니 다른 키에리 치케보다 덜 물리고 양도 적당하다 당케친구는 언니 기준 그냥 그렇네+퍼슬한 시트지 그리고 결정적으로 크림맛이 얼그레이였당 이게 맞나 싶었지만 맛나니까♥️
[한남동데이트](BBHAY/다이애그널쇼룸/단골집/키에리),3년 연속 추석에 만나는 다솜이 ㅎ.ㅎ 올해는 윤진애긴 바빠서 불참ㅠ BBHAY 서울특별시 용산구 한남대로40길 22 인천에서 한남가기 빡세다구 .. 벌써 힘들어서 커피 먹기 위해 근처 카페 찾아봤는데 디저트 맛집 같아서 방문 여기 최대 단점은 라떼가 없고 커피 오직 드립커피 하나뿐 ㅜ 애플 콜비잭과 아아를 먹었다 담에 다른 디저트 먹으러 와야지 내 사랑 다이애그널 쇼룸 가을 옷 안사기가 이번가을 목표지만 가을 신상 예쁜게 많길래 구경하러 방문했다 STUD DAMAGE DENIM PANTS 신상 스포 뜨자마자 눈에 띄었던 데님 다애 바지 5갠가 있는데 나는 다애 바지를 좋아하나보다 .. 이것도 구매하면 잘 입을 수 있을 것 같음 FUZZY MIXED KNIT CARDIGAN 이 가디건도 예뻐서 눈여겨보고 위시리스트에도 넣었던건데 막상 입어보니 먼가 사람이 부해보임 ㅠ 예쁘긴 예쁜데 .. 팔뚝이 우람해보인다구 ㅠ GLOSSY LEATHER BLOUSON RIBBED COLLAR BOLERO CARDIGAN 생각보다 이 크롭 가디건이 더 예뻤다 원피스에 입으면 딱일듯 ? 잠궈서 상의로 입어도 예쁘구 TWEED TASSEL JACKET SAILOR KNIT CARDIGAN 이 가디건도 예쁜데 개말라야 예쁠듯 ㅜ 바로 근처 렉토 쇼룸도 방문 보기엔 가을하늘 같지만 개더웠던 올해 추석 ㅜ GOYA VIRGIN WOOL JACQUARD ZIP COLLAR KNIT (BABY BLUE) 입어보진 않았지만 실제로 봤을때 이게 젤 예뻤음 ㅎ 그러고 나서 비이커도 갔었지만 기억이 안나는걸 보니 볼게 없었던걸루 ㅜ 오히려좋아 나 쇼핑하면 안댐 내 최애 맛집 단골집 갔당 육회 주먹밥이 부활하다니.... 저 가성비 갑 메뉴를 부활 시키셨다니 넘 감동적 ㅠ 역시 단골집은 넘 맛있었고 단골집 -> 키에리 루트 최고라구 한 5년동안 한남동가면 거의 꼭 가는 키에린데 아직도 메뉴 실패를 할때가 있다ㅠ 저번에 할매 오쩌구는 별루였는데 오늘 케이크는 존맛 .. 얼그레이랑 당케는 왜 요즘 없는건가요 근데 ㅠ 다소미가 추석선물도 줘가지고 집와서 야무지게 먹었다 근데 랜디스 왤케 맛있어.? 처음 먹어보는데 헤비한 도넛 안좋아하는데 존맛이었다구 ~~~ㅜ 내년에도 다소미랑 추석때 놀아야겠다 ㅜ
미라클모닝 (12.19) 콩기부 선한영향력 / 한남동 루트-오지힐-키에리,블로그쓰며 모은 콩들 유기견들에게 기부~ #루트에브리데이 브런치 1인1메뉴 필수☆해야함! 4명이서 와르르 시키고 20분컷 루트에브리데이한남점 서울특별시 용산구 이태원로55가길 26-4 2층 여기야말로 천국~ 케이크종류도 엄청 많고 키에리보다 더 맛있다는 개인적의견 말차인절미케이꾸 #파블로바더블 신세계... 머랭구운???어마한식감이여따 뽀또케이크추가로 더머굼 조각케이크2개에 파블 밥값보다 디저트값이 더나온...ㅎㅎ여자4명~ 오늘의추억🥰 키에리 후기에는 어마무시해서... 들어갔다가 기분더러워져서 나온다는 말들때문에 궁금했는데 포장이여서 그런지 나는 나쁘지않았다 너무 안좋게 생각하고 가서 그런가...?친절하던데... ☆근데 먹고가는거1시간제약있다☆ #키에리 키에리 서울특별시 용산구 이태원로26길 16-8 1층 키에리 콘치즈크럼블 이였던거같은데 고냥 음 특별하게 맛있는점은 모르겠다 이조막만한게 만원이라서 구런가...ㅎ 집가는길에 닭강정사가고 집에서 #당근스프 했는데 내가만둘었지만 줜맛...! 당근+양파+치킨스톡+우유+치즈+후추+소금+알룰로스 빵캘린더 9월4일은 나의 문구가 적혀있다 #갓빵달력 이런소중한 빵달력이 선물로 오다니 너무 뿌듯 좋다♡
"4월 둘째주 일상 : 투썸 바베큐 치킨 파니니, 신메뉴 레몬 블루밍 티, 이태원/한남동 나들이 (카오산, 키에리), 호미곱도리탕, 벨낀 이야기, 슈가로로 스파클링","4월이 절반이나 지나갔다. 어떤 사람이 일각이 여삼추라고 해서 맞다맞다 했는데ㅋㅋㅋ 그래도 시간 금방 가는거 같아서 쏘 신기ㅋㅋㅋ 레몬 블루밍 티와 바베큐 치킨 파니니 지난 토욜 오전 근무 후 필라테스 갔다가 투썸에서 브런치 먹음. 투썸 은근 파니니 맛이써.. 보통은 바질 어쩌고 먹는데 없어서 바베큐 치킨 먹었음. 이것도 맛있오. 봄 신메뉴 레몬 블루밍 티도 같이 주문해봤는데 상큼하고 조았음. 무엇보다도 날씨 좋은 날 운동 마치고 카페에서 여유 부린다는 게 넘 좋았음❤ 이날 저녁은 친구네 집들이가서 놀았는데 진짜 잼썼음,,ㅎㅎ 찍은 사진이 없넹 스플렌더 했는데 존잼이었음ㅋㅋ 스플렌더 존잼 집들이 선물은 전동 칫솔했는데 담엔 보드게임 선물해야겠다고 생각했음ㅋㅋ 일욜은 칭구랑 봄나들이 함ㅎㅎ 카오산 카오산 서울특별시 용산구 이태원로20길 13 1층 친구가 태국음식 먹고 싶다고 해서 카오산 가봤는데 메뉴도 다양하고 맛있었음ㅋㅋ 솜땀, 팟카프라오무삽(..걍 돼지고기 덮밥), 팟타이 이렇게 세가지 시켰는데 세 메뉴의 조합이 딱 좋았달까.. 솜땀 상큼하고 팟어쩌구는 짭짤..팟타이 달콤.. 맥주도 시원했음! 친구가 어쩌구를 생맥으로 파는 곳 잘 없지 않냐고 해서 한잔씩 했는데 술 이름이 기억이 안남ㅋㅋㅋ 네이버 예약하고 갔는데 예약 안해도 일찍 가면 웨이팅 없는 거 같음. 점심먹고 키에리 갔음 키에리 서울특별시 용산구 이태원로26길 16-8 1층 카페가 예쁘고 채광도 좋아서 예쁘게 입고 와서 사진 찍는 사람들 개많음ㅋㅋㅋ 사실 그 사람이 바로 나에요,,, 키에리 라벤더 얼그레이 치즈 케익 딸기 초콜릿 치즈 케익 이렇게 두개 시켰는데 라벤더 얼그레이 치즈 케익이 진짜 맛있었음. 은은하게 꽃향기가 나서 계속 신기해하면서 먹었음. 여기 왜 인기 많은지 알겠더라..! 날씨가 넘 좋아서 한남동 쪽으로 살살 걸었음. 꽃구경도 했다ㅋㅋ 주말 진짜 넘 잘 놀아서 시간이 금방 갔음,, 헬요일-금요일은 걍 뭐~~ 똑같은 일상~~ㅋㅋㅋ 그래도 압박스타킹 삼인방과 함께 해서 나름 든든했달까..! 이 땅의 모든 육체노동자들(나포함) 대단하다고 생각.. 곱도리탕 개힘든 날은 곱도리탕을 먹자..!ㅋㅋㅋㅋ 호미곱도리탕.. 걍 가끔 먹으면 좋다..ㅋㅋㅋ 일인분 양이 딱 적당. 벨낀 이야기 벨낀 이야기 - 알렉산드르 뿌쉬킨 지난주에 시작해서 오늘 다 읽었는데 단편 소설의 맛을 쬐금 알거 같다ㅋㅋ 원래 소설을 잘 안 읽고 읽어도 주로 장편 읽었는데 열린책들 문학집이 주로 단편 엮은 것들이다보니 요즘 단편들을 읽는데 일단 가볍게 금방 읽혀서 좋고 (넷플릭스에서 20~30분 짜리 영상 찾는 것도 같은 이유로 좋음ㅋㅋ) 짧은 글에 기승전결이 있으면서 반전까지 있어야 해서 재밌음. 슈가로로 스파클링 친구가 슈가로로 스파클링 주문해줘서 냉장고 채워둠ㅎㅎ 편-안. 쪽지시험 뭐란말임;; 금욜에는 별안간 쪽지시험 봄ㅋㅋㅋ 아니 이 나이 먹고 뭔 시험이고;; 하면서도 열심히 봤음ㅋㅋㅋㅋ 쩝..금욜이니까 봐줬다 아무래도 상사를 때리면 안되니까^^ 일하고 싶은 동료 1위 istp다 이거에요~~ 아무래도 일하고 싶은 동료 mbti 1위를 당당히 차지한 잇팁으로서,,직장에선 사리분별을 제법 하는 편,,^^ㅋㅋㅋㅋㅋ 광명역 파리바게트 오늘은 광명역에서 대충 샌드위치 먹고 집가는 중,, 케텍스 케텍스 창가자리에서 벨낀 이야기 다 읽었다ㅎㅎ 지금도 케텍스 안인데 이 이동 시간이 은근 좋다ㅎㅎ 특히 창밖 날씨 좋고 햇빛 잘 들면 책 읽다가 창밖보며 멍때리다가 반복 × n번 이번 한 주도 힘들었지만 또 좋았음. 이번 주말엔 기분 좋은 일(=암것도 안하기)을 해야짓..!ㅋㅋ 고심 최고~~❤ #일상, #투썸신메뉴, #레몬블루밍티, #바베큐치킨파니니, #이태원맛집, #이태원태국음식, #카오산, #이태원카페, #키에리, #호미곱도리탕, #열린책들, #벨낀이야기, #슈가로로스파클링, #광명역파리바게트"
[한남동/이태원] 디저트가 맛있고 조용한 카페 '키에리',키에리 영업시간 오후 1시 ~ 8시 위치 키에리 서울특별시 용산구 이태원로26길 16-8 메뉴 제주 밤호박 치즈케이크 코코넛 에스프레소 치즈케이크 홍국쌀 베리크림 쌀케이크(저탄수) 얼그레이 치즈케이크(with 라벤더크림) 하동 말차 치즈케이크 살구 치즈케이크(with 수제 살구 콤포트) 호두 무화과 치즈케이크 블루베리 클래식 치즈케이크 흑임자콩 치즈케이크(팥과 서리태 크림) 핑크레몬 치즈케이크 콘 크럼블 치즈케이크 인진쑥 베리크림 쌀케이크(저탄수) 음료 제조하는 곳 바깥쪽! 음료 제조하는 곳 안쪽..! 우선 바깥쪽인데 실외는 아닌 곳이랑... 아예 안쪽이랑 나눠져있어용 ㅎㅎ 대화하다보니 금방 나온 메뉴! 엄청 꾸덕해보이죠! 맛이 엄청 진하더라구요! 밤호박 치즈케이크는 정말 밤호박을 뭉쳐놓은 맛...! 말차 치즈케이크는 말차 60% 치즈케익 50%로 도합 110%맛이 느껴지는... 맛이 되게 진해서 크게 퍼서 한입에 와압!!! 먹는 갓보다 쪼금씩 잘라 먹는 게 맞겠더라구요. 저는 말차 치케 골랐지만 단호박 치즈케이크가 더 맛있었어요! 말차는...쪼금 별루얐슴^^.... 말차는 음료로 먹는 게 최고인 걸로 케익 맛이 진해서 음료 맛이 좀 가벼운 걸 고르시는 것을 추천해요! 연하게 만든 아이스 아메리카노 추천~
"그냥 걸었어 (한남동 파르크, 오월의 종, 원인어밀리언/ 이태원 키에리)",9월의 늦더위가 기승을 부리던 날. 오늘 이렇게 더울줄 몰랐다. 진짜 몰랐다. 진짜 잔짜. 밥먹으러 난포에 갔다가 웨이팅의 압박으로 파르크로 고고. (근데 왜 카카오맵에서 빠르크라고 나오는지...? 파르크로 아무리 찾아도 없어서 당황쓰) 파르크 서울특별시 용산구 이태원로55가길 26-5 수란&베이컨을 올린 묵은지 볶음밥과 항정살 수육. 노른자랑 비벼먹으면 맛있다. 초딩입맛 저격한 김치볶음밥. 깔끔했던 수육. 좋은 한끼였다.... 오월의 종 앞에서 본 귀요미 댕댕쓰. 주인 기다리는 듯... (나 좀 봐주라) 예전에 한 번 실패한 오월의 종. 무슨 장사가 점심에 끝나냐고 아쉬워하면서 갔는데 이날은 문 활짝 열려 있었다. 오월의종 한남점 서울특별시 용산구 이태원로49길 24 이렇게 빵 많은 풍경 처음. 원없이 구경했다. 무화과 호밀빵 베스트라길래 사봄. 또 언제 만나겠니. 빠잇. 더위와 습기를 뚫고 이태원 키에리로 걸어갔다. 키에리 서울특별시 용산구 이태원로26길 16-8 가게 앞에서 똥꼬발랄한 아기 냥이. 비건 케이크집으로 유명하다고. 둘러보니 손님들 대부분 케이크 몇 개씩 잡수고 계시던디. 라벤더 크림이 올라간 얼그레이 치즈케이크를 주문했다. 첫 입은 음(?).. 근데 먹으면 먹을수록 맛있다. 본래 케이크란 달고 달고 달아서 먹을수록 물리기 마련인데 신기함. 달지 않아서 끝없이 들어감. 왜 다들 몇개씩 먹고 있는지 알것 같어.. 먹고 나오니 또 생각나는 마성의 맛. 근데 규칙 보통 아이오.. 조용조용 소곤소곤 말해야 함. 케이크는 셀프 포장. 물론 남은 케이크는 없었다. 배불러서 한남동으로 돌아와 카페거리를 거닐었다. 근데 너무 더워서 원 인 어 밀리언 카페로 피신. 원인어밀리언 서울특별시 용산구 이태원로54길 31 물과 에이드로 목을 축이고 나니 살 것 같어. 앞에 거울이 있는 자리. 왜 자꾸 거울로 눈이 가는지..? 날씨가 좋았지만 더위.. 습기... 힘들었다. 아니 행복했다. 아니 지쳤다. 아니...
