url,title
https://blog.naver.com/moon_602/222743944665,"망원동 횟집 어수선, 꿩먹고알먹고, 망원양꼬치, 카페인중독"
https://blog.naver.com/sehee922/222502815078,망원동 카페인중독
https://blog.naver.com/biblec/221320959960,[망원동 카페] 망원동주민센터 근처 카페인중독 망원점
https://blog.naver.com/perfectmedia_/222127425295,"[와플맛집 망원동카페 카페인중독 - 누텔라와플, 말차와플..."
https://blog.naver.com/kkk930919/221326875754,망원동와플집 카페인중독 솔직한 후기
https://dumbndumber.co.kr/2111323379,카페인중독 망원점 - 마포구 망원동 커피숍 | 동네맛집 이곳저곳
https://blog.naver.com/yarywt/221615647465,"망원동 술집, 맛집 추천 / 한강가자, 일등식당, 카페인중독"
https://blog.naver.com/hyelin_b/221449373268,망원동 디져트 카페인중독 와플:)
https://blog.naver.com/cafein5959/221411498853,[망원동 카페/배달] 카페인중독 망원점 배달의민족 리얼 후기!
https://blog.naver.com/kkk930919/221326919323,[망원동카페] 디저트가 맛있는 카페인중독 망원점
https://blog.naver.com/grand2462/221326913132,망원동 카페인중독 디저트/ 와플에 생크림이 미쳤어요
https://blog.naver.com/grand2462/221326835837,망원동카페 카페인중독 망원점에서 힐링~
https://blog.naver.com/wltnzkf/221326849300,망원동카페 카페인중독 방문 후기 !
https://blog.naver.com/wltnzkf24/221326909109,(배달맛집) 망원동 카페인중독 와플&커피~
https://blog.naver.com/grand2462/221326890686,커피 배달 가능한 망원동 카페인중독!! 와플에 반하다
https://blog.naver.com/wltnwkd85/221326896576,망원동 카페인중독에서 와플과 커피 먹었어요! (커피배달 전문점)
https://blog.naver.com/wltnzkf23/221326905901,망원동 배달되는 와플맛집~ 카페인중독에 중독되었어요!
https://blog.naver.com/wltnwkd85/221326854718,망원동카페/달달한 와플이 땡길 땐 카페인중독
https://blog.naver.com/wltnzkf23/221326880388,망원동와플은 여기! 카페인중독 망원점 :)
https://blog.naver.com/wltnzkf24/221326884281,망원동 카페인중독에서 생크림와플을 먹다!
https://blog.naver.com/wltnzkf/221326893803,"망원동 와플, 커피배달 카페인중독 망원점"
