title,content
연남동 디저트 카페 스콘맛집 마가렛 연남,"#연남동디저트 #연남동카페 #마가렛연남 #연남동스콘맛집 #연남카페 #연남디저트 스콘과 큐브파이가 맛있는 연남동 디저트 카페 마가렛 연남 :0 마가렛 연남 서울특별시 마포구 성미산로29길 10 1층 마가렛연남 주소 서울특별시 마포구 성미산로29길 10 1층 전화번호 070-8666-0559 운영시간 매일 10:00 -22:00 안녕하세요 슈리입니다. 맑고 쾌청한 날이 계속 되는 요즘 저는 디저트 카페 투어하는 재미에 빠졌거든요! 오늘은 어디를 가볼까 고민하다가 연남동 디저트 카페 맛집으로 소문난 마가렛 연남을 다녀오게 되었지요. 홍대입구역에서 걸어서 8분걸리에 위치하고 있는 곳 지금 걸어다니면 딱 좋은 경의선 숲길 공원을 걷다보면 어느새 도착했더라고요. 주택을 개조하여 만든 주택카페 1,2층 그리고 마당까지 사용이 가능하죠 :0 여름이라 마당 앞에 있는 나무들이 더운 여름 온도를 한층 내려주는거 같더라고요 선선한 바람이 부는 가을날 테라스에 앉아서 즐기기 좋을듯해요!! MARGARET dessert cafe :0 연남동 디저트 카페의 특징이라고 할까요!? 애완동물 테라스 석이 따로 마련 되어있고 노키즈존이라 편하게 카페를 즐길 수 있어요. 카페에 들어서면 가장 먼저 보이는 강아지 액자 :0 사장님꼐서 강아지를 좋아하시는게 보이더라고요. 한쪽에 접시들과 집게가 놓여 있어요. 직접 집게로 디저트를 접시에 담으면 되는거죠~ 카페 1층 내부에 있는 빵코너 빵순이인 제가 너무나도 사랑하는 곳이죠:- 사장님께서 직접 매일 빵을 만드신다고해요. 아기자기하고 구매욕을 불러 일으킬 정도로 예쁜 디저트 가장 잘 나가는 디저트는 큐브파이, 스콘이라고해요. 큐브파이는 흑임자, 바닐라 말차, 리얼초코, 키캣누텔라,뽀또치즈, 순수우유, 구은 피스타치오 등 7가지 종류가 있어요. 그리고 스콘도 워낙 종류가 다양하죠. 바질토마토, 단호박크림치즈,빅토리아, 무화과 크림치즈 등 남녀노소 누구나 좋아할 수 있는 건강한 재료들을 이용한 스콘들이였어요. 요즘 같이 더운날 더욱 인기가 많은 조각케이크 12종류의 케이크가 있다보니 고르는 재미가 있겠죠!? 홀 케이크를 판매도 하시니 인스타 DM이나 전화로 문의하시면 될거 같아요~! *_* 직접 영상으로 디저트를 담아 보았으니 같이 확인해보시죠! 디저트와 잘 어울리는 음료 메뉴판 : 0 아메리카노, 카페라떼를 비롯한 커피류와 크림밀크티, 말차밀크, 캐모마일 등의 논커피류가 있어요. 커피류는 아이스와 가격차이가 나지 않기 때문에 아이스로 드시는 분들은 넘나 희소식!! *_* 저는 이날 크림 밀크티, 말차큐브파이, 빅토리아스콘,바질토마토스콘,단호박크림치즈스콘을 구매하였어요!! 메뉴 주문을 하고 난 후 카페 구경을 살포시 하였어요. 따뜻하고 온기를 가득 품고 있는 1층 내부 우리집처럼 포근하다~ *_* 다음으로는 2층 구경 1층과는 다르게 심플하고 깔끔하더라고요. 통창 유리라서 햇살도 들어오고 트랜디한 느낌이 들었죠. 각 방마다 테이블의 색상과 느낌이 달라요~! 평일 오픈하자마자 방문하시면 조금 한적하게 시간을 보내면서 카페를 즐길 수 있을거에요. 형형색색 알록달록한 디저트들 그리고 달콤한 크림밀크티 :0 제가 가장 먼저 연남 카페 디저트는 바질 토마토 스콘 향긋한 바질향과 그 위에 새콤달콤한 토마토 그리고 고소한 바질 스콘이 너무나도 제 맘에 딱 들었어요 말차큐브파이는 진한 말차크림이 들어가 쌉싸름하면서 달콤했지요. 그리고 빵은 겹겹이 쌓여있는 페스츄리 빵이라 뽀송뽀송하더라고요 :0 그리고 제일 인기있는 빅토리아 스콘 고소한 스콘 그리고 상큼한 크림치즈 같은 크림 그리고 그 밑에 있는 달달한 딸기쨈 푸초엄마가 먹어본 바로는 스콘자체가 너무 맛있어서 그냥 먹어도 좋다고 하더라고요. 단호박 크림치즈 스콘은 건강한 빵을 먹고 싶으신 분들을 위해서 추천드려요! 상큼한 크림치즈 담백하면서 달달한 단호박 크림 스콘도 그냥 스콘이 아니라 단호박 가루가 들어 간거 같더라고요 ㅎㅎㅎ (나의 미각은 맞을까...!!!!!) 빠라 빠라 밤~ 빠라 빠라 바밤~ 마가렛 연남만의 시그니처 음료 크림밀크티 오직 아이스로만 판매를 하는데 더운 여름날 마시기 딱 좋아~~~~ 달콤하고 부드러운 크림을 밀크티와 잘 섞어서 마시면 달달하면서 코끝에서 오는 향긋한 홍차의 향이 연남동 디저트와 잘 어울렸죠. 밀크티 두번 드시고 세번 드세요!!! ㅎㅎ 평온한 평일 오후 출근 전 만끽하는 달콤한 시간 :0 연남동 디저트 마가렛 연남은 포장도 가능해요! 저는 스콘과 큐브파이를 먹고 남은 거와 새 디저트를 구매하고 포장해서 가족들에게 선물을 했지요 ^_^ 달달한 티타임을 갖고 싶을때 그리고 연남도 분위기 좋은 카페를 찾고 있다면 적극 추천하는 마가렛 연남 :0"
[서울 홍대입구역/연남동] 마가렛 연남 :: 당신의 감성을 저격할 주택개조 카페,"저장해둔 리스트 중에서 어딜 가볼까 고민하던 중 마가렛 연남 당첨🌿 여긴 주택을 개조한 카페인데 따뜻한 느낌을 풍기는 옛날 주택의 외관은 최대한 살리면서도 내부는 현대적이고 감각적이게 리모델링을 싹-해놔서 세련된 느낌을 준답니다❤️ 마가렛 연남 서울특별시 마포구 성미산로29길 10 1층 영업시간 12:00 - 22:00 야외테이블 한정 애견동반 가능✅️ 핫플이라 사람이 넘나 많은 것... 낮에 1층 내부 찍기에는 사람이 너무 많아서 패스했는데 밤에 마침 마가렛을 지나는데 사람도 없고 안이 잘 보여서 찍어봤습니다😉👍🏻 2층은 사람이 많이 없었기에 신나게 사진 찍을 수 있었어요 후후후🥳💛 1층도 자리가 있지만 2층에 자리가 훨씬 많답니다👀❣ 햐.... 난리난다 진짜.. 여기 인테리어 완전 내스타일이쟈나~~~ 주문은 1층에서❣ 접시랑 집게 챙겨서 고르시면 돼요✅ 베이커리 카페라는 말에 걸맞게 종류가 엄청 많아요💡 인스타에서 마가렛연남 피드보면 빠지지 않고 있던 큐브파이📸 여기 시그니처인듯 스콘, 케이크, 쿠키, 에그타르트 등 디저트가 너무 다양해서 뭘 먹을지 진지하게 고민하게 되더라구요🤭❤️ 음료 메뉴판 너무 더운 날이었기에 야외에 앉기란 불가능^^ 야외에서 사진 찍고 호다닥 실내로 들어왔슴다... 그래도 분위기 난리나쥬? 욕심 많은 친구와 저.. 밥도 야무지게 먹었기에 한참을 고민하다가 시그니처가 큐브파이인 것 같으니 다른 맛으로 두 개 시켜보자! 하고서 뽀또치즈 큐브파이랑 피스타치오 큐브파이 그리고 빅토리아 스콘 주문🐷 +양심의 아메리카노 빅토리아 스콘도 그렇고 전반적으로 무난하게 맛있었어요 큐브파이는 크림이 꽉 차있어서 이점은 합격👍🏻 제기준 피스타치오는 뭔가 피스타치오 향이나 맛이 약해서 아이덴티티가 약한 느낌이긴 해도 뽀또맛보다 맛있어요 뽀또치즈 맛을 젤루 기대했는데 인위적인 치즈맛이라 좀 물렸거든요 희희 (✅워낙 여기저기 다녀서 기준치가 높을 뿐이지 맛있음 맛 없는건 아님) 그냥 너무 예쁘고 햇살 맛집이라 날 좋을 때 재방문하고 싶어지는 곳 마가렛 연남! 누굴 데려가도 괜찮다고 할만한 그런 카페여서 연남동 쪽에서 괜찮은 카페 찾으신다면 여기 추천드려요🌼"
"[일상_] 연남동 카페, 마가렛 연남, 주섬주섬","토익 개강 하루 전날 12월 4일 나의 오랜 친구 민지랑 연남 데이트 갔다 🌟🌟🌟🌟🌟🌟🌟🌟🌟🌟🌟🌟🌟🌟🌟🌟🌟🌟🌟 민지랑 나랑 알게 된 계기 ( 초등학생 때 같은 피아노 학원을 다녔는데 그 때 가방을 큰 테이블에다 두고 각자 피아노방에 들어가야 했었음 근데 둘 다 똑같은 헬로키티 가방이어서 서로 바꿔간거 itzy?) 하여간 너무 티엠아이 원래 민지가 코리코 카페 가고 싶다했었는데 하필 휴무라서 <마가렛 연남>으로 갔당 디저트 천국이얌 다 먹고 싶으다 행복한 고민 ❤️ 연남에는 예쁜 카페가 정말 많아서 올 때 마다 '여기 살고 싶다' 라는 생각을 하게 된다 너 돈 있어?? 없어~! 민지 제 2의 고향이 연남인만큼 맛집과 카페 잘알인데 연남동 봄띠 진짜 맛있어요 봄띠도 민지랑 갔었는데 인생 파스타집 등극 🍝 추워도 아아는 못참아! 민지가 생일 선물이라고 줬다 편지도 두 번이나 받았다구.. 민지야 고마워 눈물😢 포장까지 너무 예뻐서 뜯기 아까웠는데 두둥 열었는데 너무 예뻐서 환호했다,, 어찌 이리 예쁜 컵을 찾았을까..?(님피아 색이야) 내가 좋아하는 색 조합 내가 집순이인걸 알고 거기에 맞춰 선물해줬다 심지어 나 차마시는것도 좋아하는데 앞으로 내가 가장 아끼는 커업이다 이말이야 민지짱 여기서 예뻤는데 사진을 맘대로 올릴 수 없으니 내 사진을 투척 명당자리 눈여겨보다가 바로 겟또! 트리 앞에서도 찰칵 🌲 연남은 벌써 크리스마스야 ! 저녁은 내가 먹고 싶은데로 가자고 해서 밀푀유나베를 먹고 싶다했더니 데려가줬다 <주섬주섬> 리조또랑 밀푀유나베 최고 맛있다 믿고 따르는 민지언니 픽 종업원분들도 친절하고 내가 젓가락도 떨궜는데 후다닥 오셔서 주워주시고 폰충전할 곳 찾으면서 두리번두리번 했는데 바로 찾으시는거 있으세요?? 하시면서 불편한게 없게끔 해주셨다 민지 덕에 토익으로 집에 박혀있기 전 즐겁게 바깥 나들이를 했다 종종 나를 밖으로 끌어내주렴,, 💗 #연남동 #연남동맛집 #연남동카페 #연남맛집 #카페 #카페추천 #홍대 #홍대맛집 #서울카페 #일상 #일상블로그 #일상이야기 #휴학생 #대학생 #마가렛연남 #주섬주섬"
"[친구랑 연남동 데이트] 멕시칸식당 베르데,마가렛 연남 카페",지난 주말 육아는 잠시 남편한테 맡기고 대학친구 만나러 연남동에 갔다!!!! 연남동 베르데 서울특별시 마포구 동교로 262-6 1층 만나자마자 미리 찾아논 맛집!! #멕시칸식당 베르데로 고고고고 연남동 진짜 오랜만이다~~~~~~~ 친구도 반갑고~~~ 연남동도 반갑고~~~ 좋다좋아 우린 #베르데파히타 하나랑 사이좋게 음료 두개 시키고 먹었따. 처음엔 양이 적을려나 사이드 시킬까 고민했는데 이걸로도 두명이서 배불리 먹었다!!!! 수다도 떨고 맛있는 음식도 먹고 하루종일 신난.......나의 하루........ 먹고 또 수다 하러 카페로 이동~~ 마가렛 연남 서울특별시 마포구 성미산로29길 10 1층 입구부터.....넘나 예뻤다.....!! #마가렛연남 인증샷 하나 남겨주고 입장 크 .....디저트들...다 먹고 싶었는데 배가 안꺼져서 하나만 먹은게 후회스럽다.... 맛도 좋은데 이쁘기까지 하다!! 우리가 먹은 커피와 디저트~~~ 바깥은 너무 예뻤는데....카페안 분위기는 생각보다 별로여서...아수었다 사람은 또 엄청 많았음......... 오랜만에 육아해방도 하고 친구도 만나고 힐링 그 잡채였다~~~~~~ 자주자주 #자유부인 해야겠다~~
마가렛 연남(연남동 디저트카페),40대 줌마의 잠자던 소녀감성을 깨워준 가게가 있었으니... 두구두구두구(자체 북소리) 그 이름은 마가렛 연남💕 걍 지나가다 여긴 뭐지? 큰 기대 없이 들어가봤는데.. 옴마야! 휘둥그레지는 눈😍 동화속 삽화에서 막 튀어나온 듯한 비쥬얼의 케이크들이 똭~~~ 점심을 먹고온 터라 커피만 마시려고 했는데 딸기치즈타르트의 요염한 자태에 반해 버렸다^^; 한 입만 먹어야지..하다가 걍 다 먹어치웠다ㅎㅎ 2층 양옥집의 프레임을 그대로 살린 인테리어 덕분에 방방이 짱 박히기 좋은 구조다ㅎ 학창시절 친구들이랑 군것질 하며 방구석 토크하던 분위기 급소환ㅋㅋㅋ HOT랑 젝스키스 중에 누가 더 멋진 지를 목에 핏대 올려가며 토론하던 시절이 있었지ㅋㅋ 2층에도 앉을 공간이 넉넉하다 셀프 음료대에 핸드백이나 가방 놓을 공간을 따로 마련해둔 센스도 엄지척!😁 밥 배와 빵 배가 따로 있음을 매일 실천 중인 디저트 마니아들에게 강강추❤️‍🔥 마가렛 연남 서울특별시 마포구 성미산로29길 10 1층 #마가렛연남디저트카페 #마가렛연남 #연남마가렛 #디저트카페 #연남동카페 #디저트맛집 #연남동케이크 #연남동디저트 #연남동맛집 #연남동데이트 #딸기치즈타르트
[연남동 카페] 마가렛 연남,"연남동 카페 마가렛 연남 서울 마포구 성미산로29길 10 1층 영업시간 12:00-22:00 연남동 지나가면서 늘 궁금햬던 마가렛 연남!! 드디어 가봤다ㅠ 매번 연남동 카페 검색할 때마다 보이고, 지나갈 때마다 보여서 궁금했는데 몇 달만에 갈 기회가 생겼넴,, 날씨도 너무 좋고 푸릇푸릇한게 마당에 앉고 싶었는데 너무 더워서 포기,, 땀 뻘뻘 흘리면서 바로 사진만 찍고 안으로 돌격ㅠㅠ 커피 마시려다가 밀크티 종류별로 있는거 보고 넘어가버림ㅠ 밀크티 맛있다는 뜻 맞죠,,? 들어가자마자 정가운데 테이블에 있는 디저트에 압도당함,, 그래 이거지 이거야 하나하나 다 먹고 싶었는데 점심 먹고와서 에그타르트 하나만 맛보기로ㅠㅠ 카운터 옆 냉장고에 케익도 있슴!! 겉으로 봤을 때는 몰랐는데 생각보다 내부가 엄청 넓다!! 나는 1층 통창 있는 곳에 앉음 아기자기한 소품들도 많고 정돈된 깔끔한 느낌이라 좋았음!! 2층에도 앉을 수 있는 것 같은데 밖으로 나가야되는듯,,? 에그타르트, 크림밀크티, 아이스 아메리카노 에그타르트 겁나 커서 좋다,,, 엄청 폭신하고 역시 에그타르트가 최고야ㅠ 먹으면서 하나 더 시킬까하다가 배불러서 참고,, 담에는 다른 디저트도 먹어봐야징 분위기도 좋고 지금처럼 날 시원할 때 마당에 앉음 진짜 좋을듯ㅠㅠ 외관이 진짜 취향저격😻 마가렛 연남 서울특별시 마포구 성미산로29길 10 1층"
[연남동] 마가렛 연남,22. 01. 25 우리는 피자를 뿌시고 배배 옷 선물 사주공 #마가렛연남 이라는 카페를 가게 되었다 🌼🌼🌼 마가렛 연남 서울특별시 마포구 성미산로29길 10 1층 *영업시간* 매일 12:00~22:00 따뜻한 날 낮에 와야 이쁠 거 같은데 추운 날 저녁에 와서 사진이 예쁘게 찍히지 않았다ㅠㅠ 개인적으로 #마가렛꽃 엄청 좋아하는데 봄에 오면 꽃도 있으려나🌷 1층과 2층으로 구성되어 있는데 1층에서 주문을 하면 된다 각종 베이커리류도 있었지만 우리는 배가 찢어지게 불러서 디저트는 패스~! 보다가 다음에 꼭 먹어 보고 싶은 스콘이 있었는데 단호박이었나.. 다음에 꼭 먹어봐야지!🍰 배배는 뜨아 나는 아이스 말차 밀크!🍵 곳곳마다 소품들이 있었다 사장님이 남자 두 분이셨는데 이런 감각... 섬세하셔💛 우리는 2층으로 자리를 잡았다 2층도 자리가 꽤 있는 편이다 미키를 좋아하던 배배는 그렇게 미키가 되었다...🐭 여기 안쪽 방 같은 자리에 앉았는데... 조명이 너무 아쉽다 정말 조명이 너무 침침해서 사진이 이쁘게 안나온다ㅠㅠ #크로우캐년 컵이랑 #캠트레이 라니... 센스 있는 사장님~!💖 나도 집에서 컵 정말 애용하는데 사이즈도 딱이고 좋다 곳곳에 선반에 오브제랑 각종 소품들이 있는데... 인테리어 때문인가 왜 있는지는 잘 모르겠다 ㅋㅋ🙊 개인적으로 마음에 들었던 포스터 나도 나중에 카페 하고 싶다... 저스트 희망사항 ^^ 봄에 다시 한번 와볼게요~! 그땐 디저트도 먹어야지!! 음료도 맛있고 즐거웠습니다
[연남동] '마가렛 연남' 연남동 디저트카페 | 연남동 감성카페 추천,얼마전에 친구랑 갔다온 연남동카페 마가렛ㅎㅎ 원래는 근처에 티크닉을 가려했으나 그날은 포장만된다해서...ㅠ 그냥 옆에있는 마가렛으로 가기로했다 먼저 외관사진! 넘이쁘졍!!!!🥲 먼가 아이보리+그린 이 조합이 맘에든다 들어가자마자 보이는 디저트들 그리고 밖에서보기에는 되게 작고 복작복작한 카페일거같았는데 내부는 생각보다 되게 넓고 쾌적했다 만족ㅎ 맛있어보이는게 넘 많았다지...ㅠ 케익도먹고 파이랑 스콘도 다 먹고싶었는데 ㅠ 특히 이 얼그레이케이크랑 메론케이크가 너무 맛있어보였다 비주얼도 이쁘고ㅠㅠ 근데넘 많아보여서 안시켰다ㅋㅋㅋㅋ 결국친구랑 고른건 무화과스콘! 가격은 5.3 약속 늦어서 내가샀음..ㅋㅋㅋㅋ 커피는 나는 아인슈페너시키고 친구는 라떼시켰다 여기사장님 크로우캐년 덕후이신듯ㅇㅇ 아인슈페너가격은 6.5이었다 아인슈페너 잔 넘 이쁘다 이뿌당 사실 커피맛은 별로 기대 안했는데 아인슈페너는 꽤나 맛있더라구요?!? ㅋㅋㅋㅋㅋㅋ기대를 안해서그런가 커피도 크림도 은근 진하고 맛있었다 이건 사람조금 빠지고 찍어본 2층내부! 깔끔하고 시원한분위기가 아주좋다 평일인데도 사람이 꽤나 많았음!! 자리가 없을정도는 아니었지만ㅎ 연남동 디저트 카페로 추천드려여!!
연남동카페 : 마가렛연남(MARGARET)|햇살맛집 디저트카페,"안녕하세요 뽀효낭입니다✨ 오늘도 이어 연남동카페포스팅을 해보려해요 ! 마가렛연남 연남동카페 채광카페 연남동디저트카페 연남동카페 - 마가렛연남 *12:00-22:00 *홍대입구역 3번출구에서 759m 연남동카페 - 마가렛연남 외관 입구부터 너무 예쁨가득한 카페였어요 ! 이 날은 조금 흐렸지만 날 쨍쨍하고 좋은날엔 채광 완전 맛집이래오 !! !!!!! 토요일에 역시 핫플은 자리잡기힘들죠 ㅠ 주문 전에 꼬옥 자리부터 미리 잡으세요 !! 전 이 날도 럭키걸 .. 2층 올라가자마자 나름 괜찮은 자리 손님들이 나가시더라구요 ..! 연남동카페 - 마가렛연남 메뉴판 커피 / 티 / 에이드 음료도 딱 적당하게 준비되있더라구요 ..! 연남동카페 - 마가렛연남 케이크 예쁘고 맛있어보이는 케이크종류와 연남동카페 - 마가렛연남 베이커리존 베이커리도 다양하게 준비되있어요 .! 여기 베이커리 유명하더라구요 !!!! 이 베이커리존 너무 예쁘지않나요 (?) ❣️ 귀여움 가득한 접시에 원하시는 디저트 올려서 계산하시면되요 >,,< 오빠랑 저랑은 빌라더다이닝에서 너무 든든하게 잘먹은터라 음료만 마셨어요 ! 연남동카페 - 마가렛연남 2층내부 손님이 많아 테이블분위기는 담지못했어요.. 2층 분위기 깔끔한 화이트톤에 연한 개나리컬러의 테이블과 의자가 세팅되있었고 , 곳곳에 푸릇푸릇한 식물들도 있었어요 💛💚💛💚 제가 개인적으로 너무 좋아하는 분위기 ! 의자도 스퀘어 , 라운드 모양이 다르더라구요 귀여움 가득 가득했어요 !!! *아이스아메리카노 5000원 *레몬베리에이드 7000원 에스프레소도 한잔씩 하고 갔던터라 오빠는 깔끔하게 아아 저는 에이드를 택했어요 ! 음료맛은 그냥 보통이였어요 ! ㅎㅎ So so . .. .. 아 그리고 2층 올라오자마자 있는 테이블 엄청 탐났는데 ,, 결코 자리가 안나더라구요 ㅠㅠㅠ 👇🏻 연남동카페 - 마가렛연남 이 예쁜 공간 바로 앞 테이블 아마도 마가렛의 명당이 아닐까합니다 ..!!! 카페가면 꼭 제 사진을 남겨주려는 짝꿍 💛 덕분에 또 인스타용 사진 건지고 오-예 ! 지난주 토요일에 연남동데이트 제대로 즐기고왔어요 ! 1일2카페 성공 ! 연남동에 예쁜 곳이 많아서 언제한번 또 가기로했어요 헤헿 오늘도 제 포스팅을 읽어주셔서 감사합니다:) 금요팅하시고 꿀주말보내세요오 Good day💚 #연남동 #연남동카페 #연남동핫플 #마가렛연남 #마가렛 #디저트카페 #레몬베리에이드 #데일리룩 #데이트룩 #데이트 #주말 #카페투어 #카페인테리어 #데이트 #일상 #이웃 #이웃환영 #서이추 #서이추환영"
[연남동] 마가렛 연남,"마가렛 연남 연남동 디저트카페 영업시간 매일 12:00-22:00 마가렛 연남 서울특별시 마포구 성미산로29길 10 1층 밀히씨랑 벙개한날 디저트러버들은 케이크 있는곳으로 마가렛트..? 도넛도팔고 케이크도팔고 스콘도팔고 요즘 핫하다는건 다파는듯 안쪽자리(창가쪽)과 카운터 옆쪽 방 귀여운 도넛 노티드같이 해뒀넹 ㅋㅋ 컵케익, 스콘까쥐 케이크도 무난무난 블루베뤼 케이쿠 한입거리였다 아쉽 낮에오면 사람많아서 바글대던데 저녁이라그런가 조용했다 패션후르츠~ 밀히는 청포도 어쩌구 봉봉처럼 건더기가 있었다 이날 밀히가 사줌 감사룽 또사조~~ #연남동 #마가렛연남 #연남동카페 #연남동케이크 #연남동디저트카페"
