title,content
연남동카페)데얼커피/디저트맛집/피크닉세트,"데얼커피 서울특별시 마포구 연남로3길 23 지2호 매일 12:00 - 21:00 / 목요일휴무 인스타에서 데얼커피 피크닉세트를 보고 반해서 날좋을때 가봐야지! 했지만 시간이 흘러흘러 이미 피크닉 가기에 너무 추운 겨울이 되었다. 반차를 쓰고 친구를 만나기까지 한시간정도 텀이 생겨서 어딜갈까~ 하다가 급 생각나서 가게된 연남동 데얼커피 their coffee 연남동골목보단 좀 안쪽에 위치한 데얼커피 반지하이지만 큰 창문이 보이고 입간판과 예쁜 자전저가 서있어서 바로 찾을 수 있었다. 가게앞에 왕고양이가 상주하고있다. 정말크다 강아지만큼ㅋㅋㅋㅋ 고양이 알러지가 있어서 들어가야하나 말아야하나 했는데 다행히 가게 안까지 들어가는 고양이는 아닌듯해서 고양이를 피해 조심조심 가게로 골인!! 카운터는 작고 가게도 매우 협소하다. 테이블 한 6개정도있어서 내부에서는 웨이팅을 못하고 카운터에서 웨이팅리스트를 작성 후 외부이서 기다려야 한다. 다행히 나는 평일이라 웨이팅 없이 자리에 착석을 했다 금액대는 쏘쏘하다. 원래는 그자리에서 바로 만들어 주는 티라미슈를 먹어보고싶었지만 배도 안고팠고 친구를 만나서 밥먹으러 가기로 했기 때문에 흑임자우유와 앙버터쿠키를 선택했다 자리로 음료를 갖다준다해서 자리로 돌아와 카페 내부를 둘러보면 이렇게 아기자기하다. 아니 특히 저 뜯는달력. 저렇게 미니사이즈로 보니 넘나 귀엽고요? 작은 카페에 맞게 작은사이즈의 소품, 엽서등등으로 잘 꾸며져있다 두리번두리번 거리며 구경하고 있는데 자리로 가져다주신 우유와 앙버터쿠키 가져다 주신건 포크인가? 했는데 쿠키 잘라먹으라고 주신 나이프였다. 넘나 귀염 뽀짝인 앙버터쿠키. 하지만 저걸 입에 넣고 깨물어먹기엔 부스러기도 그렇고 립메이크업도 뭉개질 수 있기 때문에 같이 준 나이프로 4등분해서 먹었다. 그리고 이름을 보기만해도 꼬수울것 같은 흑임자우유 검은콩 두유는 좋아하는데 흑임자음료는 먹어본적이 없었지만 뭐 그런 비슷한 맛일 것 같아서 선택했다. 같이준 얼음컵은 우유를 다 담기엔 사이즈가 좀 부족하다. 그래서 부어서먹고 부어서 먹고 이렇게 해야하는데 난 친구에게 맛이라도 보여줄라고 남은거 가방에 넣어서 가져갔다. 흑임자우유라 그냥 고소하기만 할줄 알았는데 생각보다 더 달았다 그리고 생각보다 빨리 가라앉아서 먹으면서 휘휘 저어먹어야함 주의 그리고 그냥 유리컵+우유+앙버터쿠키면 허전할 것 같은데 뭔가 저 유리컵에 있는 캐릭터가 몇퍼센트 부족함을 꽉 채운 느낌적이 느낌. 이래서 디자인을 잘해야하나봐.... 그리고 카운터 옆에서는 이 카페만의 굿즈를 팔고 있었다. 요샌 이렇게 카페에서 카페특유의 캐릭터가 그려진 굿즈를 파는곳이 많아진것 같다. 디자인초도 같이 파는데 생일파티할때 저런 초를 꽂아도 예쁠듯! 나이가 보여지는 케이크 초 시러시러 그리고 파우치가 너무 귀여워서 하나 살까~하다가 얼마전에 파우치를 바꿨기 때문에 눈으로 구경만 하고 나왔다. 내년에는 피크닉세트를 사서 피크닉을 도전해 봐야겠다. 안녕. 오늘도 잘먹었습니다 :-)"
연남동│'데얼커피(their coffee)' 카페,"데얼커피 #연남동카페 #데얼커피 #theircoffee 작년에 친구랑 데얼커피에서 피크닉세트 주문한 적이 있었는데 직접 카페를 방문한 건 처음이였다. . . . ಇ( ˵ᐛ ˵)ಇ 언뜻 봐도 아기자기하고 귀여운 구조(?!) 하지만 반지하를 개조한 곳이라 내부공간은 좁은 편이다. 그래서 주말에는 항상 웨이팅이 있는 것 같았다. 데얼커피를 대표하는 위에 첨부한 그림도 데얼커피 사장님이 직접 디자인한 캐릭터들이다. . . . 실제로 보면 완전 귀엽다(!!!♥!!!) 데얼커피에서 판매하는 굿즈상품들 카페에서 직접 사용하는 컵도 판매하고, 메모지랑 텀블러랑 에코백도!! 에코백은 탐났는데... 일단 집에 에코백이 많다(ㅠ_ㅠ) 돈을 아껴본다... 하지만 그 돈으로 카페 탐방하는 거에 돈을 더 투자를 한다는 점 ㅋㅋㅋㅋㅋㅋ . . . ★데얼커피 주문한 메뉴★ *음료: 메론소다(6000원) + 블루크림소다(6500원) *디저트: 초코칩 쿠키(2500원) . . . 카페에 가면 인스타스토리 기록용으로 영상 한두개씩 찍는데 이것도 나름대로 재미있는거 같다! ｡^‿^｡ 초코쿠키의 먹다가 남은 흔적... 얼굴이 반쪽이 되었지용 ٩( ‘ω’ )و ٩ . . . 연남동 아기자기하고 귀여운 카페!!! !!!적극 추천!!! 데얼커피(@their_coffee) • Instagram 사진 및 동영상 팔로워 16.2천명, 팔로잉 3명, 게시물 551개 - 데얼커피(@their_coffee)님의 Instagram 사진 및 동영상 보기 www.instagram.com 데얼커피 서울특별시 마포구 연남로3길 23 지2호"
연남동 카페 조용한 분위기 데얼커피(their coffee),"카페탐방 10번째 집 (본인의 주관적인 글로 작성된 글 입니다.) 연남동 카페 데얼커피 안녕하세요!카페탐방을 하는 남자 꾸기입니돠! 오늘은 연트럴파크에서 조금더 떨어진 주택가 지역으로 다니다가 발견한 카페에요 이 카페도 너무 맘에들고, 조용한카페여서 소개를 해볼려고해요~ 한적한곳을 좋아하는분들이나 조용한카페를 좋아하시는분들한테 추천을 드릴께요! 데얼커피 서울특별시 마포구 연남로3길 23 지2호 조용하게 주택가 내부에서 힐링할 수 있는 데얼 커피 주소 : 서울 마포구 연남로3길 23 운영시간 : 매일 12:00 ~ 21:00 가는길 : 공항철도 홍대입구역 3번출구로 나와서 11분 걸어가면됨 오순도순 이야기하기 좋은 조용한카페 '데얼커피'카페 데얼커피도 제가 곧 포스팅 할 퐁시카페랑 비슷한곳이라고 생각을 하시면되요 데얼커피도 연트럴파크에서 조금 더 걸어서 내려오면 있는곳이에요 생각보다 멀지도 않고, 금방 찾을수있게끔 입간판도 새워져있어서 금방 찾으실수있으실거에요 연남동 데얼커피 연남동 데얼커피 처음에 들어가는 입구가 2개인줄 알았는데 자세히 보시면 왼쪽이 들어가는 입구이고 바로 정면에는 다른가게더라구요! 그래서 처음에 정면으로 들어갈뻔했는데 다행히도 바로 왼쪽으로 꺽어서 들어갔어요! 연남동 데얼커피 내부 저는 이날 3시정도에 갔는데도 사람들이 많이 있더라구요! 여기 그렇게 큰 카페가 아니여서 자리 없는줄알았는데 다행히도 자리가 많이 남아있어서 제가 원하는 자리에 앉았어요! 연남동 데얼커피 내부 앤틱한 목재에 이쁘게 쓰여진 글씨 연남동 데얼커피 내부모습 벽면에도 이쁘게 꾸며져있어서 아기자기한 카페라고 생각이 들더라구요 데얼커피 에코백도 팔고있더라구요! 뭔가 기여워서 사고싶었지만 수납공간이 부족해~ 데얼커피 디저트 저는 당연히 여기서 라떼를 시켜서 먹기로했죠! 다른커피보다는 라떼를 얼마나 잘하나 싶기도했고, 아메리카노보다는 덜 쓰니까.. 그리고 이날 원래 초코컵케익 먹고싶었느데 얼마나 맛있길래 다팔리고 없더라구요.. 에그타르트는 맛집아니면 맛없을거같아서 안사먹고..그냥 커피만 마시기루.. 여기는 다른 카페들과 다르게 사진이 많더라구요! 뭔가 카페분위기에 맞게 사진들을 붙였다 데얼커피 수다떨기 좋은곳 테이블수는 총 6테이블정도있었어요! 그래서 수다떨기 좋다고 제가 처음에 말한거구요 연트럴파크에서도 조금 떨어진곳에있어서 시끄럽지도 않고 단 둘이 이야기하기 좋더라구요! 데얼커피 탁자 데얼커피 라떼 맛있는 라떼가 섞으면 저렇게 변하더라구용! 맨날 브랜드 커피만먹어봐서...!ㅎ 신기하기도했고, 커피잔이 너무 기여웄어요! 데얼커피의 마스코트 데얼을 그린것 같던데 누가봐도 너무 이쁘지않나요!? 쪼르륵...!라떼의 위험 연남동 카페 여느집/여느집과 다른 낮과 밤 다르다 카페투어 5번째 집 ( 본인의 주관적인 글로 작성 된 글 입니다.)낮과 밤이 다른 카페 여느집 분위기 좋네요... blog.naver.com 연남동 카페 평생직장 커피 딸기라떼 추천 ※ 본 포스팅은 모바일전용입니다.연남동 평생직장 카페안녕하세요! 이번에 연남동 카페 투어 후기를 남기... blog.naver.com"
카페 | 아기자기하고 한적한 연남동 카페 '데얼커피',"안녕하세요 ღ'ᴗ'ღ 연남동에 있는 아기자기하고 한적한 카페 데얼커피에 다녀왔어요! 데얼커피 서울특별시 마포구 연남로3길 23 지2호 영업 : 서울 마포구 연남로3길 23 전화 : 02-336-0503 영업 : 매일 12:00 - 21:00 / 목요일휴무 데얼커피 외관 홍대입구역 3번 출구로 나와 경의선 숲길을 쭉 따라 골목으로 들어가면 위치해있는 데얼커피 :-D ! (**포스팅 이미지는 2019년 여름입니다**) 데얼커피 내부 데얼커피 내부 데얼커피 내부 카페는 외관 사진에서도 느껴지듯이 아기자기하고 사랑스러워요 ღ 우드&베이지톤 인테리어여서 들어가면서부터 마음이 편해져요 :) 또, 여긴 아늑하고 소란스럽지 않아서 좋았어요. 친한 지인과 가서 도란도란 이야기 나누기 좋은 곳 ღ 사장님 커플이 운영하시는데 사장님들을 캐릭터화한 굿즈들도 판매하고 있어요 :-D! 너무 귀엽고 사랑스러웠어요! 데얼커피, 얼그레이티, 앙데얼쿠키 데얼커피, 얼그레이티, 앙데얼쿠키 친한 동생과 가서 데얼커피, 얼그레이티, 앙데얼쿠키 주문했어요 :) 저는 카페인에 엄청 예민해서 커피나 카페인이 들어간 티를 마시면 잠을 아예 못자다시피해서, 주로 논카페인티를 마셔요! 그래서 얼그레이티를 주문했고, 동생은 바닐라빈크림이 올라간 데얼커피를 주문했어요. 앙데얼쿠키는 앙버터쿠키인데 저는 사실 웬만하면 다 맛있게 먹는 편인데, 앙버터를 정말 안좋아하거든요..? 싫어한다는 말이 더 맞겠어요. 근데 데얼커피 앙버터는 맛있어서 놀랬어요! 저 쿠키가 맛을 살려주는데 한몫하는 것 같아요 :-D* 저처럼 앙버터 안좋아하는 분들도, 한번 먹어봐도 좋을 것 같아요! 데얼커피 내부 짐을 챙겨 나오는 길에 사장님들께서 에그타르트를 서비스로 주셨는데, 여긴 정말 디저트맛집이 분명해요! 인생 에그타르트를 먹었어요 최고예요 (ㅠㅠ)!!!!!! 맛있는 디저트 먹으러 다시 또 갈게~~~ღ'ᴗ'ღ 안뇽~~~~~ #연남동카페 #홍대카페 #데얼커피 #연남동카페추천 #연남동데얼커피"
[202003] _ 연남동 카페 추천: 데얼커피 ‘their coffee’,"연남동 카페 후기 :D 연남동 데얼커피! 간만에 연남동 카페를 찾아 구석으로 들어갔다. 연남 데얼커피 (their coffee) 데얼커피 서울특별시 마포구 연남동 566-19 지2호 위치는 생각보다 아주 안쪽이다. 밤에 들어가는데 너무 구석져서 약간 무서웠다. 저녁에 다니기는 쪼큼..😢 데얼커피 간판! 이렇게 귀여운 간판은 대체 어디서 갖고오는고얌 너무 귀욥따! 메뉴는 이렇다. 저 캐릭터가 이 카페 시그니쳐인듯. 너무 귀여워! 우리는 아메리카노, 헤이즐넛라떼, 데얼커피를 마셨다. 이건 옆에서 파는 것. 에그타르트 포장해갈까 고민하다 안 했는데... 지금 생각하니까 조금 아쉽다. 해올걸 그랬나봐 ‘_’ 이것도 아쉬운 것! 옆에서 파는 데얼커피 굿즈다. 저 에코백 진짜 너무 귀여웠는데 살까말까 하다 결국 안샀..😢 가격도 저렴했는데 살 걸 그랬다. 돌아서고 나니 조금 아쉽쟈나 😢 매장은 이런 모양. 매장 크기는 작은 편이다. 평소에는 웨이팅이 있다고 하는데 우리가 갔을 때는 비어있었다. 거의 마감시간이 다 되어 가기도 했다. 히히 우리가 시킨 음료! 저 컵도 너무 귀엽다. 캐릭터가 빼꼬미하게 있는게 귀여워🌝 나중에 내 방을 다시 인테리어한다면 나도 이런 소품을 가져다 꾸미고 싶다. 언제쯤 가능할까😔 마지막은 창밖을 바라보는 돼지 피규어로- 돼지 엉덩이가 너무 탐스러워 ‘_’ 다음에 데얼커피 또 가야지이 >_<! #연남동카페 #연남카페 #연남동커피 #데얼커피 #theircoffee #연남카페추천 #홍대카페추천 #연남동카페추천 #연남동 #데얼커피굿즈예뿌다"
[연남동] 데얼커피 ! 아기자기한 카페,"안녕하세요 은찌예요 오늘은 연남동 데얼커피 포스팅입니다 이날따라 가려던 곳이 문을 다 닫아서 근처 찾다가 들어간 곳인데 알고보니 사람들이 꽤 많이 찾는 카페더라구용! 아기자기하게 꾸며 놓은 작은 카페였어요 :) 카페 가기 전 밥을 먼저 먹어줘야쥬?! 역시나 연남동을 갔기에 동차밥을 들렀어요! 연어덮밥은,, 맛있기는 하지만 예전만큼의 감동은 조금 없어졌어요 ㅠㅠ 그래도 새우마요는 아직도 너무 맛있어서 종종 생각이 나는 곳이에요 사실 따로 포스팅은 안 했었는데! 예전에 새우마요 포장해서 먹었었거든요! 진짜 최고,,!! 동차밥은 사이드만은 포장 안되고, 메인을 주문해야 사이드 포장 가능합니다! 전 새우마요를 먹기 위해 그 날엔 돈까스를 포장해서 갔다지요,, 하하 쨌든!! 오늘 메인 포스팅인 카페로 후다닥 다시 돌아와볼게요오 데얼커피는 약간 반지하에 위치해 있더라구요! 너무 추우니 얼른 들어가봅시다! 내부가 생각보다는 협소했어요 남자분과 여자분이 함께 운영하시는 곳이었는데 그래서인지 저 귀여운 여자, 남자 얼굴 그림이 여기 데얼커피 로고인가봐요 :) 한쪽에서는 로고가 박힌 제품들도 조금 판매하고 있네요 우드톤의 테이블로 구성되어 있었던 카페 내부였어요! 손님들이 조금 있어서 내부 사진은 따로 찍지 않았습니다! 음료 메뉴판 첨부할게요 요즘 크림커피에 꽂혀있어서 여기 시그니처 음료인 바닐라빈 크림이 얹어진 데얼커피를 주문해서 마셔보고 싶었는데 늦은 저녁에 간거라 잠 못 잘까봐 그냥 우유를 주문했어요!! 우유도 종류가 정말 많더라구요 우유 음료는 미리 만들어져 병에 담겨있었어요 로얄밀크티, 초코, 말차, 흑임자, 딸기 등등 저는 이 중에서 병모양이 젤 귀여웠던 딸기우유를 선택! 간단한 디저트들도 준비되어 있더라구요! 티라미수 같은 경우에는 주문과 동시에 만들어 준다고해요! 짜라란 생각보다 귀여운 비주얼이네요 딸기우유, 캐모마일 티, 티라미수 레이디핑거 쿠키로 만들어 진 티라미수더라구요! 커피도 적당히 촉촉하게 잘 머금었고 크림도 넉넉하게 얹어줘서 무난하니 괜찮았어요 :) 위에 빨간 체리가 하나 딱 얹어지니 뭔가 되게 귀엽더라구요 포크도 여기 컨셉과 잘 어울리는 작고 동글한 모양이었습니다 워낙 티라미수를 좋아해서인지 맛있게 먹었어요 :) 그 다음은 제가 주문한 귀여운 딸기우유! 저 미니우유 통을 몇 개 사고싶어서 인터넷 알아보고 있는 중이에요! 사서 어디어 쓸지는 사고나서 고민해 봐야겠어요 친구가 따르는 거 동영상 찍어 준다고 해서 느낌있게 잘 따르고 싶었는데,, 하하 쉽지않네요 생딸기우유는 정말 딱 아는 그 맛! 인위적으로 너무 달지도 않고 그냥 우유와 생딸기가 가득 들어있는 맛이라 남녀노소 다 좋아할 것 같아요 :) 미니 나무 숟가락도 함께 줘서 딸기는 저걸로 퍼먹었어요 역시 딸기철에는 딸기 관련 음료나 디저트를 꼬옥 먹어줘야해요! 아참 그리고 음료 양이 생각보다 많더라구요! 엄청 기억에 남는 곳은 아니었지만 그렇다고 또 맘에 들지 않은 부분도 없었던! 아기자기한 데얼커피 후기였습니다 :) 궁금하신 분들은 나중에 한번 방문해보세용 ㅎㅎ 데얼커피 서울특별시 마포구 연남로3길 23 지2호 By. 딸기우유 통이 너무 맘에 든 은찌"
[연남동 카페추천 “데얼커피”],안녕하세용 오늘은 수진이랑 함께 카페투어를 했던 염남동에 귀여운 카페 소개해드릴게요! 데얼커피 서울 마포구 연남로3길 23 지2호 수진이는 자몽에이드 저는 아아 그리고 이 카페의 주인공!! 티라미슈를 주문했어요 귀여운만큼 맛도 최고!! 티라미슈랑 아아의 조합 잊지못해요 ㅠㅠ 완전 굿! 수진이랑 카페 어디갈지 찾아보고 있는도중 티라미슈가 너무 맛있게 생기고 컵도 너무 귀여운 카페가 눈에 확! 들어오더라구요 그래서 당장 고고!! 저희가 앉았던 자리에서 찍은 풍경인데 마치.. 외국에 나와있는듯한 이 분위기..!! 정말 넘 예뻤어요 ㅎㅎ 가게 내부에 아기자기한 소품들도 많고 깜빡하고 메뉴를 찍지 못했지만 ㅠㅠ 디저트 종류들도 귀여운게 많았어요! 재방문 의사 100% 제가 마신 아메리카노 색이 진해서 그림이 안 보였는데 마시다 보니 그림이 뿅! ㅎㅎ 귀여워서 다시 카메라를 들게 되었네요 아기자기한 매력과 예쁜 풍경이 돋보였던 연남동 분위기 맛집 데얼커피였습니당! 데얼커피 서울특별시 마포구 연남동 566-19 지2호 #홍대카페추천 #연남동카페 #연남동예쁜카페 #홍대카페투어 #연남동놀곳 #홍대놀곳 #데얼커피 #연남동데얼커피 #홍대티라미슈맛집 #티라미슈
연남동 카페 : 데얼커피,"올만에 연남동 친구들과 피크닉 즐기러 미리 예약해둔 데얼커피 피크닉세트 픽업하러 총총 두시 예약해서 딱 맞춰서 도착 ! 귀여운 소품들 파우치 짱 귀엽 그리고 대망의 피크닉세트 가까운 공원에 돗자리깔구 착석 너무 귀엽다며 감탄연발 매달 피크닉세트 바뀐다고 하는 ㅎㅎ 얼마안남은 6월 이번달 구성 개봉 바게트샌드위치, 소세지에그마요모닝빵, 감자샐러드, 찹쌀떡꼬치, 미니와플, 과일, 자몽주스, 망고주스 피크닉매트만 준비해가면 끝 ! 들고 근처 한강으로 가두 좋을듯한 ㅎㅎㅎ 피크닉세트는 매장에서 못먹어서 담엔 커피만 마시러 다시 가봐야지.. 데얼커피 서울특별시 마포구 연남동 566-19 지2호"
연남동 카페 _데얼커피,오랜만에 친구랑 데이트 하는 날! 너무 심심하다고했더니 평일 반차를 쓰고 저랑 놀아주기로했어요 ㅎㅎㅎㅎ 그렇게 어디서 놓까 하다가 인스타에서 항상 눈여겨보던 카페로 고고 데얼커피 주택가 사이에 있어서 찾는데 좀 애먹음😅 들어오자마자 자리잡고 바로 주문!! 저는 얼.죽.아 이므로 이런 핫플에 와도 무조건 아아 칭규는 밀크티를 시켰어요 데얼커피가 유명한 이유는 바로 마스코트의 귀여움 때문이 아닐까 싶어요 ㅎㅎ 손으로 직접 그려서 만든거라 더 매력적😆 각종 굿즈들도 팔아요! 가게가 큰편이 아니라 조금만 지나니 바로 만석... 주말도 아니고 평일 오후인데 왜인거져 ㅋㅋㅋㅋㅋㅋ 역시 인기있는곳 인정👍 주문한 메뉴 등장 살짝 출출해서 앙버터랑 쿠키도 같이 시켰는데 너뮤나 잘한 선택🤎 귀여워서 먹기 힘들었던게 함정 ㅋㅋㅋ 잔마다 데얼커피 캐릭이 그려져있는데 집에 가져가고싶을 정도로 예뻤어요 ㅋㅋ 한창 수다 떨고 나오는 길에 발견한 뚱냥이 ㅎㅎ 데얼커피 사장님께서 키우시는 것 같아요 아무리 사진찍어도 반응이없다.... 담에 평일에 연남동에 놀러온다면 또 오고싶은 곳😍 영업시간 매일 12:00 - 21:00  목요일휴무 데얼커피 서울특별시 마포구 연남동 566-19 지2호 #데얼커피 #연남동데얼커피 #연남동 #연남동카페 #카페추천 #theircoffee #연남카페추천 #홍대 #홍대카페추천
연남동 카페 ‘데얼커피(their coffee)’ 리뷰,"골목골목에 핫 스팟 투성이인 연남동! 그 중 눈에 띈 ‘데얼커피’을 가보았습니다. 데얼커피 their coffee 데얼커피 서울특별시 마포구 연남동 566-19 지2호 위치는 여기입니다. 연트럴파크 근처! 처음에 입구를 못찾아서 조금 헤맸는데 이렇게 갬성 폭발인 표지판이 있더라구요. 그래서 고개를 돌렸더니 비밀의 입구가! 짠! their coffee 안으로 들어가볼까요? 가게 내부는 이렇게 편안하고 아늑한 느낌이에요. 곳곳에 붙은 엽서가 포인트! 인테리어 감각 미쳤다...! 너무 귀여운 굿즈 팔고 계셔서 살까 말까 백번 고민했어요 🐶🐱 직접 그리신 굿즈라고 하더라구요! 진짜 이런 그림체 최고..너무 귀엽우다 ㅜ__ㅜ 일단 메뉴를 고르기로!! 전체적으로 저렴하지는 않은 가격대인듯..! 디저트는 이렇게 있었습니다. 우리는 앙데얼쿠키(앙버터쿠키)를 먹기로! 약간의 기다림이 지나고 메뉴가 나왔습니다! 제가 시킨 건 멜론크림소다! (6500원) 친구가 시킨건 말차보틀우유 (6500원) 전반적인 맛은 그냥 그랬습니다... 멜론크림소다는 위에 올라간 아이스크림은 괜찮았지만 음료가 너무 설탕물 + 색소,향료 맛이었어요. 말차우유는 그렇게 진하지도, 맛있지도 않은 맛.. 녹차가루가 많이 있기는 하는데 녹차의 비린 맛도 그대로고.. 집에서 우유에 녹차가루 잔뜩 뿌리고 설탕 넣은 맛이었습니다. 그래도 요 데얼쿠키는 맛났습니다 :) 뽀각 반 쪼개서 냠냠 먹었는데 살짝 눅눅한 쿠키와 팥, 버터의 조합이 좋았어요. 앙버터 스콘, 빵은 많이 먹었어도 앙버터 쿠키는 처음인데 잘 어울리네요 ! 영업시간은 12:00 - 21:00 입니다. 목요일 휴무라고 하니 참고하세요. 이 포스팅은 제가 직접 사먹은 솔직한 리뷰입니다. #연남동카페 #연남동데얼커피 #데얼커피 #홍대카페 #theircoffee #연남동아기자기한카페"
