title,content
연남동 카페 테라스와 디저트가 다양한 마가렛 연남,"연남동 카페 테라스와 디저트가 다양한 마가렛 연남 안녕하세요. 귤이에요. 친구와 연남동 소품샵투어를 하다가 생각보다 홍대말고도 연남동에도 소품샵이 많아 다리가 아프더라고요. 그래서 찾은 카페인데 케이크, 구운과자가 다양하고 주택개조카페로 테라스도 있어 요즘 같은 좋은 날씨에 가기 좋은 카페라 소개해드릴께요. 마가렛 연남 독특한 케이크도 구움과자도 달다구리한 디저트 좋아하신다면 요곳도 좋아하실 것 같아요. 공간이 여러공간으로 나누어져서 취향에 따라 앉기 좋은 곳이에요. 위치: 서울특별시 마포구 성미산로 29길 10 1층 마가렛 연남 서울특별시 마포구 성미산로29길 10 1층 영업시간 매일11:00-22:00 포장, 무선인터넷, 반려동물 동반 외관&인테리어 연남동 주택개조카페이니만큼 주택가에 있고, 외부에 자리가 곳곳에 있고 1,2층 모두 똑같은 카페이더라고요. 2층도 테라스에서 커피를 즐길 수 있었어요. 1층은 물뿌리개와 화분이 디피되어 있었어요. 들어가니 이미 많은 분들이 찾아주셔서 이미 빈 디저트도 있고, 그렇지만 정말 많은 디저트가 있어 디저트러버라면 결정하기 어렵겠더라고요. 1층에도 자리가 있는데요. 통창에 우드톤 자리라 환해보이는거 있죠? 화장실도 있었어요. 2층에도 자리가 있어 올라갔는데요. 감성감성한 통창을 배경으로 하는 노란쿠션과 테이블 독특한 모양을 가진 컵과 조형물이 있고 화초가 있었어요. 옷을 걸어놓을 수 있는 옷걸이까지 트렌디하다는 생각이 드네요. 큰 홀같은 공간은 저런 좌석이 있고 테라스로 나가는 문쪽은 요런 형태의 테이블이 있어요. 포스터북도 감각적으로 놓여있어 공간공간 인테리어 포인트 찾는게 재밌더라고요 셀프바는 2층테라스자리있는 공간에 있었어요. 3인이상은 요 의자를 사용해서 앉을 수 있도록 되어있었어요. 저희가 앉은 곳인데요. 2층 화장실 옆쪽은 초록색테이블에 노란색라인, 파란색으로 된 앉는 자리 요렇게 있어요. 그 자리는 올라오는 곳이 보이면서도 화초가 있어 분위기가 뿜뿜했어요. 메뉴판 자리를 잡고 디저트와 음료를 주문하러 갔어요. 아메리카노 5,000원 헤이즐넛 아메리카노 5,500원 카페라떼 5,500원 카푸치누 5,500원 바닐라라떼 6,000원 카라멜라떼 6,000원 헤이즐넛라떼 6,000원 콜드브루 5,500원 콜드브루라떼 6,000원 아인슈패너 6,500원 아쌈밀크티 7,000원 말차밀크 6,500원 초코밀크6,500원 허니자몽블랙티6,500원 로즈힙 히비스커스 6,000원 루이보스바닐라 6,000원 캐모마일 허니 6,000원 레몬진저티 6,000원 청귤페퍼민트티 6,000원 마르코폴로 7,000원 바질토마토에이드 7,000원 레몬베리에이드 7,000원 청포도에이드7,000원 패션후르츠에이드 7,000원 (포장은 1,000원 할인) 음료는 요렇게 있고 메뉴판에 논카페인 표시가 있어 메뉴를 고르기 용이한 연남동 카페였어요. 구운과자류가 정말 많아서 뭘 먹어야 할까라는 생각이 들더라고요! 케이크도 12종류에 바나나푸딩까지 정말 많더라고요. 대표메뉴인 큐브파이는 12시가 나오는 시간이라고 해요. 저희는 구운과자류에 있던 수플레치즈케이크와 멜론우유케이크를 함께 나누어 먹기로 했어요. 치즈케이크속 머랭을 넣어 보들보들 사르르 녹는 치즈케이크라고 해서 궁금해지더라고요. 아메리카노 5,000원 초코밀크 6,500원 수플레치즈케이크 7,000원 멜론우유케이크 8,500원 음료값도 디저트도 저렴하지는 않았어요. 아무래도 1,2층 모두 있고 공간이 예쁘니깐이라고 생각했는데요. 빵과 케이크는 바로 받아서 가지고 갈 수 있었어요. 친구는 먼저 디저트들고 올라가고 저는 음료들고 올라가기 위해 기다렸어요. 음료가 나오고 야외테이블에서 찍었는데 모기만 아니였으면 예쁜 연남동카페 테라스에서 마시기 좋을 것 같아요. 분위기 좋은 카페에요. 식사 올라와서 보니 멜론우유케이크는 민트한 크림에 멜론 한 티스푼정도가 데코되어 있고 우유크림 사이사이 멜론이 들어가있었어요. 수플레 치즈케이크는 크림위에 딸기가 얹어져있고 퐁신해보이는 치즈빵이 딱 있었었어요. 마셔봤는데요. 제가 주문한 아메리커노는 솔직히 물맛이 더 강하더라고요. 연하더라고요. 다른 곳보다 커피가 비싼데 연해서 조금 아쉬웠어요. 친구가 마신 초코밀크도 just 제티맛이라 초코라떼 러버인데 아쉬웠다고 했어요. 다른 음료는 어떨지 궁금라네요. 수플레치즈케이크는 부드럽긴 한데 수플레보다는 살살 녹는 치즈케이크 정도인 것 같아요. 수플레라고 해서 기대했는데 그냥 기대없이 부드러운 치즈케이크라고 생각하면 될 것 같아요. 전반적으로 가격대가 있어 고민하다가 주문했는데, 전체적으로 비쥬얼이 예술이니 맛있겠다 싶었어요. 더군다나 생멜론이 틈틈히 들어가니깐여! 부드러웠어요. 생멜론은 참외맛이 나서 조금 당황스러웠는데 우유크림과 먹으니 괜찮았어요! 근데 먹다보니 느끼하고 물리더라고요. 디저트를 1인 1디저트해서 그런거 같기도 하고. 전체적으로 아쉬웠어요… 총평 연남동 카페 마가렛 연남에 다녀왔는데요. 주택개조한 카페로 테라스에서 날씨를 즐길 수 있는 곳이었어요. 다양한 디저트가 있는데, 특별한 날 먹을 수 있는 케이크도 있었어요. 가격대가 있고, 다양한 디저트가 있어요. 다양한 디저트를 고르고 싶다면 한번쯤 가볼 만 한 것 같아요."
연남동 카페 마가렛 연남 바나나푸딩 디저트 맛집,"연남동 카페 마가렛 연남 바나나푸딩 디저트 맛집 오랜만에 친구랑 연남동 핫플 깨기 ! 분위기 좋고 디저트도 맛있는 곳을 찾다가 #마가렛연남 가보자며 다녀왔어요 💛 우연히 먹어보고 반해버린 바나나푸딩 디저트 맛집이었음 히히 마가렛 연남 📞전화번호 0507-1382-6412 ⏰영업시간 11:00 ~ 22:00 Ⓜ️홍대입구역 3번 출구 757m (11분) Ⓜ️가좌역 4번 출구 910m (14분) 🚗주차 불가 상아색 외관으로 아늑한 느낌이 뿜뿜하는 연남동 카페 마가렛연남은 주택을 개조해서 마당과 테라스 감성이 넘 좋은 곳이다 ! 급 추워져서 한동안은 테라스에 못 앉겠지만 푸릇푸릇한 마당이 예뻤던 공간 🌿 출처 @cafe.margaret 인스타그램 지금은 이렇게 마당에 큰 트리가 설치됐다고 하니 연말 크리스마스 분위기 물씬 날 듯하다🎄✨ 여기는 1층 주문하는 공간인데 연남동 디저트 맛집답게 귀엽고 예쁜 빵들이 한가득이라 일단 신났고요 ~~ 천장이 낮은 주택개조 카페다 보니 살짝 반지하같은 느낌이 들었던 건 안비밀.. ㅋㅋ 어디 앉을까 살펴보는데 1층 자리는 생각보다 어둡고 테이블도 빼곡하니 사람이 꽉 차면 좀 답답할 것 같아서 패스하고 외부 계단을 통해 2층으로 gogo 〰️ 2층은 큰 거실과 방이 있는 구조라서 좌석이 좀 더 여유 있었다! 테라스석은 4개뿐이라 눈치게임 필수였는데 다행히 한 팀이 바로 일어나서 명당 차지했다 꺄항 주문하기 위해 다시 1층으로 ! 요기서 원하는 접시에 디저트를 담고 음료와 함께 주문 & 계산하면 된다 연남동 마가렛 디저트들은 하나같이 넘 귀여워서 일단 사진부터 찍고 보자며💕 스콘과 큐브파이가 유명한 마가렛 연남 디저트 테이블을 몇 바퀴 돌면서 고민했는지... 친구는 달달구리를 그닥 안 좋아해서 원래 하나만 먹을 생각이었는데 급 마음이 바뀌었고요.. ㅋㅋㅋㅋ 헤헷 이날 내가 먹고 반한 바나나푸딩과 케이크도 쇼케이스에 가득 진열돼있다 ! 가격은 조각케이크 8천원대로 살짝 높은 편 연남동 카페 마가렛 음료 메뉴 디저트 카페라서 그런지 커피 메뉴는 딱 기본적인 라인으로만 구성돼있고 tea 종류가 디카페인까지 꽤나 다양하다 우리는 빵 2개와 아메리카노 2잔 주문 완 ! 본격적으로 우리가 주문한 연남 카페 마가렛의 시그니처 디저트를 소개해 드릴게요 🥰 1. 아메리카노 5,000원 난 아아, 친구는 뜨아로 마셨는데 아이스커피 양이 넘나 적어 깜놀.. 힝 다른 테이블을 보니 내가 받은 커피보다 컵도 크고 양도 많던데.. ㅠㅠㅠ 커피 맛은 산미 없어서 괜찮았지만 디저트랑 먹으려고 아껴서 홀짝대다 보니 나중엔 너무 연해져서 아쉬웠다 (아아인데 에스프레소 1샷만 들어간건가 싶기도 하고) 2. 바나나푸딩 7,200원 흔히 먹던 푸딩의 몽글한 식감이 아닌 크림 케이크 같은 느낌이라서 오히려 좋았던 바나나푸딩 🍌 은은하게 달콤한 바나나맛 크림과 슬라이스 된 바나나도 들어가 있고 바삭바삭 사브레 맛 쿠키까지 한 번에 퍼먹으면 부드럽고 꼬소하니 넘나 맛있다 떠먹는 케이크처럼 야금야금 먹다 보면 어느새 바닥 긁고 있고요 ㅋㅋㅋ 히히 생각보다 안 느끼하고, 많이 달지 않아서 좋았다 ! 3. 리얼초코 큐브파이 6,100원 72겹 페스츄리 안에 크림이 가득 들어간 마가렛 연남의 시그니처 큐브파이 속은 부드러워서 예쁘게 안 잘림 주의 ^_^ 빵은 겉바속쫄깃해서 맛있었고 초코도 생각보다 많이 달지 않았지만 평범한 초코맛이라서 바나나 푸딩만큼의 큰 메리트가 느껴지진 않았다 ~ 테라스는 반려견 동반이 가능한 곳이라 생파하는 댕댕이 보며 힐링하기 🤎 (허락받고 찍음 !!! ㅋㅋㅋ) 스콘, 큐브파이, 케이크 맛별로 다양한 연남동 디저트 카페 찾으신다면 맛있는 바나나푸딩 드시러 방문해 보세요! 마가렛 연남 서울특별시 마포구 성미산로29길 10 1층"
연남동 카페 마가렛 연남 디저트가 가득했던 2층집,"연남동 카페 마가렛 연남 디저트가 가득했던 2층집 오늘은 얼마전 혜윰님과 함께 다녀오고 친구도 함께했던 연남동 카페 마가렛 연남에 대해 가볍게 포스팅하도록 하겠다. 이날 혜윰님과 저녁을 먹고 후식으로 카페를 찾아서 방문하는데 인터넷으로 스윽 찾아서 여기 가볼까? 이렇게 즉흥적으로 방문한 곳이다. 그리고 우리가 있는 동안에 친구도 여기로 와서 같이 놀다 온 곳.ㅋㅋㅋ 그럼 주인공 소개도 했으니 얼른 본론으로 넘어가보자. 본론으로 고!고! 마가렛 연남 서울특별시 마포구 성미산로29길 10 1층 먼저, 연남동 카페 마가렛 연남의 위치를 지도에 표시해 위에 첨부하니 그 위치를 참고하면 되겠다. [위치] 도로명 주소 서울 마포구 성미산로29길 10 지번 주소 서울 마포구 연남동 240-49 우리는 인터넷으로 찾아 지도를 보고 편하게 방문할 수 있었다. 이동네는 사실 거의 로컬이라 지도만 보면 80~90프로 한 번에 찾아서 방문하는 것 가능.ㅋㅋ 지도 보고 혜윰님 모셔다가 갔지.ㅋㅋ 그렇게 지도에 표시된 곳에 도착하면 위 사진처럼 주택이 리모델링 된 느낌으로 연남동 카페 마가렛 연남이 위치한다. 그럼 카페 앞에 도착했으니 카페의 기본적인 정보도 정리해서 함께 공유하도록 하겠다. [영업시간] 매일 12:00 - 22:00 [연락처] 070-8666-0559 [기타사항] 제로페이, 포장, 무선 인터넷 이정도로 정리할 수 있겠고 이곳의 방문느낌으로는 디저트가 다양하게 있고 인스타갬성인 카페인 것 같다. 디저트 전문점 느낌?ㅋㅋ 그럼 이렇게 체크하고 얼른 본론으로 가보자고~ 그렇게 카페안에 들어와서 적당한 자리에 착석. (2층에 자리를 잡았다) 그렇게 다시 1층으로 내려와서 다음은 연남동 카페 마가렛 연남의 메뉴판. 메뉴, 가격, 구성을 참고하면 된다. 이날 우리가 주문한 메뉴는 아이스 아메리카노 2잔. 친구는 또 알아서 주문. 그렇게 음료를 기다리면서 연남동 카페 마가렛 연남 구경. 내가 아까 디저트 전문점이라고 했던 이유가 위에 보이는 것처럼 상다리 부서질 정도로 다양하고 예쁜 디저트들이 많더라. 우리도 처음 방문하는 것이라 어느 디저트가 시그니처인지 이런건 따로 모르겟지만 종류가 다양하고 먹어보고 싶더라..ㅋㅋ 특히 저기 녹차가루인가? 녹색에 빨간 포인트. 저거 색감 왜이렇게 좋냐.ㅋㅋㅋㅋ 인스타 갬성이야 맛보다도.ㅋㅋㅋ 우리가 밥을 너무 많이 먹고와서 먹을 배가 없다는 것이 쬐금 아쉽긴 했지만 일단 이렇게 알 수 있었다. 공유. 그렇게 음료를 받고 다시 2층으로 올라와서 착석. 그리고 다음은 연남동 카페 마가렛 연남 구경. 음료를 기다리면서 1층이나 2층으로 올라와서 정경이나 손님이 없는 부분으로 촬영했고 2층 우리가 앉었던 곳은 시간이 흘러 친구랑 있다가 카페를 나설 때 쯤 손님이 다 빠지고 없길래 참고용으로 촬영해봤다. 인테리어 전문가는 아니지만 그래도 현장에 종종 다녔던 내가 스윽 인테리어를 봤다. 다들 2,3인 작은 테이블이 많고 (자리이동 안 되고, 간의 의자 사용해야함) 2층 홀 넓은 테이블은 합판에 다리만 연결해서 뚝딱뚜딱 만든 친구들이다. 그래서 팔을 올려두니 흔들흐들 불안하더라. 기본적으로 인테리어에 큰 돈을 들이지 않고 깔끔하게 디자인한 느낌. 예쁘기야 충분이 예쁜데 역시 개인 카페라서 내 렙탑으로 일하긴 힌들 듯. 간단히 렙탑 하나만들고 간단 업무정도는 모르겠다. 어차피 나는 폰으로도 하니까~ 회전률과 예쁨. 가격을 고려한 인테리어인 듯. 크게 나쁘지 않았다. (깔끔) 그리고 연남동 카페 마가렛 연남의 커피. 아까 받아서 가지고 올라왔지. 잔이 인상적이게 생겼더라고.ㅋㅋ 가볍기도 엄청 가볍고~ 커피맛은 우리가 대충 아는 씁쓸한 커피인데 체인보단 심히자 않은~ 그런 느낌이 커피였다. 그래서 나는 디저트 전문점이라고 생각하는 것. 이정도 커피면 그냥 홀짝 마시면서 토킹하기 괜찮지.ㅋㅋㅋ 그렇게 연남동 카페 마가렛 연남에서 혜윰님, 친구와 함께 소소하게 힐링하고 돌아왔다. 분위기가 좋아서 1층 야외에는 손님도 많았고 2층 테라스 쪽에 인기 많았던, 분위기 좋았던 곳이다. 재방문도 나쁘지 않지만 근처 또 봐둔 카페가 있어서 혜윰님과 거길 갈 듯.ㅋㅋㅋ 그럼 이렇게 포스팅을 마무리하고 다음 시간에 또 다른 이야기로 부지런히 찾아오도록 하겠다. #연남동카페 #카페 #홍대카페 #커피 #마가렛연남 #마가렛 #디저트 #아이스아메리카노 #카페탐방 #분위기 #데이트"
서울 연남동 예쁨&감성 뿜뿜 분위기 좋은 베이커리카페 마가렛 연남!,"홍대입구역 카페, 마가렛 연남 햇살 맛집, 매장 모든 곳이 다 예쁜 연남동 핫플 감성 카페 외관부터 내부까지 모든 게 다 예뻐요♡.♡ 오늘은 연남동에 있는 모든 곳이 다 예뻤던 카페! 마가렛 연남 후기 남겨볼게요~ 마가렛 연남 서울특별시 마포구 성미산로29길 10 1층 기본 정보 · 주문메뉴 : 수플레치즈케이크(7,000원), 아이스아메리카노(5,000원,디카페인+500원 추가) · 주차 : 골목이라 딱히 없어 보여요! · 예약 : 홀케이크 예약 가능!(네이버예약) · 영업시간 : 매일 11:00~22:00 · 특이사항 : 노키즈존! 매장 취식 시 1인 1음료 주문! 외관 외관부터 취향 저격 지나가는 길에 외관 보자마자 카페는 무조건 여기 가야 된다고 ㅋㅋㅋㅋㅋㅋㅋㅋㅋㅋㅋ 취향 저격 카페 들어가 볼게요~🏃🏻‍♀️ 야외에 테이블도 이렇게 있어요! 분위기 장난 아니죠?_? 입구 바로 옆에 있는 테이블과 의자 색감 조합이 아주 좋아요❤️ 2층으로 올라가는 계단 옆에는 예쁜 포토존&테이블! 제가 진짜 좋아하는 능소화까지! 💛💛굳굳굳💛💛 내부 인테리어, 2층 색감이 미친 2층 인테리어♡짱예쁨 2층 들어가자마자 보이는 모습 파스텔 노랑 쇼파+민트&우드 가구 +초록 플랜트 색 조합 완벽 색 조합이 마치 호크니 느낌✨ 창밖으로 보이는 파란색 울타리+포스터까지 의도치 않게 또 엄청난 색 조합 맛집 마가렛 ㅋㅋㅋㅋㅋㅋㅋㅋㅋㅋㅋㅋㅋㅋㅋㅋㅋㅋㅋㅋㅋ 색 조합에서 호크니 느낌이 난다 싶었는데 호크니 작품 포스터가 매장에 걸려 있네요! 박수 쳤던 야외 테라스 그리고 초록&노랑&파란색 조합 공간! 👏🏻👏🏻👏🏻👏🏻👏🏻 주택을 개조한 카페라 같은 층이어도 공간 여러 개가 분리된 느낌인데, 분리된 공간들마다 느낌이 달라서 취향에 따라 골라서 앉으시면 될 것 같아요! 휴지랑 물, 종이컵이 놓인 것도 느낌 있는 마가렛 연남ㅋㅋㅋㅋ 내부 인테리어, 1층 빵 냄새 가득한 따스한 느낌의 1층! 마가렛 입구 들어가 볼게요=3 화려한 식물들이 눈에 띄네요🤩🤩 빵 냄새 가득~~ 먹어보고 싶은 빵들이 잔~뜩😋 귀여운 등&흐릿하게 보이는 마가렛 포스터 느낌 굿❤️ 화장실 입구도 센스가 돋보여요~ 겸둥이 강아지 포스터와 식기류 셀프 코너도 예쁩니다~ 메뉴판 다 먹어보고 싶어요ㅠㅠ 엄청난 비주얼의 베이커리들! 와..다 먹어보고 싶어요ㅠㅠ 케이크 종류도 많아요~! 음료 메뉴판! 생일 초도 팔고 있어요~ 슬러시 기계도 있어요! 커피&디저트 타임 힐링~_~ 야외 테이블에 앉아 커피&수플레케이크 먹어볼게요~ 아이스아메리카노(5,000원) 디카페인으로 변경 +500원, 샷 추가 +500원! 포장하면 1,000원 할인! 디저트랑 먹기 좋은 깔끔하고 적당히 산미 있는 커피 맛이었어요! 수플레치즈케이크(7,000원) 배가 부른 상태로 방문한 카페이지만 디저트는 그냥 지나침 불가 ㅋㅋㅋㅋㅋㅋㅋㅋㅋㅋㅋㅋ 궁금했던 수플레치즈케이크 시켜봤어요! 비주얼이 완전 귀요미ㅇㅅㅇ 수플레&크림은 적당히 부드러워서 커피랑 마시면 입에서 살살 녹는 맛~ 상큼하고, 고소하고, 달달하고 다 했던 맛있었던 수플레 치즈케이크! 마가렛 연남 입구 포토존에서도 찍어봄>_< 잘 먹었습니다 😋😋😋😋😋 1. 매장이 진짜 예뻐요!!!!!!! 인테리어 보는 재미가 엄청남>_< 2. 베이커리 종류가 다양해요! 3. 진짜 신기하게! 카페에! 충전 돼지가 있어요~~~~ 야구장에서만 보던 보조배터리 대여 기계가 마가렛 연남에도 있습니다!!! 배터리 걱정 없이 커피 즐기기 가능>_< 4. 내부에 화장실도 당~연히 있어요! 5. 반려동물 테라스 이용 가능! 1. 골목이라 주차공간이 따로 없어요ㅠㅠ 2. 노키즈존이라 아기랑 같이 실내 커피타임은 불가능ㅠㅠ 3. 평일에도 핫플! 사람이 많아요ㅠㅠ 눈으로 즐기고 입으로 즐기는 예쁘고 맛있었던 마가렛 연남 잘 먹었습니다^_^"
