title,content
연남동 카페 | 디저트 천국 요즘 날씨에 가기 딱 좋은 마가렛(Magaret) 연남 솔직후기,"퇴사한 친구 만나러 오랜만에 연남동 나들이 (งツ)ว ෆ⃛ 연남동 예쁜곳 천국인데 은근 잘 안가게 되는,,,, 가고싶은 카페가 많았디만 추리고 추려서 마가렛 연남에 다녀오기로 했다 🫶🏻 마가렛 연남 매일 12:00 - 22:00 창문에 구름 비치는거 미쳤다 🥹 날씨 너무 좋은 날에 방문해서 행복 만땅이었음 친구가 1시 조금 넘어서 자리를 잡아줬어서 내부에 쾌적한 자리 착석 😇 2층 야외자리도 좋아보였지만 친구가 생각보다 휑했다고 했다 ! 입구부터 매우 깰꼼쓰했던 …★ 정면에서 보는 카페가 너무 예뻤는데 사람이 너무 많아서 사진찍기 실패🥲 들어오자마자 펼쳐지는 베이커리 천국 … 😇 사실 이렇게 베이커리 죄다 오픈해서 깔아두는거 위생상 별로긴한데 비주얼 마케팅으로는 진짜 최고다 이거야,,, 마스꾸 끼고 다니니까 망정이지 안 낀다고 생각하면 진짜…^^ 그래도 맛있어보이니까 용서(어쩌라고 친구한테 인사하고 냅다 커피 시키러 옴 친구가 케이크 먹고 싶다구 해서 우리는 쇼케이스 안에 있는 케이크 중에 골라서 주문했다 ㅎㅎ 논커피 음료가 많긴했지만 나는 피스타치오 처돌이이기 때문에 ✅ 피스타치오크림라떼 ✅ 자몽 얼그레이 케이크 주문 !!!! 내가 앉았던 자리 ㅎㅎ 통창이라서 바깥이 다 보여서 민망쓰할수도 있지만 답답하지 않아서 좋았다 비 오는 날 앉아도 좋을 것 같은…🥹🫶🏻 요즘엔 트레이 컬러가 예쁜게 정말 많이 나오는 것 같다 친구는 먼저 와서 라떼를 먹고 있어서 음료잔만 받아왔다 피스타치오 크림이라니,,,, 진짜 천재 아니냐고,,,, 피스타치오 향 엄청 찐하게 나고 고소한 맛 최고임 👍 당충전 확 되는 피스타치오 라떼위에 고소한 피스타치오 크림이 올라가서 조합이 너무 좋았다 💚 케이크는 고민하다가 베스트 2 메뉴였던 자몽 얼그레이 케이크로 주문했는데 얼그레이향이 좀 더 진하고 자몽이랑 어울리는 느낌은 딱히 못받았다 ! 케이크 종류가 엄청 많았는데 굳이 베스트 메뉴에서 고를 필요 없고 먹고싶은거 고르면 될듯 뭔가 심플한듯 아기자기한 느낌 공간마다 분위기가 약간 달랐는데 나랑 친구가 머물렀던 곳은 깰꼼쓰한 느낌 2층 테라스쪽은 친구가 자리 잡을때 올라가봤는데 생각보다 휑했다고 했지만 밖에서 봣을땐 여유로워보이고 좋았음 카운터 옆쪽에 있는 방도 아기자기하니 예뻐서 굳굳 음료나 디저트 가격은 비싼편이긴 하지만 돈내고 먹기 아까운 맛은 아니었다 ! 특히 피스타치오 크림 라떼 강추👍🫶🏻 요즘처럼 하늘 맑고 청량할때 가기 딱 좋은 카페라서 연남동 갔을때 한번쯤 들려보길 추천하는 곳"
"햇살 맛집,, 연남동 디저트 카페 '마가렛 연남' 아쉬웠던 후기","안녕하세요! 저는 오늘 요즘 핫한 마가렛 연남에 다녀온 후기를 포스팅하려고 합니다 :) 마가렛 연남 연락처: 070-8666-0559 주소: 서울 마포구 성미산로29길 10 1층 홍대입구역 3번 출구에서 도보 8분 영업시간: 매일 12:00 - 22:00 포장, 무선 인터넷, 제로페이 마가렛 연남 요즘 인스타에서도 그렇고 핫한 신상카페인데요 ㅎㅎㅎ 저는 근처 골목에 진~~~~짜 운좋게 주차에 성공하고 걸어갔습니당 연남동은 다좋은데 주차할 곳이 마땅치않아,, 대중교통 이용하시길 흑흑 매장 외부 매장 외부입니다! 날 좋은 일요일 오후 방문했어용 여기 진짜 햇살맛집이라고 들었는데 진짜 햇살이 넘 따스하고 예뻤지모에요 ㅠ_ㅠ 인테리어 마가렛 연남의 가장 큰 장점인 인테리어 먼저 보고 가실게요오 :) 저 이제 사진 좀 잘찍는거같지않나요?ㅎ 인스타 감성 사진 너낌,, 살리고싶은데 정말 어려워요? ㅠ ㅠ 매장 내부 매장은 1층과 2층으로 구성되어있어용 요즘은 주택을 개조해서 만든 카페가 많은데 여기도 그런 카페였어요! 그래서 2층으로 올라가려면 외부로 나와서 올라가야합니동 여기는 1층입니다! 1층 좌석은 이만큼이었고 2층은 더 넓습니당 이렇게 안쪽 자리도 있고 신기한 구조의 자리들도 있었어용 이쪽이 제일 넓은 좌석이 있는 공간이었어용 이건 딱 2층 올라갔을때 보이는 내부 모습입니당 ㅎㅎ 아쉬웠던 점은 가장 하단에 설명해드릴게요,,, 메뉴판 메뉴판은 이렇습니당! 저희는 아메리카노를 가장 좋아하기때문에,, 오늘도 어김없이 아메리카노 두잔을 ㅎ 원두를 두개 중에 고를수있어요! 마가렛 연남 와이파이 비번 공유드립니다 :) 비밀번호 : margaret1! 입니당 ㅎㅎㅎㅎ 와이파이 짱 잘터져요! 접시도 넘 예뻤어욤 ㅎㅎ 그리고 디저트 카페답게 대망의 디저트들,,! 짠 ,, 도넛도 있구 스콘도 있었어용 :) 여기 디저트 카페로 소문나서 그런지 다들 디저트 한개씩은 꼭 주문하시더라구요 ㅎㅎ 케이크도 있으니 참고바랍니당! 디저트 넘 예쁘지 않나요 ㅎㅎㅎ 커피 제 커피는 비록 아니지만,, 저희 앞 분들이 주문하신건데 스으으을쩍 찍어봤어요?ㅎ 아인슈페너 느낌이에요 글고 제가 주문한 아메리카노입니당! 커피 넘 맛있었어용 얼음이 다른곳에 비해서 덜 들어간거같아요! 노트북으로 작업할게 있어서 좀 오래 머물렀더니 손님들 잠깐 빠졌을때 한장 찍었어욤 진짜 여기 햇살맛집 맞슴당,,, 따사로운 오후였어요 오랜만에 여유를 즐겼답니당 근데 여기 제기준 치명적인 아쉬웠던 점이ㅠㅠ 바로 좌석입니다ㅠㅠㅠ 의자가 너무 불편했어요,, 딱딱하고,,ㅠ 글고 옆테이블간 간격이 너무 가까워서 약간 답답한 느낌도 살짝 받았습니다,, ㅠㅠㅠㅠ 그래서 아쉬웠어요 ㅠㅠ엉엉,, 저는 편한 좌석의 카페를 극선호하는 주의라서 이점은 아쉬웠답니당 참고하셔서 방문하시면 좋을거같아요 1층과 2층 내부에 각각 화장실이 있어서 밖으로 나가지않아도 되서 이건 넘 좋았어욤ㅎㅎ 마가렛 연남 서울특별시 마포구 성미산로29길 10 1층"
"서울 연남동 분위기 좋은 핫한 카페 ""마가렛연남""",안녕하세요 보리보리쌀보리입니다🧡 오늘은 서울 연남동에 위치한 핫한 카페 마가렛연남을 소개해드릴게요 지금부터 포스팅 시작할게요~~ 마가렛연남 서울특별시 마포구 성미산로29길 10 1층 마가렛 연남 서울특별시 마포구 성미산로29길 10 1층 외부가 초록초록하고 연남동 걷다가보면 너무 이뻐서 한번씩 보게되더라구요🧡 인테리어가 이뻐서 찍어봤어용ㅎㅎㅎ 빵종류가 진짜 많지 않나요?!! 너무 예쁘게 생겨서 먹기 아까워요ㅠㅠㅠㅠ menu 저는 아이스아메리카노를 주문했답니당ㅎㅎㅎ 빵은 레몬컵케이크와 스콘을 주문했어요 스콘은 제스타일은 아니었어요🥲 퍽퍽하더라구요ㅠㅠㅠ 하지만 레몬컵케이크는 상큼하구 맛있었답니당ㅎㅎㅎ 아이스아메리카노입니당😊 잔도 이쁘더라구요ㅎㅎㅎㅎ 맛도 산미없이 맛있었어요 서울 연남동에서 핫한 카페 찾으신다면 마가렛연남 한번 방문해보세요💛
[서울/연남동] 외관부터 디저트에 반하는 카페 마가렛 연남,"홍대/연남동 외관부터 디저트에 반하는 카페 마가렛 연남 분위기 있는 외관과 다 먹어보고싶은 디저트가있는 연남동 카페 마가렛 :) 영업시간 : 휴무 : 전화번호 : 주차 : 반려견 동반 : 실내 동반X, 외부 테라스만 가능 마가렛 연남 서울특별시 마포구 성미산로29길 10 1층 🏠 마가렛 분위기 📋 마가렛 메뉴 이 사진을 유독 크게 찍은걸보니 이게 먹고싶었나봄 (체리 좋아..) 🍝 마가렛 맛 ✏️ 마가렛 리뷰 총평 분좋카 그잡채 아메맛은 평범 실내는 동반 안되서 너무 아쉬움 빨리 봄이 됐으면.. 마가렛 연남(@cafe.margaret) • Instagram 사진 및 동영상 팔로워 4,283명, 팔로잉 2명, 게시물 118개 - 마가렛 연남(@cafe.margaret)님의 Instagram 사진 및 동영상 보기 www.instagram.com"
"마가렛 연남, 홍대 연남동 디저트 카페 (아메리카노/로얄밀크티케이크/큐브파이)","얼마 전 오랜만에 방문한 #연남동 지난번 방문했을 때도 비가 많이 내렸는데 이번에 갔을 때 역시 비가 많이 내렸다😂 다른 점은 어느덧 여름을 지나 가을도 넘어가는 풍경이 알록달록해졌다는 것! 아무튼 이번에 반문한 #연남동카페 는? <마가렛 연남> #디저트 #맛있는 #연남동 #카페 #핫플레이스 마가렛 연남(@cafe.margaret) • Instagram 사진 및 동영상 팔로워 3,866명, 팔로잉 1명, 게시물 100개 - 마가렛 연남(@cafe.margaret)님의 Instagram 사진 및 동영상 보기 instagram.com 마가렛 연남 서울특별시 마포구 성미산로29길 10 1층 원래는 카페 근처 식당에 가고 싶어서 근방 카페를 찾아보다가 발견한 핫플! 식당도 괜찮았지만 메인을 두 개나 시켰는데 음료도 무조건 시켜야 한다고 해서 별로였다😒 (다신 가지 않겠다는 말) 하필 당일 비가 많이 내릴 때라 외관이 참 겜성 가득한 곳이었는데 촬영은 못 해서 아쉬웠다!! (또 간다는 말🤤) 마가렛 연남 메뉴판 커피를 정말정말 좋아하지만 오후에는 되도록 카페인을 피하는데 다행히 #디카페인 메뉴가 있어서 아이스아메리카노를 즐길 수 있었다! 그리고 핫/아이스 메뉴 가격차도 없었다=] 카페 내부는 일반 가정집을 리모델링하여 천장이 매우 낮고 좁았는데... 그래서 서로 대화하는 소리가 잘 들렸다🥹 그래도 화장실도 꺄끗하게 잘 되어있고~ 전체적으로 아기자기하고 귀여운 너낌!! 베이커리 종류가 정말 다양했는데 마음 같아서는 정말 다~ 먹고 싶었지만 늙어버린 위장은 그런 행동을 용납하지 않는다🥲 나와 친구가 선택한 메뉴는 로열밀크티 케이크+ 구운피스타치오 큐브파이❤️ 완전 귀여운 접시와 컵을 안찍을 수 없었다 ㅋㅋㅋ 매일 카페만 다니면서 살고 싶은데🥹 절대 소박할 수 없는 소소한 연남동 나들이 끝!"
"may,[연남동]| 연교 | 마가렛연남 | 티크닉 | 끝남동 | 소점 | 연남동 데이트 | 삼청각 | 카페다원 |","5월이다 1일날 일산언니네랑 연남동에서 만났다 지난 여름 소점을 마지막으로 오랜만에 가본 연남동! 연남 연교 날씨 좋구 맛집 좋구 연교 서울특별시 마포구 연희로1길 65 1층 연남 연교 도착! 역시나 웨이팅…ㅎㅎ 웨이팅중 30분정도(?) 웨이팅 후 입장!! 배고파 죽을뻔🫨 연교 메뉴판 우리가 시킨건 우육탕면 꿔바로우 어향가지 덮밥 마파두부 덮밥 새우샤오롱 바오 성젠바오 우육탕면과 꿔바로우 어향가지 덮밥 마파두부 덮밥 새우샤오롱바오 성젠바오 새우샤오롱바오 부터 합입🤤 쟌맛탱 새우들어가면 무조건 맛있좌나요 어향가지 덮밥 댕뜨거움…. 먹을때 조심하세요 수저에 한입가득 퍼서 넣었다가… 혓바닥 데인 사람…. 다먹을때쯤 식더라구요🙄🙄 조심조심 연교 : 네이버 방문자리뷰 1,529 · 블로그리뷰 1,321 naver.me 티크닉 연남동 티크닉이다 가보고싶었던 카페였는데 야외자리가 없었다😭 아쉬운대로 사진만… 근처에 있던 마가렛연남 카페로 갔다 어딜가나 사람이 많아서 자리 잡기가 쉽지 않음… 마가렛 연남 서울특별시 마포구 성미산로29길 10 1층 마가랏 연남 디저트 카페답게 베이커리 종류가 엄청 다양했다ㅎㅎ 아아랑 먹어줘야지..! 어렵게 얻어낸 2층 테라스 구석자리ㅋㅋㅋ 옹기종기…ㅎㅎ 주문하신 아아4잔 이요~ 내가 좋아하는 크로우캐년 컵에 주셨다…ㅎㅎ(탐났다) 역시 이쁘다 다음에 일산댁언니랑 언니네 집근처 모드니라고 그릇도매점(?)같은곳을 가기로 했다 눈 돌아가겠군… 텅장각 귀여운 초1 몇일뒤 우리오빠 생일이다 어린이 생일🎂ㅋㅋㅋ 미리 생파 언니가 같이 모였을때 초라도 불자고 카운터에 같이 놓여있던 초도 하나 구입했다ㅎㅎ (불은 금지라고 하셔서 패쓰) 5월은 오빠의 달 좋은일 가득하자 우리 ♡̷̷̷ᩚ 디저트 맛집 주문했던 수플레 치즈케이크 보늬밤 케이크 단호박크림 스콘 다 맛있었다! 단호박크림 스콘 2표 수플레 치즈케이크 1표 보늬밤케이크 1표 였다고 합니닿 옹기종기 모여앉아서 수다 떨다가 다리가 점점 아파오신다고 하셔서 일어났다ㅎㅎ 카페에서 나왔는데 변요한 님을 봤다.!.!.!.!.!..! 아니 무슨일이냐 좀 더 빨리 내려올껄ㅠㅠㅠㅠㅠ 나 진짜 사진 찍고싶었는데… 이렇게 잘생긴 연예인 실물영접은 첨이야,,, 다시 또 언제 볼 수 있을까… 택시 기다리면서 몇 장 찍어주셨다…(별루다) 안녕 시바 우연히 보바를 만났다ㅋㅋㅋㅋ 보고싶다고 했는데 이렇게 급 만남이 될 줄이야 ㅎㅎㅎ 정말 너 에너지 넘치는구나? 가방 긁히는 줄 알았자나….ㅎ 반가웠어 시바 보바🐶 삼청동으루 ㄱㄱ! 결국 오빠가 좋아하는 삼청동을 왔다 삼청각 삼청각 카페다원 뷰맛집ㅎㅎ 뻥 뚫린 뷰가 좋긴하다 커피값도 뷰값 포함..ㅎㅎ 좌 생강라떼 우 따쵸 생강라떼 띠용하는맛 이름은 우웩인데 맛있었다! 초코라떼는 달달하니 맛없없! 아이스크림까지 맛있게 잘먹었습니다☺️ 삼청각 서울특별시 성북구 대사관로 3 연남동 소점 소점 서울특별시 마포구 성미산로17길 99 지난여름에 갔다온 끝남동 맛집 소점..! (끝남동을 이때 첨 알았다ㅋㅋㅋ) 맛집으로 추천받는곳! 오픈런 해야합니다… 가게가 협소하고 회전율이 빠르지 않았어요 소점 : 네이버 방문자리뷰 743 · 블로그리뷰 865 naver.me 가게내부 협소하지만 잘 갖춰서 있는 느낌…! 사장님과 직원분들 너무 친절하셨다 오코노미야키 우리가 주문한건 히로시마풍 오코노미야키 타코야끼 6알과 토마토 사라다까지 먹었었음! 여기 가앙추 5월도 잘 먹고 잘 놀고 잘 살아보자 잘 살꺼야"
연남동 카페 마가렛 연남 디저트맛집,연남동 카페 마가렛 연남 디저트 맛집 연남동에 가오픈하는 신상카페 가려다가.. 공간이 좁고 사람들도 많다는 소문에 한적하고 예쁜 카페 찾다가 발견한 곳! 요즘은 한적한데가 넘 좋은듯해요~ 근데 한적하면서 예쁘긴 또 힘들... #내돈내산 오픈시간이 12시라 그런지 평일 오픈시간쯤 갔더니 저희가 첫 손님♥ 연남동은 젊은층이 많아서 그런지 활동시간이 느린듯해요^^ 전 이제 생활패턴이 어르신(?)같아서 일찍 활동합니다..하하핳 마가렛 연남 카페는 주택을 개조한 2층 카페로 1층에서 먼저 선주문 결제후 앉고싶은 자리에 착석하심 되요! 들어가자마자 너무 예쁜 디저트들이♥ 분명 소이연남 쌀국수 먹고 배부른데.. 디저트 배는 왜 따로있는것인지..ㅋ 연남동맛집 소이연남 쌀국수맛집 찾는다면 연남동맛집 소이연남 쌀국수맛집 찾는다면 여기♡ 이번주 날씨 와~~~넘 추워요! 추울땐 뜨끈한 국물이죠 국... blog.naver.com #연남동카페 #마가렛연남 #마가렛 #홍대카페 △ 마가렛 연남 메뉴 및 가격 △ 역시 연남동카페들은 주문하는 계산대마저 예쁘죠?히힛 날이 너무 추워서 따뜻한 아메리카노와 베스트 디저트빵 하나를 빠르게 주문후 천천히 마가렛 연남 구경해봤어요 (우리밖에 없어서.. 이런 행운이♡) 마가렛연남 디저트 베스트1. 로투스 스콘 (4.500) 디저트가 하나같이 다 맛있어보여서 나도 모르게 찰칵찰칵. 나에게도 언젠가 베이킹을 배워서 이런 예ㅣ쁜 빵을 만들어볼 수 있길 소망해봅니당^^ 요즘 핫한 전구죠~ 저도 집에 하나 들일려고 눈독들이는 중! 마가렛 연남 1층 분위기는 깔끔! 손님이 저희뿐이라 프라이빗하게 있고파서 2층으로 갔어요 요기가 마가렛연남 핫스팟 같은~ SNS보니 여기서 인증샷 많이 찍으셨더라구요. 저도 동네마실 나온 츄리닝 차림이지만 한장 찰칵!ㅋ 넘나 다소곳해서 민망쓰..ㅋㅋㅋ 사진 찍은걸 보니 이곳이 젤 예쁜듯해요~ 역시 다들 예쁜곳을 아네요. #홍대핫플 #연남동맛집 #홍대맛집 #홍대카페투어 내돈내산인데 참 열심히도 찍었네요~ 오늘의 티타임 주제는 앞으로의 자기계발! 그리고 블로그에 관한 주절주절.. 아메리카노도~ 디저트도 맛있고 분위기도 넘 좋고 햇살도 따뜻하고 기분좋은 티타임 이였어요♪♬♪ 저희가 나갈때쯤엔 사람들이 많아지더라구요. 마가렛 연남 오신다면 오픈시간에 오시길 추천! #연남동데이트 #홍대데이트 #카페투어 #서울카페추천 마가렛 연남 서울특별시 마포구 성미산로29길 10 1층 - 연남동카페 마가렛 연남 연락처 070-8666-0559 - 연남동카페 마가렛 연남 영업시간 12:00~22:00
"연남동 카페, 맛있는 디저트가 가득한 마가렛 연남 내돈내산 후기!","연남동카페 / 마가렛 연남 매일 12:00 - 22:00 오랜만에 친구와 연남동 카페투어를 다녀왔어요! 연남동은 예쁜 감성카페가 모여 있어서 하루동안 카페투어하기 아주 좋은 곳이에요!! 원래 가려고 한 카페가 있었는데 하필 저희가 간 날에 카페 내부 촬영이 있어서 가지 못하고 어느 카페를 갈지 산책하며 찾아보다가 외관이 너무 예뻐서 우연히 들어오게 되었어요! 연남동에는 예쁜 카페가 너무 많아서 굳이 미리 찾아오지 않아도 돼요! 그냥 연남동 카페거리를 산책하다보면 예쁜 카페를 발견하게 된답니다 계획형 인간이 즉흥으로 카페 들어갈 수 있는 연남동 ㅋㅋ 진짜 연남동 카페거리를 지나가는데 죄다 인스타그램에서 핫한 카페들이였어여!! 마가렛 연남은 주택을 개조한 느낌의 카페였는데 내부도 넓고 자리가 많아서 정말 좋았어요! 여유롭게 커피를 즐길 수 있을 거 같은 느낌이죠?ㅎㅎㅎ 야외자리도 있는데 햇살이 엄청 직사광선이라는 거.. 원래는 저기에 자리를 잡았는데 태양이 너무 강해서 결국 안에 자리를 잡았어요 ㅋㅋㅋㅋ ㅠㅠ 1층과 2층으로 되어 있는데 구석구석 인테리어가 너무 귀엽고 감성가득했어요! 발판마저 예쁜 이 곳... 발판갬성 너무 좋아.. 1층에도 2층만큼은 아니지만 자리가 많았어요! 그런데 이렇게 큰 창이 있어도 층고가 낮고 조명이 적어서 뭔가 어두운 느낌이에여 +_+ 귀여운 접시도 가득하죠? 접시를 골라서 빵을 담고 카운터로 가지고 가면 된답니다 예쁜 접시가 너무 많아서 고르느라 한참 고민했어요 짜잔!!! 맛있는 디저트가 엄청 많죠? 사실 별 기대없이 들어온 곳인데 맛있는 빵과 케이크가 엄청 많아서 너무 놀랬어요 ㅋㅋㅋ 진짜 디저트가 너무 다양해서 정신을 못차리겠더라구요 게다가 너무 예쁘다는 거 ㅠㅠ 이렇게 귀엽고 예쁜 디저트가 한가득이라뇨!! 결국 저희는 한참 고민하다가 예쁜 꽃이 달린 레몬 컵케이크를 선택했어요~~ 더 많은 디저트를 먹어보고 싶었지만 다른 카페도 가야해서 패스 ㅠㅠ 주문을 하고 나서 2층으로 올라왔는데 2층에는 훨~~~씬 많은 테이블과 자리가 있었어요! 게다가 테라스 자리까지 있었답니당 ㅎㅎㅎ 개인적으로 1층보다 2층이 더 예쁜 느낌이에요! 사장님 어떻게 이런 귀여운 인테리어 하실 생각을 하셨나요?♥ 너무 내 취향저격... 생각보다 주문한 메뉴가 빨리 나와서 호다닥 달려갔어요 ㅋㅋㅋ 아, 음료는 밀크티와 베리레몬에이드를 주문했어요! 오늘도 포기할 수 없는 갬성샷 ㅋㅋㅋ 역시 햇살이 좋아서 그런지 야외에서 찍는 게 사진이 잘 나오네요! 대충 찍어도 감성샷이에여!! 야외에 앉지는 않았지만 사진이 너무 잘나와서 사진만 찍고 2층으로 호다닥 올라갔어요! 사진 정말 예쁘게 잘 나오죠? 역시 햇살의 힘 ㅠㅠㅠ 그나저나 디저트가 예쁘기만 한 게 아니라 맛도 있었어요!!! 레몬 컵케이크라 그런지 엄청 상큼하고 안에 레몬잼도 들어가 있어서 좋았어요 너무 달지 않고 적당히 달달하면서 가볍게 즐길 수 있어서 최고였네용 (๑˃̵ᴗ˂̵) 베리레몬에이드도 상큼하고 깔끔해서 잘 선택한 거 같아요! 마지막 마무리는 내 사진으루.. 헤헤 이 날 진짜 핑크 완전체로 입고 갔어요 ㅋㅋㅋㅋ 사실 양말은 핑크색 신고 싶지 않았는데 양말이 없어서 어쩔 수 없이 신었어요.. ㅠㅠ 핑크빌런으로 다닌 날이였네여 >_< 우연히 방문하게 된 마가렛 연남, 분위기도 좋고 자리도 많고 디저트도 맛있고 예쁘기까지해서 완전 적극 추천해요! 오랜만에 광합성 제대로 했네요 ㅎㅎㅎ"
