title,content
"[연남동]수키도키 팝업, 브레이크 타임 없는 식당 솥밥 맛집 <솔솥>, 귀엽고 커피가 맛있는 카페 <데얼커피> / 노들섬 노을 사냥","#연남동 #연남동맛집 #연남동카페 #솔솥 #브레이크타임없는식당 #데얼커피 #노들섬 #노을 #canonG7xmark2 한글날 다음날에 연차를 써놔서 부담 없이 동생이랑 엄마랑 외출을 할 수 있었다. 이젠 체력 때문에 외출하고 난 다음날엔 꼭 쉬어주어야 한다.. 엄마 차를 타고 갈까 했으나 주차에 대한 압박보다는 마음 편하게 대중교통을 타고 가기로 결정. 오랜만에 찾은 홍대입구역-. 연남동은 홍대입구역 3번 출구에서 가깝다. 역 도착하자마자 향한 곳은 동생이 원한 수키도키 팝업! 글렌 & 수키도키 팝업 2023.10.1 ~ 10.13 (현재 종료) 동생이 엄청 좋아하는 수키도키🐰 나도 매일 다꾸 하는 사람으로서 즐겁게 따라갔다. 팔시보스토어 서울특별시 마포구 동교로38안길 17 1층 연남동 굉장히 오랜만이었는데 한창때(?) 자주 왔던 곳이다 보니 지도 없이 잘 찾아가는 네비 인간.. 엉성하게 그려진 쥐, 토끼, 고양이 캐릭터가 우리의 속마음을 대변하는 듯한 거침없는 대사를 치는 것이 매력적🤣 동생이 스탬프 여러 개 사면 할인된다고 해서 내 스탬프도 하나사줬다. 주로 평일에 쉬는 나에게 유용한 'Day off 도장' . 나도 다이어리에 붙일 스티커 몇 장 고르고 나왔다. 구매한 스티커보다 사은품으로 주신 알파벳 스티커랑 갬성 엽서가 더 많아서 기분 좋았던 팝업이었다. 서울 시내에 나온 건 오랜만이라 동생이랑 엄마랑 연남동 여기저기 구경하기. 고양이 관련 소품샵으로 유명한 '고양이가 있는 액자 가게'도 들렀다. 고양이가있는액자가게 서울특별시 마포구 연희로1길 46 샵에서 들리는 음악이 귀엽고 매우 웃겼음. 우리가 알고 있는 클래식이 고양이 울음소리로 나왔다. 야옹야옹 합창 🐈 우리가 연남동에 도착한 시간이 오후 2시 30분쯤 되어서 연남동 대부분의 식당이 브레이크 타임을 가지기 시작했다. 그래서 브레이크 타임 없는 식당을 찾아야 했는데.. 연남동에서 그런 식당은 이탈리안 식당뿐.. (파스타 흥미 없는데🙃) 그러다가 동생이랑 솥밥 전문점인 '솔솥'이 브레이크 타임 없다는 것을 알아냈다. 솔솥 연남점 매일 11:30 - 21:00 / 브레이크 타임 없음, 매장 협소하여 예약 불가, 주차 불가 솔솥 연남점 서울특별시 마포구 동교로38길 35 지1층 2호, 3호 후기에서 외국인 손님이 많다는 내용을 많이 봤는데 이날 실제로 다양한 국적의 외국인이 웨이팅을 하고 있어서 놀랐다. 다들 어떻게 알고 오신 건지.. 궁금.. - 솔솥 연남점 메뉴 / 웨이팅 방법(캐치 테이블) - 솔솥은 항상 웨이팅이 있는 편이라 식당 도착하면 식당 앞에 마련되어 있는 태블릿(캐치 테이블)로 인원수, 메뉴를 미리 선택하여 웨이팅을 등록해야 한다. 우리는 점심시간도 저녁시간도 아닌 어정쩡한 시간에 가서 그런지 대기팀이 많은 편은 아니었다. 기다리는 동안 근처 포토 스튜디오에서 오랜만에 셋이 사진 찍었음. 그리곤 식당 앞에서 다시 웨이팅. 사진 찍고 가게 앞에서 기다린 시간 합하면 25분 정도 웨이팅 한 것 같다. 우리 차례가 되었다는 카톡 받고 입장! 동생은 치즈 닭갈비 솥밥 나는 돼지 고사리 솥밥 엄마는 치즈돈까스를 미리 주문 넣어 놓은 상태 (솔솥은 스테이크 솥밥이랑 도미관자 솥밥이 유명한데 이를 고르지 않은 우리들ㅎㅎ) 솥밥 집을 몇 군데 가본 결과 테이블 위에 적힌 솥밥 맛있게 먹는 법 설명을 잘 읽어야 한다. 그래야 맛있게 즐길 수 있음. 식당 문 앞에 놓인 엄청난 크기의 쌀. 농협에서 햅쌀을 주문해서 쓰나 보다. 전체적으로 약간 어둑하지만 따뜻한 분위기의 우드톤 빈티지 인테리어가 인상적. 이미 식당 내부에는 한창 식사 중인 외국인들이 많았다. 한국인 3분의 2, 외국인 3분의 1 정도. 직원들이 영어도 잘 하고 활기차고 친절했다. 솥 밥집에서 돈까스를 주문한 엄마. 근데 이 돈까스 진짜 맛있었음.. 웬만한 돈까스 맛집 저리 가라..! 한 상에 솥밥, 숭늉을 만들 뜨거운 물, 반찬, 후식으로 즐길 요구르트까지 야무지게 있는 것이 알차다. 고사리에 가려져 보이지 않지만 엄청난 양의 고기와 밥 일단 솥에서 재료와 밥과 같이 나온 소스를 골고루 섞어 옆에 있는 빈 그릇에 옮겨 담는다. 밥을 옮겨 담은 후 빈 솥에는 테이블에 마련된 누룽지를 몇 스푼 넣고 뜨거운 물을 부어 뚜껑을 닫아 놓는다. '와! 대박 맛있어'까지의 맛은 아니지만 전반적으로 맛있었음. 양도 알차서 밥을 다 먹은 뒤 솥에서 잘 불은 누룽지까지 먹으면 배가 터질 정도. 30분 미만 웨이팅은 가능. 맛있는 밥을 먹은 뒤 응당 다음 코스는 카페다. 연남동 구경하다가 귀여운 캐릭터가 눈에 띈 카페를 기억해놓았다가 식사를 마친 뒤 고민 없이 이곳으로 향했다. 데얼커피 서울특별시 마포구 동교로38안길 21 1층 데얼커피 13:00 - 21:00 / 목요일 정기휴무 일단 카페 주변이 왁자지껄하지 않고 조용해서 더 좋았다. 카페 인테리어가 아기자기 갬성적인 것이 취향 저격 사장님의 취향이 가득 반영되어 있는 듯 눈 돌리는 곳마다 귀여운 것이 가득하다. 카페 내부에 화장실도 있고 깔끔해서 너무 좋았다. - 데얼커피 메뉴 - 배가 너무 부른 상태라 디저트까지는 무리였다. 나랑 동생은 입가심으로 좋은 아이스 아메리카노, 단 커피를 좋아하는 엄마는 연유라떼로 주문했다. 카페 후기를 보니 디저트가 맛있기로 유명한 카페인 듯! 다음에 연남동을 찾는다면 디저트도 즐겨봐야지! 커피가 너무 맛있어서 동생이랑 감탄하면서 마셨다. 셋이 도란도란 일몰 전까지 수다 떨었음 (카페 이용 시간은 2시간으로 정해져 있다.) 맛있게 잘 먹었다! 일몰시간이 가까워져서 서둘러 버스 타고 노들섬으로 이동 🚌 노들섬 서울특별시 용산구 양녕로 445 오 드디어 인스타그램에서 핫한 노을 맛집에 와보는군.. canon G7x mark2 잔디 밭에 내가 상상했던 것보다 더 많은 사람들이 있어서 놀랐다. 그리고 모기가 너무 많아서도 놀람.. 그래도 엄마가 미리 준비해놓은 모기 기피제 뿌려서 물리진 않았다. 잔디 밭에 앉아있는 사람들은 어떻게 모기를 물리치고 있는 거지.. 푸디 앱 아이폰 11 canon G7x mark2 canon G7x mark2 canon G7x mark2 동생 폰 갤럭시 S22 일부러 카메라까지 챙겨갔는데 원하던 풍경을 담을 수 있어서 만족스러웠다. 그리고 노들섬부터 한강대교를 지나 노량진역까지 운동 겸 걸어왔다. canon G7x mark2 바람이 제법 시원해서 걷기 좋았다. 야경도 열심히 카메라로 담아보고. canon G7x mark2 집순이라 연휴 때 항상 집에서 뒹굴뒹굴하기만 하다가 셋이서 이렇게 서울 시내 나가서 시간을 보내니 알차고( ISTJ에게 제일 중요한 부분) 즐거운 하루였다. 끝."
"연남동 카페 '데얼커피' 우연히 들어간 디저트 천국(메뉴,가격O)","저번에 재방문했던 연남동 맛집 카쿠시타에 이어 디저트 배 채우러 갔던 연남동 카페 데얼커피 P들의 조합인 만큼 카페 검색은 많이 하긴 했는데 우연히 길 걷다가 인스타 갬성 뿜뿜 느껴지는 미니 간판 보고 바로 들어가자 해서 들어가봄 ㅋㅋ 데얼커피 서울특별시 마포구 동교로38안길 21 1층 요렇게 연남동 골목 안쪽에 있는 카페 ㅎㅎ 지도에는 1층이라고 나오는데 1.5층?2층?느낌이다 ㅎㅎ 안쪽 인테리어도 취향저격 ㅠㅠ 너무 귀여운 카페다. 벽마다 붙여져 있는 스티커와 포스터. 요런 것들로 인해 또 인스타 사진퀄이 올라가는 것 아니겠습네까^^ 그리고 내가 정말 좋았던 점... 이름에는 커피가 들어갔지만 커피 외 음료도 많이 판매하는 연남동 카페라는 점! 나처럼 커알못인 사람들에게는 너무 좋았던 ♥ 달달한 디저트 먹을 때는 고소한 음료 먹는 것을 선호하는데 쑥, 흑임자, 말차 같은 할미 입맛 취저 음료도 있었다 후후후 :) 그리고 눈이 휘둥그레해졌던 디저트... 여기 디저트 천국인가여...? 나보다 적게 먹는다 생각했던 친구가 3명이서 디저트 3개는 먹어야한다며 폭풍주문하는 것 보고 아 여기는 디저트배를 채워야하는 사람들의 수요를 제대로 파악했다고 느낌^^ 음료 가격도 이정도면 연남동 치고는 괜춘하다고 느꼈다 ㅎㅎ 특히 차 가격 비싸게 안 받는거 너무 좋음! 항상 느끼지만 차는 물에 진짜 티백 하나 넣는건데 6000~7000원대로 받는거 좀 킹받지 않습니까^^ 대신 매장 이용은 2시간까지이고 노트북과 스터디는 금지라고 한다. 그리고 이 카페를 밖에서 보고 여긴 들어가도 된다고 느낀게 카페 자체 굿즈가 있다는 것 ㅠㅠ 이렇게 브랜딩하는 카페라면 맛도 좋을 거라는 근거없는 확신^^ 짜잔~~~ 1인1음료+1인1디저트 ㅋㅋㅋ 음료는 데얼커피/쑥우유/메론크림소다 디저트는 스모어쿠키/쇼콜라가또/티라미수 디저트부터 맛 평가를 해보다면 가장 인기가 많았던 메뉴는 티라미수 시트가 커피에 적셔져있어 커피를 좋아하는 사람에게는 완전 좋을 것 같다. 나는 카페인이 잘 안 받기 때문에 쇼콜라가또가 좋았는데 난 달달해서 맛있게 먹었는데 친구들은 저 위에 체리크림(?)이 맛이 별로 안느껴졌다고 ㅋㅋ 케이크 제형은 꾸덕꾸덕한 편이었다. 약간 브라우니 느낌? 그리고 스모어쿠키는 맛있는 초코칩쿠키에 마시멜로우 올린 맛 ㅎㅎ 요건 그냥 시각적으로 먹는거지 뭐 ;) 그리고 우유 중에 가장 덜단 걸 추천해달라고 부탁드렸는데 취향저격이었던 쑥우유 ㅎㅎ 다른 테이블에서도 이거 많이 시켜먹더라. 달달한 디저트랑 먹기에 꼬소한 음료라 난 좋았다 :) 마치 케이크 먹을 때 아아 먹는 사람들과 비슷하달까^^ 데얼커피도 맛있다고 했고 메론크림소다는 크림이 아니라 아이스크림 올라간 음료였는데 데미소다 맛이 난다고 했다 ㅋㅋ 여튼 재방문 의사 있는 연남동 카페 :) 맛도 분위기도, 안에 깨끗한 화장실도 만족쓰였다! 그럼 이만... 뿅!!"
연남동 감성카페 데얼커피 귀여운 디저트맛집,"오랜만에 연남동 카페 나들이를 다녀왔습니다 미리 찾아둔 연남동 카페가 있었지만 사람이 많아서 웨이팅을 해야 하는 상황이었기에 다른 곳 가자! 해서 둘러보다가 데얼커피를 다녀왔어요 데얼커피 영업시간 13:00 - 21:00 매주 목요일 정기휴무 전화번호 0507-1310-0503 데얼커피 서울특별시 마포구 동교로38안길 21 1층 연남동에 오랜만에 왔더니 정말 귀염뽀짝하고 감성카페들이 많았는데요 주말에 갔더니 사람이 너~무 많아서 자리 잡기 힘들어 골목골목 돌아다니던 중 멀리서 창문에 붙여진 귀염뽀짝한 스티커를 보고 가게 된 카페 데얼커피입니다 데얼커피는 2층에 위치해 있고 테이크아웃 시 천원 할인도 됩니다 저는 이날 테이크아웃 아닌 먹고 갈 거라 얼른 올라가 볼게요!! 티라미수랑 스모어 쿠키 그리고 곰돌이 마들렌이 주메뉴인듯합니다 올라가는 계단에도 귀여운 곰돌이 쿠키와 빵이 보였는데요 포스터부터 우선 연남동 카페 갬성이 확 느껴집니다 ㅎㅎ 제가 갔을 시간은 한 3시쯤이었는데 다행히 딱 1자리 창문가에 남아있었기에 후다닥 앉았어요 내부 공간은 넓진 않지만 딱 보자마자 느낌이 왔어요 아 ,,, 여기 완전 귀염뽀짝 갬성 카페구나,,,,? 다행히도 창문가 쪽 2인 좌석이 남아있었기에 자리를 잡고 둘러보니 곳곳이 아기자기한 소품들로 가득해서 넘 아늑하고 예뻤어요 전체적인 매장 분위기는 우드톤이라 편안하고 아늑한 분위기였어요 딱 인스타 감성카페 느낌 디저트 메뉴도 생각보다 다양했는데요 스모어 쿠키 곰돌이 마들렌 에그타르트 티라미수 준비되어 있었어요 티라미수는 주문 즉시 만들어 주기에 살짝 시간이 걸립니다 저는 아메리카노 2잔과 티라미수 그리고 에그타르트를 시켰어요 주문하는데 보니 매장 이용 시간이 나와있었는데 아무래도 규모도 작고 감성 카페다 보니 2시간으로 이용 시간제한이 있었습니다 주문하고 나서 가게 내부를 다시 둘러보니 아기자기한 소품도 같이 있었어요 에코백 및 머그컵이 있었는데 캐릭터가 정말 귀여웠어요 아마 데얼커피 굿즈인 것 같습니다 운 좋게 창가 자리 앉았는데 사실 연남동 카페거리 골목 안에 위치한 카페라 뷰는 빌라뷰,,,입니다ㅎㅎ 주말에 갔더니 사람들이 정~말 많아서 앉아있으면서 사람 구경만 많이 했어요 드디어 등장! 데얼커피는 따로 진동벨을 주지 않고 사장님께서 직접 가져다주십니다 오랜만에 예쁘게 사진 찍고 싶어서 요리조리 돌려가며 찍었는데,,,, 아직도 사진 찍기는 어려워요 ㅎㅎ 컵은 데얼커피 굿즈에 담아주는데 컵에 그려진 캐릭터가 넘 귀여웠어요 티라미수 한 조각 크기도 정말 큽니다!! 데얼커피 티라미수 한 조각 6500원인데 크기가 정말 커요 주문 후 만들어 주시는 거라 시간이 살짝 걸리는데 일반적인 티라미수랑 달리 빵 느낌이 더 강해요 그래도 크림이 정말 부드러워서 포크랑 한입 떠먹으면 사르륵 녹아내려요 에그타르트도 크기가 정말 큰데 큼지막하게 4등분 해서 나눠먹었어요 파이 지도 부드러웠지만 안에 든 필링이 완전 제 스타일,,,, ♡ 개인적으로 저는 티라미수도 맛있었지만 에그타르트가 더 맛있어서 저 혼자 다 먹었습니다 당 떨어졌던 시간이라 디저트 폭풍 흡입했더니 어느새 빈 접시만 남았어요 싹싹 비우고 왔습니다 :) 오랜만에 연남동 감성 카페 다녀왔는데 분위기도 좋았고 무엇보다 디저트가 맛있어서 좋았어요 단 카페 내부가 작은 편이기도 하고 시간제한이 있지만 충분히 이야기하고 디저트 먹어도 넉넉한 시간이었기에 괜찮았습니다 연남동 귀염 뽀짝 한 감성 카페 찾으신다면 데얼커피 들러보세용"
연남동 조용한 카페 데얼커피,"연남동 카페 중 조용한 카페는 사실 막 많지 않은 것 같아요! 오늘은 연남동 조용한 카페 데얼커피를 제가 한 번 소개해볼게요 연남동 조용한 카페 데얼커피 사실 일부러 알고 찾아간 카페는 아니고요 그냥 지나가다가 여기가 괜찮아보여서 호로록 홀린 듯 들어가게 됐던 데얼커피! 이 때 아침부터 나와서 돌아다녀서 그런가 뭔가 준비된 체력이 소진된 상태여서 걷다가 그냥 아무데가 들어갔습니다 근데 이 데얼커피 로고 너무 귀엽지 않냐며 우연히 들어간 카페가 마음에 들 때 더 기분이 좋아지더라고요 카페 이용 시간은 2시간으로 제한돼요 저희는 카페에 오래 있을 생각으로 온 건 아니라서 2시간으로 이용 시간이 제한돼도 크게 상관없었네요 이 날 되게 날이 따뜻하고 햇빛이 좋았던 그런 날이었거든요 큰 창으로 햇빛이 들어오는 게 너무나도 마음에 들더라고요 분위기 되게 좋죠! 깔끔한 카페 느낌은 아니고 보시다시피 뭔가 이것저것 많이 꾸며져있는데 또 따뜻한 느낌이 나는 그런 곳이더라고요 벽에 붙여있는 것들 뭔가 묘하게 느낌이 비슷한 것 같던? 결이 비슷한 그림들이 벽에 붙어있었네요 사장님께서 고양이를 좋아하시는가 고양이가 굉장히 많았던 게 고양이 좋아하는 저에겐 마음에 드는 포인트 중 하나 케이크도 있어요! 이 때만 해도 딸기철이었나 근데 지금은 딸기가 없을 것 같기도 하고? 아무튼 케이크도 있었고요 제가 매우 좋아하는 에그타르트! 그리고 주문 즉시 만들어주신다는 티라미수랑 앙버터 쿠키가 보이더라고요 곰 마들렌도 너무 귀여웠고 약과 휘낭시에랑 로투스 스모어 쿠키, 각종 귀여워 보이는 세 가지 쿠키가 보였네요 약과가 요새 또 핫한 디저트던데 아주 트렌디하군요 웬만하면 디저트 먹었을 것 같은데 잠시 카페에서 쉬다가 밥 먹으러 갈 예정이었어서 아쉽게도 일단 디저트는 패스 ㅠ 다음엔 귀여운 곰 마들렌이나 약과 휘낭시에 같은 거 한 번 맛보고 싶네요 음료도 꽤 종류 다양한 편이죠? 그리고 뭔가 아메리카노 가격이 4,500원인 것이 연남동 물가치곤 괜찮은 것 같기도 했고요 주문을 마친 뒤 이것저것 진열되어 있는 제품들을 잠시 구경해봤어요 엽서 너무 귀엽죠! 떡메모지, 아크릴 키링, 아크릴 그립톡 등등 귀여운 거 한가득 데얼커피에서 직접 일러스트도 그린 거겠죠? 투멍 텀블러 너무 귀엽게 생김 데얼이 텀블러는 더더 귀여움 귀여워라 구경할 맛이 나던 소품들 에코백도 있더라고요 솔직히 푸드리 에코백 살짝 탐났는데 집에 에코백이 많단 생각이 뇌리에 스쳐서 가까스로 참을 수 있었네요 유리컵도 있고! 귀여운 머그컵도 판답니다 요런 소품들 좋아하시는 분들은 카페 가신 김에 이것저것 구경하셔도 매우 좋을 듯 희희 드디어 음료 나왔네요! 짜잔 햇빛을 잔뜩 받고 있는 음료는 누가봐도 예뻐요 자몽에이드 (6,000원) 일단 자몽 에이드는 보시다시피 색감이 너무 예뻤어요 살짝 상큼한 편이고 맛있기는 한데, 막 수제청을 썼다! 생과가 많이 들어갔다! 의 느낌은 아니더라고요 막 고퀄의 느낌을 받진 못 했지만 그래도 시원하고 상큼하게 마시기엔 나쁘지 않았던 듯 아메리카노 (4,500원) 제 선택이었던 아이스 아메리카노! 꽤 괜찮았어요 진하고 향이 좋아서 괜찮은 아메리카노네~ 하고 느끼고 왔었네요 조개 껍질로 만든… 이걸 뭐라하나요? 암튼 가리비… 보고 왔슴다 화장실도 내부에 있고 화장실에서도 여기저기… 고영희의 흔적들이 마지막으로 동영상까지 한 번 올리면서 이상으로 연남동 조용한 카페 데얼커피 포스팅을 마치도록 할게요! 데얼커피 서울특별시 마포구 동교로38안길 21 1층"
크리스마스케이크 연남동 데얼커피 주문후기,"#크리스마스케이크 #연남동케이크 #연남동카페 #연남동데얼커피 #데얼커피 #케이크맛집 #연남동케이크맛집 #연남동크리스마스케이크 벌써 크리스마스가 8일이나 지나서 너무너무 늦었지만 더 늦기전에 올려보는 #연남동케이크맛집 #데얼커피 크리스마스 주문케이크 후기랍니다 ~ 🍰 인스타로 폭풍 서치해서 대체 크리스마스에는 어디서 케이크를 주문할지 고민을하다가 첫번째, 두번째 픽을 했다가 마지막으로 선택받은건 데얼커피 크리스마스 케이크랍니다 24일,25일은 케이크 픽업때문에 카페를 오후4시부터 운영을하는 날이라 사람 하나도없는 데얼커피로 들어갔답니다 저희는 오픈시간인 오후 1시에 픽업 예약을했어요 동교동에서 연남동으로 옮겨서 더 넓고 지하가아닌 지상의 햇살이 들어오는 데얼커피 입구랍니다 픽업하려고 사장님께 전화번호랑 인스타 주문내역을 보여드리고 조용하고 이쁜 카페 데얼커피를 찍었어요 연남동으로 옮기고는 처음와서 모든게 색다르더라구요 여기저기 크리스마스 장식으로 더 따뜻하게 느껴지기도 했어요 🎄🎄🎄 공간도 훨~얼씬 넓어져서 굿즈 파는곳도 넓어져서 구경하기 더 좋아졌어요 원래는 테이블 바로 뒤쪽에 있어서 공간이 협소해서 조금 조심스럽게봤었는데 엄청 넓어졌어요 바로 옆으로는 귀여운 인형들이 대롱대로 매달린 데얼커피 스타일에 딱 맞는 작은 트리가 있었어요 데얼커피 굿즈들 ! 저는 리스트 적는 포스티잇이랑 엽서들 몇가지를 가지고 있는데 잘 이용하고있답니다 헷 매장이용은 못해서 커피는 따로 못시켰지만 커피랑 보틀우유 에이드 티 이런 종류도 판매하는 데얼커피 ~ 제가 여기저기 사진찍고 있는 사이에 사장님이 제가 주문한 케이크를 꺼내서 포장을 해주시길래 미리 구경을 좀했답니다 사진으로 봐서 어떤 비주얼인지 알지만 그래도 너무 궁금하더라구요 제가 구매한 케이크는 딸기들어간 레드벨벳케이크 였는데 이렇게 가려져도 눈사람이 보이죠 ?? 저렇게 된 케이크였답니다 포장은 아주 간단했는데 이렇게 비닐팩에 넣어주셨어요 그리고 초는 따로 준비해주는게 없어서 옆에 있는 크리스마스 트리가 있는 촛불을 하나구매했답니다 ㅎㅎ 마지막으로 트리앞에서 찰칵! 믿고먹는 데얼커피 ~~ 다음에 또올게요 차로 가는길에 거울이 있길래 한컷 찍었어요 !! ㅎㅎㅎㅎㅎ 크리스마스 분위기 냈는데 케이크까지 들고있으니 한컷으로 부족할만큼 만족스러웠답니다 혹시 2023년에 크리스마스 케이크를 데얼커피에서 주문하고 싶은 분들을 위해 간단하게 주문법을 알려드리자면 인스타그램으로 주문을했어요! 4가지 케이크가 있었는데 그 중 3번 구매했어요 가격은 디엠을 보내면 꼼꼼히 쓰여진 재료설명까지 적힌 텍스트를 받을수있어서 가격이랑 들어간 재료를 고려해서 구매하시면 된답니다 그리고 저녁에 드디어 오픈한 크리스마스 케이크 🎄🎄🎄🎄 너무 귀엽고 이쁘고 향긋하고 달달한 향기까지 있는 데얼커피 크리스마스 케이크랍니다 생각보다 너무 귀여워서 사진 백만장찍었어요 ㅎㅎ 사진빨이 안받는 케이크라는 생각이 절로드는 실물파 크리스마스케이크였답니다 위에 초코볼도 맛있고 메리크리스마스 글자도 귀엽고 눈사람이 생각보다 훨씬 사진에 잘나와서 혼자 호들갑 타임을 얼마나 길게 가졌는지 ㅎㅎㅎㅎ 메리크리스마스 ~~~ 얼릉 촛불을 끄고 한조각 먹어봤어요 생딸기가 들어간 케이크라서 배는 부르지만 한조각은 먹어야겠더라구요 위에서부터 한조각한조각 잘라내서 먹었어요 저는 처음에 레들벨벳말고 초코로 구매하고싶었는데 친구가 레드벨벳 먹고싶다고해서 이걸로 골랐는데 단면보고 오~~ 미쳤다 비주얼 짱이다 하면서 이거 사길 잘했다고 생각이 들었어요 굿굿 데얼커피 크리스마스 케이크는 부드럽고 많이 달지않은 풍미가득한 생크림맛이 강하게나고 진짜 딸기가 많이 들어간게 느껴지는 케이크였어요 딸기가 엄청 씹히고 그냥 맛있어요 저는 사실 그렇게 엄~청 기대하지 않았는데 생각보다 너무너무 맛있어서 대만족이더라구요 이정도로 귀엽고 이정도로 맛있다닛!! 호텔케이크 몇십만원 주고 주문하던데 저는 데얼커피에 한표줍니다 #데얼커피 #연남동케이크맛집 #연남동크리스마스케이크 저희 숙소가 바깥이 음지라서 여기 눈이 하나도 안녹았길래 겨울 느낌으로 바깥에서 사진을 한컷찍었어요 ~ 너무 귀엽쥬 ?? 맛도 최고 비주얼도 최고 크기도 큼지막해서 둘이 먹는거보다 단체로 먹기 더 ~ 좋은 크리스마스 케이크맛집 데얼커피 !! 일단 너무 맛있어서 추천드리고 캐릭터들이 다 ~ 귀여워서 실패없어서 2023 올해 크리스마스 케이크 구매하실때 데얼커피 구경해보세요 ~ 저두 올해도 데얼커피 크리스마스케이크 살수도있을거같아요 히힛 데얼커피 서울특별시 마포구 동교로38안길 21 1층"
