title,content
"연남동 홍대 테라스 카페, 마가렛 연남(디저트, 데이트코스)",연남동 디저트 핫플 마가렛 연남 위치 서울 마포구 성미산로29길 10 1층 전화) 0507-1382-6412 운영시간 매일 11:00 - 22 :00 ※ 반려동물 테라스 좌석 이용 가능 날씨가 조금씩 선선해지면서 테라스 카페나 브런치집이 가고싶어 검색해서 가 본 마가렛 연남 도착하자마자 기대이상으로 예쁜 공간에 감탄했어요 친구들이랑 여기 뭐야뭐야? 호들갑 테라스 자리는 이렇게나 이쁘게 마련되어있다구요 프랑스 남부 온 줄 알았잖아요 여행 온 느낌이라 기분 업업 이렇게나 예쁘고 날씨도 좋은데 사진 안찍으면 아쉽잖아요 멋진 외관에 정신 못차리고 있었는데 들어가서 더 정신 못차렸어요^^ 한 가운데 디스플레이된 정말 예쁜 디저트들과 매장 분위기 어쩌죠? 빈티지스러운 조명도 한 몫하구요 매장 소품 하나하나 눈을 뗄 수가 없는 인테리어 이런 공간에서 커피와 달달한 디저트를 먹는 건 힐링 그 자체잖아요.. 행복 매장 왼쪽에 구비된 그릇과 집게를 사용해서 원하는 디저트를 가져가서 계산하시면 됩니다! 정말 다 먹어보고싶은데 떡볶이에 볶음밥까지 먹은터라.. 마가렛 연남의 베스트 디저트인 바닐라큐브와 얼그레이자몽케이크 2개만 주문했어요! 홀케이크도 [네이버예약]으로 가능하다고 합니다! 1층에 있는 공간이에요 테라스에 앉고 싶어서 찾은 카페인데 생각보다 햇빛이 강해서 내부에서 앉기로 했어요 하지만 내부 공간도 테라스만큼이나 취향저격이라 굳이 안나가도 되.. 통창이 있는 창가자리 선택! 초록초록 플랜테리어 덕분에 꼭 테라스에 앉은 느낌이었어요 밖을 보기만해도 힐링 그 자체 자꾸만 눈이 가는 오브제들 색감이 정말 예뻐요 올리브색 와인잔은 훔쳐가고 싶다.. 2층 공간도 궁금해서 한번 올라가보았는데요 통창에 창문이 많아서 그런지 따스한 햇살이 여기저기 들어와 예쁜 인테리어와 소품들이 빛이 나는 느낌 반짝반짝! 눈이 호강중.. 원색가구와 소품으로 포인트를 준 멋진 공간 2층 테라스 자리가 기가 막혔는데 이미 착석하고 계셔서 사진은 못 찍었어요ㅠ 마가렛 연남 가시면 2층 테라스 자리도 꼭 가보세요! 아메리카노와 달달 디저트는 정답이죠 저는 얼그레이 맛에 상큼한 자몽이 톡톡 터지는 얼그레이 자몽케이크가 넘나 맛있었어요 다음 생일에 홀케이크 주문하고싶을 정도! 나가는 길까지 아름다운 마가렛 연남 추운 겨울이 오기 전에 테라스에서 달콤한 디저트먹으면서 따스한 가을 햇살 받기 정말 좋은 곳!
[수목의 일상] 외관만 예쁜 게 아닌 디저트 맛집 연남동 카페 <마가렛 연남>,"‘수목’작성_🐹 마가렛 연남 서울특별시 마포구 성미산로29길 10 1층 마가렛 연남 연남동 디저트카페 11:00-22:00 📞070-0875-6412 날씨 너무 좋은 거 아니냐며~~ 꽤 오랫동안 내 빵킷리스트에 저장돼있던 마가렛 연남 드디어 가봤당! 포장만 해오긴 했지만 내부인테리어가 넘 귀엽고 아기자기해서 나중에 매장도 이용해보고싶음 외국인 손님 분들도 많았당 월요일 점심시간이라 바쁠 시간이 아닌데도 내부에 손님이 꽤 있긴 했음 평일 저녁이나 주말에는 좀 복작복작 할 듯 날이 그렇게 덥지 않으면 테라스 자리도 괜찮을 듯? 들어가자마자 보이는 내 사랑......(초면인 빵) 마가렛 연남에서 저 네모네모한 큐브파이가 유명한 것 같던데 점심을 든든하게 먹어서 그른지 크림 왕창 든 건 별로 안 땡겨서 다른 걸로 고름! 근데 비주얼이 넘 고르고 싶게 생김 다음에 꼭 먹어줄게 액히~~ 큐브파이 맛도 꽤나 다양하다 나는 킷캣누텔라 큐브파이, 말차 큐브파이가 먹어보고싶당 큐브파이 외에도 넘 귀엽고 맛있게 생긴 애들이 잔 뜩 있어서 엄청나게 고민했다는 사실 황치즈도 막 극호인 맛은 아닌데 유튜버 가오니의 메뉴판님 보고 황며들어서 먹어볼까? 하다가 결국은 안 고름ㅋㅋㅋㅋㅋㅋㅋㅋ 완전 묵직해보이는 케이크들도 한가득 있다 담에 매장에서 먹는다면 큐브파이 한 개 케이크 한 개 이렇게 먹고싶다 (디저트만 만오천원인데요 선생님) 내가 좋아하는 바질맛 스콘도 있다 허 참나 그냥 전메뉴 도장깨기 할게요 다 맛있겠어 아주 구비되어있는 접시, 집게로 디저트를 골라준당 돼지 목에 진주목걸이네 나는 레몬컵케이크 모카는 시나몬피칸스콘 고름! 사실 저 스콘 비주얼이 좀 별로라 맛있을까?했는데 컵케이크보다 훨 맛있음 역시 먹짱의 안목이란(ㅋㅋㅋㅋ) 모카는 넘 더워서 아바라 포장해씀 메뉴 나올 동안 매장 구경했는데 주택개조카페라 공간이 꽤 넓고 좌석도 많음 2층은 안 올라가봤는데 2층에도 자리 있음 얘네 너무 귀여웡 얼룩덜룩 냥댕이들.. 보조의자도 따로 놓여져있는 센수 다음엔 매장에서 먹어봐야지~~ 레몬컵케이크는 위에 올라간 크림이랑 가운데 들어간 커드 필링이 넘 달아서 빼고 컵케이크 부분만 먹음 헤헷 솔직히 내 취향은 아니었지만 상콤달달하니 괜찮음 진짜 맛도리는 시나몬피칸스콘.. 지금 포스팅하면서도 또 사먹고싶은 맛 모두들 스콘을 드셔주세요(강조)"
[연남동 마가렛연남] 운치 있는 루프탑 디저트 카페,"안녕하세요~~ 주말 잘보내셨는지요!! 월요일이네요 ㅎㅎ 지난 주말 #연남동 #마가렛연남 에 다녀왔습니다!! 연남동은 정말 #이쁜카페 들이 많이 있었는데요~ 저는 그중 한적하고 분위기 있어 보이는 곳으로 들어갔습니다 주차는 주변 노상 공영주차장 이용하시면 될 거 같아요! 마가렛 연남 서울특별시 마포구 성미산로29길 10 1층 마가렛 연남 주소 : 서울시 마포구 성미산로29길 10 1층 영업시간 : 매일 12:00 - 22:00 ☎ : 070-8666-0559 포장, 무선 인터넷, 제로 페이 주차하고 연남동 산책을 하며 걷다가 쉬고 싶을 때쯤 보인 마가렛연남 모습이에요 외관이 정말 이쁘지 않나요 ㅎㅎ 바로 이끌려서 들어가 버렸습니다 날이 좋아서 사람들이 길에서 #벚꽃사진 많이 찍더라고요 연남동 벚꽃이 이쁜 거 같아요 ㅠㅠ 귀여운 마가렛연남 입간판입니다 아래 사진은 들어가자마자 입구에 아기자기하게 꾸며놓은 사진이에요 먼저 1층에는 야외에 #분위기 있는 자리와 안쪽에 이런 식으로 자리가 있으니 사람 몰릴 때 빼고는 자리가 은근 많아서 좋은 거 같아요 ㅎㅎ 게다가 제가 좋아하는 감성 #주택개조카페 랍니다 그리고 야외 자리는 #애견동반 이 가능한 것 같더라고요 반려견 키우시고 연남 주변에 거주하시는 분들은 마가렛연남와서 커피 드시고 가세요 야외에서!! 분위기 정말 좋습니다 제가 저녁에 가는 바람에 #베이커리 들이 쫙 빠진 진열대 모습입니다... 블로그 보면 빵 엄청 많던데 저녁시간에 가면 이런 모습을 마주하실 수 있으니 참고 바라구요 #디저트 좋아하시면 낮에 빨리 후다닥 가시는 걸 추천드립니다 진열대 왼쪽으로는 이렇게 빵을 담을 수 있는 그릇과 집게 등이 있는 자리가 있으니 꼭 그릇과 집게를 이용하시구요~ #마가렛연남 #메뉴판 입니다 저는 달달한 게 땡겨서 #바닐라라떼 를 주문했어요 아까 사진 찍을 때는 사람이 있었는데 앉아있다가 비었을 때 후다닥 찍은 창가 뷰에요 ㅎㅎ 밤이라 안 보이는 게 정말 아쉬운데 길 가는 사람 구경도 하고 조용하게 커피도 마시고 여러 가지를 즐길 수 있는 거 같습니다 주문한 바닐라라떼와 디저트가 나왔네요 빵도 은근 맛있었습니다!! 이어서 2층 내부 소개해 드리겠습니다~ 1층과 마찬가지로 예쁜 계단을 올라가면 이런 모습을 보실 수 있어요 방마다 약간의 다른 컨셉으로 자리가 있으니 골라 앉을 수도 있어서 취향에 따라 자리 앉으시면 됩니다 ㅎㅎ 곳곳에 포토존도 많으니 어떻게 찍어도 잘 나오니까 사진 많이 많이 남기세요!! 그리고 자리 잡기 힘들 거 같은 #루프탑 자리는 사람이 있어서 제대로 못 찍었어요 ㅠㅠ 꼭 저기 앉으셔서 예쁜 꽃들과 함께 사진 건져가세요 #연남주택개조카페 #마가렛연남 에서 산책하고 기분 좋게 커피 먹고 집으로 돌아왔네요 ㅎㅎ 오늘도 봐주셔서 감사드립니다~ 마가렛 연남 서울특별시 마포구 성미산로29길 10 1층"
[연남동카페] 마가렛 연남,"여러부운~ 안녕하세요!👋🏻 오늘은 연남동에 있는 베이커리카페- 마가렛 연남을 소개해드리려고해용~✨ 마가렛 연남 서울특별시 마포구 성미산로29길 10 1층 영업 시간 매일 11:00~ 22:00 출처- 네이버 참고 날 좋은날~ 오랜만에 연남동으로 놀러가써여 ㅎㅎ 마가렛 연남~ sns에서 몇번 본 적이 있어서 한번 가봐야지~ 했던 곳! 외관도 예쁘네용ㅎㅎ 매장에 들어서자마자 예쁘고 맛스러워보이는 디저트들이 많더라구요?!! 케이크 종류도 많고~ 이곳이 천국인가요 혹시~???ㅎㅎㅎ 중간 테이블에는 큐브파이, 스콘, 컵케이크 종류들이 있었어요~ 디저트가 어쩜 이렇게 예쁜지ㅜㅜ 베이커리 카페에 또 케이크가 빠지면 섭하죠~ 우와~ 케이크가 무려 13가지 종류가 있었답니다!!! 홀케이크 기준으로는 큰데 조각케이크로는 슬림한편이었어요 그에 비해 가격은 큼직 ㅎㅎ.. 커피와 음료 종류는 이렇게 있어요~ 가정집 개조형식의 2층 건물이어서 2층을 안올라가볼수가 없겠죠~ 한쪽은 이렇게 귀여운 노랑노랑한 테이블이 있었고 다른 공간에는 그냥 기본느낌! 근데 이날은 추웠어서 바람이 많이 들어와서 저는 1층으로 자리를 잡았답니다~ 1층 테이블이 있는 공간은 2층에 비해 아늑한 분위기였어요 아기자기한 소품들 구경도 하고~ 중간중간 포스터나 그림도 있어서 요리조리 둘러보기 화장실은 다행히 1층 실내에 있었는데 아마 화장실 문이 고장났던 기억이 잇었어요 (지금은 확실하지 않아요) 제가 앉은 테이블 바로 벽면에 문 없는 큰 창이 있었는데 바깥에서 햇살도 들어오고 이렇게 푸릇푸릇한 식물도 있어서 좋았어요:) 꺄하핳~~ 때마침 나온 얌얌이들~~~ -딸기 순우유케이크 -바질 토마토 스콘 -아이스 아메리카노 -패션후르츠 에이드 바질 토마토 스콘 바질 향과 맛이 나는 묵직한 바질스콘과 내가 바질이다! 하는 바질 크림치즈 그리고 새콤달콤한 토마토 진짜 바질이랑 토마토는 환상의 궁합인것같아요! 아마 바질 좋아하시는 분이면 이 디저트가 바질 맛이 진한편이라서 좋아하실꺼같아요ㅎㅎ 딸기 순우유케이크 음.. 넹 best라고 써져 있어서 기대하고 시켰던 케이크이에요 사실 순우유케이크기도 하고 아니 솔직히 딸기 케이크가 맛 없는거 쉽지 않잖아여 음 그냥 저도 그렇고.. 같이 갔던 친한엉니도 불호 였어여ㅜㅜ 크기는 작은데 가격이 있는편이니까 그래~ 요즘은 다 그래~ 라는 생각으로 넘어갔는데 맛이 없으면...참 ㅠㅠ 사실 딸기 상태도 맛도 별로였고 무엇보다도 저는 케이크 먹을때 케이크빵-시트가 중요하거든요 근데 시럽을 엄청.. 진짜 엄청 뿌린건지 뭔지는 잘 모르겠지만 바닥부분에 유산지 있는부분 안에도 흥건~ 하더라고요 ㅋㅋㅋ 갑분 입맛뚝- 빵이 설탕물이 척척해 젖은걸 먹는 느낌이라서 케이크 먹는건 멈춰써여ㅕ...또르륵🥹 아메리카노랑 에이드는 평범한 무난한 맛이라서 맛있게 먹었습니다~ 여기서 다만.. ㅋㅋㅋㅋㅋㅋㅋㅋㅋㅋㅋㅋㅋㅋㅋㅋㅋㅋㅋㅋㅋㅋ한마디만 더하자면ㅜㅜ 저 아메리카노 담겨있는 컵이여.. 흐음 코팅? 뭐라고해야하지 아무튼 그런 부분이 군데군데 떨어져 나간 부분도 있고 이제 곧 떨어질려고하는 부분도 있더라구요 마시다보면 저게 언제 뜯어져서 언제 누가 삼키게될줄 모른다는게 참 아쉬웠어여ㅜ 차라리 에이드처럼 저런 컵에 주시는게 더 맘 편하게 마실거 같더라구요~ 예 저만의 작은 생각이어씁니닷 아아~ 젝 말차러버여서 나갈때 말차 큐브파이 포장해가려고 했는데 그냥 구매하지 않았어요! 지금 이렇게 블로그를 쓰다보니까 말차는 잘못이 없었는데..그냥 살껄그랬나..? 라는 생각이 조금은 드네요 ㅋㅋㅋㅋㅋㅋㅋㅋㅋㅋ 마무리는~~ 거울샷~~~ 엉니랑 인생네컷 무조건 찍어주고~ 그와중에 다리가 아주 조금이라도 길어보이려고 정말 노력중인 저의 오른쪽 발끝이 보이시나요? ㅋㅋㅋㅋㅋㅋㅋㅋㅋㅋㅋㅋㅋㅋㅋㅋㅋㅋㅋㅋㅋㅋㅋㅋㅋㅋㅋ 연남까지 왔으니까~ 냉동고에 쟁여 둘 랜디스 도너츠! 돌아가는 길이 무겁겠지만.. 짝꿍님도 주려고 두박스나 구매했답니다~ㅎㅎㅎ 오예~ 벌써 신남!!!!!!!!!!!!!!! 네~ 그럼 우리는 다음 글에서 또 만나여~ 안늉~👋🏻 위 포스팅 후기는 광고나 협찬이 없는 내돈내산으로 이루어진 솔직후기 입니다:)"
마가렛 연남 : 디저트 맛집 연남동 베이커리 카페,"안녕하세요 햄이예요:) 주말 연남동은 어딜 가나 자리 잡기가 힘든 거 있죠🥲 결국 가려던 카페는 못 갔지만 주변에 있던 카페 중에 운 좋게 자리를 잡아서 다녀왔던 디저트 맛집 연남동 베이커리 카페 마가렛 연남 입니다! 마가렛 연남 ⏱ 영업시간 : 매일 11:00 ~ 22:00 🚗 주차불가 마가렛 연남은 주택개조 카페로 2층으로 되어 있고 주문은 1층 카운터에서 해줍니다 이날은 날씨가 꾸리꾸리해서 야외자리는 인기가 없었지만 날씨 좋은 날에는 2층 테라스석 or 1층 야외자리도 좋을듯 해요:) 1층에도 테이블이 있는데 사람들이 많아서 찍진 못했어요 초상권 지킴이😎✌🏻 디저트류는 한쪽 편에 준비되어 있는 접시와 집게를 들고 원하는 디저트를 담아서 계산하면 돼요! 스콘부터 파이, 브라우니, 케이크 등 완전 디저트 천국😇 알록달록한 비주얼의 디저트들이 하나같이 다 맛있어 보여서 고르기 힘들었던➿ 메뉴판 * MENU * 아이스 아메리카노 5,000 아인슈페너 6,500 리얼초코 큐브파이 5,800 소금초코스콘 5,300 그냥 지나치지 못했던 귀요미 미키마우스 거울🪞 초코덕후인 저랑 남자친구가 고른 디저트 초코는 못참지😚🍫🤎 운 좋게 2층에 하나 남은 자리를 잡았어요 이 자리가 단독이라 제일 좋은 자린데 다 먹고 나갈 때야 자리가 났던😂 다른 테이블들은 사람이 많아서 못 찍었어요 ㅎ 앉은 자리에서 바라본 시야👀 룸이고 테이블 수가 다른 룸 보다 적어서 비교적 조용해서 넘 좋았어요! 초록색 테이블이 제 스타일은 아니었지만 디저트는 넘 맛나 보이는 것!!!💚💚 아이스아메리카노 산미 없는 고소한 아메리카노 맛이에요 달달한 디저트 먹을 땐 커피는 무조건 아아로😙 너무 무난한 커피맛이라 더 이상의 설명은 패스-! 요즘 핫한 크로우캐년 컵에 나와서 감성이 뿜뿜✨✨ 아인슈페너 남자친구가 주문한 아인슈페너 커피 위에 크림이 올라가서 비주얼이 굿굿 달달한 커피 좋아하시는 분들께 추천합니다 크림은 약간 쫀득? 무거운 느낌의 크림이었어요! 리얼초코 큐브파이 마가렛 연남의 시그니처 디저트인 큐브파이입니다 종류가 다양하지만 초코만 눈에 보인단 말이야~~🍫👀 파이 안에는 달달한 초코크림이 쏘오옥-! 크림도 꽤 넉넉하게 들어있고 제 기준 생각보다 많이 달지는 않았어요 오히려 좋아👍🏻🤍 소금초코스콘 소금이 올라간 초코스콘이라닛?! 이름부터 최고조합인 단짠단짠이자나?! 첨 보는 조합이라 안 먹어볼 수가 없겠더라구요 ㅎㅎ 약간 쿠키 같은 느낌의 스콘이었어요 이름처럼 짠맛 나는 초코맛? 올초코이다 보니 큐브파이 보다는 더 달았어요! 이거 하나면 당충전 풀로 채워질 거 같은 단맛이에요☺️ 둘이서 열심히 먹긴 했는데 아무리 초코덕후라지만 초코+초코 조합은 투머치…💦 맛은 있는데 너무 물려서 못 먹겠더라구요 ㅋㅋㅋ 담엔 초코+다른 맛으로 먹어야겠어요 ㅎ 커피맛도 좋고 디저트도 맛있었던 마가렛 연남 후기였습니다! ✨ 알록달록한 비주얼의 디저트와 맛도 좋았던 마가렛 연남 ✨ 주말에는 웨이팅 주의! 1층은 공간이 다소 협소해서 2층을 추천드려요 ✨ 사람이 많다 보니 조금 어수선한 느낌도 있었지만 자리만 잘 잡으면 걱정 노노! 마가렛 연남 서울특별시 마포구 성미산로29길 10 1층 #연남동 #연남동카페 #마가렛연남 #디저트맛집 #베이커리카페 #홍대카페 #큐브파이 #소금초코스콘 #서이추 #서이추환영"
"[서울/마포] 연남동 크림가득 큐브파이 감성 디저트 카페, 마가렛 연남",안녕하세요:) 오늘은 연남동에 위치한 마가렛 연남이라는 카페를 소개하려하는데요! 우연히 들어간 카페가 맛있는 디저트 한가득이라 너무 좋았어요 ㅎㅎ 마가렛 연남 서울특별시 마포구 성미산로29길 10 1층 매일 11:00~22:00 영업 <외관> 카페 마가렛은 처음 볼 때 주택 같은 느낌의 외관이었어요 카페 마가렛의 포인트는 식물인 것 같더라구요..? 저희는 비오는 흐린날 방문해서 뭔가 우중충 했지만 날좋은날 방문하면 푸릇푸릇하니 넘 예쁠 것 같더라구요! <내부> 카페는 총 2층으로 이뤄져있는데요 1층에서 주문하고 자리잡은 좌석으로 가져가면 되요 1층은 이렇게 통창과 함께 이뤄진 방이 있어요 넓지는 않지만 꽤 많은 좌석이 있답니다 놓여있는 소품들도 넘 감성적이고 예쁘더라구요 야외 테라스도 있었는데요 날 좋은 날엔 저기 앉아도 좋을 것 같더라구요! 계단 따라 2층으로 올라가봤는데요 올라가는 길에도 진짜 식물들 많더라구요!! 2층은 또 다른 느낌이었는데요 이런 가운데 넓은 좌석과 함께 1층이랑 비슷한 느낌의 방이 2개가 있었어요 저희는 인원이 많아서 넓은 곳에 자리잡고! 주문하러 다시 내려갔어요 <메뉴> 아니 여기 디저트가 비주얼이 장난아니더라구요!?!? 일단 들어가자마자 다 흥분해가지고 ㅋㅋㅋ 이거 먹자 저거 먹자 했어요.. 방금까지 배부르다고 했던 사람들 다 어디감.... 여기 시그니처는 이 큐브파이인 것 같더라구요! 겹겹이 이뤄진 패스츄리 큐브파이 안에 크림이 들어있는 것 같았어요 그 외에도 디저트들이 다 맛있어보여서 고르기 너무 힘들었어요 ㅠㅠㅠ 또 너무 예쁘더라구요! 심지어 케이크도 있음... 아니 이거 언제 다 구우시는거죠..? 너무 많은데..? 고민하다가 ! 저희는 아메리카노(5000) 아인슈페너(6500) 수플레치즈케이크(7000) 킷캣누텔라큐브파이(6300) 얼그레이자몽케이크(8500) 주문했어요 4명이서 거의 1인1디저트...ㅋㅋㅋㅋㅋㅋ 가격은 착하지 않다.... 드디어 나온 음식들인데요! 아메리카노는 무난하니 괜찮았어요 양이 많지는 않더라구요! 그리고 친구가 먹은 아인슈페너! 비주얼 예쁘죵 그리고 디저트 타임인데요 그냥 한 접시에 이렇게 몰아 담아주셔서 사실 디저트 비주얼에 비해 플레이팅 비주얼이 예쁜 느낌은 아니였어요 ㅎㅎㅎ 뭐 그래도 맛만 있으면 되지..ㅋ 열심히 사진 찍어주고! 킷캣누텔라 큐브파이부터 먹어봤는데요! 겹겹이 쌓인 큐브모양 패스츄리안에 초코크림 가득이더라구요! 크림 자체가 진한 초코 맛의 커스터드크림? 같은 느낌인데 엄청 맛있다!!!! 는 아니지만 무난하니 맛있었어요 ㅎㅎ 패스츄리 자체는 맛있었답니당 그리고 얼그레이 자몽케이크는 케이크 자체는 맛있었어요 시트랑 생크림은 맛있었는데 이날 자몽이 쏘쏘한건지 조금 마이너스.. 마지막은 수플레치즈케이크인데요 딱 그 파리바게트에서 파는 기다란 치즈케이크? 딱 그거 고급진 버전이었어요 ㅋㅋ 뭔가 낯익은 맛이 반가운 느낌..? ㅎㅎㅎㅎ 이렇게 마가렛 연남에 다녀왔는데요! 빵이 종류가 진짜 많고 인테리어도 곳곳이 인스타 갬성 넘치더라구요 핫한 곳인지 방문하시는 분들이 많더라구요 ㅎㅎ 저날 저거 먹다가 단게 들어가니깐 약간 속이 니글거리더라구요 ㅋㅋㅋ... 디저트 자주 안먹는 다이어터가 되니... 맛있는 것도 잘 못먹음..ㅠ 하지만 디저트 못참죠! 기대이상의 맛집은 아니였지만 무난하니 괜찮았던 예쁜 감성 카페였답니당>< 오랜만에 간 연남동 카페랑 밥집 넘 예쁜데 많아서 조만간 또 뿌시러 가봐야겠어요 ㅎㅎ 고럼 예쁜카페를 또 찾아가기로 하며 이만 총총 🧡 #마가렛연남 #홍대카페 #연남동카페 #감성카페 #디저트카페 #홍대데이트 #연남동데이트 #홍대가볼만한곳 #연남동가볼만한곳 #홍대케이크 #디저트맛집 #예쁜카페 #핫플 #내돈내산
