title,content
홍대 연남동 데얼커피(Their coffee)_기분전환,"안녕하세요:) 여러분 혹시나 제 블로그를 들어와주셨다면 감사드립니당^_^ 오늘은 친구들이랑 연남동 카페 '데얼커피' 방문 했습니다!!!!!! 친구들이랑 당일까지 어디에서 만나지만나지 하다가 인스타에 너무 귀여운 카페가 있길래 망설임 없이 고고 했어요 요즘 날씨가 계속 더웠는데 마침 오늘은 조금 선선한 날씨였어요 물론!! 덥지만요,,,ㅎㅎㅎㅎㅎ 가자마자 문앞에 예쁘게 되어있더라구요 그래서 사진 찰칵! 이따 친구들이랑 요기서 사진찍어야지 하면서 들어갔어요 드뎌 안으로 고고!! 가자마자 커피랑 유명한 티라미수를 시켰어요 왜냐면 저희는 다이어트 중이니까 양심적으로 아.아....ㅎㅎㅎㅎㅎㅎ 셀카도 많이많이 찍고 얘기도 많이많이 하고~ 사진을 찍다보니까 커텐에 그려져있는 캐릭터가 보이더라구요 너무 귀여워서 찍었습니당 폭풍 셀카 찍었던 기억이.....ㅋㅋㅋㅋㅋ 나오자마자 친구에게 사진찍어달라고 했는데 제 친구가 사진을 진짜 잘 찍어주거든여,,,, 아니나다를까.... 역시..... 최고야.... 뭐랄까 연남동은 가는 길도 사진 찍을 곳이 많더라구요 기분 탓일까요..?? 그래서 바로 예쁘지 않나요??ㅎㅎㅎㅎㅎㅎㅎ 그림자가 웃기긴 하지만.,, 그래도 열심히 찍어준 친구 고마워ㅜ 뮤뮤 사실 이 날 친구들이랑 오랜만에 술 마시는 날이었거든여..ㅎㅎ 술 마시러 가서 진짜 이야기 엄청 많이하구 진짜 오랜만에 사진도 찍구 즐거운 시간을 보냈어요 기분전환!! 아 물론,,,, 코로나19가 아직도 위험하지만 그래도 마스크 잘 쓰고 손도 잘 씻고 다녔으니! ㅎㅎ 위험하지 않다는 건 아니니 많이 자제 해야겠어요ㅜㅜㅜ 데얼커피 서울특별시 마포구 연남로3길 23 지2호 목요일은 휴무라고 하네요! 방문하실 분들은 참고해주세요!ㅎㅎ 주절주절.. 제 이야기 들어주셔서 감사해요! 그럼 오늘은 이만 안녕! i Hasta luego!"
[picnic]연남동 연트럴파크에서 데얼커피 피크닉세트 즐기기 💖,"안녕하세요. 오랜만에 올리는 포스팅이네요! 요즘 날씨가 너무 따뜻해져서 놀러다니기 딱 좋은 날씨인 것 같아요. 작년에도 데얼커피에서 피크닉세트 대여했었는데 올해도 데얼커피와 함께 피크닉을 즐기고 싶어서 날씨 좋은 날에 한 번더 이용해봤어요 🔥 연남동 데얼커피(their coffee) 매일 12:00 ~ 21:00 목요일 휴무 데얼커피 피크닉세트는 예약을 하고 픽업을 하러 가야합니다 (예약을 하지 않으면 받을 수 없어요 ㅠㅠ) 그리고 달마다 피크닉세트 구성이 달라지기 때문에 데얼커피 인스타그램에서 피크닉세트를 확인하시면 좋아요! 저는 5월의 피크닉세트를 이용했습니다. < 5월의 피크닉세트 구성 > - 페스츄리소세지샌드위치 - 햄치즈롤꼬치2개 - 젤리푸딩 - 후실리샐러드 - 부시맨브레드(with 크림치즈, 딸기잼) - 바나나 2개 - 콜드브루에메리카노1병 구성이 아기자기하니 너무 귀여웠어요 ㅠㅠ 샌드위치 뿐만 아니라 다른 디저트까지 구성이 알차서 너무 좋았습니다! 작년보다 더욱 업그레이드 된 느낌이었어요 작년에 이용했던 데얼커피 피크닉세트입니다 작년에 아쉬웠던 건 샌드위치와 주먹밥 맛이었는데 요번 피크닉세트는 작년보다 괜찮았습니다! 종이컵에도 이렇게 사장님의 정성스러운 손길이 느껴졌습니다 👍🏻👍🏻 ( 아메리카노는 존맛 ! ) 전체적으로 맛은 괜찮았습니다! 그치만 샌드위치가생각보다 크기가 커서 먹는데 힘이 들긴했어요 ㅠㅠ 아 그리고 젤리가 정말 신기한 식감이었어요 ㅎㅎㅎ 날씨도 좋고 연트럴파크 분위기도 너무 좋아서 여유롭게 피크닉을 즐기다 왔습니다💘 2인 세트로 구성되어 있어서 한끼 식사로도 정말 좋은 것 같아요~! 🌸피크닉 준비하시는 분들에게 추천드리는 세트랍니다🌸 데얼커피 인스타그램 데얼커피(@their_coffee) • Instagram 사진 및 동영상 팔로워 7,492명, 팔로잉 2명, 게시물 418개 - 데얼커피(@their_coffee)님의 Instagram 사진 및 동영상 보기 m.search.naver.com 자세한 내용은 데얼커피 인스타그램에서 확인해주세요 ٩(๑❛ᴗ❛๑)۶ #데얼커피 #theircoffee #피크닉 #피크닉세트 #연남동 #경의선숲길 #연트럴파크 #홍대 #카페 #카페추천 #일상 #일상블로그 #서이추 #서로이웃 #서이추환영 #인스타그램 #인스타"
[연남동] 데얼커피,제 블로그엔 연남동 카페가 참 많죠.. ㅎㅎ 여전히 자주 가는 동네가 연남동이네요~ 집에서 나름 다른 곳 보다는 가까워서 ㅎㅎ 이번엔 #연남동 #데얼커피 입니다. 데얼커피 서울특별시 마포구 연남동 566-19 지2호 입구에 요로케 귀엽게 데어커피가 표시되어있네요~ 메뉴 주문하는 곳 옆에는 이렇게 소품들을 판매하고 계시네용 메뉴는 이렇습니다! 내부에는 사람들이 꽉 차 있어서 사진을 못찍었네용.. 생각보다 작았고 2인 테이블이 4-5개 정도 있었던 걸로 기억해요. 넓은 자리는 없었던 것 같고 내부도 그리 크지 않았습니다~ 저는 음료는 밀크티와 청포도에이드 디저트는 후르츠산도와 앙데얼쿠키 를 주문했어요! 컵과 쿠키게 있는 귀요미 캐릭터 왜케 귀엽죠 ㅜㅜ 귀욤귀욤 ㅎㅎㅎㅎ 맛은 생각한 바로 그 맛이었습니다 ㅎㅎㅎㅎ 밀크티는 생각보다 진해서 괜찮았어요!
연남동 :: 데얼커피 (their coffee),"연남동 :: 데얼커피, 데어커피, 카페, 라떼 시간이 남아서 가본 데얼커피 전에 에스프레소 부티크 갈때 원래 가려했던 곳인데 그땐 문을 닫아서 못갔다가ㅠㅠ 오늘은 열었을거 같아서 친구들이랑 갔다 애들아 묻지도 않고 같이 가줘서 고마워ㅋㅋㅋㅋㅋ 어디가는건지 물어보지도 않으면서 그냥 셋이 쭉 걸어가는데 좀 웃겼닼ㅋㅋㅋ 큰 테이블 하나 있고 작은 테이블 네개 정도 있는 크진 않지만 엄청 작지도 않은 카페 컵 위에 산타 뭐야ㅋㅋㅋㅋ 지금 봤당ㅋㅋㅋ 가게 한쪽이 이렇게 장식되어 있었는데 저런 사진이나 포스터든 어디서 가져오시는거지 달력 보니까 매달 바꾸시나 궁금하당 6월도 이제 거의 다 지나가는구나ㅜㅜ 학교도 이제 종강했고 생활이 많이 바뀔거 같지만 7월은 더 열심히 살아야지!! 라떼 두잔이랑 아메리카노 한잔 주세요오 마들렌이랑 에그타르트도 팔고 있었다 우린 배불러서 이거 시킬 생각도 안했네 평일 낮에는 사람이 붐비지 않아서 혼자 와서 책읽거나 할 수 있을 거 같다! 처음 들어갔을땐 큰테이블에 사람들이 꽤 있었는데 무튼 내내 꽉 차지 않고 완전 좋았다 물 따르는 곳도 귀여워ㅠㅠ 여기에도 달력이 있네~ 커피가 나왔는데 테이크아웃 잔에 그려져있는 그림들이 너무 귀엽다!!! 이래서 주문할 때 테이크아웃잔에 받으실거냐고 여쭤보셨나 보다 미리 알고 가신 분들은 강아지 그려달라고 하기도 하던데 우리는 따로 얘기 안했고 저렇게 그려주셨다 커피 이름도 적어주신거 보면 아마 주문 받는대로 스윽스윽 그리시는거 같은데 그림 못그리면... 여기 알바 못하게따 사장님이 상주하시려나...?! 데얼 라떼~! 인테리어나 그림 그려주는 특징 때문에 커피 맛에 대해서는 별 기대를 안했는데 꼬소하고 내가 좋아하는 라떼 맛이었다 친구들 천천히 마시는데 나 또 혼자 흡입한듯ㅎㅎ.. 근데 양도 꽤 많아서 오래오래 마셨다 일층은.. 아니고 지하도 아닌 것이 이것이 바로 반지하인가 봅니다 거의 뭐 평일 낮 덕후 된거 같다ㅜㅜ 아쉬운건 당분간 바쁠거 같아서 이런 여유를 즐길 수 있을지 모르겠다 힝 히히 손님 떠난 테이블 찍기 재밌어~~~ 오랜만에 셋이 같이 모여서 너무 좋았당 이제 한달 뒤에나 또 모일 수 있으려나 가격; 라떼 5,000원 데얼커피 서울특별시 마포구 연남로3길 23 지2호"
연남동 카페 :: 데얼커피(their coffee),무려 세용하용과 셋이 만난 날 리얼 역사적인 날이었다 약 10개월만에 만난 우린 데얼커피 2회차를 하러 총총••• 데얼커피 서울특별시 마포구 연남동 566-19 지2호 독립카츠있는 블럭 끝에서 꺾어 들어가면 쉽게 찾을 수 있다 흔히 아는 연남동 카페 모여있는 쪽은 아니고 놀이터 있는 곳으로 들어가면 된다! 홍대입구역 3번출구 기준 한 10분 걸으면 간다! 1월에 갔을 때는 고양이 있었는데 지금은 집만 있고 안보였다ㅠ^ㅜ 추워서 그런가?...? 외관의 분위기가 너무 좋아 진짜로ㅜ 저 원목에 써있는 저런 분위기 취저.. 고양이 보고싶었는데 뚀륵 1월에 왔을 때 산 파우치와 체크리스트 메모지! 사실 산건 아니고 랜선으로 협찬받음 (ღ’ᴗ’ღ) 파우치가 너무너무 귀엽고 취저••• 찰리 좋아하는 나에겐 더할나위 없이 좋았음 이번에는 우리 떼용이 생일이니까 초를 사봤다 ! 초가 졸귀•• 근데 우리 중 아무도 라이터 없음ㅋㅋㅋㅋㅋㅋㅋㅋㅋㅋㅋㅋㅋㅋㅋㅋㅋㅋㅋ 그래도 분위기는 내겠다고 티라미수에 스윽 꽂아봄.. 마이러브 또 생일 축하해ㅎㅅㅎ❤️ 아이스아메리카노 말차우유 데얼커피 티라미수 쿠키 저번에도 먹었던 존맛탱커피 아인슈페너같은 크림 밑에는 라떼가 있어서 아메리카노를 부담스러워하는 나에게는 딱이다 크림도 부드럽고 많아서 호로록 먹기에 너무 좋다☺️ 떼용이가 산 초코쿠키 겉 바 속 쫀 느낌 눈알 먹는 너네 너무 잔인해ㅜ 데얼커피 3회차 존버 갠적으로 딸기 우유 생겼으면 좋겠다ㅜ^ㅠ 굿즈 너무 귀엽고 취저
"[연남동 카페] 데얼커피 their coffee, 귀여운 카페","데얼커피 their coffee 서울특별시 마포구 연남동 390-56 매일 13:00 - 21:00 , 목 휴무 연남동 가면 가보고 싶었던 카페. 바로 '데얼커피(their coffee)'에요. 왜냐면 제가 구독자이기 때문이죠! 이번에 연남동 간 김에 다녀왔어요. ▪️데얼커피 정보 ✔️ 위치 : 서울 마포구 동교로38안길 21 ✔️ 시간 : 13시 - 21시, 목 휴무 홍대입구 3번 출구에서 도보 9분이에요. 보이는 건물 외관의 입구로 들어와서 2층으로 올라오면 입구가 있어요. 유튜브에서 직접 하나씩 붙이시던 데얼커피 문구가 보여서 너무 신기했어요. 친구랑 저는 토요일 3시쯤에 갔는데 좌석이 없어서 웨이팅 걸고 나왔어요. ( 사장님께 연락처 알려드리면 돼요! ) 딱 들어가면 바로 왼쪽에 카운터가 있어요. 카운터 옆에 디저트 쇼케이스가 보여서, 판매하시는 케이크랑 쿠키를 볼 수 있어요! ( 그리고 귀여운 초도 판매하고 있어요 ) 바로 디저트 옆에는 음료 쇼케이스가 있어요. 그리고 음료 메뉴판도 있었어요. 시그니처인 데얼커피도 있었어요. 카운터 옆으로는 데얼커피 굿즈가 보여요. 직접 제작하신 캐릭터로 만드신 굿즈가 전시되어 있어서 구경할 수 있어요. 떡메모지, 마스킹 테이프 등 문구류와 파우치, 텀블러, 컵 등을 판매하고 있어요. 굿즈 하나하나 너무 귀여워서 보는 재미도 있었어요! 주말이어서 좌석은 진짜 계속 꽉 차 있었어요. 그래서 내부 사진은 이렇게밖에 못 찍었어요. 데얼커피 내부는 다른 카페보다 아담한 느낌이에요. 3~4명에서 앉을 수 있는 8~9좌석이 있어요. 주문한 음료와 디저트가 나왔어요. 저희는 이렇게 주문했어요! ✔️ 로얄밀크티 6.5 ✔️ 말차우유 6.5 ✔️ 티라미수 6.0 얼음 담긴 컵과 우유병, 티라미수를 직접 가져다주셨어요. 우유병이랑 컵에도 데얼커피 캐릭터가 그려져 있었어요. 그리고 센스 넘치게 다른 캐릭터로 주셨어요! 또 티라미수는 주문 들어오는 즉시 만들어주세요. 유튜브 보면 만드시면 장면 나와요. 궁금하신 분들은 유튜브에 '데얼커피'! 사진을 진짜 열심히 찍어보려고 했는데, 망했어요. 내부가 좁아서 어떻게 찍어도 옆 사람이 나와요ㅠ 최대한 찍어본 결과물이애요ㅠㅜㅜㅠ 사진 찍는데 옆에 좌석 분께서 나가시더라고요. 그래서 사장님께 여쭤보고 자리를 옮겼어요. 이 자리가 그나마 프라이빗한 자리라서 옮겼어요. (( 탁자에 자리 옮기지 말라고 쓰여있어서 여쭤봤어요 )) 그러고 보니 아직도 디저트 후기를 안 썼네요? 그럼 이제 써볼게요~ ▫️말차우유 6.5 100% 유기농 제주 말차, 우유, 비정제 설탕으로 만든 말차우유. 병채로 주셔서 직접 흔들어서 따라서 마시면 돼요. 말차우유 별로 기대 안 했는데, 예상 밖으로 맛있었어요. 달달함도 적당하고, 진한 말차의 맛이 느껴졌어요! 오랜만에 너무 맛있는 말차였어요! 말차 우유 정말 추천해요⭐️ ▫️로얄밀크티 6.5 100% 홍차잎과 우유, 비정제 설탕으로 만든 로얄밀크티. 냉장 보관하고 2일 내에 마시면 된다고 해요. 이것도 맛있는 밀크티였어요. 그런데 아쉬운 점은 말차우유에 비해 연했어요. 말차우유는 진함 그 자체였는데, 이에 비해 아쉬웠어요. ▫️티라미수 6.0 티라미수는 바로 만들어주셔서 더 맛있어요. 중간에 레이디핑거도 맛있고, 크림도 맛있어요. 이 두 개의 조합이 정말 좋아요! 역시 유명한 데에는 이유가 있었어요. 무엇보다도 여기의 티라미수 매력은 바삭한 레이디핑거에요! 식감이 느껴져서 일반 티라미수보다 맛나요🤎 데얼커피가 좋았던 게 분위기가 너무 따뜻해요. 우드톤이라서 그런가(?) 뭔가 분위기가 좋아요. 그리고 내부를 한 곳 한 곳 정성스럽게 꾸며두셔서 구경하는 재미가 쏠쏠해요. ▪️총평 맛 : ★★★★☆ 가격: ★★★★☆ 분위기: ★★★★★ 서비스 : ★★★★★ 밀크티가 조금 아쉬워서 별 하나 뺏어요ㅠ 하지만 다른 것들은 진짜 진짜 맛있어요. 특히 말차우유랑 티라미수! 이건 꼭 드세요✨ 밑에는 데얼커피 인스타그램 링크⤵️ https://instagram.com/their_coffee?utm_medium=copy_link 팔로워 2만명, 팔로잉 3명, 게시물 907개 - 데얼커피(@their_coffee)님의 Instagram 사진 및 동영상 보기 instagram.com 데얼커피 서울특별시 마포구 동교로38안길 21 1층"
[연남동카페 맛집] 골목안 데얼커피(their coffee)에서 바닐라크림 올라간 데얼커피와 달달한 티라미수,"연남동에서 예쁜 카페를 찾아보다가 티라미수를 먹고싶어서 검색해서 간 연남동카페 데얼커피는 골목에 숨어있는 카페인데 엄청 핫하더라구요. 저는 저 날 처음 알게되서 처음 가본 곳인데 사람이 엄청 많아서 깜짝 놀랬어요. #연남동카페 #연남동맛집 #데얼커피 주소 : 서울 마포구 연남로3길 23 지하 전화번호 : 0507-1310-0503 영업시간 : 12:00 - 21:00 목요일휴무 주차불가 연남동카페 데얼커피는 한적한 골목길에 7개 정도의 테이블들이 있는 작은 공간인데 안에 들어가보니 사람들이 엄청 많고 계속 쉬지않고 손님이 들어오고 있었어요. 의도치않게 연남동 핫플에 가게됨ㅋㅋ 주문을 하기 위해 갔는데 음료 가격은 일반적인 가격이고 용기에 담겨있는 흑임자우유, 단호박우유 등이 있는데 이게 인기가 많은 것 같더라구요. 앙버터, 쿠키, 구운치즈케이크, 티라미수도 있어요. 저희는 연남동카페 데얼커피의 시그니쳐로 보이는 데얼커피 (6,000원) 2잔과 티라미수(6,000원)를 주문했어요. 옆에 보니 굿즈들도 판매하고 있어요. 연남동카페 데얼커피의 캐릭터들이 그려진 파우치, 에코백, 텀블러, 컵도 판매하고 있고 옆에는 음료를 만드시는 과정의 영상들이 계속 나오고 있더라구요. 기다리다보니 나온 연남동카페 데얼커피의 데얼커피와 티라미수예요. 데얼커피는 진한라떼에 바닐라빈크림이 올라간 커피고 아이스만 가능해요! 크림도 적당한 농도에 바나나 맛이 나는게 달달하고 맛있었어요. 그리고 연남동카페 데얼커피의 티라미수인데 초코파우더 팡팡에 체리하나 톡 올라간게 너무 귀여워요. 연남동카페 데얼커피 티라미수의 컷팅짤🤤 일반적인 티라미수는 빵이 에스프레소에 젖어서 촉촉하고 부드러운데 데얼커피의 티라미수는 조금 다른 스타일이었어요. 안에 빵이 조금 단단한 느낌? 에스프레소를 적시지않은 스타일 티라미수였어요. 단면은 이렇게 빵, 크림, 빵, 크림이 겹겹이 올라가 있고 초코파우더 듬뿍 올라가 있는데 맛있어요. 촉촉했으면 더 좋았겠지만 아니어도 맛있어요. 여기 약간 크림 맛집느낌!? 데얼커피 서울특별시 마포구 연남동 566-19 지2호 연남동카페 데얼커피는 연남동에서도 감나무집 근처까지 들어가야하는 안쪽에 위치하고 있어요. 손님이 꽤 많은 편이니 웨이팅이 싫으시다면 애매한 시간에 가시는거 알쥬...?🙊 미라클제이(ᴍɪʀᴀᴄʟᴇ.ᴊ)🦄(@itsmiraclej) • Instagram 사진 및 동영상 팔로워 2,138명, 팔로잉 613명, 게시물 513개 - 미라클제이(ᴍɪʀᴀᴄʟᴇ.ᴊ)🦄(@itsmiraclej)님의 Instagram 사진 및 동영상 보기 instagram.com 미라클로드🦄(@miracle.road)님이 Instagram을 사용 중입니다 팔로워 118명, 팔로잉 1명, 게시물 111개 - 미라클로드🦄(@miracle.road)님의 Instagram 사진 및 동영상 보기 instagram.com #미라클로드 #연남동카페 #연남동커피 #연남동 #연남동디저트 #연남동티라미수 #연남동데이트 #연남동맛집 #데얼커피 #연남동데얼커피 #이웃 #연남동라떼 #서이추 #연남 #서로이웃 #이웃환영 #서이추환영 #연남동까페"
Vol.Y 을지로 / 하이데어 / 연남동 / 데얼커피 / 카페스콘 / 하이웨스트,"보자마자 꽂힌 사진 계속 봐도 너무 마음에 든다 한여름 밤에 춥다며 꾸역꾸역 자켓 입기 ! 사랑하는 반스타킹 얼른 블랙도 샘플 보고싶다 !!! #을지로 #하이데어 셋이서 생일 축하하러 간 곳 요즘 핫하다는 을지로 그래서 그런지 카페가 어마어마하게 많다 카페 고르는데만 엄청 오래 걸린 듯 나름 생일 초도 꽂고ㅋㅋㅋ 소소하게 생일 파티하기 #운정 집 근처인 운정에 카페가 정말 많이 생겨 행복 거기다 카페가 정말 조용해서 이야기하기 너무 좋았다 ! 머리가 너무 밝아져서 톤 다운을 해야 하나 고민 기분전환에는 머리하는 거만큼 좋은 게 없지 ! 귀여운 아에이오우 파우치 겨울에 하나 더 소장해야지 어느 날 예쁘던 하늘 이제 곧 가을이니까 더 예쁜 하늘을 볼 수 있겠군 daedu shot :-) #연남동 #데얼커피 디저트가 정말 귀여운 곳 귀여운 디저트가 보고 싶거나 먹고 싶을 때 간다 여기에 피크닉 패키지도 있는 데 진짜 그건 꼭 ! 먹어봐야지 꼭 ! 정말 귀엽구나 ? 뼈다귀 입까지 완벽해 내 사진이 반인 포스팅이네 ? 왜 이렇게 아파 보이니..? 왜니..? 집에서 건강하게 먹기 ! 요즘 건강이 최고라는 생각이 자꾸 들어서 뭐 하나를 먹을 때도 채소 위주로 먹어야겠다는 생각이 든다 운동도 해야 하는데 ..! 언제하지...? 여기 파스타 진-짜 최고 ! 피자도 맛있었지만 파스타를 따라올 수가 없다 그만큼 너무 맛있음 사진첩을 뒤져보니 하늘 사진을 많이 찍는다는 걸 알게 됨 ㅋㅋㅋㅋㅋㅋㅋ 자연이 최고야 ! 여기가 홍대에 있는 유명한 곳이라고 했는데 왜 유명한 건지 1도 모르겠는.. 일단 껍데기에 털이 너무 있어서 보자마자 밥맛을 잃음 소정이가 사 온 보나이 스콘 따듯할 때 먹으니 더 맛있고, 잼을 발라 먹으니 더더욱 맛있었다 #연남동 #카페스콘 입구부터 상큼한 곳ㅋㅋㅋㅋ 여기 가서 한 번도 못 앉은 적이 없었는데 저번 주에는 만석이었다 디저트 먹고 싶었는데 참고로 이 날 한 시간 동안 연남동에서 카페 자리 있는 곳 찾아 헤맴 땀이 주룩 ! 이케아는 김치볶음밥과 고로케가 최고 ! 구경하기 전 필수 코스 #연남동 #하이웨스트 늘 사람이 붐비는 곳 꾸덕꾸덕한 초코 케이크를 다음에 꼭 먹고 말겠어 언제 쓰지 했는데 단숨에 다 써렸네 귀찮아서 조금씩 미뤘는데 다 쓰고 나니 마음이 편안하다 늘 다짐하지만 진짜 이제는 미루지 말고 살아야지 오늘도 다짐만 잔뜩 하며 마무리 -"
주말나들이; 데얼커피 / 용정 바른얼굴식당 / 맥주 / 연남동,"즐거운 주말을 집에만 있을 수 없기에 친구랑 또 ‘연남동’에 다녀왔어요 : ) 날씨가 좋아서그런지 사람이 증말 많았어요 핫플이라는 ‘카페스콘’ 으로 가는길에 이것저것 구경했는데 플리마켓 하는 곳에 이렇게 예쁜 꽃도 있었어요 너무예뻐서 가던길 멈추고 한장 담아보구 바로 카페스콘으로 튀튀 카페스콘에 도착해서 밖에서 사진을 열심히 찍고 행여나 자리가 없을까봐 급하게 올라갔는데 역시나 만석이었어요 흑... 흑흑 아쉬운마음에 내부사진 몇장 찍었습니다 2층 카운터있는층에는 테이블이 꽤 있었고 계단을 내려오면 1층에 세테이블..? 정도 앉을 수 있는 공간이 있었어요 하지만 오늘은 1층 2층 다 만석이고 차마 밖에앉을 수 없어서 ‘데얼커피’ 로 이동했습니다 이곳 역시 만석이었지만, 더이상은 체력적으로 이동불가 상태라 문앞에서 20분 ..? 정도 웨이팅 했습니다 : ) 전화번호를 남겨놓으면 연락해주시긴 하는데 어디갈곳도 없고 주변에 구경할 곳도 없었거든요 .. 기다리면서 오늘 새로 한 #네일아트 샷도 남기고 힘들어서 아무생각없이 멍- 한 저를 친구가 찍어주었어요 (지침..) 그렇게 웨이팅이 끝나고 나름 제일 큰 자리를 잡고 주문을 했습니다 저희는 아이스라떼 두잔과 앙데얼쿠키를 주문했어요 음료를 기다리며 열심히 사진을 남기고 드디어 ! 짠짠 💛 아이스라떼와 앙버터쿠키가 나왔어요 !!! 캬~ 커피맛은 고소해서 100점만점에 100점 !!!! 이었구요 쿠키도 맛있었어요 흐흐 .. 웨이팅 하길 잘했다 생각하며 친구랑 커피를 원샷했답니다 커피를 다 마시고 카페를 둘러봤는데 아기자기한것이 증말 귀여웠어요 이렇게 귀여운 제품들을 직접 판매도 하시더라구요 : ) 카페를 아주 만족스럽게 성공하고 저녁식사를 하러 #용정바른얼굴식당 으로 고고 했습니다 : ) 여기는 이전에 몇번 와봤었는데 양도 아주아주 만족스럽고 ^^ 맛도 있어서 급 단골집이 되었어요 딱 다섯시에 가서 운좋게 웨이팅 없이 자리에 착석 ! (이젠 잊지않고 메뉴판 샷) 올때마다 시키는 ‘만조크림파스타’ 그리고 새롭게 도전한 ‘미고랭쉬림프필라프’를 시켰어요 ~ 짠 (2) 여기 크림파스타는 진짜 최고에요! 파스타중에 무조건 #크림파스타 를 먹는 편인데 가끔 돈아까운 집이 있잖아요 여기는 다이어트하는 제 친구들도 소스까지 긁어먹는 그런집 입니다 : ) 진짜 배터지게 먹구 연남동 구경도 하고 길가에 있는 테이블에서 사진도 찍구 연트럴파크에서 열심히 소화를 시켰어용 (저녁에 맥주마시기 위해) 연트럴파크는 너무 좋은게 세상 귀여운 강지들을 만날수 있어서 너무 좋아요 ㅜㅜ 저희집에 귀여운 푸들이 있지만 밖에 나가면 또 산책나온 강아지들을 보며 심쿵하곤 합니당 그렇게 열심히 소화를 시키고 저녁이 됐을때쯤 근처 GS25 가서 맥주와 간단한 안주를 사서 길거리에 자리를 잡았어요 얼마전에 블랑을 우연히 먹었는데 늠흐늠흐 맛있더라구요 그리고 먹어보고 싶었던 아몬드! 짠(3) 사실 저는 알쓰라 반이상 남겼지만 친구랑 밤공기 마시며 노닥노닥 수다떨구 진짜 완벽한 마무리 였습니다 : ) 곧 또 놀자 !!! #연남동 #데얼커피 #카페스콘 #연남동카페 #연남동카피 #연남동공원 #연남파크 #연남동강아지 #바른얼굴식당 #연남동맛집 #연남동존맛탱 #데이트코스추천 #연남동데이트 #연남동소개팅 #연남동맥주 #맥주추천 #네일아트 #네일아트추천 #가을네일아트 #연트럴파크 #연남동공원"
