title,content
[홍대/연남동 감성카페] 데얼커피,"저 정말 카페덕후인데 카페가서 수다떤지 너무 오래된 것 같아요..0oo0 좋았어서 다시 한번 가고자 했던 카페들을 그리워하며..글을 쿰척쿰척 그 중에서도 홍대에 있는 한 카페를 추천해드릴까 합니다! 그 카페는 바로 데얼커피 12:00~21:00 목요일 휴무 데얼커피 서울특별시 마포구 연남로3길 23 지2호 홍대 3번 출구로 나오셔서 쭉 직진하는 방향으로 10분정도 가면 찾을 수 있어요! 그런데 좀 사이사이 길을 들어가야해서 네이버 길찾기 보고 가시는게 좋을 것 같아요. 가는동안 여러 카페가 자리잡고 있어 구경하면서 갔는데 연남동이라 그런지 감성카페처럼 보이는 카페들이 엄청 많더라구요ㅎㅎ 데얼커피는 다른 카페들과 달리 지하에 위치한 듯한 느낌이라 입구에 간판이 걸려있지 않고 입간판에 세워져 있어요 카페 창문에 ""Their coffee"" 라고 붙어 있는 카페 외부모습을 보여드리고 싶은데 제가 또 까먹고 안 찍어서 사진이 없네요..ㅠㅠ 그래도 네이버에 검색해보니 데얼커피 블로그 후기들이 많아서 사진 누르시면 이쁜 사진들 많이 볼 수 있어요! 홍대3번 출구에서 비교적 가까운 거리도 아니고 골목사이에 위치한 카페인데다 제가 찾아갔던 시간이 엄청 애매한 시간이어서 사람이 별로 없을 시간대임에도 불구하고 들어서자마자 많은 분들이 찾아주셨더라구요! 아! 이래서 유명카펜가?!했어요ㅋㅋ 데얼커피 내부 주문하기에 앞서 카운터 옆에 귀여운 소품들이 있어 사진 찍어봤어요 디저트는 치즈케이크, 티라미수가 주메뉴로 있고 쿠키와 같은 디저트들도 귀여운 봉지에 담겨 있었어요:) 음료 종류는 많은 편이 아니었어서 고르기 쉬웠던 것 같아요 (카페가면 뭐 마실지 하루종일 고르는 저로서는 정말 좋았답니다030!) 카라멜 마끼야또와 블루소다, 그리고 데얼커피 후기에 가득했던 티라미수!를 시켰어요 데얼커피_블루소다 & 카라멜 마끼야또 & 티라미수 직원분이 직접 가져다 주셨는데 컵 너무 귀엽지 않나요? 컵이 너무 귀여워서 똑같은 사진을 몇장이나 찍었는지... 카운터 옆에 있던 소품존에서 이 컵 구매가 가능하더라구요!! 컵 외에도 데얼커피만의 귀여운 캐릭터가 그려진 다양한 소품들이 있어요~ 음식과 디저트는 맛도 맛이지만 외관이 좋으면 맛이 배가 된다!라는 말이 이해가 되는 카페였답니다 친구가 귀엽다고 중간에 쿠키도 시켰는데 너무 귀엽지 않나요? 이제 데얼커피하면 귀여운 캐릭터들이 가장 먼저 떠오를 것 같아요>__< 카페 내부에 아기자기하고 귀여운 소품들이 자리잡고 있고 카페 내부 분위기도 너무너무 아늑하답니다ㅎㅎ 수다떨기 최적화!! 이런 귀여운 커튼같은 것도 있길래 폰에 담아왔어요ㅎㅎ 캐릭터들 보고 또 봐도 너무 귀여운 것 같아요 ( 심플한게 가장 귀엽다는 말에 너무나도 공감하는 1인 ) * * * 연남동에 항상 카페가 많아 인스타에서 후기 자주 찾아보고 검색해보곤 하였는데 그간 갔던 카페 중에 데얼커피가 가장 만족도 높았던 카페 아니었나 싶습니다0oo0 연남동에서 어디갈지 고민하신다면 가격도 맛도 분위기도 3박자가 잘 맞아떨어진 데얼커피 강추!!"
[연남동 카페]데얼커피(Their coffee),"카페 알바생의 내 돈주고 사먹는 솔직 후기 데얼 커피 Their coffee 너무 가고싶었던 카페가 있었는데 드디어 방문했다! 바로 데얼커피(Their coffee) 오늘의 게스트는 실명은 밝히지 않겠어 게스트는 바로 조크롱이다🦖 열심히 지도보고 찾아서 도착! 밖에서 봤더니 자리가 없나 해서 우물쭈물,,😓 하다가 중간 딱 한 자리 발견! 발 사진을 찍을 수 있는 게 point! 들어가자마자 이렇게 작은 거울이 아래에 놓여있다! ‘아마 발 사진 찍으라고 해놓은 거겠지?’ 역시 도착하면 자리 잡은 후 해야할 것은? 뭐니money해도 주문이지 오늘 축하할 일: 블로그 쓴 후 처음으로 메뉴판 찍어왔다 왼쪽은 메뉴판! 오른쪽은 bottle! 종류가 다양하다! 옆에 쇼케이스에서는 남은 보틀우유 종류를 보여준다 사실 밀크티가 마셔보고 싶었는데 없어서 실패 그렇지만 바로 정신차리고 블루소다 주문🌀 나의 게스트 조크롱은 청포도에이드 주문🍇 ♡̷̷̷ㅏ! 참고로 주문을 하면 자리까지 가져다주니 그냥 주문 후 가-만히 앉아계시면 됩니다! 기다리는 동안 할 일 보통 여자들끼리 가면 다들 하죠? 셀카놀이? 그렇지만 저는 블로그를 위해 인테리어 먼저 봤다는게 진실😌 너무 예쁘지 않아요? 여기서 우리가 주목해서 봐야할건 “3번째 사진” 왜냐구요? 여기서 point는 2개 입니다 1번째 포인트: 동영상 동영상이 계속 돌아가고 있는데 보고있다보면 카페에서 파는 음료 제조과정을 보여줍니다~ 혹시 어떤 음료인지 궁금하다! 하시면 주문 전!! 영상 확인 후 주문해주세요 2번째 포인트: 굿즈 카페에서 제작하는 굿즈가 팔더라구요! 떡메모지, 캘린더, 스마트톡, 파우치 등.. 예쁜물건이 많아요 “저도 캘린더 엽서를 하나 Get 했습니다 ㅎㅎ” 카페 로고 캐릭터가 귀여워서 그런지 굿즈도 너무 예쁘더라구요� 이렇게 구경하다보면 짠!하고 음료가 나옵니다! 2명이서 가면 저렇게 남여👩‍❤️‍👨 캐릭터로 예쁘게 맞춰주시더라구요! 사진찍기에 아주 제격입니다📸 아쉬운 점은 영상에서는 블루소다위에 아이스크림을 얹어주던데 실제로는 체리만 올라왔더라구요,, (🍨재고가 없었나,,,?) 여름에만 해주는 것일 수도 있구요! 보시다싶이 청포도에이드위에는 아무것도 데코가 되지 않습니다! 참고하세요! 그렇지만 데코없이도 컵이 너무 예쁘죠,,? 컵도 따로 팔더라구요! 한세트 사려다가 참았는데 나중에 사야하나 고민이 되네요💬 맛이 궁금하실테니 소개를 하자면 블루소다🌀 = 뽕따 소다맛 좋아한다하시는 분들 달려가세요🚴🏻 청포도 에이드🍇 = 청포도 좋아하시는 분들 달려가세요🚴🏻 청포도에이드는 씹히는 맛이 있는게 아마 청으로 만드는 것 같더라구요! 블루소다도 탄산이 있어서 개인적으로 음료 2잔 다 만족합니다🤗 음료만 소개하면 아쉬울테니 디저트도 소개하고 싶지만 배가 너무 불러서 시키지 못한 관계로 간략하게 말하자면 (속닥속닥) 손님들 드시는 것을 보니 티라미슈가 가장 인기가 많고 유명한 것 같아요 대부분 연남동 카페를 찾아오시는 손님들 많이 하시는 일이 사진찍기일텐데요, 정신 없이 마시다 보니 정작 셀카를 안찍었길래 뒤늦게 셀카를 시도해봤습니다 누가봐도 신나보이죠? 이 카페 오려고 여러번 생각했는데 계속 취소되다가 와서 그런지 표정에서 티가 너무 나더라구요😝 여기서 문제점 하나 발견. 자리 선정을 잘못해서인지는 모르겠지만 카페가 반지하에 있습니다! 그래서 그런지 조명으로 사진이 예쁘게 나오지는 않더라구요,, 카메라를 요리조리 돌려서 얻은 사진입니다! 필터를 잘 사용하셔야 예쁘게 나올 것 같아요🤣 저의 조크롱 귀,,엽쬬? 제 조댕이 입니다 그래도 열심히 저의 게스트와도 한 컷📸 저의 거즘 대학 동반자입니다 오늘도 저를 위해 연남동까지,,, 내 맘 알지?(나의 작은 고백 붂흐러워라☺️) 인테리어는 예뻐서 그런지 어디서 찍어도 배경은 너무 좋더라구요~ 이제 마무-으리!를 해보자면 맛: ★★★★☆ 가격: ★★★★☆ 분위기: ★★★★☆ 어쩌다보니 다 별 4개네..? 맛이 있습니다! 정말 생각하신 그 맛! 또는 그 이상의 맛이라고 정의하겠습니다 가격은 연남동에 맞게 적-당합니다! (사실 연남동 카페를 많이 가서 그런지 내 기준이 많이 오른 걸지도,,,) 분위기! 잔잔하고 아기자기하고 아기자기 하다고 너무 귀엽기만 하다 이건 아닙니다❌❌ 딱! 카페 캐릭터를 위주로 잘 꾸며져 있습니다! 흔히 말하는 insta 갬성이랄까..? 심지어 화요일인데도 늦은 시간 사람들이 waiting도 하더라구요 9시 마감으로 알고 있었는데 8시에 웨이팅해서 들어오시는 손님들 포착💥 Tip!을 하나 주자면 사람들이 정말 많이 찾아와요 그래서 자리가 없는 경우가 발생할 수 있기 때문에 시간대를 잘 조정하셔서 가셔야 할 것 같아요😭 짠 이제 이걸로 포스팅 마무리! 하 뿌듯해— 가려고 마음먹고 3번째만에 방문하여 온 저의 감탄이 가득 담긴 사진으로 포스팅은 마무리 하겠습니다🔚 p.s 오늘 사진 예쁘게 찍어주느라 고생한 조크롱🦖씨에게 마지막으로 감사를 표하며,, 위치는 아래에 나와있는 지도 확인!📍 데얼커피 서울특별시 마포구 연남동 566-19 지2호 #연남동 #연남동카페 #카페 #연남파출소 #홍대입구역3번출구 #경의선숲길 #홍대 #예쁜카페 #연남동맛집 #인스타갬성 #데얼커피 #their #후기 #카페후기"
Cafe 서울/연남동/홍대/데얼커피(their coffee),"#서울 #연남동 #홍대 #데얼커피 #Cafe #Coffee ★주의★ 저의 주관적인 의견이오니 참고만 하시기 바랍니다. 요번 소개해드릴 카페는 연남동 근처에 위치해 있습니다. 상호 : 데얼커피(their Coffe) 영업시간 : 매일 12:00 ~ 21:00 목요일 휴무 주소 : 서울특별시 마포구 연남로 3길 23 지 2호 주차 : 불가능(인근 유료주차장 없음) / 공영주차장은 있으나 사실상 없다고 보셔도 됩니다. * 홍대입구역 근처 공영주차장에서 주차하시고 15분 정도 걸으시면 됩니다. 데얼커피 서울특별시 마포구 연남로3길 23 지2호 입구 사진을 찍는다는 걸 항상 까먹네요 ㅎ 아직 많이 익숙하지 않네요 우선 들어가게 되면 동물 5마리가 반겨줍니다. 말차우유와 연유라떼, 앙버터 쿠키를 시켰습니다. 사장님이 가져다주셨고, 쿠키와 잔에 얼굴 모양이 귀엽네요 맛은 생각보다 단순했던 것 같네요.. 그냥 보이시는 그대로의 맛이에요 연유 라테는 카라멜마끼야또향 없는 커피 맛입니다 제가 교정을 해서 그런지는 몰라도 쿠키는 뭔가 앙버터랑은 잘 어울리지 않았던 것 같아요 식감이 딱딱해서 개인적으로 그리 선호하지 않습니다. 저희는 카운터 바로 앞쪽에 앉았고 전체적으로 베이직하고 낮에 갔는데 은은하게 빛이 들어오는 게 인상적이었습니다. 사진 왼쪽 상단에 보시면 데얼 커피 유튜브 채널 홍보 화면입니다. 화면이 커서 넋 놓고 보게 되네요 입구 사진은 안 찍는데 출구 사진만.... 전체적으로 넓진 않지만 조용하게 커피 드시고 싶으신 분은 가셔서 드시면 좋을 것 같습니다. 아참 화장실은 출구 왼편이고 엄청 넓고 깨끗하며 향기 나서 두 번은 더 들어가고 싶었어요 ㅎㅎ 오래 있다가 간 것이 아니라 잠깐 있다 간 거라 크게 리뷰(?) 할 게 없는 것 같습니다.. 음료 ★☆☆☆☆ 디저트 ★☆☆☆☆ 분위기 ★★★★☆ 전체 ★★☆☆☆ ※주관적인 의견입니다. 읽어주셔서 감사합니다."
연남동카페 :: 데얼커피,[연남동카페] 데얼커피 매일 12:00 - 21:00 목요일휴무 데얼커피 서울특별시 마포구 연남동 566-19 지2호 연남동 카페 데얼커피 내부에는큰테이블과 작은테이블이 여러개있다 데얼커피메뉴판 귀여운쿠키🍪🍪 타르트와 앙버터도 있었다 데얼커피 시그니처인 캐릭터들이 그려져있어서 더 귀엽당 미니초 간단하게 축하할일이 있을때 티라미수에 꽂으면 좋겠당 판매하고있는 에코백과 파우치들 에코백이 넘 귀여워서 하나 사고싶었는데 생각보다 크기가 좀 작아서 안샀다ㅠㅠ 우리컵도 존귀 깨알 테이블 댕댕이 댕댕확대 간지나는달력 저도 가지고싶어요.. 아인슈페너같았던 화분 청포도 에이드 6000원 자몽 에이드 6000원 채광이 좋았던 데얼커피 나중에 찾아오니 데얼커피는 피크닉세트로 유명하다고 한당. 미세먼지 없고 날좋을때 한번 도전해봐야겠당
"[연남동 카페] 소소한 감성이 가득한, 데얼커피","이웃님들 안녕 혀나쓰에요 제가 어제 연남동에 다녀왔어요❤️ 저는 오랜만에 서울 가니까 1일 2카페를 하고 싶어서 친구들을 만나기 전 일찍 도착해서 데얼 커피에 다녀왔어요 their coffee 데얼 커피 소소한 감성이 가득한, 디저트도 맛있는 곳 운영 시간: 오후 12:00 ~21:00 (목 휴무) 주차장 X, 와이파이 가능, 대관 가능 지도를 보고 열심히 찾아갔어요 분명 도착했는데 데얼 커피가 안 보여서 헷갈린 것 입간판 보고 바로 들어갔어요! 하얗고 깔끔한 외관 눈에 잘 띄지는 않지만 발견했을때의 기쁨이란❤️ 꺅 ㅠㅠㅠ 문 열기 짜릿 세상에서 갬성 카페 제일 조아요 티라미수 즉시 만들어 주신다고 적혀있어서 급 먹고 싶은 거 있죠?? 그리고 따수운 아메리카노도 시켰어요 저는 2~3명이 앉을 수 있는 카운터 옆자리에 앉았어요 맞은편에 보이는 갬성들 따뜻한 햇살과 노란 조명 때문에 그냥 바라보기만 해도 마음이 편해지고 힐링이 되더라구요 분위기 최고 크지 않은 요런 개인 카페 제 최애에요 그와중에 폴킴 노래 나와서 영상 분위기 좋죠?? 윽 사진 감성 땜에 마음의 안정이✨✨ 제가 앉았던 곳의 상과 수납 바구니 드뎌 티라미수와 어메리카노가 나왔어요 사장님이 자리로 가져다 주셨어요 티라미수 비주얼도 좋았고 맛있는 것 :) 코코아 파우더랑 크림이랑 쿠키쓰 앤 커피 환상~! 인스타에 올린 거 본 사람~~!!! 갬성 샷은 모두에게 자랑을❤️ 포크로 와구와구 사진을 찍고 와서 너무 조아요 사진이 많이 붙어 있어서 다 찍고 싶은데 커플이 있고 좀 조용한 분위기라 저 혼자 괜히 눈치봐서 ㅋㅋㅋㅋㅋㅋㅋ 사진찍고 오기가 부담스럽고 민망했는데 친구 카톡 보고 용기 얻어서 오지구 지리게 찍었습니다만 (실행력 무엇) 화장실은 이 문을 열고 나가자마자 보이는 하얀 문이에요 완전 가깝죠?? 사실 혼자 카페가는 거 좋아하는 데 카페 메뉴판이나 내부 사진 찍을 땐 넘 민망 ㅠ ㅋㅋㅋㅋㅋㅋㅋ 그래도 나름 꿋꿋하게 사진을 많이 찍고 왔어요 혼자 카페 가기 성공😆💕 우리 잇님들도 따뜻하고 소소한 분위기가 있는 데얼 커피에 다녀오는 건 어떠세요? 그럼 여기서 포스팅 마칠게요 안녕🖐 데얼커피 서울특별시 마포구 연남동 566-19 지2호 이 포스팅은 협찬/광고 없는 솔직 후기입니다."
<연남동 카페 / 데얼커피 their coffee> 굿즈 다 털어오고 싶은 카페,"캐릭터가 너무 귀여운 연남동 카페 Their Coffee 데얼커피 서울특별시 마포구 연남동 566-19 지2호 12:00 - 21:00 목요일 휴무 귀여운 캐릭터 굿즈 좋아하신다구요? 당.장 가세요 못사서 아른거림.. 주문하기 전에 주책zone 다음에 언니가 입양하러 올게🥺 다 내꺼해. 귀엽지만 정말 귀찮을것 같은 캘린더 굿즈 말고도 구석구석 볼게 많은 카페. 엽서 하나하나 다 갬성적 내부가 넓진 않아 옹기종기 아늑한 느낌 저 큰 테이블 말고 작은 테이블들을 더 놔줬으면 좋겠다. 뭔가 합석하기 애매쓰 허헣,, 나도 모르게 도청하고 있을것 같은 느낌적인 느낌 이제 주문을 해볼까요~ 컵 너무 귀요운거 아니냐구요 ㅠ^ㅠ 아메리카노, 라떼, 티라미수. 커피맛은 무난무난 괜찮다. 티라미수는 뭔가 설탕 씹히는 맛? 암튼 맛있음🌝 티라미수가 아주 넓찍해서 좋다 뭔가 인자한 티라미수같은 느낌. 자리가 불편해 옮겨서 또 sooda. 밤이 된 외부도 이쁘쟈나🌙 다음엔 지갑 충천해서 저 아가들 입양해 와야지~ 귀엽고 감성있는 데얼커피 후기 끝!"
[연남동카페] 데얼커피후기/연남동 인스타감성 카페 데얼커피/theircoffee,"인스타에서 가보고 싶어서 저장해 놨던 카페에 다녀왔어요. 알고보니까 진짜 집이랑 가까운데 있더라구요 ㅎㅎㅎ 우드 느낌으로 따뜻한 감성을 주는 인테리어가 외관부터 있었어요! ㅠㅠ 카페 앞에서 만난 귀여운 고양이 낮잠자고 있었어요 졸귀 저 캐릭터가 이 카페 시그니쳐더라구요. 데얼커피!! 메뉴판이구 저는 그냥 이번에는 티라미슈랑 아이스아메리카노 마셨어요 ㅎㅎ 요기 보틀우유도 파는데 쑥, 흑임자, 말차, 초코, 로얄밀크티, 생딸기 이렇게 있었어요. #연남동밀크티 를 찾는다면 요기 괜찮을 것 같아요! ㅋㅋㅋ바로 저 문구 ""티라미슈 주문하면 바로 만들어드립니다"" 에 반해서 홀린듯이 티라미슈를 시켰어요. 제가 앉은 테이블이에요. 감성카페 분위기 낭낭하죠 물 있는 곳에도 노란 꽃이 있더라구요. 전체적으로 인테리어가 따뜻한 느낌이고 조화로웠어요. ㅋㅋㅋ그리고 저 시럽이랑 설탕이 저렇게 귀여운 곳에 담길일인가요.. 귀여운걸 보면 볼 수록 힐링되는 것 같아요.. ㅎㅎㅎ테이블에서 만나는 캐릭터 ㅠㅠ 귀엽! 이렇게 데얼커피 캐릭터가 그려진 다양한 상품들을 판매하는 코너도 있어요. 주방쪽은 이 흰 천막으로 가려져있었어요. 티라미슈가 포옥 하고 들어가지 않고 살짝 웨하스 과자?같은 그런느낌의 과자가 얇게 중간에 들어가있고 커피맛이 났어요. 촉촉하고 너무 달지 않아서 맛있었어요. 그리고 크림도 부드러웠어요~ 그치만 너무 단 음료랑 마셨으면 저한테는 너무 달았을 것 같아요. 아이스아메리카노랑 마시니까 찰떡궁합 조금 더 감성있게 찍고 싶었는데 ㅠㅠㅠ!! 실물을 다 못담은 것 같아 아주 사알짝 아쉽네용 ㅋㅋㅋ일반적인 티라미슈인줄알고 폭 넣으면 포크가 들어갈줄알고 찔러봤는데 쉽게 찔러지지가 않더라구요 ㅎㅎㅎㅎ 데얼커피 가서 도란도란 이야기하니까 넘 좋았고 전체적으로 카페가 시끄럽지 않아서 좋았어요^^~~ 감성있는 데이트를 원한다면 #데얼커피 다녀오세용 상호명 : 데얼커피 전화번호 : 02-336-0503 주소 : 서울 마포구 연남로3길 23 영업시간 : 매일 12:00 - 21:00목요일휴무 데얼커피 서울특별시 마포구 연남로3길 23 지2호"
연남동 카페 데얼커피 [their coffee],"오늘은 사촌언니랑 사촌동생이랑 남동생이랑 넷이서 홍대를 와서 !! 연남동에 카페를 왔어요 !! (V•̀ᴗ-)✰ #연남동카페 #데얼커피 라는 곳인데 홍대 너무 복잡해서 연남동 쪽에서 급하게 찾아서 온 곳인데 아기자기하고 마음에 들었어요 ㅎㅎ 데얼커피 서울특별시 마포구 연남로3길 23 지2호 위치는 여기에요 ! 데얼커피에서 제작한 에코백, 텀블러, 유리컵을 팔던데 디자인이 너무 귀엽고 예뻐서 사고 싶었어요 ㅠㅠㅠㅠㅠ 😭 메뉴판 입니당 !! 벌써 크리스마스 분위기 ㅠㅠ 카페 안 디자인이 예뻐서 진짜 많이 찍었네요 사진 😋 저희는 아이스 아메리카노(4500원) 2잔과 아이스 연유라떼(5500원), 티라미수(6000원)을 시켰어요 !! ( ͡° ͜ʖ ͡°) 이게 아까 판매하던 유리컵인데 데얼커피 캐릭터 너무 귀엽지않나요 ..? 🙊 갬성쓰 ~~ 스노우로 셀카찍다가 필터 씌우니까 더 예뻤어요 🧡 작은 카페이긴 하지만 급하게 찾아간 카페치곤 티라미수도 맛있고 커피도 괜찮았어요 !! 연남동 가시는 분들 한번씩 가보시는거 추천해요 ☺️ 그럼 다음 리뷰에서 만나요 (•̀ᴗ•́)و ̑̑"
[연남동] 연남동카페/ 데얼커피/ their coffee/ 분위기 좋은카페/ 감성카페/ 귀여운 캐릭터 카페/ 카페추천,"안녕하세요!! 설 연휴도 이제 끝이네요,,,ㅠㅠ 늦었지만 이웃님들 그리고 제 블로그를 방문해주신 모든 분들 새해 복 많이 받으세요 (●'◡'●)ﾉ♥ 본론으로 돌아와서 오랜만에 이렇게 글을 씁니당 ㅎ! 오늘의 후기는 얼마전에 연남동 놀러갔었을 때 다녀온 카페 후기를 남겨볼게요 '^'@ 데얼커피 their_coffee 데얼커피 서울특별시 마포구 연남로3길 23 지2호 ※영업시간 오후 12:00-21:00 ※휴무일 목요일 연남동은 정말 오랜만에 와보는거라 네이버지도를 보면서 찾아왔어요! 기대를 가지구 카페에 들어갔습니다! 띠용,,,ㅠㅠ 만석이더라구요 그래서 저희가 내린 결론은! 웨이팅 팀이 1-2팀이면 기다려보고 그 이상이면 다른카페를 가자,,,!! 라는 결론을 내리고 친구들이 여쭤보러 갔는데 저희가 첫번째 순서더라구요 야호야호! 기다리기로 했습니다 헤헤 (그와중에 캐릭터 너무 귀여워요,,, 금손 사장님) 사진찍으면서 동네 한바퀴나 돌고오자! 하고 기념으로 앞에서 찍었는데 바로 생각보다 너무 빨리 전화주셔서 5분정도만에 바로 카페에 들어왔습니당 메뉴판[클릭해서 보셔유!] 가격은 4500-6500원 사이에요! 저는 그린티라떼를 주문했습니다 ! 음료를 기다리면서 사진을 찍어보았어요 에코백이랑 파우치 등등 데얼커피의 귀여운 캐릭터가 그려져있는 굿즈들도 팔더라구요 다시보니까 에코백이랑 컵이 너무 탐나요 ㅠㅠ 다음에 가면 꼭 사와야겠습니다 헤헤 날씨가 좋아요오~~ 조금 기다리다보니 주문한 음료들이 나왔습니다 *심쿵주의 너무 귀엽고 귀엽고 귀엽죠 다시봐도 맛있보여요,,, 맛+비주얼 둘다 잡은 데얼커피,,,짱짱 음료를 소개해드리자면 그린티라떼/ 메론크림소다/ 밀크티/ 데얼커피(메뉴이름도 데얼커피가 있었어요 ㅋㅋ!) 밑에 귀여운 디저트들은 친구들이 주문을하고와서 확인을 못했네요 ㅠㅠ 맛도맛이지만 사진찍는 재미가 아주,,짱짱 가게자체가 넓은편은 아니여서 테이블 수도 적지만 카페분위기도 너무 좋았고 중간중간 꾸며져있는게 너무 이쁘더라구요 저희는 4시40분 정도에 와서 2시간 조금 안되게 있었는데 집가기전에는 딱 저녁 시간이라 그런지 테이블이 많이 빠진 상태여서 마지막으로 사진을 찍어보았습니다 몇몇 소품은 잘보면 데얼커피 캐릭터가 그려있어요 ㅋㅋㅋ 찾는재미도 있네요 ㅎㅎ 귀여운 캐릭터 좋아하시는 분들은 정말 추천해드려요! 저의 후기는 굳이 단점을 생각하라면 카페가 작은편이고 웨이팅이 있을 수 있다. 하지만 맛도 맛있고 분위기 좋고 너무시끄럽지도 조용하지도 않아서 친구들과 소소한 대화나누기 딱 좋은 곳 무엇보다 컵이나 중간중간 그려있는 캐릭터가 귀엽다...사진찍을맛난ㄷㅏ! 저는 그럼 또 다른 후기로 돌아올게요!! 복 많이 받으시고 감기조심하시고 다음 후기에서 봬요 ✧(•́⌄•́๑)و ✧"
