title,content
연남동 홍대입구역 티오마카세 펠른 펠른페어링코스,"Perlen HAUS 위치 : 서울 마포구 성미산로22길 18 A동 1층 펠른 2호선, 공항, 경의중앙 홍대입구역 3번 출구에서 644m 문의 : 02-332-9287 매일 12:30~22:00 Break Time 17:30~18:30 Last Order 21:30 주차, 포장 50m © NAVER Corp. 펠른 서울특별시 마포구 성미산로22길 18 A'동 1층 펠른 예약 펠른 ABOUT US 진주알같이 반짝반짝 빛나는 그 이름처럼, 펠른은 공간을 방문하는 한 분 한 분의 취향을 헤아리고 집중하는 시간을 통해 펠른에서의 모든 순간들이 빛날 수 있는 경험을 제공합니다. VIEW DETAIL www.perlen.kr 지난 주 금요일, 연남동에 있는 펠른 하우스~ 회사 티동호회에서 첫번째 오프모임으로 다녀왔습니다! 주차 공간은 3대 정도 가능한데요. 펠른의 주차장 이용하기는 쉽지 않은 것 같습니다. 주차장은 연남2 공영주차장 이용하였구요. 평일 저녁 6시 30분 예약하고 왔는데 주차 관계로 조금 늦게 도착하였지만, 감사하게도 기다려 주셔서 티코스 놓치지 않고 처음부터 즐길 수 있었습니다. 티오마카세 진행하는 곳은 카페 건물이 아닌 다른 건물에 위치해 있었구요. 건물이 너무 멋졌네요. Perlen! 진주알 같이 반짝반짝 빛난다는 의미의 이름입니다. 문을 열고 들어가면, 반층 아래로 펠른의 티오마카세 공간이 연출되어 있습니다. 테이블 세팅은~ 멋스러운 조명등 앞으로 티코스 설명서와 함께 집기류가 시원한 물 한잔과 함께 준비되어 있었습니다. 냅킨은 자석으로 고정되어 있어요~ 예약한 코스는 90분으로 진행하는 Perlen Pairing Course 펠른 페어링 코스! 입니다. . . . 웰컴 드링크 숲속의 향기 바다의 소리 도시의 야경 . . . 준비해 주시는 동안 앞 쪽으로 보이는 커피 용품들 구경하는 재미도 꽤 쏠쏠 했습니다. 세련되고 감각적인 조명등의 불빛에 비쳐 꽤나 분위기 나네요. 창가쪽으로 줄지어 세워놓은 핸드드립 주전자와 자그마한 사이펀 추출기도 볼 수 있었습니다. 다른 코스를 진행하고 있는 분도 계셨던 것 같았네요. 처음 준비해 주신 음료는 웰컴 드링크 은은하고 부드러운 버블과 달콤한 제철 과일 젤리! 설명을 듣지 않고 맛보았다면, 젤리인지 알수 없을 정도로 일반적으로 생각하는 젤리보다 식감이 너무 부드럽고 매끄러워 한입에 쏙~ 산뜻한 과일향이 슬며시~ 기분좋게 올라옵니다. 두 번째로 서빙된 코스는 숲속의 향기! 허브 무스와 타임 아이스크림 섬세한 꽃향기 수박과 레몬, 과일향의 제철 원두 펠른 페어링 코스 재생 25 좋아요 0  접기/펴기 숲속의 향기 - 허브 무스와 타임 아이스크림, 섬세한 꽃향기 수박과 레몬, 과일향의 제철 원두 글래스 덮개 여는 순간은~ 기분이 너무~ 너무~ 좋았어요! 블랙 스톤 원형 접시에 담겨져 나온 허브무스와 타임 아이스크림! 설명은 생략하겠습니다~ ㅋㅋ 이번 코스에서 왠지 메인인 것 같은 느낌! 부드러운 정도는 말할 것도 없구요. 킹왕짱! 이네용~ 다음은~ 바다의 소리 파인애플, 망고, 와인 그라니따와 코코넛 소르베 그리고 함께 나온 드링크는 시원한 펜넬 허브와 달콤한 배의 논알콜 샴페인 입니다. . . . 코코넛 소르베가 너무너무 맛있구요~ 함께 플레이팅 되어 나온 과일이 잘 어울렸어요! 그리고 샴페인도 너무 산뜻~ . . . 그라니따는 처음 듣는 용어 같아 찾아보니, granita! 이탈리아어네요. 딸기, 레몬, 라임 등의 과일에 설탕, 와인, 얼음을 넣고 간 이탈리아의 대표적인 슬러시라고 합니다. 이탈리아의 시칠리아 섬에서 유래한 디저트라고 하네요~ 마지막 코스로 나온~ 도시의 야경! 체리 콤포트와 카시스, 다크 초콜릿 무스 그리고 펠른 시그니처 위스키 더치 함께 준비해 주셨습니다. 코스 이름과 너무 잘어울리는 감각의 초콜릿 무스였어요~ 함께 나온 커피는 펠른 시그니처 위스키 더치커피였는데요. 논알콜 커피인데 위스키 향이 가득한~ 고급진 느낌의 더치커피! 유리잔을 가득 채우는 커다란 아이스볼과 함께 나오니~ 더욱 맛있게 느껴집니다. . . . 커피 맛이 너무 마음에 들어서 궁금해서 조금 더 알아 보았는데요. 500ml 한 병에 42,000원 이네요. 펠른의 메뉴~ 정보차 올려봅니다. 회사 티동 동호회 첫 번째 오프모임으로 들려본 Perlen HAUS 함께하신 분들 모두~ 만족도는 완전 좋았구요! 펠른 페어링 코스로 오감만족! 힐링하고 반짝반짝~ 빛나는 눈빛으로 모두들 해산~ 했네용! 티오마카세 관심있으신 분들~ 강추입니다! #연남동카페 #연남동티오마카세 #연남동펠른 #펠른페어링코스 #위스키커피 #핸드드립커피 #내돈내산 #티오마카세"
[연남핫플/커피코스] 연남동 펠른,"식스센스 보신 분?! 저요~~~~~~~~~~~~ 저는 tvn예능 식스센스를 정말 재밌게봤었는데요 비록 지금은 끝나버렸지만 식스센스에 등장했던 커피코스카페! 그 곳을 다녀왔습니다. 비용은 1인 39,000원 네이버 예약을 통해 다녀왔습니다 주말의 경우 예약이 여유롭진 않아서 일주일전부터 예약을 했었습니다. 오늘의 코스컨셉은 설렘, 축제, 온기, 기대로 진행된다고 합니다. 설렘의 맛은 무슨 맛일까요? 아몬드 시트와 라즈베리로 만든 케이크 윗 부분 장식은 마치 꽃잎처럼 하늘하늘거리네요 함께나온 페어링 음료! 애플 사이더 로즈마리가 들어가 신선하고 향기가 좋습니다 향긋향긋~ 다크초코브라우니와 하몽 개인적으로 하몽은 접하지 못했던 음식이라 즐기지 못하였습니다 ㅋㅋㅋ 저도 어쩔 수 없는 애기입맛인가봐요 펠른의 시그니처라는 위스키 더치! 커피로 위스키를 마시는 듯한 기분을 주었습니다. 오크에서 숙성시켰다고하시는데, 향이 솔솔 나더라구요 한번쯤 체험해보기 좋았던 커피코스! 여러분도 추천드립니다 펠른 서울특별시 마포구 성미산로22길 18 A'동 1층 펠른"
연남동 펠른 커피 오마카세 : 코스로 즐기는 카페,"연남동 카페 펠른 ▫️2호선 홍대입구역 3번 출구 ▫️매일 12:30~21:00 (브레이크 타임 17:30~18:30) ▫️펠른 페어링 코스는 1인당 3만 8천 원이에요 디저트, 커피를 코스 요리로 즐기는 연남동 펠른🤍 오로지 펠른에서만 맛볼 수 있는 시그니처 메뉴로만 구성되어 있다 코스 진행시간은 약 1시간으로 펠른 마스터가 메뉴에 대한 스토리와 요리 과정을 안내해준다 웰컴 티까지 포함하면 총 4가지 코스! 가격이 아깝지 않을 만큼 만족하고 나왔던 펠른 후기 찝니다💝 내부 분위기 연남동 펠른은 바 테이블에 나란히 앉는 구조였다 생각보다 자리 간격이 꽤 넓어서 좁거나 불편하진 않았구요🤍 옷, 가방도 따로 둘 수 있는 공간이 있어서 큰 불편함은 없었다 코스 내내 펠른 바리스타 분께서 친절하게 대해주셔서 극진히 대접받는 기분💯💯 딱 정각에 맞춰서 시작되진 않았고, 먼저 도착하는 순서대로 커피 디저트 코스가 진행된다✨🤍 두근두근💝 연남동 펠른은 시즌마다 코스 메뉴, 구성이 달라진다고 한다 새로운 시즌에 또 가보고 싶을 만큼 퀄리티 짱짱 이번 테마는 커피, 디저트에 전통적인 한국의 멋을 담았다🤍 포크나 나이프가 아닌 수저를 셋팅해 주신 이유! 대략적인 팰른 코스 구성은 아래와 같다 ▫️오미자 캐비어수단 ▫️머랭 케이크, 에티오피아 원두 커피 ▫️약과, 논 알코올 칵테일 ▫️도토리 크렘브륄레, 김 크리스피칩, 대추 강정, 계피향 더치커피 커피와 디저트의 페어링 조합이 훌륭했던 코스 🥰 첫 번째 코스는 웰컴 디쉬인 오미자 차 붉은빛은 한 해의 안녕을 상징하며, 무탈하게 2022년을 보내길 기원하는 마음을 담아 내어주셨다 특히 오미자는 단맛, 쓴맛, 신맛, 짠맛, 매운맛 등 다섯 가지의 다채로운 맛을 포함하고 있어 먹을수록 매력적인 차! 여기에 톡 터지는 캐비어의 떡수단을 함께 더했다 특히 맛이 자극적이지 않아서 가볍게 입 안을 헹구는 느낌이었다 웰컴 티를 다 마신 후, 바로 두 번째 코스로 이어졌다🤍 에티오피아 원두로 만들어진 드립 커피! 펠른 바리스타 분께서 만들어 주시는 장면을 눈앞에서 볼 수 있다 많은 커피를 마셔봤지만 펠른 커피가 넘사벽 🙈🤍 코스가 진행되는 동안 매장에서 원두를 사서 가는 분도 있을 만큼 펠른 커피는 믿고 마실 수 있는 퀄리티다👍 추출한 커피는 잔에 조금씩 따라 마시도록 추천하셨다☕️ 디저트는 색동저고리의 색을 표현한 머랭 케이크가 나왔다 색감이 예뻐서 카메라 셔터를 멈출 수 없었음🙈 포슬포슬한 식감을 살린 베이스와 복숭아 매실 크림이 더해져 달달구리의 끝판왕이었다....🤍 유자 파우더의 향긋함까지 더한 매력적인 디저트! 특히 에티오피아 커피와 페어링 조합이 훌륭했다 머랭 특유의 파삭파삭한 식감이 매력적✨🤍 그 어디서도 맛보지 못한, 이 세상에 딱 하나 뿐인 특별한 디저트! 세 번째 코스는 푸른 하늘의 시원함과 청량함을 담은 논 알코올 칵테일🍸🤍✨ 처마 밑 단청을 통해 자연, 건축의 경계를 허문 선조들의 지혜를 따라 우리나라의 아름다운 자연을 맛과 멋으로 표현했다 푸릇푸릇하고 오묘한 그라데이션에 눈을 뗄 수 없었다 마무리로 거품까지 올려주는 센스! 펠른은 직접 눈 앞에서 만들어지는 장면을 보는 재미도 함께 더한다🤍🙏 보통 맥주 거품은 금방 사라지기 마련인데 논 칵테일의 기포는 시간이 지나도 꺼지지 않아서 신기했다🙈 생각보다 달지 않고 입에서 가볍게 떨어지는 맛! 디저트는 오방색 단청을 재해석한 오렌지 약과 모과 캐모마일 아이스크림을 얹어 시원한 맛을 함께 즐길 수 있다 펠른 코스 디저트는 전부 색감 깡패....✨🤍🙏 카메라가 다 담아내지 못할 만큼, 비주얼이 하나하나 다 예뻤다 약과는 살짝 딱딱해서, 숟가락으로 열심히 잘라냈다 냉동실에 살짝 얼린 약과 느낌! 시원하게 즐길 수 있는 디저트였다 디저트도 역시 논 알코올 칵테일과 페어링 굿✨🤭 세 번째 코스요리도 마음에 쏙 들었다💯 마지막 코스 요리는 펠른 올 타임 시그니처인 위스키 더치였다 직접 계피에 불을 피워서 향을 더해준다 칵테일 바에서만 볼 수 있는 퍼포먼스를 커피에 접목시키다니 펠른 바리스타 사장님 센스 백만점💯🤍 연기가 폴폴나는 커피 비주얼은 처음이구연,, 눈이 휘둥그레 😳 드라이아이스처럼 진한 계피 향이 커피를 감싼다 커피를 마실 때마다 코 끝으로 올라오는 은은한 계피 향☕️ 향이 강렬한 편은 아니어서, 부담없이 즐길 수 있다! 함께 나온 디저트는 도토리 크렘브륄레 🌰 많은 크렘브륄레를 먹어봤지만, 도토리로 만든 디저트는 또 처음 단맛은 전혀 없고 꼬숩고 담백한 맛을 느낄 수 있다 아래에는 김부각 크리스피칩이 깔려있는데, 이것도 됸맛탱 크렘브륄레 위에는 애플민트, 실고추, 생강 콩피가 올라간다 접시 바닥에 깔린 소스는 짭쪼름해서 김 크리스피칩과 같이 먹으면 더욱 맛있게 즐길 수 있다 ✨💯 오도독 씹히는 초콜릿 과자도 쏘굿 🤍🍫 마지막 식사까지 완벽 그 자체 ✨🤍 사실 그 어디서도 맛보지 못한 독특한 디저트가 많이 나와서 호불호가 갈릴 순 있을 것 같다 하지만 호기심 많고 새로운 맛 도전을 좋아한다면 강력 추천! 특히 커피 퀄리티는 어디에 내놓아도 손색 없을 정도! 처음 먹었던 에티오피아 드립 커피도 그렇고, 마지막에 나온 더치 커피까지 모두 정성이 가득한 맛이었다💝 특별한 날, 특별한 코스로 대접 받고 싶을 때 펠른 추천🥳 기대 이상으로 만족스러웠던 후기 끝! 펠른 : 네이버 방문자리뷰 943 · 블로그리뷰 383 m.place.naver.com #펠른 #연남동펠른 #연남동커피 #펠른커피 #펠른코스 #연남동오마카세 #연남펠른 #펠른후기 #펠른예약 #연남동데이트 #연남동기념일 #연남동코스요리"
연남동 에어비엔비 평화연남 펠른카페 데이트 코스,"안녕하세요! 블로그는 처음이라 어떻게 시작하는지 잘 모르는 블린이 입니다 이제 저의 일상과 속눈썹 샵을 운영하며 이쁜 사진들과 지식들을 같이 올려보려고 합니다! 많은 관심과 소통 부탁드려요 ~~ 최근에 전 22년지기 친구와 연남동에 에어비엔비 숙소를 잡고 1박 2일 여행을 다녀왔어요 ㅎㅎ 위치는 홍대입구역 3번 출구! 놀기도 좋아요 (숙소는 궁금하시면 댓글 남겨주세요) 숙소는 작고 아담한 바베큐가 가능한 옥탑 테라스 였습니다! 사진이 많이 부족하네요 .. ㅎㅎ 일단 숙소에 가기 전 홍대입구역에 있는 롯데리아에 갔는데 이게 머야! 기계식이던데 너무 신기하더라구요 !!! 바로 동영상으로 기록했어요 인천엔 이런게 없어서 ㅋㅋㅋㅋ 홍현희 님의 네고왕 덕분에 새우버거 공짜로 먹고 아주 맛있었답니다 ! 숙소로 가서 친구 메이크업 전까지 이쁜척 좀 하고 ㅋㅋㅋㅋ 쇼핑도 하고 이제 바베큐 하려면 고기랑 장을 봐야겠죠? 근데 저흰 호캉스만 다니다 보니 무슨 장을 봐야할지 모르겠어서 또 고기는 콩알만큼 사고 알찌들끼리 술은 너무 많이 샀더라구요 ( 참고로 서로 덤앤더머라 실수해도 안싸우고 그냥 웃어요 ㅋㅋㅋ 그래서 22년동안 싸운적이 없답니다 ) 하 .... 숙소까지 가는길에 다이소 똥냄새 나는 종이가방이 찢어져서 옆에 스티로폼 쓰레기로 담아버렸어요 ㅋㅋㅋㅋㅋ 다이소 똥냄새 나는 이유가 무슨 동물 똥으로 만들어서 그렇다는데 진짜인가요? (친구한테 코뿔소 똥이라고 했다가 한소리 듣고 알려줬는데 또 까먹음) 어찌저찌 전구도 다 달고 숯도 처음으로 해보고 우당탕탕 바베큐 시작이 됬네요 보시다시피 테라스도 아담하고 예뻐요 ! 흡연도 자리에서 가능하다고 하네용 고기 너무 조금사서 비마트로 또 배달 시키고 정말 사치 사치 ~~ 그래도 저흰 놀면서 돈 아끼지 말고 행복하게 놀기만 하자 마인드라 행복만 했죠 ♥ 먹다가 이제 너무 추워서 안에 들어와서 이차전 술 뿌수는데 너무 이쁘지 않나요 ? 저 플리도 노래가 다 잔잔하고 좋은거 같아요 지금도 글 작성하면서 듣고 있네요 ㅎㅎ 아 그리고 저의 레전드 꿀주 를 추천해 드릴게요 소주 1잔 토닉 2잔 봉봉 2잔 얼음까지 미쳤다 진짜 완전 작업주 ㅋㅋㅋ ,, 첫 만남에 맛있다고 드시다가 기절할 맛 (전 소주 1잔 토닉 1잔 봉봉 2잔으로 먹었답니다) 이제 다음날 일어났는데 얼굴이 뻥 안치고 1.5배 빵빵해져서 ㅋㅋㅋㅋㅋ 어이가 없더라구요 그래도 연남동 왔으니 저의 맛집은 가야겠죠? 여기 모르시는 분 없기를 ,,, 한번 먹은 후 다른 곳은 안갑니다 바로바로 평화연남!!!!! 진짜 낙곱새 맛집 양도 너무많다 ㅎㅎ 다 먹어주게쓰 전 밥이랑 비벼서 콩나물 참기름 김가루 같이 먹으면 크으... 군침 또 돈다 평화연남 서울특별시 마포구 동교로 254-1 다 먹은 후 어제 정육점 가다가 본 이쁜카페를 봐서 거기로 바로 달려갔어요! 펠른 에스프레소바 서울특별시 마포구 성미산로22길 18 펠른 에스프레소 바 메뉴들이 좀 신기하더라구요 다 처음 보는건데 전 그 중에 그라니타 콘판나 먹었답니다 음 맛은 더위사냥 비싼버전에 초코과자 씹히는 맛?? 그리고 차가워서 더 맛있는 .. 채광이 잘 들어오는 창가에 앉아서 여자놀이 도 좀 하고 여자분들 아시죠 ㅋㅋ 100장 찍어도 2~3 장 건지면 기분 째지죠 ( 전 맨날 못 찍어줘서 욕 먹습니다 >< ) 우당탕탕 저의 첫 블로그 게시물 어떠셨나요?! 피드백 주시면 넘 감사하죠 ㅎㅎ 긴 글 봐주셔서 감사하고 이웃? 해요 저희 ! ㅋㅋㅋㅋ 이쁜카페 맛집 놀러다니는거 너무 좋아해서 좋은 곳 맛집 데이트 코스 많이 올려보려고 해요 많관부 ♡"
서울여행 홍대 디저트 맛집 연남동 감성카페 펠른,"홍대 디저트 맛집 서울여행 연남동 감성카페 펠른 연남 안녕하세요~ 투윤입니다 ㅎㅎ 오랜만에 혼자만의 시간이 생겨 혼카페를 즐기고 왔는데요 ㅎㅎ 연남동이 집 근처라 가끔 시간이 날 때마다 연남동 감섬카페를 들리곤 하는데 어제 간 카페가 너무 만족스러워서 포스팅합니당 ㅎㅎ 펠른 연남은 펠른 에스프레소바라고 검색하면 나오는 곳이구요~ 펠른 에스프레소바 서울특별시 마포구 성미산로22길 18 펠른 에스프레소 바 펠른 서울특별시 마포구 성미산로22길 18 A'동 1층 펠른 펠른 에스프레소바와 펠른(하우스)이 바로 옆에 붙어 있어요~ 펠른 하우스에선 커피 오마카세를 즐길 수 있는 곳이고 펠른 에스프레소바 카페는 조금더 캐쥬얼하게 즐길 수 있는 디저트 카페 입니다 제가 방문한 곳은 펠른 에스프레소바였구요~ 커피 오마카세가 궁금하신 분들을 위해 다른 블로그 분의 후기 링크 올려놨으니 참고해보세요~ ㅎㅎ [마포] 연남동 커피 오마카세, 펠른 하우스 서울 마포구 성미산로22길 18 A동 1층 펠른 12:30 - 22:00 17:30 - 18:30 브레이크타임 21:30 라스트오더 ... blog.naver.com 펠른 연남의 겉모습은 위에 있는 테라스 때문인지 일본에 있는 집들이 생각나더라구요 ㅎㅎ 빨간 벽돌이 함께 주는 감성이 연남동 카페에 꼭들어맞는 느낌이었어요~ 펠른 연남은 밖에서도 커피를 즐길 수 있었는데요 ㅎㅎ 날이 추워져 저는 안쪽을 들어갔습니다 ~ 안에 들어오시면 나무의 중후한 색깔이 따뜻한 느낌이 굉장히 사람을 차분하게 하더라구요~ ㅎㅎ 뭔가 단순한 인테리어인데 실제로 가보면 심심하지 않고 단조로움에서 오는 매력이 느껴지는 공간이었어요~ ㅎㅎ 바깥으로 보이는 창뷰도 감성적이야~ 연남동 카페를 여기저기 많이 가보았지만 펠른 연남이 주는 조용한 느낌은 다른 곳에서 맛 볼 수 없는 매력이었습니다 혼카페하면서 잠깐이라도 책보는 걸 좋아하는데 조명도 아주 좋았어요 ㅎㅎ 자리를 잡고 펠른 연남에서 주문을 했는데요 펠른 카페에선 커피가 진짜 예쁜 잔에 예쁘게 나와서 커피를 마시고 싶었지만.. 저는 커피를 마시면 카페인 반응이 심해서 음료수와 그라니타를 먹었어요~! 그리고 카페 펠른은 디저트가 맛있기로 유명해서 디저트는 꼭 하나 시켰습니다 ㅎㅎ 베리, 트로피컬, 초코 중에서 저는 상콤한걸 좋아해서 베리류로 먹었는데 진짜 너무 너무 맛있어서 ㅋㅋㅋ 그 자리에서 쉬지않고 디저트를 다 없애버렸다는... 꼭 하나는 시켜 드세요~! 음료는 이번에 새로 나온 레몬 머틀 소다와 블라썸그라니타를 시켰습니다 ㅎㅎ 레몬 머틀 소다는 새로나와서 먹어보고 싶고 블라썸 그라니타는 넘 맛있다는 후기를 보고 가서..ㅋㅋ 결국 2개 다 시켰어요 ㅋㅋ 주문을 하고 음료가 나오기전 잠깐 둘러보는데 펠른 굿즈? 커피백을 파는 걸 볼 수 있었어요 ㅎㅎ 에스프레소잔부터 커피잔까지 펠른만의 느낌으로 꽉꽉 채웠다는 생각이 그냥 집근처 동네 카페 왔는데 이렇게 여행 온 느낌으로 좋기 있기 없기 싶고ㅋㅋ 정말 만족스러웠던 연남동 디저트 카페 펠른이었는데요~ 메뉴가 나왔는데 너무 예쁘잖아 ~ 진짜 메뉴 잘 시켰다 증말 젤 먼저 먹었던 건 제일 기대했던 블라썸 그라니타인데요 ㅎㅎ 예상했던 벨리 샤베트 느낌 그대로여서 정말 정말 맛있었어요~ ㅎㅎ 굉장히 진해서 마음에 들었답니당 ㅎㅎ 중간쯤 먹었을 때 살짝 변화가 있으면 좋겠는데 할 때!! 안에 있던 크럼블이~ 심봤다 ㅋㅋㅋ 황금 크럼블이 쏙 하고 나타났어요 ㅋㅋㅋ 맛은 살짝 버터향이 나는 아이였는데 상콤달콤 블라썸 그라니타와 넘 잘어울렸습니다~ 그리고 ㅋㅋ 제가 진짜 제일 맛있다며!!! 극찬한 이 디저트!! 펠른 연남 홍대 연남동 디저트 카페 맛집 맞아요~~ 요렇게 베리랑 함께 푹 내려서 먹으면 딱 다섯입인데 진짜 한 입 먹으면 행복해지는 기분~~ 이건 진짜 꼭 한 개 시켜드셔 보세요!! 레몬 머틀 소다는 레몬그라스 향이 은은하게 나서 너무 달지 않아 좋았던 음료였어요~ ㅎㅎ 위에 올라간 아이스를 섞어먹어도 돼고 떠먹어도 돼는데 저는 그냥 몇입 떠먹다가 섞어 먹었어요~ ㅎㅎ 중후한 느낌이 좋았던 펠른 연남 디저트도 넘넘 맛있고 진짜 음료수 종류도 한 개도 놓치지 않고 맛있어서 좋았던 연남동 디저트 맛집 카페 펠른이었습니다~ #서울여행 #연남카페 #펠른연남 #펠른 #연남동감성카페 #연남동디저트맛집 #홍대입구역디저트 #홍대신상카페 #홍대디저트맛집"
[카페] 연남동 펠른 페어링 코스,펠른에 두 세번 갔는데 갈때마다 코스가 달라서 너무 좋은 시간을 보내고 온다. 이번에는 위스키 코스로 다녀왔다. 알콜같은 논알콜 음료들과 디저트가 페어링 된 코스였다. 펠른 웰컴드링크 식전주 컨셉의 웰컴드링크로 석류와 향신료가 추가된 로이보스가 나왔다. 첫번째 코스는 샴페인 컨셉이었다. 음료는 위스키 더치 하이볼이었는데 향이 특이했다. 디저트로는 올리브와 절임과일들이 올라간 구움과자 세트였다. 펠른 첫번째 코스 펠른 두번째 코스 다음 코스는 럼 컨셉이었다. 커피 캐비어 럼파이와 핸드드립 커피가 나왔다. 평소에 캐비어를 좋아하진 않아서 디저트가 조금 걱정됐다. 그런데 향에 비해 맛이 강하진 않아서 파이랑 먹었을때 생각보다 괜찮았다. 짠! 파이 먹을때 성격차이..ㅎㅎㅎ 마지막 코스는 위스키 컨셉이었다. 스타아니스를 토치로 훈연해서 커피가 나올 잔으로 덮어놨다. 펠른 시그니처 더치 커피 더치커피에서 스모키 향이 나는데 질 어울린다. 펠른 세번째 코스 그리고 제일 기대됐던 디저트는 펠른 크림 앤 칩스! 바닐라빈 아이스크림에 귀리 크럼블과 그라노파다노 치즈 칩스가 올린 디저트다. 후기를 너무 늦기 올려서 이제 메뉴가 바뀐 것 같아서 아쉽다..ㅎㅎ 이번 코스도 너무 궁금한데 조만간 다시 방문해야겠다! #연남동 #연남 #카페 #커피 #커피오마카세 #오마카세 #디저트 #페어링 #홍대 #홍대입구역 #후식 #카페추천 #연남동 #연남카페 #홍대 #홍대입구역 #카페추천 #커피오마사케 #디저트카페
