title,content
"[연남동 카페] 스트뉴(Soutenu), 특별한 커피와 디저트가 반겨주는 연남동 끝자락의 따뜻한 공간","우리에게 '끝남동'으로 알려진 연남동 서쪽은 중심부와 전혀 다른 분위기를 갖는다. 같은 연남동이 맞나 싶을 정도로 여유롭다. 이 끝남동 골목 한 켠에 아주 멋진 공간이 문을 열었다. 연남동 카페 스트뉴(Soutenu)가 바로 그 곳. 발레에서 다음 단계로 넘어가기 위한 기본 동작, 또는 일관성의 의미를 갖고 있는 프랑스어 단어로서 두 사장님의 '변함없고 일관된 카페 운영'에 대한 다짐이 담겨있다. 정면으로 보이는 원목의 커피바 한 켠으로 하얀색 슬레이어 에스프레소 머신이 무게중심을 잡고 있다. 까다로운 조작방법으로 알려진 이 머신이 있다니! 머신 초이스에서 부터 전문가의 공간 느낌이 물씬 품긴다. 건물 정면의 통창을 비롯하여 창문이 사방으로 있어 오전 시간대 밝은 햇살이 공간을 가득 채워준다. 그 덕분에 이렇게 멋진 그림자도 포착할 수 있는 연남동 카페. 단층이지만 표면적이 꽤 넓은 이 신상 카페는 커피바 내부 또한 상당히 여유있는 편이다. 그만큼 작업 및 제조 공간이 확보되어 있다. 창가, 홀 중앙에 관계 없이 테이블이 여유있게 비치되어 있다. 창가 테이블 또한 건물과 도로 사이가 이격되어 있어 실내이지만 테라스에 온 듯한 느낌을 준다. 무언가 일부러 꾸민 것 없이 있는 그대로의 느낌이 일품이다. 차분하면서 따뜻한 내부는 그 자체만으로 쉼을 선사한다. 원목으로 된 커피바를 비롯한 가구가 따뜻함을 더한다. 연남동, 특히 연트럴파크 특성상 단체 방문 빈도가 높다. 이에 맞추어 단체 테이블은 물론, 쇼파 좌석까지 마련되어 있다. 뒷쪽 창문을 통해 제대로 '동네뷰'를 감상할 수 있는 곳. 한 켠에는 헹거가 비치되어 코트 등의 보관이 가능하다. 세심한 부분까지 고민한 흔적이 보이는 연남동 카페. 맥북 화면에 띄워져 있는 연남동 카페 메뉴판은 가독성이 꽤 좋다. 다양한 커피 라인업을 비롯하여 티를 비롯한 논커피, 그리고 티라미수와 레어치즈케이크 등의 디저트가 준비되어 있다. 다가오는 연말 시즌을 맞이하여 카운터 한 쪽에 작은 크리스마스트리 모형이 놓여있다. 연말 장식에 카페 본연의 분위기가 묻히지 않아 넘 좋은듯. 맛보고 싶은 메뉴가 많았지만 다 먹을 수는 없고, 고민 끝에 두 가지를 함께 곁들이기로 했다. 바닐라빈라떼와 티라미수,이렇게 두 가지. 바닐라빈라떼에는 직접 만든 수제 바닐라빈 시럽이 사용되는데 그렇게 진한 색상의 바닐라시럽은 처음 본다! 묵직한 원두의 풍미와 짙은 바닐라 향은 최고의 조합을 이룬다. 티라미수는 역삼동 다이닝바 비네뜨(Vignette)와의 협업으로 만들어진다. 피스타치오 티라미수가 오픈 직후부터 유명세를 타고 있지만 오리지널로 선택. 푸짐한 마스카포네의 엄청난 부드러움이 너무나도 아름다웠다! 에스프레소 한 잔을 추가하면서 방문일부터 판매를 시작한 레어치즈케이크을 곁들였다. 레어치즈는 그대로 흘러내려 접시를 채울 만큼 풍부했고, 맛도 당연히 신선하고 담백했다. 플레이팅은 바뀔 수도 있다고 하는데 주르륵 흘러내리는 형태를 유지해도 좋을 듯? 포크보다는 스푼이 더 먹기 편한데 부드러움 그 자체였다. 에스프레소에서는 추출할 때의 그 향이 그대로 났다. 그 말인 즉슨, 설탕을 굳이 넣을 필요가 없었다는 뜻. 원두의 맛을 제대로 살린 전문성에 탄복하는 순간이었다. 차분한 끝남동 전경이 보이는 뒷편 창문으로 지나가는 가을의 찰나를 바라볼 수 있었다. 유난히 노란색 빛을 가득 머금은 나무가 인상적이다. 맛과 퀄리티, 그리고 공간의 분위기와 함께 이를 뒷받침하는 호스피탈리티까지 충실하게 갖춘 곳. 앞으로 이 곳에서 펼쳐질 사계절의 모습이 기대된다. 연남동 스트뉴(@soutenu_seoul) • Instagram 사진 및 동영상 팔로워 97명, 팔로잉 0명, 게시물 27개 - 연남동 스트뉴(@soutenu_seoul)님의 Instagram 사진 및 동영상 보기 www.instagram.com <위치> 서울특별시 마포구 성미산로23안길 19 <교통편> 지하철 - 경의중앙선 가좌역 1번 출구 버스 - 사천교 하차 <영업시간> 매일 - 10:00~22:00 50m © NAVER Corp. 스트뉴 서울특별시 마포구 성미산로23안길 19 1층"
연남동 데이트 코스 추천 : 쌀국수 옥자 웨이팅 / 스트뉴 신상 카페,"연남동 옥자 그리고 연남동 스트뉴 카페 옥자 서울특별시 마포구 성미산로29길 40-15 1층 주소 : 서울 마포구 성미산로29길 40-15 1층 영업시간 : 11:00-21:00 (브레이크타임 15:00-17:00) * 재료소진시, 조기 마감 * 면추가 무료 주기적으로 가줘야 하는 연남동 옥자 처음갔을 때도 맛있었고 여전히 맛있는 곳이에요 여기는 물도 맛있습니다. 맛집은 물도 맛있다더니, 바로 옥자가 그렇습니다. 옥자 내부가 크지 않아, 피크 시간에는 웨이팅이 있을 수 있는데 쌀국수라 그런지 회전율이 높아 많이 기다리지 않아도 됩니다. 옥자에서 제일 좋아하는 메뉴는 홍쌀국수 홍쌀국수는 진짜 매워서 오늘은 일반 쌀국수를 먹기로 했어요. 양지보다는 차돌을 선호해서 차돌쌀국수 선택했습니다. 옥자 차돌쌀국수 10,500 원 가격도 저렴한 편이죠! :) 옥자 가격은 메뉴판 사진을 참고해주세요. 옥자 쌀국수 차돌쌀국수는 차돌 고기가 넓게 펼쳐져 있는 게 특징 (?) 고기로 면을 싸 먹으면 맛있어요 ㅎㅎ 면추가 고수추가해서 야무지게 다 먹었어요. 옥자에서 1인 1메뉴를 주문하면 면추가는 무료로 할 수 있어요. 저는 원래 고수를 못먹었는데, 신기하게도 옥자 고수는 진짜 맛있더라구요. 그 이후 고수 세계에 입문했어요! ⭐️ 쌀국수 완국수 ⭐️ #옥자차돌쌀국수 #옥자쌀국수 #옥자예약 #연남동옥자 스트뉴 서울특별시 마포구 성미산로23안길 19 1층 https://www.instagram.com/soutenu_seoul/ 스트뉴 (Soutenu)(@soutenu_seoul) • Instagram 사진 및 동영상 팔로워 671명, 팔로잉 2명, 게시물 42개 - 스트뉴 (Soutenu)(@soutenu_seoul)님의 Instagram 사진 및 동영상 보기 www.instagram.com 옥자 쌀국수를 먹고난 후, 연남동에 새로 생긴 스트뉴 라는 카페를 갔습니다. 연남동 외곽 쪽 카페라서 붐비지 않을 거라 생각했는데 다행히 빈 좌석이 있었어요. #스트뉴카페 #soutenu #soutenu카페 카페도 분위기고 예쁘고 커피도 맛있었던 연남동 스트뉴 카페! 내부에 생화도 있고 전체적인 소품도 감각있게 배치되어 있었어요. 다만, 공간 크기에 비해 노래소리나 말소리가 많이 울려서 조용히 대화하기는 조금 어려운 부분이 있어요. 사람들이 몰리기 전 오픈시간이나 마감시간에 가는 걸 추천합니다 :) #연남동신상카페 #연남동스트뉴 #연남동스트뉴카페 #스트뉴 다음번에도 재방문 의사 있어요! 그 땐 꼭 디저트를 먹어볼게요. 연남동 나들이로 옥자 - 스트뉴 코스 추천합니다 :) 50m © NAVER Corp. 스트뉴 서울특별시 마포구 성미산로23안길 19 1층"
스트뉴_누가 글라세 파는 연남동 카페,연남동 스트뉴 soutenu 연남동카페 / 누가글라세 안녕하세요. 꿀이언니입니다 ::) 연남동에 초밥 먹으러 갔다가 연남동에 새로 생긴 스트뉴라는 카페도 다녀왔어요. 인스타에서 디저트가 맛있어보여서 저장해둔 곳인데 오픈한지 얼마 안된 곳이더라구요 ㅎㅎ 연남동 디저트 맛있는 한적한 카페 찾으시는 분들께 새로 오픈한 스트뉴 소개합니다. 연남동 신상카페 스트뉴의 외관입니다. 연남동에서도 가장 안쪽 골목에 위치해 있었어요. 사실 초밥먹고 바로 프렌치토스트 조지러 가려고 했는데 웨이팅이 꽤 오래걸려서.. 카페 가기 전 카페로 왔답니당 ㅎㅎ 스트뉴의 내부 인테리어입니다. 엄청 깔끔한데 창도 크고 조명이랑 식물을 예쁜걸 가져다 두셨더라구요. 저 식물 올리브나무인거 같은데 너무 예뻐서 저도 탐나더라구요 ㅎㅎ 테이블도 꽤 크고 의자도 편해서 친구랑 수다떨기 좋아보였어요 ㅎㅎ 스트뉴의 메뉴판입니다. 시그니처 메뉴는 노란 표시가 붙어있네요. 요기 누가 글라세라는 프랑스식 아이스크림을 판매하고 있어서 궁금해서 와봤어요! 그리고 인스타에서 봤는데 딸기 티라미수 비주얼도 너무 좋더라구요. 주문하고 내부 인테리어도 더 살펴봤어요. 커피 머신도 좋은 거더라구용.. 액자랑 화분 다 예쁘죠 ㅎㅎ 역시 초록초록한 화분이 있어야 분위기가 사는 거 같네요. 아주아주 오픈형 주방인데 주방 디자인도 너무 예뻐서 한 컷 찍어봤어요. 저희는 예쁜 화분이 있는 창가쪽으로 앉았어요. 여기 나중에 보니까 댕댕이도 올 수 있는 반려동물 동반 가능한 카페더라구요 ㅎㅎ 연남동카페 재생 0 좋아요 0 00:00 00:00  연남동카페 스트뉴 커피 (6.5) 누가 글라세 (7.0) 저희는 시그니처 메뉴인 스트뉴 커피랑 누가글라세를 주문했어요. 스트뉴커피는 스트뉴 카페의 시그니처 음료인데 아인슈페너처럼 라떼에 크림이 올라가 있고 그 위에 브라운 치즈까지 올라가 있더라구요! 브라운 치즈가 올라간 커피는 처음 먹어보는데 커피 나오자마자 꼬릿꼬릿하면서도 달콤한 브라운치즈 향이 진하게 나더라구요. 원래 브라운 치즈 좋아해서 궁금해서 시켜봤는데 아인슈페너에 브라운치즈 조합 괜찮았어요! 그리고 프랑스식 아이스크림인 누가 글라세는 처음 먹어보는데 비주얼은 케이크처럼 생겼더라구요?? 누가글라세는 아이스크림을 베이스로 반구형으로 만든 차가운 디저트인데 피스타치오가 가득 들어있어 고소하더라구요! 그리고 괘나 꾸덕해서 양이 엄청 많았어요 ㅋㅋㅋㅋ 가격은 7천원 정도였는데 피스타치오도 맛있고 양도 많아서 만족스럽더라구요! 커피 맛도 괜찮고 디저트도 새로워서 꽤 만족스러운 카페투어였습니다. 그리고 아직 오픈한지 얼마 안지난 곳이라 사람도 적당히 있더라구요! 누가글라세 맛보고 싶은 분들께 연남동 스트뉴 카페 추천합니다. 매일 10:00 - 22:00 서울 마포구 성미산로23안길 19 1층 경의중앙가좌역 4번 출구에서661m 50m © NAVER Corp. 스트뉴 서울특별시 마포구 성미산로23안길 19 1층
[카페] 연남동 스트뉴 ‘피스타치오 티라미수’ 맛 보러 갔어요. (애견동반 가능),"연남동 스트뉴 피스타치오 티라미수 연남동 스트뉴 ⏰️ 영업시간 : 오전10시 ~ 오후10시 🚗 주차 : 가능한데 2대 정도 인듯 하니 미리 전화 해볼것! 😓 웨이팅 : 토요일 오후 3시 웨이팅 1팀 있었음. 🐶 애견동반가능 ☕️ 주메뉴 : 티라미슈 맛집! 아메리카노도 산미가 있는데 맛있었음 50m © NAVER Corp. 스트뉴 서울특별시 마포구 성미산로23안길 19 1층 (사진을 주차전에 찍었어야 했는데 말이지..ㅎㅎ) 홍대보다는 가좌역쪽에 가깝고 연남특유의 차들이 들어서지 못할 작은 골목들이 많은 길들 그쪽에 위치하고 있다. 공구르트 - 곰팡이 마켓 - 땡스오트 - 커피냅로스터스 등등 각각 개성과 정감이 넘치는 카페들이 즐비해서 걷고 싶은 동네 스트뉴 내부 분위기 Next image 인테리어가 특별하다기 보다는 깔끔하고 편안하다. 따뜩하고 여유롭다. 스트뉴는 애견 동반 카페여서 소형견을 데리고 온 테이블이 3개나 되었다. 포메라니안 두마리 / 말티즈 한마리 다들 어찌나 얌전하던지 ㅎㅎㅎ 너무 귀엽게 앉아있었다. 카페 내부에는 햇살이 잘 들어서 특히 오후 3시 쯤이 가장 이쁜 것 같다. 3시부터 6시까지 있어보니 그렇다. (지극히 나의 취향) 스트뉴 메뉴 연남동 스트뉴 메뉴 (출처 : 네이버플레이스) 디저트를 맛보러왔으니 음료는 아메리카노로 주문. 달달이 못먹는 남자친구는 바닐라빈 라떼를 주문했다. 그리고 피스타치오 티라미수! 하나씩 맛 평가를 해보자면 아메리카노 -> 산미가 강한편(개인적으로 산미 좋아함) 부드럽고 진하지 않아서 좋았음 바닐라빈 라떼 -> 우리가 아는 달달구리 라떼 바닐라빈 먹고 아메리카노 먹으면 많이 시다. 피스타치오 티라미수 -> 크림이 한가득. 빵은 얇음 크림이 너무 달지도 않고 느끼하지도 않고 맛있었음! 사이즈는 둘이서 하나 먹으면 딱 맞다. 티라미수는 어느새 홀랑 다 먹어 버렸다. 원래 아이스 아메리카노 안먹는데 이상하게 날씨가 봄같이 따뜻해서 아이스로 주문했다. 아, 어제 입춘이었다! 그래서 낮에 그렇게 따뜻했던 건가 ㅎㅎ (이번 사진은 내가 즐겨보는 아키텍추님을 참고해 보았다) 스트뉴 기록 끝. 여기는 오후 햇살 맞으며 디저트 먹으러 오기에 딱 좋아!"
연남동 스트뉴 피스타치오 티라미수,"연남동 조용한 카페 스트뉴에 다녀왔어요. 햇살도 잘 들어와서 넘 좋고, 맛있는 커피와 디저트까지 있는곳이라서 정말 만족스러운 카페라 소개해드려요 😍 연남동 스트뉴는 열정넘치는 바리스타가 정성껏 내린 커피와 실력있는 이탈리안 와인바 셰프의 특별한 티라미수, 꾸덕한 크림치즈와 신선한 과일로 만든 치즈케이크와 고소한 견과류가 가득 들어간 누가글라세가 있는 곳이에요 :) 공간들도 너무 센스있고 이쁘더라고요. 넓은 공간인데 꽉차지 않고, 여백의 미와 함께 창을 통해 들어오는 햇살, 그리고 조명, 테이블까지 정말 제가 좋아하는 분위기와 인테리어였어요 🥰 평일 낮이라서 더욱더 여유로웠고, 엄마와 함께 행복한 커피타임 가질 수 있었어요. 평일 낮의 여유로움과 맛있는 디저트를 드시고 싶으시다면 연남동 스트뉴 방문 추천입니다. 중간중간 벽에 걸려 있는 사진액자들때문에 유럽여행 느낌도 나고 좋았어요 :) 진짜 유럽 여행 딱 한번 다녀왔는데, 언젠가 또 갈수 있겠죠? 😭 아메리카노와 피스타치오 티라미수 주문했어요. 사실 저는 피스타치오 티라미수! 요게 넘 궁금해서 연남동 스트뉴에 일부러 간건데 정말 넘 맛있었어요 :) 피스타치오 원래 좋아하기도 한데 피스타치오 티라미수는 처음이라....💚 정말 부드럽고 넘 맛있더라고요. 엄마도 맛있게 잘 드셔서 일부러 찾아간 보람을 제대로 느꼈습니다 😊 화이트&우드 인테리어 그리고 센스있는 조명과 액자, 식물! 맛있는 커피와 피스타치오 티라미수까지 정말 다 만족스러웠던 연남동 카페였어요. 피스타치오 티라미수 넘맛있게 먹어서 다른 케이크나 누가글라세 먹으러 연남동 스트뉴 또 가고싶네요💗 2023.02.01 스트뉴 서울특별시 마포구 성미산로23안길 19 1층 <스트뉴> 주소 : 서울특별시 마포구 성미산로23안길 19 영업시간 : 매일 10:00 ~ 22:00"
3월 일상下 (연희동 폴앤폴리나/시오/연남동 밀라노식당/올웨이즈어거스트 제작소/스트뉴 카페/네일스티커로 셀프네일),"안녕하세요 :D 다양하게 먹고 놀기 바빴던 3월의 두 번째 일상을 들고 왔습니다-! @카페 노티드 연남 주기적으로 먹고 싶어지는 노티드 도넛! 아침부터 안국역에 줄 서서 사 먹던 노티드인데, 이제 배달이 되더라고요. 만세 만세! 근데 우리 집은 배달 안되고, 언니 집만 가능해서 언니가 사줬어요! (같은 동네인데... 오토바이론 3분 차인데... 너무 아쉽지만 통장 지켜짐) 전 바닐라 도넛을 제일 좋아하고, 추가로 고르면 거의 얼그레이를 먹거든요. 근데 이날 레몬슈가 도넛을 처음 먹어봤는데 너무 맛있어서 바로 최애로 등극했어요. (다음부턴 무조건 레몬슈가) @폴앤폴리나 연희동 이날은 언니랑 연희동에서 만나서 놀았는데, 벼르던 폴앤폴리나에서 빵을 포장해왔어요. 버스 타는 걸 별로 좋아하지 않아서 그런가? 은평구 살면서도 연희동을 잘 안 가게 되는데 갈 때마다 좋긴 해요. 폴앤폴리나는 조금 구석에 있었는데, 작은 가게지만 빵 종류가 알차더라고요. 버터 프레첼+블랙 올리브+라즈베리 스콘에 구름빵? 사서 먹었는데 저는 사진 속 버터 프레첼이 제일 맛있었어요! 저는 과자류보다 확실히 빵류를 좋아하는데, 기본 빵을 잘하는 곳을 찾기가 생각보다 쉽지 않거든요. 근데 여기는 확실히 빵을 맛있게 잘하는 곳인 것 같아요. @연희동 시오 시오는 전에도 갔었던 곳인데, 다른 맛집 찾아보기 귀찮아서 또 갔어요. 대기 시스템이 잘되어 있고 1인상으로 정갈하게 나와서 좋아요. 오랜만에 수프 카레 먹고 싶어서 주문했는데, 맛은 나쁘지 않은 정도였어요. (부산 남포동 도라보울이 진짜 맛있...) @연남동 밀라노식당 연남동 밀라노식당은 회사 대표님이 사주신다고 하셔서 평일에 다녀왔어요! 저는 사천교에서 내려서 10분 정도 걸었는데, 식당 이름이 보이는 곳에 써져있거나 입간판이 나와있는 곳이 아니라서 찾아갈 때 조금 헤맸어요. 저는 네 가지 치즈 크림 뇨끼를 주문했고 다른 분들은 아마트리치아나 파스타와 명란오일파스타를, 애피타이저로 브루스케타 2종을 모두 주문했어요. @연남동 밀라노식당 바질페스토에 들어가는 잣에 알러지가 있어서 바질 부라타 브루스케타는 먹지 못했지만, 훈제연어 브루스케타는 부드럽고 맛있었어요. 제가 주문한 뇨끼는 먹기 편한 크기에 꾸덕꾸덕한 소스가 충분했고요. (개인적으로 좋아하는 쫄깃한 뇨끼 식감은 아니어서 아쉽) 다른 분들이 주문한 메뉴도 한입씩 먹어봤는데, 명란 오일 파스타보다는 아마트리치아나 파스타가 매콤하게 입맛에 맞았어요! 점심시간이 지나고 갔더니 여유롭게 식사할 수 있어서 좋았고, 알고 보니 반려견 동반이 가능한 곳이라 네이버 지도에 즐겨찾기 해두었어요! @연남동 올웨이즈 어거스트 제작소 그리고 신상 카페 가서 차도 야무지게 얻어마셨는데, 여기 분위기 좋더라고요! 이름을 잊어버려서 열심히 검색해서 찾았어요. 올웨이즈 어거스트 제작소라니, 어떤 의미일까요? 아쉬웠던 건 테이블을 직접 제작하신 건지 조금 흔들렸다는 거? 요즘 셀프 네일에 빠져서 네일 스티커를 만 원어치를 주문했어요. #에버딘네일 이라는 스마트스토어에서 구매했는데 스티커도 정말 정말 다양한 디자인이 있더라고요. 저는 귀여운 것보다는 심플한 게 어울릴 것 같아 메탈 스티커 위주로 구매했어요. 마침 동생들이 집에 놀러 와서 각자의 퍼스널 컬러에 맞게 열심히 네일을 해줬어요. (조금 뿌듯했음) 동생 1 가을 뮤트 동생이 고른 연두색 네일에 진초록 더해주고, 골드 라인 스티커랑 마름모 스티커로 마무리! 동생 2 가을 딥 동생은 내 마음대로 청록색 네일에 베이지 네일 섞어주고 좀 더 화려하고 볼드 한 골드 스티커로 꾸미기! (뭔가 인도 전통의상 입으면 어울릴 거 같았음) 나 겨울딥인 저는 중청색 네일 꽉 채워 바르고 밤하늘에 별처럼 실버문이랑 별 스티커 왕창 붙이기! (언니가 내 손보고 호그와트 같다고 했음ㅋㅋㅋ) 아무튼 셀프 네일 놀이에 빠진 요즘인데 이제 더 이상 칠할 손이 없어서 심심해하고 있어요. @연남동 카페 스트뉴 아, 그리고 전 다니던 회사를 그만두게 되었어요! (자진 퇴사가 아니기도 했지만) 1년 동안 정말 즐겁게 일했던 곳이라 아쉬움이 가득하네요. 스트뉴는 사무실 근처에 있던 카페인데, 평일 오후에 갔더니 정말 한적하더라고요. 분위기도 좋고, 맛도 있고, 친절하신데 사람이 우리밖에 없어서 의아했던 곳! 아, 화장실은 밖에 있어서 그게 조금 불편해요. @연남동 카페 스트뉴 스트뉴는 반려견 동반 가능한 곳이라 초롱이와 함께 갔어요. 넷이서 아아 2잔, 딸기라떼, 카페라떼에 딸기레어치즈 케이크 주문했고 모든 메뉴 다 맛있었어요 :) 강아지 얼굴이 그려진 귀여운 컵에 초롱이 물도 따로 주셨고, 대표 메뉴인 누가글라세를 서비스로 주셔서 또 감동받았네요! 아무튼 스트뉴, 연트럴파크 산책하다가 조용히 들르기 좋은 카페입니다! @옐로우피자 요즘 옐로우피자 왜 이렇게 맛있죠? 주로 응암점에서 배달시켜먹는데, 서비스로 받은 새우링까지 맛있어요. 토핑은 리치베이컨체다! 모르는 사람 없게 해주세요! @불광천 카페 밍기적 다녀온 지 얼마나 됐다고, 또 다녀온 불광천 제주 감성 카페 밍기적. (김초롱 뒤통수 귀.여.워) 가오픈 기간엔 여유로웠는데, 주말이라 그런가 사람이 엄청 많더라고요. 초롱이를 데려갈 수 있는 카페라 자주 가게 될 것 같은데 (특히 벚꽃 질 때까지) 주말은 피해야겠어요! @불광천 밍기적 카페 전에 먹어보고 싶었던 제주 보릿가루로 만든 보리개역 음료와 딸기 치즈케이크를 주문해서 먹었는데, 여기 메뉴 왜 다 맛있죠? 센스 있게 보리개역에는 잘 녹지 않는 큰 덩어리의 얼음을 넣어주셨더라고요. 미숫가루는 시원하게 먹는 게 맛있는데 그렇다고 얼음 많이 넣으면 녹아서 싱거워지잖아요. 그런 디테일까지 신경 쓰신 거 같아서 좋았어요. 케이크는 부들부들 폭신폭신한 카스테라 시트에 산뜻한 치즈 크림이 올려져 있었는데 저는 당근 케이크가 좀 더 맛있더라고요 :) 도서관에 반려견 동반이 가능하게 되는 날은 오지 않겠죠...? 아무래도 조용히 있기가 어려울 테니까요. (초롱이는 진짜 조용한 강아지긴 한데..) 언니 오빠가 번갈아가면서 도서관에서 책 빌리거나 반납할 때 도서관 앞에서 기다리는 초롱이입니다. 그리고 마지막 소식..! 저희 집에 반려식물이 함께 살게 되었어요. 주말에 서울 식물원에 갔다가 다채로운 식물들한테 반해버린 이후에 식물을 키우고 싶다는 마음이 엄청 강해진 거예요. 그러다 어느 날 갑자기 동네 꽃집에서 입양해온 '나타샤 벤저민'이라는 아이랍니다. 이름은 아직 지어주지 못했어요. 좋은 이름 지어서 다시 사진 찍어올게요-! 4월엔 어떤 일이 일어날까요, 또 열심히 먹고 놀고 읽고 지내다 4월 일상으로 돌아올게요. 글 끝까지 읽어주셔서 감사합니다 :)"
