title,content
경의선숲길카페 스트뉴 커피 디저트 모두 맛있었던 연남동카페,"스트뉴 ~Soutenu~ 📍 서울 마포구 성미산로23안길 19 1층 경의중앙 가좌역 4번 출구에서661m 📞 0507-1353-1678 ⏰ 매일 11:00 - 20:00 🚗 근처 공영주차장, 유료주차장 이용 🎸 단체 이용 가능, 주차, 포장, 무선 인터넷, 반려동물 동반 저녁을 먹은 후 친구와 함께 방문했던 경의선숲길카페 스트뉴(Soutenu). 경의선숲길공원을 지나 연남동 끝자락에 위치해있어 조금 한적하고 분위기가 좋았던 곳이다. 주말 저녁이라 그런가 ? 저녁을 먹은 후 후식과 함께 대화를 하기 위해 방문한듯 보이는 사람들이 꽤 많았는데 나도 그랬다. 연남동카페 스트뉴는 전에도 방문한 적 있는데 포스팅 하려다 아직 못올려서 두번째 방문 후기에 살짝 끼워 넣어봤다. (feat.) 그땐 낮에 방문해서 조금 더 화사하고 따뜻한 느낌이었다면 이번엔 저녁에 가서 어둡지만 더 분위기 있고 무드가 느껴졌던. 아메리카노 + 라떼 + 딸기케이크 + 얼그레이케이크 이렇게 주문했었는데 맛있었다. 역시 1인 1케이크 하길 잘했다 ◠ ͜ ◠ 맛도 맛이지만 이때의 기억이 너무 좋아서 재방문하게 됐는데 과연 두번째 방문은 어땠을지 - 아래의 포스팅에서 확인하세요. 카페에 들어가니 분위기 있게 꾸며진 내부가 보였다. 화이트&우드로 꾸며진 이 곳은 음료, 디저트가 만들어 지는 곳. 일단 카페를 둘러보기 전에 자리를 잡고 주문을 먼저 했다 ! 경의선숲길카페 스트뉴 메뉴판 다양한 커피 메뉴와 밀크티를 포함한 논커피메뉴, 티 등 다양한 음료들을 판매하고 있었다. 디저트는 대표적으로 티라미수, 레어치즈케이크를 선보이고 있는데 계절마다 조금 씩 달라지는 맛있는 레어치즈케이크를 맛볼 수 있는 곳이다 ⊹⁺⸜(ᐡ⸝ɞ̴̶̷ ·̮ ɞ̴̶̷⸝ᐡ)⸝⁺⊹ 경의선숲길카페 스트뉴는 2-3인의 소인원과 4명 이상 다인원이 수용 가능한 다양한 테이블과 의자가 준비되어 있었다. 나는 그중에서도 소파자리에 착석했다 ! 완전 편해보이죠 🛋️ 전체적으로 화이트에 우드를 끼얹은 차분한 인테리어가 특징. 낮에 왔을 때도 정말 예쁘다고 생각했는데 밤에도 너무 예쁘고 분위기 있어서 어쩔 수 없이 또 카페 내부 사진만 오조오억장 찍어버렸다 ☆～（ゝ。∂）정말 어쩔 수 없었다구요 ! 진짜로 ! 그래서 연남동카페 스트뉴는 어떤 분위기냐고요? 진짜 너무 예쁘죠,,•( ɞ̴̶̷ ｡ ɞ̴̶̷ ) ‧˚₊♡̷̷̷ 감성 넘쳐서 너무 예뻤다. 아늑하고 분위기 있어서 데이트 하기도 좋고 친구와 함께 대화 나누기도 좋은 카페였다. 무엇보다 내가 자리잡은 자리가 소파좌석이라 그런가? 너무 편했다 ! 경의선숲길카페 스트뉴는 나처럼 인스타감성카페를 찾으시는 분들이 방문하기 좋다. 그렇게 소파좌석에서 늘어져서 친구와 수다떨고 있다보니 우리가 주문한 메뉴가 나왔다. 너무 맛있겠죠..? Soutenu Order List 🧾 아이스 카페라떼 5500원 스트뉴 커피 6500원 청포도 레어치즈케이크 8500원 스트뉴 커피 Soutenu coffee 6500원 진한 라떼위 카라멜크림 그리고 브라운치즈, 크림치즈를 올려 토치로 구워드립니다. 지난번에는 라떼를 맛봐서 이번엔 시그니처 메뉴를 주문. 혹시 많이 다냐고 여쭤봤는데 브라운치즈가 올라가고 토치로 구워주신다는 설명을 듣자마자 맛은 물론 포포몬쓰도 쩔거 같아서 스트뉴커피로 주문해봤다,,, I am 기대해요. 경의선숲길카페 스트뉴 커피 디저트 모두 맛있었던 연남동카페 (1) 재생 0 좋아요 0  접기/펴기 경의선숲길카페 스트뉴 커피 디저트 모두 맛있었던 연남동카페 (1) 대박,,, 아니 커피에 브라운치즈 올라간 것도 되게 신선한데 토치로 구워주는 퍼포먼스까지 선보여주시다니 정말 대박,, 이런게 바로 시그니처 음료 아니겠어요? 너무 맛있겠죠 토치로 굽는데 브라운치즈랑 크림치즈가 그을리면서 브라운치즈 특유의 고소한 향이 올라와서 너무 좋았다 - 설탕도 아니면서 크림브륄레 느낌으로 톡 톡 두드려줬는데 단단한 느낌은 아니고 막이 생긴 느낌이었다. 아니 근데 위에 크림이 진짜 미쳤다. 브라운치즈 향이 입혀져서 고소하고 크림은 부드러운데 너무 맛있어서 Kijul이었다 진짜 ㅠㅠ 아래에 깔린 라떼도 너무 맛있고 전체적으로 거부감 있게 단 맛이 아니라서 정말 맛있게 먹었던 시그니처 음료였다. 아이스 카페라떼 Ice Cafe Latte 5500원 예전에 마셨을땐 뭔가 씁쓸했던 것 같은데 기억 오류인듯. 이래서 포스팅은 빨리 빨리 해야하나보다..🤮 기대 없이 한입 마셨을 때 생각보다 고소한 편이라 놀랐다. 엥? 맛있는데? 예전에 먹었을 때 어떤 맛이었는지 크게 기억이 안나서 그저 그랬나보다~ 했는데, 산미나 쓴맛 없이 부드러우면서 고소한 맛의 라떼였다. 진-한 커피 좋아하시는 분들에겐 조금 연하게 느껴질 수도 있을 듯 하지만 완전 내취향🤎 청포도 레어 치즈케이크 Green grape cake 8500원 지난번엔 딸기랑 얼그레이 레어치즈케이크를 먹어서 이번엔 청포도 레어치즈케이크를 먹었는데 연남동카페 soutenu는 지난 방문때도 느꼈지만 정말 연남동 케이크 맛집이다 ദ്ദി '֊' ) 크림치즈를 섞은듯한 맛이었는데 푸딩처럼 부드러우면서 많이 시큼하거나 달지 않고 과일이랑 잘 어우러지는 맛이었다. 시트는 다이제스트 쿠키를 부셔서 만든 맛이었는데 진짜 고소하고 맛있어서 개존맛 🥺 이러면서 다 쳐머금 (돼지) 경의선숲길카페 스트뉴 커피 디저트 모두 맛있었던 연남동카페 (2) 재생 0 좋아요 0  접기/펴기 경의선숲길카페 스트뉴 커피 디저트 모두 맛있었던 연남동카페 (2) 진짜 너무 맛났다! 연남동카페 soutenu에 오시면 레어치즈케이크는 꼬옥 드셔봐야 합니다 맛있어요 진짜 💖 감성 가득한 인테리어와 함께 맛있는 커피와 디저트를 맛볼 수 있었던 경의선숲길카페 스트뉴(soutneu). 시그니처음료와 라떼, 치즈케이크 모두 너무 맛있었다 ! 편안한 소파 🛋️ 좌석에서 친구와 함께 소소한 대화도 나누며 맛있는 시간을 보냈다. 다음에 또 가야지 💗 연남동카페를 찾는다면 스트뉴 어떠세요? 추천합니다. 50m © NAVER Corp. 스트뉴 서울특별시 마포구 성미산로23안길 19 1층 #서울카페 #마포카페 #가좌역카페 #홍대카페 #연트럴파크카페 #경의선숲길카페 #연남동카페 #분좋카 #카페투어 일상블로그 #블로거 #일상 #서이추 ⓒ 2023. yoovely All rights reserved."
"[연남동 카페] 스트뉴, 끝남동 이색 디저트 맛집","이색 디저트 '누가 글라세'와 셰프가 만든 티라미수, 진하고 부드러운 커피 ☕️ 채광, 분위기까지 좋은 연남동 카페 #스트뉴 Soutenu ⏰ 영업시간 매일 - 오전 11:00 ~ 오후 22:00 연중무휴 ➿ 단체석, 주차, 포장, wifi, 반려동물 동반🐾 홍대입구역보다는 가좌역과 더 가까웠다. 연남동 끝에 있어 요샌 끝남동이라 부른다고.. 댕댕이와 함께 방문 가능한 애견 동반 카페 테이블 간격도 넓고 쾌적해서 경의선숲길 산책하다가 잠깐 들러도 넘 좋을 것 같다. 항상 🌳연트럴파크 근처만 깔짝거리다 집에 갔는데 이쪽도 볼게 은근 많네~ 다음엔 끝남동 카페 투어 함 해봐야겠음! 포스터로 밖에서부터 유혹하잖아... 안 들어가고 배기겠냐구욥;; 성수동st 노출 콘크리트 건물이었는데 내부는 천장과 벽 모두 깔끔하게 마감돼있었다. 마음의 안정이..😇 군데군데가 통창이라 채광 지대로 〰️ 시야가 탁 트여 시원한 연트럴파크 카페 단체석과 폭신한 소파 좌석이 있어 단체 모임 장소로 딱! 조용한 분위기라 혼자만의 시간 갖기에도 적합한 곳 테이블마다 짐 올려둘 간이의자가 있어 좋았다. 인스타 감성과 따수움이 공존했다. 사장님도 친절하셨음. 메뉴판 시그니처 라떼는 꼭 먹어봐야죠~ ✔️스트뉴 커피와 밀크티로 주문 연남동 디저트 카페인데 음료만 먹음 서운하잖아요;; 여기 티라미수가 푸딘코에 소개됐던 이탈리안 와인바 '비네트' 셰프님이 만든 거라는데 주문하려니 품절.. 찻잎 시향 가능 역시 가는 날이 장날 시즌마다 과일이 달라지는 레어 치즈케이크와 프랑스 아이스크림 디저트만 가능하대서 #누가글라세 로 주문했다. 이땐 몰랐지 오히려 좋아~를 외칠 줄은 ㅋㅋ 나오는 음악, 분위기, 약간은 쌀쌀해진 날씨까지 완벽한 삼박자를 즐기다 보니 🌊 재생 0 좋아요 0 00:00 00:00  🌊 금방 나온 디저트들 진하고 고소한 라떼 위에 카라멜 크림과 브라운치즈, 크림치즈를 뿌린 시그니처 스트뉴 커피 토치로 크림브륄레처럼 겉을 녹여주시는데 퍼포먼스 보는 재미도 있었다. 눈과 입 다 즐거웠음. 치즈와 캐러멜이 녹아 달고나 같은 달달함 + 치즈가 만나 단짠 거기에 고소한 라떼까지 섞여 오묘한 매력이 있었다. 맛있어서 손이 계속 갔음! 위에 크림 살짝 떠먹다가 아인슈페너처럼 잘 섞어 마시면 된다. 은은했던 밀크티 많이 달지 않아 좋았다. 티라미수를 못 먹는다는 생각에 넘 슬펐지만 이거 한입 먹고 다 까먹었다고 한다ㅋ 프랑스 아이스크림 디저트 누가글라세 새로운 맛도리를 발견해서 기분이 아주 좋아! 꿀, 견과류, 머랭이 들어간 누가 베이스에 고소한 아몬드와 피스타치오 조합. 모든 재료가 잘 어우러져 존맛이었다. 맨날 달기만 한 아이스크림 퍼먹다가 넘 신세계였음;; 둘이 먹다 보니 순삭..! 피스타치오를 좋아해서 더 맛나게 먹었다. 안에 사각- 하고 씹히는 달달한 설탕 결정?이 있어 식감 너무 재밌어!! 이번엔 뭐가 씹힐까 기대하면서 한술씩 뜨게 됨.. 견과류 좋아하시는 분들 꼭 드셔보세요!! 이색적인 홍대 디저트 찾으시는 분들 조용한 연남동 데이트 원하시는 분들 SOUTENU로 달려가시길 / 인스타 카페 스트뉴 (cafe soutenu)(@cafe_soutenu) • Instagram 사진 및 동영상 팔로워 804명, 팔로잉 1명, 게시물 59개 - 카페 스트뉴 (cafe soutenu)(@cafe_soutenu)님의 Instagram 사진 및 동영상 보기 instagram.com 📍서울 마포구 성미산로23안길 19 1층 홍대입구역 3번 출구에서 연트럴파크 경의선숲길 따라 끝까지 쭉~ 걷기 > 연남아파트가 보이면 오른쪽 골목길 따라 낮은 언덕을 살짝 오르면 왼쪽에 바로 보입니다. 경의중앙선 이용 시 가좌역 3번 출구로~ 연남동주민센터, 경성고등학교, 홍익디자인고등학교가 주변에 있음. 50m © NAVER Corp. 스트뉴 서울특별시 마포구 성미산로23안길 19 1층"
연남동 끝남동 카페 스트뉴! 바닐라빈라떼 맛있는 곳,금요일은 호갱슈가 4시에 퇴근하는 날~~ 간만에 연남동에서 만나서 이른 저녁을 먹기로 했는데요. 버스 타고 출발한 호갱슈가 길이 밀린다고 해서 한참 전에 연남동에 도착한 저는 여기 저기 산책하면서 구경중입니다~ 초록이 깊어지고 있는 연트럴파크 제가 좋아하는 분위기의 프랑스음식점도 있고... 안쪽으로 갈수록 하나씩 나오는 카페랑 음식점 구경하는 재미도 솔솔~ 50m © NAVER Corp. 스트뉴 서울특별시 마포구 성미산로23안길 19 1층 제가 쭉 걸어서 간 곳은 저녁 먹기로 한 곳과도 가까운 연남동 끝쪽인데요... 여기가 연남동 끝이라 끝남동이라고 불리운다네요^^; 그러니까 지하철역으로는 홍대입구역 보다는 가좌역 근처.. 연남동 초입 보다는 확실히 조용한 주거지 느낌... 평일이라 그런지 그렇게 붐비지도 않고 조용하게 걷기 좋은 동네였어요. 저처럼 지하철 보다는 버스를 선호하는 호갱슈 아무래도 금요일 오후라 길이 너무 밀린다고 해서 저는 일단 혼자서 커피 한 잔 하기로 했습니다~ 오메 오메 난 오히려 좋은 거 ㅎ 걷다가 느낌도 괜찮고 마침 사람이 별로 없길래 무작정 들어간 연남동 카페 스트뉴 밖에서 봤을 때는 약간 차가운 느낌이었는데 안에 들어서니 따뜻한 분위기^^ 안쪽의 창가쪽에는 넓은 테이블도 있고 밖에 나무도 보여요. 의자 등받이가 중요한 저는 일단 다 등받이가 있어 안도~~ 그리고 테이블 간 간격도 넓은 편이라 더욱 좋았어요^^ 제가 앉은 입구 창가쪽 자리 꽃도 갖다 놓으시고 과하지 않은 따뜻함이 좋은.. 메뉴판을 살펴 보니 인기메뉴에 바닐라빈라떼가 있어 한 잔 주문해 보았어요... 여쭈어 보니 직접 숙성한 수제바닐라빈시럽이 들어 갔대요. 아이스로 주문했고 가격은 6천원 요렇게 예쁜 컵에 나옵니다^^ 까만 바닐라빈이 요렇게 중간 중간 떠있어요 ㅎ 한 입 마셔 보니 바닐라시럽맛이 찐하고 커피맛도 괜찮았습니다. 다음에는 블랙커피도 한 번 마셔 봐야겠어요. 여기 후기를 찾아 보니 꽤 까다로운 머신을 쓰시고 커피맛도 괜찮다는 평인데 블랙커피 한 번 맛보고파요~ 나오는 음악들도 제 취향이네요.. 30여분 정도의 그리 길지 않은 시간이었지만 커피 한 잔과 함께 끄적거리기도 하고요.. 카페서 혼자 노는 30여분의 시간이 순삭! 와! 테이블 컬러까지 제 취향입니다. 인스타 들어가 보니 여기는 티라미수 맛집이었네요. 역삼동의 디저트집에서 들여 오시는 것 같더라구요. 특히 피스타치오 티라미수가 맛있다고 하니 일단 찜~~~ 연남동의 끝자락 끝남동의 조용한 주택가 한 켠에 자리한 카페 스트뉴 제가 저녁 먹은 이석덕 생면파스타의 바로 근처에 자리하고 있어서 묶어서 코스로 가도 딱~~ 50m © NAVER Corp. 스트뉴 서울특별시 마포구 성미산로23안길 19 1층
연남동 카페 :: 스트뉴 Soutenu,"Soutenu 스트뉴 서울 마포구 성미산로23안길 19 1층 월 - 일 10:00 - 22:00 0507-1353-1678 인스타그램 @soutenu_seoul 가좌역 1번출구에서 도보로 11분, 홍대입구역 3번출구에서 도보로 15분거리에 위치한 연남동 카페 스트뉴 거대한 건물이 반겨주지만 스트뉴는 1층 한 층만 사용합니다 스트뉴 들어오자마자 보이는 예쁜 소파석 스트뉴는 대부분이 2인석으로 이루어져 있어서 이런 다인석은 여러명 온 손님들에게 양보,,, 그리고 마음에 들었던 창가자리 우리가 방문했을 때는 대부분 소수로 방문한 손님 위주였는데 대부분 노트북으로 작업하고 있었다 카페가 전반적으로 조용하고 크게 넓지는 않지만 좌석간 거리가 꽤 있어서 혼자 오기에 좋을 것 같다 넓직넓직했던 바 메뉴판은 독특하게 맥북으로 되어 있다 아이패드로 메뉴판 해놓는 곳은 많이 봤는데 노트북을 메뉴판으로 사용하는 곳은 처음 보는 것 같다 ㅎㅎ 그리고 스트뉴에 판매하는 티들은 왼쪽에 있는 시향용 티로 향을 맡아볼 수 있다 연남동 카페 스트뉴 메뉴판 아메리카노 (5,000) 카페라떼 (5,500) 딸기치즈케이크 (8,500) 주문 창문으로 보이는 지붕들 1층에 있는 카페인데도 살짝 언덕에 위치해있어서 그런지 이렇게 지붕이 보이는게 새로움 ㅎㅎ 예쁜 물 잔 베이커리를 주문한 테이블은 포크와 냅킨을 유리잔에 넣어서 주신다 이게 뭐라고 예쁨 ㅎㅎ 무난무난했던 아메리카노 비주얼 깡패 딸기치즈케이크 스트뉴의 디저트들은 다 비주얼이 좋아서 티라미수 먹을까하다가 딸기의 압도적인 비주얼에 딸기치즈케이크 선택! 위에 치즈부분은 차가우면서 부드럽고 아래 시트부분은 바삭바삭! 모두가 익숙한 맛인데 그래서 정말 맛있는 맛 커피랑도 정말 잘어울렸는데 티랑 마셔도 맛있을 것 같다 다음엔 홍차랑 디저트랑 먹어봐야지 마지막으로 쇼파 자리로 마무리 깔끔한 인테리어와 맛있는 디저트 카페 연남동, 스트뉴 50m © NAVER Corp. 스트뉴 서울특별시 마포구 성미산로23안길 19 1층 #연남동카페 #연남카페 #연남동데이트 #연남동노트북하기좋은카페 #연남동노트북카페 #홍대카페 #홍대데이트 #스트뉴 #Soutenu"
연남동 카페 스트뉴 Soutenu | 조용하고 차분한 분위기와 감성적인 인테리어가 매력적인 연남 카페,"스트뉴 서울특별시 마포구 성미산로23안길 19 1층 스트뉴 Soutenu 매일 11:00 - 22:00 휴무 없음 ✔️ 반려동물 동반 가능 카페 스트뉴 (cafe soutenu)(@cafe_soutenu) • Instagram 사진 및 동영상 팔로워 767명, 팔로잉 2명, 게시물 52개 - 카페 스트뉴 (cafe soutenu)(@cafe_soutenu)님의 Instagram 사진 및 동영상 보기 instagram.com 여러분!! 연남동 끝쪽을 끝남동이라고 하는 거 다들 알고 계셨나요 ㅋㅋㅋㅋㅋㅋㅋㅋㅋㅋㅋㅋ 오늘은 끝남동에 위치한 감성 가득 예쁜 카페 리뷰를 데려왔어요 ꯁ 파란 바닥이 시그니처인 스트뉴(Soutenu), 좌석도 다양해서 좋았고 식물들이 가득해요! 평일 오후에 방문하니 한적한 편, 조용하고 여유로운 분위기가 좋더라구요 🫶🏻 제가 평소에 인테리어나 홈카페, 각종 소품에 관심이 많은 편이다 보니 계속 눈길이 가더라고요?! 특히 플랜테리어를 잘 해 두셔서 그런지 더 마음에 들던 여유로운 곳,, ✨🫶🏻 메뉴도 완전 마음에 쏙 들었는데요 한 번 보러 가 볼게요?! 🌝 💗 스트뉴 메뉴 연남동 디저트 맛집 스트뉴 ♥ 기본적으로 커피를 포함한 음료 종류가 많았고, 특히 디저트가 다양한 게 가장 좋았어요! 디저트는 티라미수, 레어치즈케이크, 베이글, 그리고 시그니처인 누가 글라쎄가 준비되어 있었어요. *누가 글라쎄: 꿀을 끓여 머랭을 올린 누가 베이스에 생크림과 견과류, 말린 과일을 넣은 프랑스 아이스크림 참고 🫶🏻 태블릿 메뉴판으로 사진도 확인할 수 있어요! 어떤 모습인지 보고 고르는 게 좋잖아요 ꯁ 그리고 젤 중요한 디저트 라인업..! 티라미수 오리지널, 피스타치오 레어 치즈 케이크 오리지널, 얼그레이, 블루베리, 무화과 베이글 대파 햄, 바질 햄, 무화과 시나몬, 블루베리 누가 글라쎄 다 맛있겠다 .. 하나만 어떻게 고르죠? 🥹 눈물을 머금고 딱 고른 피스타치오 티라미수, 그리고 같이 먹을 커피 두 잔 .. 이케 주문했어요 🥹❤️ 피스타치오 티라미수 / 8.5 아이스 아메리카노 / 5.0 아인슈페너 / 6.0 요렇게 주문 완! 🫶🏻💓 여유로운 분위기 느껴지시나요 🌝 날씨 좋은 평일 낮에 방문하니까 손님들이 많이 안 계셔서 여유로운 데다가 통창으로 비치는 햇빛도 정말 체고,, ✨ 물론 당연히 주말도 좋지만! 평일에 와서 책 읽으면 제일 좋겠다 싶더라고요 🥺 보통은 라떼에 크림 올린 걸 많이 고르지만 깔끔한 게 끌리는 날에는 아메리카노 베이스로 ✔️ (*스트뉴 커피가 시그니처 크림 라떼!) 많이 달지 않고 호로록 넘어가는 크림이라 디저트와 깔끔하게 곁들이기 좋더라구요-? 😋 맛있었던 피스타치오 티라미수 💚 흔히 아는 티라미수 꾸덕한 맛이 아니라 주문 즉시 만들어 내어주셔서 더 촉촉한 느낌! 케익 시트에 커피를 많이 적셔서 엄청 촉촉하고 크림도 묽은 편이었어요 호로록 순식간에 먹어버림 .. 🤤 피스타치오 크림에 분태도 뿌려져 있어 꼬수운 맛 가득했던 피스타치오 티라미수,, 💚 커피랑 곁들이기 참 좋은 디저트였고 다음에는 다른 종류로 먹어볼 의향 이쑴. 🌝🫶🏻 연남동 카페 스트뉴(Soutenu), 책 읽고 싶어지는 여유롭고 평화로운 분위기에 작업하기에도 좋아서 연남동 카공으로도 추천해요! 디저트 라인업도 다양하고 또 맛있어서 행복 충전하러 오기 딱 좋은 곳,, 🫶🏻💚 연남동 오시면 꼭 들러보세요 => ♥ 50m © NAVER Corp. 스트뉴 서울특별시 마포구 성미산로23안길 19 1층"
연남동 티라미수가 맛있는 카페🥜 스트뉴,"※이 글은 2022년 11월에 방문하여 작성한 글입니다. 연남 채광이 좋은 한적한 카페 스트뉴 soutenu 가좌역 스트뉴 영업시간 매일 10:00 - 22:00 반려동물 동반카페 가좌역 스트뉴 전화번호 0507-1353-1678 가좌역 스트뉴 위치 / 인스타 50m © NAVER Corp. 스트뉴 서울특별시 마포구 성미산로23안길 19 1층 연남동 스트뉴(@soutenu_seoul) • Instagram 사진 및 동영상 팔로워 153명, 팔로잉 2명, 게시물 33개 - 연남동 스트뉴(@soutenu_seoul)님의 Instagram 사진 및 동영상 보기 www.instagram.com 연남동 끝 쪽 가좌역 근처에 위치한 카페 스트뉴. 스트뉴는 마치 신전처럼 외관 앞에 큰 기둥 세워진 모습이 인상적인 곳이었는데 유리창 안으로 내부가 훤히 비쳐서 햇살이 잘 어울리는 공간이었다 연남동 카페 스트뉴 재생 4 좋아요 0  접기/펴기 연남동 카페 스트뉴 예상했던 대로 유리창 너머로 밝게 빛나는 햇살이 따스하게 공간 안으로 들어와서 화사하면서도 따뜻한 감성이 주를 이루고 있었다 스트뉴는 공간 크기가 넉넉하고 테이블 개수도 충분한 편. 좌석 간 간격이 넓은 편이기 때문에 여유롭게 머무를 수 있어 좋았다 연남동 스트뉴 재생 3 좋아요 0  접기/펴기 연남동 스트뉴 카페 반대편으로 보이는 연남동의 모습도 매력적이었는데 감나무와 은행나무 등 가을을 알리는 풍경부터 연남동의 주택단지, 아파트가 한 눈에 보여서 멋스러운 광경도 볼 수 있었다 연남동 스트뉴 메뉴, 연남동 스트뉴 가격 연남동 스트뉴 메뉴판 스트뉴의 메뉴판을 봤을 때 가오픈임에도 메뉴 수가 많아서 시키고 싶은 게 많았던 것 같다 디저트 종류도 음료 못지 않게 종류가 다양한 편이었는데 프랑스 아이스크림인 누가글라세부터 레어치즈케이크, 티라미수까지 맛있어 보이는 게 많았다 특히 티라미수는 강남의 이탈리안 와인바인 비네트의 티라미수를 공수해왔다고 하니 시키지 않을 이유가 없었다! 나는 피스타치오 티라미수(7,500won)와 브라운라떼(6,000won) 하나씩 주문했다 누가글라세, 브라운라떼 티라미수는 냉동실에 들어간지 얼마 안 되어 나중에 주신다고 하셨는데 그게 미안하시다고 누가글라세 아이스크림도 함께 주셨다+_+ 솔직히 기다리는 거 일도 아닌데 이렇게 신경써주셔서 정말 감사했다! 누가 글라세 고소한 견과류가 콕콕 박혀있던 누가글라세. 예전에 한 번 먹어본 아이스크림인데 우리가 흔히 아는 호두마루 맛이었고 서걱서걱한 식감이 재미있는 디저트였다 서걱서걱해도 이가 많이 시리지 않은 스타일이라서 아이스크림 잘 못 먹는 나도 맛있게 잘 먹을 수 있었다! 피스타치오 티라미수 20분 정도 지나니까 티라미수가 나왔다 내가 아는 티라미수 맛이 아니라서 당황했는데 마치 젤라또 먹는 것처럼 차갑고 쫀득해서 티라미수가 아닌 다른 메뉴인 줄 알았다 크림이 전혀 느끼하지 않고 오히려 아이스크림같다고 할까. 우리가 아는 티라미수보다 고급진 맛이지만 빵은 밑에 아주 소량 깔려있다 빵 부분이 거의 없기 때문에 티라미수의 밑에 깔린 빵을 좋아하는 사람들에게는 그다지 추천하지 않는다 하지만 피스타치오의 고소한 맛과 쫀득한 크림 맛이 매력적이라서 나는 맛있게 먹었다! 브라운라떼 크림라떼 위에 브라운치즈가 올라가는 커피! 시그니처인 듯한 커피라서 주문해봤는데 메뉴가 나오면 직접 오셔서 브라운치즈를 토치로 녹여주신다 브라운치즈의 짭짤하면서도 꼬릿한 맛이 크림라떼와 굉장히 잘 어울려서 커피도 맛있게 먹었다! 크림이나 커피도 맛있는 편이기 때문에 무난하게 시켜도 실패하지 않을 메뉴였다 연남동 햇살 좋은 공간에서 쉴 수 있는 카페 스트뉴. 연남동 메인 거리에 위치한 카페가 아니기 때문에 한적하게 힐링할 수 있었고 커피나 디저트가 특색있는데 맛도 있어서 꼭 방문해봤으면 하는 공간이었다!"
