title,content
연남동 디저트 카페 스트뉴 soutenu,"점심을 먹고 계획대로 디저트를 먹으러 왔습니다. 행복한 시간 ㅎㅎ 여기는 영알못인 저로썬 이름이 참 어려운 스트뉴. soutenu 영어사전을 검색하니 '조심성 있게 일관된 태도로 연기하는' 이라는 뜻이네요. 좋은 뜻! ㅎㅎㅎ 이 날 거리도 조용. 카페 안도 조용조용. 날씨도 흐리고 차분해지는 그런 날이었더랬죠. 테이블도 멋지고 큰 창들도 시원하네요. 창 가 안쪽 자리 선택 조용하게 얘기하기 좋은 곳이에요. 카페라떼 카푸치노 딸기 레어치즈케이크 요로케도 찍어보고.. 👀 조로케도 찍어보고 사진은 어려워...ㅎ 순두부같은 모양과 질감의 치즈케이크 넘 부드러워요. 카푸치노에는 계피스틱을 꽂아주네요. 눈과 입이 즐거운.. 제 입맛에는 우유가 좀 많았어요. 저처럼 진한 거를 좋아하시면 샷추가나 우유조금을 요청하시면 좋을듯요^^ 화장실 다녀온 사이. 언니가 시원한거 먹고 싶다면서 주문한 아이스라떼와 처음에 딸기케이크와 갈등하던 누가글라세. (이름 몰라서 검색ㅋ) 누가 그래써? 가 생각나는 이름 😂 ㅋㅋㅋ 누가크림으로만 되어있어서 밀가루없이 부드럽고 시원한 누가맛이 땡길때 좋겠네요. 배 안부르게.. 하지만 살은 찐다는 ㅋㅋ 시간이 얼마나 지났을라나 손님들이 하나둘 오시네요. 여기 애견동반이었네요. 애견동반이 많아져서 너무나 좋아요 👍 👍 👍 멀리서지만 이쁜 강쥐들 구경도 하다가 나왔습니다. 오~ 하늘 흐리멍텅한 하늘은 어디가고 파란 하늘이 기분좋게 나타났어요~ 한 장은 아쉬운 하늘 표정입니다. 그럼 간만에 연남동 나들이는 이것으로 마칩니다~~~ 감사합니다♡ 스트뉴 단체석, 주차, 포장, 무선 인터넷, 반려동물 동반 매일 10:00~22:00 50m © NAVER Corp. 스트뉴 서울특별시 마포구 성미산로23안길 19 1층 #연남동 #디저트카페 #스트뉴 #딸기치즈케이크 #커피 #맛집"
❝스트뉴❞ | 연남동,⚠️ 오로지 개인적인 의견입니다. 50m © NAVER Corp. 스트뉴 서울특별시 마포구 성미산로23안길 19 1층 매일 10:00 - 22:00 👋🏻 마지막 방문일 | 23.07.05 『메뉴』 ๑(I)아메리카노 ₩5.0 ๑스트뉴커피 ₩6.5 ★★★ ๑딸기 케이크 ₩8.5 ★★★ ๑블루베리 케이크 ₩8.5 ★★★ 『정보』 1) 매장이 가좌역에서도 홍대입구에서도 좀 걸어가야 한다. 2) 매장이 통유리로 되어있어서 채광이 좋다 ☀️ -톤앤매너 : 우드톤 푸른 느낌 -건물 : 1층 -웨이팅 : 🙅🏻‍♀️ -🪑🪑 - 8-9석 (잘 기억이 안난다) -🚻 : 실외 | 남녀공용 -🅿️ : 🤷🏻‍♀️ -가까운 역 : 가좌역 : 4번출구 : 『다시 가고 싶은가?!』 ★★★ / ❤︎❤︎ 방문기록_042 ★★★★★ - 너무 좋아.. 이걸 위해 이 지역을 간다. ★★★★ - 또 가야지~ ★★★ - 쏘쏘. 가면 가는 거고 안 가면 안 가는거고~ ★★ - 흐음.. 굳이? ★ - 안갈뤠 『외부』 『내부』 폭신해보이는 쇼파 사람이 많아서 내부 사진을 많이 못 찍었다ㅠㅠ 오랜만에 가서인지 아래 사진처럼 인테리어가 조금 바꼈다. 아래가 푸른색이라 여름에 가면 시원해보인다 소파의 위치도 바꼈다🛋️ 메뉴판 『메뉴』 스트뉴커피 ☕️🤎🧀 일반적인 크림라떼에 브라운 치즈를 올리고 토치로 살짝 구워주신다. 그래서 그런지 크림의 달달함과 치즈의 풍미가 잘 느껴졌다~ 딸기 치즈 케이크 🍓🧀🍰 딸기치즈케이크에 푹 빠진 친구가 강추해 준 카페. 맛있었지만 난 약간 꾸덕꾸덕한 느낌의 레어 치즈케이크를 좋아해서 그런지 그냥 딸기치즈케이크 맛이었다. 얼그레이 케이크가 새로 나왔던데 그거 먹으러 가고 싶다. 얼그레이를 딱히 좋아하지 않는 친구가 먹어도 맛있다고 할 정도라 매우 기대가 된다🫢🩷 블루베리 치즈 케이크🫐🧀🍰 블루베리 잼(?)이 달달해서 치즈랑 잘 어울렸다. 플레이팅이 예뻐서 먹기도 전에 맛있는 느낌이었다🥹 2023.07.05_규원 2023.02.11_태훈
피스타치오 티라미수가 맛있는 연남동 카페 스트뉴,맛있는 피스타치오 디저트와 커피가 있는 연남동 카페 스트뉴 스트뉴 운영시간 11시 - 22시 반려동물 동반 주차 가능 50m © NAVER Corp. 스트뉴 서울특별시 마포구 성미산로23안길 19 1층 피스타치오 티라미수가 맛있는 연남동 카페 스트뉴 🤍 다양한 디저트와 커피가 맛있는 카페로 다른 카페에서 접하지 못할 특별한 디저트가 있다 대표메뉴인 피스타치오 티라미수 8500 개인적으로 티라미수를 안좋아하는데 평소에 먹던 티라미수와 전혀 다른맛이라 피스타치오 매니아라면 좋아할 맛있는 디저트 🤎 누가 글라쎄 7000원 프랑스식 아이스크림 디저트인데 고소하고 쫀득하고 생소하고 맛있었던 메뉴 🤍 커피도 맛있어서 특별한 디저트를 맛보고 싶을느ㅐ 연남동에서 방문하기 좋은 곳이다
연남동 저스트텐동 / 연남동 스트뉴 / 애견동반식당 / 애견동반카페 / 선유도 브라이트사이즈 / 선유도 좋은습관PT,"양배추 샐러드로 하루를 시작~~~~~~ 휴직을 하니 아침에 샐러드를 먹어도 행복하네요 ㅎㅎㅎ 이날은 지청하랑 김유미가 놀러온 날~~~ 아니 사진을 하나도 안찍어서 놀러왔다는게 거짓말 같잖아요 ㅠ 애들한테 달력 선물도 하고 지청하가 귀여운 접시도 사주고 마싯는 케이크도 먹었단말이에요~~~~~~ 신전에 교촌도 먹었는데 사진이 없읍니당 헤헤 대학칭구들은 넘나 오랜만에 만났는데 조은시간이였따~~~ 다음엔날 꺼벙이 예방접종도 맞으러 다녀왔지용 주사맞아도 승질 안부리는 꺼벙이,,, 대견해,,, 겸댕그잡채,,,, 갑분 저녁 메뉴 공유 남편이 카레는 안조아한다했지만 이 카레는 뒤집어집니당 내가 만든 요리의 모든 포인트는 후추 후추가 들어가야 맛탱이거등용 히 쨔란~~~~~ 왜 근데 사진이 지옥에서 온 것 같은지,,,? 맛탱이라 싹싹 긁어먹었구용 남편 쉬는 날이라 꺼벙이랑 같이 #연남동 놀러 갔읍니당~~~ 올해부터 라멘의 맛에 눈을뜨고 남편이랑 하루 세번도 라멘을 먹었죵 헤헤 우린 라뚱이들이얌~~ 근데 왜때문인지 #애견동반 으로 들어갈 수 있는 라멘집 문이 안열려있어서 #텐동 으로 메뉴 변경~~ 뇸 도른놈 50m © NAVER Corp. 저스트텐동 연남본점 서울특별시 마포구 동교로46길 3 #저스트텐동 연남이 본점이였네용 맛은 걍 도랐구 댕댕이는 안고 들어갈 수 있습니당~~ #경의선숲길 산책하구 #푸딘코 에서 눈여겨 봤던 #스트뉴 다녀왔습니당 여기두 #애견동반카페 !! 50m © NAVER Corp. 스트뉴 서울특별시 마포구 성미산로23안길 19 1층 꺅 강아지랑 함꼐 갔더니 기여운 컵에 물도 따로 챙겨 주셨어용 기여웡,,,,,,,, ㅠ #오리지널티라미뉴 하나 조졌는데 먹자마자 #피스타치오티라미뉴 하나 더 조지게 되는 맛 오래오래번창해주세요,,,,, 꼬벙이는 이날 기절~~~ 요즘은 꺼벙이랑 동네 카페를 자주 갑니당 50m © NAVER Corp. 브라이트사이즈 서울특별시 영등포구 양평로22길 25 101호 #선유도애견동반카페 누나 공부할동안 얌전히 기다려주는 꼬벙이 근데 카페트에 쉬를 하는....ㅠ 조아하는 카페트인데,,,, 쉬를 해버려서 남편이랑 야밤에 빨래하러 걍 나오니까 마냥 신난 꺼벙이 헤헤 그래도 남편이랑 다녀와서 재밌었읍니다용~~~~ 마무리는 갑분 PT 갑자기 집에 누워서 놀다가 운동해볼까 싶어서 무료 PT 예약하고 다녀왔습니당 헤헤 이러다간 굴러다녀~~~ 결혼하고 나서는 살이 안빠지네용 ㅎㅅㅎ 맨날 1:1만 받다가 그룹으로 처음 받아봤는데 아무래도 그룹체질이였나봅니당 시간가는줄모르게 운동하고 3개월 결제해버렸다~~~~~~ 그룹PT의 최고 장점은 선생님몰래 한세트 쉴 수 있음 같습니당 헤,, 3개월간 제발 30회 다 채워주라 나자신아.... 화이팅,,,"
연남동 디저트카페 연남동 데이트 감성카페 스트뉴,"스트뉴 서울 마포구 성미산로23안길 19, 1층 안녕하세요 오늘은 연남동 경의선숲길쪽에 위치한 연남동 디저트카페 연남동 데이트 감성카페 스트뉴에 방문해보았어요 새로지어진 감각적인 건물 1층에 위치해 있어요 출입문은 좌측 우측 두개나 있으니 편한쪽으로 올라가시면 됩니다 영업시간: 11시 ~ 22시 < 연중 무휴 > ☎️ 02-336-1678 주차: 매장입구 주차장 스트뉴 내부 넓고 깔끔한 분위기에 테이블간 간격도 여유롭고 중간중간 초록초록한 식물들과 감각적인 소품들 사진들을 두어 힐링의 공간이 되었어요 2층이라 더 여유로운 느낌이더라구요 주방관리도 엄청 깔끔하게 관리되고 있었어요 감성넘치고 깔끔하더라구요 햇살맛집이에요✨ 이제 날도 선선해지기 시작하니 외투는 옷걸이에 걸어두면 편할듯하구요 스트뉴 메뉴 여러 커피류와 밀크티, 초콜릿라떼, 딸기라떼, 딸기에이드, 독특한 티류들과 디저트로 티라미수, 레어치즈케이크, 누가글라세가 준비되어 있어요 오늘은 바닐라빈라떼로 주문했는데 다음엔 시그니쳐커피인 스트뉴커피를 마셔봐야겠어요 프랑스 아이스크림 누가 글라세도 맛보고 싶네용😃 바닐라빈 라떼 6,000원 *2 레어 치즈케이크 오리지널 7,500원 와아아아 바닐라빈 라떼와 치즈 케이크가 이뿐잔에 담겨 나왔어요 연남동 디저트카페 연남동 데이트 감성카페 스트뉴 바닐라빈 라떼 보기에도 맛이 느껴지지않나요 완젼 부드러우면서 산미도 적당하고 많이 달지않아 좋았어요 레어 치즈케이크 오리지널 요고 꼭 드셔보세요 치즈가 완젼 부드럽고 고소하니 아래에 있는 쿠키랑도 잘 어울려요 얼그레이, 블루베리, 청포도 맛도 먹어보고싶네요 커피랑 같이 먹으면 더더 맛있답니당 연남동 디저트카페 연남동 데이트 감성카페 스트뉴 재생 1 좋아요 0 00:00 00:20  연남동 디저트카페 연남동 데이트 감성카페 스트뉴 연남동 디저트카페 연남동 데이트 하기 좋은 감성카페 스트뉴 위치는 아래에! 50m © NAVER Corp. 스트뉴 서울특별시 마포구 성미산로23안길 19 1층 #연남동카페 #연남동데이트 #끝남동카페 #연트럴파크카페 #연남동디저트카페 #디저트 #재방문 #경의선숲길맛집 #반려동물동반 #주차가능 #단체모임 #감성카페"
"연남동 카페, 피스타치오 티라미수, 애견동반 가능: 스트뉴 Soutenu","피스타치오 티라미수 맛집 연남동 카페, 가좌역 카페 스트뉴 Soutenu 스트뉴 : 네이버 방문자리뷰 44 · 블로그리뷰 35 m.place.naver.com 스트뉴 주소: 서울 마포구 성미산로23안길 19 1층 영업시간 매일 10:00 - 22:00 0507-1353-1678 가좌역 근처 ‘스트뉴’라는 카페를 방문했습니다. 이번에도 로지와 함께 방문하기 위해 애견동반 카페를 찾았고 쥬벤쿠바 연남점에서 밥을 먹고 카페에 왔습니다~ 연남동 브런치 맛집, 반려동물 동반가능 식당: 쥬벤쿠바 연남점 연남동 브런치 맛집 반려동물 동반 가능 식당 쥬벤쿠바 연남점 쥬벤쿠바 연남점 주소: 서울 마포구 성미산... m.blog.naver.com 내부는 깔끔하고 인테리어가 예뻐서 어딜 찍든 잘 나오더라고요 ㅎㅎ 이날 인스타 스토리 왕창 올렸네여 들어가니 강아지 친구들을 데리고 오신 분들이 많았어요 ! 이런 푹신한 쇼파 자리도 있고 거울 포토존도 있어요~ 카페에 거울 포토존 있는거 좋아해요 햇살이 잘 들어오는 창가 좌석도 있어요 ! 일단 주문을 해보자면 !! 피스타치오 티라미수를 하나 주문해서 나눠 먹고 음료 각자 하나씩 주문했어요~ 피스타치오 티라미수가 엄청 맛있다는 친구님의 말씀 - 아메리카노: 5,000원 - 밀크티: 6,000원 - 스트뉴 커피: 6,500원 - 초콜렛 라떼: 6,000원 - 피스타치오 티라미수: 8,500원 저희가 주문한 음료와 디저트 (제공받은 강아지 물까지) 스트뉴 커피는 크림 위에 브라운 치즈가 올려져 있어 직원분이 토치로 치즈를 녹여 주셨어요ㅜㅜ 넘 맛있어보임 피스타치오 크림이 듬뿍 올려진 티라미수였어요~ 크림이 고소하고 달달하며, 촉촉한 빵의 티라미수랑 잘 어울리는 조합이었어요 ! 로지랑 친해지는 날이었는뎅.. 친해졌겠죠? 귀여운 강아지 그림 그려진 컵에 강아지를 위한 물을 주셨어요 !! 넘 귀여움 (강아지 데리고 가시면 제공 받을 수 있나봐요) 50m © NAVER Corp. 스트뉴 서울특별시 마포구 성미산로23안길 19 1층 #스트뉴 #연남동카페 #연남동반려동물동반 #연남동반려동물 #가좌역카페 #soutenu #연남동맛집 #피스타치오티라미수 #연남동디저트"
"[연남동] 나만 알고 싶은 카페 스트뉴! 기본에 충실한 맛 연남동 끝자락에 위치한 끝남동, 히든카페 애견 동반 카페","안녕하세요 명운입니다! 블로그를 진짜 오랜만에 들어와서 글을 쓰고 있습니다. 다시 시작하게 된 계기는 천천히 적어보도록 하고 오늘 소개 드릴 곳은 바로바로바로바로 . . . . . . . . . . . 연남동에 위치한 스트뉴 입니다! 50m © NAVER Corp. 스트뉴 서울특별시 마포구 성미산로23안길 19 1층 스트뉴에 들어서자마자 보이는 아기자기한 인테리어 연남동에 위치해 있지만 구석에 위치하여 대부분 ""끝남동"" 으로 부르는 곳에 있더라고요! 예전엔 바닥이 에폭시 마감이었는데 사장님께서 직접! 손수! 카펫 타일을 깔았다고 합니다! 깔끔하게 잘 하셨더라고요! 우리들의 사진을 잘 나올 수 있게 하는 조명까지! 블루베리 치즈케이크 블루베리 치즈케이크는 정말 맛있습니다!! 따봉 따봉 직접 블루베리 젬부터 케이크까지 만드신다고 합니다!!! 케이크 먹으면서 엄청난 커피 머신도 한번 봐주고~ 단 한자리밖에 없는 소파 자리도 구경 한번 해보고~ 다음번엔 꼭 저기 앉아야지.. 이건 다른 날 갔을 때 먹은 레어 치즈케이크입니다! 하도 많이 갔더니 사장님께서 시도 중이신 잼을 서비스로 주셨어요! 무화과 잼이라고 하시는데 엄청 맛있더라고요~ 당연 원픽은 블루베리 잼!! ㅋㅋㅋㅋㅋㅋㅋ 한입하시죠?! 약오르죠?! 못참겠쥬?! 정말 단골이 된 카페입니다 조용하고 한적하여 힐링하러 가기 좋은 카페입니다! 다들 약속 전, 힐링하러 한번 씩 가보세요!!! 아 그리고 애견동반이 가능합니다! 반려견과 같이 가시면 사장님께서 반려견 전용컵에 귀여운 그림을 그려주십니다! 이상 연남동 , 끝남동에 위치한 스트뉴 였습니다. 스트뉴란? 발레의 기본동작으로 커피도 기본의 충실하겠다는 사장님의 다짐입니다."
[연남동 카페/스트뉴] 골목 끝자락 커피와 함께하는 여유로운 시간,새로 생긴 카페가 있다는 소식을 듣고 찾아 방문한 곳! 스트뉴 50m © NAVER Corp. 스트뉴 서울특별시 마포구 성미산로23안길 19 1층 연남동 끝자락 골목길에 위치하고 있다. 걸어오면서 예쁜 소품샵들도 구경하며 메인 도로보다 한적함을 느낄 수 있었다. 한번 신상 카페로 들어가 볼까나~~ 이렇게 입구를 들어가면 널찍하고 시원한 내부가 맞이해준다! 넓고 편안한 좌석들 예쁜 소품들! 처음에는 몰랐는데 가게에 붙어있는 여러 포스터들은 점부 스트뉴 매장을 직접 찍은 사진이었다!! 너무 예뻐서 당연히 인테리어 소품으로 판매하는 포스터일 줄 알았는데👍👍 뒷 배경이 넘 예쁜 거울도 있어서 인증샷찍기도 좋을 듯하다! 메뉴를 노트북으로 볼 수 있어서 신기했다 ㅋㅋㅋ 나는 얼죽아답게 아이스 아메리카노와 오리지널 티라미슈 주문! 옆에는 판매하는 티의 향을 시향 해볼 수 있게 이렇게 준비되어 있었다! 냄새를 맡아보고 티를 주문하는 것도 좋을 듯!! 커다란 나무 옆에 자리를 잡고 앉았다. 아무래도 골목 끝자락에 있다 보니 가게 유리로는 동네 풍경이 보인다 ㅎㅎ 주문을 하고 앉아있으면 사장님께서 자리로 가져다주신다. 예쁘게 플레이팅 되어 나온 티라미슈와 아이스 아메리카노 두 잔! 예뻐서 못 먹을 뻔 ㅠㅠ 하지만 안 먹을 수는 없으니까 😁 티라미슈의 크리미함과 맛있음이 사진으로 느껴지는지 모르겠다. 시트는 얇고 맛있는 크림 위에 카카오와 함께 느껴지는 코코아 파우더!! 중간중간 초콜릿의 씹는 맛이 느껴져서 티라미슈가 2배는 더 맛있었던 것 같다. 맛있게 마신 아메리카노! 산미가 조금 있어서 고소한 맛보다 산미를 좋아하는 사람들이 좋아할 맛이었다. 나는 고소한 맛을 좋아하긴 하지만 식후에 먹는 아메리카노는 다 맛있어🥰 깨끗한 화장실도 건물 옆에 바로 위치하고 있다! 골목 끝자락에 위치하고 있다 보니 접근성이 조금 떨어지는 것 같긴 하지만! 찾아온 보람이 있었던 카페 스트뉴. 커피도 맛있고 디저트로 먹은 티라미슈도 존맛탱 무엇보다 깔끔하고 편안한 인테리어와 자리까지 음료를 가져다주어서 편했던 것 같다. 다음에 또 방문할 의사 200%🙂🙂 #연남동카페 #연남카페 #스트뉴 #카페스트뉴 #연남맛집 #카페 #커피 #티라미슈 #디저트 #홍대 #홍대입구 #내돈내산 #존맛탱
여름끝자락 연남동에서 / 카페 스트뉴 / 이자카야 요코쵸,"안녕하세요! 오랜만의 뚠입니다! 이제 정말 맨투맨을 입어도 덥다고 느껴지지 않는게 정말 가을이 와버린 것 같아요 ( 🤎 ) 계절에 맞춰 가을 이야기로 문을 열고 싶었으나 그러기엔 여름의 끝자락에 방문한 연남동 너무 좋았어서 남기지 않고 넘어가기엔 아쉽더라구요ㅎㅎ 그래도 봐주실꺼죠?! 🥹 🩷 그럼 연남 바이부 시작할께요..🍃 이날따라 더 사람이 바글바글한 핫한 연남동 중심지를 피해 연남동 골목 끝으로 넘어가줍니다! 가방은 J가 구해준 헬리야드10 , 이쁘고 가볍고 물건도 많이들어가서 요즘 박제템 수준으로 들고다니는 중이에요 🖤 가기전에 줄서서 먹은 요즘 핫한 유키모찌 젤모찌 젤라또를 감싼 모찌라 젤모찌라는데 맛은 아이스 우유 모찌 느낌 귀여워🍡 가는길에 디저트집 보일때마다 못지나치고.. 그덕에 만난지 30분만에 짐이 한가득인 오빠🤣 연남동 가묜 괜히 뭐 사고싶고.. 담고싶고 저만 그렁거 아니죠..? 열심히 걸어서 도착한 카페는 스트뉴🌿 인테리어도 힙하고 식물도 많고 특히 자리 사이 공간이 넓어서 좋았어요. 동네에 요론곳 있으면 매일 갈 것 같은 느낌! 아 그리구 치즈케이크가 쫀맛이에요 ㅜ 위에 크림치즈는 달콤하면서 특히 밑에 과자 시트가 맛나서 제가 다 먹어버려ㅆ.. 이 날의 하이라이트는 카페에 있다가 만난 귀엽고 커다란 손님 올리버🐻‍❄️ 올리버 너 착장이 좀 마니 멋찌다...? 🎀 제 착장은 리에뜨 플레인 가디건, 온드민 퍼플미니드레스 입니닷 통창으로 들어오는 따듯한 햇살에 잠봉뵈르 베이글까지 외국 영화 한 장면 같쨔나.. ✨🥯 🥂 🥂 🥂 올리버가 계속 이렇게 밖을 보고 있는데 주인분이 올리버~ 고양이 친구 기다려~?? 했는데 진챠 목 빠지게 기둘리고 있는거 같아서 넘 귀엽고.. 🥲 냥친구 기다리느라 뒷모습인 올리버와 한 컷 🫶 올리버 사진 포즈가 예사롭지 않다 싶었는데 알고보니 강아지 모델이어서 신기했꾸.. 너 뭔데.. 자태가 곱디 고와..? 🤍 🤍 🤍 리에뜨 플레인 가디건은 작년인가 제작년에 사서 너무 잘입고 있는 옷 중 하나에요! 색감도 살짝 회끼도는 물탄 소라색에 소재가 촤르륵 흐르는 느낌에 소매까지 여리여리한 느낌을 살려준다고 해야하나ㅎㅎ 온드민 퍼플 드레스는 여름 가기 전에 아쉬워서 열씸히 입어주는 중 입니다👗👒 🫶🏻 J도 한 컷~~~ ^^ 주말 연남은 댕 파라다이스..❤︎ 맛있는거두 머꾸 카페도 가고 귀여운거도 잔뜩 보고 이제 본격적으로 배를 채우기위해 넘어갑니댜 룰루 -💐 도착한 곳은 이자카야 요코쵸 여기 연남동 지나갈때마다 늘 웨이팅이 길어서 한 894820번 지나쳤던 것 같은데 드디어 !!! 다녀왔습니닷 💁‍♀️ 방으로 안내받아서 살짝 아쉬웠는데 뒤에 온 단체손님 덕에? 바 자리로 안내 받아 앉게 되었어요 ㅎㅎ 일본 감성 제대로 느낄 수 있는 바 자리 🍢🍺 요코쵸 베스트 메뉴는 꼬치와 야끼소바라고 하는데 저는 소바를 안좋아해서 꼬치와 가라아게 하이볼을 주문했어요 근데 저희 빼고 모든 테이블이 야끼소바를 먹고있어서.. 아.. 여긴 야끼소바가 찐인가?.. 하면서 괜히 불안했는데 (먹는거에 실패하는거 안좋아하는 편) 먹어보니 꼬치는 소스가 특별하고 맛났는데 가라아게는 비주얼보고 기대를 많이해서 그냥 그랬어요 ㅜ 그래서.. 여기 이제 오늘이 마지막일 수도 있다며 저희는 야끼소바를 주문합니다 (예?( 근데 주문 안했으면 큰일 날 뻔 했어요 ㅎㅎㅎ 정말 야끼소바 맛집이더라구요? 소바 안좋아하는 저도 야무지게 먹고 나왔답니댜 매콤한데 쫀득하고 계란후라이 쇽 얹어먹으니 꿀맛 ✨ 결론은 요코쵸에 간다면 야끼소바와 꼬치를 꼭 먹쟈!!(?) 이때만 해도 낮엔 덥고 저녁은 선선했는데 9월이 끝나가니 갑자기 훅 날씨가 풀린 것 같아요 이렇게 또 훅 계절이 가버리기전에 이 사랑스러워서 너무 짧게 느껴지는 가을을 우리 모두 맘껏 누려보자구요 🤎 10월은 더 자주 찾아오는 뚠이 될 수 있도록 노력하겠습니다🫶🏻 그럼 오늘도 제 글에 함께해주셔서 감사드리며 10월도 모두 끝내주게 행복하세요 ! 🌷"
