title,content
반려견 동반 가능 연남동 카페 추천 펠른 연남,"마포/연남 반려견 동반 가능 연남동 카페 추천 펠른 연남 영업시간 : 11:00-22:00(l.o 21:30) 휴무 : 없음 전화번호 : 070-4227-0741 주차 : 가능 반려견 동반 : 실내 동반 가능 (케이지, 가방 필수x) 50m © NAVER Corp. 펠른 연남 서울특별시 마포구 성미산로22길 18 펠른 연남 예약 🏠 펠른 연남점 분위기 빨간 벽돌 하얀 철제 프레임으로 외관 인테리어가 멋스러운 펠른 연남점 두번째 방문! 연남동은 살짝 반지층이긴 한데 채광도 다 들어오는 건물이 많은것 같다 펠른 연남점도 그런 위치 라운드 형태의 천장도 뭔가 더 어울리는 느낌 간접조명도 예쁘고 인테리어에 신경을 많이 쓴 공간이라고 느껴졌다. 혼자오기도 하고 달쿵이랑도 왔지만 연남동에서 친구랑 만날일 있거나 데이트 하러 오기 좋을것 같다 테이블이 많지는 않다 단체모임하긴 어려울듯 개인적으로는 테이블 적어서 널찍하고 좋음 ㅎㅎ 단체는 스타벅스로...ㄱ ㅋㅋㅋ 사진은 못찍었는데 야외 테이블도 있다 굿즈들도 있고 판매하는건지는 모르겠다 가격 안내가 안되어 있었음 📋 펠른 연남점 메뉴 에스프레소도 있고 시그니처 메뉴가 엄청 다양하고 칵테일도 있다 절대 한번만 올수 없을듯 원두는 두가지 고를수 있는데 산미/다크 고소 나는 다크 고소로 골랐다. 엄청 신중히 고른 케이크.. 비주얼도 너무 예쁘고 아몬드 파우더도 들어가서 더 고소하고 쫀득할것으로 예상... 예전에도 맛있게 먹었어서 펠른 라떼 6.5 는 무조건 고르고 레몬 머틀 소다 8.0 디저트는 스프링 베리 9.5를 주문 했다. 논알콜 페일 에일도 있음 패키지가 너무 예뻐서 선물 하기도 좋을듯! 이건 저번에 그냥 더치 커피라고 생각 했는데 오크통에 숙성해 위스키 향이 느껴지는 더치인데 너무 궁금해서 다음에 먹어보러 와야겠다. 메뉴가 흔하지 않아 구경하고 고르는 재미가 있음 ☕️ 펠른 연남점 맛 비주얼도 너무 예쁜 펠른 메뉴들,,🤍 펠른 라떼 진짜 커피맛 초코맛 진한 아인슈페너인데 내가 초코향 나는 원두를 원래 좋아하는데 펠른 커피 진짜 내 취향 저격임 얼마전에 아이폰 15pro로 바꿨는데 시네마틱 모드 너무 좋네 ☺️ 라즈베리가 올라간 피스타치오 케이크도 맛있구 ㅠㅠ 이건 진짜 일단 비쥬얼이 너무 예쁨 기분전환에 최고인듯 컷팅 하는거 찍어보고 싶었는데! ㅋㅋㅋ 레몬 머들 소다는 테이크아웃 했는데 엄청 고급스러운 레스토랑에서 마지막 디저트로 나오는 상큼 달달한 디저트 음료 맛 뭔가 살짝 달달하면서 상큼 개운해서 커피 못먹는 분들이 먹기 좋을듯 😊 연남동 반려견 동반 카페 추천 펠른 연남점 재생 0 좋아요 0 00:00 00:16  연남동 반려견 동반 카페 추천 펠른 연남점 ✏️ 펠른 연남점 리뷰 총평 기분 전환하기 좋은 맛있는 맛과 비주얼 반려견 동반도 되는 연남동 커피 맛집 시그니처 메뉴가 다양해 메뉴 고르는 재미가 있음 모든 리뷰 포스팅은 주관적인 의견을 바탕으로 작성되었으며 살짝 참고만 해주세요🙂 그리고 반려견 동반 시에는 꼭 펫 티켓을 지켜 모두 즐거운 시간을 보내고 오래 방문할 수 있는 공간이 될 수 있도록 해요! -달쿵로드-"
[서울/연남] 금요일 오후 여유로운 연남동_판초/그린칩스팝업/펠른연남,"오늘 다녀온 따끈따끈한 연남동 후기. 금요일 오후 연남동은 여유로우면서 적당한 활기로 아주 좋았다. 영지 결혼 전에 추억 쌓기👯‍♀️(헤어지는 거 아님. 다시 못 보는 거 아님) 점심은 간단하게 먹기로 해서 브런치로 결정했고, 연남동 저장해둔 곳 중, 메뉴가 가장 끌렸던 #판초 고고 판초 서울특별시 마포구 성미산로 167-7 2층 인스타 보다가 알게 된 곳인가,,? 메뉴랑 분위기가 좋아 보여서 바로 저장했던 곳이다. 한창 빵 사러 많이 왔었는데, 집이랑 멀어지고 발길이 뜸해졌던 연남동,,, 여전히 골목골목 예쁜 곳들이 많다. 2층에 위치한 #판초 자리를 잡고 나면, 메뉴판을 가져다주신다. 맛있는 프렌치토스트도 요즘 먹고 싶긴 했으나, 뭔가 안 땡겨서 오픈 토스트 두 개와 양송이 수프로 결정~! 메뉴 고르고 있는데, 요렇게 이미지도 함께 볼 수 있게 아이패드도 가져다주셨다. 사진도 어쩜 이렇게 이쁘게 찍으시는지,,, 배우고 싶다 이런 감각,,, 메뉴를 주문하고(선불) 카페 내부 구경 구경 깔끔하니 이쁘다. 좌석은 총 네 자리였던 걸로 기억. 저 판초 병아리가 존귀였다. 밖에 베란다로도 연결되어 있었다. 그리고 비싸 보이는 스피커까지..!ㅋㅋ 메뉴는 주문하고 한 10분 정도? 금방 나왔다. -시즌 무화과 오픈토스트: 10,800원 -아보카도 베이컨 오픈토스트: 11,500원 -양송이 수프: 5,800원 시즌 무화과 토스트는 하몽이 아래 깔려 있었다. 하몽과 무화과는 생각해 본 적 없는 조합인데, 아주 맛있었다. 그리고 아보카도 토스트는 역시나 실패할 수 없는 맛이다. 그리고 위에 베이컨이 다져서 올라가 있는데, 이게 또 아주 맛도리였다. 아보카도도 후숙이 아주 잘되어 있어서 맛있게 먹었다. 마지막으로 양송이 수프! 원래 양송이버섯 별로 안 좋아하는데, 향긋해서 먹을만했다. 근데 약간 간간했던 것 같다.ㅠ 싹싹 긁어먹고 나와서 카페 가는 길~ 요즘 좀 날씨가 따뜻해졌는데, 오늘 나올 때 생각했던 것보다 하늘도 너무 맑아서 기분이 좋았다~ 낮잠 자는 강쥐도 보고~ 원래 봐둔 카페로 가던 길에 영지가 그린칩스 페스티벌 스팟을 발견해서 구경 갔다가, 키링 받으러 메인 스팟인 #그린칩스팝업스토어 로 갔다. 뉴스뮤지엄 연남점 서울특별시 마포구 동교로29길 34 이곳에서 23.10.24~23.11.2까지 팝업이 열린다. 근데 그린칩스 로컬 스팟에서 스탬프를 하나라도 받은 팜플렛이 있어야 입장할 수 있다. 키링만 받으면 끝인 줄 알았는데, 문제 풀면 음료랑 과자 준다고 해서 문제 풀러 갔다.ㅋㅋㅋ 근데 이렇게 본격적인 팝업인 줄은 몰랐는데, 내부가 완전 잘 꾸며져 있었다. 저 시험지 퀄리티만 봐도 느껴진달까,, 총 네 군데의 교실(?)을 다니면서 문제를 풀면 된다. 교실 컨셉, 실험실, 음악실, 미술실? 등 각각 교실 컨셉에 맞게 키치하게 잘 꾸며져있다. 저 초록색 칠판에 문제 힌트와 정답이 있으니 잘 풀면 된다. 마지막 틀린그림 찾기는 생각보다 어려웠다.ㅋㅋㅋㅋ 내가 찾은 정답은 하나도 없었음..^^ 이렇게 다 풀고 패스를 받으면, 과자랑 음료를 받을 수 있는 장소가 또 있다. 음료 종류는 어메이징 오트(오리지널/언스위트), 제주누보 논알콜, 커피가 있고 과자는 저 바삭칩 오리지널, 트러플, 스파이시? 세 가지 맛이 있다. 난 어메이징 오트 오리지널을 고르고 싶었으나,, ^재고 없는 이슈^로 인해 언스위트로,,가져왔다 우연히 간 팝업이었는데, 생각보다 재밌고 공짜 과자와 음료를 얻고 나와서 대 만 족 원래 가려던 카페와는 좀 멀어졌지만, 후보 세 곳 중 하나였던 #펠른연남 과 가까워져 펠른으로 커피 마시러 간다. 동선이 아주 아름답다. 펠른 연남 서울특별시 마포구 성미산로22길 18 펠른 연남 예약 이 카페가 있는 골목도 아주 오랜만에 오는 쪽이다. 몇 년 전에 입짧은 햇님 맛집이 있다고 해서 갔던 기억이... 펠른은 에스프레소가 유명하고 음료가 독특해서 저장해놨던 곳이다. 커피 맛집이라고 하니까 라떼를 시키고 싶었지만,,, 유당불내증 때문에 못 시켜서 좀 독특한 커피로 대신했다. 위스키 더치~ 펠른바라는 디저트도 있는데, 단면이 예뻐서 한번 시켜봤다. 솔직히 가격은 좀 에바인듯 디저트도 함께 시키면 10% 할인해 준다. 그리고 여기도 아이패드로 메뉴 이미지 다 볼 수 있다! 메뉴를 주문하고 나서 실내 둘러보기~ 창가 좌석도 있고, 실외에도 한두 자리 정도 있었다. 인테리어도 깔끔하고 조용한 분위기~ 그리고 입구에 커피잔, MD도 아주 느낌 있게 진열해놓으셨다. 주문하기 전에 앞에 주문이 많이 밀려있다고는 하셨는데,, 한 20분은 넘게 기다린듯하다.ㅋㅋㅋ 커피 기다리던 손님들이 한 번에 오신 걸까...? 그래도 열심히 수다 떠느라 시간은 잘 갔다~ 내가 시킨 위스키 더치는 얼음도 저렇게 왕 원형 얼음으로 들어있었다. 천천히 마시는 게 좋다고 하셨다. 얼음이 녹으면서 더 부드러워진다며... 나름 천천히 마신다고 마셨는데도 바닥이 너무 금방 보이더라는...^^ 그리고 영지가 시킨 플랫 화이트(오트 밀크로 변경) 꼬숩하고 오트 밀크 맛이 확 느껴졌다. 그리고 기대했던 디저트..! 묵직한 맛이 나는데, 밀가루는 안 들어가고 아몬드 가루만 넣은 것 같다. 처음에는 음,,?하는 맛이었는데 먹다 보니 은근 중독적인 맛이었다.🤨 피스타치오 맛도 꽤 은은하게 잘 느껴져서 좋았다. 마지막으로 확장 이전했다는 홍대 비앤씨 마켓까지 들리고 집으로 총총~! 엄마랑 카페 간다고 최근에 왔었는데, 그때보다 더 구석구석 돌아다녀서 알찼던 나들이였다~ 이상~~"
연남동 카페 우아한 분위기를 가진 펠른 연남,"콩닥이에요💛 홍대 들렸다가 분위기가 너무 좋은 연남 카페를 알게 돼서 연남 카페 맛집 펠른 연남에 다녀왔어요 따뜻한 겨울 감성을 지닌 우아한 분위기의 연남 카페 맛집 카페 연남 후기 지금 시작합니다 50m © NAVER Corp. 펠른 연남 서울특별시 마포구 성미산로22길 18 펠른 연남 예약 펠른 연남 서울특별시 마포구 성미산로22길 18 펠른 연남 홍대입고 3번 출구에서 나와 쭉 직진해서 연남동 연트럴파크 쪽에 위치한 펠른 연남 걸어서는 10분 ~ 15분 거리에 위치해있는데요 대중 교통을 이용하실 때는 홍대 입구역 2번 출구에서 KT 신촌 지사 앞 '홍대입구역' 정류장에서 마포 05번 버스를 탄 후 '코오롱아파트104동 앞' 정류장에서 하차 후 길 건너서 100m정도 걸어가면 된다고 합니당 저는 다른 쪽으로 와서 마을버스 마포06번 버스를 타고 경성중고.홍익디자인고에서 내려서 조금 걸어주었어용 골목을 따라 가다보면 따뜻한 분위기의 보기만해도 감성 가득한 연남동디저트맛집 펠른 연남이 보이는데요 계단을 조금 내려가면 만날 수 있는 펠른 연남이에요 독특한 게 바로 옆에 또 펠른이라는 곳이 있더라구요 거기는 펠른 하우라고 본점인데 커피 오마카세나 디저트 오마카세를 즐길 수 있는 프라이빗한 공간이었어요 어쩐지,,, 엄마랑 지나가면서 여긴 다이닝인가?? 했는데 무려 커피나 디저트 오마카세라니,,, 너무 신기해... 굉장히 고급스럽고 다이닝같은 아늑하고 프라이빗해보이는 공간이었는데 그에 반해 제가 방문한 펠른 연남은 좀 더 캐주얼하게 즐길 수 있는 에스프레소바 느낌이더라구요 펠른 연남의 디저트도 밖에서 한눈에 볼 수 있었는데요 원하는 계절을 선택할 수 있는 펠른의 계절을 표현한 디저트래요,,, 감성 뭐야...? 너무 고급스럽다... 그럼 들어가볼까요?? 문을 열고 들어가면 보이는 크리스마스 트리 옆 선반으로 쭈욱 나열 된 펠른 연남의 컵과 커피들 깔끔한 컬러와 디자인이 우드톤의 연남동디저트맛집 펠른 연남과 굉장히 잘 어울리더라구요 모두 펠른 연남에서 구매할 수 있는 MD 상품들이었는데요 펠른 연남의 분위기가 마음에 드시는 분들에겐 아주아주 좋은 소식이죠?? 연남동 카페 우아한 분위기를 가진 펠른 연남 (1) 재생 0 좋아요 0 00:00 00:07  연남동 카페 우아한 분위기를 가진 펠른 연남 (1) 아기자기한 소품들을 지나 안으로 들어가보면 일자로 길게 쭉 뻗은 내부가 한 눈에 보여요 왼쪽으로 바 테이블이 있고 오른쪽으로 테이블이 있더라구요 우드와 블랙의 디자인으로 분위기 있으면서 따뜻한 감성까지 느낄 수 있는 연남동카페 펠른 연남이었어요 안쪽에서 본 모습이에요 포근한 느낌 물씬이죠?? 그럼 메뉴를 골라볼까요?? 이 날 날씨가 너무너무너무 추워서ㅠㅠ 따뜻한게 너무 마시고싶더라구요 그래서 발로나 초콜렛 라떼와 마롱 라떼를 한 잔씩 주문해주었구용 펠른 연남의 계절을 표현했다던 케이크도 안 먹어볼 수 없으니,,, 라즈베리도 주문해줬어요 이야기가 있는 디저트라,,, 너무 기대가 되더라구요 연남동감성카페 펠른 연남에는 다양한 디저트와 커피도 많았는데요 각종 구움과자부터 에스프레소바다운 에스프레소와 커피, 티 종류, 특히 위스키 맛의 더치커피도 있어서 놀랐어요 위스키더치와 펠른라떼, 에스프레소 콘판나가 대표 메뉴라고 하던데 진한 위스키 맛의 펠른 클래식 더치를 오크로 숙성시킨 프리미엄 더치커피가 너무 궁금하더라구요,,, 다음에 연남동 카페 들릴 일 있으면 꼭 먹어봐야겠어요,,, 카운터에는 초콜렛과 과일 가루가 든 병이 있던데 시향할 수 있는 거였나봐요 테이블은 기본 2인 테이블로 되어있었어요 공간이 넓어서 요즘같이 외투도 두꺼워지고 뚠뚠해지는 날에도 걱정없이 움직일 수 있어서 좋더라구요 곳곳에 그림들이 걸려있었는데 그림들의 분위기가 오묘하더라구요 그래서 신기했어요,,, 약간 편집샵 느낌도 들고 전시회같기도 하고,,, 앉아서 기다리다보면 주문한 음료와 디저트가 나옵니당 앉아있으면 가져다주시더라구요 짜잔 음료도 디저트도 너무 예뻐요ㅠㅠㅠ 주문한 음료에도 겨울이 들어가 있나봐요 포근하고 따뜻한 분위기가 물씬 풍기죠?? 특히 이 라즈베리 디저트를 보세용... 겨울 과일은 아니지만 겨울의 포근함까지 느낄 수 있는 디자인이 너무 예쁘지않나요??ㅠㅠ 제가 시킨 발로나 초콜릿 라떼와 마롱라떼 발로나 초콜릿 라떼는 발로나 초콜릿을 사용해서 진한 다크초콜리의 풍미를 느낄 수 있었어요 퐁실퐁실 올라간 크림 위에 초콜릿 가루와 발로나 초콜릿이 올라가 있는데요 연남동 카페 우아한 분위기를 가진 펠른 연남 (2) 재생 0 좋아요 0 00:00 00:04  연남동 카페 우아한 분위기를 가진 펠른 연남 (2) 이 초콜릿 스틱은 드실 때 라떼 안에 넣어서 드셔주시면 됩니당 초콜릿이라 라떼 안에 넣으면 스르륵 녹으면서 더 진한 초콜릿 라떼를 즐기실 수 있어요 마롱라떼는 밤 라떼인데요 고소하고 달달한 밤맛과 스팀밀크로 굉장히 부드러웠어요 겨울에 마시기 딱 좋은 음료같더라구요ㅠㅠㅠ 고급스러운 밤 음료같아서 제 픽은 마롱라떼로,,, ㅋㅋㅋㅋㅋㅋㅋㅋㅋㅋㅋㅋㅋㅋㅋㅋ 연남동 카페 우아한 분위기를 가진 펠른 연남 (3) 재생 0 좋아요 0 00:00 00:06  연남동 카페 우아한 분위기를 가진 펠른 연남 (3) 휘휘 휘저어 드시면 됩니당 연남동디저트맛집 펠른 연남답게 디저트도 정말 맛있었어요ㅠㅠ 새콤달콤한 라즈베리와 트리플 베리, 루바브잼, 피스타치오 시트가 어우러져서 고소하면서 새콤달콤하니 너무 맛있더라구요 연남동 카페 우아한 분위기를 가진 펠른 연남 (4) 재생 0 좋아요 0 00:00 00:06  연남동 카페 우아한 분위기를 가진 펠른 연남 (4) 라즈베리 위에 금박 올라간거 보이시냐구요,,, 고급스러움 뭔데 진짜,,, 연남동 카페 우아한 분위기를 가진 펠른 연남 (5) 재생 0 좋아요 0 00:00 00:04  연남동 카페 우아한 분위기를 가진 펠른 연남 (5) 부드럽지만 밀도가 있어서 씹는 맛도 너무 좋았구요 새콤달콤하니 라떼나 커피와도 잘 어울릴 것 같더라구요 라즈베리를 맛 보니 다른 디저트들도 너무 궁금해지잖아... 봉블랑이랑 고민됐는데 다음 재방문할 때는 몽블롱을 먹어보는걸루,,, 분위기도 라떼도 디저트도 포근함 그 자체였던 연남동디저트맛집 펠른 연남 인스타 속 맛집같으면서도 뭐 하나 빠질 것 없이 만족스러웠던 연남동감성카페 펠른 연남이었어요 특히 애견동반이 가능한 펠른 연남이라고하니 연남동 근처에 사시는 분들이나 울 귀여운 멍멍이나 반려동물 산책 중 맛있는 디저트가 맛보고싶으신 분들 아늑하면서 포근한 감성을 느끼고 싶으신 분들 모두 연남카페 펠른 연남에서 포근함 충전하고 가세요 #연남카페 #연남동카페 #연남동카페맛집 #연남동분위기좋은카페 #연남동디저트맛집"
연남동 카페 | 펠른 연남,"연남동디저트맛집 펠른 연남에 다녀왔어요:) 이번 연남동 투어에서 빠질 수 없는 디저트타임! 펠른 연남(에스프레소바) 홍대디저트맛집 | 연남카페 📍서울 마포구 성미산로22길 18 펠른 에스프레소 바 📍070-4227-0741 📍매일 11:00 - 22:00 50m © NAVER Corp. 펠른 에스프레소바 서울특별시 마포구 성미산로22길 18 펠른 에스프레소 바 예약 내부는 엄청 깔끔하고 쾌적했어요 펠른 에스프레소바는 옆에 있는 펠른 본점보다 좀 더 캐주얼하게 즐길 수 있는 곳이에요! 편안한 분위기와 조명이 입장부터 기분 좋게 만든답니다✨ 테이블도 넉넉하고 제가 좋아하는 바 테이블도 있네용! 저는 밖에도 구경할 겸 바 테이블에 앉았어요 커피와 디저트를 동시 구매시 10% 를 할인 받을 수 있다는 점! 디저트 놓칠 수 없죠🤤 원두 또한 두가지고 상큼한 과일맛과 초코맛 중 고를 수 있답니다 더치커피도 구매할 수 있는 것 같아요 펠른 연남의 디저트! 엄청 예쁘고 정말 맛있어보이죠🤍 저희는 대표메뉴인 펠른 라떼와 더치 하이볼, 윈터 아니스 디저트를 주문했어요 :) 보기만 해도 배부른 음료들😭🤍 요 디저트 정말 요물입니다! 옴총 달달하고 깊은 맛이라 당 떨어질때 먹으면 완전 굿굿 더치하이볼은 잘 섞어서 마시는 데 텁텁함 없고 아주 깔끔하답니다 펠른 라떼도 달달하고 꾸덕하니 색다른 음료를 먹고 싶을 때 마시는 좋을거 같아요 플레이팅도 넘 예쁘고 디저트도 예뻐서 먹기 아까울 정도였어요 위에 달달한 가루가 있어서 더 맛있어요 디저트 안에 꾸덕하고 묵직한 크림이 함께 있어서 그런지 초코의 깊고 진한 맛이 가득했어요🍫🍫 매장 내부 외부 전부 멋지고 조명도 좋아서 사진찍기도 아주 좋답니다🫡♥️ 여러분도 연남동가면 펠른 에스프레소바 꼬옥 들려보기🫶🏻"
"연남동에서 호텔급의 고급디저트와 위스키향의 커피, 논알콜칵테일까지[연남 펠른]/홍대데이트코스/기념일장소추천/티오마카세","기념일엔 역시 특별한 곳! 디저트 오마카세를 하는곳, 고급스러운 호텔식 디저트를 맛볼 수 있는 커피, 디저트 오마카세 연남동 펠른을 추천한다. 특히나 기념일이나 특별한 날에. 펠른 연남 서울 마포구 성미산로22길 18 A동 1층 펠른 영업시간 12:30-22:00 (브레이크타임) 17:30-18:30 이번 기념일은 역시 특별한 기념일을 챙길 수 있는 연남동 디저트카페. 펠른! 내 생일때 디저트를 좋아하는 나를 위해 오빠가 예약했던 디저트오마카세 펠른. ▽ 생일때 방문했던 펠른 리뷰! 특별한 기념일에 레터링 서비스를 해주는 홍대/연남동디저트 오마카세 [펠른] 생일 관련 포스팅이 아주 많은데, 이렇게 보면 많이 축하를 받은거 같아 내 주변에 좋은 사람들이 많다는걸... blog.naver.com 연남 펠른에서의 기억이 너무 좋았기 때문에 재방문했다. 이번에는 어떤 디저트가 있을지 기대를 하며. 연남동카페 펠른은 홍대입구역 4번출구에서 도보 10분 정도의 거리라 날씨 선선한 날엔 부담없이 걷기 좋은 위치다. 연남 경의선숲길 산책도 하면서. 연남동 펠른은 이번년도 2월에 방문했었는데, 내부적으로는 바뀐게 없었다. 은은한 노란 조명에 달달한 분위기 가득. 커피를 좋아하는 사람은 커피에 오로지 '집중' 할 수 있는 절호의 기회, 연인들에게는 사랑을 고백하는 장소로 좋다. 분위기가 전반적으로 조용하기 때문이다. 또, 바 테이블 형식이라 직원분과 소통 할 수 있어 디저트에 대해 이해하고 즐길 수 있어서 디저트를 '감상' 할 수 있다. 펠른 하우스의 설명. 이번 시즌은 '감각의 공간' 단순한 미식 경험을 너머서 후각, 시각, 청각까지 다양한 감각에 집중을 한다. 이번 시즌 메뉴는 총 3가지 디저트+커피 or 음료 구성으로 되어있다. 첫번째는 숲속의 향기 허브무스와 라임아이스크림, 섬세한 꽃향기와 과일맛의 원두 두번째는 바다의 소리 파인애플, 망고, 와인 그라나따와 코코넛 소르베 시원한 펜넬허브와 달콤한 배 논알콜칵테일 세번째는 도시의 야경 체리콤포트와 카시스, 초콜릿 무스 펠른 시그니처 위스키 더치 직원분께서 아이패드 화면을 통해 하나하나 설명해주셨고 한번 더 볼 수 있게끔 테이블 위에 메뉴판이 놓여져있었다. 그리고 아래에 보이는 큐알을 핸드폰으로 찍으면 이번 시즌 디저트에 대한 영상을 볼 수 있다. 첫번째는 웰컴 드링크. 숲속의 향기 바다의 소리 오늘 접할 디저트 메뉴를 영상으로 한번 더 볼 수 있어 새로웠고, 디저트를 더 집중해서 느끼고 먹을 수 있을 것 같았다. 아는만큼 보이는 것 처럼 내가 어떤 재료로 어우러졌는지 알면 더 많이 보이고, 느껴지기 때문이다. 디저트를 기다리면서 300일의 축하 편지를 전달했다! ㅋㅋ 첫번째는 귀여운 잔에 넣어진 노란색 음료의 정체는? 맥주 젤리같이 생기기도 한 이것은 바로 상큼한 과일향의 젤리..! 완전 새콤달콤해서 내 스타일이었다. 웰컴디저트 이후에 메인 디저트가 나오기 전, 논알콜 칵테일과 펠른 시그니처 위스키 더치를 먼저 준비해 주셨다. 논알콜 칵테일을 받았다. 흔히 먹던 화이트와인보다 살짝 더 노란빛이 나는 칵테일이었다. 이어서 바로 준비된 디저트! 상큼하고 시원한 느낌이 가득한 바다의 소리 초코처럼 진하고 단 것도 좋아하지만, 가끔씩은 과일맛이 나는 상큼달콤한 디저트도 좋아하기에 어떤 맛일지 궁금했다. 과일중에서도 내가 좋아하는 열대과일 파인애플, 망고의 상큼함이 좋았고, 코코넛 소르베의 달달하고 고소함이 조화로웠다. 입 안이 톡톡 쏘는 팝핑캔디도 들어있어서 바다의 시원함과 청량감이 느껴졌다. 오빠가 시킨 디저트. 특별한 기념일이라 300일 기념일 문구를 요청드렸더니 흔쾌이 OK 해주시고는 Happy 300 day 라는 문구를 써주셨다. 큐브모양의 초콜릿 무스가 참 먹음직스럽게 생겼다. 정갈하게 각 잡혀있는 큐브 초코무스. 가운데는 슈가코팅한 링 모양으로 데코하여 우주같은 느낌도 있다. ♡ Happy 300 day ♥ 커피는 펠른시그니처 위스키더치 맛도 살짝 그을린듯한 훈연된 향이 느껴지는 커피였다. 위스키를 좋아하는 사람들이라면 좋아할 것. 기념일이라고 초도 달아주는 펠른의 센스. 연인들에게 데이트 장소로 추천하고싶다! 이런거 준비해주면 남자친구든 여자친구든 너무좋을듯하다. 특별한 날을 기록할 수 있으니까. 초콜릿 무스는 정말 진한 초코가 들어있었다. 커피랑 같이 먹기에 조화가 참 좋았다. 디저트 도둑.. 연남카페 재생 2 좋아요 2  접기/펴기 펠른 연남 오빠와 행복한 시간을 보냈다. 다음 기념일도 연남동 펠른에서?! 5m © NAVER Corp. 펠른 서울특별시 마포구 성미산로22길 18 A'동 1층 펠른 예약 펠른 에스프레소바 서울특별시 마포구 성미산로22길 18 펠른 에스프레소 바 예약 펠른(@perlen_official) • Instagram 사진 및 동영상 팔로워 7,323명, 팔로잉 1명, 게시물 121개 - 펠른(@perlen_official)님의 Instagram 사진 및 동영상 보기 www.instagram.com"
