title,content
[피칸파이] 레끌라 연남동 작은 사이즈 틀 변경 안내,예전에 피칸파이(타르트) 틀 자체 제작을 하였다는 포스팅한 적이 있는데 기성틀 잘 쓰다가 제작한 이유??? 기성틀 → 철에 코팅이 되어 있어 최대한 세척을 하지 말고 닦아서 써야 함 레끌라 피칸파이는 틀 세척이 필수 그것도 빡빡!! 그러다 보니 틀 코팅이 금박 벗겨져 새틀로 주기적으로 교체함(그래서 안 쓰는 틀이 무지 많음)_세척을 안해도 벗겨지긴 함 코팅이 벗겨지면 인체에 해로움! 그래서 틀 제작을 하게 됨(예전에 물방울 틀 제작 경험을 토대로 제작함_비용 우녹스 오븐 큰 사이즈 한대 또 샀다 생각하고 있음) 새로 틀을 주기적으로 교체해 오다가 기존에 틀이 단종되었다는 울픔 소식을 전해주심. 다른 업체에서 똑같이 제작한다고 다른 틀을 보내주심' 근... 데 기존 틀과 사이즈가 많이 차이 남 (내경과 외경 사이즈 높이가 모두 작게 제작) 오히려 사이즈가 커지면 재료비 인상 감수하고 그냥 사용하는데 작은 사이즈는 사용 불가!! 그래서 제작한 틀을 조금씩 기존에 남아있는 틀과 같이 사용하여 며칠 전부터 랜덤으로 고객님께 판매되고 있습니다. 제작 틀은 아껴서 나중에 사용하려 하였으나 기성틀 사이즈 단종으로 차츰 변경하게 되어 알려드려요.. 왼쪽은 기성틀 오른쪽은 제작 틀 기성틀과 제작 틀의 모양 차이는 주름이 있고 없고의 차이입니다.(기존 고객님들은 어색하실 수 있습니다.) 기성틀과 제작 틀 제품의 양은 제작 틀이 약 20g 정도 양이 더 많습니다.(피칸도 더 많이 들어갑니다~ㅎㅎ) 별도의 단가 인상 없이 랜덤으로 진행하다가 차츰 제작 틀로 모두 변경합니다 세상에 레끌라만 가지고 있는 파이(타르트)입니다.!!! 홀 사이즈도 제작했는데 단종되면 쓰겠습니다.^^ 버터지 퐁사쥐 후 비교 컷!!(참고용) 자체 제작 틀을 기성틀 사이즈 보다 조금 큼^^ 원래 미국식 전통파이는 주름 없음 ㅎㅎ 타르트 틀이라서?! 레끌라 서울특별시 마포구 동교로 266-6 2층 LECLAT 레끌라 연남동 맛집 피칸파이 맛집 호두파이 홍대 마포 선물 명절 선물 추석선물 생일 케이크 임직원 선물
"선물하기 좋은 연남동 피칸파이 맛집, 레끌라","홍대 연남동 피칸파이맛집♥ 남자친구가 파이 를 좋아해서 연남동에 파이 매장을 찾아보다가 발견했어요. 남자친구도 너무 맛있다고 좋아하더라구요 ㅎㅎ 📍서울 마포구 동교로 266-6 2층 LECLAT 📍월~토 12:00 - 19:00 (일요일 정기휴무) 홍대입구역 3번출구로 나와서 10분정도 걸어오면 카페 씨스루 옆 건물 2층에 레끌라를 찾아오실 수 있어요. 레끌라 www.leclatdechocolat.co.kr 레끌라에서는 피칸파이(호두파이) 외에도 수제초콜릿도 직접 만들어서 판매하신다고 하더라구요. 사장님이 넘 친절하고 예쁘셔서 더 정감가는 타입 >_< 덕분에 계단을 올라오면서 바로 냄새에 현혹될 수 있어요. 파이냄새가 정말 장난이 아니게 맛있거든요(?) 이건 진짜 맡아본 사람만 알 수 있어 피칸파이 홀 케이크는 생일케이크로도 사랑받는다고 해요. 냠냠 간식거리로 즐기실 분들을 위해 피칸파이 타르트로도 3개 세트, 4개 세트로 판매 중이랍니다. 저는 남자친구가 가볍게 회사다닐때도 간식거리로 들고다니기 좋으라고 3개 세트, 4개 세트로 선물해줬어요! 다음에는 홀케이크로도 한번 사다줄 계획입니다ㅎㅎ 피칸파이 말고도 다른 달콤한 디저트들도 많이 있어요. 보기도 좋고 맛도 좋아보이는 레끌라 봉봉 수제 초콜릿과 곧 다가올 빼빼로데이를 맞이하며 준비하고 계신 수제버터스틱빼빼로도 출시되었으니 빼빼로데이 선물 고민중이신 분들한테 예쁘고 고급스런 디저트 선물로 추천드려요! 이렇게 고급스러운 포장은 덤!! 저는 이번이 2번째 방문이예요 ㅎㅎ 사장님께 지난번에 너무 맛있게 잘 먹었다구, 다음엔 홀케이크 사러 온다고 슬쩍 말을 남겼더니 아직 공식 출시 전이었던 수제버터스틱빼빼로를 맛보라고 하나 꺼내주셨답니다 ㅎㅎ 달달구리~~ 너무 맛있었어요♥ 내가 만들때도 이렇게 맛있었으면 얼매나 좋을까 ㅎ,, 네이버 예약으로 먼저 디저트 찜 해놓기 약속한 픽업시간은 꼭 지켜주세요 :) 네이버 예약으로 먼저 주문해놓기 달콤한 수제파이, 수제초콜릿이 먹고 싶다면 지인에게 선물한 고급 디저트 선물세트를 찾고 있다면 홍대 연남동 디저트맛집, 레끌라로 찾아오세요♥ 레끌라 서울특별시 마포구 동교로 266-6 2층 LECLAT"
"피칸파이맛집: 연남동 레끌라 피칸파이!(내돈내산) 피칸이 듬뿍, 레끌라의 피칸파이 추천!","피칸파이맛집: 연남동 레끌라 피칸파이!(내돈내산) 피칸이 듬뿍, 레끌라의 피칸파이 추천! 가족모임,친구들 모임 케이크 담당인 저. 자주 구입하는 축하용 케이크! 코로나로 잠잠해졌지만.. 이번달 생일자의 주문. 꼭 피칸파이를 먹고 싶다고. 피칸파이를 꼭 집어 지정. 피칸파이 좋아라 하지만 조각으로 맛보았을뿐 아는 피칸파이집이 없어 네이버 검색. 생각보다 많은 피칸파이집 중 선택한 곳. 홍대,연남동에 위치한 레끌라!! 아무 정보 없이 주문한거라 실패 할 경우 내 느낌을 원망해야했지만 레끌라의 피칸파이는 정말 맛있었어요. 내돈내산 이지만 지불한 금액이 전혀 안 아까웠던 피칸파이 : 부모님 1차 칭찬, 생일당사자 2차 칭찬. 전 네이버로 3일 전에 예약하고 시간 맞춰 연남동에 위치한 레끌라에 가서 주문한 피칸파이 수령했습니다. 사각형 녹색간판 레끌라. 2층에 위치하고 있습니다. 레끌라 서울특별시 마포구 동교로 266-6 2층 제가 정신이 없어 가게 구경도 제대로 못하고 왔지만 피칸파이 외 에그타르트도 판매하고 있었어요. 하얀 쇼핑백에 주문한 피칸파이. 이 에그타르트 맛보고 여기 다른것도 맛있겠다고 생각했어요. 이 에그타르트 정말 맛있음. 잘못먹으면 비린 에그타르트인데 촉촉 부들부들 식감에 정말 맛있음. 저 에그타르트 안 좋아하는데 레끌라의 에그타르트 생각나요. 하얀쇼핑백 안에 들어있던 레끌라의 피칸파이 개봉!! 일단 선물하기 좋은 패키지에 리본! 깔끔하니 고급스러워 선물용으로 제격인것 같아요. 물론 맛도 있으니깐^^ 외관상 보기에도 피칸이 가득가득. 피칸100% 피칸이 아주 듬뿍 들어가서 고소 할 수 밖에 없는 에끌라의 피칸파이. 크러스트 부분은 완전 바삭!! 달지 않고 촉촉하고 엄청 고소한 피칸파이. 맛있다. 정말 맛있다!! 커피랑 마시니 세상 행복했습니다. 쫀득 고소 또 고소한 피칸파이. 피칸파이는 원래 맛있는데 이 집 피칸파이는 더 맛있다고 ㅎㅎ 분명 식후 먹는거라 맛만 보기로 했는데 그자리에서 다 먹음.. 보존료나 유화등 첨가하지 않아서 가급적 빨리 먹는게 좋다고 했는데 파이 수령하고 3시간도 안돼서 빈 박스만 ^^ 모르는 곳이라 주문 망설였는데 저도 만족하고 함께 먹었던 가족도 만족한 연남동 피칸파이 맛집 레끌라!! 아주 맛있었습니다. 레끌라 02-2677-2165 서울 마포구 동교로 266-6 2층"
발렌타인데이 마카롱·초콜릿 선물 추천 - 연남동 '일쩜오플로어커피(1.5floor)' & '레끌라',"2월 14일 발렌타인데이를 맞아 어떤 선물을 해야 할지 고민하고 있는 사람들을 위해 '수제 마카롱'과 '수제 초콜릿'을 맛집을 소개한다. 일쩜오플로어커피(1.5floor) 초콜릿을 주고받는 발렌타인데이에 좀 더 특별한 선물을 하고 싶다면 마카롱을 추천한다. 일쩜오플로어커피는 '연남동 수제 마카롱'으로 유명한 곳이다. 연남동의 작은 골목 안에 위치해있지만 오픈 시간부터 끊임없이 사람들이 찾아온다. 연남동 일쩜오플로어커피의 내부는 협소한 편이다. 주로 손님들이 테이크아웃을 하는 매장이기 때문이다. 매일 판매되는 마카롱 라인업은 공식 인스타그램에 공지되며 조금씩 달라진다. 또한 인스타그램에 실시간 마카롱 수량과 재료 소진 마감을 안내하고 있어 방문 전에 참고하면 좋다. ▲ 마카롱 쇼케이스 일쩜오플로어는 발렌타인데이를 앞두고 초콜릿이 가미된 다양한 마카롱을 제작하고 있다. 그 외에도 딸기 마카롱과 인절미 마카롱이 인기가 많다고 한다. 마카롱의 가격대는 2,500원에서 4,000원 사이이다. ▲ 통오레오, 페로로 로쉐 ▲ 쪼코우유 쪼코칩, 레드벨벳케이크, 우유빙수 다양한 마카롱 중에서도 눈에 가장 띄는 것은 바로 '페로로 로쉐'이다. 진한 다크 초코 크림에 초콜릿이 통째로 들어가 있어 발렌타인데이 대표 마카롱이라고 한다. '쪼코우유 쪼코칩'은 이 가게의 베스트셀러인데, 진한 다크 초코 크림과 고소한 우유 크림 위에 초코칩이 듬뿍 올려져 있다. ▲ 피스타치오 딸기, 진짜딸기우유 ▲ 말차 앙버터 다쿠아즈, 딸기우유 다쿠아즈 발렌타인데이에 초콜릿 맛 마카롱도 좋지만, 딸기가 들어간 마카롱도 예뻐서 선물하기에 좋아 보인다. 딸기 메뉴는 시즌 한정 메뉴이며, 1인 2개까지만 구매할 수 있다. ▲ 주의사항 & 음료 메뉴 마카롱 쇼케이스 위에는 '마카롱 보관방법' 과 '구매 전 주의사항' 안내문이 있다. 상자포장은 4구, 6구, 9구로 가능하며, 상자는 무료이다. 그 외에 보냉팩은 1,000원 추가이고, 비닐봉지는 50원에 유상 판매되고 있다. 마카롱을 매장에서 먹는 경우에는 1인 1음료를 주문해야 한다. 4구 상자 포장은 다음과 같다. 상자 포장에는 마카롱 먹는 방법 및 보관 방법이 적힌 메모가 붙여져 있다. 일쩜오플로어 마카롱은 당일 만든 마카롱이라 숙성하면 좀 더 쫀득한 식감을 느낄 수 있다. 또한 필링이 두껍기 때문에 반드시 차갑게 먹는 것이 좋다고 한다. 이번 발렌타인데이에는 이색적인 뚱카롱으로 마음을 표현해보는 것은 어떨까. 일쩜오플로어커피(1.5floor) 이용정보 1. 가는방법 : 공항철도 홍대입구역 3번 출구, 도보 7분 2. 주 소 : 서울 마포구 동교로 34길 21 3. 영업시간 : 수~일 13:00 - 21:00(재료 소진 시 마감) / 월, 화요일 휴무 4. 전화번호 : 02) 3144-3801 5. 홈페이지 : https://www.instagram.com/1_5floor/ 6. 가격정보 : 통오레오 2,500원, 쪼코우유 쪼코칩 3,000원, 페로로 로쉐 3,500원, 진짜딸기우유 3,500원, 딸기우유 다쿠아즈 4,000원, 아메리카노 4,500원(아이스 5,000원) 일쩜오플로어커피 서울특별시 마포구 동교로34길 21 레끌라 '발렌타인데이'하면 자연스럽게 초콜릿이 생각나기 마련이다. 선물하기 좋은 '최고급 수제 초콜릿'을 연남동에서도 찾을 수 있다. 연남동 레끌라는 '수제 초콜릿'과 '천일염 마카롱'으로 유명한 디저트 전문샵이다. 초콜릿을 사야 할지, 마카롱을 사야 할지 고민하고 있다면 연남동 레끌라를 방문해보자. 연남동 레끌라의 2월 영업 날짜는 위의 사진을 참고하길 바란다. 레끌라는 전문 쇼콜라티에를 양성하는 교육을 제공하는 곳이기도 하다. 쇼콜라티에 수업이 있는 15, 21, 28일은 휴무이고, 정기 휴무 날짜는 20일, 27일이다. 레끌라는 수제 초콜릿뿐만 아니라 다양한 디저트와 음료도 판매한다. 하지만 매장에 테이블이 하나이기 때문에 테이크아웃을 하는 것이 좋다. 카운터 옆 왼쪽 쇼케이스에는 먹음직스러운 디저트들이 있다. 선물용, 답례품으로 유명한 피칸파이, 그리고 수제 마카롱을 판매하고 있다. ▲ 수제 마카롱 7구 레끌라의 수제 마카롱은 프랑스 정통 디저트 전문점답게 클래식한 모양이다. 작고 앙증맞지만 그 맛은 아주 훌륭하다. 레끌라 마카롱은 잼 필링을 사용하지 않고 다양한 크림을 응용하여 만들었다고 한다. 2월 14일 발렌타인데이까지는 낱개로 구매가 불가하고 '7구 세트'로만 구입이 가능하다. 가격은 7구 세트에 17,500원이다. 디저트 옆 쇼케이스에는 형형색색의 초콜릿이 가득하다. 판초콜릿, 수제 초콜릿, 무스카딘, 쇼콜라 통헤이즐넛, 카카오닙스 등 초콜릿이 들어간 모든 디저트들을 모아놨다. 특히 레끌라에서는 특별한 초콜릿을 구매할 수 있는데, 위스키 술이 들어간 '위스키봉봉'이다. 위스키봉봉은 초콜릿과 위스키의 부드럽고 향긋한 맛이 아주 깊은 프랑스 정통 디저트이다. 이번 발렌타인데이에는 위스키봉봉으로 좀 더 로맨틱한 선물을 해보는 것은 어떨까. 그 밖에도 수제 초콜릿이 아주 다양하게 제작되어 있다. 코코넛, 피스타치오, 카라멜, 우지마차, 유자, 바닐라, 장미&리치, 얼그레이, 시나몬 등등 그 맛이 다양하고 디자인도 예술이다. 낱개로도 구매가 가능하며, 초콜릿 하나 당 가격은 약 2,100원이다. 발렌타인데이 선물로는 수제 초콜릿 선물 세트가 인기가 많다고 한다. 방문했던 날(2월 9일) 기준으로 리얼생초코 10구, 위스키봉봉 5구, 봉봉 10구, 봉봉 15구가 준비되어 있었다. 가장 인기가 많은 패키지는 '봉봉 15구'인데, 레끌라의 수제 초콜릿을 모두 맛볼 수 있는 세트이다. '판초콜릿'도 선물용으로 인기가 많은 제품이라고 한다. 크런치 다크, 다크 초콜릿, 단짠 판초콜릿, 딸기 화이트, 다크 과일, 화이트 과일 등 종류도 다양하며, 가격대는 8,500원에서 9,900원 사이이다. ▲ 화이트 과일 판초콜릿 & 봉봉 10구 패키지 레끌라에서 봉봉 패키지를 구매하면 정성스럽게 포장해준다. 레끌라의 고급스럽고 예쁜 패키지 덕분에 로맨틱한 발렌타인데이가 될 것 같다. 화이트 과일 판초콜릿의 과일은 하나하나 직접 말려 제작하고, 그 모양이 예뻐 선물용으로 제격이다. 발렌타인데이까지 물량 확보 문제로 봉봉 패키지 구성은 랜덤이다. 14일 이후에는 선호하는 초콜릿 맛을 고를 수 있다. 이번 발렌타인데이에 초콜릿이 식상하다면 일쩜오플로어커피의 마카롱을, 고급스러운 수제 초콜릿을 찾는다면 레끌라를 추천한다. 레끌라 이용정보 1. 가는방법 : 공항철도 홍대입구역 3번 출구, 도보 7분 2. 주 소 : 서울 마포구 동교로 50길 11 3. 영업시간 : 매일 11:00 – 19:00 / 2월 15, 20, 21, 27, 28일 휴무, 매월 휴무일 홈페이지 공지 4. 전화번호 : 02) 2677-2165 5. 홈페이지 : https://blog.naver.com/rose35wh, http://leclatdechocolat.co.kr/ 6. 가격정보 : 마카롱 7구 세트 17,500원, 위스키봉봉 5구 17,000원, 봉봉 10구 22,000원, 봉봉 15구 32,500원, 화이트 과일 판초콜릿 9,900원 레끌라 서울특별시 마포구 동교로50길 11 1층 - 작성자 Jiingni -"
11월 일기/ 연남동 에그타르트 레끌라 핑크공주 달링스푼 끼리코 중성화 수술,날씨가 급격하게 투워져떠😭 추운날씨 너무 싫운 해니눈 퍼자켓을 입눈다🎀 코트 세개 자켓 세개 샀눈데 봄이 오면 입우꾸있게띠? 치킨울 사둘고 스타벅스 이프리퀀시 기부해주신 모둔 분둘께 감사두리며 네 받아뚭니다 핑쿠다이어리🌷 2020년 함께하댜 배냇털 밀기전의 끼리코 예전엔 바닥에서만 자더니 요줌은 침대위에서 잘만 잔다 우리 강아지가 되구있나바💖💝💖💝 아침부터 신촌가서 갈비먹우구 연남동 #달링스푼 핑크공주 디즈니 러버들의 핫플이다 어렸울때 부터 Belle 이 바로 나라고 생각한 나눈 발루인 아빠와 쟈스민인 엄마 오로라인 동생과 디즈니속에서 자라왔고 그냥 보통 알려진 인어공주 뮬란 등의 영화말고도 작은 에피소드 비디오까지 소장한 진성이다🙌🏻 (자부심 미침🎀) 갖고 싶운거가 너무 많아서 사진 찍우기도 바뿌고 만져보기도 바쁘고 우리집에 이 피규어 다이띠렁 #레이어드연남 레이어드는 정말 자주 오는 곳이다 케이크가 내가 영국에서 먹던 감성과 비슷해서 자꾸오게 되눈 곳 오늘은 라즈베리케이크를 먹어꾸 다 먹눈데 5분도 안걸여꾸 에그타르트 먹으러 #호라이즌16 에그타르트는 여름 한정 메뉴라 지굼은 마카롱만 이따구해서 눈물웅 흘리며 돌아와띠😭 연남동 #레끌라 에그타르트를 찾우러 온 이곳 피칸파이도 좋아하디마눈 에그타루투가 먹고디퍼🙌🏻 명문고 교복🎀 서울대 못가서 미안해 엄빠 구래도 똑똑하게 자랐지? 해외석사라고 대푸라이드 가졌움...😎 언래 레끌라눈 에그타르트가 예약제인데 오눌은 대량주문으로 계속 만두눈 날이라서 원하는 만큼 살수있었다 lovey- 구렇게 획둑한 에그타르트 10분만에 all gone 또 온 달링스푼.... 눈에 밟히는 것둘이 많우니 데려가야디 잠울 못자게썰 이런데 오면 다 남자친구가 사주눈거라구 사장님이 선수치셔따😂😂😂 내가 가지고 시퍼한 세일러문스티커 선물로 주셔서 감사합니다🙌🏻 교복놀이하구 나이가 29.9니까눈 #핑크공주 이날 회사에서 사람들이 많이 놀려따 물꼬기 잡우러가눈 핑크공주🌷 회사 들고다니눈 것들 스티커 왜들고 다니눈지 몰라 맛있눈 고기집울 찾아따 #문래그집 또먹우러 갈래 투워서 핑크 롱패딩 꺼내따 몇개월전에 샀눈디..... 여룸부터 나룰 기다린 롱패딩 디즈니랜드 입고갈 공주옷 회사에도 입고가고시푼데 고민이야🥳 #viennacoffehouse 비엔나커피하우스 라구 아인슈페너 맛집이라며 데려와진 곳☕️ 커피맛울 모르는 나지만 맛있어따 치즈케이크는 리얼이루 맛이뚜구🧀 #물개컷 첫 미용한 끼리코 더 귀여워 짐 구이고 중성화수술해서 우울한 끼리코 이번주말 미용에 중성화에 생애 최대위기 다 겪우다 마움에 들어서 또 올리는 리얼리제이션 알렉산드라 원피스 제일 마움에 둘어🎀 아직 독일에서 안온 택배둘 오며눈 블로그올려야디
[미국인 남편의 최애] 홍대 연남동 피칸파이 레끌라 (feat. 내돈내산),"안녕하세요! 어제는 미국 추수감사절 전반적인 내용을 소개했습니다. 오늘은 Thanksgiving Day에 빼놓을 수 없는 피칸파이! 피칸파이 찐 맛집을 소개하겠습니다! 매년 이맘 때 찾는 '연남동 레끌라' 연남동 레끌라 서울 마포구 동교로50길 11 02-2677-2165 월-토 11:00 - 19:00 / 일요일 정기휴무 피칸파이, 마카롱, 수제초콜릿, 당근케익, 파운드 케익 등 판매 올해는 코로나 상황과 레끌라가 문을 닫는 오후 7시까지 연남동에 못 갈 것 같아서 네이버에서 주문을 했어요! 네이버 통해서 레끌라 홈페이지 주문이 가능해요! 주문하고 약 이틀 뒤에 바로 집 앞에 도착했어요! #내돈내산 #레끌라 #연남동파이맛집 꼼꼼하게 포장 되어 있어요! 주문으로는 이번에 처음 구매했는데 굳이 연남동까지 안가도 되서 좋네요🧡 피칸파이 박스예요! 포장 넘 이쁘죠! 레끌라만의 박스도 있고, 쇼핑백도 담아서 주세요^^🧡 짜잔!💛💚 박스 오픈하고 담겨있는 피칸파이! 가격은 31,000원 + 배송비 3,700원 가격이 후덜덜 하기는 해요.. 그런데 파이가 정말 맛있어요! 크러스트 부분도 우와~ 정말 바삭바삭하게 잘 만드셨어요. 매년 찾는 이유💛 같이 넣어서 보내주신거에요. 저희는 2일뒤에 먹을거여서 냉장보관했어요. 짜잔🧡😍 도착한 날은 한조각만 먹고 바로 냉장고에 넣어놨어요😎 연남동 피칸파이 레끌라 추천해요! 개인적인 의견 #내돈내산 1. 외국에서 먹었던 피칸파이 찾고 계신분🖐 미국스타일과 정말 비슷해요😋 다른 집 파이도 먹어봤는데 많이 달거나 좀 더 한국 파이 같은느낌이 있다면 레끌라는 외국에서 사먹었던 맛이랑 비슷합니다. 2. 파이 크러스트가 바삭바삭하고 맛있다. 저는 파이먹을때 크러스트 부분을 중요하게 봐요. 크러스트가 바삭바삭 잘 만들어져있으면 파이가 더 맛있더라고요! 3. 파이가격이 세지만, 피칸이 정말 많이 들어간다 파이 한 조각에 피칸 2-3개 올라가있는 정도가 아니고, 정말 가득 넣었다는 점에서, 이만큼 가격을 내고 먹는다는 느낌이 들어요 ㅎㅎ 호두파이 좋아하시는 분! 레끌라 피칸파이가 호두파이 비슷한데 덜 달아요 :) 추천합니다! 오늘도 읽어주셔서 감사합니다!"
[빼빼로데이] 수제 버터 스틱 빼빼로 레끌라 홍대 연남동 선물 NEW 토핑 피칸파이 초코쿠키 위스키 봉봉 답례품,"11일 새벽 추가 포스팅 11월 10일 수제 버터 스틱 빼빼로 모든 물량이 판매되어 늦은 시간까지 11일 토요일 물량 만들었습니다. 빼빼로데이 당일 전화예약 불가합니다. 너무 많은 전화 문의로 고객님 응대가 늦어지고 있습니다(양해 부탁드려요) 방문하시는 고객님께 소진 시까지 판매합니다 많은 물량을 추가 제작하였습니다🙏♥️ 레끌라는 빼빼로데이가 끝나는 다음 주도 예약 물량으로 화요일~목요일 빼빼로 또 작업합니다 월요일 임시 휴무!!! 매장 판매 문의가 많아 안내드려요. ♥매장 구매는 홈페이지 패키지 참고하셔서 방문해 주시면 더 빨리 구매 가능하세요. 홈페이지와 동일하게 패키지 최대한 맞추려 합니다. 포장 중~~~~~ 한 컷 홈페이지 택배 발송 수제 버터 빼빼로는 11월 5일 23시 59분 결제 완료 건(4일로 재변경) 많은 사전 주문량으로 조기 마감 예정입니다. (홈페이지 택배 주문 마감) 매장 판매는 4일 토요일부터 가능하며 낱개 구매 불가, 패키지로만 판매됩니다. 홈페이지 패키지와 매장 판매 패키지는 상이 할 수 있으나 최대한 많이 제작하도록 하겠습니다. 아래↓클릭 홈페이지 바로 가기 레끌라 www.leclatdechocolat.co.kr 딸기(벨기에) 토핑 변경→무지개 초코 토핑(벨기에)입니다. 원가가 비싼 제품입니다. 샘플 작업 결과 같은 초콜릿이라 많이 붙네요ㅠㅠ 21년까지 딸기 토핑 (원산지 : 벨기에) 22년 흑임자 토핑 대체 23년 무지개 초코볼 토핑 (원산지 : 벨기에) 22년도부터는 벨기에 딸기 수입이 안돼서 흑임자로 대체하였는데 23년도 빼빼로데이부터는 새로운 토핑을 찾았어요 샘플을 보내주셔서 간택된 제품!!! 좀 요란스럽죠ㅎㅎ 원산지 벨기에(기존 딸기 토핑도 벨기에!! 벨기에는 초콜릿과 와플이 유명해서 그런지 관련 특이한 토핑이 젤 많은듯해요.) 딸기 토핑이 아마 빼빼로 토핑 단가치고는 모든 빼빼로 제작 업체 토핑 제품 중 제일 비쌌는데 이번 무지개 초콜릿 토핑 분태도 딸기 토핑과 kg 원가가 같아요 우리나라 기성 초콜릿 제품은 카카오 매스 함량만 있고 별도의 카카오버터의 함량은 찾기 힘든 반면 유럽은 기성 초콜릿 제품에 카카오버터의 함량이 항상 들어 있었다는(예전 성분 표시 열심히 보러 다님) 과일 맛 향 등 저렴한 토핑을 사용하지 않으려 노력합니다!! 새로운 토핑 샘플 작업하면서 기존 토핑 제품도 홈페이지 업데이트 위해 다시 샘플 작업하였습니다!! [빼빼로데이] 수제 버터 스틱 빼빼로 레끌라 홍대 연남동 선물 NEW 토핑 피칸파이 초코쿠키 위스키 봉봉 답례품 레끌라 서울특별시 마포구 동교로 266-6 2층 LECLAT"
