title,content
"연남동 카페｜마카롱 전문점 내돈내산 지인 강추 오테라 부띠끄(feat. 네이버예약 시 혜택, 할인 팁 알려드림)","오테라 부띠끄 마카롱 맛집으로 지인이 강추해서 가게된 연남동 마카롱 카페 주소 서울 마포구 연남로3길 13 1층 영업시간 월-금 09:00~18:00 토-일 11:00~18:00 문의 0507-1310-3985 *대표 사진은 저작권 프리 픽사 베이에서 퍼 온 것입니다. 안녕하세요 블루밍입니다. 이번 소개해드릴 카페 맛집 은 마카롱 맛집이라고 지인이 강추해줘서 별 기대없이 따라갔다가 완전 반해버린 마카롱 집입니다! 음료도 경의선숲길 산책하면서 맛있게 먹었구 마카롱도 꼬끄가 딱 제가 좋아하는 꼬끄에 부드러운데 식감은 또 좋고.. 암튼 최고임,. 오테라부띠끄 카페에서는 네이버예약 시 주는 혜택과 할인 쿠폰 제공도 있으니 조건과 방법 참고하시고 가보세요! 시간 없으신 분들은 사진들만 대충 보시고 맨 밑으로 스크롤 내리셔서 네이버지도로 들어가셔서 정보 확인하세요! #오테라부띠끄 #홍대맛집 #연남맛집 #연남동맛집 #연남동카페 #카페 #마카롱맛집 #마카롱 #경의선숲길 #경의선숲길카페 #경의선숲길산책 #추천 메뉴판 Manu 매장 들어가면 카운터 위쪽 높이 메뉴판이 있습니다. 전체적으로 음료 금액대는 쪼끔 저렴한 편이에요! 제가 갔을 때가 오후 5시쯤이었나 6시쯤이었나 그랬는데 마카롱 이미 대부분 비어있어서 ' 으억 오늘 못 먹겠는데..? ' 하고 놀랐어요ㅠ 마카롱이 진짜 맛집이긴한데 다른 디저트도 다양하게 많아서 전체적으로 선물 사러 오기 좋은 곳같아요! 다행히 직원분께서 전시된게 다가 아니구 대부분 뒷 창고인가 따로 보관 중인 재고 많이 있다고 하시더라구요!! OH- YEAH . 마카롱 외에도 초콜렛, 쿠키, 롤케잌 등 다양한 디저트 많이 보여요! 카카오페이 결제 가능합니다! 카운터 쪽에 카카오 결제 QR 인식해서 하면돼서 편리하더라구용~~ 이 날 카드 못 챙겨나왔는데 카카오페이 돼서 넘 다행이었어요 ㅎㅎ 주문 Order 딸기 트로피칼 커피 바닐라 초코 헤즐넛 오렌지 카라멜 총 17,500원 카카오페이로 결제 이렇게 7개 주문했어요! (개당 2,500원) 오렌지카라멜 한 입 해버리고 사진 찍어서 6개만 찍힌 웃픈사실 ㅋㅋㅋㅋ배고팠나봐요.. 핸드드립 커피 아이스 5,000원 음료도 하나씩 시켜 먹었습니다 :) 커피 고소한 향과 밍밍하지 않고 딱 적당한 커피 쌉쌀한 맛에 풍미도 적당해서 좋았어요 적당한 수준 맞추는게 어려운데 여긴 제 입맛에 딱 맞더라구요 :) 제가 커피는 막 너무 쓰지만 않으면 웬만하면 다 좋아하긴 하는데 ㅎ 인테리어 Interior 오테라부띠끄 ! 오테라 마카롱 ! 리뷰 잠깐만 봐도 마카롱 칭찬이 파다해요~~ 마카롱 다양하게 즐기고 싶으신 분들은 저처럼 운좋게 재고있는 날이 드물다고하니, 이왕이면 안전하게 일찍 가시는 걸 추천드려요! 자격증도 뙇 걸려있고 멋지더라구요~~ 자격증 걸려있는 곳은 왠지모르게 신뢰가 가더라구요! 디저트 전시된 곳 오른쪽 카운터 아래쪽 거울 있어염 놓치지 않쥐 찰-칵 ! 뽀쨕한 ' 척 ' 하는 제 발재간 사진을 끝으로 마무리 해봅니다 네이버 예약 & 15%할인 맨 아래에 위치 지도(네이버 지도) 들어가셔서 지도 홈에 이벤트, 혜택 - 알림받기 누르시고 15% 할인쿠폰 다운 누르시면 적용 가능하십니다 ㅎ 매장 가셔서 MY플레이스 - 쿠폰 사용 버튼 - 매장에서 사용 - 직원분이 쿠폰 확인 코드 입력 그럼 끝! 이런 식으로 사용해주시면 됩니다! 총평 매장에서 먹기보다는 디저트가 넘 맛있고 귀엽고 예쁘고 또 리뷰 몇 개 찾아보니까 포장도 예쁘게 잘 해주신다더라구요~ 예쁘게 포장해서 선물할 때 들르는 것도 좋을 것 같아요 :) 연남동 데이트 연남동 마카롱 카페 마카롱 맛집 마카롱 포장 선물 디저트 선물 찾으시는 분들께 추천드리면서 리뷰 마칩니다 >_<♥ 위치 오테라부띠끄 서울특별시 마포구 연남로3길 13 1층 공감과 댓글은 글 적는데 큰 힘이 됩니다. ♥Thank you♥"
오테라부띠끄 리뷰 이벤트 - 상시 진행!,"안녕하세요, 오테라부띠끄입니다. 오테라부띠끄 의 낮과 밤 모습을 촬영해보았는데요, 참 예쁘죠? ㅎㅎ 어느새 봄도 성큼 다가와 테라스에서 커피를 즐기시는 손님들도 많아진 요즈음 인데요, 오늘은 오테라에서 진행중인 세가지 이벤트에 대해 소개해드리려고 합니다. 1. 매장 포인트 적립 이벤트 매장에서 제품 or 음료 구매시 휴대폰 번호를 입력하여 고객 등록하시면 상시 10% 적립 해드리고 있습니다. -적립된 포인트는 매장에서 언제든지 편리하게 사용가능합니다! 2. 네이버 영수증 리뷰 이벤트 제품 혹은 음료 구매 후 영수증 리뷰 작성해주시면 마카롱 1구 (맛 선택 가능) or 오트밀 초코칩 쿠키 (두가지 모두 2200원 상당 제품)를 증정해드립니다. 📍 리뷰 이벤트 참여 방법 1. 매장에서 결제 후 영수증을 건네받습니다. 2. 네이버 검색창에서 오테라부띠끄를 검색 후 리뷰 목록을 클릭합니다. 3. 방문자 리뷰 ""나도 참여"" 버튼 누른 후 건네받았던 영수증을 촬영합니다. 4. 글 입력 및 사진 첨부 후 매장 직원에게 보여주시면 참여완료! 3. 네이버 블로그 & 인스타그램 리뷰 이벤트 오테라부띠끄 매장 방문후기 또는 제품후기를 네이버 or 인스타그램 업로드 한 베스트 리뷰어 한분을 매달 추첨하여 오테라 마카롱 15종 선물세트를 무료로 증정해드립니다. 📍 블로그 리뷰 참여 시 필수사항 - 오테라부띠끄의 위치를 꼭 업로드 해주세요. 📍 인스타그램 리뷰 참여 시 필수사항 - 오테라부띠끄 공식계정을 태그해주세요. (@oteraboutique ) 📍인스타그램, 네이버 블로그 공통 필수 해시태그 #오테라부띠끄 #연남동디저트카페 #연남동마카롱 #무색소마카롱 #마카롱 #수제마카롱 많은 관심과 참여 부탁드립니다! ⸜(♡'ᗜ'♡)⸝♥️♥️"
[서울 마포구 / 연남동 카페] “오테라부띠끄” - 마카롱 디저트 카페!,"오테라부띠끄 홍대 근처에는 정말 카페가 무진장 많아요.. 홍대 카페들 다 점령하고 싶은데 언제 다 가보지~? ㅋㅋㅋ 이번에는 다양한 디저트 종류를 판매한다고 하길래 연남동카페인 오테라부띠그에 다녀왔어요! 위치 ; 홍대입구역 3번 출구에서 도보로 10분~ 오테라 서울특별시 마포구 연남로3길 13 1층 오테라부띠끄는 연남동카페로 홍대입구역 3번 출구에서 도보로 10분 정도 소요돼요~ 이번에 갔던 카페는 네이버 지도에서 검색하면 '오테라' / 카카오맵에서 검색하면 '오테라부띠끄'로 나오니 찾아가실때 참고하시기 바래요! 간판은 오테라부띠끄라고 영어로 적혀져 있었어요. 오후 4시 40분쯤에 도착했는데 햇살이 장난 아니었고 사진에도 그 느낌이 그대로 담겼..ㅋㅋㅋ 영업시간 ; AM09:00 ~ PM08:00 (설&추석은 휴무) 영업시간 평일 _ AM09:00 ~ PM08:00 주말 _ AM11:00 ~ PM08:00 (휴무_설&추석) 문의 070-4243-3985 연남동카페 오테라부띠끄의 영업시간은 평일에는 오전 9시부터 오후 8시까지이고 주말에는 오전 11시부터 오후 8시까지에요! 휴무는 우리나라 명절인 설과 추석~ 평일에 굉장히 이른 시간에 오픈을 한다는 점이 신기했는데 주택가이다 보니 아침에 나갈때 사가시는 분이 많은걸까? 생각이 들더라구요~ 메뉴 ; 저렴한 커피와 초콜렛ㆍ마카롱ㆍ머랭쿠키 등 다양한 디저트~ 타블렛은 디저트카페로 유명한 것 같던데 음료도 일반 카페처럼 종류가 많았고 특히, 커피는 아메리카노가 2,900원으로 굉장히 저렴하더라구요~ 메뉴판에는 따로 적혀 있지 않았지만 테이블 위에 살포시 놓여져 있었던 하우스 와인을 판매한다던 문구~ 하우스와인을 주문하면 수제쿠키세트를 증정한다고 하네요!? 디저트는 쇼케이스에 대부분 들어있고 2개 정도는 외부에도 꺼내져 있었어요. 마카롱은 총 18가지로 종류로 2,200원의 동일한 가격이었는데 요즘 마카롱 크키가 하도 크다보니 오테라부띠끄 마카롱은 진짜 500원짜리 동전크기처럼 느껴졌고 굵기도 꽤 얇았..^^;; 쇼케이스에는 타블렛 모양의 다양한 맛을 지닌 초콜렛과 한 입에 먹기 좋은 초콜렛, 기존 마카롱보다도 훨씬 작은 크기의 미니마카롱과 함께 파운드와 롤케익이 있었어요. 그 외에는 머렝쿠키와 비스코티라고 하는 디저트도 있었어요. 카페 규모에 비해 제휴되는 카드가 꽤 있었으니 있으신 분들은 활용하세용~ 인테리어 ; 그럴싸한 엔틱 분위기의 외부와 협소한 내부~ 오테라부띠끄는 왼쪽과 오른쪽의 모습이 사뭇 다른데 왼쪽면은 엔틱한 프로방스 분위기가 물씬 나는데 오른쪽은 일반 천막을 이용해서.. 네.. ㅋㅋㅋ 외부에는 2인석의 총 3개의 테이블이 있는데 아무래도 너무 덥거나 추울때는 사용 불가능 하겠죠 ㅠㅠ 정말 잠깐 앉았다 가기에 좋을 듯한 외부였구용~ 연남동카페 오테라부띠그의 내부 전체샷입니다.. 실제로 오테라부띠끄 가기 전에는 사람들이 왜 전반적인 내부 사진을 올려주지 않는건지 의아했지만 그게 전부였다는 사실.. 안에서 노닥거리며 있기에는 사장님이 바로 앞에 있는 느낌이라 살짝 부담스럽고 꽤 협소한 카페였기 때문에 테이크아웃을 추천드려용 ㅎㅎ 맛 ; 탄 맛의 다크한 아메리카노와 한 입거리의 마카롱~ <주문 메뉴> ㆍ아메리카노 2잔 \ 5,800 ㆍ마카롱 5개 \11,000 총금액 \16,800 카페에서 노트북 하는걸 좋아하지만 오테라부띠그 내부에 대한 정보가 자세하게 없어 노트북을 가져가지 않았던 건 아주 현명했던 선택-! 마카롱이 먹고 싶어 갔기 때문에 마카롱 몇 가지와 근처 사는 동생에게 주기 위해 아메 2잔을 테이크아웃으로 가져왔어용~ 아메리카노 윗 부분만 보고 뭐야 색이 왜 이렇게 연해!? 하면서 꺼내봤더니 샷이 밑에 집중되어 있었던 것,, 그 색만 보고 바로 알았어야 했는데 아메리카노를 한 모금 들이키는 순간 와.. 이것 무엇~? 오테라부띠끄의 아메리카노는 굉장히 썼어요... 고소한 맛이 나는 다크한 아메를 즐기긴 하지만 쓰거나 탄 맛을 즐기지는 않는데 오테라의 아메는 제가 감당할 수 있는 수준은 아니었어용 ㅠ 오테라부띠그 마카롱은 사실 한 입에 해치워버릴 수 있지만 사진을 위해서 반틈씩 깨물어 먹기..ㅋㅋㅋㅋㅋ 일반 마카롱과는 다르게 그 뭐지.. 모찌 아이스크림 먹는 느낌이라고 해야하나? 겉부분의 굉장히 얇고 속이 꽉 차 있는데 찹쌀떡같은 식감? 떡을 씹는 것 같았어요,, 그 과자 중에 있는데, 겉은 하얀색 쫀득한 식감에 속은 앙금이 들어있는 그거 뭐냐... ㅠㅠ 아 모르겠어... 암튼 우리가 알고 있는 일반적인 마카롱의 식감은 아니니 참고하시고! 맛은 그냥 평범했는데 요즘 저것보다 큰 마카롱도 더 저렴한 경우가 있다는 걸 생각해봤을떄 오테라부띠끄의 마카롱은 조금 비싸다는 생각이 듭니댜.. ^^;; 총평 ; 한적한 분위기에 있는 연남동 디저트 카페, 오테라부띠끄~! #오테라부띠끄 ★☆☆☆☆ *별의 기준은 맛, 가격, 분위기를 종합한 주관적인 견해입니다. 다양한 디저트가 있었던 연남동 디저트 카페, 오테라부띠끄:-)"
오테라 부띠끄 연남동 마카롱 맛집 추천,"연남동 오테라 수제 마카롱 추천 연남동에 나름 유명한 베이커리 오테라 부띠끄에서 사온 마카롱 과자 초콜렛 세뚜!!!! 좀 비싼데 맛은 있다. 코로나시대에 가서먹지말구 집에서 스마트하게 배송해서 먹자구요?! 내가 받은건.. 마카롱 4pcs 쿠키 4pcs 초코타블렛 2pcs 아 발로나초콜렛이라고 그래서 그런지 초코 타블렛 너무 맛있어서 놀래서 아빠 줄라고 남겨놨던거 내 입에 다 털어 넣음ㅋㅋㅋ 연남동 오테라 마카롱 요새는 마카롱 맛집이 많고 워낙 큰 마카롱이 많아서 이래저래 생각해보면 안크다는 생각 많이들 하는데 나는 또 단거는 또 그렇게 큰건 안좋아해서.. 나름 괜찮은 듯?! 그리고 마카롱은 내입맛에 솔직히 많이 달았음ㅋㅋㅋ 단거 평소에 많이 먹는 편은 아니어서 그런가보다 ㅋㅋㅋㅋ 집에 택배 배송으로 시키면 이렇게 박스 안에 선물로 줄 수 있게 종이봉투도 하나씩 들어가 있다 ㅋㅋㅋ 백화점이라 수제 마카롱집 가서 마카롱 사는것도 위험한 이 시국에 친구네 집으로 선물들고 가야할때 이렇게 시켜서 들고만 가면 편하겠다 싶음ㅋㅋㅋ 연남동 마카롱 맛집 오테라 부띠끄 이런식으로 포장되어 있고 엄청 세련된 느낌은 아니지만 정감가고 깔끔함ㅋㅋ 그리고 열어보면 낱개포장 되어있어서 하나씩 뜯어먹기 편하당 ㅎㅎ 오테라 세트에는 이렇게 과자에대한 설명이 적혀있는 카달로그가 있다 ㅎㅎ 나는 여기서 초코 타블렛이 너무너무 부드럽고 맛있었다 ㅠㅠ 연남동 오테르 가면 이 타블렛은 또 사먹고 싶다 시중에서 사먹는 그런 편의점 초콜렛들과는 다른맛이기에... 고급진 느낌임 ㅎ 하나씩 들어서 찍어본 오테라 마카롱 쿠키들 ㅎㅎ 정갈하게 담아서 티타임할때 내놓으면 딱인 오테라 마카롱 ㅎ 연남동 마카롱 초콜렛 맛집으로 추천한다. 전화번호: 0507-1310-3985 주소: 서울 마포구 연남로3길 13 1층 영업시간: 주말 11:00 - 20:00 평일 09:00 - 20:00 설, 추석 연휴 - 휴무 #오테라 #연남동마카롱 #서울마카롱맛집 #오테라마카롱 오테라 서울특별시 마포구 연남로3길 13 1층"
"[연남동 커피] 연남동 수제로 만든 케이크, 마카롱, 초코렛을 맛볼 수 있는 연남동 카페 오테라부띠끄","카페를 찾아다니며 커피 맛을 보는 요즘, 연남동에서 새로운 카페를 발견했다. #연남동커피 오테라 부띠끄~ 현수막으로 걸린 all about us가 카페 이름인 줄 알았는데 반대편에 오테라 부띠끄라고 간판이 걸려있었다. 연남동 커피 오페라부띠끄 연남동 커피 오페라 부띠끄 카페 외관이 너무 예쁘다. 와우~ 이렇게 예쁜 카페가 있었나? 연남동 마카롱 카페 오페라부띠끄 들어가자마자 내 눈을 사로잡은 마카롱~ 양이 어마어마하다. 농구선수 현주엽이 생일선물로 마카롱 케이크를 받는 것을 TV 프로그램에서 보았는데, 이 정도의 양이면 마카롱 케이크를 만들어도 충분할 듯~ 마카롱 양을 보니 #오테라부띠끄 #연남동마카롱카페 로 인정~ 연남동 카페 오페라부띠끄 메뉴판 연남동마카롱카페 오페라부띠끄 많은 양의 마카롱을 두고 주문한 따뜻한 아메리카노, 티라미슈 라떼, 메이플롤 어느 메뉴든 맛있어 보여 주문하기가 쉽지 않았다. 메뉴판엔 보이지 않지만 아이스크림도 있다~ 연남동 카페 오페라부띠끄 내부 연남동 커피 오페라부띠끄 내부에도 테이블이 있었는데 일행과 같이 앉는 바람에 사진을 못 찍었다는.. 하하하하핫;; 안에 자리가 더 있어요~ 연남동 카페 오페라부띠끄 아메리카노, 티라미수라떼, 메이플롤 따뜻한 아메리카노, 티라미슈 라떼, 메이플롤이 나왔다. 라떼를 따뜻하게 먹고 싶었지만 티라미슈 라떼는 아이스로만 나온다고 해서 시원하게 마시는 걸로~ 여기 케이크는 다 수제라고 한다. 연남동수제케이크 오페라부띠끄 연남동카페 오페라 부티크 티라미수라떼, 아메리카노, 메이플롤 왼쪽 사진부터 티라미수라떼, 아메리카노, 메이플롤케이크 맛은 스타벅스 화이트 초코렛과 비슷한 거 같은데 위에 있는 우유 거품이 더 부드럽고 쫀득했다. 티라미수 라떼라 당연히 티라미수 맛도 남, 아메리카노는 산미가 가득하고 쫀득한 느낌이랄까? 요거 어떻게 표현을 해야 하나.. 연남동 카페 오페라부띠끄 메이플롤 그리고 기대했던 메이플롤, 롤케이크가 굉장히 고급스러워 보였고, 먹어보니 스펀지가 쫀쫀했다. 파리바게트의 롤케이크 스펀지보다 쫀쫀하고 크림은 부드러웠으며 메이플 시럽?은 달콤했다. 연남동 카페 오페라부띠끄 수제 케이크, 쿠키 선물세트, 마카롱 선물세트 클래식 후랑보아즈라는 케이크는 다음 기회에~ 연남동 수제 케이크는 오테라부띠끄에서~ 디저트로 쿠키도 있다. 여기 연남동 디저트 카페라고 해도 무방할 것 같다. 다양한 종류의 디저트 선물세트가 많으니까.. 연남동 카페 오페라부띠끄 마키 롱, 마카롱 선물세트, 수제 초콜릿 연남동 커피 오테라 부띠끄는 수제초코릿도 판매하고 있다. 마카롱 선물세트도 있었는데 너무 앙증맞았다. 연남동 마카롱 카페 오테라 부띠끄에서 판매하는 미니 마카롱 선물세트가 앙증맞다. 연남동 카페 오페라부띠끄 초코, 녹차 마카롱 연남동 마카롱 카페 오페라 부띠끄의 초코와 녹차 마카롱~ 마카롱이 너무 귀엽다. 연남동 카페 오페라부띠끄 커피 가격이 인상되었다고 안내가 되어 있다. 아메리카노가 3,300원이면 프랜차이즈 카페인 이디야와 비슷하다. 연남동 카페 오페라부띠끄 배달의 민족 할인쿠폰 연남동 수제 케이크 옾페라부띠끄는 배달의 민족으로 주문을 할 수 있어 집에서도 편하게 먹을 수 있다. 매장에는 배달의 민족 어플로 첫 주문 시 6천 원 할인쿠폰이 비치되어 있었다. 수제 케이크와 마카롱 세트를 쿠폰을 이용하여 할인받을 수 있다. 연남동 카페 오페라부띠끄 제로페이, 네이버페이, 엘포인트, 엠포인트 이 외에도 네이버페이, 제로페이, 롯데카드 결제 시 엘포인트 50%사용, 현대카드 M포인트 20%도 사용할 수 있어 할인혜택이 많아서 좋다. #연남동커피 #연남동마카롱카페 #연남동아이스크림 #연남동수제케이크 #연남동마카롱선물세트 #연남동롤케이크선물 #연남동수제초코렛 #배달의민족 #배달의민족연남동카페 #엘포인트50%사용 #M포인트20%사용 #네이버페이 #제로페이 오테라 서울특별시 마포구 연남동 566-38"
"연남동 수제케이크 맛있는 곳, 오테라부띠끄 연남점","안녕하세요. 지난주에 친구 집들이가 있었어요. 아무래도 친구가 요리를 준비할 것 같아서 같이 먹을 디저트를 구매하려고 방문한 오테라부띠끄입니다. 연남동 수제케이크 오테라부띠끄 연남점 평일 09시 ~ 21시 주말 11시 ~ 21시 오테라 서울특별시 마포구 연남로3길 13 1층 카페가 참 예뻐요. 테라스도 있고, 날씨 좋은 날엔 앉아서 커피 한 잔 하는게 정말 행복할 것 같다고 생각했어요. 카페 규모는 아담하지만 테이블이나 의자가 편하게 배치되어 있었고 맛있어보이는 디저트로 가득했어요. 오테라 메뉴판입니다. 디저트만 잘 하는 곳이 아니라 음료 메뉴도 다양하게 있었고요. 아이스 아메리카노랑 카페라떼 주문했는데 커피가 참 맛있었어요. 밸런스가 잘 잡힌 맛. 저녁시간대에는 와인도 판매하시나봐요 ㅎㅎ 마침 저는 집들이하러 가는거라 와인 마실 예정이라서 ㅋㅋㅋㅋ 이거 보고 수제 티라미수 구매했어요 ! 오테라는 마카롱이랑 케이크가 맛있다고 듣고 왔는데 수제초콜릿도 하시더라고요. 맛도 특이해보이는데 많아서 민트 박하 타블렛 하나 구매했어요. 집들이 하는 친구가 민트 덕후라 골랐는데 엄청 맛있다고 잘 먹더라구용 ㅎ 선물한 보람이 있었어요. 오후 3시 쯔음 갔는데 마카롱은 거의 다 팔리구 단체주문용 마카롱들 포장중이셨어요. 역시 맛집은 맛집이라며. 오테라는 선물용 박스도 넘 예뻐요. 마카롱도 사고싶었는데 고민고민하다가 케이크랑 초콜릿만 사 가기로 했지요. 이미 뭐가 많을 것 같아서 먹을만큼만 즐기기로 했습니다. 연남동커피 맛있는 곳 찾으신다면 한 번 와보세요. 아메리카노가 밸런스 잘 잡힌 깔끔함이라 디저트랑 훌륭하게 잘 어울릴 것 같았어요. 라떼는 테이크아웃해서 마셨는데 부드럽고 따뜻해서 좋았어요. 그리고 진수성찬을 대접받았던 친구 집들이! 스테이크, 치즈플레이트, 과카몰리 매쉬포테이토까지 ㅠㅠ 정성 가득한 요리 넘 맛있게 먹구 오테라에서 사 온 디저트를 꺼내봤어요. 민트맛이 느껴지는 달콤한 초콜릿 근데 과하게 단 맛이 아니라 은은하게 퍼지는 단 맛이라 좋았구요. 와인이랑도 정말 잘 어울려요. 안주로 강추합니당. 티라미수는 먼 길을 달려왔음에도 흐트러지지 않고모양을 유지하고 있었어요. 한 입 먹어보니, 진한 코코아 파우더의 맛과 부드러운 마스카포네 치즈 맛의 조합이 참 좋았어요. 티라미수 좋아하신다면 꼭 들러보시길 ! 디저트 퀄리티도 좋고, 무엇보다 넘 맛있어요....! 퀄리티에 비해 가격도 합리적인 편이고요. 다음에 가면 꼭 마카롱도 사오고 싶어요."
