title,content
[안내] 레끌라 홍대 연남동 영업일정및 피칸파이 픽업예약&택배주문방법 - 피칸파이맛집 홍대 연남동 연희동 서교동 합정동 호두파이맛집 파운드케이크맛집 생일케이크 답례품 에그타르트,"홍대 연남동 레끌라 수제초콜렛 피칸파이 호두파이 맛집 레끌라 입니다. 포르투칼 에그타르트는 9월부터 토,일요일만 나옵니다 19년 11월 빼빼로데이에 오픈할려고 했던 픽업 예약 시스템을 알고 예약해주시는 분들이 계서 알려드려요 https://booking.naver.com/booking/6/bizes/220707?area=plt [네이버 예약] 레끌라 디저트 음료 테이크아웃 매장& 베이킹클래스 공간입니다. 인터넷 판매및 쇼콜라티에마스터과정및 베이킹클래스 전문으로 진행합니다. 테이크아웃 매장에서는 수제초콜릿 타르트 마카롱 음료위주의 판매를 합니다.. 기존에 앉아 드실수 있는 몇안되는 공간도 축소하였습니다. 제품 주문시 대기 자리 정도이니 많은 양해 부탁드립니다. 더욱더 제품에 신경쓰도록 하겠습니다. booking.naver.com 매장 픽업(당일예약제외) 예약서비스 입니다. 우선 피칸파이 3종패키지가 업데이트 되여 있습니다 위 사이트는 매장에 직접 방문해주시는 사이트 입니다. 픽업예약 안하시고 당일 매장 구매도 가능하세요 수량이 많거나 오후 늦게 구매방문예정시 확인 부탁드려요 레끌라 010-3814-2165 또는 밑에 검색창에서 레끌라 치시면 예약키 언제든 문의 하실수 있는 톡톡키 있습니다.~^^ 그리고 http://leclatdechocolat.co.kr 최고급 수제디저트 레끌라 05.04 / 하절기 수제초콜렛 택배발송 불가안내 02.16 / 19년 발렌타인데이 정말 너무감사합.. 12.05 / 홍대 연남동 매장 영업시간안내 10.22 / 18년 빼빼로데이 너무너무감사합니다.. 10.11 / 베이킹클래스 및 쇼콜라티에마스터과.. 09.05 / 추석선물 예약 이벤트 안내 01.31 / [공지] 2018년도 발렌타인데이 택배마.. 피칸 호두파이 타르트 홀 (생일 케이크) 레끌라만의 감동하는 인기만점 피칸파이홀 31,000원 피칸 호두파이 타르트 4EA 선물용으로 강추 피칸파이 호두파이 23,300원 피칸 호두파... leclatdechocolat.co.kr 방문픽업이 힘드신 고객님들 레끌라 피칸파이를 여러모로 맛있다고 주문주시는 분들을 위한 택배발송사이트입니다. 하절기에는 수제초콜렛을 제외한 피칸파이만 배송가능합니다. 피칸파이는 아무 문제 없이 선물하시거나 드시면 되세요 택배 주문은 홈페이지 말고도 다른곳에서도 주문가능하신 곳이 있으세요 그쪽을 보시는 분들은 그쪽으로 주문 주시면 되세요~같은 제품입니다.!! 레끌라 피칸파이가 다른점 너무 훌륭한 레시피를 받기도 했지만 4~5년 동안 수제초콜렛만(수제초콜렛전문점이였음) 하면서 유일하게 놓지 않고 수정작업을 했던 레시피 입니다. 자신있게 레끌라에서만 드실수 있다고 말씀드릴수 있어요 레시피를 아는 사람은 저뿐이라서 ^^ 견과류의 잡내를 없애기위해 넣는 향신료등을 첨가하지 않고 밀가루반죽에서 버터 반죽으로 교체를 하고 키포인트인 필링에는 존재하는 설탕류를 다 테스트를 해보고 적합한 당류로 정하고 호두를 사용하지 않고 두배의 단가가 나가더라도 피칸만 100%이면 수입업체에서 바로 벌크로 들어와 제가 직접 전처리를 하고 숙성한 버터지에 전처리한 피칸을 넣고 레끌라만의 필링을 넣고 피칸을넣고 오래시간 데크오븐에 구운후 또 숙성에 들어가는 레끌라 피칸파이입니다. 레끌라 피칸파이는 피칸의 맛과 버터지의 맛 필링의 맛을 고스란히 느끼 실수 있는 맛입니다.. 그냥 여기저기서 파는데 잘팔리닌깐 나도 팔까해서 떠도는 레시피로는 어떤 디저트도 판매하지 않습니다. 명품브랜드등 수제초콜렛 대량작업으로 공방및 인터넷 판매만 하다가 솔직히 맛있는 피칸파이를 공유하고 싶어 매장을 오픈!! 블로그 포스팅은 잘 못해도 꾸준히 웨딩답례품하고 업체 간식 나가고 있는 레끌라입니다. 파이&수제초콜렛 레끌라 : 네이버 블로그 레끌라는 수제초콜렛, 피칸(호두)파이,에그타르트 전문매장입니다. 한제품만이라도 정직하게 판매합니다.^^ www.leclatdechocolat.com 피칸파이&파운드등 매장 포스팅 블로그☝️ [안내] 레끌라 홍대 연남동 영업일정및 피칸파이 픽업예약&택배주문방법 - 피칸파이맛집 홍대 연남동 연희동 서교동 합정동 호두파이맛집 파운드케이크맛집 생일케이크 답례품 에그타르트"
[추석선물] 연남동 레끌라 피칸파이 맛집 연희동 수제초콜릿 추석패키지 피칸타르트 홍대 합정 서교동 호두파이 임직원선물 거래처선물 생일케이크 답례품 서울디저트,기존에 주문 주셨던 고객님!! 벌써 주문주셔서 8월30일부터 추석 선물 택배 발송 시작되었습니다! 레끌라는 기본틀의 패키지를 변경하지 않고 포인트만 주는 형태로 그때그때 열심히 가내수공업중!! 레끌라는 재구매율이 무지 높아요. 시즌때마다 많은 수량을 재 구매해주시는 고객님들 덕분에 오늘도 열심히!! [추석선물] 연남동 레끌라 피칸파이 맛집 연희동 수제초콜릿 추석패키지 피칸타르트 홍대 합정 서교동 호두파이 임직원선물 거래처선물 생일케이크 답례품 서울디저트
[수제초콜릿] 연남동 레끌라 빼빼로데이 마감 후 수제버터스틱빼빼로 밸런타인데이 화이트데이 홍대초콜릿 연희동초콜릿 마포초콜릿 봉봉쇼콜라 크리스마스선물 피칸파이맛집 호두파이 파운드케이크,"9년 차 매년 어마어마한 숫자의 버터 스틱을 만들고 있는 레끌라입니다. 2020년도 빼빼로데이는 작년에도 부족하여 올해는 스틱을 700개~800개를 더 만들었어도 부족해서 11일 빼빼로데이 당일은 매장 판매를 진행하지 못하고 12일 주문량을 만들어야 했던 상황이었습니다. 진심으로 감사합니다^^ 참고로 피칸(호두) 파이 크리스마스 선물 대량이 벌써 들어오고 있습니다. 이번 빼빼로데이에도 답례품 등 주문을 많이 받지 못하였습니다. 꼭 여유 있게 기간을 가지고 주문 주시기 바랍니다. 레끌라 제품을 꼭 맛보실 기회를 잡으세요^^ 한 가지 맛의 토핑을 한판 가득 채우고 판매 완료되면 또 채우는데 각각 판이 한 5번은 돌아가도 부족한ㅠㅠ 예전에는 택배 발송전과 매장 판매용 전체 포장 샷 사진도 찍고 그랬는데 피칸파이 등 다른 제품들 물량 제작 때문에 진열하고 찍을 시간도 없을 정도로 무진장 바빠서... 스틱만도 판매를 요청하시는 분들이 많고 매년 주문 주시는 업체부터 맛보시고 다시 주문 또다시 주문 주시는 업체 물량으로 많이 만들고 싶어도 몸이 말을 안 듣는 상황까지 와버린 오렌지 스틱은 빼빼로데이에도 많이 찾으시는 제품 오렌지 스틱의 매력은 새콤달콤 깔끔한 향, 맛인데 견과류와 같이 코팅을 하면 깔끔한 향이 견과류의 맛으로 살짝 사라지기 때문에 커버 추어 만 작업해서 판매합니다. 프랑스 마리아주 얼그레이 생초코_평균적으로 여성분들이 좋아하는 맛 시나몬 생초코_평균적으로 남성분들이 좋아하는 맛 한 업체는 며칠에 걸쳐서 픽업 완료하고 포장하는 컷 오리지널 버터 스틱은 두 개씩 포장하는 덕에 만들어도 만들어도 부족한 상황 그나마 유일하게 혼자서도 많이 빨리할 수 있는 작업 위 사진은 택배 나가기 첫날 찍은 포장 컷이 아닌 택배 발송 다하고 빼빼로데이 전날 밤에 찍은 대량 물량 컷 빼빼로데이 당일은 제품이 솔드아웃 택배 물량과 그전 매장 물량 컷은 찍지도 못함 레끌라는 매장도 인터넷도 개인당 구매 수량이 엄청 많아요 흔히 객단가라 하죠 그래서 매장도 물량이 항상 부족한 게 많이 만들어도 고객님 한 분이 다 주세요 하시는 경우도 많아요 저 몸이 부서져라 합니다ㅎㅎ [수제초콜릿] 연남동 레끌라 빼빼로데이 마감 후 수제버터스틱빼빼로 밸런타인데이 화이트데이 홍대초콜릿 연희동초콜릿 마포초콜릿 봉봉쇼콜라 크리스마스선물 피칸파이맛집 호두파이 파운드케이크"
[피칸파이] 답례품 생초코 연남동 레끌라 수제 버터 스틱 빼빼로 홍대 빼빼로데이 버터 스틱 수제 초콜릿 레끌라드쇼콜라 합정동 웨딩 선물 연희동 수제 빼빼로 택배 신촌 이대 빼빼로 맛,"최고급 수제디저트 레끌라 1 2 3 4 5 6 02.01 / 2020년 10월 추석연휴 영업안내 일정.. 12.30 / 20년 1월 레끌라 연남동매장 휴무일정.. 12.05 / [19.11] 빼빼로데이 연남동 매장 영.. 10.22 / 18년 빼빼로데이 너무너무감사합니다.. 10.11 / 베이킹클래스 및 쇼콜라티에마스터과.. 01.31 / [공지] 2018년도 발렌타인데이 택배마.. 01.05 / [모집] 2018년도 쇼콜라티에 마스터과.. 피칸 호두파이 타르트 3EA 선물용으로 좋은 피칸파이 17,700원 수제초콜릿-버터스틱빼빼로15 직접만든 수제버터스틱... www.leclatdechocolat.co.kr 9년 차 빼빼로 달인 우렁각시들과 정기 휴무도 없이 만들기 시작한 버터 스틱 올해는 더욱더 맛있는 레끌라만의 버터 스틱 스틱 한 개씩 재단해서 굽 굽 녹으면 재단이 안되고 굳히면 팔 인대가 늘어나도록 밀어야 하는 맛은 있지만 매우 까다로운 스틱!! 피칸파이는 호한마마 보다 무섭다는 입소문을 많이 내주신 고객님 덕분에 쉬는 날도 없이 작업하고 있습니다!! 참 그리고 피칸의 효능이 견과류의 여왕이라 할 정도로 효능이 정말 많은데 새로운 효능 머리카락과 손톱에도 좋다고 합니다. 그래서 제가 머리카락이 빨리 자라고 손톱이 뒤돌면 깎아야 했던 것일까요? 저 tv 볼 시간도 없어서 못 받는데 지인이 연락이 왔더라고요 그래서 네 머리카락이....미용실 원장님도 볼때마다 놀라시는 포장의 마무리는 리본 리본은 진리입니다!! 시나몬 생초코 기타 재단하기 전 한 컷 레끌라 패키지는 모두 수입하다 보니 대량으로 박스가 쭉~ 빠지면 들어오는데 시간이 좀 걸려요^^ 레끌라 서울특별시 마포구 동교로50길 11 1층 레끌라 [피칸파이] 답례품 생초코 연남동 레끌라 수제 버터 스틱 빼빼로 홍대 빼빼로데이 버터 스틱 수제 초콜릿 레끌라드쇼콜라 합정동 웨딩 선물 연희동 수제 빼빼로 택배 신촌 이대 빼빼로 맛"
[수제초콜렛] 레끌라 연남동빼빼로데이 수제버터스틱빼빼로 연희동 홍대 발렌타인데이 화이트데이 크리스마스 수제초콜릿맛집 수제초콜릿 업체물량 작업 홍 수제초콜릿 서교동 합정동 마포,"더 많은 사진과 말말말😱상세포스팅은 아래 클릭⬇️ 피칸[호두]파이 & 수제초콜렛전문점 레끌라 : 네이버 블로그 레끌라는 수제초콜렛, 피칸(호두)파이,에그타르트 전문매장입니다. 한제품만이라도 정직하게 판매합니다.^^ blog.naver.com 인터넷주문은 아래 클릭⬇️ 최고급 수제디저트 레끌라 1 2 3 4 5 6 12.05 / [19.11] 빼빼로데이 연남동 매장 영.. 10.22 / 18년 빼빼로데이 너무너무감사합니다.. 10.11 / 베이킹클래스 및 쇼콜라티에마스터과.. 01.31 / [공지] 2018년도 발렌타인데이 택배마.. 01.05 / [모집] 2018년도 쇼콜라티에 마스터과.. 11.16 / [휴무안내] 레끌라 연남동 매장 휴무.. 10.26 / [안내] 레끌라 택배사 수제초콜릿-위스키봉봉5구 선물용으로 좋은 위스키봉봉 17,000원 피칸 호두파이 타르트 홀 (생일 케이크) 레끌라만의 감동하는 인기만점 피칸... www.leclatdechocolat.co.kr 🚫제발제발 광고 전화.메일 주지마세요!! 블로그.인스타.유튜브 광고 하지 않아요🚫 [수제초콜릿] 연남동 레끌라 빼빼로데이 수제버터스틱빼빼로 연희동 홍대 발렌타인데이 화이트데이 크리스마스 수제초콜릿맛집 수제초콜렛 업체물량 작업 홍 수제초콜릿 서교동 합정동 마포 #연남동 #수제초콜릿 #레끌라 #홍대 #연희동 #수제초콜렛 #초콜릿맛집 #마포 #서교동 #합정동 #발렌타인데이 #화이트데이 #크리스마스 #선물 #봉봉 #쇼콜라아몬드 #프레즐"
"- [레끌라] 연남동 수제 초콜릿, 피칸파이 밸런타인데이 & 설날 _ 주문, 택배 발송 안내","안녕하세요~^^ 계속되는 주문량으로 수제 초콜릿 밸런타인데이 제품 업데이트가 많이 늦어지고 있습니다. 레끌라는 미리 만들어놓고 판매하지 않기 때문에 임박해서 안내가 되긴 하지만 이번에는 일주일 정도 안내가 더 늦었습니다. 아직도 피칸파이 주문량이 많기도 하고 밸런타인데이와 설날이 겹쳐 있어서 물량 부족으로 아주 짧은 기간만 판매할 예정입니다!! 수제 초콜릿 업데이트 및 판매 (피칸파이 동일적용) 온라인 주문 1월 27일 ~ 2월 4일 택배 발송 1차 2월 4일, 2차 2월 8일, 마지막 2월 9일입니다. 매장 수제 초콜릿 구입 2월 4일부터 ~ 소진시까지 픽업 예약 2월 11,12,13,14 휴무로 픽업 예약 불가입니다. 2월 14일 밸런타인데이도 휴무입니다. 시보 해제 답례품 시보 해제를 하셨던 분들의 소개로 이어지는 레끌라 제품들 피칸파이, 포르투 기식 에그타르트 직원분들 간식을 받으신 분들이 또 간식을 보내시고 이어지는 간식 릴레이~ - [레끌라] 연남동 수제 초콜릿, 피칸파이 밸런타인데이 & 설날 _ 주문, 택배 발송 안내"
[수제초콜렛] 연남동 레끌라 수제초콜릿 프레즐 연희동 프레첼 홍대 다크프레첼 둘쎄프레즐 산딸기프레즐 서교동초코렛,초코프레즐 대량물량등 다크커버추어로만 판매되였는데. 매장 판매용이 산딸기 커버추어 발로나 둘쎄 커버추어 발로나 다크 커버추어 발로나&펠크린 3가지 맛으로 변경되여 다시 쇼케이스 채웠습니다. 소진율이 빠른 프레첼 머랭쿠키도 다양하게 채울예정입니다. 🚫제발제발 광고 전화.메일 주지마세요!! 블로그.인스타.유튜브 광고 하지 않아요🚫 [수제초콜렛] 연남동 레끌라 수제초콜릿 프레즐 연희동 프레첼 홍대 다크프레첼 둘쎄프레즐 산딸기프레즐 서교동초코렛 연남동초콜렛 연희동초콜렛 초콜렛맛집
[피칸파이] 레끌라 연남동 임직원 교직원 선물 웨딩 답례품 수제 초콜릿 피칸파이 맛집 호두파이 맛집 수제 버터 스틱 빼빼로 대량 작업 결혼 거래처 홍대 크리스마스케이크 생일케이크,원형 스티커가 금색인데 사진에서 잘 안 나오는 듯 어느 디저트 선물보다 레끌라 피칸파이를 줬을 때 젤 좋아한다고 말씀하시는 고객님들 레끌라 피칸파이를 드셔보신 교직원분들은 다른 학교로 전근 가셔도 새로운 학교에서도 문의하시는 소문에 소문난 레끌라 피칸파이 선물은 받는 분들은 맛을 떠나서 무조건 고마워하죠 선물 하신분 받으신분 모두 만족하는 디저트!!! 근데 레끌라 피칸파이는 선물 받으신 분들이 직접 문의하시고 재구매해 주시는 고런 아이랍니다.^^ 한번 피칸파이를 주문주시 기업체 학교 등 여유만 있으시면 계속 찾는 레끌라 피칸파이(호두파이) 리본 전체 컷은 박스에 담기 바빠서 찍지 못했다는...../!! [피칸파이] 레끌라 연남동 임직원 교직원 선물 웨딩 답례품 수제 초콜릿 피칸파이 맛집 호두파이 맛집 수제 버터 스틱 빼빼로 대량 작업 결혼 거래처 선물
[피칸파이] 레끌라 연남동 호두파이 연희동 수제 버터 스틱 빼빼로 수제 초콜릿 선물 답례품 홍대 디저트 웨딩 대량 작업 프랑스 누가 수능선물 크리스마스 선물 생일 케이크,"폭풍 같은 추석을 보내고 이제야 포스팅합니다 추석 선물로 피칸파이(호두파이) 홀 사이즈 너무 많이 구매해 주셔서 로고 박스도 부족!! 추석 띠지도 부족!! 로고 박스는 급하게 다시 발주를 했지만 외국에서 오느라 당분간 무지 박스로 판매 됩니다ㅠㅠㅠ 레끌라 피칸파이는 고객님 개인당 구매 수량이 많으세요. 요즘에는 작은 사이즈보다는 홀 사이즈가 무지 많이 판매되고요 정말 감사하죠~^^ 택배 마감 후 픽업 물량 예약이 많아지는 바람에 구매 못하신 고객님들도 많으셨어요.... 10년 전 오픈 초에 명품 브랜드 티파니 초콜릿 만개 작업할 때 처음이라 밤새우고 10년 만에 밤새우고 10일간 3~4시간 자고 초심으로 돌아간 추석이었습니다. 다음 주까지도 추석 물량이 발송되어야 한다는 사실!! 포장해서 보내느라 사진도 못 찍고 마지막 한 분 물량 간신히 한 컷 밑에는 마지막 다마스 물량 한 컷 회사에서 직원분들께 선물도 많이 하시고 할 때마다 반응이 좋아서 기분 좋다는 피드백도 많이 주시고 정말이지 정말 감사드려요 퀵 다마스 물량 포장!! 리본도 똑떨어지고 10년 내내 항상 2배씩 추가해서 만들어도 품절되는 레끌라만의 수제 버터 스틱 빼빼로 일 년 내내 문의하시는 제품 2021년 수제 버터 스틱 빼빼로 사전예약은 10월 21일부터 5일간 홈페이지에서만 받습니다 그 후에는 홈페이지, 스토어, 픽업 사이트에서 오픈합니다. 사전예약은 10년 동안 변함없이 레끌라 제품을 구매해 주시는 고객님들께 감사한 마음을 표현하고자 매년 빼빼로 제품만 하는 이벤트?입니다! 이벤트 등이 없는 레끌라!! 담 주부터는 수제 초콜릿, 프랑스 누가, 위스키 봉봉 등 새로운 패키지를 집중해서 만들 예정입니다^^ [피칸파이] 레끌라 연남동 호두파이 연희동 수제버터스틱빼빼로 수제초콜릿 선물 답례품 홍대 디저트 웨딩 대량작업 프랑스 누가 수능선물 크리스마스선물 생일케이크"
[쿠키] 레끌라 연남동 수제초콜릿 머랭쿠키 프레첼 프레즐머랭 다크프레즐초코 디저트 달달구리 단짠 선물 간식 연희동 피칸파이 수제빼빼로데이 버터스틱,레끌라에는 버터쿠키도 있었고 리얼초코쿠키도 있었죠... 요즘 오시는 고객님들은 머랭쿠키도 파세요? 초코프레즐도 파세요? 마카롱도 파세요? ㅎㅎ 3번 방문만에 구매 하시는 고객님도 계시고 주문량이 점점 감당하기 힘들정도로 많아지니 품목이 점점 줄어들어요ㅠㅠ 많은 제품의 좋은 레시피가 많지만 나중에 기회가 있겠죠!! 틈틈히 짬을 내서 채우는 제품 머랭쿠키 프레즐머랭쿠키 프레즐초코 3종 입니다 만들면 빠지기 바쁜!! 머랭쿠키도 레끌라가 만들면....음!! 포르투기식에그타르트와 머랭쿠키 택배요청이 많은데 더 실하게 해서 조조조만간 운영틀을 바꿔서라도 무엇무엇을 판매하는지 모두 포스팅을 못하니 좀전에 고객님이 사가셔서 쭉 빠지자 급하게 포스팅 합니다. [쿠키] 레끌라 연남동 수제초콜릿 머랭쿠키 프레첼 푸레즐머랭 다크프레즐초코 디저트 달달구리 단짠 선물 간식 연희동 피칸파이 수제빼빼로데이 버터스틱
[쿠키] 수제피넛버터쿠키 레끌라 연남동 연희동 홍대 수제쿠키 테스트중,레끌라에서는 맛있는 쿠키 몇종류를 판매하기위해 테스트 중입니다. 첫번째 피넛버터쿠키 테스트중에는 차 드시러오시는 고객님들께 드려요 테스트가 끝나면 추가 포스팅합니다. 업체 물량등 매장 작업량이 많아 테스트가 늦어져요 🚫제발제발 광고 전화.메일 주지마세요!! 블로그.인스타.유튜브 광고 하지 않아요🚫 [쿠키] 수제피넛버터쿠키 레끌라 연남동 연희동 홍대 수제쿠키 테스트중
[수제초콜렛] 레끌라 연남동 핫초코 아이스초코 쇼콜라통아몬드 타르트반죽 버터반죽 타르트지 피칸파이 호두파이 레끌라 수제초콜릿 맛집 홍대 파운드케이크 발효식초,"먼저 캐나다, 브라질 동기 언니가 배워온 발효식초 레끌라 매장에서 발효후 체에 걸려서 맛보기 몸에 좋다고 해서 마셔보는데....오우 전 커피랑 자몽 발효식초를 만들어 보는걸로!! 더워서 봉봉 작업을 안하는데 예전에 누가 저한테 물어보더라구요 학원에서 여러명이서 배운거랑 공방에서 소수정예로 배운거랑 어떤게 현장에서 더 도움되냐고...............음....!! 팩트만 애기해 드리고 제품을 많이 안다고 해서 잘되는것도 아니고 많이 모른다고 해서 안되는것도 아니라 사업성하고 제품 잘만드는 건 틀리다고 정확히 동기언니가 캐나다나 브라질에서 무엇을 어떻게 할것인지에 따라 가져갈 제품이 다르고 또한 수제초콜렛이 메인인지 아니면 다른 디저트가 메인인지에 따라 집중해야하는 품목이.. 매장규모에 따라 다루어야 할 제품도 다르고 예)A라는 품목에 시간과 에너지를 투자하면 B라는 품목을 언제든 빨리 습득할수가 있지만 A와 B가 바뀐다면 A라는 품목을 잘할수가 없다는 걸 알려주면서 많이 이야기를 나누는 시간 발료식초 마시면서.... 아몬드가루가 듬뿍 파이 반죽 대량 손반죽치기 딱딱한 버터를 큰 스텐볼로 한두번만 치고 나면 팔이 안올라가는 현상 기계를 사야하지만 예전에 무조건 기계부터 샀는데... 지름신을 꾹꾹 누르는중 예전에 배운 쇼콜라통아몬드를 소량할때와 대량할때 작업방법을 제대로 다시 잡아주고 레끌라의 소포장이 맘에 든다고 포장지까지 주문하고 레끌라 상호도 쓰면 안되냐고 해서 ㅋㅋㅋ 뭐.... 그리고 사진은 없지만 100% 커버추어와 우유로만 만든 핫초코 아이스초코 만들어서 매장에서 판매하기 좋게 픽해서 주문들어오면 빨리 나갈수 있는 방법 알려주고 나니 시간가는줄 몰라 레끌라 마감시간이 훌쩍 지나버려서 헉. 마감하고 픽업하러 가야하는 분이 있는데. ㅋㅋㅋ 어쩌다 보니 내년이면 10년차 이렇게 오래할줄 몰랐고 일에 치여 시간가는줄 모르고 오다보니.... 해볼꺼 다해봐서.... 많은 질문을 받다보니 나는 왜 이일을 시작했는지 부터 생각하는 시간!! 보면 보이는데 생각하고 보는 방식이 다 다르니 매장이 많이 오픈하고 많이 문을 닫겠죠!! [연남동] 수제초콜렛 핫초코 아이스초코 쇼콜라통아몬드 타르트반죽 버터반죽 타르트지 피칸파이 호두파이 레끌라 수제초콜릿 맛집 홍대 파운드케이크 발효식초"
