title,content
[수제초콜릿] 레끌라 수제버터스틱빼빼로 연남동 수제초콜렛 11월 연남동매장 영업안내 대량작업 연희동 홍대빼빼로 빼빼로맛집 피칸파이 호두파이 생초코 얼그레이 위스키봉봉 술초콜릿,"*빼빼로 택배 마감_ 11월 08일 24시 일요일 주문&결제 완료 건 마지막 택배 발송 9일 월요일 *매장은 11월 3일부터 구매가능 사전예약 등으로 주문량이 많아 기존 수량 품절 시 추가 수량 업데이트는 없습니다.[최대한 수량 많이 업데이트하였습니다] 택배는 홈페이지, 스마트 스토어에서 구입 매장 픽업은 네이버 예약사이트에서 구입하시면 되세요. 봉봉 패키지는 빼빼로데이가 끝나면 업데이트합니다!! 인스타등 sns에는 주문량으로 별도의 수제 버터 스틱 빼빼로 관련 포스팅이 없습니다 블로그 or 홈페이지에서 확인 부탁드려요 항상 주문 주시는 고객님께 감사드려요^^ 직원이 몇백명일때도 빼빼로데이를 챙겨주는 센스 대표님들 업체 대량은 미리 주시면 요로코롬 해드려요 토핑 작년과 동일하게 어렵게 수입제품은 수입하고 어렵게 구입했습니다!! 오리지널 수제버터스틱도 많이 구매 해주시는데 레끌라 빼빼로는 토핑도 굉장히 맛이 좋아요^^ 최고급 수제디저트 레끌라 1 2 3 4 5 6 02.01 / 2020년 11월 수제버터스틱빼빼로 마감.. 12.30 / 20년 1월 레끌라 연남동매장 휴무일정.. 12.05 / [19.11] 빼빼로데이 연남동 매장 영.. 10.22 / 18년 빼빼로데이 너무너무감사합니다.. 10.11 / 베이킹클래스 및 쇼콜라티에마스터과.. 01.31 / [공지] 2018년도 발렌타인데이 택배마.. 01.05 / [모집] 2018년도 쇼콜라티에 마스터과.. 피칸 호두파이 타르트 3EA 선물용으로 좋은 피칸파이 17,700원 수제초콜릿-버터스틱빼빼로15 직접만든 수제버터스틱... www.leclatdechocolat.co.kr [수제초콜릿] 레끌라 수제버터스틱빼빼로 연남동 수제초콜렛 11월 연남동매장 영업안내 대량작업 연희동 홍대빼빼로 빼빼로맛집 피칸파이 호두파이 생초코 얼그레이 위스키봉봉 술초콜릿"
[2019 발렌타인데이] 보내며 감사합니다!!!! 레끌라 홍대 발렌타인데이 연남동 연희동 청와대 서울 초콜릿 피칸파이 합정동 망원동 디저트 발렌타인데이 화이트데이 쁘띠꼬뺑 레끌라,레끌라 2019년 발렌타인데이를 너무 감사하게 잘보냈습니다 위스키봉봉은 품절을 방지하기 위해 계속 만들어서 최대한 많은 분들이 구매하실 수 있도록 실시간으로 만들어서 택배보내고 판매하였습니다 유난히 많이 나갔던 올해 위스키봉봉 그리고 생초코도 너무 많이 만들어서 판매하였습니다 그냥 기본 다크 오리지널 생초코 pave 입니다 가로세로3cm 사이즈가 큰편입니다 박스 포장해서 판매됩니다~^^ 그리고 레끌라 수제초콜렛 봉봉 10구가 청와대에 입성하였습니다 청와대 영빈관으로 간 레끌라 수제초콜렛 이것저것 체크하시고 <초콜릿 맛과 포장등> 퀵으로 어디까지 줄어갈수 있는지 체크해서 발송하였습니다~^^ 행사가 끝날 시점에 초콜릿맛.포장등 모두 완벽하고 좋았다고 피드백도 담당자분께서 주시고 함이 납니다~^^ 이제 초콜렛으로는 명품브랜드도 원없이 해보고 대량작업도 원없이 해보고 판매도 온라인 매장 원없이 판매해보고 수업도 많이 해보고 참 운이 좋은 사람인거 같습니다 많이많이 감사합니다!! [공지] [2019 발렌타인데이] 보내며 감사합니다!!!! 레끌라 홍대 발렌타인데이 연남동 연희동 서울 초콜릿 피칸파이 합정동 망원동 디저트 발렌타인데이 화이트데이 쁘띠꼬뺑 레끌라드쇼콜라 쇼콜라티에수업 마스터과정 초콜릿강좌
[쇼콜라티에] 마스터과정 수업 초콜릿수업 레끌라 홍대 연남동 연희동 수제초콜렛맛집 홍대맛집 연희동맛집 연남동맛집 누가 프랑스엿 발렌타인17년산가나슈,독학으로 터득한 누가 제대로 만드는법 수업에 제대로 알려주기 [쇼콜라티에] 마스터과정 수업 초콜릿수업 레끌라 홍대 연남동 연희동 수제초콜렛맛집 홍대맛집 연희동맛집 연남동맛집 발렌타인데이선물
[알림] 레끌라 22년도 6월~8월 임시(여름휴가) 휴무 안내드려요^^ 연남동 피칸파이 수제 초콜릿 거래처 선물 생초코 답례품 생일 케이크 모임 선물 웨딩 임직원 디저트 연희동 홍대,"매년 9월부터 다음 해 5월까지 단 하루도 편안히 쉼 한 적이 없어 올해부터는 부지런히 일정을 잡았습니다. 필요하신 고객님들께서는 미리 주문 주시고 뜨거운 여름엔 택배 수령 후 택배 상자만 개봉 후 보냉 봉투 그대로 냉동 보관 후 섭취하세요! 아이스박스, 보냉제 등을 잘 못 사용할 경우 제품과 패키지 등을 더 좋지 않게 만들 수 있습니다. (물기가 있거나 생물이 아니므로) 몇 년에 테스트 후 제품에 맞는 택배 발송 포장 법으로 일 년 내내 발송하오니 착오 없으시기 바랍니다. 6월 20일~ 22일 임시 휴무(월, 화, 수) 7월 12일~ 15일 임시 휴무(화, 수, 목, 금) 7월 28일~ 8월 3일까지 여름휴가(여름휴가란 명칭으로 11년 만에 처음 가요) 일정 변동 있을 시 수정하겠습니다!! 항상 감사합니다. 홈페이지 및 스토어 등은 휴무일 1주 전부터 공지드려요!! 더운 날씨에도 찾으시는 생초코 (프랑스 게랑 소금과 천일염이 들어간 생 초코입니다) 요즘에 거리 두기가 해제되면서 모임을 많이 하셔서 그런지 모임에 빠질 수 없는 레끌라 피칸파이와 수제 초콜릿!!! 임직원 간식으로 꾸준히 나가고 있습니다. 제가 쁘띠꼬뺑 운영 시 물방을 모양 타르트틀도 직접 제작해서 사용하다가 요즘에는 사용하지 않고 보관 중이지만(기회만 봄) 물방을 타르트 틀 레끌라만의 피칸 파이틀을 제작해 버렸는데 여러 가지 이유로 ㅠㅠ 재질이 좋고 수량이 많다 보니 업소용 오븐 풀세트 가격이 나왔지 말입니다.ㅠㅠㅠ 그리고 기존 기성 틀보다 사이즈가 조금씩 커요(레끌라만의 타르트틀, 파이틀) 어떤 식으로 사용을 시작할지는 아직 정하지 못해서 오븐 테스트도 추가로 해야 하고 등등 또 몇 개의 일을 치긴 했는데.... 쩝!! 레끌라에 투자하는 거니깐 위로 삼아요. 앗! 그리고 블로그 포스팅이 없어도 매일매일 열심히 점점 늘어나는 주문에 열심히 작업 중이랍니다!! [알림] 레끌라 6월~8월 임시 휴무 안내드려요^^ 연남동 피칸파이 에그타르트 수제 초콜릿 거래처 선물 생초코 답례품 생일 케이크 모임 선물 웨딩 임직원 호두파이 디저트 연희동 홍대 베이킹틀 제작 파이 틀 제과도구"
[수제초콜릿] 연남동 빼빼로데이 레끌라 수제버터스틱빼빼로 연희동 홍대 발렌타인데이 화이트데이 크리스마스 수제초콜릿맛집 수제초콜렛 업체물량 작업 홍 수제초콜릿 서교동 합정동 마포,"레끌라는 8년전 처음 오픈때부터 빼빼로데이에 물량이 없어서 매년 많이 만들어도 부족하고 부족하고 했던 제품입니다. 3년전까지만 해도 스틱을 수입해서 사용했는데 수입업체에서 수입이 안되면 통관쪽까지 지인 동원하여 전화를 돌리고 돌려 11톤 트럭으로 수십박스를 받아야만 가져다 줄수 있다는 버터스틱을 그리 받아 사용하다가 작년 18년 빼빼로데이부터 버터스틱을 직접 굽기 시작해서 19년 빼빼로데이에는 여러나라 버터를 테스트 해서 더맛있는 버터스틱으로^^ 시즌이라고 구색갖추어서 그냥그냥 판매하지 않아요.ㅠㅠ 스틱을 굽다보면 하나하나 다 직접 자르기 때문에 손가락 마디마디가 빼빼로데이 끝나고나면 (버터반죽이라 온도에 예민하기도 하고) 움직일수 없을 정도로 고통을 수반하지만 레끌라만의 빼빼로? 제품을 드시길 원하는 맘에^^ 선물 받으신 분들의 피드백이 많았던 작업이였습니다. 매년 점점 많은 고객님들이 알아봐주셔서 감사합니다 작업하다 부러진 스틱까지 맛보기로 해놓았는데 모두 다 드셔버리고 한조각도 안남긴 빼빼로데이였습니다. 픽업오신 친구분 따라 오셨다 맛보시고 구입해가시거나 나가셨다 다시 오셔서 구입을 많이 하셔서 11일이 지나고도 남지 않았냐고 해주신 레끌라의 제품입니다. 계속 만들었음에도 불구하고 11일 오후에는 그냥 가셔야 하는 상황 이번 빼빼로데이는 업체 물량이 많이 들어왔어요 (포스팅이 업체물량) 작업실만할때는 온라인마감하면 더이상 제품을 만들지 않아 매장운영하는 쇼콜라티에 지인쪽으로 토스를 했는데 제가 매장을 하다보니 계속 만들어야해서 💪🏻💪🏻💪🏻 의사쌤들께 돌리는 선물부터 임직원 선물 업체 행사 물량까지 홈페이지 예약만 작년 두배 예약 시작하는 첫날이 진짜 어찌아시는지 많이 들어오세요^^ 새로 시작된 매장픽업예약에 매장으로 구입하러 오시는 고객님들 어찌 매장을 잘 찾아오시는지 항상 신기할정도 감사한 맘입니다. 작년에 구입하셨던 분들의 재구매율도 많아지고 큰사이즈 구매율이 너무 많아짐! 이번에는 크리스마스때까지 사용할 초콜릿 패키지를 완전 소진하여 다른색상도 발주한상태 내년에는 더욱 고급진 패키지로 뵐께요 레끌라의 수제버터스틱빼빼로는 2020년 10월에 또 뵈요 이번에 패키지가 이뻐서 풀기 아깝다는 피드백을 많이 받았어요.. 전 패키지보다 맛있다는 피드백이 더 좋아욤^^ 풀어서 맛있게 드셨으면 하는 바램입니다. 레끌라 사용하는 박스는 거의 수입패키지에 이번에 새벽에 가서 데려온 리본도 모든 수입자수 입니다. 언젠가는 원가 계산하는 날이 올거예요🤫 홈페이지의 봉봉은 패키지 소진으로 업데이트가 늦어질 예정입니다. 임시 패키지로 업데이트 한후 발주한 패키지가 오면 수정하겠습니다. 일년넘게 계속된 작업과 빼빼로데이, 업체물량으로 아직 골골 걸리고 있어 담주에 업체물량을 위해서라도 빠른 회복후 업뎃합니다!! 🚫제발제발 광고 전화.메일 주지마세요!! 블로그.인스타.유튜브 광고 하지 않아요🚫 [수제초콜릿] 연남동 빼빼로데이 레끌라 수제버터스틱빼빼로 연희동 홍대 수제초콜릿맛집 수제초콜렛 업체물량 작업 홍대 버터스틱 수제초콜릿 레끌라드쇼콜라 빼빼로주문 수제버터스틱빼빼로 레끌라 맛있는빼빼로 연희동 수제빼빼로택배 신촌 이대 빼빼로맛집 예약이벤트 대량 서교동 합정동 마포"
[NEW] 레끌라 신상 생초코 프레즐 판 초콜릿 태블릿 천일염 오리지널 초콜릿 카카오 100 커버 추어 생일선물 거래처 선물 펠크린 발로나 홍대 디저트수제 단짠단짠 연남동 연희동,"기존에 발로나사의 제품 중 프랑스 게랑드 소금이 들어가 은은하게 고급 진 단짠 커버 추어에 레끌라만의 레시피로 수정 작업해서 새로 나온 생 초코입니다. 우유맛이 좀 더 고급 지게 나는 생초코 예약 픽업 사이트 및 매장에서 구입 가능하세요 홈페이지는 찬 바람이 불면~~ 오리지널 다크 커버 추어 생초코와 셋뚜셋뚜 버전!! 보시다시피 레끌라의 생초코는 두께가 한입에 넣으면 가득 차는!! 제 기준은 한 개 다 못 먹고 반쪽씩 그리고 이번에 새로이 판매되는 오리지널 생 초코입니다 카카오 100% 다크 커버 추어 생초코는 설탕류가 씹히면 유화가 잘되지 않아 서랍니다 차갑게 먹을 때 쫀득함이 부족하면 너무 고온에 유화를 한다던가 하면 분리가 되고 레시피가 비율이 맞지 않을 경우에도 가능 생크림과 커버 추어가 섞일 때 상태가 캐러멜처럼 윤기가 좔좔 흐르는 상태가 생초코 최상의 상태입니다 따뜻한 날씨에도 금방 굳고 자연에서 굳혀야 해요 냉동. 냉장으로 강제로 굳히지 않아요 기타 재단할 때 카카오 가루 묻히지 않고 재단!!! 이전하기 전에 은근히 손이 자꾸 가는 다크 커버 추어 프레즐 케이스 변경되어 재 출시합니다 찬 바람이 부는 가을부터는 따뜻한 바람이 부는 봄까지는 레끌라 주인장이 무지무지 바빠지는 나날로 많은 제품을 진행하지 못해서 항상 아쉬움이 가득가득 어찌어찌 시간을 짜내서라도 안정적으로 꾸준히 판매할 수 있는 추가 제품들을 진행하도록 하겠습니다. 판 초콜릿도 추가로 한 개씩 나오고 있어요 추가되는 대로 포스팅하겠습니다!! 초코 크런치 카카오 100% 다크 커버 추어와 볶은 현미 비상용 식품으로 좋은 초코 크런치 그리고 에그타르트를 요즘 유독 찾으셔서 기존 예약제에서 제품 수정후 상시 판매제로 해야 하나 고민 중!! 테스트 중| 정식으로 판매하려고 작업 시작하면 대량 물량이 들어오고 해서 클래스 및 잠깐 판매했던 프랑스 화이트 누가 일명 프랑스 엿 테스트 중입니다. 포장 및 견과류 종류 선별, 공정 작업(레시피 수정) 등 아무리 맛있어도 공정이 복잡하면 상품화하기 힘들고 균일하게 제품이 나오지 않기 때문에 여러 방법으로 테스트 후 판매합니다. 레끌라는 제품이 나오면 대량으로 이루어져서 대량 작업 중점으로 테스트하기 때문에 좀 시간이 많이 걸려요!! 테스트한 제품들은 가끔 시식용으로 단골분들께 드려요^^ 아마도 패키지는 카카오 100% 커버 추어 랑 셋뚜셋뚜 구성이 될 예정입니다!! [NEW] 레끌라 신상 생초코 프레즐 판 초콜릿 태블릿 천일염 오리지널 초콜릿 카카오 100 커버 추어 생일선물 거래처 선물 펠크린 발로나 홍대 디저트수제 단짠단짠 연남동 연희동 웨딩"
[빼빼로데이] 사전예약안내 연남동 수제 버터 스틱 빼빼로 맛집 레끌라 홍대 수제 초콜릿 연희동 피칸파이 맛집 호두파이 맛집 에그타르트 수제 초콜릿 맛집,추가 11월 5일 금요일 매장 픽업 예약창 오픈됩니다. 레끌라 : 네이버 방문자리뷰 85 · ★4.92 · 생방송투데이 2016회 naver.me 토핑 종류 및 패키지 안내는 10월 21일 13:00시 ~ 5일간 사전예약 시 홈페이지에 오픈됩니다!!! http://leclatdechocolat.co.kr 레끌라 leclatdechocolat.co.kr 다시 안내드려요. 10월 초만 되면 많은 문의하시는 사전예약 시작 안내 최고급 버터로 직접 만드는 레끌라 리얼 수제 버터 스틱 매년 항상 많은 양을 구워도 항상 많이 부족 토핑 싫어 허시는 분들도 맛있다고 대량으로 구매하시는 제품 100% 카카오버터 커버추어로 만든 오리지널 수제 버터 스틱 토핑 종류 및 패키지 안내는 10월 21일~ 5일간 사전예약 시 홈페이지에 오픈됩니다!!! 이번에 추가되는 박스 로고 작업 발주 넣어서 로고 없는 샘플 박스 사진입니다. 주문 택배 발송 시에는 이쁜 로고 새긴 박스로 배송 됩니다!! [빼빼로데이] 사전예약안내 연남동 수제 버터 스틱 빼빼로 맛집 레끌라 홍대 수제 초콜릿 연희동 피칸파이 맛집 호두파이 맛집 에그타르트 수제 초콜릿 맛집 빼빼로 뉴 패키지 리본은 좀더 큰아이로 변경예정 새로운 판초콜릿 태블릿초콜릿 선물포장
[쇼콜라티에]마스터과정 수업 초콜렛강좌 레끌라 홍대 발렌타인데이 연남동 연희동 서울 초콜릿 피칸파이 합정동 망원동 디저트 화이트데이,쇼콜라티에 수업은 매주 진행을 하였는데 사진및 포스팅 시간이 부족해서 늦은 포스팅 합니다 기타 없이도 칼로 같이이 재단하는 습관!! 처음 시작하시는 분들은 굳이 비싼 도구 없이도 제품을 만들어 내야하기 때문에 소도구로 만들어 낼 수 있는 수업 위주로 하려고 노력중입니다 수업 시간이 걸리더라도 처음 시작할때를 생각해서👍🏻 디핑을 잘하면 너무 이쁘고 하면 할수록 재미있는 작업 학생의 센스 의자가 참 탐나요. 학생하고 식사하러 갔다가 [쇼콜라티에]마스터과정 수업 초콜렛강좌 레끌라 홍대 발렌타인데이 연남동 연희동 서울 초콜릿 피칸파이 합정동 망원동 디저트 화이트데이
[답례품] 피칸파이 레끌라 피칸타르트 웨딩답례품 기업체 임직원선물 이벤트 홍대피칸파이 연남동피칸파이 연희동피칸파이 피칸파이맛집,레끌라는 웨딩답례품 작업중입니다 답례품 작업중 또 답례품 주문이 들어와 더운날씨에 하루종일 오븐굽굽 먼저 주문 들어온 피칸타르트는 오늘 픽업완료하고 동시에 진행되였던 월요일 픽업 답례품 작업중 레끌라에서 판매 제작되는 제품은 어디에도 없는 레시피 입니다 배운 그대로 가져온 그대로 만들어 판매되는 레서피는 한개도 없습니다 몇년에 걸쳐 수정에수정 작업 모양은 비슷할지 몰라도 맛은 같을수 없습니다 음식 솜씨 있는 사람이 제과도 잘합니다 많이 배운다고 해서 많은 레시피를 가지고 있다고 해서 잘하는게 아니고 맛있는게 아니듯이 같은 제품이라도 미묘하게 자기것을 만드는게 중요한게 음식입니다 레끌라 피칸파이는 외국 고객님들의 소개도 많아욤!! 피칸파이의 필링 레시피 수업 요청도 많지만 아마도 제가 그리는 그림이 있어 수업은 하지 않는 피칸파이입니다!! 레끌라 피칸타르트는 레끌라에서만 구입 가능하세욤!!! 저는 다시 피칸파이 굽굽하러 총총 인터넷 사진후기 감사합니다 더운날씨에도 가감히 택배배송 피칸파이홀 2판 주문 주셔서 더욱 감사하구용 재주문주시면 서비스 팍팍 같이 보내드려욤!!! 레끌라 피칸파이는 한여름에도 택배배송가능합니다 받으신 다음 제품 설명대로 보관해 드시면 오래동안 드실 수 있습니다!!! [답례품] 피칸파이 레끌라 피칸타르트 웨딩답례품 기업체 임직원선물 이벤트 홍대피칸파이 연남동피칸파이 연희동피칸파이 피칸파이맛집
[쇼콜라티에] 마스터과정 수제초콜릿 홍대 발렌타인데이 화이트데이 레끌라 연남동 홍대,수업도 하고 초콜렛 작업도 많이 했는데 포스팅을 이제서야 합니다 항상 수업후 식사 가나슈는 수분을 빼주는게 중요하욤
[안내] 9월 추석연휴 휴무안내___피칸파이 호두파이 레끌라 추석선물 생일케이크 피칸파이맛집 호두파이맛집 피칸타르트 홍대 연남동 연희동 합정동 서교동,"태풍으로 인하여 9월6일부터 태풍이 끝날때까지 전국택배발송을 하지 못하여 홈페이지 전제품 임시 품절입니다. 매장방문및 예약픽업만 가능하세요 추가**태풍이 끝났어도 답례품과 매장방문판매 & 업체 물량건으로 9월11일부터 온라인 판매 정상적으로 운영됩니다. 주문건은 추석이 지나고 순차적으로 배송됩니다. 감사합니다~^^ 9월 휴무 안내입니다. 연휴 전 수요일은 정기 휴무여서 추석당일 9월 11,12,13일까지 휴무하고 14일 토요일부터 정상영업합니다. 추석 선물로 피칸파이 구매 하실 고객님들은 참고 부탁드립니다. 택배는 9월9일 월요일 마감 입니다. 픽업 예약방법등은 아래 https://blog.naver.com/rose35wh/221561882652 [안내] 레끌라 홍대 연남동 영업일정및 피칸파이 픽업예약&택배주문방법 - 피칸파이맛집 홍대 연남동 연희동 서교동 합정동 호두파이맛집 파운드케이크맛집 생일케이크 답례품 에그타르트 홍대 연남동 레끌라 수제초콜렛 피칸파이 호두파이 맛집레끌라 입니다.포르투칼 에그타르트는 9... blog.naver.com [안내] 9월 추석연휴 휴무안내___피칸파이 호두파이 레끌라 추석선물 생일케이크 피칸파이맛집 호두파이맛집 피칸타르트 홍대 연남동 연희동 합정동 서교동"
[구움과자]파운드케이크 마들렌 레몬마들렌 홍대 레끌라 프랑스 마리아쥬 얼그레이 홍차 발로나초코파운드 연남동 연희동 피칸파이맛집 수제초콜렛 수업 베이킹수업,역시 프랑스 제과 동기 캐나다 언니 레끌라 매장 제품 맛보고 이것저것 점점 알려달라는게 많아져서 맛을 보여주지 말아야해 ㅋㅋㅋ 얼그레이를 엄청 좋아한다고 해서... 얼그레이는 저도 레시피 얻어 걸린거라 이렇게 저렇게 해보다 보니 맛좋은 제품이 나와서 소장용인데 언니닌깐^^ 발로나 초코파운드 일부러 저리 발로나 70% 콕콕 위에 데코는 포장 보관 판매 좋게 하는걸로 알려줌!! 과한 초콜릿데코 맛하고 상관없는 어지러운 데코는 안하는게 좋다고 개인 취향이지만 갠적으로 ☝️ 얼그레이 파운드 케이크 홍차 프랑스 마리아쥬 제품중 전 2가지 향만 사용해요 이제품하고 또 다른 제품 위에 발로나 커버추어로 데코하고 발로나 카카오가루 솔솔 안에 커버추어가 씹혀요~ 마들렌 레끌라에서는 마들렌을 팔지 않아 틀이 인테리어로 진열되여 있는데 틀을 보고 해보고 싶다해서 마들렌은 요즘 집에서도 실력좋으신 분들이 아주 잘하셔서 레몬마들렌 기본만 알면 다 응용가능한제품 딱 마침 업체에서 샘플을 가지고 오셔서 요즘에는 글라사쥬 아이싱 기성품이 다양하게 많이 나와서 직접 만든 레몬 아이싱과 판매하는 레몬 아이싱 비교 담에는 슈 에클레어 파리브레스트등도 해보고 싶다하는데 갠적으로 슈반죽을 안좋아해서 판매를 안하지만 이상하게 슈반죽에 들어가는 과한 원재료때문에 먹지 못해서...ㅠㅠ 안에 필링은 맛있어서 먹고 싶을때도 있으면 타르트에 응용해요 해보는건 언제든 상관없어욤~^^ 맛 향 광택 등등 수업아닌 수업이 되여버린 시간!! [구움과자]파운드케이크 마들렌 레몬마들렌 홍대 레끌라 프랑스 마리아쥬 얼그레이 홍차 발로나초코파운드 연남동 연희동 피칸파이맛집 수제초콜렛 수업 베이킹수업 디저트수업 제과제빵
[수제초콜렛] 기업체수제초콜렛 이니셜수제초콜릿 홍대수제초콜릿 대량 업체 답례 선물 연남동 연희동 레끌라 피칸파이맛집,"중요한 임원분들 행사라고 엄청 고생하신 담당자분 화이트데이 지나고 피칸파이만 굽다가 수제초콜렛 불태웠습니다!! 답례품및 매장 제품은 파이&수제초콜렛 레끌라 : 네이버 블로그 레끌라는 수제초콜렛, 피칸(호두)파이,에그타르트 전문매장입니다. 한제품만이라도 정직하게 판매합니다.^^ m.blog.naver.com"
