title,content
"멜티스트 : 케이크를 예술로 승화시킨 공간, 연남동 원데이 클래스","Melttist [연남동] 나만의 힙한 ""아트 케이크"" 로 파티 준비 안녕하세요, 멜티스트 입니다.멜티스트만의 힙한! 케이크 클래스가 오픈되었어요 :)너무 큰 케이크는 부담스럽고, 작은 케이크는 마음껏 꾸미기 어렵죠.BUT ! 멜티스트에서는 [미니(도시락) / 중간 / 1호] 총 세 가지가 준비되어 있고,모든 케이크의 ‘윗면, 옆면, 케이크 하판’에 데코레이션과 레터링이 가능하답니다.완성된 케이크는 시판용 박스가 아닌 멜티스트만의 특별하고 힙한 케이크 상자에 담아드려요. SNS 감성샷 보장!※소개된 케이크는 ""멜티스트"" 만의 고유 디자인 입니다. 카피 금지※<<<< 클래스 상세설명 >>>># 크림을 ... www.sssd.co.kr 언젠가 효빵이와 스콘 얘기를 하다가 우리 둘다 베이킹 클래스에 관심 있는걸 알게됐다. 추진력 좋은 우리 둘은 곧바로 돌아오는 주말에 케이크 원데이 클래스 가보자고 ~.~ 의 상태가 됐고 원데이 클래스 어플 '솜씨당'에서 멜티스트를 예약한 후 지난 19일 토요일에 다녀왔다. www.instagram.com www.instagram.com 클래스 예약 및 정보 문의는 위의 솜씨당 or 인스타그램 DM or 카카오톡 채널 '멜티스트'를 통해 가능하니 참고하시길 바랍니다 !! 50m © NAVER Corp. 멜티스트 서울특별시 마포구 성미산로17길 109 지도로 찾아가면 '르규옹'이라는 와인바가 1층에 있는데, 그 건물의 오른쪽에 있는 계단을 따라 올라가면 공방이 나온다. 처음에 난 타투샵인줄 알고 단단히 잘못 왔구나 싶었는데 멜티스트였다. 힙한 외관에 주춤.. 하게 되던 분위기 연남동 미술 공방인 '칠앤아트' 작가님들의 작품이라고 하셨다. 예전에 오픈 전시회도 하셨다는데 너무너무 재밌었을 것 같고 ••• 작가님들의 의도도 궁금하고 ••• 신발을 벗고 들어가면 보이는 테이블에 짐을 두고 수업이 진행될 안쪽 룸으로 들어갔다. 트렌디한 체커 보드 무늬의 러그와 강사님의 스타일이 고스란이 담긴 알록달록 오브제들로 키치함 그 자체였던 공방 선반에 놓인 케이크 모형물들도 하나같이 귀엽고 힙해서 구경할 맛 쏠쏠했다.👀👀 재료 및 도구와 수업에 대한 간략한 설명을 들은 후, 샌딩 작업으로 수업의 첫 걸음을 내딛었다. 내가 예약한 옵션은 도시락 케이크 사이즈 원형 & 오레오 크림 !! 빵 사이 사이에 오레오 크림을 도톰하게 바르고 그 위의 빵에 설탕 시럽을 뿌려준 뒤 겉면에 1차 생크림을 옅게 발라준다. 빵이 비치게끔 얇게 샥샥샥 Next image 다음은 각자 원하는 겉면, 데코레이션 색상의 크림을 만드는 조색 작업에 들어갔다. 챱챱 쉐킷하는 중 클레이 가지고 노는 기분이었다. 색소와 생크림을 섞어준 후 겉면에 깔끔하게 바르면 된다. 하트 모양으로 했으면 더 귀여웠겠다! 싶었는데 그랬다면 케이크 속 내 손길 지분율은 더 떨어졌을 듯 싶다. 원형이 훨씬 바르기 쉽습니당... 다 바르고 나니 나는 연한 분홍, 효빵이는 연한 하늘 색이라 되게 솜사탕같던 우리 테이블 ෆ 위에 만들어놓은 보랏빛 데코 크림으로 가장자리에 장식용 크림을 만들어줬다. 짤 주머니를 처음 잡아본 날이라 스페츌러 위에 여러번 연습하고 만들었다. 선생님이 굉장히 꼼꼼하게 봐주셨고 자존감 지킴이처럼 칭찬을 아낌없이 부어주셔서 초보자임에도 나름 또잉또잉하게 잘 만들어진 것 같다 !! 집중의 결과물 블로그에 쓰고 싶다고 말씀드리니 열심히 사진 찍어주신 선생님 감사해용 <3 이제 만들어 둔 크림으로 텅빈 케이크를 장식할 꽃 만들기 단계 !! 이번에도 스페츌러에 연습하는 시간을 가진 후 본격적으로 데코레이션 단계에 착수했다. 저는 체리도 다섯 알 추가했답니당 꽃을 여러 송이 피우고 체리 다섯 알을 크림 위에 올려준 뒤 옆면에 레터링을 슥삭 써주면 끝 !! 참 쉽죵 ? 👏🏻🌝👏🏻 확연히 다른 온도차의 케이크 두 개 참고로 레터링은 고민하다가 그냥 내 인스타그램 아이디를 썼다. 공방 내부에 감각적인 아이템들이 많아서 그런지 아무데나 놓고 찍어도 예쁘게 나오더라 내 케이크가 예쁜 것도 있긴 하다. 인스타그램에 태그와 함께 올리면 서비스로 초도 주신다 !! 곧바로 스토리에 올리고 케이크 색과 비슷한 미니 초 하나를 얻었다 😚💗 Next image call it hip, call it kitsch 완성된 케이크는 녹아내리는 듯한 디자인의 박스에 담아 주신다. 공방의 이름인 멜티스트를 다시 한번 상기시키던 유니크한 디자인 나오는 길에 시간을 보니 딱 2시간 걸렸더라 짧고도 긴 알찬 시간이었던 케이크 원데이 클래스 ෆ 제 케이크 예쁘죠 !!!!!!!! 🥺❤ 집에 돌아오자마자 사진 백 장은 찍은 것 같다. 생크림 특성상 시간이 지나면 번짐 현상이 일어날 수 있다고 하셨지만 6시간 뒤 확인해본 결과 가운데 노랑색 꽃만 아주 조금 번져있었다. 근데 알고 봐야 보일 정도라 저랑 비슷한 채도의 색소를 이용하실 분들은 걱정하지 않으셔도 될 듯 합니당 레터링 중 일부인 breezy 🍒❤ 옵션으로 추가한 체리 덕분에 케이크에 전반적으로 향이 물들어 더 만족스러웠다. 적당히 촉촉한 시트와 달콤한 오레오 크림치즈 샌딩 그리고 느끼하지 않은 생크림과 체리는 완전 최고의 조합이기 때문에 ... 10cm의 쪼그만한 케이크는 순식간에 부스러기로 남았다. 가족들과 나눠먹은 결과 하나같이 맛있다고 해서 더 뿌듯했던 케이크 원데이 클래스 ෆ 꿈빛 파티시엘 / 제빵왕 김탁구의 꿈을 꾸시는 분들께 이번 주말에는 멜티스트에서 케이크를 만들며 여유로운 시간을 보내보시길 추천드린다 !! ’ᴗ’"
[일상글] 연남동 멜티스트🍰 케이크 원데이 클래스 후기,"그동안 정말정말 하고 싶었던 🎂케이크 원데이 클래스를🎂 하고옴 ENTP 동생의 우리 뫄뫄 하러 갈래?~ 와 ENFP 앵뿌의 그랭~! 이 만나 일사천리로 예약된 원데이 클래스 ㅋㅋㅋㅋㅋㅋ ✌🏻✌🏻 멜티스트 케이크 공방 길을 헤매는 바람에 좀 늦게 도착해서 헐레벌떡 시작함 ㅠㅠ ㅋㅋㅋ 우리 말고도 2인 한 팀이 더 있었고 올라오는 계단 사진이랑 내부 사진을 못찍었는데 암튼 인테리어가 다 너무 예뻤음💖 동생은 기본 바닐라시트로하고 나는 초코시트로 예약했었음 빵은 저렇게 기본으로 준비를 해주심 우리가 할일은 멋들어지게 케이크를 꾸.미.는.것. 😎케꾸할 생각에 벌써 드릉드릉😎 집중하는 앵뿌쓰 대갈 하찮은 앵뿌 실력 ㅋㅋㅋㅋㅋㅋㅋ ㅋㅋㅋㅋ 내 케이크 중간과정임 거의 끝부분에 찍은거긴 한데 앞부분건 사진으로 못남겼음 ㅋㅋㅋㅋㅋㅋㅋㅋㅋㅋㅋㅋ 아 대부분 레터링을 많이들 하던데 나는 그림도 그리고 싶고 레터링도 넣고 싶었지만 빵 크기는 쏘미니미 했고 한계가 있어서 그림으로 결정ㅠ (레터링 잘할 자신 없었음ㅋㅋ) 토끼 그림 하찮고 귀여워서 맘에들었음 즐거운 앵뿌 2n살 글고 컬러 조합 넘 예쁘지 않음?😘 색 만드는 거 재밌었음 색이 진할수록 나중에 번지는게 심하다고 하셨음 색 조합은 쌤이 잘 도와주시니까 알려주시는대로 하면 됨❗️ 글고 원하는 색 뽑는다고 색소를 쫌 많이 넣어서 그런가 내 크림이 묽어져서 흐물텅 해짐ㅠㅠ 님들은 적당히 넣으세요😭 글고 짤주머니로 크림 이쁘게 짜는게 젤 어려웠다 진짜 쉬울줄 알았는데;;;; 생각처럼 안되는게 현실 쌤이 시범보인 부분 빼고는 ㅋㅋ 아주 삐뚤빼뚤한 누가봐도 사온게 아니라 직접 꾸민 케이크 다운 모습🍰 하찮은 앵뿌 실력 2 🍒체리가 치트키임🍒 조금이나마 하찮음을 가릴 수 있었음 체리는 현장에서 추가금 결제해야함💸 다섯알에 2,500원임 얼레벌레 완성된 케이크 ㅋㅋㅋ 뒤에 핑크뽀짝 케이크는 동생이 한 결과물! 핑크도 화사하고 너무 예뻤음💕 소요시간은 약 2시간정도 였던 것 같음❗️ 내 케이크 사진 멀리서 찍어야 예쁘더라 ㅋㅋ^^..ㅋㅋ🥹 밑에 깔린건 케이크 포장할 상자인데 끝나고 나면 포장까지 예뿌게 해주심🎁 인스타에 멜티스트 계정 팔로우 & 태그 후 스토리나 게시글로 공유하면 초 하나 서비스로 주시는 이벤트도 하고 있었음 멜티스트 케이크 공방(@melttist_cake) • Instagram 사진 및 동영상 팔로워 191명, 팔로잉 105명, 게시물 16개 - 멜티스트 케이크 공방(@melttist_cake)님의 Instagram 사진 및 동영상 보기 www.instagram.com 쌤이 인서타 스토리 올리신거 보니까 트와이스 채영님두 와서 만들고 갔었나봄~! 포장해주신 상자 뽀짝한거 올리고 싶었는데 왜 상자 나온 사진이 이거밖에 없는? 머하는? 암튼 귀여움 ㅎ 상자 디자인이 예뿌다~ 했는데 전부 직접 제작하셨다구 함 처참한 앵뿌쓰 케이크 그리고 문제가 생김 ㅋㅋㅋㅋㅋㅋㅋㅋㅋㅋㅋㅋ 이날 날씨가 갑자기 엄청 덥기도 했고 ㅠㅠ... 얌전히 잘 들고다녀서 케이크 완벽사수 했다고 생각했는데 집와서 확인해보니까 케이크가 분리가 되어버림 ㅋㅋㅋㅋㅋㅋㅋㅋㅋㅋㅋㅋㅋㅋㅋㅋㅋㅋㅋㅋ ㅠㅠ... 이건 완벽한 나의 잘..못.. 하.....🥹🥹 들고 돌아다니다 보니까 저런 대참사가 그리고 벌써 토끼하얀부분은 색도 번져있음 ㅋㅋㅋ 완성하고 나서 사진 많이 찍어둬서 다행이다;; 그래서 장갑끼고 일단 분리된거 다시 합쳐줌 크림은 다 짜부됐지만 어쩔수없지모 얼려놨다가 엄마랑 담날 케이크 잘라먹음 ㅋㅋ엄마가 유치원생이 만든것 같다고 ..ㅋㅋㅋㅋㅋㅋㅋㅋ ㅋㅋㅋㅋ ㅋㅋㅋ 아 글고 케이크가 망가져서... 받아온 초는 꽂지도 않음..ㅠㅠ.. ㅋㅋㅋㅋ 친구들한테 케이크 자른 사진 보여주니까 누가 케이크를 저따위로 자르냐며;;;;😇🤭 먹기 편했으니까 됐어.. 근데 케이크 진짜 맛있었음 담에 또 가서 완벽하게 만들고 싶어 님들도 관심 있거나, 기념일을 턱별하게 보내고 싶다면 원데이클래스 도좐 ㄱ ㄱ~❗️ 그럼 20000 갑분끝~!~"
"[베이킹 원데이 클래스] 홍대, 연남동 카페 - 멜티스트","멜티스트 연남동으로 다녀온 원데이 베이킹 클래스 솜씨당 어플을 통해 예약 후 방문하게 되었다 평범한 케이크는 거부하리 유니크 힙합 고 자체를 만들어 중 곳을 발견한게 바로 ’ 멜티스트‘ 였다 왼쪽에 튤립 케이꾸를 보고 아 요기다!! 싶어서 바로 예약 박아버렸다 도착하자마자 케이크 만들기 시작했는데 생각하던 베이킹 실습장은 아니었다 카페 안 테이블 위에 준비물이 셋팅 되어 있었고 편하게 앉아서 할 수 있었다 케이크 시트가 준비되어 있어서 나는 시트 쌓고 생크림 야무지게 챱챱 시트를 다 쌓고 위에 내가 하고 싶은 색으로 케이크를 꾸며주면 된다 이제 내 유니크함을 나타낼 시간 예시 작품들도 도안으로 있었지만 왠지 따라하고 싶지 않는 느낌 알즤 나는 파랑분홍 치덕치덕으로 했다 디자인은 일단 바르고 시작하는걸로 선생님께서 천천히 색상, 도안 고를 수 있도록 충분히 시간을 주시고 우리가 혹여나 부담스러워할까 개인업무 하시면서 멀리 떨어져 기다려주셨다 센스쩔~~ 완성작!!! Next image 연두색 얹을 때 ‘‘와....진짜 쉽지 않겠다 큰일인가’ ‘ 싶었는데 막상 선생님께서 사진 찍어주시니 저 세상 힙한케이크 완성이다 나는 너~~~~~무 마음에 드는데 누군가에겐 식욕 뚝떨...케이꾸라고...힝 케이크 포장 전 야무지게 케이크 찍찍하고 (케이크 포장하기 전에 사진 찍을 사진 충분히 주시니 자유롭게 사진 한 50장 정도는 찍어도 될덧><) 케이크 포장 해주시는 동안 카페 내부도 쓰윽쓰윽 둘러봤는데 아기자기한 소품들이 많았다 내가 갔을 때만 해도 베이킹 클래스만 운영 중이셨는데 지금 보니 카페도 같이 운영 중이시다 내가 방문했을 당시 곧 카페 오픈 하신다고 하셨었는데 다음에 기회되면 한 번 더 가봐야겠다 포장도 굳굳 행복한 시간 충천 완료다 다덜 케이크 만들어 오라! 멜티스트 서울특별시 마포구 연남로1길 39 1층 멜티스트"
"[연남동] 유니크한 나만의 케이크를 만들수 있는 케이크 원데이클래스""멜티스트""","안녕하세요! 오늘의 리뷰는 케이크 일일 클래스를 배울수있는 #멜티스트 입니다! 5월말..저와 뚱진과의 5주년이에용ㅎㅎ 그걸 기념해서 뭘 해줄까하다가 케이크클래스를 예약하게됐어요ㅎㅎ 예약링크는 여기! http://www.sssd.co.kr/m/class/detail/23954?cmd=app [연남동] 나만의 힙한 ""아트 케이크"" 로 파티 준비 | 솜씨당 [요리 > 디저트 ∙ 케이크] 장소 : 서울 마포구 연남동 487-23, 주차 : 주차불가, 수업시간 : 총120분, 인원 : 1~4명 www.sssd.co.kr 힙한 젊은이느낌이 가득해서 매우 기대가 됐습니당ㅎㅎ 위치 가좌역 인근 케이크공방 멜티스트는 지하철로는 가좌역과 제일 가까워요! 근데 지하철보단 버스가 더 자주다녀서 저는 버스타고 왔습니당 지도에있는 건물로가면 첫번째사진처럼 밑에는 상가건물이 있고 아무표시가없어서 호엥? 했는데 밖에 나있는 계단을 따라 올라가면 핑크문이 보여요! 핑크문으로 들어오면 힙하게 꾸며진 입구와 함께 공방잏나와요 공방도 진짜 아기자기하게 꾸며져있죠? 힙하면서도 아늑한 느낌ㅎㅎ 덕분에 편한분위기에서 케이크를 만들수 있었어용ㅎㅎ 화장실도 아주 힙하고 깔끔해서 한컷!ㅎㅎ 공방인테리어부터 느낌있어서 설렜습니당ㅎㅎ 미리 세팅이 완료된 자리에서 설명대로 착착 만들었어요! 생크림을 쇽쇽바르고 찰주머니로 쇽쇽짜요! 중간중간 선생님이 응원하고 칭찬해줘서 분명저는 똥손인데 용기가생겨서 잘 짤수있게 도와주셨어요! 역시 칭찬은 고래도 춤추게하네용ㅎㅎ 옆에 레이스도 화려하게할지 심플하게할지 고르게해주셔서 화려한 레이스를골랐어요! 솔직히 어려울줄알았는데 연습도 충분히 시켜주고 쉬운방법을 알려줘서 만들기 쉬웠어용ㅎㅎ 레터링도 충분히 연습후에할수있어서 더좋았습니당ㅎㅎ 단계별로 요렇게 연습할 시간을 줘서 충분히 연습한뒤에 제작가능!ㅎㅎ 연습한뒤에 온 최고집중력으로 생크림을 짜주면되용ㅎㅎ 타라~ 그렇게 시트에 생크림을 바르는것에서부터 시작해서 케이크를 꾸며주는것까지 제손으로 완성했어요! (선생님이 많이도와줬지만^^) 내똥손에서 이런작품이나오다니 신기하고 뿌듯하더라고용ㅎㅎ 완성하면 선생님이 예쁘고 힙하게 사진도 찍어주십니당ㅎㅎ 마무리까지만족~ 떠나기전 열심히꾸민 전리품들도 한번찍어주고 선생님이 예쁘게 포장해준 상자를 들고 나왔어용ㅎㅎ 친절하고 센스 있는 사장님덕에 예쁜 케이크를 만들수 있었어요! 대만족~ 이날저녁 뚱진에게 뙇!하고 자랑했어요! 제가 만들었다는거에 엄청놀라더라고요? 호호호 나도 케이크 예쁘게 만들수 있었다구~ 케이크 일일클래스로 예쁘게 만들어서 선물주는거 엄정뿌듯하고 좋더라고요~ 추천~ 친절한 선생님과함께 예쁜케이크를 만들수있던 케이크공방 ""멜티스트"" 특별한날 정성가득한 선물이 필요하신 분들에게 추천해요! 50m © NAVER Corp. 멜티스트 서울특별시 마포구 성미산로17길 109 3층"
연남동 아트케이크 공방 멜티스트 후기,"레터링 케이크가 만들어보고 싶었다! 여러가지 클래스를 둘러보던중 솜씨당의 멜티스트 케이크 클래스를 보고 신청했다 신청할 당시에는 리뷰가 하나도 없어서 떨렸음,,, https://www.sssd.co.kr/m/class/detail/23954 [연남동/오픈특가 이벤트] 나만의 힙한 ""아트 케이크"" 로 파티 준비 안녕하세요, 멜티스트 입니다.멜티스트만의 힙한! 케이크 클래스가 오픈되었어요 :)너무 큰 케이크는 부담스럽고, 작은 케이크는 마음껏 꾸미기 어렵죠.BUT ! 멜티스트에서는 [미니(도시락) / 중간 / 1호] 총 세 가지가 준비되어 있고,모든 케이크의 ‘윗면, 옆면, 케이크 하판’에 데코레이션과 레터링이 가능하답니다.완성된 케이크는 시판용 박스가 아닌 멜티스트만의 특별하고 힙한 케이크 상자에 담아드려요. SNS 감성샷 보장!※소개된 케이크는 ""멜티스트"" 만의 고유 디자인 입니다. 카피 금지※<<<< 클래스 상세설명 >>>># 크림을 ... www.sssd.co.kr 50m © NAVER Corp. 멜티스트 서울특별시 마포구 성미산로17길 109 위치 찾는게 좀 힘들었다! 알려주신 주소로 갔는데 이제 어디로 가야하나 좀 고민했음 사진 오른쪽에 있는 건물 뒤 저 계단으로 올라가면 된다!! 올라가면 이제 검정색문이랑 핑크색문이있는데 핑크색문을 열면 계단이 나온다! 처음에 잠겨있는거 아닌가 쫄아서 핑크문 노크하고있었는데 그냥 열려있으니 맘놓고 들어가도 될것같다 계단에 있는 캐릭터는 ‘칠앤아트’ 의 저작 및 소유물이며, 멜티스트 공방과 함께하는 칠앤아트 작가님들의 작품이라고 합니다! 계단부터 엄청 화려하다 좀 일찍 도착해서 내부 구경을 하고있었다... 미술관같다... 거울하나도 예사롭지않다,,, 신발장에 귀여운 초들이 올려져있다 구경하다가 시간되서 케잌만들러 갔다!! 근데 내부 인테리어 너무 예뻐서 놀람 테이블 너무귀엽고 방석도 너무귀엽다... 구름이야 뭐야...ㅠㅠ 넘귀여움,,, 진짜 내부 너무이뻐서 깜짝놀랐다 케잌 만드는 준비물을 싹 세팅을 다 해두셨다!! 친구랑 나는 중간사이즈 케이크+원형 빵+바닐라시트+생크림에 초코볼 속크림 이렇게 골랐었다 사이즈나 빵 맛 같은거는 예약할때 고를 수 있다 # 크림을 제외한 빵 지름 1. 미니(도시락) : 10cm (평균 1-2인) 2. 중간 : 12cm (평균 2-3인) 3. 1호 : 15cm (평균 3-4인) # 빵 모양 1. 원형 2. 하트 # 빵 맛 1. 바닐라 시트 (=카스테라 빵 맛과 동일) 2. 초코 시트 # 속 크림 맛 1. 생크림 (바삭바삭 초코볼 기본 제공) 2. 초코크림 3. 오레오크림치즈 크림 https://www.sssd.co.kr/m/class/detail/23954 처음에는 판떼기에 크림을 살짝 뭍힌다음에 맨 아래 시트부터 올리고 시럽을 뿌린다 빵->시럽->생크림->초코볼 순서로 쌓는다 다 하면 이제 애벌크림(?)단계인데,,, 슬슬 나의 솜씨를 깨닫는 단계,,, 나름 최대한 얇게바른것,, 강사님이 칭찬요정이셨다ㅠㅠ,,, 아무리 못해도 칭찬해주시고 도와주신다,,,갬덩 그 담에 케잌 디자인을 보여드리면 강사님이 색소를 섞어 원하는 색을 만들어주신다! 색소 찐하게 쓰면 착색될수 있으니 파스텔톤으로 추천해주셨따 물론 착색되도 며칠 지나면 자연스럽게 사라진다 친구는 베이스 컬러로 연핑크를 골랐다 나는 연보라,,, 연보라 크림 퍼바르는것도 도와주셨다 깍지도 강사님이 디자인에 맞게 골라주신다! 시범도 살짝 보여주신다 나머지를 짜는건 나의몫.. 위에 happy 2022를 쓰면서 역시 레터링케이크는 사먹어야 하는것 같다는 생각이 들었다 손이 아주 바들바들 떨렸다...강사님이 위에 한겹 더 써서 수습해주셨다 케이크는 예쁜데,,, 강사님이 하트랑 빤짝이도 이쁘게 짜주셔서 더 귀여워졌다 완성~~ 끝나고 강사님이 예쁘게 사진도 찍어주셨다 포장도 멜티스트 자체 박스에 예쁘게 해주신다 내부가 체스판 무늬라 더 이쁘다 케이크 단면! 그 다음날 먹어서 촉촉했다 생크림이라 느끼하지 않았다,,, 내가 먹은건 아니고 우리 가족이 먹고 남긴 후기다,,,"
