title,content
연남동 찻집 믜요 전통디저트와 함께한 즐거웠던 티타임,"직접 만든 전통디저트 다양하게 즐길 수 있어요. 연남동 믜요 믜요 서울특별시 마포구 동교로 256-10 2층 홍대입구역에서 5분정도만 걸어오면 되는 가까운 위치! 근데 찾아오기가 생각보다 어려웠다. 부디 나같은 사람 없기를 바라며 입구 사진도 함께 남겨서 후기를 작성해보겠다. 우리는 다정한세트로 예약함! 간판이 바로 눈에 띄게 보이는 게 아니다. 소요 파티룸을 발견했다면 잘 찾아온 것이다. 이쪽으로 쭈욱 계단따라 올라가면 된다. 그러면 문이 두개가 나오는데, 파티룸이 아닌 문으로 들어가면 믜요임! 감성가득한 입구. 향긋한 오렌지향기같은 캔들같아서 시작부터 기분이 좋았지 뭐야! 사장님이 계신 바 공간! 여기 앞 바에서도 다과를 즐길 수 있는 것 처럼 보였다. 테이블이 5개정도 있었던 것 같음. 예약제이기 때문에, 시간되면 예약한 인원만큼 상차림이 되어 있다. 카페한 켠에는 사장님께서 직접 그리셨다는 예쁜 꽃그림도 있다. 사장님 금손이신데요..? 우리테이블 첫 세팅! 가운데 있는 가지가 또 한 갬성했다. 웰컴티가 시원하게 한 잔! 무슨 티였는지 알려주셨는데 아 또 까먹었지 뭐야,, 기분좋게 마셨던 기억만 난다. 가운데 공간에는 오늘의 과자 라인업이 적혀있었다. 과자는 월마다 조금씩 달라지는 것 같았음. 이번 2023년 10월 다정한세트 라인업은 [화과자, 개성 약과, 대추 주악, 보늬밤 양갱, 율란, 피칸 강정]이다. 과자와 함께 즐길 수 있는 차도 고를 수 있다. 슈님은 도향 우롱, 나는 벽록계 고산 우롱으로 픽! 테이블에는 이렇게 귀여운 생화도 있었다. 이런거 진짜 좋아!!! 진짜 너무나 이뻤던 다정한 세트ㅠㅠㅠㅠ 다정한 세트는 차 한잔 + 6가지 종류의 다과 구성이고, 인당 24,000원이다. 처음 차는 아이스로 요청해서 얼음 둥둥 떠있는 예쁜 유리 찻병에 받았다. 우러낸 차의 향기 맡아보시라고 찻잎도 주셨음! 흐음~~~ 제일 먼저 먹은 건 피칸 강정이다. 눅눅해질 수 있어서 먼저 먹을 것을 추천주셨다. 견과류 자체를 워낙 좋아하는데, 이 피칸강정 진짜 고소하고 달달하고 찐한게 진또배기다. 연남동 다과맛집 인정! 이건 바로 율란!밤을 갈아서 만든 전통 다과임. 어쩜 이렇게 모양도 밤처럼 예쁜지! 이 녀석은 진짜 입에 넣자마자 살살 녹는 부드러움을 가졌다. 고소하고 담백한데 살짝 달달한 맛이 완전 취향 저격! 개성약과. 패스츄리처럼 겹겹이 반죽과 조청을 쌓아 만드는 전통과자다. 대추도 어쩜 이렇게 꽃처럼 올리셨는지!! 수줍게 금가루 토핑도 올라간 보늬밤 양갱. 양갱을 즐겨먹지 않는데도 맛있게 먹었다. 수제로 만든 양갱은 처음 먹어봤는데 이렇게 부드럽고 그런거였나요??? 다른 메뉴는 두개씩 나와서 하나씩 나눠먹으면 되었는데 화과자는 1개만 나와서 잘라서 나눠먹어야 한다. 가을이라고 귀엽게 단풍도 두개나 올라간 귀여운 화과자! 솔직히 이 단면보고 진짜 감탄했다. 고급스러운 찹살떡을 먹는 것 같았다. 보기에만 예쁜 화과자들도 많다던데 여기 진짜 다 맛있음! 연남동 다과맛집 이라 자신있게 말하겠음!!!! 제일 기대했던 대추 주악! 찐득하고 쫀쫀해서, 손으로 잡고 입으로 와앙 베어먹어야 한다고 알려주셨음! 한국식 고급 찹쌀도너츠같은 맛! 고소하고 쫀득쫀득하고 달콤하고 ! 찹쌀도너츠를 좋아한다면 정말 좋아할 맛이다. 매장이용시간은 예약시간부터 90분동안이다. 1시간 30분동안 잔잔하게 맛있는 전통 다과 먹으면서 차마시고 이야기 나누기 정말 좋은 매장이라 정말정말 추천함! + 추가로 서비스로 대추주악 주신 사장님 정말 감사합니다! #연남동믜요 #믜요 #내돈내산 #내돈내먹 #연남동화과자 #연남동다과맛집 #연남동한과맛집 #연남동찻집추천 #홍대믜요 #홍대디저트카페 #홍대디저트추천 #홍대디저트맛집"
홍대 연남동 한적한 티 카페 믜요 전통 다과와 향기로운 차(茶) 다정한 세트 예약 방문,"오랜만에 홍대 연남동에 놀러 간 날 사람이 북적이는 곳은 정말 싫지만 핫플 카페는 가고 싶은 시골 쥐 한적한 핫플은 없나 찾아보다가 예약제로 운영되어 아주 조용하고, 차와 다과상을 즐길 수 있는 색다른 카페를 발견하여 다녀왔쥬! 믜요 차(茶)와 다과점 번 호 0507-1305-5740 영업시간 화 ~ 일 13:00 ~ 20:30 매주 월요일 정기 휴무 주 차 - 기 타 예약 후 방문 가 격 다정한 세트 1인 24,000원 사진 참고 믜요 서울특별시 마포구 동교로 256-10 2층 홍대입구역 3번 출구 547m 위치한 홍대 연남동 찻집 믜요 걸어서 10분 정도로 역이랑 가깝다. 주차할 곳 없으니 지하철 타고 오기! 골목 제일 끝 하얀 벽돌 건물 3층 계단 안쪽에 하얀 문이 있다. 입구를을 코앞에 두고 못 봐서 어디로 들어가야 되냐고 전화해서 물어봤다. 안쪽으로 들어오시오! 전통 디저트와 향긋한 차를 즐길 수 있는 믜요는 예약제로 운영되는 티 카페다. 일자와 시간, (다정한 or 아담한) 세트 옵션 선택 후 시간에 맞춰 방문하면 된다. 네이버 지도 공간을 검색합니다. 생활을 연결합니다. 장소, 버스, 지하철, 도로 등 모든 공간의 정보를 하나의 검색으로 연결한 새로운 지도를 만나보세요. map.naver.com 편안함을 주는 우드 인테리어에 잔잔하게 흘러 나오는 음악과 2인 테이블 3개, 바 테이블이 전부인 아담하고 아늑한 티 카페 믜요는 도시의 소란에서 벗어나 조용한 시간을 보낼 수 있는 곳으로 차의 향과 전통 다과의 맛이 어우러진 공간이다. 너무 조용하고 한적해서 첫 만남 소개팅 장소로는 부담스러울 것 같고 두번째 만남이나 연인 데이트, 친구와 함께 부모님과 함께 오기 좋겠다. 차 좋아하는 사람, 전통 다과 좋아하는 사람은 물론 당연 방문해야함! 예약제로 운영되어 인원수에 맞게 식기류가 미리 세팅되어 있었다. 2인 좌석은 먼저 도착한 사람들이 앉아 있어 우린 바 테이블로 안내 받았는데 그다지 편한 자리는 아니었다. 편안한 의자, 테이블에 앉고 싶다면 예약 시간보다 조금 일찍 도착해서 좋은 자리를 차지할 것! 다정한 세트 2인 (1인 24,000원)은 차와 한식 과자 여섯 종류가 나온다. 음료는 메뉴판에 있는 다양한 차(tea) 중에 1개를 고르면 되고, 다과는 조금씩 바뀌는데 11월엔 화과자, 개성 약과, 대추주악, 보늬밤 양갱, 피칸 강정, 윤란 6가지가 준비되어 있었다. 유과 참 좋아해서 명절날, 제삿날에 기다려지고요? 평소엔 편의점에서 미니 약과, 약과 쿠키 수시로 사 먹을 정도로 잘 먹고 게다가 대추주악은 정말 궁금했는데 믜요에서 먹을 수 있어 얼마나 행복하던지!! 차는 도향 우롱과 밀크티 선택~ 개성 주악과 피칸 강정은 따로 판매 중 나올 때 피칸 강정 하나 구매했다. 샐러드랑 요거트에 먹으면 정말 맛있다. 주문과 동시에 사장님이 차를 내려주신다. 바 테이블에 앉으면 바로 앞에서 볼 수 있다. 아살모 밀크티 퐁실퐁실한 거품 위 파란 꽃잎이 포인트! 고소하면서 부드러운 맛이 입안 가득 퍼지고 달콤한 정도가 딱 적당해서 달달한 음료를 좋아하는 사람, 그렇지 않은 사람들도 맛있게 즐길 수 있겠다. 도향 우롱 메뉴판에 차마다 향과 맛 소개가 간단히 적혀 있어 차알못도 쉽게 선택할 수 있었다. 도향 우롱은 복숭아의 달달한 향을 넣은 가향차로 아이스로 마시면 좋다고 한다. 얼죽아지만 이날 좀 쌀쌀해서 따뜻한 차로 주문했다. 차와 우려낸 찻잎도 제공되는데 향을 맡을 수 있어 좋았고, 한 잔 다 마시고 나면 이 찻잎으로 다시 우려 준다. 찻잔에 쪼르륵 따르면 복숭아 향이 솔솔~~ 얼어있던 몸이 사르륵 녹아 포근한 느낌이 들었고, 복숭아 맛이 은은하게 나서 질리지 않고 맛있게 먹을 수 있었다. 향긋하고 맛있는 차를 즐기고 있으면 전통 다과상이 차려진다. 피칸 강정, 개성 약과, 보늬밤 양갱 화과자, 윤락, 대추주악 각기 다른 종류의 한과가 플레이트에 아름답게 담겨 나와서 너무 예쁘다. 예약제라 소수 정원이 머무는 곳이라 사장님이 차나 다과를 내주실 때 마다 자세한 설명과 함께 아름다운 플레이팅, 세심한 서비스로 차알못이지만 편하게 차를 즐길 수 있었고, 다과는 더 맛있게 먹고 올 수 있었다. 개성약과, 보늬밤 양갱, 화과자 피칸 강정은 눅눅해질 수 있어서 제일 처음 먹는 것을 추천해 주셨다. 견과류 자체를 안 좋아하지만 달달한 꿀에 절여진 피칸은 말해 뭐해요! 달달하고 고소하니 맛있죠! 밤 모양이 넘나 귀여운 윤란 고소하고 부드러우면서 달달해서 나의 입맛을 완전히 사로 잡았다. 너무 먹고 싶었던 대추주악 조금 딱딱해서 손으로 먹어야 한다. 옛날 동그란 도너츠 느낌인데 좀 더 찐득하고 쫀득하고 고소하고 달콤하다. 기름기가 전혀 없어서 담백하니 맛있다. 한입 먹자마자 눈이 똥그래진 대추주악 맛있고 작고 소듕해서 아껴먹었다. 단풍이 물든 화과자는 그냥 그랬고 개성 약과는 패스츄리처럼 겹겹이 쌓인 약과에 켜 사이사이에 베이있는 쌀 조청의 은은한 단맛과 고소한 참기름 향이 압인 가득하게 퍼진다. 연남동 다과 맛집 맞네 맞아!! 마지막은 보늬밤 양갱으로 마무리~ 밤이 통째로 들어간 밤 양갱은 부드럽고 한입 베어 먹을 때마다 달달한 밤이 씹혀 아주 맛도리였다. 홍대 연남동 찻집 티 카페 믜요에서 전통 다과와 향긋한 차를 즐기면서, 바쁜 일상에서 잠시 벗어나 여유로운 시간을 보낼 수 있었고 분위기, 음료, 다과 모두가 어느 하나 빠지지 않게 조화를 이루면서, 모든 곳에 사장님의 손길 하나하나 정성과 배려가 묻어나서 좋았다. 차알못이지만 차를 즐기기에 충분했고 좋아하는 전통 다과 여러 종류를 맛있게 먹을 수 있어서 너무나 좋은 경험이었다. 바 테이블보다 편한 좌석이었으면 좀 더 즐기다 왔을 텐데 아쉽다. 홍대 연남동 도시의 소란에서 벗어나 조용한 시간을 보내고 싶다면 차와 전통 다과상이 있는 티 카페 믜요 추천한다."
연남동 근처 카페 찻집 믜요,"연남동 한식 카페 믜요 믜요는 한식 디저트를 기반으로 차와 어울리는 다과를 만듭니다. 좋은 재료를 선별하여 직접 손질하고 하나하나의 과정에 정성을 들입니다. 작고 요란하지 않는 공간에서 다과와 차 그리고 벗들과 함께 서로의 이야기들로 채워지는 평온한 한날의 우리를 그려보세요 차 와 과자. 함께 하기 좋은날_믜요 📌서울 마포구 동교로 256-10 2층 월 정기휴무(매주 월요일) 영업시간 13:00 - 20:30 믜요 서울특별시 마포구 동교로 256-10 2층 비가 펑펑 쏟아지는 날 엄마, 언니랑 함께 오랜만에 연남동에 왔습니다 연남동 믜요 카페는 예약 방문만 가능해서 친언니가 일주일 전에 미리 예약하고 방문했어요 카페의 외관 모습이며 믜요는 건물 맨 꼭대기 3층에 위치하고 있습니다 계단을 열심히 올라가다 보면 멋진 분위기의 믜요 카페가 나옵니다 카페 안을 들어가 보면 아늑한 분위기의 연남동 믜요 카페 내부가 보입니다 테이블에 3인 예약 상이 세팅되어 있습니다 앉아있는 테이블 뒤에 옷이나 가방을 걸 수 있는 행거가 있어서 좋아요 연남동 믜요 카페 내부에 화장실도 있습니다 매장 내부를 구경하고 나서 세팅된 테이블을 구경해 봅니다 전통적인 감성이 느껴지는 그릇과 포크가 놓여있어요 테이블에 앉자마자 얼음이 들어간 시원한 차를 준비해 주셨습니다 웰컴 차와 감성 있게 사진 한 장 찍고 제공될 한식 디저트인 칠월의 과자를 구경해 봅니다 총 6가지 과자가 제공되는데요 제공되는 메뉴로는 화과자, 금귤 개성 주악, 조청 궁중 약과, 복숭아 통팥 양갱 흑임자 서리태 콩다식, 피칸 강정입니다 메뉴판이 있었는데 사진을 못 찍어서 매장 메뉴판 사진을 네이버에서 가져오려고 했었는데 차, 음료, 디저트 등이 변동으로 되어있어서 따로 메뉴판은 가져오지 못했습니다 메뉴는 재료 수급에 따라 바뀌는 것 같아요 꾸니가 주문한 아이스티입니다 라임의 상큼한 맛과 달달한 아이스티의 조합이 맛있더라고요 친언니가 주문한 시원한 차와 엄마가 주문한 뜨거운 차입니다 차를 다 먹어갈 때쯤 사장님이 테이블에 오셔서 차는 추가 리필 여부를 물어봐 주시고 1번씩 리필을 해주시더라고요 제가 주문한 차가운 아이스티는 리필이 안돼서 차를 주문할걸...이라는 후회를 5초 했습니다 차를 홀짝홀짝 마시다 보니 다과 상이 준비되었습니다 플레이팅이 정말 예쁘게 되어있어요 복숭아 통팥 양갱인데 양갱의 팥이 너무 진하지 않고 복숭아 맛도 나면서 잘 어울리더라고요 흑임자 서리태 콩다식은 고소하고 입안에서 부드럽게 씹히고 피칸 강정은 고소하면서 조금 단맛이 느껴집니다 금귤 개성주악은 엄청 찰진 도넛이에요 쫀득쫀득한 식감에 바삭함과 달달함이 더해져 제 입맛에 쏙 맞았습니다 카페 믜요에서 제일 예쁜 모양의 디저트였는데 예쁜 복숭아 안에 앙금이 들어있어요 앙금 들어간 디저트를 좋아하진 않는데 카페 믜요의 양갱과 앙금은 부드럽고 맛이 강하지 않아서 좋았습니다 가족끼리 프라이빗한 공간에서 티마카세를 즐길 수 있어서 좋았습니다 자극적인 초코, 딸기 등의 디저트가 아니라서 엄마의 입맛에 잘 맞았어요 #까페 #대형카페 #서울카페 #카페추천 #연남동맛집 #연남동카페 #연남맛집 #연남카페 #연남찻집 #연남 #서로이웃환영 #서이추환연 #이웃환영"
믜요-전통 디저트와 향긋한 차를 즐길 수 있는 연남동 고요한 찻집,"믜요 서울특별시 마포구 동교로 256-10 2층 경의선 숲길 근처 카페 믜요 생긴지 얼마 되지 않은 곳인데 다과상이 나오는 차 맛집이라고 해서 예약하고 가봤다 네이버에서 믜요 검색하고 예약 가능 주말 오후 1시 30분에 예약해서 방문해봤다 시끌벅적한 연남동 골목길 안쪽에 자리한 믜요 이쪽 골목은 유독 조용했는데 가정집도 있고 그래서 그런가보다 입구부터 풍기는 전통의 향기 입구부터 매장 안쪽까지 은은한 향기가 나서 좋았다 예약자만 받는 것 같았는데 테이블마다 예약자 수만큼 세팅이 되어 있었다 앞접시랑 포크, 디저트 찍어먹을 수 있는 스틱이랑 검은색 티코스터 다과 라인업이 적힌 종이도 놓여있었다 6월에 방문하면 흑임자가 들어있는 화과자랑 모약과(정육면체 모양의 약과), 개성 주악, 산딸기 양갱, 현미 강정, 팥과 호두가 든 곶감이 나온다 친구랑 같이 방문~ 차 메뉴는 따로 메뉴판에 제공된다 백차 홍차 밀크티 등등 다양한 차가 준비되어 있다 나는 복정 백차 백모단을 골랐고 친구는 매산 금훤을 골랐다 날이 30도가 넘어서 우선 아이스로 주문했다 웰컴티로 한 모금 마실 수 있는 차가 제공된다 호로록 먹었음 이건 향이 진하지 않아서 물처럼 마셨다 매장 안쪽에는 바 좌석도 있었다 예쁜 잔에 담겨나온 차 우려낸 찻잎도 같이 제공되는데 한 잔을 다 마시고 나면 다시 오셔서 재차 우려주신다 두 번째로는 뜨겁게 우려달라고 부탁해서 마셨다 친구 차는 또 다른 모양의 찻주전자에 우려나왔다 디저트 전체샷 화과자와 양갱은 1개만 제공된다 우리가 먹은 건 인당 24,000원하는 ‘다정한 세트’ 여섯 가지 과자가 나온다 그리고 주의할 점, 기본 2인부터 예약이 가능하도록 되어있음! 다정한 세트가 부담스러운 사람들이 주문할 수 있는 ‘아담한 세트’도 있는데 이건 18,000원이고 약과, 양갱, 곶감 세 종류 과자가 제공된다고 한다 각 1개 나오는 호지차 개성 주악 엄청나게 딱딱하니 먹을 때 주의해야 한다 예전에 마카롱 먹다가 크라운 빠진 적이 있어서 조심조심...ㅋㅋ 전체샷~ 화과자 안쪽은 흑임자가 들어 있었고 많이 달지 않아서 좋았다 양갱은 나이프로 4등분해서 먹었다 위쪽은 레몬을 굳혀 투명하게 만들었고 아래쪽은 산딸기 맛이 났다 다 맛있었음 1시간 넘게 대화나누고 맛있는 디저트도 먹고 나왔다 매번 고호재 갈 때 예약이 어려워서 가기가 힘들었는데 이런 곳이 생기니 넘 좋다 대만족! #연남동카페 #홍대맛집 #홍대카페 #연남동맛집 #연남동믜요 #믜요 #다과상 #서울다과상 #전통과자 #전통디저트 #개성주악 #경의선숲길맛집 #경의선숲길카페 #홍대카페추천"
연남동 믜요~ 공쥬들의 힐링다과타임~,"짜잔 카페 리뷰는 오랜만인 것 같은데~ 어제 올린 빤쮸토키 팝업 갔다가 방문한 카페 믜요~ 전통 디저트 맛집 카페 다녀옴~ 약간 앙큼하게 나만알고 싶은 카페지만 나도 알바걸 덕분에 알았으니 다 같이 알자 마인드로 올려부려 예약 방문만 가능하니 방문하기 전에 네이버 예약하고 가야된다! 나는~ 야물딱진 알바걸이 미리 예약해줬다!❤️ 믜요 서울특별시 마포구 동교로 256-10 2층 연남동 안에 있는데 쁘띠 찾기 어려운 골목에 위치해있다! 2.5층? 튼 제일 윗 층에 위치하니 오른쪽에 계단 찾아서 올라가기~ 그래두 금방 도착~ 들어가자마자 아늑한 분위기가 정말 좋았다! 우리는 오후 6시 30분으로 예약했는데 5분정도 일찍 도착했다 사장님께서 엄청 친절하게 맞아줌~ 미리 자리랑 웰컴티?가 준비되어 있었다 가격은 다정한세트(1인 24000원) or 아담한세트(1인 18000원) 있더라~ 이용시간 90분~ 아마,, 우리는 3인이라 다정한세트(1인 24000원) 2인 + 단품추가(차, 개성주악, 개성약과 16500원) 이렇게 주문한 거 같다,, 야무지게 알아봐주고 예약해 준 연히씨 여기서 다시한번 감솨솨를,,~ 1인1음료 고를 수 있었는데 날이 너무 더워서 시원하게 웰컴티 화끈하게 마시면서 음료는 뭐 마실까~ 나는 우롱차(매산금휜)를 골랐다! (차는 1번 더 우려주시니까 차로 마시는 거 쁘띠 추천~) 5분정도 기다리니 차가 나왔다 헤헤 좋은 향이 진하게 나고~ 시원하고~ 맛나구수하고~ 너무 맛났다! 차 우려진 주전자?도 같이 나오는데 냄새 킁킁 너무 좋아~ (아니 근데 차 종류는 카페 강렬하자나!!!!! 잠 안 옴!!! 카페인약해걸앤보이들 주의!ㅠ) 친구가 시킨 차!(이름은 기억안남) 우아웅 한창차림~ 디저트들도 금방 나왔는데 너무 기깔나자나~ 호지차 개성주악 개성주악 처음 먹어봤는데 진짜 맛있었당 연히씨의 야무진 커팅 진짜 하나하나 다 맛있었다,,, 전통 디저트 최고최고.. 진짜 싹싹 잘 먹었다 사장님께서 차도 한 번 더 우려주셔서 야무지게 먹을 수 있었다! 이용시간 90분도 충분했다! 머쓱하지만 평소 카페가면 기본 2-3시간 앉아있는 궁둥무겁걸이 가기도 너무 딱이야~~~ 먹었던 디저트들을 낱개로 구매 가능한 것 같았다~ 디저트들 다 맛있어서 사고 싶었다! 그래도 저녁 먹으러 가야되니까 얼른 나왔다! 나갈 때까지 사장님이 엄청 친절하셨다! 사진 출처 : 노비 인스타 캡쳐 헤헤 분위기 최고 전통 디저트 맛집 카페 믜요 다녀왔는데~ 날씨가 너무 더워서 왠지 어느카 페를 가더라도 다 만석이었을 것 같은데 예약 방문만 가능해서 그런지 우리끼리 조용사적소근소근 분위기라서 너무 여유롭고 좋았다🩷 무엇보다도 에어컨 너무 시원하게 틀어주셔서 행복했음ㅠ 요즘 전통 디저트들이 인기만점인데 한 곳에서 다양하게 먹을 수 있는 점에서 완전 추천한다! 음 조금 비싸긴한데 그래더 차 2번 우려주시고 디저트 가지수도 많고 뭐 요즘에 약과나 개성주악 다 너무 비싸니까 뭐,,~ 그리고 분위기 좋아서 가격값 충분하다고 생각한다! 사장님도 친절하시고,,(사장님얘기 계속하는데 친분지분x) 튼 추천하는 연남동 카페 믜요~ 울 얌전한 공주왕자들 꼭 가보기~~~~~ 안농~~"
[홍대입구/연남동: 믜요] 감성 챙길 수 있는 다과를 파는 찻집,"안녕하세요 쩝쩝박사 옥돌입니다~ 오늘은 홍대입구/연남동에 위치한 찻집 <믜요>를 소개하려 합니다. 믜요 서울특별시 마포구 동교로 256-10 2층 사실 차에는 큰 관심이 없었고 예전부터 먹고싶었던 개성주악 먹으러 갔습니다! ㅋㅋㅋㅋ 이렇게 생긴 계단을 올라가면 가게가 나와요. 가게 입구입니다. 사장님이 저한테 워크인으로 왔냐고.. 물어보는거 보니깐 예약손님을 주로 받으시나 봐요. 카페 내부는 완전 감성 넘치는 찻집 느낌이에요. 예뿌죵... 메뉴판입니다. 같이 간 친구한테 메뉴판 사진 좀 찍으랬더니 이렇게 찍었네요. 죄송합니다..;; 저희는 <19차 매산금훤(10.0)>, <21차 도향우롱(10.0)>, <개성주악(3.0)>, <약과(2.5)> 를 주문했습니다. 생각보다 찻값이 만만치 않았어요ㅠㅠ 만원......ㅠㅠ 약과는 메뉴판에는 3500원으로 표기되어 있지만 실제로 2500원이었습니다. (사실 메뉴판엔 0.35면... 350원이라는 뜻이지만...^^) 주문한 차부터 나왔습니다. 정갈한 다기와 밑에 깔개.....(?) 감성 풀 충전됐습니다. 사기그릇 안에는 우려내고 남은 찻잎이 들어있어요. 사장님이 한번 향을 맡아보라고 권유하시더라고요. 향이 굿이었습니다. 저는 차알못이라 잘은 모르지만, 차 맛은 디저트와 잘 어우러지는 맛이었습니다. 향긋하고 별로 안 씁쓸했어요. 특히 저 테이블마다 있은 보라색 꽃이 예뻤습니다. 곧이어 모습을 드러낸 주인공...! 왼쪽이 주악이고 오른쪽이 약과입니다. 둘 다 진짜 작긴한데 맛있었습니다. 달콤한데 쫀득하고 바삭한 찹쌀맛... 특히 개성주악 위에 올라간 대추가 맛있었어요ㅜㅜ 순삭... 글을 한 번에 기세로 써야되는데 자꾸 조금씩 쓰다보니까 오늘 포스팅이 별로 맘에 안 드네여... 암튼 티 카페 흔치 않은데 차를 제대로 한잔 마셔보고 싶으시다면 방문하길 추천드립니다! #믜요 #연남믜요 #홍대믜요 #차 #찻집 #서울찻집 #서울티카페 #티카페 #개성주악 #약과 #약과맛집 #연남동카페 #홍대입구카페 #매산금훤 #도향우롱"
