title,content
연남동 카페 ⁍해피니스인어데이⁌ 데이트하기 좋은 수제 디저트 카페 추천,"수제 디저트가 정말 맛있는 연남동 카페 해피니스인어데이 안녕하세요. 오늘은 수제 디저트가 정말 맛있었던 연남동 카페 해피니스인어데이를 소개합니다. 인천의 유명한 디저트 카페 너티브루키의 대표님이 연남동에 오픈한 세컨드 브랜드라고 해요. 벌써부터 기대기대 위치 & 영업시간 서울 마포구 동교로 46길 7, 201호 / 0507-1439-5023 영업시간 : 12:00 ~ 21:00 (매주 월요일 휴무) 해피니스인어데이 위치 보러 가기▼ 해피니스인어데이 서울특별시 마포구 동교로46길 7 201호 ▲누가 봐도 수제 디저트 정성껏 구울 것 같은 귀여운 로고 & 입간판 해피니스인어데이는 2층에 위치하고 있어요. 네이버 지도로 쉽게 찾아갈 수 있습니다. 건물 한 쪽은 2층 간판이 잘 보이고 나머지 한 쪽은 입간판이 있어 쉽게 찾을 수 있어요~ 2층으로 올라오면 귀여운 로고의 유리문이 반겨줍니다. 입구 선반 인테리어부터 멋있어서 시선이 가고 저도 모르게 홀린 듯 사진을 찍었어요..ㅎㅎ 메인 공간과 살짝 분리된 서브 공간으로 구성되어 있어요. 메인 공간은 테이블 간격이 넓고 소파가 있어서 친구들이 같이 사는 셰어하우스 공용 공간에 잠시 쉬러 온 듯한 느낌을 받았습니다. 살짝 분리된 서브 공간은 채광이 대박.. 통유리 창의 밝은 느낌과 화이트톤이 잘 어울리는 느낌~ 메인 공간보다 더 아기자기하고 편안한 분위기의 공간이었습니다. 요즘 어디서나 인증샷이 필수인데요! 거울 앞에서 인증숏 정말 많이 찍으시더라고요~ 물결 거울 짱 예쁨.. (화장실 쪽에는 조명 달린 대형 거울 있음!) 그리고 공간 한 쪽에는 물을 자유롭게 마실 수 있게 준비되어 있는데요. 저는 이 공간이 정말 예쁘더라고요. 테이블 하나 더 놓을 수 있는 자리인데 고객을 위한 물 세팅이라니.. 친절한 사장님! 메뉴 & 가격 복숭아 시즌 메뉴 짱짱!! ▲해피니스인어데이 메뉴 대중적인 것부터 시즌 메뉴에 티까지 정말 다양한 선택지가 있어 좋았어요. 친구는 시즌 메뉴인 새콤달콤 에이드를 선택했고, 저는 오라그랏세를 선택했어요. 오라 그랏세는 연유 라떼인데, 커피-우유 층 분리되어 비주얼도 좋은 음료라고 설명해 주셔서 바로 채택!!ㅋㅋ 해피니스인어데이 : 네이버 방문자리뷰 86 · 블로그리뷰 44 naver.me 디저트는 마구잡이로 골랐던 기억이..ㅎㅎ 왜냐면 다 맛있어 보였기 때문.. 유기농 재배 밀가루, 고메 발효 버터, 최상급 초콜릿 발로나의 초코칩을 사용한다고 해요. 메뉴판에 쓰여있음ᄏᄏ 어쩐지 맛나더라~ 엄선한 재료 + 정성스러운 수제 = 정말 맛있다 테이크 아웃까지 5가지를 시켰답니다. 페퍼로니 콘치즈 (4,500) 초코칩 쿠키 (4,200) 피스타치오떠먹쿠 (7,500) 황치즈 쿠키 (4,500) 레드벨벳 쿠키 (4,500) 🔗인스타그램 확인하기 수제라 디저트 라인업은 자주 변경되는 것 같아요. 방문 전에 매장 인스타그램 확인하고 가시길! 사실 해피니스인어데이 다녀온 뒤에 정말 너무 맛있어서 인별그램 팔로우 해놨는데 글쎄 오늘 얼그레이 무화과 케이크를 판매한다는 엄청난 소식을 접했어요!! 제가 방문했을 때는 못 본 메뉴- 아마 오늘 사장님이 좋은 무화과를 get하셨기 때문이겠지요? 제철 디저트를 즐길 수 있는 것 또한 수제 디저트 집 만의 특장점인 것 같아요. 집 앞이었으면 맨날 갔을 듯..ㅋㅋㅋ 음료 & 디저트 와우... 정말 하나하나 다 맛있어보이죠?ㅋㅋ 이 정도면 한 상 차림 수준ㅋㅋ 사실 디저트 4개 이상 구매하면 수제 쿠키 1개 추가 증정 이벤트 중이라 한 상 차림이 되었어요..ㅎㅎ 무의식적으로 섞는 영상 찍으려다가 사장님이 오라그랏세는 섞지 말고 먹으라고 하신 것 같아서 급히 손을 멈추었답니다ㅋㅋㅋ 멈춰서 다행..ㅋㅋ 아래로 갈수록 더 달달하게 먹을 수 있어요! 빵&우유 조합 말모.. 디저트와 함께 정말 맛나게 먹었어요. 제가 심한 감기에 걸려.. 옮길까 봐 친구 음료를 먹어보지 못했어요ㅠ 새콤달콤 에이드는 일행의 카톡으로 맛 설명을 대신합니다..ㅋㅋㅋㅋ 결론은 짱짱 맛있고, 피치리카노도 꼭 먹어보고 싶다! 디저트 중 하이라이트는 요 페퍼로니 콘치즈!! 진짜 이것만 몇 개 더 살까 고민했을 정도!! 감동의 피자 맛! 페퍼로니와 안에 옥수수가 정말 많이 들어있어요. 달달한 거 안 좋아하는 남자친구가 좋아할 것 같은 디저트였어요ㅋㅋ 테이크 아웃까지 야무지게 남은 것들은 테이크아웃 해주셔서 집으로! 떠먹쿠가 대박입니다요 여러분. 피스타치오가 엄청 많이 들었어요. 떠먹는 스타일이라 흘리지 않고 깔끔하게 먹을 수 있어요!! 힙한 인테리어와 엄선한 재료로 만든 디저트까지! 연남동 디저트 카페를 찾으신다면 해피니스인어데이 추천합니다 ▲해피니스인어데이 instagram 보러 가기 질문은 댓글😍로, 도움이 되셨다면 공감💕부탁드립니다 다른 글도 보고 싶으시다면 이웃추가➕해주시고 이 글을 두고두고 보시려면 공유📤해가시면 됩니다"
연남동 디저트 카페 추천 '해피니스인어데이',"주말에 누워서 빈둥빈둥 거리는데 갑자기 진짜 진짜 진짜! 맛있는 수제 디저트가 먹고 싶은거예요 이 더운날 절대 실패해선 안된다는 집념으로 열심히 찾다가 발견한 연남동 카페 '해피니스인어데이' 싸장님이 인천에서 유명한 '너티브루키' 디저트 카페 대표님이라고 하시더라고요 연남동 해피니스인어데이가 세컨 브랜드시래요! 디저트로 연남까지 진출하신거면..믿을 수 있쟈나..그래서 갔쟈나.. 연남동 디저트 맛집 '해피니스인어데이' 영업시간 화,수,목,금,토,일 12:00-21:00 (매주 월 휴무) 전화번호 0507-1439-5023 인스타그램 정보 연남동 디저트 카페 해피니스인어데이 (HID)(@hid_yeonnam) • Instagram 사진 및 동영상 팔로워 821명, 팔로잉 64명, 게시물 60개 - 연남동 디저트 카페 해피니스인어데이 (HID)(@hid_yeonnam)님의 Instagram 사진 및 동영상 보기 instagram.com 기타정보 반려동물동반, 내부화장실 주소 서울 마포구 동교로46길 7 201호 50m © NAVER Corp. 해피니스인어데이 서울특별시 마포구 동교로46길 7 201호 홍대입구역 3번 출구에서 5분정도 가면 위치해 있어요 핫한 위치에 있어서 식사하고 디저트 먹으러 가면 딱 좋겠더라구요 요건물 2층에 있어요 사진으로만 봐도 햇살이 장난아니네요 들어가자마자 햇살맛집이라고 생각했는데 다 이유가 있었고욘 요 계단으로 올라가시면 돼요 카페 들어가자마자 보이는 눈에 띄는 소파.. 요 소파가 해피니스인어데이의 무드를 나타낸달까요(내 생각) 전체적인 느낌은 몬가 우리들만의 아지트! 같은 그런 느낌이에요 친구들끼리 모여서 파티하고 수다떨고 싶은 그럼 느낌! 그래서 분위기가 되게 편안하고 따뜻했어요 진짜 너무 예쁘네.. 진한 주황컬러에 블루계열 러그 매치 실화?..왕예쁨요 진짜 햇살맛집.. 그리고 개인카페인데 의자 다 편하고 오래 앉아있어도 무리 없어서 특히 좋았어요 스태프룸, 화장실, 내부공간 다 아치형 벽으로 만들어서 더 따뜻한 느낌이 들었어요 둥글둥글 전 요즘 아치가 왜케 좋은지 모르겠어유.. 여기로 들어가면 또 다른 숨은 공간이 나와요 요렇게 또 숨은 아지트 느낌! 테이블 간격 다 넓게 배치해서 이야기하고 놀기 좋았어요 크 진짜 햇살 맛집이네요 덕분에 사진이 엄청 잘 나오더라구요 거울도 있구 또 구석구석 소품들이 있어서 보는 재미도 쏠쏠했어요 연예인도?!!!!!!!!!!!! 보고 왕눈됐잖아요 나 자주 간다.. 스피커도 빵빵해서 음악 듣기도 너무 좋았어요 전 요즘 브라운톤만 보믄 기분이 좋읍니다 브라운톤 인테리어 너무 센스있고 멋있어.. 디저트 타임 이제 디저트를 주문하러..두근두근 해피니스인어데이는 다 수제로 만드신대요 사실 그래서 왔어요 스콘, 쿠키,케익,약과 등 다양한 디저트가 있어요! 모든 디저트에 풍미가 뛰어난 발효 고메버터를 사용하신대요 밀가루도 다 유기농 밀가루..세상에 저 쪼꼴렛 쿠키도 주문했는데 요건 또 카카오 함량이 높은 깔리바우트랑 발로나 초콜릿이 들어간대요.. 깔리바우트랑 발로나 뭔지 찾아봤짢아요. 찾아보고는 이건 먹어야만 한다는 생각에 칼주문 ㅎ 쿠키는 4천원대인데 고메버터에 유기농 밀가루, 초콜릿퀄리티 보면 원재료 대비 디저트 가격이 가성비가 좋은 느낌에요 거기에다 죄다 수제인데.. 오후 5시 쯤 갔는데 케익류는 많이 없어서 아쉬웠어요ㅠㅠ 배달로도 인기 많다고 들었는데 그래서인가 흑흑 쿠키랑 애플시나몬 크럼블 주문했어요 제 애플시나몬 크럼블을 제조 중이신 싸장님 먼저 쿠키 등장..연남동 디저트 카페 답댜..영롱 저는 블랙소르베, 말차마카다미아, 오렌지스콘, 초콜릿 4가지 주문했어요! 말차쿠키는 말차향에 적당한 달달함으로 넘 맛있었어요 거기에 마카다미아가 들어가서 너무 고소해 초코쿠키는 많이 달지 않아서 좋았는데 버터풍미 가득함 사이로 씹히는 초콜릿이 진짜 고급스러운 초콜릿 맛이었고 초콜릿 씹히는 식감이 정말 좋앗어요 아니 그리고 쿠키가 왜케 쫀득해요?..진짜 진짜 맛있었어요 요건 회사 가서 같이 먹으려고 따로 주문했어요 히히 블랙소르베 미친놈임요 ㅠㅠ 전체적으로 레몬향 가득한데 또 너무 달지 않고.. 아니 블랙소르베미친놈임..블랙소르베 한 입씩 먹더니 스콘 바로 뺏어가서 맛도 못 봤아요.. 참 사진 찍고 싶다고 하니 따로 그릇에 내어주셨어요 찍고 나면 포장해 주신다구 하셔서 감동..사장님 넘 친절 음료는 패션후르츠 에이드 개인적인 취향으로는 블랙소르베1위..그 담에 초콜릿..컄 미친놈 또 먹고 싶다 귀여운 애플시나몬 크럼블 특이하게 크럼블 안에 치즈가 있어 달달하면서도 고소하고 씹는 맛도 있어서 그릇을 싹싹 비웠어요 햇살도 좋고 인테리어도 예쁘고 디저트는 맛있는데 예쁘기까지해서 사진 찍을 맛이 너무나 나서 예술혼 끌어왔잖아여 연남동 디저트 카페 ’해피니스인어데이‘ 재생 0 좋아요 0  연남동 디저트 카페 ’해피니스인어데이‘ 음악과 함께 디저트 먹으니 너무 좋았던 주말.. 화장실 앞에 거을 있어서 찍었고요..안 쪽 공간에서도 찍었고요.. 그저 거울만 보면 찍는다.. 이벤트 쿠키 4개 주문하면 1개 서비스로 주는 이벤트 진행 중이래요! 다들 놓치지 마시라요 포장은 당연 가능!! 포장지 넘 졸귀쥬ㅎㅎㅎ 해피니스인어데이처럼 해피한 주말이었댜"
해피니스인어데이-연남동카페 디저트맛집 추천,"분위기맛집 연남동 디저트맛집 해피니스인어데이 안녕하세요오 맛집 핫플레이스 많기로 유명한 홍대에서 디저트맛집을 발견했습니당 ""해피니스인어데이 ""라는 신상카페인데요 인천에서 유명한 디저트카페 너티브루키의 세컨브랜드인데 더 다양한 디저트를 선보이기위해서 오픈한곳이라고합니다 검증된 디저트맛집이겠쥬?ㅎㅎㅎ 해피니스인어데이 위치:서울 마포구 동교로46길 7 201호 전화번호:0507-1439-5023 영업시간:매일 12시~21시(매주 월요일 Off) 50m © NAVER Corp. 해피니스인어데이 서울특별시 마포구 동교로46길 7 201호 매장입구 분위기있는 소품들로 아기자기하게 꾸며놓으신공간 들어서자마자 베이킹냄새가 솔솔~~💜 Oh..이런카페 보셨나용 카페로비 가운데에 거실같이 쇼파,테이블이 놓여있어서 친구집이나 집들이초대받아 온거같앗어요 😃 쇼파쿠션까지 비치되어있다능 사장님 인테리어 센스감각👍 테이블간 간격도 넓어서 친구랑 도란도란 얘기하기도좋고 핫플레이스 카페라고 가보면 너무 왁자지껄해서 분명 분위기맛집이긴한데 옆에 대화소리가 다들려서 곤란했던적이 있었는데요 해피니스인어데이에서는 그럴일 없숨댱 >< 연예인 친필사인도 있었어요!! 카페 음료메뉴판 해피니스인어데이는 연남동디저트맛집으로 소문났는데 음료종류도 다양했어요 여름철에 마실수있는 시즌메뉴(복숭아)도 준비되어있답니다 🍑 Next image 해피니스인어데이의 특징 *최고의 재료만을 엄선해서 모든 디저트를 수제로 만들고 있는 디저트카페 *유지방함량이 높아 풍미가 뛰어난 발효 고메버터 *청정지역에서 유기농법으로 재배된 유기농 밀가루 *카카오 함량이 높은 깔리바우트 *발로나사의 초콜렛 *디저트 4개이상 구매시 수제쿠키 1개 추가증정 베이킹에 대해 잘알못이라 재료이름들이 어려워서 메뉴판을 자세히 들여다봤는데 재료 하나하나 고급재료를 사용해서 직접 만드신다고 하셨어요 일반 시제품으로 사먹어도 맛있는 베이커리인데 버터는 고메버터, 초콜렛은 발로나사의 초콜렛,깔리바우트등등 좋은재료로 만들면 얼마나 더 맛있을까요!? 재료값도 비쌀텐데 음료나 디저트가격은 가성비가 있는 편인거같아요 기대기대🤤🤤 해피니스인어데이-연남동카페 디저트맛집 추천 (1) 재생 0 좋아요 0 00:00 00:04  해피니스인어데이-연남동카페 디저트맛집 추천 (1) 쇼케이스에서 디저트를 고르다가 결정장애와서 사장님이 차분하게 기다려주셨던 ,,,ㅎㅎ너무 먹고싶은것도많고 맛잇어보여서 뭘골라야하는지모르겠엇어유 수제쿠기맛집이니만큼 쿠키류도 골라야하고 평소에 환장하는 스콘,케잌,떠먹는케잌, 요즘유행하는 버터바까지..💙 충분히 고민한끝에 저희가 고른 메뉴는요!! 복숭아 에이드 아쌈 밀크티 옥수수치즈케이크 오레오 스모어쿠키 플레인 스콘 주문완료하고 카페곳곳을 구경했는데 주문대앞 로비쪽 말고도 안쪽에 은은한 조명이있는 비밀공간같은 테이블 룸 있었어요 감성템 물결거울도 갖고싶던건데 탁자위 조명도...!! 벽면 포스터도, 스피커도 카페감성제대로💚 포토존거울이 두개나있어서 두곳다 사진남겨두긔 ㅎㅎㅎㅎ 저희는 환한 통창으로 내려다보이는 창가쪽 자리에 앉아서 도란도란얘기하고있으니 사장님께서 직접 가져다주신 한가득 담긴 쟁반 ㅎㅎㅎ 고를때 너무많은가..? 고민이었는데 시켜놓고보니 너무 잘한선택이었다능 옥수수치즈케잌은 해피니스인어데이에서 처음보는 디저트였는데 고르지않을수가 없었고 오레오 스모어쿠키는 오레오 조각이아닌 한개 통으로 꼽혀서 가운데 마시멜로우 핵쩔었고,, 플레인스콘은 평소 스콘에 환장하는터라 필수템이었어요 ㅋㅋㅋㅋ 암튼 디저트 많이먹어볼려고 ,,가 아닌 다 이유가 있어서 고른메뉴들🤤🤤 음료 복숭아에이드는 설명그대로 새콤달콤달달 저두 한입 마셔봤는데 달콤한 복숭아청이 하루종일 여름더위로 지쳐있던 저를 기분좋게해주는 맛이랄까 에이드 특성상 톡!쏘는감보다는 적당한 단맛에 적당한 청량감이 딱좋았답니다 아쉬운게있다면 여름시즌메뉴인거..ㅠㅠ😭 요거요거 다음번올때도 있었음좋겟는뎅 여름이 지나가기전에 또 와야겟어유 아쌈밀크티 는 제가고른 메뉴인데 당도가 적당한 얼그레이 밀크티 라고 하셨어요 얼그레이향이 진짜 깊게 났는데 제가 마셔본 밀크티중에 젤로 진~~했답니다 밀크티베이스에 아쌈향이 너무잘어울렸어요 음료 재료 또한 고급이라서 이유있는맛 이집 밀크티..찐맛집이에요💙 디저트 오레오 스모어쿠키 4.5 옥수수 치즈케이크 8.0 플레인스콘 3.5 특히 젤 처음먹엇던 옥수수치즈케이크에 반했는데요 옥수수빵은 먹어봤어도 케잌은 처음💙 옥수수크림으로 자칫 느끼할수도 있을 케이크가 마지막 한입까지 느끼함 제로!! 바삭바삭한 크런키 쩔엇던 특별한 케잌이었어요 앞,뒷,옆쪽 포크로 떠먹을때 다 식감이다르고 은은하게 풍겨오는 옥수수향이라서 더좋았어용 해피니스인어데이-연남동카페 디저트맛집 추천 (2) 재생 0 좋아요 0 00:00 00:00  해피니스인어데이-연남동카페 디저트맛집 추천 (2) 곰돌이 초도 너무앙증맞아서 이거 아까워서어찌먹지 했지만 한쿱 올려진 아이스크림과 함께 호로록💙 중간중간에 치즈속에 콘도 들어있어서 씹는식감 자연그대로의 옥수수맛 더 살려주고~~~💜 플레인스콘도 그냥먹어도 맛있는데.. 라즈베리잼과 함께 가져다주셔서 행복했어요 라즈베리향 꾸덕한잼 맘에들어서 제품물어보고싶엇는데 까묵 ㅋㅋㅋ 다음번 갈때 여쭈어봐야겠어효 오레오 스모어쿠키는 배불러서 포장요청해서 집으로 컴컴 4+1이라는 수제쿠키증정이벤트도 진행중이라 다음번 방문할땐 선물포장요청드려야겠어유💜 해피니즈인어데이 보기만해도 기분좋아지는 굿즈스티커에 사장님께 챙겨가도되냐고 여쭈어보고 한개 가져왔어용 ㅎㅎ헿헤 집에서 살짝 따끈하게 데워먹었는데 아침에 아아랑 같이먹으니 황홀한맛 가운데 마시멜로우가 쭉쭉 늘어나서 엄청 쫀쫀했땁니다 ㅎㅎ 쿠키 고를때까지만해도 크림인줄알았는데 역시 특별한 수제쿠키 맛집 💙 #해피니스인어데이 전체적으로 투머치하게 달지도않으면서 고급재료로 고소한 향도 기가막혔던 #해피니스인어데이 데이트맛집으로도 추천합니당💜 핫플홍대에서 연남동카페맛집 발견해서 기분이가 좋슴니다>< 디저트 종류도많고 하나하나 다맛있어서 아래의 인스타그램으로 먼저 구경하고가시는거 추천드립니다 👍💜 연남동 디저트 카페 해피니스인어데이 (HID)(@hid_yeonnam) • Instagram 사진 및 동영상 팔로워 812명, 팔로잉 64명, 게시물 59개 - 연남동 디저트 카페 해피니스인어데이 (HID)(@hid_yeonnam)님의 Instagram 사진 및 동영상 보기 instagram.com 본 포스팅은 업체로부터 서비스를 제공받아 솔직하게 작성된 글입니다 #해피니스인어데이#홍대카페#연남동카페#연남동핫플#연남동디저트맛집#연남동카페추천#연남동디저트#연남동분위기좋은카페#서울카페"
