title,content
연남동 한식 디저트 카페 [ 믜요 ],"연남동에 위치한 한식 디저트 카페 믜요 인스타그램 릴스에서 보고 저장해두었다가 가보았습니다 믜요 서울특별시 마포구 동교로 256-10 2층 예약제로 운영된다고 하는데, 차와 과자가 준비되는 다과상이 두 종류 준비되어 있어요 👉 다정한 세트 (24,000원) 차와 다과 여섯 종류 - 화과자, 개성주악, 개성약과, 강정, 양갱, 과일정과 1:00, 1:30, 3:30, 4:00, 6:00, 6:30 👉 아담한 세트 (18,000원) 차와 다과 세 종류 - 개성약과, 호두알양갱, 곶감쌈 1:00, 3:30, 6:30 월요일은 휴무이고, 1인 1주문, 90분 매장이용 가능하니 참고하세용 찾아가는 길은 조금 헷갈렸지만 지도를 잘 따라가서 건물 계단을 오르면 보인답니다 2층이라고 되어있지만 3층이 아닌가 싶은... 카페 내부는 굉장히 아담하지만 분위기가 차분하고 너무 좋았어요 테이블 세 개와 옷, 가방을 걸 수 있는 행거가 있습니다 자리를 잡고 앉으면~! 웰컴티로 냉침한 홍차(였나..?)를 주십니다 밖이 너무 더웠어서 한 모금 홀짝여보고,, 메뉴판에서 차를 하나 고릅니다 고르는 데 시간이 오래 걸렸습니다,,,, 저는 21冬 탄배 홍수 오룡, 친구는 19冬 매산 금훤을 시켰던 거 같습니다 드디어 나온 차~! 먼저 냄새를 한 번 맡아보라고 하셨는데 구수한 냄새가 나서 만족스러웠습니다 😚 다음으로 나온 다과~!! 꺅 너무 예쁘고.... 감동적입니다 데려간 친구도 너무 좋아해서 뿌듯했지 뭐예요 흑임자 화과자..?와 현미 강정, 개성 모약과, 호두 곶감 쌈, 산딸기 양갱(왼쪽 사진)이 있구요 호지차 개성주악으로 추정되는 것(오른쪽 사진)은 인당 1개씩 제공됩니다 개인적으로 흑임자 화과자가 맛있었고, 곶감은 원래 좋아하고🧡, 개성 모약과는 좀 달았습니당 중간에 차 다 마신 것 같으면 한 번 더 채워주시고, 안에서 두 시간은 있었던 거 같은데 나가라고 눈치 주시거나 하시지 않아서 감사했어요,, 아마도 다음 시간대 예약손님이 없었던 거겠죠,,,? 덕분에 얘기 잘 나누다 나왔어요~~~ 조용한 분위기라 이야기 나누기도 좋고 메뉴가 한국스러워서(?) 외국인 친구 데려가기도 좋고 믜요 추천해요 !!"
[서울/연남] 차와 과자가 있는 연남동 찻집 믜요,"한식 다과를 좋아한다는 친구가 링크를 하나 보냈다. '믜요'의 다과 예약 링크였는데, 예약까지 해야하는 찻집은 처음 가보는지라 기대를 잔뜩 안은 마음으로 방문했다. 믜요 서울 마포구 동교로 256-10 2층 영업 시간 : 13시~ 20시30분(매주 월요일 휴무) 여기가 맞나...? 싶었는데 골목 제일 안쪽으로 들어오니 작게 써진 이름이 보였다. (작게) 옆으로 나있던 계단을 따라 올라가면 되는데 올라가면서도 여기로 올라가는 게 맞아? 하면서 주변을 두리번거렸더니 아랫층 식당 사장님과 뻘쭘하게 눈을 마주치기도. 의심하지 말고 3층까지 쭉 올라가면 된다~ 내부는 그리 넓진 않지만 (바 자리까지 총 4팀을 받을 수 있는 공간이었다.) 깔끔한 화이트-우드 톤으로 되어있었다. 왠지 목소리를 낮춰야할 것 같아 조용히 있었는데 꼭 그러지 않아도 괜찮았다. 자연스럽게 이야기하는 분위기. 테이블 셋팅도 깔끔하게 되어있다. 우리는 미리 예약한 다정한 세트로 즐기고 왔다! 화과자, 개성주악, 약과와 복숭아 양갱 등 다양한 디저트와 차를 같이 즐길 수 있는 세트다. 가격은 인당 24000원. 예약금 만원을 결제해서 현장에선 차액만 결제했다. 아담한 세트는 차는 동일하지만 과자의 종류가 더 적어진다. 사람이 없을 경우엔 미리 예약을 안 했어도 아담한 세트로 매장 이용이 가능한 것 같다! 식전주처럼 나오는 식전차? 녹차맛이 났다. 과자의 종류는 월마다 달라지는 것 같고 선택한 세트에 따라 정해진 과자가 나온다. 차는 원하는 차로 선택 가능! 다른 종류의 차를 또 마시고 싶으면 7천원을 추가해서 마실 수 있다고 한다. 친구는 고산 우롱차, 나는 감국차를 주문했다. 좌 우롱차, 우 감국차 차는 다 마시고 더 필요하면 한 번 더 리필이 가능하다. 따뜻하게만 마실 수 있을 줄 알았는데 시원한 차도 가능하다. 감국차는... 텁텁하지 않고 깔끔하고 개운한 맛이었는데, 가벼운 느낌이 좋으면 추천할 법하다. 향도 좋았다. 전체적인 세팅은 이런 식! 작은 컵에 차를 따라서 마시고, 인당 하나씩 주는 개성주악과 큰 플레이트에 나오는 여러 과자들. 양갱은 제철인 천도복숭아?를 사용해 만드셨다고 한다. 나뭇잎으로 정성스레 플레이팅도 해주시고 디저트 생김새도 너무 예뻐서 먹기가 아까웠다. 개성주악의 위엔 말린 금귤이 올라가 있었는데 달달한 중간에 상큼한 맛이 나서 좋았다. 흑임자 서리태 콩 다식은 아주 꾸~덕해서 작지만 잘라서 먹는 게 좋을 듯. 맛있는 과자와 차를 먹고 마시면서 비가 오는 창가 옆에서 친구와 도란도란 이야기할 수 있는 믜요. 분위기도 맛도, 구성도 너무 좋아서 또 와도 괜찮다고 생각하지만 양이 꽤나 많다보니 다음에 온다면 아담한 세트가 나을 것 같다는 생각도 하고... 무엇보다 단 것들을 계속 먹고 있으니 아무리 차를 마셔도 입 안이 계속 달아서 조금 남기고 왔다ㅠ 그치만 맛은 정말 좋아 단 걸 좋아하는 분들이나 전통 과자를 좋아하는 분들이라면 가볼만한 것 같다. 인기가 많아 직전에 예약하려고 하면 자리가 없을 수 있으니 미리 예약을 해놓는 걸 추천한다! 우리는 한 2~3주 전쯤에 했던 것 같다. 믜요 서울특별시 마포구 동교로 256-10 2층 #연남동카페 #연남동찻집 #홍대찻집 #연남동카페추천 #개성주악 #전통다과"
[연남동/카페] 믜요,안녕하세요! 저는 원래 차 종류를 즐겨먹진 않는 편인데요. 그래도 전통디저트에 관심이 많아서 찾아보던 도중 발견한 곳이랍니다 믜요 서울특별시 마포구 동교로 256-10 2층 🕑 영업시간: 1시~8시 반(월 휴무) 💡 네이버 사전예약으로 방문하셔야 해욥 믜요는 골목길에 있어서 찾기 좀 어려웠어요. 그래도 들어가면 딱 이런 뷰가 맞이해준답니다 주말 1시 반 예약이였는데 한테이블만 있더라구요 저희는 다정한 세트(2인) 을 예약했구요 차는 여기서 고를 수 있어요. 도향우롱 아이스 복숭아향이 향긋하게 나는게 아이스로 먹으니 좋더라구요 밀크티 이것도 맛있었어용 이렇게 리필해서 먹을 수 있어요 짠..! 이거 주인분이 하나하나 플레이팅 해주시는 건데 너무 정갈하지 않나요💕💕 완전 대접받는 느낌이였어요 요즘 유행하는 개성주악 맛있었구요(맛표현을 잘 못 함) 이게...견과류를 유자랑 섞어서 홍시에 넣은건데 맛있었어여 ^_^.... 호두정과 요놈 맛도리~~~~ 의외로 저 뷴홍색...이름이 뭐더라..화과자? 저게 진짜 맛있엇어요. 약간 넘 달지않고 기분좋은 단맛! 약과는 흑임자가 들어가서 완죤 고소한 맛!! 다들 전통디저트 먹으면서 힐링하셔용
연남동 찻집 전통디저트를 파는 믜요,"얼마전 인스타를 보다가 너무 예쁜 카페가있어 친구랑 다녀왔다 믜요 서울특별시 마포구 동교로 256-10 2층 믜요 ⏰영업시간 : 매일 13:00 - 20:30 (매주 월요일 휴무) 📞연락처 :0507-1305-5740 📍위치 : 홍대역 3번출구 도보 10분 🔔예약 : 네이버 예약 (매장이용시간 90분) 아담한세트 1인 18,000원(티+디저트3종류) 다정한세트 1인 24,000원(티+디저트6종류) 간단히 점심을 먹고 4시쯤 다정한세트로 미리 예약 후 방문했다 도착하니 세팅이 되어있었고 테이블은 3개 바좌석 1개 이렇게 있었다 잔잔한 음악도 나오고 인테리어도 깔끔하고 예뻐서 저절로 마음이 힐링되는 느낌이들었다 도착하면 바로 웰컴티를 내어주신다 무슨 우롱차라고 하신거같은데,,(까먹었다^^;;) 깔끔하고 호불호 없을것 같은맛이었다 그리고 티를 하나씩 고를 수 있는데 예전에 백차를 맛있게 마신 기억이 있어서 나는 백차를 친구는 도향우롱차를 주문했다 시원한걸 먹고 싶어서 아이스로 주문했는데 향을 맡아볼수 있도록 같이 준비해주셨다 잔도 너무 예쁘고 차도 깔끔하고 맛있었다 친구가 주문한 도향우롱차는 그건 그냥 복숭아 향이 가득나면서 복숭아차 같았다 진짜 맛있다!! 그리고 다과도 같이 나왔는데 와ㅏㅏ 너무예뻐서 깜짝 놀랐다 나뭇잎 데코도 너무 센스만점인것 같다 다과나오고 사진만 한 20-30분찍은거같닼ㅋㅋㅋㅋ 조명도 예뻐서 사진잘나온다,,💕 다과 라인업은 시즌마다 다른것 같은데 가을이라 그런지 이번엔 밤과 대추로 만든 디저트가 많았다🌰 내가 방문했을때는 (11월 초) 화과자,개성약과,대추주악,보늬밤 양갱,율란,피칸강정 이렇게 구성이 되어있었다 화과자만 1개고 나머지는 다 두개씩이다 피칸강정은 눅눅해 질 수도 있다고 제일먼저 먹는걸 추천해 주셨다 근데 한입먹고 진짜 깜-짝 놀랐다!!! 바삭바삭 진짜 너무 맛있어서!!😲 자꾸 생각나는 맛이다 이것만 따로 판다면 살맘이 있을정도로 맛있었던 피칸강정 율란은 진짜 ‘밤‘ 맛이었다 계피가루도 밑에 살짝 뿌려져 있어 계피맛도 같이난다 부드럽게 으깬 밤에 계피가루 섞은맛이다 보늬밤양갱은 딱 예상한 그맛 달달한 양갱에 보늬밤이 들어간맛 ㅎㅎ 보늬밤이 큼지막하게 들어있다 약과는 고급스러운 대추약과맛이었고 화과자는 진짜 오랜만에 먹어보는데 겉에 피가 쫀득쫀득하고 안에는 팥과 곶감다진게 들어있었는데 진짜 달았다 ㅎㅎ 모든 디저트가 다 달달하긴 했는데 화과자가 젤 달았던것 같다 근데 화과자 위에 올라가 있는 단풍 두개 진짜 너무 귀여운것같다 딱딱한 데코인줄알았는데 크림이었다 단풍크림..! 어떻게 만드신걸까 넘 궁금하다 그리고 요즘 유행인 내가 갠적으로 젤 기대했던 대추주악을 먹었다 개성주악은 첨먹어보는데 대추가 들어가서 이름이 대추주악인것 같다 엄청 쫀득쪽득한 도너츠 같은 맛이었다 은근 중독성있는맛인것같다 갠적으로 피칸강정>대주주악>보늬밤양갱 율란>개성약과>화과자 순으로 맛있었다 차는 차갑게 한번 따뜻하게 한번 먹었는데 마지막에 따뜻한 차를 마시니 소화가 되면서 달달함이 싹 내려가고 속이 풀리는 느낌이었다 다만 티팟이 유리라 보온성이 없다보니 금방식어서 그건 좀 아쉬웠다 개인적으로 백차는 따뜻한게 도향우롱차는 차가운게 더 맛있었던것 같다 배가 불러서 다 먹지는 못했지만 이렇게 맛있는 전통디저트를 맛볼 수 있어서 너무 좋았고 이용시간이 90분이라 사진찍고 얘기하다보니 금방시간이 지나버려 아쉬웠다 나중에 또 생각날 것 같은 너무 맘에 들었던 티카페였다"
연남동 맛집 카페 믜요,믜요 서울특별시 마포구 동교로 256-10 2층 날씨가 좋아서 경의선숲길을 찾는 사람들이 많아지도 있는데요! 얼마전에 SNS를 통해서 한식 다과를 세트로 팔고 있는 카페 '믜요'라는 곳을 알게 되었어요. 100% 예약제라 네이버지도에서 검색해서 예약이 필요한데 주말은 예약이 어렵더라구요 ㅠㅠ 지난 주에 혹시 몰라서 예약 안하고 엄마랑 같이 갔다가 구경만하고 못먹고 나왔어요 ㅠㅠㅠ흑 다음 주말엔 기필코 성공해서 리뷰를 쓰리라..!ㅎㅎㅎ
[서울 찻집] 떴으면 좋겠는데 안 떴으면 좋겠는 연남동 찻집 “믜요” -전통 디저트 티코스 감성 있게 즐기기,"안녕하세요! 오늘은 제 첫 찻집 경험을 함께 나누고자…! 리뷰를 남겨 봅니다😚 당연히 내돈내산입니답.(광고 아무도 주지 않음) 믜요 13:00 - 20:30 (월요일 정기휴무) 차와 과자: 다정한 세트(2인) 1인당 24,000원 (예약금 O) 믜요 서울특별시 마포구 동교로 256-10 2층 가게 크기는 아담한 편이에요! 테이블 3개 + 바 형식? 으로 의자 4개 정도가 있는데 네이버 예약하시면 웨이팅 걱정 없이 이용하실 수 있어요😚 참고로! 최대 1시간 30분 이용 가능이에요 네이버 예약 시에 나와 있던 다과 메뉴랑은 약간 달랐는데 저는 오히려 좋았어요! 저 가운데 놓여 있는 검은색 종이가 차 메뉴예요 (방금 확인해 보니까 달마다 차 메뉴도 좀 바껴요 대박 정성) 1인 1음료로 고르실 수 있어요 아 그리고! 원래 그런지는 모르지만 차로 주문하니까 따로 추가금 없이 리필해 주셨어요! 차가운 차와 뜨거운 차 둘 다 경험해 볼 수 있어서 좋았던,,, 이건 기본으로 제공되는 웰컴티예요 사실 특별한 맛은 안 나요 향이 납니다! 근데 센 향은 아니고 은은해서 호불호는 딱히 없을 만한…?🤔 찻집 가서 유기농 녹차 라떼 주문한 여자 나야 나… 이 날 아쉽게도 아이스티는 안 된다고 하셔서 녹차 라떼로,,, 맛은 건강한 녹차 라떼 맛이에요 말 안 해도 유기농 녹차인 게 느껴지는 건강한 녹차맛입니다 지금 생각해 보니까 안 달아서 그렇게 느꼈나 봐요 진함 정도는 막 진하지도 연하지도 않은 중간! 친구는 백도향 우롱차였나…? 둘 다 차는 처음이라… 초보자여도 괜찮을 만한 걸로 선택했어요 얘도 맛에 특별한 건 없고 향이 있어요! 은은하게 복숭아향이~ 사실 원래 차란 게 향을 음미하는 거긴 한데. 이 퀄리티… 실화인가…? 화과자만 한 개고 나머지는 다 최소 1인 1개씩 주셨어요! 사진에는 없지만 최고 1등은 피칸 강정입니다… 또 먹고 싶어서 네이버에 검색도 해 봄. 약과는 검은깨 맛이 생각보다 많이 나요!!! 단 거 많이 못 먹는 할미 입맛에 매우 적합. 개성주악,,, 첨 먹어봤는데요,,, 기름지면서 쫀득한 약과맛이 나요 근데 덜 달아요!!! 포크로 잘 안 집히니 손으로 먹으라고 물티슈도 주셨어욥(🥺) 곶감인데 안에 다양한 거(기억 안 남) + 유자가 들어갔는데 개인적으로 유자는,,, 빼는 게 나을 것 같아요 유자향이 생각보다 묘하게 안 어울렸달까요? 그래도 그럭저럭 괜찮은 맛! 화과자!! 제가 화과자를 처음 먹어봐서 비교군이 없긴 한데요 원래 안 쫀득한가요? 저건 부드러웠어요 안에 백앙금 왕왕 맛있! 안에 주황색은 곶감? 과일 정과? 느낌…? 고구마양갱!!! 이런 말 어떨지 모르겠는데 고구마맛은 안 나고 고구마 식감이 느껴져요(?) 근데 친구도 인정했어요. 먼 소리야 하다가 먹고서 바로 인정함. 찻집은 처음이었는데 차보다 다과에 홀렸습니다… 무엇보다 넘 친절하셔서 좋고!! 달마다 다과랑 차 메뉴가 조금씩 달라지는 것도 진심이 느껴져요 근데 다과가 차랑 어울리게 단맛이 느껴지는 편은 아니라서 단 거 좋아하시는 분들에게는 아쉬울지도 모르겠어요…! 그래도 카페에 질리셨다면 찻집도 한 번 도전해 보세용✨ 서울 연남동 찻집 믜요 홍대 차 다과 개성주악 곶감 화과자 피칸깅정 고구마양갱 깨약과 흑임자 검은깨 유기농 녹차 말차 라떼 핫플 핫플레이스 카페 디저트 추천 서울 여행 코스 추천 이웃 서이추 환영"
마포 연남동 홍대 새로오픈 믜요 카페 위치 메뉴 가격 주차 주소 영업시간,"믜요 서울특별시 마포구 동교로 256-10 2층 마포구 동교로 연남동 홍대 에 위치한 새로오픈한 믜요 카페 영업 시간은 13시 00분에 시작하고 20시 30분에 영업종료시간이야 아래는 사장님이 가게를 소개한 글이야 믜요는 한식디저트를 기반으로 차와 어울리는 다과를 만듭니다. 좋은 재료를 선별하여 직접 손질하고 하나하나의 과정에 정성을 드립니다. 작고 요란하지 않는 공간에서 다과와 차,그리고 벗들과 함께 서로의 이야기들로 채워지는 평온한 한날의 우리를 그려보세요-ㅠ차와과자. 함께 하기 좋은날_믜요 차와 과자 개성주악 수제 흑임자 양갱 등을 판매하고 있어"
연남동 카페 | 차분하고 조용한 분위기에서 다양한 차와 다과를 즐길 수 있는 카페 “믜요”,"띵수 I 걸어서카페속으로 I 띵카소(@jin_s._.o) • Instagram 사진 및 동영상 팔로워 1,664명, 팔로잉 481명, 게시물 721개 - 띵수 I 걸어서카페속으로 I 띵카소(@jin_s._.o)님의 Instagram 사진 및 동영상 보기 instagram.com 띵하👋 안녕하세요~ 띵카소입니다. 오늘은 커피보다 다양한 차와 직접 만드시는 다과를 즐길 수 있는 연남동 신상카페를 소개해 드리겠습니다. 100% 예약제로 운영되며 차를 선택하면 차와 어울리는 미니 다과를 페어링해주는 카페입니다. 좌석은 바테이블과 3인 테이블1개,2인 테이블 2개로 아담한 공간으로 이루어져 있어요. 햇살이 잘 들어오는 바테이블 자리도 정말 좋았어요. 넓지는 않지만 아담한 공간과 분위기에 맞게 인테리어 되어 있어서 너무 좋은 공간이에요 북적이는 연남동 카페거리 사이 조용하고 차분한 분위기의 카페를 찾은 것 같아 너무 좋아요. 방문하시면 시원한 웰컴티를 준비해 주십니다. 메뉴판에 있는 다양한 차 중 한가지를 선택하면 됩니다 아! 여기는 찻 잔도 직접 고를 수 있어요~ 저는 아담한세트 (차 1종+미니다과 3종)을 주문했어요. 따뜻한 차를 먹으니 기분이 차분해지는 느낌을 받아 오랜만에 차분하게 즐길 수 있던 시간이였어요. 직접 만드시는 다과도 정말 차와 잘 어울리고 담백하니 맛있었어요. 아래 약과는 서비스로 챙겨주신 다과인데 기존에 알고 있던 약과랑은 전혀 다른 맛이여서 정말 신기했어요~ 오랜만에 커피가 아닌 차를 즐길 수 있는 좋은 공간을 만나서 정말 좋았어요 다음에는 어떤 공간을 소개해 드릴지 정말 기대가 되네요ㅎ 믜요 서울특별시 마포구 동교로 256-10 2층 📍 서울 마포구 동교로 256-10 2층 ⏰ 오후1시~ 20시30분 ❌ 매주 월요일 휴무"
연남동 _ 믜요 Miuyo 다과 한상차림 카페,". . . 오늘은 연남동 구석에 위치한 "" 믜요 "" 입니다 :) 차분히 한상차림 다과와 차를 즐길 수 있는, 쉼이 필요할 때에 찾기 좋은 곳. 온전히 나와 , 시간을 보낼 믜요를 소개할게요 ! 믜요 MiuYo 서울 마포구 동교로 256-10 2층 매주 월요일 정기휴무 ( 방문시 참고해주세요 ) 영업시간 _ 13:00 ~ 20:30 ( 화-일 ) 100% 예약제 , 주차 불가능 구석진 골목을 쭉 따라 들어가면 , 3층 같은 2층에 위치한 믜요가 있습니다. 100% 예약제로 운영하시고 , 사장님꼐선 예약에 맞춰 다과를 준비하시기에 방문 시 네이버로 꼬옥 예약하고 가세요 :) 저는 5월에 한번 , 6월에 한번 총 2번 방문했습니다. 5월에 첫 방문했을적엔 혼자 방문했고 , 6월에 재방문시 친구와 함께 방문 했습니다. 예약시 예약금 선불결제 ( 인당 5천원 ) 있습니다 ! 매장은 크지 않아 3인석 테이블 하나 , 2인석 테이블 둘 , 바 자리가 마련되어 있습니다. 가구를 주로 목재를 사용하시고 , 모던한 분위기의 인테리어인지라 내부 자체의 분위기만으로도 차분하고 편안한 느낌이 들어요. 조명도 은은하고 세지 않아 눈도 편한 느낌입니다. 5월과 6월은 주문한 세트 자체가 달라 , 비교하면서 알려드릴게요 :) 5월은 아담한 세트 , 6월은 다정한 세트를 주문 했습니다. 아담한 세트는 한식다과 3종류를 다정한 세트는 한식다과 6종류를 즐길 수 있어요. 차와 과자 아담한 세트 1인당 : 18,000원 차와 과자 다정한 세트 1인당 : 24,000원 개성주악 (포장상품) 3구 : 9,000원 / 6구 : 18,000원 예약제이기 때문에 , 자리는 준비가 되어 있습니다. 방문하면 사장님께서 따뜻한 미소로 반겨주셔요 ㅎㅎ 자리에 착석하면 사장님이 시원한 녹차를 내어주십니다. 가볍게 리프레쉬 하기 좋은 맛이었어요 ! 그리고 마실 차나 음료를 고르면 다과와 함께 준비해주셔요 음료도 좋지만 , 믜요에선 차를 마시는 걸 추천드립니다 ! 따뜻하게도 , 차갑게도 가능해요 . [ 오월의 과자 ] 잣가루를 버무린 개성약과 , 호두 팥 양갱 , 곶감 쌈 제가 주문한 차는 ' 매산 금훤 ' 입니다. 청아한 단맛이 매력적인 대만의 청향 우롱차 라고해요. 유향과 꽃향에 산뜻해지는 기분을 준다고 하여 주문해봤습니다 ! 일단 , 식기들이 정말 귀엽고 예뻐서 눈길이 갔어요. 과자를 먹는 꼬치하나 까지도 모두 도예작가님들의 작품 ! 사장님의 찬장을 구경하고 싶을 정도랍니다 ,, ♥ 과자들은 하나같이 친숙한 맛이고 단맛이 세지 않아요. 사장님께서 손수 하나하나 만드시는 과자이다보니, 맛도 , 플레이팅에도 정성이 가득 들어간 느낌입니다 ! 처음엔 차를 차게 마셨는데 다 마시니 , 사장님께서 따뜻하게도 한번 더 우려주셔요 ! 차도 커피처럼 따뜻하게 차게 먹었을때 느낌이 정말 다르더라구요. 따뜻하게 즐길 때가 차의 향과 풍미가 한껏 더 우러나고 풍부해요 :) [ 유월의 과자 ] 화과자 , 개성 모약과 , 호지차 개성주악 , 산딸기 양갱 , 현미 강정 , 호두 곶감 쌈 6월에 제가 주문한 차는 ' 탄배 홍수 오룡' 이에요 ! 탄배홍수오룡은 찾아보니 채엽부터 배화까지 아주 긴 시간동안 많은 부분에서 신경써야 하는 차 종류 중 하나라고 해요. 만들기 까다로운 차인 만큼 맛도 정말 좋았어요 🥺 고소하고 , 화과향이 맴돌며 붉은 과실의 단 향까지 사장님의 테이스팅 설명을 완벽히 이해가능한 맛입니다. 유월의 과자 중 정말 맛있었던 과자를 꼽자면, ' 호지차 개성주악 ' 제가 개성주악 유행하기 전부터 , 접하고 먹어본 사람으로서 제일 맛있었던 개성주악이에요. 개성주악은 자칫하면 기름진 맛이 너무 강하거나 조청시럽의 단맛이 깊숙히 배어 단맛이 강하거나 제게 있어서 그냥 도너츠와 별 다르지 않은 맛이었거든요. 그렇지만 , 믜요의 개성주악은 정말 맛있었어요. 호지차의 향과 단맛이 은은하게 감돌고, 기름지지 않고 파삭하며 쫀득한 개성주악 제 인생 개성주악이라고 이야기 할 수 있어요 ! 사장님께서 개성주악만 따로 판매하시는 이유를 알 것 같던 ,, . . . 매장이 크지 않은 편이지만 , 그래서 더욱 힐링 되는 것 같아요. 크지 않은 공간에서도 잔잔한 음악과 함께 누군가와 함께 차분히 얘기하며 차와 다과를 즐길 수 있고, 혼자서도 그 시간을 온전히 보낼 수 있는 연남동의 "" 믜요 "" 사장님은 인스타그램을 운영 중이신데 , 게시된 사진들을 보면 여태껏 보지 못한 한식다과의 정점을 보는 것 같아요. 믜요:다과점 茶菓店(@muiyo___) • Instagram 사진 및 동영상 팔로워 624명, 팔로잉 210명, 게시물 84개 - 믜요:다과점 茶菓店(@muiyo___)님의 Instagram 사진 및 동영상 보기 www.instagram.com 쉼이 필요할때 한번 방문해보시는 건 어떨까요 ? 매 달마다 준비되는 다과도 틀리기에 달마다 방문하는 재미도 있을 것 같아요 😊 믜요 서울특별시 마포구 동교로 256-10 2층 광고,협찬 : uj1828@naver.com instagram : https://www.instagram.com/____youz7/"
