title,content
연남동 스트뉴 어딜가도 사람 많은 연남동에서 한적한 여유를 느낄 수 있는 조용한 카페,"연남동 스트뉴 0507-1353-1678 단체석, 주차, 포장, 무선 인터넷, 반려동물 동반가능 매일 10:00 - 22:00 50m © NAVER Corp. 스트뉴 서울특별시 마포구 성미산로23안길 19 1층 핫플이 많은 연남동, 어딜가도 사람많고 웨이팅이 기본인 동네인데 오랜만에 한적하고 여유로운 카페 발견. 따뜻하고 노곤노곤하고, 고양이 식빵굽기 딱 좋은 그런 날씨. 카페가 전체적으로 통유리창이어서, 햇살이 쏟아져 들어옴. 햇살맛집 카페를 찾는 다면 꼭 이 카페를 선택하셔라. 카페 어느 자리나 깊숙이 햇살이 들어온다. 오픈런으로 가서 사람이 아무도 없었다. 점심시간 쯤까지 있었는데도 아무도 안 오는 걸 보니 북적이고 사람 많은 카페는 아닌 듯 하다. 연남동 카페 스트뉴 재생 0 좋아요 0 00:00 00:00  연남동 카페 스트뉴 동영상으로 느껴보는 여유로운 카페 스트뉴 카페 내부는 넓은편. 답답하지 않고 시원하게 트여있다. 메뉴 이름은 생각 안남. 근데 커피는 스트뉴의 시그니쳐 메뉴임. 위에 뭐 얹어서 토치로 그을려?준다. 밑에 동영상 첨부 ~ 연남동 카페 스트뉴 재생 0 좋아요 0 00:00 00:00  연남동 카페 스트뉴 달달한 달고나 같은 얇은 막이 커피의 씁쓸함과 어우러져 아주 잘 어울렸다. 커피 싫어 인간인 나도 어느 정도 맛있게 먹었다. 교소도를 막 출소한 사람이 먹는 것 같은 흰 두부 같이 생긴 저 네모의 정체는 치즈케익이다. 점심시간이 맞물려있어서 사진만 찍고 포장해갔는데 실온에 보관했다가 와장창.. 진짜 와장창 녹아버려서 한입먹고 못먹게 되었다. 한입 먹은 평: 진한 우유맛이 느껴지는 녹진한 치즈케익. 맛있었다. 한입밖에 못먹은 후기지만 추천하는 메뉴 ㅠ 그리고 카페 입구에 커다란 전신 거울이 있다. 오오티디 데일리룩 이런거 꼭 남기고 싶어 하는 사람(바로 나)이 좋아할 법한 인테리어 사진 찍고 오세여 따뜻한 햇살과 여유로운 커피를 마시고 싶다면 카페 스트뉴 강추 누가 뭐시기 하는 아이스크림이 유명하던데, 제발 나대신 먹어주세여."
"연남동카페 애견동반카페 애견카페 스트뉴 (스튜뉴,스투뉴,강아지카페)","연남동 끝자락에 있는 스트뉴 라는 카페에요. 스트뉴, 스튜뉴, 스투뉴 등으로 불려요. 카페이름이 어려우면 검색유입이 어렵기 때문에 이름을 쉽고 짧고 간단하게 짓는게 좋아요. 약간만 글자가 틀려도 검색해봐도 안나와..... 마감재를 바르지않은 노출콘크리트 건물이고요. 카페에 사람이 많네요. 작은 입간판이 있고요. 애견동반카페라서 제가 갔던날은 겁나큰 늑대같은 개도 있었어요. 개가 몇번 짖었는데 엄청 무섭더라고요 ㄷㄷㄷ 셀카용 전신거울이 있고요. 아주 이쁘고 음악도 좋고 강아지들 귀여워 카페에요. 강아지들 진짜 귀엽더라고요. 온동네 귀여운 강아지들 다모여서 정모하는 카페인거 같고요. 강아지 많으면 개판될거 같은데 그렇지 않고 테이블간 간격이 넓어서 그렇게 개판되는 느낌은 아니었어요. 강아지들 귀여워서 강아지 없이 온 일반손님들이 아주 남의강아지 열심히 쳐다보는 카페에요. 강아지들이 막 휩쓸고 다닐거같고 그럴거 같지만 다들 차분히 주인님 옆에서 가만히 있더라고요. 대형견이 짖을때는 좀 무섭긴 하더라고요. 그거외엔 불편한 부분은 없었어요. 강아지 주인분들은 사람들이 강아지 계속 쳐다보니깐 약간 불편할수도 있어요. 귀여우니깐 안쳐다볼 수가 없어요... 편하게 음료마시고 동네 골목길 뷰 보면서 대화좀 하다가 쉬다왔어요. 통유리창이라서 앞에 골목길 보는게 정말 시원하게 느껴지고 좋더라고요. 카페는 역시 음악이랑 골목길뷰 보는거죠. 음악 중요하고 골목길 뷰 정말 중요해요. 차분히 골목 보고 있으면 마음이 차분해지고 좋아요. 그리고 남의집 강아지들 귀엽고요. 스트뉴 서울특별시 마포구 성미산로23안길 19 1층"
[연남카페:연남동카페] 조용하고 디저트가 맛있는 카페 스트뉴,"스트뉴 연남 카페 연남 디저트 카페 연남동 카페 연남동 조용한 신상카페 스트뉴 딱 좋음 ♥ 스트뉴 연남동에서 조용하고 예쁜 카페 발견 ღ 서울 마포구 성미산로23안길 19 1층 매일 오픈 10:00 - 마감 22:00 #10시마감카페 T. 0507-1353-1678 맛 ★★★+ ㄴ 피스타치오 티라미수라니 ㅠ 분위기 ★★★+ ㄴ 조용하고 넓고 예쁜 공간, 친절함 ★★★★ 가성비 ★★★ 추천 ★★★+ ㄴ 메인길에서 조금 걸어야하지만 추천 사람들 너무 많지 않은 곳, 조용하고 예쁘고 맛있는 스트뉴 이제는 체력이 없어서 늦게까지 카페에서 계속 떠들 수는 없지만 그래도 10시마감 11시마감 카페를 찾습니다 ㅋㅋㅋ (카페에 여유롭게 오래 있고 싶은 마음) #연남동카페 #연남동디저트 #연남신상카페 #신상카페추천 그러다가 스트뉴를 찾았어요 ! 이름이 살짝 어려움 🤣 연남동 산책길 맨 끝에 약간 동네쪽(?)으로 가는길에 있습니다. 그래서 사람이 별로 없어요 ! 오히려 좋아 🖤 우드한 공간에 자리도 널찍하게 떨어져 있고 낮지 않은 의자, 쇼파자리까지 다양해서 골라서 앉으면 됩니다. 진짜 핫한 금요일 연남동에서 조용한 카페를 찾아서 좋았어요 🖤 #스트뉴 #연남카페추천 매장이 깨끗해서 더 좋았고 나의 @러브 가 약을 먹어야해서 물을 가지러 갔는데 컵이 너무 귀여웠습니다 ㅋㅋㅋ 💖 연남 카페 연남동 카페 스트뉴 벽면에는 디저트 포스터가 있는데 크림이 올라간 디저트들이 하나 같이 다 침샘을 자극하였음. (방금 고기 먹고 온 사람 .. 🙋🏻‍♀️) - 아아 5,000 - 스트뉴 커피 hot 6,500 - 피스타치오 티라미수 8,500 total 20,000원 이제 카페에서 크림 없는 음료 먹기. 아아는 저의 마지막 양심이었습니다 ☕️ [연남카페:연남동카페] 조용하고 디저트가 맛있는 카페 스트뉴 재생 2 좋아요 1 00:00 00:14  [연남카페:연남동카페] 조용하고 디저트가 맛있는 카페 스트뉴 아니 커피 위에 브라운치즈와 크림이 있다 ? 저는 액체위에 치즈 ? 처음 보는 것 같은데요 🧀 두-세입 먹어버렸다. 브라운치즈맛과 부드러운 크림 넘 맛있오 🤎 #스트뉴커피 그리고 피스타치오 티라미수 ㅠㅠㅠㅠ 베라 피스타치오 아이스크림 같은 그런 느낌의 크림이었습니다. 아주 맛있게 먹고 제 아아는 사진을 찍지 않았네요. 아아는 그냥 아아니까요 💚 50m © NAVER Corp. 스트뉴 서울특별시 마포구 성미산로23안길 19 1층 나의 러브 ㅈㅎ 아 0331을 위해 시작과 끝을 그 주말까지도 감동을 줘서 고마워 ♥ 내 옆에 오래오래 있어줘 내가 다 보답하려면 멀었거든 !! 덕분에 잘 살았다는 생각이 든당 ♡ 살옹해 ♡ #홍대맛집 #홍대술집 #홍대카페 2023년은 홍대의 해구나 (1년정도만?) ㅋㅎ [홍대카페:홍대카페추천] 홍대 베이커리카페 오퍼 카페 디저트 최고 오퍼 카페 홍대 카페 홍대 카페 추천 홍대입구 카페 오퍼 카페 디저트 2개 뿌시고 싶다 .. 디저트 맛집 서... m.blog.naver.com [상수술집:홍대술집] 상수 조용한 술집 숨은 맛집 상수 타로야 타로야 상수 술집 상수 이자카야 홍대 술집 타로야 바 형식 이자카야에 알새우칩 안주 🤍 서울 마포구 와... m.blog.naver.com [홍대치킨:상수치킨] 상수 치킨 상수 포차 세븐틴 치킨매니아 왕새우치킨 치킨매니아 상수역점 상수치킨 상수치맥 상수포차 치킨매니아 상수역점 세븐틴을 좋아하시는 사장님 ! 서울... m.blog.naver.com [홍대맛집:홍대라멘] 점심 웨이팅 이츠모라멘 돈코츠라멘 이츠모라멘 홍대 라멘 홍대 맛집 홍대 점심 이츠모라멘 공기밥 무료에 국물 안짜고 좋았음 서울 마포구 와... m.blog.naver.com"
연남동 카페 스트뉴 Soutenu / 안 갈 이유가 무엇인가?,"연남동 카페 Soutenu 스트뉴 아무나 지나다니지 않을 것 같은 연남동 중에서도 끝자락 끝남동 중에서도 구석 그 곳에 새로 생긴 카페 스트뉴 다녀온 지는 꽤 되었는데 이제야 후기를 쓰게 되는구만 가고 싶어서 북마크 해두었었던 연남동 카페 스트뉴 이 때만 하더라도 12월 초여서 매장이 크리스마스 트리로 예쁘게 꾸며져 있었음 요새 내부 추운 곳도 너무 많은데 여긴 따뜻해서 좋았다 연남동 카페 스트뉴 메뉴 커피나 음료 구성도 좋고 디저트도 내가 좋아하는 것들 가득 아메리카노 (5,000원) + 카페라떼 (5,500원) + 밀크티 (6,000원) 주문을 하고 나서 음료를 자리까지 가져다주신 연남동 카페 스트뉴 사장님 라떼아트가 예뻐서 내가 시킨 것도 아닌데 사진 찍어보았음 누가 글라세 (서비스) 음료가 준비되는 시간이 조금 오래 걸려서 죄송하다며 디저트를 선물로 내오셔서 놀랐다가 감동받은 우리들 프랑스식 아이스크림이라고 하는데 견과류 맛이 입 안을 가득 채우는 그런 풍성한 디저트였다 피스타치오 티라미수 (8,000원) 연남동 카페 스트뉴 메뉴판을 보면 티라미수는 비네트라는 와인바에서 받아오시는 것 같았다 일단 비주얼이 너무 맛있어보였고 이탈리안 정통 방식대로 생크림 없이 계란과 마스카포네만 사용해서 만들었다고 하는데 그래서인지 식감에 넘쳐흐르는 부드러움 내부의 공간도 넓은데 사장님도 친절하시고 커피와 디저트 맛도 좋은데 히터까지 빵빵하다면 안 갈 이유가 무엇인가? https://www.instagram.com/soutenu_seoul/ (@soutenu_seoul) • Instagram 사진 및 동영상 팔로워 237명, 팔로잉 0명, 게시물 51개 - (@soutenu_seoul)님의 Instagram 사진 및 동영상 보기 www.instagram.com 50m © NAVER Corp. 스트뉴 서울특별시 마포구 성미산로23안길 19 1층"
"[서울/연남동] 영종도민들의 연남동 나들이: 갓잇 연남점, 스트뉴, 도토리 캐리커쳐","2023. 03. 17. ❤️‍🔥 FRIDAY ❤️‍🔥 생일 주간이라 약속도 많고, 미친 스캐쥴을 소화하고 있는 요즘 👀 정말.. 말 그대로 몸을 갈아서 놀고 있다 (늘 그렇게 살아온 편이긴 함;;;) 선지랑 옌이랑 쿈쿈이랑 연남동에 멕시칸을먹으러 옴‼️ 그렁데 트위티씨가 주머니에 이음카드만 덜렁 넣고 영종역에 오는 바람에 다시 집에 들렀다가 온다고 해서, 일단 우리 셋이 먼저 홍대입구역에 도착함🥲 너무 카페인이 시급해서 눈에 보이는 할리스에 들어가서 사먹은 콜드브루🖤 할리스 콜드브루 JMT 긍데 가격이 너무 오름… 테이크아웃 커피 작은 사이즈가 이제 걍 기본으로 5,000원 이상이군 ㅠ 컴포즈, 메가커피 짱^^77777 50m © NAVER Corp. 갓잇 연남점 서울특별시 마포구 성미산로 161-13 1층 예약 갓잇 연남점 갓잇 연남점 커피를 사들고~ 걸어서 금방 도착한 오늘의 점심장소💚 #갓잇연남점 이렇게 귀여운 주문표에 표시해서 제출하면 되는 시스템‼️ Next image 갓잇 메뉴 갓잇의 메뉴판🪄 두근 두근,, 설레는군여 우리는 “패밀리세트”로 주문‼️ - 갓 파히타 ➕ 갓 엔칠라다 - 타코 4pcs - 버팔로 윙 4pcs - 감자튀김 - 나초칩 ➕ 또띠아 - 과카몰리 넘 귀여운 갓잇의 어매니티(?) ㅋㅋㅋㅋㅋㅋㅋㅋ 처음엔 아이가릿! 할 때의 Got it인줄 알았는데 알고보니 GOD EAT 이었음👀‼️ 그래서 저렇게 귀여운 제우스 같응 캐릭터가.. 가게 인테리어도 넘 귀엽고 센스있음. T.G.I.F. 아니죠~ T.G.E.F. 맞습니다~🙆‍♀️ 음료는 제로콜라 & 사이다 얼음컵도 SO CUTE 😊 두둥~~ 등장 👀🥹 비쥬얼 미쳤다~~~🔥🔥🔥🔥 갓잇 타코 타코 🌮 는 4 피스가 나오는데, 쉬림프, 치킨, 포크 중에 고를 수 있음‼️ 우린 쉬림프 🦐 와 치킨 🍗 으로 고름👀 파히타 갓 파히타 (God fajita) 볶은 야채와 고기들을 또띠아에 싸서 먹는 요리 🧑‍🍳 엔칠라다 갓 엔칠라다 (God Enchilada) 또띠아에 고기, 야채, 치즈 등을 넣고 로제소스를 부은 요리 🧑‍🍳 버팔로윙이랑 감자튀김~ 갓잇 엔칠라다 ㅋㅋㅋㅋㅋ흡사 백숙의 닭 배를 가르는 것과 같은,, 엔칠라다 커팅식 🔪 갓잇 연남점 재생 4 좋아요 0  접기/펴기 갓잇 연남점 짜잔~~ 엔칠라다의 속 안👀 진짜.. 나 멕시칸 별로 안 좋아하는데 졸 흡임함;;;;;; (알고보니 나 멕시칸 좋아하더라ㅠ) 엔칠라다🫶🏻 내 서타일이네,,, 갓잇 타코 나의 타코 🌮 는 새우로 pick ‼️ 아무래도 새우는.. ෆ 진짜 1도 안 남기고 넷이서 패밀리세트 완벽하게 클리어~~👍🏻👍🏻👍🏻 밥을 먹었으니~ 카페를 가야쥬‼️ 2차로 갈 카페를 고르다가 결정한, #스트뉴 스트뉴 이렇게 큰 건물의 1층에 위치한 스트뉴‼️ 스트뉴 평일 (금요일) 에 와서 연남동에 생각보다 사람이 많지 않고, 어딜가도 여유로워 좋았음🖤 내부는 이런 느낌으로, 넓고 쾌적함👍🏻 깔끔한 인테리어가 내 취향이넴 ෆ (취향이 다양한 편) 예뻐서 카페 사진 겁나 찍음..ㅎㅎ 스트뉴 연남 우리가 시켰던 메뉴 중 먼저 나온 일부, 피스타치오 티라미수 (pistachio tiramisu) ➕ 스트뉴 커피 (Soutenu coffee) 피스타치오 티라미수 내가 적극적으로 골라본 디저트 메뉴💚 피스타치오 ➕ 티라미수 ?! 이 조합은 솔직히 못 참지ㅠ 뒤이어 나온 나와 옌의 따뜻한 카페라떼 ☕️ 머그잔도 넘 예쁘고, 라떼 아트도 해주심🖤 ㅎㅎㅎ순삭‼️ 시트가 좀 축축?하긴 했는데 크림이 미쳤음. J M T 배불리 먹고 기분이 좋그든여~ ෆ 옌한테 부탁해서 몇 장 찍어봄. 연두색이 봄봄해서 예뿌네💚 잘 마시고, 행복하게 놀다가 갑니다🖤 50m © NAVER Corp. 스트뉴 서울특별시 마포구 성미산로23안길 19 1층 카페에 앉아서 “다음엔 뭐할까~?” 하다가 선지가 찾아온 우리의 다음 일정‼️ 두두둥~~ 바로 캐리커쳐 🎨 요즘 소소하게 핫하다는 선지피셜. 도토리 캐리커쳐 검색해봤더니, 캐리커쳐의 특성 상 시간이 별로 걸리지 않는 작업이라 별도의 예약이 필요없다고 하여 바로 방문‼️ 도토리 캐리커쳐 상호명인 도토리 캐리커쳐 답게 내부가 다람쥐와 도토리로 잔뜩 꾸며져 있음 🐿️ 현금으로 결제할 경우, 위에 보이는 엽서와 미니 스티커들을 공짜로 가져갈 수 있음‼️ 한 명씩 앉아서 캐리커쳐를 그리는데, 약 5분 정도? 소요됐음. 귀여운 다람쥐거울로 찍어보는 거셀📷 우리 4명은 모두, 도토리캐리커쳐 1인 (A5 종이, 7,000원) 으로 선택‼️ 도토리캐리커쳐 두구두구~ 나의 완성작🖤 오늘 내가 입은 옷과 머리, 악세서리 나의 특징들은 잘 살려서 그려주심 화려한 눈 👁️ 👁️ 도토리 캐리커쳐 우리 넷의 완성본. 순서대로 옌, 선지, 혭, 쿈 쏘 큩,,, 지금은 각자 방문 앞에 붙여놨는데 진짜 귀여워서 맘에 쏙듦🖤 그림은 그림일뿐~ 나왔으면 네컷사진은 꼭 찍어야하는 필수코스‼️ 하루필름을 찾아온 우리덜💙 엄청 허버허버 찍었는데, 결과물이 귀여워서 햄복~~ 👍🏻 결과물을 들고~~ 연남동 곳곳의 다양한 소품샵들을 구경하다가 영종도 우리집으로 귀가🏠 오늘도 꽉 채워 행복했다🥰"
[홍대입구역]연남동 끝자락 카페“스트뉴”,"오랜만에 지니지니랑 평일 데이트 연남동 무슨카페를 갈까 고민하다가 저번에 혼자 산책하면서 봐뒀던 분위기 좋은 카페가 생각나 바로 공유하고 가기로 결정! 스트뉴 soutenu 매일 11:00-22:00 반려동물동반가능 50m © NAVER Corp. 스트뉴 서울특별시 마포구 성미산로23안길 19 1층 연남동 끝을 가면 여기에 이렇게 분위기 좋은 카페가 있었나?라고 무조건 생각이 들거다 연남동 초입이랑 전혀 다른 분위기 특히 평일에 가면 진짜 조용하고 이쁜 카페들 엄청 많음 책을 꺼내고 싶게 만드는 분위기 메뉴 만나기 직전에 아메리카노를 마시고와서 오랜만에 밀크티로 주문했다 여니여니 밀크티 지니지니 아아메 왜 이렇게 서로 할 말이 많은지 몰라~~ 다음에 오면 티라미수 먹어봐야지 - ♡ 스트뉴 연남 (Soutenu Yeonnam)(@cafe_soutenu) • Instagram 사진 및 동영상 팔로워 766명, 팔로잉 2명, 게시물 51개 - 스트뉴 연남 (Soutenu Yeonnam)(@cafe_soutenu)님의 Instagram 사진 및 동영상 보기 instagram.com #연남동카페 #스트뉴연남 #스트뉴 #연남동스트뉴 #연남동분위기좋은카페 #서이추환영"
연남동 신상카페 [스트뉴] 찐 쫀득한 크림맛집 ☕️,"오랜만에 데이트코스로 가본 홍대! 홍대가 나름 중간지점이라 데이트할 때 짱 편함 히히.. 통유리로 개방감과 아늑한 분위기가 좋았던 카페 스트뉴! 스트뉴 서울 마포구 성미산로23안길 19 1층 50m © NAVER Corp. 스트뉴 서울특별시 마포구 성미산로23안길 19 1층 매일 10:00 - 22:00 (@soutenu_seoul) • Instagram 사진 및 동영상 팔로워 246명, 팔로잉 0명, 게시물 51개 - (@soutenu_seoul)님의 Instagram 사진 및 동영상 보기 www.instagram.com 스트뉴는 연남동에 있어서 홍대 3번출구로 쭉 걸어오시면 돼요! 도보 10분거리에 위치해 있어용 카페 내부 카페 내부는 꽤 작지 않은 공간으로 아늑하더라구용 2인석, 쇼파석 등 좌석이 다양해서 굿! 전체적으로 통유리라서 개방감이 넘 좋더라구요ㅎ.ㅎ 감성적인 분위기와 인테리어 넘 찰떡🌟 그럼 바로 카운터에서 주문하러 고고링~ 커피부터 디저트까지 기본적인 메뉴도 있고 스트뉴의 시그니처 메뉴들도 있더라구용 디저트는 티라미수와 치즈 케이크! 역시 트리는 항상 이뿐듯ㅠ.ㅠ 트리에 달려있는 장식이 넘 이뻐유,,, 깔끔한 감성 한 스푼 카페라 편안한 분위기가🤍 [주문 내역] ✔ 스트뉴 커피 6000원 ✔ 초콜릿 라떼 6000원 ✔ 피스타치오 티라미수 8000원 짠 저희가 주문한 음료에용! 금방 만드셔서 저희 테이블로 가져다주심ㅎ.ㅎ 아니 전체적으로 비주얼이 넘 아기자기 귀여움!! 크림양도 세상 넘칠듯한 양과 개인적으로 음료양이 많았던거 같아용 (원래 얼음반인 음료도 많잖아용..!) 피스타치오 티라미수는 이름이 되게 생소했는데 커피에 적신 시트 위에 피스타치오 크림이 덮어져 나오는 케이크로 정말 부드러운 식감이에요! 피스타치오와 티라미수가 이렇게 잘 어울리다닝,, 꾸덕하면서 향긋고소한 피스타치오 크림과 쌉쌀한 커피향 조합이 쫀맛탱!! 옆에있는 귀여운 트리는 머랭쿠키! 제가 마신 스트뉴 커피로 위에 브라운 치즈를 테이블에서 토치로 구워주시는데 이게 또 ㅇ.ㅇ 이러고 보게 되더라구요ㅋㅋㅋ 전체적으로 달달한 크림과 브라운 치즈의 짭짤한 맛이 예상가는 맛이지만 어디서 먹어보지 못한 맛으로 넘 맛도링!! 일단 여기 크림이 진짜 진하고 신선한 느낌이에요 초코라떼는 적당한 농도와 당도도 많이 강하지 않은 맛이었어용 위에 크림도 얹어서 나오는데 숟가락으로 크림만 퍼먹어도 진짜 맛있고 진짜 크림만 따로 받아가고 싶음!! 가좌역 근처 감성카페 맛집으로 인정! 스트뉴에서는 무조건 크림류 드세효ㅎ.ㅎ! #연남동카페, #연남동디저트, #연남동티라미수, #연남동케이크, #가좌역카페, #연남카페, #연남디저트, #연남케이크, #가좌역디저트, #가좌역케이크, #마포구카페, #마포구디저트, #마포구케이크"
연남동 신상카페 @Soutenu 스트뉴 케이크맛집,Soutenu 10:00-22:00 안녕하세요 설율입니다! 언니랑 오랜만 데이트했어요 원래는 호밀반 가려고 했는데 닫혀서 ㅠㅠ 결국 신상 카페 탐방 나섰네요 스트뉴는 11월 달부터 방문하고 싶었어요! 그때부터 새로 오픈했구요 스트뉴는 발레의 동작인데 일관된 태도라는 뜻도 있다고 하네요! 차 종류가 다양해서 마음에 들었어요 너무 추우니까 따뜻한 오페라 블루 한잔 언니는 아아~ ㅋㅋ 향도 직접 맡아볼 수 있어요 오페라 블루가 향기롭더라구요 카페가 전체적으로 넓고 북적거려도 답답함이 없는 곳 월요일인데도 손님이 많더라구요 동네 완전 끝자락인데 인기 많음 나무 인테리어 안좋아하는 편인데 여기는 전체적으로 웜톤 유지하고 카멜 브라운 느낌을 살려서 가을풍이 도는 이쁜 카페였어요! 곳곳마다 놓인 액자도 완전 감성적 〰️ 사실 소파 자리 원했지만 포토존으로만~! 그리고 언니는 높은 테이블 선호해서 단체석에 앉아서 언니의 새 맥북 자랑을 들었어요 큭큭 어머나 프렌치 아이스크림 너무 맛있잖아? 색다른 크런치함과 피스타치오 가루 무슨 생일파티 미니 케이크 느낌 (?) 와 근데 식감이 너무 좋았고 더 먹고 싶었어요 양이 좀 더 많았으면 좋았을 것 같아요 그리고 언니가 눈여겨본 딸기 케이크 안에도 딸기가 한가득🍓🍰 달콤한 크림과 듬뿍 올라간 딸기 조합 좋더라구요 홍대생이거나 마포구 거주하시는 분들 무조건 추천드리고 싶어용 멀리 산다면 어렵겠지만 ㅠㅠ 저처럼… 하지만 이 아이스크림 완전 독특해서 왕추천🍦 50m © NAVER Corp. 스트뉴 서울특별시 마포구 성미산로23안길 19 1층 #연남동신상카페 #가좌역신상카페 #홍대신상카페 #마포구신상카페 #프렌치아이스크림 #아이스크림 #딸기케이크 #홍대케이크 #마포케이크 #연남동케이크 #연남동딸기케이크 #연남동아이스크림 #스트뉴 #soutenu
