title,content
연남동카페 수제 디저트가 맛있는 핫플 해피니스인어데이,"안녕하세요 여행인플루언선 달봉이입니다. 오늘은 서울여행으로 놀러 갔다가 카페를 어디로 갈까 고민을 정말 많이 하다가 연남동을 다녀오게 되었는데요. 연남동에는 정말 맛있는 음식점들과 맛있는 카페와 디저트판매하는 곳들이 많다는 소문을 들었습니다. 제가 수제로 만든 디저트를 정말 좋아하는데요. 그래서 이곳 저곳 연남동에 맛있는 디저트카페가 어디있으며 분위기 또한 괜찮은 곳이 어디인지 친구와 함께 검색을 해보았는데요. 검색도중에 고르기 힘들 정도로 연남동에는 정말 많은 카페들이있었습니다. 연남동카페 해피니스인어데이 주소:서울 마포구 동교로 46길 7 201호 영업시간: 12:00~21:00 매주월요일휴무 전화번호: 0507- 1439- 5023 그중에서 제가 정말 좋아하는 수제디저트인 오레오스모어와 페퍼로니콘치즈를 판매하고 있는 연남동카페 해피니스인어데이를 방문하게 되었습니다. 해피니스 인어데이 같은경우는 수제 디저트 맛집답게 최고의 재료인 유지방함량이 높기에 풍미가 뛰어난 발효 고메버터를 사용하고 있었고, 유기농밀가루와 카카오 함량이 아주 높은 깔리바우트 그리고 발로나사의초콜릿까지 사용을 하고 있는 핫플 디저트 카페입니다. 매장내부의 분위기는 친구집에 놀러온것 마냥 정말 편안한 분위기였습니다. 넓고 편한 쇼파도 준비가 되어있었으며 각종 소품들이 진열이 되어있었습니다. 친구 집 또는 약간 친구들만의 아지트 같은느낌이 들어서 카페에 있는 내내 불편함이 전혀 없었습니다. 연남동카페 해피니스인어데이는 알고보니 이미 인천 구월동 핫플 유명디저트카페인 너티브루키의 대표님께서 이렇게 편안한 분위기의 컨셉으로 세컨드 브랜드로 오픈한 곳이더라고요. 어쩐지 분위기 자체가 정말 남달랐어요. 해피니스인어데이는 특징중에 하나는 바로 테이블 간격도 정말 넓직넓직 배치가 되어있었는데요. 배치가 넓다보니 같은 공간이여도 다른사람들에 이야기소리가 섞이지않고 저희들끼리의 이야기만 잘 들을 수 있어서 좋았습니다. 저는 친구와 함께 제가 좋아하는 오레오 스모어와 페퍼로니 콘치즈를 주문을 하였고 음료로는 유자아메리카노와 딸기라떼까지 주문을 해주었습니다. 얼마 지나지않아 메뉴들이 준비가 되었는데요. 깨끗하고 깔끔한 하얀접시위에 맛스러운 수제디저트들과 포크까지 준비가됩니다. 이게 바로 유자아메리카노라는 건데요. 다른곳에서는 맛보기 힘든 커피중하나입니다. 달달한 유자와 아메리카노의 만남입니다. 한번 먹으면 꼭 생각나는 그런맛 이었습니다. 그리고 아주 시원한 얼음이 동동 올라가있는 딸기라떼도 준비가되는데요. 생딸기가 들어가서 그런지 너무나도 상큼하면서도 달달하니 맛있었습니다. 음료 양도 생각보다 많이 주어서 수제디저트와 먹기에 아주 좋았습니다. 이게 바로 오레오 스모어인데요. 빵은 정말 부드러웠으며 특히나 오레오와 함께 빵이 어울려져서 너무 맛있었습니다. 오레오 스모어는 언제 먹어도 정말 저의 최애 디저트인것같아요. 너무맛있어서 언제 연남동카페에 또 올지 몰라서 수제디저트를 포장까지 했습니다. 포장 또한 깔끔하게 잘 해주시고 귀여운 스티커까지 붙여주시더라고요. 이렇게 해피니스인어데이는 테이크아웃도 가능하며 마포구 연남이나 홍대는 배달의 민족 배달서비스도 진행을 하고 있더라고요. 연남동에 놀러가실일이 있으시다면 꼭 맛있는 수제디저트를 판매하고 있는 연남동카페 해피니스인어데이를 다녀와보시는걸 추천드려요. 그리고 시원한 유자아메리카노와 제가 좋아하는 오레오스모어까지 꼭 드셔보시길 바래요. 해피니스인어데이 서울특별시 마포구 동교로46길 7 201호 연남동 디저트 카페 해피니스인어데이 (HID)(@hid_yeonnam) • Instagram 사진 및 동영상 팔로워 866명, 팔로잉 72명, 게시물 62개 - 연남동 디저트 카페 해피니스인어데이 (HID)(@hid_yeonnam)님의 Instagram 사진 및 동영상 보기 www.instagram.com #연남동카페 #연남동디저트카페 #연남동카페해피니스인어데이 #연남동해피니스인어데이 #해피니스인어데이 #연남동핫플"
(연남동 카페) 커피와 수제쿠키가 맛있는 해피니스인어데이! 연남동 데이트 추천!,"후아... 엄청 더운 날이었습니다... 하지만~! 시원한~ 밀크티와 수제쿠키를 먹으로 연남동 나들이를 떠나봤습니다~! 홍대입구역 3번 출구로 나와서 도보로 8분 정도 거리에 있는 곳입니다. 매장명은 해피니스인어데이 입니다~! 커피와 수제쿠키가 맛있다고 소문이 나있더라고요~! 해피니스인어데이 서울특별시 마포구 동교로46길 7 201호 주소: 서울시 마포구 동교로46길 7 201호 영업시간: 화~일 12:00~21:00 매주 월요일 정기휴무 예약문의: 0507-1439-5023 단체석, 포장, 배달, 반려동물 동반 연남동 디저트 카페 해피니스인어데이는 고소한 버터 풍미가 일품인 발효 고메버터 청정지역에서 재배한 유기농 밀가루와 프랑스 고급 초콜릿 브랜드인 발로나 초코칩, 그리고 직접 로스팅한 견과류 등 좋은 재료들로만 사용하여 달기만한 디저트가 아닌 기분좋은 달콤함과 원재료들의 풍미가 잘 어우러지는 디저트를 추구하고 있습니다. HID는 해피니스인어데이라는 뜻으로 방문해주신 모든 분들에게 HID에서의 시간이 그낭 하루의 행복한 기억으로 남길 바라는 사장님의 바램을 담아 지었다고 합니다. 매장은 2층에 위치해 있습니다~! 건물에 주차장은 있지만 1층에 식당도 있고해서 쉽지는 않습니다. 그러니 도보를 이용하시기 바랍니다. 계단을 올라가니 유리문이 삭~ 왼쪽으로는 카운터와 내부가 보이네요~! 더우니 후딱 들어가 볼께요~!~! 으~ 시원하다~ 이 날이 제 기억엔 체감온도가 37도였나... 이랬던거 같습니다... 걸어오는데 와우....ㅜㅜ 인테리어가 화이트&아이보리 사이로 딱 제스타일 이었습니다~! 사장님 나이스샷~ ㅋㅋㅋ 통유리로 밖을 시원하게~ 볼 수 있는 뷰도 좋습니다~! 특이하게 바테이블이 있었고 밖을 바라보고 앉는 방향으로 쇼파도 있었습니다~! 안쪽으로 룸이 있습니다~! 단체? 여러명이 왔을떄 이용하기 딱 좋습니다~! 4인석 2개+2인석 1개 최소 10명이 앉을 수 있습니다. 나이스한 구조 였습니다^^ 그리고 테이블 간격을 넓게 배치하여, 편안하게 쉬고 가는 느낌의 카페 분위기를 연출하셨습니다. 오~! 수제쿠키 너무 맛있어 보입니다~! 다 맛보고 싶었지만... 다이어트 중이라서... 흑흑흑 적당히 골라 봤습니다... 아~! 이벤트 중이었습니다~! 디저트 4개 이상을 구매한 손님에게 수제 쿠키 1개를 추가로 증정하는 4+1 이벤트를 진행하고 있습니다~! 사장님의 손길이 한땀~ 한땀 들어간 수제쿠키~! 종류가 너무 다양합니다... 저같은 결정장애에게는 너무 큰 시련 이었습니다... 금액은 3,500원 부터 8,000원까지 구성되어 있습니다. 유지방 함량이 높기에 풍미가 뛰어난 발효 고메버터를 사용~! 청정 지역에서 유기농법으로 재배된 유기농 밀가루 사용~! 카카오 함량이 높은 깔리바우트 사용~! 발로나사의 초콜릿 사뇽~! 어썸밀크티에 쿠키 5개만 골랐습니다... 사장님 추천을 3개 받고, 2개는 제가 선택 했습니다~! 이곳이 인천 구월동에서 유명한 수제 디저트 맛집인 ""너티브루키"" 본점 대표님께서 다른 컨셉의 다양한 디저트를 선보이기 위해 연남동에 오픈한 세컨 브랜드 매장이였습니다~! 쿠키가 비쥬얼도 특이하고 향도 좋고~! 맛이 아주 끝내줬습니다~! 그리고 쿠키가 말랑말랑? 퐁신퐁신? 부들부들? 해서 너무 좋았습니다~! 푸석하지 않는 식감~! 으~ 또 먹고 싶네요... 잘 섞여라~ 너무 맛있겠죠?! ㅋㅋㅋ 너무 맛있습니다ㅜㅡㅜ 사장님께서 남는 쿠키를 포장해 주셨습니다~! 감사 합니다~~ㅎㅎㅎ 그리고 저 쪽찌~! 쿠키를 바로 드시시지 마시고 시원하게 냉동보관 했다가 드시기 직전에 10분정도 자연해동하면 더 맛있다고 합니다. 그리고 냉동보관하면 2~3주까지는 괜찮다고 하네요. 연남동 디저트 카페 해피니스인어데이 (HID)(@hid_yeonnam) • Instagram 사진 및 동영상 팔로워 826명, 팔로잉 65명, 게시물 60개 - 연남동 디저트 카페 해피니스인어데이 (HID)(@hid_yeonnam)님의 Instagram 사진 및 동영상 보기 www.instagram.com '이 글은 업체로부터 서비스를 제공받아 작성한 솔직한 후기 입니다.' #연남동까페 #카페추천 #쿠키맛집 #수제쿠키맛집 #커피맛집 #연남동수제쿠키 #쿠키추천 #해피니스인어데이 #디저트맛집 #연남동디저트카페 #후식맛집 #연남동데이트 #데이트추천 #테이크아웃"
연남동 카페 편안한 아지트 같은 해피니스인어데이,"안녕하세요 여행 맛집 인플루언서 달봉이입니다. 오늘은 연남동에서 아주 핫하다는 연남동카페 해피니스인어데이라는 곳에 다녀왔는데요. 연남동카페 해피니스인어데이 주소: 서울 마포구 동교로 45길 7 , 201호 영업시간: 12:00~21:00 매주 월요일 휴무 전화번호: 0507-1439-5023 해피니스인어데이 서울특별시 마포구 동교로46길 7 201호 해피니스 인어데이는 건물 2층에 위치해있었습니다. 입구에서 부터 유리문 너머로 아기자기한 것들이 보였는데요. 인테리어에 신경을 많이쓴것 같은 느낌이 들더라고요. 매장 내부의 인테리어는 약간 깔끔한 친구의집? 또는 친구들과의 아지트 같은 느낌이 들더라고요. 그래서 그런지 들어서자마자 편안한 느낌을 받았어요. 대부분 화이트 톤으로 깔끔하였고 쇼파와 매트로 포인트를 주었더라고요. 테이블은 삼삼 오오 모여서 커피와 맛있는 디저트를 먹기 좋게 배치가 되어있었습니다. 테이블 간격 자체가 다른카페와는 다르게 넓게 배치되어있어서 다른사람들 눈치를 보지않고 친구들과 편하게 먹을 수 있어서 좋았습니다. 한쪽에는 옷걸이도 준비가 되어있어서 외투를 걸어놓을수 있었고 시원한 물도 마실 수 있었습니다. 물옆에 있는 조명 또한 아주 아늑한 느낌의 조명으로써 분위기를 더했습니다. 연남동 카페 해피니스인어데이는 이미 인천 구월동에서 아주 유명한 디저트카페 너티브루키의 대표님의 세컨브랜드로 만든 카페라고 하더라고요. 이곳이 유명한 이유중 하나는 모든 디저트를 수제로 만들고 있으며 최고의 재료들만을 사용하여 만든다고 합니다. 풍미가 아주 뛰어난 고메버터, 유기농밀가루, 깔리바우트, 발로나사의 초콜릿을 사용한다고해요. 연남동카페 해피니스인어데이는 생각했던 것보다 메뉴들이 정말 다양하고 많이있었는데요. 그 중에서 저는 친구와 함께 유자아메리카노, 딸기라떼, 페퍼로니콘치즈, 오레오스모어를 주문하였습니다. 디저트를 하나만 주문을 할까 고민도 하였지만 언제 또 와서 먹어보냐는 마음에 두개나 주문을 하였습니다. 얼마 지나지않아 깔끔한 접시에 음료와 디저트가 준비가 되었는데요. 비쥬얼부터 정말 먹음직스러웠습니다. 제일 먼저 정말 신기해보였던것이 바로 유자에이드인데요. 어디에서나 쉽게 먹지 못하는 음료인거 같은데요. 층이 두개로 나뉘어져있어서 아래층은 노란 유자색상 위층은 갈색빛의 아메리카노 색상을 띄더라고요. 유자의 달달함과 아메리카노의 만남은 어떨지 정말 궁금했는데요. 사진을 찍은 후 바로 빨대로 섞어서 먹어보았습니다. 유자아메리카노는 정말 처음먹어봐서 그런지 신비로운 맛이었습니다. 달달하면서도 씁쓸하면서도 그리고 시원하기까지하더라고요. 유자와 아메리카노 생각보다 찰떡궁합이었습니다. 맛있어서 쭈욱 들이키게 되더라고요. 유자아메리카노를 한번 들이켠 후 연남동카페 해피니스인어데이의 디저트를 먹어보았는데요. 페퍼로니 콘치즈를 제일 먼저 먹어보았습니다. 이것 또한 정말 신기하였습니다. 디저트인데 피자맛이났으며 빵은 또한 부드러웠습니다. 그리고 콘이 디저트 안을 가득 채워져있더라고요. 피자와 콘을 좋아하는 저로써는 정말 제 스타일이었습니다. 딸기라떼는 싱싱한 딸기가 들어가있었으며 우유와 달달함의 만남이랄까? 달달하고 시원함을 한번에 느끼고 싶으면 추천드려요. 이건 오레오스모어라는 디저트인데요. 쿠키디저트라고 생각을 하시면 될거 같아요. 퍽퍽하지않고 쫀쫀하여서 음료와 같이 마시기에 아주 좋았습니다. 직접 디저트와 음료를 마셔보니 연남동 카페 해피니스인어데이가 왜 인기가 있는 핫플인지 알것 같더라고요. 일단 디저트가 너무나도 맛있었으며 분위기 또한 정말 아지트 같은느낌이라서 편하게 친구와 수다떨면서 먹기에 안성맞춤이었어요. 해피니스 인어데이는 테이크아웃과 배달의민족 배달서비스도 진행을 하고 있었는데요. 그래서 친구와 함께 맛있게 먹은 후 너무 맛있어서 집에 있는 가족들도 가져다주려고 포장도 하였습니다. 포장 또한 아주 깔끔하게 해주셨어요. 오늘은 아지트같은 분위기를 자랑하는 연남동카페 해피니스인어데이에서 맛있는 디저트와 처음먹어보는 유자아메리카노를 먹고왔습니다. 유자아메리카노와 맛있는 디저트가 궁금하시다면 꼭 한번 다녀와 보시는걸 추천드려요 𝗛𝗔𝗣𝗣𝗜𝗡𝗘𝗦𝗦 𝗜𝗡 𝗔 𝗗𝗔𝗬 해피니스인어데이 (HID)(@hid_yeonnam) • Instagram 사진 및 동영상 팔로워 778명, 팔로잉 62명, 게시물 54개 - 𝗛𝗔𝗣𝗣𝗜𝗡𝗘𝗦𝗦 𝗜𝗡 𝗔 𝗗𝗔𝗬 해피니스인어데이 (HID)(@hid_yeonnam)님의 Instagram 사진 및 동영상 보기 www.instagram.com #연남동카페 #연남동해피니스인어데이 #해피니스인어데이 #연남동디저트카페 #연남동디저트"
연남동카페 해피니스인어데이 키치한 분위기 쿠키맛집,"연남동 데이트를 하던중 카페를 찾아보다가 발견한 홍대디저트맛집 [해피니스인어데이] 후기 가지고 왔어요! 해피니스인어데이 📍주소: 서울 마포구 동교로46길 7 201호 📍영업시간: 화요일- 일요일 12:00-21:00 월요일 정기휴무 📍전화번호: 0507-1439-5023 해피니스인어데이 카페는 홍대입구역에서 가까운 위치에 있어요! 2층에 위치해있어서 계단으로 올라갔어요 해피니스인어데이 내부에요 연남동에 이렇게 크고 넓은 디저트카페가 있었다니 ♥ 힙한 분위기에 아기자기한 포인트들이 많았어요 사진 찍기도 너무 좋았던 카페에요! 넓은 통창으로 되어 있어서 햇살이 예쁘게 잘 들어오더라구요🌞 해피니스인어데이 연남동카페는 인천에 있는 디저트 카페 ‘너티브루키'의 대표님의 세컨 브랜드 카페에요! 너티브루키는 수제 디저트로 유명한 카페로 알고 있어서 신기했어요 🙄 안쪽에는 또 다른 공간이 있었어요! 공간마다 분리되어 있어서 넘 좋았어요 공간 하나하나가 다 깔끔하고 예뻤던 연남동카페 🖤 겉옷 보관할 수 있는 행거도 있었어요 센스만점이자나!! 인테리어 하나하나 넘 예쁘지 않나요 감각적인 인테리어가 돋보였던 홍대디저트 ✔️ <해피니스인어데이 메뉴판> 커피, 논커피,티, 에이드 종류가 있어요! 시그니처메뉴로 유자 아메리카노, 얼그레이초코라떼, 얼그레이 크림모카가 있었어요! 디저트 종류는 스콘, 쿠키, 바스크치즈케이크, 티라미수, 마들렌, 버터바 등 구움과자들과 케이크가 있어요! 디저트 종류가 정말 많아서 친구들 모임장소나 홍대데이트로 너무 좋은 연남동카페 해피니스인어데이 :) 사장님 넘 친절하셔서 감덩 ,,♥ 설명해주시며 메뉴추천도 해주셨어요!! 카운터 옆에는 해피니스인어데이를 줄인 HID 스티커와 메모지가 있었어요 💛 넘 귀엽고 키치한 디자인이라 하나씩 가져오기 ㅎ_ㅎ 블루베리 크림치즈 떠먹쿠 헤이즐넛 초코쿠키 시그니처 브루키 버터버 오레오스모어 쿠키 블루베리크림치즈 떠먹쿠 쿠키 사이사이 블루베리 크림이 왕창 들어있어요 크림치즈 큐브도 많이 들어있고💛 바삭함과 쫀쫀한 블루베리 크림을 한번에 느낄 수 있어요 시원한 아이스크림케이크 먹는 기분🍨 독특한 디저트라 젤 맘에 들었던 떠먹쿠 🤍 디저트 욕심을 부려서 음료는 아메리카노로 주문 🙄 산미가 없는 아메리카노라 쿠키, 버터바랑 너무 잘 어울렸던 !! 연남동디저트 해피니스인어데이는 디저트 4개 이상을 구매하면 수제 쿠키 1개를 추가로 증정하는 이벤트도 하고 있어요 :) 테이크아웃으로 쿠키포장해가도 넘 좋을듯! 시그니처 브루키 처음보는 비주얼의 쿠키 밑에는 브라우니, 위에는 쿠키로 되어 있어요 브라우니와 쿠키의 조합.. 💯🩷 연남동디저트맛집이라는게 느껴졌던 디저트! 쿠키 버터의 풍미가 가득! 느껴졌어요 헤이즐넛 초코쿠키 견과류 가득했던 초코쿠키 진짜 너무 부드러운 쿠키는 처음! 무엇보다 퍽퍽하지 않고 촉촉 쫀득해서 더 맛있게 먹을 수 있었어요 💛 버터바 고소한 버터 풍미가 느껴져서 맛도리 🤍 느끼하지 않고 고급진 버터 맛이 느껴졌어요 두께도 두껍고 꾸덕꾸덕 버터바는 말해모해.. 오레오스모어쿠키 쫀득하면서 달달함✨ 안까지 오레오가 가득해서 달달한거 좋아한다면 오레오스모어 츄쳔 🩶 디저트 종류도 다양하고 정말 맛있었던 연남동카페 해피니스인어데이 쿠키 먹고 싶을 때마다 방문할거 같아요..🙆🏼‍♂️💛 해피니스인어데이 서울특별시 마포구 동교로46길 7 201호 #연남동카페 #연남동디저트 #연남동데이트 #연남동쿠키 #홍대디저트맛집 #홍대디저트카페 #연남동쿠키맛집 #연남동디저트카페 #해피니스인어데이 #서이추환영 #서로이웃환영 #서로이웃 #서이추"
"연남동 카페, 연남동 디저트 맛있는 해피니스인어데이","안녕하세요! 오늘도 좋은 하루 보내고 계신가요? 요즘 디저트 맛집 찾아다니는 재미에 푹 빠졌는데요!? 오늘은 맛있는 디저트들 중에서도 수제 쿠키 등 직접 만든 수제 디저트를 파는 연남동 디저트 맛집을 발견해 공유해 드릴게요😜 해피니스인어데이 연남동 카페 해피니스인어데이는 최고의 재료를 엄선해서 모든 디저트를 수제로 만들고 있는 곳이에요! - TEL : 0507-1439-5023 - ADDRESS : 서울 마포구 동교로 46길 7, 201호 - 영업시간 : 12:00~21:00 (매주 월요일 휴무) 더 믿음직스러웠던 게 인천 구월동 유명 디저트 카페 '너티브루키'의 대표님이 만든 세컨 브랜드라는 점이었어요! '너티브루키'는 인천은 물론이고 온라인 상에서도 꽤 유명한 수제 디저트 맛집이거든요ㅎㅎ '너티브루키' 본점 대표님께서 직접 다른 컨셉의 다양한 디저트를 선보이기 위해 연남동 카페를 오픈하신 것이라고 해요!! 이미 검증된 디저트 맛집의 브랜드라고 하니 재료나 맛이 더 신뢰가 가더라구요😁 연남동 카페 해피니스인어데이는 인테리어도 참 맘에 들었는데요? 일단 테이블 간격을 넓게 배치하셔서 쾌적하고 편안하게 쉬다갈 수 있는 느낌의 카페 분위기를 연출하셨더라구요. 감성 카페들 가보면 좁아서 앉아 있기가 불편했는데 다른 손님들과도 간격유지가 되고 내가 함께 간 사람들과도 오손도손 얘기 나눌 수 있어서 좋았어요. 인테리어를 감성있게 잘 해서 그런지 오늘의 집 같은 곳처럼 예쁘게 인테리어한 친구네 집이나 아지트에 놀러간 느낌도 나요😆 드디어 연남동 디저트 맛집 연남동 카페 해피니스인어데이 디저트들!!! 눈으로 보기에도 맛있어 보이죠? 바스크치즈케이크, 푸딩, 쿠키 등 다양한 종류의 디저트들이 있어요. 특히 처음에 언급했듯이 해피니스인어데이는 최고의 재료를 엄선해서 수제로 디저트를 제작하는 연남동 카페인데요? -발효 고메버터 (유지방 함량 높아 풍미가 뛰어남) -유기농 밀가루 (청정지역에서 유가농법으로 재배) -깔리바우트 (카카오 함량이 높음) -발로나 초콜릿 (발로나사의 초콜릿) 이처럼 실제로 좋은 재료들을 사용하여 손님들에게 퀄리티 좋고 맛있는 디저트를 제공하기 위하여 노력하는 곳이더라고요. 요즘 날씨가 많이 덥죠? 맛있는 디저트와 함께 아아 한잔 땡겨주면 그게 힐링💚 특히 연남동 카페 해피니스인어데이의 디저트들은 커피 한 잔과 함께 즐기기에도 조합이 잘 어울려요👌 수제로 만들어서 그런지 식감도 좋고 맛도 풍미가 더 잘 느껴져요!! 사실 재료도 넘 좋은 거 쓰시고 해서 비쌀 줄 알았는데 원재료 대비 디저트 가격이 가성비 있는 편이더라 굳굳 디저트 4개 이상을 구매한 손님에게 수제 쿠키 1개를 추가로 증정하는 이벤트도 진행하고 있으니 놓치지 마세요!! 또 근방에 사시는 분들께 꿀팁 드립니다🍯 연남동 디저트 맛집 해피니스인어데이는 테이크아웃이 가능하답니다! 또한 현재 마포구(연남/홍대)근방 '배달의민족'으로 배달해서 드실 수도 있으니 편하게 맛있게 집에서도 즐길 수 있다는 거!!!!! 연남동 카페 어디갈까 찾고계신 분들 수제 디저트 좋아하시는 분들 연남동 디저트 맛집 해피니스인어데이 가보세요😜 연남동 디저트 카페 해피니스인어데이 (HID)(@hid_yeonnam) • Instagram 사진 및 동영상 팔로워 787명, 팔로잉 62명, 게시물 54개 - 연남동 디저트 카페 해피니스인어데이 (HID)(@hid_yeonnam)님의 Instagram 사진 및 동영상 보기 www.instagram.com 해피니스인어데이 서울특별시 마포구 동교로46길 7 201호"
