title,content
"[연남동] 믜요, 다정한 세트(2인) 후기","믜요 서울특별시 마포구 동교로 256-10 2층 저번에 경복궁 생과방을 다녀온 뒤로, 전통다과를 다시 먹어보고 싶어서 곰이랑 둘이서 '믜요'라는 다과를 판매하는 카페에 다녀왔다. 가격대가 있는 편이지만 그만큼 다과가 너무 맛있어서 계절별로 또 가고 싶어지는 곳이었다. [연남동] 믜요 🕑 영업시간 | 13:00 - 20:30 * 월요일 정기휴무 📌 네이버 예약으로 사전예약 후 방문 \ 가격 | 다정한 세트(2인), 1인당 24,000원 2023.10.13 금 방문 @ 건물 외부 3층에 위치한 믜요. 계단으로 올라가면 철문이 하나 나오는데 그 문을 밀면 믜요로 들어갈 수 있다. @ 가게 내부 내부는 깔끔함의 정석. 테이블은 2인용 3개 정도 있었고, 개인이 앉을 수 있는 1인용 바 테이블이 하나 있다. 우리는 제일 처음 도착해서 동그란 테이블에 앉았다. @ 기본 세팅 자리에 앉으면 이렇게 기본적인 세팅이 되어있다. @ 웰컴티 웰컴티로 한 입 마실 수 있는 사이즈의 차를 내주시는데, 깔끔하고 목이 시원해져서 다과를 먹기 전 준비하는 느낌이 들었다. 웰컴티와 함께 준비된 메뉴판에서 차를 고르면 된다. 아이스티를 먹어보고 싶었는데 주문이 안된다고 해서 차로 선택했다. 차 이름이 생각이 안 나는데 옅은 복숭아맛이 나는 차라고 해서 골랐다. @ 선택한 차 뜨겁게 / 차갑게 중에 얼죽아인 나는 차갑게를 선택했다. 정말 옅은 복숭아맛이 나면서 꽤 시원한 맛이었다. 아주 만족스러웠다. @ 다정한 다과 세트 주문한 다과 세트가 나왔다. 개성주악, 양갱, 밤으로 만든 다과, 개성주악 2개, 피칸 정과가 구성이었다. 다른 분들 후기를 보니 다과의 종류는 매번 바뀌는 듯 하다. 가을이라 밤으로 된 다과가 나왔다. @ 주악 경복궁 생과방 때도 제일 만족스러웠던 다과 중 하나가 주악이다. 그때 먹었던 맛이랑 비슷했다. 찹쌀도넛과 가장 비슷한 맛. 사장님이 메뉴를 설명해주셔서 먹기 전 이게 무슨 맛이 날지 생각해보는 재미가 있었다. 피칸 정과부터 먹었는데, 진짜 역대급으로 내 취향이었다. 차랑 먹으니 그 맛이 두배로 좋았다. 네모난 다과가 개성주악인데, 나한테는 개성주악과 피칸강정이 제일 맛있었다. 순위를 매겨보면 아래와 같다. 개인적인 선호도 개성주악 = 피칸강정 > 동그란 다과(이름이 생긱이 안남) > 주악 > 밤 모양 다과 >>>>>>> 양갱 (양갱을 원래 싫어함) 가격대가 2인 합쳐서 24,000원이 아니라 1인당 24,000원이라 비싸다고 느껴질 수 있으나, 그만큼 다과가 맛있었다. 가을에 가봤으니 계절별로 다과가 달라진다면 계절별로 가보고 싶을 정도로 맛있고 분위기가 정말 좋았다. 다음 번에는 겨울이나 봄에 가보고 싶다. 아주 만족스러웠음."
연남동 찻집 - 믜요 데이트 소개팅 디저트 카페,"믜요 서울특별시 마포구 동교로 256-10 2층 영업시간: 13:00~20:30(매주 월요일 휴무) 예약제로 운영: 네이버 예약 필수 주차 불가, 도보 추천 복잡한 연남동에서 조용하고 편안한 디저트 카페를 찾는 분이라면 좋아할 찻집을 소개하려고 합니다. 믜요 예약 방법 믜요는 예쁜 전통 다과와 차를 함께 마실 수 있는 공간인데요. 워크인 방문으로는 이용이 어려워서 꼭! 예약을 하고 가야 해요. 예약 방법은 아래 링크를 누르시면 예약 페이지가 나오는데요 네이버 지도 믜요 map.naver.com 아래 이미지처럼 다정한 세트와 아담한 세트 중에서 원하는 메뉴의 예약 가능 시간 중 편한 일정과 시간을 선택한 뒤 예약금을 결제하면 끝!! 노쇼를 방지하기 위해서 예약금은 선불로 받고 있는 것 같았어요. 1인당 5천원씩 미리 결제해야 예약이 완료되는 점 꼭! 참고해주세요!! 믜요를 살펴보자 테이블 세팅은 이렇게 정갈한 개인 차림상으로 되어 있어요. 그리고 중앙에는 오늘의 과자를 확인할 수 있게 메뉴판이 놓여져 있답니다. 특히 찻자리의 즐거움을 위해 도예작가님들의 그릇을 선별하여 준비했다고 해요. 그래서 고급스러운 테이블 분위기를 연출할 수 있었던 것 같아요. 다른 테이블도 너무 깔끔하게 꾸며져 있어서 어느 자리든 편안한 느낌으로 차를 즐길 수 있을 것 같았어요 특히 테이블과 찻집 중간중간에 식물을 배치한게 더 편안함을 강조할 수 있었던 것 같아요. 믜요에서 즐길 수 있는 차의 메뉴판이에요. 차, 밀크, 그리고 사이드과자의 정보가 담겨있는데요. 혹시 다른 종류의 차가 궁금하다면 7천원을 추가하면 또 다른 차를 주문할 수 있다고 해요 그런데 주문한 찻잎으로 또 차를 내릴 수 있기 때문에 저는 도향 우롱만 마시기로 했어요 차 주문을 마치면 조금 뒤에 주문한 차를 직접 우려서 서빙을 해주시는데요. 이렇게 차의 향도 맡을 수 있도록 찻잎도 함께 주십니다. 따뜻한 차를 따르면서 향이 느껴졌는데요. 밖은 추웠는데 따뜻한 복숭아 향의 차를 따르니 포근해지는 기분이었어요. 차를 즐기고 있다 보면 전통 과자가 나오는데요. 이곳에서 직접 만든거라고 해요 그러면 본격적으로 오늘의 과자를 살펴볼게요. 아까 메뉴판에서 본 화과자와 개성약과, 대추 주악, 보늬밤 양갱, 율란, 피칸 강정입니다. 사실 저는 대추는 좋아하지 않아서 대추를 다 빼고 먹었다는... ㅋㅋ 약과와 화과자, 밤 양갱 모두 너무 맛있었어요. 일반 디저트는 너무 달기만 한데, 여기는 은은한 달콤함으로 건강하고 편안하게 즐기는 디저트였어요. 특히 피칸 강정은 미용실에서 우연히 먹다가 대량으로 구매할까 고민했었는데 이렇게 먹게 되어서 너무 반가웠답니다!! 이제 모든 메뉴가 나오면 예약한 시간부터 1시간 반 동안 편한하게 이야기를 나누면 됩니다. 데이트나 소개팅을 준비 중이라면 조용하게 서로 대화 나눌 공간이 연남동에는 많지 않은 것 같은데, 믜요는 딱 맞는 공간이라고 생각해요 연남동에서 식사를 하게 된다면 믜요에서 편안한 티타임을 가져보는건 어떠세요? 다음에도 좋은 곳을 소개하도록 하겠습니다!"
"믜요 | 차분한 휴식이 필요할 때, 홍대입구 연남동 신상 티 카페","마음에 여유를 주는 곳, 차분한 분위기의 티 카페 '믜요' #연남동카페 #홍대입구카페 #홍대입구역카페 믜요 서울특별시 마포구 동교로 256-10 2층 📍위치 : 서울특별시 마포구 연남동 228-32 3층 ⏰ 운영시간 : 13:00 - 20:30 *매주 월요일 휴무 🔍 참고사항 • 예약제로 운영 (네이버 예약) 믜요:다과점 茶菓店(@muiyo___) • Instagram 사진 및 동영상 팔로워 352명, 팔로잉 205명, 게시물 78개 - 믜요:다과점 茶菓店(@muiyo___)님의 Instagram 사진 및 동영상 보기 www.instagram.com 지친 일상에 여유가 필요할 때 가보면 좋을 곳, 연남동 카페 '믜요' 찻잎을 덜고, 물을 부어 우려내고, 다시 컵에 조금씩 따라 마시고. 그 과정을 보는 것만으로도 마음에 평안이 찾아오기도 한다. 그래서 방문해 본 카페! 코 끝을 은은하게 스치는 인센스 향과 차분한 음악이 맞아주던 곳 북적이던 연남동 거리와 달리 조용한 분위기의 아담한 공간이 기다린다. 4개의 의자가 놓인 바 테이블과 2인 테이블 2개, 3인 테이블 1개로 이루어진 좌석 2-3인 정도의 인원이 방문하기 좋다. 따뜻한 차를 마실 수 있는 공간에 어울리게 편안함을 주는 짙은 우드톤 가구들로 채워진 곳 예약제로 운영되고 있는 티 카페 믜요. 다정한 세트 / 아담한 세트 중 원하는 옵션을 골라 예약을 하면 시간에 맞춰 미리 세팅을 해주신다. 내가 예약한 옵션은 '아담한 세트'로, 한 종류의 차와 세 가지의 미니 다과가 제공된다. 매달 정해진 미니 다과를 맛볼 수 있고 차는 각자의 취향에 따라 선택하면 된다. 건네주시는 책자에 차에 대한 설명이 잘 나와있어 차를 몰라도 쉽게 고를 수 있다. 본격적으로 차를 마시기 전, 웰컴 티로 내어주신 녹차! 어쩐지 갑자기 더워진 날씨에 힘들었는데 시원한 녹차로 씻어낼 수 있어 좋았다. 주전자와 잔에 뜨거운 물을 몇 번 부어 데운 뒤, 찻잎을 골라 담아 우려낸다. 그 사이 다양한 생김새의 잔 중 원하는 찻잔을 고르기! 모두 도예 작가님들의 그릇이라고. 다 우려진 차를 숙우 (물 식힘 그릇)에 담아주시면 원하는 만큼의 양을 찻잔에 따라 마시면 된다. 차와 함께 즐길 수 있는 오월의 과자도 나왔다. 오월의 과자는 잣가루를 버무린 개성약과, 호두 알 양갱 그리고 곶감 쌈으로 구성됐다. 믜요에서 맛볼 수 있는 다과들은 모두 사장님께서 직접 만드신다고. 생김새가 정말 예뻐 먹기 아까웠다. 정성 가득한 만큼 맛도 물론 완벽했던! 일행이 주문한 메뉴들로 차려본 한상! 상차림이 정말 예뻐 계속 카메라 셔터를 눌러댔다. 찻잎으로 우려낸 차를 좋아하지 않는 사람들도 있다. 그런 사람들을 위해 사진 속 메뉴와 같이 말차 라떼, 밀크 티 등 우유가 더해진 음료도 만나볼 수 있다. 🔽 인스타그램으로 카페 정보 보기 🔽 카페인 다이어리(@caffe_ine_diary) | Instagram 팔로워 7,878명, 게시물 409개 - 차곡차곡 쌓아가는 카페 공유장 ⠀ • 수원, 용인 카페 + 서울 및 기타 지역 • 번외편 (맛집 숙소 전시) • 협업 및 문의는 DM www.instagram.com"
"[ 믜요 ] ; 연남동 찻집, 한식 디저트 카페","☕️ 믜요 📍 서울 마포구 동교로 256-10 2층 ⏰ 13:00 - 20:30 ( 예약제 ) 월 휴무 믜요:다과점 茶菓店(@muiyo___) • Instagram 사진 및 동영상 팔로워 1,014명, 팔로잉 215명, 게시물 109개 - 믜요:다과점 茶菓店(@muiyo___)님의 Instagram 사진 및 동영상 보기 instagram.com 연남동에 위치한 다과점, 믜요 차와 다과상이 나오는 세트들은 예약 후 방문 가능하며 6종류 다과의 다정한 세트, 3종류 다과의 아담한 세트가 있으며 네이버에서 예약 가능하다. ⬇️ 믜요 : 네이버 방문자리뷰 72 · 블로그리뷰 21 m.place.naver.com 매장이 크지는 않지만 테이블 간 거리도 있고 깔끔한 분위기라 불편한건 하나도 없었다. 우리가 방문한 시간에는 우리뿐이었음! 🍀 사장님이 준비하시는 곳.~ 6종류의 다과와 음료가 나오는 다정한 세트 ( 2인 48,000₩ ) 로 예약하였고, 다과는 계절에 따라 달라진다. 이 날의 다과는 화과자 개성 약과 대추 주악 보늬밤 양갱 율란 피칸 강정 음료는 차, 밀크티로 나뉘어져있으며 따뜻하게, 차갑게 고를수 있다. 차를 고르면 먼저 내어주시는 웰컴티 시원해서 바로 목 축이기 좋았다. 이름은 기억이 안나요…ˊ•̥ ̯ •̥` 내가 고른 차 ; 21春 도향 우롱 ( 백도 향료를 가향한 차, 과하지 않은 복숭아의 달달한 향이 은은하게 감도는맛 ) 이라고 한다. 설명처럼 은은한 복숭아향이 부드럽게 들어와 다과랑 마시기 좋았다. 차를 내어주시며 차호 뚜껑을 열어 향을 맡아보라 설명해주시는데 우려진 찻잎의 향이 진또배기이당… 꼬소하고 달달한게 어떻게 향에서부터 느껴지는지… ⁰̤̑ ₀̑ ⁰̤̑ .ෆ⃛ 차는 더 우려주시니 꼭 요청해서 n번 마시기! 믜요는 다과점.. 고로 메인은 다과라는 말! 테이블에 직접 하나하나 플레이팅해주신다. 너무 예뻐서 입으로 들어가기 전에 눈으로 먼저 먹었음… 플레이팅된 잎사귀들은 모두 생화 🌿 너무 내 스타일 ♡ᜊ♡ 예쁜건 다시보기 피칸 강정 시간이 지나면 눅눅해지니 먼저 먹으라한 피칸 강정 다들 하얀풍차의 엘리케이터라는 빵? 과자? 를 아시나요.? 파샥한 페스츄리 위에 달달한 피칸이 올라간 빵인데 초딩때 내 최애 디저트였다. 그 페스츄리 위에 올라간 추억의 피칸 맛 흑흑 ଵ˛̼ଵ 피칸에 달달한 코팅이 되어있어 꼬소 + 달콤하고 이거 진짜 계속 집어먹으면 몇 개 먹었는지도 모를 맛이다… 대추 주악 처음 먹어보는 개성주악 겉에 조청이 엄청 진득해서 손으로 먹을때 다 묻기 때문에 물티슈도 주신다. 생각보다 더 쫀득해서 질깃한 정도.? 난 그런 식감을 좋아해서 완전 맘에 들었다. 찹쌀 도너츠 고오급 버전… 또 먹고싶다. 율란 공주 햇밤으로 만든 율란 되게 부드러워서 입에 넣자마자 녹는다. 자칫 평범했을 밤맛을 돋보이게 만들어준 계피가루가 킥 ᵍᵒᵒᵈᵎᵎ 개인적으로 차와 마시기는 제일 좋았던 다과라고 생각한다. 🌰 보늬밤 양갱 마트에서 파는 연양갱 생각하고 먹었는데 즁말 차원이 다른맛이다. 생각보다는 달지 않고 부드럽다. 보늬밤도 직접 만드신다고 하니 맛이 있을수밖에. ⁽̨̡ ¨̮ ⁾̧̢.•♥ 개성 약과 약과는 워낙에 좋아해서인지 무난하게 먹었다. 일반 약과랑 좀 다르긴 하지만 특색은 없는? 화과자 화려해서 제일 마지막까지 남겨둔 화과자 달것같이 생겨놓고 6가지 다과 중에 제일 안달다. 겉은 부드럽고 안에는 곶감 앙금이 들어서 식감을 더해준맛. 개성주악과 피칸강정은 개별 구매 가능하다. 순식간에 지나간 90분 🕧 믜요의 잔잔한 분위기가 그 날의 나를, 그리고 우리를 차분하게 만들었다. 시끌벅적한거 안좋아하는 나로서는 최고의 공간이었고 바쁘게 흘러가는 시간들 속에서 잠시 쉼을 느껴서 정말 행복했다. 계절따라 바뀌는 다과들 먹으러 또 가고싶다! 잘 마시고 잘 먹고 잘 쉬다 갑니다.~ 💛 #믜요 #연남동믜요 #연남카페 #홍대카페 #연남찻집 #홍대찻집 #서울찻집 #한식디저트"
[연남동 맛집 소개] 차와 과자가 맛있는 믜요,"오늘은 차와 과자 맛집 ‘믜요’를 소개하려고 합니다! 계속 가고 싶었던 곳인데 드디어 어제 엄마랑 같이 방문하게 되었어요! (예약 후 방문하시는 걸 추천합니다!) 공간도 너무 예쁘게 잘 꾸며져 있었고, 도착하니 웰컴 티도 내어주셨습니다 :) 저희는 ‘다정한 세트’로 예약했어요. 차는 각자 선택할 수 있는데 저희는 백모단과 금훤으로 주문했고, 과자는 달마다 정해져있는 과자들로 준비해 주셨습니다. 왼쪽은 백모단, 오른쪽은 금훤입니다. 차가 정말 맛있었어요. 향도 좋고 은은하고 깔끔한 맛이었어요 과자 역시 눈으로도 입으로도 너무 맛있었습니다..💛 (세팅도 너무 예쁘게 해주셨어요!) 저랑 엄마는 화과자가 최애픽이었습니다🥰 재방문 의사 너무 있습니다! 믜요 서울특별시 마포구 동교로 256-10 2층 #믜요 #연남동맛집 #차와과자 #연남동가볼만한곳"
"연남동티룸 프라이빗 티코스,연남동찻집 믜요","믜요 서울특별시 마포구 동교로 256-10 2층 이제 제법 따뜻한 햇살이 익숙질 5월 이 계절을 즐기기위해 티코스를 예약해 가기로 했다. . 평소에는 스타벅스나 투썸같은 프랜차이즈카페를 많이 애용하지만 오늘은 시작하는 5월이라 연남동 티카페, 믜요를 찾아 갔다. 오픈한지 며칠 되지않아 아직 가오픈 중이다. . 믜요는 예약제로 네이버예약에서 날짜와 시간을 선택해 예약해주면 된다. . 주소엔 2층이라되어있지만 3층같은 느낌이고 아직 밖에서 볼수있는 간판이 없는건지 아님 내눈에 안보인건지 다시 연락해 확인하고 찾아갔다. (카레집 윗층이 맞음) 첫 느낌은 심플하고 단정해 느낌이 좋았다. . 내 자리가 셋팅되어진 모습 오늘의 티푸드가 적혀있는 메뉴판이 참친절하다. 월컴티로 시원한 냉차를 준비해주셔서 땀이 진정이 되았다. 다기에서도 계절감이 느껴져서 넘 좋다. 차는 메뉴판에서 고르면 차를 우려주신다. 그 전에 내 찻잔을 고를 수있는 멋찐기회도 주신다. 우린차는 향을 맞고 눈으로 차물의 색을 보고 그 다음 코로 향을 맡으면서 입으로 맛을 본다. 아,따뜻하다. 지금 내 오감이 모두 열일을 한다. . 그리고 몇번 더 우려 마실 수 있어 좋다. 티마스타님께서 2번 더 맛있게 우려주셔서 차는 열심히 마실수있다. 믜요는 차도 좋아하지만 티푸드가 더 주력하는 곳이란다. 마스터님의 한땀한땀의 손길이 들어가 만들어지는 티푸드들. . 차와 과자:다정한 세트 차와 과자:아담한 세트 가 있는데 난 차와 과자:아담한 세트 예약 아담한 세트 구성은 차 한잔과 잣가루를 버무린 개성약과. 호두 알 양갱 곶감 쌈 이다. 차 한잔과 함께 하기에 충분하다. . . 차를 마시면 티마스터님과 이런 저런 이야기도 나누면서 티마스터님의 감가과 애정을 더욱 더 담겨진 공간인것을 느껴다. 나같으면 없애을 천장의 구조물을 독특하게 살려 이 공간이 더 멋있어졌다. 창살도 포기할 수 없는 디자인으로 이 공간이 더 멋스럽고 주인장의 감각이 느껴지는 곳이였다. . 연남동에 오게 되면 다시 한번 믜요를 찾아 내 감각을 다시 느끼는 시간을 가져 볼 것같다."
[믜요] 연남동 개성주악 한식 다과 디저트 카페,요즘 유튜브 알고리즘에 탕후루와 개성주악이 정말 많이 뜬다. 달달구리 간식이 유행 중인데 영상을 계속 보다 보니 개성주악에 꽂혀서 가까운 곳에 개성주악을 파는 가게를 찾다가 발견한 '믜요' 한식 디저트 카페다. * 개성주악이란? 찹쌀가루와 소량의 밀가루를 곡주(막걸리)를 첨가하여 반죽해서 기름에 튀기는 떡으로 조청과 꿀로 달콤하게 즙청한 떡 믜요 서울특별시 마포구 동교로 256-10 2층 고깃집 사이 골목으로 쭉 들어가면 나오는 건물 2층에 있다. 현관문을 열고 들어서면 보이는 곳! 아담하고 작은 가게로 100% 예약제 운영이다. 나는 개성주악만 포장할 거라서 바로 방문했다. 테이블은 3~4테이블 정도이다. <예약 방문 시 참고!> 네이버 예약으로 팀 당 90분 이용 가능하고 노쇼 방지 예약금 인당 5천 원 있음! 다정한 세트: 차 + 6종류의 한과 세트 / 인당 2.4만 (7~8타임으로 시간 대가 다양한 편) 아담한 세트: 차+ 3종류의 한과 세트 / 인당 1.8만 (1시 / 3시 30분 / 6시) * 개성주악은 포장 가능 예전에 자주 가던 다과 카페가 있었는데 없어져서 너무 아쉬웠는데 가까운 곳에서 다시 다과를 즐길 수 있어 기뻤다. 아담하지만 정갈하고 조용하게 수다떨기 좋은 힐링 공간이었다. 미리 전화 주문한 개성주악! 개당 3천 원이다. 일단은 궁금했던 개성주악을 포장해서 먹고 분위기가 좋아서 다음에 예약해서 방문해 보려고 한다. 예쁜 그릇에 옮겨서 담으니 정말 먹음직스러웠다. 홍시 느낌도 나고 귀여운 개성주악 겉면이 조청으로 발라져 있어서 찐득거리고 그릇으로 옮기는 게 쉽지는 않았다. 생각보다 엄청 딱딱해서 나이프로 조금씩 잘라서 먹었다. 유과와 약과 맛이 나면서 은은하게 시나몬 맛이 나는 느낌? 딱딱하지만 잘라서 먹으니 은근 촉촉하면서 맛있었다. 기름기가 있는 겉면은 쌀 도넛 느낌도 나고 쌀 조청과 만나서 촉촉하면서 쫄깃한 식감 흰쌀 부분은 쌀 조청과 함께 어우러져 슴슴하면서도 달달한 순한 맛 맛있는 디저트였다 ㅎㅅㅎ 호박팥차랑 같이 옴뇸뇸 원래도 전통 한식 디저트 좋아하는 데 자극적이게 달지 않으면서 식감이 쫀득해서 먹는 재미가 있었던 믜요 개성주악 다음번에 매장에서 다과 세트 먹어보고 추가 후기를 써야겠다 ㅎㅎ (내돈내산 후기)
"[일상] 유난히 내성적이었던 연남동 -경희대, 믜요, 연남동 소품샵, 선유도공원, 한강라면","저 서울!!!!! 놀러왔어요!!!!!! 연남동 투어. 가보자고. 연남동 투어라고 어그로 끌고 경희대 보여주기 서울 온 김에 경희대 학생인 척 캠퍼스 투어해봤습니답 *^^* 유난히 내성적이었던 대학생 김태리••• 아니 근데 태리 씨… 이거 어케 올라가셨어요 생각보다 높이가 장난 아니던데 [찻집] 떴으면 좋겠는데 안 떴으면 좋겠는 연남동 찻집 “믜요” 안녕하세요! 오늘은 제 첫 찻집 경험을 함께 나누고자…! 리뷰를 남겨 봅니다😚 당연히 내돈내산입니답.(... m.blog.naver.com (참고하세요!!!!!!!!!!!!!!) 오늘의 목적. 여유롭게 연남동 투어하기. 덕분에 여유 한가득 즐기고 나왔어요! 고양이가있는액자가게 서울특별시 마포구 연희로1길 46 진짜 고양이 천국 현실판. 여길 봐도 저길 봐도 고양이예요 입구부터 내 지갑 유혹하는 굉장한 녀석… 이 글을 쓰고 있는 지금까지도 눈에 아른아른하고요… 하놔 샀어야 했는데. 여기 킬포는 뭔지 아시나요 브금이 고양이 울음소리입니다(찐임) 근데 약간 (좀 많이) 킹받아요 진짜 ㅋㅋㅋㅋ 가 본 사람만 공감할 수 있는 킹받음… 생각보다 공간은 좁았는데 물건이 어엄청 많아서 구경하는 재미가 쏠쏠했어욥 몰랑갤러리 서울특별시 마포구 동교로 233 길 가다가 우연히 무섭게 귀여운 장소 발견. 어떻게 지나치죠? 들어갑니다. 뭐야!!!!!! 입구 가기 전 엘리베이터에서부터 귀여운 거 반칙이지!!!!!! 이렇게 귀여워서 어쩌자고… 너 이런 식이면 진짜… 곤란하다… 진짜 적당히 귀여워라… 선유도공원 서울특별시 영등포구 선유로 343 사실 여기서부터 할 말이 진짜 많아요. 제가 여기 온 목적은 <<✨🤍한강 라면🤍✨>>인데요 알고 보니 여기가 라면 스팟이 아니더만요…? 그래서 양화한강공원으로 이동하려는데 이동하는 길이 공사중임. 레알 어쩌자고… 그래서 우회해서 돌아가라는데 그냥 가는 곳마다 막힘 ㅠㅠ 길 헤맨 건 사진으로 인증할 수가 없어서 억울한데 암튼 1시간 헤맸어요 ㅋㅋㅋㅋㅋㅋㅋㅋㅋ 오로지 라면을 위한 그녀들의 열정,,, 진짜 지금 생각하면 광기네요? 그냥 집 가서 치킨 먹었어도 될 듯 양화 한강공원 서울특별시 영등포구 노들로 113 양화개나리점 중꺾마. 한 시간 넘게 헤매서!!!! 한강!!!!! 도착해쒀요!!!!!! 사실 지치고 지친 다음에 버스 타구 옴… 얼른얼른 자리 잡아 우리 지금 배고파서 포악하고 악랄하고 예민하니까. 흐끄급 내가 너만을 위해 1시간 넘게 걸었다는 걸 알고 있니 근데 그 와중에 옆에 기기 고장남 뭐야 고쳐줘요 와!!!!!!!!! 나도 이제 어디 가서 한강 라면 먹었다고 자랑할 수 이쒀!!!!!!!! 근데 야무지게 먹고서 소신발언하는데요 이게 4천 원은 아니지 않아요? 너무 얼탱구리예요 여러분은 컵라면 드세요 별 차이 없슴다… 어떻게든 한강이랑 라면을 같이 찍겠다고 노력하는 모습이 애잔하다… 그냥 한강라면 가격의 80%를 차지하는 그릇 자랑하는 사진 됨 그리고 냅다 자랑하는 걸음 수… 분명 목적은 여유로운 연남동 투어였는데요? 엄… 암튼 그렇게 됐습니다… 오늘도 의도치 않게 바쁘게 살아보았어요! (웃프다) 마지막으로 꼭 하고 싶은 말은 여러분은 한강라면 드시려면 꼭 양화한강공원 가세요… 선유도공원 손절하십시오… 제발… (이랬는데 선유도공원에서도 라면 가능하면 어쩌지?) 경희대 캠퍼스 투어 김태리 사자상 서울 연남동 투어 여행코스 추천 갈만한 곳 놀거리 소품샵 카페 찻집 갤러리 포토존 포토스팟 믜요 고양이가있는액자가게 갤러리몰랑 몰랑이 선유도공원 양화대교 양화한강공원 한강라면 진짬뽕 참깨라면 삼각김밥 만보걷기 일상 블로그 블로거 이웃추가 서이추 서이추 환영"
