title,content
[공지] [후기] 빼빼로데이 레끌라 크리스마스 선물 연남동 홍대 피칸파이 생초코 봉봉 쇼콜라 위스키 봉봉 초코쿠키 대량 임직원 선물,빼빼로데이는 끝났지만 레끌라의 수제 버터 스틱 제작은 아직 끝나지 않아서 후기 포스팅이 늦었어요. 빼빼로데이 전부터 미리 사전 예약해 주신 건이 많아서 이번 주 오늘까지 수제 버터 스틱 빼빼로 만들었어요. 외국에 나가실 때 픽업하시고 서울 올라오실 때 픽업하고 싶다고 하셔서 ^^ 23년도 빼빼로데이도 많이 많이 구매해 주셔서 감사합니다.!! ♥♥ 12/1일 물량은 금빛 리본으로 12/2일부터 피칸파이(타르트) 홀 사이즈만 리본 레드 그린 골드 색상으로 변경됩니다. 레끌라가 사용하는 리본은 모두 단가가 있는 리본입니다~! 레끌라는 크리스마스에도 초콜릿류나 피칸파이가 많이 판매되어 별도의 크리스마스 제품은 만들지 않고 있으나 그래도 느낌은 내줘야 하니 요란스럽지 않게 깔끔하고 고급 진 리본으로 12월 한 달간 소진 시까지 변경되어 판매됩니다. (여력이 되면 다른 제품도 만들도록 하겠습니다) 올해부터는 다른 제품에 집중하고자 봉봉을 제작하지 않으려 했지만 문의를 많이 주셔서 패키지 수량 구색 갖추기가 아닌 맛있고 선호하시는 8가지 가나슈 레시피만 뽑아서 패키지 판매합니다. 8구 패키지만 봉봉 쇼콜라 그 외에는 위스키 봉봉 패키지입니다.(↑사진 제품 설명서 제작 중) 레끌라 수제 버터 스틱 빼빼로는 10년 넘으신 고정 고객님들이 무지 많으세요~ 이번에는 매일 새벽 출근해서 당일 판매 제품 포장 컷만 남길 수 있었습니다. 10일 금요일은 모든 제품이 품절되어 11일 제품을 다시 처음부터 만들어야 하는 상황이 되어 12년 차 레끌라 빼빼로 달인들 다시 지원 요청 밤새 추가 제작 23년도 레끌라 빼빼로 패키지는 총 4가지로 구성되었습니다. 11일 토요일 물량 급하게 다시 만들고 일부 제품 컷!! 택배 시 포장 컷!!!! 레끌라 서울특별시 마포구 동교로 266-6 2층 LECLAT 사소한 차이가 다른 결과물을 만든다!! [후기] 빼빼로데이 레끌라 크리스마스 선물 연남동 홍대 피칸파이 생초코 봉봉 쇼콜라 위스키 봉봉 초코쿠키 대량 임직원 선물
[답례품] 연남동 레끌라 시보 해제 스승의 날 어버이날 어린이날 임직원 선물 거래처 선물 피칸파이 수제 초콜릿 웨딩 답례품 결혼 홍대 수제 초콜릿 에그타르트 디저트 맛집,"레끌라 제품들은 거의 선물용으로 꾸준히 예약 주시고 주문을 해주셔서 어버이날, 스승의 날이라고 해서 별도로 제품을 만들어 미리 예약을 받거나 하고 있지 않습니다. 기존처럼 예약 구매해 주시면 되세요^^ 지금 주문량이 많아지고 있으니 스승의날, 어버이날 전 꼭 수량이 많을 시 미리 예약창에서 해주시면 되세요^^ 월요일 새벽에 출근해서 퀵으로 발송한 시보 해제 답례품입니다 시보 해제란? 공무원 시험에 합격 후 연수가 끝나면 감사의 인사로 드리는 선물이라고 합니다. 웨딩 답례품 다음으로 문의가 많아 몇 년 전에 찾아 봤습니다.ㅋㅋ 레끌라에서만 있는 레시피의 피칸파이와 수제 초콜릿으로 이루어진 패키지 대량 주문이 들어오면 어디에 사용되는지 잘 모르는 경우가 있는데 받아 보신 고객님들이 전화 주셔서 어느 행사에서 받았는데 주문하는 방법 등을 문의해 주셔서 알게 되는 경우가 너무 많은 레끌라 제품이에요^^ [답례품] 연남동 레끌라 시보 해제 스승의 날 어버이날 어린이날 임직원 선물 거래처 선물 피칸파이 수제 초콜릿 웨딩 답례품 결혼 홍대 수제 초콜릿 에그타르트 디저트 맛집"
"[위스키 봉봉] 레끌라 연남동 명절선물 수제 초콜릿 밸런타인 17년산 발베니, 맥켈란 12년산 선물 위스키 봉봉 몰드 위스키 봉봉 홍대 연희동 최고급 초콜릿","위스키 봉봉 시럽 온도 작업 후 위스키를 적절히 섞어서 알코올을 날린 후 위스키의 고유한 향을 느끼시는 최고급 수제 초콜릿입니다. 그래서 좋은 위스키일수록 향이 달라요. 위스키 봉봉은 장기 보관이 불가능하며 햇볕 없는 서늘한 곳 실온 보관입니다. 냉동 보관 불가!! 기존에 항상 꾸준히 했던 밸런타인 17년산 위스키 봉봉만 제작했는데 발베니 12년산, 맥켈란 12년산 추가 구성됩니다. 요즘 구하기 힘들다는 12년산 발베니, 맥켈란 (입고 즉시 품절되는 제품들) 17년산은 저희 집 밑에도 항상 진열되어 있다는.... 발베니, 맥켈란 12년산 품절 시 글레 피딕 12 or15년산, 달모어 12년산 위스키로 대체됩니다. 발베니 12년산은 장미 모양 몰드 가운데 원형 (참조 밸런타인 17년산 5구 10구_홈페이지) 밸런타인 17년 산은 기존과 동일한 술통 모양 몰드 가운데 원형 맥켈란 12년산 주름 모양 원형 몰드 가운데 원형 (참조 밸런타인 17년산 5구 10구_홈페이지) 구성은 3가지 위스키 각각 5구, 10구 오렌지 패키지로 구성되며 추가로 15구 패키지는 3가지 위스키가 모두 구성될 예정입니다.(시즌 패키지) 참고로 날씨가 아직 뜨거워서 제작 시기를 조금 늦추고 있습니다. 제작과 동시에 홈페이지 예약창 오픈합니다. 레끌라 서울특별시 마포구 동교로 266-6 2층 LECLAT [위스키 봉봉] 레끌라 연남동 수제 초콜릿 밸런타인 17년산 발베니, 맥켈란 12년산 선물 위스키 봉봉 몰드 위스키 봉봉 홍대 연희동"
[22년도] 밸런타인데이 설날 연남동 레끌라 예약 일정 설날 주문 마감 일정 택배 발송 초코쿠키 수제 초콜릿 연희동 홍대 피칸파이 맛집 거래처구선물 임직원 선물 홍대,설날(구정) 주문 마감!!! 2022년 1월 23일 23시 59분 결제 완료(선물하기는 미 수락 시 설날 이후 발송) 주문량에 따라 조기 마감될 수도 있습니다. 마지막 택배 발송 1월 25일(수요일) 별도의 요청 없을 시 피칸파이 발송 일정 참조!! 구정 선물 밸런타인 17년산 위스키 봉봉 수제 초콜릿 예약 기간 2022년 1월 15일 00시~23일 23:59분 결제 완료 마감 택배 발송 25일 모두 발송 다른 제품 추가 구매 시 예약 제품과 동일 발송합니다. 밸런타인데이 택배 예약 마감 2월 7일 24시 결제 완료 -> 10일 모두 택배 발송(대량 작업으로 추가 일정 없음) 2월 11일~ 매장 예약 없이 구매 가능 제품 홈페이지 참조 부탁드려요^^ 품목에 따라 조기 품절될 수 있습니다!! 레끌라 leclatdechocolat.co.kr 밸런타인데이 봉봉 패키지 예약 일정(위스키 봉봉 포함) 2022년 1월 28일 00시 ~2월 7일 23:59분 결제 완료 마감 보내는 날짜 선택 2월 10일 목요일 모두 발송 다른 제품 추가 구매 시 예약 제품과 동일 발송합니다. #항공 샷 매일매일 반복 작업 중!! 피칸파이 홀 사이즈 버터 반죽 틀 작업 새로운 제품이 들어갈 NEW 패키지 http://www.leclatdechocolat.co.kr/ 레끌라 www.leclatdechocolat.co.kr 위 홈페이지 업데이트 위스키 봉봉 단품!! 무스 카딘 쇼콜라 아마드 오랑젯 패키지 위스키 봉봉 생초코 명절 선물로 최고인 레끌라 피칸파이 [초콜릿] 위스키 봉봉 연남동 레끌라 밸런타인 17년산 설날 주문 마감 일정 택배 발송 초코쿠키 오랑제 무스 카딘 수제 초콜릿 연희동 홍대 피칸파이 맛집 거래처구 정 선물 임직원 선물 설날 선물 구정선물
[피칸파이] 레끌라 연남동 단체 주문 관공서 대기업 임직원 선물 답례품 디저트 수제 초콜릿 생일 케이크 명절 선물 크리스마스 선물 수제 버터 스틱 빼빼로데이,"대량 물량 작업 중에도 택배 주문, 픽업 예약, 매장 구매는 변함없이 계속~~ 진행됩니다. 이번 물량은 피칸파이 홀 사이즈 한 박스 + 피칸파이 4EA 한 박스 요로코롬 set로 진행된 작업입니다. 주 거래처 관공서 or 대기업or 대학병원 등 물량!!! 레끌라 제품은 드셔본 분이 소개하시거나 답례품으로 받아보신 업체에서 재 문의가 많아요. 저렴하면서 여러 가지가 들어있는 답례품보다 단품으로 단가가 있는 제품을 선택하시는 분들의 안목!! 받아보신 분들이 재구매와 단체 선물로 계속 이어지는 이유입니다. 추석 전부터 물량으로 지난주까지 정신없이 쫓기듯 보내고 오늘에야 좀 초콜릿을 만져봅니다. 수제 버터 스틱 빼빼로도 곧 홈페이지에 사전예약분 업데이트합니다. 레끌라 서울특별시 마포구 동교로 266-6 2층 LECLAT"
[수제 초콜릿] 밸런타인데이 레끌라 연남동 가나슈만들기 흑임자 피스타치오 유자 디핑초콜릿 봉봉쇼콜라 화이트데이 홍대 연희동 커버추어 선물 임직원 몰드 하트 초콜릿 입술 위스키 봉봉,"아래 ↓ 사진 위스키 봉봉 패키지에 들어가는 원구 모양 현재 위스키봉봉 예약이 많이 들어오고 있어 순도 99.9999% 식용 순금을 서비스로 붙였습니다.(홈페이지 사진에는 없음) 포장 개봉 시 순금이 날아갈 수 있으니 꽉 붙잡으세요^^ 이번 봉봉 패키지는 작년보다 가격은 조금 내렸습니다.(초콜릿(커버추어) 원가는 주문할 때마다 오르지만요ㅠㅠ) 디저트가 주식이 아닌데도 추운 겨울날 찾아 주시는 고객님께 감사함에 코로나19 전과 동일하게 진행합니다.^^ 설날 전 택배 마감하고 3일 동안 픽업 예약으로 주문 들어온 피칸파이, 생초코(매년 바쁨이 업데이트하는 듯) 완료 후 떡국 먹고 밸런타인데이 초콜릿 만들기 돌입했습니다. 예전 수제 초콜릿만 할 때는 설날이 바쁜 때가 아니었는데 피칸파이를 판매하면서 변치 않고 매년 많은 수량을 주문 주시는 고객님 덕분에 감사한 나날을 보냅니다. 혹시나 질리실까 몇 년씩 오시는 고객님께 여쭈어보면 그럴리가요? 그렇게 말씀해 주셔서 완전 감사!! 디저트를 길게는 6년씩(피칸파이 판매하기 시작부터) 찾아오시고♥️♥️♥️ 아무튼 재구매율이 높은 레끌라 피칸파이 자랑이었습니다. 10월에 업데이트된 수제 초콜릿 봉봉 패키지는 모든 제품이 몰드(고객님들이 젤 선호하시는 모양) 11년을 디핑으로 명품 브랜드 작업을 한 디핑장이가 디핑 제품이 빠지면 되겠습니까!? (고객님들이 제일 선호하는 맛과 궁금해하시는 맛)으로 추가 업데이트 예정입니다. ☞밸런타인데이 수제 초콜릿 주문은 1월 29일부터★ (29일 전 업뎃완료 예정)_홈페이지와 픽업예약창에서 주문 가능(스마트 스토어 x) 레끌라 m.leclatdechocolat.co.kr 2월 9일 목요일 오전 11시 결제 주문 건 마감 2월 9일 목요일 택배 마지막 발송(별도로 원하시는 일자는 추후 안내) 2월 3일~14일 매장 구매예정 픽업예약창 29일 오픈 소비 기간 수령일로 15일!! 단! 습기 없고 햇볕 없는 서늘한 장소 15일 (장기 보관 시 밀봉 냉동) 차량 안 보관 금지!! 사전 예약 또는 주문량으로 인해 택배 마감 일정이 변경될 수도 있습니다. 흑임자 수제 초콜릿 (밀크 커버 추어+검은깨 페이스트+헤이즐넛 페이스트) 다크 커버추어 디핑 피스타치오 수제 초콜릿 (화이트 커버 추어+피스타치오 페이스트) 다크 커버추어 디핑 리얼 유자 수제 초콜릿 (밀크 커버 추어+유자 진액) 밀크 커버 추어 디핑 유자는 유자청 또는 유자 관련 공사 품을 사용하지 않고 매년 전남 고흥에서 수확했다는 알림 문자 오면 진액만 사용합니다. 유자 껍질 등 사용하지 않음 다크, 밀크, 화이트 커버 추어 각각 향과 맛 초콜릿으로 패키지 구성됩니다. 설날 피칸파이 등 물량으로 사전 제작 및 업데이트 늦었지 말입니다❤️ 맛 ☞☞ 밀크 커버추어 1구 = (유자 엑기스 + 밀크 커버추어) 다크 커버추어 1구 = (화이트 커버추어 + 피스타치오) 하트 모양 1구= (다크 커버추어 + 꿀)= 다크 커버추어 밀크 커버추어 1구 = (시나몬 + 밀크,다크 커버추어) 다크 커버추어 1구 = (밀크 커버추어 + 흑임자 + 헤이즐넛) 5구 패키지만 디핑, 몰드 제품 2가지 버전으로 업데이트합니다. 디핑 다크 피스타치오 와 다크 흑임자 검은깨가 콕콕 박힌 5구 패키지와 어울리는 리본 맞추기 스티커 붙였다 떼기 테스트 중 레끌라 서울특별시 마포구 동교로 266-6 2층 LECLAT [수제 초콜릿] 밸런타인데이 레끌라 연남동 가나슈만들기 흑임자 피스타치오 유자 디핑초콜릿 봉봉쇼콜라 화이트데이 홍대 연희동 커버추어 선물 임직원 몰드 하트 초콜릿 입술 위스키 봉봉"
[누가] 프랑스 누가 레끌라 연남동 블렁누가 고급 엿 견과류 엿 연희동 수제 초콜릿 초코쿠키 쇼콜라아몬드 오리지널 선물 수능 빼빼로데이 답례품 디저트 홍대 합정동 피칸파이맛집,"프랑스 누가 견과류 듬뿍 엿!!! 포스팅입니다. 견과류는 아몬드 피스타치오 호박씨 브라질너트(고급 진) 들어간 누가 누가는 캐러멜 등 당과류와 다르게 작업 공정 자체가 번거롭기도 하지만 이해만 되면 쉬운 작업!! 단연 당과류중 많은 견과류 함량과 단연 고급 진찐찐 제품입니다. 레끌라에서 판매하는 누가는 현재 매장 구입만 가능하며 견과류는 그때그때 작업 완료 시 맛을 보고 변경될 수 있으며, 사이즈 및 단가, 포장 등 수시로 변경 예정입니다. 점점 맛있어지고 예뻐지도록 이렇게 요렇게 해보랍니다!! 특히 수능 선물로 요청이 엄청 많았던 프랑스 고급 진 엿 현재는 작은 조각으로 개별 포장해서 판매 개시하였습니다. 프랑스 오렌지 껍질 당절임 커버추어 코팅 오랑젯!! 없어서 못 파는 리얼 초코쿠키 밀가루가 안 들어가는 레끌라만의 초코쿠키가 변신해 버렸습니다. 미니 사이즈로 초코에 또 초코를 가미한 초코 크랙 쿠키 수제 초콜릿 패키지도 올해는 다르게 해보고 싶어 작업 중이오니 조만간 포스팅합니다. 제가 완성품 시식전 한 컷!! 쇼콜라 통아몬드 두 가지 버전 포장입니다 기존에 소포장과 원형 통 포장 두 가지 버전 그리고 헤이즐넛이고 고소 고소한 토핑으로 업데이트합니다!! 홈페이지는 미니 로고 패키지가 오늘 도착해서 구성이 완료되면 업데이트 예정 [누가] 프랑스 누가 레끌라 연남동 블렁누가 고급 엿 견과류 엿 연희동 수제 초콜릿 오리지널 선물 수능 빼빼로데이 답례품 디저트 홍대 합정동 피칸파이 맛집 리얼초코쿠키"
[수제초콜릿] 레끌라 연남동 브랜드 업체 로고 전사작업 디핑 선물 추석 이벤트 거래처선물 임직원선물 대량작업 수제초콜렛 생일케이크 피칸파이 에그타르트 쿠키 답례품,"추석 택배 마감 안내!! 9월 4일 일요일 24시 결제 완료 건 마감! 9월 5일 마지막 택배 발송! 너무 오랜만에 포스팅입니다. 날씨가 쌀쌀해지기 전부터 들어온 수제 초콜릿 다량 작업 브랜드 업체 (롱샴 코리아) 날씨가 따뜻할 때에는 가나슈 작업이 영~ 수분을 날려주고 디핑을 해야 하기 때문에 (많이 모르고 지나치는 공정) 다크, 밀크, 화이트 수분 빼는 시간이 다 다르다!! 왜? 수분을 어떻게 뺀다? 수업할 때 매번 반복했던... 날씨와 무관하게 템퍼링은 쉽지만 가나슈 상태가 식감, 유통기한을 좌우하기 때문에 매우 중요한!! 하루 종일 가나쉬 만들고 다음날부터 순차적으로 재단하고 그후~~~ 디핑 제가 하는 전사 작업은 템퍼링 한 커버 추어 상태를 보고 전사 작업을 해서 사이드로 나가지 않게 작업하는 게 포인트!!!! 서포터 친구들한테도 강조 강조하는 작업 조금만 넘어가도 (구매하시는 분들은 모르셔도 제가 알기 때문에) 제품화하지 않습니다. 요즘 원재료 단가가 말도 안 되게 인상되어도 용량을 추가하면 했지 줄이진 않아요^^ 명품 브랜드 대량 작업등은 내 품을 떠나는 날까지 초초 예민해져 발송되고 나서야 온몸에 혼이 쫙~ 빠져나가는 작업이랍니다!!<10년을 넘게 해도 적응이 안 되는> 선물 포장의 마무리는 리본이죠!!<리본을 제대로 묶는 분들이 아주 극히 드물다는 사실을 알아 버렸다!!>쉽지만 어렵다는..🥹 리본을 어떻게 잘~ 매듭 했는지... 보면 판매하는 사람의 마음? 자세가 보인다는(사소한 거 같지만 그 사소한 게 정말 중요하다는 사실) 역시 브랜드 업체들 리본을 받으면 기분이 좋다. 명품 브랜드 등 오랜 전통 있는 브랜드들은 리본의 질, 색감 등 많이 신경 쓴 느낌이 들어 좋다(명품 브랜드들이 리본을 꼭 하는 이유?!) 질이 너무 좋아 묶을 때 손이 아플 때도 있지만 이쁜 리본을 보내주면 묶을 때 기분까지 좋아지더라고요^^ 업체에서 픽업 요청해 주신 퀵으로 브랜드 백화점 등으로 발송 후 마무리!! 제품 패키지를 이것저것 준비하려고 했지만 너무 빠른 추석, 업체 물량으로 이힝 ㅠㅠㅠㅠ 수제 초콜릿 패키지 중 문의 많이 주시는 부분은 예약을 통해서라도 상시 주문받도록 추석 전후로 홈페이지에 업데이트하겠습니다. [수제초콜릿] 레끌라 연남동 브랜드 업체 로고 전사작업 디핑 선물 추석 이벤트 거래처선물 임직원선물 대량작업 수제초콜렛 생일케이크 피칸파이 에그타르트 쿠키 답례품"
[후기] 빼빼로데이 레끌라 연남동 홍대 연희동 크리스마스 선물 피칸파이 맛집 수제 초콜릿 생초코 초코쿠키 누가 프랑스 스위스 임직원 선물 거래처 선물 대기업 공기업 디저트 맛집,"빼빼로데이 후기 이제야 포스팅합니다.(사진 찍을 여유가 없었음.. 아까비)_일독이 이제야 풀리기 시작해서 늦은 포스팅 매년 사전예약으로 온라인 주문량이 많은 레끌라 빼빼로입니다. 10월 21일부터 받은 예약으로 온라인 물량과 매장 물량을 확보하고 발주 넣고 있~는~데 기존에 피칸파이 임직원분들 선물로 진행했던 대기업 s 전자에서 전화 발주 빼빼로 패키지 제일 큰 제품으로 진행하게 되어 주문한 토핑이 도착하기 전에 추가 발주 및 커버추어 초콜릿 발주. ※시즌 크리스마스, 빼빼로데이, 밸런타인데이, 화이트데이 등 시즌 때에는 sns 메신저 답변이 많이 어렵습니다. 계속 작업 중이라 답변 시간이 부족하므로 모든 톡 디엠 메신저 off 상태로 홈페이지 또는 급하신 건은 전화 주시기 바랍니다. 밤새워서 박스 접기_오롯이 (택배 발송 완료 후) 대량 작업 박스 접기 및 리본 묶기 업체 물량 리본 묶는 데만 정확히 3시간 걸림.(엄청 빨리 묶음) 10년 레끌라드쇼콜라 오픈하고 바로 명품 브랜드 대량 물량으로 밤샘 작업 후 일주일간 정신을 못 차려서 다음날 일정에 지장으로 절대 밤샘은 하지 않을 거야!!라고 다짐했지만 10년 만에 초심으로 돌아갔는지 밤샘 작업하고도 부족하던 시간들 대량 작업은 다마스 기사님이 오셔서 도와주셔야 하는 상황까지 가서 전체컷을 못 찍은 것이 정말 이뻤는데.. 오렌지 패키지와 리본이 모아 놓으면 엄청 빛이 났거든요... 사전예약분 모두 택배 발송하고도 버터 스틱을 계속 구워야 했던.. 인터넷 주문 못하신 고객님들 전화문의 엄청 주시는데.. 매장용 12시 오픈과 동시에 오후 2시면 매일 전날 만든 물량 모두 품절!! 온라인은 빼빼로 주문만 하시는 게 아니라서 택배 포장만 하루 종일 걸림... 오리지널 패키지 리본... 손 아파~!! 리본도 두꺼워서ㅠㅠ 사서 고생하는 스타일!! 버터 스틱은 계속 구웠어요 새벽에 굽고 낮부터 밤까지 초콜릿 코팅하고 밤새 포장하고.. ㅎㅎㅎㅎ 11년 차라 요령이 생겨서 괜찮겠지 하는데도 매년 주문량에 변수가 많아 매장 물량이 많이 부족하니 어찌하오리까요^^ 계속 많이 만들라 하시지만 11일 가까워지면 손이 안움직여요..ㅠㅠ 그래도 지나고 나면 힘듦은 잊어버리고 열심히 살았구나!!! 계속 잊지 않고 찾아주셔서 너무 감사드리고요 무지 많이♥ 토핑 작업은 레끌라의 11년차 서포터들이 알아서 매일매일 차곡차곡 만들어 놓으면 제가 다음날 싹 품절 해 버리고 또 만들고 계속된 반복 작업!! 크리스마스 선물 패키지를 만들까요? 힘이 들어서 고민 중입니다. 이번 수능 제품도 만들까 했는데 ㅠㅠ 대량이 들어오면 올~~스톱 되는 바람에.. 오늘도 피칸파이 쿠키 택배 포장 후 포스팅 [후기] 빼빼로데이 레끌라 연남동 홍대 연희동 크리스마스 선물 피칸파이 맛집 수제 초콜릿 생초코 초코쿠키 누가 프랑스 스위스 임직원 선물 거래처 선물 대기업 공기업 디저트 맛집 레끌라 서울특별시 마포구 동교로 266-6 2층 LECLAT [후기] 빼빼로데이 레끌라 연남동 홍대 연희동 크리스마스 선물 피칸파이 맛집 수제 초콜릿 생초코 초코쿠키 누가 프랑스 스위스 임직원 선물 거래처 선물 대기업 공기업 디저트 맛집"
[위스키 봉봉] 밸런타인 17년산 레끌라 수제 초콜릿 연남동 연희동 합정동 선물 답례품 커버 추어,찾으시는 분들이 많으셔서 기존에 판매했던 밸런타인 17년산 위스키 먼저 오늘부터 5월 말일까지 판매합니다. 다른 위스키 중 헤네시 xo는 구입했는데 단가가 높아서 보류 중입니다. 발베니 맥켈란 글랜피딕 블루 라벨 등 제가 찾는 제품은 몇 년산 인지에 따라 단가가ㅠㅠ 위스키 봉봉 수제 초콜릿은 위스키의 향이 다 하기 때문에 다른 향 찾아 9월 이후부터 새롭게 출시합니다. 밸런타인 17년산 위스키 봉봉은 5월 말까지 판매한 후 9월 중순쯤 날씨 여부에 따라 재 판매됩니다. 5구 패키지와 10구 패키지로 구성되며 모양은 순 금박을 붙인 원형 모양 포함 술통 모양으로 밸런타인데이 17년 산은 확정입니다. 다른 위스키는 정해지면 다른 모양의 몰드로 진행됩니다. 위스키 알코올은 몇도 이상이 되면 사라집니다. 그래서 향이 중요하며 어떤 위스키를 사용했는지 꼭!!! 확인하신 후 구매하시기 바랍니다. 굳이 레끌라가 12년산을 쓰다가 같은 판매 금액으로 더 비싼 17년산을 쓰는지 다른 위스키 테스트 시 뭐가 이리 오래 걸리는지 피칸파이 주문 때문에 바쁘기도 했지만요 ㅎㅎ 5월까지는 택배 진행하지 않고 매장에서만 판매합니다. 15구 패키지는 하반기부터 판매 예정입니다. (구성을 다르게 구상 중) [위스키 봉봉] 밸런타인 17년산 레끌라 수제 초콜릿 연남동 연희동 합정동 선물 답례품 커버 추어 레끌라 서울특별시 마포구 동교로 266-6 2층 LECLAT
