,Unnamed: 0,0,combined
0,올드페리도넛 한남점,1029619861.0,"🎃보스톤크림은 초코코팅된 도넛 안에 들어간 바닐라크림이 너무 맛있었음!! 🎃우유크림은 처음엔 약간 크림치즈맛 나서 느끼했는데 먹다본 부드러운 휘핑크림 먹는 맛이나서 일단 다 먹긴 함ㅎㅎ 🎃크림브륄레는 내 원픽...🫶🏻 상살하는 딱 그 맛이지만 빵피도 부드럽고 가벼워서 모든 게 완벽했음. 🎃 피넛버터는 엄청 단 건 아닌데 질감이라고 해야되나? 그 자체로 묵직한 맛이라 둘이서 반갈하면 딱임!! 🎃피스타치오는 너무 버터리하고 도넛표...한남동에 방문했다가 우연히 근처에 올드페리도넛 매장이 있길래 방문포장해왔어요 매장이 굉장히 키치하고 굿즈 상품이 많더라고요 귀여운 느낌이라  구경하기에도 좋았어요 바닐라크림라떼도 추천받아서 마셔봤는데 크림이 엄청 쫀득해요 양이 좀 작아서 아쉽다는 느낌인데 한번 먹어볼만했어요 도넛 은 시그니처나 베스트 종류로 골라봤는데 제 입맛에는 엄청 맛있다 기대하고 먹을 정도는 아니고 취향껏 골라먹으면 더 좋을것 같아요-KB노리체크 카드 도넛이 나왔다고 해서 냉큼 달려갔어요! 포장해왔는데 세가지 도넛 매력터져요! 민트초코 , 레몬크림, 옥수수크림 입니다 ㅋㅋ 그리 고 인스타에 인증하면 그립톡 받을 수 있어요. 한남점은 민트 도넛 그립톡 이여요 ㅋ 상큼 ㅋㅋㅋ올드페리도넛 맛있어서 한남동 올때마다 들려요. 도넛이 굉장히 쫄깃하고 크림도많이들어있어요. 제 입맛엔 보스톤크림이 가장 맛있네요. 던*에 있는  보스톤크림과 차원이달라요. 가격대가 도넛하나에 4400원이 비싸긴하지만 맛있어서 종종 사먹을 듯 해요. wooden시그니처 메뉴들이 맛있고 랩노쉬 콜라보도 괜찮네요 저는 크림브륄레 도넛이랑 프로틴 드링크 크림브륄레맛이 제일 좋았어요정말 말도 안 되게 맛있어요! 한국 도넛계 킹오브 킹. 머리가 아플정도로 맛있읍니당ㅜㅜ 제 최애는 코코넛. 차애는 라스베리, 피스타치오, 브륄레, 피넛 버터, 보스턴, 우유크림. 네 이정도면 그냥 다 좋아하는거 맞구요.. 맞습니다.. 꼳 메뉴별로 하나씩 다 드셔보셔요.. 약~속^~^~우와, 생각보다 엄청 맛있어요!! 👍😋 도넛이 막 엄청 달지도 않은데, 밸런스랄까? 입맛에 딱이네요 정말!! 😍약속시간보다 일찍 도착해서 시간 보내려고 방문한 곳이었는데, 도넛 맛집이었네요ㅎㅎㅎ 브런치 약속이라 도넛은 2개씩 4개 포장했구요♡ 도넛 구매시 음료 500원 할인이라고 하셔서 커피도 주문했네요ㅎㅎ 바닐라크림라떼 맛있었는데 다음엔 매장에서 맛 볼 거에요 😀 화장실도 깨끗하고 공간도 아기자기하게 예쁘게 꾸며져 있어요ㅋ생각보다 공간이 좁지만 확실한 컨셉 도넛도 생각보다 맛있다 주말 보단 평일에만 올듯피스타치오 고소하고 맛있어요…🥹🩷 개인적으로 피넛버터보다 이게 나아요 당일날 못 먹으면 냉동보관입니다따듯한 라떼와 도넛 어떠세요?? 참 맛있네용.  도넛안에 필링이 느끼해지려고 할때 따듯한 라떼가 기름을 녹이면서 맛을 부드럽게 넘겨줍니다.커피는 평범하지만 도넛이 찐입니다👍 버터넛, 버터 피스타치오, 화이트 초코 세서미 도넛 get🔥 말해 뭐합니까 너무 맛있어요👏👏기대만큼은 아니었지만 당충전 확실히 되는 맛있는 도넛이었습니다🍩 직원분들이 친절하셔서 좋았어요!도너츠 맛집이다. 그런데 너무 과하다. 맛은 있는데 정말 과하게 들어간 속 재료가 부담 스러울 정도다. ㅎ 크기도 큰편이라 커피나 음료가 꼭 필요한 도너츠였다. 그리고 가격이.. 너무 비싸다는 흠이 있다. 하나에 4~ 5천원정도고 음료도 비싸다.한번 먹어볼만은 하다.퇴근 후에는 먹기 힘든 핫플 올드페리도넛 쩔깃한 버터 글레이즈 도넛 사이에 피스타치오 크림 가득💚 도넛 위에 뿌려진 달콤짭쪼롬한 가루도 맛있음토요일!! 도넛을 좋아하지는 않지만 유명하다고도 하고 블루스퀘어로 뮤지컬 보러 왔다가 시간이 남아서 와봤어요 테이블이 몇개 안되서 이미 만석 😅 문 앞에 계시는 직원분이 먹고 가시냐고 물어보시고 웨이팅 걸어주셨어요 주문은 미리 할 수 있어서 결제하고 기다리니까 불러주셨고 주문한 도넛도 자 리로 가져다주심 😃 이미 밥을 먹어서 친구랑 시나몬 슈가 도넛 1개 주문하고 블루베리 밀크랑 아아 주문했어요! 블루베리 밀크 달달~해서 맛있...올드페리 언제나 최고 ㅎㅎㅎㅎㅎ모든 맛을 먹어보기위해 자주방문하는중ㅋㅋㅋㅋ크림브륄레 도넛 진짜 맛있어요!!! 커피랑 먹으면 딱 좋아요❤️달달하니 당충하기 좋고 맛도있네요 ㅎㅎ 피넛 도넛 존맛👍🏻👍🏻 갠적으로 피스타치오도 맛났어요버터피스타치오(₩5500)를 가장 맛있게 먹었어요 링도넛이지만 도넛 중간에도 크림이 있고 은은하게 피스타치오 향이 나니 부드럽고 달달해요 피스타 치오 불호해도 먹어봐도 될 정도로 은은하게 피스타치오 향이 나니 맛있었어요 😊 크림브륄레(₩4200)는 지난번에 먹었던 것보다 상태가 안 좋아서 아 쉬웠어요 ㅜ 제대로 카라멜라이징이 되지 않아 뷜릴레를 제대로 즐기지 못했어요 설탕이 부족했던건지 잘 타지 않았던건지 눅눅한 커스타드 크...피스타치오 도넛 도넛중에 최애 도넛 먹을때마다 감탄해요~빵순이 친구의 추천으로 다녀온 올드페리도넛,, 개인적으로 구멍뚫린 도넛보다는 안뚫리고 안쪽에 크림 든 도넛들이 다 맛있었던거 같아요. 우유크림도넛, 보스턴크림도넛, 피스타치오크림도넛까지 안에 필링이 든 건 맛있게 먹었는데 초코크런치 도넛은 제입맛에 너무 달았던거 같아요 미쿡의 초코단맛 그잡채!😋도넛 자체가 굉장히 달기때문에 음료는 아메리카노 추천합니다 평일에 오니 자리는 많습니다! 테이블 자체가 4개밖에 없어서 주말에는 앉아서 먹기 쉽 지않을거같아요주중에 오니 조용하네요. 직원들도 친절하고요. 피스타치오 처음 먹었는데 맛납니다.피넛버터랑 피스타치오 먹었어요요즘 유행하는 ??티드 다 필요없고 내 인생에 최고의 도넛은 올드페리.. 제발 백화점 입점해주세요..직원분이 엄청 친절하셨어요. 올드페리도넛에서 원래는 Butter pistachio 를 맛있게 먹었는데 이번에는cream brulee가 제일 맛있네요. 다른 건 너무 달아요..ㅎㅎ그래도 또 생각나는 맛이에요리틀넥한남서 식사후 날이 더워 건물 2층에 위치한 오울드페리도넛에서 달달한피넛크림이 들어있는 도넛과 쌉쓸한 아메리카노와 피오나에이드를 시켰어요 청량함이 느껴지면서 색스럽고 예쁘네요~^^ 층고가 높고 유리창으로 개방감이 느껴져서 몇 안되는 테이블이지만 좁은느낌은 없었어요~ 운좋게도 저희는 바로 앉았는데 나오면서 보니 몇팀이 웨이팅을 하더라구요~크림브륄레가 맛있어서 종종 가요!  종류가 더 다양해졌으면 좋겠음…인테리어가 심플하고 직원 분이 친절하게 시그니처 메뉴 알려주셨어요 크림 브륄레 도넛 진짜 맛있고 커피도 맛나요~ 첫 방문인데 좋은 시간 보내다 갑니다유명해서 먹어봤는데 특별하다 보다는 계속 생각나는 맛 🍩🍪피넛버터랑 라즈베리 정말 추천!!! 라즈베리 필드는 쨈 아니에요~ 깔끔하고 안 달고 정말 맛있어요!!진짜 오랜만에 다시 가봤네요~! 달지만 맛있네요 ㅎ한남동 들를 일 있으면 무조건 올드페리부터 헤헤동생이 추천해줘서 웨이팅하고 들어갔어요! 커피 맛있고 도넛도 기본 맛이에요!!커스터드 크림이 넘 맛나요도넛이 맛있어요생각보다 얼그레이는 맛 쏘쏘 우유크림은 크림은 너무 맛있는데 빵이 질겨요ㅠㅠ 베리쨈이랑 피스타치오가 부드러워요!!맛은 있어요, 노티드 보다 올드페리가 전반적인 맛은 좋았지만. 피스타치오 도넛 먹으러 왔는데, 바로 뒤에 한보따리 있는데도 안준 이유는 잘 모르겠으나 사유설명도 없고 그냥 안된다고 해서 서비스부분에서 아쉬웠네요.. 팝업이나 가지 굳이 매장은 이용안할 것 같아요.쫀득쫀득 부드럽고 맛있는 우유크림 도넛은 물론!! 아메리카노도 맛집!! 블루스퀘어 올때 마다 꼭 들르는 필수 코스^^도넛종류가 다양합니다. 특히 크림뷔릴레와 피스타치오가 베스트셀러입니다.유명하다고 해서 들린 올드 페리 도넛... 유명세 만큼 사람들이 많아서 포장해 와서 집에서 아이들과 먹었어요..좋아요 맛있어요크림이 과하지않고 맛있어요◡̈기대했는데...쫌 실망이군... 피스타치오 도넛은 고소할 줄 알았는데 넘 달고 시나몬~은 퍼석한 츄러스 맛 도넛먹는 느낌 우유크림~은 우유크림보다 치 즈크림이랄까? 역시 SNS의 힘! 음료는 굿~! 아!!!자리 안내해 주시는 직원분 넘 친철!!!!!7시 좀 안되서 갔는데, 모두 품절이어서 마지막 하나 남은 도너츠 겟! 크림브뢰 맛있었다버터피스타치오 존맛! 오픈시간 10분전에 앞에 4팀 기다리고 있더라구요..커피에 먹는 도넛의맛..혈관이 꽈악 막힐지라도 먹고싶은맛!진짜 맛있어용콜드브루 비어도넛 한정판이라서 냉큼 맛봤는데 아주 맛좋아요!! 맥주 맛보다는 커피맛이 더 진하면서 은은한 술빵 맛이 느껴진달까 ㅎㅎㅎ맛집이라고 해서 찾아갔는데, 운이 좋게 줄도 안길고 포장으로 바로 싸서 나왔어요✌️ 빵이 보들보들해서 너무 맛있었습니다올드페리 도넛은 진리👍🍩크림들어있는 빵이 맛있어요주말 4시 넘어서 갔는데 사람 많았어요! 도넛 맛있는데 테이블 붙어있는건 살짝 아쉽네여ㅠㅠ유명하다해서 선물했네요선물용으로 좋아요 크렘브륄레 도넛 맛있어요울동네 도넛가게 엄청 생겼다가 다 없어지고 두군데 남은곳중 한곳!올드페리가 잴먼저 생겼는데 안없어지고 있오서 넘 좋음.도넛이 너무 달다고 욕하는 리뷰 많이 봤는데 도넛이 그럼 안달수가 있나?안단거 먹을려면 호밀빵 같은거나 먹을것이지.맛있다 없다를 평가하는게 아니라 달다고 욕하는건 참ㅋㅋㅋㅋ아니 그럼 케이크나 도넛 왜먹음?친절하진 않지만 맛있어요 맛으로 승부보는 느낌적인 느낌 😎🤘크림브륄레가 베스트인 이유가 있네요 설탕과 커스터드크림의 달콤함 쫀득한 식감까지 맛있게 먹었어요피스타치오랑 크림브륄레 맛있었어요버터피스타치오 디게 달아요 맛있움도넛 진짜 달고 맛있네요 피스타치오, 크림브륄레 추천도넛이 맛있어요.아메리카노와 먹으니 달달하고 맛있네요~ 얼그레이향이 좋았어요! 피스타치오맛은 생각보다 달았어요.순무도넛 너무 맛있고 굿즈도 너무 귀여워요도넛먹으러 왔어요! 맛있어요 ~#올드페리 #도넛 #한남 #올드페리한남밥 먹고가서 도넛은 못먹고 커피만 마시고 왔어요! 근데 분위기 깔끔하고 커피 맛있어서 담엔 꼭 커피랑 도넛 같이 먹으러 갈래요!!!!!너무 달기만한 도너츠.. 조금 실망도너츠가 쫄깃해서 맛있어요!!사람들이 자주 오는 이유를 알 거 같은 맛  근데 전 커피가 더 맛있었습니자..🙃입안가득 달달하게 퍼지는 크림의 도넛, 맛있어요.피넛버터 진짜맛있어요!ㅋㅋ크림브륄레는 기본인맛인데 피넛버터 맛있네요^^ 친절하시고 맛있어요저번엔 밤에 와서 도넛이 다 나가 있었는데 토요일 1시쯤 왔더니 베스트 메뉴인 버터 피스타치오를 먹을 수 있었어요! 크기는 주먹보다 크고 맛은 달달하네요매번 블루스퀘어 공연보러 갈때마다 들러서 먹고 있어요피스타치오 먹고싶었는데 저녁때 갔더니 몇종류 없더라구요 ㅠㅠ 초코도넛 많이 달지않고 꾸덕한 느낌이 아니라서 부담없이 먹기좋아요~! 전체적으로 안달아서 엄마가좋아하셨어요 ㅎㅎㅎ한남동 간김에 들렀어요.  역근처라 접근성좋았고  도넛은 무조건 맛있네요ㅎ오 역시 마싯어요!!도넛 맛잇어요~  특히 크림필링이 딱 내 스타일! 매장은 크지 않지만 안에 화장실이 있어서 좋음맛있어서가긴가는데...언제 먹어도 맛있어요! 케이크도넛은 물리지도 질리지도 않고 담백해서 맛있어요 특히 시나몬! 시나몬에 크림라떼랑 같이 먹으니 조합이 너무 좋아요! 크림라떼의 크림 찍어먹으면 더 꿀맛쫄깃한 반죽에 달달한 크림이 듬뿍 들어있어요 제 픽은 크림브륄레, 보스턴 어찌구 동행자 픽은 피스타치오 2명이 5개 시켰는데 우유도 달고 도넛은 더 달아서 결국 남겼어요🥲 최대 4개인 것 같습니다,, 올라가는 길은 계단이구 왼쪽 거예요! 헷갈려서 휘적휘적 거리다가 그냥 올라갔는데 맞았어요!!! 우 유도넛은 사실 쏘쏘했어용 크림 브륄레는 겉이 바삭한데 확실히 반죽은 쫄깃했어요 보스턴은 커스터드 크림 때문에 제 입맛에 맞더라구요 ㅎㅎ ...매장이용시 2시간 제한이 있고 국민카드랑 이벤트중이어서 그립톡도 받았네요. 이렇게 제대로 구현(?)된 민트초코도넛은 처음 먹어봅니다🤩개인적으론 도넛을 누군가에게 선물한다면 걱정없이 사도되는 곳이라고 생각합니다. 선물로 드려서 사진이 없네요 ^.^;;맛있어요 ㅎㅎ 분위기 좋고~~다시먹어도 맛있당 올드페리보다 맛있는 도너츠가 있나여?5년째 가장 좋아하는 도넛가게예요. 우유크림도넛도 너무 맛있네요!첫 구매였는데 너무 맛있어요👍🫶🏻맛있어요~  늦게 가면 몇 종류 없어요 ㅠ늦게가서 먹고 싶은 맛은 팔렸지만 도넛하면 올페죠🧡맛있어요 매장에서도 먹어보고 싶어요도넛 포장해 왔어요! 주말이라 웨이팅 길 줄 알았는데 비가 왔어서 그런지 웨이팅 없이 빠르게 구매 가능했어요ㅎㅎ 대신 매장 취식은 웨이팅이 있더라구요 :) 도넛 크기도 정말 크고 맛있었어요 시그니처 도넛 네가지 있는 거 샀는데 만족 만족 !! 도넛 고민되시면 시그니처 세트 드세욥 🫰🏻약 일년만에 가서 사먹고 이렇게 맛있었나.. 감동해서 일주일만에 또 갔습니다. 버터 피스타치오가 가장 맛있어요. 크기도 크고 빵도 쫄깃쫄깃해요.  케이크 도넛 스타일의 시나몬슈가도 괜찮았는데 제 입맛엔 역시 쫄깃하고 크림든 도넛이 훨씬 맛있었습니다.  포장하실 분들은 대기 없이 바로 들어가서 주문하시면 됩니다.2층에 위치하고 있어요. 최대 2시간 이용 제한 시간을 두니까 참고하세요! 도넛 맛있어요:) 서울에만 있다고 해서 뮤지컬 보러온 김에 왔는데 잘 온 것 같 아요.코코넛 도넛 맛있어요! 피스타치오 크림도 많이 들어있습니다. 서울 3대 도넛 정복 완료🏆 직원분들이 친절하셔서 좋았습니다. 테이블 좌석 앉으려면  대기 하셔야합니다.누구나 다아는 이미 유명한곳!  너무 맛있어요~~~크림브륄레맛 멋있었어요!!피넛버터 너무너무 좋아용! 나이스웨더는 맨날 솔드아웃이라 ㅠㅠ 오랜만에 한남으로 왔는데 편안- 하네요귀여운 도넛집:)코코넛 피스타치오 피넛버터 맛있어요생각보다 별로..맛잇는데 도넛이 너무 빨리 떨어쟈서ㅜㅜ이렇게 맛있으면 다이어트는 도대체 언제 어떻게 하란거죠. 빵순이의 마음을 오랜만에 설레게한 빵이에요. 그냥 지나치는 건 너무 힘드니까 당분간 올드페리도넛 근처는 가지말아야겠어요.아직은 서울에서만 먹을 수 있는 올드페리도넛에 다녀왔어요. 시그니처 도넛 중에서 버터 피스타치오가 제일 맛있었어요. 새콤한 산미도 느껴지고 달달하고버터인데도 많이 느끼하지 않아서 계속 먹을 수 있겠더라구요👍재방문 의사 백퍼센트입니다. 지방에도 지점 내줬으면 좋겠어요. 🥹웨이팅이 있는데 직원분들이 친절해서 사람들이 많이 가는거 같아요 도넛이랑 커피 먹으면 너무 맛있어요맛나요포장했는데 매장이 너무 귀여웠고 굿즈들도 너무예뻤어요초를 팔면좋겟어요 별도 구매하러 다녓는데 그래도 예쁨♥참새가 방앗간을 그냥 지나갈 순 없죠. 언제나 사랑하는 올드페리도넛 ! 요즘 케이크도넛이 새로나와서 신나서 달려갔습니다. 유후- 좀 늦게 방문했더니  솔드아웃 된 녀석들이 많아서 다음에 또 들러야겠어요 ^^ 도넛은 달고 맛있는 행복한 맛!"
