,Unnamed: 0,0,combined
0,Poke all day 포케&샐러드 연희점,1233281842.0,메밀 면포 케 포케 데이 배달 매장 넓다 깔끔하다 분위기 포케 건 연언제 신선하다 야채 에너지 충전 가능하다 포케 샐러드 인 가구 안성맞춤 최애 식당 양파 후 레이크 듬뿍 뿌리 더더 포케 신선하다 에너지 충전 힐링포케 데이 처음 포케중 제일 가격 타 가게 저렴하다 편 소스 매콤 소스 연어 야채 신선하다 자주 매장 감성 몸 마음 건강하다 기분 연어 포케 꼭 다음 오리고기 후후후오늘 저번 주 오늘 훈제오리 연어 여기 통창 분위기 매장 청결하다 번창요즘 포케 점심 중 발견 포케 가성 비 대비 양 오리고기 토핑 해초 샐러드 추가 양송이 스프 진하다 배달 듯 해 매장 깔끔하다 알 록 점점 조용하다 활기차다깔끔하다 건강 들기름 메밀 은 육회 추가 인테리어 깔끔하다 넓다 대화저번 보고 쌈장 소스 큐브 스테이크 조합 그냥 비빔밥 아주 땐 배부르다 뒤 금방 가게 이쁘다 혼밥포케먹 항산 깔끔하다 양도 든든하다 포케 포케올데항상 배달 매장 처음 완전 넓다 쾌적하다 분위기 종종 매장청결하다 직원 화장실 깨끗하다완전 매장 깔끔하다 넓다늘 건강하다 운동 디 말 운동 질리 다양하다 먹거리 종종 맛집 랩 저녁 포케 식사 저녁 고민 돨포케 토핑 짐 재료 조합픽업 어니언 플레이 때문 더더 메밀 면 들기름 살짝동네 이렇다 늘 포케 처음 들기름 메밀 샐러드 든든하다 신선하다 육회 추가 청결하다 넓다 직하다 공간 여유 먹기배달 매장 훨 배부르다 여 매장 이쁘다배달전인 다시 양 매장 여전하다 청결하다 재 생각 먼저깔끔하다 끼 먹기 건강하다 음식현미 밥포케 든든하다늘 후기 처음 재료 신선하다 매장 화이트 톤 깔끔하다 무엇 매일 어도건강하다 식사 메밀분 기도단호박 크림 스프그릇 알록달록 귀엽다 말 모말 모먹음 직 스럽다 매장인테리어 멋지다 포케집 요즘 샐러드 사랑 끼 든든하다 아보카도 기본 추가 요기 상콤 다른 괜찮다 포 인테리어 눈 즐겁다 공간포케 데이처음 들기름 메밀 샐러드 그렇다매장 처음 야채 신선하다 매장 넓다 깔끔하다 다음깔끔하다 조용하다 주차인테리어 이쁘다매장 인테리어 분위기 재료 신선하다매장 깔끔하다매장 깨끗하다 포케현미 밥 닭 가슴 살 참깨 간장 닭 가슴 살 부드럽다 야채 현미 밥 닭 가슴 살 조화롭다 매장 인테리어 깔끔하다 자주가성 비 완전 집앞 점심 매장 깨끗하다매장 포케 양 최애 포케집 중 입 미당신선하다 다양하다 식감 한번 재 의사젤 배달 맛잌 매장양 포만 감 짠뜩 가게 의자 금방 자리근처 포케집 건 기쁘다 만 역시 상큼 연어 스리 차마 최고벼르 벼르 비쥬 얼 장난 다른 포케집 메밀 샐러드 보구 왓어 담 육회 추가 직원 이쁘다 친절만족스럽다 혼밥체인점 당연하다 염색 여자 매니저 직원 불친절하다 한숨 말 성의 응대 홀 일 서비스 직 불친절하다 어쩌 계시 직원 교육 다시 건강하다 자주 이용 이제고소하다 신선하다 토핑 자주현미 밥포케 연어 와사비 간장 현미 밥포케 스테이크 소스 처음 배달 앱 볼때 리뷰 한번 양도 한국인 기지 심지어 소스 쌈장 그냥 야채 비빔밥 잔뜩 죄책다양하다 비건 옵션 매장 넓다 쾌적하다가게 이쁘다 혼밥자리 넓다 깨끗하다 음식 야채 등 매우 풍부하다 건강하다 끼 한번포케 데 연어 현미 포케 들기름 메밀 데 둘 현미 포케 소스포케 다이어트식단 체고 알록달록 인테리어 맘 매장 쾌적하다메밀 굿소스 양도신선하다 양 매장 분위기 깔끔하다 주말 점심포장 매장 배달 최애 맛집 중 샐러드 여기 포케 존맛치킨 랩 스프 처음 날 먹기기분 건강하다 가끔포케 완전 신선하다매장 분위기포케 처음 건강하다매장 청결하다신선하다 양도매장 깔끔하다 넓다 포케 처음 양도 건강하다 배부르다신선하다 자석 여유 깨끗하다매장 깔끔하다포케 메밀 포케 최고항상 메밀 면 참치 메인 토핑 건강하다 느낌건강하다 샐러드쾌적하다가게 이쁘다 포케올데매장 깔끔하다 사진 음식종종 데이 포케 오늘 매장 건강하다신선하다연어 포케 항상 양 다이어트양 쾌적하다매번 매장 오니 새몆번 체료 항상 신선하다혼밥 기도 음식포케 체인점 자주 실패하다 다음자주 포케집입 매장 넓다요가 운동 후 먹기 최고 추가 추가 듯 양 단호박 스프 꼭추 번귀엽다 인테리어 신선하다 재료 언제 소스 비건 선택 지도 욧항상 늘가볍다 든든하다자주 사이드양도 건강하다야채 싫다 맨 키 오스 재료 빼기넓다 인테리어 이쁘다신선하다 먹기 자주 요벌써 두번째 매장 청결하다 간단하다 먹기포케 처음 샐러드 싱싱하다좀 차질 재료 신선하다 포케 건강 자체 요 요자주매장 이쁘다항상 들기름 메밀 강추 건강하다 샐러드 감사현미 밥포케 연어 양다이어트 종종 도움 번창재료 신선하다포케 쾌적하다 자주 용포케 여기 만 늘종종포케 데이 포케 젤신선하다 자주 요 매장 깔끔하다브레이크 타임 도착 단호 기분 살짝 별로 음식 준비 안내 계속신선하다일주일 두번째가끔 배달 보고 매장 처음 매장 신선하다 양 짐 배부르다 다른 보 현미 밥 메밀 선택 다음 메밀 건강하다 끼
1,스웨이커피스테이션,1826959498.0,호주 계단 재밌다 구조 고가 높다 넒 열 차 티켓 문명 기재 기차역 컨셉 해리포터 생각 다만 음료 서빙 시 고가 높다 작다 얘기 메모 다른사람 배려 대서 모 무색매장 인테리어 직원 웃 톤 다운 우드 톤 분위기 호주 궁금하다 재 크림 보고두 웨이 팅 저녁 타임 조금 한산하다 외관 부 터 내부 크리스마스 벌써 크리스마스 스웨 스테이션 유명하다 여전하다 멋지다 라떼아트 섬세하다 처 스웨 카푸치노 쌉싸름하다 초컨셉 확실하다 크리스마스 시즌 멋지다 호주 디저트주말 피크타임 피해 웨이 팅 팀 바로 입장 자마자 아늑하다 엔틱 분위기 인테리어 응대 바버샵 단골 장님 게다가 과 산미 싫어하다 적당하다 산미 아주 모든 카스웨 스테이션 우리동네 동네분위기라테 스팀 우유 고소하다분위기 조용하다 자주 남자 직원밸런스 분위기 독특하다 웨이 팅 아쉽다불친절하다 억울하다 왜 응대 이해 정도분위기분위기 사진가게 분위기 아늑하다분위기레몬 치즈 케익 분위기 진하다 작다 양처음 리뷰 달 에스프레소 시작 처 카푸치노 전체 어요 아트 세심 해주시 에스프레소 탄산수 설탕 보고 제대로 구나 기분 저녁 모두 조용하다겨울 생각 분위기 따뜻하다사진 읍 쿠폰 움요 롱 블랙처음 매장 바쁘다 상황 원두 선택 음료 어서 등 말씀 불친절하다 짜증나다 듯 손님 대하 말투 태도 굉장하다 실망 스럽다 음료 값 저렴하다 편도 불쾌하다 해부터 요즘 웨이 팅 계속 만 카푸치노 여전하다라떼 아트 멋지다호주 스타일 롱 블랙 프루티 묵직하다 이름 기차 티켓 기념 독특하다 컨셉 분위기세련되다 여운 분위기가볍다 라떼 오트 밀크 행복이티오피아 롱 블랙 제일 여운 잔향 남구 산미 고소하다 밸런스 레몬 치즈케잌 뿐 산뜻하다 달 부담 스웨 매일스웨 아이스 라떼분위기 부드럽다 케이크 꼭디저트 분위기 만족스럽다디저트아따인테리어 멋지다멋있다플랫 화이트 분위기인테리어 감성 음료 디저트호주 맛집 궁금하다 맛집 대한 프라이드 강하다 덥다주말 오후 스웨 스테이션 여유 느낌 분위기 쪼으네용꼭 번은 에스프레소 라떼크리스마스 분위기 이쁘다 노래 감성 충만 다시 가도일요일 오후 밖 층계 안쪽 공간 따뜻하다 분위기 조용하다 알 주인 남녀 분 티켓 이름 타자기 타이핑 차분하다 분위기 속 편하다최애인테리어 취향 컨셉 독특하다 직접 타자기 티켓 형태 쿠폰인테리어 멋있다 이야기 나누기분위기 맛집 카이 막 맛집 크림 라떼 쿠폰 기차표 쎄다굿 먼저 뇌 자극 주니 저절로 고맙다 습최상급 라떼아트 예술분위기 인테리어 멋있다 애정이구 분위기 오카이 막 맛집 자꾸인테리어 재밌다 용서비스 다만 잘못 가면 웨이 팅 좌석 좀 불편하다 여럿 가기 불편하다분위기 주말 자리 해 카푸치노 강추낮 밤 분위기 완전 다른 인테리어 멋지다 스테이션 컨셉 주시 기차표 쿠폰 센스 자체굿분위기 해리포터 속 장면 느낌 인테리어 티켓 쿠폰 재밌다 아이디어 단호박 치즈케이크 최고무조건 번 이상은 따뜻하다 라떼 함 라떼 아트 끝내주다크리스마스 시즌 이면 항상 외관 맛집 소개 걸 전 티켓 특별하다 기억 찻잔 기분 자리 편하다 아쉽다내내 진하다 고소하다 무척화이트 류 공간 특색성 굿공간 아주 쿠폰 비행기 티켓 디자인 재미 완전크리스마스 성 낭낭 스웨 스테이션 인테리어 멋지다 음료 핫초 코 달 고급 진 인테리어 따뜻하다 느낌 마치 유럽분위기 인테리어호주 플랫 화이트 반갑다 종류 선택 디카 페인 선택 폭 다양하다 직원 아늑하다 즐겁다낮 아늑하다 분위기 점점 어둑해지다 저녁 시간대 이쁘다 카푸치노 초콜릿 초콜릿 진하다 케이크 작다 진하다 괜찮다인테리어 멋지다이쁘다 아늑하다 커피숍 디저트 안되다 이제 알 억울하다인장 멋지다 신사 분과 고급 진 작업 위해 목적 아쉽다 정도 다음 다이어리 글 책굿장님 자부심 이유 디저트 최고내부 인테리어 멋있다 교통 수단 별로 편하다 다시 만큼 특이하다 특별하다 공간 아이스 초코 위 마시멜로분위기 스타일 분위기 원두 시큼하다 강하다컨셉 확실하다매장 분위기 역대 요분위기 듁임인테리어 멋 스럽다 주말인테리어 소품 곳곳 여행 컨셉 디테 괜찮다호주 알 살짝 초코 가루 신의한수 레몬 케이크 크림 가볍다 발란스 다만 크기 작다입 생각 동쪽 처음 임 임분위기 아주 멋 스럽다조용하다 분위기 조명 인테리어 아늑하다 연말 처 생각 이름 영문 기차 티켓 제일 잠깐 혼자 행복하다인테리어 멋지다 향기롭다 밀크 티케이크분위기 레몬 치즈 케이크 상콤기 안이 생각 넓다외관 아담하다 멋지다 노래 분위기 음료 나이 대도 다양 무엇 젠틀 정장 계시 모습 만도 음료 대한 신뢰 혼자 음료 모습 멋지다 요즘 그냥 인스타 용 음료선택 정도 마음컨셉 아주 독특하다 신기하다 화장실 워후라떼아트 정성 요즘 풀 서비스 제공 요기 정리 해주시 커피한잔 귀하다 느낌 크리스마스 느낌 물씬 입구 내부 계속 사 진 요 평일 혼 타임 용바닐라 라떼 아이스 초콜릿 아이스 플랫 화이트 음료 잔 무난 인테리어 컨셉 독특하다 쿠폰 이름 타자기 직접 재밌다디저트 모두 만족스럽다 위 크림크리스마스 분위기 가게 음료스웨 음료 아늑하다 공간 수다인스타 핫 사진 그대로 아기자기 올해 가기 전굿굿분위기 맛집 고요 전반 전 스웨 카푸치노 우유 양 조금진하다 편이 핫초코 진심스웨 스웨 스웨 멀다 슬프다 택시 타고 가면 가게 인테리어 이쁘다 디저트 바나나브레드 피콜로 촉촉하다 부드럽다 바나나브레드 진하다 피콜로 조화 상큼 걸산미 강하다 진해 내부 아늑하다 주차 가능하다해외 매장 줄 소갯말 그대로 해외여행 기분 낼 분위기 썸 커플 꼭 핫초코 초콜릿 그렇다 좀 싫어하다 분 좀 핫초코랑 마
2,프로토콜 연희점,1032580297.0,요기 겸 집중 부공 랄 책상 스탠드 메모장 연필 전반 분위기 쉿 그렇다 분위기 노트북 책 담소 소담 소담 모던 혼자 집중 책 권책 뭐 산미 굉장하다 과테말라 드립커피 산미 진하다 아주원두 자부심 대형 프로토콜 공간 입구 다르다 넓다 공간 힙 세련되다 인테리어 진 미가 만족스럽다 전 필터 음 권 다양하다 미가 퀄주말 이용 제한 조용하다 공부 직원 콘 센트 좌석 노트북 미리 충전 가세라떼 맛집 분위기 조용하다 작업 거나 공부 원두 설명 서도 원두 대해 알진심 첫 설명 전반 차분하다 분위기 카공 주말 이용 제한 재 의사노트북 작업 창가 드립커피 괜찮다라떼 주말 오후 그렇다 웨이 팅 조금 금방 어요 창문 밖 꽉 채운 푸른 가로수 가로수 무채색 인테리어 파운드 케익 주말 매장초심자 행운 랄 처음 멋지다 직접 로스팅 원 가격 대가 분위기 어두컴컴하다 취향 존재 창밖 푸른 가로수 근교 듯창가 초록 초록 뷰 멋지다 복숭아 기억 재 원두 계속 드립커피 다양하다 원두 설명핫 직원 전 엔트러 싸이트 단골 입맛 엔트러 싸이트 여기 자리 빠 에스프레소 아메리카노프로토콜 쇼룸 이번 프로토콜 필터 조만간 가야노트북 전체 어둡다 자리 등 집중 무난유명하다 이유 작업 환경 산미 편견 푸릇 강추원두 재미명성 자자하다 대만 땅 대화 작업 가기 최적 날 위 스탠드 조심 일 나이스조용하다 공부 거나 노트북 분위기카운터 보시 남자 필터 키 여자 손님 응대 서비스 최악 여러 번 오늘 필 터 밍밍 맛없다 기분 불쾌하다 다른 오늘 별로 뭐 때문 공격 기분 쁜 티 내면 일 고객 본인 기분 나쁘다 티 화 풀이 그것맛집 주말 오후 프로토콜 다행하다 웨이 팅 자리 잡고 아메리카노 한잔 라떼 한잔 피 아이스 아메리카노 푸릇 원두 블루베리 고민 슈퍼 노말 원두 아이스 스몰 라떼 스몰 라떼 고소하다 진하다 추가 분일요일 낮 안경 직원 남성 메뉴판 대뜸 뒤 좀 보 앞 손님 계시 가까이 끼리 이야기 무안하다 말씀 야하다 어떻다 산미 밑 보라분위기 짱보고 인테리어조용하다애플 티 한번최애 낮 밤 가면 지난번 카스테라 레몬 파운드 요 지난 주말 착각 당황 스럽다 이번 땐 마음 공간 넓다 차분하다 분위기분위기창가 자리 책 노래 책 가끔 창밖 나무 보이 완전 힐링심플 차분하다 분위기 취향 원두 의 종류 다양하다멋지다 앤 트러 사이트 대충 유원지 이후 꽤 라떼 맛집 정보 저녁 스몰 라떼 양 연하다 생각 착각 진하다 라떼 카스테라 파운드 케이크필터 초코 파운드 과테말라 원두 선택 최고 조용하다 정돈 분위기 깔끔하다 모던 느낌 실내 디자인 테이블 홀 테이블 조명 의자 장식품 세련되다 깔끔하다 테이블 정리 노트북 책 작업분위기매장 넓다 차분하다 분위기 배경음악 뷰 굿 재멋지다 그냥 땐 좀 느낌 거기 이제 분위기 챡챡 넓다 테이블 간격인테리어 감각 어둡다 눈 노트북 책 분 꽤 계시 주말 자리 테이크아웃 할인 아이스 아메리카노 저렴하다 원두 구매 엔트러 일단 원두 구매 패스프로토콜작업 저녁 어둑하다 분위기 순간 집중 장소 낮 어떻다 분위기 일지 궁금하다여기 옛날 가기 좀 힘들다차분하다 정적 분위기 조용하다 집중 자리 스탠드 테이블 넓다탁 공간 공부 거나 집중 모습 공간 힘 걸 알 능 종류 다양하다 원두 설명분위기 맛집 생각 조용하다데이트 종류 분 꼭 한번 보기 매장 노트북 공부 분 간단하다 커피한잔 분 조금 대기 구 직접 주시 설명 서도 대해 조금만 맘 꼭 까페 발견 다양하다 원두 선택 가능하다 인더스트리얼 인테리어 느므말 모해 노트북 최고 지모아메리카노 기본 슈퍼 블렌드 데 일리 대중 디저트 류 몇개 작업 집중 공간 햇볕 작업 인테리어 작업 공간 인정일 언니 힙 비싸다 뷰 초록 초록 조용하다 책 작업 거나 공부 가사 음악 공간 멋지다원하다 스타일 원두 선택 안내 직원 매우 좌석 넉넉하다 콘센트 조명 배치 집중웨이 팅 처음 후회 종류 어둑어둑하다 음악 몽환 사색 바닐라 빈 라떼 달달 카시스 블루베리 디저트 자리 교실 배열 디자인 분 회의 메모 연필 재밌다필터 최고 패션후르츠 원두 원두 걸 그렇다 뇌 오지 인테리어 음료 자리 편하다 낮뷰 집중진심 바리스타유명하다굿굿 책흠 직원 좀 컬조용하다 쾌적하다 막 자리 인물사진 분 자제 모든 적당하다핸드 드립 메인 자리 아메리카노 핸 드 콩 꼭 뉴욕 거리 수다 사 람 노트북 패드 본인 개인 작업 분 주말 그렇다자세하다 안내 공간 이용 전 집중 공간 왜 프로토콜 인기 깨달숏컷 여성 직원 끝내주다 분위기 치디저트 조명도 분위기 평일 낮 시간대 도 웨이 팅 금방 연락 착석 라떼 마음 따뜻하다인스타 광고 보고 기대 인테리어 음악 보통 직원 그닥 근처 살 혼자 작업 해 천장 높다 편이 쾌적하다 화장 실 남녀 공용 좀 불편하다분위기가장 샌드위치 아쉽다남자 직원 여자 직원난 왜 여기 집중 여기 출근분위기항상예전 궁금하다 분위기 생각 시끄럽다 혼자 작업 공간 음료 자리그림자 음악 바리스타 다음 새롭다 싱글 오리진 궁금하다담백하다 분위기 정갈하다 다양하다 원두 설명혼자 혼자작업 공간 워낙 유명하다 역시 이유다소 라인업 화려하다 아쉽다분위기카공 무엇가장 인기 좀 이제 내부 좌석 혼자 집중 공부 묘 매력 램프 자리 액자 사진 묘 마음 안정감 일본 애니메이션 분위기 사진 보기 필터 평일진심꼭 재무채색 편안함리뷰 그냥 각오 네 뭐 분 괜찮다 다시 방 문가깝다 단골음악 조명도 이쁘다 작업 자주 평점 높다 궁금하다 이유집중웨이 팅 바 좌석 생기 이동 그것 편하다최악 인스타 용 후기 라떼 연하다 미가 전혀 취향 차이 직원 강하다 물 좀 손님 물 자기 끼리 연하다 진하다 탓 숙닥숙닥 퉁명스레 물 줌 우린 제대로남자 직원 여자 직원 끝내주다평일 혼 스페셜 티 맛집혼자 작업 설명 자세하다특이하다 장소 다시 발길최애도서관 느낌 당황 다음 공부 느낌 참여직접 로스팅 대한 자신감 집중 직원 프로 페셔널 컬함 사이 어디분위기 말로 인스타 감성 여기 경험 시간제 뭐 직원 제지 기분 잡 중간 그냥 경험머리 아저씨 에스프레소굿넓다 분위기 혼자 작업 공간 밤 에두최고 온 세상 집중 가능 라떼 핫 아이스 전부 최애디카 페인 브루잉 베리 크리스마스주말 이용 제한 어차피 이상은 의자 딱딱하다 불편하다 엉덩이 마비 힙스터 기분 만끽 작업 무난자리멋지다 공간 요 개인 작업 눈치 안보 수준매장 넓다 테이블 차분하다 분위기 작업 다만 직원노트북 작업 환경 완전 인스타 성 식 약간 차갑다
