,Unnamed: 0,0,combined
38,스타벅스 연희DT점,36462644.0,혼자 온 인석 차지 경우 직원 좀 조절은은하다 부드럽다 라떼스벅스벅 좀 여유 좌석 구조 탁트인 뷰책 보기 스벅입동료 잠깐 수다 시끌시끌하다 친구 대화 굿연대 기숙사 볼 주차장 스벅 주차장 대부분 드 이브 쓰루 주차공간 남아 주차 입장 아메리카노 진하다 뷰 매장 안도 쾌적하다 손님 조용하다 음료 딸기 쮸쮸 바동네 조용하다 대화전 분 별로 저번 사이즈 업 쿠폰 사용 쿠폰 사용 데 사이즈 업 대뜸 제일 작다 사이즈 톨 사이즈 사이즈 문의 네 다시 제일 작다 사이즈 톨 사이즈 고요넓다 편안하다스타벅스 주차 가능하다 오늘 에스프레소 진하다 부드럽다 피로 블루베리 치즈 케익 달콤하다 라떼 싱겁다 그냥 우유 속상하다 우유 조화 제대로 담 제대로 러떼주차오렌지 판타지 유스 베리 티히비스커스 티백 접시 주시매장 아늑하다 음료 주차공간직원 바질 토마토 베이글안경 여자 직원 말투 표정 행동 전부 불친절하다 재 정도 리뷰 비슷하다 상황 더러 시정 필요하다차로 고민 만남 마무리 장소 마감 정도 충분하다 편리하다 이용매장 넓다 시원하다 드라이브스루 매장 직원 바쁘다 듯이용자주 이용다른 매장자주 이용매장 넓다매장 넓다자주 이용차 항상 주차 난 스벅 드라이브 루 편하다 편안하다자주 이용매장 넓다굿주차공간 드라이브 스루 차량 줄기프트 콘 플랙스 날 분위기 내기디티굿용 망고 리 프레 결제 취소 스벅 아이 핑크 음료수 카페인 음료 라며 안내 주시 결제 취소 후 다른 안내 직원 스벅 어플 칭찬 여기드라이브 루 편하다 이용자주 이용굿의자 음료 음료 다시 생각 다시음료 디저트자주자주 이용강북 몇 안되다얼그레이 바니 라티 라떼 최고굿씨솔 카라멜 콜드 브루 요조용하다 깨끗하다 직원 오전 노트북 작업 오후 콘센트 부분 헐렁 거리 테이블 간격 넓다 편이 편안하다가볍다 공부 음료근처 자주 아기 의자매장 뷰굿굿자주 이용애정 스벅매장 넓다 편하다덥다 여름 시원하다 스벅 프라푸치노 굿굿접근성 주차장 앞 응대 패스 등록 편 해 다만 앞차 좀 느리다 단점굿굿가끔 이용가깝다 굿굿얼그레이 바닐라 티 라테 최고 빡치다 마다 티 기분 전환 강추자바 칩 프라프치노자주 이용 늘랜더 데이 특 음료 레드 파워 패션 티 딸기 시럽 에너지드링크 음료 후기 동감 요 한번비 별로돌체 라떼 달달 구리대화얼그레이 바닐라 라떼 완전 직원오늘 공부 라떼 한잔 분전 환하다 라테 분업곤약 젤리 재밌다굿굿초코 즐 자바 칩 프라푸치노 굿선물굿외 음료 다양하다 스타벅스 오늘 블랙 돌체 밀크 티 조금 달 괜찮다 스타벅스 매장 주차공간 대정 분위기자리 편안하다시원하다 주차장시원하다 공부오늘 카페인 충전 완료스벅 여러 분 불친절 처음 안경 여자 표정 말투 기분 나쁘다 그렇다 서비스 직 일카라멜 즐 잔뜩 블론드 바닐라 더블 샷 마키 충전 제대로
39,그로어스,1038765233.0,입구 멋있다 그로 어스 평일 낮 예약 식사 처 메뉴인 그로 어스 브랙 퍼스트 버섯 크림 트러플 마팔디네 둘 꼭 한번그로 어스 세번 음식 분위기 브런치 집중 가장 장소 항상 항정살 오일 파스타 리조또 사진 항상 내부 외부 단체 모임 공간진심 브런치 매장 최고 친구 분위기 대요 공간 완전 넓다 쾌적하다 주변 분위기 힐링 음식 직원 짱 데이트 장소 완전 딱이다 청첩장 모임 해도근처 이렇다 뷰 맛집 주택가 조용하다 브런치 가게 그로 어스 뷰 예 쁘 음식 분위기 깡패 그로 어스 블랙 퍼스트 완전 짐합브런치 맛집 넘버 비 날 보기 드물다 햇살 맛집 브런치 한적하다 여자 수다 떨기 최고앞 도착 자마자 브런치 중 탑인 밖 주택 온화하다 분위기 뷰 환상 브런치 확실하다 차별 화가 그로 어스 볼 이상브런치 블랙 퍼스트 트러플 파스타 분위기 블랙 퍼스트 구성 든든하다 건강하다브런치 편 여기 제일 분위기 규모 다양하다 모임 거나 데이트 장소 도 음식 앞 자주하트 시그널 보고 메모 공간 분위기 완전 반했어 채광 워낙 날씨 날 항상 완전 행복하다 조만간계단 하얗다 분위기 가게 설레다 미음 창 뷰 꽤 자리 잡고 선불 테이블 번호 말 시스템 새우 오일 파스타 양송이 크림 리조또 비주 얼 신선도 나름 괜찮다 리조또인테리어 음식 테이블 넓다 의자 편하다 친구 대화 음식 먹기 다음 일 생기분위기 음식 파스타 맛집 버섯 크림 트러플 마팔디네 거기 직원 화장실 청결하다 비누 제대로 비치 더욱 요 재 의사자주 브런치 항정살 오일 파스타 최애 예약 처음 자리 캐치 테이블 예약 강츄한적하다 조용하다 분위기 인테리어 음식 브런치조용하다 골목 여유 건물 자체 힐링 임 브런치 양 여기 맛집 라떼 내부 야외 테라스 자리인테리어 음식 양도 만 기분 전환가게 분위기 채광 시끄럽다 요리 직원분위기 뷰 친구 모임 데이트 장소 크림 뇨끼 크림 도리 꼭 전반 음식 보기 힘드다 명 나물 페스 토 항정살 파스타 깍두기 볶음밥 등 신기하다 성공하트 시그널 핫 브런치 한적하다 주택가 주택 리 모델링 뷰 멋지다 항 정 파스타 소스 매콤 느끼하다 그로 어스 베스트 존맛 브랙 퍼스트 바삭 빵 아보카도 육즙 소시지 토마토 다양하다 재료 성 깍두기 볶음밥 흔하다 독음식 분위기 사진 찍기 기념일 예약브런치 맛집 그로 어스 강남 소문 부랴부랴 브런치 아침 뷰 음식 끝내주다 마팔디네 파스타 예술 명불허전 그로 어스 자주분위기 음식여유 휴일 기분 시작 식사 음식 직원 프렌치 토스트 기 꼭지금껏 브런치 가게 중 제일 주변 한적하다 뷰 채광 기분 음식 뻔하다 데이트 단체 모임 부모님 모시 다시음식 바로 비주 이쁘다 재 의사 만 만족스럽다 브런치 타임분위기 데이트 장소 아주가게 이쁘다 미슐랭 셰프 파스타 딸기 라떼 생 딸기 가득 항정살 오일 파스타 마팔디네 은 처음 완전 반하다토스트날씨 오히려 분위기 브런치 역시 그로 어스해 브런치 햄 보케 햇살 맛집 브런치 맛집뇨끼 마팔디네 샥슈카 둘 크림 느끼하다 예상 마팔디네 먼저 림 느끼하다 법 하몽 짭짤하다 치즈 크림소스 그렇다 뇨끼 개인 크림 뇨끼 느끼하다 편 리뷰 역시 일행 좀 느끼하다이쁘다 브런치 분위기 브런치 비주 입구 실내 인테리어 이쁘다 데이트 장소 도 날씨 힐링한번 계속두번째 사이 핫 브런치 다시 뷰 음식 여전하다 온 지인 아주 맘 비 비 멋지다평일 한적하다 빛 따뜻하다 분위기친구 예약 이쁘다 자리 만 가요 직원 분 마팔디네하트 시그널 핫 브런치 일부러 월요일 오전 분위기 인테리어 음식 플레이 팅 음식 간이 좀 느낌 새우 토스트 강 추하다뷰 음식 다음블랙 퍼스트 항정 파스타 문해 창가 분위기 아침 조용하다 밤 분위기 해 연말 모임 예 약하다 구뷰 누구항정살 오일 파스타 버섯 크림 리조또 베이컨 프렌치토스트 리조또 트러플 풍기면 부드 럽 토스트 과일 다만 항정살 파스타 좀 별로 베스트 항정 살이 파스타 노 느낌 입맛 가게 외관포토 존 가득하다 도리 가능하다 여자 모임 장소 딱이다 입구 꽃 아치 기분 식당 통창 기분 아주 플레이 트 트러플 파스타 요물 요 트러플 아주 듬뿍 가득하다 짭쪼롬 고소하다 데이트 코스친구 간만 데이트 분위기 맛집 분위기 부터 입구 뿜뿜 외석 나란하다 뷰 맛집 요 대표 메뉴인 음식 선택 완전 깔끔하다 클리 분위기 데이트 담 신랑브런치 처음 평일 점심 데이트 분위기 치 치 버섯 크림 트러흘 마팔디네 소스 싹싹매장 넓다 분위기 샐러드 메인 요리 양송이 스프 간이 한편 빵 새우 오픈 토스트 새우 달짝지근하다 소스 괜찮다 다만 마팔디네 간이 강하다 약간 편매장 넓다 뿌요가게 분위기 음식 데이트 분위기 친구 즐겁다 데이트하트 시그널 보고 궁금하다 방송 실제 테라스 전부 포토 존 뷰 맛집 분위기 기대하다 온 사실 음식 대안 요리 퀄리티 훌륭하다 온 지인 만족하다 데이트 무조건분위기공간 브런치만 역시 성공 굿이쁘다매장 이쁘다 인테리어 이쁘다 데이트 장소 최고 브런치이쁘다 소문 만족 눈 힐링 맘 힐링 모두 힐링 다른 친구화창하다 날씨 브런치 완벽하다 조합 브런치 무엇 풍경 조화 분위기 날 데이트 그로 어스 블랙 퍼스트 잼 항 정상 파스타 명 나물 페스 토어머니 누나 데리 직원 안내 파스타 고 깍두기 볶음밥 신기하다음식점 이자 브런치 분위기 아침 먹음 이예 용 파스타 완전 강추 면도인테리어 음식분위기 데이트 장소분위기 음식 브런치 맛집처음 분위기 직원 토마토 파스타 항정 파스타 담 가게매장 내부 음식 양도 날씨 사진생화 곳곳 꽃 가득하다 음식미치다 좐맛탱분위기 모두 번 다음 맛집 멋지다친구 맛집 인테리어 공간 넓다 모임음식 분위기 뷰 모두 괜찮다 매장 어서 인사 바쁘다 그렇다 도 식사 마치 직원 인사 선결 제라 결제 필요 부분 손님 입장 별루일단 분위기 기분 산뜻하다 음식 정갈하다 특유 포인트 즐거움매장 이쁘다 브런치 종류 생각 만족분위기 채광 데이트 레이스프렌치토스트 항정살 오일 파스타 비쥬 인테리어 동네 조용하다직원 음식 매장 환하다인테리어 해 음식브런치 고정 파스타 중 항정살 파스타하트 시그널 보고 거기 선 항정 파스타 와이프 기름 범벅 항정 파스타 굉장하다 느끼하다 밤새 고생 크림 리조또 그냥 그렇다 가격 대비 가성 굉장하다 안좋다 재 의사 전혀가게 분위기 브렉 퍼스트 피스타치오 뇨끼 색다르다 고소하다 특별하다 날 데이트평일 오후 웨이 팅 공간 넓다 분위기인테리어 깔끔하다 음식 재 주차 좀 편하다데이트 장소 최고 최고 미슐랭 셰프 사랑 명 페스 토의 알 지방 러 슬프다좀 비싸다 분위기한적하다 친구 즐겁다 휴일 분위기 조음하트 시그널 주차 아쉽다 음식 다시 정도 가격 해 가격 쎄다친구 가게 다음 여자친구 데리 다시지난번 후 다시 지인음식 친절 최악 하트 시그널 분위기 보고 분위기 뿐 음식 대한 설 명도 핸폰 충전 부탁 대꾸 서버 묵 수행 친절 기대 분위기 시여자친구 데이트분위기 주차 아쉽다벌써 세번 처음 친구 항상 데리 정도처음 분위기 다음 다시그로 어스 뷰 맛집 브런치 맛집 데이트 힐링 요 가면 뷰 맛집 임 옴분위기 제일 브런치 맛집 일 분위기 뷰 다음 날 구멋있다 용 자주분위기 직원조용하다 골목 데이트직원 분위기 여유버섯 트러플 디네 쫜득하 이렇다 파스타 몀 두껍다 라면 신 기하 샥슈카 느끼하다 질 한번 먹기 빵 인테리어매장 청결하다분위기친구 음식 분위기 인테리어 미치다 사진 찍기 밥 해결 가성 비 다음직원 음식 기분 식사나들이 뇨끼 크림 라떼 손가락 듭 나머지 주택 개조 인테리어 독특하다 조용하다 한가하다매장 쾌적하다 음식 사람과 특별하다 날처음 분위기항정살 오일 파스타 약간 매콤 조화 브렉 퍼스 재료 빵 갯수 아쉽다기분 식사 파스타 분위기 다음뇨끼 양송이 스프 깍두기 오코노미 볶음밥 양념 쎄다 만 만난 지인 저녁식사 장소 카운터 햇살 날가깝다 자주 매장 이쁘다 무엇 음식 진심 다른 꼭 재 날씨 그로 어스사진 속 음식 이름 정확하다 기억 트러플 파스타 김치볶음밥 셋 만족스럽다 밥 모두 여기 해결유명하다 지방 일 파스타 좀 피클 아쉽다이쁘다
40,다크에디션커피,1779458685.0,다양하다 설명 모든 신선하다예전 직장 근처 점심 몇 번 그때 라우터 이름 취향 간 손님 강아지 두 마리나 드립커피 상대 가격 대가 좀 다양하다 원두다양하다 모두연유 라떼 요모든 종류 특별하다 잔 마음 위로유리 떼어마어마하다 주인 사랑 스페셜 티모든 신선하다 요어떻다 곳도 다크 에디 션 대신커피집 설명 그대로 과일 아주테이크아웃
41,카페 니어리,1514592974.0,아기자기 내부 귀엽다 음악 혼자 근처 이렇다 디저트 다음 디저트귀엽다 밤 인사 롤케이크 도리 나중 강아지 데리바닐라 빈 크림 라떼 후르 츠 이드 디저트 아기앞 새롭다 주말 학생 커플 인테리어 분위기 모두 아기자기하다 데이트 분위기 근처 분 꼭 한번 시 초코 롤 케익 존맛무화과 케이크 달 아아 인테리어 감성사진디저트 귀엽다 이쁘다 소품 사진혼자 일 분위기 집중
42,포싵,1352553531.0,엄마 생신 케이크 가족 모두 멀리 디자인상담 자세하다 치즈 느끼하다 달 무엇 최고 덕분 선물사진 실물 욥 빵 크림요청 사항 친구 다음전 케이크 가게 기대하다 사진 만족스럽다 초도 제공재 꼭 케이크 가게 디자인
43,티아레나,1534115818.0,벼르 가게 티 아레나 미리 예약 인용 애프터눈티 세트 고요 두껍다 메뉴판 혼미하다 대표 차 걸 엔틱 분위기 애프터눈티 세트 홍차 간 친구 만족하다 근사하다 건 대표 직원 모두테이블 간격 넓다 편이 옆 테이블 이야기 염려 티룸 테이블 커서 비 좁다 차 화장실 자주 가게 무척 청결하다 밀크 티 시판 베이스 직접 법랑 팬 즉시 버터 나이프 플레이 팅 해주시 스콘 무척 늘 포장 옵밀크 티 티 전문점 티 아레나 골목 입구 바로 사진 내부 홍콩 클래식 티 하우스 듯 느낌 고풍 스럽다 가구 다양하다 찻잔 장식 귀엽다 티팟 등 인테리어 매우 멋지다 포트 앤 메이애프터눈티 세트 특별하다 경험 차 종류 설명 해주시 디저트 다른 분언제 티 아레나 특유 따뜻하다 고급스럽다 분위기 늘 티 종류 설명 전문성 이번 새롭다 코랄 럼 직접 자두 청 다해 역시 상큼 기대 처음차갑다 따뜻하다 가을 겨울가도 차 티 푸드유명하다 티 브랜드 거의 차 보통 샌드위치 편 디저트 도 높다 산미 밸런스 힐링 필요하다번 애프터눈 티 세트 이번 두번째 너 무 만족스럽다 취향 설명 해주시 가까이 시도 제일 티룸입두번째 임 분위기 다시 한번 감탄 디저트 역시 만족스럽다 차 항상 맘 뿐 친구 편안하다애프터눈티 세트 티 아레나 인테리어 멋지다 공간 넓다 테이블 간격 적당하다 거기 티 푸드 무엇 차 우려 멀다 자주 아쉽다 간단하다 스콘 차 스콘 여기 젤 꼭 포장서비스 차도 디저트 구비 스콘 기분차 스콘 차 대해 자세하다 설명 때문 처럼 결정 장애 최적 장소 조용하다 아늑하다 분위기 혼자살때 자주 티 아레나 지금 비록 이사 자주 가끔 온 손님 데리 차마 싫다분위기 미치다 차 설명 자세하다 입 차 여유 책 권 차 스콘 괜찮다밀크 티 시럽 여기 홍차 여러분다양하다 티 조용하다 아늑하다밀크 티 덕후 베이커리 류 홀딱 반하다 스콘 딱딱하다 별로 포속 하니 촉촉하다 부드럽다 생크림 스콘 가도 비교 불가하다 단호박 케이크 도달 단호박 본연 간직 달콤하다 대화 케이크화이트데이 특별 티 세트 판매 궁금하다 거리 역 좀 멀다 편이 환승 필수 거리 조금 아쉽다 심지어 날 길이 지각 양해 기준 오후 창가 볕 아주 듭 사진 티홍차 성지 홍차 종류 밀크 티 직접 굿행복하다 최애조용하다 차분하다 분위기 개인 티팟 찻잔 정성 스레 차려 주신 티 상 친절 차분하다 서빙에프 터눈 티 세트 미리 예약 정각 가게 티 후 잠시 티 푸드 티 푸드 설명 티 푸드 경우 티룸 중 가장 구성 인 에프 터눈 티 경우 티팟 작다 티팟 하나로 차 생각 티홍차 전문점 홍차 깊다 단점 가게 장점겸 찻집 가게 아늑하다 분위기 대화 집중 행온 느낌 스트레스 잠시 풀 위로 공간넉 분위기 차사랑 듯 해 멀다 맘 재 의사 정도 차도 애프터 눈티 세트 완벽하다 직원 설명 티 즐겁다 티 어요 공간 아늑하다 좌석 편하다 일행 추억요즘 엄마 자주 티 골목길 존재 사실 대화 제일 은 엄마 공부 차 직접 플레이 팅 해주시 설명 티 전문점 티 종류 분위기 아늑하다 고급 지고 영국 왕실 왜 티분위기 차 티 푸드티애프터눈티 진심 최고 스콘 홍차 완전 굿굿 가족 분 완전 친절 자체 여러분 꼭 가세 오 홍차 맛집 애프터눈티 맛집차 매장 앤 차도 요 무엇 티 종류 균일 가인항상 손님 모시이번 펠트 차갑다 새롭다 차티 종류 분위기이모 즐겁다 보냇어용드르 티 아레나 생크림 스콘 이므 라무 르 장미 가향 차 머리 아프다 정도 찻물 장미 은은하다 크림 딸기 잼 차 모 금 조화롭다 여기 크리스틴 다트 너 주로 요 마음 위타 드 잉글리시종류작년 지인 소개 알 이후 최근 몇 달 간 거의 찻집 브랜드 별 홍차 다양하다 판 차 기도 차만 처음 아주 깜짝 이후 자주항상 요즘 물가 애프터눈티 세트 비싸다차 손님 항상 모시 인테리어 이쁘다 만족조용하다 차분하다 분위기차 종류 굉장하다 직원 디저트 친구 즐겁다 행복하다차갑다 오늘 밀크 티 달달 진하다내부 인테리어 아름답다 디저트 차 종류 무척 다양하다차 종류 인테리어 멋지다 특별하다 날 가기 갓 차홍차 종류 차 스콘 대박 강추애프터눈 티 세트 두 시식 후기 그냥 최고 말뭐 그냥 번 가세 예약 빛 가격 아깝다 오히려 가격 완전 퀄리티 디저트 차 밀크 티 애프터눈 티세 그냥 일단 예약 절대 후회발렌타인 에프 터눈티 세트 세상 양도 인생 스콘 멀다 자주 못 연 희다동네 이쁘다 찻집 우리 다음 애프터눈티 차도 종류 다양하다 재미홍차 전문점즐겁다 인테리어 다양하다 차 차 죄송스럽다이쁘다 까페 차 전문점 늘 라떼 부드럽다 직접 콘 자꾸만 손따뜻하다 분위기 속 다양하다 티 디저트 타임 뮤 행복차 설명 분위기 다음혼자 차 여유 분위기 차 종류 완전 고향 만족스럽다스콘 분위기 따뜻하다 분위기 따뜻하다 차 마음 따뜻하다평소 를 별로 자주 지인 모처럼 좀 색다르다 괜찮다 생각 괜찮다 티 마스터 적당하다 온도 티 종류 각자 개인 주전자 요 다른디저트 차 대해 서도 꼼꼼하다 설명 덕분 특별하다 하루 습엔틱 우아하다 차 완전 영국 고전 느낌 랄 이쁘다 무엇 차 종류 간곳 제일 뭘 선택 어렵다 테이스티 후 설 명 후회 만족스럽다 선택 스콘 막 끈 뜨끈하다항상 차 공간 기분라떼 단호박 케이크스콘 어유 나중 홍차 욤다양하다 차 대해 설명 인테리어 티팟 구경 재미 쏠쏠하다선택 아쉽다 언제 겨울 따뜻하다 그렇다 합 정오 꼭우선 매장 넓다 깨끗하다 디자인 마치 영국 귀족 느낌 차도 직접 우리 시 주인 디저트 안달 오시 여기 꼭 보시 강력설명 해주시 티 세트 전체 화가 마카롱 쿠키 달 마지막 상큼 종류애프터눈 티 세트 예약 홍차 종류 다양하다 차 대한 깊다 애정 느 샌드위치 중 오이 샌드위치 예상 디저트 종류 모두 왕 무화과 스타 마음 진정하다 애프터눈 티 분티 맛집 종착 전 이제 여기 가렵 티 드분위기늘장님 인테리어 스콘 밀크 티 분위기 조용하다 얘기 나누기굿해 살짝 춥다분위기다양하다 종류 차로열 밀크 티 항상본격 덕후 위 우리 주위 이렇다소품 정성 스레 수집 느낌 가득 티팟 고오 지고 여심 저격 분위 티 행복하다응대 차 종류 궁금하다 자세하다 설명 애프터눈티 세트 준비 자리 아늑하다 편하다 대화밀크 티 테이블 당 못 아쉽다 로얄 밀크 티 스콘 밀가루 비리 버터 고소하다굳다인테리어 차도 스콘 포트 앤 메이슨 포총 크리스틴 다트 너 이므 라무 르 차 장미 차로 깔끔하다 개인 적 스콘 이므 라무 르 장미 포총가도 차 디저트 완벽하다 애프터눈티 타임마르코폴로 지난 번 이후 기억 환대분위기 멋지다 차 훌륭하다분위기 로열 밀크 티 코랄 럼굿이쁘다애프터눈티 예약 차 종류 배 불리스콘 분 티 아레나 스콘 차 꼭 애프터눈 티 세트 접시 행복 매장 일반 판매 스콘 계속 겉 바삭 속 아주 촉촉하다 리 매장 장님 굉장하다 따뜻하다 네이버 예약 요청 사항 퀸즈 다기음식 웰컴 티 맘 양 편이 한텐 딱이다 디저트 중 무스 스콘 기대하다 스콘 좀 아쉽다 분 위기 아주재 의사 적극 에프 터눈티 스콘새롭다 웰컴 드 링크 차 이번 무스 류 디저트 대박 산딸기 하얗다 무스 케익 은 겉 우유 푸딩 속 산딸기 잼 상큼 달달 입 행복하다최고 이상은 최고 애프터눈티 세트 인 예약 최강 좌석 뷰 도 그릇 컵 식 기류 샌드위치 디저트 밀크 티 기억 남 만큼 적극 기념일 식사다양하다 티 디저트 샌드위치 괜찮다 친구 즐겁다티 매니아 라면 무조건 강추 입구 홀린 듯 인테리어 빈티 티팟 나볼차 종류 다양하다스콘 어어 무 분위기 차도 재 의사
