,Unnamed: 0,0,combined
117,WP커피,1388383414.0,모임 공간 작업 공간 구분 친구 여기 친구 종정 책보 그렇다 쿠키 시시키 그냥주차 온 왕 친절 분위기 쿠키 댜일찍 어서 앞 주차 자리 보석같다 한잔 쿠키 무료 주시 부디 오래오래쿠키발견 보석같다쿠키쿠키 선물자몽 차 서비스 쿠키주차쿠키 직접 판매 공짜 주차 가능쿠키 짱초코케익탁 구조 조금 시끄럽다 인상 음료 음료 한잔 당 쿠키 를 무료 서비스 면 무척쿠키쿠키 무료굿자주 동네음료 사면 쿠키 무료음료 시 쿠키 좌석 편하다 요즘 찾기 힘드다 의자 편하다 널찍하다 굿굿여기 최애 단골인 시 쿠키 쿠키 종류쿠키 주네친구 오기굿뀼굿굿조굿굿묘차갑다 분위기굿존맛아아굿굿굳다음료 주시 쿠키 음료 좌석 편하다 자주 가요굿편안하다 식 그렇다 쿠키 서비스조용하다쿠키쿠키 도주 캐모마일분위기굿 아늑하다 공부 집중 쿠키제일 의자 편하다 음료분위기 굿조용하다사면 쿠키 서비스 주시음료 괜찮다 치즈케이크굿주차 가능 야외 테이블 분위기 조용하다 살짝 두운 분위기 남 녀 화장실 괜찮다 아이스 경우 얼음 작다 줌콜드 브류 구수하다 낯선가깝다굿굿쿠키 무료분위기 쿠키 무료 듯굿조용하다 넓다주차 편하다 쿠키 맛집굿굿쿠키
118,파리바게뜨 연희안산점,18252035.0,우유 팥빙수 얼음 눈꽃 정도 완전 고 아이스크림 세상 그렇다 곱다 얼음 서비스 별거 마늘빵 조각 기분 매우샐러드 신선하다샌드위치 맛집아기 어린이집 동안 혼자 편하다빵 종류 다양하다페스트리 식빵 모카 빵 사과 잼빵 장땡 먹기 편하다굿굿자주 이용굿여러분롤 케익 행사굿굿빵 빙수 구매직원 짱파리바게트계시 융통성 일부러 여기 파바 몇 년 직원 불친절하다 애매하다 젠 렵바로 근처 편리하다굿굿알바오늘 토스트 빵욥평일 알바생 주말 알바생 중간 추가 주말 알바 제휴 사 할인 안내 그냥 결재 제휴 할인 가능 추가 경우 기존 문건 취소 후 추 가주 문건 합 재결 재해 야하다 번거롭다 평일 알바 적극 안내 처리오늘 아내 프렌치토스트 용 빵 점심 쿠키매일 토스트 용 빵 굿굿굿빵오늘 식빵바로 근처굿굿굿케익 가격 괜찮다 어버이날 기념 부모님 뿌듯하다오늘 빵오늘 빵 사냥케익 생각 직원굿굿자주 이용오늘 빵자주오늘 식빵굿쾌적하다 자리굿일요일 오전 매장 계시 젊다 여성 아이 빵샐러드가깝다 식빵 자주 가요거의 매일 식빵 해자주 이용항상 이용 굿굳다회사 점심 자주 빠르다 서빙 깔끔하다 늘매장 조용하다케이크 종류 다양하다아주 영업 덕분 예약 케이크 픽업굿굿굿빵 요굿양파 치즈 브레드 가도 완전사라다 빵늘 빵케잌굿굿가깝다 늘 애용 빵집빵굿굿굿굳다굿굿굿굿직원 모두 무척 빵매번 기분 애용자주 가요
119,커피랩로스터스,34348951.0,원두 라떼 맛집산책 발견 맛집저렴하다 가격가성 비요굿겨울철 최애 음료 청귤차새해 첫 청귤차 따뜻하다 콤굿
120,"카페, 어서",1234686967.0,엄청나다 붕어빵 팔고 계시 붕어빵 팥 이렇다 미리 빵 바삭 살짝 말리 바로 붕어빵 역시 바삭 라떼만 붕어 계시 끈 바삭 붕어 도 직관 팥 슈크림 완전 요 붕어 계절 붕세권 행복하다오늘 오픈 날 요 베이글 샌드위치 미치다 요 따끈따끈하다 야채 든든하다 앞 자주 이용 오래오래 장사여전하다 리뷰 이벤트 카야 토스트 완전 바삭 장난 담 카야 중독분위기 조용조 용 편하다 대화 무엇 아이스 아메 원샷 카 토스트 존맛 리뷰 이벤트 진행중 오픈 한지 얼마 안되다 자주 돈길잉어빵 도 자주카야 토스트 존맛 용 직원 도 용 밀크 티 달달 산미 고소하다 베이글 궁금하다 담 밥 야하다위생 붕어 완전 바삭출근길 점심시간 간단하다 마시기 고소하다 적절하다 쓴맛 질리 살짝 혀 자극 산미 퇴근 후 산책길 알 맛집가격 저렴하다 출근길 사기어서 고급 진 붕어빵음료 샌드위치 장소 수다 떨기 부담 배달 자주 듯다양하다 카야 토스트 친철오픈 오픈 이벤트 아메리카노 한잔 아부 럿 샌드위치 갑니댱 번창음료 리뷰 카야 토스트 최고 닷베이글 샌드위치라떼출퇴근 근처 아침 일찍 문 여 테이크아웃 편하다 가성 비 아쉽다 단골 오래오래새롭다 어서 가격 착하다 취향 자주 이용밖 시원하다테라스 개방 감 또한 듯주차 가능하다 아침저렴하다카야 토스트 바삭 취향 저격 요초코 라떼 진하다 음료 모든 음료 포장 깔끔하다 자주 이용 해영수증 보고 깜짝 테이크아웃 가격 가성 비 얼마나가격 착하다 한잔 가격 잔야외포장달달 자주 이용오픈 저렴하다 진해
121,와이베를린,639777033.0,
122,연희문화살롱,1789900326.0,미녀 공연 떡볶이 볶음밥 먹기 와인 먹기 편안하다 행복하다 분위기 배우 가수 해 다음 번 만날새우 감 바스 국물 떡볶이 다음 꼭 남자친구수다 떨기아름답다 세계 맥주 와인 위스키 가득 냉장고코로나 아이스 밀크 티 대화 한적하다 공간가수 노래 운 즉석 공연 볼 이집 새우 감 바스 시켯더 영수증얼굴 이쁘다 공간음악 편안하다 휴식 공간통기타 가수 커피집 와인 술 관심 느긋하다 대화 편하다 공간 가끔 운 손님 온 다른 뮤지션 연주 여 오후분위기준장 가수 시라 라이브 공연 직관 가능하다 운 대단하다 아티스트 연주 눈앞 보고 호사 황 가수 김광석 기타리스트 완전 감동 완전 주인 가수 성격 자주 느낌새우 감 바스 신세계 첫경험 떡볶이 맛집 등록 거부 유명하다 겨울 찬 바람간 바스 처음 다음주 화이팅공연 가볍다 맥주 잔 적당하다 시끄럽다 정신
123,카페인더포레스트,1013937090.0,근처 매장 깔끔하다 주변 조용하다 청포도 이드 다음 처 포레스트인테리어 마음 알바생 공부 분위기 다음 스카 대신 공부처 공 노래 선곡 굿 분위기 사진 짱 강 추하다디저트 분위기 취향 었어 푸른 정원 생각 실망
124,카페리코,11562617.0,닭 가슴 살 샌드위치 아이스 아메리카노 식사 대용종종 이제 리뷰 가게 매우 귀엽다 샌드위치 새롭다 개발 아메리카노 궁합 찰떡 금액 합리 꼭굿굿간식 거리 소라 과자매장 인테리어 귀엽다굿아기자기하다 깜찍템들 인테리어 카페인 충전 완료요우연 치 종종응대 정신 번쩍 컵휘가격 착하다 친절 덤안쪽 공간늘뿌듯 항상 컾 너 무굿여기 음료 다양하다 순간 결정 버퍼링 급속 충전 정신 번쩍굿양 살짝 실망하다가까이 자주 음료굿항상굿굿굿굿굿굿가성 기 커피가게굿굿굿굿굿굿굿굿썸머 라떼 잔굿굿굿 여기계속 맴 요굿굿분위기 가격 착하다전 딸바 가성 비 괜찮다 듯굿굿딸기스무디 완전 가격 저렴하다요요음료 종류요요요요굿고구마 파우더 고구마 수저 든든하다스무디날 왜오늘 동료 한잔라떼더치 쟁여놓 먹기다양하다 참신하다 신선하다 직원 강 추하다
125,파도바,1409319673.0,
126,쏘잉구떼 양과점,1428844673.0,브레드 푸딩 맛집 크림
127,데이지카페,1238217011.0,굿덥다 친절굿편안하다 동네편하다 차 마시기 조용하다 편하다 동네 집중음료 디저트 다양하다굳다굿약하다 스콘 가루굿굿차안굿굿굿굿새 가격장님 매우굿굿굿굿시원하다굿길목 위치 종종 이용자리 넓다 이쁘다 쥬스매장 조용하다굿굿세련되다 정다운 분위기 동네동네자주 이용새롭다 개업 환경 굿방역 최선 다해 주시 코로나 위기 극복새롭다 개업 넓다 깨끗하다굿조금 번창굿
128,아이스프링카페,1900352602.0,음료 호텔 넓다 고급넓다친목요굿자몽주스 자몽 오늘 토마토주스굿굿가격 저렴하다 편안하다블루베리 요거트 스무디 짱교회 까페 예배 마치 모 이야기굿굿아이 스프링교회빵코코넛 스무디 치아바타 조금 입구 뷰 남다르다굿연유 라떼 컵 이쁘다 여 치아바타깨끗하다향기 부드럽다 음료가도 가성 비 분위기 다음분위기 호텔 라운지 고급 진 고요하다 편안하다음료 크기 생각 작고 콘센트내부 넓다 쾌적하다굿아늑하다 편안하다굿대화 직원 아메리카노 이번 빙수 출시굿굿너코코넛 스무디치아바타 빵 만 마들렌 오늘 가요눈 날 디카 페인 카페라떼 분위기굿교회 솝 스럽다 날 날 테라스 가면 산책로호텔 느낌 귀차니즘 지난 여름 대체 노을 이쁘다 풍경 완전 힐링 임 교회 정문 왼쪽 출입 구 욧늘 애용 최고디카 페인 아메리카노 가성 비 굿굿굿코코넛 스무디장안 좀 낡다 주차편하다잣 과자 원천 교회 분위기 넓다 가성 비 최고굿편하다친구 번개굿굿굿가격 저렴하다
129,오몽듀,1883552123.0,오몽듀 선생님 최고 설명 똥손 만족 기본 수량 제외 고도 미니 마카롱 쪼꼬미들 귀엽다 건조 대기 동안 음료수 오늘 즐겁다 추억 마카롱 대한 지식첫 베이 킹 클래스 재미있다 완성 이쁘다 선물아기자기하다 시즌 시즌 마카롱 마카롱 아트 마카롱 자체 조금 비싸다 자주사진 똥손 실물 깡패 이번 크리스마스 소중하다 선물 생각 었어 마카롱 쫀독 완전 다음 클래스 번창자마자 급하다 사진 못 정도 줜맛탱 못 센스 번창 가게 중 포장 이쁘다 선물 마다 기분 바닐라 빈 필링 마카롱퇴근 마감 못 급하다 전화 흔쾌하다 괜찮다 오시 말씀 겨우 겨우 도착 우왕좌왕 설명 해 주시 선물 용 마카롱 구입 마카롱 너 무오몽듀 마카롱 꼬 꼭 쫀득꼬끄 존맛매장 인테리어 마카롱 귀엽다빼빼로데이 맞이 마카롱 구매 마카롱 결제 가격 사악하다깔끔하다 귀엽다 맛집 디저트이쁘다피스타치오 초코 크림 퐁실퐁실 질감 도 느끼하다가게 아늑하다 데이 츠 쿠키 르뱅 쿠키 진하다 버터 았 가격 조금 부담 자주 일주일 번 꼭쑥 푸딩 극락 갈수 바로 존맛 달콤하다 부드럽다 고소하다 추베릅 츄베릅새롭다 쑥 푸딩 완전오몽듀 쿠키 존맛에그타르트 바닐라 빈 처음 고구마 마카롱 고구마 주 변 맛집 소문 항상대추야자 쿠키 대추 은은하다 스타일 취향 저격근처 새롭다 마카롱 맛집 발견 모양 이쁘다 금손 인정제일 가깝다 디저트 종종 식감 편차 심해 디저트 날 부드럽다 식 어떻다 날 힘들다 정도 딱딱하다 자주모든 쿠키 기분디저트 맛집여기 르뱅 쿠키 항상
130,빽다방 연희삼거리점,1311192596.0,예민하다 건가 한참 생각 네이버 리뷰 직원 불친절 얘기 기본 아이스 아메 리 카노 테이크아웃 요청 고객 앞 본인 앞 띡 주방 스태프 존 이렇다 처음 요 혼자 암불쾌하다 리뷰 장내 회용 컵 아메리카노 한잔 후 착석 이후 매장 가면 일회용 잔 달라 부탁드리다 정부 정책 때문 오히려 장내 일회용 컵 사 용 금지 무엇 때문 불쾌하다 요청 불쾌하다 기색 비치 시기직원 불친절하다 이제직원 음료삼거리 처음 그렇다 현재 알바 매우 불친절하다 끌 적립 안해 주시 고요 결 재기 꽃힌 카드 보고 돈 아내 고하 시 여 현금 다르다 뭐 왜 변하다 사정 몇번 불쾌하다 다방 처음 영수증 달라 싫다 티 싫다 면장 여미숫가루 간 얼음 우유직원 좀자주 이용오후 시간대 일 분 불친절하다 본인 계산 실수 손님 책임 도 계산 말 다시 결제 해결 간단하다 문제 참고 매장 바쁘다 저희 팀 중간 전화 세상 불친절하다 테아메리카노 저렴하다굿바닐라 라떼 요즘 콜드 블루 연유 라떼 직원직원 기분차 한잔 여유항상 계시 여자 직원심한국말 초 학년 한국말 블랙펄 라떼 요 카패 라떼 딸 전화 드 링크 도 달라 직원 본인 번 확인 한국어 딸 번 확인 한글 스크린 확인 시여자 알바 음료간 얼음여자굿불친절고객 약속 신경 주지 좀굿음료 가성 비보통굿요굿굿굿저렴하다 매일 부담 마시기비싸다굿굿굿앗 메리 카노가성 비미숫가루굿굿굿굿굿굿굿
131,마룬,35977819.0,분위기 차분하다 차 마시기캐모마일 차도산미 분위기힘드다 요즘 위로 친정 느낌친정 분위기직원 음료동네 맛집 느낌굿괜찮다직원 다음굿굿굿굿불친절하다조용하다인테리어 분위기 만족하다서비스 굿바쁘다 가능하다 핸드 드립커피 홀 먼저 손님 단 둘 전부 이후 동안 구성 도대체 뭐 바쁘다최고 분위기 최고 서비스 최고라떼 아주 굿라떼아트 예술 요조용하다보통분위기 서비스친절 인테리어 굳다친절빙수
132,팔레트샐러드 연희점,1212605834.0,포장 처음 매장 직접 자리 뭐 늘 팔레트 샐러드 빡센 일정 날 든든하다 무겁다 딱이다 요집앞 분위기 번 번 번 감동 샐러드 재료 간이 소스 최고 근처고민 아주 기분 배부르다 너 무 습 댜 증맬루 서비스 꾿배달 로만 직접 봄 배달 고구마 오버 쿡 좀 푸석하다 호박 은 부분바게트 바게트 대신 다른 매번 기억 서비스 감사 매일 고 이사오 정도 랍 오늘왜 이제 아주 조만간 재 무조건 댜 직원 연어 존맛매번 마다 무엇 샐러드 깔끔하다 양도 요즘 최애 맛집 서비스바게트 빵 잼 기억 남고 수비드 부채 연어 최고 팔레트 내부 인테리어 분위기 다음수업 늘 애매하다 온라인 수업 양도 어요 수업 죄송 햇자주 매장 처음 분위기 무엇 보 음식 건강하다 늘 매콤 포크 비프 추가 단백질 풍부하다 운 고구마 달달 적당하다 핵꿀맛 외 호박 브로콜리 버섯 야채 곡배달 매장 가깝다 매장 이쁘다 음식 아보카도 바나나 스무디 브라운 치킨 말포장 정도 음팔레트 샐러드 구성 다양하다 후무스 연달 서비스 일 기분 번창오늘 첨가바질 파스타 존맛매장 좀 어둡다 연어 좀 작다고기 살짝 감 단호박 고구마 가득 포만 감건강하다 쿠폰적당하다 연어 따뜻하다 고구마 보리 운 야채 신선하다 채소 바게뜨 빵 하루 마지막 장식 샐러드 만찬 번 주신 아보카도 바나나 주스 감동 배부르다 다음 날 아침 역시넓다 분위기 사진 생각 사진 그대로 건강 담백하다 은근 배부르다 건강하다 심리 허기처음 끝 만족 일단 퀄리티 재료 쓰시 예 냥 단호박 달 단호박 재료 재료 별로 세심 구성 만족스럽다 야채 싫어하다 끼 조화롭다 구성퇴근길 야채 조리 정성 가득 후무스 바게트 최고 양도 넉넉하다 끼 다른 궁금하다오늘 서비스 샐러드 중독 맛집비 날 계단 미끄럽다네이버 결제 후 픽업 한번 보고 운 야채 젤 비트 후무스 빵 발린 요것 다음 번 다른 건강하다 배 느낌예전 남자친구 기억 만 포장 원래 브로 콜 리도 버섯 고기 편 여기 브로콜리 추가 정도 고기 부드럽다 냄새 안나 수비드 양 편이 성인 여자 기준 배부르다우선 이벤트 무료 아메리카노 재료 각각 신선하다 간이 다이어트 중 행복감요 수비드 비프 촉촉하다 오리 탈 소스 다만 오늘 단호박 딱딱하다 아쉽다진심 만족 수비드 비프 팔레트 배민 앱 우리 배달 배달 가능 보고 안심 가게 넓다 쾌적하다 조명도 적당하다 어둑하다 차분하다 가격 정도 적당하다 진심 최고아메리카노 쿠폰 완벽건강하다 검색 완전 고구마 단호박 브로콜리 어떻다 운 정도 닭 가슴 살 촉촉하다 소스 조화롭다 다음 다른샐러드 회사 학교 근처 자주 샐러드 위치 샐러드 전문점 다양하다 신선하다 재료 수비드 닭 가슴 살 플레이 담백하다 매장 넓다 테이블 넉넉하다 혼밥 배달 기사 자주존맛 처음 채소 신선하다 구성 알차다 배부르다 산뜻하다분위기 샐러드 재료 신선건강 식이 맛없다 생각 잠시 야하다 고기 부드럽다 재료 신선하다 매장 분위기 은은하다 조명 덕분 직원 최 우선 배달 포장 가능하다 재 의사가격 고기 부드럽다 간이 거의 안되다 원하다 소스처음 영접 이후 일주일 최소 번은 단골 맛집 샐러드 당연하다 스무디 바질 페스 토 파스타 징 도리사진 전 포장 호화롭다 샐러드 부동 샐러드 맛집 위 토핑 베이직 재료 대신 다른 재료 편식 걱정 토핑들 은 소스 전 개인 토핑들 빼 곡물 샐러드 소스대쟌맛 샐러드 발견 인테리어 캠핑 와인 바 독특하다 재료 배부르다 그릇분위기 맛집 샐러드 맛집 식단 분위기 가볍다 끼 따뜻하다 든든하다 백반 샐러드샐러드 맛집예정 미리분위기샐러드 맛집 든든하다 무엇비프 팔레트 고기 소스차별 수비드 샐러드 수비드 연어 부드럽다 담백하다 나니 아주 든든하다브런치 팔레트 샐러드 음식 팔레트 처럼 기도 든든하다 자극 건강하다 요 아주 적극 배달 도 홀매장 넓다 바 아늑하다 분위기 후무스 병아리 콩 약간 단 후무스 사고 정도 닭 가슴 살이 수비드 그렇다 촉촉하다 가격 대비 양 든든하다 플레이 트 구성 굉장하다 포만 엄청나다 빵 단호박 고구운 채소 연속처음 배민 보고 샐러드 여기 만 재료 신선하다 눈 입비프 샐러드 브라운 치킨 샐러드 포장 재료 신선하다 비프 치킨 질 기지 촉촉하다 부드럽다 야채 종류 다양하다 신선하다지하 이렇다 넓다 새롭다 공간 전혀 매우 넓다 쾌적하다 편하다 인테리어 멋있다 어요 맥주 수비드 닭 가슴 살 구성 알차다 양도 브로콜리 별로 편 입 깜짝 버섯 차갑다 조금 아쉽다 현미 곡물양 고구마 단호박 좀 뻑뻑 유 아메리카노 쿠폰 목맥힘 해결사무실 앞 종종 점심 불 좀 노래 샐러드 색 노랗다 고구마 단호박 도 꽤 포만 감 욥 아메리카노 서비스요즘 제일 샐러드건강하다 분위기 끼 식사 더하다 나위 일반 샐러드 다르다 와인 바 느낌 인테리어 탄수화물 단백질 지방 비율 고려 샐러드 구성 빵 밑 잡곡 밥 끼 먹기 부족함넓다수비드 비프 팔레트 를 달라 채소 등 내용물 종류 다양하다여기 종류 샐러드 모두 브라운 치킨 연어 운 야채 다음 운 야채 추가 욧 바질 페스 토 파스타 나중 내일팔레트 샐러드 매장 바게트 위 허머스 색감 비프 포크 샐러드 고기랑 채 밥 재료 샐러드 끼 식사 든든하다 각자 야채 간이 매장 넓다 분위기 먹기샐러드 은근 바 일별 샐러드인생 샐러드종종 배달 팔레트 샐러드 평이 괜찮다 단골 바질 페스 토 파스타 수비드 비프 샐러드최고 최고알 브라운 치킨 수비드 연어 포장 가게 직접 샐러드 정도 트럴 파크 날 관계 우선 둘 가격 정도 짐 양 샐러드 야채 밥 버섯 고구마 단소스 내용 뮬 신선하다 관리 분 강추 연어 생 와사비 마 소스 최고다이어트 해 어둡다 음식 색 신선하다 내용물 알차다 샐러드신선하다 느낌 자극 고기 부드럽다 고구마 달 부드럽다 은근 닝 단호박 씬스틸러조용하다 샐러드재료 신선하다 배달 빠르다건강하다 끼 재 의사양 끼 식사 다른 샐러드 궁금하다약간 바 느낌 테이블 마다 조명 나름 분위기 마음 음식 건 강 생각 연어 비프 등 샐러드 아보카도 블루베리 음료 판매 다소 느끼하다 카페라떼 건강하다 생각 음식 연어 고기 적당하다 익신선하다 건강하다 재료 로만 샐러드 가성 비 매장 분위기 장난 생각 힙 넓다 공간 다이어트 행복하다 용 담최근 샐러드 중 가장 요리 샐러드 맛집 항상 토핑 추가 기본 단호박 고구마 곡물 배 든든하다 메인 토핑 짐 채소 간이 삼삼하다 그냥입 리뷰 배부르다 다이어트 단골 서비스 자주 주시브런치 샐러드 맛집 양 신선하다신선하다 샐러드 베이직 소스 참기름 고소하다짱배달 지도 근처 매장 인테리어 이쁘다 넓다재료 정성 가득 퀄리티 양도 짐 포만 굉장하다 건 강하다 든든하다 먹기 가게 분위기 앞 자주 듯 해분위기 지하 샐러드 바 수비드 비프 연어 샐러드 세상 빵 채소 고기 잡곡 특이하다 지하 위치 분위기 샐러드 바 두운 조명 색다르다 분위기 인테리어 신경 느낌 자주 욧비밀 공간 분위기 샐러드 가게 기본 채소 알차다 구성눈 휴무 일 산책 겸 포장 양도 재료 신선하다 오늘 단호박 버섯 연어 돼지고기 말 날 춥다 서비스 주신 팔레트 샐러드 최고 월화 목금 토샐러드 맛집 동네 자주 샐러드 재료 신선하다선물 용 분특별하다 샐러드 후무스 바게트 빵 샐러드 현미 밥 양 끼 식사 충분하다 스테이크 건강하다 끼 식사바질 최고짐 든든하다 끼 식사 딱이다 용최애 샐러드 바질 페스 토 파스타 양 완전 배부르다 블루베리 스무디 취향 다음두번째 최애 샐러드 가게 근처 아쉽다 체인점요새 자주 애용 맛집 소고기 고구마 핵맛 양도 은근 배부르다재료 신선 퀄리티건강하다 든든하다 끼 양도 포장샐러드 배고프다 풀 우울하다 팔레트 샐러드 짐 다양하다 채소 후무스 빵 꼬들꼬들하다 잡곡 매장 분위기 양 포장 가면 먹기 충분하다분위기 내부 깔끔하다샐러드 편 인생 샐러드 만난 기분 요즘 야채 값 양 어쩜이리 샐러드 재료배부르다든든하다국포장 트롤 파크 피크닉 기분 양도 내용 실하다 건강하다 끼건강하다굿샐러드 가게 분위기매장 분위기 전 포장 스테이크 치킨 퀄 샐러드 재료 신선하다 보통 샐러드 고기 곡물 단호박 고구마 등 알차다 든든하다샐러드 요리 느낌 기존 소스 통조림 샐러드 든든하다 담백하다 건강 끼
133,사루비아다방,198726407.0,굿조용하다 주택가 위치 찻집 차 도구 때문 꼭 차갑다 직접 블렌딩 차갑다 빈티 찻잔 소개 주시 가끔 구입 여지 홍 백차 계열차 공간 구매 클래스 보고
134,에쏘하우스,35031928.0,아메리카노 기본 블렌딩 프릳츠 올드독 아주 약간 산미 고소하다 원두 브라 질 위주 블렌드 다른 만족 가깝다 자주비엔나 맛집 만근방 제일항상여기 아아 원두 기본 젤로 묵직하다 구수하다고급 진맛 랄 항상이집브라질 구수하다모든 종류 디카 페인아이스 바닐라 모카 아이스크림바닐라 라떼 아이스크림 감동 숲 터 사 가세 안쪽 웨이 팅아인 슈패너 크림 쫀쫀해젤직접 로스팅 아이스 바닐라 라떼 아이스 카페모카 아이스 초코 아이스크림 스쿱 다만 매장 좁다 함정안산 전제로 페이 쿠폰 사용 가능하다 직장 앞 쿠폰 사서 직장 동료 간단 헌 선물 용 애용매번브라질 여기 최애산미 완전 만족서대문 최고 바닐라 라떼서대문 구청 인근 최고 원두 미가 살굿공원 초입 위치라면 맛집아이스크림굿굿프릿 츠 원두 원두완전 굿 베이직 블랜딩 바디 감자주 가요아이스 바닐라 라떼 매장 강아지 귀엽다자주 가요라떼 부부 친절매장 청결하다가성 비맛집 아바 위 아이스크림주변 여기 가요아쉽다최고늘 늘가성 비최고더치 라떼맛았가까이 행운 누리 카푸치노 점점 제대로진리서대문 구청 부근 맛집종류 선택라떼 양 갈수록 자리여기 예전 한번 재 여전하다진하다 종종 제로 페이도 안되다 아쉽다종말 자주요바닐라 라떼 어제 종류 다른 덜하다 담 다시 바굿굿굿굳다굿굿굿명품 기분바닐라 라테비싸다굿굳다아이스 초코 요구청 가깝다 염 자주라떼 요진하다 힘근처 자주 무난 맀 용종류 단순하다요바닐라 라떼 아이스크림최고굿
135,연희롱블랙,1944434824.0,오 대학가 근처 저가 보통 원두 느낌 요기 미도 원두 깊다 어떻다 가격 파시 거죵디카 페인 여기 제일 콜드 브루 원두아메리카노 대박 대박굿
