title,content
{서울/연희동 카페} '코르타도 맛집' 매뉴팩트커피(Manufact Coffee Roasters),"오랜만에 들린 연희동 매뉴팩트커피! 이 때 내가 '코르타도' 라는 에스프레소 메뉴에 빠져있을 즈음이어서 들려보았다😗 (코르타도로 유명한 매뉴팩트) . . 이제는 너무나도 유명해진 매뉴팩트커피 그래서 이 외관사진은 옵션이면서도 너무 흔해진.. 자, 올라가즈아〰 . . . 오픈시간 조금 지났을때라 상당히 한산한 느낌 난 한잔 빠르게 털고 나갈거니까 낄낄 냉장고속 콜드브루 여전히 커피에 집중하는 바이브 자리잡고 주문! 코르타도 아이스로! . . 빛을 죽이고 찍어보았다... 아 내 아이폰.. 나도 인물모드 갖고파ㅠㅠㅠㅠ . . 기다리는 중🌞 에코백 산거 찍어보구(물론 지금은 너덜너덜...) 크........ 진짜 죽인다 이게 바로 코르타도 라구요 얼른 호로록 하고싶은 비쥬얼 빠르게 사진을 많이많이 찍어봅니다 맛은! 음... 일단 '맛'이 비쥬얼을 못따라가네 너무 속았당.. 그리구 향미나 입체감이 적어서 아쉽... 다크초콜릿이 베이스로 후미에 약산미가 감도는 느낌 산미도 막 경쾌한 느낌은 아니고 .. 어디까지나 이건 개인적인 느낌이었고ㅋㅋㅋㅋ 코르타도가 상당히 진한 커피메뉴임에도 불구하고 꿀떡꿀떡이 가능할정도로 전체적인 발란스나 바디감이 조화로웠다!! 몇모금이었더라? 아무튼 순각삭제완료! . . 커피사회에서도 큰 활약을 한 매뉴팩트지요.. 전시에서 못 만났으므로 ..이렇게라도 위안을😌 . . 잘 마시고 갑니다👋🏽 매뉴팩트커피 서울특별시 서대문구 연희동 130-2"
"[연희/매뉴팩트커피] 연희동 라떼가 맛있는 카페 MANUFACT COFFEE 메뉴, 가격","요즘 사회적 거리두기로 통 새로운 곳을 자주 가지 못해서... 세월을 거슬러 올라... (사진첩도 거슬러 올라...) 가봤던 곳 중에 또 가고 싶은 곳을 기록해보려고 한다. 내가 좋아하는 '라떼가 맛있는 카페'가 몇 군데 있는데 오늘 올릴 곳은 그 중 연희동에 있는 카페 매뉴팩트커피다! 연희동 매뉴팩트커피 주소 / 서울 서대문구 연희로11길 29, 2층 영업시간 / 월- 토요일 09:00 - 18:00, 일요일 휴무 전화번호 / 02-6406-8777 입구 사진은 찍지 않아서 인스타 공식계정에서 가지고 왔다. 연희점은 입구에 나무로된 입간판이 있긴 하지만, 입구 자체가 크지 않고 2층에 있어서 주소를 잘 보고 가야한다! 사진 참고...! 매뉴팩트커피 서울특별시 서대문구 연희로11길 29 매장 안쪽은 이런 느낌! 공간이 좀 협소한 편이기도 하고 워낙 유명하고 인기가 많아서 주말엔 보통 앉을 자리가 잘 없어서 늘 테이크아웃을 해서 먹었다. 판매하고 있는 콜드브루랑, 원두도 진열해 두시는데 이건 그냥 멋내기용(?) 디피고 실제로 콜드브루는 냉장고에서 꺼내주셨던 것 같다. 벽에 걸어두니까 괜히 멋있다! 추가로 멋짐 포인트 하나 더. 이건 벽에 설치되어 있는 정수기인데 처음보는 거라 괜히 신기해서 물 한 잔 마셨다. 꼴꼴꼴 물 잘 나왔다. MANUFACT COFFEE 매뉴팩트커피 메뉴, 가격 플랫 화이트, 카푸치노, 라떼, 아메리카노 / 각 4000원 모카 / 5000원 콜드브루 샌프란시스코, 카멜리아 / 각 5000원 콜드브루 폴고갱 / 4000원 핸드드립 4가지 종류 / 각 5000원 흔히 마실 수 있는 아메리카노나 라떼에 사용되는 원두는 폴고갱이라는 블랜딩 원두라고 한다. 이 원두 맛이 좋아서 따로 원두만 구매해 가시는 분들도 많다고 해서 나도 폴고갱!원두를 사용하는 음료만 마셔봤다. 하지만 메뉴판을 잘 확대해 보면 폴고갱 원두 말고도 콜드브루와 핸드드립이 종류가 여러개고 종류마다 사용되는 각 원두에 대한 설명도 아주 잘 되어 있다. 친-절. 라떼 4000원! 이면 요즘 왠만한 카페에서 아메리카노 가격보다 저렴하다고 봐도 될 듯하다. 매뉴팩트가 플랫화이트가 유명해서 오신다는 분들도 많지만 나랑 반려자는 라떼에 빠져서 한창 라떼만 시켰다. 둥둥. 엄마 따라서 강아지 인형 들고 온 어떤 애기랑 같이 메뉴 시키고 기다리는 중... 연희동 매뉴팩트 라떼 후기 나왔다! 나의 라떼. 위에도 적었지만 4000원이면 여느 카페의 아메리카노값보다 저렴한데, 맛은 절대로 저렴하지 않다...! 아주 부드럽고 풍미가 어마어마하다. 느껴지는 크레마... (맞나) 자리가 없어서 테이크 아웃을 해야했던 터라 괜히 아쉬운 마음에 나가기 전에 원두들과 기념사진을 찍어봤다. 하지만 요즘 같은 때라면 자리가 있든 없든 테이크아웃 각이다. 물 컵 앞에서도 기념사진 한 장 더. 1층까지 내려와서도 한 장 더. 질척 질척 가게 앞 꽃은 괜히 또 찍었다. 그리고 드디어 마셔본다...! 5월달에 찍은 사진이라 날도 좋고... 아무데서나 마셔도 커피를 마시는 그 곳이 곧 카페였던 날이었다. 마무리는 기동이(스쿠터)를 산지 얼마 안돼서 신이 났던 그날의 나와 반려자 사진으로... 매뉴팩트 후기 끝! 조만간 원두 구매하러 한 번 가봐야겠다."
[연희동 카페] 매뉴팩트커피 (Manufact coffee) | 라떼 맛집,"라떼 맛집 추천 매뉴팩트커피 ⏰ 월 ~ 토 | 09:00 ~ 18:00 매주 일요일 휴무 🚗 주차 불가능 안녕하세요 ◡̈ 다온입니다 오늘은 연희동에서 라떼 맛집을 찾아서 추천해드리려고 해요! 저는 남자친구 소개로 다녀왔는데요! 오전에 맛 없는 커피를 먹어버려서🥲 오전에 맛 없는 커피 먹은 입을 맛있는 커피로 덮기 위해 갔어요ㅋㅋㅋㅋㅋ 맛있는 커피를 먹어야 기분 좋은 우리..☕️ 입구부터 요즘 감성 가득가득 ◡̈ 커피 맛도 좋다는데 갬성도 가득할 것인가✨ 전체적으로 자리가 넓은 편은 아니었고, 인테리어는 깔끔하게 되어있어요! 포인트 하나하나 살리려고 한 모습들이 묻어나있는 듯한 느낌이었어요🤍 커피 원두와 드립백, 콜드브루도 판매하고 있어요 매뉴팩트커피 메뉴판 저희는 라떼 (₩5,000) 2잔 주문 했어요😆 커피 나오기 전에 매장 구석구석 디테일 보기◡̈ 물건들이 가지런히 정돈되어있는게 완조니 제 스탈쓰🫶🏻 매뉴팩트커피 라떼 라떼 비주얼 뭐람..🧡🧡 비주얼 먼저 합격!!!✨ 깔끔한걸 좋아하는 편이라 라떼보단 아메리카노 즐기는 저인데도 라떼가 고소하면서도 깔끔한 맛이라 정말 맛있게 먹었어요!!😮👍🏻 매뉴팩트커피는 연희동이 본점이고, 하남점에도 있으니 가까운 곳으로 방문해보세요◡̈ 라떼 맛집 찾으신다면 #매뉴팩트커피 완전 추천추천입니당✨ 매뉴팩트커피 서울특별시 서대문구 연희로11길 29 <매뉴팩트커피 인스타그램> Manufact Coffee Roasters(@manufactcoffee) • Instagram 사진 및 동영상 팔로워 1.1만명, 팔로잉 0명, 게시물 173개 - Manufact Coffee Roasters(@manufactcoffee)님의 Instagram 사진 및 동영상 보기 instagram.com <다온 인스타그램> Instagram의 다온(@daontoday)님 프로필 • 게시물 412개 팔로워 1.1만명, 팔로잉 833명, 게시물 412개 - 다온(@daontoday)님의 Instagram 사진 및 동영상 보기 www.instagram.com"
연희동카페 플랫화이트맛집 매뉴팩트커피,"연희동엔 다양한 컨셉의 카페들이 많이 있는데 새로운 카페도 가보긴 하지만 저는 제가 가봤던 카페 중에서 그날 그날 마시고 싶은 커피를 마시러 카페를 가고 있어요~ 매뉴팩트커피 그중 오늘은 연남동 사러가 마트 주차장 근처에 있는 연희동 커피 맛집 매뉴팩트커피에 왔어요~ 이 골목은 맛집들이 모여 있어서 자주 오곤 하는데 1층엔 베이글 맛집 '에브리띵베이글' 그 옆엔 파스타 맛집 '밀스' 건너편엔 수제 아이스크림 맛집 '콜드레시피' 수제 양갱 팥빙수 맛집 ' 금옥당' 짜장면 탕수육 군만두 맛집 '이품' 등등 다양한 맛집들이 모여 있어요~~ 매뉴팩트커피는 계단위로 올라가면 입구가 나와요~ 입구만 보면 을지로의 숨은 카페 느낌이 나긴 하는데 원조는 여기 매뉴팩트커피가 아니었나 싶어요 ㅎㅎ [영업시간] - 월 ~ 토 09:00 - 18:00 매주 일요일 정기휴무 * 02-6406-8777 서울 서대문구 연희로11길 29 2층 매뉴팩트커피 서울특별시 서대문구 연희로11길 29 저는 약속 전에 간단하게 커피를 마시려고 카페에 온 거라서 매뉴팩트커피에서 제가 좋아하는 플랫화이트 커피를 주문했어요~~ 디저트로는 브라우니랑 무화과 파운드 케이크, 다양한 커피 용품들과 더치커피, 원두도 판매를 해요~ 매장은 아담하지만 볼거리는 다양해요 요기서 커피를 내리는 모습을 보기도 하고 고개만 돌리면 바로 손님이 보이는 구조라서 구경을 마친 저는 앞 만보고 있었어요 ㅎㅎ 플랫화이트 5,000원 주먹만한 유리컵에 플랫화이트 담겨 나왔어요~ 세 입만 마시면 없어지는 양이랍니다 ㅎㅎ 평소 접한 플랫화이트보다는 진한 비주얼의 커피지만 맛은 진하지만 쓰지 않아요~ 커피 맛을 음미하면서 마시다보면 한 입, 두 입, 세 입... 커피가 없어져요ㅠㅠ 양이 적어서 아쉽지만 어찌보면 또 다른 커피를 마실 수 있으니 좋은거겠죠?!!! ㅎㅎ 매뉴팩트커피 주변으로 아인슈페너 맛집 '커피가게동경' 카페와 호주식 커피 맛집 '스웨이커피스테이션'도 추전해요~ 서울빵지순례 연희동베이커리 소금빵맛집 피터팬 서울에서 소금빵 맛집을 찾는다면 제 기준 피터팬1978을 빼놓을 수 없어요~ 진짜 진짜 소금빵을 모두가 알... m.blog.naver.com 카페, 맛집, 전시, 여행을 기록하고 같은 분야 소통과 서로이웃 환영합니다 :)♡"
"연희동 | 매뉴팩트커피, 플랫화이트 좋아","연희동 매뉴팩트커피에 갔다 커피로 유명한 카페라 전부터 와보고 싶었던 곳! 매뉴팩트는 사러가마트 옆에 위치해있다 2층으로 올라가면 된다 뭔가 마음에 드는 입구 항상 사람이 많다고 들었는데 다행히 우리가 갔을때는 자리가 있어서 (평일 1시 좀 넘어서 갔다) 테이크아웃하지 않고 앉아서 마실 수 있었다 앉아있으니 계속 사람들이 들어와서 금방 자리가 찼고 테이크아웃하는 사람들도 많았다 영업시간이 9시부터라고 하니 아침 일찍가서 마셔도 좋을 것 같다 플랫화이트 맛집이니 플랫화이트 아이스로 주문했다 ☕ 매뉴팩트는 커피 가격이 저렴했다 내가 시킨 플랫화이트는 4000원이고 모든 커피를 5000원 이내로 마실 수 있다 작고 예쁜 잔에 나온 플랫화이트! 커알못이지만 맛있는 커피라는 게 느껴진다 평소 쓴맛은 안 좋아하는데 이 커피의 씁쓸함은 왠지 기분좋은 씁쓸함? 그런 느낌이라 좋았다 고소함과 씁쓸함의 조화도 좋았다 공간이 크지 않은데 손님들이 많다보니 여유있게 대화하고 작업할 분위기는 아니다 커피에만 집중하게 되는 공간 매뉴팩트커피에서는 원두와 드립백, 콜드브루도 판매하고 있다 엄마 선물로 원두를 살까하고 고르고있으니 옆에서 친절하게 설명해주셨는데 무난하게 잘 팔린다는 폴고갱 원두를 사봤다 방금 마신 플랫 화이트에도 폴고갱 원두가 들어갔다고 한다 몰랐는데 원두를 사면 커피 한 잔을 마실 수 있었다..! 자세히보니 메뉴판에도 적혀있다 그래서 바닐라라떼로 한 잔 더 마시기로 테이크아웃해서 나온 바닐라라떼 맛있다!! 달달한 걸 좋아해서 그런지 플랫화이트보다 바닐라라떼가 더 마음에 들었다 옆에서 보니 바닐라라떼 마시는 사람들도 꽤 있었는데 다 이유가 있나보다"
[연희동] 매뉴팩트커피 - 수식어가 필요 없는 자타공인 커피맛집☕,"까망별의 Cafe Story 커피계에서 유명하다는 매뉴팩트커피! 안녕하세요 ◡̈ 까망별입니당💜 커피 좋아하시는 분들은 다들 다녀오셨을 곳! 연희동의 <매뉴팩트커피> 에 다녀왔어요🙌🏻 오빠는 혼자서도 몇번 방문했었다는데, 주차가 어려워서 저는 방문 실패하다가, 드디어! ㅋㅋㅋㅋ 저도 매뉴팩트 마셔봤습니다아!😆☕ 입구부터 넘나 친숙 & 익숙 ㅋㅋㅋ sns에 굉장히 많이 올라오는 단골 대문이죠! 나무 표지판은 빈티지스러워서 더 따사로운 분위기! 계단을 따라 올라가면 스탠드에 패브릭을 씌워놓은 유니크한 간판ㅋㅋㅋ 이쁘더라구용??💛 저는 그래도 꽤 크려나? 했는데 내부가 진~~짜 작아서 ㅋㅋㅋ 놀랐어요! 그래서 테이크 아웃 해가시는 분들도 엄청 많고, 날씨가 좋으니 나가서 마시자는 분들도 계시고ㅋㅋ 하지만 저는 더웠고, 다리도 아팠고😇 타이밍 좋게 자리가 딱! 나서 바로 착석ㅋㅋ 매장 안에 큰 룸 하나는 콜드브루 내리고 있구요! 바 Bar 자리, 가운데 큰 테이블 하나, 창가에 의자 두개! 이렇게가 끝이에요!!! 공간은 좁은데, 안에서 일하시는 분들은 4분인가? 계셨고 ㅋㅋㅋ 그러다보니🤔 회전율은 빠릅니다!!!! ㅋㅋㅋㅋㅋ 다들 길게 앉아계시지 않아요! 손님이 끝없이 오기도 하고, 약간 정신없어서ㅋㅋㅋ 금방 마시고 일어서는 편...!! 주문 📋 - 핸드드립 에티오피아 '모모라' 6,000 - 핸드드립 콜롬비아 '엘 디비소' 6,000 ice로 주문 완료하고, 바로 옆에서 바리스타님이 커피를 내려주는걸 지켜봤죠 👀 ㅋㅋㅋㅋㅋㅋ 커피 다 내린 다음에, 조금씩 따라서 맛을 보시고! 고개를 끄덕 끄덕 - 한 뒤, 통과!였는지 따라 주시더라구요 ㅋㅋㅋ 맛있어요.............. 여러분, 꼭 가세오......... 왜 커피 성지 느낌인지 넘나 알 것 같... ☕☕☕ 커피 컬러 보세오🤎 크- 햇살이 넘 좋았다💛 매뉴팩트커피 꼭 방문해보세요🤎 영업 시간 📌 : 월~토 9:00 - 18:00 (매주 일요일 정기휴무) 주차 📍 : 불가 (근처 공영주차장 이용) 매뉴팩트커피 서울특별시 서대문구 연희로11길 29"
"[연희동] 매뉴팩트커피,연희김밥 ,콜드레시피 아스크림","#메뉴팩트 #연희동 #동네맛집 #동네여행 See.y씨이님 더운 날이지만 운동 끝나고 이동 😀 See.y 씨이님 절친 약속 장소 이동 중 너무 예뻐서 첫 장소 목마름 해소 매뉴팩트 커피 연희 핫한 To go 만 가능 그래도 좋아요. 😎 아이스 아메리카노 벌컥벌컥 절친 플랫화이트 고소고소 조명 일회용컵 전구와 함께 :) 요즘 콜드브루 관심 많아서 콜드브루 구매 욕구 연희동 연희김밥 유명하죠. See.y 씨이님 정보 알지 못하고 연희동 상점 매주 수요일 휴무 라는거 그 중 일요일 휴무인 연희 김밥집 발견 하지만 운좋게 한곳에 사장님 문닫게 직전 한개 남은 김밥 한줄 득템 야호 1,000원 할인 왕오징어 김밥 너무 매워요. 맥주 벌컥벌컥 포장 김밥과 사러가마켓 구매한 맥파이 한정판 여름회동 맥주 원샷 3번째 콜드레시피 아이스크림 ( 21시까지 영업 ) 사실은 매뉴팩트 커피 마시면서 산책 중 사장님 영업시간 문의 후 간단히 저녁 알코올(?)섭취 :) 더위 날리기 위해 여름 시즌 백도복숭아 소르베 너무 상큼 새콤달콤 달지 않아서 좋아요. 레몬 크림 맛보고 싶네요. 절친 얼그레이 선택 포장/배달 가능 시즌별 메뉴 다양하고 여름엔 디져트 아스크림 만한게 없죠. 사러가마켓 살짝쿵 방울양배추 ,체리페퍼 위드 크림치즈 구매 “다비쳐 “ 김원효 개그맨 마주침 :) 인사 할뻔 인스타 글 남겼더니 답글 왔어요. 신기방기 :) See.y 씨이님 보고 , 먹고, 즐기고 위해 더위도 이겨낼고야 !!"
매뉴팩트커피/에티오피아봄베 시즌블랜드/ 연희동 커피집,"매뉴팩트커피 9:00-18:00 일요일정기휴무 오래된 건물 2층에 위치해 있다 이층계단으로 올라가면 #매뉴팩트커피 에브리띵베이글 건물 2층에 위치해있다 6시까지만 영업한다. *nine to six 근무 매장이 협소한 관계로.. 역시나 만석이였지만.. 다행히 커피를 마실수 있었다 #에티오피아봄베 hot #시즌블랜드 ice 커피가격대는 있는 편이다 주문과 동시에 원두를 갈아서 핸드드립으로 내려준다 원두를 구매하면 에소프레소, 아메리카노 한잔 제공해 준다 커피맛은 단연 최고! 너무 맛있어 단 양이 작을 뿐 ㅎㅎ 아이스가 얼음때문인지 양이 많게 느껴짐 뜨거운 아메리카노는 원두의 향과 맛을 느끼기 어려운데.. 적당히 커피마시기 좋은온도, 커피의맛과 향을 느낄수 있었다 다시 생각나는 커피 맛 빈티지하면서 깔끔 모던 한 매장 좌석은 몇개 없다 6인석테이블석, 창가에2인석, 벽에 붙은 바 테이블4석 다행히 벽에 붙은 테이블 석에서 커피를 마실수 있었다. 오래있을 분위기는 아니다.. 연희동에서 커피 제일 맛있는 곳! 잠시 머무르는 건 괜찮지만.. 자리가 협소한 관계로 테이크아웃이 편할 것 같다 기회되면 #매뉴팩트하남 매장에도 가보고 싶다~ #매뉴팩트커피 #메뉴팩트하남 #매뉴팩트본점 커피맛집인정:) 춘천에도 매뉴팩트 만큼 커피가 맛있는 곳이있다!! # HK커피로스터스 #스페셜티커피 전문점 조마간 방문해 봐야겠다!"
[홍대입구역]매뉴팩트커피 : 라떼가 맛있다는 연희동 커피 맛집,매뉴팩트 커피 Manufact Coffee 월~토 9:00 ~ 18:00 일 휴무 https://www.manufactcoffee.com/ Manufact Coffee Roasters https://www.instagram.com/manufactcoffee/ www.manufactcoffee.com 날 맑은 날 연희동에 놀러갔다. 연희동 너무 좋아. 홍대 합정 연남 연희 상수 중에 나는 연희동이 제일 좋다. 역에서는 아무래도 좀 거리가 있지만 소소하고 아기자기한 가게들과 진짜 사람이 사는 다소곳한 주택들이 모여서 만든 골목골목이 구경할 맛이 나기 때문이다. 오늘 여기 온건 유명한 카페가려고! 본가가 홍대/합정/망원에서 멀어서 이쪽은 잘 못왔었는데 커피 맛집이 죄다 이쪽에 몰려있어서 얼마나 와보고 싶었는지.. 앞으로 이 동네 커피 투어를 해볼 생각이다. 우선 그 첫번째는 매뉴팩트 커피! 매뉴팩트 커피는 하남 스타필드점도 있고 성수점도 있다. 허름한 계단으로 올라가면 매뉴팩트 커피 로스터즈 사인이 보인다. 옆에 유리문 열고 들어가면 짜잔 꼭 조그만 매점같아 보이기도 한다. 이 뒤에서 커피를 뽑는 것 같진 않구 우선 계산은 여기서 했다. 메뉴는 only 커피!! 커피 맛집인 만큼 커피만 팔고 있다. 나는 라떼를 마시러 왔지만 콜드브루도 유명한듯? 제일 첫번째 메뉴가 콜드브루인걸 보면 말이다. 원두 종류도 다른데보다 훨씬 많은 것 같다. 특히 핸드드립 원두가 많네.. 아직 핸드드립의 맛을 아는 레벨이 아니라 나는 항상 아메리카노 아니면 라떼만 마신다. 계속 마시다보면 언젠간 레벨업 하겠지! 한켠에는 이렇게 원두별 콜드브루를 판매한다! 아 이제와서 생각해보니 저거 하나 사올걸.. 매장은 무척 협소하다. 앉을 자리가 다합해서 10개가 안되는 느낌? 한켠에는 콜드브루잉 하는 기계가 줄지어 있는데 진짜 브루잉을 하는 기계인지는 모르겠다. 커피는 여기서 뽑는듯? 여기서 로스팅도 하고 커피도 뽑고 하나보다. 완전 오픈되어 있음. 여기서도 앉아서 마시라고 의자를 갖다 놓은건가 의문이 드는.. 내가 오후 3~4시 사이에 갔었는데 그때는 한 4명정도 있었다가 내가 커피 사고 얼마 안있어 거의 자리가 다 찼다. 나는 라떼 처돌이! 고소하고 달큰하고 진한 라떼를 좋아한다. 이곳도 라떼가 맛있다고 추천받아 왔는데 사실 내가 기대하는 라떼 맛은 아니었다. 아무래도 내가 좋아하는 라떼는 원두의 맛이 아니라 우유의 맛으로 좌지우지 되는건가보다. 워낙에 유명한 곳이라서 아메리카노도 마셔볼까 하다가 그냥 나왔다. 다음에 근처를 지나갈 일이 있으면 다시 와봐야지! 총평 분위기가 무척 연희동스럽다. 맛있는 커피가 저렴하다. 자리가 매우 협소하다. 평점 맛 : 4.0/5 분위기 : 4.0/5 가격 : 4.0/5 재방문의사 : 4.0/5
서울 연희동 에스프레소 카페 매뉴팩트커피,"연희동 카페 나의 노후를 함께할 연희동에 다녀왔다. 얼마 전 인테리어 예쁜 카페 글에 친구가 매뉴팩트 언급하면서 댓글을 달았는데 그 이후로 여기 커피가 계속 생각났었다. 서울 가는 스케쥴이 생겨서 바로 여기서 커피부터 먹음ㅎㅎ 위치는 사러가와 연희김밥 사이 골목을 지나 에브리띵 베이글 옆 계단 2층, 금옥당 맞은편 주소 : 서울 서대문구 연희로11길 29 전화번호 : 02-6406-8777 영업시간 월-토 09:00-18:00 매주 일요일 정기휴무 매뉴팩트커피 연희동은 교통도 불편하고 주차도 불편하다. 나는 사러가 마트 주차장을 이용했는데 사러가 주차장은 구매금액 따라 최대 2시간 까지 주차 이용 가능. 5천원 이상 30분 2만원 이상 1시간 3만원 이상 1시간 30분 5만원 이상 2시간 이 동네 주차 단속도 자주하니까 그냥 돈 내고 여기 대는게 편하다. #매뉴팩트커피주차 #연희동주차 매장은 매우 허름한 건물 2층 엘리베이터는 없고 계단으로 올라가야 한다. 계단을 올라가면 입구 작은 간판 오른쪽으로 들어가면 된다. 매장은 큰 테이블 하나+의자 여섯개에 바 테이블 하나. 딱 커피만 먹을 수 있는 분위기다. 앉아서 대화를 하거나 공부를 하거나 업무를 보기엔 직원들도 분주하고 사람이 너무 지나다닌다. 메뉴 에스프레소 4,000 롱블랙 5,000 아메리카노 5,000 코르타도 5,000 플랫화이트 5,000 라떼 5,000 바닐라라떼 6,000 브루잉커피 6,000 원두는 세가지 케냐 '마띠라PB', 파푸아뉴기니 '카구아', 폴고갱 15,000-18,000 콜드브루도 여기서 내린 것을 판매한다. 근데 매장에서 사도 오늘 내린 것은 아닐 수 있다. 한 병에 15,000원 인터넷 판매도 하고있으니 커피 좋아하면 꼭 먹어보길 추천한다. 특히 폴고갱! https://manufactcoffee.com/coldbrew Cold Brew | Manufact Coffee Roasters https://www.instagram.com/manufactcoffee/ manufactcoffee.com 작년엔 신세계에 입점돼있었는데 이젠 매뉴팩트 홈페이지에서만 판매하는 듯. 매뉴팩트라고 쓰인 예쁜 컵이랑 드리퍼, 원두에 티셔츠까지 판매한다. 매장 한켠에선 계속 커피 내리는 중 카운터 안쪽에 직원들 쉬는 공간도 있고 직원이 항상 두세명은 나와있다. 살갑고 친절하고 이런 분위기는 아니고 그냥 커피 배우는 사람들이 자기 할 일 하는 느낌이라 오히려 좋다. 주문하고 앉아있으면 직원분이 커피만 자리까지 가져다 준다. 빨대나 냅킨은 셀프. 플랫화이트 아메리카노랑 라떼 정도밖에 안먹어봤지만 여기선 플랫화이트를 먹어야한다. 처음엔 섞지 않고 먹는다. 저번에 물어봤을 때 분명히 서울우유 쓴댔는데 우유까지 맛있다. 위쪽은 우유 향 가득에 커피도 고소하고 좋다가 아래로 갈수록 쓰다. 1/3 쯤 마시다 섞으면 끝까지 맛있게 먹을 수 있을 듯 시럽 들어간 커피도 빨리 못먹는데 얘는 3분만에 다 먹고 일어났다. 에스프레소라 컵이 주먹만하긴함. 진짜 커피전문점의 감성 커피가 맛있으니까 모든게 좋아보인다. 총평 ★★★★★ 최고의 커피전문점 오랜만에 먹으니까 더 맛있다. 매뉴팩트커피 서울특별시 서대문구 연희로11길 29"
