title,content
연희동 카페 : 매뉴팩트커피(커피맛집에서 바닐라라떼) + 폴앤폴리나에서 빵 사먹은 하루,"어제도 동생이랑 동네산책 빵이랑 커피 사왔다! 폴앤폴리나 서울 서대문구 연희로11길 56 폴앤폴리나는 너무 예쁜 삼각형 건물에 있다. 여기는 우리가 배고플 때 가끔 사오는 빵집! 난 저 전봇대와 전깃줄이 너무 이상한데, 연희동 놀러오는 친구들은 신도시는 저런게 없다면서 전깃줄이 잇는게 이쁘다고.. 햇는데😅😅 한번 새똥 맞아봐.. 진짜 싫다니까.. 🐧🐧 ㅠㅠㅋㅋㅋㅋㅋ 서로를 부러워하는 요상한 상황!! 여튼 빵사러 고고😆😆 여긴 샌드위치도 맛있다! 😆😆 맨날 늦게와서 빵이 별로 없었는데 오늘은 많았다! 메뉴가 다양하진 않다. ㅎㅎ 버터프레첼이랑 스콘! 동생이랑 반띵😆😆 사실 나는 엄청난 빵순이였는데, 위염을 심하게 겪고 난뒤.. 완전 쫄보가 되어 먹는거에 조심하게 되었다. 많이 못 먹음.. 😅😅 엉엉.. 여튼 버터프레첼 짱 맛잇다..🖤 매뉴팩트 커피 서울 서대문구 연희로11길 29 오늘 커피는 매뉴팩트 커피! 여기서 쇼핑몰 사진 많이 찍더라.. 😅😅 매뉴펙트 커피는 매우 조그만데 사람이 항상 많아서 앉아서 먹기란 쉽지 않다. 좁은공간에 따닥따닥 잇어서 사진찍기도 어려움 😭😭 주문은 요기서! 귀염뽕짝😆😆 사실 여기는 커피맛집이라 커알못인 우리는 올 일이 별로 없는데, 다행히 바닐라 라떼가 있었다. (5,000원) 귀여운 컵들이랑 원두 판매중! 요고 자세히 보니까 물 나오는 곳?!! 신기방기 근데 바닐라라떼.. 너무 맛있어서.. 놀람..😆😆 여기 이제 원픽..히히 왜 사람 많이오는지 연희동 20년차에 깨달음.. 집 돌아가는 길에 저기 저 강아짘ㅋㅋㅋㅋㅋ 어우 깜짝이야 증말😅😅 골목길 지나갈때까지 서로를 쳐다봤지..😆😆 폴앤폴리나 서울특별시 서대문구 연희로11길 56 매뉴팩트커피 서울특별시 서대문구 연희로11길 29"
연희동 카페 추천! 노트북하기 좋은 커피숍 아워온즈/매뉴팩트커피/카페129 11,"날씨가 너무 좋았던 일요일 ☀️ 노트북으로 작업은 해야겠고, 나들이는 가고 싶고! 그래서 선택한 연희동 카페 탐방 연희동에는 유명한 카페가 많으니까 ~ 연희동 카페를 너무 우습게 봤다 😥 이렇게 사람이 많은 줄은 몰랐지… 일단 첫번째 방문한 곳은 아워온즈 서울특별시 서대문구 연희맛로 45 아워온즈 첫번째도 노트북 하기 좋은 곳 두번째도 노트북 하기 좋은 곳 으로 검색해서 간 곳 내가 좋아하는 피터팬제과 바로 옆블럭에 있음 겉에서 볼 때 엄청 커서 당연히 자리가 많은 줄 알았지 ^^^^^ 오 느낌있어 들어가면 분명 더 아늑할꺼야 와 여기 빵 미쳤는뒈??? 머쉬멜로우 올라간 쿠키랑 소금빵 먹어야지 그런데!! 직원분이 자리부터 확인하라고 하셔서 자신있게 2층으로 갔더니 이미 만석 아니나다를까 노트북사용자분들로 꽉 차 있었음 힝 😥 자리가 없어서 포기하고, 두번째로 찾아간 곳 매뉴팩트커피 서울특별시 서대문구 연희로11길 29 매뉴팩트 커피 워낙 유명한 곳 말해 뭐해 어?? 뭐라고??? 일요일은 왜 안써있어 ㅋㅋㅋㅋㅋㅋㅋ 들어가보지도 못하고 실패 이젠 검색해서 찾아간다는 마음을 버림 그냥 지나가다가 괜찮으면 들어가야지 하고 찾은 곳 카페129-11 서울특별시 서대문구 연희로11가길 20 카페 129 11 사실 지나가다가 고른 건 맞지만 검색할 때 나왔던 곳이였다 루프탑 같은 야외 공간을 봤던것 같다 👀 이렇게 느낌있는 계단을 따라 올라가면 됨 저기가 그 루프탑 같은 곳이군! 루프탑이 아니라 테라스? 같은 공간이였다 내부는 이런 느낌 사람도 많이 없는 편이라 문서작업에 집중을 할 수 있겠군 이 자리가 딱이였는데 이 테이블은 3인 이상 가능하다하여 결국 2인 좌석에 자리잡음 내가 앉아야 할 곳 그래 아늑하니 괜찮아 아이스아메리카노 를 주문하고 열심히 집중집중 💻 을매나 집중 했는지 커피맛이 기억이 안난다 ㅋㅋㅋㅋ 발등에 불떨어졌으니 껄껄껄 반 정도 마신거 같은데 무난한 커피였던 걸로 기억 근데 친구로 보이는 2명의 손님이 귀에 이어폰을 낀 채로 소리를 지르면서 대화를 해서 그건 좀 힘들었다 😭 문서작업이나 공부가 필요할 땐 자리선정이 중요함 요즘 핫하다는 프로토콜 에도 가봐야 되는데 여긴 너무 핫해서 일요일이 아닌 날 방문해보려한다 얼떨결에 카페투어가 되버린 3월 주말의 어느 날 이였다"
연희동 카페 매뉴팩트커피 플랫화이트와 바닐라라떼,"연희동 카페 매뉴팩트커피 영업시간 월-토 09:00 - 18:00 일요일 휴무 주차장 X 콜드브루/핸드드립 전문 플랫화이트 맛집 내 입맛엔 바닐라라떼 ♡ 협소하지만 분위기는 굿 슬슬 봄이 와서 그런지 여기저기 걷고 싶은 요즘! 날씨 좋은날 연희동에 다녀왔다 연희동은 주차하기 어려워서 갈려고 할때마다 망설여지는 곳인데 이날은 처음으로 버스를 타고 가보았다 지하철도 없고.. 교통편 에라잇~ 연희동에 도착하자마자 제일 먼저 방문한 곳은 바로 매뉴팩트커피 ** 어느 후기에서 매뉴팩트커피는 연희동 방문시 꼭 들려야 하는 곳이라고 ㅎㅎ 그만큼 커피맛집으로 소문이 자자한 곳! 그 중에 플랫화이트 커피가 그렇게 맛있다고 한다 연희동 카페 매뉴팩트는 꽤나 협소한 공간이다 생각보다 더 작은 규모라 살짝 놀랬음 ㅎㅎ 또 이것저것 뭐가 엄청 많아서 약간 정신없어 보이지만 커피 공장처럼 돌아가는 모습이 신기하기도 했다 콜드브루와 핸드드립 커피를 맛 볼 수 있는 곳 원두도 같이 판매가 되고 있다 연희동 카페 매뉴팩트커피는 플랫화이트 맛집이라는 얘기를 너~무 들어서 여기 오기전부터 메뉴는 이미 정해져 있었다 플랫화이트 (4,0) 바닐라라떼 (5.0) 이렇게 주문을 했다 자리가 마땅치 않았지만 ㅎㅎ 코로나 시국에 커피 길빵을 할 순 없고 먹고 가야 하는데.. 중간에 큰 테이블이 하나 있고 벽쪽으로 좌석이 몇개 더 있다 다행히 구석진 벽쪽에 2인석이 있어서 그쪽으로 가서 앉았다 내부 영상 맛보기 # 이 작은 공간에 직원분들이 꽤 많았다 정말 커피 공장처럼 다들 분주한 모습이였다 내가 앉은 자리에서 커피가 제조되는 과정이 한눈에 보여 주문이 들어올때마다 계속 쳐다보게 된다 ㅎㅎ 모든 자리가 만석일때도 있고 갑자기 손님들이 훅 빠질때도 있었다 자리가 협소하다보니 타이밍만 잘 맞추면 될 듯 한데 다른 카페들에 비해 회전율은 좋은편인거 같다 주문이 들어오면 바로 원두를 갈고 바로 커피를 내리고 작업대가 중간에 있어서 이 모든 과정이 한눈에 보인다 언젠가 나도 한번 해보고 싶은 것 중에 하나가 바로 커피~~ 기회가 된다면 배워보고 싶다 왼쪽이 플랫화이트, 오른쪽이 바닐라라떼 플랫화이트 컵세트가 너무 예뻐서 컵은 판매 안하나~ 살펴봤는데 판매 안하는거 같다 아쉽.. 플랫화이트는 뭔가 찐~한 맛은 없었지만 이런 담백하고 고소한 느낌이 좋아서 사람들이 좋아하는거 같다 약간 어른 커피 느낌이랄까 달달한 느낌을 원한다면 바닐라라떼를 추천! 사실 내 입맛엔 라떼가 더 맛있었다 ㅎㅎ 달달+고소 밸런스가 굿굿 이번 신상 가방 로이백을 들고 나왔다 은근 자주 손이 가는 가방이다 일단 너무 가볍고 요즘처럼 가벼워진 룩에 넘나 찰떡 ! 내눈엔 블랙보다 화이트~ ♡ 링크 같이 걸어둘게요! ▼▼ [펠리시티스토어] 로이 비건 레더 가벼운 토트 숄더백 : 펠리시티 스토어 가벼운 무게감과 멋스러운 디자인이 돋보이는 비건 가죽 여성 가방 smartstore.naver.com 연희동 카페로 가볍게 들리기 좋은거 같다 공간 보다는 커피를 즐기기 좋은 곳 다음에 날 잡고 연희동 카페투어 제대로 해봐야 겠다! 매뉴팩트커피 서울특별시 서대문구 연희로11길 29"
내가 사랑하는 연희동 🤎 에브리띵베이글 & 매뉴팩트커피 & 페잇퍼,"에브리띵베이글 서울특별시 서대문구 연희로11길 29 1층 에브리띵베이글 매뉴팩트커피 서울특별시 서대문구 연희로11길 29 페잇퍼 서울특별시 서대문구 연희로15안길 32-7 1층 바늘이야기 연희점 서울특별시 서대문구 연희로11가길 15 서울 그로서리 클럽 서울특별시 서대문구 연희로11가길 8 1층 교통편이 불편해 자주는 못 가지만 일부러 이 코스대로 휴일을 보내기 위해 들리는 연희동. 아침에 일어나면 아무것도 먹지않은 채 일찍 에브리띵베이글로 향한다. 에브리띵 베이글 나는 원래 우리나라에서 맛있는 베이글을 꼽자면 포비베이글파였는데, 여기서 베이글을 먹은 뒤로는 포비베이글은 2순위로 밀렸다. 포비가 한국식 베이글의 1인자라면, 에브리띵은 증말 미국식 베이글의 1인자..🥯💕 이 집 맛집이라는 소문을 듣고 처음 먹었을 땐 크림치즈의 강렬한 맛과 전체적인 짭쪼로함에 당황했다. 약간 단순무식한 맛? 근데 이게 머리에서 안 사라지는거다 약간 주말 아침마다 먹어줘야할 거 같고, 뉴요커 빙의 해줘야할 거 같음(나만그럼 주의) 진짜 찐 뉴욕에서 먹던 맛ㅋㅋㅋ 왜냐면 뉴욕 에싸베이글에서 먹고도 ""크림치즈의 강렬한 맛과 전체적인 짭쪼로함. 약간 단순무식한 맛""을 똑같이 느꼈으니까. 거기다 베이글의 쫀득쫀득함ㅠㅠ (포비는 맛있지만 안 쫀득하쟈나여!!!) 외국인들 오면 엄청많이 사간다. (매일 아침 대용아닐까요??) 뉴요커 빙의하시고싶으신 분들 추천합니다!! 매뉴팩트 커피 연희본점 아니 근데 더 대박인 건 맛집 위에 맛집 👀✨ 이 맛있는 베이글 집 위에 내 최애 커피집이 위치한다는 사실... 승무원하면서 내 취미가 그 나라 그 지역 젤 유명한 카페가서 커피마시는 거 였는데 증말 뉴욕, 엘에이, 샌프란, 시애틀 어디 스페셜티 커피에 내놔도 안 꿀리는 곳이 나는 매뉴팩트커피라고 생각한다. 내가 이 일을 그만둬도 커피는 매뉴팩트가서 마시면 되잖아? 혼자 이런생각 많이함. 그리고 나도 최근에 여기서 딱 한번 먹어봤는데 밑에서 냄새가 강하지않은(딱 크림치즈만 바른) 베이글은 위에서 커피와 함께 즐길 수 있다😭💗 진짜 다른게 호사가 아니다... 큰거 안 바랍니다 이 두가게가 나 할머니될 때까지 여기서 사이좋게 영업해주시길 서울 그로서리 클럽 원래는 커피랑 베이글 먹고 바로 걸어서 페잇퍼가면서 꽃가게랑 예쁜 주택들 구경하는 것이 나의 루틴인데 사로가마트 쪽에 새로운 가게들이 들어섰다. 주택을 개조하여 그로서리 마켓과 작은 전시공간 피자가게 카페가 함께 모여있는 공간. 이런거 좋아하는 나는 또 총총 방문🏃🏻‍♀️=33 밑쪽에 그로서리쪽과 전시공간만 둘어보았는데 내가 갔을 때만 그랬는지 아니면 쭉 그렇게 구성하는지는 모르겠지만 프로틴 제품들이 많았다. 프로틴 도넛이랑 칩이랑 등등 최근에 마켓컬리에 그 때 본 프로틴 도넛이 입점되어 있었다. 다이어트 하더라도 일부러 단백질을 챙겨먹으려고 노력해서 판매 상품들 하나하나 다 관심이 갔다. 그리고 패키지는 왜이렇게 예뻐😵‍💫💕 건강보조식품? 영양제도 패키지가 어찌나 이쁜지 선물용도로도 너무 좋을 것 같았다 사지는 않았지만 음료나 간식, 식재료 등등 연희동 오면 둘러 볼 만한 좋은 곳이 생겼다. 바늘이야기 연희점 연희동 너무 오랫만에 왔나... 이건 또 언제 생겼죠....?? 정말 뜨개질 취미가지신 분들 오면 천국일듯😇 나 갑자기 취미 생길 뻔 했잖아 뜨개질 관련 상품들 구매할 수 있는 공간과 윗층에는 카페도 보였고 위쪽은 가보지 않았지만 뜨개질 수업을 들을 수 있는 공간이 있는 듯했다. 이 니트 팔면 사고싶은데 완제품은 없고 실만 판다ㅠㅠ.. 누가 떠줘🧶 폴로 니트보다 예쁜 거 같은데 손재주가 없으니 가질 수가 없습니다.. 🪡🧵 책도 판매하고 있고 인터넷 사이트도 있는 듯 고등학생때, 대학생때 목도리 떴던 추억💭 시장에 위치한 뜨개질가게에서 아주머니 할머니들이랑 (뜨개고수, 장인들) 옆에서 배우고 하던 기억이 새록새록 났다ㅋㅋㅋ 증말 못해서 성격 다 배렸던 예쁜 주택들과 주택을 개조한 카페들을 구경하면서 이제 페잇퍼로 이동 페잇퍼 예쁜 고양이 두마리가 맞아주는 이곳은 넘나 소듕한 공간😭💕 합정의 만화카페로 유명했던 즐거운작당이 사라지고 아이들을 위한 동화책북카페인 달달한 작당을 시작하셨다가 마침내 연희동에 비밀 만화책방인 페잇퍼로 돌아왔다. 즐거운 작당이 사라져서 얼마나 슬펐는데 페잇퍼로 돌아오시고 얼마나 기뻤는지! 즐작+달작이 합쳐져 만화책과 그림책이 집 가득하고 공간은 비밀 아지트처럼 따뜻하고 포근하다. 사장님도 뭔가 만화책에 나오는 카페 주인같은 느낌이시고 언제부턴가 두마리 고양이도 함께 맞아줘서 진짜 절대 사라지지말아주세요🙊 나 울어 구비되어있는 책들 양과 질도 어마어마하다 라면맛은 말할 것도 없습니다 paperr.kr 너무너무 소중한 연희동의 세공간, 👒🧳"
[연희동] 매뉴팩트커피 플랫화이트,매뉴팩트 연희 본점에 꼭 한 번 가 보고 싶었어요. 지도 보고 열심히 찾아가다가 그냥 지나쳐서 다시 돌아온 입구입니다... 여긴 이미 너무너무 유명하지만 내부가 이렇게 좁은지 저는 몰랐습니다... 대충 막 식물이 우거진 사진을 봤던 것 같은데 거의 인스타그램 정방형 안에 들어있는 풍경만 봤다 보니 이렇게 협소한지 몰랐네요... 아이스 플랫화이트 4000원 무려 제가 배정받은 자리 (???) 출입문 앞에 허벌의자가 놓여 있는데 거기도 자리였습니다... 척추수술 당첨 의자에 걸터앉아서 얼른 들이키고 갈 길 가는 fun~ cool~한 감성이겠죠? 그치만 저는 할 일이 있었다구요ㅜ 바 자리가 나서 남은 걸 마저 마시고 얼릉 나왔습니다. 라이카 시네마에서 오렌지필름 단편선 보고서 오렌지 받았어요... 귀엽주.. 가방에 넣고 다녔더니 소지품에 농약 범벅 아무튼 매뉴팩트 플랫화이트는 증말 맛있습니다. 이로써 연희 방배 도산 모든 지점 도장을 깼는데요~ 도산점을 돌려내라.... 돌려내라... 진짜 기영이 할머니처럼 맨날 매뉴팩트 도산점 추억하잖아... 매뉴팩트커피 서울특별시 서대문구 연희로11길 29
[연희동] 매뉴팩트커피,알 수 없는 날씨 속 두영과 연희동 투어 🫧 50m © NAVER Corp. 매뉴팩트커피 서울특별시 서대문구 연희로11길 29 궁금했던 곳에 왔다 코르타도 꽃 선물 고맙습니다 🌸 #리따플라워 혼자 또 오고 싶은 곳 두영을 떠올리면 같이 따라오는 연희동에서 졸업 기념 사진 찍기 📸 떠올리면 늘 기분 좋은 곳 #리따플라워 !! 50m © NAVER Corp. 유어마인드 서울특별시 서대문구 연희로11라길 10-6 2층 우측 커피조아인간 오늘 간 곳 방가방가 하이보루 구다사이 궁금했던 책들 요기 맛있다고 했다 끝
연희동 - 매뉴팩트커피 / 연희동커피 / 연희동원두,"이미 유명한 곳 .. 소소 원래는 엄마의 에브리띵 셔틀을 갔다가 집에 마침 원두도 다 떨어져서 아차! 하고 간 곳 ㅎㅎ 여기는 뭐 완전 연희동 포토스팟이도라 .. 영업시간 / 평일, 토요일 9:00 ~ 18:00 일요일휴무 계단따라 쭉 올라가면 쨔라란 ~ 전에도 자리가 매우 좁아서 거의 뭐 테이크아웃 전문점이었는데 지금은 완전 ... ㅎㅎㅎ 여건 메뉴판 ! 그리고 여기는 쭉 원두들 ~ 어떤 걸 사야할지 몰라서 물어보니 하나하나 친절하게 설명해 주셨다 ㅎㅎ 그래서 고른 ! 저 빨간아이! 아! 원두를 사면 메뉴판에서 원하는 커피도 한잔 서비스로 주는데 ... 이 날 가고 다음에 갔을 땐 텀블러를 챙겨왔다 ㅠ 이 날 완전 길에서 호로록 마신 .. 다덜 저처럼 뚜벅이는 원두 구매할 때 텀블러 필수..! 옆쪽에 다른 원두들도 있고 드립백도 따로 판매하고 있다 ~ 아! 그리고 이 날은 어디에 사용하냐 물어보시고 거기에 맞게 직원분이 알아서 갈아주셔서 물어보고 갈아주나 보다 했는데 다음에 갔을 땐 ... 그냥 주시길래 미리 갈아둔거 주시는건가? 했더니 ... 원두 그대로 주신 ㅠㅠㅠㅠ 그래서 따로 갈았다 ... 갈아달라고 꼭 말하세오... 그리고 몇 달 마시다가 결국 커피머신을 샀다는 .. 기다리는데 커피향이 가득해서 너무 좋았던 .. 그리고 구경하고 있으니 쨘 나왔곰 ! 히히 좋아랑 그리고 에브리띵까지 들려서 가득 사고 왔다 ! 정말 그냥 가는 법이 없다 ㅎㅎㅎㅎ #연희동 #연희동카페 #연희동원두 #연희동원두카페 #연희동데이트 #연희동맛집 #연희동에브리띵베이글 #서울카페 #서울원두카페 #매뉴팩트커피 매뉴팩트커피 서울특별시 서대문구 연희동 130-2 에브리띵베이글 서울특별시 서대문구 연희동 130-2 1층 에브리띵베이글"
연희동 플랫화이트 맛있는 카페 | 매뉴팩트커피 로스터즈 MANUFACT COFFEE ROASTERS,안녕하세요 여기 마음에 드는 곳 방문기 연희동에 플랫화이트 맛있는 카페 소개해드려요 연희동 플랫화이트 맛집 : 매뉴팩트커피 연희동 카페를 찾다가 성수와 힙지로 느낌이 가득한 카페를 만났어요 입구부터 범상치 않은 너낌쓰 자리가 워낙 협소해서 웨이팅이 있었고 내부에 기다릴 공간이 마땅치 않아서 문 밖에서 기다리는 동안 찍은 사진이예요 이게 참 뭐라고 갬성 뿜뿜✨ 내부가 크진 않지만 직접 커피콩을 로스터리 하는 곳 답게 곳곳에 관련된 아이템들이 진열돼있었어요 콜드브루 원액과 커피콩도 판매하시고 커피가 맛있어서 그런지 테이크아웃으로 커피만 가져가시는 분들도 꽤나 많았습니다! 아이스 아메리카노와 플랫화이트를 주문했어요 아이스 아메리카노는 미듐 정도의 무게에 적당한 산미가 느껴지는 커피입니다 플랫화이트 역시 아이스로 시켰는데요 엄청 꼬수운 타입보다는 커피 맛이 잘 느껴지는 타입이었어요 산미도 살짝 있어서 균형감있게 마시기 좋았습니다 드립으로 내려주시는 모습을 보기만해도 기분은 충분히 좋아집니다☺️ 매뉴팩트커피 서울특별시 서대문구 연희로11길 29 #내돈내산 #매뉴팩트 #플랫화이트맛집 #연희동카페
"꼬숩- 꼬숩- 플랫화이트가 맛있는 연희동 카페, 매뉴팩트커피","연차로 아주 씬났던 금요일! 연희동에 플랫화이트가 아주 꼬수우니 맛나다는 그 유명한 매뉴팩트커피에 다녀왔다! 달지 않고 적당한 쓴맛과 꼬-소한 맛이 담긴 라떼를 굉장히 좋아하는 나에게는 기대 뿜뿜 되는 카페였다😌 매뉴팩트커피 서울 서대문구 연희로11길 29 다들 입구 사진을 많이 찍으니까 나도 한 장! 사진 찍을 때마다 차들이 자꼬 지나가서 쪼꼼 위험, 불편했따🥲 그치만 맘에 드는 사진이 나올 때까지 찰칵 찰칵! 내가 이렇게 사진에 열정적이였던가....허허허 두근 두근 이제 카페가 위치한 2층으로 올라가 봅니다 내부에 좌석은 총 8개로 카페가 생각보다 넓지 않아서 처음 들어갔을 때 조금 웨이팅이 있었다! 아니 얼마나 맛나길래 금요일 낮 시간대에 사람이 꽉 찬거지! 여기를 둘러봐도 저기를 둘러봐도 온통 다 매뉴팩트 아이템들이다! 커피에 대한 자부심 멋있따... 저 뒤에서는 더치커피들이 똑-똑-똑 -떨어지고 있다☕️ 커피 찐 맛집이라 그런가 더치커피 보틀로 사가시는 분들이 많았다! 다들 필수로 한 병씩 사가시는 듯하다 나도 다음에 사보까... 햇빛이 예쁘게 들어오는 자리☀️ 드디어 그 유명한 플랫화이트를 만났따!!!!! 커피 맛이 찐-하고 꼬-숩고 뭔지 모르게 달달했다! 시럽이 전혀 들어가지 않았을텐데 달달했따... 너무 맛있어서 달게 느껴졌나.. 양이 그리 많지 않아 금방 호루룩 다 마셔버렸다... 다음엔 1인 2잔 시켜야 할 거 같다🥺 그럼 잠 못 자려나..허허 😆 나중에 연희동에 가게 되면 무조건 생각날 거 같은 카페! 다음엔 두우잔 마시러 가겠어요! ☕️☕️ 매뉴팩트커피 서울특별시 서대문구 연희로11길 29"
[매뉴팩트커피] 콜드브루가 맛있는 연희동 매뉴팩트 커피의 디카페인 과테말라,"매뉴팩트 커피 콜드브루 과테말라 디카페인 Manufact coffee Guatemala Decaf ※ 이번 리뷰는 현장에서 구매한 것이 아닌 매뉴팩트 커피 홈페이지에서 주문했음을 미리 알려드립니다. 연희동에서 콜드브루가 맛있기로 유명한 <매뉴팩트커피>! 최근 내게 있었던 가장 큰 변화는 카페인 섭취량이다. 주말에 커피를 마시지 않거나 오전 중으로 커피를 안마시면 두통이 와서 극단적으로 카페인을 줄였다. 처음 며칠은 좀 힘들어서 진통제의 힘을 빌렸는데 지금은 디카페인 커피로 잘 지내는 중이다. 매번 스타벅스나 이디야에서 디카페인 사마시는건 좀 돈이 아까워서 콜드브루 원액이나 디카페인 원두를 찾던 중 매뉴팩트커피를 발견했다! 매뉴팩트 커피 공식 홈페이지는 아래에! https://manufactcoffee.com/ Manufact Coffee Roasters https://www.instagram.com/manufactcoffee/ manufactcoffee.com 원두의 종류가 많아서 순간적으로 모두 맛보고 싶었지만 디카페인을 주로 마시기로 결심한 이상 참아야했다ㅠ 맛있어보이는게 많던데ㅠㅠ 여기에서 선택 가능한 디카페인 선택지는 콜롬비아, 과테말라 두 가지다. 그리고 디카페인 콜롬비아 콜드브루가 계속 품절상태이기 때문에 과테말라를 선택할 수 밖에 없었다. 콜드드루 과테말라 디카페인 Guatemala Decaf 가격 1,5000원 최근 얼음 트레이에 얼려서 활용 중 10일 넘었지만 아직 한통을 다 못마셔서 1잔당 1500원 안되는 가성비를 보여주고 있다. 참고로 유통기한은 제조일로부터 3개월이다. 원두 정보는 아래와 같다 (출처 : 매뉴팩트커피 공식 홈페이지) Origin : Guatemala Cup note : Toast, Walnut, Brown Sugar, Dark Chocolate, Smoky Information : Antigua / Arabica / Caturra, Bourbon / Natural CO2 Processing / 저온 자외선 살균 과테말라 원두가 원래 약간 산미가 있다보니 맛있겠다고 생각했는데...(개인적으로 약간의 산미가 가미된 원두를 좋아함) 컵노트를 보니 여기서 로스팅을 할 때 산미가 많이 사라지는 것 같다. Natural CO2 Processing 이건 카페인 추출 방식을 의미한다. 매뉴팩트커피의 과테말라 콜드브루는 고소한 맛이 있고 산미는 없다! 스모키하면서 고소한 맛을 찾는 사람에게 추천하고 싶은 맛이다. 적당히 원하는 만큼 넣으면 된다. 설명서에는 물과 콜드브루 원액 1:1의 비율을 추천하고 있지만, 나는 그냥 내맘대로 마신다. 1:1 비율은 진할 것 같고... 디카페인이라도 카페인이 없는건 아니라서 조심하고 있다. 다 좋은데 카페인 함량에 대한 정보는 없어서 이 부분은 좀 아쉽다. (스타벅스 톨사이즈 디카페인 아메리카노의 경우, 5-10mg의 카페인 함량) 매뉴팩트 커피의 과테말라 콜드브루가 괜찮아서 콜롬비아 콜드브루도 맛보고 싶은데 대체 언제 입고되는건지ㅠㅠ 아무튼 내돈내산 디카페인 커피 추천 후기 끝!"
