title,content
[연희동 카페] 매뉴팩트커피 연희동 커피맛집 연희동데이트 필수코스!,"매뉴팩트커피 연희점 서울 서대문구 연희로 11길 29 월~토 : 9:00~ 18:00(일요일 휴무) 02-6406-8777 커피 러버 욜릭은 매뉴팩트커피를 애정 합니다❤️♥️ 몇 년간 다닌 매뉴팩트 나만 알고 싶은 매뉴팩트지만 소개해들려요 ☕️ 매뉴팩트커피 연희동에 가면 항상 가는 코스가 정해져 있어요 연희동 칼국수 갔다가 사라가마트 구경 후 매뉴팩트커피 이날도 마지막 코스인 매뉴팩트로 고고 여기가 카페야?라고 할 정도로 두 눈 크게 뜨고 잘 보세요 안 그럼 지나쳐요 ㅎㅎㅎ 항상 여기 계단 오를 때마다 뛰어올라가요 자리 있나 없나 확인하러 ㅎㅎ 이날은 평일에 가서 그나마 웨이팅 없이 바로 들어갔네요 🤣👏👏 매장 한가운데에 긴 테이블이 있는데 6명 앉을 수 있고 벽면에 있는 바 테이블은 4명 또 저랑 동생이 앉은 창문 쪽 작은 테이블에 2명 총 12명 앉을 수 있어요 협소하긴 하죠?? 그래도 찾아오는덴 이유가 있겠죠?? 😘 저는 항상 드립 커피를 사 마시는데 젤 좋아하던 카키스원두가 이젠 영원히 안 나와서 비슷한 계열로 항상 구매해요 다시 카키스원두 부활시켜주세요 😭 드립 백, 원두, 콜드브루 원두랑 똑같은 콜드브루도 있어서 가끔 사 마시는데 넘 맛있어요 ㅎㅎ 매뉴팩트 커피는 원두 구매하면 커피 한 잔을 무료로 받을 수 있는데 이날 저희는 구매한 원두랑 똑같은 커피로 한 잔 마시고 나왔어요 👏 커피 좋아하시는 맛잘알 이웃님들은 이미 #매뉴팩트커피 많이들 아시겠지만 그래도 #연희동 들리시면 #사러가마트 만 가지 마시고 매뉴팩트커피 한 번 들러보세요 저희처럼 이렇게 원두도 구매해서 집에서 홈 카페 구현함 해보시길 바라며 욜릭은 이만 총총총 #내돈내산 커피 맛집 리뷰 끝🤗"
연희동 커피맛집 매뉴팩트커피,"안녕하세요 🧘🏻‍♀️💖 비도 내리고 날씨가 제법 시원해졌어요 오늘은 서대문구 연희동 라떼맛집, 매뉴팩트커피 리뷰를 가져왔습니다! 영업시간 월 - 토요일 09:00am - 18:00pm (매주 일요일 정기휴무) 오시는 길 매뉴팩트커피 서울특별시 서대문구 연희로11길 29 사러가 서울특별시 서대문구 연희맛로 23 사러가 🚖🚖🚖 주차는 연희동 사러가마트 주차장(iparking지원)을 이용해주세요 위 지도를 보시다시피, 연희동 매뉴팩트와는 도보로 1분 남짓한 거리고 주차비용은 아래와 같아요👇🏻 사러가마트 주차장 주차비용 무료 주차시간 30분 1만원 이상 구매시 - 무료 주차시간 1시간 3만원 이상 구매시 - 무료 주차시간 1시간 30분 5만원 이상 구매시 23년 3월 7일부로 사러가마트 주차장 무료 주차 요금이 변경되어 슈퍼마켓, 임대 합산해 최대 1시간 30분까지 지원 주차 요금 변경 전과 후에 대한 차이는 아래의 첨부된 사진을 확인해주세요 😋 그럼 주차도 했겠다~~ 연희동 인생커피 라떼맛집 매뉴팩트커피로 가볼까요? 1분도 안 걸었는데 익숙한 외관이 보여요‼️ 매뉴팩트커피만의 감성이 느껴지는 나무 입간판(a.k.a. 카페 베뉴) 🥰 2층에 매장이 있어 옛스러운 계단을 밟으며 올라가봅니다 사장님의 센스가 느껴지는 조명등과 함께 무심한듯 세워져있는 나무 판넬☝🏻 인테리어 소품겸 복도에 툭 놔두셨더라구요 괜히 더 멋스러운 것 있죠! 참신해서 보고 또 보았던... 캔버스에다 매뉴팩트 로고를 찍어냈더라구요 저걸 조명등에는 어떻게 붙여놓았을까요🤔🤔 매장에 들어서자마자 보이는 렉 선반 위에는, 매뉴팩트만의 굿즈들과 원두가 자리잡고 있어요! 바로 옆이 계산더라구요 🏄🏻‍♀️ 협소한듯 하지만 아늑한 이 느낌 🫢 빽빽하게 다양한 소품과 사장님의 취향이 묻어나있어요 📸 똑같은 뷰 더 크게 한 장 더 찰칵 이 외 입구쪽 창가에도 자리가 있는데 너무 비좁긴해요 👍🏻👍🏻👍🏻 그렇지만 매뉴팩트 커피는 역시, 커피맛으로 오는거죠? 또 다른 선반의 모습 ☝🏻 굿즈와 원두들을 올려 전시해놓은 선반 뒤로 오픈된 작은 공간이 있는데요 커피를 아주 전문적으로 사랑하시는 사장님(추정🤔)의 공간으로 사용되는 것 같았어요 직접 세심하게 커피를 내리시며 커피향을 맡으시는 모습입니다👍🏻👍🏻 계산대 위에는 이렇게 MANUFACT가 적혀있고 조각 파운드 케이크 사진도 있었어요 다음엔 매장에서 꼭 먹어봐야겠네요 🍰💖 무화과 파운드 케이크 4,000원 치즈 파운드 케이크 4,000원 핸드드립, 에스프레소, 콜드브루 별로 다양한 커피 종류가 준비되어 있습니다 ☕️☕️☕️ 매뉴팩트커피는 원두를 구매하시면 아메리카노 한 잔을 서비스로 제공한다고 해요 아마 콜드브루를 준비 중이신 종업원분의 모습 커피에 대한 진심이 느껴지는 곳이죠? 매장을 둘러보며 제 커피를 기다립니다💖 연희동 매뉴팩트커피는 애견동반이 안되긴 하지만 테이크아웃시 댕댕이와 잠깐 들어왔다가 바로 나가는 건 괜찮은 것 같아요 짜잔- 드디어 나온 연희동 매뉴팩트커피만의 아이스라떼입니다 맛이야 말해 모해모해 정말 최고입니다! 라떼 5,000원 플랫화이트도 라떼와 가격이 동일하던데 다음에 파운드 케이크와 함께 도전해보려구요! 테이크아웃 커피를 들고 가파른 계단을 내려가는 길- 이상으로 인생라떼 혹은 인생커피집 신촌 연희동 매뉴팩트커피였습니다 🌟🌟🌟🌟🌟 별점 5점 만점에 다소 협소한 공간으로 인해 4.5점을 주면서 긴 글 마치도록 할게요 모두 멋진 하루, 잘 마무리하셔요 🏄🏻‍♀️🏄🏻‍♀️"
연희동 매뉴팩트커피 manufact coffee,안녕하세요~ 수완지구 서울우리아이치과 조원빈 대표원장입니다 지난번에 서울에 세미나 일정이 있어서 신촌을 갈 일이 있었어요 지인에게 추천을 받아서 다녀온 연희동 매뉴팩트커피 소개합니다❤️ 매뉴팩트커피 서울특별시 서대문구 연희로11길 29 운영시간: 월~토 9:00 - 18:00 일요일 휴무 맛있는 커피 마시는 것을 정말 좋아하는 것을 넘어 사랑하는데요🥰 그래서 연희동 매뉴팩트 커피에 들어서자 마자 너무 설렜답니다 향긋한 원두향이 가득한 이 공간. 매뉴팩트커피는 드립커피가 유명한데요. 콜드브루 (4.0~5.5) 에스프레소종류 (4.0~5.0) 핸드드립 (5.0) 원두는 로스팅한 날짜가 적혀있구요 원두 구매시 커피한잔 서비스 증정 이러면 원두를 구매하지 않을 수 없겠죠❤️ 보기만 해도 힐링이 되는 장면입니다.. 콜드브루는 이렇게 병에 담아서 나오네요 핸드드립은 매뉴팩트에 가시면 꼭 맛보세요 강추입니다 마치 찰리와 초콜릿 공장 영화가 생각나는 연희동 매뉴팩트 커피입니다 원두 종류에 따라 커피의 맛이 꽤 다르더라구요 그동안은 스타벅스 원두만 익숙해져서 그랬는지 몰랐는데요 매뉴팩트커피에 가시면 원두 종류도 이것저것 물어봐 가면서 못마셔본 원두에 도전하시는 것도 추천합니다 #매뉴팩트커피 #연희동매뉴팩트 #manufactcoffee #연희동카페
서울 연희동 카페 : 매뉴팩트커피(manufact coffee),"예전부터 가고 싶어서 저장해둔 연희동 메뉴팩트커피 ! 카페 입구에서 찍은 사진이 쇼핑몰이나, 인플루언서 인스타 피드에서 자주 봤었어요 :) 저는 연희동에 자주 가는 편인데 이상하게 갈 때마다 초저녁쯤 가서 커피 마시기엔 애매해서 못 갔는데 이번엔 주말 4시쯤 방문했습니다ㅎㅎ 주소📍 서울 서대문구 연희로11길 29 영업시간⏰ 월-토 09:00-18:00 (매주 일요일 휴무) 전화번호📞 02-6406-8777 주차장 없음 매뉴팩트커피 서울특별시 서대문구 연희로11길 29 만석이여서 대기를 했습니다! 따로 종이에 기입하거나, 테이블링이 없어서 입구에서 기다렸어야 했어요! 대기하는 입구가.. 통유리라서 안쪽이 훤히 보이는데 요건 살짝 카페를 즐기고 있는 손님들도, 대기 손님도 서로 뻘쭘하더라고요? 빨리 나오라는 압박감 주기....?ㅋㅋㅋㅋㅋ.. 창틀도 테이블로 만들어버리는 힙함,, 이 자리는 디저트는 못먹겠는걸료? 센치하게,, 커피만 호다닥 마시고 빠져야겠어요 가게 내부가 상당히 협소한 편으로 자리가 몇 개 없어요ㅜㅜ 한 10명 정도 들어갈 수 있는? 저는 6명 정도 앉을 수 있는 긴 테이블, 빈티지 무드의 의자가 있는 자리에 앉았어요ㅎㅎ 매뉴팩트커피 메뉴 커피 메뉴로는 콜드브루, 핸드드립, 에스프레소 베이스인 기본 종류가 준비되어 있고 디카페인으로 변경 시 +1000원 디저트 메뉴로는 브라우니, 무화과 파운드 케이크 두가지 뿐! 전 디저트를 너무 좋아하지만 여긴 커피 맛집이라 커피만 마시러 오기에 충분합니다🫶🏻 카운터에서 결제 후 자리로 가져다 주십니다 :) 매뉴팩트커피의 굿즈도 팔고 원두, 드립백, 콜드브루도 팔고 있어요☕️ 커피를 마실 수 있는 공간 바로 옆 커피를 만드는 공간이 있어요! 이 좁은 공간에 바리스타분들이 바글바글 꽉 채워져여! 주문이 들어오면 각자 할 일을 하는데 손발 척척,,~! 동시에 커피 향이 카페에 싹 퍼지는데 넘 좋아요ㅠㅠ 입구쪽에는 테이크아웃 손님과 취향껏 먹으라는 느낌인 홀더, 빨대, 설탕, 시럽등이 준비되어 있네요!! 브라우니 4.000 브라우니 맛은 굉장히 평범한 편! 담에 간다면 굳이 시키지는 않을 고 같아여 ㅎㅎ,, 플랫화이트 아이스 5.000 매뉴팩트커피 시그니처인 플랫화이트!! 안에 들어간 우유는 딱 서울우유맛 났어요ㅋㅋㅋㅋㅋㅋ 근데 맛있어ㅠㅠㅠㅠ 컵도 이쁘고 커피 떼깔이 너무 좋자냐,, 커피 맛이 너무 꼬숩고 플랫화이트가 웬만하면 마시면서 쓴맛이 나기 마련인데 끝까지 단맛과 향이 유지됐어요!! 그냥 커피가 짱 맛있음ㅠㅠ 콜드브루 카멜리아 였나,, 이것도 향이 좋고 깔끔하고 너~무 맛있었는데 기억이 안나네요ㅠㅠ 모두가 찍는다는 카페 입구에서 사진 찍고 마무리!! 연희동 오는 친구들 다 데꼬 가고 싶은 커피 맛✨"
[매뉴팩트커피(Manufact Coffee)/연희동] 아늑한 공간에서 즐기는 맛있는 커피,"연희동에는 맛있는 커피를 파는 보석 같은 카페들이 참 많습니다. 그 중 가장 좋아하는 공간인 매뉴팩트 커피. 꽤 오래된 건물 2층에 위치한 매뉴팩트커피. 간판도 느낌있게 잘 만들었네요. 작고 아담한 공간. 바리스타분들이 바로 앞에서 커피를 내려주시는 풍경. 문을 열고 들어서면 커피 향이 기분좋게 코를 자극합니다. 자리는 이 넓은 탁자와 바리스타 앞에 카운터석, 창가에 2인석이 전부. 조금 기다려서 받은 라떼와 아메리카노. 개인적으로 이 곳에서 가장 좋아하는 메뉴는 이 라떼입니다. 빛깔처럼 맛도 좋은 라떼. 진한 커피에 고소한 우유의 맛이 잘 어우러진, 밸런스가 좋은 라떼. 두 잔다 깨끗이 비웠습니다. 디저트가 없어서 커피와 곁들어 먹는 것을 좋아하는 분들은 아쉽겠지만, 그만큼 커피에 집중하고 있는 곳이기에 맛이 보장되는 곳입니다. 연희동에 훌륭한 카페들이 참 많지만, 개인적으로 하나 골라보라면 이 곳을 택할 것 같네요. 매뉴팩트커피 서울특별시 서대문구 연희로11길 29 #매뉴팩트커피 #manufactcoffee #연희동카페 #연희동맛집 #연희동커피 #라떼"
연희동 매뉴팩트커피,"언니랑 데이트하고 언니가 가보고 싶다던 카페가 근처에 있다길래 바로 ㄱ 연남동에서 꽤 걸어서 도착! 매뉴팩트커피 서울특별시 서대문구 연희로11길 29 나중에 다시 역 갈 때 버스 타고 갔다ㅎ 1층엔 유명한 에브리띵 베이글 집이 있고 2층에 매뉴팩트커피가 위치해있다 당연 베이글 집도 방문했음ㅋ 1층에 메뉴팩트커피 입간판이 있고 살짝 가파른 계단을 타고 2층으로 가면 된다 매뉴팩트커피 전화번호 : 02-6406-8777 영업시간 : 9:00 ~ 18:00 매주 일요일 정기휴무 2층에 도착하면 은은한 안내판이 맞이한다 옆에 문 있으니 열고 들어가면 됨ㅎ 비 오는 날엔 밖에 우산 통이 있어서 거기에 우산 꽂아두고 들어가면 된다 카운터가 굉장히 작다 그냥 매장이 전체적으로 작아서 앉을 수 있는 공간이 별로 없다 거의다 테이크아웃해감 (텀블러 주면 텀블러에 내려주신다) 우리가 도착했을 때도 2자리 남아서 겨우 앉았다ㅎ 쉐어용 큰 테이블이 하나 있고 (5~6명 정도 앉을 수 있음) 벽에 바자리 (3~4명?) 창문에 2명 자리가 있다 근데 공간이 좁아서 지나다닐 때 좀 불편함 커피가 주력인 만큼 다 커피 메뉴이다 라떼종류가 잘 나간다고 해서 카페라떼, 플랫 화이트 따뜻한 걸로 주문 원래 아이스파인데 이날 비 와서 춥고, 이젠 나이가 드니 추운 날은 따뜻한 게 땡기네요^^ 커피로 유명한 만큼 커피용품들을 파는데 드리퍼랑 여과지 등등을 판다 아 그리고 매뉴팩트 굿즈도 파는데 티셔츠랑 컵 쏘큐트 콜드브루도 유명한지 사람들 많이 사간다 메뉴팩트 커피 제조 시설? 이 꽤나 큰 편이다 벽에도 저렇게 되어있어서 뭔가 신기 여기가 매뉴팩트 커피 만들어주시는 공간인데 큰 테이블에서 드립 맨 안쪽에서 라떼나 에스프레소 등을 만들어준다 옆에서 바로 구경할 수 있어서 나름 재미가 쏠쏠 언니 라떼 만드시는 중 왼쪽이 라떼고 오른쪽이 플랫 화이트 매뉴팩트커피 커피 맛있다 약간 고농축된 카페인 맛 갠적으로 앤트러사이트가 더 취향이긴 하지만 산미 있는 커피 좋아함^^ 연희동 오면 자주 들릴 거 같다 아이스 내리는 거 신기해서 찍어봤다 저렇게 내리는 건 처음 봄"
"연희/망원 나들이 :: 연희동 브런치 (에브리띵 베이글, 매뉴팩트커피), 망원동 먹부림 (유부, 히트커피, 소금집) + 테틈카페","연희/망원 나들이 :: 연희동 브런치 (에브리띵 베이글, 매뉴팩트커피), 망원동 먹부림 (유부, 히트커피,소금집) #연희동 #연희 #연희브런치 #에브리띵베이글 #서울나들이 #연희나들이 #망원나들이 #연희매뉴팩트 #매뉴팩트커피 #망원동 #망원 #망원맛집 #망원유부 #유부 #유부초밥 #소금집 #히트커피 #히트 #딸기케이크 연희, 망원 나들이 기록! 기분 좋게 꽃 사들고 라랄라 서울역 도착! 이 날은 벼르고 벼르던 에브리띵 베이글을 가기 위해 연희동으로 슝슝 이동!!! 에브리띵 베이글은 에브리띵베이글 서울특별시 서대문구 연희로11길 29 1층 에브리띵베이글 연희동 안쪽에 위치해 있는데 내가 여기 오는 이유는 다른 베이글도 물론 맛있지만 CREAM CHEESE & LOX 를 먹기 위함이다...!! 쪽파크림치즈랑, 숙성연어가 들어가는데 그 조합이 진짜 미친다 ㅠㅠㅠㅠ 넘 맛있음....... 베이글 종류도 엄청 많고 크림치즈도 엄청 많은 에브리띵 베이글! 아침 8시에 열어서 오후 6시면 닫아버리는데 그 마저도 다 팔리면 닫아버리기 때문에 일찍 가는 것을 추천한다! 일월은 또 휴무니까 참고하길! 이게 바로 LOX....!! 쥰맛탱...... 얼핏보면 저 구분되지 않는 토마토와 연어.. 그리고 적양파... 쪽파크림치즈의 조합 엄청나..... 또 먹고싶다 ㅠㅠㅠ 베이글은 양파 베이글 골랐는데 크리스피하게 튀긴? 양파가 씹혀서 맛있었다 ㅠㅠㅠ 그리고 꿀팁을 드리자면 에브리띵 베이글 바로 윗층에 매뉴팩트커피라고 커피 맛집이 있으니 밑에서 베이글 사고 윗층에서 커피 사가지고 근처에 궁뜰공원가서 쩝쩝박사 하는 것을 추천.... 핸드드립, 더치커피 등등 모든 커피가 아주 딥하고 맛있으니 아주 꿀조합이다.... 영롱하다 영롱해.... 여기도 6시까지 밖에 영업안하고 매주 일요일 휴무니까 참고! 베이글 먹고서 연희동 거닐다가 들르게 된 가든어스 플랜트 라이브러리! 난 식물계의 마이더스 손으로... 모든 식물이 3개월을 버티지 못함으로 윈도우쇼핑만 잔뜩 하고 나왔지만 언젠가 햇볕좋은 집에서 살게 된다면 꼭 식물들을 키우고 싶다! 여기 오니까 더 욕망이 커짐.... 안에 직원분들도 엄청 친절하시니 연희동에 왔다면 한번 쯤 들러보시는 걸 추천드린다! 가든어스 연희대공원점 서울특별시 서대문구 연희로11가길 42 연희대공원 1층 베이글 하나가지고 나눠 먹은 것이라서 본편 찍으러 망원동에 있는 < 유부 >로 고고고 유부 서울특별시 마포구 동교로 277 1층 연희에서 망원으로 넘어가는 길에 있어서 딱 좋았던 유부! 여기도 키오스크 주문이었다 여기저기 키오스크 주문이 너무나 당연해지고 있는 이 시대.... 과거에 비해 너무나 최첨단이잖아.. 메뉴는 계속 바뀌는 것 같았다! 우리는 치즈닭갈비, 게딱지장, 한우육회, 명란로제 이렇게 4가지 시키고 맥주를 시켰다! 맥주 빠질 수 없지.... 원래 술 안좋아하는데 요즘 자꾸 술 먹다보니까 이제 맥주가 땡기기 시작한 나... 이렇게 술에 중독이 되어가는 건가 ^.^... 이 글을 쓰면서도 뭔가 호가든 로제가 먹고 싶은 나... 각설하고 유부가 나왔다! 일단 무조건 시켜야하는 메뉴는 게딱지장..... 너무 맛있어...... 육회도 맛있긴 했는데 개인적으로 취향은 게딱지장 > 치즈닭갈비 > 육회 > 명란로제 였다! 명란로제는 넘 리조또같아서 맛있긴 한데 유부초밥으로 또 먹고 싶진 않은 느낌?! 로제보다 명란 느낌이 더 나면 좋을 거 같았다. 다른건 다 굿굿이었음 ㅎㅎ 이렇게 배부르게 먹고 밖으로 나와서 테틈카페에 가고 싶어서 갔는데... 카페테틈 서울특별시 마포구 동교로36길 15 1-2층 역시나 졸귀탱!!!!! 귀!여!워!!!!! 헤헤 귀엽다... 아주 귀여워.... 1층은 굿즈샵이고 2층은 카페인데 아쉽게도 카페는 만석이라 가지못하고 굿즈샵만 구경할 수 있었다 ㅠㅠㅠ 그래도 귀여운 녀석들 찍어오기... 컵 너무 귀엽자나... 갖고싶잖아.... 케이스도 토마토 케이스 너무 귀여워ㅠㅠㅠㅠㅠㅠ 아쉬운 대로 카운터라도 찍어오기... 지름신을 막으며 스티커 몇장만 구매했다... 아쉬운 마음에 사진이라도 남기기.. 다음엔 꼭 널 즐기고 오겠어 테틈...! ( 이미 충분히 즐긴 것 같지만... ) 그리고 야식으로 먹을 잠봉뵈르 사러 망원에 있는 소금집 들르기 다들 잠봉뵈르 안먹어 봤으면 꼭 소금집으로 입문하세요!!!!!! 강 조!!!! 소금집 잠봉뵈르가 짱이다 꼭 머릿속에 새겨놓길..... 버터가 진짜 맛있다구요... 꼭 먹어.. 두번 먹어... 소금집델리 망원 서울특별시 마포구 월드컵로19길 14 2층 위치는 요기..... 사진은 없지만 꼭 먹길..... 꼭 들러주길... 무슨 망원가서는 먹부림만 했던 거 같은데...? 이 다음 기록이 망원 카페 히트커피인게 맞나...? 아무튼! 천안 신방동에도 있는 히트커피가 서울 망원동에도 생겼는데 사실 난 천안에선 안가보고 서울에서 처음 가봤다 ㅋㅋㅋㅋㅋ 일단 딸기 케이크 비쥬얼로 시작.... 나는 이걸 먹으러 히트커피에 왔다 ^_^ 딸기 너무너무너무 맛있어.... 딸기철에 꼭 다시 와야지....!!!! 거의 끝물이었는데도 딸기가 이렇게 맛있었는데 완전 철에 먹으면 얼마나 맛있을까....... 빵보다 딸기 비중이 높아서 거의 딸기에다가 케이크를 곁들인.... 그래서 한입 먹으면 케이크가 와르르 무너진닼ㅋㅋㅋㅋ 근데 너무 맛있어... 딸기에 무슨짓을 한게 분명해.... 히트 케이크 사진을 마지막으로 하여튼 연희동이랑 망원동가서 열심히 나들이를 빙자한 먹부림을 하고 온 일상 기록 끗.....!!"
"[카페일기] 매뉴팩트커피_연희동 카페_라떼, 플랫 화이트 맛집_콜드브루 맛집","오늘의 카페일기는 매뉴팩트 커피입니다! 몇달 전부터 엄마가 정말로 궁금해하던 카페가 있어서 평일에 방문해 봤어요. 매뉴팩트커피 서울특별시 서대문구 연희로11길 29 주말에는 당연하게 웨이팅이 있다고 해서 평일 점심 시간 쯤에 갔어요. 평일인데도 테이크 아웃하는 분들이 앞에 많이 서 계셨고 다행이 저희가 들어갔을 때는 벽 쪽으로 자리가 있어서 바로 앉았어요!! 자리를 잡고 주문을 하러 갔어요. 매뉴는 모두 커피 종류였고 생각보다 너무 다양해서 고르기 어려웠어요. 엄마는 플랫 화이트, 저는 라떼를 주문했어요. 엄마가 디카페인 원두를 구매한다고 하셔서 커피 한잔은 그냥 주셨고 제 커피와 원두 값만 결제 했어요! 결제를 하고 자리에 앉아서 기다리면서 가게 내부를 구경했어요. 내부에 다른 손님들이 많아서 따로 자리는 못 찍었어요. 가운데 큰 테이블이 있고 벽쪽이나 창쪽에 바 테이블 같이 앉을 수 있는 곳들이 있었어요. 그리고 한쪽에서는 커피 머신기가 위치해 있어서 커피를 직접 내리시고 음료를 만드는 모습을 볼 수 있었어요. 자리를 잡고 기다린지 얼마 되지 않아서 직접 가져다 주셨어요. 라떼가 나온 후 섞이지 않게 한 뒤 먼저 커피를 한잔 마셔봤어요. 커피가 많이 시지 않고 맛있어서 놀랐어요. 커피를 좋아하시는 엄마도 만족하셨어요! 바로 섞어서 먹어보니 적당히 고소하고 커피와 우유가 잘 어울리는 느낌이여서 맛있었어요!!! 제가 먹어봤던 라떼들 중에 탑에 드는 거 같아요~~ 곧바로 나온 플랫화이트! 원래는 제가 플랫 화이트를 즐겨 마시곤 했는데 그걸 자주 빼서 먹던 엄마가 요즘은 플랫화이트를 더 자주 드시더라고요. 플랫화이트는 라떼보다 더 원두의 고소한 맛이 강하게 느껴졌어요! 가끔 플랫화이트를 먹다보면 원두와 우유가 따로 노는 느낌이 들곤하는데 여긴 전혀 그렇지 않았어요. 라떼와 플랫 화이트를 비교하자면 저는 개인적으로 라떼가 더 맛있었어요! 음료를 다 마시고 콜드브루도 궁금했는데 병으로 콜드브루를 판매하고 있어서 저희가 마신 음료에 들어간 원두로 만든 콜드브루도 구매해왔어요! 콜드브루는 메뉴에도 있고 냉장고 쇼케이스가 있는데 그쪽에서 보고 직접 꺼내서 계산하면 되더라고요! 디카페인을 구매하고 싶었는데 그날은 떨어졌다고 하더라고요.... 다음에 디카페인 콜드브루 사러 와야지.... 집에 가서 엄마가 콜드브루를 먹고 후기를 알려주셨는데 우유랑 섞어 먹어도 맛있고 그냥 얼음과 물을 섞어서 먹어도 너무 맛있다고 재구매 의사 완전 있다고 합니다!! 가기 전에 리뷰를 보다뵌 가게 직원분들의 불친절 글이 종종 보였었는데 전 그런 느낌 전혀 못 받았어요. 직원분들께 물어보면 자세히 설명해주시고 친절했어요! 가게 자체가 넓은 편은 아니다보니 주말에는 테이크아웃을 하거나 평일에 방문하는 걸 추천합니다! 시간에 따라 다를 수 있지만, 평일은 대기가 오래 걸리는 편은 아닌 거 같아요!! 오늘의 리뷰는 여기까지! 오늘도 끝까지 읽어주셔서 감사합니다."
