title,content
연희동 카페 매뉴팩트커피,"매뉴팩트커피 녹아내릴 듯 더웠던 어느 날. 가 봐야지, 가 봐야지 생각만 하던 연희동 카페를 찾았다. 연남동이랑 그리 멀지 않은데 한 번 도 가보지 못했던 동네인데 동생이 가고 싶은 카페길래 이때다 싶어 바로 방문! 연남동에서 택시를 타고 가자니 너무 금방이고 걸어서 가면 20분이었는데 그냥 걷자! 해서 걸었지만 도착해 보니 택시 탈 걸 하는 생각이 들었던 날이다. 그만큼 한여름같이 아주아주 더웠음. 그래도 인별그램에서 보던 입구를 보니 괜히 반갑고 드디어 마셔보는 건가라는 생각도 들었다. 주소 : 서울 서대문구 연희로11길 29 영업시간 : 09:00 ~ 18:00 / 일요일 휴무 일단 주문부터! 매뉴팩트커피 메뉴는 콜드브루, 에스프레소, 핸드드립으로 나눠지고 원두 구매 시 커피 한 잔을 서비스로 주신다. 다음에 기회가 되면 원두도 사 보는 걸로 하고 카페인 수혈을 위해 각자의 취향에 맞게 주문! 아! 그런데 주문받으시던 직원분 정말 불친절하다... 나만 느낀 줄 알았는데 다 마시고 나오자마자 동생도 동생 남자친구도 주문받는 사람 말투며 표정이며 매우 불쾌했다고 한 마디씩 했다. 아니 열 마디 했다. 그래서 사실 다시 가고 싶지는 않다. 콜드브루 : 6,000원 플랫 화이트 : 5,000원 라떼 : 5,000원 실내 공간은 매우 협소하고 다른 카페들과 다르게 구조가 특이한데, 주문받는 곳 뒤쪽이 커피를 만드는 곳이 아니라 매장 안쪽이 커피를 만드는 공간이다. 주문받는 곳 옆에는 콜드브루와 원두가 있다. 그리고 가운데에 6명이 앉을 수 있는 쉐어 테이블이 있다. 공간이 협소에서 곳곳에 자리를 만들어 두신 것 같았는데 창가에는 나무 판으로 간이 테이블을 만들어 놓고 의자 두 개가 있다. 감성은 있지만 해가 쨍쨍하게 들어오는 시간에는 더울 듯하다. 마지막 공간은 벽 쪽 자리인데 혼자 방문했을 때 앉기 좋은 자리 같다. 공간도 공간이지만 의자가 편하지 않아서 오래 앉아서 수다 타임을 갖기에는 어렵고 정말 커피를 한 잔 마시기 위해 방문하기 좋은 연희동 카페라는 생각이 든다. 벽 쪽 테이블 한 쪽 귀퉁이에는 빨대, 티슈 등이 준비되어 있다. 커피가 나오기까지 시간은 조금 걸렸던 것 같고 평일 낮 시간이었음에도 방문하는 사람들이 많았다. 나야 휴가 쓰고 방문했지만 그렇지 않은 것 같은 분들을 보니 괜히 부럽기도 하고 ㅎㅎ 일단 사진부터 남겨주고 카페인 충전을 시작해 본다. 동생 남자친구가 아무 생각 없이 주문은 콜드브루. 지금 보니 콜드브루도 메뉴가 세 종류였는데 주문받으실 때 어떤 걸로 드릴까요?라고 물어보시지도 않았다. 그래서 이게 둘 중 어떤 건지는 모르겠지만 한 모금 마셔보니 그냥 우리가 아는 콜드브루 맛이다. 이건 특별하게 맛있다는 느낌은 들지 않는 맛. 동생의 픽 라떼는 고소함도 있지만 생각보다 진한 느낌보다는 부드러운 느낌이 강했던 것 같다. 고소하면서도 원두 향이 진하게 느껴지는 걸 좋아하는 나에게는 아주 약간 밍밍하게 느껴지기도 했지만 나쁘지는 않았던 맛! 마지막 내가 픽한 매뉴팩트커피의 플랫 화이트. 한때 정말 많이 마시던 메뉴였는데 어디는 너무 진해서 속이 쓰리고 어디는 그냥 라떼를 마시는 것 같은 느낌이 들었는데 이곳은 너무 진함과 라떼의 중간 느낌?? 근데 좀 더 묵직함이 느껴져도 괜찮겠다 싶었다. 그래도 고소함은 진하게 느껴져서 입맛에는 잘 맞았다. 빈속에 마셔도 부담스럽지 않을 것 같은 느낌이랄까?? 세 가지 중에서는 가장 맛있었던 메뉴! 직원분의 불친절함 때문에 재방문하게 될지는 모르겠지만 한 번쯤은 방문해서 마셔보기 좋은 곳이라 생각되는 연희동 카페. 궁금했던 곳 한 번 가 본 것으로 만족! 매뉴팩트커피 서울특별시 서대문구 연희로11길 29"
"연희동 카페, 매뉴팩트커피","연희동 카페, 매뉴팩트커피 address : 서울 서대문구 연희로11길 29 open : am 09 : 00 - pm 18 : 00 sun off instagram : @manufactcoffee https://instagram.com/manufactcoffee?igshid=NzZlODBkYWE4Ng== Manufact Coffee Roasters(@manufactcoffee) • Instagram 사진 및 동영상 팔로워 12K명, 팔로잉 0명, 게시물 263개 - Manufact Coffee Roasters(@manufactcoffee)님의 Instagram 사진 및 동영상 보기 instagram.com 이른 시간에도 방문할 수 있는 연희동 매뉴팩트 커피. 두번 째 방문! 방문은 두번 째지만 듁스 원두 다음으로 사랑하는 매뉴팩트 원두🫶🏻 커피를 다 마신 후 알았는데 원두 구매 시 음료 한 잔을 서비스로 제공 받을 수 있답니다:) 저희는 플랫화이트, 라떼, 무화과 파운드케이크 주문! 매뉴팩트 커피를 웨이팅 없이 항상 웨이팅없이 방문할 수 있는 나 어떤데ㅋㅋㅋㅋㅋㅋㅋ (혼자 방문하거나 2인 방문을 추천드려요) 사람들로 꽉 차있어서 공간 촬영 불가x 조용한 공간에 커피 내리는 소리와 고소한 향을 맡고있자면 행복 그잡채 요새는 플랫화이트 맛집이라고 소문나 있는 매뉴팩트 커피는 사실 라떼 맛집:) 여전히 변한 없이 고소하고 깊은 맛- 쉐어테이블에서 저희가 커피 마시는 동안 테이크아웃 손님들도 정말 많았어요! 그리고 처음 먹어본 매뉴팩트 무화과 파운드 케이크 사실 기대 안했는데 기대 이상의 맛 적절히 달고 적절히 담백한’_‘ 내 원두 갈아주시는 소리:) n년 전과 똑같은 사진! 커피맛도 공간도 여전한 연희동 카페, 매뉴팩트 커피. 연희동을 방문한다면 꼭, 테이크아웃으로라도 드셔보시길 추천드려요-"
"[연희동 카페투어] 올드프렌드, 매뉴팩트커피, 피터팬1978 소금빵","반차메이트와 연희동 카페투어를 하고 왔어요! #평일반차 #카페투어 세상 신남! 맛있는 라떼를 찾으러 폭풍 검색하다가 '올드프렌드' 당첨. 근데 지도 주변을 아무리 돌아봐도 카페가 보이지 않아서 주위를 한참 맴돌았는데, 알고 보니 2층이었어요! 생각보다 입간판이 작아서 뒤늦게 발견ㅋㅋㅋㅋ 공간도 널찍하고 깔끔하게 정돈된 인테리어가 제 마음까지 정돈 시켜주는 느낌. 메뉴판 마저도 완전 심플. 로스팅 공간도 너무 갬성적이네? 요즘 다시 이런 딥한 우드톤이 좋아요. 원두 패키지도 깔끔하고 가격도 나쁘지 않음. 요즘 핫한 카페마다 다 있다는 아르떼미데 조명. 카운터 쪽에 테이블 조명도 있음. 카르텔이랑 얘랑 고민하다가 카르텔 샀는데, 미련 남네.. 어..? 여기 소품 하나하나 다 탐나네..? 이거 보고 다시 기타 사고 싶어진 점. 찾아보니까 마틴치고 저렴하네? #마틴백패커 40만원대. 소품이 꽤나 많은데도 깔끔하게 정리되어 있어요. 왜 때문에 우리 집은 이렇게 정리가 안돼?ㅋㅋㅋㅋ 한 잔 한 잔 정성스럽게 내려주시는 커피. 친구랑 라떼 2잔을 주문했는데, 상당한 시간이 걸렸다. 난 천천히 내려줘도 맛있는 커피 먹는 게 좋아서 괜찮았지만, 성격 급한 사람은 느리다고 할 듯ㅋㅋㅋ 근데 기대에 비해 맛은 조금 실망한 점.. 쓴맛이 강해서 소문처럼 꼬숩 존맛은 아니었어요(소근소근) 그래도 햇살도 분위기도 따뜻하고 음악도 좋아서 여유로운 분위기를 즐기고 싶으시면 추천할 만한 카페입니다! 다른 카페에 비해 역에서 거리가 조금 되는 만큼 확실히 조용한 편이라 시간 보내기엔 좋아요! 올드프렌드 서울특별시 서대문구 연희로25길 37 2층 올드프렌드 하지만 커피 맛이 조금 아쉬워서 두 번째 후보였던 ‘프로토콜’에도 가보기로 했어요. 가는 길에 ‘피터팬1978’이 있어서 본능처럼 들어감. 소금빵 친구들 안녕!? 피터팬은 하드 소금빵, 소프트 소금빵 두 가지가 있는데 얼마 전 먹은 씨스터브레즈가 하드 소금빵이었으니까, 오늘은 소프트로 선택! 빵 사서 프로토콜에 갔는데, 평일인데 사람 머선일이야…? 카페 문 열자마자 사람 열기에 놀라버림. 코시국이랑 너무 안 맞는 카페라서 바로 손절ㅋㅋㅋ 날은 아직 춥긴 하지만, 소금빵도 먹고 싶으니까 매뉴팩트커피 테잌아웃해서 공원에서 먹기로 계획 변경! 원래 연희동=매뉴팩트커피 국룰이었잖아요?ㅋㅋㅋ 진짜 오랜만이다. 커피 사면서 혹~시나 하는 마음에 내부에서 빵 섭취 가능한지 여쭤봤더니, 냄새 없는 간단한 건 가능하다고 하셔서 안에서 먹기로!! 너무나 감사한 마음ㅜㅜㅜ 헤헿 실외기 뷰ㅋㅋㅋ창가자리 득템. 소금빵 단돈 1,500원!! 가성비 뭐야? 대부분의 소금빵이 식으면 노맛인데, 식은 것치고 꽤나 맛있었어요! 데우면 더 맛있을런지 다음에 또 사봐야겠다며 ㅎㅎ 사실 매뉴팩트커피는 맛이 다른곳보다 뛰어나기보다는 공간이 주는 분위기와 친절함, 안정된 라떼아트 그리고 적당한 커피값으로 테이크아웃하러 방문하곤 했는데 앞으로는 빵 투어 후에 매뉴팩트커피 코스로 더 자주 찾게 될 것 같아요! 매뉴팩트커피 서울특별시 서대문구 연희로11길 29"
연희동 카페 매뉴팩트커피ㅣ내 인생의 플랫화이트,"연희동 카페 MANUFACT COFFEE 매뉴팩트커피 ㅣ 내 인생의 플랫화이트 어릴 때만 해도 새롭고 이색적인 곳이 좋았다. 나이가 들어서 일까, 아니면 충분히 경험해서 일까. 요즘엔 마냥 새롭다고해서 자극을 주진 않더라. 🤔 나에게 이로운 영향을 주는 곳들은, 생각해보면 대체로 익숙한 곳, 나를 안정적으로 만들어 주는 곳들이었다. 오늘 포스팅할 #연희동카페 역시 그 동네의 터줏대감 역할을 톡톡히 하는 공간. 이미 나의 인스타그램에서는 '오랜 짝사랑'이라고 소개할 만큼 꾸준히 오래 방문하는 곳이다. 매뉴팩트커피 서울특별시 서대문구 연희로11길 29 연희동 카페 매뉴팩트커피(Manufact coffee) 연희동 카페 매뉴팩트커피(Manufact coffee)  이제는 강남까지 진출한&nbs... blog.naver.com 블로그에도 한 번쯤은 썼겠지 하며 찾아봤는데 무려 7년 전 블로그 글,,,, 나도 오래됐고 이 카페도 오래됐다. 👵🏻☕️ 이러한 무드가 좋다. 이런 모양의 조명인 줄 알았는데 캔버스 천을 이케아 st 조명에 붙인 거였네. 7-8년만에 알게 된 사실,,, 늘 변함이 없는 입구뷰 변함 없어서 좋다 좋아. 연희동카페 매뉴팩트커피 메뉴/가격 세월이 흐르고 보니 가격도 많이 올랐다. 꼭 매뉴팩트커피 보다 다른 곳들이 싼 것도 아니긴함. 연희동카페 대부분의 가격과 비슷할 것이야,, 그런데도 워낙 저렴했던 과거와 대비해서 조금은 놀란? 느낌도 있었지만 '대체불가'라는 게 그래서 대단한 것. 아이스 플랫화이트 5천원 충분한 지불가치가 있는 맛이다. 창틀을 테이블삼아 먹는다? 날이 선선하다면야, 이 자리마저 너무 분위기 좋기만 하다. 우리가 갔던 때는 해가 쨍했던 9월의 초였으므로 저 자리의 주인이 내가 됐다면 조금은 힘들었으리라. (더위 극혐하는 1인,,,^^) 그래도, 최근 방문했을 때엔 늘 웨이팅이었는데 이날은 주말임에도 운 좋게 큰 원테이블 석에 앉았다. 매뉴팩트커피 연희점은 좁은 공간에서 조금은 불편함을 감수해야한다. 편하게 오래 머무를 분들이라면 다른 카페 가시길 권해드린다. 하지만, 한 컵 정도는 테잌아웃 해 가 줘요.... 정말 맛있으니까 🥹 식수가 나와요 신기신기 드디어 나왔다. 5천원 커피 치고 너무 작다고 생각할 수 있음. 근데 이거 주기적으로 수혈해줘야 돼. 상투적인 표현을 빌려, 한 번도 안 먹은 사람은 있어도 한 번만 먹은 사람은 없을 거다. 함께한 i 언니도, 아 이 맛,,, 진짜 제일 맛있다- 라고 해줬을 만큼. (카페 문화?를 아주 즐기는 언니도 아니고 그만큼 커피 맛에 큰 감흥 없는 편인데도 매뉴팩트커피 아플화는 다르다고. 했다.) 다른 플화 맛집 아무리 가 봐도,,, 안 돼 안 돼. 콜드브루도 맛있긴 하지만 역시 현장에 와서 먹어야 돼. 이번에도 감탄하면서 마셨다. 진짜 사랑해요. 냅다 도깨비 김고은 돼버린다,,, 🧣 보통은 다른 디저트는 먹은 적이 거의 없다. 매뉴팩트커피 커피메뉴 말고는 거의 본 적도 없었다. 커피를 마시는 이유가 커피를 먹기위한 것보다는 그 시간동안 대화를 하기 위함이라는 무빙 미현의 말 처럼 (무친자가 따로없음) 우리도 그냥 이 시간을 더 즐기려고 커피 + 디저트 까지 시켜봤는데- 치즈 파운드 케이크, 꼭 시킬 필요는 없겠어요,.🙄 (그냥 빠바 파운드케익? 같은 맛,..) 폰 바꾸고 장착할테야 캬아 🖤🤍🐼 가장 애정하는 카페에서 우리 푸린세스 그립톡도 선물받고!! 늘 사랑스런 기억만 가득하다. 커피만 맛있는 게 아니라 그 시간 속의 추억과 이야기까지 오감을 만족시켜 주는 곳. 오래오래 함께 해주세요 🫶 제발요🩵 #연희동카페 #매뉴팩트커피 #매뉴팩트 #플랫화이트맛집 #아이스플랫화이트 📍 같이 가면 좋은 곳 🧸🍭 연희동 옵젵상가X이나피스퀘어 파우치 꾸미기 @사러가마트 2층 연희동 옵젵상가X이나피스퀘어 파우치 꾸미기 @사러가마트 2층 체크인챌린지 시즌 2가 끝나가고 이미 물리... blog.naver.com 연희동 산책 기록 ㅣ 모데스트무드 쇼룸, 엽서가게 포셋 POSET 연희동 산책 기록 🧸 모데스트무드 쇼룸 ✉️ 엽서가게 포셋 오랜만에 초스피드 포스팅 - 🏃🏻♀️?... blog.naver.com 연희동 술집 희로, 도테야끼 맛집 ㅣ 나를 위한 작은 술상 🍥🍢🍺🥢 연희동 술집, 도테야끼 맛집 희로 姬路 나를 위한 작은 술상 겉으로는 큰 일이 없지만 머... blog.naver.com"
"연희동 커피맛집, 매뉴팩트커피 MANUFACT COFFEE ROASTERS","연희동 카페추천 커피맛집 매뉴팩트 manufact coffee roasters 매뉴팩트커피 서울특별시 서대문구 연희로11길 29 영업시간 9:00 - 18:00 정기휴무 매주 일요일 오늘은 제가 너무 좋아하는 커피 연희동 매뉴팩트커피를 소개할게요~ 다른지점들도 있는데 저는 연희동에 있는 매장만 가 보았구요 연희동매장은 작기때문에 자리가 없는 경우도 많아서 아예 테이크아웃 하시려고 오시는 분들도 많아요! 그만큼 커피맛이 좋다는 거겠죠?! 사진 속 건물 2층에 위치해 있는데요 정말 작고 아담한 느낌이에요! 다인원이라면 비추합니다ㅠㅠ 들어가자 마자 커피향이 풍기구요~ 작지만 커피 만드는 곳과 원두, 굿즈판매까지 있을건 다 있답니다! 주문은 이쪽에서! 연희동 매뉴팩트커피 메뉴판 저희는 아이스라떼로 2잔 주문했구요 한잔은 디카페인으로 변경했습니다:) 커피를 만드는 곳이 완전히 오픈되어 있어서 바로 옆에서 커피 만드시는걸 볼 수 도 있어요~ 주문한 라떼 두 잔이 나왔습니다:) 한 잔은 디카페인으로 변경해서 커피색이 다른게 보이시죠?! 매뉴팩트커피는 고소하고 아주 맛이 좋아요~ 아무래도 디카페인보다는 원래원두가 맛이 훨씬 좋습니다:) 오랜만에 맛난 라떼 한 잔에 기분이 좋아졌어요! 한쪽에는 굿즈로 컵들이 있고, 다양한 원두와 드립백, 콜드부루까지 판매 중이에요! 커피 마시다가 집에서 마실 드립백도 추가로 구매했어요~ 한 박스에 5개 들어있고 만원이었어요 라떼 뿐만 아니라 플랫화이트도 맛있기로 유명하더라구요~ 커피 좋아하시는 분들은 매뉴팩트커피 꼭 방문해 보세요!"
라떼가 맛있었던 연희동카페 매뉴팩트커피 방문 후기,"안녕하세요 송글입니다~~! 제가 종종 시간 나면 혼자서 카페투어, 빵집투어 하면서 힐링하는걸 좋아하는데요! 지난번에 연희동에 갔다가 테이크아웃 했었는데 굉장히 맛있게 먹었던 기억이 있는 곳..!! 이미 커피 좋아하시는 분들에겐 유명할듯한 연희동 매뉴팩트커피 랍니다 >//< 최근에 우연히 연희동 데이트를 하게 되서 재방문해본 후기를 남겨보려고 해요 날씨가 너~~무 좋았던 날 ㅠㅠ 춥지도, 덥지도 않고 파란 하늘에 돋아난 새싹들의 싱그러움이 가득했던 💚 봄 좋아 💕 매뉴팩트커피 주소 서울 서대문구 연희로11길 29 영업시간 월~토 09:00 - 18:00, 정기휴무 매주 일요 전화 02-6406-8777 외관은 이러하답니다...! 오래된 건물 2층에 있는 작은 카페예요 그러나 요즘같은 세상에 위치와 크기는 큰 상관이 없는 듯 합니다ㅎㅎㅎ 숨어있어도, 작아도, 여기 맞아? 싶어도 ㅋㅋㅋ 맛있고 유명하면 다들 알아서 잘 찾아오는듯(=나) 오히려 이런 게 감성이 되어버린~~ 매뉴팩트 오른쪽에는 #에브리띵베이글 이 있어요 이 베이글집도 유명해요!! 이게 바로 감성이다 이말이죠 >""< 따지고 보면.... 나무 판떼기와 벽돌일 뿐인...걸... 영업시간이 저녁6시까지라서 평일에 퇴근하고서는 갈 수 없는 소즁한 곳 메뉴 연희동카페 매뉴팩트커피의 메뉴판입니다 커피 전문점 느낌이 뿜뿜이에요. 핸드드립도 유명한 것 같더라고요! 에스프레소, 콜드브루 메뉴도 있음 이제보니 디저트로는 브라우니랑 무화과 파운드 케이크가 있군용 핸드드립 원두 종류도 여러가지이고 커피 내리시는거 보니까 완전 전문적으로 보이는 게 커피 좋아하시는 분들에게 인기있을 듯 매뉴팩트는 라떼가 꼬소하고 맛있기 때문에 플랫화이트, 아이스라떼 주문했어요 한쪽에는 매뉴팩트커피 굿즈들이 있어요 로고가 박힌 유리잔, 머그컵과 원두, 콜드브루 원액도 있었습니다! 원두 사면 아메리카노를 무료로 한 잔 먹을 수 있더라고용 안그래도 필요한데 원두 살까 한참 고민했어요 ㅋㅋㅋ 텀블러도 있고, 핸드드립 용품들도 있었어용 컵들도 깔끔한 디자인이라서 선물이나 소장용으로도 좋을 것 같았음! (일단 그냥 내 취향...ㅎㅎ) 내부 카페 공간이 작기 때문에 좌석도 많지 않아요 이렇게 창문 앞 두자리랑 큰 테이블에 의자 8개 있습니다 모르는 사람들과 그냥 마주보고 앉으면 돼요^0^ 사람 조금 몰리면 무조건 웨이팅 해야하는.. 그래서 혼자갔을 때는 그냥... 테이크아웃 함 ㅎㅎ 완전 느낌있는 인테리어 아닌가용 여기도 앉을 수 있어요! 어차피 다들 앉아서 오랫동안 시간 보내는 느낌이 아니기 때문에 (애초에 그럴 분위기가 아님...) 커피 호로록 마시고 나가게 된답니당 이렇게 홀에서 커피 내리시는 걸 볼 수 있어요 창문 앞에 에스프레소 머신이 있고 그 옆 테이블에서 핸드드립 내리심 뭔가 모르게 독특한 분위기의 카페예요 어딘지 일본스럽기도 하공..? 아이스라떼 5,000 꼬숩꼬숩한 아이스라떼! 산미는 전혀 없고 고소한 맛의 라떼입니당 라떼 맛있는집 가면 어떤우유 쓰나 유심히 보게되는데 매뉴팩트커피에서는 서울우유를 사용하시더라고요 부드럽고 꼬소한 라떼는 사랑 ✨ 저번에 마신 아이스 플랫화이트보다는 연하긴 하지만 마시썽..! 플랫화이트 5,000 하뚜 라떼아트가 되어서 나온 플랫화이트~~! 스티밍이 지대로 되어있는 것 같쥬?! 벨벳같은 우유폼에 찐하고 꼬수운 플랫화이트예요. 라떼 좋아하신다면 강추입니다 >0< 최근들어 더욱 느끼고 있는 게, 확실히 커피의 맛과 향을 제대로 느끼려면 아이스보다는 따뜻한걸 마셔야 하는 것 같아요 왜 이탈리아 사람들이 아이스로는 절!대! 마시지 않는지 그 부심이 조금은 이해가 간달까... 그래도 한여름 아아는 포기못햐 온탕과 냉탕을 오가는(??) 매뉴팩트커피 플랫화이트 & 라떼 ㅎㅎㅎ 연희동만의 차분하고 여유로운 분위기가 있는데 그 분위기와 잘 어울리는 카페인 것 같아요 앉아서 여유롭게 먹기는 어렵지만 테이크아웃 해서 마시면서 주변 산책해도 넘나 좋은..❤️ 전원주택도 많고 맛있는 빵집, 예쁜 카페도 많아서 날씨 좋을 때 놀러가기 좋답니당 ㅎㅎㅎ 이날 진짜 온도, 습도, 햇살까지 완벽했던 하루랄까...ㅎㅎㅎ 여기 이름이 뭐였더랑... 주택개조해서 만든 여기 카페와 서점도 연희동 갈 때마다 들리는 곳인데, 혼자서 구경하기에도 좋답니당!! 그리고 연희동에 매뉴팩트커피 로스팅룸인지 아니면 큰 카페를 만들려고 하는 곳인지 매뉴팩트 써있고 준비중인 것 같은 건물이 있더라고용 만약에 자리 더 넓게 해서 생겨도 좋을 듯,, ㅎㅎㅎ 날도 좋고, 커피도 맛있고 행복했던 연희동 나들이였답니다! 연희동카페 찾으시는 분들이나 라떼 좋아하시는 분들 계시면 연희동 매뉴팩트커피 꼭 방문해보셔용! 그럼 모두들 평온한 오후 되시길>0<"
