title,content
"성수동 직장인 엄선_성수동 서울숲 카페 추천 : 브레디포스트, 카페온화, 테디스오븐, BNHR, 옹근달, 멜라, 노티드, 누데이크","회사가 성수동으로 이사를 한지 4년 정도 되었다. 회사가 성수동으로 오기 이전부터 주말 나들이를 성수동으로 자주 왔었는데 출퇴근하면서 평일에 만나는 성수동은 또 다른 느낌- 커피와 디저트를 너무 사랑하는 나는 평일 & 주말 가릴 것 없이 성수동을 누비고 다녔고 그동안 가본 것들을 추천순으로 정리해보기로 했다. 이후로도 더 정보가 쌓이면 새글을 또 써볼 예정 가본곳이 엄청 많지만, 기억에 남고 또 방문할 의사가 있는 곳만 기록하기로! 추천순으로 정리 [1순위] 성수동 브레디포스트 2023.10 기준으로 최고 추천 부추크림프레즐이 시그니처이고, 존맛탱, 그렇다고 다른 프레즐이 맛없는것도 아님, 어니언스프는 그냥 쏘쏘. 나혼산에 나왔다고 하더니 그 여파인지 아니면 다른 이유가 있는건지 사람이 급작스럽게 많아져서 요즘은 자주 못갔 ㅠ 웨이팅 내겐 너무 힘들기 때문에 패스- [2순위] 성수동 카페온화 수플레를 너무너무 좋아하는 나로썬, 카페 온화는 늘 스테디 회사가 성수동으로 이사오기 전부터 다녔던 곳! 5년전쯤?에 처음 왔는데 그때는 웨이팅이 어마무시해서 꼭 애매한 시간에 방문을 해야만 했다. 남들 밥 먹는시간, 남들 커피 안마시는 시간 ㅋㅋㅋ 이제는 오픈한지 몇년이 지났기도 하고, 다른 지역에도 많이 카페온화 프랜차이즈 지점이 생겨서 성수동은 좀 널널한 편. 브루잉 (드립) 커피도 진짜 퀄리티 좋아서 애정 [3순위] 서울숲 테디스오븐 웨이팅만 없다면 주3회는 방문할 수 있을정도 일단 베이커리류가 훌륭하다. 케이크만 몇개 가져다놓는 여느 커피숍들과는 다르다. 그리고 여긴 커피 외에 마실 음료들의 선택권도 많고, 퀄리티가 진짜 좋다. 신메뉴도 자주 생기는 편이고, 왜 인기가 있는지 누구보다 이해가 되는 서울숲 카페! 문제는 웨이팅인데, mz들에게 꽤나 인기인지 2시간 이상 기다릴 수도 있다는 얘기를 듣고 돌아온적이 한두번이 아니다. 카페 웨이팅 못 참지... [4순위] 성수동 BNHR 온세상 사람들이 여기 아이스바닐라라떼를 먹어봤으면... 커피 메뉴만 따진다면 여기가 1위가 되기도. 아메리카노는 말할 것도 없고, 달달한 커피를 안좋아하는 편인데도 여기 바닐라라떼는 압도적이다. 레알 바닐라빈을 육안으로 확인할 수 있고, 바닐라향도 진짜 최고다. 매번 먹느라 사진을 못 찍.... 한가지..우리 크로플은 먹지 않기로 해요...별로.... [5순위] 성수동 옹근달 나혼산 박세리 감독편에 나온뒤 사람 많은편. 여기도 베이커리류가 좋은데 까눌레가 특히 추천할만하고, 계절별로 베이커리가 종종 바뀐다. 특히 여긴 이 근처 카페들 중에 산미있는 커피를 잘 하는 곳. 한가지 단점이 있다면 좌석이 너무 불편하다. 카페 의자는 모름지기 편해야하거늘, 딱딱한 것을 넘어 차가움이 느껴져서 주로 테이크아웃- [6순위] 성수동 멜라 샌드위치, 오픈토스트, 프렌치토스트 등의 브런치 메뉴 위주 친구와 가서 식사 대용으로 시간을 보내기에 좋다. 성수동에 은근히 제대로 된 브런치 파는 곳이 많지 않고, 퀄리티도 그냥 쏘쏘인데, 멜라는 진짜 내 취향저격. 모두가 친절하고 매장도 매우 깔끔한 편이다. [7순위] 성수동 노티드 노티드. 뭐 이제 조금 식상해진 느낌이 있긴한데, 한때 거래처 간식을 사서 방문할 때도, 직원들 간식을 사다 줄때도, 주저없이 노티드를 갔었다. 피치스 성수점이 오픈할 때 노티드 매장이 샵인샵 개념으로 있었고, 근처에 테이크아웃 전용 매장이 하나 더 생겼는데 요즘엔 주로 테이크아웃용 매장으로 간다. 테이크아웃매장에는 도넛과 젤라또를 함께 팔고 있다. 요즘엔 성수에 도넛과 젤라또 매장이 많이 생겨서 새로운 곳 위주로 많이 가긴 하지만, 노티드와 비교해보면 여러가지면에서 노티드가 더 괜찮다는 느낌을 지울 수가 없다. [8순위] 성수동 누데이크 누데이크는 청담이 메인이라 이미 1호점을 다녀온 적이 있다. 성수점이 생겼다는 걸 이미 진작에 알고 있었으나, 방문은 최근에야 했다. 주말 웨이팅은 너무 어마무시하고, 평일 저녁먹고 차 한잔 마시려고 갔더니 한적하더라. 역시 핫스팟들은 평일에 가는 수 밖에 없. 맛이야 뭐 워낙에 보장되어 있는 맛. 청담점에 갔을 때도 생각했지만 케이크 가격은 너무한 편이긴 하다. 리스트를 업데이트 해야겠다는 사명감으로 더더 많은 곳에서 돈을 흥청망청 써보고, 더더 많은 것을 먹어서 돼지가 되어보겠습니다. 이상 끄읕-"
성수동 커피 맛집 카페 벤허 BNHR 성수 애견동반카페,"라떼가 맛있는 성수동 카페 벤허 BNHR 커피, 특히 라떼가 맛있는 성수동 카페 BNHR입니당! 성수역 4번출구에서 가까운 성수동 카페거리에 위치하고 있구요 성수동 근처 둘러보다가 맛있는 라떼 마시러 방문하기 좋아용! 네이버 지도 검색이나 간판 표기는 BNHR이라고 되어있는데 카페 벤허라고도 읽는것 같더라구요! 둘 다 표기해두긴 했는데 본문엔 BNHR로 칭하도록 할게용ㅋㅋㅋ 성수동 카페 벤허 BNHR 📞070-4175-6118 📍서울 성동구 연무장5길 9-16 1층 ✅영업정보 평일 09:00 - 21:00 20:30 라스트오더 주말 12:00 - 22:00 21:30 라스트오더 50m © NAVER Corp. BNHR 서울특별시 성동구 연무장5길 9-16 1층 성수동 카페 BNHR는 내부가 꽤 넓은편이었어요. 사실 내부 인테리어나 분위기는 크게 기대하지 않았는데 널찍한 통창 분위기와 높은 층고에 시원한 분위기가 넘 좋더라구요! 인테리어도 감성돋고 이뻐서 예상보다 훨씬 더 좋았던 성수카페였음! 성수 골목쪽에 위치한 카페라 바깥 뷰도 정말 기대없었는데 ㅋㅋㅋ 나무와 정원이 있는 건물이라 그런지, 뷰도 초록초록 싱그럽고 좋았어용. 그리고 천장의 둥근 조명들이 정말 너무 이쁜듯! 높은 층고에서 진가를 발휘하는 분위기라 좋았습니당! 감성도 놓칠 수 없음! 메인컬러가 노랑인듯 하더라구요. 곳곳에 옐로우 컬러 포인트를 줬는데, 플랜테리어 인테리어도 곳곳에 있어서 되게 밝고 활기찬 느낌이라 좋았어요. 성수동 카페 BNHR 메뉴입니다! 방문했을때 커피와 라떼가 정말 맛있는 곳이라는 추천을 받고 갔었거든요. 그래서 커피에 대한 기대가 이미 있었음! 근데 커피 메뉴 외에도 다양한 음료 메뉴가 있더라구요. 커피 원두는 고를 수 있었어요. 역시 커피 맛집은 원두도 선택이 가능함.👍 각자 취향껏 원두를 선택해보았습니당! 크로플이나 가볍게 먹기 좋은 디저트도 있었어요. 저희는 각자 1인 1음료만 주문했음! 그리고 성수동 카페 BNHR는 애견동반도 가능한 카페라고 하더라구요. 저희가 방문했을때도 옆자리에 강아지가 있어서 넘 귀여웠어용 계속 강아지에게 시선이 뺏김 ㅠㅋㅋㅋㅋ 성수 카페 BNHR에서 직접 만든 티라미수와 쿠키 등 디저트도 은근 다양했습니당. 피넛버터 쿠키! 맛있을것 같은 느낌이 물씬나지 않나요 ㅋㅋㅋ 그리고 이 티라미수 진짜 먹어보고싶었는데, 이날 너무 많은걸 먹고 방문했어서 도저히 들어갈 배가 없더라구용 ㅠ 하지만 역시 아쉬움... 다음에 또 방문해서 요 티라미수 꼭 같이 먹어봐야겠어용. 성수 카페 BNHR 굿즈들도 판매되고 있더라구요. 머그컵, 그립톡, 볼펜, 스티커 세트 등 귀엽고 아기자기한 굿즈들이 많았어요. 오렌지도 판매하시는건가? 궁금했음ㅋㅋㅋ 카운터 앞쪽엔 셀프로 이용가능한 셀프바도 있어서 물을 가져가거나 티슈 사용하기에 편하더라구용. 성수 카페 BNHR에서 주문한 음료 메뉴들입니다! 따뜻한 아메리카노와 아이스 아메리카노, 그리고 썸머 아이스크림 라떼에요. 아메리카노는 각자 취향껏 원두 골랐었습니다. 둘다 다르게 골랐는데 각자 만족하더라구요 ㅋㅋㅋ 썸머 아이스크림 라떼는 올려진 아이스크림도 넘 맛있었음! 라떼도 진짜 맛있더라구요. 아이스크림과 라떼 둘다 만족스러운 주문이었습니당. 물론 섞어서 같이 마셔도 넘 맛있음ㅋㅋㅋ 더 부드럽고 좋더라구용! 커피, 라떼가 맛있는게 찐이었던 성수동 카페 BNHR! 커피 맛있는 성수 카페 찾으시거나 애견동반카페 찾으신다면 바로 BNHR 고고해보시길 바라용! #성수카페 #성수동카페 #성수 #성수동 #성수역카페 #서울숲카페 #뚝섬역카페 #성수카페추천 #애견동반카페 #라떼맛집 #커피맛집 #성수주차가능카페 #벤허카페 #BNHR #성수라떼가맛있는카페 #분위기좋은카페 #내돈내산 #서이추 #서이추환영 #서로이웃추가"
[성수동 데이트] 주차장있는 성수동 카페 찾는다면? BNHR (벤허커피),"주차장 있는 성수동 카페 BNHR 벤허 ✔디올성수 바로 앞건물, 주차가능 카페 ✔맛있는 커피 ✔반려동물 동반가능 ✔넓은 공간, 쾌적한 화장실 성수동데이트 가시면 주차 어디에 하시나요? 저는 차를 가지고 다니는 편이라 항상 주차장을 찾곤 하는데, 서울숲쪽으로 갈 때엔 늘 성동구민종합체육센터 주차장에 주차했었어요. 공영주차장이라 주차비도 덜 사악하고 경차할인이나 저공해차량할인도 적용이 되구요. 그치만 요즘은 서연무장길(성수역 남쪽)으로 많이 간단 말이죠? 많이 아시는 디올성수가 있는 성수동. 서연무장길 쪽으로는 공영주차장이 너무 적고, 주차할만한 곳이 정말 없어서 늘 그냥 걷자 하고 서울숲에서 서연무장길까지 걸어다녔었어요. (2-30분 정도 소요) 그러다가 최근 성수동 주차장있는카페를 알아두고 다녀보는 중인데욤 :-) (카페 이용해서 일부 시간은 주차권 받고, 추가되는 시간 만큼만 주차비 지불) 성수동 (서연무장길) 주차장있는 카페 중 한군데로 BNHR(벤허커피) 소개 해 드려요! 카페 이름이 BNHR이라 어떻게 읽나 했는데 벤허커피 였어요 :-) 성수동 벤허커피 BNHR 일단 위치도 요즘 성수동에서 가장 핫한 디올성수 바로 앞건물에 위치하고 있어요 ㅎㅎ 전 사실 최근에 디올성수 레이디디올 셀레브레이션 전시 갔을때도 요 건물에 주차했었어요. 벤허커피 BNHR가 있는 건물에 제가 좋아하는 성수동 수제버거 맛집 '르프리크'도 있거든요. 르프리크와 벤허커피 두군데 다 이용한다고 해도 주차중복할인은 안되구, 이용하는 한 상점에서만 주차할인 적용이 된다고 해요. 무튼! 최근 성수동데이트 땐 요 건물(블루스톤타워, 성동구 연무장5길 9-16)에 주차하고 벤허커피 이용, 그리고 서연무장길 쇼핑하면서 4시간쯤 놀다가 나왔던 것 같아요. 물론 그냥 성수동 주차장있는 카페 라는 이유만으로 제가 포스팅 하진 않겠죠 :-) 벌써 두번이나 방문 한 성수동 커피맛집 이기도 하답니다. 카페 인테리어도 힙하고 예쁨. 그리고 넓어서 아주 좋다구요. 테이블과 좌석이 많다보니 서연무장길 미어터지는 주말에도 BNHR 벤허커피는 자리 있었어요. 헤헷. 성수동 BNHR 벤허커피 메뉴 추천드려요. 저는 시그니처 표시가 되어있는 비엔에이치알커피 BNHR COFFEE 마셨거든요. 오오오?? 맛있다!!! 소리 저절로 나옴 ㅎㅎㅎ 라떼 느낌인데 더 고소하고 달달해요. 따뜻한커피 나오는 커피잔에 시원하게 나오는것 부터 생소했음 ㅎㅎ (보통 아이스음료 메뉴는 유리컵에 나오는데 비해) 성수동 벤허커피 BNHR 내부도 한번 보실께요. 큰 빌딩 1층에 위치한 카페이다 보니 카페 화장실이 건물1층 엘리베이터 옆에 있는데, 매우 깨끗하고 쾌적하답니다 ㅎㅎ 쨍한 노란색으로 곳곳에 포인트를 준 인테리어 인데 깔끔하고 예뻤어요. 요 자리 왼쪽에 대형 전신거울이 있거든요? 거기서 꼭 거셀 찍기 ;-) 저는 첫 방문때도 베이비랑 :-) 이번에도 베이비와 함께 갔었어요 ㅎㅎ 성수동 서연무장길 데이트에 주차장있는 카페 찾으신다면- 커피맛도 좋은 성수동 BNHR 벤허커피 추천드려요! 50m © NAVER Corp. BNHR 서울특별시 성동구 연무장5길 9-16 1층 BNHR 벤허커피 서울시 성동구 연무장5길 9-16. 1층 평일 09:00 - 21:00 토,일요일 12:00 - 22:00 *주차 가능 *반려동물 동반 가능 BNHR COFFEE(@bnhrcoffee) • Instagram 사진 및 동영상 팔로워 5,282명, 팔로잉 0명, 게시물 306개 - BNHR COFFEE(@bnhrcoffee)님의 Instagram 사진 및 동영상 보기 www.instagram.com"
성수 카페 BNHR :: 성동구 연무장길 벤허 커피 성수동 반려동물 동반 카페,"오늘 리뷰할 곳은 5월즈음에 다녀왔던 성수동 카페 BNHR ! 검색해 보니 벤허 라고 읽는 것 같았다 ㅎㅎ 원래 가려고 찾아 둔 곳이 있었는데 생각보다 거리가 멀기도 했고 비가 갑자기 와서, 급하게 눈에 띄던 곳으로 들어온 거였는데 생각보다 너무 마음에 들었던 카페 🙂 BNHR (벤허) 🏠 서울 성동구 연무장5길 9-16 1층 ☎️ 연락처 : 070-4175-6118 ⏰ 영업시간 : 평일 09:00 - 21:00 (20:30 라스트오더) 주말 12:00 - 22:00 (21:30 라스트오더) ⭐️ 주차(건물 지하1층), 포장, 무선 인터넷 반려동물 동반, 남/녀 화장실 구분 50m © NAVER Corp. BNHR 서울특별시 성동구 연무장5길 9-16 1층 위치는 디올성수와 매우 가깝다 ! 빈티지한 외관도 웬지 마음에 들었고 출입문이 특이하고 신기? 했다. 노란색의 아주 커다란 유리문으로 되어있고 사이드를 밀면 회전문처럼 돌아가면서 문이 열린다. 성동구 연무장길 카페 벤허 벤허커피 들어오자마자 보이는 귀여운 우산꽂이 곳곳에 노란색 포인트로 인테리어를 해두셨는데 너무 귀여웠던. 메뉴판은 요렇게 ! 우리는 아이스 아메리카노 (5,000원) 두 잔을 주문했다. 티라미수, 크로플, 쿠키 등 디저트 메뉴도 있는 것 같았는데 우리가 방문했을 때는 티라미수는 품절이었다 🥺 원두는 하우스/ 베이비/ 디카페인 중에 선택할 수 있고 우린 산미가 가장 적은 하우스를 선택했다 ! 성수역 성수동 카페 벤허커피 bnhr 카페 벤허 넓은 내부공간에, 층고가 높은 구조로 되어 있어 엄청 쾌적하게 느껴져 좋았다 ! 통창으로 되어 있어 날씨 좋을 때 오면 채광도 정말 좋을 것 같았음🍀 곳곳이 보이는 옐로우 포인트 인테리어와 화분들도 다 너무 예뻤던. 저-어기 보이는 전신거울에서 거울샷도 찍었음 후후 콘센트와 휴대폰 충전기까지 이렇게 여유롭게 구비되어 있어 더 좋았던 🥹 진동벨도 웬지 귀여워서 찍어 봄 👀 성동구 카페 건대 성수동 카페 성수 크로플 맛집 성수동 애견동반 카페 그리고 우리가 주문한 아메리카노 ! 커피 맛도 나와 남편이 좋아하는 꼬수운 + 탄맛이 많이 느껴지는 원두라 매우 취향이었다 ! 사이즈업이 없는 건 조금 아쉬웠지만 ^_^ㅎ 들어갈 때 사진 찍어 주고 싶었는데 후다닥 먼저 들어가버리는 바람에 놓쳐서 나갈 때라도 찍어 봄ㅋㅋㅋㅋㅋㅋ 우연히 발견한 곳인데 자리도 너무 편하고 커피도 맛있어서 한번 쯤 더 방문해보고 싶은 곳 ! 검색해보니 티라미수가 정말 맛있어보이던데 다음에 왔을 땐 품절이 아니길 🥹"
힙하다 힙해! 라떼가 맛있는 성수동 카페 BNHR 벤허커피 후기,"커알못이지만 라떼를 참 좋아하는 글쓴이🤤 항상 커피는 라떼 종류만 먹을만큼 라떼를 사랑하는데요 최근에 다녀온 성수동 카페 라떼 맛집 소개해볼게요 힙하다 힙해! 라떼가 맛있는 성수동 카페 BNHR 벤허커피 후기 50m © NAVER Corp. BNHR 서울특별시 성동구 연무장5길 9-16 1층 기존 한남동 카페로 먼저 알고 있었던 BNHR 장소이전 또는 리모델링으로 소식을 건너들었으나 현재 네이버에서 검색하면 성수점만 만나볼 수 있어요 🔖BNHR COFFEE BNHR COFFEE(@bnhrcoffee) • Instagram 사진 및 동영상 팔로워 5,298명, 팔로잉 1명, 게시물 312개 - BNHR COFFEE(@bnhrcoffee)님의 Instagram 사진 및 동영상 보기 www.instagram.com 사실 저녁을 먹으러 쿠나를 방문했는데 웨이팅이 살짝 있어서 잠시 쉬어갈 생각으로 BNHR 카페로 들어왔어요 좋아하는 가게가 연달아 붙어있으니 참 좋다요😌 벤허커피 고소하고 달콤한 우유베이스에 리스트레토 샷. 얼음없이 차갑게 마시는 커피 조금 작은 80z 잔에 제공 6,000원 아쌈밀크티 6,500원 피넛버터 쿠키 3,900원 저녁시간이라 +500원 추가하고 디카페인으로 주문했어요 그리고 너무 맛있게 생겨 시선강탈 당한 쿠키도 같이 주문했어요 +500원 추가하면 귀리우유로 변경 가능하고 +1,800원 추가하면 샷추가도 가능해요 BNHR 하면 노란색 컬러가 가장 먼저 떠오르는데요 성수점도 채도높은 노랑,빨강 컬러의 포인트 컬러로 식물의 초록 컬러까지 더해져 굉장히 조화로웠어요 널찍한 하얀 내부에 천장이 높고 귀여운 둥근 조명과 통유리창으로 되어있어 햇빛도 굉장히 잘들어와요 벽과 테이블에 트렌디한 스티커로 꾸며져있고 곳곳에 제가 좋아하는 슈프림 브랜드 액자도 볼 수 있어 감각적이고 힙한느낌의 카페였어요 썸머 아이스크림 라떼를 시킬까 살짝 고민하다가 시그니처 커피인 벤허커피로 주문했는데 비쥬얼 합격💛❤️ 일행은 오전에 카페인을 많이 섭취해 아쌈밀크티로 주문했는데 BNHR은 벤허커피와 아쌈밀크티가 유명하더라구요 빠르게 나가야해서 사진도 다 흔들렸구요🫨 사진을 찍고 먹으려던 찰나에 쿠나 웨이팅 입장을 알리는 캐치테이블 알림.. 입장 시간 늦어지면 취소가 되서 어쩔수 없이 호다닥 테이크아웃잔으로 옮겨 매장을 나왔어요🥹 쿠나에서 밥을 먹고 테이크 아웃했던 커피를 먹어보고 완전 반함.. 라떼는 우유맛에 따라 맛이 굉장히 달라지기도 하는데 우유가 정말 고소했고 커피도 정말 맛있어서 계속 맛있다고 남발하며 먹었어요 양이 적은편이라 비싸다고 느껴질수도 있지만 커피가 맛있으니 인정!! 포장한 피넛버터쿠키는 집에가서 엄마와 같이 먹었는데 군것질 안좋아하시는 엄마가 먼저 맛있다고 할정도로 쿠키도 정말 맛있었어요 1개 더 사올걸 너무 아쉬웠어요😩 다음에는 여유로울때 방문해서 매장에서 먹을거에요 성수에 가게되시면 BNHR 벤허커피 완전 강추😬 광고 아닌 직접 먹어본 후기 사진은 아이폰12pro로 촬영했습니다. 공감과 댓글은 글쓴이를 춤추게해요🤍 ♥오늘도 행복한 하루되세요♥"
성수동 카페 추천 : 커피 맛이 괜찮았던 성수동 카페 BNHR,"성수동 카페 추천 카페 BNHR 안녕하세요 유댕이에요 :) 오늘은 성수동에서 친구랑 우연히 들렸던 카페가 있었는데 커피 맛이 괜찮아서 카페 BNHR를 포스팅해 보려고 합니다 50m © NAVER Corp. BNHR 서울특별시 성동구 연무장5길 9-16 1층 #BNHR #성수동카페 #성수동BNHR #성수동카페추천 #성수동라떼맛집 #성수카페 #성수동분위기좋은카페 #성수데이트 #내돈내산 ✔위치 서울 성동구 연무장5길 9-16 1층 ✔영업시간 월-금 09:00 ~ 21:00 토,일 12:00 ~ 22:00 < 성수 카페 BNHR 메뉴판 > 친구는 아이스 아메리카노, 저는 아이스 바닐라라떼를 주문! 아이스 아메리카노 5,000원 아이스 바닐라라떼 6,000원 . . . 아이스 아메리카노를 주문하면 이렇게 세 가지 원두 중에서 선택할 수 있었어요 친구는 읽어보고 제일 무난한 하우스로 선택했어요 하우스는 다크초콜릿의 풍부한 단맛, 꽉 찬 바디감, 진한 커피향이 특징이라고 해요!! 주문 후 매장을 둘러봤습니다 커피 주문하는 곳과 픽업하는 곳 사이에 홀더와 빨대, 시럽 등이 준비되어 있었어요 쿠키가 들어있던 쇼케이스 위에 BNHR 굿즈가 올려져 있었어요!!! 세상에 굿즈 노랑 노랑 하니 너무 귀엽잖아?? 캐셔대 옆에 굿즈가 진열된 선반이 있었는데 볼펜과 그립톡만 있는 게 아니고 에코백과 머그컵 등 다양하게 있었어요!! 빈자리가 생길 때마다 사진을 찍어 보았어요 테이블이 다 똑같은 테이블로 되어 있지 않고 벽면과 창가 쪽은 다른 테이블로 되어 있었어요 곳곳 노란색 인테리어 사이에 알록달록한 테이블과 의자가 인상적이었어요✨ 그리고 포토존으로 보이는 전신 거울이 있었는데 거울 앞에 테이블이 있어서 그 자리에 앉아야지만 사진 찍을 수 있어서 아쉬웠어요 ㅠ^ㅠ 전신거울에서 사진 찍는 거는 포기 못하는 저... 하지만 쳐다만 보고 왔어요 ㅋㅋㅋㅋ 구경하다 보니 음료가 나왔습니다!! 노란색 쟁반이 쨍한 노란색이라서 너무 탐났어요!!! 소품샵가서 있으면 충동구매할 거 같았어요 ㅋㅋ 아이스 아메리카노 5,000원 저는 괜히 커피 크레마가 저렇게 진하게 올라와 있으면 더 커피가 맛있어 보이더라고요 아아 시키면 크레마 보기 힘들었는데 여긴 크레마가 있어서 그런지 더 먹음직스러웠어요!!! 커피향이 진하니 좋았고 맛은 고소하니 좋았습니다 아이스 바닐라라떼 6,000원 제가 주문한 아이스 바닐라라떼 아이스 바닐라 라떼는 먹기 전에 잘 저어 줘야 하고 라떼 냄새가 달달하니 좋더라고요 그리고 라떼가 부드러워서 너무 맛있게 먹었어요!!! 특히 바닐라 라떼 자체가 많이 달지 않아서 너무 좋았습니다!! 성수동에서 카페 어디 갈지 고민이라면 BNHR 추천드립니다!!"
