title,content
"서울숲, 성수동 묘사서울","얼마전에 하루종일 성수 투어한 날 갔던 신상 카페, 성수동 묘사서울 후기다. 여기서 묘사란 사물이나 현상을 표현하는 것이니 서울을 묘사한 건가? ㅋㅋㅋ 이름이 특이해서 왠지 더 궁금해졌고요? 성수역에서 걸어가는 것은 무리고 서울숲역이나 뚝섬역에서 걸어갈 수 있다. 현재 정식오픈이 아니라 가오픈 상태다. 아직 가오픈인데도 인기가 상당하다. 11월 4일부터 정식 오픈이라 그 전에는 시간이나 메뉴가 변동될 수 있다고 한다. 도대체 어디에 있다는 거지 하면서 여길 지나갔는데 되돌아보니까 하얀 뭔가가 붙어있었다. 눈을 찡그리며 가까이 다가갔다. 여기구나 ㅋㅋㅋㅋ 이게 아니었다면 절대 카페라는 걸 알 수 없음. 서울숲, 성수동 묘사서울의 영업시간은 12시부터 밤 10시까지다. 주차공간은 없다. 좁디 좁은 주택 골목 안쪽에 있으니 공영주차장을 이용하자. 성수문화복지회관 주차장 서울시 성동구 뚝섬로1길 43이다. 아 이쪽 동네도 많이 바뀌었구나 집에서 가까운 편인데도 잘 안 오게 된다. 올라가서 첫 번째 문이 있는 곳이 아니라 한 층 더 올라가야 한다. 대략 2.5층이라고 생각하면 되려나? 문이 닫혀있는 곳의 문을 억지로 열면 안 되고요? ㅋㅋㅋㅋ 내가 그럴 뻔 했쟈나 ㅋㅋㅋ 예전에 을지로 투피스처럼 그냥 철문이 닫혀있는 게 컨셉인줄 알았지.. 나만 그런 게 아니라 다른 사람들도 1층 문을 열려고 시도하는 걸 봤다 ㅋㅋㅋ 이렇게 문이 열려있고 옆에 간판이 붙어있으니 알 수 있을 것이다. 황송부부가 만든 카페라는데 내가 인스타를 안 해서 알 수가 없는 것.. 아 그런데 건물 계단 쪽 내벽이 이렇게 빨간 벽돌로 되어있는 게 좀 신기하다. 원래 그런가? 이게 로고인가? 묘 사 이렇게 보인다. 한글 로고로 이렇게 독특하게 만든 거 좋아보임. 그냥 남의 집에 놀러온 것 같기도 하고 이사갈 집 보러온 것 같기도 하고 ㅋㅋㅋ 이 집 빛이 잘 드네요 ㅋㅋㅋ 물은 잘 나오나요? 아 화장실은 다행히 내부에 있다. 바닥색은 오묘한... 이 색을 뭐라고 해야지 톤다운된 청록색? 터키색? 찾아보니까 뇌록색이라고 하네 대들보나 서까래에 사용된 색으로 이끼의 색을 표현했다. 뇌록색은 정말이지 처음 들어보는 색인데 오묘해서 마음에 들었다. 저 길다란 건 나무인가 어리둥절 여기도 의자랑 테이블 구분이 좀 어렵긴 하다. 설명에 의하면 옛 건물 구조에 사용됐던 고재를 가져다 쓴 것이라고 한다. 옛것에 대한 흔적과 한국의 정취를 표현하려고 했다고 함. 약간 꿈보다 해몽 느낌이지만 그러려니 하자 강인한 엉덩이를 가지고 있다면 여기에 앉아보자. 나는 그럴 자신이 없었다. 순간 뒤로 넘어지는 상상을 했는데 소름돋았다. 아 이 스피커 예쁘다. 카키색과 원목이 잘 어울린다. 제품명이나 모델은 전혀 모르겠으나.. 음악은 잘 생각이 안 나는 걸 보니 멜론 탑 100같은 건 아니었던 듯 하다. 카페에 잘 어울리는 음악이었다. 이런 반투명한 소재는 한지 사이의 빛을 표현하려고 한 것이라 한다. 오 그러고 보니 약간 문살같아 보이기도 한다. 사람이 하나도 없는 것처럼 찍었지만 사실 사람이 많았다. 다들 나간 찰나에 찍은 것이다. 사람들이 어찌나 많이 오는지 ㅋㅋㅋ 평일 낮인데요 ㅋㅋㅋ 주말에는 매우 북적거릴 것 같쟈나 공간에 사선으로 테이블과 의자를 배치해놓은 게 마음에 든다. 덜 효율적일진 몰라도 이런 재미요소를 찾아보는 걸 좋아한다. 이게 성수동 묘사서울의 전체 메뉴다. 에스프레소나 아메리카노 등 기본 커피가 있고 바닐라 라떼가 있는데 마다가스카르산 바닐라빈을 끓여내 넣는다고 한다. 커피가 아닌 것으로는 레몬에이드, 초콜릿, 티, 말차 라떼, 쑥 라떼가 있고 나는 쑥 라떼로 골랐다. 원래 레몬에이드를 마시려다가 급변경 ㅋㅋ 디저트로는 이 날 붕어와 티라미쑥이 있었다. 사람들이 많이 먹는 동그란 화과자가 이 날 없길래 물었더니 정식 오픈될 때부터 다시 판매될 수도 있다고.. 난 붕어를 주문했다. 티라미쑥을 다른 사람들이 먹는 걸 봤는데 치즈와 쑥크림이 같이 있는 것처럼 보였다. 쑥라떼랑 비슷하게 생겼는데 좀 높이가 낮고 폭이 길다고 생각하면 된다. 저건 뭐야 학교인가? 성수고등학교? 밖으로 이렇게 풍경을 볼 수 있다. 그냥 학교일뿐이지만 주변에 나무들이 많아 좋아보이기도 한다. 그렇지만 이 자리는 단 두 명만 가능 ㅋㅋ 나름 인기많은 치열한 자리같쟈나 콘센트도 있네 여기가 포토존이라고 해야 되나... 느낌 있어 보이지만 앉기는 힘들어보인다. 벽도 똑같이 빈티지하게 노출콘트리트였으면 싫을 뻔했는데 이 정도는 괜찮다고 본다. 저 끄트머리에 앉으면 시소처럼 내려앉을까? 돌이 두 개 있는 건가 잘 모르겠네 두 개가 받치고 있으니까 저렇게 잘 고정되는 거겠지? 와 아이스 쑥라떼 괜찮을까 걱정됐는데 그냥 덥고 힘들어서 먹기로 함 ㅋㅋㅋㅋ 장이 나약해서 차가운 것과 우유에 약하다. 쑥라떼와 바닥의 색이 은근 비슷해보인다. 이렇게 톤을 맞추네 얼떨결에 난 솔직히 이게 맛있을 거라고 생각하지 않았는데 한 모금 먹어보고 놀랐고요? 아니 내가 좋아하는 맛이쟈나 ㅋㅋㅋ 위에 올려진 크림이 고소하면서 달달해서 쑥섞인 우유와 잘 어울렸다. 쑥 특유의 맛도 잘 살렸다. 난 좀 단 맛을 좋아해서 호! 여기 오기 전에 오설록에서 진짜 맛없는 라떼 먹었는데 거기보다 훨씬 나음. 오설록이 원래 그런가? 아무튼 이거 맛있었다. 좀 남긴 이유는 맛 없어서가 아니라 속이 부글거릴까봐 참은 것이다. 안쪽에 커다란 창문이 있다. 여기도 이웃집 뷰 ㅋㅋㅋㅋ 앞에 있는 것은 의자다. 한 쪽에 꾸깃꾸깃 있는 것은 내 가방.. 좀 치우고 찍는다는 것을 깜빡했다. 긴 것이 의자요 작은 것이 테이블이다. 반대로 앉지 말자. 붕어는 붕어빵보다는 음... 붕어싸만코같은 것에 가깝다. 그 붕어싸만코 겉에 있는 바삭바삭한 것? 찹쌀로 얇게 구운 걸까? 위에서 찍으니 잘 안 보이고요 이런 모양이다. 날아올라가는 붕어 모양? 팥으로 고정시켜놓았다. 크기가 붕어싸만코만했으면 좋겠지만 길에서 파는 붕어빵만한게 좀 아쉽다. 틀이 저만한가보지 나무 위에 올려놓고 이렇게도 찍고 저렇게도 찍고요? 1층 2층 이렇게도 찍을 수 있음 이웃사촌처럼 ㅋㅋㅋ 제목 층간소음 언성을 높이는 붕어 ㅋㅋ 나무 위에라도 올려놓고 찍어야 아 여기가 묘사서울이구나 거기 갔구나 알 수 있겠고요 사선이 컨셉이니 나도 사선으로 찍어본다. 평일 낮이라 이렇게 저렇게 찍어볼 수 있었다. 카페는 평일이지 평일 낮에 새로운 카페에 가는 게 제일 재밌다. 음식이 맛있으면 좋고 맛 없어도 어쩔 수 없고요? 매일매일 이렇게 다니면 재밌을텐데 이렇게 카페에 다니려면 돈을 벌어야 하지.. 로또 되게 해주라 로또 사지도 않으면서 매번 소원만 비는 것 뻣뻣한 붕어 칭구칭긔 붕어빵은 왜국에서 들어왔다지만 우리 나라 거가 더 맛있으니까 우리 나라 음식이다. 느그들 고구마 붕어빵 있냐? 걔네도 우리 거를 다 지네 것이라고 우기는데 우리도 못 할 이유가 뭐임? 명란젓이고 김치고 요즘엔 닭갈비도 지들 거라고 하던데 초밥도 우리 고유 음식이다. 오조오억년 전부터 우리 거다. 마지막으로 하얀 테이블.. 아니 의자에 놓고 찍어본다. 다들 나만큼 찍던데 뭐 ㅋㅋ 이제 붕어를 먹어보자. 붕어빵은 아니라서 붕어라고만 해놨나보다. 그 동그란 건 나중에 또 와서 먹어봐야지 난 사실 이것의 맛도 크게 기대하지 않았다. 붕어가 붕어지뭐 아니 근데 이것도 맛있네? ㅋㅋㅋㅋ 이 의외성은 뭐지 속에 든 게 뭔가 하니 버터와 팥이다. 팥버터 붕어인 셈이다. 팥이 조금 들어있고 버터가 많이 들어있어 좋음. 고소하면서도 달달하고 짭짤한데 그 짠 맛의 출처를 알고 싶어 계속 맛을 봤다. 껍데기인가? 껍데기에 소금을 넣은 건지 안쪽에 넣은 건지 잘 모르겠다. 아무튼 단짠을 느낄 수 있었다. 사실 이 날 디저트 많이 먹으려고 점심 안 먹었는데 점심도 못 먹고 이 붕어 하나 먹고 끝냄 크흡 티라미쑥도 먹을걸 그랬다. 쑥맛 좋아해서 괜찮았을 것 같은데 묘사서울 재생 0 좋아요 0 00:00 00:00  묘사서울 부분부분을 찍어 이어놓은 영상이다. 분위기가 궁금하면 참고하시고요? 별로 대단히 특별할 건 없지만 음료나 디저트도 맛있고 생각보다 마음에 드는 공간이었다. 큰 기대없이 한 번쯤 와보면 좋겠다. 50m © NAVER Corp. 묘사서울 서울특별시 성동구 서울숲2길 2 2층 #묘사서울 주소: 서울특별시 성동구 서울숲2길 2 2.5층 전화번호: 070-7576-0840 #서울숲 #성수동카페 #신상카페 #성수동묘사서울"
성수동 서울숲카페 묘사서울,"색감도 인테리어도 디저트도 감각적인 서울숲카페 묘사서울 서울숲 제일 안쪽 골목에 멋진 감각을 자랑하는 카페가 있어요 색감도, 인테리어도, 디저트도 예사롭지 않을만큼 매력적인 성수동 서울숲카페 묘사서울 그레이트커피와 아주 가까운 곳에 있어요 두 곳 모두 창밖 풍경이 예술인 곳 카페의 바닥 색감이 특히 좋아요 플랫화이트 단독샷으로 스타트 말차라떼와 모나카 음료랑 디저트가 워낙 이뻐서 오늘은 카페 인테리어보다 음료랑 디저트를 먼저 보여드려요 ^o^ 붕어 붕어빵 아니고 모나카에요 맛도 좋은데 이쁘기까지 깨알같이 팥으로 붕어를 세워놓았어요 이런 디테일 좋아요 한상차림 어쩜 이렇게 고울 수가 작품같자나~~~ 메뉴판에도 품격이 커피바의 품격 신기신기 창밖으로 보이는 가을 풍경 자그마한 테이블 테이블이 아주 많지는 않아요 묘사 이렇게 생긴 건물의 2층에 있어요 이렇게 끝낼 줄 알았겠지만 이 후에도 몇번이나 더 갔기 때문에 다른 사진을 또 보여드려요 ^^; 사람들이 많지 않을 시간이어서 텅빈 공간을 찍어봤어요 역시 카페에는 사람이 좀 적어야해 ^^; 의자 참 특이하죠 멋스럽다고 할 수 밖에 비싼 스피커 지난 번 보다 (?) 좀 더 많은 공간을 보여드리고 있어요 다른 날의 가을 풍경 플랫화이트 커피도 수준급 맛있어요 또 다른 날의 커피 커피 커피 붕어랑 모나카 이외에 이젠 양갱도 있어요 성수동 서울숲카페 묘사서울 전화: 070-7576-0840 주소 위치: 서울 성동구 서울숲2길 2 2.5층 영업시간: 12:00 ~ 22:00 성수동 서울숲카페 묘사서울 주차: 안돼요 50m © NAVER Corp. 묘사서울 서울특별시 성동구 서울숲2길 2 2층"
성수동 분위기 좋은 카페 Best !서울숲 묘사서울 • 카페 차(ㅊa) • 성수 쎈느(Scene) 아르코(arco),"언제가도 가야할 곳들로 넘쳐나는 #성수동카페 다양한 컨셉에 분위기 좋은 카페들로 갈때마다 설레인다. 사회적 거리두기에 이은 생활적 거리두기까지 한동안 외출을 자제하다보니 그새 가고픈 카페리스트만 한가득~ 간만에 콧바람도 쏘일겸 서울숲으로 피크닉 가는 길에 찜해뒀던 #성수동분위기좋은카페 중 3곳을 가보았다. 📌 은나라가 추천하는 분위기 좋은 카페추천, 성수동 카페 Best 3 1. 사진 한장에 반해서 찾은 비주얼 카페, #성수묘사서울 2. #이영자달고나밀크티 맛집으로 유명한 #성수차 #ㅊa 3. 편집샵으로 카페와 한꺼번에 즐길수 있는 #성수아르코 #성수쎈느 당신의 선택은 과연 어떤 곳일까? 붕어빵도 남다르게 느껴지는 #성수동카페 #묘사서울 정갈함과 너무 예뻐 먹을수 없을 것만 같은 사진 한장에 반해 찜해뒀던 이곳은 서울숲 산책하며 들르기 좋은 곳에 위치해있었다. 주택가에 자리한 이곳은 창 너머로 학교가 보이고 마치 옆집에 놀러온 것 같지만 남다른 내부 인테리어로 문 하나 사이로 순간이동을 하는 느낌이였다. 우리집근처에도 이런 곳 하나 있음 너무 좋겠다~ 싶을정도로~ ㅎㅎ 화이트톤에 대들보와 돌기둥 등 한옥재들을 가구로 활용해 테이블이나 의자로 사용하고 있었다. 어쩜 이런 분위기를 연출할 생각을 했을까? 공간과 너무 잘 어울리면서도 깔끔함이 돋보였다. 다만 테이블 높이가 낮고 의자가 편해보이지 않는다는 단점이 있지만 일단 보기엔 너무 감각적! ㅎㅎ 붕어 4,300원 / 앙 큐브 5,000원 / June 7,000원 붕어와 4가지 앙큐브 그리고 6월 음료인 흑임자라떼 붕어말고 다람쥐도 있어서 뭘 먹어야하나 고민했는데.. 다람쥐는 시즌 한정메뉴로 지금은 맛볼수 없다고해서 고민없이 붕어와 앙 큐브로 선택! 나무 모양 테린느와 동그라미라는 메뉴가 있어 다음엔 맛보지 않은 메뉴로 선택해봐야겠다. ㅎㅎ #성수카페 #묘사서울 시그니처 음료인 쑥라떼와 인기메뉴인 뽀또치즈 맛도 궁금하다. 성수동 카페, 서울숲 가는길에 찾음 좋은 성수 묘사서울 🐟 재생 56 좋아요 1 00:00 00:09  접기/펴기 성수동 카페, 서울숲 가는길에 찾음 좋은 성수 묘사서울 🐟 비주얼 최강이였던 묘사서울 디저트들~ 속이 알찬 붕어도 앙 큐브도 많이 달지 않아서 좋았고 특히 큐브양갱은 재료 본연의 맛이 느껴지는 깊은 맛이라 좋았다. 흑임자라떼랑도 잘 어울리고~ 그야말로 여심저격! 보기에도 찍기에도 너무 예뻤던 디저트와 공간들! 다만 조금 비싼 가격이 아쉽지만 그럼에도 한번쯤 찾아볼만한 곳이였다. ㅋㅋ 묘사서울 서울특별시 성동구 성수동1가 685-486 2층 비주얼에 반한 여심저격 성수카페 묘사서울 영업시간 : 매일 12시 ~ 22시 위치 : 서울시 성동구 서울숲2길 2 2층(뚝섬역 8번출구 600m) 주차 : 주차공간 No, 근처 공영주차장 이용 comment : 예쁘고 공간도 좋으나 가격대가 청담! 비싼게 아쉽다. #전참시 #이영자밀크티맛집 으로 방송에 나오면서 핫했던 #성수동카페차 #ㅊa 그 옛날 삼성제분이였던 건물을 카페공간으로 재해석한 카페 ㅊa는 얼마전까지 줄서서 먹는 맛집이였다. 다들 찾는데는 이유가 있겠지 싶어서 찜해뒀던 곳인데 요즘 한산하다고 해서 찾아봤다. 언제나 방송 직후가 가장 북적이는 법! 이제는 언제든 오가며 편하게 마실수 있어 딱 좋았다. ㅋㅋ 카페투어만 아니면 한병 사오고 싶었던 ㅊa 밀크티와 달고나 듬뿍 올라간 스콘과 마들렌도 시선을 사로잡았다. 바 테이블과 바를 바라보며 앉을수 있는 깔끔하고 심플한 공간으로 특별함은 오직 달고나뿐이였다. ㅎㅎ 달고나 만드는 모습이나 스콘위에 올리는 모습 보고싶었는데... 예전보다 손님이 많지 않아선지 만드는 모습을 볼 순 없었지만 궁금하긴 했다. 코로나 시작되고 집콕하면서 달고나도 만들어보고 #달고나커피 도 만들어봤지만 이렇게 고운 빛깔의 두툼한 달고나는 만들지 못했기에 그 방법이 궁금했다. ㅋㅋ 달고나밀크티와 달고나 올린 마들렌 제법 많은 달고나가 올라갔음에도 생각처럼 달지 않은게 마시기 딱 좋았던 #달고나밀크티 오히려 다른 곳에서 파는 밀크티보다 덜 달았다. 오~ 이래서 #밀크티맛집 이라고 소문난건가? 마들렌도 위에 올라간 달고나로 바삭한 식감까지 더할수 있어 재밌었다. 스콘도 맛볼껄~ ㅎㅎ 생각했던 것보다 달지 않아 좋았던 성수 ㅊa 달고나밀크티 다음에는 달고나커피랑 달고나 스콘도 맛봐야지~ 아메리카노 마시면 달고나를 따로 내주던데.. 여럿이 가서 이것저것 맛보면 좋을 듯 하다. ㅎㅎ 카페 차 서울특별시 성동구 성수동1가 685-408 이영자도 반한 달고나밀크티맛집 성수카페 차(ㅊa) 영업시간 : 10시 ~ 22시 위치 : 서울시 성동구 서울숲6길 2(뚝섬역 8번출구 400m) 주차 : 도보 5분거리 ‘성동구민종합체육센터’ 에 공용주차! 문앞에 한두대정도 가능하긴하다. comment : 방송초 줄서서먹을정도였으나 지금 한산하고 찾기 딱좋다. ㅎㅎ 트렌디란 편집샵으로 핫한 성수 카페, 쎈느 • 아르코 #성수쎈느 (Scene)는 무대라는 뜻으로 1층은 베이커리 #카페아르코 (Arco)가 2층은 국내외 디자이너 브랜드의 의류를 선보이는 복합공간이다. 안이 훤하게 들여다보이는 통유리 외관에 넓은 야외 테이블 그리고 넓은 주차공간까지~ 성수동에서 쉽게 볼수 없는 규모로 사람들도 많았다. 문을 열고 들어서면 #성수아르코 포토라인 원형계단과 함께 사방이 뚫린 2층 공간이 펼쳐진다. 다양한 먹거리로 브런치 카페로도 손색없었던 #성수arco 마지막 코스로 찾지 않았다면 케이크나 스콘이라도 맛봤을텐데.. 다음에 브런치 먹으러 다시한번 찾아야겠다. ㅋㅋ 베이커리 종류 이외에도 이탈리안 카푸치노, 플랫화이트, 아인슈페너, 티라미수라떼, 아이리쉬커피까지 다양하게 맛볼수 있었다. 특히 쎈느 시그니처 블라썸 칵테일 커피와 오렌지시럽에 에스프레소와 우유를 넣은 오렌지 라떼는 어떨지~ 이번에는 분위기만 즐겨봤는데 아무래도 다음에 다시가서 이것저것 맛봐야할 것 같다. ㅋㅋ 생활적 거리두기가 실천되고 있는 요즘, 핫해선지 사람들로 북적여서 살짝 거리를 둬야할 필요가 있어서 한산해질때를 기다려야할 듯하다. 아무래도 주차하기도 편하고 커피도 맛있어서 인기있을수 밖에 없지만~ ㅎㅎ Scene 서울특별시 성동구 성수동2가 314-2 핫한 편집샵, 성수아르코 + 성수쎈느 영업시간 : 평일 08시 ~ 22시 / 주말 10시 ~ 23시 위치 : 서울시 성동구 연무장5길 20(성수역 4번출구 200m) 주차 : 매장앞에 바로 할수 있다. comment : 힙한 분위기에 예쁘지만 늘 너무 북적북적 생활적 거리두기가 필요한 이시기에는 거리두기가 필요할듯! 성수동 분위기 좋은 카페, 성수 아르코 & 쎈느 재생 0 좋아요 0  접기/펴기 성수동 분위기 좋은 카페, 성수 아르코 & 쎈느 비주얼 최강의 서울숲 카페, 성수 묘사서울 전참시 이영자맛집으로 유명한 달고나밀크티로 유명한 성수카페 차(ㅊa) 편집샵으로 아르코 베이커리 카페와 쎈느 의류샵을 한꺼번에 즐길수 있는 #성수카페 쎈느(Scene) 아르코(arco) 세곳 모두 다른 분위기의 다른 먹거리로 보는 재미에 먹는 재미까지 누렸던 분위기 좋은 #성수동카페 은나라가 추천하는 카페 Best 3. 이웃 여러분들은 어디가 제일 끌리셨나요? 이번 주말, 성수동 카페투어를 계획하고 있다면 위 세 곳에서 즐거운 시간되길 바래본다."
[성수동] 묘사서울,"맨날 동네에서 메가커피만 가다가 아주 오랜만에 예쁜 카페, 맛있는 디저트가 먹고 싶었어요. 공간 구경하는 걸 좋아하고 맛있는 커피도 좋아하는데 코로나가 무엇인지 자꾸만 집에만 있게 만들더라고요 ㅠㅠㅠㅠ 예전부터 가보고 싶어서 휴대폰 사진첩 '가봐야하는 곳'에 저장되어 있던 묘사서울에 다녀왔어요. 묘사서울 입장하자마자 분위기에 허허허허허. 느므 좋아요 벌써 좋아요! 커피와 디저트를 주문해요. 주문할 때 음료와 디저트에 대해서 하나하나 아주 상세하고 친절하게 설명해 주는 시스템에 또 한번 허허허허허. 판매하는 음식에 대한 대단한 애정이 있어야 가능한 일일텐데, 정말 마음에 들었어요. 공간도, 설명도, 모두 다 말이죠. 시즌별 메뉴를 계속 준비하시는 것 같더라고요. 제가 갔을 땐 호랭이가 주제였어요! 호랭이는 모나카예요. 옛날엔 모나카 많이 먹었잖아요. 요즘 디저트로 모나카라니. (너무 좋아요!) 동글동글 디저트는 이름이 기억나지 않지만 적당히 달달하니 좋은 맛이에요. ... 이래서 다녀오면 바로 바로 적어야 합니다앙. 제가 방문했을 때 1주년이었어요. 꿀떡도 함께 주셨는데, 이 곳에선 꿀떡마저 뭔가 예뻐보이는 느낌이에요. 공간이 이렇게 중요합니다. 여기저기 사진 찍고 싶은 구석구석이 많았는데 사람이 너무 많아서 그저 눈에만 꼭꼭 담고 왔어요. 한가한 시간이 있을까, 모르겠지만 꼭 다시 방문해서 그때의 시즌메뉴를 맛보고 싶어요. 이왕이면 큰 창 너머로 눈이 오는 계절이면 좋을 것 같아요:)"
성수동 카페거리 : 신상카페 ' 묘사서울 ',"성수동 카페거리 핫플 카페 묘사서울 요즘 인싸 핫플로 꼽히는 성수동 카페 중 하나 묘사서울을 다녀왔다. 성수동 카페거리 제일 안쪽 골목 꺽고 들어가면 오래된 빌라 2층에 자리하고 있다. 주차정보 : 성동구민종합체육센터 성수동 카페거리는 원체 좁아서 주차장을 보유한 가게가 없다. 그래서 성동구민종합체육센터 검색해서 주차하면 된다. 카페거리 구경하다 도착한 묘사서울 카페 입구. 심플하고 묘하게 끌리는 가게 싸인. 음료나 디저트가 이색적이었고, 사진을 너무 예쁘게 나와서 오고 싶어서 왔는데... 막상 내부 공간을 딱 보자마자 드는 생각은 정말 단순하다. 마치 그림을 그리기 전 하얀 도화지 같은 곳이었다. 그리고 음료를 주문하고 알았다. 왜 이 공간을 이렇게 꾸미셨는지... 주인공은 주인장 부부가 개발한 디저트와 음료이기 때문에 인테리어는 그 배경에 불과했다. 그래서 지극히 단순하고 단순했다. 단 단순할지언정, 오래된 고택에 대들보 역할을 했었을 법한 나무들을 테이블로 의자로 활용해서 묵직한 포인트가 됐다. 창문들은 저마다 액자 프레임 같았다. 카페 사장님께 이것 저것 여쭤보니 상세히 친절하게 설명해주셨다. 시즌별로 젊은 사장님 부부가 직접 시럽, 소스, 디저트를 개발하고 판매하신다고... 아무래도 두 분 디자인 전공하신 듯... 빙쑥도 먹어보고 싶었는데... 다음을 기약하며... 나는 쑥라떼와 기본 라떼를 주문했다. 디저트로는 붕어를 시킬까 고민하다 호랑이모나카로 결정! 이거 급하게 마시고, 우린 제스티살룬 가서 버거를 먹어야하므로 디저트는 하나로 만족! 짠! 드디어 마주한 묘사서울의 시그니처 메뉴들. 일단 쑥라떼는 너무 맛있어서 한모금 쭈욱 들이키니 반이나 훅 내려앉았넹... 근데 호랑이 모나카를 받치고 있는 녹색 양갱크림인가? 이 둘의 조합이 넘 이색적이고, 개성이 넘쳤다. 카페계의 혁명처럼 느껴졌다. ㅋ 그래서 카페도 아무나 여는게 아닌 듯 이 정도 부단하고 치열한 고민과 열정이 아님 살아남기 힘든 세상이 됐네... 가게 오픈하자마자 주문을 넣은터라 카페안은 우리일행 뿐이었다. 그래서 여기저기 옮겨다니면서 사진촬영을 ㅋㅋㅋ 이래서 인테리어를 이렇게 하셨나봄. 어디다 갖다놔도 호랑이모나카 너의 존재감은 충분했다구~ 게다가 땅콩카라멜 크림이 안에 들어있어서 넘 맛있다. 어흥~ 범 내려온다 ~ ♪ 이번엔 라떼! 진한 커피와 우유의 조합. 잘 먹구, 잘 마시고 갑니다~ 50m © NAVER Corp. 묘사서울 서울특별시 성동구 서울숲2길 2 2층"
