title,content
성수동 묘사서울 : 퓨전 한식 디저트 카페,"성수동 묘사서울 : 퓨전 한식 디저트 카페 주말에 마장동에 볼일이 있어서 들렀다가 점심 먹고 멀지 않은 성수동에 다녀왔어요 가보고 싶은 카페가 많은 곳인데 멀기도 하고 주차도 어려워서 생각만 가득했었거든요 날씨도 푸근해서 공영주차장에 주차하고 가보고 싶었던 카페를 두 군데나 들렀는데 귀여운 디저트가 있는 #성수동카페 #묘사서울 부터 보여드릴게요 주차는 성수 2동 3주차장인 공영주차장에 하고 (5분당 100원/ 주차하는 데 30분 걸렸어요) 조금만 걸어갔는데 간판이 없어서 조금 헤맸어요 성수동 카페 묘사서울 을 알려주는 sns에서 많이 보았던 디저트 사진! 2.5층이라는 것도 신기합니다 2층에 무슨 매장인지 카페가 있고 반층을 더 올라가면 일반 주택의 문 같은 게 보이는데 상호도 특이하게 쓰여 있어요 요즘은 뭔가 튀던가 새로운 디저트가 있던가 공간이 근사하던가 그런 특별함이 있어야 하는 것 같네요 #묘사 상호도 어쩜 이렇게 쓰셨을까요? 실내를 들어가 보고 다시 한번 놀랐어요 성수동 카페 대부분이 그렇듯이 주택을 개조한 것 같은데 길쭉하고 공간이 넓지는 않지만 인테리어랑 테이블과 의자 등도 나쁘지 않았다는 거요 조그마한 공간에 실내에 화장실이 있는 것도 마음에 들었답니다 주방도 자그마한 공간인데 다른 카페들처럼 판매 중인 디저트들도 하나도 안 보이네요 커피 머신은 #FAEMA #훼마 를 사용하시는군요 안쪽에 주방용 소품들이 살짝 보여요 어떤 디저트가 있을까? 과연 있기나 할까?라는 호기심도 은근 생기더라고요 제네바 스피커는 있어서 웃었어요 음악이 좋았던 기억이 나네요 성수동 묘사 서울의 메뉴는 커피부터 티랑 에이드에 네 종류의 디저트가 있어요 커피는 제법 종류별로 있고 라테류는 홍차, 쑥, 인절미, 흑임자 등등 다양해요 체리 밀크티랑 블루베리 밀크티도 보통은 접할 수 없는 것 같고요 2022년 2월 디저트라고 쓰여있는데 3월에도 여전히 똑같았어요 곰돌이, 흑호(흑임자 호랑이?) 거기에 쑥 케이크 등이 있어요 크지 않은 공간인데 배치를 잘 하셔서 테이블과 의자가 제법 있고 손님들도 계속 들어오는 #성수동핫풀 입니다 의자 밑에는 겉옷이나 백을 넣을 수 있는 바구니랑 방석이 들어 있어요 메뉴를 주문하고 계산을 하면 알아서 테이블로 가져다주신답니다 너무 이뻐서 사진을 어찌나 찍었던지요 어쩜 이렇게 귀여울 수가 있을까요? 쑥 라테 - 7,000원 #쑥라테 는 시그니처 음료 같아서 주문했는데 글라스에도 상호가 적혀 있어요 카페라테 - 5,500원 신랑은 말해 뭐해요? 카페에 가면 90%는 #카페라테 죠 깔끔하고 단아한 커피잔에 라테아트도 이쁜데 커피 맛도 좋다고 했어요 붕어 앙버터 - 4,300원 동그라미(4개) - 5,000원 손으로 동글동글 #경단 을 빚은 것처럼 만든 네 가지 맛의 #앙금 으로 비주얼 어쩔!! 메뉴판에 있던 흑호랑이는 잘 모르겠고 테이블마다 이거 아니면 곰돌이 앙버터를 시키시는 듯요 얘는 붕어 앙버터에요 똑같은 사진이지만 가로로 찍고 세로로 찍고 정말 그냥 먹기 아까운 마음.... 쑥 향이 너무 강하지 않아서 취향에 맞았던 시원한 쑥 라테 선택을 잘 한 것 같아요 #인절미 라테도 궁금해지더라고요 동그라미라는 이름을 가진 귀요미 #한식디저트 (#퓨전한식디저트 )는 하나씩 가져다 먹는 재미가 있고 맛이 다 틀려서 더 궁금했어요 #흑임자 동그란 모나카를 반으로 자른 후에 생크림을 담고 그 안에 흑임자로 빚은 흑임자 앙금 살짝 달콤하면서도 묘한 매력이 있는데요? #와사비 제일 궁금했던 와사비 앙금인데 끝에 와시비 특유의 맛이 느껴지면서 제일 맛나게 먹었던 것 같아요 아이디어 정말 칭찬합니다! #치즈 치즈라니요 치즈 앙금이라니 이것도 특이했어요 색감도 오렌지색인데 정말 치즈 맛이 나요 느끼하지 않고 짭조름하긴 했지만 와시비 다음으로 맛났던 아이~~ #자색고구마 재료 선택도 참 잘 하신 것 같아요 동그라미 4개 모두 색감이 눈에 뜨이고 조화로우면서도 화려하고 귀엽거든요 자색 고구마는 달달한 자색고구마 맛 신랑이랑 하나씩 수저에 담아서 서로 반개씩 나누어서 먹는 재미가 쏠쏠했던 성수동 카페 묘사 서울의 디저트에요 얘는 붕어 #모나카앙버터 랍니다 밑부분을 팥으로 고정시켜서 플레이팅 반으로 커팅 하면 마치 #모나카아이스크림 처럼 보이지만 사실은 버터에 팥소가 들어가 있어요 버터와 팥소의 조합은 말이 필요 없죠 지난번에는 을지로 카페 적당에서 #백설기 앙버터를 맛나게 먹었는데 이번에 성수동 카페 묘사 서울에서는 특이하게 #붕어빵 모나카 앙버터를 정말 맛나게 먹어보았어요 총평 묘사는 필자의 의도를 가리키기도 하고 작품을 쓰는 방법을 뜻하기도 한다죠 묘사가 잘 된 작품은 생동감을 주는데요 디저트에서 정말 생동감이 느껴졌어요 그래서 상호를 그렇게 지으신 건지는 잘 모르겠지만 우리 한식의 재료로 음료랑 디저트를 만들어냈지만 비주얼도 여성의 마음을 사로잡는 귀엽고 사랑스럽고 가격도 좋고 맛도 좋아서 기분까지 좋아졌던 성수동 묘사 서울 잘 다녀왔습니다 성수동 카페 묘사서울 사랑스러운 퓨전 한식 디저트 재생 60 좋아요 3 00:00 00:24  접기/펴기 주택가를 개조해서 만든 앙증맞고 맛있는 퓨전 한식 디저트가 있는 성수동 묘사서울 https://www.instagram.com/myosa_seoul/ 묘사서울ㅣCoffee for Thought(@myosa_seoul) • Instagram 사진 및 동영상 팔로워 5,050명, 팔로잉 2명, 게시물 376개 - 묘사서울ㅣCoffee for Thought(@myosa_seoul)님의 Instagram 사진 및 동영상 보기 www.instagram.com 50m © NAVER Corp. 묘사서울 서울특별시 성동구 서울숲2길 2 2층 전화번호 - (010) 5594 - 9151 영업시간 - 12:00 ~ 22:00 휴무일 - 연중무휴 주차 - 근처 유료주차장 이용 유아 동반 가능 반려동물 동반 불가능 ★ 커피사랑경화 성수동 카페 묘사서울 #성수동카페 #묘사서울 #성수카페 #성수묘사 #한식디저트카페 #퓨전한식디저트 #커피사랑경화카페"
성수동 서울숲 카페 묘사서울 빙수,"안녕하세요 여행 인플루언서 스텔라 트래블입니다. 너무 더워진 요즘, 빙수가 저절로 생각나는 계절이 왔어요! 맛있고 보기 좋은 빙수집 어디 없나 찾다가 발견한 서울숲 카페이자 성수동 카페인 묘사서울. 서울숲은 서울숲 성동구 성수동에 위치한 공원인데요. 뚝섬역에서 내려 서울숲으로 가기까지 넓게 카페거리가 펼쳐져 있어요. 오늘 저는 그중 디저트 맛집 묘사서울에 다녀왔어요. 기본 정보 묘사서울 주소 서울 성동구 서울숲2길2 2층 영업시간 매일 12:00 ~ 22:00 연중무휴 문의 010-5594-9151 지도 묘사서울 서울특별시 성동구 서울숲2길 2 2층 주택 골목 사이사이 카페가 위치한 성수동 서울숲 카페들. 빨간 벽돌 건물 주택가가 근린상가로 변한 모습들을 볼 수 있어요. 묘사 서울 또한 기본 빨간 벽돌 외관을 그대로 유지하고 있는 곳이었어요. 주택가에 위치해있어 주차장은 따로 없어요. 근처 유료주차장을 이용해야 합니다! 외관에 조용하게 이곳이 모나카와 양갱 빙수를 파는 곳임을 알려주고 있어요. 이게 바로 요즘 성수 핫플 분위기 아니겠어요? 많은 분들이 인터넷에서 찾아오는 곳이지 않을까 싶어요. 묘사서울은 2층에 위치해있어요. 1층은 다른 업장이니 조심하세요! 살짝 헷갈리더라고요 ㅎㅎ 2층에 올라왔는데, 문이 닫혀 있는 거 아니겠어요? 문 닫았나,,? 싶었는데 운영 중이었어요 ㅋㅋ 금색 철문 열고 들어가면 됩니다!! 이게 바로 성수동 바이브 내부 꾸민 듯 안 꾸민듯한 느낌이 드는 카페에요. 인테리어에 힘을 많이 주기보다는 살짝 뺀 느낌이었어요. 아늑하고 편안한 분위기로 꾸며져 있어요. 다만 여기 의자와 테이블이 같은 높이라 디저트 먹기 편하지 않았어요. 빙수를 먹는데 수저는 작은데 테이블은 너무 낮고..ㅋㅋ 먹기가 불편했어서 테이블 높이가 낮은건 살짝 아쉬웠네요 ㅎㅎ 메뉴 묘사서울은 다양한 디저트 메뉴가 있어요. 대표 디저트는 바로 동물 모양 모나카! 총 5가지 종류로 붕어, 나무, 원숭이, 곰(각 4,800원)과 앙큐브(5,000원)가 있어요. 완두 빙쑥과 흑임자 땅콩 빙수 위에 원하는 디저트 모나카 올려서도 드시더라고요! 포인트로 좋을 것 같아요 ㅎㅎ 저는 원숭이 모나카가 이미 올라간 카레 바나나 빙수로 주문했어요. 가격은 14,000원이에요. 카레+바나나+원숭이 조합이라뇨?!! 이외 흑임자 라떼가 인기가 많더라고요! 음료 가격은 5,000원 ~ 7,500원 사이 가격대에요. 아메리카노는 5,000원이네요. 카레 바나나 빙수 등장 귀여운 원숭이 뭐냐고요..ㅠㅠ 너무 귀엽잖아요!!! 카레 바나나 빙수라 진짜 카레맛이 나려나? 했는데 정말 맛이 나더라고요 ㅋㅋ 첫맛이 바나나 향과 바나나맛이 난다면 끝 맛은 카레맛이 나는? 먹다 보면 중간중간 카레향이 확 돌 때가 있었어요. 카레맛이 빙수와 잘 어울려 맛있게 먹었어요! 바나나맛은 진하게 난답니다! 굿 ㅎㅎ 자꾸 사진 찍는데 넘어가려고 하더니 결국 넘어가버림 ㅋ 잘 가라 밖에서 햇살이 들어와 약간 역광이어서 사진이 잘 나오더라고요 ㅎㅎ 사진 너 맘에 든다 모나카부터 먹기 시작! 원숭이 모가지 반으로 갈랐어요. 안에 앙금이 꽉 차있더라고요. 달달한 모나카였어요. 성수동 서울숲 카페 묘사서울 성수에 다녀왔는데요. 바로 옆이 서울숲 연결통로라 서울숲과 함께 들리기 괜찮겠더라고요. 카레 바나나 빙수도 위에 올려져 있는 원숭이 모나카가 너무 귀여워 맛있게 잘 먹었어요 ㅎㅎ 제 블로그에 들려주셔서 감사합니다~"
"서울숲 디저트 카페, 할매 입맛 모여라 성수동 흑임자빙수 묘사서울","묘사서울ㅣCoffee for Thought(@myosa_seoul) • Instagram 사진 및 동영상 팔로워 6,052명, 팔로잉 0명, 게시물 492개 - 묘사서울ㅣCoffee for Thought(@myosa_seoul)님의 Instagram 사진 및 동영상 보기 www.instagram.com 📌𝗶𝗻𝗳𝗼𝗿𝗺𝗮𝘁𝗶𝗼𝗻 010-5594-9151 서울 성동구 서울숲2길 2 2층 매일:12:00~22:00 📃𝗠𝗘𝗡𝗨 화이트 아인슈페너 7.0 아이스 쑥 라떼 7.0 흑임자 땅콩 빙수 12,0 50m © NAVER Corp. 묘사서울 서울특별시 성동구 서울숲2길 2 2층 근처 뚝섬유수지 공영주차장 이용해주세요! 5분당 150원 할머니 입맛 모여라~!!! 성수동 카페에서 핫한 곳 중 하나인 묘사서울은 쑥,인절미,모나카 등등 할매입맛을 저격한 디저트들이 판매하고 있는데요! 예전에 서울숲 디저트 카페에서 모나카를 먹고 반했는데 이번에는 흑임자빙수도 개시를 했다고해서 늦은 저녁에 먹으러 다녀왔슴다❣°ʚ(❛ั ᴗ ❛ั)ɞ°❣ 근데 아무래도 서울숲~성수 이 쪽은 주택가들에 카페들이 많기 때문에 다소 길 찾기가 어려우실텐데 일단 뚝섬역 8번 출구로 나와 성수현대아파트를 제일 먼저 찾아주세요! 그럼 아파트를 지나 마크 69를 지나 골목 안쪽으로 들어오면 간판 없는 묘사서울이 나옵니다! 주택가에 위치해있기때문에 주차는 공영주차장을 이용해주는 것이 좋고 간판이 아주 작기 때문에 두 눈 크게 뜨고 보셔야해요!! 저도 전에 방문했을때 지도상 위치가 여기가 맞는데 자꾸 안 보여서 삥삥 돌았습니다;ㅎ 저녁 9시쯤 방문했는데도 사람들이 다들 무더위를 피하러 온 건지 사람들이 엄청 많았어요! 옛날 가정집 같은 분위기면서도 모던한 느낌으로 약간 쇼룸같은 분위기라 사진 찍기도 너무 좋고.. 또 뭔가 옛스러우니까 괜스레 정겨우면서도 추억 가득한 공간 같았어요 ㅋㅋ 메뉴판 묘사서울은 커피를 좋아하는 사람들도 그리고 논커피를 즐겨하는 사람들도 좋을만큼 메뉴들이 엄청 다양한데요! 이렇게 태블릿으로 메뉴들이 하나씩 소개돼서 어떤 구성으로 나올지 눈으로 확인할 수 있다는 점이 좋았어요! 보기만 해도 시원해보이는 티, 에이드 서울숲 디저트카페에서만 볼 수 있는 모나카 디저트! 심지어 빙수와 같이 주문하면 천원 할인과 센스있게 사진과 같이 빙수 위에 콕 올려주고 있답니다! 예전에 동글동글 귀여운 모나카도 먹었던거 같은데 시즌별로 매번 바뀌는거 같았어요! 화이트 아인슈페너 7.0 아이스 쑥 라떼 7.0 흑임자 땅콩 빙수 12,0 할매 입맛을 저격해줄 쑥 라떼 등장ㅋㅋㅋ 약간 할머니댁 툇마루에서 먹는 듯한 느낌이라 음료랑 아주 잘 어울렸는데요! 예전엔 쑥 라떼라는게 다소 생소했는데 요즘은 할매 입맛들이 많아서 종종 생기고 있는 것 같았어요! 맛은 진하지만 씁쓸한 느낌은 딱히 없고 먹으면 먹을 수록 고소하기에 맛있었답니다! 요 메뉴는 화이트 아인슈페너라고 아래에 얼그레이 시럽이 깔려있으며 약간 카라멜 맛도 나고 부드러운 크림맛이랑 먹으면 먹을 수록 굉장히 당 충천 되는 맛이었어요! 기분 안 좋을때 먹으면 딱일 듯한 메뉴ㅋㅋ 그리고 대망의 묘사서울의 흑임자빙수! 이걸.. 먹기 위해 이걸 썼다고 해도 과언이 아닐 정도로 진짜 너무 궁금했고 반했던 메뉴였어요 ㅋㅋㅋ 사실 흑임자에 관심이 없었는데 진짜 고소하고 맛있다고 해서 걍 눈 한번 딱 감고 먹어봤더니 인생 빙수 될 정도로 ;;;; 최고였네요 곱게 갈린 우유 빙수 위로 꾸덕한 흑임자 페이스트 한입 딱 떠먹으면 그렇게 달지도 않고 고소하고 담백하고.. 흑임자의 진한 맛이 잘 어울러져서 맛있었어요! 다들 더워서 테이블 당 빙수가 하나씩 있었는데 왜 그러지 알 정도라 꼭 서울숲 디저트 카페를 간다면 이것만큼은 먹어주시길 바라겠습니당ㅋㅋㅋ 다만 숟가락 크기는 조금만 더 컸으면 좋았을.. 크고 많이 퍼먹고 싶어요( •̀ o •́ ).. 근데 거의 마감시간이 다가왔는데도 사람이 계속 방문하는 것도 모자라 쿠팡 이츠 배달분들이 막 ㅋㅋㅋ 혼자 일하시는데 굉장히 바빠보이시더라구여.. 그치만.. 성수동 사람들은 좋겠습니다 이 맛있는 디저트를 매일 먹을 수 있으니깐요 ㅋㅋ 묘사서울은 잠실에도 생겼다고 하니까 조만간 거기서도 한번 먹어보고 둘이 어떤지 비교해봐야겠슴다^0^ 서울숲 디저트 카페, 할매 입맛 모여라 성수동 흑임자빙수 묘사서울 재생 0 좋아요 0  접기/펴기 서울숲 디저트 카페, 할매 입맛 모여라 성수동 흑임자빙수 묘사서울"
[서울숲 맛집] 분위기 힙한 성수동 디저트 카페 추천 :: 묘사서울,"안녕하세요. 허니킴입니다. 오늘은 오랜만에 서울숲 맛집 추천 후기 돌아왔답니당. 바로 분위기 힙한 성수동 디저트 카페 찾으시는 분들께 추천해 드릴만 한 맛집 묘사서울인데요. 원래 꼭 가보고 싶었던 곳인데 인간 비타민 동생이랑 서울숲에 갔다가 늦게까지 하는 카페를 찾다 들러보게 되었답니다. 솔직한 내돈내산 추천 후기이니 믿고 봐주세요 ㅋㅋ 그럼 리뷰 보러 가실까요? 가보자고~~ 묘사서울 📍위치 : 서울 성동구 서울숲2길 2 2층 ☎️ 연락처 : 010-5594-9151 🕓 영업시간 : 매일 12:00 ~ 22:00 묘사서울 위치, 주차 서울숲 맛집 위치는 지하철 2호선 뚝섬역 8번 출구 또는 수인분당선 서울숲역 5번 출구 근처지만 엄청 가까운건 아니고 거리가 좀 있어요. 그리고 흡사 가정집 대문처럼 생긴 비주얼에 건물을 보고도 제가 온 건물이 맞는지 몇번이나 재확인 했답니다. 닉스마이돌리라고 적혀져 있는 건물 2층에 위치해 있어요. 주차 불가능하고 인근 유료주차장 이용하셔야합니다. 분위기 힙한 성수동 디저트 카페 묘사서울 사실 서울숲, 성수동에 분위기 힙한 카페 너무 많지만 여긴 분위기가 정말 독특한데요. 처음엔 ""엥 나 잘못온거아님?"" 하면서 어리둥절하게 들어왔는데 내부 분위기에서 유니크한 감성이 느껴지더라구요. 구조가 특이해서 그런지 더 특별한 느낌이었는데요. 사실 막 의자가 편한 느낌은 아니지만 나쁘지않았어요. 디저트가 맛있는 묘사서울 메뉴, 가격 서울숲 맛집 메뉴판입니다. 양갱,모나카, 빙수가 유명한 집이었은데 늦게갔더니 품절된 메뉴가 많았고 빙수는 아예 안되더라구요. 가격대는 성수동 치고는 합리적인 편? 저희는 체리에이드 6,500원, 카푸치노 5,500원 붕어 4,800원, 나무 4,800원 주문했어요. 디저트 가격 매우 합리적이었어요. 묘사서울 메뉴 추천, 맛 평가 붕어빵에서 영감을 받은 앙버터 모나카 붕어와 부담스럽지 않은 쑥맛을 살린 모나카 나무 상큼달콤한 체리에이드 그리고 카푸치노입니다. [서울숲 맛집] 분위기 힙한 성수동 디저트 카페 :: 묘사서울 재생 2 좋아요 0 00:00 00:11  [서울숲 맛집] 분위기 힙한 성수동 디저트 카페 :: 묘사서울 간단하게 영상으로도 담아봤어요 :) 이제 맛평가해볼게요 일단 카푸치노는 제가 먹은게 아니라 같이 간 인간비타민 칭구의 의견으로 적자면 카푸치노가 맞나싶을만큼 아쉬운 맛이라고 하더라구요. 혹시 저희가 시킨게 카푸치노가 아니고 잘못나온거라면(?) 댓글 달아주시면 수정하겠습니다. 제가 시킨 체리에이드는 가격대비 양은 적은 편이었지만 상콤달콤한 맛이 꽤 괜찮았어요. 제 스타일이라서 저는 다음에 가게된다면 또 먹고싶어요. 맛은 흡사 체리콕같은 느낌인데요. 기본적인 체리콕 맛에 체리 과육이 씹히는 맛이라 상큼한 탄산 베이스 음료 좋아하시는 분들이라면 누구나 호불호없이 좋아할 맛입니다. 디저트 중 인기가 많은 양갱은 이미 품절이었고 모나카만 주문 가능했는데 그나마도 이거 두개만 남아있었고 저희 이후에 방문하신분들은 먹지도 못했어요 ㅋㅋㅋ 영업은 22시까지하지만 20시반 이후에 가면 거의 못먹는듯? 쑥 가나슈가 들어간 나무 처음에 말차인줄 알았는데 알고보니 쑥이었던!! 흡사 트리같이 생긴 모양이 예뻤답니다. 맛은 생각보다 쓰지않고 달달한 맛이었고 괜찮았어요. 가격 대비 이만하면 만족스러운 퀄리티라는 느낌? 쑥이라는 재료가 사실 디저트에 흔히 쓰이는 재료가 아닌데 뭔가 힙한 할매니얼 느낌이 낭낭해서 할미입맛 분들도 먹기에 좋은듯했어요. 다음은 앙버터가 들어간 붕어!! 한쪽만 나오기에... 어쩔수없이 반 갈랐는데 제가 너무 못짤라서 몰골이 이렇네요. 하지만 맛은 괜찮았어요. 사실 전 느끼한게 별로라 앙버터를 그다지 좋아하는 않아요. 그치만 이건 괜찮았어요 적당히 달달한 팥의 단맛과 조화로웠답니다. 묘사서울 총평, 추천 후기 우선 성수동에 늦게까지 하는 카페가 생각보다 별로 없는데 (보통 21시면 닫아요.) 여긴 22시까지 하기 때문에 늦게까지 하는 카페를 가시길 원하시는 분들께 추천합니다. 다만 늦게가면 늦게 갈수록 선택의 폭이 좁아지기 때문에 감안하셔야할 것 같구요. 위치가 찾기 쉽지는 않아서 시간 여유를 가지고 오셔야할거같아요. 그리고 서비스적인 측면에서도 막 불친절하다 이런거까진 아닌데 살갑거나 친절하신거 같은 느낌은 아니었기 때문에 서비스를 중시하면 고민해보시는 게 좋을 것 같아요. 하지만 나름 합리적인 가격대에 괜찮은 분위기와 특색있는 디저트를 즐길 수 있다는 점에서 저는 추천해 드리고 싶습니다. 이렇게 내돈내산 솔직 추천 후기마무리할게요! 저는 다음 리뷰로 돌아오겠습니다. 그럼 20,000~ 50m © NAVER Corp. 묘사서울 서울특별시 성동구 서울숲2길 2 2층 #묘사서울 #내돈내산 #내돈내산맛집 #서울숲맛집 #성수동카페 #디저트카페 #분위기힙한카페"
