title,content
서울숲 감도 서울 성수동 파인다이닝 디저트 카페,"서울숲은 자체만으로 예쁜 곳이지만 주변으로 까페들이 많아 인기있는 지역이기도 하죠. 이중에서도 여느 장소들에 비해 결이 다른 수준을 보여주는 서울파인다이닝 디저트 카페 감도를 소개드립니다. 50m © NAVER Corp. 감도 성수점 서울특별시 성동구 왕십리로 83-21 디타워 서울포레스트 지하1층 B115 감도 운영시간 매일 11:30 ~ 21:00 디타워 서울 포레스트 지하 1층에 위치하고 있으며 수인분당선 서울숲역과 연결되어 있고 주차는 두시간 지원받습니다. 서울숲에서는 도보 2분, 성수동 카페거리에서도 10여분이면 도착할 수 있습니다. 다양한 먹거리가 있는 디타워에서도 모던한 감각으로 중심에 자리하고 있어 찾기 쉽습니다. 다소 이른 시간이라 여유있어 보이지만 내부는 물론 야외테이블까지 금세 만석이 되었어요. 초입에서부터 디저트에 관한 남다른 내공이 느껴집니다. 카운터에 비치된 카드에서도 감도의 다짐이자 추구하는 바를 확인할 수 있어요. 군더더기없이 깔끔한 내부는 담백하면서 고.급진 맛을 통해 쉼을 얻게 하려는 컨셉을 반영하고 있습니다. 층고가 높으면서 사방을 통창으로 처리해 답답함도 느껴지지 않아요. 공간을 따뜻하게 메우는 감미로운 음악은 파인다이닝다운 분위기를 한껏 연출합니다. 메뉴는 QR로 파악한 후 직원분을 통해 주문하면 됩니다. 손전등이 있어 의.아했는데 디저트를 보다 다채롭게 즐겨보길 권하는 방식이었어요. 메인 디저트라인중에서 스트림에스로 선택해 봤습니다. 설산에서 흘러 내려와 몽떼로 만든 집 사이를 굽이굽이 흐르는 쿠키크럼블. 하.나의 작품과도 같아요. 귀여운 플레이팅은 볼수록 얼마나 많은 정성이 깃들었는지 절로 느끼게 하는 비주얼입니다. 이쯤되니 아까 본 손전등이 생각났어요. 마치 눈내린 마을같기도 하고요. 보는 즐거움이 있어 감성까지 풍성하게 해주는 서울숲 파인다이닝 디저트 카페입니다. 딜크림과 유자레몬이 어우러져 입안 가득이 퍼지는 향은 넘나 상쾌했습니다. 몰랑몰랑한 식감도 재미있었구요. 젤리에는 라즈베리와 유자가 곁들여 집니다. 기분좋은 쫀득함을 가지면서 은은하게 올라 오는 단맛이 로네펠트 티에 더해지니 짙게 남는 잔향이 감도만의 매력으로 이끌어 줍니다. 만다린 아이스크림은 한입넣는 순간 깊은 유자향과 부드러운 제형이 상큼함을 돋궈 줍니다. 이곳이 아이스크림으로도 유명하다더니 끄덕이게 하는 퀄이었어요. 또 다른 시그니처 소금 아이스크림이 궁금해져 말돈소금으로 골랐습니다. 주문과 함께 바로 만들어 주셔서인지 스푼들어가는 느낌부터 남달랐어요. 젤라또스러우면서 부담스럼지 않은 꾸덕함에 짠 맛의 풍미가 적당히 섞여 누구나 좋아할 만한 깔끔함이 돋보였답니다. 입가심으로 선택해 본 스파클은 언뜻 칵테일 느낌 낭낭하죠. 코코넛을 기본으로 라임젤리와 슈가 캐.비어 등이 쌓아 올려진 모습은 이국적입니다. 밑부분부터 떠올려 먹어보니 새콤달콤에서 시작해 톡 쏘는 청량함까지 마무리로 딱이었습니다. 맛과 친절함은 기본에 정신적인 휴식을 취할 수 있는 공간 파인다이닝 형태의 디저트 카페는 흔치 않으니 방문해 보시길 권해 드립니다. 서울 파인다이닝 서울숲 디저트 재생 9 좋아요 2 00:00 00:32  서울 파인다이닝 서울숲 디저트 꼭 서울숲과 성수동 근처가 아녀도 디저트가 주는 편안함이란 언제든 접해 볼만한 색다른 기분이기에 서울 파인다이닝 카페 감도 기억하시면 좋겠습니다. 이 포스팅은 디타워 서울포레스트로부터 지원을 받아 작성되었습니다"
성수동카페 서울숲 신상 카페 감도,"고급스럽고 특별한 디저트를 맛볼 수 있는 서울숲 신상 카페 감도 성수점에 갔다왔어요 오픈한지 얼마 안되어서 외관부터 깔끔함이 느껴지는 성수동카페 감도 서울숲역과 바로 연결되어서 접근성도 위치도 좋았어요 감도는 파인 디저트 다이닝으로 강남 유명 디저트 카페인 우나스의 메인 셰프님이 메뉴개발을 진행해 주셨다는 얘기를 듣고 꼭 가보고 싶었던 곳었어요 영업시간은 매일 10시 ~ 22시에요 성수동카페 감도 안으로 들어가서 제일 먼저 qr체크인을 했어요 입구 왼쪽에 눈에 띄는 이 돌! 왼쪽 사진은 감도 공식 인스타에서 캡쳐한 사진인데 돌 사이에서 질소 연기가 나나봐요~ 제가 갔을 땐 잠잠했어요 아마 주방과 연결된거 같기도 한데.. 제가 앉은 자리에서 이렇게 연기가 나는 걸 봤거든요 돌이 위치한 쪽으로 이 연기가 나갈것 같은데 그 생각을 못해서 인스타속 풍경은 못봤어요 ㅠㅠ 아쉽 ㅠㅠ 다음 기회를 노려야겠어요 ㅋㅋ 성수동카페 메뉴판 & 가격이에요 입구에 메뉴판이 따로 마련되어 있어서 사진으로 확인도 가능하구요 테이블 마다 이렇게 qr코드를 스캔해서 메뉴도 볼 수 있었어요! 서울숲 신상 카페 답게 qr코드 메뉴판이라니!! 신선했어요 메뉴를 살펴보고 정한 뒤 주문을 했어요 아메리카노는 산미 있는것, 고소한 것 둘 중 선택이 가능해 좋았어요 감도 카페 소개 내용도 볼 수 있었는데 감도는 미각을 통해 온전한 쉼을 느낄 수 있는 공간을 만들기 위해 탄생한 파인 디저트 다이닝 브랜드라고 해요 특색있는 맛을 가진 5가지 플레이팅 디저트와 질소를 활용한 아이스크림을 메인으로 고급스러운 맛의 디저트를 맛볼 수 있는 곳! 내부는 블랙앤 화이트로 깔끔하게 꾸며져 있었고 테이블 위에 귀여운 조명도 올려져 있었어요 동그란 조명 위에 손을 가져다 대면 조명이 켜지더라구요 싱기방기 ㅋㅋ 주문을 한 뒤 진동벨을 받고 메뉴가 나오기를 기다렸어요 한쪽에 이렇게 공간이 뚫려있어서 깔끔한 내부 공간도 볼 수 있고 앞에 올린 사진처럼 질소 아이스크림 만들면서 생기는 연기도 볼 수 있어서 신기했어요 ㅋㅋ 그리고 잠시 뒤 등장한 성수동 카페 감도의 디저트와 음료 조약돌 바질들 벨라비타노치즈 아이스크림 아메리카노 바다소금 아메리카노를 주문했어요 제일 궁금했던 조약돌 바질들 파인 디저트 다이닝 답게 디저트가 요리처럼 멋있는 비주얼로 등장했어요 성수동카페는 디저트를 주문하면 예쁜 사진이 담긴 카드를 줘요 뒷면을 보면 디저트에 대한 설명이 적혀있어 좋더라구요 조약돌 바질 들판은 우나스 이은아 셰프님과 콜라보로 탄생한 감도의 플레이팅 디저트로 제일 위에 조약돌 모양은 머랭쿠키에요! 그 아래에는 은은한 허브향이 나는 바질 아이스크림이 깔려있고 제일 아래에는 크럼블과 유자 마리네이드 토마토가 들어있어요 이렇게 설명으로만 들어서는 상상이 안되는 디저트라 이건 꼭 먹어봐야 알 수 있어요 ㅎㅎ 저는 우나스 디저트 너무 맛있게 먹어서 기대하고 먹었는데 역시나 실망시키지 않더라구요 바질 향이 너무 강하지 않아 아이스크림과 잘 어울렸고 방울토마토도 너무 맛있었어요 사실은 플레이팅 디저트 먹으러 온거였는데 질소 아이스크림도 대표메뉴라고 해서 한번 주문해 봤어요 아이스크림 종류가 꽤 다양했는데 제일 색달랐던 벨라비타노치즈 아이스크림을 주문했어요 아이스크림이 조약돌 바질들 안에 있는 아이스크림보다 더 빨리 녹을 것 같아서 제일 먼저 먹긴 했어요 ㅋㅋ 처음 먹었을 때는 달달한 아이스크림 맛이었는데 중간중간 치즈가 콕콕 박혀있어서 진한 치즈맛도 느낄 수 있었어요 단짠의 조합! 색다르고 맛있더라구요 그리고 아메리카노는 두가지 원두 선택이 가능해서 저는 고소한 원두로 선택했고 진한 맛의 아메리카노가 디저트와 먹기 딱이었어요 그리고 바다소금 아메리카노는 위에 바다소금 크림이 올려져 있어서 짠맛 + 단맛을 느낄 수 있는 매력적인 음료였어요 나가는 길에 다른 테이블 위에 등이 켜진걸 보고 터치해서 한번 켜봤어요 ㅎㅎ 성수동카페 재생 20 좋아요 0 00:00 00:17  성수동카페 디저트 영상도 찍어봤으니 확인해 보세요 50m © NAVER Corp. 감도 성수점 서울특별시 성동구 왕십리로 83-21 디타워 서울포레스트 지하1층 B115 감도"
성수동 디저트 카페 : 감도 (@gamdo.official),"성수동의 디타워 서울포레스트 지하에 위치한 디저트 카페, 감도 성수점 (@gamdo.official) 50m © NAVER Corp. 감도 성수점 서울특별시 성동구 왕십리로 83-21 디타워 서울포레스트 지하1층 B115 감도 서울포레스트 주차장을 2시간 무료로 이용 가능하다고 한다. 지하철 이용해 방문시 수인분당선 서울숲역에서 매우 가까우며, 2호선 뚝섬역에서도 걸어갈 수 있을 것 같다. 10분정도 걸릴 것 같다. 처음 방문해보는 디타워 서울 포레스트 상가. 주차도 편하고 깨끗하고 깔끔해서 좋았다. 디뮤지엄에서 전시도 볼 수 있고, 식당이나 카페들도 괜찮아보이는 곳들이 있어서 다음에 시간 될 때 또 가보기로 했음.. 아무튼 내가 방문했던 감도는 질소 아이스크림으로 한 때 핫했던 아이스크림 브랜드 '브알라'에서 만든 카페였다! 그리고 '파인 디저트 카페'라고 적힌 입간판에서도 알 수 있듯, 뭔가 파인 다이닝 레스토랑의 디저트 버전 같은.... 고급스러운 디저트 카페를 추구하는 곳 같았다. 하지만 음.. 너무 큰 기대는 하지 않고 방문하시는 걸 추천한다. 그리고 나는 미리 캐치테이블을 통해 예약을 하고 방문했으며 평일 낮이라 그런지 예약이 다 차지 않아서 예약 안하고 방문하신 분들도 웨이팅 없이 바로 빈 자리에 들어가 앉을 수 있는 것 같았음. 들어오자마자 보였던 벽에 걸려있는 커다란 바위 조형물.. 이 바위 옆에 서계신 직원분께서 예약 확인 후 자리를 안내해주셨다. 엄청 친절하셨다! 테이블마다 귀여운 조명이 놓여 있다. 그리고 그 옆에 있는 QR코드를 스캔시 감도에서 만든 온라인 메뉴판 사이트로 연결된다. 천천히 자리에 앉아서 메뉴를 고른 후, 카운터에서 주문을 하도록 안내해주셨음. 손님이 없을 때 틈틈히 찍어본 카페 내부 공간 사진들. 개인적으로 카페 실내 공간 분위기는 그냥 그랬다. 생각보다 좁았고, 좌석 간격도 많이 가까운 편이며, 깔끔한 색감과 가구들 위주로 이루어져 있긴 한데, 그렇게까지 고급스럽거나 멋지지는 않았다. 그냥 소소한 동네 카페들과 크게 다르진 않은 느낌이었음. 그리고 평일 점심시간쯤 방문했는데 딱 그 때가 주변 회사들 점심시간인지 거의 빈 자리가 없을 정도로 손님이 많았고, 많이 시끄러웠으며 좁은 공간의 답답한 느낌을 조금 보완하고자 통유리창을 설치한 것 같은데 밖으로 지나다니는 분들과 우리가 서로 너무 잘 보이도록 트여있는 느낌이었다. 조금 비싸더라도 고급스럽고 차분한 분위기의 공간에서 디저트 먹을 생각으로 방문했는데ㅠㅠ 솔직히 분위기는 실망스러웠다. 내가 너무 기대를 많이 했나보다. 반대쪽 자리들. 주문을 하기 위해 사이트로 들어가서 골라본 메뉴들. 아이스크림과 다른 재료들이 조합되어 예쁘게 플레이팅 된 디저트 메뉴 외에도 일반 스쿱 아이스크림 메뉴, 커피와 음료 메뉴들이 다양했다. 주문 후 메뉴 나오길 기다리는동안 요런 게 있길래 가지고 놀았다. 나의 쉼은 ________이다. 나는 진짜 망설임 없이 나의 쉼을 '늦잠'이라고 정의할 수 있었음ㅋㅋㅋ 늦잠이 없으면 쉬는 것이 아니다ㅋㅋㅋ 조약돌 바질 들판(18000) 말돈소금 아이스크림 (6200) 바다소금 라떼 (5700) 어쩌다보니 전부 흰색에 가까운 메뉴들만 골랐다. 조약돌 바질 들판 (Pebble Basil Field)는 이은아 셰프의 '우나스'와의 콜라보레이션으로 탄생한 메뉴였으며 조약돌 머랭쿠키와 유자 마리네이드 토마토, 바질 아이스크림이 조합된 디저트로 은은한 허브향이 매력적인 디저트라고 소개되어 있었음. 아이스크림이 몽글몽글한 느낌으로 부스러져 있었고 위에 머랭 쿠키가 올라가 있었다. 바질 아이스크림 맛은 꽤 독특했고 호불호고 갈릴 것 같았지만 그렇다고 난해하거나 막 난감한 정도는 아니라.. 특별한 메뉴 도전해보고 싶으신 분들께 괜찮은 메뉴 같았다. 왼쪽 사진은 네이버 플레이스에 올라온 메뉴 사진을 캡쳐했습니다. 오른쪽 사진이 내가 먹은거. 투덜거리는 이야기를 너무 많이 써서 이제 그만 쓰려고 했는데 딱 하나만 더.. 머랭쿠키로 표현된 조약돌 비주얼이 생각보다 허접했다. 업체측 사진과 너무 달랐다. 독특한 비주얼 때문에 고른 메뉴였는데 아쉬웠음. 말돈소금 아이스크림이랑 바다소금라떼는 꽤 익숙한 단짠단짠 소금맛이라 맛있게 먹었다. 짭쪼름과 달달함이 조화롭게 섞인, 딱 생각한 그대로의 맛이었다. 말돈의 '말돈'이 뭔지 궁금해 찾아보니 영국의 지역 이름이었고 여기서 장인들이 고급 소금을 만들면서 그 소금을 말돈 소금이라고 부르게 되었다고 한다. 말돈소금 아이스크림이랑 바다소금라떼는 단짠단짠 좋아하시는 분들이라면 크게 호불호 갈리지 않을 듯한 맛이었음. 안전한 선택지를 원하시는 분들께 추천ㅋㅋㅋ 아이스크림과 음료 모두 맛있었고, 특히 바질 아이스크림은 다른 곳에서 먹어본 적 없는 특별한 맛이라 뭔가 새로운 경험을 해볼 수도 있어 좋았지만! '파인 아이스크림 다이닝' 이라는 그럴싸한 수식어로 다른 아이스크림 가게들과 차별화하기에는 많이 부족한 곳이었고 살짝 비싸지만 아이스크림을 활용한 메뉴들이 독특하고 괜찮은.. 그냥 카페였을 뿐이다. 한번쯤 가볼만은 한 곳이지만 너무 기대는 하지 않고 방문하시는 걸 추천!"
"성수동 카페 감도 성수점, 파인 디저트 다이닝 메뉴 후기","오랜만에 서울숲 나들이를 나간 김에 엄청 핫했던 성수동 카페 감도에 다녀왔다. 감도는 Fine Dessert Cafe라는 컨셉의 카페로 유니크한 디저트 메뉴가 유명하다. 매장 내부는 모던하고 깔끔한 느낌이다. 일요일 오후였는데 많이 혼잡하진 않아도, 빈자리는 한 테이블 있는 정도? 꾸준히 손님들이 있는듯 하다. 감도에서는 디저트를 필수로 주문해야하는데, 조약돌 바질 들판이 가장 유명하다. 메뉴판만 보고서는 무슨 조합이려나 싶었는데 다행이도 친절하게 사진이 함께 있었다. 사진을 보니 메뉴 선택에 한결 도움이 되지만, 먹어보기 전 까지는 맛 자체가 상상은 잘 안된다. 조약돌 바질 들판, 유자 밀푀유, 구운 감자 크렘브륄레와 감도 샌드가 있었는데 우리는 아이스크림이 먹고싶지 않아서 구운 감자 크림브륄레를 시켰다! 감도의 분위기를 설명하자면 카페보다는 갤러리와 쇼룸 어딘가에 속한 느낌이 강했다. 나의 쉼은 빗속을 걷는 것! 이 사진만 보더라도 카페보다는 분명히 갤러리에 가까운 느낌이다 물을 셀프로 가져다 먹을 수 있게 냅킨과 함께 있었다. 다행이 안쪽 자리가 나서 앉아있는데, 중국인 관광객부터 외국인들도 제법 많아서 신기했다. 감도는 미각을 통해서 온전한 쉼을 느낄 수 있는 공간을 만들기 위해 탄생한 파인 디저트 다이닝 브랜드라는 브랜딩을 하고 있는데, 코로나 이후 파인 다이닝에서 '파인 디저트 다이닝'까지 고급화 전략을 많이 쓰는 듯 하다. 드디어 나온 디저트(17.0)와 아메리카노(5.8) 2잔. 내가 가끔씩 옛날 사람이라고 느낄 때가 있는데.. (엄청난 옛날 사람이 아님에도 불구하고) 커피 한잔 6천원이 요즘은 그렇게 흔하지 않다는 점이다. 스타벅스가 제일 착해... 플레이팅만 보았을 때는 약간 계란 후라이 같기도 하고? 아메리카노는 합격!! 맛이 제법 괜찮았다!! 부드럽고 마일드한 느낌은 아니었고 적당히 볼륨있는 텍스쳐에 아로마도 풍부했다. 하지만 개인적으로 디저트 메뉴는 아쉬웠다. 어... 굳이.. 왜..? 이게 왜?? 파인 디저트 다이닝이라는 컨셉인거지 했던 애매모호한 맛이었다. 감자에 설탕을 뿌려서 카라멜라이징시키고 감자를 얇게 채썰어 튀긴 다음 함께 곁들여 먹는 메뉴가 왜 디저트에 가까운지, 그리고 이게 왜 특색 있는지는 잘 모르겠다. 그냥 가격대를 있게 만들어서 파인 디저트 다이닝이라는 컨셉을 잡은걸까? 나는 재방문의사 없음. 실망에 가까웠다. 성수동 카페, 성수동 파인 디저트 다이닝 카페 감도를 다녀온 후기를 정리하자면, 특색은 있었으나 다시 갈 것 같지는 않은. 인스타 혹은 SNS 유명세가 떨어지면 사람들이 올까? 싶었던 곳으로 마무리. 성수동 카페 감도 내돈내산 후기 끝! 50m © NAVER Corp. 감도 성수점 서울특별시 성동구 왕십리로 83-21 디타워 서울포레스트 지하1층 B115 감도 예약"
[감도] 성수동 감도 높은 디저트 카페(소금커피 추천),"감도 / 서울 성동구 왕십리로 83-21 디타워 서울포레스트 지하 1층 (성수동) 오픈: 매일 12:00 - 20:00 문의: 02-6233-7623 *서울숲 역 4번 출구 / 디 타워 주차 가능* *캐치 테이블 예약 가능* 감도 성수점 담백한 고급스러움을 담아낸 파인 아이스크림 다이닝 app.catchtable.co.kr 질소를 활용한 아이스크림이 메인이라는 디저트 카페. 성수동 디 타워 지하 1층에 자리한 곳. 입구부터 감각적인 공간 탬버린 즈위 손소독제와 핸드크림이 놓여 있는 입구. 손소독제 뿐 아니라 핸드크림까지 놓아둔 배려심에 감동 웨이팅을 오래 할 줄 알고 갔는데, 딱 창가 쪽 테이블이 남아서 Pick! 처음엔 꽉 차 있었는데, 대화하다 둘러보니 텅 비어 있던 일요일 저녁시간의 카페 감도 이름도 낭만적인 바닷소금 커피와 라테 주문 🌊☕️ 무슨 맛일까? 하는 궁금함으로. 한마디로 설명하자면 아메리카노와 라테인데 단잔의 생크림이 커피 위에 올라가 있었던 아인슈페너 느낌의 맛있었던 커피 예전에 먹어본 솔리드 캐러멜 라테랑 비슷한 맛! 너무 쓰지고, 시지도 않은 고소한 커피 위에 적절한 조합의 단잔의 부드러움이👍 감도는 미각을 통해서 온전한 쉼을 느낄 수 있는 공간을 만들기 위해 탄생한 파인 디저트 다이닝 브랜드입니다. 복잡한 것은 최소화하고 절제와 담백함을 지향하며, 재료가 가진 본질적인 맛에 집중한 디저트를 소개합니다. 감도 소개 글 중 “나의 쉼은 OO이다” 라는 미완성된 문장과 키워드가 적힌 작은 종이를 계산하고 나오면서 발견. 일러스트나 가게 전화번호 대신 이곳의 아이덴티티를 확실히 느낄 수 있었던 내 취향 저격 감도의 명함 온전한 나만의 시간 구름 속에 빠지는 상상을 하는 것 음악 커피와 초콜릿 부드러운 이불 그리고 감도 생각만 해도 힐링 되는 것들! 성수동 속 차분하고 미니멀한 힐링 되는 카페 #감도 미니멀하지만 차갑지는 않아 이야기하기 좋았던 곳 바깥도 보여서 답답하지 않았던 공간. 눈 오는 날 오면 겨울을 온전히 느낄 수 있을 것 같은 디 타워 내부에 있으면서도 바깥과 연결되어 있었던 곳. 아이스크림과 잘 만들어진 디저트 먹으러 다시 오고 싶은 곳! 성수동 소금 커피 또 먹고 싶어요☕️ 50m © NAVER Corp. 감도 성수점 서울특별시 성동구 왕십리로 83-21 디타워 서울포레스트 지하1층 B115 감도"
성수동 감도/서울숲 감도/질소아이스크림/gamdo,"50m © NAVER Corp. 감도 성수점 서울특별시 성동구 왕십리로 83-21 디타워 서울포레스트 지하1층 B115 감도 요즘 성수동 가는 재미에 빠진 흰둥이와 나. 빵집 3군데 빵지순례와 밥까지 냠냠하고 집에 가려는 찰나 눈에 보이는 디저트가게. 이미 손에 몽블랑 하나, 크림 크로와상 하나 들고 있지만 참새방앗간을 지나갈 순 없지!! 뭔가 일본같군요 신이나서 발걸음도 가볍게 들어가봅시다.캭캭 감도 영업시간 애매한 시간이었는데도 한쪽 홀은 만석. 다행히 문 왼편에 자리 2개가 따로 있어서 조용히 먹을수 있었다. 감도 메뉴 뭔가 아이스크림이 맛날거 같아서 아이스크림 시켰는데 사장님이 원두 좋은거 쓴다며 자꾸 꼬시더라. (근데 아포카토에 나온 에스프레소 진짜 맛났음.) 감도 메뉴 / 아이스크림 아이스크림 메뉴가 이렇게 있다. 저 중 내 원픽은 올리브오일 & 후추인데 이건 집에도 아이스크림에 올리브오일 막 뿌려먹는지라 패스하고, 그 다음픽은 바질인데,, 바질은 최근에 제주 가서 많이 먹어서 또 패스. 그 다음은 치즈를 골라볼까 했는데 원래 새로운 집 가면 젤 위에꺼 시켜먹는게 가장 실패가 없는것 아니겠슈? 마침 말돈 소금만 초이스가 두개나 있는걸 보아하니 말돈소금이 인기인가 싶어서 그걸로 픽. 흰둥이는 아포카토 픽. 감도 메뉴 /디저트 디저트카페라고 하며 디저트 메뉴도 조금 있는편. 나중에 찾아보니 우나스랑 콜라보한 메뉴가 있다고 함. 밀돈소금, 아포카토 말돈 소금 아이스크림의 맛은? 으아니 말돈소금이라며 소금맛이 안나고 왜때문에 프레츨이 들어있는거쥬? 그럼 아이스크림 이름을 프레츨이라고 하던가. 한입먹고 소금맛이 안나길래 흰둥이한테 소금맛이 안난다고 했더니 흰둥이 왈 ""조약돌이 소금인가부다"" ""아 그런가? 소금 뭉처 놓은건가? 암염처럼?"" (대환장 잔치 ㅋㅋㅋ) 막 이랬는데 걍 질소로 얼린 머랭스러운 맛이었다. 예전에도 질소 아이스크림 먹은적 있는데 난 질소아이스크림의 식감을 좋아하는 사람이 아닌가봄. 어딘가 부드럽지만 그게 완벽히 부드럽지 않고 서걱거리는 맛이라고 해야하나. 근데 반전은 흰둥이의 아포카토는 존맛. 사장님 말씀대로 원두가 좋은가 먹다보니 참 맛나서 내 말돈소금 아니 프레즐 아이스크림도 아포카토로 만들어서 먹으니 맛나서 다먹음. 아포카토는 다시 먹으러 가고싶음. 헤헤. 그치만 걍 말돈소금은 집에서 뿌려먹자. 대리석 질소 쇼쇼쇼 아이스크림 먹다보면 벽에 있는 대리석에서 연기가 나오는 쑈가 펼쳐진다. 아이스크림 먹으면서 쇼도 볼수있다. 뭔가 웃기게 적었지만 실제로 보면 좀 그럴싸하다. 글구 아이스크림 스푼 예뻤어. 가게 이름 폰트도. 여러가지로 많이 신경쓴거 같은 디저트가게임. 내부는 이런느낌 아포카토가 맛있었으니 다음번에 지나가다 커피 함 먹어볼 예정. 질소아이스크림 좋아하는 분들은 엄청나게 좋아할거 같으니 가보십쇼. 나는 쫀쫀한 아이스크림파. +추가글 신기하게도 먹을때 엄청난 맛은 아니었는데 며칠지나니 자꾸 생각난다. 요상하네 ㅋㅋ 한두번 더 가봐야겠다 헤헷"
