title,content
[서울맛집] 감도(gamdo) 성수동 서울숲 디타워카페 소금아이스크림이 꿀맛이에요,"안녕하세요! 구름갱입니다 지난주 다녀왔던 성수동 디뮤지엄에 위치하고 있는 감도(gamdo) 라는 소금아이스크림, 소금라떼 꿀맛집 꿍이와 다녀왔는데요 소개합니다 #감도(gamdo) 이렇게 디타워 지하에 위치되어 잇네요 운치있게 한장 찍혀서 흡-족 감도입니다. 10:30~ 22:00 까지운영하네요 감도의 메뉴판입니다! 감도컨셉이 약간 소금? 컨셉인가봐용 저희는 바다소금 아메리카노, 바다소금 라떼 택했어요 (꿍이와 저는 소금 매니아랍니다 ㅇㅅㅇ) 매장은 모더니즘한 느낌 화이트톤에 굉장히 미니멀했어요 간결하면서도 허전해보이지 않게 공간을 연출했네요 착석전에 야무지게 사진 찍어준 꿍꿍이 큐알로 메뉴이미지도 볼수 잇어요!! 신기잼 ㅠ 무튼무튼 아무튼!~ 커피와 아수쿠림 나왓네영 눈이너무 무섭게 나와서 눈자이킁 음료랑 바다소금 아이스크림 궁금하지 않으신가요? 저희도 궁금했땁니다 ㅋㅋㅋㅋ 스푼도 그렇고 절제의 미학을 보여줍니다 아이스크림부터 살펴볼까요? 가운데 이건 뭘까요? 딱딱잼 정답은 넵 머랭이엇습니당 헤헤 자 소금아이스크림 한스쿱 또 먹어봐야겠죠 아주 부드럽게 떠져용 (꿍이가 젤 좋아하는 디저트중 하나 아수크림!) 호빵맨 머리같은 아수크림 안에는 프레즐같은 과자도 들어있어요 식감 업! 결론적으로 말하자면? 네.. 그러합니다!! 아아도 한잔.. 흐음 살짝 솔트의 맛이 나네요 전체적으로 아이스크림은 고급진 맛이엇습니다 살짝 바닐라맛에 솔트의 맛이 은은하게 감칠맛을 더해줬고 아아도 아주 시원하고 맛있게 잘먹엇어요 서울숲이나 디타워 갈일 있으시면 들러보셔용!! 50m © NAVER Corp. 감도 성수점 서울특별시 성동구 왕십리로 83-21 디타워 서울포레스트 지하1층 B115 감도 디뮤지엄 지하입니다 ! 서울숲도 근처구여 주차는 주차타워가 있어요..!"
성수동 일일 먹부림 😋 메종 파이프그라운드 / 감도 Gamdo / 오복떡집,"어느새 22주차 임산부인 나. 열흘 정도 제주 다녀온 것 제외하면 꼬박 100일을 동네만 맴돌며 갑갑함 만렙 찍는 중인데 몸이 무거워진 탓에 또 혼자선 멀리 나가기 버거운... 그런 상황. 이제부터라도 힘을 내어 남편과 자주 돌아다니기로 했다. 주말이면 조수석에 누워 가고 싶은 곳 가고 먹고 싶은 것 먹어가며 출산 전 4개월을 만끽해보기 😇 메종 파이프그라운드 / 서울숲 디타워 지하 1층(M1)에 위치한 브런치 식당 메종 파이프그라운드 서울특별시 성동구 왕십리로 83-21 지하1층 B124호, B125호 예약 가지 라자냐와 M.P.G 옥수수 피자 주문했다. 비건 메뉴 같은 느낌 밀가루 대신 가지로 층을 쌓았다. 토마토 소스와 당근 퓌레가 산뜻해서 좋았다! 전체적으로 안 무겁고 소화 잘되는 맛 🫶🏼 옥수수 피자. 겉보기엔 매콤할 것 같았는데 의외로 달착지근+짭잘한 게... 불량식품 맛 스타일. 바삭한 감자칩, 오도독 옥수수 식감이 재미있긴 하지만 어딘가 좀 그랬다. 장난 같은 맛이야 😅 감도 / 서울숲 디타워 지하 1층(M1)에 위치한 디저트 카페 감도 성수점 서울특별시 성동구 왕십리로 83-21 디타워 서울포레스트 지하1층 B115 감도 생각보다 넓지 않은 매장. 직원분도 친절한 편 아님 X 전부터 궁금했던 아이스크림 전문 카페 방문. 바다소금 아메리카노 주문 후 디저트도 하나! 조약돌 바질 들판 (조약돌 머랭쿠키, 유자 마리네이드 토마토, 바질 아이스크림, 크럼블) 맛있었다 🦄 토마토 절임과 바질, 맛이 없을 수 없는 저 조합이 아이스크림으로 재탄생. 익숙하면서도 새로운 느낌. 매끈한 머랭쿠키도 좋았다. 오복떡집 / 성수동 트리마제 옆 동네 떡집 오복떡집 서울특별시 성동구 성덕정길 32 오복떡집 인스타 핫플로 유명해 즐찾해뒀던 곳 ㅎㅎ 임신 후 (떡국 제외하고) 떡 먹은 적이 없는데, 오늘은 웬일인지 소화도 되게 잘 되고 금방금방 출출해지길래 찾아가보았다. 떡 고르는 어머님들의 날랜 손길. 그 사이로 원하는 거 4팩 획득 😎 남편의 픽 오복떡집 시그니처 중 하나라는 이티떡. 달달한 팥앙금이 찰떡을 감싸고 있는 형태. 자색고구마떡. 속엔 달달한 흰앙금이 들어있고 그걸 둘러싼 떡이 고구마 맛이다. 향이 진함. 단호박흑임자. 찰떡에서 단호박 맛이 듬뿍 나서 좋았고, 겉에 흑임자 고물은 역시 아주 달달쓰 이거 빼곤 다 맛있었다! 얼그레이/쑥 티라미수 떡. 왜 티라미수냐면 떡 겉면에 전통적인 고물 대신 찐한 초코가루를 입혔기 때문이다. 이 아이템 때문에 오복떡집이 젊은이들 사이에서 유명해진 듯 한데 좀 오잉?스러웠다. 초코랑 떡은 안 어울려... 사실 난 그냥 초코가 싫다... 초코맛 디저트..😞 다음 주말엔 어디 갈까? 체력이 허락하는 한 어디든 플리즈. 물론 환상의 수발러 남편 동행 필수다 🐇🐇"
[감도 성수점/성동구 성수동] 아름다운 디저트를 즐길 수 있는 카페,"그림같은 디저트 메뉴들을 판매하는 것으로 유명한 감도 성수점. 아이스크림 좋아하는 아이들과 시원한 디저트 즐기러 방문했습니다. 감각적으로 꾸며진 공간. 입구에 있는 돌모양 조형물에서는 주기적으로 드라이아이스같은 연기가 나왔는데 신비로운 분위기를 만들어주었습니다. 이 곳의 대표 디저트인 조약돌 바질 들판. 조약돌 모양의 머랭 쿠키와 유자 마리네이드 토마토, 바질 아이스크림으로 이루어진 구성. 귀여운 모양의 디저트가 신기했는지 아이들이 무척 좋아했던 메뉴입니다. 입에서 사르르 녹는 머랭과 아이스크림의 식감도 재밌었습니다. 상큼하니 좋았던 메뉴. 함께 즐기려고 주문했던 바다소금라떼. 단짠단짠한 맛이 좋았던 바다소금라떼. 조용하고 진중한 느낌의 공간에서 아름다운 디저트를 여유롭게 즐길 수 있었던 곳입니다. 특별한 디저트가 먹고싶은 날에 방문해보면 좋을 것 같습니다. 50m © NAVER Corp. 감도 성수점 서울특별시 성동구 왕십리로 83-21 디타워 서울포레스트 지하1층 B115 감도 #감도 #성수감도 #감도성수점 #성수카페 #성수동카페 #성수동아이스크림 #성수아이스크림 #성수동디저트 #성수디저트 #조약돌바질들판 #바다소금라떼"
성수동 핫플 팝업 런던 언더그라운드 런칭 감도 높은 스트릿 캐주얼,"안녕하세요, 윤에쓰입니다. 성수동 핫플이 될 팝업이 하나 오픈하였어요. 바로 세계 최초의 런던 지하철인 ‘언더그라운드’를 통해 일상 속 과거의 헤리티지와 현재의 트렌드를 결합해 새로운 시각을 전하는 스트릿 캐주얼 브랜드 London Underground인데요. ‘FIND YOUR UNEXPECTED MOMENT’를 주제로 열리는 이번 팝업은 9월 22일을 시작으로 11월 19일까지 약 두 달간 운영이 되어 여유 있는 방문이 가능하기에 성수에 가시는 분들이라면 한 번쯤 계획해 보시면 좋을 것이라는 말씀을 먼저 드리고 싶어요. 내부는 브랜드 키 컬러인 페일 그린을 활용해 구성이 되어 특별한 공간으로 온 것만 같은 그런 기분이 들게 해요. 교통수단을 지하에 적용하며 이동의 개념을 새롭게 정의한 런던 언더그라운드의 과감한 관점을 이어 터널에 온 것만 같은 공간을 제안하고자 했다는 설명인데요. 입구에 들어가면 이렇게 이번 시즌 컬렉션에 대한 재단이라고 해야 하나요? 쭉 걸려있는 모습인데 이게 실제 만들어낸 옷들에 대해서 전시를 해놓은 것이라고 하더라고요. 런칭 첫 팝업인 만큼 언더그라운드 헤리티지와 아이덴티티를 보여주기 위한 아카이빙 전시 형태로 풀어냈다고 하는데, 페일 그린 컬러를 활용해 만들어 놓은 지하철 튜브 공간부터 색다른 즐거움을 느낄 수 있었어요. 좁은 통로를 따라 안으로 들어오면 23FW 컬렉션에 대해 마주할 수 있는데요. 스트릿 캐주얼이 느껴지는 스타일들이 편하고 힙하게 입기 좋겠다는 생각이 들더라고요. 브랜드의 강점인 다양한 컬러, 감도 높은 디테일과 소재 그리고 트렌디한 실루엣까지도 기대 이상으로 예쁘다는 생각이 들었어요. 기본으로 입기 좋은 반팔, 맨투맨, 니트 등 상의와 와이드한 핏을 가진 하의들까지 매력적인 옷들이 많이 보이더라고요. 처음 런던 언더그라운드 컬렉션 화보를 보면서 예쁘다고 생각했던 것보다 더 예쁜 게 많구나 느껴졌어요. 피팅룸까지도 페일 그린 컬러로 아주 감성적인 느낌이 아닐 수 없죠? 제일 먼저 풀오버 니트를 하나 입어봤는데 소매와 밑단 배색과 오버핏한 실루엣이 아주 괜찮더라고요. 여기서 1863은 지하철이 개통된 연도를 뜻하는 것으로, 큼지막하게 들어간 디테일이 매력이에요. 함께 입고 있는 데님도 런던 언더그라운드로, 전반적으로 와이드한 핏으로 나온 게 힙하고 좋더라고요. 니트와 잘 어울릴 거 같아서 같이 입었는데 입고 있던 옷은 그대로 두고 이대로 집으로 돌아가고 싶다는 생각이 들 정도로 제 취향에 들어맞았어요. 트러커 디자인의 다운 재킷도 눈에 띄더라고요. 따뜻하면서도 스타일리시하게 입을 수 있는 아우터로, 세미 오버핏에 실용성 좋은 다양한 포켓 그리고 소매 조절이 가능한 스냅과 앞/뒷면에 가죽 패치 등 특징을 가졌어요. 한 칸 옆으로 지나오면 또 다른 옷들을 만나볼 수 있었는데요. 처음이 가을이었다면 여기는 코트, 가디건, 자켓 등 겨울이 곁들어져 있어요. 개인적으로 니트웨어들이 컬러부터 패턴까지 계속해서 예쁘다는 말을 입 밖으로 꺼내면서 봤던 거 같네요. 모자 종류들도 준비가 되어있고 올 가을, 겨울을 보다 클래식하면서도 스트릿 캐주얼 무드로 꾸밀 수 있는 옷들을 만나실 수 있는 런던 언더그라운드 성수동 팝업이에요. 성수동 핫플이 될 팝업으로서 지하철 플랫폼이 연상되는 포토존이 마련이 되어있어서 한 컷 남기고 왔어요. 이날 비가 와서 앉아서 찍지 못한다는 게 당시에는 아쉽게 다가왔는데 집으로 돌아와서 보니 우산을 들고 있는 모습도 나름의 감성으로 연출된 거 같아서 괜찮더라고요. 입고 있는 니트 가디건도 정말 예쁘지 않나요. 디자인도 소재감도 디테일도 핏도 모든 것이 잘 갖춰져 나왔다는 생각이 들더라고요. 보기만 해도 포근해 보이는 이런 느낌 정밀 좋아요. 제 개인적으로는 이날 봤던 23FW 컬렉션 중에서 1순위로 마음에 들었네요. 화보를 보며 안으로 들어서면 티켓 창구를 연상하게 하는 카운터가 있어요. 이 마지막 공간은 런던의 헤리티지를 직접 풀어낸 공간으로 방문객의 일상과 런던을 유연하게 이어주고자 했다는 설명인데, 여기서 사진 찍어도 예쁠 거 같다는 생각이 들더라고요. 여기서는 스티커 3종을 웰컴 기프트로 받을 수 있으며, 15만 원 이상 구매 시에는 머그컵과 가죽 트레이 등 스페셜 굿즈가 담긴 럭키드로우 캐비닛을 열어볼 수 있는 언익스펙티드 키를 받아 열어볼 수도 있어요. 저는 스티커가 올려져 있는 트레이를 받았는데 이런 감성템은 언제나 좋죠. 런던 언더그라운드 성수동 팝업에서는 현장에서 인스타그램 팔로우 및 방문 인증 시에 10% 할인 혜택도 받으실 수 있으니 가시는데 참고하시길 바랄게요. 기간은 11월 19일까지로 여유 있게 진행을 하고 있으니 스트릿 캐주얼 스타일을 좋아하신다면 한번 방문해 보시는 것을 권해드리는 바에요. 브랜드에 대한 자세한 정보는 아래 남겨드리는 홈페이지와 인스타그램에서도 둘러보실 수 있답니다. LONDON UNDERGROUND LONDON UNDERGROUND 런던 언더그라운드 공식 웹사이트 · 온라인 스토어 | Outerwear, Knitwear, Tops, Bottoms, Accessories www.londonundergroundstudio.com London Underground(@londonunderground.studio) • Instagram 사진 및 동영상 팔로워 1,059명, 팔로잉 1명, 게시물 38개 - London Underground(@londonunderground.studio)님의 Instagram 사진 및 동영상 보기 www.instagram.com 런던 언더그라운드 성수동 팝업 런던 언더그라운드 재생 0 좋아요 0 00:00 00:36  접기/펴기 런던 언더그라운드"
성수동 카페/서울숲 카페_감도 (gamdo),"감도 성수점 매일 10:30-22:00 #성수동카페 #서울숲카페 #서울숲감도 #성수동감도 성수동, 서울숲 카페 감도 다녀왔어요 🍨 감도 메뉴예요 ✔️아메리카노 5,8 ✔️조약돌 바질 들판 18,0 신기한 디저트들 ㅎㅎㅎ 바다소금 아메리카노가 뭐지 했는데 설명이 아주 찰떠쿵ㅎㅎ 테이블에 여로케 신기한 것이 있더라두요 ,, QR 코드를 스캔해서 메뉴를 볼수 있다니 진짜 세상 편해졌다 넘 예뿐 조명 ✨ 넘 생소해서 어떤 맛일까 궁금했던 조약돌 디저트 위에 있는건 머랭 쿠키예요 맛은 ,,,,,,, 한번이면 만족 ㅎ 메뉴 설명이 아주 잘 되어있어서 좋았어요 내부가 넓은 편은 아닌데 깔끔하고 고급진 너낌 디타워 서울 포레스트 지하 1층에 있어요"
"[감도 높은 동네, 커핑하기] 성수동 ③ : 레어로우 하우스, 피치스 도원","성수동 커핑하기 세번째 편! 오늘은 성수동을 베를린처럼 만든 트렌디한 가구 브랜드의 쇼룸과 세계적인 브랜드들의 협업 러브콜을 받는 핫하다 못해 뜨거운 복합문화공간을 소개할게요! 1. 레어로우 하우스 : 서울 핫플들을 철재 가구로 빼곡히 채운 ‘레어로우’의 쇼룸 ⓒ레어로우 레어로우 하우스 서울특별시 성동구 연무장길 20 예약 글래드호텔부터 현대카드의 복합문화공간, 사운즈한남, 의정부 미술도서관, 서울공예박물관까지. 핫플레이스엔 항상 레어로우의 철재 가구가 있습니다. 레어로우는 베를린 뒷골목의 자유로운 분위기가 나는 곳을 찾다가 성수동에 집을 지었대요. 레어로우 하우는 가구 뿐만이 아니라, 책, 음악, 패브릭, 식물, 와인, 프린트 등 레어로우가 표현하는 라이프스타일이 무엇인지 느낄 수 있어요. 대표 제품인 모듈 선반 '시스템 000'. 선반 막대에 전원을 꽂으면 LED등이 켜져요. ⓒ레어로우의레어로우 “철재는 ‘차갑다’를 ‘세련되고 유용하다’고 표현하면 어떨까요. 철은 나무보다 훨씬 다양한 색을 표현할 수 있어요. 필요에 따라 자석 고리를 붙여 물건을 걸거나, 자석 조명을 붙여 불을 밝힐 수도 있죠.” 레어로우 양윤선 대표, 롱블랙 인터뷰에서 2. 피치스 도원 : 거리 자동차 문화를 더 힙하고, 캐주얼하게. ‘피치스’의 복합문화공간 NCT127, 코카콜라, 포뮬러E 등, 다양한 브랜드가 이곳에서 팝업을 열고있어요. ⓒ피치스도원 피치스 도원 서울특별시 성동구 연무장3길 9 피치스 도원 2021년 성수동 700평짜리 부지에 연 ‘피치스 도원’. 자동차 튜닝 개러지로 쓰는 분홍색 컨테이너를 중심으로 도넛이나 햄버거, 카페, 위스키 바, 옷가게가 한데 모여있어요. 특이한 건 공간 곳곳에 튜닝 스포츠카가 놓여있다는 거예요. 마음껏 구경하고 만지고 타볼 수 있어요! 자동차도 ‘자연스런 일상’에 함께할 수 있다는 걸 보여주죠. 여인택 대표는 “자동차 스타일링은 질 나쁜 사람들이 즐기는 취미 아냐?”라는 대중의 선입견을 없애기 위해 ‘피치스 도원’을 열었대요. 피치스 도원 퓨엘 갤러리. 사람들은 자유롭게 영상이나 자동차를 구경하고, 다운타우너·노티드도넛도 먹어요. ⓒ롱블랙 “거리 자동차 문화를 좀 더 친숙하게 풀어내고 싶었어요. 그러려면 누구나 좋아할 만한 요소를 공간에 넣는 게 중요했어요. 도넛이나 햄버거, 음료, 티셔츠에 ‘자동차’라는 맥락을 끼워 넣었죠. 장소도 왜 하필 성수동이겠어요. 자동차 공업사가 많고, 수제화 거리를 중심으로 패션이 꽃을 피웠잖아요. 우리가 이곳 문화와 잘 어울린다고 생각했죠.” 여인택 피치스 원 유니버스 대표, 롱블랙 인터뷰에서 성수동을 감도 높은 동네로 만든 레어로우와 피치스의 이야기, 지금 롱블랙에서 읽어보세요! 레어로우 : 차갑고 무거운 철에서 아름다운 유용함을 발견하다 롱블랙 프렌즈 K 철재 가구는 그것 나름의 매력을 지녔어요. 반듯하게 뻗은 직선, 군더더기 없는 깔끔한 단면을 저는 좋아하죠. 특유의 차가운 촉감은 언제 만져도 질리지 않는 낯선 www.longblack.co 피치스 여인택 : 자동차를 파고 들어, 새로운 스트리트 문화를 만들다 롱블랙 프렌즈 L 그런 상상 해봤어? 스포츠카 타고 시속 200km로 아우토반Autobahn을 달리는 나. 생각만 해도 스트레스 풀리네. 현실은… 출퇴근길 꽉 막힌 도로를 기어 다 www.longblack.co 롱블랙이 어떤 서비스인지 더 궁금하세요? 아래 링크를 통해 확인해보세요! >>> https://bit.ly/3CVVXOz"
성수동인근 감도높은 신축건물 전체 통임대,"성수동인근 사무소 신축통임대/ 소형건물전체임대 안녕하세요! 오늘 소개해드리는 매물은 신축건물로 전체통임대 가능한 상품이예요. 임대인측에서 직접 사용하고자, 디자인설계부터 ~ 최고급자재로 완성도 높은 시공까지! 흔히 볼수있는 건물이 아니예요~ 완성도 높은 건물로 현장에서 보시면 더욱 만족하실 공간 입니다. 최근 쇼룸 겸 사무실로 전체 임대 알아보시는 기업이 많은데요. 목적에 맞게 변경/ 사용 가능한 활용도높은 공간이예요. 상세내용 소개 ★ 보증금 :1억5천만원 / 850만원 ★ 1~3층,4층루프탑까지 전체 통임대 ★ 102.89㎡ ( 연면적 31평) ★ 자주식주차 3대가능 ★ 사용승인일 : 2022.07.04 ★성수동인근 송정제방길 신축건물 ★입주시기 :즉시입주 협의가능 ★빠른문의 : 02-498-2007 전세로 변경 계약도 가능! 문의주세요~ 특히 3층은 높은층고와 복층으로 연결되어 루프탑까지 이용가능하며, 다야한 연출가능 곡선의 어우러짐과 전면 시원한통창으로 건물의 특별함을 더해 주어요. 진화한 벽난로 화로도 갖추어져 있습니다. 성수동인근 사무소 신축통임대/ 소형건물전체임대 높은 층고로 흔하지않은 건축설계로 특별한 건물 임대를 알아보시는 분들에게 추천드려요~! 성수동인근 사무소 신축통임대/ 소형건물전체임대 성수동인근 사무소 신축통임대/ 소형건물전체임대 루프탑 앞쪽으로 뚝방제방길이 형성되어 있으며, 야경도 아름다운 공간이예요. 루프탑 바닥면도 건물벽면자제와 동일소재로 디테일한 부분까지 세심하게 신경쓴 건물입니다. 그래서 임대후 특별한 공간투자없이 바로 사용가능하세요~ 성수동인근 사무소 신축통임대/ 소형건물전체임대 성수동인근 사무소 신축통임대/ 소형건물전체임대 디자인사무소/쇼룸/엔터테이먼트/IT 기업등에게 맞춤인 통임대 현재 단독으로 진행중인매물로 궁금하신점은 02-498-2007로 바로문의 주세요. 성수동인근 최고급신축 단독통임대 /전체임대/송정동제방길통임대 재생 0 00:00 00:00  접기/펴기 성수동인근 최고급신축 단독통임대 /전체임대/송정동제방길통임대 디자인사무소, 쇼룸 추천"
[성수동/서울숲] 감도/ Gamdo (파인 디저트 카페),"친구랑 오랜만에 성수동 데이트👭🏻 성수동 카페 찾다 디저트가 너무 예뻐 찾아간 곳💚성수동 파인 디저트 카페 감도!! 감도/ Gamdo 월~일 10:30-21:00 주차 가능 지하 1층에 있는 감도! 감도는 5가지 플레이팅 디저트와 질소를 활용한 아이스크림을 메인으로 맛을 통해 여운과 쉼을 주는 담백한 디저트를 선보인다고 함! 그리고 강남의 유명한 카페인 우나스의 메인 쉐프님이 메뉴 개발을 함께 진행하셨다고 한당☺️ 들어가기 전부터 보이는 요 돌덩이! 이 돌덩이가 미술 작품 같은 느낌☺️ 자리 얼른 잡고 주문하러~ 메뉴는 이렇게 카운터 앞에 놓여 있기도 하고! 자리마다 요렇게 QR코드가 있어 자리에 앉아 스캔해서 편하게 메뉴를 볼 수 있다! QR을 찍으면 요렇게 나온다~ 우리는 -조약돌 바질 들판 -아이스 아메리카노 -바다소금 아메리카노 요렇게 주문했다! 디저트와 커피를 기다리면서 찍은 내부 공간 금요일 저녁 7시쯤 도착했는데 자리는 여유 있었다 한 10분쯤 기다리니 나온 디저트와 커피! 디저트가 너무 예쁨.....💚 디저트와 함께 주신 디저트 설명과 먹는 방법! 조약돌 바질 들판 조약돌 모양으로 빚어낸 머랭 쿠키, 유자에 마리네이드한 방울 토마토, 향긋한 바질 아이스크림, 입안에서 부서지는 크럼블로 구성 된 감도의 시그니처 디저트🍨 예쁘기만 할 줄 알았는데 진심 너무 맛있게 먹었다 디저트 먹느라 커피는 나중으로 미루고...🤣 다 먹고 친구가 내 사진도 찍어주었다 오랜만에 만나 이런저런 얘기 나누며 마감할 때까지 수다수다🗣 파인 디저트 카페는 처음인데 너무 맛있게 먹어서 다른 디저트도 먹으러 조만간 또 와볼 예정☺️"
