title,content
대왕쿠키가 있는 그레인바운더리 성수점 :: 성수동 쿠키 맛집!,"어쩌다보니 지점 도장깨기 중인 ㅋㅋ 대왕쿠키 맛집 그레인바운더리. https://m.blog.naver.com/joyfulmint/223033527757 종로 카페 디저트 맛집 그레인바운더리 종로점 :: 대왕 쿠키 맛집🍪 얼마전 평소에 그렇게 자주 먹지도 않는 쿠키가 마구마구 땡기는 것이 아닌가.. 물론 맛있는 쿠키 먹는 거... m.blog.naver.com 종로점 방문 후기 포스팅 그레인바운더리 성수점 서울 성동구 아차산로 66 1층 매일 11:00-21:00 내가 그나마 안먹던 디저트가 바로 쿠키였는데.....ㅎ 언젠가부터 쿠키까지 먹네? ^^ 나이들수록 디저트 바운더리가 넓어진다. 오히려 덜 먹어야 하는거 아닌가? ㅋ 뭐 여튼 ㅋㅋㅋㅋㅋ 이날도 성수동에 간 김에 그레인바운더리 성수점이 있어 카페인+당보충 겸 들어갔다. 신기하게도 안경점이랑 붙어있고 공간도 공유하고 있었던 특이한 카페. 그래도 종로점보다 깔끔해서 내 취향은 성수점 쪽! 다만 의자는 그리 편해보이지 않았다. 다양한 종류의 쿠키들과 크럼블 중에 뭘 먹을까 하다 결국 쿠키를 선택! 음료는 언제나처럼 아아. 크럼블도 한 번 먹어보고는 싶은데 여기만 가면 일단 쿠키부터 먹게 되는.. 나는 구석 쪽 테이블에 착석했다. 이때 매장이 한산해서 조용한 분위기라 좋았던.ㅎㅎ 이날도 역시나 큰 대왕쿠키.🍪 나는 초코를 좋아하니까.. 더블초콜릿쿠키를 픽했다. 빅 초코칩 쿠키는 지난번에 먹었고 그때 엄청 달다는 걸 알았기에 더블초콜릿쿠키는 어떨지 궁금. 쿠키처럼 달달한 디저트랑 찰떡궁합이었던 아아. 여기 쿠키는 딱딱하지 않고 포크로도 포슬포슬 잘 떼어져서 부드럽게 먹기 넘 좋다. 근데 더블초콜릿쿠키 역시 빅 초코칩 쿠키만큼이나 엄청나게 달았다는 점..ㅎㅎ 그치만 행복해지는 맛이야.. ><🤎 크기는 일반 쿠키의 두 배? 진짜 말그대로 대왕 쿠키인만큼 ㅋㅋ 절대 한 번에 다는 못먹겠다. 그래서 이날도 여기서는 반만 먹었음. 맛있게 먹다가 쿠키 좋아하는 동생이랑 이날 저녁에 만나기로 했던 친구 갖다줄 약과 쿠키도 사서 포장해갔다. 그레인바운더리 성수점 매장은 종로점보다 인테리어가 더 내 취향. 안경점이랑 붙어있어 독특한 구조지만 전체적으로 조용하고 분위기가 좋다. 다만, 테이블이 좀 많이 낮은 편이라 오래 앉아있을만한 자리는 아니었음. 쿠키는 이번에도 역시나 매우 달아서 한 번에 다 못먹고 반이나 남겼지만..ㅎㅎ 그럼에도 쿠키 생각날 때마다 그레인바운더리가 떠오르는 이유는 여기 쿠키가 그만큼 맛있어서겠지..!! 쿠키 하나의 가격이 쎈 편이지만 일반 쿠키의 두 배 이상의 크기라 왜 그 가격인지 납득도 되고 ㅎㅎ 얼려두면 오히려 여러 날 먹을 수 있다. 대왕쿠키 맛집을 찾는다면 방문해 보시길 :) 50m © NAVER Corp. 그레인바운더리 성수점 서울특별시 성동구 아차산로 66 1층"
[성수] 성수동 디저트 카페 추천 ‘그레인 바운더리 성수점’,"그레인 바운더리 성수점 ✅ 위치 : 서울 성동구 아차산로 66 1층 ✅ 영업시간: 매일 11:00-21:00 ✅ tele: 0507-1390-2423 성수동 카페 가려고 찾아보다가 우연히 들어간 곳 안경가게? 랑 매장을 같이 사용해서 카페 맞나…? 했다가 포스터랑 간판 보고 카페 맞구나 하고 들어갔다 그린애플스무디(5,800) 볼빨간 애플유자티 (5,000) 주문 쿠키가 다양해서 먹을까 했지만 식당 웨이팅 걸어놓은 상태라서 패스함 사람도 없고 내부가 아주 한적하고 깔끔해서 좋았다 :) 감성은 없는 빨대 ㅋㅋㅋㅋ 그린애플 스무디 보고 뭔가 불안한 비쥬얼이라 생각함 문방구 슬러시 비주얼 이랄까… 서비스 ? 로 단백질바 비쥬얼의 쿠키를 주시는데 이거 맛있었다 !! 친구가 근데 바닥에 떨어트림 ㅎㅎ 3초안에 주워서 먹음 그냥 … 오 걱정했는데 의외로 맛있었던 스무디 너무 단건 또 싫어하는데 많이 달지 않고 싸구려 문방구 맛 안났음 ㅋㅋㅋ 추천해용 잘 가라앉아서 휘휘 열심히 저어줘야함 약간 방정맞은 친구의 젓기 스킬 ㅋㅋ 이건 홍초 비슷한 맛이 나는데 끝맛이 시큼해서 내스탈은 아니었다… 그냥 좀 애매한 맛…… #그레인바운더리성수점 솔직후기였습니다 :) 50m © NAVER Corp. 그레인바운더리 성수점 서울특별시 성동구 아차산로 66 1층 #성수동카페 #성수동디저트 #성수동데이트 #성수동카페추천 #성수동핫플 #그레인바운더리 #그레인바운더리성수점 #서이추 #서이추환영"
성수동 카페 : 쿠키가 맛있는 그레인바운더리,"그레인바운더리 성수점 / grainboundary 서울 성동구 아차산로 66 1층 매일 11:00 - 21:00 어제 회사분들이랑 식 후 카페로 그레인 바운더리에 다녀왔어요 그레인 바운더리 카페는 성수역 4번출구 도보 5분거리 윤성수 안경점이 있는 건물 1층에 위치해있어요 그레인 바운더리는 보존료와 인공색소를 사용하지 않고 100% 우유버터와 신선한 계란을 사용하여 만든 수제쿠키와 크럼블을 판매하는 카페에요 주차장은 따로 없고 인근 공용주차장을 이용해주시거나 대중교통을 이용해서 방문해주시면 돼요 종로에 본점을 두고 동대문에 2호점, 성수에 3호점을 런칭했어요 또한 신세계백화점 강남점, 본점, 센텀점, 대구점, 대전점에 입점되어 있어서 어느 지역에서든 그레인 바운더리 쿠키를 맛보실 수 있어요 그레인바운더리 카페 영업시간은 평일, 주말 상관없이 매일 오전 11시부터 밤 9시까지 운영하고 있으니 방문하실 분들은 참고해주세요 성수동 카페 : 쿠키가 맛있는 그레인바운더리 재생 35 좋아요 0  접기/펴기 성수동 카페 : 쿠키가 맛있는 그레인바운더리 확실히 쿠키, 크럼블 전문점이라 그런지 다양하고 선택의 폭이 넓었고 가지각색의 디자인부터 맛까지 다른 그레인바운더리만의 차별화 된 쿠키를 먹어볼 수 있어서 좋은 것 같아요 그레인바운더리 카페 시그니처 대표 메뉴는 빅초코칩 쿠키, 카라멜크랜베리 쿠키에요 그 외 쿠키는 더블 초코 스모어 쿠키, 오레오 스모어 쿠키, 더블 에스프레소 스모어 쿠키, 누텔라 스모어 쿠키, 바나나 스모어 쿠키, 포레누아 체리 쿠키, 버터 스카치 쿠키, 초콜렛 크림치즈 쿠키, 얼그레이 피스타치오 쿠키, 무화과 피칸 쿠키, 믹스 넛 쿠키, 모카 쿠키, 더블 초코 쿠키, 녹차 쿠키, 초코나무 숲 쿠키 등 종류가 많아서 골라먹는 재미가 있었어요 쿠키는 모두 200g 이상으로 시중 쿠키의 3-4배 정도라서 눈으로 봐도 크기가 일반 쿠키와는 확실히 달라보였어요 저희가 주문한 메뉴는 빅 초코칩 쿠키 6,000원 카라멜 크랜베리 쿠키 6,000원 초코나무 숲 쿠키 6,500원 테이크아웃으로 포장한다고 요청드리고 총 주문금액 18,500원 과장님께서 결제해주셨어요 쿠키 말고도 커피, 티, 음료도 다양하니 원하시는 메뉴로 골라서 주문해보세요 성수동 카페 : 쿠키가 맛있는 그레인바운더리 재생 4 좋아요 0  접기/펴기 성수동 카페 : 쿠키가 맛있는 그레인바운더리 그레인바운더리 카페 내부는 아담하고 작았고 화이트 원목 인테리어로 꾸며져 있었고 감성적이고 따뜻한 분위기도 들었어요 다른 카페랑은 다르게 조용해서 책을 읽거나 노트북하기에도 좋더라고요 제가 갔을 때에도 노트북하고 계신 손님도 있었어요 제가 먹은 빅 초코칩 쿠키는 달콤한 초콜릿청크가 들어가고 은은한 피넛버터향과 로스팅된 견과류의 풍미를 느낄 수 있는 겉바속촉한 쿠키였어요 회사분들이 주문한 카라멜 크랜베리 쿠키는 달콤한 카라멜, 은은한 피넛버터향과 새콤한 크랜베리의 조합을 느낄 수 있는 쿠키였대요 초코나무 숲 쿠키도 그렇게 너무 달지 않고 적당해서 맛있다고 하셨어요 제가 먹은 빅 초코칩 쿠키가 왜 시그니처인지 먹어보니 알 수 있었어요 성수동에서 쿠키나 크럼블, 버터바 맛집을 찾고 계신다면 그레인바운더리 카페 어떠신가요 ? :) 그레인바운더리(@grainboundary_official) • Instagram 사진 및 동영상 팔로워 30K명, 팔로잉 43명, 게시물 1,105개 - 그레인바운더리(@grainboundary_official)님의 Instagram 사진 및 동영상 보기 www.instagram.com 50m © NAVER Corp. 그레인바운더리 성수점 서울특별시 성동구 아차산로 66 1층 #그레인바운더리 #그레인바운더리성수 #디저트카페 #성수쿠키 #성수카페 #성수역카페 #성수동카페 #뚝섬카페 #뚝섬역카페"
성수동 디저트 카페 | 수제쿠키 맛집 그레인바운더리 (grainboundary),"팝업스토어, 쇼룸 등 트렌디한 볼거리가 많아 자주 가게 되는 성수동 ♥ 이미 가본 카페가 많아서 방문할 때마다 어떤 카페를 갈지 늘 고민이다 성수동 카페거리를 둘러보면서 괜찮은 카페 없을까 찾아보다가 눈에 띈 그레인바운더리 성수점 신세계백화점에도 입점되어 있는 카페로 수제쿠키와 크럼블로 유명한 디저트 맛집이다 그레인바운더리 성수점 @grainboundary_official 영업시간 매일 11:00 - 21:00 성수역과 뚝섬역 사이에 위치하고 있으며 성수역 4번 출구 뚝섬역 5번 출구에서 도보로 4분 정도 걸리는 역에서 가까운 카페 take out discount 포장을 하는 경우에는 음료를 2.5 ~ 3.5 정도로 착한 가격으로 판매 중이다 보존료와 인공색소를 사용하지 않고 100% 우유버터와 신선한 계란을 사용하여 수제쿠키와 크럼블을 만드는 카페 브랜드 쿠키 크럼블 등 디저트 전문점이지만 선택할 수 있는 음료의 종류가 다양해서 좋았다 커피가 당기지 않아서 티와 에이드 위주로 살펴보았다 디저트 전문점답게 쿠키 크럼블 버터바까지 디저트 종류도 굉장히 다양하다 쇼케이스에서 실물로 구경할 수 있어서 사진으로 자세하게 담아보았으니 함께 구경하기 ◡̈ 카페 오기 직전에 붕어빵을 먹기도 했고 이야기하다가 바로 밥을 먹으러 갈 예정이라 디저트를 먹지 않기로 했는데 쿠키와 파운드 케이크의 비주얼을 보니 먹고 싶은 마음이 굴뚝같이 커졌다 ... 그치만 함께 간 친구가 디저트는 별로 당기지 않는다고 하여 주문은 따로 하지 않았음! ( 대신 사장님이 주신 서비스를 받았다 ...♥ ) 🍸 더블베리아이스티 5.0 🍸 그린애플스무디 6.5 🍸 서비스 크럼블 딸기 홍차에 레몬과 라즈베리가 가미된 상큼달달한 더블베리아이스티 끝맛이 살짝 홍초?의 시큼한 맛이 나는 것 같아 만족스러운 음료는 아니었다는 솔직후기 ㅠㅠ 풋풋하고 상큼함이 느껴지는 그린애플스무디 생김새는 어렸을 때 먹던 슬러시처럼 생겨서 혹시 불량식품맛이 나지 않을까?했는데 너무 달지 않은 깔끔하고 청량한 사과맛이다 친구가 시킨 이 음료는 대만족 🫶🏻 서비스로 받은 디저트라 정확한 이름은 모르겠지만 요거트맛이 나는 달달한 크럼블 엄청 맛있었다 !! 얼마 먹지 못하고 바닥에 떨어뜨려서 속상했다는 비하인드 .. 🥹 성수 쿠키 맛집 그레인바운더리 재생 0 좋아요 0  접기/펴기 성수 쿠키 맛집 그레인바운더리 모던한 내부 인테리어도 마음에 들어서 사진도 여러 장 찍었다 카페 바로 옆 공간에 윤서울 성수라는 안경점이 함께 있어서 전체적으로 차분하고 조용한 분위기 모던한 인테리어에 끌려서 들어가 본 성수동 카페 그레인바운더리 시끄럽지 않은, 차분하게 이야기 나눌만한, 맛있는 디저트가 있는 카페를 찾을 때 방문해보면 좋을 듯하다 see you🤍 Copyright ⓒ 2023 by gomii all rights is reserved. 50m © NAVER Corp. 그레인바운더리 성수점 서울특별시 성동구 아차산로 66 1층"
"성수동 뚱쿠키 크럼블 맛집 [ 그레인바운더리 ] 무화과치즈크럼블, 더블에스프레소스모어쿠키, 캬라멜크랜베리쿠키, 토마토바질에이드","성수동 뚱쿠키 맛집 [ 그레인바운더리 ] 무화과치즈크럼블, 더블에스프레소스모어쿠키, 캬라멜크랜베리쿠키, 토마토바질에이드 서울 성동구 아차산로 66 1층 가끔 달달한 쿠키에 아아 한입 하고 싶은 날이 있어요 ! 예전에 친구가 알려줬던 쿠키맛집 중에 [ 그레인바운더리 ] 라고 있었는데 마침 성수동에 있어서 다녀왔어요 ♥ 엇 .. ? 여기가 카페 였다고요 ... ? 성수 갈때마다 지나갔던 곳이었는데 안경집으로만 알았지...ㅎ 숨은 성수카페가 있더라고요 !? 카페가 되게 아늑해요 ♥ 어느순간부터인지 작은 카페를 찾아다니게 되더라구요 아늑한 매력이 있어서 그런가봐요 ♥ 진짜 화들짝 놀랐어요 ,, 😳 휘둥그레질 수 밖에 없는게 이렇게 많은 쿠키가 있는 곳은 처음이에요 !! 20가지 쿠키가 있어요 !!!! 기본 쿠키부터 종류가 다양해요 !! . . 스모어쿠키 종류 다양한게 제일 좋았어요 ,,, ♥ 게다가 크럼블 종류까지 다양하더라구요 !! 크럼블은 얼먹해서 먹으면 그렇게 맛있다고 하던데 히히 꽉꽉 채워져있어서 사진으로만 봐도 묵직함이 느껴지지않나요 !? 라즈베리치즈크럼블 먹을까 하다가 무화과치즈크럼블 골라봤어요 ! 🤧 무화과 되게 좋아하거둔요 ♥ 성수 카페 그레인바운더리 메뉴 달달한 쿠키에는 당연히 아이스아메리카노 ! 그리구 친구가 맛있다고 했던 토마토바질에이드도 추가로 ! ㅎㅎㅎ 옆에는 한눈에 볼 수 있게 되어있었어요 ! 이렇게 모아놓고 보니까 상당해요 ?! 그레인바운더리에서 쿠키 27종 / 크럼블 20종을 만날 수 있더라구요 !! 사람은 두명이지만 음료 3잔 / 디저트 3개 크크 맛있는게 너무 많아서 고민고민하다가 겨우 골랐다구요 ^^ ;; 가장 기대했던 더블에스프레소스모어쿠키 커피향이 가득해요 ! 그리구 쿠키를 한번 데워주시더라구요 !!! 스모어가 쭈우우우욱 늘어나요 ♥ 캬라멜크랜베리쿠키는 진짜 역대급 묵직했어요 ㅋㅋㅋㅋㅋㅋ 크랜베리가 한가득 들어있어요 !!!! 크랜베리 좋아하는 저로써는 식감 대박 ,,, ♥ 대왕뚱쿠키 들어서 반으로 쪼게 보고 싶었는데 그레인바운더리 쿠키로 해봤지롱ㅋㅋ 내가 만든 쿡키이이잉이ㅣ ♥ 쿠키 한입 아메리카노 한입 최고 !! 토마토바질에이드는 처음인데 ! 친구가 여기 에이드 맛있는거래요 ! 처음 맛보는거라서 신기해써요 히히 토마토 맛있더라구요 ㅋㅋㅋ 여름에 상큼한 음료 먹고 싶을 때 요고요고 생각날거 같은 ♥ 예쁜 곳에서 달달한 거 먹으니까 기분이 좋을 수 밖에 ~~~ ♥ 이제 나는 으른이니까 카페 가면 아이스아메리카노 마시는데 ! 사실 속으로는 쓰면 어쩌지..... 생각하구 있단말이에요 ㅋㅋ큐ㅠㅠ 역시나 이번에도 첫 입 마실 때 조마조마 했는데 되게 고소했어요 !!!!! 친구도 왜이렇게 고소하냐며 ㅋㅋㅋ!!! 아메리카노 성공 ♥ 무화과치즈크럼블에 무화과가 엄청 들어가 있어요 !! 보통 잘게 잘게 들어있는데.......ㅋㅋ 크럼블 하나에 무화과 하나 전부 다 들어있는게 아닌가 싶고 ! 이맛에 뚱쿠키 먹는건가봐 ♥ 그레인바운더리 쿠키랑 크럼블은 온라인에서도 만나 볼 수 있더라구요 ! 굳이 카페 안가도 집에서 먹을 수 있는 거 좋아 ㅠㅠ 달달한 디저트 좋아하신다면 꼭꼭 한번쯤은 ,, 🫶🏻 +++ 집에서 가족들이랑 먹었거든요 !? 우리 가족들은 단 거 안좋아하는데도 쿠키 맛있다고 하는데 괜히 기분 좋음 😛 아그리구 쿠키랑 크럼블 얼먹했는데 세상 맛있음.......ㅠㅠㅠ 솔직히 말하면 그냥 먹는거 보다 맛있었던 ㅋㅋ 이제 무조건 얼려먹을거야 ㅠㅠㅠㅠㅠ **솔직후기** 포스팅의무없음"
[성수역/성수동] 대왕 쿠키가 있는 카페 - 그레인바운더리 성수,"안녕하세요 :) 오늘은 성수역 근처?!에 있는 쿠키집을 가보았어오 입구가 요렇게 생겼는데 안경집이랑 같이 붙어있떠라구여!? 저는 잘못들어가는줄알고 한참 기웃거렸서요 ㅋㅋ 들어가자마자 눈을 사로잡는 쿠키..! 모형도 있었지만 실물도 있었고, 실물이 진짜 뚠뚠하고 크기도 왕큽니다.. 이렇게까지 클 줄 몰랐는데 너무 커서 다 못먹을까봐 못사먹었어요 ㅠㅠ (아숩) 쇼케이스 안에는 크럼블도 판매하고 있었어요 이 날 점심을 너무 거하게 먹는 바람에 아무것도 못먹은게 너무 속상하네요! 카페.. 내부 자리랄까요? 안경점이랑 같이하셔서 그런지 안경맞추러오셨다가 대기하시는 분들도 잠깐 앉아있다 가시고 하더라구요~? 저는 커피 마시면서 앉아있었습니다. ㅎㅎ 엄청 조용해요.. 커피도 왕큰잔에 주시고요, 산미없이 맛있었던거같아요! 뚠뚠한 쿠키 좋아하신다면 가셔서 꼭 쿠키 드셔보세요! 저도 다음에 또 간다면 포스팅 또 쓰겠습니다~! 50m © NAVER Corp. 그레인바운더리 성수점 서울특별시 성동구 아차산로 66 1층 주소 : 서울 성동구 아차산로 66 1층 전화번호 : 0507-1390-2423 영업시간 : 매일 11:00 - 21:00 주차 : 불가능"
"성수 쿠키 맛집, 그레인바운더리(grain boundary), cookie 추천","커피와 어울리는 디저트로는 뭐가 있을까요? 저는 평소 커피와 초코맛이 진한 디저트를 먹는 걸 좋아하는데, 남친 차에서 유일하게 허락되는 디저트가 바로 쿠키 입니다. 차마 저도 양심적으로 케이크는 안 먹고, 힘든 날에는 초코 쿠키와 커피를 먹는데, 초코의 달달, 쌉쌀, 쓴맛이 커피와 함께 먹으면 그 맛이 더 강렬해져서 좋아하는 조합입니다. 남친 생일 선물로 성수동의 핫한 안경점 YUN에 방문했을 때, 같은 공간 안에 힙한 쿠키점 그레인 바운더리(grain boundary)가 함께 있어, 커피와 크럼블를 주문해서 먹어보았습니다. 당연히 쿠키도 사서 집에 돌아갔습니다. 안경이 준비되는 시간 동안, 같이 그레인 바운더리 구경해보시죠! 토요일,일요일 우리에게 주어진 48시간 중 이런저런 시간을 빼면 사실 저희가 주말동안 온전히 사용할 수 있는 시간이 10시간 정도 될까요? 그런데 이 시간동안 평일에 못했던 일들을 하려고 하면 매주마다 그 시간이 턱없이 부족한 거 같습니다. 남친의 안경을 함께 골라주고, 한두시간 정도 기다려야한다고 해서, 저랑 남친도 이 기다린 시간이 너무 아깝다고 고민하고 있었는데, 다행히 안경점 안에 그레인바운더리가 있어 바로 커피 한잔을 하면서 평소에 나누지 못했던 이야기를 나누고, 바로 안경을 픽업해서 다음 장소로 이동하기로 했습니다. 시간 절약하기 좋은 동선이었습니다. 5m © NAVER Corp. 윤 성수 서울특별시 성동구 아차산로 66 1층 예약 그레인바운더리 성수점 서울특별시 성동구 아차산로 66 1층 건물 앞에 주차 공간이 두자리있어서 저희처럼 안경 맞추러오셨다가 커피 한잔, 디저트 하나 즐기시면 딱 좋을 공간인 것 같습니다. 저희처럼 꼭 안경이 아니더라도, 바로 그레인바운더리로 입장할 수 있는 별도의 문이 있으니, 어떤 문을 이용하셔도 좋습니다. 어떤 문으로 들어가도 두 공간이 다 개방되어 있어, 편하게 왔다갔다할 수 있습니다. 남친은 안경테를 고르다가 커피가 마시고 싶다고 해서 이미 아이스 아메리카노(4,500원)를 주문해서 가지고 돌아다녔고, 안경 주문 후 저만 추가로 뜨거운 아메리카노(4,000원)를 주문하였습니다. 디저트로 무엇을 먹을까 고민했는데, 그레인바운더리에는 크게 두 종류의 디저트가 있습니다. 27가지의 쿠키나 20가지의 크럼블이 있는데, 쿠키는 저희에게 익숙한 디저트지만, 다른 종류인 크럼블은 조금 생소한 디저트 입니다. 영국의 디저트인 크럼블은 과일 위에 버터, 밀가루, 설탕, 아몬드 가루등으로 만든 반죽을 소보로처럼 굵게 부수어 덮어주는 방법으로 만들어 집니다. 이미 먹어보았지만, 남친에게 크럼블을 처음 먹어본다고 하고, 무화과 크럼블(7,000원)을 추가로 주문 하였습니다. 가격이 비싸다고 생각할 수도 있지만, 기본적으로 사이즈가 성인 여성의 주먹보다 크다보니, 다른 디저트와 비교했을 때 절대 비싼 가격이 아니었습니다. 크럼블은 크게 다섯가지 카테고리로 나뉘는데, 1) Fresh and Sweet, 2) Filled with Valrhona Chocolate, 3) Sweet Potato, 4)Sweet and Salty, 5)Blondie 중 저는 1번 프레쉬 앤 스위트에서 무화과 크럼블을 주문하였습니다. 기본적으로 밀가루 맛이 덜 느껴지고, 무화과를 엄청 많이 넣어구나라는 생각이 들 정도로 재료를 아끼지 않고 넣은 맛이니, 커피와 함께 드시길 추천 드립니다. YUN 안경과 크레인 바운더리 공간을 합쳐서 본다면 정사각형 구조에 가깝지만, 실제 카페 공간만 본다면 직사각형으로 길게 공간이 뻗어 있습니다. 입구에서 주문을 마치고 안쪽으로 들어가면 테이블과 좌석이 있어 앉아 이야기를 나눌 수 있습니다. 뒤에 보이는 공간도 YUN안경과 바로 연결되어 있어 자유롭게 양쪽 공간을 이동할 수 있습니다. 원래는 안경이 나올때까지 기다리면서 천천히 이야기를 나누려고 했는데, 남친이 도저히 2시간이나 카페에 앉아있기 어렵다고 해서, 안경은 다음번에 찾기로 했습니다. 데려오기도 힘들고 같이 데리고 있기도 힘들고, 나이만 먹었지 초딩같은 남친을 만나고 있는건 아닌가라는 생각이 들었습니다. 이런 저의 생각을 읽었는지, 카페를 나서는 길에 초코렛 쿠키를 사줘서 봐주기로 했습니다. (단거에 많이 약한 나)"
