title,content
"성수동 카페 맛집 | 묘사서울 :: 서울숲 카페 맛집 (빙수, 디저트)","Tasty Road 서울숲 카페 / 묘사서울 주소: 서울 성동구 서울숲2길 2 2층 전화: 없음-> 문의사항은 인스타그램 DM 영업시간: 12:00 - 22:00 묘사서울ㅣCoffee for Thought(@myosa_seoul) • Instagram 사진 및 동영상 팔로워 4,831명, 팔로잉 2명, 게시물 307개 - 묘사서울ㅣCoffee for Thought(@myosa_seoul)님의 Instagram 사진 및 동영상 보기 instagram.com 지난 주말에는 문득 평소에 자주 가지 않는 동네를 가고 싶어서 오랜만에 성수동에서 데이트를 하기로 했어요 성수동 맛집 | 난포 :: 서울숲 한식 맛집 (웨이팅 꿀팁, 예약, 주차) Tasty Road 서울숲 맛집 / 난포 위치: 서울 성동구 서울숲4길 18-8 지층 전화: 02-468-1540 영업시간: 매... m.blog.naver.com ^ 남자친구가 미리 웨이팅을 걸어놨던 난포에서 점심을 먹은 뒤 예전부터 메모장에 <성수동 카페 맛집 - 묘사서울, 귀여운 디저트>라고 적어놨던 묘사서울 카페를 가기로 했어요 사실 성수동 카페라고 해서 성수역 근처인 줄 알았는데 뚝섬역과 서울숲 역과 가깝더라고요 뚝섬역 근처 골목에 이렇게 예쁜 카페와 맛집들이 몰려있는지 몰랐어요 카페가 주택 골목 사이에 위치해 있어 주차는 근처 공영주차장에 하고 왔어요 2층에 위치한 묘사서울 처음에 아래층에 있는 카페와 헷갈렸어요 입구가 바로 계단이다 보니 거기가 2층인 줄.. 올라오다 보면 위와 같은 카페 포스터가 붙여져 있으니 한층 더 올라오시면 돼요 약간 진짜 가정집 들어가는 느낌이죠? 처음엔 밖에선 조용하고 아무 소리도 안 들리길래 영업 안 하시는 줄 알았어요 묘사서울 내부 가정집을 개조해서 만든 카페 시멘트의 느낌을 그대로 살렸고 중간에 우드 느낌으로 인테리어를 하셨어요 깔끔하면서도 약간 독특한 느낌 자리마다 아래에 방석이 놓여 있으며 의자 밑에 돌을 받치고 있는 신기한 자리도 있어요 처음에 나무 위에 앉는 자리에 앉았는데 테이블보다 높아서 약간 불편해서 자리를 옮겼어요 ㅠㅡㅠ 저희가 앉았던 안쪽에는 이렇게 통창이 있어 답답하지 않았고 무엇보다 저희가 갔을 때는 분위기가 차분하고 조용해서 대화하기 좋았어요 (얼마 지나고 바로 만석이 되긴 했지만.... 그만큼 핫플인 거겠지요? ᄒᄒᄒ) 묘사서울 메뉴 붕어빵과 앙큐브 디저트로 유명한 카페인만큼 그 밖에도 여러 가지 다양한 디저트들이 있었어요 위와 같이 아이패드에 사진을 보여주시면서 디저트 메뉴들을 친절하게 설명해 주셔서 고르기 더 편했어요 주문한 메뉴 흑임자라떼 7,000원 빙쑥 7,500원 붕어 4,300원 동그라미 5,000원 묘사서울은 쑥라떼, 인절미라떼, 흑임자 라떼가 시그니처라고 하시길래 흑임자 라떼와 8월의 메뉴 중에 하나인 빙쑥을 시켰고 디저트는 붕어 그리고 동그라미 구성으로 시켰어요 빙쑥 7,500원 남자친구가 극찬하며 먹었던 빙수 곱게 갈아내린 얼린 쑥 우유 위에 부드러운 쑥 크림과 고소한 인절미 크럼블이 올라간 메뉴에요 저도 몇 입 먹어봤는데 쑥 향이 확 풍겨오면서 적당히 달달하고 시원한 게 너무 맛있더라고요 평소에 쑥라떼 좋아해서 많이 마셔봤는데 여기 쑥 라떼도 무조건 맛있겠다고 생각했어요 흑임자라떼 7,000원 약간 비싸다고 생각하긴 했지만 맛있으니 용서.. 쑥빙수와 마찬가지로 적당한 달콤함에 고소함이 느껴지는 음료였어요 붕어 4,300원 동그라미 5,000원 보통 붕어와 앙큐브를 많이 드시는 것 같은데 저희는 붕어와 동그라미 조합으로 시켜봤어요 동그라미는 달달한 모나카 위에 팥 크림과 네 가지 맛의 앙금이 올라가져 있는 디저트예요 모나카와 앙금을 베어먹어봤어요 솔직히 특별한 맛인지는 모르겠는데 앙금이 엄청 부드러웠고 모나카와의 조합이 좋았어요 사실 맛을 떠나서 보기만 해도 기분이 좋아지는 디저트였답니다 붕어는 평소에 먹어 본 앙버터 맛으로 짭짤하며 달콤했어요 아메리카노와 먹으면 조합이 좋을 것 같네요 맛있는 음료와 귀여운 디저트가 가득했던 성수동 카페 다음엔 쑥 라떼와 테린느도 먹어보고 싶네요 성수동 카페, 서울숲 카페 맛집을 찾고 계시다면 묘사서울 추천드려요 :) #내돈내산 #성수동카페 #서울숲카페 #묘사서울 50m © NAVER Corp. 묘사서울 서울특별시 성동구 서울숲2길 2 2층"
"성수동 뚝섬역 서울숲 카페 | 묘사서울, 막나가쇼 디저트 노마드족 서있는 붕어빵, 가오픈 신상 카페, 인플루언서 인증하기 카페","성수동 뚝섬역 서울숲 카페 | 묘사서울, 막나가쇼 디저트 노마드족 서있는 붕어빵, 가오픈 신상 카페, 인플루언서 인증하기 카페 단풍이 유난히 긴 이번 가을 겨울을 맞는 이 시점에도 단풍이 남아있다. 한컷 성공하고 기분 좋았던 날. 이 자리에는 혼자 온 손님이 먼저 앉아있었는데 의외로 이 집은 혼자온 손님이 많았다. 또한 남성 손님도 많은 편이었는데 의상 업계 사람들이었는지 특이한 옷차림도 눈에 띈다. 여하튼 단풍이 드리운 성수고등학교 뷰가 이 집의 명당이다. 50m © NAVER Corp. 묘사서울 서울특별시 성동구 서울숲2길 2 2층 T 070-7576-0840 A 서울 성동구 서울숲2길 2 2층(지번 서울 성동구 성수동1가 685-486 2층) O 12:00 ~ 22:00 2호선 뚝섬역8번 출구에서 598m http://www.instagram.com/myosa_seoul 묘사서울ㅣCoffee for Thought(@myosa_seoul) • Instagram 사진 및 동영상 묘사서울ㅣCoffee for Thought(@myosa_seoul)님을 팔로우하여 사진 및 동영상을 놓치지 않고 확인해보세요. www.instagram.com 아인슈페너(7.) 쑥라떼(7.) 붕어(4.3) 쑥라떼가 특이해 시켜봤는데 맛이 꽤나 좋았다. 아인슈페너는 달달한 크림과 커피가 디저트하기 좋다. 얼마 전 새로 시작한 막나가쇼에서도 성수동 3대 빵집 편에서 새로 생긴 이 집이 노출됐다. 생기자마자 어떻게 3대 빵집으로 나왔는지는 모르겠지만 3대 빵집이라기엔 빵집이 아니고 빵순이들이 즐기기엔 그냥 디저트. 어하튼 붕어란 이름의 붕어빵은 내취향엔 딱 좋았다. 직접 만들었다는 가염버터는 팥과의 궁합이 👍🏻 특히, 원래 호빵에 버터를 발라 먹은 취향이라 나에겐 더욱 좋았다. 다만 너무 작은 크기에 4천원대 붕어는 사실 한입거리. 나중에 보니 모든 디저트들이 가격대비 크기가 너무 작았다. 또한 주문할때는 1인 1음료란 말이 없어 음료 대신 디저트를 주문했는데 나중에 1인 1음료라며... 어쩌라는 건지 모를 말을 했지만 우리가 처음부터 말을 해줬어야 알지 않느냐는 반응을 하자 다음부턴 그렇게 해달라고. 사실 디저트가 이렇게까지 작은줄 알았다면 시키지 않았을듯. 맘애 들었던 쑥라떼 들고 한컷 ㅋ 다른 창은 바로 다른 건물이 붙어있어 답답함 주의 나머지 공간들은 자연스러움을 추구한 한식 풍의 인테리어다. 자칫 길에서 뭘 주워왔나 하는 느낌이 들수도 있지만 요즘 스타일이려니😂 건물을 지나다 자칫 그냥 지나칠 수도 있는 위치이며 지하철 역과은 다소 멀다. <메뉴 참고> 가격은 요즘 다 이렇게 올랐나 싶게 가격대가 좀 있다. 공감과 댓글은 사랑입니다❤️ 이웃 추가 감사합니다🙇🏻‍♀️ <함께 가면 좋은 맛집> 성수 뚝섬역 서울숲 맛집 | 성수동 호호식당, 맛과 인테리어를 다 잡은 일본가정식집 성수 뚝섬역 서울숲 맛집 | 성수동 호호식당, 맛과 인테리어를 다 잡은 일본가정식집대학로에서 유명해진 ... m.blog.naver.com"
반차 쓰고 성수동 나들이 - 묘사서울/ Perment bake shop(퍼먼트)/ 웨이크앤베이크/ 성수 디올,"어린이날이 낀 황금연휴 금요일에 반차를 쓰고 회사 근처 성수동으로 나들이를 갔다. 오랜만에 만난 대학 동기 하지만 오전에 일하고 바로 친구를 만나자니 나의 저질체력이.. 오늘 일정에 발목을.. 12시부터 피곤해서 너무 집에 가고 싶었음..ㅋ 남들 밥 먹을 때 카페 가고 남들 카페 갈 때 밥 먹자고 상호합의하에 12시부터 카페로 감;; 핫플에서 살아남기 가능할까? 묘사서울 묘사서울 서울특별시 성동구 서울숲2길 2 2층 멀리서 온 친구.. 양갱을 좋아하는 친구.. 그 친구가 가고 싶어 하던 '묘사서울'로 갔다. 인스타로 많이 접한 카페 항상 가보자 해놓고 안 가던 카페를 드디어 가본다. 내비 찍고 갔는데 눈에 많이 안 띄어서 찾느라 애 좀 썼다;; 옛날 가정집 느낌 나는 입구 엄청 넓은 카페는 아니지만 양옆에 통창이 있어서 탁 트인 느낌을 주는 조용한 카페이다. 오픈 시간에 가서 다행히 창가 자리를 사수할 수 있었다. 더치커피, 흑임자라떼 앙큐브, 시즌메뉴 흑호(모나카) 를 주문했다. 주문하기 전에 사장님이 패드로 디저트를 이미지랑 같이 설명해 주셔서 좋았다 :) +) 앙큐브는 하나를 시키면 4종류의 아담한 앙큐브가 나온다 . 플레이팅 좋고 커피 맛있고 개인적으로 흑호 강추 Perment bake shop perment 서울특별시 성동구 서울숲6길 12 1층 아까도 말했다시피.. 「 남들 밥 먹을 때 카페 가고 남들 카페 갈 때 밥 먹자고 」 했으나.. 알고 보니 그 남들은 밥 먹을 시간에 밥 먹고, 카페 갈 시간에도 밥 먹는 남들이었나봄..ㅋㅋ 그렇게 웨이팅과 브레이크타임으로 밥을 못 먹고 식당을 찾아.. 헤매는데.. - 오거트가 있는 골목을 정처 없이 걷다가 눈에 띈 가게 하지만.. 들어갈까 말까 굉장히 망설이던 찰나에 뒤에 있던 커플이 여기야 물론 우리한테 한 말은 아니지만.. 라고 하는 말에 친구랑 나는 홀린 듯 이곳으로 들어가게 됨ㅋㅋㅋㅋㅋ 운명이었을까?(암튼,,) 분위기도 좋고.. 의자도 편하고 다리 아프고 힘들었는데 잘 쉴 수 있었음 (밥 못 먹어서 좀 짜증 난 것만 빼고) 역시나 창가 자리는 다 찼고, 벽 쪽으로 자리를 잡고 빵을 고르는데 보아하니 퀸아망 맛집인 거 같아 보였음 - 카운터에 가서 빵이랑 음료를 계산하면 음료 제조해서 테이블로 가져다준다.. 요즘 같은 셀프 시대에 이런 거? 오히려 좋아♥ 친구는 퍼먼트 샌드위치 난 계란이 들어간 저 빵.. 이름이 생각 안남ㅋㅋㅋ 뭔가 계란빵 먹는 듯한 기분이었.. 그치만 맛있음 맛있으면 된 거 :) - 기대 안 하고 홀리듯 들어왔지만 편하고 맛있는 카페 나중에 다시 간다면 잠봉뵈르 도전..! Wake & Bake 웨이크앤베이크 성수 서울특별시 성동구 서울숲2길 28-12 지하1층 골목을 걷다 보면 '웨이크앤베이크'가 나온다.. 요기도 인스타 어딘가에서 본 것 같다.. 낯설지가 않아.. 친구는 수원에서 먹어봤다고 한다 백화점에 입점해 있다나? 엄청 맛있었다며 에그타르트와 스모어타르트를 추천해 주었었으나.. 초코는 불호라 스모어타르트는 스킵.. 치즈타르트 존마탱 뭐가 맛있을지 고민하다가 삼..^^ 에그타르트 치즈타르트 몽블랑타르트 비싼 물가에 익숙해져서 인지.. 타르트 개당 3000원,, 딱히 비싸다는 느낌은 안 든다 물가에 무감각해지는 중..ㅋ - 집에 가서 먹어보니 부인할 수 없는 JMTGR! 바삭바삭하니 만약에 또 먹게 된다면 치즈타르트를 먹고 싶다:) (역시 사 먹길 잘했어) ** 냉장고에 넣은 후에 먹어도 바삭바삭함이 유지됨! 서울숲에 사람이 너무 많아서 걸어서 성수로 넘어갔다.. 오늘은 불금이 아니었던가? 성수인데 사람이 별로 없다.. 라고 생각하는 순간 사람들은 모두 디올 팝업 스토어에 있었음.. 아무 생각 없이 친구랑 걷다가 왜 이렇게 사람이 많아? 하고 주변에 갔다가 발견.. - 뜻하지 않게 핫플을 지나쳤다. 크리스찬 디올 성수 서울특별시 성동구 연무장5길 7 질 수 없다..! 하여, 나도 외관 사진 찍음ㅋㅋㅋㅋㅋㅋ 역시 디올.. 외관에 돈을 많이 쓴 티가 난다. 막 찍어도 사진이 잘 나온다 :) 이래 봬도.. 아직까지 아이폰8 씁니다만? 내 기준 잘 나온 사진 비록 밥은 못 먹었지만 카페도 2군데 가고, 타르트도 사고, 뜻하지 않게 발견한 디올 팝업스토어 사진도 찍고 12시부터 8시까지 2만보 걸은 날 ^^ 뿌-듯 #성수나들이 #성수카페 #뚝섬카페 #서울숲카페 #묘사서울 #퍼먼트베이크샵 #웨이크앤베이크 #디올성수 #직장인반차"
성수동 카페 투어 묘사서울 여긴 모르면 안 됩니다,"안녕하세요! 오늘 투표날이네요 다들 투표하러 가시죠? ㅎㅎ 저도 가족들이랑 점심 식사하고 바로 투표 하러 가려고 해요 그러고 잠 좀 자야지 ㅠㅠ 넘 피곤피곤.. 그건 그거고 오늘은 카페 투어 이야기에요 거의 주 1회 정도 다루고 있는데 음.. 맛집보다 카페 다녀온 게 더 많은데 카페 소개부터 언능 해야겠어요 사진 이러다가 썩고 트렌드도 지나가겠다 아니 요즘 카페 투어 하면 성수동이잖아요!! 진짜 성수동 ~ 뚝섬에 널린 게 카페도 또 인스타 카페 핫 플 보면 대부분이 이쪽 동네더라고요 올 초? 작년 말? 즈음부터 본격적으로 저도 카투에 입문하게 되었는데요 입문을 성수동에서 아마 가장 유명한? 유명한 곳 중 하나인 묘사서울 이라는곳 알고, 방문하게 되었어요 정말 지금도 좀 그렇지만 한때 인스타 켜면 여기 사진만 보일 정도였어요 ㅋㅋㅋ Next image 묘사서울은 성수동 카페거리 끝자락에 위치해 있어요 이쪽 길 지나가는데 예쁘고 감성 있는 카페가 꽤나많이보이더라구요 어디 갈지 모를 때는 그냥 이쪽 길 들어와서 괜찮아 보이는 곳 아무 데나 들어가면 될 거 같아요 다 이뻐요 다 ㅎㅎ 천천~히 동네 구경 하면서 지도 따라 도착한 묘사서울 인스타에서만 보다가 실제로 오게 되니 두근두근 매장은 주택을 개조한 모양이더라구요 지도 따라 도착을 하긴 했는데 여기가 맞나..? 싶었는데 네, 맞네요 맞아요 ㅎㅎ 평일에 와도 자리가 없을 경우가 많다던데 주말에 가서 자리 없을까 봐 완전 걱정됐어요 그나마 일요일이니 한두 자리는 있지 않을까 싶었는데 만석이더라구요 ㅠㅠ 이를 어쩌나.. 하는 순간 마침 손님 한 팀이 나가셔서 바로 앉을 수 있었어요 휴 .. 다행 !! 성수동 카페 묘사서울의 메뉴판이에요 나무 쪼가리에 메뉴판을 해 놓은 게 인상적이에요 이런 것도 감성이다 감성 ~!! 우선 음료는 아인슈패너와 아메리카노를 선택했구요 묘사서울만의 디저트 ! 제일 유명한 붕어와 티라미쑥을 주문했어요 여기 카페의 특징이자 사람들이 좋아하는 게 시즌별 디저트 모양을 달리한다는 거예요 예를 들어 크리스마스면 트리 모양의 디저트를 만들거나 올 초에는 쥐의 해라고 쥐 모양으로 디저트를 만들고 뭐 그러더라구요 ~~ 그래서 그거 보러 또 많이들 가는 거 같아요 다녀온 분들 사진 보면 참 귀엽게 잘 만드시는 거 같아요 ㅋㅋㅋ 주문을 하고 자리에 앉아서 기다렸어요 자리 앉아서 기다리는데도 손님이 계속 계속 들어오더라고요 정말 핫플중 핫플이긴 한가 봐요 Next image 짜잔 주문한 메뉴가 나왔어요 음료랑 디저트 ~!! 인스타에서만 보던걸 실제로 보니 뭐랄까 연예인 본 기분이랄까요 ㅋㅋㅋㅋ 아 그리고 나도 뭔가 이쁘게, 감성적으로 사진을 찍고 싶은데 사람이 너무 빼곡히 있으니 창피하기도 하고 뭔가 각도 잡기도 애매하고 ㅠ ㅠ 슬펐어요 . 소심하게 구석에 나름 잘 배치하고 찰칵 찰칵 찍어봅니다 이상하게 사진 찍는 사람이 또 저밖에 없어서 눈치가 보이는 소심쟁이 입니다 ㅠㅠ ㅋㅋㅋ 눈치 보이지만 그래도 또 언제 오겠냐며 열심히 요래조래 사진을 찍었어요 빨리 건지고 먹어야 할 텐데 ㅠ 마음에 드는 사진을 건지지는 못했지만 그래도 몇 장 찍었으니 이제 먹어보기로 해요 먼저 티라미쑥 좀 오래돼서 기억은 잘 안 나지만 매장에서 직접 만든다고 하신 거 같아요 평소 쑥을 좋아하지는 않지만 그래도 많이들 드시는 것 같길래 주문해서 먹어봤는데 오호 ~ ! 굉장히 부드럽고 쑥 향도 강해요 애들 입맛이라 쑥 향이 입에 착 맞지는 않았지만 이런 쑥 같은 걸 좋아하신다면 마음에 들어 하실 것 같아요 밑에 있는 빵? 도 굉장히 부드럽더라구요 한 입 먹고 말라고 했는데 부드럽고 살살 녹는 느낌이 좋아서 몇 스푼 더 먹었어요 그리고 붕어! 안에 앙금이 들어 있어요 나름 시그니처 메뉴라고는 하는데 그렇다 할? 특별함은 없었던 거 같아요 물론 맛있기는 하지만 충분히 상상할 수 있는 맛이었어요 ㅎㅎㅎ 그리고 양 큐브도 시그니처인걸로 아는데 그것도 먹어볼 걸 그랬어요 밥 먹고 간 거라 배불러서 두 개만 시켰는데 지금 다시 보니 뭔가 좀 아쉽네요 또 언제 갈지 모르는 핫플.. 간 김에 유명한 건 다 먹어볼 걸 ㅠ.ㅜ ㅋㅋㅋㅋ 그래도 뭐 핫플에 다녀왔다는것 만으로도 만족 ^__^ 다음 성수동 카페 투어 는 어디로 할까요~!! 어디가 핫한가요!! 50m © NAVER Corp. 묘사서울 서울특별시 성동구 서울숲2길 2 2층"
"page 69. 서울숲과 밤커 (성수동 카페, 묘사서울)","안녕하세요 붕어에요🐟 요즘 펭수의 인기가 대단한거 같아요. 티비를 틀면 펭수 저기도 펭수 어른들의 마음을 잘아는 펭수가 참 좋아요. 캐릭이 또한번 대세가 되어버린 요즘. 카페도 이렇게 찍어내듯 잘 묘사하는 곳이 있어요. 성수동에 새로생긴 묘사 서울은 이렇게 캐릭터를 표현해내는 카페에요. 캐릭터의 카페를 만들자!의 의도는 아니신거 같지만 붕어에 쥐까지 있으니 캐릭터 카페로 가셔도 인기는 꾸준할듯싶어요! (네 제가 또 가고싶어서...) 저도 처음 이 붕어를 보고 친구와 회사에서 일을 마치고 달려왔어요. 회사에서 거의 한시간....걸렸네요. 이날 너무 추웠어. 벽돌 가정집안에 자리한 카페 묘사 처음에 2층인줄 알고 문 닫은줄 알았어요. 그래서 살짝 헷갈렸지만, 그냥 올라오면 해결되는 문제 옛날 저희집 문손잡이랑 똑같네요. 초등학교때니까 벌써 25년도 훨씬 더 되었네요. 사람들은 어찌 그렇게 잘 찾아오는지 곳곳에 자리가 찼어요. 내부는 스웨이드 바닥재와 우드 요새 우드 없는 카페는 뭔가 아쉬운거 같아요. 친구네 아버님께서 인테리어를 하셔서 가구와 바닥에 대해서 한참을 얘기했다죠. 첨에 저 테이블에 앉아버렸지 모에요👉🏻👈🏻 근데 테이블&의자 전부 가능할거 같던데. 이제 주문타임! 고재가 참 이뻐요 수분을 빼는 일이 참 어려운 작업이라던데 그래서 고재의 아름다움이 더 빛을 발하는거 같아요. 사람들이 꽤 많이 있어서 살짝 오래걸렸지만 얘기하다보면 금방가요. 붕어한마리와 레몬티 그리고 쑥라떼 색감이 참 바닥과 닮아있어요. 막상 나오니까 더 궁금해서 찰칵찰칵 다들 얘는 한마리씩 꼭 주문하더라구요. 그럴만해요 :) 팥이 들어간건 대부분 좋아하는데, 얘는 속이 앙버터! 팥과 떡이 들어있을거라 생각 했는데, 사실 기대했어요 앙버터는 빵으로도 충분해서 물론 맛은 좋았답니다. 제 개인적인 취향🖤 레몬티 달달하고 향긋해서 금방 먹었어요. 겨울에 레몬티 자몽티는 몸을 금방 풀어주는거 같아요. 밤에 카페를 갈때는 커피를 피하다보니 이런 티종류를 찾게 되는듯해요. 몇장 찍고 바로 먹을 준비 근데 팥에 붕어가 생각보다 잘고정이 되어있어요. 몇번을 흔들어도 안빠져나오더라구요. 친구 한입, 저 한입 아 여기엔 팥이 들어간 카페인만큼 양갱도 같이 팔아요. 조그마한 큐브형태로. 하나씩 집어먹기에 그 디저트도 좋을 거 같아요. 물론 요 독특한 디저트만큼 시선을 끌지는 못하겠지만, 다시 잘 고장했어요. 친구가 더 징그럽다며, 성수동 카페 묘사 재생 6 좋아요 0  접기/펴기 붕어디저트 진짜 안나와서 한번 찍어봤어요. 이런거 참좋아하고 잘놀아요? 카페에서 음악의 힘 참중요한거 같아요. 사람들이 많으면 그것도 소용없지만 약간의 소음과 음악이 있으면 분위기를 변화시키는데 큰 역할을 하는거 같아요. 이렇게 직원분들의 이름이 있을줄이야. 이 대봉감은 이제 없을거 같아요 이 카페 방문은 벌써 작년이거든요. 저 간판에 위치한 층이 아니니 한번 더 올라가야 묘사 서울이었어요. 문닫은거 아니더라구요. 담엔 다른 캐릭터를 먹으러🐭 또다시 돌아온 월요일이지만 힘내셔요 :) @bouton_and 여기서 친해져요 우리👋🏻"
"성수동, 카페묘사서울","묘사서울 서울특별시 성동구 성수동1가 685-486 2층 쑥덕쿠라면 #묘사서울 2층에 위치한 자그마한 공간 오늘은 지둥이가 쏜다! 바닐라라떼, 쑥라떼 디저트로는 모나카, 붕어 음료 나오기 전에 이곳저곳 사진으로 흔적남기기 묘사서울의 포토스팟 사선테이블과 큰 창문, 창문 밖은 물들고 있다 군데군데 나무와 돌 카페트까지 색감들이 다 예뻐버리기 지둥이 가방 색감도 디자인도 귀염터지니까 사장언니가 쑥덕쿠 그래서 쑥으로된 음료와 디저트가 jmtgr #성수동카페 #묘사서울"
