title,content
"3년만의 성수동 나들이(앤드밀, 묘사서울)","3년 전, 갓 빵순이가 되어 빵투어를 떠났던 이후 처음으로 약속이 잡혀 간만에 2호선 타고 다녀온 성수동 50m © NAVER Corp. &meal 서울특별시 성동구 성수동1가 8-29 첫 목적지 - 성수동 브런치 카페 '앤드밀' 월요일 휴무 제외, 오전 11시 오픈~라스트 오더 오후 7시 쿠팡이츠 배달 및 전화로 포장예약이 가능하다. 이번에 안 사실인데 성수동이지만 성수역보다는 뚝섬과 서울숲에 위치한 맛집이 더 많은 것 같았다. 카카오맵으로 보고 뚜벅뚜벅 왔는데 어리둥절, 앤드밀은 2층에 있었다. 평소에는 사전답사처럼 하나하나 다 찾아보는 편이지만 이날은 그냥 이랬다. 11시 오픈인데 10분 전인 1시 50분에 도착하였다. 웨이팅이 많다고 하여 긴장했는데 2등으로 도착 오픈 시간에서 살짝 유동적인 곳들이 있는데 앤드밀의 경우 칼같이 여는 편이다. 앤드밀 메뉴 *샌드위치 -연어샌드위치 8.0 -새우에그 / 베이컨감자 / 베이글 / BLT 샌드위치 7.5 *파니니 -바질크림고구마그릴샌드위치 / 바질토마토파니니 9.0 -꼬꼬아보파니니 9.5 *스프, 샐러드 -구황작물샐러드 9.5 -토마토야채스프 7.0 -단호박콘스프 5.5 *음료 -아메리카노, 라떼, 에이드, 티, 탄산 사이드 메뉴 제외 샌드위치or파니니 1인 1메뉴 주문 필수 매장 내 테이블은 총 4개! 모두 사람들이 있어 사진 X 2인용 테이블 3개, 4인용 테이블 1개 위에 썼다시피 평소에 카페나 특히 빵집의 경우 방문하기 전 베스트 메뉴를 꼭 찾아보고 오는 편인데 이 날은 왠지 얼레벌레 와서 주문하느라 시간이 꽤 걸렸고 고심에 고심을 했지만 결국 아무거나 골랐던 것 같다. 친구가 주문한 메뉴 - 바질크림고구마그릴샌드위치 내가 주문한 메뉴 - 베이컨감자샌드위치, 단호박콘스프 티 메뉴는 히비스커스와 레몬라임, 인데 내가 주문한 레몬라임은 은은한 얼그레이 티백맛.. 사실 앤드밀에서 알고있던 유일한 메뉴가 저 바질크림고구마그릴이었는데 각자 주문하게되어 다른 것을 급하게 골라본 것이었지만,,결과는,, 바질크림고구마그릴샌드위치 이 날 먹었던 세개 중에 가장 맛있었다. 바질이라는 이름과 오묘한 색감에 거부감 느낄 수도 있지만 막상 한입 먹어보면 호불호 크게 안 갈릴 바질맛에 달달한 고구마와 치즈의 조합 굿 베이컨감자샌드위치 보이는 그대로 감자샐러드에 옥수수 콕콕 박힌 맛에 사과 아삭, 빵은 부시맨브레드에 아래에 머스타드가 발려있는데 개인적으론 위에도 발려있으면 좋겠다. 상추도 그렇고,,보이는 맛 아는 맛.. 단호박콘스프 생각했던 것보다 묵직하지 않은 식감과 진하기보단 은은한? 단호박 맛에 가깝다. 옥수수가 있어서 씹는 맛이 더해진 정도 위에 올라간 바게트에 따뜻한 치즈가 주르륵 흘러내리는게 취저 한 마디로 말하자면 내 스타일 아님 막입이지만 이 날은 왜인지 이런 느낌이 들었다. 앤드밀에서는 핫샌드위치 먹는 것을 추천 평소 에그샐러드를 그다지 선호하지 않아서인지 그냥 딱 아는 맛인데 이제 비싼 가격을 곁들인,, 50m © NAVER Corp. 묘사서울 서울특별시 성동구 성수동1가 685-486 2층 두번째 목적지 - 성수동 카페 '묘사서울' 연중무휴, 오후 12시 오픈~오후 10시 묘사서울은 2년 전 오픈한 카페인데 (벌써) 오픈했을때부터 SNS 인플루언서들의 글이 많이 올라오기도 했고 은근 흔치 않은 쑥을 주재료로(?) 쓰고 있어 엄청난 쑥덕으로써 언젠가 가보리라..하다가 이제야 타이밍이.. 여기도 2층, 완전 주택가에 있어서 의아했는데 요즘 유행하는(?) 주택을 개조한 카페였다. 그런데 그중에서도 더 찐으로 주택 느낌,, 뚝섬역과 가까운 앤드밀과는 거리가 조금 있지만 식사하고 소화할겸 걸어오니 딱 오픈시간쯤이었다. 매번 디저트와 음료 사진만으로 접했던지라 내부가 이렇게(?) 작을 줄은 몰라서 당황했다. 아마도 방을 튼 것으로(?) 예상되는 3개의 공간과 주문하는 곳 바로 옆에 있는 기다란 바 하나 묘사서울 메뉴 *커피 -사진 참고 *논커피 -티 6.5 -뿅따 / 메가톤바 라떼 6.5 -쑥 / 인절미 / 흑임자 라떼 7.0 *디저트 -붕어 4.3 -나무 4.8 -동그라미 / 앙큐브 5.0 -테린느 7.0 묘사서울 메뉴 - 시즌 -4월 7.5 (체리 밀크티) -5월 6.5 (메론맛 아이스크림 라떼) -호랑이 4.8 (모나카 느낌) -한입거리 6.0 (한과 구움과자) 디저트 메뉴만 보면 이게 뭔 소리냐 싶겠지만 사장님이 태블릿 PC로 이미지와 설명을 해주신다. 가장 사진이 잘 나올 것 같은 포토존이었는데 역광,, 바로 앞에 중학교가 있었는데 옛날 생각이 났다. 10년 전에는 몰랐지 교복만 입어도 예쁘다 화장 안 해도 예쁘다 이게 무슨 말이었는지 어떻게 알았냐구요? 저도 알고싶지않았습니다.. 묘사서울에서 가장 기억에 남는 것은 맛이 아닌 옛 추억,, 추팔은 이제 그만하고 맛 후기를 친구가 주문한 흑임자라떼 내가 주문한 쑥라떼와 쑥테린느 쑥라떼 달달한 우유(?) 크림이 올라간 쑥라떼 크림은 은근 묵직하진 않다. 묘사서울 대표메뉴 답게 쑥맛은 만족! 쓴 어른 쑥맛은 아니고 단 쑥맛에 가까운데 맛있게 마셨다. 오랜만에 쑥향 킁카킁카 쑥테린느 생각 이상으로 꽝꽝 얼어 있어서 당황,, 내가 그동안 먹어왔던 테린느는 탱글탱글 했는데 얘는 꾸덕한 브라우니를 얼먹하는 느낌 근데 맛이 완전 쑥가나슈같은 그런 단맛은 아닌 묘한 맛? 테린느라기에는 수분감이 굉장히 없고 같이 나온 노란 테린느?는 설명해주신대로 딱 말랑카우맛인데 역시나 수분감이 없었다. 주력 메뉴인 쑥라떼가 맛있었고 테린느는 솔직히 그저 그랬다. 앤드밀~묘사서울 후기 끝, 오전 일찍부터 만나서 결국 오후에 건대로 넘어갔다. 나에게는 성수동 감성이 썩 맞지 않는 것 같다."
성수동 서울숲길 - 묘사서울 (쑥 라떼 + 앙큐브),"묘사서울 010-5594-9151 서울 성동구 서울숲 2길 2 2층 (뚝섬역 8번 출구에서 597m) 12:00 - 22:00 연중무휴 주차 : #성동구민체육센터 묘사서울 서울특별시 성동구 서울숲2길 2 2층 묘사서울ㅣCoffee for Thought(@myosa_seoul) • Instagram 사진 및 동영상 팔로워 5,116명, 팔로잉 2명, 게시물 400개 - 묘사서울ㅣCoffee for Thought(@myosa_seoul)님의 Instagram 사진 및 동영상 보기 www.instagram.com #묘사서울 #서울숲길커피숍 #성수동커피숍 #성수동서울숲길 #서울숲길데이트 #묘사서울메뉴 #묘사서울주차 #서울숲길디저트맛집 #서울숲길쑥라떼 성수동 서울숲길 - 묘사서울 (쑥 라떼 + 앙큐브) 우연히 방문한 성수동, 우연히 방문한 #묘사서울 이에요 성수동 서울숲길 디저트 맛집으로 검색했는데 마침 눈에 들어오는 곳이라 찾아갔지요 성수동 서울숲길 - 묘사서울 (쑥 라떼 + 앙큐브) 간판 없는 곳, 심플한 곳, 요즘 인테리어라고 하는 총집합인가 (ㅋㅋ) 포스터 하나만으로 커피숍 위치를 가리키는 곳이에요 건물 1.5층엔 미용실이 있고 2.5층이 묘사서울 입니다 성수동 서울숲길 - 묘사서울 (쑥 라떼 + 앙큐브) 규칙 없이 놓여있는 테이블과 의자 감성 + 인테리어가 독특해요 다만 편한 자리는 아니에요 성수동 서울숲길 - 묘사서울 (쑥 라떼 + 앙큐브) 한식 디저트로 알려진 #묘사서울 은 쑥 라테와, 인절미 라테가 시그니처 메뉴랍니다 저희는 아메리카노와 쑥 라테 그리고 #앙큐브 주문했어요 세련된 비주얼의 #앙큐브 는 초코, 백앙금, 쑥, 비트 순서로 나오구요 초코맛이 가장 강하기 때문에 마지막에 드심을 추천합니다 #인스타갬성 뿜뿜 하는 비주얼이죠? 깔끔하면서도 갬성있는 비주얼이랄까.. 실제로도 메뉴 나오면 다들 사진 찍기 바쁘세요 (ㅋㅋ) 성수동 서울숲길 - 묘사서울 (쑥 라떼 + 앙큐브) #앙큐브 는 네모난 큐브의 양갱이랍니다 앙큐브가 달달할 거 같아서 아메리카노로 주문한 건데 오호 딱 잘 어울리던데요? 달달함을 중화시켜준달까? 산미 없는 구수한 아메리카노라 앙큐브와도 잘 어울려요 성수동 서울숲길 - 묘사서울 (쑥 라떼 + 앙큐브) 사람 많은 성수동 언제부터 이렇게 성수동에 사람이 많았나 핫플레이스가 따로 없네에 ~~ 주말엔 어디든 웨이팅 풀이에요 :) 차가 들어올 수는 있으나 사람들로 붐비기 때문에 주차장에 주차하고 걸어 다니심을 추천합니다 빠잉 #묘사서울 #서울숲길커피숍 #성수동커피숍 #성수동서울숲길 #서울숲길데이트 #묘사서울메뉴 #묘사서울주차 #서울숲길디저트맛집 #서울숲길쑥라떼"
뚝섬역 카페 :: 묘사서울 / 성수동 서울숲 디저트,"지난주 금요일 반포대교 달빛무지개분수 가기 전에 들린 뚝섬역 카페 를 소개합니다. 요즘 성수동 카페 디저트 에 완전 홀릭💛 그렇게 사람들이 성수동 핫하다고 할 땐 안가다가 한 번 놀러간 이후로 꿀벌이 꽃찾아가듯이 자주 들려요 ! 그중에서 작년부터 정말 가고싶었던 곳인 뚝섬역 카페 '묘사서울'을 소개합니다. 묘사서울 핫플인 성수동 거리를 걸어들어갑니다. 서울숲 디저트 카페 라고 생각해도 되는게 성수동 거리 바로 옆이 서울숲이더라구요. 나만 몰랐나봉가 ㅋㅋㅋㅋ 길을 쭈-욱 따라 끝까지 걸어들어가면 빨간 벽돌의 건물이 나오는데 솔직히 지도 안켜고 찾았으면 헤맸을 듯 참고하시는 분들 네이버 지도 켜서 묘사서울 검색해서 가시길 추천드려요. 2.5F 층 이마저도 힙하네요 뚝섬역 카페 묘사서울 로고입니다 깔끔하고 이쁜듯 카페 내부에요. 심플하고 좋은듯 묘사서울 메뉴 전 이날 여기서 음료는 뽕따라떼 인절미라떼 디저트는 앙큐브 곰돌이 이렇게 시켰어요. 짜잔🥛🧊☁ 작년에 인스타에서 이 앙큐브에 붕어빵같이 생긴 디저트보고 홀린듯이 와보고 싶었는데 제가 들릴 땐 곰돌이도 새로 나왔더라구요. 곰돌이 🐻 귀여운걸 무지 좋아하는편 앙큐브 & 곰돌이 너무 귀엽지 않나요? 먹기 아까웠어요 사진을 이렇게나 많이 찍으니 옆테이블에서 쳐다보더라구요 누가보면 촬영 나온줄 알겠어요 ㅋㅋㅋㅋㅋ 아무튼 앙큐브와 음료들 갖다주시면서 직원분이 먹는 방법이나 순서를 설명해주시더라구요. 이 디저트들 중에서 요 곰돌이는 겉이 바삭해서 받자마자 먹어야해요. 안그럼 바로 눅눅해져서 본연의 맛을 못느낄수도 있어요 받자마자 사진찍느라 10분 정도 뒤에 먹었는데 그때도 눅눅하더라구요. 직원분 설명해주신 것처럼 받자마자 먹어야할듯 근데 이렇게 귀여운 걸 사진으로 안남기고 먹을수가 없져.. 곰돌이는 안에 바나나크림이에요. 먹으면 바나나킥과자 맛이 나요. 곰돌이 밑에 연두색은 앙금인듯 귀엽다고 1분 전에 말했는데 바로 목 절단 ㅎㅎ 이렇게 앙금에 찍어서 먹는 것도 좋아요. 다음은 묘사서울 앙큐브 앙큐브는 양갱이에요. 요즘 핫한 앙금도 동그란 모양으로 나왔던데 그건 다음에 먹어봐야겠어요. 초코 / 플레인 / 쑥 / 비트 Next image 앙큐브 먹는순서는 플레인 → 쑥 → 비트 → 초코 초코가 제일 맛이 강하니 초코 먹고나면 다른게 밍밍함 그래서 저 순서대로 먹으라고 하더라구요. 다음은 음료 하루라도 커피 수혈 안하면 안되는데 이날은 밖에서 커피 추가로 사먹을지언정 여기서 핫한걸 먹어보리라 결심 ! 뽕따라떼 색깔이 넘 예쁘지 않나요 사진이 실물을 못담아 내는듯😥 우유 안에 연유가 들어가 있고, 하늘색은 완전 뽕따맛 뽕따 아이스크림 녹여서 만들었나 싶을정도로 존똑 어떻게든 예쁜 색감 담아내려 노력했으나 발로 찍은 샷만 있는듯 ㅋㅋㅋ 인절미라떼 와 진짜 꼬숩 그 자체 인절미 통으로 갈아서 넣었나봐요 정~~말 찐해요. 맛있었어요 뽕따라떼가 초딩입맛용이라면 인절미라떼는 어른입맛용 뚝섬역 카페 묘사서울 성수동 서울숲 디저트 서울숲카페거리 재생 5 좋아요 1 00:00 00:09  접기/펴기 뚝섬역 카페 묘사서울 성수동 서울숲 디저트 서울숲카페거리 뽕따라떼 인절미라떼 앙큐브 곰돌이 주문했지요 정말 와보고싶었던 묘사서울 와보니 속이 후련하네요! 앞으로도 예쁜 곳 맛있는 곳 찾아서 많이 추천해드릴게요 🎈 그럼 굿나잇 묘사서울 영업시간 매일 낮12시 - 오후10시 (연중무휴) 묘사서울 위치 (주소) 서울 성동구 서울숲2길 2 2층 50m © NAVER Corp. 묘사서울 서울특별시 성동구 서울숲2길 2 2층"
[성수동 카페] 묘사서울 서울숲역카페,"묘사서울 영업시간 : 12:00 ~ 22:00 휴무 : 연중무휴 (인스타 참고) 주차 : X 안녕하세요. 숙띵입니다. 오늘은 유니크한 디저트를 파는 성수동 카페 묘사서울 방문했어요. 골목으로 가다보면 보이는 서울숲카페 묘사서울 일반집들 사이에 있어서 찾는데 조금 어려울수도 있겠단 생각을 했습니다. 2층에 위치했으니 참고하세요. 내가 저 문을 열어도되나?싶게 생겼어요 ㅋ 12시 5분전에 도착했는데 사장님께서 문을 열어주셔서 들어갈수 있었어요. 예쁘고 친절하신 묘사서울 사장님! 인절미라떼 (7,000) 뽕따라떼 (6,500) 붕어 (4,300) 동그라미 (5,000) 주문했습니다. 붕어는 앙버터 모나카 / 나무는 모나카 쑥 가나슈 쑥 별로 안좋아해서 붕어로 픽! 큰 통창이 2개가 있더라고요. 저는 사진에서 보이는 반대쪽 창에 앉았어요. 카페는 전체적으로 조명이 없어서 어두운느낌이였는데 사장님이 메뉴 빼느라 안켜두신건가? 묘사서울은 전체적으로 아담하게 꾸며져 있어요. 나무 의자가 유니크해서 앉을까하다가 불편해서 패쓰~ 입구 옆에 휴지랑 빨대가 준비되어있으며 의자 밑에 방석들이 구비되어있습니다. 사장님이 직접 메뉴를 갖다 주십니다. 귀여워!!! 메뉴가 가격에 비하면 사실 엄청 작은데 ㅋㅋㅋ 그래도 사먹게되는 비주얼. 의자에도 올려놓고 괜히 찍어보고 메뉴랑 너무 잘 어울리는 인테리어 흑임자, 와사비, 치즈, 고구마 맛 순서입니다. 한 입 크기로 먹기 딱 좋게 나왔네요. 귀여워서 자꾸 찍게되는 메뉴들 뽕따라떼는 정말 뽕따맛이 나더라고요. 우리가 아는 뽕따 아이스크림 생각하시면 될거같아요. 인절미라떼도 말 그대로 인절미라떼인데 달달한게 맛있어요. 둘다 후회없던 선택 고구마앙금 부터 먹었는데 모나카랑 앙금 사이에 크림이 있었어요. 자색고구마맛 무난 치즈맛은 뽀또치즈가 생각났어요. 와사비맛은 먹고나니 알싸한 맛이 살짝 있는 와사비 그렇지만 이상하진 않았어요. 정말 와사비 맛 ㅋㅋㅋ 흑임자맛은 맛 그래도 흑임자 ^^ㅋ 붕어 안에는 팥이랑 버터가 들어가 있습니다. 아기자기한 메뉴들이 마음에 드는 성수동 카페 묘사서울 핫플답게 어떻게 찍어도 사진이 잘 나왔어요. 가격에 비하면 양이나 크기가 한입크기.. 모나카를 좋아하는편은 아닌데 여러맛 앙금덕에 맛있게 먹었어요. 서울숲역카페, 성수동카페 , 뚝섬카페로 흠 잡을 곳 없는 묘사서울 다음엔 양갱을 먹어봐야겠어요~ 50m © NAVER Corp. 묘사서울 서울특별시 성동구 서울숲2길 2 2층 읽어주셔서 감사합니다. 댓글 답방 꼭 갈게요 :-) 🌟 인스타 맞팔하실분은 아이디 댓글로 남겨주세요!"
성수동 묘사서울,"전화번호: 070-0000-1234 주소: 서울 성동구 서울숲2길 2 2층 평일: 12:00 - 22:00 2층 50m © NAVER Corp. 묘사서울 서울특별시 성동구 서울숲2길 2 2층 묘사서울메뉴 #묘사서울메뉴 인스타 구경하다가 우연히 발견하게 된 묘사서울 디저트가 너무 이뻐보여서 방문해보기로 ! 빌라 건물 같은곳 2층에 위치하여 있었다 ! 을지로에 이런곳에 위치한 카페가 많았는데 ! 여름이라 퇴근하고 밥먹고,카페까지 가는데도 밝아서 기부니가 좋다 ! 입구는 이런느낌 !! ㅎㅎ 가정집 ?! 같은 입구 ! 들어가면 전혀 다른 느낌 ! 심플,세련 너낌 ?! 우리는 메뉴를 동그라미랑 아이슈페너,흑임자라떼를 주문 ! 동그라미라는 메뉴가 너무 신기해서 방문한거여서 꼭 주문하기로 ! 동그라미 디저트는 과자 안에 크림 그위에 앙금 ?! 으로 이루어져 있었다 맛은 ...ㅎㅎ 보기에만 이쁜거 같다?! ㅎㅎ 넘 이쁘니까 감성사진 남기고 ! 음료는 흑임자 라떼가 맛있었다 !! 보통 흑임자 라떼,쑥라뗴 주문하면 엄청 단 경우가 많았는데 나름 적당한 달달함 이였다 ! ㅋㅋㅋ 파괴 !!ㅎㅎ 이뿌게 먹기는 쵸큼 힘듬...ㅎㅎ https://www.instagram.com/the_berily/ @the_berily님이 Instagram을 사용 중입니다 팔로워 28명, 팔로잉 11명, 게시물 13개 - @the_berily님의 Instagram 사진 및 동영상 보기 www.instagram.com"
성수동 서울숲 카페: 묘사서울,"성수 서울숲 카페: 묘사서울 서울숲 골목길 끝자락에 위치한 귀여운 디저트카페 묘사 서울 정보! 주소: 서울 성동구 서울숲2길 2 2층 연락처: 010-5594-9151 인스타그램: http://www.instagram.com/myosa_seoul * 주차 불가능 50m © NAVER Corp. 묘사서울 서울특별시 성동구 서울숲2길 2 2층 나는 서울숲 카페골목을 좋아한다. 근처에 공영주차장이 크게 있어서 주차하기 편하고 골목길이 예쁘기 때문이다. 그래서 올해 성수동 서울숲 주변을 자주 방문하여 많은 카페를 다녀보았다. 묘사서울은 서울숲 카페골목길 가장 끝에 위치한 카페이다. 카페 입구 주문을 받는 곳 음료 메뉴와 디저트 메뉴 디저트류는 시즌마다 조금씩 바뀐다고 한다. 22년 2월의 특별 디저트는 호랑이띠를 맞이하여 흑호 디저트가 준비되어 있었다. ㅎㅎ 실내 공간 사진들 넓은 편은 아니다. 그래서 오픈런으로 일찍 방문했다. 창문 너머로 성수고등학교가 보인다. 양갱 세트와 곰돌이, 흑호 모나카! 너무 귀여워서 먹기 아깝다..! ㅋㅋ 아메리카노와 인절미 라떼! Next image 예쁜 디저트에 대한 매너! 먹기 전에 예쁘게 사진 찍어주기! ㅎㅎ 서울숲 카페골목에서 예쁜 감성의 디저트 카페를 찾는다면 묘사 서울을 추천한다. :)"
"성수동카페, 서울숲카페, 묘사서울","성수동 나들이 성수 카페 묘사서울 성수동 나들이 떠난날~ 묘사서울도 다녀왔어요 성수동엔 이쁜 카페들이 참 많아요! 입구가 헷갈릴수 있어서 중간중간 포스터가 붙어있어요! 로고가 포인트를 참 잘 살린것 같아요 귀여운 음료와 디저트들이 많아요~ 저는 시그니처들을 총총 주문합니당 잠깐 을지로 감성이 스쳐가는 테이블과 의자에요 우드랑 돌? 들의 인테리어가 보이죠! 주방도 약간 숨은 구조에요 이 마저도 힙스럽습니당 큰 창과 덩그러니 있는 스피커 운좋게 창가자리에 앉았어요 뷰가 보고만 있어도 마음이 잔잔해집니다 네모네모~ 주문한 음료가 나왔어요 창가뷰랑 어우러져서 넘 이쁘죠? 그래서 또 열심히 찍습니다 ( 이 사진을 함께간 사람들이 싫어합니다) 뽕따라떼 6,500 인절미라떼 7,000 아인슈페너 7,000 붕어 4,300 동그라미 5,000 묘사서울 붕어빵과 동그라미 붕어빵마저 멋있으면 어쩌죠? 팥과 치즈 어른들도 좋아할 맛이에요! 봉따라떼 어릴때 먹던 진짜 뽕따 맛!! 크림이 새콤하고 소다맛이 똑같아요 인절미라떼, 아인슈페너 인절미라떼는 고소하고 아인슈페너는 달달~ 요즘은 이렇게 찍는게 인스타 감성이라고 하던데 맞나요? 확대샷으로 저도 감성적으로 찍어봤어요 동그라미는 다 각자 다른맛이에여 흑임자, 와사비,치즈 그리고 까먹었어요…ㅠㅠ 그래도 추천하는곳입니다 :) http://www.instagram.com/myosa_seoul 묘사서울ㅣCoffee for Thought(@myosa_seoul) • Instagram 사진 및 동영상 팔로워 5,076명, 팔로잉 2명, 게시물 381개 - 묘사서울ㅣCoffee for Thought(@myosa_seoul)님의 Instagram 사진 및 동영상 보기 www.instagram.com 다양한 이야기는 참고하세용 50m © NAVER Corp. 묘사서울 서울특별시 성동구 서울숲2길 2 2층 010-5594-9151 매일 12:00 - 22:00 연중무휴"
[성수동/뚝섬] 묘사서울,"사진으로만 봐서 맛있을까 싶었는데, 모나카와 양갱이 커피랑 너무 잘 어울렸다. 인스타 핫플이라 평일에 다녀왔던 묘사 서울 감각적인 인테리어와 디저트라 사진이 정말 잘나온다. 친절+맛+분위기 최근 다녀온 카페중에 최고였다. 12월 메뉴였던 트리와 양갱이들...귀엽자나😻 초콜렛,?,쑥, 비트 4가지 색의 양갱 커피랑 너무 잘 어울렸다. 트리 안에는 버터+와사비가 들어 있어서 독특했다. 매운건 아니고 살짝 향이 나는 정도? 트리 아래 팥과 함께 먹으니 더 꿀맛! 위치는 뚝섬의 끝자락... 골목 안쪽 빌라 2층에 있어 찾기가 좀 힘들었다. 메뉴판과 입구 Next image 운영시간: 12:00~ 22:00 위치: 서울 성동구 서울숲2길 2 2층 (주차 불가) 50m © NAVER Corp. 묘사서울 서울특별시 성동구 성수동1가 685-486 2층 #묘사서울 #성수동디저트 #묘사 #뚝섬카페 #뚝섬역카페 #성수동카페 #성수카페 #서울숲카페 #성수핫플 #신상카페 #모나카앙버터 #서울데이트"
