title,content
"[서울] 왕십리 제일곱창, 성수동 BNHR 벤허커피, 서울숲과 성수구름다리","주말에 서울 나들이를 갔다 왔다. 처음 계획은 서울 숲이 메인이었으나 뭔가 바뀐느낌(?)ㅎㅎ - 수인 분당선을 타고 왕십리역까지 가는데 1시간 40분 정도 걸렸다. 친구랑 나는 헤드뱅잉, 목을 혹사시키며 잠을 잔 덕분에 그래도 체감상 힘들게(?) 느껴지지는 않았다. 다만 목과 어깨가 조금 아팠을 뿐! 왕십리역에서 내렸는데 빵집이 있어서 충동구매할뻔했다. 하지만 짐이 될 걸 알기에 유혹을 참아냈다. . . 친구는 모카 치즈크림빵 삼 제일곱창을 가기 위해서는 2번 출구로 나가서 도보로 이동을 했어야 했는데.. 수인 분당선에서 내려서 2번 출구까지 가는 데에만 체감상 10분 정도 걸린 것 같다. 그만큼 길다😥 2번 출구에서 나와서 직진해서 걷다 보면 나옴! 제일곱창 왕십리 50m © NAVER Corp. 제일곱창 서울특별시 성동구 고산자로 281 레트로 감성 뿜뿜 샤르망 오피스텔 맞은편에 위치해있다. 항상 웨이팅 줄이 있어서 앞 쪽에 사람들이 있다 싶으면 거기가 제일곱창이라고 생각하면 될 듯😁 코로나 때문에 영업시간을 15:00~22:00로 조정하셨다고 한다. 우리는 15:11에 도착했는데도 대기가 5팀이 있었다. 앞 쪽에 키오스크가 있는데 거기에 전화번호를 기입하면 카카오톡으로 알림이 온다. 되게 빨리 들어갔쥬? 연락받고 3분 동안 미 입장 시 취소되니 멀리 가면 안 됨. 인원도 예약인원이 다 있어야 한다고 한다. 본관이 만석이면 본관 입구에서 QR코드 체크를 하고 별관으로 안내받는 시스템이다. 별관 약도와 입구 별관은 본점하고 가깝게 있다. 본점 왼쪽으로 이동해서 코너 골목으로 들어가서 약국에서 꺾으면 있음 ㅎㅎ 들어가면 인원을 물으시고 자리 안내를 해주신다. 기본 세팅해 주시고, 메뉴판에 있는 메뉴 골라서 주문하면 됨 메뉴판 다른 블로그 후기를 보니 곱창 1인분 + 대창 1인분 이런 식으로 메뉴당 1인분씩은 주문을 받지 않는다고 한다. 그리고 구이류는 나중에 추가 주문을 할 수 없으니 처음에 딱 먹을 만큼 주문해야 함. 우리는 3명이서 갔는데, 모둠구이 2인분 + 대창 1인분 시키고 나중에 볶음밥 1인분 추가했다. 모둠구이에 대창이 없어서 다른 분들도 대창을 추가로 시키는 것 같길래 😗 기본 세팅 낙지? 순두부찌개가 나온다 양배추가 들어가서인지 시원하고 맛있음 간이랑 천엽도 주시고, 파김치랑 소스류 양배추, 마늘 등 나옴 밑반찬들은 리필이 가능하다. 간이랑 천엽 리필 안 될 줄 알았는데 해주셔서 깜놀 ^3^ 파김치도 찐 맛이라 리필하게 될 것 같은 맛이다. 싱싱해보이쥬? 간이랑 천엽을 처음 먹어본 것 같은데 천엽은 아무 맛없고 그냥 식감만 있었는데 내 취향은 아니었고, 간은 순대 간이랑 맛이 비슷한데 탱글탱글한 식감? 괜찮았다. 위꼴주의😍 또 먹고 싶다 🤣 파인애플 꽁다리처럼 보이는 애는 부추 구성은 염통, 곱창, 막창, 양깃머리, 감자, 버섯, 숙주, 부추 직원분께서 직접 구워주심 먼저 먹어야 하는 건 요렇게 소스에 놔주신다. 굽는 거 굉장히 힘드실 텐데 묵묵히 구워주신다 이게 바로 서비스 정신인가 본받아야 돼 정렬도 하시는데 음 아무튼 손이 많이 가실 것 같다 곱창 줄 세워진 거 보세요!!! 완성 샷 기름에다가 파김치 넣어주시고, 기름 흡수용으로 식빵 넣어주면 끝. 와,, 기름에 굽다 못해 기름에 절여진 파김치 진짜 존맛임 ㅜㅜ.. 사진 보니깐 또 먹고 싶네 ㅎㅅㅎ 저 때가 곱창이 젤 맛있는 타이밍이라 빨리 먹어줘야 한다 안 그러면 질겨지고 맛이없더용 대창도 엄청 크고, 기름도 많고 고소했다 양깃머리는 처음 먹어봤는데 약간 뭔가 특이한 맛이 났었는데.. 막창이랑 비슷한 식감인데 맛은 다른.. 볶음밥 1인분 주방에 가져가셔서 볶아서 나온다 그냥 먹으면 됨 날치알이 들어간 씹히는 맛이 있는 볶음밥? 총 76,000원이 나왔다. 핸드폰 충전 부탁드렸는데 흔쾌히 해주셨다. 되게 친절하셨고, 필요한 거 말씀드리면 바로바로 해주신다. 호출 벨이 없어서 아쉬웠지만 ㅜㅜ . . . 솔직후기 : 맛있고 서비스도 좋으나 너무 멀기 때문에 그냥 근처에 있는 꼽창꼽창이나 가야겠다 먹고 나서 카페로 이동 걸어가기에는 먼 거리였기에 버스를 탔다. 카페는 특별히 정한 곳이 없었기에 일단 포토매틱 부스에 갔다가 생각해 보려고 했는데 포토매틱 부스에 사람이 엄청 많았다. 우리가 간 포토매틱 부스는 요기! 50m © NAVER Corp. 씬(scene) 서울특별시 구로구 경인로19길 36-20 한 번에 한 장밖에 안 나와서 여러 명이서 가면 여러 장을 찍어야 하기 때문에 회전율이 좋진 않은듯했다. 기다리기에는 날씨가 생각보다 조금 춥고,, 암튼 그랬기 때무넹 카페에 먼저 가기로 함 원래는 다른 카페에 가려고 했는데 바로 근처에도 핫한 카페가 있어서 들어가 봤는데 마침 자리도 있어서 ㅎㅅㅎ 그냥 여기로.. - BNHR(벤허커피) 성수점 50m © NAVER Corp. BNHR 서울특별시 성동구 연무장5길 9-16 1층 디저트는 초코 크루아상, 티라미수만 보였다. 에그 크루아상? 도 있던데 잘 모르겠다. 와이파이 와이파이 비밀번호는 benhurgram 아메리카노 5,000원 / 바닐라라떼 6,000원 / 티라미수 7,000원 난 역시 아메리카노를 마셨는데 여기도 맛있었다 ㅎㅎ 되게 진한 맛? 도미닉커피랩하고는 다른 느낌의 맛있음! - 확대 샷 냠냠 곱창집에서 물을 좀 많이 마셨더니 다 못 마시고 나옴 😅 나갈 때 찍은 카페 전경 테이블이 4인용이라서 좋다. 애견 동반 카페라서 강아지들과 같이 오시는 분들도 계시고, 천장이 높아서 탁 트여있다는 느낌이 든다. 사진 찍었을 때는 저녁시간이라서 사람들이 다 빠져나갔는데, 우리가 처음 들어갔을 때는 꽤 많았다 ㅎㅎ 그래서 대화 나누는 것도 눈치 안 보고 냥냥 하계 나눌 수 있음 그리고 무엇보다 조명 맛집이다. 셀카가 잘 나오니 방문하시게 된다면 꼭 셀카 찍으세요. 화장실은 건물 화장실인데, 건물 자체가 깨끗하고 관리도 잘 되어있어서 화장실도 깔끔함. - 서울숲과 성수구름다리 300m © NAVER Corp. 서울숲 서울특별시 성동구 뚝섬로 273 성수구름다리 서울특별시 성동구 성수동1가 그러니깐 이게 어떻게 된 일이냐면 카페 갔다가 다시 포토매틱 쪽으로 갔는데 사람이 너무 많아서 서울숲 근처 포토매틱으로 가려고 했는데 다시 한강으로 노선이 변경되었다는 얘기 근데 아무 생각 없이 걷다 보니깐 서울 숲으로 갔고 다시 정신을 차려서 한강 쪽으로 가려고 했으나 암튼 그렇게 됐습니다. 수도 박물관 쪽으로 해서 가다 보면 표지판이 친절하게 한강 가는 길 안내를 해준다. 사실 정확히 어제 어디였는지도 몰랐는데 오늘 포스팅하면서 찾아보니깐 성수구름다리였음 왼쪽에는 롯데타워가 보이구여 오른쪽으로는 남산타워가 보입니당 야경 맛집.. 성수구름다리 메모.. 사진을 찍는(척하는) 나를 찍기 .... 바람이 많이 불어서 얼뻔했다... 구름다리를 건너면 한강을 볼 수 있다. 앞 쪽에 벤치가 있어서 춥지만 않으면 앉아서 물 멍 때리기도 좋은 듯 얘네는 다리 내려와서 찍어봄 시간이 좀 더 있었으면 걸었으면 좋았을 텐데 집 가는 시간 때문에 20분 정도 머물다가 왔다. 벤치에 앉아서 그림자 찍기 근데 막 여의나루 공원처럼 오래 있을 수 있는 곳은 아니고 산책하기 좋은 곳! 처음봐서 찍음 ㅋ 8시쯤에 저기서 출발했는데 걷고 환승하고 집 오니깐 11시..ㅍㅍㅍ 역시 서울은 아침 일찍 갔다 와야 한다는 걸 체감했다."
"2023 6월 4 * 삼덕동 카페 동성, 이네딧담, 서울숲 성수동 먼치스앤구디스, BNHR 벤허, 파스테리아 대구 범어","230622 카페 동성 / 사촌동생 여유로운 분위기가 좋은 곳. 일하기 괜찮은 작은 테이블이 많고 코드도 많아서 편하게 있을 수 있었다. 창밖으로 차들만 없었어도 더 좋은 뷰였을 텐데 아쉽. 빈티지하고 고즈넉한 매력이 있는 카페다. 50m © NAVER Corp. 카페 동성 대구광역시 중구 국채보상로152길 28 1층 예약 230622 이네딧담 / 사촌동생 아주 오랜만에 찾은 이네딧담. 이름부터 맥주 이름이라 술을 주문 안 하면 좀 눈치 보여서 무알콜 한 잔을 주문했다. 스테이크는 살짝 질긴 감이 있지만 깔린 양배추가 너무 맛있었고, 가지튀김은 맛있을 수 없는 메뉴. 특히 저 소스가 정말 맛있었다. 50m © NAVER Corp. 이네딧담 대구광역시 중구 국채보상로150길 83 사거리 모퉁이 1층 초록색어닝 230624 서울숲 수도권 파견 가 있을 때 다녔던 치과에 들르면서, 서울 사는 친구를 만나러 온 곳. 서울숲-성수동 라인이 그때 살던 곳과 멀어서 안 와봤는데 생각보다 서울숲이 엄청 커서 좀 놀람. 센트럴파크를 지향했다는데 무슨 말인지 알 것 같았다. 50m © NAVER Corp. 서울숲 서울특별시 성동구 뚝섬로 273 230624 먼치스앤구디스 / JI 이영자 소금빵으로도 유명한 곳. 소금빵도 소금빵인데 감각적인 소품들과 식료품이 많아서 구경할 맛이 났다. 주말인데도 줄이 없고 소금빵도 많이 남아있었다. 소금빵은 내가 먹은 소금빵 중 1,2위를 다툴 정도. 포장해가서 집에서 먹었는데도 맛있었으니 바로 먹으면 더 맛있었을 것 같다. 50m © NAVER Corp. 먼치스앤구디스 서울특별시 성동구 연무장길 33 1층 230624 옹근달 / JI 성수동의 모든 카페가 정말 사람이 미어터져서 겨우 찾아 들어간 카페. 내부는 사람이 너무 다닥다닥 앉아있고 좁아서 사진을 찍을 수가 없었다. 방송을 여러 번 탔던 영향도 있는 듯. 인테리어도 쏘쏘 맛도 쏘쏘 디저트 가격은 비쌈. 그래도 땅값 비싼 곳에서 사진에 보이는 저런 연못 같은 것도 만들어 놓고 신경 쓴 모습이 보인다. 50m © NAVER Corp. 옹근달 서울특별시 성동구 성수이로7길 41-1 230624 BNHR 벤허커피 / JI 내 기차 시간이 애매하게 남아서 카페 두탕 뛰기. 원래 벤허커피였는데 이름을 바꾼 듯? 테이블도 널찍하고 자리가 있어서 더운 날이었는데 오래 쉬었다. 포인트 컬러와 식물의 조화가 꽤 힙했던 곳. 라떼가 맛잇었음. 50m © NAVER Corp. BNHR 서울특별시 성동구 연무장5길 9-16 1층 230628 파스테리아 범어점 / MJ 좋아하는 레스토랑. 집과 멀지도 않고 음식과 분위기도 괜찮은 곳이다. 오랜만에 간 건데 여전히 맛있엇다. 처음 주문해본 라자냐도 굿. 동성로 본점도 가봤는데 개인적으로 범어점이 분위기도 더 좋고 맛도 더 좋게 느껴졌다. 50m © NAVER Corp. 파스테리아 범어점 대구광역시 수성구 달구벌대로492길 17 1층 파스테리아 범어점"
성수동 카페 BNHR커피 리치바닐라,"진한 커피가 인상적인 BNHR커피 성수동에 카페가 너무많이생겨서 하나하나 가보기도 벅찬지경이다 밥을먹고 커피한잔은 자연스런 코스~ 카페종류도 워낙다양하고 커피도 정말 가지각색이다 #BNHR커피 라는곳이 생겨서 잠깐들러보았다 성수근린공원 근처 블루스톤 빌딩이라는 곳인데 붉은벽돌외관의 새로생긴 건물이다 이곳 1층에 입점해있는 BNHR #벤허커피 라고도 하던데... 검색해보니 한남동에도 있다 카페 내부는 층고가 높아 시원한 느낌이고 테이블과 의자가 뭐랄까? 레트로한(?) 느낌도 준다 시그니처 메뉴인 #리치바닐라 와 BNHR커피를 주문 가격은 좀 비싸다 각 6,000원 정말 특이했던 BNHR커피 양이 정말 작다~ 일반 컵이 아니라 정말 작은컵이고 설명에 의하면 견과류+샷+우유가 들어갔다 리치바닐라는 정말 달콤 라떼와는 또다른 느낌인데 여성분들이 참 좋아할맛^^ 사실 가성비 그리좋은 커피는 아니다 한번쯤은 경험해보면 좋을만한데 성수동 카페투어를 할때 참고하시면 좋을듯 50m © NAVER Corp. BNHR 서울특별시 성동구 성수동2가 302-8 1층"
카페 / 성수동 'BNHR 벤허' 명랑한 미니멀 인테리어의 카페,"안녕하세요. 환입니다. 날씨가 점점 추워집니다. 오들오들 지난주에 성수동에 작품 촬영이 있어서 다녀왔습니다. 시간이 한시간 반 정도 떠서 벤허 커피🚶🏻 지나가다가 샛 노란색이 눈에 띄어서. ✨ 코로나 2단계 시작 전(ㅜㅜ) 빨리 잠잠해져서 끝났으면 좋겠네요. 50m © NAVER Corp. BNHR 서울특별시 성동구 연무장5길 9-16 1층 성수역 사번출구랑 가깝습니다. 눈에 확 들어오는 빨강, 노랑 색 대비 🎈🌼 문이 특이합니다. 통유리가 가운데를 중심으로 회전하는 구조. 강아지와 함께 밖에 앉아있으면 좋겠네요. 널찍널찍한 테이블들이 아주 잘 정리되어 있습니다. 오전에 가서 그런지 아무도 없었어요. 천장이 높고 통유리로 되어있어서 답답하지 않습니다. 시각적으로 시원시원 🐳 귀여운 천장 등 모든 조명에 로고가 쓰여있었는데 깔끔하고 예쁩니다. 깔루아랑 제휴가 되어있는는 걸까요? 곳곳에 깔루아가 이 날 날씨도 진짜 좋았는데 말입니다. 금방 새로운 일이 생겨서 얼마 있지 못하고 떠났습니다. 여유롭게 그림이라도 그리고 싶은 장소였습니다. 햇살도 좋고 자리도 넓고 색연필 스케치북 물감 늘어놓고 난장판으로 드로잉하고 싶은. 다음에 해보는걸로. 컵에도 로고가. 브랜드 이미지 참 뚜렷 손잡이 두께가 두꺼워 귀엽습니다. 커피 맛도 상 꽤 맛있었습니다. 이 카페도 지금 코로나 때문에 무척 힘든 시간을 보내고 계시겠죠. 힘내세요. 화이팅!👏🏻 코로나가 빨리 끝나야 저도 새로운 카페를 가볼텐데 말이죠. 읽어주셔서 감사합니다."
"성수동 맛집 치카미치, BNHR 카페 테이크아웃 후기","오늘은 점심으로 일본 가정식 맛집 치카미치와 힙한 카페로 유명한 BNHR에 다녀왔어요. 둘 다 포장 해와서 집에서 먹었습니다 :) 치카미치 치카미치는 골목길에 있어요. 아기자기한 느낌이 나는 예쁜 가게예요. 치카미치 서울특별시 성동구 성수동1가 8-17 1층 평일이라 그런지 전화 주문하고 음식이 다 나오는데 15분정도밖에 안걸렸어요. 저는 대표메뉴인 밀푀유카츠 (11,000원) 바질 소바 (11,000원), 오므라이스 (9,000원) 이렇게 3개 주문했어요. 밀푀유 카츠는 하루에 15접시밖에 안파는 메뉴인데 먹을 수 있어서 너무 신났어요. 먼저 밀푀유카츠예요. 성수에서 저희집까지 20분정도 걸리다보니 좀 식었더라구요. 그래서 그런지 기대에 좀 못미치는 맛이였어요. 고기가 좀 푸석푸석했어요. 가게에서 나오자마자 먹었으면 더 맛있었을꺼 같긴합니다. 근데 양이 너무 작았어요. 다음은 오므라이스입니다. 아무래도 포장해오니 사진이 정말 안예쁘게 나오네요. 소스가 새콤달콤 맛있긴했는데 솔직히 조금 평범한 맛이였어요. 마지막으로 바질 소바입니다. 기대안한 메뉴였는데 제일 맛있었어요. 바질향이 강해서 호불호가 갈릴꺼같은 메뉴이지만 저는 워낙 바질을 좋아해서 극호였어요 : ) 소스가 고소하면서도 정말 맛있어요. 면이 좀 불었음에도 쫄깃쫄깃 맛있더라구요. 치카미치 총평 ☆☆ 망고플레이트 2위 맛집이라 기대했는데 전반적으로 평범한 맛이여서 약간 실망했어요. 아마 식은 다음에 먹은 영향이 큰 것 같아요. 양이 조금 작은편이니 참고하세요 ~ BNHR 카페 BNHR 서울특별시 성동구 성수동2가 302-8 1층 용산에 1호점이 있고 여긴 2호점이라고 합니다. 세상 힙한 느낌의 카페예요. 벤허 카페라고도 불리더라구요. 통창이 너무 예쁜 곳입니다. 성수동은 주차 지옥인데 여기는 건물 지하에 주차장이 있어요! 유료인거 같긴한데 저희는 테이크 아웃만 하고 금방 나왔더니 따로 요금은 청구안되었어요. 밀크티가 먹고 싶어서 간거라서 시그니처 음료 말고 아쌈 밀크티와 초콜릿 밀크티를 시켰어요. (각 6,500원) 이렇게 팩에 담아줘요. 초점이 나갔네요 ㅜㅜ 팩에 담아줘서 양이 좀 많아보였는데 딱 1인분입니다. 아쌈 밀크티는 정말 맛있었어요! 너무 달지도 않고 밍밍하지도 않고 밀크티의 정석같은 맛 : ) 초콜릿 밀크티는 저한테는 너무 진해서 별로였어요.. 안에 건더기(?) 같은것들이 있어서 잘 흔들어 먹어야 할꺼같아요. 솔직히 집에 잔뜩 있는 허쉬 초콜릿 우유와 차이점을 잘 모르겠어더라구요. 하지만 진한 초코우유를 좋아하는 분들은 좋아하실꺼같아요. BNHR 총평 ☆☆☆☆☆ 가게도 예쁘게 꾸며놓았고, 아쌈 밀크티가 워낙 맛있었어서 코로나가 없어지고 꼭 재방문하고 싶은 곳이예요. 날씨 좋은날 통창에서 햇빛 받으면서 커피 마시면 너무 행복해질꺼같은 가게였습니다 :)"
성수동 카페 BNHR (벤허커피) 깔끔함이 돋보이는 곳~!,"지난 휴일 절치니를 정말 백만 년 만에 만났던 거 같아요... 시간이 왜 이리 빠른지~!! 저희의 중간 지점인 성수동에서 만나 식사를 하고, 예쁜 카페 특이한 카페를 잘 찾아주는 친구가 이번에 추천해 준 BNHR(벤허커피)를 가보기로 했습니다. BNHR(벤허커피) BNHR(벤허커피)는 원래 한남동에 본점이 있다고 하고 성수동이 2호점이라고 합니다. 건물이 넓고 크죠? 이곳 1층에 BNHR(벤허 커피))가 있습니다. BNHR 서울특별시 성동구 연무장5길 9-16 1층 성수 BNHR(벤허커피)는 성수역 4번 출구에서 도보로 5분 정도 걸리는 거 같습니다. 엄청 심플하면서 깔끔하게 BNHR(벤허커피)가 써있네요~! 성수 BNHR(벤허커피)의 영업시간은 평일 AM 11:00 ~ PM 09:00 주말 및 공휴일 AM 11:00 ~ PM10:00입니다. 안으로 들어가 보니 엄청 넓었습니다. 이날 코로나 대거 재확산 터지기 직전의 날이었는데, 친구 이날 잘 만난 거 같은 안도감 ㅠㅠ 넓어서 사람과의 거리도 충분히 둘 수 있어서 좋았던 곳입니다. 처음엔 카페라기보단 약간 페스트푸드점 같다는 느낌이 더 많이 들었던 저.. ㅎㅎ BNHR(벤허커피)는 전체적으로 깔끔하면서 톡톡 튀는 컬러감으로 분위기를 내고 있는듯합니다. 카운터의 모습~! 소소한 볼펜이나 그립톡 스티커 등도 판매하는 듯했습니다. BNHR(벤허커피)는 밀크티가 맛있기로 유명하더라고요? 밀크티도 맛있고 커피도 맛있다고.. ㅎㅎ 친구는 바닐라 라떼를, 저는 이날 당이 땡겨서 초콜릿 밀크를 주문하였습니다. 주문을 하면 진동벨을 주십니다. 울릴 때까지 기다리기~! 물 마시는 공간이 준비되어 있습니다. 테이블에 앉아서 카운터의 전체적인 모습도 담아봤고요, 옆에도 보고, 뒤돌아보고.. 여기저기 카페를 둘러보았어요 BNHR(벤허커피)는 천고도 높고 창도 넓고~ 사람만 엄청 많은 게 아니라면 넓은 공간에 좋은 거 같았습니다. 진짜 테이블 수가.. 카페가 넓어서 그런지 엄청 많았어요... 빨간 쟁반에 나왔습니다. 초콜렛 밀크는 저렇게 파우치에 담아 나오네요? 뭔가 BNHR(벤허커피)의 독특함이 살아나는 듯합니다. 음료를 다 찍어보았어요 초콜렛 밀크를 파우치에 담아진 거랑 얼음 담긴 종이컵 주시는데, 처음엔 그냥 종이컵 주신 줄 알고.. 물먹는 컵이랑 다를 게 없네? 했는데 BNHR(벤허커피)의 로고가 딱~! 저거 하나로도 뭔가 더 특별해 보이는 느낌은 왜 때문인지...ㅋㅋ 마시기 전에 사진을 이리저리 찍는 거 필수죠? ㅎㅎ 왜 인스타에서 핫한지 알 거 같기도 하고요.. 손으로도 들고 찍어봅니다. 초콜렛 밀크는 얼음 담긴 종이컵에 조금씩 덜어서 마셔보는데요, 와... 진짜 이거 진해요~ 찐초코~!! 그 진한 초콜렛의 풍미를 그대로 느낄 수 있는 거 같았어요 맛없는 단맛이 아닌 초콜렛의 깊은 단맛... 밀크티로 유명한 이유를 알겠더라고요..ㅎㅎ 친구의 바닐라 라떼 상세컷은 찍질 못했지만, 저도 조금 맛보았는데요, 바닐라 라떼 또한 진짜 진하고 풍미 있는 바닐라 향이 커피와 정말 잘 어울렸어요~! 사실, 카페 분위기나 인테리어 봤을 땐 왜 유명하지? 했었는데 맛보고 나니 알겠더라고요~ 밀크티 파우치 몇 개씩 구매해서 쟁여가고 싶더라고요 ㅎㅎ 다음에 진한 초코가 생각날 때 또 와야겠습니다. 진한 밀크티의 풍미를 느낄 수 있는 BNHR(벤허커피) 자꾸 생각날듯한 깊이 있는 맛~!"
"성수동 팩밀크티가 유명한 카페,BNHR","BNHR 성동구 성수동 이날은 카페를 두탕 뛴 날이었는데 처음에 아르코를 갔다가 지나가다가 BNHR을 발견하여 들어가게 되었다. 요즘은 이 모양이 대세임을 느낀 증거 아르코와 똑같은 문으로 디자인되어있었다. 노랑&빨강&검정 내부는 꽤 크다. 좌석은 뭔가 롯데리아 + 버거킹 느낌! 주문은 앞에서 먼저하고 진동벨을 주는 시스템이다. 직원들은 BNHR로고가 박힌 티셔츠를 맞춰 입고 있었고, 커피머신 노란색은 내가 간 카페들중 처음이었다. 귀염귀염 메뉴판의 모습 군더더기 없이 깔끔쓰하다. 우리는 밀크티를 먹으러 옷 것이므로! 두명다 아쌈 밀크티를 주문하였고 배부른 상태라 따로 디저트는 주문하지 않았다. 주문대 앞에 귀여운 악세서리들을 팔고 있었는데 스티커/ 핸드폰 그립톡 /볼펜등을 판매중이었다. 조명이 느므 귀여웠음 요런식으로! 뭔가 패스트푸드점 같지 않나유?! 내부도 꽤 크고 좌석이 자리를 많이 차지하는 구조가 아니어서 사람도 꽤 많았다. 화장실을 다녀왔더니 나와있던 메뉴 (TMI:참고로 화장실은 카페밖 건물내부에 있다.) 진동벨이 울리고 언니가 가져온 밀크티 아쌈 밀크티는 팩에 들어있었고 이미 예전부터 유명한 카페라고 했다. 하지만 난 이날 처음 알았다.. 생각보다 양은그렇게 많지않고, 따라먹을 수 있는 잔은 종이컵 또륵 😭 층고는 높은편이고 창문은 시트지가 붙여져 있는지 해가 쨍쨍함에도 불구하고 눈을 찌푸릴 만큼 눈부시지 않아서 좋았다. 해가 들이치니 흰벽에 로고가 새겨지는데 예뻤다. 밀크티팩도 깔금하지만 양이 느므 적습니다.. 두번먹으면 끝남 많이 눈이 부셔 보이지만 전혀~눈이 부시지 않았다능 창문이 자동차 썬팅한것처럼 붙어있어서 밝은데 눈부시지 않아서 좋았다. 아이패드 6과 아이패드 에어3 다이어리 끄적끄적하고 헤어진날 ^*^ 50m © NAVER Corp. 비엔에이치알커피 서울특별시 성동구 성수동2가 302-8 1층 효저미(@hyodang222)님의 Instagram 프로필 • 사진 및 동영상 239개 팔로워 275명, 팔로잉 234명, 게시물 239개 - 효저미(@hyodang222)님의 Instagram 사진 및 동영상 보기 www.instagram.com"
