title,content
[성수동 갈만한 곳]TTRS 성수_감도높은 29cm의 오프라인 리빙 편집샵,"TTRS 성수 서울특별시 성동구 아차산로9길 12 1층 성수동에 온라인 쇼핑몰 29cm의 오프라인 스토어가 최근에 오픈했다고 해서 근처에 간 김에 들렸습니다. 기대기대~ 물건 가짓수가 엄청 많은 편은 아니어서 이 매장만 보러가기에는 아깝지만 성수에 온 김에 가볍게 들르기에는 추천합니다! 같이 구경해보아요~ 감도 높은 29cm의 리빙/라이프스타일 카탈로그 느낌 성수역 근처에 위치해 있어서 접근성도 좋아요~ 안에 커피샵, 젤라또집이 있어서 밖에서 먹고 있는 분들도 계셨어요. TTRS 내부의 카페/젤라또 집 한국도자기 제품 한국도자기 제품들은 클래식한 것들만 있다고 생각했는데 저렇게 프렌치 스러운 것도 너무 예쁘더라구요~ 귀여워서 TTRS 성수에서 본 다음에 29cm 홈페이지 들어가서 더 구경해보았어요 요런 식기류들 정말 요즘 대유행인것 같아요 ㅎㅎㅎㅎ 쿠션 뿅뿅 하게 생긴 소파들도 예쁘죠? 딱 바로 눈에 띄는 섹션이 있습니다. 굉장히 유럽 앤티크스럽게 꾸며진 공간인데요 약간 아스티에 드 빌라뜨 같은 느낌이더라구요. 아스띠에 드 빌라뜨에 좀더 컬러가 추가된 느낌? TTRS 성수 식기류 브랜드는 Marin Montagut (마랑 몽타구) 인것같아요. 메이드 인 프랑스이고요. 근데 가격도 아스티에 드 빌라뜨랑 크게는 차이나지 않는 것 같기두 하구요... 흠흠...ㅎㅎㅎㅎㅎㅎ 그래도 예쁘긴 엄청 예뻐요. 또 예쁜건 꼭 찾아봐야되는 성격이라 찾아봤어요 ㅎㅎㅎ 쿠션이 특히 예쁘네요! 마랑 몽타구 또 알아갑니다 ㅎㅎㅎㅎ https://ko.marinmontagut.com/ 마랑 몽타구 | 프랑스 제작 인테리어 장식용 일러스트 공예품 프랑스의 유명한 일러스트레이터이자 디자이너인 마린 몬타구트 공식 웹사이트. 인테리어 장식을위한 일러스트 수공예품 컬렉션의 온라인 판매. 프랑스에서 제작. 사용자 지정 개체입니다. | 마린 몬타구트, 프랑스 예술가의 공식 웹 사이트. 그의 컬렉션의 E-shop ko.marinmontagut.com TTRS 성수 빌라레코드 요즘 또 1인 소파에 관심이 있는 저는 저 주황색 빌라레코드 소파가 눈에 띄었어요! 저 소파는 또 소파치고 가격이 괜찮은 것 같아요! 요즘 가을이라 그런지 코듀로이 소파는 처음 봤는데 유독 예뻐보였어요. TTRS 성수 조명들 리빙샵에 조명이 빠질 수 없죠~ 더 많은 물건을 보기 위해서는 그래도 여전히 온라인29cm 몰에서 보는 것이 더 좋을 것 같아요. TTRS 성수는 29cm의 오프라인 카타로그 느낌이었달까요? 대표 상품들 중심으로만 진열되어 있는 느낌이었습니다. 그래도 느낌을 느껴보기(?) 위해서는 좋은 것 같아요~ 29cm 몰 구경구경 ㅎㅎㅎㅎ https://www.29cm.co.kr/home/ 근처 들려볼만한 곳 근처에 또 함께 가보면 좋을만한 곳입니다. ㅎㅎㅎㅎ 에르제 빵집 제가 이번에 간 곳은 에르제 라는 빵집이었어요. 네이버 지도에 저장해두고 처음 가봤는데 딱 눈에 띄더라구요. 그래서 빵 몇개 사봤는데 맛있어요! 또 그 외에도 쇼핑, 편집샵 Spot으로는 'EQL 성수',' 아모레 성수' 또 빵순이로서 빵집 픽은 서빙고동에 핫한데 성수에도 생긴 '코끼리베이글 성수' 요렇게 추천합니다! ㅎㅎㅎ 취향에 맞는 브랜드&제품들 발견해가시고, 재밌는 구경하세요~ *다른 글들도 추천드립니다. https://blog.naver.com/st0910809/223142273107 [리빙/가구] 애프터문_신혼 인테리어(주문 제작 맞춤 가구 추천) 들어가며.. 저는 결혼 준비하면서 가장 힘들었던 부분이 다름 아닌 ""혼수""였습니다. 전세집 구하... blog.naver.com https://blog.naver.com/st0910809/223172089754 [기은세 따라잡기] 고터 꽃시장 영업시간&찾아가는 법/ 이태원 앤틱 가구 거리 요즘 나의 영감의 원천, 기은세의 집 Youtube 요즘 제가 뒤늦게 정주행하고 있는 유튜브 채널 '기은... blog.naver.com https://blog.naver.com/st0910809/223135732865 [리빙] 핀란드 국민브랜드, Marimekko 시간이 흐를수록 빛을 발하는 감성 컬러풀하지만 편안한 자연스러운 감성 작년 회사원 6년차 이던 저는 용... blog.naver.com"
"[감도 높은 동네, 커핑하기] 성수동 ④ : 카린지, 린가네 스낵바, 슬로우파마씨","오랜만에 성수동으로 다시 돌아온 커핑하기! 낮에는 돈가스와 카레를, 밤에는 통조림과 하이볼을 파는 바로 변신하는 식당. 요즘 핫한 공간의 플랜테리어를 책임지는 식물 디자인 스튜디오의 푸릇푸릇한 쇼룸. 벌써 재밌지 않나요? 그럼 저랑 오늘도 열심히 성수동 커핑해보실까요? 1. 카린지·린가네 스낵바 : 낮에는 돈가스 카레를, 밤에는 통조림과 하이볼을 ⓒ롱블랙, 카린지·린가네 스낵바 카린지_린가네 스낵바 서울특별시 성동구 왕십리로4길 10-3 1층 예약 낮에는 돈가스·카레를 팔던 '카린지'는 저녁이 되면 ‘린가네 스낵바’로 간판이 바껴요. 하이볼 한 잔과 시판 스낵, 통조림 안주를 파는 귀여운 바가 됩니다! 투트랙 레스토랑으로 기획된 재밌는 이 곳. 카린지·린가네 스낵바의 목표는 신포우리만두나 역전할머니맥주 같은 ‘우리 주변의 프랜차이즈’래요! “저는 네잎클로버를 좋아하지 않아요. 세잎클로버가 좋아요. 제가 지향하는 식당도 똑같아요. 한 끼에 30~40만원하는 집은 저랑 안 맞아요. 쉽게 발 닿는 곳에 있고, 언제나 맛이 똑같은, 한 마디로 ‘일상 속 행복’이 이곳의 키워드예요.” 정동우 대표, 롱블랙 인터뷰에서 2. 슬로우파마씨 쇼룸 : 지금은 한국에서 가장 바쁜 식물 디자인 스튜디오의 쇼룸 ⓒ슬로우파마씨 슬로우파마씨 서울특별시 성동구 아차산로11가길 26 1층 슬로우파마씨 조경 인테리어를 트렌드로 만든 식물 디자인 스튜디오, '슬로우파마씨'의 쇼룸 까르띠에, 이니스프리 매장부터 나이키X지드래곤 전시까지. 네이버와 토스, 무신사스튜디오와 서울 시청의 사옥 조경도 슬로우파마씨의 손을 거쳤어요! 쇼룸의 1층은 작은 전시 공간이, 2층엔 작은 편집샵이 있어요. 식물과 관련된 슬로우파마씨 자체 제작 상품, 식물 관련 소품들이 가득해요. 현재 12/23 - 03/31는 슬로우파마씨의 겨울 휴무라네요.. 방문에 참고하세요! “식물을 좋아하는 마음은 본능이에요. 엄마를 생각하는 마음처럼요. 예전엔 좋아하고 싶어도 거리의 가로수 말곤 볼 만한 식물이 없었어요. 이젠 어딜 가든 다양한 식물을 접할 기회가 늘어났죠.” 이구름 슬로우파마씨 대표, 롱블랙 인터뷰에서 성수동을 감도 높은 동네로 만든 카린지·린가네 스낵바와 슬로우파마씨의 이야기, 지금 롱블랙에서 읽어보세요! 바비정 : 몽탄과 고도식의 기획자, 세잎클로버 같은 식당을 꿈꾸다 롱블랙 프렌즈 K 깜짝 놀랐어요. C가 지난 주말에 고기 먹으려고 4시간이나 웨이팅했다는 거예요. 도대체 어떤 식당이냐고 물었더니, 우대갈비*로 유명한 삼각지 몽탄이었죠.*육류 신 www.longblack.co 슬로우파마씨 : 비커와 약봉지에 넣은 잎, 식물로 하는 힐링 비즈니스 롱블랙 프렌즈 B 친구에게 이끼를 선물 받았습니다. “가끔 멍하니 보고 있으면 마음이 편해져.” 친구 말대로 가만히 이끼를 바라봅니다. 지름 75mm, 높이 150mm 유리병 안에 www.longblack.co 롱블랙은 매일 감각적이고 트렌디한 브랜드의 이야기를 전달합니다. ↓ 어떤 서비스인지 더 궁금하세요? 아래 링크를 통해 확인해보세요! 롱블랙은 어떤 서비스인가요? 매일 하나의 콘텐츠, 24시간 안에 안 읽으면 사라지는 구독 서비스, 롱블랙 www.longblack.co"
"[감도 높은 동네, 커핑하기] 성수동편 - ②","특별한 큐레이션 시리즈, 롱블랙 커핑하기! 성수동에서 더 특별하고 알찬 하루를 보내고 싶은 여러분들을 위해, 성수동 2탄을 준비했어요. 성수 팝업 전성시대를 가장 앞에서 이끌어왔다고 해도 과언이 아닌 팝업 스토어 플랫폼 '프로젝트렌트'와 후각, 촉각, 시각을 깨워줄 수제 비누 브랜드 '한아조'의 쇼룸 겸 오프라인 스토어까지 소개해볼게요! 1. 프로젝트렌트 : 매번 바뀌는 콘텐츠, 지금 가장 핫한 트렌드를 보여주는 팝업 스토어 플랫폼 2021년 6월에 프로젝트 렌트 2호점에서 열린 '스튜디오 아이'. 현대자동차의 아이오닉5 출시를 앞두고 열렸던 팝업. ⓒ프로젝트렌트 프로젝트렌트 1호점 서울특별시 성동구 서울숲길 43 1층 현재 성수동에는 총 4지점의 프로젝트렌트가 있어요! 렌트는 상설 운영되지 않고, 팝업 브랜드에 따라 지점 별 운영 시간이 달라집니다. 방문 계획이 있으신 분들은 프로젝트렌트의 인스타그램이나 홈페이지를 참고해 보세요! 새로 매장을 낼 때 중요하게 생각하는 건 입지예요. 전 입지도 소비자 관점에서 봅니다. 그 동네를 걸어다니고 싶은가. 이 관점에서 딱 반걸음 먼저, 뜰만한 동네에 들어가려고 합니다. 1, 2, 3호점을 잇달아 낸 서울숲길 골목이 그랬어요. 2018년만 해도 메쉬커피 외에는 유명한 매장이 없었어요. 지금은 멋진 가게들이 들어서며 떠들썩한 거리가 됐죠. 최원석 필라멘트앤코(프로젝트 렌트) 대표, 롱블랙 인터뷰에서 2. 한아조 : 휴식에서 오는 영감, ‘잠시 멈춤’의 시간을 주는 수제 비누 브랜드 한아조의 대표 상품, 자투리 비누로 만든 퍼그램 프로젝트(왼쪽) ⓒ한아조 LCDC 3층에 위치한 한아조의 쇼룸 겸 오프라인 스토어(오른쪽) ⓒ롱블랙 한아조 서울특별시 성동구 연무장17길 10 (성수동2가 ) 우리는 돈보다는 명예, 돈보다는 사랑, 돈보다는 아름다움이 중요한 사람들입니다. 한아조는 A와 C 사이에서, B를 고민하는 사람, 정도로 볼 수 있겠습니다. 김상만 한아조 공동대표, 롱블랙 인터뷰에서 성수동을 감도 높은 동네로 만든 사람들의 이야기, 지금 롱블랙에서 읽어보세요! 프로젝트렌트 : 비즈니스 디자이너, 팝업으로 성수를 물들이다 롱블랙 프렌즈 B 주말에 자주 찾는 매장이 있습니다. 갈 때마다 콘텐츠가 바뀌는데, 트렌드를 읽기에 딱입니다. 성수동 서울숲길에 있는 팝업 스토어 플랫폼 프로젝트 렌트Project www.longblack.co 한아조 : 색이 없던 삶, 자투리 비누에서 나만의 색을 찾다 롱블랙 프렌즈 C 선물로 비누를 받았어요. 오동나무 박스에 정갈하게 담겨왔죠. 모양이 독특해요. 동그란 흰색 비누 안에 조각 비누들이 박혔어요. 노랑, 분홍, 주황, 민트. 아! www.longblack.co 롱블랙이 어떤 서비스인지 더 궁금하세요? 아래 링크를 통해 확인해보세요! https://bit.ly/3QLOpUb"
성수동) 돼지고기 꿉당 디저트는 감도 조약돌 바질 들판 아이스크림,"#꿉당성수점 #꿉당 #성수맛집 꿉당 성수점 서울특별시 성동구 성수이로20길 10 경협회관 104호 주말에 성수동 핫플레이스 꿉당에 다녀왔어요. 12시 오픈이라고 해서 11시 반쯤 도착했더니 웨이팅이 한 팀 걸려 있었어요. 가게 오픈은 안 했지만 번호 입력해 놓으면 되고요. 기다리는 동안 메뉴도 한 번 스캔!! 12시 즈음 되니 슬슬 사람들이 몰려오더라고요. 메뉴는 간단해요. 저는 꿉당이랑 목살, 갈매기살을 시켰고요. 사이드로 트러플 짜파게티랑 이름이 엄청 긴 물회를 시켰어요. 차례로 자리를 안내해 주시고 보니 오픈하자마자 자리는 꽉 차더라고요. 오픈런 하길 잘했쥬!!ㅎㅎ 기본 찬은 파김치랑, 갓김치 같은 게 나왔고요. 깻잎이랑 무같이 절여져 있는데 같이 싸 먹는 거예요. 깔끔하고 개운해서 고기가 전혀 느끼하게 느껴지지 않더라고요. 몇 번 리필을 했어요^^ 요즘은 고깃집에 와사비 안 주면 섭섭하죠. 트러플 짜파게티 도착하자마자 냄새가 장난 아니었어요. 정말 트러플의 풍미가~음!!! 맛은 짜파게티랑 크게 다를 게 없는데 풍미가 확실히 고급 졌어요. 그리고 이 물회는 음... 개인적으로 그냥 별로였어요. 위에 문어 빼고는 회가 없고 안에는 면이 들어 있는데 육수가 약간 파인애플 환타 맛이 나는ㅋㅋ 초고추장 물에 면 들어 있는 그런 맛이더라고요. 개운하긴 한데 물회는 횟집 가서 먹는 걸로요. ㅋㅋㅋㅋㅋ 고기는 먹느냐고 시작 사진밖에 없는 반전!! ㅋㅋㅋㅋ 꿉당은 고기를 직접 구워서 다 잘라주셔서 정말 편했어요. 테이블마다 구워주셔서 직원분들이 많더라고요. 고기는 진짜 대대박 부드러워요. 그리고 고기 자체가 굉장히 프레시 하다고 해애하나요. 싱거워요.ㅋㅋ 염지 이런 게 전혀 안된 정말 리얼 고기인가 봐요. 고기 엄청 두꺼운데 살살 녹더라고요. 양은 적고 가격은 비싸지만 부드럽고, 고기는 싱겁지만 쌈장을 두툼하게 찍고, 기본 찬에 샐러드 정도 있었으면 했지만 배는 불렀고, ㅋㅋㅋㅋㅋㅋㅋㅋㅋㅋㅋㅋ 그랬답니다.ㅋㅋ 50m © NAVER Corp. 꿉당 성수점 서울특별시 성동구 성수이로20길 10 경협회관 104호 그리고 걸어서 조약돌 아이스크림으로 핫한 감도 성수점에 갔어요. 조약돌 아이스크림은 안에 바질이랑 치즈 같은 게 있는데 아이스크림에서 파스타 맛이 나요. 호불혹 있을 듯해요. 그리고 옆에 기본 아이스크림은 솔트 아이스크림인가 했는데 짠맛이 아주 미세하게 나는 것 같기도 했어요. 엄청 부드럽고 시원해서 조약돌 아이스크림보다 훨씬 맛있었답니다. sun. 50m © NAVER Corp. 감도 성수점 서울특별시 성동구 왕십리로 83-21 디타워 서울포레스트 지하1층 B115 감도"
[성수동] 특색있는 아이스크림이 생각날때. 감도 성수점,"점심 먹고 아이스크림이 땡겼다. 베라31도 멀지 않은 곳에 있기는 한데 특별한 아이스크림이 먹고 싶어서 감도를 찾아왔다. 매장은 굉장히 모던한 인테리어다. 성수 성수스러운 디자인이라고 할 수 있겠다. 총 세 가지 아이스크림을 맛봤다. 말돈소금, 얼그레이, 올리브오일&후추 올리브오일&후추 7,400원 내가 고른 '올리브오일&후추'다. 내가 골라서가 아니라 제일 맛있었다. 역시 비싼 게 맛있는 건가. 굉장히 가벼운 텍스처의 아이스크림에 올리브오일과 후추가 뿌려져 있다. 신선한 올리비오일 향과 후추향을 좋아한다면 도전해보기 바란다. 말돈소금 6,900원 똑같은 베이스에 말돈소금이 뿌려진 아이스크림이다. 짜거나 하지 않고 말돈 소금의 향과 씹히는 감이 더 주가 되는듯하다. 무난하게 호불호 없이 좋아할 만한 메뉴이지 않을까 싶다. 얼그레이 6,900원 개인적으로는 가장 특색 없는 느낌이다. 그냥 얼그레이 아이스크림. 특별한 특징이 없다. 베라에서 두 개 맛을 볼 수 있는 가격인데 기왕이면 더 특색 있는 걸 먹는 걸 추천한다. 분명히 자주 방문하기에는 가격이 부담스럽다. 그래도 가끔 올리브오일&후추와 말돈소금이 생각나서 방문할 수 있을듯하다. 50m © NAVER Corp. 감도 성수점 서울특별시 성동구 왕십리로 83-21 디타워 서울포레스트 지하1층 B115 감도 예약"
"성수동 카페 ; 감도(Gamdo) ""담백한 고급스러움을 공간부터 디저트까지 담아낸 파인 아이스크림 다이닝 성수동 감성카페!!""","고든램지 피자를 먹고, 개운하게 아아를 마시고 싶어서 바로옆에 있는 감도라는 카페를 방문해봤어요! 외부에서 봤을 때 엄청 다크하고, 감성적으로 보여서 여기 가보자! 해서 들어가 봤습니다!! 판넬도 다크다크한 분위기 - 디저트 카페로 홍보하시네요! 바형태 테이블도 4자리있고, 외부에서 봤을 때 엄청 다크닝하죠! 저희가 앉을 좌석인데 사진이 왜이리 흔들렸지... 마음이 엄청 급했나.. ㅋㅋ 카페 분위기가 엄청 심플하고, 인스타에서 볼법한 감성을 지녔어요! 그래도 전 테이블, 의자가 큼직큼직해서 이게 젤 좋았습니다! 커피의 맛은... 저는 좀 별로였어요.. 엄청 쓴 커피를 선호하지 않는데 감도의 커피는 쓴 아아더라구요.. 하지만 남자친구는 쓴 커피를 선호하는 편이라 감도의 커피가 맛있었다고 합니다! 오늘도 감성적이고, 다크닝하고 새로운 카페를 알아봤습니다! 🔆 지도 네이버 지도 감도 성수점 map.naver.com 🔆 인스타 담백한 고급스러움 | 감도(@gamdo.official) • Instagram 사진 및 동영상 팔로워 2,226명, 팔로잉 0명, 게시물 19개 - 담백한 고급스러움 | 감도(@gamdo.official)님의 Instagram 사진 및 동영상 보기 www.instagram.com 🔆 별점 접근성 ★★★★★ 가성비 ★★★☆☆ 사진 ★★★★★ 맛 ★★★☆☆"
성수동 모임 옥수수피자 먹으러 : 메종 파이브그라운드 그리고 Gamdo 감도,성수 서울 숲 약속 💓 옥수수피자가 맛있다고 블로그 링크를 언니가 보내주었는데 너무 맛있어보였음 약속 장소는 메종파이브그라운드 옥수수피자 ? 그냥 콘옥수수 올라간 피자 같은건가? 요즘 너무 바빴어서 일단 정해진 대로 움직인 나 일단 먹으러 갔습니다 ㅋㅋㅋ 지난번 서울숲 디타워 갔을때 밖에서 보고 전-혀 네버 피자집이라곤 생각1도 못한 카페인가? 뭐 떠먹는 피자인가? 뭐 하는덴지 전혀 몰랐음 피자 보단 카페에 더 가까운 인테리어 였음 같이 간 언니가 강추한 옥수수피자와 지난번 가지라자냐는 좀 별로 였다고해서 라구파스타 시킴 리뷰에도 양이 많지는 않다해서 2개 주문 ㅋㅋㅋㅋ 아무리 봐도 사진 너무 못찍었다.. 블로그 자격 박탈 사진은 별로지만 맛은 있었다는요.. 콘옥수수 그 한알 한알이 아니라 그냥 통이네?ㅋㅋㅋ 중간 중간 감자칩 토핑도 있고 맛있었음 시그니처 매뉴가 옥수수피자인듯 언니와 오랜만에 만나서 수다 떠느라 사진은 일단 발로 찍음 ㅠㅠ ㅋㅋㅋㅋㅋ 이것이 발로 찍은 사진 그래도 라구파스타 무척 맛있었다는 진짜룽~~~ 옥수수 피자도 넘 맛있엇고 잘 먹고 가요.. 남김없이 잘 먹었음 ㅋㅋㅋ 그리고 옆 쪽에 있는 커피집으로… 카페인지알고 들어왔는데 다들 식사를 하고계셔서 멈칫 디타워에 있는 카페 Gamdo 감도 카페 이름이 갠장히 특이했슴니다 큐알로 메뉴보고 주문을 해달라구 하심 감도 카페 분위기는 이러합니다..😊 바다소금라떼와 그냥 아아! 시그니처라고 직원분이 얘기해주셨는데 오! 크림 정말 부드럽고 맛있엇음:-) 찾아보니 디저트도 맛있다고 하눈데 ㅎㅎㅎ다음에 가서 먹어봐야겠다요😃 #성수동 맛집 #서울숲맛집 #디타워피자 #서울숲디타워 #메종파이프그라운드 #GAMDO #감도커피
"성수동 카페맛집 ""감도""",점심을 너무 맛있게 먹어서 디저트도 고급진 맛을 보고 싶었다.. 서울숲 근처 검색하는데 오~특이한 아이스크림 발견!!!! <감도> 조약돌바질들판 조약돌은 머랭이고 안에 유자마리네이드토마토가 들어있다 바질아이스크림과 한번에 떠먹으면 상큼가득 독특하고 맛있다 구운 감자 크렘브륄레 와 메뉴이름 너무 어렵🤣 부드러운아이스크림에 감자랑 같이 먹으면 부드럽고 바삭하고 식감이 재미있다 저 과자는 치즈맛🧀 소금아메리카노 소금라떼 오트밀라떼도 주문!! 메뉴가 다맛있었다 또 오고싶은곳😄 #감도 #감도성수점 #아이스크림다이닝 #디저트맛집 #성수맛집 #서울숲맛집
[서울숲/성수동] 감도 - 체험적 실험적 디저트카페,"친구랑 다녀온 성수동 신상 까페, 디타워 지하 디저트카페 감도입니당. 친구가 데려가줘서 고맙다고 함. #성수동카페 #감도 #성수동감도 #서울숲맛집 #성수맛집 #서울카페 #서울숲카페 50m © NAVER Corp. 감도 성수점 서울특별시 성동구 왕십리로 83-21 디타워 서울포레스트 지하1층 B115 감도 디타워 (아크로 상가건물) 지하 1층 이 건물은 층 네이밍도 동선도 좀 특이한 편이라 길을 못 찾겠다면 안내원에게 꼭 물어보길 추천한다. - 주소 : 서울특별시 성동구 왕십리로 83-21 디타워 서울포레스트 지하 1층 B115 감도 - 매장 전화번호 : 02-6233-7623 감도 방문시 주차지원 2시간 가능. 감도의 메인 인테리어는 바로 이 돌덩어리. 돌에서 연기가 뿜어져 나온다고 했는데 ㄷㄷ 아주 모던하게 생겼습니다. 굉장히 소피스티케이티드 한 파인 디저트 카페를 지향하는 것 같고 뭐랄까 엘불리 이런데서 내는 디저트만 따로 내볼까 그런 의도는 잘 이해했습니당 질소 플레이 조와하심. 심상을 떠올리게 하는 메뉴판과 다양한 맛의 아이스크림이 있다. 가격은 상당히 비싼 편. 그만큼 메뉴 구성이 유니크하고 정성이 많이 들어간 느낌이다. 뭔가 현대미술 작품같은 바위에 대리석 데스크 탐난다. 플레이팅과 쟁반마저 아름답다. 그리고 각 메뉴에 대한 설명을 담은 카드까지 의미를 전달하려고 많이 신경쓴 느낌. 스푼 하나마저도 큐레이션된 느낌. 이 와중에 개별포장된 빨대혼자 어색... 서늘한 스뎅 빨대 줄 것 같았는데 ㅎㅎㅎ 시그니처 메뉴인 듯한 조약돌 바질 들판. 머랭으로 조약돌을 표현하고 은은한 바질향과 스리슬쩍 초록빛이 도는 아이스크림을 질소로 굳혔는지 동글동글하게 굳혀 깔았다. 바닥에는 유자 토마토 마리네이드. 모두 섞어먹는 게 정석. 바질 + 토마토 는 언제나 훌륭한 조합이고 이 조합을 디저트에 적용한다는 참신한 생각이 현실화된 결과물. 예쁘다. 그리고 바질의 향긋함에 머무르지 않고 딜을 올린 것도 엣지있는 맛을 주었다. 강남 유명 카페 '우나스'의 메인 셰프님께서 개발해 주신 메뉴라고 함. 그르치 뭔가 디저트 하나로 끝나는 서사 같지는 않어... 조약돌 머랭은 그냥 아는 맛. ㅎㅎ 바질 아이스크림과 바닥에 깔린 크럼블, 토마토를 같이 먹으니 맛은 있다 생각보다 아이스크림의 텍스쳐와 맛에서 밀키함이 강했고 토마토는 달았다. 시원하고 상큼하고 신선하고 짭쪼름한 맛이 될 수 있었는데 더 소르베틱하게 살렸으면 좋았을 것 같음. 맛의 밸런스를 기존의 디저트에 가깝게 가져가면서 향이나 재료 조합에서 신선함을 주려고 한 것 같은데 조금은 달고 크리미한 아는 맛에 허브 살짝 곁들인 맛이 되었다 아이스크림은 얼그레이를 시켜 보았는데 질소로 얼린 거라 질감이 특이하다. 밀키하기보다는 워터리한. 아하 그래서 빨리녹는다고 사르륵 녹는 맛이다. 젤라또나 하겐다즈처럼 농축미는 없는 대신 가볍고 사푼한 질감. 바다소금 라떼. 커피가 정말 향긋하고 고소했다. 라떼 맛이 진짜로 마음에 들었음. 그와 대조를 이루는 짭쪼롬하고 무게감 있는 폼이 바다소금 맛이었다. 다음에 오면 굳이 바다소금보다는 일반 커피를 B nutty 로 골라서 먹어봐야겠다고 생각함. 커피가 약간 타짜도로처럼 이태리 스타일로 진하고 고소한 마끼아또에 가까운 맛을 내줌. 물잔 하나 휴지 하나에도 돌과 무채색이라는 디자인 아이덴티티가 반영되어 있어서 정말 컨셉적 공간이고 체험을 위한 곳이라는 생각이 들었다. 1인 1메뉴 등 다양한 정책이 있으니 참고할것! 서울숲 디저트카페 감도 재생 29 좋아요 0  접기/펴기 성수동카페 감도 #감도 #성수동카페 #성수동감도 #서울숲맛집 #성수맛집 #서울카페 #서울숲카페"
감도(gamdo)_성수동 커피&디저트,메종 갔다가 커피 마시러 옆에 있는 감도로 자리 옮김ㅋ 분위기 대충 이렇고요 밖에 역시 사람 없음ㅋ 오미크론 창궐 중이라 그럴지도. 메뉴는 큐알로 메뉴 이미지 확인 가능 #바다소금라떼 2잔ㅋ 내가 좋아하는 맛이었음. 근데 비쌈... 1잔에 6800원.
