title,content
[맛있는거 기록하기] 성수동 '대림국수'&'벤허커피(BNHR)' / 한강 통목살구이 / 왕십리 '팀메리' 요거트볼,"1. 성수동 대림국수 ★★★★★ 가현이가 맛있다며 데려간 성수동 꼬치국수집. 우리 원래 웨이팅 하는 곳은 절대 절대 안가는 사람들인데,,, 이 날 지하철 역의 인파를 보고 어딜 가든 기다려야 한다는 것을 깨달음.. 그리고 기다림 국수집이라 음식도 금방 나오고 회전도 빠른 편이라 많이 안기다리고 들어갔다! 우리는 온면, 냉면, 비빔 하나씩 시켰음! 느끼한데 매콤해서 계속 들어가는 맛임.. JMT 알고보니 가현이 전날도 여기서 먹었다고 한다.. 대단해 근데 참고로 매운거 못먹는 사람은 먹기 힘들 것 같다. 모든 메뉴가 매콤쓰 갠적인 취향은 온면>비빔면=냉면 이거랑 다른 메뉴도 시켰던 것 같은데 사진을 안찍어서인지 기억이 안남. 무튼 맛있었고 가격도 저렴했음 굳굳 또가고싶은 곳 2. 성수동 벤허커피(BNHR) ★★★★★ 요새 을지로에서 맛있는 커피에 눈을 뜬 나.. 그 중에서도 라떼나 플랫화이트 맛있는 곳을 여기저기 탐방하는데 성수동 라떼맛집을 치니 여기가 나왔다. 사실 내부는 고속도로 휴게소 식당같았음.. 주문하는 곳이나 조리하는 곳은 예뻤는데 테이블들이..약간.. 그리고 공간이 크고 층고가 높아서인지 소리가 엄청 울려서 진짜 시끄러웠다 절대 조용한 카페는 아닙니다... 그래서인지 사진이 이것 뿐 근데 여기에 쓴 이유는 그런 모든 단점을 제치고 커피가 너무너무 맛있기 때문이다 참고로 나는 달달한걸 좋아하는 초딩입맛인데 정말 맛있었다 고소하고 달달함 그 자체 평생 바닐라 라떼만 먹어온 가현이가 시킨 바닐라라떼도 넘 맛있었음 그냥 아/아 시킨 지영언니 내 라떼 먹어보고 안시킨걸 후회함 강추합니다.. 근데 메뉴 이름이 라떼였는지 아닌지는 기억 안남.. 시그니처 메뉴였던 듯 3. 한강 통목살구이(★★★★★) & 철판 아이스크림 (★) 뱅이랑 따릉이타고 오밤중에 한강가서 먹은 목살&철판 아슈크림 10시 지나서 갔는데 세상 사람들 다 한강에서 정모하는 줄 알았음 사람 무리에 피곤함을 느끼는 나랑 뱅이,, 야무지게 포장해서 따릉이타고 한적한 곳으로 가서 먹음 통목살 구이는 진짜 맛있고 가성비 개좋은데 주변에 안먹어본 사람 아직도 넘 많아서 전파시키는 중 ;; 저거 양 개많은데 12000원인가 그랬던 것 같다 결국.. 다 못먹고 남김....... 그리고 철판아이스크림. 갑자기 먹고싶어서 4500원인가 5000원 주고 삼 오레오맛 샀는데 오레오 1개 넣어주길래 그떄부터 정내미 떨어졌따 (1봉지 아님 ㄹㅇ 1개임 1개 말이 되냐ㅣ구요 5000원에 오레오 1개???허 참) 게다가 따릉이타고 가는 사이에 다 녹아서 줄줄 흘렀음 오랜만에 먹고싶어서 샀는데 다시는 돈주고 안먹음 4. 왕십리 팀메리 요거트 (★★★★★) 인스타 팔로우만 해놓고 한번도 못가봤다가 집 가는길에 급 삘받아서 테잌아웃 해온 팀메리 요거트가 정말 꾸덕꾸덕하다,, 역대급 과일들도 싱싱하고 안에 있는 시럽?!같은거랑 먹으니 한그릇 뚝딱 탄수 중독자로서 한끼식사 대용으로는 좀 부족했지만 간식용으로 최고 +) 뱅이네 부모님이 기르신 거봉이랑 오늘도 달굼당 초코 스콘이랑 카야버터스콘 넘 존 맛 탱 구 리 입 니 다! ~~ ~ ~"
[성수동] 벤허커피 BNHR 성수 가오픈,"50m © NAVER Corp. 블루스톤타워지식산업센터 서울특별시 성동구 연무장5길 9-16 어제 이 글을 보았다. 내가 한강진 갈때마다 들러보지만 자리가 항상 없었던 벤허커피가 성수에 드디어 오픈한다는 소식. 네이버 위치는 아직 안뜨는데 '블루스톤지식산업센터' 혹은 '블루스톤타워' 라고 치면 나온다. 그 빌딩 1층. 한강진보다 훨씬 넓직하고 층고도 높아서인지 공간이 더 넓어보인다. 커피맛은 뭐, 말모. 가오픈인데 사람은 역시나 많아요."
✔️[성수동]유럽느낌 잡화점 먼치스앤구디스/ 커피맛집 BNHR커피,"성수동 심플한 데이트코스 먼치스앤구디스*BNHR 안녕하세요! 저 오랜만에 성수동에 다녀왔어요~ 요즘 성수동에 새로운곳이 엄청 많이 생겼더라구요! 이리저리 돌아다니면서 구경하는 재미가 쏠쏠했어요. 약속시간보다 조금 일찍 도착해서 간단하게 구경할 곳 없을까 찾아보다가 요즘 성수동에서 핫하다는 먼치스앤구디스에 잠시 들러보았습니다. 요즘 성수동에서 힙한 먼치스앤구디스 에요. 식료품을 베이스로 다양한 라이프스타일 제품들을 취급하는 곳이에요. 외관이 꼭 유럽의 작은 마을에 있을 것 같이 생겼죠! 빈티지하면서도 멋스럽더라구요. #먼치스앤구디스 무슨뜻일까 궁금해서 찾아봤어요. *munchies 간단한 안주류 *goody 썩 매력있는것, 즐겁게 하는 것, 유쾌하게 하는 것 매장에 들어서자마자 왼쪽으로 커피랑 빵을 판매하고 계시더라구요. 아쉽게도 맛보진 못했지만 너무 맛있어보였어요. Black truffle GET!ㅎㅎㅎㅎㅎ 친구가 블랙 트러플 과자를 보자마자 정말 맛있다고 추천하더라구요! 바로 겟했습니다😋 집에와서 먹어보니 트러플향이 잘 느껴지고 단짠단짠 조합이 너무 좋았어요. 맥주안주로 퍼펙트합니다.🍻 온라인에서도 판매하고 있으니 좋아하시는 분들은 주문해서 드셔보셔도 좋을 것 같아요! 시리얼이랑 라구소스는 정말 가게를 나서기 전까지 데려오고 싶었던 아이들이에요. 집에와서 사올걸 하고 후회했답니당😿 살림과 아직 어색한 사이인 제가 봐도 너무나도 탐나는 아이들이 많더라구요. 살림이랑 친해지면 다시 방문해서 데려오려해요:) 가드닝을 위한 물건들도 보여요-! 정말 없는게 없죠. 와인도 다양하게 판매하고 있어서 와인이랑 간단한 안주거리 사서 뒷마당에서 가볍게 한잔해도 좋을것같아요. 여기는 정말 냉장고를 털어오고 싶었어요. 충동구매하고 싶은 마음을 잘 다스렸답니다.😌😌 다음에 또올게-! 뒷마당에 야외자리도 마련되어있어서 날씨좋을 때 매장에서 구매해서 먹어도 너무 좋을것같아요:-) 평소에 쉽게 접할 수 없는 다양한 식료품들이 많아서 그냥 구경하는 것 만으로도 신기하고 즐거웠어요. 이런 공간들이 많이 생겼으면 하는 바램입니다🖤 50m © NAVER Corp. 먼치스앤구디스 서울특별시 성동구 연무장길 33 1층 카페로 이동하던중에 만난 #노티드성수 안국이나 잠실점은 주말에 항상 웨이팅이 있는걸로 알고있는데 그에 비해 성수점은 주말에도 한가한 모습이었어요! 노티드의 유혹을 뿌리치고 얼른 뜨아마시러 총총총~~~ #bnhr #벤허커피 #성수동카페 #뚝섬카페 오랜만에 벤허커피마시러 왔어요. 원래 밀크티로 유명한 곳이지만 저는 이곳의 커피를 정말 좋아한답니다. 제가 좋아하는 #듁스커피 원두를 사용하고 있거든요◡̈ ◡̈ ◡̈ 벤허커피 한남점은 매장이 작은편인데 성수동은 매장이 정말 널-찍해서 좋았어요. 역시 벤허커피는 절 실망시키지 않아요. 여기 커피 원래 이렇게 맛있었나 하고 마실때 마다 감탄하는 곳! 벌써 뜨아를 마시는 계절이 왔어요.🥲 네일이 좀 더 자라기 전에 남겨두고싶어서 사진으로 남겨보았습니다. 너낌있나요🙈 10월도 벌써 얼마 남지않았네요. 추워진 날씨에 다들 감기조심하시고 남은 10월 마무리 잘하시길 바래요! 50m © NAVER Corp. BNHR 서울특별시 성동구 연무장5길 9-16 1층"
성수동 카페 벤허커피(BNHR),"성수동 투어 마지막 코스?????? 벤허 커피 쓰기 귀찮아서 미루다가 사진도 몇 장 안되길래 끄적여 본다. 이곳은 민지가 가보고 싶다고 해서 후식 커피는 벤허로 결정! 성수동엔 오픈한지 얼마 안 된 것 같다~~~ 작년에 한남동인가 갔을 때 보긴 봤는데! 벤허 커피는 밀크티가 유명하다는 소문을 익히 들음. 하지만. 아무도 밀크티는 주문하지 않았다. 반전ㅋㅋㅋㅋㅋ 오호 이곳이 그 핫한 벤허 커피? 메뉴 난 밀크티를 안 좋아하니깐 리치 바닐라를 주문하고 민지는 비엔에이치알커피, 지원기은은 아메리카노 ^ㅅ^ 그 누구도 밀크티는 주문하질 않았다... 디저트는 티라미수 하나뿐!!!! 난 목금에서 제대로 먹지 못해서 티라미수를 주문했다. 왜 때문에 아무도 밀크티 안 마셨던 건지........ ㅋㅋㅋㅋㅋㅋ 진동베르르르ㅡ르르르르르르르르르르 흠, 내가 생각했던 느낌이 아니었다 그래서 그런지 사진 찍는 열정이 식음. 포스팅하기 귀찮았던 이유는 내가 사진 찍을 때 대충 찍어서 그런가... 암튼 그렇네요 ^ㅅ^.... 비엔에치알에서는 폭풍 수다를 떨고 나왔던 기억뿐.. 티라미수는 거의 내가 다 흡입 ㅠㅠ 리치바닐라 바닐라라뗴 랑 다른 리치바닐라 자세히 보면 바닐라빈이 콕콕 박혀있다. 생각보다 맛있게 마신 것 같다~ 맛있어서 호로록 금방 마셨네! 기니가 자기 아아도 좀 마시라고 줬는데 커피 맛은 생각보다 괜찮은 카페 같음! 매장은 생각보다 넓고 깔끔하다, 사진 찍을만한 게 딱히 없음! 왜냐면 어딜 찍어도 사람들이 나오기에 생략 ^ㅅ^. 이상 초간단 BNHR 포스팅 끝!"
[소루카페.2] 비엔에이치알커피_BNHR_벤허커피_성수동카페,"두 번째 카페 포스팅은 요즘 핫한 #BNHR 일명 #벤허카페 #비엔에이치알커피 성수동으로 시장조사를 나갔다가 이미 유명한 #아르코커피 는 방문한 뒤였고😃 곧 유명해질 것만 같았던, 가오픈 중인 BNHR를 찾았다 들어가는 입구에서부터 느껴지는 몬드리안 감성ㅋㅋㅋㅋ 사실 BNHR 카페는 한남동에서 이미 가본 적이 있었는데 사장님께서 좋은 곳을 많이 다니시는 것 같아 팔로우 해놓고 있던 중 성수점 오픈 소식을 알게 되었다 시그니처 컬러인 레드와 옐로우가 들어간 굿즈 MD 상품들도 함께 판매 중인 카운터의 모습 스티커 사고 싶었는데... 참았다 😇 들어가자마자 제일 눈에 띄었던 건 요 조명들💡 천고가 높았는데 굵고 길게 내려와준 동글뱅이 조명 때문에 심심해 보이지 않고 공간이 더 풍성해 보인다 모던하면서도 패스트푸드점 같기도 한 가구들 온통 레드였으면 보기 싫었을 것 같은데 한 테이블 당 원 레듴ㅋㅋㅋㅋㅋㅋㅋㅋㅋㅋ 사소한 것들도 신경 쓰신게 보였던 부분이다👍🏻 #업사이드커피 를 사용한다고 해서 커피를 먹어볼까 싶었지만..!! 고민고민하다 벤허커피만큼 유명하다는 #아쌈밀크티 를 선택했다 ❤️트레이까지 깔맞춤 조아요❤️ 메인 로고가 새겨진 귀여운 종이컵과 함께 팩에 담긴 밀크티가 나왔다❣️ 요런 패키지 느킴 사진을 안 찍을 수가 없쟈나 ~▽~ 맛도 너무 달지 않고 딱 조았는데 종이컵에 먹어서 그런지 약간 원샷 느낌으롴ㅋㅋㅋㅋㅎㅎ 10분도 안 돼서 다 마셨다 ･▽･ ? @주임님찍사 #미니미짤 ~(˘▾˘)~ 전체적으로 분위기며 맛이며 모두 좋았던 비엔에이치알(발음 약간 힘듦 주의🤗) 커피 #성수점 !! 넓어서 단체로 방문하기에도 좋을 것 같다 공간이 밝아서 사진 찍기에도 bbb 특히 반려견도 함께 할 수 있다고 하니... 백 점💯💯💯 #성수동카페 #성수동맛집 #성수동데이트 #성수역카페 #성수동핫플 #애견동반카페 BNHR COFFEE(@bnhrcoffee) • Instagram 사진 및 동영상 팔로워 5,206명, 팔로잉 1명, 게시물 143개 - BNHR COFFEE(@bnhrcoffee)님의 Instagram 사진 및 동영상 보기 instagram.com 50m © NAVER Corp. 비엔에이치알커피 서울특별시 성동구 성수동2가 302-8 1층"
성수동 카페 벤허커피 BNHR : 초콜릿밀크. 리치바닐라,성수동에 있는 벤허 커피! 바로 옆에 있는 파스타집에 가려다가 웨이팅이 너무 길어져서 들어갔다 여기 갈 때까지만 해도 밤에 추웠는걸 ㅋㅋㅋ 일단 들어가자마자 주문부터 했다 벤허 커피 메뉴판 난 추워서 직접 끓여 만든 초콜릿밀크를 친구는 리치 바닐라를 주문했다 벤허 커피 내부 주문 후 둘러본 내부는 곳곳에 초록 초록한 풀들이 있어서 좋았고 전체적으로 약간 미국 하이틴 느낌이 들었다 초콜릿밀크와 리치 바닐라 직접 끓여만든 초콜릿밀크는 파우더가 들어가서 그런지 더 진한 초코맛이었는데 약간 다크초콜릿 향이 났다 리치 바닐라는 그냥 진한 아이스 바닐라 라떼맛 바닐라 빈도 보였다 추웠는데 몸 녹일 수 있는 따듯한 음료와 넓은 공간이 있어서 좋았다 :) 50m © NAVER Corp. BNHR 서울특별시 성동구 연무장5길 9-16 1층
성수동 카페 BNHR,"성수역 근처에 있는 BNHR을 가봤어요. 의자가 불편해요.. 쇼파 테이블이 없어요 분위기도 왁자지껄한편 약간.. 패스트푸드점 같아요 저는 아이스 아메리카노를 마셨어요. 무난해요 크게 맛없지도 않지만 크게 맛있지도 않는 무난무난한 맛 밀크티랑 초코우유는 저렇게 팩에 나와요. 저는 안 먹어서 맛을 모르겠는데, 먹어본 지인들이 진해서 맛있대요."
[성수동카페] ♡ 깔끔한 인테리어 BNHR 벤허 카페 리뷰 ♡,"안녕하세요 #메이크업아티스트 #요니쌤 입니다 오늘은 성수 핫플인 곳 중 하나인 #BNHR 카페 소개해드릴게요!! 먼저 #위치 와 #휴무 알아보실까요? BNHR 서울특별시 성동구 연무장5길 9-16 1층 ** 화요일 휴무 / 매일 12시~20시까지 ** 그럼 바로 시작해볼까요? #요니의뷰티로그 짠!! 바로 이곳인데요, 외관이 노란색으로 되어 있어서 멀리서도 한 눈에 보이더라구요!! 문도 제가 좋아하는 전체적으로 움직이는 문이에요-!!ㅎㅎ ↓↓↓↓↓↓↓ #bnhr #요니의뷰티로그 재생 0 좋아요 0 00:00 00:00  접기/펴기 #bnhr #요니의뷰티로그 #요니의뷰티로그 메뉴판은 이렇게 제가 제일 싫어하는 영어 버전으로 되어 있어요 저는 카페에 영어로 된 #메뉴판 이나 사진이 없는 메뉴판을 싫어하는 편이에요 사실 처음가는 곳이면 잘 모르니깐 사진으로 일단 보고 시각적으로 선택할 수 있지만 영어로 딱 한줄로 끝내는 메뉴판에는 읽는것도 시간이 흐르고 눈에 딱 안들어와요,, 물론 제가 영어를 잘 못해서,,,ㅎㅎ 아무튼 저는 친구가 와본적이 있어서 추천해준 #BNHR COFFEE 주문을 했어요-!!(ONLY ICE / 6,000원) #요니의뷰티로그 카페 카운터는 깔끔하게 화이트하면서도 포인트 색인 노란색으로 정리가 잘되어 있어 보기 좋았어요-!!ㅎㅎ #요니의뷰티로그 #요니의뷰티로그 바로 옆쪽에는 #밀크티 와 #디저트 #굿즈 준비가 되어 있었는데, 저희는 이 날 카페는 2군데 다녀와서 그냥 커피만 먹기로 결정했어요,,,, #요니의뷰티로그 #요니의뷰티로그 음료를 기다리면서 이곳저곳 둘러봤는데 정말 제가 좋아하게 깔끔 - 깔금 - #손소독제 도 준비 되어 있고 물도 준비가 되어 있고 #충전기 종류별로 준비가 되어 있었어요-!!ㅎㅎ #커피원두 도 제가 좋아하는 #듁스원두 이더라구요!! #요니의뷰티로그 천장도 높고 공간자체도 넓고 통유리로 되어 있어서 답답하다는 생각이 하나도 안들었고 식물로 #인테리어 를 해서 조금 더 안식한 느낌을 받았어요1! 천장에 매달려 있는 #조명 도 이쁘니 가져오고 싶더라구요,,ㅋㅋ #요니의뷰티로그 #요니의뷰티로그 #요니의뷰티로그 짜잔!! 드.디.어. 나온 커피-!!! 달콤하면서도 쌉쌀하면서도 계속 끌리는 커피 라떼맛!! 완전 맛있었어요!!ㅎㅎ 지금 포스팅하면서도 또 먹고싶을 정도로 정말 제 스타일!!! 공간도 넓직 - 넓직 - 해서 좋았고 커피맛도 훌륭해서 다시 찾아가고 싶을 곳이에요!! 다음에는 이미 유명한 메뉴인 #썸머아이스크림라떼 를 먹으러 가야겠어요-!!ㅎㅎ 그럼 오늘 포스팅은 여기까지 -!! 오늘도 제 #요니의뷰티로그#블로그 봐주셔서 감사합니다 #메이크업아티스트요니쌤#메이크업레슨문의#출장#환영 궁금하신 내용은 언제든지 #인스타#디엠 또는 #댓글 주세요!! 포스팅이 도움 되셨다면 #공감 많이 눌러주세요-!! ღMake-up Artist 요니ღ(@yony_makeup) • Instagram 사진 및 동영상 팔로워 36명, 팔로잉 56명, 게시물 22개 - ღMake-up Artist 요니ღ(@yony_makeup)님의 Instagram 사진 및 동영상 보기 instagram.com"
":성수동, BNHR",성수동에 갔다가 “비엔에이치알”_”벤허” 다녀오기 _비엔에이치알커피 & _오렌지 레모네이드 달달구리한 커피 조타 _상업적 목적으로 사진 촬영은 안된다고 하니 참고해 주세요~!
성수동수제화거리 디올성수/포인트오브뷰(소품샵)/gs25도어투성수/카페포제/BNHR/먼치스앤구디스,"성수동 카페거리랑 서울숲만 유명한줄 알고 여태 성수동카페거리만 가봤는데 요즘은 성수동수제화거리가 더 핫하다고 하는 성수동토박이 친구들 덕분에 이날 맛집도 가고 소품샵도 가고 카페도 가고 여기저기 볼거리들 많이 보고 온 하루 까먹기 전에 어디어디 다녀왔는지 기록하는 오늘의 포스팅 50m © NAVER Corp. 성수동수제화거리 서울특별시 성동구 연무장7길 15 삼한창고 <BNHR> 르프리크 1시간을 웨이팅했어야했는데 순번됐을 때 빨리 안오면 대기밀린다고 해서 르프리크 가까운 카페에 있기로 해서 바로 윗층에 있던 카페여서 BNHR을 감. 사실 이름도 모르고 그냥 가까이 있길래 들어간건데 카페맛집이다. 커피, 쿠피, 티라미수 다 맛있었던 곳 이 곳도 자리가 없어서 못앉을 뻔 했는데 마침 한자리 남아있어서 이 곳에서 웨이팅하면서 기다릴 수 있었음 <디올성수> 요즘 성수동 핫플로 인기있는 곳인 디올성수 인스타에서도 핫하길래 오~ 하고 이런 곳도 생겼네 하고 있었는데 BNHR 카페 코앞이길래 가봄 사실 디올성수 갈 생각없었는데 30초 거리에 있길래 외관이라도 구경하자 해서 갔는데 잘 지어놨다 성수동 핫플답게 디올성수 사진찍는 사람들 굉장히 많았음. <포인트오브뷰 - 소품샵> 이 곳은 친구가 한번 가보고싶다고 해서 갔던 포인트오브뷰 소품샵 엄청 감성적이고 엔틱한 느낌을 주는 소품샵이다 종이, 필기구 등이 굉장히 많았고 1층부터 3층까지 이루어져있어서 굉장히 볼거리가 많았다 <먼치스앤구디스 - 식료품/소품샵> 이 날 소품샵만 2군데를 다녀왔군 여기는 길가다가 우연찮게 발견해서 들어갔는데 카드 털이범인 곳이다 아기자기한 소품들이 있었고, 간식과 같은 식료품을 팔고 있었는데 곧 발렌타인데이라고 친구들과 똑같은 초코렛 하나씩 사서 나왔다ㅋㅋ 매장이 좁았고, 사람은 미어터지던 이곳 <gs도어투성수 - 편의점 팝업샵> 요즘 정말 별개 다 있구나 하고 느꼈던 곳 편의점 팝업샵이 있다? 사실 gs도어투성수를 편의점 팝업샵이라고 부르면 맞나? 싶기도하고 암튼 카페처럼 앉을 자리도 있고 와인부터, 한잔 와인도 판매하고 식기류도 판매하고 신기방기 눈돌아감 와인을 한잔씩 팔고 있는데 2-4천원 정도였나? 한잔 시음하고 바틀로 구입할 수 있다는 점이 굉장히 맘에 들었음 친구 추천으로 화이트와인 하나 구입해서 나옴 <카페포제> 집에 가기 아쉬워서 마지막으로 들린 코스 카페포제 주말에 방문한 성수동은 여기저기 사람이 많았고 자리 있는 곳을 찾기 힘들 정도였음 집에 귀가 전에 들린 카페이였기에 커피는 조금 부담스러워서 패션후르츠에이드를 시켰는데 너무 달지 않고 맛있었다 분위기도 괜찮았고, 너무 시끄럽지도 않고 성수동 나들이 기록 끗. #성수동수제화거리 #디올성수 #포인트오브뷰 #gs25도어투성수 #카페포제 #BNHR"
성수동 나들이 (아르코/쎈느/보이어/BNHR),"안녕하세요 ;-) 늘 그렇듯 꽤 지나버린 포스팅을 하고있어요. 해야지 해야지 하다가 요즘 여러모로 준비하고 있는것들이 많아서, 또 미루다 미루다 이제야 해요! 카페아르코 가로수길에서 오랫동안 자리잡고있었던 카페 아르코가 성수동으로 확장이전했더라구요. 1층은 카페로, 2층은 의류매장으로 구성되어있고 저희는 너무아침부터 가서 사람이 바글바글 하지는 않았어요. 더 며칠전에 방문하려고 했었는데... 사람이 너~~~~~~무 많아서 포기했다가 일부러 오전11시쯤 도착해서 천천히 사진도 찍었어요. 아침에 오셔서 커피랑 빵드시는 분들도 있더라구요? 2층은 12시 이후부터 구경 할 수 있어요. 보이어 친구와 카페에서 얘기하다보니 시간이 순삭.... 점심먹으러 보이어에 갔습니다. 미리 예약을 안했는데 다행이 자리가 있어서 얼른 안내받아 앉았어요. 내부는 연한우드톤에 요즘 유행하는 브릭형타일의 느낌들 쾌적하게 먹기 좋았어요 ;-) 점심 세트메뉴를 먹었는데 맛있었어요. 특히 카레!! 꼭꼭 추천이요! 성수동 투어니까 골목 걸어다니면서 여기저기 구경하고 다녔답니다. BNHR_성수점 점심먹고 여기저기 투어하고 걷다보니 또 목이말라져..... 들린 BNHR 성수점 아르코 근처에있어요. 그리고 옆에도 브런치카페가 또 있답니다. 정말 카페가 많은데 정말 사람이 많아요 ㅋㅋㅋㅋ 앉을 자리가 없어서 눈치보다 빠르게 쟁취했어요. 사람이 너무많아서 사진도 못찍을 정도였어요. 그래서 천정말 저렇게 찍었어요! 참 센스 있는 인테리어 인듯해요. 포인트를 득어가야 할곳만 딱딱.... 요즘 코로나때문에 많이들 경직되어 있는것 같은데, 이날은 다들 뭔가 표정들이 밝고 행복해보이는것 같았어요. 얼른 코로나가 끝나서 당연햇던 하루가 당연했던 시간이 돌아왔으면 좋겠어요! 모두모두 힘내세요!!"
"[성수동] 오르에르, 포인트 오브 뷰, BNHR 벤허커피","50m © NAVER Corp. orer 서울특별시 성동구 연무장길 18 OR.ER 오르에르(@or.er)님의 Instagram 프로필 • 사진 및 동영상 271개 팔로워 1.2만명, 팔로잉 93명, 게시물 271개 - OR.ER 오르에르(@or.er)님의 Instagram 사진 및 동영상 보기 www.instagram.com 성수동에서 전시 하나 보고 벤허 커피 가는 길에 #오르에르 를 마주친 김냄비…! 이미 포인트 오브 뷰 온라인 홈페이지에서 왕창 구매를 해서 더는 살 게 없었지만 오배송(?)의 인연이 깊기도 하고, 오프라인 매장을 구경해 보고 싶기도 해서 들렸다. 3층 #오르에르아카이브 옛날 한국식 주택에 빈티지한 물건들이 채워졌을 뿐인데 아이러니하게 중세 유럽같은 느낌이 들었다. 2층 #포인트오브뷰 2층 오르에르 라운지 안쪽에 위치하고 있다. 실제로 꼭 보고 싶었던 그림들 확실히 오프라인 매장에 오니 크기도, 질감도, 색감도 직접 확인하고 신중히 고를 수 있어서 좋았다. 홈페이지로 봤을 때는 가운데 저 koh-i-noor 지우개를 사고 싶었는데, 실물이 콩알만 해서 마음 식었어 아름다운 것들 내가 직장만 있었어도 바로 샀다 ^^;; 디피 보는 맛이 쏠쏠 공간이 협소해서 움직일 때 조심할 부분이 많았다. 내가 산 떡메모지 이거랑 포스트잇 세트를 하나 샀는데 마음에 쏙 든다. 계산대 근처 공간도 허투루 쓰지 않다니 공간에 대한 칭찬이 왜 자자한지 이해했다. 50m © NAVER Corp. BNHR 서울특별시 성동구 연무장5길 9-16 1층 #벤허커피 #BNHR 공간이 넓어서 시간 보내기 좋았던 곳 쿠폰도 진동벨도 깔끔해서 예쁘다. 유진쌤이 사주신 크로플인데 쫄깃해서 맛있었다. 라떼가 맛있는 집이래서 간만에 마셨는데 무난한 맛이었음 인서타 핫플은 바닥에 코박고 커피 마셔야 하는데 그런 거 하나 없고, 편하고, 공간이 넓어서 좋았다. 첫 성수동 나들이에 사온 것들 포스트잇 진짜루 이쁘댔지!"
