title,content
"이번주일상, 제스티살룬, 성수동 쿠나, BNHR ,국제다방 블루쑤이샵 후기 및 마감","날씨가 많이 추워졌네요 머플러 모자도 꼭꼭 필요한 완연한 겨울이네요 코로나 신규 확진자수가 매일매일.. 또 .. 올해는 이렇게 갔다쳐버려도 내년에도 이러면 안되는데 증말....ㅠㅠ 엄마 이와중에 마스크 쓰면 추울때 은근 따뜻하긴해요 94짜리가 더 따뜻 궁금했던 이영자 새우버거로 알려진 제스티살룬 드됴 먹어봤네요 레트로 감성의카페 청라 국제다방 쌍화차 시킨 내친구 .. 근데 쌍화차의 노른자 띄워서 드셔보신분계세요? 맛이 궁금하긴하나 저는 워낙 커피말고 다른 음료나 차에 관심이 없어서.. 아. 이와중에 조금 기쁜소식 그2.5단계때 집에만 있다가 쪘던 3키로 . . 2달만에 겨우겨우 드디어 평소의 몸무게로 돌아왔어요 요 청바지는 겨울마다 추울수록 더 많은 사랑을 받는 발열데님 시리즈 히트데일리진인데 안감이 요래요 그냥 살짝안쪽에서 긁은 기모는 따뜻한 느낌만 주는데 겨울에 완전 따뜻하다거나 든든한거는. 좀 떨어지거든요 밍크 융기모?처럼 완전 두껍지도 않지만 발열안감이라 활동할수록 따뜻하게 나온 기능성원단이에요 그렇다고 거칠거나 까슬거리지 않는 소재라 겨울내내 교복으로 잘 입으실듯해요 겉감도 따뜻한 느낌의 재질이에요 딸기는 요맘때(=비쌀때)가 제일 맛이가 있는거 같아요 가격은 딸기한팩 > 감귤한박스 ㅋㅋㅋㅋㅋ 전에 제주도 갔을때 방문했던 감귤농장에서 인연이되어 겨울마다 주문해서 먹거든요 무농약 감귤이라 저렇게 못생겨도 맛은 좋아요 요 전화번호로 주문하시면 되세요 여름내내 샤인머스켓으로 앵겔지수 높였는데 겨울내내 딸기 .가 한몫하겠다 . 보쌈도 먹고 굴보쌈 메뉴에 있는줄 몰라서 못시켰던거 안타까웠던건 나뿐?ㅋㅋㅋ 성수동 투어했던날! 가려던곳 리스트가 많았지만 성수동은 주차가 좀 어렵잖아요 이 건물에 주차장이 있어서 BNHR 커피맛 기대안했었는데 아메리카노 완전 맛있게 마셨어요~ 티라미수도 수준급 듣던대로 메종엠오 보다 진짜 백배 더 맛있었던 토끼맘의 토끼엠오? 메종토끼 ? 너무 궁금해서 하나 카페서 완샷 했는데 너무 맛있어!!!!!! 카페 차리자!!!! 제가 망원동있을적 엄청 좋아하던 #미아논나 BNHR 랑 같은건물에 있더라구요 샌디취 먹어보려고 했는데 자리가 없었어 ㅠㅠ 이 건물에 칙피스, 르프리크 쿠나 맛집들이 모여있어서 저처럼 성수동 초보들에게는 괜찮을거 같아요 주차도 되고 (비록 무료주차는 1시간뿐이지만 ㅎㅎ) 다른곳으로 무브 아 여긴 카페 아르코였는데 다른곳으로 바뀌었더라구요 날씨가 추워서 걷다가 걍 보이는 카페로 들어감 카페 레이다 라는곳이었는데 다들 음료에 대해 코멘트를 별로 안하더라구요 ㅎㅎ 블루쑤이샵 재생 24 좋아요 0  접기/펴기 니트 평소에 핑크 라벤더 칼라 잘 안입는편인데 잘어울린다고 해주셔서 히힛 그리고 다시 아까 그건물 이탈리안 레스토랑 쿠나 요새 인기많은 뇨끼맛집으로 알려진 곳 셰프님의 문신이 특히 기억에 남구요 메뉴판에 있는 메뉴 거의 다 오더했던거 같은데 뇨끼맛집답게 뇨끼도 맛있고 특히 바질페스토파스타가 맛있었던거 같아요 토끼엠오? 메종토끼? 아침부터 고급지게 시작했던 주말 사실 지금쯤 강원도 어느 캠핑장에서 아침을 맞이했어야 했는데 토요일인 어제도 배송을 했거든요 조금이라도 빨리 받아보셨음 하는 마음에최대한배송하고 그래서 도저히 강원도까지 운전하고 갈 체력이 안되더라구요 ㅠㅠ 캠핑룩만 다 챙겨놨는데 ㅎㅎㅎㅎ 냉삼으로 스트레스를 풀었죠 뭐 <블루쑤이샵 후기 및 마감 > 11월 미니마켓 오늘밤 12시 마감할게요 불편한 시스템에도 불구하고 항상 아껴주셔서 감사합니다 아직까지는 큰 지연품목이 없어서 배송이 착착 나가고 있는데 주문 마감즈음에 주문이 몰리는 편이라 마감 임박해서 주문주신분들은 조금 지연이 되더라구요 빠른주문=빠른배송 아시죠?ㅎㅎㅎ 후기입니다"
성수동 카페 <BNHR> & 복합 문화 공간 <피치스도원> 구경하기,"#성수동카페 #성수동맛집 #성수카페 #성수맛집 #성수역카페 #성수역맛집 #성수카페추천 #성수bnhr #BNHR #성수동BNHR #성수피치스 #피치스 #피치스도원 #건대술집 #건대입구맛집 #건대입구술집 #일상 #친구 #카페투어 #맛집투어 #인쌩맥주 #건대맛집 #서이추 #서이추환영 안녕하세요 지동이에요 :) 오늘은 성수동 카페 'BNHR' 소개해드릴께요 ㅎㅎ 원래 가려던 '플디'는 공사중이고 두번째로 고른 '루프'는 사람이 너무 많아서 오게된 맞은편 'BNHR' 카페 입니다 어쩔수없이 오게됐는데 넘 예쁘고 맛도좋아서 추천드리려고해요!! 50m © NAVER Corp. BNHR 서울특별시 성동구 연무장5길 9-16 1층 위치 입니다~ 매일 12:00-20:00 화요일 휴무 입구에요! 문이 특이하게 양쪽으로 돌아가서 신기했어요 ㅎㅎ 요즘 이런문 많이 보이는듯!! 메뉴판 입니다 :) 내부 모습 입니다~ 노랑노랑💛🌿 테이블 10개 이상으로 공간 꽤컸어요! 주문 후에 진동벨 받아서 15분 정도 기다린것 같아요! <주문한 메뉴> 오렌지 레몬에이드 6.8 썸머 아이스크림 라떼 6.8 크로플 with 아이스크림 9.0 인스타 갬성을 위해 최선을 다하는중인 월넛씨 성수동 카페 <BNHR> & 복합 문화 공간 <피치스도원> 구경하 (1) 재생 3 좋아요 0  접기/펴기 성수동 카페 <BNHR> & 복합 문화 공간 <피치스도원> 구경하 (1) 결과물 :) 원래 가려했던 루프,,, 플디도,,, 담에 다시올께🤍 다음은 피치스 도원 입니당🍑 50m © NAVER Corp. 피치스 도원 서울특별시 성동구 연무장3길 9 피치스 도원 위치 입니다 :) 카페 바로 옆이어서 찾기 편했어요 ㅎㅎ 매일 11:00-22:00 <자동차 문화를 기반으로한 스트리트 브랜드 Peaches의 오프라인 스토어> 라고 합니다 유명한 포토존💗핑크지만 힙한 분위기 생각보다 사람이 많지않아서 좋았어요 ㅎㅎ 나두 사진 건져따 ㅎㅅㅎ 뒤쪽으로 들어가면~ 찍을땐 몰랐는데 엿을 날리고있네,,,? 노티드 도넛과 다운타운 버거가 입점해 있습니다! 주문후 앉아서 먹을수 있는곳 같아요 테이블이 타이어에요!🌚 뒤쪽엔 옷도 파는것 같아요! 구경은 패스~ 자동차가 거꾸로 꽂아져있어요! 신기 ㅎㅎ 여기도 포토스팟으로 유명하죵~ 성수동 카페 <BNHR> & 복합 문화 공간 <피치스도원> 구경하 (2) 재생 0 좋아요 0 00:00 00:06  성수동 카페 <BNHR> & 복합 문화 공간 <피치스도원> 구경하 (2) 아기 상어 뚜루루루~🦈🦈 어항안에 SMOKING TIGERS 라고 써있는데 후카bar (물담배&위스키바?) 인것 같았어요 월넛씨가 추억의 냄새가 난다고 무슨냄새지? 했었는데 알고보니 물담배ㅋㅋㅋㅋㅋ 그녀의 추억은 무엇인가,,, 나가는길~ 화이트닝 못해줘서 미안해 월넛씨,,,^^ 그래도 예뻐 초록초록한 여름🪴🌿🌱 쪼금만 덜 더워주면 고맙겠어 :) 50m © NAVER Corp. 인쌩맥주 건대점 서울특별시 광진구 아차산로25길 14 1, 2층 성수동 카페 <BNHR> & 복합 문화 공간 <피치스도원> 구경하 (3) 재생 1 좋아요 0  접기/펴기 성수동 카페 <BNHR> & 복합 문화 공간 <피치스도원> 구경하 (3) 성수동 카페 <BNHR> & 복합 문화 공간 <피치스도원> 구경하 (4) 재생 2 좋아요 0  접기/펴기 성수동 카페 <BNHR> & 복합 문화 공간 <피치스도원> 구경하 (4) 건대입구로 이동해서 '인쌩맥주' 라는 술집을 갔어요 김치전 존맛탱 아이셔에이슬 존맛탱 김치전 8900￦ 저려미 술집인데 퀄리티가 좋았어요 ㅎㅎ 완벽한 하루였슴당 그럼 안뇽히~❤"
한남동 벤허커피가 성수에도 생겼따! 라떼가 맛있는 성수동 카페 BNHR,50m © NAVER Corp. BNHR 서울특별시 성동구 연무장5길 9-16 1층 안녕 성수동 벤허! 한남동에서도 좋아하는 bnhr 카페가 성수동에서도 생겼습니다 ㅎㅎㅎ! 사실 생긴지는 꽤 됐는데 이제야 가본... 메뉴판 보시라! 한남동은 거의 대부분 2인용 좌석에 작은 카페 느낌이었다면 성수동 벤허는 널찍널찍! 입구 도어도 엄청 크구요! 역시나 너무 예쁜 벤허 굿즈. 사회적 거리두기 때문에 테이블을 몇개 빼두셨는데 이거 마저도 간지.. 햇빛 잘 들어오고! 테이블이 크고 편해서 여기서 작업하거나 과제하기 딱 좋다고 생각했음! 물론 그렇게 하시는 분들도 꽤 많았음! 너낌 알쥬~ 느낌있는 카페의 상징 = 카페 굿즈 한남동이랑은 꽤 다른 느낌의 성수동 BNHR 저는 한남동도 성수동도 좋았습니다. 왜냐면 커피가 맛있거든요. 그리고 벤허 왔으면 라떼! 따듯한 라떼도 아이스 라떼도 진짜 맛있음. 추천합니당. 성수동에서 널찍한 자리~ 콘센트~ 노트북 할 곳~ 찾으신다면 bnhr... 옼께이..? #성수동카페 #성수BNHR #성수동라떼맛집 #성수역신상카페
[카페] 서울 성수동 : BNHR / KANTO / ARCO,"2020년 4월 20일 눈뜨자마자 혼자 바람 쐬러 가고 싶다는 생각에 동네 근처? 다른 동네? 대전 근교? 어디로 가야 하나 생각의 꼬리에 꼬리를 물다 결국 조금 무리수 같지만 즉흥으로 서울 다녀오기 혼자 갈 때면 초행길도 부담되고 당일치기 운전이 힘들어 기차역에 차를 두고 떠나는데 오늘만큼은 코로나로부터 안전하게 돌아다녀 보자는 생각으로 집에서부터 곧장 서울로 출발! 어디 갈지 고민도 별로 안 해보고 계획 없이 (평소에는 엄청 찾아봄) 서울숲을 목적지로 정했습니다. 성수동은 두 번 정도 가봤지만 근처에 서울숲은 왜 그냥 지나쳤을까 처음 가보는 곳에 대한 설렘 가득 서울 가고 싶을 때면 아주 일찍 일어나 부지런히 오전 중 도착하게끔 움직이는데 이날은 너무 여유를 부려 두시가 넘어 도착 비도 오고 거의 다 왔을 무렵 차도 막히고 순간 잘못된 선택이었을까 싶었지만 가보지 않으면 모른다는 긍정의 마음으로 참고 화장실도 참고 드디어 도착을 해버렸습니다. 다행히도 방문했던 카페들은 각각 가까운 거리에 위치해서 헤맬 걱정이 없었어요! 오기 전 가고 싶었던 성수동의 새로운 카페들 서울숲 산책은 제일 마지막으로 코스로 정하고 늦게 가면 자리가 없을 것 같아 얼른 BNHR로 향했습니다. BNHR 한남동에서 한번 가보고 새로 오픈한 성수동 BNHR은 어떨까 굉장히 기대되었어요! 블루스톤 타워 1층 엄청나게 세련된 건물에 놀라웠고 들어가서는 앉을 자리가 눈에 띄지 않을 만큼 문전성시를 이뤄 놀랐습니다. (시선을 어디 둬야 할지 모를 만큼 사람들이 많았던) 사실 한남동 BNHR에 비해 훨씬 넓고 테이블도 많고 깔끔하지만 단순한 구조이기도 하고 눈요기를 할만한 요소는 별로 없어 조금 아쉬웠습니다. 천장에 달린 BNHR 로고가 새겨진 조명이 인상적 오랜만에 마셔보는 이곳의 시그니처인 비엔에이치알커피 주문! (밀크티도 드셔보세요) 적당히 고소하고 달달했던 커피 맛은 역시나 정말 훌륭했습니다. 하루 커피 할당량 두 잔 중 한 잔을 원샷하고 서둘러 다음 제일 기대되었던 칸토 카페로 이동! KANTO 커피와 문화가 공존하는 공간 지상과 지하를 이어주는 새로운 문화를 전달하고자 합니다. 입간판에 적힌 위의 문구가 인상적이었습니다. 입구에서부터 사뭇 진지해지게 만드는 흑백의 조화란 좋아하는 색깔은 다양하지만 좋아하는 색 조합을 꼽자면 블랙 & 화이트가 제일 먼저 떠오릅니다. 지하세계로 내려가는 검은 계단을 통해 들어선 카페는 눈이 휘둥그레질 만큼 깔끔함으로 무장했고 저의 취향을 저격 한때 나만의 카페를 만들고 공간을 꾸며보고 싶단 생각을 많이 했었는데 부산 어슬로우데이 카페 이후 칸토 카페에서 한 번 더 격하게 대리만족을 했습니다. 긴 말보단 사진 몇 장으로 더 이상의 설명이 필요 없는 이곳의 모던한 익스테리어와 인테리어 다행히도 사람이 많을까 조바심을 내었는데 여유롭게 공간을 즐길 수 있었습니다. (셀카도 한 장 찍고) 카페와 커피의 깔 맞춤 사전에 사진으로 봤던 플랫 블랙을 주문해보았습니다. 망원동에 위치한 언아이콘의 레드 쇼콜라가 생각나는 비주얼! 고소한' 너트 베이스'와 쓴맛의 '룽고' 담백하고 부드러운 식감에 다양한 맛을 느껴볼 수 있었던 커피 오랜 시간 머물며 앉아있어도 불편함 없었던 무척 마음에 드는 칸토 카페였습니다. ARCO 마지막으로 세 번째로 들른 곳은 인스타그램에서 수차례 피드에 올라온 아르코 멀리서도 눈에 띄는 엄청난 스케일의 카페 외관도 예쁘고 이것이 서울클라쓰인가 싶을 정도로 압도되는 곳 건물 앞쪽 스티킹 되어있는 통유리 앞이 핫한 포토존이었는데 힙하고 개성 넘치는 사람들이 정말 많았습니다. 2층은 쇼룸? 마켓처럼 보이는 공간이었는데 슬쩍 둘러보고 패스! 이제 카페인 섭취의 한계로 인해 오렌지에이드 주문 보통은 자몽에이드, 레몬에이드를 즐겼는데 이곳에서 먹어본 오렌지에이드 너무 맛있었습니다. 아르코는 혼자 가면 많은 사람들 사이에 있는 나를 발견할 수 있는 곳 그러나 실은 친구들이랑 같이 가고 싶은 카페였습니다. 이렇게 세 곳을 다녀오니 시간이 순삭! 쌀쌀한 날씨에 배도 고프고 뜨끈한 라멘을 먹고 싶었으나 거리를 구경하다 쿄와텐동에 가서 저녁 해결! 물론 맛있었지만 대전에 있는 와타텐동을 더 추천하고 싶습니다. 마지막으로 미뤄두었던, 소화시킬 겸 산책하기 딱 좋은 서울숲을 거닐다 풍경도 담고 잠시 벤치에 앉아 오늘 하루를 되돌아보았습니다. 오늘의 선택은 훌륭했고 해가 질 무렵 하늘이 개어 풍경도 예쁘고 눈으로 보는 즐거움 마시는 즐거움이 가득한 서울에서의 하루 끝!"
[성수동카페/BNHR벤허커피]한남동 뽀사먹고 성수동도 접수중인 핫플카페(ft카멜커피),"ㅎㄴ의 점심시간에 맞춰 이른점슴으로 햄벅으로 낮술 한잔 조져주고 https://blog.naver.com/mjinchul1/222477665871 [성수동맛집/넛츠버거]성수동핫플이라는 신상버거맛집.햄버거덕후라면 한번 가보실만한..(ft어반자카파 박용인) 평일 점심약속을 잡았던 성수 어디어디 가고 싶다고 했는데 월요일이라 휴무 하는 매장들이 많았..... 결국... blog.naver.com 점슴시간 끝날 무렵 회사로 들어가야 하는 ㅎㄴ 사장이지만 공사는 철저한편 ㅋㅋㅋㅋㅋ 회사 가서 마감 하고 나온다며 카페에서 기다리라길래 ㅎㄴ회사 근처에 있는 BNHR 벤허 카페로 가 봅니다. 핫플이긴 하지만 이동넨 어딜 들어가도 다 핫플이니깐 ㅎㅎㅎ BNHR의 입구 인스타 갬성에 맞게 요즘 핫플인곳의 문은 저따구식으로 많이 만들더라구요 회전문 스탈 시골분들 오심 들어가는 문 못찾게 만드나 봐요 50m © NAVER Corp. BNHR 서울특별시 성동구 연무장5길 9-16 1층 BNHR 070-4175-6118 서울 성동구 연무장5길 9-16 영업시간 월~일요일 12:00 - 20:00 화요일 휴무 빌딩쪽 입구에 붙어 있던 해피아워 주중 직장인들 위해 할인행사를 하는가 봅니다. 아........ 할인행사 하긴 해야겟네요 ㅋㅋㅋㅋㅋㅋ 공간은 겁나 크고 시원시원한데 손님은 없슴 이날 평일 낮 12시 지난시간이었던점 감안해도 없어도 너무 없네요 그래도 화이트톤으로 깔끔한 인테리어라 전 좋았습니다. BNHR 벤허커피의 메뉴 이곳의 시그니처는 밀크티랑 BNHR커피라고 하더라구요 그래서 전 BNHR커피 선택 ㅋㅋㅋㅋ 요런저런 굿즈들도 있었는데.... 강렬한 노랑색 칼라가 눈에 들어왓던 라마르조꼬 4구짜리 일라나?? 이정도면 기본 몇천만원은 하지 ㅋㅋㅋㅋ 커피머신계의 샤넬이라 보면 됩니다. 요때만 해도 이집이 밀크티가 유명한줄 난 모르고 있었지 ㅋㅋㅋㅋㅋ 진작 알았으면 하나정도 사서 맛봤을텐데... 회사 들어가는 ㅎㄴ한테 아아 2잔 건넸는데........ 지금 보니깐 왜 평일 할인을 안해주셨지???? 평일 12시~2시까지 아메리카노 3,900원이라더만 따아만 3,900원인겨??? ㅋㅋㅋㅋ 찌니님은 아아 난 bnhr커피 첨엔 무슨 에스프레소도피오인줄 ㅋㅋㅋㅋ cold 인줄 모르고 당연 따뜻한건줄로만 생각하고 입에 대니 차가운 기운이 엄습을 ㅎㅎㅎㅎ 뭐랄까??? 예전 어릴때 엄마가 여름에 델몬트 병에다가 믹스커피 넉넉하게 넣고 냉장고에서 차갑게 한뒤 컵에다가 얼음 띄우고 줬던 그맛? 커피잔에 믹스커피 2-3봉 넣고 연유 넣고 냉장고에 시원하게 하면 이 맛 나올라나? 달달하면서도 끝엔 고소한 맛과 커피의 쌉쓰레한 맛까지 입안의 미각을 일깨우는 맛 같아요 한번 경험해 보실만한 맛 ㅋㅋㅋㅋ 카멜커피랑은 비슷한 듯 다른결 https://blog.naver.com/mjinchul1/222324989504 [여의도 더현대맛집/카멜커피]기분좋은 달달함에 해피해지던 카멜커피.대기시간이 아깝지 않아~ 여의도에 새로 오픈한 더현대 일반적인 백화점 형태가 아닌 스타필드처럼 휴식과 쇼핑을 함께 할수 있는 고... blog.naver.com 한남동이나 성수 오셨다면 한번쯤 경험해 보세요 전 담에 밀크티 먹으러라도 한번 더 가볼 용의가 있습니다 ㅋㅋㅋ"
"[서울/성수동]BNHR성수(성수벤허)-BNHR커피, 아쌈밀크티, 초콜릿우유","어제 다녀온 성수 핫플레이스 ‘비엔에이치알커피(BNHR)’ 한남동에 1호점이 있고 최근 성수에 2호점이 생겼다👏👏 원래는 쎈느 갔었는데 자리가 없어서 비엔에이치알(BNHR)로 목적지 변경하고 2분 걸어서 비엔이이치알 도착!!🚶🏻‍♀️ 요 노란문이 BNHR커피 입구인데 네모네모한 것이 귀여웠다🟨 내부는 요 테이블과 의자로 채워져 있었는데 테이블 간격은 좀 좁다는 느낌이라 아쉬웠지만 의자는 퐁신퐁신해서 좋았다😶 그립톡, 스티커, 볼펜 등 귀여운 굿즈들도 판매한다 BNHR은 듁스 원두를 사용하시나부다 (요즘 자주 보이는 듁스☕️) 음료를 주문하면 왼쪽의 진동벨과 오른쪽의 도장 쿠폰을 주신다 (도장은 음료 개수대로 찍어 주신다) 요게 비엔에이치알커피☕️ 차가운 커피지만 얼음은 없다! 고소한 넛츠향이랑 커피맛이 잘 어우러지고 달달하기까지 하니 당연 맛없없인 커피 (초점 무엇 ㅠ) 요 팩에 들어있는 건 왼쪽은 아쌈밀크티 오른쪽은 초콜릿 우유다 파우치에 들어있는 두 음료는 작은 종이컵에 얼음이 담겨져 같이 나오는데 여기에 부어서 마시면 된다 아쌈밀크티도 초콜릿 우유도 맛과 향이 진하다 초콜릿 우유보다 아쌈밀크티가 더 달달하고 개인적으로는 얼음 없이 마시는 게 더 맘에 들었다🥛 밀크티보다 커피가 더 맛있는 건 안비밀🤫 BNHR이 새겨진 조명이 예뻐서📸 요즘 성수에 BNHR, 호호식당 등 서울 핫플들 분점이 꽤나 생기던데 담엔 당도 분점인 ndd 뿌시러 가야지🍨 • • • <BNHR 메뉴판> #서울카페 #성수동카페 #성수역카페 #뚝섬카페 #성수카페 #BNHR #벤허성수 #비엔이이치알커피 #아쌈밀크티 #초콜릿우유"
[성수동 카페] 벤허커피 BNHR 커피,"안녕하세요 홀릭입니다 오늘은 회사 안가고 반차찬스로 놀고 있는 오전에 아 더늦으면 내년에 올라가겠구나! 위기의식을 느끼며 올리는 #성수동카페 #벤허커피 #BNHR커피 방문 후기 입니다 전시회 끝나고 동생이랑 돌아다니다가, 잠시 의논할 곳이 필요하여 찾았던 곳이구요 뭔가 #인스타핫플 느낌이 물씬 나는 곳이라 망설이지 않고 바로 들어갔습니다 ㅋㅋ 50m © NAVER Corp. BNHR 서울특별시 성동구 연무장5길 9-16 1층 위치는 성수동에 많은 핫플 카페들이 몰려있는 젊은이들이 줄서있던 곳들 사이에 있었습니다 다시 하는 말이지만 성수동에 살고싶습니다....내가 원하는 외국같으면서 도시같으면서 너무 좋음 ㅠㅠㅠㅠㅠㅠ 높은 층고 BNHR 이라고 쓰여진 조명 화이트톤 요즘 느낌 물씬 나는 인테리어도 참고하며 (자리가 많지는 않았어요) 간소한 메뉴 뭔가 아크릴인지 비닐인지를 씌워놓아 빛 안들어간 사진을 찍기 힘들고 대충 찍었지만 아무튼 메뉴 가게 명함도 한컷 컬러감이나 이런게 넘나 요즘 스타일이고 제 스타일이라 좋더라구요 ㅋㅋ 요즘 굿즈가 대세죠 사고 싶었지만 꾹 참았던 볼펜과 여러 굿즈들 특히 문구 매니아이기 때문에 스티커도 사고 싶었는데 스티커는 왜 안사고 온거죠? (저를 탓하며 ) 진동벨 저희는 저녁을 먹으러 갈 거였기 때문에!!! #리치바닐라 와 #밀크티 트레이도 이쁩니다. 이쁜거에 약해요 저 .... ㅠㅠ #벤허커피 #BNHR 이라고 쓰여진 자기주장 강한 패키지!!!! 밀크티는 얼음컵을 달라고 했고, 파우치에서 한번에 다 덜수가 없어 마시면서 부어서 마셨습니다 밀크티의 맛을 알게 된 후로 뭔가 어른이 된거 같은 느낌이었는데 아무튼 향도 진하고 좋고 너무나 제스타일 입니다 왜 집에서 우리면 저 맛이 안나는 거죠 ㅠㅠㅠㅠ 넘 만족했던 #리치바닐라! 보시다싶이 바닐라빈이 콕콕콕콕 박혀있어서 좋았어요 음료 자체는 그렇게 비싼 편은 아닌데 디저트는 가격대가 좀 있는 편이었던거 같고 자리가 있다없다 하는 것 같았지만 (또 요즘은 핫풀에서 조금 꺾인듯 하지만) 왠지 좋아보였던 #벤허커피성수점 방문 후기 였습니다!!! 이제 카페투어는...힘들겠지만 다시 나가서 커피마실 날을 기다리며 ㅠㅠㅠㅠㅠ"
[서울] 성수동 : BNHR 여기커피 맛있다며,"50m © NAVER Corp. BNHR 서울특별시 성동구 연무장5길 9-16 1층 요기...바로 쿠나옆에있어용 쿠나갔다가 바로들렸는뎅, 핫플이라며? 커피맛있다며? 여기저기서 소리들었는데... 바로옆이라니 지나칠수없쥐! 돌리는문~~~ 미국 서부쪽에서 피자를 팔것만같은 칼라와 인테리어 넓찍하니....죻다~ 시그니처를 드셔야한데요. 아아시켯다가..모두가 비엔에이치알커피를 시키길래 따라시켯어용 옆에언니가.. 여기는 이걸마시로 오는것이라며~~~~~알려줘서! 넓게넓게 햄버거아님 피자나워야할것같지만 커피한잔씩! 가격은뭐..얼추.. 햄버거값이긴하죠요즘커피들ㅋㅋㅋ 참고로아이스인데 여기다주셨어요. 2유는 모름~ 이렇게찍겠다공 들다가 흘림어카지...ㅂㄷㅂㄷ하면서 예쁘게쨘 맛이좋으네요 핫플이라길래 와본이곳 끄읏 #BNHR #BNHR커피 #BNHR카페 #BNHR커피맛집 #BNHR성수 #BNHR성수동 #성수동카페 #성수동카페추천 #성수동카페맛집 #성수동카페데이트 #성수동데이트 #성수동데이트추천"
