title,content
"주일 예배 후 성수동 - 감도, 뺑드에코","주일 11시 예배를 드리고, 괜히 성수동 아무생각 없었지만 그냥 밖에 있고 싶은 기분이? 난 역시 집순이는 아닌가 봄 오랜만에 뺑드에코 소시지바게트 2개는 사야 함 ㅋㅋ 차 안에서 하나 클리어 오늘은 조금만 샀다 신의바게트랑 소시지바게트만 소문난 성수 감자탕 줄이 장난 아니네 내가 자주 갈땐? 저 정도는 아니었는데 근데 맛있긴 함 난 줄 서서 가진 않겠지만 ㅋㅋ 빵 사고 딱히 할 게 없어서 커피마시러 성수동 골목은 주차가 힘드니까 디타워로 50m © NAVER Corp. 감도 성수점 서울특별시 성동구 왕십리로 83-21 디타워 서울포레스트 지하1층 B115 감도 아무래도 점심 때여서 그른가 자리는 많이 있었음 나는 ‘바다소금아메리카노’ ㄱㅈㄱ님은 ‘바다소금라떼’ 그리고 ‘유자밀푀유’ 사실 후기를 몇 개 좀 찾아봤는데 비싸다는 후기가 많았는데…… 주차 2시간 되고 ㅋㅋ 커피도 6300원 6800원 이면 뭐 그렇게 많이 비싼 건 아니라고 생각함 그리고 유자밀푀유 넘 맛있다 진짜 저 설명에 나온대로 바삭하고 달콤하고 상큼한 디저트 오랜만에 같이 사진도 찍고 데이트 느낌이지만 현실은 먹고 살 이야기 ㅋㅋ 이런게 있어서 해봄 나의 쉼은 ‘알콜’ 이다? 근데 요즘은 마니 못 마시겠다 ㅜㅜ 운동을 쉬어서 그런가 체력이 그지가 됨 술 마시려면 체력 키워놔야 함 ㅋㅋㅋ 3월 부터 운동 ㄱㄱ 아니 오늘부터!!!!! 아….. 벌써 주말이 끝나간다."
성수동 오드플랫 알트 감도 높은 빈티지 가구 쇼룸,"임스체어를 다양하게 보유하고 있는 것으로 유명한 빈티지 가구 쇼룸 오드플랫의 두 번째 공간, 오드플랫 알트입니다 본점 오드플랫은 예약제로 운영되고 있어 예전에 방문하려다 말았던 적이 있었는데 오드플랫 알트는 예약이 필요 없어 좀 더 자유롭게 찾을 수 있어 좋았습니다 오드플랫 알트 ODDFLAT ALT • 14:00 ~ 18:00 (일,월,화 휴무) • 서울 성동구 아차산로6길 8, 4층 여기가 맞나? 가 흔해진 요즘이지만 아무런 표식이 없어 방문 난이도가 있는 편인 오드플랫 알트입니다 층도 제대로 몰라 더 헤맬 뻔했는데 4층입니다! 😆 생각보다 넓은 공간에는 자연스럽게 섹션을 나누어 빈티지 가구들을 전시하고 있습니다 사장님 두 분이 반갑게 맞아 주시며 편하게 둘러볼 수 있도록 해 주십니다 입구 가까이에 전시되어 있는 Eames 임스 라운지 체어입니다 1970년대 초반에 생산된 빈티지 제품으로 90년까지만 사용된 로즈우드 패턴을 볼 수 있는 제품이라고 합니다 코발트블루 컬러 원단을 사용한 우드 재질 SB02 체어도 귀엽습니다 미팅룸이나 서재에 잘 어울릴 듯한 섹션입니다 특히 조명이 마음에 들었는데 이탈리아 브랜드 제품이라고 합니다 다소 키치한 느낌의 컬러풀한 라운지 체어도 유니크합니다 독특한 빈티지 디자인의 스피커가 돋보이는 섹션입니다 역시 벽에 걸려있는 조명에 시선이 가는데 미래적인 디자인의 60년대 조명이라고 합니다 오드플랫 알트에서 가장 마음에 들었던 조명입니다 이런 멋진 조명이 하나 걸려 있으면 공간에 다른 소품이나 장식이 필요 없을 것 같아요 18개의 전구가 달려있는 샹들리에로 스위스에서 생산된 제품이었습니다 Concorde 콩코드라는 이름의 라운지 체어입니다 이름에서 유추할 수 있듯 에어 프랑스의 요청으로 일등석 라운지 체어로 만들어진 의자입니다 부드러운 라인이 심플하고 세련된 느낌을 주고 컬러 원단으로 복원되어 포인트로 사용하기에도 좋을 것 같습니다 Joe Colombo라는 이탈리아 디자이너의 Elda Chair입니다 1990년대에 생산된 제품인데 이렇게 세련되고 현대적인 가구를 만들 수 있다니 놀라울 따름입니다 콩코드 체어와 엘다 체어의 투 샷입니다 둘 다 마음에 쏙 들지만 금액이 😅 오드플랫 알트에서는 빈티지 가구를 셀렉 후 상태에 따라 복원하여 선보이고 있습니다 앞에 보았던 콩코드 체어를 화이트 부클 원단으로 새롭게 복원한 제품이라 합니다 독특한 디자인의 595체어입니다 Elba Chair 와 더불어 미니멀하고 미래적인 디자인을 보여주고 있습니다 Maria Sabot의 라운지 체어입니다 납작한 원형의 형태로 보기만 해도 편안해 보이는 의자입니다 가장 마음에 들었던 디자인이었지만 가질 수 없는 너😥 독특한 퍼플 컬러 체어가 놓인 섹션입니다 실용성보다는 디자인에 염두를 둔 가구 같아요 빈티지 버전의 콘란샵에 다녀온 듯한 성수동 오드플랫 알트였습니다 (금액 또한😆) 친절하게 맞이해 주시니 꼭 구입하지 않더라도 부담 없이 방문하셔서 디자인 감각을 키울 수 있는 멋진 가구들을 편안하게 둘러보시라 추천하고 싶습니다 50m © NAVER Corp. 오드플랫 알트 서울특별시 성동구 아차산로5길 8 다미빌딩 4층"
"우리의 성수동 핫플 정복기 (feat. 메종 파이프 그라운드, 감도)","일요일 아침, 남편과 아이는 키즈카페로 나는 성수동 핫플로 향했다. 오랜 친구를 만나러 가는 길이 단순히 신나는 이상으로 설렌다. 생활을 늘 공유하고, 함께 여행도 다녔고, 고등학교 시절부터 2,30대를 함께 했지만 결혼하고는 각자 생활에 바빴고.. 통화는 했지만 얼굴은 볼 시간이 그렇게 자주 나지 않았는데.. 서로 바빴다 생각했는데.. 30대의 나는 직장에 목숨을 걸었고 지극히 내 개인의 삶을 내려놓았고, 반대로 친구는 30대에 일을 내려놓고 아이를 키우고 있었으니 우리의 대화가 어색했을 수밖에.. 이제 내가 여유가 생기니 친구 안부도 묻고 아이 키우며 조언도 구하게 됐는데.. 그렇게 또 늘 그 자리에 있어준 친구가 고맙다. 오랜 친구들도 생활 반경이 달라지거나 떨어져 있던 시간만큼 (심리적) 거리가 생기게 된 것을 경험해서 알게 되니 더더욱.. 친구는 아이 둘째가 6살이 되니 꽤 오래 놓고 있던 일을 다시 오전 근무로 시작했고 여전히 아이 둘을 직접 키우고 있다. 새벽 6시에 수영도 하고 있다. 나도 재활에 이어 필라테스 4개월에 접어들었다는 이야기를 하며 서로 이제 건강을 챙길 때라며, 우리는 휴일 오후를 함께 보냈다. 예전에는 떡볶이와 탕수육도 1인 1접시 하던 우리, 튀김류를 똑같이 좋아했고 그렇게 식성도 비슷했던 우리 이제는 40대가 되어 성수동 핫플에서 (아이들은 두고) 만난다. 아이들이랑 같이 볼까 했는데 둘만 보자는 너, SNS를 전혀 하지 않고 오직 자기 인생에 집중하는 모습도 참 곧은 느낌이라 신기하고 좋다. 난 이제 아이 없이 혼자 나오는 내 모습이 어색했고, 아가랑 서울숲을 가야 할 것 같은데 성수동 핫플레이스를 걷고 있는 모습이 계속 어색하지만 핫플 정복하자는 너의 말이 또 그렇게 유쾌해서 실컷 웃었다. 이렇게 쓰다 보니 참.. 역시 사람은 추억을 먹고 산다.. 우린 메종 파이프 그라운드에서 11시에 만나 브런치를 하기로 했는데 서울숲 역 5번 출구로 올라오면 바로 보이는 건물이라 지하철을 타봤는데.. 너무 오랜만에 탔더니 노선도를 보고도 승강장을 물어 찾아갔다는.. 부끄러운 상황ㅋㅋ 메종파이프그라운드 성수점 그렇게 도착한 메종파이프그라운드 자리가 꽉 차 있었다. 한남점에서 인정받고 성수에 오픈을 해서인지.. 아주 심플하고 와인으로 치면 드라이한 느낌의 인테리어에 한번 놀라고, 휴일 아침부터 많은 사람에 또 놀란다. 50m © NAVER Corp. 메종 파이프그라운드 서울특별시 성동구 왕십리로 83-21 지하1층 B124호, B125호 예약 대중교통을 이용한 내가 왜 더 늦냐.. 메뉴 먼저 주문해~ 음료는 아아로, 나 곧 도착해! 오자마자 아아 들이켰다..^^ 쓴맛이 나지 않는 순한 아메리카노 맛이었고, 너랑 내가 결혼할 즈음 인기였던 핀란드의 이딸라 스타일 글라스웨어, 컵 그립감에 또 한 번 더 힐링이었다. 사진을 잘 찍지 않는 친구, 어 사진도 찍냐며? 나도 찍어볼까 하며 폰을 들어본다. 세라믹과의 조화로운 테이블웨어에 또 한 번 눈이 즐거웠고. 이곳 시그니처 옥수수 피자는 달달하고 살짝 매콤한 맛도 나고, 빵도 바삭하면서 부드러운 맛. 굿굿! 가지 튀김 좋아하는 우리, 이번엔 가지 라자냐. 정말 가지에 심심한 토마토소스만, 아주 건강한 맛! 또 굿굿! 아보카도 사우어 도우 플레이트, 아보카도 맛은 아직도 잘 모르는 나인데 새콤한 소스 맛이 너무 딱 좋다. 수다와 맛있는 음식에 시간 가는 줄 몰랐는데.. 사람들이 줄을 선다. 2차 가자! 메종 파이프 그라운드에서 나와 전시회 공간을 지나니 카페들이 몇 개 보인다. 그중 담백한 고급스러움에 이끌려 들어간 감도 디저트 카페, 감도(Gamdo) 성수점 감도 성수점 서울특별시 성동구 왕십리로 83-21 디타워 서울포레스트 지하1층 B115 감도 테이블마다 터치할 때마다 색이 변하는 귀여운 조명이 놓여있다. 소금이 들어간 맛인가? 신기한 메뉴들 시켜보기. 바다소금 아메리카노는 샷 추가한 진한 맛, 짠맛은 안 느껴졌고.. 너의 바다소금라떼는 엄청 짜다며 깜짝 놀라더라. 너무 예쁜 예술작품 같은 조약돌 바질 들판. 조약돌은 머랭 쿠키인데 담백했고. 유자 마리네이드 색색의 토마토와 아이스크림이 크럼블과 버무려져.... 맛있는 거 같긴 한데.. 대체 이건 무슨 맛의 조화인가..... 이게 요즘 스타일인가? 또 2시간 넘게 수다가 이어졌고.. 숲 유치원을 3년째 보내고 있는 친구 아이의 7세 이야기를 한참 듣고 내가 중요한 걸 놓치고 있는 건 아닌지.. 두 돌부터 시작된 놀이학교.. 1년 반을 보내고, 엄마 눈에 아이의 도약이 보여서 영유로 들어선 우리 아기 같은 아이를 너무 이르게 이끌고 있는 건 아닌지.. 복직을 하며 단지 어린이집에 보낸 후, 한 아이의 괴롭힘을 덮는데 급급했던 기관의 대처로 다시는 정부체제의 기관에 보내지 않겠다 다짐했던 워킹맘 시절.. 이제 내 아이는 내가 지키겠다는 마음으로 아이만 보고 있는 엄마.. 아이만을 너무 바라보고 있으면 아이가 부담이 되지는 않을지.. 또 한편으로는 내가 안내?해주는대로 잘 따라와 주는 아이.. 또 한 번 돌아보며 아이가 원하는 그리고 엄마가 이끌어주는 것의 균형을 잘 잡아야겠다 생각합니다.. 아이의 시선으로 고민할 것을 또 다짐하고, 여자들의 상점 보마켓도 들어가 봅니다? 보 마켓(BO MARKET) 업체 사진 보마켓에는 예쁘게 포장되어 있는 인테리어 소품부터 야채도 소포장으로 예쁘게, 생필품들, 그릇도 있고요. 덴마크 왕실티도 다양하고 또 예쁘게 진열되어 있었어요^^ 간단히 식사와 음료도 먹을 수 있는 공간도 있고요. 50m © NAVER Corp. 아크로 서울포레스트디타워 서울특별시 성동구 왕십리로 83-21 아크로 서울포레스트 이제 에스컬레이터를 타고 1층으로 나가서 건물을 한 바퀴 둘러봤네요. 친구는 지하철 입구까지 걸어와 손을 흔들어 주네요. 저 역시 또 돌아 손 흔들었지요:) 또 보자!"
성수동에서 뭐먹었지 (감도/레이어10/보이어/케이키/오스테리아로에로),"성수동 감도 예전부터 계속 가고 싶었던 카페다. 디저트계의 하이엔드 감성이랄까.. ㅋㅋㅋㅋ 50m © NAVER Corp. 감도 성수점 서울특별시 성동구 왕십리로 83-21 디타워 서울포레스트 지하1층 B115 감도 스엠 사옥인 서울숲 디타워 지하 1층에 있다. 지나가면서 보기만했는데, 너무 더운 여름날, 아이스크림을 팔길래 결국은 들어감…ㅋㅋㅋ 일단, 맛이 진짜.. 대만족이다. ㅋㅋㅋㅋㅋㅋㅋ 뭐라 형언하기 어려운 고오오오오급진 맛이 난다. ㅋㅋㅋ 아이스크림에 올리브오일 뿌리는거 무슨 요리 경연프로에서나 본 거 같은데 정말 맛있구나 생각이 들엇고 집에서 흉내내보기엔,, 집엔 올리브 오일 좋은 건 잇어도 이런 싱싱한? 아스크림이 업쥐.. 란 생각이 들어서 담에도 성수동에 온다면 또 감도와야지 싶었음 다만 실내 분위기가 대단히 좋진 않다. 그냥 하얀 배경에 의자랑 책상 줘서 먹고 갑니다 정도. 성수동 레이어10 성수동… 사람없는 카페를 찾아서… 50m © NAVER Corp. 레이어10 카페 서울특별시 성동구 상원4길 10 레이어 10 마침 근처가 도로공사중이라 사람이 정말 없었다.. (아무나 막 찍은거 아니구 내 칭구 뒷모습이애오) 길가다가 보기엔 카페?란 느낌이 들 정도로 벽돌건물에 그냥 ‘CAFE’ 라고만 성수동감성 던지는중 내부도 아 이게 실내인가 창고에 버려진 나 같은 느낌 MZ들은 이런데서 노는구나.. (이해하려고 애쓰는중) 감성 살려본 척 사진을 찍어본다. 커피 양 많고 마싯다 크 이맛이지 우리는 커피만 맛잇으면 장땡이여 성수동 보이어 50m © NAVER Corp. 보이어 서울특별시 성동구 연무장길 14-2 1층 캐치테이블에서 보고 인상적이었어서 일단 예약도 좀 어려운 편이엇던걸로 기억. 가바야지! 하고서 벼르고 벼르다가 평일 낮에 시간이 되서 예약하고 가봄. 예약이 어려웠던 이유는 좌석수가 적어서다. 런치세트메뉴 17000원이라니 저렴해보이지만 여자둘이서 점심 가볍게 먹고 7만원 넘게 나왔다 물론 추가메뉴는 시킨 적도 없고 셋트 각각 하나씩 시켰을 뿐인데 스테이크는 저날 200그람짜리가 아니면 주문이 안됏고 등의 변수로 두명이서 34000원이어야 햇는 런치가 7만원 가볍게 넘겨버림 맛은 좋았지만 재방문은 없을 것 같다. 너~~~무 시끄럽다 내부가… 공간이 소리 울림이 너무 심해서 양옆 테이블이 떠들기 시작하면 우리의 얘기가 잘 집중되지 않는다. 소음 속에서 밥을 먹고 나면 음식이 맛있었어도 ‘정신없었다’라는 느낌이 마지막에 남기 때문에 재방문은 어려웁겟다. 성수동 케이키 인스타에 조금만 노출되면 카페들 앞에 줄이 늘어서고 너무 인적으로 붐벼서 여기가보자! 햇던 곳들 다 뒤로하고 그저 사람 없는데로 찾아 들어감 어짜피 커피맛만 좋으면 돼 ㅠㅠ 케이키란 카페인데 우리가 방문했을때엔 손님이 1도 없었지만 창가에 친구와 둘이 나란히 앉아서 사람구경하며 커피 마시고 잇엇더니 줄줄줄줄 사람들이 들어왓다 ㅋㅋㅋ 커피랑 옥수수케익 합이 진츠 조앗다 가게 내부도 아기자기 하니 귀여운데 창가자리가 사람구경하는 재미가 잇다 :-) 50m © NAVER Corp. 케이키 서울특별시 성동구 연무장길 39 1층 성수동 오스테리아 로에로 여기는 완벽한 와인집이구나 음식들이 와인을 부르는 메뉴들이고 당시 약을 먹느라 금주중이엇어서 술없이 식사만 햇는데 음식이 안주 정도의 양으로만 제공되기 때문에 제대로 된 식사를 원한다면 다른 곳을 가는걸 추천한다. 하지만 밥과 술을 먹은 것 같은 금액이 나왔다 :) 그럼에도 송아지 메뉴?는 매우 추천한다 ㅋㅋㅋ 50m © NAVER Corp. 오스테리아 로에로 서울특별시 성동구 뚝섬로9길 13-1 2층"
감도 높은 식사와 행복 - 성수동 쵸리상경,"아빠 생신을 맞이하여 ktx를타고 대전에 내려왔다. 아이들 모두 재우고 대전 본가에서 쓰는 글 1. 까마득한 후배의 인별그램에 올라온 사진 한장에 담긴 고요함과 정숙함이라니. 한장의 사진이 이렇게나 쑥 내 마음에 들어올 수 있음도 정말 신기한 경험. 당연히? 어디서 다운 받은 사진인가 싶어 물어봤는데 노필터로 찍은 풍경사진이란다. 아니, 이렇게 실력이 뛰어났던가. 그래서 찬찬히 다시 그녀의 인스타 피드를 살펴보았는데 풍경사진들하나같이 정말 예술이다. 폰 카메라로 찍었고 심지어 어떤 보정도 거치지 않았다는 사실이 놀라웠다. 핸드폰으로 사진 찍는 법을 배웠던가. 아무렴 그럴것 같지는 않았는데 사진에 묻어나는 그녀의 스타일이랄까. 무엇보다 내면이 참 예쁘고 아름다운 윤경이라 사진 가득 윤경이가 묻어나는 것 같았다. 그 예쁜 마음을 알아봐주는 그런 좋은 사람 만나서 더욱 행복하기를 진심으로 바라는 마음 💕 앞으로도 그런 감도높은 사진들로 내 마음을 적셔주라 증말. 2. 또 한번의 성수동 나들이. 금요일은 참 OFF들을 많이 내는건지 11시에 서울숲 역에서 내리는데 사람들이 우르르 개찰구로 쏟아지더라는 ^^ 우리의 선택은 솥밥으로 유명한 쵸리상경이었다. 대기가 많다는 이야기에 급하게 찾다보니 다와서 골목을 좀 헤멨다. 그러느라 잠시 지체 되었더니 세상에나 테이블링 대기 11번 ㅋㅋㅋㅋ 성수동은 정말 볼 거리가 너무 많다. 그래서 서울숲을 걷고 거리를 구경하며 시간을 보내니 어느덧 우리 타임이 왔다. 많은 사람들이 맛집에 대한 후기를 올린다. 이 집의 분위기나 특징은 다른 사람의 글을 참고 하시기를 결론적으로, 나름 꽤 괜찮았다. 그러나 솔직히 이 가격인가 싶다. 스테이크와 연어 둘다 맛있었는데 조금만 더 양이 많았다면 좋았지 않을까 싶은 물론 쵸리상경 자체가 여심저격 스타일이라 아마도 우리 신랑이랑 같이 갔다면 ㅋㅋ 양이 좀 부족하다 투덜거렸을것 같다. 3. 참 시간이 빠르다. 벌써 10월이라니. 이제 올해도 3개월 남았다. 작년 10월은 만삭이었고 둘찌를 만났었는데 올해 10월은 둘찌가 곧 돌이고 나는 우리 가족의 해외여행을 계획하고 있다. 하루하루 촘촘히 인도하심따라 살다보면 좀 더 감도 높은 충만한 삶을 누리고 있지 않을까 싶다. 비가오면 비를 맞고 바람이 불면 바람을 맞는 삶 그렇게 살아보려고요 예술가가 되어서요 -드라마 작은 아씨들 대사 중-"
서울숲카페 주차편한 디저트다이닝 성수동핫플 감도,다양한 #서울숲카페 핫플 중에서 주차도 편하고 분위기가 좋은 #성수동카페 #카페감도 여유로운 시간 보냈어요. 50m © NAVER Corp. 감도 성수점 서울특별시 성동구 왕십리로 83-21 디타워 서울포레스트 지하1층 B115 감도 감도 성수점 서울 성동구 왕십리로 83-21 디타워 서울포레스트 지하1층 B115 #감도 https://m.place.naver.com/place/1424054328 디포레스트타워 지하1층에 위치하고 있어서 서울숲역4번출구와 연결되어 있는 #서울숲카페 #감도 조용하고 깔끔한 서울숲디타워에 위치한 #서울숲카페 #카페감도 #감도성수점 #감도성수점 담백한 고급스러움을 공간부터 디저트까지 담아낸 #성수파인다이닝 #성수디저트카페 파인 아이스크림 다이닝 카페 공간이에요. 깔끔깔끔한 분위기 새하얀 따뜻함이 느껴지는 #감도성수점 기분 좋은 만남을 갖기 좋은 #서울숲카페 #감도 아닐 수 없어요. 메뉴는 각 자리에서 큐알코드로 #카페감도 음료와 디저트 확인하고 주문은 카운터에 하면 된답니다. 조약바질들판 아이스크림 유자 밀푀유 아이스크림 구운 감자 크렘브렐 수플레 등 다양한 #서울숲디저트 #서울숲핫플 메뉴가 있었지만 담백하고 깔끔하게 역시나 따뜻한 아메리카노 선택한 #문쑴기록지 향긋한 커피향과 함께 따스한 시간 #카페감도 보내며 웃음꽃 만발했지요.
"[성수동/뚝섬] 광야 속 감성 디저트 데이트추천 감동적인, 감도",오늘은 최근에 간곳중 눈도 입도 모두 모두 너무 즐거워서 감동 제대로 하고 왔던 파인 아이스크림 다이닝 '성수 감도'에 대해 이야기 하려고 합니다. 감도 X UNAS 입장- ! 계산대에 OR체크인을 하고 자리 잡도록 해요~ 메뉴판은 좌석에도 있으니 좌석에 앉아 고민합시다. 서울 성동구 왕십리로 83-21 디타워 서울포레스트 지하1층 B115 감도 D타원 지하 음식점들 즐비 해 있는 곳 매일 10:30 - 21:00 뻥뷰 - - 지하지만 지하가 아닌 그런 느낌! 빛도 잘 들어옴 광야의 노래~ 어 - ! 넥스트 레벌 ! 하 ! 이게 아닌데.. 요즘 성수동에 SM 사옥이 이사를 왔습니다. 그곳은 아크로포레 D타워 안그래도 핫해진 성수동이 더 핫해 져 버렸다 - ! 근데 메뉴판이 어딨냐구?!! 여기있다!!! QR 코드를 이용해서 메뉴판을 볼 수 있다. 요즘 스마트폰 사용 세대를 위한 괜찮은 방법인거 같다. 나이대가 생각보다 젊은 층을 겨냥 했다고 생각이 든다. 그래도 요즘 QR로 방역패스 체크인을 많이 해 보셔서 하 실 수도있을거 같은데 작은 글씨가 보기 불편하면 카운터에서 하는게 나을 수 있겠다. 메뉴를 골라봅시다. 메뉴판은 사진 + 가격 + 설명 + 원산지 등 표시가 구체적으로 되어있다. 사진을 보면서 고를 수 있는 것도 좋은거 같고 어떤 재료가 들어가서 만들어진 디저트인지 알 수 있어서 좋았다. 보다가 내가 못먹거나 싫어하는 재료가 들어간게 있으면 거르기 좋을듯! 내부는 깔끔하다. 1월인데 아직 트리 장식이 놓여있었다. 저기 반납구가 뭔가 인상적이다... 셀프존에는 물과 컵이 놓여있으니 목이 마르면 저곳을 이용하자. ICE / HOT 두 가지 물이 놓여있는게 좋았다. 자리로 돌아와서 조명 가지고 놀기... 테이블마다 놓여있길래 어떻게 키고 끄는건지 경험 해 본다... 누를때마다 빛이 바뀜... 오! 귀여운 버섯 조명 그래서 우리는 무슨 메뉴를 골랐느냐 하면 조약돌 바질 들판 자잔 - ! 디저트 도착 ! UNAS 우나스 와 콜라보 해서 만들어진 디저트 조약돌 모양을 하고 있는 머랭이 올라간 조약돌 바질 들판 정말 이름처럼 생겼다. 감도 아이스크림 + 바질 + 머랭 개인적으로 우나스의 색감 표현과 디저트를 진짜처럼 만들어 내는 그 스킬을 굉장히 좋아하는 편이라 음식 보고 감탄 연발 하며 기뻤습니다. 받은 명함으로 함께 사진 찍어봄 유자 밀푀유 엄청 얇게 쌓여 만들어진 페스츄리 겹겹히 쌓인 사이에 카라멜 소스가 들어있는데 저 카라멜 소스가 정말 너무 맛있었다! 촤르륵 - 나이프로 갈라버리기! 몽글몽글한 저 크럼블이 다 아이스크림이다! 성수 감도 밀푀유 먹기 재생 0 좋아요 0 00:00 00:10  접기/펴기 성수 감도 밀푀유 먹기 성수 감도 조약돌 바질 들판 먹방 재생 4 좋아요 0 00:00 00:16  접기/펴기 성수 감도 조약돌 바질 들판 먹방 디저트별로 명함처럼 설명 카드를 준다. 요즘 뭐랄까 사장님이라 직원 분들이 설명해주기 보단 이런 카드로 설명을 대신하는 그런 업장이 점점 늘어 나는듯 아무래도 인거비 상승에 따른 회전율을 빠르게 하기 위함이 아닐까? 개인적 생각을 해본다. 설명처럼 정말... 그 맛을 다 느껴버림.. 내 입을 정확 했다! 있었는데요... 없어졌습니다. 깔끔히 정복 하였다. 아이스크림이다 보니 금방 녹아서 헬레벌떡 먹지 않으면 제대로 디저트 맛 못느낄수 있어서 바르게 컷 했다 - ! 약간 이게 아쉬움... 일단 넘 맛있어서 음식에 대한 감탄을 연발 하다보면 다 먹고없다. 맛있다. 깔금하다. 정교하다. 디저트 러버라면 꼭! 먹어 보길 추천 종업원의 안내와 구체적인 서비스를 원한다면 비추 주문과 반납등이 셀프 서비스
