title,content
2023 10월 일상로그 eight #시월의 아름다운 날 #클레멘타인 #성수동카페 #서울숲데이트 #도둑맞은집중력 #요한하리,"50m © NAVER Corp. 클레멘타인 서울특별시 성동구 서울숲2길 5-1 1층 #일상로그 #일상기록 #라이프로그 #생각정리 #일상 #클레멘타인 #성수카페 #서울숲카페 1. 갑자기 겨울이 왔다. 오늘 정말 추워서 계절이 온몸으로 느껴졌다. 친구랑 오랜만에 서울숲을 즐겼다. 아파서 링겔을 맞고 왔다는 말에 남편만큼이나 걱정해주는 친구 ㅋㅋ 한동안 서로 바쁜 시즌을 넘기고 다시 잠깐이라도 얼굴보며 수다를 나누니 참 좋았다. 암튼 클레멘타인은 성수동 골목 끝자락에 있어서 조용하고 아늑한 분위기가 있다. 꽃도 같이 판매하고 있는 플라워 카페인데 들어갈 때 전체적인 비쥬얼이 너무 예쁘다. 주택을 개조해서 벽돌느낌의 외관도 좋고, 2층에는 쇼룸도 있었다. 커피는 산미가 없는 우유맛이 아주 많이 나는 내 스탈이었고, 디저트는 무난을 떠나 ..... 맛이 없었다. 파운드 케이크인데 푸석푸석함이 너무 심해서 둘이서 먹었음에도 절반이상 남김 ㅠㅠㅠ 담엔 커피만 마시자!!! 계단아래 감섬있는 자리가 예뻐서 좋았고, 플라워가 있어서 감성감성한 것도 굿! 1층은 조금 어두웠고, 2층은 환하고 넓고 분위기 좋았는데 테이블이랑 의자가 조금 불편. 어디나 100프로 만족할 수는 없겠지만 따뜻한 커피, 서울숲 근처, 예쁜 분위기 등 맘에 드는 곳! 2. 서울숲 걷는 여유🌳🌳🌳🌳🌳🌳 서울숲이 근처에 있어서 참 좋다. 벌써 낙엽이 한가득인걸 보니 가을 한가운데 서 있음이 느껴졌다. 둘이 길을 걷고 이야기를 나누다가 갑자기 우리 네일케어받을래? 해서 급 근처 네일샵을 찾아 관리를 했다. ㅋㅋ 기초 케어가 시급한 우리 둘의 손을 보고 급 결정. 조금 흐린 하늘이라 걷기에 좋았고, 갑자기 우리의 첫만남 추억놀이도 하고, 한참 세월이 지나고 나서 돌아보는 우리의 20대가 예쁘다 생각했고, 잡히지 않는 것 같은 그 무언가를 위해서 열심히 살던 과거도 생각했다. 어느 정도 안정을 찾고, 자기꺼 열심히 챙겨가며 즐겁게 살고 있는 오늘도 우리 스스로 다독였다. 10년이상을 우린 서로에 대해 이해하고 다독이고 격려하며 친구관계를 이어오고 있다. 물론 언젠가는 서로에게 섭섭하고 실망했던 적도 있었고, 앞으로도 그런 일들이 생기겠지만 잘 지내고 싶다는 오글거리는 서로를 기대하기로. 3. 빵사서 컴백🥐🥐🥐🥐🥐🥐 소금빵 사서 집으로. 탄수화물을 줄이기가 힘들다 ㅠㅠ 로와이드 압구정이 생기고 나서는 여긴 잘 안오게 된다. 압구정이 매장도 넓고, 직원분들도 친절함. 여긴 별로. 사람들이 많은 시간도 아니었는데 직원분들이 엄청 별로였다. 도둑맞은 집중력 저자 요한 하리 출판 어크로스 발매 2023.04.28. #도둑맞은집중력 #요한하리 #독서기록 #독서로그 4. 집중력 위기를 현대 사회 시스템이 만들어낸 유행병이라 개인을 탓하는 걸 넘어 사회적 해결 방안이 필요하다고 주장하는 책이다. 오랜만에 아주 재미있게 읽고 있다. 나름 한가지를 하면 집중을 잘한다고 생각했는데 요즘은 전혀 그렇지가 않다. 세가지 유형 중 가장 인상적인 건 데이라이트, 햇빛이다. 데이라이트 상실은 가장 심각한 형태의 산만함이며 자신을 분열시킬 수도 있다는 것! 이 상태가 되면 자신을 이해할 수 없어서 아주 하찮은 목표에 집착하거나, 리트윗 같은 바깥 세상의 아주 단순한 신호에만 의존하게 된다는 것인데... 이 책에서는 우리의 집중력을 망가뜨리는 소셜 미디어의 알고리즘이 어떻게 우리의 공동체마저 무너뜨리는지에 대해서 이야기하는데 맞는 소리만~~~~ ”커다란 문제를 해결하려면 많은 사람이 장기간에 걸쳐 집중력을 발휘해야 한다. 민주주의는 진짜 문제를 파악해 공상과 구분하고, 해결책을 떠올리고, 문제를 해결하지 못하는 지도자에게 책임을 물을 수 있을 만큼 긴 시간 문제에 집중할 수 있는 시민의 능력을 요구한다. 그러한 능력을 잃어버린다면 온전히 기능하는 사회를 만들 능력을 잃게 된다.“ ”우리가 책의 내용을 이해하려면 방황활 정신적 공간이 반드시 필요하다. 독서만 그런 것이 아니다. 삶도 그렇다. 딴생각은 상황을 이해하는데 반드시 필요하다.“ ”토막 난 파편을 통해 세상을 바라볼 때는 무언가에 오랜 시간 집중할 때만큼 공감이 나타나지 않는다. .... 우리는 자신이 사용하는 기술에 주의를 기울여야 한다. 시간이 갈수록 우리의 의식이 그 기술의 모습으로 변하게 될 것이기 때문이다.“ 5. 대학교 과외를 하던 시절. 인턴 등의 특별한 사유가 없는 이상 꾸준히 과외를 했고, 좋은 학생들을 만나 학생들의 결과물도, 나의 경제적 결과물도 좋았다. 그 시절 고딩이었던 귀요미가 벌써 사회인이 되었다. 내 나이 먹은 건 생각도안하고, 그녀가 사회인이 되었다는 사실이 놀랍다. 작년 미국가기 전 한 번 만났었는데 일년만에 그녀의 연락으로 다시 만났다. 건강을 챙기는 어른이 되어 만나니 기분이 이상하면서도 기특함😄😄 6. 사랑하는 뉴욕👍👍👍"
성수동 서울숲 신상카페 클레멘타인 플라워카페,"심심해서 들어왔다가 백년만에 아니 오백년만에 써보는 블로그..🫥 계속 내리 비가 오다가 갑자기 해가 떠서 급하게 촬영하려 성수동카페 검색했다가 발견한 #클레멘타인 신상카페는 아직 알려지지 않아 사람이 많이 없을거라 생각하고 가지만 너무 큰 착각! 사람 없는곳만 찍어서 안느껴지지만 이미 만석🥹 주택을 개조하는게 유행인듯- 1층은 카페 2층은 체리코코 늘- 그렇듯 시원한 아아☕️🧊 자리로 가져다주시는 언니 센스🫶🏻🫶🏻🫶🏻 하트3개 귀엽다 귀여워 귀여운건 늘 좋지 좋아! 거의 옆 테이블과 일행이라고 해도 될 정도로 테이블 간격이 좁다 듣고싶지않은데 자꾸 내 귀에 말하는 것 같은 기분 ㅋㅋㅋ ㅋㅋㅋㅋ😏 또 귀여운거ㅋㅋ주황 스티커는 케익 박스 테이프인데 주문하면서 3장 갖고와서 핸꾸🧡 핸꾸라는 말이 맞는진 모르지만 그냥 한번 써봅니다..ㅋㅋ 한 입씩 다 맛보고 싶은 케익- 딥초콜렛 케익은 꼭 집에 사가야징 사실 케익보다 박스가 넘 예뻐서 ㅠㅠㅠㅠㅠ 플라워카페라 이렇게나 꽃이 많아요- 여기도 꽃🌼 저기도 꽃🌺🌸🌷 아 예뻐!! 옛날엔 꽃, 식물 관심 제로였는데 이젠 길가에 꽃만봐도 카메라부터 꺼내는 나…… 싫기도하고 좋기도하고! 완전 포토존! 여기 조금 더 유명해지면 사진찍으려고 줄서야될듯싶다…!! 확실히 꽃이 있어서 사진이 엄청 잘 나올 것 같긴한데 얼굴이 예쁘면 똥밭에서 찍어도 예쁘므로……… 성수동 뒷골목에 있지만 사진만보면 뭔가 유럽 골목같다 (내 상상 속의 유럽ㅋㅋ안가봄) 이런 곳이 유럽아닌가요?ㅋㅋ 원피스 입고가길 잘 한듯 뒷모습만 몇장 건졌다 🫶🏻 안에 앉아있다가 바깥으로 옮겼는데 두피탈뻔했..다… 너무더워ㅠㅠㅠㅠ 다 갖고싶다 모조리!!!!! 파리 감성…….🗼 7천5백원주고 구매한 예쁜 박스🤍 케익 그 안에 잘 있니?? 클레멘타인..앞으로 지금보다 더 핫해질테니 평일 낮에 간 내자신 칭찬해..! 성수동 카페 이곳 저곳 많이 가봤지만 근래에 최고로 예쁜 공간- 조만간 또 와야지🤍 50m © NAVER Corp. 클레멘타인 서울특별시 성동구 서울숲2길 5-1 1층 #클레멘타인 #성수동카페#신상카페#핫플레이스 #성수동카페추천#플라워카페#커피맛집 #성수동맛집#서울숲카페#카페클레멘타인 #테라스카페#성수신상카페#디저트카페 #성수동데이트 #뚝섬카페"
"[카페 클레멘타인] 서울숲카페, 서울숲플라워카페 / 성수동감성카페","클레멘타인 하얀 벽돌로 감성있게 꾸며진 클레멘타인 플라워카페로 운영 중이어서 꽃도 보고 커피도 마실 수 있어요:) 50m © NAVER Corp. 클레멘타인 서울특별시 성동구 서울숲2길 5-1 1층 운영시간 매일 11시-21시 야외부터 식물이 가득해서 여기서 사진찍는 분들이 많이 계시더라구요!! 1,2층으로 되어 있고 1층은 분위기가 조금 더 어둡고 2층은 밝고 트여있는 분위기에요! 케이크와 타르트. 스콘 등 달달한 디저트가 많아서 고민을 했는데 저는 저녁을 왕창 먹어야해서 스콘으로 결정! 1층은 창가자리 있어서 따뜻한 햇살 받으면서 수다떨기 좋고! 안쪽은 조명이 어두워서 혼자 작업하기 좋더라구요! 그리고 2층은 층고가 높아서 트여있는 느낌이고 밝아서 느낌이 또 다르더라구요! 이 자리 좋아보이는데 이미 다른 고객님이 찜 ㅎㅎ 야외에서 사진찍는 분들도 많더라구요! 그리고 확실히 외국여행객이 이제는 명동이나 경복궁보다 우리가 많이 가는 성수동에 온다고 하던데 정말 카페내에 한국인보다 외국인이 많았답니다 ㅎㅎ 그리고 함께 운영중인 플라워샵 제가 있는 동안 플로리스트 분을 본적이 없는데 어떻게 운영되는지는 모르겠지만 구매할 수 있더라구요!! 제가 딱 좋아하는 포장지와 꽃의 색감 ㅎㅎ 저와 잘 맞더라구요~ 하지만 이날 손에 짐이 너무 많아서 구매하지 못해서 아쉬웠어요ㅠㅠ 저는 플레인스콘과 아이스아메리카노 조합으로 먹었는데, 평소 스콘을 먹을 때 너무 부셔져서 잘 먹지 않았는데, 여기는 부스러기가 많이 안 나오더라구요! 그래서 잘라먹기 편했고, 원두는 산미가 있더라구요! 산미있는 커피를 좋아하지 않는데, 산미가 강하지 않아서 마시기 괜찮았어요! 저녁이 될 수록 분위기가 더 좋았던 클레멘타인! 밝고 화이트 느낌의 분위기를 좋아한다면 낮에 방문하는 것을 추천! 아늑하고 어두운 분위기 원한다면 저녁에 추천!! #클레멘타인 #카페클레멘타인 #서울숲클레멘타인 #서울숲카페 #서울숲맛집 #성수동카페 #성수동맛집 #뚝섬카페 #뚝섬맛집 #서울숲데이트 #성수데이트"
[성수동] | 잠수교집 | 클레멘타인 | 플라워카페 | 우디집 | 폴라앳홈 | 성수동 데이트 | 카페추천 |,"성수동 데이투 오빠 따라 서울로 ㄱㄱ 오빠를 한시간 반이나 기다렸다.. 차에서 쿨쿨 자면서 😭 날씨가ㅋㅋㅋ최악 비바람 젤 시러 3시가 넘어서까지 한끼도 못먹은 상태 생각난 잠수교집으루 성수동 잠수교집 웨이팅 있을까바 (오늘만큼은 기다릴수없다) 전화문의 드렸더니 한가하다고 하셔서 갔드 작년 여름에 오고 2번째 오는 잠수교집 (매장 앞 주차공간이 있어서 편한점도 있다) 주차 4대정도 가능! 메뉴판 급랭 삼겹살 시골청국장 공기밥 볶음밥 주문! 작년에 왔을때 진짜 맛있게 먹었다 밑반찬도 넘 맛있었고 볶음밥도 짱 밑반찬 진짜 잘 나오는 밑반찬들ㅎㅎ 다 맛있다! 고기 기다리는중 후추 톡톡 냉삼 굽굽 맛나 맛나 청국장이 왜 다들 시키는지 알겠다 보글보글 내용물도 한 가득! 볶음밥은 필수! 반찬들과 양념을 호일안에 감싸서 준비해주신다 몇분뒤 호일을 열고 볶볶 볶음밥 완성이요 볶음밥을 먹으면 김을 같이 주신다 싸먹으면 쟌맛 사진 남겨주구 작년 여름에 왔을때다 이번에도 잘 무그따 50m © NAVER Corp. 잠수교집 성수 직영점 서울특별시 성동구 아차산로 137 1층 잠수교집 50m © NAVER Corp. 클레멘타인 서울특별시 성동구 서울숲2길 5-1 1층 클레멘타인 : 네이버 방문자리뷰 144 · 블로그리뷰 347 naver.me 클레멘타인 성수동 클레멘타인 카페 플라워카페로 커피도 마시고 꽃도 구매할수 있다 작년 여름에 왔을때다 외관자체가 그냥 이쁘다 플라워카페 답게 꽃들도 한가득 너무 이뻤다 사진도 찍어주구 계단 밑 자리 주문했던 아아2잔과 레몬케익(?)🍋 맛있었다 아아 1잔 연하게 주문했더니 저렇게 하트 스티커로 귀여웠다ㅎㅎ 카페 안 사진 꽃 너무 이쁨 2층에는 쇼룸겸 카페공간이 있어요 쇼룸까지 구경하고 공간들이 다 이뻐서 사진이 잘나옵니다—̳͟͞͞♥ 날 좋을땐 테라스 자리ᜊ⃰ ⃰ 50m © NAVER Corp. 우디집 서울특별시 성동구 둘레9길 17 2층 우디집 카페 우디집 : 네이버 방문자리뷰 803 · 블로그리뷰 1,012 naver.me 나 성수동 우디집도 갔었지 우디집 느낌있는 입구ㅎㅎ 여기서 많이들 사진 찍으시던데.. 더워서 패쓰했던ㅋㅋㅋ 주차는 건물에 1~2대 가능 했었습니다 (주말엔 불가능할듯) 내부사진 아메리카노(5,000) 우디집라떼(6,000) 평일에 갔을때라 사람없고 좋았다ㅎㅎ 역시 평일 짱 역시 야외자리가 젛지 평소에 너무 좋아하는 폴라앳홈 넘 넘 사고픈게 많다 50m © NAVER Corp. 폴라앳홈 서울특별시 성동구 성수일로10길 11 1층 온 김에 쇼룸까지 구경하기 그냥 다 이뻐벌임 사고싶은거 꾹 참고 나왔다는 (그렇다고 안산건 아님) 성수동 데이트했던 날 끝"
[서울 성수동] 클레멘타인,"50m © NAVER Corp. 클레멘타인 서울특별시 성동구 서울숲2길 5-1 1층 성수동1가 685-490 매일 11시 - 21시 전화 0507-1367-3511 클레멘타인(@clementine.crko) • Instagram 사진 및 동영상 팔로워 2,184명, 팔로잉 3명, 게시물 60개 - 클레멘타인(@clementine.crko)님의 Instagram 사진 및 동영상 보기 instagram.com 성수동 플라워카페 #클레멘타인 메뉴 케이크 배가 너무 불러 케이크 먹을 생각이 없긴 했지만, 오후에 가서 그런지 남아 있는 케이크도 몇 없었다 주문하는 카운터와 함께 꽃을 파는 공간이 있다 꽃을 사진 않더라도 충분한 포토존이 되었던 곳 2층은 옷을 판매하는 공간이 있는데, 구경은 따로 하지 않아 어떤 브랜드인지는 모른다 허허 조용하면서도 밝고 화사했던 2층 이날 하늘이 조금 흐렸는데도 불구하고, 여러 창문들과 가운데 천장 창 덕에 사진이 잘 나왔다 #씨브리즈티 (6.0) 에디션덴마크 티를 판매하고 있는 클레멘타인 4종류가 있었는데 제일 상쾌한 씨브리즈로 골랐다 공간이 너무 좋았던 클레멘타인 날씨 좋을 때 야외 즐기러 한 번 더 가보고 싶었다 그때는 케이크도 한 조각 먹어야지-"
서울｜성수동 감성 카페 서울숲 「클레멘타인」,"서울숲 플라워 쇼룸 카페 클레멘타인 곧 다가오는 나의 생일을 미리 축하해 주기 위해 주말에 만난 스윗한 ANNA양과 오랜만에 성수동 데이트를 즐기고 왔다. 밥 먹고 나서 우리가 다녀온 곳은 내가 가보고 싶었던 쇼룸 겸 플라워카페 <클레멘타인> 외관 서울숲 중심 거리 끝자락에 위치한 클레멘타인은 2층 건물의 단독 주택을 개조해 만든 카페다. 카페로 들어가는 입구 곳곳에 놓인 트리로 크리스마스 분위기 제대로! 마당에도 테이블과 의자가 놓여있어 이용이 가능한데 우리는 추워서 안으로 들어가서 자리 잡았다. 플라워샵 카페 안으로 들어가면 플라워샵이 바로 보이고, 중앙에 판매하는 크리스마스 소품들이 진열되어 있다. 카페 밖과 안, 곳곳에 놓안 트리와 감각적인 소품들로 크리스마스와 너무 잘 어울리는 공간이다. 메뉴판 음료는 커피, 라떼, 뱅쇼, 에이드, 티 종류가 적혀있는 메뉴판이 있는데 플라워샵이 있어서 그런지 센스있게 꽃이 같이 놓여있다. 쇼케이스 안에는 얼그레이/레몬파운드/딥초콜릿/복숭아케이크, 에그타르트 등의 베이커리가 담겨있어 커피와 같이 먹을 디저트 메뉴도 주문 가능하다. 예쁜 공간에 예쁜 디저트 케이크 보니 절로 좋아지는 기분 1층은 자리가 만석이라 주문하고 2층으로 올라갔는데 오래된 주택 건물이라 노후되고 부식된 계단이라서 주문한 음료 들고 오르락 내리락할 때 조금 불편했다. 2층에 리턴대 있으면 좋을 듯한데 아쉽, 이동할 때 컵 깨뜨릴 수도 있을 거 같은데 말이다. Next image 코코체리 쇼룸과 같이 운영하는 2층은 들어가면 바로 정돈된 옷들이 보이는데, 피팅룸도 있어 입어볼 수도 있고 구매도 가능하다. (가격도 저렴해서 바지 하나 입어보고 바로 결제까지 했다는) 2층 출입문으로 들어와 좌측 공간은 테이블 6개 정도 테이블 세트가 있어 카페 이용 가능한데 벽면에는 옷, 가방, 신발 아이템들도 같이 진열되어 있다. 중앙은 여러 명이 앉을 수 있는 다이닝 테이블이 있는데 감각적인 조명과 대형 화분에 리스까지 장식되어 크리스마스 분위기 제대로 느낄 수 있었다. 친구는 플랫화이트 나는 바닐라빈라떼, 그리고 디저트로 주문한 에그타르트 플랫화이트 아트가 예쁜 플랫화이트, 직접 마셔보지 않아 모르지만 친구는 진해서 맛있다고 했다. 바닐라빈 라떼 바닐라빈 라떼 역시 진하고 고소한데 적당한 단맛이라 너무 맛있었다. 에그타르트 겉은 바삭하고 속은 촉촉 그 자체인 에그타르트 커팅 할 때 부스러기가 많이 떨어질 줄 알고 걱정했는데 속에 계란이 촉촉해서 잘 썰리고, 무엇보다 다른 곳에 비해 크기가 커서 좋았다. 맛도 굿!! 주택 개조한 카페로 넘치는 개성은 물론 감성 가득한 서울숲 카페 <클레멘타인> 입구부터 내부 공간까지 크리스마스 장식이 있어 크리스마스 분위기와도 너무 잘 어울린다. (예쁜 공간만큼 사람도 많음) 클레멘타인은 1층은 플라워샵이 있어 연인에게 꽃을 선물하기도 좋고 2층은 쇼룸이 있어 쇼핑까지 가능한 복합공간의 카페다. 성수동 서울숲 근처 커피, 디저트 맛집 카페 찾는다면 추천! #뚝섬역카페 #성수동감성카페 #서울숲카페 #클레멘타인성수 #클레멘타인 ▶ 주소 : 서울 성동구 서울숲2길 5-1 1층 ▶ 대중교통 : 2호선 뚝섬역 8번 출구 627m ▶ 운영시간 : - 화~금 11:00 ~ 19:00 - 토~일 11:00 ~ 21:00 - 매주 월요일 휴무 클레멘타인(@clementine.crko) • Instagram 사진 및 동영상 팔로워 1,416명, 팔로잉 2명, 게시물 54개 - 클레멘타인(@clementine.crko)님의 Instagram 사진 및 동영상 보기 instagram.com"
