title,content
성수동 카페거리 주차 가능한 카페 업사이드커피 (디저트 맛집 ),"맛있게 장어덮밥도 소바도 먹고 입가심 해줘야지 ~ 그냥 또 무작정 걸었다. 서울 성수 카페 거리니 어디든 안나올까 해서 걷다보니 ~뭔가 느낌적인 ㅋㅋ 느낌이 퐉 오는 카페를 발견했다 성수동 디저트카페 업사이드 커피 발견 !! 성수동 카페거리 주차 가 되는 곳이 많지 않은데 !! 카페앞에 주차가 가능했다 뭐 자리가 넉넉치 않으니까 ㅋㅋ 당연히 자리가 있을꺼라는건 !!! 아니라는건~ 성수 카페 맛집 일꺼라는 확신을 들고 들어가야지 ~ 왜? 입구에 들어서자 마자 찐한 커피향이 진동하기 시작했다 오잉~? 밖에서는 몰랐는데 카페 안에 들어가니 !!! 매장이 넓다 !! 매장안에 여러대의 로스팅 기계가 있다 오호 !! 로스팅 기계가 몇대야 ~? 커피 맛나겠는데 ㅋㅋ 오호 여기가 성수동 카페거리 맛집 이구만 성수동 디저트카페 잘 골라왔다 잔득 쌓인 커피콩을 보아하니 ~!!! 커피 좋아하는 나에게 이곳이 천국이겠네 여기로 커피콩 사러 오세요~ 성수동 카페 주차도 되는 곳이랍니당~ 저 많은 커피콩을 보니 여기서 커피콩 납품도 하고 판매도 하는거 같은데 ~ 오호 !! 커피맛이 어떨지 기대가 되는데 로스팅 기계로 작업중인 직원분도 여러분 계신다 나도 갈때 커피좀 사가야 하나 ㅋㅋ 성수 카페 맛집 에서 사야는데 얼마전에 커피 샀는데 , 맛없는 커피 다 먹을 때 서울 성수 카페 업사이드 커피 로 맛있게 로스팅 된 커피콩 사러와야징 ~ 자리를 잡아볼까~? 다른 자리도 많았지만 로스팅 기계가 보이는 유리건너편에 앉아야지 뭔가 분위기도 좋고 ~ㅋㅋㅋ 편안한 분위기에 이 장소 내가 요즘 열심히 운전연수 중이니 업사이드로 성수동 카페거리 주차 도전 해봐야징 ~ 성수 카페 맛집 이라고 말하고 싶은 로스팅 카페 업사이드커피는 매장 벽면마다 분위기가 다르게 인테리어 되어있다 한쪽은 바 형식 한쪽은 심플하게 ~또 한쪽은 감성적으로 ㅋㅋ 통유리로 주차장이 보이는 구조이다 성수동 카페 주차 가능한 곳이 많지 않아서 이곳이 장점이기도 하지만 반면에 주차장 때문에 시야가 가려서 답답하기도 하고 로스팅 카페 성수동 카페거리 맛집 업사이드 커피 메뉴를 보니 ~ 이름도 특이하네 ~시그니쳐커피를 시켜야지 ~ 오호 ~해방촌 커피 요거 맛나겠는데 그리고 뚝섬커피 로 선택 !! 커피도 원하는 걸로 골라서 먹을수도 있어 커피만 시키면 섭섭하잖아 성수동 디저트 카페 까지 왔는데 ㅋㅋ 배부르게 밥을 먹어도 디저트 배는 따로 있다는 사실 ㅋㅋ 바닐라 파운드로 선택!! 성수동 카페거리 맛집 일꺼란 확신이 든단 말이지 오호~ 어쩔 ~ 비주얼 어쩔꺼야 ~? 누가 봐도 세상 달달할거 같은 느낌 아니겠어? 성수 카페 맛집 업사이드 커피 , 우연히 찾아왔지만 정말 잘 골랐다 서울 성수 카페 넘나 많은데 ㅋㅋ 이제 몇군데 밖에 못갔지만 여기 맘에 드는뎅 심지어 맛있는 커피도 있어서 기분도 좋은데 생각도 못한 책 선물을 함께 간 친구한테도 받고 ㅋㅋ 오늘 왜케 좋은날 ~~~ 업사이드 커피 성수 카페 맛집 이 강아지 캐릭터인가 곳곳에 귀여운 그림들이 있다 컵부터 시작에 받침대까지 귀여움이 가득한데 강아지 뒷통수까지 ㅋㅋ 어멋 !! 성수동 카페거리 카페 넘 귀여운 캐릭터인데 해방촌 커피 는 위에는 차가운 크림이 올라가 있는데 달콤하면서 부드럽다 , 어떤느낌이랄까 에스프레스 마키아또 큰사이즈? 좀더 부드럽다고 할까 우리의 오늘의 선택한 커피들은 잘 골랐다 싶다 성수 카페 맛집 이 맞네 뚝섬커피는 아이스크림의 달달함과부드러움 그리고 커피와 상반되게 차갑고 ㅋ 은근 이조합 잘어울리네 기본 커피가 맛이 좋아서 일수도 ~ 우리가 시킨 파운드는 아이스크림도 추가할수 있지만 ~ 우린 이미 당 섭취가 ㅋㅋ 넘치기 때문에 파운드빵 만 먹었는데 파운드의 뻑뻑함과 달달하고 부드러운 커피의 조합 요거 괜찮다 추천할만한데 성수동 카페 주차 가능한 업사이드 커피 에서 파는 커피빈 종류~ 이름도 귀여운데 ㅋㅋ 옹기종기 ~근데 지금 다시 보니 강아지가 아닌거 같아 미우캣인가? 로스팅 하는 성수 카페 맛집 업사이드는 주차도 가능하니까 커피빈 대량으로 사러오기도 좋을거 같은데 아기자기한 소품들도 판매하고 있어서 ㅋㅋ 나름 구경하는 재미도 있어 ㅋ 서울 성수 카페 올만한 곳인데 성수 카페거리 주차 되는 업사이드커피 에서 로스팅한 커피빈도 사러오고 ㅋ 맛있는 디저트도 먹을수 있는 성수 디저트카페 ~ 오늘도 우연히 들렸지만 ~넘나 잘 왔구나 나의 촉은 역시 뛰어나다니까 50m © NAVER Corp. 업사이드커피 서울특별시 성동구 연무장13길 3"
"[서울숲] 성수동 카페s # 업사이드커피 연무장점(해방촌커피), 하이라인(하이라인라떼), 멜로워 성수(뉴트로크림라떼)","서울숲역, 성수동에는 생각보다 많은 카페와 디저트샵이 있다. 종종 디저트 먹으러 가면서, 코스처럼 들렸던 성수동의 카페 업로드 포스팅! 첫번째는 업사이드커피 연무장점 업사이드커피는 성수동에만 무려 3개 지점이 있다. 성수점, 뚝섬점, 연무장점 연무장점만 가봤지만 밝고 차분한 분위기여서 좋았다. 여러가지 시그니처 커피가 있지만 이 날은 해방촌 커피 아이스 주문 얼음 동동 플랫화이트에 달콤한 크림, 그리고 커피가루로 귀여운 포인트 완성 생각보다 잔이 크고, 그리고 진하게 보이지만 섞으면 연한 커피이다. 진한 커피를 좋아하는 나로서는 좀 아쉬웠다. 크림과 섞이고 얼음이 녹으면서 더 연해졌기 때문.... 다음에는 거품 보글보글한 성수커피를 마셔보려고 한다~ 두번째는 하이라인 매장도 넓고 모던한 느낌의 하이라인, 평일에 방문해서 그런지 사람도 없고 조용했다. 단, 의자가 불편해서 오래 앉아 즐길수가 없었음.......... 이 곳의 시그니처, 하이라인 라떼와 비스코티를 주문했다. 세트로 10,000원 잔 주변에 묻은 설탕 같은데 달지 않았다 크림은 엄청 쫀득하고 부드러운데, 비스코티를 찍어 먹으면 정말 잘 어울렸다. 밑의 라떼도 연하지 않고 진해서 비스코티를 다 먹고 남은 크림과 섞어 마시면 내가 좋아하는 농도의 커피가 되었다~ 서울 숲에서 가장 괜찮았던 크림커피 여기는 특이한 모양의 푸딩도 있는데, 푸딩도 먹어보고 싶다 세번째는 멜로워의 뉴트로크림라떼 2018년 여름 방문하고 두번째 방문인데, 그 때는 고소하고 적당한 신맛의 리얼 마키아또를 맛있게 마셨다. 이 날은 크림라떼와 함께 까늘레를 먹고 싶었는데 멜로워는 까늘레가 없어서 무척 아쉬웠다. 뉴트로크림라떼는 스타벅스 더블샷 정도의 크기로 그 위에 크림이 가볍게 올려져 있는데 크림라떼보다는 라떼 같아서 또 아쉬웠다는~~"
성수동 업사이드커피 #자꾸 생각나는 뚝섬 커피,"안녕하세요, 욤입니다. 오늘은 정말 정말 간만에 여유로운 하루를 보내요. 정말 이런 시간이 얼마만인지ㅠ감동스럽군요ㅠㅠ 하지만 장마철 날씨는 참 내맘같지 않은ㅋㅋㅋ 그래도 오늘은 기분이 좋으니까 넘어가는걸로ㅋㅋ 지난번엔 서울에 갔을땐 제가 숙숙이랑 먹고 반했었던 #뚝섬커피 를 먹으러 갔습니다ㅠㅠㅠ 정말 아메리카노만 마셨었는데 카페에선ㅋㅋ 여긴 달달한 뭐 많이 올라간 커피가 존맛이에여ㅠ #성수동카페 #업사이드커피 입니다 :) 50m © NAVER Corp. 업사이드커피 서울특별시 성동구 연무장13길 3 [성수 카페, 업사이드커피] 주소 서울 성동구 연무장13길 3 영업시간 08:00 - 21:00 포장 시 1000원 할인 업사이드커피 안으로 총총 들어가 줍니다. 저는 진짜 운 좋게 한자리 남은 곳에 앉았음! 그리고 포장 손님들도 진짜 많았어요ㅋㅋ 역시 맛있는 커퓌집,,,*다음에 또 먹고싶음. 그리고 옆쪽에 바로 된 자리도 있는데, 거기도 사람들이 꽉꽉 차있어용ㅋㅋㅋㅋ 안쪽엔 로스팅을 따로 하는 공간도 있더라구요 :) 그래서 커피 관련 굿즈를 상당히 많이 팔고 있었어요. 메뉴를 살펴보도록 합니다. 생각보다 심플해요. 제 목표는 오로지 하나. 뚝섬 커피였음ㅋㅋㅋ 저 라떼에 아이스크림에 그레놀라 최고임ㅠㅠ 베이커리류도 간단히 팔고 있었어요ㅋㅋ 저흰 이미 다른 곳에서 먹었기에 패스함. 그리고 주문한 #뚝섬커피 두잔이 나왔습니다! 정말 영롱하지 않나요ㅠ저 그레놀라 존맛이에여! 고소하고 달달하고, 아이스크림이 들어갔는데 커피는 많이 안 달고 쌉쌀하고 맛있고 난리남. 요즘 몸이 안 좋아서 커피를 한잔 이상 마심 큰일나는데, 이걸 위해 다른 커필 참았습니다. 옆모습은 이렇게 생긴 #성수업사이드커피 #뚝섬커피 이 마저도 영롱하군요ㅋㅋ 그레놀라 많은거 내꺼임^^ 숟가락으로 아이스크림이랑 잘 퍼먹어 주세요. 마음 같아선 두번 세번 먹고 싶지만... 칼로리를 생각하면서 꾹꾹 참아보도록 합니다. 헝, 그레놀라 줄어드는게 참 아쉬워요. 안에 아몬드 슬라이스도 어찌나 고소한지. 다음에 성수동 가면 또 마셔야겠어요ㅠㅠ 성수 카페, 업사이드 커피 였습니다!"
서울 업사이드커피 뚝섬 / 성수동 카페 추천,"업사이드커피 성수동 카페 추천 서울 성동구 왕십리로14길 19-1 1층 업사이드커피 Time 월,화,수,목, 금 08:00 ~ 19:00 주말, 휴일 10:00 ~ 19:00 19:00에 영업이 끝나는데 테이크아웃 시 1,000원 할인되서 주변 직장인들에게 인기가 좋을 카페다 ㅎㅎ Price 에스프레소 4,500원 아메리카노 4,500원 카페라떼 5,000원 플랫화이트 5,000원 바닐라라떼 5,500원 카페모카 5,500원 해방촌커피 6,000원 뚝섬커피 6,500원 업사이드커피 5,000원 성수동이 요즘 뜨면서 카페 가격들도 많이 올랐는데 업사이드 커피는 가격대가 참 좋다 ㅎㅎ 커피와 같이먹으면 좋을 파운드, 스모어쿠키, 연무장쿠키까지! 밥을 너무 많이 먹고와서 디저트는 생략했다. 오트, 쌀, 콩 등을 블렌딩 해서 풍미를 살린 차세대 식물성 대체 우유 xilk 100% 식물성 대체우유를 취급하고 있어서 라떼를 마실 때 변경 할 수 있는 좋은 카페다 ♥ 벽면에는 업사이드 커피의 굿즈와 원두들이 가득 ♥ 다른 지점은 어떨지 모르겠는데 내가 방문한 뚝섬점은 굉장히 규모가 작았다. 테이블 3개와 바자리 4개가 전부로 작은 공간이여서 노트북 이용시 1시간으로 시간 제한이 있고 주차장도 없지만 아늑한 분위기가 있다 ♥ 노래도 일반 카페처럼 팝송이아니라 재즈음악이 나와서 색다르게 느껴졌다. 곳곳에 장식되어있는 꽃 하늘색 카네이션과 용담초를 카페에서 볼 줄이야,, 여름에 정말 잘어올리는 꽃들인데 이곳에 있었다 ㅎㅎ 주문한 메뉴가 나왔다. 해방촌 커피와 #뚝섬커피 아이스 ♥ 해방촌커피는 크림 + 플랫화이트 뚝섬커피는 아이스크림 + 라떼 현재 성수, 뚝섬, 연무장 3개의 지점이있는데 지점마다 또 시그니처의 메뉴가 있는게 이 카페만의 특징! 크림커피나 라떼류를 먹으면 입이 텁텁해져서 물 마시고 싶어지는데 이곳은 처음부터 얼음물을 주는 센스가 남다르다 ♥ 포스팅을 위해 #업사이드커피 SNS에 들어갔는데 곧 을지로에 지점을 또 낸다고 한다(!!!) #해방촌 골목에서부터의 시작을 기점으로 서울 내 여러 곳으로 뻗어가는 업사이드 가까운 업사이드에서 커피와 여유로운 시간을 누리길 ♥ 위치 및 지도 50m © NAVER Corp. 업사이드커피 뚝섬점 서울특별시 성동구 왕십리로14길 19-1 1층 업사이드커피"
성수동 미어캣이 반겨주는 커피맛집 '업사이드커피 뚝섬점',"뚝섬역에서 친구와 합류하고 커피 수혈하기 위해서 카페를 가기로! 원래 가려던 오시요가 닫아서 맛있는 카페 추천해달라고 친구에게 구걸했다..ㅠㅠ 맛있는 커피를 먹기 위해서 블루보틀도 지나치고 친구의 추천으로 업사이드 뚝섬점에 도착🌼 50m © NAVER Corp. 업사이드커피 뚝섬점 서울특별시 성동구 왕십리로14길 19-1 1층 업사이드커피 업사이드커피 뚝섬점 매일 08:00-19:00 공휴일 09:00-19:00 (추정) UP.SIDE COFFEE , 원두납품(문의:DM)(@up.side_) • Instagram 사진 및 동영상 팔로워 8,048명, 팔로잉 0명, 게시물 403개 - UP.SIDE COFFEE , 원두납품(문의:DM)(@up.side_)님의 Instagram 사진 및 동영상 보기 www.instagram.com 나는 처음가봤지만 이미 너무 유명했던 업사이드커피! 카페 내부가 넓지 않아서 자리가 없었고, 나갈까 고민하다가 그냥 주문했는데 다행히도 금방 나가는 분이 계셔서 자리가 생겼다 아메리카노 4,500 카페라떼 5,000 콜드블루 6,000 연무장 플랫 5,000 + 각종 디저트들.. 잘만든 캐릭터 하나가 배불려준다 ㅠㅠㅠㅠ 쿠폰 도장모양까지 캐릭터 머리모양으로 너무귀엽다... 메뉴에 지역 네이밍을 붙여서 뚝섬 커피, 해방촌 커피, 성수 커피 시그니처 메뉴를 판매하고있다 테이크아웃 손님도 많이 다녀감 음료가 먼저 나왔다 실리콘 재질의 코스터도 귀엽고 스탠리스 컵에 로고도 고급지게 뽑혀있어서 꼼꼼하게 잘 만든 브랜드같아서 컵을 들고만 있어도 기분이 좋다ㅎㅎ 아메리카노와 콜드블루는 둘 다 맛이 진한 편이었고 나는 꼽자면 아메리카노 맛이 더 나았다 그리고 라떼맛집임ㅋㅋㅋㅋㅋ 콜드블루 주문했는데 라떼가 맛잇네...?^^.. 다음에 오면 시그니처 메뉴를 좀 먹어봐야겠다 곧이어 나온 디저트 바닐라파운드/스모어쿠키/르뱅쿠키 여기서 최강은 바닐라파운드였다! 다른 디저트가 다 단맛이라 바닐라파운드부터 먹었는데 너무너무 맛있었다 ㅠㅠ 최근에 맛있는 디저트를 못먹었는데 너무 만족함 스모어쿠키는 바닐라파운드 조지는동안 마시멜로우가 식어서 딱딱했지만 달달하니 맛있었고 르뱅쿠키도 초코와 마카다미아가 들어있어서 식감 좋고 맛있었다 디저트 비쥬얼부터 이쁘다 꾸덕해보이고 색감도 이쁨! 거기다 맛까지 있었으니 너무 좋음.. 뚝섬역에서 출발하면서 맛있는 커피집을 친구가 추천해준거라 바로 뚝섬점으로 간건데 포스팅하면서 업사이드커피가 여러 지점이 있다는걸 알았다 ㅋㅋㅋㅋ 어쩐지 작은 카페인것치고 캐릭터나 굿즈, 포스터 등 브랜딩이 너무 잘되어있다고 생각했었음 그리고 여러지점이 있는건 그렇다쳐도 성수동에만 업사이드커피가 3곳이 있다는게 놀랍다 ㅋㅋㅋ 미어캣 귀여워.. 대구에도 데려오고싶다 다음날 다른 대형 카페도 갔었지만 카페 규모에 비해 썩 맛있진 않았다 오히려 매장 자체는 작아도 내실좋은 업사이드카페가 또 오고싶게 만든다 다음에 서울오면 다른 지점에도 또 방문하고 싶은곳! #내돈내산 #업사이드"
[성수]해방촌커피로 유명한 커피맛집 성수동 - 업사이드커피,"정말 오랜만에 성수동을 다녀왔습니다. 성수동은 핫플이 많기로 유명한데 오늘 소개해드릴 곳은 업사이드커피 입니다아. 업사이드커피(성수) 영업시간 : 8시 ~ 21시 주차 : 가능 (협소) * 반려동물 동반 가능 * 화장실 카페 건물 이용 가능(외부) 50m © NAVER Corp. 업사이드커피 연무장점 서울특별시 성동구 성수일로 45 1층 갈색 벽돌로된 건물에 있는데 동네카페와 핫플 그 사이 어딘가인 느낌이에요 귀여운 강아지 시그니처인지 출입문에 그려져 있고 앞쪽 주차장에 차가 만차라 첨에 못찾았어요;; 앞쪽엔 야외테이블이 있는데 주차된 차가 없으면 날이좋을때 이용하면 좋을거 같아요 입구에 들어서자마자 연말분위기가 느껴지는데요! 볼펜,그립톡,컵 등 굿즈도 다양하게 있는데 너무나 귀여웠어요 커피맛집답게 종류별 맛이 설명되어 있고 음료 종류도 커피 위주로 있다. 시그니쳐 메뉴는 커피를 안좋아하는 사람(=나)도 먹어보고 싶어지는 달달한 커피들이었다. 커피머신도 연말 분위기에 맞춰 꾸며져 있다아. 벽엔 엽서가 가득하고 원두(인것같은) 포대가 높이 쌓여져 있는데 뭔가 감성적이다🤣🤣🤣 내부엔 바테이블과 원형테이블이 있는데 공간이 넓지는 않다. 편한 의자가 아니라 오래앉아있기는 힘들것 같습니닷😅 바테이블 맞은편엔 커피공장처럼 큰기계들이 보여요! 주문메뉴 뚝섬커피 6,000원 아메리카노 4,500원 뚝섬커피 아이스크림 + 라떼 생각지 못한 뚝섬커피 비주얼이다. 아이스크림,라떼 위에 쿠키가 올려져 있는데요 쿠키가 고소하면서 달달하면서 너무 맛있었어요! 아메리카노는 즐겨먹지 않아서 잘 모르지만 잘 모르는 제 입맛에도 고소하고 맛있었어요. 컵이 너무 귀여워서 탐났다는... 쿠키+아이스크림 + 라떼 한스푼 조합은 정말 꿀맛이었어요. 다먹고 검색해보니 해방촌커피가 무척 유명한 커피맛집이었다고 합니다. 다음엔 해방촌커피 마시러 와야겠다 생각이 들게한 맛있는 카페 업사이드커피👍 #성수 #성수동 #건대입구 #건대입구카페 #성수동카페 #성수카페 #서울숲 #성수핫플 #성수맛집 #성수동맛집 #해방촌커피 #뚝섬커피 #아메리카노 #업사이드커피 #업사이드커피연무장점 #애견카페 #애견동반 #반려동물 #반려동물동반 #내돈내산"
성수동카페 업사이드커피 커피맛집 성수로와,"안녕하세요. 초코 애호가 에디터 쿠키입니다! 하루에 한 번은 꼭 라떼를 마셔줘야 하는 저는 성수동카페 업사이드커피에 다녀왔어요! 이곳에서 마신 음료와 함께 내부를 꼼꼼하게 살펴보도록 할게요~ 하루 정도는 여유와 사색을 가지고 부담 없이 편하게 즐기며 라이프 스타일을 추구하는 업사이드커피! 귀여운 미어캣 캐릭터가 반겨주는 성수동카페입니다. 성수로와 N줄요약 커피맛집 업사이드커피는 카페거리에 있어서 쉽게 찾을 수 있었어요. 성수동에 카페가 워낙 많아서 못 찾으면 어쩌나 걱정하실 수 있지만 길을 따라서 걷다 보면 금방 찾을 수 있을 거예요!! 건물 앞에 들어서자마자 보이는 미어캣 캐릭터!! 정말 귀엽지 않나요? 미어캣이 어서 들어오라고 손짓하고 있는 것 같아요 ㅋㅋ 점심 시간때라 그런지 사람이 정말 많았는데요. 하마터면 못 앉을 뻔했어요 ㅎㅎ 자리가 꽤 많이 준비되어 있는 덕분에 바로 착석했답니다! 주문한 메뉴 아이스 카페라떼 5,000원 레몬에이드 5,500원 메뉴를 후다닥 고르고 나서 성수동카페 업사이드커피 내부를 둘러봤는데요. 사람이 끊임없이 들어오고 나가고 있었는데 깨끗하게 유지되고 있었어요. 아이스 카페라떼와 레몬 에이드가 금방 나왔는데요. 미어캣이 그려져 있는 스테인리스 잔이에요ㅠ 너무 귀엽지 않나요... 들고 갈 뻔했을 정도로 제 마음에 쏙 드는 잔이었어요. 카페라떼와 레몬 에이드 모두 같은 잔에 나왔는데요. 스테인리스인 덕분에 더욱 차갑게 마실 수 있었어요. 역시 커피는 카페라떼가 제일 맛있는 거 같아요. 우유와 커피가 섞이면서 고소한 맛이 살아난다고 할까요? 자리에 앉아서 음료를 마시다 보니 직원 분이 커피를 내리시는 모습을 보게 되었어요. 이렇게 가까이서 보는 건 처음이라 신기했어요. 커피 맛뿐만 아니라 내부 인테리어도 제 마음에 들었어요. 저는 뭔가 과하게 꾸며져 있으면 오래 머물러 있기 힘들더라고요 ㅎㅎ 그런데 성수동카페 업사이드커피는 내부가 깔끔하고 포인트만 주듯이 꾸며진 느낌이라 편했어요. 다음에는 파운드 케이크와 쿠키를 주문해서 먹어보려고요. 배부른 상태라 음료만 주문했지만 디저트가 눈에 밟히네요 ㅎㅎ 점심을 먹고 갔을 대 사람이 많았으니 더 일찍 방문하거나 저녁에 가도 괜찮을 거 같아요. 깔끔한 카페라서 언제 가든 편하지 않을까 싶네요~ 성수동카페에서 시간을 보내고 싶거나 커피맛집을 찾는 분들이라면 업사이드커피에 한 번쯤은 방문해 보셨으면 좋겠어요! 요즘은 건물마다 하나씩 있는 게 카페이지만 귀여운 미어캣 케릭터가 오라고 손짓하는 곳은 이곳 밖에 없을 테니까요 ㅋㅋ 테이크아웃을 하면 1,000원 할인되니 참고 하시길 바랄게요^^ 업사이드커피 운영시간 매일 8:00~21:00 인스타그램 @ up.side_ 50m © NAVER Corp. 업사이드커피 서울특별시 성동구 연무장13길 3 더많은 성수동카페, 성수동맛집이 궁금하다면 성수로와 인스타도 팔로우 해주세요+_+"
성수동에서 넘어온 을지로 핫플 [업사이드커피],"▼ 제주아방에서 저녁 먹고 을지로3가 힙지로 제주고기집 [제주아방] (feat. 와인) 대학 동기들과 부부동반 모임을 가졌다. 이번 모임 장소는 서로의 중간장소인(?) 을지로 3가! 영업시간 월-... blog.naver.com 보이는 곳 아무 카페나 찾아 들어감! 업사이드커피 을지로점 서울특별시 중구 을지로4가 45-2 영업시간 월-금 08:00 - 18:00 토 10:00 - 18:00 라스트오더 17:30 매주 일요일 정기휴무 주말에 을지로를 갔더니 웬만한 카페는 다 문이 닫혀있어서 유일하게 열려 있던 업사이드커피를 방문했다. 블로그를 쓰면서 알게됐는데 업사이드커피는 성수동 간판 카페 중 하나라고! 을지로에도 상륙했다고 한다. 마감시간쯤 도착해서인지 정말 우리말고는 없었던 카페! 굉장히 조용해서 좋았다. 업사이드커피 음료 메뉴 Next image 시그니처 메뉴는 해방촌 커피 / 업사이드 커피 / 뚝섬 커피 커피 종류를 시키면 원두도 선택할 수 있다. Next image 업사이드커피 디저트 메뉴 디저트는 마감시간에 가서인지 한두개씩만 남아있었다. 이 날 블로그 한다고 공개했더니 구석구석 찍으라고 조언해주던 친구ㅋㅋㅋㅋ 추우면 담요도 가져다 사용할 수 있습니다 여러분! 귀여운 강아지가 그려져있는 진동벨이 울리고 받아온 우리의 메뉴! 아메리카노, 플랫화이트, 해방촌커피, 오버더레인보우 티 그 중 남편이 시킨 해방촌커피가 진짜 맛있었다. 플랫화이트 위에 크림이 올라가있는데 크림이 완전 쫀득쫀득 그 자체. 내가 시킨 오버더레인보우티는 생각보다 맛이 없었다,,,(머쓱) 이 집은 커피맛집인듯. 다음에는 커피로 주문해봐야겠다!"
"(성수동) 업사이드커피, 로스터리 카페",다른 동네에도 있는 것 같던데 여긴 성수동 업사이드커피 매장 내부는 크지 않고 로스팅 머신들이 주르륵 메뉴 디저트 해방촌커피. 크림과 커피의 밸런스가 좋다. 성수동에서 마셔본 중 제일 낫네 근데 친절하진 않음
