title,content
"5.15.-5.21. | 백만년만의 서울 나들이 | 한올 티건 자켓, 성수동 PEEPS, 클레멘타인","5월 초부터 이렇게 덥기 있나요,,,☀️ 벌써부터 대낮에 31도를 찍다니 ㅠ 나는 아직 셔츠를 제대로 입고 다니지도 못했는데 벌써 반팔을 개시해버려서 조금 슬픔 🥲 이제 진짜 옷 안 살거다. (레인부츠 빼고) 그런데 마지막으로 하나는 사야겠다. 왜냐? 다음달에 결혼식이 2번이나 있으니까 😊 한올 티건 자켓 hanoll teagan jacket (begie) Teagan Jacket (Beige) *잡사는 자연스러운 현상입니다. 이와 같은 이유로 교환 환불은 불가합니다* - 프리미엄 썸머 울 - 트위드 조직감 - 페이크 입술 포켓 - 넓은 라운드 네크라인 - 포인트 단추 - 바이어스 처리 썸머 울 소재로 제작된 자켓입니다. 리오셀 블렌딩으로 우수한 광택과 부드러 www.hanoll.shop 작년에 한올을 처음 알게 되었고, 여름 니트 2개를 사서 정말 호크룩스 수준으로 잘 입고 다녔다. 심플하고 베이지 계열 옷이 많은 곳이라 완전 내 스타일✨ 한올 홈페이지 사실 이 트위드 자켓은 작년에도 살까 고민했었다. 색상이나 디자인이나 너무 나한테 딱일게 뻔히 보였으나(?) 이상하게 팔 부분 카브라가 거슬렸다. 한 두푼도 아니기에 저 카브라가 거슬린다면 손이 잘 안 갈 것 같아서 안 샀는데 왠걸, 올해는 저것도 하나도 신경 안 쓰이고 예뻐보이는걸 🤭 색상도 차분하니 하객룩으로도 딱 좋을 것 같고, 슬랙스건, 청바지건 어디든 휘뚜루하기 좋은 디자인이다. 한올 홈페이지 상세 페이지 색상은 착용샷보다는 살짝 붉은기가 돌아보였다. 재오픈하는 시간에 바로 주문했더니 다음날 도착😃 예쁜 상자에 고이 담겨 온 내 자켓 한올은 항상 더스트백을 준다. 여행갈 때마다 유용하게 사용하는 중 😉 상세샷에서 붉은기가 있어 보여서 좀 걱정했는데 실물은 붉은기 없음! 딱 채도 낮은 느낌이라 색상이 코디하기 쉬움 😁 입어보니 길이도 품도 딱이다 ✌️ 착샷은 다음에 추가하도록,,, 2. PEEPS PEEPS 주소 : 서울특별시 성동구 서울숲4길 16-25 1층 영업시간 : 매일 11:30 - 22:00 (15:00-17:00 브레이크타임) 21:00 라스트오더 주차 : 별도 주차공간 없음. 인근 공영주차장 이용 예약 : 캐치테이블 예약 가능 50m © NAVER Corp. PEEPS 서울특별시 성동구 서울숲4길 16-25 1층, PEEPS 친구랑 미리 예약해두고 간 PEEPS! 캐치테이블로 예약해서 편했다 ㅎㅎ 와인바를 겸하는 곳이라 그런지 주말 11시 반쯤 갔는데 자리는 넉넉했고 차근차근 사람들이 들어왔다. <주문 메뉴> 비프 타르트 18,000원 참나물 페스토 조갯살 파스타 25,000원 감자 뇨끼 땅콩호박 퓨레 25,000원 석류 에이드 7,000원 청포도 에이드 7,000원 제일 맛있었던 비프 타르트 🫶🏻 한우에 매실 장아찌, 트러플 오일과 발사믹 캐비어까지 올라간 춘권을 베이스로 한 타르트라고 설명해주심 입맛 돋구는 에피타이저로 너무 딱이었고 먹자마자 와인 한 잔 하고 싶어지는 맛 🙊 이 곳에서 이 메뉴는 꼭 시켜야 한다고 생각 ‼️ 호박퓨레를 얹은 뇨끼 🥔 감자가 겉바속촉은 제대로인데 개인적으로 밀가루맛이 조금 더 느껴져서 그건 아쉬웠다. (그래도 겉바속촉 쫀득 맛있음) 그리고 무엇보다 저 호박 퓨레 소스가 너무 달달하니 고소하고 맛있다 🥰 덕분에 소스 박박 긁어먹어서 설거지 대신 해드림 ㅎ 이것도 추천할만한 메뉴 🫶🏻 참나물 페스토 조갯살 파스타! 참나물로 파스타라니! 신기한 마음에 시켜본 메뉴. 바질 페스토처럼 참나물로 페스토를 만든 것 같았다. 면과 소스와 모든게 적절하니 잘 어우러져서 맛있게 먹은 메뉴다. 피스타치오도 들어가서 고소한 맛도 가미됨! 다만 내가 조개를 좋아하진 않아서 다음번엔 난 다른 메뉴를 시켜볼 듯! 파인 다이닝으로 나와야할 메뉴들이 하나하나 구성된 것 같이 고급스럽고 맛있었던 PEEPS 💕 다음엔 저녁에 방문해서 와인과 함께 즐겨보고 싶음! 3. 클레멘타인 클레멘타인 주소 : 서울특별시 성동구 서울숲2길 5-1 1층 (2호선 뚝섬역 근교) 영업시간 : 매일 11:00-21:00 주차 : 별도 공간 없음. 50m © NAVER Corp. 클레멘타인 서울특별시 성동구 서울숲2길 5-1 1층 예전부터 가보고 싶었던 성수 카페 🌱 가드닝이 예뻐서 매력적이었다. PEEPS랑 가까운 김에 가보게 되었다! 한참 인기 많을 때보단 조금 사람이 빠진 듯해서 12시 반쯤 갔는데 자리가 널널했다. 물론 여기도 사람들이 계속 들어옴 (우리가 빠릿빠릿 움직여서 사람들과 덜 겹친 듯) 클레멘타인의 정체성이라고 볼 수 있는 플라워샵 🌸 한켠에 놓여있는 꽃들이 너무 예쁘고 그냥 보기만 해도 기분 좋음 꽃 찍는 모습을 친구가 찍어줬는데 정말 열심히 찍네 😅 머리가 너무 새까매서 염색하고 싶은데 흑갈색으로 해도 점점 밝아지다 보니 또 포기해야지 😔 내 머릿결,,, 내 돈,,, 실내도 자리가 있고 2층에도 있지만 실내는 에어컨으로 좀 추워서 우리는 2층 올라가는 계단 밑 공간을 선택했다. 그늘은 가려줘서 덜 덥고 적당히 선선해서 좋았다 ㅎ 탠저린바질에이드를 마셨는데 그냥 탠저린에이드에 바질잎이 올라간 거라 아쉬웠다,,, 🥺 뭔가 바질과 탠저린을 같이 청으로 담갔다거나 내가 상상한 것과는 다른 심플함 ㅠ 에이드 자체는 맛있었다! 디저트도 여러개 있고 카페 종류도 많다. 디저트는 배불러서 못 먹었지만 음료는 엄청 특별하지도, 맛없지도 않은 그럭저럭 맛있는 것 같다. 사실 음료는 기대 안 하고 간거라 나는 좋았음 😊 4. POINT of VIEW POINT of VIEW SEOUL 주소 : 서울특별시 성동구 연무장길 18 1,2,3층 영업시간 : 매일 12:00 - 20:00 (매달 마지막주 월요일 휴무) 50m © NAVER Corp. POINT of VIEW SEOUL 서울특별시 성동구 연무장길 18 1,2,3층 쇼룸들 구경해야지 하고 걸어가는데 사람들이 줄을 쫙 선 곳이 보였다. 지나가면서 보니 뭔가 소품과 문구를 파는 곳 같아서 먼치스 앤 구디스를 갔다가 우리도 줄을 섰다 🚶‍♀️🚶 사람이 워낙 많아서 사진은 못 찍었지만 다양한 문구 제품들, 문구 베이스의 오브제 등 다양한 소품을 파는 곳이었다. 1층부터 3층까지 공간이 넓고 각 층에서는 각 층의 제품을 결제를 해야한다. 지우개가 너무 귀엽기 있나요 🥹 아까워서 못 쓸 지우개들,,, 이건 정말 사고 싶었던 문진 겸 인센스 홀더 살짝 타원형의 외형이 너무 예쁘고 심플하면서도 독특한 느낌이 좋음 😌 43,000원인데 살까말까 정말 고민하다가 일단은 참았다 🥲 그리고 내 발길을 사로잡은 그릇(?) 음식을 담을 그릇은 아니고 딱 선반에 올려두면 너무 포인트가 될 것 같았다. 근데 이건 9만원 😱 예쁘긴 한데 이 돈을 주고 사기엔,,, 나란 사람의 월급 너무 비루하다 😬 나는 이 노트와 펜 하나 연필 한 자루 사왔다 ㅎㅎ 노트 8,000 초록색 연필 (정원가의 펜) 4,000 볼펜 8,000원 준 듯하다. (사진엔 없음) 집들이도 한 바탕씩 한 마당에 이제라도 방명록으로 써야하나 고민중이다 ㅋㅋㅋ + 🤍 친구들이 사준 집들이 선물 🎁 AUX 도자기 제품인데 내 취향 저격 🔫 티팟부터 예쁜 파스타볼, 고블렛 잔, 찻잔 세트, 접시까지 ㅠ 너무 푸짐하게 준비해준 친구들 🫶🏻 고마워 💕"
성수동 서울숲 카페 추천 클레멘타인,"성수동 서울숲 카페 추천 클레멘타인 50m © NAVER Corp. 클레멘타인 서울특별시 성동구 서울숲2길 5-1 1층 쥬라기공원 팝업스토어에 가려고 했다. 비록 사전예약은 못했지만 현장예약도 받는다고 해서. 근데 밥먹고 술렁술렁 갔더니 현장예약이 마감되었다고 한다. 네?;; 이런, 밥부터 먹는게 아니였군.. 아쉽다. 방황하다가 눈에 보이는 카페로 들어갔다. 성수동에서 흔한, 구옥을 개조한 카페다. 곳곳에 트리장식을 해놔서 예쁘다. 따듯한 밀크티를 주문해 놓고 1층을 구경해본다. 사진도 찍고 1층은 자리가 없어서 2층으로 올라갔다. 이 자리 맘에 드는데 이미 주인이 있군. 옆 테이블로 착석 밀크티에 식용꽃이 뿌려져있다. 먹을때 거추장 스럽..그래서 먹어버림. 추운날 밖에 돌아다니다가 따듯하고 달달한 밀크티를 한입 먹으니 몸이 노곤해진다. 그렇게 수다 떨다가 또다른 미션을 수행하지 못하였다고 한다.. 깔깔"
성수동 플라워카페 @클레멘타인,"서울숲 정말 오랜만에 걸어보아요 이렇게 예쁜 곳에 더 예쁜 당신이 바로 울엄니 성수동 꽃집과 같이 운영중인 카페 클라멘타인 여자들이 정말 좋아할 공간으로 캐쥬얼한 야외석 3자리가 있어 가벼운 소개팅으로도 오기 좋을 거 같아요 꽃 한송이 사주면 바로 그린라이트 💚 보라꽃은 향기가 나지 않았다고 한다 지팡이는 쿨허벌 알 수 없는 이상한 극강의 달콤한 티 엄마는 아메리카노 주문했는데 너무 쓰다고 반 버리고 물을 탔다 나는 레몬에이드 이것도 맛없기 힘든데.. 피치 밀크 케이크도 먹었는데 정말 싸구려 케이크 맛이라 너무 당황스러웠어요 성수동에서 이런 일이 있을 수 없는데 🙏🏻 모녀샷 찰칵 나가는 길 포토존에 자리가 났다 거울에 비친 나에게 보내는 💓 지정 : 엄마 저 풀 먹어봐 ㅋㅋㅋㅋㅋㅋㅋㅋㅋㅋㅋㅋ 인테리어는 미쳤으나 음료, 음식이 준비 덜 된 듯한 성수동 신상카페 클레멘타인"
"구월의 열두 번째 | 비비비커피,클레멘타인,서울숲,한강전망대,성수동애견동반카페",오랜만에 만난 응비 여전히 귀엽구나 너- 오랜만에 만난다고 컬리에서 이것저것 장난감도 사고 간식도 사 갔는데 너무 좋아해 줘서 행복 날씨 최고 산책하기 좋은 날씨네- 성수동에 #비비비커피 애견 동반이라고 해서 갔는데 9월 말까지만 하신다고ㅜ 애견 동반이라고 하면 보통 테라스나 야외 자리만 되는데 여기는 실내도 된다!! 근데 은비자식이 너무 짖어서... 밖으로 나갔...ㅜㅜ 너무 얌전했던 콩콩이 간식 많이 줬더니 저렇게 문에서 쳐다보고 있어 귀엽게 야외 자리도 좋았을 텐데 옆에서 공사하고 있고 사람이 계속 다녀서 은비 안정을 위해 호다닥 나오기 기다려는 잘하는데... 왤케 짖어 진짜ㅜㅜ 개린이자슥 오늘 개시한 양말인데 벌써 꼬질꼬질해진... 헤드는 게 너무 이뻤던 #클레멘타인 여기도 야외는 애견 동반이라 가려고 했는데 아까 보니 은비 너무 짖어서... 안되겠다 싶어서 테이크아웃만 해서 가기 해 내려갈 때 #서울숲 내려가는 햇빛 받는 나무색이 너무 이쁘고 한강 전망대! 오늘 날씨 좋으니까 노을 보러- 간식을 기다리는 귀염둥이 틈틈이 노을 구경도 해주고 기다려 훈련도 하고 완전히 내려간 해 이때까지 이쁘고 나면 살짝 애매해지지만 좀 더 기다리면 또 이쁜 색이 나오니까 기다리기 안 움직이고 여기서 계속 있으니까 지루한 은비 기다려죠 해가 완전히 내려가고 좀만 더 기다리면 남색 하늘이 나오기 시작하면 또 기절 근데 제일 이쁜 건 저 주황에서 노란색으로 그라데이션 더 어두워질 테지만 이제 그만 갑시다 바람이 차다 올해 여기서 보는 마지막 노을일 듯 강바람은 너무 추워 내년에 또 만나- 약간 어두우면 무섭긴 한데 사람은 적어서 좋다 수국이 이뻤었나 봐 깜장 콩이라 그늘 들어가면 안 보여서 너무 웃겼지 ㅋㅋㅋ 그래도 간식 많이 준 덕분인지 내가 안 오면 뒤돌아서 나오나 봐주고 나보고는 안 짖어줘서 고마워ㅜㅜ
[서울숲 카페] 클레멘타인 :: 성수동 유럽 감성 플라워 카페,"클레멘타인 Clementine 🤍 서울 성동구 서울숲2길 5-1 1층 🤍 11:00 - 21:00 클레멘타인 서울특별시 성동구 서울숲2길 5-1 1층 오랜만에 놀러 온 서울숲🌷 이날은 딱히 카페 안찾고 왔는데 정말 좋아하는 유럽 감성 카페를 발견했지 뭐예요?🤍 하지만 저 멀리서도 잘 보이는 웨이팅 하는 사람덜.. 그래서 근처에서 피자 한 조각 먹고 다시 왔습니다!.. 그만큼 예뻐서 꼭 가고 싶었음!... 해도 딱 그 카페만 비추니 햇살 맛집에 카페 안에 작은 꽃집도 있었어요.💐 하얀 건물에 돌바닥🙂 유럽 감성 물씬 풍겼던 서울숲 카페 클레멘타인🌷 입구에는 꽃이 잘 진열되어 있길래 첨엔 뭐지 했는데 파는 거더라고요! 꽃 살 생각은 없었어서 구경만 잔뜩 했습니다.🌝 여기서 사람들 사진도 엄청 찍더라고요! 꽃집 옆에는 뚫려있는 상태로 이렇게 자리가 있었고요. 더 안에는 카운터가- ! 사람이 진짜 많았던 터라 3-4시 경이였음에도 디저트가 거의 없었어요.🥲 Menu 서울숲 감성 카페, 클레멘타인 꽃 저렇게 테이프로 붙여놓은 것까지 gamsung … 카운터에서 바라본 꽃들💛 꽃 좋아하는 슬이는 아주 행복〰️🩰 저 자리가 아주! 탐났으나 자리가 안 비어서 2층으로 올라갔어요. 조심조심 2층 계단은 밖에 있었습니다.🫒 날 좋을 땐 저 계단 밑에 요 자리도 너무 예쁘겠잖아요!!🥨 Second floor 서울숲 유럽 감성 카페, 클레멘타인 곳곳에 있는 창의 햇빛이 가득했어요! 저 옆자리에 앉았다가 너무 뜨거워서😅 안으로 자리를 옮겼습니다. 그래도 저기가 젤 이쁘다… 넓진 않았는데 자리는 많았어요! 남이 먹은 거 찍는 이상한 취미🌝 🩰플랫 화이트 (6.0) 🩰탠저린바질에이드 (7.5) 를 주문했습니다. 플랫화이트는 먹을만했어요! 사실 커피 맛을 기대하고 온건 아니라 이 정도면 무난하다 요런 느낌? 근데 저 탠저린바질에이드는 가격 대비 노우… 살짝 이도저도 아닌 맛🌬️ 천장 절반이 유리라 더욱 환했던 카페👐🏻 주변에 예쁜 가방이나 신발이 디피되어 있더라고요? 알고 보니 2층 구석에 체리코코라는 온라인 쇼핑몰이 있었어요. 구경하다가 삔 하나사달라고 이쁜척ㅎ ㅏ는 중💥 성공ㅋ🫶🏻 오랜만에 예쁜 카페를 발견해서 기분이 좋았던 나! 소녀소녀 유럽 감성 좋아하신다면 서울숲 카페 클레멘타인 가보셔요! ♥️ 그럼 안뇽!🌬️🤍 [플로어] 한남동 Flore 바스크 치즈케이크 맛집 신상카페 플로어 F L O R E 서울 용산구 이태원로49길 24-14 1층 11:30 - 21:00 월요일 휴무 동생과 밥 다 먹고... m.blog.naver.com #클레멘타인 #서울숲카페 #성수동카페 #성수카페 #서울숲카페추천 #clementine #서울감성카페"
성수동 카페 클레멘타인 / 서울숲 플라워 카페 / 성수동 카페거리,요즘 너무너무 핫한 성수동 친구랑 주말에 성수동 나들이 다녀왔어요 서울 성동구 서울숲2길 5-1 클레멘타인 open 11:00 closed 평일 19:00 / 주말 21:00 off 유동적 다른 곳은 몰라도 꼭 여기는 가야지 했던 성수동 클레멘타인 햇살 맛집 클레멘타인 메뉴에요 커피나 티랑 즐기기 좋은 디저트도 있어요 인테리어 분위기 꽃향기 채광 플라워 가드닝이 정말 매력적인 공간이에요 꽃과 작은 화분은 카파에서 구매 가능해요 전문 플라워샵 처럼 판매 중인 꽃 종류도 다양했고 주말이기도 했고 다른 분들 눈에도 다 예쁜 공간이라 사람이 정말 정말 많았어요 역시 서울 ..! 친구는 아아 저는 레몬에이드 그리고 에그타르트 주문했어요 무심하게 톡 놓여있는 화병도 이렇게 예쁠 일인가요? 우리 예지씨 길고 가는 예쁜 손가락 꽃밭에 시골쥐 등장 그대로 딱 우리 집 화장실에 가져다 놓고 싶은 감각적인 세면대와 수전 너무 예뻐.. 앉고 싶었던 자리 :) 2층으로 올라가는 계단 아래 야외 테이블 공간인데 너무 예쁘지 않나요 꽃향기 풀냄새 가득한 클레멘타인 입구 앞 작은 테이블도 언제나 핫한 자리 2층으로 가면 체리코코 쇼룸이 있어요 서울숲 카페 성수 카페 찾으시는 분들 낮에 클레멘타인 꼭 가주세요 :) 50m © NAVER Corp. 클레멘타인 서울특별시 성동구 서울숲2길 5-1 1층 주차공간은 따로 없고 주말에는 웨이팅 조금은 하셔야 해요 #성수동카페 #성수동카페거리 #성수동카페추천 #클레멘타인 #성수동클레멘타인 #성수동플라워카페 #성수동플라워샵 #서울숲카페 #서울숲브런치 #성수동브런치 #성수동데이트
성수동 플라워 & 디저트 카페 클레멘타인 (체리코코 쇼룸도 함께 있는 곳) / clementine / 서울숲 디저트 카페 / 서울숲 플라워 카페,"성수동 플라워 & 디저트 카페 clementine 클레멘타인 지난주 그렛이와 성수동에서 밥 먹고 방문한 클레멘타인! 50m © NAVER Corp. 클레멘타인 서울특별시 성동구 서울숲2길 5-1 1층 서울 숲과 성수중 그리고 성수고 근처 카페랑 식당들 쫙~몰려있는 거리에 위치해있는 클레멘타인. 지하철 이용하시는 경우 뚝섬역이나 서울숲 역 이용하시는 걸 추천드린다. 플라워 카페 겸 디저트 카페로 꽃다발 포장해가시는 손님들도 많았던. 크리스마스 시즌도 알차게 준비해두셨다! 블링 블링 감성 돋는 오너먼트들로 카페에 자리 없어서 살짝 짜증 났던 마음 몽글 몽글해짐. 카페 좌석은 2층에도 있기에 1층이 꽉 찬 경우 2층 좌석도 한번 살펴보시길. 우드 + 화이트톤의 딱 깔끔한 분위기였고 아늑한 편이었다. 주말이어서 사람이 많아서 좀 정신없긴 했지만😂 핫플 즐기려면 어쩔 수 없쥬. 디저트 종류가 많지는 않았지만 커피와 곁들이기에 좋은 메뉴들이 알차게 준비되어 있던! 배불러서 안 먹으려다가 괜히 아쉬워서 에그 타르트 하나 함께 주문했다. 메뉴판에 드라이플라워 한 송이가 함께하니 더 감성적이던💕 나는 따듯한 플랫화이트, 그렛이는 아이스 바닐라 라떼로 주문! 성수동 카페들 특징처럼 낡은 주택을 개조한 카페였는데 구석구석 화분들이 더해져서 편안한 분위기였다. 1층이 없어서 2층에 겨우 자리 잡음! 2층에 옷이랑 가방 신발 등을 판매하고 있었는데 알고 보니 온라인 쇼핑몰 체리코코의 매장이었다. 커피 먹다가 급 옷 쇼핑하기 딱 좋음 ㅎㅎ 참고로 그렛이는 커피 다 마시고 이곳에서 기가 막히게 핏이 잘 어울리던 아이보리 컬러 코드류이 팬츠를 겟 했다. 테이블에 손님이 꽉 차있을 때는 좁은 공간에 꽉 찬 느낌이라 좀 답답했는데 손님이 좀 빠지고 나니 구석구석 인테리어 디테일들을 즐겨 볼 수 있었다. 따듯한 플랫 화이트와 아이스 바닐라라떼 그리고 에그 타르트! 성수동 핫플 카페들 올 때 요즘 기대 안 하고 오는 편인데 이 집 커피 잘 하네. 그렛이가 주문한 아이스 바닐라 라떼를 마셔보진 못했지만 (감기 걸려서 조용히 내 것만 마심) 적당히 달달하니 진해서 맛있다고 했고 내가 주문한 따듯한 플랫 화이트 또한 진하면서도 우유의 부드러운 풍미가 좋았다. 이날 그렛이 생일 전에 만난 거여서 선물도 함께 찍어봄💙 에그 타르트 또한 말랑말랑하면서도 겉은 바삭해서 커피와 부담스럽지 않게 곁들이기에 좋았다. 아메리카노와 먹었다면 더 잘 어울렸을 듯한 메뉴! 규모 자체가 많이 크지는 않지만 1,2층으로 구성되어 있고 플라워 & 디저트 카페에 내부에 체리코코 매장도 있어서 구경할 거리가 많았던 감성 카페 클레멘타인. 주말에 방문하니 워낙 핫플이라 정신없긴 했지만 커피와 디저트 맛 좋았고 꽃 구경, 소품 구경, 옷 구경하는 재미가 있었던 아기자기하게 다양한 콘셉트가 있던 카페였다. 사람 너무 복잡하지 않은 시간대 노려서 다시 방문해 보고 싶은 카페. 성수동 플라워 & 디저트 카페 clementine 클레멘타인"
성수동 플라워카페 클레멘타인카페 찐핫플 방문후기,"여기는 인스타로 핫해서 예전부터 가고싶었던 클레멘타인카페 였어요! 성수동에 간김에 얼른 가봐야겠다 하고 바로 고고씽! 입구부터 꽃들이 예쁜 나무와 꽃들이 가득가득!! 야외테이블도 있고, 중간중간 꽃들로 꾸며진 곳들이 감성적이에요 🥹✨ 입구를 지나서 클레멘타인카페 안으로 들어가면 이렇게 예쁜 꽃들이 주르륵~~ 전시되어 있답니다! 물론 구매도 가능하다고 해요 ✨🫶🏻 특이하고 갬성적인 꽃들이 아주 많았어요!! 💐 꽃 옆에는 이렇게 대형 전신거울이 쨘! 있어용 ⭐️ 거울을 보면 전신샷도 빠질 수 없죠!? 1층에는 자리가 없어서 2층으로 올라갔어요!! 2층에 올라가야 예쁘게 사진찍을 수 있는 장소가 있거든요!😍 이렇게 벤치에 앉아서 찰칵! 😎📷 꿀팁은 해가 쫌 있을 때 낮에 가서 찍으면 더 예쁘게 나오더라구요!! 또 2층에는 의류들과 가방,신발 파는 작은 상점도 있어요! 커피마시며 구경가능요 ☺️ 성수동 , 서울숲에 방문했다면 꼭 ! 한 번은 인스타감성으로 가볼만한 클레멘타인카페에요!💐 지금까지 찐방문후기였땁니다! 🫶🏻 성수클레멘타인 서울숲클레멘타인 50m © NAVER Corp. 클레멘타인 서울특별시 성동구 서울숲2길 5-1 1층"
