title,content
성수동 업사이드커피 연무장점,"위로 갔다~ 옆으로 갔다~ 두 세달에 한 번씩은 꼭 찾는 것 같은 성수동 업사이드커피. 뚝섬점,성수점 말고 이번에는 연무장점으로.... 새로운 지점을 오픈할 장소를 물색하고 있다는 인스타 피드가 올라왔을 때 용산쪽도 후보지에 있다고 해서 우와아아~ 물개박수 치며 좋아했는데 흑흑 까비여...... 생각보다 매장은 좀 작았다. 이번 매장의 컨셉은 블루블루인가??! 통창으로 사람 구경하기 좋은 곳 성수동 업사이드커피 연무장. 이 쪽은 하도 옷 잘 입는 사람이 왔다리 갔다리 해서 진짜 바깥 구경 하는 걸로도 시간이 너무 잘간다. 메뉴판은 패드로 확인이 가능했다. 매장 이용시 1인 1잔이 원칙이고 테이크 아웃시 모든 음료는 1000원 할인! 노트북 이용시간은 1시간으로 제한한다고 한다. 무얼 시킬까... 하다가 나는 아메리카노를 주문했고 같이 온 사람은 우유와 시럽이 약간 들어간 이 곳의 시그니처 중 하나인 업사이드커피 를 주문했다. ..? 왠 일로? ㅋㅋㅋㅋㅋㅋ 성수동 업사이드커피 연무장점에서는 디카페인도 가능하다. 대신 오백원 추가여! 아메리카노를 주문하니 원두 선택의 시간도 오네요. 저는....umm...에티오피아로 하겠습니다~ 옆에는 디저트 몇 개가 있어서 사진만 찰칵. 쿠키는 마카다미아,초콜렛,말차 총 세가지고 있고 그 옆에는 연무장커피에 쓰이는 쿠키가 있었다. 따로 단품으로 주문가능한지는 물어보진 않았는데 진열이 되어 있는 거롤 보아.. 가능하겠죠? ㅋㅋㅋ 여긴.. 파운드케이크가 진짜 맛있다. 지난 번에 먹어보고 생각보다 넘 괜찮아서 깜놀했음. 물론 저녁식사를 하기 직전이라 많이 먹진 못했지만 그렇지 않았다면 허버 허버 다 먹었을것이당. 사진을 찍다 발견한 희소식! 성수동 업사이드커피 연무장점 오픈행사로 3개월 동안 시그니처 메뉴를 제외한 커피메뉴는 500원 추가 할인이 된다고 한다~ 꺄호우 앗..근데 와이파이가 제공이 안되는구나. 그건 몰랐넹. 이제는 그냥 카페라고 부르기엔.. 넘나 커져버린 upside coffee. 기프트카드도 있다. 옆에는 마켓컬리에서도 만나볼 수 있는 RTD 커피 네 종류가 주루룩. 다 마셔봤는데 솔티드카라멜>아메리카노>카페라떼>바닐라빈라떼 순으로 내 입맛에 맞았다. 가격도 넘 저렴하게 나와서 마켓컬리에서 무료배송쿠폰이 올 때마다 꼭 한 두개씩 넣어서 주문하고 있음 ㅎㅎ. 이 날 솔티드 카라멜 두 개 구매완료. 드립백커피도 있어요. 업사이드 미어캣..넘나 귀여운 것 선물용으로도 괜찮을 것 같다. 아메리카노와 업사이드커피 한 잔. 무조건 미어캣도 같이 찍어줘야 성이 풀림.. ㅋ 물개 같으면서도 그냥 멍멍이 같으면서도 여튼 아이가 참 공손하다. 여기 아메리카노는 참 기본에 충실한 것 같다. 진짜 적당-히 고소하고 적당-히 시고... 참 맛있게 마셨다. 첫 도전한 이 곳의 시그니처. 크기는 플랫화이트 먹을 때랑 비슷하게 쪼만하게 나오는데 이 쪼만한게 굉장히 맛있었다. 나는 단 걸 많이 안좋아한다 하지만 아메리카노 같은 커피는 별로다 싶으면 무조건 이거!! 단 온도는 좀 미지근하게 나온다. 성수동 업사이드커피 연무장 직원님이 아주 친절하게 음료 설명을 해주셨다. 첫 맛이 좀 더 달고 가면 갈수록 커피의 맛이 더 진하게 올라왔다. 고급스러운 맥심커피를 마시는 느낌이 들기도 하고.... 이건 난 커피 써서 싫어~ 하는 사람도 백타 맛있다고 먹을 듯......... 업사이드 연무장점. 잘 마시다 갑니다용~! 50m © NAVER Corp. 업사이드커피 연무장점 서울특별시 성동구 성수일로 45 1층 #성수동커피맛집 #성수동카페 #업사이드커피연무장점"
성수동 카페 모음 zip. 업사이드커피/칸토성수/오푸,"성수동 카페 모음zip. 따라오면 실패할 일 없음 업사이드커피 / KANTO 성수 / 오푸 성수동 하면 요즘 제일 핫하고 팝업스토어가 자주 열리는 동네 중 하나다 -! 열심히 놀고 난 뒤에 카페를 찾는 사람들을 위해 준비한 이번 포스팅 오늘 추천하는 성수동 카페 3곳은 다 내돈내산으로 다녀오고 쓰는 솔직리뷰이니 참고 ^_^ 업사이드커피 🌏 서울 성동구 왕십리로14길 19-1 1층 업사이드커피 ☎️ 070-8691-4107 🏷️ 해방촌에서 시작한 업사이드 🏷️ 서울 전역 귀여운 미어캣 전파 중 미어캣카페로 유명한 업사이드커피 성수동에는 두 지점이 있는데 성수점과 뚝섬점. 예전엔 연무장점도 있었던 것 같은데 현재는 사라진 것 같구 .. ㅜㅜ 성수동 직장인 시절에 테이크아웃하러 자주 들렀던 곳은 뚝섬점이다 카페 들어서자마자 온 세상이 미어캣 천국 협소하지만 내부에 테이블 좌석도 있다 업사이드커피 오면 흔한 커피 메뉴 말고, 해방촌 커피(크림+플랫화이트) 뚝섬 커피(아이스크림+라떼) 업사이드 커피(시럽+우유+커피) 연무장 플랫(아몬드우유+시럽+커피) 8호점 커피(캐모마일+배+라이트블랜드) 요 시그니처 메뉴를 먹어보는 걸 적극 추천함! 한때 업사이드에 미쳐서 시그니처 메뉴들 도장 깨기 하고 다녔음 그 정도로 성수동 최고의 라떼 맛집 tmi) 종이컵 귀여워서 한때 모으는 게 취미였다고 한다 ^^ 300m © NAVER Corp. 업사이드커피 뚝섬점 서울특별시 성동구 왕십리로14길 19-1 1층 업사이드커피 업사이드커피 서울특별시 성동구 연무장13길 3 KANTO 성수 🌏 서울 성동구 연무장길 20 지하1층 ☎️ 0507-1343-3657 🏷️ 블랙 무채색 흑백카페 🏷️ 컨셉 확실한 연무장길 핫플 칸토하면 무채색ㆍ흑백ㆍ블로그 리뷰만 500+ 회사 언니랑 평일에 반차 쓰고 다녀와야 할 정도로 지독한 웨이팅 카페였지만 연무장길에서 워낙 핫하고 한때 인스타 피드에 칸토에서 찍은 사진 안 올리는 사람이 없었음.. 블랙 성애자라면 감동받을 듯 한편에는 이렇게 전시 공간처럼 꾸며둠 -주문내역- 플랫 블랙 6.0 블랙 크림 6.5 블랙 파운드 5.5 에브리띵 블랙이다 이것이야.. 처음엔 흑임자 디저트인가 했는데 초코 파운드 케이크+크림 맛 +_+ 디저트까지 시커 메서 속을 도통 알 수 없네 ㅋ 디저트와 시그니처 커피 맛 훌륭하고 블랙&화이트 인테리어도 사진 찍기 좋아서 꽤 만족스러웠던 칸토 성수. 50m © NAVER Corp. KANTO 성수 서울특별시 성동구 연무장길 20 지하1층 오푸 🌏 서울 성동구 뚝섬로 408-7 3층 ☎️ 0507-1368-3258 🏷️ 하다 하다 소파까지 만들어먹는 세상 🏷️ 인테리어 예쁜 인스타 카페 소파 모양의 유니크한 디저트가 있는 카페, 오푸 우연히 인스타에서 어떤 분이 올린 사진 보고 여기 어디야 무조건 가야 해; 외치며 보니까 성수동이길래 ㄱㅇㄷ 외치며 다녀왔었다. Oh! Sofa - 15.0 (화이트초콜릿+커스터드+딸기+피스타치오) 근데 이 소파 디저트 가격이 사악해서 시켜야 돼 말아야 돼 했는데 그래도 시킴.. ㅋ 아이스크림케이크라 10분 뒤에 먹을 수 있다 처음에 개딱딱해서 포크로 아무리 잘라도 소용없음 ^^ 자두에이드 - 6.5 리치 로즈 에이드 - 6.5 그라데이션 영롱한 거 보세요 인조적인 맛이 안 나서 좋았던 에이드 아주 상콤하고 톡톡 트로피카나 st.. 오푸,,에이드 맛집으로 인정합니다 50m © NAVER Corp. 오푸 서울특별시 성동구 뚝섬로 408-7 3층"
서울 성수동 카페거리 업사이드커피 귀여운 해방촌커피,"업사이드커피 #성수카페 #성수동카페거리 📍 서울 성동구 연무장13길 3 ⏱️ 평일 08:00 - 21:00 / 주말 09:00 - 21:00 🅿️ 주차장 없음 서울 핫한 카페들이 모여있는 성수동 카페거리!! 그중에서도 크림 커피가 아주 맛있다고 소문난 업사이드커피에 다녀왔다✨ tmi,, 친구 만나러 가기 전 1시간 일찍 나와서 여유롭게 커피 마시고 가려고 했는데 출근시간이라 차가 너무 밀려서 계획 실패ㅠㅠ 결국 30분 넘게 달려와서 주차할 곳 찾느라 뱅글뱅글 돌다가 결국 커피 5분 컷하고 호다닥 나왔당 ㅋ.ㅋ 메뉴 업사이드커피의 메뉴👀 요기는 시그니처 메뉴가 다양하게 있었다! 해방촌 커피, 뚝섬 커피, 성수 커피, 업사이드커피, 연무장 플랫,,,, 이름만으로는 도저히 정체를 파악할 수 없는 음료들ㅋㅋㅋㅋㅋ 다행히 이름 옆에 뭐가 들어가는지 설명이 적혀있었다! 궁금한 건 많은데 질문 못하는,, 극I 내향인은 이런 배려 너무 감사해요🥹❤️ 나는 그중에서도 크림 올라간 게 유명하고 맛있다는 후기가 많아서 해방촌 커피로 주문했다😊 커피로 유명한 곳답게 원두 종류도 앞쪽에 설명이되어있었다ㅎㅎ 내가 주문한 해방촌커피는 원두 선택이 해당되지 않아서 그냥 스윽 훑어보고 지나갔당🤭 디저트 종류는 파운드랑 쿠키가 있었고 업사이드커피는 쿠폰을 보관해 주는 시스템인가 보다! 위쪽에 쿠폰이 잔뜩 담긴 바구니도있었당ㅎㅎㅎ Let's take awawy! 포장은 1,000원 할인을 해준다! 카페 내부 브루잉 커피 내리는 모습을 볼 수 있는 바 자리도 많이 있었고 안쪽에는 로스팅실이 있었는데 밖에서 다 보이도록 되어있었다✨ 밖에 생두 포대도 잔뜩 쌓여있고 안에서 사장님이 로스팅하는 모습이 보이는데 완전 멋짐 뿜뿜이였당ㅎㅎㅎㅎㅎ👍🏻 내가 주문한 해방촌커피는 저렇게 포스터로도 붙어있었다ㅎㅎㅎ 작은 잔에 라떼와 크림이 올라가 층이 나눠진 예쁜 음료,,를 기대했는데,,,!!! 이렇게 귀여운 음료가 나와서 좀 당황했다ㅋㅋㅋㅋ 매장에서 먹고 가면 이렇게 주는가보당,,🤣 업사이드커피의 마스코트인 미어캣 얼굴이 컵이랑 크림 위에도 올라가있었당ㅎㅎㅎ 티코스터에도 있지롱~~~~🤭 귀여운 얼굴,, 먹기 아깝지만 나에게는 시간이 없었기에 일단 섞어봄ㅋㅋㅋ 윗부분만 슥슥 섞어주고 크림이랑 커피 같이 호로록 마셨당😋 역시 크림커피는 실패없지!! 요건 음료 기다리면서 한쪽 벽에 스티커가 잔뜩 붙어있길래 구경했는데 내가 좋아하는 카페들의 스티커도 보여서 너무 반가웠다! 부산의 레이지모먼트커피스탠드와 서울 상봉역쪽에있는 포츠커피! 두세 모금 홀짝 마시고 포장해서 나왔당ㅎㅎㅎ 다음엔 꼭 여유롭게 가서 커피를 다 마시고 와야지ㅠㅠ 디저트도 먹어야지!! 다음을 기약하며,, 안뇽 미어캣❤️ 50m © NAVER Corp. 업사이드커피 서울특별시 성동구 연무장13길 3 #업사이드커피 #성수업사이드커피 #해방촌커피 #업사이드커피시그니처 #성수카페추천 #성수크림커피"
"성수동 카페, 업사이드커피 뚝섬점 달달한 해방촌커피 꿀맛","성수동에 머리 받으러 갔던 날 머리카락에 수분 채우고 나오는 길에 1층에 있던 업사이드커피 뚝섬점에 들렀어요 귀여운 미어캣 간판이 눈에 띄는 이곳 전부터 가보고 싶었던 카페였는데 예약한 미용실 바로 아래층에 있다니!!! 지나칠 수 없었기에 머리 끝나고 바로 가봤어요 밖에 앉을 수 있는 테이블, 의자가 있었지만 날이 추워서 앉아계신 분은 없었네요 언뜻 봐도 사람이 많아 보이는 데다가 다음 일정이 있기도 했고 천원 할인도 해준다고 하길래 내심 테이크아웃 해야겠다 맘먹고 들어갔어요 평일에 일찍 오픈하니까 회사가 근처였다면 출근 도장 찍었을 텐데 아쉽다아 생각하면서...! 마지막까지 뚝섬 커피랑 고민하다가 해방촌커피(6.0) 주문했어요 테이크아웃이라 할인받아서 5천원 결제했네요 디저트류는 없는 줄 알았는데 스모어쿠키도 있더라구요 점심을 배불리 먹었던 날이라 패스했지만 다음에는 커피랑 같이 맛보고 싶네요 귀여운 머그잔 보니까 급 욕심났지만 이미 컵부자라 꾹꾹 눌러 참고 주문이 꽤 있는 것 같아서 카페 둘러보면서 기다렸어요 다양한 원두에 드립백, 펜, 코스터까지 있더라구요 여기 원두도 유명한 듯했는데 다음에는 구매해봐야겠어요 마켓컬리에서도 즐길 수 있다니 장바구니에 담아뒀다가 주문해봐야겠다 싶었네요 기다리다 보니 매장이 한산해져서 내부 사진 찍어봤어요 테이블은 3개 정도, 바 형태로 4자리 정도인 아담한 성수동 카페예요 문 옆에는 테이크아웃 기다리기 딱 좋게 의자도 2개 놓여있어요 자리 나서 앉아서 기다리다 보니 곧 주문한 음료가 나오더라구요 잘 섞어서 마셔야 맛있다고 알려주시면서 하트 빨대랑 같이 챙겨주셨어요 홀더 때문에 잘 안 보이지만 살짝 보이는 커피 색깔만 봐도 이미 맛있는 느낌 :) 넘치지 않도록 조심하면서 휘휘 저어서 잘 섞어준 뒤 마시면서 지하철역으로 향했는데 오- 맛있어요♥ 플랫화이트와 크림의 조합이라니 최애 조합이라 맛있을 줄 알았지만 진짜 맛나더라구요 나른해지는 시간이었는데 커피 한 잔으로 기분 좋아진 오후였어요 집이나 회사 근처에 지점이 생기기를 기원하며!!! 다음에는 뚝섬커피도 마셔봐야겠어요 :D 50m © NAVER Corp. 업사이드커피 뚝섬점 서울특별시 성동구 왕십리로14길 19-1 1층 업사이드커피 영업시간 평일 8:00 - 20:00 주말 9:00 - 20:00 ☎ 070-8691-4107 - 내돈내산 솔직 리뷰입니다"
"[커피, 어디서든!] 숙대입구 카페/와인바 오오비, 성수동 업사이드커피 연무장점, 연산동 다저트카페 두살차이","이거 약간,, 그간 다녀 온 괜찮았던 카페들 한번에 몰아서 끝내기~ 느낌 없지 않아 있지만,, 나름 처음부터 ‘어디서든 커피를 마신다,, 서울이든 부산이든,,’을 컨셉으로 잡고 사진 모아뒀다는 거 ^^ 그렇게 스스로 괜히 한번 더 힘주고 시작하는 이번 포스팅, 첫 번째는 #카페오오비 50m © NAVER Corp. 오오비 서울특별시 용산구 한강대로 268-1 2층 #오오비 #카페오오비 #남영동카페 #숙대입구카페 #서울역근처카페 여기다, 서울..! 숙대입구역이랑 가깝고, 나는 카페시바 찍고 식후 커피 마시러 갔음~ 찾아간 이유를 말하자면 요런 분위기 좋아보여서! 요런 엘피바 느낌~ 낮은 카페, 밤은 와인바로 즐길 수 있는 공간이었다. 밤에 와인 마시면 짱 좋겠는데~ 하지만 햇살이 이렇게 들어오는 낮의 오오비도 참 예뻤다. 따스한 색감 좋아 햇살 필터가 역시 짱이야! 나 아마 밀크티? 마시려고 했는데 안된대서 호기심에 시켜본 브라운치즈라떼~ 보이는 그 맛이다. 단짠! 호록! 분위기 너무 좋아~ 사진으로 전할 순 없지만 당연히 음악도 계속 좋았고, 걸려있는 포스터들도 맘에 들었다. 칭구들이랑 주말 오후에 만나서 오~래 앉아 수다떨기 딱 좋은 곳 같았다. 다음은, 사진으로 봐도 어김 없이 날씨 참 좋았던 어느 주말~ 성수동 열심히 돌아다닌 날, 편안하게 머물렀던 #업사이드커피 연무장점! 50m © NAVER Corp. 업사이드커피 연무장점 서울특별시 성동구 성수일로 45 1층 #업사이드커피연무장점 #성수동업사이드커피 #성수동카페 #서울숲카페 코너 1층에 있는 작은 카페다. 좁지만 통유리창이라 갇혀 있는 느낌보다 뚫려서 통하는 느낌이 좋았음~ 업사이드~ 귀엽군~ 매장이 넓지 않아서 테이크아웃 손님들이 많았는데, 나는 다음 일정까지 틈새 시간이 나서, 잠시 앉았다 가기로 했다. 이 날 마신 커피. 처음 온 카페인데, 뭔가 고유한 중심이 느껴질 때면 어떻게든 시그니처 메뉴를 먹어보려고 하는 편이다. 근데 시그니처가 무려 4가지? 나 돼서 ㅎ 고민하다 주문한 #연무장플랫 아몬드우유+시럽+커피 조합의 연무장 플랫은 이대로 들고 크게 호로록 마셔야 한다고 했다. 가볍게 고소한 아몬드우유의 살짝 빈 곳을 달달한 시럽이 잘 메워주는 맛있는 커피였다. 아주 굿,, 언젠가 또 한 숨 돌리고 싶을 때 슬쩍 들러 한 잔할 만한 곳인 것 같다. 그리고~ 다시 부산으로 돌아와서, 편안하게 들러 케이크 한 조각 후다닥 해치우게 되는 곳, #연산동디저트카페 #카페두살차이 ✌️ 50m © NAVER Corp. 카페 두살차이 부산광역시 연제구 안연로 12 1층 카페 두살차이 #연산동두살차이 #연산동카페두살차이 #연산동카페 #연산동케이크맛집 이렇게 다양한 조각케이크가 아주 사랑스럽게 쇼케이스를 가득 채우고 있다. 케이크뿐 아니라 이렇게 쿠키, 구움과자들도 다양해서 고르는 재미가 아쥬 쏠 ~ 쏠 ~ 너무 귀여워서 아무래도 쿠키도 하나 해야겠다 생각한 순간인듯 👀 이 날 내 선택을 받은 케이쿠는 이름마저 귀여운 #푸우의꿀단지 🍯 시나몬이 곱게 사르르~ 아, 귀여운 커피콩쿠키도 같이 주문했는데, 달지 않고 살짝 쌉싸름한 맛에 파삭하면서도 밀도 있게 씹히는 식감이 계속 먹게 되는 쿠키였다. 케이크는 꿀카스테라라고, 엄청 부드럽고 달달한 카스테라에 더 부드러운 크림, 시나몬의 풍미가 기분 좋게 퍼지는 짱맛 케이크였다. 폭 폭 크게 떠먹을 수 있는 케이크,, 정말 힐잉이야,, 조만간 또 한 조각만큼의 행복,, 돈으로 사러 출동해야겠어,,💪🍰 괜히 붙이는 마무리 사진은, 고모가 집에 놀러와서 아침으로 차려 준 (차렸다고 할 수 있나 모르겠네 🤥) 내 취향 조식 한상 ㅋㅋ💛 언제 먹어도 좋지만 아침으로 먹기에도 딱 좋은 칭구들 다 데려다 소개시켜줬다구~ 그럼 끝! 또 어디서 커피를 마셔볼까🤎"
"성수동 주민의 주간일기 ep.38 (업사이드커피, 성수 마씨, 프라이데이 무브먼트)","어느새 싱그러운 초록색으로 물든 5월의 서울숲. 아침저녁으로는 선선하지만, 한낮에는 햇살이 무척이나 따가워져서 언제 불현듯 여름이 들이닥칠지 긴장 아닌 긴장이 되기도 한다. 1년에 며칠 안 되는 황금 같은 계절을 즐기려고 하는데 요즘 왜 이렇게 바쁜지. 회사 업무 바쁜 건 이제 예삿일이 되어버렸고, 이탈리아에 다녀온 지는 벌써 한 달이 지났는데 블로그에 여행기는 아직 프롤로그를 갓 시작하는 단계다. 그런데 나는 며칠 뒤면 다시 영국으로 출국한다. 오 마이 갓 @.@ 그래도 주말마다 틈틈이 친구들도 만나고 동네 산책을 하며 업사이드커피, 성수 마씨, 프라이데이 무브먼트에서 소소하게 즐거운 시간을 보냈다. 6월부터는 워라벨도 좀 더 신경 쓰고 주변 사람들도 잘 챙기고 더 부지런하게 놀아야지. 평소보다 조금 빈약하지만, 5월 2~3주 주간일기 시작 :) May 13th, Saturday @ 업사이드커피 오래간만에 오빠랑 건대까지 나들이를 갔다가 다시 집로 돌아오는 길에 더위를 피해 업사이드커피에 들렀다. 참고로 업사이드커피는 내가 간 성수동 카페거리 근처 외에도 뚝섬점, 연무장점이 더 있다. 세 군데가 각각 분위기가 조금씩 다른데 여기가 가장 넓은 편. 미어캣 두 마리가 꼭 껴안은 모습의 캐릭터가 너무 귀여워서 마음이 몽글몽글 따뜻해진다. 오빠랑 함께 가는 날에는 그림처럼 대롱대롱 매달리게 됨. 굿즈가 뭔가 예전보다 많아진 느낌인데 귀염 뽀짝 해서 정신을 바짝 차리지 않으면 나도 모르게 계산을 하게 될 듯하다. 실내에도 자리가 났지만 야외에 앉기 적당한 시기가 얼마 남지 않았다는 생각에 밖에 앉았다. 특별한 뷰는 없고 주차된 차들이 주로 보였지만 그래도 바깥이라고 숨이 더 트이는 느낌. 이날의 픽은 시원하고 깔끔한 아이스 아메리카노랑 아이스크림, 쿠키 크럼블이 들어가 달콤 그 자체인 뚝섬 라테. 그늘에서 달달구리를 홀짝이자니 주말을 옳게 사용하고 있다는 생각이 들어서 기분이 더욱 좋아졌다. 50m © NAVER Corp. 업사이드커피 서울특별시 성동구 연무장13길 3 May 14th, Sunday @ 성수 마씨 성수동 돈가스계의 최고 존엄이라는 성수 마씨에 드디어 방문했다. 연무장 길에는 여전히 사람이 많았지만 점심시간을 살짝 비켜서 갔더니 웨이팅은 30분 내외였다. 거기다 출입문 쪽에 자그마하게 대기 공간이 마련되어 기다리기도 괜찮았다. 실내는 2~4인용 테이블과 혼밥 하는데 딱인 바 좌석이 골고루였다. 밖에서 보이는 것보다는 더 넓은 듯한 느낌. 특이하게 손을 닦는 세면대가 가게 내부에 있었다. 포스트 코로나 시대에 잘 맞는 인테리어 같다. 성수 마씨의 시그니처인 안심카츠. 사진에서도 촉촉함이 보이는 것처럼 고기가 정말 부드러우면서 겉은 바삭함을 유지 중. 소금, 고추냉이를 번갈아가면서 곁들이면 담백하고 너무 맛났다. 살짝 느끼해질 땐 아삭한 양배추 샐러드가 진리. 치즈 카츠는 큼직하게 네 피스가 나왔는데 한 입 먹자마자 고소함 폭발이었다. 치즈가 금방 딱딱해지는 게 아니라 꽤 오랫동안 부드럽게 늘어져서 좋았다. 천천히 먹다 보면 어느새 굳어버리니까 치즈 카츠를 시키기 망설여지기도 하는데 여기서는 그럴 걱정은 접어두어도 된다. 일일 수량이 한정적인 특 등심 카츠는 품절이라서 이번엔 못 먹어봤는데 다음에 오픈런으로 도전할 예정. 50m © NAVER Corp. 마씨 서울특별시 성동구 연무장길 29-1 1층 May 20th, Saturday @ 프라이데이 무브먼트 뚝섬에서 제일 힙한 카페를 알려달라고 하면 가장 먼저 머릿속에 떠오르는 프라이데이 무브먼트. 매장 바깥의 캠핑 의자에 앉으면 기분이 한층 더 좋은데, 이날은 비가 와서인지 야외 자리는 없었고 안으로 들어갔다. 한쪽은 의류 및 서핑, 캠핑 용품 편집숍으로 운영 중. 나랑 맞는 스타일은 아닌데 그래도 한 번씩 둘러보게 되는 매력이 있다. 그리고 여기는 자타 공인 카눌레 맛집! 파리 감성 낭낭하게 개별 포장된 단품이나 고급 진 4구, 9구짜리 선물 박스 등 구성도 다양하다. 지금까지 프라이데이 무브먼트에서 카눌레를 사줬을 때 누구나 호평 일색이었다. 나의 최애 조합은 크림에 시나몬 가루가 올라간 커피와 진한 풍미의 카눌레. 겉은 캐러멜 라이즈드가 잘 되어서 되게 바삭한데 속은 촉촉하고 찰진 데다 생각보다 많이 달지 않아서 꼭 쌉싸름한 음료가 아니라도 조합이 괜찮다. 디저트 러버라면 1인 1 카눌레 필수! 50m © NAVER Corp. 프라이데이무브먼트 서울특별시 성동구 왕십리로14길 7 1층 프라이데이무브먼트 # 업사이드커피 # 성수 마씨 # 프라이데이 무브먼트"
성수동 카페 업사이드커피,"가보고싶었던 성수동 카페 업사이드커피 지도를 잘못봐서 어딘가 막 헤맸던 곳 ㅠ ㅋㅋ 쿠키랑 파운드케익이랑 다 너무 맛있어보인다. 성수동 카페 업사이드커피 메뉴와 가격 시그니처를 마셔보기로했다. 엄청 고민하다가 주문했는데 해방촌 커피를 시켰는지 성수커피를 시켰는지 결론적으로 기억이 안남... 성수동 카페 업사이드커피 내부 엄청 깔끔하고... 분위기 괜찮음. 강아지인가? 수달인가? 캐릭터 진짜 잘만들었다고 생각함. 주문한 메뉴 나왔다! 나의 녹차맛 사랑 ㅎㅎㅎ 말차파운드케익 주문 아니 꾸민거도 귀여운데 컵도 귀여워 ㅠ 위아래 판박이얌 음료는 달달~허니 맛있었다. 요런 커피는 사실 맛이 다 비슷한데, 왜 맨날 먹고싶은걸까? ㅎㅎ 친구가 주문한 아메리카노 컵도 너무 귀여워.... 바닥에 코스터 먼데... 귀여워... 강아지인가.... 파운드 케익도 땅땅하니 맛있었다. 딱 내가 바라는 카페의 파운드케익 맛이라고 해야하나 ㅎㅎㅎ 묵직- 한 맛이 참 좋음 테이크아웃은 1천원 할인이라고! 굿 50m © NAVER Corp. 업사이드커피 서울특별시 성동구 연무장13길 3 인기많은 성수카페, 지점이 여기저기 생긴 이유를 알겠다. 컨셉이 뚜렷한 느낌. #성수역카페 #성수동카페 #성수카페 #성수동커피 #자연도소금빵 버버리팝업 밖에서 구경하기 (지금은 업서졋나? ㅎㅎ) 최소 반이상 -_ ㅠ 그래서 어제 잠도 못자고 오늘 지각하고 난리 .. ^ ^"
