title,content
서울 성수동 플라워카페 클레멘타인 내돈내산 후기 꽃도 주문 가능한 편집샵 분위기의 카페에요 데이트 장소로 왕추천,"뚝섬역 가볼만한 데이트장소 클레멘타인 플라워카페 서울 성동구 서울숲 2길 5-1 1층 영업시간 11:00 - 21:00 포장, 무선 인터넷, 반려동반 동반 글 사진 © sangsangworld.All rights reserved. 소중하게 직접 담은 사진들을 임의로 사용하지 마세요. * Z플립4로 촬영된 사진입니다. 플라워카페 클레멘타인 외부 분위기 글 사진 © sangsangworld. 안녕하세요. 상으이에요! 오랜만에 서울 나들이를 다녀와서 서울 포스팅 가지고 왔어요! 워낙 가고 싶었던 곳도 많았기때문에 폭풍 검색을 하게 되었어요 ♥ 이번 서울 여행 속 포스팅은 모두 내돈내산으로 경제적 대가 없이 순수한 마음으로 작성하게 되었어요. 그리고 여기 플라워 카페는 워낙 꽃을 좋아하기도 하고 분위기가 너무 좋아보여서 선택하게 되었어요. 1층과 2층으로 구성된 클레멘타인 카페는 주택 개조형 카페 같은 분위기로 주택가들 사이에 있는 카페에요. 1층과 2층에는 테라스 공간도 있어서 날씨가 좋은 날에는 이런 공간에서 즐겨도 너무 좋을 거 같아요. 오늘은 너무 추우니깐 빠르게 내부 공간으로 입장해볼게요 ~♥ 플라워카페 클레멘타인 음료 & 디저트 메뉴 글 사진 © sangsangworld. 플라워 카페이니만큼 티 종류를 즐기고 싶었지만, 빠르게 달달한 메뉴를 골랐어요. ㅋㅋㅋㅋㅋ언행불일치 빠르게 메뉴를 고르고 나서 내부 공간을 구경했어요. 내부 공간이 너무 예뻐서 구경하는 내내 행복했던 거 같아요. 따스한 색감의 조명과 곳곳에 보이는 꽃들이 아주 마음에 드는 공간이였어요. 지금까지의 사진 속 공간이 1층 공간이에요. 1층에는 주문 가능한 공간과 테이블로 구성되어 있고, 플라워 작업하시는 공간도 있더라구요. 아 꽃만 봐도 기분이 좋아지네요~ 플라워카페 클레멘타인 내부 분위기 글 사진 © sangsangworld. 2층 공간은 다른 카페들과 달리 다양한 디자인의 여성 옷을 구경 할 수 있는 편집샵 공간이 있더라구요. 꽃도 구경 할 수 있고, 커피도 마실 수 있고, 다양한 의상이나 가방도 구경 할 수 있는 공간이여서 뭔가 복합문화공간 같은(?) 그런 느낌이였어요. 뭔가 조화로워서 이상하거나 부담스럽지 않았던 공간이에요. 주인장 찾기 평일 오후 시간에 방문했더니 손님이 많지 않아서 여유롭게 공간을 구경하고 둘러봤던 거 같아요. 주문한 솔티카라멜밀크와 바닐라빈라떼 그리고 디저트 딥초코케이크에요 ~♥ 제가 선택한 솔티카라멜밀크는 정말 달달한 카라멜 우유 느낌이였어요. 너무 너무 달달해서 힘 불끈 나는 맛이에용 달달한 음료 좋아하시는 분들께 추천이용 딥초코케이크는 빵 시트 부분이 약간 푸석한 식감이여서 살짝 아쉬웠어요.ㅠㅠ 디저트 종류가 약간 아쉽다는 리뷰를 본적이 있는데 이런 부분 잘 개선하면 더 사랑 받는 카페가 되겠다 싶었어요! 그래도 클레멘타인이라는 카페에서 귀여운 소품들과 반려 식물들이 너무 아기자기한 공간이여서 공간에 머무는 동안 행복한 시간 보내고 왔어요. 눈도 즐겁고 입도 즐거운 시간이였어요. 데이트 장소로도 너무 좋을 거 같고, 인생사진을 찍을 수 있는 포토 스팟들이 많으셔서 그런지 예쁜 분들이 많은 공간이였어요. 카페 공간들이 넓고, 다양한 테이블이 구성되어 있어서 한명부터 6명 이상 여러명이 즐길 수 있는 공간의 플라워카페였어요. 1층에는 잔잔한 꽃향이 느껴져서 너무 좋더라구요. 서울숲 근처에는 정말 예쁜 감성 카페들이 많던데 제가 이곳에 찾아온 건 정말 럭키 같더라구요 히히 꽃 주문 예약도 받고 있어서 사랑하는 애인에게 선물도 해주고 커피도 즐긴다면 정말 좋겠다 싶은 공간이에요. 혹시 서울숲 그리고 성수에서 예쁜 카페를 찾고 계시는 분들께 정말 강력하게 추천해드리고 싶은 공간이에요. 오늘의 포스팅은 여기서 마칠게요. 제 블로그와 함께해주신 모든분들 행복하거나 더 행복하세요! 50m © NAVER Corp. 클레멘타인 서울특별시 성동구 서울숲2길 5-1 1층"
[성수동 카페]오픈런 해야하는 핫플! 클레멘타인 카페 다녀왔어요,"안녕하세요 챠챠밍이에요 맛따라 멋따라 일상공유는 넘넘 오래만이라 어색하네요 흐흐( ͡ ͡° ͜つ ͡͡° ) 날이 아직 따뜻할때 성수동 플랜테리어 맛집 클레멘타인에 뛰어다녀왔어요~ 사람이 많아서 앉을 자리가 없을수도 있다 하여 평일 낮 12시에 오픈런 했어요 ◝(⁰▿⁰)◜ 50m © NAVER Corp. 클레멘타인 서울특별시 성동구 서울숲2길 5-1 1층 위치 : 성동구 서울숲 2길 5-1 1층 영업시간 / 화-금요일 : 12-19시 토-일요일 : 11-21시 월요일 : 휴무 성수 클레멘타인은 옛날 주택을 리모델링 개조하여 사용하는듯 해요 1층은 카페, 2층은 옷가게더라구요 좋은것과 좋은것이 합쳐져 더 좋은 시너지를 내는 것 같아요(✿˵•́ᴗ•̀˵) 건물 만으로도 넘넘 고급스런 느낌이에요 새하얀 페인팅으로 깔끔 순수한 느낌을 잘 살린듯해요 '◡'✿ 챠챠밍은 요기 계단아래 앉았어요 곳곳에 감각적인 인테리어로 자리 비치가 되어있더라구요 골라 앉는 재미가 있어요 이 자리에 앉기위해 1시간 10분이나 걸리는 뚝섬까지 오픈런 했습니당 (๑•̀ㅂ•́)و 이제 실내로 들어가볼까요? 들어가자마자 마음이 차분해지는 기분이에요 혹시 여기 북유럽 아니죠?꒰ღ˘‿˘ற꒱ 먹고싶은 디저트도 잔뜩있지만 하나만 주문하기로 했어요 이제 메뉴판 보여드릴게요 에스프레소 4.5 아메리카노 5.0 라떼 6.0 플랫화이트 6.0 바닐라빈라떼 7.0 아이스크림라뗴 7.0 솔티카라멜밀크 7.0 탠저린바질에이드 7.0 레ㅐ몬민트에이드 7.0 루이보스 바닐라 6.0 쿨허벌 6.0 씨브리즈 6/0 챠챠밍네는 아메리카노 (5.0)와 아이스크림라떼(7.0), 얼그레이케이크(8.0)을 주문했어요 클레멘타인을 마저 둘러볼까여? 실내 자리도 넘 예쁘쥬~ 마치 꽃집에 온것같은 기분이 들어요 플랜테리어를 넘 매력적으로 가꾸셨어요 식수대가 있는곳 마저도 이렇게 예쁘기 있나요~'◡'✿ 다들 여기서 사진 엄청 찍으시더라구요 그래서 챠챠밍도 사진 찍었는데 부끄러우니까 올리진 않을게요 싱싱한 생화들이 가득해요 사장님께서 꽃 가꾸시는걸 좋아하시는것 같아요 직접 꽃꽂이를 하시는 모양이에요 직접 꽃을 가꾸시는 흔적들도 보이거든요 이런 개수대나 데크등의 소품들을 잘 활용해서 그런지 더욱더 가정집같고 친근한느낌이고 ㅎㅎ 클레멘타인이 핫한 비결인 것 같기도해요 물론 커피와 디저트도 넘넘 맛있었어요 아이스크림 라떼가 넘넘 제취향๑❛◡ુ❛๑ 얼그레이케이크도 넘 맛있었어요 크림이 넘모 소프트하구 얼그레이 특유의 알싸향긋한 향도 잘 살리셨구 전반적으로 1시간이나 걸려서 온 보람이 있다는 느낌이 들어요 커피는 산미가 약해서 챠챠밍같이 고소하고 쓴커피 좋아하는 사람들은 취저일거에요 향도 되게 복합적인 향이 우아하게 어우러진 느낌이었고 아이스크림라떼는 크흐...말해모해 아이스크림라떼 실패할수 있을리가 없쟈냐(๑>ᴗ<๑) 날 추워지기 전에 다들 클레멘타인 한번씩 들러보시는거 추천 ( ु ´͈ ᵕ `͈ )ु 오랜만에 일상 소통이라 넘모 어색하네여 ㅎㅎㅎ 이웃님들, 서울 & 근교 핫플 더더 추천해주세요 ~"
"서울 성수동 플라워카페""클레멘타인""","안녕하세요~우슬입니다:) 서울여행중에 제일 기대했던 서울숲에 위치한 핫한 카페 클레멘타인 다녀왔던 블로그기록 하려고해요. 클레멘타인 서울숲 핫한 플라워카페 위치 및 주소 서울 성동구 서울숲2길 5-1 1층 전화번호 0507-1367-3511 영업시간 매일 11:00 ~ 19:00 토,일 11:00 ~ 21:00 연중무휴 기타사항 🐶🐱반려동물 동반가능🙆🏻‍♀️ https://www.instagram.com/clementine.crko 클레멘타인(@clementine.crko) • Instagram 사진 및 동영상 팔로워 1,283명, 팔로잉 2명, 게시물 50개 - 클레멘타인(@clementine.crko)님의 Instagram 사진 및 동영상 보기 www.instagram.com 입구 및 외관 위치는 성수중,고등학교 옆 골목에 위치해있어요 하얀 카페가 클레멘타인입구에요 서울여행계획할 때 제일 기대했던 곳인데 이렇게 직접 와서 보니 더 예뻤어요💓 주말 아침에 갔는데 핫한카페답게 포토존 명당에는 사람들이 앉아 있었구 저희는 나중에 자리비면 냅다 옮기려구 일단 내부로 자리했어요ㅋㅋ 미리 생각해놓은 자리가 있어서 집중공략했어요! 내부 내부는 7테이블 정도 있구요🪑 우드톤과 화이트톤 조화가 좋았어요 클레멘타인은 내부보다 외관맛집이라 그래서 그런지 바깥에 다 앉아계시구 안에는 널널했어요 저희는 안쪽에 자리잡고 주문 먼저 했어요 메뉴 ✔️아메리카노(₩5,000) ✔️바닐라라떼(₩7,000) 클레멘타인 메뉴판 메뉴판에도 꽃이🌷 메뉴는 커피,에이드,티 종류로 비교적 심플하구요 에그타르트와 케이크 다양한 디저트들이 있어요 포장상자도 하얀색에 파란색감 넘 심플하고 예뻐요🤍 여기저기 빼놓을 수 없이 공간들이 다 예뻐요🤍💚 조명과 식물들 조합 또한 말해뭐해ㅠㅠ 여기 다 아시는 제일 핫한 포토존🌷🤍 이쪽에 플라워리스트분이 항상 계시던데 꽃도 많이 사가시더라구요ㅎㅎ 그래서 금방 꽃병이 비워졌어요 저는 그전에 한컷 찍었어요 아니 사실 한컷아니구 엄청 찍었어요😁 막 찍어도 꽃이 예뻐서 사진 잘나와요🥰 색감맛집이에요ㅠㅠ 예쁜 건 확대해서 보기💓 아,,,예쁘다 예뻐 여자아기가 꽃다발 들고 다니던데 넘 귀엽더라구요🥰 구경하는 사이 나온 커피 찐하고 고소한 라떼와 아메리카노☕️ 커피먹으며 얘기하는사이 외부 찜해놓은 자리 비어있길래 바로 옮겼어요😆 여기가 젤 예쁜자리인거 같아요 물론 다 예쁘지만요🧚🏻‍♀️ 머리에 식물🌱 여기서 사진 꼭 많이 찍으세용💐 나가면서 자리비었길래 2층으로 올라갈 때 한 컷 찍었어요 클레멘타인 1층은 카페 2층은 클레(cle)브랜드 옷가게에요 이 날 날이 좋아서 채광 잘 들어서 넘 예뻤어요 체리코코 인터넷쇼핑몰로만 봐왔지 직접 눈으로 보니까 옷들이 전체적으로 채도가 낮고 고급지고 세련미 뿜뿜 제 스타일이었어요🤍🙊 흰티에 청바지에 코트 넘나 스타일리쉬해🤍🤎 서울여행중에 제일 기대한만큼 제일 좋았어요🤍💜 클레멘타인에서 꽃구경도하고 브랜드 옷구경도 하고 눈이 즐거웠구 공간들도 다 예쁘고 여성분들이 좋아하실만한 포인트들이 너무 많아요💗 가시면 포토존에서 사진 많이 담아와주세요🙌 50m © NAVER Corp. 클레멘타인 서울특별시 성동구 서울숲2길 5-1 1층"
"서울)성수동 카페 클레멘타인, 카페 테디스베어, 진작다이닝",클레멘타인 서울특별시 성동구 서울숲2길 5-1 1층 동생 픽 카페 알고보니 내 친구도 저번주에 여기 왔었더라고? 핫플이면 또 와줘야지 사람이 넘 많아 헥헥 대기 걸어두고 성수동 돌아다니기. 2층에도 카페인줄 알고 올라갔는데 옷가게였음. 동생이 내 집게 잃어버리는 바람에 하나 사줌. 개이득. 감사감사함둥. 이런거 사주면 뭐하냐고. 맨날 집에 모셔둬서 현실은 고무줄이랑 클립으로 묶는디 테디스오븐 서울특별시 성동구 서울숲2길 43 (성수동1 가) 1층 여기도 대기걸어두기. 성수동 주말은 그냥 무조건 다 대기.. 사람 북적북적 진작다이닝 서울특별시 성동구 왕십리로14나길 10 오후 4시라서긍가 대기 없었음. 정말 감사합니다. 진짜 통구이되기 직전이였는데 살려주셔서 감사함둥. 후토마끼 처음 먹어보는데 넘 맜있고!!!! 나 오이 극혐하는데 괜찮아 맛있오 막내동생이 빵남매들 잘 있다고 보내준 사진 아이 귀여웡 엄마가 얼른 갈게 쪽 ♥ 갬성사진 찍느라 배터리 다 썼는데 하필 내 자리에 콘센트 없고... 눈치보면서 쓰고있는데 젠틀가이께서 써도된다고 했다.. 흑흑 감삼당 차라리 자리를 바꿔주시는게 어때요? 집도착하니까 선물이... 막내동생 커플의 집들이 선물.. 이런거 안 줘도되는데.. 내가 03년생한테 지금 뭘 받은거야... 암튼 고마웡 ♡ 소식좌들이라서 내가 사놓은 음식 거의 안 먹었더라?... 집 오자마자 이불빨래 겸 건빵이 산책 나 강철체력? 암튼 내 여름휴가 끝났고요.
[서울 성수동카페] 클레멘타인 | 데이트하기 좋은 감성 가득한 플라워카페 | 서울숲 근처 쇼룸이 있는 핫플,"📍 클레멘타인 [서울] [성수동카페] [내돈내산] 🏡 서울 성동구 서울숲2길 5-11 ⏰ 평일 11:00 - 19:00 주말 11:00 - 21:00 (월요일 정기휴무) 📞 0507-1367-3511 클레멘타인 서울특별시 성동구 서울숲2길 5-1 1층 꺄 여러분 저도 드디어 성수동 핫플인 클레멘타인을 다녀왔습니다 !! 외관, 내부, 인테리어 등 모든게 다 마음에 든 흔치 않은 카페였어요 ❤️ 포스팅 시작합니다 🫶🏻 외관 골목을 돌아서 이곳을 보자마자 감탄부터 나왔던 1인... 와 진짜 이쁘지 않나요 ㅠㅠㅠ 크리스마스 느낌도 톡톡히 내고 있는 저 트리도 너무너무 예쁘고 찾아오길 너무 잘했다는 생각부터 들게 만든.. 여기도 포토존 중 하나인 거 같아요 크리스마스 느낌 나는 저 장식들 너무 좋구요 역시 플라워카페답다 라는 생각이 드네요 ..ㅋ.ㅋㅋ 리스 넘 예쁜거 아니냐구~~ 우리집에도 이렇게 큰 트리 놓고 싶다라는 생각으로 찍은 사진 예전에는 오너먼트 가득한 트리가 좋았는데 요즘에는 또 오른쪾 트리처럼 심플한게 좋은 거 같기도 하구 사실 그냥 트리면 다 좋아요 ㅋㅎㅋ 예? 아직 포토존 안 끝났습닌다만 왜 데이트 장소로 추천하는 지 아시겠죠... 인생샷 찍을 수 있는 장소가 엄청 많아요 여기저기서 사람들이 찰칵찰칵 사진을 찎는데 백번 이해함... 사진 안 찍으면 손해라구요 내부 (1층) 🥺 아니 무슨일이에요 진짜 ㅠㅠㅠㅠ 꽃 좋아하는 1인 진짜 들어가자마자 감동받아서 한참 보고있었어요 ㅠㅠㅠ 꽃도 예쁜 것만 잔뜩 진열해 놓으신 사장님 센스.. 예쁘고 비싼것도 잔뜩있는 여기 꽃다발도 만들어주시더라구요 ~! 앞에 어떤 분이 사가시던데 사장님 포장 센스 장난아니구요 살짝 봤는데도 너무 예쁜 포장에 색 조합이더라구요 다음엔 남자친구랑 와서 꽃 사달라고 해야겠어요...ㅎㅋ❤️ ""꽃 그만 찍어"" "" 그거 어떻게 하는 건데"" ""꽃 그만 찍으라고"" ""그거 어떻게 하는 거냐고"" 꽃의 늪에서 벗어나 왼쪽엔 카운터랑 1층 좌석이 등장합니다 ㅇㅏ 트리에 앓다 죽겠어요.. 🎄 나 여기 너무 맘에 들잖아.. 여긴 1층 창가자리 (여기는 외관 포토존에서 계속 보이는 자리라 저희는 다른 데에 앉았아요) 저 사장님 갬성 너무 맘에 들어요 메뉴판에도 꽃 놓칠 수 없지~ 플랫화이트가 맛있다해서 저는 플랫화이트 주문했습니다 :) ! 내부 (2층) 2층으로 올라오면 요렇게 조금 더 밝은 분위기의 좌석들이 있습니다! 저는 이 날 친구랑 갔는데, 커플들이 가득하더라구요 백번 이해하구요 보다시피 여기도 인테리어가 장난이 아니죠 2층은 반대편에 쇼룸이 장식되어 있어요 ! 여성복을 주로 판매하시고 계셨고, 커피 먹고 수다떨다가 옷구경까지 한 코스에 삽가능~ 메뉴 : 플랫화이트, 아메리카노, 얼그레이케이크 조금 늦은 저 대신 친구가 미리 시켜놓은 얼그레이케이크 사실 케이크는 먹을 때 그렇게 큰 감동은 못 느꼈어요 그냥 맛있는 케이크다~ 정도? 근데 플랫화이트는 듣던대로 맛있더라구요 🥺 아아도 산미 없이 무난하게 먹기 좋았습니다 ! 그릇 예쁘다.. 케이크 데코도 갬성있다.. 저 아무래도 클레멘타인 뽕 찬 거 같아요.. 고소한 플랫화이트 존맛 메뉴 추천입니다 !! ❤️ 맛있는 커피도, 예쁜 꽃도, 예쁜 옷도 가득한 클레멘타인 데이트 코스로도 인생샷을 위한 곳으로도 안성맞춤입니다 성수동 카페로 강추합니당 👍🏻 50m © NAVER Corp. 클레멘타인 서울특별시 성동구 서울숲2길 5-1 1층 #서울 #서울카페 #성수동카페 #성수카페 #서울숲카페 #서울감성카페 #서울플라워카페 #플라워카페 #서울크리스마스 #서울크리스마스핫플 #서울핫플 #핫플 #클레멘타인 #쇼룸카페 #인생샷카페 #소통 #공감 #댓글 #좋아요 #일상 #기록"
"성수동 플라워 신상카페, 클레멘타인","클레멘타인 / clementine 서울 성동구 서울숲2길 5-1 1층 (성수동1가 685-490) 평일 11:00 - 19:00 (매주 월요일 정기휴무) 주말 11:00 - 21:00 0507-1367-3511 - 주차 불가 (인근 유료주차장 이용) 포장, 무선 인터넷, 반려동물 동반가능 엊그제 점심 때 성수동 서울숲에 새로 오픈한 클레멘타인 신상카페에 다녀왔어요 클레멘타인 카페는 수인분당선 서울숲역 5번출구 도보 10분거리, 2호선 뚝섬역 8번출구 도보 10분거리에 한적하고 조용한 서울숲 주택 골목가에 위치해있어요 영업시간은 화요일부터 금요일 오전 11시부터 오후 7시까지이고, 매주 월요일은 정기휴무에요 주말은 오전 11시부터 오후 9시까지이니 방문 전 참고해주세요 서울숲 클레멘타인 카페는 2층 주택을 개조한 카페에요 1층은 클레멘타인 카페와 플로워샵, 2층은 체리코코 쇼룸인데 1층 클레멘타인 카페는 체리코코 쇼핑몰에서 운영하는 카페라고 하더군요 요즘 카페들을 둘러보면 대부분 주택을 개조해서 많이 카페로 탈바꿈 하는 것 같아요 외관은 화이트 색감의 벽돌로 되어 있어서 깔끔해보였고 꼭 유럽에 온 듯한 유럽감성 분위기도 들었어요 외관 벽에는 검정색 글씨로 clementine 라고 적혀있어요 싱그러움이 가득한 꽃들과 식물이 함께 어우러져 있는 클레멘타인 - 말 안해도 아시겠지만 클레멘타인은 플라워 카페에요 저는 12시 40분 쯤에 도착했는데도 자리가 거의 꽉 차있었어요 제가 간 시간대가 점심시간이라 사람들이 많을 줄 몰랐는데 확실히 서울숲에 새로 오픈한 신상카페라 그런지 자리가 거의 꽉 차있었네요 저도 예쁜 신상 카페를 찾아다니는 걸 좋아하는데 역시 여자 마음은 다 똑같나봐요 이제 클레멘타인 카페 내부로 들어가볼게요 입구에 들어가자마자 먼저 보였던 공간은 주문하는 곳 이였어요 아이보리톤 색감의 카운터와 천장 위에는 예쁜 모양의 조명들로 꾸며져 있던 공간 클레멘타인 카페의 메뉴판이에요 에스프레소, 논커피, 티 중에서 제가 주문한 메뉴는 아이스크림라떼 7,000원, 에그타르트 5,000원 총 주문금액 12,000원 결제했어요 디저트 종류도 5가지가 있었는데 케이크 (딥 초콜릿, 얼그레이, 초코 라즈베리 등 ) / 에그타르트 비주얼이 예뻐 먹기 아까워 보이는 디저트들 커피와 디저트 주문을 끝내고 이곳 저곳 둘러봤어요 이 공간은 예쁜 색감의 꽃들이 한 가득 푸릇푸릇하고 ,, 싱그러워 보이는 꽃들이 있는 공간이였는데 클레멘타인 카페에 방문하시는 분들 보면 여기서 사진은 필수로 찍고 가시던데 여기가 포토존인가봐요 이렇게 한 쪽에선 카페와 또 다른 한 쪽에서는 플라워샵을 같이 운영하다보니 좋았던 건 커피를 먹으면서 예쁜 꽃들을 구경할 수도 있고 보면서 마음의 정화가 되는 기분이 들었어요 제가 좋아하는 꽃인 캄파눌라 꽃도 있었어요 여기 있는 꽃들도 다 판매하고 있는 꽃이에요 매주 수, 금요일마다 예쁜 생화가 들어온다고 해요 :) 플라워 예약도 가능하다고 하니 플라워 예약은 070 4278 5257 이 번호로 문의주세요 ! 거울 포토존도 있으니 방문하시면 저기서도 한번 사진 찍어보세요 이 꽃다발은 각각 15,000원에 판매하고 있어요 색감이 참 예뻤던 꽃다발 - 클레멘타인 카페만 갔다가 바로 집에 갔으면 저도 하나 사올텐데 다음에 재방문할 때 꼭 사보기로 하죠 저기가 제가 앉은 자리에요 원목테이블 2개가 있는데 4인이 앉을 수 있는 자리고 아이보리톤의 가구들과 원목 테이블로 꾸며져있어서 클레멘타인 카페 분위기가 감성적이고 따뜻한 분위기가 들었어요 클레멘타인 카페에 작은 야외 테라스가 있어서 밖으로 나와봤어요 테라스에서는 총 2팀 2인씩 앉을 수 있어요 베이지톤 원형테이블과 민트색 의자 2개와 베이지톤 원형테이블과 하늘색 의자 2개가 배치되어 있는데 따뜻한 분위기와 외국에 온 느낌이 들었던 공간이에요 민트색 의자가 있는 테이블 자리는 인기가 많은 자리라서 쟁취하려는 사람들이 많이 보였어요 2층에는 체리코코 쇼룸 오프라인 매장이 있어요 여기까지 왔는데 당연히 구경을 안 해볼 수가 없겠죠 2층 야외 테라스에도 앉아서 커피를 먹을 수 있어요 테이블이 작아서 디저트를 놓을 공간은 없어보이네요 따뜻한 아이보리와 연노란색 톤 2층에 올라와서 들어가자마자 딱 보였던 공간이에요 이 공간 보고 진짜 예쁘게 잘 꾸몄다 라고 생각이 들었어요 이렇게 예쁜 쇼룸은 처음 와 보는 것 같아요 저도 구경을 해보니깐 예쁜 옷도 많았고 가격도 착했어요 다음 여름 휴가 때 입을 옷 여기서 사야겠어요 귀여운 버섯 조명도 있었고 토드백과 샌들도 판매하고 있어요 2층 체리코코 쇼룸의 전체적인 분위기에요 피팅룸도 있으니 마음에 드시는 옷이 있다면 가져와서 피팅해보세요 또 다른 공간 여기도 예쁜 신발이 많았어요 2층 쇼룸 구경을 끝내고 다시 1층으로 내려왔는데 제가 주문한 메뉴 아이스크림라떼 와 에그타르트 가 준비되어 나왔어요 클레멘타인 카페는 진동벨이 따로 없고 커피와 디저트다 준비되면 직원분이 자리까지 가져다 주십니다 비주얼이 너무 먹음직스러워 보이지 않나요 ? 아이스크림 라떼는 라떼 위에 아이스크림을 동동 띄어 주시는데 라떼 베이스가 전체적으로 쓰지 않고 달달했어요 항상 아이스크림 라떼를 카페에서 주문해서 먹으면 베이스가 일단 씁쓸하게 깔리고 달달한 아이스크림을 띄어주시는데 클레멘타인 카페는 전체적으로 달달하게 먹을 수 있어서 단 거 좋아하는 전 맛있게 잘 먹었어요 에그타르트는 일반 카페 에그타르트 보다 크기가 더 커요 이게 근데 먹다가 살짝 물리는 감은 없지 않아 있더라고요 겉에 패스트츄리가 바삭하니 맛있었고 입에서 살살 녹았지만 먹다가 물려서 반은 남겼어요 서울숲 주변 가볼만한 곳 으로 클레멘타인 카페 추천드립니다 남자친구 분들은 클레멘타인 카페에 여자친구 데려가서 꽃다발도 사주기에 좋고, 2층 체리코코 쇼룸도 같이 구경해주면 여자친구가 진짜 좋아할 것 같아요 로그인 • Instagram 전화번호, 사용자 이름 또는 이메일 비밀번호 로그인 또는 Facebook으로 로그인 비밀번호를 잊으셨나요? 계정이 없으신가요? 가입하기 앱을 다운로드하세요. instagram.com 50m © NAVER Corp. 클레멘타인 서울특별시 성동구 서울숲2길 5-1 1층 #클레멘타인 #성수클레멘타인 #서울숲클레멘타인 #신상카페 #성수동신상카페 #서울숲신상카페 #성수카페 #성수동카페 #서울숲카페 #서울카페 #뚝섬카페 #뚝섬역카페 #카페추천 #카페투어 #서울카페투어 #cafe #카페 #디저트카페 #clementine #카페탐방 #성수동 #서울숲 #체리코코 #플라워카페 #서울숲꽃집 #테라스커피"
