title,content
"♡성수동 로스터리 디저트 카페, 업사이드커피 (Upside Coffee)","안녕하세요! 혜원입니다:) 오늘은 성수동의 카페를 소개해드릴게요 이름은 ‘업사이드커피’ 저는 ‘성수커피’ 주문했어요 메뉴판 옆에 테블릿에 사진이 나와있어서 주문하기 편했어요 디저트도 있더라구요! 보틀밀크티도 있었어요 하나 사올껄ㅠㅠㅠㅠㅠ 머신 너무 귀엽죠ㅠㅠㅠㅠㅠㅠ 원두랑 MD들도 판매중이에요 필터커피 주문하고 여기서 마시면 좋을 것 같아요! 안쪽으로는 로스팅하는 곳인가봐요:) 매장은 아주 깔끔해요 생각보다 큰 공간은 아닌데 자리가 부족한 느낌도 없어요 성수커피 달달한 카푸치노 맛인데 너무너무 제 스타일이에요ㅠㅠㅠㅠ 커피가 세상 부드럽고 적당히 달달해서 끝없이 들어갈 것 같아요 에티오피아 커피라면서 주셨는데 산뜻한 산미가 너무 좋았어요! 커피도 너무 맛있고 직원분들도 친절해서 좋았어요 해방촌에 본점이 있다고 하는데 다음에는 해방촌으로 가보려구요! 그럼 오늘도 안녕히! 50m © NAVER Corp. 업사이드커피 서울특별시 성동구 성수동2가 273-47 양혜원(@hye_one_s2_) • Instagram 사진 및 동영상 팔로워 362명, 팔로잉 200명, 게시물 30개 - 양혜원(@hye_one_s2_)님의 Instagram 사진 및 동영상 보기 www.instagram.com 혜원하다 www.youtube.com"
"서울 성수동, 커피와 파운드케이크가 맛있는 숨은 맛집 카페 '업사이드커피(up-side coffee)'","💛커피도 직접 로스팅해서 맛있고 디저트도 맛있는 성수동 카페💛 성수동에서 걸어다니다가 멀리서 귀여운 미어캣같이 생긴 간판보고 기웃거리다가 커피로스팅 직접하는 공간 있는 거랑 파운드케이크 있는 거보고 호다닥 들어간 카페! 업사이드커피 < OPEN > ✔평일 08:00 - 21:00 ✔주말 12:00 - 21:00 < MENU > 성수커피 6,000원 업사이드커피 5,000원 프랜차이즈 카페인 줄 모르고 들어갔는데 성수 뿐만이 아니라 여의도, 뚝섬에도 카페가 있다는 곳! 지점 지역 이름별로 시그니쳐 커피 메뉴가 있다. 성수커피, 여의도커피, 뚝섬커피! 해방촌커피도 있는데 해방촌은 매장이 있는지 모르겠다. 무튼 귀여운 캐릭터+파운드케이크에 홀려 들어간 카페 업사이드커피 서울특별시 성동구 연무장13길 3 가게 안이 참 아늑하고 따뜻한 분위기이다. 여기서 커피를 로스팅해서인지 원두도 이렇게 쌓아놓고! 바 안 쪽에 로스팅 공간이 보이는 구조이고 가게는 길쭉! 한 형태! 파운드케이크 넘 쬰쬰단단하고 맛있어 보여서 왼쪽에서 세번째 파운드케이크로 선택! 바닐라빈 파운드케이크였던 걸로 기억한다! 매장은 이렇게 길쭉한 바 좌석이랑 반대편에 삼삼오오 앉을 우 있는 테이블로 구성되어 있다. 은근히 넓직한 카페 큰 잔이 성수커피, 작은 잔이 업사이드커피 그리고 바닐라빈 파운드! 커피도 진하고 고소하고 맛있고 파운드케이크가 진짜 진하고 단단쵹쵹한 식감이다 너무 좋아~❥ 진짜 우연히 들어갔는 데도 유명한 카페인건지 손님이 계속 오고가고 동네주민으로 보이는 사람도 오고가고 막 그랬다. 무튼 커피도 파운드케이크도 넘 맛있어서 회사동기한테도 추천해줬는데 동기도 다녀오고 커피맛있었다는 후기!! 성수가면 들릴 카페가 생겼다 히히 💌 #서울 #성수 #성수동 #카페 #추천 #맛집 #업사이드커피 #성수커피 #파운드케이크 #파운드 #존맛 #내돈내산 #후기 #메뉴 #영업시간 #분위기 #데이트"
[서울성동]성수동핫플레이스에 있던 업사이드커피카페 내돈내산,성수동핫플레이스에 있던 업사이드커피카페 내돈내산 안녕하세요 전국식당입니다 오늘은 여자친구랑 성수 쪽으로 데이트 갔다가 갔던 카페 후기 남깁니다 위치&영업시간&주차정보 50m © NAVER Corp. 업사이드커피 서울특별시 성동구 연무장13길 3 위치는 연무장 길 13길3 1층 입니다 영업시간은 평일 08:00~21:00 주말은 12:00 ~21:00입니다 주차 불가능하다고 써져 있네요 외관&내부 외부에도 자리가 있었고 내부에도 자리가 있었네요 외부는 테이블 4개 정도 있었는데 고정식 의자라 날씨 좋은 날에 나가서 먹으면 좋을 거 같네요 저희가 갔던 날에는 더워서 안에서 먹었습니다 안에도 테이블석이고 30명 정도 들어갈 거 같습니다 시그니처 컵이랑 커피 원두도 판매했네요 메뉴판&음식 오늘은 아아 4500원 해방촌 커피 6000원입니다 짜잔 나왔네요 크림 위에 그림 그려주는데 저 그림이 여기 카페의 시그니처 그림인 거 같네요 크림 헤쳐모여~~ 성수동핫플레이스에 있던 업사이드커피카페 내돈내산 재생 0 좋아요 0 00:00 00:00  접기/펴기 성수동핫플레이스에 있던 업사이드커피카페 내돈내산 후기 가게는 깔끔한 편입니다 직원분들도 친절하시고 워낙 성수에 카페가 많다 보니 걸어다 기나 가 규모가 어느 정도 있고 깔끔해 보이는 곳 들어갔네요 대형카페도 있었는데 사람들이 워낙 많다 보니 어차피 배부르게 먹지 않을 거면 커피는 비슷할 거 같아서 아무 곳이나 들어갔습니다 핫플레이스라 가격이 조금은 있는데 비싼 편은 아니네요 커피는 신맛이랑 고소한 거 고를 수 있었는데 진한 편이었네요 해방촌 커피는 달달한 크림이 인상적인데 아인슈페너랑 비슷한 느낌입니다 위에 크림이 달달하고 아래 커피가 써서 단쓴단쓴맛이 올라오네요 오늘은 여자친구랑 성수 데이트하고 한번 포스팅해봤습니다~~ #내돈내산 #성수업사이드커피 #솔직후기 #그냥그저그런 #평범한집 #깔끔해 #성수데이트 #뚝섬데이트 #볼거리많아 #커피는평범 #그래도좋아
성수동 업사이드커피,"업사이드커피 서울 성동구 연무장13길 3 해방촌에서 시작하여 성수,여의도에도 지점이 있다 귀여운 수달이 반겨주며 항상 친절한 카페 성수커피,뚝섬커피,여의도커피 등등 시그니처 메뉴가 많으며 대부분 크림 베이스의 커피이다. 공간이 작아 오히려 정겨운 느낌을 준다."
"12월의 성수동 (LCDC, 삭스어필, 글월, 셀렉트마우어, 요안나, 화화담, 먼치스앤구디스, 업사이드커피, 서울숲 + 쇼핑샷)","https://blog.naver.com/hi-ddu/222953803034 12월의 드라마(크리스마스 만끽하러 간 더현대서울, 명동, 신세계백화점 본점) 12월 되면 귀신같이 생각나는 #디바 #12월의드라마 올해는 나도 크리스마스 기분을 본격적으로 느껴보기 위... blog.naver.com 이전 포스팅에 이어서 22/12/11 친구랑 수다 떨다 어느새 잠들고 아침에 셋 다 늦잠을 잤다 어느 호텔 조식 안 부러운, 친구가 전날 동네 유명한 빵집에서 사다 둔 크루아상과 마들렌, 스콘 그리고 직접 내려준 찐한 커피까지 먹고 성수에 평균연령 높여주고 기강 잡아주러 출동 ㅋㅋㅋ 친구네 집에서 성수동까지 도보로 가능한 거리라 좋았다 몇 개월 전 혼자 왔던 때를 떠올리면서 나 여기 왔었는데! 여기 걷다 보니까 다짜고짜 LCDC 나와서 놀랐었는데!!라는 말을 마치자마자 또 그때처럼 다짜고짜 뾰로롱 LCDC가 나타났다 ㅋㅋㅋ 나만 신기해 삭스어필 삭스어필에서 나, 남편, 친구 셋이 사이좋게 양말 한 켤레씩 골랐다 짝꿍이 우리에게 선물해 줬다 희희 이거 완전 병원용 엘리베이터 구조 아니냐며 힙과는 거리가 멀고 병원과는 가까운 으른들의 이야기 #글월 지난번에 왔을 땐 시간이 없어서 이예하만 둘러보고 가서 여길 다시 와보고 싶었다 (이젠 LCDC에 이예하는 없어졌다) 여기도 버섯 편지와 관련된 상품들을 파는 곳이라 그런지 분위기도 차분하고 전체적으로 조용해서 맘에 들어 각종 문구들도 팔고요 제일 큰 목적은 글월에서 파는 향수를 사고 싶었던 것 향도 맘에 쏙 든다 + 요즘 같은 시대에 펜팔 서비스도 이용 가능하다고. 로맨틱하기도 하지 근데 요즘 젊은이들이 펜팔이란 걸 알까 싶네 저도 정말 모르고 싶ㄷ... 너무 더워서 잠깐 밖으로 피신 트리가 뭐랄까 공포영화에 나올 것만 같고 호러느낌이여 #셀렉트마우어 아잇 정말 너무 귀여워서 다 데려가고 싶었다 ㅠㅠㅠㅠ 탐났던 스피커 너는 나랑 같이 가자 #요안나 다이어리, 크리스마스카드, 스티커 구매 좀 더 구경하고 싶었는데 1시 30분에 중앙감속기 예약을 해둬서 아쉬움을 남기고 나왔다 .....ㅎ 분명 일요일 1시 30분으로 예약을 했다고 생각했는데 월요일 예약이었고, (나란새끼 ㅎ) 빈자리가 없어서 다급히 근처에 있는 식당을 찾았는데 친구가 와봤다던 곳이 마침 가까이에 있어서 다행이었다 #화화담 #화화담_성수 여기도 꽤 맛집인지 대기가 있었는데 다행히 두 팀뿐이어서 오래 기다리진 않았다 짝꿍이 시킨 것 클래식 쌀국수였던가 친구가 시킨 분팃느엉 내가 시킨 양지곱창새우 쌀국수 그리고 새우 크로켓 아 너무 맛있었다 중앙감속기 예약을 잘못해서 살짝 멘붕이었는데 #오히려좋아 이럴 때 딱 쓰는 말이었더라 특히 친구가 시켰던 저 메뉴 정말 맛있었고 스테이크 종류도 다 맛있다던데 이제 언제쯤 또 가볼랑가 ㅠ 밥 휘리릭 들이키고 또다시 성수 걷기 #먼치스앤구디스 인서타에서 볼 땐 세상 갬성 뿜뿜하고 여유 가득해 보였는데 이날의 이곳은 가히 아비규환 그 자체 작은 공간에 사람들이 빽빽이 들이차서 구경은 커녕 어서 나가고 싶단 생각뿐이라 덕분에 지갑을 지켜냈다 소금빵 맛집이라던데 그 많은 사람들이 복작거리는 곳에 빵들이 쇼케이스도 없이 덜렁 나와있는 거 보면서 도저히 살 수가 없었고요 #업사이드성수 #업사이드카페 #업사이드커피 성수는 정말 젊은이들이 바글바글 커피 마시러 왔는데 여기도 만석이라 좀 기다렸다 다른 곳 가기엔 우린 너무 지쳤어요 떙벌땡벌 친구들 블로그에서 봐와서 처음인데도 익숙하게 느껴지는 곳이었다 제가 또 미어캣에 환장하지 않습니까? 안물안궁 ㅎ 커피도 맛있었고 캐릭터도 예쁘고 따뜻하니 좋았엉 집에 갈 시간이 거의 다 돼가서, 뭔가 다른 걸 하기보단 서울숲도 한번 가보기로 했다 사람들 틈에서 내내 지쳐있던 남편이 서울숲에 가니까 비로소 안색이 피어나는 걸 보면서 이 복잡한 곳에 괜히 오자고 했나 살짝 미안해졌던 순간 촌놈촌놈 ㅋㅋㅋ 서울숲 걷고 지하철 타러 느닷없이 SM 사옥?까지 와부렀네 키보미 짱팬인 옥시시 친구가 생각나서 한 컷 찍어 보내줬더니 우리애 왜케 시무룩하냐며 ㅋㅋㅋ 올겨울에 트리 정말 질리게 본다 질리진 않음 친구가 내가 좋아할 만한 곳이라고 데려간 곳은 #보마켓 넌 정말 날 잘 아는구나 ㅎ 사진 속에 보이는 납작복숭아 통조림이 너무 사고 싶었는데 가져갈 엄두가 나지 않아 포기했다 이왕 이렇게 된 거 난 꼭 납작복숭아를 먹으러 유럽에 가고 말겠어 순간이동한 것처럼 집 도착 삭스어필에서 해준 포장이 넘 귀여워 우리 양말 희희 집에 있던 다른 미키들하고 한 컷 #포인트오브뷰 보마켓 요안나 조카들 써주려고 산 카드인데 내년에나 보내야겠네 다이어리도 하나 샀다 맘에 쏙 든다규 난 주로 먼슬리를 애용하는 편이기 때문에 나한테 딱 좋은 타입이다 말 그대로 에피소드가 있을 때 날짜를 직접 체크하고 기록할 수 있어서 부담이 없어 좋은 일 가득하길 #쓰는사람을위한향 힘들었지만 그래도 재밌었던 서울 나들이 끝"
성수동 뚝섬역 카페 해방촌 그 느낌 업사이드커피 뚝섬점,"50m © NAVER Corp. 업사이드커피 뚝섬점 서울특별시 성동구 왕십리로14길 19-1 성수동 뚝섬역 카페 해방촌 그 느낌 업사이드커피 뚝섬점 * 070-8802-7579 * 서울 성동구 왕십리로 14길 19-1 ( 성수동1가 7-8 ) * 평일 08:00 - 20:00 / 주말, 공휴일 12:00 -20:00 * 포장, 무선 인터넷, 반려동물 동반 http://www.instagram.com/up.side UP Side(@up.side) • Instagram 사진 및 동영상 팔로워 454명, 팔로잉 554명, 게시물 45개 - UP Side(@up.side)님의 Instagram 사진 및 동영상 보기 www.instagram.com 이번에는 혼자 또 쉬는 날에 부지런히 다녀온 카페 성수동 뚝섬역 카페 해방촌 그 느낌 업사이드커피 뚝섬점 인데요 여기 업사이드커피는 해방촌에 있는 카페로 시작한 로컬 브랜드로 유명하죠 :) 제가 방문한 뚝섬점은 역에서도 엄청 가까이 위치해 있어서 좋았어요 평일에는 오픈 시간이 빠르다 보니 출근하는 직장인 분들이 한잔씩 들고 출근하시기 좋을 것 같았는데 저도 쉬는날인데도 부지런히 준비하고 10시인가 11시쯤인가 도착했는데도 안에 손님들이 많이 계셨어요 와.. 쉬는날에 이렇게 일찍 카페를 가려고 나온 사람은 저 밖에 없을 거라며 혼자 뿌듯해 하며 왔었는데 ㅋㅋㅋㅋㅋ매장 안에는 손님들이 꽉 차있었달까요 ㅎㅎ.. 또 이렇게 외부 벽면을 보면 테이크아웃주문시 -1000원 이렇게 쓰여 있었는데 저렴하게 맛있는 커피를 맛 볼수 있으니 출근하는 직장인 분들에게 엄청 인기가 좋을것 같더라고요 :) 오해를 많이들 하시던 성수동 뚝섬역 카페 해방촌 그 느낌 업사이드커피 뚝섬점의 그려져 있는 저 그림 ㅋㅋ저거 강아지 미어캣 아니고 수달입니다 수.달 참고 하시길 :) 외관 사진을 찍고 매장 안으로 들어왔어요 이건 성수동 뚝섬역 카페 해방촌 그 느낌 업사이드커피 뚝섬점 의 메뉴판이에요 제가 주문한 커피는 시그니쳐 메뉴중에 * Ttukseom Coffee - 뚝섬커피 이 메뉴를 주문 했어요 :) 귀여운 스티커도 있고 : ) 이 스티커는 판매되고 있는 스티커더라고요 ㅎㅎ 어디다 딱 붙이면 귀여울 것 같은 비주얼의 스티커 매장 곳곳에는 저렇게 마스코트 수달이가 있어요 ㅋㅋㅋ매장 전체적인 느낌을 좀 귀엽게 만들어 주는 느낌 이랄까요 ㅎㅎ 성수동 뚝섬역 카페 해방촌 그 느낌 업사이드커피 뚝섬점 에서도 간단한 원두 및 굿즈들도 판매 되고 있는것 같으니 이쪽에서 골라서 원하시는걸 사가셔도 될 것 같네요 ㅎㅎ 이건 이제 음료가 제조되는 공간의 모습이랄까요 매장 자체가 넓지 않고 협소한 공간인데도 알차게 인테리어가 잘 되어 있는게 엄청 깔끔하고 뷰가 예쁘다 해야하나 아무튼 그 공간을 활용을 잘 하신 사장님의 인테리어 센스 음료가 한 잔 만들어지고 있길래 내껀가 하고 찍어 봤는데 앞 손님 ㅎㅎ 아메리카노라서 머쓱 제가 성수동 뚝섬역 카페 해방촌 그 느낌 업사이드커피 뚝섬점에서 주문한 커피 메뉴 뚝섬 커피가 나왔네요 고소하고 달달하게 아이스크림 + 커피 + 우유와 위에 가루까지.. 달달 고소~한 맛이 정말 활력이 생기는 맛이랄까 :) 거의 다 마시고 다음 카페를 가기 위해 성수동 뚝섬역 카페 해방촌 그 느낌 업사이드커피 뚝섬점을 나왔는데 앞에 커피를 올려두고 사진을 찍으니 여기 나름대로 또 포토존이라 사진도 예쁘게 잘 나오는 것 같던데 저쪽에서 인물 사진을 찍어도 좋을 것 같더라고요 ㅎㅎㅎ"
성수동 크로플 맛집-업사이드커피,이번 휴무에는 크로플이 너무 너무 먹고싶어서 인스타로 찾아보다가 발견한 크로플 맛집-! 성수동에 위치해있는 ‘업사이드커피’ 외부모습 지하철 역에서 7-10분 정도 걸었더니 도착! 카페 앞에는 주차장으로 되어있어서 순간 카페가 어디에 있는지 발견을 못했습니다 ㅋㅋㅋㅋㅋㅋㅋㅋㅋㅋㅋㅋㅋㅋㅋㅋㅋㅋㅋ ㅋㅋㅋㅋㅋㅋㅋㅋㅋㅋㅋㅋㅋㅋㅋㅋㅋㅋㅋ 카페에 들어가면 귀엽게 인테리어가 되어있더라구요 우선 QR체크를 하고 메뉴판을 보았어용 테블릿에 메뉴사진들도 담겨있고 메뉴판에 크로플이 없어서 뭐지..했지만 테블릿에 시그니쳐 메뉴들이 모여있더라고요! 드디어! 나왔습니다 브라운치즈크로플(₩12000) 저희는 2p를 시켰어용 진짜 진짜 맛있었습니당 음료도 업사이드커피 시그니쳐 메뉴 중에서 골라서 시켰는데 진짜 크로플이랑 딱 조화로웠답니다 +코로나로 인해서 먹을때 빼고는 마스크를 착용해야했습니다 직원분께서 몇번 주의를 주었는데 지켜지지 않는다면 나가달라고 하신다고 해용! 50m © NAVER Corp. 업사이드커피 서울특별시 성동구 연무장13길 3 다들 크로플이 먹고싶다면 up side coffee 로 🤍GO GO🤍 #성수동카페 #크로플맛집 #성수동카페거리 #이웃환영 #이웃 #한남동 #꼼나나비앙 #한남동미용실 #용산미용실 #성수동맛집
"성수동, 뚝섬 커피 찐맛집 ‘업사이드커피 뚝섬점’","날씨 좋은 주말에 다녀왔던 성수동 나들이. 구석구석 정말 좋은카페가 많이 생겨나고 있는데, 뚝섬역에 해방촌 터줏대감인 업사이드커피가 생겼대서 커피맛보러 호다닥 댕겨왔다!:) 사람없을때 가려고 오픈런을 했더니 레알 한명도 없었다고 한다..ㅋㅋㅋ 코로나땜시 오픈런이 최구야. 수달이 앙뇽? 업사이드커피 뚝섬은 테이크아웃 하면 무려 천원이나 할인해주심! 개이득,, 날씨 좋을 때 커피 한잔 테이크아웃 해서 서울숲 산책가도 좋을 것 같다. 내가 인스타에서 한눈에 뿅 반한 뷰. 넘이뽀! 뚝섬 한가운데에서 기왓집 뷰라니?ㅎㅎ 전체적인 분위기랑 너무 잘어울렸다ෆ 옆으로 큰 창이 하나 더 있어서 시원한 느낌이었다. 커피마시면서도 한옥지붕 볼수 있어서 좋았다궁!ෆ 업사이드커피 뚝섬점 메뉴판. 원래 먹고싶었던 메뉴는 거품올라오는 커피였는데, 그건 성수점에서만 판매하는 거라구 해성,,힝구. 아쉽지만 그냥 해방촌커피로 두잔 주문했다! 스모어 쿠키도 판매즁! 너무 맛있어 보였는데 살찌니까,, 안먹고 참았다 흑흑. 헤헤 귀여운 수달 스티커들S2. 업사이드커피의 마스코트 수달이가 그려진 원두도 판매중이었다. 원두맛도 중요하겠지만 일단 패키지가 넘 귀여웡,,ෆ 매장에 아무도 없어서 널널하게 자리잡고 앉았다. 수달이가 요기 또 잉네?ㅋㅋㅋ 귀엽뜨~ 요즘 화분에 관심이 엄청 가서 이런거 보면 무슨나무야~? 하고 관찰한다ㅋㅋ 이사가믄 예쁜 화분들이랑 허브 입양하러 양재꽃시장 가야지 총총=333 금방 만들어주신 우리의 해방촌 커피! 업사이드커피의 시그니처다. 오픈키친이라 커피만드시는걸 봤는데 엄청 정성스럽게 만들어주신다..괜히 기분좋음ෆ 우유+에스프레소+시럽(?) 위에 부드러운 크림이 올라간 해방촌커피. 크림 위에 코코아 파우더로 up.side라고 그려져 나오는게 포인뚜다ㅋㅋ 크림이 엄청 부드러워서 잘 섞였다! 괜히 귀여워서 찍어봄ㅋㅋㅋ 너무너무 부드럽고 일단 커피가 진-짜 맛있었다. 괜히 커피로 유명한게 아니었어.. 완전 꼬수운 커피라 내가 딱! 좋아하는 맛이었음*^^* 업사이드커피는 통창때문인지 채광이 장난없당! 그래서 셀카가 아쥬 잘나와버림 낄낄~ 요렇게 찍어도 예쁜데 왜 나는 안찍어줬냐...? 어쩔수없이 칭구사진으로ㅋㅋ나도 찍어주라!=3= 아기자기한 소품들도 너무 귀엽고 커피도 찐맛이고! 오랜만에 너무 좋은 성수동 카페를 발견해서 행복뜨. 분위기 미쳐뜨. 남편도 델꾸가서 커피 사줘야지!ෆ 인스타로 알아보니 해방촌점은 이제 정리하시는거 같으니 다들 성수동이나 뚝섬으로 가세유~~~"
성수동커피 ● 업사이드커피,"업사이드커피 성수 성수역 3번 출구에서 398m 성수역 3번출구에서 도보 5분거리에 위치한 업사이드커피. 붕어랑 우연히 산책하다 미어캣스러운 귀여운 간판을 발견하고 들어가게 된 곳입니다. - 서울 성동구 연무장13길 3 (성수동2가 273-47) - 평일(월~금) 08:00 ~ 20:00 - 주말 (토,일) 12:00 ~ 20:00 - 테이크아웃 시 1000원 할인 50m © NAVER Corp. 업사이드커피 서울특별시 성동구 연무장13길 3 간판을 보고 나는 미어캣이라 주장하고 붕어는 개라고 주장했는데 못물어봤네요! ㅎㅎ 하지만 다른 이웃님 블로그를 염탐해보니 미어캣이 맞나봅니다 !! (기쁨의 미소 ㅋㅋㅋ) 네이버에 검색하니 총 세 곳이 검색되는 업사이드커피. 2018년 해방촌에서 시작했다고 소개하는 업사이드 커피는 성수와 뚝섬에 분점을 낸거였어요. #업사이드커피성수 를 방문했을 당시 내/외부 모두 반딱반딱 깨끗하더라니! 생긴지 얼마 안된 카페였던겁니다. :) 잘왔네 잘왔어 하면서 주문 시작! 메뉴판을 보며 생소한 메뉴이름에 직원분 귀찮게 여쭤보기 시작합니다. '이건 뭐에요? 이거는요? ㅋㅋㅋ' 사실 지금 기억이 안나서 아마도 재 방문하면 또 물어볼지도....ㅎㅎ 메뉴 하나하나 정독하게 만드는 메뉴판 찍어왔습니다. (메뉴판 옆 태블릿 화면에 메뉴 설명이 있긴해요!) 열심히 설명듣고 시그니처메뉴 중 업사이드커피를 주문했습니다. 업사이드커피에 갔으니 업사이드커피는 맛봐야죠?! (왕단순 호블린 ㅋㅋ) 붕어는 예전에 감자밭에서 먹었던 쑥라떼가 그리웠는지 쑥 스무디를 주문하더라고요. 카페인에 취약한 붕어는 늦은 오후에 카페 갈때면 꼭 노카페인만 주문해요 ㅋㅋ 메뉴를 기다리며 카페 내부를 구경해봅니다. 모던한 분위기의 카페는 제 취향을 저격합니다! 탕탕..ㅋㅋ 안쪽에는 원두를 볶는 큰 기계도 구경할 수 있습니다. 원두도 판매중인 업사이드커피! 커피에 대한 사장님의 고집이 느껴집니다. ㅎ_ㅎ! 짜잔. 주문한 메뉴 등장! 붕어가 주문한 쑥 스무디와 내가 주문한 업사이드커피에요! 심쿵. 업사이드커피의 티코스터 넘 귀엽습니다! 몰래 호주머니에 넣을 뻔 했어유 ㅋㅋㅋㅋ 제가 주문한 업사이드커피는 온도가 뜨듯한 정도? 뜨겁지 않아 바로 마시기 좋은 온도였어요. 쑥 스무디랑 나란히 놓으니 양 차이가 좀 나지만 진하고 고소한 커피에요! 오히려 쑥 스무디가 배불러보이는 비쥬얼-! 업사이드커피는 적당한 양으로 맛있게 다 마실 수 있는 사이즈였습니다 ㅎㅎ 붕어 배부를까봐 쑥 스무디도 뺏어먹으니 달달하고 고소한 쑥맛! 맛있었어요. ㅋㅋ 아참, 업사이드커피는 커피가 위에서 아래로 자연스럽게 스르륵 내려가는 모습을 구경하는 재미도 있습니다.! 젓지 않아도 된다하시더라구요. 요즘 낮이 짧아져서 오후 6시 30분에도 어둑어둑해져요. 커피 마시고 일어나니 깜깜 ㅋㅋ 사진 속에는 마치 주차장이 있는 것 같아 보이는데, 여기 주차 안된대요! '주차는 아쉽게도 불가하니 근처 공용주차장을 이용해주시기 바랍니다.' - 네이버 플레이스 中 성수역 3번출구랑 옴총 가까우니 도보 이용해야겠어요. 다녀온 후 귀여운 미어캣이 자꾸 생각나는 카페에요! 테이크아웃하면 1000원 할인도 해주는데 이쁜 공간에서 마시고 싶으니 다시가도 매장 이용할 것 같아요. 다음에 가면 디저트 크로플과 다른 시그니처 메뉴도 도전해봐야겠습니다. 가볍게 산책하다 발견한 #성수동커피 #업사이드커피 붕어랑 또 방문할게용~ :)"
