title,content
서울 성수동 클레멘타인 인스타 여신들의 핫플 카페,"안녕하세요, 미야입니당! 요즘(?) 성수동이 핫하죠? 맞나; 아무튼! 저는 지방 사람이라 성수동이 핫하다는 걸 인스타로 배웠숨니다,, 팝업도 많이 열리고 MZ들이 많이온다고함 (이것 또한 글로배움^^) 인스타 돋보기에 온통 예쁜사람만 뜨는 나 여신 언늬야덜 죄다 팔로우 해놨는데 요기는 무조건 꼭! 가더라구용! 그래서 나도 다녀옴 >_< 조금 걷다보니 여긴가봐! 바로 알았어요 클레멘타인 테라스 분위기를 담기에 날씨도 완벽했던 날 :) 외부 자리를 지나 안으로 들어가볼게요 문을 열면 바로 내부가 있구요 주문하는 공간이 있어요 클레멘타인이 인스타에서 유명한 이유 플라워샵도 같이 하고 있어서 요 포토존이 유명해요! 미니 다발로 만들어 놓은 것도 있고 푯말에 보면 꽃이 필요할 때 문의해달라고 적혀있어요 카페 온김에 꽃 한다발 선물받으면 너무 좋을 거 같아요 예쁘죠..♥ 바로 앞에 전신거울이 있고 뒤에도 좌석이 있어요 이 거울이 쇼핑몰 언냐덜 필수 포토존이구먼 껄껄 (언니 아님 내가 더 나이 많음^^) 예쁘면 다 언니 아니겠냐며,, 디저트 종류도 있었는데 저희는 디저트를 곧 먹으러 갈 거라 패스! 밖으로 나가볼게요 사실 카페 자체는 되게 감성 뿜뿜인데 앞에는 그냥 길이예요 안쪽에 사람들이 많이 찍는 공간이 있는데 역시나 사람이 있어서 못 찍었어요~ 나는 그냥 여기 와본걸로 만족 ^-^ 2층에서 내려다본 야외 좌석 2층 올라가면 바로 보이는 자리구요 저희는 여기에 앉았어요 왜냐면.. 자리가 없는 걸여ㅋ.. 근데 날씨가 좋아서 여기 앉길 잘했다 했었어요 요기 안쪽에도 자리가 있고 옷가게? 작게 하나 있어요 이 안쪽에 자리가 있는데 진짜 사람이 바글바글 해서 차마 카메라 찰칵 소리 못내겠; 아이폰 무음 카메라 있다던데 난 왜 안되냐 블로거분들은 공감하실 거 예요 내부 찍는 찰칵! 소리 나자마자 모두의 시선이 나에게 온다는 것을^-^.. 밀크티를 주문했는데 맛있었어요! 밀크티 좋아하시는분들 추천해요 포토존에서 열심히 찍어보았어요 꽃은 판매용이기 때문에 눈으로만 봐야해요 사진은 만지는 제스처만 취함 캬캬 꽃을 워낙 좋아해서 그런지 여기 너무 좋았어요ㅠ 클레멘타인의 다른 포토존! 야무지게 찍어주야쥬~ 여심 저격 예쁜 꽃집 분위기 카페라서 사진 찍는 사람들이 많았어요 그틈에 나도 열심히 찍어줌>_< 성수동 핫플 찾으시면 클레멘타인 추천해요! 100% 개인적인 후기입니다. 참고만 부탁드려요. Open - 11:00 Close - 21:00 📞 0507-1367-3511 📞플라워샵 070-4278-5257 * 연중무휴 인스타 참고 클레멘타인 서울특별시 성동구 서울숲2길 5-1 1층 클레멘타인(@clementine.crko) • Instagram 사진 및 동영상 팔로워 2,288명, 팔로잉 3명, 게시물 60개 - 클레멘타인(@clementine.crko)님의 Instagram 사진 및 동영상 보기 www.instagram.com ▼주변 가볼만한 곳▼ 서울 청담 테라스룸 파리 감성 핫플 레스토랑 안녕하세요, 미야입니당 ! 인스타하는 사람 중에 테라스룸 모르는사람 없죠? 서울 갈 때 마다 꼭 가보고싶... blog.naver.com 서울 성수동 소문난 성수 감자탕 주말 웨이팅 맛은 과연 안녕하세요, 미야입니당 ! 작년에 다녀왔는데 이제야 써보는 나란인간 ^^ 백종원 3대 천왕과 여러곳에서 나... blog.naver.com [서울 삼각지 몽탄] 이영자픽 우대갈비 맛집 웨이팅 성공 후기 안녕하세요, 미야입니당 ! 원래도 유명했지만 이영장님 방문 후 더 유명해진 몽탄 우대갈비 유행의 시초 몽... blog.naver.com ᴍ ɪ ʏ ᴀ ᴀ - ɪ ɴ s ᴛ ᴀ 미야(｡♥‿♥｡) 여행ㅣ카페(@mi____yaa) • Instagram 사진 및 동영상 팔로워 7,722명, 팔로잉 1,151명, 게시물 562개 - 미야(｡♥‿♥｡) 여행ㅣ카페(@mi____yaa)님의 Instagram 사진 및 동영상 보기 www.instagram.com"
서울숲 클레멘타인 플라워카페 감성 가득 성수동 카페,"서울숲 감성카페 클레멘타인 플라워카페 서울숲 근처에 감성 가득한 플라워 카페 클레멘타인에 방문했다. 1월 초에 방문했기 때문에 아직도 크리스마스 분위기였다. 11:00 - 21:00 매주 월요일 휴무 영업일 변동이 종종 있는 곳이니 인스타 or 네이버에서 영업일정 확인 후 방문하세요! 클레멘타인 서울특별시 성동구 서울숲2길 5-1 1층 뚝섬역 8번 출구로 나와 뚜벅 뚜벅 걸어간다. 조금은 조용한 주택가 골목에 위치한 서울숲 카페 클레멘타인. 하얀 페인팅의 깨끗한 2층 건물이 단연 눈에 띈다. 이곳 골목도 조금씩 주택들이 카페나 펍, 공방 등으로 바뀌어 가는 분위기다. 웨이팅이 종종 있다는 소문에 12시30분 즈음 방문했는데 여유로운 시간을 보냈다. 좌석이 채워지기 시작한 것은 점심시간이 지난 1시 30분 부터 였던 듯 하다. 아마 식후 디저트를 위해 손님들이 바짝 몰리는 시간인 듯 하다. 좌석은 1층부터 2층까지 마련되어있는데 1층은 5~6 테이블 정도이고 2층도 비슷했던 기억. 플러스 외부에도 1층과 2층 모두 야외 테이블이 준비되어 있다. 화이트와 실버 그리고 블랙 커피 머신위의 머그컵과 찻잔을 살짝 덮어 놓은 천. 최근에 방문한 카페에서 이토록이나 깔끔했던 곳은 드물었다 :-) 다양한 스타일의 창문을 통해 쏟아지는 햇빛이 카페 내부를 가득 채우니 따뜻한 온기도 가득하다. 레트로한 액자도 분위기를 한껏 끌어올리고 있다. 서울숲 클레멘타인 플라워 카페 감성 가득 성수동 카페 재생 42 좋아요 4 00:00 00:32  접기/펴기 서울숲 클레멘타인 플라워 카페 감성 가득 성수동 카페 각각의 쇼케이스를 준비한 센스는 굿!! 종류별의 조각케이크와 파운드 케이크 에그타르트와 레밍턴이 보인다. 11시 오픈 카페인데 케이크들이 빨리도 소진되고 있었다. 붉은 천일홍 한 송이가 안내해주는 감성 가득 성수동 카페 클레멘타인 메뉴 음료메뉴가 심플하게 준비되어 있다. 서울숲 카페 클레멘타인에 준비된 4종류의 티에 관한 설명을 읽고 본인의 스타일 혹은 그날의 컨디션에 따라 마시고 싶은 티를 골라보는 것도 좋을 것 같다. 탠저린 바질 에이드 7,500 레밍턴 7,000 생과일 쥬스가게에서도 보기 힘든(?) 탠저린 음료가 있어 주문해 봤다. 탠저린 시럽에 오렌지를 올린 것인지 귤청에 오렌지를 올린 것인지 잘 모르겠다. 새콤하지 않은 은은한 오렌지 쥬스의 맛과 바질의 은은한 향이 입안에 퍼진다. 고소한 코코넛과 달콤한 초코 코팅의 레밍턴. 스펀지 케이크 안쪽에는 딸기잼이 있었다. 디저트의 맛은 무난했다. 특별히 크게 감동받지는 않았다 ㅠㅅ ㅠ 두 디저트의 궁합이 실패였는지도 모르겠다. 크리스마스의 여운이 남아있는 내부 인테리어. 작은 소품들로 공간 곳곳을 예쁘게도 꾸며 놓았다. 성수동 카페 클레멘타인은 플라워샵도 함께 운영되고 있는 플라워카페이다. 당연히 꽃과 화분판매도 가능!! 꽃같은 분이 꽃을 가꾸는 구나...헿 판매하고 있는 화분들도 멋지게 전시해 놓고 있어 디저트를 먹다가 잠시 기분 전환 삼아 둘러보았다. 플로리스트의 작업공간이지만 이 화려한 꽃 테이블은 손님들의 포토존이 되어 있었다. 괜찮으려나 모르겠지만 특별한 제지를 하지 않는다. 아마 이 공간 때문에 서울숲 카페 클레멘타인이 입소문 탄 듯 하다. 만약 여자친구, 혹은 어머니와 함께 이곳을 방문했다면 꽃 한 송이 정도 선물하는 센스를 발휘해 보자. 물론 꽃 선물의 대상은 남자친구 or 아버지여도 좋다. 하지만 카페에 앉아 있는 동안 여성분들과 함께 방문한 남자손님들 중에는 꽃을 보고 환호하는사람이 없었다. 다들 여성분들 사진 찍어주기에 바빴다.^^;; 서울숲 카페 클레멘타인의 가장 핫한 공간. 플라워 테이블. 여리고 하늘하늘한 꽃잎의 보라색 델피니움 독특한 스타일의 실거베라의 연분홍빛이 너무 예뻤다. 거베라 뒤의 붉은 알스트로메리아도 너무 매력있다! 처음 본 털이 송송난 튤립이 있어서 신기했다. 아이스퀸 튤립이란다!!소녀의 발그레한 딸기빛 볼을 닮은 컬러~! 예뻐서 한동안 바라봤던 것 같다. 디저트도 먹고 꽃향기도 맡으며 독서도 하고 여유로운 오후의 시간을 보낸 서울숲 카페 클레멘타인. 나는 충분한 2시간을 보냈기에 테이블을 기다리는 다른 손님들에게 자리를 양보하고 카페를 나선다. 아늑한 공간. 햇살 맛집. 그리고 아름다운 꽃과 디저트가 있는 성수동 디저트 카페 여성분들이 환호할수 밖에 없는 조건들을 갖춘 곳이다. 그리고 카페의 2층에서도 커피를 마실 수 있다. 2층은 여성쇼핑몰 체리코코의 쇼룸과 함께 공간을 공유하고 있다. 날씨가 따듯해지는 봄과 다채로운 컬러의 꽃이 만발하는 여름에는 더욱더 인기가 폭발할 것 같은 플라워카페 클레멘타인. 따뜻했던 겨울 날씨에 야외테이블에서 커피를 마시는 손님들도 있었다. 서울숲의 아름다운 플라워 카페 클레멘타인~ 카페투어를 좋아하는 당신을 위한 리뷰 끗!"
"성수동 플라워 카페 클레멘타인 : 커피 마시면서 꽃, 옷 구경 가능한 곳","성수동 플라워 카페 클레멘타인 커피 마시면서 옷이랑 꽃 구경 가능해요 #서울카페, #성수동카페, #플라워카페 안녕하세요 ~ 은화입니다 🩷 오늘 소개할 곳은 성수동에 위치한 플라워 카페 '클레멘타인' 입니다. 성수동에는 예쁜 카페가 정말 많죠~!! 저도 그래서 어딜 갈지 엄청 고민이 많았는데요. 예쁜 테라스와 싱그러운 꽃에 반해 결정했습니다:) 그럼 자세히 소개해 드릴게용 GO GO~!! 📍서울 성동구 서울숲2길 5-1 1층 뚝섬역 8번 출구에서 682m ⏰ 매일 11시 ~21시 🐶 반려동물 동반 가능 @clementine.crko flower cafe : clementine 외부 및 1층 테라스 야외 테라스 자리는 총 3개입니다. 하얀 벽돌에 검은 창문, 따스하게 비추는 햇살까지 너무 맘에 들던 곳이에요. 그다음으로 보이는 자리입니다. 사람들이 꽃집 다음으로 여기서 가장 사진을 많이 찍더라고요. 여기 앉아서 먹을까 고민했는데 책상이 낮아서 사진만 찍었어요. 그리고 계단 옆에 있던 자리입니다. 여기는 위에 가림막이 따로 없어서 날씨 영향을 가장 많이 받는 자리입니다. 마지막으로 테라스 자리 중 가장 예쁘다고 생각이 들었던 공간입니다. 계단 단차로 인해 생긴 공간인데 약간 미니 다락방 느낌 나고 넘 귀여운 공간이었어요. flower cafe : clementine 1층 내부 (꽃집, 인테리어) 내부가 만석이라 카페 자리는 못 찍었어요. 출처: 업체 사진 화이트와 우드 인테리어로 따뜻한 느낌을 주는 카페였어요. 손님이 많아 사진은 못 찍었지만 카운터 앞에 2자리, 우측에도 꽤 여러 자리가 있었어요. 클레멘타인의 하이라이트인 꽃 구경하러 가볼까요? 생각보다 조명이 어둡다고 느꼈어요. 사진 보니깐 봄과 여름에 더 많은 꽃이 있더라고요. 제가 알아보고 갔을 땐 꽃다발도 더 많았는데 막상 가보니깐 없었어요. 실제로 판매하는 꽃이니 눈으로만 봐주세요! 카페의 하이라이트니깐 사진도 많이 많이 찍었어요. 전신거울도 있습니다. 넘 예뿌죠~?? 완전 맘에 들어용 ㅎㅎ + 그리고 1층에 화장실이 있는데 1칸밖에 없어서 사람들이 줄 서서 기다리더라고요. 참고하세용 flower cafe : clementine 메뉴판&디저트 종류 커피가 다른 곳보다 엄청 연하니깐 참고하세요 *1인 1음료 주문 *주말 및 공휴일은 2시간으로 카페 이용 제한 *트레이는 카운터로 반납 외국인들도 많이 방문하다 보니 영어 메뉴판과 한국어 메뉴판으로 총 2개 있어요. 4가지 티와 설명서입니다. 디저트존입니다. 가짓수가 많지는 않지만 다 맛있어 보여요. 에그타르트와 케이크, 스콘, 파운드 등이 있어요. flower cafe : clementine 주문 메뉴 레몬 파운드 케이크 추천합니다 아메리카노 - 5,000원 에그타르트 -5,000원 레몬 파운드케이크 - 7,000원 짜짠~!! 저는 이렇게 주문했어요. 레몬 파운드케이크랑 에그타르트 중에서 뭐 먹을지 고민하니깐 친구가 다 먹자고 하더라구용ㅎㅎㅎ앗싸✨🤤 2층 안에 있는 자리에서 디저트 사진을 찍으니 사람들이 사진에 계속 나와서 밖에서 사진을 찍어봤어용. 맛있겠죠?? 아메리카노는 평소에 연하게 먹는 타입인데 너~~무 연하더라고요... 제 친구는 그냥 마셨는데도 연하다고 그러더라고요? 대체적으로 커피가 연한 편이니 참고하세용 레몬 파운드 케이크 이거 진짜 맛도리~ 너무 달지도 않고 상큼해서 커피랑 먹기 좋았어요. 파운드 케이크 못하는 곳 가면 그냥 목만 막히는데 여기는 촉촉하니 좋았어요. 에그타르트 에그타르트가 5천원이라 살짝 비싼 감이 있지만 맛있으니 용서 가능:) 겉바속촉 맛있는 에그타르트였습니다. 에그타르트는 데워서 주십니다. flower cafe : clementine 2층 내부 (카페, 옷 가게) 옷 가게 '체리코코'가 있어요. 출처: 업체 사진 저는 1층보다 2층이 더 예쁘다고 느꼈어요. 2층 역시 손님이 많아 전체적인 사진은 못 찍어 네이버 업체 사진으로 대체합니다. 저는 큰 거울 앞에 앉아서 먹었어요. 여기 카페 진짜 분위기도 좋고 포토존도 많아서 좋은데 아쉬운 점이 책상이 다 낮아요 ㅠㅠㅠㅠ 그래서 허리 아파서 진짜 후다닥 먹고 나왔어요. 안쪽에 있던 채광 가득한 자리입니다. 여기 사진이 굉장히 이쁘게 나오더라고요. 너무 눈부셔서 사진 빠르게 찍고 나왔어요. 햇살 가득한 자리 옆에 거울이 있어요. 자연광 거셀은 못참죠~?!! 2층에 있던 물 마시는 곳 입니다. 종이컵으로 마시면 돼요. 2층 곳곳에 거울이 참 많아요. 쇼파를 기준으로 왼쪽은 카페, 오른쪽은 옷 가게 '체리코코' 입니다. 옷은 총 2곳에 있고, 탈의실도 있어요. 전반적으로 파스텔톤의 깔끔한 디자인의 옷입니다. 가격도 성수동 다른 쇼룸에 비해 저렴한 편이었어요. flower cafe : clementine 2층 야외 (테라스) 총 2개 있어요 제가 만지고 있는 창문 안은 쇼룸이랍니다. 여기 앉으면 밑에 1층 보면서 사람 구경도 하고 안에 옷 구경도 하기 좋은 자리입니다. ㅋㅋㅋㅋㅋ 저 끝에 보이는 흰색 창문이 아까 소개했던 채광이 좋은 자리입니다. 여기가 나머지 테라스 자리인데요. 여기서 디저트는 좀 어렵고 그래도 음료 정도는 먹을 수 있지 않을까요? 사진 보니 테이블과 의자가 있을 때도 있더라고요. 제 착장과 여기가 가장 잘 어울려 사진이 좀 많네용ㅎ 카페 총평을 말씀드리자면, 아래와 같습니다. <장점> 공간이 아주 매력적이다. 카페 뿐만 아니라 꽃, 옷 구경 가능하다. 사진이 잘 나온다. 디저트가 맛있다. <단점> 테이블이 낮다. 화장실이 1칸이라 매우 협소하다. 성수동, 서울숲, 뚝섬 예쁜 카페를 찾고 계시다면 '클레멘타인' 추천합니다. 이상으로 글을 마칠게요. 오늘도 읽어주셔서 감사합니다. τнänκ чöü ᰔᩚ 50m © NAVER Corp. 클레멘타인 서울특별시 성동구 서울숲2길 5-1 1층 #서울숲카페, #성수동카페, #뚝섬카페, #테라스카페, #서울테라스, #성수동테라스, #뚝섬테라스, #서울숲테라스, #체리코코, #클레멘타인, #플라워카페, #성수쇼룸, #뚝섬쇼룸, #서울숲쇼룸, #성수동꽃집"
성수동 클레멘타인 인스타 감성 가득한 플라워카페,"간만에 성수동 나들이 주말에 성수동이라니..🤦‍♀️ 인스타에서 너무나도 핫한곳인데 나는 이제서야 방문했다 클레멘타인 서울숲2길 5-1 50m © NAVER Corp. 클레멘타인 서울특별시 성동구 서울숲2길 5-1 1층 카페 사진을 찍어보려고 하였으나 많은 사람들로 인해 간단히 인테리어 사진만🙄 다른때는 웨이팅까지 한다던데 이날은 날씨가 추워서인지 웨이팅 없이 바로 입장가능했다! 바로 옆에는 꽃도 판매하고 있다 인테리어도 되고 1석 2조인듯 자리가 없어서 2층으로 총총총. 요 자리에 앉았는데 사진찍다가 땀이 삐질삐질 이때가 디게 추웠던 날인데 (3월) 땀흘린거 실화냐며 아참 계단이 좀 가파르다고 해야하나? 2층 올라올땐 문제가 없는데 내려올땐 조심조심! 이층에 올라오면 복도쪽에 요런 쇼파도 있다 이 복도사이로 쇼룸에서 옷판매도 하고 있던!! 나도 얼른 오프매장 하나 열어야지 열심히 일하자 ~ 나이먹고 캉캉 블라우스 입기 부끄러웠다능 우리 효자상품 캉캉 블라우스 요고 입고 촬영했을때가 3월 디지게 추웠던 날인데 글은 5월에 적고 있구나🤣 특가상품으로 거의 마진없이 파는 상품인데 깔별로 너무너무 잘나가서 계속 오더넣구 있다 ❤️❤️❤️❤️❤️ 디테일컷❤️ 허리 밴딩부분이라 옷이 증말루 편하던 아아한잔, 티한잔 동생이랑 핫한 카페 다니면서 웃긴게 우린 항상 메뉴가 변하지 않는다 ㅋㅋㅋㅋ 역시 뭐니뭐니해도 자연광을 따라올수 없구나 햇빛이 너무 뜨거워서 오랫동안 앉아있지는 못했다🤣🤣 공간 하나하나 활용을 잘한 카페 재방문 의사 있는곳❤️ 블라우스 구매는 요기아래 링크에서 구매 가능합니다✅ 더로엘 : 네이버쇼핑 스마트스토어 인생에서 가장 아름다운 시간, 더로엘 m.smartstore.naver.com"
[서울] 서울숲 성수동 카페 - 클레멘타인 웨이팅/주말/메뉴,"50m © NAVER Corp. 클레멘타인 서울특별시 성동구 서울숲2길 5-1 1층 📍 영업 시간 : 12시 ~ 8시 📍 매주 월요일 휴무 📍 주차 공간 X 주말에 서울숲 핫플 클레멘타인에 방문했습니다 ! 점심 먹고 2시쯤 방문했던 거 같아요. 날씨가 넘 좋아서..🙊 건물이 넘 예쁘게 나왔어요. 멀리서부터 엄청 사람이 북적북적 하더라고요. 도착하자마자 제일 먼저 해야할 일은 ! 테이블링으로 웨이팅을 걸어놓는 일입니당. 참고로 저희가 웨이팅 걸었을 땐 앞에 13팀 정도 있었던 거 같아요. 웨이팅 걸어놓고 클레멘타인 구경을 시작해봤어요 ! 1층 야외에 3-4자리 정도 앉을 자리가 있던데 사진은 잘 나오겠지만 사람이 넘 북적북적 많아서 편하게 앉을 수나 있을까 싶었어요.😭 2층으로 올라가는 계단 밑 요 자리가 젤 유명한 자리 같더라고요 ! 그래서 저도 한 장 남겼답니당..🤍 2층에도 두 명이 앉을 수 있는 자리가 2개 정도 있었어요. 이제 낮에도 별로 덥지 않은 날씨라 요 자리 앉아도 괜찮겠다 싶더라고요. 확실히 1층에 비해 아늑한 느낌이었어요. 클레멘타인은 1층은 카페, 꽃집 2층은 쇼룸을 운영하고 있어요. 웨이팅 걸어놓고 2층 올라가서 쇼룸 구경하면 시간 훅훅 갑니다 -! 옷부터 신발까지 예쁜 것들이 자꾸 눈에 들어오더라고요 구경하고 있는데 순서가 되어 다시 1층으로 내려갔어요 ! 1층 카페 들어가려면 거쳐야하는 꽃집..🌷 다발도 넘 예쁘지 않나요? 여러 종류의 꽃이 병에 담겨있는데 병마다 꽃 이름을 적어주셔서 좋았어요. 뒤쪽 공간도 예쁘게 잘 꾸며놔서 감탄만 엄청 했던 거 같아요. 꽃집 바로 옆에 카페 내부 공간입니다. 사람이 넘 많아서 사진을 요거 밖에 찍진 못했지만 옆 테이블과 공간이 엄청 좁아서 그냥 다 같이 합석한 느낌이 들었어요. 웨이팅이 계속 있다보니 자리를 옮기는 건 불가했구요 ㅠ 메뉴입니다 ! 옆에 꽃 한 송이 붙여놓으신 거 쏘 로맨틱..🙊 디저트 종류도 많이 있었답니다 :) 저희는 간단하게 탠저린바질에이드 (7,0) 쿨허벌 (6,0) 요렇게 주문했어요. 탠저린바질에이드는 한입 먹으면 악!! 오렌지다 !! 하는 맛이었고 ㅋㅋㅋㅋㅋㅋㅋㅋㅋㅋㅋㅋㅋㅋㅋㅋ 쿨허벌은 되게 신기한게 목으로 넘어갈 때 까진 그냥 허브티 맛 나는데 끝에 달달한 향이 나더라고요? 생각보다 제 취향이었어요. 나갈 땐 레몬 파운드 케이크 (7,0) 포장했습니다. 요기 포장 박스가 예뻐서 선물하기에도 넘 좋을 거 같았어요. 🤍 너무 너무 너무 너무 예쁜 카페였지만 자리가 다 가깝게 붙어있어서 편하게 이야기를 나눌 수 있는 분위기는 아니라 아쉬웠어요. 다음엔 평일 낮에도 방문해보고 싶네요 😭 #성수동카페 #서울숲카페 #서울숲클레멘타인 #성수동클레멘타인 #클레멘타인주차 #클레멘타인웨이팅 #클레멘타인주말 #클레멘타인메뉴 #서이추 #서이추환영 #답방"
