title,content
성수동 업사이드 커피 (업사이드커피 연무장점) 미어캣 캐릭터가 귀여운 카페,"성수동에서 깔끔하고 널찍한, 대형 프랜차이즈가 아닌 카페를 가고 싶으면 이 곳 Next image 넓은 주차공간과 귀여운 미어캣 캐릭터가 반겨준다 주차 자리는 3~4대 정도고 미어캣은 직접 만든- 이름이 미어캣이라고 한다ㅎㅎ 귀염짐 테잌아웃하면 천원할인! 내부가 넓고 깨끗하다 쾌적한 느낌을 줌 이 근처 몇 안되는 앉아있다 가기 편안한 카페 메뉴ㅎㅎ 해방촌에서 시작되어서 뚝섬/성수/연무장 이렇게 있는듯 각 지점에서 시그니쳐커피를 하나씩 개발해 담당하고 있는 듯하다 아메리카노 4.5 플랫화이트 5 에스프레소 그라니따 4.5 주문 에스프레소 그라니따란 크림 위에 에스프레소 간 것을 올려 먹는 것 순 에스프레소 얼음일 줄 알았는데 설탕이 섞인듯 카페인+당 충전 직빵느낌이라고 한다 아! 커피 원두 고를 수 있고 옆에 베이커리 같이 팔고 있음 그리고 캐릭터가 너무 귀여워서인지 어디다 붙여놔도 찰떡같이 구매욕을 자극하는... MD존 담에 머그 사러 갈 예정 ㅎㅎ 알고보니 캐릭터는~ 해방촌에서 제일 먼저 시작할 때 있었던 고양이로부터 시작된 거라고 한다 커여움 ㅜㅜ 스티커도 팔아줘요"
성수동 카페 추천) 업사이드커피,"엄마 아빠가 오빠네 집 근처에 진짜 맛있는 커피 파는 곳 있다고 해서 그러려니~~ 했었는데 오늘 오빠 데리러 갔다가 기회가 돼서 나도 먹어보기로 했다 (얼마나 맛있는지 어디 한번 보자구ㅎ) 업사이드라커피라는 카페인데 앉을 곳도 거의 없고 카페도 작아서 처음엔 그냥 별생각 없이 따라들어갔다 요즘 카페인 좀만 먹어도 심계항진 오는 나는 디카페인 원두로 골랐고 엄마 아빠는 fill up 원두로 하나, sunny side 원두로 하나 이렇게 시켰다 (요로코롬 귀여운 그림도 그려주심♡̆̎) 나 커피 먹고 맛있다는 말 진짜 잘 안 하는데 진짜 정말 너무 맛있다🫢 왜 이거 맨날 셋만 마셨는데? 나 진짜 서운해.. 암튼 이 좋은 거 나만 알 수 없지!! 성수동 가서 카페 찾는 사람들은 꼭 업사이드커피 가봤으면 좋겠다! 업사이드커피 뚝섬점 있는 골목에 카페가 5-6개 정도 있는데 그중에서 제일 맛있을뿐만 아니라 내 인생 top3 아아에 드는 맛도리 카페다!! #성수동 #뚝섬 #카페 #맛집 #업사이드 #upside #디카페인"
커피가 맛있는 아기자기한 성수동 업사이드커피,"업사이드커피는 2018년 해방촌에서 시작한 커피 브랜드이다. 내가 몇 번 방문한 지점은 뚝섬역 1번 출구에 있는 작지만 아기자기하게 잘 가꿔진 카페이다. 뚝섬역 5번 출구, 성수역 3번 출구 근처에도 있는데 더 큰 공간으로 돼 있으니 참고 바란다. 뚝섬역 부근에서 약속이 있으면 친구들과 함께 또는 혼자서 친구 기다리며 잠시 머물기 좋다. 혼자 책 보시거나 간단한 업무하시는 분들이 꽤 있었다. 공간이 작기 때문에 오래 머물 수는 없다. 앉아 있는 동안 보니 테이크 아웃 고객분도 많이 온다. 다음 약속까지 시간이 남아 혼자 갔을 때 주문했던 플랫 화이트 5,000원 진한 에스프레소에 우유가 적게 들어간 커피다. 우유의 거품이 카푸치노처럼 부풀어 있지 않고 평평해 플랫(Flat), 우유를 의미하는 화이트(white)가 더해져 플랫화이트라는 이름을 갖게 됐다고 한다. 진하고 고소하니 맛있다. 배부를 때 딱 좋다. 친구들과 갔을 때 아메리카노와 해방촌 커피를 주문했다. 해방촌 커피는 커피, 우유, 크림이 들어가 있어 달달하니 당 떨어질 때 좋다. 지금은 미어캣 로고로 토핑이 돼 나오는 거 같다. 아메리카노 4,500원 해방촌 커피 6,000원 작지만 곳곳에 신경 쓴 게 보인다. 아이보리 톤의 빈티지한 스위치가 예뻐서 찍어봤다. 작은 공간이라 벤치 안에 수납을 할 수 있는 벤치가 있다. 공간 활용을 잘 한 거 같다. (손님용 x) 벤치에서 보면 바 카운터, 디피 공간이 한눈에 들어온다. 작지만 계절 꽃과 원두, 컵 등을 살 수 있게 디피 돼 있어 커피 기다리며 잠시 구경하기 좋다. 곳곳에 예쁜 꽃 들, 기분이 좋아진다. 친구 기다리며 여기 있는 책도 봤다. 레시피 책인데 마음에 드는 레시피가 있어서 사진 찍어뒀다. 잠시 머물면서 책 보기에도 좋다. 커피가 맛있으니 지나가다 보이면 들러보시길 50m © NAVER Corp. 업사이드커피 뚝섬점 서울특별시 성동구 왕십리로14길 19-1 1층 업사이드커피 뚝섬점 영업시간: 월~일 8:00~19:00 1. 뚝섬점 (뚝섬역 1번 출구) 2. 성수점 (성수역 3번 출구) 3. 연무장점 (뚝섬역 5번 출구) 4. 을지로점 (을지로4가역 1번 출구)"
성수동 카페 업사이드커피 성수. 해방촌 커피,"성수동 카페 업사이드커피 성수점 해방촌 커피, 크로플 맛집 서울 성동구 연무장 13길 3 업사이드커피 : 네이버 방문자리뷰 277 · 블로그리뷰 185 naver.me 2018년 해방촌에서 시작한 커피 브랜드. 올해 처음 방문해 본 카페인데 내 인생 커피 1순위가 되어버렸다 ‘해방촌 커피’ 가 그 주인공! 아우어베이커리 플랫화이트도 넘 맛있지만 해방촌 커피가 밀치고 들어와버렸다 ㅎㅎ 매장 앞에는 주차가 4-5대 가능한 것 같고 야외 테이블도 있다. 빨리 들어가자고 손짓하는 우리 딸 업사이드커피 성수점은 주중은 8:00 - 21:00 주말은 12:00 - 21:00까지 운영 햇살 받는 미어캣 ㅋㅋㅋ 귀여워라, 테이크 아웃은 1000원 할인해준당 밖에도 미어캣 안에도 미어캣 여기가 우리 집이었으면 ㅋㅋㅋ 머신, 핸드드립, 원두볶는 기계도 있고 구경하는 재미가 있는 업사이드 카페 원두가 엄청 쌓여있음 ㅋㅋ 다음엔 원두도 구입해봐야겠다 원두, 굿즈 등 다양한 상품들도 볼 수 있다. 머신에도 미어캣이! ㅋㅋ 꿈에 나오겠당 귀엽게 생긴 디저트류 어떤걸로 먹을까 고민하다가 해방촌 커피가 시그니처인 것 같아 주문해봤다 소소하게 꾸며 놓은 공간들 우리는 해방촌 커피로 주문하고 엄마는 디카페인 라떼로 주문했다 위에 올려진 건 커피가루인데 아.. 이 커피 진심 존맛탱이다 ㅋㅋㅋ ㅠㅠ 너무 맛있어서 결국 테이크아웃으로 한 잔 더 사서 먹었다. 테이크아웃은 어차피 글씨가 다 망가진다구 커피가루를 더 많이 넣어주신다 (많이 넣음 더 맛있다는 사장님의 설명) 울 귀요미 아가들 아이스크림도 주시구 직원분들 너무 너어무~ 친절하시다 친절한 곳이 좋은 봄수박맘 ㅎㅎ 담에 또 미어캣 보러 가야지 :)"
"성수동 카페, 업사이드커피 upside coffee","지난주, 오후 반차를 내고 성수동에 다녀왔어요! 성수동은 너무 멀어서 정말로 1년에 한두번 갈까말까 한 곳인데 반차쓰고 큰맘먹고 다녀왔습니다- 점심으로는 제 사랑,,,,,,,,제 진심,,,, 칙피스에 가서 샐러드를 먹고 (하트) 소품샵 구경하다가 커피 마시러 업사이드커피로 향했습니다! 사실 제가 그동안 혼자만의 편견(?)이 있었어서 업사이드 커피는 방문해보지 않았었는데요! 알면 알수록 저 혼자만의 생각같아서 ㅋㅋㅋㅋㅋㅋ 이번 기회를 통해서 방문했습니다! 날이 따듯할 땐 이렇게 밖에서 마시면 너무 분위기가 좋을 것 같습니다! 메뉴판에는 각 지점별 시그니처 메뉴가 있었어요! 그치만 시그니처 메뉴는 대부분 크림 같은 게 들어가거나 달아서 시도해 볼 생각조차 안했답니다 ㅠㅠ 그치만 혹시 몰라요,,,업사이드는 시그니처도 안 달 수도!!!! 시그니처메뉴 = 달다라는 생각때문에 물어보지도 않았어요,,ㅋㅋㅋㅋ 이렇게 로스팅 하는 공간이 다 보여서 뭔가 더 커피가 맛있게 느껴지는 기분이랄까요? 매장 곳곳에는 업사이드커피의 로고인 물개?수달?을 찾을 수가 있습니다! 여러가지 MD 제품과 원두도 판매중이였구요! 심플하게 파운드케이크도 판매중이였어요! 아메리카노와 아이스 플랫화이트를 주문했구요! 저는 개인적으로 아메리카노가 살짝 연하게 느껴지는 아쉬움이 있었어요- 평일이지만 금요일이었기에 사람이 많으면 어떡하나 걱정했는데 대부분이 혼자 온 손님들이고, 많지도 않아서 여유있게 낮시간 즐기기 너무 좋았습니다!"
"성수동 나들이 - 성수 우콘카레, 업사이드커피","같이 가고 싶은 카레집이 있다구 하여 가게 되었습니다. 둘 다 저녁을 먹지 않아서 매우 배고팠음...후후후 우콘카레 : 네이버 방문자리뷰 333 · 블로그리뷰 293 naver.me 유명한 성수동 맛집 성수다락 근처에 있답니다. 간판이 작아 혼자 갔으면 한바퀴 돌았을거 같아용 가게 내부는 작은편이구, 4인석 셋 / 2인석 하나 / 단체석 하나 / 바스툴 자리 이렇게 있던거 같아요 가격은 모둠카레가 12,000원 그 외에는 9,000원 정도였던거 같아요~ 맛집으로 소문난 곳 치고 아주 합리적인 가격!! 저는 가라아게 카레를 주문했구, 짝꿍은 모둠카레를 주문했습니다. 사실 모둠 말고 새송이카레를 주문하고 싶어 하셨는데 제가 모둠시키라고 했습니다. 미안하다. 매운맛도 선택 가능한데 저는 3단계로 먹었어용 3단계 맵기는 평소 먹던 오뚜기 매운맛 정도였음! 좌) 가라아게카레 우) 모둠카레 가라아게 닭고기가 정말 부드럽구 마싯엇구요 모둠카레는 전부전부 마싯엇어요 카레소스에 야채가 들어간 걸 선호하는 편이라 조금 심심했지만 넘 맛있었어요 담에 오면 새송이카레도 먹어보자....미안하다! 배고파하는 거 같아서 모둠 시키라구 했는데 먹고나서도 배고파하셨음... 카레를 먹고 당충전하러 카페로 고고씽 했음 ^^ 오늘 회사에서 아주 마싯는 카페를 갔다며 데려간 곳 업사이드 커피 입니다 업사이드커피 : 네이버 방문자리뷰 567 · 블로그리뷰 340 naver.me 각각 성수커피와 해방촌커피를 주문했는데,,, 해방촌 커피에 곰돌이 모양으로 안뿌려주셔서 조금 슬펐어요 하지만 징짜마싯엇음 성수커피는 땅콩향이 많이 나는 느낌이었고 해방촌커피는 위에 크림에서 살짝 바닐라향이 느껴지면서 달콤하고오 부드럽고오..마싯고오..따듯하고오..... 넘 마싯었어요 정말루..... 가게에 들어가면 커다란 로스팅기가 3대정도 있는데 신기하더라구요 사장님,, 커피에 진심이시구나 하는 생각으루 저거 치우면 테이블을 몇개를 더 두는데 대단하시다 하는 이야기도 했었음. ... 물끄러미 ... 먹다가 디저트 땡겨서 파운드케이크를 하나 주문했어요 아이스크림은 따로 추가 해야해요(1,000원) 부드럽고 맛있었슴~~~ 달콤한거 좋아하시면 아이스크림 꼭 추가하세용~ 밥이랑 커피 먹고 심심해서 석촌호수까지 걸어갈까~ 했는데 얼어죽을것을 예감하고 그냥 건대갔다눙. 별점... <우콘카레> 마시떠마시떠 <업사이드> 아주좋아! 마시떠 마시떠"
뚝섬 카페/성수동 카페 :: 업사이드커피(upside coffee),"뚝섬 카페, 업사이드커피(upside coffee) 업사이드커피가 해방촌에 있을 때부터 궁금했는데,, 뚝섬점에서 드디어 마셔보네. (해방촌 매장을 가보긴 했는데, 주차할 곳이 마땅치 않아서 내려왔던 기억이) 지금은 해방촌점은 없어지고, 뚝섬점과 성수점, 여의도점만 운영되고 있다. 예상보다도 훨씬 더 좁았던 실내. 근처 직장인들이 테이크아웃을 많이 해서인지, 작은 테이블 3개밖에 없었다. 메뉴판 참고하세요! 라떼(5,000) 예상했던 것처럼 맛있는 맛의 라떼였다. 마켓컬리에도 입점되어 있어서, 4가지 맛의 파우치커피를 판매하고 있던데,, 다음에 한 번 사봐야지. 업사이드커피의 마스코트 귀엽다. 잘 마시고, 잘 쉬다가 갑니다. 주소 - 성동구 왕십리로14길 19-1 전화 - 070.8691.4107 영업시간 - 평일 08:00~20:00/주말 09:00~20:00 50m © NAVER Corp. 업사이드커피 뚝섬점 서울특별시 성동구 왕십리로14길 19-1 1층 업사이드커피"
[뚝섬] 업사이드커피 : 성수동 조용한 디저트 카페 아인슈페너 맛집,"뚝섬 성수 카페 업사이드커피 안녕하세요오 마언니 입니당 😚 이번 주는 클스마스도 있고(비록 토욜..이디만 ㅜㅜㅜㅜ) 해서 그런지 증말로 일 빼고 다 하고 싶은 화욜이네염... ㅋㅋㅋㅋ 오늘은 카페 맛집 몰빵으루 있는 곳 중에 하나인 성수거리에 업사이드 커피 소개해드릴께용! https://m.smartstore.naver.com/up-side_coffee UP.SIDE COFFEE : 네이버쇼핑 스마트스토어 업사이드 커피는 모두의 삶과 일상에 푹 녹아 들고 싶습니다. m.smartstore.naver.com 요기 들어가시면 원두 구경도 할 수 있구 구매도 가능쓰 !! 업사이드커피 서울특별시 성동구 연무장13길 3 한적한 길에 있다 보니 전반적으로 어둑어둑한 편이디만 기여운 수달마크가 요렇게 똿! 여즘 날씨가 추워서 그런지 내부 보기만 해도 다땃해 보이는 건 기분탓인가염.. ㅋㅋㅋㅋㅋ 원두 납품 소개도 되어 있그영 바 형식의 테이블과 원탁 테이블 3-4자리 앉을 수 있는 공간이 있어염 엄청 크고 막 넓고 그렇지는 않지만 조용해서 좋았어요 저는..! 그리구 장인 손길이 듬뿍듬뿍 난다그영 😲😲 기여운 컵들이 무지개 오색빛깔로 샤샤샥 🌈 🌈🌈 뭔가 겨울 너낌 나는 인테리어 ! 겨울에는 외투가 실내 들어오면 걸리적거리는데 옷걸이에 걸 수도 있어욥 👍👍 아인슈페너 5,000 저어는 어랜만에 돌아왓지만 포스팅 하다보니 그 사이 입맛은 하나도 안 변한 거 같아옄ㅋㅋㅋㅋㅋ 아인슈페너 만쉐애 💜 콜드브루 베이스에 크림은 쫀쫀하기보다는 부드러운 편이었어요 달콤한 크림으로 호로록하다가 콜드브루로 입가심하는 너낌 (●'◡'●) 평범한 코스터인 줄 알았디만 커피잔을 들어보니 요기에도 이렇게 수달이 똿 S'more Cookie (말차+화이트초코칩) 3,500 더블 수달 등장 ✨ ✨ 코스터 색깔 다른 거 보세염 짱귀... 😚 밥을 배불리 먹어놓고도 먼가 씹을께 필요했던 저랑 친구는 영롱해 보였던 스모어쿠키 하나 샀오용 ! 거의 마감시간대에 가서 말차만 남아 있어서 픽하기는 했지만 둘 다 말차 덕후라ㅋㅋㅋㅋ 순삭햇답니다아 (+하나씩 포장해온 건 안비밀) 성수동 카페거리답게 괜찮은 카페들이 우수수 있지만 괜찮은 레벨의 커피 맛과 조용한 곳에서 시간 보내고 싶으신 웃님분께 업사이드커피 소개해 드려욤 ! 트레이드 마크인만큼 수달쓰로 마무으리"
[서울 성동] 성수동 카페의 정석시그니처 커피와 쑥스무디 그리고 브라운치즈크로플 :: '업사이드커피',"업사이드커피 up.side coffee 서울시 성동구 연무장13길 3 안녕하세요! 윤자리입니다 😇 같은 카페지만 귀여운 로고가 있는 곳은 더 눈길이 가는 법인데요 ! 성수동 카페로 괜찮은 곳을 검색하다가 파란 색상에 눈에 띄는 캐릭터가 있는 카페를 발견했어요 - 바로 성수동 [업사이드 커피]입니다. 유명한 이 곳, 다녀왔어요! 50m © NAVER Corp. 업사이드커피 서울특별시 성동구 연무장13길 3 성수동 카페 성수 카페 업사이드커피 업사이드 커피는 성수역 3번출구, 성수동 카페거리 옆 골목에 위치 해 있어요 귀여운 미어캣? 캐릭터가 눈에 들어오기때문에 업사이드 커피를 찾기는 어렵지 않았어요 2018년 해방촌에서 시작한 업사이드 커피 업사이드커피는 2018년 해방촌에서 처음 시작한 커피숍인데요. 지금은 성수동과 뚝섬, 여의도에도 매장이 있는 곳이죠 ! 업사이드커피 원두도 굉장히 유명해요 ! 성수동 카페 성수 카페 업사이드커피 내부 업사이드커피 내부모습이에요 - 매장은 작은편이었지만 역시나 테이블은 거의 만석 ! 사람들이 끊임없이 들어오는 곳이었어요 깔끔한 오픈형 공간과 뒷 편에는 원두 로스팅 공간도 마련되어있었어요 업사이드커피 원두가 유명한 이유! 매장 곳곳에는 업사이드커피의 귀여운 캐릭터들이 곳곳에 있었고 원두를 포함한 다양한 MD 상품도 있어요! 성수동 카페 성수 카페 업사이드커피 메뉴 업사이드커피 메뉴판이에요 해방촌커피, 뚝섬커피, 성수커피, 업사이드커피 등 업사이드커피의 각 지점의 이름을 딴 특색있는 시그니처 커피종류가 포인트 ! 이외에도 다양한 커피종류, 스무디 종류도 있었어요 저는 쑥스무디가 먹고싶어서 오기도했답니다! 브라운치즈크로플은 태블릿 메뉴판에 있더라구요! 기존의 메뉴판에 없다고 지나치면 안돼요 ! 파우치와 병에담긴 밀크티 종류도 판매하고 있어요! 매장에서 직접굽는 쿠키와 파운드케이크도! 🍴주문 메뉴🍴 시나몬링 (6,000원) 쑥스무디 (5,500원) 레몬파운드케이크 + 아이스크림 (6,000원) 브라운치즈크로플 (6,500원) 성수동 카페 성수 카페 업사이드커피 식사 메뉴 먼저 등장한 음료와 레몬파운드케이크 ! 고소하고 깊은 맛의 쑥 스무디는 쉽게 만나볼 수 없는 메뉴여서 굉장히 반가웠어요 먹는내내 향긋한 쑥향이 굿~! 시나몬링은 업사이드커피 시그니처 메뉴로 새로나온 메뉴에요 ! 쫀득한 거품과 컵 입구에 시나몬 가루가 있어서 입에 닿을 때마다 달달한 시나몬 가루를 먹을 수 있어요 레몬파운드케이크에 아이스크림을 추가했는데요 바닐라 아이스크림에 크림소스를 레몬파운드케이크과 함께 먹으니 조화롭게 즐길 수 있었어요 - 편안한 맛, 포근 ~ 업사이드커피를 검색하면 무조건 함께 등장하는 브라운 치즈 크로플이에요 ! 위에는 브라운치즈가루가 솔솔 뿌러져있었고 아이스크림도 한 덩어리가 올라가고 ! 고소한 맛보다는 엄청 달달달달한 맛이어서 단 걸 좋아하지 않는 분들은 패쓰하셔도 될 것 같아요! 크로와상 생지는 쫀득쫀득함 그 자 체 성수동 카페 성수 카페 업사이드커피 후기 편안하고 포근한 매장 분위기 다양한 음료 종류와 훌륭한 원두 베이커리도 맛있는데 ! 업사이드커피를 방문한 뒤 느낀점은 음료 라인업이 훌륭하다는 점! 그리고 베이커리와 원두도 직접 만들어서 판매한다는 점이 아주 마음에 들었어요 카페의 정석을 보여주는 업사이드 커피, 방문을 추천합니다 ☺️👍🏻"
"[서울숲 카페] 성수동 업사이드커피 (메뉴, 주차, 테이크아웃 할인)","뚝섬역 근처에 위치한 업사이드커피는 우리가 성수동에서 추천하는 카페 중 한 곳이다. 기본적으로 커피 맛이 좋고 다양한 원두를 선택할 수 있는 전문성이 있다. 그리고 테이크아웃을 하면 1000원이나 할인되는 가격적 매력이 있다. 카페 앞에 1~2대 주차가 가능하다. 매장은 8~10명 정도 이용가능한 작은 편으로 따스한 웜톤의 분위기이다. 동물(미어캣)이 귀엽다. 전자 메뉴판으로 옆으로 넘기며 볼 수 있다. 아메리카노는 두 개의 원두 중 선택이 가능하다. (원두는 시기적으로 바뀐다) 커피 외 다양한 음료도 판매한다. 밀크티와 콜드브루 쿠키도 있다. 처음 방문했을 때, 지니는 아이스아메리카노, 나는 뚝섬커피를 주문했다. 뚝섬커피는 바닐라 아이스크림과 크럼블이 들어가서 씹히는 맛이 있다. 두 번째엔 지니는 아아, 나는 해방촌 커피를 주문했다. 해방촌 커피는 아인슈페너 스타일이다. 세 번째엔 카라멜 라떼를 먹어보았다. 맛있음 ㅎㅎ 인증샷 ㅎㅎ 이 날은 밀크티를 먹었는데 밀크티가 진한 맛이어서 맘에 들었다. 드립백도 구매가능하다. 가격이 저렴한 편인 것 같다. 마침 드립백이 떨어져서 한번 구매해봤다. 집에서 커피가 먹고 싶을 때 드립백으로 커피를 내려먹는게 소소한 행복인 것 같다. 빠른 시일내에 먹으면 좋고 시간이 지나면 향이 날아갈 수도 있다고 한다. 원두도 구매할 수 있다. 원색의 종이컵들 시즌마다 컵 컬러 바꿔서 준다. 오늘 마신 음료 ㅎㅎ 지니는 늘 그렇듯 아이스 아메리카노, 나는 바닐라빈 라떼 바닐라빈 라떼는 시럽을 직접 만드신다고 한다. 여기 달달한 커피는 엄청 달지 않아서 좋다. 또 올게 ㅎㅎ 50m © NAVER Corp. 업사이드커피 뚝섬점 서울특별시 성동구 성수동1가 7-8 #서울숲카페 #뚝섬역카페 #성수동카페 #카페 #맛집 #테이크아웃 #업사이드커피"
"성수동 바닐라빈 라떼가 넘 맛있는 카페, 달달한 커피가 가득 🍪🧋🍹☕🍨 @업사이드커피","평소 커피를 좋아하는 친구로부터 커피가 맛있는 곳이라며 추천받은 @업사이드커피 성수동에 데이트 간 김에 들려봤다 업사이드커피 서울특별시 성동구 연무장13길 3 카페가 작은데도 사람들이 많았다 거의 만석 확실히 맛있나보다 했던 ,, 전체적으로 달달한 커피 메뉴가 많았다 카라멜이나 아이스크림 등 달달한게 올라간 커피들이 많았던 ,, 오빠는 성수커피 나는 바닐라빈 라떼 파운드하고 스모어 쿠키같은 디저트류도 파는데 우리는 테이크아웃 할거라 패쓰 커피를 기다리며 찍은 카페 내부 곳곳에 예쁜 곳들이 가득해서 기분 좋았던 여기 업사이드커피의 캐릭터인가 보오 강아지는 아닌갓 같구 ,, 수달인가 아니지 무슨 동물이더라 아 미어캣인강 ,,, 머선 동물인지는 모르겠구 일단 커피샷 오빠거 성수커피 내 입맛엔 오빠거보다 내거가 더 맛났다 ,, 바닐라빈 ,, 업사이드 커피 한 잔씩 사들고 성수 골목 구석 구석 누비기 날도 좋고 커피도 좋고 하늘도 좋고 차 막히기 전에 집으로 춍춍 =3 #업사이드커피 #성수업사이드 #성수업사이드카페 #성수카페 #성수카페추천 #성수카페맛집 #성수카페 #성수역카페 #성수역커피가맛있는곳"
서울 성수동 카페 업사이드커피 뚝섬점,"뚝섬역 카페 UP SIDE 커피가 맛있는 작은 공간 해방촌에서 시작한 업사이드 커피 뚝섬역에 위치한 뚝섬점에 방문하였다. 1번 출구 뒷골목에 위치해 있다. 매장 앞 주차 불가 매장이다. 카페 안 공간은 정말 좁고 작다. 손님들이 꽤 많았던 곳이며 웨이팅도 살짝 있었음 가운데 바좌석과 뒤쪽으로 테이블 몇게 있음 귀여운 수달이 마스코트인 업사이드 커피. 원두도 로스팅하여 판매한다. 거피를 내리는 공간. #업사이드커피메뉴 시그니처 커피인 #해방촌커피 와 #뚝섬커피 티와 라떼 일반 커피도 준비되어 있다. 아메리카노는 4,000원 부터 시작이다. 생화가 너무 예뻤던 카페 아기자기 하게 인테리어도 정말 잘해 두었다. 커피도 팩포장하여 판매하는듯 하였다. 오늘은 달달한 바닐라 라떼 한 잔. 좁고 손님들이 많아 어수선 하여 오래 작업이나 책을 읽는 분위기는 아닌듯. 커피맛도 괜찮았고 공간이 정말 좋았던 카페였다. 50m © NAVER Corp. 업사이드커피 뚝섬점 서울특별시 성동구 왕십리로14길 19-1 1층 업사이드커피 영업시간 매일 08:00 ~ 19:00 주말 10:00 오픈 서울 성동구 왕십리로14길 19-1 1층 업사이드커피 전화번호 0507 1386 7579"
