title,content
성수동 브런치맛집 성수역 테니 tenne 서울 애견동반 카페,"☕️ 성수동 브런치맛집 성수역 테니 tenne 서울 애견동반 카페 대만족 내돈내산 후기 글/사진 윤제주 안녕하세요. 여행 인플루언서 윤제주입니다! 이번 서울 여행중 요즘 가장 핫하다는 성수동 핫플 뿌수기를 해봤는데요~ 우연히 지나가는데 너무 예뻐보이는 카페가 있는거에요..!! 찾아보니 브런치 전문 카페였는데 계속 눈앞에 아른아른 거려.. 원래 목적지였던 더반베를린 성수점에서 1차 커피하고 바로 2차로 카페 다녀온곳이에요. 마침 출출했던지라 브런치로 간단하게 허기도 달랠수있었던 성수 브런치 카페였습니다. 테니 •주소 : 서울 성동구 뚝섬로17가길 55 1층 •시간 : 매일 08:00 - 21:30 / 20:00 라스트오더 50m © NAVER Corp. 테니 서울특별시 성동구 뚝섬로17가길 55 1층 예약 테니 외관 제가 반했던 성수동 브런치카페의 외관입니다. 유럽느낌 한스푼 나는 감성에 예쁜 크리스마스 장식까지 곳곳에 보여 눈에 딱 띄더라구요. 참을 수 없다 바로 돌진했죠..^^ 테니 내부 사실 사진엄청 많이 찍었는데ㅜ 휴대폰 바꾸면서 클라우드 백업과정에서 문제가생겨많이 날라갔어요 흑흑... 생각보다 내부가 엄~청 넓구요! 브런치 카페인줄만 알았는데 일반 빵 종류도 엄청많았어요. 식사대용으로도 충분한 포차키아 바게트, 치아바타등 빵 종류도 다양해서 식사부터 디저트까지 다 즐길 수있는 곳이에요! 후기 보니 주위 직장인 분들도 브런치로 점심드시러 오시는 분들도 많더라구요~ 테니 메뉴&가격 11:30 ~ 2:30까지는 런치 세트메뉴로 커피/티류 2000원 할인등 가성비 좋게 즐길 수 있으니 참고바라고요! 일단 단품 기준 커피 아메리카노 5천원 브런치 메뉴는 8천원~1만원 중반대라 가격이 정말 합리적이더라구요! 또한 소식좌를 위한 샌드위치 하프사이즈!!! 반쪽만도 팔아서 간단하게 간식겸 먹기도 좋겠습니다. 테니 야외 공간 여름에는 그냥 야외 좌석으로 운영되는 이 테라스 공간, 겨울에는 이렇게 막이 쳐져있고 난로도 있었어요! 추워져서 그런가ㅜㅜ 난로가 있음에도 쌀쌀해서 야외에 앉기는 무리였는데요. 참고로 애견동반 가능한 브런치 카페라 반려동물 데리고 오시는 분들도 많았어요!!! 입구쪽에는 창가를 향한자리..! 이쪽라인이 인기 자리인지 만석이었습니다 ㅜㅜ흑흑.. 내부 자리는 2인석 + 4인석 고루고루 많았구요! 자리도 꽤 편했답니다. 제가 픽했던 자리~! 쿠션도 빵빵해서 푹신하고 좋았어요:) 테니 주문 메뉴, 가격 크로크 마감 10,000원 아메리카노 5000원 *세트할인 -2000원 라임민트티 6000원 주문한 브런치와 커피, 티 메뉴가 등장!!!!! 냄새부터 미쳤다했는데 아웅 크로크 마담 넘넘 맛있어요.. 크로크무슈 + 계란 반숙인데 존맛탱입니다. 런치 시간에 방문해서 티 한잔(아메리카노)은 -2000원도 받아서 가성비 굿이였어요! 커피도 꼬숩고 무난하게 괜찮았고 라임민트티는 스벅에서 먹어본ㅊ 이후로 처음마셔보는데 적당히 달콤하고 맛나더라구요! 브런치 두번드세요 세번드세요... 다른 메뉴는 안먹어봤지만 근처 살거나 직장이 이쪽이였다면 성수동 브런치 테니에서 도장깨기 했을것 같아요. 안갔으면 후회할뻔한 테니! 맛, 가격, 인테리어 모두 만족했습니다. 성수동 간다면 강추드려요!!!!!! 브런치 무조건먹기 배부르면 빵이라도 먹기 보기만 해도 존맛일것 같았어요. ✨✨✨ 함께 방문하기 좋은 성수동 핫플 디올성수 ▼ 성수 놀거리 디올성수 팝업스토어 라이트닝쇼 크리스마스 미디어아트 시간 🎄 성수 놀거리 &성수동 핫플 디올성수 야외정원 라이트닝 크리스마스 미디어아트 시간 포함 솔직후... m.blog.naver.com"
[성수동 베이커리] 테니 : 삼성동 현백에도 있는 슈 맛집✨,회사간식으로 먹고 뿅가버린.. 나의 당수치를 아름답게 올려준 디저트가 있었으니 … 성수동 테니 베이커리 맛집 & 브런치도 맛도리 Tenne🥨 : 잘-구웠다 ! 50m © NAVER Corp. 테니 서울특별시 성동구 뚝섬로17가길 55 1층 예약 테니 본점은 성수동 뚝섬로에 위치하고 있지만 삼성역 현대백화점무역센터점에서도 구매가능한 테니의 빵들👀 포장도 깔끔하니 예뻐서 받는이도 기분좋아진당ㅎ 왼쪽부터 오른쪽으로 초코맛 > 얼그레이 > 캬라멜바닐라맛 처음 맛 볼 때는 해동이 꼬ㅐ~됀 상태여서 그런지 슈가 주르륵 흘러버렸다.. 이 상태로도 행복한 맛이지만 좀더 맛있게 먹기 위해 냉장고로 ㄱㄱ 당 떨어지는 마의 4시가 되어 다시 소환된 슈들💕 얼그레이 슈 / 초코 슈 바삭하고 고소고소한 소보루 슈 안에 향긋한 얼그레이 슈크림이 빵빵하게👀 ㅏ..이건 행복이야 맛의 그라데이숀을 위해 아껴둔 초코슈도 얌🤭 오옷..! 초코맛이 밀크가 아니라 다크초코다 취향저격🔫 슈 껍데기에도 다크다크한 초코맛이 함께 있어서 온전히 초코에 빠져드는 맛ㅠ 화룡점정 캬라멜바닐라 슈 기본 바닐라도 맛있는데 진한 캬라멜소스까지 맛도리 니킥 제대로 날리신다.. 개인적으론 초코 > 캬라멜바닐라 > 얼그레이 순으로 맛도리였다 간단하면서 센스있는 선물로도 괜찮을 것 같아 개인적으로도 방문해봐야겠다 🤭 당떨어지는 초코순이 & 빵수니덜 꼭 잡솨바〰️
[카페] 성수동 테니(Tenne) : 바삭 달콤 퀸아망과 슈가 맛있는 디저트카페,"성수동 테니(Tenne) : 핫하다 못해 너무 뜨거웠던 주말 성수동, 맛집 탐방기 #2 “바삭함의 극치를 보여주는 퀸아망이 대표적인 디저트 카페, 테니(Tenne)” 50m © NAVER Corp. 테니 서울특별시 성동구 뚝섬로17가길 55 1층 예약 리미투어의 두번째 장소, 디저트카페 테니. 피자로는 배가 차지 않아 평소에 리미가 가고싶어했던 디저트카페에 방문했다. 내,외관은 서울 시내에 위치한 여느 카페보다는 웅장한 느낌? 협소하진 않은 듯..? 내부에도 좌석들이 꽤 있었고 테라스도 별도 마련되어져 있었다. 인테리어도 매우 깔끔했지만 이미 입소문을 탄 곳인지 사람이 많아 주말에는 쉽게 자리를 잡을 수 없다는 것이 문제. 우리는 운좋게 막 자리에서 일어나는 손님이 있어 그자리로 겟! 타이밍이 안맞았더라면 자리가 없어서 다른 곳으로 이동하지 않았을까.. Next image 디저트 카페 답게 베이커리 종류가 눈길을 사로잡았고 특히나 슈들이 아주 기욤기욤한게 날 좀 먹어 달라고 유혹함. 피자를 먹고 난 직후라 이것저것 맛보기엔 부담스러워서 대표메뉴인 퀸아망 한가지 종류와 슈 한 종류, 아메리카노 주문! 얼그레이 퀸아망(₩4,800) 몽블랑슈(₩5,000) 처음에 뒤집혀서 잘못나온 줄 알았던 퀸아망. 정상이었다고 한다.. 머쓱. 일단 퀸아망은 완전 내 취향저격. 바삭하고 달콤하니 버터풍미 가득한게 1인 1퀸아망해도 부족할 정도. 이곳의 대표메뉴라고 하던데 인정하지 않을 수 없는 맛. 하지만 몽블랑 슈는.. 밤의 달콤한 맛을 기대했던 나에겐 슈 안쪽 크림이 레몬맛이어서 개인적으로는 입에 맞진 않았다. 함께한 리미와 보갱이는 슈 겉면의 식감과 크림 모두 만족스러워 했다. 레몬향이 강하지는 않았지만.. 기회가 되면 다른 슈를 먹어 보는 것으로..! 커피는 잔당 ₩5,000원으로 합리적인 가격이라 굿. 커피 풍미도 크레마도 부드러워서 쌀쌀해지는 날씨에 따뜻하게 몸녹이기에 좋았다. (애 낳은 나만 뜨아..) 성수동 근처에서 맛있는 퀸아망이 먹고싶다면..? 원래 퀸아망하면 뚝섬의 서울앵무새이지만 테니의 퀸아망도 이곳 못지 않게 맛있기 때문에 성수역에서 가까운 거리에 있는 곳에서 슈도 맛보며 커피한잔하면 좋을 것 같은 곳!"
"성수동 카페 테니 Tenne, 유럽 감성 가득 베이커리 디저트 카페","테니 Tenne 서울 성동구 뚝섬로17가길 55 1층 월-목 08:00-21:30 금 08:00-22:30 토 10:00-22:30 일 10:00-21:30 0507-1341-3094 성수동 카페 찾아 보다가 발견한 테니!! 테라스쪽이 너무 분위기 있고 유럽 감성 낭낭😊😊 더 추워지기 전에 테라스에서 커피 마시고 싶어서 바루 웨이팅 걸었다. 가게 안에 테이블링으로 웨이팅 걸어두고 밖에서 10-20정도 기다리고 입장 들어가면 요렇게 메뉴판 주시는데 식사 메뉴도 따로 있었지만 이미 밥먹고 커피 마시고 싶어서 간 것이라 카페 메뉴만 ⭐모든 커피메뉴에 디카페인으로 변경 가능⭐ 베이커리 메뉴 퀸아망 뉴욕롤 크루아상이 종류별로 있는데 다 맛있어 보인다😚😚 특히 초코 뉴욕롤은 마지막 하나 남은 거 바로 겟-⭐ 주말이라서 그런지 빵 빠지는 게 하나씩 보였는데 인기 품목은 잘 빠지는 거 같았다,, 이와중에 4명이서 가서 빵 4개 고름,,ㅎㅎ 뉴욕 초코롤 5,500원 브리오슈 슈크레 3,500원 커피 카라멜 퀸아망 5,000원 얼그레이 퀸아망 5,000원 퀸아망 두개는 요렇게 바스켓에 담아주는 데 더 보기 좋고 맛있어 보였다🤭 개인적으로 커피 카라멜 퀸아망이 얼그레이보다 맛있었는데 여기 있는 빵은 뭐든 그냥 다 맛있어!!🥰🥰 웬만하면 아무거나 집어도 다 존맛존맛일듯!! 커피까지 나오고 한샷☕☕ 테라스에서 먹는 분위기 너무 좋아!! 저녁 가까이 될수록 추웠지만 겉옷 입고 충분히 즐겼다 앉아있는데 참새가 왔다갔다 넘 귀여워서 찍었다 나무랑 의자랑 조합이 이뻐서,,ㅎㅎ 개인적으로 또 한번 더 가고 싶은 카페!! 우리는 테라스에 앉았지만 안에 테이블도 좋고 분위기도 좋아보여서 겨울이나 여름에 가게 안에서도 빵이랑 커피 마시면 넘넘 좋을 거 같다😄😄 50m © NAVER Corp. 테니 서울특별시 성동구 뚝섬로17가길 55 1층 예약 #성수동카페#성수카페#성수동베이커리카페#성수동디저트카페#성수동테니#테니#퀸아망#뉴욕롤#성수핫플"
[카페] 성수동 “테니 Tenne” 유럽여행.. 같은 브런치카페🧡,"테니 친구랑 성수동에 브런치 카페를 다녀왔어요! 요기가.. 요즘 핫플이더라구요!! 친구가 찾은곳인데, ‘캐치테이블’로 미리 예약을 하고 다녀왔어요! 분위기..너무 좋아요…!! 제 취향저격.. 🧡 50m © NAVER Corp. 테니 서울특별시 성동구 뚝섬로17가길 55 1층 예약 가게에 주차공간은 총6대 정도 가능한데, 매장이용 3대 , 테이크아웃3대 이렇게 공간이 있더라구요! 자리가 없으면 근처에 공영주차장을 이용해야 해요, 정기휴무 : X 영업시간 : 월~금 : 8시~21시반 토~일 : 10시~21시반 코너에 있는데, 외관이 화사한 느낌이라 딱 눈에 들어옵니당! 오렌지색 테니Tenne 로고가 정말 예뻐요! 외국같은 감성이야.. 여자들이 좋아할거같은 브런치 카페에요 ! 들어가는 순간 또오고 싶어짐.. ! 인테리어도 정말 유럽느낌나네.. 나 지금 여행왔냐..? ㅎㅎ 아니 뭐가 이렇게 깔끔하고, 유럽같고.. 뭔가 또 호텔 로비 온듯한 느낌이네… 뭔지 아시죠? ㅎㅎㅎㅎ 브런치 메뉴뿐아니라.. 베이커리가 정말 대단하더라구요…!! 너무 예뻐..ㅎㅎ 맛보기도전에 맛을 알거같은 느낌…! 어쩐지.. 테이크아웃도 많이 하더라!! 베이커리도 진짜 너무 훌륭..! 저희는 이렇게 주문했어요! - 프렌치 어니언 수프 - 브리오슈 프렌치 토스트 - 라구파스타 프렌치 토스트.. 너무 촉촉하고.. 두툼하니.. 맛있어요!!!! 플레이트에 로고도 넘 귀엽넹 ! 성수 브런치 카페 테니 Tenne 재생 4 좋아요 0  접기/펴기 브런치🧡 요긴.. 또 다시 가고싶네요.. ! 뭔가 여기서 밥먹으면 뭔가 주말에 여유롭게 브런치를 먹는 느낌이라고나 할까요? 힐링이 되는 공간이에요! 평생..놀고먹고 싶어지는 여유를 부리고 싶다고 느껴지는 공간..! 예쁜공간과 예쁜음식들로 제 취향이더라구용 ㅎㅎ 요 귀여운.. 눈사람씨 ☃️도 따뜻해져서 녹기전에 얼른 만나고 오세요! ㅎㅎㅎ #성수동 #성수동카페 #성수브런치카페 #성수테니 #tenne #성수동카페"
성수동에서 유럽감성 느낄 수 있는 신상카페_ Tenne 테니,"성수동에서 밥먹고 좀 걷다가 발견한 분위기 완전 좋은 카페! 이 근처 회사를 다닐 땐 이정도까지 아니었는데 계속 새로운 식당, 카페가 생기면서 이 주변도 성수의 또다른 핫플이 되고있다 아 지금 회사도 성수동이었으면 좋겠다,, Tenne 테니 영업시간 08:00~21:30 라스트오더 20:00 공휴일, 주말오픈 10:00 아침 일찍 오픈에 8~11시까지는 빵 10% 할인까지 하니까 브런치 먹기에도 딱 좋을 것 같다! 이렇게 야외에 테라스도 넓어서 더 분위기가 좋은 것 같은 느낌ㅠㅠ 외관부터 엄청나게 이쁜 카페다 사실 외관보고 바로 들어간거라ㅋㅋㅋ 자리 먼저 잡으려고 내부를 봤는데 세상에,, 내부도 넓고 이쁘면,, 자꾸 오고싶잖아,, 바 테이블도 있고,, 안으로 쭉 들어와서 오른쪽으로 꺾으면 내부에 공간이 또 있다 여기는 더 아늑하고 분위기 더 좋았음,, 내가 앉은 자리는 여기,, 밖에 또 야외 테이블도 있고 엄청 넓고 분위기 좋은 카페라니ㅠㅠ 너무 좋자나!!!!! 글의 절반은ㅋㅋㅋㅋ 분위기 좋다는 글인듯 근데 진짜 좋은 걸 어떡해ㅎ___ㅎ 병음료, 맥주, 와인, 샌드위치 등 입구부터 맛있는 거 천지~ 빵 종류 보세요ㅠㅠㅠ 회사나 집앞에 이런 카페 있으면 맨날 가서 사먹어야지,, 못 참아,, 가격도 비싸다고 생각은 들지 않았음! 스콘 이런 건 3,000원 하는 것도 있고 카페에서 5,000원 이하 빵이 다양한 건 아주 좋은 일이라고 생각함 커피랑 음료 메뉴는 막 다양하진 않지만 그래도 다 맛있는 것만 있었다 빵이 다양하니까 음료는 이정도면 충분해유 판매하는 와인도 있고 다 이뻐서 다음에 파티할 때 사자며ㅋㅋㅋ 기약없는 약속을 하고왔음ㅋㅋㅋ 글라스 와인은 이렇게 판매하는데 신기하다,, 와인 안 먹지만 궁금해서 한 잔 시켜보고 싶었달까 우리가 시킨 음료는 라임민트 티, 라임민트에이드, 아이스 얼그레이 디저트는 감자베이컨 포카치아! 배불러도 디저트는 포기할 수 없지,, 음료는 양도 많고 맛있게 잘 먹었고 빵도 엄청 푹신하고 감자도 포슬포슬하게 맛있었다 ㅠㅠ 포카치아 좋아하는 사람은 아주 만족할지도! 이쁘고 분위기 너무 좋고 맛까지 있는 신상카페 테니 추천함니다!!! 다음에 빵 사러 가야쥐 50m © NAVER Corp. 테니 서울특별시 성동구 뚝섬로17가길 55 1층 예약 #성수동카페 #성수역카페 #성수동디저트카페 #성수동핫플 #성수동카페거리 #성수맛집 #성수동카페추천 #성수동브런치가게추천 #성수동빵집추천 #성수동와인바 #성수동테라스카페 #성수동분위기좋은카페 #테니 #Tenne #성수동테니 #카페테니 #성수동내돈내산카페"
성수동카페 브런치맛집 테니 Tenné 유럽풍 인테리어 야외테라스 #성수로와,"안녕하세요, 성수로와 맛잘알 에디터 지주입니다 : ) 오늘은 길을 걷다 우연하게 알게 된 성수동카페 테니 Tenné 방문 후기를 준비했어요. 가게 외관이 너무 예뻐서 마음 속에 보관해 뒀다가 성수로와 에디터들과 함께 다녀오게 되었는데요. 유럽풍 인테리어부터 맛있는 브런치 메뉴까지 모두 만족스러워서 재방문 의사 200%인 성수동카페 테니를 소개합니다~ <네이버 지도 삽입: 서울 성동구 뚝섬로17가길 55 1층> 50m © NAVER Corp. 테니 서울특별시 성동구 뚝섬로17가길 55 1층 테니는 오렌지 브라운, 황갈색을 뜻하는데요. 가게 이름으로 잘 구워진 빵의 색을 표현하고 싶었다고 해요. 유럽식 식사빵, 페이스트리, 디저트를 비롯한 브런치, 커피, 와인, 맥주 등 다양한 음식을 즐길 수 있는 성수동카페랍니다. 성수동카페 테니는 파리의 빵집을 떠올리게 하는데요. 특히 매장 왼쪽에 마련되어 있는 테라스가 매력 포인트입니다~ 성수로와 에디터들과 11시 10분쯤 도착했는데 이미 테라스 자리는 다 차있더라구요ㅠㅠ 아쉽지만 다음을 기약하며 내부로 들어왔어요. *평일 5시 이후에 브런치 및 샌드위치류 식사를 이용하는 경우 예약이 가능하다고 해요. 테라스 자리를 원하는 분들은 예약을 이용하면 좋을 것 같아요. 겉으로 봤을 때는 내부 공간이 좁을 것 같았는데 막상 들어와 보니 비밀의 공간이 있더라구요~ 저희는 제일 안쪽에 자리를 잡았는데요. 바로 옆에 작은 테라스로 나가는 문이 있었어요! 내부 공간이랑은 또 다른 분위기였는데요. 잠시 앉아서 구경을 하니 진짜 유럽에 와있는 기분이 들었어요ㅎㅎ 성수로와 에디터 픽은? 잠봉뵈르 11,000원 치아바타 치킨샌드위치 10,000원 터키B.L.T. 샌드위치 9,500원 잡곡 사우어도어(1/2) 4,000원 아메리카노 5,000원 저는 소문난 잠봉뵈르 애호가인데요. 여러 성수동카페에서 잠봉뵈르를 먹어봤는데 가게마다 다 다른맛이라 신기해요ㅋㅋ 테니 잠봉뵈르는 버터가 특이했어요. 버터에 크렌베리가 섞여 있어서 상큼했고 햄도 많이 들어있어서 먹는 내내 입이 즐거웠답니다. 치아바타 치킨샌드위치도 정말 맛있었어요. 빵에 바질페스토가 들어가 있어서 프레시하게 즐길 수 있었는데요. 치킨이랑 다른 야채들도 한 가득 들어있어서 한 끼 식사로 딱 좋았어요. 잠봉뵈르랑 치아바타 치킨샌드위치는 하프로 주문도 가능하다는 점 참고해주세요~ 사실 터키 B.L.T 샌드위치는 주변에서 흔하게 볼 수 있는 비쥬얼이라 큰 기대가 없었는데요. 먹어보니 생각이 완전 달라졌어요!! 성수동카페 테니의 잠봉뵈르, 치아바타 치킨샌드위치, 터키 B.L.T 샌드위치 중 제일 맛있었거든요~ 샌드위치 안에 바삭하게 구워진 베이컨이 들어가는데 진짜 맛있었어요ㅠㅠ 여러분도 꼭 드셔보세요! 그렇다고 다른 메뉴가 맛이 없다는 건 아니고 원픽을 정하기 힘들 정도로 다 맛있으니까 여럿이 함께 가서 다양한 메뉴를 나눠 먹는 걸 추천할게요^^ 혹시나 샌드위치로 양이 부족할까 싶어서 잡곡 사우어도어도 주문했는데요! 겉은 바삭하고 속은 쫄깃쫄깃 아주 담백하니 맛있더라구요. 풀, 하프 이렇게 두 가지로 구매 가능하답니다. 매장에서 직접 빵을 굽는 시스템이라 더욱 맛있었던 것 같아요~ 성수동카페 테니에서 평일 아침 8시부터 11시까지 베이커리 10%할인을 진행한다고 하니 근처에 있는 분들은 꼭 이용해 보길 바랄게요~ [테니 Tenné] 평일: 08:00-21:30 주말 및 공휴일: 10:00-21:00 @tenne_seongsu 다른 성수동카페 및 맛집이 궁금하다면 성수로와 인스타 팔로우해보세요~ 한 눈에 성수동 핫플레이스를 구경할 수 있답니다."
[테니] 유럽감성 듬뿍 성수동 카페,"성수동에서 유럽 감성을 느끼고 싶다면 여기로~~ #테니 주차 당연히 없구요,, 주말 오후에 갔는데 웨이팅이 있었다 실내 자리랑 테라스 자리 따로 웨이팅 등록을 할 수 있었고 테라스 자리로 웨이팅 걸었는데 10분정도 기다리니 차례가 왔다! 바로 옆 디플랫에서 옷 구경하다가 생각보다 빨리 차례가 와서 후다닥 내려감 여기가 우리가 앉은 자리 날씨가 따뜻할 때는 가게 외벽따라 쭈욱 테이블이 있어서 엄청 멋있고 느낌있다구 같이 간 친구가 말해줬다ㅋㅋ 하지만 지금은 추워서 테라스 자리는 몇개 없었다 6테이블 정도있었던듯? 그리구 이건 나올 때 발견해서 몰랐는데 나중에 검색해보니 테라스는 #애견동반 가능하다고 한다! 강아지 물컵 준비해놓은 센스👍 빵 종류는 여러 가지 있었는데 퀸아망이랑 슈크림빵이 선물 상자가 있는 걸 보고 그렇다면 저 두개가 메인이다! 라며 각각 하나씩 시켰다ㅋㅋㅋ 주문할 때 테이블 번호를 물어보시고 자리로 갖다주샤서 너무 좋다😊 우리가 시킨건 페니로쉐(왼) 커피카라멜퀸아망(오) 페니로쉐는 이름에서도 유추할 수 있듯이 페레로로쉐맛인데 안에 크림이 아주 가득하다! 전혀 느끼하지도 많이 달지도 않아서 페레로로쉐의 고급버전을 먹는듯했다 그리구 더 맛있었던 퀸아망!!!! 퀸아망이 훨씬 더 내 스타일이었다. 겉에 커피카라멜 시럽으로 코팅되어서 엄청 빠작빠작한ㅠㅠ 이렇게 겹겹 사이에도 커피카라멜❤️ 한입 마시고 커피 한모금 마시면 헤브으으으은❤️ 하 진짜 밀가루 설탕 버터 너무 좋아..... 커피는 모두 #디카페인 으로 변경할 수 있어서 또 더 맘에 드는 곳~~~~~ 이날은 그냥 커피 마셨지만 커피 줄이기 시작한 뒤부터는 디카페인 옵션 있는 곳 보면 너무 감사하고 더 애정이 간다 암튼 #퀸아망 먹으러 한 번 더 가고 싶은 곳입니당 #성수동맛집 #성수동카페 #성수동데이트 #디저트카페 #애견동반카페 #성수동애견동반 #테라스카페"
