title,content
성수카페[호텔 아우프글렛]신메뉴 베로와상/성수동 신상카페,"부지런히 카페 투어 다니던 어느 날 방문한 성수동 신상 카페 호텔 아우프글렛 서서히 달궈지고 있으니 핫플로 뜨거워지기 전에 다녀오소서 건물 1,2,3 층을 쓰고 있어요 주차장 따로 없어요 (서울 디타워 유료 주차장 이용) 아우프글렛이라는 이름의 성수동 호텔로 착각할 수 있지만 노노노 70-80년대 호텔을 모티브로 한 카페에요 그래서인가 입구부터 블랙으로 세련된 느낌이랄까 커피 한 잔 들고나와 가볍게 쉬어가기 좋은 자리도 있구요 1층 로비 1층은 주문하고 빵을 고르는 곳 좌석은 없어요 안 그래도 두리번두리번 거리니 직원분이 2층에 자리부터 잡고 오시라며 ㅋㅋ 입구에서 왼쪽으로 나가면 엘리베이터 지하 1층도 아우프글렛이네요 아마도 빵을 만드는 곳인가 봐요 2층 라운지 창가 쪽은 모두 바자리 벽 쪽으로는 모두 2인석 테이블 블랙 앤 화이트 바닥 타일이 반질반질하니 호텔 라운지 느낌 나요 테이블 간 간격이 넓진 않아서 손님 많으면 좀 갑갑하긴 할 것 같고 손님 없는 무드는 딱 이렇게 자리 잡아 놓고 3층도 구경 가요 3층 오피스 굿즈를 판매한다고 얼핏 들은 거 같은데 개인 사무실 느낌이라 더 이상 다가서지 못하고 먼발치에서 잠깐 아직 미완성인 거 같았어요 주문하러 다시 1층으로 내려왔어요 이미 다른 지점들이 많고 (금호, 한남, 연남, 잠실, 도산) 성수동이 6호점이라고 하는데 저는 아우프글렛 이번에 알았네요 ㅎㅎ 성수점은 오픈한지 채 한 달이 안 된 신상 카페 쌔삥 스멜~^^ 더위 먹었었는지 음료 메뉴판을 못 찍었어요😅 호텔 아우프글렛의 시그니처인 베로와상 궁금해서 빵 구경이나 실컷 하자 했는데 품절된 종류도 있고 뭐.. (베이글+크로와상) 트리플 크림치즈 먹고 싶었는데 품절 아몬드 크림치즈랑 오렌지랑 코코넛만 진열 중 바게트도 두 종류 베이컨 치즈가 맛있을 거 같아 하나 고르고 포카치아도 궁금했지만 패스 케이크 종류가 많이 없더라구요 이름표만 달랑 남아 있는 쇼케이스 그래도 엘리베이터로 오르락내리락 힘들진 않았어요^^ 한숨 돌리고 바라보니 자리 지키던 손님들 빠져나가고 한가하니 있을만하네 샤인머스캣 에이드 6.5 카페 라떼 5.5 베로와상 6.0 더블 베이컨 치즈 바게트 7.5 베로와상 반으로 자르러 집어 드니 폭신폭신 기대만큼은 아니지만 무난했구요 차라리 바게트가 맛도리😋 짭짤한 베이컨과 크림치즈 조화 너는 포장도 하나 해야겠다 더운 날 돌아다녀서인지 세 모금에 끝내버린 라떼 원두 두 가지 중 고를 수 있어요 저는 언제나 고소한 맛 ㅎㅎ 커피 맛있습니다 무난할 것 같던 샤인머스캣 에이드는 기대 이상으로 👍🏻 영상은 빠트리지 않고 찍어야죠^^ 성수 서울숲카페 아우프글렛 신상카페 베로아상 재생 1 좋아요 0 00:00 00:19  성수 서울숲카페 아우프글렛 신상카페 베로아상 주차장이 가깝진 않아서 대중교통이 편리하실 거예요 뚝섬역에서 5분 거리입니다~ 카페에서 나와 몇 발짝 걸으면 로와이드 성수점도 있으니 엮어가셔도 좋으실 거예요~😉 영업시간 11:30 - 20:30 주소 서울 성동구 왕십리로 10길 9-2 주차 불가(디타워 주차장 이용) 50m © NAVER Corp. 호텔 아우프글렛 성수점 서울특별시 성동구 왕십리로10길 9-2"
성수동 카페 디저트 맛집- 그냥 지나치면 클나! 아우프글렛 성수,"세똥이랑 성수동에 갔습니당~ 성수동에 볼 일? 을 보고 둘이서 정처 없이 걷고 걸었습니다.. 카페가 어디 있나.. 왜냐하면? 어느 카페를 갈지 아무런 계획이 없었기 때문입니다..! 세똥이는 성수동에 온 목적이 분명해서 그 목적을 이루고 나니 멍해졌고 저도 덩달아 멍~~ 걷고 걷다가 어? 가까이 와보니 카페였자나?? 호텔 아웊글렛? 모야 어떻게 읽는 거야? 둘이 그러다가 여기다! 더우니까 얼른 들어가자! 해서 바로 들어갔어용ㅋㅋㅋ 검정 창이라 그런가 감각적으로 보인달까?..ㅎㅎ Good morning Good afternoon Good evening 입구에 러그도 깔려있고 진짜 호텔인 줄 알겠어요ㅎㅎ 들어갔는데 검정 타일과 거울에 빛이 비쳐서 그런가 약간 한여름 아스팔트에 아지랑이 일어나는 느낌? 약간 몽롱~ 했어요ㅋㅋㅋㅋㅋㅋ 먹고 가려면 일단 자리부터 잡고 주문해야 한다고 해서 위층으로 올라갔어용 ! 50m © NAVER Corp. 아우프글렛 성수 서울특별시 성동구 왕십리로10길 9-2 뚝섬역 7번 출구에서 제일 가까워요! 아우프글렛 성수 < 운영시간 > 매일 11:30 - 20:30 건물 지하 1층부터 3층까지가 카페인가 봐요! 평일 오후였는데도 사람이 많아서 거의 모든 자리가 꽉 차있었고.. 자리가 넓지 않고 가까이 붙어있었어요.. 조금 불편.. 창가 자리는 햇빛이 너무너무너무 더워서 패스 남아있는 한자리에 가방을 내려두고 계단을 통해 1층으로 내려갔어용ㅜㅠ 내려가자마자 보이는 예쁜 컵들ㅎㅎ 다들 디저트를 먹고 있었는데 맛있어 보여서 하나만 먹어보기로 했어요ㅋㅋㅋ 빵들이랑 네모난 모양의 케이크들도 있어요ㅎㅎ 음료 메뉴판은 요기!!! 이 중에서 저희가 고른 것은!! 베로와상 코코넛 크림!!!! 그리고 한결같이 아아~ 베로와상 코코넛 크림은 6,000원 아이스 아메리카노는 5,000원 얼른 먹자!! 호텔 아우프글렛 성수- 베로와상 코코넛 크림 재생 0 좋아요 0  접기/펴기 베로와성 코코넛 크림 신기한 맛! 세똥이가 열심히 잘라줬답니당ㅋㅋㅋㅋㅋㅋ 바삭한 빵이 아니라서 그런가 잘 잘라지지는 않았던 것 같아요..ㅎㅎ 잘라놓은 모습이 조금.. 그렇기는 해두.. 달달한 크림도 있고 코코넛도 들어있고 기대했던 것보다 맛있었어요!! 처음 먹어보는 종류의 빵이라서 그런가 낯설었는데 달달 고소고소 맛나요ㅎㅎ 2층 창가에 놓여있길래 가져다가 구경했어요ㅎㅎ 1F - 로비 겸 카페 2F - 카페 라운지 3F - 오피스, 기프트샵 독특한 조명도 있구여..ㅎㅎ 그러고는 카페 가면 해야 할 중요한 일이 한 가지 남았죠?!!! 바로 인생샷ㅋㅋㅋㅋㅋ 항상 그렇듯,, 셀카는 한 장도 쓸만한 게 없구여.. (제 얼굴이 문제인 건지..?) 세똥이가 찍어준 사진들이 그나마 봐줄 만하더라고요.. ᄏᄏᄏᄏᄏᄏᄏᄏ 이러쿵 저러쿵 했구요.. 수다쟁이는 이만! 성수동 카페 찾고 계신다면! 아우프글렛 성수 추천드려요!!"
"[성수 맛집, 성수 빵] 아우프글렛 성수동 카페 빵집","아우프글렛 성수 총평 1. 흔하지 않은 디저트를 먹고싶다면 추천 2. 흔하지 않은 카페를 가고싶다면 추천(호텔이라고 검색해야 함, 호텔 컨셉) 3. 1충은 캐셔, 2층이 좌석 자리(창가자리도 있으나, 협소하긴 함) 4. 거울 포토존 있음! 사진 많이 찍는 여자분들이 좋아할 카페 5. 소파가 적당히 푹신해서 오래 앉아 떠들기 좋음 한번쯤은 가볼만 하다! ✔️성수 데이트 코스 ✔️성수 거울 포토존 ✔️성수 특이한 빵집, 특이한 카페 시나몬 베로와상, 피스타치오 다이스 페스츄리 맛 평가 커피: 산미 조금 있는 편(진하지 않고 가볍게 마시기 좋음) 피스타치오 다이스 페스츄리: 안에 바닐라크림이 굉장히 꾸덕하고 페스츄리는 담백한데 뽀송한 느낌은 없음(상큼한 잼도 같이 얇게 발려있는데, 맛있음) 시나몬 베로와상: 입에 넣는 순간, 시나몬 향이 진짜 코를 찌름(안에는 스트링 치즈 같은게 들어있고 개인적으로 빵만 있어도 맛있을 듯) 좌: 좌석, 우: 화장실 단체석이지만 별다른 제한 문구는 없음 내부 전체 빵냄새가 아주 그득그득임 논픽션 향초부터 핸드워시가 비치되어있어서 괜히 더 고급지고 기분 좋음 요즘 한창인 빵지순례하기 성수 빵집으로 추천할 만한 빵집! 소금빵집도 주변에 줄 서있는데, 독특한 아우프글렛도 가보셔요😋 #성수맛집 #빵지순례 #성수빵맛집 #뚝섬빵집 #서울숲빵맛집"
"[성수카페] 성수동 디저트 카페, 아우프글렛 성수","안녕하세요 히피입니다>.< 요즘 핫하디 핫한 동네인 성수동에 위치한 디저트 카페 아우프글렛성수 다녀왔어요. 50m © NAVER Corp. 아우프글렛 성수 서울특별시 성동구 왕십리로10길 9-2 성수동디저트카페 아우프글렛성수는 2호선 뚝섬역 7번 출구로 나와서 도보 10분이면 도착이에요. 자세한 위치는 상단 지도를 참고해주세요:) 아우프글렛성수는 지하1층부터 3층까지 사용하고 있어요. 보니까 지하는 디저트 만드는 곳이고, 3층은 사무실이더라구요. 손님들이 사실상 이용할 수 있는 곳은 1,2층이라고 보시면 돼요! 1층 로비에서 음료 디저트 주문하고, 2층 라운지에서 주문한 음식들 먹을 수 있어요. #성수아우프글렛 음료메뉴판입니다. 다양한 커피 티 에이드 종류가있고, 디저트로 아이스크림과 크로플도 있네요. 다음엔 플랫화이트 먹어볼거에요. 플랫화이트 맛있는거 아시는분!!!!! 플랫화이트 파는 카페 몇 없는데 아우프글렛에 있어서 괜히 반갑네요 히히 저는 이전에 커피를 한잔했기에 시원한 애플망고 에이드 주문했어요. 케이크들.. 작은데 왜이렇게 비싸? 근데 맛은 좋을 것 같아요. 사진 순서대로 코코넛망고케이크 커피케이크 올리브레몬바질케이크에요. 이 외에도 디저트가 엄청 많더라구요. 올리브레몬바질케이크나 코코넛망고케이크는 난생 처음보는 조합의 케이크라 맛이 궁금하네요! 아우프글렛 디저트는 모양도 너무 이쁘게 만들어서 더 식욕을 자극하는 것 같아요. 잼도 귀여운 미니병에 담아서 판매하더라구요. 아우프글렛에서 판매하는 빵이랑 함께 먹어도 좋을 것 같아요~~ 갓 구워져 나온 신선한 빵까지 이정도면 성수동 디저트카페로 인정이요. 케이크부터 빵 크로플 잼 등등 종류가 무척이나 다양하더라구요. 개인적으로 케이크가 젤 맛있어보였어요! 아우프글렛 애플망고 에이드입니다. 달달구리 하고 시원해서 맛좋았어요. 아 그리고 따듯한 아메리카노도 함께 주문했었는데, 아메리카노는 산미가 강한 원두 였어요. 한쪽에는 커피잔까지 판매하고 있었는데, 아기자기 하고 고급진 느낌이라 인테리어용으로 놓아도 괜찮겠더라구요. 성수동 디저트 카페를 찾으신다면 아우프글렛 성수 추천해요! 인테리어도 깔끔하고 맛도좋답니다!"
[서울 성수동] 아우프글렛 성수,"50m © NAVER Corp. 아우프글렛 성수 서울특별시 성동구 왕십리로10길 9-2 성수동1가 656-401 매일 11시 30분 - 20시 30분 전화 070-8858-0828 AUFGLET(@aufglet) • Instagram 사진 및 동영상 팔로워 28K명, 팔로잉 1명, 게시물 1,558개 - AUFGLET(@aufglet)님의 Instagram 사진 및 동영상 보기 instagram.com #호텔아우프글렛 이름으로 성수에 생긴 아우프글렛 1층 ‘로비’에서 주문 후 2층 ‘라운지’로 가면 되는데, 자리가 많은 편은 아니니 자리를 먼저 잡아야 한다 디저트 베루와상 베이커리 시그니처인 베루와상을 포함해 다양한 종류의 베이커리류가 준비되어 있고, 그렇게 결정장애가 생긴다... 왼쪽으로 나가면 엘리베이터가 있다 큰 테이블 하나와 2인석 그리고 창가자리로 되어있다 소파 테이블이 하나 밖에 없고, 2인석 테이블은 따로 이동이 안돼서 여러명이 오면 좀 불편할 것 같다 2인석 자리에 셋이서 앉아 있다가 운 좋게 소파 테이블에 자리가 나서 바로 옮겼다 고소하고 생각보다 맛있었던 #카페라떼 (5.5) 예쁘게 먹기는 힘들지만, 맛있었던 파블로바 #베로와상트러플크림치즈 (6.5) #복숭아파블로바 (9.0) 베이글 + 크로와상이란 새로운 디저트가 탄생했다 부드러우면서 쫀득한 식감의 크로와상이었는데, 크림치즈가 조금 들어있어 치즈 맛이 잘 안 느껴졌다 가격도 조금 센 편이지 않나 싶다 복숭아 파블로바는 일단 복숭아가 맛있었다 달지 않은 크림을 사용해 머랭과 먹기에 부담 없었고 복숭아 콤포트도 또 조화를 극대화해주었다 매장들이 작은 편이라 조금 불편했지만, 새로운 디저트와 베이커리를 맛볼 수 있어 좋았던 성수 직원분들이 수시로 닦고 청소하셔서 깨끗했고 위에 ‘누트’ 쇼룸도 있어 카페에서 시간 보내고 구경하러 가기에도 좋았던 곳이었다"
[성수 카페] 아우프글렛 성수 / 성수 이색카페 / 뚝섬역 카페 / 성수동 카페 / 이색 디저트 / 베로와상 (베이글 + 크로와상) / 호텔 컨셉 카페 / 성수 핫플,"저번화에 이야기 요약.. 오랜만에 카페 투어를 하러 시간을 내서 성수에 간 유미.. 잘 확인도 안 해보고 갔다가 정기휴무날에 방문하게 된다. 결국 그는 원래 가고 싶었던 곳에 가지 못하게 된다. 하지만 하나도 못 가보고 집으로 돌아오게 된다면 아쉬움이 정말 크게 남을 것 같다는 생각에 근처에 있는 다른 카페를 방문하게 되는데.. 아우프글렛 성수 정보 위치 아우프글렛 성수 서울특별시 성동구 왕십리로10길 9-2 연락처 070 - 8858 - 0828 영업시간 월 ~ 일 : 11:30 - 20:30 기타정보 : 따로 주차장이 있긴 한데 정말 작으니 주변에 있는 공영주차장을 이용하시길 바랍니다. 외관 모습 그리하여 버스를 타고 뚝섬역에 내려서 도착한 이곳은 바로 아우프글렛 성수!!!!!! 호텔 분위기가 흘러넘치는 외관 모습. 고급 진 호텔로 들어가는 듯한 느낌의 입구 모습. 자동문 옆에는 아우프글렛 성수에서만 판매하는 특별 메뉴인 '베로와상' 이라는 디저트의 사진이 나와 있습니다! 베로와상이란? : (베이글 + 크루와상)을 조합한 빵이다. (Only 아우프글렛 성수에서만 맛볼 수 있다.) 내부 모습 <1층> 원래 가려고 했던 곳인 '한나'를 못 간 충격으로 제정신이 아니었는지 카운터 사진 찍는 것을 빼먹은 것 같아요 (사진이 없어요.. ㅜㅜ) 아무튼 간에 입구를 통해 들어오면 카운터의 모습이 보입니다. 카운터 쪽에는 이렇게 아우프글렛 성수의 메뉴판이 놓여져 있다. 아이스 아메리카노 가격은 적당한 느낌..! 주변에는 디저트와 빵들이 굉장히 많이 보였는데.. 여기에는 휘낭시에와 마들렌 같은 기본 디저트류가 있었고 쇼케이스 냉장고에는 이렇게 특이하게 생긴 디저트들도 보였다. 특히나 저 네모네모하게 생긴 것들은 맛이 너무 궁금했지만 이미 사 먹을 메뉴들을 정해서 왔기 때문에 패스~~ 마지막으로 여기 구석에는 빵류들이 진열되어 있었다. 그나저나 사장님께서 네모를 좋아하시나 보다. 마지막으로 이것이 바로 오늘의 메인 '베로와상' 가격은 개당 6,500원 정도였다. 아무튼 나는 '베로와상'을 먹으러 왔기 때문에 저 중에서 하나를 주문했다. < 추가 정보 > 자리는 2층에 있고요! 여기가 자리가 얼마 없는데 또 엄청난 핫플이라서 주문하기전에 꼭 2층에서 자리를 잡고 내려와서 주문을 해야합니다..! 사진처럼 안내문에 나와 있습니다!!! 하지만 안내문을 못 봐도 걱정 NoNo 카운터로 가시면 직원분들께서 2층에 먼저 자리 잡고 주문해달라고 친절하게 안내해드리기 때문..!!! 내부에는 계단이랑 엘리베이터가 있는데 둘 중 원하는 걸 이용하시면 됩니다! 헤헤~~ 2층이지만 편하게 엘리베이터 이용!!! 내부 모습 <2층> 전체적인 분위기는 요러했는데요 일단 전 개인적으로 검은색이 많아서 좋았습니다!!! 그나저나 2층 내부는 굉장히 깔끔하면서 고급스러운 느낌이 들었던 것 같아요..! 그리고..!!! 여러분들이 보시기에는 호텔 감성이 나오는 것 같나요..? 창문 자리 근처에는 이런 종이도 있었습니다. 대망의 하이라이트!!!!! 제가 주문한 트러플 크림치즈 베로와상!!! 참고로 가격은 6,500원이었습니다. 이렇게 봉지에 담겨서 나오는데요..!! 봉지 벗겨버리기!!!! 벅겨버린다니깐 조금 이상한 것 같은데.. 기분 탓인 걸로,,, 그리고 베로와상을 칼로 서걱서걱해서 잘라내면 안에 이렇게 흰색 물체가 나타나는데요..! 저게 바로 크림취즈입니다~~ 그러고 한 입 먹어보았는데요..! 전체적인 맛은 달짝지근하면서도 크림치즈는 엄청 쫄깃하고 짭조름했습니다. 뭔가 아주아주 고급진 스트롱치즈를 먹는 느낌..? 아무튼 간에 저는 그냥 치즈가 맛있었습니다. 그리고 동그란 모양은 베이글인데 겹겹이 페스츄리처럼 되어 있었습니다. 참으로 신기한 빵이었어요..! 난생 처음보는 이색 베이커리~~ 결과적으로 '베로와상' 정말 야무지게 잘 먹었습니다~~ 마지막으로 이건 아메리카노 빨대인데요. 빨대가 엄청 기다란 게 아니라 컵 크기에 최적화가 되어 있었습니다. 컵에 딱 넣으면 이런 느낌!!! 다른 곳에서는 컵 높이는 낮은데 빨대는 길쭉한 곳도 많았는데 여기는 빨대가 컵 크기에 맞추어져 있어서 좋았습니다~~!! 아차..! 아메리카노 맛은 산미는 거의 없었고 무난 무난한 느낌의 맛이었어요!! 뭔가 너무 갑작스럽게 끝낸 것 같은 느낌이 드는데 네. 끝난 거 맞습니다. 그냥 저렇게 마무리하면 허전하니깐 화장실 옆에 있던 거울에서 찍은 거울 셀카 사진 한 장 투척하면서 마무리..!! 엘리베이터부터 해서 화장실 쪽 거울까지 곳곳에 거울이 한 4~5개 정도 있으니 친구분들이랑 같이 가셔서 거울 셀카도 한 장 건져오시길...!!! <The end> #호텔아우프글렛 #호텔아우프글렛성수 #아우프글렛성수 #이색디저트 #베로와상 #성수카페 #뚝섬역카페 #성수핫플 #호텔컨셉카페 #깔끔한분위기 #블랙앤화이트카페 #거울많은카페"
[성수동] 핫하고 새로운 카페인데...아우프글렛 성수,"성수동에 워낙 많은 카페가 있어서 카페에 특색이 없다면 살아남기 힘들다. 그런 점에서 다른 카페에서는 보기 힘든 특색을 갖고 있는 아우프글렛 성수를 소개한다. 특색있다는게 맘에 든다는건 아니다. 아우프글렛 성수( HOTEL AUFGLET) 1. 매장 운영 : 11:00~20:30 2. 매장 번호 : 070-8858-0828 아우프글렛이라는 곳이 알고 보니 이미 유명한 곳이었다. 핫플이라는 곳마다 지점이 있다. 이 카페도 핫한 카페라는 거겠지! 성수 지점만 특이하게 이름 앞에 HOTEL이 앞에 붙는 건 건물 특성 때문인듯하다. 8층짜리 건물에 지하 1층~3층 까지가 아우프글렛이고 지하 1층은 빵을 만드는 곳 3층은 셀렉샵으로 카페는 실상 2개 층이다. 1층에서는 각종 빵과 케이크가 전시되어 있는 것을 볼 수 있다 가격도 쓱~ 봤는데 아~주 무시무시하다. 작은 크기의 케이크 하나가 15,000원 하는 거를 보고 바로 커피로 눈을 돌렸다. 직장인 점심으로 디저트까지는 무리무리 그래도 커피는 준수한 가격을 보여준다. 처음 방문이니깐 정석으로 아이스 아메리카노를 시켰다. 2층은 카페 자리다. 이런 일반적인 테이블과 의자는 2인용 세트 딱 하나만 있고 창가 쪽 바 테이블 소파가 있는 테이블까지 있다. 이 소파 테이블이 제일 많은데 문제는 제일 불편하다. 철기둥을 아예 박아둔 상태여서 테이블을 움직일 수 없다. 간격이 전부 일정하게 벌어져 있어서 내 지인과 옆에 모르는 사람과의 거리가 똑같다. 그게 참 묘한 기분이 들게 만든다. 아메리카노 5,000원 커피가 나오기까지 오래 걸리지는 않았다. 커피맛은 무겁게 깔리기보다는 가볍고 산미가 있다. 엄청 특별한 맛은 아니지만 맛이 진한 빵과 잘 어울릴 거라는 생각이 들었다. 인테리어는 새롭다. 검은색 욕실 타일로 바닥이 쭉 깔려있고 큰 전신거울이 있다. 조명은 거울 옆에 조명이건 그림을 비추고 있는 조명이건 전부다 효율성보다는 오롯이 공간을 더 이쁘게 만들기 위한 디자인적 요소로 설치한 것으로 보인다. 특색 있는 매장임에는 분명하다. 하지만, 공간도 편하지 않고 베이커리의 가격이 매우 높다. 핫플레이스에 놀러 왔다고 하면 한 번쯤 소비할 수 있겠지만 자주 방문하기에는 어려운 곳이라고 본다. 50m © NAVER Corp. 아우프글렛 성수 서울특별시 성동구 왕십리로10길 9-2"
성수 카페 / 호텔 아우프글렛 성수 / 성수동 카페,"베이커리가 맛있는 성수동 핫플 호텔 아우프글렛 성수 호텔 아우프글렛 성수 매일 11:30-20:30 주차불가,노키즈존,노펫존 50m © NAVER Corp. 아우프글렛 성수 서울특별시 성동구 왕십리로10길 9-2 비오는 주말 방문한 성수동 아우프글렛 이름이 왜이렇게 어려워 아웃푸글렛 아우푸글렛 등등 헷갈려..;; 비가 오는 터라 성수동 7번 출구에서 가장 가까운 카페로 방문. 지하철역에서 5분 소요 아우프글렛은 체인인데 성수점은 공간에 활용된 소품들을 마치 호텔에 있는듯한 느낌으로 연출하고자 하여 호텍 아우프글렛이라고.. 근데 전혀 그런 느낌은 들지 않았음 ㅎㅎ 역시나 주말에는 웨이팅이였으나 다행이 자리가 빨리 빠져 약 10분만에 착석함. 3인이 방문했는데 2인석에 앉고 테이블간의 간격이 매우 좁아 마치 같이 온듯한 느낌으로 커피를 마심.. 성수 핫플 호텔 아우푸글렛 메뉴판! 아메리카노 5,000 카페라떼 5,500 가격은 핫 아이스 동일한듯 하고 디카페인시 +1,000 추가. 성수 핫플 아우프글렛에는 다양한 베이커리들이 있음 여기의 주 메뉴는 베로와상 맛있어 보이는 빵들이 잔뜩.. 우리는 뺑오쇼콜라 후추크림바게트 시켰는데 진심 후추크림바게트 무조건 드세요.. ⭐️⭐️⭐️⭐️⭐️ 존맛입니다. 집 가까우면 포장해오고 싶은 맛. 빵수니는 행복해,, 대략 2층 좌석은 이런 구조 자리가 매우 불편하지만 성수 핫플이기에 온갖 핫플러들이 모여있는 느낌,, 좌석도 약간 다같이 회식하는 고런 느낌쓰.. 우리는 3인이 방문 했는데 2인 좌석에 비집고 앉았음 ㅠㅠ 빵과 음료가 준비되는데는 시간이 조금 걸리는 편이고 셀프! 아이스아메리카노 2잔 아이스카레라떼 1잔 시켰는데 커피 왤케 맛없어요.. 너무 연했음.. 성수 핫플 베이커리에만 신경 쓰신듯.. 호텔 아우프글렛 성수동 네임만큼은 아니였고 베이커리가 맛있어서 빵 좋아하면 한번쯤은 추천. 하지만 공간 너무 협소해ㅠㅠ"
"[성수동] 새로운 메뉴 베로와상을 선보인, 호텔 아우프글렛 성수","크로플을 처음 선보였던 아우프글렛 금호를 꽤나 즐겨 찾다가 최근엔 방문이 뜸했었는데 성수동에서 외관이 눈에 띄는 매장이 있어 보니 ""호텔 아우프글렛 성수"" 50m © NAVER Corp. 아우프글렛 성수 서울특별시 성동구 왕십리로10길 9-2 영업시간 : 11시 30분 ~ 20시 30분 주차 : 🙅‍♀️ 부티크 호텔 외관 같은 건물 매장 밖에도 자리가 있습니다 아우프글렛의 신메뉴인 베로와상 베이글 + 크로와상이 합쳐진 건데 어떤 맛일지 궁금해요~ ""호텔""이라는 컨셉에 맞게 1층은 Lobby!! 2층은 호텔 라운지 컨셉의 좌석인데 사진에 담질 못했는데 시원한 통창이 좋더라구요~ 여러 종류의 빵들이 많이 있었지만 오늘은 베로와상에 집중해 봅니다. 베로와상 코코넛 크림 베로와상 샌드(콘 크림) 베로와상 츄러스 뺑 오 쇼콜라를 골라 담고 음료 메뉴 오늘은 포장해서 가져가는 거라 음료는 패스~ 분명히 사 왔는데 집에 가보니 이미 식구들이 맛본 뒤라 사진이 없어요 😅😅😅 베로와상은 베이글의 식감이나 뭔가가 느껴질 줄 알았는데 그냥 크로와상을 베이글 모양으로 만들어 놓은 거더라고요 색다른 식감을 기대했던지라 뭔가 좀 아쉬웠지만 그냥 빵맛으로만 보면 맛있어요!!! 걔인적으로는 베로와상 츄러스가 쫄깃하면서도 달콤한 게 젤 맛있더라구요 커피랑 먹으면 2개는 거뜬할듯한... 베로와상먹으러 한동안 아우프글렛에 또 자주 방문할듯 합니다!!! 🤤🤤"
