title,content
넓고 포근하고 아늑한 성수동 브런치 카페 [ 헤이숲 ],"네이버 지도 리뷰를 보고 정한 카페로 가는 길, 나와 친구의 발걸음을 멈추게 하는 카페가 성수동 골목에 있었다. 전체적인 색감이 사람의 눈을 편안하게 해주는 연갈색과 갈색으로 맞춰져잇고, 원목으로 되어있는 탁자와 의자들, 너무 정적이지 않게 군데군데 놓인 작은 원목들과 인형들이 눈길을 끌었다. 회백색 기둥에 기대어 장식되어 있는 원판 레코드 주크박스에서는 잔잔한 음악이 흘러나오고 있었다. 힙한 사람들의 성지인 성수동에서 유독 이 카페가 눈에 띄었던 것은 인스타 감성의 낮은 의자, 낮은 탁자, 들어가기 전부터 느껴지는 어둡고 날선 분위기, 칙칙하거나 차가운 사람들의 태도로 도배된 흔한 카페들과 달리 무척이나 포근해 보였기 때문이리라. 전체적으로 아늑한 색감의 카페 [헤이숲] 그래도 친구랑 먼저 가보기로 한 카페가 두 군데가 있어서 혹시나 그 카페들이 마음에 들지 않으면 다시 오자고 마음에 찜꽁하고 발걸음을 돌렸다. 그러나 우리가 찾아갔던 카페는, 분명 네이버 리뷰에서 인기도 많고 멋지고 디저트가 맛있다고 인기가 많던 두 카페는 솔직히 말해서 너무 실망스러웠다. 어둡고 칙칙한 곳에서 차가운 철의자 혹은 스테인리스 의자에 앉아 너무 높거나 아니면 너무 낮은 테이블 위에 음식들을 올리고 이야기를 나누어야 하는 소위 말하는 힙한 감성의 카페들이었다. 그런 카페들이 나쁘다는 건 아니다. 다만 나라는 사람은 그런 곳을 선호하지 않을 뿐이다. 근묵자흑이란 말처럼 다행스럽게도 내 친구 또한 차라리 아까 걸어오면서 봤던 카페[헤이숲]을 가는 게 낫지 않겠냐고 나에게 조심스럽게 물어봤다. 우리는 그래서 빨리 발걸음을 헤이숲으로 돌렸다. 헤이숲 서울 성동구 성수이로7길 38 1층 101호 0507-1354-7255 귀엽고 사랑스러운 소품들이 즐비한 아늑한 분위기의 성수동 브런치 카페 헤이숲 Next image 처음 카페에 들어섰을 때는 매장은 넓은데 사람이 없어서 실은 좋았다. 조용한 분위기가 좋아서였기 때문이다. 그러면서 한편 걱정도 됐는데, 혹시 메인 거리에 있는 카페 아니라 사람이 없는 걸까? 장사가 안되는 걸까? 카페는 너무 이쁜데... 하는 쓸데없는 걱정을 했다 ㅋㅋ 그냥.. 우리가 점심을 빨리 먹고 사람들이 몰리기 전에 카페에 입성했던 것이었음을... ㅎ 그 성수동의 수 많은 사람들이 이렇게 분위기 좋아보이는 카페에 안들어올리가 없음을...ㅎ 내가 좋아보이면 남들도 다 좋아보이는것도 같은 이치임을... ㅎ 여자의 로망 : 대왕 곰돌이... ♥ 우연히 발견하게 된 성수동의 이 예쁜 카페에서 또 너무 마음에 들었던 건 '대왕 곰돌이'가 가게 내 비치되어 있다는 점이다...! 만져도 되겠지? 하는 맘에 당장에 달려들어 마구마구 만지작거렸다... 폭신폭신하고 뭉글뭉글하고 보드라운 곰인형이 왜 이렇게 기분이 좋은지... 나도, 내 친구도 큰 곰돌이를 품에 안으며 잠시간 부비적거려보았다... 큰 곰돌이를 보면 유치원생으로 돌아가는 기분이 든다. 내 걱정, 근심은 곰돌이가 대신 해치워줄 것 같은 느낌... ★ 이 글을 읽고 있는 당신도 어른이인것을 나는 알고 있다 ㅇㅅㅇ 메뉴판 나는 솔직히 말하면 헤이숲이 브런치 카페라기보다는 그냥 일반 카페인 줄 알았다. 갈 예정이 있었던 카페도 아니라 네이버에서 막 알아보지도 않았어가지고 더 그랬다. 그리고 브런치 카페들을 많이 가보지는 않았으나 친언니나 친구들, 친한 동생들과 가봤던 브런치 카페들은 음식 종류가 정말 많았기 때문이었다. 여기는 딱 수프와 샌드위치 정도만 마련되어 있다. 근데 또 생각해 보면 브런치(brunch)라는 뜻은 우리나라로 '아점(=아침+점심)'인데 이렇게 가볍게 먹는 게 실은 맞는 것 아닐까라는 생각도 들었다. 계산대 옆에 진열되어 있는 츄러스 포근한 느낌 그대로 계산대도 정감이 갔다. 이 가게를 운영하시는 사장님께서 정말 많은 부분에 세세하게 디테일까지 신경 쓰신 느낌이 들었다. 그리고 소품들 하나하나에 먼지가 쌓여있지 않은 것을 보고 정말 매일같이 깨끗하게 청결을 유지하시는구나 싶었다. Next image 친구랑 나는 일반 츄러스와 초코츄러스를 시켰다. 나의 취향은 일반 츄러스..! 단 거를 좀 못 드시는 분이라면 일반츄러스를 시키시는 게 좋을 것 같다는 생각이 든다! 그리고 이 브런치 카페 : 헤이숲에서 마음에 들었던 점은 여타 다른 카페들에 비해 음료가 한가득 나온다는 점이다. 뭔가 푸짐하게 주시는 기분. 아늑하고 포근한 가게의 분위기만큼이나 밝고 웃는 얼굴이신 사장님께서 직접 오셔서 츄러스를 잘라주셨다. 아, 츄러스는... 조금 딱딱하긴 하다. 입천장 까질 수 있으니 조심...! ps. 헤이숲이 브런치 카페라는 걸 알게 된 이유는 아직 손님이 적을 때 사장님께서 브런치 메뉴인 수프를 만드시면서 가게 안에 계신 손님들에게 트러플 버섯 수프를 조금씩 나누어주셔서 음식도 만드는 브런치 카페구나! 하고 알았다. 사장님께서 말씀하시기를 '루(수프를 만들 때 기본적으로 들어가는 밀가루 반죽)' 없이 만든 수프라 굉장히 맑을 거라고 하셨는데 먹어보니 정말 그랬다. 깔끔하고 담백한데 트러플의 맛과 향은 풍성하게 나는 버섯 수프... 정말 맛있었다 :) 나중에 또 성수동 들릴 일이 있다면 여기서 아점을 먹어봐야겠다 >.< 50m © NAVER Corp. 헤이숲 서울특별시 성동구 성수이로7길 38 1층 101호"
성수동카페 _ 헤이숲 (성수동브런치카페),서울 성동구 성수이로7길 38 1층 101호 오전 10시 ~ 오후 9시 성수동은 더더더 핫해지고 있는 요즘 갈때마다 사람이 많아지고 있는 느낌적인 느낌 일찍여는 진짜 브런치카페 찾다가 가게 된 헤이숲 서울숲이 생각나는 이름이다. 브런치카페인데 12시 오픈하는 브런치카페는 옳지않다규! 10시 오픈이라 좋다. 통창이라서 요즘같은 가을에 햇빛받으며 앉아있기 좋다. 메뉴 일행은 트러플 버섯 수프 나는 프렌치 어니언 수프 수프만 먹으면 배고플텐데했는데 다행히 숏파스타면을 추가할 수 있다. 숏파스타면에는 뇨끼와 푸실리가 있으니 취향에 따라 고르면 될듯 내부 거의 첫 손님으로 가서 내부사진 편하게 찍고.. 11시 넘어가니 사람들이 많아 진다. 프렌치 어니언 수프 위에는 치즈가득.. 양파를 얼마나 잘 볶았는지 단맛이 줄줄 트러플 버섯 수프 난 트러플이 취향이 아닌데 일행은 맛있다고.. 트러플 좋아하는 사람들은 좋을듯. 루꼴라 프로슈트는 나눠서 먹고 추가했던 숏파스타면이 나와서 수프에 풍덩 푸실리 뇨끼 오~~ 어니언 파스타같아.. 배불러진다 행복해짐 ㅋㅋ 바쁘셔서 조금 늦어진 음료도 나와주고 청귤에이드는 페리에 부어서 마시면 된다. 약간 느끼해진 속을 시원하게 살짝 아쉬워서 플레인 츄로 주문 길게 주시는거 같은데 먹기좋게 잘라달라고 함 ㅋ 메뉴보고 살짝 배고플 수도 있겠는데 했는데 왠걸 배부르게 먹었으니 서울숲까지 걷자며 ㅎㅎㅎ (멀지않나요 ㅜㅜ) 수프 맛집 찾기 힘든데 수프 생각날때 들리면 좋을 듯.. 100m © NAVER Corp. 헤이숲 서울특별시 성동구 성수이로7길 38 1층 101호 성수역 2호선 서울특별시 성동구 아차산로 100
지나가다가 우연히 들렀던 성수동카페 헤이숲 내돈내산,"얼마전에 라인이와 다녀온 성수동나들이 소품샵 잡화점도 실컷 구경하고 점심도 맛있게 먹었고 그렇다면 그 다음은! 카페투어! 주말에 성수동 골목길마다 카페에 사람이 가득가득 그래서 그냥 발길 닿는대로 빈 자리가 있어서 우연히 들어간 카페 헤이숲 주말 오후의 카페 헤이숲에는 사람이 가득 차있었다. 메뉴판에는 음료는 커피와 에이드류가 있었고 수프, 샌드위치, 츄러스와 같이 가벼운 식사할만한 메뉴들이 있었다. 성수동 카페 헤이숲은 생긴지 얼마 안된 신상카페인지 네이버 영수증 리뷰도, 블로그 리뷰도 별로 없었다. 우리도 우연히 들어갔던 카페였을 뿐. 이것이 진정한 내돈내산 찐리뷰! 성수동에 베통이라는 베이커리를 가려다가 통창에 아늑한 분위기의 카페가 보여서 여기로 왔는데 오히려 여기가 옆집 카페뷰인게 괜히 예뻐보이는 이상한 곳이었다. 엔틱한 가구들로 채워진 카페는 테이블도 의자도 다 각기 달랐다. 언제나 그렇듯 나는 아메리카노를 라인이는 라떼를. 그리고 츄러스가 맛있게보여서 플레인츄로를 하나 골랐다. 아메리카노는 산미가 적고 고소한 편이었고 쓰고 묵직한 편이 아니라 깔끔하고 가벼운 편이었다. 아메리카노도 라떼도 샷이 진했다. 샷이 진하고 우유가 고소한 편이라서 라인이가 맛있다고 만족했던 라떼. 츄러스는 플레인으로 골랐는데 플레인이 시나몬가루가 팡팡 뿌려진 거라 했는데 위에 초코시럽도 뿌려줬다. 사실 츄러스는 그냥 그랬다. 시나몬맛에 먹기는 좋긴 했는데 그냥 뭐 그냥 츄러스구나 싶었다. 사실 츄러스는 갓 튀긴 걸 길거리에서 찹찹찹 먹는 맛이니까. 50m © NAVER Corp. 헤이숲 서울특별시 성동구 성수이로7길 38 1층 101호 총평, 평범했던 카페. 성수동에서 우연히 들어갔다가 친구랑 도란도란 대화하기 좋았음."
명동닭한마리_성수동_헤이숲_해목_젠제로_한강 피크닉🌈,"요새 브이로그 찍느라고 블로그 사진을 많이 못찍어서 ㅋㅋㅋㅋㅋㅋ 이날 닭한마리 먹으러! 닭한마리 먹으면 현대아울렛 꼭 한번 들러줘야 함.... 나 근데 삼송빵집 빵 너무 달다고 하면서 맨날 잘먹음 요새 이 각도 셀카가 맘에 들구 오빠 얼굴 짜부시키기 나 입은 맨투맨 너무 귀엽다고 오빠도 산다고 해서 레이브 왔는데 애초에 이거보다 한 사이즈 큰거 오빠가 맞지도 않을 것 같았고 ㅋㅋㅋㅋㅋㅋ 문제는 이 디자인만 품절이어서 보지도 못했다ㅜ 진짜 길에 사람이 너무너무너무 많아서.... 옆길로 피신 은근 같이 찍은 사진이 없는 거 같아서 요새 좀 찍는 즁 카페도 자리가 다 없고ㅜ 사람 없는 카페 겨우 찾음 커피 맛있구 또 이 각도 셀캌ㅋㅋㅋㅋ 오빠 통화하러 감 ㅋㄷ 뿌이 맛보라고 스프 주셨따 날 좋고 그치만 난 일하러ㅠ... 언니 골프 가서 나 홀로 설치..... 타공판 필요할 것 같아서 다이소에서 엄청 급하게 사왓는데 원래 있던 거랑 사이즈가 안맞음^^...ㅋㅋㅋㅋㅋㅋㅋㅋㅋㅋㅋㅋㅋㅋㅋㅋㅋㅋ 설치 혼자하긴 또 처음이네.. 나름 미리 짜와서 금방(?) 할 수 있었다... 12시 퇴근...ㅎ 날이 너무 좋은데 추석에도 출근을 해야해요 퇴근하고 해목!!!!!!!!!캬캬 오빠가 히츠마부시 너무 좋아해서 언젠간 와야지 와야지 했는데 드디어 옴.. 오픈런하니까 웨이팅 안함 데헷 꺄향 너뮤맛있어 또 먹고싶다.. 해목 논현점 왔으면 젠제로 필수코스임 티라미수, 초콜릿, 산양유 요거트, 무화과 이렇게 시켰다! 고급진 맛... 한강 왔지 생각보다 너무 추워서.. 피크닉 할 날씨인가? 햇는데 또 못있을 정도는 아니라 일단 자리 잡음 귀여운 강쥐들도 보구 브이로그용 영상두 많이 하늘이 넘 예뻤쟈나 진짜 순식간에 어두워져서 ㅋㅋㅋㅋㅋㅋㅋㅋㅋㅋ 나도 니트입고 있는데 추웠는데 오빠는 반팔 입고 있어서 ㅋㅋㅋㅋㅋㅋㅋ 안 춥냐고 오천번은 물어본 듯 갑자기 호떡 먹고 싶다고 해서 찾아찾아 신당 중앙시장 왔는데 너무 맛없어서 슬펐다는 이야기.."
〔성수동 카페〕 신상카페 (๑•͈ᴗ•͈) 브런치 카페 헤이숲 ♥ heysoop 와인바겸카페 내돈내먹 내돈내산,"안녕하세요. 모네입니다아- 10월초 일요일 쉬는날이라 집에서 빈둥대다가 제가 엄청 어릴 때부터 동네에 자주 가던 즉석떡볶이 가게가 있는데ㅜ 얼마 전부터 엄청 가고 싶었는데 타이밍이 안 맞아서 못 먹다가 일어나마자마 동네 친구한테 징징거려서 드디어 즉석떡볶이 부수고 , (당연히 볶음밥도 ⁽͑ʺˊ˙̫ˋʺ⁾̉ ) 다 먹고 카페 가서 노닥노닥 거리다가 빠빠이 할 때 쯤... 매일 붙어다니는 내 단짝에게서 카톡!! 요즘 저는 체력이 딸려서 쉬는날 집밖으로 잘 안나가는데.. 나가봤자 동네 카페?? 이 날은 이미 집 밖으로 나와있는데다가 저도 많이 심심했나봐요 점심 같이 먹은 친구 안뇽~해주고, 만날까? 에 바로 콜!! 을 외쳐주는 ⺣̤̬♥ 그렇게 우리 단골 심심풀이 장소 성수에서 보기로 했어요 ㅋㅋ 근데 할 것도 안 정해 놓고.. 그냥 만난거라 ㅜㅜ 주말 저녁이라 사람은 바글바글, 춥고 .. 할 건 없고... 아니 2-3주 전에는 없던 팝업스토어나 일반 가게들이 엄청나게 새로 생기고 있던 가게들은 흔적도 없이 사라지고.. 신기해하면서 돌아다니던 와중에 ( ꙭ )( Ꙭ ) 이건 뭐지..? 분명 얼마 전에는 없었는데?? 저랑 제 단짝은 이런 따듯한 느낌 인테리어도 원래 좋아하고 그냥 터덜터덜 걸어다니는데에 조금 지쳐있었기 때문에 카페같아보여서 그냥 홀린듯 스르륵 직진해서 들어온 카페헤이숲 #heysoop 여기 근데 너무 느낌있자나!? ˃ᴗ˂ 따듯 + 아늑 좋아하는 느낌은 다 모아놓은 카페 카페트 봐아.. 취향완전저격 일단 조금 출출했기에 뭐 좀 시키자 해서 보는데 수프를 파네?! 그래서 헤이 숲 인건가?? 꺄르르 깨르르 ๑>؂•̀๑ 닭고기 들어간 수프를 먹고 싶었는데... 토마토 소스는 정말 안 좋아해서 메뉴판 앞에서 고민 하다가 트러플 버섯 수프 8.5 +뇨끼 추가 3.0 블루베리 츄로 6.5 아이스 아메리카노 5.0 (x2) 이렇게 주문!! 커피랑 먹거리 준비헤주시는 곳이 진짜 완~전 오픈 되어 있어요 괜히 뭔가 믿음직.. 다행히 사람이 북적북적 하지 않아서 주문한 메뉴들 나오는 거 기다리면서 조용히 구석구석 사진 찍고 다녔어요 ㅎㅎ 아무리 봐도 분위기 너무너무 내스타일이다아 ꔛ Ꙭ̮ 한참 구경하고 있는데 시킨 메뉴가 나왔어요!! 뇨끼 추가 금액이 비싸지 않아서 몇 알 없을 거라고 생각했는데 사진으로 보는 것보다 푸짐해요 ᐧ༚̮ᐧ 뇨끼는 사진 다 찍고 바로 수프속으로-!!! 아 그리고 사장님께서 직접 트레이에 담아 자리까지 가져다 주세요 들어와서 계속 느끼고 있었지만 남자 사장님 너무너무 인상도 좋으시고 친절하십니다ㅎㅎㅎ “츄로가 뭐지? 츄러스인가??” 하다가 사장님께 여쭤보고 츄러스 종류인데 ꔛ (설명 잘 기억 안나요 ㅠㅠ) 나중에 추가한 블루베리 츄로.. 솔직히 저 츄러스 안좋아해요 진짜 제 돈 주고 사 먹어본 적 살면서 단 한번도 없어요ㅋㅋ 근데.. 이거 왜 이렇게 맛있죠??? Ꙭ 친구랑 수다 떨면서 수프칭찬, 커피칭찬, 인테리어칭찬 그리고 사장님의 친절함을 막~ 칭찬하고 있던 그 때 작은 용기에 담아서 맛 보라고 가져다주신 닭고기 야채 수프!!! 위에 써놨지만 저 토마토소스 정말 안 좋아합니다 (눈물..) 그래소 에그인헬 같은 것도 안 좋아하는데.. 근데 오픈기념 서비스? 같은 걸로 주신 것 같기도 하고... ㅜㅜ 이런거 남기면 예의가 아닌 것 같고.. 아까 주문한 크림 수프도 양 어마어마해서 ”이거 왜 먹어도 먹어도 줄어들지를 않지?“ “밑에서 계속 생기는 것 같아..” 이런 얘기 하고 있었는데.. ㅜ 엉엉 억지로라도 먹어야지 했는데 근데....... ...? 잉..?? 사라짐.. ㅋㅋㅋㅋ 사라졌어요 저 수프.. 진짜 순삭 진~짜 존맛탱 먹으면서 “나 나중에 와서는 이거 시켜 먹을래” ㅋㅋㅌㅋㅋㅋ 저희는 크림수프를 시켜서 뇨끼를 추가했는데, 토마토수프인 닭고기야채수프에는 푸실리 추가해서 먹으면 딱일 것 같아요 ˃ᴗ˂ 넓찍한 카페 내부공간! 저희은 창가쪽에 앉았어용 감성 100스푼 입구까지 감성 그득그득... 저희 나올 쯤에는 저 자리가 비어 있었는데 저 자리도 되게 좋아 보였어요 ㅎㅎ 카페 자체가 너~무 적막하지도 않고 너~무 시끄럽지도 않고 편하게 얘기 나누기에 딱인 분위기?? 그래서 성수 소개팅 장소로도 괜찮아 보여요 ( ✘_✘ ) 오 요기는 뭐지 벽장인가-?? 하고 봤는데 이 안쪽 까지 감성 뿜뿜으로 꾸며 놓으리고 휴대폰 충전기들 (센스 뭐야....) 나가려고 준비하는데 사장님께서 오시더니 10월 중순이나 말부터는 와인도 판매하실거라며.. 아니 이 분위기에 와인까지 판매하시면.. 진짜 소개팅장소로 유명해질 것 같은데..ㅜ 제가 다녀왔을 때에는 정말 오픈한지 얼마 안되어서 네이버 검색에도 안 나왔었는데 지금은 네이버플레이스 등록도 되어있더라구요 ㅎㅎㅎ 성수 자주 가시는 분들은 지도 보시면 바로 어딘지 아실듯 !?! ㅎㅎ 진짜 오랜만에 카페갔다가 큰 만족하고 나온 카페 성수신상카페 헤이숲 날씨가 더 쌀쌀해져서 그런지 뜨끈뜨끈한 수프생각 가득... 조만간 또 가야겠어요 (๑˃̵ᴗ˂̵)و 50m © NAVER Corp. 헤이숲 서울특별시 성동구 성수이로7길 38 1층 101호 완전 결백한 내돈내산 내돈내먹 후기입니당 ㅎㅎ (๑•͈ᴗ•͈) #내돈내먹 #내돈내산 #성수카페 #성수동카페 #성수신상카페 #서울신상카페 #수프맛집 #스프맛집 #토마토수프 #크림수프 #성수동 #뚝섬카페 #뚝섬 #서울숲 #서울숲카페 #성수소개팅 #소개팅장소추천 #성수동와인"
성수 신상 카페 맛집 헤이숲 나만 알고 싶은 내돈내산 브런치카페,"Hey 숲 얼마 전 성수동에 일이 있어 방문했었는데 따듯한 햇살과 선선한 바람의 조화로움이 완벽하던 가을 날씨 덕분에 혼자만의 커피 타임을 즐겨봐야겠다 생각했어요. 흔한 카페는 가기 싫어서 성수동 골목골목 걷다가 헤이숲이라는 신상 카페 발견! 입구부터 내 스타일,,🥹 가끔은 검색이 아닌 걷다가 내 기분이 온전히 끌리는 카페로 들어가 보곤 하는데 이런 곳이 커피까지 맛있으면 하루 행복 충전 100% 죠 50m © NAVER Corp. 헤이숲 서울특별시 성동구 성수이로7길 38 1층 101호 지하철 이용하실 경우 성수역 4번 출구에서 가장 가까운 편이에요. 빈티지한 감성들이 돋보이는 소품들과 무심한 듯 싱그러움을 더해주는 플랜테리어🌿 게다가 밝은 햇살이 헤이숲의 분위기를 더욱 사랑스럽게 만들어줘요. 평일 낮 손님이 많지 않았을 때를 이용해서 찰칵 찰칵✨️ 커피 마시다 보니 점점 손님이 많아지더라고요. 특히 외국인 손님들이 많았는데 이때만 해도 오픈 초라 검색도 안되던 상황이어서 아마 지나가다가 여기 예쁘다~싶어서 들어오지 않으셨을까 싶던. 운 좋게 창밖을 바라볼 수 있는 자리에 앉았는데 한낮의 햇살을 맞으며 카페인을 충전할 수 있음에 얼마나 행복함을 느꼈던지🫧 주말이면 아마 이 자리들이 꽉 차겠죠. 자리를 골라 앉을 수 있다는 여유로움을 만끽한 평일의 어느 오후🫶 커피류 종류가 많지는 않고 브런치 카페인만큼 샌드위치나 수프 메뉴를 즐겨볼 수 있어요:) 간단하게 요거트 즐겨보기에도 괜찮겠네요. 개인의 취향에 따라 메뉴 구성이 부족하게 느껴질 수는 있는데 저는 메뉴만 엄청 많은 것보단 적정 양의 메뉴에 집중해서 최고의 맛을 전해주는 걸 선호하기에 메뉴판 구성 개인적으로 만족스러웠어요. 이 카페트는 우리 집에 데려오고 싶어서 여러 번 바라봤다는. 고소하면서도 시원하게 카페인을 충전하고 싶어서 아이스 라떼 주문. 그리고 플레인 츄로도 함께 주문했어요! 바삭 달달한 츄로 초콜렛 푹 찍어 먹으면 당 충전 든든하죠💫 한동안 아메리카노 위주로 마셨는데 이날은 식사도 제대로 못하다 보니 아이스 라떼가 먹고 싶어서 주문해 봤는데! 여기 아이스 라떼 맛있어요. 사실 아이스 라떼 주문하면 밍밍하니 우유맛만 많이 나는 곳이 많은데 적당히 진하면서 고소해서 츄로와 맛있게 호록 호록. 참고로 여기 수프 맛집입니다..🫰 제가 방문했을 때가 아마 오픈 극 초기여서인지 사장님(?)께서 홍보 겸 수프를 조금씩 덜어서 맛보게 해주셨어요! 트러플 버섯 수프로 추정되는데 트러플의 향과 버섯의 고소한 식감이 더해져서 속 따듯하게 데워줘서 좋았어요. 아마 주문하게 되면 더 많은 양과 예쁜 그릇에 담아주실 거예요 ㅎㅎ 혼자 걷다가 빈티지하면서도 상쾌한 분위기에 끌려 들어갔는데 메뉴들도 모두 맛있어서 만족스러웠던 성수헤이숲. (아쉬운건 논커피 메뉴가 많지는 않아요!) 사실 혼자 알고 싶은 성수신상카페인데 좋은 곳은 또 공유해야 하니까😉 작성해 본 내돈내산 포스팅이었습니다 🫰 재방문해서 찍은 사진들 추가 공유해드려요! 단호박 크림 수프 달달 짭쪼름? 한 느낌이었고 초코바나나 추로는 달달하니 바삭해서 라떼나 아메리카노랑 조합 좋았어요! 앞으로도 성수 가면 종종 들릴 예정이에요🫶"
