title,content
[성수동 신상카페/호텔 아우프글렛 성수점] 취향 가득한 베이커리 카페 등장!,"찾아갈 때 마다 새로운 성수인데, 얼마전엔가 보니 뚝섬역에서 서울숲역으로 가는 사이에 왠 호텔이 하나 생겼더라구요!? 이름도 어떻게 읽는 건지 한참 걸렸는데, 모던하면서도 깔끔하고 임팩트 있는 외관 부터 눈길을 끌었던 카페, 아우프글렛 성수점 이더라구요. 1층은 베이커리를 구경하고 주문하는 공간, 2층은 카페, 3층 부터는 브랜드 쇼룸이나 사무실로 운영되더라구요. 50m © NAVER Corp. 호텔 아우프글렛 성수점 서울특별시 성동구 왕십리로10길 9-2 ⏰운영시간⏰ 매일 11:30 - 20:30 🚶‍♀️위치🚶‍♀️ 뚝섬역 7번 출구 바로 앞 📌포인트📌 외관 부터 내부 분위기 까지 취향과 감성 가득 정감 있는 성수동 동네의 일상을 구경할 수 있음 베로와상이라는 신기한 빵 종류를 맛볼 수 있음 요기 아우프글렛은 전체적으로 성수동의 하늘과 햇빛과 자연스럽게 어울리는 건물로 구성이 된 느낌인데요! 곳곳에 근사한 도자기 디스플레이까지 멋있더라구요. ㅎㅎㅎ 안으로 들어서자 마자, 다양한 베이커류를 구경할 수 있더라구요. 사실 빵이 가득 차게 준비되어 있었다고 하는데, 제가 방문 했던 늦은 오후에는 이미 보시다 시피 빵 쇼윈도가 많이 비었더라구요. ㅎㅎㅎ (아침 부터.. 아무래도 오픈런을 좀 하시나봐요... ㄷ ㄷ) 주문은 여기서 하시면 되는데요. 커피, 티, 에이드, 디저트 류 까지 다양한 메뉴가 준비되어 있고, 가격대는 여타 카페들과 비슷해요. 저희는 아이스 아메리카노로 주문 하고, 2층으로 올라 가봤습니다. 2층에 올라가자 마자 정말 ~~ 햇빛이 근사하게 쏟아지는 멋진 공간이 펼쳐 지더라구요. 곳곳의 핀조명에다가 벽면 한켠을 채운 거울까지, 곳곳이 포토존이다 보니 여기저기 사진을 찍으시는 분들이 많으시더라구요. 어디서봐도 성수동의 동네 풍경이 한 눈에 펼쳐지는 느낌이랄까요? 알고 보니 아우프글렛 호텔은 1970년대 부터 1980년대 호텔에서 영감을 받아 만든 공간으로 성수점이 7번째 호텔이라고 하더라구요. 바닥에 적혀 있는 Good morning, Good afternoon, Good evening 이라는 문구도 굉장히 와닿더라구요. ㅎㅎㅎ 커피도 주문해 봤는데, 연하게로 주문했는데도 커피 향이 꽤 은은하더라구요. 커피를 잘 모르는 제가 마셔도 커피 맛이 꽤 좋아요. 커피를 마시는 공간이나, 주문을 하는 공간도 공간이지만, 계단의 벽면에도 다양한 작품 들이 예쁘게 디스 플레이 되어 있어서 근사하더라구요. ㅎㅎㅎ 조용히 커피 한잔 하시면서, 성수동의 동네 풍경도 만끽하시기 딱 좋은 곳이더라구요. 호텔 아우프글렛. 다음엔 꼭 베로와상을 먹으러 들려 보겠노라 다짐했던 곳이에요!ㅎㅎㅎㅎ 나오기 전에도 햇빛도 너무 근사하고, 뭔가 공간 자체가 우아하면서도 예뻐서 찍어봤어요. ㅎㅎㅎ 사람이 조금 적을 때 쯤 들러서, 커피 한잔하며 멍 떄리고 싶은 곳 호텔 아우프글렛 이었습니다!ㅎㅎㅎ"
호텔 아우프글렛 성수점 : 성수동 신상카페 베로와상 솔직리뷰🥐,"호텔 아우프글렛 성수점 Hotel Aufglet #내돈내산 50m © NAVER Corp. 호텔 아우프글렛 성수점 서울특별시 성동구 왕십리로10길 9-2 영업시간 11:30 - 20:30 휴무일 x SNS AUFGLET(@aufglet) • Instagram 사진 및 동영상 팔로워 28K명, 팔로잉 1명, 게시물 1,556개 - AUFGLET(@aufglet)님의 Instagram 사진 및 동영상 보기 www.instagram.com 호텔 아우프글렛은 서울의 여러 지역에 매장이 있는 유명한 카페입니다. 이번에 서울숲, 뚝섬역 인근에 성수 매장을 새로 만들면서 처음으로 출시한 새 베이커리가 있어요. 바로 베로와상인데요 🥐 베이글 + 크로와상의 조합이라 생각하시면 좋겠습니다. 오늘 요거 소개시켜드리기 위해 글을 쓰게 되었어요 :) 입구부터 고급지고 멋드러진 호텔 아우프글렛 성수점입니다. 실제로 호텔 아니고 카페에요 :) 호텔에서 편히 쉬는 느낌을 주고 싶어 이름을 이렇게 지었다고 합니다. 지하1층 - 빵 굽는 곳 1층 - 로비 (카운터, 빵 매대) 2층 - 라운지 (테이블 이용 공간) 3층 - 오피스 (굿즈 전시) 드시고 가실 분들은 1층에서 먼저 안내받고 2층으로 올라가 자리를 맡으시면 됩니다. 매장으로 들어서자마자 빵을 담을 수 있는 유산지와 트레이가 있었어요. 아우프글렛만의 컵도 진열되어있고, 포카차야가 진열되어 있었습니다. 지금부터는 베로와상인데요, 다양한 종류가 진열되어 있었습니다. 햄치즈 츄러스 이 외에도 아몬드, 트러플 등 정말 다양한 베로와상이 판매되고 있어요. 여기는 바게트샌드위치와 할라피뇨 스틱 프레즐(?) 이었습니다. 피스타치오 등 다양항 빵도 있었고요. 의외로 베이커리 종류가 굉장히 많았습니다. 중앙에는 카운터가 있었고, 음료주문도 가능합니다. 그리고 무화과잼과 파블로바 무스케이크도 판매중입니다. 가격대는 꽤 나갔습니다. 2층 LOUNGE 계단 혹은 엘리베이터를 이용해 2층으로 올라가시면 테이블이 나옵니다. 길쭉한 공간이 인상적이에요. 자리간 간격은 좁은 편입니다. 츄러스 베로와상 5.5 트러플치즈 베로와상 6.5 저는 이거 한 입 먹어보자마자 정말 기발하다고 생각했습니다 ...! 베이글 + 크로와상 = 베로와상 잘 부서지는 크로와상 식감에 씹을수록 속은 쫀득하고 부드러운 빵이었어요. 엄청 특별하다, 맛있다 까지는 아니지만 그럼에도 기존의 크로와상과 베이글을 합쳐서 만든 '베로와상' 을 만들어낾으로서 사람들의 호기심을 자극했다고 생각해요 ! 츄러스베로와상은 겉은 딱 부드러운 츄러스를 먹는 맛이었고, 안에는 모짜렐라 치즈가 들어있어 달달 꼬소한 맛이었어요 💛 그리고 저 검정(먹물) 베로와상은 트러플 치즈 베로와상입니다. 딱 빵 봉지 열자마자 트러플 향이 쫙 퍼지면서 안에는 역시 모짜렐라 치즈가 들어가있어요. 빵 크기는 솔직히 작은 손바닥 만한 크기라서, 하나에 5-6천원 내면서 사먹을 만큼의 양은 아니라는 생각이 듭니다. (비싸다고 느꼈어요 !) 그럼에도 베로와상이라는 신박한 빵을 맛보고, 트러플치즈와 츄러스 맛의 부드러운 빵을 호텔 아우프글렛에서 즐겨보았다는 점에 의의를 두고 싶네요 🖤"
"성수동 헬로선라이즈&모이프 팝업스토어 둘러보기(TOMG톰그레이하운즈, 아우프글렛)","안녕하세요, 패션블로거 허닝입니다☺️ 요줌 핫하다는 성수동을 오랜만에 놀러갔는대요 정말 볼것도 먹을것도 너무 많고 뭔가 둘러보기만 해도 요즘 트렌드를 파악할 수 있더라구요! 먼저 성수에 도착하자마자 커피가 너무 먹고 싶어서 마일스톤을 방문했어요 커피맛집이자 사진맛집^^ 이 날은 추워서 여자친구는 따듯한 라떼를 먹구 저는 플랫화이트를 마시고 출발했어요 ㅎㅎ 50m © NAVER Corp. 마일스톤 커피 성수점 서울특별시 성동구 서울숲4길 15 1층 톰 그레이하운드(Tom Greyhound) 편집샵 헬로선라이즈 옷들을 실제로 볼 수 있어서 좋았습니다ㅎㅎ 빈티한 블루색상의 스웻류가 너무 이뻤어요 가격도 10만원 초반대여서 후드나 맨투멘 고민하고 계신다면 유행하기전에 얼릉 겟하세요! 저는 이 집업이 너무 예뼈보이더라구요 ㅎㅎ 가격은 28만원정도 했던거 같아요^^ 패스~ 그 외에 아워레가시, 포스트 아카이브 팩션, 팔로마울, 가니, 살로몬, 아디다스 등등 다양한 브랜드와 제품들이 있어요! 제 여자친구는 헬로선라이즈 모자를 구매했습니다ㅎㅎ 회원가입하면 5%할인도 가능하다고 하더라구요! 50m © NAVER Corp. 톰그레이하운드 성수점 서울특별시 성동구 연무장길 21 아우프글렛 X 모이프(의류콜라보) 카페&팝업스토어 스트릿패션을 좋아하시는 분이라면 모이프라는 브랜드를 다들 아실거라고 생각해요 카페 아우프글렛 직원들을 위한 유니폼 스타일의 의류를 모이프가 협업하여 콜라보 제품으로 나왔어요! 아우프글렛 1층 카페 매장 안쪽으로 들어가서 엘레베이터를 타고 3층으로 가시면 팝업스토어가 있습니다! 엄청 넓지는 않았지만 다양한 협업 제품들이 있었어요 베로와상?? 베이글&크로와상 생긴건 크로와상이지만 식감은 베이글ㅎㅎ 시식도 가능해서 먹었는대 넘 맛있었어요☺️ 요거는 11월부터 판매되는 인형이라고 합니다 소재가 모이프제품에 재고로 남는 옷들을 사용하여 직접 한땀한땀 여꿔서 만든 래빗인형이에요 봉제선 디테일^^ 팝업스토어에 방문만 했는대 드립백을 선물로 주셨어요 ㅎㅎ감사합니다 거기 계신 직원분이 너무 친절하게 설명해주시고 챙겨주셔서 뭔가 기분이 매우 좋았답니다😉 성수동가시면 한번 들려서 구경해보세요! 긴 글 읽여주셔서 감사합니당 안뇽~~~🤩 50m © NAVER Corp. 아우프글렛 성수 서울특별시 성동구 왕십리로10길 9-2"
"가을이가 겨울로 환승중, 그아이의아우프글렛 그리고 성수동 이야기","몹쓸 비가 내리면서 가을이는 겨울로 환승중이다. 느릿느릿 걸어서 겨울이 조금이라도 늦게 오기를 바라는 마음 반, 얼른 눈이 펑펑 내리는 겨울이 왔으면 하는 마음 반... 참 갈팡질팡하는 그아이구나. 그리고 그 중간의 일상에서 들렸던 곳들 이야기를 해보자. 잠실롯데백화점에 생긴 아우프글렛은 커피맛이 좋고, 공간도 마음에 든다. 사람만 조금 온다면 100점만점이겠지 그리고 행사장으로 들렸던 성수동의 풍경도 좋아서.... 환승중인 가을이에게 부탁했다. '조금만 기다려달라고' 1. 가끔은 보정하지 않은 풍경이 익숙해질 때가 있다. 내가 커피에 무척 까다로운 사람이긴해. '뜨겁게 해주세요, 진하게 해주세요' 이런 요구가 바리스타에게 부담이 될 줄 알지만 한 번씩 말한다. 그리고 가만히 커피 내리는 풍경을 바라본다. 아우프글렛은 이름도 좋고, 소문만 듣다가 이렇게 잠실에 오픈하고 처음 들렸다. 성수에도 한남에도 있다는데 나는 저장만 해놓고 가보질 않았네. 이미 사람들이 다녀오고 또 이렇게 많이 앉아있네. 공간은 큰데, 자리는 그닥 많지 않다. 주루룩 앉아서 커피를 마시는 풍경이 정겹다. 아우프글렛은 디저트가 무척 유명하다고 들었는데, 이미 배가 부른 상태라 겉바속촉의 까눌레 한 개만 시켰다. 물론 진하게 내린 카푸치노와 플랫화이트는 정말 백점만점의 백점이더라. 커피는 뜨거운 맛에, 특유의 향기에 위로를 받는거니까. 일상의 풍경 속에 커피가 빠지면 정말 무미건조한 시간의 연속일거다. 커피를 마시기 시작하면서 하루도 빠짐없이 사색의 시간들을 가지고, 또 누군가와 대화를 하고 그 시간들을 나눈다. 아메리카노는 일하면서 마시기 좋고, 카푸치노는 찬바람이 불기 시작하면서, 라떼와 플랫화이트는 봄부터 마시면 좋다. 물론 얼음이 들어간 음료는 봄여름가을겨울이 없다. 까눌레를 4조각으로 나눠서 입 안에 싹 넣으면 오우, 이렇게 맛있나? 잠실역에 참 카페 갈 곳이 없었는데 아우프글렛이 나를 살렸오. 그아이, 그 날 기분이 좋아져서 셀카 한 장 남기고 성수동으로 출발. 붉은 배경앞에서 사진을 찍으니까 좋으네 (보통은 한두번 보정을 하고 사진을 올리지만 오늘은 보정없이 모두 핸드폰 사진으로 올려버렸다. 이렇게 가끔은 보정없는게 더 정겨운 날이 있으니까) 2. 타박타박 음악소리와 함께 한껏 날아올랐던 성수동의 시간 다들 안녕하신가? 이렇게 말을 걸어보고도 싶고. 익숙했던 카페들이 문을 닫고 옮기고 새로 생긴 곳에는 사람들이 줄을 서서 기다리고. 모든 것은 변하고 또 변하는 중에 다시금 새로운 규칙들이 생긴다. 바람도 사랑이고, 맨투맨 하나만 입고도 무척 적당했던 가을날이 글을 쓰는 와중에도 느껴진다. 하늘도 좋았고 움직이는 나뭇가지들도 좋았다. 골목골목 사람들의 걸음걸이가 느리다 가을에서 겨울로 환승중인가요? 혼자 피식거리고 웃다가 잠시 멈춰본다. 몸과 마음을 수양하기 좋은 요가수업, 프레쉬와 함께 했다. 정말 힐링 스튜디오가 맞더라. 공간에 들어가자마자 기분 좋게 맞아줘서 고마웠다. 헤스페리데스 향기가 상큼하고 달콤하다 그냥 눈을 살짝 감아 버리는? 퍼포먼스는 아니구요 그냥 본능에 따라 가는거죠. 성수동에 이런 곳이 있었나? 공간은 단순했고 수업은 잼있었다. 프레쉬 비누는 참으로 묵직하지? 내가 좋아하는 스타일로 패킹을 한 다음, 작은 그림을 그려볼까 했는데 그냥 냅두고 그 시간을 즐겼다. 손 안에 향기가 가득했다. 옆에 친구가 만든거랑 같이 커플샷도 찍고, 무표정하게 사진 한 장도 남겼다. 인스타그램 올렸더니, 웃으라고 한 마디씩 하네. 매일매일 방긋거리면서 웃을 수는 없잖아. 이렇게 핸드폰으로 찍은 무보정 사진도 좋구나. 일상글을 쓸 때 마음이 편한 이유가 이런거겠지. 꾸미지 않고 그냥 있는 그대로의 나를 보여주는거니까. 오늘의 일상 컷은 아우프글렛과 성수동 그리고 프레쉬였음."
"2021.05.11 [여의도, 한강공원, 더현대 서울, 연남동, 아우프글렛, 성수동, 성수 어니언, 투썸]","후 ㅋ방금 만보 걷고 왔다 다이어트 시작이당ㅋㅋ… 지코바 죤맛 ㅠㅠ 이성을 잃고 시켜버렸다. 살크업;;;;미쳤 언니가 전날부터 서브웨이 먹고싶다고 난리 치더니 결국 담날 혼자서 사옴 ㄷㄷ 일어나니까 서브웨이가 있네? 아싸 ㅋㅋ 에그마요 별로 안좋아하는데 늦잠잤기에 선택권은 없었다능ㅠ 아 내꺼에 야채 다넣음 ㅡㅡ진챠 센스없네 갠적으로 피클 되게 좋아하는데 다들 피클 싫어하네..?왱 ㅠ 죄책감으로 런 젤링 초키 콩국수 먹을 생각에 신났었는데….. 오랜만에 여의도!! 역시 우리는 날씨 운 쩔어버린당께 ㅋㅋ 먼저 와서 선영이 기다렸당 도중에 어떤 이상한 분이 말걸었는데 ….뭐라했는지 기억도 안나….(앞만 봐서..) 도를아십니까 인줄 알았음;; 진짜 듣다가 분노 게이지 상승했다 운명 어쩌구 쫑알쫑ㅇ알;;뭐라는거임 선영 이때만 해도 마냥 날씨가 좋은 줄 알았지…..헤헤 더현대😎 생각보다 그저그랬? 사람이 느므느므 많아욥 ㅠ 더현대 식당들 진짜 사람 캐많고, 자리 간격도 좁은 곳이 많아서 ㅠㅠㅠㅠ 만약 거기서 먹었으면 허겁지겁 먹었을듯 그냥 IFC몰로 넘어가서 아비꼬 먹었당 하 카레는 항상 맛있지 저 크림치즈 고로케 죤맛٩( ᐛ )و IFC몰은 파리가 날리더군요…..한가하니 좋더라.. 선영이가 산 쿠키 ㅋㅋㅋ귀여웠당 하지만 불량이였음 ㅡㅡ 기린 다리가 안들어가지네 에라이 귀엽당ㅋㅋㅋㅋ 레이어드에서 디저트사서 여의도 한강공원으로 갔당 카페 웨이팅 하시는 분들은 대부분 사서 한강 가시더라구요ㅋㅋ 다들…. “야 빨리 사고 한강가자” ㅋㄷㅋㄷ 입 만들어쥼 이날 약간 쌀쌀할 것 같아서 자켓 챙기려다가 들기가 너무 싫어서 ㅠㅠㅠ 가디건 작은거 하나 챙겨갔는데, 추워서 죽을뻔^^ (두통왔음) 둘다 추운데 떠들고는 싶고…. 이 순간을 즐기고는 싶었지만…. 조금 있다가 바로 철수^^ 롱패딩이 어찌나 그립던지 여의도 근처에는 할게 많이 없어서 연남동으로 피신왔당 드디어 내 마음속 크로플 1위 아우프 글렛에 선영이 데려갔음ㅋㄷ 너도 맛있지~~~~~? 진심 여기가 젤루 맛있는듯 이날 이후로 단거는 땡기지 않는당께… 혀가 마비됨 좋은사람과 좋았던 하루^^ 하이~Hi 예전에 닌텐도로 동숲 원없이 해서 질려서 바로 삭제함 ㅎㅎ 애들아 친추 안걸어도됑..ㅎ먄 배그 땡기네 ❤︎ 어린이날 날씨 짱이였다 ㅠㅠ 하지만 알바하러 갔음 서녕이랑 알바 사파리 직원인가? 이날 코로나 없는 어린이날인줄 키즈카페에 애기들 겁나 많던디…. 자꾸 한놈이 미끄럼틀 타고 내려오면서 저거(이름 모름)중간에 놓고 내려오길래 뺏어서 함 해봤는데 생각보다 별로임 이날 에버랜드라며…? 투썸 가는중 헉헉 아 캐더웠음 땀나;;;;;;;;;; 돼지가 자꾸 쫄라서 사줌 아 맛있다 ㅋㅋㅋ 진심 이성잃고 조질뻔함 (팬 전적있음) 강의 밀림ㅋㅋㅋㅋㅋ 인생 베이지 걸 하이~Hi 주 3회 박서녕 시롸냐? 여니도 오랜만에 만나서 한강가려했는데 미세먼지 ㅋㅋㅋㅋㅋㅋㅋ오바여서 급경로 변경 고딩 때 이후로 오랜만에 어니언 방문 진심 저 피자빵? 이 진짜 맛있었다 ㅠㅠㅠㅠㅠㅠㅠㅠ또 먹고싶당 선영이 초코음료에서 알콜맛남 원래….저기 밖에 앉아있었다가 참새 습격받고 정신 혼미해졌음(조류공포증…) 애들 ㅋㅋㅋㅋㅋ심각성 인지하고 급하게 내부로…..피신 고맙다 애들아… 근데 안에 있다가 우리 앉았었던 자리에 다른 분의 음료와 빵이 놓아져있었는데 주인 없는 사이에 참새 습격당했다….ㅋㅋㅋㅋㅋ;;;;;; 땀;;;;그 장면을 본 우리 캐당황 나중에 다행히 참새가 습격하고 있을 때 주인왔음^^후 없을 때 왔었다면….난 몰라…..끔찍해…. 말씀 드리기엔 오지랖이야….아닌가..? 그러기엔 자리도 멀었어 참새를 보고 충격먹은 남성분 뒷모습이 잊혀지지 않음ㅋㅋㅋㅋㅋㅋㅋㅋㅋㅋㅋㅋㅋ한 3초간 정지였음 아이셔 ㄱㅊ? 우동 맛집;; Cheers~~~~!! 와 진짜 재밌네 내 몸은 20살로 기억되고 있군 (기억 조쟉..ㅠ) 오랜만에 윾빈이 만났다 ㅠㅠㅠㅠ보고싶었어 일단 배좀 채우자 ㅋㄷ 기엽당ㅋㅋㅋ 이날 밖에 안나왔으면 서운할 뻔 ㅠㅠ 날씨 최고였다 카페에서도 명당자리에서 바람 솔솔 맞으니 기분 최고였음 안쪽까지 처음 와봤는데 새로운 동네 온 기분이여서 새로웠다 설레군~~❤︎ 홍대 거리 걷다가 사람도 많고…. 오랜만에 젊음의 거리에 적응이 안돼서 잠실로 피신 우리찐딴가 가려던 카페 디저트랑 자리가 다 별로여서 원래 오던 곳으로~~^^ 요 빵 맛있넹ㅋㅋㅋ 왐마 이 귀염둥이 누고? 이만❤️‍🔥❤️‍🔥"
