title,content
성수동 브런치 밀카페 우프 + 콜렉트 카페 22.8.27,"성수동 오랫만에 브런치. 일전에 봐둔 밀카페 우프. 카페지만 브런치 메뉴도 있다. 원래 핫한 쵸리상경, 온량에 오픈런 해서 가보려고 했는데 대기가 엄청났다. 여긴 아직 알려지기 전인지 바로 입장가능해서 고고. 오픈키친 좋다. 키친이 커! 전형적인 브런치지만 맛있다. 단호박 스프도. 오믈렛도 맛있다. 샌드위치도. 3명이서 헤비하게 먹었다. 볕이 좋았던 주말 오전 성수동. 만나서 반가워! 구름 한 점 없는 쾌청한 날 콜렉트 커피 그라니따 맛있다. 좋은 사람들과 맛있는 음식! 충만해."
[성수동브런치/서울숲맛집] 밀카페 우프 오믈렛 추천,"안녕하세요 ㅎㅎ 레리입니당 :) [서울호호식당/서울숲맛집] 호호식당 성수 분위기 굿 안녕하세요 ㅎㅎ 레리입니당 :) #서울숲 #파스타맛집 #돈까스맛집 찾다가 발견한 #맛집 ! #호호식당 성수점... blog.naver.com #서울숲 #파스타맛집 #돈까스맛집 찾다가 발견한 #맛집 ! #호호식당 성수점 에 다녀왔어요 ㅎㅎ #파스타맛집 #호호식당 성수점 은 #뚝섬역 에서도 가까워요 ! #성수핫플 이라 주변에 #카페 맛있는 곳도 많아서 최고 ㅠㅠ #외관 이 딱 봐도 #분위기있는맛집 ㅠㅠ #성수맛집 #호호식당 점원불들도 너무 친절하시구 ㅠㅠ #식당분위기 도 넘 좋았어요! #뚝섬역맛집 #서울숲맛집 #분위기좋은맛집 #호호식당 의 최고 장점은 맛과 분위기 에요 ! #성수맛집 #성수예쁜파스타 #호호식당 은 매장을 넘 이쁘게 꾸며 놓으셨어요! #분위기 물씬 ㅠㅠ #힙한식당 #뚝썸파스타 #호호식당 에서는 편안히 얘기하면서 먹을 수 있습니당! 좌석간 거리도 넓고 매장이 넓어서 편안히 앉아서 먹다가 왔어요 ㅎㅎㅎ #성수맛집 #뚝섬맛집 #돈부리파스타 는 분위기가 좋고 #파스타 맛있어서 재방문 하시는 분들이 많더라구요! #성수분위기좋은식당 #뚝섬파스타맛집 인거 같아요 ㅎㅎㅎ 맛있는 파스타 와 편안한 분위기가 장점이에요! #파스타 먹고 감탄하면서 얘기나누니 한 순간도 지루하지 않더라구요 ! 밀카페 우프 서울특별시 성동구 서울숲4길 16-19 2층 영업시간 11:00 - 21:00 Last order 20:15 2호선 뚝섬역 1번 출구에서 도보 7분 #분당선 서울숲역 4번출구 에서 에서 도보 10분 이면 #성수맛집 #뚝섬맛집 #밀카페우프 에 도착할 수 있어요! @oeuf.mealcafe님이 Instagram을 사용 중입니다 • @oeuf.mealcafe님 프로필의 게시물 47개 팔로워 3,363명, 팔로잉 0명, 게시물 47개 - @oeuf.mealcafe님의 Instagram 사진 및 동영상 보기 www.instagram.com 임시휴무일 은 #인스타그램 으로 공지 한다구하니 미리 확인하고 방문하시는 게 좋을 거 같아요! #밀카페우프 매장인테리어에 감각이 넘쳐났습니다 ㅠㅠㅠ 막 찍어도 사진이 넘 이쁘게 나오더라구요!! 지친 맘 힐링했습니다 ㅠㅠ #오믈렛 하구 #에그아보카도샌드위치 주문! 요즘 2층카페가 핫한거 아시죠 ㅠㅠ #분위기좋은카페 내부 인테리어도 넘 이쁘더라구요 ㅠㅠ #브런치카페 이지만 양이 엄청 많아서 점심으로도 제격입니다! #딸기케이크 도 넘 맛있어보이더라구요 ㅠ 힘들고 지칠 때 오면 위로 받기 좋은 곳이에요 ㅠㅠ 맛있는 음식으로 하루 마무리 하기! #에이드 비주얼도 넘 이뻣어요! #레몬에이드 #오미자에이드 음식 나오자마자 감탄했잖아요!! #성수맛집 #뚝섬맛집 #밀카페우프 확실합니다! 가게 둘러보면서 얘기하다보면 시간 금방 가더라구요 ㅎㅎㅎ #대화하기좋은식당 이에요! 1시쯤 방문했을 땐 웨이팅 없었어요! 보통 성수맛집 은 12시 전부터 줄 길게 서있는데 #호호식당 이랑 #밀카페우프 는 1시 반부터 웨이팅이 있더라구요! #맛있는케이크 #브런치맛집 #서울숲역오믈렛 #밀카페우프 날씨 좋은 날에는 맛있는게 땡기잖아요 ㅠㅠ #인기메뉴 인 #오믈렛 이랑 #샌드위치 정말 맛있게 먹었어요! #딸기에이드 신메뉴 도 맛있더라구요 상큼한 딸기가 가득 토핑되어 있어요 ㅎㅎ 그 덕에 하나도 느끼하지 않답니다! #성수맛집 #서울숲역맛집 #밀크티 도 정말 맛났어요 ㅎㅎㅎ 지금 #서울숲 에 완전 벚꽃 이쁘게 펴서 배부르게 맛있는 음식먹구 #벚꽃구경 다녀왔답니다! 사람도 엄~청 많아요 ㅋㅋㅋㅋ. 은은한 조명 덕분에 차분한 대화를 이어나갈 수 있는 #분위기맛집 #밀카페우프 완전 추천해요 ㅎㅎㅎ #서울숲역 #뚝섬역 #서울숲 에서 힐링하고 싶으시다면!! #서울숲브런치 #성수브런치 #뚝섬역브런치맛집 #밀카페우프 에 들려 보세요! 기분 좋은 행복함을 얻으실 수 있을거에요 ㅎㅎㅎ #브런치 #점심 으로 #밀카페우프 에서 #성수브런치 #서울숲역카페 #브런치맛집 제대로 힐링했어요 ㅠㅠ #우프 는 #지인추천 으로 알게되었어요! 지인추천은 신뢰도 100 인거 아시죠 ?! 일반적인 #카페 와 같이 다양한 #조각케이크 와 #스콘 이 있었어요! #브런치 먹으러 왔는데 담에는 #카페 로도 재방문 하고 싶은 너무 이쁜 곳이에요 ㅠㅠ 특히 #펌킨파이 가 맛있다구 소문이나서 한조각 남으신거 보이나요 ㅋㅋㅋ 여기 리뷰 보면 주문 느리다고 되어 있는데 정말 맛있어서 음식 늦게 나와도 용서되는 맛이에요^^ 제가 느끼기에는 친구랑 얘기하면서 떠들다보니 늦다는 생각도 안들었어요! #브런치 #점심 #밀카페우프 #성수브런치 #서울숲역카페 #브런치맛집 소개팅 도 많이 하시더라구요! 그만큼 분위기 좋은 곳이니 완전 추천해요 ~ 꼭 방문해보세요!! #서울숲브런치 #성수브런치 #뚝섬역브런치맛집 #밀카페우프 에서 맛있는 점심 먹구 #서웊숲 으로 #벚꽃 보러 가면 힐링 제대로 입니다 ㅠㅠ 주말 알차게 보내구 와서 넘나 행복해요 ㅎㅎ 여러분 들도 힘들면 성수로 갑시당!! #아보카도에그토스트 #오믈렛 #딸기에이드 #밀크티 는 꼭 드셔야 합니다 ㅠㅠㅠ 너무 맛있어서 어제 갔다왔는데 또 가고 싶네요 .. 분위기도 너무 좋고 점원분들도 완전 친절했어요! 50m © NAVER Corp. 밀카페 우프 서울특별시 성동구 서울숲4길 16-19 2층"
성수동 나들이 : 밀카페 우프/메쉬커피/서울숲/먼치스앤구디스,"오랜만에 성수동👋 날씨는 왜이렇게 또 좋은지 모든 하늘이 나를 돕는 느낌 뚝섬역에서 내려 기분좋게 친구와 밀카페 우프로 향했다. 빨간벽돌 건물이 바로 밀카페 우프! 들어가자마자 보이는 포스터를 따라 2층으로 올라갔다. 전체샷을 찍지는 못했지만, 햇빛도 잘들고 아기자기하고 깔끔했다. <출처: 네이버 플레이스> 우리가 이날 선택한 메뉴는 리코타치즈와 딸기샐러드 그리고 치폴레 클럽 샌드위치 딸기랑 블루베리도 신선하고 그래놀라랑 카카오닙스도 적당히 씹혀서 너무 맛있었다. 또한, 저 리코타치즈가 진짜 미쳤다... 리코타치즈 진짜 달콤하고 부드럽고 (츄베릅~) 사랑해.....❤ 리코타치즈샐러드에는 새콤한 발사믹소스가 뿌려져있고, 나는 너무 잘어울려서 좋았는데, 친구는 발사믹소스를 먹지 못해서 아쉬웠다고 한다. 치폴레 샌드위치도 치즈가득하고, 알차고 프레쉬해서 너무너무 내스탈이었다. 커피도 한잔 마시고 가고싶었지만, 다음 코스까지 정해두었기에 여기서는 안녕... 50m © NAVER Corp. 밀카페 우프 서울특별시 성동구 서울숲4길 16-19 2층 그리고 커피는 메쉬커피! 친구는 메쉬커피를 너무 좋아해서 성수동에 올때마다 꼭 이곳에 들른다고 했다. 테이크아웃 전문 커피라서 앉을곳이 충분하지 않지만, 커피가 너무 맛있어서 꼭 방문한다는 그곳 ""메쉬커피"" 분명 저번에 왔던 기억이 있는데, 커피 진짜 맛있다 하고 가게 이름을 기억하지 못했던 곳이었다. (이번에는 잘 기억해야지!) 커피맛을 충분히 느끼고싶어서 따뜻한 아메리카노로 주문했고, 산미가 너무 강한 커피를 좋아하진 않는데 나에게는 적당한 산미와 고소함이 느껴져서 향도 맛도 좋았다👍 50m © NAVER Corp. 메쉬커피 서울특별시 성동구 서울숲길 43 이날 날씨가 너무 좋아서 카페 바로 앞에 잠깐 앉아서 멍 때리고, 사람들도 구경하다가 밀카페 우프에서 먹은 샐러드랑 샌드위치 소화시킬겸 서울숲으로 고고 햇빛도 좋고, 적당히 바람도 불고, 산책나온 강아지들 사진찍으러 나온 작가님들 우리와 같이 햇빛을 쬐러 나온 사람들로 가득했다. 이날 진짜 다양한 주제로 떠들다가 서울숲 사진은 하나도 찍지도 못함 이날 먹은 음식은 샐러드랑 샌드위치 반쪽, 커피한잔이라 소금빵까지 사들고 집가면 완벽하겠다 싶었다. 그래서 찾아간 곳은 평소에 가보고 싶던 먼치스앤구디스 늦은 시간에 방문했는지 내사랑 소금빵은 sold out..!! 아기자기한 식료품점이었다 햇빛이 쫙 내리쬐는 곳에 위치해 있던 컵이랑 그릇 너무 귀엽다... 크림치즈, 페스토, 소스 옆쪽에는 그릭요거트, 치즈도 팔고있었다. 피크닉세트 포크랑 나이프도 있었는데 진짜 귀여워... 50m © NAVER Corp. 먼치스앤구디스 서울특별시 성동구 연무장길 33 1층 평일 낮의 성수동 나들이는 역시 행복이다. 과거와 새로운 현재가 함께 공존하는 동네이기도 하고 좋아하는 공간들이 집합되어 있어서 참 좋다. 멀지 않지만 먼 느낌이라 (이게 무슨말이여...) 자주 오진 않았었는데, 활기가 너무 좋고, 이곳저곳 구경할 것도 많아서 자주 와야겠다. 아 진짜 행복해 역시 가만히 있지 못하는 병에 걸린 사람답게 열심히 돌아다녀야지 오늘도 안녕👋"
서울숲 카페 추천: 브런치 카페 '밀카페 우프(OEUF)'/성수동 브런치 카페/서울숲 브런치 카페,"안녕하세용~ 뽀글이 누나예요❤ 오늘은 너무너무 괜찮았던 서울숲 브런치 카페 #밀카페우프 에 대해 포스팅 할고에용! 밀카페 우프(OEFU) 서울숲 브런치 카페 50m © NAVER Corp. 밀카페 우프 서울특별시 성동구 서울숲4길 16-19 2층 위치는 뚝섬역 8번 출구에서 도보로 8분 거리에 위치해 있어요..! 성수동은 주차할 곳이 협소하므로 도보로 방문하는 것을 추천드려요! oeuf.mealcafe • Instagram 사진 및 동영상 팔로워 3,487명, 팔로잉 0명, 게시물 64개 - @oeuf.mealcafe님의 Instagram 사진 및 동영상 보기 www.instagram.com 밀카페 우프(oefu) 운영시간 평일&주말: 11시~21시 화요일 정기휴무 * 20:50 라스트 오더 외관은 빨간 벽돌로 되어있고 들어가서 계단으로 올라가면 2층에 매장이 있어요 밀카페 우프 내부 인테리어 깔끔한 인테리어 / 총 26좌석 1층 계단에서 올라오시면 이렇게 매장이 있어요!! 오픈 시간에 맞춰서 가서 그런지 저희 밖에 없어서 편하게 사진 찍을 수 있었어요 :) 좌석은 대략 26좌석이고 전체적으로 깔끔깔끔 화이트! 인테리어에요 그리고 화장실도 카페 내부에 있어 굉장히 깔끔해서 좋았어요..! (어딜 가나 화장실 중요하게 생각하는 1인) 밀카페 우프 메뉴판 메뉴판 / 카운터 브런치 메뉴는 다양했고 커피 케이크도 판매하고 있어요..! 가격도 쏘쏘해서 먹고 싶은 거 다 시켰어용 ㅎ 과일 팬케이크 14.0 / 오늘의 수프 8.0 폴 브렉퍼스트 18.0 저희가 시킨 메뉴는 총 4가지! 과일 팬케이크 14.0 폴 브렉퍼스트 18.0 오늘의 수프 8.0 아메리카노 5.0 15분 정도 기다리니 주문한 메뉴가 나왔어요! 비주얼부터 오마이갓! 정말 푸짐하게 나와서 놀랬어요 과일 팬케이크는 과일이 많이 올라가 있어서 배부르게 먹을 수 있었어요 폴 브렉퍼스트도 양이 많아서 배부르게 먹었답니다! 브런치 카페는 처음 방문해 보는데 생각보다 분위기도 좋고 양도 푸짐해서 너무너무 좋았어요..! 다음에도 방문하고 싶은 곳입니다! 위치: ⭐️⭐️⭐️⭐️⭐️ 분위기: ⭐️⭐️⭐️⭐️⭐️ 맛 & 가성비: ⭐️⭐️⭐️⭐️⭐️"
성수동 밀카페 우프,"장소 사진은 없음... 배고파서 먹느라 정신 없었네ㅎㅎ 인테리어는 전체적으로 화이트 톤. 사장님이 굉장히 비즈니스적인 친절함을 보여주심. 나쁘단 얘기는 아님 ! 샌드위치는 무난무난했고 오믈렛은 따끈하니 맛있었다. 소스는 직접 만드신다고. 옥수수 수프도 기대 안했는데 담백했다. 그리고 브런치 메뉴들에 쓰여진 빵이 다 똑같은 것,, (매우) 좀 아쉬웠지만ㅠ 빵 자체는 말랑말랑하고 꼬소했다. 첨에 들어갔을 때 음 브런치 전문이 아닌 거 같아서 1차 당황, 메뉴 소소한 거 몇 개 시킨 거 같은데 5만원 훌쩍 넘겨서(???) 2차 당황, 아 솔직히 가격에서 띵했다. 이렇게 비싸다고...? 물가가 미친 걸까 성수동이 미친 걸까ㅎ 나는 솔직히 아직도 메뉴당 가격이 대체 얼마였던 건지 감이 안잡힌다 ;;; 찾아보기 싫다ㅎㅎㅎ (샌디치, 오믈렛 각각 15000원이라 치고..(샌드위치가 만오처넌이라니!!! 내가 사랑하는 망원동 604seoul의 그 튼실하고 크고 다채로운 소스에 알찬 쉬림프번이 9000원인데요!!?!?) 수프가 8000원대 였던 거 같은데, 그럼 째깐했던 커피랑 아이스티가 6000원이었던 거야..?) 성수동이 제정신이 아닌 걸로ㅎㅎㅎㅎㅎ 그래서 기대를 안했던 탓인가 그냥저냥 오 맛은 있네, 잘 먹긴 먹었던 거 같다. 성진이랑 나는 딱히 호불호 없는 입맛이라 😅 가격대비 퀄리티가 좀 아니었어ㅠ 좀 후회스러워 다시는 실수하지 않으려 남겨보는 리뷰 기록,,,"
[성수동 카페] 밀카페 우프 oeuf_과일 팬케이크 미쳤어!,안녕하세요! 성수동에서 늦은 점심을 먹고 나서 서울숲에서 산책을 하다가 배도 좀 꺼졌다 싶어서 카페를 가게 되었습니다. 저번에 친구들이랑 보톡으로 통화하다가 팬케이크 먹고 싶다고 무의식으로 말 흘려버렸는데 한 친구가 팬케이크 카페를 찾아주면서 여기를 가자고 했거든요! 스릉한다 친구야♥ 서울숲에서 조금만 걸면 있던 곳이라 금방 도착했고 붉은색 벽돌로 되어 있고 oeuf라고 적혀있어서 바로 찾을 수 있었습니다. 매장은 1층에서 계단을 올라와야 있는 식이였는데요. 2층에 올라오면 카페 전체가 보여서 많이 크다는 생각은 못 들었는데요. 작은 매장인 것 같으면서도 시끄럽지 않아서 오순도순 놀기에 좋았습니다. 인테리어는 깔끔한.. 약간 성수동 느낌.. 다들 뭔지 아시겠죠..? 성수동 느낌... 그 느낌 주문은 주방(카운터) 쪽에서 하면 되는데요. 케이크 같은 경우 그날 그날마다 달라서 왼쪽에 비치되어 있는 케이크 보고 결정하면 되는데요. 저희는 팬케이크를 먹으러 왔기 때문에 과일 팬케이크로 주문했습니다. 근데요? 케이크도 좀 맛있어 보이더라고요.. 나중에 또 오게 된다면 저기 있는 것들도 꼭! 먹어봐야지 주문한 과일 팬케이크! 팬케이크 사이즈 좀 큰 거 하나만 나올 줄 알았는데 3개가 나오더라고요. 살짝 놀랍.. 두툼하고 폭신폭신해서 식감 정말 좋았습니다. 과일은 제철마다 달라지는 것 같은데 딸기랑 바나나 조합도 정말 좋았습니다. 가보실 분들은 아래 참고해주세요. 50m © NAVER Corp. 밀카페 우프 서울특별시 성동구 서울숲4길 16-19 2층 서울숲 인근에 위치 뚝섬역 8번 출구에서 15분 내로 도착 OPEN: AM 11:00 instagram: oeuf.mealcafe
"[뚝섬역, 서울숲 카페] 성수동 핫한 브런치카페 '밀카페 우프(OEUF)","하이앙뇽 바쁘다바빠를 드디어 벗어나게 된 웅찌!!ㅠㅠ 서울숲에서 배가고팠던 웅지는 예전에 과일 샐러드를 맛있게먹엇떤 브런치 카페를 다시찾게되는데..😎 50m © NAVER Corp. 밀카페 우프 서울특별시 성동구 서울숲4길 16-19 2층 밀카페 우프(OEUF) 월,수-일 11:00-21:00 (20:50 라스트오더) 화요일 정기휴무 화장실은 매장 1층에 있다. 외관이 편집샵 같이 생겼땨.. 모던한 moooodddd🫢wow와우웅!! 드큰두근 기대를 안고 입장❣️❣️ 메뉴판 친절히 매장 앞에 메뉴판까쥐👍 사장님 세심한센스..>< 들어가자마자 오른쪽에 보이는 메뉴사진들과.. (징짜..잡지사진가태.....) 수많은 계단들... . . . 그래도 어째..먹으려면 올라가야지..😱😭 내부가 생각보다 넓은것 같아보였는데 생각보다 아늑하다. 주방이 오픈되어있어서 요리하시는 모습을 볼수도 있다😍 창문이 통창이라 매장이 답답하게 느껴지지않는다! 주문하는곳 옆에는 디저트들도 있고❤️ 물도 준비되어있음!! 자아 아 오늘의 웅지한끼는❗️❗️❗️ 바로바로오오!! 리코타치즈와 계절과일 샐러드 11000 오늘의 스프 8000 풀 블랙퍼스트 18000 리코타치즈와 계절과일 샐러드 11000 진짜 과일이 신선했다!!🌿 달달한 샤인머스캣이랑 리코타치즈 조화은근죠아! 완전 가벼움 부담없다❤️ 계절마다 과일이 바뀐다던데 다음번도 기대됨! 지난번에 먹었던 과일샐러드 딸기is ....뭔들.. 넘나맛있었던 기억❤️😍😍 개인적으로 딸기가 더 입맛에 맞았따!! 오늘의 스프 8000 빵이 정말 바삭하게 잘구워짐❣️❣️ 스프는...글쎄...웅지입맛은 아니었움😅 적당히고소하고 뭔가씹히는맛! 풀 블랙퍼스트 18000 역시 비주얼이 좋구나!🎉❤️ 무난하게 실패없는 메뉴 소세지가 특히나 뽀득하니 맛있었다👍 스크램블에그가 정먈 부드러웠뜸!! 쟈알 먹었따아!!❤️❤️❤️😊👍🌿🌿🌿 가벼우면서 맛있는 브런치를 즐기고 싶으신 분들, 데이트장소 찾아보시는 분들께 추천한다. 50m © NAVER Corp. 밀카페 우프 서울특별시 성동구 서울숲4길 16-19 2층"
[성수동 밀카페우프] 서울숲에 위치한 브런치 맛집,"안녕하세요 :) 너무 만족스럽게 먹었던 성수동 브런치 맛집 데려왔습니다 50m © NAVER Corp. 밀카페 우프 서울특별시 성동구 서울숲4길 16-19 2층 🌿밀카페 우프 영업시간 매일 11:00-21:00 라스트오더 20:50 배달, 애견동반 가능 지도를 따라 서울숲 인근 골목에 들어가면 이렇게 붉은 벽돌의 건물이 나타납니다 ‘밀카페 우프’는 2층에 있어요 찾아보니 광흥창역 근처에도 2호점이 있더라구요 제 활동반경에서는 광흥창역이 더 가깝다보니 다음에는 2호점을 가보려구요 미리 공개하는 재방문의사 5/5 콜미바이유어네임이 생각나는 포스터 싱그럽다 싱그로와 오늘 생각난 김에 콜바넴 봐야겠어요 계단 따라 올라오시면 바로 가게 등장 포근한 인테리어가 딱봐도 브런치집 창도 넓어서 개방감도 있었어요 저는 비록 비 오는날 갔지만 그럼에도 분위기 굿 날씨 좋은 날 가면 더 좋을듯 하네요 테이블은 6~7개 정도 있어요 2~4인이 방문하기 적당한듯 합니다 🌿 메뉴판 음료는 커피, 티, 에이드 종류 다양하게 있어요 디저트는 매일 바뀐다고 하니 참고하세요 🌿 브런치 메뉴 오믈렛(18.0) 풀 브랙퍼스트(21.0) 오늘의스프(9.0) 초당옥수수샐러드(11.0) 치폴레샌드위치(14.5) 잠봉샌드위치(13.0) 무화과 크림치즈 샌드위치(14.5) 스크램블 토스트(16.0) 과일 팬케이크(16.0) 세이버리 에그 베이컨 팬케이크(18.0) 메뉴 하나하나 다 맛있어 보여서 고민하다가 (3인 기준) 오믈렛 치폴레샌드위치 과일 팬케이크 아메리카노, 청귤에이드 주문했습니다!! 오픈키친 너무 예쁜거 있죠 외국 주방 훔쳐보는 느낌 디저트가 매일 바뀌니 쇼케이스를 참고하라고 하더라구요 케이크류 저렇게 디피되어있는거 너무 이쁘지 않나요ㅠㅠ? 전 식사하러 방문한거라 케이크는 못먹었는데 다음엔 케이크도 먹어보려구요!! 브런치 맛을 생각하면 케이크도 무조건 맛있을듯 그리고 배달도 되는 것 같더라구요 배달 기사님이 여럿 왔다갔다 하셨어요 성수동 인근 주민분들 부럽습네다 애견 동반도 가능해요 !! 저희가 귀엽다고 하니 옆으로 다가오던 아가🐶💛 강아지가 있는데 괜찮냐고 물어봐주신 옆자리 손님분도 넘나 젠틀하셨어요 화장실은 카운터에서 키를 챙겨서 계단 아래 1층으로 가시면 됩니다 ! 아메리카노(5.0) 연하게 주문한 아메리카노 등장 이 디자인 컵 집에도 똑같이 있는데, 집에서는 절대 안쓴단 말이죠? 근데 밖에서 보니 왤케 이쁜지 모르겠어요 ㅋㅋㅋㅋㅋㅋㅋ 과일 팬케이크(16.0) 색감이 너무 예쁜 과일 팬케이크 등장 복숭아, 바나나, 생크림, 시럽이 같이 나와요 시럽 뿌리니 더 먹음직스러워 보이죠 팬케이크는 3장 있는데 두께도 딱 적당했어요 과일도 신선했고 달달해서 맛있었어요 과일에서 신 맛 나면 절대 안 먹는데 진짜 딱 맛있는 과일의 단맛이었어요 👍🏻 치폴레 샌드위치(14.5) 치폴레 샌드위치는 치폴레소스, 로메인, 토마토, 에멘탈치즈, 베이컨, 달걀프라이로 구성되어 있는 샌드위치입니다 빵 자체도 맛있었고, 속재료도 신선했어요 * 치폴레 : 멕시칸 요리에 주로 사용되는 재료인 훈제, 건조된 할라피뇨 * 치폴레 소스 구운 치폴레+토마토로 만든 소스 오믈렛(18.0) 오믈렛도 뒤이어 등장 양파와 베이컨을 볶아 속을 채운 오믈렛 위에 토마토 소스가 올려져있어요 직접 만드신 소스라그런지 더 맛있었어요 감자도 같이 있는데 은근 맛도리 떼샷갑니다~ 색감 너무 예쁘죠 요리가 한꺼번에 나와서 좋았고, 맛도 기대 이상이어서 기분 좋았어요 가게 안에 퍼지는 빵 냄새도 아주 디퓨저로 놓고싶은 지경 건강하게 배부른 느낌 잘 느꼈습니다 지도에 저장되어 있던 곳 우연찮게 갔던 건데 너무 잘 골랐다 싶었던 브런치맛집 성수동 혹은 광흥창 쪽 방문하시게 되면 드셔보세요 강추 ! 그럼 이만 즐거운 주말 보내세요 :D #밀카페우프 #성수동브런치 #브런치맛집"
coffee & cafe) 성수동 브런치 카페 oeuf (밀카페우프),"밀카페 우프 서울특별시 성동구 서울숲4길 16-19 2층 성수동 예쁜 카페 골목사이 2층 브런치 카페 연휴동안 뭐 할까~~ 하다가 오랜만에 서울 나들이를 다녀왔어요;) 주말에 늘 북적거리던 성수동 카페 골목이 조용하고 한가한 이 거리가 익숙치 않을 정도로 서울은 연휴만 되면 사람들이 빠지는 거 같아요 눈치게임 성공! 차도 안 막히고, 주차로 고생도 안 하고 평소에 웨이팅이 1~2시간은 기본인 맛집, 가고 싶던 카페들도 프리패스~ 고층 아파트 사이에 정감있게 제각기 색을 내며 자리 잡고 있는 주택가를 보면 왠지 모르게 힐링이 되네요 배도 조금 출출하고 당 섭취도 필요해서 브런치 카페인 '밀카페 우프'에 방문 시그니처 메뉴는 사장님께서 디저트라고~~ 그래서 나는 제일 먼저 바나나푸딩 PICK 음료는 패션 후르츠 에이드와 아이스라떼 에이드와 라떼는...쏘쏘 바나나 푸딩은 진짜~~맛있었다 옆 테이블은 다양한 브런치 메뉴를 주문했는데 푸짐하게 잘 나오는 듯했다@@ 수다를 떨며 시원한 통 유리창 넘어 창밖을 들여다보니 예약해둔 연극 시간이 다 되어서 브런치는 못 먹었다 다음엔 브런치 먹으러 가볼게요~:) 성수동 안녕👋 #성수동카페 #성수동브런치 #바나나푸딩 #서울숲핫플 #밀카페우프 #우프시그니처메뉴 #핫플카페 #서울카페 #Jay일기"
