title,content
[성수역 카페] 성수동대림창고갤러리 | 멋스러운 인테리어와 함께 커피 한잔☕️,"#성수역_카페 #대림창고 #대형카페 안녕하세요 히새입니당 어제는 오랜만에 데이트하러 성수동에 갔는데요 남자친구가 한 번도 안가봤으면 한 번 가자고 해서 가 본 대림창고갤러리 !! 후기를 적어보려고 합니다~~ 50m © NAVER Corp. 성수동대림창고갤러리 서울특별시 성동구 성수이로 78 《 성수동대림창고갤러리 》 - 영업시간 : 매일 11:00-22:00 - 전화번호 : 0507-1390-9669 - 주차 : 유료표기된 노상주차장, 한라시그마밸리 유료 지하주차장 📌 성수역 3번출구 도보 5분 대림창고는 과거 자재를 보관하던 창고를 개조하여 만든 카페라고 해요! 그래서인지 회사 간판으로 쓰던 것 같은 옛스러운 간판이 있더라구요 비오는 날이었지만 더 운치있는 느낌..! 대림창고는 한때 성수동에서 가장 인기가 많았던 카페였다고 합니당 딱 들어가자마자 보이는 내부도 아주 멋드러졌어요 👍 저 나무들은 뭘 표현한건지 궁금하네용 대형카페답게 엄청 넓었어요! 이만한 공간이 옆쪽에 더 있었어요 금요일 퇴근시간 이후에 방문한거라 사람이 많을 줄 알았는데 비가 와서인지 생각보다는 한적했고, 사람이 많더라도 테이블 간 간격이 넓어서 답답한 느낌은 없을 것 같았어요! 저희가 방문하기 전에 꾸준히 손님이 많았던건지 빵은 많이 나갔더라구요! 종류도 꽤 다양했고, 개별포장하거나, 비닐로 덮어 위생적으로 관리하고 있어 좋았어용 아쉽지만 저희는 금방 저녁을 먹어야해서 커피만 주문을 했답니다! (왼) 디카페인 아메리카노 - 6.5 (오) 아메리카노 - 6.0 날씨가 꿉꿉해서 아아가 너무너무 땡겼던 탓에 나오자마자 살짝 마셔버렸어요 ㅋㅋ 커피맛 좋아요! 신맛은 거의 없고 고소해서 딱 제가 좋아하는 스타일! 퇴근하고 여유롭게 카페에 앉아 커피 한 잔,, 심지어 금요일,, 행복,,🫶 그림들도 둘러보고~ 인테리어도 보고~ 소품 하나하나 구경하는 재미도 쏠쏠했어요 이 부분이 정말정말 맘에 들었어요! 열맞춰서 정리되어있는 액자들과 은은하게 벽에 비춰진 바다까지 보고 있으면 아주 마음 편안해지는 공간..♡ 이 곳은 천장이 반투명하게 되어있어서 쨍쨍한 날이면 햇빛이 은은하게 들어와 정말 예쁜 공간이라고 해요! 비오는 날에 간거라 그 모습을 보지 못한 건 아쉽지만, 이 자체로도 충분히 예뻐서 만족! 화장실도 깔끔하고, 무엇보다 들어가자마자 좋은 향이 확 나서 기분좋아지더라구요! 사소한 거 하나하나 신경쓴 느낌이 물씬 났답니다 아주아주 예쁜 인테리어와 커피 맛도 최고! 기분전환하기 정말 좋은 공간🫶 성수동 오실 일 있으시면 한 번쯤 방문해보셔도 좋을 것 같아용 저도 다음에는 빵도 한 번 먹어보러 재방문해야겠어요!"
"[성수카페] 창고형 갤러리 카페 ""성수동대림창고갤러리""","50m © NAVER Corp. 성수동대림창고갤러리 서울특별시 성동구 성수이로 78 영업시간 11:00 ~ 22:00 (연중무휴) 무선 인터넷, 남/녀 화장실 구분 안녕하세요~ 성수 나들이 갔을때 우연히 지나가다 눈에 띄어서 방문하게된 카페 ""대림창고"" 다녀왔어요! 공장을 개조해서 만든 창고형 갤러리 카페라고 하네요~ 어쩐지 외관부터 독특하더라구요!! 자~ 들어가보실까요? Next image 이날 날씨가 너무 좋아서 막찍어도 이쁘게 나오더라구요~ 날씨가 다했다!!! 외관부터 궁금증을 유발하게 생기지 않았나요? 입구쪽에 전시되어 있는 조형물도 독특해요~ 갤러리 카페여서 그런지 곳곳마다 구경거리가 한가득! 요리보고 저리봐도 신기하죠~? 그림도 곳곳에 전시되어 있어서 구경하기 좋은 것 같아요! 2층 내부사진은 못찍었지만 아담한데 앉아서 마실 수 있는 공간이 있더라구요~ Next image 평일인데도 불구하고 사람이 많았어요~ 하지만 공간이 넓어서 자리는 많답니다! 맛있어 보이는 디저트와 베이커리류들 다 먹고싶네요 ㅜ 가격은 대체적으로 무난한 편이였던 것 같아요! 대림창고에서 사용하는 원두 종류 및 설명서도 같이 전시 되어 있더라구요~ 지나가면서 한번 쯤 읽어보는 것도 좋을 것 같아요! 전 개인적으로 이 공간이 눈에 띄더라구요~ 한 공간에 여러 그림들이 놓여져 있으니까 뭔가 조화를 이루면서도 감명있게 느껴졌어요 Next image 저희가 시킨 배이커리 메뉴는! 크루아상카야&코코넛 - 6,000 더블뺑오 - 5,800 시나몬프레즐 - 6,000 + 음료 4잔 역시 성수라 그런지 가격이 착하진 않지만 대체적으로 빵도 무난하니 맛있는 편이였고 특히 크루아상카야&코코넛은 제 취향이였어요! 보통 베이커리 빵집 가면 잘안보이는 메뉴이기도 해서 시켜봤는데 역시 기대이상~ 더블뺑오는 뺑오쇼콜라랑 흡사한맛이에요! 겉에 코팅되어있는 초코가 맛있었다는 ㅋㅋ 시나몬프레즐은 쫀득쫀득하면서 시나몬맛이 은은하게 올라오는게 매력적이더라구요! 사실 이날 밖에서 패션쇼 리허설하고 있었는데 창밖으로 구경하는 재미가 쏠쏠했답니다~ 정말 특이한 옷도 보고 눈호강하는 시간이였어요 ㅎㅎ +ps. 패션쇼 사진 Next image 모처럼 쉬러 왔다가 좋은 구경도 하고 즐거운 시간이였슴당 ㅎㅎ 전 몰랐는데 이미 성수에서는 유명한 카페더라구요~ 지나가다 한번쯤 들리면 좋을 것 같아요!"
[성수역 카페] 성수동대림창고갤러리 / 코코넛카야 크로와상이 맛있는 성수역 대림창고(소금빵 비추),"50m © NAVER Corp. 성수동대림창고갤러리 서울특별시 성동구 성수이로 78 성수동대림창고갤러리 매일 11:00 ~ 22:00 안녕하세요! 오늘은 성수역에 위치한 성수동대림창고갤러리를 소개해 드리려고 합니다:) 이곳은 이미 많은 분들이 알고계신 곳일것 같은데요 ㅎㅎ 대림창고라고 해서 대형 창고를 갤러리 처럼 만들어서 카페로 만든 곳입니다 ㅎㅎ 그래서 규모가 어마어마 하고 공간 활용이 정말 잘 되어있어요! 2층도 있으니 2층에도 자리 잡으실 수 있습니다 ;) 평일 저녁이었지만 이미 솔드아웃된 빵들이 많더라구요! 성수는 워낙 핫해서 언제 오든 사람이 많은 것 같아요 ㅎㅎ 그리고 성수에 워낙 작은 카페들이 많은데 이런 카페들은 일찍 닫아서 평일에 오래 앉아있을 수 있는 카페를 찾으신다면 이곳 추천드립니다 :) 예쁜 트리와 함께 내부 공간이 엄청 넓게 펼쳐져 있어요 ㅎㅎ 안에 끝까지 들어가기엔 정말 꽤 걸어야 할 정도이고 여기 공간 외에도 안쪽 내부 공간이 또 따로 있고 2층에도 있으니까 편하신 자리로 앉으면 좋을 것 같습니다 :) 메뉴 디카페인 아메리카노(6000), 크로와상 카야&코코넛(6000), 소금버터빵(3800) 메뉴판입니다! 메뉴는 정말 다양해요 ㅎㅎ 정말 읽기보기에도 시간이 걸릴만큼 다양해서 와인과 맥주도 같이 판매하는 곳이라 더 꽉찬 메뉴인거 같더라구요 :) 많은 빵들 중에 요즘 유행하는 소금빵을 먹어봤는데 정말 맛 없,,,,,,,, 너무 맛없어서 깜짝 놀랐어요 ㅠㅠ 질기다 못해 찰흙 수준 ㅋㅋㅋㅋㅋㅋㅋㅋㅋㅋ 원래 소금빵이 잘하는 곳이 유명하긴 하지만 대림창고가 유명하다고는 들어본 적 없어서 기대를 하진 않았지만 이렇게 맛이 없을 수가 없더라구요!! 너무 질긴 와중에 다 식어서 딱딱 그자체였어요 ㅠㅠ 절대 소금빵은 대림창고에서 사서 드시지 마시고 다른 소금빵 맛집에서 사서 드세요 ㅎㅎㅎㅎ 그 옆에 크로와상 카야&코코넛은 강추드려요 :) 좀 더 카야잼이 많이 들어있으면 맛있었을 것 같지만 그래도 소금빵 먹다가 먹으니 훨씬 맛있게 느껴지더라구요 :) 위에 코코넛 가루가 듬뿍 묻혀있는데 이게 또 썰때 풀편해서 다 나가 떨어져요 ㅋㅋㅋㅋ 그래도 그나마 붙어있는 아이들과 안에 들어있는 카야잼이 아주 얇게 발라져있어서 달달한 크로와상 맛이었습니다! 크로와상 자체도 맛이 없는편은 아니라 아마 다른 크로와상 종류도 맛있을 것 같더라구요 :) 다른 베이커리들도 종류별로 있었는데 별로 끌리는건 많이 없었어요 :) 이곳은 베이커리 맛집으로 유명하기 보다는 분위기가 창고를 베이스로 만들었고 워낙 넓어서 단체 손님이나 늦게까지 여는 카페로 선택해서 올 것 같더라구요 ㅋㅋㅋㅋ 깔미까레는 맛있어보였지만 거의 다른 카페의 반 사이즈인데 가격이 비싸서 패스 했어요 ㅠㅠ 대체적으로 다른 카페에 비해 가격이 1.5배는 되는것 같더라구요 ㅎㅎㅎ 크로와상 종류가 다양해서 크로와상은 먹어볼 만 한 것 같아요 ㅎㅎ 데이트 장소로는 넓어서 주변 사람들 시선 신경쓰지 않고 얘기할 수 있어서 좋은 것 같긴 한데 워낙 창고 느낌이고 화장실도 깨끗한 편이 아니라 저는 굳이 추천드리지 않겠습니다 헤헤 [총평] 성수역 카페로 유명한 대림창고 후기 들려드려요 :) 워낙 유명해서 항상 사람이 많은 곳이지만 평일 저녁에도 사람이 많더라구요! 그래도 워낙 대규모 이기도 하고 자리가 넘쳐나서 사람이 많아서 바로 앉으실 수 있을거에요 ㅎㅎ 10시까지 운영하는 곳이라 주변에 카페 중에 늦게까지 하는 카페를 찾으신다면 여기 추천드립니다 :) 베이커리는 크로와상이 그나마 나은 것 같고 이번에 먹은 카야&코코넛 추천드리고 소금빵은 절대 절대 드시지 마세요! 찰흙 수준으로 질기고 딱딱 했습니다 ㅎㅎㅎㅎ 베이커리는 대체적으로 다른 곳에 비해서 가격도 비싸고 커피도 아메리카노가 6천원이라 비싼편인 것 같아요! 늦게까지 하는 성수역 주변 카페 찾으시면 방문해보세요:) 맛 : ★★★ 재방문의사 : ★★ 그럼 다음에 만나요! #성수역카페 #대림창고 #성수역카페추천 #성수역디저트맛집 #성수역디저트카페 #성수카페추천 #성수디저트맛집 #서울숲카페 #서울숲카페추천 #서울숲디저트맛집 #써울숲디저트카페 #성수디저트"
"[서울/성수]공장을 개조해서 만든 빈티지 갤러리 카페 ""성수동대림창고갤러리""","안녕하세요!! 오늘은 오래된 공장을 개조해서 만든 창고형카페 ""성수동 대림창고 갤러리"" 카페를 소개하고자 합니다☺️ 🚩 서울 성동구 성수이로 78 (성수역 3번 출구에서 305m 도보5분 소요.) ⏰️ 매일 11: 00 ~ 22 : 00 🚗 유료 표기된 주차라인의 노상주차장 (점포,지정 표기된 주차라인은 주차불가) 한라시그마밸리 유료 주차장 이용 Next image 입구에 들어가면 큰 조형물들과 함께 빈티지 함이 뿜뿜 넘쳐난답니다!!👍 갤러리 카페이다보니 한쪽에서는 전시 작품들이 설치되어 있었어요. 현재 진행중인 전시는 ""희부연 오후의 코끼리는 눈을 감는다"" 라는 전시를 진행하고 있습니다. 2022.08. 까지니 가보실 분은 서두르셔야 할거 같아요! Next image 1층입니다. 와~ 진짜 넓어요! 콘크리트와 우드를 이용한 바닥과 벽, 노출된 폐공장의 구조물을 멋스럽게 유지해서 분위기가 딱 핫플갬성이네요👏👏👏 그래서 빈자리를 찾는다고 고생했답니다😭 2층 공간도 있으니 참고해주세요! 매장 규정 안내도 있으니 확인해 주시고, 원두도 판매하고 있답니다! 커피,티,에이드 종류 뿐만 아니라 맥주,와인도 팔고 있습니다. 시그니처 메뉴와 시즌음료인 딸기우유 케익도 4종류 있답니다. 저희는 ""밀크티"" / ""아인슈페너"" ""꺄또쇼콜라""로 주문했습니다. ""밀크티"" / ""아인슈페너"" 밀크티는 딱 기본적인 맛이고, 아인슈페너는 크림이 조금 더 꾸덕했으면 좋았을텐데 하는 아쉬움이 있었지만, 커피맛은 좋았답니다! ""꺄또 쇼콜라"" 오랜만에 초코케이크가 먹고 싶어서 주문한 메뉴랍니다! 먹는 순간 오~달다!!ㅋㅋㅋ당충전 만땅했네요ㅋㅋ 꾸덕하고 너무 맛있었어요👍 (그치만 아메리카노가 너무 땡겼습니다🤣) 성수동 빈티지카페를 찾는다면, 갤러리카페를 좋아하신다면, 대형카페를 찾는다면, ""성수동대림창고 갤러리"" 추천합니다👍 50m © NAVER Corp. 성수동대림창고갤러리 서울특별시 성동구 성수이로 78 #대림창고 #대림창고카페 #성수동대림창고갤러리 #성수동카페 #갤러리카페 #성수대형카페 #공장개조카페 #창고형카페 #성수카페추천 #성수동카페거리 #대림창고메뉴 #성수핫플 #성수가볼만한곳 #성수동데이트 #서울카페 #서울갤러리카페 #빈티지카페 #게이샤원두 #밀크티 #아인슈페너 #꺄또쇼콜라 #카페추천 #답방 #공감 #댓글 #서로이웃 #서이추환영"
<성수동대림창고갤러리> 성수동 핫플 창고를 개조해 만든 카페 베이커리 / 성수 디저트 맛집 뚝섬핫플 성수맛집 뚝섬 성수동 가볼만한곳 넓은카페 갤러리카페 성수 대림창고,성수동 창고 카페 성수동 대림창고갤러리 엄청넓다 천장같은데가 낡은 창고형태를 유지하고있으면서도 손이 많이들어간것같은 / 갈것같은 느낌이었음 이런곳은 유지보수를 어떻게하는지 궁금 베이커리 타르트 크롸상 케익 티라미슈 딸기우유 레몬타르트 베리타르트 샤인머스켓 크로아상 바스크치즈케이크 가또쇼콜라 당근케이크 티라미수 빵이 너무 오픈돼있지않아서 좋았다 얼그레이 까눌레 빨미까레 파운드케이크 음료 메뉴 아이스아메리카노 & 오렌지에이드 커피는 안마셔봐서모름 오렌지에이드는 핵노맛 근래 먹은 에이드들 중에 기억에남을정도로 맛없었던게 시그니처키친 에이드였는데 여기꺼가 더맛없음ㅋㅋ 완전 밍밍한데 끝에 이상한 향까지남 얼그레이크림크로핀 7.4 바삭하고 맛있다 사진에서 보이는 큰 애플파이랑 뒤에 동그란 시나몬프레첼도 사봤는데 애플파이는 속에 애플이 거의없긴했지만.. 그래도 둘다 먹을만했음 여기는 걍 창고컨셉과 큰평수로 어필하는 곳인지 정작 음료나 베이커리 관련해서는 별로라는 리뷰들을 좀 봤는데 나는 에이드가 너무 맛이없었어서였을까; 베이커리류는 괜찮은편인듯느껴졌다 2층 루프탑 루프탑 경치는 좀 새롭긴했는데 계단이 너무 좁고가파라서 정말 위험하게 느껴졌다 2층은 환기가 잘안돼서 눅눅한 냄새까지 기왕이면 1층에 있는걸 추천 화장실 너무 추워서 오래 못있고 나옴 남자가 긴팔긴바지 입고도 못버틸정도라. 특이하게도 에어컨조절은 아예 안된다고했다 이유는모르겠지만 암튼 다시가게되거든 날씨 좀 추워지고 에어컨끌때쯤 가야할듯; 한번정도는 더 가보싶은곳
[성수동카페거리] 성수동대림창고갤러리 카페,"성수동카페거리 대림창고에서 파나마게이샤 커피를 알게 되다. 성수동대림창고갤러리 네이버지도검색 100m © NAVER Corp. 성수동대림창고갤러리 서울특별시 성동구 성수이로 78 성수역 2호선 서울특별시 성동구 아차산로 100 ▶️ 운영시간 Am 11:00 ~ Pm 11:00 ▶️ 음료&메뉴 다양 5,000 ~ ▶️ 성수역3번출구 도보 350m (천천히 주변거리를 둘러보며 방문하기를 추천해요.) 우리는 자동차검사 겸 근처 성수동에 위치한 단골 카센터에 차를 맡기고 걸어서 방문했네요. 과거 창고건물을 그대로 카페로 사용하고 있다. 대림창고 카페 내부를 둘러보고 한적한 1층 공간에 앉았다. 파나마커피로 유명한 게이샤 아인슈페너 두 종류 세트에 15,000원 진한 맛과 향을 각각 느낄 수가 있다. 커피가격에 놀라 검색해보니 원두가격이 장난아니다. 맛도 좋지만 커피생산량의 차이와도 관계가 있어서~ 대림창고에서 파나마산 커피를 처음 접하고, 이후 강릉카페거리의 모 카페에서 같은 종류의 커피를 주문했으나 커피 맛의 차이가 커서 다소 실망했었다. 파나마커피는 꼭 이곳에서 먼저 맛 보기를 추천한다. 1인 1음료가 기본이라 대림창고시그니처 음료인 ""딸기요거트우유""도 한 병 주문 갤러리카페라 곳곳에 조형물이 전시되어 있다. 장소마다 다양한 크기의 테이블이 있으니 인원 수에 따라 공간의 여유를 누려보자. 대림창고, 레트로감성 물씬~ 특별한 커피가 생각날 때, 다시 가자. #성수동카페거리 #대림창고 #성수동카페 #커피전문점 #파나마커피 #게이샤커피 #딸기우유 #갤러리카페 #레트로감성카페"
[성수] 성수동대림창고갤러리 | 공장을 개조한 창고형 베이커리 대형 카페,"📍 서울 성동구 성수이로 78 🕒 매일 11:00-22:00 🚘 노상공영주차장 추천 ☕️ 아메리카노 5.0 ▫️Signature - 게이샤 시그니처(가격변동) ▫️dessert - 베이커리 종류 다양 안녕하세요. 응듀입니다:) 성수동 카페를 찾다가 유명한 창고형 카페가 있다고 해서 방문을 했는데 사람이 너무 많아서 음료를 마시진 못했지만..ㅠ 사진은 찍어와서 공유해드리려고 해요!ㅎㅎ 성수동대림창고갤러리 공장을 개조한 카페라 그런지 외관을 보고 여기가 맞나..? 싶었어요..ㅋㅋ 여기가 입구인데 문이 너무 커서 내가 이 문을 밀고 들어갈 수 있을까.. 여기 입구 진짜 맞나.. 의심가득 문을 열고 들어갔는데 생각보다 문이 가볍더라구요 들어가자마자 입구쪽에는 특이한 큰 조형물이 눈에 들어왔어요 갤러리 카페로 운영되고 있어서 그런지 정해진 일정기간동안 전시가 진행되고 있더라구요 제가 갔을 때는 ‘멀티페르소나 - 엄마 예술가의 시간’이 2023.01.03~02.28까지 전시되고 있었어요 입구 근처 왼쪽에도 앉을 수 있는 공간이 있었고 안으로 좀 더 들어와보니 주문하는 곳과 베이커리류가 중앙에 진열되어 있었어요 진짜 불을 떼우는 건지 모르겠지만 장작이랑 난로가 있었고 공장을 개조한 창고형 카페라 그런지 층고가 엄청 높더라구요 메뉴판도 엄청 크게 있었고 시그니처 음료가 ‘게이샤’였는데 가격이 17,000원.. 도대체 어떤 커피길래..! 그 옆에는 케이크랑 딸기라떼가 냉장보관되고 있었어요 케이크는 딸기생크림, 당근, 티리마수, 바스크 치즈, 갸또쇼콜라 5종류가 있었고 딸기라떼는 병으로 담겨 있어서 테이크아웃으로도 편할 것 같네요:) 겨울 에디션 케이크도 있었는데 3단 딸기 생크림 케이크 베이커리류도 다양했고 보통 대형카페에는 빵종류가 많더라구요ㅎㅎ 1개씩만 남아있는 빵들도 있고 이미 없어져버린 빵도 있었어요 왼쪽에 공간이 하나 더 있어서 들어가보니 사람이 엄청 많더라구요.. 평일에 방문한건데 완전 핫플인정👍 주말이면 더 사람이 많겠죠..? 여기는 2층으로 올라가는 계단이고 계단 폭이 좁아서 한사람씩 올라가야 해요 올라가보니 넓을 줄 알았는데 생각보다 크진 않았어요 조형물도 있었는데 아이를 업고 있는 조형물은 한 색으로도 입체적으로 보이니까 신기하더라구요 여기는 루프탑인데 아직 겨울이라 사람이 한명도 없었어요..ㅎㅎ 방문하고 솔직한 후기로는 공장을 개조한 카페라 색다르긴 했지만 사람도 너무 많아서 조용하게 시간보내고 이야기하기에는 힘들 것 같은 분위기였어요ㅠ 그래도 층고가 높고 카페가 넓으니 답답함은 없었고 서울에는 대형카페가 많이 없기도 하고 이색카페를 찾으신다면 추천해요:) 50m © NAVER Corp. 성수동대림창고갤러리 서울특별시 성동구 성수이로 78"
성수동대림창고갤러리 : 공장을 개조해서 만든 성수 갤러리카페,"20221209 성수동대림창고갤러리 ₩6,000 그야말로 창고같은 외관을 가지고있는 성수카페 대림창고. 별 생각 없이 지나다니던 거리였는데, 나 빼고 다 알고 계신 창고형 갤러리카페였다 ㅋ점심먹고 커피사먹으러 다같이 나왔다가 들어간거였는데 커다란 내부에 신선한 충격을 받았던 곳. 두둥. 성수 대림창고는 공장을 개조해서 만든 창고형 갤러리카페이다. 공장이었던 장소라 그런지 내부가 엄청나게 크고 넓었다. 대림창고 메뉴판. 매장 중앙으로 각종 디저트도 쭉 진열되어있었고, 음료 메뉴도 상당했다. 크리스마스가 다가와서 커다란 트리도 진열되어 있었다. 사진에 보이는것보다 훨씬 크다. 비행기를 표현한거같은 커다란 조형물. 불멍 때리기 좋은 장작불까지❤️👍 이게 모두 1층의 모습이고, 2층에는 다락방도 있다! 실로 어마어마한 규모의 카페였는데, 웅장하고 정적인 느낌이 들던 곳이라 마음이 참 편안했다. 카페라떼(₩6,000) 날은 추웠지만 아이스는 절대 포기 못해..! 따뜻한 라떼도 좋아하지만, 식을수록 우유 냄새가 올라오는게 싫어서 아이스로 주문했다. 개인적으로 플라스틱보단 종이컵이 좋긴 해! 아이스 음료에는 홀더 대신 종이컵을 한 겹 더 씌워주고, 따뜻한 음료는 종이포장재질의 홀더를 끼워준다. 라잌 디스! 라떼는 고소하고 깔끔했다. 에스프레소가 우유랑 섞여서 정확히는 모르겠지만 산미는 거의 안느껴졌다. 요즘 공장단지를 개조한 콘크리트 느낌카페가 유행이라는데, 대림창고는 그렇게 투박한 느낌은 아니었다. 오히려 크고 웅장한 규모에 비해 따뜻하고 고즈넉한 분위기가 느껴졌달까? 아마 콘크리트만 있는게 아니라 곳곳에 우드 색깔이 있어서 그런거같다. 대림창고갤러리랑 비슷한 느낌으로 할아버지공장도 꽤 괜찮다는데 기회가 되면 그 곳도 들러보고싶다! 50m © NAVER Corp. 성수동대림창고갤러리 서울특별시 성동구 성수이로 78"
성수-성수동대림창고갤러리 카페 후기,"대현안녕하세요 :) 志玹쯔쉐엔 져니입니다! 다들 즐거운 주말보내셨나요?? 저는 주말에 핫한 성수에 다녀왔습니다!! 원래는 어딜 가야지 미리 파악하고 다니는 ESTJ 이지만, 가끔은 무작정 걸어다니다가 들어가고 싶을때가 있는데 그게 바로 오늘이였어요! 성수동대림창고갤러리 2호선 3번출구 300M 11:00~22:00 이름 그대로 창고를 카페로 바꾼! 그래서 크고 웅장해요! 들어가자 마자 보이는 조형물, 조형물 옆에는 직접 로스팅을 하고 계시더라구요! Next image 크루아사우오자망드는 왕추천이에요!!ㅠㅠ 꼭! 드세요! 제발~ 게이샤커피 아세요? 커피중에 제일 맛있다던 게이샤커피 판매하고 있어서 먹어보았습니다! 가격은 ..17000원 너무 비싸지만.. 맛은 있더라구요..풍미가 놀라워요! 그치만 저는 아메리카노..ㅎ 저는 2층에 자리를 잡았는데 , 조용한 분위기를 즐기고 싶으시다면 2층이 낫더라구요! 여러 조형물,그림이 전시되고있어서 사진도 찍고 좋았어요! 완전 강추! 벌써 다녀오신분들도 있으시겠죠? ㅎㅎ 무계획으로 돌아다니는거도 좋은거 같아요! Zaijian👋"
성수 카페ㅣ성수 갤러리카페ㅣ성수동대림창고갤러리ㅣ대림창고,#성수동대림창고갤러리 50m © NAVER Corp. 성수동대림창고갤러리 서울특별시 성동구 성수이로 78 N번째 방문한 성수동대림창고갤러리 (정식 이름이 너무 길군) 널찍널찍하고 시원시원한 내부에서 눈에 띄고 싶지 않을때 방문하면 좋은 곳이다 전시회를 따로 안가도 될 정도로 그림이나 작품도 진열되어있는 갤러리카페 약간 이 카페가 개조되는 과정을 재현한 듯 한 공간 커피는 제 값을 한것같지는 않다ㅎ 커피 말고 빵이랑 케잌류도 팜 암튼 탁 트인 공간에서 눈만 즐거웠던 성수대림창고
