title,content
"성수동 주차장 있는 카페, 성수동 이색 디저트 카페 - 이트앤드링크","오늘은! 친구랑 다녀온 성수에서 흔치 않은 주차장 있는 카페에 다녀왔는데요! 원래 가고 싶었던 곳이 아니고 사람들에게 떠밀려서 오게된 곳인데 너무 넓고 디저트도 많고 일본과자나 식품들을 팔아서 이색적이었던 이트앤드링크 포스팅 바로 시작할게요 시~작💚 이트앤드링크 위치 - 서울 성동구 성수일로8길 39-1 시간 - 12 : 00 ~ 22 : 00 휴무 - 연중무휴 주차장O, 가게 앞 주차공간 6자리정도 가능 💚인스타그램 주소💚 이트앤드링크 - radar - eat and drink(@eatanddrinkseoul) • Instagram 사진 및 동영상 팔로워 1,924명, 팔로잉 1명, 게시물 78개 - 이트앤드링크 - radar - eat and drink(@eatanddrinkseoul)님의 Instagram 사진 및 동영상 보기 www.instagram.com 귀여운 곰돌이 판플렛이 반겨주고 있는 이트앤드링크💚 성수에서 주차할 수 있는 카페는 정말 드문데 여기는 사람들도 그렇게 많지 않았고 주차공간도 있어서 너무 좋았고 밖이 너무 더워서 사막에서 오아시스를 찾은 기분이었어요^^ 가게 바로 앞에 주차공간도 있어서 성수동에서 혹시 주차장있는 곳을 찾으신다면 꼭 와보세요 : ) 다만 주말에는 자리가 있을진 모르겠네요⋆ᶿ̵᷄ ˒̼ ᶿ̵᷅⋆ 도보로 방문시 성수1번출구에서 가까워서 1번출구에서 도보로 방문하시는 걸 추천드릴게요! 사진 출처 이트앤드링크 메뉴판입니다 참고해주세요 : ) ღ 커피종류, 에이드, 밀크티, 초코라떼, 티종류를 판매하고 있고 시그니처 음료는 아이스크림라떼, 바닐라빈 라떼, 땅콩 크림라떼고 오트밀크로 변경하고 싶은 분들은 700원만 추가로 내면 오트밀크로 변경이 가능하니 참고해주세요💛 디저트는 버터 카라멜 샌드, 헤이즐넛 크런치, 티라미수, 얼그레이, 당근, 초콜릿 체커보드, 인절미케이크와 치즈 브라우니를 판매하고 리치몬드 라거 맥주도 있고 유기농 레몬에이드와 자두맛 탄산음료는 병으로 판매하고 있는데 처음 보는 병이고 너무 예뻐서 처음엔 와인인줄알았어요!! 주문하는 곳에는 다양한 일본간식류들을 판매하고 있었고 처음 보는 간식도 있어서 너무 신기했어요! 다양한 간식을 파는 곳은 사랑이죠..💛 테이블 위에도 심슨 초코 시리얼과 후르츠박스, 마이쮸같은 젤리도 판매하고 있었어요! 또 간식뿐 아니라 초와 라이터도 판매하고 있어서 여기서 생일을 축하해주셔도 좋을 것 같았어요💛 네이버 영수증 이벤트를 하면 받을 수 있는 신기한 쿠키를 받을 수 있는데 지금은 8월이라 저 쿠키 말고 네이버를 확인해보니 후르츠 박스라는 일본젤리를 주고 있고 당일 선착순 5명에게만 증정하고 소진 시 품목은 랜덤증정해서 드리고 있다고 합니다! ✅네이버 알림받기를 하시면 10% 할인도 받을 수 있으니 꼭 알림받기를 하고 가세요! 체리 히비스커스 티 7,000 체리에이드 7,000 티라미수 8,000 체리 히비스커스티는 아마드티의 로스쉽&체리 티백을 넣어서 음료를 만들어주세요🍒♥️ 체리에이드는 직접 만든 체리청의 상큼함이 느껴지는 에이드여서 청을 잘 섞어서 마셔야 한다고 하셨어요! 모든 음료위에 예쁜 데코까지 올려져있어서 더 예쁘고 마음에 들었어요 여름에 딱 마시기 좋아보이는 색감으로 맛도 좋고 너무 시원해서 계속 마시게 된 것 같아요! 플레이팅도 너무 예쁘니 제 마음에 쏙♥️ 유리컵까지 너무 예뻐서 음료를 담을때 더 예뻤던 것 같아요! 아마드 티백으로 우린거라서 너무 달지 않아서 더 좋았고 시원한 목을 축이기에 딱 좋았어요❗️ 직접 만든 청을 사용해서 만들어서 그런지 더 맛있고 저기 파라솔꼬치는 그냥 플레이팅인 줄 알았는데 마시려고 보니 보이는 빨강, 노랑, 초록젤리들♥️💛💚 너무 탱글 탱글해서 맛있었고 일단 아무것도 없을 줄 알았는데 안에 젤리들이 숨겨져있어서 너무 귀여웠던것같아요!! 탱글 탱글 맛도 있었던 젤리! 티라미수가 컵에 담겨서 나오니 더 색달랐어요! 위에 티라미수 가루들이 듬-뿍 올라가있고 달달하고 너무 부드러워서 커피랑 마시면 딱 좋을 것 같더라구요!! 퐁신 퐁신하고 부드럽고 달콤한 티라미수💛 컵에 담긴 티라미수라 떠먹기도 편해서 오히려 케이크 처럼 생긴 것 보다 더 먹기 좋았어요! 딱 외관만 보면 자리도 많이 없을 것 같은에 내부가 생각보다 넓었고 자리도 많아서 좋았어요! 솔직히 핫플가면 자리 하나도 없잖아요.. 근데 여긴 분위기도 나쁘지 않고 맛도 있고 디저트도 많이 팔아서 오히려 더 좋았어요!! 다음번에도 다시 방문해고 싶었던 만큼 깔끔해서 더 기억에 남았답니다 : ) 또 화장실이 정-말 정-말 너무 깨끗해서 진짜 너무 마음에 들었어요!! 솔직히 아무리 핫플이어도 화장실이 더러우면 조금.. 다음번에 안가게 되더라구요 근데 여긴 정말 백화점 화장실인 것 처럼 깔끔하고 좋은 향기까지 나서 더 좋았답니다!! 또 다양한 물품들도 판매하고 있어서 관심있는 분들은 한 번 구경해보시고 구매하시면 될 것 같아요!! 테이블 위애도 귀여운 소픔들과 판매하는 식료품도 올려두셔서 더 사고 싶어졌던 식품들💛 성수동에서 주차장도 있고 음료도, 디저트도 맛있었던 이트앤드링크💛 이색적인 일본간식도 판매해서 군것질거리 좋아하는 분들에게도 추천드리고 싶은 곳이에요! 깔끔해서 더 기억에 남았던 곳 한 번 방문해보세요 추천드릴게요 : ) 이트앤드링크 서울특별시 성동구 성수일로8길 39-1 이트앤드링크"
서울 성수동 성수역 디저트 카페 이트앤드링크 Eat and Drink,"성수역 인근에서 드문 조용한 디저트 카페 이트앤드링크 Eat and Drink 📍 서울 성동구 성수일로8길 39-1 이트앤드링크 성수역 1번 출구에서 126m ⏰ 매일 12:00~22:00 ☎️ 02-6014-8391 ✔️ 반려동물 동반 가능 저희 사무실이 있는 성수역 2번 출구 근처에서 생각보다 편하게 대화나눌 수 있는 카페를 찾기가 힘들었는데요. 마침내 이트앤드링크를 찾게되어 공유합니다. 건물 입구가 안으로 좀 들어가 있어 지나치기 쉬운데요. 글 맨 아래 첨부한 사진처럼 큰 입간판이 있으니, 잘 확인하고 들어가시면 됩니다. 창밖으로는 초록초록한 나무가 보이고요. 널찍한 규모에 비해 테이블이 그렇게 많지 않아 평일에는 조용한 편이더라고요. 회사 동료들과 갔을 때도 인근 회사원분들이 잠깐씩 들르거나, 혼자서 공부나 작업을 하시는 분들이 띄엄띄엄 있었어요. 메뉴판에는 귀여운 그림이 그려져 있고요. 옆쪽 쇼케이스에는 케이크와 쿠키 등 다양한 디저트가 있어요. 처음 방문했을 때는 음료만 마셔서 몰랐는데, 이날 보니까 종류가 생각보다 많더라고요. 저희는 각자 커피와 초콜릿 체커보드 케이크, 인절미 케이크 이렇게 케이크 두 조각을 함께 시켰어요. (퇴사 기념으로 케이크를 쏜 H님 감사해요!) 계산대 옆쪽과 맞은편에서는 다양한 소품도 판매하고 있었는데요. 개인적으로는 라이터나 알파벳 모양 클립, 성냥 모양 볼펜 등 귀여운 아이템들이 눈에 들어오더라고요. 저희 커피와 케이크가 나왔어요. 초콜릿 체커보드 케이크는 생각보다 크기가 훨씬 크더라고요. 옆에 인절미 케이크가 유독 작아보이지만 보통 크기입니다^^; 커피는 무난하게 맛있었고요. 케이크 둘중 굳이 꼽으라면 제 입맛에는 초콜릿 체커보드 케이크가 더 맛있었어요 모양도 특이하고, 생각보다 달지 않아서 자꾸 손이 가더라고요. 인절미 케이크는 중간에 진짜 떡이 들어가 있어서 식감이 재밌더라고요. 안쪽도 조도가 너무 밝지 않아 아늑한 느낌인데요. 오브제와 액자, 거울 등의 인테리어 포인트 덕분에 심심하게 느껴지지 않았어요. 토분이나 조각과 팝한 LP 커버와도 어울릴 수 있네요. 특히 거울은 셀카를 찍기에 좋은 포토존이 될 거 같아요. 성수역 인근에서 조용하고 편안한 시간을 보낼 카페를 찾는다면 이트앤드링크가 맘에 드실 거예요. 반려동물 동반도 가능하니 참고하세요. 50m © NAVER Corp. 이트앤드링크 서울특별시 성동구 성수일로8길 39-1 이트앤드링크 ▼ 가치소비가 가능한 성수동 그로서리 숍 ▼ 서울 성수동 성수역 그로서리 스토어 슈퍼파인 Superfine 지속가능한 식문화를 경험할 수 있는 그로서리 스토어 슈퍼파인 Superfine 오늘은 취재로 먼저 다녀와 너... blog.naver.com"
"성수동 카페, 이트앤드링크 eat and drink","📋성수동 카페 <이트앤드링크 eat and drink> ✔ 위치 도로명 : 서울 성동구 성수일로8길 39-1 이트앤드링크 지번 : 성수동2가 289-224 ✔ 영업시간 월~일 12:00 ~ 22:00 연중무휴 ✔ 연락처 / 인스타그램 02-6014-8391 / @eatanddrinkseoul ✔ 주차 가능 ⭕️ 가게 바로 앞 주차 공간이 있습니다 이트앤드링크 - radar - eat and drink(@eatanddrinkseoul) • Instagram 사진 및 동영상 팔로워 2,107명, 팔로잉 1명, 게시물 78개 - 이트앤드링크 - radar - eat and drink(@eatanddrinkseoul)님의 Instagram 사진 및 동영상 보기 www.instagram.com 50m © NAVER Corp. 이트앤드링크 서울특별시 성동구 성수일로8길 39-1 이트앤드링크 이트앤드링크는 성수 애견동반 가능한 카페입니다 맑은 날에는 이트앤드링크 통유리를 활짝 열어두고 있어요 낮에는 밝고 화사한 느낌 밤에는 차분한 분위기를 느낄 수 있어요 주문을 하는 쪽과 받아가는 쪽이 구분되어 있어요 주문을 받아가는 쪽에는 아기자기한 디자인과 함께 휴지와 물을 마실 수 있도록 준비되어 있었고 다 먹은 식기류를 반납할 수 있도록 되어 있었어요 주문하는 곳 옆에는 다양한 일본 간식류를 판매하고 있어요 메뉴판 이트앤드링크 메뉴 및 가격 소개 icecream short latte 아이스크림 숏라떼 6,000 butter and cookie(salted caramel) 버터 샌드 쿠키 1,700 아이스크림 숏라떼 부드러운 바닐라 아이스크림과 진한 에스프레소의 풍미가 어우러지는 아포가토 style 커피 버터 샌드 쿠키 진한 버터와 단짠단짠 솔티카라멜의 조화로운 촉촉하고 담백한 쿠키 영수증 이벤트 네이버 영수증 리뷰 인증 고객에게 일 10명 한정으로 짱구 판박이 젤리를 받을 수 있어요 초콜릿, 레드벨벳 처커보드 케이크 8,000 이트앤드링크의 시그니처 패턴인 체커보드가 케이크 무늬로도 만들어져 있어요 쇼케이스에는 케이크, 쿠키, 병음료, 젤리 외에도 다양한 디저트가 있어요 계산대 맞은편에는 다양한 소품도 판매하고 있어요 이것저것 보는 재미는 덤이죠 테이블 위에는 귀여운 소품과 판매하는 식료품들도 함께 올려두셔서 한번씩 눈길이 가요 층고가 높고 노출 콘크리트 바닥으로 이루어져 있어 2000년대 감성을 느낄 수 있어요 넓찍한 매장과 깔끔한 테이블로 구성되어 있으며 테이블 간격들도 넓고 식물과 나무의자가 함께 있어서 따뜻하면서도 여유로운 분위기를 볼 수 있어요 하지만 의자가 모두 딱딱해서 오래 앉아있기에는 조금의 불편함이 있어요 리치몬드라거 5.0% 출시 맥주 구매시 유기농 콘스낵을 증정해주셔요 레트로 느낌의 인상적인 언필터드라거로 버지니아 지역의 최고급 몰트와 홉으로 양조하고 필터링을 거치지 않아 고소한 풍미가 특징이에요 george nelson - eye clock 벤치 의자의 감성과 함께 옆에는 시계와 감성사진들이 같이 걸려있어요 이트앤드링크 : 네이버 방문자리뷰 216 · 블로그리뷰 39 m.place.naver.com 옛날 감성의 귀여운 소품들을 구경하면서 색다른 디저트와 맛있는 커피를 맛보고 싶으신 분들 특히 애견 동반 카페를 찾고계시는 분들에게 추천드려요"
성수동 대형 디저트 카페 이트앤드링크,"안녕하세요 문화생활하는 뚱이입니다 성수3탄 디저트 카페를 소개하려고 합니다 성수동은 맛집도 많고 이쁜카페도 많고 사람도 많고 배는 고프고 당도 땡기고 근데 갈곳은 없고!!!!! 서울에서 한번 커피마시기가 이리 힘든지 이더위에 객사할뻔했어요 50m © NAVER Corp. 이트앤드링크 서울특별시 성동구 성수일로8길 39-1 이트앤드링크 📍주소 : 서울특별시 성동구 성수일로 8길 39-1 1층 🕰운영시간 : 매일 12시 ~ 22시 ☎️ 전화 : 02-6014-8391 🅿️ 주차 : 카페앞 주차 가능 (6대 정도 가능) 🐶 애견동반: 가능 원래 가려고 했던 카페에 자리가 없어서 퇴짜를 맞고 방황하던 저희에게 구세주 카페 발견 바로바로~~~~ 이트앤드링크 커피입니다 성수미술관이 바로 옆에 위치해 있는데 개인 전시를 하는 곳인데 주소가 잘 안 나와있어서 이트앤드링크커피숍 주소를 찍고 오신다는 분들도 계시더라고요(참고해주세요) 카페안에 있는 소품들이 다 제 취행을 저격을 해버렸습니다 친구는 계속 뭐먹을거냐거 묻지만 저는 소품들에 정신이 팔려서는 ㅋㅋㅋㅋㅋ 여기는 화장실인데요 ㅋㅋㅋㅋ 빨간 점이 있는곳이 여자 화장실 파란 점은 남자 화장실입니다 화장실 칸이 한칸 밖에 없지만 그래도 깨끗해서 좋았어요 초코 체커보드케이크 & 복숭아에이드를 주문하였습니다. 너무 목마른 나머지 에이드를 휘젓지 않고 호로록 하는 바람에 초반에 액기스를 반이상을 다먹어서 탄산수만 먹은 기분이랄까 ㅠㅠ 꼭 휘저어서 드세요~~~~ 저기에 들어있는 알록이달록이는 과일이 아니라 과일젤리입니다 맛있어요~~~~ 1. 대형디저트 카페이지만 사람이 많지 않아 조용하고 이쁜카페 입니다 2. 이쁜 굿즈들과 주전부리들도 많이 팔아요 3. 영수증 리뷰 이벤트도 하고 있대요 (영수증을 어따 갔다 버렸는지 ㅜㅜ) 4. 케이크, 쿠키 디자인이 이쁜데 맛도 굿굿"
넓고 휴식하기 좋은 성수동 강아지동반 카페 : 이트앤드링크,입구부터 귀여운 강아지 그림이 반겨 주는 성수동 카페에 다녀왔어요 카페이름은 🐶이트앤드링크🐶 입니다 🏁EAT DRINK🏁 너무 귀엽죠? 길 바로 옆은 아니고 약간 안쪽에 있어서 눈에 바로 띄는 곳은 아니에요 그래서 더 프라이빗하고 휴식할 맛이 나는 것 같아요🐶 강아지 간판을 보고 들어오시면 됩니다 전체적인 인테리어는 깔끔하고 예쁩니다 초록초록 마음이 편안해 지지 않나요? 공간이 생각보다 넓고 테이블 간격도 넓어서 더 좋았어요 평소에도 그렇긴 하지만 강아지를 데리고 가면 테이블 간격이 넓은 곳이 훨씬 좋더라고요 이트앤드링크 메뉴입니다 메뉴판에도 강아지 그림 있어요 너무 귀여워요 케이크 종류도 꽤 다양 합니다 당근케이크 티라미슈 치즈 브라우니 등등 타르트도 있어요 케이크 상자도 너무 깔끔하고 예뻐요 초록초록🌱 귀여운 초와 라이터도 판매하고 있답니다 케이크만 따로 포장 주문해도 좋을 것 같아요 강아지 동반이 되는 아주 좋은 카페❤ 성수동에 반려견 동반이 가능한 카페들이 많아져서 좋아요 아메리카노 아이스 초코 피치 우롱 당근케이크를 시켰어요 아이스 초코의 스마일 그려진 거 너무 내 취향🙂 귀여운 스티커가 붙여져 있어서 찍어 봤어요 당근케이크에 진짜 당근이 길게 붙어 있는 거 처음 봐요 먹어 보니까 달콤 하더라고요 당근케이크 달콤하고 맛있습니다 !추천! 화장실에 가려는데 멀리서 보고 문이여러개라 당황 했으나 거울이였어요ㅋㅋㅋ 사진찍기 좋습니다📸 화장실이 아주 깔끔해요 화장실의 깔끔함은 얼마나 기분이 좋던지 깔끔한 화장실 = 좋은 카페 공식이 성립 됩니다 성수역 근처라서 접근성이 좋아요 반려동물과 함께 방문해 보세요 위치는 요기 50m © NAVER Corp. 이트앤드링크 서울특별시 성동구 성수일로8길 39-1 이트앤드링크
"조용한 분위기의 성수동 대형 카페 ""이트앤드링크""","#성수동카페 #성수역카페 #성수카페 #이트앤드링크 이트앤드링크 서울 성동구 성수일로 8길 39-1 이트앤드링크 ☎ 02-6014-8391 매일 12시 ~ 22시 (라스트 오더 : 21시 30분) 단체석, 포장, 반려동물 동반 50m © NAVER Corp. 이트앤드링크 서울특별시 성동구 성수일로8길 39-1 이트앤드링크 성수동 신상 카페를 다녀왔어요😁 이트앤드링크는 성수역에서도 가까운 거리에 위치해있어요 귀여운 입간판 입간판 외에 간판이란 게 없어요 그래서 앞에 있는 차량 때문에 카페인지 모르고 지나칠 수 있겠더라구요😱 밖에서 보기만 해도 내부가 널찍해 보이고 카페에 들어서면 향냄새가 나요 저희밖에 없길래 빠르게 사진 찍었어요 굿! 층고도 높고 좌석도 많은 편 공간도 널찍하죠👍 좌석이 독특하게 벤치 의자로 되어있어요 단체 인원이 이용하기도 너무 좋을 거 같아요ㅎㅎ 곳곳에 포인트로 놓여 있는 독특한 장식품들 갈색과 청록색? 이 조화롭더라구요 화장실은 남/여 분리되어 있고 깔끔! 주문대에도 독특한 장식품이 있어요 이날 제가 신은 신발과 비슷ㅋㅋㅋㅋ 메뉴판마저 귀여워요 커피, tea, ade 종류로 구성되어 있고 커피는 라떼 메뉴가 많은 편 디저트는 조명이 엄청 밝은 쇼케이스 안에 있어요 디저트가 적은 편은 아닌데 쇼케이스가 커서 그런지 휑해 보이는 느낌이 들더라구요🤔 그리고 초코 무스케이크와 오렌지 얼그레이 케이크 이름표가 뒤바뀌어 있는 거 같더라구요? 치즈케이크 7,000원 티라미수 7,500원 스트로베리 갸또 쇼콜라 8,000원 초코 무스 케이크 6,500원 오렌지 얼그레이 케이크 7,500원 쑥 휘낭시에 3,300원 흑임자 휘낭시에 3,300원 피칸 휘낭시에 3,300원 솔티드 초코 휘낭시에 3,300원 플레인 휘낭시에 3,000원 바닐라라떼 7,000원 체리 히비스커스 7,500원 스트로베리 갸또 쇼콜라 8,000원 쑥 휘낭시에 서비스 진동벨은 따로 안주셨고 준비되었다고 불러주시더라구요?! 저희 밖에 없어서 상관없었지만 나중에 손님 많을 때는 불편하실 것 같은데라는 생각이 들었어요 그리고 쑥 휘낭시에를 서비스로 주셨어요 대박대박ㅎㅎ 오랜만에 플래시 키고 한번 찍어봤어요 안 켜고 찍는 게 더 나은 거 같군요😂 휘낭시에 위에 이끼 낀 것 마냥 나왔네요ㅎㅎ.... 카페 이름이 찍혀 있는 잔 예뻐요ㅎㅎ 바닐라라떼는 적당히 달달하니 무던한 맛이었어요ㅎㅎ 남자친구가 체리 히비스커스를 골랐길래 히비스커스 별로지 않아!? 나는 맛없던데 이랬거든요 그래도 먹어본다길래 시켜버렸습니다 오우 그런데 체리가 들어가서인지 평소 먹어본 히비스커스랑은 다르더라구요🫢 체리 덕분에 달달함이 느껴지고 체리도 가득하게 들어가있어요 그리고 색도 예뻤던ㅎㅎ 큼직한 딸기 5개가 올려진 갸또 케이크 개인적으로는 조금 아쉬웠던 갸또 케이크였어요 꾸덕한 식감과 진한 맛을 생각하고 시킨 케이크인데 갸또 부분이 꾸덕하지가 않더라구요 딸기도 달달하니 크림하고도 잘 어울리고 맛있었는데 갸또의 꾸덕함이 조금 아쉽더라구요ㅠㅠ 사장님이 서비스로 주신 쑥 휘낭시에 제가 너무 잘게 쪼개버렸나 봐요ㅋㅋㅋ 반만 잘라서 한 번에 먹는 것을 추천드립니다..😱 신기하게 안에 떡이 들어있어서 쫀득해요 겉에 붙어 있는 게 튀밥?이라고 해야 하나요 되게 바삭한데 쑥이랑 같이 먹으니깐 더욱 고소하니 맛나더라구요 신상 카페라 그런지 깔끔하고 단체 인원도 이용하기 좋은 공간이에요 성수역하고도 가까운 편ㅎㅎ 간판이 따로 있지는 않아서 네이버 지도 키고 찾아가시는 걸 추천드려요👍"
