title,content
성수 대형카페 성수동대림창고갤러리&아더 성수 스페이스 힙성지 성수나들이♬,"안녕하세요. 슬기로운 제주생활 HJ입니다. 어제는 유럽동화갬성 제주카페소개..... 오늘은 성수 대형카페로 이어지는 카페투어 일명 카투....... mz갬성으로 성수나들이했던 기억을 쥐어짜내 최선을 다해 풀어내보는 오늘... 중요한건 꺽이지않는 마음...중꺽마... 20m © NAVER Corp. 성수동대림창고갤러리 서울특별시 성동구 성수이로 78 아더 성수 스페이스 서울특별시 성동구 성수이로 82 성수동대림창고갤러리 서울 성동구 성수이로 78 0507-1390-9669 am11-pm10 공장을 개조해 만든 창고형 갤러리 카페 성수동대림창고갤러리. 낡은 공장들이 밀집되어있던 동네가 힙한 공간으로 탈바꿈하는 그 시작점부터있던 성수터줏대감. 한평생 서울에서 나고자랐지만..낯선동네 성수동. 새로운곳에 대한 탐닉보단 익숙함을 선호하는 타입이라 매번 가는곳중심인 추억팔이러는 근처 스벅으로 가서 잠시 쉬어가는 일정이 대부분이에요. 왜인지..이날 성수동에 첫걸음떼는 순간 이상하게 마음이 몽글몽글하더니,성수감자탕먹고 나온이후엔 텐션과 도파민이 급상승🤪 그래서 무작정 성수 구석구석 걷다가 입장하게된 카페입니다만...... 사실 넘나 유명한 카페라 전 입구문보자마자 여기다!했는데...옆에있던 술메님..낯선 공장문 입구보며 여긴어디?나는누구?남편둥절🙄 팔로팔로미~드루와하며 입장하면 이렇게 멋진 조형물로 무언의 의심눈초리 바로 꺽이게하고요. 육중한 문을 열고 들어가면 넓은 실내와 높은 층고로 낯선 이방인에겐 덜 쭈삣하게 만들어줘서 좋았고요! 힙성지 성수동에서 가격도 이만하면 나쁘지않았어요. 게이샤 어쩌구가 먹고싶었지만 내 도파민을 눌러본다.. (은근 커피에 진심이었던 성수동대림창고갤러리와 상반된 내 미각..그거이그거다..ㅋㅋ) 베이커리에도 진심인듯 눈길끄는 디저트들이 많았어요. 역시나 대부분 테이블이 거의 식사너낌으로 빵을 드시는중.... ( 전 감자탕에 밥한그릇 다먹고가서 패스 #프로다이어터 ) ""성수동대림창고갤러리"" 그이름에서도 느껴지듯 전시도 자주열고 각종 오브제들이 가득해서 커피나오는동안 구경하느라 시간가는줄 모를정도였어요. 1층과2층까지 이어지는 대형카페의 넓직넓직 부대낌없는 공간은 너무 좋았는데, 노트북들고 가긴 비추... 콘센트가 너무 없어서...배터리충전하고픈 여행러에겐 조금 곤란데쓰였다고한다. 그럼에도 불구하고 구석구석 빈티지속의 자연친화느낌으로 편안했던 성수동대림창고갤러리. mz갬성 억지로 끌어모았지만 쉽지않은 인스타스토리 사진... (리얼 mz자식이 둘이요..하며 내 텐션눌러주는 미움덩어리😛흥.칫.뽕) 이렇게 좁고 가파른 계단을 오르면 3층 루프탑도 있어요. 하지만 무릎도가니와 더위에 강한자들이 없던게 함정+_+ 아더 성수 스페이스 서울 성동구 성수이로 82 02-468-2223 pm1-pm9 ""일상에서 쉽게 놓치고 있는것들을 익숙하지만 낯설고,새롭게 느낄수있도록 표현한다-But near missed things.""- 아더레어의 메인슬로건 계획은 물론 정보도 없었던 아더 성수 스페이스. 대림창고에서도 눌러지지않은 텐션으로 좀더 성수를 느끼고싶은찰나...바로옆 건물 웨이팅줄을 발견하고 저도모르게 줄서서 입장했던곳이에요?ㅋㅋ 처음엔 여기뭐지? 1도 정보없이 술메님 잠시 흡연타임하는동안 나 옷구경하고올께~하고 들어갔는데, 응? 대략 이런 연출된 공간이 저를 기다리고있었.... 우주공간이라는 테마로 연출된 공간이 생각이상 너무 좋아서 얻어걸렸다기엔 너무 훌륭했던~ 성수동 핫플레이스 인정!! 그야말로 완벽한 복합문화전시 공간 그이상이었던 아더 성수 스페이스. 그나저나 여기 지금보니 완전 공간전체가 포토스팟이었는데.....젊은이들사이에서 기빨려 구석에 있던 파워I 술메님 부를껄...이거 보고 가시는분들아..제몫까지 이쁜사진 많이 찍어주세효..털썩... 아더에러 쇼룸공간과 함께. 전 앞에 5명정도 있어서 바로 들어갔는데,나중에 보니 주말에는 엄청난 웨이팅이 있는 곳이었어요. 물론 전시공간안 쇼룸이라 식당이나 카페만큼 대기시간이 길지않지만, 입구에서 직원분이 인원컨트롤중이라 저처럼 평일 한가한 시간대에 다녀오시길 추천드립니다! 유명한 디올성수앞부터 시작해... 오래된 건물의 그 감성을 현재 빈티지느낌으로 재탄생시킨 성수동 골목 거리곳곳이 모두 저에겐 문화충격이었어요. 와..나 그새..제주 시골쥐 다됐네...하면서 다녔..ㅋㅋ 아직은 한적한 제주의 조용함이 좋지만, 가끔씩 서울나들이에서 콧바람은 삶의 활력을 주네요? 이웃님들은 저와 반대로 복잡한 서울생활에서 잠시 제주로 힐링여행오세요~~ 뜬금 광고time: 제주 한달살기 바다품은 제주집 함덕 독채타운하우스가 기다립니다~^^"
성수동대림창고갤러리 - 요즘감성 핫한 공장개조 성수대형카페 / 창고형 갤러리카페,"주문한 메뉴 :: 대림창고 딸기우유 아이스 아메리카노 시나몬 프레즐 대림창고갤러리 성수역 카페를 찾던 중 딱 보였던 딸기우유에 꽂혀서 다녀온 곳이에요. 영업시간은 오전 11시부터 오후 10시까지라서 시간도 여유롭네요. 커피도 알콜도 있어서 간단하게 한잔 하고 싶을 때 와도 좋은 곳이였어요. 사람이 많아서 자리찾는게 힘들지만 갤러리카페인만큼 분위기도 좋고 회전률도 좋은게 장점이였습니다. 아! 딸기우유 맛있어요! 꼭 드셔보세요! 성수동 대형카페 대림창고갤러리의 문이에요 거대하지요? 처음에는 문을 못찾고... 큰 문은 장식이라 생각하여 옆에 유리를 열고 들어가려고 했다가 뒷분이 알려주셔서 잘 들어갔어요^^... 성수동카페 성수역카페 검색하다가 찾은곳인데 대형카페보다는 딸기우유 사진을 보고 여기다! 했던 곳이였네요 ㅎㅎ 생각보다 너무 넓어서 신기했어요 공장으로 사용되던 곳을 개조했다는데 그만큼 공간이 커요! 1층에는 이렇게 큰 공간이 2곳으로 나누어져있고 화장실도 이곳에 있어요 1층에 카운터와 빵진열대가 있는 공간이에요 여기도 좌석이 매우... 많답니다 사람도 그만큼 많긴한데 웨이팅은 없었어요 메뉴판이에요 맥주도있고 커피, 딸기우유 다양하게 있는데 성수동대형카페 대림창고는 빵을 팔고 있는것도 좋았어요! 처음 갔을 때는 빵이 많았는데 나가면서 찍으려고 보니 빵이 다 사라져있는거있죠...ㅠㅠ 원래 2줄로 가득가득 있어요... 케이크도 있었는데 꾸덕해서 맛있어보였어요! 너무나 슬프게도... 딸기우유가 많이 있었는데... 나갈 때 포장해가려고 보니 솔드아웃이였고 딸기우유 사진을 못찍었어요ㅠㅠㅠㅠㅠ 진짜 맛있었는데!!! 입구쪽에 있는 장식이에요 여기저기 무심하면서도 힙한 장식들이 있었답니다 ㅎㅎ 옆에 장작도 보이네요! 제가 픽한 시나몬프레즐 프레즐도 종류별로 있었는데 음... 맛은 쏘쏘...?ㅎㅎ 열심히 커팅중 ㅋㅋㅋ 포크 두개로 자르려다가 도저히 안되서 나이프 가져왔어요 완성완성 딸기우유와 커피도 보이네요 이야기하면서 하나씩 집어먹기 좋았어요 딸기우유는 아래에 가라앉아 있어서 섞어서 먹어야해요 커피도 맛있었습니다 ~ 벽에 뜬금없이 있는 대형거미 이야기하다가 발견해서 읭? 했어요;;; 확대해놔서 징그러운데 그냥보면 잘 보이지도 않아요...ㅋㅋ 갤러리카페 답게 장식들이 많았어요 작품을 감상하러 오시는 분들도 계셨고 뭔진 모르겠지만 촬영하러 오신 분들도 계셨네요 시원한 곳에서 초록초록 푸르른 식물들을 바라보니 그저 힐링이였네요 ㅎㅎ 햇빛은 잘 들어오지만 (식물때문에 창문으로 해두신것같아요) 내부는 매우 시원합니다 ㅎㅎ 곳곳에 쌓여있는 장작들 용도는 모르겠지만 ㅎㅎ 불멍하고 싶네요 카운터에 있는 알콜들이에요 맥주도 있어서 시원하게 한잔 하는것도 추천드립니다~ 오늘도 내돈내산 잘 마셨습니다~ 50m © NAVER Corp. 성수동대림창고갤러리 서울특별시 성동구 성수이로 78 위치 : 서울특별시 성동구 성수이로 78 주차는 유료로만 가능해요"
"성수핫플 자연도소금빵, BD버거, 성수동대림창고갤러리","성수동 플리마켓을 빠르게 돌고나서 그냥가기 아쉬워서 주변을 구경했다! 50m © NAVER Corp. 자연도소금빵in 성수 서울특별시 성동구 연무장길 56-1 1층 오전에 사람들이 줄을 서고있길래 궁금해서 우리도 줄서봤다. 약간 컨셉확실한 빵집이었음 센과치에로 느낌? 종업원도 인테리어와 깔맞춤한 유니폼을 입고있었다. 메뉴는 딱 한메뉴만 있었고 소금빵 4개에 12,000원에 팔고있었다. 퍽이나 비쌌는데 사람들이 줄스는 이유가 궁금해서 한번 먹어보기로..! 세상에서 제일 맛있다는데 과연?? 안에서 금방 빵이 구워져서 나오는 모양이었다. 키오스크에서 미리 주문하고 줄서고 있으니 한 10분정도 후에 금방 받을 수 있었다. 바깥에 있는 종업원은 포장만 하는 분인 것 같았다. 그래서 먹어봤는데.. 맛을 처음보고 음?! 너무 평범해서 놀람ㅋㅋㅋㅋㅋㅋㅋㅋㅋㅋ 아니..그냥 평범한 소금빵이잖아? 엄청 느끼한걸 보니 딱히 비싼버터를 쓰는 것도 아니고.. 풍미가 있지도 않고.. 밀가루 자체도 평범하고.. 그냥 갓 나왔다는 컨셉 하나로 사람들이 줄서서 먹는다니.....ㅋㅋㅋ 특색이라면 꽈배기처럼 쫄깃한 느낌의 소금빵이란 것? 하지만 진짜 그냥 왠만하게 알려진 소금빵 파는 빵집에서 식어서 파는 것보다 못한 맛이었음 컨셉만으로도 이렇게 인기가 있을수도 있구나 소비자에게 엄청 맛있다는 것을 시각적으로 강조하면서 저딴거 하나에 3천원에 팔아도 맛보지 않으면 살 수 밖에 없게끔 하는 ... 마케팅의 신비란 50m © NAVER Corp. bd버거 성수 서울특별시 성동구 성수이로14길 7 2층 bd버거 성수 예약 새우버거를 파는 이곳에 점심에 방문했다. 이곳도 웨이팅이 있는 곳인데 오픈하자마자 얼마안되서 가서 그런지 웨이팅없이 입장가능했다. 간편하게 테이블마다 키오스크가 있어서 기다릴 필요없이 결제까지 바로 진행했다. 한 15분 정도 기다리니 벨이 울려서 햄버거를 가지러 갔음 대표버거 두가지와 가지튀김을 시켰다. 가격 참 후덜덜하다.. 비주얼은 진짜 좋은데 크기 자체는 여자 주먹만함! 와사비 쉬림프가 더 내 입맛엔 맛있고 단백했다. 그릴 쉬림프 아보카도는 일단 새우가 너무 탱글해서 한입 베어물기가 힘들었고 새우가 딱 4개만 들어가 있고 그 외엔 패티가 없어서 좀 많이 비어있는 맛이었음 가지튀김은 금방튀긴 것 처럼 바삭했는데 기름을 좀 오래썼는지 넘 느끼했음 찍어먹는 마요소스? 는 약간 매콤하게 해서 느끼함을 그나마 잡아줘서 밸런스 있었다. 웨이팅없이 먹었기에 딱히 불만족한 것 없이 잘 먹었지만 양대비 가격이 너무 넘사라서 재방문하지는 않을 듯 하다. 50m © NAVER Corp. 성수동대림창고갤러리 서울특별시 성동구 성수이로 78 창고를 개조한 성수동대림창고 갤러리!! 앞에선 수급해온 빵을 팔고 있었음! 여기는 오로지 커피만 제조하는 듯 공장을 어떻게 이런 느낌으로 개조를 시킨건지 왜 갤러리라 붙였는지 들어오고서야 알았다. 자연그대로 방치한 것 같으면서도 인테리어를 어우러지게 잘 한 듯한 분위기있는 대형카페 였음! 천장엔 움직이는? 조각상이있었는데 아마 여기가 옷공장이었나 싶었음 드문드문 조각품도 있긴했는데 너무 기괴하긴 했다. 천장을 보면 이쁘긴하다. 여기서 제일 비싸보이는 커피를 시켜봄; 그거슨.. 게이샤 시그니처 무려 가격이 변동임 내가 시켰을땐 거진 2만원이었음;;;; 게이샤가 비싼 원두라는 건 알고 있어서 시켜본 건데 확실히 왠만한 원두에서 맛보지 못한 꽃향이 나는 아메리카노맛이었다. 위에 아인슈패너처럼 휘핑크림이 있어서 맛있게 먹긴 했는데 2만원가치 까지는 아니었다. 여태 내가 시켜먹어본 커피 중에 제일 비싼 커피!!!! 언제 이런거 먹어보냐 싶어서 시켜본 거였지만 역시 가격에 만족할 맛까진 아닌 ㅎㅎㅎㅎ 그럼 왜 시켰냐 했겠지만.. 궁금한 걸 어떡해 커피는 엄청 비쌌지만 테이블 자리는 엄청 딱딱하여 오래 있지는 못했다. 그렇게 성수동 나들이 끝! 이젠 데이트비용에 하루 10만원은 우숩다 ㅎ.ㅎ.. 일을 본격적으로 시작해서 그런지 돈에 겁이 없어진듯.. 정신차렷.. #성수나들이 #성수핫플 #성수맛집 #성수소금빵 #성수수제버거 #수제버거성수점 #대림창고갤러리 #성수대형카페"
"[서울 성수동] 성수동대림창고갤러리, 성수동카페거리의 오래된 공장 속에 들어선 커다란 카페에서 느끼는 과거와 현재 (feat, 게이샤 코스)","성수동의 오래된 공장 속 카페에서, 게이샤 코스를 마시고 왔습니다. #서울 #성수동 #카페 #성수동카페거리 #성수카페 #대림창고 #성수동대림창고갤러리 #게이샤코스 #220821 일요일 오후, 동생네와 조우하러 서울 성수동으로 향합니다. 성수동에 대한 첫 인상은, 주택가와 경공업 특히 자동차 수리쪽이 오밀조밀하게 합쳐져 몰려있는 꽤나 오래된 분위기의 동네네요. 제이원은 다 떨어져가는 누추한 움막에서라도 커피만 맛있으면 괜찮은 카페라고 생각합니다. 반대로, 으리번쩍하지만 커피가 맛없으면 두번 들릴 일은 없죠. 성수동대림창고갤러리. 나름 유명한듯 한데, 어떤 카페인지 궁금해지네요. 성수동대림창고갤러리 서울 성동구 성수이로 78 2성수역 3번 출구에서305m 성수역 3번출구로 나와서 우측방향으로 300m 매일 11:00 - 22:00 - 코로나시국 한시적 22시까지 영업(주문마감 21:30) 0507-1390-9669 https://www.instagram.com/daelimchanggo_gallery *주차안내 1.유료 표기된 주차라인의 노상주차장 (점포,지정 표기된 주차라인은 주차불가) 2.한라시그마밸리 유료 지하주차장 이용 50m © NAVER Corp. 성수동대림창고갤러리 서울특별시 성동구 성수이로 78 성수동 카페거리. 특유의 오래된 분위기가 자연스럽게 다음 세대의 이목을 끄는 곳입니다. 2호선 성수역에서 가까워서 많은 사람들이 오고가고 있네요. 벽돌로 만들어진 건물 앞쪽 모습이 독특합니다. 커다란 나무문이 정문이라는걸 알기 전까지는 입구가 어딘지 헤메게 되네요. 입구에 들어서자마자 보이는, 어디에 쓰였을지 모르는 기계장비. 벽돌로 된 인테리어 사이사이로, 갤러리라는 정체성을 잃지 않기 위한 그림작품들이 슬쩍 널려있습니다. 안쪽은 대부분의 공간을 카페 좌석이 차지중. 듬성듬성, 카페 좌석 앞뒤로 조형물과 작품들이 포진해있습니다. 개인적으론 갤러리라는 이름에 걸맞는 분위기까지는 아니라고 느꼈고, 오히려 벽돌과 오래된 기계들이 내는 특유의 분위기가 마음에 들었습니다. 메뉴 성수동대림창고갤러리 성수동이라는 동네의 특징을 생각해보면, 카페거리라는 유명세와 대규모 공장 속에 들어와있는 분위기에 기대어 커피 가격은 좀 높은 편. 여기 주민도 아닌데다 성수동은 생애 처음 와보지만, 여기 이 동네가 커피값을 올려받은지는 몇 년 안되었을것같네요. 그정도로 주변은 워낙 오래된 동네입니다. 게이샤 원두를 취급하는데 에스프레소 메뉴가 있다니, 맛이 궁금하네요. 게이샤 코스 3가지 메뉴중, 게이샤 에스프레소와 게이샤 코르타도로 주문했습니다. 자리에 돌아와서 주문벨을 넘겨놓고, 다시 한번 카페 탐방. 아까 들어온 입구쪽에 2층으로 올라가는 계단이 있었습니다. 2층에 작은 공간이 또 하나 있네요. 역시 시작과 끝지점에 조형물을 세워둔 점에서 갤러리를 표방한다는 이미지를 풍기지만.. 아무리 봐도 갤러리보다는 카페라는 단어가 더 끌립니다. 3층 올라가는 계단. 더운 날씨에 인기는 없는, 꽤 넓은 공간의 루프탑이 있습니다. 다시 내려와 일행들과 떠들다보니 울리는 진동벨. 게이샤 코스를 받아들고 옵니다. 게이샤 코스 1만5천. 게이샤 원두로 내린 에스프레소 음료들이군요. 게이샤 원두를 핸드드립이 아니라 머신으로 추출하는덴 처음 봅니다. 일단 설탕 넣지 않고 한모금 홀짝. 커피콩의 숙성이 좀 과한건가 싶은, 게이샤 특유의 향이 진합니다. 일행 말로는 신김치와 응아를 섞은 향이라고 하네요. 저는 청국장이 떠오릅니다. 에스프레소는 설탕을 넣어 한번에 왈칵 마셔주는게, 쓴맛은 줄이고 향은 더 세게 느낄 수 있습니다. 몇 번 더 음미하다보면 쿰쿰함은 가시고 새고롬한 게이샤 특유의 두터운 계열의 바디감이 느껴지네요. 대중성은 많이 떨어지는 편입니다. 누군가는 아마 왜 이걸 돈주고 먹냐고 할 듯한, 강렬하게 숙성된 향과 맛. 게이샤 코르타도쪽은 어떨까요. 아무래도 우유를 섞은 덕분에 강한 향과 맛은 좀 희석된 기분이 듭니다. 뒤쪽에 고소한듯 새콤하게 남는 게이샤의 여운에서 다시금 떠오르는 발효된 향. 역시 마실수록 조금씩 진정(?)되어갑니다. 게이샤 특유의 향을 올린것까진 좋은데, 불쾌감이 들 정도로 올려낼 필요는 없지 않았나 싶네요. 핸드드립이 적당한 굵기로 원두의 향을 적당히 끌어내는 반면, 에스프레소 머신의 경우엔 미세할 정도로 가늘게 갈아내어 고온고압으로 추출하기 때문에 맛이 과도하게 올라온게 아닐까... 하는 합리적 의심을 해봅니다. 반면 동생네가 마시고 있던 아이스 아메리카노와 아인슈패너는 원두에 향이 너무 없는데다가, 커피에서 물을 너무 많이 타면 느껴지는 밍밍함이 강하게 느껴지는 쪽. 게이샤쪽은 너무 진했는데, 일반 음료는 좀 더 진했으면 하는 바람이 있습니다. 성수동대림창고갤러리. 갤러리인지 카페인지 알 수 없는 묘한 경계선에서, 음료마저 모 아니면 도 같은 카페군요. 분위기가 좋다 나쁘다는 개인적인 취향이 될 것 같습니다. 더운 여름에 시원하게, 돈을 주고 공간을 대여한다는 개념으로 접근하거나 좋은 사람들과 담소를 나누기엔 나쁘지 않은 공간입니다. 잘 다녀왔습니다. 제이원 & 제이은의 서울 나들이 이야기. https://blog.naver.com/winterainy/222600430217 211216 신세계백화점 본점 크리스마스 시즌 매지컬 홀리데이 Magical Holidays. & 롯데백화점 본점 Little Cloud Big Wishes. Magical moments for you. #신세계백화점 #본점 #크리스마스시즌 #MagicalHolidays #롯데백화점 #매지컬... blog.naver.com https://blog.naver.com/winterainy/222579819409 211126 청계천 서울빛초롱축제의 낮과 밤 / 서울 빛축제, 12월 5일까지. 2년만에 부활한, 서울빛초롱축제 #청계천 #서울 #빛 #축제 #빛초롱축제 #낮 #밤 #빛축제 #청계천빛축제 행... blog.naver.com https://blog.naver.com/winterainy/222509121760 181229 서울스카이, 롯데월드타워 / 서울 송파구 야경 아마도, 서울에서 가장 야경보기 좋은 곳 결혼기념으로 여기저기 쏘다니던, 연말의 기억. #서울스카이 #제2... blog.naver.com https://blog.naver.com/winterainy/222651742477 서울대입구역 전집, 김치전 부추전 감자전 녹두전이 단돈 2천원? 각종 전 2천원부터 관악산 사당방면 관음사 코스를 다녀와서, 서울대입구방면으로 하산했습니다. 집으로 향... blog.naver.com <국내여행> 네이버 인플루언서 제이원입니다. 공감과 덧글은 창작자에게 큰 힘이 됩니다. 제이원 & 제이은의 팬이 되어주세요. https://in.naver.com/j.one_j.eun -> 들어가셔서 '팬하기' 꾸욱 감사합니다 _ _)"
