title,content
"2월에 간 서울나들이🫣/ 압구정 제일양 / 성수동 테니 / 성수명당 / 광야 KWANGYA, SM / 아방베이커리 / 부엉이산장 / 누데이크 / 런던베이글 뮤지엄 도산","설 칭구들을 안본지 풀타임 참⏳️ 서울을 한번 가야겠다고 맘먹고 출바알🖐 금욜 저녁 퇴근하고 7시 차타고 ㄱㄱ.. 가기전에 토스트 냐미 🥪 금욜 저녁이라 그른가 차엄청막히고 내 궁디는 터지겠고 살려줘 😢 10시 반 서울도착 서울 버스는 노선도 많고 무서워서 타기싫은데~~(ㅋ) 만나기로한 장소가 버스가 더 빠르데서 탑승~~ 11시 압구정 제일양 도착 나 양꼬치 처음먹어봄..(두근) 제일양 압구정로데오점 서울특별시 강남구 압구정로46길 25 2시에 영업종료인데 꿔바로우가 마감이라니요!!!!!! 눈물 나 꿔바로우만 보고 달려왔어 (아님) 양꼬치랑 마라탕 칭따오 시켜서 호로롭 성공적인 첫 양꼬치였다 다 먹고 칭구네 집으로~~ 근데 집앞이 한강공원이래.. 그럼 가야지 저벅저벅 걸어서 한강공원 도착 저멀리 보이는 트리마제뷰 배쿈.. 그곳에 당신 잘지내니? (제대 하루전날이었슴;) 추워서 걍 바로 들어옴ㅎㅎ 집와서 피지컬100 보면서 과자먹다가 잠듬 일어나서~ 다른 친구들도 만나러 성수동 ㄱㄱ 성수명당 가기루함 부랴부랴 인나서 성수동 갔는데 생각보다 빨리 도착함..; 근데 배고파 어제 저녁에 많이 무거서 그른가~ 배에서 꼬르륵소리나서 눈에 보이는 문연 브런치가게 아무곳이나 들어감🐷 테니 서울특별시 성동구 뚝섬로17가길 55 1층 예약 아무곳이나 들어간 곳 치곤 이뻤음 성수동은 원래 이른가 🙏 거울보면 찍어야지 1시에 바로 밥무거야하니까 간단하게 먹기로함 셋이서 슈림프 아보카도 샌드위치랑 치킨 시저 샐러드, 아아메 2잔 조지기 냐미 새우 탱글탱글하구 존맛이었다. 브런치 묵고 30분도 안되서 성수명당감; 성수명당 서울특별시 성동구 연무장19길 10 1층 예약 🏃‍♀️어쩌다 오픈런인디 예약해둬서 바로 입장~ 지혜가 예약해가꼬 테이블에 지혜이름 똭 넷이서 더오프라인샵 스테이크, 명당 로제 떡볶이, 생참치연어김밥, 벌꿀하이볼, 유자하이볼 시킴 방금 브런치 먹은사람 맞아요? ㅎㅎ 생참치연어김밥 존맛!~ 벌꿀하이볼은 그냥.. 그냥 하이볼인데 벌꿀 씹으면 넘 달어~ 유자하이볼은 그냥 유자에이드 너낌쓰~ 술맛 한탱두안남 술이 많이 안들어가는거 같움 길가다 만난 엔시티 조카덜.. (칭구가 시즈니) p들의 여행이란.. 길가다 신라면 냄새맡고 팝업스토어 가는것.. ㅋㅋㅋㅋㅋㅋㅋ 걍 들어감; 하이 쏘니! 손흥민 사인 티셔츠 있고요 글자 플카처럼 프린터 해주는것 있음 해차니 건강하기가 걸려있어서 빌림; 우리꺼도 하나 인쇄 인생네컷 비슷하게 3컷있슴 사람들 다보는데서 찍는거라 조금 민망하지만 잘찍었다 앞에 직원이 칼같이 다음 차례 부르기 때무네 포즈 착착착 해야함 그 다음은 광야 투어감 걸어가자고 괜히 말했어 종아리 터지기 직전에 도착 반가워 배켠..❤️ 온통 배켠 카페 투성이야! (행복하단 뜻) 광야 슥 구경하고 (3분 컷) 추워서 다음 친구들을 기다리며 카페로; 아방베이커리 서울숲점 서울특별시 성동구 왕십리로 83-21 지하1층 B117호~120호 카페 고른 기준 없음 걍 추운데 자리 빈곳이 이곳 뿐 호다닥 들어가서 빵이랑 아메4잔 시켜서 앉음 이곳 빵을 여러개 시켜도 1인 1음료 매장임..ㅠ 사실 연달아서 와다다 먹어서 빵이 잘안먹힘 그렇다고 남기진않음~ 저녁시간 다 되서 다시 한강을 건너~ 신사 부엉이산장~ 부엉이산장 신사점 서울특별시 강남구 도산대로11길 31-4 1층 아직 일행이 두명안와서 맨정신네컷 갈기고 다시 부엉이산장으로 돌아가서 여섯이서 뭐시켰더라 사진으로 대충보면 치즈감자전 육전 곱도리탕 김치찜같은거랑..호떡, 주먹밥 술...그리고 술.. ㅋㅋㅋㅋㅋㅋㅋㅋㅋㅋㅋㅋㅋㅋㅋ 암튼 247,500원 나옴... 회비 결제~ 이때는 술이 좀 됏슈 그리고 술마시면 취중네컷 해줘여쥬 ㅋㅋㅋ 정신차리고 담날보니 사진은 안가져옴 다행히 원본파일을 폰으로 받기라도함 ㅜㅜ내사진 술먹고 카메라앞에서 재롱부리는중; 아침에 일어나서 런던베이글 오픈런 가기로했는데 오픈런은 무슨 10시에 인남^^.. 대충 부랴부랴 인나서 나옴 런던 베이글 뮤지엄 도산점 서울특별시 강남구 언주로168길 33 1, 2층 갔는데 웨이팅 있어서 그 근처 누데이크 가봄 어쩌다 누데이크 오픈런함 줄 왜 서있나 햇슈 오픈전이라서 ㅋ 누데이크 하우스 도산 서울특별시 강남구 압구정로46길 50 하우스 도산 B1 예약 누데이크 도전60초 빵음료 나왔는데 런던베이글 웨이팅 갑자기 훅 줄어서 한입에 우겨넣고 나옴; 함냐 맛은 있더라; 근데 커피 jonna작아 런던베이글가서 빵사고 구경하고 안에서 먹는건 기대도 안혀 런던베이글 사진이 많은이유 예뻐서~ 바로 나와서 달래해장 달래해장 압구정로데오점 서울특별시 강남구 도산대로49길 32-1 1층 음~ 달래해장 음~ 음~ 내서탈 아녀 여까지 서울 일정 끝 터미널 도착 돌아갈땐 눈알아프니께 안경끼고 집가기 근데 ㅅㅂ.. 존나빡치는거 💢 런던베이글 봉투 두개 나눠서 가지고 있었는데 폰충전하고 오는새에 하나 누가 훔쳐감 ㅅㅂ 누구야 장발장 가만안둬 부추크림베이글 나 그거 먹고싶어서 두번 줄서서 샀다고ㅠ 먹은놈 설사하길 🙏 분노의 상태로 집 도착.. 알찼던 서울여행 끝; 🤘"
[Order made] 성수동 카페 테니 - 카페 셀프바 제작,"동연무장에서 가장예쁘고 맛보장되는 테니의 주문제작요청으로 셀프바를 제작했습니다. 고객님들이 좀 더 편리하게 셀프바를 이용하실 수 있도록 위치랑 사이즈 등을 고려해서 주문해주셨어요! 손잡이는 큰문을 좀 더 편하게 잡고 열 수 있도록 디자인하고 내부는 비품을 넣을 수 있도록 넓게 구성이되었어요! 바로 옆이지만 너무나도 커서 대표님께 도움요청을 드렸는데 흔쾌히 도와주셔서 너무 감사했습니다 🙇‍♀️🙇‍♀️👍🧡🧡 많은 고객님들의 편의를 위해 요청해주신 만큼 많이많이 방문해주세요 :) 테니와의 미팅은 언제나 맛난 베이커리와 함께!! 아 슬러쉬 대존맛이에요.. 🥺🥺✨️ 가구주문제작 요청은 0507-1354-4717 및 카카오톡 플러스친구'정근날'로 문의부탁드립니다. www.instagram.com/junggunal_official 정근날 Junggunal(@junggunal_official) • Instagram 사진 및 동영상 팔로워 4,903명, 팔로잉 261명, 게시물 276개 - 정근날 Junggunal(@junggunal_official)님의 Instagram 사진 및 동영상 보기 www.instagram.com"
[서울 성수동 카페/뚝섬 카페] 테니 Tenne,#서울카페 #성수동카페 #뚝섬카페 #성수카페추천 #테니 #tenne #성수역카페 #베이커리카페 성수 골목 사이 구경하다가 서울 오기 전 성수 카페 검색했을 때 런던 느낌난다는 카페가 있었는데 여기였어..그 이름은 테니... 지나가다가 얼떨결에 발견했던 곳 50m © NAVER Corp. 테니 Tenne 서울특별시 성동구 뚝섬로17가길 55 1층 위치는 요기 테라스가 인상깊었던 카페였다. 테라스에 자리 잡아놓고 주문하러 들어가기 카페매장은 정말 컸고 사람도 정말 많았다. 서울은 역시다 역시... 난생 첨 듣는 빵인 에스카르고...?부터 시작해서 크루아상..슈크레 퀸아망..?도 있고... 브런치 카페라 그런지 쫀독쫀독한 치아바타 등 샌드위치에 사용하는 빵들도 많았다. 슈도 있었는데 내가 알던 슈가 아닌데? 등등..다양한 빵들이 있었고 우리는 일단 얼그레이 퀸아망이랑 몽블랑슈를 주문했다. 비오는 날 테라스에서 차 한잔 여유롭고 기분이 너무 좋았다. 왼쪽이 얼그레이 퀸아망 오른쪽이 몽블랑슈 난생 처음보는 비주얼 얼그레이 퀸아망은 이름값 제대로 하는 아이였다. 페스츄리같은 식감에 얼그레이 향이 가득했다 합격! 몽블랑슈는... 내 입엔 영~ 담에 또 가게되면 안먹는걸루.. 담엔 퀸아망 다 먹어바야징
[테니 Tenee] 성수역 맛집 | 성수역 카페추천 | 성수역 브런치 | 성수동 글라스 와인 가격 (feat.디저트 추천),"■ 위치 서울 성동구 뚝섬로17가길 55 1층 ■ 영업시간 월 ~ 금 8am~9:30pm 10am~10:30pm ■ 휴무일 없음 ■ 전화번호 0507-1341-3094 성수역 신상카페 | 성수역 맛집 | 성수역 카페추천 성수역 브런치 | 성수역와인바 성수역 핫플 | 성수동핫플 성수동디저트맛집 | 성수역디저트맛집 테니 소개해드리려고해요 테니 Tenee _ 외관 성수역 브런치 | 성수역와인바 성수역 핫플 | 성수동핫플 성수동디저트맛집 | 성수역디저트맛집 테니 Tenee 외관이에요 멀리서부터 딱 이 곳만 밝혀져있고 밝은 화이트톤의 벽과 테라스 테이블이 잔뜩 있어서 유럽을 연상케하는 느낌이라 좋더라구요 테니 Tenee _내부 인테리어 성수역 브런치 | 성수역와인바 성수역 핫플 | 성수동핫플 성수동디저트맛집 | 성수역디저트맛집 테니 Tenee의 내부 인테리어에요 정말 조명을 어찌나 잘 쓰셨는지 로맨틱한 느낌도 나고 살짝 어두운 듯한 공간과 호텔 스위트룸이나 라운지와 비슷한 느낌으로 응접실처럼 꾸며놓은 공간이 예쁘더라구요 외부로 연결되는 야외 공간도 좋고 밖에서 바로 보이는 테라스 공간도 좋아서 어딜 앉아야할지 고민이 많이 될 것 같은 곳이에요 테니 Tenee _메뉴판 크로크무슈 8,000원 크로아상 샌드위치 8,000원 잠봉뵈르 11,000원 에그브리스켓 샌드위치 10,000원 프렌치어니언스프 8,000원 사우어도우 오픈 샌드위치 11,000원 치아바타치킨 샌드위치 5,000~9,000 Tenne 샐러드 12,000원 딥4종&브레드 8,500원 후무스&브레드 7,000원 라구 파스타 18,000원 에스프레소 3,500원 아메리카노 4,500원 라떼 5,000원 로네펠트 티 4,500원 성수역 브런치 | 성수역와인바 성수역 핫플 | 성수동핫플 성수동디저트맛집 | 성수역디저트맛집 테니 Tenee 의 메뉴판이에요 브런치, 와인, 디저트 등 다양한 종류의 베이커리와 식사 메뉴를 판매하고 있어서 너무 좋더라구요 테니 Tenee _ 빵 디저트 메뉴 및 가격 - 올리브스콘 3,200원 - 스콘 3,000원 - 잡곡식빵 7,000원 - 뺑오쇼콜라 3,800원 - 소시지크루아상 4,500원 - 베이컨치즈에스카르고 4,500원 - 초코헤즐넛에스카르고 4,500원 - 아몬드크루아상 4,500원 - 크루아상 3,500원 - 브리오쉬슈크레 3,000원 - 퀸아망 4,200원 - 흑임자 퀸아망 4,500원 - 시나몬 퀸아망 4,500원 - 퀸아망 6종세트 23,000원 (정상가 26,700원) 성수역 신상카페 | 성수역 맛집 | 성수역 카페추천 성수역 브런치 | 성수역와인바 성수역 핫플 | 성수동핫플 성수동디저트맛집 | 성수역디저트맛집 테니는 일반 베이커리 카페가 아닌 정말 훌륭한 디저트를 판매하는 곳이더라구요 이 곳에는 '이렇게 맛있는 크루아상' 저자이자 프랑스 바게트로 굉장히 유명하신 제레미볼레스터 쉐프님이 계시기 때문이지요 그래서 정말 디저트 하나하나 너무 먹어보고 싶더라구요 파스쿠아 스윗 로제 가격 27,000원 테니 Tenee 와인 가격 테니 Tenee 네추럴 와인 가격 테니 Tenee _ 와인 가격 및 종류 - 네추럴와인 - 로제와인 - 화이트와인 - 레드와인 테니 Tenee에서는 쉽게 접하기 어려운 네추럴 와인부터 쉽게 볼 수 있는 파스쿠아 프리잔뗴 스위트 화이트 부터 스윗 로제를 정말 저렴한 가격에 판매하고 있어서 와인샵에서 구매하는 것보다 저렴한 가격의 와인이 많아서 좋더라구요 테이크 아웃가격 기준으로 기재되어 있고 홀에서 마실 경우 10,000원 추가금이 붙더라구요 와인바보다는 훨씬 저렴한 편이라 캐주얼하게 와인 마실 때 여기와서 마시면 좋겠더라구요 테니 Temee _ 글라스 와인 메뉴 및 가격 - 칸포르라테스 템프라니요 6,000원 (120ml) - 카피틀로 102 네로디볼라(오가닉) 5,500원 (120ml) - 퍼즈 (네추럴) 12,500원 (120ml) -르피프(내추럴) 8,500원(120ml) 성수역 신상카페 | 성수역 맛집 | 성수역 카페추천 성수역 브런치 | 성수역와인바 성수역 핫플 | 성수동핫플 성수동디저트맛집 | 성수역디저트맛집 성수동 글라스와인 테니 테니에서는 글라스 와인으로 마실 수 있어서 가볍게 한 잔 마시거나 맛 보고 마음에 들면 보틀로 구매하기 좋겠더라구요 테니 Tenee _주문한 메뉴 - 딸기슈 - 사과슈 - 퀸아망 - 카페라떼 - 아메리카노 이번엔 식사후에 방문해서 디저트와 커피만 마시고 가기로 했어요 다음번엔 방문하면 와인을 마시거나 브런치 메뉴를 접해봐야겠단 생각이 들더라구요 제가 주문한 메뉴는 테니 Tenee 시그너쳐 메뉴인 퀸아망과 그 다음으로 유명한 슈 위주로 주문했어요 테니 Tenee 사과슈 _ 맛은? 성수역 신상카페 | 성수역 맛집 | 성수역 카페추천 성수역 브런치 | 성수역와인바 성수역 핫플 | 성수동핫플 성수동디저트맛집 | 성수역디저트맛집 테니 사과슈 사실 먹기전에는 일반 크림 슈 느낌으로 생각하고 사과 쩀이 들어있으려나 했는데 반전이었어요 칼로 살짝 건들여보니 슈가 정말 엄청 얇은 피처럼 되어 있어서 신기하더라구요 튀김 옷처럼 살짝 싸여져 있는 슈 사이에 얇게 슬라이스된 사과가 잔뜩 들어있고 사과 퓨레가 들어있더라구요 먹자마자 정말 상큼하고 달달한데 인위적이지 않고 자연스러운 단맛이 느껴졌어요 사과 본연의 향과 맛을 잘 살린 슈인데 처음 먹어보는 맛이라 너무 신선하더라구요 사과슈는 아쉽게도 9월 한정판매라고 하니 아마 다음번엔 다른 제철 메뉴를 선보일 될 듯 해요 [테니 Tenee] 성수역맛집 | 성수역신상카페 | 성수동카페 | 재생 1 좋아요 1 00:00 00:22  접기/펴기 [테니 Tenee] 성수역맛집 | 성수역신상카페 | 성수동카페 | 테니 Tenee 딸기슈 _맛은? 성수역 핫플 | 성수동핫플 성수동디저트맛집 | 성수역디저트맛집 테니 딸기슈는 제일 많이 보이는 디저트더라구요 아무래도 데코레이션이 가장 예뻐서 그런게 아닐까 싶은데 겉에 크림이 올려져 있어 바닐라 빈 크림이 들어있는 슈 인지 알았는데 칼로 잘라보니 생딸기와 딸기를 다진듯한 느낌으로 되어 있는 슈더라구요 생딸기 씹히는 식감도 정말 좋고 너무 단 맛이 아닌 딸기 향과 맛이 잘 살아있는 고급스러운 슈더라구요 테니Tenee 퀸아망 _ 맛은? 성수역 핫플 | 성수동핫플 성수동디저트맛집 | 성수역디저트맛집 테니 퀸아망은 이 곳의 시그너쳐 메뉴인데요 저는 완전 바삭한 식감의 퀸아망을 생각하고 먹었는데 바삭한 식감 보다는 쫜득한 식감의 퀸아망이더라구요 일반 퀸아망보다 훨씬 두께가 두꺼운 편이고 속은 나비파이와 같은 느낌인데 겉면은 쫜득하면서 빠짝한 식감이라 여러 식감을 즐길 수 있어서 좋았어요 단맛이 강한 편이라 너무 단 걸 안 좋아하시는 분들은 다른 메뉴를 추천드릴게요 ! 테니 Tenee 카페라떼,아이스아메리카노_ 총평 성수역 핫플 | 성수동핫플 성수동디저트맛집 | 성수역디저트맛집 테니의 카페라떼는 엄청 딥한 느낌의 카페라떼가 아닌 부드러운 느낌의 라떼더라구요 ! 산미가 엄청 도드라지는 느낌이 아니라 가볍게 디저트와 먹기 좋은 커피였어요 아메리카노도 산미가 거의 없고 향이 엄청 강한편이 아니라 디저트나 브런치 먹을 때 같이 마시면 좋을 커피더라구요 ! 아마 이런 조합까지 계산되서 만들어 진 음료였을 것 같은 느낌 테라스 공간이 너무 예쁘고 성수동에 이렇게 크게 자리잡은 브런치 카페가 많이 없는데 디저트나 샤워도우도 유명하니 꼭 한번 드셔보시는 걸 추천드려요 특히, 제레미 볼레스터 쉐프님의 손길이 깃든 곳이니 맛있는 빵을 좋아하시는 분들이라면 성수 빵지순례장소로도 추천드립니다. 50m © NAVER Corp. 테니 Tenne 서울특별시 성동구 뚝섬로17가길 55 1층"
성수동 베이커리 카페 -테니(Tenne),"이미 한달은 지난 방문 후기이기는 하지만 친구와 약속하고 성수동 베이커리 카페 테니 방문!! 확실히 깨끗한 외관과 넓은 건물이 눈을 사로잡았다. 안에 주문하러 들어가니 한두팀 정도 웨이팅이 있었지만 금방 차례가 와서 주문완료. 뉴욕롤 중 하나 먹고, 머랭 어쩌고였던 듯 그리고 슈 하나 시켜먹고 음료 두 잔 시키고 사람들이 많았는데도 시끄러운 분위기는 아니라 조곤조곤 말하기 좋은 분위기였다. 음료는 무난했고, 빵은...음......솔직히 디피되어있는 거 보고 기대를 많이 해서, 특별한 맛은 아니었다. 뉴욕롤도 조금 더 바삭했으면 좋겠는데... 내 입맛에는 평이했다 오히려 이 다음에 먹은 프렌치토스트는 맛있게 먹어서 ㅋㅋ내가 따뜻한 걸 먹고 싶어서 그랬을 수도 있고 그래도 분위기가 좋아서 누가 가자고 하면 응 가자!! 하고 갈듯 ㅋㅋㅋ 어쨌든 내돈내산...아니 친구돈친구산 후기ㅋㅋㅋㅋㅋ 성수, 테니"
성수동디저트맛집 테니에서 피스타치오딸기티라미수 먹은 후기,"50m © NAVER Corp. 테니 서울특별시 성동구 뚝섬로17가길 55 1층 예약 영업시간 월 - 금 8:00 - 21:30 토 - 일 10:00 - 21:30 이번 주말 성수에 있는 카페에 갔다~~~~ 이번에는 지나가다가 우연히 발견한 테니! 안의 내부가 브런치 하기 딱 좋은 분위기! 심지어 테라스?도 있고 나름의 웨이팅과 포장이 되는듯했다 ㅎㅎ 사람이 많아서 모자이크 처리했는데 분위기를 다 가려버렸다 ㅜㅜ 정말 다양한 디저트가 있다 ㅎㅎ 뉴욕롤??? 신기했다 ㅎㅎ 퀸아망이나 아망슈처럼 생겼었다~ 크로아상도 있어~ 정말 바삭해보이는 디저트들~~~ 그리고 고른 디저트가 있는 코너 다양한 크림 베이스 디저트들이 많았다 ㅎㅎ 나의 선택은 피스타치오 딸기 티라미수~~! 요즘 피스타치오 크림이 인기가 많은가 싶기도 했다 ~~ 피스타치오를 좋아하는 나로선 굿~~ 음료 메뉴~~~ 나는 슈크림라떼 가격은 8,000원 그리고 남친은 어떤 티 메뉴를 주문했는데 잘 기억이 안난다 ㅎㅎ 사진은 대충 컷~! 또다른 대충컷~! ㅋㅋㅋㅋ 클로즈업샷~~ 피스타치오 딸기 티라미수~~의 비쥬얼을 보소~~ 슈크림 라떼는 엄청 달았다쥬?? 마지막 이쁘게 찍은 사진으로 마무리~ 그리고 보니 떠먹은 사진을 안 찍었네 ㅜㅜ 하지만 디저트는 찐 맛집이다~ 포장도 되니 음료 안 마시고 디저트 사먹으로 또 가고 싶다~~~"
"성수 카페｜성수동 주민이 추천하는 브런치 맛집, 테니(tenne) / 추천메뉴","테니 서울특별시 성동구 뚝섬로17가길 55 1층 예약 테니(tenne) 유럽 감성 가득한 성수동 베이커리 카페 * 평일 08:00 - 21:30 * 주말 10:00 - 21:30 이번 년도 9월 초 남편이랑 산책하다 우연히 발견한 카페 남다른 느낌이라 무조건 가야지 하고 방문했던 ""테니"" 방문했을 당시, 오픈한지 얼마 안 되었던 것으로 기억 애정하는 장소라 묵혀두고 있다 이제서야 포스팅! 이미 너무 유명해졌지만!!! 무튼, 9월부터 11월까지 한 여섯 번 정도 방문 한 것 같다. 테라스 쳐돌이인 나로써는 지나칠 수 없는 외관 이런 곳이 생기다니😭 (감격) 실내에서 바라본 모습, 탁 트여 있어 안에 있어도 답답하지 않고 많은 인원을 수용할 수 있을만큼 넓다. 곳곳이 많은 애정과 신경을 쓴 듯한 느낌. 화장실은 한 칸이라 그 점은 조금 아쉽다. 우리는 항상 야외 자리에만 착석! 테니가 좋은 점은 인테리어, 맛 뿐만 아니라 bgm도 우리 스타일..! 공간 내 모든 것이 조화롭다. 푸릇푸릇한 잎들 사이에서 한 컷🌿🍃📷 본격적으로 먹어본 메뉴를 나열하자면...! ✅ 에그 브리스킷 샌드위치 (\12,000) 가운데는 빵이 아니고, 정말 보들보들한 계란이 들어가있다. 혹시... 계란찜이세요..? 수준 거기다 맛이 굉장히 찐한 치즈와 부드럽게 찢겨져 있는 브리스킷이 들어있다. 따뜻하게 나오는 샌드위치 한 입 먹고 이렇게 맛있는 샌드위치 처음이야! 라고 외쳤던,, 당근라페랑도 조화가 좋다 근데 먹다보면 좀 느끼해져서 한 사람당 반쪽이 최대치 ✅ 치아바타 치킨 샌드위치 하프 (\6,500) - 오른쪽 바질이 잔뜩 발려져있고 루꼴라도 들어있다. 바질&루꼴라 좋아하는 나로써는 호! 근데 에그 브리스킷이 너무 맛있어서 맛이 묻혀버렸다. 차게 나오는 샌드위치 엄청 추천할 만한 메뉴는 아닌 거 같다. 어디선가 먹어볼 법한 맛 ✅ 퀸아망 - 상단 다른 날 방문했던 사진, 에그 브리스킷 샌드위치가 너무 맛있어서 한 번 더 주문했던 날 맛은 맛있다.. 겉 면은 맛탕 같은 식감에(맛 표현이 구수해지는) 안에는 애플파이 같다. 아몬드가 잔뜩 박혀서 고소하다. ✅ 슈림프 아보카도 샌드위치 (\14,000) 따뜻하게 나오는 샌드위치, 맛있다 아보카도도 후숙이 잘 되어있고 실하게 들어있다. 근데.. 겉면에 빵이 딱딱해서 교정한 나로써는 먹기 힘들었던 샌드위치 실제로 치아 뒷면에 부착한 유지기가 탈락했던.. 소스는 사우전아일랜드랑 비슷한 맛이 난다. 소스랑 아보카도 새우,,, 내용물이 많아서 손으로 들고 먹는데 손에 소스 범벅에.. 질질... 흘리게 되는 샌드위치 맛은 있지만 좀 지저분하게 먹게되서 동행자가 누구냐에 따라서 선택 잘 해야될 거 같은 샌드위치! ✅브리오슈 프렌치토스트(\16,000) 프렌치 토스트가 맛 없을 수가 없지..! 폭신폭신 부드럽고 달달하다. 따뜻한 아메리카노랑 잘 어울렸다. ✅ 라구 파스타(\19,000) 개인적으로 생각했던 면 종류가 아니라 좀 당황했던 메뉴😅 (왜이리 넓쩍...쓰..?) 과연 맛있을까? 했었는데 다행히도 맛있게 잘 먹었다 양도 많고, 다른 곳에서 라구 파스타를 먹으면 좀 짠 느낌이 강했는데 간도 괜찮았다. 남편이랑 이렇게 둘이 시켰는데 너무 배불러서 다음 번엔 하나만 시키자고.. 라구 파스타는 저녁에 와인이랑 먹는 게 더 어울릴 거 같다. ✅ 오늘의 스프 (\8,000) 계절감이나 제철재료에 따라 변경된다는데 11월 중순에 갔더니 컬리플라워 크림치즈 스프였다. 맛은 옅은 크림스프 맛이 아닌, 그렇다고 너무 걸쭉하지도 않았고 딱 적절한 농도와 진함이였다. K 입맛 패치가 된 나는 스프에 후추를 들이 붓는 스타일이라 후추가 별로 없어서 살짝 아쉬워 라는 생각이 들 때 한 입 먹으니... 단언코,,, 말할 수 있는건 내가 살면서 먹어본 스프중에 제일 맛있었다 말할 수 있다! 🤤 -- 언제부턴가 샌드위치에 당근라페가 아니라 그냥 일반 피클이 나오는 점이 조금 아쉽지만.. (당근라페 진짜 맛있었는데.. 사장님 보고 계신다면 다시 당근라페로 주세요ㅠㅠㅠ) 핫플이 되면서 조금씩 메뉴도 달라진 것 같다. 무튼 애정하는 테니 포스팅 끗! 확실한 건, 베이커리 종류 다 맛있고 직원들 모두 친절하다는 점.. 성수동 살면서 이렇게 한 가게를 자주 방문한 건 테니가 처음 아닐까 싶다! 와인도 팔고 있어 낮이든, 밤이든 언제든 가기 좋은 테니! 강추! #성수동 #성수동맛집 #뚝섬맛집 #뚝섬역맛집 #브런치맛집 #맛집추천 #브런치추천 #성수카페 #성수동카페 #성수카페추천 #성수동카페추천 #테니 #테니메뉴 #테니메뉴추천 #샌드위치맛집 #분위기좋은카페 #테라스맛집 #테라스카페 #감성맛집 #감성맛집추천 #감성카페 #감성카페추천 #베이커리카페 #베이커리카페추천 #빵맛있는곳 #빵집추천 #성수동빵집 #성수빵집 #뚝섬빵집"
