title,content
[서울/성수동] 굴림 휘낭시에 마들렌 빵순이는 빵나라에서 기절해볼게요,"오늘은 성수 굴림 소개해볼게유😉 위치는 역이랑은 좀 멀어용 성수역에서 버스 타거나 한 20분 정도 걸어야해요! 50m © NAVER Corp. 굴림 서울특별시 성동구 성수이로5길 1 1층 굴림 공지나 자세한 소식은 인스타 통해 보셔용! https://instagram.com/goollimm?igshid=YmMyMTA2M2Y= 굴림(@goollimm)님이 Instagram을 사용 중입니다 팔로워 5,544명, 팔로잉 1명, 게시물 486개 - 굴림(@goollimm)님의 Instagram 사진 및 동영상 보기 instagram.com 쿠팡이츠나 배민 배달도 가능하고 예약도 가능해요! 저는 차 갖고 왔는데 주변에 공영 주차장이 있어요 평일에 방문했고 자리는 좀 운이 좋아 빨리겟! 서울은... 주차난이...후후... 좋아하는 유튜버가 자주 가는 곳이더라구여🥺 일층에 화이트톤의 건물 등장! 투명한 유리라 앉아있음 밖에 사람들이랑 눈 마주칠 수있어요>_< 노키즈존 노 스터디존 입니다! 빵........ 쏘 영롱.... 빵을 실물 크키로 볼 수 있어 너무 좋더라구요!! 휘낭시에랑 마들렌이랑 이런... 천국이자나..?🤤 아이스크림 올라간것도 먹고싶은데 저희는 테이크아웃이라 아숩네요 ㅠㅠ 빵 종류가 너무 다양해서 조아요ㅠㅠ 매장이 넓진 않지만 좌석도 꽤 있답니다 깔끔하고 카페트 깔린 것 때문인지 약간 프랑스 디저트가게 너낌 한스푼..? ㅎ 가운데 스피커를 두셨더라구요 ㅎㅎ 공간활용도 잘 하신것 같아요😇 마실것도 준비되어 있어요!! 빵들...안뇽...또올게...? 포장해서 집으로 고! 하나씩 포장을 해주시구 이름도 적어주셔서 알수있어요 촉촉한 너낌... ?????? 필링이 아주 가득 찼고 달달해요!!! 아빠도 엄청 조아하시더라구요 ㅎㅎ 그녀(유튜버)가 극찬한 #바나나시나몬 촉촉한거.... 보이시나요...? 으에엥에 넘 마싯자나!!!! #굴림바나나시나몬 꼭 드세요!!!!!! #리치고구마 달달+달달=❤ 고구마도 한조각 콕! 진짜 넘 다 맛있어요 ㅠㅠ 맛있으면 다른 빵들도 궁금해지는거 저만 그런가요? ㅠㅠ 늦어도 답방 꼭 갑니다✨🤍"
[굴림] 구움과자가 맛있는 성수동 디저트 카페,"- 월~토 11:00오픈 20:00마감 - 매주 일요일 정기휴무 예전부터 가보고 싶었던 굴림 카페 방문 꼭 먹어보고 싶었던 디저트가 있었거든요 후후.. 빵 글자만 큰 거 아주 좋아 ~ 카페 내부는 크지 않고 뭔가 요즘 감성..? 테이블과 의자가 딱딱해서 조금은 불편해요 그래도 의자보다 테이블이 높은건 다행인건가 평일에 갔더니 사람 없어서 좋았습니다♪( ›◡‹ ) 굴림은 디저트 선물상자도 따로 있어서 포장해서 선물하기도 좋을 거 같아요 바삭한 패스츄리들도 맛있어 보이고 휘낭시에랑 마들렌도 종류도 많고 전부 맛있어 보여서 결정하기가 너무 힘들었어요 ㅠㅠ.. 감태 휘낭시에는 처음 봐서 궁금했는데 품절돼 버린.. 굴림의 방문 이유 바로 팥 바닐라 아이스를 위해.. 인스타에서 우연히 디저트 사진을 봤는데 이건 먹어야해 하면서 달려왔습니다( ๑˃̶ ꇴ ˂̶)♪⁺ 음료 종류는 많지는 않고 간단해요 24시간 냉침한 밀크티도 유명합니다 주문한 메뉴 - 콜드브루 hot(1잔당) 5,000 - 팥 바닐라 아이스 8,000 - 마롱 5,500 팥 바닐라 아이스는 보고 왔기에 바로 시켰는데 다른 디저트는 전부 맛있어 보여 결정을 못해서 사장님 추천 픽 > 마롱으로 하나 더 주문 마롱은 밤 페이스트가 진하고 패스츄리 결도 바삭바삭하면서 고소함과 달달함이 있는 가을의 맛 팥 바닐라 아이스는 일단 모양부터가 끝났다 ꈍ◡ꈍ 아이스크림이 빨리 녹으니 사진 얼른 찍으세요ㅋㅋ 반갈샷 하고 싶었는데 가운데를 잘라버리면 다 쓰러질거 같아서 끝부분만 잘랐는데 소심했네 (⺣◡⺣) 팥의 적당한 당도와 시원하면서 달달한 바닐라 아이스크림 결이 살아있는 패스츄리빵까지 조화로운 맛이었어요 사실 바닐라와 팥 조합은 맛없으면 반칙이죠 (´∀｀)♡ 구움과자 맛집이라고 소문이 많던데 다음번에는 휘낭시에랑 마들렌도 먹어봐야지（ﾉ´∀`） 📍굴림 50m © NAVER Corp. 굴림 서울특별시 성동구 성수이로5길 1 1층 굴림 #성수동 #카페 #굴림 #일상 #서이추환영 #이웃환영 #공감 #소통 #데일리"
성수동 구움과자 맛집 굴림,"안녕하심까 팥죽임댜 요새 서울 맛집 찾아보면 광고거나 협찬이 넘 많아서 고민ㅠ 한참 찾다가 끌리는 곳 발견했어요 고고 굴림 영업시간 및 기본정보 📌 서울 성동구 성수이로5길 1 1층 굴림 ⏰ 11:00 - 20:00 🚫 정기휴무 일 🚗 주차 불가능 ☎️ 0507-1485-7999 위치 특성상 주차는 안될 듯 한적한 곳에 위치해있어 편하게 이용가능했어욤 빵 & 커피라고 쓰여진 곳이어요 읭 왕기여어,,🥐🥐🥐 메뉴 커피 콜드브루 hot 4.5 / ice 5.0 콜드브루라떼 5.5 밀크티 6.5 차 페퍼민트루이보스 7.0 마테레몬그라스 6.5 캐모마일메들리 6.5 피치블로썸 7.0 맥주 IPA 7.5 애플사이다 7.5 메뉴는 요렇습니다 가게가 큰 편은 아니라 커피류는 콜드브루만 하시나봐용 저흰 고민하다가 밀크티 시킴-! 때깔 쥑이죠,,? 🤤 비엔누아즈리랑 구움과자를 메인으로 하는데 종류별로 다양해서 좋았음 요새 또 구움과자에 빠졌거등요 고민하다 호지차랑 망고코코넛도 주문 🥭 성수동 구움과자 굴림 리뷰 재생 13 좋아요 0  성수동 구움과자 굴림 리뷰 츄베릅 내부 화이트톤과 우드가 어우러지게 배치되있어 넘 좋아유 선물세트도 하는데 넘 예뻐보이고 괜히 사고싶네요 ? 채광도 쥑이네 냠냠굿 금방 나온 칭구들 마쉿게따 밀크티가 적당히 달고 진해서 넘 맛도리 🌝 꼭 드셔용 글고 보틀에 나와서 양이 상당합니댜 2잔 분량 ㄱㅇㄷ 망고코코넛은 보이는 그대로 트로피칼한 맛-! 과하게 달지도 않고 식감도 있어서 맛있었어욤 식감은 폭닥폭닥 🥭 호지차는 의외로 달달해욤 글고 보관때문인지 차가웠는데 꾸덕한 식감에 달달한 필링이라 얘도 맛났음 냠냠굿~ 한적하니 좋다 동네살면 생각나서 올법한 곳이랄까요 공간도 좋고 밀크티도 구움과자도 냠냠굿 🤤 성수에서 갈만한 곳을 찾는다면 굴림 가볼만두 🥟♨️ 50m © NAVER Corp. 굴림 서울특별시 성동구 성수이로5길 1 1층 굴림"
성수동 마들렌맛집 굴림. 인생 마들렌 등극...(코평수까지 커지는맛),"이미 유명한 마들렌맛집 굴림 ㅎ 빵투어 계획세우고 아침부터 들렸다. 통유리로 햇살이 들어와서 평화롭고 따뜻한 느낌이다. 마들렌4개랑 서양배를 사왔다. 이렇게 맛있어서 갬동받는맛 너무 오랜만이었다... 마들렌 원탑집이다..ㅜ *바나나시나몬 마들렌 마들렌 맛집이라더니.. 진짜 식감이랑 맛 머선일..... 역대급으로 맛있었다. 여태 먹은 마들렌중 탑1. 원래 바나나크림이 저렇게 녹아있지않는데 얼렸다가 에프에 구워서 저렇게 녹았다 ㅋㅋ 식히면서 냉장고에 넣어놓고 좀 굳힌 다음에 먹었다. 겉은 아주아주아주 얇게 바삭한 느낌이있고 속에 부드러운정도가 진짜 미쳤다 ㅜㅜㅜ 부드러운빵 많이 먹어봤다지만 이건 차원이다르다 ㅜㅜ 이렇게 부드러운와중에 촉촉하고 버터리한맛도있다 ㅠ 씹자마자 막 사라져버리는데 촉촉함과 버터풍미는 남아있고ㅠ 마치 안개를 먹는거같다 ㅋㅋ 시나몬맛은 맛있게 아쥬 적당히 난다. 맛도 대박맛있고 식감이 아쥬 돌아버렸다. *망고 코코넛 마들렌 이것도 얼렸다가 에프굽. 겉은 아주 나노단위만큼 얇게 바삭하고 속은 진짜 ㅋㅋ아까 바로 위에 썼듯이 ㅁ친 부드러움...쵹쵹하게 부드러움 ㅜㅜ 말도안데 진짜 굴림은 마들렌 원탑이야 ㅜ 망고잼도 맛있고 코코넛은은하게 잘어울린다 ㅜ *호지차 마들렌 냉동실에서 미리 꺼내놨어야하는데 ㅋㅋ ㅜ 바나나시나몬때도 그렇고 ㅜㅜ또 까먹어서 렌지에 돌렸더니 크림이 녹아벌였다. 근데 또 크림이 녹은것도 맛있었다.. 마들렌 자체도 엄청 공기같이 보드라운데 크림이 녹아서 쳑쳑해져가지고 진짜 핵쳑쳑.. 그리고 맛도 미텼다.. 다음엔가서 마들렌 전메뉴 털어와야겠따.. *고구마 마들렌 이거 고를때 사쟝님께서 많이 리치하다고 하셨는데 너무 내 스타일거같아서 기대한 리치고구마. 기대보다 더 맛있어 버리기 ㅜ 일단 마들렌 자체가 솜털구름마냥 너무 부드럽게 죤맛탱인데 크림까지 ㅁ친맛 ㅜ 정말 리치리치하게 고구마맛 진하댜.. 버터뤼한 고구마 풍미 오졌구요.. 먹자마자 온 얼굴에 풍미가 다 퍼진다.. ***진짜 내 인생 마들렌집*** tmi. 굴림후기만 쓰면 너무 말투가 난폭해진다 ㅋㅋ 그리고 너무 맛있으면 미간만 찌푸려지지 코평수까지 확장되진 않았는데 굴림 마들렌은 먹을때 나도모르게 미간+코평수 커진다 ㅋㅋㅋㅋ내얼굴을 보진 못했지만 엄청 화난 앵그리코뿔소 표정일듯..ㅋㅋㅋ *서양배 서양배 (4.800) 시원하게 먹고싶어서 냉장고에 넣었다가 먹었다 ㅎ. 근데 당일 먹어야했는데 하루 있다가 먹었다 ㅜ 당일날 먹었으면 페스츄리 아주 결대로 파샤샥했을듯. 담백한 바닐라커스터드크림에 상콤하고 살짝 달달한 쵹쳑한 서양배ㅎ 페스츄리도 너무 버터기름진맛이 아니라 더 잘어울렸다. 깔끔함 ㅎ 깔끔 상콤 은은 부드럽 ㅎ ( 아 그리고 모양도 너무 커엽 ㅋㅋ 서양배 모양인가보다) https://instagram.com/goollimm?utm_medium=copy_link 굴림(@goollimm)님이 Instagram을 사용 중입니다 팔로워 5,239명, 팔로잉 1명, 게시물 451개 - 굴림(@goollimm)님의 Instagram 사진 및 동영상 보기 instagram.com 50m © NAVER Corp. 굴림 서울특별시 성동구 성수이로5길 1 1층 굴림 #서양배 #서양배페스츄리 #과일페스츄리 #굴림 #바나나시나몬마들렌 #망고코코넛마들렌 #호지차마들렌 #리치고구마 #리치고구마마들렌 #고구마마들렌 #마들렌맛집 #마들렌 #성수굴림 #성수맛집 #성수빵집 #성수동"
성동구/성수동) 굴림,"* 내가 갔던 지점은 논현점, 지금은 성수동으로 이사 했다고 함 ! 사진도 다 논현점 사진!!!! 지금 직장 2차 면접 봤던 날,, 현ㅇ이랑 빵 파티 하러 각 잡고 만남ㅋ 인테리어 세상 우드 우드!!!! 따땃한 이미지였던 굴림 안녕 나야 저 물병 현ㅇ이가 엄청 탐내했찌 나는 밀쿠티, 현ㅇ이는 아아 ! 그리고 빵 네 개 🥐🥯🍞🥖🥨🥞 히히ㅣ 빠질 수 없는 발샷 🐷🐷 도착 전에 다 팔릴까 봐 DM으로 예약하고 갔는데 언니 진짜 왕 친절 하시구ㅠ 바닐라 크림 크로아상 호지차 마들렌/피스타치오 마들렌/초코 마들렌 호지차!!!! 녹차 홍차 호지차 다 환장하는지라 빼놓을 수 없었따ㅏ 근데 생각보다 향이 약했어ㅠ 마이 원픽, 피스타치오,, 말해 뭐해 진짜 고소하고 진하고ㅠ 와 얘도 진짜 위험한 친구 초코 세상 진하고 마냥 단거 아니고 쌉싸름 달아서 무한정 들어가는 애^^,, 굴림 밀크티 맛집ㅋ 다섯 통 마시고 싶다 우리 이거 먹고 바로 또 보겠지 떡볶이 먹으러 가기로 해서 마들렌만 먹고 바크크는 포장 ㅋㅋㅋㅋㅋㅋㅋㅋ 다른거 다 먹었는데 크로아상 손도 안 대고 접시째 가져갔더니 언니 너무 놀래서셔 맛 없냐고 걱정 하심,, 언니 그럴리가요,, 저희는 그저 계획적인 돼지들인걸요 껄껄 50m © NAVER Corp. 굴림 서울특별시 성동구 성수이로5길 1 1층 굴림"
"일상ㅣ3년 만에 만난 교환학생 친구랑 성수동&뚝섬한강공원 (계월곰탕, 키베이커리, 굴림)","일상ㅣ3년 만에 만난 교환학생 친구랑 북촌 놀러가기 (랜디스도넛, 황생가칼국수, 비원떡집) 6시에 교환학생 친구랑 만나서 저녁 먹기로 했다. 난 3시 쯤 일찍 북촌에 도착해서 여유롭게 구경 좀 하기... blog.naver.com 북촌에서 놀고 바이바이했는데 어쩌다보니 또 만나서 놀게 됐다ㅋㅋ! 이날의 목적지는 성수! #계월곰탕 에서 밥 먹고 뚝섬한강공원으로 건너가서 놀기로 했다 계월곰탕 옆에는 바로 어글리크림치즈가 있었다. 내가 가보고 싶어서 네이버 지도에 저장해뒀던 곳인데 월욜은 휴무라서 못 갔다ㅜㅜ 아쉽ㅠㅠ 대신에 #키베이커리 에 다녀왔다 ㅎㅎ 치즈타르트가 유명한 곳이라고 해서 에그타르트랑 치즈타르트 좋아하는 엄마 사다주려고 잠깐 들렀당 사장님 부부가 운영하고 계신 키베이커리. 여자 사장님은 일본 분이신데 정말 친절하시고 에너지가 너무 좋았다! 사장님이 서비스로 리프파이 하나도 넣어주셨당 흐흐 계월곰탕 들어와서 영롱한 치즈타르트 찍어보기~ 내 폰 카메라는 요즘 정상이 아니라서 친구 폰으로 찍었는데 정방향이 있는걸 이날 처음 알았다고 했다ㅋㅋ 친구가 미국 가기 전에 제대로 된 한식, 예를 들면 국밥이나 칼국수 같은거 먹고 싶다고 해서 뚝섬유원지랑도 멀지 않고 평점이 높은 계월곰탕으로 왔다. 맛은 깔끔한데 두 번은 안 올 것 같은 맛..? 뭔가 아쉬운 맛이다.. 건강한 맛이긴 함 ㅎㅎ,, 닭 구이도 주문했는데 저번에 갔던 황생가칼국수가 훨씬 만족스러웠다 ㅎㅠ 뭐,, 종목이 다르니까 비교는 어렵지만 그래도~ 전체적인 만족도로 봤을 때?~ 밥 다 먹고 근처에 마트 있길래 한강 가서 먹을 과자 몇 봉지 사고 가는 길에 위치한 #굴림 들러서 구움과자는 안 사고 음료만 테이크아웃해갔다. 굴림은 구움과자가 그렇게 맛있다는데!!!!!!!! 성목이가 하나 사줄까?했을 때 그냥 하나 먹어볼 걸!!!ㅋㅋㅠ 다음엔 구움과자 쓸어?와야지ㅋ.ㅋ 근데 여기 화장실은 너무 으스스하다.. 어둡고 좀 그렇다.. 잠깐 화장실 간 사이에 음료 인증샷 찍어둔 조쉬~ㅋㅋ 거울셀카도 남겼구용~~ 원래는 뚝섬한강공원까지 걸어가 생각도 했는데 은근 날이 후덥지근하기도 했고 은근 멀어서^^,, 결국 택시 탔당ㅋㅋ 미국에서 한국으로 오기 전에 엄마아빠가 진짜 맛있는 빵이라고 챙겨주셨다는데 알고보니 카스테라였다ㅋㅋ 맛은 보통 잘 알고 있는 그 달콤하고 부드러운 카스테라 맛~ 성목이는 처음 먹어본다고 해서 살짝 놀랐음! 미국에선 카스테라 빵을 잘 안 먹는구나 알게 됐다 마트에서 골라온 과자는 3종류. 홈런볼, 꼬북칩 초코츄러스맛, 콘치 크림치즈맛. 성목이가 제일 좋아하는 과자 중에 하나가 홈런볼이라고 했다. 미국에는 저 홈런볼 사이즈 *4개 사이즈 정도가 하나로 판다고 했다ㅋㅋ 꼬북칩은 별로라고 했다ㅋㅋㅋ 난 진짜 맛있어서 계속 집어먹게 되던데!ㅋㅋㅋ 난 꼬북칩 맛이랑 식감 다 좋은데 성목이는 식감이 우선 별로라고 했다 (진짜????) 콘치는 미국에도 있는 식감과 맛이라고 했다. 과자 시식평 끝! 그리고 한강 왔으니까 라면 먹어야지~~~~ 라면 먹을 생각에 굉장히 신나했던 Joshㅋㅋㅋ 나는 참깨라면, 조쉬는 오징어짬뽕으로 골라서 야무지게 끓여왔다ㅎㅎ 근데 난 한강에서 라면 먹었던게 거의 3년 전이라서 라면 끓이는 기계 사용법을 몰라서(ㅋㅋㅋㅋㅋ) 성목이가 알려줬닼ㅋㅋㅋㅋㅋㅋ 라면 기계에서 자동으로 물 나오는 줄도 몰라서 '물은 어디서 받지????' 이러고 있었음ㅋㅋㅋㅋ 사실 좀.. 창피했닼ㅋㅋㅋㅋㅋ 예,, 한국에서 태어난건 맞습니다만,,ㅎ호홓.. 사진은 굉장히 평화로워 보이지만 진짜 바람이 거의 바닷바람처럼 미친듯이 불었다ㅋㅋㅋㅋ 바람이 너무 많이 불어서 사진도 그지 같이 나옴^.^ㅋㅋ 진짜 덜 이상한 사진 빼고 마빡이처럼 나온 사진은 다 지워버림 킄ㅋ 한강에서 미국, 한국 얘기 한참동안 하고 앞으로 커리어 얘기도 하고~ 라면 다 먹고 건입까지 걸어가서 근처 카페 들어가서 또 수다 떨고 놀았당 그리고 길거리에 피규어 파는 부스가 있는데 의외로(?) 그런 귀여운걸 좋아하는 조쉬ㅋㅋㅋㅋ 나는 사실 걸어가면서 귀여운 피규어 관심 없어서 그냥 지나갔는데ㅋㅋ 암튼~ 미국에 있는 친구 선물로 사가기로 하고 열심히 골랐다. 19곰 테드도 있었는데 귀엽긴 한데 좀 그래서?ㅋㅋ 짱구 피규어로 고른 성목! 저 째깐한게 하나에 8000원이라고 해서 (에바죠....아무리 봐도 이거 거품 ㅎ..) 1000원 씩 깎아달라고 하니까 총 3개에 2만원까지 깎았다 ㅎㅎ 그리고 갑자기 길거리 떡볶이도 먹어보고 싶다고 해서 갑자기 먹게 된 떡볶이. 저때 진짜 배가 완전 터져버릴 것 같아서 나는 떡 2개만 먹었다ㅋㅋㅋㅋ 맛은 .. 없었다 ㅎ 그냥 미국 가기 전에 먹어보고 싶은거 같이 먹으면서 노는거죵~~ 사실 떡볶이 달지도 않고 그렇게 맵지도 않았다! 근데 은근 (많이) 매워했던 성목 ㅎㅎㅎ그래도 반은 먹은 듯? 너 생각보다 진짜 잘 먹는다!? 그리고 진짜 바이바이!~~ 8월에 시애틀에 가서 볼 수 있음 꼭 보자고 했는데 과연 만날 수 있을지??.?? 시애틀에서 만나면 하루 정도는 같이 놀아준다고 했는데 꼭 와라 성목이 ^.^ ㅎㅎㅎ 짧지만 알차게 잘 놀았던 3일이었다~~ #일상블로그 #일상블로거 #뚝섬한강공원나들이 #쫑스네"
"휘낭시에 맛집, 성수동 카페 <굴림>","제 식단 일기에서 본 그 마들렌! 마들렌 맛집이라고 해서 갔는데 웬걸 휘낭시에 찐찐 맛집이었습니다! 외부는 요로케 생겼습니다. (쫌 흐리게 나왔네요..ㅎ) 좋아하는 유튜버가 있는데, 그분이 여기 구움과자 넘 존맛탱이라고 해서 기록해뒀다가 찾아왔숩니다!! 성수역에서 생각보다 멀어요 ㅋㅋ 네이버는 14분 이랬는데 전 체감상 한 20분은 넘게 걸은 느낌? 왜죠;; 내부는 요로케 뒤쪽에도 자리가 있었는데, 손님들 계셔서 거긴 패스~~~ 사장님이 바로 앞에 계셔서 사진 찍기 너무 민망한 거예요 ㅋ 그래서 대충 찍었어요! 아니 맛이 중허지, 카페 인테리어가 중한 건 아니니까~ 판매 메뉴를 이렇게 해 놓으셨더라고요! 주문하면 뒤에 있는 트레이에서 꺼내주신답니당 마들렌& 휘낭시에 맛집이라고 하길래 그거 위주로 샀습니다! 마들렌 종류 되게 많았는데, 제 취향인 것만 샀어요. 바나나 시나몬은 필수라길래, 일단 담고 ㅋ 한강이랑 무척 가깝길래 뚜벅뚜벅 걸어왔습니다. 아, 뚝섬 유원지랑은 쪼금 거리 있음! 호다닥 하나 까먹어 봅니다! 와 진짜.. 미쳤.. 제가 먹어본 휘낭시에 중 탑!!! 겉은 바짝하고 속은 촉촉한 스타일 먹는 내내 ""넘 맛있당""만 반복했어요. 진짜 하나만 사 온 나 반성해... 이거 더 사러 다시 갈까 고민할 정도 넘 맛있었어요! 그다음은 레몬 마들렌. 마들렌은 이렇게 다 앞에 이름을 써주셨더라고요! 센스 넘치심~ 저 레몬 글라세 좋아해서 이것도 맛나게 먹었는데 마들렌보다는 휘낭시에가 더 제 취향이었어요! 얼려먹으면 더 맛있으려나? (좌) 바나나시나몬 (우)초코가나슈 다음날에 먹어도 맛있더라고요ㅎ 근데 뭔가 얼려먹는 게 궁금해서 반은 얼려먹어봤거든요? 바나나 시나몬은 얼려먹는 추천! 제가 하루 지나고 먹어서 그런지 몰라도 상온이라 바나나가 말랑말랑해서 바나나 맛이 진했는데, 얼리니까 바나나&시나몬의 맛이 둘 다 조화롭게 나더라고요! 그리고 얼리면 약간 폭신 폭신보다는 살짝 오독오독? 근데 가나슈는 안 얼리는 게 더 맛있었어요. 근데 얼려 먹어도 굿이긴 함. 성수동 가면 꼭 가보세용! 재방문의사 무조건 있음!! 50m © NAVER Corp. 굴림 서울특별시 성동구 성수이로5길 1 1층 굴림"
성수동 카페❛굴림(goollimm)❜촉촉한 마들렌 맛집(ft.구움과자성지),"*내돈내산* 성수/서울숲/뚝섬 카페 [ 굴림(goollimm) ] 구움과자, 밀크티 맛집 @playxxjin 안녕하세요 :D 카페 굴림은, 강남에서 성수로 이전한 구움과자 맛집인데요 강남에 있을때부터 가고싶어서 찜해놨었는데 아쉽게도 일요일 휴무라 방문을 못하고 있다가 토요일 성수에 오게되어서 이때다 싶어 드디어 방문하게 되었어요~ 저도 자칭 빵순이인데 아직 구움과자는 많이 안먹어봤어요. 그런데 굴림에서 마들렌에 입문하게되었어요! 먼저 주차는 불가해서 걸어오시는것이 좋습니다. 골목안쪽에 운좋게 한자리 있어서 주차할 수 있었고, 아니면 주변 공영주차장을 이용하려고 했답니다. 성수 굴림 월-토 11시~20시 매주 일요일 휴무 @goollimm 로그인 • Instagram 전화번호, 사용자 이름 또는 이메일 비밀번호 로그인 또는 Facebook으로 로그인 비밀번호를 잊으셨나요? 계정이 없으신가요? 가입하기 앱을 다운로드하세요. www.instagram.com 50m © NAVER Corp. 굴림 서울특별시 성동구 성수이로5길 1 1층 굴림 대로변에 있어서 찾기 쉬웠어요~ 내부 인테리어는 화이트&우드톤이에요. 성수 굴림 메뉴판(22년7월기준) 커피는 콜드브루, 콜드브루라떼만 있어요. 저는 밀크티 픽! 아기자기한 스티커도 챙겨왔구요~ Next image ▶▶ 우와~ 빵순이 환장@.@ ▶▶ 바닐라아이스, 팥아이스도 먹고싶었지만 배가불러서ㅜㅜ 마들렌 2개 픽! 선물포장도되네요~ 테라스도 있습니다. 짠~~ 다음에 오게된다면 보다 푸짐하게 먹고싶네요. 아이스 콜드브루 / 5.0 밀크티(보틀) / 6.5 : 2가지 얼그레이 블랜딩 적당히 쌉싸름한 밀크티! 맛있었어요~ 꺄~~ 드디어 먹어보는 굴림 마들렌! 구움과자라하면 식감이 너무 궁금했던 까눌레만 먹어봤지 마들렌, 휘낭시에는 뭔가 푸석할것같고 아는맛 같아서 굳이 안먹었었는데 마들렌이 이렇게 촉촉한거였구나~ 기본만 보다가 이렇게 다양한 크림이 들어가니 한층 고급지고 촉촉한거였네요! 바나나시나몬 마들렌 / 3.7 : 굴림 마들렌하면 다들 추천하시는 바나나시나몬! 역시 빵순이들이 인정할만 합니다. 바나나와 시나몬이라니 신선한조합이였는데 조화롭게 너무 맛있었어요! 바나나시나몬은 필수~★ 피스타치오 마들렌 / 3.7 요즘 피스타치오도 너무 좋더라구요 빵에 피스타치오도 왜이렇게 맛있는건지T^T 마들렌 입문 성공적♡ 밀크티와 잘 어울리는 구움과자들 너무 촉촉하고 부드러웠던 마들렌~ 밀크티 챙겨서 영화보러~~ 화장실은 카페밖 건물내에 있습니다. (남녀공용, 비밀번호있음)"
