title,content
서울숲 '성수지앵협동조합' 성수동 조용한 카페,"성수지앵 협동조합 : 네이버 블로그 성수지앵 협동조합 운영시간 10:00 ~ 21:00 문의전화 070-4156-7500 blog.naver.com 서울숲 ' 성수지앵협동조합' 매일 10:00 - 21:00 서울숲 역 5번 출구 4분 이날 비 오고 춥고 해서 근처에 아무 카페나 들어갔는데 서울숲에 올 때마다 항상 지나갔던 곳이었더라고요!? 성수지앵이라고 되어 있는데 친구들한테 위치 보낼 때 인터넷에는 #성수지앵협동조합 이라고 떠서 여기가 맞는지 헷갈렸잖아요 ㅋㅋㅋ 근데 동일한 곳이 맞습니다! 친구들도 저 무슨 서류 떼러 온 줄 알았대요 ㅋㅋㅋㅋㅋㅋㅋㅋㅋㅋ 앉는 좌석은 옆에 계단을 통해서 2층으로 올라가면 됩니다! 초콜릿, 케이크 같은 디저트들도 팔고 있었는데 특히 초콜릿 종류가 꽤 많았어요! 신발 초콜릿도 있는데 넘 신기하죠? 과연 맛있을까...라는 생각은 들지만 금손이라는 점은 인정! 2층으로 올라오면 양쪽에 문이 두 개가 있는데 어느 쪽으로 들어가셔도 상관없어요! 왼쪽에는 넓으면서 좌석이 많았고, 오른쪽은 단체석이 있는 곳이었어요 (참고로 여자 화장실은 왼쪽 남자화장실은 오른쪽과 가까워요) 저는 왼쪽으로 들어왔고 사람이 없어서 너무 좋다고 생각했는데 한 분 계시더라고요 저분이 앉아 계신 곳은 노트북을 사용할 수 있게 바로 앞에 콘센트와 독서실 느낌처럼 벽을 보며 개인적인 업무를 할 수 있는 공간이었는데요 딱 봐도 집중이 잘 될 것 같았어요 바닐라라떼 (hot) 5,000 넵 저는 얼죽아가 아닙니다. 기왕이면 시원한 거를 선호하긴 하지만 추운데도 불구하고 무조건 아이스를 먹을 깡은 없어욥 이날은 비 와서 발도 다 젖고 닭살도 돋아서 따뜻한 바닐라라떼를 시켰는데 하트가 아기자기한데요? ㅋㅋㅋㅋㅋ 성수지앵의 바닐라라떼 맛있는 편인 것 같아요 시럽 말고 파우더를 사용하시는 것 같은데 확실히 묵직한 단맛이라 너무 제 취향이었어요! 커피 중에서 특히 바닐라라떼는 시럽파랑 파우더파로 나뉘는 거 아시죠? 저는 무조건 파우더 파거든요 여러분도 선호하는 거 있으신가용? 친구들 만나기 전까지 여기서 몸 좀 녹이고 블로그도 쓰면서 편안하게 쉬다가 갈 수 있었는데요 ㅎㅎ 서울숲에 예쁜 카페는 많지만 그만큼 사람도 많고 편한 분위기는 아니라 오래 앉아있기 불편한 경우들이 많았는데 성수지앵은 사람도 많이 없고 좌석도 편해서 오래 앉아 있기 좋았고 무엇보다 2층이라 눈치 보이지 않는다는 점이 좋았어요:) 사람 많은 곳을 피하고 싶으신 분들은 여기가 딱이라고 생각합니다!! 50m © NAVER Corp. 성수지앵협동조합 서울특별시 성동구 왕십리로 101 예약"
[성수동/뚝섬] 조용한 2층카페 “성수지앵협동조합”,"성수지앵협동조합 수인분당서울숲역 5번 출구에서263m 매일 10:00 ~ 21:00 서울숲 5번출구의 2층카페 오늘은 노트북작업을할꺼라 1층카페인곳은 조금 눈치가보여 2층카페를 찾아서 왔다 1층에서 주문후 2층으로 가면된다. (1층도 자리가있긴함) 가게에서 먹는건 여기서 주문하고 테이크아웃은 키오스크로! 종류가 많고 다양하다 디저트는 수제 초콜릿을 판다는게 특징이고 기본적인 케이크와 생과일쥬스를 찬다. 구운 과자류도 상온에 팔고있다. 영수증은 기본적으로 안주니 필요하면 말을하고 주문하면된다. 에스프레소 블랜딩은 산미가 없고 쓴맛의 원두니 참고! (종류1가지) 1,2층만 카페고 3~6층은 다른 장소로 쓰이고있다. 우리는 바스크치즈케이크랑 아아, 수박쥬스, 키위쥬스를 시켰다. 키위 생과일주스에는 설탕뺴달라고했는데 뺴주셨다 :) 바스크 치즈케이크에 치즈 모양 화이트 초콜릿 너무귀엽네요 ㅎㅅㅎ 케이크 맛은 있는데 너무 냉동?된느낌으로 바스라져서 먹기 너무힘들었다 ㅠㅠ 촉촉한감이없어서 아쉬움.. 포크자국이 나면서 파여야지 제맛인데..! 그래도 맛은 있었다! 만족하며 다먹음 벽돌+우드로 전체적으로 따땃한 느낌의 인테리어 바테이블과, 2인용테이블이있어서 조용히 책을읽으러오거나 커공족들이 종종올것같다. 2인용 테이블이 너무맘에들었지만.. 오늘은 3명왔으니! 다른곳에 앉았다 다음에 2명오면 이자리에 앉아야지 충전코드도 테이블에 다 있어서 good! 단체석도있다. 카페가 전체적으로 나이가 좀 있으신 분들이 오셔서 대화를 하러 오시는 어르신들이 많아보였다. 성수 카페가 항상 사람이많고 셀카족들이많아서 싫었느데 공부하거나 노트북으로 작업할만한 장소로 딱인듯하다. 다음에도 작업하기위해서 자주 찾을것같다. 만족 ⭐️⭐️⭐️⭐️ 맛 ⭐️⭐️⭐️ 공간 ⭐️⭐️⭐️⭐️⭐️"
성수동 카페 [성수지앵 협동조합]에서 펭아트전 보고왔어요.,"성수지앵협동조합 주소 : 서울 성동구 왕십리로 101 영업시간 : 매일 10:00 - 21:00 전화 : 070-4156-7500 🐧 안녕하세요. 8월 8일 펭수의 생일을 맞이하여 펭아트전이 열렸던 성수동 카페 성수지앵 협동조합에 다녀왔습니다. 웬만하면 서울에 나갈 일이 없는데, 1년에 한 번씩 펭수 덕분에 나가는 듯합니다. ㅎ 바로 우리 형님이 펭아트전에 참여하고 있기 때문입니다. 성수동 카페 성수지앵협동조합은 뚝섬역 8번 출구로 나와 성수 보건지소 옆에 있는 건물인데요. 주차할 곳은 따로 없습니다. 펭수야 생일 축하해! 성수동 카페에 들어가자마자 커다란 펭수가 반겨주네요. 장미에 물을 주고 있는 어린 왕자 펭수. 먼저 주문부터 했답니다. 성수동 카페 성수지앵 협동조합은 성수동 도시재생 사업의 일환으로 탄생한 성수지앵 협동조합의 보금자리로 1, 2층 카페부터 레고 블록 대여, 공유 주방, 서울숲 어르신들 경로당까지 다양한 꿈을 담은 공간이라고 합니다. 블록방은 현재 내부 수리로 인해 일시 휴업이랍니다. 케이크와 초콜릿 등 디저트도 있어요. 특히 성수 수제화 초콜릿은 한때 번성했던 성수동 수제화 공장이 위기를 맞게 되면서 여성들이 모여 지역 발전을 위해 엄마의 마음으로 만든 초콜릿이라고 합니다. 그리고 성수지앵 초콜릿도 고품질의 재료를 사용하여 쇼콜라티에 1, 2급 자격증을 가지고 있는 조합원들이 만드는 초콜릿이라고 해요. 다음엔 초콜릿을 먹어봐야겠네요. 주문을 하면 이 펭수 컵을 같이 주십니다. 펭수 컵 안에 펭수 스티커도 들어있어요. 뉴욕에서도 펭하! 커피를 내려주는 펭수! 1층에서 주문을 하고 2층으로 올라갔어요. 펭수 생일맞이 화려하게 꾸며져 있는 성수동 카페 성수지앵 협동조합 2층. 노란색 풍선들과 함께 포토존도 마련되어 있어요. 타로점 보고 있는 펭수. 해변에 놀러 간 펭수까지, 커다란 펭수 인형들! 잠시 펭수 관람 타임! 직접 만든 뜨개 옷을 입고 있는 다양한 크기의 펭수들이 컨셉에 맞게 전시되어 있어요. 하얀 얼굴에 똥그란 눈, 노란색 입술이 귀여운 펭수입니다. 한 땀 한 땀 정성이 느껴지는 펭수를 볼 수 있는 펭아트전 이에요. 펭수도 보고 음료도 마시고 1석2조! 남편은 자몽에이드였나? 저는 달고나 밀크티를 마셨어요. 달고나 라테만 마시다가 달고나 밀크티는 처음 마셔봤는데 맛있네요. 큼직한 달고나를 아주 많이 넣어주셨어요. 달고나 많이 넣어주는 곳 좋아요. ㅋㅋ 귀여운 너츠타르트는 두 개 다 내가 먹음. ㅎ 펭수 덕분에 오랜만에 성수동 나들이 잘 다녀왔습니다. 다시 한번 펭수 생일 추카추카!! 돌아오는 길에 서울 앵무새도 지나왔어요. 줄이 아주 길더라구요. 성수동 핫플인가봐요. ㅎ 50m © NAVER Corp. 성수지앵협동조합 서울특별시 성동구 왕십리로 101 예약 #성수지앵협동조합 #성수지앵 #성수동카페 #성수동성수지앵협동조합 #펭아트전 #펭수생일 #성수지앵펭아트전 #펭수"
성수동 카페 감성만땅 색감이쁜 서울숲 근처 성수지앵,"안녕하세요~하벨입니다:) 재택 근무를 시작했더니 하루는 빠른데 한주는 느리게 가는듯한 2월이에요. 지난주말엔 뚝섬역에 가서 전시회 감상하고 왔는데요! 대기하는 시간이 있어서 그동안 어디가지 고민하다가 발견한 성수지앵이라는 성수동 카페에 갔어요~ 사실 원래 가기로 한곳을 못가서 지나가다 들린 건데 생각보다 분위기도 넘 좋고 색감도 이쁜게 제맘에 쏙 들더라구요! 일단 입구부터 신비로운 느낌이 납니다 ㅎㅎ 이 건물은 성수지앵협동조합?으로 여기 들어가도 되나? 하고 가까이 가봤더니 카페가 맞더라구요~ 여기는 서울숲역과 뚝섬역 사이에 있는 곳으로 서울숲 구경하다가 근처에 쉴 겸 이 카페 들리면 좋은 데이트 코스가 될듯해요~ 50m © NAVER Corp. 성수지앵협동조합 서울특별시 성동구 왕십리로 101 1층 주문하는 곳 들어가면 1층은 주문하는 카운터가 나옵니다. 은근 따뜻한 컬러감으로 조명을 장식해놔서 느낌이 좋았어요. 여기서 음료를 주문한 뒤 2층에 가면 된다고해요. (이 시간에 자리가 있는지 몰라서 저흰 우선 위층에서 자리확인하고 다시 내려왔었어요) 성수지앵 메뉴판 이날 좀 추웠어서 둘다 따뜻한 음료를 고르기로 했죠! 전 늘 그랬듯 녹차라떼(5000원)를, 남친은 바닐라라떼(4500원)를 픽해줬어요~ 메뉴판은 인터넷에 나와있는 가격은 좀 더 높은데 제가 위에 올린 게 현시점이라 더 정확할 거에요! 가격은 다른 서울숲 근처 카페들에 비해 저렴한 편이였습니다 ㅎㅎ 또 기본메뉴 외에 시즌메뉴도 있었는데요, 수제청딸기, 제주청귤, 딸기랑 청포도 에이드 등 좀 더 색다른 과일음료들이 이미지와 함께 나와있어요:) 좀만 안추웠으면 아이스로 저 음료들 먹었을텐데 아쉽네요ㅜㅜ 한편 밑에는 초콜릿선물상자, 당근케이크, 빵, 샌드위치, 쿠키 등 디저트도 보였습니다! 저흰 밥을 먹고온 터라 디저트는 패스~ 1층 내부 인테리어 음료 기다릴겸 1층 우측 창가에 있는 의자에서 잠시 앉아있기로 했어요. (1층은 이자리와 문옆에 하나, 또 계단 앞에 하나 이렇게 3군데에 자리가 있습니다.) 창가쪽 자리엔 작은 소품이 있었는데 나중에 음료 나오면 찍어야겠다 생각했죠 ㅎㅎ 한 10분 정도 지나니 음료 두잔이 바로 나왔어요! 매장에서 먹고가서 잔인줄 알았는데 ㅜㅜ 종이컵인건 좀 아쉬웠지만 컵홀더가 감각적인 디자인이라 사진 잘나오겠다~하며 소품활용해 찍어줬어요 ㅎㅎ 홀더에 적힌 기호? 모양은 이 성수동 카페 가게 이름인 성수지앵 초성을 따서 만든듯 했습니다 ㅎㅎ 색감을 잘 활용한 게 매력적이였어요! 2층 내부 인테리어 계단을 이용해 올라가면 문이 좌우 두개 있는데요, 오른쪽 문을 열고 들어가면 단체석이 나오고 그 왼쪽으로 나가면 이렇게 일자형 테이블이 나옵니다. 창문에 색감을 입혀서 되게 감각적이고 느낌 있는 분위기더라구요! 은은한 조명에 분위기도 고요해서 공부나 노트북하러 가기도 좋아보였어요~! 창문 맞은편은 이런 형태의 자리가 두군데 있어요, 위쪽에 은은한 조명이 비추기 때문에 커플끼리 나란히 앉아 오순도순 얘기할 수 있겠고 여기에 앉아서 사진을 찍어도 좋을 것 같았습니다. 처음 계단을 올라와서 왼쪽 문을 열면 이 공간이 나와요! (물론 다 연결되있어서 어디로 들어가든 상관없지만요) 아까 창쪽이 일자테이블이라 불편했다면 창색감은 그대로 즐기면서 마주보며 대화할 수 있는 이쪽 테이블에 자리를 잡아주세요~ 저희는 창가쪽에 앉았다가 이곳이 자리가 났길래 냉큼 여기로 가주었어요!! 보니까 의자나 꾸며논 것도 좀 더 특별하고 색감 이쁜 액자, 레온사인도 있는 게 여기가 명당인 것 같더라구요 ㅎㅎ 이건 창쪽에서 찍은 사진이에요! 보라색~파랑색 색감이 되게 힙한 느낌이에요. (바깥이 도로라서 좀 아쉽지만) 그 밖에 비친 풍경도 좋았으면 이 성수동 카페는 아마 핫플로 엄청 유명했겠다! 싶었답니다. 녹차라떼와 바닐라라떼 한편 저희가 주문했던 음료 리뷰를 해보자면 우선 녹차라떼는 일반적인 녹라맛이였어요~ 따뜻하고 부드러운 우유맛이 주를 이뤘고 쓴맛없이 살짝 달달함이 첨가된 녹차맛이 났죠! 다음으로 바닐라라떼는 조금 특이했는데 일단 굉장히 달달했어요~~ 흔히 먹는 커피맛이 설탕이라면 여긴 흑설탕느낌이랄까요? 좀 색다른 느낌의 바닐라라떼맛이였답니다 ㅎㅎ 단체석 이건 음료 다 마시고 나오기 전, 단체석 방에서 찍은 사진이에요! 6명정도의 인원이 앉아서 담소나눌 수 있는 테이블이 마련되어 있어요! 이때 전시회 알람이 울려서 후다닥 가느라 더 못찍었는데 ㅜㅜ 이 성수지앵은 5시쯤 사람이 없어서 여유롭게 사진 찍을 수 있으니 시간대 맞춰서 방문하시는 걸 추천드릴게요! 가장 맘에 들었던 인테리어로 이 성수동 카페 후기를 마무리할게요~ 우연히 발견한 곳인데 은근 분위기 좋고 색감도 이뻐서 조용히 쉬어갈 수 있었어요 ㅎㅎ 대화하기 좋은 장소였습니다! 다음엔 여기 갔다가 방문했던 전시회 후기도 적어볼게요! 감사합니다:)"
"성수 아이와 가기 좋은 전시가 있는 카페, 성수지앵협동조합","오늘은 특별한 전시가 있어서 어린이집 땡땡이치는 날이에요. 점심까지만 먹고 후다닥 하원하여 전시가 있는 성수지앵 카페로 향합니다. 50m © NAVER Corp. 성수지앵협동조합 서울특별시 성동구 왕십리로 101 예약 성수지앵협동조합은 2호선 뚝섬역에서 도보로 5분 정도 거리에 있어요. 서울 성동구 왕십리로 101 매일 10:00 - 21:00 070-4156-7500 주차, 단체, 무선 인터넷, 놀이방 이용 가능. 내부로 들어가니 쇼룸에 디저트가 보여요. (재이니는 벌써 초콜릿을 하나 뚝딱) 카페 성수지앵이라고 쓰여있어요. 1층에서 주문 후 2층에서 편안하게 커피를 즐길 수 있어요. 키오스크로 주문하려다가 직접 주문했어요. 둘 다 주문 가능해요. 성수지앵 카페는, 성수동 도시재생 사업의 일환으로 탄생한 성수지앵 협동조합의 보금자리라고 해요. 1층, 2층 카페부터 레고블럭 대여, 공유 주방, 서울숲 어르신들 경로당까지 다양한 공간을 제공한다고 해요. 주문 후 카페를 둘러보니 캘리그래피 전시가 보입니다. 재이니가 순삭 한 초콜릿이에요. ㅎㅎ 주문 후 2층으로 가는 길에 또 다른 작품들도 있어요. 이번 캘리그래피 전시는 애미의 외숙모가 활동하시는 온통 캘리그래피 모임에서 하시는 거였어요. 함께 2층으로 올라가는 계단이에요. 성수지앵 카페에는 엘리베이터도 있어서 휠체어나 유아차도 접근이 좋아요. 당신은 좋게 사랑스럽게 유일하게 창조된 존재입니다. 또 다른 공간에도 작품들이 있어요. 작품 하나하나 좋은 글귀들이 마음을 따듯하게 하네요. 사랑 2층으로 올라오니 넓은 공간이 있어요. 휠체어나 유아차도 불편함 없이 지날 수 있어요. 단체석을 피해 조그마한 테이블 자리로 갑니다. 안쪽에 전시된 애미의 외숙모 작품들이에요. 작은 텃밭에 글씨 한 점, 그림 한 점, 짧은 시 한 점, 심어 놓습니다. 잠시 쉬어가도 좋습니다. 당신의 마음에 작은 씨알이 되겠습니다. 라는 의미의 '씨알(CR)'이라는 필명으로 캘리그래피 수업도 하시고 봉사도 많이 하시는 애미의 외숙모에요. 만날 때마다 좋은 말씀도 많이 해주시고, 마음 따듯하신 분이에요. https://instagram.com/youngme1656?igshid=OGQ5ZDc2ODk2ZA== 조영미(@youngme1656) • Instagram 사진 및 동영상 팔로워 1,008명, 팔로잉 902명, 게시물 435개 - 조영미(@youngme1656)님의 Instagram 사진 및 동영상 보기 instagram.com 사랑은 모든 걸 이겨내요. 언제나 네 옆에 있을게 우리 잠시 쉬어가요. 완벽하지 않아도 괜찮아 함께여서 행복해요 정답이 아니어도 괜찮다. 성수지앵과 잘 어울리는 전시에요. 언제나 네 곁에 있을게 그들이 별을 보고 매우 크게 기뻐하고 기뻐하더라 작품을 구경하는 사이 주문한 메뉴들이 나왔어요. 본인이 고른 당근 케이크를 보고 신이 난 재이니에요. 당근 케이크의 당근만 먹고 끝낸 건 비밀. 새로 산 목도린데 머리에 하더니 좋아합니다. 분명 목도린데 왜 어울리는 거죠? ㅋㅋㅋ 오늘도 달려달려 재생 2 좋아요 0  오늘도 달려달려 성수지앵 카페 옆에는 무대도 있었어요. 평소에는 버스킹도 하고 이런저런 행사도 많이 한다는데 이날은 유난히 춥기도 하고 공사 중이라 아무런 행사가 없어요 ㅠ_ㅠ 그래도 신나게 뛰어노는 재이니에요 ㅎㅎ 태어나 추위를 몇 번 마주하지 못한 3세 재이니는 겨울이 너무 춥습니다. 춥춥 서울숲 방문이나 뮤지컬 관람 후 아이와 조용히 편안한 공간을 원하시면 성수지앵 카페를 추천해요. 재이니는 놀 거리를 가져가서 놀이방 이용은 안 했지만 수시로 이런저런 전시도 하고 놀이방도 이용 가능하니 편안하게 아이와 방문하기 좋은 것 같아요. 지하철 창밖 풍경이 아름다운 날이에요. 퇴근 시간 이전에 후다닥 집으로 향합니다. 오늘도 알차게 보낸 하루입니다^^*"
성수동 성수지앵 공부하기 좋은 까페12월 서울 무료 전시회 추천,"성수동 데이트코스 12월 무료 전시 추천 성수지앵협동조합 : 도심 속 작은 갤러리 Copyright ©️ INA All rights reserved 한 해가 다 가기 전 부지런히 이번 달 전시회를 찾아서 다니고 있어요 특히 요즘에는 유료 전시 만큼이나 간단히 둘러보기 좋은 무료 전시들도 많아 사부작 사부작 다녀온 따끈따끈한 생생 후기들을 이웃님들에게 소개해요! #성수놀거리 #서울숲놀거리 #이번달전시회 기본정보 50m © NAVER Corp. 성수지앵협동조합 서울특별시 성동구 왕십리로 101 예약 운영시간 매일 10:00~21:00 비용 관람료 무료 아메리카노 4,000 원 주차 1 대 가능, 장애인 주차 구역으로 주차 시 1층 까페에 문의 요망 성수지앵 주차 특이사항 현재 유아시설(놀이방) 이용불가, 반려동물 동반 가능 나눔공유센터 소개 성수지앵협동조합 은 2015년부터 시작된 성수 도시재생사업의 결과물로 만들어진 성수 도시재생 CRC (Community Regeneration Cooporation) 기업이에요 나눔공유센터 는 2020년 4월부터 현재까지 운영 중에 있고, 카페 외에도 블록방(유아놀이시설), 공유주방, 파티룸, 경로당 등을 이용할 수 있어요 최근에는 성수지앵 까페 2호점까지 확장했다고 하니 더 기대가 되었던! 내부시설 소개 카운터 및 TAKE-OUT 전용 무인 키오스크 커피(음료) 는 카운터에서 주문하시거나 TAKE OUT 인 경우, 무인 키오스크도 이용 가능해요 TAKE-OUT 전용 무인 키오스크 화면 대략적인 커피 가격은 위의 화면을 참고해주시고 (약 4~5000 원 대), 매장 / 포장 가격 차이는 없었어요 1층 내부공간 테이블 위 조그만 트리 하나만으로도 크리스마스 분위기 물씬이네요! 슈퍼포지션 Superposition 전시회를 알리는 귀여운 고양이 포스터도 붙어 있어요 슈퍼포지션 전시회 포스터 두근 반 세근 반 기대를 갖고 12월 성수동 무료전시 슈퍼포지션 보러 2층으로 go go! 엘리베이터 이용도 가능 하니 유모차도 문제 없겠죠? 2층 까페 곳곳에 그림들이 전시되어 있고 각자 자유롭게 공부하거나 친구들 연인들과 함께 담소를 나누고 있었던 저만 #성수동까페 하면 패션피플들만 와서 사진 몇 장 찍고 호다닥 가야될 것 같은 편견? 부담이 있나요? 성수지앵은 오히려 조용하기 공부하거나 작업하기 좋아 카공족들에게 안성맞춤인 까페 같았어요 무엇보다 wifi 는 물론 각 테이블 마다 usb 포트 2개, 콘센트 1 개 가 마련되어 있어 콘센트 자리 눈치게임 할 필요 전혀 없음 게다가 다양한 예술작품을 무료로 감상할 수 있는 전시공간까지 딱 제 개인 공유오피스로 삼고 싶을 만큼 일하기 좋은 분위기 였어요 참고로, 화장실은 비장애인과 장애인이 함께 사용하는 곳으로 비장애인 또한 해당 화장실을 사용 가능해요. 남자화장실(좌) 여자화장실(우) 로 엘리베이터를 사이에 두고 나뉘어져 있음 슈퍼포지션 전시 소개 다채로운 색감과 예쁜 그림체가 인상적이었던 슈퍼포지션 Superposition 이웃님들을 위해 한 컷 한 컷 정성 가득 담아왔어요 잠깐 함께 감상해볼까요? 그림체 너무 예쁘지 않나요? 마침 이 그림으로 제작된 무료스티커가 있어 어머 이건 먹어야챙겨야 해! 눈 뒤집혔던 여러분 커피도 마시고 전시도 보고 스티커까지 챙겨가세요 한 동안 눈을 뗄 수 없었던 작품 중 하나 산과 달과 바다일까요? f 라는 친구가 남긴 전시 감상과 고양이 발바닥 스탬프가 귀여워요 저는 개인적으로 특히 문소 작가님의 그림체가 제 취향이라서 좋았어요 #문소 #슈퍼포지션 #성수지앵x슈퍼포지션 사진 속 귀염뽀짝한 스티커는 자유롭게 가져갈 수 있어요 저도 하나씩 쟁였죠 후 굿즈도 얼마든지 구매 가능해요! Superposition 슈퍼포지션 뜻 이 궁금해서 국어로는 '중첩', 물리학에서는 둘 이상의 파동이 서로 만났을 때 새로 생기는 파동을 의미하기도 하고, 여기서는 신진/아마추어 미술 작가와 f&b 공간을 연결하여 작품 구매/대여 서비스를 제공하는 새로운 링크플랫폼 서비스를 말해요 해당 전시는 문소 작가님 외에도 배준호, 최재희, 김한비 작가님이 참여하여 다양한 그림들을 한 자리에서 볼 수 있는 것도 큰 장점이에요 8인 단체석 / 주 전시공간 시티팝 분위기 낭낭한 그림체가 딱 제 취향저격이었어요 집에 가져가고 싶었다는 메뉴 및 가격 (할인 꿀팁 포함) 성수지앵 까페 메뉴 아메리카노 4000원 까페라떼 4500원등 음료 주문 시 수제 초콜릿 1000원 제로페이 가능 성수지앵 카드(선불충전식 카드) 결제 시 10%할인, 조합원 20% 할인 (가입비 5 만원) 조합원+선불카드 30% 할인 + 가입비 5만원은 추후 회원 탈퇴 시 돌려준다 고 하니 근처 직장 또는 학교를 다니는 학생이라면 조합원 가입하고 야무지게 할인 챙기세요! #한양대스터디까페추천 #한양대까페추천 성수지앵 초콜릿 성수지앵 초콜릿 은 공장에서 대량생산된 일반 초콜릿과 달리 쇼콜라티에 자격증을 소지한 조합원이 직접 한땀 한땀 정성들여 만든 수제초콜릿으로 방부제를 넣지 않고 만들었다니 우리 아이들도 마음 놓고 먹일 수 있겠죠? 성수동 수제화 산업을 모티브로 다양한 수제화 모양이라는 점도 참 흥미로웠어요 총평 서울숲 성수동 12월 무료전시 를 찾고 있다면 커피 한 잔 가격으로 가볍게 둘러보기 좋아 성수동 필수 데이트코스 로 추천해요 서울숲 뚝섬역 지하철은 물론 121번 등 성동구민체육센터 버스정류장 바로 앞 에 위치하여 접근성이 일단 좋음 개인적으로는 혼자 조용하게 작업하기 위해 공유오피스나 스터디까페 등을 주로 방문하기 때문에 스터디까페 월 평균 이용금액과 비교할 경우, 성수지앵 : 2800원*30일=84000원 타 스터디까페 : 5000원*30일=150000원 44% 저렴한 금액 (조합원 가입, 선불카드 이용 시 기준) 이니 성수 일하기 좋은 카페 로도 추천 좋아요 백개! #한양대스카추천 #한양대공부하기좋은까페 + 점심시간을 제외하고 음악 소리도 그렇게 크게 틀지 않아 집중하기 최적이었어요 다만, 유아놀이방은 현재 이용불가하오니 이웃맘들은 이용 시 참고해주세요. 이 글은 리뷰노트를 통하여 본 업체에서 제품 또는 서비스를 제공받아 작성된 글입니다"
