title,content
[Tenne - 테니] 유럽 감성 가득한 성수동 신상카페,#성수동테니 성수동 신상카페로 유럽 감성 가득한 카페입니다! 더 추워지기전에 테니 테라스에서 브런치 먹고 싶었는데 먹게 돼서 기분이 너무 좋고 분위기도 좋네요♡ #메뉴판 빵도 맛있는 거 같고 보틀와인도 판매하네요 빵 오픈이나 마감시간 할인도 해주는 거 같아요 햇빛 너무 좋잖아~~~~~~ෆ⃛ 오랜만에 브런치 먹어서 기분이 너무 좋았어요 저희는 시그니처 메뉴인 @슈림프 아보카도 샌드위치 @삭슈카&브레드 주문했습니당 두 음식 다 맛있었어요 특히 삭슈카가 너무 맛있어요 시그니처 메뉴 꼭 드셔보세요 내부도 예뻐요! 이제 추워서 테라스는 포기해야할거 같아요~~~~ 남은 빵들은 포장 분위기도 좋고 맛도 좋고 다음에 또 올거 같아요! 테니 Tenne 서울특별시 성동구 뚝섬로17가길 55 1층
[성수테니]성수동핫플/성수테니/성수동카페/퀸아망맛집,#성수동카페 중에 지난 겨울에 첫 방문해서 세 번이나 다시 간 #성수테니 💚 #성수동핫플 #테니 를 처음 갔을때가 12월이어서 이렇게 외관에 크리스마스리스 장식이🎄 오 센스있는데?! 싶었던 ㅎㅎㅎ #성수동카페 #테니카페 의 추천디저트 는 퀸아망이라고 해서 2개를 주문해보았다 ㅋㅋㅋ 바삭바삭 달달한 식감은 맛없없!🤭 #성수역테니 의 내부 곳곳은 넘예라 포토존이 이렇게나 많다 두 번째로 방문했을 때는 평일 낮이라 베이커리류가 더 다양하고 많이 남아있었다 오예~~~ #성수동빵집 아우라도 느껴지는게 퀸아망만 유명한 줄 알았는데 뉴욕롤까지.. #테니카페 의 메뉴판 참고하깅💘 #성수역카페 #테니카페 는 #성수디저트카페 답게 종류가 너무 많아 고르는 재미가 쏠쏠해 ㅎㅎㅎ 퀸아망 종류도 많아여 내부는 화이트톤의 넓직한 개방감이 있어 넘 좋더라눙💘 내부에서 안으로 들어가면 이런 공간이 또 나오고 아늑하면서 분위기 좋은 숨은 공간이 또 나온당 ㅎㅎ 테이블 자리자리 모두가 넘 운치 있는거 아니냐며.. 테니는 계산할 때 테이블 번호를 미리 말씀드리면 알아서 가져다 주신당 넘 조은데~~~~? ㅎㅎㅎ 디카페인아메도 가능해서 디카페인아아메랑 아메2장으로 시킴 #테니카페 는 테라스 자리도 있어서 날 좋을 때 테라스조온습을 느끼기에도 안성맞춤🌿 날 따뜻해지면 테니로 #성수동테라스 즐기러 와야디~~~~🤣😁
"내돈내산 > 성수동 브런치 , 베이커리카페 테니 Tenne","안녕하세용 지옹이에용😉 주말에 성수동 신상카페 테니 다녀왔어요!ㅎㅎ 분위기도 너무 좋고 음식도 너무 맛있었던 테니 리뷰 🫶🏻 베이커리카페 Tenne 테니 ⏰영업시간 평일 8:00~ 주말 10:00~21:30 (라스트 오더 20시) 주차는 앞에 자리가 있길래 임시주차했는데 정식 주차장은 아닌듯! 2자리정도 주차공간은 있다! 카운터가 3군데 있는데 가장 안쪽에서 주문 해야한다 ㅎㅎ 성격급해서 들어가자마자 주문외쳤다가 직원들 눈초리삼^^ (살짝 불친저,,ㄹ) 어쨌든 안쪽에 빵 쇼케이스와 디저트 쇼케이스가 있는데 생각보다 다양하게 준비되어 있고 하나같이 다 맛잇어보였다 👉🏻샌드위치 , 음식 , 음료 메뉴판 샌드위치 종류도 많고 와인도 팔고 스프도 팔고!! 베이커리뿐 아니라 브런치메뉴도 판매한다니! 👍🏻 아침을 못먹은 저와 일행은 샌드위치를 주문! 크로와상 햄치즈 샌드위치 아보카도쉬림프샌드위치 크로와상샌드위치는 만들어져있어서 바로 나오는데, 아보카도 쉬림프샌드위치는 10-15분소요 된다 안내받음 주말이라 주문이 밀렸는지 20분정도 걸렸당 일행이 먹은 크로와상햄치즈샌드위치는 만들어져있는건데 그래도 맛있다고 한당 크로와상이 바삭바삭! 아보카도쉬림프샌드위치 깜빠뉴위에 쉬림프, 아보카도 , 치즈가 들어간 샌드위치 였는데 소스가 약간 매콤하기도 하면서 느끼하기도 하면서(?) 취향저격❤️❤️ 같이 나온 당근라페도 맛잇엇다!! 들고 먹기는 어려워서 (한조각 먹다가 내용물 우당탕함..) 차라리 잘라먹는걸 추천..! 나도 한조각은 들고 먹고 (우당탕) 한조각은 조각으로 잘라서 먹으니 오히려 더 맛있어👍🏻 쉬림프아보카도샌드위치 야외테라스에서 먹다가 화장실 가려고 들어왔다가 본 실내,, 아니....내부 인테리어 너무 이뿌당🫣❤️ 화장실도 너무 깔끔하고 안쪽 자리도 넓고 쾌적!! 이 비밀 자리는 서늘한날 앉으면 너무 좋을거같다😉 다음엔 아늑한 비밀자리에 앉아야지🫶🏻 밖에서 봄 테느 ! 주말 점심쯤 방문이라 웨이팅아닌 웨이팅 대란이 있긴했지만 피크시간만 지나면 여유롭게 즐길수 있을거같다!! 총평 + 깔끔한 인테리어와 넓은 공간 + 다양한 베이커리 와 음식 + 지옹 TIP 쉬림프아보카도샌드위치 🫶🏻 + 야외 테이블에서 사진 찍으면 이쁘게 나옴🫡 -주차공간 없음! -카운터 못찾으면 눈초리받음😅 아침부터 운영하는 브런치카페 #테니 성수동카페 찾으신다면 추천함미당🙌 50m © NAVER Corp. 테니 Tenne 서울특별시 성동구 뚝섬로17가길 55 1층 #뚝섬카페 #성수동카페 #성수동핫플 #카페추천 #카페투어 #성수동신상카페 #테니"
성수동 테니 사람들 ㅎㄷㄷ많아요!+셀링클로젯 짱예쁜 자켓+일상,안녕하세요 큐예용:) 이번주도 잘 보내고 계신지요^^ 전 역시나 하루 시작을 미팅으로 하고있고요! 헤헤 싸일러 미팅 샌드위치가 있어서 너무 행복 ㅋㅋㅋㅋ 세일도 올렸고! 아 어제 밤에 괄사 세일도 추가했지용!! 사무실 털어서 세일올리는거에 맛들렸어요 ㅋㅋㅋㅋ 아시죠 오늘 바로 출고...ㅋㅋ http://www.qurade.com/ qurade.com JOIN US 회원가입시 현금처럼 사용가능한 포인트 지급! PHOTO REVIEW 포토리뷰 작성시 포인트를 적립해 드립니다! SALE 놓치지 마세요! 마지막 기회 Kakao TALK @큐레이드 am10:00 ~ pm6:00 실시간상담 가능 We hope that you enjoy your shopping today. Thank you! We hope that you enjoy your shopping today. Thank you! We hope that you enjoy your shopping today. Thank you! W... www.qurade.com 저는 모자를 좀 보온?기능으로 써서 가을부터 정말 많이 쓰는것같아요! 이거 생산했던 모잔데 생각해보면 이 모자 엄청 잘나갔었는데... Stay Silly라는 문구 아직도 너무 좋구용^^ 성수동 편집샵들 꾹이랑 시장조사도 다니고^^ 세상에 정말 많고 예쁜 브랜드들이 너무 많아서 내년에 정말 잘 해야겠다는 생각이 들어요... 꾸주히 엄청 준비 열심히 하고있어요^^ 그리고 너무 다녀서 꾹이랑 커피와 진~~한 달달구리^^ 앉아서도 계속 일얘기 멈출수 없는 우리..아이디어 폭발이고요^^ 쎈느에있던 약간 무섭지만 귀여웠던 인형 ㅋㅋㅋㅋ 그리고 바로 촬영 도와주러 한남동!!! 하 케익 참고 한입도 안먹었어요...대추오빠가 정말심각하게 얘기해서요....ㅋㅋㅋ ㅠㅠ 정말정말정말 예쁜 셀링클로젯 하운드 투스 자켓!!! 제가봐도 이건 너무예뻐요.. ㅋㅋㅋㅋㅋㅋ 이거 촬영 도와주러 갔지용^^ 울 30%라서 엄청 따뜻하긴한데 사실 지금 낮에 너무 더워서...더워요... ㅠㅋㅋㅋㅋㅋㅋ 다음주쯤부터 아~~주 잘입으실듯^^ 안감이 완전 예쁜 핑크라서 소매 겉으면 핑크가 삭 보여서 너무 예쁘더라구요!! 사진 잘찍었네 ㅋㅋㅋ SELLING CLOSET (blogpay.co.kr) HOUNDSTOOTH x PINK 자켓 sellingcloset.shop.blogpay.co.kr 오늘은 오전 내내 사무실에서 미팅하고 점심에 또 사무실 근처 나들이! ㅋㅋㅋ 성수동에 참 좋은곳이 많아요^^ 이곳은 뉴 핫플 테니!!와..근데 사람이 사람이...정말 많았어요 ㅋㅋ테라스는 만석이구요! 줄서서 주문... 공간이 워낙 넓어서 그런지 완전 안쪽에 자리 하나 있었구요! 사진은 나올때 찍은건데 1시 이후에 가면 그래도 앉을곳은 있을것같아요^^ 점심시간에는 정말 꽉차있었어요! 프렌치 토스트랑 샌드위치! 오전에 너무 미팅이 연달아 있어서 배고팠어서 흡입해서...사실 맛이 크게 기억이 나진 않아요...ㅋㅋㅋ 분명 맛있었던것같은데 이땐 뭘 먹어도 맛있다고 했을것 같기도 하고 ㅋㅋㅋㅋ 그리고 걸어오는길에 궁금했던 에르제! 도산에도 있는데 이상하게 앉을자리가 없으니 안가게 된다는 ㅠㅠㅠ 초코 깜빠뉴 꾹이 주려고 하나 사서 왔어용!!:) 그리고 또 공장투어하고 ㅋㅋㅋ 마지막 스케줄은 완성집!! 완성집은 옷에 말그대로 완성을 해 주는 곳이예용!! 단추까지 달아주는 집도 있고 이곳은 마지막 실밥정리+아이롱+검품+포장까지 해 주는곳이예요! 여기는 완전 백화점 들어가는 브랜드만 하는곳이라서 좀 단가 비싼 납품되는 옷들은 여기서 할려고용^^ 지하인데 이 물건 내리는 저...저거...아주 맘에 들어서 찍었어욬ㅋㅋㅋㅋㅋ 벌써 이번주 반이상 지나갔네용!! 모두모두 행복한 하루 보내시고 다시 올께용!!
[성수맛집] 힙플 성수동 <TENNE:테니> 에서 브런치를 먹을 땐 삭슈카로!!,"밀린 포스팅이 너~~무나 많아서 최대한 빠르게, 맘먹은 김에 부지런하게 올려봅시다!! 설 연휴 직전에 -진짜.. 이렇게 묵혀도 되는건가 싶지만 그러니까 더 묵히지 말아야지ㅎㅎ 데이뚜 겸 (?) 서울의 힙플! 힙플의 성지! 성수에 갔음 아침으로 브런치를 먹을 계획을 하고, 사실은 브런치를 먹을 계획으로 성수를 간 것에 가까움ㅋ 반쪽🌙님이 찾은 곳과 내가 찾은 곳(나는 왕십리였음) 중에 고민하다가 성수로 결정! 테니 : Tenne -평일(월-금) 8:00 - 21:30 / 주문마감 20시 -주말 ·공휴일 10:00 - 21:30 / 주문마감 20시 -주차는 성수AK밸리 - 시간당 3천원 크루아상 햄지즈 샌드위치 (8천원), 브리오슈 프렌치토스트 (1만6천원), 삭슈카&브레드 (1만8천원), 오늘의 수프 (8천원), 오늘의 파스타 (1만9천원), 라자냐 (2만원) 아메리카노 (5천원), 바닐라라떼 (6천5백원), 에이드 (7천원), 맥주 (7천5백원) 등 Next image 예전에 성수를 돌아다니다 '신발세일' 이라는 현수막에 홀려 들어갔더니 왠 빵과 음료만 한가득이라 '성수는 카페에서 수제화도 파나?' 하고 어리둥절한 채 나왔던 바로 그 곳이아닌가요?ㅋㅋㅋㅋㅋㅋ 이렇게 마주치게 되어 너무나 반갑고요?! 그런데 심지어 여기가 성수 브런치 맛집이었다니! 카페라고 하긴 하지만, 카페라고만 부르기에는 메뉴가 상당히 본격적인 편이라 브런치집...브런치카페라고.... 그럼 결국 카페인건 똑같은건가?! ㅋㅋㅋㅋㅋㅋㅋㅋㅋㅋㅋㅋㅋ 내부도 넓고, 테라스가 있는게 인상적인 카페였음 사진에서는 빠졌지만, 테라스 옆에 붙은 아래 두번째 사진 안쪽으로 들어가면 다시 공간이 나오게 되서 실내 공간이 생각보다 진짜 넓은 편이다 게다가 테라스 좌석도 이용 가능하다 난로를 피워주시는 것 같다 내가 갔던 때는 사람이 몰리기 전이고, 날이 추워서 그런지 다들 테라스를 기피해서 난로를 피울 준비만 하고 난로를 피우진 않았다 (장작을 정리함) -이때가 1월 한파가 왔던 다음날 이었음. 눈 많이오고 도로 결빙으로 교통사고 엄청 많이 났던 당시 나는 프렌치토스트를 먹고 싶어서 찾아 간 것이라 브리오슈 프렌치토스트(1만6천원) + 삭슈카&브레드 (1만8천원) + 라임민크에이드(7천원) = 4만 1천원 이렇게 주문해서 먹었음 원래 반쪽🌙님은 파스타를 먹으려고 갔는데 토마토베이스 파스타가 없었다...ㅠ 그렇게 자세히 메뉴를 보고가지를 않았더니 그래서 고민하다가 삭슈카로 변경했다 개취로 브리오슈 프렌치토스트는 다음에 다시 먹을 지 잘 모르겠음 브리오슈 빵 자체가 버터가 많이 들어가서 부들부들하고, 단 맛이 나는게 특징이기 때문에 프렌치토스트로 만들때 확실히 계란물도 더 잘 입혀지고, 부들부들한 식감이 확 살아나는 부분은 좋았다 그런데 계란... 계란 특유의 냄새가 좀...ㅠ 식빵 안쪽까지 계란물을 적신 후 다 익히지 못해서 그런건지 어떤 부분에서 계란 냄새가 있었다 냄새에 민감하고, 비위가 약한 편이라 나는 반숙조차 먹지 않아서 그 계란 특유의 향이 거슬렸고 그 부분은 반쪽🌙님이 먹음. 우리 것만 좀 불 조절이 잘 안된건지 어떤 부분은 타고, 안쪽은 계란냄새가 나고.. 계란 냄새가 안 나는, 잘 익은 부분은 맛있었다 시럽에 시나몬 향이 상당히 강하게 나는데 문제는 시나몬 향도 별로 .... 반쪽🌙님 말에 따르면 시럽을 듬뿍 찍으면 계란 향이 덮힌다고 하는데 둘다 별로라서 솔직히 프렌치토스트는 안 먹을 듯 =_= 오해하면 안 되는 부분이 편식이 있는 내 취향에 안 맞다는 것이지, 맛이 없다는건 아니다 맛은 있는데 계란냄새나 강한 시나몬 향이 싫어서 안먹겠다는 것 -나는 카푸치노도 잘 안마시는게 카푸치노에 시나몬 뿌리는게 싫어서임. 그런 맥락에서 식혜는 마셔도, 수정과는 안마심. 계피향이 싫어서 위에 올려준 믹스드베리 청도 달달하니 맛있었다 솔직히 이거 덕분에 시나몬향과 계란을 버티고 한 그릇 다 비운거다 그리고 여기는 삭슈카 맛집임 무쇠 후라이팬에 삭슈카 한그릇과 빵이 나오는데 일단 토마토 소스때문에 이게 나오면 냄새부터가 어마어마 하다 맛있는 냄새, 식욕을 마구마구 자극하는 새콤한 냄새가 뿜뿜한다 빵은 9조각이 나왔는데 -왜 애매하게 9... 2인기준이 아니라 홀수인가 빵에 삭슈카를 쓱 찍어?발라? 먹으면 진짜...ㅠㅠ 빵이 진짜 고소하고, 부드러우면서 담백하니 맛있다 그냥 빵만 먹어도 맛있고, 삭슈카와 함께 먹어도 맛있음 이 빵이 뭐였는지 모르겠는데 삭슈카와 함께 나오는 빵만 사갈까 잠시 고민도 했을 정도 ㅋ 🔎삭슈카 토마토 소스에 야채와 계란을 넣어 만든 스튜. 오스만 제국에서 기원하여 북아프리카에서 발전된 요리로 세계 각지로 퍼진 북아프리계 유대인에 의해 영미권으로 이동하였다. '에그인헬' 이라는 이름으로 알려져있다. 팬 하나로 조리할 수 있는 간단한 요리고, 빵을 곁들여 함께 먹는다 오스만 제국에서 (현재의 튀르키예 / 구, 터키) 만들어져서 중동쪽 요리라고 하는듯하다. 라임민트에이드도 나름 잘한 결정이었다 깔끔하게 탄산+민트가 마무리를 지어줬음 성수에 브런치 먹으러 오면, <테니>에서는 꼭 삭슈카를 먹으리 ㅎㅎ 50m © NAVER Corp. 테니 서울특별시 성동구 뚝섬로17가길 55 1층 예약 #성수동맛집 #성수맛집 #성수카페 #성수브런치 #성수브런치카페 #성수브런치맛집 #성수테니 #카페테니 #tenne #삭슈카 #서울삭슈카 #에그인헬 #서울에그인헬 #성수삭슈카 #서울데이트 #성수데이트 #데이트맛집"
유럽 감성 한가득 성수동 카페 테니,"안녕하세요'◡' 랭이소입니다. 이번 포스팅은 서울 맛집 2탄!! 성수동 유럽 감성 가득한 카페☕ ""테니"" 입니다. ୨୧ 위치: 서울특별시 성동구 뚝섬로17가길 55 1층 ୨୧ 영업시간: (월~목) 08:00~21:30,(금~일, 공휴일) 10:00~20:30 ※ 마지막 주문-20:00 ୨୧ 전화번호: 0507-1341-3094 ୨୧ 가게 앞 잠시 정차는 가능하지만, 주차시설🚗 없어요 50m © NAVER Corp. 테니 서울특별시 성동구 뚝섬로17가길 55 1층 예약 미스디올 전시&팝업 장소인 플라츠2와 가까이에 있는 카페를 열심히 찾아보다가 랭이소의 레이더망에 걸린 곳이에요. 외부 테라스입니다. 도로변에 있는 듯한 느낌이 약간 들지만 파리 생제르맹에 있을법한 멋스러운 카페예요. 입구입니다. 화이트 외관에 주황색 포인트의 컬러 매치가 세련되면서도 깔끔해요. 여기도 평일 주말 없이 웨이팅이 기본!! 하지만 저흰 평일에다가 방문시간이 4시 반이라서 어중간한 시간이었는지 웨이팅 없이 착석 가능했어요. 아, 매장 이용 시 직원분이 안내를 해주세요. 자리를 안내받은 후, 주문할 수 있습니다. 자리를 잡고 주문을 하러 가면서 매장 내부를 구경했습니다. 실내가 꽤 넓어요. 화이트톤에 우드 또는 대리석 테이블로 인테리어가 고풍스럽고 굉장히 세련돼 보여요. 메뉴판이라고 찍었는데 지금 보니깐 디너메뉴입니다. 하하하 초보 블로거는 이렇습니다. 주문 순서를 기다리면서 빵을 구경했어요. 퀸아망, 크루아상, 소금빵, 휘낭시에, 바게트, 브리오슈 슈크레 등 각종 빵들이 유리 케이스 안에 진열되어 있구요. 밀푀유, 생크림 케이크, 파리브레스트 등 케이크류도 다양하게 있어요. 주문을 하고, 다시 자리로 돌아왔어요. 여긴 주문 시 테이블 번호를 직원분에게 알려주면 직접 가져다주십니다. 저기 문 너머에 있는 자리도 너무 예쁜데 구경만 했습니다. 평소 같았음 여기저기 구경하고 날뛰었을 텐데 말이죠. 저어기... 성수-뚝섬-서울숲 생각보다 거리가 있는 거 맞죠? 암것도 몰랐던 프로 지방러는 여길 몇 번 왔다리갔다리 하다 보니 이미 체력이 바닥이 난 상태였거든요💧 5분 정도 지났을까요? 직원분이 주문한 음료와 빵을 가져다주셨어요. 사과 슬러시 7,500원 참외 아이스티 7,000원 피넛버터 스트로베리 롤 4,500원 소품 하나하나 갬성이 흘러넘칩니다 아주!! 여기서 사진 한번 찍기 위해 남은 힘을 다해 들고 가서 찍었어요. 사진 결과물을 보고!! 이날의 랭이소를 스스로 칭찬했습니다. 잘해써!!! 흐뭇'◡' 참외 아이스티는 제가 알던 참외 맛이 이게 맞나? 싶었어요. 주문이 잘못 들어갔나? 의구심마저 들었어요. 단 맛이 강한 허브티 맛이었어요. 남친이 주문한 사과 슬러시는 시원시원 달달하고 재료 본연의 맛을 느낄 수 있었어요. 피넛버터 스트로베리 뉴욕롤은 겉은 생각보다 덜 바삭하고 촉촉했어요. 속은 상상한 그대로 엄청 촉촉해서 식감이 부드러웠어요. 피넛버터와 딸기잼이 빵과 잘 어우러져 정말 맛있었습니다. 데코로 있는 핑크색 초코는 스트로베리 맛🍓입니다. 마지막으로 고풍스러운 벽거울에서 인증샷을 찍고 나왔습니다. ""테니"" 역시 너도 성수동 핫플이었어. 햇살 좋은 날, 파리지앵처럼 브런치나 커피를 즐기고 싶으신 분은 한번 방문해 보는 건 어떠세요? ⓒ2023. 랭이소 all rights reserved."
성수동 카페 [테니 Tenne],"테니 Tenne 서울 성동구 뚝섬로17가길 55 1층 성수역 3번출구에서 583m 영업시간 월~금 08:00 ~ 21:30 토~일 10:00 ~ 21:30 20:00 라스트오더 0507-1341-3094 반려동물 동반, 여/남 화장실 구분 밥을 먹었으면 커피와 디저트는 필수잖아요? 원래 계획했던 카페는 테니는 아니었는데 가려던 카페가 생각보다 매장이 너무 작고 테이블끼리 너무 붙어있어서 ㅠㅠ 가는 길에 봐뒀던 테니로 계획 변경.ᐟ 매장 내부는 만석이어서 제대로 찍지는 못했어요ㅜㅜ 위 사진 속 테이블 외에도 자리가 더 있었어요.ᐟ.ᐟ 그중 제일 앉고 싶은 자리는 역시 테라스였지만 만석에다가 테이블석 앉으려고 대기하시는 분들도 많아서 저희는 그냥 안쪽 자리에 앉았답니다 성수동 왜 이렇게 핫해 .. ? 매장에 디저트 종류가 정말 많아용 배만 안 불렀다면 잔뜩 먹을 수 있는데.ᐟ.ᐟ 배가 너무 불러서 아이스 아메리카노, 아이스 라테, 시나몬 퀸아망 주문! 진동벨 받고 조금 기다리니 금방 나왔어요 시나몬 퀸아망 짱맛 .. 시나몬 조아조아 매장 분위기도 예쁘고 디저트도 커피도 맛있는데 조금 아쉬운 건 매장 크기에 비해 화장실이 작더라구요 다음엔 테라스 자리를 노려보는 걸로 - ! 50m © NAVER Corp. 테니 Tenne 서울특별시 성동구 뚝섬로17가길 55 1층"
성수 브런치카페 테니 TENNE 성수동 핫플 테라스카페,"성수 브런치카페 소개해요. 베이커리 종류도 많고 테라스가 예쁜, 왠지 청담에 있을 법한 인테리어 핫플인데요. 어떻게 테니 카페에 가게 되었냐면요. 디올뷰티 팝업 미스디올 전시회 보고 나오니까 3시정도였거든요. 이 시각이 딱 브레이크타임 이라 근처 성수동 식당들은 식사가 안되더라구요. 12시 반 예약된 전시 본다구 아침부터 준비하고 밥 못먹고 나왔더니 배가 너무 고팠는데 말이지요ㅜㅜ 미스디올 전시회 디올뷰티 팝업스토어 예약링크 루프탑 카페 증정품 정보 미스디올 전시회 기간 2023년 5월 5일~2023년 6월 4일 사전 예약 링크 조금 아래 전시 비용 무료 여성들이 ... m.blog.naver.com 언니랑 공주놀이 하는 하루에 의상도 그렇고 왠지 브런치가 땡겼는데 성수 플라츠2 전시장 주변 가는 곳마다 브레이크타임 이라는거예요ㅜㅜ 그러다 찾은 곳 성수 테니 카페 입니당. 전시장이었던 플라츠2 에서 20만원 이상 화장품 사고 루프탑 카페 이용하긴 했었는데 (무슨 얘긴지는 위의 미스디올 전시회 포스팅 클릭) 음료랑 밥배는 다른거잖아용?🤭 게다가 거리도 걸어서 2분이니까 엄청 가까웠어요. TENNE CAFE 주소📍 서울시 성동구 성수동2가 271-7 전화☎️ 0507-1341-3094 #테니영업시간 카페 영업시간🕰 매일 8:00-21:30 브런치메뉴 11:00-16:00 브레이크타임 16:00-17:00 (베이커리, 카페 이용 가능) 디너 17:00-20:00 이뿌죵? 유럽 감성 인테리어. 인스타에서는 이미 핫플이더라구용. 겉만 보고 그냥 베이커리 카페인줄 알았는데 네이버지도 보니까 식사메뉴도 있길래 찾아갔어용. 밖에 테라스자리 사람들이 가득해요. 더워진 날씨에도 테라스엔 웨이팅 있나봐요. 저희는 너무 덥고 지쳐서 무조건 시원한 에어컨 실내자리 앉았어요ㅋㅋㅋ 미스디올 전시회 다녀오신 분들 많이 보여요ㅋ.ㅋ 입장할때 채워주는 팔찌가 있거든용 일단 베이커리 메뉴 못지나치죵 레몬롤 부터 폭파시키고요. 뉴욕롤이라고 베이커리 카페 메뉴에서 핫한 페스츄리 빵종류인데 레몬롤은 페스트리 롤 겉은 상콤한 레몬코팅 안은 커스타드 크림이었어요. Next image 테니브런치메뉴 테니 카페는 3시 30분쯤 도착했는데, 브레이크타임이 다른 식당보다 30분~1시간 늦고 브런치 식사가 가능했어요. 요기 될만한 브런치 메뉴로 주문했어요. 머쉬룸 리조또 삭슈카 & 브레드 (에그 인 헬) 삭슈카 메뉴는 처음 접해보는데 특이하더라구요. 토마토 스튜에 계란을 넣어 익혀서 빵이랑 같이 먹으면 되는데요. 개인적으로는 🤔🤔🤔🤔🤔 머쉬룸 리조또는 트러플 향이 나고 크림없이도 맛있었는데 조금 짰어용. 테니 오기전에 땀많이 흘려서 염분 섭취하니 좋았지만용😝 성수베이커리카페 테니 분위기 맛집으로 인정! 50m © NAVER Corp. 테니 서울특별시 성동구 뚝섬로17가길 55 1층 예약"
