title,content
성수동 신상카페 | 아우프글렛 호텔 트러플 베로와상 (이미 핫플 빵집),"OO야 지금 어디야? 우리 오늘 만나기로 했잖아! 언니의 전화를 받고 나는 얼음이 되었다. 0_0 이상하다 화요일이 약속한 날짜인줄 알았는데 아니었다니...! 이번주였다니. 요즘 정신이 가출한 나는 서둘러 옷을 챙겨입고 약속장소로 향했다. 우리는 기대 이상이었던 전시 하나를 보고 핑크 플로이드 노래가 이렇게 멋있었구나 서로 감탄했다. 몇년만에 만난 그녀는 그저 멋있어 보였다! ㅎㅎ 일가를 이뤄가는 모든 인간은 다 멋지다! 1층. 2층이 카페공간 우리는 전시를 보고 젊은이들의 성지 성수동으로 갔다 성수 신상카페인 아우프글렛으로 나를 인도해준 그녀. 이런 곳, 이런 분위기 정말 너무 오랫만이었다. ㅎㅎ 위치는 2호선 뚝섬역 근처! 성수동 신상카페 + 맛있는 빵천국 트러플 베이글이 있는 아우프글렛 성수 ▪️위치 | 서울시 성동구 왕십리로10길 9-2 2호선 뚝섬역 5번출구서 5분이 안걸리는 거리. ▪️주차 | 주차장이 있지만 몇대 안된다고 하니 근처 서울숲비즈포레 주차장이나 (1시간 기준 6,000원) 좀 더 저렴한 성동체육센터 부설주차장 이용권장. ▪️영업시간 | 오전 11시반 - 오후 8시반 ▪️메뉴및 가격대 | 커피. 티. 에이드. 미니케익. 크로플과 맛있는 빵들 3,500원 - 14,000원 사이의 가격대 빵 두개, 세개 고르다 보면 금액 커짐 주의 ▪️주변 갈만한 곳 & 데이트 코스 추천 | - 매력적인 문구점 포인트오브뷰 - 빈티지 가구전문점 사무엘스몰즈 - 맛있는 솥밥 솔솥 100m © NAVER Corp. 아우프글렛호텔 카페 서울특별시 성동구 왕십리로10길 9-2 samuelsmalls 서울특별시 성동구 연무장5가길 25 SKV1 tower B107 예약 솔솥 성수점 서울특별시 성동구 연무장5가길 24 솔솥 성수점 POINT of VIEW SEOUL 서울특별시 성동구 연무장길 18 1,2,3층 이름은 호텔이지만 진짜 호텔은 아님 주의. ㅎㅎ ▪️음료메뉴는 아래사진 참조. 언니도 나도 라떼파. 타일바닥 귀엽다. 공간은 좁고 긴 형태였다. 오픈한지 며칠 안된 신상카페라 그런지 역시나 사람들이 많았다. ’ .̮ ‘ 출처 : Eyesmag 사이트 아우프글렛 성수의 시그니처 빵 베로와상을 먹어보았다 베이글 + 크루와상 = 베로와상 냉장쇼케이스에 실험적?으로 보이는 미니케익들과 베린, 잼등이 진열되어 있었다. 우리는 빵을 고르고 2층으로 올라갔다. 그러고 보니 1층엔 자리가 없었던 것 같다. 2층 3층이 카페 공간이고 지하에 빵공장?이 있다고 함. 3층엔 굿즈도 판매하는 것 같다. 2층 올라가는 길에 인상적이던 사진작품 아우프글렛 매장을 이번에 처음 가 본거라 다른 매장도 이런 향기가 나는 지는 잘 모르겠다. 공간에서 너무 맘에 드는 향기가 났다. 물어 본다는 걸 깜빡했네. 매장의 시그니쳐 향인가보다. 뭐랄까 샌달우드 + 묵직한 뭔가인데... 더 이상의 설명은 생략한다 0_0 ㅎㅎ 열심히 사진부터 찍는 나 가장 안쪽에 화장실과 넓은 좌석이 있고 창가쪽으로 매우 좁은 바테이블이 있다. 너무 좁아서 신선하기 까지 함...!!! 날씬하다면 이 자리는 바로 당신자리! ㅎㅎ 그 옆으로는 두명이 앉을 수 있는 테이블이 주르륵 놓여져 있는데 고정형 가구였다. 그래서 더 깔끔하긴 했다. 예쁜 거울. 그 거울 앞에서 사진. 맛있는 빵에 감탄하면서 몇년간 못다한 이야기를 나누었다 0_0 정말 맛있었다... 빵... 좌 크랜베리 초코 바게트. 우 후추듬뿍 크림바게트 하나하나 다 최고의 맛이었다. 0_0 글 쓰는 중에도 다시 먹으러 가고싶다... 우리가 주문한 건 - 크랜베리 다크 바게트 (안에 초코랑 크랜베리 토핑) - 후추 듬뿍 + 치즈가 들어간 바게트 - 트러플 베로아상(두가지 맛이 있는듯?) - 포카치아 슬라이스 햄 올라간거 이름이 정확치 않음에 주의 ㅎㅎ 전화통화중인 언니를 그려본다. 그녀를 응원해 본다. 나도 스스로 잘 해보자 다짐해 본다. 그나저나 여기, 가족과 또 가고싶다. 후추듬뿍 바게뜨랑 베이글 먹으러 0_0 다음에 또 가자. 성수 신상카페 | 아우프글렛 호텔 트러플 베이글 (이미 핫플?) 재생 12 좋아요 0 00:00 00:13  성수 신상카페 | 아우프글렛 호텔 트러플 베이글 (이미 핫플?) 50m © NAVER Corp. 호텔 아우프글렛 성수점 서울특별시 성동구 왕십리로10길 9-2 #성수동카페 #성수동신상카페 #신상카페 #베이글카페 #아우프글렛 #트러플베이글 #크로플 #크랜베리다크바게트 #성수빵집 #맛있는빵집 #성수동데이트 #베로와상 #aufglet #몬킴"
[성수]성수동 신상카페_호텔 아우프글렛 성수점,"성수동에 아우프글렛이 생겼다🖤 이번 카페 컨셉은 호텔 느낌으로 오픈했다 한 건물이 다 카페인줄 알았지만 1층에서 주문하고 2층만 이용 가능한데 자리가 매우 협소했었다 컨셉 제대로다🖤 포카치아, 바게트, 베로와상 등 빵들이 생각보다 다양해서 뭐 먹을지 한참 골랐습니다만,,🤤 궁금했던 베로와상 무조건 담고 아아 두잔 주문! 1층 공간이 너무 이뻐서 열심히 사진 찍어보고 귀여운 네모 케이크들 탐나지만 가격이 창렬이라 참았다....ㅎ 저 작은 케이크가 만원이라뇨 아이스 아메리카노 (5.0) 베로와상 코코넛 크림 (6.0) 더블 베이컨 치즈 바게트 (7.5) 꺅 이집이 빵 맛집이라던데요 베로와상은 말해뭐해,, 크림이 너무 많지 않을까 걱정했지만 너무 맛있구요 바게트는 맛있었는데 넘 질겨서 잘라먹기 힘들었다 이쁜 것도 좋지만 컷팅 해주셨으면 좋겠다ㅠ 하지만 세상 맛있게 먹음😋 살짝 기대 안했는데 생각보다 빵들이 맛있어서 놀랬다 아우프글렛 크로플을 참 좋아하는데 지점마다 모두 생기는건 아니여서 아쉽다 하지만 시그니처인 베로와상도 꽤나 맛있어서 먹으러 또 방문할 듯! 먹는데 빨대보고 킹받음을 계속 표현하는 칭구ㅋㅋㅋㅋ 빨대가 짧아서 환경을 위한건가싶었지만 먹기 불편해서 빨대 없이 먹는게 더 편했다 제발 바꿔주세요... 통창이지만 뷰가 좋진않고 매장이 매우 작아서 주말엔 절대 못올 것 같다 2층 입구에 큰 거울도 있는데 민망해서 거울 앞에서 사진 못찍은 둘이요ㅎㅎ 마감시간이 20:30 으로 생각보다 빨리 나와야한다는 점, 생각보다 빵이 맛있어서 다른 빵들도 궁금하지만 자리가 너무 협소하다는 단점 그래도 시그니처 빵인 베로와상 먹으러 한번쯤 방문해보세요🥐🤎 50m © NAVER Corp. 호텔 아우프글렛 성수점 서울특별시 성동구 왕십리로10길 9-2 뚝섬역에서 조금 더 가까우니 참고하세요~!"
성수동 모던한 호텔 감성 카페🏩 아우프글렛,"※이 글은 2023년 6월에 방문하여 작성한 글입니다. 뚝섬 / 성수 베로와상을 주력으로 판매하는 베이커리 카페 호텔 아우프글렛 hotel aufglet seongsu 뚝섬역 아우프글렛 영업시간 매일 11:30 - 20:30 뚝섬역 아우프글렛 위치 / 인스타 호텔 아우프글렛 성수점 서울특별시 성동구 왕십리로10길 9-2 AUFGLET(@aufglet) • Instagram 사진 및 동영상 팔로워 28K명, 팔로잉 1명, 게시물 1,542개 - AUFGLET(@aufglet)님의 Instagram 사진 및 동영상 보기 www.instagram.com 유명 크로플 전문점이 새롭게 런칭한 카페 아우프글렛 성수점. 크로플 유행 시초자로 유명했던 아우프글렛이 성수동에 새롭게 자리를 잡으면서 크로플 이외에 다른 디저트를 선보인다고 해서 사람들의 이목을 집중시킨 곳이기도 했다 성수 아우프글렛 재생 7 좋아요 0  접기/펴기 성수 아우프글렛 베이글과 크로와상을 혼합해 만든 베로와상을 중점으로 포카치아나 소세지 바게트 등 여러 베이커리 류를 판매중이었던 아우프글렛. 이전 아우프글렛은 크로플과 커피메뉴들의 비중을 반반으로 둔 느낌이었는데 새로 오픈한 호텔 아우프글렛은 커피나 음료보다 베이커리에 더 비중이 쏠린 느낌이었다 빵 종류는 창가 쪽으로 일렬로 배치되어 있었고 크림이 들어가 있는 케익이나 디저트는 따로 냉장고에 보관되어 있었다 성수동 카페이고 유명 카페인 만큼 가격대도 일반 빵집보다 높은 편. 인기가 많은 카페였기 때문에 주말 오픈런 하는 사람들도 많았다 오픈 시간 전까지 10명 정도의 손님들이 줄을 선 후 들어갔던 것 같다 취식 가능한 본격적인 공간은 2층으로 올라가면 나온다 아우프 글렛의 이전 공간처럼 호텔 아우프글렛은 블랙 인테리어의 모던한 감성을 유지했고 공간은 작은 편이지만 착석가능한 좌석이 많았다 하지만 협소한 공간에 많은 인원을 수용할 수 있는 만큼 좌석 간격이 좁아서 답답히긴 했던 것 같다 매장 안에서 먹고 갈 사람들은 시그니처 베로와상을 커피나 음료와 함께 먹고가도 좋을 듯 하다 실제로 먹고 가는 사람들도 많았지만 나처럼 포장해 가는 사람들도 굉장히 많았음. 빵이 목적인 사람들은 포장하는 것도 추천! 나는 베로와상 아몬드크림(5,500won), 베로와상 오렌지 & 초콜릿 앙글레이즈(6,000won), 할라피뇨 소시지스틱을 포장! 베로와상 아몬드크림만 먹어봤는데 겉바속촉 느낌에 베이글보다는 크로와상 느낌이 강했던 빵이었다 안에 크림은 고소한 스타일이라 생각보다 담백하고 느끼하지 않아서 괜찮았다 70~80년대의 호텔을 컨셉으로 한 카페 아우프글렛 성수. 크로플 전문점에서 베로와상까지 다양한 디저트를 경험해볼 수 있는 곳으로 성수동 놀러가면 한 번 쯤 방문해볼만 했고 사람이 많아 너무 혼잡하면 나처럼 포장하는 것도 권유하고 싶다!"
"성수동 카페/ 호텔 아우프글렛 성수점 하겐다즈 콜라보 디저트, 햄치즈 베로와상 후기","성수동 카페 중 디저트, 빵 맛집 많은데요 서울숲~성수 사이 골목에 정말 맛있는 빵과 디저트를 파는 호텔 아우프글렛에 찾아왔습니다! ""마이 리틀 피스타치오 트리"" 아우프글렛과 하겐다즈가 만나 피스타치오 디저트 컬렉션들을 선보인다고 해요 이벤트 기간은 11.10 - 12.10 50m © NAVER Corp. 아우프글렛 성수 서울특별시 성동구 왕십리로10길 9-2 아우프글렛 성수에서 크리스마스를 맞아 하겐다즈와 콜라보를 했더라구요 하겐다즈 피스타치오 디저트를 만날 수 있었습니다 크리스마스 트리도 크게 놔서 카페 앞이 완전 분위기 좋은 포토스팟이예요 아우프글렛 성수는 1층 로비 2층 라운지 3층 오피스 호텔 컨셉으로 지어놨더라구요 성수 카페 아우프글렛 1층입니다. 우산, 커피컵 등 굿즈를 구경 할 수 있어요. 마들렌, 휘낭시에 등 구움과자류 한개에 3,500원 정도! 바게트, 페스츄리, 앙버터 아우프글렛 시그니처 베로와상까지 여러 종류의 빵을 팔고 있어요. 제일 눈에 띄는건 케이크류더라구요 네모네모한 큐브 모양의 케이크들이 특이해서 눈에 띄어요 하겐다즈 X 아우프글렛 콜라보 디저트 3종입니다. 왼쪽부터 피스타츠오 트리 파르페 아이스 피스타치오 베로와상 피스타치오 플레이팅 디저트 입니다. 아우프글렛 성수에서는 카페메뉴도 판매하고있어요. 저는 피스타치오 플레이팅 디저트와 햄치즈 베로와상 주문! 2층 에 자리잡았습니다. 카페 테이블이 좀 좁아서 불편했지만 감성은 있어요. 호텔 라운지 같은 느낌. 트레이 두개 놓으면 꽉차는.. 테이블도 좀 흔들려서 불안해요 쏟지않게 조심!! 아우프글렛 X 하겐다즈의 시즌 메뉴 1가지와 아우프글렛 클래식 디저트 2가지 이상 구매 후 스탬프 쿠폰 완료시 기프트 세트를 증정한다고 해요 우선 아우프글렛 하겐다즈 콜라보 디저트 피스타치오 플레이팅 디저트입니다. 요 작은게 7,500원 이라는 사실 하겐다즈 피스타치오 아이스크림 밑에 사브레 브루통, 피스타치오 소스가 깔려있어요. 사브레 브루통은 견과류맛이 나서 고소하고 딱딱한듯 바삭해서 아이스크림과 잘 어울렸어요. 피스타치오 화이트 초콜릿까지. 하겐다즈 좋아하시는 분이면 강추 디저트 친구가 먹고 극찬한 햄치즈 베로와상. 살짝 짭짤하면서 위에 뿌려진 깨가 고소함. 페스츄리류라 바사삭 한 식감에 버터까지 발려있어서 정말 맛있음 샤인머스켓 에이드 6,500원 너무 달지않은 에이드였어요. 싸구려스러운 맛이 아닌 진짜 신선한 청포도 향이 느껴졌음. 아우프글렛 성수 솔직 후기 베로와상이 시그니처던데 다른 종류의 베로와상도 먹고싶을만큼 맛있는 빵을 파는 카페..! 재방문의사 100% 분위기도 좋고 음료도 맛있다. 성수 분위기 좋고 맛있는 빵을 파는 카페 찾으신다면 추천드립니다."
"성수동카페,호텔아우프글렛,프롤라,성수동 산책,핫플구경 :)",50m © NAVER Corp. 호텔 아우프글렛 성수점 서울특별시 성동구 왕십리로10길 9-2 얼마전 오픈했다는 곧 핫플이 될 호텔아우프글렛 :) 꽃이 있는 카페는 언제나 좋아🤍 베이글과 크로와상이 만난 베로와상 무슨맛일까?! 엘베에서 한컷 :) 내부엔 자리가 없을만큼 사람들이 많아서 사진은 요정도 예쁜 커피잔 :) 사실 이날 좀 늦어서 친구가 먼저 주문해주었다 동글동글 귀엽네? 무슨맛일까 궁금했는데 바삭바삭한 식감과 안쪽엔 크림들이! 다음에 올땐 다른 디저트들도 먹어봐야겠다 :) 50m © NAVER Corp. 프롤라 서울특별시 성동구 연무장17길 5 1층 예약 다음에 들린곳은 프롤라 작고 귀여운 에스프레소바 일록달록 카페내부 :) 에스프레소 종류가 꽤 많은데 내가 주문한건 4.레오파드 이름처럼 초콜릿이 콕콕 박혀있다 ㅎㅎ 친구는 커피를 많이 마셨다며 패션푸룻소다 살짝 출출해서 함께 주문해본 브리다파니니 비건메뉴인듯한데 친구가 지난번에 맛있게먹었다며 추천해주었다 야채(?)를 좋아한다면 맛있을듯 아!배부르다 하며 시작된 산책 귀여운 성수동의이모저모고모 ㅋㅋ 50m © NAVER Corp. 누데이크 성수점 서울특별시 성동구 성수이로7길 26 1층 예약 누데이크 성수 안살거면서그냥 한번 들어가봄 ㅎㅎ 이 케이크 인스타에서 많이 봤는데 실제로 보니 더 귀엽네?초를 붙여 만들다니! 정말 기발하다!! 무슨 하나의 작품같아 :) 하늘이 너무 맑았던 6월 맑은 하늘이 너무 그립다!!
성수동 뚝섬 핫플카페 '호텔 아우프글렛' 새로운 빵 베로와상,"성수뚝섬카페/빵지순례/베루와상 안녕하세요! 탈리입니다~ 오늘의 탈현생! 새로운 빵이 탄생했다! 바로 베로와상! 호텔 아우프글렛 성수 뚝섬 카페 다녀왔습니다~ 50m © NAVER Corp. 아우프글렛 성수 서울특별시 성동구 왕십리로10길 9-2 📌 성동구 왕십리로 10길 9-2 (뚝섬역 7번출구에서 3분거리) ⏰ 매일 11:30 ~ 20:30 📞 070-8858-0828 뚝섬역 7번출구에서 3분정도 걸어오면 나오는 카페 호텔 아우플글렛 입니다 완전 모던함의 끝판왕! 약간 제가 전에 포스팅 했었던 [건대입구역 카페 추천]12분의 미학 ""트웰브미닛"" - 맛있는 빵과 함께 즐기는 스페셜티 커피 트웰브미닛 건대입구역 건대카페 / 건대카페추천 / 크루아상맛집 위치: 광진구 아차산로 33길 68 영업시간:... blog.naver.com 건대에 있는 트웰브미닛이라는 카페와 느낌이 비슷했습니다 완전 깔끔하고 깨끗하고! 마치 호텔에 들어가는 듯한 느낌! 입구에서부터 베로와상을 홍보하고 있는데 베로와상... 처음들어보시죠? 저도 이날 처음 들어 봤어요! 베이글+크루아상의 합성어라고 합니다! 최근에 런베뮤에 빠져서 베이글을 엄청 좋아하는데 색다른 베이글이라고 하니 기대감이 뿜뿜 했어요!! 카페 호텔 아우프글렛은 총 4층으로 되어있지만 1층에서 주문하고 2층에서 먹을 수 있는 공간으로 되어있어요 지하랑 3층은 신경안쓰셔도 됩니다~ 카페 아우프글렛은 신기한 구조로 되어있는데 1층, 2층 둘다 직사각형의 구조로 되어있어요! 다양한 구운쿠키류들도 있습니다! 마들렌, 휘낭시에등 맛있어 보이는 쿠키들이 많았어요 특히 휘낭시에는 특이한 것들이 많더라구요!!! 그리고 다양한 빵종류도 준비되어 있어요! 빵지순례로 요즘 핫한 카페라고 하더니 정말 모든 빵들이 다 먹음직 스럽게 생겼어요... 어쩜... 요즘은 빵들이 왜케 좋을까요....?하하하 식빵같은 종류도있고 바게트에 크림종류를 넣은 빵들도 있고 치아바타빵등등 많은 종류가 있었어요 그리고 푸딩 종류도 있었어요!!! (요즘 사진이 이상하게 찍혀서.... 폰을 바꾸든가 해야겠어요... ㅜㅜㅜㅜ) 그리고 오늘의 하이라이트!!! 새로운 빵! 베로와상입니다!!!! 베이글 형태에 겉 빵 결이 크루아상 같아요!! 맛도 다양하게 준비되어 있습니다 기본, 시나몬, 햄치즈, 먹물 등등.. 아우프글렛의 음료 메뉴들입니다! 음료들은 평범한 것 같아요! 저와 엉공이는 빵 2개와 아아! 그리고 아이스초코를 시켰습니다~ 그전에 2층 부터 소개해 드릴께요오~ 호텔 아우프글렛이 요즘 핫한 카페로 유명해 지고 있어서 자리가 없을 때도 많다는... 저는 평일 5시쯤 어중간한 시간에 가서 그런지 널널 했습니다! 그래도 역시 핫플은 핫플인가 봐요... 하하하 생각보다는 엄청 넓지는 않아요!! 이제 드디어 궁금해 하실~ 짜잔~ 햄치즈 베로와상이랑 무화과 크림치즈 치아바타를 주문했습니다! 우선! 초코와 아아는 평범했어요! 뭐 엄청 맛있다는 아니고 마실만 하다~ 괜찮다~ 정도? 아아는 산미보다 고소한 맛이 강한 아아였습니다~ 무화과 크림치즈 치아바타! 크림치즈도 꽉차있고 무화과도 많이 들어가 있엇어요! 치아바타빵이랑 다 너무 잘어울렸어요! 살짝 빵이 딱딱한 느낌이 있긴 했는데 밸런스 있게 맛있는 빵이라고 생각 했습니다! 크림치즈랑 무화과를 좋아한다면 추천드려요오~ 드디어 베로와상~ 그중에서도 햄치즈 크루아상으로 골랐습니다! 런베뮤에서 포테이토베이글을 너무 맛있게 먹어서 이걸로 골랐어요 ㅋㅋㅋㅋ (런베뮤 사랑해...) 생각보다 베이글의 느낌보다는 크루아상의 맛이나 식감이 크더라구요! 그래도 겉은 바삭하고 속은 쫀득한 빵이었어요! 좀더 베이글의 느낌을 살릴 수 있었다면 더 좋을 것 같은 생각? 제가 개인적으로 요즘 베이글에 빠져서 그런 것 같아요 ㅋㅋㅋㅋㅋ (안에 들어가 있는 토핑들도 맛있고 잘 어울렸습니다) 그래도 상당히 맛있게 먹었습니다! 오늘도 역시나 깔끔하게~ 하하하 개인적으로 괜찮은 카페인 것 같습니다 깔끔한 인테리어도 너무 마음에 들고 빵들도 맛있었습니다 다음에 성수나 뚝섬에 온다면 또 들릴만 한 것 같아요!! 여러분들도 새로운 빵지순례를 할 곳이나 베로와상이 먹어보고 싶으시다면!!! AUFGLET(@aufglet) • Instagram 사진 및 동영상 팔로워 28K명, 팔로잉 1명, 게시물 1,564개 - AUFGLET(@aufglet)님의 Instagram 사진 및 동영상 보기 www.instagram.com 카페 호텔 아우프글렛으로 고고! 하세요~"
"성수동 디저트 맛집, 호텔 아우프글렛에 트리보고 빵먹으러 가요","점심에 진짜 가성비 쩌는 한식부페 먹었는데!! 칠천오백원에 메인이 두가지나 나오고 (제육볶음이랑 닭가슴살탕수육) 밥도 흑미밥 백미밥에 표고버섯밥, 계란볶음밥, 비벼 먹을 수 있는 무생채 열무김치 콩나물 배추겉절이, 상큼한 상추무침, 콩나물잡채, 시래기된장국, 양배추샐러드, 구운김 다 먹고 나면 후식으로 귤도 있었고 귤까지 다 먹고 나면 진짜 마지막 입가심으로 숭늉과 매실차가 준비되어 있었다 너무 가심비 쩌는 만족스런 식사 진차 좋았는데 간판 안찍어서 이름을 모름.. 대충 위치로 검색해도 안나옴... 대충 이런 너낌쓰... 근데 사진으로 보니깐 별로 맛없어 보이네ㅎㅎㅎㅎ 맛있었어용🤭 배 뚜들기며 흡족한 마음으로 돌아오다가 아우프글렛 앞에 트리가 예뻐서 사진 몇장 찍었는데 발걸음 멈춘 김에 빵구경이나 하자(는건 핑계ㅋㅋㅋㅋ)고 들어간 성수동 아우프글렛 예.. 구경만 하려고 했는데 피치 못하게 딱 두개만 샀어요.. 케잌마다 설명을 자세히 붙여 두셨는데 진짜 설명만 봐서는 무슨 맛일지 잘 상상이 안되는 그래서 궁금하고 먹어보고 싶은 케잌 한입꺼리밖에 안되는 크기에 가격은 넘나리 사악하지만 언젠가 한번은 맛을 봐주겠쒀..🥸 오늘 고심 끝에 고른 빵은 몽블랑이랑 츄러스 베로와상 베로와상이 베이글과 크루아상을 합친 말이란다 아우프글렛 크로플 유행시키더니 크루아상 가지고 열일하신다 증말.. 일반 크루아상보다 확실히 촉촉 쫠깃하긴 하드라 몽블랑은 구냥 겉은 파삭 속은 촉촉하고 쫙쫙 찢어지는 패스츄리, 그 다 아는데 맛있는 맛 아메리카노 땡기는 맛 담에 역꾸기 데려가서 다른 빵도 뿌셔야징 50m © NAVER Corp. 아우프글렛 성수 서울특별시 성동구 왕십리로10길 9-2 #성수동이름모를한식부페 #성수동트리맛집 #아우프글렛성수 #호텔아우프글렛 #베로와상 #성수동케잌맛집 #이거슨 #내돈내산"
베로와상이 있는 성수동 커피 맛집 호텔 아우프글렛 성수동,"성수동 커피 맛집 호텔 아우프글렛 성수동 HOTEL AUFGLET은 호텔의 친숙하고 편안한 느낌을 드리기 위해 'Good Morning, Good Afternoon, Good Evening. 이라는 슬로건으로 전개 됩니다. AUFGLET의 7번째 스토어 'HOTEL AUFGLET'의 공간은 시대를 더 거슬러올라 1970- 80년대의 호텔에서 영감을 얻었습니다. 공간에 활용된 가구들과 소재들은 마치 실제 호텔에 와있는 듯한 느낌을 연출하고자 하였습니다. B1F bäcker CUISINE 전체 플로어가 오직 베이킹 공간으로 구성됩니다. 6번째 매장으로 오픈했던 AUFGLET 도산점 ""backer의 확장형태로 독일어로 빵집 주인""이라는 뜻을 담고 있으며, 매일 아침 HOTEL AUFGLET의 backer team이 갓 구워진 다양한 베이커리와 디저트들을 준비하는 공간입니다. 1F LOBBY 1층은 로비 공간 겸 카페로 HOTEL AUFGLET의 다양한 베이커리와 디저트, 음료를 만나보실 수 있는 공간입니다. 2F LOUNGE 호텔 공간에 있는 카페처럼 큰 통창이 매력적인 공간으로 HOTEL AUFGLET 라운지에서 편안하게 앉아 여유를 즐기실 수 있도록 하였습니다. 3F OFFICE HOTEL AUFGLET의 오피스 공간 겸 AUFGLET의 색깔을 담아낸 굿즈들과 다양한 브랜드의 제품들로 구성한 HOTEL AUFGLET의 기프트 샵 입니다. 호텔 조식에서 볼 수 있는 접시 세트, 커피잔, 타월 그리고 우산, 서적 등 다양한 소품들을 HOTEL AUFGLET 오피스에서 만나보실 수 있습니다. (이하 아이즈매거진 ) 이런 조합은 누가 생각하나요? 크로플의 유행을 선도했던 카페 아우프글렛(AUFGLET)이 공개한 신메뉴가 또다시 화제다. 바로 베이글과 크루아상을 조합한 ‘베로와상’이 등장한 것. 울퉁불퉁 러프한 디테일, 수십개의 켜켜이 쌓인 레이어로 이루어진 베이글 속 다양한 플레이버를 품고 있다. 현재까지 공개된 정보에 의하면 두 가지 종류가 구성될 것으로 예상된다. 이와 더불어 장시간 발효를 거쳐 만든 고소하고 담백한 바게트도 함께 발표됐으며 전체 신메뉴는 모두 7번째 성수 스토어를 위한 메뉴라고. 새로운 전개를 알린 성수 스토어는 지하 1층부터 지상 3층까지 엄청난 규모로 베일을 벗을 예정이다. 못 말리는 빵순이라면, 6월 중순으로 예고된 업데이트 시기에 주목해 보길. 지금까지 공개된 모든 정보는 슬라이드에서. via eyesmag [네이버 지도] 아우프글렛 성수 서울 성동구 왕십리로10길 9-2 https://naver.me/50eJFR7C"
