title,content
성수동/구움과자/굴림,성수동 베이커리 카페 굴림 인스타에서 핫해서 한 번 가보고 싶었는데 성수동으로 이전했다는 피드 보고 벼르고 벼르다 방문 50m © NAVER Corp. 굴림 서울특별시 성동구 성수이로5길 1 1층 굴림 월요일 - 토요일 11:00 - 20:00 일요일 휴무 스티커가 귀엽다 포장에 붙여주시는데 느낌 있네 성수역에서는 조금 걸어야 한다 쭉 걸어오다 보면 통창으로 매장이 보이는데 작은 베이커리 카페라서 앉을 수 있는 자리가 많지 않다 ㅠㅠ 다행히 한 자리 있어서 의자 붙여서 셋이 앉음ㅋ𐨛 𐨛 𐨛 𐨛 매장이 베이커리 위주이다 보니 커피머신은 보이지 않았다 콜드브루로 아메리카노 또는 라떼 보틀 밀크티 밀크티를 마셔볼까 했는데 사장님이 향이 쎈 편이라고 하셔서 호불호가 있을 수 있다 해서 그냥 라떼 다음번엔 밀크티 마셔봐야지!!!! 보틀도 갬성있게 예뻤음ㅋㅎㅎ 영롱한 베이커리 비주얼 마들렌이 유명한데 맛도 다양하다 뭘 먹지 고민에 고민 조리빵 종류도 미쳤다 옥수수에그 꽈리고추햄치즈 바질토마토치즈 오후3시쯤 방문했는데 이미 품절인 메뉴도 있음 ㅠㅠ 크루아상도 맛있다 해서 무슨 크림으로 먹지 고민 바닐라냐 쑥이냐!!! 물 마시려는데 이 갬성 뭐죠 너무 예쁘다 ㅠㅠㅠㅠㅠㅠ 컵도 예쁜데 물병도 와.. 공간 자체가 예쁘다 느낌있네 플레이팅 소쿠리 같은데 받고 싶었는데ㅠㅠ 랜덤인가 보다 빵은 정말 최고 맛있음 구움과자 맛집이라더니 바나나 시나몬은 촉촉 달달 부드러운 식감이구 쑥 크루아상은 쑥 크림이 진하고 달달한데 페이스트리가 바삭하고 정말 완전 와 맛있네 이 말만 나옴 크루아상 그렇게 좋아하지 않는 나도 인정하는 빵 결에 크림까지 조화가 좋음 서양배는 배? 어울릴까? 했는데 완전 잘 어울림 정말 여기 페이스트리 맛집임 무슨 빵이 다 맛있냐 정말 이건 포장하고 싶은 마음이었는데 갈 때 보니 품절ㅋㅋ𐨛 𐨛 𐨛 𐨛 𐨛 다음엔 오픈런으로 가서 빵으로 브런치 하며 여유롭게 즐기고 오고 싶다
성수동 굴림,50m © NAVER Corp. 굴림 서울특별시 성동구 성수이로5길 1 1층 굴림 12월 31일 금요일에 찾은 성수동 카페 굴림 역에서 조금 멀다는 점.. 이 친구 많이 보네ㅎㅎ 겨울 다 가기 전까지 클쓰마스지 아직 크리스마스 한 발 남았다 반포 쪽에 있을 때부터 오고 싶었는데 멀어가지구 오기 힘들었는데 성수동으로 이전했다길래 설레서 방문했다💗 커피 메뉴는 이렇게! 디저트 스캔 마들렌 종류가 창의적이다 크루와상 메뉴 매대에 없는 건 품절된 것! 이제 보니 쑥 크루와상 탐난다 메뉴가 많이 없어서 재방문을 다짐하였다고 한다 선물 포장도 가능! 꽈리고추햄치즈(5.5) 뺑오쇼콜라(4.5) 포장하구 매장안에서는 아이스 아메리카노 피스타치오 마들렌 주문 퍽퍽한 마들렌 싫어하는데 촉촉하구 꾸덕한 마들렌이어서 내 스타일 포장해 온 크루와상은 남편이 맛있게 먹었다고 한다.. 담에 더 많이 사러 간다!~
굴림(feat.성수동 cafe),"카페 태그의 첫 글! 오늘 연휴 마지막 날 기념으로 성수동 카페투어를 했다. 오늘은 블로그 꼭 적어야지!라는 생각으로 사진도 여러장 찍어봤다. 첫 번째로 간 곳은 성수동2가에 있는 '굴림' 굴림(@goollimm)님이 Instagram을 사용 중입니다 팔로워 5,146명, 팔로잉 1명, 게시물 449개 - 굴림(@goollimm)님의 Instagram 사진 및 동영상 보기 www.instagram.com 운영시간은 11:00 ~ 20:00 매주 일요일이 정기휴뮤! 카메라 사고 싶게만드는 사진이네? 내가 오후3시 넘어서 갔는데... 생각보다 사람이 좀 있었다. 성수역에서도 꾀나 걸어야하는 거리인데, 요세는 SNS가 워낙 발달되어있다보니... 다들 잘 찾아서 다니시는 듯 싶다.. 여기도 이미 핫플인듯? 원래는 논현역쪽에 있다가 최근에 성수동으로 오신 듯 하다. 사진 뭔가 더럽게 못찍네ㅋㅋ아놔 입구에서 한 컷 찍어봤다. 안에 사람이 많아서... 최대한 사람 안나오게 찍으려다보니...(핑계 ㄴㄴ..) 하하하하하 주문 후 자리에 앉아서 한 컷! 매장 내부는 그렇게 크진 않다. 빵 종류는 매우 많다! 콜드브루와 바닐라크림크루아상 프릳츠 콜드브루를 쓴다고 한다. (나름 서치좀 해보고 감..ㅋㅋ) 기대하고 마셨는데~ 오우 부드러운게 GOOD이었다 필터커피를 자주 마셨는데... 콜드브루도 매력이 있구만... 그리고 나름 추천받고 먹어본 바닐라크림크루아상! 그렇게 달지도 않은 것이... 부드러운 것이... 맛있었다!! 콜드브루 라떼도 먹어보고 싶었다만... 다른 카페들도 돌아야하기에... 카페인 조절해야해서... 참았다...(칭찬한다잉?ㅋㅋ) 나와서 한 컷! 사장님은 매우 바빠보이셨다. 그래서 약간의 스몰토크를 좋아하는 나는... 그냥 조용히 있다가 나왔다. 다음에 도전?ㅋㅋ 굴림 그러고 보니 메뉴도 그렇고... 빵들도 좀 찍어볼걸... 아직 초보 블로거 틱 팍팍나네?ㅋㅋ 아무쪼록 이전 부터 가보고 싶었던 굴림. 만족 만족 다음에는 콜드부르 라떼 먹으로 와야지! 성수동이 참 핫한 곳이 많은 듯 싶다. 나는 어쩌다보니 성수동에 살게됐는데, 집을 구하고 난 후에야 여기가 이렇게 핫플인걸 알았다. 어쨋든...좋구만?ㅋㅋ 50m © NAVER Corp. 굴림 서울특별시 성동구 성수이로5길 1 1층 굴림"
"성수동 카페, 구움과자가 맛있는 굴림","처음 생길때부터 가봐야지 했는데 이제서야 가본 굴림 작지만 알차게 테이블 자리도 있고 안쪽에 베이킹 공간도 있다 테이블 좌석이 조금 불편해 보이지만 우드 특유의 따뜻한 느낌이 예쁜 곳 빵 종류를 한눈에 볼수 있게 진열되어 있고 주문하면 안에서 꺼내주신다 좋아하는 빵은 여기 다 있는듯! 안쪽 베이킹 공간 굴림 메뉴판 원두는 프릳츠 사용하신다고 표시되어 있다 (개인적으로 프릳츠 라떼 좋아함) 집앞이라 테이크아웃해서 먹었는데 사진이 없..? 사장님도 너무 친절하시고 빵도 맛있고, 까눌레 특히 추천! 종종 들르는 방앗간 같은 곳- 50m © NAVER Corp. 굴림 서울특별시 성동구 성수이로5길 1 1층 굴림"
성수동 빵집 [굴림] - 내 원픽 소개 추천까지 🤤🔥,안녕하세요 하늘입니다 :) 오늘은 성수동에 있는 빵집을 소개해드릴게요 학교 끝나자마자 달려온 이 곳 !! am.11:00 오픈 - pm. 20:00 마감 일요일 휴무 맛있는건 크게 봐야죠 🤭 굴림은 구움과자 맛집이에요 ㅎㅎㅎ 음료도 같이 팔지만 종류가 다양하진 않아요 !! 앉아서 먹을 공간도 아늑하게 있습니다 :) 저는 빠르게 포장하고 집으로 ㅎㅎㅎ 제가 사온건 바닐라크루아상 바나나시나몬 휘낭시에 까눌레 감태휘낭시에 🧡 아 여기 구움과자 맛집이에요 정말 .. 사랑해 .. 바나나시나몬 : 마들렌 왜이리 부드럽냐구 치아없어도 먹을 수 있는 빵 ㅋㅋ 저 크림 진짜 최고에요 ㅠ 휘낭이들도 버터리하고 맛있어요 ! 저 감태휘낭이도 진짜 매력적인 아이 .. 🤍 까눌레는 단면까지 😋 진짜 내가 먹어본 까눌레 중 원탑 -! 바닐라 크루아상도 단면까지 바닐라 맛이 진한편은 아니고 은은해요 !! 앉아서 먹고 가시는 분들은 팥바닐라아이스도 드셔보세요 ! 다들 엄청 맛있대서 저도 친구랑 조만간 먹으러 갈 예정 🤍 그리고 바나나시나몬이랑 까눌레 휘낭이들 !! 다들 드셔보세요 ㅎㅎㅎ 크루아상도 맛있었지만 구움과자가 진짜 최고에요 🤤
성수동 카페 굴림 후기,성수동 카페 후기입니당 음료 종류는 모든음료가 카페인이 함유되어있어요! 스티커가 너무 이쁘더라구요 아쉽게도 카페인을 멀리하고있어서 음료는 못마셨지만 디저트와 빵들 종류가 많아서 행복했어요 저는 레몬 글라세와 망고 코코넛 픽! 여러개 구매시 이렇게 포장도 해주신데요! 카페 디자인이 참 이뻐요 굴림카페에서 조금만 가면 나오는 한강에서 디저트시간을 갖었답니다 종류별로 글자로 적어주셨어요! 망고만 먼저먹었는데 세상 촉촉한 이맛! 안에 망고도 들어있어요 너무너무 맛있고 촉촉하더라구요 대만족!! 다른 디저트도 도전해봐야겠어요 만족도 : ⭐️⭐️⭐️⭐️ 50m © NAVER Corp. 굴림 서울특별시 성동구 성수이로5길 1 1층 굴림
"[맛집 끄적] 성수동 구움과자 디저트 맛집, <카페 굴림>","⭐️ 100% 내돈내산 후기! ⭐️ 안녕하세요! Chaetty 입니다! 이번에는 성수동 구움과자 카페 <굴림>에 갔다 왔답니다! 제가 먹은 메뉴 위주로 끄적여볼까 합니다 ㅎㅎ ※ 저는 평일 낮에 방문했습니다! 📌 카페 위치 입장샷이랑 내부 사진 또 못 찍었어요...ㅋㅋㅋ 왜냐하면 성수역 3번 출구에서 약 1km 걸어갔는데 꽤 걸려서 발이 아프더라구요😇 (위치 제대로 안 알아보고 가서 쌩고생 ㅋㅋㅋ) 뾰족플랫슈즈 신고갔는데 진짜 너무 힘들었어요 ㅋㅋ큐ㅠㅠ 성수역 3번 출구에서 거의 15-20분 정도 걸어가야해요! 저 거리 보이시나요..? 자차로 다니시는 분들은 상관없겠지만, 혹시 걸어가는 분들은 부디 운동화 신고 가시길☺️ 여러분의 발은 소중하니까요♡ 제 발 하나만 아팠으면 됐죠 뭐.. 📌 카페 도착! + 포토존(1) 50m © NAVER Corp. 굴림 서울특별시 성동구 성수이로5길 1 1층 굴림 드디어 카페에 입장!!!...하기에 앞서 포토존에서 찰칵!📸 누가 봐도 여기는 한 컷 찍으라고 그려놓은 포토존💗 발 아파도 포토존에서 사진 한 컷은 필수😉 (제대로 정리도 못해서 휘날리는 잔머리 좀 보세요 ㅋㅋㅋㅋ) 📌 포토존(2) 그리고 이 카페는 내부/외부로 공간이 나뉘어져 있는데요! 저는 그 날 날씨가 너어어무 좋아서 밖에 앉았어요 ㅎㅎ 테이블은 조그맣게 2개만 있어서 자리 선점하려면 운이 좋아야해요! (앉아 계시다가 저희가 밖을 둘러보니 곧 나갈거라고, 여기 앉으라고 자리 내어주신 우리 엄마 또래의 일행분! 복 받으실 거예요♡ 감사했습니다♡) 포토존 2222!! 무드등 아니고 자연등 맞습니다☺️ 굴림포스터가 붙어 있어서 이 아래 테이블에서 한 컷 또 찰칵👍🏻 이제 제가 먹은 메뉴를 소개해볼게요! 📌 메뉴 소개 참고로 여기 커피는 콜드브루 종류만 판매합니다! 저는 밀크티, 친구는 콜드브루 아메리카노 시켰어요! (밀크티는 귀여운 보틀에 담아주시고, 얼음컵은 따로 주셨어요!) 디저트 종류가 다양해서 직원분께 추천 부탁드렸는데요~ 사장님 추천 메뉴는! 1. 바닐라크림 크루아상 2. 꺄눌레 3. 바나나 시나몬 요렇게 3가지 추천해주셔서 3가지 다 시켰답니다 ㅋㅋㅋ 영롱한 저 냠냠이들을 보세요💗 결과를 먼저 말씀드리면 추천 메뉴 3가지 다 지~~~~인짜 완전 맛있었어요!! 강추강추!!👍🏻👍🏻👍🏻 (걸어오느라 발 아픈 것도 잊었음🤣🤣) 친구가 저한테 진실의 미간이 보인다고 했을 만큼 온 표정으로 맛있음을 표현했달까 ㅋㅋㅋ 바나나 시나몬 바나나 시나몬은 시나몬 빵에 바나나크림이 들어가있는 빵이었는데, 향긋한 시나몬 빵을 한 입 베어물면 달달~~한 바나나크림이 입 안을 싸-악 감싸는 촉촉한 빵이에요! 꺄눌레 다음은 꺄눌레! 저는 꺄눌레를 처음 먹어봤는데 처음에 반으로 자를 때 이게 과연 예쁘게 잘릴까 싶을 정도로 겉이 단단하더라구요! 근데 한 입 베어물면 파-삭! 하고 겉이 부서지는데 안은 고급 카스테라처럼 촉-촉해요! 겉 표면이 살짝 달콤쌉싸름해서 진짜 매력적인 맛이에요! 바닐라크림 크루아상 마지막으로 바닐라크림 크루아상! 사진처럼 크루아상 안에 크림이 듬-뿍 들어가 있고, 바닐라빈이 콕콕 들어가 있어서 바닐라향이 물씬 나는 맛있는 빵이에요! 📌 총평 ★★★★☆ 성수동에서 조용한 분위기의 맛있는 구움과자 카페를 찾는 분들에게 추천! 1. 좋은 점 - 디저트가 정~~말 맛있어요! 직원분이 추천하신 디저트 3가지 꼭 먹어보기! - 야외에도 조그맣지만 테이블이 마련되어 있어서 요즘 날씨에 즐기기 너무 좋아요! 2. 아쉬운 점 - 뚜벅이 분들은 성수역에서 15-20분 정도 걸어와야해서 성수역 부근에서만 시간 보내실 분들은 동선을 생각해보셔야 할 것 같아요! - 테이블이 많지는 않아서 주말에 오면 아마 자리가 없을 수도...? 3. 재방문의사 : 완전 ⭕️ (담엔 포장도 해오려구요👍🏻) 4. 참고사항 1) 주변에 공영주차장 있음 2) 일요일 휴무(월~토 / 11:00 ~ 20:00 운영) 3) 배달, 포장 가능 4) 노키즈존 5) 노트북 사용 금지 제 2번째 맛집끄적을 봐주신 분들 감사합니다 ㅎㅎ 다음에도 알찬 기록을 끄적해볼게요!💜"
성수동 구움과자점-굴림,"성수동에서 가보고 싶었던 굴림에 방문했다. 코너를 끼고 있었다. 짐을 많이 들고 갈수가 없는 상황이어서, 아쉽지만 마들렌 두개만 골랐다. 가장 많이 나가는 바나나시나몬 마들렌과 사장님께 추천받은 피스타치오 마들렌! 앞: 바나나시나몬마들렌 뒤: 피스타치오마들렌 바나나’시나몬’ 이니까 당연한 얘기겠지만, 시나몬 항이 상당히 셌다. 근데 나는.. 시나몬을 별로 안즐기나보다…? 안에는 바나나커스터드크림이 들어있어서 촉촉했다. 피스타치오마들렌 안에는 조금 더 되직한 양갱 느낌의 필링이 들어있었다. 약간 백앙금 같은 느낌? 개인적으로 바나나시나몬마들렌 안에 들어있었던 묽은 크림이 더 잘어울리는것같다. 조금 아쉽? 카운터 옆쪽으로 문을 열고 나가면 이런 공간이 펼쳐졌다. 날씨가 풀리면 여기 앉아도 좋을듯!! 코너를 돌아서 밖에서 본 모습. 비밀의 공간의 바깥쪽 면! 창고같은 느낌으로 연출해서 힙한 느낌이 든다. 매장 안은 많이 작은편이고, 5-6팀 정도 앉을수 있는것 같다. 숨겨져 있는 야외 공간에는 2팀! 다른 메뉴 먹어보러 한번 더 방문하고 싶은곳!! 마들렌류 뿐만 아니라 페스츄리 류를 먹어보고싶다🤪 50m © NAVER Corp. 굴림 서울특별시 성동구 성수이로5길 1 1층 굴림 #성수동 #성수동구운과자 #성수동빵집 #성수동카페 #성수카페 #성수동마들렌 #마들렌맛집 #구운과자맛집"
[성수주민피셜] 성수동 베이커리카페 “굴림”; 아담하고 조용함,"아빠랑 차타고 집가는 길에 보게된 빵집 아빠말로는 생긴지 쫌 됐다고 하는데 나는 처음 봤다..엄마도 아는거 보니 나만 몰랐었음 ㅎ 50m © NAVER Corp. 굴림 서울특별시 성동구 성수이로5길 1 1층 굴림 집에서 3분 거리이다! 개꿀! 운동끝나고 오는 길에 부스터샷 맞은 아버지께서 맛있는 빵이 드시고 싶다 하셔서…가서 샀다(아빠카드로)💵 “빵” 이 커다랗게 써있는 입간판보고 우리끼리는 “그 빵집~”이라고 불리던 곳… 정식 이름은 굴림!! (알고보니 논현동에서 꽤나 유명했던 곳인데 이곳으로 이전하셨다고 하는 블로그 글을 읽었다ㅎㅎ) 솔직히 뷰는 별로다^_^ 요기는 테라스자리!! 봄에는 좋을것 같지만 지금은 넘 춥다… 전체적으로 따뜻하고 아기자기한 느낌!! 하지만 ⭐️노키즈존, 노트북금지⭐️ 이니 나는 카페를 이용할 일은 없을듯 하다..보통 노트북 들고 카페를 가다보니.. 빵 종류는 카페보단 많지만 빵집보단 적은 그정도..!! 뒤에 주방에서 계속 만들고 계신듯하다 레몬…머시기랑 카라멜크럼블,바질토마토…랑 옥수수 에그? 그리고 밀크티 샀는데 총 2만원정도 나왔다!! 빵 맛이야 뭐..당연히 맛있다!! 부드럽고 다음에는 호박유자맛을 꼭 먹어보고싶다..! 아빠도 맛있다고 하셨지만 아빠 입에는 좀 달다고 하셨다ㅠㅠ(하지만 두개 드심) 사진은 아빠가 먹어버려서 없다^_^ 전체적으로 나중에 봄에 날씨 좋아지면 여기서 빵이랑 커피 사들고 한강으로 피크닉 가기 좋은!!! 딱 그런곳이다!! (한강으로 가는 굴다리까지 정말 2분컷이다..대신 성수역까지는 좀 멀다 걸어서 15분?20분?) 돈 많이 벌어서 먹고싶은거 다 먹고 살아야지…"
"성수동 나들이 / 하루필름, 성수 탐광, 카페 할아버지 공장, 베이커리 카페 굴림, point of view 소품샵, 성수 포인트오브뷰, 오르에르 아카이브, 구의역에서 홍대","내가 왜 포스팅 제목에 구의역에서 홍대를 넣었냐면.... 이따 나옴 🤦🏻‍♀️ ㅋㅋㅋㅋㅋㅋㅋㅋㅋ뽀로로 은이 졸귀ㅋㅋㅋㅋㅋㅋ❣️ 애들이랑 놀다가 늦은 점심 때 나가기로 ! 애기들 이모 가지말라고 ㅋㅋㅋㅋㅋㅋㅋㅋㅋ 문 막고 있엉ㅋㅋㅋㅋㅋㅋ 이모 갈거얏!! 설에 보자아~~💖❤️ 성수 왔다!! 나는 발길 닿는 대로 다녀서 그냥 정처없이 걷는 중~ 저기 [stetch] cafe 이따 갈까? 하면서 찍어 놓음 결국은 안갔다는거~ 걷다가 저번에 지호랑 왔다가 퇴짜 맞은 [탐광] 으로 옴! 오늘은 한다ㅠ_ㅠ 넘 조아 50m © NAVER Corp. 탐광 서울특별시 성동구 연무장5가길 26 간판을 못 찍었네 ! 아 어뜨캥 여행 온 기분ㅠ_ㅠ 행복행!!! 일본같아 ㅋㅋㅋㅋㅋ너무 가고싶다 우와 222라니 나의 행운의 숫자🤭💖 과연! 와!!!!! 비주얼이 미쳤음 와..... 너무 완벽한 이 오믈렛 오랜만이야ㅠㅠㅠㅠ 🍳🍚 재생 0 좋아요 0  🍳🍚 으악‼️‼️‼️ 간장 베이스 덮밥 이고만?! 기대이상으로 맛있음ㅠㅠ 와구와구 🤤 햄복한걸>.< 쿄쿄쿄😖💖 여기도 이쁘당 우와! 인스타에서 [할아버지 공장] 보고 너무 가보고 싶었는데 여기있다 !!! 원래 갈 생각 없었는데, 지도 보니까 완전 근처라 왔다 ‼️ 50m © NAVER Corp. 카페 할아버지공장 서울특별시 성동구 성수이로7가길 9 와... 입구부터 진짜 눈 돌아감 진심 👀 와 🤭 아 진짜 근래에 내가 가봤던 카페 중에 제일 이쁘다 혹시나 해서 2층있나? 싶었는데 있었어ㅠㅠㅠㅠㅠ 와ㅠㅠ 진짜 미술관 같다 이 안의 공간도 예뻤는데 사람들 계셔서 못 찍었당 긴 테이블이랑 작은 테이블 있음 엄~청 넓고, 진짜 예술적이다 이 계단식 공간은 [테라로사]를 상기시킨다 식사도 되고, 빵들도 있던데 베이커리 카페 [굴림] 가야해서 자제함 ! 아아도 맛있었음 ! ❤️💜🙆🏻‍♀️ 성수동 나들이~ 라고 하고 다리 뿌셔지는 ..중.. 성수 베이커리 카페 [굴림] [하루필름] 갔다가 와 사람 너무 많아서 그냥 여기로 ㅋㅋㅋㅋㅋㅋㅋ 🥐🍞🥖 재생 0 좋아요 0  🥐🍞🥖 진짜 빵 천국-🤎 음료 메뉴도 간단하고 참 좋았는데..... 웨이팅.... 말도 안되게 기다렸다고 한다... 그냥 주문이 전부 밀렸던데... 약간 의문.. 거짓말 안하고 40분 기다림 기다리는 와중에 쑥크림 품절됐다고ㅋ..ㅋ....💦 꺄아아앙 ‼️ 그래도 너무너무 맛있어서 사르르🤭❣️ 와.... 부서지는 크로와상 말모 + 바닐라크림 ㅠㅠㅠㅠㅠㅠ미쳤음 💖 쫀맛 진짜 🥐💕 레몬 마들렌이랑 바닐라크림 크로와상 포장했지롱 엄마 줘야지잉~ 대전씨 그리고 ! 지호도 서울 올라왔대서 저녁 같이 먹기로 했당 중간에 시간이 있어서 오늘의 나를 기념으로 남기고 싶은 마음에 성수 [하루필름] 왔지롱 ❣️ 여기 웨이팅이 더 말도 안되네...ㅋㅋㅋㅋㅋㅋㅋㅋ 그래도 할거 없어서 그냥 쭈욱 기다림 한 50분? 기다린 듯! 하늘색 존, 파란색존, 보라색존 있었는데 알고보니 다들 하늘색존 기다리더라 ! 워낙 하늘색이 유명해서 나도 그러려고 했지만 웨이팅 미쳐서 그냥 보라색 들어감~ 근데 너무 이쁘네!!!!!!! 찐 보라가 아니라 연보라 파스텔톤이라 💜 너무 맘에 들음 💖 아 진짜 다다다 맘에 드는뎅 😆💕 영상도 있는데, 그건 찐 원본이어서^^ 못 올리겠다아 너무 잘나와서 한 번 더 찍었지롱-❣️ 눈 배경도 이쁜거 같아서 찍었는데 너무너무 잘했넹😘 진짜 찍은 사진들 다 맘에 들었는데 네컷만이어서 아쉬웠다ㅠ_ㅠ 그리고 ! 언니가 추천해준 성수동 포인트오브뷰 소품샵 알고 보니 하루필름 맞은편 ㅋㅋㅋㅋㅋㅋ 아 그게 여기야??! 하고 바로 들어옴 1F 오르에르 카페 2F point of view 포인트오브뷰 소품샵 3F 오르에르 아카이브 50m © NAVER Corp. orer 서울특별시 성동구 연무장길 18 [하루필름]은 여기 바로 앞 이 곳이 오르에르 아카이브 3층 눈이 휘둥그레 👀 와 진짜 눈이 행복하다.. 3층 갔다가 2층으로 내려옴~ 조그마한 공간이라 소수정원 입장함! 그래도 좁아 눈 돌아간다 진짜🤭❣️ 마구마구 고르고 싶었지만 자제하며.... 🕶 스티커에 환장하는 나이지만 여기는 뭐... 고를게 없네...? 그래도 아쉬우니까 하나 데려옴 귀여운 티켓홀더 수첩도 데려왔다아 너무 이뻐 ❤️ 더 늘어났네 노을 이뻤는뎅 하......................... 성수에서 홍대 가야되는데 반대로 가서 구의역에서 홍대 택시탐 미친거임💦 아니 나는 당연히 지하철로 30분이면 택시로 10분인줄 알았지 이 바보 ㅠㅠㅠㅠㅠㅠㅠㅋㅋㅋㅋㅋㅋ 대교 타서 와우.... 꽉 꽉 꽉 막혔다 진짜 택시 40분 탄 사람 나야나..... 기차가 16,000원인데 택시비 22,000원 나옴ㅋㅋ...ㅋ................ㅋㅋㅋㅋㅋㅋㅋ ㅋㅋㅋㅋㅋㅋㅋㅋㅋㅋㅋㅋㅋㅋㅋㅋㅋ 웃고 있지만 내 마음속은 타들어 가고... 하..................... 그래도 참 많은걸 배웠다 너무너무 배움.. 감사합니다.. 택시타기전에 길도 좀 확인하고 응??!!!!! 거리 좀 확인해라 숩아 제발!!!!!!! 지호도 배 터질거같다고 해서 그냥 카페 왔다 ! 와 그리고 아슬아슬하게 공항철도 타고 서울역 도착했는데.... 20:25 기차인데, 20:20에 내림 와.... 공항철도는 또 욀케 밑에 있어 ㅋㅋㅋㅋㅋㅋㅋㅋㅋ 진짜 거의 3층을 뛰어 올라가다가 토 할뻔..... 지호랑 둘 다 허벅지 터질뻔ㅋㅋㅋㅋㅋㅋㅋㅋㅋㅋㅋㅋ 와ㅠㅠㅠㅠㅠㅠㅠㅠㅠㅠ다신 겪고 싶지 않은 에피소드였다 ㅋㅋㅋㅋㅋㅋㅋㅋㅋㅋㅋㅋㅋ그래도 너무 재밌었던 추억 ㅋㅋㅋㅋㅋㅋㅋㅋ 행복행복했던 하루 끄읕 ! 😆❤️"
