title,content
성수동 카페 . 뚝도시장 근처 디저트 맛집 굴림,"굴림 성수동 카페 Intro ㆍㆍㆍㆍㆍ 성수동에서 맛보는 정말 맛있는 디저트: √ 미리 보는 총평 (5점 만점) - 지극히 개인적 맛 . 5점 분위기 . 5점 친절함 . 5점 화장실 . 남녀공용 (외부) 재방문의사 . O □ 성수동 카페 굴림 방문 전 체크 1. 메인거리에서는 조금 벗어난, 카페거리 근처에 있습니다. 2. 근처 또 뚝도시장도 있어서 맛집 찾기에도 수월한 위치 3. 노트북 사용이 제한되고 노키즈존입니다. 전부터 궁금했던 성수동 카페 굴림. 단골로 방문하고 있는 카페 사장님께서 한-참 전에 추천을 해주셨는데 매번 동선이 맞지 않아서 방문을 못하고 있다가 맘먹고 여기만 가겠다. 하는 마음으로 방문해 봤습니다. 역에서 직진만 하면 도착이라 찾기 어렵지 않아 좋았습니다. 성수동 카페 굴림에 대한 후기를 좀 찾아보고 갔는데 내부에 들어가자 생각했던 것보다 더 자리도 많고 무엇보다 분위가가 좋았습니다. 왠지 모르겠지만 TMI로 현재 나이키 맥스 원앙을 집에 고이 모셔두고 있는데 다음에 방문할 때는 원앙 신고 방문하면 여기와 참 잘 어울릴 것 같았습니다. (?) 디저트 맛집으로 워낙 유명해서 그런지 사장님께서 패키지에 신경을 많이 쓰시는 것 같았는데 답례품이나 선물하기에도 참 좋을 것 같았습니다. 자리를 잡고, 느긋하게 쉬어가는 날이라 커피에 디저트를 곁들여 봤습니다. 여기까지 왔는데 성수동 디저트 맛집을 그냥 넘길 수가 없어서: □ 주문 콜드브루(Ice) . (5.5) 감태 휘낭시에 . (3.6) 성수동 카페 굴림에서 프릳츠 원두 쓰고 있지 않을까 싶었는데 주문을 하려고 보니 역시나 반가운 물개 친구가 있었습니다. 에스프레소 머신은 따로 있지 않은 것 같았고 그대신 깔끔하게 마실 수 있는 콜드브루와 콜드브루 베이스의 라떼 두 가지, 그리고 밀크티와 차 메뉴가 있었습니다. 디저트에 즐기기 참 좋아 보이는 라인업. 굴림의 공간은 보고 있으면 굉장히 사장님께서 정성을 많이 들인 공간이라는 게 절로 느껴졌습니다. 가구도 주문 제작으로 맞췄을 것 같은데 가게 이름처럼 둥글둥글한 게 뭔가 제 성격이랑도 닮은 것 같았습니다(?) 로고와 깔맞춤으로 거울도 있으니 성수동 카페 굴림 방문하셔서 인증샷 남기시면 참 좋을 것 같습니다. 주문하고 얼마 지나지 않아 맛있어 보이는 디저트 정식이 차려졌습니다. 이 사진만 보니 갑자기 경복궁 생과방이 생각나는데 여담으로 저는 2년째 실패하고 있지만 올해도 도전을 해보겠다는.. 그런.. 무튼, 깔끔하고 이쁘게 잘 차려진 게 어떻게 찍어도 사진이 참 잘 나오더라구유. 뚝도시장에서도 가까우니 여기서 맛있는 디저트와 커피, 차 드시고 맛집 묶어서 방문하시면 참 좋을 것 같다는 생각입니다. 콜드브루는, 굉장히 깔끔하면서도 단맛이 좋은 제가 참 좋아하는 타입이었습니다. 개인적으로 투썸 콜드브루를 좋아하는데 보다 더 맛이 좋더라구유. 그리고 무엇보다 이 감태 휘낭시에. 디저트 맛집으로 워낙 유명해서 어느 정도 맛있겠지라는 생각은 했지만 어느 정도가 아니라 굉장히 맛있습니다. 겉은 살짝 바삭하면서 너무 달지 않으면서 손이 계속 가는. 동네 어르신들도 모셔오고 싶을 정도로 참 좋았습니다. 성수동 카페 . 뚝도시장 근처 디저트 맛집 굴림 재생 0 좋아요 0 00:00 00:18  접기/펴기 성수동 카페 . 뚝도시장 근처 디저트 맛집 굴림 자리마다 콘센트가 있는데 간단한 충전 정도 하시면 좋을 것 같고 위에 써놓은 대로 노트북 사용은 제한되고 노키즈존으로 운영되고 있습니다. 슈퍼내추럴에서 워낙 많이 봐서 익숙한 친구들: 아, 그리고 굴림에는 굉장히 매력적인 테라스도 있습니다. 두 테이블이 있는데 돌아오는 가을에 이용하면 참 좋을 것 같습니다. 여기에서 커피랑 디저트 먹고 뚝도시장 맛집 가서 저녁까지 먹으면 아마 딱 좋은 성수동 코스가 되지 않을까 싶네유. 성수역에서 직진만 하면 도달하는, 중간에 성수동 카페거리와 뚝도시장이 있어서 구경하면서 찾아가는 재미도 있는 디저트 맛집 굴림. 고르기 힘들 정도로 맛있는 빵들이 많이 있으니 빵순이 빵돌이들 얼른 방문해 보셔유: □ 영업시간 월 - 토 . 11 : 00 - 20 : 00 매주 일요일 정기휴무 50m © NAVER Corp. 굴림 서울특별시 성동구 성수이로5길 1 1층 굴림 #성수동카페 #성수동디저트 #성수동디저트맛집 #성수동맛집 #굴림 #뚝도시장맛집 #성수동카페거리"
"성수동 카페 | 굴림, BBC","바삭 꼬소 맛있는 빵집 영업시간: 월-토 11-20시 (자세한 사항은 굴림 인스타그램 참고하세요) www.instagram.com/goollimm 굴림(@goollimm)님이 Instagram을 사용 중입니다 팔로워 3,930명, 팔로잉 1명, 게시물 427개 - 굴림(@goollimm)님의 Instagram 사진 및 동영상 보기 www.instagram.com 예전에 논현쪽에 있을때 몇번을 가려고 하다 못갔었던 곳인데 성수로 이전하셨단 소식에 부지런히 가봤어요. 날씨도 넘 좋고 많이 먹고 걷기로 작정하고 갔어요. 헤헷 11시 오픈때 갔으면 햇살이 잘 들어왔을거 같은데 1시 넘어 가서 그런가 해가 넘어가더라구요. 밖에서도 먹을수있는 자리가 있어서 좋네요. 통유리로 훤하게 보이는 매장. 노트북 사용금지. 빵먹고 적당히 수다떨고 가는게 낫겠죠. 나무 의자랑 테이블이 모양이 다양해요. 둥글둥글하기도 하고 네모네모하기도. 깔끔한 내부. 큰길가에 있어서 찾기 쉬워요. 예전 매장은 골목 안에 있고 주차는 헬이었거든요. 이렇게 이전하시니 참 좋네요. 성수역에서도 3번출구로 쭉 걸어오면 되고 헤맬것도 없어요. 유리 테이블도 있고요. 갈색으로 톤다운된 테이블과 의자가 안정감을 줬어요. 친절하셨던 사장님. 뭔가 빵순이의 심정을 잘 아시는듯한 ㅎ 이렇게 정면으로 보이는 모습. 저 뒤에가 작업공간 같아요. 테라스가 있다 하셔서 저 문 열고 나가봤어요. 이렇게 테이블 의자. 근데 실외기가 돌아가서 좀 시끄럽긴 했어요. 그래서 사진만 찍고 다시 들어왔죠. 사장님께서 이런 재질 좋아하시는거 같아요. 뭔가 전통적인 느낌. 성수동빵집 굴림 음료 메뉴 가격 커피는 프릳츠 콜드브루만 사용하시네요. 디저트 카페에서 보면 콜드브루랑 티만 내어주는곳이 종종 보여요. 애매하게 에스프레소 내려서 커피맛이 어떻다 저렇다 얘기 듣느니 이렇게 메뉴 선정하시는것도 난거같아요. 커피가 진짜 원두 가는것 부터 내릴때도 그렇고 엄청 예민해서 어렵더라구요. 성수동빵집 굴림 재생 13 좋아요 0  접기/펴기 굴림 준비된 메뉴 쭉 찍어봤어요. 여러명 가서 싹 다 먹어보면 너무 좋을텐데. 혼자는 이럴때 힘들어요 ㅎ 까늘레 많이 먹는다고 추천해주셨고 마들렌은 바나나시나몬나 피스타치오 괜찮다하셔서 피스타치오로 선택. 페이스트리 다 너무 맛나보였어요 ㅠ 그래서 밤 들어간걸루 픽. 바닐라아이스 먹어보고싶었으니 선택. 쑥 좋아하니까 쑥크림 크루아상도. 피넛버터쇼콜라도 이것저것 더 고르려다 정말 다 포장해가서 안먹고 놔둘거같아 자제했어요. 요렇게 실내에서 대충 한컷. 빵은 외쿡빵인데 뭔가 굴림이란 이름도. 나무 트레이도 한국느낌 나는것이 예쁘게 잘 어울려요. 녹아서 젤 먼저 아이스크림 들어간거 먹구. 바삭해서 놀라구 고소하고 너무 맛있어서 감탄. 그냥 긴말 필요없이 다 맛있어요!! 흐잉 ㅠ 커피랑 먹었어야 더 맛났을 까늘레. 마들렌. 얘네는 다 못먹고 포장. 쑥크림이 듬뿍 들었던 크루아상. 계속 맛있다 하면서 와구와구 먹고. 밀크티도 참 깔끔하고 진한 얼그레이향이 좋았어요. 날도 좋아서 밖에 가지고 나가서 먹었는데 어찌나 맛있게 잘 먹었나 모르겠어요. 오랜만에 빵을 열심히 먹고 많이 걸은날 ㅎ BBC: 브로벨커피 월요일 휴무 자세한 사항은 브로벨커피 인스타그램 참고하세요. www.instagram.com/brobellcoffee BBC(BroBellCoffee)님이 Instagram을 사용 중입니다 • BBC(BroBellCoffee)님 프로필의 게시물 148개 팔로워 1,607명, 팔로잉 316명, 게시물 148개 - BBC(BroBellCoffee)(@brobellcoffee)님의 Instagram 사진 및 동영상 보기 www.imstagram.com 성수동빵집 굴림 갔다가 근처 이길래 다녀와본 브로벨커피. 사진으로 만 봤을때 작아보였는데 실제로 어떤느낌일지 궁그미. 오 하얗고 깔끔하고 예쁨. 들어가자마자 엄청 원두 로스팅하는 냄새가 났어요. 직접 로스팅 하시나보다 싶고요. 통유리라 밖이 보이고 훤하니 좋았어요. 햇살도 잘 들어오고. 요런 부분 중요해요 ㅎㅎ 깔끔하게 뭔가 딱 미니멀한 느낌이 좋네요. 디저트 하나 먹어보고싶었지만 너무 빵을 많이 먹고 온터라 커피만 주문. 성수동카페 브로벨커피 BBC 메뉴 가격 시그니쳐라는 BBC라떼, 스티키라떼. 지금 생각해보면 하나는 필터커피 마셔볼걸 싶어요. 이렇게 내어주세요. 성수카페 BBC 재생 2 좋아요 0  접기/펴기 흑임자서리태 커피 흑임자서리태 크림을 주욱 우유위에 부어서 섞어마시면 돼요. 예상밖의 비주얼이었고 크림의 농도도 묽은편. 이렇게. 많은 분들이 필터커피 마시던데 필터커피랑 휘낭시에 먹어보면 맛이 좋을거 같기도 하고. 어떤분 후기에 여기 커피 마시고 머리에 종이 울렸다던데. 아직은 종이 안울려서 다음 기회를 노려봐야겠어요. 아래 링크 누르면 로즈 인스타그램으로 연결돼요. 더 빠른 소식 접할수 있으세요. 인스타에서 우리 더 친해져요:) www.instagram.com/sssuerose Instagram의 로즈의 진지한 카페투어(@sssuerose)님 프로필 • 게시물 3,191개 팔로워 9.5만명, 팔로잉 190명, 게시물 3,191개 - 로즈의 진지한 카페투어(@sssuerose)님의 Instagram 사진 및 동영상 보기 www.instagram.com"
[성수동 카페] 구움과자가 맛있는 조용한 분위기의 카페 '굴림',"★읽기 귀찮으신 분들을 위한 요약★ (1) 성수동에 위치한 조용한 카페 입니다 (2) 제가 방문했을 당시, 노트북 사용은 금지되어 있었습니다 (3) 구움과자, 빵 (베이커리) 종류가 정말 맛있어요! 특히 크로와상이 빨리 품절되더라고요 ㅠ,ㅠ!! (4) 조금만 걸으면 한강이 나와서 카페에서 시간을 보내다가 한강에 가시는 것도 추천! (5) 논현에서 유명했던 베이커리 카페라고 합니다! (6) 음료 가격은 4,500원에서 7,500원 사이! 성수동 빵이 정말 맛있어 보이는 카페 굴림 [영업시간] 오전 11시 ~ 오후 8시 (매주 일요일 휴무) [주소] 서울 성동구 성수이로5길 1 50m © NAVER Corp. 굴림 서울특별시 성동구 성수이로5길 1 1층 굴림 여름에 능소화보러 성수 한강 근처에 갔었어요 성수에 있는 한강이 능소화 핫플이잖아요!!! 사진 찍기로 한 시간이 많이 남아서 어디서 시간이 보내지 하는데 성수동에 구움과자로 유명한 카페가 있다고 검색에 나오더라고요! 그래서 바로 방문해본 '굴림'! 카페가 아주 크진 않지만 6~8팀 정도가 앉을수 있는 공간은 충분했어요! 정말 다양한 구움과자, 빵들이 있더라고요! 크림 크루아상도 있지만 따로 보관되고 있어서 만약 보이지 않는다면 사장님께 여쭤보세요...!! 저도 이거 모르고... 크루아상을 먹지 못했습니다 ㅠ.ㅠ;; 저는 평일 4~5시 사이에 방문했음에도 불구하고... 당시에도 많은 빵이 없었어요 정말 무화과빵도 먹고 싶었는데 금방금방 나가는 메뉴라고 하더라고요ㅠ.ㅠ 굴림 카페를 스윽 살펴보시면 커피가 아니라 '티', '차' 종류도 눈에 띄어요! 카페 한 쪽에 차를 위한 다기들이 놓여있는데 아, 여기는 차 관련해서도 사장님이 하시는구나! 그냥 티백으로 슥 끝내시는 게 아니구나 싶더라고요 그래서 주문한 살구빵과(5,000원) 마테레몬그라스 티 (6,500원) 완전 맹맛! 이게 아니라 향이 은은해서 좋았어요 다음에는 여기서 밀크티를 먹어보고 싶더라고요! 카페에서 시간을 보내고 있는데 단골손님으로 보이는 듯한 분이 오셔서 여기 밀크티 없으면 못 산다고...ㅋㅋㅋ 말씀하시는 걸 엿들어버렸어요 진짜 엄청나게 촉촉해보이는 커스타드 크림과 달짝지근해 보이는 살구빵... 진짜 너무 맛있었습니다 ㅠ.ㅠ!!! 잘리는 것도 잘 잘리고 커스타드 크림도 너무너무 맛있고 샤샥하고 녹아버리더라고요 먹으면서 아쉬웠던 건... 아메리카노를 시킬걸...!!!! 하 이런 빵에는 아메리카노를 먹었어야했는데!!!! 싶더라구요 맛있는 구움과자와 빵! 맛 못지않게 사진찍는 곳도 충분히 있어요 곳곳에 사진찍기 좋게 거울이 예쁘게 배치되어 있어서 사진 찍는 맛도 있었습니다ㅎㅎㅎ 정말 조용하면서도 성수동 특유의 따뜻한 분위기 그런 감성을 느낄수 있어서 너무 좋았어요! 다음에 능소화를 보러가게 된다면 다시 한 번 또 들릴 거 같아요! 성수동에 들리신다면 굴림카페 가보시는 건 어떠신가요?"
"277 - 1. 굴림 (Goollim, 성수동2가) - 논현역에서 성수동으로 이전!","제가 사실 낯을 좀 가리는 편이라 ㅋㅋㅋ 아마 저 낯가리는 건 블로그에서도... 이웃분들도 다 아실 ㅋㅋㅋ 저 아래 짤 보고 폭풍 공감 이거 ㅋㅋㅋ 공감 ㅋㅋㅋㅋㅋㅋㅋ 하지만 이제는 좀 나아져서 특히 코로나 이후로는 동네 주변 말고는 갈데도 없고해서 동네는 단골집들은 인사 잘하구 다니는데, 여기는 이웃 ㄴㅈㅂㅅ님이 소개시켜주셔서 간 다음부터 정말 꽤 열심히 다녔던 곳입니다. 저도 그렇고 사장님도 그렇고 약간 낯가리는 분이 좋은데 ㅋㅋㅋㅋㅋㅋㅋㅋㅋ 여기 사장님하고는 이상하게 만나면 그렇게 열심히 이야기를 하다 왔음 이유는 모르겠는데 사장님이 진짜 기분좋게 장사를 하셔서 뭔가 조금씩 이야기를 더 하게 된 듯 여튼 저희 동네에서 몇 년간 장사를 하던 굴림이 이사를 떠났어요. 이사를 간 사연은 제가 또 자세히 들었지만 또 다 쓸 수는 없고... 지난 번도 그렇고 이번도 그렇고 번잡한 곳 보다 조용한데가 더 좋으시다고 중심가가 아니라... 뭔가 골목길 한 쪽에 자리 잡으셔서 난 드릴 화분 하나 가슴에 품고 (무슨 레옹에 마틸다도 아니고 ㅋㅋ) 난 성수동 구경을 제대로 했음 사실 이전을 하셨다고 하셔서 한 번 가봐야겠다 했는데 성수동에 사무실 있는 친구 만나러 가면서 들럿어요. 확실히 매장은 더 넓어졌지만 자세히 보니 메뉴들은 거의 그대로. 그리고 굴림만의 이 독특한 글씨체도 그대로. 이름들도 참 ㅎㅎㅎ 치즈치즈치즈 뭔가 제가 굴림을 좋아했던 건 잡스런 기교보다 정말 직관적으로 그대로 만드세요. 내가 한참 홀릭으로 먹었던 저 쑥크림크루아상 가오픈이라 1시에 오픈하고 얼마 안되어서 들이닥쳐서 사람이 없었는데 첫날 가오픈날 준비하신 빵 다 팔렸다고 하시는데 왜 내가 다 기쁨? ㅋㅋㅋ 저 가운데는 공기청정기인 줄 알았는데 알고보니 ㅋㅋ 스피커였음 ㅠㅠ 그래 공기청정기일리가 없지 뭔가 굴림 느낌이 그대로 있는 각종 가구들 뒤에 테라스도 있다고 매우 기뻐하면서 말씀해주심 사장님이 살짝 나오셨네 ㅎㅎㅎ 예전에 논현동에서 혼자서 근무하셨는데 이제 사람이 2주 뒤에 온다고 하심 여튼 이렇게 또하나의 단골집이 논현동에서 사라졌지만 그래도 잘 되어서 가셨으니 기쁜 일이네요. 커피랑 차도 있음. 사실 단 한 번도 앉아서 먹어보지 않았.... 처음 가기 시작했을 때가 코로나 때라 맨날 사서만 와서. 햇살 이렇게 잘 들어오는 (사실 이 날 이게 겨울이야 싶을 정도로 날이 따뜻하기도 했네요) 집에와서 사온 것 간단히 1시에 사서 저녁에 들어오면서 오지게 흔들고 왔더니 모양이 좀 달라진 듯 ㅋㅋㅋ 피넛버터 쇼콜라 단 듯 안 단 듯 단 ㅋㅋㅋㅋㅋㅋ 먹고 싶으면 언제든 뛰어가서 먹을 수 있었던 굴림 그립겠지만... 이전한 곳에서 번창하시길! 잘 먹었습니다. 굴림 서울특별시 성동구 성수동2가 520-2 1층 굴림 010-3682-7999 https://www.instagram.com/goollimm/ www.instagram.com www.instagram.com 이 포스팅은 저의 개인적인 경험과 견해이며, 어떠한 포스팅과 관련된 혜택도 소개된 업소로부터 제공받지 않았음을 밝힙니다. 상세한 가격, 제품 성분 및 알러지 여부, 주차 가능 여부, 할인정보, 위치 정보 등의 질문에는 답하지 않으며 해당 관련 사항은 저의 책임이 아님을 밝힙니다. 실시간 업데이트는 아래로 (그냥 제 주소가 또 미리보기가 이상하게 되어서 ㅋㅋ 최신 포스팅으로) Instagram의 KB님: “이제 우리 동네를 떠나서 성수동으로 간 굴림. 가오픈 기간에 오픈하셨다고 인사까지 가게될 줄은 몰랐는데 성수동 있는 친구 사무실 들르면서 가는 길에 내가 만든 작은 화분을 들고 들렀다. 굴림만의 귀여운 글씨체도 러프하면서도 힘있는 패스트리들도…” 좋아요 7개, 댓글 1개 - Instagram의 KB(@kbpkbpkbp)님: ""이제 우리 동네를 떠나서 성수동으로 간 굴림. 가오픈 기간에 오픈하셨다고 인사까지 가게될 줄은 몰랐는데 성수동 있는 친구 사무실 들르면서 가는 길에 내가 만든 작은 화분을 들고…"" www.instagram.com 감사합니다."
성수동카페 굴림 - 디저트 최고 인생샷 찍을 수 있는 예쁜 공간 (네이버 평점 4.69),"성수동 핫플 디저트가 맛있다고 소문난 성수동 카페 굴림에 방문하였습니다 요약하자면 마들렌 콜드브루 라떼 밀크티 맛집! 50m © NAVER Corp. 굴림 서울특별시 성동구 성수이로5길 1 1층 굴림 ⏱운영 시간: 월 - 토 오전 11시 - 오후 8시 (일 휴무) 📍위치: 성동구 성수이로5길 1 성수역 3번 출구에서 성수동 카페거리를 따라 10분정도 걸어가면 대로변에 있어 쉽게 찾을 수 있습니다 디저트 맛집이라고 평점이 매우 높아 찾아갔는데 우드톤의 예쁜 공간까지 갖춰져 있어 시간을 보내는 내내 정말 행복했습니다🥰 고민이 없도록 간결한 카페 메뉴! 🤎저는 콜드브루 라떼 아이스, 🤍동생은 밀크티를 시켜보았습니다 컬리에서 프릳츠 커피캡슐을 주문해서 마셔본 경험이 있어 프릳츠 원두를 사용한다고 하니 더 기대가 되었습니다 디저트도 빼놓을 수 없다! 정말 모두 맛있어 보여서 다 주문하고 싶었지만 참고 참아 호지차 마들렌과 소금흑임자 마들렌을 주문하였습니다🤣 이번에 두 개만 먹었으니 10번 더 방문해서 다른 디저트 메뉴들도 뿌셔야겠습니다🧐 모든 메뉴를 맛보고 싶을 정도로 존맛탱 디저트를 선물용으로 포장도 가능합니다 카페 한 편에 마련된 포장 공간을 볼 수 있었는데 고급스러운 상자와 보자기에 선물받으면 정말 기분이 좋을거같습니다 햇살과 정말 잘어울리는 우드톤의 공간입니다 중간에 있는 스피커와 굴림을 의미하는 거울, 모던한 조명이 정말 잘 어울립니다 오픈런을 한 덕분에 모든 공간을 누려보았습니다 예쁜 동생 프사도 건져주었습니다 청량한 하늘까지 정말 최고입니다👍🏻👍🏻👍🏻 이리 저리 정신없이 사진찍고 있으니 나온 메뉴들 메뉴들까지 이렇게 예쁘게 나오면 어떡하냐구요 여기 평점 4.69맞나요?? 5 드립니다! (내 맘대로?) 🤍냉침한 밀크티는 홍차의 향이 가득 담겨있으며 너무 달지 않아서 정말 맛있었습니다 🤎콜드브루 라떼도 쓰지않고 고소해서 커피를 잘 못마시는데도 쫀맛! 고소한 라떼 맛집 찾기 쉽지 않은데 여기는 커피도 잘해버리네요 🧡영롱한 마들렌 단면입니다 간단하게 크림이 올라가 있는줄 알았는데 가나슈 베이스인듯한 생초콜렛 느낌의 호지차크림과 흑임자크림이 듬뿍 빵도 얼마나 촉촉한지 ㅠㅠ 감동적인 맛입니다 소금 흑임자 마들렌에서 소금의 짭짤한 맛은 느껴지지 않았지만 정말 맛있었습니다 먹다보니 깨송편을 먹는 느낌도 났던거 같습니다😝 오늘 매장에 있는 모든 디저트 못먹어봐서 아쉬울 따름입니다 다음에 성수동 가면 무조건 또또또 갈 집입니다 성수동에 간다면 꼭 굴림의 디저트 뿌셔주세요👻👻"
성수동 디저트 카페 굴림 팥 바닐라아이스 *,"성수동 디저트 카페 굴림 팥 바닐라아이스 * 성수역에서 나와서 이마트를 지나 어느 조용한 골목에 있었던 성수동 디저트 카페 굴림 * 구움과자랑 크루아상도 유명하고 팥이랑 바닐라 아이스크림이 들어간 크루아상도 인기가 있다해서 궁금해서 굴림에 다녀갔어요 :-) 50m © NAVER Corp. 굴림 서울특별시 성동구 성수이로5길 1 1층 굴림 성수동 디저트 카페 굴림 위치 * 운영시간 월요일 - 토요일 11:00 - 20:00 일요일 정기휴무 평일 낮에 갔더니 조용하게 즐길 수 있어서 좋았던 성수동 굴림 :) 살짝 아쉬웠던건 테이블과 의자가 낮아서 먹는데 등을 굽히고 먹어야 했던거였어요ㅋㅋ 그래도 등을 기댈수 있다는게 다행이었다란 생각이 든 정도..?? 원랜 논현역 근처에 있었는데 성수동으로 이사갔다고 하더라구요~ 분위기는 좋고 평일 낮에 오면 디저트를 조용히 즐길 수 있단 생각이 들더라구요 ~ 음료는 프릳츠의 콜드브루와 밀크티 그리고 차가 있었는데 개인적인 생각으론 음료 가격대가 좀 높구나 싶더라구요 - 특히 차 가격이 좀 쎈것 같아서 좋은걸 쓰나 싶었어요ㅎㅎ 휘낭시에랑 마들렌 그리고 페스츄리류랑 크루아상 종류가 다양해서 뭘 먹어야할지 고민되더라구요 (항상 선택장애가 있는 저) 팥 바닐라 아이스는 먹자고 했으니 팥 바닐라 아이스는 찜꽁해주고~ 휘낭시에는 감태 휘낭시에로 골라주고 마들렌은 호박유자로 골라줬어요! 생각보다 맛이 다양해서ㅋㅋㅋ 포장도 해야하나 싶었는데 구움과자들도 생각보다 가격대가 좀 있는것 같아서 ^^; 마음을 내려놓게 되더라구요 ㅠㅠ 마들렌이랑 휘낭시에도 3,500원이 넘는거 보고 머쓱해졌어요 ,, 요즘 가격이 많이 올랐다고 하지만 구움과자 가격도 가끔 헉하고 놀랄때가 있는데 그정도까지 하나..? 싶을때가 있어요ㅎㅎㅎ 여튼! 주문하고나서 조금 기다리고 있으면 요로코롬 정갈한 한상차림으로 갖다주셔요 :-) 단짠으로 먹으려고 감태 휘낭시에도 주문한거였는데 개인적으론 좋은 조합이라고 생각했어요!ㅋㅋ 마들렌이 생각보다 달았고 팥 바닐라아이스도 달았기 때문이죠ㅎㅎㅎ 집근처엔 이런 느낌의 카페가 없어서 아쉽긴 하지만요 - 이런 카페들은 왜 다 먼곳에 있는가 하면서 결국 가게되네요ㅋㅋㅋ 유튜브같은거 보다보면 맛집이 있네 하고 주소 보면 집에서 다 멀더라구요ㅋㅋㅋㅋ 여튼! 성수엔 예쁜 카페들이 많아서 참 좋은것 같아여..^_^~ 호박유자 마들렌의 호박퓨레가 생각보다 너무 달아서 당황했던게 아직도 기억이 나네요ㅎㅎ 호박맛이 좀 달달하고 진해서 달달한걸 좋아하시는 분들께서 굴림의 디저트를 좋아하지 않을까란 생각이 들더라구요 - 감태 휘낭시에가 달달함을 상쇄시켜줘서 좋았어요! 짭쪼름하니 좋았던 감태 휘낭시에 - 팥 바닐라 아이스크림 조합은 달달하니 맛없없 조합인데 페스츄리를 자르려고 할때 아이스크림이 다 녹아서 호다닥 먹어야겠더라구요ㅋㅋㅋㅋ 페스츄리는 겉바삭 속촉촉한 스타일은 좋았어요~ 다른 맛도 궁금했는데 워낙 달아가지구ㅋㅋㅋㅋ 다른 맛들은 적당히 달달할지 그건 잘 모르겠지만요 @_@~ 여튼 궁금증 해소 완료했구요 ! 성수동 다른 카페들도 시간이 되면 가봐야겠어요 :-)"
