title,content
성수동 베이커리 디저트 카페 테니 Tenne,"Tenne 성수동 베이커리 디저트 카페 테니 #성수동베이커리카페 #성수동디저트카페 #성수동테니 #테니 인스타 구경 중에 디저트 카페로 괜찮길래 오빠와 성수동 나들이 갔을 때 갔었던 카페 테니 Tenne 50m © NAVER Corp. 테니 서울특별시 성동구 뚝섬로17가길 55 1층 예약 사실 후보군이 이곳저곳 있었는데, 라이카 팝업스토어를 가는 도중에 '엇! 여기는 내가 봤던 곳이야!' 하면서 지나가게 되었다 마침 어떤 카페를 갈까 고민하던 중이었는데 잘 됐다 싶어서 팝업스토어 구경 후에 다녀왔다 원래는 우리가 갔을 때 처음엔 사람이 엄청 많았다 결제하려는 줄도 제법 길었고, 사람도 바글바글 마침 딱 사람 없을 때 겨우 찍을 수 있었던 사진! 베이커리 카페답게 빵이 한가득이고 무엇보다 마음에 들었던 것은 정말 오픈되어 빵을 진열하지 않았다는 것 (그래도 유리 진열장 안에 날파리 한 마리가 들어가 있는 것을 보긴 했다만 정말 오픈되어 있는 것보단 낫지) 버터 풍미 가득한 퀸아망부터 시작해서, 휘낭시에, 페스츄리, 소금빵, 치아바타, 깜빠뉴, 파이류 등등 다양한 베이커리가 있어서 뭘 먹을까 상당히 고민스러웠다 되게 맛있을 것 같은 에그샐러드 샌드위치 뭔가 풍성한 맛이 날 것 같다 요런 포카치아는 넘나리 내 스타일 그린 라따뚜이 포카치아도 맛있어 보이고, 핫 허니 페퍼로니 포카치아도 넘 맛있어 보이고 (특히 핫 허니 페퍼로니 포카치아 맛나 보임) 생각해 보니, 집에 잘 보관했다가 오븐이나 에프에 돌려서 먹어도 아주 맛있었겠어 (아쉽다 괜히) 슈 종류는 디자인이 귀엽고 맛있어 보인다 이날은 슈가 별로 땡기지 않아서 안먹었는데 지금 이렇게 보니까 왜 이렇게 맛있어 보이냐 특히 꽃 모양의 딸기슈 🍓 살짝 고민했던 딸기생크림케익 하지만 승자는 밀푀유! 오랜만에 밀푀유라 먹었는데 대존맛이었다 심지어 홀 사이즈도 있다니! 와인도 있는데 저녁에는 와인바처럼 운영하는 듯하다 다들 디저트 말고 브런치도 많이 먹는 것 같던데, 테니 메뉴 보니까 브런치, 리조또, 샌드위치(샌드위치는 핫, 콜드 이렇게도 나뉘어있고) 전반적으로 상당히 괜찮아 보인다 라자냐도 먹어보고 싶고, 라구파스타도 조쿠영 어니언 수프 별로 안 좋아하는데, 왠지 별표 들어가니까 먹어보고 싶은 프렌치 어니언 수프 별표 들어간 건 다 먹어보고 싶은 욕심 히히 아무튼 우린 빵을 고르고, 음료는 오빠는 과감하게 슈크림 라떼, 나는 한여름의 라임 민트티 핫 🔥 우리가 갔을 때에는 딱 한자리 남아있을 때 그것도 실내가 아닌 실외였다 조금 덥긴 했지만 그늘에 있음 바람도 시원하니 좋아서 나쁘지 않겠다 싶어 실외로 자리 찜꽁 참고로, 주문할 때 반드시 본인의 테이블 번호를 외워가야 한다 안 그러면 주문할 때 테이블 번호 다시 보고 오라 함 이 부분은 굉장히 불편했다 심지어 우리는 제일 안쪽 자리에 있어서 울 오빠 고생 좀 했지 그래도 테이블 번호를 알려달라 한 이유는 가져다주기 때문! 편하긴 하다 하지만 플레이팅이 그리 예쁘진 않지만, 그래도 밀푀유는 최고 최고! 맛나다 맛나 오랜만에 먹어서 더 그런가? 아무튼 굉장히 맛있었다 브런치 먹기에도 괜찮은 카페라 또 가보고 싶은 카페 주말에 갔는데 그 정도면 사람이 엄청 몰리는 것도 아니고! 나중에 다시 도전!"
성수동 베이커리 카페 디저트 맛있는 테니 Tenne,"안녕하세요! 서울 여행 첫번째 날 성수동 갔는데요! 성수동 놀러가자마자 카페 다녀왔답니다! 분위기도 좋고 디저트도 정말 맛있었는데요! 성수동 베이커리 카페 브런치 맛있는 테니 한번 같이 보러 가실까요? Tenne 영업시간 08:00 - 21:30 L.O 20:00 50m © NAVER Corp. 테니 서울특별시 성동구 뚝섬로17가길 55 1층 예약 성수동 카페 테니 위치는 위 지도를 참고하셔서 방문하시길 바랍니다 사실 제가 방문했던 당시 영하 15도였었는데, 체감온도로 영하 22도 정도 되는 날씨였어요! 너무 추운 날씨에 돌아다기니 힘들어서 성수동 여기저기 둘러보기 전에 제일 가보고 싶었던 카페 테니 먼저 가보기로 했어요! 뭔가 깔끔한 가죽면에 카페 이름 새겨놓은 느낌 날씨가 추우니 얼른 슝슝 테니 내부로 들어가기로 했답니다! 테니 입장하자마자 무작정 들어가서 자리를 잡는게 아니라 인원 몇 명인지 물어보시고 자리를 안내해주시더라구요! 창가 자리도 참 마음에 들었는데 창가자리는 식사나 브런치 이용 시 저 테이블 쪽으로 안내를 해주시는 듯 하더라구요! 자리 안내 받은 후 주문하기 위해 카운터로 슝슝! 이 곳 성수 테니 같은 경우 낮 시간대에만 브런치 이용가능하고 그 외에는 디저트 판매할 줄 알았는데 저녁 시간대에는 디너메뉴가 따로 있어서 와인과 곁들어 많이 드시더라구요! 저희는 따로 와인바갈꺼여서 식사는 패스하고 카페로만 이용하기로 하고 저는 로네펠트 루이보스 티 사촌언니는 바닐라 라떼 주문했어요! 디저트도 구움과자류부터 슈크림, 케이크까지 제법 다양해서 어떤 걸 선택해야하나 고민했는데 고민고민 하다가 몽블랑슈크림 그리고 라즈베리케이크 선택했어요! 케이크 보니까 홀케이크로도 팔던데 특별한 날이나 기념일에 주문해서 먹기도 좋을 것 같더라구요! 와인도 같이 판매하고 있는 만큼 꽤나 다양한 종류의 와인들과 와인 안주류도 같이 판매하고 있더라구요! 저희는 와인바 갈거여서 안마셨지만,, 만약 와인바 웨이팅 너무 심했더라면 이 곳에서 와인 한 병 주문해서 마셨을지도,,, 어둑어둑한 분위기 너무 좋던 테니 저녁 식사 메뉴도 판매하고 있어 친구들과의 모임 뿐만아니라 데이트 장소로 오기도 좋을 것 같더라구요! 제가 방문했을 당시에는 예약 후 식사하러 오시는 분들이 꽤 있으시더라구요! 크리스마스 직전에 방문해서 그런지 포근한 느낌이 물씬 나던 공간 포근한 느낌도 물씬나는데 크리스마스 오브제를 두어서 그런지 마음이 포근해지는 느낌 테니 내부 안쪽은 조금 어두컴컴했는데 이런 조명들을 구석진 곳에 두어 분위기를 살린듯한 느낌이더라구요! 유럽 감성 물씬 풍기던 테이블 이 공간은 포토존으로 둔 느낌인데 깔끔 심플하더라구요! 진짜 천장 위 조명도 그렇고 뭔가 벽돌이나 저 창문까지 진짜 유럽 성 일부분 옮겨놓은 느낌이더라구요! 저희가 막 테니 왔을 때는 사람 별로 없었는데 이렇게 분위기가 좋아서 그런지 테이블에 자리가 없을 정도로 인기가 많더라구요! 그리고 금방 나온 디저트들과 음료! 몽블랑 슈크림 그리고 라즈베리케이크! 카페 오기 전에 한창을 돌아다닌터라 디저트 맛이 어떨지 엄청 궁금해서 제일 먼저 라즈베리 케이크 먹어봤는데 라즈베리 잼의 상큼함과 부드러운 생크림이 꽤 조화로운게 크림자체도 느끼하지 않고 케잌이 부드럽고 참 맛있더라구요! 두번 째로 먹은 몽블랑슈크림은 그냥 겉만 보고 판단했을 때는 그냥 위에 몽블랑 크림 있고 안에는 커스터드크림만 들어있겠거니 했는데 커스터드 크림 뿐만 아니라 상큼한 잼도 같이 들어있어 마냥 달콤한게 아니라 상큼한 맛과 달콤한 맛이 나는게 꽤 신기하면서도 맛있더라구요! 디저트에 정말 감탄했던 성수동 테니 여유만 된다면 조금 더 머물고 싶었지만 와인바 하나 자리 남았다고 해서 와인바 간다고 호다닥 갔는데 조금 더 오래 못 있다간게 조금 아쉽더라구요,, 분위기도 좋고 디저트도 맛있던 곳이라 다음에 방문하게 된다면 먹어보지 못했던 디저트들 포장해가고 싶고, 식사도 많이 하시던데 한번 분위기 좋게 식사하러 가고 싶네요! 분위기 좋은 디저트 카페 찾으시거나 브런치가 맛있는 카페 찾는다면 성수동 테니 한번 가보시는 건 어떠세요?"
성수동테니 낮에는 브런치카페 밤에는 와인바로 즐기기,"성수동카페거리에 핫한 브런치카페가 새로 생겼다고 해서 바로 달려온 곳, 성수동테니 낮버전과 밤버전으로 두 번이나 다녀왔다 50m © NAVER Corp. 테니 서울특별시 성동구 뚝섬로17가길 55 1층 예약 2호선 성수역 3번 출구로 나와서 좀 걸어오면 된다 오픈런해야 앉을 자리가 있을 정도로 핫하다는 소리를 들어서 진짜 딱 아침 8시에 공부할 책거리를 들고 달려갔다 오픈시간 평일 8:00 / 주말 10:00 마감시간 평일, 주말 21:30 (라스트오더 20:00) 일찍 와서 그런지 아직은 자리가 비어있었다 손님들로 차기 전에 사진을 찰칵찰칵! 이 분위기.. 인테리어.. 소품.. 뭐야 뭐야~~~!! 테이블과 의자들이 각양각색이라 마치 이케아에 온듯한 느낌이었다 벽지와 바닥 타일도 여러 가지 스타일로 꾸며놔서 각 공간마다 다 다른 분위기를 자아냈다 그래서 취향껏 골라 앉기 좋았다 (물론 자리가 있을 때의 이야기이지만..!) 인테리어에 엄청난 공을 들인듯한 성수동테니 고급스러운 유럽풍 스타일~~ 포토존이 아주 한가득이었다 사진엔 없지만 화장실도 깔끔하고 이뻤다 휴무날 아침 일찍 일어나서 핫한 카페 창가 자리에 앉아 공부라니..! 내가 정말 좋아하는 모먼트 아이스아메리카노 한 잔과 함께 여유로운 휴일을 보내기 딱 좋았던 오전의 성수동테니 이후에 사람들이 하나둘씩 오기 시작해서 (갓 나온 빵을 먹으러 온 이 부지런한 사람들..!) 이날에 나는 오래 있지 못했고 좀 더 한적한 카페를 찾아 떠났다 ㅎㅎ 그 이후에 회사 사람들과 함께 다시 찾은 오후(저녁)의 성수동테니 !! 미국 뉴욕 미슐랭 레스토랑 출신 쉐프님이 만들어내는 양식 메뉴들이 아주 고급스럽고 맛있다고 소문나서 회식 장소로 바로 픽하게 됐다 (게다가 와인도 판매함.) 음식 주문을 완료 후 와인은 어떤 걸 시켜야 할지 우왕좌왕하고 있을 때 성수동테니 직원분이 추천해 주신 와인. 치킨시저샐러드 14,000원 제일 처음으로 나온 샐러드~~! 엄청 푸짐했다 야채도 싱싱하고 소스도 맛있었다 (원래 내 돈이면 이런 곳에 와서 샐러드따위 시켜 먹지 않는 메뉴지만.. 이날은 회식^^ 사장님 법카^^찬스로 코스요리처럼 먹어보자며 시켰다ㅋㅋㅋㅋㅋ 근데 안 시켰으면 서운했을 정도로 맛있게 먹었다) 오늘의수프 8,000원 계절감과 제철재료에 맞춰 변경된다는 오늘의 수프. 2인당 1개씩 시켜먹었다 ㅗㅜㅑ.. 부드럽고 따끈하니 몸을 사르르 녹이는 맛이었다 (회식을 작년(22년) 12월에 했기 때문에 다소 쌀쌀한 날씨였다) 위에 올라간 페이스트리를 파사삭 하고 부신 후에 같이 먹으니 아주 꿀맛이었다 봉골레 18,000원 링귀니, 바지락, 홍합, 페퍼론치노 조개와 마늘로 맛을 낸 오일파스타! 우리가 시킨 메뉴가 파스타였는지 조개찜이었는지 헷갈릴 정도로 파스타 위에 조개가 듬뿍 올라가 있었다 머쉬룸리조또 20,000원 이게 내 원픽~!! 이거 1인분 맞나요..? 양이 엄청 많았다ㅋㅋㅋ 큼직한 머쉬룸이 듬뿍 들어있고, 위에 이렇게 버섯이 쌓일 정도로 나오는 버섯리조또는 처음봤다ㅋㅋ 너무 맛있게 먹었다 라구파스타 19,000원 플레이팅을 어쩜 이렇게 맛있어 보이게 하시는지.. 음식들이 너무 예뻐서 사진 찍을 맛이 나는 성수동테니 같이 나온 빵과 곁들여 먹었는데 빵도 너무 맛있었다 베이커리도 같이 운영하고 있어서 요리와 함께 나오는 빵들의 퀄리티가 높은 편이었다 성수동테니 낮에는 브런치카페 밤에는 와인바로 즐기기 재생 2 좋아요 0 00:00 00:09  성수동테니 낮에는 브런치카페 밤에는 와인바로 즐기기 ㅋㅋㅋ진짜 테이블을 꽉 채워서 주문한 우리들. 비프웰링턴 52,000원 드디어 메인메뉴 등장!!! 비프 웰링턴은 2일에 걸쳐 준비가 되기 때문에 예약필수!인 메뉴라고 한다 때깔이 참 곱다.. 소고기를 페이스트리로 감싼 요리인데 맛이 아주 훌륭했다 꼭 먹어보시길 추천..!! ㅋㅋㅋㅋㅋㅋ짜자잔! 끝날 때까지 끝난 게 아니다^^ 코스요리처럼 먹기로 했으면 마지막 순서는 당연히 디저트~! 불러온 배를 붙잡고도 디저트는 포기 못해..! 하는 우리 팀원들 ㅋㅋㅋㅋ 각자 먹고 싶은 거 하나씩 골라보자 했는데 어쩌다 보니 저렇게 많이... (사장님 잘 먹었습니다....!!!) 애초에 테니는 베이커리 카페로 유명해진 곳이기 때문에 빵과 디저트의 퀄리티가 아주 우수하고 예쁘고 샤랄라(?)했다 (그런데 사실 베이커리랑 디너요리 중에 어떤 것이 메인인지 모를 정도로 두 마리 토끼를 다 잡은 곳이었다) 위 사진은 내가 아닌 우리 회사 사람들이 찍은 사진. 사진을 이렇게나 잘 찍다니... 블로그 포스팅을 앞으로 더 잘하려면 저렇게 사진 찍는 기술을 좀 전수받아야겠다. 허허 아무튼 너무나 맛있게 식사했던, 기억에 남는 회식장소였던~ 성수동테니 맛도 훌륭했지만 저녁에 조명도 어스름하니 분위기가 아주 짱이었다~! 다음에 또 올 테야!! 오늘의 브런치카페 맛집 테니 후기 끝-!"
성수동카페 테니 베이커리 고풍스럽고 세련된 분위기의 테라스 카페 Tenne,"안녕하세요? 꽃을 든 여자입니다. 오늘은 성수동카페 “테니 베이커리”를 소개할게요. 성수역에서 미스디올 전시장으로 가는 길에 발견한 카페인데, 인근 카페 중 가장 눈에 띄는 곳이어서 바로 들어갔어요. 알고보니, 성수동 핫플, 핫한 브런치 카페였더라구요. 테니 베이커리는 디저트 종류가 다양하고, 내부 인테리어도 잘 꾸며져있고, 테라스석은 이미 만석으로 인기가 있는 곳이었어요. 무엇보다, 테이블 간격이 넓어 시끄럽지 않고, 조용한 분위기여서 더욱 마음에 들었어요. 최근에는, 삼섬역 현대백화점 무역점 지하 식품코너에 입점했다고 하는데요. 꿀팁 한가지 알려드리면, 현대백화점에서 구매한 구매영수증을 가지고 성수동 매장으로 가면 음료 1잔을 무료로 제공해준다고 해요. 단, 유효기한은 구매 후 한달이내라고 하네요. 삼성역에서 성수역까지는 가까운 거리가 아니지만 ㅎㅎ 마침 두 곳 다 볼일이 있는 분들이라면 참고하시면 좋을 것같아요. :) 성수동카페 테니 베이커리 (Tenne) 주소 : 서울 성동구 뚝섬로 17가길 55 1층 성수역 8번 출구에서 도보 585m (7분) 영업시간 : T. 0507-1341-3094 캐치테이블로 예약가능(식사)* 성수 테니는 성수동 2가에 위치해있고, 도보 7분 거리가 접근성도 좋았어요. 50m © NAVER Corp. 테니 서울특별시 성동구 뚝섬로17가길 55 1층 예약 제레미 볼레스터 쉐프가 오픈한 테니 베이커리 카페는, 베이커리 겸 레스토랑이라 디저트부터 식사까지 폭넓게 즐길 수가 있는 브런치 카페에요. 브런치 메뉴는 오전 10시~오후 5시까지 그리고 디너메뉴는 오후 5시~ 오후 8시 반까지 주문가능하다고해요. 네이버 예약으로 사전예약도 가능하다고 하니 참고하세요. :) 테니 베이커리 메뉴판. 베이커리와 음료 외에도 샌드위치, 브런치, 스프, 샐러드, 파스트, 리조또를 판매하고 있었고, 런치/디너 메뉴도 별도로 있었어요. 점심시간에는 몇가지 할인도 받을 수 있으니 참고하세요 :) 샌드위치와 커피/티 주문시, 2,000원 할인 샌드위치와 스프/샐러드 주문시,3,000원 할인 샌드위치와 스프/샐러드 그리고 커피/티 주문시 4,000원 할인 그린 라따뚜이 포카치아 7,000원 핫 허니 페퍼로니 포카치아 7,000원 트러플 소금빵 5,000원 말돈 소금빵 5,000원 소금빵이 보통 2,000원이라 처음엔 왜이렇게 비싸지?했는데.. 오우! 트러플/말돈 소금이 들어간 소금빵이라니... 한번 먹어보고 싶다는 생각이 드네요. 성수갈일 있으면 테니 베이커리는 필히 재방문해야겠당... 까눌레 4,000원 휘낭시에 3,500원 허니 고르곤졸라 휘낭시에 4,000원 프렌치 어니언 휘낭시에 4,000원 테니 베이커리의 테라스 분위기에요. 날씨가 좋다보니..이미 사람들로 꽉 차있었어요. 화창한 봄날 따스한 햇볕아래 카페 테라스에서 커피 한잔. 생각만해도 너무 낭만적이지 않나요? 오래전 호주여행을 했을 때, 카페 테라스에서 빵 하나에 모닝커피를 마시며 담소를 나누는 아주 여유로운 모습의 노인들의 모습이 떠오르네요. 여름이 오기전에.. 테라스석에 도전해봐야겠어요! 다양한 와인도 구비되어 있었어요. 잔으로도 마실 수 있도, 보틀로도 주문이 가능했어요. 조용한 분위기와 유럽풍 느낌의 실내 인테리어가 아주 마음에 들었어요. 안쪽으로 들어가면 또 이렇게 넓은공간이 있어요. 천장도 넓고 아늑한 분위기도 났어요. 화장실 옆쪽에 비치된 휴지와 컵, 물 주전자. 주전자도 예쁘고 거울도 예쁘네요. 안쪽 실내 분위기에요. 따뜻하고 편한 분위기, 그리고 조용해요. 고풍스러우면서도 세련된 느낌의 인테리어. 무척 깔끔해보이기도 하죠? 아주 마음에 들었어요. 나중에 집안 분위기를 이렇게 꾸며보면 어떨까하는 생각이 들었어요. 굿굿. 친구들 네명이서 주문한 디저트와 음료. 이렇게도 찍어보고 저렇게도 찍어봐도, 사진이 예쁘게 안나오넹.. ㅎㅎ 밀푀유 8,000원 애플시나몬 뉴욕롤 5,500원 퀸아망 5,000원 테니베이커리에서 제일 유명하다는 퀸아망은, 말차, 얼그레이, 시나몬, 커피카라멜 등 종류가 다양했어요. 그런데.. 생각보다 맛은 평범했던 것같아요. 일단 빵들이 대부분 바삭한 느낌을 넘어 딱딱하다고 느낄 정도였어요. 밀푀유 8,000원 밀푀유 케잌 먹고 실패한 적이 없는데.. 이건 뭐랄까 케잌의 부드러움은 생략된 비스킷 먹는 느낌이었어요. 생각보다 별로였습니다. 냉정히 말해서.. 가격은 사악한데 맛은 그 가격의 1/2 가치도 안됨. 내가 주문한 게 젤 비쌌는데.. 재방문의사 : 50~60% 테라스석과 아주 마음에 드는 실내 인테리어와 분위기. 다 좋았는데.. 디저트가 저희가 주문한 것들은 다 맛이 없었어요. 어쩜 5개가 다 그렇지?.. ㅠㅠ 그래도.. 근처에 다시 가게된다면, 다른 빵에 도전해볼 마음은 있어요. 일단 내부 분위기가 반 이상은 먹고 들어가니깐요..^^ 오늘 포스팅 어떠셨어요? 또 만나요~"
"성수동 브런치, Tenne 테니 베이커리","지인분의 개인전이 성수동에서 열려 오랜만에 성수동 나들이를 하게 되었어요. 전시 관람 전 브런치를 먹기 위해 친구들과 들린 성수동에서 핫한 베이커리 브런치 카페 소개드려 봅니다! 성수동 빵 맛집, 브런치도 가능한 Tenne 테니 베이커리 50m © NAVER Corp. 테니 서울특별시 성동구 뚝섬로17가길 55 1층 예약 성수동 브런치 베이커리 Tenne 테니 <영업시간> 월-목 : 8:00 - 21:30 금 : 8:00 - 22:30 토 : 10:00 - 22:30 일 : 10:00 - 21:30 *테라스 자리 반려동물 동반 가능합니다. *브런치 타임은 오전 10시부터 오후 4시까지입니다. <예약> 캐치테이블 및 네이버예약 가능 <주차> 매장 주차 가능 (4대) 만차 시 인근 유료 주차장 이용해야 함 포장손님은 매장 입구에 잠시 정차 가능 <콜키지> 최대 2병까지 가능 병당 1만원 오픈 시간이 전반적으로 일러 이른 아침식사나 브런치가 가능한 성수동 베이커리 카페였어요. 저희는 12시경 방문해 보았습니다. Tenne 테니라고 읽으면 되는것 같아요! 건물 외관 모습입니다. 여러가지 브런치와 샌드위치를 사진으로 확인할 수 있는 배너 담아보았어요. 날씨가 좋은날 앉으면 좋을 테라스 자리입니다. 저희가 방문한 날 갑자기 날씨가 너어무 따뜻해져 테라스 자리에 앉으면 딱 좋았을텐데 복작복작 이미 사람이 들어차 4인 자리가 없더라고요. ㅎㅎㅎ 성수동 브런치 맛집으로도 유명하지만 이름이 테니 베이커리인만큼 빵이 그렇게 맛있다고 해요! 카운터 진열장에서 다양한 종류의 빵과 구움과자, 케이크, 디저트 류를 살펴 볼 수 있습니다. 케이크류를 홀사이즈로 구매원하시는 경우 미리 예약 하셔야 해요. 비주얼 무엇... 진짜 맛있어 보이네요. ㅎㅎㅎ 요즘 무화과가 제철이지요. 제 최애 과일. 브런치 뿐 아니라 다양한 빵들을 음료와 즐길 수 있더라고요. 주문을 진행하는 동안 카운터 근처를 담아 보았습니다. 브런치와 곁들여 마실 수 있는 와인 종류들도 볼 수 있었어요. 여기도 햇살 맛집입니다. 태양없인 살수 없당 엄청나게 큰 거울이 가짜 벽난로 위에 있음 나름 예쁘더라고요. 포토존으로 보시면 될 것 같네요 ㅎㅎ 예쁘게 입고 오는날 사진 남기기 좋아보였습니다. 저희는 좀 더 안쪽 자리를 찾아 들어왔어요! 12시 도착 했을땐 사진처럼 비워져 있었는데 주문 하다보니 곧 모든 테이블이 다 차더라고요. 저희는 미리 예약을 하고 방문하였습니다~ 벽돌벽과 큰 아치형 유리 통로가 어우러져 뭔가 목가적인 분위기의 공간이예요. 테이블마다 짐 놓는 수납함이 따로 있어 편리하였습니다! 성수동 브런치 베이커리 카페! 테니 메뉴판입니다. 브런치와 샌드위치류, 커피 음료 등 보실 수 있고 빵이나 케잌은 쇼케이스에서 고르시면 되요~ 저희는 연어 에그 베네딕트, 사워도우 멜트 치킨 룰라드, 한우 스테이크 퀘사디아, 베이컨 에그 베네딕트 음료와 빵을 주문했어요! 사워도우멜트입니다. 매일 직접 굽는 사워도우빵에 잠봉, 치즈, 토마토를 더한 샌드위치입니다. 감자튀김이랑 같이 나왔어요! 일단 사워도우를 너무 좋아하기도 하고 잘 구워진 빵에 치즈와 잠봉, 토마토를 곁들이면 맛이 없을 수 없는 조합이지요! 연어 에그 베네딕트입니다. 비트 연어 그라블락스와 수란을 직접 구운 잉글리쉬 머핀위에 올리고 시금치와 홀렌다이즈 소스를 곁들인 접시입니다. 요것도 안맛있을 수 없지 ㅋㅋㅋㅋㅋㅋ 에그 베네딕트는 언제나 제 최애 브런치 메뉴 중 하나예요~ 풍성하다... 이날 식사는 전시회 오픈을 한 작가님 친구가 사주었습니다. 감사히 잘 먹었어용! 치킨 룰라드입니다. 수비드한 닭 반마리를 구운 야채 샐러드, 밥과 함께 내어주는 요리입니다. 소스가 된장같이 특이했는데 (형태나 색이 된장같음 ㅎㅎㅎ) 로메스코 소스라고 부른다고 해요. 스페인 쌈장이라고 보시면 됨. ㅎㅎㅎ 한우 스테이크 퀘사디아입니다. 투쁠 한우로 만든 호화로운 퀘사디아... 한우 외 구운 파프리카와 양파, 샐러드도 함께 곁들여집니다. 한우라 그런지 고기 양이 많아 그런지 퀘사디아 1개만 먹어도 속이 든든해지기 시작해요. 디저트로 함께 곁들인 빵입니다. 에그타르트 같은데 테두리가 페스츄리처럼 여러겹으로 구워졌어요! 크기도 왕크고 맛있음! 너무 배불러 못먹고 포장한 빵까지 맛이 어떨지 궁금하네요~~ 대학생 꼬맹이 시절 배낭여행으로 유럽여행을 갔을 때 노천카페에서 먹는 빵과 커피가 그렇게 맛있었는데... 성수 테니 베이커리 테라스 자리에 앉으면 브루클린에서 브런치 먹는 것 같은 느낌이 들것도 같은? 분위기도 좋고 음식도 전반적으로 무난 (제 입맛에 살짝 짠 느낌이 있는데 제가 워낙 싱겁게 먹는편이긴 합니다.) 빵은 아주 맛있는 편이였어요! 8인까지 가능한 단체 좌석이 있어 다양한 모임도 가능한 점도 장점이고 테이블간 간격도 넓어 데이트 하기에도 참 좋아 보였어요~ 성수동 브런치, 빵 맛집 테니베이커리 후기였습니다! #성수동카페 #성수동맛집 #성수동베이커리 #성수동브런치 #성수동데이트 #성수동모임 #성수동단체"
