title,content
[성수 갤러리 카페] 성수동대림창고갤러리,"성수다락에서 점심먹고 근처 카페 대림창고갤러리 들렀어요 :) 성수동대림창고갤러리 영업시간 매일 11:00-22:00 주소 서울 성동구 성수이로 78 주차 유료(유료 표기된 주차라인 노상주차장) 차로 지나가다가 보고 창고형 카페인가 했는데, 역시나 공장을 개조해 만든 카페라고 하네요. 옛날 그대로의 모습과 현재의 모습이 공존하는 성수동대림창고갤러리 들어가자마자 엄청난 조형물이 전시되어 있었어요. 공장이었던 곳이라 공간도 크고 넓더라구요. 공간공간마다 색다른 분위기가 있는 것 같아요. 2층에는 올라가진 않았지만, 2층에도 테이블이 있는 것 같아요. 대림창고는 빛이 들어올 수 있도록 천장을 개방해놓아서 밝은 분위기가 나서 좋았어요. 이른 점심 먹고 왔는데도 사람이 꽤 있었는데, 음료마시고 앉아있다보니 사람들이 계속 들어오더라구요. 성수동 핫플 맞네요🙂 대림창고에서는 맥주도 판매 중이더라구요? 커피랑 음료 종류도 꽤 많구요. 저는 따뜻한 아메리카노로 주문했습니다. Next image 베이커리 류도 판매 중이었는데, 빵 위에 비닐 덮개로 덮여있어서 조금은 더 위생적으로 느껴졌어요 :) Next image Next image 갤러리 카페라 그런지 음료나 디저트, 베이커리류 전체적으로 가격대가 상당하더라구요. 커피랑 디저트랑 이것저것 하니까 거의 밥값나옴🤣 저희는 바닐라 까눌레(4,000), 얼그레이 까눌레(4,000), 연유버터 라우겐(5,700), 당근케이크(9,000) 먹어봤어요. 까눌레 겉바속촉 맛있더라구요. 역시 디저트는 아메리카노랑 먹어야죠☕️ 당근케이크 크림도 맛있고 당근이 씹히는데 거부감 없고 식감이 좋았어요. 아메리카노는 특별할 건 없지만 산미는 없는 원두라 좋았구요. 사람이 많아서 시끌벅적 하지만 카페 분위기 자체는 빈티지 느낌 나고 좋았어요. 사람많을때는 음료 대기시간이 길다고 하니 참고하셔서 방문하세요! 50m © NAVER Corp. 성수동대림창고갤러리 서울특별시 성동구 성수이로 78"
[성수] 성수동대림창고갤러리 성수카페 (#커피 #베이커리),"성수동대림창고갤러리 갤러리 같기도 창고 같기도 한 성수동대림창고 카페 :) ☕상호명: 성수동대림창고갤러 🚶🏻주소: 서울 성동구 성수이로 78 / 성수역 3번출구 304m ⏰ 11:00 -22:00 🔺️ 성수동 대림창고 갤러리 공식계정(@daelimchanggo_gallery) • Instagram 사진 및 동영상 팔로워 2,008명, 팔로잉 524명, 게시물 46개 - 🔺️ 성수동 대림창고 갤러리 공식계정(@daelimchanggo_gallery)님의 Instagram 사진 및 동영상 보기 www.instagram.com 50m © NAVER Corp. 성수동대림창고갤러리 서울특별시 성동구 성수이로 78 안녕하세요 :) 조블리입니다 몇일 전에 성수쪽에 모임이 있어 나갔어요 원래 가려고 했던 곳은 가지 못하고 성수동 왔으니 대림창고 가자 하고 간곳이었어요 성수동 하면 할아버지공장 카페와 대림창고 카페가 유명하잖아요 예전에 갔었는데 오랜만에 갔는데 더 좋으것 같아요 층고도 높고 갤러리 느낌의 카페 이런 분위기 참 좋은것 같아요 👍🏻 #성수카페 #성수동카페 카페 이렇게 창고 들어가는 분위기 카페 문을 열면 와!!! 갤러리 처럼 작품도 전시 되어 있고 탁 트인 느낌의 카페 좋네요 :) 두 개 형태로 카페가 나눠져 있는데 안쪽 테이블보다는 바깥쪽 테이블이 더 시원한것 같아 이쪽으로 자리 잡았어요! 커피바 저녁에는 술도 알콜도 파는것 같아요 커피와 알콜의 만남 베이커리 베이커리 종류도 꽤 많이 있고 성수동대림창고갤러리 대표 메뉴는 딸기우유 #대림창고딸기우유 직접만든 딸기로 일일 한정수량 판매 이렇게 전시 되어 있어 판매 되고 있네요 갤러리 나름 작품을 전시 해 놓기도 하고 캐릭터 그림도 있더라구요 포스터 처럼 꾸며 놓기도 했어요 나무를 이용해 전시 공간을 만들어 놓고 보는 재미도 있는 카페에요 주문한 음료 빵도 주문 하고 음료도 다양하게 주문 베이커리가 생각보다 달지 않아 정말 맛있게 먹었어요 너무 달면 어떻하지 그랬는데 왠걸 생크림이 폭신하고 과일 무화과랑 잘어울리더라구요! 커피 한잔과 먹는 빵은 언제나 굿굿 ☕ 🌷조블리한줄평 : 갤러리 카페여서 보는 재미도 있고 층고가 높아 답답함 없이 도심에서 볼 수 없는 대형 카페 인것 같아요 성수동에 있어서 그런지 외국인 손님도 많고 테이블마다 느낌도 다르고 자연친화적인 그런 카페여서 식물원에 있는 듯한 기분도 들었답니다 커피도 베이커리 종류도 맛있어서 한번 정도 가보셔도 좋을것 같아요 🥐 * 주관적인 생각입니다 글 읽어주셔서 감사합니다 :) #내돈내산 #성수동카페 #성수카페 #대림창고 #성수동대림창고갤러리 #성수동커피 #성수역카페 #대림창고 #성수동카페거리 #성수동카페 #갤러리카페"
[성수동카페-대림창고갤러리-성수동대림창고갤러리 카페 와이프와 다녀온 성수동카페],[성수동카페-대림창고갤러리-성수동대림창고갤러리카페 와이프와 다녀온 성수동카페] 10월에 회원님 결혼식 갔다가 다녀온 성수동. 오랜만에 와이프와 둘이 데이트. 성수동 거리를 걷다가 길 건너에 분위기 좋아 보이는 곳이 있길래 가보니 카페였다. 50m © NAVER Corp. 성수동대림창고갤러리 서울특별시 성동구 성수이로 78 카페 이름은 성수동대림창고갤러리!! 성수동대림창고갤러리 [성수동 거리] [성수동 거리] #성수동 #성수동거리 몇 주 전 회원님 결혼식 갔다가 오랜만에 아내와 데이트하면서 찍어본 ... blog.naver.com [주말에 다녀온 성수동-성수동 거리] [주말에 다녀온 성수동-성수동 거리] 주말에 회원님 결혼식 축하드리러 서울 남산 갔다가 아내와 다녀온 성... blog.naver.com 성수동 거리를 걷다가 찍어본 사진 지난 포스팅! 와이프와 거리를 걷다가 길 건너에 저 건물 내가 좋아하는 스타일이네 이야기 나누다가 길 건너보니 카페였다. 와이프와 구경할 겸 커피도 마실 겸 가보자 하고 벽돌 건물로 향했죠. 길 건너서 도착한 성수동대림창고갤러리카페! 이때 슈퍼올드쇼라는 전시회가 열리고 있었습니다. 지금은 끝났을 거예요. 대림창고갤러리카페로 들어가 봤습니다. 입구를 지나 들어가 보니 옛날 공장 같은 곳을 리모델링한 거 같았습니다. 층고도 높고 답답하지 않은 분위기! 성수동대림창고갤러리카페의 모습을 사진에 몇 장 담아봤습니다. 입구에서 들어갔을 때의 테이블과 커피와 빵을 주문하는 곳! 입구 쪽에서 왼쪽에도 커피를 마실 수 있던 공간이 있었습니다. #대림창고갤러리 #성수동카페 #성수동대림창고갤러리 #슈퍼올드쇼 #성수동대림창고갤러리카페 빵들이 전시되어 있던 모습! 저희도 이 그림 아래 테이블 자리를 잡고 앉아서 커피와 빵을 주문했습니다. 잠시 숨 좀 돌릴 겸 어디 또 구경 갈지 커피와 빵을 먹으며 생각해 봤습니다.ㅎ 이상 지난 10월에 다녀온 성수동 카페 성수동대림창고갤러리카페 방문 포스팅 끝! 즐거운 주말 보내세요~
"성수동 카페거리 핫플, 인더스트리얼한 느낌의 대형카페 #성수동대림창고갤러리","성수동에서 카페 검색을 하니 가장 추천이 많았던곳!! 대림창고를 다녀왔어요. 원래 공장, 창고 .. 이런걸로 쓰던 곳을 리모델링해서 갤러리를 겸한 카페로 만들었다는데 외관부터 굉장히 특이하더라구요. 성수동 카페거리 핫플 성수동 대림창고 갤러리 인더스트리얼한 갬성이 아주 멋스러워요. 날씨가 너~~무 더워서 헥헥 거리며 찾아왔어요. 출입문이 굉장히 거대해요. 들어서자 마자 나무로 만든 조형물이 뙇~~ 방직기 같은 느낌도 있고 뭔가 공장 내의 어떤 기계를 형상화한거같아요. 입구 좌측엔 이런 갤러리 느낌의 공간이 있군요. 성수동 카페거리 핫플, 대림창고는 안으로 들어가면 규모가 상당해요. 사람도 많고요. 실내 분위기는 사진으로 확인하셔요. (클릭하면 크게 볼수있어요.) 카운터가 오른쪽에 있고 메뉴는 칠판 글씨로 적혀있어요. 홀 중앙에 베이커리 쇼케이스도 있어 디저트를 골라볼수도 있겠죠?? 한켠에는 판매용 드립백도 있는데 여기 커피맛이 괜찮아서 선물용으로 사가도 좋을것같아요. 점심으로 느끼한걸 먹어서 아아를 주문했어요. 커피만 먹으면 아쉬우니까 체리크로와상 성수동 카페거리 핫플, 대림창고. 커피가 상당히 맛있어요. 좋은 원두를 쓰나봐요. 넓고 사람도 많아서 살짝 정신없긴 하지만 나름 느낌있는 카페였어요. 서울 여행 오랜만에 온 부산 촌사람이라 서울 카페는 “우와~~~”. 할줄 알았는데 의외로 덤덤… 요즘은 부산에도 좋은 곳이 하도 많아 그렁가봉가~~ 50m © NAVER Corp. 성수동대림창고갤러리 서울특별시 성동구 성수이로 78 영업시간 11:00~22:00 성수역 3번 출구에서 304m 0507-1390-9669 #성수동카페거리핫플 #성수동대림창고 #성수동카페 #서울성수카페 #성수동카페거리 #성수동핫플 #성수동대형카페 #성수동가볼만한곳"
[서울 성수] 성수동대림창고갤러리 | 성수동 대형카페,"50m © NAVER Corp. 성수동대림창고갤러리 서울특별시 성동구 성수이로 78 서울 성동구 성수이로 78 0507-1390-9669 8년전인가.. 친구들이랑 다녀왔던 대림창고~~ 그 뒤로 성수동 주변에 예쁜 카페가 많이 생겨서 지나가기만 하다가 오랜만에 다녀왔어요~~! <메뉴판> 커피종류가 다양하더라고요! 여기는 예전에 공장이었는데 개조해서 카페를 만든곳이래요~ 갤러리카페인만큼 그림도 많았고 구조물들이 예술작품처럼 느껴지더라고요! 오늘 아이스아메리카노(6,000) 아인슈페너(7,500) 크레마가 대박이죠👍🏼 커피는 원두도 중요하지만 누가 어떻게 커피를 내리는지에따라서 맛도, 향도 달라지는데 진짜 맛있어요!!!!💗 #성수동대림창고갤러리 #성수동카페 #성수카페 #상수카페추천 #성수동카페추천 #성수동커피맛있는곳 #성수커피추천 #성수동대림창고 #성수대림창고 #성수카페 #성수동아이스아메리카노 #성수아이스아메리카노 #대림창고 #성수대림창고 #권남매 #권남매블로그성수대림창고 #권남매블로그대림창고 #그린 #그린이 #그린이대림창고 #아이스아메리카노 #아아"
장례희망 모임은 계속된다♥ (성수동대림창고갤러리),"[장례희망] 책으로 만들어지다: 죽음에 대한 우리들의 생각 (Feat. 빈지노, 박재범, BTS) 우리의 생각과 말들이 이렇게 책으로 모아질 수 있다니 정말 놀랍다.. 이렇게 책 제작까지 될 줄은 몰랐는... blog.naver.com 장례희망 모임이 끝난지 2~3달이 지났다. 그래도 인연은 계속된다. 한가위 전에 만나기로 했는데 드디어 만났따! 성수동대림창고갤러리 서울특별시 성동구 성수이로 78 성수동대림창고갤러리에서 만났다. 죄송하게도.. 나는 지각했따ㅜ 호가든 로제~ 목 넘김이 좋다♥ 다들 'd' 하는데 나는 'b'하고 있다 바부~ㅋㅋ 지나가다 본 신기한 거 (성수역 근처) 재생 0 좋아요 0  지나가다 본 신기한 거 (성수역 근처) 와 힙하다 힙해! 관련글 살 날이 얼마 안남았다면, '나'의 버킷리스트는 어떻게 변화할까? [장례희망 3주차] 목요일마다 광진오랑에서 '장례희망'이라는 수업을 듣습니다. 어제까지 벌써 3주차였는데요. 수... blog.naver.com"
"성수 카페, '성수동대림창고갤러리' 공장을 개조해 만든 성수동 창고형 갤러리 카페","성수동대림창고갤러리 📍위치 : 서울 성동구 성수이로 78 성수역 3번출구에서 304m 성수역 3번출구로 나와서 우측방향으로 300m 🕒 운영시간 : 월-일, 11:00 - 22:00 📞 연락처 : 0507-1390-9669 네이버 플레이스 성수동대림창고갤러리 서울특별시 성동구 성수이로 78 안녕하세요~ 탱지입니다 : ) 4월 말에 친구들이랑 성수에 있는 팝업스토어 구경하고, 돌아다니던 중 성수동대림창고갤러리를 발견했어요!! 외관도 독특한데, 실내가 살짝 보이는데 조형물이 너무 예쁘게 생긴거에요.. 그래서 바로 홀리듯이 카페 안으로 들어갔습니다ㅋㅋ 우리가 홀렸던 조형물중 하나입니다 ㅋㅋ 문이 활짝 열려있어서 카페 내부가 보였는데 저 조형물이 정말 예쁘더라구요!! 대림창고갤러리가 공장을 개조해서 만든 카페라 천장도 진짜 높고, 넓어서 답답한 느낌이 없었어요 Next image 대림창고갤러리의 메뉴판 입니다! 점심을 먹고 와서 음료만 주문하기로했어요. 케이크, 딸기우유도 판매하고 있네요~ 🍓♥️ 대림 딸기 우유는 직접 만든 딸기코디얼로, 일일 한정수량 판매한다고해요! 심지어 각종 다양한 빵들까지!! 옛날부터 소금빵이 유행인데, 저는 아직까지 못먹어봤어요. 언제쯤 소금빵을 먹어볼 수 있을까요..흑흑 지금보니 저때 못먹었던 빵들이 눈에 밟히네요.. 대림창고 카페 내부입니다! 카페가 진짜 넓죠? 곧곧에 작품도 전시되어있어요. 제가 방문했을 때에는 《꼬리를 스스로 삼키는 자는 끊임없는 선을 그린다 》 라는 전시를 하고 있었어요 😊👍🏼 대림창고 전시소식을 알고싶으면 인스타그램 @daelimchanggo_gallery를 확인하시면 됩니다! 사진 찍기도 정말 좋을것 같은곳..♥️ 난로도 있던데, 겨울에 난로를 틀어주실까요? 아님 그냥 장식일까요 ㅋㅋ (궁금) 대림창고에서 공부하시는 분들도 많이 계셨어요 카페가 넓어서 노트북 하기도 괜찮을것 같아요 진동벨이 울리면 음료를 픽업해오시면 됩니다! 아이스아메리카노, 오렌지주스, 초콜릿라떼입니다 각자 취향이 들어나는 음료들이네요 😊✨ 음료 마시면서 얘기를 나눴어요 분위기가 좋아서 카페에서 얘기 나누는동안 너무 좋았네요! 성수에서 분위기 좋은 카페를 찾으신다면 대림창고 강추드립니다 👍🏼👍🏼 📍위치📍 50m © NAVER Corp. 성수동대림창고갤러리 서울특별시 성동구 성수이로 78 #성수대림창고갤러리 #성수동대림창고갤러리 #대림창고성수 #성수대림창고 #성수분조카 #성수카페추천 #성수분위기좋은카페추천 #성수데이트 #성수빵맛집 #성수커피맛집 #성수내돈내산"
성수동 핫플레이스 대형카페 성수역 카페 성수동대림창고갤러리 주차 메뉴 게이샤 시그니처 슈페너 후기,"요즘 핫플은 바로 성수죠! 성수역 근처 성수동 대림창고 갤러리 창고형 갤러리 카페에 가보았어요 성수동의 랜드마크라 불리는 대림창고는 70년대 정미소로 사용되던 붉은 벽돌 건물이에요 정미소 건물을 최대한 유지하며 개조했기 때문에 빈티지한 분위기가 매력적이고 젊은 커플들에게 인기 있는 카페에요! <성수동대림창고갤러리> 서울 성동구 성수이로 78 성수역 3번출구 우측방향으로 300m 영업 11:00~22:00 0507-1390-9669 *주차안내 1.유료 표기된 주차라인의 노상주차장 (점포,지정 표기된 주차라인은 주차불가) 2.한라시그마밸리 유료 지하주차장 이용 50m © NAVER Corp. 성수동대림창고갤러리 서울특별시 성동구 성수이로 78 성수역 카페 성수동대림창고갤러리 들어가자마자 커다란 조형물이 있어요 개성 넘치는 인테리어와 작품을 전시하는 대림창고 카페입니다 성수동 핫플레이스 대림창고는 공장을 개조해 만든 창고형 갤러리 카페입니다 천장이 아주 높게 트여 있죠? 내부는 정말 넓습니다 그리고 사람들이 정말 많아요 안에 정원 같은 공간이 있어요 여기에도 예술 작품이 전시되어 있네요 인더스트리얼 인테리어! 다른 세계에 온 느낌이드는 벽난로에요 다양한 연령대의 사람들 남녀노소 가릴 것 없이 모여 담소를 나누고 있습니다 오픈된 넓은 공간에서 음료를 만들어줍니다 게이샤 시그니처 음료들이 있어요 게이샤 슈페너 17.0 게이샤 모카 17.0 게이샤 코스 17.0 Draf & Craft Beer 메뉴에는 필스너우르켈, 호가든, 호가든로제, 스텔라, 폭포페일에일, 레페브라운 있어요 대림창고 딸기우유 직접만든 딸기코디얼로 일일 한정수량으로 판매하는 대림창고 시그니처 음료죠! 소시지 페스트리, 까눌레, 휘낭시에 데니쉬빵, 베이글 무화과 & 크림치즈 얼그레이 크림 크로핀 카야 크루와상, 코코넛 크루와상 연유버터 라우겐, 시나몬 프레즐 휘낭시에, 무화과 휘낭시에, 브라우니, 레몬 파운드케이크 쇼숑오뽐므, 뺑오쇼콜라 등등 다양한 베이커리 메뉴가 준비되어 있습니다 빵 맛집이네요! 게이샤 시그니처 메뉴 중 게이샤 슈페너 !! 17,000원이라는 가격에 주문할까말까 고민했는데! 가격만큼 맛이 훌륭했습니다 부드럽고 달달하고 향이 강했어요!! 함께 주문한 아메리카노도 맛났어요!! 여기서 사진을 찍으면 정말 잘 나옵니다 인생사진 맛집이에요! 성수동카페 성수동대림창고갤러리 추천합니다^^ #성수동대림창고갤러리 #성수동대림창고 #대림창고 #성수동핫플레이스 #성수동대형카페 #성수역카페 #성수카페 #성수핫플레이스 #성수핫플 #성수카페거리 #갤러리카페"
성수동대림창고갤러리 갬성카페 솔직후기,"안녕하세요! 밧드입니다 밧하! 끝나지않은 성수동 나들이 업로드입니다 ㅋㅋ 바로 직전 포스팅을 노티드성수를 올렸었는데요~! 오늘은 성수동대림창고갤러리를 포스팅해봅니당 :) 일단 남편과 연애때도 가끔 왔던 곳! 저희부부에게는 나름 추억이 있는 곳이에용 :) 그럼 성수동대림창고갤러리의 입구사진부터 보여드릴게요! 대림창고는 창고로 쓰이던 곳을 개조해서 카페로 만든 성수동 1세대 카페로 알고있어요~ 근데 오늘 성수동을 열심히 돌아다녔는데 성수동대림창고갤러리 만한 카페가 없더라구요!? 결국은 돌아 돌아 다시 여기로 왔답니당 ㅠ 그럼 한번 성수동대림창고갤러리로 같이 들어가볼까요? 처음 들어서면 보이는~ 전시물과 가게 앞쪽의 모습입니다 ㅋㅋㅋㅋㅋ 오랜만에 와도 역시나 반가운 성수동대림창고갤러리 바이브~ 그럼 성수동대림창고갤러리의 가격정보를 살펴볼까요? 가격정보 *아메리카노 5,0 아인슈페너 6,5 카페라떼 6,0 코르타도 6,0 *바닐라라떼 7,0 카페모카 7,0 아포가토 8,5 아메리카노 6,0 카페라떼 6,0 초콜릿라떼 8,0 밀크티 8,0 클드브루 아이스티 8,5 말차라떼 8,0 말차 아포가토 8,5 대림창고딸기우유 9,0 성수동대림창고갤러리는 이정도 가격대를 형성하고 있으니 참고 부탁드립니다! 성수동대림창고는 빵 종류도 엄청 많아요! 좌라라락 진열이 되어있는 진열대를 찍어봤습니당 :) 진짜 다 먹어버리고싶은 비주얼들,,,, 사람들도 많아서 빵들이 금방 소진될거같아요 ㅋㅋㅋㅋㅋㅋ 노출콘크리트와 전시되어있는 전시물들에서 힙함이 그대로 전해져오네요 ㅋㅋㅋ 여러 구석구석에서 그냥 단순한 카페가 아닌 성수동대림창고갤러리라는 이름처럼 갤러리로 보여지기 위한 노력을 많이 하는거같아요! 이런 노력,,,, 굿! 트리가 아직도 있어서 조금은 놀랬네요 ㅋㅋㅋ 크리스마스 지나고 그냥 냅두신듯,,,,? 대림창고는 언제가든 사람이 많아서 ㅠㅠ 최대한 다른분들 얼굴 안나오게 찍고 모자이크 처리 할수밖에 없겠더라구요! 성수동대림창고갤러리 갬성카페 솔직후기 (1) 재생 4 좋아요 0 00:00 00:10  성수동대림창고갤러리 갬성카페 솔직후기 (1) 대림창고의 현장감을 전해드리기위한 동영상도 촬영해보았답니다 :) 성수동대림창고갤러리 갬성카페 솔직후기 (2) 재생 2 좋아요 1 00:00 00:07  성수동대림창고갤러리 갬성카페 솔직후기 (2) 대림창고의 현장감을 전해드리기위한 저희가 앉아있던 옆방도 가서 촬영을 해보았습니당 ! 저희가 시킨 디카페인 아메리카노와 바닐라라떼, 9천원짜리 조각케익이 나왔네요! 솔직후기 오랜만에 왔지만 성수동에 한시간 정도 밥먹고 소화시킬겸 걸어다니면서 여기저기 구경을 해봤지만 대림창고만한 분위기를 가진 카페는 사실상 서울에서 생기기가 힘들죠,,, 일단 서울인데 이 정도 크기가 생기기는,,, 기업이 아니고서는 ㅋㅋㅋㅋㅋㅋㅋㅋㅋ 그나저나 케잌에 대림창고라고 영어로 써있는데 조금 별로다...? 이런 생각도 했답니다 ㅋㅋㅋㅋㅋ 이 힙한 장소에 케잌에는 뭔가 동네케잌집에 올라갈만한 데코를 해놔서 뭔가 그렇더라구요? 저희 같았으면 DLCG 뭐 이런식으로 했으면 어땠을까 이런 말도안되는 말도 남편과 주고받으면서 먹었답니다 ㅋㅋㅋㅋㅋㅋㅋㅋ 그리고 생각보다 케잌이 진짜 작아서 9천원은 조금 비싸다,,, 라는 생각을 했지만 음,,,, 여기는 성수동이니까! 어쨌든 커피값은 장소에 비해 (제주같은곳 생각해보면) 그리 비싸진 않은 듯 하고! 한번쯤은 꼭 방문해보시기를 추천드려요~ 그럼 이만 밧빠! 성수동대림창고갤러리 / 밧드의 최애카페 / 솔직후기 안녕하세요! 밧드입니당 밧하 😀 오늘은 저의 최애 까페중 하나인 😀 성수동대림창고갤러리 포스팅해보... blog.naver.com 전에 대림창고를 다녀왔던 포스팅도 링크 남겨볼게요~ 궁금하신분들은 클릭 요망 헿 100m © NAVER Corp. 성수동대림창고갤러리 서울특별시 성동구 성수이로 78 성수역 2호선 서울특별시 성동구 아차산로 100 #성수동대림창고갤러리 #성수동카페추천 #대림창고 #성수역주변카페추천 #성수동갬성카페추천 #성수동대림창고"
