title,content
성수동대림창고갤러리 : 공장을 개조한 성수동 카페거리의 핫한 대형카페,"안녕하세요. 혀니유입니다. 😍 오레오 팝업스토어에 가려고 현장 대기 예약 후 카톡 알림이 오기만을 기다리다가 성수동에 카페거리가 있다는 것을 알았어요. 그렇게 카페를 알아보다가 발견한 성수동대림창고갤러리!!! 성수동대림창고갤러리 ✔️ 서울 성동구 성수이로 78 2호선 성수역 3번 출구에서 304m ✔️ 월요일부터 일요일 11:00~22:00 ✔️ 0507-1390-9669 50m © NAVER Corp. 성수동대림창고갤러리 서울특별시 성동구 성수이로 78 성수역 3번 출구로 나와서 우측 방향으로 300m 정도 걸어가다 보면 대림창고가 보여요. 저희는 오레오 팝업스토어에서 아이들과 시간 보낼 곳을 찾아 헤매다가 우연치 않게 발견한 곳이었거든요. 처음에는 다른 곳을 찾았는데 그 카페가 월요일이 정기 휴무라서 낙담하던 차에 발견한 곳이라 더 반가웠어요. 그 유명한 대림 참고인 줄 모르고 낙후된 건물에 입구도 무거운 문으로 보이고 신기하게 쳐다보던 중에 발견한 곳이라서 더 신기했어요. 문이 워낙 크고 무거워서 왕건이처럼 당기면 안 돼요. 밀어야 해요. 밀어도 무게감이 상당하더라고요. 문을 열자마자 펼쳐지는 모습이에요. 정말 깜짝 놀랐어요. 대림창고에 대해 흘려듣기만 했지 정보가 1도 없었기 때문에 정말 놀랄 수밖에 없었어요. 안쪽으로 엄청 넓은 공간이 저를 또 놀라게 했어요. 말로만 듣던 대형카페. 서울촌♡ 티 내는 거 같아서 좀 창피하기도 했어요. 여기 쪽문으로 올라가면 2층도 있어요. 아이들이 2층을 궁금해해서 2층으로 올라가 봤어요. 2층도 여유 있는 공간으로 꾸며져 있었지만 저희는 1층에서 자리를 잡기로 했어요. 주문하는 곳 음료 받아 가는 곳 반납하는 곳 주문하는 곳 바로 앞에는 입맛 돌게 하는!! 엄청 많은 종류의 베이커리가 진열되어 있어요. 메뉴판을 보니 맥주 종류도 판매하더라고요. BEER, NON COFFEE, COFFEE 아메리카노 6000원, 카페라때 7000원, 아인슈페너 7500원. 대림창고의 시그니처 메뉴인 딸기우유와 티라미슈 각 9천 원씩 가격에 깜짝 놀랐어요. 주문하는 곳 옆에는 냉장 보관해야 하는 우유, 티라미수, 당근 케이크 같은 베이커리도 진열되어 있어요. 메인홀도 엄청 넓고 층고가 높아서 전혀 답답하지 않았는데 메인홀 옆에 메인홀과 비슷한 느낌의 인테리어로 서브 홀이 있었어요. 저희는 서브 홀에 자리를 잡았어요. 단체 손님도 많고, 연인끼리 가족 단위로 방문한 손님들도 많았어요. 삭막할 수 있는 공간에서 발견한 초록이들이 반갑더라고요. 크루아상과 초코 라테, 아메리카노 이렇게 주문했어요. 아이들이 먹기 좋게 은 크기로 크루아상을 잘라봤어요. 바삭함과 부드러움의 공존!! 와~~~~ 열무가 엄청 잘 먹더라고요. 전 아이들이 너무 맛있게 먹어서 부스러기 쬐금 먹어봤는데 확실히 달라요~ 맛있어요. 사람들이 이 문을 열고 계속 들어가길래 여긴 어딘가 했더니 여자화장실이었어요. 어디 특별한 곳으로 이어지는 곳인 줄 알았다니까요. 아이들이 좋아할 만한 공간은 아니에요. 음악도 아이들이 아는 가요가 나오는 것도 아니고, 음악소리도 크고, 사람들의 수다 소리도 만만치 않고요. 아이들과 오레오 팝업스토어에 가기 위해 기다릴 공간을 찾다가 우연히 발견한 핫플에서 시간을 때운 거라서요. 열무는 빨리 나가자고 했고 왕건이도 지루하지만 어디 갈 곳이 없어서 그냥 시간을 무료하게 보냈어요. 그래도 오레오 팝업스토어에 방문해서 이렇게 생각지도 못한 대형카페에도 오게 되고 맛있는 커피도 마시고요. 창고형 대형카페 너무 좋은 거 같아요."
[오하우] 성수 랜드마크! 성수동대림창고갤러리 대형 카페,"[오하우] 성수 랜드마크! 성수동대림창고갤러리 대형 카페 안녕하세요! 내일을 위해 제로(O) 하는 법(HOW), 오하우의 김대리입니다:) 저녁에 회식 후 가볍게 커피 한잔하러 들어간 성수동대림창고갤러리! 공장을 개조해 만든 갤러리 겸 카페 대림창고인데요! 성수동 랜드마크로 대형 카페이지만, 주말엔 자리가 없을 정도입니다! 그럼, 포스팅 시작합니다! 성수동대림창고갤러리카페 📍위치: 서울 성동구 성수이로 78 ⏰영업시간: 11:00~22:00 ❗정기휴뮤: 없음 50m © NAVER Corp. 성수동대림창고갤러리 서울특별시 성동구 성수이로 78 성수역 3번 출구에서 쭉 직진하면 왼쪽에 위치해 있어요! [오하우] 성수 랜드마크! 성수동대림창고갤러리 대형 카페 빨간 벽돌이 인상적인 카페! 밖에서 바라본 카페의 분위기가 넘 예쁘네요 ㅎㅎ [오하우] 성수 랜드마크! 성수동대림창고갤러리 대형 카페 저녁에 와서 그런가?? 엄청 따뜻한 느낌이에요! [오하우] 성수 랜드마크! 성수동대림창고갤러리 대형 카페 갤러리 카페라 그런가 먼가 조형물들이 많이 있었어요! lighs, all right! 먼 소리죠 이게..? [오하우] 성수 랜드마크! 성수동대림창고갤러리 대형 카페 2층도 있어서 전체적으로 카페가 천고가 높아요! [오하우] 성수 랜드마크! 성수동대림창고갤러리 대형 카페 들어가면 왼쪽 방향에도 넓은 공간이 있어요! [오하우] 성수 랜드마크! 성수동대림창고갤러리 대형 카페 크고 넓고 높고! 곳곳에 설치된 조형물들까지~! [오하우] 성수 랜드마크! 성수동대림창고갤러리 대형 카페 구경 그만하고 주문을 하러 다시 나가봅니다 ㅎㅎ [오하우] 성수 랜드마크! 성수동대림창고갤러리 대형 카페 주문하는 곳이에요! 그 뒤 매장 중앙에는 맛있는 빵이 있는데!! [오하우] 성수 랜드마크! 성수동대림창고갤러리 대형 카페 [오하우] 성수 랜드마크! 성수동대림창고갤러리 대형 카페 회식을 한 후고, 저녁 늦게 들러서 빵도 별로 없고 음료만 시켰답니다:) 다음엔 힘내서 빵도 먹을 거예요! [오하우] 성수 랜드마크! 성수동대림창고갤러리 대형 카페 메뉴판:) [오하우] 성수 랜드마크! 성수동대림창고갤러리 대형 카페 크리스마스트리 때문에 더욱 따뜻한 느낌이 팍팍!! [오하우] 성수 랜드마크! 성수동대림창고갤러리 대형 카페 카페가 너무 예쁘네요 ㅎㅎ [오하우] 성수 랜드마크! 성수동대림창고갤러리 대형 카페 한쪽 벽면엔 빔으로 이런 영상도 나오고~~ [오하우] 성수 랜드마크! 성수동대림창고갤러리 대형 카페 카페 제일 안쪽 구석도📸 [오하우] 성수 랜드마크! 성수동대림창고갤러리 대형 카페 주문한 음료들이 나왔네요 ㅎㅎ 음료가 하나 늘었어요! 왜냐면!! 오하우에 새로운 분이 입사했기 때문입니다👏👏👏 오늘은 성수 핫플 유명한 성수동대림창고갤러리 카페 포스팅을 했는데요! 성수동에 유명한 카페가 많잖아요?! 도장 깨기 하듯 다녀봐야겠습니다 ㅋㅋㅋ 그럼, 다음 포스팅에서 또 만나요~🖐 #오하우 #제로웨이스트 #zerowaste #성수핫플 #성수카페 #성수동카페 #성수동대림창고갤러리 #대림창고갤러리"
성수 카페 [성수동대림창고갤러리] 탁트이고 빈티지한 감성이 가득한 카페,"오~랜만에 방문한 성수동 완전 대만족 카페도 짱 좋음 성수동대림창고갤러리 서울 성동구 성수이로 78 0507-1390-9669 외부 성수 왔을 때마다 여기 지나갔는데 카페라고 생각을 안 하고 지나쳐서 처음 방문해요. 내부 와우, 이렇게 크고 개방감 넘칠줄 몰랐어요. 빛 들어오는 부분과 푸릇한 느낌이 유독 좋았어요. 안쪽으로 들어가면 또 이렇게 큰 장소가 있답니다. 원목 테이블도 너무 예뻐요 다만, 노래 소리가 다소 크다는 점 알아두세요 메뉴 Next image 음료와 원두 종류 다양하고 맥주까지 있네요 빵 종류도 엄청 많았어요! 너무 많고 다 맛있어 보여서 고민고민 사각 조각케이크가 9,000원인데 성수 물가인가봐요 ㅎㅎ 아메리카노 2잔 12,000 쇼송옴쁘므 6,800 밤브리오슈 6,500 배가 고파서 큰 빵 위주로 고른..ㅋㅋ 애플파이 좋아해서 주문해 봤어요. 단면을 잘라보니 사과자 큼지막하게 들어있었어요. 달큰하고 아삭아삭 씹히는 사과가 맛있었어요. 밤식빵이랑 소보루 둘다 제가 좋아하는 빵이라 기대가 커요 과연 밤은 안에도 들어 있을 것인가. 오 생각보다 밤이 꽤 들어있어서 만족! 안에 빵도 넘청 부드럽고 위에 소보루는 많이 달지 않아서 좋았어요. 살짝 산미 있는 아이스아메리카노! 날이 더워서 산뜻하게 잘 어울렸어요. 빵이랑 함께 마시기도 딱 좋았어요. 앉았을 때 보이는 뷰?가 넓고 쾌적해서 여유있었어요. 물론 근교에 가면 훨씬 큰 규모의 카페가 많지만 성수동에서 이정도 규모의 카페는 찾기 힘든 거 같아요. 성수동에서 넓은 카페 찾으시는 분들은 한번 방문해 보셔요~ 그럼, 읽어주셔서 50m © NAVER Corp. 성수동대림창고갤러리 서울특별시 성동구 성수이로 78"
[성수] 성수동대림창고갤러리 - 공장을 개조한 성수동 대형 카페,"이제는 너무나 핫플이 되어버린 성수동! 작년에...^^ 친구와 다녀왔던 카페리뷰를 이제서야 올려본닷😅 매번 성수동 카페거리를 지나다니면서 대림창고 외관을 보고 언젠간 가봐야지 하다 눈이 내렸던 어느 날 다녀오게 되었다ㅎㅎ 성수동대림창고갤러리 매일 11:00 ~ 22:00 50m © NAVER Corp. 성수동대림창고갤러리 서울특별시 성동구 성수이로 78 대림창고는 성수역 3번출구에서 도보로 5~10분 정도 걸리는 곳에 있다! 주차의 경우, 유료 표기된 주차라인의 노상주차장을 이용하거나 근처 한라시그마밸리 유료 주차장을 이용해야 한다😀 멀리서 봐도 한눈에 알아볼 수 있는 대형카페다ㅎㅎ 카페 외관은 붉은 벽돌로 되어 있고 입구는 엄~청 큰 나무 대문이다 공장을 개조해서 만든 창고형 갤러리카페인 대림창고는 입구로 들어서면 높은 천장과 공장 컨셉의 인테리어들을 한 눈에 볼 수 있다 그리고 입구쪽에는 큰 창문과 함께 앉을 수 있는 공간이 있다 주말에는 사람이 많아서 자리잡기 힘들다고 했는데 평일 오후가 되니 이곳마저도 자리가 없었다 마침 내가 방문했을 때가 크리스마스를 앞두고 있었어서😅 (얼마나 늦게 포스팅하는 걸까..) 자리 한켠에는 작은 트리도 있었다🎄 갤러리 카페여서 그런지 곳곳에 아트 제품도 많이 전시되어 있었다ㅎㅎ 카페 안쪽 주문하는 곳까지 들어와 보니 빈자리 없이 가득 찬 좌석들이 보였다ㅋㅋㅋㅋㅋ 점심시간이 조금 지난 애매한 시간이었는데도 불구하고 사람이 정말 많았다😂 다행히 메인 공간외에 자리가 있어 자리 잡고 베이커리와 커피 구경에 나섰다ㅎㅎ 커피 주문하는 곳은 넓은 오픈형 공간이다 주변엔 공장 개조형 답게 노출 콘크리트로 빈티지한 느낌을 살려낸 것 같다 그리고 카운터 맞은편으로는 다양한 베이커리들이 준비되어 있었다🍞🥐🥯🧀🥖 빨미까레, 시나몬 롤, 크로아상, 더블뺑오 등 베이커리 종류가 다양했고 가격대는 일반적인 베이커리카페 정도의 가격대였다 정말 어느 순간부터 카페에서 파는 빵들도 만원에 가까운 가격이 나가서 커피와 빵 1,2개만 사먹어도 웬만한 밥값은 나가는 것 같다ㅋㅋㅋㅋ (빵수니는 운다...😂) 소금빵, 휘낭시에, 까눌레 등 구움과자 종류도 판매중이었다 밥을 배부르게 먹고 오지 않았다면 디저트와 커피 즐기기에도 좋을 것 같았다 그리고 빵 보다는 케이크가 떙겨서 패쓰-ㅋㅋㅋ 커피 종류 이에도 🍺&🍷도 판매하고 있었다 그 외에 초콜릿 라떼나 밀크티, 말차라떼, 프레쉬주스, 에이드, 티 등 논커피 종류도 다양했다 메뉴판과 카운터 앞 게이샤 커피라는 대림창고의 시그니처 메뉴가 쓰여있었다 가격은 계속 변동되는 듯 했는데 내가 방문했을 땐 커피 한 잔에 15,000원 정도였다😅 게이샤 아이리쉬 커피에는 소량의 위스키도 첨가된다고 하는데 과연 무슨 맛일지..ㅎㅎ 주문하는 곳 옆으로 조각 케이크가 진열되어있는데 빵보다 더 맛있어보여서 티라미수 케이크도 같이 주문했다 근데 정말 조그만한 조각케이크도 9,000원정도 한닷...ㅋㅋㅋㅋㅋㅋ 그리고 대림창고 딸기우유🍓가 유명한지 케익과 함께 진열되어 있었는데 직접 만든 시즌음료이고 생딸기가 덩어리째로 들어있어서 꽤 맛있다고 하였다 가격은 9,000원으로 역시 비싼편...ㅎㅎ 우리는 아인슈페너, 바닐라라떼, 티라미수를 주문 했고 사람이 많아서 커피 받는데도 15분 정도 시간이 걸렸던 것 같다ㅋㅋㅋㅋ 여느 카페에서나 그렇겠지만 매장 규정처럼 외부 식음료 반입이 안됬고, 애완동물이나 킥보드, 자전거 등도 출입이 금지되어 있었다 그리고 아트 갤러리다보니 실내 기획전 작품들 파손에 주의해달라는 문구도 있었다ㅎㅎ 🎄🎄🎄 지나고 나서 다시 봐도 예쁜 트리💚 사람키보다 큰 대형트리가 있어서 크리스마스 분위기 물씬 났다ㅎㅎ 거의 대림창고 포토존이어서 트리 앞에서 사람들이 한번씩은 사진 찍었다😆 우리도 커피 기다리는 동안 여러장 찍었다ㅋㅋㅋㅋ 트리 옆으로는 카페에 또 다른 공간이 있는데 이 곳도 내부가 엄청 넓은 편이다 워낙 넓은 공간이다보니 크게 튼 음악소리가 울리기 시작해서 사람들 말소리+음악소리에 꽤...시끄러웠던 것 같다ㅠㅠㅋㅋㅋㅋㅋㅋ 오래 앉아있거나 대화하기에는 힘들었던😂 게다가 이쪽 공간에 화장실이 있었는데... 화장실 안에서 냄새가 많이 나는 편이라 사람들이 문을 여닫을 때마다 화장실 냄새가 조금 나서 그 점이 참 아쉬웠다ㅠㅠㅠ 갤러리라는 이름에 걸맞게 카페 이곳저곳 구경할 수 있는 작품들이 많이 전시되어 있다 카페 안쪽으로 가보니 하늘이 훤히 보이는 투명유리창으로 된 공간에 식물도 심어놓고 힙한 작품들도 함께 전시해두어서 이곳저곳 들러보고 구경하는 재미가 있었던 것 같다ㅎㅎ 그리고 카페에 양 옆으로 연통이 있었는데 직접 나무를 넣고 난로를 피우다보니 난로 앞은 나름 꽤 따뜻했고, 불멍 때리기에도 좋았다ㅎㅎ 커피나오는데까지 시간이 조금 걸리기도 하고 워낙 카페가 커서 이곳저곳 구경했는데 2층으로 올라가는 계단이 보였다! 계단으로 올라가서 왼쪽으로 들어가보니 나오는 또 다른 공간! 2층은 음악소리가 크지 않아서 조용하게 대화하기에 조금 더 좋았고 가운데에 큰 나무테이블이 있어서 단체로 앉아서 얘기하기에도 좋은 공간인 것 같았다😀 기다림 끝에 나온 음료! 개인적으로 커피맛은 그냥 쏘쏘했다ㅎㅎ 아인슈페너는 크림이나 커피 자체도 내가 기대했던 맛이 아니여서 그런지ㅠㅠ 주문한걸 조금은 후회했다...ㅋㅋㅋㅋㅋㅋ 바닐라라떼도 별다른 특별함 없이 무난했던 커피 맛ㅎㅎ 역시 시그니처 커피를 마셨어야 했던건가😂 그리고 조금은 비쌌던 티라미수케이크🎂 다행히 부드럽고 달달하고 맛있었다 대림창고는 다 먹은 컵이나 식기들은 반납하는 곳에 직접 갖다놔야한다! 카운터 맨 끝쪽에 반납하는 곳이 있다ㅎㅎ 장작과 난로, 빨간벽돌과 조명, 크리스마스 장식까지 분위기가 너무 좋았다ㅎㅎ 대림창고는 성수동에서 워낙 유명하고 큰 대형카페에 속하기도 하고 대림창고만이 주는 특별한 빈티지함과 분위기가 있어서 한번쯤은 와보기 좋을만한 카페인 것 같다😃"
"[성수 | 뚝섬 | 서울숲] 존맛탱 피자 맛집 노모어피자 내돈내산 후기 (성수동대림창고갤러리, 하루필름)","정말정말 오랜만에 성수에서 연듀를 만나서 놀았다! 그래서 오늘의 리뷰는 힙한 성수 핫플에서 놀기😎 ① 50m © NAVER Corp. 노모어피자 서울숲점 서울특별시 성동구 서울숲2길 26 1층 한국가서 피자먹고싶다하니깐 연듀가 알아봐준 노모어피자 서울숲점! 서울숲역 5번출구에서 가깝다! 성수역 근처는 많이 가봤어도 이쪽 동네는 처음 와봐서 피자먹으러 가는 길 내내 정말 힙하다는 느낌이 들었다! 노모어피자 간판마저 갬성갬성 노모어피자 서울숲점에는 공휴일에 방문했고, 오픈런을 하기 위해 11시 30분에 도착했다! 중간에 브레이크타임 있는데 요일별로 다르니 주의할것! 우리 앞에 딱 한팀 있었는데, 우리가 들어가자마자 사람들이 우루루 들어왔다! 주문 방식은 매장 입구에 키오스크가 있어서 거기에서 메뉴고르고 결제하면 주문이 들어간다! 우리가 고른 메뉴는 반반피자(R) -옥수수새우피자 -바질마스카포네뇨끼피자 그리고 사이다까지 옥수수 새우 피자가 시그니처메뉴이고 바질 마스카포네 뇨끼 피자가 히트 메뉴였다! 맛은 말해뭐해! 너무 맛있었다! 옥수수 새우 피자는 맵찔이 기준 쵸큠 매웠는데 한국인 입맛에 딱 맞게 자극적이고 맛있어서 계속 들어감,,,ㅋㅋㅋ 바질 마스카포네 뇨끼 피자는 바질향이 나면서 걍 존맛이었다! 정말 또가고싶은 피자 맛집이었음! 진짜 개존맛인디 위가 너무 작아서 남김,,, 광광우럭,,,ㅠ 아 지금 이글 쓰면서 또먹고싶어지네,,,,,,,,, 피자는 천사 연듀님이 사주심,,, 아리가또고자이마스,,,♥ ② 하루필름 서울숲점 서울특별시 성동구 서울숲2길 45 1층 하루필름 피자 다먹고 소품샵에 들어갔는데 둘다 소품샵에 그닥 관심없어서 한바퀴 슝 돌아보고 하루필름 가서 사진찍오따 ㅋㅋㅋㅋㅋㅋㅋㅋㅋㅋ 하루필름 다른 지점들은 요즘 뽀샤시하게 안나오고 칙칙하게 나오는 곳들 많아졌는데 하루필름 서울숲점은 뽀샤시 그잡채라 너무 좋았음! 아니 근데 하루필름에 스티커 기능 생겼더라...? 둘다 T라서 호호 ③ 성수동대림창고갤러리 서울특별시 성동구 성수이로 78 성수동 대림창고갤러리에 가고싶어서 성수역쪽으로 걸어서 넘어갔다! 지도도 없이 길 잘찾아가는 연듀쨩 스고이 연듀는 아아 마시고 나는 바닐라라떼 마셨다! 오랜만에 마시는 한국 커피라서 기부니가 날아갈것 같았다 (카페인중독자) 디저트도 맛있어보였는데 이미 피자로 배가 꽉차있어서 못먹었다ㅠ 까비ㅠㅠ 성수동 대림창고갤러리는 엄청 넓어서 공휴일인데도 불구하고 자리가 남아돌았다! 그리고 카페 자체가 너무 예쁘게 잘 꾸며져있어서 사진찍기 너무 좋았다! 힙한 동네 성수에서 놀기"
성수동대림창고갤러리 / 밧드의 최애카페 / 솔직후기,"안녕하세요! 밧드입니당 밧하 😀 오늘은 저의 최애 까페중 하나인 😀 성수동대림창고갤러리 포스팅해보려고합니다! 이곳은 남편이 데려가줘서 알게 된 까페인데요~ 저는 정말 좋았습니다! 성수동대림창고갤러리 주차정보 성수역에서 300m 정도로 가까운 거리에 있어요~ 도보로 오시는걸 추천드리구요! 만약 어쩔 수 없이 끌고오셨다면 많은 성수피플들이 이용하는 성수동 카페거리 창미 주차장을 이용해보세요! 30분 1,500원 60분 3,000원 120분 6,000원 240분 12,000원 50m © NAVER Corp. 창미주차장 서울특별시 성동구 성수일로10길 32 창미빌딩 가격정보 *아메리카노 5,000원 아인슈페너 6,500원 카페라떼 6,000원 코르타도 6,000원 바닐라라떼 7,000원 카페모카 7,000원 아포가토 8,500원 디카페인 아메리카노 6,000원 디카페인 카페라떼 6,000원 게이샤 슈페너 15,000원 게이샤 모카 15,000원 게이샤 코스 15,000원 (셋중 두가지 선택) 1.게이샤 에스프레소 2.게이샤 콘파냐 3.게이사 코르타도 초콜렛라떼 8,000원 밀크티 8,000원 콜드브루 아이스티 8,500원 말차라떼 8,000원 말차 아포가토 8,500원 대림창고 딸기우유 9,000원 파인애플 주스 8,000원 오렌지 주스 8,000원 자몽 주스 8,000원 오렌지에이드 7,500원 레몬에이드 7,500원 자몽에이드 7,500원 복숭아에이드 7,500원 얼그레이 티 8,000원 루이보스 발란스 8,000원 맥주가격 호가든 8,000원 1664블랑 8,000원 맥파이 페일에일 8,000원 맥파이 쾰쉬 8,000원 필스너 우르켈 8,000원 필스너 + 코젤다크 8,000원 코젤 시나몬 8,000원 요 정도의 가격대를 형성하고있습니다! 성수역을 지나다니다 보면 무신사 벽화도 보일거구요! 대림이라고 써있는 이런 벽이 보이실겁니닷 여기가 바로 대림창고입니당 :) 맥주도 팔고있어서 많은 분들이 퇴근하고도 찾으실거같아요! 창고를 거의 그대로 살리면서 카페로 개조해서 사용하고 계신다고 하는데 여러 아티스트들과 협업하신 것도 보이고 멋진, 구경할 부분이 많은 공간입니다~ 성수동대림창고갤러리의 입구와 문열고 들어서면 바로 보이는 입구의 모습입니다! 벌써부터 갬성이 차오르는듯한 느낌~ 여러부분에서 설치미술 전시를 보러온 것 같은 매력을 느낄수가 있고 예술가의 방에 놀러온 것 같은 느낌도 받을 수 가 있습니다! 성수동대림창고갤러리 / 밧드의 최애카페 / 솔직후기 재생 22 좋아요 2  접기/펴기 성수동대림창고갤러리 / 밧드의 최애카페 / 솔직후기 대림창고의 분위기 성수동대림창고갤러리는 일단 300평 정도의 공간 자체가 주는 엄청나게 큰 공간감, 그 안에 여러가지 작은 부분들까지 섬세히 신경쓰신 모습들이 정말 사장님의 열정이 찐 이신 것 같습니다 ㅋㅋㅋㅋ 저희는 아메리카노 두 잔과 딸기 케익 1조각을 주문했습니다! 맛은 아아는 무난 무난한 우리가 아는 그맛! #우아맛 그리구 딸기케잌 맛있었습니당 여러가지 매력을 느낄 수 있는 성수동대림창고갤러리~ 요론 아기자기한 전시물들도 있어서 색감이 예뻐서 찍어보았구용 솔직후기 이미 유명한 성수동대림창고갤러리 ! 다들 한번쯤은 다녀와보셨으리라 생각이 되는데요! 성수에는 대림창고말고도 주변에 #어니언 이라는 카페도 되게 유명하니까 거기도 한번 가보실겸 와보시면 좋을 것 같구요~ 가격대는 제가 느끼기에는 저렴한 가격대는 아닙니다만 전시를 보는듯한 커다란 공간에서 주는 성수동대림창고갤러리만의 vibe와 분위기가 있어서 아깝다고 생각되지 않더라구요! 카페투어를 좋아하시고 예쁜 카페를 좋아하시는 분이라면 꼭 한번은 가보시길 추천드리겠습니다! 그럼 이만 밧빠 👋 100m © NAVER Corp. 성수동대림창고갤러리 서울특별시 성동구 성수이로 78 성수역 2호선 서울특별시 성동구 아차산로 100 어니언 성수 서울특별시 성동구 아차산로9길 8 어니언 창미주차장 서울특별시 성동구 성수일로10길 32 창미빌딩 #성수동대림창고갤러리 #대림창고 #성수역주변카페 #어니언성수 #카페추천 #서울핫플 #서울데이트장소추천"
