title,content
"[성수동 카페] 호텔 아우프글렛 성수, 신메뉴 베로아상이 기다리는 호텔 느낌에 충실한 카페","매번 비슷한 듯 색다른 공간으로 보는 재미를 듬뿍 선사하는 아우프글렛(Aufglet)의 7호점. 아직 오픈 한 지 며칠 지나지 않은 7월 초에 다녀온 호텔 아우프글렛 성수는 기존 매장과는 아예 다른 느낌이었다. 별다른 특색없는 뚝섬역 뒷 골목에 우뚝 서 있는 유럽풍 호텔 느낌 가득한 성수동 카페는 들어가기 전부터 압도적 존재감을 뽐낸다. 다른 사무실과 건물을 공유하고 있어 1층으로 들어온 후 한 번 더 입장해야 한다. 엘리베이터 앞에 놓칠 수 없는 'AUFGLET'. 카운터가 위치한 1층은 좁고 긴 형태로 주방으로 이어지는 안쪽에는 카운터가 창가를 따라 베이커리 진열대가 놓여있다. 아우프글렛 자체를 오랜 기간 못갔었지만 성수 카페의 오픈이 기대된 이유는 따로 있다. 바로 신메뉴 베로아상(beroissant) 출시 때문. '베이글'과 '크로아상'의 합성어로 크로플의 아성을 이을 후발주자로서 성수점에서 첫 출시를 알렸다. 매장 곳곳에서 베로아상 포스터를 볼 수 있다. 베이글 형태에 크로아상 질감이라니! 현재 한남점에서도 즐길 수 있다. 크로플 외에 약하다고 생각했던 베이커리 라인이 대폭 확충된 것이 특징. 베로아상 외에 포카치아, 바게뜨 등도 유혹의 눈빛을 보내고 있었다. 또한 맞은 편 냉장고 안에는 미니케이크 및 잼 종류도 진열중. 음료의 경우, 논커피가 확충된 것이 눈에 띄었으며 커피 메뉴는 기존 매장과 큰 차이가 없다. 시그니처 크로플도 주문이 가능한 성수동 카페. 이미 몇몇 후기에서 자리에 대한 얘기가 있어 나도 영향을 받는 것이 아닌가 걱정이 되었다. 일단 좌석 공간은 2층에만 위치한다. 벽면을 따라 놓인 벤치형 테이블과 테이블 맞은 편에 놓인 보조 의자, 그리고 창가를 따라 설치된 높은 의자들. 벽면 끝자락에 라운지형 쇼파 테이블이 있지만 이마저도 사람들이 한 두팀 앉으면 차버린다. 공간의 매력에 비해 좌석과 동선 처리가 아쉽다. 진동벨이 울리면 1층에서 픽업해오는 방식. 오르내리는 계단이 좁고 경사가 있어 트레이를 가져올 때 특별히 조심해야 한다. Beroissant Coconut Cream 아우프글렛 브랜드 색상이 인상적이었다. 바삭하고 부드러운 식감은 크로아상 그 자체, 속에 있는 코코넛 크림도 너무 달지 않고 담백했다. Espresso 하지만 나에겐 역시 아우프글렛은 커피 맛집. 점심 직후라 가볍게 곁들인 에스프레소 한 잔은 여느 지점에서와 마찬가지로 감동 그 자체였다. 'Hotel Aufglet'이라 적힌 잔 자체도 너무 예뻤다. 원두를 직접 뽑는 로스터리 카페인 아우프글렛. 실력있는 바리스타들이 정말 열일하는 곳이다. 참고로 2층 창가 테이블 한 켠에는 호텔 아우프글렛 브랜드 카드가 놓여있다. 3층에는 MD제품의 판매 공간이 있는데 이 날은 바로 이동을 해야했던 날...다음을 기약하기로 했다. 트레이 반납을 위해 1층에 다시 내려오니 그나마 여유로웠던 오픈 초반이 지나고 주문하는 손님들로 카운터가 꽤 분주했다. 북적임을 피해 서둘러 밖으로 나왔다. 건물 코너를 따라 야외 좌석이 마련되어 있는데 무더운 여름이 지나면 사람들로 북적이지 않을까. 만족감과 아쉬움이 공존한 성수동 카페. 하지만 신메뉴 베로아상은 꽤 만족스러웠다. 개인적으로 크로플보다 베로아상이 더 나은듯? 기존 매장에서는 볼 수 없었던 다양한 새로운 매력 가득한 이 곳이 앞으로 어떠한 바람을 일으킬 지 궁금하다. AUFGLET(@aufglet) • Instagram 사진 및 동영상 팔로워 28K명, 팔로잉 1명, 게시물 1,545개 - AUFGLET(@aufglet)님의 Instagram 사진 및 동영상 보기 www.instagram.com <위치> 서울특별시 성동구 왕십리로10길 9-2 <교통편> 지하철 - 2호선 뚝섬역 7번 출구 버스 - 뚝섬역8번출구 또는 성동구민종합체육센터 하차 <영업시간> 매일 - 11:30~20:30 50m © NAVER Corp. 호텔 아우프글렛 성수점 서울특별시 성동구 왕십리로10길 9-2"
성수동 카페) 베로와상 전문 카페 호텔 아우프글렛 성수,"성수동 카페) 베로와상 전문 카페 호텔 아우프글렛 성수 재생 13 좋아요 0 00:00 00:25  성수동 카페) 베로와상 전문 카페 호텔 아우프글렛 성수 - 2023년 9월 방문 기록 - 이번에 다녀온 곳은 베로와상 전문 카페인 호텔 아우프글렛 성수점이다. 베로와상이란 베이글과 크로와상을 합친 건데 크로플을 처음으로 개발한 아우프글렛에서 새로 나온 디저트라 해서 궁금했고 얼마 전에야 다녀오게 되었다. 아우프글렛은 금호점만 가봤는데 원조답게 내가 먹어본 크로플 중 가장 맛있었다. 금호동 카페) 크로플의 원조 카페 아우프글렛 크로플의 원조라 불리는 금호동 카페 아우프글렛 드디어 나도 다녀왔다! 2018년에 금호동 오픈한 아우프글... blog.naver.com 호텔 아우프글렛 성수 외관 뚝섬역 7번 출구에서 134m 거리에 위치한 호텔 아우프글렛 성수 50m © NAVER Corp. 아우프글렛 성수 서울특별시 성동구 왕십리로10길 9-2 메뉴 : 베로와상 코코넛 크림 6,000원 주소 : 서울시 성동구 왕십리로 10길 9-2 전화 : 070-8858-0828 영업시간 : 11:30 ~ 20:30 건물 외관부터 예사롭지 않아 보이는 이곳은 1970~80년대 호텔에서 영감을 얻어 이름부터 '호텔 아우프글렛 성수'점이다. 호텔 아우프글렛 성수 1층 로비 아우프글렛 성수 1층은 로비 공간 겸 카페로 다양한 베이커리와 디저트, 음료를 만날 수 있는 공간이다. 호텔 아우프글렛 성수의 커피바 성수동 카페 호텔 아우프글렛 성수의 메뉴판 예전에 비해 에이드 메뉴가 많이 추가된 것 같다. 베로와상과 치아바타 등 여러 가지 베이커리가 진열되어 있는 1층 로비 창가 쪽 진열대 햄 치즈 베로와상 샌드, 트러플 크림치즈 베로와상 샌드, 베로와상 츄러스, 베로와상 코코넛 크림, 콘크림 베로와상 샌드, 무화과 크림치즈 치아바타, 앙버터 치아바타, 후추 크림치즈 바게트 등이 있고 고르곤졸라 다이스 패스츄리, 커스터드 다이스 패스츄리, 피스타치오 다이스 패스츄리, 블루베리 다이스 패스츄리, 몽블랑 패스츄리, 뺑 오 쇼콜라, 더블 베이컨 치즈 바게트, 플레인 바게트 등이 진열되어 있다. 포장 케이스도 조금 멋진 아우프글렛 반대편 진열대에는 여러 가지 종류의 마들렌과 휘낭시에를 만날 수 있다. 주문을 하고 옆문을 통해 나가 2층 라운지나 3층 오피스로 올라가면 되는데 엘리베이터가 있어 편하게 올라갈 수 있었다. 지하 1층은 아우프글렛의 베이커리 룸이다. 호텔 아우프글렛 성수 2층 라운지 2층 라운지 공간은 호텔에 있는 카페처럼 큰 통창이 매력적인 공간이다. 가로로만 긴 건물이라 공간이 넓은 편은 아닌데 큰 통창 덕분에 답답한 느낌이 들지는 않았다. 창가 쪽에는 사진처럼 바 테이블도 있어 성수동 거리를 내려다볼 수 있지만 사실 뷰는 그냥 그렇다 ㅎㅎ 테이블이나 의자가 너무 따닥따닥 붙어있는 느낌이라 조금 부담스럽긴 하지만 그래도 내부 분위기는 꽤 좋다. 핫플 카페의 필수인 전신거울도 있고 옆에 있는 의자는 전시용이라고 적혀 있었다. 라운지 입구 쪽의 이 자리가 가장 독립된 공간인데 사실 여기도 뷰는 그냥 그렇다 ㅎㅎ 서울숲 앞이 아니라면 성수동 뷰가 다 그렇지 뭐 ㅋㅋ 호텔 아우프글렛 성수 3층 오피스 3층 공간은 호텔 아우프글렛의 오피스 공간 겸 아우프글렛의 색깔을 담아낸 굿즈들과 다양한 브랜드의 제품들도 구성된 기프트샵이다. 거울 뒤편으로 사무실이 있어서 그런가 3층은 2층 라운지보다 공간이 조금 더 작은 편이다. 3층은 통창이 아닌 타원형의 창인데 여기 창가 자리도 마음에 들기는 했다. 3층 오피스 안쪽의 장식장에는 여러 가지 굿즈들이 있는데 호텔 조식에서 볼 수 있는 접시 세트, 커피잔, 타월 그리고 우산, 서적 등 다양한 소품들이 진열되어 있었다. 3층 입구 쪽에도 전신 거울이 있다. 호텔 아우프글렛 로고가 약간 그랜드 부다페스트 호텔 느낌도 나고 ㅋㅋ 호텔 아우프글렛 성수 메뉴 베로와상 내가 주문한 건 코코넛 크림 베로와상과 트러플 감자 휘낭시에 그리고 애플망고 에이드 베로와상 종류가 너무 많아서 뭘 주문해야 할지 고민하다 코코넛 크림 베로와상을 주문한 거였다. 베이글과 크로와상을 합치면 어떤 맛이 날까 궁금했는데 너무 기대를 했던 걸까, 생각보다는 그냥 그랬다. 베이글 맛은 거의 안 나고 크로와상 느낌만 난달까! 맛이 없는 건 아니지만 아주 감동할 맛은 아니었다는 거 ㅋㅋ 아우프글렛 크로플을 먹었을 땐 진짜 감동했는데 말이지 ㅋㅋ 코코넛 크림 베로와상을 자르면 안에는 커스타드 크림과 크림치즈가 반반씩 들어있는데 크림이 달지 않아서 좋았다. 아우프글렛에서 만드는 휘낭시에는 어떤 맛일까 궁금해서 트러플 감자 휘낭시에를 주문한 거였는데 트러플향이 너무 강해서 나랑은 안 맞았던 걸로 ㅋㅋ 기대했던 것보다 베로와상이 아주 감동적인 맛은 아니었지만 그래도 꽤 맛있게 먹었던 성수동 카페 호텔 아우프글렛 성수점 코코넛 크림만 먹어봐서 다른 종류의 베로와상과 베로와상 샌드 그리고 패스츄리도 궁금해 한 번쯤은 더 방문해 볼 생각이다."
성수동 카페 호텔 아우프글렛 성수 베이커리 맛집 솔직후기,"성수동 카페 호텔 아우프글렛 성수 베이커리 맛집 솔직후기 (1) 재생 2 좋아요 0  접기/펴기 성수동 카페 호텔 아우프글렛 성수 베이커리 맛집 솔직후기 (1) 성수동 카페 호텔 아우프글렛 성수 베이커리 맛집 솔직후기 (2) 재생 5 좋아요 0  접기/펴기 성수동 카페 호텔 아우프글렛 성수 베이커리 맛집 솔직후기 (2) 성수동 카페 호텔 아우프글렛 성수 베이커리 맛집 솔직후기 (3) 재생 4 좋아요 0  접기/펴기 성수동 카페 호텔 아우프글렛 성수 베이커리 맛집 솔직후기 (3) 성수동에서 핫하디 핫한 베이커리 맛집 호텔 아우프글렛 성수점 이름은 호텔이지만 카페라는점~ 크로와상과 베이글을 합친 베로와상을 먹을 수 있는 베이커리카페인데, 베이커리 맛도 궁금하고 핫하다고하니 성수동 데이트를 하러 간김에 한번 방문해봤다. 베이커리가 맛있는 핫한 카페 호텔 아우프글렛 성수점 ⏰ 영업시간 매일 11:30 - 20:30 50m © NAVER Corp. 호텔 아우프글렛 성수점 서울특별시 성동구 왕십리로10길 9-2 호텔 아우프글렛 성수점은 뚝섬역 7번 출구에서 도보로 3분 거리에 위치해있다. 뚝섬역과 굉장히 가깝기도 하고, 근처에 핫플이 많아서 성수동 데이트 코스로 넣기 좋은 곳 요즘은 어딜가도 평균이상하는 성수동 맛집에서 맛있는 저녁식사를 하고 2차로 호텔 아우프글렛 성수점을 방문했다. 1층에는 결제 카운터와 베이커리 진열대가 있고, 카페 공간은 위층에 있어서 여기서 빵을 고르고 엘베를 타고 위로 올라가면 된다. 베이커리를 담는 쟁반은 입구 우측에 있고, 우측에 굿즈도 있어서 간단하게 살펴볼 수 있었다. 스피커가 좋은 제품인듯? 소리가 빵빵하니 듣기가 좋았다. 호텔 아우프글렛 성수점의 시그니처 메뉴인 베로와상은 종류별로 있었는데 코코넛크림, 초코라즈베리가 가장 인기가 많은 메뉴 나는 원래 베로와상을 먹으러온건데... 다른빵들도 다 맛있어보여서 베로와상을 바로 고르지 못하고, 한번 둘러보고 가장 땡기는 걸 먹기로 했다. 베로와상만큼 인기가 많다는 소세지 바게트 식사를 안했다면 여기서 간단하게 브런치를 즐겨도 좋을 것 같았다. 더블 베이컨 치즈 바게트와 후추 크림 치즈 바게트 등 일반 베이커리집에서 보기 힘든 다채로운 메뉴들이 있어서 보는 재미가 쏠쏠했던- 아묻따 믿고먹는 몽블랑도 있고 일반 플레인 바게트, 크렌베리 다크 바게트도 있는 모습 😆 이건 감자 베이컨 포카치아인데, 전반적으로 식사대용으로 먹기 좋은 베이커리가 많아서 저녁을 많이 먹고 방문한 게 후회스러울 정도였다 😭 냉장진열대에는 바게트 등에 발라먹기 좋은 각종 잼과 이색적으로 생긴 큐브 케이크가 있었다. 후기를 보니 케이크보단 빵이 맛있다고해서 요건 패스하기로- 이건 음료 메뉴판 가격대는 아메리카노를 제외하고는 다 상당히 가격대가 있는 편이었다. 우린 아이스 아메리카노 한잔과 크림커피 한잔을 주문하기로 했다. 그리고 빵은 비주얼이나 맛 조합으로 생각해보나 제일 맛있어보이는게 후추 크림 치즈 바게트길래 이걸로 픽했다 😋 카운터에 있던 호텔 아우프글렛 성수점 설명 지하1층은 베이킹 공간 1층 로비는 베리커리, 디저트, 음료를 만나볼 수 있는 공간 2층은 라운지로 호텔 라운지 느낌으로 편하고 쾌적하게 카페 공간을 즐길 수 있다. 3층은 기프트샵으로 호텔 조식에서 볼 수 있는 접시세트, 커피잔, 타월, 우산, 서적 등을 볼 수 있다고하는데, 이름이 오피스길래 사무실인줄 알고 안간건 함정 🥹 카페 바로 옆에 엘리베이터가 있고 간판도 있어서 쉽게 카페공간으로 갈 수 있었다. 2층 카페공간은 이름도 거창하게 '라운지'라고 되어있길래 기대가 많았는데, 생각보다 협소한 느낌이라 살짝 당황쓰 😅 일반 테이블은 테이블간격도 좁은 너낌이었고 그나마 가장 안쪽 소파자리는 쾌적하고 넓은 편이라 우린 이쪽에 착석하기로 했다. 자리가 없을 때에는 쉐어테이블로 사용할 것 같았던 소파자리 통창인건 마음에 드는데, 앞에 뷰가 살짝 갬성과는 먼 느낌 🫨 그래도 음료와 빵은 요즘 갬성으로 가득 차 있는 모습이었다 ㅋㅋㅋ 비주얼이 상당히 좋았던 크림커피와 후추 크림치즈 바게트! 겉바속촉 바게트 안에 후추크림치즈가 듬뿍 발라져있는 빵으로 가격은 7,500원 요건 호텔 아우프글렛 성수점의 시그니처 커피인 크림커피로 가격은 7,000원! 위에 나있는 귀여운 크림뿔이 특징인 음료 후추크림치즈 바게트가 묵직한 맛이라 아메리카노와도 어울리지만, 우유가 첨가된 크림커피와도 궁합이 상당히 좋았다. 성수동 카페 호텔 아우프글렛 성수 베이커리 맛집 솔직후기 (4) 재생 1 좋아요 0  접기/펴기 성수동 카페 호텔 아우프글렛 성수 베이커리 맛집 솔직후기 (4) 다만 위에 있는 크림만 먹으면 괜찮았는데 나중에 섞어먹으니 약간 이맛도 저맛도 아닌게 가격대에 비해 다소 아쉬웠던 맛이었다. 그래도 베이커리 맛집답게 빵 하나는 기가막히게 맛있었던 호텔 아우프글렛 😎 바게트는 먹기 좋게 커팅되어있고, 빵 한조각에 크림치즈가 이렇게 두툼하게 발라져있으니, 이게 맛이 없을 수가 있냐구요~ 배가 부른데도 맛이 좋아서 계속 들어갔던 후추크림치즈 바게트! 후추가 크림치즈 중간중간 박혀있어서 살짝 스파이시하면서 묵직한게 아주 맛있게 먹었다 😋 이메뉴는 짱 강추드림다 나가는 길에 찍은 2층 바테이블 공간 공간만 보면 참 모던하고 예쁜데, 창밖에 있는 풍경이 에러라서 그게 아쉬웠달까 그래도 라운지 공간에 포토존도 있고, 공간 자체는 예뻐서 사진찍기에는 좋아보이긴했다 히히 외관도 예쁘고 베이커리도 맛있어서 나름 괜찮게 있다간 호텔 아우프글렛 성수점! 잘먹었습니다~ 기대를 너무 했던 탓인지 인테리어나 커피 맛은 다소 아쉬웠지만 베이커리는 유명한 만큼 맛은 좋았어서 다음에 방문한다면 베이커리만 포장해서 한번 더 먹어볼 것 같다. 성수동 빵지순례를 하러오거나 다른 곳에서는 맛보기 힘든 베로와상을 먹고싶다면 한번쯤 방문해보는 걸 추천드리고 싶다."
성수동 카페 호텔 아우프글렛 성수 다양한 베이커리 즐겨요,"안녕하세요! 친한 동생이랑 서울숲에서 놀다가 뚝섬 근처에 베이커리 다양하다던 성수동 카페 호텔 아우프글렛 성수 방문했는데요! 한번 같이 보러가실까요? HOTEL AUFGLET 영업시간 50m © NAVER Corp. 아우프글렛 성수 서울특별시 성동구 왕십리로10길 9-2 아우프글렛 성수 위치는 지하철역 기준으로 뚝섬역 7번 출구 쪽에 위치해있으니 참고하여 방문바랍니다 아우프글렛 성수 같은 경우 서울에 다양한 지점들이 있지만 성수점은 호텔 컨셉을 잡은 카페라고 하더라구요! 아무튼 내부에 우선 입장하자마자 자리부터 잡은 후 디저트를 골라보기로 했는데요! 가볍게 먹기 좋은 구움과자류들 쇼케이스 내부에는 이렇게 케이크들도 진열되어있었는데요 인기가 많아서 그런지 쇼케이스에는 케이크가 많이 없는 상태였답니다. 그리고 또 다른 진열대에는 페스츄리 류들의 빵들이 진열되어있는 것들을 볼 수 있었답니다 어떤 빵을 고를까 하다가 크림치즈와 무화과가 들어간 빵으로 골랐어요! 테이크아웃도 가능해서 그런지 빵을 포장하면 이렇게 고급스러운 느낌의 박스에 포장해서 주시는 듯 하더라구요! 선물용 디저트 찾는다면 이 곳 아우프글렛 성수점에서 디저트도 즐기고 선물하기도 좋겠더라구요! 디저트 골랐으니 음료는 무난하게 저는 티 음료로 주문했고, 친한 동생은 아메리카노로 주문했답니다! 주문한 후 저희가 자리잡은 2층으로 올라갔는데요! 주문받는 공간은 정말 딱 호텔 로비 느낌이었다면 2층 내부는 호텔 라운지에 온 듯한 느낌이 물씬 풍기는 분위기의 인테리어로 되어있었답니다 이렇게 큰 거울도 마련되어있어서 슬쩍 예쁘게 사진도 찍었어요 히히 아무튼 창가 자리도 마련되어있긴하지만 카페 내부 분위기는 정말 예쁘고 마음에 들지만 바깥 뷰는 그렇게 예쁜 뷰가 아니어서 저는 막 그렇게 바깥 자리에 앉고 싶진 않더라구요 저희가 주문한 음료와 무화과 크림치즈 빵! 빵 속에는 크림치즈와 무화과가 듬뿍 들어가있어 음료와 맛있게 즐기기 좋았답니다 호텔 컨셉의 카페 아우프글렛 성수 잘다녀왔어요! 다양한 디저트들이 많은 만큼 뚝섬 근처 디저트 맛있는 곳 찾으시거나 선물용 디저트 찾는다면 이 곳 방문해보시길 바래요!"
