url,title
https://blog.naver.com/spring5867/223264573241,한남동 베베르카. 감각적인 핑크 테이블 세련된 브런치 맛집
https://blog.naver.com/bbosil/223238550507,베베르카 - 한남동 올데이 브런치
https://blog.naver.com/haranalice/223232061758,한남동 핑크 빛의 브런치 카페️ 베베르카
https://blog.naver.com/ryanive/223238594644,[한남동 카페] 베베르카 | 한남동에 새로 오픈한 감각적인...
https://blog.naver.com/danidaaaaa/223238461167,"베베르카, 한남동 신상 브런치 카페 / 분위기 있는 한남동..."
https://blog.naver.com/best012341/223276371502,"한남동 브런치카페 베베르카(신상브런치, 핑크톤의 세련된 느낌)"
https://blog.naver.com/syjin0926/223261068445,[한남동] 베베르카 / 인덱스카라멜한남
https://blog.naver.com/bbo_chelin/223239447402,"[한남]베베르카, 프렌치토스트가 맛있는 한남동 브런치 카페"
https://blog.naver.com/cjini86/223279625034,한남동 신상 브런치 카페 베베르카 아기자기해
https://blog.naver.com/wonnie_moments/223242405499,베베르카 VEVERKA 한남동 신상 브런치 카페 / 내돈내산...
https://blog.naver.com/hiverlinge/223244021541,"[서울 용산구] 한남동 한강진 브런치 카페, 베베르카 VEVERKA..."
https://blog.naver.com/jji9498/223268790661,이태원역 한남동 예쁜 브런치 맛집 베베르카
https://blog.naver.com/nyatajr/223235569666,한남동 신상 브런치맛집 베베르카
https://blog.naver.com/yerinbling/223274839098,한남동 브런치 : 베베르카(VEVERKA)
https://blog.naver.com/victorlee45/223233480552,베베르카 브런치 카페 한남동 나들이...
https://blog.naver.com/ruby_3_86/223244446292,한남동 멋진 브런치를 원한다면! 베베르카.
https://blog.naver.com/sychone95/223263236836,"[한남동, 이태원] 신상 브런치 카페 ‘베베르카(veverka)’"
https://blog.naver.com/kohkoh_123/223279926255,[한남동] 베베르카 / 브런치 카페! ...인 것치고는 좀 많이 먹고...
