url,title
https://blog.naver.com/hao0231001/223053115073,한남동 디저트계 에르메스 아틀리에폰드 Atelier Pond...
https://blog.naver.com/jenny8428/223089524882,"한남동 파티세리 폰드, 디저트계의 에르메스 아틀리에폰드..."
https://blog.naver.com/achellnet/223244349941,아틀리에폰드 갤러리아 카라멜바 픽업 후기♥
https://blog.naver.com/st0910809/223252741598,[한강진/한남동 디저트]디저트계의 에르메스_아틀리에 폰드...
https://blog.naver.com/bob8608/222549314288,[한남동] 아틀리에 폰드 / Atelier Pond - 김유정 셰프
https://blog.naver.com/kei04134/222571414576,"예약필수 한남동 고급 디저트, 아틀리에 폰드"
https://blog.naver.com/thesweeeet/223055269278,한남동 프리미엄 디저트 <아틀리에 폰드 - Atelier Pond...
https://blog.naver.com/nalgo/222841453935,디저트계의 에르메스라는 한남동 아틀리에 폰드 Atelier Pond
https://blog.naver.com/wlstnrl28/222697767499,[한남]비싼쿠키..아틀리에 폰드
https://blog.naver.com/godesylove/223170514857,서울 한남 아뜰리에폰드 디저트계의 에르메스..카라멜바...
