url,title
https://blog.naver.com/jklee433/223267030648,한남동 제주감성 비건 코스메틱 | 아이엠랑데자뷰 한남비자림점
https://blog.naver.com/wlsrud8541/223268964974,제주 감성 가득한 아이엠랑데자뷰 한남비자림점 제품 추천
https://blog.naver.com/junseo10000/223271662452,한남동 골목투어(& 비건 코스메틱 아이엠랑데자뷰 한남비자림점)
https://blog.naver.com/foodlovey/223270661057,"한남동 코스메틱 아이엠랑데자뷰 한남비자림점, 실제로..."
https://blog.naver.com/sohy___/223270970148,비건 코스메틱 아이엠랑데자뷰 한남비자림점 팝업 스토어...
https://blog.naver.com/kmge2/223273133400,브랜드 '아이엠랑데자뷰' 한남비자림점 팝업스토어 방문 후기
https://blog.naver.com/221_sunn/223275515623,한남동 놀거리 팝업스토어 쇼룸 아이엠랑데자뷰
https://blog.naver.com/solee0625/223270528910,[한남동] 한남동 쇼룸 비건코스메틱'아이엠랑데자뷰'
https://blog.naver.com/cho_it/223262054208,한남동 아이엠랑데자뷰 팝업스토어 그윽한 우디향의...
https://blog.naver.com/sunyoung94ss/223270926482,"한남동에서 만나는 제주 친환경 코스메틱 ""아이엠랑데자뷰"""
