title,content
연희동 와인 허니도우 맛도 분위기도 굿굿,"⭐️⭐️⭐️⭐️⭐️ 허니도우 연희점 4:00~9:00 주차가능 허니도우 연희님이 Instagram을 사용 중입니다 • 허니도우 연희님 프로필의 게시물 16개 팔로워 257명, 팔로잉 0명, 게시물 16개 - 허니도우 연희(@honeydough_yeonhee)님의 Instagram 사진 및 동영상 보기 instagram.com 연희동 놀러갔을 때 마지막에 간 허니도우 연희점. 낮엔 카페로 운영하고 밤엔 와인바로 변신하는 곳이에요✨ 그리고 러브캐쳐 나왔던 박정진님이 운영하시는 곳?? (하지만 안계셨음 ㅎㅎ) 연희동 길 초입에 있는 허니도우는 건물 2층에 있어요 저기 계단으로 올라가시면 돼요. 귀여운 도넛💓 여기가 또 도넛맛집이라 꼭 와보고 싶었어요! 와인바 답게 문앞에 놓여있는 빈 와인병들 와인은 연희점에서만 와인바를 운영하는지는 모르겠네요 내부는 화이트 인테리어에 식물들로 꾸며져있어서 약간 이국적인 느낌도 들어요 군더더기 없는 깔끔함🤍 이런곳이 또 사진 맛집이죠😋 자리마다 스머징스틱으로 은은한 향이 나고 흔들흔들하는 초가 분위기를 더해주더라고요 와인을 먹으러 6시 이후에 왔지만 도넛도 팔고있어서 먹고싶었던 몬스터 브라운 도넛도 주문했어요. 다른 도넛들도 먹고싶었지만 배불러서 참았.. 커피 등 음료도 팔고있으니 참고해주세요 와인도 가격이 착하더라고요! 종류는 많지 않지만 대중적이고 먹기 좋은 종류들로 구성되어 있었어요! 고민하다 선택한 레드와인 장발몽 까르베네 쇼비농 13% 같이 먹으면 좋을 햄치즈 플래터도 주문 :) 카운터 옆에 바로 만들어진 물결모양 테이블이 와인을 즐기기 더 좋은 공간같아요 그래서 저희도 여기 앉았는데 어둑어둑해질수록 분위기가 장난 아니에요 와인은 시원하게 먹을 수 있도록 아이스버킷에 담아져 나와서 계속계속 먹기 좋은 온도를 유지해주더라고요! 확실히 그냥 먹는거랑 다름👍 집에서 와인 먹을 때도 아이스버킷을 꼭 사용해야겠다 생각했어요 귀여운 몬스터 브라운 도넛😆😆 햄치즈플래터도 구성이 너무 좋았어요 허니도우 와인은 가성비 갑인듯!! 특히 요 과일맛 나는 치즈가 완전 취향저격✨ 플래터만 먹는데도 배부른거 실화냐구요오 분위기 정말 끝내주죠 그대 눈동자에 건배하고 싶은 분위기 ㅎㅎ 진짜 연희동은 숨겨진 맛집도 많지만 데이트 하기엔 여기가 최고 같아요 썸 타시는 분들께 적극 추천합니다 ㅎㅎㅎ 브라운치즈가 잔뜩 올라간 몬스터 도넛도 맛나요 다음엔 카페로 이용해서 도넛을 더 여러개 먹고싶네요 저희도 모처럼 분위기와 와인에 취해 연애 기분을 낼 수 있었던 허니도우 였습니다 연희동 데이트로 추천드려요!! 연희동 와인 허니도우 맛도 분위기도 굿굿 재생 7 좋아요 0 00:00 00:34  접기/펴기 연희동 와인 허니도우 맛도 분위기도 굿굿 50m © NAVER Corp. 허니도우연희점 서울특별시 서대문구 연희로11가길 53 1층 #연희동카페 #연희동와인 #연희동맛집 #연희동데이트 #허니도우 #연희점 #도넛맛집 #와인맛집"
연희동카페 허니도우 planteria,"초록초록한 식물들이 가득한 연희동카페 HONEY DOUGH ~~!! 낮에는 도넛과 커피를 밤에는 와인을 만나볼 수 있는 허니도우에요~ 건물 2층에 자리잡고 있고 주차는 건물 뒤쪽 주차장을 이용하면 됩니다~ 오후4시에 오픈하는 연희동카페 HONEY DOUGH 에요~~ 와인바로는 오후 6시부터 이용가능하구요~ 초록초록한 아이들로 곳곳을 꾸며놓아서 그린힐링도 가능한 허니도우입니다~ 화이트컬러를 베이스로 해서 초록초록한 아이들이 더 싱그러워 보이는 HONEY DOUGH에요~ 와인바로도 운영하고 있어서인지 초록이들과 함께하는 바테이블도 홀 가운데 자리잡고 있었구요~ 룸도 있어서 소규모모임하기에도 괜춘한 연희동카페 HONEY DOUGH에요~ 와인모임 장소~ㅋ 밤에는 와인바로 이용가능한 허니도우지만 낮에는 귀염진 비주얼을 가지고 있는 도넛들이 메인이라는거~ 브라운치즈가 가득 올라가는 몬스터브라운 늠 궁금했는데 품절..ㅠㅠ 더블초콜릿도 품절..ㅠㅠ 가장 궁금했던 아이템들이 다 품절이라 살짝 슬펐..ㅋ 아쉬움은 접어두고 있는 아이들로 메뉴를 꾸려봤어요~ 크리스피 크런치바랑 밀크크림, 미숫가루, 솔티카라멜, 티라미수 도넛을 골라봤습니다~ 다들 알록달록한 구여움을 가지고 있는 허니도우 도넛들이에요~ 도넛 뿐 아니라 커피와 음료도 판매하고 있는 연희동카페구요~ 도넛들과 함께 즐겨줄 음료는 레드자몽에이드를 골라줬어요~ 주문한 도넛들이 준비되는 동안 연희동카페 플렌테리어를 마음껏 즐겨주기~ㅋ 초록초록한 아이들이 많아서 좋더라구요~ 2층이라 창가에 앉아서 밖을 구경하는 재미도 있었구요~ 밀크크림, 미숫가루, 솔티카라멜 크림도넛 3총사에요~~ 도넛 사이에 크림이 가득가득 들어가 있습니다~ 밀크크림은 우유가 들어간만큼 부드러운 맛을 솔티카라멜크림은 카라멜의 달콤함을 미숫가루크림은 곡물의 고소함을 주고 있구요~ 필링크림들이 아낌없이 들어가는 허니도우 도넛들이에요~ 빵이 살짝 제 취향은 아니었는데 부드러운 필링크림은 가득가득 들어가 있습니다~ 하나씩 들고 먹기 좋게 포장되어 나오구요~ 연희동카페 캐릭터가 귀여워서 어쩐지 더 귀엽게 보이는 HONEY DOUGH의 도넛들이었네요~^^; 티라미수도너츠는 케이크 같은 비주얼을 자랑해요~ 커피시럽이 꽂혀져 나와서 먹기 전에 커피시럽을 쭈욱~ 짜넣어 준 다음 한입 베어물면 커피 풍미도 한껏 즐겨줄 수가 있어요~ 크림 데코도 그렇고 티라미수 케이크 같은 연희동카페 티라미수도너츠에요~ 노랑이 접시에 담겨나와서 그런지 파티 푸드로도 괜춘할듯 싶더라구요~ 티라미수 도너츠는 먹기 전에 커피시럽을 쭉쭉~~ 짜넣어줍니다~~ 연희동카페 허니도우 티라미수도넛 재생 4 좋아요 0 00:00 00:18  접기/펴기 연희동카페 허니도우 티라미수도넛 초코크런치가 가득 묻혀져 있는 크리스피 크런치 바 도넛은 일명 돼지바도넛으로도 불리는데요~ 딱 봐도 돼지바비주얼~~ㅋ 솔티카라멜도넛은 카라멜도 듬뿍 올려져서 나와요~ 중간중간 레드자몽에이드로 상큼하게 입가심도 해줍니다~ 허니도우 캐릭터 넘 구엽~ㅋ 낮에는 도넛과 커피를 밤에는 와인을 즐길 수 있는 연희동카페 HONEY DOUGH 에요~~ 50m © NAVER Corp. 허니도우연희점 서울특별시 서대문구 연희로11가길 53 1층"
연희동카페 허니도우 프루티 페블스 추천!,"깜찍하고 맛있는 연희동카페 허니도우2020 신촌 갔다가 가까운 연희동카페 도너츠맛집 찾다가 방문해 보았습니다. 여유로운 오후시간 햇빛 잘 드는 플렌테리어 가득한 허니도우 즐거운 시간이었어요. 나무색과 초록잎이 어우러져 깔끔하면서 자연친화적인 느낌의 연희동카페 여기가 도너츠맛집이랍니다. 카운터도 어디 영화에 나오는 것같이 아기자기, 깔끔 그 자체. 큐알체크인하고 주문을 먼저 한 후 창가로 자리를 잡았습니다. 이제 막 해가 지기 시작하는 시간, 길어지는 해가 통창으로 들어오는 그림이 참 예쁜 자리. 반대편에 엄청 귀여운 강아지가 사람구경 하고 있었는데, 그 강아지 보느라고 지나가는 사람들마다 멈췄다 가는 모습이 재밌는 자리입니다. 쇼케이스에 샘플도넛이 있어요. 메뉴판 보고 고르는 것보다 직접 도너츠 모양 보고 고르는 게 쉬워요! 허니도우 메뉴판입니다. 간단한 음료도 맛이 좋고, 도너츠는 말할 것도 없죠! 허니도우 도너츠들 넘 예뻐요. 딱 봐도 무슨 재료의 어떤 맛이 나겠구나! 하는 게 팍팍 느껴지는 디자인들. 라즈베리 피스타치오, 정말 상큼할 것 같고~ 더블초콜릿은 엄청 진할 것 같고요! 도너츠는 두 개 골랐어요. 몬스터 브라운(4,500원)과 프루티 페블스 (4,000원) 프루티 페블스 제가 생각하는 연희동카페 허니도우 베스트 도넛! 가운데는 크림 살짝 들어있고, 도넛 전체에 바사삭 과일맛 과자가 뿌려져 있는 도넛이예요. 보기만해도 상큼상큼. 보기보다 큼직한 도넛이라 한 입 가득 넣고 먹을 때 기분이 제일 좋은 도넛! 생일파티 할 때 준비해서 깔아두면 기분이 넘 좋을 것 같은 연희동카페 허니도우 프루티 페블스. 몬스터 브라운 브라운 치즈의 진득함이 트레이드마크인 몬스터 브라운. 두 눈 땡글 뜨고 있는 뽀글머리 도넛입니다. 넘 귀엽죠 >.< 귀여움에 반해서 허니도우에서 젤 많이 나가는 도넛일 것 같아요. 몬스터의 눈알은 맛있는 화이트 초콜릿입니다~ 연희동디저트 허니도우 재생 3 좋아요 0 00:00 00:19  접기/펴기 연희동디저트 허니도우 연희동카페 허니도우 도넛빵도 진짜 맛있어요. 그렇지않아도 부드러운 도넛에 크림, 그리고 두꺼운 브라운치즈가 켜켜이 쌓여있어서 풍미가 장난 아닙니다. 도넛은 너무 작게 잘라먹는 것보다 한 입 가득하게 좀 큼직한 사이즈로 해서 먹는게 훨씬 맛있어요. 휴~ 이제야 기분이 좋아지네요! 요즘 도넛에 빠져서 도넛 앙~ 먹을 때 그 만족스러운 기분 자꾸 느끼고 싶어진다니까요. 매장도 깔끔하고 직원 친절하고, 무엇보다 음료랑 도넛 짱 맛있는 시간 날 때마다 연희동카페 허니도우 자주 가야겠어요~ 정신건강을 위해서!! #연희동디저트 #연희동도너츠 #연희동디저트카페 #연희동도넛 #서대문도넛맛집 #서대문카페 #서대문디저트맛집 #연희동카페 #연희동도넛맛집 #연희동디저트맛집 #홍대입구역도넛 #홍대입구역역카페 50m © NAVER Corp. 허니도우연희점 서울특별시 서대문구 연희로11가길 53 1층"
연희동카페 허니도우 분위기좋고 노래좋은 와인 도넛 그리고 커피,"서비스 제공받아 추가 결제 하였습니다. 가디쪽에 사는 지인과 만나기 위해 어디서 만나면 좋을까 하다가 서울 올라온지도 얼마 안되었고 연희동도 안가봤다길래 맛집 많고 아기자기하면서 세련됨, 프라이빗한 분위기를 풍기는 연희동으로 오게 되었어요 점심으로 연희동 마우디에서 파스타와 뇨끼를 먹고 깔끔한 커피 또는 티와 디저트를 먹기 위해 허니도우 연희점 으로 왔습니다. 허니도우 서울에 여러 곳이 있는데 이 날은 연희점으로 ~ 반 2층 같아요 계단으로 올라가주세요 그냥 디저트 팔고 커피파는 조그마한 카페라고 생각했던건 큰 오산 들어가니까 큰 홀과 햇빛이 쫘악 내리는데 오후 2시에 정말 예쁜거 있죠? 노래는 백예린 플레이리스트여서 막 마음도 설레고 날씨도 좋고 :) ♡ 그리고 딱 주문하러 가면 제일 먼저 눈이 가는 건 메뉴판이 아닌 귀여운 도넛들 ꈍ◡ꈍ 오후 2시에 왔지만 이미 3종류가 sold out 된건 너무나도 아쉬워라 .. Tiramisu salted caramel 그리고 하나 더 였던 걸로 기억해요 연희동카페 허니도우 분위기좋고 노래좋은 와인 도넛 그리고 커피 재생 4 좋아요 0 00:00 00:24  연희동카페 허니도우 분위기좋고 노래좋은 와인 도넛 그리고 커피 직원분께 양해를 구하고 연희동카페 허니도우 연희점 도넛들을 찍어봤어요 꺅 영상으로 보니까 더욱 귀엽군요 위는 연희동카페 허니도우 연희점 메뉴판! 저는 5월의제주말차라떼 아이스와 지인분은 홍차아이스티 hot 으로 주문 도넛은 10분 정도 직접 만들어 오기에 시간이 걸리니 양해 부탁드린다고 하셨어요 아 그리고 연희동카페 허니도우 연희점은 와인도 팔아요! 어쩐지 같이 간 지인분이 여기 분위기도 되게 좋아서 와인 마시기에도 좋겠어요 했는데 역시나- 창가 자리는 사수해야 할 것 같은데 여기저기 모든 테이블이 이뻐보여서 또 찰칵. 요시고 사진전 다녀오셨나봐요 아니 사진들 완전 이쁘구 감성있고 ~ 저희는 큰 창을 바깥으로 열어둔 창가자리에 앉았어요 처음 만난 자리라서 서로에 대해 이야기가 끊임이 없었던지라 10분 금방 지나갔어요! 짠- 드디어 나온 끄아아악 너무 귀여운 도넛들 허니도우 시그니처는 아무래도 브라운 치즈 도넛이 아닐까 합니다 너무 귀엽잖아 ;; 연희동카페 허니도우 분위기좋고 노래좋은 와인 도넛 그리고 커피 재생 1 좋아요 0 00:00 00:31  연희동카페 허니도우 분위기좋고 노래좋은 와인 도넛 그리고 커피 호들갑 너무 떨다가 아아 빨리 영상 찍을게요 하고 후다닥 찍어보았어요 유리 안에 전시해둔 메뉴 전용 도넛보다가 우리가 먹을 도넛 보니까 너무 더 막 맛있어보이고 나만 그래야 ..? 초코를 아주 좋아하는 지인은 누텔라 도넛을 선택했어요 아낌없이 도넛 위에 발라진 누텔라와 식감을 살려줄 크림, 견과류까지 저는 이걸로 선택! 위에 크래커가 올려져있고 크림에 블루베리까지 사실상 제일 데코가 많았던걸 고른 욕심쟁이가 아닌가 귀엽게 생긴 캐릭터 도넛 솔직히 그냥 눈으로만 이쁜거 아냐 했는데 맛도 있어서 좋았고 카페 내부 그 식물이랑 함께 하는 인테리어!! 플랜테리어 라고 하더라고요 감성적이고 이뻐 .... 오후 6시 부터는 와인서비스가 시작된다고 하네요 제가 갔을 때는 오후 2시여서 못했지만 다음번엔 와인이랑 도넛 즐겨보고 싶돠 .... 가격도 합리적이어서 부담없이 남자친구, 친구랑 오기 좋을 연희동 카페 허니도우 연희점 추천드립니다 50m © NAVER Corp. 허니도우연희점 서울특별시 서대문구 연희로11가길 53 1층 아 저 이날 신촌역에서 내려서 가려니까 금, 토, 일 차없는 거리 해서 버스가 잘 안오더라구요 가는 편 잘 찾아보고 가시길 바라며! 오늘도 좋은 하루 되세요 :)"
"분위기 미쳤다, 와인한잔하러 3차로 가도 될것 같은 도넛집 연희동 Honey dough 허니도우","오랜만에 찾아온 리뷰! 오늘은 #연희동 #도넛집 #허니도우 를 리뷰해보려고해요. 요새진짜 도넛집이 핫한거 같아요! 여기저기 많이 생기더라구요. 연희동에도 자주 다니던 골목에 갑자기 도넛집이 생겼는데 굉장히 귀여워서 한번 들어가봤어요. #메뉴판 이렇게 음료 메뉴를 팔구요, 엇 여기는 없는데 와인도 팔더라구요! 여러가지 도넛들! 엄청 먹음직스럽게 생겼죠. 요새 저런 필링이 가득찬 노티드도넛 스타일의 도넛이 유행인가봐요. #crispycrunchbar 3,8 #monsterbrown 4,5 내가 먹고싶은것 하나, 남친 먹고싶은거 하나 해서 두개 픽! (이미 양손가득...빵 사오고 오기전에 빵도 먹은상태라 도넛을 많이 못주문해서 아쉽아쉽 🥲) 무엇보다 여기는 진짜 분위기가 너-무 좋은 도넛집이었어요. 깔끔하게 정돈된 실내, 그리고 살짝 은은하게 어두운 조명에 매장내에서는 재즈 음악들이 흘러나왔어요! 왜 와인을 파는지 알겠는. 저희는 술을 따로 먹으러가기로해서 와인 주문은 안했지만,가끔 술먹으면 단게 땡기잖아요. 그럴때 와서 3차로 도넛 먹으면서 와인해도 너무 좋을것 같음! 깔끔한 흰색 인테리어에 곳곳에 배치되어있는 귀여운 거울, 화장실 가는쪽도 엄청 깔끔하구 예쁘다 도넛은 주문과 동시에 만들어진다구 하는데, 주문하니 도넛 만드는 곳에서 도넛을 만들어다가 직접 가져다주셨당! 저 눈이 붙어있는 도넛은 #브라운치즈 가 올려져있는 도넛같은데 맛이 궁금해서 시켜봄! 짠! 요게 바로 #허니브라운 도넛 요건 딱봐도 옴청 달아보이는 #크리스피크런치바 허니브라운은 요렇게 빵 안에 사알짝 필링이 있었고 나는 위에 치즈가 조금 달달할줄 알았는데 치즈는 짭쪼롬했다!! 그래서 #단짠단짠 도넛! 예상외의 맛이어서 놀랬는데 맛났당 ❤ 다른것보다 얘가 내 스타일! 요 도넛안에는 크림+ 딸기잼이 들어있는데 이 맛은 무엇이냐하면... 돼지바맛임 ㅋㅋㅋㅋㅋ 바깥에 있는 까만 쿠키와 딸기잼&크림의 조합이 진짜 딱 돼지바였다! 단걸 잘 먹는 나도 엄-청 달았다. 당충전 빡!!! 분위기가 넘 좋아서 셀카도 찍고... 담번에는 꼭 와인마셔봐야지~~~ 하면서 나왔던 #honeydough 50m © NAVER Corp. 허니도우연희점 서울특별시 서대문구 연희로11가길 53 1층 #연희동맛집 #연희동빵집 #연희동도넛 #연희동핫플 #연희동분위기좋은 #연희동와인 #연희동데이트 #연희동소개팅 #도넛맛집 #도넛핫플 #도넛"
서울 연희동 와인바 / 도넛카페 / 카페 :: 허니도우 연희,"연희동 와인바 / 도넛카페 연희동에 새로 오픈한 인스타감성 와인바 겸 도넛가게 허니도우 연희 <Honey Dough _ yeonhee> 오늘은 연희동에 새로 오픈한 와인바 허니도우연희 다녀옴! 인스타에서 보니까 저 계단이랑 햄버거도 포토존이더라,, (햄버거는 1층 가게 간판이에요) 들어오자마자 메인 S자 바 테이블이 내 눈을 사로잡았지✨ 내 카페 감성 = 화이트 + 초록초록 창가쪽, 안쪽, 테라스, 메인 바 등 자리도 많고 공간도 넓어서 좋았다 솔직히 좁은데 테이블끼리 너무 붙어있으면 시끄러워서 오래있을수가 없음... 도우-넛 🍩 와인은 레드 / 화이트 / 디저트 / 글라스 + 샴페인까지 있다 🥂 (와인은 오후 6시부터 한다고 함!) 여기가 포토존이로구나- 두자리 간격으로 칸막이도 있고 특히 저 바 의자가 굉장히 편했음 이런곳에 거울이 빠지면 안되지. ㅋㅋㅋㅋㅋ 내부 조명도 은은하고 화장실 앞쪽 벽도 다 거울로 되어있어서 아쥬. 맘에 들오 ♡ 여기서도 사진 찍으면 예쁠것같다 다음에는 여기 앉기로 >< 뒷문으로 나오면 있는 통유리 테라스! 조금 아쉬웠던점이 뷰가,, 쪼금,,웅,, 쨔 - 란 치즈플래터 (39.000) 빌라욜란다모스카토 다스티 (35.000) Villa Jolanda Moscato d'Asti 다양한 치즈가 있는 치즈플래터 + 프레즐 = 짠짠짠 왜 와인에는 치즈인지 알겠다 둘이서 한병 다 마실수 있을까..? 했던걸 각 1병 했어도 쌉가능,, '칸티 모스카토 다스티' 랑 굉장히 비슷한 맛이었던 요 와인! 내가 제일 좋아하는맛ㅠㅠ 아카시아/꿀/허브향이 나는 스파클링 와인이다 병도 예뻐서 다마시고 챙겨왔지 🥂 몬스터 도넛 (4.500) - 시그니처 더블초코 푸딩 도넛 (3.500) 집가기 싫어서 불멍 중 화장실 앞 포토존 ✨ 분위기며 맛이며 다 너무 좋았던 허니도우 연희 포스팅 끄읏 ✋🏻 50m © NAVER Corp. 허니도우연희점 서울특별시 서대문구 연희로11가길 53 1층 주소 서울 서대문구 연희로11가길 53 매일 4p.m. - 9p.m. 🥂6시부터 와인서비스 시작 (가게 뒷편 주차가능) Instagram의 𝒥𝒾 𝒽𝓎ℯℴ𝓃(@j_jyeonee)님 프로필 • 게시물 74개 팔로워 558명, 팔로잉 678명, 게시물 74개 - 𝒥𝒾 𝒽𝓎ℯℴ𝓃(@j_jyeonee)님의 Instagram 사진 및 동영상 보기 wwwinstagram.com #연희동와인바 #연희동와인바추천 #연희동카페 #연희동카페추천 #연희동도넛 #연희동도넛카페 #허니도우연희"
"[Honey Dough] 눈도 입도 즐거운 귀여운 도너츠들이 잔뜩! 연희동 카페 추천 ""허니도우"" -연희점","뽀짝하고 맛있는 도너츠들이 잔뜩! 올 데이 데이트코스 추천! 허니도우 CAFE / 연희동 21.10.19 안녕하세요 래빗입니다아:D 오늘은 오랜만에 연희동 데이트 당떨어지는 요즘같은 계절에 당충전+눈도 입도 즐거운 도너츠맛집이 있다해서 냉큼 다녀왔던 연희동 도너츠맛집 카페추천! 허니도우 포스팅시작할게요오! ᙏ̤̫ 허니도우 - 연희점 A - 서울 서대문구 연희로11가길 53 1층 T - 매일 pm 2:00 ~ pm 10:00 P - 카페 뒷쪽 주차장 이용 I - instagram.com/honeydough_yeonhee 허니도우 연희님이 Instagram을 사용 중입니다 • 허니도우 연희님 프로필의 게시물 16개 팔로워 274명, 팔로잉 0명, 게시물 16개 - 허니도우 연희(@honeydough_yeonhee)님의 Instagram 사진 및 동영상 보기 instagram.com 위치) 홍대입구역 경의선방향 3번출구에서 도보 10분 ! 연희동 카페골목에 위치한 허니도우-연희점 카페로 들어가니 독특한 구조에 카페 안 가득한 플랜테리어 인테리어가 완전 인스타 갬성에 래빗서타일!!!! 물결모양에 쉐입에 바테이블과"" 창가쪽에서는 햇살이 잔뜩 들어오는 따뜻하고 갬성적인 분위기"" 제가 도착한 시간에는 이용객이 없던 조용한 시간이라 정말 온전히 평온한 시간을 보낼 수 있었던 래빗"" 인증샷도 쿠욱 남겨주구요오?! 지금 다시 보니 그날 정말 꾸꾸꾸 룩이었네요?ㅋㅋㅋ 세련된 소품 하나하나까지 집에다 데리고 오고 싶었던 게 많았던 유니크하고 뽀짝하던 허니도우- 내부분위기"" 그리고 허니도우-연희점은 6시부터 와인을 마실 수 있는 있어서 낮에 카페와는 또 다른 분위기를 느낄 수 있어서, 연히동에서 데이트를 계획하시는 커플분들에게 카페-와인을 모두 즐길 수 있어요!! 허니도우 인스타그램 허니도우 연희점 허니도우""는 서울에 지점이 여러개 있는 유명한 수제 도너츠 카페에요! Next image 몬스터브라운 4,500 마스카포네티라미수 3,800 아이스아메리카노 4000 허니도우 아아니 이거 먹을 수 있는거 맞쥬?! 너무나 귀엽게 생긴, 허니도우 몬스터브라운 도너츠 왕눈이 눈이 코옥 박힌 브라운도너츠는 브라운치즈가 잔뜩 들어간 달콤하고 쫀득하던 , 시그니처 도너츠 인증!! 허니도우 커피맛집도 인증입니다.!! 산미가 가득한 커피를 그닥 좋아하지 않은 래빗인데 담백하니 너무나 맛있던 아메리카노, 달달한걸 좋아하지 않은 분들이라면, 저처럼 말차도넛은 추천합니다: 도너츠 식감이라기보다는 정말 부드러운 커스터드를 먹는 너낌가득이었던 말차도너츠"" 마차 특유에 담백한 맛이 일품이었고?! 부드러운 식감이 너무나 좋았던"" 내.돈.내.산 재방문의사 500000 그날따라 탄수화물 중독이었던 래빗은"" 욕심으로 도너츠 5개를 주문해보았는데요? 남은 도너츠 포장해서 빵순이에게 전달했는데 말이됴?! 입맛까다로운 빵순이도 인정한 찐 도너츠 맛집이에요!!! 거기에 낮에는 갬성적인 카페고 저녁에는 분위기 넘치는 와인바로 변신하니 연희동에서 계획하시는 커플분들께 완전 희소식이겠쥬?! 연희동에서 데이트 계획하시는 분들꼐"" 맛있는 도너츠, 디저트를 맛보고싶으신 분들꼐"" 연희동 카페, 연희동 와인 맛집 분위기, 미각, 시각 오감만족할 수 잇는 허니도우 - 연희점 완전추천드립니다:D @redrabbit_973님이 Instagram을 사용 중입니다 • 2,702명이 @redrabbit_973님의 계정을 팔로우합니다 팔로워 2,702명, 팔로잉 824명, 게시물 591개 - MinSeo(@redrabbit_973)님의 Instagram 사진 및 동영상 보기 instagram.com"
