title,content
"[연희동] 카페, 도넛, 와인까지 한번에 연말 모임 허니도우","목란을 갔다가 예약했던 허니도우를 갔어요. 허니도우는 도넛을 파는 카페 겸 와인샵이예요. 도넛,카페, 와인 저희는 6인에 아이1명이고, 술을 안먹는 사람도 있어서 2차가 고민이었어요. 연희동은 규모가 작고 인원이 많은경우 들어갈 곳이 많지 않았거든요. 그러다 발견한 허니도우는 6~7인이 들어갈수 있는 룸이 있어서 예약을 했어요! 물론, 분위기도 좋았기 때문이죠!! 허니도우 연희점의 낮 허니도우 연희점은 천장의 서까래가 훤히 보이는 높은 천장과 푸른 그린 깔끔한 화이트가 포인트예요. 밤에도 낮에도 분위기 은은 허니도우의 카페 메뉴와 도넛이예요! 연말모임을 위해 사전 탐방할 때는 커플세트를 먹었어요 아메리카노 2잔 + 우유도넛 이 단돈 10000원~! 이날은 창가쪽에 앉았어요~ 낮도 예쁜 허니도우~ 허니도우 밀크도넛 커플 세트에 나온 밀크도넛 주문을 하면 바로~~ 크림을 만들어서 주기때문에 도넛 나오는 시간이 좀 걸려요! 달지않고 부드럽고 크리미한 도넛!! 맛있어요~~~ 와인 리스트 와인가격이 착해요~ 19500원에서18만원까지!! 와인을 잘 아시는 분은 어떨지 모르겠지만 가볍게 연말 기분내는 용으로 마시기에는 부담스럽지 않아 좋은거 같아요! 예약한 룸인데~~~ 신나서 사진을 안찍었네요ㅠ 안쪽에 자리잡고 있어서 독립적이지만 유리로 되어있어 개방감이 있어요! 프라이빗한 연말 모임으로 제격이겠죠! 원래는 와인을 먹으려고 했는데 지인들이 배불러서 못 먹겠다고ㅠㅠ 그래도 도넛이 빠지면 안되니깐 ㅋㅋ 아이와 지인이 갑자기 가야해서 테이크아웃으로 변경해주고 4명이 남아서 1시간동안 신나게 수다 떨었네요~~ 연말에 이런 분에게 추천 * 목란 갔다 어디가지? * 연희동에서 늦게까지 느긋하게 마시고 싶다면 (예쁜 카페 일찍 닫는 경우가 많아요) * 술마시는 사람 아닌사람 모두 만족 시키는 연말 모임 장소 * 프라이빗하지만 예쁜 장소 * 연희동에서 6명이상 갈만한 곳 50m © NAVER Corp. 허니도우연희점 서울특별시 서대문구 연희로11가길 53 1층 주차는 건물 뒤편에 가능하나, 뒤편으로 가는 법이 어려움~ 룸 예약 가능 #연말모임 #허니도우 #연희동모임 #연희동맛집 #연희동 #연희동연말모임 #연희동단체 #연희동카페 #연희동와인 #모임 #연말"
달콤한 수제 도넛과 와인을 함께 즐길 수 있는 연희동 카페 허니도우(HONEY DOUGH),"일요일 시도 플레이스에 들리기 전 시간이 조금 남아 근처를 둘러보기로 했다. 연희동에는 크게 올 일이 없어 이야기로만 많이 들었는데 이번 기회에 어떤 분위기 일지 보기로 했다. 대부분의 매장이 마감에 가까운 시간대여서 닫는 중이었는데 눈에 들어오는 곳이 있어 한 번 들어가 보기로 했다. 이름에서부터 달콤한 느낌이 느껴진다. 허니도우 연희점 HONEY DOUGH 서울 서대문구 연희동 192-29 1층 주차 : X 근처 사러가쇼핑센터주차장 이용을 추천 입간판도 귀엽다. 주차는 근처에 있는 사러가쇼핑센터주차장에 주차하고 걸어왔다. 대로변에서 가까워 찾기에 어렵지 않다. 간판을 따라 이어진 계단을 따라 올라가면 매장으로 들어올 수 있다. 카운터도 분위기가 있다. 매장 입구로 들어와 안쪽으로 들어오면 카운터가 있다. 카운터 앞으로는 메뉴판과 쇼케이스 너머로 보이는 다양한 도넛들이 영롱하게 빛나고 있다. 메뉴판에는 다양한 음료와 와인들이 적혀있다. 오로지 목적은 도넛이었기에 도넛을 천천히 골라보기로 했다. 분위기 잡기 좋은 느낌이다. 주문을 마치고 매장을 둘러보기로 했다. 매장은 비교적 카페치고는 어두운 편이다. 아무래도 와인을 같이 취급하고 있기 때문에 그런 것 같았다. 매장 인테리어는 하얀색을 바탕으로 나무톤과 식물들로 포인트를 준 것 같다. 덕분에 매장도 넓어 보이고 어두운 조명에도 답답하지 않았다. 안쪽에도 테이블이 있다. 입구에서 왼편으로 들어오면 테이블이 더 준비되어 있다. 안쪽에 룸같이 준비되어 있는 공간은 마음 편하게 분위기를 즐기기에도 좋을 것 같았다. 50m © NAVER Corp. 허니도우연희점 서울특별시 서대문구 연희로11가길 53 1층 도넛은 총 4종류 밀크 크림과 얼그레이, 레몬 크림, 솔티 카라멜을 포장했다. 전부 개별 포장을 해주어서 들고 다닐 때 불편함이 없었다. 다만 포장하는데 시간이 조금 오래 걸려 기다려야 했다. 거의 들어오자마자 바로 만들어주는 느낌이었다. 맛은 정말 취향 저격이었다. 폭신하면서 입에 착착 감기는 게 아주 마음에 들었다. 연희동에서 와인과 함께 도넛을 맛보고 싶다면 허니도우에 들러보는 게 좋다."
홍대 데이트 - 연희동 와인바 미정 / 카페 허니도우 / 상수역 제비다방,"지난주말에 지인 두분과 홍대에서 데이트했다! ㅎㅎㅎ 1차로 연희동 와인바 미정에 갔음. 여기 진짜... 음식이 다 너무 맛있어서 감탄 ㅠㅠ 난 술을 안마시는데 여기는 꼭 술 한잔이상 기본으로 시켜야 한다고 해서 와인한잔 시킴 ㅎㅎㅎ 맛있는 안주랑 먹으니 술도 술술 들어감! 식빵도 맛있고 스파게티도 존맛이궁 흑흑 메인인 문어요리와 스테이크 최고 ㅠㅠ 마지막 후식까지 완벽!! 연희동 와인바 미정 강추합니닷!!!+_+ 50m © NAVER Corp. 미정 서울특별시 서대문구 연희로11가길 53 원래는 미정 근처 다른카페로 2차 가려고했는데 미정과 같은 건물에 카페가 있어서 호기심에 와봄! 공간은 넓고 예쁜데 사람은 별로 없어 좋았다! 우리는 별도의 룸에서 커피랑 후식먹음. ㅎㅎㅎ 커피랑 도넛 둘다 맛있었오~~^^ 미정 가신분들은 2차로 여기 가면 좋을듯! 50m © NAVER Corp. 허니도우연희점 서울특별시 서대문구 연희로11가길 53 1층 아직도 할말이 너무 많아서 헤어질 수 없었던 우리는 3차로 상수역 제비다방에 옴!! ㅋㅋㅋ 낮에는 제비다방, 밤에는 취한제비로 운영되는곳! 8년전 쯤, 첫 직장이 이 근처여서 직장동료분이랑 왔던 기억이 있는데 정말 좋아서 다음에 또와야지! 해놓고...ㅠㅠ 정말 좋은곳 찾아다니는것도 부지런해야한다는 생각이 들었다. 오랜만에 왔음에도 역시나! 좋았음!! 여기는 1층이고 주문을 할수있는곳이 있다. 지하에는 공연장과 테이블이 더 있는데 우린 1층에 자리잡음~^^ 음악도 분위기도 정말 완벽했다...ㅠㅠ 새벽 2시까지 신나게 수다떨다 헤어짐!! 이날 생각해보니 이렇게 새벽까지 논게 정말 오랜만이었다. 나 포함 만난분들까지 모두 아이엄마여서 이렇게 새벽까지 좋은곳에서 맛있는거먹으며 논게 정말 더 감격스러웠음!! 서울에 좋은곳이 이렇게 많은데 진짜 더 부지런히 찾아다녀야지...!!! 행복했던 기억으로 오래오래 남을 날이었다. :) 50m © NAVER Corp. 제비다방 서울특별시 마포구 와우산로 24"
"[연희동 카페] 허니도우 연희점ㅣ 도넛, 분위기 맛집, 연희동 데이트",#연희동카페 #연희동도넛 #분위기맛집 #연희동데이트 #허니도우연희점 #허니도우 너무 귀여웠던 도넛! 카페도 넓고 분위기가 좋았어요:) 50m © NAVER Corp. 허니도우연희점 서울특별시 서대문구 연희로11가길 53 1층
귀여운 몬스터도넛이 반겨주는 연희동카페 허니도우,"#연희동카페 #연희동와인 #홍대카페 #홍대도너츠 #허니도우 #홍대와인 오늘은 홍대 연희동쪽에 있는 연희동카페 허니도우2020을 다녀왔습네다 요즘 베이커리카페못지않게 도넛전문점이 참많이보이는것같아요 저 중고딩때는 던킨도너츠가 대세였고 일본에서 건너온 미스터도넛도 한창 핫하다가 어느새 한국에서 철수한것같더라구요 허니도우의 음료메뉴에용 도넛뿐만아니라 커피,차같은 음료도있고 세트메뉴도있습니당 가운데 귀여운 로고가 인상적이네요 ㅎㅎㅎ 도넛전문점이니까 도넛들을 둘러볼까용 대체적인 가격대는 3.5부터 형성되있네요 보슬보슬 치즈가루위에 눈 두덩이가 박힌 몬스터 도넛이 허니도우의 시그니쳐메뉴랍니다 연희동카페 허니도우는 저녁6시이후 와인바로 변신하는데요 와인리스트메뉴가 따로준비돼있어요 전 도넛목적으로 방문한거라 와인을 마시진않았지만 분위기가 좋아서 데이뚜목적으로도 좋을것같아욤 가격도 합리적이네욧 와인메뉴옆에있던건데 뭐인지궁금해서 사장님한테 여쭤본다는걸깜빡햇네요 ㅎㅎ 연희동카페 허니도우실내모습이에요 인테리어가 전반적으로 군더더기없이 깔끔하게 떨어지는것같아요! 곳곳에 식물이 많이놓여있는 플랜테리어 인테리어가 인상적임듕 회의실마냥 문이있는 개인실도있었어요! 통창이라서 여기서 회의하면 머리가 뚫려서 아이디어 샘솟을것같아요 ㅋㅋㅋ 정문말고 후문(?) 뒷문에서 본모습이에욯 뒷문에도 출입구가있더라구용 ㅎㅎ 저는 친구집에서먹으려고 포장해갔는데 연희동배경을 안주삼아 안에서뇸뇸해도 좋을것같네요! 포장해서 친구집으로왔숩니당! 무려7종류를 픽픽ㅎㅎㅎㅎㅎ 몬스터브라운도넛 더블초코푸딩 라즈베리 피스타치오 마스카포네 티라미스 7가지 다 맛있긴했는데 하나만꼽으라면 전티라미스! 친구는 시그니처메뉴인 몬스터브라운을 골랐네요ㅎㅎ 귀엽고깜찍한 도넛친구들이있는 허니도우 연희점이었습니다 50m © NAVER Corp. 허니도우연희점 서울특별시 서대문구 연희로11가길 53 1층"
분위기도 좋고 메뉴도 만족스러운 / 연희동와인 허니도우,"허니도우연희점 서울특별시 서대문구 연희로11가길 53 1층 #연희동와인 #연희동와인바 #허니도우연희점 연희동에 오픈한 허니도우 젊은 사람들이 많은 곳들에 매장이 하나씩 생기는데 귀여운 모양에 맛까지 책임지는 도넛이 시그니처 낮에는 주로 도넛과 함께 카페로 즐길 수 있고 저녁에는 와인과 함께할 수 있는 공간이다 ( 코로나 이전에 ) 와인들 좋아하는 지인들 따라 여러 와인바 도장깨기를 하고 다녔는데 유명하고 웨이팅이 긴 와인바들과 비교했을 때도 전체적으로 만족스러운 편에 속했던 곳이다 🥂 재방문 의사 100% 있음 🥂 허니도우 연희점은 오픈한지 얼마 안되어서 그런지 깔끔하고 분위기 있는 공간을 여유롭게 쓸 수 있다 사람이 많이 없어 조용하게 와인을 마실 수도 있고 오픈한지 얼마 안되었음에도 불구하고 친절하면서도 부담스럽지 않은 서비스를 해주시는 사장님 또한 너무나 좋았던 곳으로 소개하고 싶다 방문했던 날은 비가 오는 저녁이라서 약한 조명과 잔잔한 분위기였는데 심플하면서도 센스 있는 인테리어라서 낮에 방문한다면 낮분위기도 좋을 것 같은 느낌 와인과 함께 치즈플래터, 도넛을 하나 먹었다 ( 사실 가기 전부터 이 도넛으로 정하고 갔고요 ) 공간도 도넛도 인스타 감성 낭낭한 분위기 도넛의 경우 귀엽기는 했지만 사실 주물할 때 살짝 맛이 걱정되었는데 기대 이상으로 만족스러워서 갈때 종류별로 다르게 세개를 포장해갔다 ( 포장도 센스 있게 해주셔서 대대만족! ) 사실 비가 예상했던 것보다 많이 오는 날이라 대충대충 입고 ( 젖은 신발로 흑흑 ) 갔는데 지인과 함께 간다면 낮도 그렇고 밤도 만족스러운 사진을 찍기에도 좋아보인다 센스있는 인테리어에 감탄을 하면서 이달의 와인을 PICK 와인리스트는 보기 편하게 되어있고 홍대와 연희동이라는 위치를 감안하면 무척이나 괜찮은 편이라는 생각을 했다 특히 가벼운 치즈 플레이트와 함께하면 어린 커플이나 친구들끼리 방문하기에도 부담스럽지 않은 금액대라고 해야할까? ( 거기다가 분위기는 얼마나 좋게요! ) 비오는 이날은 #쟝발몽 #샤르도네 이렇게 가게에서 마시는데도 가격도 괜찮은데다가 화이트 와인을 좋아하는 나에게는 딱 혹시라도 허니도우 연희점에서 어떤 와인을 골라야할지 고민인 분들이라면 치즈 플레이트 & 도넛과 함께 먹기 좋은 가볍게 하기 좋은 와인으로도 소개해본다 친절하게 소개해주시는 사장님 ( 어려보이셔서 혹은 매니저님? ) 가게 전체의 분위기도 좋았지만 담당해주시는 분들이 마음에 들면 아무래도 그 공간이 더 좋게 기억된다 조용하지만 운치있는 분위기에서 함께하는 와인 특히 천장 부분의 공간도 탁 트여있고 시원한 느낌을 주는 인테리어라서 그런지 오랜 시간 머물러도 편하고 좋은 것 같다 ( 나중에 코로나 끝나면 꼭 와인 술쟁이들이랑 와야지 ) 가볍게 함께할 수 있는 플레이트의 경우에도 다른 곳에서 내어주는 것과 비슷한 것 같으면서 은근하게 만족스러운 맛과 조합이라고 해야할까 공간, 분위기, 서비스 대비 구성과 가격이 너무나도 좋았다 마무리로 도너츠까지 끝내면 오랜만에 와인바 투어 완료! 마지막 사진은 맛있어서 포장 구매해온 도너츠들 먹으려고 펼쳤다가 너무 귀여워서 찍어보았다 나중에 연희동에 갈 일이 있다거나 지인들과 와인 한 잔 해야할 때 다시 방문할 의사가 있는 곳 앞으로 잘 부탁드립니다 🥂🥂 https://www.instagram.com/honeydough_yeonhee/ 허니도우 연희님이 Instagram을 사용 중입니다 • 허니도우 연희님 프로필의 게시물 16개 팔로워 257명, 팔로잉 0명, 게시물 16개 - 허니도우 연희(@honeydough_yeonhee)님의 Instagram 사진 및 동영상 보기 www.instagram.com #연희동카페 #연희동데이트 #허니도우 #연희동 #홍대데이트 #홍대와인바 #홍대와인 #홍대카페"
연희동 카페 허니도우 수제도넛 먹어볼래요?,"즉석에서 완성되는 수제도넛 연희동 카페 허니 도우 글 · 사진 · 영상 © 진냥 추석 연휴 마지막날 저녁을 먹으러 연희동에 갔다 익숙한 길에 새롭게 문을 연 공간이 눈에 띄었다. 워낙 새로 생겼다가 없어졌다가 반복되는 상권이라 이번에는 또 뭐가 생긴건가 궁금하긴 했는데, 저녁을 먹고 난 직후라 무언가를 더 먹을만한 여유는 없어 다음을 기약했던 곳에 다녀왔다. 허니도우연희점 서울특별시 서대문구 연희로11가길 53 1층 연희동 자주 가는 사람들이라면 익숙한 명륜진사갈비쪽 대로변에서 연희동으로 집입하는 골목 입구에 자리하고 있는 연희동 카페 허니도우 HONEY DOUGH 아주 심플한 외관이지만 외부로 열려있는 폴딩 도어 덕분에 지나가는 이들의 눈길을 한 번쯤은 끌게 만드는 곳이다. 연희동을 돌아다니다가 두눈이 똥그란 저 캐릭터와 마주했다면 한 번쯤 들어가보길 추천한다. 여기 도넛 맛집이거든요 😉 왼쪽 계단을 따라 올라가면 2층인 듯 1층인 매장으로 연결된다. 초록잎이 가득하게 꾸며진 내부 공간. 어디 동남아 휴양지 리조트에 온 것 같은 느낌이 물씬 풍기는 분위기에 기분이가 좋아졌다 ☺ 이곳이 연희동 카페로 변신하기 전 같은 자리에는 칵테일바가 있었다. 내부 구조는 크게 바뀐것이 없었데 플랜테리어 하나로 분위기가 확 바뀌었다. 게다가 층고도 높고, 햇살도 넉넉하게 들어와서 햇살 맛집 분위기 맛집으로 인정하는 연희동카페. 매장 제일 안쪽 창가자리에 앉으면 이런뷰 가능~ 내가 방문하기 전까지 이 곳에 대한 리뷰가 거의 없다시피했던 곳이라 '도넛을 파는 카페' 정도의 정보만 가지고 방문했는데, 글쎄 그냥 진열해 둔 도넛을 판매하는 것이 아니라 주문과 동시에 즉석에서 크림과 토핑을 얹어주는 시스템으로 운영되고 있는 곳이었다. 완전 신박하쥬? 연희동 카페 허니도우 도넛 미쳤어!! 재생 57 좋아요 0 00:00 00:22  접기/펴기 연희동 카페 허니도우 도넛 미쳤어!! 판매되고 있는 도넛들의 샘픔을 진열해 놓았는데, 윗줄은 알록달록하고 화려한 토핑이 눈길을 끌고, 아랫줄은 심플한 크림류의 도넛이 주를 이루고 있다. 저건 딱 진열장에서 도넛의 종류만 소개해주는 거고 주문을 하면 안쪽 주방에서 뚝딱뚝딱 만들어준다니 서른n살 어른이는 벌써 신이 납니다 😁 잠시 도넛에 홀렸었는데 연희동 카페이니만큼 주문할 수 있는 음료도 꽤 다양한 편이었다. 커피류뿐만 아니라 병에 담긴 사과주스, 탄산수, 에이드와 아이스티 등도 주문할 수 있고 도넛이 포함된 세트메뉴도 좋아보였다. 싱글세트 1만원 아메리카노 1잔 + 우유도넛 1개 + 크림도넛 택 1개 커플세트 1만원 아메리카노 2잔 + 우유도넛 1개 나는 빵순이라 도넛 2개 먹어야 하니까 당연히(?) 싱글세트로 선택했다 ㅎㅎㅎ 우유 도넛은 고정이고 선택으로 뭘 먹을까 하다가 샘플 도넛에 토핑된 눈과 마주쳤다. 그 정체는 잠시 후 공개됩니다 😁 메뉴판 옆에 와인리스트가 걸려 있었다. 여쭤보니 오후 6시부터는 와인을 판매 한다고 하는데 살펴보니 가격대는 저려미부터 10만원대까지 다양했다. 알쓰에 와알못이라 나한테는 해당사항이 없을 듯 하지만 가을바람 살랑살랑부는 창가에 앉아 와인 한 잔 하는 상상을 해보니 여기 공간이랑 잘 어울릴 것 같네~ 요기가 바로 내가 추천하는 제일 안쪽 자리. 주문하기전에 먼저 자리부터 맡아뒀다며 ㅎㅎ 가운데 커다란 테이블을 기준으로 공간이 나뉘는데 반대쪽으로 넘어가보니 최대 6명 정도가 사용 가능한 개별룸이 있었다. 요즘 유행하는 저 조명까지 있어서 와인은 여기서 먹어도 분위기 괜춘하겠다 싶었다 ㅎ 생각보다 숨어있는 공간들이 많았는데 다들 분위기가 조금씩 달라서 여러번 와도 매번 다른 분위기를 연출할 수 있는 곳 분위기 맛집 연희동 카페 허니 도우. 내 주문이 들어간 이후에 안쪽 주방공간에서 분주하게 기계가 돌아가는 소리가 들리더니 곧 내 자리로 두개의 도넛과 커피가 배달되었다. 왼쪽이 우유도넛 오른쪽이 브라운치즈 도넛이다. 커다란 두개의 눈이 쳐다보고 있는 것 같죠? ㅎㅎ 우유도넛에는 정말 아낌없이 크림을 넣어주셨다. 뽀얀 우유크림이 도넛 두께만큼이나 두툼했다. 아무리 도넛이라고 해도 이정도면 턱 빠져요;;; 도넛 특유의 빵 냄새과 고소한 크림의 향에 정신이 털리기 전에 서둘러 사진을 찍었다. 손에 감기는 도넛의 질감이 벌써 포근하다. 퍽퍽함과는 거리가 먼 것이 느껴지는구나~ 도넛 아래쪽만 먹고 위쪽 빵은 그대로 있는거 봐 ㅋㅋㅋㅋㅋㅋㅋㅋㅋㅋㅋㅋㅋㅋㅋㅋㅋㅋㅋㅋㅋ 우유 크림 진짜 엄청 들어있는거 인정~~~ 크림의 질감이 생크림 100%같지는 않은데 느끼하지 않고 적당히 달달하니 자꾸 땡긴다. 그리고 이집 커피 잘하네~ 산미 없는 원두 선호하는데 딱 그런 구수~~한 맛이었다. 그리고 진해~~~~~~~~~~~ 흐리멍텅한 커피 완전 싫어하는데 디저트와 함께 하기에 적당했다. 내 앞쪽에 다른 손님들이 앉아 있어서 호시탐탐 기회를 노리다 그 손님들이 나가고 자리가 정리되자마자 한 컷. 여기 분위기 맛집, 햇살 맛집 맞쥬? 폴딩도어를 열어놔서 시원한 바람까지 살랑살랑 불어오니 넘 기분이 좋았다. 그 분위기 살려 두번째 도넛 달려 봅니다! 두번째 주자~ 브라운치즈 도넛~ :) 브라운치즈 크로플에만 올려 먹는 줄 알았더니 도넛에도 올려 먹을 수 있는 거여써!!!! 두 눈을 그렇게 똥~ 그랗게 뜨고 있으면 내가 주문을 안 할 수가 없지 않겠니? 복실복실한 얼굴에 동그란 두 눈은 뭔가 묘하게 세서미 스트리트를 떠올리게 한다. 안녕하새오. 도넛이애오. 맛있게 드새오. ㅋㅋㅋㅋㅋㅋㅋ 이렇게 뭔가 눈이 달린거, 귀여운 걸 먹을 땐 단면 사진 못 찍겠는거 나만 그런거임? (아니 그럴거면 먹지를 말든가 ㅋㅋㅋ) 먼저 눈 부터 제거(?)하고 반을 갈라 먹어보니 달달한 크림위에 브라운치즈가 잔뜩 올려져 딱 단짠단짠 하기 좋은 도넛이었다. 매장에서 먹어본 도넛들이 마음에 들어 궁금했던 몇 종류의 도넛을 포장해왔다. 각각의 토핑이 망가지는 걸 원하지 않아 각기 개별포장을 요청드렸더니 하나하나 종이 상자에 담아 이름까지 적어주셨다. 프루티 페블스 4.0 얼그레이 3.5 마스카포네 티라미수 3.8 라즈베리 피스타치오 3.8 알록달록한 시리얼이 잔뜩 붙어있는 프루티 페블스는 친구 딸래미의 원픽! 역시 어린이들이 좋아할 줄 알아쓰~ 나의 원픽은 라즈베리 피스타치오. 최근에 던킨 라이브 매장에 다녀왔었는데 라즈베리 도넛이 기대이하라 속상했었다. 얼마전 실패의 경험때문에 먹을까 말까 하다 포장해왔는데 먹어보길 잘했다. 넘 맛있었다. 많이 달지 않고 적당히 상큼함까지 내 취향임. 다음에 가도 이건 또 먹고 싶을 듯. #연희동카페 #허니도우 #HONEYDOUGH #연희동도넛 #분위기맛집 #햇살맛집 #플랜테리어카페 #초록뷰 copyright ⓒ 2021 진냥 All Rights Reserved. 본 게시글의 모든 글과 이미지의 저작권은 진냥(dbwls0315)에게 있습니다. 이 블로그 내 모든 글과 이미지의 무단 도용 시 저작권법 위반으로 처벌받을 수 있습니다."
