title,content
"연희동 카페, 저녁에는 와인과 함께 허니도우","지난주 꽤 괜찮은 카페 겸 와인바를 발견했다. 알고 보니 연희동 카페로 이미 꽤 유명한 곳이더라. 이런 보물 같은 곳을 이제서야 발견하다니. 카페 외관에서 보이는 이쁜 간판이 한눈에 들어왔다. 계단을 통해 위로 올라갈 때 보이는 양옆의 와인병들 때문에 이곳이 카페인지 와인바인지 헷갈렸는데 알고 보니 위에도 설명했듯이 이곳은 낮에는 카페지만, 오후 5시 이후부터는 와인도 함께 판매하는 곳이었다. 연희동 카페의 계단을 올라, 문을 열고 안으로 들어가려는데 벽에 붙어있는 귀여운 스티커가 눈에 들어왔다. 나는 최근에서야 이곳을 알게 됐지만, 지인들 말로는 이미 오래전부터 유명한 곳이었다고 하더라 안으로 들어가자마자 제 눈에 띈 건, 테이블 정중앙에 있는 예쁜 식물들. 그냥 장식용 조화가 아니라 정말 살아있는 그래서 더 싱싱한 식물들이었다. 테이블은 이렇게 곡선으로 되었고 마치 파티션 같은 용도처럼 공간에 나눔이 되었는데 뭔가 센스가 제대로 느껴지는 곳이기도 했다. 카페 한쪽에는 이렇게 깔끔한 원형 테이블과 의자들이 있었는데 어딘지 아늑한 느낌이 꽤 마음에 드는 곳이었다. 그리고 제일 마음에 들었던 창가 쪽 자리. 물론 우리는 이 자리보다 더 예쁜 초록 잎이 앞에 있는 자리에 나란히 앉아서 와인과 맛난 음식들을 먹었지만. 바깥쪽에는 단체석도 있었는데 나중에 거리 두기 규제가 풀리면 지인들 여럿과 함께 다시 와봐야겠다는 생각도 들었다. 주문을 하러 카운트로 갔는데 쇼케이스 안에 도넛들이 너무 귀여워서 한참을 가만히 쳐다만 보다가 결국은 하나를 주문하고 말았다. 사실 요즘 살이 너무 많이 쪄서 다이어트 중이었지만, 맛있는 건 0칼로리니까... 천천히 시간이 흐를수록 더 예쁘게 변화는 연희동 카페, 허니도우 흐르는 음악도 어쩜 센스가 넘쳐서 그런지 기분이 말랑말랑 더 좋아지더라. 어두워질수록 더 매력 있게 변화던 곳이었다. 감성적인 분위기에 기분이 좋아진 우리는 계속해서 별것 아닌 일들에도 많이 웃었던 것 같다. 각 자리마다 분위기 있게 스머징 스틱이 놓여있더라. 검색을 해보니 연희동 카페에 있는 모든 도넛들이 다 맛있는데, 그중 제일 많이 주문한 도넛이 바로 이 귀여운 도넛이길래 주저 없이 주문했다. 도넛 이름은 몬스터 브라운이라고. 반을 딱 잘라서 먹는데 크림과 부드러운 치즈 맛이 너무 좋았다. 정말 딱 한 입만 먹으려 했는데 너무 맛있어서 결국 몇 입 더 먹고 말았다. 내가 좋아하는 프리챌도 가득 주셨다. 참고로 이곳 직원분도 무척 친절해서 더 기분 좋았던 저녁이었다는. 구성이 너무 좋았던 햄 치즈 플레이트. 보기만 해도 무척이나 푸짐하더라. 사실 치즈 플레이트는 다른 곳에서도 몇 번 먹어봤지만 이렇게까지 구성이 잘 나오는 곳을 오랜만에 보는 것 같아서 거기다 사진도 너무 잘 나와서 나는 계속해서 휴대폰과 카메라로 플레이트 사진을 찍었던 것 같다. 차곡차곡 정말 푸짐하고 예쁘게도 담아주셨다. 보고만 있어도 기분 좋았는데 언젠가 나도 내 소중한 지인들과 함께 와인을 마실 때 이렇게 예쁘게 플레이팅 해보고 싶다. 비주얼이 그만큼 마음에 들었다는. 특히 올리브가 정말 맛있었다. 너무 짜지도 않은 데다가 두툼해서 나는 정말 맛나게 먹었지만, 남자친구는 올리브를 그리 좋아하지 않아서인지 건들지도 않더라. 덕분에 올리브는 내 입에 다 들어갈 수 있었지만. 크래커와 치즈들도 있었는데 치즈 종류가 정말 하나같이 다 맛있었다. 특히 후르츠 앤 넛 치즈는 역시 최고였던! 연희동 카페 겸 와인 집이었다. 와인 리스트도 꽤 괜찮았고, 가격도 연희동의 다른 와인 집들에 비해서 꽤 괜찮았다. 샴페인부터 레드, 화이트 거기다 디저트 와인도 있었고 와인 한 병이 부담스러운 사람들이 먹을만한 글라스 와인도 판매하고 있었다. 우리가 그중 선택한 건 내가 사랑하는 스페인 레드와인, 마츠 엘 레시오(Matsu El Recio) 분위기가 좋아서 그런가? 맛있는 와인이 더 맛있게 느껴지더라. 정말 연희동 카페지만 와인을 마시러 들어오길 너무 잘한듯싶었다. 창밖이 어두워지자 더욱 분위기 있는 공간으로 변했던 연희동 카페. 밖의 건물들이 희미해지자 정말 스페인 마요르카의 어느 레스토랑이 있는듯한 기분마저 나더라. 분위기도 좋고 가격도 좋은 데다가 맛도 좋고 직원분도 친절해서 우리 커플이 와인 한 병 마시는데 무려 2시간이 넘게 걸렸던 곳, 사실 우리는 그리 오래 한곳에 앉아있지 못하는 스타일인데도 말이다. 이번에는 와인을 먹어봤지만 다음에는 조금 일찍 와서 카피도 마시고 다른 도넛들도 먹어봐야겠다. 물론 그러다 해가 저물면 와인도 한 잔 마시고 말이다. 50m © NAVER Corp. 허니도우연희점 서울특별시 서대문구 연희로11가길 53 1층 / 연희동 카페, 허니도우 Add. 서울 서대문구 연희동 Tel. 0507-1374-2967"
연희동카페 허니도우 귀욤뽀짝 몬스터도넛과 와인까지 즐겨요~,"연희동카페 허니도우 귀욤뽀짝 몬스터도넛과 와인까지 즐겨요~ 맛있는 크림도넛과 와인까지 즐길수있는 분위기좋은 카페 와인바 안녕하세요 잇님들 주디에요~♥ 빵순이 도넛덕후 이주디에요!! 주디가 정말 디저트 빵 케이크 좋아하는거 아시쥬!! 마포카페 허니도우가 세상 크림도넛으로 맛있다고해서 인스타에서 핫하더라구요 귀여운 몬스터 케릭터 도넛이 시그니쳐인 마코파케 허니도우는~ 낮에는 카페 밤에는 와인바 로 밤낮으로 즐길수있는 카페 이자 와인바더라구요!! 분위기가 세상 갬성가득해서 마포카페 마포와인바 허니도우 연희점을 들어가자마자 어찌나 신나던지>_< 허니도우 연희점 위치 마포카페 허니도우는~ 건물 뒷편에 주차장이 있기때문에 주차를 편하게 하실수있답니다:) 햄버거 가게 골목 2층 계단을 통해 허니도우 연희점 을 가실수있어요~ 허니도우 연희점 0507-1374-2967 주소 서울 서대문구 연희로11가길 53 1층 공항홍대입구역 3번 출구에서1170m 50m © NAVER Corp. 허니도우연희점 서울특별시 서대문구 연희로11가길 53 1층 마포카페 허니도우 연희점은~ 매일 2시에 오픈을한답니다 4시부터는 와인을 즐길수있는 도넛이맛있는 카페이자 와인바에요! 허니도우 연희님이 Instagram을 사용 중입니다 • 허니도우 연희님 프로필의 게시물 16개 팔로워 275명, 팔로잉 0명, 게시물 16개 - 허니도우 연희(@honeydough_yeonhee)님의 Instagram 사진 및 동영상 보기 www.instagram.com 마포와인바 허니도우 매장 내부가 정말 예쁘쥬? 갬성가득하쥬?! 초록초록 예쁜 식물들로 예쁘게 꾸며져있는 허니도우 연희점 거울셀카도 찍을수있게 예쁜 거울이있어욤!!!! 거울셀카맛집 허니도우 연희점 테이블 마다 어찌나 갬성가득한지 진짜 너무 분위기가 좋은거에요 마포에서~ 홍대에서 연희동에서 데이트하기 넘나 좋은 허니도우 연희점 연희동카페 허니도우는 해가지는순간부터 즐길수있는 와인바로 변하는게 정말 신기해요 허니도우 연희점은 대관도 가능하답니다!! 이렇게 개인룸이 있어서 모임하시기에도 정말좋아요 마포와인바 허니도우에서 생일파티하고싶어요 ㅋㅋㅋㅋㅋㅋㅋㅋ 화장실도 겁나 깨끗해서 좋더라구요!>_< 허니도우 메뉴 마포카페 허니도우의 메뉴에요:) 커피맛집 답게 다양한 커피와~ 레몬에이드 레몬자몽에이드 말차라떼 허니레몬티 우유 등 있답니다!! 주디는 도넛과 함께 먹을수있는 우유 아이스를 주문했어요~ 도넛과 우유는 국룰아닌가요ㅋㅋㅋㅋㅋㅋㅋㅋㅋㅋㅋ 와인 가격도 넘나 착해요! 와인도 취향에 맞게 다 추천해주시기때문에 와인 입문자들이 가기시에도 정말 좋은 홍대와인바 마포와인바 허니도우에요~ 허니도우는 플레이트와 와인잔도 넘나 갬성가득가득_ 마포 도넛맛집 홍대 도넛맛집 허니도우 연희점은~ 진짜 귀욤뽀짝한 몬스터 도넛과 크림도넛 등 도넛이 종류가 다양해요 도넛들이 진짜 다 맛있쥬?! 허니도우 연희점의 쇼케이스 안에 도넛들이 어찌나 다 사랑스러운지 홍대도넛맛집 허니도우 연희점은 몬서트브라운 블루베리요거트 라즈베리피스타치오 더블초콜릿푸딩 마스카포네티라미수 누텔라 레몬크림 그린티 우유크림 푸르티페블스 도넛이 있답니다!! 진짜 ㅋㅋㅋㅋㅋㅋㅋㅋ너무귀엽쥬 브라운치즈가 소복히 쌓여있는 몬스터 도넛!!! 물 한잔 달라고해도 이렇게 예쁜 유리글라스잔에 레몬까지 띄어서 주시는 센스 있는 마포카페 허니도우 연희점 주디는 도넛 6개를 주문했어요 우유크림도넛 브라운몬스터도넛 누텔라도넛 푸르티페블스도넛 마스카포네티라미슈도넛과 캬라멜도넛 을 주문했어요!!!!!!! 진짜 보기만해도 맛있어보이쥬!!!! 누텔라도넛 3500원 우유크림도넛 3500원 솔티캬라멜도넛 3500원 마스카포네티라미슈도넛 3800원이에욤 보기만해도 입안이 달달해지는~ 마포도넛맛집 허니도우 연희점 요즘 이렇게 크림 빵빵하게 들어간 노티드 서타일의 도넛이 인기많잖아요!!! 허니도우 도넛은 크림양이 정말 장난아니에요!!!!!!!!!!! 도넛 안에 가~득 크림이 들어있고 솔티카라멜로 코팅되어있어욤 밀크크림도넛!!!!!우유크림도넛 정말 먹어보고싶었는데 진짜!!!!!!! 우주대존맛 세상대존맛이에요 정말 식도가 행복해지는맛~~~~~ 다이어트임에도 포기할수없는 허니도우의 우유크림도넛 티라미수도넛은 마스카포네크림치즈가 드~음뿍 올려져있어요 코코아 가루가 소복히 쌓여있고 위에 커피를 짜서 먹을수있는게 꽂혀있답니다 넘나 신기하쥬? 누텔라도넛!!!!!! 진짜 달달한 누텔라가 듬~ 뿍 뭍어잇고 위에는 달달한 휘핑크림과 견과류들이 붙어있어서 식감도좋고 정말 맛있답니다 당떨어질때 무조건 드셔줘야하는 누텔라도넛~ 브라운치즈가 소복하게 쌓여있는 몬스터도넛과 푸르티페블스가 사랑스럽게 쌓여있는!! 푸르티페블스 도넛과 우유가 나왔어요~ 푸르티페블스 라는 미국에서 인기많은 상큼한 쌀로만든 씨리얼이 도넛에 토핑되어있어요 후루츠링보다 더 상큼하고 바삭바삭한것같아요ㅋㅋㅋㅋ 진짜 색도 너무 귀엽고 맛도 맛있음!! 브라운치즈 몬스터도넛이 정~말 허니도우의 시그니쳐 도넛이에요 너무너무 사랑스럽쥬 허니도우 일러스트랑 넘나 똑같이 생김ㅋㅋㅋㅋㅋㅋㅋㅋㅋㅋㅋ 커여워요~ 이 귀여운 일러스트 도 주셔서 핸드폰 케이스에 붙혀놨어요 넘나 귀욥 우유크림도넛!!을 먼저 먹어봤어요 진짜~ 바닐라향이 느껴지는 고소한 밀크크림이에요 크림이 정말 부드럽고 달콤한데! 너무 심하게 달지않아서 물리지않더라구요 진짜 퐁신퐁신~ 도넛빵까지 맛있는 허니도우 우유크림도넛 진짜 너~무 부드럽고 달콤한 우유크림도넛 마포카페 허니도우의 우유크림도넛은 진짜 커피랑도 잘어울릴듯해요 우유크림도넛먹고 우유 마시기!!!!!!! 진짜 우유는 도넛이랑 국룰이에요 넘나 맛있는것>_< 남은 도넛들은 이렇게 예쁜 포장박스에 포장해주셨어요 허니도우 연희점은 포장박스도 너무 사랑스러움~ 박스마다 어떤 도넛인지 귀여운 손글씨로 정성껏 작성해주셔서 헷갈리지않아요~ 집에와서 ㅋㅋㅋㅋㅋㅋㅋㅋ밥먹고 도넛 야무지게 먹었답니다 진짜 너~무 맛있어서 다이어트는 실패...... 연희동에서 맛있는 도넛과 커피를 즐기고싶으시면 허니도우 연희점을 추천해요 오후4시부터는 분위기좋은 와인바로 변신하는 허니도우 연희점 데이트하기 넘나 좋은 카페 이자 와인바 랍니다 #허니도우 #마포카페 #마포와인바 #허니도우연희 #마포허니도우 #허니도우연희점 #홍대허니도우 #홍대도넛 #홍대크림도넛 #홍대와인바 #홍대카페 #연희동카페 #연희동허니도우 #연희동도넛 #연희동와인바 #연희동크림도넛 #마포디저트카페 #홍대디저트카페 #홍대데이트 #마포데이트 #홍대데이트코스 #마포데이트코스 #연희동데이트"
연희동 카페 무드 있는 허니도우,"낮에 파주에 갔다가 점심을 든든히 먹어서 간단히 먹을 곳을 찾다가 집에서 머지않은 곳인 연희동 카페 허니도우를 방문~~ 보통 식사를 6시에 하지만 집에 들렀다 가느라고 7시쯤에 도착했어요! 지도가 있지만 조금 찾기에 어려움이 있어서 지도 밑에 찾아가는 법 자세히 설명해 놓았어요^*^ 50m © NAVER Corp. 허니도우연희점 서울특별시 서대문구 연희로11가길 53 1층 홍대입구역 3번 출구에서 나와 반대 방향으로 가다가 왼쪽으로 올라간 다음 연희동 방향으로 직진하다가 동서한방병원 건너편으로 좌회전하여 올라가다가 첫 번째 우측 길로 들어가 조금 가면 우측 2층에 있어요 연희동 카페 허니도우 내부는 전체적으로 어두운 분위기인데요^^ 카페이지만 와인바 같은 느낌이 들었어요 플랜테리어 인테리어가 너무 감성적이고 예쁜데요~~ 커피와 음료 메뉴판이고요^^ 거의 다 차가운 거와 따듯한 거 두 가지가 있어요! 요즘은 밤에 날이 선선해 따듯한 게 좋지요^(^ 연희동 카페 윈도우에는 바로 귀엽게 생긴 캐릭터 도넛들이 있어요! 모두 14종의 도넛들이 있는데... 이제 도넛을 가까이 감상해 볼까요! 뒤에서부터 마스카폰 티라미수,레몬크림,라스베리 피스타치오,몬스터 브라운 이 중에서 몬스터 브라운은 두 눈이 박혀 있어 귀여운데 시그니처 메뉴에요 반드시 먹어야죠! 뒤에는 레몬크림과 티라미수가 솔드 아웃되었다고 표시되어 있어요 바로 위에 있는데... 그러고 보니 여기 윈도우에 있는 것은 샘플이네요^^^ 이걸 실제 도넛으로 착각하다니ㅜㅜ 이어서 보면 누텔라,더블 초코릿 푸딩,블루베리 요거트,푸루이티 페블즈 위에는 위의 토핑이 화려한데 비해 여기에는 평범한 도넛인데요~~ 그렇다고해서 가격이 저렴하지 않은 것을 보니 속이 알차다는 증거... 그래서 그런지 여기에 있는 것도 당기네요~~ 지금 눈에 띄는 것은 밀크 크림과 얼그레이 크리스피 크런치 바, 그린티, 솔티 카라멜,미숫가루 모두 14종인데 이 중에서 무엇을 먹을까 고민 중!!! 고민 끝에 선택한 것은 몬스터 브라운, 푸루티 페블즈,얼그레이,그린티,라스베리 피스타치오 음료는 허니자몽티와 우유로 했어요~~ 연희동 카페 전체적인 조명이 어두운 편인데 분위기를 위해서 그렇게 한 거 같아요 이렇게 테이블마다 귀여운 호롱 불이 놓여 있네요^^ 연희동 카페 허니도우 재생 0 좋아요 0 00:00 00:00  접기/펴기 브라운치즈/ 프루티페블즈/라즈베리/얼그레이/그린티/허니자몽/우유 오후 6시부터는 와인 서비스가 시작되고 합리적인 가격에 분위기 있는 데이트를 즐길 수 있어요~~ 음료로 나온 우유와 허니 자몽 티 허니 자몽 티는 꿀맛과 자몽의 고유의 맛이 조화가 입안에 은은히 퍼지네요^*^ 혼자 갔지만 먹고 나면 포장도 가능하니 걱정할 필요도 없고요^^ 사실 점심만 많이 안 먹어도 이 정도는 다 클리어가 가능하지요! 하나만 남기고 전부 다 먹었는데요! 귀엽게 생긴 것도 보기에 좋지만 다양한 크림의 맛과 함께 분위기 있는 곳에서 먹으니 더욱 좋네요~~~"
"[카페/서대문구] 연희동 낮에는 카페 저녁에는 와인바 도넛 맛집 ""허니도우""","안녕하세요 멀티플레이어입니다 :-)❣ 연희동 <<허니도우>> 영업시간: 매일 14:00~22:00 / 16시부터 와인 서비스 시작 가게 뒤편 주차 가능, 만차 시 연희맛로 공영주차장 이용 주소: 연희동 192-29 1층 50m © NAVER Corp. 허니도우연희점 서울특별시 서대문구 연희로11가길 53 1층 이마트24 바로 앞! 로얄싸롱 옆옆집에 있었던 허니도우! 점심 먹고 바로 갔었지만 오후 2시부터 영업하는지 몰랐던 우리는 다른 카페로 갔다...ㅠ.. 📌공식 인스타그램📌 허니도우 연희님이 Instagram을 사용 중입니다 • 허니도우 연희님 프로필의 게시물 16개 팔로워 274명, 팔로잉 0명, 게시물 16개 - 허니도우 연희(@honeydough_yeonhee)님의 Instagram 사진 및 동영상 보기 www.instagram.com 네이버에서 영업시간이 안 적혀있어서 몰랐는데,, 왜 인스타그램을 찾아볼 생각을 못 했는지,,, 흑흑 아쉽다 오픈 시간 전까지 다른 카페에 있다가 집에 가는 길에 포장하려고 들린 허니도우~! 외관 및 간판 햄버거 집 위에 위치하고 있었다 계단 타고 위로 총총 와인 왼쪽 정렬 와인바 답게 빈 와인병이 계단 왼쪽으로 정렬되어 있었다 도넛 메뉴 포장할 거라서 그냥 기본 도넛 중에서 골랐다 밀크 크림 도넛 눈 달려있는 몬스터 브라운이 시그니처 메뉴로 제일 핫하다고 하던데,,, 다음에 와서 꼭 먹어볼게요 음료 / 와인 메뉴판 다음에 와서 도넛이랑 음료랑 꼭 먹어볼게요 와인도 한번...도저언... 크림을 넣어야 된다고 하면서 5~10분 정도 기다리라고 하셨는데 기다리는 김에 카페 내부 찍기-☆ 내부 앉을 수 있는 좌석은 너무 많았고 전체적인 화이트 톤으로 내부가 깨끗해 보였고 넓어 보였다 화이트와 그린(식물)의 조합이란.............♥ 화장실 주문하는 곳 주문하는 곳입니다 너무 깔끔하쟌냐~!~!~! 좋아하는 사진들 내가 찍고 내가 좋아하는 사진 ㅎ자화자찬ㅋ 입구 출구 여기 옆에는 큰 거울이 있는데 사진을 엄청 찍었다죠?ㅋㅋㅋㅋㅋ 사진 찍을 거 다 찍고 얼마 안 있다가 도넛이 나왔다 Next image 포장 한 개씩 포장해 주실 줄 몰랐즤~! 크림 많은 거 봐,,,, 지져스👍 연희동 카페, 그리고 와인바 ""허니도우"" 개인적인 후기 ✔ 기본 도넛의 맛이 괜찮을 걸 보니까 시그니처 도넛들도 맛보러 와야겠다고 느꼈다 ✔ 적당히 달고 크림이 많다고 해서 느끼하지 않았다는 점에서 좋게 와닿았다 ✔ 크림 들어가 있는 도넛들은 직접 크림을 넣어야 돼서 5~10분 정도 기다려야 할 수도 있어요 (물론 시간은 개수에 따라서 달라지겠죠) ✔ 낮에는 한적하고 조용한데, 밤에는 어떤 분위기일지 궁금하다 ✔ 결론은 꼭 다시 와야겠다 ✔ 9.25 방문"
연희동디저트카페 허니도우 브라운도넛 꿀맛,"*1 [ 연희동 카페 : 허니도우 연희점 ] 주소 서울 서대문구 연희로11가길 53 1층 (지번) 서울 서대문구 연희동 192-29 1층 연락처 0507-1374-2967 위치 홍대입구역에서 자차로 4~5분 거리에 있습니다 연세대학교와 가까운 거리에 있습니다 연희동 카페거리 내에 위치합니다 특징 깔끔한 매장과 운치있는 분위기에서 데이트를 즐길 수 있다 차별화 된 음료와 디저트를 맛볼 수 있다 사장님과 직원분이 친절해서 기분 좋게 이용할 수 있다 50m © NAVER Corp. 허니도우연희점 서울특별시 서대문구 연희로11가길 53 1층 *2 오늘도 찾아주셔서 감사합니다 :) 저는 데미안의 리뷰찾기를 운영 중인 데미안입니다 만추가 깊어지면서 나들이 하기 좋아지고 있고, 분위기 좋은 카페를 찾아다니는 게 낙인 요즘입니다 서울에는 수 많은 카페거리가 있지만 오붓하게 담소를 나눌 곳을 찾는 다면, 저는 주저없이 연희동 카페거리라 답할 것입니다 *3 기분전환을 위해 연희동에 가서 맛있는 디저트도 맛보고 운치있는 시간을 만끽했습니다 내부가 어떨지 궁금한 곳이 많아서 어디를 갈지 고민하다가 찾아간 곳이 바로 연희동 카페 '허니도우 연희점' 입니다 홍대입구역에서 자차로 5분 거리에 있으며, 연세대학교에서 가좌역 방면으로 가는 길목에 위치합니다 *4 연희동 카페 '허니도우 연희점' 는 모던하면서 세련된 인테리어로 꾸며져 있었고, 내부도 청결하게 관리 되어 있었습니다 입장 시 온도체크와 방문자인증을 진행하며 손소독제도 비치 되어 있더군요 커피와 와인, 음료가 다양하게 갖춰져 있으며 눈길을 사로 잡는 디저트들이 진열 되어 있었습니다 *5 몬스터브라운 4천 5백원 블루베리 3천 6백원 후르츠 4천원 크런치 바 3천 8백원 바닐라 라떼 5천원 아이스 아메리카노 4천원 저와 동생은 각자 아이스 아메리카노와 아이스 바닐라 라떼를 마시기로 하였습니다 도넛은 각자 2개씩 맛보기로 하였는 데, 저는 시그니처 메뉴인 몬스터 브라운을 꼭 맛보고 싶더군요 그래서 블루베리맛과 함께 선택했으며, 동생은 후르츠 맛과 크런치 바를 주문하였습니다 *6 [ 바닐라 라떼 ] 먼저 바닐라 라떼부터 마셔봤습니다 부드러운 커피와 우유가 조화를 이뤘더군요 진하면서 부드러운 풍미를 느낄 수 있었고, 타 매장과 차별화 된 맛을 즐길 수 있었습니다 많이 달지 않아서 마시기 부담없었고, 도넛과 함께 먹기에도 딱이었습니다 허니도우 연희점 재생 0 좋아요 0 00:00 00:00  접기/펴기 허니도우 연희점 허니도우 연희점 재생 0 좋아요 0 00:00 00:00  접기/펴기 허니도우 연희점 허니도우 연희점 재생 0 좋아요 0 00:00 00:00  허니도우 연희점 *7 [ 아이스 아메리카노 ] 허니도우 연희점의 아이스 아메리카노는 맛과 향 모두 기분을 산뜻하게 해주더군요 산미가 없고 고소해서 괜찮았고, 부드러운 목넘김이 예술이었습니다 도넛이 달아서 함께 먹기에 좋더군요 커피양도 많아서 만족스러웠습니다 *8 [ 몬스터 브라운&블루베리 도넛 ] 연희동 카페 '허니도우 연희점' 의 시그니처 메뉴인 몬스터 브라운은 눈이 앙증맞게 달려 있어서 귀여움 그 자체입니다 달콤한 도넛과 짭잘한 브라운 치즈가 어우러져 단짠의 조화로움을 느낄 수 있더군요 블루베리 도넛은 상큼한 맛과 크림의 고소함이 더해져 고급스러운 맛을 선사하였습니다 허니도우 연희점 재생 0 좋아요 0 00:00 00:00  접기/펴기 허니도우 연희점 허니도우 연희점 재생 0 좋아요 0 00:00 00:00  허니도우 연희점 허니도우 연희점 재생 0 좋아요 0 00:00 00:00  허니도우 연희점 *9 [ 후르츠&크런치 바 도넛 ] 후르츠 도넛은 다채로운 과일 맛의 시리얼과 휘핑크림이 토핑으로 올라가 있는 도넛이었습니다 화려한 비주얼 만큼이나 맛도 색다르더군요 바삭바삭한 식감도 느낄 수 있고 맛있었습니다 크런치 바 도넛은 크런치 초콜릿의 진한 맛과 도넛이 더해져 달콤함 맛이 강한 도넛이었습니다 *10 단순하게 도넛 맛이 궁금해서 찾아갔는 데, 예상치 못한 보석을 발견한 기분이 들었습니다 매장 분위기도 좋고 디저트 퀄리티도 높아서 기분 좋은 시간을 만끽할 수 있었습니다 게다가 직원 분들도 친절하게 손님들을 대하고 있어서, 다음에 또 오고 싶은 마음이 절로 생겨났습니다 *11 매번 연희동을 올때마다 느끼는거지만, 매장마다 고유의 색채가 또렷합니다 연희동 카페 '허니도우 연희점' 도 매장 고유의 분위기와 음료 디저트 퀄리티가 만족스러웠습니다 다음에 또 데이트하러 방문할게요 후기를 끝까지 봐주셔서 감사합니다 허니도우연희점 서울특별시 서대문구 연희로11가길 53 1층 존재하지 않는 이미지입니다."
