title,content
[서울/카페] 연남동 치플레 선물용 디저트 추천 가격 및 내돈내산 존맛후기,"연남동 치플레 화 - 토 11:00 ~ 19:30 일 - 월 11:00 ~ 17:00 연중무휴, 재료소진시 마감 집으로 돌아가기 전 선물을 사가기 위해 들린 연희동 치플레 서울 올때마다 들러야지 했는데 늘 시간이 부족해 못 들렀다ㅠㅠ 그러다 마침 연희동에 머물러 있기도 했고 전화 해보니 아직 재고도 남아있다 해서 마지막 코스로 들리게 되었습니다~! 📍서울 마포구 동교로 262-9 1층 📞02-6949-1960 주차시 근처 공영주차장 이용/ 대중교통 이용 권장 치플레는 골목에 위치해 있어 자차보다 대중교통 이용이 더 편리합니다 우와한 느낌의 외관입니다~! 입구에 치즈케이크 샘플이 놓여져있어요ㅎㅅㅎ 치플레는 테이크아웃 전문점이에요. 매장이 협소해 대기 인원이 많을 시 두 팀씩 입장 도와드리고 있습니다 외관이 예뻐 사진찍으면서 기다리시면 될 거 같아요 포장 전문점인 만큼 고급스러운 포장박스가 한켠에 쌓아 있었으며 인테리어 효과를 줬습니다 치즈케이크를 더 맛있게 먹을 수 있도록 위에 부어먹는 크림도 같이 판매하고 있어요 진한 코코아 맛인 코코 샤워 향긋한 로얄 밀크티가 들어간 로얄샤워 달콤한 바닐라 우유크림 밀크 샤워 가 있으며 가격은 각 2,500원 입니다 매장내에선 취식이 안되지만 치즈케이크와 잘 어울리는 와인과 더치커피, 밀크티도 판매하고 있었어요 치즈케이크는 4종류가 있어요 좌측부터 순서대로 치플레, 브륄레, 쇼콜라, 피오레 입니다 ㅎㅅㅎ 피오레는 이번에 새로 나온 맛인지 new라는 펫말이 적혀있었어요 다른분들 블로그 찾아보니 시즌별로 맛이 바뀌는듯 해요 포장은 4구와 8구 두 종류가 있으며 모든맛을 원하시는대로 고르시면 됩니다 (중복선택 가능) 4구 : 16,000원 8구 : 29,000원 8개입 구매시 2가지맛을 선택해주시면 4개씩 반반으로 담아주세요 제가 간 날은 사람이 없어선지 4가지 맛을 반반 선택 가능했습니다. 초콜릿 수플레치즈케이크가 올라간 치플레아이스크림도 예쁘고 맛있어 보였습니다 ㅎㅅㅎ 가격은 7,000원 4개 혹은 8개입 구매하시면 영수증이벤트에 참여하실 수 있습니다~! 리뷰 작성 후 직원에게 보여주시면 치플레 1개를 받으실 수 있어요 포장에 진심인 연남동 치플레..! 리본포장과 종이쇼핑백, 장거리 시 오랜시간 보관할 수 있도록 보냉백도 추가할 수 있었습니다 저는 4구 2박스, 친구는 8구 한박스 구매했습니다~! 영수증 리뷰 참여해서 치플레도 하나 더 받았어요 잼민이가 찍어준 치플레 사진ㅋㅋㅋ 맛있어서 한번에 다 먹었다고 하네요 ㅎㅅㅎ 오리지널 치플레 단면이에요 바닐라빈을 가득넣어 육안으로도 콕콕박힌 모습좀 보세요! 부드러워서 입에 넣자마자 사르르 녹는걸 느낄 수 있었습니다. 네가지 종류 다 개성 있었지만 저는 오리지널이 가장 맛있었어요 ㅎ-ㅎ 보관은 냉장 시 3일, 냉동 시 일주일입니다 차갑게 해 먹으면 더 맛있으니 냉동보관 후 서걱거리는 식감을 느껴보세요ㅎㅎ 연남동 치플레 외에 부산, 동탄, 현대백화점 무역 센타점에도 치플레가 있다고 해요 선물용으로 아주 강추합니다~! 50m © NAVER Corp. 치플레 서울특별시 마포구 동교로 262-9 1층 #연희동 #치플레 #연희동치플레 #연희동치즈케이크 #연희동선물 #수플레치즈케이크 #치즈케이크맛집 #연남동선물추천"
< 치플레 > 홍대 디저트 • 연남동 케이크 테이크아웃 맛집,"치플레 서울 마포구 동교로 262-9 1층 070-8648-3103 꺅- 치즈케이크 먹고 싶어서 검색하다가 알게된 연남동 치플레! 얼마전 홈카페 포스팅으로 잠깐 언급한 적 있죠? 여기 테이크 아웃 전문점인데도 가게가 너무 예뻐서 안 올릴수가 있어야죠 ㅎㅎ 50m © NAVER Corp. 치플레 서울특별시 마포구 동교로 262-9 1층 위치는 홍대지만, 2호선 홍대입구역은 아니고 연트럴파크 근처 연남동이에요 홍대서 연희동 가는 길가에서 가게가 멀지않아 도로 공영주차장에 주차했는데 골목 거의 안들어가더라구요 깔끔한 신축건물 1층이고 입간판과 샘플 테이블도 나와있어서 쉽게 눈에 띄었어요. 인기좋아서 품절될까봐 일찍 고고 오픈한지는 오래되지 않았다는데 여기 오후되면 품절된다는 글이 많아 오전에 방문하니 다행히 구매가 가능했습니다. 저 사니깐 치플레랑 브륄레는 품절 ㅎㅎ (아슬아슬했다) 매장에 여쭤보니 다른 디저트 맛집들처럼 별도로 전화예약은 안된다고 하시더라구요. 총 4가지 맛의 치즈케이크 치케 전문점이고 총4종이 있어요! 치플레 브륄레 쇼콜레 딥포레 보시다시피 쇼콜레는 초코, 디폴레는 말차 치즈케이크이고 치플레가 기본이에요. 8개 세트 (26,-) 4개는 14,000원이고 온김에 넉넉하게 8개 쟁였어요. 더워서 음료도 하나 마셔야겠다했는데 예쁘고 친절한 사장님께서 밀크티를 추천해주셔서 아아 마실려다가 밀크티로 결정했어요. 보틀형태 밀크티입니다! 테이크아웃점이 이렇게 이쁘면 반칙아닌가요? 포장만 가능한 디저트집인데, 외부도 예뻤는데 내부 인테리어도 너무 예뻐요. 포장기다리면서 몇 컷 찍어봄 ㅎㅎ 뉴욕 어딘가 있는 케이크집 st. 군데군데 소품에도 신경을 많이 쓰신 느낌 쟁인것들 들고 집으로~ 디저트 언박싱 내가 샀지만 선물받는 느낌 ㅎㅎ 여기 로고랑 포장까지 예뻐서 선물용으로도 너무 좋을 듯. 우선 베스트랑 베이직을 먹어봐야 될 거 같아서 치플레랑 수플레로 시도해보았어요. 1케이크 1접시 모드로!!! 밀크티도 같이 준비했어요. 기본기에 충실한, 치플레 기본 치즈케이크인 치플레는 크림이랑 곁들여먹으면 좋다해서 크림도 같이 발랐어요. 덩어리 치즈케이크같은 느낌은 아니고 치즈 + 바닐라 조합인데 식감도 너무 꾸덕하지않아서 요즘같은 시기에 더 먹기 좋은 거 같아요. 같이 느껴지는 바닐라맛이 굉장히 고급스러워요, 검은 점들은 보니 바닐라빈 들어가서 그런거 다들 아시죵? 바닐라 들어가도 단 느낌은 아니에요 크림브륄레 느낌의 브륄레 윗면이 크림 브륄레같이 생긴 브륄레. 윗면 슈가코팅 때문에 치플레보단 약간은 달달한 편이에요 크림 브륄레처럼 윗면 탁탁 쳐봤어요 (머쓱머쓱) 밀크티도 딱 디저트에 맞는 농도. 디저트도 밀크티도 전반적인 밸런스가 좋고 세련된 느낌이라 만족스러웠어요. 전 꾸덕 치즈케이크보다 이런 부드러운 치케파 ♡ 치플레 덕에 행복했던 주말의 티타임 끄-읕 밀크티 시음기 포스팅은 별도의 포스팅으로 https://blog.naver.com/trade05/222807298534 < 홈카페 > 냉침 밀크티 티타임 & 연남동 맛집 치즈케이크 치즈케이크 그리고 밀크티 어제의 티타임. 일요일이지만 가야될 총회도 있었고 다녀와서보니 며칠동안 또 ... blog.naver.com"
더현대팝업 치즈케이크 치플레,"안녕하세요~! 더현대 지하 팝업스토어에 있는 치플레에서 치즈케익을 구매했습니다!!~ 50m © NAVER Corp. 치플레 더현대서울점 서울특별시 영등포구 여의대로 108 지하1층, 치플레 팝업스토어로 더현대 서울점에 있지만 원래위치는 50m © NAVER Corp. 치플레 서울특별시 마포구 동교로 262-9 1층 마포구 연희동이라고해요!! 원래 엄청 유명한 치즈케익집이라고 하네요 ㅎㅎ 평일 2시에 갔는데도 줄이 많이 길었습니다! ㅎㅎㅎ 팝업스토어 치플레! 패키징도 너무 고급스럽고 매장도 너무 예뻤어요~~! 치즈케이크 종류는 치플레, 브륄레 두가지가 준비되어 있었는데요, 치플레는 부드럽고 진한 크림치즈의 풍미와 바닐라빈이 어우러진 플레이버 라고 적혀있구요, 브륄레는 다들아시는것처럼 윗표면을 바삭하게 슈가코팅하여 달콤함을 더한 치즈케이크 입니다. 8개에 35,000원 , 4개에 19,000원이구요 낱개로사면 5,000원이였던것 같아요..... 골프공보다 살짝 큰정도인데,,, 저거하나에 5천원이라니,, 너무 사악하지않나요 ???? 브륄레가 먼저 솔드아웃됐어요,, 그것도 제앞에서요!!! 제앞에분이 갑자기 브륄레를 쓸어가시더라고요 ㅎㅎㅎㅎㅎ 제가 너무 당황하니 직원분이 30분있다가 브륄레가 새로나온다고해서 그때부터 또다시 30분을 기다렸습니다...하 제뒷분들도 모두 30분을 추가로 기다리시더라구요 ㅋㅋㅋㅋㅋㅋ 킹받아 기다린게 아까워서 8구짜리, 4구짜리 2박스를 구매했습니다!! 기본과, 브륄레 반반으로요~ 4구짜리는 동생한테 줬고 저흰 8구짜리를 먹었는데요! 가볍지만, 결코 가볍지 않습니다 라고 적혀있는 박스 ㅋㅋㅋ (치즈케익은 원래 다 묵직하고 무겁던데 ..) 하나하나 꺼내보았어요!ㅎㅎ 귀엽지 않나요 ? 정말 쪼그매요,, 몽쉘보다 작아용!!ㅎㅎㅎ 반을 갈라보니 포슬포슬한 텍스춰라 칼로 썰었을때 부스러기가 많이 나오더라구용 ㅎㅎㅎ 달달하고 묵직하고 포슬하고 식감은 너무 맛있었어요!! 개인적으로 기본보다 달콤한 브륄레가 더 맛있었어요~~! 줄이없으면 사볼만 하겠지만 ㅎㅎ 줄서서까지 살필요 없을것 같아용!ㅎㅎㅎㅎ 그치만 선물하기 너무좋을것 같은 치플레 ㅎㅎㅎ! 팝업끝나기전에 꼭가보세용 ㅎㅎ"
연남동 디저트카페 '치플레' 신상 출시 기념 재방문 후기,"치플레 매일 11:00-19:30 월요일 정기휴무 ☎ 070-8648-3103 ※ 재료 소진 시 조기마감 #연남동카페 #연남동디저트 #연남동디저트카페 3개월 전에 방문했었던 연남동 신상 디저트카페 #치플레 [연남동 디저트카페] 선물하기 좋은 수플레 치즈케이크 맛집 ‘치플레’ 치플레 #연남동신상카페 #연남동디저트 #연남동수플레 연남동에 새로 생긴 수플레 치즈케이크 맛집 #치플레... blog.naver.com 처음 먹어보는 수플레 치즈케이크 넘 맛있어서 다음에 또 가야지 생각 중이었다. 그런데 가을맞이 신상 맛이 나왔다구요? 그럼 당장 가서 먹어봐야지~! 연남동 대부분의 맛집이나 핫플은 연희동대우아파트 정류장에서 내려야 가기 편하다. 3개월 만에 재방문한 연남동 디저트 맛집 치플레 여전히 갬성 만땅인 아웃테리어 치플레는 테이크아웃 전문점이기 때문에, 포장 박스가 외부에 전시되어 있다. 포장 넘 고급스러워서 선물하기 딱 좋은 비주얼 매장이 협소하기 때문에 대기 발생 시 2팀씩 입장 가능 8개입(8ea) 26.0 라이트 로열 밀크티 7.0 밀크샤워 1.5 코코샤워 2.5 쇼콜레와 티오레로 8개입을 주문했고, 쇼콜레와 어울리는 밀크샤워와 티오레와 어울리는 코코샤워도 추가했다. 예전에 방문했을 때는 치플레/브륄레/쇼콜레/딥포레 4가지 맛이 있었지만 현재 가을 신상으로 티오레가 추가되었다. 티오레는 최고급 찻잎을 직접 우려낸 향긋한 얼그레이 플레이버로, 얼그레이 처돌이는 무조건 좋아할 맛! 치플레는 4개입과 8개입으로 포장이 가능하다. 4개입은 1가지 맛, 8개입은 2가지 맛을 선택할 수 있다. 음료는 아메리카노와 밀크티 두 가지가 끝! 저번에는 아이스 아메리카노 먹어봐서 이번에는 라이트 로열 밀크티를 먹어보기로 했다. 또한 치플레에 곁들여 먹을 수 있는 크림도 함께 판매하고 있다. 연남동 디저트 맛집 치플레는 테이크아웃 전문점이기 때문에, 미리 전화 예약 후 방문하면 좀 더 빠르게 픽업이 가능하겠죠? 고급스러움 그 잡채... 생일 때 홀케이크 선물 받으면 부담스러운데, 치플레는 포장도 넘 고급스럽고 낱개로 포장되어 있기 때문에 냉장 or 냉동 보관 후 하나씩 꺼내 먹기 넘 좋음! 포장 기다리면서 포토존에서 사진 한방 찍기 브륄레 플레이버는 상온에 2시간 이상 노출되거나 반나절 이상 오랜 시간 냉장 시 위의 바삭한 슈가코팅이 녹을 수 있어 구입 후 1시간 이내에 먹는 걸 추천! 장시간 이동해야 한다면 이점 꼭 유의해서 구매하세요! 리본 선물 포장 +1.0 보냉팩 +0.5 요즘 날씨라면 보냉팩은 필요 없겠지만, 무더운 여름에는 필수로 추가해야겠죠? 선물할 예정이라면 리본 선물 포장은 꼭 추가하세요! 넘 고급스럽고 이쁘니까요... 빠르게 포장 완료! 넘 고급스러운 패키지 확실히 리본이 있어야 더 고급스럽죠? 설탕 대신 알룰로스를 넣어 달콤함은 그대로, 칼로리는 가벼운 라이트 로열 밀크티 향이 진하고 맛은 묵직한데 적당히 달아서 넘 맛있었던 밀크티 3개월 전에 방문했을 때는 밀크샤워밖에 없었는데, 지금은 프리미엄 크림이 2가지 추가되었다. 프리미엄 크림 종류는 시즌마다 변경될 수 있음! 코코샤워와 마블샤워가 있었는데, 티오레에는 코코샤워가 더 잘 어울린다고 해서 코코샤워를 추가했다. 마블샤워는 기본 플레이버인 치플레에 잘 어울릴 듯! 사진 찍다 목말라서 마셔버린 밀크티 적당히 달아서 진짜 맛있다ㅠㅠ 치플레 보관방법 - 냉장 보관 시 최대 3일, 냉동 보관 시 최대 일주일 이내 - 브륄레 플레이버는 냉장 시 제품 위의 슈가코팅이 녹을 수 있어 바로 먹는 것을 추천 크기도 딱 혼자 먹기 좋은 사이즈라 냉장 or 냉동 보관하다가 하나씩 꺼내 먹기 넘 좋당 추천받은 대로 티오레랑 코코샤워 같이 먹었는데 향긋한 얼그레이 플레이버랑 초코초코한 코코샤워 넘 잘 어울림! 플레이버에 크림까지 같이 먹으면 두 배로 달아져서 밀크티보다는 아아가 더 잘 어울리니까 참고하세용 :) 4개는 친구 주려고 따로 구매한 4구 박스에 담아봤다. 친구가 넘 좋아해서 뿌듯 ^__^V 연남동 디저트 맛집 치플레 선물하기 좋은 디저트로 추천! 50m © NAVER Corp. 치플레 서울특별시 마포구 동교로 262-9 1층 #연남동카페 #연남동신상카페 #연남동신상디저트 #연남동디저트 #연남동디저트카페 #연남동디저트맛집 #연남동수플레 #연남동치즈케이크 #연남동디저트선물 #연남동치플레 #치플레 #연남동데이트"
연남동 디저트 맛집 핫플 인정 정말 맛있는 수플레 치즈케이크 치플레,"🍮 연남동 디저트 맛집 핫플 치 플 레 * 치플레 / 정보 연남동 디저트 맛집 치플레에 다녀왔어요 :) 치플레는 수플레 치즈케이크로 정말 부드럽고 맛있는 떠오르는 연남동 디저트 맛집 이랍니당 ! 워낙 치즈케이크가 맛있다고해서 기대반설렘반으로 달려갔는데 왠걸 ... ! 정말 너무 맛있어서 앉은자리에서 6개 순삭... ㅎㅎㅎ · 치 플 레 · 치플레 서울특별시 마포구 동교로 262-9 1층 ▷ 영업시간 : 매일 11시 ~ 19시 30분 * 화요일만 17시 마감 ▷ 테이크아웃만 가능 ▷ 주차는 주변 공영주차장 chefflé (치플레)(@cheffle_official) • Instagram 사진 및 동영상 팔로워 1,364명, 팔로잉 0명, 게시물 85개 - chefflé (치플레)(@cheffle_official)님의 Instagram 사진 및 동영상 보기 www.instagram.com * 치플레 5가지 플레이버 치플레의 치즈케이크는 5가지 플레이버로 얼그레이가 들어간 티오레는 신메뉴라고 해요 ! 치플레 : 부드럽고 진한 풍미와 바닐라빈의 조화 브륄레 : 슈가코팅으로 바삭한 식감 딥포레 : 일본 우지지방의 고급스러운 말차 티오레 : 최고급 잎을 직접 우려낸 향긋한 얼그레이 쇼콜레 : 쌉싸름한 프랑스 발로나 다크초콜렛 * 치플레 가격 원하는 플레이버 4개에 14.000원 2가지 플레이버 8개에 26.000원이고 라이트 밀크 로열티는 7.000원 아메리카노는 4.500원, 크림은 1.500원이랍니다 ! 크림은 케이크위에 올려먹으면 되는데 3가지 맛이 있어서 원하는 맛으로 선택하면 돼요 ! 바닐라우유 밀크샤워 / 초코맛 코코샤워 / 블루베리 요거트 마블 그리고 또 연남동 디저트카페 치플레의 밀크티는 설탕대신 알룰로스를 넣어 달콤함은 그대로, 칼로리는 낮은 밀크티라 좋더라구요 :) #연남동밀크티 #연남동밀크티맛집 원하는 케이크를 주문하면 이렇게 고급스럽고 이쁜 상자에 포장을 해주어서 선물할 때 정말 좋을듯해요 🎁 #연남동선물 #연남동생일선물 #연남동케이크 케이크 8개입 26.000원 밀크티 7.000원 밀크샤워 1.500원 코코샤워 2.500원 총 37.000원 * 티오레 / 브륄레 저는 티오레 플레이버 4ea와 브륄레 플레이버 4ea 하프앤하프를 픽했어요 ! 평소에 브륄레를 좋아하는데 치즈맛과 브륄레 맛이 함께 난다고 하니 궁금했고 티오레는 이번에 새로 나온 얼그레이 맛이라고해서 궁금하더라구요 ! 브륄레는 맨 위에 슈가코딩이 되어있어서 한창 유행했던 달고나 또는 탕후루 먹는 느낌 ! 그리고 은은한 치즈맛이 나서 질리지않고 계속 먹을 수 있는 맛이었어요 ㅎㅎ 예전에 치즈케이크 사놨다가 한조각 간신히 먹고 냉동고에 넣어뒀는데 연남동 디저트 맛집 치플레 케이크는 앉은자리에서 순삭할만큼 ㅎㅎㅎㅎ 정말 맛있고 질리지 않아요 ♥ 게다가 위에 슈가코팅이 되어있어서 오도독 씹는 재미까지 있어서 넘 좋더라구요 :) 너무 달지도 않고 너무 진하지도 않아 은은하게 살린 치즈맛과 브륄레의 맛이 정말 맛있어서 커피와 먹기 정말 좋은 디저트에요 ! 그리고 선물 포장 고급스럽고 이뻐서 생일선물이나 집들이 선물로도 퍼펙트 ♥ 티오레도 은은한 얼그레이향과 치즈향이 잘 어우러져서 밀크티를 좋아하는 저에게 정말 맛있고 만족스러운 맛이었어요 ♥ 단면은 치즈케이크의 꾸덕한 식감이 살아있는 모습 보이시죵 ㅎㅎㅎ 연남동 디저트 맛집 치플레는 기본에 충실하고 케이크 맛의 정점을 정말 제대로 알려주는곳이어서 100000%만족 * 치플레 밀크티 치플레의 밀크티도 은은한 얼그레이향에 달지 않아서 넘 좋더라구요 ! 디저트와 음료까지 먹으면 너무 달지않을까하는데 치플레의 밀크티는 알룰로스를 이용하여 칼로리 걱정도 줄이고 마음 편히 먹을 수 있어서 넘 좋아용 :) 그리고 바닐라우유크림맛의 밀크샤워와 코코아맛의 코코크림도 있는데 케이크 위에 부어먹으면 맛의 변화를 주어 다양한 맛으로 먹을 수 있다고 해요 ! 사실 크림 안부어도 정말 질리지않고 먹을 수 있어 넘넘 맛있어요 >.< 그래도 맛이 궁금해서 부어 먹어봤는데 완전 진하고 맛있어서 또 매력이 있더라구요 ㅠㅠ 이렇게 다 맛있으면 어쩌쥬 💛🤍🧡 치플레는 테이크아웃만 가능하고 주차는 연남동 공영주차장 이용하시면 가깝게 이동하실 수 있어요 ! 연남동 디저트 맛집 치플레 케이크는 차갑게 바로 먹는게 제일 베스트이고 냉장보관을 하면 3일이내, 냉동보관은 일주일이내 먹는게 가장 맛있다고 하니 참고하세용 ! 저는 너무 맛있어서 포장하자마자 앉은자리에서 6개 먹었 ... 돼단 🍮 치플레 재생 3 좋아요 1 00:00 00:18  접기/펴기 치플레 연남동 홍대 합정 상수 연희동에서 디저트맛집을 찾고계신다면 치플에 꼭 꼭 꼭 다녀와보세요 💌"
