title,content
"합정 해리포터 카페 ""943 킹스크로스 CAFE""","안녕하세요 좋은땅 출판사 에디터 현입니다👋 영화 해리포터에 나오는 🚂‘킹스크로스’역을 아시나요? 영화에서 킹스크로스 역은 호그와트로 갈 수 있는 기차역🚂이죠. 합정에도 호그와트로 향하는 ‘킹스크로스’ 역이 있다고 하여 달려가 보았습니다.🏃 (해리포터를 좋아하는 저는 이렇게 사심을 채웁니다...😍) 마법사의 세계로 어서 가볼까요? 943 킹스크로스CAFE 서울특별시 마포구 양화로16길 24 1층~4층 943 킹스크로스 CAFE ✔ 방문일 : 23.10.27 ✔ 주문한 음식 : BEST SET (2인) (드레곤 레그 플레이트 + 버터 맥주 + 히비 커터스) ✔ 주의 : 1인 1음료 주문 필수 (음료 미 주문 시 입장 제한) ‘943 킹스크로스 CAFE’는 영화 ‘해리포터🧙’ 를 모티브로 꾸며 둔 카페에요. 수많은 해리포터의 팬분들이 찾는 곳으로 유명하죠. (저처럼...) ‘해리포터’의 팬분들은 어떤 모습을 보게 될까요?👀 943은 무슨 뜻일까요? 영화 해리포터를 보시지 않으신 분들은 943이라는 숫자가 조금 생소하실 수 있으실 텐데요. 영화 해리포터에서, 킹스크로스 역 9와 3/4 승강장🚂에서 마법 세계로 갈 수 있는 문(이라고 쓰고 벽)이 있답니다. 카페의 943은 9와 3/4 승강장에서 따온 것이라 할 수 있겠네요. Entrance of a café 카페 입구 🏬건물 전체가 ‘943 킹스크로스 CAFE’로 되어 있답니다. 앞에 있는 안내 표지판을 같이 보실까요?👀 943 킹스크로스 CAFE는 이렇게 층별로 태마가 나누어져 있어요. 카페가 해리포터 배경인 것도 설레는데 이렇게 층마다 태마가 다르다니요!😆 입구 옆! 🧹빗자루 포토 존이 있어요. 빗자루 제작을 크게 해 두어, 성인들도 쉽게 올라갈 수 있도록 해 두었어요. 외관에서부터 해리포터 팬들에게 설렘을 선사하는 이곳! 같이 들어가 보실까요?🥰 Inside the café 1F : Magical Liquid Medine & Dessert & Food 카페 내부 (1층 : 마법 물약 & 디저트 & 음식 제조) 우선, 입구에 들어서면 수많은 마법 지팡이🧙들이 잔뜩 있어요. (원래는 지팡이를 판매했지만, 지금은 잠시 판매 중단이라고 해요😂) 영화에서 나오는 장면 그대로 진열이 되어 있다는 것이 정말 좋았어요. 판매 굿즈 (열쇠고리 가격 : 13,000원~15,000원) 장식용 굿즈 : 해그위드와 마법 지도 다양한 장식과 판매 굿즈🎁들이 놓여 있는 것을 볼 수 있었는데요. 장식품과 판매 굿즈를 보는 재미가 쏠쏠했답니다. (판매용 굿즈는 주기적으로 바뀐다고 해요. ) 둘러본 김에, 다른 층은 어떤지 가볼까요?👀 Inside the café 2F : Wizard Cafe 카페 내부 (2층 : 마법사 카페) 2층 마법사의 카페☕는 일반 카페처럼 테이블을 배치해 두었어요. 앤티크 한 장식들과 더불어 해리포터의 요소들로 꾸며 둔 것이 인상 깊었답니다. 해리포터에 나오는 움직이는 액자와 디멘터 장식 디멘터가 있다니! 😱 어서 다음 층으로 도망가 볼까요? 디멘터가 뭐죠? 디멘터는 해리포터에 나오는 괴물 중 하나에요. 상대가 가장 무서워하는 모습으로 변한 뒤, 인간의 영혼을 흡수해 가는 무시무시한 괴물이랍니다. 영화에서, 해리가 가장 두려워하던 괴물이기도 해요. Inside the café 3F - Banquet hall 카페 내부 (3층 : 연회장) 긴 테이블이 늘어져 있던 해리포터의 연회장을 기억하시나요? 호그와트의 마법 학생들이 식사🍽️를 하기도 하고, 학기가 끝날 때마다 기숙사 점수💯를 발표하는 장소인데요. 3층- 연회장은 호그와트의 연회장을 본 따 있답니다. 아무래도 자리가 넓다 보니 👩‍👩‍👧‍👧단체 손님👩‍👩‍👧‍👧들이 이용하기 좋아 보이더라고요. 이곳 역시 해리포터 특유의 앤티크 한 분위기🤎로 꾸며져 있어요. 영화 속 해리처럼 연회장에서의 식사🍽️하는 장면을 연출하고 싶다면, 3층에서 방문을 추천합니다. Inside the café 4F : Wizard Dormitory 카페 내부 (4층 : 기숙사) 호그와트의 학생들이 머무르던 기숙사🏫는 어떤 모습일까요? 4층 - 기숙사에서는 🦉호그와트 학생들의 기숙사로 꾸며져 있습니다. 4층의 좌석들은 이렇게 🛏️침대 모양으로 되어 있어요. 신발을 벗고 좌석으로 이용이 가능하답니다. 편하게 앉아서 카페 이용이 가능할 것 같네요. 943 킹스크로스 CAFE 즉석사진 (비용 : 5,000원) 4층의 또 하나의 매력! 📸즉석 사진 촬영이 가능하답니다. 모닥불 위의 포토존에서 943 킹스크로스 CAFE의 프레임으로 즉석사진을 찍을 수 있어요. 포토존에서 사진 촬영 시, 4층에 비치된 호그와트 교복을 입고 찍을 수도 있답니다. 943 킹스크로스 CAFE의 음료와 🍽️음식은 어떤지 보러 가 볼까요? 잠깐! 지하는요? 안내판에 있는 지하 층 ‘마법사의 오두막""이 소개에서 빠져있죠? ‘마법사의 오두막""은 지금 리모델링 중이라고 합니다. (지금은 출입이 제한되고 있어요😭) Café &Bakery Order 음식 주문 해리의 11번째 생일날 해리, 넌 마법사야🧙 라는 말과 함께 건네 받은 케이크🎂를 기억하시나요? 943 킹스크로스 CAFE에서, 해리의 케이크를 재현한 케이크를 구매할 수 있답니다. 해리의 생일 축하 케이크를 재현한 943 킹스크로스 CAFE 케이크 (가격 : 17,000원) 943 킹스크로스 CAFE에는 외국인 손님들이 많이 온다고 해요. (실제로 제가 방문한 날에도 많은 외국인분들이 오셨어요) 그런 이유로 메뉴판도 한국어와 영어가 같이 비치되어 있답니다. 음식의 이름들을 보면 정말 마법 세계🦉에 온 것 같은 느낌을 주는데요. 해리 일행이 즐겨 마시던 ‘버터 맥주🍺’ 마법 세계에서 볼 수 있을 것 같은 ‘🍖드레곤 레그(용 다리)’ 등의 재미있는 이름들이 있답니다. 저는 세트메뉴인 ‘Best set(2인)’을 시켜 보았어요. Best set(2인) : 드레곤 플레이트 1접시 + 버터 맥주 1잔 + 히비스커스 1잔 = 59,000원 Best set(2인)은 ‘드레곤 레그 플레이트’ 1접시와 음료 2잔을 제공해요. (음료는 자유롭게 선택 가능합니다.) 저는 해리포터에 나오는 ‘버터 맥주🍺’ 같이 간 일행은 ‘히비스커스’를 선택하였어요. 드레곤 플레이트 1접시 🍽️드레곤 레그 플레이트🍽️ 같은 경우, 저렇게 다양한 음식들을 한 번에 먹을 수 있어요. 나초, 파인애플, 호밀빵, 야채, 감자튀김 등과 각종 소스들이 놓여있었답니다. 그리고 뭐니 뭐니 해도... 이렇게 어마 무시한 다리 모양의 고기🍖가 같이 제공되고 있어요. 크기를 보니, 괜히 ‘드레곤 레그’라고 부르는 게 아닌 것 같네요. 🍖드레곤 레그 먹는 방법! 드레곤 레그 플레이트를 주문하게 되면, 포크와 나이프, 그리고 비닐장갑을 제공받는답니다. 저도 처음에는 열심히 칼로 썰다가... 비닐장갑을 끼고 뜯으니까 훨씬 먹기 편하더라고요. 결론 : 드래곤 레그는 칼보다는 손으로 쭉쭉! 같이 주문한 ‘버터 맥주’와 ‘히비스커스’ 도 살펴볼까요? 버터맥주 10,000원 (단품 구매 시) 🍺버터 맥주는 쌉싸름한 흑맥주 위에 부드러운 크림이 올라가 있었는데요. 부드러운 맛과 쌉싸름한 맛이 한 번에 느껴져 신기했답니다. 히비스커스 : 10,000원 (단품 구매 시) 히비스커스 위의 나무 막대는 티백을 묶어 두는 용도입니다. (원래는 컵 위에 올려져 있어야 하는데, 저 사진에서는 차 안으로 퐁당...🤣) 해리포터 팬인 저는 카페 구경하랴, 음식 먹으라 신나기도 하면서 사심도 가득 채운🥰 943 킹스크로스 CAFE였는데요. 그래서, 943 킹스크로스 CAFE은 어떠냐고요? 현 에디터의 한 줄 감상! ‘943 킹스크로스 CAFE는 언제 가야 좋을까요?’ ‘Always’ 저처럼 해리포터의 팬이시라면? 이번 주말 943 킹스크로스 CAFE 카페 어떠세요? 오늘, 🧡‘943 킹스크로스 CAFE’🧡 어때요? 홍대 이색데이트 마법 테마카페(@943kingscross) • Instagram 사진 및 동영상 팔로워 1,868명, 팔로잉 33명, 게시물 178개 - 홍대 이색데이트 마법 테마카페(@943kingscross)님의 Instagram 사진 및 동영상 보기 www.instagram.com ▼합정의 또 다른 카페를 가보고 싶다면? ▼ 분위기 좋은 카페 추천 ‘오버트 합정’ 안녕하세요 좋은땅 출판사 에디터 현 입니다. 🎉오늘부터, 좋은땅 출판사 블로그의 신생 코너, ‘오늘 여... blog.naver.com 합정 사진 맛집 카페 ‘해피베어데이’ 👋안녕하세요?👋 좋은땅 출판사 에디터 현입니다. 오랜만에 [오늘 여기 어때?]🥰로 인사드려요. 사실... blog.naver.com"
홍대 943 킹스크로스 CAFE - 유니버셜스튜디오 안 가도 버터 맥주 가능!,"홍대역 근처 해리포터 느낌의 카페를 다녀왔습니다. 디즈니랜드에 있는 해리포터 긋즈샵 같은 느낌이었는데요. 오픈 시간에 맞춰 갔는데 사람이 진. 짜 많았고, 외국인도 진~짜 많은 홍대 핫 플 943 킹스크로스 카페입니다. 카페 명부터 심상치 않죠? 해리 포터에서 나왔던 킹스크로스역 9와 3/4승강장을 뜻해요! 건물 밖에는 마법 빗자루와 사진 찍을 수 있는데요. 제가 간 날은 비가 온 날이라 기념사진은 못 찍었어요 ㅠㅠ 여러 프로그램에도 나오고 간단한 안내 문구도 해리 포터가 생각나요! (컨셉.. 미쳤다!) 홍대 이색 카페 '943킹스크로스' 1층 들어오자마자 입구엔 마법 지팡이 상자들이 가슴을 떨리게 하더라고요. 꺅 진짜 소리 지를 뻔 ㅜㅠㅠ 943 킹스크로스CAFE 서울특별시 마포구 양화로16길 24 1층~4층 별도 설명은 하지 않겠습니다. 감동 그 자체였어요! 저작권 때문에 100% 똑같진 않았어요. 그래도 이 정도면 매우 매우 만족합니다! 홍대 이색 카페 '943킹스크로스' 메뉴판 외국인이 많아서 영어 메뉴판도 있었고 버터 맥주가 있었어요!!!! 오~~마이갓~~~ 음료 말고도 음식 메뉴가 있었는데 커다란 칠면조 다리가 있는 메뉴도 있고 해리 생일 케이크, 디저트 케이크도 있어요. 버터 맥주(9,500원)랑 943 포션(10,000원) 하나씩 주문했어요. 그런데, 맥주보다 포션이 비싸서 놀랐지만 맛도 맥주가 더 맛있어서 또 놀랐지 모야^^ 어떤 분이 시킨 건데 눈 호강했어요! 위자드 모자 초코가 너무나 커엽! 홍대 이색데이트 마법 테마카페(@943kingscross) • Instagram 사진 및 동영상 팔로워 1,575명, 팔로잉 50명, 게시물 167개 - 홍대 이색데이트 마법 테마카페(@943kingscross)님의 Instagram 사진 및 동영상 보기 www.instagram.com @943kingscross 943 킹 크로스/ 943KING'S CROSS는 1인 1음료 주문이 필수예요. 그리고 꼭 음료를 주문하고 입장하시기 바랍니다. 주말에 가면 대기가 길어요. 매장을 구경하느라 순차적으로 들어간다거나 인원 제한을 두는 건 아니지만 원활하게 흘러가도록 간격을 두시는 거 같아요. 홍대 이색 카페 '943King's Cross Wizard Cafe' 매장 안내도 943 킹스크로스 카페는 지하부터 4층까지 영업해요. 5~6층은 직원 공간이 머글 출입 금지예요. 층별로 컨셉이 달라요. 지하층은 마법사의 오두막 1층은 마법 물양/디저트&음식 제조 2층은 마법사 카페 3층은 연회장 4층은 기숙사 입니다. 943 킹스크로스 카페는 월~목 11시 30분 ~ 새벽 2시 30분 금~일 9시 30분 ~ 새벽 2시 30분 주말엔 일찍 문 열어요. 대신 음식 준비가 늦게 돼서 못 먹을 수 있어요. 엘리베이터가 있어서 돌아다닐만해요. 안 힘들어요! 메뉴 주문하고 위층으로 넘어가는 길에 큰 거울이 있어서 사진을 찍었어요! 홍대 943 킹스크로스 CAFE 2층 마법사 카페 943 킹스크로스 카페 - 움직이는 사진 재생 20 좋아요 0 00:00 00:27  접기/펴기 943 킹스크로스 카페 - 움직이는 사진 2층 마법사 카페는 움직이는 사진과 벽난로, 1층이 보이는 자리까지 한공간인데 다양하게 꾸며져 있었어요. 공간이 조금 좁은 편! 홍대 943 킹스크로스 CAFE 3층 연회장 우리가 아는 그 연회장이에요. 천장엔 촛불이 없지만 긴 테이블이 연회장 느낌이 제현 되었고 촛농이 녹아있는 촛대도 한몫했어요. 드디어 나온 버터 맥주 9,500원 943 포션 10,000원 버터 맥주는 흑맥주에 달콤한 크림이 올라가있었고 포션은 얼음컵과 같이 나와요. 버터 맥주는 짭짜름한 크림? 때문인지 고소한 흑맥주와 잘 어울렸어요. (찐 버터 맥주를 안 먹어봐서 어떤지는 모르겠어요.) 943 포션은 블루레몬에이드예요. 병에 붙어있는 스티커 때문인지 1만 원! (음.. 만 원 주고 먹을 맛은 아니었음) 홍대 이색 카페 '943King's Cross Wizard Cafe' 4층 기숙사 기념촬영이 가능한 4층 기숙사층입니다. 포토존도 있고 해리포터 가운과 모자 등이 있어서 컨셉사진 찍기 좋았어요. 헤헷 그리핀도르!!! 홍대 943 킹스크로스 CAFE 지하층 마법사의 오두막 오두막 가는 길이라서 입구부터 심상치 않았어요! 오두막 느낌이라 가구도 느낌 있게 되어있었어요. 거울이 있길래 사진도 한번 찍어보고 ^^ 출입 금지구역도 있어요 마법에 걸린 인간이 늑대로 변해 위험해요. 눈으로만 감상하기! 디멘터 영상이 있어서 해리포터 에피소드가 생각이 났어요. 디멘터 크흐흐 가기 전에 추가로 주문한 음료! 위자드 쇼콜라 11,800원 위자드 버터 11,800원 친구가 늦게 와서 점심 이후 4시쯤에 한 번 더 들렸는데요. 버터 맥주는 품절됐었고 줄은 엄청 길었어요! 위자드 쇼콜라는 모자 초코랑 초코 쉐이크라서 달달하게 맛있었어요. 위자드 버터는 달달한 라테+칵테일 느낌이었습니다. 홍대 943 킹스크로스 CAFE 사진이 워낙 많아서 정리하기 힘들었던 역대급 카페였는데요. 층별로 다른컨셉의 카페였고 해리포터 덕후라서 디즈니랜드 말고도 국내에서 그 느낌을 낼 수 있는 곳이 있다는 점이 행복했습니다. (실제로 디즈니랜드 안 가 봄^^;;;;) 그리고 엘리베이터 있는거 너무 좋았어요. 화장실도 깔끔하고 방문객 수에 비해 잘 정리된 느낌이에요. 그리고 음식도 엄청났어요. 사진 그대로였고 옆에서 주문하신 분들 거 보니깐 양이 상당합니다. 여자 3명이서 플레이트 하나 정도 먹는 걸 추천드려요!"
"서울 홍대 943 킹스크로스 CAFE l 홍대에서 할만한 것, 홍대 테마 카페 추천, 포토박스에서 네컷사진","이 카페를 방문하기 위해 홍대에 왔다 해도 과언이 아닌데요, 대학로로 연극을 보러 가기 전 시간이 남아 방문하게 되었어요. 홍대에서 할만한 것, 테마 카페를 찾아보던 중 이곳을 발견하였고, 방문해 보고 싶더라고요. 어렸을 때 해리포터에 빠져 헤어 나오지 못한 경험이 있죠 .. 마법 학교를 테마로 한 '943 킹스크로스 CAFE' 다녀왔습니다 - 943 킹스크로스 CAFE 영업시간 월-목 11:30 - 21:00 , 금-일 10:00 - 21:30 홍대 거리를 따라 내려오니 멀게 느껴지진 않았어요. 다만 마법이라는 말 때문에 괜히 숨겨져있을 줄 알았는데 그건 아니더라고요 ㅋㅋ 제법 커 보이는 건물에 설레는 마음으로 들어가 볼게요 - 느낌 있던 왼쪽의 문 앞에서 사진을 찍고 들어가려는데 문이 안 열리는 거예요 .. 잘못 찾아온 줄 알고 영업시간을 확인해 보았는데 출입문은 오른쪽이었답니다 ^^.. 너무 신났었나 봐요 .. 들어가자마자 계단이 보여서 2층으로 이어진 줄 알았는데요, 해리포터 올리밴더 상점을 떠올릴 수 있게 재현해둔 모습이었어요. 오른쪽으로 돌아보니 메뉴판이 영어로 돼있더라고요? 읽어보고 주문할 메뉴를 골랐는데 카운터에 가보니 한국어 메뉴판이 있었어요. 외국인분들도 많이 오시더라고요 ~ 음료 가격이 다소 비싸다 느껴질 수 있겠지만 입장료가 포함된 가격으로 1인 1음료 주문해 주셔야 하고, 그 후 지하 1층부터 4층까지 테마별로 꾸며진 전층을 이용할 수 있답니다 ! 943 킹스크로스 카페에서는 커피와 음료뿐 아니라 음식에 간단한 맥주, 칵테일도 맛볼 수 있는 곳인데요, 위자드 케이크가 눈에 띄었어요. 해그리드가 해리 포터의 생일에 준 케이크죠. 그뿐 아니라 윙가르디움 레비오우사 - 가 생각나는 지팡이도 볼 수 있었는데, 아무래도 해리포터의 저작권 때문에 대놓고 해리포터라는 티는 내지 않고 마법학교를 테마로 삼고 있는 듯해요. 음료가 나올 동안 지하 1층을 내려가 볼게요. 1층만큼 해리포터의 느낌은 없지만 전체적으로 인테리어가 세심하게 꾸며져있고 포토존도 많았어요. 지하 1층은 '마법사의 오두막'이라는 컨셉이였는데요, 저 호박 허수아비 때문인지 할로윈느낌도 살짝 나더라고요. 1층에서 감탄해서 그런지 조금은 아쉬운 느낌도 있었어요 - 음료를 받아 올라가 볼게요. 엘리베이터 옆에는 지하 1층부터 4층까지의 컨셉이 적혀있습니다. 2층은 '마법사 카페'로 1층을 내려다볼 수 있고, 앉아서 즐길 수 있는 카페니 pass 해줄게요 ~ 3층은 '연회장' 컨셉으로 작았지만 호그와트의 연회장을 연상케하는 나무의자가 있었어요. 가짜화로와 흔들의자를 꾸며두셔서 색다른 컨셉으로 사진 찍을 수 있었답니다 ! 4층은 '기숙사'를 표현했어요. 침대를 배열해 좌식을 만들어두었고, 유니폼을 입어볼 수 있는 공간도 있었답니다. 유니폼은 해당 층에서만 착용이 가능하고, 다른 손님분들을 위해 가급적 3분 이내로 촬영하길 권장한다고 적혀있어요 ! 이렇게 포토박스도 마련돼 있었는데요, 표지가 이쁘거나 해리포터가 그려져있던 건 아니지만 카페에 방문한 추억을 남기기 위해 저희도 찍어봤답니다 ~ 그리핀도르 , 후플푸프 , 래번클로 , 슬리데린의 유니폼 중 원하는 의상을 입고 목도리도 챙겨줬어요 ~ 살짝 이런 느낌이었는데 - 방학 때 집으로 돌아가지 못하고 기숙사에서 보내는 듯한 느낌이랄까요 ㅋㅋ 유니버셜스튜디오가서 지팡이도 못 사 오고 의상 하나 못 사 온 게 후회되었는데, 이렇게 대리만족을 해버립니다 .. 아 참, 주문한 음료는 헤이즐넛 라떼와 위자드 버터였어요. 둘 다 너무 달아서 음료는 거의 먹지 않은 채 구경하기 바빴답니다 :( 그래도 여유롭게 한 시간 정도 보냈던 이색 테마 카페였어요 - 생긴지 오래됐는데 왜 이제서야 와봤는지 ~ 마법학교의 느낌은 조금이나마 느껴볼 수 있는 카페 '943 킹스크로스'였습니다! 잘 놀고 갑니다 ◡̈ 50m © NAVER Corp. 943 킹스크로스CAFE 서울특별시 마포구 양화로16길 24 B1층~4"
