title,content
"연희동카페 [보연희] 제철과일 디저트카페 원탑! (무화과 파르페, 무화과피스타치오다쿠아즈)","보연희 주소: 서울시 서대문구 연희맛로 17-63 2층 영업시간: 12:00 -22:00 (매주수요일정기휴무) * 10월12일 ~ 10월27일까지 카페휴무 * 보연희 서울특별시 서대문구 연희맛로 17-63 2층 보연희는 디저트가 너무 맛있는곳인데 무화과 디저트가 맛있다기에 아침일찍 일어나 달려온 보연희 ! 처음 와보는데 너무 설렌다 매장은 테이블이 굉장히 많고 테라스 자리도 2테이블이나 마련되어있었다 협소하지않아 웨이팅 걱정은 안해도 될듯했다 메뉴판 음료는 커피 티 에이드등 종류가 다양하다 쇼케이스에 디저트가 진열되어있어 뭘 먹을지 쉽게 고를수 있다 ! 다 먹어보고싶은데 왜 내 배는 하날까..^^ 가을 무화과파르페 무화과 피스타치오 다쿠아즈 이거 먹으려고 아침부터 달려왔지! 비주얼 완전 미쳤다 !!!! 무화과가 얼마나 들어간거야 !!! 무화과 파르페를 주문하면 사장님이 토치를 같이 들고 오시는데 푸딩위에 설탕을 토치로 녹여주신다! 다들 미리 카메라 켜놓고 기다리기 ! 가을 무화과파르페 (15800원) 무화과, 크림브륄레 호지차푸딩 피스타치오 아이스크림, 그래놀라가 들어있다 호지차 푸딩은 처음인데 호지차푸딩 쓰지않고 맛있었다 호지차 푸딩을 다먹고 나면 피스타치오아이스크림이 반겨주는데 맨 아래 깔려있는 그래놀라와 같이 먹으면 정말 맛있다 가격만 봤을때 저렴하게 느껴지진 않았지만 무화과양과 먹다보면 가격이 인정되는 메뉴다 무화과 피스타치오 다쿠아즈 (9300원) 피스타치오 크림이 덕지덕지 발린 케이크다! 무화과가 통으로 들어가있어서 한입먹자마자 배부른느낌이 들었다 피스타치오때문에 꼬숩고 무화과랑 잘어울리고 맛있었다! 디저트 맛집답게 다 맛있었고 이거 외에도 다양한 케이크가 있었는데 너무 맛있어보였는데 더 못먹어서 아쉬운,, 그리고 요즘 무화과 공급이 어려워서 10월 12일부터 27일까지 카페를 잠시 쉬어간다고 하셨는데 무화과 디저트를 좋아하신다면 꼭 다녀오시길 추천드립니당 #연희동카페 #연남동카페 #홍대카페 #연희동신상카페 #연희동디저트카페 #디저트카페 #서울카페 #연희동조용한카페 #무화과디저트"
[일상|신촌 맛집] 연희동 보연희/이석덕생면파스타,"안녕하세요! 오늘은!! 저번주 화요일에 했던 #신촌 나들이를 기록해 보려고 합니다 ㅎㅎ (사실 신촌에 가서 별거 안했어요... 계속 미루다가 일주일이나 늦게 올립니다...하하하) 범계에서 친구들을 만나고 지하철과 버스를 타고 서울로 슝슝 갔답니다! 날씨가 흐려서 너무 추웠어요ㅜㅜ 진짜 날씨 너무 아쉬워ㅜㅜ 연희동 보연희 서울특별시 서대문구 연희맛로 17-63 2층 보연희 서울특별시 서대문구 연희맛로 17-63 2층 카페 입구 입니다! #보연희 는 #연희동 에 있는 #디저트 #카페 랍니다. 카페 입구에 조명과 식물을 이용한 인테리어가 너무 예쁘게 되어 있어요. 카페는 2층에 있고 밑에 층에는 식당?이 있었던 것같아요. 카페 인테리어도 너무 예쁘지 않아요??? 완전 감성 가득가득한 카페입니다! 제가 갔을 때는 케이크 종류가 많지 않았는데 다른 블로그 리뷰 보니까 케이크 종류가 다양한 것 같더라구요 (동생이랑 다시 가기로 했는데 그 때는 많은 케이크를 볼 수 있었으면....) 메뉴판은 깜빡하고 못 찍었어요...ㅜㅜ 친구들이랑 제가 먹었던 메뉴는 #초코딸기생크림케이크, #딸기파르페, #딸기라떼, #아메리카노, #카페라떼 입니다!! 여기 #딸기케이크 진짜 최고에요 제가 먹었던 딸기 케이크들 중에서 딸기가 이렇게 많이 들어간 건 처음 먹어 봤어요 ㅎㅎ #초코케이크인데도 너무 달지 않고 적당히 달아서 좋았어요!! 딸기 파르페는 딸기가 정말 가득가득 담겨있답니다!! 밑부분에는 생크림과 딸기청이 함께 있어서 마지막까지 딸기를 계속 먹게 된답니다! 완전 최고~~!!! 다음으로는 버스타고 정말 신촌으로 넘어갔답니다~ 신촌에서 길가리 구경하고 갈 곳 없어서 산책을 하게 되었었는데 가게가 너무 예뻤어요 옷이랑 각종 액세서리를 판매하는 곳이었는데 분위기랑 인테리어가 대박이에요 벽에 악세사리가 엄청 많이 걸어져 있어요 너무너무 사고 싶었는데 액세서리 알러지가 있어서 못 샀어요ㅜㅜ 정말 아쉬웠어요ㅠㅠ 계속 돌아 다니다 밥을 먹으러 갔답니다 뭐 먹을까 엄청 고민하다가 결국은 파스타로 결정을 하고 바로 파스타 먹으러 갔지요 이석덕생면파스타 서울 서대문구 명물길 16 2층 이석덕생면파스타 신촌점 이석덕생면파스타 서울특별시 서대문구 명물길 16 2층 이석덕생면파스타 신촌점 #신촌맛집 에 대해 검색해 보다가 #가성비 좋은 곳이라고 나와서 가보게 되었어요~!! 식당은 2층에 위치하고 있습니다! 계단으로 올라가면 바로 오른쪽에 입구가 나와요 출입구 벽에는 빨간색으로 색칠한 벽에 액자와 장식이 걸려 있답니다. 식당 내부는 전체적으로 빨간색과 금색을 사용해서 인테리어가 되어 있었어요. 그리고 음식 주문은 키오스크에서 테이블 번호를 선택한 후 바로 결제하는 형식이에요. 저희는 #세트메뉴 를 시켜 먹었어요 세트 메뉴를 시키면 사진 맨 위에 있는 #로레인샐러드와 #감자베이컨부르스케타 를 서비스로 받을 수 있답니다. 가격도 엄청 저렴했어요! 그러나...음식이 제 취향은 아니었어요 ㅎㅎ (제가 한식을 너무 좋아해서 그런가봐요) 파스타 면은 #생면 이라 바로 먹지 않으면 빨리 불어버려요...ㅎ (저희가 정신없이 사진 찍다가 늦게 먹었더니 불기 시작했더라구요) 그리고 다른 블로그 리뷰들은 #스테이크 맛있다고 괜찮다고 했는데 제가 갔던 날은 컨디션이 안좋으셨나봐요 스테이크를 먹는데 고기가 조금 질겼어요ㅠㅠ 이 점이 너무 아쉬워유ㅠㅠ 피자는 치즈가 엄청 많아서 치즈러버인 저에게는 엄청나게 좋았답니당👍 👍 위에 올라간 #살라미햄 도 맛있어용 동그란 튀김은 이름이 기억 안나요....ㅎㅎ 아무튼 주먹밥(?) 안에 치즈를 넣고 튀겨서 소스를 올린 음식이었어요 생각하시는 그 맛입니다..... 밥 안에 치즈 넣고 튀긴 맛입니다 저렇게 많은 음식들 중 저는 #살라미햄치즈피자 가 제일 맛있었어용 (자세한 음식 이름은 기억이 안나네요...) 가성비 식당으로는 추천을 해드립니다! 밥을 다 먹은 후 집으로 바로 왔어요 너무 힘들었거든요 하하하 뭐 어찌저찌해서 잘 놀고 집에 무사히 왔습니다 계속해서 미뤘던 글도 드디어 올립니다! 앞으로는 열심히 써보겠습니다~! 그럼 안뇽"
"Welcome To Summer(벌써?) - 고구마 치즈, 연희동 보연희","날씨가 또 왜 이렇게 더운 건지 모르겠네요ㅠ 봄은 잠깐 스치고 여름이 바로 저를 맞이해줄 것만 같습니다ㅎㅎ하 저 아직 여름 옷도 안 꺼내서 그냥 있는 옷 입었다가 더워 죽는 줄 알았습니다ヽ(；▽；)ノ <3월 31일 아침> 오랜만에 계두두 사진을 가지고 와봤습니다 살핵빼기 식단 아직 잊지 않았습니당ㅎㅎ 풀무원 한끼 연두부가 드레싱을 달리하여 판매되고 있더라고요 저는 참깨 흑임자소스가 오리엔탈 유자 드레싱보다 더 어울리는 거 같아요! 유자 드레싱은 너무 상큼한 느낌... <점심> 드디어 다이어트 식단 다운 식단 등장! 점심은 샐러디에서 로스트닭다리살 샐러드를 샀습니다 닭가슴살만 먹다가 닭다리살 먹으니까 너무 맛있는 거 있죠ㅋㅋㅋㅋㅋ 이 샐러드에는 기본 드레싱으로 크리미 할라피뇨가 나옵니다. 아니 근데 칼로리를 찾아보니까 한 통이 235 칼로리!!!!! 샐러드 먹을 때 드레싱 적게 또는 먹지 말라고 들었는데 이유가 있었네요ㅠ <저녁> 유튜브에서 시도해 보고픈 다이어트 식단을 발견해서 벼르고 벼르다가 드디어 해먹었습니다 고구마 위에 그냥 치즈 올려먹는 거라 간단합니다! 간단하지만 고구마 피자 먹는 기분👍👍 스트링 치즈 3개 정도 올렸는데 2개만 올려도 충분할 거 같았습니다 치즈와 고구마 사이에 토마토소스까지 뿌리면 물리지 않고 더 맛있게 드실 수 있을 거 같네요!! 추천입니당 고구마 피자 땡기는 날 또 해먹어야겠어요 <4월 1일 아침> 뭐 했다고 벌써 4월이 되었을까요!! 시간 너무 빠르네요ㅠ 오늘 아침은 닭가슴살에 흑미밥 같이 먹었습니다☺️ 점심에 맛난 거 먹어야 하거든요~~ <❤️점심❤️> 오늘 점심으로는 연희동에 있는 보연희에 갔습니다🥰 보연희 서울특별시 서대문구 연희맛로 17-63 2층 12시 오픈보다 살짝 일찍 방문했더니 아직은 쇼케이스가 채워져 있지 않았습니다 다 맛있어 보여서 고르기 어렵더라고요 고민 끝에 결국 딸기 피스타치오 다쿠아즈랑 딸기 파르페 주문하고 자리를 잡았습니다! 여기는 1인 1음료 주문을 해야 하는데요 파르페는 음료로 인정해 주시기 때문에 아메리카노를 하나 더 시켰습니다! 날씨가 따뜻해서 테라스석도 열려 있었습니다~ 잠시 기다리니 메뉴가 나왔는데 비주얼 대박입니당ㅎㅎ 이곳은 일단 맛없는 게 없는 것 같습니다 이번이 4번째 방문인데요 케이크를 다 다른 걸 시켰었지만 모두 맛있었습니다( ´∀｀ )b 파르페랑 다쿠아즈도 다 먹고 나니 다른 것도 먹고 싶어서 후보에 있었던 뽀또 황치즈 크럼블도 주문했습니다((o(^∇^)o)) 딱 치즈케이크에 짭짤한 황치즈맛이 추가된 맛입니다! 크럼블의 식감이 도드라지진 않았지만 어쨌든 맛있습니다~~ 케이크뿐만 아니라 음료도 맛집인 거 같네요 아메리카노는 그냥 1인 1음료를 시켜야 하니까 한 건데 맛있어서 (산미보다는 고소한 쪽) 기분 좋았습니다😊 예전에 밀크티도 시켜봤었는데, 먹어본 밀크티 중에서 손꼽는 정도라서 진짜진짜 추천드려요! 메뉴에 대한 설명이나 당일 진열 메뉴 등에 대한 건 인스타에 올려주시는데요! 궁금하신 분들은 확인해 보시는 것도 좋을 거 같네요 보연희(@beau_yeonhee) • Instagram 사진 및 동영상 팔로워 18K명, 팔로잉 185명, 게시물 2,814개 - 보연희(@beau_yeonhee)님의 Instagram 사진 및 동영상 보기 instagram.com 카페에서 나와 연희동을 돌아다니다 국화빵이랑 아이스크림 발견해서 바로 또 사먹었습니다...호호호 엄마 식탁이라는 가게 옆에서 팔고 있더라고요 현금과 계좌이체가 지불 가능 방식인 듯했습니다! 오늘 또 만우절이라고 크럼블 국화맛? 아이스크림을 천원 할인하더라고요👍 위에 꽃이 올려져 있습니다ㅋㅋㅋ (먹어봤는데 그냥 풀맛입니다) 아이스크림은 컵이랑 모나카 중 하나 골라서 담을 수 있습니다 저는 나눠먹어야 해서 컵으로 골랐어용 우유맛도 아니고 바닐라맛도 아닌 것이 뭔가 오묘한 맛이 났습니다...질감은 가볍게 사르르 녹는 쪽입니다(젤라또 같은 꾸덕한 질감이 아님) 국화빵은 팥이랑 고구마슈크림?맛이 있었는데 오리지널을 먹는 게 제맛이다 싶어 팥으로 주문했습니다 그냥 팥은 아니었고 계피향이 나더라고요 그래서 그런지 뭔가 호떡이 생각났습니다 저는 시나몬 러버이지만 국화빵은 쏘쏘였습니다 단 거만 먹고 나면 입맛 떨어지나 봅니다(사실 많이 먹은 거라 그럴만해요ㅋㅋㅋ) 오늘 저녁은 스킵합니다~~"
"연희동 브런치 (그로어스) & 카페 (본지르르, 보연희)","연희동 #그로어스 브런치 카페에 외국인 친구와 다녀왔다. 나는 공간이 널찍한 브런치카페에 가고 싶어서 그로어스를 선택했다. 주택을 개조한 브런치카페이다. 부츠는 #부티크헤르원 밤비 부츠. 흐드러진 보라색 라일락 장식과 함께 사진도 찍었다. 브런치카페 답게 준비된 포토스팟이 있다. 찍을땐 약간 귀찮았는데 지금 보니 그래도 추억으로 남기니 좋다. :) 곳곳에 조화로 장식되어있는데 생각보다 예뻤다. 진분홍 꽃이 있는 테이블에 착석- 2층 자리 창가뷰에서 문화주택이 즐비한 이동네 특유의 차분한 분위기를 즐길 수 있다. 트러플 소스의 버섯크림 트러플 마팔디네 가 우리 입맛에 가장 맞았다.(소스까지 다 먹었다.) 두사람이서 위의 메뉴와 프렌치토스트까지 시켰는데 프렌치토스트까지는 양이 너무 많아서 거의 못먹고 나왔다. 아래는 1 층 자리 이다. 이렇게 위쪽에도 꽃장식이 있는데 보통 솜씨는 아니다. 어느덧 날이 어둑해졌다. 알게된지 얼마안된 친구와 함께한 브런치로 조금씩 서로에 대해 알아가고 있다. 한살 한살 나이 먹을수록 친구 사귀는게 어렵다고 하는데, 뜻하지 않게 이렇게 사랑스럽고 귀여운 친구를 알아가게 되어 감사하다.. ^^* 다음 행선지인 #보연희 케이크 전문점으로 이동했다. 얼린과일이 아닌 생망고 케잌 이라 과육과 생크림 정말 부드럽고 맛있다. 이곳도 계속 가야지 했던곳인데 드디어 와서 후련하다. 아쉽게도 사진은 없다. 보연희 서울 서대문구 연희맛로 17-63 2층 https://naver.me/GbE5eeUy 이 근방에는 본지르르 카페도 좋으니 #본지르르 카페도 추천한다. 본지르르는 여름에 다녀왔다. 따뜻한 느낌의 붉은 벽돌집으로 외관 내관 모두 멋있다. 주택을 개조한 카페이다. 붉은 벽돌과 대비되는 상큼한 연두색 목수국이 있다. 소나무 뷰 오래 있진 않을거라 커피 한잔만 했는데 , ‘과일 한접시’ 메뉴가 눈길이 갔다. 2층은 이렇게 연희동 특유의 분위기를 즐길 수 있다. 저 한지 조명이 하나 더 있어 공간이 따뜻해지는 느낌이다. 따뜻한 붉은빛의 외관. 데크에는 이렇게 벤치도 있다. 벤치 옆에 저렇게 조명이 있어 밤에는 어떨지 궁금하다. 한가지 인상적인건 이 카페엔 온갖 종의 예쁜 개들이 많았다. ㅎㅎ 그런데 개들이 다들 꼼짝도 안하고 주인옆에서 가만히 앉아만 있어서 신기했다. ( 짖지도 않고 태도가 어쩜 그리 좋은지.) 문화주택들이 아직 많이 남아있는 동네라 서정적인 옛서울의 분위기를 즐기기 좋다. https://m.place.naver.com/restaurant/1161125870/home?entry=pll 본지르르 연희 : 네이버 방문자리뷰 125 · 블로그리뷰 322 m.place.naver.com #연희동 #연희동카페 #연희동스파게티 #브런치카페 #연희동브런치 #브런치 #강아지카페 #주택개조카페 #연희동데이트 #데이트코스 #외국인친구 #문화주택 #카페인테리어"
디저트 뿌셔 [연희동 보연희] 흑임자라떼 쪽파쿠키,"비가 내리던 어느 날, 돈가스에 미친 우리는 연희동으로 향한다 다이어트 얘기 하다가 응 알겠고 내일 돈가스 예약이나 확실하게 해 ㅋㅋㅋㅋㅋㅋㅋㅋㅋㅋㅋㅋㅋㅋㅋㅋㅋㅋㅋㅋㅋㅋㅋㅋㅋㅋㅋㅋㅋㅋ 북촌에서 한장 찰칵 연희동 가는 길 돈가스 먹기 전 들린 카페 보연희 김여행 트위터 보고 달려왔당 (사실 흑임자 라떼 보고 달려 옴 ㅋㅋㅋ) 흑임자 매니아 나야나~ 2층에 있습니당 고생 끝 보연희 흑임자라떼 커피 줄이기로 결심해서 반샷만 넣고 반샷은 따로 받았당ㅎㅎ 숟가락 참 특이하게도 생겼구낭 이맛이야! 달달한 흑임자 크림 쉐킷 ㅠㅠ 너무 맛있음 맘 같아선 3잔 마시고 싶다라는 커피 중독자의 생각 ;;^^;; 월요일이라 그런지 손님이 별로 없었다 종류 별로 사고 싶었던 디저트... 케이크... 다음엔 디저트 뿌시러 온당... 오늘은 돈가스 먹을거니가 참는다.. 또 가고 싶고 최애 카페에 등극 했어요 못참고 카페 나가면서 쿠키 하나 삼 ㅋㅋㅋㅋㅋㅋㅋㅋㅋ 쪽파 크림치즈 쿠키 고급스러운 야채크래커맛 다음엔 다른맛 구매해야봐야징 헤 보연희 서울특별시 서대문구 연희맛로 17-63 2층"
"파르페 투어 - 연희동 보연희, 잠실 디저티스트, 성수 래뮤","가게들이 다 떨어져 있어서 물론 이 가게들을 다 방문하는 건 힘들지만 어쨌든 요즘 파르페가 소소하게 인기인 것 같아서 파르페 파는 카페를 모아보는 글! 보연희 서울특별시 서대문구 연희맛로 17-63 2층 보연희 2층에 위치해있다 케이크 메뉴(계절에 따라 다름) 여름엔 이렇게 테라스 석에 앉을 수 있다 겨울엔 닫혀있음 음료 메뉴 1인1음료인데 파르페는 음료를 따로 시키지 않아도 된다 복숭아 파르페 (14,500원) 복숭아 + 복숭아 소르베 + 바닐라 아이스크림 + 생크림 + 통밀 크럼블 황도인지 백도인지는 그때그때 다른 것 같다 딸기+생크림+딸기 소르베+크럼블 총평: 이 돈 주고 먹기엔 구성이 좀 단조롭다고 느꼈다 차라리 여긴 케이크가 맛있을 듯 사진 찍기도 디저티스트가 훨씬 예쁘다 피스타치오 딸기 다쿠아즈 그냥 맛있어보여서... 아래는 가게 인스타그램에서 가져온 계절별 파르페 사진 무화과 파르페 복숭아 파르페(백도) 체리 파르페 후르츠 허니콤 파르페 래뮤 서울특별시 성동구 연무장길 14 2층(성수동1가) 래뮤(ramewe) 이게 왜 래뮤야 구움과자도 판다 커피 종류가 많지 않음 애초에 메뉴 자체가 소박하다 계절에 따라서 무화과 파르페, 밤과 배 파르페 등 판매 내가 갔을 때는 복숭아 파르페 하고 있었는데 특이했던 점은 밑에 멜론 딜 아이스크림이 있다는 거! 딜이 들어가서 맛이 재미있었다 총평: 양에 비해 비싸긴 하지만 특이한 구성이 돋보임 아마 곧 딸기도 하지 않을까?! 기대기대 아래는 가게 인스타그램 계정에 있던 사진들을 가져왔다 초당옥수수 파르페 체리 파르페 무화과 파르페 밤과 배 파르페 디저티스트 서울특별시 송파구 송파대로48길 37 호수임광아파트 상가동 2층 송리단길 석촌호수 디저티스트 석촌호수에서 나와서 송리단길(ㅋㅋ) 초입에 있다 입구 젤라또 건물 2층이다 드링크 메뉴 마카롱과 휘낭시... blog.naver.com 디저티스트는 케이크도 너무 맛있는 곳이당... 디저티스트 체리 파르페 벚꽃 파르페 샤인머스캣 파르페 아래는 인스타그램에서 가져온 사진 샤인머스캣 파르페 망고패션 파르페 산딸기 파르페 딸기 파르페 벚꽃 파르페 총평: 비싸긴 하지만 예쁘고 맛도 있고 전체적으로 고급스러운 구성 디저티스트는 케이크도 맛있고 음료도 맛있고 다 맛있음🫶"
(서울) 연희동_ 보연희,"인스타그램으로 눈여겨보고 있었던 보연희 갈 수 있는 기회가 생겨서 달려갔다 :) *open- pm. 12:00 *close- pm. 10:00 *Every Wednesday off https://instagram.com/beau_yeonhee?igshid=MDE2OWE1N2Q= 보연희(@beau_yeonhee) • Instagram 사진 및 동영상 팔로워 15K명, 팔로잉 202명, 게시물 2,729개 - 보연희(@beau_yeonhee)님의 Instagram 사진 및 동영상 보기 instagram.com 케이크 종류가 진짜 많았다! 다 먹어보고 싶었지만 무화과 뿌시러 간 날이라서 다른 메뉴들은 미뤄두기. 쓰면서도 군침이 도네.. 가을이 가기 전에 조만간 또 방문해서 바밤바 갸또 먹어보고 싶다🤭 *초도 종류별로 있어서 분위기 내기 딱 좋다 :) 예전엔 기념일이 아니더라도 무조건 아무 의미 부여하면서 예쁜 초 꽂고, 불 켜고 그랬는데 요즘엔 그러진 않는다. 그래도 예쁜 초 보니까 살짝 탐이 나긴 했지만, 참았다! 예쁜 셀프 바 :) ‘영암 무화과 우유 생크림 케이크’ 그리고 ‘샤인머스캣 파르페’ + 아메리카노 둘☕️ 햇살 받아서 더 예쁜 디저트들✨ ‘영암 무화과 우유 생크림 케이크’ 같이 간 친구 피셜 : 무화과 케이크에서 고구마 맛이 난다! 그 정도로 담백하고 꼬수웠다. 아마 잘 익은 무화과와 부드러운 케이크 시트의 구움 향이 더해져서 그렇게 느껴진 것 같은데 많이 달지 않고 살살 녹는 우유 생크림도 좋았고, 폭신한 스펀지 같은 시트도 너무 마음에 들었다.❤️ ‘샤인 머스캣 파르페’💚🌳 파르페를 시켰는데..! 나무가 한 그루 왔어요! 진짜 비쥬얼 보고 너무 예쁘고 귀여워서 한참 웃었다. 먹기 아까울 정도로 예쁘게 쌓여있어서 조심조심 포크로 하나씩 떼어내서 먹었다 :) 파르페 맨 밑부분은 투명한 젤리였는데 다 함께 먹으면 식감이 진짜 신기하고 달달하니 기분이 좋았다. 화장실 가는 길에 전신 거울도 있다! 여기..아주 잘 나옵니다 사진👍🧡 2022. 10. 10 무화과 파르페 사진을 보고 갔던 카페였지만, 무화과 철이 거의 끝나갈 즈음에 방문한 거라서 역시나 무화과 파르페는 품절이었다.🥲 여쭤봤더니 파르페에 올릴만한 예쁜 무화과들은 이제 만날 수 없어서 아쉽게도.. 그래도 무화과 케이크는 맛볼 수 있어서 좋았고 정말 만족했으니 나중에 꼭..! 다른 케이크 모두를 맛봐야겠다.❤️ 사장님이 해바라기를 좋아하시는지 올라가는 계단과 입구, 그리고 내부에도 곳곳에 해바라기가 가득했는데 같이 간 친구가 해바라기를 좋아하는 친구라서 왠지 모르게 내가 다 기분이 좋았다.🌻"
