title,content
연희동 로덴드론 연희 3호점에서 브런치 내 돈 내산,"연희동 로덴드론 연희 3호점에서 브런치 내 돈 내산 동네 친구들과 함께한 즐건 브런치 이야기. 가기 좋고 분위기 좋은 연희동 맛집이다. 로덴드론은 연희동 사는 친구의 추천으로 가게 된 건데. 일단 맛보다는 분위기였다. 내 돈 내산 솔직후기 시작~~~ 연희동은 요즘 웬만큼 꾸며서는 눈에 띄지 않는다. 그래서 여긴 규모 면에서 일단 선두권으로 보인다. 로덴드론1호점은 자주 가던 카페다. 우리가 이번에 간 곳은 로덴드론 연희 3호점으로 마당이 멋진 곳이다. 내부 분위기는 주인의 취향이 묻어나는 건데, 고급보다는 고풍스럽다. 일관된 분위기는 아니지만 굉장히 애쓴 티가 났다. 앤틱한 분위기를 내기 위해서. 나름 돈이 많이 들어가 보이기는 하나 조금 산만한 듯. 저렇게 앤틱한 소품을 모아 일관된 분위기를 내기는 쉽지 않을 듯하다. 오히려 1호점의 분위기가 내 취향엔 더 맞는 것 같다. 모던과 앤틱을 넘나드는 분위기다. 의자는 편해 보이는 좌석과 좀 불편해 보이는 의자가 섞여있다. 우리는 좀 일찍 가서 여기저기 앉아보고 골라서 좌석을 정했다. 첨에 앉았던 의자인데. 식사를 하기엔 좀 불편했다. 그래서 분위기보다는 먹기 편한 좌석으로. 입구에서 본 풍경이다. 뭔가 소품이 굉장히 많은데. 서로 어울리지는 않는 듯. 그래도 주인장의 노고가 보인다. 요즘은 내부를 단독의 내부를 이렇게 카페 분위기로 리모델링한 브런치 카페가 많아지고 있다. 카페 하려면 수십억 들어갈 듯. 친구가 골라온 메뉴다. 우린 셋이 와서 서로 다른 음식으로 골고루 시켰는데. 일단 보기에 푸짐하고 맛나 보여서 첫인상은 합격이다. 맛은 합격점이라기엔 아쉽고 별 셋. 그래도 양이 푸짐해서 별 하나는 추가해 볼까? 일단 아메리칸 브런치(16000원) 미트볼 파스타(15000원) 이름이 생소한 삭슈카(17000원) 그리고 연어샐러드 (16000원) 추가. 애초에 좀 양을 많이 주문한 듯. 난 빵이 맛있어서 다른 사람보다 더 많이 먹었던 듯. 다들 얘기하기에 바쁜 틈을 타서. 메뉴판은 입구에서 찍어왔는데. 잘 안 보임. 기본적으로 양이 좀 많았는데. 세 명이서 네 개나 주문한 건 미스였다. 브런치도 양이 왜 이리 많은 건지. 여자 손님용으로는 양을 좀 줄이고 퀄리티를 높이는 게 좋지 않을까? 그래도 빵은 열심히 먹었음. 미트볼 파스타도 양이 많았다. 내가 워낙 해산물 파라 나의 의견은 좀 주관적이라고 봐야 듯. 친구들은 맛있게 먹었다. 이건 첨 먹어본 건데. 음, 한 그릇 다 먹기엔 힘들고. 이것저것 같이 먹는다면 먹을 수 있지... 어찌 되었든 끝없는 수다와 이어지는 푸짐한 식사. 할 수 없이 커피를 주문했는데. 엄청 진하다. 커피는 4천 원인지 5천 원인지 기억은 안 나는데. 비싸지는 않았다. 샐러드는 완전 내 스타일. 샐드는 연어도 푸짐하고 야채도 신선하고. 샐러드가 있어서 다른 음식도 먹을 수 있었다고 할까? 푸짐한 연어와 싱싱 야채 좀 보소~~~ 실내 분위기는 한 번 더 모아서 보자. 나름 독특해서 사진을 많이 찍어왔다. 안쪽으로는 룸이 마련되어 있는데. 예약을 해야 이용 가능했다. 로덴드론 연희 3호점은 내부보다 마당 좌석이 더 멋있다. 나름 예쁜 화분에 나무들이 푸릇푸릇. 비가 와서 실내에서 먹었지만. 브런치를 다 먹고 나서 아쉬움에 지하로 내려가 커피를 한잔 더 마셨다. 요 마당 좌석은 앉아보고 싶었는데, 아쉽다. 비가 온 뒤라 의자가 젖어 있었기 때문. 내부 인테리어는 잘 모르겠고, 마당의 좌석은 일품이다. 다시 오게 된다면 마당에 앉아봐야지~~ 입구의 이 조각도 멋지다. 나름 동네 사람들은 알고 있는 명물. 연희동 로덴드론 연희 3호점에서 친구들과 함께한 브런치 타임, 내 돈 내산이다. ▶▶▶ 줄리아 생각 규모를 보나 마당에 꾸민 걸 보나 한번은 가볼만. 음식은 조금 아쉬운 듯. 연희동이 맛집이 많아서 어지간해서는 순위에 들기 어렵다. 연희동 브런치 오트 후식으로는 분위기 커피 앤트러사이트 연희점 내돈내산 연희동 브런치 오트 후식으로는 분위기 커피 앤트러사이트 연희점 내돈내산 동네 친구와 오랜만에 브런치하... blog.naver.com"
연희동 디저트 브런치 카페 로덴드론 연희3호점 내돈내산 찐후기❣️,"안녕하세요👋👋 마미손🤲입니다😆 요즘은 아이들 방학이라 함께 지내느라 돌밥...돌밥...너무 힘들어요ㅠㅠ 이럴 땐 에어컨 빵빵하게 틀고 단거먹으러!!! ㅎㅎ 그래서!! 오늘은 분위기 좋고 달달~한 디저트가 맛있었던 연희동의 카페 소개해드릴게요^^ 로덴드론 연희3호점 로덴드론 연희3호점 서울특별시 서대문구 연희로11라길 7 로덴드론 본점(연희1호점)을 갈까~하다가 새로 생긴 연희3호점으로😆 사러가 주차장과 완전가까운 곳에 위치!! 외관만봐도 규모가 상당할 거 같죠??🤩 5군데의 로덴드론 지점이있네요❣️ 들어가자마자 보이는 로덴드론의 상징!! 나무 기린이 우릴 맞이해주었어용 이 날 날씨도 쨍하니 넘 좋았어요🎈 날 선선해지면 야외에서 즐겨도 넘 좋겠어요❣️ 나무 기린은 생각보다 엄청커요ㅋㅋㅋㅋㅋㅋ 기념으로 옆에서 사진 찰칵📷 많이들 하시더라구요ㅎ 이제 내부로~~~ 키오스크로 주문하구요~~~~❣️ 브런치, 샐러드, 파스타, 스프...😆 세트메뉴도 있어서 밥 안먹고 여기서 해결해도될듯요😍 단지 가격은 저렴하진않습니다!!ㅎㅎ 이제 보이는 건 다양한 디저트들❣️ 조각케이크 종류도 많았어요👍 디저트와 커피를 고르고 윗층으로🤍 윗층으로 올라가는 계단 옆 벽도 넘 예뻤어요😍 위에서 내려다 본 아랫층~~~ 층고가 높아서 시원시원~~~👍 좌석은 여기저기 구석구석 꽤나 많았어요~~ 저흰 저 소파자리 픽✌️ (전체적인 샷을 못찍어서 아쉽네요?^^;;) 자 이제 먹어볼까용? 저희가 시킨 메뉴예욤♡ 둘이 갔는데 좀 많이 시켰쥬?ㅋㅋㅋㅋ 그릇도 제 스톼일~~너무 예뻐용💙 요고요고 너무 귀엽지않나요??😍 살짝 잔인해보이지만...ㅋㅋㅋㅋ 나눠먹느라 쪼갯...습니다😂😂 망고 조각케이크도 망고가득가득 맛있었어용🎈 초코케이크는 뭐 말해뭐해요~~~ 우리가 다 아는 그 맛있는 맛이유~~~~~~❣️ 점심밥을 먹고 갔음에도 디저트와 커피 클리어✌️ 로덴드론 연희3호점 총평 ⭐️⭐️⭐️⭐️ 큰 규모의 널찍널찍하고 탁 트인 분위기라 연희동 가신다면 한번쯤 가보시길 추천!! 하지만!! 엄청 특별한 디저트는 없음!!ㅎㅎ 다 아는 맛~~^~^ 로덴드론 연희3호점 서울특별시 서대문구 연희로11라길 7 #로덴드론 #연희동로덴드론 #로덴드론연희3호점 #로덴드론연희동 #연희동카페 #연희동 #연희동카페어디가 #사러가근처카페"
[연희동/카페] 로덴드론_연희3호점. 여유로운 브런치 시간,"오늘 #로덴드론연희 3호점에 다녀왔습니다. 얼마전 3호점이 생겨 많은 관심을 모은 곳인데, 아는 동생이 가봤더니 좋다고 이곳으로 약속장소를 잡았어요. [연희동/카페] 로덴드론연희3호점 로덴드론 연희3호점 서울특별시 서대문구 연희로11라길 7 #로덴드론연희3호점 은 연희맛로 인근에 있어 찾기 쉽답니다. 연희 메인 스트리트인 사러가길에서 가까워요. 건물도 시원한 단독건물이라 찾기 쉬웠습니다. #주차가능 입니다. 건물을 둘러 4대 정도? 혹은 그 이상 주차가 가능합니다. [연희동/카페] 로덴드론연희3호점 3호점은 #브런치카페 를 주 테마로 합니다. 그래서 이른 시간부터 사람이 많아요. 오픈 시간은 오전 8시. 저희는 10시에 갔는데 대부분 메뉴를 모두 만날 수 있었습니다. [연희동/카페] 로덴드론연희3호점 메뉴는 브런치와 샐러드, 그리고 음료가 구비되어 있습니다. 주문은 키우스크로 하는 형식이랍니다. [연희동/카페] 로덴드론연희3호점 들어가서 만나는 야외 테이블. 이곳이 인기가 정말 많아요. 늦으면 야외는 앉기 힘들다더라고요. 특히 지금처럼 바람이 시원한 날씨에는 더욱 좋은 듯 합니다. [연희동/카페] 로덴드론연희3호점 로덴드론의 상징인 기린. 얘는 1호점부터 3호점까지 모두 있는 듯합니다. [연희동/카페] 로덴드론연희3호점 3호점에서 가장 아쉬운 점은, 지하 1층에서 주문을 하고 1층 홀이나 야외 테이블로 이동해야 한다는 점입니다. 이게 꽤 번거로웠어요. 지하 1층에 약간의 자리가 있긴 하지만, 사람이 많이 지나다녀서 좀 번접스럽더라고요. 게다가 음식이나 음료를 직접 가지고 움직여야 해서, 저는 꽤 무겁고 고됐어요. 나이드신 분들은 힘들겠다 싶었습니다 (직원분이 좀 도와주시긴 했는데, 따로 서빙을 하는 직원은 보이지 않더라고요) [연희동/카페] 로덴드론연희3호점 지하1층 매대입니다. 빵류가 진열되어 있고, 주문은 키우스크로 합니다. 진동벨이 울리면 다시 와서 가져가야 해요. [연희동/카페] 로덴드론연희3호점 그리고 다 먹은 음식은 1층에 있는 퇴식구에 두고 가면 됩니다. [연희동/카페] 로덴드론연희3호점 물과 냅킨은 1층에 비치되어 있답니다. 셀프 서비스^^ 하지만 브런치는 좀 가져다주면 좋을 것도 같아요, 요리전용엘리베이터가 있던지요. 뭐, 저만 유독 힘이 들었을 수도 있습니다-어제 좀 앓다 왔거든요. [연희동/카페] 로덴드론연희3호점 홀은 넓직하고, 다양한 테이블과 좌석이 있어 골라 앉는 재미가 있었습니다. 공간이 커서 상당히 쾌적해요, 테이블간 거리가 멀어서 사적인 대화가 가능한 점도 만족스러웠습니다. 요즘 인기있는 곳은 좁아서 옆 테이블 소리가 들리는 게 영 마음이 불편하거든요. [연희동/카페] 로덴드론연희3호점 오래된 타자기를 진열해 놓아 고풍스러운 멋이 있습니다. 곳곳에 창문이 많아 볕이 잘 들어오는 것도 좋았어요. 전명창이 아니라 덥거나 부담스럽지 않았습니다. [연희동/카페] 로덴드론연희3호점 시그니처? 타자기. 예전에 저도 집에 있는 걸 본 기억이 있는데, 컴퓨터 자판을 두드리는 것과는 또 다른 매력이 있습니다. [연희동/카페] 로덴드론연희3호점 저희는 런치3인세트. #연어샐러드 와 #삭슈카 (에그인헬), #미트볼파스타 와 #아메리칸브런치 가 나오는 세트입니다. 특히 #커피포함 되어 좋았어요, 요즘 브런치에 커피 주는 곳 드물잖아요. 느긋하게 먹고 커피를 마시면서 대화할 수 있어 좋았답니다. 음식은 맛있었고, 짜지 않아 좋았습니다. 양도 꽤 많아서 셋이 배불리 먹었는데 좀 남더라고요. 하지만, 수다쟁이 친구들이 만났는데 이걸로 끝날 수는 없죠, 앉아있는 시간이 길어져 디저트와 차를 다시 주문했습니다. [연희동/카페] 로덴드론연희3호점 이번엔 #블루베리치즈케이크 와 #애플 파이 . 그리고 저는 페파민트 차. 친구는 자몽티를 마셨는데 맛있다구요. 이곳 커피는 진하고 깔끔해 아주 마음에 듭니다. 사실 저는 디저트류가 더 마음에 들었어요. 이외로 달지 않고, 사과가 몽글몽글 씹히는 애플파이가 매우 매력적이었구요, '단 것을 먹겠다'고 외친 블루베리치츠케이크도 담백했습니다. 사실 전 스타벅스 치즈케이크같은 진득한 맛의 치츠케이크를 좋아하는데, 살짝 푸실한 느낌이긴 했어요, 그래도 맛있습니다. [연희동/카페] 로덴드론연희3호점 가정집을 개조한 카페라 나무 계단이 반갑습니다. 예전에 2층집에 살때 있었던 건데, 그 뒤로는 쭉 아파트에서만 살아서 정겹더라고요. 구석구석 세심하게 꾸며놓은 것도 마음에 듭니다. [연희동/카페] 로덴드론연희3호점 2층에서 1층을 볼 수도 있어요. 꽤 재치있는 구조인듯 합니다. 화장실은 깨끗하긴 한데 살짝 좁은 아쉬움이 있습니다. 제가 긴 사람이 아닌데, 좀 좁은 느낌이 있었답니다. 그래도 여유로운 브런치를 즐기실 분, 디저트 좋아하시는 분들께 추천드리고 싶은 곳입니다."
"[연희동 카페] ""로덴드론 연희3호점"" 연희동브런치 테라스카페","""로덴드론 연희3호점"" ⏰ 매일 08:00-22:00 로덴드론 연희3호점 서울특별시 서대문구 연희로11라길 7 로덴드론 연희 1호점 서울특별시 서대문구 연희로25길 82 로덴드론 동교 2호점 서울특별시 마포구 신촌로4길 11 세광빌딩 1층 예전에 로덴드론 1호점일 때 티라미슈 진짜 맛있게 먹었던 기억이 있다! 2호점은 동교동쪽에 있고 3호점이 연희동에 크게 생겼다! 연희동 사러가 주차장쪽 핫라인 골목에 뚝딱뚝딱 공사하더니 로덴드론 3호점이 생겼다!! 야외테라스 자리도 매우 넓고 많이 있었지만 너무너무너무너무너무...더웠기 때문에 안으로 들어가기!!! 역시..이제 주문도 키오스크로! 주문을 하고나면 옆에 진동벨이 나온다 다양한 디저트와 베이커리류도 있고! 커피메뉴 뿐만 아니라 음료메뉴도 엄~~청 다양하다!!! 직접 만든 건지 쨈 종류도 많았다! 선물용으로 좋을듯😏 로덴드론 3호점은 공간이 매~~우 넓다! 그래서 사람들이 많아도 북적인다는 느낌이 없을듯! 주말에 연희동 대부분 카페들 웨이팅이 있을 정도인데 여기는 1층 2층으로 나누어져있고 공간도 넓어서 웨이팅 걱정은 없다! 2층으로 올라오니 통유리로 된 바닥이 보이고 책꽂이에 책들도 있어서 혼자 작업하거나 책읽으며 휴식하기에도 좋을듯!! 각 공간마다 느낌이 다양했다! 개인적으로 좋았던 점은 5-6명이 함께 카페를 가야하는 상황일 때 생각보다 작은 규모의 카페들이 많아서 좌석을 붙여야 하는 상황이 대부분인데 이렇게 큼지막한 좌석있어서 참 좋았다! 게다가 독립된 공간이면 더 좋아~~~ 이날은 배가 불러서 까눌레 하나 먹었지만 예전에 1호점에서 티라미슈를 정말 맛있게 먹었던 기억이 있다! (그만큼 디저트 맛있음!) 브런치 메뉴도 있는 것 같던데 나중에는 로덴드론에서 브런치도 먹어봐야지!"
"연희동 디저트 로덴드론 연희 3호점 대형 브런치 카페 메뉴, 시설, 주차 내돈내산","< 연희 > 로덴드론 2023. 11. 1 단독주택을 개조한 대형카페 맛있는 커피와 브런치를 야외에서 먹을 수 있는 ""로덴드론"" 다녀오다. 위치 서울 서대문구 연희로11라길 7 시간 매일 08:00 ~ 22:00 전화 02-337-3377 화장실 실내 남/여 구분 주차 가게 앞과 옆 5대까지 가능 편의 단체, 포장, 무선인터넷 주차 정보 로덴드론 연희 3호점 주차는 총 5대까지 가능하고 앞쪽으로 2대, 옆쪽으로 3대. (사진 속 화살표 참고) 주차금지 표지판이 세워져 있는데 살짝 치우고 주차하면 된다. 혹 만차일 경우 바로 근처에 사라가 마트 주차장이 있는데 비용은 발생된다. 외부 모습 독특한 구조의 건축물이 압도하고 주택을 개조한 카페지만 외부 모습은 전혀 주택 같지 않다. 로덴드론의 마스코트 기린. 로덴드론은 브런치 카페로 입구에 브런치&음료 메뉴를 지나가면서 쓰윽 훑어볼 수 있다. 입구 계단을 오르면 저 멀리 기린이 반겨준다. 서울 연희동에 기린이라니.ㅋ 덩치가 실제 기린만 하다. 테라스 모습 여기는 로덴드론 연희 3호점으로 1호점은 여기서 조금 떨어진 같은 연희동에 위치해 있고 2호점은 동교점으로 홍대에 있다. 주문은 왼쪽 짧은 계단을 내려가면 키오스크, 디저트가 전시되어 있고 실내 매장은 오른쪽 계단을 이용. 이제야 고급 주택이었던 느낌이 든다. 전원주택을 개조해 만든 카페 중 규모가 상당한 대형카페다. 테라스에서 먹은 식기들은 퇴식구에 놓기만 하면 되니 왔다 갔다 번거롭지 않아서 좋다. 테라스 한켠에 자리 잡고 있는 기린. 나무로 만들어졌는데 나름 정교하다. 아이들이 와도 좋아하겠는걸. 연희동의 매력이라면 식상하지 않은 대형카페들이 많다. 틀에 박힌 일반 카페 모습이 아니라 생각 이상으로 독특하고 기발한, 그래서 더욱 핫한 전원주택 속 힐링 공간으로 인기가 높다. 주문 장소 & 메뉴 정보 브런치, 피자, 샐러드, 파스타, 수프와 커피, 크림 커피, 티, 주스, 라떼, 스무디 등 음료도 정말 다양하다. 디저트 맛집다운 비주얼이다. 예쁘고 맛있어 보이는 로덴드론 연희 3호점은 디저트 천국. "" 주문이요 "" 로덴드론의 시그니처 커피 모카블랑 + 아인슈페너 + 바스크 치즈케이크 주문 메뉴 더 추워지기 전에 테라스에서. 겉면은 스모키하고 속은 크리미한 바스크 치즈케이크의 촉촉함과 꾸덕꾸덕함 정도가 적당해서 커피와 맛있게 먹었다. 다만, 아인슈페너는.. ;; 로덴드론의 시그니처 커피답게 모카블랑 굿!! 다시 먹고 싶은 비주얼이다. 모카가 커피 맛을 방해하지 않고 진한 커피 맛과 부드러운 크림이 너무 진하지도 달지도 않다. 실내 모습 우와. 이렇게 넓은 규모와 좌석이!! 자리 없어서 나갈 일은 없겠다.ㅋ 중앙에서 주문했던 곳이 보인다. 게다가 인테리어 어쩜 너무 괜찮다. 소품이 참 많고도 다양하다. 탈을 쓴 사람인 줄 알았다. 순간 뒷걸음쳤다. 사장님은 코카콜라를 좋아하시나. 룸 안에 회의실처럼 놓인 테이블은 예약석으로 운영되고 그 외 다양한 컨셉과 디자인의 좌석이 세다가 포기할 만큼 많다. 통유리의 구조가 특이하다. 개조한 실내여서 그런가? 실내 공간이 매우 넓어서 부분부분 다른 컨셉으로 꾸며진 내부를 둘러보는 재미로 시간 가는 줄 모른다. 여기 사장님은 정말 멋지시네. 수집가이신게 틀림없어. 뵙고 싶다.ㅋ 코카콜라에 이어 볼타자기를 세상에 어디서 다 수집하셨을까. 그런 사장님 손길이 닿아서인지 실내는 테라스와는 또 다른 분위기로 힐링하며 머물기 좋다. 핫한 연희동 전원주택 대형카페 눈과 마음이 즐겁고 싶다면 로덴드론 기린을 찾으러 GO!! 로덴드론 연희3호점 서울특별시 서대문구 연희로11라길 7 광고 X, 협찬 X 내 돈 내 산 소중한 솔직 리뷰입니다."
연희동신상카페 로덴드론연희3호점 야외테라스,"로덴드론 연희3호점 서울특별시 서대문구 연희로11라길 7 안녕하세요~ ""내벅""입니다 이번엔 연희동에 생긴지 얼마 안된 신상카페 로덴드론 연희3호점을 소개해드릴까 합니다. 겉에서 봐도 건물이 정말 크고 높죠? 이미 연희동엔 연희1호점, 동교동에 동교2호점이 있어요! 최근에 3호점이 생겼는데 헉! 영업시간을 알려드릴려고 했더니 네이버지도에는 나오지않는군요! 대신에 연희1호점, 동교2호점의 영업시간으로 대체해서 알려드릴게요!!! 연희1호점의 영업시간: 매일 08:00-22:00 동교2호점: 매일 08시-22시 3호점 주소: 서대문구 연희로11라길7 (전화번호 02-337-3377) 2군데가 비슷한거 보니 3호도 비슷하지 않을까요??! 자신은 없음. 오 이게 뭐지요?!! 야외가 멋지군요 컥 들어가보니 대형 기린 동상이... 야외 자리들이 꽤 많고 넘 멋집니다. 이 날 날씨가 좋고 하늘이 화창했는데 파라솔들도 제대로 쳐져있어서 햇살에 얼굴이 익지않을 것 같은 좋은 자리들이 많았어요. 그래도 저는 콘센트가 필요하기에 안으로 들어가기로 했습니다. 약속으로 가기전에 잠깐 노트북을 써야하거든요. 카페가 확실하지는 않지만 스튜디오를 개조한 자리라고 하던데 정~말 넓었어요. 8명까지 앉을 수 있는 테이블들도 꽤 많았습니다. 확실하진않지만 적어도 3개의 방을 봤어요. 이런 자리들은 다 ""예약석""이라는 팻말이 세워져있었어요. 방 안에 따로 딱 요로코롬 테이블이 있어서 프라이빗하게 친구들을 만나거나 청첩장 모임 하기도 좋을 것 같습니다. 2층으로 올라가봤어요. 상당히 넓습니다. 자리도 지인짜 많고요. 2층으로 일단 자리를 맡기위해 올라가봤어요. 오 ~ 1층이 보이는 넓은 유리도 있군요. 진열되어있는 빵들이 보여요. 이런 소파 자리도 있고요! 책장 옆에 이런 다양한 2인석들도 있습니다. 의자가 다른 디자인들이 정말 많군요 콘센트도 간간히 보여요! 가게 내부를 구경하는데 오래 걸렸어요. 정말 넓어서.. 오 이렇게 귀여운 고양이 피규어들은 어디서 구하셨나. 총 몇마리일까요. 9마리군요! 위 동영상 보면 내부의 일부를 담아봤어요. 자 이제 주문을 하러 1층으로 내려가봅니다! 휘낭시에는 3천원! 에그타르트도 있고요.스콘(3천)도 있습니다. 테이블 위에 꽃도 있고 조각상도 있고 인테리어 및 소품에 신경쓴 느낌. 가운데 꽃도 있고 예쁘게 진열해놓았죠? 까눌레도 종류가 많았는데 이렇게 귀여운 눈 달린 까뉠레는 뭐지요?! 우든 트레이 위에 올려놓았어요! 저희가 주문한 메뉴가 나왔습니다. 사실 제 동행이 먼저 주문해놓고 전 늦게 도착해서.. 메뉴 이름은 정확히는 모르겠군요. 어쨌든 브런치 구성으로 먹어봅시다! 스프도 있어요! 클로즈업 보면 재료가 풍부하죠?! 이것도 상큼하니 괜찮았어요!! 미트볼 파스타~ 단백합니다~~ 전반적으로 브런치하기에 맛이 괜찮아요 그리고 동행이 가장 좋아했던 스프! 이렇게 빵이랑 같이 찍어먹어야죠! 아래는 스프가 얼마나 꾸덕(?) 부드러운지 담아본 동영상입니다. 요로코롬 빵위에 쓱~ 스프를 뿌려주면 빵도 부드러워집니다~ 식사를 다 하고 아쉬워서 다시 1층에 내려와서 디저트를 골라봤어요 케이크를 먹을까해요. 우리의 선택은 치즈케이크! 바스크치즈케잌입니다. 호~ 전 이 메뉴가 제일 마음에 들었습니다. 치즈케이크 생각나면 오면 좋겠어요! 어디에서 공수한 걸까? 매장이 넓고 야외에서 파라솔 그늘 밑에서 커피 마시기에 좋은 신상카페 소개드려요!"
