title,content
케이크가 맛있어서 줄 서는 카페 연희동 보연희,"연희동에서 밥을 먹고 너무 배가 불러서 바로 카페 가지 말고, 동네 한바퀴 돌고 가자 싶어서 살짝 걷다 들어갔는데 자리가 딱 한 자리밖에 안 남아 있던 카페..! 연희동 보연희. 이렇게 갔을 땐 유명한 곳인지 정말 몰랐는데, 우리가 들어가자마자 바로 만석이 되고 점점 웨이팅을 하더니 매장 안에까지 들어와서 기다리는 사람이 있길래 정말 깜짝 놀랐다. 테이블도 많았는데 꽉 차고, 금방금방 사람들이 들어와서 여기가 이렇게 유명했나? 새삼스러웠다. 보 연희는 매주 수요일 휴무에, 인스타그램 계정도 있었다. 인스타그램: @beau_yeonhee 크리스마스가 지난 지 한참이었지만 아직도 트리가 있어서 좋았다. 이번 크리스마스에는 바깥을 잘 못 돌아다닐 때라, 트리를 많이 못봤었는데... 이쁘다ㅠㅠ 가게 이름 로고를 공들여 만드셨는지 여기저기 보연희 디저트카페 로고가 새겨져 있었다. 평소에도 웨이팅이 많은지 웨이팅 등록 안내판도 있었다. 들어갈 땐 이걸 못봤는데, 나올 때 사람들이 하도 많아서 보니까 웨이팅 안내판까지..! 그냥 동네 카페인데 이정도라구..!? 여유로워보이지만 엄청 바쁜 직원 분들. 나같으면 정말 음료 메뉴에 케이크에, 끝도없이 들어오는 손님에.. 정신이 없을 것 같은데 여기 직원분들도 정말 친절하시고 안내도 잘 해주셨다. 케이크에 초를 꽂고 싶은데 가능하냐고 하니까 당연히 가능하다며 라이터도 빌려주셨다. (초는 이 매장에서 샀다) 음료 메뉴판. 아메리카노가 5,000원이니 싼 편은 아니지만 연희동에 그렇게 싼 카페가 별로 없어서 이만하면 나쁘지 않다. 하지만 에이드나 티 종류가 좀 비싼 편이다. 나는 바닐라라떼 따뜻한 것, 연하게 타달라고 부탁드렸다. 원래는 지금 보약을 먹고 있기 때문에 커피를 마시면 안 돼서...!ㅠㅠ 그것도 다 못 먹고 반은 남겼다. (카페인 때문에) 티 메뉴도 있는데 여기 밑에 '1인 1음료 주문'이라고 쓰여 있다. 아마 디저트는 제외인 것 같다. 음료 메뉴를 고르고 밑에를 살펴보니 케이크 종류도 많고 초 종류도 많았다. 아무래도 디저트 맛집이다보니, 여기 와서 케이크를 사가는 손님들이 많은 것 같았다. #돼지바딸기케이크 8,500원 #딸기우유생크림케이크 8,500원 #초코주르륵 딸기우유 생크림케이크 8,500원 #딸기피스타치오다쿠아즈 9,000원 #호지차바밤바갸또 8,200원 #피스타치오아몬드갸또 8,200원 #해남꿀고구마치즈케이크 8,200원 일반 케이크 종류는 8,500원이고 갸또 종류는 8,200원인 것 같다. (치즈케익 제외) 정말 맛있어보였던 딸기 생크림케이크를 하나 고르고... 다쿠아즈는 패스하고.. 친구들이 베스트 메뉴라고 쓰여 있던 '호지차 바밤바 갸또'를 골랐다. #호지차 #바밤바갸또 #바밤바케이크 돼지바 딸기 케이크는 다음에 와서 꼭 먹어보고 싶다. ㅋㅋㅋ 케이크 위에 올라간 초코 부스러기들이 돼지바에 붙어있는 그 맛인가 보다. #돼지바케이크 창가가 양 옆에 있는 한 쪽에도 이렇게 혼자 오면 좋을 자리가 있고, 다른 쪽에는 테이블이 있어서 여러명이 앉을 수 있었다. 이렇게! 손세정제, 물티슈, 빨대, 휴지, 포크 등은 따로 셀프로 가져갈 수 있게 놓여져 있었다. #연희동케이크맛집 #연희동케이크 친구와 거울샷 ㅋㅋㅋㅋ 빠더너스 후드는 너무 크자나요.. ㅠㅠㅠ 케이크와 아까 산 마스킹테이프도 함께 찍어보았다. 음료는 밀크티, 따뜻한 아메리카노, 따뜻한 바닐라라떼! 케이크가 정말 맛있었다. 밤은 내가 좋아하지 않아서 내 취향은 아니었지만, 딸기 생크림케이크는 정말 순삭..! 친구의 좋은 일을 기념하여 초도 불었다. 앞으로도 좋은 일 많이많이 있기를 바라며... 소원을 비는 친구. 빈 소원이 뭔지 모르지만 다 이루어지기를 바랄게!!!! #바밤바케이크 단면 통 밤과 밤크림이 정말 꾸덕꾸덕하니 많이 들어가 있었다. #딸기생크림케이크 딸기생크림케이크의 단면 크림이 정말 부드럽고 맛있는데 케이크 시트도 촉촉하고 맛있었다. 이렇게 되려면 시럽을 엄청나게 발라야 하나..? 잠깐 한 테이블 나가고 다음 사람 들어오기 전에 찍은 테이블. 전체적으로 의자나 테이블에 인테리어적으로 신경을 많이 쓴 것 같진 않지만 편하게 앉아서 대화할 수 있는 곳이었다. 여기도 직원분이 치우기 전에 잠깐 찰칵 이렇게 테이블이 비어도 금방 사람이 들어오기 때문에 빨리 찍어야 한다! 나갈 때 본 셀프 물 바 ㅋㅋㅋ 여기서도 물은 셀프다. #연희동카페 #보연희 #연희동맛집 #연희동카페추천 보연희 서울특별시 서대문구 연희맛로 17-63 2층 연희동 사러가마트 근처에 있는 카페인 보연희, 다음에 연희동에 놀러갈 때도 꼭 들르고 싶다. 잘 먹었습니다!"
"연희동 디저트투어 #1 / 카페마(올레무스2), 보연희, 르솔레이","9월 어느 날~~ 디저트 길라잡이 림언니를 따라 3인방이 모여 연희동 디저트 투어를 다녀왔다. 카페마-보연희-르솔레이-점심식사(쭈꾸미)-온고-카페톤 이렇게 5차까지 다녀온 어질어질한 후기 시작 언니 J야...? 📍 연희동 카페 마 (Cafe MAA) -주소 : 서울 서대문구 연희로11가길 48-10 -영업시간 : 화-일 11:00 - 19:00 첫번째로 간 곳은 ~~ 연희동 골목 안에 눈에 띄게 예쁜 건물 #올레무스 두번째 이야기 #카페마 (cafe maa) #연희동MAA 기존의 올레무스는 당분간 영업을 안하고 있다고 함 커피는 아메리카노, 플랫화이트, 바닐라플랫화이트, 브루잉커피,, 티 종류는 메밀차, 허브 부케, 매실 정향, 루바브 아이스티 ,, 디저트 종류는 #피치멜바, #자허토르테, #부다페스트 이렇게 있었고 이 날 루바브 아이스티는 기계고장으로 안된다고 하셨다. ㅠ_ㅠ 모닝카페인이 필요해서 아이스아메리카노 한잔이랑,, 디저트 전부 (피치 멜바, 자허 토르테, 부다페스트) 주문 여기서부터 여기까지 싹 즈세요 위) 자허토르테 아래) 부다페스트 올레무스는 자리가 협소하다던데 카페마는 테이블이 구석구석 엄청 많았다. 2층도 있었는데 안 올라가봤지만,, 그리고 11시 오픈시간에 맞춰갔는데도 손님이 꽤 많았다 피치멜바 : 파삭한 머랭+라즈베리잼+복숭아조림+ 럼향이 나는 아이스크림이 어디서도 맛 보지 못한 신선하고 맛있는 조합이었다.. 달달 상쾌한 맛💘 자허토르테 : 꾸덕한 초코 케이끄 느낌.. 프랑스의 식전주 파스티스가 들어갔다고 한다. 옆에 일렬로 세워진 크림이랑 같이 먹으니 맛있었고 하지만 나는 한번 맛 본 걸로 만족하는 정도였음! 디저트러버언니는 이거 매우 좋아하는 편이라고 함! 부다페스트 : 많이 달지않고 담백했던 생강향 살짝 나는 헤이즐넛 다쿠아즈~~ 상큼한 귤과 크림이 잘 어울렸다. 이것도 맛있었지만 그래도 원픽 피치멜바 못 따라감 맛 평론가처럼 얘기하면서 먹었는데도 사진 찍은 시간보니 단 6분 만에 그릇 비워진거 실화? 푸드파이터야 무어야; 다들 피치멜바 극찬하며 하나 더 노나먹고 나옴 💗💗💗 여름과 너무 잘 어울리는 공간이었읍니다 ~~ 멜바 먹으러 또 갈꺼에오~ 📍 연희동 보연희 -주소 : 서울 서대문구 연희맛로 17-63 2층 -영업시간 : 12:00 - 22:00 (매주 수요일 휴무) 두번째 코스로 이동하였숩니다. 제철과일 올라간 디저트가 맛있기로 유명하다는 #보연희 과일 진짜진짜 좋아하는 편이라 여기 너무 궁금했다. 쇼케이스 안에 다양한 케이크 종류가 가-득 #무화과피스타치오다쿠아즈 케이크인데 시트가 다쿠아즈로 되어있고 비쥬얼 화려한거보소,,, 작은 원형 테이블이 여러 개 있는 내부 그리고 테라스 좌석도 있었다. #초코체리다쿠아즈 #무화과피스타치오다쿠아즈 예쁜 케이쿠 보기만해도 행벅했고 특히 무화과 피스타치오 다쿠아즈 너무 맛있게 먹었다. 많이 달지 않아서 더 좋았다 !!! 무화과가 이렇게 맛있는 과일이었나 언니가 추천해준 쿠스미 비비 디톡스티 이것도 너무 내 스타일이라 찍어둠,, 보온병 담긴 뜨거운 물도 같이 주셔서 셀프리필까지 가넝 순-삭 👥👤👥👤 (웅성웅성) 옆 테이블에 저거 모야모야 ..? 우리도 시키자 추가 주문한 #무화과파르페 위에 올라가는 과일들은 제철과일로 매번 바뀐다고 한다. 서빙과 동시에 직접 토치질 해서 설탕을 녹여주시는데 이런 퍼포먼스 좋으네효 호지차로 만든 푸딩 위에 브륄레가 만들어졌다 👀 파르페 맛은 그렇게 특별하지 않았음,,, 파르페보단 케이크가 진짜 맛난 집이었다. 📍 연희동 르솔레이 -주소 : 서울 서대문구 연희맛로 7-29 -영업시간 : 12:00 - 19:00 (매주 월,화요일 휴무) 세번째 코스는요 마들렌천국 #르솔레이 종류가 지인~~짜 많아서 고르기 너무 어려웠음 ^^.. 그립톡 ㄱㅇㅇ 프렌치 감성 낭낭한 내부 분위기가 아늑하고 좋았다. 매장은 작은 편이고 가운데에 큰 타원형 테이블이 있고 주위에 작은 테이블 2~3개 있었나 ..? 타이밍 좋게 와서 가운데 테이블에 앉을 수 있었다 ㅎㅎ #그리너리마들렌 : 무난한 말차맛 마들렌~~ #로즈리치마들렌 : 무난한 로즈맛 마들렌~~ 리치가 정말 정말 조금 씹힘 #청양먹태마들렌 : 호기심에 골라본 신기한 맛 청양먹태 마들렌ㅋㅋㅋ 희안하게 맵고 달고 짭잘해서 맥주를 부르는 맛이었다. 다음에 포장해와서 맥주안주로 먹고싶음 #버터소금마들렌 : 고메버터, 말돈 소금, 라비다 소금 들어간 내가 고른 마들렌. 단짠단짠 내 취향 제일 맛있었다. 에스프레소랑 너무 잘 어울렸구 추가 주문한 #피스타치오갈레트브루통 무난했고 #썬드라이토마토휘낭시에 맛있었다 연희동에 예쁜 곳 증말 많더라 ~~ 점심은 걷고 걸어서 #연남동교동집 으로 ~~ 느끼함 없애주려고 매콤한 쭈꾸미를 먹어주었다 근데 여기서 끝이 아님,, 쭈꾸미 먹고 다시 시작된 2차전 .....투 비 컨티뉴드"
"연희동 카페, 연희동 디저트 보연희 생과일 파르페 케이크 맛집","주말 연희동 데이트 다녀오면서 방문한 연희동 카페 보연희. 여긴 디저트 맛집으로 유명한 곳! 복숭아파르페에 이어 무화과파르페도 맛있어 보이길래 방문했다. 주말이라 연희동 주차는 번거롭다. 근데 이날 주차운이 좋아서 공영주차장 자리 하나 남은 거 바로 주차했다. 그리고 연희동 거리 산책하며 보연희로 걸어왔다. 이렇게 예쁜 포토존도 있다! 겨울 크리스마스 시즌에 더 예쁠 거 같은 곳🫶🏻 보연희는 2층에 위치해 있어서 계단을 올라야 하는 번거로움이 있다. 매장 들어가자마자 자리부터 잡고 주문을 하러 갔다. 우리가 자리 잡자마자 갑자기 사람 엄청 많아지고 웨이팅까지 생겼다. 그리고 곧이어 디저트도 많이 품절되고 무화과파르페도 품절되었다. 주말엔 무화과파르페 금방 품절될 수 있으니 오후 3시 이전에 방문하세용! 무튼 쇼케이스에 있던 보연희 디저트들! 샤인머스캣도 커팅 준비하면 10-15분 후에 가능하다고 했다. 근데 남자친구는 초코체리다쿠아즈 먹고 싶다 해서 저걸로 먹었다. 그이는 여기서 먹을 수 있는게 거의 없었다.... 말차 무화과 이런 거 다 싫어하는 사람이라 입맛 넘 까다로워~ 보연희에서 판매하고 있는 초! 홀케이크 주문 시 구매하면 좋을 듯. 보연희 음료 메뉴! 생각보다 음료메뉴보다 엄청 다양했다. 티더 twg라 믿고 먹을 수 있는 보연희. 주말이라 그런지 역시 매장은 꽉 차있었다. 우리 들어오고 나서 금방 만석이었다. 그래서 테이블 사진은 없슈. 우리가 주문한 다쿠아즈 케이크와 음료 먼저 나왔다. 초코 체리 다쿠아즈는 비줠만 봐도 맛있어 보이쥬. 커피도 컵이 길어서 양이 엄청 많아 보인다. 역시 디저트엔 아메리카노가 진리입니다. 초코 체리 다쿠아즈에는 씨를 제거한 체리가 듬뿍 들어간다. 🍒초코 체리 다쿠아즈 : 9,000원 헉 역시 가격이 사악하네요ㄷㄷ 다쿠아즈 시트 사이에 초콜릿크림이 들어가 있고, 위에는 생크림과 체리가 올라간다. 여기 생크림 완전 부드럽고 우유맛 진해서 맛있다. 그리고 체리도 완전 새콤달콤 맛있는 체리다. 다쿠아즈 사이에 들어간 체리도 씨가 발라져 있어서 먹기 편했다. 연희동 보연희의 초코체리다쿠아즈 단면은 이런 느낌! 뭔가 보기엔 속이 뻥 뚫린 느낌인데 체리가 사이사이 꽉 차있다. 크림도 너무 과하게 들어가지 않아서 너무 느끼하지 않다는 장점이 있다. 다쿠아즈 시트는 쫀득하고 달달하고, 안에 초콜릿 크림도 느끼하지 않고 초코맛이 진해서 맛있다. 위에 우유 생크림도 부드러워서 식감이 잘 어울린다. 초콜릿 크림이 생크림보다 살짝 꾸덕해서 맛있음! 체리도 달달해서 전체적으로 맛있다🍒🍫 케이크를 먹고 있다 보면 파르페가 나온다. 지금 제철인 무화과파르페! 복숭아 시즌에 오고 싶었는데 우리가 방문한 주부턴 무화과였다. 먼저 푸딩 위에 설탕을 올려서 가져다주시고 사장님이 직접 토치로 설탕을 태워준다. 이렇게 직접 토치로 설탕을 태워주시는데 그전에 영상 찍을 준비 시간도 주신다. 설탕 타는 냄새 완전 미쳤으~~ 토치로 설탕 태워주면 이런 먹음직스러운 무화과파르페 비주얼이 완성된다. 무화과 양이 미쳤죠ㄷㄷ 진짜 올해 먹을 무화과 혼자 다 먹은 듯. 무화과 양이 엄청 많이 들어가서 무화과 진짜 좋아하는 분들만 도전하세요!! 🍹가을 무화과 파르페 : 15,800원 정말 무화과 듬뿍 들어간 파르페다. 거의 식사 한 끼 가격이죠! - 혜민농원 꿀 무화과 - 피스타치오 아이스크림 - 크렘브륄레 호지차 푸딩 이렇게 이루어진 파르페다. 완전 가을스러운 구수한 디저트라 할매입맛 저격이다. 난 원래 초딩입맛이지만 저건 다 무난하게 좋아해서 먹어봄! 호지차 푸딩은 막 탱글거리는 느낌은 아니다. 위에 토치로 태워서 그런가?? 무튼 크렘브륄레 호지차 푸딩은 달달하면서도 호지차 맛이 진해서 맛있다. 근데 식감이 좀 특이한 편! 호불호 갈릴 수도 있을 거 같다. 혜민농원 꿀 무화과는 정말 듬뿍 들어간다. 약간 흙맛이 느껴지긴 하는데 그래도 고르고 맛있다. 근데 내가 혼자 무화과 다 먹어서 나중에 혓바닥이 엄청 아렸음ㅋㅋㅋㅋ 연희동 카페 보연희 무화과파르페에 들어가는 푸딩은 요런 식감이다. 살짝 결이 느껴지는 푸딩🍮🍮 호지차맛이 정말 진한 구수한 푸딩🤎 그리고 푸딩 아래에는 피스타치오 아이스크림이 들어가 있다. 그리고 그 밑에는 인절미 크럼블이 있다. 달달구리한 인절미크럼블, 꼬숩 피스타치오 아이스크림, 호지차 푸딩까지 진짜 꼬수움 파티🤎🤎 나 초딩입맛인데도 이 조합 좋았다! 인절미 크럼블 없었으면 살짝 심심했을 거 같다. 오독오독 고소하고 달달한 크럼블이 씹혀서 맛있다! 피스타쵸 아이스크림도 완전 맛있었다. 남자친구도 원래 피스타쵸 안 먹는데 이런 꼬수운 원물맛 진한 건 좋다고 함. 꼬수움 파티 그잡채 보연희 무화과파르페! 그리고 파르페 안에 들어간 저 많은 무화과 내가 다 먹었다가 혀를 잃어버렸다..... 혀 완전 아렸음 ㅠㅠㅋㅋㅋㅋㅋㅋ 연희동카페 보연희(@beau_yeonhee) • Instagram 사진 및 동영상 팔로워 19K명, 팔로잉 178명, 게시물 2,903개 - 연희동카페 보연희(@beau_yeonhee)님의 Instagram 사진 및 동영상 보기 instagram.com 꼭 와보고 싶었던 뻥킷리스트였던 연희동 디저트 맛집으로 유명한 연희동카페 보연희! 제철과일을 이용한 보연희만의 디저트가 궁금했는데 이번에 케이크와 파르페까지 모두 먹어볼 수 있어서 좋았다. 다음에 딸기 디저트 나올 때 또 방문하고 싶은 연희동 보연희! 디저트 좋아하시는 분들 방문해 보세요🤎🤎 보연희 - 위치 : 서울 서대문구 연희맛로 17-63 2층 - 전화번호 : 070-8230-6745 - 영업시간 : 목-월요일 12:00-22:00, 라스트오더 21:30, 수요일휴무 보연희 서울특별시 서대문구 연희맛로 17-63 2층 #연희동카페 #연희동디저트 #연희동디저트카페 #연희동카페추천 #연희동디저트맛집 #연희동케이크 #연희동파르페 #연희동커피 #보연희 #연희동보연희 #연희동케이크맛집"
[연희동] 보연희 / 무화과 디저트 내돈내산 솔직후기,"안녕하세요 오랑입니다! 오늘의 리뷰는 연희동에 있는 카페 [보연희] 입니다. 연희동카페 보연희(@beau_yeonhee) • Instagram 사진 및 동영상 팔로워 19K명, 팔로잉 161명, 게시물 2,909개 - 연희동카페 보연희(@beau_yeonhee)님의 Instagram 사진 및 동영상 보기 www.instagram.com 저는 무화과를 정말 정말 사랑하는 무친자인데 우연히 인스타그램에서 파르페 사진을 발견하고 참을 수 없어서 바로 달려왔어요!! (무화과는 시즌 메뉴라 금방 없어지니까요😂 타이밍 놓치면 내년에 먹어야 함!!) 계단을 따라 2층으로 올라가면 도착입니다! 내부는 이렇습니다. 복잡복잡하고 테이블을 많이 넣어서 좀 답답해 보여요. 공간도 좁구요. 그나마 벽 쪽 테이블은 여유가 있어서 이곳에 앉았습니다! 훨씬 이쁘기도 하고~ 답답함이 덜하네요! 그럼 케이크 먼저 살펴보겠습니다. 크림과 토핑이 듬뿍 들어가 있네요. 통통하니 보기 좋습니다! 다양한 종류의 케이크가 있어서 유혹이 많았지만... 오늘은 무화과를 정복하러 왔기에 겨우 참았습니다 ㅋㅋ 다음에 도전~~~😃 귀여운 초도 있고~ 메뉴판입니다. 아이스 아메리카노 5천원 가을 무화과 파르페 1만 5천 8백원 영암 무화과 생크림 케이크 7천 8백원 주문 완료! 아이스 아메리카노 연하게 2잔과 먹고 싶던 무화과 파르페, 추가로 주문한 무화과 케이크까지 무화과 파티네요😄 주문한 음료와 디저트가 나왔습니다. 한번에 담기 어려워서 케이크만 먼저 📸 예쁘다~~ 햇살과 함께 담으니 더 예쁘네요😄😄 맛있겠쭁!!! 한번 먹어보겠습니다. 두근두근 영암 무화과를 넣어서 만들었대용 일단 비주얼 합격 위에 밤도 하나 올려져 있네요🤓 맛은 솔직히 말해서 별로였습니다. 사람마다 입맛과 취향이 다르니 참고하세요! 일단 제 입맛에는 최악이었습니다. 이유는 일단 달큰한 무화과의 단맛을 기대했는데 인공적인 맛의 바밤바 잼 맛이 너무 강해요. 그게 무화과 맛을 덮어요. 너무 달고 인공적입니다. 나는 무화과 케이크를 먹으러 왔지 바밤바 케이크를 먹으러 온 게 아닙니다!!! 무화과도 뭔가 층층이 쌓여 있는 게 많아 보이지만.. 글쎄요.. 생각보다 그리 많이 들어있지 않고 얇아서 별로 맛이 느껴지지 않았습니다. 가득 씹히는 과즙의 무화과보다는 정말... 바밤바맛.... 😨 크림도 좀 느끼했고 일단 전체적인 조화가 맞지 않아 먹는데 너무 달고 불편했습니다. 다시는 사 먹지 않겠어!! 탈락!!! 실망이야 케이크!!! 라며 아이스 아메리카노로 씻어내리려는데.... 어머나? 샷을 따로 주시네요? 연하게 시켰는데 너무 연해 보이길래 으악~ 큰일이다~ 그냥 먹어야지 뭐😂 생각했거든요. 그런데~~ 이렇게 입맛에 맞게 조절해서 먹으라고 남은 샷을 따로 챙겨주는 카페는 처음 봐요!!!! 다정해!!!! 세심해!! 친절해!!! 완전 나이스하쟈나~~?!!? (이런 디테일이 살아있는 가게 좋아함...❤️) 게다가 커피도 맛있습니다. 향긋하고 고소하고 넘 좋네요~ 제 입맛에 맞게 농도를 조절해서 먹었더니 딱 좋았어요!!! 합격!!!!! 케이크는 섭섭했는데 커피는 합격이다!! 그렇다면 오늘의 주인공 파르페는...? 짜잔~ 파르페가 나왔습니다. 위에 설탕이 뿌려져있는데 직원님이 토치를 가져와 태웁니다!!!! 어머!! 보는 맛도 있네!!?!! 우왕..... 예뿌당...❤️ 인스타에서 보던 그 디저트와 똑같이 생겼습니다. 일단 무화과 파르페는 들어본 적도 없고 먹어본 적도 없습니다. 너무 떨려요... 메뉴판에 원산지도 적어놓으셨네요..ㅎㅎㅎㅎ 혜민 농원의 꿀 무화과 피스타치오 아이스크림 크림브륄레 호지차 푸딩을 얹었습니다. 보연희만의 아이디어가 돋보이는 파르페!!! 다른 파르페는 살펴보면 맛이 상상이 가더라구요~ 제철 과일과 아이스크림이나 생크림, 바삭한 과자는 뻔한 맛이라면 이 파르페는 맛이 상상이 안 간 달까? 왜 이 조합으로 만들었을까 궁금증을 불러일으켰어요. 게다가 이 호지차 푸딩부터 심상치가 않습니다. 직접 만드셨나 봐요. 뭐야 왜 이렇게 맛있어!!!! 호지차의 고소함이 이런 거구나 느꼈던 진하고 부드러운 맛!!! ※텁텁하지 않음(이게 아주 중요) 무화과는 어찌나 달고 맛있던지 제가 기대하던 제철 과일의 참맛을 온전히 느낄 수 있었습니다. 큼지막해서 씹는데 과즙이 쫘악~~~ 무화과의 단맛이 머리끝까지 차오릅니다 ㅠㅠㅠ ㅠㅠㅠㅠㅠㅠㅠㅠㅠㅠㅠㅠㅠㅠ 달다!! 달아!!!!!! 무화과 상태가 좋으니까 이것만 먹어도 끝내주게 맛있어요. 가을을 온전히 느낄 수 있달까...❤️ 게다가 푸딩 겉면은 크림브릴뤠 상태라 바삭하게 씹히는데 식감도 좋고 푸딩은 일반적인 푸딩보단 좀 더 단단한 느낌~? 방금 내가 무화과 케이크에 실망한 집이 맞는 건가 싶을 정도로 맛의 퀄리티가 차원이 다릅니다. ❤❤❤❤❤ 게다가 이 피스타치오 아이스크림!!! 배스킨라빈스도 긴장해야 하는 진한 맛-!!! 피스타치오를 쏟아부은 맛!!! 🔥🔥🔥 이렇게 진하고 고소한 아이스크림은 처음 먹어봐요. 피스타치오의 꼬소함이 한가득 중간에 씹히니까 식감도 좋고 끝내주게 맛있네요. (금방 녹으니까 빨리 드세요!!) 물론 가격은 비쌉니다. 이 가격은 좀 에바가 아닌가...? 싶기도 한데 어디서도 먹을 수 없는 구성과 신선한 제철 과일을 듬뿍 즐길 수 있고 함께 올린 호지차 푸딩, 아이스크림의 퀄리티가 기대 이상의 맛입니다. 결국 맛있으니까 인정하게 되네요. 어디서도 먹을 수 없는 맛과 퀄리티라면 당연히 돈을 내고 찾아오게 되죠! 인스타 맛집 특징처럼 예쁘기만 하고 맛없는 거 아니야? 걱정했는데 이 파르페는 진짜 맛있습니다. 일부러 연휴에 먹으러 찾아온 건데 후회 없는 선택이네요. 정말 맛있었고 파르페는 내년에 또 먹으러 오고 싶어요. 무화과는 어찌저찌 먹어도 호지차 푸딩이랑 저 진한 피스타치오 아이스크림은 만들어 먹을 수 없으니까요..흑흑... 우리 또 만나...🍂 무화과 디저트의 신세계 인생 무화과 디저트 파르페 보연희 보연희 서울특별시 서대문구 연희맛로 17-63 2층"
