title,content
보연희 연희동 카페: 입에서 녹아내리는 맛과 건강을 느낄 수 있는 무화과 케이크의 향연,"보연희 연희동 카페는 무화과 케이크의 맛과 효능으로 유명한 곳입니다. 이 카페는 고객들에게 최상의 서비스와 최고의 맛을 제공하기 위해 항상 노력하고 있습니다. 보연희 연희동 카페의 무화과 케이크는 입에서 녹아내리는 맛으로 유명합니다. 신선한 무화과를 사용하여 만든 케이크는 부드러운 식감과 달콤한 맛이 일품입니다. 한 입 베어보면 입 안에서 녹아내리는 듯한 감각을 느낄 수 있으며, 연희동 카페에서만 맛볼 수 있는 특별한 맛입니다. 무화과는 단 맛뿐만 아니라 건강에도 많은 이점이 있는 과일입니다 ""보연희 연희동 카페: 입에서 녹아내리는 맛과 건강에 도움을 주는 무화과 케이크"" 무화과에는 다양한 비타민과 미네랄이 풍부하게 들어있어 면역력 강화와 혈액순환에 도움을 줍니다. 또한, 무화과에는 식이섬유가 풍부하게 함유되어 있어 소화를 도와주고 변비 예방에도 효과적입니다. 따라서, 보연희 연희동 카페의 무화과 케이크는 맛과 함께 건강에도 도움을 주는 최고의 선택입니다. 보연희 연희동 카페는 무화과 케이크 외에도 다양한 메뉴를 제공하고 있습니다. 신선한 과일과 샐러드, 다양한 종류의 커피와 차 등 다양한 선택지를 제공하여 고객들의 다양한 취향과 요구에 부응하고 있습니다. 또한, 연희동 카페는 아늑한 분위기와 편안한 의자가 마련되어 있어 손님들이 편안하게 즐길 수 있는 공간을 제공합니다 보연희 연희동 카페는 맛과 서비스에 최선을 다하는 데에 머물지 않고, 항상 더 나은 경험을 제공하기 위해 노력하고 있습니다. 고객들의 의견과 요구를 소중히 받아들이고, 그에 맞는 메뉴와 서비스를 개발하는 데에 최선을 다하고 있습니다. 고객들의 만족도를 최우선으로 생각하는 보연희 연희동 카페에서는 항상 따뜻한 환대와 최상의 맛을 경험할 수 있습니다. 보연희 연희동 카페는 맛과 효능으로 유명한 무화과 케이크를 제공하는 곳입니다. 입에서 녹아내리는 맛과 함께 건강에도 도움을 주는 이 카페에서는 최상의 서비스와 최고의 맛을 경험하실 수 있습니다. 보연희 연희동 카페에서 특별한 시간을 보내고 싶다면 지금 바로 방문해보세요!"
연희동 탐방 : 시오&보연희&바늘샵&포셋&챙스베리&어글리베이커리,"날씨 좋은 연희동 좋은 기억의 힘은 엄청난 것 같다. 두 달도 넘게 지난 사진인데 기다리면서 맞았던 바람과 햇빛 심지어 그 때 했던 생각까지도 또렷하게 기억난다. 망원동은 자주 갔으면서 연희동에 가볼 생각은 못 했었는지 :-) 시오 시오 앞에서 기다리면서 봤는데 주변에 예쁜 가게와 건물들이 참 많았다 ੧ᐛ੭ 이렇게 말하면 언제 지켜질지 모르는 기약이 되는 걸 알지만 다음에 천천히 걸으면서 다시 살펴보고 싶다는 생각이 많이 들었다 🚏 시오 서울특별시 서대문구 연희로11가길 23 1층 삼 삼색토리야끼 요즘에는 이렇게 차림새 있는 식탁이 좋은 거 같애 (*◡̎*)⁼³₌₃ 별거 아니어도 정성 가득해보이고 작은 식기들이 참 예뻐서 ! 특히 저 절임이 올라가있는 고양이 접시는 내가 평소에도 애용하는 귀염둥이 /ᐠ. ｡.ᐟ\ᵐᵉᵒʷˎˊ˗ 카페가 왤케 예뻐 엄청 배부르게 잘 먹고 카페로 이동🗯️ 카페 선정을 위해 매우매우 오래 고민했던 걸로 기억나는데 우리 메뉴만 보고 온 거 아녔어,,? 보연희 왤케 예뻐 (•́ɞ•̀) 바깥쪽은 보테니컬인데 안으로 들어오면 깔끔하고 아기자기해서 예뻤다 (✿´꒳`)ﾉ° 보연희 서울특별시 서대문구 연희맛로 17-63 2층 근데 케이크 맛집이야 좀 부끄러운 게 케이크 뭐 먹을지 고를 때 나 진짜 너무 배부르다고 말했더니 애들한테 그래도 먹어야된다고 혼났는데 누구보다 야금야금 열심히 먹은 거 같애 (¬‿¬) 귀엽고 맛있어보이는 케이크 왕많아 히또딴 히주 또 딴 거 먹어··· 나만 빼고 다 아아 먹어··· 이거 보니까 갑자기 생각났는데 오늘 엄마도 카페에서 다른 거 먹겠다고 3분 고민하더니 또 아아 먹었어··· 그치만 당당하게 계속 딴 거 먹는다 ༼ง’̀-‘́༽ง 이 케이크는 피스타치오 생딸기였고 배불렀는데도 매우매우 맛있게 먹었다 바늘샵 구경하기 밥 먹고 조금 구경하려고 돌아다니다가 뜨개 용품 파는 가게를 발견해서 들어갔다 ! 이때부터 시작이었을까 나의 네잎클로버 뜨기가 🧶🍀 귀엽잖아 이 때는 내가 뜰 수는 없다는 생각에 구경만 하고 왔는데 귀여운 가방이 진짜 많았다 ! 아마 지금 가면 두어개는 집어올 거 같다. 사실 이 포스팅을 하는 이유는 엽서 소품샵 포셋을 다녀온 걸 남겨두고 싶어서 (*ˊᵕˋ*)ﾉ 포셋 연희 서울특별시 서대문구 증가로 18 3층 305호 포셋 예쁘고 귀여운 엽서가 너무 많아 직접 알아보고 온 건 아니었고 내가 좋아할 것 같다고 해줘서 포셋에 오게 되었었다 ˊo̴̶̷̤.̮o̴̶̷̤ˋ 근데 진짜 한 치의 예상도 벗어나지 않고 진짜 좋았다 *.☆⸜(⑉˙ᗜ˙⑉)⸝♡.* 너무 귀엽고 사랑스러운 엽서들이 가득했다 또 가고 싶당 엽서 뿐만 아니라 펜도 팔고 있고, 엽서를 쓸 수 있는 공간도 있다. 그리고 그 모든게 다 너무 매력적으로 느껴져서 집에 가기가 싫었어 정말 철없는 엽서 새로운 곳에 갈 때마다 엽서가 보이면 꼭 사오곤 했는데 늘 예쁘고 의미있는 것만 사왔던 것 같은데 그동안 못봤던 엽서들도 사올 수 있어서 너무 좋았다 ˙ᵕ˙ 사용자가 마음을 눌러담아 쓴 글자는 하나도 없는데 제품 자체가 가진 메세지가 철없는 웃음을 짓게하는 엽서라니 ! 이건 내꺼야 다른 엽서는 사랑하는 또 소중한 사람들한테 써줬거나 써줄 예정이거나 관상용이거나 한데 이 네잎클로버만큼은 나에게 쓰고 싶었다 ( ⁎ ᵕᴗᵕ ⁎ ) 집에 와서 촉촉한 볼펜으로 꾹꾹 눌러서 쓰고 잘 봉해뒀다. 한 학기 밖에 안 쉬었지만 다시 학교로 돌아가고 시작하는 많은 일들이 너-무 힘들 때 꺼내보려고 ! 열고 싶은 순간은 많았지만 아직 내용이 기억나는 걸로 봐서 더 나중에 열어보기로 결정했다 ෆ⸒⸒⸜( ˶'ᵕ'˶)⸝ 반가워 스누피 나 혼자 두툼한 봉투를 들고 계산하는데 반가운 스누피 발견 💙 기분 좋다 챙스베리 놀러갔다 올 때마다 먹어보라구 이것저것 사갔더니 집 오면 내 손부터 보는 엄마 ( ᐛ )و 를 위하여 챙스베리에 들렀다. 근데 여기도 진짜 예쁜 가게다 (◍ᐡ₃ᐡ◍) 도로 옆이라 차도 엄청 많지만 햇볕도 잘 들고 디저트가 엄청엄청 맛있는 곳이었다 몽블랑 먹구 싶어 몽블랑이랑 솔티드 카라멜 먹었는데 고-급 디저트였습니다 🌟 망원동까지 뚜벅뚜벅 왜인지 사진이 없는데 어글리베이커리 가려고 열심히 걸어갔다 ~ 앵간 멀었지만 ? 근데 그냥 많이 걸으니까 좋았고 여기저기 구경도 다니고 재밌었다 좋은 하루였어 ദ്ദി˙∇˙)ว 2월 일상과 3월 일상과 4월 일상이 사진 셀렉된 채로 기다리고 있는데 시간 뒤죽박죽 안하고 싶어서 또 와르르 쓰는 중 ( ｣｡╹o╹｡)｣ 5월 가기 전에 2,3,4월 올린다 반드시 !!!!!"
"성공적이었던 연희동 나들이 코스 ✨️ (시오, 보연희)","보고 싶었던 친구를 오랜만에 만났던 날! 수다도 식후경이지 일단 밥부터 먹으러 갔다 시오 서울특별시 서대문구 연희로11가길 23 1층 오랜만에 찾은 연희동 시오는 변함없이 정갈하고 맛있었다 🥹 부들부들 계란이랑 짭짤한 닭고기랑 아삭한 청경채 너무 잘 어울린다 또 먹고 싶음 😇 다른 친구들은 처음 와보는 곳인데 다들 맛있게 먹어줘서 뿌-듯 그렇게 식사를 마치고 카페로 이동~~! 보연희 서울특별시 서대문구 연희맛로 17-63 2층 정말 시오 바로 옆에 있는 보연희 ㅋㅋㅋ 비가 쏟아졌던 날인데 가까워서 다행이었다 연희동 놀러 가시는 분들 시오 - 보연희 코스 추천합니다 둘 다 맛도리들임 진짜,, 👍 복숭아 얼그레이 케이크 시켜서 나눠먹었다 🍑 이게 복숭아인지 케이크인지 과일이 아낌없이 들어가 있어서 감덩.. 친구들이랑 다음에 다시 와서 과일 파르페 먹자고 다짐했다 수다 열심히 떨고 헤어지기 전에 사진 남기러 갔다 이렇게 반갑고, 즐거웠던 하루 끝! 잘 놀고 집으로 돌아왔다 버스 타고 35분 만에 도착한 집 🏡 심플하우스 영등포구청역점 서울특별시 영등포구 양산로 95 4층 고시원인데 깔끔하게 관리 잘 되는 곳이라 지내기 좋다 원룸은 연단위 계약이라 부담스러운데, 고시원은 월단위로 계약 가능하고 월세, 관리비 등 금전적 부담이 덜한 것도 장점! 이곳이 궁금하시다면 자세한 리뷰는 아래를 참고해주세여 🤗 직장인 혼자 살기 좋은 영등포 고시원 안녕하세요, 초여름입니다 😊 오늘은 영등포 쪽을 다녀왔는데요, 괜찮은 고시원을 발견해 여러분들께도 ... m.blog.naver.com 그럼 저는 또 잘 먹고 잘 지내는 일상 기록으로 돌아올게요 :D 안녕~~!"
"연희동 카페 보연희 딸기케이크 2종 맛,가격 리뷰","#내돈내산 #연희카페 #보연희 #딸기케이크존맛 누군가의 추천으로 오래전에 지도에 저장해놓았다가. 오늘 배달로 시켜 먹었다. 원래 추천 메뉴는 블루베리 케이크와 딸기 케이크였는데, 딸기케이크 2종을 시켜 먹었다. 배민에 입점해 있는 보연희. 가게 소개에 나와있는 케이크들 너무 맛있어보인다..❤️ 가게도 이쁜 것 같아서 다음에 한번 가봐야겠다. 인기 메뉴는 딸기 왕창 우유 생크림 케이크와 맛있는 초코주르륵 딸기 케이크 가격은 각 7,800원이다. 매장에 갈 경우 7,200원이다. 그래.. 수수료 있으니깐 이정도 가격 차이는 뭐., 아무튼 요즘 배민1으로 빠르게 배달 시켰음. 이시국에 외출없이 맛있는 케이크 시킬 수 있음에 감사할 뿐이다. 맛있는 딸기가 왕창 들어있어서 평이 좋은 보연희 딸기향이 향긋하다. 맛있는 딸기를 쓴것이 분명하다고 느꼈음 왼)초코주르륵 오)딸기왕창 케이크 일단 초코 주르륵 케이크는 달테니 상대적으로 덜 단 생크림부터 먹어보았다. 커피고 내리고.. 작은 크기는 아니다. 단면을 보면 알겠지만 딸기가 아주 콕콕 많이 박혀있다. 크림도 야무지게 많이 들어있음 포크로 찍었을때 딸기를 보시라.. 확실히 시트보다 크림과 딸기 위주이다. 그렇다고 시트맛이 안느껴지는 것은 아니다. 조화가 잘 맞는 것 같다. 지금 딸기철이 살짝 비껴나갔는데도 불구하고, 딸기가 달달했다. 그리고 크림은 우유크림에 살짝 달달했다. 부드럽고 맛있다 👍 그다름은 초코 주르륵 딸기 케이크. 역시 딸기가 많이 박혀 있다 커피가 아주 진하게 남았을때 먹었다. 초코 시트가 있는데 시트의 맛이 강하게 느껴지는 것은 아니고 맨 위에 초코로 덮힌 부분의 맛이 초코맛이 강하다! 초코가 맛있다 ㅠㅠ 그래서 단거 + 고급진 초코 좋아한다면 딸기 왕창 생크림보다 초코 주르륵 딸기 생크림 케이크가 더 맛있을 것이다. 딸기 왕창 생크림케이크가 좀더 시그니처 메뉴인 것 같은데, 둘다 취향의 영역이고 뭐가 더 맛있다 겨루기 어려웠다. 맛 리뷰 정리 ▪️딸기 왕창 생크림 케이크: 고소한 우유생크림과 달달하고 풍부한 딸기, 적당한 시트의 조화가 좋다 ▪️초코 주르륵 생크림 케이크: 맨 위층의 초코가 맛있다. 우유생크림에 맛있는 초코를 더한 맛 매장가 기준 7200원 인 것이 좀 비싸다 느낄 수 있지만, 맛있음..! 가게도 이쁘던데 뭐 그정도 지출이야 할 수 있단 생각이 듬 재구매 의사 ⭐️⭐️⭐️⭐️ (다음엔 딸기 철에 먹어야지!) 보연희 서울특별시 서대문구 연희맛로 17-63 2층"
[서울 연희동 디저트 카페] 디저트 맛집 보연희,푸어링아웃에 안착하지 못하고 근처 다른 카페를 찾다가 케이크 리뷰 사진 보고 홀려서 바로 고고 주택가인지라 푸어링아웃처럼 주택 개조 카페를 기대했는데 보연희는 2층에 있었다 동료가 아줌마 감성이라고 사진 안찍고 싶다는거 ㅋㅋㅋㅋㅋㅋㅋㅋㅋㅋㅋㅋㅋㅋ 그러면서 바로 카메라를 다시 꺼내들었지 찍을거면서~~ 어둡게 찍으니 느낌있는걸 아줌마 감성이라고 한거 취소해! 올라가는 길도 나쁘지 않구만! 저 문을 열고 들어왔다 테이블 10개 안되려나 작은 공간인데 거의 만석이어서 또 자리는 안찍었다 들어가자마자 보이는 ▼케이크▼가 몹시 황홀 무화과 케이크를 보고 왔기 때문에 무화과 케이크와 나는 디카페인 아아 동료는 아이스 라떼 주문 완! 디카페인 없는 카페도 많은데 여기는 메뉴가 내 마음에 듭니다 그리고 들른 깔끔한 화장실 (TMI) 화장실이 안에 있는 카페가 좋다구요! 주문한 음료와 케이크가 나왔다 커피와 케이크 샷 너무 좋다 무화과가 위에도 올려져있고 층층이 껴있다 좋다좋아 무화과는 설탕같이 달달했고 씹을 것도 없이 입에 넣으면 사라졌다 빵도 엄청 부드러워서 많이 씹을 것도 없고 크림도 맛있고 너무 달지 않은 고급진 맛의 크림 감동이야.. 디카페인 아아는 내 입맛에 딱이었다 산미와 탄맛 어느 한쪽에 치우치지 않아서 좋았다 라떼는 동료 취향이 아니라고 하던데.. 난 모르겠고! 푸어링아웃에 자리가 없어서 다행이라고 할만큼 너무 잘 찾아왔다 그리고 여기는 파르페가 유명한가보다 알았으면 파르페 시켰을텐데 들어오자마자 케이크에 눈 돌아가서ㅋㅋㅋ 옆 테이블 파르페 시선강탈 토치로 지져주시네..? 볼거리도 있고 맛도 있고 다음에 가면 파르페 먹어봐야지(´༎ຶД༎ຶ`) 홀케이크도 예약제로 팔고 있다 선물하거나 선물로 받으면 이쁘고 맛있어서 좋을듯(╹ڡ╹ ) 아무튼 뜻밖의 성공적인 카페로 보고싶어라 코스 해피엔딩 보연희 서울특별시 서대문구 연희맛로 17-63 2층
연희동 맛집 시오 + 카페 보연희,안녕하세요 오랜만에 블로그 쓰네용 친구가 자취를 시작해서 연희동 놀러갔다왔어욤 집근처 맛집으로 간 곳 '시오' 시오 서울특별시 서대문구 연희로11가길 23 1층 역에서는 좀 거리가 있지만 버스타면 가기 편하더라구용 차 막힐거같아서 일부러 지하철타구갔어욤 주차는 모르겠어요 ㅎ.ㅎ 문을 못찾아서 헤메었지만 이곳입니다 생활의 달인에 나왔나바여 역시나 어쩐지 맛나더라 근데 오랜만에 들어오니까 이 임티가 있네염 꽁짜조아 내부는 안쪽으로 깊게있고 테이블이 8~10개 정도 있는거 같았어욤 평일 저녁에 방문했는데 10~15분정도 대기하고 먹었어염 웨이팅 하는 분들 점점 많아지긴했어여 근데 웨이팅 공간이 따로 있고 깔끔해서 대기하기 좋았어요 와우 앉아서 구경하며 수다떨다보니 음식이 금방나왔어요 저는 대표메뉴인 삼색야끼도리를 시켰고 친구는 스프카레를 시켰어요 닭고기도 큼직하고 맛있고 옆에는 계란이랑 청경채가 있어욤 닭고기 아래로 매운 고추가 짱아찌처럼 있어여 밥에도 소스가 잘 저며져있어서 존맛이었어요^.^ 냠굿~ 요건 친구밥~ 친구밥엔 치즈가 올라가있네염 반찬도 가지튀김이랑 두부랑 김치~~ 샐러드랑 후식귤까지~~ 친구가 항공샷을 더 잘찍었군용 칭구야 맛나게 잘먹었엉! 친구집 가기전에 케이크를 사서 가기로했어욤 그래서 찾은 카페 보연희 사실 시오 바로 옆건물이더라구여 일층에 입간판이 있네여 큐큐 카페는 2층이에여 크리스마스 분위기로 꾸며놓은 계단을 올라가여 열심히 올라가는 칭규 카페 바로 앞도 크리스마스네여 음예뻐 칭구가 사진을 더 잘찍네염 카페 내부는 사람들이 있어서 많이 못찍었어여 쇼케이스에 케이크가 있어여 무화과 케이크로 골랐어욤 사람없는쪽으로 찰칵 그렇게 사온 무화과케이크~~ 근접사진 생크림이 엄청 달거나 하면 물릴텐데 여기는 안달고 적당히 맛있어서 계속 손이갔어욤 무화과도 부드럽고 빵도 맛있고 맛있었어요! 역시 친구가 사진을 더 잘찍네염 연희동도 이쁜 카페 맛집도 많아보여서 또 놀러가고 싶은 동네인것 같아염 친구야 새로운곳에서 행복한 일들만 가득하길!
