title,content
연희동 카페 보연희 케이크가 맛있는 곳,"계절 과일 케이크와 파르페로 유명한 보연희 피스타치오 딸기 다쿠아즈가 먹고 싶어서 딸기 시즌 끝날 것 같아서 다녀왔습니다 보연희 서울특별시 서대문구 연희맛로 17-63 2층 서울특별시 서대문구 연희맛로 17-63 2층 ✔ 운영시간 12:00 - 22:00 라스트 오더 21:30 매주 수요일 휴무 ✔ 전화번호 070-8230-6745 ✔ 주차 연희 플라자 주차장, 카카오 주차장 건물 우측 계단 2층으로 올라가면 보연희가 있어요 평소에 웨이팅이 있다고 들었는데 오픈 시간에 맞춰 웨이팅 없이 들어갔습니다 앉아서 기다릴 수 있는 의자도 준비되어 있어요 웨이팅 공간까지 신경 쓰신 느낌 푸릇한 식물들로 예쁘게 꾸며 놓으셨습니다 내부는 깨끗하고 넓은 편이고 바 테이블, 테라스까지 테이블이 여유 있는 편이에요 좀 더 자세히 보여주기 위해 동영상도 찍어봤어요 휴지와 물티슈, 손소독제도 놓여 있습니다 아기자기하게 꾸며놓은 느낌 다양한 케이크가 쇼케이스 안에 채워져 있었어요 비주얼 진짜 장난 아닙니다 돼지바 딸기 케이크 8.500원 딸기 우유 생크림 케이크 8.500원 초코 주르륵 딸기 우유 생크림 케이크 8.500원 딸기 피스타치오 다쿠아즈 9.000원 호지차바밤바갸또 8.200원 해남 꿀 고구마 치즈 케이크 8.200원 블루베리 요거트 케이크 8.500원 케이크 가격은 8000 ~ 9000원 (메뉴판) 아메리카노부터 디카페인, 에이드, 티 등 음료 종류가 정말 다양합니다 딸기 피스타치오 다쿠아즈 9.000원 아메리카노 5.000원 주문했어요 주문한 음료와 디저트가 나왔습니다 우유 생크림, 피스타치오 화이트초코 생크림, 피스타치오 아몬드 다쿠아즈, 통째로 들어간 딸기로 만들어진 딸기 피스타치오 다쿠아즈 다쿠아즈가 아래 얇게 깔려있어 부드럽고 크림도 고소하고 딸기와 피스타치오 조합이 훌륭. 피스타치오가 강한 맛이 아니라서 불호인분들도 왠지 맛있게 먹을 수 있을 것 같아요! 계절마다 바뀌는 케이크라 계절마다 궁금한 보연희 연희동에서 맛있는 케이크 먹고 싶으면 보연희 추천합니다!"
"보연희, 약과와 무화과디저트가 짱맛있던 연희동카페","ᴄ ᴀ ғ ᴇ 보연희 요즘 가을철이라 무화과디저트카페들이 완전 핫플로 떠오르고 있는데요! 그 중에서 연희동에 있는 보연희 카페는 무화과 파르페로 핫한 가게입니다 >_< 무화과파르페와 복숭아디저트 먹으러 갔는데 복숭아는 더이상 안 나오고 대신 약과샌드가 있어서 시켰는데 약과샌드 대존맛탱....❤ 무화과 비쥬얼도 미쳤져!!! 보연희 서울특별시 서대문구 연희맛로 17-63 2층 보연희 #연희동카페 #보연희 #무화과디저트 #무화과카페 *제철과일디저트 *매주 수요일 휴무 *홀케이크 예약가능 저녁먹고 늦은 시간에 갔더니 사람이 별로 없는 편이였어요! 연희동에는 10시까지 영업하는 카페가 드문데 다행히도 늦은 시간까지 영업해서 늦은 저녁 먹고 방문할 수 있었습니다 :> 보연희 내부 깔끔하게 정리된 느낌의 카페 보연희 내부! 테라스 좌석도 있었는데 이 날 비가 와서 넘 춥더라구요,,,8ㅅ8 날씨 좋을 때는 테라스에 앉아서 무화과파르페를 즐기면 딱일 꺼 같은데 그러기엔 요즘 너무 급격하게 추워졌죠...? 메뉴판 연희동 보연희는 제철과일을 이용한 케이크로 케이크 종류가 다양해서 넘 좋더라구요!!! 밥먹고 간 데다가 파르페만 아니였어도 케이크 하나 시켜보는 건데,,, 다음에 케이크 한 번 먹어보고 괜찮으면 기념일에 홀케이크로도 사보고 싶은 비쥬얼❤ 그리고 세상에나^_^ 놀랍게도,, 오랜만에 메뉴판을 안 찍었습니다 커피종류는 다양하지 않았지만 대신 논커피인 에이드, 밀크티 종류가 많았고 파르페와 신메뉴인 약과샌드가 있었습니다 (최근에 다녀와서 기억력 좋은 상태!) 보연희, 무화과디저트 연희동 맛집 무화과파르페 ￦15,000 약과샌드 ￦5,000 밀크티 ￦6,000 (기억력의 오류가 있을 수 있음 주의) 복숭아파르페가 먹고 싶었는데 이제 안 나온다고 하시더라구요 8ㅅ8 넘나리 아쉽,,, 근데 여기 약과샌드 맛집,,,,진쨔,,,존맛탱❤ 요즘 너튜브세상에서 약과디저트가 그렇게 핫하다는데 빵정은 처음이거든요! 아무리 쪼개려고 해도 쪼개지지 않는 약과 ^_^......... 약과+아이스크림의 조합인데 약과가 안 잘라지더라구요ㅠㅠ... 그래서 결국 손으로 들고 한쪽씩 아이스크림 발라서 먹었는데 진짜 짱맛있어요!!!!!!!!! 친구가 약과샌드 계속 생각난다고 다음날도,,,그 다음주도,,,또 가자고,,,,,허허,,, 무화과파르페는 받자마자 엄청 묵직하고 사이즈가 커서 맘에 들더라구요! 파르페치고도 비싸다 생각했는데 무화과가 듬뿍이라 가격 인정했습니다 >_< 아이스크림이였는지 생크림이였는지... 근데 생크림이 맞는 거 같아요!! 무화과가 진짜 가득해서 쌓여있고 옆에 꽂혀있는 과자가 넘 맛있더라구용 >_< 무화과 껍질이 좀 쓴맛이 있어서 껍질 떼고 먹기는 했는데 달달하니 무화과디저트맛집 인정~! 저는 밀크티를 좋아하지 않아서 오로지 친구 몫 ^_^ 맛평가 불가넝........ 가을맞이 무화과디저트 연희동 카페, "" 보연희 "" 무화과의 계절답게 연희동에 무화과디저트 카페가 많더라구요!!! 생무화과를 맘껏 즐길 수 있었지만 무화과 껍질에 살짝 씁쓸한 맛이 있어서 조금은 아쉬웠어요! 근데 약과샌드 진쨔 존맛탱...❤ 약과디저트가 맛있다고 듣기는 했었는데 아이스크림이랑 먹으니까 약과 짱맛있어요! 약과 자체도 바삭바삭 맛있더라구용 >_<"
"연희동 ""보연희"" 피스타치오디저트 맛집","#보연희 #연희동 #연희동카페 #연희동맛집 #피스타치오디저트 보연희 아마도 사장님 성함을 따서 만드신 듯한 카페 이름! 연희동 카페 항상 만석으로 연희동 핫플로 꼽자면 또 보연희지요 음료 메뉴 한번 봐주시구요~ 여기서 음료는 아메리카노만 마셔봄ㅎㅎ 그리고 이날의 목적은 딸기파르페(12월) 지금은 망고파르페가 나온다 (5월) 음료 메뉴로는 티 종류도 있구요 사실 티가 가장 무난한데 특히 저 오설록 티 ㅠㅠ 나 맨날 마시는거라 진짜 커피 마시는게 이득이여 디카페인 티도 나눠져있구요 음료 메뉴는 세가지 메뉴판이나 있어서 다양하게 고를 수 있다!! 요 비쥬얼 때문에 왔지요 딸기파르페 여름엔 복숭아파르페도 아주 핫하다 복숭아가 통째로 들어가있던걸루 기억 진짜 생크림 그 자체 근데 이 날 딸기가 조끔 아쉬웠다ㅠㅠ 역시 과일은 복불복이여 안에 딸기슬러쉬? 상콤하고 시원한 게 들어 있었다 두번째 방문 언정쓰랑 이날 언정이와 나는 피스타치오로 대동단결 앞에는 피스타치오맘모스케이크 뒤에는 왼쪽부터 피스타치오갸또 피스타치오다쿠아즈딸기 뭐 이름이 정확하진 않는데 아무튼 여기서 핵심은 우린 다 피스타치오 골랐다는 점 크기가 엄청 크진 않아서 아아와 함께라면 둘이서 케이크 세조각은 거뜬 (은 난 막판에 너무 느끼했다..ㅎㅎ늙은이) 요거 진짜 꾸덕하고 피스타치오 맛 진한데 아는 맛있는 맛 요 피스타치오는 좀 더 크리미한데 다쿠아즈가 엄청 겉 빠아아짝 속은 쫀득했다 언정인 이게 독특하고 제일 맛있다고 함 요것도 아는 맛있는 맛인데 특이하게 피스타치오페이스트가 치즈케이크 안에 쏙쏙 들어 있었다 ! 다양한 케이크 그리고 계절과일로 파르페로 유명한 보연희 연희동 카페 보연희 후기 끝 빵떠기(@bbang.__.dduck) • Instagram 사진 및 동영상 팔로워 62K명, 팔로잉 289명, 게시물 1,951개 - 빵떠기(@bbang.__.dduck)님의 Instagram 사진 및 동영상 보기 instagram.com"
[연희동] 보늬밤케이크가 맛있는 연희동카페 보연희,사실 나 작년 이 맘때 연희동카페 보연희 다녀온 것 같다. 묵히고 묵혀둔 포스팅이랄까ㅋㅋㅋㅋ 연희동카페 중 밤케이크가 맛있는 집을 단연 꼽으라면 보연희 라고 자신있게 말할 수 있다. 그 정도로 인기도 많고 맛있다. 그 외에도 다른 케이크와 디저트도 맛있다는데 하지만 난 밤케이크에 꽂혔고! 이 때 당시 약과디저트가 있었기에 먹어봐야한다면서 그것도 주문했다. 주문한 디저트들이 나왔다. 2명이서 음료를 하나만 시키고 디저트에 파르페까지 주문했는데 진짜 돼지인줄^^ 케이크 안에 밤이 들어있는데 그 겉을 감싸는 무스가 넘 부드럽고 맛있다. 달달하면서 촉촉한데 깊은 밤맛이 나서 진짜 넘 싸가지고 가고 싶은 맛이다. 약과는 먹을 때 딱딱했던 걸로 기억한다. (넘 오래되서 기억이 가물거리지만 먹기 힘들었던 건 선명하다) 난 그냥 케이크로 추천!! 파르페에 딸기가 가득 얹혀있다. 연희동카페 보연희 밤케이크만 유명한게 아니라 딸기파르페도 유명해서 주문했다. 크림이 달달하고 아래에 퍼먹을만한 과자 부신게 들어있는데 파르페 안에 중간중간 씹을게 들어있었으면 좋았겠다 싶다. 밀크티는 우리가 아는 그 맛!!! 달달하고 맛있다. 연희동카페 보연희 에서는 밤케이크 무조건 추천!!ㅋㅋ이거 하나는 꼭 시키고 다른 음료와 디저트 먹어볼 것! 보연희 서울특별시 서대문구 연희맛로 17-63 2층
"[서대문/연희동] 보연희, 여름에 어울리는 복숭아 파르페와 진한 원물 맛 피스타치오 갸또!","보연희 ● 영업시간 월,화, 목~일요일 12:00~22:00 수요일 휴무 보연희 서울특별시 서대문구 연희맛로 17-63 2층 ● 방문 일자 및 주문 메뉴 2023. 6. 29. 복숭아 파르페 (13,500원) 피스타치오 갸또 (8,200원) ● 지극히 주관적인 만족도 및 느낌 과일 파르페와 케이크가 맛있는 카페, 연희동 카페 보연희 복숭아 파르페 물렁물렁한 백도, 크림, 아이스크림, 그래놀라 구성 복숭아 철 가기 전에 먹어봐야 할 구성 요소가 서로 잘 어울렸던 파르페 피스타치오 갸또 피스타치오 원물 맛이 잘 느껴졌고 크림, 케이크 등의 단 맛이 강했고 질감은 부드러운 편이었음. 피스타치오 디저트 좋아하시는 분이라면 좋아하실 맛 ● 본격 리뷰 연희동은 교통편이 좋지 않아 자주 오는 동네는 아닌데, 맛있는 빵, 디저트 집이 많음 연희동의 마스코트 같은 이름을 가지고 있는 카페 보연희는 2층에 위치 계단 타고 올라가면 2층에 위치 카페 옆으로 3층으로 올라가는 계단이 보이고 웨이팅 대기 공간도 보이고 보연희 입성 거의 한눈에 보이는 카페 내부 입구 앞에 바로 보이는 바 테이블 입구 근처에 물과 컵이 비치 카페 안쪽 자리는 창가 뷰가 있어 좋음 비 오는 날이라 해가 강하게 들어오지 않았는데 화창한 날 오면 뷰가 아주 좋을 듯 주문 카운터 카페 이용 제한 시간이 있지만 빵빵한 와이파이도 있음 케이크 맛집답게 쇼케이스에 케이크가 비치 복숭아 자두 우유 생크림 망고 우유 생크림 피스타치오 갸또 살구 브릘레 치즈 케이크 호지차 바밤바 갸또 디저트 주문 여부와 상관없이 일인 일음료 시켜야 함 다양한 음료가 있고 시그니처 과일 파르페도 있음 주문하면 진동벨을 주고 카운터에서 디저트를 수령 복숭아 파르페와 피스타치오 갸또 ● 복숭아 파르페 음료로 주문한 복숭아 파르페부터 먹어보자 여름 시즌 메뉴인 복숭아 파르페 복숭아의 물렁 부드러운 식감이 좋음 복숭아 다 먹고 나면 나오는 아이스크림과 그래놀라 1부 복숭아, 2부 아이스크림, 그래놀라의 두 가지 다른 구성으로 이루어진 파르페 뭔가 예상이 가는 맛이지만 맛있었던 맛 ● 피스타치오 갸또 피스타치오 디저트 좋아한다면 지나치기 쉽지 않은 디저트 부드럽고 달달한 피스타치오 크림 피스타치오 원물 맛이 꽤 느껴지면서 단 맛도 같이 올라옴 부드러운 질감의 케이크 연희동에서 케이크 맛집과 색다른 파르페를 찾는다면 보연희!"
연희동 디저트카페 보연희에서 딸기케이크가 유명한 곳,"보연희 주소 서울 서대문구 연희맛로 17-63, 2층 전화번호 070-8230-6745 영업시간 12:00 - 22:00 매주 수요일 정기휴무 보연희 인스타그램 연희동카페 보연희(@beau_yeonhee) • Instagram 사진 및 동영상 팔로워 18K명, 팔로잉 186명, 게시물 2,818개 - 연희동카페 보연희(@beau_yeonhee)님의 Instagram 사진 및 동영상 보기 www.instagram.com 딸기케이크 딸기파르페가 유명하다는 연희동 디저트카페 보연희에 다녀왔어요! 홀은 ㄱ자구조로 테이블은 8개정도 있었던 것 같아요 <연희동 디저트카페 보연희 메뉴> 차를 팔아서인지 음료 종류가 꽤나 많았어요 메뉴판에 디저트는 3가지밖에 안써있지만 쇼케이스에서 케이크를 고를 수 있어요 전 파르페만 보고 방문했기때문에 쇼케이스보지도않고 파르페를 이미 주문했지만 막상 케이크를 보니 케이크도 먹고싶었어요ㅠㅠ 포장해갈까했는데 들고돌아다니기싫어서 패쑤.. 바닐라라떼 6,000원 잉글리쉬 블랙퍼스트 (tea) 6,000원 딸기파르페 16,500원 친구가 마신 바닐라라떼 꽤 큰 컵에 담겨나와 양이 많은 것 같아요! 원래 에이드파인데 탄산 좀 줄여보자하고 주문한 티에요 TWG 티였고 저 작은 그릇은 왜 주나했는데 티백 놓는 거라고 하더라구요ㅋㅋ 파르페파는 곳이 잘 없잖아요 (캔모아 다시 흥했으면ㅠㅠㅠ) 그래서 엄청 기대하고 방문했는데 제가 너무 옛날 파르페를 기대했던탓인지 기대만큼은 아니었어요..! 딸기와 생크림안에 딸기레몬샤베트가 있고 그 아래 통밀크럼블이 있는데 따지고보면 다 맛은 있어요 딸기도 좋은 딸기 사용하시는 것 같고 생크림도 맛있고 샤베트도 통밀크럼블도 맛있은데 샤베트랑 통밀크럼블이 너무 적었어요 통밀크럼블이 중간에도 좀 있었으면 맛과 식감 모두 더 살아났을텐데 아래에만 조금 깔려있었거든요 ㅠ 맛은 있었지만 조금 아쉬웠던 부분이에요.. 결론은 파르페도 맛있지만 그 가격이먼 케이크를 2개 먹는다! 에요 그래도 생크림을 먹어보니 케이크맛집이 맛는 것 같아요 다음엔 가서 케이크를 뿌시고오겠어요 🫡 보연희 서울특별시 서대문구 연희맛로 17-63 2층"
연희동 “보연희”,"마디스 - 보연희 코스 추천 , 다만 배터질 수 있음 아직 트리가 있군 보자마자 입이 떡 벌어지는 비주얼 … 혼자 딸기 파티 즐기기 단독샷 무조건 찍어야하는 비주얼임 딸기파르페 딸기와 크림 , 딸기소르베 , 크럼블 대충 요렇게 구성되어있음 일단 안에 딸기소르베는 상큼달달한맛이고 인위적인맛이 없어서 좋았음 근데 처음에 먹었을땐 소르베인 줄 몰랐음 왜냐면 소스마냥 다 녹아있었거든요,, 근데 안쪽부분은 약간 사각거려서 소르베라는걸 알아차렸음 맛 자체는 괜찮았음 위쪽에 딸기를 고정시켜놓은 크림은 달달한 생크림맛임 생크림이랑 소르베는 질감 자체가 달라서 잘 어울릴까 걱정했는데 다행히 생크림이 딸기소르베의 맛이나 식감을 해치지않아서 좋았음 근데 가장 중요한건 딸기가 맛이 없음 … 달달한것도 아니고 상큼한것도 아닌 애매한 달달상큼에 떫은맛이 더해진 느낌 ..? 그니까 맛있는건 아닌데 맛없는것도 아닌 밍밍한 맛임 솔직히 이런 메뉴는 부재료보다 원물맛이 중요하다고 생각하는편이라서 좀 아쉬웠음 딸기 우유 생크림 케이크 일단 시트는 퐁신촉촉하면서 가볍게 부드러웠음 약간 달달한맛도 느껴지는데 제누와즈에 바른 시럽맛인거같음 크림은 우유생크림이고 우유 특유의 비린내 없이 아주 깔끔한 느낌의 유지방맛이라서 좋았음 무엇보다 담백한 크림이 아니라 달달한편에 속하는 크림이라는점이 가장 맘에 들었음 안에 딸기도 생각보다 많이 들어있는데 그렇게 달지는 않았음 … 그래도 크림이 달달해서 같이 먹으니까 맛있었음 호불호 안갈릴듯한 맛임 피스타치오 약과 여기 약과가 진짜 완벽하게 제 취향입니다 전 쫀득하고 꾸덕(?)한 약과는 별로 안좋아하거든요.. 겉은 아주 약간 쫀득하면서 빠삭하고 속부분은 두꺼운 페스츄리과자처럼 결결이 바삭한 페스츄리 약과를 좋아하는데 여기가 페스츄리 약과의 정석인듯함 달달빠삭한게 넘 맛도리 … 겉에 달달한게 발려있는데 이게 찐덕거리는 조청 느낌이 아니라 달고나처럼 바삭한 느낌이라서 좋았음 약과 사이에 아이스크림은 깔끔한 우유아이스크림에 피스타치오를 갈아서 넣은맛임 깔끔하게 고소함 ! 아이스크림 자체에서는 피쵸맛이 그렇게 진한건 아닌데 바닥부분에 피쵸가루랑 분태가 많이 깔려있어서 같이 먹으면 피쵸 특유의 꼬소함이 진하게 느껴짐 역시 내 기준 보연희 베스트는 약과인듯 … 약과 넘 맛도리 평생 먹을 딸기를 다 먹은 기분임 파르페가 비주얼에 비해 맛이 좀 아쉬웠지만 오늘 수급된 딸기가 별로였구나 ~ 이렇게 생각하려구요 하튼 제 베스트는 언제나 약과 보연희 서울특별시 서대문구 연희맛로 17-63 2층"
연희동 보연희 회동 후기,"INTRO. 연희동 씨케이브에서 점심 먹고 난 후, 그곳에서 바이또하는 용세 지인의 추천을 받아 연희동 보연희에 방문했다. 몽블랑이 맛있다고 해서 방문했는데 정작 몽블랑은 안 먹고 음료만 쥬문 후 대화 삼매경에 빠졌다는 ㅋㅋㅋ 객단가 ㅎㅌㅊ 손님은 우리를 일컫는 게 아닐까? 연희동 보연희 위치/ 영업시간 보연희 서울특별시 서대문구 연희맛로 17-63 2층 연희동 '사러가'가 있는 골목을 따라 쭉 들어오면 보연희가 있다. 간판이 다소 작아서 그냥 지나칠 수 있으니, 사러가를 기점으로 보연희에 방문하는 사람들은 필히 왼쪽을 살펴보며 걸어가시길 추천. 짠 이렇게 네모난 간판이 여기 '보연희'요 하고 손님을 반긴다. 이곳도 크리스마스 시즌이라 그런지, 빨간 포인세티아 화분과 트리로 장식되어 있었다. 크리스마스만의 몽글몽글한 분위기를 좋아하는 사람이라면, 입구에 당도하자마자 맘에 쏙 들겠다고 생각. 보연희의 영업시간은 위와 같다. 매주 수요일은 휴무이고 12시에서 22시까지 영업한다고 한. 2. 보연희 메뉴/ 내부 보연희는 널찍한 공간과 테라스가 특징인 카페이다. 인테리어에 힘을 주지는 않았지만, 연희동 구경 다니다가 카페에 잠시 쉬고 싶을 때 들르긴 딱 좋은 공간이라고 생각했다. 천장도 개방형이라서 시원한 느낌이 들기에, 이곳에서 공부하기도 좋겠다고 생각했다. 우리는 딱 오픈 시간에 방문했고 1시 조금 넘어서 나왔는데, 이때까지 우리를 포함해 약 3-4팀 정도가 있었다. 점심 시간대에는 사람이 적은 것 같으니, 점심 시간대에 조용한 카페를 찾는다면 보연희 추천한다. 보연희 메뉴와 갸격은 윗사진을 참고하시라. 3. 보연희 음료 기무라는 따아, 나랑 용세는 쇼콜라 라떼를 시켰다. 맛은 쏘쏘.. 이건 용세가 졸업 사진 찍으면서 선물 받은 아베베 빵인데, 이날 나랑 기무라한테도 선물해 줬다. 달달한 게 정신 팍 들게 해주는 맛이었다. ㄸanks 용세. OUTRO. ""그대들은 어떻게 살 것인가?"" 해석을 시작으로 지브리 영화 전반에 대한 평론, 진로와 가까운 시일 내 하고 싶은 일들에 관해 도란도란 이야기했던 알찬 시간이었다. 평일 점심에 이렇게 여유를 즐길 수 있는 날이 인생에 얼마나 있을까 생각해보니, 더더욱 소중했던 시간이라 생각. 12월 와인 파티를 고대하며, 딱대 회동 이것으로 끝. 병아리가 쓴 글이 더 읽고 싶으시다면? https://blog.naver.com/bbiyakbbibbiyak/223264768283 시험 끝나고 한가 한강? INTRO. 지난했던 중간고사 기간을 마치고 모처럼의 여유가 찾아왔던 10월 말 - 11월 초. 송도에서 카... blog.naver.com https://blog.naver.com/bbiyakbbibbiyak/223207494224 여주 해슬리 나인브릿지 여름 방학 여행 INTRO. 제일제당에 다니는 지인이 있다면 그를 붙잡으시오. CJ 임직원 혜택으로 깔끔하고 단정하게 ... blog.naver.com"
디저트맛집 연희동카페 보연희 | 다양한 케이크가 있는 곳,"연희동 케이크맛집 카페 보연희 12:00 - 22:00 (off 수요일) 동생이랑 남편이랑 어디갈까~~ 하다가 요기 케이크가 맛있다고 해서 찾아왔다! #연희동케이크맛집 #연희동디저트 카페는 생각보다 넓었는데 테라스도 문이 열려있어서 더 시원해보였다!! 테이블은 다 이런 조그만 원테이블! 두세명이 오기 적당해보임 ㅎㅎㅎㅎ 테라스도 나가봤는데 의자 두개뿐이라 우리는 패스☺️☺️ ㅎㅎ 근데 엄청 편해보인다!! 강제로 앉혀진 오빠 ㅋㅋㅋㅋㅋㅋㅋㅋ 근데 요기 뷰는 별거 없다. 🤣 동태찜집 뷰.. ㅠㅠㅎㅎㅎㅎㅎ 우리는 내부에 자리를 잡았다!! 테이블이 다 나무질감이 강해서 음료가 반듯하게 놓여지지가 않아서 불안했음 ㅠㅠㅎㅎㅎㅎㅎ 케이크 종류가 꽤 다양했다!! 은근 크고 비싸고 맛있어보임ㅎㅎㅎ🖤🖤 고민하다가 베스트 붙은 것중에 고르기로!! 호지차 바밤바갸또!! 나는 호지를 엄청 좋아하는데🖤🖤 이런데에 들어간 밤은 또 별로 안좋아해서.. 😅 고민하다가 그래도 특이한 것 같아서 주문했다! 베스트는 아니지만 옆에 있는 얼그레이 케이크도 먹어보고싶다. ㅎㅎㅎ 케이크 말고도 초가 다양하니 많아서 급할때 여기오면 되겠네 싶었다. 😆 order 아이스 아메리카노 4,500원 아이스 바닐라라떼 5,500원 녹차연유라떼 5,500원 호지차 바밤바갸또 8,500원 요게 8,500원이라니 너무 비싼 케이크 근데 크기가 은근 크고 토실하다!! 😆 그리고 글루텐프리! 호지 맛 10% + 밤 맛 10% 갸또맛 80% ㅋㅋㅋㅋㅋㅋ 호지 좋은데 밤 싫다고 고민할게 아니었다 ㅎㅎㅎ 요곤 초코케이크!! 그럼 어때 짱 맛있었다. 🖤 취향이 다 달라서 알록달록한 음료들 녹차라떼 달달하니 맛있었다. 💚💚 주말인데 여유로워서 좋았다! 뒤에 일정이 있어서 오래 못있었는데ㅠㅠ 기사분들이 꽤 많이 왔다가시는 거 보니까 배달로 많이 이용하는 것 같았다. 😆 #내돈내산 #연희동카페 #보연희 동네에 이런 카페가 있는 줄 몰랐는데! 다음에 얼그레이케이크 먹으러 와야지 🖤🖤 보연희 서울특별시 서대문구 연희맛로 17-63 2층"
