title,content
연희문화살롱 밴드조 공연관람 : 가수 황명하님과 마담샹송,"연희문화살롱 밴드조 공연관람 : 가수 황명하 님과 마담샹송 서대문구 연희동에는 연희문화살롱 이라는 공연 및 식사를 겸할 수 있는 문화공간이 있습니다. 수시로 다양한 공연이 이루어지는 곳이고, 다양한 장르의 음악고수분들을 만나 볼 수 있는 공간입니다. 50m © NAVER Corp. 연희문화살롱 서울특별시 서대문구 연희로 89-12 2층 201호 블루스맨이 오래전부터 알고 지내는 후배 밴드조 공연이 있어서 시간 내어 찾아갔습니다. 밴드 조 밴드조를 알게 된건 꽤 오래전입니다. 여러 장르의 음악을 하고 몇번의 멤버 교체를 거치고 난 후 지금의 밴드조가 완성됐습니다. 장르는 코리안 블루스라고 보시면 이해가 쉬울 것 같습니다. 밴드조를 이끌고 있는 철이가 워낙 음악적으로 조예도 깊은데다가 음악적인 감각이 매우 뛰어 납니다. 전국으로 쉬지않고 공연을 다니면서도 꾸준히 작곡을 하는 것 보면 참 대단하다는 생각을 갖습니다. ▲▲▲ 밴드조의 배철 밴드조 공연 밴드조의 노래는 참 재미있습니다. 어떻게 그런 생각을 했을까 할 정도로 재미있습니다. 노래속에 삶이 녹아 있습니다. 중간중간 건반을 맡고 있는 영미가 장기자랑을 하면서 공연의 흥을 더해줍니다. ▲▲▲ 밴드조의 영미 밴드조는 2인조 그룹입니다. 2인조 이지만 사운드는 매우 풍부하게 나옵니다.기타와 건반으로 이루어 졌지만 건반이 베이스 리듬을 함께 연주하기 때문에 소리가 꽉차게 들립니다. 영미의 건반 연주실력은 상당히 뛰어 납니다. 밴드조 공연 재생 32 좋아요 0 00:00 00:13  접기/펴기 연희문화살롱에서 밴드조공연 ▲▲▲ 밴드조의 철이와 영미 ▲▲▲ 밴드조의 영미의 개인기 가수 황명하 그리고 숨은 음악고수 연희문화살롱은 가수 황명하 누님이 운영하는 문화공간입니다. 수시로 직접 노래를 부르시고 많은 음악관련 지인들을 초대해서 함께 공연도 합니다. 유명한 기타리스트 김광석님을 비롯하여 각자 한 분야에서 경지에 오르신 숨은 고수분들을 만나 볼 수 있습니다. ▲▲▲ 가수 황명하 님 블루스맨이 갔을 때는 마담샹송님의 샹송을 들을 수 있었습니다. 오랜만에 듣는 에디트피아프 빠담빠담(Padam Padam), 귀에 익숙한 샹송이 감미롭습니다. 마담샹송님의 노래는 연희문화살롱에서 자주 공연을 하시니 방문하신다면 들으실 수 있을 겁니다. ▲▲▲ 멋진 샹송을 부르시는 마담샹송 님 마담샹송 빠담빠담 재생 0 좋아요 0 00:00 00:00  접기/펴기 마담샹송님노래 빠담빠담 에디트피아프 아직은 인디밴드이고 아직은 잘 알려지지 않았지만, 실력만큼은 최고라 할 수 있는 뮤지션들 입니다. 얼마전에는 기타의 신 하타슈지님이 공연을 하셨네요 블루스맨"
연희문화살롱 샐러데이즈 넘 맛있는 샌드위치와 샐러드,"연희문화살롱에서 런칭한, 달콤한 건강을 담은 샐러데이즈 샌드위치와 샐러드를 먹고 왔어용~: )♡ ❤ 샐러데이즈 샌드위치 맛있는 야채와 건강이 가득한 샌드위치 구운 신선야채가득 샌드위치 피스타치오 수비드닭가슴살 샌드위치 두부웰빙 샌드위치 스트릿 반미샌드위치 연희 문화살롱 샐러데이즈 ❤ 샐러데이즈 샐러드 건강과 상큼함을 담은 샐러드 훈제오리 샐러드 연어 프레쉬 샐러드 왕새우 샐러드 리코타치즈 샐러드 목살스테이크 토마토 샐러드 생명 샐러드 구운버섯 샐러드 그린 샐러드 수비드 닭가슴 샐러드 보기만 해도 먹고싶죠?^^ 넘 아름다운 연희문화살롱 샐러데이즈 윤혜경 대표님 샐러데이즈 와 선물한 캘리그라피 액자 샐러데이즈 윤혜경 대표님과 한컷 밤에도 반짝반짝 예쁜 연희문화살롱과 샐러데이즈 신선함과 건강을 함께 생각하는 샐러데이즈 샌드위치와 샐러드는, 양도 푸짐하고,착한가격에다 한끼 식사로도, 여성분들 다이어트 식사로도 충분한듯해요~^^ 물론, 칼로리 걱정도 적겠죵? 오늘, 연희 문화살롱 샐러데이즈 맛보러 가실래요? 50m © NAVER Corp. 연희문화살롱 서울특별시 서대문구 연희동 188-79 #연희문화살롱 #연희동맛집 #샐러데이즈연희점 #샐러데이즈 #달콤한건강 #다이어트음식 #맛있는샌드위치 #맛있는샐러드 #소소한일상 #소소한행복 #감사한하루"
"연희동 핫플 투어 : 매뉴팩트커피, 하우스오브연희, LP샵, 피터팬1978, 유어마인드, 데스툴, 우동카덴)","안녕하세요~ 좋아진혜예요:) 서울 연희동 핫플 투어하고 왔어요~ 감성 가득한 연희동 너무나 매력적 ! 연희동 감성 핫플 코스 소개합니당~! 연희동 핫플 투어 #연희동 #연희동핫플 #연희동카페 매뉴팩트커피 서울특별시 서대문구 연희로11길 29 매뉴팩트커피 처음 와본 사람 사실은 연희동을 처음 와본 사람:) 연희동 좀 많이 멋진 듯! 커피부터 한 잔 하고 시작합니둥~ 사진으로 볼 때 작은 줄 몰랐습니다만 규모는 작지만 감성 가득함~ 연희동 방앗간 그 잡채:) 플랫화이트 1등답게 고쑵고 맛있네요~ 잘 먹고 갑니당~!! 연희동은 길거리도 예쁘네? 진짜 너무 예쁜 연희동 하우스오브연희 서울특별시 서대문구 연희로11가길 8 복합문화공간 하우스오브연희 하필 브레이크 타임ㅋㅋㅋ 아쉽지만 안녕~ 하우스오브연희 건물의 반지하? 공간에 LP샵이 있어 들렸어요~ 레트로 그 잡채ㅠㅠㅠ 사장님 매우 친절하셨어요! 노래 듣고 가라고 듣고 싶은 LP 찾아오라고 하심 ! 김광석 듣고 싶었지만 LP 못 찾아서 눈에 띈 LP 이런 감성 사랑하는 나인걸요ㅠㅠ 너무 좋았던 시간 연희동 나들이 : 하우스오브연희 LP샵 재생 14 좋아요 5 00:00 00:16  접기/펴기 연희동 나들이 : 하우스오브연희 LP바 여름은 싫지만 예뻐서 사랑하는 계절 이 사진이 여기였구나~ 날씨도 너무나 사랑스러웠던 하루 귀여운 자판기도 있던 곳 유어마인드 서울특별시 서대문구 연희로11라길 10-6 2층 우측 독립서점 유어마인드 사랑스러운 곳ㅠㅠ 여기가 여기예요!!! 이 뷰ㅠㅠㅠ 너무 예뻐 햇살 맛집이고 감성 맛집이고 다하는 곳 ! 패키지가 너무 사랑스러운 곳! 유어마인드~ 패키지가 이렇게 귀여우면 뭐라도 사고 싶죠~ 친구 선물 샀어요:) 피터팬1978 서울특별시 서대문구 증가로 10 연희동 핫플 왜 이렇게 많은 거예요ㅠㅠ 가는 곳마다 다 핫플ㅋㅋㅋ 피터팬1978도 여기 있었어요 블루리본 맛집~ 여기 팥빙수 먹고 싶었는데 포장밖에 안 되는거 조금 아쉬웠어요ㅠㅠ 데스툴 서울특별시 서대문구 연희로25길 98 2층 연희동 카페 데스툴 여기서 뭔가 작업하면 작업 잘 될 것 같은 카페ㅋㅋ 재미있는 공간이 많은 연희동 재택근무 하기 좋은 카페ㅋㅋ 잘 머물다 갑니당~!! 길도 이렇게 예쁘면 연희동에 살고 싶죠.. 서울살이는 꿈 꿔 본 적 없지만 연희동은 살아보고 싶었어요? 우동카덴 서울특별시 서대문구 연희로 173 거화빌딩 1층 정호영 셰프의 우동집 우동카덴 여기 처음 왔어요~ 맛집답게 블루리본도 있고 미쉐린가이드 맛집 브레이크타임 마치고 오픈런 했더니 바로 들어갔는데 잠깐 지났더니 바로 웨이팅 걸렸어요~ 줄 서는 맛집이구먼~ 후토마키 2피스 주문했어요~ 한 피스는 꼬다리 주셨어요:) 카키아게 붓카게우동 면빨 탱글탱글 쫄깃쫄깃~ 멘타이코 크림 우동도 하나 시키구요~ 가라아게도 시켜봤어요~ 가라아게 빼고는 다 괜찮았어요~ 가라아게는 맛있는 곳 많으니까:) 카키아게에 함게 나온 튀김이 진짜 예술이었답니당 연희동 핫플 투어 : 매뉴팩트커피, 하우스오브연희, LP샵, 피터팬197 재생 5 좋아요 4 00:00 00:12  연희동 핫플 투어 : 매뉴팩트커피, 하우스오브연희, LP샵, 피터팬197 (정호영 셰프님 혹시나 마주칠까봐 두리번 두리번 한 건 안 비밀~) 연희동 핫플 투어 재미있었어요~ 다 맛집이고 다 핫플인 연희동 이렇게 매력적이면 또 가고 싶잖아요~! 다음에 날이 좀 더 시원할 때 방문해 천천히 둘러 보고싶어요:) 연희동 핫플 투어 추천합니당~"
연희문화살롱에서 프리마켓을 합니다,#연희동#연희문화살롱 #꽃구름 #주얼리 #악세사리 #프리마켓 #프리마켓모집중 2019.03.22일 금요일 연희문화살롱에서 프리마켓 을합니다 호안석 귀걸이도 새로 나왔어요 시간되시면 놀려오세요 11~6시까지 해요~♡♡
"신촌 가볼만한 곳 '서울프린지페스티벌' 마포구 서대문구 실내외공간, 티켓판매기간 예매처 기획프로그램 프린지소사이어티 축제장소(ft.연희예술극장 신촌문화발전소 모티포룸)","출처: 서울프린지페스티벌 신촌 가볼만한 곳 '서울프린지페스티벌' 마포구 서대문구 실내외공간, 티켓판매기간 예매처 기획프로그램 프린지소사이어티 축제장소(ft.연희예술극장 신촌문화발전소 모티포룸) 신촌 가볼만한 곳, 서울프린지페스티벌은 대학로에서 열린 ‘독립예술제’로 시작하여 연극, 무용, 음악, 퍼포먼스, 시각, 영상 등의 다양한 분야의 예술가들이 참여하는 축제이다. 출처: 서울프린지페스티벌 작품이나 예술가에 대한 심사, 선정이 없는 자유참가의 원칙을 두고 있으며, 모두에게 참여의 기회를 개방하고 있는 축제이다. 서울프린지페스티벌과 함께하며 올 여름 요란한 무더위를 식혀 보세요~ㅎ 출처: 서울프린지페스티벌 2023년 서울프린지페스티벌 기간: '23.8.8.(화)~8.27.(일) 20일간 장소: 서울 마포구 및 서대문구 일대 실내외 공간 주소: 서울 서대문구 연희맛로 2-3 B1 연희예술극장 전화: 02-325-8250 요금: 유료 주최.주관: 프린지페스티벌 사무국, 서울프린지네트워크 출처: 서울프린지페스티벌 서울프린지페스티벌 '티켓 판매기간 및 예매처' ▷티켓 판매기간: 7.26. 오후 2시~8.26. 오후 5시 ▷문자 및 전화 예매: 문자예매 010-2184-0278 / 전화예매 070-7092-8171 ※작품 발표 하루 전 오후 5시 예매 마감 출처: 서울프린지페스티벌 ■ 티켓 예매처: 서울프린지페스티벌 홈페이지(seoulfringefestival.net) ▷유의사항 ① 서울프린지페스티벌 홈페이지(seoulfringefestival.net) 회원가입 후 예매 가능하다. ② 인터넷 예매 시 결제는 카드 도는 무통장 입금으로 가능하다. ③ 무통장 입금의 경우 당일 밤 12시까지 입금해주셔야 하며, 입금 확인이 안 될 경우 예매가 자동 취소된다. ④ 작품 관람일 하루 전 오후 5시까지만 ㅇ례매가 가능하다. ⑤ 자율후불제의 경우 작품 관람 후 관객이 스스로 티켓 금액을 정하여 지불하는 방식이다. 해당 공간에서 현금 혹은 카드로 결제 가능하다. ⑥ 자율후불제 및 무료 작품 중 작품에 따라 인원 수 제한으로 온라인 예매가 필수인 작품이 있다. 출처: 서울프린지페스티벌 ■ 장애인 관객 선예매 및 할인 안내 ▷장애인 관객 선예매: 7.19.(수) 오후 2시~8.26.(토) 오후 5시 ※작품 관람일 하루 전 오후 5시 예매 마감 ▷장애인 할인: 장애인 관객 본인 및 동반 1인 50% 할인 ※증빙 서류 지참 출처: 서울프린지페스티벌 서울프린지페스티벌 '축제장소' ▷축제장소: 서울시 마포구, 서대문구 일대 실내외 공간 <연희예술극장, 모티포룸, 공상온도, 극장 PLOT, 갤러리 아미디 신촌, 신촌문화발전소, 아트스페이스 디에이스튜디오, 신촌 일대 야외공간(스타광장, 토끼굴, 아리수공연장), 이너프라운지, 몸소리말조아라 센터, 고라니특공대, 성미산마을극장, 살라1, 오손도손 스튜디오> 출처: 서울프린지페스티벌 서울프린지페스티벌 '기획 프로그램' ▷친환경 예술축제 만들기 <에코프린지> ▷모두에게 열려있는 축제 만들기 <배리어프린지> ▷독립예술집담회 13th with 독립예술웹진 인디언밥 <시대에게 쫓겨나기> ▷생활밀착형 소규모 예술 수다 <마이크로포럼> ▷예술가 동료들의 피드백 품앗이 <오픈리허설> ▷작품을 넘어선 예술적 소통 <친절한 린지씨> ▷프린지 작품이 가진 빛을 찾아내는 <프린지 비평회> ▷네버엔딩 페스티벌 <플레이슈터> 출처: 서울프린지페스티벌 서울프린지페스티벌 '프린지 소사이어티' 프린지 소사이어티란? 서을프린지네트워크의 독립예술 커뮤니티 플랫폼으로 예술가와 기획자, 관객 등의 독립예술계 구성원들이 워크숍, 포럼, 네트워킹 등의 다양한 방식으로 서로 만나고 연결되는 곳이다. 출처: 서울프린지페스티벌 ■ 프린지 살롱 축제 구성원들이 자연스레 모이던 프린지 살롱이 돌아왔다. 근데 이제 노점 스타일을 곁들인, 일시적으로 공공공간을 점유하고 열리는 프린지 살롱은 언제든 쫒겨날 준비를 한 채, 신촌의 공원에서 시작한다. 비평회, 마이크로포럼, 자원활동가 수다회 등 다양한 프로그램이 기다리고 있다. ▷일시: 8.10.(목)~8.27.(일) 중 화, 목, 토요일 ▷장소: 창천문화공원 > 경의선 책거리 > 홍대 앞 걷고 싶은 거리 > ? ※장소는 쫒겨날 때마다 이동하며 서울프린지페스티벌 SNS에 공지된다. 출처: 서울프린지페스티벌 ■ 어린이 사생활 박람회 ""비교귝, 비영리, 비어른, 비서사"" 어린이들이 필요한 것을 찾아 즐기는 [제1회 사생활 박람회-개진적인 생활 속 시간]편이 진행된다. 놀이터러, 돗자리를 들고서~ ▷일시: 8.24.(목)~8.25.(금) 17:00~19:00 ▷장소: 궁뜰어린이공원(서대문구 연희동 123-5) ▷출연: 김숙희, 정진새, 원멜리에, 한아름, 최유진, 김현정, 강훈구 출처: 서울프린지페스티벌 ■ 지금, 여기로의 알아차림 워크숍 ver. 요가 외부 자극 속 나의 마음, 정신, 그리고 몸의 상태를 자세히 관찰해 본적이 있는가? 사소한 움직임이 쌓여 습관으로 이어지고 무심히 또 하루를 보낸다. 지금, 조금 더 나의 감정, 마음, 정신을 살펴본다면 하루쯤은 다른 일상을 맞이해볼 수 있지 않을까? 익숙해진 몸에 새로운 자극을 느끼며 나를 돌아보는 시간, 잠시 핸드폰도 컴퓨터도 멀리, 생각 또한 멈춰 온전히 나를 관찰해보자. ▷일시: 8.10.(목) 17:00~18:10 ▷장소: 갤러리 아미디 신촌(서대문구 신촌역로 21, 2층) ▷프로그램: 드로잉+명상+아사나수련 ▷참여비: 20,000원 ▷예매: 서울프린지페스티벌 홈페이지 출처: 서울프린지페스티벌 서울프린지페스티벌 '프린지와 함께하는 공간 이야기' ■ 이너프 라운지 8.10~8.11 황유택 <TED: 황유택> 8.12~8.13 풋인라이트 <BLANK 상영전> 8.12~8.13 우주마인드1인극프로젝트 <우주마인드1인극프로젝트> 8.16~8.17 그린피그 <스냅숏> 8.19~8.20 모래성클럽 <나는 뭐야?> 8.19~8.20 자리 <이상한털 조꼬띠클럽> 8.22~8.23 프로젝트 비비 <블러드라인> 8.25~8.27 친구삼X리리랜드 <나방파리> 8.26~8.27 유리정신 <유리화장실> 출처: 서울프린지페스티벌 ■ 연희 예술극장 8.11~8.13 레벨업프로젝트 <회색인간> 8.12~8.13 아그데 아그데 <HAPI HAPI HAPI> 8.16~8.17 새새스튜디오 <로미오와 줄리엣, 그리고 모순> 8.19~8.20 느루 <영 원의 꿈> 8.19~8.20 118 dance project <감정불구(Trythness)> 8.22 창작집단 쥐락펴락 <지금도 걸어가는 모든 이들에게: 걷는사람> 8.23~8.24 HAPPY ENDING PROJECT <콘센트-동의> 출처: 서울프린지페스티벌 ■ 신촌문화발전소 ▷신촌문화발전소 공연장 8.8~8.9 박웅 <운수좋은날제비긴s> 8.11 Team OOOD <호리섹스데이> 8.12 검은산 <히어로> 8.16~8.17 청춘예찬 <덴마크의 백성들> 8.18~8.19 창작집단 유리 <쥐덫> 8.22~8.23 극단 물만난낙타 <늦둥이오빠> 8.23~8.24 송명인 <현재> 8.26 극단 현 <요양원> ▷신촌문화발전소 로비 8.8~8.17 ZOBO <아름다운 지옥 2.6> 8.18~8.26 박혜랑 <생의 찬미: 너에게 보내는 편지> 상설 인형꾼 배시시 <[광고]이야기 찾아드립니다.> 출처: 서울프린지페스티벌 ■ 고라니특공대 8.11~8.13 역극집단 공외 <어느 울보 페미니스트의 하소연> 8.16~8.17 공동재 <MMM: My Magical Moments> 8.16~8.17 근기소 <백퍼센?또해?피엔딩> 8.18~8.20 해마다 프로젝트 <제 10층> 8.18~8.20 세악_서울실험예술인모임 <SEAC 7th New Music Concert> 8.22~8.24 노구라 프로젝트 <진솔씨를 찾습니다!> 8.23~8.24 윤소희 <희곡-집> 8.26 20도씨 <언노운 테마파크> 8.26~8.27 동꾸결사대 <동굴뒤에터널있어요> 상설 인형꾼 배시시 <[광고]이야기 찾아드립니다.> 출처: 서울프린지페스티벌 ■ 갤러리 아미디 신촌 8.12~8.13 뿔 <만난 얼굴들> 8.15~8.17 팀 파라란 <유령-씨앗> 8.18~8.19 별들의유랑 <연극이 끝나려면> 8.22~8.24 창작집단 보라, 인간 <수경을 쓰다> 8.26 옥이 <옥이의 방> 출처: 서울프린지페스티벌 ■ 몸소리말조아라 센터 8.10~8.11 프로젝트 정류장 <이윽고 평온한 순간이 올 테니까> 8.12~8.13 이산 <산세베리아> 8.12.~8.13 나희경 <GL드라마가 한 여성퀴어에게 미친 영향> 8.17~8.20 이준영 <애완조각(대표작: 방공호)> 8.17~8.18 이한솔 <옛날 옛날에> 8.24~8.25 임영 <'춘광사설(春光乍洩)': 구름 사이로 잠깐 비추는 봄 햇살> 8.26~8.27 백란희의 백란희 <10년 보증 매트리스> 출처: 서울프린지페스티벌 ■ 모티포룸 8.10~8.11 아트필터 <고유하다> 8.12~8.13 움사(UMSA) <10분의 여백> 8.14~8.15 모나지 <모나지않은> 8.16~8.17 극단 문지방 <8월의 색> 8.19~8.20 별도공간 분홍이와 <쓸데없이 쓸모있는 해쉬브라운> 8.21~8.24 영경 <여름이 싫다는 건 거짓말이었어> 8.23~8.24 누비라 <새로이> 8.25~8.27 미세먼지 <BLANK> 8.26~8.27 창작공간 너희집 <아일랜드> 출처: 서울프린지페스티벌 ■ 공상온도 8.10~8.13 매머드머메이드 ,침묵하는 것만이 그를 사랑하는 방버이라는 게 분명하다> 8.11~8.13 때와곳 <뭍의 감가> 8.17 무음 <이방인의 노래> 8.18~8.20 기린(GuiLin) <모두의 클래식> 8.18~8.20 다이빙라인 ,엎질러진 물은 습도 향상에 도움이 된다> 8.22~8.24 프로젝트PAN <프린지 수익정산 어떻게 할 것인가(근데, 수익이 나기 해?)> 8.22~8.24 민정 <륜과 노마드: 제 살을 드러낸 언덕으로> 8.25 heymayday <voicemail_0.mp3> 8.26~8.27 송선호 <사계-四季> 서울프린지페스티벌 서울특별시 마포구 성산동 661"
