title,content
2023 3월 (1)_미분당 이수점 / 커피루소 정동 / 아우어베이커리 광화문디팰리스점 / 랜디스도넛 연남점 / 코스트코 광명점,"2023.02.28(화) 아침부터 빠르게 신설+면목 외근을 하고 와서 뜨끈한 국물이 땡겨서 가본 이수역 미분당! 산본에서도 유명해서 웨이팅 있는 집이라 기대 두근두근 몰랐는데 한명씩 식사하기 편한 혼밥 맛집이다! 매장이 왜이렇게 조용한가 했더니 주인장의 이런 뜻이~! 어떤 블로그 후기에서 친구랑 조금 얘기했다가 직원이 주의를 줬다고 했는데 정말 그런 분위기다 나는 차돌양지힘줄 쌀국수.. ㅋㅋㅋ 양도 많고 국물이 정말 끝내준다~~! 핫소스는 많이 매운편이었고 해선장 소스는 내가 저 한통 다 비울뻔ㅋㅋㅋㅋ 다음에 또 쌀국수 땡기면 와야지~~~😆 그리고 저녁도 외식,, 언니랑 촌놈집 갔다가 내가 움청 졸라서 먹은 설빙 딸빙 아주 아주 맛도리였다!!! 미분당 이수점 서울특별시 서초구 서초대로 13 1동107호 - 2023.03.01(수) 시간이 왜이렇게 빠른거야 진짜ㅠ 벌써 3월이라니 주말에 못만난 선비님과 데이투 나는 브런치가 땡길 때마다 정동길에 있는 커피루소가 땡긴다! 어제 고기 먹었으니까 ㅎ 콥샐러드 하나랑 아메리칸 브런치 ㅎㅎㅎㅎ 커피 루소 브런치 양도 많고 맛있다! 브런치 시키면 커피도 할인해주고 좌석도 많고 창가 자리도 있어서 강추✨ 어디갈까 여기저기 돌아다니다가 광화문 디팰리스에 들어갔는데 우연히 발견한 여기는 바로…. 누하스 안마의자 체험할 수 있는 곳!!! 저기 기계에 3000원 카드결제하면 누하스 안마의자를 15분동안 체험할 수 있다 이런거 마주쳐도 하기 망설였는데 여기는 사람이 별로 안돌아다녀서 도전했다! 핸드폰 무선 충전도 되고 완전 좋~! 디팰리스 건물에는 아우어베이커리도 있다! 더디초코 먹어주고 베이비 드라이버에서 데보라가 일하는 카페 느낌이 난다! 미국 카페 감성 커피루소 정동 서울특별시 중구 정동길 17 아우어베이커리 광화문디팰리스점 서울특별시 종로구 새문안로2길 10 1F, 103호 아우어베이커리 광화문디팰리스점 - 2023.03.02(목) 촬영 장소 사전 답사 가는 날! 내부는 마음에 들었다 얼마전 김나영 언니도 들른 곳,, 주방도 마음에 들고 근데 야외에서 촬영 많이 하고 싶었는데 야외가 넘 좁아서 패수.. 사전답사 한 스튜디오가 연희동이라서 연남동 지나서 왔는데 뭔가 아쉬운 마음에 랜디스🐷🐷 오랜만이다~! 빠르게 딱 두개만 골랐다! 둑흔둑흔 어떤 맛이냐면 시나몬 애플잼 맛 나는 애플프리터랑 버터크럼 도넛! 애플프리터는 너무 달아서 먹다 남겼다 ,,,,ㅋㅋㅋㅋㅋ 아주아주 단 약과 같은 식감? 버터크럼은 그렇게 후기가 좋지 않았는데 나는 맛있게 먹었다! 근데 올드페리 버터 피스타치오가 더 맛있는듯! ㅎ흐흐흐 랜디스도넛 연남점 서울특별시 마포구 동교로 247 - 2023.03.03(금) 사무실 근처에 새로 오픈한 감성커피 진한 라떼 좋아하지만 너무 진햇,,,, 오랜만에 애플하우스에서 떡볶이랑 무침만두 일반떡볶이… 별로인거 알면서 또 사먹었는데 역시나 후회,, ㅎㅎ 떡볶이는 죠떡 최고 신설동에서 외근 후 바로 퇴근하고 연차인 선비님 만나러~! 스시가 먹고 싶어서 청량리역에서 걸어서 15분 거리인 곳까지 열심히 걸어가따 먹고 싶은 건 꼭 먹어야 하는 사람…. 서비스까지 낭낭하게 나와서 맛있게 먹구 (차도 잘 안타면서) 차에 넣어놓을 간식 사기ㅎㅎㅎ - 2023.03.04(토) 토요일은 아침부터 아빠랑 코스트코 ㅎㅎㅎㅎ 사업자 회원으로 멤버쉽 카드 만들어따! 크크크 그릭요거트 먹고싶었는데 용량이 감당 안될 거 같아 내려놓고ㅠ 얘도 살찔까봐 내려놓고 얘도 당뇨 걸릴까봐 내려놓고 불고기는 밥반찬이니까 사고 이거는 같이 뉴욕갔다온 솔덕이 생각나서 사진 보내주고 코스트코에 갔다온지 5일이 됐는데 냉장고에 음식이 썩어난다,,, 언넝 냉장고파먹기 해야지…. 위험한 거 알지만 넘 좋은 코코ㅠ 광명 벨로엥에서 아빠 자전거도 쇼핑하고… 난 자전거가 200만원이 넘길래 당연히 전기자전거인 줄 알았지 ㅎ 아빠의 소비는 뭔가 무섭다,,, ㅎㅎㅎㅎ 도미노피자로 저녁 마무리~~~ 코스트코코리아 광명점 경기도 광명시 일직로 40 - 2023.03.05(일) 내 뉴 차를 태워주고는 싶고, 나는 왕초보고 ~ ㅎ 아직은 운전할 때 옆에 누가 있어야해서 울동네로 일찍 와주신 선비님 집 근처에 있는 왕송호수에 가봤다! 한옥 느낌이 나는 카페 초평가배 날씨가 완전 따뜻해졌다! 왕송호수 앞에 앉아서 수다 떨다가 일욜 오후는 주차난이 더 심하니까 집에 차 대러,, 일찍 총총,, 진~짜 오랜만에 선비님이 메뉴선정ㅎ 짬뽕 먹으러 산본 짬뽕타운! 차돌 짬뽕 곱빼기였는데 양 증말 많다,, 나 짬뽕 안좋아하는데 여기 맛있네ㅎㅎㅎ 난 탕수육 먹으러 짬뽕집 오는 사람 ㅎ 여기 탕수육도 찹쌀탕슉이라 아주 제 스타일이구여 찹찹 맛있게 먹구 일요일 끝~! 초평가배 경기도 의왕시 왕송못서길 52 초평가배 짬뽕타운 산본점 경기도 군포시 산본천로 56 센트로601 상가 2층 짬뽕타운 산본점"
[ 서울 연남동 ] 아이언맨 도넛으로 유명한 랜디스도넛 연남점,"비온뒤 맑음으로 시작하는 랜디스도넛 가는길 !! 연희동 그냥 걷다가 오늘 랜디스 사람없네 가보자 ! 해서 바로 줄을 서기 시작했다 아무래도 비왔어서 사람이 별로 없던거 같다 갑작스럽게 온 랜디스 랜디스도넛 매일 11:00 ~ 21:00 ( 라스트오더 20:30 ) 랜디스 건물에는 위에 보나바시움이라고 커피숍이 하나 있는데 랜디스 도넛산거를 저기서 같이 먹을 수 있다 음료만 주문한다면 !!!! 근데 도넛종류가 워낙많은데다가 밤에 숙소에서 다른 디저트 사먹을거라서 하나씩만 시키자구 했다 그래서 더더욱 고민하기가 힘들었다구 .. 아이언맨도 마스크 썼다구용 넘나두 슬프다 언제 끝나 코로나 ,,,? 진짜 도넛진열장으로 가기 1분전 한걸음전 얼마나 설레고 쿵쾅대는지 알아요 ,,???? 진짜 주문어떻게 하지 멀리서 카메라 확대로 뭐먹지 무슨맛이지 이렇게 진지하게 고민하는 사람 있을까 그정도로 도넛종류가 많은데다가 맛있고 그래서 흔하지 않은곳이라 사람들이 기본 박스로 많이 사가는거 같다 너무너무 맛있어보여 ,,, 다시봐도 또먹고싶은맛 랜디스는 좀 달다면 노티드는 우유도넛 이런느낌 개인적으로 크리스피의 고급진 맛이 랜디스 도넛아닐까 싶다 ,,, 진열창인데 이렇게 깨끗하기 있냐구요 ,,, 도넛 미니먼치킨처럼 작은것도 팔았는데 엄청 고급졌다 ,,, 점원분 손들도 엄청 빠르다 ,, 아무래도 ,,, 사람들이 많이 와서 그런가 연남동이 본점이라구 들었는데 ㅎㅅㅎ 나는야 본점버프 엄청 강한사람 어딜가도 분점가도 괜찮지만 본점이 젤 최고 ㅋㅡㅋ 보나바시움 연남점 매일 11:00 - 21:00 ( 라스트오더 : 20:30 ) 완전 청량청량한 그런분위기의 카페 정말 기대 하나도 안했는데 나름 분위기 좋아서 기분이 좋았다 다들 랜디스에서 올라오는 사람이 대다수 ㅋㅋㅋ 아 뭐먹지 하다가 근데 음료 가격이 비쌀줄 알았는데 가격이 괜찮았다 채광이 잘 들어오는 카페라 너무 좋았다 우리는 아메리카노 \4500 이것만 주문하고 랜디스 도넛과 함께 먹었다 랜디스 도넛에는 라즈베리 케이크 초콜릿크롤러 뭐먹지 몇만번 고민하다가 고른것들 ,,, 결정장애 치고는 아주 빨랐어 그지 ,,??? 그리고 금손 연희가 내머리 전갈머리처럼 따아줬다 흐히히 체육대회 말고는 저렇게 딸 기회가 없었는데 너무너무 기분이 좋았다 ,,, 도넛 단면 너무나도 장난아닌것 그냥 아직도 너무 생생한데 도넛이 엄청 쫄깃했다 그래서 진짜 맛있었다구 ,,,,, 또 생각나 나 이렇게 도넛 좋아하는 사람이 아닌데 .. 연희가 채광 좋다면서 찍어준곳 ,,, 왕왕왕이뿌다 그냥 랜디스 위에 있는 카페라서 별로 기대 안했는데 너무 이뻐서 좋았다 내심 뿌듯 ,,,, 이거시 랜디스 도넛의 층안내도인데 일층 외에는 전부 보나바시움이다 ,,, 랜디스 도넛에 오면 포토존 무조건 찍어야해서 또 안찍고 가기가 아쉬워서 찍고 갔다 ,, 여기 무조건 찍어줘야하는곳 !! 다들 가면 꼭 한번 찍길 ,,, 랜디스도넛 연남점 서울특별시 마포구 동교로 247 나롱(@rongrong_1227) • Instagram 사진 및 동영상 팔로워 566명, 팔로잉 349명, 게시물 79개 - 나롱(@rongrong_1227)님의 Instagram 사진 및 동영상 보기 instagram.com #랜디스도넛 #랜디스도넛연남점 #연남동카페 #서울 #연남동놀거리 #연남동 #아이언맨도넛 #일상 #일상블로그 #일상블로거 #일상이야기 #일상생활 #일상생각 #서이추 #내돈내산 #직장인 #서이추환영 #서로이웃 #서로이웃환영 #이웃 #이웃환영 #수도권 #블로거 #초보블로거 #공감 #댓글 #소통 #답방 #맛집블로거 #맛집추천 #카페 #카페추천 #애드포스트"
"[파퓰러의 반차여행-연희동, 연남동] 랜디스 도넛 /보나바시움 연남점/ 초콜릿 책방 / 사러가쇼핑센터 /유어마인드 / 연희아트페어 / 우들랏 / 어반플레이 / 오디너리핏/ 밤의서점","파퓰러의 2022 또 다른 프로젝트! 반차여행! 올해는 반차를 써서 의미 있는 서울/서울 근교여행을 해보기로 했습니다. 이번에는 충동적으로 반차 쓰고 연희동을 찾았어요. 주말에 골목길 경제학자 모종린 교수 책을 본 영향이 컸는데요. 동선은 연희동을 사는 제 친구 추천 코스를 따랐습니다. 연희동에 가기 위해 홍대입구 지하철역 3번 출구로 나왔습니다. 연남동에서 연희동으로 가기 위함이에요. 지나가던 길, 마스크 가게를 발견했습니다. 코로나가 키운 새로운 시장이네요. 화려해요, 화려해~ 랜디스도넛 #랜디스도넛 연희동으로 가다가 말로만 듣던 랜디스 도넛을 발견했습니다. 건물이 멋지네요. 도넛이 옥상에 턱! 길을 건너 입장해 봤어요. 평일 오후에 와서 사람이 많은 것은 아니었습니다. 랜디스 도넛은 왜 이렇게 인기가 많을까요? 그렇게 맛있나? 굿즈도 팔고 있습니다. 2층은 보나바시움이라는 카페입니다. 랜디스 도넛은 먹고 갈 곳이 없어요. 건물 옆에는 사진 찍는 곳이 있습니다. 이것 때문에 인기가 있는 것일지도 모르겠어요. 사진들 많이 찍고 가시더라고요. 연희동 가는 길, 아파트 너머에 초콜릿 책방이란 곳도 발견했어요. #초콜릿책방 책과 커피를 파는 곳이었습니다. 랜디스도넛 연남점 서울특별시 마포구 동교로 247 보나바시움 연남점 서울특별시 마포구 동교로 247 초콜릿책방 서울특별시 서대문구 연희로5길 46-11 102호 이제 연희동에 왔어요. 커피팝이라는 카페가 보였는데, 제가 '파퓰러'이기 때문에 사진 찍어봤습니다. #커피팝 #연희동커피팝 사러가 쇼핑센터 그다음은 모종린 교수 책에서 본 사러가 쇼핑센터를 봤어요. 책에서는 주차하기 좋아서 성공할 수 있었다고 적혀있었습니다. 여느 마트와 비슷한 느낌이지만, 세련된 동네 슈퍼 같기도 했어요. 피터팬 빵집도 있고, 빕 구루망이라는 맛집도 있었습니다. #사러가마트 #사러라쇼핑센터 연희정원을 찾았습니다. #연희정원 모임공간도 있고, 편집샵의 편집샵 느낌 나는 공간도 있었어요. 유어마인드 & 원모어백, 초콜릿코스모스, 유노이아, 사루비아 다방, 비하인드 리메인, 가라지 가게 등 다양한 공간이 모여 있습니다. 연희정원 옆쪽으로 난 길을 따라 올라가 봤어요. 유노이아 의류점이 보이네요. 옛날 집을 잘 꾸며서 상점으로 만들었습니다. 연희정원 내 유어마인드 #유어마인드 2층으로 올라가면 독립서점, 유어마인드가 나와요. 그 옆은 또 식물 가게라는 식물집입니다. #식물가게 유어마인드 옆 자판기가 신기하네요. 독립서점 유어마인드 들어가 봅니다. 책도 많고, 문구류도 많은 것 같아요. 책갈피전을 하고 있었습니다. ㅎㅎ #유어마인드 #연희동독립서점 #연희동서점 안쪽에 독립서적들이 있었어요. 재밌는 책들이 많았어요. 기발하다~ 3년 이하 시리즈도 재밌었어요. 왜 굳이 서점이고, 로컬 베이커리일까요? 유어마인드 구경 잘 하고 다시 1층으로 내려옵니다. 반지하인 아래층에는 가라지 가게가, 위층에는 카페가 있습니다. 여기서 보면 반지하이지만, 바깥에서 보면 1층이에요. 연희정원을 나와 에브리띵 베이글 가려고 해요. 건너편에 양갱상점 금옥당이 있네요. 이곳이 에브리띵베이글이에요. #에브리씽베이글 #에브리띵베이글 #연희동베이글 #에브리싱베이글 #everythingbagel 외국 느낌 나쥬~ 영업시간을 보면, 아무 때나 먹을 수 없는 베이글이라는 것을 알 수 있습니다. 저는 베이글은 호밀 에브리띵을 선택했습니다. 가격은 2500원. 크림치즈는 쪽파 선택했어요. ㅋㅋ 총 4000원 들었네요. 이곳은 인스타 성지라고 합니다. 맛 때문일까요? 분위기 때문일까요? 내부에 먹을 곳은 없기에 파 냄새 풍기면서 다니다가, 근처 놀이터에서 먹어봤어요. 먹다가 중간에 일부를 떨어뜨려 아까웠지만, 맛있군요. 커피팝 서울특별시 서대문구 연희맛로 5 연희사러가쇼핑센터 서울특별시 서대문구 연희맛로 23 연희정원 서울특별시 서대문구 연희로11라길 10-8 유어마인드 서울특별시 서대문구 연희로11라길 10-6 2층 우측 에브리띵베이글 서울특별시 서대문구 연희로11길 29 1층 에브리띵베이글 우들랏 #우드랏 #woodlot #우들랏 이번엔 연희동 친구가 추천해 준 우들랏을 가봅니다. 목공 소품샵인데요. 아이디어 상품이 많은 것 같아요. 사진 촬영을 열심히 하고 계셔서 들어가 보지는 못했습니다. 이번에는 전시를 보려고 이동해요. 이동하다가 재밌는 곳도 많이 발견했습니다. 싸이아파트가 가장 재밌었어요. 제가 보려고 한 것은 '연희 아트페어'인데요. 여러 곳의 갤러리에서 한꺼번에 특정 기간 동안 전시를 하는 거였어요. 처음 간 곳은 플레이스막2였지만, 전시는 종료되었어요. 흑흑. 그다음으로 간 곳은 가까운 곳의 갤러리인입니다. 여기서 시원한 피에르 탄산수 주셨는데 넘나 맛있게 잘 먹었어요. 완전 더웠거든요. 창작물들을 잘 감상해 봅니다. 아터테인, 갤러리 민트 등 주변의 갤러리들도 열심히 구경해봤습니다. #연희아트페어 #갤러리인 이제는 연희동 사는 친구가 추천해 주었던 많은 카페 중, 전망이 좋다는 카페를 찾아갑니다. 연희동은 부의 상징이었는데 말이죠. 지금도 그 느낌 그대로 있지만, 집이 상점이 되고, 문화공간이 된 변화가 있는 것 같아요. 연희동 사진관도 멋지고, 그 옆 카페도 멋지네요. 다음에는 연희동 사진관 옆 카페도 가볼까 봐요. 제가 가려던 카페는 오디너리핏인데요. 오디너리핏 가는 길, 경찰 서 옆 옥상에서 재밌는 이정표를 발견했습니다. 외국느낌 나네요. 드디어 카페 오디너리핏에 도착했습니다. #오디너리핏 #연희오디너리핏 여긴 할 말이 많아 별도 리뷰로 찾아오려고요. 여깄습니다. 별도 리뷰~ 상세 내용은 하단 포스팅에서 살펴보세요. https://blog.naver.com/project_pop/222738242737 [연희동 카페, 핫플레이스, 전시공간, 데이트코스, 뷰맛집] 오디너리핏 (odinary pit), 캐비넷클럽 하우스 안 루프탑 카페예요. 연희동 전망 좋은 카페, 오디너리핏을 찾았습니다. 오디너리핏은 연희동 서연중학교 근처에 있어요. 약간 ... blog.naver.com 어반플레이에서 만든 연희동 골목 지도를 발견했어요. #연희동지도 #연희동골목길지도 이 #어반플레이 지도에 대한 내용도 모종린 교수 책에서 봤는데요. 이게 바로 그 지도였다니~ 진작 있었다면 참 좋았겠다는 생각도 해봤습니다. ㅋ 연희동을 나와 '밤의서점'으로 향합니다. 예전에 MBC 일밤에 나왔던 서점이에요. 가는 길에 양과점과 버거집과 바가 공존하는 건물을 봅니다. 밤의서점 #밤의서점 #연희동독립서점 밤의서점은 성산회관 근처에 있네요. 진짜 마니아가 아니라면, 잘 찾아올 수 없는 곳에 있어요. 다섯시에 문을 열어요. 고양이가 맞이합니다. 열린 곳이 문 같지만 진짜 문은 왼쪽에 있지요. 내부는 사진을 못 찍게 되어 있어 눈으로 구경만 하고 왔어요. TV에서 봤던 거랑 정말 비슷하고, 신비한 느낌이 폴폴 납니다. 유인나와 강하늘이 촬영했었지요. 운영시간이 짧으니 잘 보고 가세요. 우들랏 서울특별시 서대문구 증가로 31 갤러리 인 서울특별시 서대문구 홍제천로 116 201호 오디너리핏 서울특별시 서대문구 연희로11가길 48-23 , 3층 밤의서점 서울특별시 서대문구 성산로 309-51 이렇게 연희동 반차투어를 마칩니다. 많이 걸었네요. 연희동은 제게 부자 동네라는 이미지가 강했는데, 지금은 많이 변한 것 같아요. 고유의 느낌은 그대로 있지만, 외국 느낌도 나고, 단아한 느낌도 났습니다. 날씨가 더워지기 전에 많은 반차를 써야 할 것 같다는 생각이 들었습니다. 2022. 5. 12. #골목여행 #반차여행 #연희동가볼만한곳 #연희동카페 #연희동서점 #연희서점 #서울여행 #서울투어"
아이언맨 도넛 랜디스도넛 연남점★,"주말이면 줄이 너무 길어서 늘 지나가면서 궁금했던 랜디스 도넛을 드디어 방문을 했습니다~!! 아이언맨 2에서 스타크가 먹은 도넛으로 유명한 랜디스 도넛이죠 ㅎㅎ 형형 색색 어찌나 종류가 많던지 고르기가 너무 힘들었어요~ 고심 끝에 고른 도넛이 이미 다 팔려서 처음에 고른 것 못샀아요ㅠㅠ 그렇지만 다른 맛있게 많으니까 괜찮아유~ 위치와 운영시간은 여기!! 운영시간: 매일 11:00~22:00 주소 서울특별시 마포구 동교로 247 전화번호 : 02-322-0621 랜디스도넛 연남점 서울특별시 마포구 동교로 247 도넛 수에 따라 박스의 크기가 달라지더라고요. 도넛을 고를 때 도넛 사이즈를 물어보시는데 대 중 소를 생각해두셨다가 도넛 고르기 전에 크기를 직원에게 먼저 말씀해 주시면 돼요~ 도넛 종류가 크게 4가지로 나뉘는데 클래식, 디럭스, 펜시, 프리미엄으로 가격이 올라갈수록 토핑이 다양하고 많은 것 같더라고요~ 펜시부터 필링이 들어간 도넛이 있었어요. 개인적인 취향이 적극 반영된 초이스 ㅎ ㅎ! 글레이즈 올드 패션과 메이플 크롤러 메이플 크롤러는 베이스 도넛이 글레이즈 올드패션과 같은 스타일의 빵 일 거라 생각했는데 폭신한?! 식감의 빵으로 메이플 향도 진해서 맛있었어요~! 다음엔 큰 거 한 박스 사서 가족들과 함께 나눠먹어 보도록 해야겠어요. 달달구리와 함께 하는 행복한 시간 #랜디스 도넛 #연남동 랜디스 도넛 #아이언맨 도넛 #YOGA #요가 #마이트리요가 #마이트리연희 #연희동요가 #연남동요가 #신촌요가 #홍대요가 #홍은동요가 #홍제동요가 #남가좌동요가 #북가좌동요가 #창천동요가 #서대문구요가 #아쉬탕가 #하타정렬 #빈야사 #테라피 #힐링 #명상 #플라잉요가 #국제요가지도자 #요가지도자과정 #RYT200 #워크샵 #어린이요가 #어린이플라잉요가 #키즈요가 #키즈플라잉요가"
