url,title
https://blog.naver.com/pj4554/223238431697,[브릭샌드 서울역점] 서울역 조용한 카페 추천
https://blog.naver.com/nies_k/223278507788,[서울/강남] 브릭샌드 서울역점
https://blog.naver.com/cchumi_k/223242187295,브릭샌드서울역점 사무실 간식 추천
https://blog.naver.com/sg-yongin/223196599534,서울역 카페 건강한 수제 간식 브릭샌드 서울역점
https://blog.naver.com/ddojii/222963148596,디저트 선물하기 좋은 서울역 카페 브릭샌드 서울역점
https://blog.naver.com/myminnu2/223272071508,"브릭샌드 서울역점┃서울역 카페, 휘낭시에, 디저트선물..."
https://blog.naver.com/lhh2025/223259020888,"브릭샌드서울역점, 서울역맛집 쿠키선물 추천"
https://blog.naver.com/minipucu/223234453561,[서울 용산] 서울역 카페 브릭샌드 서울역점
https://blog.naver.com/by_ddd/223239170729,브릭샌드서울역점에서 다양하고 촉촉한 휘낭시에 골라보기
https://blog.naver.com/iamjivvon/223186904261,서울역맛집 휘낭시에 맛집은 여기 브릭샌드서울역점
