title,content
한남동 SALIR 살리르 수제 아이스크림 와인바 도라지와 미나리라니 색다르다,"2023.08.12 SALIR 살리르 한남동 SALIR 살리르 📍 한남동 살리르 위치 서울 용산구 이태원로54길 58-20 1층 ⏰ 한남동 살리르 영업시간 오픈 16:00 마감 00:00 *월요일, 화요일 휴무 ☎️ 한남동 살리르 예약방법 캐치테이블 한남동 SALIR 살리르 캐치테이블로 예약하고 토요일에 방문했다 바랑 테이블 예약시 선택가능하다 테이블 2팀 바 2팀 정도면 만석인 작은 가게이고 살리르 위치 찾기 힘들 수 있으니 골목을 잘 보길! 요기가 바테이블이다 캐치테이블에서 살리르 예약할 땐 테이블을 골랐는데 막상가니 바 자리가 좋을 것 같아서 앉았다 한남동 SALIR는 작은 가게지만 사장님이 소품 하나하나 다 골라서 꾸민 장소이다 그래서 구경하는 재미가 있다 아기자기한거 좋아하시는 것 같다 소품들 막 보여주셨음ㅋㅋㅋㅋㅋ 신기한게 레고 체중계.. 귀여웠다 근데 나는 실용적인게 아니면 절대 안 사는 성격이라 사장님이랑 나랑 서로 이해못하고ㅋㅋㅋㅋ 한남동 살리르 메뉴판 가격 MINARI & LEMON 7,000원 DORAJ & PARMESAN & OLIVE OIL 7,000원 REAL TESORO FINO 10,000원 LAURA HARTWIG 12,000원 한남동 SALIR 정사각형의 로고 귀여움 살리르 테이블 스크래치도 사장님이 다 만드신거다ㅋㅋ 컵이 일단 넘 귀여움 물컵ㅎㅎ 한남동 살리르는 수제 아이스크림과 와인을 페어링하는 색다른 가게다 👀 새삼 귀여워 살리르 아이스크림 메뉴는 달마다 바뀐다 그게 정말 대단한듯..심지어 특이하다 8월에는 오이 미나리 도라지 등등이 있었고 9월에는 전부 다른 맛인데 검정색인 아이스크림 같다 MINARI & LEMON 생각보다 살리르 아이스크림 메뉴가 특이해서 고민했다 뭔가 다 내가 안 좋아하는 재료들이랄까..?ㅋㅋㅋ 그나마 미나리와 레몬이라고 하셔서 익숙한 레몬이 있으니 고른 아이스크림 DORAJ & PARMESAN & OLIVE OIL 친구가 고른 도라지 치즈 올리브오일 아이스크림 아니 어떻게 저렇게 조합할 생각을 하지.. 천재신가 한남동 살리르가 유명한 이유는 아이스크림 와인 페어링 때문이다 특별하게 와인을 고르지 않으면 사장님이 각 아이스크림에 어울리는 와인을 골라주신다 LAURA HARTWIG 로라 하트윅 까베르네 쇼비뇽 REAL TESORO FINO 레알 테소로 피노 쇼비뇽과 피노 와인! 그리고 그 와인에 맞게 와인잔까지! 잔이 독특하고 예쁘다 SALIR 로고도 박혀있음 하나하나 다 사장님이 신경쓴게 느껴진다 내가 고른 미나리 레몬 아이스크림과 와인 이렇게 먹으니 기분이 넘 좋았다 그리고 아이스크림이 진짜 맛있었다 상큼하고 입안을 개운하게 만들어주는 느낌? 8월 여름에 딱 먹기좋은 맛이었다 아이스크림 한입 먹고 와인 마시니 넘 잘 어울렸다 왼쪽이 친구가 고른 도라지 아이스크림이다 확실히 내 스타일은 아니었다ㅋㅋㅋㅋ 일단 도라지 치즈 다 내 취향이 아님 친구는 맛있다고 했다 이렇게 아이스크림 와인 페어링 조합으로 가격 36,000원이었다 괜찮은 가격인듯!! 매달 아이스크림도 달라지니 매달 가는 재미도 있고! 아이스크림 와인 페어링 해주시면서 설명도 해주신다 지금은 기억이 안 나지만..^^ 와 진짜 잘 어울린다~ 이러면서 맛있게 먹었다 특히 한남동에서 이렇게 색다른 아이스크림을 먹을 수 있는 게 좋은듯..! 한남동 SALIR 살리르 재방문의사 있다 다음에는 어떤 아이스크림이 있을지 궁금하다 50m © NAVER Corp. 살리르 서울특별시 용산구 이태원로54길 58-20 1층 #살리르 #SALIR #한남동살리르 #한남동아이스크림"
[한남동 가볼만한곳] 아이스크림바 살리르(디저트&와인 디저트),"50m © NAVER Corp. 살리르 서울특별시 용산구 이태원로54길 58-20 1층 안녕하세용 연근이에여영 요즘 블테기가 와서,, 오랜만의 포스팅이네여 ㅎㅎ 얼마전 친구와 갔었던 한남동 아이스크림바 살리르랍니당 친구와 저녁먹기전에 시간이 남아서 한남동 가볼만한곳인 아이스크림바 살리르를 찾았어요!! 원래 베라 가려고 했는데 ㅋㅋㅋ 못 찾아서(?) 하핫 지하철로 오려면 이태원역이나 한강진역에서 내려서 조금 걸어오시면 돼요! 월요일은 정기휴무고 다른 날들 16시부터 운영하는데 거의 시간 딱맞춰갔는데도 대기손님이 한팀있었어요~~ 우리 살리르 잘 찾은 듯?ㅎㅎ 가게 앞에 이런 테이블 ㅋㅋㅋㅋ이 있었는데 요즘 갬성카페 느낌도 나고 귀엽더라구영 와인말고 아이스크림만 먹을거면,, 웨이팅이 너무 싫다면 여기서 먹어도 괜찮을거같아요 바 앞에 좌석은 4자리 있었고 저희는 음식해주시는 데 바로 앞에 앉았습니돠 덕분에 조리과정 다 보면서ㅋㅋㅋ 말도 걸어주시고 재밌었어요 사장님이 되게 힙하시더라구요... 뭔가 환승연애 나오실듯한 느낌?ㅎㅎ (매우 칭찬입니닷) 다른 테이블에 손님 앉기 전 슬쩍 찍어봐씁니당ㅎㅎ 좌석은 10분 정도 만에 꽉 찼어요!!! 진열장?에 수많은 와인들이 걸려있었어요 와인과 아이스크림의 페어링이 컨셉이다보니 와인과 아이스크림에 대한 지식이 많아야할 것 같은데 대단하시더라구용ㅎㅎ 내부는 요즘애들(?)이 좋아하는 인스타갬성 힙한 느낌! 깔끔해서 좋았고 나오는 음악도 매장분위기와 잘어울렸어요 굿 먼저 물과 메뉴판이 나와씁니당 물병은 매끌매끌해서 잡기 어려웠지만 갬성 포기 못하쥬... 아이스크림 먹을 수저도 나오고!! 그럼 아이스크림 함 골라보까용? 베라만큼은 아니였지만ㅋㅋㅋ 7가지 정도 아이스크림 종류가 있었습니닷 뭐 먹지이이? 선택장애 연근... 살리르 메뉴판입니닷 영어가 좀 알아보기 힘든 글씨체이지만 알 수 있죠 저희는! 메뉴는 달마다 바뀌어서 저의 포스팅과 메뉴가 다를 수 있다는 점 참고해주세유 근데 아이스크림 메뉴가 참 신선하지않나여,,,? 바나나&딸기&발사믹 배&버터&팔각 수박&라임&할라피뇨 파인애플&스피어민트&소금 살구&레지아노(치즈)&후추 오미자&올리브&로즈마리 헤이즐넛&커피&피클 ㅋㅋㅋㅋ뭔가 두개정도는 음 맛있겠다 싶은데 하나씩 엥하는 조합이였어요 하하핳 당황당황 안에 펼쳐보면 아이스크림 외에 와인메뉴가 나와용 여기는 읽어도 뭔지 전혀 모르겠네요...ㅎㅎ 아이스크림 메뉴의 심상치않음을 느낀 저희는 예상에 없던 와인을 한잔씩 주문했습니다 ㅎㅎㅎ 와인은 아이스크림에 어울리는 걸로 추천해주세용! 저희는 뭔가 제일 무난해보이는 좌 - 파인애플&스피어민트&소금 우 - 바나나&딸기&발사믹 두가지를 주문했습니당 요렇게 주문하면 휘리릭 만들어주세요!~ 먼저 파인애플&스피어민트&소금 아이스크림! 이거는 진짜 찐 맛있었어요 ㅋㅋㅋ 와인의 도움없이도 맛있게 먹을만한! 우리가 원한 무난한 느낌 ㅎㅎ 상콤하니 맛있었어요ㅠㅠ 요 아이스크림은 바나나&딸기&발사믹 바나나랑 딸기는 무난한데 발사믹이 이 디저트를 특별하게 해줘용ㅋㅋㅋ 맛이 없는 건 아닌데 당연한 말이지만 발사믹맛이 진짜 많이 나요 ㅎㅎ 그래도 이정도 메뉴선정이면 성공하지 않았나 싶습니당!!! 하지만 아이스크림바인만큼 와인 안마시려니 친구가 아쉽다구 해서 ㅎㅎㅎ 요렇게 두 잔 ㅎㅎㅎ 아이스크림이랑 같이 먹으면 더 좋은 와인이 있나봐용 딱딱 추천해주시더라구요 잔 모양도, 도수도 달라서 신기했어요 확실히 둘다 와인과 아이스크림 같이 먹으니 맛이 배가 되는 느낌이여써용 안 마셨으면 아쉬울뻔?? 왼쪽의 파인애플 스피어민트 소금은 와인도 달달하고 진짜 우리취향!! 을 외치면서 먹었어요 도수도 낮은것같고 ㅎㅎ 오른쪽의 바나나 딸기 발사믹 조합의 와인은 도수도 좀 있고 더 무거운 느낌... 한두입 맛보고 친구한테 거의 양보(?)했어요 ㅋㅋㅋ 친구는 술남기는거 아니라고 안남기고 다먹었네유 마지막으로 의도치않게 수박&라임&할라피뇨 맛도 맛볼 수 있었어요ㅎㅎ 이거도 꽤 맛있었었는데 할라피뇨맛 역시 당연히 느껴집니다 ㅋㅋㅋ 다행히? 엄청 할라피뇨!!! 이런 느낌은 아니고 나름 잔잔한 느낌 ㅎㅎ 쪼금 매워요 감당되는 분들만 시키시구 어지간하면 와인이랑 같이 주문하시길....ㅠㅠ 테이블이 얼마없는데 대기손님들 계속있고 무엇보다 저녁먹으로 가야해서 금방나왔네요ㅋㅋㅋ 사장님이 왜캐 빨리가냐구 하셨움... 아이스크림, 와인 좋아하시고 디저트 찾으신다면! 한남동 살리르 추천드려요!(내돈내산)"
"한남동/한강진 젤라또, 살리르 (salir)","예쁜 플레이팅으로 담은 신기한 조합의 젤라또, 살리르 50m © NAVER Corp. 살리르 서울특별시 용산구 이태원로54길 58-20 1층 살리르 위치 및 영업시간 위치 : 용산 이태원로54길 58-20 / 한강진역 3출에서 560m 영업시간 : 월화 휴무, 수목일 16:00-24:00, 금토 16:00-2:00 저녁 먹고 나오는 길에 급 아이스크림이 당겨서 찾아보다가 알게 된 젤라또집 살리르, 메뉴가 진짜 신기했다 럼과 키위 아보카도, 패션후르츠와 데낄라 대추와 호밀빵 요로케 3개를 주문하였다 메뉴는 매달 ? 바뀐다고 하셨다 이외에도 와인바여서 와인메뉴들도 판매 중이었다 내부 자리는 넓지 않은 편, 창문을 바라보고 있는 바자리 하나와 벽을 향하고 있는 바 자리, 그리고 가운데 테이블이 하나 있다 내부가 조용해서 도란도란 이야기하기 좋을 듯 하다 주문은 요기서 ! 다른 아이스크림도 궁금하다 ㅠㅠ 그리고 젤라또 뒤에는 와인이 가득 있다 다음이 와인도 마셔보고 싶다 ! 주문을 하면 물을 먼저 주시는데 컵이 넘 예뿌다 ! 물병이 약간 막걸리 너낌쓰 젤라또는 빠르게 준비해주셨는데 플레이팅이 너무 예쁘다 ! 식기 넘 녜뻐 ㅠㅠ 대추, 호밀빵 젤라또는 조금 달달한 맛이었다 대추가 새 모양으로 올려져 있는데 이거 의도하신 건가요오,, 넘 예쁨 ㅠ 대추향이 은은하게 나고 조금은 텁텁한 식감이었다 다음은 럼과 키위 ! 신기하게 럼맛이 나서 운전할 때 취하지 않을까 걱정이 되었다 희희,,,, 상콤해서 개인적으로 제일 마음에 들었던 맛 마지막은 아보카도, 데낄라와 패션후르츠 아보카도는 역시 맛이 잘 나지 않았고 패션후르츠 상콤함이 넘 좋았다 ღ 너무 예쁜 플레이팅..ღ 이런 식기가 요즘 유행인지 여기저기서 자주 보인다 가볍게 젤라또 먹기에 너무 좋았던 곳 ! 다음엔 와인과 곁들여 먹어보러 갈게요오 #한남젤라또 #한남동젤라또 #한강진젤라또 #한남아이스크림 #한남동아이스크림 #한강진아이스크림 #한강진역젤라또 #한남카페 #한남동카페 #한강진카페 #살리르 #한남살리르 #한남동살리르 #한강진살리르 #한남와인바 #한남동와인바"
한남동 분위기좋은 와인바 '살리르'찐후기 (아이스크림 와인 페어링),한남동 SALIR 매일 16:00 - 24:00 금.토 16:00 - 02:00 매주 월요일.화요일 휴무 50m © NAVER Corp. 살리르 서울특별시 용산구 이태원로54길 58-20 1층 >> ㅑ 하 안녕하세요 생일날 밥먹고 분위기좋은 곳 가고싶다 ~~ 해서 찾게된 와인바 한남동 살리르 찐후기 날립니다 - 매장이 작은편이라 대기 있을 수 있어요! 저희는 인스타그램으로 미리 예약했답니다 V wow 힙한 사장님과 힙한 공간 ...멋있다 .... 살리르는 직접만드신 젤라또랑 와인이랑 페어링 해주시는 곳이에요 ! 아이스크림과 와인이라니.. 독특하지않나요 !? 저희는 무화과랑 샐러리 픽 ! 어떤 와인을 주시려나 ㅎㅎ 두근두근 이날 저희가 마신 와인 ! 꺄 나왔습니다. 떨리는 마음으로 아이스크림 먹고 와인마셔봤는데 생각보다 너무 잘어울렸어요 !! 무화과랑 베이컨도 너무 잘어울리는거있죠 크 다먹어갈때쯤 서비스로 주신 망고 ! 사장님 너무 친절하셨어요 시킨것보다 서비스가 더 많은거 아니냐며 ...ㅋㅋㅋㅋㅋ ㅠㅠ 와인이 술술들어가는 분위기 ~~ 저희 나갈때쯤 단체분들이 들어왔는데 메뉴 하나씩 다시키심... ㅋㅋㅋㅋㅋㅋ 이게 말로만듣던 여기서부터 저기까지 다주세요 인가 ..? 부럽댜 저도 다 맛보고 싶은데요 ~~ 후기가 많이없어서 기대없이갔는데 너무 만족하고 나왔던 곳이에요 ! 조만간 또가야지 ㅋㅋㅋ 색다른 디저트를 경험하고싶으신분들 한남동 와인바 살리르 추천드려요 !
[한남동 와인바] 살리르 SALIR 수제 아이스크림과 와인의 페어링,"#SALIR 한남동에서 아주 이색적인 곳에 다녀와서 바로 블로그에 남겨볼려고 해요 바로 살리르(SALIR)라는 곳입니다. 한남동 살리르 SALIR 서울 용산구 이태원로54길 58-20 16:00~02:00 / 매주 월요일 휴무 0507-1375-3318 금요일 밤에 한남동 골목을 돌아다니다가 가게가 예뻐서 들어가게 된 곳이에요 살리르는 수제아이스크림에 와인을 페어링해주는 곳! 가게 문앞에서 아이스크림가게인지? 와인바인건지 ? 한참을 검색하다가 고민끝에 들어갔어요 그만큼 특별한 메뉴라는 거겠죠?ㅎㅎ 메뉴판 맨 아래 있는 글씨가 아이스크림 종류에요 메뉴하나가 한줄이고, 아이스크림에 들어가는 재료가 쭉~ 나열되어 있다고 생각하시면 됩니다. 아이스크림 단품으로 주문하면 가격은 5,000원이에요 메뉴판을 펼치면 와인종류와 맥주가 있고 사장님이 아이스크림과 어울리는 술을 페어링해주세요 그게 싫으면 술만 단품으로도 주문 가능합니다. 메뉴가 어려워서 주문해서 먹어보기 전까지 사장님이 설명을 해줘도 이해가 잘 안됐어요ㅋㅋ 저는 라즈베리 아이스크림에 페어링을 요청드렸고, 나머지 하나는 그냥 잘나가는 걸로 추천해달라고 했습니다. 가게 내부는 좁지만 인테리가 너무 감각적으로 잘 되어 있어요 조명 하나도 평범하지 않아요 천장을 비추는게 특이하다고 생각했습니다. 여기는 말 안해주면 아무도 모를 것 같은 공간이에요!ㅎ 벽에 있는 철판?을 옆으로 밀면 화장실이 나옵니다. 좁은 공간이지만 흔하지 않은 인테리어 요소들이 많죠? 제가 주문한 복숭아 아이스크림과 라즈베리 아이스크림! 복숭아는 아이스크림 안에 복숭아 과육이 씹혀서 달달했고, 라즈베리는 상큼 그 자체!♥ 아이스크림에 어울리는 와인으로 골라주셨고 사장님이 설명을 진짜 잘해주셨는데 제가 와인을 잘 몰라서 이해를 못했어요 ㅜ 아이스크림을 먼저 한입 먹고 단맛이 입안에 있을때 와인을 마시면 더 잘어울릴꺼라고 하신 것만 기억이 나네요 이거는 아이스크림이 너무 맛있어서 추가 주문한 체다치즈 아이스크림입니다. 이게 먹으면 마지막에 커피향이 은은하게 감돌면서 제일 맛있었던 아이스크림이에요!! 한남동에서 특별한 메뉴나 와인바를 찾으신다면 여기 추천드려봅니다.!! 50m © NAVER Corp. 살리르 서울특별시 용산구 이태원로54길 58-20 1층"
Salir (살리르) 한남동 수제 아이스크림과 와인페어링,"#아이스크림와인페어링 #아이스크림오마카세 @salir_hannam 1F, 58-20, Itaewon-ro 54-gil, Yongsan-gu, Seoul Seoul, Korea Mon-Tue: Closed Wed, Thur, Sun: 4:00pm - 12:00 am Fri, Sat: 4:00pm - 2:00 am Reservation 캐치테이블, 인스타 DM, Call 주차공간은 근처 공영주차장 이용 예전에 쇼비뇽블랑에 더블비안코 아이스크림을 같이 먹은 적이 있다. 조합이 너무 괜찮아서 말했더니 모임에서 살리르 라는 아이스크림+와인 페어링 하는 곳이 있다며 추천받았다. 더워지면 가야지 벼르고 있다가 드디어 다녀왔다. 바 자리로 안내받고 메뉴판을 받았다. 표지엔 이달의 아이스크림맛! 매월 새로운 7가지의 맛으로 메뉴가 바뀐다는 점이 특징이며, 아이스크림 단독으로도 주문 가능하나 원하면 어울리는 와인을 추천받을 수 있다. 첫번째로 먹은 아이스크림은 SAFFRON & CADAMOM 아이스크림 (카다멈: 인도 향신료 이며 생강향이 나는 넛트류 이다) 당연히? 와인페어링 요청했다. 아니 근데 컵이 진짜 농협은행…🤍💙 그리거 두번째로 주문한 APRICOT CHEESECAKE (살구 치즈케잌) ORIENTAL MELON & JAMON & PEPPER (참외 하몽 후추) 이번에도 살구치즈케이크맛 아이스크림과 어울리는 와인을 추천해달라고 요청드렸다. 오렌지와인을 주셨다. 약간 느끼하게 느껴질 수도 있는 치즈케잌에 상큼한 오렌지와인을 끼얹으니 조화가 괜찮았다. 참외셔벗은 딱 먹자마자 여름맛 이었다. 유당불내증이 있거나 유제품을 피하는 분이라면 셔벗으로 드시길 바란다. 이거추천!!! 이제 6월이니 어떤 새로운 맛이 있을까 기대하며 재방문 예정이다.🍨🍷"
한남동 아이스크림과 와인 페어링을 즐기는곳 @살리르,"살리르 한남동 아이스크림과 와인 페어링을 즐기는 곳 [ 주소 ] 서울 용산구 이태원로54길 58-20 1층 [ 시간 ] 16:00 - 24:00 *월화 휴무 한남동 와인바 살리르에 다녀왔다. 가볍게 2차를 할 장소를 찾던중 와인과 아이스크림을 페어링 하는 와인바가 생겼다고 하여 호기심이 생겨서 총총총총 방문 한남동 와인바 살리르는 골목 안에 위치해 있었고 내부는 바테이블 하나와 창가 테이블 하나 그리고 원형테이블 하나로 좌석이 막 많은 편이 아니였다. 마침 우리가 방문했을때는 2인 테이블이 하나 비워져 있어서 호다닥 앉을 수 있었다. 물컵과 아이스크림 스푼이 세팅되어 있었고 사장님께서 메뉴판과 물병을 가져다주셨다. 메뉴판 맨 앞에는 살리르에서 직접 만드는 아이스크림과 와인메뉴가 적혀져 있었고 아이스크림을 고르면 그에 어울리는 와인을 추천해준다고 하셔서 우리는 아이스크림만 먼저 고르고 와인은 사장님의 추천에 따라 주문해 보기로 하였다! 라임 라임 라임 버터스카치 & 피클 한남동 와인바 살리르에서는 다른 아이스크림집에서 보지못한 특이한 여러 아이스크림이 많았다! 좀 흔하지 않은걸 먹어볼까 하다가도 나는 시트러스 더쿠라 라임아이스크림을 주문했고 그에따라 어울리는 화이트와인을 같이 내어주셨다 다른 아이스크림은 조금 색다른 느낌으로 주문해보고 싶어서 버터스카치 피클 아이스크림을 주문했는데 아이스크림과 피클..? 그게 무슨 조합이지..?어떤맛이지..?하는 살짝 걱정과 함께 호기심을 안고 주문했는데 비쥬얼은 귀염 뽀짝 하였다. 살리르 라임라임라임 평소 시트러스느낌 뿜뿜 나는 상큼한 디저트를 좋아하는데 적당히 상큼 하면서도 무거운 느낌도 나는 아이스크림이였다 화이트와인과 페어링 해주셨는데 와인도 무난하였고 라임 아이스크림과의 조합도 좋았다. 살리르 버터스카치&피클 괜찮은 맛일까..?라는 걱정으로 주문했던 버터스카치 & 피클 아이스크림 한입 먹자마자 엇-! 하고 주문하길 잘했다는 생각이 들었다. 평소 자주 먹었던 스카치캔디 버터맛 사탕느낌 ! 피클이 무슨 조합이야?라고 생각했는데 피클 한입 먹자마자 상큼하게 정화되는 느낌도 들고 버터스카치 맛과 너무 잘어울려서 별미라는 생각이 들었다 오히려 피클이 부족해서 피클 더먹고 싶은 느낌이 절로,, 어떻게 이런 조합을 찾으셨지 라는 생각도 들면서 별미로 맛있는 아이스크림이라는 생각이 들었다. 한남동 와인바 살리르는 다른곳에서 접하기 힘든 살리르만의 아이스크림을 맛볼 수 있고 그에 따라 와인페어링이 가능해서 아이스크림을 안주로 즐길 수 있어서 좋았다 아무래도 아이스크림이라 양이 많은 편은 아니여서 가볍게 2차나 마무리 할때 가서 즐기기 좋은곳 아이스크림과 와인 페어링이 재밌었다 50m © NAVER Corp. 살리르 서울특별시 용산구 이태원로54길 58-20 1층"
"[한남동] 수제 아이스크림 와인바 데이트 맛집, 살리르 SALIR","헹슐랭 헤일리입니다. 일본에 갔을때 디저트 술집들이 꽤 있었는데 한국에서는 그런 곳을 못찾겠더라구요. 그런데 최근 제가 원하던 곳을 드뎌 찾았어요. 바로 피토테일 근처에서요 >.< 50m © NAVER Corp. 살리르 서울특별시 용산구 이태원로54길 58-20 1층 살리르 주소 : 한남동 683-56, 1층 영업시간 : 16시-새벽2시 월요일 휴무 반려동물 동반 가능 한남동 공영주차장 뒷편 맛집들이 몰려있는 골목에 이렇게 숨어있을 줄이야!!! 매장이 살짝 안쪽에 있어서 그동안 지나다니면서 못본것 같아요. 매장은 아담해요. 바 테이블과 홀에 2개 정도 테이블이 있어요. 굉장히 모던하고 차가운 느낌의 분위기. 힙 그 자체 뒷편에 꽂혀있는 술들 내가 원했던게 이거자나~~~ 살리르 메뉴 Next image 맨 앞장에는 아이스크림 메뉴 뒷장엔 다 술입니다 ㅎㅎㅎ 셰리, 포트, 와인, 맥주 등 다양해요. 살리르 아이스크림 파인애플, 스피아민트, 소금 딱 지금 계절에 어울리는 청량한 맛이었어요. 살구, 레지아노, 핑크페퍼 살구보단 치즈와 후추의 맛이 지배적인 요리같은 느낌의 아이스크림이었어요. 와인과 페어링이 좋을것 같아요. 헤이즐넛, 커피, 피클 이 무슨 해괴한 조합인가!! 싶어서 시켜봤어요. 그런데, 생각보다 무난한 맛이었어요?? 피클이 이렇게 너티한 아이스크림과 어울리다니!! 함께 주문한 맥주 세종 반 디 브루어 [비어스픽] 북페어링 : 너무 한낮의 연애 두번째 참여한 북페어링 비어스픽에서 주최한 맥주 큐레이션이다 오늘의 책은 바로 '너무 한낮의 연애... blog.naver.com 예~~ 전에 마셔보았던 '라 시렌 와일드 세종' 이 떠오른 맛. 효모의 쿰쿰한 매력이 있는 맥주였어요. 이렇게 예쁜 샴페인잔에 따라주셨어요. 갖고 싶은 탐나는 잔 맥주와 아이스크림도 꽤 잘 어울렸어요. 다음에는 다양한 술과 아이스크림 페어링을 시도해보려구요. 새로운 미식경험을 원하는 분 2차로 가볍게 즐길 곳 찾는 분들 특별한 아이스크림 좋아하시는 분 아이스크림과 맛있는 술을 즐길 수 있는 아이스크림 바 살리르 였습니다. #살리르 #한남동아이스크림 #한남동와인바 #이태원아이스크림 #이태원와인바 #디저트바 #아이스크림바"
