title,content
한남동 젤라또 맛집 살리르 salir 고급 아이스크림 맛집,"내돈내산 맛집 고급 디저트 맛집 한남 살리르 한남동에서 놀다가 후식으로 아이스크림, 젤라또를 먹고 싶어 찾다가 발견한 살리르. 블로그 리뷰 수가 많지 않은 걸 보면 덜 유명한 곳 같은데 조만간 엄청 유명해질 것 같다. 일단 젤라또가 평범하지 않았고, 분위기가 참 독특했기 때문이다. 📍살리르 한 줄 요약 1. 한남동 젤라또 아이스크림 맛집이다. 2. 내부가 협소해 자리를 잘 잡아야 한다. 3. 아이스크림과 함께 와인을 페어링 해 먹을 수 있다. 4. 분위기도 고급스럽고, 유니크하다. 5. 남자 직원분이 친절하게 아이스크림 설명을 해주신다. 6. 어디서 먹어보지 못한 유니크한 아이스크림을 맛볼 수 있다. 살리르 📍주소 : 서울 용산구 이태원로54길 58-20 1층 ☎️전화번호 : 0507-1375-3318 🕘영업시간 : 16:0~24:00 금, 토 16:00~01:00 월, 화 정기휴무 🚘주차 : 불가능 살리르 가는 길 살리르는 한강진역 3번 출구로 나와 EMIS한남 또는 마르디메크르디 매장 근처에 있는 골목으로 들어가면 된다. 간판이 쉽게 보이지 않는 곳이라 잘 찾아가야 한다. SALIR 라고 적힌 곳이 바로 살리르 살리르 골목에는 벽에 이런 간이 테이블도 있었다. 내부가 좁기 때문에 손님이 많을 경우 이곳에서 서서 젤라또를 맛봐도 좋을 것 같다. 살리르 내부 살리르는 와인과 젤라또 아이스크림을 파는 곳으로 부엌 안쪽에는 저장된 와인이 많았다. 자리는 이렇게 벽을 보고 앉을 수 있는 두 개의 자리와 카운터 바 앞에 앉는 자리 그리고, 매장 가운데 위치한 원테이블 자리가 있었다. 최대로 인원을 수용해도 7명쯤..? 10명 정도 수용이 가능해 보였다. 살리르 메뉴판 이달의 아이스크림 메뉴가 있었고, 매달 다른 맛을 맛볼 수 있는게 살리르의 매력이다. 메뉴 이름도 어려웠는데 읽기 힘든 독특한 폰트로 적혀져 있었지만 직원분이 오셔서 메뉴 하나하나 어떤 재료가 들어갔는지 설명해 주셔서 아이스크림을 고르기 쉬웠다. 한남동 아이스크림 맛집 살리르 젤라또 메뉴 설명 영상 재생 4 좋아요 0 00:00 00:32  한남동 아이스크림 맛집 살리르 젤라또 메뉴 설명 영상 메뉴를 설명해 주시는 걸 촬영한 영상인데 초고추장이 들어간 아이스크림 등 정말 독특한 메뉴가 많았다. 진짜 신세계… 우리는 대저 토마토 살사 & 나쵸와 화이트초콜렛 & ABSINTHE(압생트)를 주문했다. 다른 분들은 와인과 함께 아이스크림을 페어링해 드셨지만 술찌인 우리는 물과 먹었다. 와, 아이스크림이 나왔는데 플레이팅이 예술이었다. 이렇게 매력적이게 생긴 아이스크림은 처음.. 도자기 그릇도 엄청나게 이뻤다. 주황색의 로고도 이쁘고. 화이트초콜렛&압생트 7,000원 화이트초콜렛&압생트부터 먹어보았다. 가격은 처음에 안적혀 있어서 이렇게 고급스럽게 나오는데... 비쌀 수도 있겠다 생각했는데 하나 당 7,000원쯤 했던 것 같다. 분위기와 맛에 비하면 합리적인 가격이라고 생각한다. 화이트초콜릿으로 만든 아이스크림 위에 중국 향신료인 구운 팔각을 올린 아이스크림이었다. 화이트초콜릿 아이스크림은 쫀득하고 진했다. 근데 뭔가 먹을수록 술맛이 느껴져서 뭐지!!!? 했는데 메뉴명 옆에 적힌 압생트가 술맛의 주범이었다. 아니스 향이 아주 강하고 알코올 도수가 높은 술이었는데 은근 달달한 화이트 초콜릿과 잘 어울렸다. 아직도 이 맛이 기억나는 거 보면 새로운 독특한 맛의 조화로운 아이스크림이었던 것 같다. 대저토마토살사&나쵸 7,000원 이것도 정말 독특했던 아이스크림이다. 대저토마토로 만든 얼음 자글자글한 아이스크림에 라임과 고수 그리고 매콤해 보이는 고추, 나쵸 한 조각이 나오는 구성이었다. 대저토마토에는 고수 혹은 일본 시소 잎이 들어갔는지 특정 향이 느껴졌다. 평소에 고수를 즐겨먹는 편은 아니지만 이 대저토마토 아이스크림에는 잘 어울리고 맛이 조화로웠다. 맛을 조금씩 보고, 라임을 뿌려 상큼하게 먹어보았다. 나쵸를 부숴 나쵸 위에 대저토마토 아이스크림(얼음)을 올려 먹었는데 이것도 맛있었다. 단순히 한남동에서 젤라또 맛집을 찾다가 발견한 귀한 아이스크림 집 살리르. 7,000원에 고오급 디저트 아이스크림을 먹은 경험이었다. 한남동 방문하면 무조건 재방문 의사 100% <한남 타코 맛집> https://blog.naver.com/dudn305/223167099696 한남 맛집 타크 캐치테이블 후기 웨이팅 꿀팁 (feat. 1시간 웨이팅) 맛집 한납 타코 맛집 타크(tac) 방문 후기, 캐치테이블 후기 한남동이 핫한 동네라는건 알았는데, 유명 음... blog.naver.com 50m © NAVER Corp. 살리르 서울특별시 용산구 이태원로54길 58-20 1층"
[한남] '살리르 Salir' 한남동 수제 아이스크림과 와인 페어링,"와인도 좋아하고 아이스크림도 좋아하는 사람..! 저요 근데 와인이랑 아이스크림을 같이 먹어본 적은 없었다 ㅎㅎㅎ 수제 젤라또와 어울리는 아이스크림을 함께 먹을 수 있는 곳 한남/한강진역 근처 이색 데이트 장소를 찾는 분께 추천드리고픈 곳이다 살리르 Salir 영업시간 수,목,일 16:00-24:00 금,토 16:00-01:00 매주 월, 화 정기 휴무 연락처 0507-1375-3318 예약, 반려동물 동반 가능 골목 사이로 들어가야 찾을 수 있는 살리르 눈을 크게 뜨고 찾아야 한당 ㅋㅋㅋ 아는 사람만 찾아 오는 젤라또집 살리르 안으로 들어오니 분위기 있는 음악과 이런 갬성진 테이블이 있었다 ㅎㅎ 이런 바테이블도 있고 뒷쪽에 홀테이블도 있긴 하다 한남동에 이런 젤라또집이 있었다니 살리르 Salir 메뉴, 가격 한남 젤라또집 살리르는 매 달 메뉴가 새롭게 바뀐다. 9월에는 전부 다른 맛이지만 전부 같은 검정색의 아이스크림을 판매중이셨다. 네이버에 사장님이 올려두신 메뉴! 사진에서 보다시피 전부 검정색이고 메뉴에 따라 토핑이 추가되는 것도 있다 아이스크림은 개당 7,000원 메뉴판을 보면 알겠지만 ㅋㅋㅋㅋ 다른 수제 아이스크림, 젤라또집에서는 보기 힘든 맛들이 많다. 시솔트, 에스프레소는 그나마 흔해보이는데 트러플, 패션프루트+핫소스, 카프레제, 커리, 스모크치즈는ㅋㅋㅋㅋ 이런 맛 아이스크림 첨 본다구요.. 살리르 Salir 주류메뉴 , 가격 안쪽은 페어링해서 먹을 수 있는 주류 메뉴가 있었다 직접 골라도 되지만 뭘 먹을지 모르겠을 때 사장님이 잘 어울리는 걸 추천해주시니 추천 와인과 페어링 해보시는 걸 추천한다. Maldon Sea salt 말돈 시솔트 (7.0) Espresso 에스프레소 (7.0) Real Tesoro Fino 레알 테로소 피노 (10.0) 총 24,000원 우리는 이날 저녁 술약속이 있었구.. 오빠는 운전을 해야 해서 ^^........ 내거만 시키고 오빠는 딱 한 입 맛만 보여주기로 ㅋㅋㅋㅋ 아이스크림마다 어울리는 와인이 다른데.. 내가 시킨 시솔트 맛만 페어링 와인을 주문했다. 새까만 젤라또들 ㅋㅋㅋㅋㅋㅋㅋㅋ 이게 무슨 비주얼이냐며 ㅋㅋㅋㅋㅋㅋㅋㅋㅋㅋ 신박하다 신박해!!! 사진에서 보다시피 맛이 달라도 모두 새까만 색이다 ㅋㅋㅋㅋㅋㅋㅋ 왼쪽이 시솔트 오른쪽이 에스프레소 (아마 그럴걸요...?) 사진으론 나도 구분이 안 간다 ㅋㅋㅋㅋ 와인을 이렇게 양껏 따라 주셔서 너무 좋았다 아이스크림과 와인,, 처음이야!! 시솔트는 짭쪼름한 바닐라아이스크림? 먹어본 듯 한 맛에 더 고급져진 맛이었는데 무난할 거라 생각했던 에스프레소 맛은 완전 신기한 맛이었다. 그도 그럴 것이 에스프레소+파인애플+민트의 조합이라 ㅋㅋㅋ 되게 복잡 미묘했다. 분명 시작한 맛은 에스프레소인데.. 입맛을 다시다보면 파인애플 맛도 나면서 끝맛은 또 민트임 ㅋㅋㅋ 이건 직접 먹어봐야만 아는 맛이다 ㅋㅋㅋ 커리맛이랑 트러플, 패션후트츠 핫소스맛도.. 넘 궁금했는데 다음 일정이 촉박해 못 먹어본 게 한이다 ㅜ-ㅜ 매달 맛이 바뀌어 못 먹어볼 거 같당.. 누가 저대신 먹어주세요... 분위기도 넘 좋고 새로운 경험을 해봐서 둘다 넘 재밌어서 계속 낄낄댔다 ㅋㅋㅋㅋ녹아서도 검정 색소 들어간 게 티나는ㅋㅋㅋㅋ 단점이라면 입술과 혓바닥이 이렇게 검정색으로 물든닼ㅋㅋㅋㅋㅋㅋ 썸탈때는 9월은 방문 금지............. 친한 사람 끼리 와야할 듯 ㅋㅋ 50m © NAVER Corp. 살리르 서울특별시 용산구 이태원로54길 58-20 1층 #한남동데이트 #한남동아이스크림 #한남아이스크림 #한남동젤라또 #한남젤라또 #한남동이색데이트 #한강진역데이트 #한강진역아이스크림 #한강진역젤라또 #한강진아이스크림 #한강진젤라또 #한남동와인 #와인젤라또 #와인아이스크림 #아이스크림와인 #젤라또와인 #아이스크림와인페어링 #젤라또와인페어링"
한남동 '살리르 SALIR' 후기/ 수제 아이스크림과 술 페어링,"한남동에 맛도리 아이스크림과 와인을 페어링 해주는 곳이 있다고해서 방문했다! 살리르 📍위치: 서울 용산구 이태원로54길 58-20 1층 ⏰시간: 목, 일 16:00-24:00 금, 토 16:00-01:00 (월, 화 휴무) 📝: 전화 및 캐치테이블 예약 가능 ✨독특한 수제 아이스크림에 어울리는 술을 페어링 해주는 방앗간 같은 공간 50m © NAVER Corp. 살리르 서울특별시 용산구 이태원로54길 58-20 1층 살리르는 현대카드 스토리지 뒷골목에 숨겨져있다! 길을 지나가다가 보면 요런 표지판을 보고 들어가면 된다. 앞에 쓰여있는 6월에 아이스크림 메뉴들 저 표지판이 없었다면 나는 절대 찾지 못했을거야..... 골목 맨 안쪽에 자리잡고 있다. 매장 내부는 좁은 편이다. 바로 앞에 보이는 2인 테이블과 중간에 3-4인용 테이블, 그리고 바 자리가 전부이니 방문하는 인원이 많다면 예약이 필수다! 나는 운좋게도 워크인으로 바로 들어갔지만, 고 사이 자리가 없어서 돌아가시는 분들이 여럿 있었다 ㅠㅠ 그치만 묵직한 음식을 파는건 아니어서 이른 시간엔 회전이 빠를 것 같긴 하다. 살리르 메뉴판 살리르 메뉴판 앞쪽에는 아이스크림 메뉴들이 써있다. ~내가 방문한 6월의 아이스크림 메뉴~ 똠양꿍 그라니따와 브리오슈 블루치즈와 배 체리 블라썸 오크라와 와사비 ?.? 도대체 무슨 맛일지 너무너무너무 궁금해지는 이름들ㅋㅋㅋㅋ 넘나 궁금했지만 동시에 무슨 맛일지 무서워서 믿고 먹는 메뉴들만 골랐다🤪 메뉴는 달마다 달라지는 것 같다! 펼쳐보면 주류 메뉴들이 있다! 와인, 맥주, 보드카 등등 굉장히 다양한 종류의 술이 있다. 나는 아이스크림에 페어링 해주시는 술을 먹어보기로 했다💗 블루치즈와 배, 그나리따와 브리오슈! 페어링 해주신 와인도 함께 나왔다. 다녀온지 한 달 넘어서 뭐였는지 기억이 안난다;;;;; 진짜 잘어울렸는뎅 ㅠㅠ 블루치즈와 배는 맛없없 조합 ㅜㅡㅜ 꼬릿한 고소한 블루치즈에 배가 올라가니 더 달큼했다. 거기에 같이 주신 레드 와인을 마시니 풍미가 x1000 🌟 상큼한 그라니따에는 역시 화이트 와인이 잘어울렸다. 상큼이 배가 되고 깔끔해서 디저트로 먹기 아주 좋았다>< 요렇게 둘이 먹고 가격은 3만 2천원이 나왔다! (맞나?) 아이스크림만 먹으면 7천원, 페어링까지 함께하면 16000~원 정도 되는 것 같다. ㅎㅅㅎ....첨엔 넘나리 당연하게 아이스크림+페어링이 7천원인줄 알았다. 바보 맞음. 양심 없는것도 맞음 ㅠ 한남동에서 오며가며 가볍게 들르기 좋은 곳이다. (지갑은 무거워야 함.💸) 다음엔 어떤 메뉴가 나올지도 궁금하다 담에 또가야지!"
"한남동 와인바 살리르 - 와인과 아이스크림의 완벽한 페어링, 데이트코스로 딱 (대기/메뉴)","아이스크림과 와인의 완벽한 페어링 제철 재료 수제 아이스크림과 와인 한 잔 독특한 컨셉의 아이스크림 와인바 🍨🍷 @ 한남동/이태원/한강진 살리르 SALIR 요즘들어 자주 찾게 되는 한남동 👀 기종이랑 밥 먹고 2차 갈 곳 찾다가 발견하게 된 한남동 아이스크림 와인바 살리르(SALIR) 아이스크림과 와인의 페어링이라니..! 아이스크림 와인바라는 독특한 컨셉에 끌려 바로 방문해봤는데 너무 만족스러웠다 가볍고 산뜻한 입가심과 동시에 딱 한 잔만 더 ~ 😇 하기 좋았던 한남동 살리르(SALIR) 추천 후기 한남동 아이스크림&와인바 살리르(SALIR) 서울 용산구 이태원로54길 58-20 1층 화요일-일요일 16:00-02:00 (매주 월요일 정기휴무) 50m © NAVER Corp. 살리르 서울특별시 용산구 이태원로54길 58-20 1층 한남동 와인바 '살리르' - 위치/대기 한강진역 3번 출구에서 도보 7분 컷! 테이블 적어 웨이팅 있음 주의 (대기명단 올릴 수 있어요) 한남동 '살리르'는 한강진역 도보 7분 거리 디앤디파트먼트 건물 뒷쪽 골목길에 있다 이태원 메인로드 뒤쪽 언덕 아래 한남동 바이브가 물씬 느껴지는 곳! 골목길 구석진 곳 안에 있어 찾기 어려웠는데 어떻게들 알고 오는지 이미 매장은 만석..😞 다행이도 전화번호 남기고 대기가 가능해서 대기 올려놓고 주변 산책하며 기다렸다 기종이랑 골목길에서 사진 찍고 놀다가 30분 뒤에 전화받고 매장으로 뛰어갔다 🤧 한남동 와인바 '살리르' - 내부/메뉴 다양한 아이스크림과 추천 페어링 와인을 함께! 아이스크림 단품, 주류만도 따로 주문 가능 :) 골목길 안쪽 이런데에 가게가 있나 싶은 곳에 은밀하고 위치하고 있는 살리르 👀 4인용 테이블, 창가쪽 2인석 바 좌석 4인 정도의 아담한 내부 우리는 내가 좋아하는 바 테이블로 안내를 받았다 😇 인더스트리얼한 컨셉의 바 인테리어 콘크리트와 메탈의 조화 너무 쿨하다 벽면에 있는 와인렉이 정말 멋졌는데 저건 기성품 아니라 제작이겠지..? 👀 나중에 큰집 이사가면 나도 저렇게 해야지(?) [ 한남동 살리르 SALIR 메뉴판 ] 아이스크림과 주류로 구성되어 있는 메뉴 아이스크림은 단품으로 주문 시 5,000원 특이한 점은 모든 메뉴에 꽃이 함께 나온다 🫢 카모마일/세이지/아카시아/장미/해바라기 등 플레이버와 어울리는 꽃으로 데코해주시나봄 주류는 포트/셰리/마데이라 등 주정 강화 와인 종류와 일반 와인 그리고 벨기안 맥주 등 다양하니 참고 아보카도 고수꽃 조합 먹어보고 싶었는데 오늘은 주문이 안 된다고 하셔서.. ✔️ 오리엔탈멜론 아이스크림 ✔️ 다크초콜렛 아이스크림 + 글래스와인 으로 시켜보았다 😇 수제 아이스크림의 맑고 담백한 비쥬얼 테이크아웃이나 포장도 가능한 것 같다 나란히 앉는 바 자리 좋아하는 1인.. 데이트나 소개팅 2차로 오기 좋을 것 같다 물론 나는 유부초밥이라 해당사항 없음 한남동 와인바 '살리르' - 아이스크림과 와인의 완벽한 페어링 내가 시킨 다크초콜렛 아이스크림 말린 해바라기 꽃잎이 귀엽게 올라가있다 차가운 컵에 예쁘게 담아 정성스런 데코까지 마치 파인다이닝 식사 후 나오는 디저트 같다 👀 나는 우유 베이스의 부드럽고 진한 맛으로 먹고 싶다고 했더니 추천해주신 메뉴였는데 아이스크림 안에는 해바라기씨가 들어있다 쌉쌀달콤고소한 맛의 파티 와인은 어떤 스타일 좋아하는지 말씀 드리면 직원분께서 아이스크림과 어울리는 걸로 페어링해서 맞춰서 내어주시는 구조다 추천해주신 와인은 '셰리와인' 종류로 포트와인처럼 와인에 브랜디를 추가해 도수를 높여서 만든 주정 강화 와인 종류 포트와인보다 덜 달달한 편이라 드라이한 와인 좋아하는 내 입맛에 딱! 너티 스모크 오크함이 느껴지는 뉘앙스라 다크초코와 정말 잘 어울리는 맛과 향이었다 내가 아이스크림도 와인도 다 좋다고, ISFJ 종특인 아무거나 추천해달라고 했는데 이렇게 찰떡콩떡으로 내어주셔서 감동 🥹 기종이가 시킨 오리엔탈멜론 아이스크림 아카시아 꽃이 올라가있는데 향이 대박이었다🤍 오리엔탈멜론이 뭔가 싶었는데 참외였음! 한 입 먹어보니 리얼 참외향이 가득한 것이 첨가물 없는 풍성한 원재료의 맛과 항이 좋았다 개운하고 상쾌한 샤베트 타입이라서 식사 후 입가심 리프레시에 딱 좋을 맛 요즘 가장 인기 많은 플레이버라고! 아이스크림 한 입에 셰리와인 한 잔 이리도 섬세하고 고급진 디저트라니 👀🖤 아이스크림 장르를 이렇게 풀어내다니.. 역시 새로운 식경험에 쓰는 돈은 아깝지 않다! 매장 BGM도 정말 좋았는데 옆테이블 손님들과 하시는 이야기 들어보니 이태원 하우스 바 통로(Tongro) 사장님? 이 차시렸는지.. 무튼 관계가 있다고 하심 기종이 아는 형이 하는 곳이라.. 적극적으로 아는 척 하고 싶었지만 ISFJ ISTJ는 가마니 있었읍니다... 다 먹어갈 즈음에 서비스로 내어주신 팝콘플라워 아이스크림 옥수수맛 아이스크림에 팝콘이 올라가있다 서비스를 주시다니요 감사합니다 🤧💛 고소하고 달콤한 옥수수맛에 바삭하고 짭짤한 팝콘토핑 조합 사장님 진짜 맛잘알 인정.. 간만에 신선하고 만족스러웠던 미식경험 😋 아이스크림과 와인 페어링이라는 새로운 경험과 친절하고 따뜻한 접객, 멋진 공간 연출과 BGM 기분 좋은 입가심과 가벼운 한 잔, 아이스크림과 와인의 아름다운 마리아쥬 🤍 한남동 와인바 살리르 추천드립니다 ▼한남동 와인바 추천 포스팅도 보고가세용▼ 한남동 라핀부쉬 - 프랑스식 포장마차 컨셉의 분위기 좋은 와인&다이닝바 (예약/메뉴) 마포 샤퀴테리 전문점 랑빵스81에서 오픈한 프랑스 포장마차 컨셉의 와인&다이닝바 이태원에서 프랑스 ... m.blog.naver.com"
"살리르, 한남동 아이스크림 와인바 ( 한남동 2차로 가기좋은 와인바 추천 )","살리르 📍서울 용산구 이태원로 54길 58-20 1층 📞 0507-1375-3318 ⏱️ Wed-Sun 16:00~24:00 (Fri-Sat 16:00~02:00) 🚗 주변 공영주차장 이용 살리르 서울특별시 용산구 이태원로54길 58-20 1층 한남동에서 밥을 먹고, 간단하게 와인 한잔 하려고 들어갔던 살리르 (하지만 간단하지 않게 되었다) 아이스크림과 술을 페어링 하는 아이스크림바 라는게 신기하고 궁금하여 찾아가 보았습니다. 살리르는 한강진역 뒷 골목 쪽에 위치하고 있습니다. 오후 4시부터 오픈인데, 10분 전 쯤 도착하여 앞에서 살짝 대기를 하고 들어갔습니다. 살리르의 내부 입니다. 노출된 내부 벽 마감과 바 테이블의 금속 상판, 콘크리트 하부 마감이 시크하면서도 힙한 느낌의 분위기를 나타내고 있습니다. 바 테이블 너머로는 오픈키친 공간이 있습니다. 벽에 있는 금속 와인랙이 돋보이는 인테리어 입니다. (사장님이 직접 디자인 하였다고 합니다) 바 테이블 좌석 뒷 쪽으로는 작은 테이블 좌석도 있습니다. 공간의 시크한 분위기와 어울리는 금속 마감의 가구들도 눈에 띕니다. 카운터 앞에는 요렇게 아이스크림이 진열되어있습니다. 살리르의 메뉴판 입니다. 앞에는 아이스크림 메뉴가 있고, 메뉴판을 열면 안 쪽엔 주류 메뉴들이 있습니다. 처음들어본 술들이 대부분이라, 일단 아이스크림을 주문하고 거기에 맞는 주류를 추천받아 주문하기로! 참고로 살리르의 아이스크림 메뉴들은 매달 바뀐다고 하니, 제가 먹었던 메뉴들은 다음엔 없을지도... (9월의 메뉴 였습니다!) Guinness & Fried Twix 기네스 맥주 베이스로 만든 아이스크림에 튀긴 트윅스가 올라간 메뉴. 진하면서 부드러운 아이스크림과 튀긴 트윅스 조합이 생각보다 너무 좋았어서 깜놀!! 패트러스 보르도 에이지드 위드 러브 (15.0) 이 맥주와 조합이 좋다하여 마셔봤는데, (처음 본 맥주였음) 가볍고 살짝 달콤함과 산미도 느껴지는 맥주였습니다. 아이스크림과 같이 먹어봤는데, 오? 새롭게 신선하면서 맛있었습니다!! 자꾸 손이 가게되는.. 역시 사장님이 추천하는 이유가 있었습니다! Ricotta & Dill & Mustard 리코타 치즈와 레몬, 딜을 넣은 아이스크림 위에 디종 머스터드가 올라간 메뉴. 이 재료의 조합들은 뭐지? 하는 생각이 드는데, 한 입 먹어보고는 역시 감탄. 부드럽고 상큼한 아이스크림과 톡쏘는 맛이 느껴지는 머스터드와 조화가 좋았습니다. 리얼 테소로 피노 (10.0) 이 아이스크림과 어울린다는 리얼 테소로 피노 쉐리를 추천 받았습니다. 이 조합도 좋아서 계속 먹게되는!! 아이스크림의 재료들이 생각치도 못한 조합들이라 호기심도 들고, 또 그 조합들이 잘 어우러져 놀라운 맛을 만들어냅니다. 또한, 각기 다른 주류들과 조합이 좋아 너무 재미있습니다!! Mango & Habanero + 알렘브리 모스카텔 드 세투발 진하면서 달콤한 망고와 매운 하바네로고추와 어우러진 아이스크림 메뉴는 과일향 진한 포트와인과 잘 어울렸습니다. Smoked Salmon & Caper berry 이름부터 신기해서 주문해본 아이스크림 메뉴. 연어와 아이스크림이라니..? 먹을 수록 훈제 연어의 맛이 느껴지면서, 아이스크림으로 해도 잘 어우러져서 놀라웠습니다. 화이트와인과 잘 어울렸던 메뉴. 먹어볼수록 너무 재미있는 살리르! 이건 뭐였더라.. 이것도 맛있었는데..!! Sambuca & Coffee 삼부카와 커피의 조화로움을 느낄 수 있는 아이스크림. 이렇게 적고보니까 이 날 진짜 많이 먹은 것 같습니다^.^.. 종류별로 다 먹어본 듯ㅋㅋ Jujube & Rye bread 무화과 & 하몽 / 아보카도 패션후르츠 데낄라 그 외에도 계속 종류별로 다 먹었다는… 살리르는 아이스크림과 술을 같이 즐기는 컨셉부터 너무 신선했고, 다양한 재료와 맛을 풍기는 아이스크림도 놀라웠습니다. 그리고 각 아이스크림 마다 어울리는 주류들도 달라 하나씩 맛보는 재미도 있었습니다. 다음 메뉴가 궁금해지는 살리르!! 또 가야겠습니다! #살리르 #한남동살리르 #한남동와인바 #한강진와인바 #한남동와인 #한남동아이스크림바 #한남동아이스크림"
