title,content
명동 남산타워뷰 루프탑 카페 구할구,"명동카페 / 남산카페 / 남산타워뷰카페 카페 구할구 안녕하세요 이써니입니다. 요즘 날씨가 너무 좋아서 루프탑카페나 테라스카페 찾는 분들 많으시죠 ?! 남산돈까스 먹으러 갔다가 저도 명동 카페 검색했는데요 - 남산타워뷰 가 보이는 명동 루프탑 카페가 있어서 방문해보았어요 ! 명동 카페 구할구 소개해드릴게요. 카페구할구 남산 0507-1486-5953 서울 중구 퇴계로20길 73 카페 구할구 50m © NAVER Corp. 카페구할구 남산 서울특별시 중구 퇴계로20길 73 카페 구할구 예약 명동 카페구할구 남산은 명동역에서 도보 10분정도 소요되는것 같아요. 대신 남산가는 길이라 언덕길이긴 하지만 요즘 날씨도 선선하고 해서 천천히 올라가면 힘들지 않더라고요. 남산타워 가는 길 유명한 목멱산방 바로 옆에 위치한 카페구할구 남산 검색해보니 제주도에도 위치한 카페였어요 ! 1,2,3층과 루프탑까지 카페를 통으로 쓰는 건물이라 생각보다 규모가 있던 남산 카페였어요. 카페구할구 남산 가고자 하는 분들에게 전해드릴 사항이라면 평일 점심시간에 가지마세요..... 하필 평일 점심시간인 12시쯤 도착했고 주문부터 줄이 어마어마했고요 ?! 자리잡고 내려와서 주문했는데 음료 10분정도 걸린다고 하셨는데 30분 넘게 기다렸다 받을 수 있었답니다^_ㅠ 근처 직장인분들이 테이크아웃 하시는 분들이 많으니 평일 점심시간은 꼭 피해가세요...!!! 명동 남산타워뷰 루프탑 카페 카페구할구 메뉴 & 가격 아메리카노 4,500원으로 무난한편이었고요. 크로플이나 브런치메뉴도 있어서 브런치 먹으러 방문해도 좋을 것 같더라고요. 저는 돈까스 먹을거기 때문에 ! 요즘 커피를 자주 마시지 않으려고 하고 있지만 언덕 올라가니 목이 타서 아이스아메리카노 주문했고 아빠음료로 제주감귤주스 주문해드렸어요. 잔와인이나 맥주 등도 판매중이라 저녁시간에 가서 맥주한잔 해도 좋을 것 같더라고요. 10시부터 14시까지 크로플 , 크루아상, 통밀쿠키중 1가지와 아메리카노를 7,500원에 판매하고 있어서 디저트 드실 분들은 그렇게 주문하는게 이득일것 같고요 ?! 구움과자들 준비되어 있어서 간식으로 주문해도 좋을 것 같아요. 이제서야 눈에 들어오는 단백질쿠키는 어떤건지 궁금하네용 크루아상도 준비되어있쥬 샌드위치같은거 시켜서 커피랑 먹으면서 여유부리면 좋을 것 같은 남산카페입니다 ! 음료기다리면서 사진남겨보기 1층에 음료주문하고 기다리는 분들이 많아서 사람 빠질때 기다렸다 찍었어요^_ㅠ 1층은 먹고갈 자리는 따로 없어요 - 의자가 있긴 한데 음료 기다려서 픽업해가는 분들이 앉아있기 좋은 자리였고요 ?! 계단이 꽤나 높은 편이기 때문에 루프탑에 자리잡고 내려와서 음료 나올때까지 올라갔다 또 내려왔다가 음료 가지고 또 올라갈 자신이 없어서 아래서 기다렸는데 그게 30분이 넘을줄이야 울아빠 나 도망간줄 알았을듯...ㅋㅋㅋㅋ 명동 남산타워뷰 루프탑 카페 구할구 남산 2층 점심시간 지나고 나가려고 보니 자리가 꽤나 많이 빠졌길래 내부도 열심히 담아보았어요 - 층마다 창가자리가 있고 높이에따라 아무래도 뷰가 조금씩 달라지겠죠 ?! 2층은 벽돌이 포인트인 인테리어였어요 2층은 아무래도 아주 높지 않기 때문에 리라초등학교 뷰, 육교뷰이고 ㅋㅋㅋㅋㅋ 오른쪽으로 보면 남산타워가 보인답니다. 3층은 이런 분위기 벽돌 인테리어에서 화이트톤으로 바뀌었죠 ?! 테이블도 조금 더 낮은 테이블에 편안한 소파였고 단체가 앉기 좋은 공간도 있었어요. 화장실 2층 3층에 모두 있는것 같아요 3층 화장실 이용했는데 한칸이었고 깔끔한 편이었어요 ! 물과 티슈 등 가져다 먹을 수 있게 셀프바로 준비되어 있고 음료 잔도 이쪽으로 두고 가면 되더라고요. 애견동반 주의사항이 붙어있는걸 보니 반려견 동반 가능한 카페이더라고요 ?! 남산에 멍뭉이 산책하러 오신 분들 많이 봤는데 산책왔다가 커피한잔 하고 가시기에도 좋을 것 같은 남산 카페였답니다. 저는 루프탑에 앉았다가 눈이 너무 부시는 관계로 3층 창가자리에 앉았답니다. 역시나 리라초등학교 뷰이긴 하지만 오른쪽으로 고개 돌리면 남산타워가 2층보다 훨씬 잘 보이더라고요. 명동 카페 구할구 루프탑 루프탑에도 자리가 꽤 준비되어 있었어요. 면적이 넓은편은 아니나 2층 3층 루프탑까지 있어서 꽤나 자리가 넉넉한 편이었어요 이쪽은 그냥 시티뷰였어요 ! 저는 처음에 해를 피해서 이자리로 앉았는데 , 해는 가려지는데 뷰가 보이는 자리는 아니라 아쉬워서 결국 3층에 자리잡은거랍니다. 여기 자리잡고 주문하고 올라오는데 30분 넘게 걸려찌... 루프탑에서는 남산타워가 확실히 더 잘보여요 ! 근데 저쪽 자리는 눈이 너무 부셔서 못앉겠더라고요 ㅋㅋㅋㅋ 해가 뜨거운 가을이었다..!! 음료 받아와서 남산타워 배경으로 사진찍어보기 바람 솔솔 불고 시원한데 해는 뜨거웠던 날인데 선글라스만 있어도 이쪽 자리 앉으면 좋을 것 같고요. 카페 찾아보면서 블로그 다른분거 보니까 책가져가서 책읽으면서 시간 보내셨던데 진짜 책읽으면서 시간보내기 좋을 것 같은 남산 카페였어요. 음료는 테이크아웃잔에 주셔서 좀 아쉬웠어요 카페에서 먹으면 플라스틱잔 못쓰지 않나 싶기도 한디...? 점심시간에 사람이 몰려서 그런것 같기도 하고요 ?! 아이스 아메리카노 4.5 목말라서 주문한 아메리카노 무난하게 마시기 좋았어요. 1,000원 추가시 디카페인 원두로도 변경 가능하더라고요. 라떼종류도 1,000원 추가시 오트밀크로 변경가능하고요. 제주 감귤주스 6.0 식사하러 가야해서 배부르지 않을 주스메뉴로 주문해드렸는데 너무 시다고 하시더라고요 ㅋㅋㅋㅋ 난 달달한 감귤쥬스 생각했는데 아빠입엔 시다고 하셨어요 근데 신거 진짜 잘 못드시는 편이긴 합니당 아이스크림메뉴같은거 있음 그거시켜드리면 좋겠다 싶었는디 없어서 쥬스 시켜드린건데 메뉴선정 실패했고요...? 논커피 메뉴도 스무디나 에이드 메뉴 등 다양했어요 ! 3층 창가에서 애기들 하원하는것도 보고 ㅋㅋㅋㅋㅋ 시원한 바람 맞으며 시간 보내기 좋았던 남산타워뷰 카페 구할구! 점심시간에 간것만 아니면 더더 만족스러웠을것 같지만 오랜만에 여유롭게 루프탑 즐기기 좋았던 명동카페였어요 !"
[명동] 카페구할구 남산 남산타워뷰 루프탑 카페,"""남산이 시원하게 보이는 뷰"" 남산과 명동 시티뷰를 조망할 수 있는 카페구할구 남산 에 다녀왔습니다. 카페구할구 남산 서울시 중구 퇴계로20길 73 카페 구할구 월-금 10:00~20:00 토,일 10:00~21:00 50m © NAVER Corp. 카페구할구 남산 서울특별시 중구 퇴계로20길 73 카페 구할구 예약 1. 찾아가는 길 남산 케이블카 가는 방향 리라초, 숭의여대 맞은편에 위치한 카페 구할구 명동역에서도 걸어서 5분 남짓으로 가깝고 4층 루프탑까지 건물 하나를 통으로 쓰고 있어서 찾기가 어렵지 않습니다. 2. 내부 모습 1층은 따로 테이블이 있진 않고, 주문 후 받아서 올라가면 됩니다. 벽돌 벽이 편안한 느낌을 주는 2층 4인 테이블이 있어서 노트북 작업을 하거나 책을 읽기에도 좋아보였습니다. 가장 큰 통창은 리라초 뷰ㅋㅋㅋㅋ 넘나 선명한 시선강탈 개나리색의 리라초 옆에는 숭의여대도 있고 남산타워도 보입니다. 반대쪽은 회현역 방향 뷰 건물이 사방으로 트여있어서 그런지 어느 쪽에서 봐도 뷰가 좋고 큰 창에서 들어오는 밝은 빛 때문인지 따스하고 편안한 느낌이 들었습니다. ☺️ 3층으로도 한번 올라가보았습니다. 역시나 시선강탈 리라초뷰😀 제가 갔던 날은 주말이라서 리라초 학부모님들은 안계셨는데 왠지 평일에는 리라초 학부모 핫플 일거 같은 느낌적인 느낌ㅋㅋㅋ 반대쪽창으로 보이는 남산의 느낌도 좋습니다. 창이 마치 액자처럼 보이지 않나요. 좋았던 점 중에 하나가 요즘 카페에 가보면 저렇게 크고 푹신한 소파가 잘 없는데... 보기만 해도 세상 아늑하고 푹신해보이는 소파가 있어서 넘 편해보였습니다. 6인 테이블 같아서 차마 앉지는 못했는데 단체 모임하기에 정말 좋을 듯! 역시 리라초 맞은편 카페 맛집이 맞는 듯한 합리적 의심ㅋㅋㅋㅋ🤔 그리고 명동 남산 근처라서 그런지 외국인 관광객 분들도 꽤 많이 오시더라구요! 생각보다 카페가 참 크다고 느꼈던게 무려 루프탑까지 있습니다. 날씨 좋은날 올라가면 기분까지 상쾌해질 것 같은 탁 트인 시원한 뷰 저 멀리 남산타워가 한 층 더 잘보이는게 지금은 좀 춥겠지만.. 안추우면 루프탑에서 데이트도 하고 커피 한잔하면 넘 좋을 것 같습니다. 그리고 이쪽은 회현역 방향 시티뷰 한 공간 안에서도 각도에 따라서 완전 다른 다양한 분위기를 느낄 수 있는게 이 곳만의 장점인듯 했습니다.! 😉 3. 메뉴 메뉴는 커피와 크로플, 브런치 메뉴와 간단한 주류도 있었습니다. 저는 식사를 하고나서 우연히 지나가다가 커피 한잔 하자 하고 들어간거였는데 은근 찾아보니까 브런치 맛집이라고 하더라고요! 가격도 착한 편인거 같아서 언제 이 동네에 또 올 일이 있으면 다음에는 브런치를 좀 먹어봐야 겠다는 생각😎 아메리카노 / 4,500 카페라떼 / 5,000 하지만 언제나 그렇듯 주문은 평범하게 아아와 아라ㅋㅋㅋ 커피는 무난했습니다. 4. 총평 남산 가는 길목에 위치한 카페 구할구 루프탑도 있고 굳이 루프탑이 아니어도 큰 통창에서 들어오는 빛과 뷰가 좋아서 여유있는 시간을 보내기에 좋았던 곳입니다. 바로 옆에 제가 좋아하는 비빔밥 맛집 목멱산방도 있어서 비빔밥 먹으러 올때 코스로 들려도 좋을 것 같은 곳🤓 총평 ★★★★ 남산과 명동 시티뷰가 같이 보이는 여유롭고 평화로웠던 카페"
"[명동 브런치] 남산타워 보이는 루프탑 카페, 카페구할구 남산","#명동브런치 #카페구할구 명동 브런치 카페구할구 가을날 명동 루프탑 카페에서 브런치 약속 하늘과 남산타워뷰가 정말 예쁜 날의 나들이 브런치 카페 내돈내산 솔직후기 시작요 카페구할구 남산 명동 브런치 카페 검색하다 찾아낸 재방문각 조용하고 아기자기 포근한 공간 마음에 둘어 재방문각 루프탑카페 기록 시작요 카페구할구 남산 : 네이버 방문자리뷰 493 · 블로그리뷰 236 m.place.naver.com 위 링크 명동 브런치 방문한 카페구할구 남산점 네이버플레이스 링크로 참고해주세요 남산 브런치 맛집 뷰맛집 카페구할구, 친구랑 어디서 보지 서칭하다 발견한 카페인데 루프탑 가을 브런치 퍼펙트하게 즐겼어요 !! 카페구할구 매장 매장 1,2,3,4 루프탑으로 구성되어 있어요 분위기 있는 남산 카페 활짝 열려있는 카페구할구 남산점 검색하니 카페구할구 제주도에도 있더라구요 그래서인지 제주 청귤에이드 메뉴 있아요 1층에서 시그니쳐 구할구커피 주문하고 친구와 함께 먹을 브라운 치즈 바닐라 크로플 맛있어 보이는 휘낭시에 주문했습니다 주문하고 10분쯤 걸린다고 진동벨 주셔서 매장 윗층 올라가 예쁜 카페 구경 시작했어요 층마다 조금 다른 컨셉 가구들로 꾸며졌는데 각각의 분위기로 포근했던 것 같아요 긴 원목테이블부터 낮고 푹신한 의자까지 좋아하는 자리에 앉아 쉬어갈 수 있어요 뷰맛집 카페구할구 과연 리라초 뷰인가 2층이 어느 후기에서 말한 리라초 정면 바라보는 리라초뷰 모습이었어요 하지만 뻥 뚫인 이 자리도 가을 바람 선선해 제겐 브런치 즐기기엔 만족스러웠어요 남산타워도 다른 층에서는 잘보인답니다 3층은 리라초 윗부분이 보입니다 그 옆엔 여기온 큰 이유 남산타워가 보여요!! 카페구할구 3층 통창뷰&루프탑뷰 끝내줬어요 끝내주는 뷰, 명동 루프탑 카페 명동 카페, 카페구할구 루프탑입니다 남산타워를 바라보며 브런치할 수 있었어요 날씨 좋은 지금 추워지기 전 딱이었어요 명동 브런치 카페 행복한 순간이에요 !! 다른 유명한 명동 카페들은 웨이팅만하다가 들어가지도 못하고 나온적도 있는데 카페구할구 기다리지 않고 이런 자리 앉다니 남산타워 벗삼아 맛난 커피&크로플 먹었어요 구할구라떼 크로플 명동 브런치 카페 메뉴 솔직후기 ㄴㄹ 피디님과 방문한 명동 브런치 !! 이렇게 사진 아무 생각 없이 찍다가 피디님이 연출 도와줘서 사진 퀄리티 올라갔어요 남산 브런치 왔으면 남산과 찍어야하는데 빨리 먹으려고 크로플만 찍다가 다시 찍었어요 남산 배경 뷰맛집 카페구할구 브런치에요 리라초뷰 명동 카페구할구 카페구할구 이름의 커피라 주문했는데 구할구라떼 부드러운 크림 올라간 라떼에요 올라간 크림 무척 부드러웠고 맛 괜찮았아요 커피 보다 마음에 들었던 크로플 브라운치즈 올라가면 실패하기 힘들지만 바닐라 아이스크림과 브라운치즈 넘 맛있고 크로플도 적당히 구워져서 순삭했어요 !! 달달구리 브런치 성공적 점점 사라져가는 브라운치즈 크로플 순삭 전 마지막 사진으로 맛있어 또 주문할래요 카페 구할구 남산 브런치로 대만족했어요 루프탑도 실내도 모두 좋아서 장소도 퍼펙트 브런치로 간단하게 커피하기 좋았어요 !! 다만 든든한 식사할 브런치 메뉴 많지 않아요 50m © NAVER Corp. 카페구할구 남산 서울특별시 중구 퇴계로20길 73 카페 구할구 예약 명동 브런치 카페구할구 남산 위치 명동역 1번출구에서 언덕 오르면 나옵니다 :) 번잡하지 않고 도심 속 콧바람 제대로 즐겼던 남산 브런치 카페 카페구할구 후기 마쳐용 지치지 않고 꾸준하게 행복기록 목표 !! 베프랑 밀린근황 수다수다 명동 데이트 기록 꿍 (제 게시물은 무단도용/복제를 금지합니다🙏🏻)"
"명동 애견동반 카페 , 카페구할구 남산","#내돈내산 안녕하세요 핸잉이에요! 오늘은 명동 애견동반 카페 '카페구할구 남산' 다녀온 후기를 써보려고 합니당 알고보니 제주도에도 있더라구요..!! 여기 카페구할구 남산은 숭의여대와 가깝게 위치해있답니다. 골목으로 들어가야 해서 좀 조용한 편이에요! 영업시간은 오전 10시부터 저녁 8시까지 ! 여기만 그런 게 아니고 이 주변 가게들은 보통 다 이정도 시간에 닫더라구요..! 꽤 빨리 닫죠!! 여덟시만 되도 사람들이 많이 안다녀서 그런가봐요 훔 여기 주변에 할랄푸드도 있고 이국적인 음식이 많이 보여서 외국인 분들도 좋아하실 것 같은 골목이였어요 ~,~ 지하1층부터 4층까지 이루어져 있는 명동 애견동반 카페 입니당 단 지하1층은 스텝분들의 공간이라 1층부터 이용 가능하다고 볼 수 있겠어요. 여긴 1층인데 자리가.. 테이크아웃 할 때 기다리는 자리?! 밖에 없어요 ! ㅋㅋ 요긴 명동 애견동반 카페 라서 펫티켓을 더더욱 지켜주셔야 해요! 풀어놓고 놀아라~~ 할 수 없어욤 루프탑에서도 풀어놓을 수 없고 반드시 항상 내 강아지 곁에 있어야 한다는 점 ! 화장실 바닥에 배변을 시키시는 분들은 설마 없겠죠..?하하 곳곳에 놓여져있는 소품들이 왠지 모르게 따스한 감성을 느끼게 해 주었어요. 병음료들 !! 메뉴가 꽤 많더라구요 ! 와 다방라떼.. 예전에 프랜차이즈에서 일할때 메뉴에 없는 다방커피 달라고 떼쓰는 진상 있었는데;; 그 분 여기서 드시면 되겠네요.. 아무튼.. 메뉴가 많아서 !! 뭘 마실지 고민을 했답니다. 차가움은 오직 차가운걸로만 주문 가능하다는 뜻이겠죵? 핸잉은 애플시나몬티를 마셨는데... 잠시후에 계속 맛있어보이는 단백질쿠키도 있었는데요. 이 날은 크로플을 먹고싶어서 패쓰했어용 흥국쌀 마카다미아 쿠키는 언젠가 먹어보고 싶긴 하네요 ! 자리를 차지하러 계단을 따라 올라갔어요. 여긴 2층이에요. 다들 조용히 계셨던 게 기억이 나네용 ㅋㅋ 이제 명동 애견동반 카페 3층으로 올라가봅시다요 평화로운 3층 ~~ 3층에 앉기로 했어요 ! 의자가 푹신해서 좋더라고욤 테이블은 좀 낮았지만..하하 3층은 혼자 앉기 좋은 자리도 푹신한 의자로 되어있어요. 바깥 풍경을 보며~~ 그리고 4층으로 올라가면 루프탑이 있다고 해서 이 날 추워서 앉을 생각은 없었지만 궁금해서 가보고싶었는데요! 아쉽게도 어두컴컴한게 닫혀있는 것 같더라구요! 요렇게 주문 완료 !! 가지각색으로 시켰네용 우유 술 차 ~ ㅋㅋㅋ 메뉴 / 가격 바닐라라떼 (\5500) 애플시나몬티 (\6500) 벨칭 비버 피넛버터 밀크 스타우트 (\10000) 브라운치즈 바닐라 크로플 (\10000) 바닐라라떼_5500원 먼저 바닐라라떼 입니당 따뜻한 거 ~ 옆에는 한입 드셔서 모양이 난거에욤 ㅋㅋㅋ 이렇게 하트모양 라떼아트를 만들어주셨답니다. 꽤 달고 바닐라맛이 났다고 하셨어요. 색깔만 보면 초코라떼 같기도 하네용 벨칭 비버 피넛버터 밀크 스타우트_10000원 다음은 벨칭 비버 피넛버터 밀크 스타우트 입니다! 이름 한번 참 기네요. 아하 맥주는 이렇게 따르는 것이군 예전에 맥주 물따르듯 따랐다가 거품이 반이 되었던 기억이 나네영 이렇게 흑맥주랍니다 ! 컵도 세트로 맞춰주셨네용 비버가 입 벌리고 있는게 귀엽네유 키키 맛은 다크초콜릿 맛에다가 피넛버터를 더한 맛이라고 하셨어요! 맛있었다고 하셨답니당 애플시나몬티_6500원 애플시나몬티 !! 핸잉은 얼죽아인데 따뜻하게 나와서 놀랐어요..! ㅋㅋㅋ 생각해보니 차가운거라고 말씀을 안드렸더라고요.. 안 물어보신거 보면 차가운게 원래 없는 메뉴인가?!?! 말 그대로 사과랑 시나몬이 들어있는 차(tea)인데요. 애플민트까지 들어있어서 이게 맛에 큰 영향을 주었어요! 애플민트 맛이 굉장히 많이 나더라구요 ㅋㅋㅋ 그다음에 시나몬맛..애플맛은 약간?? 맛은 있긴 한데 너무 민트맛이 많이 나서 민트티를 마시는 기분이 들었어요. 민트를 빼고 마실껄 그랬나봐여.. 그냥 없이 나와도 맛있었지 않았을까 하는 생각이~~ -> 알려주셨는데 로즈마리라고 하시네요!! 로즈마리향이 강했나봐용!!! 브라운치즈 바닐라 크로플 _ 10000원 그리고 디저트로 먹은 브라운치즈 바닐라 크로플 입니다 크로플 오랜만에 먹는 기분 브라운치즈가 솔솔 뿌려져있어요. 항상 브라운치즈가 있는 크로플은 가격대가 좀 있는 것 같네영 시럽을 팍팍 뿌려줬어요. 달콤달콤 짭쪼롬한 치즈맛에 달콤한 바닐라아이스크림 ! 크로플이 잘 잘리는게 먹기 전부터 부드러움이 느껴졌어요. 퍽퍽하지 않아서 굿굿!! 맛있게 잘 먹었답니당 !! 50m © NAVER Corp. 카페구할구 남산 서울특별시 중구 퇴계로20길 73 카페 구할구 예약 저번에 갔던 목멱산방과 가까운 명동 애견동반 카페 카페구할구 위치입니다!"
"남산, 중구 - 카페 구할구, 봄이 느껴지는 따뜻한 밤 -","카페 구할구 서울특별시 중구 퇴계로20길 73 카페 구할구 예약 운영기간 10:00 - 22:00 AM 10:00 - PM 2:00 까지 크로플과 아메리카를 세트로 구매할수 있습니다. 그외 다양한 브런치 메뉴도 있습니다. 식사를 마치고, 바로 옆 건물에 있는' 카페구할구'에 들어갔습니다. 건물 전체가 카페에요. 맨위층은 루프탑인데, 날이 좋은날 루프탑에 올라가서 서울의 경치를 구경하는 것도 좋을것 같아요. 열려 있는 창문사이로 봄이 느껴짐니다. 작은 냉장고에, 병음료와 맥주가 들어 있었어요. 8시 쯤 들어갔는데, 카페가 조용했담니다. 저녁엔 유동인구가 없어서 카페에 손님이 적은거 같아요. 인스타 포토존?? 사진 찍기 딱이네요. 자몽에이드, 오자몽에이드 쿠키와 함께 - 쿠키가 무거운 느낌은 아니여서 에이드랑 먹기에 좋았어요. 오렌지 색, 주황색, 색상이 너무 예쁘네요 - 색상만큼 맛도 있었다는 ^^ 멍때리기 참 좋은 카페인거 같아요. 가만히 앉아서 창문 밖에 차들이 왔다 갔다 하는걸 구경했어요 - 한적한 여유가 느껴지는 카페였어요. 열어 놓은 창문 사이로 봄의 향기가 솔솔 불어 오네요.. #카페구할구 #남산 #남산카페 #남산타워 #자몽에이드 #커피 #에이드 #쿠키 #스콘 #cafe #coffee"
서울 명동 카페 남산타워뷰 루프탑 카페 구할구,"사진. 글 @flat white 서울 명동 카페 남산타워뷰 루프탑 카페 카페 구할구 #서울카페 #명동카페 #남산카페 #카페추천 카페구할구 남산 서울특별시 중구 퇴계로20길 73 카페 구할구 예약 안녕하세요, 플렛화이트예요~ 서울 남산타워가 한눈에 보이는 루프탑 카페 카페구할구 남산 카페에 다녀왔어요 🐰 비⛈️가 내려서 남산 타워 보면서 비 내리는 오후에 운치 있는 카페에 즐기는 여행도 행복✨이 아닐까 싶었어요🎈 명동역에서 걸어서 8분 이면 도착하는 걸어서 가기 편했어요 1층 매장 입구에는 카페 구할구 특별하고 사진 찍기 편한 멋진 포토존이 있었어요 단골 고객 쿠폰과 따뜻한 담요 있으니, 2층, 3층 이용하실 때 먼저 챙겨서 올라가시면 좋을 것 같아요🎈 카페 구할구 📌 주소: 서울 중구 퇴계로 20길 73 ⏰ 매일 : 10:00 - 20:00 1층은 음료를 주문하는 곳 2층, 3층에서 남산 뷰, 담소를 나눌 수 공간이 있어요~ 테이블마다 좌석의 스타일이 다르다 보니 커플 테이트 하기 좋은 자리,🐰 단체 모임 하기 편한 단체석도 있었어요 층마다 배치되어 있는 티슈와 물과 컵이 있었어요, 이곳은 반려동물도 함께 할 수 있는 문구도 볼 수 있었습니다. 3층 남산 뷰가 보이는 테이블에 앉았어요, 남산 타워가 보여서 좋은 것 같아요 3층 창밖 뷰 테이블 추천해요, 🐰 오픈 형 창문이라서 활_짝 열려요~ 날씨 좋은 날에는 완전 멋진 남산뷰를 볼 수 있을 것 같아서 나중에 다시 와보고 싶어요~ 💛 기분 좋은 카페~ 바닐라 라테 5,500 카푸치노 5,000 플레인 크로플 4,000 짧은 시간 동안 남산 뷰 보면서 커피 타임을 가질 수 있는 시간이 되었어요 ✔️ 사장님 친절해요 ✔️ 아늑하고 편해서 대화하기 좋은 곳이었어요 화장실도 깨끗하고 2층, 3층 계단으로 되어있어요 ✔️ 남산 뷰를 볼 수 있는 곳으로 남산 카페 구할구 추천하는 서울 여행, 서울 카페였습니다. 50m © NAVER Corp. 카페구할구 남산 서울특별시 중구 퇴계로20길 73 카페 구할구 예약"
