title,content
한남동 브런치 맛집 카페르상스 사운즈한남 데이트 코스,"📍카페르상스 사운즈한남 서울 용산구 대사관로 35 사운즈한남 1층 매일 10시 ~ 22시 (라스트오더 21:30) 와인과 함께 즐기는 브런치 한남동 데이트 코스 추천 사운즈 한남에서 브런치 먹기 좋은 카페르상스 한남동 브런치 카페로 유명해서 방문했는데, 커피도 맛있고 베이커리도 맛있어서 만족스러웠던 곳! 한강진역 맛집 많은 사운즈한남으로 들어가면 오른편에 위치한 카페르상스 입구부터 너무 멋있는 한남동 브런치 카페르상스 날씨 좋은 날에는 야외 테이블에 자리 잡고 화이트와인에 브런치 하고 싶어지는 분위기 건물 밖에서 바라보는 모습에 반해서 안으로 들어가면 더 반하는 곳! 카페에 들어서자마자 보이는 와인과 은은한 조명이 빛나는 실내. 한남동 데이트 코스로 추천하고 싶은 카페르상스 사운즈한남점은 평일엔 17시 이후로, 주말엔 올데이 와인 주문이 가능해서, 브런치와 와인을 함께 즐길 수 있는 한남동 브런치 맛집이라고 한다. 다음에 친구들이랑 오면 야외 테이블에서 화이트 와인에 브런치... 꼭! 커피 메뉴로는 에스프레소, 아메리카노 등이 있으며 원두를 선택할 수 있었다. 클래식, 다크, 디카페 원두고 산미나 바디감등을 보고 선택할 수 있다. 나는 산미있는 커피를 좋아하는 편이라 산미 단계가 3인 클래식 원두를 선택했는데, 아메리카노 너무 맛있어서 또 마시고 싶었다. 카페르상스는 나가사키 청정 자연에서 자란 귀한 찻잎만을 채엽하여 장인 정신으로 만든 고급 명차도 판매하고 있는데, 오가와 그린티(녹차), 오가와 호지티, 오가와 블랙티/애플 로즈 블랙티 로 준비되어 있었다. 일본식 고급 명차를 마셔볼 수 있어 한남동 데이트 코스로 좋은 곳! 한남동 브런치 맛집의 베이커리는 종류도 다양했다. 내가 좋아하는 소금빵 종류도 여러가지였는데, 앙버터 소금빵,플레인소금빵, 밀크크림 소금 버터롤로 특별한 소금빵이 준비되어 있어 고르는 행복을 만끽할 수 있었다. 그 외에도 치아바타, 바게트와 같은 기본빵도 살 수 있고~ 눈이 행복했던 마들렌도 종류가 여러가지 바닐라마들렌,초코렛마들렌, 얼그레이마들렌, 브림브륄레마들렌까지 마들렌의 부드러운 달콤함을 좋아하는 편인데, 카페르상스 마들렌은 특별해서 더욱 맛있어 보였는데 실제로 먹어보니 진짜 맛있었음! 특히 크림 브륄레 마들렌 설탕 코팅 최고 요즘 너무 맛있는 휘낭시에도 종류가 세가지 클래식 휘낭시에, 무화과 휘낭시에, 피스타치오 휘낭시에가 준비되어 있었는데, 난 무화가 휘낭시에가 제일 맛있었다! 무화과는 사랑이지~ 한남동 브런치 카페 오셔서 휘낭시에도 꼭 드셔보시길! 휘낭시에, 마들렌, 소금빵 외에 쿠키, 카츠샌드도 판매하고 있었는데 다음에 한남동 브런치 먹으러 오면 브런치 메뉴에 가츠샌드 함께 주문해서 먹어보고 싶음! 너무 맛있을 것 같아서 꼭 주문해야지! ㅎㅎ 카페 오시는 손님들 트레이 가득 베이커리 담아서 커피와 함께 주문하는 사운즈한남 핫플 :) 우리가 주문한 휘낭시에와 마들렌 소금빵이 나왔고, 클래식 원두를 선택해서 만들어진 아이스 아메리카노도 함께 나왔다. 커피가 너무 맛있어서 순식간에 전부 마실 수 있었던 적당한 산미의 아메리카노는 베이커리들과 잘 어울려서 더욱 맛있게 먹을 수 있었던 조합! 묵직한 버터의 맛이 느껴지는 휘낭시에와 겉바속촉 단짠고소의 대명사 소금빵까지 맛있게 먹었던 브런치 맛집 카페르상스 사운즈한남에서 분위기 좋은 한남동 카페 찾으신다면 추천하고 싶은 곳이라 네이버 지도에 저장해 두시고 꼭 한번 방문해 보시길! 유럽풍 건물의 예쁘고 따뜻한 감성의 인테리어와 베이커리까지 가득한 카페르상스 사운즈한남 주말에는 브런치와 와인을 주문해서 더욱 특별한 데이트 해보시길 바라며 추천한다! 한남동 브런치 르상스 재생 0 좋아요 0 00:00 00:00  접기/펴기 한남동 브런치 맛집 50m © NAVER Corp. 카페 르상스 사운즈한남점 서울특별시 용산구 대사관로 35 사운즈 한남 1층"
[용산구/한남동] 이태원 카페 카페 르상스 사운즈 한남점,"친구와 간단히 저녁을 먹고 와인 한잔하러 방문한 이태원 카페 #카페르상스 영업시간 매일 10:00 ~ 22:00 라스트 오더 21:30 발렛주차 가능 (2시간 5천 원, 이용 금액에 따라 추가 지원) 서울 용산구 대사관로 35 사운즈 한남 1층 한남동 랜드마크인 사운즈 한남 건물 내에 위치한 이태원 카페 사운즈 한남. 오랜만에 한남동 나들이라 잔뜩 들떠서 친구와 방문했어요. 예전부터 사운즈 한남 건물에 맛있는 집과 카페가 모여있다는 말만 들었는데, 이날은 실물 영접. 태국 대사관을 지나 럭셔리한 건물 1층에 바로 카페 르상스가 보이더라고요. 건물 옆으로 돌아가면 찻길을 피해서 테라스석이 마련되어 있어서 여기에서 브런치나 커피, 와인들을 즐길 수 있습니다. 우리도 테라스석을 노렸으나…이렇게 사진을 찍고 여기저기 둘러보고 나니…남아있는 한 테이블마저 다른 분들이 앉으셨어요. 눈물을 머금고 내부로.. 그래…요새…더워…이러면서… 사운즈 한남 건물에 있는 매장들입니다. 테라스석의 장점은 카페 르상스 뿐만 아니라 분지로에서 가츠 산도 같은 요깃거리를 시켜서 같이 즐길 수도 있고, 앉아서 주문할 수 있는 QR이 있어서 왔다 갔다 하지 않아도 된다는 점. 카페 르상스도 브런치 메뉴와 베이커리류가 다양하기 때문에 여유로운 분위기에서 연인과 가족, 그리고 애견도 함께 즐길 수 있다고 하네요. 아쉽지만 테라스에서의 여유는 다음 기회로… 역시…유명한 이태원 카페답게…외부 테라스뿐만 아니라 내부도 이미 꽉 차 있네요. 카페 르상스의 베이커리류부터 둘러봅니다. 제가 좋아하는 담백한 종류의 빵들부터 식사로 즐길 수 있는 샌드위치류 그리고 보기만 해도 겉바속촉이 느껴지는 식사 빵류 달달한 디저트류까지…다양하게 구비되어 있습니다. 카페 르상스는 프랑스산 밀가루와 버터를 사용해서 빵에 더 깊은 풍미를 느낄 수 있고 일본식 제빵 기법을 활용해서 직접 생산하는 빵 들이라서 베이커리 자체의 퀄리티가 높아 유명하다고 하네요. 베이커리만 유명한 게 아니죠. 이곳이 이태원 카페 중에서 손꼽히는 이유는 직접 로스팅 한 원두로 커피를 선보이기 때문입니다. 이렇게 직접 로스팅 한 원두를 판매도 하고 있고요. 녹차도 시중의 녹차를 사용하는 게 아니라 일본 장인이 직접 재배, 선별하는 녹차를 제공한다고 하네요. 역시.. 사람 많고 유명한 데는 이유가 있어요. 평일 오후 다섯시 이후로는 보틀 와인도 즐길 수 있습니다. 이렇게 칠링 되어 있는 와인들이 오늘 우리의 목표~ Next image 와인 리스트도 이렇게 다양하게 구비되어 있습니다. 와인과 곁들일 수 있는 안주류들도 준비되어 있습니다. 우리는 부라타 무스 샐러드(23,000원)으로 선택~ 예쁜 글라스의 음영이 곁들여진 부라타 무스 샐러드와 레드와인. 나랑 똑같이 와인 좋아하는 친구와 함께하니 더 좋은 이태원 카페에서의 힐링 타임~ 바질과 로즈마리 잎이 곁들여진 부라타무스 샐러드. 카페르상스 재생 3 좋아요 0 00:00 00:14  접기/펴기 카페르상스사운즈한남점 밑에 부라타 치즈인가? 하면서 섞으려니..부라타 치즈가 무스 형태로 두껍게 바닥에 깔려 있네요. 섞는 건가? 섞어! 이러다가 아닌가 봐~~~이러면서 둘이 떠서 먹기로… 부라타치즈 가득 떠서 방울토마토와 먹는데…방울토마토가 스테비아 토마토인지 엄청 달고 맛있어요. 부라타 치즈와 함께 하니 부드럽고 달콤한 싱싱함이 배가 되네요. 생햄이 함께 있어 고소함과 짭조롬함이 그대로 느껴지고… 바질 잎의 싱싱함도 그대로 느낄 수 있네요. 무엇보다 이렇게 칠링 한 와인을 내주니, 시원한 여름이 되네요. 친구랑 이렇게 와인으로 가볍게 한잔하고 나니.. 어제 만나도 오늘 만나도 할 말이 어찌나 많은지…어둑 어둑해질 무렵에서나 자리를 털고 일어났습니다. 오랜만에 이태원 나들이에 핫플인 이태원 카페에서 와인 마시기까지 오붓하게 오랜 지기와의 즐거운 시간이었습니다. 50m © NAVER Corp. 카페 르상스 사운즈한남점 서울특별시 용산구 대사관로 35 사운즈 한남 1층 #카페르상스 #이태원카페 #사운즈한남카페 #이태원핫플 #한남동핫플 #한남동카페 #한남동와인 #이태원와인 #한남동테라스카페 #이태원테라스카페 #한남동브런치 #한남브런치 #한남동브런치카페 #카페르상스사운즈한남 #용산카페 #순천향병원근처카페 #이태원베이커리카페 #한남동베이커리카페 #사운즈한남 #한남동베이커리카페 #한남동커피맛집 #한남동브런치맛집 #이태원브런치맛집"
"한남동 테라스 카페 르상스, 사운즈한남 커피 디저트 맛집","📍 카페 르상스 사운즈한남점 CAFE LE SENS 한남동 테라스 카페 르상스! 낮과 밤 모두 다 다녀온 후기 사운즈한남 1층에 위치한 카페인데, 콰르텟 사운즈였는데 어느 순간 카페 르상스로 바뀐 것 같다 사운즈 한남 지하 1층에 발렛 주차 가능 (2시간 5천 원) 유럽 느낌이 물씬 나는 한남동 카페 르상스는 다섯 가지 감각의 만족을 경험한다는 뜻을 가지고 있다고 함 베이커리, 커피, 와인, 핑거푸드 그리고 테라스와 음악 요즘은 진짜 더워서 이용하기 힘들겠지만,, 날 좋을 때 방문하면 분위기가 정말 좋은 곳이다 화장실도 카페 내부에는 없지만, 엄청 깔끔하게 관리되고 있음! 낮에 방문했을 때는 비가 와서 내부에 앉았고, 밤에 방문했을 때는 테라스 자리를 이용했다 내부는 옆 테이블과의 간격이 유지되지 않아서 다소 복잡한 느낌인데, 테라스는 여유로움 🌱 카페 르상스 내부 테이블은 작은 편이지만, 콘센트도 있고 손님이 없는 시간대는 나쁘지 않음 다만, 만석일 때는 많이 복잡함 카페 르상스 출입문 옆에 설치된 스피커! 우드 + 벽돌 인테리어로 되어 있어 고급스러운 느낌이고 재즈 위주로 노래를 틀어주셨다 사실 낮에는 시끄러워서 노래 잘 안 들림 ㅋㅋ 디저트를 먹을 계획은 없었지만, 안 먹을 수는 없는 비주얼,, 눈길이 간다👀 그래서 방문 때마다 먹었다 ㅋㅋㅋ 한남동 카페 르상스는 프랑스 밀가루, 천연발효종(르방)을 넣어 만든 전통 유럽빵과 좋은 재료를 듬뿍 넣은 쿠키와 마들렌, 휘낭시에 등 구움 과자류를 매일 아침 굽는다고 한다 비주얼 최고..💗 주문은 여기에서 하면 된다 가츠 산도도 판매하고 있어서 신기했고 통밀 사브레, 러스크, 사워도우, 치아바타, 소금빵, 잠봉뵈르, 바게트 등 다양한 베이커리와 다양한 종류의 휘낭시에, 마들렌, 쿠키까지 여기가 천국입니다아 취향껏 발뮤다 토스터에 데워먹기! 한남동 커피 맛집 카페 르상스 메뉴판 아메리카노, 플랫화이트, 크림 커피 등이 있고 밀크티, 초코 라떼, 스미스 티, 그 외에 일본 차, 말차, 티 에이드 등 JAPANESE 일본 음료 비중이 높았다 * 오트밀 우유(귀리), 저지방 우유 변경 +500원 미국을 대표하는 3대 원두인 인텔리젠시아 원두를 사용하는 곳! 아이스 아메리카노 5,500원 따뜻한 카페라떼 6,000원 르뱅 쿠키 5,500원 처음 방문했을 때 먹었던 메뉴! 커피 맛도 괜찮았고 쿠키도 달달해서 당충전하기에 좋았다 황치즈 쿠키 5,500원 소금빵 3,500원 친구가 사준 소금빵과 황치즈 쿠키! 맛있는 거 사준 멋쟁이 친구💗 사실 나는 소금빵을 최근에 일본에서 너무 감명 깊게 먹고 와서 나쁘지 않다고만 생각했는데 친구들은 맛있다고 했다 그리고 아메리카노도 너무 맛있다구,, 황치즈 쿠키는 처음 먹어보는데 와,, 이거 진짜 맛있다 ㅋㅋㅋㅋ 배부르다면서 헤비한 치즈 쿠키를 주문해서 으악👀했는데 진짜 맛있네,, 이건 또 먹고 싶다 50m © NAVER Corp. 카페 르상스 사운즈한남점 서울특별시 용산구 대사관로 35 사운즈 한남 1층"
한남동 테라스 카페 카페르상스 사운즈한남점 다녀온 후기 (feat. 제일기획근처),"안녕하세요 부자언니입니다! 오늘은 한남동에 위치한 분위기있는 테라스카페, 카페 르상스 사운즈 한남점을 소개시켜드리려고 합니다 50m © NAVER Corp. 카페 르상스 사운즈한남점 서울특별시 용산구 대사관로 35 1층 카페르상스의 사운즈한남점은 제일기획 근처에 위치해서 찾기 쉬운데요! 제일기획에서 도보로 7분, 가장 가까운 이태원역을 기준으로하면 15분정도 걸린다고 생각하시면 됩니다. 저희는 카페르상스에 방문하기전에, 카페르상스가 한남동에 위치한 다른 카페들과 특별히 다른점이 무엇인지 한번 찾아봤어요! 🤔 1. 커피, 베이커리 뿐만아니라 브런치와 화이트와인도 제공한다는 점 2. 프랑스산 밀가루와 버터를 사용해서 빵에서 더 깊은 풍미를 느낄 수 있다는 점 3. 일본식 베이커리 기법을 활용해 베이커리 자체의 퀄리티가 높고 맛있다는 점 4. 직접 로스팅하는 원두를 사용하고 다양한 옵션을 제공한다는 점 5. 일본 장인이 직접 재배, 선별하는 녹차를 사용한 녹차음료들이 있다는 점 이렇게 조사를 하고 가면 그 특별한 점에 더 신경쓰면서 맛을 보고 구경을 하게 되서 그곳을 100% 즐기고 온 기분이 들거든요! 이 글을 보시고 방문하시게 되는 분들도 그런 기분을 느끼셨으면 좋겠어요 ❤️ 사운즈한남에 도착하자마 보이는 간판부터 찍어봤어요. 이렇게나 많은 가게들이 입점하고 있었는지는 몰랐는걸요? 저희가 갈 카페르상스 뿐만 아니라 음식점, 펍, 생활 브랜드들도 여러가지 있었어요!😳 각 가게들이 어디에 위치하고 있는지 정말 친절하게 맵과 리스트도 제공되어 있이서 너무 찾기 쉽더라구요. 카페르상스는 3번👍 입장하자마자 오른쪽으로 보이는 곳이 카페르상스입니다. 전체적으로 굉장히 모던하고 따뜻한 느낌이었어요. 특히 테라스가 너무 제 스타일 ㅠㅠ 짚과 파라솔 덕분에 바닷가 휴양지 느낌이 나지 않나요? 🏖️ 날씨가 따뜻해지고 나면, 테라스에서 카페르상스의 브런치 메뉴인 분지로의 돈카츠를 활용한 카츠산도와 올리브/하몽 등과 함께 화이트와인을 즐기며 분위기 있는 모임을 가지기 딱 좋을 듯해요❤️🍷 카페 안을 보니 벌써 많은 분들이 맛있는 빵과 커피를 즐기고 계시더라구요!🥐☕️ 내부는 이렇게 생겼어요. 밖에서 보던것 처럼 아주 깔끔하구요, 테이블은 9개정도 있었던 것 같아요👏 뒤쪽으로는 와인 스토리지와 유럽감성이나는 스피커와 디스플레이가 벽에 비치되어 있었어요 🍷🔊 인테리어 중에 가장 맘에 들었던 것은 빛나는 간판들인데요, 눈에도 잘띄고 카페의 느낌과도 잘 어우려저서 계속 눈길이 갔어요 😳 주문전에 같이 곁들여 먹을 빵부터 담아보기로 했어요. 매일 아침 정성스럽게 굽고 계신다는 빵맛이 너무 궁금했답니다🤭 한남동 테라스 카페 추천 카페르상스 사운즈한남점 (제일기획근처) 재생 0 좋아요 0  접기/펴기 한남동 테라스 카페 추천 카페르상스 사운즈한남점 (제일기획근처) 저는 저녁에 갔던 터라 빵이 선반 가득차있지는 않았지만 그래도 종류별로 다 있어서 신나게 고를 수 있었어요 🫶🏻 앙버터소금빵도 맛있어보이고, 우유크림 먹물 소금빵도 궁금하고, 치아바타 종류도 정말 궁금했지만! 저는 휘낭시에를 너무 좋아하고 남자친구는 쿠키나 마들렌을 좋아하는터라 요 섹션을 좀 더 집중해서 봤어요 😂 남자친구에게 먹고싶은 것을 담아오라고 하니 피스타치오 휘낭시에 한개, 무화가 휘낭시에 한개, 크림브륄레 마들렌 한개를 골라왔네요! 이제 카운터로 가서 주문을 하면 되는데요, 그린티, 유자 그린티, 말차가 들어간 기본, 초코, 오트밀 라떼, 과일+티 에이드, 밀크티, 커피까지 종류가 다양했어요. 🤟 만약 커피를 시키신다면, 원하는 원두 종류를 고르실 수가 있는데요! 클래식, 다크, 디카페인 이렇게 3가지가 있고, 각각 산도나 바디감 밸런스가 어떤지도 센스있게 적어놓으셨으니 취향대로 선택해보세요💚 (메뉴판 이미지도 아래에 첨부합니다) 앉아서 좀 기다리니 진동벨이 울려서 말차라떼와 고른 빵들을 받아올 수 있었어요. 너무 맛깔나게 생겼죠? 😋 라떼가 달지않아서 아주 달달한 디저트와 먹기가 딱 좋았어요. 완벽궁합! 크림브륄레 마들렌 재생 2 좋아요 1 00:00 00:11  크림브륄레 마들렌 크림 브륄레 마들렌은 겉이 정말 브륄레처럼 딱딱하더라구요! 신기해서 동영상도 찍어보았는데, 겉에 묻은 설탕이 탁 깨지는게 괜히 기분좋더라구요😝 빵도 라떼도 순삭하고 오늘 즐거웠던 데이트를 마무리하며 셀카한장📸 날 풀리면 다시와서 꼭 테라스를 이용하리라 다짐하며, 이만 줄이겠습니다! 존재하지 않는 이미지입니다."
한남동🕊️ 카페 르상스 사운즈한남점_가을에 가야하는 이유:CAFE LE SENS @cafelsens,"/ 카페 르상스 사운즈한남점 / 안은 핫하고 밖은 여유로워🍂 카페 르상스 사운즈한남점 서울특별시 용산구 대사관로 35 사운즈 한남 1층 카페 르상스 ⎟CAFÉ LE SENS(@cafelesens) • Instagram 사진 및 동영상 팔로워 425명, 팔로잉 5명, 게시물 53개 - 카페 르상스 ⎟CAFÉ LE SENS(@cafelesens)님의 Instagram 사진 및 동영상 보기 instagram.com 사운즈 한남 이미스, 이솝을 들려 잠시 쉬는 타임으로 방문했어요 빨간 테이블과 의자가 인상적임 매장안은 협소한편 밖에서 봤을때 워낙 핫해보여서 오! 여기 모야? 들떠서 들어갔어요 지쳐버린 제 친구에요.. 매장 안 - 다양한 디저트들이 유혹하는 중 앙버터랑 소금빵을 지나치다니 대단해 아직도 인기 있는 쿠키들, 마들렌 메뉴판 주문메뉴 아메리카노(디카페인) 말차오트밀라떼 커피는 3가지로 선택할 수 있어요 CLASSIC DARK DECAF 평균 커피 2잔 이상 마셔서 디카페인이 꼭 필요하다 주문완료- 말차오트밀라떼, 아이스아메리카노 맛이 특별하진 않았으나 분위기가 좋았어요. 카페 르상스 이외에도 근처에 디카페인 아메리카노도 산미가 살짝 있는 편 요즘엔 산미 있는 커피도 잘먹는 편이다 요즘같은 날씨엔 야외에서 마시는 걸 추천드립니다. 매장 안은 워낙 시끌벅쩍해서.. 야외에서 시원하게 바람쐐며 여유롭게 차한잔 마시기 돌아다닐때는 북쩍거려도 먹고 마실때는 여유로워야 한다구 서울의 분위긴가요🌱 너무 여유롭고 좋았던, 잠시 휴식타임 서울의 삶은 어떠니 원효야- 미래에 대해서 의논 중ㅋㅋ 야외가 더 매력적인 곳이에요! 겨울이 오기전에 야외를 열심히 즐겨보자- 충전 완료했으니 다시 움직여야해 한남! #사운즈한남 #카페르상스한남 #한남동카페추천 #한남동꼭가야하는곳"
"[사운즈한남 카페 르상스] 한남동 살고싶어지는 테라스카페, 애견동반, 주차요금","#내돈내산 📍 위치 서울 용산구 대사관로 35 사운즈 한남 1층 🕐 영업시간 (순천향대학교 서울병원 옆) 🚘 주차가능O 발렛 2시간 5,000₩ 🐕 애견동반 가능O 50m © NAVER Corp. 카페 르상스 사운즈한남점 서울특별시 용산구 대사관로 35 사운즈 한남 1층 한남동 최애 공간, 사운즈 한남 의 카페 르상스 한남점 테라스가 유명한 카페죠. 건물 자체가 크고 독립적인 공간이라 고요해서 좋아요. 힐링🍃 올때마다 인근 주민 분들이 대형견과 함께 방문해 계시더라구요. 너무 귀여운 귀🐕 ㅎㅎ 테라스는 애견동반이 가능해요! 테라스 착석 시 바로 보이는 이솝 매장 “깨끗하고 정돈된” 🫧 1층 공용 화장실에도 이솝 바디밤이 비치돼있어요 센스 굿! 라인드 컨센트레이트 바디밤 레몬우디향🍋 레몬향 좋아해서 살까? 했던. 50m © NAVER Corp. 이솝 사운즈 한남 서울특별시 용산구 대사관로 35 1층 예약 타 매장보다 유입객들이 적어 조용히 시향&구매가 가능할 거 같아요. 여긴, 조용해서 정말 좋아..🙆🏻‍♀️🤍👼🏻 # 한남동 조용한 카페 추천 2층에는 또다른 카페와 와인샵이 입점돼있더라구요! 50m © NAVER Corp. 다이슨 데모 스토어 사운즈 한남 서울특별시 용산구 대사관로 35 사운즈 한남 B1F 예약 50m © NAVER Corp. % 아라비카 매거진 B 한남점 서울특별시 용산구 대사관로 35 2층 50m © NAVER Corp. 분지로 사운즈한남점 서울특별시 용산구 대사관로 35 사운즈 한남 1층 다 못둘러봤지만, 카츠/돈까스로 유명한 #분지로 등 음식점이나 다이슨, 미용실 같이 여러 매장들이 있어 복합문화공간 느낌이에요. 분지로는 다음에 포스팅 쓸게요! +포스팅 써서 추가해요~! [사운즈한남 분지로] 맛있어서 쓰는 일본식 고급 돈까스 #광고아님 📍주소 서울 용산구 대사관로 35 사운즈 한남 1층 이태원역/순천향대학교 서울병원 옆 🕐 영... m.blog.naver.com 유명한 맛집👍🏻 아무쪼록, 조용히 평일 낮에 시간 때우기 좋습니다. 르상스 메뉴&베이커리 크림 브륄레 마들렌 3,800₩ 소금빵들 ! 4,000₩ 크림 들어간 블랙 소금빵 맛있어 보인다.. 4-5천원 대의 바게트류 들 담백한 기본 빵들을 잘 만들어요 요기. 앙버터 소금빵 4,500₩ 허니 러스크 4,500₩ 러스크 먹고싶었는데 공복이라 참았다.. 샌드위치류! 생각보다 저렴한 편? 결국 아메리카노 2잔과 5,500₩ 크림 브륄레 마들렌 3,800₩ 을 시켰습니다. ㅎㅎ 크림 브륄레의 코팅이 너무 예쁜 나머지.. 원두는 산미/고소함/디카페인 3종류라 전문적이고 좋았어요. 단일된 원두는 질려요! 브런치와 와인 푸드들도 함께 판매되네요.^^ 저녁에 테라스에서 와인 즐겨도 좋을 거 같고 낮에 더 어울리는 공간이라 낮드링크도 좋을 거 같아요! 🍷 카페 내부 홀 오피스가 꽤 있어서 그런지 미팅중인 회사원 분들이 주로 계셨어요. 한가로이 즐기고 간 사운즈한남🖤 조만간 또 올거예요. 주말에는 어떨지 모르지만 평일에는 사람이 없고 공간이 넓어 공간감이 주는 고요함이 참 좋아용. 주차장 요금 사운즈한남 내 매장에서 구매를 해야지만 2시간에 5천원 적용이 됩니다! 미구매 시 미적용 주차/발렛 업체에서 잘 관리해주세요. #한남동카페 #한남동맛집 #한남동브런치 #사운즈한남 한남동 가볼만한 곳 내돈내산 찐맛집 테라스 주차가능 카페 애견동반 애완동반 와인맛집 다이닝바 서울카페 서울여행 이솝 한남점 다이슨매장 발렛가능 주차요금 발렛요금 조용한 카페 술집 이태원 데이트"
