title,content
"한남동 와인바, 아이스크림 와인 페어링 살리르",아이스크림이랑 술 페어링 해준다는게 넘 매력적이라 저장해둔 살리르 50m © NAVER Corp. 살리르 서울특별시 용산구 이태원로54길 58-20 1층 달마다 아이스크림 라인업 바뀐다고 하셨으니 이건 이미 참고하기 힘든 메뉴판 이미 취해서 읽어도 머리가 안돌아감 그래서 추천받았다 아이스크림 단독으로 주문 가능하지만 우리는 술도 같이 페어링해주신 와인 스모크드 초코 앤 솔트 내가 고른 아이스크림인데 먹자마자 훈연한 향이 확 나서 신기했다 차가운데 스모키함 아이스크림에서 처음 느껴보는 맛이라 첨엔 넘 낯설었다 ㅋㅋㅋㅋ 추천해주신 레드와인이랑 확실히 잘 어울림 친구가 고른 땅콩과 금귤 여기 아이스크림이 다 흔하지 않은 맛이라 한입 한입 먹어보는게 재밌었음 스파이시 트로피칼 프루트 이건 확실히 기억난다 아이스크림에서 매운맛이 날수있다는게 충격이었기 때문에 첫입은 상큼한데 매콤함이 톡 치고올라온다 너무 낯설어..근데 나쁘지 않아... 신선해..매력있어 그래서 비슷한걸루 추천받아서 하나 더 시켜봤다 모과랑 생강 사장님께서 어울리는 술이라면서 한잔 내어주심 감사해용 ㅜㅜㅜ 재밌었넴 화장실 매장 안에있고 깨끗한것도 좋다 이번달 아이스크림 라인업이 궁그매 한남동 가시면 가볍게 들러보세용
한남동 와인바 살리르 내돈내산,"안녕하세요 이웃님들 ㅎㅎ 한남동~!./ 이색 아이스크림이랑 같이 와인 먹는 곳을 찾아서 2차로 갔어요! 내부 자체는 좁지만 분위기도 좋고 사장님도 친절하게 설명 많이해주셔서 테이크아웃하러 들어간 아이스크림 집에서 엄청 먹고 왔네요 ㅎㅎ 골목길에 있어요.. 한강진역 3번출구에서 도보 7분 컷이고 테이블이 적어서 웨이팅 있대요..평소엔 저는 럭키 였네요 ❤️ 50m © NAVER Corp. 살리르 서울특별시 용산구 이태원로54길 58-20 1층 아이스크림 종류가 엄청 다양한데 너무 좋은게 추천 페어링 와인을 함께 먹을 수 있어서 너무 좋았어요!!! ㅋㅋㅋㅋㅋㅋㅋㅋㅋㅋㅋㅋㅋㅋㅋㅋㅋㅋㅋㅋㅋㅋㅋㅋ 이렇게 아이스크림을 고르면 거기에 맞는 와인을 주신답니다!! 먹으면서 너무 신기하고? 새롭고? 맛있고 와인이랑도 너무 잘어울려서 또 추천받아서 시켰어요! 내부는 4인용 테이블, 창가쪽 2인석 그리고 바 좌석 4인 정도 가능합니다. 좁지만 안에 화장실도 있어서 그점은 좋았어요 원래는 아이스크림 마다 꽃도 내어주시나봐요 저희갔을땐 없었는데 ㅎㅎ 진짜 이색? 이차로 가기 너무 좋은곳! 와인 먹고싶을때 가기 너무 좋은곳!! 한남동 가면 강추 합니다 ㅎㅎ #한남동와인바 #한남동아이스크림 #한남동맛집 #한남동와인"
"팔팔하게 돌아다닌 팔월 / 한남동 도노, 살리르, 여의도 콘래드 호캉스, 진주집, 국립중앙박물관 전시, 서울식물원, 빌리아일리시 콘서트","춥다추워 긴팔 필수여. 처서 지났다고, 삐진애마냥 바로 추워지면 쫌 아쉬워?! 거 모나리자에게 너무한거 아니요. 50m © NAVER Corp. DONO 서울특별시 용산구 이태원로54길 63 예약 한남동이니까 밀가루 좀 먹어볼까나. 마당에 저 의자들 쓰는걸까. 먼지가 소복해보이던데,,?ㅋ 사실 먹은지 꽤 오래돼서 이게 뭔지 ㄱ이 안납니다,, 꾸덕하고 짭짤하니 내 취향이었던걸로. 어떤 요리든 새우 대가리만 들어가면 진국이 된다. 저 대가리들만 버터에 볶볶해도 존맛- 화덕피자 파는 집 많지 않으니까 보이면 일단 시켜야됨. 한남동 브랜드 쇼룸에서도 안 사던 옷을 소품샵에서 두 벌이나 지름 깔깔💸 50m © NAVER Corp. 살리르 서울특별시 용산구 이태원로54길 58-20 1층 메로나나 먹을까했는데, 눈앞에 왠 아이스크림'바'가 눈에 치여서 냅다 들어감. 뭐여 이 좁고 힙한 분위기는 뭐여 이 참신한 맛들은 와인, 칵테일 등 주류와 페어링해서 먹는 아이스크림 컨셉이라는데 정말 한남동스럽고 신박했다. 디저트보다 요리에 가까운 맛이라, 술이랑 먹으면 진짜 맛났을 것 같음ㅇㅇ. 메뉴부터 컨셉까지 다 힙한데, 힙중의 힙은 사장님이었음. 사장님 최고 힙하셔. 내가 먹은 샐러리맛 아스크림. 샐러리 갈아만든 차가운 이유식같아. 개운해~신선해~새로와~ K-직장인들이여🥹 안녕하세요. 예쁜쓰레기 대장입니다. 이 심보로 돈쓰다가 거덜났읍니다. 정신치료로 탕진했다고 정신승리하겠읍니다ㅎ 서울에 비 어엄청 많이 왔던 다음날 공교롭게도 예약되어있던 호캉스. 쩌는 한강뷰의 이곳은 여의도 콘래드 호텔임다. 비가 한참 와서 흙탕물이 되어버린 한강뷰를 내가 또 언제 보겠소. 오!히!려!좋!아! 50m © NAVER Corp. 세상의 모든아침 서울특별시 영등포구 여의대로 24 전경련회관 50층, 51층 예약 ❌이건 오!히!려!싫!어!❌ 엄마가 놀면뭐하니에 나온 한강뷰 레스토랑 가보고 싶다고 한 열번쯤 은근히 흘려서, 뻥안치고 60번 넘게 전화해서 예약한 레스토랑인데 말입니다. (왜때문에 네이버 예약이나 테이블링 안해ㅜ) 뜻밖의 구름뷰☁️ 하지만 더 뜻 밖이었던건 유명세에 비해 턱없이 아쉬운 서비스ㅎ 심지어 위 사진 속 파노라마 한강뷰 쪽에 앉지도 못함. 안좋은 날씨에 텅텅 비어있었음에도, 직원 부를 방법도 마땅찮은 한참 안쪽의 작은 홀로 안내받아 자리변경을 요청했더니 매우 황당한 답변이 돌아왔다. “짝수 시간대 예약자는 안쪽 작은 홀로, 홀수 시간대 예약자는 파노라마뷰의 메인홀로 배정” ?????????!!!!!!!!!!!!! 아니 그럼 예약할때 얘기 해주셨어야죠🤷🏻‍♀️ 우리가좍 뿐 아니라 다른 예약자들도 당혹스러움을 감추지 못함. 머 한강뷰는 호텔에서 보면 되니까. 라고 하면서도 아쉬운건 어쩔 수 없었다. 젠쟝! 음식이 잘못한건 없으니 리조또 고기도 부드럽고 맛있었습니다.. 면이 굵고 토통하니 특이하고 식감 좋았음 얜 그냥 서가앤쿡 꽃게파스타st 평화로운 다음 아침날☀️ 내나이 곧 서른,,조식에서 한식 찾는다,, 콘래드 한식 가짓수 많아서 너어무 좋음. 그래 나 사실 바랬어 파란하늘 고맙다 날씨야. 한때 나도 점심먹은 후 손에 커피 들고 여의도 공원을 산책하는 멋찐 서울 직장인이 될 수 있을거라 생각했지,, (서울 직장인 맞긴함. 근데 이제 쫌 구석에 있는) 어디서 차임벨 소리 들릴 것 같아요. 역대급 물폭탄에 역대급으로 잘 자란듯한 풀떼기들. 점심시간 끝나가는 직장인들 사이로 난 여유롭게 잉어 밥주기 구경하는거 짜릿해. 평일 낮 서울도심 이 맛에 오지. 하늘 담은 연못이었는데 개구쟁이 소금쟁이가 장난치고 갔음다. 귀찮아하는 엄마아빠 끌고 야무지게 한강둔치. 물이 다 안빠져 평소 여의도 공원 면적의 절반 정도였다. 강 안쪽에 가로등이 서있어서 뭔가 했더니, 물이 차있던거였음,,오마나. 바람도 좋고 날도 좋고 30분 정도 멍때리다가 점심먹으러 일어남. 50m © NAVER Corp. 진주집 서울특별시 영등포구 국제금융로6길 33 지하 1층 예약 여의도 콩국수 맛집 여기 진짜 맛집임 대박임. 나 콩국수 별로 안좋아하는데, 비빔국수 시켜놓고 엄마 콩국수 내가 다먹음. 진짜 담백하고 고소하고 진득하고, 소문난 맛집이라 언제나 대기가 있지만 앉자마자 나오는 K-패스트푸드라 회전율 와따여👍 그리고 만두 꼭 시키십숍숍숍. 여기 만두 맛집임. 만두 양도 많고 진짜 맛있었다. 꼭먹어야됨. 쓰읍. 쓰다보니 또 생각나는데. 같이 갈래 이거 보고있는 칭구들아,,!? 엇 어디 해가 지고 있는것 같은데요! 이거 핑크색 물든거 같은데요!! 이 정도면 분홍 하늘 아입니까!!! 50m © NAVER Corp. 국립중앙박물관 서울특별시 용산구 서빙고로 137 국립중앙박물관 끝나지 않는 서울여행. 국중박 들립니다. 하늘을 액자에 담아둔 듯한 건축구조가 아주 웅장하구 멋있다. <아즈텍 특별전시-아스테카 태양을 움직인 사람들> 유료전시지만 궁금해. 못참아. 위협적인 독수리처럼 보이기 위한 갑옷이라는데요(왼) 쫌 큐티뽀짝한듯. 이건 좀 괴랄하고 무섭습니다,,🫢 인간을 재물로,,바칠때,,쓰던 칼이라는데,, 쫌..귀여운듯 하다가도 섬뜩쓰. 약간 ‘타인은 지옥이다’ 그 눈깔 아줌마 같아. 스크류바 아닙니다. 나는야 바람의 신-🌪 소용돌이 바람을 표현한 몸뚱아리가 아주 직관적이군요. 맘에 들어. 저승 문턱의 사신,,인데,, 저승 안갈래요. 무서워요. 용산 사는 사람들 좋겠다. 나도 여기로 산책와서 책 읽고 싶다. 아차차-난 올공이 있지. 욕심 멈춰-!✋ 50m © NAVER Corp. 서울식물원 서울특별시 강서구 마곡동로 161 서울식물원 마곡으로 옮겨 재개관한 LG아트센터 개막 전 테스트 공연에 초대받아 온김에, 바로 옆에 있는 서울식물원 구경 호로록. 초록색으로 눈정화🍃 뭔데 나 이 주간 엄청 바빴네. 갑자기 이번엔 문래. 워크샵 영화 찍을 때만해도 그냥 공장촌이었는데. 하긴 그것도 벌써 9년 전이니까~ 앗 내 나이~~🤓 상점도 상점인데 공방도 많아서 거리 구경하는 재미도 있음. 여기는 컨셉 아니고 진짜 찐 커피숍. 50m © NAVER Corp. 타코 비리아 서울특별시 영등포구 도림로139길 11-1 103호 104호 시금치 통닭 대기가 많다면 타코를 드십숍숍숍- 타코 맛 무난. 타코는 언제나 옳다. 살사감튀 존맛존맛. 아맞다 나 빌리콘서트 갔었지. 친구 잘둔 덕에 이틀 티켓팅 내리 실패하고도 콘서트에 가는 행운을 얻었습니다. 감사함다~감사함다~🙏 귀엽고 노래잘하고 잘놀고 빌리가 다해. 무엇보다 그냥 노래 자체가 너어무 좋아서 몸을 주체할수가 없었다. 활어마냥 퍼덕거린 결과 3일 동안 허리가 나감,,ㅎ 근데 거 여러분들. 우리는 삼각대가 아닌데, 왜 삼각대마냥 폰들고 찍기만 하고 있어요. 같이 좀 흔듭시다 후하항~ 이라고 하지만 즐기는 방식은 자기 맘임ㅇㅇ NDA 무대에서 요 뮤비 영상 비슷한 LED가 쓰였는데, 알던거지만 진짜 노래랑 비주얼이랑 너무 잘 붙음. 10차선 횡단보도 건널때 이 노래 들을 거임. 표준 뽀빠이 자랑으로 급 마무리. 두 달만에 표준이 되었소다. 뿌듯해. 다들 운동하십숍숍쇼 밀린 사진이 많아서 부담스럽네 쫌ㅎ 추석 연휴에 쓰지않을까 내일의 나에게 미루며 끝."
"[한남동/카페] 살리르, 술과 독특한 아이스크림","아주 독특한 아이스크림 가게를 발견해서 다녀왔다. 오후 16시에 오픈하는 술과 아이스크림을 파는 가게이다. 예쁜 물병과 물 잔을 먼저 세팅해 주신다. 술집인지 모르고 갔기 때문에 .. 아이스크림만 시켰다. 월별 메뉴도 있고 보통 메뉴도 있다. 나는 초코, 생강, 라임이 들어간 아이스크림과 토마토, 바질, 올리브오일이 들어간 아이스크림을 시켰다. 왼쪽이 초코, 오른쪽이 토마토이다. 독특한 재료가 들어갔지만 튀지 않고 조화로운 맛이다. 아이스크림 위에 정성스럽게 토핑까지 올라간다. 인테리어도 너무 멋지고.. 밥 두 공기처럼 두 공기 뚝딱하고 나왔다. 다음에는 저녁시간에 가서 술 한 잔도 하고 싶다만.. 한남동은 우리 집에서 너무나 먼 동네다! 50m © NAVER Corp. 살리르 서울특별시 용산구 이태원로54길 58-20 1층"
[추천] 한남동 이색 와인바 ‘살리르’,"금요일 데이트의 2차를 장식한 곳은 바로 이곳! <살리르>입니다 :) 원래 오든을 가려고 했는데 대기가 길어져서 바로 옆에 있던 곳을 트라이 한건데요 살리르 서울특별시 용산구 이태원로54길 58-20 1층 계획에 없던 곳이었지만 너어무 특별한 곳이었습니다! 예상치 못했던 일들이 이렇게 즐거움을 안겨주기도 하니 인생은 참 알 수 없는 것이어요 🥹😌 굉장히 독특한 컨셉의 와인바인데요 🍷 와인과 🍧 아이스크림의 페어링 !! 저녁을 먹은 상태라면 2차로 오기에 정말 적당한 곳이었어요!! 긴머리의 사장님 컷 ㅎㅎ 저희가 앉을 자리가 다행이 있었네요 :) 무심한 듯 시크한 인테리어가 감각적입니다 ㅎㅎ 저희가 앉았던 테이블 :) 아이스크림을 주문하면 거기에 어울리는 잔 와인을 추천해주십니다 :) 제가 주문한 건 너티한 종류였고 친구는 푸르티한 메뉴를 골랐는데 두 가지를 페어링 했을 땐 개인적으로 친구 메뉴가 상큼함이 배가 되어서 굉장히 특별했어요! 아트가 따로 없죠 😀 분위기와 함께 무르익어갑니다 :) 어떤 좋은 시간을 보내고 나면 사실 무슨 대화를 나눴는지는 다 기억나지 않아요 그런데 돌아가서 자리에 누웠을 때 아, 오늘 시간이 너무 행복했어 라는 감정으로 가득 남게되죠. 연말과 연초엔 가끔 다 그만두고 싶단 생각을 할 정도로 스트레스가 많았던 날들이었는데 또 이렇게 선물같은 하루 때문에 견뎌내고 다 잊어버릴 수 있는 거 아닐까 생각이 드네요. 행복이 별 거 없죠? 사는 것도 별거 없고요. 사랑하고 아끼고 많이 안아주고 +맛있는 거 많이 먹고 그렇게 살아요 우리, :) 2023.2.5. From Mei"
"[한남] 이태원/한남동 와인 바 페어링 아이스크림! 살리르, SALIR",한남동에 위치한 살리르입니다 와인바 찾으신다면 추천합니다 :) 위치를 잘 찾아간다면 바로 여기 이쪽 골목 구석에서 만날 수 있어요! 바로 이 곳입니다! 들어가는 공간이 확 보여서 좋았어요 저희에게 이곳으로 자리 안내를 주셨어요! 따로 예약한건 아니고 전화로 대기 있냐고 여쭤봤더니 지금 오면 된다고 하셨구 그 뒤로는 저희처럼 전화 예약하고 오시는 것 같더라구요 :) 바자리쪽에 안내해주셨구요! 만들어주시는 주인님(?) 사장님(?) 너무 힙해요 ㅠㅠㅠ❣️ 이렇게 아이스크림!!! 앞쪽에서 결제합니다 아이스크림도 다 직접 믹스해서 만드신거래요!!!! 멋지다... 아이스크림 고르면 어울리는 와인을 주십니다! 맛이라고 써있네요 하나도 모르겠어서 추천해달라고함... 그래서 고른 두가지 맛 그리고 거기에 어울리는 두잔! 쨘 수저입니다 :0 요게 아마도 럼키위였어요! 비주얼 너무 예쁘죠 ㅠ 이친구는 주주베 그릇까지 너무 예뻐요! 늦은 점저먹고 카페갔는데 뭐먹긴 애매하고 할때 와인바 안주도 가볍고 싶다면 여기 추천해요 :0 그럼 이만 뿅🤎 #한남동와인 #한남와인 #이태원와인 #살리르
와인과 아이스크림 페어링 한남동와인바 ‘살리르’,"내가 제일 사랑하는 아이스크림🍦 그리고 와인🥂 두 조합을 페어링해주는 와인바 SALIR https://instagram.com/salir_hannam?igshid=MjkzY2Y1YTY= S A L I R(@salir_hannam) • Instagram 사진 및 동영상 팔로워 1,137명, 팔로잉 63명, 게시물 180개 - S A L I R(@salir_hannam)님의 Instagram 사진 및 동영상 보기 instagram.com 월화 휴무 수목일 4-12 금토4-2 한남동 작은 골목 속 골목안쪽에 위치한 SALIR 자칫 잘못하다간 놓칠 수 있으니 구석구석 살펴보기!!! 내부는 4자리 정도만 있어 매우 아늑하다 그래도, 깔끔하니 힙한 갬성 가득하다 와인 메뉴판 주문 팁: 먼저 🍦🍦 고른 후 그에 어울리는 와인을 직원분이 추천해주신다 쨘🍦 우리가 처음에 골랐던 메뉴들 이름이 너무 길고 설명이 장황해서 이름을 외우기 힘들었다 참고로, 메뉴는 시즌별로 바뀌고 네이버, 인스타그램에 업데이트된다 샴페인🍾 서비스로 주셨전 자두인데, 정말 맛났다"
[아이스크림&와인바] 한남동 살리르 SALIR/ 매달 바뀌는 아이스크림과 와인 페어링/2차 가기 좋은 곳/ 데이트하기 좋은 곳 ♥,"220628 올만이다 !!! 습관들여야대는데,,, 블로그,,, 쥬륵 어제 고딩 친한 친구를 만나서 간단하게 밥먹구, 2차 고민하다가 아주 재밌고 특이한 곳에 다녀옴!! 갱장히 힙한 인테리어로 와인과 아이스크림을 같이 파는 곳이라구 한다 0_0 생각보다 더 재밌는 곳이 많아 세상엔,,, 대략적인 메뉴판 앞모습 앞의 6가지 써있는 게 아이스크림 맛 종류 사장님의 레시피로 매달 바뀐다고 한다 이런식으로 날 재방문하게 하는거쥐,,, 아이스크림은 개당 5000원이고, 아이스크림을 고르면 그에 맞는 와인이나 맥주를 추천해주신다 우리는 맨 마지막의 (D) CHOCO & SUN FLAVOR, POP CORN FLAVOR (다소 읽기 어려운 글씨체,,로 당황,,) (D)는 다크초코라는 뜻,,,! 내 손톱,,, 저리가,,, 뜯겨나간게 보기싫쿤 ㅎ 대략적인 가격은 이렇다 근데 어차피 사장님이 아이스크림 골라주시니 저걸 다읽어봐두 크게 의미가 없다 ㅎㅎ 다 처음보기도 하고,, 생각보다 술종류는 저어어어엉말 많다 세상에 인테리러가 고급져서 뭐 대충 찍어도 이쁘다 POP CORN FLAVOR 요건 신기해서 시켜본애 페어링해주신 와인: Justino's Madeira, verdelho 10 Years Old (Alc 19) 아이스크림은 뭔가 어딘가 먹어본 맛인데 팝콘이랑 무난하게 잘어울렸다 여러아이스크림 중 얘는 좀 빨리 흘러내려서 맛을 제대로 보지 못한거 같기두 ㅎㅎ 달달한 편이라서 페어링 해주신 와인이 도수가 쎄고 좀 와인이라기엔 좀 특이한 맛이 느껴졌다,, 묵직하면서 달달한 맛이나고 도수가 쎈게 느껴지지만 목이 타들어갈정도는 아닌 ㅎㅎ 난 취할거같아서 친구에게 토스 ㅎ (D) CHOCO & SUN FLAVOR petrus bordeaux (페트루스 보르도) (ALC 5.5) 보르도..? 와인하면 흔히 나오는 보르도...? ㅎ 뭐,,,잘 모르겠구 요건 흑맥주랑 페어링해주셨다 맥주는 꽤나 묵직하고 그래도 낯설지 않은 맛이었다 묘하게 다크초코랑 잘어울렸다 (왼) 첫번째 나온 주황색 와인 (오) 흑맥주 ! 왼쪽 와인,,,너무 첫인상이 강렬해 검색해서 요 시리즈로 더 먹어볼 예정 ㅎㅎ 매달 아이스크림 맛을 직접 구상해서 바꾸신다고 한다 사장님께서 센스있고 친절하셔서 6월말이니 다음달 메뉴라며 먹어보라고 주셨다 요건 커피향나는 아이스크림 그리고 이건 마지막 마무리로 주신 파인애플맛 아이스크림 딱 상크미를 원하던 타이밍에 주셔서 더좋았다 ㅎ!! 아무래도 2차나 3차로 가는 곳이니까 파인애플같은 상큼한 맛으로 마무리할 수 있도록 이 맛은 늘 있었으면 좋겠다고 생각했다 ㅎ.ㅎ 처음엔 무조건 재방문의사 있구요 !! 첨에는 잔당 가격이 만원, 만오천원해서 비싸다 생각했는데 양도 많이 주시고,, 비싼건 도수가 좀 높은 경우도 있고 한두잔에서 끝나니까 전체적 가격은 적당하다고 생각이 들더라구요 50m © NAVER Corp. 살리르 서울특별시 용산구 이태원로54길 58-20 1층"
한남동 와인과 아이스크림 페어링이 있는 곳 - 살리르 SALIR,"SALIR 서울 용산구 이태원로54길 58-20 1층 동기가 데려가준 곳, 살리르! 와인이랑 아이스크림 페어링이 있는 곳이라니~ 너무 기대됩니다! 일단 후식으로 제격이에요. 들어가는 입구부터 분위기 무엇.. 밀린 블로그 글쓰기 힘든데 약간 삘받았는지 계속 쓰는중 추천받은 와인 추천 받은 와인! ** 아이스크림 먹고 싶은 걸 고르고, 그 아이스크림과 어울리는 와인을 추천받아 보세요. ** 이렇게 아이스크림 종류도 꽤 많다. 나는 엘더플라워, 친구들은 탈리스커 10y와 애플그린샤벳트 난 쫀득쫀득한 아이스크림이 먹고 싶어서 샤벳트는 패스했다. 그래봤자 다같이 나눠먹었는데 엘더플라워, 탈리스커 둘 다 맛있고 샤베트도 시원하긴 한데 쫀득하진 않았다. 신났는지 흔들리는 샷들 =) 후추를 뿌린 탈리스커 풀이랑 같이 있는 게 엘더플라워 가게 내부는 조금 협소하다. 자리가 꽉 차면 그대로 못 이용하는 구조..? 그래도 밖에도 의자는 없지만 테이블이 있는 것으로 보아 스탠딩 정도는 가능할 듯! 각자 어울리는 술 추천받아서 아이스크림과 호다닥- 먹어보기. 여기 아이스크림도 맛있고, 장사도 잘 될 것 같아서 부럽다.. 사장님.. ^^ 또 갈거라서 더 부러운 사장님, 어쨌거나 괜찮은 와인바 찾았다! 아이스크림은 덤이라, 여자들이 참 좋아할 바 - 50m © NAVER Corp. 살리르 서울특별시 용산구 이태원로54길 58-20 1층"
살리르 (SALIR) / 한남동 아이스크림 와인 페어링,오빠의 추천으로 방문한곳. 젤라또와 와인 페어링이라는 점이 신선해서 가기전부터 궁금해졌던 곳이였다. 내부는 생각보다 작았는데 공간에서 부터 존재감이 뿜어져 나오는 곳이라는 인상부터 들었다. 석류&장미 그리고 레드와인 은은한 레드와인과 상큼한 셔벗이 맞춤같았다. 장미맛이 나는데 은은-해서 향기롭게 느껴질 정도였다. 그리고 펜넬씨&크림셰리 그리고 쉐리와인 펜넬씨 라는 향신료가 강한맛이여서 걱정반 기대반으로 주문했는데 처음 마셔보는 쉐리와인이 너무 맛있었다. 서비스로 주신 에스프레소&IPA / 팔각&아몬드 까지 완벽했던 디저트 와 페어링이였다! 쉐프님과 수다떨다보니 시간이 훌쩍 흘러있었다. 나올때쯤 보였던 작은 간판. 친구들이랑 한강진 오면 꼭 다시 들려봐야지!
한남동 맛집 클랩피자 & 디저트바 살리르,"히 내가 젤 좋아하는 9월 기념 🤍. 장소 블챌을 시작해보겠습니더 🤡 엄청 잘 놀러 댕기는 요즘 일상도 기록할겸 ..!! 20230901 저녁으로 말로만 듣던 클랩피자 방문 👏🏻 🍕 50m © NAVER Corp. 클랩피자 한남 서울특별시 용산구 이태원로42길 36 지하1층 예약 금요일 저녁 웨이팅 지옥 상상만해도 끔찍했는데 7시좀 넘어 다행히 웨이팅 없이 입장했움 페퍼로니 피자 & 더블포테이토 피자 반반 작은사이즈로 주문해따 가격은 피자 작은사이즈 (11인치) 24000원 치즈 프라이 5800원 콜라 4000원 ☠️ 이었움 포테이토보다 페퍼로니가 매콤해서 덜 물렸다 피자 생각나면 또 올 의향 있는 듯 ❕ 현대카드 라이브러리에서 lp랑 책도 구경했는데 사진없어 ☠️ 그래서 다음 장소는 ㄷ 50m © NAVER Corp. 살리르 서울특별시 용산구 이태원로54길 58-20 1층 카페는 닫은 시간이었고 아이스크림이나 빙수같은 시원한 디저트가 땡기고 헤비한 술집은 안땡겼는데 ,, 디저트 사진보고 1초만에 홀림 갓벽한 장소 발견 !! 불금토에는 영업시간도 새벽 1시까지 🤍 담에 가면 스팸 아이스크림 꼭 먹어봐야지 이날은 품절이었따 가게안은 요런 분위기 테이블은 몇개 없음 아이스크림을 선택하면 어울리는 와인을 추천해주신당 ! 미나리 레몬 아이스크림을 선택하고 스파클링 와인과 화이트 와인을 추천해주셔서 (와인종류는 글라스 1만 - 1.2만원대) 추천대로 도전쓰 🥂 맛은 완전 좋았다 !! 미나리 향이 조금 나긴하지만 무난하게 다 좋아할 맛임 레몬셔벗같은 느낌이 더 강했다 내취향으로 아이스크림 너무 맛있었는데 양이 너무 귀여움 !! 🐑 헐 끝임 또 쓸게 안넝 ~"
서울 한남동 한강진 이태원 아이스크림 바 혼술 맛집 살리르,찾기 힘들었다 아이스크림 판다는 말에 술이랑 아이스크림? 반신반의 일단 인테리어 넘넘 이쁨 취향저격 메뉴를 봐도 몰라서 사장님께 추천해달라규 부탁드림 난 초코러버라서 초코아이스크림이 좋아요 하니 그에 맞춰 맥주까지 추천해주심 체이서로 물만 마시던 나는 아이스크림도 안주가 될 수 있다는 점에 하트 뿅뿅 바 자리는 만석이라 창가자리에 나 홀로 혼술 바 자리 예약하면 혼술도 쉽게 가능할듯 사장님이 친절히 말도 걸어주심 50m © NAVER Corp. 살리르 서울특별시 용산구 이태원로54길 58-20 1층
