title,content
한남동 카페 추천 카페 르상스 사운즈한남점,"50m © NAVER Corp. 카페 르상스 사운즈한남점 서울특별시 용산구 대사관로 35 사운즈 한남 1층 📍주소 서울특별시 용산구 대사관로 35 사운즈 한남 ⏰영업시간 매일 10:00 - 22:00 21:30 라스트오더 ☎️문의 02-794-9009 💈기타 주차, 포장, 발렛파킹, 남/녀 화장실 구분, 배달가능 여러분 안녕하세요 형광이에요 오늘은 제가 특별한 한남동 카페 다녀왔어요! 낮에는 한남동 브런치 카페로, 저녁에는 와인과 음식을 맛볼 수 있는 곳인데요 다양한 분위기와 감성으로 즐길 수 있는 카페 르상스 사운즈한남점 소개해 드릴게요!🥰 햇살이 좋은 가을날의 방문이었어요 바람도 선선하고 길가에는 단풍잎이 떨어지기 시작해서 한남동 카페 나들이 하기 딱 좋은 날씨더라고요 길가를 걷다가 발견한 한남동 분위기 좋은 카페였답니다!😉 한남동 카페 야외테라스 분위기 특히 이렇게 입구부터 야외 테이블이 놓여 있는데요 파라솔과 갈대로 분위기있게 꾸며져 있어서 한남동 브런치 하기에도 정말 좋아 보였어요 특히 이 야외 테라스에 앉아 한남동 브런치 식사, 와인 하면 정말 좋을 것 같죠? 이미 핫플로 소문이 나서인지 사람들이 이 야외테라스에 하나둘 자리를 잡기 시작하더라고요😅 고급스러운 분위기와 더불어 프리미엄급 수준 높은 커피, 음료를 고집하는 곳이기도 한데요 고품질 원두커피만을 취급하고 일본 장인의 손길을 거친 녹차를 수입하는 곳이라고 하더라고요 그 덕분에 고퀄리티 입맛이 까다로운 분들도 아주 만족스러워 하실 한남동 카페 랍니다😚 한남동 카페 내부 내부 분위기도 보여드릴게요 커다란 통창으로 보이는 뷰가 아주 환상적이죠? 이국적인 감성이 가득해 외국 여행 온 기분도 들어요! 테이블,의자 모두 아주 감각적이면서 편안한 무드를 자아내고 있었고 카페 내부에서는 베이커리와 은은한 커피향이 풍기고 있어서 친구와 커피한잔, 또는 한남동 데이트 장소로도 정말 딱이라는 생각이 들었답니다😄 한켠에는 이렇게 커다란 스피커도 설치되어 있는데요 여유로운 감성이 가득 묻어나고 있었고 재즈, 클래식, 캐롤까지 분위기 있는 음악이 흘러나오더라고요! 크리스마스를 대비해 케이크와 슈톨렌도 판매한다고 하니 홈파티 예정이신 분들은 파티 준비하시기도 좋겠네요 🥰 한남동 카페 르상스에 오시면 평소 접하기 힘들었던 특별한 베이커리를 맛보실 수 있는데요 전통 프렌치 빵과 올리브, 하몽, 카츠샌드에 더불어 일본 제빵 스타일을 접목한 베이커리도 구매가 가능해요! 실제로 빵이 진열된 쇼케이스를 보니 처음본 종류의 빵들이 많아서 아주 새롭더라고요! 😋 한남동 베이커리 맛집으로도 유명해서 이렇게 낱개 포장된 빵들도 많이 있었는데요 한남동 브런치 하러 온 손님들도 많았지만 다양한 베이커리 포장 구매하는 분들도 많았어요 위생적으로도 아주 깔끔하고 보기좋게 진열되어 있어서 저도 한남동 카페 방문한 김에 빵을 몇개 골라 보았답니다 😚 한남동 카페 르상스 사운드한남점 친구와 마주보고 앉아 도란도란 이야기도 나누고 여유로운 분위기도 맘껏 즐기다 왔어요 확실히 커피에 대해 잘 아는 친구라 그런지 카페 르상스 원두의 퀄리티가 다르다고 아주 만족해 하더라고요! 직원분들도 아주 친절하시고 응대가 마음에 들어 인상깊었습니다 그래서 다음에는 한남동 카페 저녁에 방문해 와인과 음식 즐겨보기로 했답니다😁 한남동 카페 르상스는요 ✔️세계 3개 원두인 인텔리젠시아 원두 취급 ✔️고품질 벨기에 코코아 사용 ✔️프랑스산 밀가루와 버터 사용 카페 르상스 사운즈한남점 꼭 방문하셔서 고급스러운 분위기에 더불어 오전에는 고품질 커피, 저녁엔 프리미엄 와인 즐겨보세요! 🤭"
"한남동 브런치카페 르상스 사운즈 한남, 특별한 날 분위기있게 커피한잔하기 좋은 곳","르상스 사운즈한남점 서울특별시 용산구 대사관로 35 한남1층 10:00-22:00 (연중무휴) RO | 21:30 02-794-9009 | 포장 / 발렛 / 🅿 | 연말데이트로 추천할만한 카페 르상스! 낮에는 브런치와 커피를 즐길 수 있는 야외 테라스, 밤에는 와인바로! 해외에 온 기분이 들게하는 한남동카페 '르상스'에 다녀왔어요. 한남동카페 르상스 한남동카페, 분위기&브런치 맛집 50m © NAVER Corp. 카페 르상스 사운즈한남점 서울특별시 용산구 대사관로 35 사운즈 한남 1층 한남동카페 르상스 한남동카페 '르상스'는 이태리의 한 거리를 떠올리게 하는 분위기가 너무 멋있는 곳이에요. 한남동캎페 '르상스'는 사운즈한남의 입구로 들어오셔서 뒷쪽에있는 문으로 들어가시거나 도로로 보이는 문으로 들어가셔도 되요~ 야외에있는 테이블이 유독 눈에 들어오더라구요~ 카메라를 들기만해도 명작이 탄생하는 이 곳 한남동카페 '르상스' 이재 곧 연말이잖아요! 커플분들 연말데이트장소로 적극추천합니다! 저녁에는 와인도 판매하기때문에 부모님을 모시고와서 와인한잔 좋을 것 같아요. 한남동카페 '르상스'의 내부는 따뜻하고 포근한 느낌이에요. 재즈, 캐롤 등 정통음악들을 즐길 수 있는 라운지형식으로 되어있답니다~ 일본제빵기술을 접목해 한국인들이 좋아할 수 있도록 만들어놓은 다양한 베이커리종류들이 많이있는 한남동카페 '르상스' 전통 프렌치 빵과 하몽, 카츠샌드 등 종류가 굉장히 다양해요~ 한남동 브런치카페로 추천할만하네요! 곧 있을 연말을 맞이해 캐롤 및 슈톨렌도 판매하고있었어요~ 한남동카페 '르상스'에서는 일본(나가사키) 장인의 녹차를 직수입하셔서 사용하신다고 해요!! 맛이 어떨지 너무나 궁금하네요! 커피에 사용되는 원두도 고품질 벨기에 원두와 코코아를 사용하셔서 커피와 코코아의 향이 깊고 진하다는 것이 특장점!! 세계 3대 원두 중 하나인 인텔리젠시아 원두를 사용하신다는 것을 보고 한남동카페 르상스가 커피맛집이라고 소문난 이유를 알겠더라구요! 한남동카페 르상스의 브런치메뉴들을 살펴보면 부라타 무스 샐러드 23,000원 올리브&하몽 16,000원 치즈플래터 27,000원 등 가격도 착한편이에요~ 빵을 만드실 때에도 프랑스산 밀가루와 버터를 사용하신다고하시니 풍미는 말할 것도 없더라구요~ 내부에서 밖을 내다본 풍경도 멋지죠?? 뻥 뚫린 뷰는 아니지만 은은한 가을감성 폴폴~~ 흰 눈이 펑펑 내린 후에 와도 예쁠 것 같은 느낌^^ 밤에는 테라스가 분위기있는 와인바로 변한답니다~ 낮과 밤, 두가지의 모습을 갖고있는 한남동카페 르상스! 네이버 지도 공간을 검색합니다. 생활을 연결합니다. 장소, 버스, 지하철, 도로 등 모든 공간의 정보를 하나의 검색으로 연결한 새로운 지도를 만나보세요. naver.me"
한남동 브런치 카페 르상스 사운즈한남점 제일기획 순천향대 맛집,"50m © NAVER Corp. 카페 르상스 사운즈한남점 서울특별시 용산구 대사관로 35 1층 한남동 브런치 카페 르상스 사운즈한남점 (1) 재생 1 좋아요 0 00:00 00:03  한남동 브런치 카페 르상스 사운즈한남점 (1) 한남동 브런치 핫플로도 유명한 카페 르상스 사운즈한남점 다녀왔어요 :) 영업시간이 오전10시부터 오후 10시까지라 어떤 시간에 만나도 좋을 카페 르상스는 브런치, 베이커리, 커피만 파는게 아니라 와인도 있었어요! 퇴근 후 내사람들과 즐기는 와인 타임 이런곳에서의 분위기라면 저는 대환영! 제가 알쓰이지만 유일하게 사람들과 즐기는 분위기가 와인 & 샴페인 타임이거든요 ㅎㅎ #제일기획 #순천향대맛집 #한남동베이커리 #한남동커피 #한남동테라스 저는 빵순이라 특히 아침, 점심 이런 브런치는 빵으로 잘 먹는 편이에요 그냥 커피만 즐겨도 늘 기분은 UP 되어있는 편이지만 ㅋㅋ 빵과 함께라면 더 든든하기도 하고 나중에 운동할 계획이 있다면 간단히 빵 정도로 라이트하게 식사 한 후 저는 운동끝나고 편히 밥먹는? 스타일이거든요 ㅋㅋㅋㅋㅋㅋ 이날도 필라테스 저녁에 예약해두었던 날이라 커피와 샌드위치 즐겨야지 해놓고 결국 달콤한 마들렌 픽 ㅋㅋ 사실 저는 야외 자리 성애자이잖아요 그래서 너무너무 카페 르상스 사운즈한남점의 야외석들의 분위기가 취향저격이었는데요 아직 이번주까지는 따뜻해보여도 방심할 수 없는 온도차가 살짝 있었던 한주였기에 컨디션 조절 위해 혹시 몰라 실내에서 커피타임 즐겼습니다 ㅎㅎ 몇일뒤면 3월이니 봄 날씨다! 느껴질때부턴 저는 꼭 저 야외석 앉아서 커피 즐길래용 ㅋㅋ 모던 베이커리 테라스 카페로 보시면 되는 순천향대 맛집 카페 르상스 사운즈한남점! #카페르상스 #사운즈한남 #한남동브런치 #한남동카페 #한남동브런치카페 #카페르상스사운즈한남점 곳곳이 손님들로 꽉 차 있던 실내라 더 자세히 좌석들 담을수는 없었지만 ㅠㅠ 정말 한남동 여자들의 핫플이었어요 ㅎㅎㅎㅎㅎㅎ 실내석이 아담한ㄷ스 보여도 다양한 베이커리 종류가 있었고 커피 맛도 좋아서 깔끔하게 분위기 즐기기 좋은 사운즈한남 카페 르상스! 화이트와인과 베이커리 종류 카페 르상스에서 겟해서 같이 먹어도 잘 어울리겠다 싶고요 ㅎㅎ 특히 테라스에서는 분지로의 돈카츠를 활용한 카츠산도! 올리브, 하몽 이렇게 화이트와인과 즐길 수 있어서 분위기 있는 모임 가지기 너무 좋은 카페 르상스 에요 :) 사운즈한남하면 레드 레드라는데! 바로 야외로 이어지는 문으로 보면 이 좌석들이 이어져 있어요 :) 통통한 쿠키들도 눈길이 가구요 저는 마들렌, 휘낭시에 이런거 좋아해서 종류별로 겟해도 좋겠다는 생각 바로했다는! 프랑스산 밀가루와 버터를 사용했다고 하더라구요 그래서인지 빵이 더 깊은 풍미를 느낄 수 있어서 너무 좋았구요! 일본식 베이커리 기법들을 활용한 곳이라 여기는 베이커리 자체의 퀄리티가 높아보였어요 같이 온 언니도 찐 인정해준 곳! (이미 언니는 여기 자주 오신 찐 고객 ㅎㅎ) 한남동 브런치 카페 르상스 사운즈한남점 (2) 재생 2 좋아요 0 00:00 00:12  한남동 브런치 카페 르상스 사운즈한남점 (2) 앙버터 홀릭들에게 추천하고픈 소금빵도 보이구요! 잠봉뵈르 보자마자 커피와도 어울리는 한남동 브런치 메뉴! 그리고 저녁에는 와인과 어울리는 안주로도 딱이겠다 싶었던 메뉴에요 ㅎㅎ 진짜 넘 맛있겠죵?! 치아바타 홀릭이기도 한 저는 올리브 치아바타보고 멈칫! 완전 내스탈 ㅎㅎ 주위 선물하기에도 너무 좋아보이는 기프트박스도 센스있어보이는 디자인! 깔끔 그 잡채 참고해보시고 선물로 get 해보세요! 1인당 1개씩 이용하기 좋은 센스있는 미니 사이즈 발사믹오일과 잼까지! 커피는 주문하면 원두를 고르실 수 있어요 은은한 산미의 밸런스가 느껴지는 1번은 클래식! 2번은 다크한 묵직한 바디감이 느껴지는 원두이고 3번은 디카페인도 있답니다! Japanese tea 가 왜이리 눈에 띄는가 했더니! 일본 차 장인의 맛을 느낄 수 있는 곳이더라구요 카페 르상스 ㅎㅎ 한남동 브런치 카페 르상스 사운즈한남점 (3) 재생 1 좋아요 0 00:00 00:14  한남동 브런치 카페 르상스 사운즈한남점 (3) 외국 아니냐며 분위기 어쩜 좋아 ♥ 언니가 여기서 사진 꼭 찍어야된다고 앉아보라며 ㅋㅋㅋ 멋있는 곳에서의 즐거운 커피타임 잘 즐기고 왔답니당 또가야지이 ★ 본 리뷰는 카페 르상스 사운즈한남점에게 제품/서비스를 제공받았으나, 주관적인 생각으로 작성하였습니다."
"[한남동 핫플] 콰르텟 이후 생긴 사운즈한남 카페 ""르상스"" 과연 커피맛은?","230407 르상스 내가 지금까지 살면서 가장 맛있다고 느낀 아메리노가 있는 한남동 카페 콰르텟에 방문했는데 세상에.. 인테리어는 모두 그대로인데 카페가 바뀐 슬픈 사실😫 콰르텟 아메리카노는 진짜 잊을 수가 없는 맛이었고 손님들도 분명 많았던 것 같은데 콰르텟 사장님 어디 가셨나요!? 그래도 어차피 찾아간거 변경된 카페 르상스의 커피맛은 어떨지 궁금해서 다른 곳으로 가지 않고 르상스에서 아메리카노를 즐긴 후기를 적어본다. 기본정보 📌영업시간 / 10:00 - 22:00 📌 문의 / 02-794-9009 (휴무 없음) 카페 르상스 사운즈한남점 서울특별시 용산구 대사관로 35 사운즈 한남 1층 한남동 핫플인 사운즈한남에 위치한 콰르텟에 방문해봤다면 알겠지만 콰르텟 때와 달라진거 하나 없이 인테리어를 그대로 사용하고 있는 르상스. 사운즈한남에는 이 카페뿐 아니라 몇 몇 음식점과 쇼핑거리가 입점해있는데 분위기가 진짜 짱이다. 단 하루의 휴일도 없이 영업을 하고 있는 한남동 핫플 사운즈한남 카페 르상스는 서울의 한복판이지만 주차가 가능한 곳이다. 하지만 주차비가 발생하니 참고하기를~ 분위기 여유로운 주말 사운즈한남 카페 르상스는 건물 내부와 외부 두 곳에서 음료를 즐길 수 있는데, 외부가 건물에 둘러쌓여 있어 길거리와는 완전히 차단되면서도 자연광을 받을 수 있는 공간이라 아늑한 느낌을 자아낸다. 특히 건물 벽돌 색감이 붉지 않고 거의 모노톤에 가까운 따뜻한 잿빛색이라 공간 자체가 멋스러우면서도 여유로운 주말 브런치를 즐기는 것 같은 착각을 불러일으키는 곳이다. 앉아만 있어도 기분이 좋은 곳🥰 카페 입구는 바깥쪽에도 있지만 건물 안쪽과 연결되는 외부쪽에도 입구가 하나 더 있어서 왔다갔다하기에도 편리하다. 내부는 일반적인 카페 느낌. 메뉴 커피&일본식음료 커피와 차, 말차 라떼, 에이드 등의 음료를 다양하게 판매하고 있는데 특이한 점은 커피 외에 대부분의 음료는 일본식이라 명명되어 있다. 일본에서 생산되는 재료를 사용하는 건가? 가격은 요즘 흔하게 접할 수 있는 정도였고, 내 기억이 맞다면 메뉴도 콰르텟 때와 하나도 바뀌지 않은 듯. 📍커피 / 4,500 ~ 6,500원 📍일본식 음료 / 7,000 ~ 7,500원 빵 조류와 와인 종류도 몇 가지씩 판매하고 있다. 맛 평범해진 아메리카노 아메리카노와 정확한 명칭은 기억이 나지 않지만 흔히 말하는 마늘빠을 함께 구매했다. 커피가 담기는 잔과 트레이 모두 콰르텟 때와 달라진 것이 하나도 없다. 다크한 원두로 선택한 아메리카노! 콰르텟 때에 비해 상당히 평범해진 아메리카노 맛에 다소 실망스러웠다. 이전에는 아메리카노의 맛이 저말 진하게 느껴졌었는데 지금은 어느 카페에서나 먹을 수있는 맛으로 변질됐어😭 하.. 콰르텟 사장님 어디서 다시 카페 안 여시나요? 아시는 분 있으면 댓글로 좀 알려주시길ㅜ 마늘빵은 우리가 아는 딱 그 맛~ *총평* 분위기는 여전히 매력적이지만 맛은 평범해진 한남동 핫플 사운즈한남 카페 르상스:) *내돈내산*"
한남동 브런치 추천 사운즈한남 카페 르상스,"안녕하세요 오늘도 남들하는거 다 하는 쪼쪼입니다 핫하디 핫한 한남동ㅎㅎ emis 한남 쇼핑하러 갔다가 날씨도 좋고 조금 여유를 느끼고 싶어서 사운즈한남 들려서 브런치 먹었음! 50m © NAVER Corp. 카페 르상스 사운즈한남점 서울특별시 용산구 대사관로 35 사운즈 한남 1층 서울특별시 용산구 대사관로 35 이태원역 3번 출구에서 773m 매일 10:00 - 22:00 라스트오더 21:30 주차, 발렛파킹, 포장 가능 EMIS 한남 바로 맞은편에 있는 사운즈한남 카페 르상스! 워낙 유명해서 사람도 많은 맛집 평일인데도 사람들이 많았다 햇살 받으며 야외에서 마시는 커피! 너무 좋아ㅎㅎㅎㅎ 한남동의 랜드마크가 사운즈한남인 이유가 있다니까!!!! 야외에서 먹을 수 있는 자리가 있는지 확인하고 주문하러 다시 들어갔다 사운즈한남 카페 르상스 재생 0 좋아요 0 00:00 00:12  사운즈한남 카페 르상스 맛있는 베이커리들과 음료를 팔고 있는데 와인도 팔고 있다!!!!!!!!꺄!! 황치즈 쿠키도 너무 맛있어보인다 소금빵 앙터버와 샌드위치도 인기가 정말 많아서 손님들 다 집어감ㅎㅎ 프랑스산 밀가루와 버터를 사용해서 풍미 장난아니고 일본식 베이커리 기법들을 활용해서 소금빵도 퀄리티 다르다 함! 베이커리만 파는 게 아니라 나같이 와인을 마시면서 브런치 즐기는 손님들을 위해 간단한 플래터들도 판매한다 나는 레드와인과 부라타무스 주문! 한남동 브런치는 와인이 빠질 수 없지 주문하고 밖으로 나왔더니 너무 힐링된다ㅠㅠㅠㅠ 날씨까지 완벽해! 테라스로 나오면 한남동 브런치 맛집인 분지로 카츠산도랑 같이 즐길 수 있음 다 이어지는 구조라서 취향껏 즐길 수 있다 운좋게 빨간색 테이블 한자리 남은 곳을 내가 앉을 수 있었다 멋진 샤넬 모델이 내려다보는 자리라서 이열ㅎㅎㅎ 좋아좋아 한남동스러운 느낌이야 꺄!!!!!!!!!!완벽한 브런치야 세상 맛있어보인다 간단하게 나올 줄 알았는데 하몽과 함께 비주얼 짱짱인데!??! 진짜 너무너무 맛있음!! 부라타무스 완전 부드럽고 세상 달콤함 토마토도 새콤달콤한게 치즈랑 너무 잘 어울렸고 레드와인이랑 찰떡궁합!! 외국같자나ㅠㅠㅠ 나 혼자 치얼스 하늘을 바라보면서 브런치 먹고있으니 시간가는 줄 몰랐다 그늘이 있어서 덥지도 않았고 살랑살랑 부는 바람이 정말 기분 좋았음 요즘 브런치를 먹으러 많이 다녔는데 한남동 브런치가 제일 좋았음!! 인기가 많은 사운즈한남인데도 바글바글 정신없는 느낌보다는 생기발랄한 느낌이 더 많이 나서 친구들끼리 한남동 브런치 와인즐기기 아주아주 추천함!! #한남동브런치 #사운즈한남카페 #사운즈한남르상스 #한남르상스 #한남동카페 #한남동와인 #한남와인 #한남동베이커리 #한남카페추천"
