title,content
한남동 카페 아우프글렛 한남 : 하겐다즈 팝업스토어 피스타치오 콜라보,"한남동 아우프글렛 한남 : 피스타치오 팝업스토어 아우프글렛 한남 서울특별시 용산구 이태원로54가길 20 1층 아우프글렛 한남 포장, 무선 인터넷, 배달 ✔️ 2023. 11 방문 기준 안녕하세요 여행 인플루언서 짱준 입니다😎 금일 소개할 포스팅은 블로그 초창기에 이미 포스팅했던 곳으로 이번에 마침 하겐다즈 신메뉴 피스타치오와 콜라보 한 팝업 겸 크로플의 원조이자 패션, 사진, 푸드, 인테리어 등 다양한 문화 요소를 접목해 새로운 가치를 만드는 브랜드 카페 '아우프글렛' 소개해 드릴까 합니다. 📍 한강진역 3번 출구에서 도보 6분 거리에 위치 🚘 주차 공간 없음 🕰️ 매일 12:00 ~ 21:00 건물 외관 한남동 팝업스토어 한남동을 나름 자주 오는 편이라 지리로 잘 알고 이미 와봤던 곳이지만 크리스마스 트리와 이번에 하겐다즈 신메뉴인 피스타치오 팝업 협업을 했다고 해서 들리게 했다. 나도 현재 카페에서 하겐다즈로 아이스크림을 두 가지 종류와 디저트 음료를 활용 중이라 시장조사 겸 모처럼 들렸는데 하겐다즈 모형의 오너먼트로 꾸며진 대형 트리들이 심플하면서도 임팩트 있는 인테리어와 어우러져 고급스러운 크리스마스 분위기를 연출하며, 카페 곳곳에는 원형 리스, 대형 제품 모형 등의 소품이 배치돼 연말 특유의 축제 분위기를 느낄 수 있었다. 매장 내부 1F 입구로 들어오자마자 앞에 신제품 '피스타치오 아이스크림'에 트리 컨셉을 더해 연말 분위기가 물씬 풍기는 이국적인 풍경의 팝업 공간을 구현했다. 한남동 아우프글렛 한남 팝업스토 하겐다즈는 이번 마이 리틀 ‘피스타치오 트리’ 콜라보 레이션 캠페인을 통해 최근 출시한 ‘피스타치오 아이 스크림'을 소비자들이 보다 색다르게 경험할 수 있게 꾸며놨다. 한남동 카페 아우프글렛 한남 : 팝업스토어 콜라보 재생 8 좋아요 0  접기/펴기 한남동 카페 아우프글렛 한남 : 팝업스토어 콜라보 3년 전에 방문했는데 아직도 심플하면서 블랙, 스테인리스, 유리, 거울, 이런 소재들을 활용한 집 같은 모던함이 아직도 한남동뿐만 아니라 최근에 7번째 성수점까지 포토그래퍼이자 아트 북 《나우보이즈》의 발행인이며 카페 아우프글렛의 공동대표인 몬 킴의 취향이 묻어 나오는 공간이다. 2F 2층에는 좀 더 좌석이 많고 특유의 인센스 향이 퍼져 나온다. 하겐다즈 역시 창립자의 '돈홀백 (Don't Hold Back - 주저하지 마)' 정신을 기반으로 신선한 조합에 아이스크림뿐만 아니라, 아트 전시 및 팝업스토어 등 다양한 소비자 캠페인을 펼쳐왔다. 이에, 새로운 도전을 주저하지 않는 두 브랜드가 함께 피스타치오 아이스크림을 재해석해 소비자들에게 제공하게 됐다. 검정색과 스테인리스 소재의 각각 다른 가구들이 놓여 있던 인테리어에 창가 쪽에 의자나 소파도 푹신하고 포근한 것보다는 딱딱하고 각이 잡혀서 자세를 바로잡고 앉을 수 있는 것, 커튼보다는 블라인드를 선호하는 직선적인 인테리어가 특징이다. 중앙에는 선반에 MD 상품과 콜라보 제품들이 놓여 있고 직선적인 느낌에 가지런히 놓여 있는 아우프글렛 대표 몬킴의 취향이 인테리어에 묻어 나오는 거 같았다. 공간 분리를 유리 볼록 파티섹션으로 두어 어두운 분위기에도 채광, 조명에 따라 환한 분위기를 조성했다. 거울에는 '하겐다즈 피스타치오 트리'로 된 포토존이 마련되어 있었다. Menu 메뉴는 이번에 콜라보 한 하겐다즈의 피스타치오를 활용한 5가지 종류로 파르페, 베로와상, 디저트 플레이팅 등 3종의 신메뉴와 아포가토, 크로플 등 2개의 기존 메뉴로 구성됐다. 메인 메뉴인 '피스타치오 파르페'는 초콜릿 스폰지 위에 '하겐다즈 피스타치오 아이스크림'이 다양한 토핑과 함께 얹어진 트리 모양의 디저트로 구현돼, 소비자 들이 마이 리틀 '피스타치오 트리'를 실제로 맛볼 수 있는 색다른 경험도 선사한다. 기존에 아우프글렛의 디저트들도 크로플만 아니라 각종 협업 콜라보를 통하여 독특한 디자인, 맛으로 MZ들의 성지뿐만 아니라 외국인들한테도 인기가 있는 곳이다. Order - PISTACHIO AFFOGAT0 6.5 원래는 파르페를 가장 먹어보고 싶었는데 주말에 다 재료들이 소진돼서 그런지 입고가 한시 넘어서 된다고 해서 그나마 아이스크림과 커피를 맛볼 수 있어서 아포가토로 주문하게 됐다. 워낙 하겐다즈 납품을 받아봐서 금액적인 부분이나 잘 아는 편이라 예상했던 거는 한 스쿱 정도 나올 줄 알았는데 두 스쿱으로 나와서 반은 그냥 아이스크림 본연의 맛을 느낄 수 있었다. 하겐다즈만의 깊고 진한 크림에 피스타치오의 본연의 고소함이 그대로 느껴지는 게 이런 유통 아이스크림에서 가능한지 신기했고 마치 갓 만든 젤라또를 먹는듯한 풍미가 전달됐다. 반 정도 남아서 샷과 함께 부어 먹으면 좀 더 고소하면서 커피의 풍미와 함께 밀도 높은 아포가토의 맛을 느낄 수 있었다. 팝업 기간 중 해당되는 디저트를 2개 이상 주문하면 기프트 세트를 받을 수 있고 현재 한남점, 성수점, 도산점, 잠실점에서 진행 중이니 겨울 시즌에 색다르게 즐기러 가기 좋았다. 세계 최고 아이스크림 함께하는 크리스마스 공간 '아우프글렛' 다방면에서 현재 콜라보를 진행하는 아우프글렛이 세계적인 아이스크림인 하겐다즈와 만나 겨울에 특별한 트리를 경험하고 한정판인 디저트 5종과 이벤트 굿즈 상품들을 만나 볼 수 있어 기존에 방문했더라도 새롭게 느낄 수 있던 곳으로 추천한다. 그럼 여기까지 한남동 팝업스토어 카페 '아우프글렛 한남점' 였습니다. AUFGLET(@aufglet) • Instagram 사진 및 동영상 팔로워 29K명, 팔로잉 3명, 게시물 1,619개 - AUFGLET(@aufglet)님의 Instagram 사진 및 동영상 보기 www.instagram.com [한남동/ 이태원역 카페] 미니멀한 감각에서 느끼는 버터의 찐한 크로플의 맛 ""아우프글렛 한남"" 아우프글렛 한남점 2021. 05월 방문 오늘 소개할 포스팅은 최근 몇 년간 꾸준히 인기 있는 원조이자 서울 3... blog.naver.com"
한남동 맛집 이태원 미트볼라운지 인생샷 건지기 좋은 한남동 카페 로우 커피 갔다가 아우프글렛 한남점 까지,"한남동 맛집 이태원 미트볼라운지 인생샷 건지기 좋은 한남동 카페 로우 커피 갔다가 아우프글렛 한남점 까지 안뇽하세용 어제 친구들을 정말 오랜만에 만났는데 이왕 만나는 거 한남동 맛집 카페 핫플 아주 제대로 조지고 왔습니다 그렇게 조져진 건 우리였다. 아무튼 점심 먹기 괜찮다고 해서 한남동 맛집 미트볼라운지 들렀다가 인생샷 건지기 위해서 로우커피 갔다가 번외로 아우프글렛 한남점 까지 찍고 왔어요 ㅋㅋㅋ 한남동 맛집 미트볼라운지 한남동 맛집 어디 가지 고민하면서 여러 곳을 추렸거든요 근데 휴무인 곳도 있고 2월 한 달 쉬어간다는 곳도 있어서 이래저래 고민하다가 전날에 네이버로 예약이 후딱 된다고 하길래 그럼 그냥 여기로 가자!! 해서 고른 한남동 맛집 입니다 ㅋㅋㅋ 12시 반에 예약을 했는데 일단 주말에는 사람이 점심시간에 좀 가득 차고 웨이팅도 있는 거 봐서는 미리 예약해서 가는 게 제일 좋은 것 같아요! 3명이라서 그런가 가장 넓은 테이블로 안내를 받았습니다 후후 미트볼라운지 한남본점이 있고 삼청점에는 아날로그 키친이랑 같이 콜라보?한 지점이 하나 더 있더라구용 다음에는 거기도 한번 가보는걸루 미트볼라운지 메뉴는 샐러드 파스타 라이스류 미트볼플래터 사이드 음료 이렇게 있어요! 3명이라서 한 접시씩 시켰는데 저희는 칼로리 양심상 샐러드 하나 시키고 제일 유명해 보이는 인기 메뉴로 주문했습니당 뭐든 인기 제일 많은 게 실패할 확률도 적고 맛있더라구욬ㅋㅋㅋ 아 제로콜라는 못 참지 치킨샐러드 / 13,000 요런 치킨샐러드 진짜 오랜만에 먹는 거 같아요! 바삭바삭하고 맛있었어용 뭔가 이렇게 리조또랑 막 튀기고 느끼하고 고칼로리 먹을 땐 그냥 양심상 풀떼기 가득한 샐러드는 꼭 시켜야 할 거 같고 콜라도 제로로 시켜야 하잖아요... 메뉴는 차례대로 비슷비슷하게 나와서 한 번에 사진 찍기 좋았음! 이거 중요하거든요 ㅋㅋㅋ 한남동 맛집 이태원 미트볼라운지_한남동 카페 로우 커피 재생 5 좋아요 1 00:00 00:20  접기/펴기 한남동 맛집 이태원 미트볼라운지_한남동 카페 로우 커피 미트볼 바질크림 리조또 / 21,000 미트볼라운지 한남점 미트볼 크림리조또는 소스가 두 가지라서 바질페스토랑 데미그라스 소스 둘 중 하나로 선택할 수 있어용 저희는 이게 제일 유명해 보이길래 바질페스토로 선택 미트볼 플래터 / 32,000 또 이런 거 안 시킬 수 없거든요! 뭔가 미트볼라운지의 시그니처 메뉴같기도 하고 일단 비주얼과 양에서 아 이건 진짜 꼭 시켜 먹어야 한다는 생각이 들어서 다들 만장일치로 일단 시킴 양도 넉넉했고 무엇보다 맛있었어요 사실 뭐 튀김은 신발을 튀겨도 맛있다는 명언이 있는데 이건 감자와 윙 어니언 링을 튀긴 건데 맛이 없을 리가 없음 저 소스들도 진짜 존맛탱 시작은 달콤하고 평범하게 채소에 끌려, 일단 첫입이니까 샐러드부터 조져봤습니다 그렇게 칼로리에 조져진 건 나였다. 다 괜찮았는데 실내가 사알짝 춥더라구요? 특히 완전 외부랑 딱 연결되어 있는 창가 쪽 좌석은 굉장히 추워보이셨... 우리는 조금 안쪽이라 그렇게 춥진 않았는데 그게 살짝 아쉽긴했어용 근데 이제 날 풀리면 상관없을 듯 ㅋㅋㅋ 위치는 여기! 50m © NAVER Corp. 미트볼라운지 한남본점 서울특별시 용산구 이태원로54길 36 예약 한남동 카페 로우커피 사실 이날 한남동 카페 어디 가지 고민하다가 가장 먼저 들린 곳이 다른 카페였는데 아니 실내에도 사람이 너어어어어무 많고 외부는 몇 자리 비어있긴 했는데 진짜 추웠거든요 이날 ㅠㅠ 아무튼 그래서 고민하다가 그러면 다른 핫플 가자!!해서 찾아온 곳이 한남동 카페 로우커피 ♡ 시그니처 메뉴들인데 너무 귀엽져 ㅋㅋㅋ 참 그리고 저 저번에 로우커피 갔을 때 크로플 먹어봤는데 여기 맛집이에요 존맛탱 넛츠화이트 크림초코라떼 이 둘이 시그니처 메뉴니까 이것도 드셔보세용 맛있음!! 사실 달고 고칼로리면 안맛있는건 없다라고 생각하는 편이긴 함. 인테리어가 정말 깔끔한데 센스돋는 키치한 소품들이 많아서 인생샷 셀피 건지기 너무 좋은 한남동 카페 되시궜습니다 여기 좌석도 너무 예쁘져 보통 두 명이서 앉긴 하는데 의자 하나 끌어와서 3인으로 앉기도 하더라구용 날이 더 풀리면 바깥에 저렇게 야외에 앉아서 커피 호로록 해도 사진 진짜 예쁘게 잘 나와요 플랫화이트 아메리카노 라떼 하나씩 ♡ 50m © NAVER Corp. 로우커피 서울특별시 용산구 이태원로54길 26 로우커피한남 예약 아우프글렛 한남점 사실 여긴 제가 친구들 기다리면서 다녀온 곳 인데요, 12시 오픈인데 제가 도착한 시간이 좀 애매하게도 11시 55분이라서 약간 기다리다가 들어갔어요 여길 주변으로 일단 외국인 관광객들이 정말 많았습니다! DONT ASK DONT THINK DONT GUESS 일단 아무 생각하지 말고 아우프글렛 으로 들어가보자고 한남동카페 아우프글렛 시그니처 케이크잖아요 요거요거! 사실 혼자 간 게 아니라면 정말 먹어보고 싶었는데 다음에 카페 들르거나 아니면 테이크아웃을 해서라도 이 케이크 무조건 꼭 먹어볼거에요 한남동 카페 아우프글렛 메뉴판! 요즘 워낙 커피값이 많이 올라서 다들 가격대가 후덜덜한데 사실 아우프글렛 기본 메뉴는 막 엄청 비싸나? 까진 아니고 그냥 쏘쏘였던듯 다음에 가면 아우프글렛 시그니처 케이크는 무조건 먹어볼거에요 오픈이 12시였는데 미리 대기하고 있던 손님들이 벌써 1팀이 계셨음! 근데 중국분들이셨던거 같아용 찐 핫플을 어떻게 알고 아침 일찍 온 건지 너무 신기함 어차피 시간 때우다가 밥 먹으러 가야 해서 시그니처 메뉴나 달달한 거보다는 그냥 아메리카노 완 샷 때렸습니다 아 맞다 저 여기 오픈 시간에 들어갔는데 찐핫플인만큼 앉자마자 완전 사람 가득찼어요... 근데 주말이라서 그런 것 같기도 50m © NAVER Corp. 아우프글렛 한남 서울특별시 용산구 이태원로54가길 20 1층 아우프글렛 한남점 위치는 요기! 다음에 또 핫플 뿌시면 내돈내산 후기 써볼게용 그럼 뿅 ♥"
한남동/이태원/한강진역 파스타&리조또 맛집 빠레뜨한남 본점(테이블링 웨이팅)+아우프글렛,"빠레뜨한남 본점 주소: 서울 용산구 이태원로54길 16-7 101호 영업시간: 화-금 11:30-20:30(라스트오더 20:00) 토,일 11:30-21:00 (라스트오더 20:30) 브레이크타임 16:00-17:00 매주 월요일 휴무 전화번호: 070-8873-5433 한강진역 공영주차장 이용 한남동 다녀온지 얼마 안돼서 다시 다녀왔던 날! 예..난포는 테이블링에 60팀이 넘기도 했고, 둘다 배고프고 힘이없는 상태였는데ㅋㅋㅋㅋㅋ 근처에 빠레뜨한남이 있었고,크림파스타도 먹고 싶어서 걸어왔다- 한동안 매우매우 핫했던 빠레뜨한남-! 엄청 여러 브랜드들이 매콤크림파스타랑 오믈렛을 비슷하게 만들어팔았던ㅋㅋㅋㅋ 본점이라 클줄 알았는데 되게 아담한 사이즈였다 앞쪽엔 주차가 되는줄 알았는데, 검색해보니 아닌듯! 근처 공영주차장을 이용하면 되는거같다 갬성 사진찍고 싶었는데 쓰레기봉투ㅠㅠㅋㅋㅋ 문이 되게 뻑뻑했는데 오는 사람들마다 문을 잘 못열었던ㅋㅋㅋㅋㅋㅋㅋㅋ 한남빠레뜨는 테이블링으로 앞에서 예약이 가능했다 7팀 정도 대기가 있었는데, 아무도 없고 우리만 매장 앞에 멀뚱멀뚱ㅋㅋㅋㅋㅋㅋ 테이블링 시스템이 번호가 뜬 후 몇분까지 용인?이 되는지 모르겠는데, 아무도 안오는데 웨이팅은 안줄어서 좀 답답했다.. 심지어 안에 몇테이블 비어 있는데.. ㅋㅋㅋㅋㅋㅋ 매장은 6테이블 정도 있다 Next image #빠레뜨한남메뉴판 배고파서 손떨렸음ㅋㅋㅋㅋ메뉴 3개시키려다가 크로플먹으러 갈거라 참고 2개만 시켰다 빠레뜨 파스타, 트러플버섯 우삼겹 리조또, 오렌지에이드를 시켰다 시원한 맥주 한잔이 먹고싶어서 주문했는데, 하이볼말고 안된대서.. ㅎ 못시켜서 아쉬웠음 먼저 나온 오렌지에이드-! 많이 달달한편! 제일 시그니처 메뉴인 빠레뜨 파스타! 우와아 보기에도 꾸덕해보여서 너무 맛있어보이자놔 트러플버섯 우삼겹 리조또도 향이 너무 좋았다! 옆테이블은 바질새우파스타를 먹던데 그것도 맛있어보이고, 다른 메뉴들도 맛있어보였음 메뉴가 같이 나와서 좋았다🥹 이런 매콤크림파스타는 비슷한데가 많았는데, 원조는 원조인가요~~ 꾸덕한게 너무 맛있었음!! 크림이 되게 꾸덕꾸덕!! 고소하고 진해서 너무 맛있었다 트러플버섯우삼겹리조또도 향이 되게 좋았고, 꾸덕하고 부드러웠음! 친구는 이 리조또가 너무 맛있었다고했다! 둘다 맛있었는데 저 크림파스타 너므 맛있었음..!! 담번에 다른메뉴도 추가해서 먹어보고 싶다- 에이드는 너무 달아서 그냥 탄산음료가 나을거같고- 메뉴 2가지는 모두 너무 맛있었다!! + 이쪽이 카페들이 일찍 닫아서, 어딜가지 하다가 바로 근처에 아우프글렛이 있어서 다녀왔다 예전에 다녀왔던 후기도 남겨야지- 한남동 아우프글렛, 드디어 먹어본 크로플!(+와인바) 아우프글렛 한남점 주소: 서울시 용산구 이태원로54가길 20 (한강진역 3번출구에서 403m) 영업시간: 카페 1... m.blog.naver.com 처음 먹었을때 너-무 맛있었던 기억에 친구도 맛보게하고 싶어서 방문했다 아우프글렛도 9시까지니까 참고하시길! 마지셔우드 팝업스토어도 하고 있었다 와.. 지금 글쓰다가 찾아봤는데, 저 키링자판기가 엄청 핫한듯ㅋㅋㅋㅋㅋ 라떼 두잔에 크로플하나를 시켰다! 예전에 쓴 글을 보니까, 커피는 500원, 크로플은 1,000원 올랐음! 처음에 뭔가 충격적으로 맛있었어서 그걸 기대했는데, 역시 그때만큼의 맛을 느끼진 못했다 배도 불러서인듯..! ㅋㅋㅋ 하지만 여전히 맛있었다 크로플은 바삭촉촉하구, 저 아이스크림이 되게 쫀득함 저 미니호보백 사고싶었눈뎅ㅋㅋ아 저 하얀게 키링임!! ㅋㅋㅋㅋㅋ 일찍 갔으면 좀더 구경했을듯- 20m © NAVER Corp. 빠레뜨한남 본점 서울특별시 용산구 이태원로54길 16-7 101호 아우프글렛 한남 서울특별시 용산구 이태원로54가길 20 1층 #빠레뜨한남본점 #한남동빠레뜨한남 #한남동빠레뜨한남메뉴추천 #한남동맛집추천 #한남동파스타맛집 #한남동카페 #한남동카페추천 #한남동아우프글렛 #한남동아우프글렛크로플 #한강진역맛집추천빠레뜨한남 #이태원맛집빠레뜨한남 #한강진역카페추천아우프글렛 #아우프글렛마지셔우드팝업"
[서울]이태원 한남동 카페 아우프글렛 한남 & 목련 맛집 콘하스 한남,"안녕하세요!모모입니다:) 벌써 4월이라니... 시간 진짜 빠르게 지나가는 것 같네요! 다들 지난주말에 벚꽃 구경 잘하셨나요? 오늘 저녁부터 비온다고 해서 이제 벚꽃은 다 떨어질것 같아요...ㅠㅠ 3월 말에 JW메리어트 동대문 호텔에서 결혼식 끝나고 다녀온 한남동 카페 아우프글렛 한남 & 콘하스 한남점 아우프글렛 한남 서울 용산구 이태원로54가길 20 1층 영업시간: 매일 12:00-21:00(라스트 오더 20:00) 070-8898-0699 -웨이팅 있음 -크로플 꼭 먹어야함!!! 봄 느낌 물씬 나는 주말이였어요! 가게 안에 있던 튤립! 노랑노랑 봄 느낌이예요! 남편이랑 한남동 오랜만에 갔는데 길거리에 목련도 이쁘게 피고 벚꽃도 막 피고 있더라구요! 지난주말에 벚꽃이 더 이뻤지만! 이때는 이렇게 얼마 안핀 벚꽃도 너무 이쁘더라구요 3월 말이라 목련이 엄청 만개했을때였어요! 정말 새우알칩같은 목련 50m © NAVER Corp. 콘하스 한남점 서울특별시 용산구 이태원로55나길 22 콘하스 한남점 원래는 목련 맛집인 콘하스 한남 가려고 했는데 진짜 주말이라 그런지... 사람 엄청 많아서 포기..... 여기 콘한스 한남 2층에 가서 목련 사진만 찍고 왔어요! 여기서 커피 마시고 싶은데.. 자리가 없는걸 어떡해.... 진짜 사람들 바글바글... 완전 시끄럽고...사진찍는 사람들 줄 서있고...😂 목련 맛집 콘하스 한남에서 제 사진도 살짝 찍어봤어요! 여기가 포토 스팟은 아니지만... 줄 기다릴 자신은 없어서 한장 찍고 나왓어요..ㅋㅋㅋㅋ 콘하스 한남 2층에서 1층 찍은 사진이예요! 사람이 많아서 바깥 자리는 이미 뭐 다 만석... 목련 구경하고 가세요!! 콘하스 한남에서 커피는 못먹었지만 목련꽃 구경 실컷 하고 왔어요! 가길 정말 잘한것 같아요🤍 다음번엔 갔다와서 꼭 다시 포스팅 하고 싶네요~~!!🫡 진짜 오늘 포스팅 하려고 했던 아우프글렛 한남!! 50m © NAVER Corp. 아우프글렛 한남 서울특별시 용산구 이태원로54가길 20 1층 몇년전에 크로플에 한참 빠졌을때 크로플 맛집으로 유명했던 아우프글렛 제가 예전에 갔을때는 금호동에밖에 없었는데 이제 여러군데 많이 생겼더라구요! 금호, 한남, 도산 여러 군데 생겨서 더 좋은것 같아요💗 1층에 웨이팅 적어주시는 직원분 계시는데 웨이팅 적고 앞에서 기다렸어요! 호명했을때 그 자리에 없으면 다음팀으로 넘어가요! 근데 생각보다 웨이팅 적어놓고 자리에 없는 팀이 많아서 15분 만에 저는 들어갔어요! 아우프글렛 한남 입구 블랙 화이트 느낌~~~ 빈 자리도 알려주세요! 저희는 2층 구석진 자리였는데 거울도 있어서 좋더라구요ㅋㅋㅋ 1층에 주문하는 곳입니다! 아우프글렛 한남 메뉴판이예요! 저는 얼그레이 밀그티 먹고 싶었는데 이 날은 품절이라...ㅠㅠㅠ 그냥 아포가토 시켰어요! 아이스 아메리카노(5.0) 아포가토(6.5) 크로플(10.0) 이렇게 주문 했답니다 주문하는곳 뒤편으로 보면 파는 디저트들이 전시되어있는데요 시그니처 쁘띠 케이크는 이미 sold out 크림브륄레, 티라미수, 까눌레 디저트 종류도 다양한것 같아요! 브라운 비스켓 이것도 sold out...ㅠㅠ 화이트 시그니처 케이크(42.0) 블랙 시그니처 케이크(42.0) 아우프글렛에서 케이크도 팔다니!! 한번 나중에 먹어보고 싶지만 가격이 좀 비싼것 같아.. 누가 사줬으면 좋겠네요..ㅋㅋㅋㅋ 1층입니다! 자리가 진짜 사람들로 꽉 찼어요! 한켠에 있던 조명 특이하고 이쁘네요👍🏻 2층 저희 자리예요! 구석에 있어서 아늑한 느낌이였어요! 겉옷 아무렇게나 벗어놓고 1층으로 주문하러 바로 갔다왔거든요...ㅋㅋㅋㅋ 저희가 주문한 크로플, 아포가토, 아메리카노~~~💗 간만에 먹는 아우프글렛 크로플이라 사실 좀 설렜어요! 마켓컬리에도 아우프글렛 크로플을 팔더라구요! 아이스크림이랑 같이 그것도 맛있긴 했지만 카페에서 바로 먹는맛같진 않더라구요...ㅠㅠㅠ 크로플(10.0) 그 뒤에 올라가져 있는 아이스크림까지 진짜 말해뭐해요...ㅜㅜㅜㅜ 크로플 엄청 바삭하고 아이스크림도..미쳤어요! 아우프글렛 가면 꼭 크로플 먹으셔야해요!!!!!!!!!!!!! 남편이 먹은 아이스 아메리카노(5.0) 제가 먹은 아포가토(6.5) 여기 있는 아이스크림이랑 똑같은게 크로플에도 올라가요! 남편은 왜 크로플 위에 아이스크림있는데 또 아포가토 시켰냐고 뭐라고 했지만 여기 아이스크림이 맛있는걸 어째!!! 메뉴판 보니까 아이스크림만도 따로 팔더라구요ㅋㅋㅋㅋ 먹기전에 사진 엄청 많이 찍었네요...ㅋㅋㅋㅋㅋ 오랜만에 먹는 크로플이라... 근데 크로플 진짜 넘 이쁘지 않나요? 맛은...정말..말해뭐해요...ㅠㅠㅠㅠ 사진 보니까 또 먹고싶네요..💗 서울 사시는 분들은 넘 부럽네요! 저는 마켓컬리에서나...시켜먹어야죠...뭐... [서울]이태원 한남동 카페 아우프글렛 한남 & 목련 맛집 콘하스 재생 5 좋아요 0  접기/펴기 [서울]이태원 한남동 카페 아우프글렛 한남 & 목련 맛집 콘하스 에스프레소 뿌리는 동영상 저는 근데 아이스크림이 너무 맛있어서 아이스크림 맛만 느끼고 싶었어요! 커피 뿌리니까 처음엔 약간 쓰더라구요...ㅠㅠㅠ 하지만 시간 지나고 아이스크림이 좀 녹으니까 달달해졌어요! 결혼식 갔다가 남편과 오랜만에 서울 데이트 그것도 한남동 데이트~~~💗 아우프글렛에서 크로플 먹으니 더욱 더 완벽해졌답니다!! 또 서울 데이트 하러 가고 싶네요🥹"
