title,content
신사 가로수길 신상 카페 히트커피로스터스 신사,"한남동에서 푸딩 진짜 맛있게 먹었던 히트커피로스터스가 신사에도 생겼다길래 다녀왔다 커피 맛집으로도 유명한데 나는 여기 푸딩이 그렇게 맛있더라! 위치 &영업시간 위치 서울 강남구 도산 대로 17길 34 1층 영업시간 평일 11:00 - 21:00 주말 12:00 - 21:00 라스트 오더 20:15 신사 가로수길에서 조금 안쪽으로 들어오면 있다 조금만 더 가면 마일스톤 커피까지 있어서 맛있는 커피가 생각날 때 오기 좋은 곳! 밖에도 작지만 7개의 1~2인 테이블이 있었다 50m © NAVER Corp. 히트커피 로스터스 신사 서울특별시 강남구 도산대로17길 34 1층 내부 분위기 공휴일이라 그런지 사람이 엄청 많았던 신사 가로수길 카페들 히트커피로스터스 역시 사람이 꽉꽉 차 있었다 사진에서 보이는 것처럼 바쪽 테이블도 있고 그 뒤쪽으로 10자리는 넘게 있어서 웬만하면 웨이팅 없이 이용할 수 있을 것 같다 단, 테이블은 좀 다닥다닥 붙어 있는 편 안쪽 자리는 생각보다 햇빛이 안 드는데 이쪽 자리는 햇살이 잘 들어왔다 테이블 3개 정도 있었고, 다음엔 여기 앉아봐야지 싶던! 메뉴판 메뉴는 한남점이랑 신사점이랑 똑같은 것 같다 여기 미숫가루 라떼도 있는데 저번에도 맛있게 먹어서 주문! 푸딩은 그냥 가면 무조건 주문해야 하고 ㅋㅋㅋㅋ 커피 외에도 티, 주스 등 음료 메뉴가 많아서 선택 폭도 넓음 플렛 화이트를 주문했더니 원두 선택이 가능했다 직원분께서 친절히 설명해 주시니 취향에 따라 선택하면 좋을 듯 난 15pm 플렛 화이트를 주문했다 푸딩 진짜 무조건 먹기... 히트커피 간거 스토리에 올리니까 친구한테 여기 다 맛있다곸ㅋㅋㅋㅋ 연락이 왔다 디저트에 진심인 친구가 추천하는 푸딩&파이 파이가 진짜 맛있게 생겨서 고민하다가 푸딩만 주문했는데 다음에는 파이도 꼭 먹어야겠다 주문을 하면 이렇게 번호표를 주시고 음료를 가져다주신다 우리는 야외에 자리가 마침 나서 바로 앉을 수 있었다 메뉴 후기 플렛 화이트 4.5 미숫가루라떼 6.5 커스터드 바닐라 푸딩 6.0 미숫가루는 우유에 탄 찐~한 미숫가루 맛! 위에 아이스크림이 있어서 미숫가루랑 같이 퍼먹으면 꿀맛 근데 이거 먹고 있으면 커피도 생각나니까 친구가 주문하면 뺏어 먹는 걸 추천 ㅋㅋ 플렛 화이트는 커피 맛집답게 고소하고 진했고 푸딩은... 진짜 부드럽게 쫀쫀한 게 너무 맛있었다 개인적으로 테라스는 한남점이 더 예뻤지만 신사에도 생겨주니 너무 좋았다 푸딩 먹고 싶을 때 또 가야지"
"[가로수길 카페] 히트커피 로스터스 신사 , 플랫화이트 맛집","히트커피 로스터스 신사 가로수길카페 커피 전문가 인친님이 알려주신 히트커피 로스터스, 커피 맛있으니 꼭 좋아하실꺼라며 알려주시는데 안 가볼수가 있나요?! 바로 가봅니다.. ㅋㅋㅋ 히트커피 로스터스는 천안점부터해서 한남동, 서교동 그리고 신사동 이렇게 지점들이 있었는데요, 이번에 처음알게 된 카페인데, 이렇게 지점들이 많은 줄 몰랐어요. 많은 지점들 중 저는 가로수길 바로 옆길에 위치해 있는 히트커피로스터스신사에 가봤어요. 히트커피 로스터스 신사 서울특별시 강남구 도산대로17길 34 1층 겉외관부터 새하안 인테리어가 이국적이고 맘에 들었는데, 안으로 들어가보니, 더더더 이쁘더라고요?! 오마이갓! 블랙과 화이트의 조화로운 인테리어가 너무나 제 취향인 히트커피로스터스신사 카페 한쪽에는 테라스자리도 마련되어 있었는데요, 요즘 날씨에만 즐길 수 있는 테라스! 날씨가 더 추워지기전에 테라스에 자리를 맡아봅니다. 히트커피로스터스신사는 이렇게 반층 아래 위치해있는데도 창문이 많아서 인지 빛이 너무 환하게 잘 들어오는 카페였어요. 그리고 또 한켠에는 단을 높여서 만든 좌석도 있었어요. 단차를 두고 만들어서인지, 공간이 더 독특해보였어요. 1~2인용 테이블이 놓여져 있는 테라스자리. 주문했던 플랫화이트가 나오고, 눈에서부터 이미 보이는 진한 맛에 유레카! ♥ 찾았다 플랫화이트 맛집! 이날의 첫 커피를 맛있는 커피로 시작하니, 너무 행복했답니다. 맛있는 커피에 인테리어까지도 즐길 수 있는 곳이라 더더욱 맘에 들었어요. 맛있는 커피 마시고 나가는 길, 직장인들의 점심시간이 되니 삼삼오오 모여드는 손님들로 점점 북적이기 시작하더라구요. 인친님 정보로 알게된 곳이지만, 커피맛집을 알게되어서 기쁘네요. 신사동 가시면 꼭 들려보세요. #신사동카페 #히트커피로스터스신사 #히트커피로스터스 #플랫화이트맛집 #가로수길카페 #히트커피로스터스가로수길 #가로수길카페추천 #플랫화이트"
"히트커피로스터스, 스페셜티 커피가 맛있는 한남동카페","안녕하세요. 골드레인이에요. 한남동, 한강진, 이태원 데이트하러 왔다가 카페 가려고 찾아보면 막상 맛있는 카페 찾기가 쉽지 않은데요. 규모도 크면서 스페셜티 커피가 맛있는 카페 추천해드릴게요 : ) 한남동카페 한강진카페 이태원카페 히트커피로스터스 히트커피로스터스한남 1. 히트커피로스터스 한남 @출처 - 히트커피로스터스 공식 인스타그램 히트커피로스터스는 천안에 본점과 로스터리를 두고 있는 커피를 좋아하는 사람들에게는 이미 잘 알려져 있는 카페에요. 원두납품도 직접하는 곳이고 한남점 뿐만아니라 서교와 신사에도 지점들이 있어요 : ) 히트커피로스터스 한남 서울 용산구 이태원로 258 매일 12:00 - 21:00 라스트오더 20:00 인스타그램을 통해 영업시간은 공지하고 있다고 하니 방문 전에는 꼭 인스타그램 확인!! 해보고 가셔요 : ) 50m © NAVER Corp. 히트커피로스터스 한남 서울특별시 용산구 이태원로 258 건물 뒤편 테라스 1층 한남동카페 히트커피로스터스 한남 위치는 한강진역에 내려서 마세라티 골목 지나서 나오는 골목 따라 내려 온 뒤 우회전 하시면 있어요. 테라스 있는 카페를 찾으실 수 있을거에요~ 2. 외관 및 인테리어 한남동카페 히트커피로스터스입니다! 블랙 어닝이 있는 테라스가 가장 먼저 눈에 들어오는데요 : ) 날씨가 좋을 때는 여기에 앉아서 여유롭게 커피 한잔 하기 좋겠더라구요!! 제가 방문했을때는 완전 더운 여름이어서 테라스에는 사람이 한명도 없었어요. 한남동카페 히트커피로스터스! 제가 방문했을 때는 평일 점심 시간 살짝 지난 시간대였는데요. 주변의 직장인분들인건지 사람이 굉장히 많아서 자리 겨우 잡았어요. 근데 2-3시? 넘어가니깐 사람들이 싸악 빠져서 자리 많더라구요! 혹시나 여유롭게 커피를 즐기고 싶다면 2시 이후에 방문하시는 것이 좋을 것 같아요. 3. 메뉴 @출처 - 네이버 @출처 - 네이버 히트커피로스터스의 메뉴에요. 콜드빙하가 시그니처 메뉴라고 해요. 미숫가루라떼, 코코넛라떼 등 다양한 히트커피만의 메뉴들이 준비되어 있었어요. 매장 한켠에는 원두에 대한 소개와 시향할 수 있는 원두가 준비되어 있었는데요. 필터커피의 라인업은 수시로 바뀐다고 하니, 커피를 좋아하는 분들이 왜 많이 찾는 카페인지 알 것 같았어요 ㅎㅎ 커피 메뉴 외에 푸딩, 케이크 등의 디저트 메뉴도 있었습니다. 식후에 간단하게 커피와 디저트 함께 즐기기 좋을 것 같아요. 특히 치즈 테린느가 맛있다고 하더라구요. 저는 남편이랑 필터커피 두잔 시켜서 마셨는데 사진이 없네요 ㅠㅠ 커피 맛은 만족이었습니다. 4. 요약 한남동카페 히트커피로스터스 한남동에서 스페셜티커피 맛있는 찐커피맛집을 찾고 계신다면 꼭 한번쯤은 방문해보아야할 카페라고 생각해요. 꼭 가서 시그니처 메뉴나 필터커피 드셔보시길 추천드립니다. *공감,댓글,서이추는 힘이 됩니다 :) *본 포스팅은 내돈내산, 솔직후기 입니다 #히트커피로스터스 #히트커피로스터스한남 #한남동카페 #한강진카페 #이태원카페 #한남동데이트 #한강진데이트 #이태원데이트"
서울 한남동 카페 히트커피로스터스 한남(HIT COFFEE ROASTERS),"서울 한남동 카페 히트커피로스터스 한남 HIT COFFEE ROASTERS 롭스인사이드 지난 주말 한남동에서 친구를 만나기로 했는데 친구가 조금 늦게 도착한다고 해서 잠시 머물 근처 카페를 검색하다 마음에 드는 곳을 발견했어요! 카페 러버 롭스 마음을 사로잡은 곳은 바로 서울 한남동 카페 히트커피로스터스 한남 🫶🏼 지금부터 히트커피 한남 방문기 시작해 봅니당 =3 HIT COFFEE ROASTERS 히트커피로스터스 한남 ☑️ 매일 12:00-21:00 𝑯𝑰𝑻𝑪𝑶𝑭𝑭𝑬𝑬 𝑹𝑶𝑨𝑺𝑻𝑬𝑹𝑺(@hitcoffee_official) • Instagram 사진 및 동영상 팔로워 3,770명, 팔로잉 626명, 게시물 1,685개 - 𝑯𝑰𝑻𝑪𝑶𝑭𝑭𝑬𝑬 𝑹𝑶𝑨𝑺𝑻𝑬𝑹𝑺(@hitcoffee_official)님의 Instagram 사진 및 동영상 보기 www.instagram.com 살짝 헤매다 도착한 한남동 히트커피로스터스. 도착하자마자 분위기가 너어무 좋아 감탄했어요! 위쪽 큰 도로에서 폭스바겐 건물이 보일 때 내리막길로 내려와 뒤쪽 골목으로 조금만 걸어 내려오면 오른쪽에 보여요-! 한강진역 3번 출구에서 얼마 안 걸린답니다~ 테라스 좌석부터 갬성 있어 버리긔..💫 날이 생각보다는(?) 안 추워서 밖에 잠깐이라도 앉아 있고 싶었는데 혼자라 그냥 내부 테이블로 자리를 잡았답니다...? (너무 아쉬웠던,, 🥲😭) 외관부터 감탄하고는 이제 안으로 들어가 볼게요. 스페셜티 전문 로스터리 카페라는 히트커피로스터스는 전국에 매장이 세 곳(천안/서울 서교/서울 한남)이 있더라고요? 다음에 가까운 천안에 갈 일이 있으면 히트커피로스터스에 들려 봐도 좋을 듯하네요. 저는 빈속이라서 고민하다 넛츠크림라떼를 주문했어요. 먹음직스러운 디저트도 있는데 곧 친구가 오면 점심을 먹으러 가야 해서 아쉽지만 패스ㅠ Next image 여러 원두 종류와 컵, 드립백도 판매 중이더라고요. 종류가 다양하지는 않지만 잠깐 구경하는 재미. 저는 이 2인 테이블에 자리를 잡았어요~ 정말 무거웠던 짐.. 너란 백팩...🎒🥵 하긴 주인이 롭스니 단벌 신사 도전은 이번에도 실패입니닷,, 🤦🏻‍♀️ 히트커피로스터스 한남 직원 분들은 하나같이 친절하시고 내부 분위기도 괜찮았답니다. 혼자 방문하기에도 부담 없는 곳. 서울 한남 혼카페로도 추천해요 :> 화장실도 관리가 잘 되어 말끔하고 바깥쪽 세면대가 저렇게 특이했어요! 여자 화장실 내부에도 세면대가 있는데 밖에도 따로 있어 편리했네요 ㅎㅎㅎ •넛츠크림라떼 :: 6.0 섞지 않고 있는 그대로 마시면 되는 메뉴. 처음 딱 맛봤는데 '와 진짜 맛있다' 라고 느낌. 그런데 다시 또 마시면서 느낀 점은 두유맛? 오트밀밀크?(오트밀밀크 맛 사실 제대로 모름) 혹은 미숫가루 맛도 느껴지는 거 있죠? (메뉴판 보면 미숫가루 라떼는 따로 있던데 음..) 그래서 고소하긴 했으나 계속 마시는데 텁텁하고 느끼한 부분도 있더라고요~? 🤔 그리고 크림을 먹으려는데 자꾸 그 밑에 숨어 있던 미숫가루(?)가 나와서 목이 막히는 느낌 ㅠ 티코스터도 히트커피로스터스 로고가 새겨진 튼튼한 가죽 재질이더라고요. 이런 아이템은 그곳만의 개성이 느껴지고 뻔하지 않아 좋은 것 같아요 ☺️ 빈속에 마시는데도 부담 없던 히트커피로스터스 넛츠크림라떼. 고소하니 많이 달지 않은 커피 한 잔 마시고 나서 아점 먹으러 갔는데 맛있게 잘 먹었답니다 ㅎ_ㅎ 테라스 분위기부터 넘나 롭스 스타일이었던 곳, 틈내서 잠깐 들른 서울 한남동 카페 히트커피로스터스 한남 방문기였습니다-! 50m © NAVER Corp. 히트커피로스터스 한남 서울특별시 용산구 이태원로 258 건물 뒤편 테라스 1층"
[서울/한남] 히트커피로스터스 ; 한남동카페추천,"한남동 자체를 자주 가진 않는데, 가끔 블루스퀘어로 공연 보러 갈 때 가는 정도? 이날도 공연 관람후 저녁먹으러 가던길에 요 카페를 보고 눈여겨뒀던터라 한번 가보기로. 신상 카페인건가? 했는데, 생각보다 년도가 예전이어서 원래 있었던가? 의아해하며 일단 입장. 검색을 해봤더니 천안이 본점이고 서울에는 서교, 한남 이렇게 두 매장이 있었다. 테라스 좌석이 꽤 있었는데, 애견 동반 고객들이 상당히 자리하고 있었다. 한남동에 가면 주로 스타벅스 리저브 한남을 많이 갔었는데, 새로운 한남동카페 추천!! 스페셜티 전문 로스터리 카페라고 되어 있었는데, 원두 원산지별로 다양한 필터 커피를 주문할 수가 있었다. 난 카페에 가면 그 카페의 시그니처 커피를 많이 주문하는 편이라서.... 고민끝에 콜드빙하를 선택했고, 일행은 코코넛라떼를 주문했다. Non-coffee 메뉴도 쥬스나 티 종류도 준비되어 있으니 참고하시길. 원두가 2종류가 있어서 선택 가능했던 것 같다. 필터커피로 주문 가능한 다양한 원두 시향이 가능했고, 그 뒤에 커피 추출하는 곳이 셋팅되어 있었음. 그라인더, 포트 등이 전부 블랙이라서 뭔가 통일감도 있었다. 뒤쪽에는 히트커피로스터스에서 판매하는 굿즈들과 원두, 드립백도 구매가 가능했다. 바 안쪽 공간이 굉장히 널찍했고, 저 안쪽에 선반에 다양한 글라스, 머그 등이 놓여져 있었음. 매장안이 조금 삭막할뻔 했는데, 테이블위에 화병이 뭔가 분위기를 화사하게 해주는 것 같은 느낌? 벽쪽 좌석에 앉아서 안쪽 공간을 바라본 사진. 바깥쪽은 전부 다 테라스 좌석! 주문한 메뉴 등장. 융(?) 코스터가 왠지 모르게 시선 강탈이네. 코코넛 라떼는 HOT / ICE 가능한데 아이스로 주문. 코코넛라떼 6.0 ; 코코넛라떼 + 바닐라 아이스크림 - 코코넛맛이 진하게 느껴지는 라떼에 바닐라 아이스크림 보기보다 꽤 크게 들어가 있었다. 아이스크림까지 맛이 조화롭게 잘 이루어졌고, 코코넛을 좋아한다면 꼭 한번 마셔보기를 추천! 콜드빙하 6.0 : 직접 내린 콜드브루와 수제크림의 조화. - 콜드빙하라는 이름이 생소해서 어떤 메뉴인지 물어봤었는데, 콜드브루 라떼 + 크림이 올라간 메뉴라서 약간 아인슈페너같은 느낌의 음료라고 생각하면 될 듯. 두 가지의 커피가 다 나쁘지 않아서, 필터커피를 마셔보고 싶었는데 영업시간 제한 + 저녁 시간이었던 탓으로... 다음기회로 미루기로 하였다. 언젠가 다시 가볼 수 있겠지... 그런 의미에서 빨리 블루스퀘어 공연 다시 예매를 ㅋㅋㅋㅋㅋㅋㅋㅋ 50m © NAVER Corp. 히트커피로스터스 한남 서울특별시 용산구 이태원로 258 건물 뒤편 테라스 1층 한강진역 3번 출구로 나오면 도보 5분 이내로 도착 가능할 듯 . # 영업시간 매일 10:00 ~ 21:00 https://www.instagram.com/hitcoffee_official 𝑯𝑰𝑻𝑪𝑶𝑭𝑭𝑬𝑬 𝑹𝑶𝑨𝑺𝑻𝑬𝑹𝑺(@hitcoffee_official) • Instagram 사진 및 동영상 팔로워 3,754명, 팔로잉 626명, 게시물 1,683개 - 𝑯𝑰𝑻𝑪𝑶𝑭𝑭𝑬𝑬 𝑹𝑶𝑨𝑺𝑻𝑬𝑹𝑺(@hitcoffee_official)님의 Instagram 사진 및 동영상 보기 www.instagram.com 영업시간은 인스타그램에 따로 공지도 되긴 하는듯 하다. 스마트 스토어도 따로 있어서 원두 구매는 인터넷으로 가능!"
신사 가로수길 카페 히트커피로스터스 - 커피와 푸딩,"천안에서 시작해 서교, 한남을 거쳐 신사까지 진출한 신사 가로수길 카페 히트커피로스터스. 신경써서 엄선한 고퀄리티의 커피와 달달한 수제 푸딩, 파이가 있어 신사동에서 맛있는 커피 마시고 싶을 때 들르기 참 좋은 곳이다. 가로수길 메인 스트릿에서 한 블럭 정도 들어간 길에 위치해 있는데 길이 모이는 가운데에 위치해 있어 접근성이 꽤나 좋은 편이다. 야외자리도 귀여운데 추워서 이제 못 앉... 하이얀 외관에 하얀 차양이 귀여운 곳. 반지하라서 좀 답답하지 않을까 싶었는데, 그럴 걱정은 하지 않아도 되는 쾌적한 카페였다. 문을 열면 이런 모습이 보이는데요. 미국 여행가서 볼 법한 갬성 듬뿍 녹아든 내부 인테리어가 사랑이었다. 신사 가로수길 카페에는 바 자리도 있어서 혼커하기에도 안성맞춤임 다른 분들의 블로그 후기를 보고서는 저 안쪽이 테라스인 줄 알았는데 오잉 그냥 유리로 분리된 실내 공간이었다. 조용하게 대화 나누기 좋을 정도의 테이블 사이즈였는데 난방 때문인지 내가 갔을 때에는 개방해 두신 것 같진 않았다. 제일 마음에 들었던 곳. 벽 쪽에 높다란 미니 테이블이 있었는데, 그 위에 붙은 각양각색의 액자와 포스터가 또 매력있다. 신사 가로수길 카페 메뉴 및 가격은 이렇ㄱ. 필터 커피는 매번 라인업이 달라지는지 직원분께 문의하면 친절하게 안내해 주시고, 대표 메뉴로는 콜드빙하, 넛츠크림 라떼 등이 있다. 블랙, 화이트 기본 커피도 당연히 갖춰져 있으니 어떤 취향을 가졌어도 하나는 걸릴 느낌이다. 필터 커피 원두는 한 쪽에서 시향도 가능하다. 가격은 아마 원두마다 차이가 있을 것 같고 - 각각 커핑노트가 적혀 있어 선택이 어려울 때 참고해볼 수 있음. 디저트도 빠질 수 없지. 맛있는 커피와 곁들이기 좋은 달다구리로는 미니미한 사이즈의 가벼운 파이와 탱글한 커스터드 푸딩이 있다. 파이는 직접 만드시는지 생지인지 모르겠네 이 날 내가 주문한 건 이렇게. 깔끔한 아메리카노와 커스터드 바닐라 푸딩이다. 아메리카노는 원두 선택이 가능해서 산미있는 것과 고소한 것 중 산미있는 걸 골랐다. 가격은 4,500원 탱글탱글 비쥬얼부터 귀여운 커스터드 바닐라 푸딩. 미리 소분해 두신 듯 저 플라스틱 케이크 받침이 조금 많이 아쉽긴 했는데 - 탱글탱글해 보이는 비쥬얼과 촉촉한 시럽, 앙증맞은 타임까지 올라간 푸딩 자체의 비쥬얼은 나쁘지 않았다. 커스터드 푸딩 맛집 재생 4 좋아요 0  접기/펴기 히트커피 바닐라빈 커스터드 푸딩 바닐라빈이 듬뿍 들어간 커스터드 푸딩. 이런 건 역시 탱탱함을 느껴줘야지. 푸딩 파는 곳이 많지 않은데다 원래 잘 사먹는 편도 아니라 냉큼 영상도 찍어봤다. 겉은 탱탱 속은 후들후들 촉촉한 푸딩은 씹을 것도 없이 사르르 녹아내린다. 근데 달아도 너어어어무 달아서 깜놀! 커피 없인 절대 못 먹을 듯한 당도였고 개인적으로는 커피 맛을 가리는 느낌이라 좀 아쉬웠다. 그치만 비린내도 안나고 진한 바닐라향 뿜뿜은 그뤠잇 단 거 아주 잘 드시는 분들은 좋아하실 것 같슴다 푸딩 먹고 놀란 가슴 커피로 치유. 이거는 에스프레소 15PM으로 주문했는데 꽤 가벼우면서 화사해 산뜻하게 마시기 좋았다. 아이스가 더 잘 어울릴 것도 같았는데 넘 추워서,, 따수운 걸로 만족함 역시 여긴 커피 맛집이었어 간만에 푹 쉬었던 휴무일. 신사 가로수길 카페에서 여유로운 커피타임. 근데 금세 만석이 돼버려서;; 역시 신사동 핫플은 다르구나를 실감했다. 여튼 맛있는 커피와 감성적인 분위기가 있는 히트커피로스터스 신사. 가로수길 나들이 가시는 분들 메모해두셔요 :) 50m © NAVER Corp. 히트커피 로스터스 신사 서울특별시 강남구 도산대로17길 34 1층 서울특별시 강남구 도산대로17길 34 평일 오전 11시 - 밤 9시 주말 12시 - 밤 9시 (8시 15분 라스트오더) 연중 무휴 주차는 인근 공영주차장에 가능해요."
가로수길 카페 | <히트 커피 로스터스 신사>,"히트커피 로스터스 신사 서울특별시 강남구 도산대로17길 34 1층 신사 가로수길에 일이 있어 갔던 날 오랜만에 간 가로수길이니 만큼 커피가 아주 맛있는 곳에서 책도 조금 읽고 갈까 해서 찾아낸 <히트 커피 로스터스 신사> 천안에 본점이 있는 로스터리 카페라고 한다. 서울은 서교와 한남점에 이어 신사점도 새로 생긴것이라고. 예전엔 지방에서 친구가 오면 쇼핑도, 핫플도 모두 데려갈 수 있어 꼭 데려왔던 가로수길 이제 많은 스토어들이 폐점하고 조금은 한산한 느낌이 생겨서 당황했는데 그럴수록 오히려 가로수길 구석구석 가치있고, 또 찾아오고 싶은 가게들이 뿌리깊게 들어서고 있다는 생각이 든다. 가로수길 감성카페 히트커피 로스터스 신사점 내부로 들어오니 평일임에도 사람들로 북적였다 겨우 난 자리로 앉음 야외석 자리는 비어있었는데 워낙 추워서 초겨울 날씨에 앉기는 힘들었다. 사람이 많아 내부 사진은 찍지 못함 ㅠㅠ 가로수길카페 히트커피로스터스 메뉴와 가격 필터커피를 마실까 고민하다가 오늘은 쫀득하게 내린 머신커피가 먹고싶군,,하여 따뜻한 아메리카노(4.5)를 주문했다. 늘 일본에서 먹었던 커스터드푸딩을 먹고 싶었는데 히트커피로스터스 에서도 커스터드 바닐라 푸딩(6.0)을 판매하고 있어 반가운 마음으로 주문했다. 아메리카노 원두도 두 종류가 있어 고를 수 있었는데 찍진 못했지만 더 산미있는 타입으로 선택했다. 가로수길 커피맛집 히트 커피 로스터스 신사점 필터커피 원두리스트 취향껏 추천받아 선택하면 될듯! 책을 읽고 있으니 히트커피로스터스 메뉴가 나왔다. 정성껏 준비하시는 것 같기도 하고, 사람도 많아서 주문하고 나서 시간이 조금 걸려 나온편! 이미 크레마부터 나의 마음을 흔든 히트커피로스터리 따메리 독감 이후로 미각을 조금 잃어서 커피 마시는 재미를 약간 잃은 상태였는데 그래도 감각을 조금씩 돌려주는듯한 향과 맛이었다. 신사동카페 히트커피로스터스 커피를 담아주는 머그컵도 귀염귀염 컵엔 그만 일하라고 써있는데 히트커피 로스터스 신사점에는 노트북을 들고 일하는 분들도 많았다 ㅋㅋㅋ 사실 히트커피로스터스는 플랫화이트 맛집이라 플랫화이트를 주문하면 감성있는 우드트레이에 라떼아트도 얹은 예쁜 커피를 내어주시는 것 같다. 이것을 나중에 알아버려서 다음엔 꼭 플랫화이트를 먹어야지 다짐,, 하지만 아메리카노 맛도 굿굿이었다는 점! 접시도 비주얼도 너무 예쁜 커스터드 바닐라 푸딩 수제바닐라빈, 캐러멜시럽, 동물성생크림 등으로 만들었다고 한다. 일본에서 먹었던 그 부드러운 푸딩맛에서 뭔가 약간 부족한 느낌이었지만 무언가와 비교하지 않는다고 생각하면 그 자체로는 매우 맛있는 커스터드푸딩이었다. 커피를 좋아하는 사람들과 다시 오고 싶은 가로수길 커피 맛있는 카페 히트커피로스터스 신사점 이었다:) #내돈내산"
