title,content
[한남동] 난포 / 아우프글렛,난포 (한남점) 요즘 핫하다는? #퓨전한식 난포에 다녀왔어요. 성수점은 웨이팅이 있다는 말을 듣고 한남점으로 꼬우 친구와 다섯시 반쯤? 도착했는데 다행히 웨이팅 없이 착석! 모든 메뉴를 다 맛보고 싶었지만 입은 두개니.. 세개만 시키자ㅎㅎㅎㅎㅎ #강된장쌈밥 #제철회묵은지말이 #제철회국수 감자전은 다 식어서 나온다는 후기를 보고... 패스 했어요. 담금주?도 크고 신기하니까 차칵 강된장 쌈밥은 짜지 않고 심심하니 맛있더라구요. 자극적이지 않고 정말 한식다운 너낌! 제철회 묵은지말이도 맛있었어요. 회와 묵은지를 같이 먹은건 처음이었는데 회가 쫀득하니 묵은지랑 먹으니까 짱맛! 다음은 들깨국수와 고민하다가 선택한 제철회국수! 매콤달콤 요것도 맛있었어요! 저는 맵찔이라 저한테는 조금 매웠지만 무난무난!! 담범엔 다른 메뉴도 먹어봐야겠어요. 아우푸글렛 여러분 저 이번에 크로플맛집 갱신했어요! 항상 새들러하우스에서 크로플 포장했었는데 말이에요. 이번에 아우푸글렛을 먹어보고는 정말 인생 크로플이다 정했지효 아우푸글렛 가신다면 꼭꼭 크로플도 드셔보세요. 빵이 일단 쫄깃하고 심지어 위에 올라가는 아이스크림까지 쫀득하답니다! 아이스크림 어디껀지 물어보고 싶었는데.. 부끄럼쟁이라 궁금증을 안고 나왔어요 ㅎㅎㅎㅎㅎ 여긴 정말 재방문 백퍼!!!! 30m © NAVER Corp. 아우프글렛 서울특별시 용산구 이태원로54가길 20 난포 한남 서울특별시 용산구 이태원로49길 18 B1. 1F 예약
"한남동 분위기 좋은 내추럴 와인바 : 모르클 / 카페 , 크로플 맛집 : 아우프글렛","안녕하세요 오늘도 즐거운 하루입니다 ･ᴗ･ . . 요새 코로나 거리두기 제한이 많이 풀리면서 많은 분들이 불금을 보내기도 하고 예전처럼 다시 늦은 시간까지 술집이나 와인바를 즐기죠, 제가 한참 한남동의 매력에 빠져있었을 때는 약속 장소마다 항상 한남동이여서 한남동에 유명하다고 하는 맛집, 카페, 와인바를 자주 이용했던 것 같아요. 하지만 한남동에는 워낙에 맛있는 맛집도 많고 술집, 와인바도 좋은 곳이 너무 많아서 딱 이곳이 제일 좋다 이렇다고할 수는 없지만, 이용하고서 엄청 만족했던 곳을 소개해드리려고해요 모르클 Morcle 한남동 내추럴 와인바 와인바 주소 | 서울 용산구 이태원로 208 영업시간 | 17:00 - 24:00 매주 월요일 휴무 지도로 봤을 때는 위치가 큰 대로변에 있어서 금방 찾을 줄 알았는데 계단을 오르다가 중간에 오른쪽 편에 들어가야 와인바가 나오더라구요 1층에 있는 줄알고 1층만 보시지 마시고 무엇보다 큰 계단이 나오는 곳을 보면 될 것 같아요 한남동에 온 김에 분위기 낼겸 와인을 먹어야된다는 생각이 강해서 사실 안주보다는 와인을 위주로 찾았는데, 알고보니 이곳이 와인도 와인이지만 음식들이 진짜 너무 맛있었어요 와인바 안으로 들어왔는데 공간 자체는 크지않고 조그마한 공간에, 인테리어가 잘되어 있고 살짝 어두운 조명으로 분위기가 엄청 좋았어요 딱 와인 먹고 취하기 좋은 공간이랄까..?ㅎ 중간 자리가 가장 큰 테이블이여서 단체 손님들로 예약 받거나 하는 것 같았어요 저희가 방문할 떄도 그 자리에는 한 8명 정도 되는 손님들이 서로 마주앉아서 와인을 즐기고 있더라구요 창밖을 보고 나란히 앉아 먹을 수 있는 테이블이 있었고 와인바 안에 중간에 가장 큰 테이블을 놨는데 여러 꽃들로 테이블을 가득 채웠었고 다 사용한 와인병들로 화병을 만들어 꽃들이 꽂혀져 있었어요 하지만 또 포토존은 잊지 않았죠 요새는 포토존이 없으면 장사가 안될 정도로 이런 공간 쯤은 하나 다 있는 것 같아요 이 거울을 보니 여자손님들이 이곳을 절대 못 지나치겠다 생각했어요 하지만, 저도 여자손님이였죠..? 그래서 못지나쳤답니다 ´▽` 빼꼼 와인바 자체가 큰 곳은 아니기 때문에 프라이빗한 공간은 없었고 오픈형 공간이었고 조금 조용하게 와인을 즐기고 싶은 사람들은 사이드에 있는 테이블을 이용하면 될 것 같아요 테이블에 자리를 잡고 음식을 시키고나면 저희에게 와인이 진열되어 있는 곳으로 안내를 해주어 와인에 대한 설명을 해줘요 모르클 와인바의 와인 진열장 와인바답게 와인이 한눈에 볼 수 있게 진열되어 있는데 입구 쪽에 진열되어 있어서 들어오면서도 시선을 강탈했던 곳이에요 와인병의 컬러들도 무겁지 않고 컬러풀하게 진열되어 있는게 너무 귀여운 진열장인것 같아요 보통 와인바에 진열되어 잇는 와인들은 어두운 조명과 무거운 분위기의 고급스러운 와인들이 진열되어 있는 걸 많이 봤었는데, 모르클에 있는 와인들은 컬러들이 여자들이 좋아할만한 컬러풀하고 예쁜 색상의 와인병들이 많아서 차분해지기보다는 오히려 텐션이 업되서 좋았던 것 같아요 화이트, 레드 그리고 드라이, 스위트한 맛 종류별로 설명을 해주시는데 저희는 레드지만 스위트한 맛이 있는 와인으로 선택했어요 와인은 대체적으로 가격대가 나가는 편. 와인 1병에 전부 7만원 이상은 되는 것 같아요 와인에 가격이 적혀져 있지 않아서 그냥 무작정 선택했다가는 나중에 계산할 때 놀랄 수 있어요 직접 와인을 오픈하여 각자 와인잔에 따라 놓으니 진한 컬러의 레드 와인이 아닌 약간 프레쉬한 컬러의 레드 와인이더라구요 무겁지 않고 가벼운 느낌의 달달함이 있는 와인이라 와인을 부담스러워할 수 있는 사람들한테는 딱 괜찮을 것 같은 맛이엿어요 친구들과 짠하고 한잔 두잔 하다보니 어느새 금방 바닥이 보이더라구요 3명이서 1병은 살짝 부족했나봐요 라구 파스타 22.0 라구 파스타는 역시나 맛있어 음식의 가격대가 괜찮은 편이였는데 살짝 양이 부족해서, 몇 젓가락 하다보면 금방 사라져요 이곳은 배 채우는 식사를 하러 오는 곳이 아니라 와인이 메인이고 와인과 곁들여 먹을 음식들을 판매하는 곳이라 양은 이해가 되더라구요 그리고 라구 파스타가 파스타 중에서도 와인이랑 합이 좋은 것 같아요 청포도 프레쉬 치즈 19.0 프레쉬한 과일로 가볍게 입가심을 하고 싶다면 청포도로 와인 안주해도 잘어울려요 들깨 떡볶이 13.0 여기서 저의 픽은 들깨 떡볶이. 옆에 꽂혀져 나오는 나룽지도 바삭하게 구어져 나오는데 소스에 찍어먹으면 중독성 있어서 바닥까지 싹싹 긁어먹었어요 들깨 떡볶이가 이렇게 맛있을 일인가요 마음 같아서 하나 더 먹고싶었어요 여기를 또 가고 싶었던 이유도 이 들깨 떡볶이가 아주 한몫해요 지예찡 생일 축하해 친구랑 준비한 디딥크 차량 방향제 베이향인데 향이 너무 좋아서 선물용으로 구입했는데, 딥디크 중에서도 베이 향이 가장 인기있더라구요 친구도 너무 좋아하고 선물하는 저희도 너무 뿌듯뿌듯! 제가 차가 있지는 않지만 저도 그냥 겟 하나 하고싶었어요 케익도 너무 귀여운 노티드 케익 맛도 취향저격 케익 예쁘게 넣으려다 되려 망한 케이스.. ㅋㅋㅋㅋㅋㅋㅋㅋ 예뻤던 케익이 안쓰러워졋어요 웃고 떠들면서 오랜만에 폭풍 수다떨며 행복했던 모르클 와인바! 이 곳은 사실 겨울 쯤에 갔었는데 그래도 너무 맛있게 먹었고 기억이 좋게 남아있는 곳이여서 늦게라도 후기를 올렸어요 와인값이 좀 있는 편이라 나중에 계산할 때 가격에 헉 하긴했지만, 그 기억말고는 꼭 다시 한번 가봐야지 생각했었어요 음식이 자꾸만 생각나는.. 그런 곳이에요 친구 생일을 맞아 분위기 내면서 생일 파티 할만한 곳을 찾다가 이곳은 원래 계획이 있던 곳은 아니였지만 어디갈지 찾아보다가 갑자기 알아보게되서 가게된 곳이였는데 오히려 계획에 없던 곳을 가게되면서 좋은 곳을 찾게되었던것 같아요 한남동 와인바 를 검색해서 가까운 곳에 위치하고 늦은 시간임에도 이용할 수 있었던 곳을 찾다보니까 모르클 Morcle 이라는 곳을 가게되었던건데, 지금 생각하면 아주 굿 초이스 모르클 완전 추천 저도 조만간 다시 방문할 예정이에요 50m © NAVER Corp. 모르클 서울특별시 용산구 이태원로 208 한남동 카페 크로플 맛집 아우프글렛 주소 | 서울 용산구 이태원로54가길 20 영업시간 | 17:00 - 24:00 월요일, 목요일 휴무 크로플하면 아우프글렛이겠죠? 예전에 크로플이 이 정도로 퍼지기 전에 크로플을 초창기에 시작한 곳인 것 같아요 그만큼 맛도 인정 아우프글렛하면 사실 금호동에서부터 시작해 처음에 아우프글렛을 알았을때는 금호동으로 방문했었어요 너무 맛있어서 또 오고싶었는데 걸렸던 이유가 거리와 교통편 때문에 망설였었거든요 그런데 이렇게 연남동, 한남동에도 생겨 보다 쉽게 이용할 수 있어서 너무 좋네요 크로플 9.0 크림브륄레 6.0 크로플이 메인이지만 크림브륄레도 먹고싶어서 함께 주문. 크림브륄레는 위에 달고나 같은 게 위에 덮어져있어서 그걸 깨면서 먹는 재미가 있고 달달하게 디저트 먹기 좋았어요 크로플이 엄청 부드러운데 겉은 살짝 바삭해서 칼로 썰때 바사삭 하는데 이 식감이 좋았어요 인테리어마저 여자들의 취향 저격 사실 인테리어로만 보면 평범한 카페 같지않아요 그만큼 인테리어를 잘해놨다는 뜻..! 어머나 여기도 포토존이 있네요? 처음부터 여기를 앉은건 아닌데 계속 호시탐탐 노리다가 여기 자리에 앉은 손님들이 나가면서 저희가 냉큼 앉았어요 사진에 죽고 못사는 저희는 솔직히 대화보다 사진 찍는데 80프로의 시간을 보낸 것 같아요 ㅋㅋㅋㅋㅋㅋ 또 조명하며 전체적인 분위기가 사진에 너무 잘 담겨서 예쁜 사진들을 많이 건졌어요 호호 친구의 패션을 보면 이게 겨울인지 여름인지 헷갈리겠지만 오른쪽 저를 보면 단번에 알수 있습니다 ･ᴗ･ 50m © NAVER Corp. 아우프글렛 한남점 서울특별시 용산구 이태원로54가길 20 1층 한남동에서 멋진 와인바도 알게되고 크로플이 너무나도 유명한 아우프글렛도 이용하면서 즐거운 시간을 보내고 왔어요 다음에도 한남동 맛집 또 소개할게요! . . 오늘도 행복한 하루였습니다 ･ᴗ･"
[한남동/이태원카페] 크로플맛집 아우프글렛,"#크로플맛집 으로 소문난 #한남아우프글렛 소문은 익히 들었으나 직접 방문하기는 이번이 처음... #아우프글렛와이파이 >>aufglet1234 (나도 몰라, 이게 왜 생각나는지...) [위치] 서울 용산구 이태원로54가길 20 6한강진역 3번 출구에서400m 12월을 맞아 홀리데이 포스터와 소품들이 많다 메뉴판도 심플하고 멋지다 깔끔해 내스탈이야 크로플맛집이지만 *플랫화이트 *아메리카노 주문!! 2층에 자리를 잡았으니 또 내려오기 귀찮으니 여기저기 둘러보며 기다린다.. 조금 기다린다 조금 더 기다린다 조금만 더 기다린다 : : : 메뉴판 옆에 디피되어있는 까눌레와 크림브릴레 티라미수 크림브릴레 참 맛있는데 파는곳 많이 없는데 여기 파네? 좋은건 크게 보기 주문한 음료 두잔이 나왔다 폭신폭신해보인다 나의 크림... 늘 단 것만 먹는 나니까 나는 항상 크림이나 우유 베이스의 커피만 마신다 아메리카노는 아직 무리다... 사실 맛은 쏘쏘.. 특별하게 맛있지도 맛이 없지도 않다... 크로플맛집인데 크로플은 안먹어서 그런가.. 왜 유명한지는 잘모르겠어... 전체적인 분위기는 모던,심플하다 중성적인 매력?? 남여 모두 수용가능한 곳... 핫핑크의 카페가 아니여서 좋다.. (핫핑크카페 뭔가...난 쫌 그렇던데...) 소품들이 다 비싼거더라... 스피커도 200마넌짜리 쓰시고 말야.. 그게 4대는 있어보이던데!!! 히터는 좀 틀어주지.. 춥다... #한남동카페 #이태원카페 #한강진역카페 하면 #아우프글렛 많이 나오던데 담에는 크로플 먹으러 가볼거야.. 음료는 오츠커피랑 챔프가 더 맛이가 있..."
[헤라 아우프글렛 SCENE #000000 씬 넘버블랙 팝업스토어 ~2022.4.30 / 한남동팝업 / 한남동데이트 / 아우프글렛 한남점 연남점 금호점],"@herabeauty_official x @aufglet 들려오는 낯선 음악, 마주치는 이들의 옷차림, 함께하는 사람과의 시간. 익숙한 공간에서 우리는 매일 무의식적으로 새로운 취향을 확장해 나갑니다. 익숙함 속에서 새로움을 발견하는 교류의 순간, #씬넘버블랙 이 지금부터 시작됩니다. 4월 한달간 아우프글렛을 방문하고 여러분만의 #블랙씬 을 찾아보세요. Unfamiliar music, fashion from others, and time spent with someone. We unconsciously expose ourselves to new tastes even in common places like a cafe. In a moment when you discover newness in the ordinary, what we call #SceneNo_black is about to begin. Visit Aufglet in the month of April to find your own #BlackScene. #SceneNo_black #씬넘버블랙 #blackscene #블랙씬 #헤라 #아우프글렛 #연남동데이트 #금호동데이트 #팝업 #핫플 #핫플레이스 #팝업스토어 #힙플 #힙플레이스 #인스타올릴만한곳 #데이트코스 #데이트장소추천 #데이트 #인스타업로드 #친구랑놀곳 #친구랑갈곳 #인스타갬성 #인스타감성플레이스 50m © NAVER Corp. 아우프글렛 한남점 서울특별시 용산구 이태원로54가길 20 1층 50m © NAVER Corp. 아우프글렛 연남점 서울특별시 마포구 성미산로31길 11 AUFGLET 50m © NAVER Corp. 아우프글렛 금호점 서울특별시 성동구 독서당로51길 7 1층"
[한남동] 최애 크로플 맛집 아우프글렛,"제가 정말 사랑하는 아우프글렛 크로플 먹고왔어용>.< 제발 울동네에도 생겼으면 조케따😆 오후 1시쯤 방문!! 항상 마감때쯤 와서 이렇게 휘낭시에, 까눌레가 남아있는건 첨보는듯 했어요. 초콜릿도 보이구용!! 무화과잼, 얼그레이잼 둘다 탐난다 아이스아메리카노 2 크로플 1 주문하고 2층으로 올라갔어용 논픽션 제품들이 보이구욤 이번엔 쿠폰도 생겨버림 진작 있었음 꽉꽉 채웠을텐데말이죰 내사랑 크로플 요리조리 찍어봅니당 아이스크림까지 쫀득쫀득 친구도 데려와서 맛보여줬더니 넘 맛있다구 좋아해줘서 내가 만든것도 아닌데 갱장히 뿌듯하더라구요 히히 당충전 잘하구왔어용❤️‍🔥 5m © NAVER Corp. 아우프글렛 한남 서울특별시 용산구 이태원로54가길 20 1층 아우프글렛 서울특별시 용산구 이태원로54가길 20 https://m.blog.naver.com/lmml4003/222785546062 [한남] 아우프글렛 22.06.22 저의 최애 크로플 맛집 아우프글렛 다녀왔어요. 6시쯤 방문했는데 자리가 없어 저녁식사 먼저 하... m.blog.naver.com"
한남동 솔솥/아우프글렛,50m © NAVER Corp. 솔솥 서울특별시 용산구 이태원로54가길 26 지1층 Break time 15:00~17:00 이때만 피해 가세요~~ 저는 수요일 1시 30분쯤 방문했는데 웨이팅 20분 정도 했습니다 메뉴 출처 네이버 와규/도미관자 버터향 솔솔🧈 밥은 비벼서 그릇에 덜고 누릉지 2스푼 정도 넣고 물 넣으면 끝 직원분이 친절하게 설명도 해주셔용~ 바로 옆에 있는 아우프글렛 Next image 크로플 9000원
아우프글렛 한남 카페는 한남동 핫플레이스,"오늘은 한남동 탐방입니다. 아우프글렛 한남점을 방문해보았습니다. 핫플레이스죠. 완전 핫플레이스 ~ 금호점 연남점에 이어 3월 5일에 한남점이 오픈했다고 합니다. 아우프글렛 자체가 워낙 핫한 곳이라 쭉쭉 뻗어나가는 것 같아요. 아우프글렛 한남점은 1,2층으로 이루어져 있습니다. 인스타그램을 보니 많은 분들이 모여서 만들었더라고요 사진, 건축, 인테리어, 패션, 커피, 호텔등 다양한 분야의 친구들이 모여 만든 복합 문화공간이라고 설명되어 있습니다. 그래서인지 인스타그램 계정도 세련된 느낌입니다. (인스타그램에서 한남동 핫플레이스 치거나 아우프글렛 한남 쳐보세요!) 입구에서 QR체크하고 안내 친절하게 받아 입장했습니다. 테이블이 빌 때 마다 바로 와서 청결하게 닦는 모습을 보면서 참 시스템화 잘 되어있구나 라는 생각이 들더라고요 아마도 아우프글렛 연남점 금호점을 하시면서 어느정도 체계가 갖춰진 것 같아요. 한남점은 그 시스템을 다 쏟아부은 느낌이랄까요? 낮에는 카페로, 밤에는 와인바로 운영된다던데, 저흰 낮에 갔습니다. 메뉴가 정말 다양합니다. 사실 아우프글렛 이라고 하면 크로플의 성지아니겠습니까? 그래서 크로플만 있겠지 라고 생각했는데 엄청 다양하더라고요 크롬 브륄레도 있었어요. 이거 파는 카페 정말 드문데! 그래서 이걸 픽! 같이 가신 분은 바이닐 커피를 골랐습니다. 그게 여기 시그니처 커피라고 하더라고요 참고로 아우프글렛의 대표 메뉴인 크로플 가격은 9천원입니다~ 아, 그리고 사방에 거울이 참 많습니다. 그래서 사진 찍을 때도 다른분 안찍으려고 노력했는데도... 많이 나오셨죠 그래서 모자이크 쓱! 확실히 복합 문화공간인 만큼 한 쪽 벽에는 지금 핫한 제품들과 여러 사진, 그림들이 전시되어 있습니다. 논픽션 제품부터 아우프글렛 굿즈까지 쭉 있더라고요. 저희 제품도 저기 조만간 들어갈 수 있길! 아우프글렛은 무언가 핫플레이스에 핫한 아이템, 그리고 감각적이고 세련된 전시를 겸한 공간이었습니다. 그래서인지 사진 찍는 분들도 엄청 많습니다. 여긴 화장실 손 세정제도 논픽션이더라고요 비쌀텐데;; 아우프글렛 라이터도 팔던데 신기했어요 ㅋㅋㅋㅋ 정말 멋지고 세련된 공간입니다. 데이트를 가실 때도 좋고, 혼자 둘러보기에도 좋습니다. 아우프글렛 한남 정말 추천합니다. 아, 그리고 조금 부지런히 움직이시면 좋습니다. 저희 나올 때 사람들이 들어가려고 줄 서서 바글바글 ... 한남 핫플레이스 답더라고요 ( 핫플레이스의 고통은 사람이 많다는 것 ㅠㅠ ) 이상, 아우프글렛 한남 카페 나들이였습니다."
[한남동/강남] 아우프글렛와플 맛집,"안녕하세요!! 요즘 SNS에서 핫 하다는 아우프글렛 와플 맛집! 와플을 좋아하는 저로써 방문을 안 할 수가 없었어요! 아우프글랫 깔끔하게 아우프글렛 간판이 되어 있쥬 ? 처음에 이런 한적한곳에 커피숍이 있나? 생각이 들더라구요! 입구 처음에 아우프글렛 카페 발견 하고 카페에도 웨이팅이라는걸 처음 느껴봄!! 주말이라 그런가? 생각 했는데, 다른 후기들 보니, 평일에도 줄을 쓴다고 하더라구요!! 전 도저히 기다릴 자신이 없어서 카페 안으로 들어가보기나 하자 해서 들어가봤는데, 이게 웬걸 포장도 된다고 해서 포장을 하기로 결정!! (다음에 와서 직접 바로 먹어야징) 포장 기다리면서 기념으로 사진 찰칵!! 웨이팅 기다리시는분 보는데, 창피 어느덧 10?15분 기다렸는데, 와플 두둥!! 와플 좋아하는 저로써 너무 궁금해서 기다리지 못 하고 차에서 먹고 가기로 아우프글렛 포장 일단 냄새는 합객!!!! 먹고 싶은데, 블로그 포스팅 해야되서 사진...!! 먹고 싶어요 ㅠㅠ 빨리 주세요 아우프글렛 와플 영롱한 자태 보이시쥬??? 딱 봐도 맛있어 보이쥬 (기대 기대) 농담이 아니라, 제가 여태껏 먹어본 와플중에 아우프글렛 1등!!☝️🥇!!!!! 먹는데 1분컷 솔직히 한번 더 가서 주문 할까도 고민 했으나, 복근을 유지 해야하므로 다음에 와서 또 먹기로 주말에 데이트 하실때 아우프글렛 가셔서 꼭 드셔보세요!! 적극추천합니다. 50m © NAVER Corp. 아우프글렛 서울특별시 성동구 금호동1가 1801-4"
"[한남동] 웨이팅한 크로플 맛집 ""아우프글렛"" 한남 솔직후기","오늘은 원래 크로플 맛집으로 너무 유명한 ""아우프글렛"" 한남점에 다녀온 솔직후기를 포스팅하려고 해요 평일에 7시조금 넘어서 방문했는데 딱 만석이 되었다고 해서 웨이팅을했어요..ㅎㅎ 이날넘 추워서 어쩔까 고민했는데 와보고 싶었던 곳이라 웨이팅을 했는데 따로 폰 번호를 적거나 하지 않고 앞에서 이름 불러주시더라구요 ㅠㅠㅠ 50m © NAVER Corp. 아우프글렛 한남 서울특별시 용산구 이태원로54가길 20 1층 영업시간: 12:00~21:00(라스트 오더 20:00) 날씨가 좋으면 야외에 앉아서 기다리거나 밖에서 마실수 있을것 같더라구요! 입구부터 느껴지는 감성 지금 아우프글렛이랑 크로우캐년이랑 콜라보중이더라구요! 그래서 특색있는 요케이크가 판맹중인가봐요 정말 독특한 디자인 아우프그글렛 메뉴판 커피메뉴, 티, 등등 독특한게 밀크쉐이크도 있어요!!! 디저트에는 까눌레, 크로플, 크렘브뤨레등등 영롱한 마카롱 비주얼 ..! 카페 느낌이랑 뭔가 잘어울리는 색 1층내부 처음들어갔을 때 사람이 꽉차있어서 위로 올라갔는데 갈때 되니까 자리가 비어서 찍어봤어요 정말 모던한 분위기의 가구 위층으로 올라오니 되게 분위기 좋은 술집같았던 분위기 술도 파시는건가 ..?(뻔뻔한 블로거의 자세 .. ㅠ) 창가쪽이 앉고 싶었는데 당연히 만석이라 다른곳으로 멋쟁이들이 옴청 많더라구요 ㅎㅎ 논픽션 향수들이 있더라구요! 시향만 가능한건지 판매하시는건지는 모르겠어요 뭔가 써져있는게 없었어요 여기서 사진 찍는 사람들 보고 냅다 셀피 ..ㅎㅎㅎ 역시 아우프글렛 시그니처 크로플 :) 크로플😋 재생 5 좋아요 0  크로플😋 아메리카노 (5,000원) 피치블로썸 (5,500원) 크로플 (10,000원) 시럽 휘리릭 달달해서 다시간다면 시럽안하고 먹어도 충분할거 같아요! 커피도 진하고 맛있었고 크로플 유행의 원조 답게 크로플 버터맛이 진하고 아이스크림도 꾸덕하니 넘 맛있었다 ! 아이스크림에 바닐라 빈이 콕콕 박혀있는거 같아요 크로플 맛집으로 이미 유명한곳이라 꼭 가보고 싶었던 아우프글렛 한남 웨이팅이 없는 시간이라면 재방문 할것 같은곳이다 :)"
