title,content
[한남동 아이스크림 바] 살리르,"폭염주의보가 내려진 날 솥밥을 먹으러 갔다가 우리가 솥밥이 될 뻔 했다. 그래서 밥먹고 열심히 찾아간 아이스크림 가게,,,! 저저번주에도 한남에서 양갈비 먹고 짱 맛있는 아이스크림을 먹었는데 오늘은 진짜 더 미친 아이스크림을 찾아버렸다… 골목 안쪽에 있어서 눈에 잘 띄지 않았던 입구!!! 바로 아이스크림 바 살리르! 아이스크림 카페도 가게도 아니고 무려 ‘바’ 라길래 잉? 했는데 아이스크림과 어울리는 와인을 추천해서 페어링해주는 곳이었다. ㅁ ㅣ쳐따.. 엄청시롱 깔끔시롱한 가게 내부! 컵이랑 오브제 하나하나 다 가게랑 너무 잘 어울리는 예쁜 디자인이라 셔터를 안 누를 수 없었다ㅠㅡㅠ 의자도 테이블도 디자인이 독특 깔꼬롬! 사장님께서 계속 틈틈히 손님들이 나갈 때 마다 테이블과 의자를 정성껏 닦으셨다ㅠㅠ 쏘 청결 매장...! 게다가 사장님이 완전 멋쟁이셨다. 뭐랄까 아이스크림을 떠주시는데 이제 진짜 멋쟁이의 아이스크림 같은 느낌… 아이스크림이 한 층 힙해보이는 ! ㅋㅋㅋㅋㅋㅋㅋ(아무말,,) 딱 우리 셋 앉으라고 요로코롬 숟가락 세 개가 이뿌게 놓여있었다. 수저받침까지 있는 게 킬포! 원래는 이렇게 매달 ‘이달의 맛’ 메뉴판이 있는데 아직 칠월 메뉴판이 안 왔다고 하셨다. 고로 위 사진은 6월 메뉴! 7월의 메뉴들 :) 대신 이렇게 마스킹테이프 위에 귀엽게 7월의 메뉴가 적혀있었다. 순서대로 적어보자면 아래와 같다!!! 살구, 레지아노 치즈, 후추 오미자, 올리브, 로즈마리 파인애플, 스피아민트, 소금 수박, 라임, 할라피뇨 배, 버터, 팔각 바나나, 딸기, 발사믹 식초 이렇게 엥? 이런 조화가 된다구? 아이스크림에? 싶은 맛의 조화들이 나열되어있다. 다들 살짝 동공지진이 왔고 고민의 시간을 거친 후 고른 건 모두 오미자였다. ㅋㅋㅋㅋㅋㅋㅋ 다들 가장 무난한 것을 고른 것 같은데 우린 그래도 서로 다른 맛을 시켜보자! 하고 세가지 메뉴를 시켰다. 이렇게 세 개 ! 나는 딸기 바나나 발사믹 (좌측 위) 숩은 오미자 올리브 로즈마리 (우측 위) 랭구는 수박 라임 할라피뇨 (좌측 아래) 먼저 내가 주문한 딸기 바나나 발사믹은 다행히도 내 입맛에 100% 맞았다. 우와 어떻게 이게 어울리지? 싶었는데 어울리는.. 엄청 고급지게 은은한 딸기 맛이랑 무난한 바나나 맛을 발사믹 식초가 상큼하게 잡아주는 맛이었다. 최근에 올리브오일 아이스크림 맛은 알아버렸지만 발사믹도 어울린다니 이마 탁 치기,,, 넘 맛있따 아이스크림 이것은 랭구의 수박 라임 할라피뇨…! 랭구가 먹지마자 맵다고 해서 잉? 했는데 진짜 매웠다! 매운 아이스크림이라니 상상이 안 가는데 진짜 먹는 순간 수박의 달콤상콤함에 할라피뇨의 알싸함이 은은하게 퍼진다! 라임 맛은 강하진 않고 아주 살짝 새콤함이 가미되는 정도? 아무튼 세게중에 제일 신박한 맛이었고 집에 와서도 계속 은근 생각나는 맛… 할라피뇨랑 수박이 어울린다는 것에 충격을 받은 날이다. 이건 숩스가 시킨 오미자 로즈마리 올리브! 제일 무난한 맛이었다고 생각했는데 숩이 입맛에 안 맞다고 한 걸 보면 그것도 아닌가보다! 로즈마리 향이 꽤 강하게 나고 올리브의 짭짤함이 전반적인 맛을 이루어서, 디저트로서의 아이스크림과는 가장 거리가 먼 느낌이었다. 아마 이 메뉴는 ‘오미자’ 를 보고 많이 시킬 것 같은데, 오미자 맛 보다는 올리브와 로즈마리가 더 주인 듯 하다! 나중에 아이스크림이 꽤 녹았을 때 떠먹어보았는데 꽤 크리미한 스프를 먹는 것 같았다. 오미자의 상큼함을 기대하고 시키면 당황하겠지만 와인 안주로는 진짜 최고일 듯 한! 마지막은 사장님의 사랑이 담긴 파인애플, 스피아민트, 소금 맛의 아이스크림! 너무너무 감사하게도 한 번 맛 보라고 주셨는데 진짜 감탄하고 셋다 눈 깜짝할 새에 싹싹 먹어치웠다! 민트 좋아하는 사람이라면 진짜 환장할 맛. 인위적인 민트가 아니고 정말 그 박하잎 그대로의 향과 파인애플의 새콤달콤함 그리고 은은하게 짭짤한 맛이 어우러져 입안을 확 개운하게 만들어주는 맛이었다. 여름날에 온다면 무조건 얘 하나는 꼭 시킬듯! 개인적으로 7월 메뉴가 8월 메뉴로 바뀌기 전에 꼭 다시 먹어보고 싶은 맛이다. 무엇보다 대낮이라 술은 안 마셨지만 아이스크림 하나하나 먹어보며 우와,,, 와인이랑 먹으면 와인 한 병은 진짜 순식간에 다 마시겠다 싶었기에 다음에 오면 해질녘에 와서 꼭 어울리는 와인과 먹어보고 싶따. 헤헤 나오는 길에 찍어본 입간판. 투명해서 글씨는 잘 안 보이지만 파란색 글씨입니다 파랑덕후 합격 드리구요~ 다음엔 꼭 와인과 아이스크림 먹으러 와야징 헤헤 살리르 서울특별시 용산구 이태원로54길 58-20 1층"
[한남동] 살리르 : 수제 아이스크림과 쉐리와인의 환상적인 페어링,"살리르 서울 용산구 이태원로54길 58-20 1층 0507-1375-3318 수목일 16:00-24:00 금토 16:00-02:00 주차 불가능 애견동반 가능 Sesame & Laver chips Pomegranate & Pine nut Gochujang & Choco & Potato chips Real Teroso fino Tio diego amontiado Don gonzalo oloroso 살리르, 외관 수제 아이스크림과 와인을 페어링 해주는 특별한 곳, 한남동 와인바 살리르에 방문했어요. 살리르, 내부 빈티지한 벽면에 살구색상의 포인트와 은은한 조명이 더해져 감각적인 인테리어가 돋보이는 공간이었어요. 얇은 스테인레스를 사용해 시크하고 세련된 분위기는 덤! 총 9명 정도 수용 가능한 아담한 크기의 매장이라서 앉고 싶은 자리가 있다면 미리 예약하고 방문하는게 좋을 것 같아요. 살리르, 메뉴 (아이스크림) Sesame & Laver chips Pomegranate & Pine nut Gochujang & Choco & Potato chip (와인) Real Teroso fino Tio diego amontiado Don gonzalo oloroso 매달 새로운 맛의 아이스크림을 선보이고 있는 한남동와인바 살리르 ! 먼저 아이스크림을 고르면 사장님께서 친절한 설명과 함께 잘 어울리는 와인을 페어링 해주는 곳이에요. Sesame & Laver chips + Real Teroso fino 참깨 아이스크림 완전 도른맛,, 진하고 꾸덕한 바닐라 아이스크림 성애자인 제 입맛에 완전 취향 저격이었고 고소한 참기름과 짭쪼름한 김부각이 감칠맛 업! 같이 페어링해주신 와인도 향긋하고 깔끔해서 꿀떡꿀떡 잘 넘어갔어요. Pomegranate & Pine nut + Tio diego amontiado 상큼한 석류향이 입안에 가득 퍼지는 가벼운 질감의 셔벗 아이스크림과 묵직하고 진한 바디감의 쉐리와인이 환상의 조합이었어요! 와인에서 어딘가 익숙한 위스키의 향이 느껴져서 더욱 맛있게 먹었어요. 달달한 아이스크림에 부드럽고 묵직한 쉐리와인의 조합이란 하루의 피로가 싹 사라지는 맛이에요. 쉐리와인은 접해본적이 많이 없는데 이렇게 맛있는 와인이었나요?! Gochujang & Choco & Potato chips 사장님께서 서비스로 주신 메뉴! 진한 다크 초콜릿과 매콤한 고추장이 더해져 굉장히 이색적인 맛이었는데 은근히 매콤한게 매력있더라구요~ Don gonzalo oloroso 쉐리와인 중 가장 비싼 가격에 판매되고 있었던 돈 곤잘로 올로로소 ! 깊은 풍미에 깔끔한 목넘김이 좋았어요. 포스팅 하면서 또 먹고 싶어지는 기분,, 밥먹고 디저트 필수인 사람한테 딱인 곳이에요. 말로 표현하기에 부족한 맛이니 꼭 직접 가서 먹어보는걸 추천해요~! 독특하고 맛있는 아이스크림에 다양한 종류의 와인을 페어링 해주는 한남동에서 가볍게 한잔하기 좋은 와인바 살리르 추천드려요~! 50m © NAVER Corp. 살리르 서울특별시 용산구 이태원로54길 58-20 1층 #한남동와인바#한남동데이트#한남동젤라또#한남동술집#이태원술집#서이추환영#서이추#맛집블로거#푸드블로거#맛집탐방#먹잘알#맞팬#서울가볼만한곳#맛집추천#한남동애견동반#한남동애견동반술집#서울맛집추천#이태원젤라또#이태원와인바#이태원데이트#한강진역와인#한강진역데이트#한강진역술집#서울와인바추천#용산와인바#서울쉐리와인#쉐리와인안주#쉐리와인추천"
"한남동, 이태원 와인바 살리르:: 남들과는 다른 경험을 하고 싶다면 추천","살리르 서울특별시 용산구 이태원로54길 58-20 1층 한남동 살리르 살리르 로고부터 예쁘네요. 한남동, 한강진, 이태원 부근에서 약속이나 데이트가 있으신데 취하게 마시고 싶진 않지만 그렇다고 카페는 가고 싶지 않다면 대강추 그리고 1차로 가도 좋고 2차로 와도 좋은 곳... 살리르 매장 살리르는 사실 이번년도 초부터 너무 가고 싶었는데 꼭 가려고 하는 날 휴무일이어서 계속 못 가고 있다가 드디어 다녀왔습니다! 영업시간은 저처럼 헛걸음 하지 마시고 꼭 참고해서 가주세유! 매주 월요일, 화요일 휴무 수, 목, 일은 밤 12시까지 금, 토 일은 새벽 2시까지 영업해요! 살리르 메뉴판 잘 안 보이지만... 사실 아이스크림 메뉴도 계속 바뀌고 고르시는 아이스크림에 맞게 사장님이 와인을 골라주시기 때문에 메뉴가 큰 소용은 없는듯한 느낌 ㅎ 살리르 아이스크림 아이스크림 비주얼로 맛이 상상이 안 가는 독특한 맛들만 있어서 사장님에 의존하여 아이스크림도 선택해 보세요.. ㅎ 살리르는 그냥 믿고 가십시다! 살리르 메뉴 근데 그냥 메뉴판이 너무 예쁜 거예요..? 그래서 찍었스요 (저 폰트 모지..궁금) 와인 따라주시는 중 쫄쫄쫄,,,, 와인 어서 나에게로 컴온 그래서 뭐 시켰냐면 PassionFruit 패션후르츠 (5,000) Avocado & PassionFruit & Tequila Whipping Cream 이름은 패션후르츠이지만 많은 재료들이 들어가 있어서 다채로운 맛을 내던 아이스크림이었어요. Kiwi 키위 (5,000) Rum(Havana) & Kiwi 키위는 정말 키위처럼 생기지 않았나요? 제가 시킨 메뉴는 아니어서 한 입만 먹어봤지만 상큼 상큼 딱 상상하던 그 맛이었어요 ᄒ 럼이 들어간 알코올 아이스크림입니다! 하바나 럼 제가 시킨 패션후르츠는 한 번 더 보기 일단 살리르에서 좋았던 건 아이스크림을 먹고 나서 입에 껄끄럽게 남는 게 없다는 게 가장 좋았습니다 :) 당연히 우유 베이스가 아니어서 그렇긴 하겠지만요...? Coffee 커피 Sambuca(Triple anise liquer) & Coffee 이거는 두 번째 시킨 와인에 내어주신 아이스크림! 이 커피 아이스크림도 바카리 삼부카가 들어간 알콜 아이스크림입니다! 바카리 삼부카 아이스크림이 살이 안 쪘더라면,,, 얼마나 좋았을까요 그럼 매일 먹을 텐데 말이야,,, 서울브루어리 한남 서울특별시 용산구 한남대로18길 18 2층 예약 와인을 두 잔밖에 안 마셔서 그른가 살짝 아쉬워서 순천향 쪽으로 내려와서 서울 브루어리에서 수제 맥주 두 잔 깔끔하게 마셔줬습니다ᄒ 서울 브루어리 위치는 타르틴베이커리 바로 옆에 있어요! 적당히 조용하고 편안한 분위기여서 가볍게 맥주 한 잔 하면서 떠들기 딱 좋았던 것 같아요. 아이스크림 소사이어티 서울특별시 용산구 한남대로20길 47 와인에 맥주에 그리고 또 아이스크림으로 마무리 아이스크림 2차는 처음 보시죠..? 아이스크림 소사이어티... 유명세에 비해서 막 엄청 맛있는 건 아니지만 그냥 무난하게 먹기 좋은 곳 같아요. 사실 아이스크림이 맛없기도 힘들지 않습니까..요? 그럼 오늘도 봐 주셔서 감사하고 날이 점점 추워지고 있는데 항상 감기 조심하시고용!"
체크인 | 한남동 살리르 SALIR - 아이스크림 & 와인 페어링,"살리르 SALIR 영업시간 수, 목, 일 16:00-00:00 / 금, 토 16:00-01:00 살리르 서울특별시 용산구 이태원로54길 58-20 1층 한남동에 있는 살리르 아이스크림 & 와인 페어링 아이스크림과 와인이라니 좋아하는 것들의 조합! 🍨🍷🍨🍷 신기한 페어링이라 궁금했다 살리르 간판 아마도 매월 바뀌는 아이스크림 메뉴!! 월별 메뉴는 인스타를 참고하면 된다 @salir_hannam 아이스크림 자체만으로도 맛이 궁금해지는 조합이당 와인 메뉴판 (아마 달라졌을 수도!) 아이스크림과 페어링 좋은 와인 고르기 와인 쪼로록… 바나나&바닐라&버번 아이스크림 + 쉐리 와인 참깨&김부각 아이스크림 + 살렌토 화이트 와인 쉐리 와인은 처음이었는데 포트보다는 덜 달았던거 같다 화이트는 쇼블처럼 상큼한 맛! 아이스크림이랑 와인 페어링 재밌었꼬 맛있었따… 매월 메뉴가 바뀌니까 조만간 또 한번 가야겠다!"
먹데일리 | 한남동 디저트바 ・ 아이스크림 바 살리르 ・ BAR SALIR 강추강추 강강추 ☺︎,"색다른 디저트를 맛보고 싶다면 - Hanam Icecream Bar Salir. 한남동 아이스크림 바 살리르. 친한 언니랑 이태원에 놀러 갔다가 정말 우연히 들린 한남동 아이스크림바 살리르 내가 아이스크림 먹고 싶다는 한마디로 시작해 이태원 일대를 찾다가 진짜 정말 완전 우연히 여기 아이스크림 파네! 하고 들어간 곳이다 그냥 아이스크림 파는 곳인줄만 알았지 베스킨 막이러고- 아마 이번 겨울에 방문한걱 같은데 이제 포스팅 해본다 ^-^.. 양심.. 따댱님 저 잊지 않고 올렸어요 잊지 않았다구요 이날 한남동 아이스크림바 살리르에서의 기억이 강렬하게 즐겁고 유쾌했어서 블로그에 무족권 올린다!! 다짐했던 블로그 쥬인 그리고 다짐한지 몇달 지나..^-^ 올렸다 ..양심.. 애니웨이 레고 쓰따뜨~ 이태원 지금은 없어진 파스타집에서 점심을 뿌시고 저녁으로 내가 자주보는 유투버의 맛집이 궁금해서 가보려고 했는데 새상에나 웨이팅이 아사리판 ^^.. 돌아버린 웨이팅을 기다릴까 하고 아이스크림 집을 찾다 진짜 상당히 그냥 들어간 살리르 마침 또 자리가 테이블바 밖에 없어 자리잡고 아이스크림을 고르려 하는데 오호 메뉴들이 다 신선한것이다 - 치즈와 유자와 발사믹 - 망고 피치 - 초코 진저 라임 그외, 석류, 베이컨이 들어간 셔벗 등등 시즌마다 메뉴 유동이 있다고 했어서 지금 방문하면 이때 메뉴와 또 다른 아이스크림을 맛볼 수 있다 (첫번째 메뉴는 이름 기억이 안남 ㅜ) 메이플 시나몬 베이컨 석류 바질 할라피뇨 다크초코 한남동 아이스크림바 살리르의 최대 와우포인트 킥포인트는 사장님이 직접! 아이스크림에 페어링해 멋진 와인 또는 맥주를 선사해주신다 이날 사장님 텐션업으로 을매나 많은 술은 갖다 주셨는지 젊은 따당님 많이 버세오 🔥 아이스크림도 직접 메뉴 개발과 제작을 하고 여기에는 어떤 재료와 제품들이 들어가는지 먹을때마다 하나하나 설명해줘서 아이스크림 하나에 들어간 히스토리를 들으며 찐한 아이스크림 한스푼 맛을 즐길 수 있다 주류잘알이라면 얼마나 멋진 이야기를 가진 친구들인지 알듯 마침 같이 방문한 언니가 가니 12개 되는 슈퍼 간이라 절대 안취하고 와인에 대해 잘 알고 있어 페어링하는 메뉴에 대한 이야기가 한바구니 꽃 피웠다 알못은 옆에서 신기한 표정으로 귀를 쫑끗했다 사장님과 매니저 두분이 한남동 아이스크림바 살리르에 상주해 계시는데 두분의 인연은 사장님이 운영하는 또 다른 바에서 단골손님과 사장으로 인연을 맺으셨다고 오호 ⭐️ 매니저님은 디자이너 출신이라고 어쩐지 브랜딩에 신경 쓰는게 티가 나고 개인적으로 인스타도 팔로우를 주고 받았다 ㅎ 마침 마켓에 대한 계획이 있어서 프로 마켓러인 언니랑 매니저님과 수다 삼매경 요거슨 사장님이 만든 할라피뇨 다크초코 위에 뿌린것이 할라피뇨인가..? 무엇이지 생각하지 못했던 조합으로 jmt을 뽑아내는 살리르 싸장님 사장님 삘 받아서 와인 등등 값비싼 주류들을 꺼내오시는데... 이날 사장님도 상단히 취해 계ㅅ.. 갠적으로 와 뭐야 이 화려한 비주얼 했던 아이스크림 페어링한 레드와인은 와알못도 정말 잘 마셨던 기억 싹싹 긁어 먹어서 잔에 채워주시는 사장님의 모습이댜 고것을 흐믓하게 바라보는 매니저님 아이스크림에 베이컨을 넣을 생각을 어떻게 하지??? 이것도 와인 페어링을 해주셔서 같이 찰칵찰칵 찍었다 살리르에 있는 커트러리와 접시, 글라스가 예뼈서 들어서 보다가 자기 같은 사람이 또 있다며 대화가 시작됐었다 심볼 하나하나 박은것도 정성이다 진짜.. 해본 사람만 안다 저거는, 얼마나 신경써야 하는지 석류 바질과 정말 잘 어울렸던!!! 라임에 들어간 (모히또인가) 메뉴 하나하나 페어링 해준 싸장님과 매니저님께 간빠이 사진이 잘나왔으니까 많이 올려야지 (겨울옷인거 보소..) 살리르 이대로도 좋다는 싸장님과 살리르를 더 키우고 싶은 매니저님 전 매니저님 의견에 한표요 살리르는 더 유명해져 한다!! (아니 유명해지지마..나 웨이팅 없이 들어갈테야 🙄) 50m © NAVER Corp. 살리르 서울특별시 용산구 이태원로54길 58-20 1층 전화 0507-1375-3318 주소 서울 용산구 이태원로54길 58-20 1층 영업시간 일-토 16:00 - 새벽 02:00 #한남동맛집 #한남동아이스크림 #한남동디저트집 #디저트바 #수제아이스크림 #아이스크림맛집 #와인맛집 #디저트맛집 #아이스크림바"
[한남동 와인] 그냥 지나가면 후회 할 한남동 와인바 살리르 SALIR,"유명해져...아니 유명해지지마.. @한남동 아이스크림 & 와인바 살리르 SALIR 와인과 아이스크림이 만났다. 투게더 아니다. 하겐다즈 .. 그것도 아니다. 실험정신으로 개발하고 최고급 재료로 직접 만든 수제 아이스크림이다. 여기는 한 번 맛보자마자 월요일 업로드 예정임에도 불구하고 바로 다음날 블로그를 켰다. 그만큼 추천하는 곳이며 남녀노소 할 것 없이 누구나 좋아할 공간과 맛이다. *물지 않는 동물 및 착한아이 삽가능 한남동 아이스크림 & 와인바 살리르 SALIR 매주 월요일 휴무 50m © NAVER Corp. 살리르 서울특별시 용산구 이태원로54길 58-20 1층 위치가 조금 애매해 아마 찾아가기 어려울지도 모르겠다. 하지만 맛을 위해선 뭔들 못하리 내부로 들어서자마자 힙함이 느껴진다. 대~충 한 것 같은 인테리어 속에 갠지 한 스ㅍ.. 오늘은! 후기 위주로 글을 쓸 예정이므로 쓸때없는 이야기는 하지 않겠다. (말투부터 진지하지?) 얼핏 보기엔 호두, 피스타치오, 망고, 커피맛 같지? 메뉴보고 신박해서 기절하고, 맛있어서 기절했다. 메뉴 보고 내가 본 단어가 맞나 싶었다. 복숭아, 아몬드, 소금의 조합이라니.. 망고랑 고추(외국 고추라했는데 이름이 기억 안난댜..암튼 엄청엄청 매운 고추라 했음.)라니... 체리랑 올리브 오일이라니... Cheddar & Coconut & Mangosteen & Pineapple &Coffee / Peach & Almond & Disaronno & Salt 한남동 와인바 살리르에서는 아이스크림을 고르면 어울리는 와인을 추천해주신다. 이걸 우리는 고급진 말로 ""페어링""이라고 한다. 추천 받은 와인과 아이스크림을 ""페어링"" 해보았다. : Cheddar & Coconut & Mangosteen & Pineapple &Coffee 잘 나가는 패션 잡지 회사의 에디터인 나는 비가 추적추적 오는 밤, 블랙 레더 트렌치 코트와 프라다 구두를 신고 파리 거리를 걷고 있다. 세상 섹시해 : Peach & Almond & Disaronno & Salt 덥고 쨍한 여름, 하와이 비치에서 오렌지색 비키니를 입고 모래사장에 누워 태닝을 하고 있다. 저 멀리서 파란색 셔츠를 입은 귀여운 남자랑 눈이 마주쳤다. 짜릿해 입에서 아이스크림이 녹을 때 쯤 현실로 돌아온다.. 아, 물론 현실에도 내 옆엔 섹시한 남자가 있었다. 다행이다. 잠시 떨렸다보다. 사진이 흔들렸다. 훈제 연어와 오이, 그리고 너 이름이 뭐지 올리브 같은건데...ㅋ..케스퍼인가 암튼 메뉴엔 없지만 옆 테이블 손님이 요청하셔서 덤으로 얻어 먹었다. 연어 아이스크림이라니..상상이나 해봤겠는가? 심지어 맛도 있다. 여기 작고 귀여운 고추가 있다. “하바네로”라고 한다. 나무위키에 검색해봤다. 결론은 엄청 매운걸로 Mango & Habanero / Oxalis & Raspbarry & Rose 왼쪽) 망고랑 고추의 조합이라... 장난하ㄴ.. 이쯤되면 사장님 얼굴을 확인해본다. (뭐지 이 믿음직함은?) 이게 무슨 장난인가 싶지만 앞에 먹었던 아이스크림 맛이 훌륭했기에 믿고 한 입 먹어본다. : Mango & Habanero 발렌티노 가방을 보았다. 하얀색 가죽에 옐로우 골드 체인이 달려있고, 가운데엔 금장 로고장식이 고급지게 박혀있다. 언니가 너무 늦었지? 미안해, 언능 집으로 가자 KRW 3,100,000 대추가 들어간 아이스크림이다. 이 아이도 메뉴에 없었다. 한 입 먹고 할아버지가 생각났다. 대추를 한움큼 쥐어 함박웃음을 하고 다리를 절뚝이며 나에게 달려오는 할아버지. 보고싶다. 이것 저것 많이 내어주셔서 감사한 마음에 화이트 와인 한 잔 더 주문했다. 여긴 도대체 무엇인가.. 지금까지 먹은 아이스크림을 와인이 깔끔하게 헹궈주는 느낌이다. 3주년이라 3개를 쌓아 봤다. 사장님이 기념일이라고 선물을 주셨다. 사실, 내어준 여러 아이스크림 만으로도 충분한 선물이었다. 겉은 차가워 보이지만 달콤함을 선물하는 그는 우리가 나갈때까지 줄게 뭐가 있나 가게를 두리번 거렸다. (저 사실 티셔츠 갖고싶었어요..) 진심으로 잘 되셨으면 좋겠다. 사실 잘 될 것 같다.. 사장님.. 벤츠 가즈아 ! +와인 이야기를 많이 안한 것 같은데, 한남동에 정말 많은 와인바가 있다는 것을 안다. 하지만, 자부한다. 이 집 잘 혀 ."
[한남동 디저트] 살리르 아이스크림 와인바,"한남동 늦은시간까지 여는 와인바, 아이스크림 살리르 운영시간: 수목일 16시-24시, 금토 16시~2시(월화 휴무) 주소: 서울 용산구 이태원로 54길 58-20 1층 50m © NAVER Corp. 살리르 서울특별시 용산구 이태원로54길 58-20 1층 평일 저녁, 친구들과 한남동에서 저녁먹고 커피를 마셨는데 카페가 10시정도 마감이라 하고픈 말이 아직 많은데 너무 아쉬워서 3차 가볼만한 곳을 찾았어요~ 평일이라 술은 안먹고 싶어서 아이스크림가게가 있길래 가보았습니다! [매장내부, 메뉴] 살리르!! 독특한 이름이죠? 와인 페어링과 아이스크림을 판매하고 있습니다. 아이스크림 메뉴 금액: 5,000원 베리베리베리 빼고는 다 예상 불가능한 맛이였어요...ㅎㅎㅎ 이렇게 진열되어있었어요! 와인도 종류가 정말 많았어요! [아이스크림] Berry Berry Berry Daikon & Yuzu Choco & Earl Grey & Jeju Mandarin 이렇게 세가지 시켰습니다! 역시나 베리베리베리가 제일 맛있었구요! 다음은 만다린, 마지막이 유자.... 다이콘이 무 더라구요...ㅋㅋㅋㅋㅋ 무식감 지대로...ㅎㅎㅎㅎ 제입맛에는 안맞았어요! 열심히 12시까지 수다떨다 집 갔습니다~ㅎㅎㅎ 한남동에서 배부른데 늦게까지있을 곳을 찾는다면!! 살리르~"
