title,content
한남동 브런치 데이트하기 좋은 카페르상스 사운즈한남점,"한남동 브런치 데이트하기 좋은 카페르상스 사운즈한남점 프랑스 밀가루와 천연 발효종을 넣어 만든 전통 유럽빵. + 한남동 카페 유럽 테라스 감성까지 좋아요. + 음악+와인과 핑거푸드 + 테라스 + 베이커리와 커피 즐겨요. 언니와 평일 한남동 데이트로 정했던 곳!!! 바로 한남동의 핫 플 공간인 카페 르상스 사운즈한남점 입니다~~~ 입구부터가 아주 취향 저격이었어요~~ 주차는 지하 발렛파킹 (2시간 : 5000원) 하면 됩니다. 짠~~ 테라스가 진짜 너무 좋쵸~?!! 한남동 브런치 장소로 아주 그뤠잇 했어요!!!! 이제 낮 날씨가 따스해졌으니 이런 곳에서 즐겨줘야죠~~즐겨줘야죠~~~ 한쪽에 베이커리들도 종류가 다양했어요!!! 빵 냄새에 이끌려서 신중하게 골라봅니다~ㅋㅋㅋㅋ 마들렌과 르뱅 쿠키, 바게트와 소금빵, 휘낭시에 등등.. 카페 르상스 사운즈한남점은 좋은 재료를 듬뿍 넣어서 부드러운 식감과 바삭 촉촉함을 가지고 있는 베이커리라고 했어요! 그래서 더 고르기가 힘듭니다~~~ 뭘 먹어봐야 잘 먹었다고 소문이 날까요~~?! 야무지게 베이커리를 고르고 이번엔 커피를 골라봅니다!!! 시그니처 베스트 메뉴 마셔봐야죠~! 늦은 오후 시간이어서 카페인이 부담되었는데 디카페인이 있어서 너무 좋았어요! 처음 분위기도 좋았는데 커피까지 맘에 들었어요~~~ 내부는 따뜻한 느낌의 우드톤 인테리어였어요~ 깔끔하면서 차분한 분위기 좋아요~~~ 한남동 브런치 카페에서 주문한 메뉴 르상스 크림 커피 6,500원. 플랫 화이트 5,500원. 할라피뇨 치아바타 / 말차 르뱅 쿠키 보기만 해도 맛있어 보이죠~~?!!! 직접 로스팅 하는 원두여서 더 기대가 되는 커피입니다~~ 베스트 메뉴 커피였던 크림 커피는 너티한 크림과 함께 고소한 맛이 좋았어요. 고소함에 반해버렸던 순간이었어요~~ 음~~ 맛있다 맛있다!!!! Good Good 역시 베스트 인 이유가 있었어요~~~ 치아바타 좋아하는데 할라피뇨를 품고 있는 건 처음 먹어봤어요! 오~~ 이런 조합 좋아요~!! 프랑스산 밀가루 + 버터를 사용해 더 깊은 풍미를 느낄 수 있었던 치아바타. 여기 베이커리에 진심이었어요~~~ wow wow 지금까지 먹어봤던 르뱅 쿠키와는 차원이 달랐던 쿠키였어요!!! 진심 1위로 픽 했어요!!!! 왜냐고요?!! 마카다미아도 가득 들어있지만 촉촉 더하기 촉촉해서 너무 맛있었어요~~ 이 조합으로 다시 먹으러 가야겠어요~ 포스팅하는 이 순간 그때의 맛이 다시 생각날 정도입니다!!!! 어둑 어둑해지면서 더 감성적으로 변하는 한남동 브런치 맛집!! 음악과 영상으로 눈과 귀가 즐거워지는 공간이었어요~~~ 와인도 준비되어 있었어요~~주말은 올데이, 평일 17 이후에는 주문 가능하다고 하니 여기서 분위기 좋게 한남동 데이트 즐겨야겠지요?!!! 낮과 밤의 매력이 다 있는 곳!! 너무 좋았어요~~ 한남동 브런치 재생 20 좋아요 0 00:00 00:32  접기/펴기 한남동 브런치 음악 들리시죠?!! 진짜 힐링 그 자체였어요~~~ 특히 여기 테라스 공간!! 테라스에서는 부지로의 돈카츠를 이용한 카츠산도와 브런치와 화이트 와인을 즐길 수도 있다고 하니 정말 퍼펙트하죠?! 언니랑 오래간만에 한남동 데이트했는데 만점이었습니다~~!!! 카페 르상스 다섯 가지 감각을 경험한다는 의미의 복합 문화 공간 한남동의 핫플이 될 이유가 충분했던 곳이었어요~~ 베이커리와 커피+와인과 핑거푸드+테라스와 음악의 조합으로 일상에서의 즐거움과 여유를 느낄 수 있는 공간으로 인정합니다~! 여기서 카페 데이트하고 저녁으로 너무 맛있는 카츠를 즐긴 후기는 오후에 이어집니다~ 힐링 포인트가 많은 한남동 디저트 카페 :: 카페 르상스 사운즈 한남점 - 다양한 베이커리와 좋은 재료들 Good - 디카페인까지 준비되어 있어요 Good - 커피부터 와인까지 Good - 발렛파킹 매일 10:00~22:00 50m © NAVER Corp. 카페 르상스 사운즈한남점 서울특별시 용산구 대사관로 35 사운즈 한남 1층"
"한남동 카페 카페르상스 사운즈한남, 테라스에서 즐기는 브런치(+연말 데이트 장소)","오랜만에 들른 한남동. 사운즈한남은 한남동 가면 꼭 지나가는 곳인데, 사운즈한남에 위치한 카페르상스에는 처음 가봤다.ㅎㅎ 테라스에서 여유롭게 브런치 즐기고 음료 마시고 하는 사람들이 늘 있어서 궁금했던 차에,,, 시간이 생겨 다녀올 수 있었던 한남동 카페 카페르상스. 카페르상스는 베이커리 종류가 꽤 많고, 와인 메뉴도 꽤 많고, 브런치 메뉴도 있어서,,, 카페 음료 뿐 아니라 연말 데이트 겸 브런치도 즐길 수 있는 한남동 카페였다. Next image 사운즈한남 입구로 들어가서, 뒷쪽 문으로 들어가도 되고,,, 아예 도로에 있는 요 문으로 들어가도 되는 한남동 카페 카페르상스. 바틀로 판매하고 있는 와인은,, 종류도 꽤 많이 구비하고 있어서 둘셋 이상의 모임으로 브런치를 먹기에 딱 좋은 곳이었다. 푸릇푸릇. 카페와 베이커리와 와인을 취급하고 있는 카페르상스. 사운즈한남 건물 내에 위치한 베이커리 카페로,,, 테라스의 야외 좌석이 있어서 주말에는 늘 사람이 많은 곳이다. 연말 데이트 장소로도 좋을듯. 50m © NAVER Corp. 카페 르상스 사운즈한남점 서울특별시 용산구 대사관로 35 사운즈 한남 1층 용산구 대사관로 35 사운즈한남의 1층에 자리잡은 한남동 카페 카페르상스. 주차는 사운즈한남 건물 내 지하 주차장에 주차하면 되는데,,, 요 아래아래쪽 사진에 카페르상스에서 주차 지원 해주는 내용 사진 찍어와서 공유해드리니, 참고하시길. 지하철 타고 가려면 6호선 한강진역에 내려서 한 10여분 정도 걸어가면 된다. 한남동 카페 카페르상스의 오픈시간은 오전 10시. 내부는 요렇게 좌석이 쭈우욱 있었고,,, 야외에는 이렇게 좌석이 쭈우욱,,, 있었다. 테라스쪽에 좀 안정적으로 자리가 마련되어 있어서, (식물이 딱딱딱 다 가로막고 있었다.) 앉아서 브런치 먹거나,,, 수다 떨기에 괜찮은 자리였다. ㅎㅎ 빨간테이블과 의자는,,, 나름 사운즈 한남에서 핫플이라 ㅋㅋ 셀카찍는 여성분들 수만명,,, 연말 데이트 장소로도 그래서 좋을 것 같다. 이날도 평일 오전에 갔는데 사진 찍고 거의 반 이상이 자리가 차더라.ㅎㅎ 아참, 테라스에서는 옆 가게인 분지로의 카츠산도도 테이크아웃하고, 카페르상스의 브런치 메뉴들도 함께해서,,, 브런치로 같이 먹을 수 있다고 한다. 참고하면 좋을듯. 와인 종류도 다양했던 한남동 카페 카페르상스 사운즈한남점. 주차는 매장 이용시 2시간에 5천원 발렛비용을 내면 된다. 그리고 추가 할인은 15천원 25천원 각각 30분과 1시간을 주는 모양. 커피 메뉴는 오른쪽과 같다. ㅎㅎ 세계 3대 원두인 인텔리젠시아 원두를 사용하고,,, 찻잎도 특별한 걸 공수해서 사용하는 듯 했다. ㅎㅎ Next image 부라타 무스 샐러드와 올리브&하몽, 플래터와 다양한 화이트와인 스파클링 와인, 레드 와인 로제와인 등,,, 다양하게 브런치를 즐길 수 있는 메뉴와 와인이 있었던 한남동 카페 카페르상스. 와인 종류가 꽤 다양해서, 브런치 뿐 아니라,, 저녁에 간단하고 가볍게 한잔하기에도,,, 연말 데이트에도,, 좋을듯 싶었다. 베이커리 종류도 많았는데,,, 프랑스산 밀가루와 버터를 사용하는 카페르상스의 베이커리들은,,, 일본식 베이커리 기법을 사용해서, 베이커리의 퀄리티가 높다고,,, 식사대용 빵도 아주 많았고(건강빵ㅋㅋㅋㅋ) 샌드위치 종류도 많았다. 그래서 그런지 평일 점심에 샌드위치 사가는 사람도 좀 있었다. ㅎㅎ 포장 손님도 은근히 있었던 카페르상스. 와인과 함께 즐기기 좋은 바스크치즈케이크와 파운드 케이크도 있었다. ㅎㅎ 부라타 무스 샐러드와 화이트 와인, 그리고 소금빵(은 너무 맛있어 보여서 시켜버림ㅋㅋㅋ) 한남동 카페 카페르상스의 브런치 메뉴인, 부라타무스샐러드는,,, 바질 오일이 왕창 들어가 있어서 풍미가 너무 좋았다. 마리네이드된 토마토도 상큼달달했고, 하몽도 짭짤하고,,, 중간에 섞인 치즈도 맛있었다. ㅎㅎ 그리고 부라타 무스에 마리네이드된 토마토 하나 집어 먹고,,, 아 이건 빵에 넣어 먹어야겠다(=탄수화물을 같이 먹어줘야겠다) 생각하고, 다시 카페 안으로 들어가서 소금빵을 하나 사옴 ㅋㅋㅋㅋ 화이트 와인과 잘 어울렸던 부라타 무스 샐러드. 그리고 넘나 바삭하고 버터향 한가득했던 소금빵. 소금빵도 맛있었다. ㅋㅋ 버터 풍미 엄청나고,,, 겉은 완전 바사삭파사삭하고, 속은 촉촉하니,,, 그래서 반 갈라서 부라타 무스 샐러드 왕창 쌔려넣고 샌드위치 만들어 먹었다. ㅋㅋㅋ 옆 가게의 카츠산도도 테이크 아웃하고, 여기 카페르상스에서도 다양한 베이커리 메뉴와 브런치 메뉴가 있으니, 여러개 시켜서 요렇게 새로운 메뉴(ㅋㅋ)도 만들어 먹고,,, 와인과 브런치 하기에 넘 여유롭고 좋은,,, 연말 데이트 장소로도 좋았던,,, 사운즈한남의 카페르상스였다. 한남동 카페, 카페르상스 사운즈한남 테라스에서 즐기는 한남동 브런치 재생 3 좋아요 0 00:00 00:53  접기/펴기 한남동 카페, 카페르상스 사운즈한남 테라스에서 즐기는 한남동 브런치"
한남동 브런치 카페 르상스 사운즈한남점 테라스에서,"한남동 브런치 카페로 분위기 좋았던 사운즈한남점 후기에요. 저는 사운즈한남 자체를 처음 가봤는데, 다양한 브랜드들이 입점되어 있었어요. 카페 갔다가 남편이랑 구경하면서 데이트하기 좋았어요. 햇살 아래 맛있는 음료와 여유를 즐기기 좋았던 곳이랍니다 : ) 50m © NAVER Corp. 카페 르상스 사운즈한남점 서울특별시 용산구 대사관로 35 1층 <카페 르상스 사운즈한남점> 전화번호 02-794-9009 매장주소 서울특별시 용산구 대사관로 35 1층 영업시간 매일 10:00 ~ 22:00 라스트오더 21:30 카페 르상스 사운즈한남점이 있는 공간에는 oror, Aesop, PHILLIPS, dyson 등 다양한 브랜드가 입점해있어요. 한남동 브런치 먹고 구경하고 가기에도 좋더라고요. 카페에 입장해 보면 우드 한 인테리어가 눈에 들어와요. 편안하고 아늑한 느낌이 들었어요. 평일에도 손님이 많은 곳이었어요. 외국인 분들도 계시고, 친구 지인들이랑 모임 하는 분들이 많았어요. 가장 먼저 눈에 들어온 건 베이커리류였어요. 한눈에 봐도 제대로 만들어진 맛있는 빵이라는 걸 알 수 있었어요. 빵을 좋아하는 분들이 커피 한 잔과 함께 한남동 브런치 하기에 좋은 곳이에요. 여기 방문하기 전에 찾아봤는데, 프랑스산 밀가루랑 버터로 만들어요. 만드는 기법은 일본식으로 퀄리티를 높였고요. 카페 르상스 사운즈한남점의 메뉴와 가격이에요. 커피, 밀크티, 초코라떼, 제페니즈 티, 제페니즈 말차 라떼, 제페니즈 티 에이드 등이 있어요. 커피는 르상스 크림 커피가 가장 인기 있다고 해요. 저는 커피를 좋아하지만 카페인에 취약한 관계로 에이드를 주문하려고 했는데요. 모두 솔드아웃이더라고요. 오전 중에 다 나간 걸지, 잠시 수급이 안되는 건지는 모르겠네요. 한쪽 냉장고에 다양한 화이트 와인이 진열되어 있더라고요. 테라스에서는 브런치랑 화이트 와인을 같이 즐길 수 있다고 해요. 브런치는 분지로의 돈카츠를 활용한 카트 산도와 올리브&하몽을 등이 있다고 합니다. 저는 음료를 마시러 갔던 거라 한남동 브런치 메뉴판을 따로 확인을 못했네요. 카페 르상스 사운즈한남점에서 음료랑 빵을 몇 가지 주문하고 자리를 찾아봤는데요. 실내에 손님이 꽤나 많아서 여유로운 테라스에 앉기로 했어요. 마침 햇살이 잘 들어서 일광욕하기에도 좋겠더라고요 : ) 곧 날이 따듯한 봄이 오는데, 그때는 테라스 자리에 손님들이 더 많을 듯하네요 ㅎㅎ 남편은 아이스 아메리카노를 주문했어요. 저는 메뉴에 원하는 게 없어서 아쉬운 대로 산펠레그리 리모나타 레몬을 주문했어요. 얼음이랑 컵을 따로 챙겨주셔서 먹기 편했어요~ 그리고 음료 메뉴만큼 엄청 맛있고요 *_* 빵은 소금빵 앙버터, 마들렌, 휘낭시에를 주문했어요. 소금빵이랑 앙버터 두 가지다 좋아하는데요. 둘 다 맛볼 수 있어서 너무 행복했어요 : ) 마들렌은 겉에 탕후루처럼 달달한 것으로 바삭하게 코팅되어 있었어요. 안쪽에는 크림이 들어있고요. 휘낭시에는 무화과가 들어있고요. 마들렌 식감은 촉촉하고 쫀득하니 참 좋았어요. 마들렌은 겉은 바삭하면서 속은 쫀득한 빵의 식감과 마지막에 부드러운 크림까지 너무 좋았어요. 안쪽에 들어있는 크림은 슈크림 비슷한데, 더 풍미가 좋았어요. 소금빵 앙버터는 빵이 굉장히 바삭한데 딱딱한 느낌은 전혀 없어요. 부드러운 바게트 같은 맛이에요. 속에 버터도 아주 고소하고요~ 조합이 끝내줍니다 : ) 남편이랑 기분 좋게 햇살 받으면서 데이트하기 좋았던 카페 르상스 사운즈한남점이었어요. 다음에는 친구들이랑 화이트 와인과 브런치 먹으러 꼭 재방문하고 싶어요 : ) 한남동 브런치 카페 르상스 사운즈한남점 테라스에서 재생 6 좋아요 0 00:00 00:19  접기/펴기 한남동 브런치 카페 르상스 사운즈한남점 테라스에서 #한남동브런치 #카페르상스사운즈한남점 #한남동카페 #한남동베이커리카페 #한남동테라스카페 #한남동커피 #사운즈한남"
한남동 브런치 카페에서 데이트 즐기기 카페 르상스 사운즈한남점,"한남동 브런치 카페에서 데이트 즐기기 카페 르상스 사운즈한남점 안녕하세요 신이나는 여행중인 여행가 이나예요 어제는 오랜만에 한남동 브런치 카페에서 데이트를 즐기고 왔는데요 조용하고 여유로운 분위기의 카페를 발견해서 이웃님들께 소개해드리려고해요 카페 르상스 사운드한남점 영업시간 : 10:00 ~ 22:00 (라스트오더 21:30 휴무 : 없음 주차 : 가능, 발렛파킹 한남동 데이트 50m © NAVER Corp. 카페 르상스 사운즈한남점 서울특별시 용산구 대사관로 35 사운즈 한남 1층 카페 르상스 사운즈한남점은 한남동 대사관 거리에있는 사운즈 한남 1층에 위치해있어요 이태원역과 한강진역 모두 도보 10분거리에 있어서 어느 역을 이용해도 편하게 올 수 있어요 또 주차도 가능해서 매장 이용시에 2시간에 5천원에 가능 한남동에서 주차하기 힘든데 주차걱정없이 이용할 수 있는것도 큰 장점이더라구요 이곳이 바로 요즘 한남동 핫플로 떠오르고 있는 사운즈한남! 왼편으로 파라솔이 보이는 곳이 카페 르상스예요 안쪽에도 입구가 있고 길쪽으로도 별도의 입구가 있어요 들어가기 전에 개나리가 예쁘게 폈길래 사진 한장 남겨보았어요 한남동 데이트 사운즈한남 건물내에 곳곳에 샤넬 광고판이 커다랗게 있더라구요 덕분에 더 력셔리해보인달까 공간 자체가 여유로움이 느껴지는 곳이라 한남동 데이트 코스로 딱이겠더라구요 카페 르상스의 내부 모습이예요 사람들이 많이 있어서 사람없는 쪽만 찍다보니 공간 전체가 보이진 않지만 분위기 보이라고 담아봤어요 재즈음악이 나오는 조용한 분위기의 한남동 브런치 카페였어요 카페르상스의 빵들은 모두 프랑스산 밀가루와 버터를 사용하고 일본식 베이커리 기법들을 활용한 수준 높은 베이커리를 완성시켰다고 해요 기대를 가지고 빵들 구경해봅니다 버터향 가득했던 버터 소금빵들 밀크우유 소금빵, 앙버터 소금빵 오리지널 소금빵 들이 있는데 비쥬얼부터 매우 훌륭 +_+ 일단 빵들이 큼직큼직해서 브런치로도 손색이 없겠다 싶더라구요 종류도 생각보다 많았구요 마들렌과 쿠키도 일반적으로 많이 보던 사이즈와는 다르게 큼직큼직해서 마음에 들었어요 아니 기프트 박스가 고급스런 화장품 상자 같네요 저는 매장에서 빵 먹어보고 너무 고소하고 맛있어서 치아바타 하나 포장했어요 ㅎ 빵과 함께 먹을수있는 올리브 오일과 잼도 있었구요 바게트 러스크와 돈가스 맛집 분지로의 카츠로 만든 카츠산도도 있었어요! 그 외에도 다양한 빵들이 있었어요 한남동 데이트 카페를 둘러보니 와인 종류도 많더라구요! 와인은 평일 17시 이후, 주말에는 종일 주문이 가능하다고해요 저는 평일 이른시간에 방문해서 와인을 마시진 못했지만 따뜻한 햇살있는 테라스에서 와인한잔 하면 딱이겠더라구요 구경을 마치고 주문을 했는데요 빵을 몇개 고르고 음료를 주문했어요 저는 핫플에 오면 그 가게의 시그니쳐 메뉴를 꼭 먹어보는데요 르상스 크림커피가 시그니쳐인것같아 주문해 보았어요 참고로 제패니스 티는 일본 차 장인인 오가아 타유키의 차를 사용한다고 해요 +_+ 재료 하나하나 신경쓴 느낌이나네요 짠 주문한 빵과 음료가 나왔어요 르상스 크림커피와 카페라떼 그리고 스금빵 오리지널, 초코마들엔, 그리고 황치즈 쿠키! 소금빵은 통통하고 버터 풍미 가득했고 황치즈 쿠키는 일단 크기도 크고 비쥬얼만 봐도 치즈 듬뿍들어간 느낌 한입만 먹어도 치즈 풍미가 진해서 아메리카노와 먹으면 딱이겠더라구요 초코 마들렌은 초코를 못먹는 저에게는 너무 달았지만 초코 좋아하는 제 친구는 박수치며 먹더라구요 베이커리들이 모두 재료가 좋고 재료를 아끼지 않는게 느껴졌어요 모처럼이니 테라스에 자리를 잡았는데요 라떼는 원두를 선택할 수 있었는데 클래식으로 주문했더니 고소하고 깊은 풍미의 라떼라 빵들과도 잘 어울렸어요 대망의 르상스크림라떼는 경과류 크림이 들어가서 고소하고 부드러움의 끝판왕!!! 이거 너무 맛있네요 >< 괜히 시그니쳐 메뉴가 아닙니다 ㅠ 선선하니 기분좋아서 테라스에 사진만 수십장 찍은거 같아요 ㅎ 한남동 브런치 카페 르상스에서 데이트 즐기기 재생 12 좋아요 0 00:00 00:35  접기/펴기 한남동 브런치 카페 르상스에서 데이트 즐기기 테라스 분위기 느껴보시라고 영상으로 담아봤어요 지나다니는 사람도 많아서 찍는데 제약이 좀 있었지만 재즈음악 흘러나오는 테라스에서 커피한잔, 와인한잔 하면 얼마나 기분좋게요? >< 카페 내부에서 테라스를 보면 이런 느낌! 따수운 느낌의 공간이라 분위기 좋은 곳에서 모임을 하고싶다면 카페르상스로 나들이 와도 되겠더라구요 오늘은 한남동 핫플인 사운즈한남의 브런치 카페 르상스를 소개해드렸는데요 베이커리 뿐만 아니라 커피, 차까지도 좋은 재료를 엄선해서 만드는 곳에 여유로운 분위기의 카페였어요 테라스에 앉아있으니 많은 분들이 강아지를 데리고 산책하는 모습을 볼 수 있었는데요 유럽의 노상카페에 앉아있는 기분이 들어서 이국적이고 좋더라구요 한남동 브런치 카페 찾는다면 카페 르상스 방문해보세요! 그럼 또 좋은 후기 가지고 돌아올게요 안녕!"
한남동 카페 와인과 함께 연말 데이트 르상스 사운즈에서 즐기기,"한남동 카페 추천 르상스 사운즈 한남 와인과 함께 연말 데이트 즐기기 카페 르상스 사운즈 한남 * 주소 : 서울 용산구 대사관로 35 사운즈 한남 1층 * 영업시간 : 매일 10:00 - 22:00 라스트오더 21:30 * 전화번호 : 02-794-9009 주차가능, 배달/포장 가능 카페 르상스 주차도 가능하니 참고하세요! 11월이 되니 연말 분위기가 점점 느껴지는데요. 오랜만에 한남동 카페 르상스 사운즈에서 연말 데이트 느낌 뿜뿜 느끼고 왔어요. 와인과 샐러드 & 베이커리 조합 넘 좋았답니다~ 한남동 카페 르상스 사운즈는 한남동의 랜드마크인 '사운즈한남' 건물 내에 소재한 모던 베이커리 테라스 카페로, 럭셔리한 건물의 테라스에서 브런치, 커피, 화이트와인을 여유로운 분위기에서 연인과 가족 그리고 애견도 함께 즐길 수 있는 카페더라구요. 야외좌석이 있어서 반려동물과 함께 방문하신 분들도 많이 보였어요. 카페 르상스 사운즈 한남은 내부와 외부 모두 좌석이 마련되어있어요. 날씨 좋을때 바깥좌석 앉으니까 넘 좋더라구요~ 인생샷 찍기도 좋음! 특히 테라스에서는 분지로의 돈카츠를 활용한 카츠산도, 올리브&하몽을 비롯한 브런치들과 함께 화이트와인을 즐길 수 있어 분위기 있는 모임을 가지기 좋아보였고 브런치류 베이커리 또한 즐길 수 있으니 친구들이랑 모임장소로도 좋고, 연말 데이트 코스로도 추천하기 좋겠더라구요. 저흰 음료는 와인을 마시기로 했고 부라타 무스 샐러드와 빵 종류를 골랐답니다. 커피나 논커피음료, 차 종류도 다양하게 있구요! 세계 3대 원두인 인텔리젠시아 원두 및 일본 장인이 직접 재배, 선별하는 녹차를 제공한다고 하니 음료 고르실때 참고하시면 좋을 것 같아요:) 베이커리 종류도 다양하죠~ 고르는 재미가 쏠쏠해요~ 프랑스산 밀가루와 버터를 사용해 빵에서 더 깊은 풍미를 느낄 수 있고, 일본식 베이커리 기법들을 활용해 베이커리 자체의 퀄리티를 높였다고 합니다. 저희는 빵은 우유크림먹물소금빵과 잠봉뵈르바게트를 주문했어요. 물이랑 전자레인지는 따로 준비되어있습니다. 빵을 직접 데워먹을 수 있더라구요. 빵을 골라서 돌아오니 와인과 샐러드가 셋팅되어 있었어요. 연말 분위기 뿜뿜! 저는 물론 이번에도 포카샷 & 인형샷을 갈겼답니다. 인증샷 찍기 넘 좋아요~ 예쁜 사진을 많이 건질 수 있는 한남동 카페랄까요. 으른으른한 만남해보자고 한남동에 갔는데 만족스러웠던 연말 데이트였어요. 부라타 치즈 무스 & 마리네이트 토마토 & 하몽이 들어간 부라타 무스 샐러드 입니다. 재료들이 잘 어울리더라구요👍치즈와 토마토의 조합! 하몽은 오랜만에 먹었는데 짭짤한 맛이 아주 좋았어요. 샐러드와 와인의 조합이 최고였습니다👍 조명 아래 샐러드와 인형들의 떼샷..jpg 전체샷도 한번더~ 우유크림 먹물 소금빵은 이름 그대로 크림과 소금빵의 조합이어서 단짠단짠을 제대로 즐길 수 있었구요, 잠봉뵈르도 너무 딱딱하지도 않고 와인이랑 잘 어울리는 메뉴였어요. 서로 짠~ 학교 밖에서 같이 식사하러 나간건 처음이라 더 기대되었던 한남동 카페 데이트 만남이었쥬~ 담에 또 즐기러가보작우요! 우리 마크가 모델인 폴로랄프로렌도 괜히 한컷...💚 50m © NAVER Corp. 카페 르상스 사운즈한남점 서울특별시 용산구 대사관로 35 사운즈 한남 1층"
