title,content
한남동 카페 아우프글렛ㅣ이집 크로플은 100개도 먹을 수 있어,"크로플로 유명한 한남동의 아우프글렛,, 카페인데도 웨이팅이 있어서 세번째 방문만에 들어갈 수 있었다. 아우프글렛, Aufglet 위치 : 서울 용산구 이태원로54가길 20 영업시간 : 12:00-21:00 sns : https://instagram.com/aufglet?igshid=NDk5N2NlZjQ= AUFGLET(@aufglet) • Instagram 사진 및 동영상 팔로워 26K명, 팔로잉 1명, 게시물 1,463개 - AUFGLET(@aufglet)님의 Instagram 사진 및 동영상 보기 instagram.com 일단 세번째 트라이만에,, 온 거라서 굉장히 기대하고 방문했다. 외관은 통유리로 된 깔끔한 분위기이다. 생각보다 간판이 잘 보이지 않아서 놓칠뻔ㅎ 내부 역시 매우 깔끔하고 블랙 인테리어로,, 톤온톤 바이브 근데 자리가 많지 않고 안쪽면은 통거울이었다. 그래서 살짝 복잡하고,, 암튼ㅋ 가보면 알것ㅠ 좌석은 좁아서 조금 불편했다. 가격대는 메뉴판을 참고하면 되는데 참고로 1인 1메뉴이고 디저트는 포함 안된다ㅠ 에휴~~! 여기는 근데 저 케이크가 엄청 유명한 것 같다. 비쥬얼부터 눈길을 사로잡고 마카롱도 꼬끄 자체의 디자인이 굉장히 예뻤다. 케이크 포스터도 있는걸 보니 여기의 시그니쳐 메뉴인듯하다. 그런데 나는 왜 크로플 맛집으로 알았지? 암튼 우리가 먹은 아메와 크로플. 크로플은 기본 아이스크림이 올라가는 듯 하다. 크로플도 진짜 너무 맛있었는데 위에 있는 아이스크림이 미친넘임; ㄹㅇ 크로플 맛집에 웨이팅이 있을 법 하다ㅠㅠ 크로플은 엄청 바삭하고 속도 촉촉 쫀득하다. 근데 아이스크림은 완전 쫀득; 첨에 비쥬얼로만 크림인줄. 저 아이스크림만 따로 안팔아서 다행이다. 안그랫으면 저 아이스크림으로만 100키로 쌉가능 ㅠ 웨이팅은 이렇게 이름 인원을 써두면 기다리는 방식이다. 연락이 오거나 테이블링이 있는 건 아니다.. 운 좋게 들어가서 다행인듯. 예전부터 오고싶었던 곳이었는데 가격이나 좌석 조도등의 문제로 경험해본것으로 만족이다. 맛은 충분히 있었고 디저트의 디자인?도 굉장히 예뻤다. 하지만,, 불편한 부분이 있어서 굳이 다시 찾아가진 않을 것 같다. 개인적인 인테리어 선호도 차이로 재방문은 안할 것 같지만 디저트의 퀄리티 자체는 100점이었다! 아이스크림이 올라간 크로플은 시럽 크로플 아이스크림 3박자가 완벽했다. 케이크는 비쥬얼적으로 훌륭해서 이건 다음에 홀케이크로 픽업은 해볼 수 있을 것 같다! 재방문 의사는 없지만 재구매 의사는 있는 ㅎ; 한남동에 방문해서 디저트 맛있는 곳을 가고싶다면 여길 추천한다! 다만, 금요일저녁이나 주말엔 웨이팅이 있을 수 있으니 참고! 별점 : 5/5 (맛은 5/5지만 흠,, 좌석등이 불편해 전체적으론 3/5) 50m © NAVER Corp. 아우프글렛 한남 서울특별시 용산구 이태원로54가길 20 1층"
20230331-한남동 카페 아우프글렛 도산점 AUFGLET /마지셔우드 팝업스토어 margesherwood 키링자판기,"짜잔! 오늘은 점심시간에 한남동을 다녀왔다! 날씨 너무 좋아~~~~~ 친구가 갖고 싶다고 한 키링을 찾으러 아우프글렛 한남점을 다녀왔다!! 꺄아아아 멀리서 봐도 느무 귀엽다! 바로 이게 마지셔우드의 키링 자판기구나 엣헴 여기 카드를 꽂고 번호를 입력하면 데굴데굴 굴러서 밑으로 톡! 떨어진다. 뭔가 쫌 더 귀엽게 생겼던 22번 키링을 선택해서 뽑았다! 몽츙하게 생긴 게 진짜 귀엽구낭 나도 살까 잠시 고민했지만 난 더 멍충한 귀여운 키링을 사서 참았다! 언줴와여~~ 우드 자판기에서 키링을 뽑으면 안에 럭키 티켓이 들어있다! 행운의 티켓! 럭키 1번은 우드 라테를 카페 안에서 교환 할 수 있다 귀여워.. 1 귀여워.... 귀여워.. 2 인증샷 철컥.! 아우프글렛 메뉴우~ 마지셔우드 가방 키링 이렇게 마지셔우드 가방에 우드 키링을 달아준다! 진짜 입틀막.. 넘귀욥 하찮아..❤️ 그냥 라테인 줄 알았는데! 크림 라테였다.. 나 크림 라테 넘 좋아하잖아 으뜨케..~~~ 잘먹을궤~ 귀여운 스티커 저거 떼서 노트북에 붙이고 싶었다.. 크림위에 달고나 같은 것도 올라가있다 맛있어~~!!! 점심시간 30분 동안의 짧지만 긴 일탈+ 자처한 셔틀 아우프글렛 도산점에서 4월 2일 남은 이틀!! 토요일 일요일 마지셔우드의 제품들과 귀여운 키링도 구매하고! 아우프글렛의 맛있는 커피도 한잔하면 너무 좋을 것 같다! 커피 넘 맛있당😆 AUFGLET(@aufglet) • Instagram 사진 및 동영상 팔로워 27K명, 팔로잉 1명, 게시물 1,477개 - AUFGLET(@aufglet)님의 Instagram 사진 및 동영상 보기 instagram.com Margesherwood(@margesherwood_official) • Instagram 사진 및 동영상 팔로워 140K명, 팔로잉 111명, 게시물 879개 - Margesherwood(@margesherwood_official)님의 Instagram 사진 및 동영상 보기 instagram.com 50m © NAVER Corp. 아우프글렛 한남 서울특별시 용산구 이태원로54가길 20 1층 하트시티에 사는 마지셔우드의 캐릭터 ""우드""가 자판기를 타고 아우프글 렛 한남점에 상륙합니다! 아우프글렛 한남점에서만 보실 수 있는 우드자판기와 우드 메뉴를 만나보 세요 (한정기간, 우드구매고객에 한함) 아우프글렛 한남점에서만 보실 수 있는 우드 자판기에서 우드 구매가 가능하며 (1인 2개 한정) , 모든 구매 고객께 아우프글렛에서 우드 메뉴를 교환할 수 있는 ""럭키 티 켓”을 증정해 드립니다 기간 : 3/30 (목) 12PM ~ 4/2(일) 8PM 장소: AUFGLET 한남점, 서울 용산구 이태원로54가길 20 1층 • 구매 방법 1) 아우프글렛 한남점 입구에 비치된 우드 자판기에서 우드 구매 2) 우드박스 안에 있는 ""럭키 티켓"" 확인 3) 매장 안에서 ""럭키 티켓"" 제시 4) 티켓에 기재된 행운 번호에 해당하는 우드 메뉴와 교환 • 우드 메뉴 LUCKY 1 - WOOD LATTE LUCKY 2 - WOOD LATTE + Canelé 1 LUCKY 3 - WOOD LATTE + PETITE CAKE 1 *1인 1회 2개씩 구매가능 *자판기에서 구매하신 우드는 교환/반품이 어려우니 신중한 구매 부탁드 립니다. *준비된 우드 수량이 소진 시, 행사가 조기종료될 수 있습니다. *럭키티켓은 수령하신 당일만 사용 가능합니다. *럭키티켓은 우드와 함께 박스 속에 랜덤으로 들어 있습니다. *우드는 100% 핸드메이드로 제품마다 약간의 사이즈 차이가 있습니다. https://instagram.com/margesherwood_official?igshid=YmMyMTA2M2Y= 이제 회사로 돌아가 보자 😆 오늘 이야기 끝!!!! #카페 #카페추천 #서울 #한남동 #한남동카페 #이태원 #아우프글렛 #아우프글렛한남점 #라테 #margesherwood #마지셔우드 #팝업스토어 #마지셔우드키링 #키링 #가방 #가방추천 #우드자판기 #럭키티켓 #메뉴 #데이트 #여행"
"한남동 아우프글렛 X 헤라 콜라보 팝업스토어 방문기! (웨이팅, 굿즈후기 등)","1000m © NAVER Corp. 아우프글렛 한남점 서울특별시 용산구 이태원로54가길 20 1층 아우프글렛 연남점 서울특별시 마포구 성미산로31길 11 AUFGLET 아우프글렛 금호점 서울특별시 성동구 독서당로51길 7 1층 안녕하세요, 세니입니다 이번 포스팅은 아우프글렛 X 헤라 콜라보 팝업스토어 방문기를 적어볼게요 ! #aufglet #hera #000000 익숙함 속에서 새로움을 발견하고 교류하는 두 브랜드가 만나 나만의영역 (SCENE)을 발견하고 공유까지 하는 SCENE # 000000 프로젝트를 선보이는 팝업스토어를 열었다고 합니다 ◡̈ #헤라 자신만의 취향과 방식으로 나만의 아름다움을 발견하고 ‘나다움'을 표현하는 블랙 쿠션처럼 익숙함이라는 진부한 틀에 구속되지 않고 늘 새로운 창의성을 전개하는 브랜드 헤라. #아우프글렛 카페를 매개체로 다양한 문화의 교류를 통해 익숙함 속에서 새로움을 발견하고 MZ 컬쳐 트렌드를 선도하는 복합 문화 공간 아우프글렛. 건축, 인테리어, 패션 디자이너, 바리스타 등 다양한 분야의 대표가 만나 탄생시킨 힙 플레이스. 2022년 4월 1일부터 30일까지 한달간 아우프글렛 한남점에서 이 둘의 스토어가 열립니다 연남, 금호점에서도 헤라 블랙쿠션 콜라보 행사가 열리고, 헤라블랙세트는 한남점에서만 만날 수 있다는 점 참고로 저는 지난주 일요일에 방문했어요 ◡̈ 확실히 오픈한 주말이었어서 많은 사람들이 웨이팅을 하고 있었고 누가봐도 핫플느낌 ! 🥺 🖤 🤍 헤라 X 아우프글렛 굿즈들 너무 너무 예쁘지 않나요 ,, 블랙감성 ,, 얘땜에 4월달에 아우프글렛 꼭 가야됨 아우프글렛 웨이팅, 포토존, 굿즈 등에 대해서 자세히 리뷰했으니 방문 전 참고하기 좋을거에요 ! 이 씬넘버코드는 아우프글렛 (한남점) 매장 밖에서부터 크게 보이더라구요 ! 참고로 SCENE # 000000(씬 넘버블랙) 은 블랙의 컬러코드로 나만의 영역을 새롭게 발견하고 공유하는 프로젝트라고 합니다 ! 아우프글렛 한남점 메뉴판. 지금 헤라와의 콜라보 행사기간동안 판매하는 ' 헤라블랙세트 ' 🖤 :: 가격은 ₩22,000 :: ⬇️ 1. 쁘띠 블랙 케이크 2. 음료 (3가지 중 2잔 선택) - 아메리카노 핫/아이스 - 라떼 핫/아이스 - 허브티 핫/아이스 3. 헤라 미니 블랙쿠션 2개 * Notice_ 헤라블랙세트 * - 행사기간에만 특별히 판매된다는 점. - 500세트 한정수량 판매로 조기품절 가능. 주문하는 곳, 카운터 옆에 굿즈템들, 케이크가 디피되어있어요 여기서도 감성샷 몇장 씩 찍어주는 코스 ! 1,2 - 큰 케이크 / 3 - 미니 케이크 (쁘띠) 케이크는 쁘띠 블랙, 쁘띠 화이트. 크런키같은 질감의 초콜릿으로 덮힌 케이크 종류였고 ! 나름 신기한 비주얼이라 한번쯤 먹어보기 좋겠더라구요 게다가 이번 행사기간에만 판매하니,, 그냥 지나칠 수가 없겠죵 아우프글렛 X 헤라 콜라보 이 조합 생각보다 넘 잘어울렸어요 흥해라 흥해 🖤 - 알면 좋은 정보 ! 올 4월 한달간 전국 백화점 및 아모레퍼시픽공식몰에서는 헤라블랙쿠션 구입 시 아우프글렛의 감성을 담은 컵과 플레이트 등의 굿즈를 증정한다고 합니다 ♡(˃͈ દ ˂͈ ༶ ) 저는 주말/오후 3시쯤 방문했구요 위 사진처럼 아우프글렛 출입문 앞에 웨이팅 줄이 쭉 있었답니다 아우프글렛에서 4시쯤 나왔었는데 여전히 웨이팅이 있었구요 ,, 🔥 핫플은 평일 방문 적극추천 ! 이 스팟은 매장입구 들어오면 딱 보이는 모습들이에요 동영상부터 포스터까지 헤라와 아우프글렛 각각의 감성 모두 잘 담겨있어서 뜨억했던게 기억납니다 HERA x AUFGLET 재생 0 좋아요 0 00:00 00:05  접기/펴기 HERA x AUFGLET 그리고 열일 중이신 직원분들 웨이팅 안내부터 주문까지 정말 친절하게 응대해주셔서 핫플에서 기분좋게 있다 왔어요 ! 저는 바로 요 자리에 앉았는데요 2층 벽거울 부근에 있는 4인석 자리. 구석 자리여서 아주 좋았어요 ! 아우프글렛 진동벨이구요 카페 내 많은 사람들이 계셔서 주문이 다소 늦게 나올 걸 인지하고 열심히 이곳저곳 사진을 찍어봅니다 ! 바로 이 QR ! 휴대폰으로 이 큐알인식을 하면 플레이리스트를 비롯해 콜라보 내용이 담겨있고 Apmall 링크를 연결해 블랙쿠션 쇼핑이 가능해요! 바로 아래 링크로 넘어간답니다 ◡̈ 헤라 '블랙쿠션 X 아우프글렛' 기획전 2022-03-31 ~ 2022-04-30 m.amoremall.com 아우프글렛 한남점 홀 모습. 사람들로 가득하죠 ㅎㅎ 그리고 매장에서 흘러나오는 음악들 선곡도 좋았는데요 🎵 헤라와의 콜라보와 어울리는 무드로 아우프글렛이 직접 선곡한 리스트라고 해요 ! 이 콜라보와도 잘 어울리셨던 모델분 ! 여기저기 돌아다니며 사진찍다보니 마침 진동벨이 울리더라구요 © 2022 럽유센. All rights reserved. 짜잔 예쁘게 플레이팅 해주셨어요 ! 확실히 여러 분야의 대표가 만나 탄생시킨 카페인만큼 센스와 트렌디함 최고 사실 이대로 사진찍어도 좋을 듯 했지만 저만의 감성에 맞게 여러 구도로 찍어봅니당 © 2022 럽유센. All rights reserved. :: 헤라 블랙세트 :: 우선 저는 음료주문을 커피 1잔, 티 1잔 주문했구요 - 아메리카노 - 블루베리 루이보스 © 2022 럽유센. All rights reserved. 소문대로 커피 맛도 좋고 블루베리 루이보스 티 맛도 굿 엄마랑 같이 갔었는데 어머니가 좋아하실 것 같다고 직원분이 추천해주신 메뉴였어요 © 2022 럽유센. All rights reserved. 기분좋은 패킹이더라구요 🖤 © 2022 럽유센. All rights reserved. 헤라 미니쿠션과 쁘띠 블랙 케이크 ! 이렇게 포토존도 따로 마련되있는데요 아우프글렛의 블랙감성의 내부를 그대로 담을 수 있는 원형 거울입니다 ◡̈ 제가 방문할 당시엔 사람들로 가득차서 예쁘겐 안담기더라구요 흑흑 ㅠㅠ 그래서 방문샷이라도 찰칵 ,, 이 포토존에서 건지려면 무조건 평일에 방문해야겠죠 ? 아쉬운대로 사람없는 이 스팟에서라도 살짝 찍어봤어요 ! 아우프글렛 글씨와 씬 넘버블랙 살짝 보이는 곳에서 한 컷 🖤 / 쁘띠 블랙 케이크는 배가 불렀어서 집에서 먹으려고 그대로 가져왔었어요 ෆ̈ 그래서 헤라 X 아우프글렛 굿즈들과 케이크 맛 리뷰를 바로 또 적어볼게요 ! © 2022 럽유센. All rights reserved. 집에서 (나름) 예쁘게 디피해본 아우프글렛 쁘띠 블랙 케이크 공개! © 2022 럽유센. All rights reserved. 사이즈는 위 사진처럼 미니사이즈의 원형 케이크이구요 © 2022 럽유센. All rights reserved. 기분전환할겸 제공된 촛불도 켰어요 매장에서 직원보고 불 켜달라고하시면 켜주시니까 매장이용때 참고부탁드려요 ◡̈ 케이크 안에는 라즈베리 잼(?) 가득, 초코, 딸기크림과 생크림이 듬뿍 들어가있었어요 잼 맛이 강한 케이크여서 평소 잼이나 단 디저트 좋아하시면 한번 드셔보기를 추천합니다 ! © 2022 럽유센. All rights reserved. 굿즈는 이렇게 배송이 왔습니다 🖤 ✔️ 헤라 블랙 쿠션 ✔️ 플레이트 ✔️드립백 3개 ✔️ 컵 드립백은 총 3개 ! 가장 맘에 들었던 굿즈는 바로 이 컵 ! 아이스는 완전 시원하게 핫은 완전 뜨겁게 마실 수 있는 소재라 일상생활 속 애용할 컵이었습니다 카페에서 이미 받았던 헤라 미니 블랙쿠션 2개와 일반 블랙쿠션 1개가 더 왔어요 ! © 2022 럽유센. All rights reserved. 이 헤라 블랙쿠션은 매트커버가 초밀착 피팅되어 무결점 피부표현이 지속되는 쿠션입니다 게다가 자외선 효과는 덤덤덤 초미세먼까지 흡착 방지효과가 있어서 요즘같은 코시국에도 좋을 것 같아요 워낙 좋기로 유명한 헤라쿠션이라 긴 설명이 필요없죠 ,, 🖤 미니랑 본품 크기 비교샷. 쿠션컬러는 총 10가지에요 색상구성은 헤라 홈페이지 참고해주세요! 컵 다음으로 플레이트에 반했는데요 다만 접시소재가 스테인이라 조금은 무게감이 있었답니다 근데 이게 매력 😙 조만간 디저트 사와서 이 접시에 올려두고 먹어야겠어요 ! 커피는 바로 타먹어버리기 ☕️ 아우프글렛 매장에서도 커피가 맛있더니 드립백도 적당히 고소하니 맛있었어요 ! 아우프글렛 외관도 예뻐요 저처럼 외관샷도 찍으시는걸 강추해요 되도록이면 평일방문 추천하구요 주말에 방문하시려면 오픈시간대 가는걸 추천 ! 그리고 인스타 이벤트 진행 중이랍니다 ◡̈ 포스팅 내용 외 궁금사항은 댓글문의 🖤 #아우프글렛한남점 #아우프글렛x헤라 위 포스팅은 제품과 서비스만을 제공받아 솔직하게 리뷰작성을 했습니다."
한남동/한강진 : 아우프글렛_AUFGLET,"AUFGLET 아우프글렛 한남점 서울특별시 용산구 이태원로54가길 20 1층 . . 며칠 안남은 4월의 여유를 즐기기위해 (=걍일하기싫음) 모닝포스팅을 해봅니다 'ㅅ'/ 지난번 신사장님이랑 같이 갔던 한강진 포스팅 드디어 시작ㅎㅎ 이 날 무조건 아우프글렛 가는걸로 하고 만난거라 밥 먹고 바아아아로 아우프글렛으로 왔다. 도대체 어디에 생긴건가 했드만 생각지도 못했던 골목에 생겼자나? 웨이팅 있을거라 생각했는데 역시 예상은 틀리지 않았구요,, 그래도 다행히 한 15분? 정도 기다리다 들어갈 수 있었다. 바깥에 있던 아랄리아 이제 식물만 보이면 눈을 떼지 못하는 1인,, 2층으로 안내받고 올라갔는데 남아있던 몇 자리가 써억 - 맘에 들지 않는 것,,, 일단 그래도 자리를 잡고 주문하러 1층에 내려왔는데 마침 4인 테이블 하나가 비어서 신사장님이랑 빠르게 그 자리 차지하고 앉았다 희희 생각보다 폭신해서 좋았는데 저 등받이가 자꾸 인사해서 쩜 불편; 아우프글렛 본점갔을때는 못봤던 홀케이크도 있었다. 좀전에 인스타 들어가서 둘러보니,,맛있을것같아,, 사실 생긴건 맛있게 생기진 않음,,,, 아무튼 신사장님 앉혀놓고 내 맘대로 먹고싶은거 다 시키기 ~ ! 크로플 당연하고 내 최애 디저트인 크렘브륄레까지 주문 너의 세심한 터치✨ 하 먹고싶다 아우프글렛 가고싶다!! 가고싶으니까 메뉴 하나하나 클로즈업 한 사진 올려보아요 개인적으로 아우프글렛 크로플이 제일 맛있다. 처음으로 먹어본 크로플이 여기꺼여서 그런건지는 모르겠지만 가끔 크로플 먹고싶어서 카페에서 시켜먹어보면 이 맛이 아니야,, 그리고 크렘브륄레 -3-♡ 제시카키친가면 애들한테 크렘브륄레 하나씩 가져와서 내 앞에 놓아달라고했었는데 (그렇게 한번 가져오면 8개 쌓임) 그렇게 원없이 먹을 수 있었을때가 좋아찌,, 신사장님 자꾸 ""와 이거 뭐야? 에그 뭐라고?"" ㅋㅋㅋㅋㅋㅋㅋㅋㅋㅋㅋㅋㅋㅋㅋㅋㅋㅋㅋㅋㅋㅋㅋㅋㅋㅋㅋㅋ 커피도 맛있꾸 아니 2년? 3년? 동안 한번도 안만나고 간간히 전화로 근황만 얘기하다가 만나기전에 1시간 넘게 전화로 그간 각자 겪은 풍파 다 얘기해놓고 만나서는 온통 딴 얘기만 하고 옴ㅋㅋㅋㅋㅋㅋㅋ 그치만 보통 인연 아닌 우리 둘, 참 좋으다 신사장아♥ 나랑 또 아우프글렛 가주라 신사장아 알찌?"
[ 뮤지컬 규현 주연 '프랑켄슈타인' / 한남동 '오복수산' / 한남동카페 '아우프글렛' 후기 ],"평일 휴무 좋은점 중 하나! 주말 보다는 조금 여유로운 휴무를 즐길수 있다. 이 날도 아침부터 부지런히 움직인 하루! #직장인휴무 겸둥이 소개로 이제야 정착하게 될 미용실을 찾았다! 원래 찾아가던 여자 디자이너 선생님이 계셨는데 예약이 다 마감되서 다른 남자 선생님께 머리 컷을 받았다. 여기는 어느 선생님께 머리를 맡겨도 만족도 최고! ✔️오늘 예약한 시술 : 스켈링컷 ( 40,000원) 소요시간은 대략 한시간 정도 걸렸다. 두피 스케일링을 해서 그런지 되게 시원하다! 묵은 두피의 기름?! 들이 씻겨 내려가는 느낌! 한 달에 한 번 정도 정기적으로 받는거 추천! #서앤강헤어 대학생때 부터 긴 머리 스타일을 유지했는데 이번엔 머리를 중단발로 잘라봤다! 서울가는 버스 안 ~ 이렇게 많이 자른 적은 처음이라 처음엔 어색했는데 아침에 머리 손질하기도 쉽고 해서 만족 중이다. #중단발 프랑켄슈타인 뮤지컬 오늘 유니 언니랑 만난 주요 목적!!! 나의 네번째 뮤지컬을 보러 왔다. 규현과 박은태 주연의 ''프랑켄슈타인' #프랑켄슈타인뮤지컬 #블루스퀘어신한카드홀 벌써 시간이 날때마다 보러오는 나의 네번째 뮤지컬! 역시 성공적이었다 ㅠ 뮤지컬이라는 취미생활은 정말 복잡한 일상생활에서 벗어나 아무생각도 안나게 해주는 마법. 잠시나마 현실세계에서 벗어나게 해준다! 규현님 노래도 되게 좋아하는게 뮤지컬을 할때랑 발라드를 부를때랑 느낌이 아예 달라서 더 매력적으로 느껴졌다. 그리구 이렇게 연기를 잘한다구요,,,?! 규현님의 새로운 발견과 뮤린이인 나에겐 앙리역할을 맡은 박은태라는 배우의 새로운 발견이었다! #프랑켄슈타인규현박은태 한남동 오복수산 원래 가려고 했던 음식점이 있었는데 부득이하게 갔다가 다시 나오는 사태 발생 ^^ 급하게 다른 음식점을 서치하다가 발견한 #한남동오복수산 오복수산은 체인점으로 한남동에도 위치해 있다. 네이버 평점은 4.42! 갱쓰 평점은 ⭐️⭐️⭐️⭐️ 가게 내부에 좌서이 많은 편은 아니고, 역시 맛집이라 그런지 웨이팅이 있었다. #오복수산메뉴 ✔️난 특선 카이센동 ( 카이센동 + 성게소, 연어알, 게살 ) : 29,000원 을 주문했다. 언니가 주문한거 까먹었다 ㅠㅠ 이래서 사진을 찍어 와야해! ㅠ 음식은 꽤 빠르게 나왔다! 비쥬얼 부터가 사진 예쁘게 찍고 싶어지는 센동! #카이센동먹는법 밥에 회를 얹어서 초밥처럼 해서 먹으면 된다. 비린맛도 안나고 되게 신선했다! 언니가 이야기 하면서 먹다가 또 호로록~ 회가 먹고 싶을 때 종종 생각 날거 같은 집이다~ 한남동카페 아우프클렛 밥 먹고 카페를 안갈 수가 없지! 커피 귀신둘 ~ ☕️ 지나가다가 예쁘다고 생각했던 카페 다시 찾아서 돌아온 둘~ 역시 실내도 한냄동 스탈~ 🖤 #한남동카페 #아우프글렛 언니가 여기는 크로플 맛집이랬다. 밥먹고 와서 배부른데 또 안먹어 볼 수 없지 ! ㅎㅎ ✔️난 크림커피 : 7,000원 ✔️언니는 라떼였나?! : 5,000원 ✔️크로플 : 9,000원 까지! 아우프클렛 크림커피도 넘 맛있었구, 크로플도 맛있었다 ㅠ 분위기도 커피랑 디저트도 모두 예쁘고 맛있었던 곳 ⭐️⭐️⭐️⭐️⭐️ #아우프글렛한남 카페 오기전에 포토이즘에서 사진찍었는데 현실 우리얼굴에 당황 ^^ 역시 인생네컷이 최고인거 같다ㅎㅎ #포토이즘한남동 유니언니의 깜짝 선물 🥰 넘넘 귀여운 언니랑 커플 파우치! 예쁜 마음 넘 소중하고 감사하다💗 우리 해피뉴이어야~ #파우치 #선물 요렇게 알찬 서울 나들이 끄읕! 리프레쉬였다! 온냐~ 아주 잘쓰고 있오!! 고마왕 🥰"
[한남동] 한강진역 카페 아우프글렛 한남 :: 크로플 맛집,50m © NAVER Corp. 아우프글렛 한남점 서울특별시 용산구 이태원로54가길 20 1층 한남동 카페 Aufglet 아우프글렛 아우프글렛은 국내에 최초로 크로플을 선보인 카페라고 한다 감각적인 인테리어 소품 아우프글렛은 케이크도 엄청나게 힙한데 인스타그램에 판매 공지가 뜬다 빠-빨간맛 궁금해 허니 이 케이크는 발렌타인데이 케이크로 2월 14일까지 판매 했다 주인을 기다리고 있는 케이크가 가득했다 주문 하는 곳 까눌레도 먹고 싶었는데 안된다고 하셨다 2층으로 올라가면 좌석이 많다 벽면이 거울로 되어있어서 엄청 넓어보인다 바깥을 볼 수 있는 창가 좌석이 인기있다 검정색 스피커에서 힙한 노래가 빵빵하게 나와서 책을 읽거나 집중해서 뭘 하기는 힘들다 검정색 테이블과 의자라니 완선 신선하다 위에 사진보다는 이 사진이 제일 실제 느낌이다 차갑게 느껴지는 이 공간 크로플은 아주 맛있었다. 역시 원조는 달라. 위에 올라간 아이스크림도 엄청 쫀~득 쫀득 빨리 안먹으면 다 녹아버려서 빨리 먹어치워야한다 논픽션이랑 무슨 사이지? 화장실에 핸드워시도 논픽션 상탈크림 핸드워시였다 키링도 팔고있다 라이터도 팔고있다 2천원이었다 한남동 한강진역 카페 아우프글렛 내 최애카페 월요일 1시였음에도 불구하고 만석이었어서 자주 가기는 힘들다 저녁에는 와인바로 운영된다고 한다 #한남동카페 #한강진역카페 #크로플맛집 #아우프글렛
