title,content
서울 한남동 테라스에서 브런치와 와인을 즐길 수 있는 카페 르상스 사운즈한남점,"카페 르상스 사운즈한남점 서울특별시 용산구 대사관로 35 사운즈 한남 1층 카페 르상스 사운즈한남점 매일 AM 10:00 - PM 22:00 라스트오더 PM 21:30 * 주차는 지하주차장에서 발렛가능 카페 이용시 2시간에 5천원! 카드결제만 가능. * 이태원역, 한강진역 3번출구에서 도보 10분 이용 가능. 저번 주말엔 오랜만에 한남동에 다녀왔다. 전부터 와보고싶었던 #카페르상스 에 방문했는데, 주말 점심쯤이였는데도 주차도 수월하고 사람도 많이 없었다. 카페르상스는 베이커리와 커피, 와인과 핑거푸드 그리고 스페셜 티 까지 일상에서의 즐거움과 여유를 전하 복합문화공간 이라고 소개되어 있다. 카페 르상스는 사운즈한남 상가 안에 입점해있는데, 여러 상가가 많아서 카페도 가고, 식사도 하고, 쇼핑도 하고, 데이트 장소로 딱 인 곳이다. 테라스도 잘 되어있는데 이 날 햇빛은 좋았으나, 바람이 넘 많이 불어서 앉아있진 못했다. 그래도 앉아계시는 분 몇분은 계셨으니 눈치보지 말고 이용해도 될 듯! 얼른 날씨가 더 따뜻해졌음 좋겠네.. 카페로 들어가는 입구 앞에도 테라스 자리가 잘되어 있다. 카페 내부는 그리 크지 않으나 좌석이 알차게 있음ㅋㅋ 조금 좁아서 답답 할 수 있을 것 같다. 벽쪽으로 쇼파 테이블이 붙어있는데 통창이 앞이라 빛도 잘 들어오고 사진도 예쁘게 나온다 :) 우린 항상 그렇듯 아메리카노와 소금빵, 쿠키 주문함. 카페 한켠에 예쁘게 진열되어 있는 베이커리. 너무 예쁘게 진열되어 있어서 진짜 눈 돌아감..ㅋㅋㅋ 생각보다 구움과자 종류가 많아서 넘 좋았다. 포장해올걸 ㅠㅠㅠ 지금보니 후회되네.. 요즘 어딜가든 소금빵은 거의 평균 이상은 하기 때문에 요기 소금빵도 무난무난 맛있었음. 근데 저 뽀또쿠키가 치즈맛이 진하게 나는게 진짜 맛남 저거 포장해왔어야지 두현아.. 요기서 와인도 구매할 수 있고, 핑거푸드도 판매중이니 테라스에서 한 잔 하는 것도 좋을 것 같음.! 사진은 못 찍었지만 책자에 와인과 푸드메뉴에 대해 자세히 설명되어 있으니 구매하는데 도움이 될 것 같다. 주말인데도 불구하고 생각보다 사람이 없어 (핫플이라 엄청 많을 줄 알았음.. 아님 내가 운이 좋았ㄴㅏ,,) 조용히 즐기기 좋았던 카페 르상스 사운즈한남 상가안에 여러 상점이 입점해 있어 카페 왔다가 다른 곳 구경하기도 좋고 데이트하기 좋은 장소임 매일 아침 마들렌, 휘낭시에, 쿠키 / 식빵, 소금방, 치아바타, 잠봉뵈르 등 여러가지 베이커리를 만든다고 하니 다음에 또 방문해보고 싶은 곳이다 :)"
한남동 브런치 카페 - 카페르상스 사운즈한남점 데이트 코스,"#한남동브런치 #한남동브런치카페 - #카페르상스사운즈한남점데이트코스 카페 르상스 재생 3 좋아요 2 00:00 00:18  접기/펴기 카페 르상스 한남동 브런치 카페 - 카페르상스 사운즈한남점 데이트 코스 (1) 재생 4 좋아요 2 00:00 00:06  한남동 브런치 카페 - 카페르상스 사운즈한남점 데이트 코스 (1) 카페 르상스 방문기, 지금 시작합니다 ☺️🙌 이태원 3번출구에서 직진하면 나오는 핫플, 대사관로 안녕하세요 오랜만에 이태원에 다녀온 지구별시골쥐예요 여러분 모두 #서울핫플 로케이션 가운데 #이태원한남동 이라고 들어보셨을거에요. 여러 국가를 대표하는 대사관으로 가득한 다국적거리로 유니크한 분위기를 자아내죠. 이곳에는 #사운즈한남 이라는 이태원 도심 속의 복합문화공간 아케이드가 위치해 있는데요. 한남동 브런치 #카페르상스 책과 음악, 미술을 즐길 수 있는 문화 공간이 가득한 곳과 어울리는 매혹적인 카페로 오전, 오후, 저녁 인산인해를 이루는 #카페르상스사운즈한남 지점에 다녀왔어요. 한남동 데이트 코스로도 유명한 곳이죠. 날씨가 풀리고 새싹이 돋아나면 카페르상스 야외 테이블도 늘 꽉 차게 돼죠. #사운즈한남 공간은 어딜 찍어도 참 예쁜듯. #카페르상스사운즈한남점 에는 한남동 브런치 데이트 코스답게 다양한 음료 메뉴가 제공되는데요. 그 중에서도 제가 찜해둔 것은 일본 #나가사키고급녹차 로 만든 TEA음료 시그너쳐 메뉴 - #말차라떼 - 였어요. #일본전통차 장인 - #오가와타카유키 마스터 그 외에 #오가와그린티 #오가와호지티 등도 인기가 많은데 제가 갔을 땐 솔드아웃! 😂 타이밍을 잘 맞춰 가셔야 맛볼 수 있어요. 다음으로 수제베이커리도 인기가 많아요 디저트는 사랑이니 무려 3개나 담아봅니다 #한남동수제베이커리 카페 르상스는 사랑! 프랑스 밀가루와 '르방'이라는 천연 발효종을 재료로 해서 마들렌, 휘낭시에, 쿠키, 소금빵 등을 매일 아침에 만든다고 합니다. 한남동 브런치하러 와서 맛보지 않고는 못배길 정도로 신선하고 고급진 맛이 납니다. 자차로 오시는 분은 사운즈 한남 지하1층에서 발렛 주차 가능다고 합니다. 주문 완료 후 '접수 진동 벨'을 받고 휴대폰을 충전할 수 있는 좌석을 찾아 착석! 오랜만에 문학적 감성을 내고자 책 한 권을 갖고 전부 읽으려고 하거든요. (그동안 휴대폰 충전도 좀 하고요,,) 카페 르상스 사운즈한남 - 이태원 한남동 카페 재생 4 좋아요 2 00:00 00:17  접기/펴기 카페 르상스 사운즈한남 - 이태원 한남동 카페 나의 자리를 찾아서 이동,, 한남동 데이트 코스답게 손님이 많으니 조심히 이동 히힛. 사실 저는 만약에 대체만 할 수 있다면 우유대신 #비건음료 를 선택하고 있어요. 카페 르상스는 #비건베지테리안 분들을 위해 오트밀/귀리 옵션을 제공하고 있어서 #말차귀리라떼 를 받아왔답니다. 비건분들도 한남동 브런치 하기에 딱이죠! 어때요 #일본녹차 장인의 혼이 담긴 말차라떼 색깔이 참 곱죠? 실제 맛도 녹차의 깊은 맛과 녹차향이 마시는 순간 혀끝에서부터 느껴진답니다. 이건 휘낭시에 (플레인) 인데요. 일반적으로 한 입 그냥 배어먹어도 맛있지만 플레인 맛으로 선택한 이유 중 하나가 카페 르상스 시그너쳐 말차에 디핑해도 꽤나 두 가지 맛이 조화로워서 말이죠 😋 그리고 제가 최근에 꽂혀 있는 팥과 치즈가 안에 듬뿍 채워진 바삭하면서도 촉촉 그 자체인 소금빵입니다. 이름하여 #앙버터소금빵 이거 하나만 먹어도 #한남동브런치 로서 훌륭한 한 끼가 완성돼죠. 매우 든든합니다. #한남동카페르상스 분위기가 참 좋아요. 각종 문화생활을 향유하는 손님들이 주로 방문하여 담소를 나누는 곳이어서 그럴까요? 카페에서 흘러나오는 배경음악도 상호간의 대화에 집중시켜주는 것 같아요. 한남동 데이트 연인들도 그래서 눈에 띄고. 마침 제가 여행 관련 책을 읽고 있는데 제 양 옆 테이블 손님들도 모두 이번 여름 여행계획을 짜고 계시더군요. 마지막 남은 #르뱅쿠키 는 책 다 읽고 야외 공기마시며 냠냠! 한남동 브런치 카페 - 카페르상스 사운즈한남점 데이트 코스 재생 2 좋아요 2 00:00 00:18  한남동 브런치 카페 - 카페르상스 사운즈한남점 데이트 코스 매력적인 공간, #이태원카페 #한남동카페 <사운즈한남>에 위치한 카페 르상스에서 일상에서의 즐거움과 문화적 여유를 함께 즐겨보시는건 어떨까요? ☺️ 50m © NAVER Corp. 카페 르상스 사운즈한남점 서울특별시 용산구 대사관로 35 사운즈 한남 1층 해당 포스팅은 #블로그링크 협찬을 받아 체험 후 #솔직리뷰작성 됐습니다. by #맛집블로거 #지구별시골쥐"
[카페 르상스 사운즈한남점] 다양한 베이커리가 있는 한남동 브런치 맛집,"오래만에 한남동을 방문하게 됐는데 뭔가 묵직하게 먹는 것보다는 가볍게 베이커리류가 땡기더라구요! 그래서 한남동 베이커리 카페를 찾아보다가 제 눈을 사로잡은 곳이 있었으니..!! 평소에 너무 가보고 싶었던 사운즈한남에 위치한 카페 르상스 사운즈한남점! 한남동 브런치 카페 르상스 사운즈한남점을 소개해드릴게요😁 카페 르상스 사운즈한남점 주소 서울 용산구 대사관로 35 1층 영업시간 매일 10:00 ~ 22:00 * 라스트오더 21:30 전화번호 02-794-9009 카페 르상스 사운즈한남점은 이태원역에서 도보로 10~15분 정도 거리에 위치해 있어요! 순천향대학교 서울병원 근처에 위치해 있어서 쉽게 발견할 수 있어요! 저녁때 방문했더니 한적하니 분위기가 너무 좋더라구요! 한남동 브런치 카페 르상스 사운즈한남점 본격적으로 안내해드릴게요! ㅋㅋ 가장 먼저 베이커리 쇼케이스가 눈에 보여요! ㅋㅋㅋ 일단 빵을 먼저 고르기로 하고 어떤 빵이 있나 구경해봅니다! ㅋㅋ 제가 너무나 사랑하는 치아바타도 종류가 다양하게 있더라구요ㅠ 그동안 맛보지 못한 것들이 있어서 시선을 사로잡았지만 한남동 브런치 느낌으로 먹으려고 조금 더 짭쪼름한 빵을 골라보기로 했어요! ㅋㅋㅋ 평소 소세지빵을 좋아하다보니 소세지 바게트 절대 놓칠 수 없죠ㅠㅠ 거기에 잠봉뵈르까지 있어서 한남동 브런치 완성 뚝딱이에요 ㅋㅋ 이외에도 요새 많은 분들이 좋아하는 구움과자류인 휘낭시에, 마들렌도 다양한 종류를 맛볼 수 있어요! 여기에 쿠키까지 이렇게 맛나보일 일인가요 ㅠㅠ 여기서 멈추려고 했지만 달달구리를 참지 못하고 우유 크림 먹물 소금빵도 픽해보았어요 ㅋㅋㅋ 한남동 브런치를 위해서 빵을 잔뜩 골라봅니다 ㅋㅋㅋ 카페 르상스 사운즈한남점에서는 프랑스 밀가루와 천연발효종을 넣어 만든 전통 유럽빵과 다양한 빵들을 매일 아침 굽고 있어요! 신선한 빵을 매일 맛볼 수 있다는 게 정말 큰 장점같아요! ㅋㅋ 발사믹과 잼도 추가로 판매하고 있는데 선물상자까지 준비되어 있어서 선물용으로 빵 고르기도 좋아요! 이제 음료를 골라보기로 할게요! ㅋㅋㅋ 커피를 비롯해 다양한 음료를 맛볼 수 있답니다! 특히 커피는 카페 르상스 사운즈한남점에서 직접 로스팅하는 원두를 이용해서 더 풍미깊은 커피 맛을 볼 수 있어요! 원두도 디카페인까지 총 3가지나 있어서 골라마실 수 있답니다! 한남동 브런치 카페 르상스 사운즈한남점의 특징 중 하나는 바로 일본 장인이 직접 재배, 선별하는 녹차를 제공한다는 거예요ㅠㅠ 차 좋아하는 분들이라면 꼭 놓치지 마세요! 저도 다음엔 차를 마셔야겠어요! ㅋㅋ 이외에도 병음료도 다양하게 있어서 취향껏 즐길 수 있답니다! 카페 르상스 사운즈한남점은 한남동의 랜드마크인 '사운즈한남' 건물 내에 위치한 모던 베이커리 테라스 카페예요! 내부 공간도 널찍한 편이고 전체적으로 조명이 고급스럽고 무드가 있어서 매력적인 공간이더라구요ㅠㅠ 특히 테라스에서는 분지로의 돈카츠를 활용한 카츠산도, 올리브&하몽을 비롯한 브런치들과 함께 화이트와인을 즐길 수 있어 분위기 있는 모임에도 딱 좋아요! ㅋㅋ 테라스 좌석도 살짝 구경해봤는데 전체적인 무드가 너무 좋은 것 같아요ㅠㅠ 날씨 풀리면 바로 테라스에서 한남동 브런치 때리러(?) 옵니다 ㅋㅋㅋㅋㅋㅋㅋㅋㅋㅋ 소세지바게뜨 잠봉뵈르 우유 크림 먹물 소금빵 아이스아메리카노(디카페인) 주문한 메뉴가 모두 나왔어요! 카페 르상스 사운즈한남점은 프랑스산 밀가루와 버터를 사용하는 것은 물론 일본식 베이커리 기법들을 활용하고 있어요! 그래서 그런지 빵이 하나하나 너무나 고급진 느낌..! 먼저 디카페인 아메리카노를 마셔봅니다ㅜㅜㅜㅜㅜ 저녁이라 디카페인을 선택해봤는데 너무 깔끔하고 고소했어요! 한남동 브런치의 완성은 커피가 아닐까 싶은데 제 입맛에 너무 딱이었어요 ㅋㅋㅋ 빵들돌 하나씩 소개해드릴게요! ㅋㅋ 먼저 우유 크림 먹물 소금빵이에요! 소금빵의 짭쪼름함에 우유 크림의 달달고소함이 어우러져서 진짜 단짠의 정석이에요ㅠㅠ 크림빵 좋아하는 분들 강력추천입니다!! ㅋㅋㅋ 두 번째는 소세지 바게뜨예요ㅠㅠ 원래 바게뜨도 좋아하고 소세지빵도 좋아하는데 이 두 개가 합쳐지니 천국..! 바게뜨라서 조금 딱딱한 감이 있는데 저는 씹는 식감 좋아해서 맛있었어요! ㅋㅋ 마지막은 잠봉뵈르예요ㅠㅠ 프랑스하면 역시 잠봉뵈르를 빼놓을 수 없죠ㅠㅠ 잠봉뵈르 안에는 치즈와 얇은 햄이 겹쳐져 있는데 겉 빵은 고소해서 전체적인 조화가 너무 좋아요ㅠㅠㅠㅠㅠ 이런 빵은 뜯어먹는 재미죠!! ㅋㅋ 잠봉뵈르 유명한 집 몇 개 먹어봤는데 지금까지 중에서는 제 입맛에 제일 잘 맞았어요! ㅋㅋㅋ 카페 재생 0 00:00 00:30  접기/펴기 카페 한남동에서 맛있는 베이커리와 커피를 맛보고 싶다면 한남동 브런치 맛집 카페 르상스 사운즈한남점을 방문해보세요😍 #카페르상스사운즈한남점 #한남동브런치 #한남동맛집 #한남동카페 #한남동카페추천 #한남동브런치추천 #한남동테라스 #한남동카페 #한남동베이커리 #한남동커피 #사운즈한남"
한남동 사운즈한남 데이트 ♥ 카페 르상스 <CAFE LE SENS> 소금빵 맛집,"안녕하세요 도니입니다 한남동에서 제가 정말 사랑하는 공간인 사운즈한남에 위치한 카페 르상스에 다녀왔어요 ( ˘ ³˘)♥ 구 콰르텟 카페에서 카페 르상스로 변신한 곳 콰르텟 커피맛을 잊지 못하지만,, 그에 못지 않게 소금빵에 반해서 쓰는 리얼 후기 지금 가볼게요 🤍💫 CAFE LE SENS 서울 용산구 대사관로 35 사운즈 한남 1층 매일 10:00-22:00 02-794-9009 유럽 분위기가 물씬 나는 카페 르상스 다섯 가지의 감각의 만족을 경험한다라는 뜻이래요 카페 르상스 ⎟CAFÉ LE SENS(@cafelesens) • Instagram 사진 및 동영상 팔로워 405명, 팔로잉 5명, 게시물 51개 - 카페 르상스 ⎟CAFÉ LE SENS(@cafelesens)님의 Instagram 사진 및 동영상 보기 instagram.com 너무나도 더웠기에 테라스는 당연히 못앉고 내부 홀에 들어갔어요 날이 시원해지면 테라스석으로 가세요 ,, 🧚‍♀️ 사운즈 한남 자체 인테리어가 주는 분위기를 제대로 느낄 수 있게 해주는 테라스 💗 🏷️ m e n u 커피ㅣ밀크티ㅣ디카페인티ㅣ티ㅣ말차라떼ㅣ에이드 빵을 구워서 먹을 수 있게 발뮤다 토스터까지 구비 너무 더웠기에 아메리카노만 마실 계획으로 왔는데 빵 냄새를 맡고 안 고를 수가 없었어요 🥲 베이커리카페답게 다양한 종류들의 빵들이 있어요 르상스의 인기메뉴인 소금빵 🥐 르상스의 소금빵은 유럽 고메 버터와 고품질 우유로 발효해 진한 풍미가 느껴진다고 해요 제가 시킨 소금빵은 앙버터소금빵 🥐 고메버터가 앙금과 함께 두툼하게 들어가 있어 고메버터의 풍미를 그대로 느낄 수 있었어요 단면을 보니,, 맛 없을수가 없겠죠? 한입 베어 물면 겉은 바삭,, 안은 달콤한 팥과 버터향이 느껴져 진짜 맛있더라구요? 앙버터 소금빵 도전은 처음이었는데 진짜 행복한 맛이었어요 💞💞💞 디카페인 아메리카노와 르상스 크림커피 땅콩 크림이 가득 들어간 크림커피였는데 너티크림커피?같은 맛이었어요 디카페인 맛은 그냥 그랬어요 크림커피도 무난,, 소금빵 즐기러 오기에 너무나도 좋은 곳인 르상스 사운즈 한남 들렸을 때 꼭 한번 들려보세요 ✨✨ 50m © NAVER Corp. 카페 르상스 사운즈한남점 서울특별시 용산구 대사관로 35 사운즈 한남 1층"
한남동 사운즈 한남 <카페 르상스> 부라타무스 강추..내 또간집 예약,"여러분 안녕하세요~ 오늘은 제그 #사운즈한남 에 위치해 있는 #카페르상스 에 다녀왔어요 사운즈 한남 입구부터 어 버 어 버 거림... 카페 르상스 어딨는거죠? 하고 눈 크게 뜨고 보니 찾았다! 3구역임! 벽돌 부터 고급진거 내착각인가.. 드디어 카페 르상스 도착 카페 르상스 사운즈한남점 야외 테라스 자리도 있고, 실내 자리도 있어요 전 갠적으로 테라스 자리가 맘에 들었습니다 내부 자리도 아늑한데 살짝 테이블 간 간격이 좁은 느낌 각종 쿠키랑 마들렌도 팔고 와인 리스트도 후덜덜 했네요 와인과 메뉴는 평일 17시 이후 주문 가능 주말은 all day 가능 하다고 하네용! 저희는 야외 테라스로 나왔습니다 야외 테라스 넘 이쁨 아 나두 화이트 입고 올걸 아숩;;; 화이트 입고 오면 색상 진짜 잘받을 거 같아요 메뉴판 정독 시작... 여기 베이커리보다 저녁 메뉴가 더 탐나는 듯 가격도 꽤나 합리적! #부라타무스 23,000 참고로 존마탱 저희가 주문한 화이트 와인과 부라타무스 나옴요! 와인 인생샷 찍어드림 바로 앞에 또 노란튤립 있어서 사진 더 잘나왔어용 요 조합 강추 ! 화이트 와인에 부라타무스 드셔보세요 제 인생 부라타 달성 놀람 포인트 정리 1. 내가 오늘 점심에 먹은 토마토랑 차원이 달랐음 이녀석 미친 존맛임 2. 허브 ㅈㄴ 채식동물 처럼 먹음 3. 하몽&치즈 어디껀지 너무 궁금함 아니 여기 카페라더니 그냥 안주 맛집이네요? 오늘 좀 추워서 오빠랑 야외 테라스를 앉네 마네 했는데,,,,, 이거 먹고 추위를 잊었어요 부라타무스 강추...꼭 드세요... 전 이거한 10접시쌉가능😍 꼭 가보시오 다들~~ 저희는 안주 먹으러 재방문 예정 50m © NAVER Corp. 카페 르상스 사운즈한남점 서울특별시 용산구 대사관로 35 사운즈 한남 1층 #서이추 #서이추환영 #서이 #서이환영 #블린이 #맛집블로그 #한남동카페 #한남동데이트 #한남동브런치 #한남동카페추천 #사운즈한남맛집 #사운즈한남카페 #블로그소통"
예쁜 테라스가 있는 한남동 베이커리 카페 르상스 사운즈한남점,"예쁜 테라스가 있는 한남동 베이커리 카페 르상스 사운즈한남점에 다녀왔어요 :) 테라스에 앉아있는데 양 옆테이블 모두 외국분들이고, 전반적으로 카페에 많은 외국인들이 있어서 카페 르상스 사운드한남점이 여행하는 외국인들에게 핫한 카페 느낌이더라구요? 한남동 베이커리 카페, 르상스 사운즈한남점 [전화] 02-794-9009 [위치] 서울 용산구 대사관로 35 사운즈 한남 1층 [영업시간] 매일 10:00 - 22:00 (21:30 라스트오더) *방문 2023.10 사운즈 한남 카페 르상스는 테라스가 예뻐서 가을 날씨 즐기러 방문한 카페에요. 이태원역, 한강진역 근처에서 야외 테이블이 있는 카페 찾으신다면 카페 르상스 사운즈 한남점 추천해요! 카페 르상스 매장 내부에서 밖으로 이어지는 문으로 나가서 왼쪽으로 돌아 가시면, 카페 르상스 테라스가 이솝 매장을 마주보고 있어요. 야외 테라스 테이블이 한 4~5개 밖에 없었어요. 생각보다 야외 테라스가 넓지는 않았어요. (참고! 화장실은 카페 테라스 가는 왼쪽 방향이 아닌 오른쪽방향 건물 안에 있다고 합니다.) 베이커리 카페 답게 정말 다양한 베이커리류를 판매하고 있었어요. 소금빵 안에 크림 든 것도 맛있어보이고, 샌드위치랑 구움과자류도 다양하게 있답니다. 제가 처음 카페 도착했을 땐, 야외 테라스 자리가 없어서 실내 자리에 앉아 있다가 야외 자리가 생겨서 이동했어요. 친구보다 먼저 도착해서 티 주문했답니다~! 친구가 오고 나서 야외 테라스로 자리를 이동!! 샌드위치랑 휘낭시에도 주문했어요. 샌드위치는 칼로 반 잘라서 친구랑 나눠먹었어요. 샌드위치는 맛있었지만, 샌드위치 바닥이 좀 축축해서 들고 먹기 안좋더라구요. 사운즈 한남 카페 르상스에는 베이커리나 카페 음료 외에 와인 드시는 분들도 많더라구요. 야외 테라스에서 와인이라니 너무 분위기가 좋아보였어요~ 캐나다에 다녀온 칭구한테 받은 선물!!!!!! 당폭발하는 완전 맛있는 메이플 쿠키! 친구가 절때 커피 없이 못먹는 단맛이라 그랬는데, 저는 달달하니 너무 맛있어서 주말 내내 완전 많이 먹었답니다. 고마워 뚜언니💛 50m © NAVER Corp. 카페 르상스 사운즈한남점 서울특별시 용산구 대사관로 35 사운즈 한남 1층 리프레시가 너무 간절한 요즘! 나도 얼른 한달 후가 되어 떠나고싶다~"
