title,content
[한남동 카페] 크로플 맛집 아우프글렛,"50m © NAVER Corp. 아우프글렛 서울특별시 용산구 이태원로54가길 20 한남동으로 출퇴근하면 좋은점*_* 점심시간에 맘만 먹으면 시간을 내서 카페를 다녀올 수 있다ㅎㅎㅎ 아우프글렛은 연남동에 있는 크로플 맛집으로 알고 있었는데 동료선생님이 한남동에도 생겼다고 해서 가보게 되었다. 오복수산 뒷골목에 위치해있고 컨템포러리 카페 골목으로 들어가서 우회전 후 쭉 들어가면 바~로 보인다. 1층 2층 2층 2층 총 2층으로 이루어진 카페이고 내부의 한면은 거울이여서 더 넓어보이는 것? 같았다. 처음 딱 들어왔을 때 블랙 계열의 인테리어에 와인병이 눈에 들어와서 바....? 인줄 알았다ㅋㅋㅋㅋㅋ 월요일 점심(한시쯤)인데도 불구하고 주문이 밀려서 20분 정도? 기다린 것 같다. (아마 크로플 때문에 좀 더 걸린듯 하다) 우리는 아아, 아라, 초코라떼와 크로플을 하나 시켜먹었다. 기다리는 동안 밖에 벤치에 앉아있었는데 날씨도 너무 좋고 햇살이 드니까 딱 좋았다ㅎㅎㅎㅎㅎ 평일 점심에 햇살을 쬐며 마시는 여유로운 커피 한잔... 더이상 행복할 수가 없는 순간ㅋㅋㅋ 직원분께 여쭤보니 크로플 등의 디저트류는 밖에서 먹으면 안된다고 하셔서 안에서 먹었다~ 커피 정도는 밖에 앉아서 먹으면 좋을 것 같다. 아이스라떼 여기 크로플 처음 먹어보는데... 오동통.. 아주 도톰하고 굽는 냄새가 진짜 장난아니다... 기다리면서 밖에까지 냄새난듯ㅎㅎ 겉은 적당히 달고 바삭했다. 속은...내가 여태 먹은 크로플 중에 제일 쫄깃 촉촉하고 고소했다ㅠㅠ 나는 라떼를 먹었는데 그냥 기본으로 커피는 잘하는 듯 하다>_< 오동통크로플 그리구 우리는 크로플 빨리 먹고 커피는 가면서 먹어야했기 때문에 테이크아웃 잔에 달라고 했는데 훨씬 예뻣다. 유리잔보다 테이크아웃잔 디자인이 훨씬 예쁘고 편했던듯ㅋㅋㅋ 금호동, 연남동에 이어 한남동 아우프글렛 카페 크로플이 진짜 맛있으니 커피와 함께 꼭 먹어보세요😝 #한남동 #한남동카페 #한강진역 #한강진역카페 #한남동카페거리 #아우프글렛 #아우프글렛한남 #한남동아우프글렛 #카페추천 #한남동카페추천 #크로플 #크로플카페 #한남동크로플 #크로플맛집 #크로플카페 #한남동크로플카페 #아우프글렛카페"
"[한남동 카페] 아우프글렛 (Aufglet) 3호점, 낮과 밤이 다르게 운영되는 새로운 컨셉의 공간","지난 삼일절 연휴 동안 초청자들을 대상으로 성공적인 가오픈기간을 마친 후 재정비 기간을 갖고 3월 5일 정식오픈을 한 아우프글렛 (Aufglet) 한남점. 크로플 원조, 크로플 맛집으로 이미 너무나도 유명한 아우프글렛의 세 번째 매장으로 다양한 카페와 음식점 등이 밀집한 한남동 한강진역 뒷편 카페거리에 위치한다. 바깥에서부터 기존의 두 매장과 다른 이미지를 품기는데, 벽돌건물에 자리한 금호본점과는 당연히 다르고 입구 바깥에 테라스로 활용이 가능한 스탠드가 있는 하얀색 주택의 연남점과도 상이하다. 오히려 '힙하다'는 이미지가 가장 잘 어울리는 이태원 상권인 것을 감안해도 차분한 느낌을 갖는다. 2층 발코니 한 켠에는 멀리서도 쉽게 찾아올 수 있도록 ""Aufglet""이 큼직하게 걸려있다. 검정색 바탕에 하얀색 정자체의 아우프글렛 로고. 아주 직관적으로, 심플하며, 단정한 느낌이 참으로 좋다. 기존 두 매장과 마찬가지로 한남동 카페 또한 주택가 골목에 위치한다. 주변에 다양한 상업시설이 있음에도 맞은 편 벽돌집을 비롯하여 여전히 주거시설로 둘러쌓인 곳. 따라서 방문하는 사람들의 주민들에 대한 배려가 필요한 곳이기도 하다. 새로운 매장 오픈을 알리기 위해 주변에는 이런저런 표식이 있다. 특히 매장 맞은 편 전신주에 로고 포스터가 둘러져 있는 것이 인상적이었다. 담장 한 켠에는 누가 봐도 '한남점=3호점'이라는 것을 직관적을 알 수 있게 매장 오픈 포스터가 부착되어 그 자체로 포토존 역할을 한다. 매장 앞의 여유공간에는 대기용 벤치가 마련되어 있다. 맨 왼쪽의 붉은 색 문은 주택건물 윗층으로 올라가는 전혀 별개의 문이다. 반대편 끝자락 공간에는 재떨이가 마련되어 있어 지정된 흡연구역을 표시해준다. 한남동 카페는 1층과 2층, 두 개 층으로 구성되어 있다. 아우프글렛에 익숙한 사람이라면 안으로 들어서자마자 특이한 점을 발견할 것이다. 바로 커피바 옆에 각종 와인이 함께 진열되어 있다는 것! 금호점과 연남점과는 다르게 한남점에서는 주류도 판매된다. 대신 모든 시간대 커피류와 주류를 주문할 수 있는 건 아니다. 오픈시간부터 낮시간 동안은 카페로만 운영되고 한 시간의 브레이크 타임 후, 저녁부터 마감까지는 바로만 운영된다. 즉, 낮동안 주류 주문은 불가하며 저녁에는 카페메뉴 주문이 불가한 구조. 또한 아우프글렛의 전매특허인 크로플은 오후 3시까지만 판매된다. 카페운영시간 동안 좀 더 커피 자체에 집중하기 위한 것으로 아우프글렛의 로스터가 얼마나 공을 들여 원두를 볶아 공급하는지 알고 있는 나로서는 드디어 아우프글렛의 커피가 커피 자체로 빛을 발할 수 있는 환영할 만한 조치라고 생각한다. 커피바와 주방, 그리고 좌석공간이 함께 위치한 1층과는 다르게 2층은 전체가 온전히 좌석공간으로 사용되고 있다. 올라가는 계단 옆에 감각적인 미국 뉴욕시내 건물 사진이 도시적인 이미지를 배가시킨다. 건물이 끝나는 지점을 일반 벽면대신 거울로 처리하게 공간의 여유를 극대화시킨 것이 특징이며 그 중앙에는 다양한 오브제가 있는 진열장이, 그 앞으로는 테이블이 여유있게 비치되어 있다. 공간이 넓기 때문에 좌석 자체의 개수도 많지만, 벽면을 따라 단체석이 마련된 것이 특징이며 운이 좋으면 쇼파 좌석에서 편안한 시간을 보낼 수 있는 행운을 얻을 수도 있다. 바깥에서 보인 아우프글렛 로고 깃발을 2층에서도 만날 수 있는데 건물 너비만큼 테라스 공간이 좁고 길게 나있으며 연남점과 같은 옥외좌석은 마련되어 있지 않다. 중앙의 진열대 선반 위에는 다양한 물품들이 각자의 자리에서 빛나고 있는데 아우프글렛 MD제품인 라이터와 공동대표 겸 사진작가 Mon Kim의 사진 포트폴리오, 그리고 인기 향수브랜드 논픽션 (Nonfiction)의 향수 샘플 등이 보는 즐거움을 선사한다. 금호점, 연남점과 마찬가지로 한남점의 테이블 또한 널찍하다. 매장을 찾는 손님들의 편안한 시간을 배려하는 아우프글렛의 방침이 나는 참으로 좋다. 안에서 테라스 방향을 바라 본 모습. 오픈한 지 30분도 안된 시점에 2층의 창가 측 테이블은 다 채워졌다. 테라스 앞에는 창가를 바라보는 2인 좌석이 있어 일반 테이블 좌석과 차별화 되어있다. 시간대에 따라 카페 또는 바로 운영되는 곳이기 때문에 낮동안에는 위와 같이 카페 메뉴만 카운터에 비치된다. 함께 비치된 티라미수, 크림브륄레, 그리고 판나코타의 모형 또한 카페로 운영되는 오후 5시까지만 비치되는 것. 양해를 구해 바 메뉴도 사진으로 담았는데, 메뉴판 좌측에는 각종 주류가 종류별로 적혀있으며 우측에는 한남점에서만 맛볼 수 있는 다양한 음식이 적혀있다. 언제 오는 것에 따라 분위기는 물론 즐기는 방법 또한 완전히 달라지는 것이 한남동 카페의 매력이다. 신규 매장 오픈 기념으로 오랜만에 크로플을 먹기로 하고 이를 내가 가장 좋아하는 아우프글렛 커피메뉴인 플랫화이트와 곁들였다. 금호점만 있던 시절부터 모든 커피메뉴를 다 맛 본 나로서는 라떼도 아닌 따뜻한 플랫화이트가 원두의 캐릭터를 가장 잘 표현한다고 생각한다. 점장 겸 바리스타가 직접 커피를 내리고 라떼아트까지 그려준 신성한 플랫화이트 한 잔! 적당한 바디감에 고소함과 특유의 아로마가 클린컵으로 이어지며 독보적으로 맛있었는데, 원두의 맛이 좀 더 잘 표현되도록 셋팅값을 조금 바꾸었다고 한다. 크로플이야 원조의 맛은 더 말하면 입아프고, 아우프글렛 아이스크림에 대해 따로 글 쓴 적이 있을 정도로 촘촘하게 박힌 씨앗은 그 맛과 비례한다. 겉바속촉의 크로플과 부드러운 아이스크림과의 조합은 커피와도 아주 잘 어우러졌다. 플랫화이트를 너무 맛있게 마셔 원두 셋팅이 어떻게 바뀌었는지 제대로 느껴보기 위해 원두의 맛을 가장 잘 맛볼 수 있는 에스프레소를 추가로 주문했다. 전면부의 맛은 '짠 맛'이 느껴질 정도로 짙었으나 뒤로 갈수록 고소한 아로마로 귀결되었다. 음, 많은 사람들이 아우프글렛을 크로플 맛집으로 찾더라도 나에게 아우프글렛은 커피 맛집이며 오늘도 어김없이 그 생각이 깊게 들었다. 개인적으로도 기다려 온 아우프글렛 세 번째 공간의 오픈 소식! 기다리고 기대해 온 보람이 제대로 느껴졌던 시간이었다. 이견이 필요없는 본연의 커피 맛집과 함께 맛집으로서의 역할을 수행하며 코로나19로 인해 큰 타격을 받은 한강진 상권에 활력을 불어넣어줄 것이라 기대되는 곳이다. AUFGLET(@aufglet)님의 Instagram 프로필 • 사진 및 동영상 795개 팔로워 11.5천명, 팔로잉 0명, 게시물 795개 - AUFGLET(@aufglet)님의 Instagram 사진 및 동영상 보기 www.instagram.com <위치> 서울특별시 용산구 이태원로54가길 20 <교통편> 지하철 - 6호선 한강진역 3번 출구 버스 - 한남동주민센터 하차 <영업시간> 매일 - 12:00~22:00 12:00~17:00 (Cafe) 17:00~18:00 (Break) 18:00~22:00 (Bar) 50m © NAVER Corp. Aufglet3 서울특별시 용산구 이태원로54가길 20"
"주말기록 : 수린한남, 한남동 아우프글렛, 그랜드하얏트서울, 호캉스","연차내고 놀러가기~.~ #코닥미니샷3 신기해서 이리저리 테스트중 바로 찍어서 프린트해도되고 앨범에 있는 사진을 선택해서 프린트해도 되고ㅎㅎ 간편 그 자체라서 좋다❤️ 밥 먹으러 수린 한남 찾으러 나인원으로ㅎㅎ 지나가다만 봤는데 같은 건물에 블루보틀도 있다 예약하고 간 게 아니라 가운데 자리에 착석~ 다음에는 예약하고 창가에 앉아야지ㅎㅎ 기본 반찬부터 주고 채끝 스테이크 덮밥이 나온다👏🏻 맛있당 밥 먹고 찾은 한남 아우프글렛🤍 1호점만 가봤는데 한남동에도 생기다니…꿀 1,2층 건물이라 넓직하게 앉기 좋다 크로플은 아우프글렛이 진리! 아이스크림이랑 먹으면 입에서 녹는다 녹아😭 좋은건 한 번 더~~💕 창가 자리에는 거울이 이렇게 딱! 배불리 먹고 그랜드 하얏트 체크인하러~ 2시 50분쯤 갔더니 많이 안기다리고 금방 체크인할 수 있었다 들어가자마자 좋은 냄새~.~ 서울 호캉스는 처음이라 설렌다❣️ 한강뷰라 더 기대된다! 복도를 따라서 도착 요런 액자도 있고… 인스타에서 많이 보던 수영장 뷰💙 청량 그 자체 유리창이 깨끗해서 더 잘 보였던 뷰 전면이 유리라 야경도 기대된 곳 코로나4단계라 수영장 입장은 체크인하면 한번밖에 못한다ㅠㅠ 체크인 하자마자 갔는데 다음에는 아침에 가는걸로.. 평일에는 배드 무료 이용이다 하지만 숲 속에 자리잡기~ 평일에 가니 여유 넘쳤다 누워 있는 것 자체가 힐링👏🏻👏🏻 가운이랑 슬리퍼 신고 입장 가능! 수건도 입구에서 줘서 정말 편하다 흐흐….💗 수영장 다녀와서 걸어서 편의점~ 정문 쪽에서 나와 외쪽으로 쭉 가다보면 편의점 2개가 위치! 보니스피자가 배달도 되구요… 웨이팅 때문에 먹기 힘들었는데 서울은 참 좋다~ 야경 보면서 컵라면 부수기ㅎㅎ #육개장 최고 아침에 일어나서 조식도 먹었구요ㅎㅎ 이럴때만 세상 부지런해지는 건 나뿐인가…😂 뒤쪽으로 가면 따로 위치한 조식 먹는 곳 들어가면 바로 커피부터 주신다~.~ 빵순이는 빵으로 시작! 맛있는 메뉴가 많다 비닐장갑 끼고 움직여야 해서 많이 못찍었다ㅠㅠ 💚💚💚 체크아웃하고 성수동 #블루보틀 마들렌도 하나 먹고ㅎㅎ 커피 원샷 #서울숲 도착! 햇빛이 너무 강해서 그늘만 찾다가 지쳐버렸다ㅎㅎ 😎 성수동 들리면 항상 들리는 #하노이102 여기는 반미맛집ㅎㅎ 반미랑 쌀국수 먹고 집으로🙌🏻 #그랜드하얏트서울 #그랜드하얏트 #호캉스 #서울호텔 #한남동맛집 #수린한남 #한남동카페 #아우프글렛 #크로플맛집 #이태원카페 #성수동카페 #성수동맛집 #서울숲맛집 #서울숲카페 #카페추천 #카페투어"
한남동 카페 / 서울 3대 크로플 맛집 ' AUFGLET 아우프글렛 ' 크로플 먹어본 후기 by 낌띰로그,"AUFGLET 아우프글렛 한남점 5m © NAVER Corp. 아우프글랫 한남점 서울특별시 용산구 이태원로54가길 20 아우프글렛 서울특별시 용산구 이태원로54가길 20 너무 가보고싶었던 크로플맛집 ' AUFGLET 아우프글렛 ' 드뎌 다녀왔지요 : ) 서울 용산구 이태원로54가길 20 (서울 용산구 한남동 683-24) 한남동카페 아우프글렛 한남점은 한강진역 3번 출구로 나와서 쭉 걸어가다가~ 폭스바겐 건물 옆 내리막길로 내려가고~ 은하부동산 맞은편 골목길로 쭉 들어가다보면 나와요 ! 한남동 아우프글렛 위치 이태원 아우프글렛 이태원 카페 / 이태원 디저트 맛집 아우프글렛 한남점 전용주차장은 따로 없기 때문에 인근 공영주차장을 이용하시는 게 좋을 거 같아요 ! Cafe 매일 12:00 - 17:00 (Break time Fri~Sat 17:00 - 18:00) Dining bar 18:00 - 22:00 (Last order ~21:00) 한남동 크로플 맛집 / 서울 3대 크로플 / 크로플 원조 아우프글렛 한남점 영업시간은 낮 12시부터 오후 5시까지고, 오후 5시부터 오후 6시까지는 잠시 휴식시간(브레이크타임)을 갖다가 오후 6시부터는 카페가 아닌 다이닝바(와인바, 펍)로 운영된다고 해요 : ) (저번에 암것두 모르고 6시 넘어서 크로플 먹으러 갔다가 퇴짜 당한 1인..) 한남동 와인바 / 한남동 다이닝바 / 한남동 펍 이태원 와인바 / 이태원 다이닝바 / 이태원 펍 AUFGLET(@aufglet)님의 Instagram 프로필 • 사진 및 동영상 1,210개 팔로워 1.5만명, 팔로잉 2명, 게시물 1,210개 - AUFGLET(@aufglet)님의 Instagram 사진 및 동영상 보기 instagram.com 아우프글렛은 연중무휴인 것 같긴 한데 그래도 혹시 모르니 인스타그램 참고하시고 가시는 걸 추천드려요 : ) 아우프글렛 다이닝바 / 아우프글렛 크로플 아우프글렛 한남점은 외부에도 테이블이 있는데 이 날은 크리스마스였어서 홀케이크가 잔뜩 올려져 있더라구요 ! 아우프글렛 홀케이크 1층 테이블에도 홀케이크 잔뜩 👀 이태원 홀케이크 맛집 홀케이크는 이렇게 생겼더라구용 ㅇㅅㅇ 아우프글렛 홀케이크 주문 아우프글렛 한남점 인테리어 2층은 요롷게 생겼어요 ! ! 블랙앤화이트는 역시 깔끔 of 깔끔. 2층 올라가는 계단 옆에 트리도 있는데 요것두 트리장식이 과하지도 않고 딱 깔끔하게 꾸며져서 더 더 예쁘더라는 ✨🎄 아우프글렛 음료 가격 종류 / 아우프글렛 디저트 아우프글렛 음료랑 디저트 메뉴판이에요 !! 커피랑 논커피인 티, 에이드 등 팔고, 디저트도 팔아요. 에스프레소 / 아메리카노 / 카페라떼 / 플랫화이트 / 카푸치노 / 카페모카 / 바닐라라떼 / 바이닐 / 아포가토 / 크림커피 피치블라썸 / 블루베리루이보스 / 크림슨아이스티 / 얼그레이밀크티 / 초코 / 유즈스파클링 / 링고스파클링 / 에이드 까눌레 / 아이스크림 / 티라미수 / 크림브륄레 / 크로플 까눌레 ₩3,000 저는 최애 디저트가 까눌레인데용.. 아우프글렛은 크로플맛집이니까 이 날만큼은 까눌레를 잠깐 포기했었는데 포스팅 하고있는 지금... 그 때 선택을 매우 후회해용 ㅠㅠㅠㅠ 걍 둘 다 먹을 걸ㅋㅋㅋㅋㅋㅋㅋㅋ큐ㅠㅠㅠㅠ 저랑 제 친구가 시킨 메뉴는 아이스아메리카노 4,500원 바닐라라떼 5,500원 크로플 9,000원 입니당 👀✨ 아메리카노 ₩4,500 커알못이지만 아우프글렛 아메리카노 괜찮았구용 ☕️🤎 달다구리 크로플이랑 먹기에 넘흐 찰떡궁합이었어용ㅎ 크로플맛집 / 크로플원조 바닐라라떼 ₩5,500 전 갠적으로 바닐라라떼도 맛있었는데 크로플이랑은 약간 케미가 안 맞더라구요.. 바닐라라떼보다 크로플이 더 달아서 크로플 먹고 바닐라라떼 먹으면 무맛...ㅋㅋㅋㅋㅋㅋㅋㅋ ㅠㅠ 이 점 참고하세요.. 달달한 디저트에는 아메리카노가 첵오 ❤️ 크로플 ₩9,000 대망의 #크로플 🧇✨ 아우프글렛 크로플 종류는 딱 하나밖에 없고, 기본적으로 크로플 위에 똥글똥글 몽글몽글한 아이스크림이 1스쿱 올라가요 👀 헉헉 크로플위에 시나몬 가루랑 정체불명의 흰색가루가 뿌려져있고, 메이플 시럽이 작은 컵에 준비되서 나오는데 먹기 전에 메이플시럽을 한바퀴 돌려가며 뿌려주면 됩니당 ㅎ 크로플 존맛 맛집 / 크로플 탑 아우프글렛 🧇✨ 재생 1 좋아요 0 00:00 00:10  접기/펴기 아우프글렛 🧇✨ 아우프글렛 크로플.. 소문대로 존맛탱이었어요 ㅠㅠ 크로플 원조답게, 서울 3대 크로플 맛집답게 걍 미친 맛 💗 아우프글렛 크로플은 겉바속촉이다 못해 쫀쫀하기까지 해요.. 심지어 아이스크림까지 인절미같이 쫀득쫀득 😋 셀 수 없이 크로플들을 먹어왔지만.. 아우프글렛 크로플이 저에게 1순위가 되버렸다쥬... 진짜 서울 살았으면 아우프글렛 자주 갈텐데 ㅠㅠㅠㅠㅠㅠ 글고 갈 때마다 무조건 1인 1크로플 할텐데 말이쥬.. 크로플 원조 명성답게 !!!!! 크로플 존맛.... 인생크로플으로 등극. 아우프글렛 크로플 너... 내 마음속에 저장 🧇✨❤️ 재방문의사 1000000%라고요.."
한남동 아우프글렛 Aufglet 여전히 맛있는 크로플,"Aufglet 아우프글렛 한남 - 영업시간 cafe 12:00 - 17:00 bar 18:00 - 22:00 휴무 없음 주차 한강진역 3번 출구 한남동 공영주차장 추천 한남 파르크에서 점심 먹고 크로플 먹으러 간 #아우프글렛한남점 주말 오후 2시 반 정도였는데 10분 정도 웨이팅하고 들어갔다 아우프글렛 한남점은 낮엔 카페, 저녁엔 바로 운영된다고 한다 #아우프글렛한남 #aufglet 너무 예뻤던 아우프글렛 트리 🎄 연말 느낌 낭낭했던 12월 말 주말이라 1, 2층 모두 만석이고 너무나 시끄러운 분위기였는데 구석 자리 안내 받아서 좋았당 ㅎ.ㅎ 너무 오랜만에 먹는 아우푸글렛 크로플 ఇ 우리는 세명이니까 크로플도 3개, 음료도 3잔 ㅎㅎㅎㅎ 분명 밥을 먹고 왔지만 크로플은 1인 1개 먹어야한다며. . 먹을 땐 맘이 잘통하는 우리 ( ˆ͈̑꒳ˆ͈̑ )੭♡ 한판씩 들고 올라오는데 급식받는거 같고 뭔가 웃겼던 ㅋㅋㅋㅋㅋㅋ 아메리카노 4,500 크로플 9,000 시럽통도 귀여워 .. 시럽은 안뿌려도 아이스크림때문에 충분히 달달한 편! 그래도 단게 최고..ㅎㅎ 뚱뚱하게 올라간 하겐다즈 아이스크림도 귀엽 오랜만에 먹지만 여전히 존맛 ㅎㅎ 바삭하고 쫄깃 겉바속촉 아우프글렛 크로플 짱 50m © NAVER Corp. 아우프글렛 서울특별시 용산구 이태원로54가길 20"
"한남동 나들이(아우프글렛, 낫띵리튼 쇼룸, 도노 DONO )","드디어 가본 한남동 아우프글렛! 웨이팅 좀 기다리고 들어갈 수 있었다 🥲 그렇게 크로플이 맛있다고 해서 기대기대했는데 진짜 존맛탱이었다 내가 먹어본 크로플 중 최고,, 갓 나온거 먹어서 더 맛있었는지도 ㅠ 웨이팅 싫고 사람많은것도 싫은데 저거 먹고싶어서 다시 갈거같다 다른지점도 많으니 다른곳 가봐야징ㅎㅎ 한남동 가면 꼭 가야한다는 낫띵리튼 쇼룸 이제 가을 니트들이 잔뜩 ㅠㅠ 근데 곧 겨울될듯 난 오픈시간에 가서 사람이 거의 없었는데 주말에가면 쇼룸도 웨이팅이 있다고 한다 한남동 코스가 뷰 맛집 ㅎㅎ 한남동 도노 파스타 먹고 싶어서 네이버 예약해서 찾아간 곳 ㅎㅎ 제일 무난한 메뉴들로 시켜서 먹었고 맛도 무난무난 했다ㅎㅎ 어푸어푸에서 그립톡도 겟겟 ㅎㅎ 너무 귀여운 것들이 많았지 가을 날씨도 이제 끝이군 ㅠㅠ 한남동 투어도 끝!"
한남동 카페&와인바 아우프글렛(AUFGLET),"친구들과 와인바를 가고 싶어서 서울에서 유명한 와인바를 찾던 중 ‘아우프글렛(AUFGLET)’을 가기로 했다. 한남동 아우프글렛은 한강진 역에서 도보로 약 10분 정도 걸린다. 역에서 가깝기 때문에 위치가 좋았다. 한남동 카페거리를 걷다보면 아우프글렛이 나온다. 화이트와 블랙 타일로 인테리어 되어있어 외관이 깔끔하고 모던한 느낌이 든다. 한남동 아우프글렛은 2층으로 되어있다. 그리고 오픈시간부터 낮에는 카페로만 운영되고 저녁부터 마감까지는 와인바로 운영된다. 낮에는 카페 메뉴만 주문이 가능하고 저녁엔 와인만 주문이 가능하다. 아우프글렛의 가장 유명한 메뉴인 크로플은 다음에 낮에 방문해 꼭 먹어보고 싶다. 안의 내부는 조명이 은은하고 블랙 가구를 배치했다. 다만 아쉬웠던 점은, 테이블에 양초 불과 테이블 옆 스탠드만 놓여져 있어서 밤이 되니깐 너무 어두웠다. 내가 앉은 자리는 2층 안쪽 자리인데 큰 거울이 있었다. 처음엔 너무 깨끗해서 거울이 아닌줄 알고 놀랐다ㅋㅋ 메뉴판 와인도 보틀만 있고 가격대가 있는 편! 우리는 화이트 와인을 시켰다. 네추럴 와인 중 ‘모라사 디아솔 비우라’를 시켰다. 11.5% 스페인 와인으로 8만 5천원이다. 원래 레드를 좋아하는데 화이트를 스파클링이 있거나 달아서 자주 안먹었다. 근데 이 와인은 하나도 달지 않고 깔끔해서 목넘김이 너무 좋았고 안주랑도 잘 어울렸다. 안주는 바질페스토 파스타(1만 8천원), 감자뇨끼(2만원), 현미보리 머쉬룸 리조또(2만원) 이렇게 3가지를 시켰다. 바질페스토 파스타와 감자뇨끼 바질페스토 위에는 꽃이 올려져 있었다. 감자뇨끼엔 치즈가 몽글몽글 있어서 비주얼 최고! 바질 페스토 1만 8천원 슬라이스 치즈, 보라색 꽃, 채소, 그리고 초록색 면! 평소 바질페스토를 좋아하는데 정말 맛있었다. 이번에 시킨 메뉴 중 최고! 담백하고 바질 향이 강해서 와인과 정말 잘 어울렸다. 감자뇨끼 2만원 뇨끼는 전에 연남동에서 유명한 곳에서 먹어봤는데 내 스타일이 아니라서 다신 안먹었는데, 아우프글렛 감자뇨끼는 정말 맛있었다. 감자가 쫄~깃하고 미트 소스가 곁들어저 있어 짭잘한 맛과 감자의 고소함이 잘 어우러졌다. 그리고 치즈가 신의 한수...!!!! 현미보리 머쉬룸 리조또 2만원 밖이 어두워져서 사진이 잘 안나왔다🥲 처음엔 위에 뭐지? 했는데 버섯이었다. 목이버섯과 송이버섯이 올려져있다. 음.... 솔직하게 이 메뉴는 나쁘지 않았다. 추천드리는 메뉴는 아님. 모라사 디아솔 비우라 11.5% 8만 5천원 그리고 깔끔한 화이트 와인 모라사 디아솔 바우라 위의 안주들과 너무 잘 어울렸다. 그리고 맛이 깔끔해서 목 넘김 최고! 9시쯤? 서비스로 아이스크림을 주셨다. 바닐라 맛 아이스크림인데 와인과 찰떡이라서 아주 맛있게 잘 먹었다 :) 분위기있는 와인바 또는 카페를 가고 싶다면, 한남동 아우프글렛 추천! 50m © NAVER Corp. 아우프글렛 서울특별시 용산구 이태원로54가길 20"
