title,content
Apr (23) : 평일일상 / 먹고 또 먹고 / 홍꼬꼬 닭강정 돈암시장점 / 성신여대 닭강정 맛집 / 망원동 비전스트롤 / 카페라떼 맛집,"#낙지연포탕 낙지야...미안헤... 근데 너무 맛있쪄...🐙 낙지사랑 본점 서울특별시 성북구 고려대로5길 93 일상빌딩 뉴진스의 탈을 쓴 발라닭 스티커 너무 귀여워서 회사에 붙여뒀다. 🤣🤣🤣🤣🤣 근데 문득 나 요즘 블로그에 수다 떠는게 힘들어. 그러니까 수다떨게 없어서 힘들어. 할말이 없어졌어.🤔 이때까지만 해도 행복했다😌 아이브의 아이엠 훅까지 진도 나가고 처음에는 뽕짝같던 노래가 점점 귀에 익으면서 정들고 재밌어서 좀 열심히 했거든요? 좀 열심히 하니까 더워요 안더워요? 그런 와중에 스벅 생일쿠폰이 나와서 ""자허블 한잔 때리자! 아휴 덥다!!!"" 하고 한잔 크으 하면서 집에 룰루랄랄 걸어가다가 또 갑자기 ""기분이다! 장보자!!!"" 하고 생협갔다가 차 뒷범퍼 개박살나는 재앙을 맞닥들였다... 휴....🥹 작년 11월에 나온 6개월도 안된 신차라구요... 갓길 정차해서 계란 사고 있는데 우회전하던 버스가 뒷범퍼 아작내고 갔다. 아니 그래도 3차선 도로인데 이렇게 까지 안쪽을 돌았다고요...? 차 수리하는데 1주일 소요됐는데 진짜 지옥이었다고 한다.😳😳 정 떨어져서 당분간 차 안 탈래. 디스 이즈 208만원짜리 짭짤이 토마토...🤬🤬🤯🤯 비싼 짭짤이 토마토! 얘만 보면 눈물이 나네. 근데 맛이 참 좋네? 맛있어서 또 사러 갈 예정.😛😛 차 사고를 당하고 정신을 잃어 풀떼기만 사왔나봐요. ㅋㅋㅋㅋㅋㅋㅋㅋ 아, 치아바타 빵도 사왔는데 진짜 진짜 존맛탱구리. 슬라이스해서 2/3는 냉동 보관하고 나머지 2피스 먹는데 팬프라이로 살짝 구워먹는데 와우 이거 너무 쫄깃쓰 너무 맛있어요. 생협 오아시스에서 나오는 올리브 치아바타 꼭 사드세요! 심지어 살짝 구운 치아바타에 페이장브레통 게랑드 솔트 버터 올려먹으면 말해모해 말해모해🥲🥲 오아시스마켓 한성대역점 서울특별시 성북구 성북로 12 1층 홍꼬꼬닭강정 📍서울 성북구 보문로40길 29 📞02-922-5582 성신여대입구, 성북동, 안암동 등지에 존맛 #닭강정 못 만나서 슬펐는데 드디어 만났습니다! #돈암시장 #홍꼬꼬닭강정 나의 동네 닭강정 맛집 진짜 존맛탱구리! 수영하고 나오는 길에 닭강정이랑 생맥주 한 잔! 수영하고 나와서 너무 허기가 져서 지도 켜놓고 닭강정 폭풍 검색하다 만났다 카카오맵 후기에 매콤간장 후기가 제일 많아서 매콤간장으로 먹었는데요 진짜 골때려요. 존맛탱구리. 만원의 행복💸💸 진짜 맛없는 닭강정집은 닭이 매말라 있는데 여기는 촉촉하고 너무 맛있었다. ㅋㅋㅋㅋㅋㅋㅋㅋㅋㅋㅋㅋㅋ ☺️☺️☺️☺️☺️ 너무 행복해요. 홍꼬꼬닭강정 돈암점본점 서울특별시 성북구 보문로40길 29 비전스트롤 망원동 커피 찐맛집 📍서울 마포구 망원로 61 ⏰목-월 09:00-22:00 (매주 화,수 휴무) 📞0507-1375-1002 몰랐는데 줄서는 카페답게 매주 화,수 휴무구나! 대단해 대단해!!! 혼자 보내는 토요일 저녁. 등산 후에 씻고 다시 길을 나섰다. 며칠 전에 본 친구의 #버터푸딩 포스팅때문에 비전스트롤의 버터푸딩이 너무 먹고싶더라고요? 씻고 이래저래 하다보니 시간이 늦어져서 망원동 도착하니 7시 10분경이었다. 저녁 피크시간대라서 웨이팅 안할 줄 알았는데, 4팀 가량 웨이팅 있었고, 나는 30분 이상 기다렸다가 카페 입장할 수 있었다. 눈 침침한 사람은 저녁에 못 오겠다. 또 말 그림 액자 아래에 앉았다. 여기 진짜 내 지정석이야 뭐야? 혼자 카페가면 지겨울까봐 혹시나 싶어서 노트북 들고 갔다. 원래 핫플에서는 노트북 사용 일절 금지해놓은 경우가 많았지만 여차하면 버터푸딩 먹고 다른 카페 가려고 했거든요. 근데 여쭤보니 노트북 사용 완전 가능하다고 한다! 와! 너무 좋아! 카페라떼 ... 5,000원 + 디카페인 ... 500원 밤이라 #디카페인 #카페라떼 마셨는데요. 진짜 거짓말 아니고 근래 마신 라떼 중에 제일 맛있었다. 나는 아무리 생각해도 비전스트롤 커피가 내 입맛에 완벽하게 맞아. 버터푸딩 ... 10,000원 플래쉬 터뜨리니까 힙해졌어. 마음에 들어! ㅋㅋㅋㅋㅋㅋㅋㅋ 버터푸딩은 15-20분 정도 소요된다고 했고, 그 시간 동안은 블로그 포스팅 열심히 적었다. 물론 휴대폰으로도 쓸 수 있지만, 나는 휴대폰 보다는 역시 노트북이다! 무겁지만 맥북에어 들고가길 참 잘했지. 생각보다 빨리 나온 버터푸딩!! 냄새와 비쥬얼이 증말 넘사벽인데요!!! 제가 한번 먹어보겠습니다?! 다만, 첫 입에는 아주 호기롭게 맛있었는데 이게 먹다보니 혼자 다 먹을 수 있는 디저트는 확실히 아니더라는 생각을 다시 한번 더 했다. 많이 남기고 와서 좀 안타까웠는데, 이걸 블로그에 기록해두고 다음에는 꼭 2인 이상 방문할 때만 먹기로 해요. 비전스트롤 서울특별시 마포구 망원로 61 1층 4,500원짜리 #콩나물국밥 얌얌얌 전주가콩나물국밥전문점 망원역점 서울특별시 마포구 월드컵로 93 일성빌딩 살빼면 헐벗고 다니고 싶은데 살빼기 힘드니까 일단 집에서만 헐벗고 있다. ㅋㅋㅋㅋㅋㅋㅋ 이상한 말일 수도 있는데 나이드니까 옷도 거추장스러워서 진짜 뭘 대충 하나만 입고 싶음... ㅋㅋㅋㅋㅋㅋㅋㅋ 최대한 피부에 닿는 면적 적게...😅 오늘도 이렇게 노화 타령하면서 일기를 마무리하네요? 세월이 흐르는건 상관없는데 내 몸이 노화하는건 너무 슬퍼. 게다가 그냥 노화도 아니고 이제는 그냥 막 아파. ㅋㅋㅋㅋㅋㅋㅋㅋㅋㅋㅋㅋㅋㅋㅋㅋㅋ"
완벽한 커피와 디저트가 있는 곳:: 망원동 비전스트롤,"오늘은 내가 사랑하는 카페, 아끼는 카페인 망원동 비전스트롤(visionstroll) 포스팅 망원동에 정말 수 많은 카페가 있고 또 그 중 많은 곳을 가봤지만 드물게 거의 모든 것이 마음에 드는 카페다.(화장실은 제외한) 완전히 내 취향 가득🫶 비전스트롤은 버터푸딩이나 블루베리 갈레트 등과 같은 디저트가 유명하지만 개인적으로는 커피가 매우 맛있는 커피 찐맛집이다. 가볍고 향긋한게 첫 입 마시면 띠용👀 됨....☕️ 비전스트롤 서울 마포구 망원로 61 1층 0507-1375-1002 09:00~22:00 매주 화요일, 수요일 정기휴무 ✔️비전스트롤은 매주 화요일, 수요일이 정기휴무일이다. 우리는 비내리는 날 일요일 오후 2시가 되기 좀 전에 방문했다. 이 시간까지 자리가 아직 남아있던 것은 아마도 비가 왔기 때문. 원래라면 얄쨜없음. 전에 왔을 때는 bar 테이블에 앉았는데(파란의자) 오늘은 운좋게 편한 등받이 의자 자리 선점 성공❤️ 인테리어도 우드 감성이 가득하다. 역시 나는 대리석보다는 나무가 취향인 듯. 38000짜리의 살 수 없는 키링 키링보다 나는 커피잔이 더 가지고 싶다. 카운터에는 호밀 휘낭시에, 코코넛 마카룬, 시나몬 버터 스틱이 있다. 그리고 소소하게 비전스트롤의 마스킹 테이프 MD도 있음. 물론 이 디저트들도 좋지만 나는 더 묵직하고 강렬한게 먹고 싶으니까 얘네들은 다음 기회에! 몰래 찍어서 미안해 갱쥐야... 진짜 너무 예뻐서 인형인 줄 알았어🤍.. 비전스트롤 메뉴판 분명 욕심이 나는 음료들이 몇 있지만 여기는 아메리카노가 너무 맛있어서.. 또메리카노 주문했다. 나중에 바닐라빈 라떼, 초코쉐이크, 와일드 플라워 먹어보고싶다! 번외로 비전스트롤은 진토닉과 위스키도 판매한다. 그치만 카페에서 마시는 커피가 최고니까. 나는 커피로 커피가 먼저 나옴. 무심하게 잘라놓은 가죽 코스터가 아직도!? 그리고 오늘은 블루베리갈레트를 주문했다. 처음 먹어보는데 두근두근 ⋯ 이 날 비가 추적추적 왔는데 창가 자리에 앉아서 커피마시니까 너무 좋았다. 역시 비는 안에서 구경하는게 zㅣ존. 밖에 비온다 주륵주륵💧 그리고 우리가 들어오고 나서 5분만에 매장이 꽉 찼다. 심지어 커피를 반 정도 마셨을 때는 외부에 웨이팅하시는 분들로 바글바글했음. 나갈 때 보니까 웨이팅 페이퍼에 사람들 한 가득.. 이 날은 아주 운수 좋은 날이었다. 망원동에서 음식점, 카페 총 다섯 군데를 갔는데 아무곳도 웨이팅 하지 않고 프리패스 ˘◡˘♡ 암튼 다시 블루베리 갈레트로 돌아와서,,🫐 - 블루베리 갈레트 아주아주 바삭 어쩌면 파삭한 갈레트 위에 블루베리 콩포트가 빼곡히 올려져 있고 생크림 한 스쿱이 올라가 있다. 먹는 방법 생크림을 잘 펴바르고 4등분을 한 뒤 손으로 먹는다. 그래서 물티슈도 함께 준비해 주셨음. 블루베리 콩포트는 적당한 단맛이 나서 좋았고 생크림 역시 느끼하지 않고 우유 맛이 강해서 맛있었다. 아주 조화로운 존맛 디저트! 갈레트는 무슨 맛이냐면 아주 맛있는 크로와상 겉면에 설탕 또는 시럽을 바른뒤 바삭하게 구워낸 달달한 파이 인데 그거보다 좀 더 맛있음. 이건 전에 왔던 사진🩷 이 때도 역시 금비랑 왔었다.. 진정 나의 망원동 메이트여 버터푸딩을 먹었는데 이름이 왜 버터푸딩인지는 잘 모르겠다. 그냥 ‘젼나 맛있고 진한 초코 푸딩 크로와상에 아이스크림 많이’ 로 이름 바꿔야할 듯🍫🥐 가격은 13,000으로 좀 비싼 편이었는데 맛있으면 가격 안보는건 국룰. 달달함이 쎈 디저트라 내 혓바닥이 버텨준다면 몇 개고 먹고 싶은 맛이다. 처음 먹었을 때 그 충격을 잊지못해.. 다른 날 다른 사진입니다. 한결같은 앵글. 다들 망원동 가면 비전스트롤 꼭 가보시라! 개인적으로는 블루베리 갈레트보다는 버터푸딩이 더 짱짱 ..❤️ 비전스트롤 서울특별시 마포구 망원로 61 1층"
망원동 카페 비전스트롤 / 버터푸딩을 먹기위해 가야하는 곳 / 웨이팅 정보,"망원동 카페 버터푸딩 꼭 먹어야하는 비전스트롤 매일 9시 ~ 22시 (매주 화, 수 정기휴무) 비전스트롤 서울특별시 마포구 망원로 61 1층 버터푸딩 먹으러 방문한 망원동 카페 비전스트롤 ! 🥐🥐☕☕ 처음 방문했을때는 웨이팅이 없었던거 같은데, 그 다음 방문할때는 소문이 많이 났는지 웨이팅 1시간,,, 이래서 매번 포기하다가 오랜만에 다시 웨이팅 도전했다 ㅎㅎ 비전스트롤스러운 웨이팅리스트 ㅋㅋㅋ 저기에 휴대폰번호 뒷자리와 사람수를 적으면된다 이정도 웨이팅이면 기다릴만 하징 ㅋㅋ 저기에 적어두고 바로 근처에 있는 올리브영가서 시간을 보내다가 오면 딱임 귀여운 댕댕이 올리브영안까지는 들어가지 못하고 밖에서 기다리고 있다 ㅎㅎ 웨이팅리스트에 올리고나서 갑자기 우리뒤로 5명이 주르르륵 달렸음 휴 빨리와서 적길 잘했다 ㅜㅜㅜ 이번에는 웨이팅 20분정도 한거같다!! 얏호 선방했음 ㅋㅋㅋ 아무래도 카페이다보니 사람들이 잘 빠지질않아서 타이밍 안좋으면 오래 기다려야할수도있다 흑 디카페인 커피랑 비전 에스프레소, 아메리카노 그리고 버터푸딩도 주문했다 블루베리 갈레트도 먹고싶었는데 이거 먹고 바로 저녁먹으러 갈거라서 포기 ㅠㅠ 비전스트롤만의 감성이 느껴진다 이건 처음 왔을때 너무 맘에 들었던 컵인데 보니까 판매도 하고 있더라 ㅋㅋㅋ 오른쪽에 있는 컵이 35,000원 살까말까 고민되기 시작했다 디자인 자체는 매우매우 마음에 드는데!! 친구들한테 이거 살까? 물어봤더니 착한 ISFP, ESFJ 친구들이 돌려돌려서 별로라고 말해줬다 ^^ 눈치없이 살뻔했네 설거지가 힘들지 않을까? 씻기 힘들거같은데 배려있게 이야기해줘서 그냥 안사기로 결정 좁고 사람이 많다 ㅋㅋㅋ 웨이팅이 많을수밖에 없음 ㅠㅠ 테이블이 적으니까 그래도 창가쪽에 앉을수 있어서 좋았음 이 컵에 담아줬음 했는데 오늘도 컵 운 꽝입니당 ㅜㅜㅜ 비전 에스프레소라고 하는데 럼이랑 꼬냑이 들어갔다고 한다 ! 오 이런 에스프레소는 처음이야 ㅋㅋ 먼저 스푼에 묻어있는 꼬냑의 향기를 맡은 후에 에스프레소에 넣어 휙휙 저은 후 마시면 된다고한다 꼬냑을 넣고 안넣고 맛의 차이가 있어서 꼭 넣고 휙휙 저어주기 !! 오늘 커피를 3잔째 마시고있는 친구들 카페투어가 쉬운듯 쉽지않다 ㅋㅋㅋ 그리고 오늘 아침부터 쉴틈없이 일하고 있는 위장 ㅜㅜ 힘내 위장 !! 만드는데 15분? 20분정도 걸린다는 버터푸딩도 나왔당 우왕 ㅎㅎㅎㅎ 너무 먹고싶었어 버터푸딩 뭔가 초코푸딩이면 초코푸딩이지 버터푸딩의 비주얼이 아니긴한데 ㅋㅋㅋ 여튼 너무 맛있다 초코크로아상을 쪄낸뒤 중간에 아이스크림을 넣어줬는데 그냥 바삭한 식감의 초코 크로아상이 아니라 쫀득한 느낌의 크로아상이라서 더 매력이 넘친다 쫀득한 식감에 초코까지 더해졌고 거기에 바닐라아이스크림까지 더해져서 이건 맛이 없을수가 없는 조합이다 ㅋㅋㅋ 초코쟁이들은 꼭 먹어봐야함 쫀득하고 시원하고 달달한 매력이 장난아니다 바닐라아이스크림이 녹으면서 쫀득한 초코 크로아상사이로 스며들어 더 촉촉하고 맛있어지는데 아이스크림이 생각보다 빨리녹아서 ㅋㅋ 빨리먹던가,, 아니면 스푼이 절실했다 스푼으로 떠먹어야할거 같았음 ㅋㅋ 아이스크림이 녹으면서 줄줄 흐른다 ㅠㅠ 근데 너무 맛있다는거??? 빨리먹어야함 근데 저 상태가 돼도 맛있어서 매력넘침 커피도 맛있고 디저트도 맛있는 망원동 비전스트롤 !!🥐🥐☕☕ 웨이팅할만한 가치가 있는 카페인거같다 오늘도 역시 실망시키지않는 버터푸딩 매일매일 먹고싶당 ㅎㅎㅎ #망원동카페 #망원카페 #비전스트롤 #망원동비전스트롤 #비전스트롤웨이팅 #버터푸딩 #망원역카페"
"망원동 비전스트롤, 서울 푸딩으로 유명한 버터푸딩 그 이유는?","안녕하세요, 이웃님들 나또취입니다. 지난번에 언니랑 전부터 궁금했던 서울 푸딩으로 유명한 버터푸딩을 먹으려고 망원동 비전스트롤에 다녀왔어요. 그래서 그 후기를 좀 풀어보려고 해요. 서울 푸딩으로 왜 유명한 것인가. 망원 비전스트롤이 생기자마자 버터푸딩을 먹기 위해 온 사람들이 정말 많아 웨이팅이 늘 있었어요. 그래서 갈 엄두도 못내다가,, 저희가 갔을 땐 마감 2시간 전 + 평일이라 마지막 자리,, 하나 남은 거 웨이팅 없이 겟 ! 평일 저녁에 갔음에도 생각보다 꽤나 많았던 사람,, 그리고 운 좋게 웨이팅 안하고 남은 한 자리 겟또~! 아쟈뵹 너무 좋았고요.. ㅎㅎ 웨이팅 평소에 안좋아해서 ..! 원래는 워낙 여기가 서울 푸딩으로 유명한 핫플이다 보니 사람이 정말 많고 늘 웨이팅 국룰이었는데요..!?! 그래도 유명해진지 좀 되어 그런가 아님 마감시간 임박해서 그런가 비교적 전보다는 사람이 덜해서 좋았어요. 원래는 진짜 많고,, ㅎ 갈 엄두도 못냄요. 망원동 비전스트롤 영업시간 월/목/금/토/일 : 9:00 ~ 22:00 화요일 / 수요일 정기휴무 주변 카페들에 비해서 여기가 훨씬 빨리 오픈하는데요! 그래서 좋은 것 같아용. ㅎㅎㅎ 비밀의 카페마냥 어둑어둑한 분위기. 근데 저는 이런 어두운 분위기를 사실 별로 좋아하진 않아요,, ! 왜냐하면 셀카가 잘 나오지 않아서,, 헿 저는 밝은 카페에서 자연스럽게(?) 웃으면서 사진 찍는 걸 좋아해서요! ㅎ 어두운 분위기의 망원동 비전스트롤 그치만 사람은 정말 많았고 여기서 유명한 버터푸딩 말고도, 꽤나 다양한 디저트류들이 많았어요. 버터푸딩 말고 어쩌면 다른 메뉴들이 더욱 맛있을 수도 있겠다는 생각이 들었어요. 어두운 느낌인데 나름 갬성 넘쳐요. 셀카는 잘 안나오지만 한 가지 통일된 무드로 카페를 꾸며놓으셨답니다. 보통 저는 푸딩 파는 카페 생각하면 밝고 귀여운 캐릭터 카페이거나 아니면 차분한 베이지톤의 카페를 떠올리게 되는데 여기는 아니더라고요! 커피 메뉴도 있고 논카페인 메뉴도 다양해서 고르는 재미가 있었고 좋았어요, 그리고 곳곳에 놓인 인테리어 구경하는 재미도 있었고 무엇보다 여기 아아 맛집! 원두를 함께 팔고 있더라고요! 원두는 선물하기 정말 좋을 거 같아요. 그리고 마스킹 테이프,, 이걸 누가 살지는 모르겠지만 팔긴 해요. 원두는 두 가지 중 고를 수 있고 노트가 다 적혀 있어 원하는 걸 고르면 돼요. 근데 저희는 디카페인 시켜서,, ㅎㅎ 원두를 따로 안골랐습니다, ㅎ 저희가 주문한 건 아이스 아메리카노 디카페인 원두로 시켰고요! (밤이라) 디카페인은 500원 추가 해야해요. 그리고 여기 블루베리 갈레트도 유명하던데 저는 상콤한 것보다 달달한게 저날 더 땡겨서 버터푸딩을 먹기로 해서 푸딩으로 쥬뮨 !! 원투 패키지는 선물하기 정말 좋은 듯 커피 좋아하는 친구에게 선물하면 좋을 듯 하고 그게 아니더라도 가볍게 집들이 할 일 있거나 하면 빈손으로 가기 그럴 때 사가면 좋을 듯 영화를 싫어해서 해리포터를 본 적은 없지만 뭔가 그런 느낌,, 마법의 공간 나만 아는 공간 느낌처럼 비밀스럽게 꾸며두셨습니다. ㅎㅎ 각종 디저트가 많았던 망원동 비전스트롤 팁도 줄 수 있지만,, 흐음 시나몬 버터 스틱 양은 70g 4500원, 시나몬을 좋아하신다면,, 근데 도전하기에 70g은 너무 많아요.. 입에 안맞으면 오또케 오또케,, ~ 코코넛 마카롱,,? 내가 아는 그 마카롱.? 왜 비주얼은 다른 거지,,? 근데 바삭바삭 맛있어보이는데용? 호밀 휘낭시에,, 이거 참 맛있게땨 싶었던 메뉴였어요. ㅋㅋㅋ 달달구리 + 고소할 듯한 느낌 ! 그치만 이때 이미 저희 마제소바 배 터지게 먹어서 결국 디저트는 버터푸딩 하나만 먹기로 했어요. 서울 푸딩으로 유명하다고 하니까 먹어보긴 해야겠고,, 다른 것도 궁금하지만 그냥 다음에 먹어보기로. 여기.. 컵과 모자도 팔고 있어요! 근데 막 제 취향은 크게 아니라서 구경을 하지는 않았답니다..! 10시에 마감이라 그런지 9시 30분 정도부터는 사람이 거의 없었고, 그 덕분에 빈 매장을 찍을 수 있었어요. 나름 넓고 분위기 있어보이는데,, 생각보다 사람 많은 거에 비해서는 시끄럽진 않은데 그렇다고 조용하지도,, 그냥 적당한 느낌이에요! ㅎㅎ 겨울엔 옷 걸 수 있는 옷걸이가 있는 듯, 망원동 비전스트롤 꽤나 섬세하네... 아이폰 야간모드로 찍으니까 좀 더 밝게 찍힌 것 같긴 한데,, 실제로는 이것보다는 약간 어두워요. 정말 유럽 갬성 나는 듯한 카페,, 취향은 아니지만 예쁘긴 하네용! ㅎ 아무래도 취향 타는 인테리어 느낌인데 그래도 나름 분위기 좋은 카페에용~ 디카페인 저는 마실 때마다 산미가 좀 있어서 별로였는데 여기는 오히려 고소한 맛이 있어서 제 입에는 좀 더 잘 맞는 듯 했어요. 그리고 망원동 비전스트롤은 일반 카페에서 주는 아메리카노 잔보다 좀 더 큰 것 같아서 더 좋았어요. ㅎㅎ 서울 푸딩으로도 유명하지만 여기는 티코스터도 유명하다고,, 언니가 알려줘서 사진 찍어봤어요. ㅋㅋㅋ 아 그리고 여기 가을에 온 사람 보니까,, 앞에 은행나무가 있어서 더 멋있었어요. 와 망원동에 이런 곳이? 하는 느낌이라 여긴 여름보단 가을에 또 오고싶은 곳이에요. 가을 평일 낮에 오고싶어요. 아메리카노와 버터푸딩 같이 찍기.. 어,,? 내가 생각한 푸딩은 이게 아닌데 싶긴 했지만 이게 버터푸딩이래요! 근데 여기서 버터맛은 안났고,, 카카오파우더맛이 진하게 났어요. 비주얼은 엄청나게 달 것 같은데,, 생각보다 또 그러지 않고 위에 올라간 아이스크림이 제일 달달해요. ㅋㅋㅋ 그리고 초코 크루와상?이 꽤나 폭신 겉은 바삭한데 아이스크림이랑 만나니 약간 눅눅해지고 촉촉해지는데요! 이상한 초코 같은게 씹히는데 특이했어요. 그렇다고 또 가서 두 번 먹을 맛은 아니었는데 그냥 한 번 쯤 호기심에 먹을만한 느낌? 서울 푸딩으로 왜 유명한건진 모르겠다 ~ 고급스러운 초코맛은 나는데 식감이 푸딩이라고 하기엔 좀 그렇고,, 특이한 느낌 근데 제가 버터푸딩이 망원동 비전스트롤에만 있는 줄 알고 검색해봤는데 수원에도 있어요, 근데 진짜 아이스크림 양이 다 제각기 느낌.. 아무튼 한 번 다녀온 걸로 만족하고 다음엔 커피만 먹으러 가는 걸로,, ㅎㅎ 워낙 일반 푸딩이 흔해서 그런가 버터푸딩이라는 메뉴가 독특해서 서울 푸딩으로 유명한 것 같은 망원동 비전스트롤 후기였습니다! 비전스트롤 서울특별시 마포구 망원로 61 1층 비전스트롤 베이크샵 서울특별시 마포구 망원로 61 (망원동) 비전스트롤 로스터스 서울특별시 마포구 망원로 61 2층 위치는 망원시장 지나면 있고, 근처 맛집으로 망원동 한강껍데기 있어요. 거기 목살이랑 죽밥 맛있음,, 강추추추추추 (껍데기는 못먹는 메뉴라 모르겠어요..)"
