title,content
[200221]망원동 비전스트롤/연남동 파델라/ 카카오프렌즈 라이언카페,저번에 못간 비전스트롤을 가려구 일찍??(2시) 나왔다 ㅋㅋㅋㅋㅋㅋㅋㅋ 3-4시 넘어서 가면 빵 나올때까지 기다랴야된다 해서 빠르게 으차으차 비전스트롤 서울특별시 마포구 망원동 422-32 가게가 커보였는데 생각보다 앉을수 있는자리가 매우매우매ㅐㅐㅐㅐㅐㅐ우 적다ㅠㅠ 테이블 합석은 기본인듯ㅋㅋㅋㅋㅋ 우리도 바 자리에 나란히 앉지도 못하구 ㄱ자로 된데에 앉았당 ㅠㅠㅠ하필 불편한 자리ㅠㅠㅠ 비전스트롤 대표메뉴 버터푸딩이랑 콜드브루를 시킴! 비전스트롤 스티커 기념으로 하나씩 챙겨옴ㅎ 버터푸딩은 오래걸려서 커피부터 나옴! 콜드브루 병도 이쁘고 컵도 예쁨 내가 자취했으면 저 병 가져갔을꺼야......🥺 블로그 갬성은 동영상 하나씩 필요하니까:) 커피마시면서 기다리니까 나온 버터푸딩!! 뜨끈한 빵에 아슈크림 조합은 언제나 옳다구요ㅠ 확실히 저 아래에 있는 빵이 아슈크림에 촉촉해져서 더 맛있어ㅠㅠ 저기가기전에 언니기다리면서 산 위글위글케이스 졸기탱탱탱 여기서라도 봄이오는걸 느낀다ㅠ 빵 먹고 커피먹고 다시 밥먹으러 감 ㅋㅋㅋㅋㅋㅋㅋㅋㅋㅋㅋ ㅋㅋㅋㅋㅋㅋㅋㅋㅋㅋㅋ ㅋㅋㅋㅋㅋㅋㅋㅋㅋㅋㅋ 푸딘코에 올라온 피자맛집을 감 내부가 좁다해서 일찍갔은데 두둥 예약제.........ㅎㅎ 인스타(??)로 예약제인지 누가 알았겠냐구요ㅠ 언니가 피자가 먹고싶다해서 찾다가 나온 연남동 파델라! 파델라 서울특별시 마포구 연남동 567-34 1층 오늘의 디너 첫손님은 우리였나봄......!! 하긴 5시반인가 갔으니 그럴만도 ㅋㅋㅋㅋㅋㅋㅋㅋㅋㅋ 와인 글라스 두잔이랑 와인에이드! 와인도 맛있었구 에이드는 말할것도 없지😋 특별한게 없었는데 이거부터 너무 맛있었어ㅠㅠ 이 양이 무려 여자 세명이서 다 시킨 음식 ㅋㅋㅋㅋㅋㅋㅋㅋㅋㅋㅋㅋㅋ 커피에 빵도 먹고왔는데 진짜 푸파 미쳤다 언뜻보면 적어보일(?!??)수도 있지만 진짜 한상 가득ㅠ ㅋㅋㅋㅋㅋㅋㅋㅋㅋ ㅋㅋㅋㅋㅋㅋㅋㅋㅋ ㅋㅋㅋㅋㅋㅋㅋㅋㅋ 그리고 너무 당연하게도 ✨올클리어✨ 정말 우리 너무 멋져 🥺🤜 🤛😊 이제 밥먹었으면 뭐다? 식후 아아타임😎 홍대역 버정에서 가ㅏㅏㅏㅏ장 가기쉬운 카페가 어디일까 했을때 생각난 라이언카페!! 카카오프렌즈홍대점 서울특별시 마포구 동교동 165-5 카프샵은 그렇게 자주갔는데 정작 라이언카페는 처음ㅋㅋㅋ 분명 3층이라 안간걸꺼야. 마카롱 진짜 너ㅓㅓ무 귀여워ㅠㅠㅠㅠ 안살수가 없자나ㅠㅠ 주문하고 기다리는 동안 구경하기ㅎㅎ 맥이랑 콜라보는 케이스가 노래서 그런지 맥 특유의 총알느낌이 안난당 테이블마다 라이언 무드등이 있음....!!!!! 자꾸 만지게 되는 졸기탱 라이언🙀🙀 (코로나 조심🥺🙏) 어피치였나 엄청 큰 인형 옆자리 앉고 싶었는데ㅠ 인기자리라 못앉음 구석구석 카카오 프렌즈 장식도 많구 우리집이었음 좋겠다~!~~! ㅋㅋㅋㅋㅋㅋㅋㅋㅋㅋㅋㅋㅋㅋㅋ 여기서 막 퇴근한(ㅠㅠ) 문대리언니를 만나 언니 저녁먹을겸 근처 피자파는 집에 가서 우린맥쥬 언니는 피자를 먹구 아 맥주가 되게 쌌는데 저집 이름이 기억안난다 암튼 간만(?)에 서울 자매즈 다 모여서 코로나 욕이랑 신천지 욕 와방많이하구 ㅋㅋㅋㅋㅋㅋㅋㅋㅋㅋㅋㅋㅋㅋ 행복했던 푸파데이를 끝냈다-! #망원동 #망원동카페 #비전스트롤 #망원동비전스트롤 #콜드브루 #버터푸딩 #연남동 #연남동맛집 #파델라 #연남동파델라 #연남동피자맛집 #연남동파스타맛집 #연남동스테이크맛집 #연남동저렴한맛집 #카카오프렌즈 #홍대카카오프렌즈 #라이언카페
망원동 핫플 카페 비전스트롤,"안녕하세요 감자입니다 ღ'ᴗ'ღ 얼마 전 망원동 나들이를 다녀왔을 때 당충전이 필요해 버터푸딩 맛집으로 유명한 비전스트롤을 다녀와 후기를 남겨볼까 해요. 비전스트롤 서울 마포구 망원로 61 1층, 2층 목-월 12:00~21:00 (매주 화, 수 휴무) 국민지원금 사용 및 반려동물 동반 가능 망원역 2번 출구에서 도보 15분 내 거리에 있어요. 별도 주차공간이 없기 때문에 차량 이용 시 공영주차장에 주차 후 도보 이용을 추천드려요. 비전스트롤은 간판이 없는 카페임에도 꾸준히 핫플인 곳이라 항상 사람이 많답니다. 1층은 커피메이커, 2층은 베이크샵으로 운영되며 1층은 만석이라 2층으로 안내를 받았답니다. 작년 초에 방문했을 때는 분명 한 층만 있었는데 사람이 많아지며 확장 오픈한 것 같더라고요. 들어가자마자 벽면에 붙은 포스터들이 보였고 신메뉴인 블루베리 갈레트에 눈이 가더라고요. 군데군데 카페에서 제작한 굿즈도 진열 판매하고 있어 구경하는 재미도 있었답니다. 특히 카운터 옆 벽 선반에 진열된 콜드브루, 시럽, 컵과 텀블러백 등은 꽤 탐나더라고요. 내부는 아이보리&우드톤 인테리어로 깔끔했고 차분하면서도 은근히 힙한 분위기가 좋았어요. 2~4인용 좌석이 넉넉하게 준비돼 있었고 원하는 자리를 선택하되 자리 이동은 불가해요. 3인 이상 이용할 수 있는 테이블 뒤로 작지만 창이 나있어 푸릇한 뷰가 보이는 것도 좋았고요. 특히 베이크 공간이 너무 마음에 들었는데요? 버터&설탕 단내가 가득 풍겨 계속 눈이 갔는데 어두운 우드톤 인테리어에 은은한 조명이 더해져 빈티지하면서도 감성적인 분위기가 좋았어요 ♥ 메뉴&가격 커피, 논커피류 음료수&진토닉, 위스키 등 주류와 함께 다양한 디저트들이 준비돼 있답니다. 아이스 아메리카노2 (9.0) + 버터푸딩(8.5) = 17,500원 버터푸딩은 새로 만들어 20분 정도 걸린다 했고 오랜만에 먹고 싶어 기다리기로 결심했어요. 기다리는 동안 음료를 먼저 받았고 알록달록한 글라스 컵이 힙하면서도 귀여워 탐나더라고요. 아메리카노는 산미가 강한 편이라 호불호가 갈릴 것 같지만 디저트랑 먹기엔 괜찮았어요. 오랜 기다림 끝에 갓 구운 따끈따끈한 디저트가 나왔고 아이스크림이 녹기 전에 먹고 싶어 평소보다 빠르게(대충) 떼샷을 찍었답니다. 딱 보기에도 달달하니 먹음직스러워 보이죠? 버터푸딩은 갓 구운 크로와상을 반으로 갈라 빈틈없이 초콜릿 코팅을 하고 식힌 뒤 사이에 바닐라 아이스크림을 담아 준답니다. 칼질 장인에게 커팅을 맡겼는데 생각보다 딱딱하지 않아 자르는 게 힘들어 보였어요. 겉은 바삭하지만 속은 폭신폭신하다고 보면 돼요. 먹기 좋게 자른 뒤 아이스크림과 함께 먹으면 입안 가득 달달한 초코맛이 강하게 퍼져 눈이 확 떠질 정도로 충격적인 단맛이 나요. 세상 달면서도 부드러워 계속 손이 갔어요. 처음 방문했을 때는 콜드브루와 라떼를 마셨는데 확실히 산미 있는 원두라 라떼가 더 맛있었어요. 그때도 버터푸딩을 먹었는데 한 입 먹자마자 세상 달다며 당충전을 몰아하는 기분이라 했는데 워낙 중독성 강한 단맛이라 금세 다먹었답니다. 자주 먹기엔 무리지만 1년에 한 번 정도 피곤하거나 당 떨어질 때 생각나는 맛으로 내년쯤 또 생각나 먹으러 가지 않을까 싶어요 ♥ 망원동에서 달달한 디저트가 먹고 싶거나 분위기 좋은 핫플 카페를 찾을 때 추천드려요. 워낙 유명해 사람이 많다는게 흠이지만요?"
망원동 비전스트롤(버터푸딩),"비전스트롤 서울특별시 마포구 망원동 422-32 비전스트롤 보이자마자 줄 서있는사람들 모습부터 보였다 ㅎㅎㅎㅎ 여기 의자 뒤로 줄 스면된다 이름적고 이런거없음 날씨 좀 풀려서다행이지ㅠ 그래도 앞에 세팀 있어서 기다릴 수 있었다 휴,,💨 대문 메뉴판 서부느낌 물씬 음악도 서부느낌 음악이 좀 시끄러웠다 나랑안맞나봐 😵 #버터푸딩 나란히 나란히 대기중인 버터푸딩 우리자리 세명 잔이 특이하다 ㅋㅋㅋㅋㅋㅋㅋ 초코크로와상에 아이스크림 나는 단걸좋아해서 먹자마자 너무 맛있었다 이때 좀 피곤했는데 당충전 ㅈㄴ한느낌 ㅋㅋㅋ 정신 확 차려짐 아이스크림이랑 같이 한입에 넣어줘야해 드럽,,,, 다들 이렇게 되는거 맞지,,? 우리만 더러운거아니지? 또 시킴 너무 맛있어서ㅋㅋㅋㅋㅋㅋㅋㅋㅋㅋㅋㅋㅋㅋㅋㅋㅋㅋㅋㅋㅋㅋㅋㅋㅋㅋㅋㅋㅋ 근데 하나만 시키는게 나았다 두번째는 괜히 시켰다싶었다🤣🤣 너무 달아서 금방 질려버렸다,,, 단점은 커피가 맛이없다 산미감있고 내가 싫어하는맛 반넘게남긴듯 커피진짜맛없,,,☹️ 커피가 맛있었으면 버터푸딩 더 먹을 수 있었을듯 남았어요ㅠㅠ 아까워 지금 먹으라고하면 먹을 수 있음 우리들어오고 줄 더 길어졌고 요즘 웨이팅싫어서 또 오진않을듯?? 한번쯤 가보기 좋은곳"
망원동카페 비전스트롤 디저트가 맛있는 분위기 좋은 카페 다녀왔어요,"안녕하세요 망원동카페에 다녀왔습니다! 버터푸딩과 디저트가 맛있는 '비전스트롤' 후기에요! 저번에 방문했을때 사람이 많아서 못 간 비전스트롤ㅠ 이번엔 꼭 가야겠다 생각하고 오픈런 go! 토요일 기준으로 12시 15분 2등으로 도착했습니다 비전스트롤은 2층과 1층으로 나누어져있는데 2층말고 1층에서 기다리면 됩니당 매장 위치 : 서울 마포구 망원로 61 (망원동) 매장 영업시간 : 12:30 ~ 21:00 매장 휴무일 : 화요일•수요일 •매장 내부• 12시 30분이 되면 직원이 한팀씩 입장하게 해줘요 한팀씩 입장하니 여유롭게 자리를 고를 수 있어서 좋았고 저는 2층 창가 자리를 골랐습니다 해가 따뜻하고 분위기가 좋았어요! 2층 창가자리 2곳이 있고 보통 2~3인석이라 4인 이상은 비추해요 저번에 5인으로 웨이팅 적었는데 연락이 안온거 보면.. 4인은 모르지만 5인은 확실히 불가능인가 생각ㅎ 비전스트롤 메뉴입니다! •비전스트롤 후기• 주문메뉴 : 아이스아메리카노, 리틀디킨스, 버터푸딩, 블루베리갈레트 •아이스아메리카노• 컵이 너무 귀엽죵!! 이 컵 너무 탐났어요ㅎㅎ 이 컵을 본 것만으로 아아시키길 잘했다 생각했고 커피맛집이라고 후기보고 기대해서인가 맛은 평범했습니다! 얼음이 짱커요ㅎ •리틀디킨스• 향이 좋았고 뜨끈 뜨끈 몸 녹이기 좋아요 •블루베리갈레트• 직원분께서 크림을 펴서 손으로 먹고 손을 닦으라고 설명해주셨어요! 얇은 엄마손 파이에 블루베이잼 그리고 크림이고 비쥬얼이 대박!! 그래서인지 맛이 비쥬얼을 못이겼어요 밑에 빵이 얇고 크림과 잼이 많고 비율이 아쉽고 블루베리갈레드를 쉽게 설명하면 엄마손파이 얇게해서 샹달프 블루베리 올리고 설탕 없이 휘핑친 생크림 먹는 맛이에요 •버터푸딩• 초코비주얼에 버터푸딩이란 말에 너무 궁금해서 꼭 먹어보고 싶었어요!!! 요즘 빵테기였는데 먹는순간 빵테기 치유 완료^^ 크루아상이 바삭하지않고 엄청 부들부들했고 오히려 부드러운점이 포인트같았습니다! 저는 한개 다 순삭 가능할 맛이였고 내 친구는 두입이 한계라네요 빵 초콜릿 아이스크림의 조합 난 싹싹 긁어먹었습니다ㅎ 단거 좋아하시는 분들은 꼭 드셔보세용!! 비전스트롤 베이크샵 서울특별시 마포구 망원로 61 (망원동) #비전스트롤 #망원동카페 #망원카페 #망원동예쁜카페 #망원동감성카페 #망원동분위기카페 #망원동디저트카페 #버터푸딩 #블루베리갈레트 #망원맛집 #망원놀거리 #망원데이트 #망원동맛집 #망원동놀거리 #망원동데이크 #망원역카페 #망원역맛집 #내돈내산 #후기"
유니크한 망원동맛집(홍대맛집) 망원동 파스타: 망원 몰라 (Feat.비전스트롤),"안녕하세요 핑지입니다 일주일 동안 무소식이던 핑지는 오랜만에 🐻‍❄️백꼬미 만나고 데이트를 즐기고 왔어용 🐲💛💚 이번에는 홍대 근처 호텔 글래드마포에서 지내면서 오랜만에 잔잔하고 아기자기한 데이트를 즐겼어요😙 망원동 거리가 맛집과 카페로 유명한 곳이라 여기저기 찾아보는 재미가 톡톡💫❤ 이번에도 참새가 방앗간은 지나치지 않는다고 망원동맛집(홍대맛집)으로 유명한 망원동 파스타 맛집 몰라 (Feat.비전스트롤)을 다녀왔어요 50m © NAVER Corp. 몰라 서울특별시 마포구 망원로 53 #몰라 #망원동몰라 #망원동맛집 #서울맛집 #홍대맛집 #서울맛집추천 망원동맛집추천 #홍대맛집추천 #망원동파스타 #망원동파스타맛집 #비스트롤비전 #망원동맛집홍대맛집망원동파스타몰라 #홍대데이트 #망원동데이트 #망원동곱창파스타 #몰라개복치 #개복치 #망원동개복치 #서울마포맛집 #마포맛집 #마포파스타 #망리단길맛집 #인싸맛집 #힙한맛집 #망원몰라 TEL: 02-3144-2202 주소: 서울 마포구 망원로 53 지번 서울 마포구 망원동 421-15 03958 6) 망원역 2번 출구에서 800m 거리 🐻‍❄️백꼬미와 핑지는 자차를 가져와서 마포구민체육센터 유료주차장에 세우고 걸어갔어요! 망원동 거리가 거의 거주민 전용 주차장이여서 빙빙 돌다가 겨우 찾음... 화장실도 있고 좋아요... 여기에서 살고싶다 이런 서늘서늘 느낌 좋다 저깄구나! 애타게 가르키는 🐻‍❄️백꼬미의 손가락 레드와 블루의 조합으로 시강 끝판왕 망원동맛집(홍대맛집) 망원동 파스타 몰라(Feat.비전스트롤)! 망원동맛집(홍대맛집): 망원동 파스타 몰라(Feat.비전스트롤)의 영업시간은 12:00 - 23:00 15:00 - 17:00 브레이크 타임 (매주 수요일 휴무) 망원동맛집(홍대맛집) 망원동 파스타 몰라(Feat.비전스트롤) 내부 인테리어가 너무 엔틱하고 멋스러워서 사진을 주구장창 남겼어요! 음악도 술을 부르는 ㅋㅋㅋ 힙해요🎶 둠칫둠칫 이날 유이레컬러에서 인생 메이크업 받고 신남 둠칫둠칫 기본적인 생수와 메뉴판이 셋팅되고 정말로 진지한 선택의 시간!!! 이번에는 메뉴 4개를 주문했음 Next image 메뉴랑 리뷰는 미리 찾아보고 가는데 토마토 팍시가 너무 맛있어 보이던... 곱창파스타 (투움바 소스) 차돌박이 알리오 올리오 불고기깔조네 토마토팍시 꿀꿀이 2마리 출몰이닷 오바리 👉🏻 곱창파스타는 곱창 대신 베이컨&새우로 변경 가능하지만 🐻‍❄️백꼬미와 핑지는 오리지널 시그니처로~~~ 소스는 투움바소스와 불닭소스에서 선택! 그리고 몰라의 이름 유래가 뭐냐면 @위키백과 ㅋㅋㅋㅋㅋㅋㅋㅋㅋㅋㅋ 개복치 학명이 영어로 '몰라몰라' 라구요 (콩글리쉬인 줄...🤭🤭🤭) 그런데 갑자기 웬 개복치? 하실텐데 이유는 얘가 그렇게 예민하대요 ㅋㅋㅋ 그만큼 몰라 사장님께서 섬세하시다는 의미!!! 작명 센스에 감탄하고 가요 (사실은 메뉴판 표지 하단에 설명이 있어요) 🐻‍❄️백꼬미와 열렬한 토론 중 기대하던 🍅토마토 팍시가 나왔어요! 생각보다 너무 훌륭한 실물에 두근두근 대박대박 (feat. 열일하는 🐻‍❄️백꼬미 보조) 토마토 뚜껑을 열면 치즈가 쭈욱~~ 2개 모두 열어주는 센스 커팅도 예쁘게 하시는 보조님 🍅토마토 팍시 여성분들이 정말 좋아하실 것 같아요!! 핑지는 생토마토 안 먹는데 얘는 거부감 없이 먹었고 너무 맛있었어요 ㅠㅠ 에피타이저로 강력추천... 다만 시간이 지나면 토마토에서 수분이 나오기 때문에 메인 드시기 전에 바로 드셔주시면 굿👍🏻 이어서 등장하기 시작한 메인들! 망원동맛집(홍대맛집) 망원동 파스타 몰라(Feat.비전스트롤)의 시그니처 곱창파스타!~~~ 신기하다구! 파스타에 곱창이라늬~~~ 크리미한 투움바 소올스!~~ 불고기 깔조네 갠적으로 얇고 부들한 검은깨 도우가 생소하고 좋았던... 차돌박이 알리오 올리오!!! 마늘쫑과 차돌박이가 아낌없이 들어가서 맛있고 전혀 느끼하지 않고 담백한 파스타 역시 파스타는 바로 섞는 맛이쥐~~ 야무지게 익은 곱창이😙 ... 배고프다 갑자기 글 적는데 다시 먹고팡 🐻‍❄️백꼬미의 원픽은 곱창파스타 핑지의 원픽은 차돌박이 알리오 올리오 갠적으로 곱창 특유의 곱 느낌이 파스타를 먹으면서도 느껴져서 맛있지만 크리미한 투움바소스보단 불닭소스가 더 어울리지 않을까라는 생각이 들었어요 참고로 투움바소스는 생각보다 맵진 않아요 (매콤한 곱창 맛있지 않나요?!) 🐻‍❄️백꼬미는 맵ㅉ이라서 너무 맛있대요 차돌박이 알리오 올리오는 담백하고 핑지가 사랑하는 차돌박이가 있어서 그냥 좋아요 ㅋㅋㅋㅋㅋㅋㅋㅋ 알리오 올리오 잘 하는 집이 찐이다! 불고기 깔조네는 이렇게 소스와 피클이 세트로 오는데 소스와 드시는 것을 강력히 권해요! 보시다시피 깔조네 안은 매콤한 할리피뇨와 치~~즈가 다진고기 외에 가득 들어있어요 여기에 소스를 곁들이니 너무 맛나요 매콤한 맛이 중화되면서 크리미~~ 마늘이나 고추는 눈물나도록 아리고 매운데 할라피뇨는 매콤하고 자극적이지 않아서 신기해요ㅋ 핑지는 멕시코 요리도 너무 좋아요👍🏻❤ 망원동맛집(홍대맛집) 망원동 파스타 몰라(Feat.비전스트롤) 에서 불고기 깔조네에 차돌박이 알리오 올리오 곁들여서 가득 먹었어용!! 게다가 🐻‍❄️백꼬미와 서로 느낀 점이 있는데 음식들이 뒤끝이 느끼함 1도 없이 깔끔했음! 보통은 니글니글(아시죠?)한 경우가 많은데 신기햄 게다가 요근래 운동을 쉬니까 음식에 대한 욕구가 거의 없다시피 사는데 망원동맛집(홍대맛집) 망원동 파스타 몰라(Feat.비전스트롤) 에서 식욕이 되살아나서 맛있게 먹은 음식 중 손가락 안에 꼽을 수 있어욧🖐🏻 여러분 분위기&감성&유니크&컨셉&트렌디 모두 잡은 ✌🏻힙한 망원동 맛집(홍대맛집)은 망원동 파스타 몰라(Feat.비전스트롤)가 있어요! 근처에 카페 맛집도 많아서 데이트(나들이)코스로 짱👍🏻 그리고 몰라의 자체제작 스티커랑 명함도 귀여워서 챙겼음! 예전에 핑지가 빠져있던 문구류 인스가 생각나네요 (인스, 랩핑지는 어느덧 추억 속으로🥲) 마지막은 입구에 있는 인싸존에서 거셀을😍 몰라 이뻐 그만 봐 ㅋㅋㅋㅋㅋㅋ 시룬뎅~~~~~~ 존재하지 않는 이미지입니다."
진한 미국감성 망원동커피 비전스트롤,"망원동의 힙한 카페 비전스트롤이어요! 진짜 망원동커피를 마시고 싶다면 반드시 추천하는 카페에요^^ 진한 미국감성이 담긴 아메리카노 한 잔을 만나보세요! #비전스트롤 #망원동커피 #망원카페 비전스트롤 서울특별시 마포구 망원로 61 1층 이미 유명한 망원카페 망원역에서 내려 망원 한강 공원 나가는 길에 지나칠 수 없는 망원동커피 비전스트롤! 입간판 부터 분위기가 끝내줘요~ 비전스트롤의 대표 메뉴는 아메리카노 등 망원동 커피와 함께 버터푸딩인데요! 이날은 아쉽게도 너무 배가 불러서 버터푸딩까지는 도전하지 못해 아쉽 ㅎㅎ 워낙 요즘 핫한 카페인만큼 사람도 많고 줄 설 수도 있으니 시간 확인 꼭꼭 해보시고 방문하세요! 진한 포틀랜드 감성의 망원동커피 내부 인테리어도 끝내주네요 저 말 그림과 바닥에 걸린 융단 패턴이 묘하게 어울리는데요 이게 바로 미국감성인가요 ㅎㅎ 저는 마치 서부 영화 시대의 바에 온 것 같은 느낌도 들었어요. 오늘은 테이블에서 마셨는데 다음에 오면 꼭 바테이블에도 앉아봐야겠어요^^ 미국감성 뿜뿜! 에스프레소 4,500원 아메리카노 4,500원 비전스트롤은 테이블과 스텐딩 가격이 달라요! 참고해서 주문하시면 될 것 같은데요~ 망원동커피는 이제 너무 좋은 곳이 많아서 매번 고민하게 되네요 저번 포스팅에서 소개드린 꼬르소산도도 분위기에 취하는 망원동커피였는데요 오늘 비전스트롤에서는 미국감성에 취하게 되요^^ https://blog.naver.com/hdhd0620/222054425286 망원카페추천 클래식한 매력의 꼬르소산도 + 크림 잘하는 집! 오늘 추천하는 카페는바로! 망원역의 클래식한 카페꼬르소산도에요~마포구청카페로도 유명해요!얼마나 클... blog.naver.com 오픈 시간 화, 수 휴무! 나머지 12:00 ~ 21:30 미국감성이 특별히 더 묻어나는 이유는 일하시는 바리스타 분들의 스타일도 굉장히 멋있었기 때문인데요! 이런 미국감성을 만들기 위해 비전스트롤을 방문하는 모두가 그 감성을 이해할 수 있도록 내부 인테리어 부터 메뉴, 그리고 자신들의 패션과 응대하나하나 잘 짜여진 느낌을 받았어요. 이렇게 메세지가 확실한 카페는 너무 좋네요 이런걸 컨셉이라고 할 수 있겠죠? 오늘도 비가 주룩주룩오네요 한강으로 야외로 다니긴 힘들지만 이렇게 멋진 카페에 앉아 생각 정리하는 시간을 가져보아야 겠어요~"
망원동 카페 버터푸딩이 맛있는 집 “비전스트롤”,"안녕하세요!! :) 망원동에 버터 푸딩 맛집 있는거 아시나요?? 휴,, 너무 바쁘고 망원동에 갈일이 별로 없어서 제 버킷리스트에만 오랫동안 담겨 있다가 저번 주말에 드디어 댕겨 왔습니다!!😉 주말이라 디저트가 품절되서 못먹으면 어쩌나 걱정을 하고 갔는데 다행히 먹고 올 수 있었어용~ 비전스트롤 베이크샵 영업시간: 12:30~21:00 *매주 화,수 정기휴뮤 망원동 비전스트롤은 간판이 없는 카페에요! 그래서 지도를 잘 보고 가야 찾을 수 있습니당~ 가시다보면 빨간 벽돌 건물이 나온답니당! 앞에 웨이팅 리스트가 있는것 보면 원래 웨이팅이 많은 것 같은데 딱 제가 갔을땐 웨이팅이 없더라구요??🙃 간판이 없는 대신 이렇게 귀엽고 작은 표지판이 있습니당 매주 화요일, 수요일은 정기휴무니까 꼭 참고하셔서 방문하세요~!! 뚜둥,,여기가 어디냐면 2층 입구입니당..ㅎㅎ 제 목적은 버터푸딩을 먹는 것이었는데...! 1층은 재료 소진으로 디저트도 같이 주문할꺼면 2층으로 안내를 받았어요ㅠㅠ 같이 운영하는 카페인데 이게 왜 아예 두개의 카페처럼 운영 되는지는 모르겠지만.. 그래도 아예 재료소진으로 못먹는 것 보단 나으니까~~ 개인적으로 1층 자리가 더 환하고 좋아보였는데,, 10초 발을 들이고 거의 바로 나와서 기억이 안나네요...🥲 메뉴가 있는 곳이 귀엽게 꾸며져 있는 것 같네용 2층 내부는 약간 재즈 분위기가 나는 것 같았어요~ 1층 보다는 자리가 더 좁긴 하더라구요ㅠ 내부 좌석들이 많이 붙어 있는 편이라 정말 음악소리랑 수다 소리랑 겹쳐서 조금 시끄럽다는 생각이 들었어요...😵‍💫 그래도 분위기도 좋고 기분도 좋고 + 단거 먹으니 모든 용서할 수 있어! 아이스 아메리카노랑(4,500원) 아이스 바닐라빈라떼 (5,500원) 주문했어요! 아메리카노는 처음 먹어보는 맛이었어요!!! 조금 특이하더라구요? 산미가 조금 있고 약간 과일향이라고 해야하나,, 신기한 맛이었어요 특별히 다른 원두를 쓰시나봐요~~ 근데 컵 너무 귀엽지 않나요?!! 완전 취향저격ㅋㅋㅋㅋ 뭔가 클라이밍이 떠오르기도 하고.. 저는 컵이 마음에 들어서 탐나더라구요~💓 뚜둥 대망의 버터 푸딩!! 버터 푸딩은 초코 크로와상에 바닐라 아이스크림이 올라가있는 디저트에요! 진짜 엄청 달더라구요ㅋㅋㅋㅋ단게 땡길때는 이게 최고인 것 같아요 >< (뭔가 다 먹으면 안될 것 같은 맛이지만 다 먹었쥬~ㅋㅋㅋ) 비주얼부터 장난 아니에요ㅠㅠ 버터푸딩 사진 올렸더니 인스타에서 다들 어디냐고 묻더라구요ㅎㅎ 지금 보니가 또 먹구싶네요ㅠㅠ 다음에는 1층 자리에서 다른 디저트도 먹어보고싶네용~ 비전스트롤 베이크샵 서울특별시 마포구 망원로 61 (망원동)"
