title,content
망원동 마카롱 카페 : 마떼아에서 달달하게 -,"망원동 마카롱 맛집 맛있는 디저트 카페 방문하니 그 이름 마떼아 카페 In 망원동 마떼아 서울특별시 마포구 월드컵로19길 36 2층 카페 마떼아, 망원역 2번 출구에서 가까운 카페로 2층에 위치해있다:) 마카롱 그려져있는 문 발견하면 카페 마떼아 찾기 성공~ 안은 따스한 톤의 조명 아래 아늑한 공간으로 꾸며진 스몰 카페 벽면에 마카롱 디자인된 그림이 놓여있다ㅎㅎ 디저트는 마카롱부터 디저트 베이커리류로 나뉘어 있당 우리는 마카롱과 아아 마시기로 하고~ 아이스 아메리카노와 마카롱을 선택하였다:) 거품 가득 올려져 커피마저 맛있어 보이는 망원동 마떼아 카페:) 프레첼 머랭은 맛보기로 먹었는데~ 머랭에 바삭함 플러스 프레첼 짠맛도 중화되어 맛있게 먹었던 아이:) 메인인 마카롱♡ 왼쪽 레몬 얼그레이 마카롱 오른쪽 유자 레몬 마카롱으로 나는 왼쪽 레몬 얼그레이 마카롱으로♡ 레몬 얼그레이 마카롱 2,800Won 처음 먹었을 땐~ 음? 레몬의 상큼함은 크게 안 느껴져서 레몬 맞아요? 했는데~ 안에 상콤함 팡팡 터지는 레몬 잼과 레몬 버터가 들어있어서 처음은 달콤하게 중간엔 상콤 새콤 한 매력 있는 마카롱이었당♡ - 아이스아메리카노 4,000Won 여기에 아이스 아메리카노 한 입 딱 마셔주는데~ 우와, 마카롱이랑 이렇게 잘 어울릴 수 있나요? 싶게 맛있던 아메리카노♡ 마카롱 한 입, 아아 한 입 하니 어느새 하루 행복 다 채웠어요☺️하게 되는 곳 고래, 힐링을 채우다. 어디에서? 마떼오, 망원동 카페에서:) -"
망원동구움과자 맛집 마떼아 역대급 크림마들렌 추천,"안녕하세요- 쵸이에요- 저는 지난 주말에 구움과자를 사러 망원동에 다녀왔는데요 제가 구움과자 진짜 좋아하거든요 근데 망원동에 구움과자 찐맛집이 있다고해서 빠르게 사가지고 왔습니다 ㅎㅎㅎ #망원동디저트 #망원동맛집 #망원동구움과자 마떼아 마떼아 서울특별시 마포구 월드컵로19길 36 2층 주소 : 서울 마포구 월드컵로19길 36 2층 영업시간 ) 월~토 12:00 ~ 19:00 전화번호 : 0507-1332-2018 #마카롱 #마들렌 #크림마들렌 #휘낭시에 망리단길에 위치하고 있는 마떼아는 맛집이 많은 골목에 위치하고 있어요 ㅎㅎ 간판이 보이면 옆에 문으로 들어가서 2층으로 올라가면 아주 밝고 깔끔한 매장이 나타납니다 ㅎㅎ 망원동 구움과자 맛집으로 유명한 마떼아는 연남동에서 유명하던 메리가 상호만 변경하여 이전오픈한 곳이였어요 ㅎㅎ 역시 맛있으면 연남동이든, 망원동이든 맛집으로 유명해지는 것 같아요 ㅋㅋㅋ 마떼아는 마카롱, 구움과자, 케이크까지 하는 맛집인데 특히 저는 구움과자를 엄청 좋아하는 사람으로써 크림마들렌이랑 휘낭시에가 너무 마음에 들더라구요 크림 마들렌 그림이 있을 정도로 사장님이 구움과자에 엄청난 진심이 느껴지는 공간이였어요 ㅎㅎㅎㅎ 전체적인 쇼케이스는 이렇게 깔끔하게 되어있고 마카롱, 크림마들렌, 휘낭시에, 머랭쿠키 크게 이렇게 나눠져있는데 흔한 맛이 아닌 특별한 맛들이더라구요? 그리고 좌석이 많은건 아니지만 3팀정도는 이용할 수 있는 공간이 있었어요 그래서 구움과자와 너무 잘어울리는 커피종류도 판매하고 있더라구요 ㅎㅎㅎ 그리고 구움과자종류는 또 선물하기 찰떡이란말이죠? 그래서 선물박스 구매도 가능하고 요즘 여름이라 덥기때문에 보냉포장도 추가할 수 있어요 마떼아는 크림마들렌이 있기때문에 크림들어간 종류들이나 냉장이 필요한 종류들은 꼭 보냉 포장을 하길 추천드려요 ㅎㅎ 와...저 이거보고 놀랬자나요 그 비싼 발로나 초코스틱이 3줄이나 들어가다니 ㅋㅋㅋㅋㅋㅋㅋㅋㅋ 안에는 와인에 졸인 무화과가 들어있어서 무화과의 씹는 맛까지 느껴지던... 마롱, 레몬유자, 라즈베리초코, 피스타치오 등등 정말 흔하지 않은 맛있는 맛들이 많았어요 이렇게 특별한 구움과자들은 진짜 선물하기 너무 좋거든요 ㅋㅋㅋㅋ 그리고 일단 엄청 오동통!! (저는 구움과자 왕창 사서 냉동했다가 급 땡길때 해동해서 먹는걸 너무 좋아해서 왕창 담았답니다) 마카롱 색감도 너무 예쁘게 잘 만드시고 맛도 특별한 맛들이에요 ㅋㅋㅋㅋㅋ 이런 맛의 마카롱 본적 있으신가요... 완전 망원동 마떼아에서만 맛볼 수 있는 특별한 맛들!! 사장님이 엄청난 정성과 실력... 정말 좋은 최상의 재료들과 그 재료들의 맛을 온전히 느낄 수 있게 만든... 이렇게 깔끔한 매장이고 안쪽에는 가장 중요한 만드는 공간이 있었어요 그래서 구움과자가 나오는 시간이면 빵 냄새가 엄청날 것 같은... 그럼 또 못참는거 아시죠 구움과자 굽는 냄새는 진짜 모든걸 다 사게 만들어요 ㅋㅋㅋㅋㅋㅋㅋㅋㅋ 저는 크림마들렌이 너무 땡겨서 크림마들렌 종류별로 1개씩이랑 휘낭시에까지 !! ㅎㅎㅎ 발로나스틱이 들어간 무화과 휘낭시에인데 제가 발로나 초코스틱도 너무 좋아하고 무화과도 너무 좋아하니까 안살이유가있나요...무조건 사야지.. 그리고 마롱도 너무 좋아하거든요 근데 안에는 또 제가 좋아하는 말차... 그럼 또 무조건 사야죠 ㅋㅋㅋㅋㅋㅋㅋㅋㅋ 이렇게 제가 좋아하는 조합으로 만들어진 마들렌이 많아서 뭘 뺄 수가 없더라구요 ㅋㅋㅋㅋㅋㅋ 그래서 이렇게 한상자 포장해갑니다 ㅎㅎ 저는 집이 가까워서 따로 보냉포장은 안했지만 집가자마자 냉장에 넣어줘야해요 그리고 먹기전에 살짝 꺼내서 냉기를 빼고 먹으면 완전 부드럽고 맛있게 먹을 수 있다는 꿀팁!! 이렇게 예쁘게 포장해서 얼른 집으로 달려갔습니다 ㅋㅋㅋㅋ 집가자마자 몇개꺼내서 바로 먹었어요... 가장 먼저 먹은건 피스타치오였는데요 안에 크림이 이렇게 빵빵하게 들어가있다니 너무 부드럽고 맛있는 피스타치오 버터크림이였어요 그렇다고 엄청 달달한 크림이 아니라 딱 적당하게 달달한 크림 위에서 말씀드렸듯이 제가 너무 좋아하는 발로나스틱이랑 무화과잼이 들어간 휘낭시에도 바로 먹었습니다 제가 직접 베이킹 원데이클래스 하고 다닐 정도로 구움과자를 너무 좋아하고 빵도 너무 좋아하는데 마떼아는 진짜 너무 맛있더라구요 그 재료들의 조합이 최고에요.... 그리고 저녁에 또 냠냠했던 유자 크림 마들렌 ㅋㅋㅋㅋㅋ 상큼한걸 별로 안좋아하는데 유자와 크림이 적절하게 맛을 내고 있어서 너무 맛있게 먹었어요 ㅋㅋㅋㅋ pt쌤이 보면 경악을 할 주말이였지만 제 입은 즐거웠다고 하네요?ㅋㅋㅋㅋㅋㅋ 망원동에서 구움과자 맛집 찾으시는 분들은 정말 마떼아 방문해서 꼭 드셔보세요.... * 네이버 전화연결 / 인스타그램으로 예약가능 *케이크는 주문제작으로 예약가능 *마카롱/구움과자 택배가능 택배도 가능하니 꼭 드셔보세요... 구움과자를 모르셨던 분들도 마떼아 구움과자 드셔보시면 그날부터 1일되실꺼에요 ㅋㅋㅋㅋㅋ ""이 글은 리뷰노트를 통하여 본 업체에서 제품 또는 서비스를 제공받아 작성된 글 입니다."""
"망원동맛집 | 디저트카페, 마떼아","디저트카페 <마떼아> 📌 서울 마포구 월드컵로19길 36 2층 🕰 화 ~ 일 11:00 - 19:00 매주 월요일 정기 휴무 너무 좋아하는 구움과자. 그 중에서 마들렌과 휘낭시에는 이틀에 한 번 카페를 가서 먹을 정도로 너무너무 좋아하는 디저트 중에 하나다. 최근에는 마들렌 중에서 속 안이 크림 필링으로 되어 있는 마들렌이 있다고 해서 다녀왔다. 내가 방문한 곳은 망원동맛집 <마떼아> 각종 구움 과자와 마카롱등을 판매하고 있는 디저트카페다. 마떼아 서울특별시 마포구 월드컵로19길 36 2층 망원동맛집 <마떼아>의 위치는 여기. 망리단길 카페들이 모여있는 2번 출구 근처라 찾기 어렵지 않다. 보이는 건물 2층이 바로 디저트카페 <마뗴아> 안으로 들어가면 아기자기하고 아늑한 공간이 맞이한다. 소규모 공간이지만 테이블도 4테이블 정도 있고, 1인 손님 기준으로 하면 5팀 정도도 가능한 것 같다. 한쪽엔 이렇게 디저트 쇼케이스가 있다. 마떼아의 디저트들은 포장도 가능하다. 이렇게 상자도 따로 있어서 모양이 예쁜 마들렌이나 마카롱을 담아 선물하기 좋은 것 같다. 마카롱 꼬끄로 되어 있는 귀여운 액자 :) 이런 아기자기한 소품으로 마떼아의 디저트카페 비주얼이 완성되는 것 같다. 머물렀다 가도 되지만, 나는 이날은 포장해서 갈 예정이라 포장했다. 쇼케이스에서 열심히 디저트 구경하기. 크림마들렌과 색이 예쁜 투톤 마카롱이 판매되고 있다. 물론 음료도 팔고 있어요! 마카롱 색 보고 기절하는 줄 알았다. 단일톤으로 구성된 마카롱도 있지만, 이렇게 투톤으로 구성되어 있는 마카롱들이 많아서 선물용이나 특별한 날에 티푸드로 내어놓기 너무 좋아 보였다. 안에 샌딩된 크림층까지 포함하면 3색으로 이뤄진 마카롱들도 있어서 보는 내내 감탄함. 빼빼로데이 시즌 주간에 방문해서 빼빼로데이마카롱도 판매하고 있었다. 마카롱들은 이렇게 시즌 상품으로도 판매하는 것 같았다. 빼빼로데이나 크리스마스처럼, 특별한 날에 판매하는 마카롱 비주얼이 궁금해지던 디저트카페 :) 크림이 샌딩된 쿠키류도 판매하고 있었고. 이렇게 마떼아만의, 마들렌 안에 크림필링을 잔뜩 채워놓은 크림마들렌을 판매하고 있기도 했다. 마들렌 광인인 나는 이날은 크림 마들렌을 잔뜩 포장해가기로>< 단짠 프레첼 머랭 쿠키도 너무 귀엽네 :) 원하는 제품을 고르면 상자에 예쁘게 포장해주신다. 마들렌은 개별 포장을 해서 넣어 주신다. 아무래도 속부터 겉면까지, 크림이 들어가있는 제품이다 보니 다른 제품과 부딪혔을 때 모양이 뭉그러지거나 크림이 섞이는 일이 많을텐데 개별 포장이라 안심. 상자 겉면에는 이렇게 씰링 스티커를 붙여 주심. 개별 포장 된 마들렌이다 보니 6개 정도 들어갔을 때가 가장 안정감있는 것 같다. 함께 넣어주신 디저트 보관 방법 안내 카드. 이런 카드 넣어주면 남은 디저트들 보관은 어떻게 해야 하는지 도움 되고 좋은 것 같다. 상자 열어보기 :) 쨔라라란!!! 이렇게 상자 열면 속이 꽉찬 마들렌이 쪼르르 맞이한다. 모양도 너무 깔끔하고 예뻐서 선물용으로도 좋은 것 같다. 포장해온 내 크림마들렌과 쿠키! 크림마들렌은 7종류를 골랐고, 쿠키는 얼그레이 쿠키를 골랐다. 개별 포장 되어 있고, 크림 마들렌 가장 윗면에도 OPP필름을 붙여 놓은 상태로 포장을 해 크림이 뭉그러지지 않고 깔끔했다. 초코크림 무화과, 바질 황치즈, 모카크림, 피스타치오크림, 바닐라가나슈, 레몬유자, 라즈베리초코의 크림 마들렌 7종과 얼그레이초콜릿 쿠키 1종 :) 바닐라가나슈 크림 마들렌 바닐라빈이 중간중간 보이는, 부드럽고 달큰한 크림 마들렌이다. 바닐라 크림은 가장 베이직한 크림 중 하나라고 생각하기 때문에 바닐라 크림 향을 얼마나 잘 살리느냐가 중요한데, 마떼아의 크림 마들렌은 바닐라향이 풍부하게 살아 있어 먹는 내내 즐거웠다. 속안도 크림이 꽉 차 있어서 어느 부분을 먹어도 크림을 기분 좋게 즐길 수 있을 것 같다. 무난하게는 커피랑도 잘 어울리지만, 바닐라향이 가향되어 있는 홍차나 밀크티 종류와도 잘 어울릴 것 같은 느낌이었다. 피스타치오 크림 마들렌 피스타치오의 매력을 잘 느낄 수 있는 크림 마들렌. 피스타치오에게 기대하는 견과류 특유의 향과 맛을 잘 느낄 수 있었다. 무엇보다도 크림 속에 피스타치오를 잘 샌딩하여 나온 올리브 컬러의 크림이 눈으로 보기에도 즐겁다. 아직 피스타치오의 매력을 잘 모르는 분들이 있다면 한 번 드셔보길 추천하는 마들렌. 피스타치오 특유의 기분 좋은 고소함과 향을 잘 느낄 수 있다. 느끼하지 않은 고소함이라 크림이 풍부하게 들었어도 물리지 않고 먹을 수 있다. 개인적으로 얘는 차랑 마시면 너무 좋을 것 같았던 마들렌이었다. 유자레몬 마들렌 레몬과 유자가 들어간 크림은 시다? 일단 레몬이 디저트로는 호불호가 갈릴 수 있는 재료라고 생각하는데, 평소에 레몬파운드 레몬마들렌을 좋아하는 나에게 이 마들렌은 그극극그그그그극극호였다! 레몬의 상큼함과 레몬과 유자의 껍질을 이용하여 만든 제스트가 향을 더욱 풍부하게 했던 마들렌. 부드러운 크림에 톡톡 퍼지는 시트러스 향이 기분 좋았다. 이런 마들렌은 에이드 종류와 먹어도, 과일향이 가향된 홍차와 먹어도 너무너무 좋을 것 같았다. 라즈베리 초코 마들렌 2가지의 크림을 맛볼 수 있는 마들렌이다. 겉면에서는 새콤한 라즈베리 핑크 크림이 먼저 보이지만, 반으로 자르면 진한 초코 가나슈가 들어 있는 제품이다. 라즈베리의 상큼함과 진한 초코가 잘 어울렸던 마들렌. 특히 라즈베리 크림의 컬러가 너무 예뻐서 여기에 귀여운 생일 초 하나만 꽂아도 분위기가 날 것 같았다. 개인적으로 파티 디저트에 가져간다면, 얘는 꼭 포함시키고 싶었던 비주얼 디저트였다. 모카크림 마들렌 카라멜 컬러의 모카 크림이 매력적이었던 마들렌. 겉면에 고소하게 씹히는 견과류까지 더해져 커피 크림의 부드러움과 견과류의 고소함을 동시에 느낄 수 있는 디저트였다. 특히 마들렌을 베어물 때마다 촉촉하게 퍼지는 커피향도 한몫! 얘는 모카번, 모카케익 등 모카류 디저트를 좋아하는 어른들이라면 좋아할 필승의 디저트같다. 가족 단위로 먹을 디저트 포장할 때 꼭 포함시켜야 할 맛! 바질 황치즈 마들렌 평소에 바질을 좋아하는 분이라면 맛있게 드실 수 있는 마들렌이다. 바질 특유의 향과 마들렌이 잘 어울릴까? 하는 생각이 들었지만 의외로 잘 어울린다. 아마 황치즈 크림이 그 역할을 했다고 생각함. 짭쪼로함지만 부드러운 크림치즈의 향이 바질과 잘 어우러진다. 바질만 단독으로 있었으면 향이 낯설었을 것 같은데, 황치즈 크림이 마들렌과 바질을 잘 어울리게 잡아준 것 같다. 초코크림 무화과 마들렌 초코 좋아하는 분이라면 구매해야 할 원픽 마들렌. 라즈베리 초코와는 전혀 다른 매력의 초코 마들렌이다. 라즈베리 초코 안에 들었던 가나슈는 좀 더 진하고 쫀득함이 있었는데, 이 안에 들은 가나슈는 좀 더 마일드한 달콤함이 있다. 개인적으로 라즈베리처럼 맛이 새콤하고 톡 튀는 제품에는 진한 가나슈가 잘 어울렷을 것 같고, 이렇게 무화과처럼 은은하게 단맛이 있는 과일에는 이런 부드러운 가냐슈가 합이 더 좋은 것 같다. 어느 재료하나 도드라지지 않고 잘 어울렸던 마들렌. 초코 좋아하는 분이 초코 마들렌 중에 하나 선택해야 한다면 나는 요 초코크림 무화과를 더 추천하고 싶다. 얘 진짜 짱맛임 :) 얼그레이 초콜릿 쿠키 티타임에 빠지지 않는 쿠키 단순히 지루할 수 있는 쿠키에 얼그레이로 향을 더하고, 초코 크림을 샌딩해서 여러 맛과 향을 동시에 느낄 수 있다. 커피랑도, 홍차랑도 잘 어울릴 느낌의 디저트. 개인적으로 커피 취향이 각각 달라 음료를 여러개 시켰을 경우, 디저트로는 얘를 시키면 차를 마시는 사람도, 커피를 마시는 사람도 모두 만족할 만한 디저트였을 것 같다. 본 포스팅은 리뷰노트를 통해 업체로부터 제품, 혹은 서비스를 제공받아 작성하였습니다."
망원동 마카롱 맛집 '마떼아'에서 선물 포장으로 딱 좋은 고급 디저트와 마카롱 맛 본 후기,"마카롱 같은 디저트는 정말 주기적으로 먹어줘야하는 것 같아요 ((특히 여자들은,, 알죠? ^^,,)) 저는 덮어놓고 달기만 한 마카롱 보다는, 적당히 달달하면서 깊이와 풍미가 있는 마카롱을 훠얼~씬 더 좋아하는데요! 이런 제 취향에 맞는 망원동의 유명한 마카롱 가게에 다녀왔습니다 🚶‍♀️ 바로 망원동 마떼아에요! 망원역에서 딱 5분만 걸으면 바로 도착! 2층으로 올라가줍니다 ㅎ.ㅎ 망원동 마카롱 마떼아 내부 내부가 생각보다 좁지 않고, 네 테이블 정도가 있어서 여기서 몇 개 맛보고 나머지는 포장해가기에 딱 적당할 것 같더라구요 ❔ 00:00 00:00  접기/펴기 망원동 깊은 맛 마카롱 마떼아 내부 전경 🧁 망원동에서 데이트하다가, 아님 웨이팅 할 때 당도 떨어지고 지칠 때가 많은데 그 때 혈당농도 채워주며 쉬어가기 딱 알맞은 공간이에요 🍭 카페처럼 단정하고 분위기 있게 꾸며져 있어서 거울 사진도 한 장 찍어봤습니다 ㅎ 망원동 마떼아에서 제일 중요한 곳은?? 당연히 마카롱 & 구움과자 쇼케이스죠 ~~ 진열대를 보면서 구매하고 싶은 제품을 고르면 됩니다 망원 마떼아 마카롱 마카롱이 색감도 예쁘고, 이름만 읽어도 제 취향인 맛이 가득해서 최대한 많이 주문해봤어요 !! 망원 마떼아 구움과자 마카롱 옆에 있던 구움과자들은 맛보진 않았지만, 마카롱 맛을 보고 나니까 궁금해지네요 🤤 저는 일단 매장에서 마카롱 몇 개 먹고 가려고, 따뜻한 티랑 같이 시켰습니다 망원동 마떼아 마카롱 6구 달달함과 부드러운 풍미, 그리고 쫀득한 크림의 삼위일체로 완벽함을 자랑하는 고급스러운 망원동 마카롱 🤎 마카롱별로 2,800원과 3,000원인 게 있어서 6개 가격은 따로 적지는 않을게요~ 먹고 싶은 것 골라서 주문하면 됩니다! 일단 요 프레첼 머랭은 서비스로 주셨는데 ・・・ 뭔지도 몰랐던 프레첼 머랭, 애피타이저로 먹고 눈 커졌습니다 🫢 짭조름한 프레첼이 오독오독 씹히는 동시에 달달한 머랭이 스르르르 녹아요.. 거기에 따뜻한 티 한 모금 마시니까 일주일 동안 피로가 싹 풀리더라구요 햐.. 이렇게 되고 나니, 이제 마카롱에 대한 기대감이 하늘 끝까지 솟구치기 시작했더랍니다,, 👼 제가 이 날 매장에서 먼저 먹어본 건 두개였는데요. 우선 이 두개 맛부터 소개해 드릴게요 따뜻한 차랑 먹으니까 오히려 차가운 커피보다도 궁합이 좋았어요!! 망원동 마떼아 - 제주말차 마카롱 ㅎㅎ 사실 맛본지 시간이 지나서 조금 까먹긴 했지만, 제주말차라는 이름이 이해가는 쫀득하고 녹진한 하지만 텁텁하지 않은 말차 맛이 크림 속에 잘 녹아든 마카롱이었어요 🍵 말차 좋아하는 분은 요거 추천! 망원동 마떼아 - 크림브륄레 크림브륄레.. 솔직히 크림브륄레 싫어하는 사람 없잖아요? 귀한 크림브륄레 마카롱, 망원동 마떼아에서 판매하고 있었숩니다 힘을 주며 꼬끄에 포크를 꽂으면, 파삭하고 부서지는게 아니라 금이 가며 꾸우욱 눌려요 👍 요거 생긴대로 요물입니다 🤎 코팅된 꼬끄가 깊이있게 단 맛을 선사해준 다음, 크림 안에 박혀있는 카라멜이 달달한 맛을 중화시켜줘요! 마떼아 마카롱은 이런식으로 조합이 잘 되어 있는 것 같아요 안 물리고 계속 먹을 수 있는 마카롱이 찐찐 마카롱 아닌가유 ㅎㅎㅎ 맛있는 거 크게 한 번 더보기 skill.. 마떼아에서는 이렇게 두 개 맛보고, 나머지는 집에서 두고두고 먹고 싶어서 데려왔어요 우리 집으로 가자. 너무 맛있었던 프레첼 머랭은 주변 사람들한테 꼭 맛보게 해야한다는 사명감으로 (?) 7,000원에 한 박스 같이 구매했습니다 🥨 (나중에 남자친구 하나 줬더니 그 자리에서 다 먹으려 해서 겨우 뺏었어요..좀 위험한 음식임) 이 날 날씨가 더워서 보냉포장 옵션을 추가해서 집에 안전하게 모셔갔답니다 포장도 깔끔하게 잘 해줘서 선물로도 좋을 것 같구요!! 나중에 선물 뭐 줄지 생각 안날 때 마떼아로 향하려구요 안내문에 냉동보관은 3주까지 가능하다고 해서, 퇴근 한 다음 블로그 쓰면서 꺼내먹는데 행복했었죠 🫶 망원동 마떼아 - 레몬얼그레이 레몬이랑 얼그레이 조합이라니 신기하기도 했는데, 레몬맛이 차분하면서도 상큼해서 얼그레이랑 잘 어울리더라구요!! 마떼아의 마카롱들은 너무 뻔하지 않은 맛이라는 점도 좋아요 😆 망원동 마떼아 - 오페라 오페라는 마떼아의 시그니처가 아닐까 싶을 정도로 대 박 적 입니다 고급스러운 초코 코팅을 맛보고 나면 진한 커피 향이 초코랑 자연스럽게 섞여 들어와요.. 🍫 50m © NAVER Corp. 마떼아 서울특별시 마포구 월드컵로19길 36 2층 마떼아는 제가 먹어본 마카롱 중에 제일 고급스러운 것 같아요 !! 괜찮은 가격에 쌓인 화까지 녹일만한 디저트 맛보고 싶으신 분들 한 번 들러보세요~"
