title,content
"푸짐하고 맛있는 디저트가 있는 망원동 구움과자점, <마떼아>","망원동 맛있는 구움과자점, 매장도 깔끔하고 사장님도 매우 친절하심 구움과자가 크고 너무 달지 않고 맛있음 마카롱도 가격 저렴, 선물용으로도 좋을 듯 마떼아 마포구 월드컵로 19길 36 2층 화~일 11~19 매주 월요일 휴무 빵이나 디저트류를 좋아하지만 유지어터이기 때문에 섭취 횟수를 확 줄였어요. 그래서 더 맛있는 집만 찾아서 먹으려고 합니다.ㅋㅋㅋㅋ 별로 맛없는데 칼로리만 섭취하면 슬프잖아요ㅠ.ㅠ 망원동에 맛있는 구움과자집이 있다는 말을 듣고 출동해 보았습니다. 포장해서 저녁에 온가족이 먹었는데, 반나절 지나서 먹었는데도 정말 너무 맛있었어요. 주소 보고 왔는데도 첨엔 못 찾았어요.ㅎㅎ 1층에는 다른 매장이 있고요, 오른쪽에 귀여운 노란 입간판 보이시죠? 마떼아는 2층에 있습니다. 콘크리트 벽에 상형문자같은 간판 너무 귀여워요. 창문에도 맛있어보이는 구움과자 사진이 잔뜩 계단을 올라가면 2층이 바로 나와요. 2층은 마떼아만 사용하고 있어서 한적하고 좋아요. 비밀의 공간으로 들어가는 느낌.ㅋㅋㅋ 맛있는 냄새가 솔솔 나서 더욱 기대가 됩니다. 구움과자전문점은 앉아서 먹을 곳이 별로 없는 데가 많은데 #마떼아 는 통창뷰를 보며 맛있게 먹고 갈 수 있어요. 테이블이 3~4개 정도 있어서 편안하게 먹을 수 있습니다. 공간 별로 테이블이나 의자를 달리해서 분위기도 다르고, 매장이 정말 깔끔해요. 오픈치킨이라 믿고 먹을 수 있습니다. 이 공간 참 맘에 들더라고요. 제가 좋아하는 우드우드 스타일.ㅋㅋㅋㅋ 더 빽빽하게 테이블 놓으실 수도 있을텐데 손님들의 편의를 생각하신 것 같아서 더 좋았습니다. 거울하고 액자 참 예쁘네요. 음료 가격은 적당해요. 디저트 가격이 저렴해서 참 마음에 듭니다. 선물박스 보냉박스는 1,000원씩 추가인데 저렴하죠? 멤버십 가입하면 포인트가 무려 7% ㄷㄷㄷㄷㄷ 가입 안 할 수 없죠?ㅋㅋㅋ 저희는 빵돌이 가족이라 한 번 살때 좀 많이 사는 편이라 핵이득일 것 같아요.ㅋㅋㅋㅋㅋ 꽤 종류가 다양하죠? 마카롱도 있고 브라우니도 있는데, 저는 구움과자로만 담아 보았습니다. 얼그레이 진짜 좋아하는데 낮에 갔는데도 솔드아웃이라 슬펐어요.ㅠㅠ 담엔 꼭 먹는다. 알차게 포장해서 나오는 길. 집에 가서 가족끼리 먹을거라 상자 포장은 하지 않았습니다. 저는 요런 깔끔한 종이가방에 로고 붙은 종이가방 좋드라고요. 로고도 너무 센스있어요. #마카롱 #구움과자 뿐만 아니라 케이크 주문도 받고 있습니다. 인스타 보시고 주문하실 수 있어요. 주문 케이크 좋아하거든요. 다음번에는 케이크 주문해볼까봐요. 상단 오른쪽부터 : 모카크림// 황치즈// 피스타치오크림// 초코크림무화과// 바닐라가나슈// 라즈베리초코// 레몬유자// 기본 마들렌 구움과자 8종 세트.ㅋㅋㅋ 이정도는 먹어야 구움과자 먹었구나 하는거 아입니꽈?ㅋㅋㅋㅋ 저 다이어트 해서 먹어봤자 1개 먹는데, 이게 하루에 다 사라졌다는 사실...... 심지어 보시면 알겠지만 크기도 크거든요.ㅋㅋㅋ 아시는 분은 아실 #로얄베일 대자 나무도마.ㅋㅋㅋㅋㅋ 영상으로도 담아보았어요.ㅋㅋ 정말 크죠? #모카크림 마들렌 진짜 대박이에요. 위에 초콜릿 크런치가 바삭하고요, 커피마들렌 속에 모카크림이 가득 들었어요. 커피향과 모카향이 너무 잘 어우러지는데...순간 다이어트를 잊었네요.ㅋㅋㅋ #바닐라빈가나슈 바닐라빈 콕콕 많이 박힌거 보이시죠? 향이 장난 아니에요. 마들렌 자체도 너무 달지 않고 부드럽고 딱 좋았습니다. 태권도 다녀와서 당 보충하는 따님.ㅋㅋㅋ 역시나 #라즈베리초코 골랐어요. 빵만 초코일 줄 알았는데 속에 초코가 가득찼네요. 엄청 눅진하고 너무 달지 않아서 더 맛있게 잘 먹드라고요. 마지막은 저희 아들의 원픽 #레몬유자 고흥유자청을 사용하신다고 해요. 엄마랑 늘 입맛 겹쳐서 엄마는 레몬을 맛도 못 보고..ㅠㅠ 똑같은거 두 개 사기는 왠지 그렇잖아요. 맛있다고 야무지게 잘 먹드라고요 1. 망원역 근처 구움과자 전문점, 마카롱도 있다 2. 테이블 넉넉 먹고가기도 편안, 인테리어도 깔끔 3. 사장님 정말 친절, 구움과자도 가성비 넘치는 곳 마떼아 서울특별시 마포구 월드컵로19길 36 2층 #마떼아 #망원마떼아 #망원커피 #망원카페 #망원디저트 #망원역디저트 #망원역커피 #망원역카페 #망원데이트 #망원역데이트 #망원역마떼아 #망원디저트맛집 #망원역디저트맛집 #망원구움과자 #망원마카롱"
"[망원동 디저트] 명품 구움과자, 마카롱 전문점 마떼아","안녕하세요 밍밍카입니다. 오늘은 퇴근하고 망원에 들렸는데요! 고급 재료로 만들어진 맛있는 구움과자 전문점 망원동 맛집 마떼아 한번 리뷰해볼게요 마떼아 서울특별시 마포구 월드컵로19길 36 2층 마떼아 영업시간 매주 일요일 정기휴무 월요일 ~ 토요일 12:00 - 19:00 위치 서울 마포구 월드컵로19길 36 2층 : 망원역 2번출구 망원시장방향으로 오시다, 우측 골목에 가까운 아이보리 색 건물 2층입니다! 문의전화 0507-1332-2018 포장, 예약 가능 반려동물 동반 가능 매장 내 좌석 O 망원동 마카롱 전문점 마떼아는 아이보리 색 건물 2층에 위치해 있어서 요런 판넬 발견하시면 도착하신겁니다! 일요일은 정기 휴무이며, 연남동 '메리'에서 오래 운영해 오시다가 상호만 변경하여 망원동으로 이전 오픈하였다고 해요. 매장 내부는 화이트 & 우드 톤으로 굉장히 깨끗하고 쾌적하였답니다 매장에 2~3인석 창가 테이블 하나가 있고 카운터 바로 건너편에도 앉아서 드실 수 있는 공간이 준비되어 있어용 망원 마떼아 는 맴버쉽 가입 시 포인트 적립이 무려 7%! 7%라면 쌓아가다 보면 금방 채워지겠더라구용 음료도 판매하고 계시는데요 아메리카노, 바닐라 라떼 등 디저트류와 어울리기 좋을 것 같더라구요~ 선물박스 패키지도 있으니 구움과자 선물용 기프트로 굳이네요 이제 마떼아의 라인업을 한번 살펴볼게요! 먼저 제가 좋아하는 프레첼 머랭 바질 치즈 특히 프레첼 머랭은 정말 먹다보면 금방 먹어버리는 마성의 간식이죠! 바질치즈 마들렌은 바질과 황치즈의 조합이라 독특한 맛이 날 것 같아서 골라봤어용 무화과 초코 헤이즐넛 카라멜 요건 휘낭시에 종류였구요, 라즈베리 초코 모카 크림 약과 바닐라 크림 얼그레이 레몬 머랭 특히 요 약과 바닐라 크림 디저트는 직접 만드신 약과라니.. 훨씬 맛있을 것 같아요 약과 좋아하시는 분들에게 추천! 레몬 유자 바닐라 가나슈 피스타치오 크림 얼그레이 가나슈 망원 디저트 맛집 마떼아의 마들렌들은 기존 알고 계시는 마들렌보다 통통하고 안에 꽉 차 있더라구요 그리고 다양한 마카롱들이 준비되어 있으니 이름 아래 재료를 보며 기호에 따라 골라주시면 되겠습니다! 뚱카롱이 아니라 일반 마카롱인데요, 저는 개인적으로 너무 달고 해비한 뚱카룽보다 이렇게 담백하고 덜 단 마카롱이 좋더라구요~ 매일 사장님께서 좋은 재료와 적은 첨가물로 정성스럽게 만드신다고 합니다 :) 매장 내부도 깔끔하게 정돈되어 있어서 위생 청결해 보였어요 저는 픽업하러 매장에 방문했는데요, 기다리면서 발견한 마카롱 꼬끄 .. 미술 작품인 줄 알았는데 자세히 보니 꼬끄들이더라구요? 귀엽 귀엽 마카롱과 구움과자 모셔와보았어요~ 마떼아 마카롱은 아몬드 풍미가 잘 느껴지는 쫀득한 꼬끄라고 해서 더 기대가 되었답니다! 제가 고른 마카롱 메뉴는 크림브륄레 (3.0) 레몬 얼그레이 (2.8) 오페라 (3.0) 애플바닐라 (2.8) 라즈베리피스타치오 (2.8) 총 6구에요 깔끔하게 포장된 선물박스에 옹기종기 모여있는 마카롱들! 답례품이나 선물용으로 제격이에용 특히 정말 좋아하는 크림브륄레 바로 먹어보았는데 너무 달지 않은 크림에 부드러운 꼬끄가 느끼하지 않게 맛있었어요 망원동 맛집 마떼아의 시그니처 마들렌도 모셔와 보았어용! 크림이 안에 들어가 있는 푹신한 마들렌으로 크기도 커서 간식 대용으로 좋답니다. 피스타치오 (3.7) 바질 치즈 (3.0) 바닐라 가나슈 (3.5) 라즈베리초코 (3.7) 레몬유자 (3.7) 모카 크림 (3.7) 엇 잘못 잘랐다 그리고 휘낭시에 한가지는 헤이즐넛 카라멜 (3.0) 이에용! 전체적으로 가격도 저렴해서 부담없이 고르기 좋았습니다. 마들렌 크기가 정말 커서 마들렌 하나에 아메리카노 한 잔하면서 간식으로 맛있게 먹었습니다 마들렌이 퍽퍽하게 느껴질 수 도 있는데 가운데 듬뿍 담긴 크림으로 마떼아만의 특별한 마들렌을 맛보았답니다 개인적으로 바닐라빈이 콕콕 박힌 바닐라 가나슈 마들렌과 요 피스타치오 마들렌을 추천 드립니다! 다른 마들렌도 맛있긴 했지만 요 두개가 담백하니 너무.. 맛있.. ❤️ 나머지는 아직 덜 먹어보았네용 히히 마카롱들은 색감도 예쁘고 알록 달록 아기 자기한 모습이라 눈으로 봐도 즐겁고 맛도 기대되는 비주얼이었답니다 ~ 그릇에 함께 두니 색감이 너무 예쁘네요. 마카롱의 크기가 한 입에 먹기 적당한데요, 저는 조금 더 냉장고에 넣어둔 후 하루가 지난 점심에 먹어보았습니다. 뚱카룽과는 다른 근본의 마카롱! 뮤직뱅크 느낌으로다가 찍어보았어용 열심히 먹어본 결과 제가 가장 맛있게 먹었던 마카롱 추천해드릴게용! 라즈베리 피스타치오 마카롱은 라즈베리 안에 피스타치오가 살짝 숨겨져 있는 마성의 마카롱이었어용 색감도 예뻐서 제일 기대했는데 새콤한게 너무 제 스타일이었구요! 애플 바닐라 마카롱은 화이트초콜렛 가나슈 크림에 달콤한 사과잼이 들어 있어서 처음 먹어보는 마카롱 맛이었어요 개인적으로 애플 바닐라 1등! 마카롱은 물론 구움과자류도 택배도 가능하다고 하니 전국 어디서나 마떼아의 시그니처 디저트를 맛보실 수 있답니다. 마떼아의 디저트 보관방법도 적혀 있으니 참고하셔서 드시면 좋겠어용 망원동에 아기자기한 디저트 가게들 중 개인적으로 가장 맛있게 먹었던 곳이에요. 망원 디저트 가게 마떼아는 네이버 전화 연결, 인스타그램으로 예약이 가능하며 케이크는 주문제작으로 받고 있으니 기회가 된다면 주문해보고 싶던 곳이었답니다 :) 마지막으로 마떼아 공식 인스타그램 주소 남겨드리고 떠나볼게요~ 뿅! ↓↓↓ 마떼아, 망원동 커다란 손 작은 가게(@mattea517) • Instagram 사진 및 동영상 팔로워 8,681명, 팔로잉 871명, 게시물 1,902개 - 마떼아, 망원동 커다란 손 작은 가게(@mattea517)님의 Instagram 사진 및 동영상 보기 www.instagram.com 이 게시물은 본 업체에서 서비스를 제공받아 직접 체험 후 작성한 후기입니다."
(망원동디저트) - 마떼아 🍭🍬,마떼아 서울특별시 마포구 월드컵로19길 36 2층 🏡 주소 : 서울 마포구 월드컵로19길 36 2층 📲 전화번호 : 050713322018 ⏰ 영업시간 : 월~토 12:00-19:00 ✨ 매주 일요일 휴무 ✨ 망원동에 완전 맛있는 마카롱집이 있다고 하는데 다들 알고 계시나요~?! 앤 평소에도 마카롱이나 디저트 너무너무 좋아하는데 이렇게 맛있는집이 있다니 🤭 오 원래는 메리였는데 마떼아로 변경되었데요! 다들 참고 ✔️ 2층에 위치해있고 운영시간 다시 한번 확인 해 주시면 좋을 것 같아요 🫶🏻 오우~?! 마카롱 꼬끄로 만든 액자라니 너무 귀엽네요 🩷 포인트 적립도 해 주고 다양한 커피 종류는 물론 패키지도 있으니 참고 🫶🏻 프레첼 머랭 🫧 옴마나 저 이거 진짜 좋아하는 디저트 중 하나인데 정말 하나 사오다가 말았어요 👀 무화과 초코 🍫 앤은 무화과랑 초코 둘 다 너무 좋아하는데 이 조합 최고네요 ✌🏻 클래식 바질치즈 맛이 참 다양하니 앤 마떼아 디저트천국으로 인정 🤛🏻 가나슈랑 머랭이라니 진짜 디저트 종류가 이렇게나 다양할 수 있나요~?! 앤이 정말 정말 기대 많이 했던 마카롱 입니다 🙌🏻 종류가 이렇게나 다양하다구요?! 하나하나 다 먹어봐야지 👍🏻 이쁜 상자에 12개 마카롱 포장해서 앤 집으로 총총 🏡 박스에 야무지게 포장 해 주시고 얼음팩까지 꼼꼼하게 포장해주시니 만족 🫧 마떼아에서 준 보관하는 방법 ✔️ 무조건 한번씩 읽고 참고 하시면 좋을 것 같아요 💕 우와 종류가 12개 🙌🏻 뭐를 먹어야하나요?! 마떼아 마카롱이 다 맛있다고해서 하나 하나 다 포장 🤭 레몬 얼그레이 크림브륄레 밤세 소금 카라멜 제주 말차 등등 우와 종류 너무 맘에 든다 🍭 앤의 최애맛만 골라서 오늘 냠냠 🩷 아니 이러다가 앤 마카롱 돼지 될 것 같아요 🤭 그치만 맛나 🫶🏻 남편이랑 같이 먹었는데 둘다 엄청 맛있다며 왕창 먹었어요 👀 애플바닐라 🍏 우앙 안에 크림이 가득 너무 달콤한데요 🫧 밤세 🍭 저 이거 너무 좋아요!! 이렇게 달달구리 해도 되는건가요 ✌🏻 오페라 🎶 커피와 초콜릿의 조화 아니 사장님 배우신 분 👍🏻 아망드 무화과 🍬 무화과는 무조건 못 놓쳐!! 앤은 무화과 좋아해 ❣️ 크림브륄레 👏🏻 이게 제일 잘 나간다고 해서 두 개나 포장해왔어요 ✨ 망원동에 위치한 마카롱과 다양한 디저트가 너무너무 맛있는 집 ✔️ 왜 다들 마떼아 와서 디저트 사나 했더니만 다 이유가 있었어 🩷 마카롱이 너무 맛있는 곳 마떼아 🫶🏻 By. Ann❣️ #망원동디저트 #망원동맛집 #마카롱맛집 #망원마카롱 #망원마카롱맛집 #마카롱 #망원디저트 #망원디저트추천 #망원역디저트추천 #망원동마카롱맛집 이 글은 리뷰노트를 통하여 본 업체에서 제품 또는 서비스를 제공받아 작성된 글 입니다
망원동디저트카페 마떼아 크림마들렌 마카롱 선물하기 좋은 구움과자 맛집,"안녕하세요- 쵸이에요- 저는 주말 아침에 볼일을 보고 망원동에 있는 구움과자 맛집에 재방문했어요 왜냐면 주말에 빼빼로데이였잖아요? 흔한 빼빼로말고 더 맛있는 구움과자 선물해주는 걸 좋아해서 망원동디저트카페로 유명한 곳에 왔습니다 #망원동맛집 #망원동디저트카페 #디저트카페 마떼아 마떼아 서울특별시 마포구 월드컵로19길 36 2층 주소 : 서울 마포구 월드컵로19길 36 2층 영업시간 ) 월~토 12:00 ~ 19:00 전화번호 : 0507-1332-2018 망리단길에 위치하고 있는 마떼아는 맛집이 많은 골목에 위치하고 있어요 ㅎㅎ 간판이 보이면 옆에 문으로 들어가서 2층으로 올라가면 아주 밝고 깔끔한 매장이 나타납니다 ㅎㅎ 망원동 구움과자 맛집으로 유명한 마떼아는 마카롱, 크림마들렌으로 엄청 유명한 곳이에요 엄청 깔끔하고 밝은 매장에 친절 사장님이 운영하고 계시는 곳 먼저 마카롱 비쥬얼좀 보세요 이 날이 빼빼로데이라서 빼빼로마카롱도 있었어요 비쥬얼보고 다 너무 귀여워서 저한테 엄청난 고민을 안겨준 마떼아... 겉에 초코 코팅도 되어 있고 안에는 말차 + 초코크림이 번갈아가며 짜있더라구요 보기만 해도 너무 귀엽지않나요 빼빼로데이에 흔한 빼빼로과자말고 이런 마카롱 주면 완전 좋죠! 전에 왔을때보다 음료 종류도 많이 늘은 것 같아요 저는 오늘 마들렌 포장하러 와서 따로 마시지는 않았지만 마들렌, 마카롱이랑 함께 먹으면 너무 잘어울릴 메뉴들 그리고 선물박스, 보냉포장 등 가격도 적혀있어서 보고 포장 추가해도 너무 좋을 것 같아요! 포인트 적립 제도도 있고 프레첼 머랭도 있어서 왔다갔다하면서 간식으로 먹기 좋을 것 같아요 ㅎㅎㅎ 제가 들어갔을때 마들렌은 진열중이셔서 마카롱을 먼저 찍었어요 근데 흔하게 볼 수 있는 맛들이 아니라서 더 눈에 들어왔고 색감도 제가 너무 좋아하는 파스텔 색감이라 진짜 더 예쁘더라구요 그리고 빼빼로데이를 맞아 출시된 빼빼롱도...엄청 고민하게 만든.. ㅋㅋㅋㅋㅋㅋㅋㅋㅋㅋㅋㅋㅋㅋ 그리고 제가 오늘 포장해가려고 온 마들렌 마들렌 비쥬얼도 엄청나죠? 안에 크림이 들어있는 크림마들렌인데 종류랑 맛이 다양해서 선물하기 정말 좋아요! 전에도 선물하면서 저도 먹었었는데 진짜 크림이 너무 맛있고 잘 어울리더라구요 아메리카노랑 마들렌 하나면 아침 끝 저는 이렇게 포장으로 요청드렸어요 ㅎㅎㅎ 사장님께서 너무 예쁘게 상자에 담아주셨고 더 안들어가는 친구들은 제가 냠 ㅎㅎ 이렇게 먹는 방법, 보관방법까지 함께 알려주시니 선물하기에 찰떡이고 저는 개인적으로 냉동실에 넣어두고 하나하나 꺼내먹는 걸 좋아하는데 다음에 한번 와서 냉동실에 쟁여놔야겠어요 ㅎㅎㅎ 망원동, 홍대에서 구움과자, 마카롱 찾으신다면 망리단길에 위치하고 있는 마떼아 꼭 방문해보세요 사장님이 정말 친절하시고 원하는대로 최대한 맞춰주시려고 하는 모습이 너무 잘 보이더라구요 사장님 덕분에 너무 좋은 선물했어요 선물 받은 남자친구가 진짜 맛있다고 극찬을...!!"
"마카롱, 마들렌 맛도리 망원동디저트카페 마떼아","여러분, 안녕❤️ 망원동디저트카페 마떼아에서 디저트 원 없이 먹고왔습니다. 블로그 하시는 분들은 아시겠지만 디저트로 배채우는거 쉽지않습니다. 알쥬?ㅎ 마떼아 서울특별시 마포구 월드컵로19길 36 2층 망원역 2번 출구에서 318m 월-토 12:00 - 19:00 매주 일요일은 휴무입니다. 2층에 있는 망원동디저트카페 마떼아 햇볕도 적당히 잘 들고 블라인드 사이로 들어오는게 공간하고 잘 어우러지지요. 뭔가 팝업스토어 같기도 하네요. 저게 다 마카롱 꼬끄로 만든거래요. 마카롱 꼬끄가 예술작품이 되는 순간👍🏻 하늘아래 같은 색상은 없다는게 망원동 디저트카페 마떼아에서 깨달았습니다. 꾸밈노동비 낭낭하게 썼던 나 자신... 차라리 마카롱, 휘낭시에 이런거나 사먹지🥲 왼쪽은 무화과초코 휘낭시에 3,0 피스타치오크림 마들렌 3,7 복숭아 크림치즈 마들렌 3,8 쑥팥배기 3,9 오른쪽은 크렘브륄레 3,0 소금카라멜 2,8 레몬얼그레이 2,8 천도복숭아 2,8 제주말차 2,8 입니다. 푸짐푸짐하죠. 웬만한 디저트카페에서 이러기 쉽지않은데 얼그레이티 4,0 까지 그저 갓벽했습니다. 레몬얼그레이 마카롱입니다. 사장님이 미적감각도 있으신지 꼬끄부터 필링까지 예술이었습니다. 네이밍에 걸맞게 만드신느낌이 낭낭했어요. 단면을 보니 단순 필링이 아니라 얼그레이 잼까지 있더군요. 이녀석은 쑥팥배기 마들렌인데 가을메뉴라고해요. 쑥, 팥이 호불호 갈린다지만 합정디저트맛집답게 초등학생 입맛도 맛있게 먹을 수 있었어요. 쑥크림과 팥크림이 잘 어울리는데 할매니얼들 제대로 저격할 맛! 천도복숭아 마카롱입니다. 꼬끄를 보니 아까 본 꼬끄아트에서 떼온 것 같네요 크크 크랙으로 꼬끄 식감이 상상이 되시려나요. 바삭 쫀득 제대로였어요. 꼬끄 후레이크 대용량 출시하셨으면 제 아침식사로 고정됐을텐데😘 복숭아 잼이 있어 찐 복숭아 스러워서 마음에 듭니다. 남은건 아이스팩 동봉해서 예쁘게 포장해주셨어요. 그리고 서비스로 마카롱 하나를 더 주셨어요. 블로거한테 후한 경우 잘 없는데 감동❤️ 요즘 생각날 때마다 냉동고에서 하나 둘 씩 꺼내먹고 있습니다. 감사합니다. 크림브륄레는 겉면이 그을려져서 와자작 부서지는게 참 재미났어요. 쫀쫀한 카라멜이 쭈우욱~ 친구들하고 등산가기로 했는데 아침에 입맛이 없어서 피스타치오크림 마들렌 하나 먹었는데도 든든했습니다. 대충 2시간 산 탔는데도 허기짐을 못느꼈어요. 등산 다녀온건 조만간 일상글로 올려야징 이녀석 짐작가시나요? 맞습니다. 제주말차 마카롱입니다. 요즘 일본 방사능문제 때문에 말차 어쩌고가 꺼려지는데 망원동카페 마떼아는 제주말차로 만든다고요! 오*록 뺨 후려갈길 깊은 말차의 맛이 느껴지는게 얼그레이티하고 특히 잘 어울렸답니다. 아직 맛봐야 되는 녀석들이 더 있는데 리뷰기한땜시 이만 줄입니다. 여성사장님이 소소하게 운영하시는 망원동카페 마떼아 겨울메뉴는 어떨지 무지하게 기대됩니다. 딸기메뉴 원츄🥰 늦은 오후에 방문했더니 밤메뉴들이 죄다 나가서ㅠ 조만간 다시 방문해야겠어요. 딱 기다려라! 이놈들! 네이버 영수증 리뷰 이벤트도 진행하는데요. 사진 포함 후기글 3줄 이상 올리시고 재방문시 마카롱을 무려 3개나 받을 수 있습니다. 그래서 저 또 갈거임ㅇㅇ 오늘도 포스팅 읽어주셔서 감사합니다❤️ #망원마떼아 #마떼아 #마포구디저트 #마포구카페 #망원동카페 #망원동디저트카페 #디저트카페 #망원동맛집 #크렘브뤨레 #얼그레이티 #쑥디저트 #팥디저트 #마카롱세트 #마카롱선물세트 #디저트선물세트 #여자친구선물 #여자친구선물추천"
