title,content
망원동 아기자기한 구움과자집🍂 엔티프(NTIF),"※이 글은 2023년 9월에 방문하여 작성한 글입니다. 망원동 귀여운 과자가 있는 카페 엔티프 N.TIF 망원역 엔티프 영업시간 매일 12:00 - 19:00 반려동물 동반카페 망원역 엔티프 전화번호 010-8505-0901 망원역 엔티프 위치 / 인스타 엔티프 서울특별시 마포구 포은로 78 2층 엔티프ㅣ망원동 베이크샵(@n.tif_official) • Instagram 사진 및 동영상 팔로워 167명, 팔로잉 2명, 게시물 7개 - 엔티프ㅣ망원동 베이크샵(@n.tif_official)님의 Instagram 사진 및 동영상 보기 www.instagram.com 망원동길에 새롭게 연 디저트 카페 엔티프. 건물 2층에 자리잡은 엔티프는 귀여운 모양을 한 조그마한 디저트를 판매하는 곳으로 9월 4일에 오픈한 따끈따끈한 공간이었다! 오밀조밀한 귀여운 모양의 디저트 뿐만 아니라 카페 공간도 파스텔톤으로 아기자기한 맛이 있던 엔티프. 하늘색 카운터와 격자무늬의 바닥, 샛노란 벽지가 눈에 띄는 공간으로 딱 디저트 카페스러운 사랑스러운 느낌으로 꾸며져 있었다 진열대엔 미니사이즈의 구움과자들이 진열되어 있다 꽃 모양, 낙엽모양 등 귀여운 모양의 과자들이 있어 보기에도 좋고 데코하기에도 안성맞춤! 구움과자는 휘낭시에, 마들렌, 까눌레, 파운드케익 같은 카페에서 흔하게 볼 수 있는 것부터 우리에게 조금 생소한 티그레까지 만나볼 수 있었다 티그레는 찾아보니 휘낭시에랑 비슷하지만 모양과 식감이 살짝 다르다고 하니 휘낭시에 좋아하는 사람들은 한 번 도전해봐도 좋을 듯. 망원동 엔티프 메뉴, 망원동 엔티프 가격 망원동 엔티프 메뉴판 마실거리는 구움과자 류와 어울리는 티와 커피가 준비되어 있다 시즌메뉴인 파르페도 정말 궁금했지만 시간이 없는 관계로 아메리카노(4,500won)와 현재 테스트 중인 얼그레이 디저트 하나 주문했다 티그레, 아메리카노 이 날 가을임에도 더웠어서 아메리카노를 시켰는데 부담없이 고소한 맛이 나는 시원한 아메리카노 맛이었다 시간이 정말 없었던 관계로 아메리카노만 후딱 먹고 티그레는 포장해서 나중에 먹기로 ㅠㅠ 기존 티그레에서 얼그레이 맛을 테스트 중이신 것 같았는데 티그레에 비스켓을 올려 먹으라고 서비스로 주셨다! 시간만 있었으면 다 먹고 나오는건데 아쉽다 오픈한지 얼마 되지않아 까눌레도 서비스로 주셨다 이렇게 많이 받아가도 되는건지,, 몸둘바를 모르겠다😙 포장할 때 미니까눌레도 함께 포장해갔다 1200원이라는 가격에 귀여운 사이즈의 까눌레는 소품이라고 해도 믿을 정도로 미니 장난감같은 느낌! 핑거푸드같기도 하고,, 귀여워서 먹기 아까울 것 같다 가오픈 이벤트로 예쁜 상자에 포장해주심! 선물용 박스도 아기자기해서 지인 선물용으로 좋을 듯+_+ 서비스로 구움과자 하나 더 넣어주셔서 나가는 순간까지 기분좋게 머물 수 있던 곳. 구움과자는 집에서 야금야금 하나씩 먹어봐야겠다!"
망원동 카페 엔티프 귀여운 티그레 디저트 카페,"최근 오픈한 망원동 카페 엔티프입니다 지난 제주 여행 때 진정성 종점의 티그레를 맛본 후 그 매력에 푹 빠졌었는데 티그레를 메인으로 다양한 구움 과자를 선보이는 디저트 카페라 하여 기대를 안고 방문해 보았습니다 엔티프 N. tif • 12:00 ~ 20:00 (월, 화 휴무) • 서울 마포구 포은로 78 2층 망원동스러운 오래된 상가 건물 2층에 위치한 디저트 카페 엔티프입니다 깔끔하지만 다소 평범한 간판에 처음 방문하는 분들은 카페인 줄 모를 것 같기도 한 외관인데요 망원동 카페 엔티프의 입구에 들어서면 밖에서 보았던 모습과는 달리 눈부시게 햇살이 들어오는 버터색 공간이 펼쳐집니다 채광이 너무 좋아 나중엔 커튼을 쳐달라 부탁드릴 정도였어요 😆 제빵실로 향하는 아치형 문을 뒤로하고 가로로 긴 쇼케이스와 카운터가 위치하고 있습니다 아치형 문 옆에는 계단식으로 만든 진열대를 두어 감성 소품들로 꾸며놓고 있습니다 엔티프만의 포장 패키지 샘플도 볼 수 있습니다 망원동 카페 엔티프의 디저트 쇼케이스입니다 앞 사진들엔 컬러감이 제대로 표현되지 않았는데 러블리한 베이비 블루 컬러의 진열대라 버터색 벽과 조화를 이루고 있습니다 😄 디저트 카페 엔티프의 메인 디저트 티그레입니다 방문한 날에는 8가지 종류를 판매하고 있었는데 sns 계정에 매일 라인업을 올리시니 방문 전에 참고하시면 좋겠습니다 솔직, 두근, 편안, 긴장, 상쾌 등 이름도 귀엽게 지으신 것 같아요 ㅎㅎ 망원동 카페 엔티프의 메뉴판입니다 커피와 티 종류를 갖추고 있고 에디션 덴마크의 차를 사용하고 계십니다 😃 취향에 맞아 몇 번 구입하기도 한 화이트 템플도 있어 디저트에 차를 곁들일까 잠시 고민을 ㅎㅎ 티그레도 궁금했지만 오늘 방문한 목적 중 하나인 가을 파르페입니다 우연히 사진으로 비주얼을 보았는데 그 맛이 너무 궁금하더라고요 😁 금손 사장님이 직접 그리신 파르페에 대한 설명입니다 망원동 카페 엔티프는 젊은 여자 사장님 두 분이 운영하고 있는 곳입니다 😃 주문을 마친 후 둘러본 매장의 모습입니다 매장이 그리 크지 않아 2인석 3개를 갖추고 있습니다 오픈한지 얼마 안 된 시간이었는데 햇살이 눈부시게 들어와 등이 따가울 정도였어요 ㅎㅎ 햇살 사진 남기고 싶으신 분들 참고해 주시고요 😁 입구 옆에는 바 테이블도 마련되어 있습니다 구움 과자 위주의 디저트 카페라 그런지 취식할 수 있는 테이블 수는 많지 않은 편입니다 망원동 카페 엔티프의 장점 중 하나, 화장실이 매장 내부에 있다는 점입니다 망원동 자주 방문하는 분들은 아시겠지만 낡은 상가 건물에 입점해 있는 매장들이 많아 외부 공용 화장실을 이용해야 하는 경우가 많은데 이렇게 매장 내부에 있다니 정말 좋습니다 😄 작은 테이블을 갬성 느낌으로 꾸며놓고 있습니다 망원동 카페 엔티프는 보시다시피 귀엽고 아기자기한 분위기의 카페입니다 젊은 사장님들이 패기 넘치게 셀프 인테리어로 준비한 매장이라 세련미는 다소 부족하지만 젊음의 열정이 보인다고나 할까요? ㅎㅎ 벽면에도 직접 그린 포스터와 그림들을 붙여 장식하고 있습니다 😄 드디어 주문한 가을 파르페와 라즈베리 티그레인 '두근'이 나왔습니다 역시 자연광이 최고예요, 사진 백 장을 찍습니다 ㅎㅎ 망원동 카페 엔티프의 시즌 메뉴인 가을 파르페입니다 제일 아래 휘낭시에 조각을 깔고 보늬 밤 크림과 공주 밤 한 알, 새콤한 카시스 쿨리, 슈트로이젤 위에 무화과 아이스크림과 바닐라 아이스크림 미니 스쿱, 누가 틴으로 데코하였습니다 파르페를 무척 기대하고 있었는데 중간에 포인트로 들어간 카시스 쿨리 양이 과해 보늬 밤 크림과 공주 밤의 맛이 완전히 묻혀 아쉬웠습니다 휘낭시에로 마무리되는 식감도 조금 무거운 느낌이었고요 반면, 진한 쇼콜라와 라즈베리 가나슈의 티그레 ‘두근’ 은 초콜릿을 좋아하는 저의 입맛에 잘 맞았습니다 적당한 단맛도 커피와 잘 어울릴 듯한 느낌이었습니다 다만, 겉 부분이 다소 건조한 느낌이었는데 사장님께서 바삭한 느낌을 원하셔서 구워낸 질감이라 하니 참고하시고요 😄 다소 취향에 맞지 않는 부분도 있었지만 적극적으로 고객의 피드백을 원하는 사장님들과의 즐겁고 진지한 대화로 앞으로 더욱 개선되는 모습을 보여주리라 기대됩니다 티그레를 좋아하는 분들은 한번 방문해 보세요 망원동 카페 엔티프였습니다 😄 엔티프 서울특별시 마포구 포은로 78 2층"
망원동 신상카페 [엔티프 N.TIF] 아기자기한 분위기 디저트 맛집,"엔티프 서울특별시 마포구 포은로 78 2층 엔티프 서울 마포구 망원동 401-36 2층 망원역 2번 출구에서 512m 망원동 신상카페 엔티프 영업시간 -매주 월요일, 화요일 정기휴무 수~일 12:00 ~20:00 다양한 주제가 될 수 있는 'N', 그의 표현이 되어줄 소재 'MOTIF'가 만나 이야기를 듣고 굽는 엔티프 카페 망원동 디저트카페 엔티프 영상으로 보기 예쁜 카페 투어를 좋아해서 카페를 많이 다니는 편! 이번에는 망원시장 들렸다가 방문하기 좋은 망원동의 신상 디저트 카페를 찾아왔다. 포스팅 작성 날짜 네이버 카페명 검색 기준으로 새로 오픈이라 뜨니 완벽한 신상카페!! 아직 블로그리뷰가 9개뿐인지라 내가 10번째 영광이 될 것 같다. 왜 엔티프일까는 방문한지 거의 3주 차에 알게 되었다,, N과 모티브였다니 너무 신선하다!!!!! 망원동시장 먹거리 투어를 신나게 돌아다니다가, 이제 다리가 아플 때쯤 카페인 한잔 마셔줘야 할 것 같아서 찾은 카페 N.TIF 사실 대형카페를 좋아하다 보니 2층 매장이 밖에서 바라보니 넓을 것 같아서 방문했는데 생각보다 규모는 아기자기했다고 한다 망원동 디저트 신상카페 엔티프 내부 위에 말했듯 대형카페를 찾다가 들어오다 보니 생각보다 작아서 다른 데로 가볼까 싶던 찰나도 정말 0.1초 정도,,? 아기자기한 카페가 너무 예뻤다!! 그리고 작게 보이는 디저트들이 발길을 사로잡아줬다 소품들도 귀여운 센스! 벽 쪽으로도 테이블이 붙어있어 작은 공간이 있다 창가 쪽 뷰로 소품들을 꾸며놨는데, 지금 리뷰를 보니까 아마 크리스마스 트리로 장식되어 있는 듯하다. 해당 사진은 10월 말이다. 동경제과에서 공부한 셰프가 직접 만드는 디저트로 마들렌, 휘낭시에, 카눌레, 파운드, 쿠키 등 다양한 라인업의 디저트가 준비!! 안쪽 디저트를 굽는 공간은 매장만큼 넓어 보였다. 바로 구워져서 나온다고 생각하니 더 맛있어 보이는 느낌 시즌 메뉴로 파르페도 11,000원에 판매한다. 엔티프 메뉴판인데 음료메뉴는 많지 않다. 아메리카노, 카페라떼, 바닐라라떼, 그리고 디카페인으로 주문시 500원추가. 티는 루이보스바닐라와 저스트프룻, 화이트템플이라 적혀있다 우리는 아이스아메리카노와 카페라떼 그리고 디저트들을 주문했다. 디저트에는 저마다 이름이 있다. 들뜸, 포근, 경쾌, 애틋 아래에는 어떤 쿠키인지에 대한 설명도 적혀있어서 고르기가 수월하다 미니까눌레는 크기가 정말 작은데 오후2시세트로 세가지맛 미니카눌레가 있다! 휘낭시에와 마들렌종류들 그리고 많이 못 보던 비주얼 티그레 구움과자까지!! 크기가 작아서 오히려 배부를 때 먹기 좋은 느낌! 우리가 주문한 건 신바람과 포근 신바람-바삭하고 촉촉한 럼바닐라 카눌레 포근-부드럽고 따스함이 느껴지는 호박파운드 아메리카노와 카페라떼와 너무 잘어울리는 디저트 구움과자도 귀엽고 접시도 예뻤다! 라떼는 고소한 우유맛을 좋아하는데 딱 맛있었다 커피자체가 맛있어서 맛있는 그런 라떼맛 아메리카노도 산미 없이 고소했다 디저트는 배고플 때 오면 많이 아쉬울 것이고 배부른 상태에서 오면 더 좋을 사이즈 다른 데서 먹었던 디저트보다 확실히 크기가 좀 더 작은 느낌이다 까눌레를 칼로만 커팅해보려다 실패해서 포크로 자르는 모습 겉바속촉의 정석이다 맛있게 먹고 푹쉬고! 카페자체가 조용해서 혼자온 손님도 두명정도 있었고 나중에는 세명정도 더 와서 매장이 가득 찼던 것 같다 우리도 열심히 망원동 카페를 즐기고 가본다! 화장실도 내부에 있음 기분 좋은 떨림이 함께하는 만남 그 순간을 N.TIF 엔티프가 구워드립니다~! 일러스트가 귀여워서 똑같은 각도로 사진한번 찍어보기 손님이 앉아있어서 완벽하진 않지만 딱 이 각도다! 공간이 예뻐서 더 편안했던 망원동 신상카페 엔티프 리뷰종료 - 엔티프는 마포구 망원동에 위치한 신상 카페로, 망원역에서 512m 거리에 있음. - 영업 시간은 매주 월요일과 화요일을 제외한 수~일요일 12:00 ~ 20:00. - 카페 내부는 작고 아기자기하며, 소품들이 귀여움. - 동경제과에서 공부한 셰프가 직접 만드는 디저트를 판매함. - 디저트는 마들렌, 휘낭시에, 카눌레, 파운드, 쿠키 등 다양함. - 음료 메뉴는 아메리카노, 카페라떼, 바닐라라떼 등이 있음. - 디저트는 크기가 작아 배부를 때 먹기 좋음."
"망원역 엔티프, 꾸덕하고 달달한 티그레와 파르페가 궁금하다면 망원역 카페 엔티프","시즌에 맞는 음식만 생각하고 있었는데, 찾다보니 시즌에 맞는 디저트도 있더라구요? 오늘은 시즌마다 맛있는 디저트를 준비하는 망원역 카페 엔티프를 소개드리려고 해요. #망원역카페 #망원동카페 #망원역엔티프 #망원동엔티프 #엔티프 #망원역데이트 #망원동데이트 엔티프 서울특별시 마포구 포은로 78 2층 <주소> 마포구 포은로 78 2층 <근처 지하철역> 망원역 2번출구 망원시장 방면으로 직진하시다가 옆골목으로 슬쩍 빠지셔야해요. 하약색 건물 2층이라 찾기 어렵지는 않으실거예요. <주차> 근처 망원 공영주차장 이용 가능 카페 전용 주차장은 따로 없고, 근처 공영주차장을 이용해야해요. 망원 공영주차장은 30분 1,800원으로 운영하고 있어요. 동경제과에서 공부하신 셰프님께서 직접 디저트를 만든다고 하시니 기대가 되더라구요. 수요일~일요일 12:00~20:00 월요일~화요일 정기휴무 1층에서 간단히 메뉴를 확인하고 올라가실 수 있어요. 2층에 보시면 작은 카페지만, 이미 아시는 분들은 많이 방문해주고 계시더라구요. <연락처> 010-8505-0901 <인스타그램> https://www.instagram.com/n.tif_official 엔티프ㅣ망원동 베이크샵(@n.tif_official) • Instagram 사진 및 동영상 팔로워 1,009명, 팔로잉 10명, 게시물 52개 - 엔티프ㅣ망원동 베이크샵(@n.tif_official)님의 Instagram 사진 및 동영상 보기 www.instagram.com <스마트스토어> https://smartstore.naver.com/ntif_bakeshop 엔티프 : 네이버쇼핑 스마트스토어 여러분들의 이야기가 구워지는 공간, 엔티프입니다. smartstore.naver.com 너무 예뻐서 선물용으로도 좋다고 생각했는데, 네이버 스마트스토어로 구매도 가능하다고 하네요. <네이버링크> https://naver.me/5dPageVJ 엔티프 : 네이버 방문자리뷰 102 · 블로그리뷰 8 naver.me 자리가 엄청 많은게 아니기 때문에 방문하시기 전에 꼭 예약하시고 방문하시는 것을 추천드려요. 망원역 카페 엔티프 분위기 어떤가요? 정말 깔끔하고 좋지 않나요? 정말 사진찍기에 예쁜 소품샵 느낌이었어요. 망원역 엔티프 전체적인 분위기예요. 전체적으로 하~얀 분위기라 디저트가 더욱 눈에 확 들어오더라구요. 기념으로 예쁜 종이들을 모을 수 있어요. 저는 개인적으로 책갈피로 쓰려고 가져왔어요. <음료> 아메리카노 4,500원 카페라떼 5,000원 바닐라라떼 5,500원 시즌 파르페 11,000원 <디저트> 솔직 3,800원 든든 4,300원 두근 4,300원 긴장 4,300원 상쾌 4,900원 등등 다양한 티그레들이 준비되어 있어요. 이름이 굉장히 특이하죠? 뭔가 상대방에게 느끼는 감정을 표현하면서 고르기도 좋을 것 같더라구요. 시즌 파르페 11,000원 긴장 4,300원 상쾌 4,900원 어때요? 망원역 카페 엔티프는 일단 보기에도 굉장히 예뻐서 더욱 좋더라구요. 데이트 하기에 딱 좋은 장소였어요. 가을 시즌에만 판매하고 있는 파르페 모습이에요. 가을에 어울리는 밤과 카시스, 무화과의 조합! 그리고 그 위에 수제 아이스크림 토핑! 다른 곳의 디저트들과 다르게 각 재료 본연의 맛을 느낄 수 있어서 너무 좋았어요. 맛이 너무 달거나 세지않고, 은은한 재료의 맛들이 입안에서 조화를 이뤄서 즐기기 좋더라구요. 상쾌(왼쪽) 상쾌라는 이름의 티그레는 유자와 오렌지가 주는 상쾌함이 가득한 디저트예요. 상큼한 맛을 좋아하신다면 추천드리고 싶어요. 긴장(오른쪽) 긴장이라는 이름의 티그레는 쌉싸름한 말차베이스에 상큼한 라즈베리가 만나 두근거림이 함께하는 디저트예요. 디저트에 대한 맛 표현이 너무 예쁘지 않나요? 저는 이번에 '티그레'라는 디저트를 망원역 엔티프에서 처음 먹어봤는데, 뭔가 꾸덕함과 함께 상큼하기도 하고 쌉싸름하기도 하더라구요. 이번에는 은은한 디저트를 먹으면서 꼭 달기만한 디저트와는 또 다른 매력을 느낀 것 같아요. 망원동에 가시면 망원시장을 중심으로 데이트를 즐기실 수 있어요. 이번에 망원동 데이트를 즐기면서, 입 안을 너무 행복하게 만들어줬던 망원역 카페 엔티프를 여러분께도 꼭 소개드리고 싶더라구요. 물론 시장을 돌아다니면서 지친 몸을 쉬어가기에도 딱 좋은 카페라고 생각해요. 이번 주말은 다른 곳 말고 망원동에서 편안한 데이트를 즐겨보시는 것은 어떨까요?"
망원동 N.TIF(엔티프) 오픈!,"엔티프 서울특별시 마포구 포은로 78 2층 N.TIF(엔티프) 📍서울특별시 마포구 포은로 78 2층 📍영업시간 12:00 - 20:00 📍정기휴무 매주 월요일 화요일 📍포장 예약 반려동물 동반 가능 엔티프ㅣ망원동 베이크샵(@n.tif_official) • Instagram 사진 및 동영상 팔로워 282명, 팔로잉 9명, 게시물 19개 - 엔티프ㅣ망원동 베이크샵(@n.tif_official)님의 Instagram 사진 및 동영상 보기 instagram.com 초기 자본이 넉넉하지 않은 사람이 드디어 카페를 OPEN 해땅.. 떨림반 걱정반으로 시작한 나의 카페 오픈 일기.. 사부작 거리면서 기록을 남겨보려고 한다 카페 오픈은 이 직업을 선택한 순간부터 나의 꿈이었다. 꿈이 이루어지는 첫 시작 6월 28일 부동산에서 가계약을 하고 8월 14일 잔금을 치른 뒤 16일에 드디어 나만의 공간에 들어설 수 있었다 (이때까지만 해도 내가 이렇게 힘들 줄 몰랐지 .. ㅎ) 하지만... 나는 극 P 오픈까지의 중간 과정은 없다 ㅎ 그냥 로고를 만들고 스티커 제작도 하고 청소도 하고 소소하게 마음에 안 드는 부분을 페인트칠 하면서 여느 카페 사장님과 다를 거 없이 매장 오픈을 준비했다! 다른게 있다면 주변에서 많은 도움의 손길이 있었던 정도..💗 로고, 명함, 매장에 데코로 붙인 포스터 등등등 모든 그림은 금손 우리 장지은 셰프님이 수작업으로 해주셨다. 생각보다 로고 명함 디자인 비용이 꽤나 컸던 걸로 기억해 돈 없다고 내가 찡찡 거렸던 기억이.... 다시 한번 지으나 사랑한다..💛 음.. 다들 비슷하시겠지만 일단 나는 돈이 없어 조금 급하게 오픈을 한 케이스다. 숨만 쉬어도 나가는 월세 공과금 기타 등등등 초기 자본이 넉넉하지 않은 나로서는 한 푼 한 푼이 아쉬워 오픈을 서둘렀다. 오픈을 하고 난 후 이게 가장 큰 후회로 남았는데............ 자책해 봐야 뭐.. 시간을 돌릴 수도 없는 노릇 즐기자 :) 아무튼! 오픈을 하고 정말 정말 많은 기대를 했지만 음. 뭐 처음부터 잘하는 사람이 있겠어? ㅎ.. 당연히 어설펐고 빈틈투성이였다. 쇼케이스 진열부터 포장, 홀에서 드시고 가시는 분들 응대 등등 내가 생각했던 것과 다르게 흘러갔다 ㅎ 이게 바로 제대로 준비 안 하고 오픈한 나의 바보 같은 실수의 첫 시작! 그치만 나는 복받은 인맥왕 ,, 나의 구세주이자 존경하는 권형준 셰프님이 오셔서 나를 구원해 주셨다 🥺 그 결과..! 티그레 맛집으로 노선 변경 ㅎㅅㅎ 인생 원하는 데로 흘러가지 않는 게 국룰이지 머 ㅎ BEFORE AFTER 나는 노선을 틀어서 티그레의 베리에이션을 늘렸고 쿠키를 없애는 대신에 티그레에 들어가는 모든 걸 직접 하나하나 만들기로 결정! 은 정말 당연한 말이지만 요즘 페이스트까지 직접 만드는 곳 은 드물겠지 ....라는 혼자만의 자신감으로 ㅎㅎ.. 내 손이 닿을 수 없는 곳(ex-원재료 가공!)은 비싼 재료로 메꾸고 나에게 남은 건 체력 뿐! 잠자는 시간을 줄이고 남들과 달라질 수 있는 다른 방향으로 몸을 갈아 넣기로 했다! 그 결 과 당연한 거지만 내가 귀찮아진 만큼 맛은 당연히 있었고 손님분들도 좋아해 주셨다! (이때의 뿌듯함이란..) 아직 많은 분들이 오신 건 아니라서 지극히 일부의 의견이긴 하지만 겉바속촉에 꾸~덕한 가나슈가 너무너무 맛있다는 말이 나를 힘나게 해줬다! 그 덕분에 나랑 지은이는 우울하고 자존감이 많이 떨어져 있던 시간에서 조금 더 자신감이 붙고 우리의 손길을 하나하나 더 늘려감으로써 자존감은 up 웃는 날 도 늘어갔다. 아직 오픈한지 이주 조금 넘은 시기이지만 조급하고 불안한 감정이 아예 없다는 건 당연히 거짓말이지만 장사는 뭐다? 존버 ! 버티고 버티다 보면 어느 순간 많은 분들이 찾아주고 좋아해 주시겠지란 마음으로 하루하루 더 열심히 하는듕 ㅎ_ㅎ 💕좋은 재료로 하나하나 정성들여서 만들고 있으니 엔티프 많이많이 사랑해 주셨으면 한다💕 #망원동카페 #망원동디저트 #망원동데이트 #망원동티그레 #망원동 #망원동맛집 #망원동분좋카 #망원역카페 #냠냠쩝쩝"
망원동 디저트 맛집::신상 굼과자 맛집💛엔티프,"오랜만에 망원시장 갈겸 왔던 망원동🐥 카페 세잔 있던 자리 건너편 건물 2층에 새로 생긴!! 가오픈중인 엔티프 방문했다! 망원동 디저트 투어::카페 세잔, 괄호, 연남동 교동집 쭈꾸미, 올바른 김밥 오랜만에 친구 만나서 망원동 간날 예전에 한번 왔다가,,남은게 별로 없었던 기억이 있는 카페 세잔! 이날... m.blog.naver.com 건물입구에 귀여운 입간판이 있고 2층 올라가면 왼편에 엔티프가 있다! 방문한 날에 해가 들어오지 않아서 아쉬웠다ㅠㅠ 햇살 맛집일거 같은 느낌인데 말이지,, 베이지색 벽과 하늘색 포인트, 바닥이 편안한 느낌을 주던 엔티프! 색감도 예뻐서 사진도 잘나오고 넘 좋다아 내가 좋아하는 파운드ㅠㅠㅠ 다른 보통의 파운드 보다 크기가 작아서 너무 좋았다!! 이것 저것 먹고싶은데 파운드는 보통 크기가 커서 부담스러운데 여러개 먹기 딱 좋은 사이즈였다💛 내가 좋아하는거 총 집합ㅜㅠ 디저트 이름도 너무 귀엽고 센스 있다! 엔티프는 티그레 맛집이라던데 종류도 다양하고 맛있는거 많아서 고르기 힘들었다ㅠㅠ 너무 귀여웠던 까눌레ㅠㅠ 날씨 좋을때 한강가서 먹기 딱 좋은 디저트 천국💛 콜드브루랑 든든 티그레, 경쾌 주문했다!! 시트러스 처돌이라 제일 궁금했던 레몬 쿠키 든든은 브라우니 티그레 였는데 이름처럼 든든했구! 촉촉 꾸덕하고,,많이 안달아서 좋았ㄷㅏ!(k디저트 극찬ㅋㅋㅋ 많이 안달아서 좋다,,,) 레몬 쿠키는 더 쨍한 상큼함이 있었으면 더 좋았겠지만 은은하니 좋았다! 한강 갈때 들러서 후식겸 사가기 너무 좋았던 엔티프! 다음에 또 들러서 디저트 뿌셔야지 망원동 구움과자 맛집으로 인정 합니다🐥"
