title,content
망원동디저트 맛집 마들렌 추천 마떼아,"안녕하세요 오늘도 남들하는거 다 하는 쪼쪼입니다 망원동에 맛있는 거 먹고 시장 구경 갔다가 연남동에 진짜 좋아했던 디저트맛집인 메리가 망원동 마떼아로 오픈한 게 생각나서 들렸다 꺄!!!!!!!내가 좋아하던 그 마들렌들을 다시 먹을 수 있는고야!?!!?! 마떼아 서울특별시 마포구 월드컵로19길 36 2층 서울특별시 마포구 월드컵로19길 36, 2층 망원역 2번 출구에서 318m 월 ~ 토 12:00 - 19:00 매주 일요일 정기휴무 포장, 예약 반려동물 동반 가능 사장님 진짜 정성가득하게 디저트를 만드시는 걸로 이미 유명하지ㅎㅎㅎ 마들렌도 맛있지만 휘낭시에도 엄~청 잘 만드시기 때문에 설렘 가득! 2층으로 올라가는 중ㅎㅎㅎ 몰랐던 사실인데 케이크도 주문제작 가능! 세상 아기자기하다ㅎㅎㅎ 앉아서 먹고 갈 수 있는 테이블도 있다 그리고 마들렌 그림이 너무 예뻐서 나도 갖고싶었음ㅎㅎ 사장님의 갬성이 나랑 잘 맞는 것 같아! 느낌 너무 이뻐,,,ㅠㅠㅠㅠㅠ 자 이제 골라봅시다~! 난 내가 먹기도 하고 선물도 할 거라서 박스 포장을 주문했다ㅎㅎㅎ 하ㅠㅠㅠ진자 맛있는거 너무 많아서 다 가져가고 싶었음!!!!! 와,, 사장님 정말 꼼꼼하시구나 머랭 이렇게 예쁘게 만드시다니 깨진 거 하나없이 아주 완벽해! 난 휘낭시에 덕후이기 때문에 헤이즐넛 카라멜과 무화과 초코를 필!수!로 사야하기에 겟겟! 심플 이즈 베스트! 레몬향과 버터맛이 너무 좋은 클래식도 겟겟 맛있는 마들렌과 휘낭시에를 많이 사서 너~무 기쁘다ㅎㅎㅎ 맛있는거에 쓰는 돈은 1도 안아까움 집에 와서 바로 뜯음!!!!!!!!!! 하ㅠㅠㅠ행복해 마들렌 9개^^^^^^ 한번에 다 먹지말고 하루에 딱 3개씩만 먹자 제발 밤마들렌과 밤크림 속에 진한 유기놀제주말차 가나슈가 들어있는 마롱! 바닐라빈이 콕콕 들어가고 생크림비율 많은 이보아르화이트 초콜릿가나슈크림으로 촉촉하고 고급스러운 바닐라가나슈마들렌! 커피맛 낭낭하고 둘세초콜릿크런치로 바삭한 식감 살린 모카크림! 다른곳에서는 볼 수 없는 유니크하고 좋은 재료를 넣은 마떼아 마들렌ㅎㅎㅎㅎ 이러니 유명할 수 밖에! 구움과자는 실온 2일/냉장 4일/냉동 2주 보관 가능하다ㅎㅎ 실온에 두고 2일 안에 먹는게 젤 맛있고 냉장했던 크림마들렌들은 실온에 좀 두고 먹으면 부드럽게 더 맛있게 먹을 수 있음! 색깔있는 마들렌은 처음봐서 고른 라즈베리초코! 발로나코코아마들렌 속에 과나하초콜릿가나슈와 라즈베리버터크림의 완벽조화의 마들렌!!!!!!!! 상큼달달 존맛임 먼저 내가 젤 좋아하는 마떼아 휘낭시에! 와인에 졸인 무화과를 넣고 발로나 초콜릿 채운 무화과초코 휘낭시에는 진짜 깊은 맛 무화과의 달달함과 초코의 달달함이 섞여 아주 매력적!!!!!! 복은 헤이즐넛을 꽉 채워놓고 카라멜을 완전히 뒤덮어준 헤이즐넛카라멜! 고소함과 오도독한 식감은 물론 커피랑 마시기 너무 좋았던 휘낭시에!! 속까지 아주 꽉~차게 맛있음 크림마들렌의 크림드르이 뭉개지지않게 다 고정해주셔서 보관하기 더 쉬웠다 마들렌들 너무 맛있어서 난 와인과 함께 먹었다ㅎㅎㅎㅎ 와인과 구움과자 잘 어울리는거 아시는지?! 마떼아 마들렌 만세 이렇게 맛있을 줄이야ㅠㅠㅠㅠ 기대 했는데 기대 더 이상임 크림이 느끼하지않고 상당히 맛있고 깔끔하고 좋았다 친구에게 몇개 줬더니 너무너무 맛있다며 택배주문을 하겠다고 할 정도로 너무 좋아해서 뿌듯^^ 좋은 재료로 정성들여 만드는 망원동디저트맛집 마떼아 왕! 왕! 완,전,추,천~! #망원동맛집 #망원동카페 #망원동디저트 #망원동휘낭시에 #망원동마들렌 #망원시장맛집 #망원시장카페 #망원시장디저트"
[맛집 공유] 마카롱이 맛있는 망원동디저트 맛집 '마떼아',"마떼아 서울 마포구 월드컵로19길 36 2층 ☎ 0507-1332-2018 월~토 12시~7시/ 일 10시~10시 50m © NAVER Corp. 마떼아 서울특별시 마포구 월드컵로19길 36 2층 평소 마카롱과 마들렌 등 디저트를 너무 좋아하는데요. 오늘은 망원동디저트로 유명한 가게가 있다고 해서 가보았습니다!! 사실.. 마카롱 없어서 못먹잖아요.. 저만 그런거 아니죠..? 전 앉은자리에서도 마카롱 5개는 먹을 수 있는데.. 비싸서 잘 못먹는 디저트 중 하나랍니다. 망원역 2번출구에서 도보로 5분정도 걸어가면 찾을 수 있는데요. 망원동구움과자 맛집 마떼아는 2층에 위치해있습니다. Next image 입구에 가면 친절하게 간판도 놓여져있어서 쉽게 찾으실 수 있습니다. 벌써부터 마카롱 먹을 생각에 기분이 좋아집니다. 사실 마떼아는 이미 연남동에서 유명한 디저트가게였습니다!! 연남동에 메리가 상호만 변경해서 망원동 마떼아로 이전한 것인데요. 아시는 분들은 다 아실 것 같더라구요. 문을 열고 들어가니!! 한 쪽엔 테이블이 놓여져있는데요. 음료도 판매하니 매장에서 먹고가도 좋을 것 같았습니다. 한쪽엔 제가 기대하고 온! 마카롱, 마들렌, 휘낭시에가 있었습니다!! 벌써부터 뭘 고를지 고민됬습니다. 한 쪽엔 꼬끄가 붙어있었는데 모형인지 진짜 꼬끄인지 모르겠지만 너무 예뻐서 찍어보았습니다. 맛있는건 이쁘잖아요.. 꼬끄만 먹어도 맛난거 다들 아시죠?ㅎ 괜히 거울로 사진도 찍어보았습니다... 매장에서 먹을 때 주문할 수있는 음료도 있는데요. 저는 일정이 있어서 음료를 시키지않았지만 디저트가게가 맛있으니 음료도 당연 맛있을 것 같았어요. 멤버쉽도 7%나 적립해주네요. 요즘 7%나 적립해주는데 많지않죠! 마들렌과 마카롱 그리고 휘낭시에가 종류별로 놓여져있었습니다. 종류가 엄청 많죠? 마떼아 마카롱 종류 마떼아 마카롱은 아망드무화과, 애플바닐라, 오페라, 소금바닐라, 소금카라멜, 제주말차. 라즈베리피스타치오, 레몬얼그레이, 밤세, 유자생강, 크렘브뤨레,웨딩임페리얼 총 12가지 종류가 있었습니다. 특히 좋았던게 마카롱에 설명이 자세하게 되어있어서 더 잘 고를 수 있었어요. 마떼아 마들렌 종류 마떼아 마들렌은 마롱, 레몬유자, 얼그레이가나슈, 바닐라가나슈, 피스타치오가나슈, 모카크림, 손수약과, 약과바닐라크림 총 8가지 종류나 있었는데요. 마들렌 이렇게 많은 종류가 있는 디저트가게는 처음 보는 것 같아요! 마떼아 휘낭시아, 머랭 휘낭시에는 무화과초코, 헤이즐넛카라멜 2종류가 있었고 머랭도 있었습니다. 뭘고를지 모르겠을땐 종류별로 다 골라봐야겠죠..?? 동생과 같이가서 마카롱과 마들렌, 휘낭시에를 종류별로 골라보았습니다! 정말 맛있어보이죠? 그리소 사진에는 못찍었지만 옆쪽에 만드는 공간이신 것 같았는데 엄청 넓고 깨끗했습니다. 그 공간에서 이렇게 맛있는 디저트가 나오는 것 같아요! 저도 제과제빵 만드는것에 관심이 많은데..제가 만들면 예쁘게 안만들어져서 포기했습니다.. 맛있는 구움과자 만드시는 분들 존경스럽고 부럽습니다!! 드디어 포장하고 나왔습니다! 집에 가는 시간이 멀게만 느껴졌는데요. 1시간정도 거리라고 하니 얼음과 같이 넣어주셨습니다. 두근두근.. 마카롱과 구움과자를 먹기전! 마카롱과 구움과자를 보관하는 법과 맛있게 먹는 법이 적혀있습니다. 괜히 정독한번 해주고!! 녹지말라고 이렇게! 포장해주셨답니다. 정말 1시간거리인 집에 오는 동안 하나도 녹지 않았습니다. 마떼아 구움과자 및 마카롱 마카롱과 마들렌, 휘낭시에를 전부 접시에 담아보았습니다. 보기만해도 너무 흐뭇하죠. 전.. 디저트가 제일 좋아요. 없어서 못먹죠! 마떼아 구움과자 및 마카롱 조금더 근접샷으로 찍어보았습니다. 마카롱과 구움과자를 종류별로 사보아서 맛이 너무 궁금했는데요. 마떼아 무화과초코 휘낭시에 무화과초코 휘낭시에입니다. 휘낭시에가 다른가게에서 먹어봤을때는 조그맣고 퍽퍽한느낌이 있었는데 마떼아 휘낭시에는 안그렇더라구요! 크기도 크고 너무 맛있었습니다. 마떼아 모카크링 마들렌 마떼아 모카크림 마들렌입니다. 마들렌 통통한거 보이시나요?? 통통하고 큼직해서 한입에 먹으니 더 맛있었습니다. 특히 부드럽고 촉촉한 크림이랑 같이먹으니까 더 맛있었는데요. 마들렌 더 사올껄 그랬어요. 기본마들렌만 먹어봐서 그 맛을 생각했더니 그게 아니더라구요. 아쉬웠습니다. 다음에는 마들렌을 더 사오려구요! 마떼아 라즈베리 피스타치오 마카롱 사실 한때 마카롱에 미쳐서 마카롱을 저도 많이먹고 남자친구도 많이 사줬던 기억이 있는데요. 마떼아 마카롱은 엄청 달지도 않고, 쫀득하니 맛있었습니다! 마떼아 밤세 마카롱 밤세 마카롱은 바닐라빈과 초콜릿가나슈가 들어간 마카롱이었는데요. 바닐라를 좋아해서 그런지 이것두 맛있더라구요. 바닐라에 초코가 들어가니 더더 맛있겠죠! 마떼아 크렘브륄레 마카롱 크렘브륄레마카롱은 동생이 고른 마카롱이였는데요. 겉에 설탕을 입혀서 바삭바삭하고 제가 좋아하는 바닐라크림이 들어가서 맛있었습니다. 디저트 좋아하시는 분들은 마카롱, 구움과자 딱 먹으면 아실 것 같아요!! 너무 달아도 맛이 질리고 맛이 없는데 망원동맛집 마떼아는 적당히 달아서 맛있는 것 같아요! 마떼아사장님께서 6년동안 마카롱을 만들어오고 있다고합니다. 특히 마카롱의 재료인 버터와 초콜릿 바닐라빈 아몬드가루 등을 고급재료로 사용하고 있으니 맛있는 건 당연하겠죠? 망원동에 데이트할떄도 기분전환으로 마카롱 먹어도 좋고, 선물용으로 마카롱이나 구움과자 사가시면 너무 좋을 것 같아요! 오늘의 별점 ★★★★★"
"망원동 기념일 주문제작 케이크 추천 ""마떼아"" 빵케이크 (떡케이크X) 부모님 환갑케이크","안녕하세요 라떼입니다 밀려있는 블로그 포스팅을 부지런히(?) 하기위해 예전에 저장해놨던 포스팅을 이제야 올립니다 ㅠㅠ 5월쯔음 아버지 환갑잔치에 주문했던 커스텀케이크 주문을 했는데 넘 맘에 들었던 곳을 리뷰해보려고 해요. 마떼아 서울특별시 마포구 월드컵로19길 36 2층 https://instagram.com/mattea517?igshid=MzRlODBiNWFlZA== 마떼아, 망원동 커다란 손 작은 가게(@mattea517) • Instagram 사진 및 동영상 팔로워 8,588명, 팔로잉 878명, 게시물 1,963개 - 마떼아, 망원동 커다란 손 작은 가게(@mattea517)님의 Instagram 사진 및 동영상 보기 instagram.com 예약은 인스타그램 디엠으로 했어용 T. 0507-1332-2018 제가 예약한 케이크디자인도 인스타에 올라와있는데요! 그전에 예뻐보이는 케이크 캡쳐해서 이런 스타일로 하고싶다고 보냈었는데 더 예쁘게 해주셔서 감동이었어요.ㅠㅠ 제가 주문해서가 아니라.. 인스타피드에서도 젤 이뻐보인다는..헤헷 아버지 환갑생일 잔치 기념으로 처음 케이크를 주문제작하려고 알아보는 중에 제가 눈여겨봤던 곳중 하나인데요 제가 이곳을 고른 이유는!! 1. 떡케이크 아닌 빵케이크 하는 곳 2. 디자인이 고급스러운 곳 이 두가지를 중요시 생각했거든요 떡케이크 개인적으로 싫어해서ㅠㅠ 크림있는 빵케이크를 원했어요 그리고 너무 쨍한 컬러를 쓰는.. 건강에 좋지않을것같은 알록달록 색소 생크림쓰는 곳은 피하려고 했어요 왜냐면 아버지 환갑..인지라 너무 유치해보일까봐서였지용!! 은근 까다로운? 이 두가지를 충족해서 요기로 골랐답니다 >_< 영업시간은 월~토 12:00~19:00 매주 일요일 휴무 일요일날 휴무이니깐 주문후 픽업하시는 분들은 일요일 휴무인거 잊지마세요! 커피메뉴도 있구 선물박스, 초 등도 매장에서 추가로 구매가능해요 사실 마떼아는 제가 마카롱을 구경하다가 알게된 가게였는데 의도치않게 첫이용을 주문제작 케이크로 하게됐네요 마카롱도 담에 꼭 머거봐야지.. 이날은 거의 닫을때쯔음 픽업을 가는 바람에 먹고싶었던 맛이 품절이었어요.ㅠㅠ 쨘! 가서 예약한 케이크를 받았는데.. 너무이뻐서.. 바로 그자리에서 대충찍었는데도 디테일이 미쳤어요 꽃잎 하나하나 넘 예쁘더라구요 색상도 딱 제가 원하던 고급진색상!! 아 레터링은 요청했더니 저기에 넣어주셧어요 ㅎㅎ 원래 연남동에서 메리마카롱으로 운영하던 곳이 망원동으로 이사하셨다구해요~! 마들렌도 넘 맛나보여서 두개 주문했어요 ㅎㅎ 바닐라크림이랑 레몬이었던것같은데 넘나 맛있엇읍니당.. 대망의 오픈식~! 사진으론 이쁜 비쥬얼이 다 안담겨요 사진 몇십 장 찍었는데 실물이랑 가까이 나온사진이 별로없어요 실물이 훨씬 이뻐서 ㅠㅠ 대망의 잔칫날(?) 식사하면서 케이쿠 간소하게 했는데요 가족들 다 이게 뭐냐며 너무이쁘다고 이런 케이크 처음본다고 반응이 아주 좋았습니다 ㅎㅎ 돈쓴보람 있던 날.. 아부지도 엄청 좋아하셨어요 꽃잎 디테일.. 두번 세번 네번 봐주세용... 꽃잎 안에 수술까지 표현되어있는것 보이시나요 잎파리도 결이 살아있는,, 사장님 너무 전문가에요 ㅠㅠ 꽃잎 생크림들도 마싯어요 시트는 세가지 맛 중에 고를 수 있었는데, 저는 라즈베리로 했어요! 라즈베리 맛도 라즈베리 본연의 향도 느껴지고 인공적인 향이 아니라 정말 맛있었습니다 다른데서 못먹는 맛이었어요... 크림도 부드럽고 핵존맛.. 싹싹 긁어먹었읍니다.. 초는 금색초 쪼꼬미로 여섯개 구매했어요 초 괜히 큰걸로했다가 케이크 이쁜거 묻힐까봐 금색초로 했는데 잘어울리더라구요 ㅎㅎ 담에 다른 친척분들도 자기생일날에 이케이크 또 해달라고 주문이 빗발쳤다는,,, 다음 특별한날에도 또 주문할 의향 있는 예쁜 케이크집이었어요 #망원동디저트 #서울주문케이크 #환갑케이크주문제작 #케이크주문제작추천 #레터링케이크 #마떼아케이크 #내돈내산 #망원동케이크"
망원동으로 이전 오픈한 마카롱가게 마떼아 방문! (구 연남동 메리),"마떼아 서울시 마포구 월드컵로19길 36 2층 화 - 토 12:00 - 19:00 일 - 월 휴무 마떼아 서울특별시 마포구 월드컵로19길 36 2층 연남동에 자주 간 건 아니지만 갈 때면 마카롱 사먹을 가게가 있다는 든든함을 느끼게 해 주었던 메리마카롱. 3월엔가 오랜만에 방문했더니 건물 리모델링을 하면서 없어져버린 것이었다...?! 아니 사장님 어디로 가셨나요 하면서 뒤늦게 인스타를 찾아보았지만 이미 늦음 ㅠㅠ 연남동 메리마카롱으로는 딱히 다른 정보를 찾을 수 없었다.. 이렇게 장사를 접을 분이 아닌데?? <라고 막연하게 생각하며 인스타 파도타기를 시작 (두둥) 우여곡절 끝에 새로운 상호명으로! 새로운 장소에서! (다름아닌 망원동에서~~~!!) 새로 가게를 오픈하셨다는 소식을 접하게 되었다.. 역시 인터넷은 찾으면 안 나오는 게 없어(?!) 암턴 새 가게의 이름은 마떼아. 망원역에서 도보 5분 정도 거리에 있는 채광이 좋은 2층에 자리한 곳이었다. 보니까 마감시간도 7시길래 호다닥 다녀옴 (5월말엔가 6월초엔가 갔었던거 같음ㅋㅋㅋㅋㅋㅋ) 이날 맴이 급해서 핸드폰도 놓고 가가지고 (지갑만 들고 런함) 정작 가게 사진은 없다..ㅎ 내가 고른 맛은 (아마도) 애플바닐라, 유자생강, 라즈베리피스타치오. 각잡고 리뷰해야지 하고 먹은 게 아니어서 사진은 유자생강만 있다 헤헤... 기포없이 단정한 표면. 살짝의 반짝임이 마카로나쥬가 잘 되었음을 알려주는.. 어쩌구.. 아마도 유자조각으로 보이는 것들이 크림 사이에 콕콕 박혀 있다. 뚱카롱은 싫은데 마떼아 마카롱은 꼬끄와 크림의 비율이 적당해서 좋음! 크림이 아주 적게 들지도 않았으며 꼬꼬는 쫀득하고 크림이 부드러워서 조화가 좋다 아마도 가운데가 생강맛이 나는 크림인 것 같..다.. 유자가 새콤하면서 간혹 나는 생강향 같은 것이 너무 달아지는 입맛을 싹 잡아주었다. 라즈베리 피스타치오도 고소하면서 상콤한 맛이 좋았구 애플바닐라는 뭐... 말하면 입만 아푸지~! 히히 마떼아 망원으로 이사와서 넘 좋아 자주 찾아갈게요~~(feat 동물농장 마무리 톤)"
"[ 망원동구움과자 :: 마떼아 ] 구움과자, 마카롱 찐찐맛집, 포장하기도 좋다구요♡","오랜만에 망원동 나들이~~ 망원시장도 구경하고 밥도 먹고 거기다가 진짜 맛도리 구움과자랑 마카롱이 유명한 망원동카페가 있다고 해서 호다닥 방문했다 :) 망원동구움과자 마떼아 마떼아 서울특별시 마포구 월드컵로19길 36 2층 마떼아 서울 마포구 월드컵로19길 36 2층 매주 일요일 휴무, 월-토 12:00-19:00 0507-1332-2018 <인스타그램> https://www.instagram.com/mattea517/ 마떼아, 망원동 커다란 손 작은 가게(@mattea517) • Instagram 사진 및 동영상 팔로워 8,718명, 팔로잉 869명, 게시물 1,896개 - 마떼아, 망원동 커다란 손 작은 가게(@mattea517)님의 Instagram 사진 및 동영상 보기 www.instagram.com 오시는길 망원역 1번출구에서 나오셔서 골목길이다보니 네이버지도를 잘 확인하고 오셔야함미다! 마떼아 간판이 넘 귀여운데, 발견 못할 수 있는 분들을 위한 사장님의 표시들이 곳곳에 느껴졌다 ㅎㅎㅎㅎ 세심한 사장님,,:) 망원동구움과자로 유명한 곳인것만 알고 있었는데, 요렇게 주문 케이크도 받고 계셨다! 내부 내부는 엄-청 넓지는 않지만 우드톤 테이블 의자에, 햇살도 들어오는 쪽이라서 와서 구움과자도 먹고~ 커피도 마시면서 노트북이나 폰하기에 딱 좋을 것 같다 :) 머랭 머랭도 색도 너무 이쁘고, 거기다가 용기까지 넘 이뻤다! 선물하기에 가격도 부담스럽지 않아서 추처어언- 구움과자 약과 스모어라뇨,, 진짜 약과와 관련된 다양한 구움과자들을 봤지만 약과스모어는 처음이었다! :) 저거는 무조건이다 해서 2개나 쟁임. 마들렌, 휘낭시에, 약과쿠키까지! 거기다가 모카크림, 마롱, 바닐라 가나슈처럼 흔한 구움과자 가게에서는 보기 어려운 맛들이 많았따!! 쇼케이스 안에 진짜 이쁘게 하나하나 진열되어있고, 사장님의 정성스러운 손글씨와 설명이 느껴지는데 진짐 보는 것만으로도 즐거웠음,,,♡ 마카롱 정-말 다 사고 싶지만 ㅋㅋㅋㅋㅋㅋㅋㅋㅋㅋ 못사는 슬픈,, 마카롱도 종류가 정-말 많았다! 거기다가 맛들도 오페라, 웨딩임페리얼, 유자생강, 애플바닐라처럼 흔히 보기 어려운 맛들이 정-말 다양했다! 맛들도 고급진?느낌이라서 서눔ㄹ하기에도 정말 좋을것같다 :) 메뉴판 #마떼아메뉴판 음료도 비싸지않고 좋다! 거기다가 핫이나 아이스 가격도 동일 :) 구움과자랑 마카롱이 주를 이루다보니 포장하시는 분들도 많을텐데 6개-15개까지나 자유롭게 구성이 가능! 진짜 좋다구요,,, 선물하는 일이 다양하잖아요,,, 뒤에 쭈욱 보이는 마떼아 상자들! 여러개를 담을 수 있다보니 상자의 크기도 다양했다 :) 3만원 가량을 구매했는데 요 큰 쇼핑백에 한가득 들어갔다구요,,♡ 진짜 안에 구움과자 한가득 ㅋㅋㅋㅋㅋㅋㅋ 마카롱이랑 구움과자의 보관방식과 먹는날이 다르다보니 요거 참고하시는 것도 좋을 것 같다 !!! 마들렌이 맛이 너무 다양해서 하나씩 구매,,! 마들렌이 진-짜 다른곳과 달랐던건, 마들렌이 통통이라는거! 거기다가 안에 필링이 제대로 차있어서 각 맛을 느끼기에 좋다는거!! 거기다가 정-말 맛있었던 약과 휘낭시에와 약과 스모어!!!! 약과스모어는 정말 어느 카페, 구움과자집에서도 본적이 없었는데 진-짜 맛있었다 ㅠㅠㅠㅠ 쭈욱 늘어나는 스모어랑 늘어진약과가 입에서 촉촉하게 느껴졌고, 거기다가 쿠키같은?느낌도 있어서 정-말 맛있었다 ㅠㅠㅠㅠ 맛도 있고, 하나하나 수제의 느낌이 느껴지고! 거기다가 다양한 맛, 새로운 맛까지 도전해볼 수 있었던 마뗴아였다 히히히히 선물하기 위한 망원동구움과자집을 찾으시는 분들! 새로운 구움과자, 마카롱을 찾으시는 분들에게 강추!"
