title,content
"서울 망원동 카페, 비전스트롤 (Vision stroll)","서울 여행 갔을 때 정말로 만족했던 망원동 카페, '비전스트롤 (Vision stroll)' 원래 겨울에 방문하려고 했는데 동선이 안 맞아서 이번 여름에 방문했다. 다행히 앞에 포스팅했던 육장이랑 가까워서 육장을 먹고 바로 이동했다. 비전스트롤 서울특별시 마포구 망원로 61 1층 📍비전스트롤 매일 09:00 - 21:00/ LastOder 20:30 (매주 화, 수 휴무) 포장, 반려동물 동반 0507-1375-1002 눈앞에서 창가 자리를 놓쳐버렸지만 그래도 자리가 있는 것에 만족... 점심 먹고 바로 방문해서 너무 헤비한 느낌도 있었는데 나중에 웨이팅 하는 거 보고 내 결정에 머리 쓰담쓰담했다. 우리는 아메리카노 아이스 2잔이랑 버터푸딩을 주문했다. 디저트 가격이 세기도 했지만 사람들 테이블 위에 버터푸딩 하나씩은 무조건 있어서 바로 같이 주문! 비전스트롤만의 원두도 있었다. 동영상을 한 번 찍어서 전체적인 분위기를 보여주고 싶었는데 사람이 너무 많았다. 뭔가 직원분들도 힙하시고 분위기 자체가 죽여준다 ㅎㅎ 뭐라고 설명해야 하지?... 미국에서 여유를 즐기는 느낌이랄까~? 흘러나오는 노래들도 최고고 사람들은 많지만 소란스럽지 않은 분위기? 아메리카노부터 먼저 나왔는데 잔이 너무 이뻤다. 아메리카노는 산미가 있는 편! 나는 산미랑 탄 맛 둘 다 선호하진 않지만 상대적으로 산미를 선호하는 사람인데, 나름 맛있게 먹었다. 내가 샷을 하나만 해서 그럴 수도? 너무 진하다 생각 들면 얼음을 천천히 녹여먹어도 될 것 같다. 와 비주얼 보고 깜짝 놀란 버터푸딩 얼핏 보기엔 크루아상에 아이스크림 넣은 느낌이다. 그게 맞긴 한데 맛은 전혀 다른 느낌? 아 뭐지 뭐가 버터고 뭐가 푸딩이지? 너무너무 맛있었다. 거짓말 전혀 안 보태고 우리의 인생 디저트로 등극했다. 초코가 뿌려져있는 크루아상과 바닐라 아이스크림 그 밑에는 촉촉하게 젖어있는 빵인데 아 뭐랄까 직접 먹어보셨으면 좋겠읍니다... 달달하고 바삭하고 맛있고... 서울 가면 버터푸딩 먹으러 또 갈 것 같다... 다른 사람들은 블루베리 갈레트도 같이 시켜서 먹던데 버터푸딩을 먹어보고 나도 먹고 싶어졌다. 배가 불러서 못 먹었지만 다음에 망원을 또 방문하면 먹어보고 싶다. 서울 망원동 카페 '비전스트롤' 강추합니다."
"평일 웨이팅 필수 망원동 ""비전스트롤""","놀라지 마세요 카페 맞습니다 ◡̎ 입구부터 갱장히 H I P 함이 느껴지는 망원동 #비전스트롤 (visionstroll) 등록된 풀 네임은 비전스트롤 베이크샵 놀랍게도 평일 낮 그것도 월요일 낮이였지만, 우린 웨이팅을 했다... 더욱 . . 기대되는 이런 유명함 ,, 한,, 20분정도? 기다렸더니 2층으로 안내를 해주셨다 ! 워후 나 이런 느낌 너무 좋아해 안에서 간단한 베이킹도 하시는 것 같았고 주방 건너편에는 사용하시는지는 모르겠지만, 통유리로 된 베이킹룸도 있었다! 네,, 역시 이 초짜는 메뉴판사진따위는 없슴다. 다음엔 꼭 각성하고 카메라를 켜보도록.... 콜드브루와 카페라떼 네, 음료값은 테이블과 스탠딩으로 나뉘어져 있었고 가격대는 넘치는 감성과 힙에 비해 싼 편 ㅋㅋㅋㅋㅋ(제 맘대루) 왜,, 왜 자꾸 영상찍는데 말해 ... 본인거 찍을때 조용해 지는 싸람 ^__________^ 그래도 42좋게 ~ 너무 유명해서 이거 먹으러 오는 사람이 대다수라는 비전스트롤의 #버터푸딩 네에- 그걸 시켰습니다! 도대체 왜 푸딩인지 왜 버터인지 단 하나도 모르겠지만 이 메뉴 만드신분 맛잘알 분명하다. 초코와 바닐라 아스크림의 조화라뇨 거기에 저 크롸상,, 초코를 바르다 못해 흠뻑 뒤집어 썼다. 나름 라떼를 시켰는데,, 아예 차 종류를 시킬걸 그랬어.. (커알못이라 검정커피는 안머금ㅋ) 아스크림 녹는거에 맘아파서 얘기도 중단하고 와구와구 먹었다. 멋진건 가까이에서 한 번 더 ..! '사장님.. 혹시 담부턴 버터푸딩에 포크말고 스푼주시면 안될까요 .. ?' 그래야 푸딩이죠 ^___^ ! 그 만큼 스푼으로 떠먹고 싶었고, 그게 더더 한 - 입 가득 먹을 수 있어서 더더더 맛있을 것 같았다! 보이는 이쁨이 먹을때 좀 마니 무너져서 마음이 아팠지만, 당 충전 만큼은 제대로 되는 #시그니처메뉴 인듯! 커알못이라 커피맛은 잘 모르겠지만, 그래도 무난한 편인듯하다. 2층은 테이블이 5개 정도 있었던 것 같고 (+- 1개는 기억력탓) 1층보다 온전히 카페분위기를 즐길 수 있었을 거라고 생각한다. 1층은 분위기가 조금 다르고 더 좋을 수 있지만 입구사진에서 보다시피 옆면이 통유리라 웨이팅하는 사람이 많을땐 조금,, 부담스러울 듯 ㅜ 비전스트롤만의 분위기가 충분히 느껴지는 카페 인테리어와 직원분들 그리고 메뉴들까지 삼박자가 너무 잘 어우러져서 간만에 맘에 쏙 든 카페 ! 그럼 모두들 𝐇𝐀𝐏𝐏𝐘 𝐍𝐄𝐖 𝐘𝐄𝐀𝐑 🤍 비전스트롤 베이크샵 서울특별시 마포구 망원로 61 (망원동)"
서울 마포구 망원동 카페 비전스트롤(visionstroll),"비전스트롤 서울특별시 마포구 망원로 61 1층 카페 이름이 적힌 눈에 확 띄는 간판은 없지만 노랗게 물든 은행나무와 우드톤의 외관이 시그니처가 되어버린 망원동 카페 비전스트롤에 다녀왔어요 오픈 직후부터 최근까지도 웨이팅이 어마어마해서 항상 망원동 가면 그냥 지나쳐가기 바빴는데 평일에 다녀오니 여유로운 편이라 좋았어요 요즘 핫한 신상 카페들 다니다 보면 거의 비슷비슷한 인테리어라 특별히 기억에 남는 곳이 별로 없었는데 망원동 카페 비전스트롤은 분위기와 인테리어가 독특했어요 미국 서부 분위기가 물씬 느껴지는 소품들이 가득해서 문득 카우보이가 생각나더라고요 1층 내부는 좌석 간격이 좀 좁아보일 정도로 테이블이나 의자는 많은 편이었지만 우드톤으로 통일되어 있어서 정신없거나 복잡해 보이진 않더라구요 저녁에는 위스키와 진토닉도 판매하는 곳이라 그런지 다양한 메뉴들로 메뉴판이 꽉 차있었고, 커피 메뉴의 경우 특이하게 테이블 가격과 스탠딩 가격으로 나누어져 있는데 대부분 테이블에 앉아서 드시더라고요 평소처럼 라떼를 주문하려다가 먼저 다녀온 아는 언니가 여기 콜드브루만 몇 병씩 구매해서 먹는다는 게 생각나서 오늘은 라떼 대신 콜드브루를 주문했어요 카페 비전스트롤하면 버터 푸딩과 블루베리 갈레트가 시그니처 디저트인데 사진만 봐도 입안에 달달함이 가득해지는 비주얼이라 저는 헤이즐넛 퍼프를 주문했어요 사실 2층 공간이 조금 더 여유롭다고 해서 주문 후 2층에 자리를 잡으려고 했는데 1층과 2층 메뉴 쉐어가 안돼서 1층에서 주문을 하면 1층 공간만 이용할 수 있고, 2층 공간을 이용하려면 2층에서 주문해야 되더라구요 주문 전에 미리 말씀해 주시면 좋았을 텐데 아쉽지만 2층은 다음을 기약하고 창가 좌석에 자리를 잡았어요 방문 전 직원분이 너무 불친절하다는 얘기가 좀 있어서 갈까 말까 망설였는데 생각보다 친절하시고 직원분들의 워크웨어도 데님으로 통일된 부분이 참 멋지더라구요 출입문 바로 옆에서는 비전스트롤의 다양한 굿즈들을 판매하고 있었는데요 직접 로스팅 하신 원두와 드립 백, 캡슐커피는 물론이고 티셔츠와 볼캡, 키링, 유리컵까지 비전스트롤이 추구하는 분위기가 그대로 담긴 굿즈들이었어요 그중 리사이클 유리를 사용해 수작업으로 제작된 글라스 컵은 안 사 온 게 아쉬울 정도로 예쁘더라고요 내열 유리컵이 아니라 시원한 물만 담을 수 있다고 해서 그냥 왔는데 사진으로 다시 보니 사 올걸 그랬나 봐요 내적 댄스 유발하는 신나는 로큰롤 음악부터 재즈 음악까지 음악 선곡마저도 비전스틀로과 닮아있더라고요 화장실은 2층 공간으로 올라가는 상가 1층에 위치하고 있어서 얼른 손 씻으러 다녀왔는데 그 잠깐 사이에 주문한 콜드브루와 헤이즐넛 퍼프가 나와있더라구요 창가 자리라 밖에서 슬쩍 찍어봤어요 콜드브루는 맥주병을 연상시키는 디자인의 보틀로 제공되는데 개봉 시 오프너가 필요해서인지 가져다주시기 전 오픈 후 얼음이 가득 담긴 유리컵과 함께 제공되고 있고 원래 달달한 디저트를 안 좋아하는데도 헤이즐넛 퍼프는 보기만 해도 얼른 맛보고 싶어지는 비주얼이었어요 홀스 파워라는 이름을 가진 비전스트롤 콜드브루는 한 입 마시면 진짜 말의 힘이 느껴질 정도로 제가 느끼기엔 엄청 진한 편이었어요 콜드브루 자체도 진하고 산미도 굉장히 강한 편이라 처음 마셨을 땐 조금 당황스러웠는데 얼음이 조금 녹고 디저트와 함께 마시니 괜찮았어요 판매 중인 사이트에 설명을 보니 제조 후 1-2일 지난 콜드브루는 4-5일 정도 냉장고에서 숙성시키면 가볍던 부분들은 무거워지고 신맛은 차분해지면서 잘 숙성된 위스키의 맛을 느낄 수 있다고 적혀있었어요 평소에 콜드브루를 좋아하시고 산미 있는 커피를 즐겨 마시는 분들은 더 맛있다고 느끼실 거 같아요 콜드브루보다 눈에 더 들어왔던 가죽 티코스터에요 진짜 인테리어부터 작은 소품 하나하나 애정을 가지고 채우셨다는 게 그대로 느껴졌던 부분이었어요 예쁘게 먹기엔 조금 힘들었던 헤이즐넛 퍼프는 겉을 둘러싸고 있는 슈 바깥 부분이 바삭하지는 않았지만 헤이즐넛 견과가 오독오독 씹히면서 안에 있는 헤이즐넛 크림이 고소하니 진짜 맛있더라구요 평소에 디저트를 좋아하는 편도 아니고 크기에 비해 가격이 좀 비싸다고 생각했는데 먹고 나니 커스터드 퍼프와 잔두야 퍼프도 맛보고 싶어질 정도로 만족스러운 디저트였어요 꿈속을 거닐다라는 의미의 단어 비전스트롤 트렌드에 맞춰 변화하는 곳이 아닌 5년, 10년 후에도 늘 같은 자리에서 망원동의 로컬 카페로서 오랫동안 자리하고 싶다는 다짐이 인상 깊은 공간이었어요 늦은 저녁의 비전스트롤도 궁금해지는 카페 비전스트롤 망원동 가시면 꼭 한 번 들러보시는 걸 추천드려요 비전스트롤(visionstroll) 서울 마포구 망원동 422-32 평일 및 주말 09:00-21:00(last order 20:30) 매주 화요일 및 수요일 휴무 visionstroll(@visionstroll_coffeemaker) • Instagram 사진 및 동영상 팔로워 7,946명, 팔로잉 776명, 게시물 371개 - visionstroll(@visionstroll_coffeemaker)님의 Instagram 사진 및 동영상 보기 www.instagram.com"
망원동 디저트 카페 비전스트롤 웨이팅을 한시간이나했지,"이래저래 동네방네 잘도 돌아다니는것같지만 사실은 i성향이 강한 구이삼입니다. 그래서 어디가 힙하다거나 유명하다거나 그런건 사실 잘모르고 친구들이 여기 좋다쥬타하는 그런곳에 쫄래쫄래 잘도 쫓아다니는 나란남자. 이날은 망원동에 한강공원 가려고 만났다가 밥도먹고 카페도 한번 들러야지 싶어서 어디갈까 고민하다가 무작정 끌려간곳. 밥먹고서 디저트 먹기 좋은곳이라하여 은근히 기대가 되었기도 하죠 오후3시부터의 기다림 딱히 사전정보는 없이 친구만 믿고 찾아갔었는데 진즉에 대기가 있을거라고 언질은 해주었어요. 뭐 그래봐야 일요일에 얼마나 사람들이 많이 가겠어~ 그리고 뭐 무슨 푸딩인지 뭐시긴지 그게 맛있다면서 꼭 가보자고하여 여차저차 앞까지 오게되었네요. 비전스트롤 앞에 딱히 줄도 없고 앞에 서성이는사람 한 2~3명 있는걸로보아 웨이팅 얼마 없다. 조금만 기다리자 대기 명단은 이렇게 아날로그틱합니다. 제가 사진을 찍을때 딱 햇빛이 이쁘게도 드리웠네요 하지만 앞에 4팀이나 있었어요 이정도면 뭐 금방 자리가 날줄 알았.. 나 이날 감기걸린것같아 아무리 힙한 망원동 디저트 카페에 왔어도 그렇지 한시간이나 기다리는건 너무했다 싶긴했어요. 한 10분정도 기다렸을때까지도 단 한팀도 나오질 않아서 이때는 스리슬쩍 포기하고 다른데 아무데나 갈까 싶었어요 안그래도 이런 기약없는 기다림 너무나 안좋아하는터라 잠깐 고민했지만 갑자기 생겨난 오기. 그렇게 망원동 디저트카페의 기다림은 시작이 되었고요 여긴 웨이팅하는데에 저런 의자하나만 두었고 그외에는 없습니다. 규칙일랑 저 번호쓰는 메모지밖에 없고요. 그래서인지 두서없이 사람들이 얼쩡대는 꼴을 보실 수 있을텐데요 안그래도 인도도 좁고 협소하여 약간은 어수선한 분위기가 연출이 된답니다. 그리고 제 뒤로도 계속 사람들이 왔었는데 이게 더 오기가 생기더라구요 그렇게 비전스트롤에 들어갈적엔 BAR자리가 나서 그냥 앉았어요 사실 그런 부담스러운 자리는 딱히 선호하는 편이 아니지만서도 더이상 추위에 떨 수 없겠더라구요.. 내부 인테리어는 굉장히.. 힙하달까요? 그냥 이렇게 말해서 그렇지 뭔가 예쁘거나 아기자기함보다 빈티지 펍같은 느낌이라 디저트를 먹는 카페 보다는 맥주를 먹을것같은 망원동 비전스트롤입니다. 뭔가 정리된 느낌보다는 약간 키치한 분위기입니다 그리고 일하시는분들이 규모에비해 많다고 느껴지는데 모두들 상당히.. 인싸같은느낌 절대적 MBTI E고수하실것같은 그런너낌 뭔가 나랑은 정반대의 사람들이 일하고 있구나.. (조금 쫄았음) 망원동 디저트 카페 메뉴판 차림표를 한번 바라봅니다. 나는 추우니까 일단은 따스한 아메리카노. 친구는 아아 그리고 추위에 덜덜 떨었으니 먹고픈거 다처묵을것이당. 버터푸딩 8,500원 블루베리 갈레트 9,000원 솔직히 빵종류를 좋아하는편이 아니라서 하나만 시켰어도 될법한데 이렇게 기다린거 뭐 다먹어보고싶었습니다. 그리고 제가 바 자리에 앉았다고 했잖아요? 여긴 전부 오픈키친이라서 요리를하시던간에 커피를 내리던 모든게 다 눈앞에 펼쳐집니다. 뭔가 가득차보이는 주방에도 질서는 있는듯하고 뭔가 비전스트롤 직원들의 합이 잘맞아보이였어요 버터푸딩이라는건 한 20분걸린다고 미리 언질을 해주셨고요. (아마 만석이라 앞주문이 많은듯) 조리하는 과정이 이렇게 제 자리에서 훤히 보이더라구요 신기하기도하고 뭔가 멋있기도해서 열심히 찍어보았는데 뭔가.. 부담스러웠으려나 그랬다면 죄송🙄 아무튼 뭔가 초코렛향이 엄청씨리 찐하게 나서 보니까 저렇게 오븐에서 갓나온 정체불명의 빵이 있더라구요 크로와상이었는데 나중에 알고보니까 저것의 이름이 버터푸딩이라고합니다. 뭔가 우리 한국에서 흔히 아는 이름의 Puding과는 다른것인가 내가 아는 사전적의미와 여기서의 네이밍은 좀 다르게 쓰이는것인가 저는 약간 그 짱구에서나오는것같은 도토리묵같이생긴 탱글한 그런것을 기대하였었는데.. 아무튼 아래에 그 비쥬얼 있으니 잠시후 다시 설명해두림요 가장빠르게 나온것은 아무래도 샷만 내리면되는 커피들이었어요 뜨아 아아 둘이 사이좋게 등장했습니다. 여기는 뭔가 각자의 파트가 다 있던데 딱 한분만 샷을 추출하시더라구요 뭔가 전문 바리스타같은 여성분이셨는데 포스가 장난 아니셨음.. 하필이면 제가 앉은자리에서 coffee내리는게 정말 적나라하게 다보였습니다 ㅎㅎ 뭐 이렇게 좁은 망원동 디저트 카페 내부에서만 볼 수 있는 고런 매력적인 광경이 아닐까합니다. 그리고 진짜 맛있어요! 뭔가 머신도 특이해서인지 아니면 원두가 좋은것인지 그리고 비교적 빨리나온 블루베리갈레트입니다. 여기 메뉴들은 살짝 알수없는? 이름들을 갖고있는듯한데 뭔가 어디 다른나라에서 그렇게 부르는것이겠거니 생각하게됩니다. 비쥬얼은 아주그냥 생크림 가득 올려져있었는데 저것도 대충만든 크림이 아닌것으로 느껴집니다 무심한듯 시크하게 덤퍽 올라가있거든요 일단 커피하고의 궁합이 굉장히 좋은편입니다. 은은한 아메리카노와 달달구리 디져트의 환상적인 합! 여기서 느껴지는 고오급진 그런 맛이었습니다. 망원동에 참 여러번 왔는데 이런 괜츈한 카페가 있었다니 나름 색다른 경험이랄까요 먹는 과정도 나름 재미나긴했었어요 따로 포크는 주지 않고 나이프만 등장했는데 그냥 cream잘 펴바르고 그다음에 잘 잘라서 손으로 집어먹으라고 하더라구요 근데 포크좀 주세요 진짜 불편해요 한손으로 바르는것까지는 그렇다쳐도 자를때 잡을게 없으니까 너무나 괴로워요 손에 묻는것도 싫어영 엉엉... (달라고하면 주실것같긴함!) 그렇게 정말 열심히 잘라서 들어봤답니다. 그렇지 않아도 따로 물티슈도 주셨음 바삭한 빵과 그위에 발린 블루베리쨈 그리고 너무나 부드러운 생크림의 삼박자가 너무나 잘 어우러집니다. 이거 여기서 개발한거면 기립박수 칠 수 있을정도 하지만 많이먹으면 살짝 물려요 뭐랄까 느끼하달까요 그래도 쨈의 상큼함이 있어서 그나마 중화되는 너낌쓰~ 나름깔끔하게 먹어도 이렇고롬 더러워집니다. 그리고 페스츄리같은 질감의 빵은 도무지 흘리지않고는 먹을 수가 없답니다 장단점은 있지만 뭐 저는 옷을 훌훌 털어버리면 그만이지만 바닥 청소하기가 좀 힘들진 않을까하네요 그리고 잠시 후 등장해벌인 스페샬 MENU😃 초코의 탄맛을 좋아하시는 분이라면 비전스트롤 시그니처 메뉴 버터푸딩 이거 찐으로 달아요 그냥 단거위에 달달한거 올리고 단것으로 마무리한 그런느낌입니다. 망원동 디저트 카페 나름 시그니쳐음식인듯 한데 확실히 그 비주얼만큼은 압도적입니다. 그리고 처음 들어왔을때의 그 강한 초콜렛의 스위트한 향기가 엄청 강했어요 과정은 이러한것으로 보입니다 크로와상생지에 초코소스를 엄청 발라주고 오븐에 한번 구워줍니다. 보통 이럴때 냉동생지가 익는시간이라면 175도 이상으로 18분정도 굽게되는데 그러면서 쪼꼬가 약간 타게될것으로 예상합니다. 확실히 먹는내내 살짝 번된 그 특유의맛이 존재했는데 이게뭘까 뭘까 하다가 느껴진 맛이랄까요 그리고 아이스크림을 올려주는데 이런 레시피가 정말 순식간에 이루어지는 느낌인게 우리 앞에 놓여지면서도 김이 모락모락나는데 아직은 녹지않고 차가움을 유지하는 세덩이의 바닐라아이스크림을 볼 수 있습니다. 신기한 과정이지만서도 뭔가 독특함면에서는 별다섯개 주고싶었어요. BUT이것도 단점은 존재합니다. 뜨겁다가 급속적으로 차가운 개체를 만나게되서 그런지 엄청 질겼어요. 이때는 다행히도 손으로 먹으라고 안하고 포크를 주시긴했습니다만 먹으면 먹을수록 더러워지는 나의 접시를 볼 수 있답니다. 이게 음식이 뒤섞이는 그러한 이미지가 아니고 좀.. 보기안좋게 어그러지는 현상.. 그리고 당연하지만 먹으면서 녹는것도 자연스럽게 볼 수 있으니 천천히 먹으신다면 요로코롬 그냥 바닐라국물을 보시게 될겝니다ㅋㅋ 저한테는 살짝 불호였던게 특유의 탄맛이 좋진 않았어요 그래도 당충전은 정말 1000퍼센트 하실 수 있고요 둘중에 뽑으라면 전 위에 소개한 블루베리쨈이 들어간 디졀트가 훨씬 더 맛있었어요! 그래도 나름 저녁먹기전에 잘 다녀온것같고요 cafe 안에서 지켜보니 여기 단골들도 참 많아보이더라구요 테이크아웃 손님도 더러 보였습니다. 그리고 비전스트롤 웨이팅 하면서 보니까 지나가는사람들하고도 인사도 하시면서 아지트같은 느낌으로 운영되는것같기도하고요 그러면서 입소문이 너무나 잘나서 이토록 핫플레이스가 되어버렸구나😎 내돈내산으로 다녀온 망원동 디저트 카페 가보시면 바로 알게되는 존멋탱구리 바이브 저는 재방문의사 있고요 또간다면 그냥.. 평일에 갈래요 흐엉. 그럼이만, 구이삼올림"
"[망원 비전스트롤] 비전스트롤 버터푸딩, 망원동 카페 비전스트롤 솔직 담백 후기 (솔담후)","망원동에는 간판이 없는데 줄을 서있는 카페, 맛집이 정말 많죠(?) 오늘은 망원동 비전스트롤을 다녀왔습니다. 어두운 밤 이곳은 오픈시간 부터 정말 많은 사람들이 줄을 서는 비전스트롤입니다. 이곳의 최고최고 강추 메뉴는 버터푸딩!!!!!!!!!! 비전스트롤 버터푸딩입니다. 내부 인테리어는 굉장히 이국적이에요 이곳은 한국이 아닙니다. 라는 느낌의 비전스트롤 비전스트롤은 2인 방문시 2개의 음료를 필수로 주문해야합니다. 백종원 선생님이 그렇게 하면 안된다고 했는데!!!!!! 줄을 많이 서요... 그리고 이곳은 인당 1개의 음료를 시키면 추가로 하이드커피를 주문할 수 있데요 그 커피가 맛이 대박이라는데... 담에 꼭 먹어볼게요 아 드디어 등장했습니다. 비전스트롤 버터푸딩 아니 이름이 왜 버터푸딩이지???? 라는 생각이 들지만 음 맛이 진짜......... 꾸덕꾸덕 + 달달함 + 시원한 아이스크림 아웃백에서 판매하는 그 브라우니??? 약간 그런 느낌이에요!! 망원동 비전스트롤 정말 분위기도 좋고 맛도 좋고 대박입니다... 달달한걸 좋아하시는 분들께 정말로 강추하는 메뉴입니다. 다만, 단걸 싫어하시면.. 이곳은 출입하지 마세용!! 비전스트롤 서울특별시 마포구 망원로 61 1층 [비전스트롤] 맛은요 ? ★★★★☆ 가격은요 ? ★★★☆☆ 위치는요 ? ★★★☆☆ 분위기는요 ? ★★★★★ 주차는요? ☆☆☆☆☆ (길가 공영주차장 이용)"
