title,content
"[망원동 디저트] 찾았다, 서울 마카롱 맛집 쫀득한 꼬끄 '마떼아' 솔직 후기","망원동 맛집 추천 마떼아 영업시간 : 월~토 12:00 ~ 21:00 매주 일요일 정기 휴무 주소 : 서울 마포구 월드컵로19길 36 2층 ☎️0507-1332-2018 🚘주차 불가 안녕하세요🙆‍♀️ 오늘 너무너무 더운 날이네요🔥 회사에서 너무 더워서 하루종일 지치는게 퇴근하고 달달한 디저트를 먹어야겠더라구요 +_+ 그래서 오늘 퇴근하고 망원동 마카롱 맛집을 찾아서 달려갔다 왔습니다 ! 요즘 맨날 여기저기 다니고 있어서 포스팅이 많이 밀렸지만 완전 쫀득한 꼬끄가 맛있는 마떼아를 빨리 공유해드리고 싶어서 급하게 노트북을 켰어요 6호선 망원역 2번 출구에서 도보 약 4분정도 거리에요 핫한 망원동답게 근처에도 소품샵이나 빈티지샵이 많아서 볼거리고 많더라구요 저는 지도 보고 찾아가다가 지나쳤는데 마떼아는 2층에 위치해있으니 저처럼 1층만 보지 말기 !!! 키토빵앗간 이라는 곳 위층이에요 건물 오른편 문으로 들어가면 돼요 문에 마카롱 사진이 붙어있어요 :D 힙한 콘크리트 계단 약간 망원동 힙한 인스타 느낌 카페st 원래 기존에는 연남동에서 '메리'라는 상호로 꾸준히 다년간 마카롱 전문점을 운영하시다가 최근에 망원동으로 주소를 이전하면서 '마떼아'라는 상호로 변경되었어요 ! 검색하보니까 연남동 시절 메리도 유명한 마카롱 집이었더라구요 넓지는 않지만 앉아서 먹을 테이블도 있고 아주아주 깔끔한 인테리어가 편안한 분위기를 만들어주었어요 ! 화이트&우드 인테리어가 너무 편안하고 예뻤어요 XD 큰 쇼케이스 안에 마카롱뿐만 아니라 다양한 디저트가 있었어요 마카롱 우선 마떼아에서 가장 메인 디저트이자 제가 방문한 목적인 마카롱 ! 12개 종류가 있었어요 밤세 천도 Peach 크렘브륄레 웨딩임페리얼 애플바닐라 오페라 소금카라멜 소금바닐라 라즈베리 피스타치오 아망드무화과 레몬얼그레이 제주말차 그 외 구움과자 바닐라 가나슈 얼그레이 가나슈 모카크림 얼그레이 머랭 라즈베리 초코 마롱 레몬유자 피스타치오크림 클래식 마들렌 바질치즈 마들렌 헤이즐넛 카라멜 마들렌 무화과 초코 마들렌 모두 너무너무 맛있어보이지만 이 헤이즐넛 카라멜과 바질치즈 마들렌이 비주얼도 독특하고 해서 더더 먹어보고싶더라구요 하지만 저는 마카롱을 이미 많이 주문해서 마들렌은 꾹 참았어요.🤤 게다가 프레펠 머랭까지 ! 일반 머랭은 흔하지만 이렇게 프레첼이 콕콕 박혀있어요 미리 주문했던대로 꼼꼼하게 포장해주신 사장님 제가 퇴근이 갑자기 살짝 늦어지면서 예약했던 시간보다 살짝 늦게 도착했는데 사장님이 웃으면서 정말 괜찮다고 해주셔서 너무너무 죄송하고 감사하더라구요ㅠㅠ 너무 친절하신 사장님...😇 집이 30분 넘게 걸려서 저는 보냉 포장을 해왔어요 마떼아는 첨가물이나 안정제 없이 자연에 가까운 최상급 재료로 만든다고 해요 보관 방법도 상세하게 적혀있었는데 냉장보관은 3일, 냉동보관은 3주까지 가능하다고 해요 냉동이 무려 3주나 보관이 되니까 여러개 쟁여놓고 하나씩 꺼내 먹기에 너무 좋은 간시 ! 냉동시 반드시 밀봉해서 넣고 먹기 전에는 실온에서 해동 필수 !! 구움과자 보관기간은 실온 2일, 냉장 4일, 냉동 2주로 마카롱보다는 조금 더 짧아요 하지만 2일 안에 먹는게 가장 맛있게 먹는 방법😎 마떼아에서 판매 중인 프레첼 머랭인데 맛 보라고 서비스로 넣어주셨어요❤ 짭짤한 프레첼과 입에서 사르르 녹는 머랭의 조합 맛 없는거 impossible 집에 와서 씻고 하느라 거의 한시간 후에 열어봤는데도 아이스팩이 아주 깡깡 얼어있어서 마카롱도 하나도 안녹았더라구요 장시간 이동하시는 분들도 녹을 걱정 안하셔도 될 것 같아요 짠 저는 마카롱 총 12개를 주문했어요 맛 별로 하나씩 다 주문하려고 했으나 아쉽게도 제주말차는 이미 품절이었어서 제가 가장 좋아하는 크렘 브륄레를 하나 더 해서 12개 !! 순서대로 밤세 / 천도 Peach / 아망드 무화과 / 크렘 브륄레 / 애플 바닐라 마카롱이 사진으로 보는 것보다 크기가 훨씬 커요 저는 개인적으로 꼬끄 맛도 너무 좋아해서 이렇게 크키가 넓은(?) 마카롱도 좋아하는데 완전 취향 저격 필링도 빈틈없이 차있는데 색감이 위 아래 꼬끄부터 필링까지 마카롱이 전부 다 엄청 통통해서 더 먹음직스러워요 너무 알록달록한게 사진도 참 잘나오더라구요 순서대로 웨딩임페리얼 / 소금바닐라 소금 카라멜 / 라즈베리 피스타치오 / 레몬 얼그레이 / 오페라 마떼아는 이탈리안 머랭을 사용해서 더욱 쫀~~득한 꼬끄가 가장 큰 특징이자 강점인 것 같아요 쫀득 꼬그 처돌이는 진짜 첫 입에 바로 반했어요 게다가 설탕을 줄여서 직접 만든 수제 잼이 들어가 이는데 확실히 설탕을 확 줄여서 단맛이 너무 강하지 않은게 참 좋았어요 너무 종류가 다양해서 뭘 먼저 먹을까 하다가 쨍한 핑크색이 참 예뻐서 눈에 확 들어오길래 아망드 무화과 먼저 먹어봤어요 와인 무화과 잼이랑 아망드 쇼콜라 잼들이 통째로 들어가있는게 너무 달콤하고 부드러운 필링과 쫀득한 꼬끄의 조합이 말해 뭐해🤦‍♀️ 그리고 가장 기대하면서 구매했던 오페라 !! 이 친구 비주얼 미쳤지 않나요? 겉에 코팅된 진한 초콜릿. . . 초코 덕후는 안 살 수 없는 비주얼 사실 비주얼만 보고는 엄청 진한 초코 마카롱인지 알았는데 가운데 필링이 버터커피 크림이더라구요 오히려 초코와 커피의 향이 진하게 느껴지면서 달달한게 풍미 가득이었어요 역시 실망시키지 않는 마떼아👍 그리고 가장 가장 좋아하는 크렘 브륄레 !!!!!! 이 크렘 브륄레는 위에 크림을 토치로 구워내기 때문에 비주얼이 정말 마카롱 가게마다 살짝 다르던데 마떼아의 크렘 브륄레는 외관부터 백점 단짠단짠 그자체인 마카롱 심지어 안에 카라멜 잼까지 들어있어서 진짜 그 자리에서 10개도 먹을 수 있을 것 같은 맛이에요 카라멜이 아예 들어있는 크렘 브륄레 마카롱은 처음 먹어봤는데 너무 기대 이상으로 맛있었어요 마카롱 좋아하시는 분들 진짜 마떼아 크렘 브륄레 꼭!!!! 드셔보세요 밀크티와 카라멜의 조합으로 달달한 웨딩임페리얼 이것 또한 단짠단짠 그자체인 소금 카라멜 구운 생피스타치오 크림과 상큼한 라즈베리가 달달한 라즈베리피스타치오 레몬과 향이 진한 얼그레이의 조합이 너무 잘 어울렸던 레몬얼그레이 종류가 너무 많아서 아직 다 먹어보지는 못했지만 지금까지 먹어본 마카롱 모두 너무너무 기대 이상으로 맛있었어요 대성공적 !!!!!!! 프랑스 우유버터, 발로나초콜릿, 바닐라빈, 아몬드 가루 등 고급 재료로 만드는 부드럽고 달달한 필링과 쫀득한 꼬끄 마카롱 !! 망원동 마카롱 맛집 '마떼아' 강강강강강추 드립니다👍👍👍 마떼아 서울특별시 마포구 월드컵로19길 36 2층"
망원동 디저트 마떼아 크림마들렌 휘낭시에 마카롱 망원동 맛집,"마떼아 0507-1332-2018 월~토 12:00-19:00 일요일 휴무 망원역 도보 4분 요즘 회사 일로 스투레스 만땅이라, 힐링이 절실해서 퇴근하자마자 달려간 곳 망원동디저트 맛집 마떼아 구움과자가 맛있다는 소문을 듣고 찾아갔다 망원역 2번 출구에서 도보로 4분 거리 한적한 망원동 골목, 아이보리색 건물 2층에 위치해있다 사장님이 연남동 메리로 오랫동안 운영하시다가 '마떼아'로 상호를 변경하고 2023년 3월 망원동으로 이전 오픈했다고 한다 창가에 2~3인 테이블이 있고 벽쪽에도 자리가 마련되어 있다 화이트톤의 깔끔한 인테리어에 우드로 포인트를 주어 따뜻한 분위기가 좋았다다 분위기 좋은 망원동구움과자 마떼아 음료 메뉴 아메리카노 4.0 바닐라라떼 5.5 생크림라떼 6.0 얼그레이티 4.0 망원동디저트카페 마떼아 디저트와 즐기기 좋은 음료도 있고 음료 금액도 착한 편이다 좋은 재료와 최소한의 첨가물로 매장에서 매일 정성스럽게 만들어지는 마떼아의 디저트 라인업 마카롱 / 크림마들렌 / 휘낭시에 마카롱 밤세 2.8 / 천도복숭아 2.8 라즈베리 피스타치오 2.8 / 아망드 무화과 2.8 애플바닐라 2.8 / 오페라 3.0 크렘브륄레 3.0 / 웨딩임페리얼 2.8 레몬얼그레이 2.8 / 제주말차 2.8 소금카라멜 2.8 / 소금바닐라 2.8 크림마들렌 레몬유자 3.7 / 라즈베리초코 3.7 모카크림 3.7 / 얼그레이가나슈 3.5 마롱 4.0 / 피스타치오크림 3.7 바닐라가나슈 3.5 / 얼그레이머랭 4.8 휘낭시에 무화과 초코 3.0 헤이즐넛 카라멜 3.0 클래식 마들렌 2.8 머랭 프레첼 머랭 7.0 선물박스(Gift Box) 1.0 보냉포장 1.0 종이가방 0.5 선물박스는 6개~15개 자유롭게 구성이 가능하다 선물하기에도 좋은 망원동디저트 마떼아 다 맛있어 보여서 이것저것 담다보니 디저트 풍년이로구나! 헤이즐넛 카라멜 휘낭시에 헤이즐넛 카라멜 휘낭시에 3.0 볶은 헤이즐넛 위로 카라멜을 덮어 구워낸 휘낭시에 오독오독 씹히는 헤이즐넛의 식감이 좋고 고소하다 휘낭시에를 뒤덮은 카라멜의 풍미도 굳뜨 단짠단짠 완전 취향저격 캬~! 무화과 초코 휘낭시에 무화과 초코 휘낭시에 3.0 와인에 졸인 무화과를 넣고 발로나 초콜릿을 채워 구워낸 휘낭시에 톡톡터지는 무화과와 초코의 조합이 좋다 많이 달지 않고 고급스러운 단맛 라즈베리초코 마들렌 라즈베리초코 마들렌 3.7 초코마들렌 안에 라즈베리버터크림과 초콜릿가나슈 라즈베리쨈이 아낌없이 들었다 라즈베리와 초코의 풍미가 엄청난 마들렌 고급스럽고 상콤달콤 정말 맛있음! 모카크림 마들렌 모카크림 마들렌 3.7 커피 마들렌에 진한 모카버터크림이 가득 들었다 마들렌 위에 둘세초콜릿 피칸크런치가 바삭하게 씹혀 식감도 좋음 재료가 좋아서 맛이 정말 고급스럽다 피스타치오크림 마들렌 피스타치오크림 마들렌 3.7 구운 피스타치오에 화이트초콜릿 피스타치오 가나슈 피스타치오 맛이 진하지 않고 은은하다 피스타치오가 호불호 있는 메뉴인데 누구나 맛있게 먹을 수 있는 맛! 바질치즈 마들렌 바질치즈 마들렌 3.0 고르곤졸라 돌체치즈와 황치즈, 신선한 바질페스토로 맛을 낸 마들렌 바질과 치즈 풍미가 美쳤다 단짠조합인데, 달콤함이 더 많이 느껴짐 포슬포슬 촉촉한 식감의 마들렌 바닐라가나슈 마들렌 바닐라가나슈 마들렌 3.5 마다가스카르 바닐라빈과 화이트초콜릿 가나슈크림을 채워 넣은 마들렌 아낌없이 콕콕 박혀있는 바닐라빈에 화이트초콜릿 바닐라빈이 들어간 디저트를 원래 좋아하긴 하지만 이건 찐임..! 커스터드와 엑셀런트 아이스크림을 합친 맛인데 그것보다 한 5단계 상위버전임! 촉촉하고 풍미 가득 고급스러운 단맛 레몬유자 마들렌 레몬유자 마들렌 3.7 고흥유자청과 유자레몬커드 버터크림에 레몬글라세 풍미 가득 상큼한 버터크림에 레몬제스트가 콕콕 박혀있다 중간중간 씹히는 레몬제스트와 사각사각 레몬글라세의 식감이 좋다 레몬에 유자가 더해져 시지 않고 상하다 고급스럽고 상콤달콤 사랑스러운 맛 그 많던 디저트가 사라지는 건 순식간..! 우열을 가릴 수 없을 만큼 하나하나 다 맛있다 재료 본연의 풍미가 좋고 고급스러운 맛이 남 가족들과 함께 먹었는데 다들 행복에 취해버림♡ 몇개는 지인에게 선물했는데, 완전 맛있다며 어디서 샀냐고 물어봤다 바로 망원동맛집 공유♡ 보관 방법과 먹는 방법은 동봉된 설명서 참고! 여기서도 느껴지는 사장님의 친절함과 섬세함 망원동구움과자 맛집 마떼아 뭘 골라도 다 맛있어서 취향껏 고르면 된다 (취향이 아니더라도 취향이 되어버리는 Magic) 고민은 행복만 늦출뿐! 회사에서도 집에서도 멀지 않은 곳에 있어 앞으로 퇴근 길 힐링코스가 되겠다♡ 다음에는 마카롱 가보자고! 00:00 00:30  접기/펴기 마떼아 망원 디저트 50m © NAVER Corp. 마떼아 서울특별시 마포구 월드컵로19길 36 2층 이 글은 본 업체에서 제품 또는 서비스를 제공받아 직접 체험 후 솔직하게 작성된 글입니다."
망원동 디저트 카페 투어 하기 좋은 마카롱 맛집 마떼아,"안녕하세요! 식집사 인사드립니다. 가까운 동네는 아니지만 망원동 나들이를 자주 가는 편인데요 볼거리 많은 망원시장을 포함해 놀거리와 먹을거리가 많은 망원동에 특히 마카롱이 맛있다는 집을 찾았는데요 망원동 마카롱으로 유명한 마떼아입니다. 마떼아 서울특별시 마포구 월드컵로19길 36 2층 주소: 서울 마포구 월드컵로19길 36 2층 영업시간: 매일 12:00~19:00 휴무일: 매 주 일요일 전화번호: 0507-1332-2018 망원시장과 가까운 곳에 위치해 있고, 복잡할 것 같아 대중교통으로 방문했는데요 골목 구석마다 분위기 있는 카페와 식당들이 있어서 이색적인 느낌이 들었습니다. 그래서 망원동이 재미있는 것 같아요 2층에 있는 마떼아에 도착했습니다. 문을 열고 들어가면 진한 우드톤의 바 테이블과 넓은 원형 테이블, 사이드에도 테이블이 있어요 넓지 않은 실내지만 테이블 간격도 좋았고 서로의 이야기에 집중하며 데이트하기 좋을 것 같습니다. 망원동 디저트 카페에 맞게 넓은 냉장 쇼케이스에는 보석같이 디스플레이 된 마카롱과 휘낭시에, 마들렌이 있었는데요! 먹음직스러운 모습에 사진을 찍으면서도 뭘 먹을지 머릿속이 복잡해졌습니다! 마카롱의 가격대는 2,800원~3,000원 마들렌과 쿠키는 3,700원~4,000원의 가격대로 준비되어 있습니다. 과거에는 무슨 디저트 가격이 이렇게 비싸냐 했지만 요즘은 인식이 많이 바뀌었죠! 특히 직접 만들어 본 사람이라면 아시겠지만 마떼아의 디저트 가격은 저렴한 편에 든다고 볼 수 있습니다! 필링으로 사용되는 좋은 재료들과 손이 여러 번 가는 과정을 거치는 디저트라 이 정도 가격이면 합리적이라 생각합니다! 디저트마다 설명이 써져 있는데요 어떤 맛일지 상상해 보는 재미도 있어서 좋았습니다! 쇼케이스 위에 메뉴판을 확인했습니다. 기본적인 커피 메뉴와 티가 있구요 그 옆에는 디저트 포장에 대한 안내가 있습니다. 매장에서 먹고 갈 거라 고민하며 맛있어 보이는 마카롱을 4개 골랐고, 날씨가 더웠던 관계로 시원한 아메리카노와 얼그레이 티를 주문했어요 마카롱은 필링 종류에 따라 버터크림 2개와 가나슈 2개를 골랐어요 커피와 얼그레이, 그리고 마카롱까지 있으니 좋은 곳에 애프터눈 티 즐기러 온 것 같네요! 먼저 마카롱을 하나 들어봤는데요 마카롱 사이즈가 제법 크고 뚱카롱이 아님에도 묵직한 느낌이 들었습니다. 레몬 얼그레이 마카롱 입니다. 홍차 향이 은은한 가나슈에 가운데 상큼한 레몬 잼이 더해져 상큼하면서도 향긋했습니다. 그다음으로 라즈베리 피스타치오 마카롱입니다. 피스타치오의 느끼하면서도 고소한 맛이 라즈베리 필링과 잘 어울립니다! 꼬끄도 쫀쫀하니 맛있었구요 그다음으로 애플 바닐라 마카롱입니다. 바닐라빈이 콕콕 박힌 화이트 초콜렛 가나슈에 사과쨈이 있어 이건 맛없을 수 없는 맛이죠! 마지막으로 천도복숭아 마카롱입니다. 쫀쫀하게 씹히는 꼬끄 속에 달콤한 복숭아살이 버터크림 필링에 섞여 있어요 이렇게 마카롱 4개가 그 자리에서 눈 녹듯 사라져 버렸네요ㅎㅎ 남으면 포장해 가려는 마음으로 구움과자를 조금 더 주문했습니다. 레몬 유자 마들렌으로 상큼하게 마무리해봤는데요! 크림 마들렌 속에 크림이 얼마나 많이 들어 있는지 보여드릴게요 향긋한 레몬향에 기분까지 산뜻해지는 그런 맛이었습니다. 망원동 카페가 많지만 맛있는 곳 찾기 쉽지 않았는데 잘 찾아온 것 같다는 생각을 했습니다! 그중 저의 원픽은 애플바닐라였습니다!ㅎㅎ 연남동에서 운영하시다 망원동으로 이전한 지는 얼마 안 되셨다는 사장님 이전 매장은 가보지 않았지만 그동안 마카롱 본연의 맛을 보여주기 위해 노력을 많이 하신 것 같았습니다. 부드럽고 쫀쫀한 꼬끄, 그 속에 시원하고 향긋하게 녹아드는 필링은 오랜만에 느껴보는 좋은 경험이었습니다! 시즌 별로 디저트에도 변화를 주시는 것 같은데 망원동 데이트할 때 맛있는 디저트샵 찾으신다면 마떼아 추천드립니다. 이 글은 리뷰 노트를 통하여 제품 또는 서비스를 제공받아 작성된 글입니다."
"망원동디저트, 마카롱 대맛집 찾았어요!!! ""마떼아""","디저트 호황이라고 해도 될 정도로 디저트카페가 여기저기 많이 생겨나고 디저트 퀄리티도 많이 좋아지고 있죠! 매번 그냥,저냥 하나씩 맛보다가 심각하게 만족하는 마카롱맛집을 대발견해서 소개해드립니돠!!!!! 망원동 골목 2층에 있어요. 망원역에서 가깝답니다. 저는 이날 따릉이타고 디저트픽업 다녀왔어요^^ 매장 근처 곳곳에 가는길 표시가 있어서 잘 찾아오시면 돼요^^ 주재료로 들어가는 버터, 초콜릿, 바닐라빈, 아몬드가루 등을 고급재료로 써서 맛이 좋다고 유명한 가게에요. 계단을 타고 올라가면 마떼아 도착! 연남동의 메리가 이전오픈했다네요^^ 망원동디저트/망원동맛집 마떼아 영업시간 12:00 - 19:00 매주 일요일 정기휴무 매장으로 들어서면 깔끔한 우드톤 가구들이 맞이해줍니다. 커튼 뒤 매장 한켠에서 디저트들을 직접 만드시네요. 6년 동안 꾸준하게 사장님이 직접 만드는 정성가득 망원동구움과자집^^ 디저트장에는 정말 다양한 구움과자들이 다양하게 들어있어요. 비쥬얼이 딱 봐도 오동통한게 맛있어 보이죠? 요즘 유행하는 약과디저트들도 있어서 몇개만 맛보려다가 참지 못하고 하나 가득 집어들었답니다^^; 멤버쉽포인트도 적립해 주시고 커피도 판매하고있어요! 이날은 포장만 하러갔는데, 담에 가면 꼭 커피까지 같이 마시고 오려구요^^ 그리고 한쪽 벽면에 신기한 액자가 있었는데 가까이에서 보니까 진짜 마카롱 꼬끄인거에요!! 이만큼 것 연습하신것만 봐도 쫀득하고 맛있는 마카롱맛이 기대되는 집입니다. 잘 찾아왔어요^^ 날이 더워져서 보냉포장 부탁드렸어요. 요즘 낮에는 홍콩인가 싶게 더워서 맛있는 디저트들이 상할수있으니 보냉포장 꼭꼭 해서 가져가세요^^ 안에 얼음팩까지 넣어주셔서 안전하게 망원동구움과자들을 들고 돌아올수 있었어요^^ 저녁먹고 디저트로 몇가지 꺼내봤어요. 하나씩 비닐개별포장을 해주셔서 냉장고에 넣고 보관하기도 편하고, 회사에서 하나씩 나눠먹기도 좋아요^^ 저녁먹고 먹기에는 많은 양이지만 망원동구움과자들이 탐스럽게 생겨서 욕심내서 이만큼이나 꺼냈네요^^ 레몬얼그레이 2,800원 먼저 이름부터 여심저격인 레몬 얼그레이 마카롱이에요. 안에 정말 상큼한 레몬잼이 있어서 기분이 확! 좋아지는 맛이에요. 딱 적당한 양의 레몬버터크림과 더불어 예상대로 꼬끄가 정말 쫀득하고 맛있네요^^ 아망드무화가 2,800원 마카롱이 하도 맛있어서 하나 더 집어 듭니다.이거 대박 완전 추천이에요! 와인에 졸인 무화과와 더불어 초코를 입힌 통아몬드가 들어있어서 마카롱을 먹고 이런 식감은 정말 처음이에요!!! 손수약과 3,700원 약과가 올라간 휘낭시에인데 약과도 직접 만드신거라네요. 휘낭시에 부분이 부드러워서 쫀득한 약과랑 잘 어울려요. 휘낭시에 특유의 쫀득한 맛도 있구요! 레몬유자 3,500원 남편이 새콤한걸 좋아해서 고른 마들렌! 유자텅과 레몬커드 버터크림, 레몬글라세 가 들어가서 새콤하고 맛있어요. 통통하고 크기도 큼직해서 비쥬얼 대박입니다. 위에 올라간 크림도 단면으로 보니 양이 꽤 많이 들어가요. 커피와 잘 어울립니다^^ 약과 바닐라크림 6,000원 요즘 유행하는 약과쿠키도 있네요^^ 역대급으로 맛있습니다. 약과도 시중에서 파는것보다 맛이 좋고 쿠키 부분이 부드럽고 묵직해서 무조건 둘이서 나눠먹어야해요. 망원동맛집에 들르면 카페는 꼭 마떼아로 와야겠습니다!! 한때 뚱카롱이 유행했는데 저는 크림이 과하게 들어가면 맛이 떨어졌거든요, 마카롱 안에 들어가는 수제잼이 과하게 달지 않아서 맛있고, 크림을 적당하게 샌딩해서 최상의 맛조합을 찾은듯해요. 남편이랑 디저트 먹는 내내 여기 대박이라고 완전 감탄에, 감탄을 했어요^^ 망원동디저트가게이자 망원동맛집인 마떼아! 진짜 너무 맛있어요!!!! 유튜버 여수언니에게 추천하고 싶은 디저트 대맛집입니다. 마카롱, 휘낭시에, 쿠키가 기복없이 퀄리티가 좋아서 개인취향에 맞게 맛을 고르시면 무조건 만족하실거에요. 주기적으로 찾아가게 생겼네요^^ #망원동디저트 #망원동구움과자 #망원동맛집 #마떼아 #마떼아마카롱 #마떼아가격 #망원역맛집 #망원역카페 #망원동카페 #망원디저트카페 마떼아 서울특별시 마포구 월드컵로19길 36 2층 이 글은 리뷰노트를 통하여 본 업체에서 제품 또는 서비스를 제공받아 작성된 글입니다."
[마포구 망원] 마카롱 전문점 마떼아 망원동디저트 추천,"마떼아 운영시간 : 월요일 12:00-19:00 (일요일 휴무) 전화문의 : 0507-1332-2018 안녕하세요. 오늘은 망원동 나들이를 갔다가 최근 핫하다는 마카롱 집을 다녀와봤어요. 망원동디저트 맛집인 마떼아는 마카롱을 전문적으로 판매하고, 구움과자들도 판매하고 있어요. 마떼아 2층으로 올라가면 되세요. 이 계단 끝에 달콤한 것들이 기다리고 있어요. 넓은 좌석은 아니지만, 간단히 디저트 즐기실 수 있게, 바 좌석과 긴 의자가 있었어요. 영롱한 달달구리 친구들 평일 낮이였는데 손님들이 줄지어 있어라고요. 마카롱 액자가 너무 인상적이었어요.~ 망원동디저트 맛집인 마떼아는 포인트 적립 7%를 해주고 있어요. 우와~~ 그리고 음료도 판매하고 있어서, 매장에서 디저트 즐기실 수 있으세요. 본격적으로 마뗴아의 구움과자들을 구경해볼게요. 이것저것 맛있어 보이는 마카롱을 다 담아봤어요. 맛별로 ~~~ 끄악 너무너무 맛있어 보여요 ^^ 이중에서 저 왼쪽에 오페라 마카롱 원픽입니다. 말차도 너무 맛있었는데~ 어쩜 하나같이 다 필링도 맛있고 겉은 바삭할까요? 마들렌도 집어봤어요. 맛별로 다 집어서 가족모임에 가져가서 먹으려고요 약과도 있네요~~ 어머어머 ~~ 저거 가족 모임때 가져가려고 구매하는 건데... 이건 못참겠네요. 한개만 몰래 먹고 가야지~~ 단면 보이시죠? 꾸덕 ..꾸덕 그자체에요. 포장도 꼼꼼하게 보냉 완전하게 해주셔서 ~~ 가족모임 때도 겉은 바삭하고 필링은 꾸덕한 마카롱 먹을 수 있었어요. 마카롱 선물, 마들렌 선물 망원동디저트 선물 찾으신다면 마떼아 추천드려요. 마떼아 서울특별시 마포구 월드컵로19길 36 2층 #망원동디저트 #망원동구움과자 #망원동맛집 *이 글은 리뷰노트를 통하여 본 업체에서 제품 또는 서비스를 제공받아 작성된 글입니다."
