title,content
망원동 디저크카페 비전스트롤 또가고 싶은곳,"서울여행을 계획하다보면 가보고싶은 곳이 정말 많은거같아요! 맛집도 맛집이지만 저같은 빵순이에겐 카페도 1일 1카페로는 부족해서 1일 2카페는 가는거같고 많이 갈때는 3번도 가는거같아요ㅋㅋㅋㅋㅋㅋㅋㅋㅋㅋㅋ 제가 이번에 방문한 연남동카페는 비전스트롤이에요! 예전부터 너무너무 가보고싶었던 카페인데 이제서야 오게되네요ㅠㅠ 진짜 여긴 빨리 왔어야했는데 왜 이제왔는지ㅠ,ㅠ!!!! 연남동카페 비전스트롤 주소 : 서울 마포구 망원로 61 전화번호 : 0507-1375-1002 영업시간 : 09:00 ~ 21:00 화,수 정기휴무 포장 / 반려동물 동반 가능 연남동카페 비전스트롤 메뉴판 생각보다 종류가 많아서 메뉴판 사진찍고 자리에 앉아서 고민했어용ㅋㅋㅋ 사람들이 계속해서 오기때문에 자리부터 안잡으면 못 먹겠더라구요ㅠㅠㅠ 일단 자리는 협소하기때문에 불편함은 좀 감소하고 방문하세요!! 연남동카페 비전스트롤는 원두도 직접 볶아판매중이에요! 커피가 맛있다보니 원두납품도 인기가 많은가보더라구요! 원두는 콜롬비아, 에티오피아, 콜롬비아 게이샤, 시즈널블랜드, 콜롬비아 디카페인 이렇게 준비되어있었어용ㅎㅎ 바 좌석도 있어요! 주방이랑 너무 붙어있어서 부담스러우면 다른 곳으로....슥 유명한 버터푸딩, 블루베리갈레트외에도 핑거디저트들이 판매중이더라구요ㅎㅎㅎ 작아서 너무 귀여워용ㅎㅎㅎㅎ 추석당일날 방문했는데 역시 사람이 많더라구요ㅎㅎㅎ 추석당일에 하는 카페 정말 드문데 연남동카페 비전스트롤 짱짱!!!! 덕분에 이번ㅇ 서울여행때 방문할수있었어요ㅠㅠㅠ 간단한 셀프바~ 분위기도 너무 좋고 카페지만 연남동카페 비전스트롤에서는 커피, 디저트, 진토닉, 위스키 등등 다양한 음료가 판매중이였어요ㅎㅎㅎㅎ 연남동카페 비전스트롤에서 유명한 콜드브루! 온라인/오프라인 둘 다 구매가 가능해요!!! 대왕사이즈도 있으니 참고하세용ㅎㅎㅎㅎㅎㅎㅎ 컵분위기도...뭔가 힙해!!!!!!!! 카페라떼는 귀리우유로 변경했어요! 귀리우유로 변경하니까 깔끔하니 너무 맛있더라구요ㅎㅎㅎ 요즘 비건라떼로 많이 즐겨드시던데 저는 개인적으로 너무 좋았어요 블루베리갈레트위에 맛있는 크림 툭.....♥ 블루베리 갈레트 9.000원 직접 만드는 블루베리콩포드 비쥬얼부터 너무 맛있어보이죠? 크림을 거침없이 툭툭툭 발라서 손으로 집어서 먹으면되요!!!!!! 오히려 먹을땐 도구가 있으면 먹기가 힘들기 때문에 손으로 과감하게 집어서 먹기! 생각보다 많이 안 달아서 좋았던 블루베리갈레트! 일단 크림 양도 넉넉하고 블루베리 콩포드도 넉넉하게 올려주셔서 너무 좋았어요!! 갈레트는 바삭바삭 식감이 너무 좋더라구요! 이쁜게 맛도잇네 커피쉐이크 8.000원 양이 정말 창렬스러웠던 커피쉐이크ㅠㅠ 하지만 너무 맛있어서 용서가 됬던 커피쉐이크...............!!! 양이 진짜 너무 작아서 짜증나더라구요ㅠㅠㅠㅠ 그래도 다음에는 또...초코쉐이크도 사먹어볼래요 버터푸딩 9.500원 주문하면 즉시 만들어주기때문에 20분정도 걸려요! 진짜 이건 맛없을수 없는 비쥬얼이라구요!!!!!!!!!!!!! 완전 내가 좋아하는 스타일ㅠㅠ 그리고 이번 여행중 서울에서 먹었던 디저트중에 제일 만족했던 디저트! 일단 망원동카페 비전스트롤 디저트는 뭐든 듬뿍듬뿍 올려줘서 좋더라구요>.,< 일단 비쥬얼이 너무 좋아서 인스타 업데이트 무조건이다!!! 어휴 이거 진짜 맛있음.............. 또먹고싶어 블루베리 갈레트보다 더 맛있었떤 버터푸딩!!!!!!!!! 극단적으로 달진않은데 달달하면서 너무 맛있는 디저트였어요ㅎㅎㅎㅎ 망원동카페 비전스트롤 재방문하면 무조건 시켜먹을꺼구요! 아참! 아메리카노보다는 콜드브루가 확실히 맛있더라구요! 카페라떼는 맛있었는데 아메리카노는 정말 내스타일이 아니였음ㅠㅠㅠㅠㅠㅠㅠㅠ 힝 비전스트롤 서울특별시 마포구 망원로 61 1층 #비전스트롤 #망원동카페 #홍대카페 #연남동카페 #초코푸딩 #블루베리갈레트 #서울디저트맛집 #서울디저트 #서울여행 #서이추 #서이추환영 #내돈내산 #내돈내먹"
망원동 카페 버터푸딩이 맛있는 비전스트롤,"비전스트롤 서울특별시 마포구 망원로 61(망원동) 월, 목, 금, 토, 일요일 9:00-21:00 (Last order: 20:30) 매주 화, 수요일 정기휴무 망원동에서 디저트맛집으로 유명한 비전스트롤 여기는 버터푸딩이 맛있기로 유명하다 #망원동카페 #망원동카페추천 #비전스트롤 #망원동비전스트롤 #서울디저트맛집 멀리서 저긴가 하고 있었는데 핫플답게 웨이팅이 있군요 핫플 쉽지 않아~ 카페 웨이팅 잘 안하는 편인데 다른 곳 찾기도 귀찮아서 웨이팅 했는데 10분 만에 들어갔다! 나이스 타이밍 외관도 예쁘네요 비전스트롤은 카페인데 위스키나 진토닉 같은 술도 팔고 분위기가 어둑어둑해서 커피말고 술 홀짝홀짝 마시기에도 괜찮다! 비전스트롤 카페에서 드립백과 옷, 텀블러, 그릇 등등 다양하게 판다 일하시는 분들도 힙하고 카페도 느낌있다 사람이 만석이라서 없는 곳만 슬쩍 찍어봤어요 여긴 바좌석과 테이블 약 7개 정도가 있어요 우린 바좌석이 먼저 나서 바좌석에 앉았다 드립백과 간단한 슈와 버터쿠키류 같은 것도 팔아요 요기가 바좌석 이곳은 버터푸딩과 블루베리 갈레트 디저트들 만드는 공간 나름 분업화가 잘되어 있군요 여기 오면 누구나 먹는다는 버터푸딩과 아메리카노를 주문했어요 바좌석의 묘미는 이렇게 가까이서 커피 내리는 모습을 볼 수 있어요 컵도 힙하고 느낌있지 않나요? 전 술이나 커피 워낙 빨리 마셔서 요즘 감성 카페 같은 곳 가면 양이 너무 적어서 두 잔씩 시키는데 요긴 커피 양도 많구 무엇보다 커피가 산미가 좀 있는데 깔끔+묵직해서 시원하게 마셨어요! 술잔도 저렇게 쪼로록 되어 있어서 뭔가 귀엽구 직원분들께서 가내수공업처럼 열심히 버터푸딩을 만들고 계세요! 버터푸딩은 나오는데 한 15분 정도 소요됩니다 하루에 몇 개 만드는지 좀 궁금하네요 버터푸딩은 겉은 바삭 속은 촉촉하면서 초코가 꾸덕해서 아이스크림이랑 같이 먹으니까 당충전 되는 맛 그렇다고 너무 무거운 머리아픈 초코 느낌도 아니라서 아메리카노랑 먹으니까 넘넘 맛있더라구요! 커피도 맛있고 디저트도 맛있는 #망원동핫플 #망원동카페 #비전스트롤 #망원동카페추천 앞전에 소금집에서 거하게 먹은 터라 못 먹은 블루베리 갈레트 이것도 맛있다는 평이 많던데 담번에 기회가 되면 이거 먹으러 또 가구 싶어요 #망원동카페추천 #망원동카페 #버터푸딩 #망원동비전스트롤 #비전스트롤 #망원동핫플 비전스트롤 서울특별시 마포구 망원로 61 1층"
"/ 일상 (망원동 비전스트롤, 샐러마리, 가을 한강 노을)","망원동 마실을.. 나갔던 지난 10월 어느날 언제 이렇게 물들었는지도 모르고 지냈었다 버스에서 처음 제대로 본 은행나무ㅋㅋ 뭄미가 목요일에도 오픈하신다길래 혹시나하고 가봤는데 역시나 솔드아웃ㅋㅋㅋ 밍기적거리다 늦게 나갔더니 뭄미 솔드아웃, 모을도 만석이어서 당황.. 크레타는 리뉴얼 하던때라 못 들르구여 수아님과 향주사장님 추천 보고 다녀온 파인드 스터프 잔이 너무 다 이쁘쥬 한개 득템 해서 잘 쓰고 있고 🤍 아담한데 알차게 알차게 채워져있는 공간 MANGWON 골목길 바이브 요기는 어쩌다가게 서점 귀여운 상점이 또 생겨서 구경👀 ㅋㅋ 나 다람쥐 좋아하네? 비 전 스 트 롤 ! 비전스트롤 2층은 처음 가봤는데 만석에 만석이라 도넛 포장만😱 목요일잉데.. 나 이제 젊은이가 아뉜가... 핫플 무서어.. ㅋㅋㅋㅋ 잠시 혼이 쏙 빠져나감 인테리어 멋있어여😳 진짜.. 미국 서부 어디.. (안가봄) 시간 여행.. 카우보이.. 그런 느낌 꺅 저는 이 도넛을 품겠습니다 1층은 조금 한적하길래 커피 한잔 먹고가기로!!!!! 1층 2층이 아예 별개로 운영되기때문에 2층에서 포장한 도넛을 먹을 수는 없어서 사진만 챡챡 귀여운 도넛이이🍩 집에 오자마자 바로 먹었는데 듣던대로 넘 맛있었다 달짝지근 쫀득한 식감, 당보충 제대로🤎 소품샵에서 구매한 꾸여운 카드와 스티커🥳 태하 백일 축하 카드와 서히언니 생일 카드로 망원동 카페 비전스트롤 베이크샵 - 카페에서 잠시 멍때리다가 노을 보러 가볼까!!싶어서 급 망원 한강 공원 비전스트롤에서 한강까지 걸어서 10분 - 다행히 많이 안추워서*_* 여유롭게 물멍,,, 노을멍 🌇🌉 멀리 여의도 야경도 넘 멋져서 그쪽으로 좀 더 걷다가 급! 출구가 마침 또 샐러마리 근처길래 모처럼 혼밥을 날이 추웠지만 먹어보고 싶었던 바질냉우동으로!! 탱그르 그리구 버섯 김밥! 😮😮😮 샐러마리는 밥이 질다 쫀득했던 김밥ㅎㅎ 엄마 드리려고 포장해온 멸치 고추 김밥쓰 매콤매콤 한강에서 줍줍한 이쁜 단풍잎 .. 🍂 아 진짜 혼자 너무 잘 다녀.. 🤣 오후에 반짝 여행 다녀온 기분 ㅋㅋㅋㅋㅋ 홈카페, 커피 일상 🍎(@___yw.h)님이 Instagram을 사용 중입니다 팔로워 16.8천명, 팔로잉 212명, 게시물 1,164개 - 홈카페, 커피 일상 🍎(@___yw.h)님의 Instagram 사진 및 동영상 보기 instagram.com"
핵달달한 버터푸딩이 있는 망원동 카페 <비전스트롤>,"내가 먹어 본 푸딩 중에 제일 달아 망원동 비전스트롤 망원동엔 정말 정말 많은 카페가 있지만 달달한 디저트를 좋아한다면 한 번 가볼 만한 카페다! 망원동 비전스트롤 베이크샵 서울 마포구 망원동 422-32 망원역 2번 출구 목-월 09:00-21:00 라스트오더 20:30 매주 화요일 수요일 휴무 망원역 2번 출구에서 한강 방면으로 걷다 보면 나오는 비전스트롤! 길가에 위치해있어서 찾기 쉽다. 내부는 2층까지 있었는데 2층은 못 가봤다 ㅠ 원목 인테리어로 편안한 분위기에 노래가 되게 힙했다. vision stroll 가죽 받침 멋져요 ㅎㅎ 갖고 싶다!!!! 알록달록 잔에 나온 아메리카노다. 산미가 있는 편이라 호불호 갈릴 거 같긴 한데 나는 맛있었다! 커피, 밀크티 같은 카페 음료들도 판매하고 진토닉이나 위스키 같은 주류도 판매하신다. 알름두들러 블로그 쓰면서 찾아봤는데 오스트리아 국민 음료수래요..! 많이 달지 않았던 비건 탄산음료! 시나몬 버터 스틱 이거 은근 중독성 있고 맛있었다.. 시나몬은 안 어울리는 곳이 없는 거 같아 ~~~ 동그란 조명 너무 귀여웠다. 근데 초점을 조명에 잡으면 너무 어두워지고 저 시나몬 스틱에 잡으면 빛이 날아감 ㅋㅋ ㅠㅠ 버터 푸딩 비전스트롤의 주인공! 이라고 해도 될까요?! 어마어마하게 달다. 그리고 맛있다.. 엄청 달고 부드러운데 막 몸에 안 좋은 설탕 느낌은 아니고 꿀 느낌??!!!! 하여튼 맛있었다. #망원동카페 #망원카페 #망원동디저트 달달하고 부드러운 디저트가 먹고 싶을 때 한 번쯤 생각날 것 같다. 버터푸딩이 궁금해서 가봤는데 분위기 좋고 맛있었다! 잘 먹었습니다 - 비전스트롤 서울특별시 마포구 망원로 61 1층"
"안 좋아한다고 함부로 말하는 거 아니야, 망원동 <비전스트롤>","비전스트롤 서울특별시 마포구 망원로 61 1층,2층 망원동에서 살고 싶을 정도로 망원동에 좋아하는 디저트가 많다. 바삭하고 달콤한 타르트, 부드럽고 쫀득한 마카롱, 버터 풍미가 물씬 나는 구움과자! 그러나 파이류나 크림이 많은 건 좋아하지 않았다. 비전스트롤을 가기 전까진. 망원동 카페 중에서도 유명한 비전스트롤의 디저트는 버터 푸딩과 블루베리 갈레트 그리고 오레오 도넛으로 단출하다 1층은 가본 적이 없고 2층만 가보았는데 창이 커서 바람이 살랑살랑 불 때가면 정말 좋다 커피 대신 오트밀크를 주문했다 비전스트롤 음료는 대체로 양이 적은 편 일행은 커피를 주문했는데 맛있다고 하였다. 블루베리 갈레트 디저트 중에서는 초콜릿 맛만 선호하던 때가 있었는데 이젠 바닐라 맛, 딸기 등 각종 과일류도 좋아하고 캐러멜이나 생크림도 곧잘 먹는다 물론 맛있는 것만! 그래서 초콜릿 맛이 듬뿍 있는 버터푸딩을 선택할까 하다가 비주얼이 너무 달 것 같고 오히려 갈레트가 생크림이 달지 않다고 하여 블루베리 갈레트를 선택했다. 생각보다 조그마하였는데 네 등분으로 잘라서 한 입씩 먹으면 된다 먼저 쫀쫀한 크림을 함께 나온 나이프로 펴 발라주면 된다 정말 바삭하게 잘리고 블루베리 잼도 생크림도 많이 달지 않다 적절한 당도와 바삭함 왜 다들 비전스트롤에서 기다리는 줄 알겠다. 특별하게 보이는 디저트를 특별한 맛으로 기대에 부흥해 주니까! 이후... 또 먹으러 다녀왔다."
매일매일두에세이- 을지로투어 / 을지로 산수갑산 / 을지로 호랑이 라떼 / 망원동 소금집델리 / 망원동 비전스트롤 버터푸딩 / 연남동 버바나 햄버거 / 오오티디 / 냠냠에세이,"킁킁 콧바람 씨티투어 2 진리의 산수갑산 적당~히 순대국이 땡길때는 망원동 순대일번지를 가지만 씨티투어 주간이었으므로 오랜만에 산수갑산행 열차를 탑승. 두에세이가 간날은 비도오고/ 순대가 잘 만들어졌는지 막 맛이 미화되면서 온 몸에 궁물이 쫙 퍼져벌임! 순대충전완료. 을지로 호랑이 산수갑산도 먹은김에 호랑이를 드디어 와봄 알고나면 찾기쉽고 모르면 헤매게되는 위치. 비와서 웨이팅 거의 없이 바로 앉아서 먹은거에 만족했다; 두에세이의 기대엔 2%못미쳤던 곳. 담엔 챔프커피가야지.. 또 비가 올랑말랑했던 어떤 날, 틈새시장을 공략했숩니다 망원동 소금집 델리 계획했던 시간보다 밍기적거리다 늦게나와서 가슴졸이며 왔는데 말이지예, 1등을해벌임;; 두에세이 개당황;; 붐명히 완전 웨이팅 미쳤다고 이날 토욜이어서 지굼나가면 안되는데 하고 나갔는데 말이지예(야호) 날씨빨을 받으면 토요일아침 10시반에 도착했는데 일등해버릴수있읍니다!! 텅빈골목길캐당황/ 운동화랑 커플쓸애기 잠봉뵈르만 먹기에는 좀 아쉬워서 슾-도 시키고 루벤도 시켜봤숩니다 아, 역시 탁월한 선택! 사이드를 코울슬로나 감자튀김중에 선택할수있는데 감튀 탁월한 선택. 감튀맛집이십니다!! (감튀를 해야 양도 많음 ㅎㅎ) 스프는 그때그때 바뀌는거같고 두에세이가 갔을때는 콜드스프-가스파쵸 였다 가스파초 페이보릿이라 뭔가 개이득적 너낌으로 뇸뇸 먹었고♥ 천장까지는데 허벌허벌먹게되는 이 맛. 꼬숩꼬숩하고나면 쫍쫄하고 콜라충전하면 무한반복루프*ㅅ* 오랜만에 맛있는 브런브런 부런치를 해서 토요일 아침댓바람부터 설쳐서 나간보람을 매우 느꼈던 날bb 맛있는건크게한번더.jpg 요래요래 햄 자랑 (두툼두툼) 배불러서 산책을 좀 해줍니다 좀 걸어주었으니 까먹고있던 카페에 가보기로합미다 ㄱ ㄱ 망원동 비전스트롤 버터푸딩의 사진을 봐버려서 와벌임 다행히 족굼만 웨이팅을 하고 들어감니다 아까 느끼한걸 잔뜩먹었으므로 아뭬리카노로 균형을 맞춰봅니다 오랜만에 시콤한 아메리 버터푸딩 영.접☆ 달코~~~옴하고 쵹쵸옥한 따듯한 초코크로와상에 바닐라아이스크림은 진리입니다bb 쓰페셜 디저트로 뙇 먹기 좋았다 씌원하게 아메리카노 마시면서 멍때리면서 칠링..멀리못가도 이게어디야하면서... 맞은편뷰가 [ 최고의맛 - 수제돈까스 ] 집이어서 한동안 돈까스병에 걸렸던 두에세이였다;; 다시 연남동으로, 버바나 너무 코앞이라서 되려 까먹고 안가보다가 신뢰하는 먹선생님의 제보를 받고 드디어 와보았다 버바나클래식버거/ 와사비새우버거(20개한정이었다) / 치킨앤프라이즈 이릏게 시켜보았다 먹을줌비완료☆ 아니 코 앞에 일케 맛있는 버거집있었는데 외때무네 이제껏 외면했쥬?? 8ㅁ8 눙물흘리면서 허버허버 먹었다는 이야기 클래식버거에 깔려있는 데미그라스쏘스같은거도 미쳐벌이고(감자찍먹하면 죽음) 사진에 감자가 왜소해보이지만 그릏지않고요 빵 춐춐/쫀득하구여 쉑쉑버거보다 맛있는 너낌*_* 올만에 햄버거먹고 배좀 뚜두렸숩니다 와사비새우버거사고 ㅊa가서 밀티 텤아웃해서 먹기로 행벅한 계획을 세워두었숩니다♥ 내용물완죠니실해벌임! 집 코앞이지만은.. 기분은 어디 비치 파라다이스.. 잊지말기로해여★ 어서어서 [ 곰돌이레쓰고파리 ] 할 그날을 기다리며.. 언젠가..오..겠..쥬..?! ciao 치즈방앗간사러갔다가 빵터져벌임. 작명쎈쓰 굿자비★"
"'비전스트롤' , 오래도록 사랑받는 망원동 카페.","안냐세여 여러분 -! 오늘은 망원동의 터줏대감 같은 아주 오래도록 사랑받고 있는 망원동 카페인 '비전스트롤'을 소개해볼까합니다 ✨😊 요즘은 망원-합정 근처 카페를 정말 많이 다니는 데요 ! 이 비전스트롤은, 오며가며 자주 봤지만 늘 신상카페에 우선순위가 밀려서 못가다가 ! 근처 볼일이 있어서 겸사 겸사 커피한잔하면서 작업하고 왔어요 ! ☕ 비전스트롤 ★매주 화, 수요일 휴무 영업시간 : 오전 9시-오후10시 라스트오더 오후 9시 30분 주차공간 X 비전스트롤 서울특별시 마포구 망원로 61 1층 비전스트롤은 망리단길 근처에 있어서 망원동 주민 뿐만 아니라, 망원동에 놀러 오시는 분들에게도 꽤 유명하고 사랑받는 카페인데요 카페 하나가 오래도록 사랑받는다는건 요즘같이 카페 과포화 시대에 이유가 있는 거겠죠 ? 입구에는 깔끔하게 선반정도가 있는데 예전에 지나가면서 볼때는 카페가 아니라 소품샵인줄 알았어욬ㅋㅋㅋ 근데 알고보니 엄청 유명한 카페였다는 ! 비전스트롤은 아침에도 커피를 마실 수 있는 몇 안되는 카페인데요 ! 9시부터 오픈을 하신다니, 9시부터 밤 10시까지면 언제든지 갈 수 있게 열어두셔서 정말 좋은것 같아요 ✨ 막상 안으로 들어가려고 보니 엄청 서부적인 느낌이 강했던 ! 깔끔하고 심플한 느낌의 카페인 줄 알앗는데 완전 반전 분위기였어요 주문을 받으시고 간단한 디저트류 작업을 하시는 곳인데 주방이라고 따로 막혀있거나 분리되잇지 않앗어요 예쁨 예쁨✨ <메뉴판> 저는 또 2차 카페를 갈 예정이었어서 디저트류는 생략하고 아메리카노만 주문✔️ 알고보니 '버터푸딩'이라는 메뉴가 유명하던데 다음 기회에 ~~! 커피는 요기서 내려주시는 듯해요, 뭔가 아지트적인 기운이 팍팍 오네요 자주 가게 되면 다음엔 바에 앉아보겟슴댜 생각보다 많은 테이블 수, 6개정도 되는 것 같아요 매장크기 매우 적당 ✔️ 지금생각하니 사진을 마구 마구 찍고 잇어서 불편하셨을 것 같아요 ,, 하지만 내 블로그에 꼭 박제 해놓고 싶은 곳인걸요 .. 😭 다찌 테이블 위에는 귀여운 소품과 캔디류들도 있었어요 :-) 맥주사탕 아시는분 계시죠 ㅎㅎㅎㅎ 추억의 캔디 ~♥ 커피와 도착한 귀여운 코스터 가죽으로 되서 두툼하고 멋드러져요 ☕ 가죽 코스터 굿즈 정말 괜찮은데 ? 괜히 예뻐서 한번 찍어봤어요 😉📸 카페 조도도 따뜻하면서 아늑하구 음악두 정말 멋진 비전스트롤 잠깐 음악 감상하실분 🎶 스토리용으로 ..♥ 와이파이 패스워드는 입구 벽에 있어요 패스워드 보러갔다가 본 비전스트롤 굿즈들 ! 특이햇던게 커피 시럽도 있더라구요 ? 살까말까 삼백번 정도 고민햇어욬ㅋㅋㅋ 다음날 강릉을 갈 예정이엇는데 지인 사다주려구 고민하다가 끝내 못샀는데 살짝 아쉬네요 .. 처음 갔을 때는 손님들이 꽤 계셔서 못찍은 카페 내부 ! 마침 가기전에 손님들이 나가셔서 찍어봤어요 :-) 크기가 작지 않아서 친구와 이야기나누기에 부담스럽지않은 느낌 ?! 암튼 이번에 다녀오니까 왜 오래도록 사랑받는지 알겠더라구요 ! 분위기며, 커피맛이며 넘넘 좋앗슴미댜 저도 조만간 출근전에 커피 한잔 하러 한번 더 가려구욧 ! 힛, 그럼 모듀모두 즐거운 월요일 되시길 바라며 안냥~~~!"
"일상73) 공포의 임당검사, 망원동 즉석우동(놀면뭐하니), 비전스트롤, 레스피레, 소금빵 맛집","벌써, 26주차 임산부 👼🏻💛💛 디데이100일을 남겨두니 싱숭생숭 기분이 몽글몽글 하더라구요. 구래도!!!!!공포의 #임당검사 무사히 통과하고 , 기분좋게 포스팅 시작끄- 저번 주말 놀면뭐하니 재방을 보다가 남편이랑 급 끌려서 찾아온 이곳 #망원동즉석우동 #놀면뭐하니 어묵우동 & 돈까스 사진은 왜 이것뿐인지.. 가격대에 적당한 맛? 오랜만에 뭔가 포차에서 먹는 우동맛이라 반가웠다능 ◡̈ 그래도 저는 재방문 의사 ⭐️⭐️⭐️⭐️ 가성비듀 좋고 맛도 좋아서 다음엔 남편이랑 1인1우동과 서브로 돈까스를 시키기로 ㅋㅋㅋㅋㅋㅋㅋㅋㅋㅋ #망원동카페#소금빵맛집 망원동에 갔으니 소금빵 맛집 하나 들러주구요, #레스피레 빌라 사이에 있는 귀여운 저 빨간문이 요 카페에 포인트 인거 같아요 ㅋㅋㅋ 소금빵 맛집 답게 종류가 다양했어요 초코소금빵, 우유크림소금빵, 커스타드소금빵 등등 근데 저희는 12시 오픈 땡 갔어서 픽업예약 해두고 1시에 찾아가기로 했답니다. 직접 방문하면 소금빵 나오기전에 픽업예약 가능합니다! 뭔가.. 이거 무슨 느낌이지.. 유럽풍인가? ㅋㅋㅋㅋ 뭔가 아기자기 하면서도 귀여웠던 2층 공간 소금빵 5개 주문했더니, 요 귀여운 박스에 포장해 주시더라구요. 순서대로 소금빵/ 갈릭소금빵 커스타드소금빵/우유크림소금빵/초코소금빵 짭짤한 소금빵에 커스타드 크림은.. 말모말모 💛💛⭐️💛💛 제가 원래도 커스타드를 좋아하지만 크림 듬뿍 너모 맛있어요!!!!!꼭 드셔보시길 오래전부터 넘나 가보고 싶었던 곳 #비전스트롤 간판이 없지만 도로변에 있어 찾기 쉽더라구여 월요일 12:30분쯤? 방문했는데 딱 한테이블 남아있더라구요.ㅋㅋㅋㅋㅋㅋ 인기 짱많오 디카페인 있어 넘나 행복한 #임산부 롹스타일에 노래가 나오면서 뭔가 밴드느낌이 직원분들로 가득한 이곳 ㅋㅋㅋㅋㅋㅋㅋㅋ 호두의 태동도 심상치 않았던 이곳 ㅋㅋㅋㅋㅋㅋㅋㅋ롹좋아하니? 호두야? 너무 먹어보고 싶었던 #블루베리갈레트 바삭한 파이지에 블루베리콩포트와 크림이 가득! 파이지가 좀 더 두툼했음 맛있었을거 같은 아수움이 있지만 그래도 새로운 디저트를 먹어봐서 만족끄- 디카페인 커피는 산미가 은근 있더라구요? 산미 있는건, 라떼로 먹어야 꿀맛인데 ㅠㅠㅋㅋㅋㅋㅋㅋㅋㅋㅋㅋㅋㅋㅋ이날따라 아아를 마셔서.. 이렇게 산부인과 검진을 핑계로 평일에 남편과 데이트하는 낙으로 보내는 임산부, 재택근무로 밖에 나갈일이 많지 않아 우울하지만 날도 이제 슬슬 풀리니 열심히 산책도 다니고 출산을 위한 준비를 열심히해야겠오요!!!! 모두들 Good bye-"
