url,title
https://blog.naver.com/k_daramgee/222833234491,도란도란 이야기 나누기 좋은 성수동 카페 누아흐(nuah)...
https://blog.naver.com/wisemong/223158641923,"성수동 까페 누아흐 디저트, 음료 다 맛있어요. 조용해서..."
https://blog.naver.com/dssa1020/222645530192,성수동 카페) 아늑하게 쉴 수 있는 카페 누아흐
https://blog.naver.com/didwls68/223117877678,[누아흐] 성수동 뚝섬역 카페 분위기 좋은 카공 몬드크림라떼...
https://blog.naver.com/j_salience/223054769051,[뚝섬역카페] 누아흐 l 분위기 좋은 조명맛집 성수동카페
https://blog.naver.com/vivalavida_kr/222808498599,성수동디저트카페... 맛에 반했던 뚝섬역카페 [누아흐]
https://blog.naver.com/muam_e/222845831739,뚝섬역 카페 누아흐 아늑한 성수동 주차가능카페 솔직후기
https://blog.naver.com/easysun31/223149996497,[성수동 얼그레이쉬폰케이크가 맛있는 감성카페]누아흐 카페
https://blog.naver.com/ghdudaksm/222685624335,( 성동구카페 ) 성수동디저트카페 누아흐 ♡
https://blog.naver.com/pinks2rose/222692638783,[맛집] 따뜻하고 포근한 분위기의 성수동디저트카페 누아흐
https://blog.naver.com/rvd_romi/222727731793,[성수동카페/성동구디저트카... 에이드가 맛있는 누아흐nuah
https://blog.naver.com/sunkyeong94/222769627620,성수동디저트카페 쉬면서 힐링하기 좋은카페 누아흐
https://blog.naver.com/bzzi29/222689204090,성수동 디저트카페 누아흐 ◡̈
https://blog.naver.com/vhals0302/222605077124,성수동 디저트카페 뚝섬역 누아흐 Nuah
https://blog.naver.com/todaysdiary-u_u/222766511062,성수동 데이트코스로 좋은 뚝섬역 주차가능카페 누아흐
https://blog.naver.com/hw9307/222695112373,성수동데이트 서울데이트 예쁜카페추천 [누아흐]
https://blog.naver.com/sssus1004/222663972446,성수동 디저트 카페 누아흐
https://blog.naver.com/life-tam9/223092986946,성수동 뚝섬역 카페... 피치블랙티 바스크치즈케이크 누아흐
https://blog.naver.com/lawyerd/222606635657,"후기 #누아흐 감자에그샌드위... 어글리쿠키, 성수동 디저트..."
https://blog.naver.com/totonana91/222663169688,성수동디저트카페 누아흐 nuah * 성수데이트코스 성동구카페...
https://blog.naver.com/dlstudl/222598059637,뚝섬역카페 누아흐 헛개차 아메리카노 구수해~ 성수동카페
https://blog.naver.com/sunghee147/222628143104,[뚝섬역 카페] 누아흐_디저트가 맛있는 성수동카페/ 디저트 맛집...
https://blog.naver.com/cocos2_/222630258993,"뚝섬역카페 누아흐, 숨은 성수동디저트카페가 여기네요:)"
https://blog.naver.com/ohyurim0807/222661379112,"성수동 1가] 성동구 카페, 성수동 디저트 카페 '누아흐nuah'"
https://blog.naver.com/parkwing1988/222741260690,성동구 성수동디저트카페 또가고픈 누아흐
https://blog.naver.com/seungttoo/223183196863,성수동 따뜻한 분위기의 감성카페 누아흐 음료 종류
https://blog.naver.com/dustnr0829/222758899812,성동구카페 누아흐 커피와 디저트가 맛있는 성수동디저트카페
https://blog.naver.com/simji0520/222607216995,"성수동카페 누아흐 nuah, 아늑한 공간이 좋은 디저트카페."
https://blog.naver.com/dfdoong/222812676404,성수동디저트카페 누아흐 분위기좋은 성수동카페 성수동데이트
https://blog.naver.com/berry320/222579508271,성수동디저트카페 카공하기 좋은 누아흐
https://blog.naver.com/eunchelinguide/222841517868,성동구카페 누아흐 무료주차 가능한 성수동 카페
https://blog.naver.com/zi0_175/222821085211,[성동/뚝섬] 성수동디저트카페 누아흐의 꾸덕한 쇼콜라케이크와...
https://blog.naver.com/jdaeun96/222574197333,성수동디저트카페 뚝섬역 누아흐 샌드위치도 맛있네
https://blog.naver.com/dldbrud260/222577152897,[성동구카페] 성수동디저트카페! { 누아흐 }
https://blog.naver.com/mysky239/223057131639,"누아흐 (성수동 카페, 뚝섬역 인근)"
https://blog.naver.com/ojojoojj04/223103876501,성수동 카공하기 좋은 카페 추천! '누아흐'
https://blog.naver.com/llllstyle/222454452433,뚝섬역 성수동 카페 누아흐 디저트도 맛있어
https://blog.naver.com/leena21/222487939760,디저트가 맛있는 뚝섬역 카페 성수동 누아흐
https://blog.naver.com/lim_edu/222491676181,성수동 카페 누아흐 추천메뉴
https://blog.naver.com/soniakang/222606204221,성동구카페 누아흐 성수동에서 맛있는 디저트
https://blog.naver.com/hellojyb/222385748385,"새로 오픈한 뚝섬카페, 누아흐(nuah) #성수동카페 #디저트맛집..."
https://blog.naver.com/sosmall77/222502391104,뚝섬역 카페 누아흐 디저트 잘하는 성수동 신상카페
https://blog.naver.com/ydy5061/222432412974,성수동 카페 누아흐 어글리쿠키 짱짱맛 분위기 짱짱맨
https://blog.naver.com/torikyom77/222582748921,성동구카페 성수동디저트카페 누아흐 :)
https://blog.naver.com/gmldi216/222495961480,"누아흐(Nuah) 뚝섬역 카페 , 성수동 분위기 좋은 디저트 카페!"
https://blog.naver.com/loveeunzi/222831632371,"있는 무료주차 가능한 성수동디저트카페, 누아흐 (with 고양이)"
https://blog.naver.com/icecream0908/222457016239,뚝섬 누아흐 / 디저트부터 분위기까지 다좋아 성수동카페추천
https://blog.naver.com/billjang9/222425883593,서울 뚝섬역 성수동 쿠키 맛집 카페 / 누아흐
https://blog.naver.com/nuniw/222402163887,성수동신상카페 뚝섬역디저트카페 누아흐 달달하네
https://blog.naver.com/aepun2/222639396243,"성수동 뚝섬역 핫플 추천, 주차 가능 카페 누아흐"
