url,title
https://blog.naver.com/ittravel/223255742805,성수 과일모찌 맛집 성수동 수제모찌 후기
https://blog.naver.com/clara_wink/223261266810,샤이니 키가 먹던 쫀득 달달 성수동 수제모찌 포장 후기
https://blog.naver.com/hwangham/223065245042,뚝섬역 디저트카페 쫄깃상큼 참을 수 없는 성수동 수제모찌
https://blog.naver.com/gyubin0804/222916534534,성수동수제모찌 그냥 지나칠 수 없지
https://blog.naver.com/choiwoon787/223072156111,[서울숲역] 성수동 핫플레이스 딸기모찌 맛집 /성수동 수제모찌
https://blog.naver.com/falsoyong2/223044298803,생과일모찌 찾을땐 성수동수제모찌
https://blog.naver.com/uuzz2/222921030265,"성수 | 성수동수제모찌, 생과일모찌 맛집, 서울숲 디저트"
https://blog.naver.com/blossomjinn/223113394191,성수동 수제모찌 : 성수동 디저트맛집 테이크아웃! 서울숲 과일...
https://blog.naver.com/yyoo0104/223065029524,성수동 수제모찌 디저트 _ 쫀득상콤달콤 오감만족
https://blog.naver.com/jinjoo3238/223120567689,성수동 디저트카페 수제모찌 포장 후기 : 답례품 / 피크닉 음식...
https://blog.naver.com/anamsalda/222916197603,성수동 모찌 맛집 수제모찌
https://blog.naver.com/feelpeople/223102535190,뚝섬역 디저트 맛집 성수동 수제모찌 선물용 간식
https://blog.naver.com/taetante/223058807520,다양한 과일의 '성수동 수제모찌'
https://blog.naver.com/seul9543/223064628835,뚝섬역 딸기모찌 맛집 성수동 수제모찌 냠냠
https://blog.naver.com/hahaha_1226/223050469148,매장에서 직접 만드는 생과일찹쌀떡 성수동 수제모찌
https://blog.naver.com/lizdoll/223068936965,뚝섬역 디저트맛집 성수동 수제모찌 취향저격 포장후기
https://blog.naver.com/gongsilc/223052611931,"생과일 모찌 딸기 추천, 성수동 수제모찌 맛있는 데다 친절하심"
https://blog.naver.com/ghddl8120/223104265482,성수동 수제모찌 내 돈 내산 후기
https://blog.naver.com/cys765600/223107443529,"딸기모찌 맛집] 서울숲 방문 전 준비하기, 성수동 수제모찌"
https://blog.naver.com/hojjj1020/223054815428,생과일모찌 성수동 수제모찌 쫀득 그 잡채 디저트로 추천
https://blog.naver.com/aloud50_/222997591304,성수동 성수동수제모찌 딸기모찌(딸기찹쌀떡)
https://blog.naver.com/sunsunhe0829/223103103865,성수동 디저트맛집. 선물로 좋은 성수동 수제모찌
https://blog.naver.com/baaaba/223227590210,뚝섬역 디저트 맛집 성수동 수제모찌 | 생과일 모찌:서울/성동구
https://blog.naver.com/yoonina8/222915555333,성수동 디저트카페 수제모찌로 수능대박 합격기원 응원
https://blog.naver.com/ksbeen0709/223060485232,[성수동맛집] 성수동수제모찌 딸기모찌중에 원탑!!
https://blog.naver.com/jiseul_ee/223189538907,성수 서울숲 디저트 포장 선물로 추천 #성수동 수제모찌
https://blog.naver.com/happynchic/222935210073,성수동 디저트맛집 서울숲데이트 간식으로도 좋은 수제모찌...
https://blog.naver.com/lsi6782/222922096067,성수동수제모찌 생과일 모찌 맛집으로 인정
https://blog.naver.com/en-escape/223101540611,"딸기모찌 맛집] 생과일 가득 들어있는 ""성수동 수제모찌"" 후기!!"
