url,title
https://blog.naver.com/2713s/223245405834,전시회같은 서울 신상 성수동이색카페 하우스 오브 지알 후기
https://blog.naver.com/all_day_sunny/223200055614,[하우스 오브 지알] 그레일즈... 성지가 될 성수동 신상 핫플
https://blog.naver.com/junsisi922/223213806790,하우스 오브 지알 HAUS OF GR 성수동 전시 카페 & 쇼룸...
https://blog.naver.com/ditonditto/223211074613,"패션과 문화를 아우르는 공간, 그레일즈의'하우스오브지알'"
https://blog.naver.com/kbu0292/223237515487,"231014 - 231015 가을일상 :: 해칭룸, 하우스오브지알, 솔솥..."
https://blog.naver.com/zunn_6/223198791459,"프리뷰, 하우스 오브 지알 오픈, 마티스더큐레이터 23fw..."
https://blog.naver.com/hongjb411/223199226580,하우스 오브 지알GR 그레일즈 성수동 서울숲 카페...
https://blog.naver.com/white_nine/223261029570,[성수 가볼만한곳] 성수맛집/성수핫플/브런치/이자카야...
https://blog.naver.com/sudarling1009/223196048236,그레일즈 쇼룸&카페! 성수동 서울숲 새로운 힙스터들의 성지
https://blog.naver.com/flowery_ak/223230006627,서울 성수동 브라운 래빗 서울숲점 | 성수동 핫해!
