url,title
https://blog.naver.com/ljo8308/223188370728,"주차장 있는 카페, 성수동 이색 디저트 카페 - 이트앤드링크"
https://blog.naver.com/superlamb1/223247084614,서울 성수동 성수역 디저트 카페 이트앤드링크 Eat and Drink
https://blog.naver.com/tjgl0626/223263090835,"성수동 카페, 이트앤드링크 eat and drink"
https://blog.naver.com/ns01136/223184607133,성수동 대형 디저트 카페 이트앤드링크
https://blog.naver.com/cheekesea/223033517411,넓고 휴식하기 좋은 성수동 강아지동반 카페 : 이트앤드링크
https://blog.naver.com/bom_e2/222948198574,"조용한 분위기의 성수동 대형 카페 ""이트앤드링크"""
https://blog.naver.com/hanseon216/223267234251,귀여운 디저트를 판매하는 카페 이트앤드링크 성수/[Eat And...
https://blog.naver.com/cmj9021/223277437088,‘초이로드’ EP.240-2 <성수동>편 *이트앤드링크
https://blog.naver.com/asl5751/222913182254,"[서울 성수동/성수옥 아궁지, 이트앤드링크, 보스코]10월..."
https://blog.naver.com/si_yeonny/223043663632,[성수동 카페] 케이크가 맛있는 이트앤드링크
