title,content
망원역/망원동/레터링케이트/당일 케이크/선물/위켄드케이크,"다음날 회사 친한분 생일이라서 케이크를 알아봤다 출근시간이 일찍이라서 전날 사야했음 파바나 뚜쥬말고 귀여운 케이크를 사고 싶었는데 보통 레터링케이트는 예약인데 당일에도 구매가능한 케이크가게가 있어서 굿잡!ㅋㅋㅋㅋ #위켄드케이크 망원파출소에서 응파이 방향으로 안쪽으로 쭉가면 노란색 스탠딩 철제간판이 있고 거기 뒤에가 바로 입구! 입구가 어둡고 자동 불이 안켜졌던 것 같아서 귀여운 철제간판에 비해 들어갈 때는 초큼 놀람ㅋㅋㅋㅋㅋㅋㅋㅋㅋㅋㅋㅋ 입구들어가자마자 보이는 케이크 진열장 위에 귀달린 동물친구들이 귀여워서 토끼로할지 강아지로할지하다가 반려동물 강아지가 있으니까 강아지로!! 결정 레터링 멘트는 현장에서 얘기하면 바로 작성해주심! 진열장 위에 저 귀여운상자에 담아주신다 상자가 너무 산뜻하고 귀여웠다 ㅋㅋㅋㅋ 그리고 맥주양초부터 다양한 초가 올려져 있다 입구에서 뒤돌면 소품이 있다!!귀여운거 한가득 있음 레터링이 써지는 동안 전혀 안심심했는데, 아주아중아주아주주줒 귀여운 강아지가 있어서 만지다보니까 시간 순삭 진열장 오른쪽이고, 뒤쪽으로 오픈 주방이 있다! 케이크는 25,000원이었다 (멘트: 00이는 좋겠다 우리랑 친구라서) 원래 랜덤케이크 18,000원짜리 사려고 갔는데, 내가 고른게 25,000원이었나보다!ㅋㅋㅋㅋ가격 확인도 안하고 그냥 고름 진열장에 있는 모든것이 18,000원인줄 알았음...ㅋㅋㅋㅋ 그래도 귀엽고 선물받은사람이 좋아해서 아주아주 만족 ♡♡♡♡ 강아지랑 같이 찍어서 보내줌 마침 강아지 옷도 초록색인데, 레터링을 초록색으로 써주셔서 타이밍 굿 !ㅋㅋㅋㅋ 원래 레터링 케이크 이런거 왜하는지 이해 못했는데, 이번에 좋아하는거보고 왜해주는지 이해 조금 했다!!ㅋㅋㅋㅋ 이런거 좋아하는 사람에게는 좋은 선물 같다 :) 아! 그리고 케이크 크기가 크지 않아서 좋은 것 같다! 맛은 못봤지만..! 맛있었겠지???!!!ㅋㅋㅋㅋㅋㅋㅋㅋㅋ 위켄드케이크 서울특별시 마포구 망원로2길 69 3F"
"망원동 레터링케이크, 위켄드케이크에서 쿼카케이크 선물받았어요 :)","위켄드케이크 서울 마포구 망원로2길 106 1층(망원동 396-10) 망원역 2번출구에서 688m 월,화 정기휴무 수~금 12:00 ~ 19:00 토,일 정보없음 포장, 반려동물동반, 국민지원금 남편 야간근무하는날 친구가 집에 놀러왔어요~ 친구는 회사 동료들이었는데 (정확히는 언니와 동생) 둘다 퇴사를해서 이제는 회사에서는 못보고 따로만나는 친구들이예요. 결혼식때 제 부케를 받아주기도 하고, 제일일찍와서 사진과 영상을 담아준 고맙고 소중한 친구들이예요. 원래 저 결혼식 하기전에 브라이덜샤워를 해주기로했었는데 코로나때문에 자가격리를 해야되서 무산되었거든요. 그게 마음에 많이 걸렸다며 케이크를 준비해왔더라고요. 항상 마음써주는 친구들이라 늘 고마운데, 귀여운케이크까지 ㅠㅠ 너무 감동이었습니다. 친구가 망원동에 위캔드케이크에서 주문제작해서 직접 픽업해왔다고해요! 가격을 물어보기가 ㅋㅋㅋ 좀 그래서 가격은 제가 모릅니다 ㅋㅋㅋㅋ 카카오톡 플러스친구 위켄드케이크에서 문의하시면 됩니다. ▼ https://pf.kakao.com/_CxkQxls 위켄드케이크 망원동에 위치한 귀엽고 맛있는 케이크- 가게 입니다 pf.kakao.com 행복한 쿼카가 케이크를 먹고있는 망원동 위켄드케이크 명함. 망원동 레터링케이크 위켄드는 언제나 가장 신선한 재료를 사용한다고해요~ 수제 제누와즈, 키리쉬를 이용한 수제시럽과 100% 동물성 생크림과 신선한버터, 필라데피아 크림치즈, 앵커버터로 만들어져 풍미가 아주 좋답니다. 보존제가 없어서 냉장보관을 해야해요. 냉장보관은 최대3일까지 가능한데 저희는 하루만에 다 먹었답니다 ㅋㅋ ㅠㅠㅠ제이름처럼 따뜻하고 행복하길 바래주는 친구들의 마음에 정말 감동받았어요. 그리고 쿼카 케이크 너무 귀엽지않나요... 결혼식때 저처럼 왕관을 쓰고있네요 ㅋㅋ 저왕관은 꽤 묵직했어요! 예뻐서 버리지않고 잘 보관해뒀답니다 :) 망원동 레터링케이크 위켄드케이크 레터링케이크는 처음인데 정말 귀엽고 뽀짝뽀짝 하더라고요. 셋이서도 사진찍고 놀았는데, 친구들 초상권이 있으니까 사진은 제얼굴만 올릴게요 ㅋㅋㅋㅋㅋ 큰 초가 하나들어있었는데 초도 예쁘더라고요. 잔인하게 쿼카 머리통에 꽂아주었어요 ㅋㅋㅋㅋㅋㅋㅋㅋㅋㅋㅋ 찐 행복 귀부분은 설탕같던데 저는 너무달아서 맛없었어요 ㅋㅋㅋㅋㅋㅋㅋㅋㅋㅋㅋㅋㅋㅋㅋ 저 귀를 고정해주는 이쑤시개 같은게 들어있어서 먹을때 주의해주세요! 픽업해온 친구에게 주의사항을 다 말해주셨어서, 먹을때 빼고 안전하게 먹었습니다. 안에는 초코랑 크림이 들어있었는데, 엄청 부드럽고 폭신하고 달콤하고 맛있었어요!! 엄청 달지않고 적당히 단맛이 커피나 우유랑 먹기 딱 좋았습니다. 맛있다 맛있따 하면서 먹었어요~ 표면(?)은 설탕으로 만들어진거같던데 역시 좀 많이 달았습니다. 훼손하기 뭔가 미안한 쿼카의 웃는 얼굴을 제외하고 밤새 수다떨면서 케이크를 다 먹었어요. 귀부분빼고는 다 너무너무 맛있었습니다 :) 레터링케이크는 예쁘게 보여지는게 중요하다보니까 맛이 그저 달기만 할거라고 생각했는데, 정말 맛있더라고요 :-) 크기는 앙증맞았는데 은근 양이 많았어요~ 셋이서 맛있게 잘 먹었답니다. 곰돌이가 쓰고있던 왕관은 깨끗하게 닦아서 에그라이트 위에 안착! ㅋㅋ 위켄드케이크 서울특별시 마포구 망원로2길 106 1층"
"망원동(위켄드케이크, 파이브테이블즈, 이나피스퀘어X비믹스 팝업스토어)","지인언니 사무실 놀러가기로 해서 오랜만에 #망원동 여기 예쁜 카페도 많고 동네분위기 넘 죠타! 위켄드케이크 서울특별시 마포구 망원로2길 69 3F 우선 사무실 오픈 축하를 위한 레터링 케이크를 미리 주문 했었다. 위켄드케이크 인스타 미리 주문해 놓은 위켄드케이크 픽업. 여기는 동물모양 케이크가 시그니처인듯! 특히 저 병아리 넘 귀엽ㅠㅠㅠ 좁은 계단을 따라 3층으로 올라가다보면 위켄드케이크 포스터를 찾아볼 수 있음! 우리는 참새 케이크가 필요했기에 참새로ㅋㅋㅋㅋㅋㅋ위켄드케이크의 다양한 레퍼런스 이미지 중에서 참새는 아쉽게도 없었지만 알아서 예쁘게 해주시리라 믿고 주문했는데 넘 귀요운 참새가 탄생했당!ㅎㅎ 첫 주문이면 바닐라시트+바닐라크림이 대표 맛이라고 해서 그걸로 주문했당 - 미니는 넘 작을 것 같아서 미듐사이즈(15cm)로 업했고(가격은 50,000원) 맛은 안먹어봐서 모르겠지만 후기는 좋더라! 레터링 케이크에 레터링 글씨체도 귀여우니 만족스러웠다 - 파이브테이블즈 서울특별시 마포구 망원로6길 19 식사는 망원동 파이브테이블즈. 원래 가려고 했던 곳은 예약이 꽉차서 지나가다가 발견하고 들어간 곳이었다. #마르게리따 #봉골레 #닭가슴살구운야채버섯 #와인바틀 요렇게 주문했는데 전체적으로 양이 넉넉했다. 1인이 운영하는 식당이었는데 우리 테이블밖에 없어선지 음식도 생각보다 빨리 나오고 맛있었당- 낮술ㅋㅋ 후식도 주신 복숭아 요거트도 넘 맛있었음! 지나다가 INAP X Bmix (이나피스퀘어 X 비믹스)에서 콜라보하고 있는 팝업스토가 있어서 구경했는데 가격도 부담스럽지 않고 빼뚤때뚤한 그림체가 넘 졸귀ㅋㅋㅋㅋ모야모야 이거시 콜라보의 힘인가! 내가 원하는 큰사이즈도 디자인이 다양했으면 좋았을텐데- 작은 탁상용이 훨씬 디자인도 많고 아담하니 귀여웠다. 마침 딱 오늘까지 팝업기간이라고 함! 커퍼시티 서울특별시 마포구 동교로 48 1층 마지막으로 커퍼시티에서 커피한잔씩 하고 저녁먹기 전에 귀가! 여기도 짱 친절쓰- 망원동 가게들 넘 예쁘고 친절하시고 퀄리티도 좋고 넘 매력있는 동네 :)"
"서울 망원동 : 카페나하, 크레타마켓, 위켄드케이크, 모을, 이치젠, 비전스트롤","망원동에 간다면 ? 추천 도장 꽝 #카페나하 전부터 망원 맛집 후보에 있던 곳을 드뎌 방문했다 ! 오므라이스 + 돈가츠 조합은 많이 느끼할까봐 오므라이스 + 시오소바 조합으로 택 ! 오무리 아주 보들보들 데미그라스 소스 조합 아주 꾿이구요 시오소바 간 딱 좋고 새우가 통실통실 맛있었음다 요거 먹구 1층에 제로퍼제로 구경하면 딱임. 카페 나하 서울특별시 마포구 희우정로16길 32 2층 #크레타마켓 요즘 아아앙아주 핫한 크레타마켓. 온라인 스토어에서 바닐라시럽 구매 하려고 했는데 품절이 너무 빨라서 그냥 매장에 와버렸음다. 그래놀라, 바닐라시럽, 타르타르소스 외에도 맛있는 거 투성이라 조심하십쑈. 지갑조심 ! 나중에 선물할 일 있다면 꼭 여기 기프트 세트 할꺼다 굿 @ 바닐라 시럽 아주 고급지고 맛있는데 진하지 않아 많이 넣게되유 양이 훅훅 줄어서 여러개 사도 좋을 거 같움 @ 타르타르 소스 식빵+오이 조합에 먹음 맛있다길래 해먹으려고 대기 중 크레타 마켓 서울특별시 마포구 망원로2길 69 1층 #위켄드케이크 하,,진짜 우연히 지나가다가 봤는데 쇼케이스에 이 친구가 혼자 있는거여요,, 너무 구여워서 델꼬가야지 어케 당일케이크는 문구 바로 써주십니다 ! 크기도 딱이고 맛도 있고 하 사장님도 친절하시구 생일용품도 구매 가능한 곳 진짜 추천이야요,,최고야 위켄드케이크 서울특별시 마포구 망원로2길 106 1층 #모을 여긴 정말 나만 알고싶다. 모르면 그냥 지나칠 곳이다 3층이구 올라가면서도 여기가 맞아 ? 싶었는데 정말 너무 좋은 곳,, 카페에서 과일이라 생소한 조합이오나 아주 좋다는 거 마실 메뉴는 여러 종류의 핸드드립과 티 이 조차 마음에 들고 맛도 좋았다는 거 사장님도 너무 친절하시고 조용한 공간이라 혼자 가서 조용히 책을 읽기도 너무 좋을 거 같다. 모을 서울특별시 마포구 월드컵로19길 71 3층 #크로우캐년 망원오면 꼭 한번 들리는 곳인데 참나 한번도 못 만났던 민트 마블이 있다요 ? 옐로우 요거트볼, 핑크 플레이트, 베이비블루 숏텀블러도 있었다 너어무 고민했지만 집에 있는 친구들을 생각하며 내려놓았네,, 크로우캐년홈 쇼룸오피스 서울특별시 마포구 희우정로21길 9 1층 #이치젠 망원동에서 제일 많이 먹은 밥집이 아닐까 이치젠 텐동 주문하면 정말 배부르게 잘 먹는다. 텐뿌라 조합이 넘 젛아요 최애는 가지랑 새우 ! 맛잘알 이치젠 토마토바질은 꼭 하나 시켜서 반은 식전에, 반은 식후에 먹기 @오후타임은 5시30분 시작이고 5시부터 웨이팅 리스트 작성 가능합니당 이치젠 서울특별시 마포구 포은로 109 101호 #비전스트롤 초코푸딩이 유명한 곳이나 너어무 배불러서 커피만 마셨다는 ㅎ 낮에는 햇살이 촥 들어오고 밤에는 이렇게 분위기가 좋답니다 어두운 거 좋아하는 새럼 여기 ~! 여기 두번째 방문인데 정말 커피는 맛있는지 잘 모르겠구,, 디쟈트가 맛있음요. 비전스트롤 베이크샵 서울특별시 마포구 망원로 61 (망원동) 이 외에도 망원동엔 카페가 무지 무지 많구요. 웜그테 쇼룸, 소품샵 수바코, 604서울, 망원시장 등등 너무 좋은데 가는 교통편이 좋지 않아서 하루 종일 있다가 오는 편 ! **내돈내먹"
망원 위켄드케이크 (Weekend Cake)ㅣ망원동 레터링케이크 포토케이크ㅣ망원동 주문케이크,"4월에 태어난 욱이 생일을 맞아 ✨ 이곳저곳 레터링 케이크 주문할 곳을 찾아보다가 발견한 위켄드 케이크. 위켄드케이크는 레터링 뿐만 아니라 귀여운 캐릭터의 모양, 포토케이크까지 다양하게 디자인을 고를 수 있어서 선택의 폭이 넓었다. 결정을 잘 하지 못하고 이것도 저것도 다 하고 싶은 맥시멀리스트의 나이기에 내 선택을 잘 들어주실 것 같았다 (,,) 그래서 여기다! 라고 생각하자마자 바로 위켄드케이크 카카오톡으로 주문을 했다. 포토케이크를 원하면 미리 사진을 보내면 되고, 포토케이크가 아닌 일반 크림 케이크라면 원하는 디자인과 색상을 말씀 드리면 최대한 맞춰 주신다. 시트와 크림을 선택하는 곳에서 고민을 많이 했다. 라즈베리를 좋아하긴 하지만 케이크에 들어간 베리류는 별로 좋아하지 않아서 고민에 고민을 거듭한 끝에 초코시트와 바닐라 크림으로 결정! 그리고 디자인은 화려한 것보다 최대한 깔끔하게 하고 싶었다. 괜히 화려하기만 하면 먹기 아깝고,, 또 먹기 아까울 까봐,, 🥲 그래서 쨍한 레드컬러를 케이크에 두르고, 간단한 포인트를 주기로 했다. 그렇게 주문을 하고 드디어 기다리고 기다리던 픽업 날! 위켄드케이크는 망원동, 망원파출소 옆에 있는 하얀색 건물 3층에 있다. 집 근처여서 지나가다가 보기는 했지만 케이크집이 있는 줄은 몰랐는데 새로운 발견 ✨ 관심을 갖고 찾아보니 그제서야 보이지 않았던 입간판도 보인다. 노오란색으로 귀엽게 쓰여져 있는 위켄드케이크 입간판 🍋 3층으로 계단을 올라가는 중간중간 위켄드케이크의 귀여운 포스터가 붙여져 있다. 캐릭터들 입가에 케이크 크림이 묻어 있는 게 너무 귀엽다. 3층으로 가서 위켄드케이크의 유리문을 열면 케이크 쇼케이스와 그 위에 귀여운 초들이 반긴다. 초만 봐도 가슴이 몽글몽글 해지는 게 생일 주인공이 아닌 챙겨주는 사람인데도 너무 기분이 좋아진다. 들어가자마자 활기차게 인사해 주시고 친절하게 내가 필요한 것들을 물어봐 주셔서 엄청 빠르게 픽업 완료! 위켄드케이크의 분위기는 모든 피규어들과 소품 하나하나 너무 귀엽고 아기자기했다. 사진 안 찍으려고 했는데 너무 귀여워서 찍을 수 밖에 없을 정도 🤍 쇼케이스 뒤에서 계속해서 다른 케이크들을 만들고 계시고 앉을 수 있는 자리는 없어서 피규어들이랑 초들 구경만 룰루랄라 했다. 위켄드케이크에서는 주문 제작하는 케이크 뿐 아니라 당일 판매하는 케이크도 항상 기다리고 있다. 당일 구매할 수 있는 케이크 디자인들도 너무너무 귀엽다,, 고양이, 강아지 귀가 달린 케이크들도 있고 노란 병아리와 꽃이 달린 핑크 케이크까지 💜 조각 케이크 5,500원 스몰 케이크 10,000원 미듐 케이크 33,000원 라지 케이크 45,000원 곰도리 케이크 25,000원 미리 카카오톡으로 주문한 나는 바로 픽업을 할 수 있었다. 미니 사이즈여서 케이스도 미니미니 한 게 너무 귀엽다. 케이스 사이로 살짝 보이는 하트를 닮은 빨간색 케이크 ❤️ 벌써부터 설렌다 💭 마! 이게 내 마음이다! 짜라란 ❤️ 주문한 레터링도 너무너무 예쁘게 나와서 정말 너무 만족스러웠다. 중간에 문구도 한 번 바꿨는데 항상 친절하게 해주셔서 너무 감사했다. 화려하게 하고 싶진 않아서 쨍한 레드 컬러에 심플한 프릴 레이스로 포인트를 준 게 너무나도 만족스러웠다. 분홍색 프릴에 빵빵한 하트까지 너무 마음에 드는 케이크 ❤️ 욱이도 너무 예쁘다고 해서 너무 만족스러웠다. 💐❤️ 아이 예뽀라 초코시트 사이사이로 바닐라 크림이 듬뿍 들어가 있어서 전혀 퍽퍽하지 않았다. 케이크의 겉 (빨간색 부분)은 크림치즈이고, 크림도 달지 않고 깔끔한 바닐라 크림이어서 단 음식을 즐기지 않는 욱이도 부담 없이 먹을 수 있었다. 🌸 위켄드 케이크 wee kend it🙃 망원동케이크(@weekend__cake) • Instagram 사진 및 동영상 팔로워 10K명, 팔로잉 24명, 게시물 686개 - 위켄드 케이크 wee kend it🙃 망원동케이크(@weekend__cake)님의 Instagram 사진 및 동영상 보기 www.instagram.com 위켄드케이크 서울특별시 마포구 망원로2길 69 3F"
가족들과 두돌 생일파티 :) 뽀로로 치치포포 기차놀이 + 망원동 위켄드케이크,"안녕하세요? 23개월 딸을 키우고 있는 볼탱탱이맘입니다. 이번 주말은 볼탱탱이 두돌을 맞이하여 가족들과 조촐하게 생일파티를 했답니다. LA갈비, 잡채, 치킨텐더 샐러드, 미역국을 만들어 밥을 간단하게 가족들에게 대접했어요. 그리고 이모가 망원동 위켄드케이크에서 볼탱탱이가 좋아하는 토끼 모양 케이크를 주문해왔어요. 너무 예쁘죠? 바닐라 시트에 복숭아퓨레 그리고 크림치즈가 들었어요. 가격은 25,000원이랍니다. 수수팥떡은 외할머니 콩 백설기는 친할머니께서 해주셨어요. ^^ 생일 축하 노래도 하고 촛불도 불어요. 책을 보며 수없이 연습하던걸 실제로 해보는 볼탱탱이예요. 그리고 볼탱탱이가 제일 좋아하는 뽀로로 치치포포 기차놀이를 선물 받았어요. 포장을 뜯고 뽀로로가 보이니 우아~~우아~~ 뽀로로~~ 하면서 너무 좋아했어요. ^^ 역시 뽀통령이에요. 바로 뜯어서 갖고 놀았답니다. 할머니들이 생일선물로 용돈도 주셨지만 볼탱탱이에게는 뽀로로 기차놀이가 최고였어요. 모두 집으로 돌아간 후에도 볼탱탱이는 밤늦도록 뽀로로 기차놀이를 했답니다. 볼탱탱이가 너무너무 좋아하는 뽀로로 기차놀이에 단점이 있었으니 기차끼리의 연결고리가 너무 잘 빠진다는 것.. 탈선을 너무 잘한다는 것.. 그리고 너무 시끄럽다는 것.. 이렇게 주말 동안 볼탱탱이의 두돌 생일파티를 무사히 끝냈답니다. 앞으로도 예쁘고 건강하게 쑥쑥 커주길♡ 엄마 말 잘듣고!! 다음날 볼탱탱이와 함께 짐보리 스틱오와 뽀로로 빙글빙글 노래방장난감을 활용해 뽀로로 동산을 만들어 보았어요. 그럴듯 하죠? ^^ #두돌생일 #두돌생일파티 #집에서생일파티 #세살생일 #망원동케이크 #위켄드케이크 #뽀로로장난감 #뽀로로치치포포기차놀이 #뽀로로기차놀이 #생일상차리기 #생일음식 #수수팥떡 #백설기 #짐보리스틱오 #스틱오"
[망원동 케이크] 당일 구매 가능 귀여운 / 위켄드케이크,"연말에 주문한 레터링케이크 세 곳 다 맛도, 가격도, 디자인도 예뻐서 남겨봅니다.! (가격은 디자인에 따라 상이 할 수 있으니 직접 문의가 가장 좋아요.) 위켄드케이크 먼저 처음은 위켄드케이크 🎂 당일에 받을 수 있고 레터링까지 되는 곳을 찾아보다가 인기가 많아 예전에 못했던 기억에 혹시~? 하는 마음으로 연락 드렸는데 된다고 해서 바로 주문을 한 곳입니다. 위켄드케이크 망원동 레터링케이크 귀여운 포스터 망원동은 망원시장이 있어서 좀 복잡하지만 2번 출구에서 10분 내외에 있어요. 합정과 망원 사이인데 망원역이 더 가까워요. 3층에 위치하고 있는 위켄드케이크 픽업☑️만 가능해요. 도착 도 착 설렌다 위켄드케이크 당일 픽업과 레터링이 가능하다고 직원 분이 알려주시고 디자인을 보내주시는데 그 디자인 안에서 레터링 문구가 가능해요. 동물이나 단색 원형 디자인이 있었는데 심플하게 하고 싶어서 단색과 테두리에 꽃이 있는 걸 고민하다가 꽃은 그새 예약이 되어버려서 다음 예쁜 디자인으로 골랐어요.! 예약자 확인하고 보여주시고 포장 완료 포장예쁨 포장 박스 너무 귀여워요. 받으니 케이크도 만족😆 위켄드케이크 다음엔 포토케이크 해 보고 싶더라구요.! 오픈 친구들과 저녁 먹고 오픈 옆에 디자인도 조금씩 해주셔서 감동 작은 케이크라 밑에 고정틀이 없어 조심해야 합니다. 조명이 살짝 어두웠지만 그래도 빛나는 우리의 노랑이 2023년 레터링케이크 도시락 상자에 들어가는 케이크 보다는 조금 큰 사이즈예요. 식사 후 디저트로 먹는다면 1-3인용까지도 조금 커버 가능한 그런 크기 연말 케이크 2023 We'll be happy ever after 우리는 영원히 행복할거야 연말모임의 첫단계는 케이크라우 우리의 행복을 바라며🌟 소원을말해봐 올해는 우리 더 웃고 행복하고 기뻐하자.🫶 예쁘다 소원들어주세요 당일이었지만 연말 분위기도 제대로 내고 친구들도 좋아해서 반나절만에 준비한 이벤트 성!공! 사이즈도 가격도 괜찮았고 당일이라 조마조마하는 마음으로 문의를 했는데 응대가 빨라 편했던 것 같아요. 감사합니다~! 맛은 크림치즈와 초코시트와 바닐라크림 크림치즈가 꾸덕했답니다. 기도합니다 아멘 우리 모두 2023년 행복합시다.🙏🏻 문의는_카카오톡 위켄드케이크 위켄드케이크 서울특별시 마포구 망원로2길 69 3F"
