title,content
망원동 일본감성 가득한 티노마드모리에서 따뜻한 저녁식사 후기🍵,"추운 겨울의 어느날, 지연언니가 링크를 보내왔던 #티노마드모리 ! 티노마드를 여름에 다녀오고 ~ 티노마드모리? 이번엔 교토느낌의 음식점 컨셉이었다! 당장 좋아! 를 보냈고 언니가 예약을 해주었다 (하트) 프토프토프토 가 유행인 요즘~ 우리가 가고 싶었던 조앤더슨은 너무 유명해졌고~ 상수에 음오아예를 갔지만 솔드아웃이었고~ 주변을 검색해보니 가까운곳에 #상수비하인드 #비하인드카페 에 프렌치토스트를 판매중이어서 사이좋게 하나씩 주문해서 먹었다 ㅎ-ㅎ 다음엔 꼭 조앤더슨을 포스팅 할 수 있길 티노마드 모리 인스타로 봤을때부터..너무 기대가.. 티노마드 모리 서울특별시 마포구 망원로2길 19 비동 1, 2층 마을버스를 타고가서 그렇게 오래 걷지 않고 도착할 수 있었다 ㅎㅎ 저녁 7시 예약이었지만! 조금 빨리 도착하는걸 추천드려요 그래야 앉고싶은 자리에 앉을수있는(?) 입구부터 일본에 온것만 같은 분위기가 넘친다 1층이라 더 그런듯한~? 들어가자 보이는 큰 화면.. 누구 아이디어이신지.. 정말.. 마치 숲속에 들어와있는 느낌을 연상케하더라구요 이렇게 한참을 서서 화면을 감상했어요 화면 바로앞에 둥글게 세팀정도 앉을 수 있는 테이블이 있었고! 입구 바로 옆쪽으로 밖을 바라볼 수 있는자리! (여기는 혼자와도 좋을 것 같더라구요) 이렇게 안쪽으로는 좌식자리가 두 개 있더라구요! 이미 먼저오신 분들이 앉아계셔서 ! 고민고민하다가 하나 남은 좌식자리에 앉았답니다. 그렇게 메뉴판을 .. 분명 야끼우동을 후기에서 봤었는데 ㅠㅠ 출시예정으로 바껴져 있어서 아쉬웠어요 저희는 2인 스키야키 나베 set B 를 주문하고 오니기리 명란마요, 크림치즈명란마요 둘 다 하나씩 주문했어요 지금보니 둘 다 명란마요네..? ㅋㅋㅋㅋㅋㅋ 음료는 스파클링 시소 모히토!! 기다리는 동안 한참을 바라 보고 또 보고 낮에 와도 좋을 것 같지만 언니말듣고 저녁에 오니 티노마드 분위기를 한껏 더 느낄 수 있어서 좋았어요 자리에서 따뜻한 물을 가득담아 계속 우려내서 마실 수 있는 호지차 추운날 식사 전 따뜻한 차 한잔은 몸을 녹여주니 좋더라구요 그렇게 스키야키 도착! (사실 처음먹어보는 1인) 조금 끓으면 다시 오셔서 뚜껑을 열어주십니다 ㅎㅎ 양파도 버섯도 고기도 가득가득한 스키야키! 양이 어마어마 하더라구요! 일본에 가서도 단 한번도 먹어본적이 없는데 티노마드모리에서 첫 도전인 셈이죠 ㅎㅎ 그때 귀여운 통에 오니기리 등장! 2단으로 주셨어요! 왼쪽이 명란마요 오른쪽이 크림치즈명란마요 언니가 뒤집어주는 스키야키~ 고기양이 어마어마해서 둘 다 너무 놀랬어요 먹어도 먹어도 줄지 않는 고기 같이 주신 미니두부..도 맛있었고 저의 최애픽이었던 명란마요오니기리.. 이렇게 맛있으면 다이어트못하즤 .. 정말 맛있어요 ㅎㅎ 둘 중 하나만 골라야 하신다면 명란오니기리 추천드립니다 :) 계란까지 풀어서 찍어먹어보니 고소하고 불고기 같으면서도 달달하고~ 스키야키 이런 맛이구나!? 먹어도 줄지 않은데 남기긴 싫고 ㅠㅠ 그렇게 먹던 중 받은 언니의 청첩장... 18년도 부터 지금까지 쭉 - 함께 하고 있는 우리 라서 그런지 청첩장을 받고, 여러가지 감정들과 함께 눈물이 왈칵 터져버렸다 우리 언니 결혼 진심으로 축하해 마지막은 티노마드에서도 먹었던 호지차 아이스크림으로 후식 호지차 아이스크림이요? 정말 맛있답니다 :D 티노마드 모리 꼭 추천드려요 그리고 화장실 밤에가면 조금 무서워요 다녀오시면 아실꺼에요 .. 여름에는 다른 메뉴를 하실것만 같은 곳 ! 여름에 또 가자 언니 (하트) Instagram의 티.노마드 모리 森(@t.nomad_mori)님 프로필 • 게시물 8개 팔로워 2,203명, 팔로잉 1명, 게시물 8개 - 티.노마드 모리 森(@t.nomad_mori)님의 Instagram 사진 및 동영상 보기 instagram.com #티노마드모리 #티노마드모리스키야키 #망원동신상맛집 #망원동티노마드모리 #망원티노마드모리 #티노마드모리예약 #망원동일식 #망원동일본가정식 #합정신상맛집 #맛집블로그 #서이추 #서이추환영 #망원동데이트"
"[언박싱 100일 챌린지] 망원동 카페 ""티노마드"" 방문후기/메뉴추천","요 며칠간 블로그가 너무 뜸했네요ㅠㅠ 바쁜 현생을 사느냐고 블로그를 잘 못했는데요 그래서 여기저기 다니다보니 '나중에 포스팅해야지!' 하고 찍어둔 사진들이 많아 정리할 겸 포스팅을 같이 하려고 합니다🥲 오늘은 맛있는 차와 디저트가 함께 있는 망원동의 ""티노마드""입니다 티노마드 영업시간 | 화~목 정기휴무 금 13:30 - 20:30 토 12:00 - 20:30 일 12:00 - 20:30 월 12:00 - 20:30 티노마드 서울특별시 마포구 포은로 112 2층 예약 일주일에 4일만 운영되는 곳이니 꼭 날짜 확인하셔야하고 예약제로 운영되어 시간마다 예약 인원이 정해져 있어요! 예약되면 1시간 30분 사용이 가능합니다🤭 네이버 예약을 통해서 예약하시면 됩니다 예약제로 운영하고 인원제한도 있는게 엄청 특별한 것 같아서 급하게 전날 예약하고 가기로 했습니다 Next image 지도보고 찾아갔는데 어디지 싶었는데 2층인데다가 간판은 작아서 확인이 어려우니 잘 찾아가야합니다! Next image 이용안내에 대해 설명하고 있고 생각보다 작은 문으로 들어갔습니다 ㅎㅎ Next image 실내로 들어가니 생각보다 조명이 어두웠어요! 맑은 날씨였는데 안과 밖의 분위기가 완전히 달라서 너무 좋았어요👍 뭔가 차분해지는 느낌을 받으면서 자리로 안내받았어요! 메뉴를 보고 고른 후 카운터로 가서 선결제하고 즐기시면 됩니다! Next image 실내는 아늑하고 조용한 분위기입니다 촬영시에는 무음으로 촬영해달라고 하셔요😭 Next image 저희는 2인차빙세트로 주문하고 조용히 둘러보았습니다 서울에서 이렇게 조용하게 즐길 수 있는 카페가 있나 싶을 정도로 조용하고 분위기도 좋았습니다😎 예쁜 찻잔에 웰컴드링크를 마시며 조용한 힐링의 시간을 보내봅니다 Next image 호지차 빙수와 화과자세트가 너무 예쁘게 담겨옵니다! 호지차 빙수는 진짜 진하고 맛있어요👍👍🥰 호지차를 좋아해서 여기저기서 많이 먹어봤지만 여기처럼 진한 곳도 없는 것 같아요! 저 가운데 항아리에서 계속 연기가 나서 저기는 뭔가 했는데 차를 주문하고 드시는 분들이 물을 리필할 수 있도록 해둔 항아리였어요! 예약제이고 기본적인 메뉴 가격도 있는 편이긴 하지만 서울 여느 카페에서도 느낄 수 없었던 조용하고 따뜻한 시간을 보낼 수 있었어서 너무 행복했습니다😍"
망원동 티노마드,노마드(유목민)의 마음으로 편안하게 차 한 잔 마시며 쉬어가는 장소 🌿 티 노 마 드 🌿 티노마드 서울특별시 마포구 포은로 112 2층 처음 들어오자마자 선 결제하며 보이는 다과들! 원래 후기를 보고 와서 쿠리킨톤을 먹으려고 했지만 영롱쓰한 화과자에 반해서 홀리듯 화과자 결제… 결과는 대실패^^ 맛을 표현하자면 우리 집 강아지 꾸리꾸리 맛 다음에는 쿠리킨톤 먹어야지 티노마드에서 가장 많이 시키는 2인 세트를 시켰다 화과자 떡은 계절의 꽃 차는 노마드차 차빙은 말차 🍵 처음에 나오는 웰컴 티 존맛 우마이(うまい)다! 맛있던 순서🌿 1. 노마드 차 민들레차 향이랑 같고 온천을 즐긴 후 향기로운 차 한잔하는 기분을 들게 한다. 2. 말차 빙수 녹차를 좋아하는 대한민국 사람이라면 무조건 와야 한다.. 적당히 달달하고 녹진하다 완전 존맛탱이다 ;) 3. 말차색 치즈케이크(?) 말차 빙수 오른쪽에 있는 작고 네모난 케이크인데 색은 녹색이지만 달달하고 부드러운 치즈케이크다. 티노마드의 내부사진 맘이 편안해지는 향이 가득하고 일본에 잠시 놀러 온듯한 느낌을 주는 곳이었다. 살아있는 빨간 물고기도 있다! 아기자기한 소품들이 많고 볼 것이 다양한 곳이다. 오늘은 오빠랑 왔는데 다음엔 울 엄마 데려가야지 ㅎㅎ 🌝
망원동 카페 :: 티노마드 T.NOMAD 호지차 빙수,"티노마드 마음이 편안해지는 감성 티카페 망리단길 카페 티노마드 T.NOMAD 오시는 길 티노마드 서울특별시 마포구 포은로 112 2층 망원역(6호선) 2번출구로 나와 망원우체국사거리까지 직진! 배스킨라빈스 끼고 좌회전해 맞은편에 올리브영이 보이는 사거리까지 쭉 오시면되구요 작은사거리에서 굿맘 할매 순대국 가게 끼고 한번 더 좌회전하신뒤 직진하시다가 주택가 골목길로 들어오시면 2층에 티노마드(T.NOMAD)가 위치해있어요! 주차, 발렛 모두 불가! 메뉴 TEA 노마드차 단품 7.5 / 세트 12.5 호지차 단품 7.0 / 세트 12.0 말차 단품 7.0 / 세트 12.0 겐마이차 단품 7.5 / 세트 12.5 *세트메뉴는 떡, 화과자, 말차케이크 중 택1 그외 말차라떼, 호지차라떼, 프리미엄녹차, 셀프드립커피, 말차칵테일, 차 우유 빙수 망원동 카페 티노마드는 웨이팅이 꽤 많은편이라 네이버예약 후 방문하시는것 추천드리는데요 네이버예약시 노쇼(No-show) 방지를 위해 예약금 10,000원이 선결제되고 이 금액은 방문 후 결제하실때 차감되니 안심하셔도됩니다 :) * 카페 티노마드 이용시간 1시간 30분 * 네이버 예약 :: 티노마드예약 반갑습니다.티.노마드입니다. 원하시는 예약날짜와 시간,인원을 선택해 주세요. 노쇼 방지를 위해 예약금 만원을 선결제 부탁드리며 현장에서 차감됨을 안내드립니다. 많은 양해 바랍니다.감사합니다. m.booking.naver.com 티노마드 반년만에 상하이 여행 멤버들과 만나는날! 점심 맛있게 먹고 커피말고 티 한잔 하러 방문한 곳 망원동 카페 티노마드 (T.NOMAD) 입구 초입부터 웨이팅이 어마어마했는데 다행히 전날 서영언니가 네이버예약(예약금 선결제) 후 DM으로 사장님과 컨텍한 터라 큰 기다림 없이 예약시간 맞춰 입장할 수 있었다! (언니최고!) 체온측정 및 QR체크인하고 반달모양 창가자리 안내받고 착석! 가방이랑 짐은 테이블 옆에 대충 놔두고 사람들 몰려오기전에 후다닥 내부사진 찰칵! 얼마 지나지않아 직원분이 오셔서 웰컴티와 함께 메뉴판을 전달해주셨고 호지차 / 노마드차 각각 2세트와 호지차빙수 단품을 추가했다! * 주문과 결제는 입구 앞 리셉션에서 직접 진행! 고소하면서도 달달한 웰컴티 마시며 숲을 연상시키는 매장 음악을 귀기울여 듣다보니 주문한 TEA & 빙수 등장! 제일먼저 먹어본 메뉴는 티노마드 차 우유 빙수 최고급 말차, 호지차를 듬뿍 넣어 1+ 등급 우유와 티노마드 레시피로 탄생된 차 우유 빙수 말차/호지차 특유의 텁텁함과 쓴맛이 전혀 없고 달달한 감칠맛이 매력적이었던 메뉴! 금방 녹아버려서 아쉬웠다ㅠㅠ 노마드차 전남 여수의 무농약 친환경 단지에서 재배한 생화를 베이스로 시즌별로 특별히 엄선한 재료만 모아 블렌딩한 디카페인 茶 오리지널(색색의 꽃) / 블루(푸른빛 색상) 중 택1 그리고 호지차 교토 우지산 엽차를 천천히 로스팅해 구수한맛과 깔끔한맛만 남긴 프리미엄 TEA 노마드차는 향기롭고 달달하긴한데 시간이 지나면 지날수록 텁텁한 맛이 올라와서 머무는동안 천천히 음복하고싶으시다면 고소한 맛의 호지차를 추천하고싶다 티팟에 제공된 차를 다 마시면 홀 중앙에 위치한 셀프 리필바에서 2~3차례 뜨거운물을 더 가져올 수 있으니 참고! *세트메뉴 디저트는 화과자, 떡, 말차케이크 중 선택 일일 한정 수량으로만 판매하기때문에 이왕이면 세트로 주문하시는것 추천 :) 티노마드 디저트 종류별로 주문해보았고 화과자, 말차치즈케이크, 떡 중에서 역시나 화과자가 젤 맛있고 인기많았다! 쨍한 색감이 제일 먼저 눈길을 사로잡고 한입 베어물면 달달한 앙금의 맛과 고소함이!!!! 엄청 맛있었음ㅠㅡㅠ 말차 치즈 케이크는 풍미가 좋고 기대했던것보다 훨~씬 부드러워서 놀랐던! 프랑스 키리 크림치즈와 특등급 교토 우지산 말차가루를 사용해 당일 생산하신다고! 진짜 맛있음 헤헿 떡은 인절미+달달한 생크림 / 담백한 카스테라 느낌인데 쫀득쫀득 고소하니 맛있었다! 커피말고 TEA 한잔 하고싶을때, 조용한 공간을 선호한다면 고즈넉한 티카페 T.NOMAD 망원동 데이트하실때 카페 티노마드 망리단길 감성 카페 방문해보세요 :) 티노마드 영업시간 : 매일 13:00 - 22:00 수요일휴무 연락처 : 02-545-5084 워니의 서울라이프 #알콩달콩 #연애하듯결혼생활하기 #정환이랑 #노는게젤좋아 이정원(@wony.life) • Instagram 사진 및 동영상 팔로워 16.1천명, 팔로잉 801명, 게시물 473개 - 이정원(@wony.life)님의 Instagram 사진 및 동영상 보기 www.instagram.com"
05.23 망원동 티노마드 카페추천,오랜만에 수딩이랑 망원동 카페 내부도 너무 예쁜 곳!❤️ 4시 정각에 딱!!! 들어 갔다!! 예약 알아 본 수딩이 아주 칭찬해😆 Welcome tea🍵 (photo by 수딩) 자리에 앉으면 웰컴티를 주시는데 너무 맛있었다!! 취향저격😍 우리가 시킨 메뉴는 -호미차 세트 -말차 빙수 말차빙수랑 티라미슈 인절미 존맛탱.. 수딩이가 찍어준 사진❤️ 사진작가야.. 녹차 별로 안좋아하는데 이 빙수 먹고 녹차를 좋아하는 건가 싶을 정도로 너무 맛있었다.. 지금도 생각나는 맛.. 첫 게시물 끝! #카페 #티노마드 #망원동 #카페추천
망원동 맛집 / 티노마드 모리 드디어 예약 성공♥,"티노마드 모리 서울특별시 마포구 망원로2길 19 비동 1, 2층 우연히 인스타에서 보고 너무너무너무너무너무 가고 싶어서 3월달부터 대기 타고 기다렸던 #티노마드모리 예약 가능한 날은 인스타에서 공지해주신다. (한달에 2번 예약 가능! 취소건이 생길 때마다 운좋게 자리가 생길 수 있으니 정말 가고 싶으면 수시로 확인해야한다!) 저번달에 친구네 커플이랑 세명이나 예약에 도전 했지만 실패 했었다 이번엔 오빠가 기필코 성공해준다더니 진짜 예약 성공해줬다 >_< 꺄올 그렇게 두달여만에 방문한 티노마드! 2시보다 살짝 일찍 갔더니 2번째로 입장 ! 원하는 곳에 앉을 수 있었따 히히 이곳은 마치 ..일본? 진짜 인테리어 취향저격 :) 모든 공간 , 소품 하나 하나 다 감각적인 이 곳 요 자리도 탐났는데 ㅎ_ㅎ 이 공간은 혼자 오신 손님께서 이용하셨다 진짜 이뽀... 겨울에 눈내리는 배경 보고 반했었는데 이런 초록초록한 배경도 예쁘다 하지만 겨울에 또 올테야 :-) ( 오빠 보고있니 ) 먼저 호지차로 빈 속을 달랬다 요즘 빠진 호지차 ! 메뉴는 스키야키 뿐이라 빨리 나오는 편 ! 귀요어... 우리는 스키야키 2인 세트를 시켰다 오는길에 망원시장 보고 흥분해서 이거 먹고 바로 시장가서 간식 거리 사먹자고 난리 나리 쳤던 ..ㅎ_ㅎ 순서대로 오이지, 계란(?), 날계란 요로케 ! 들어있다 메뉴는 정말 빨리 빨리 나오는 편 ! 그리고 무엇보다 고기 퀄리티가 너~무 훌륭했다 매일 공수해오는 프라임 등급만 사용하시고 식감을 위해 두께감있는 고기를 주신다! 사진을 안 찍을 수가 없는 비주얼 ~ 오빠 예약 성공해줘서 고마워 ㅠ_ㅠ 저기 대나무통에 집게, 가위 등 들어있어요 센스 만점 ! 스키야키가 데쳐지느 동안 주변 구경하기 드디어 구경한는 주변 인테리어 :-) 하지만 바로 오빠가 먹으라고 해서 다시 본업으로 ㅎ_ㅎ 요거 곤약면? 같은거 꼬들꼬들하니 양념 잘 베어서 넘나 맛난당 스카프 왜저래! 먹느라 대충 뒤로 넘기고 먹었다보다 ㅎㅎ 진~짜 맛있게 뇸뇸 먹고 둘다 bbb 여긴 정말 괜찮다고 무한 칭찬 그리고 마무리로 이렇게 귀여운 호지차 아이스크림까지 주신다 ! 뭔데 귀여워 너.. 아이스크림도 호지차도 완벽하게 클리어 ~ 다 먹고 먼저가신 손님 자리 다시 한 번 더 찍어본다 :-) 요기가 우리자리~ 세팅도 치우시는 것도 정말 빠르신 직원분! 그새 깔꼼! 인스타 스토리에 올리니까 여기 어디냐고 많이들 물어봐서 뿌듯했던 히히 잘 먹고 잘 쉬다 갑니당 !! https://www.instagram.com/ha112y 🤍(@ha112y) • Instagram 사진 및 동영상 팔로워 638명, 팔로잉 277명, 게시물 384개 - 🤍(@ha112y)님의 Instagram 사진 및 동영상 보기 www.instagram.com"
"망원동 티노마드 예약방문, 호지차 세트, 차빙(말차)세트, 연남동 레이어드, 홍대 카카오프렌즈","망원동 티노마드는 예약제로 운영된다. 커피를 별로 좋아하지 않아서 일부러 예약해서 찾아간 곳인데 기대 이상., 예약금 만원을 결제했고 시간 맞춰 가니 이렇게 차를 먼저 내어 주셨다 (존맛) 대표 메뉴인 차빙세트와 호지차 세트 주문 총 28,000 앞에 놓인 단지에 뜨거운 물이 담겨있어서 필요시 차에 뜨거운 물을 리필해서 마시면 된다 말차 안좋아하는데 말차 빙수 존맛이다 ㅋ ㅋ ㅋ 티노마드에 오면 꼭 찍어야 하는 귀여운 카스테라 ㅎ ㅎ 끝부분에 설탕이 묻어있어서 식감이 바삭하고 많~이 달다 내가 기대했던 호지차 세트 세트도 내 입맛대로 구성 선택 할 수 있는데, 난 화과자를 선택했다. 찻잔 아래 나뭇잎은 거름망 용도로 사용하면 된다 ㅠ ㅠ 소품 하나하나 너무 귀엽다 ㅠ ㅠ 말차는.. 내가 너무 싫어하는 거라.. 주문하고 싶지 않았던 구성인데 엥 대체 무슨 일 말차가 이렇게 맛있는거였나요 ㅠ ㅠ ㅠ 저 오른쪽 아래 말차 무스..? 말차 진짜. 진짜. 안좋아하는데 .. 이 집 말차는 다 맛있다.. 전체적으로 티노마드 말차는 쌉쌀한 맛이 너무 강하지 않고 단맛도 섞여있어서 부담스럽지 않았다 화과자 좋아해서 일부러 화과자가 있는 세트로 골랐다(최고) 티 노마드 가장 큰 장점은 사진 촬영 금지라는 것.. (무음은 가능) 조용히 마실 수 있어서 너무 좋았다. 한시간 반이라는 이용시간 제한 덕에 카공족도 없었고 인스타족도 없어서 너무 편했다. 그리고 들린 카카오 프렌즈 춘식이 언제 봐도 너무 귀엽다ㅜㅜ 바디필로우 베스트도 춘식이♡ 망원동 들렸으니 넘어온 연남레이어드 대 조 녜 매번 와도 매번 예쁘다 유명한 레이어드 스콘 이제 손가락 발가락 다 합친것보다 많이 방문 해서 안먹어 본 스콘이 없다. ㅋ ㅋ 연남동 살 때 너무 좋았는데. 이젠 안뇽.. 마지막은 bhc 뿌링클 순살 자취생은 꼭 순살로 먹어줘야 뼈가 안나와서 좋그든으.."
"<서울 망원동> 레스피레 소금빵, 티노마드, 망원 한강공원","성수동을 떠나고 나니 서울 나들이는 큰 맘 먹고 다녀와야 하고, 특히 강서, 마포 쪽은 아주 큰 맘을 먹어야 한다. 네이버 지도에 표시해 놓은 곳은 하루하루 늘어만 가고, 진짜 올해 처음이자 마지막으로 가보자 하며 남편이랑 망원동 나들이를 했다. 그것도 대중교통으로! (그것은 엄청난 용기.....) 요즘 정말 미쳐있다고 해도 과언이 아닌 소금빵 겉바속촉 꼬소한 소금빵이라는 인스타 후기를 보고 저장해놓은 곳이다. 5개 밖에 살 수 없다는 슬픈 소식😥 내부는 넘 좁아서 사진을 찍지 못했다. 소금빵 인기가 많아서 인지 직원분께서 소금빵을 무한 생산하고 계셨는데 뭔가 왠지 힘들어보이는 그의 뒷모습...... 하지만 넘 맛있으니 고맙습니다😉 5개 사서 2개는 바로 먹어치우고, 3개는 소중히 가져와서 냉동실에 넣어 두었다. 벌써 1개밖에 안남았는데 아쉬워서 먹을수가 없네........💛 레스피레 서울특별시 마포구 월드컵로13길 55-24 지1, 1층 사실 망원동에 온 가장 큰 목적은 티노마드 예약을 해야만 갈 수 있는 곳이라 북적이지 않고 소란스럽지 않아서 넘 좋았던 곳. 인테리어가 너무 좋다. 서울 시내에 이 올드한 건물 2층에 이런 곳이 숨어 있다니. 새소리 물소리 가득한 오래된 숲속 찻집에 방문한 기분이랄까. 너무 더운날이었는데 예약 시간 기다리느라 많이 돌아다녔더니 지쳐버린 남편.. 남편 쏴리...🧡 우리는 2인 차세트로 주문했다. 호지차와 차빙(말차)가 함께 나오는 메뉴! 또 언제 와보겠냐 싶어 쿠리킨톤도 함께 주문했다. 메뉴 너무 성공적👍 밤톨처럼 생긴 이 화과자가 ""쿠리킨톤"" 이다. 평소에 화과자는 많이 달아서 잘 먹지 못하는데, 이건 정말 꾸덕한 밤 그대로였다. 많이 달지 않고, 차랑 먹으니 찰떡이다. 한켠에는 여러 제품들을 판매하고 있었다. 예쁜게 넘 많은데, 우리집에 데리고 와도 똑같이 예쁘려나? 티노마드 티 제품들도 구입 가능하다. 입구 거울에서 한방! 티노마드 서울특별시 마포구 포은로 112 2층 오랜만에 한강이 보고싶어 망원 한강공원을 갔다. 그래, 이 분위기! (흑 다시 서울로 이사와야 하나😥) 날이 너무 좋았다. 절로 행복해지는 하늘! 망원 한강공원 서울특별시 마포구 마포나루길 467 한강공원망원지구사무소 어쩌다보니 선유도공원 까지 가게 된..........하하 양화 한강공원 서울특별시 영등포구 노들로 113 양화개나리점 집에 와서 남편이랑 완전 뻗었다. 차 없이 서울 나들이 가는건 당분간 못하겠..... 망원동아 잘 있어 난 내년에나 오지 않을까 싶다! 그 동안 맛있는 곳 많이 많이 생기길💛"
망원동 데이트 티노마드 모리,지난 해 티노마드에서 스키야키 나베집을 오픈했다는 소식을 들었는데.. 예약이 왜이렇게 힘들어요?ㅠ 최근에 운영하던 가게를 정리하고나서야 여유가 생겨 겨우겨우 피켓팅에 성공했다.. ㅎㅇ 역시나 목재와 돌을 사용한 인테리어 너무조와 오르신 들어가십니다~ ㅋㅋㅋㅋㅋㅋㅋㅋ 먼저 준비해주신 식전차는 호지차 따뜻하게 마실 수 있다 뒷통수는 에어컨빵빵 얼굴은 따끈따끈 취하는느낌..? ㅋㅋㅋㅋㅋㅋㅋㅋ 네. 관동식 스키야키 B세트 2인 스키야키와 명란마요 오니기리가 같이 나오는 세트로 주문함 티카페인 티노마드와 마찬가지로 정갈하고 예쁜 상차림 너무 예쁘자나요 아까워서 어떻게 먹나 명란마요 오니기리도 한피스씩 도시락통에 담아주신다 보기에도 예쁘지만 맛도 있어서 기분좋게 식사를 할 수 있었다 그리고 후식으로 나온 아이스크림 귀여워서 기절 곰돌이 쿠키 짱맛 날씨가 많이 덥지않아 망리단길을 산책하다가 들어간 카페 리벌티 망원동에는 아담하고 예쁜 카페가 많은데 나는 넓은 카페가 좋아=_= 비건메뉴도 있군요? 아이스오트라떼와 아이스아메리카노 원두도 선택지가 3가지 그리고 디저트는 못참지ㅋㅋㅋㅋㅋㅋㅋㅋㅋㅋ 마카다미아 쿠키도 시켰다 여기 완전 쿠키 맛집 메모.. 쿠키 대맛집.. 쿠키+오트라떼 꼭 머거 두번 세번 머거 오랜만에 셀프 사진 찍으러 ~_~ 요즘엔 영상도 만들어주네 너무 귀엽자나 ㅋㅋㅋㅋ 꼼지락꼼지락 빨리 사진 촬영하는데 적응해야 웨딩촬영도 잘 할텐데 어색해.. ㅋㅋㅋㅋㅋㅋㅋㅋㅋ 마무리는 단골집 한지 ♥ 요즘 운동에 꽂혀있는 오빠는 단백질 섭취를 해야한다며 고등어 시킴 ㅋㅋㅋㅋㅋㅋㅋㅋㅋㅋ 촴내 그럼 소주는요
