title,content
"망원동 일본감성 낭낭한 스키야키 맛집 관동식 스키야키 , 티노마드 모리 (메뉴판 유)","안녕하세요 ⸌◦̈⃝⸍ ⸌◦̈⃝⸍ 오늘의 포스팅은 망원동 스키야키 맛집, 티노마드 모리에 방문한 후기를 가지고 왔습니다 *내돈내먹* 여긴 제가 3월달부터 가고싶었던 곳이였는데, 항상 예약이 다 차있어서(예약하기 꽤 힘든..) 못가다가 최근에 예약이 좀 비어있길래 마침 휴가도 썼겠다해서줍줍해서 평일 점심에 가게되었어요 제 별점은요, 맛 ★★★★★ (5) 먹어본 스키야키중에 최고 분위기 ★★★★ (4) 넘나 일본분위기 but 좁아서 별 한개 뺌 가격 ★★★★(4.5)구성이 넘 많아서 가성비 짱 청결 ★★★★★ (5) 넘 깔끔해요 양 ★★★ (3.5) 첨엔 양 적은거같았지만 먹고나니 적당히 배부른정도 친절 ★★★★★ (5) 친절하세욥 재방문의사 ★★★★ (4) 한줄평 : 스키야키 고기가 이렇게 사르르녹는건 처음, 간도 넘 잘 되어있고 (짜지도 않고 밍밍하지도 않고) 맛으로만 따지자면 먹어본 스키야키 중 최고 *지극히 개인적인 견해, ★5개 만점 망원동 티노마드 모리 외관 티노마드 모리 서울 마포구 망원로2길 19 비동 1, 2층 0507-1468-3524 매일 12:00-20:30 (15:30-17:00 브레이크타임) *한 타임당 식사시간 1시간 30분 예약 필수, 관동식 스키야키 50m © NAVER Corp. 티노마드 모리 서울특별시 마포구 망원로2길 19 비동 1, 2층 예약 티노마드 모리 외관 예약을 드뎌 성공하여 가게된 티노마드 모리 ! 먹고 티노마드 카페 가려했는데, 카페 예약을 안해서 시간이 애매해서 결국 못갔어요ㅠㅠ (카페도 예약제라 예약 필수 ) 예약은 네이버 예약으루 ! 티노마드 모리 : 네이버 방문자리뷰 691 · 블로그리뷰 177 m.place.naver.com 굉장히 일본느낌 낭낭해서 기분이 좋아졌어요 ⸌◦̈⃝⸍ ⸌◦̈⃝⸍ 문앞 2인석 근데 딱 들어가면 바로 우측에 2인석이 있어서 *놀람주의* 제가 입구를 잘못 들어간줄 알았는데, 잘 들어간게 맞더라구요 무튼 좌측에 아기자기한 자기들이 진열되어있었어요 갬성 낭낭한 소품들이 곳곳에 있었구요, 공용 테이블 저흰 젤 마지막에 도착해서 그런지 , 이렇게 생긴 공용 테이블 앞에 앉게 되었지요 공간은 좁은편이예요 2인좌석 3개랑 공용좌석엔 5명정도 앉을 수 있었어요 한 타임당 최대 11명정도 수용가능 ! 잔잔한 음악이 나오면서 벽면에는 초록초록한 숲속 영상이 틀어져 있어서 힐링하는 느낌이 납니다 찻잔에 저 물을 떠서 넣으면 됩니당 호지차 티백이 컵안에 담겨있어서, 뜨거운물만 부우면 호지차가 우러나와요 ⸌◦̈⃝⸍ ⸌◦̈⃝⸍ 2인 좌식 여기는 좌식의 2인석이예요 ! 여기 앉고싶었으나, 이미 저희가 갔을땐 다 차있었기에 저흰 공용 테이블앞에 앉았지요 뭔가 진짜 일본 너낌이쥬 제가 인스타에 스키야키 사진 올리니깐 어디냐고들 많이 물어보더라구요 정갈하면서 예쁘고 맛있는 스키야키 👍🏻 호지차를 우리면서, 메뉴를 골라봅니다 티노마드 모리 메뉴판 저흰 2인 관동식 스키야키 A세트 를 주문했어요 2인 관동식 스키야키 구성 2인 관동식 스키야키 A세트 ㅡ 48000원 (프리미엄급 생고기) : 2인스키야키 +공기밥2 + 호지차 + 호지차 아이스크림 2인 관동식 스키야키 B세트 ㅡ 58000원 (프리미엄급 생고기) : 2인스키야키 +오니기리 2ps + 호지차 + 호지차 아이스크림 벽면의 숲 미디어아트 ! 인테리어도 우드우드하고 벽면에 숲 미디어아트도 있어서 자연속에 들어 간 기분 낭낭이였어요 인덕션이 앞에 하나씩 놓여있었구요 호지차를 우려내어 예쁜 꽃 찻잔에 마시면 됩니당 감성 낭낭해요 !! !! 관동식 스키야키 맛있게 먹는 법 ! 광동식 스키야키는 냄비에 재료를 둘러담고, 육수를 자작하게 부어 전골처럼 끓여먹는 방식이라고 해요 ㅡ 우선 날계란을 잘 저은 후 (*날계란은 스키야키의 타래가 끓여지면서 좀 더 짭짤한맛이 남) 🔽 나베가 익기시작하면 먼저 익은 야채부터 먹기 🔽 고기는 타래가 살짝 간이들때까지 기다린 후에 먹기 🔽 ㅡ 짠 ! 정갈하게 나온 피클과 계란찜(차왕무시), 날계란 ! 계란말이는, 일본식 계란말이라서 모양도 예쁘고 부드러웠어요 드뎌 스키야키가 냄비에 담아져서 나왔지요 ⸝⸝ʚ̴̶̷̆ ̯ʚ̴̶̷̆⸝⸝ 어느 스키야키집 보다 맛스럽게 담겨져 나왔지요 야채아래에 간장베이스의 육수가 담겨 있었어요 ! 날계란을 휘리릭 잘 저어줍니다 휘리리리리릭 👍🏻👍🏻❣️ 두툼한 고기와 팽이버섯, 표고버섯, 당근, 양파, 유부, 청경채 등 들어있었지요〰️ 채소부터(배추, 버섯, 청경채, 쑥갓, 당근 등) 먹고 실곤약을 먹은 후에 고기를 날계란에 푹 찍어서 냠냠 🥩 고기가 넘 부드러워여....미쳤어여...그냥 녹아버림 ㅠ 재료가 넘넘 신선해서 맛있어요!! !! 간이 딱 잘 되고 고기가 넘 부드러웠던게 인상에 깊게 남은,,👍🏻 밥도 나왔구요 , 스키야키랑 밥이랑 호로록 먹으면 꿀맛 ! 육수 간이 넘나 딱 잘 맞춰져있었어요 다른곳에서 스키야키 먹을때 좀 짰던적이 간간히 있었거든요 먹기좋게 잘라서 앞접시에 덜어먹는 중 〰️ 〰️ 너무 배고팠을 시간이라 (딱 점심이였음) 정신없이 먹었어요 호로록 식사 끝 정신없이 먹은 후 .. 같은 시간대에 식사했던 분들은 호다닥 다 가셨는데 식사 속도느린 저땜에 우리만 남아있었던,, 그치만 한타임당 식사시간이 1시간 30분이예요 !! !! 거의 한시간반을 채운 느낌,, 호지차 아이스크림 그리고 마지막 입가심 디저트로 나온 호지차 아이스크림 ! 씁쓸한 맛 없이 고소하면서도 막 달지도 않지만 맛있었어요 까망이와 노랭이.. 딱 나랑너..라며 먹었던 ^~^.. 화장실 진짜 조그마한데 있을거 다 있어서 놀랐던.. 어떻게 이렇게 좁은공간에 화장실이 만들어졌죠..? 무튼 점심으로 정갈한 스키야키 정식 잘 먹었습니다 〰️ 한번쯤 꼭 가보면 좋을 거같아요!!! !! *내돈내먹"
망원동 티노마드 모리,"티노마드 모리 t.nomad mori 망원동 카페 티노마드에서 새로 오픈한 일식당, 티노마드 모리. 스키야키 나베와 오니기리, 야끼우동을 선보인다. 작은 공간이라 네이버 예약 필수! |> 네이버 예약 네이버 예약 :: 티노마드 모리 예약 안녕하세요, 티노마드 모리입니다. 원하시는 날짜, 시간 및 인원을 선택해주세요. m.booking.naver.com |> 올해 2월에 다녀온 카페 티노마드 망원동 카페 티노마드 티노마드 입구부터 엣지있는 티노마드. 2층이라 살짝 안쪽 골목으로 들어와 입간판 있는 빌라로 올라가면 ... m.blog.naver.com 매주 월•수 휴무 영업시간 : 12:00-20:30 (15:30-17:00 브레이크타임) 주차 : 바로 앞 도로에 노산공영주차장 이용 티노마드 모리 서울특별시 마포구 망원로2길 19 비동 1, 2층 예약 불멍하기 좋은 공간! 6명이 앉기에도 충분한 큰 테이블과 창가쪽 테이블, 안쪽으로 2인석 테이블 2개가 더 마련되어 있다. 2인 세트(35.) 1인 스키야키나베 + 오니기리 2개 + 호지차 아이스크림 (그런데 아이스크림 못먹고 후다닥 나와버림..? 후식이 있다는 걸 까먹고 나왔는데, 왜 계산할 때 별 말씀 없으셨는지..ㅠㅠ)"
망원동 카페 | 고즈넉한 분위기 티맛집 쉬어가는 카페 “ 티노마드 ”,안녕하세요 콩쥬입니다 ๑❛ᴗ❛๑ 오늘은 망원동에 위치한 카페를 추천해드리려고 왔어요 🫡 저는 개인적으로 조용하고 한적한 카페를 좋아하는데 집 근처에 취향저격하는 카페가 있다고해서 갔다와보았습니다 탕탕🔫 평소에 커피를 마시러 카페는 자주가지만 차를 마시러 카페를 찾아간 적은 없었는데 거의 처음으로 방문하게 되었어요 티노마드 카페는 편안하게 차 한잔 마시며 쉬어가라는 의미로 티 노마드라는 공간을 만들었다고 하는데요 한번 가보자구요 50m © NAVER Corp. 티노마드 서울특별시 마포구 포은로 112 2층 예약 영업시간 목요일 정기휴무 평일 & 주말 : 13:00 - 20:30 02-545-5084 단체석 / 포장 / 예약 / 노키즈 존 저는 처음에 무슨 카페를 예약하고가나 생각했는데 예약없이는 이용이 안되더라구요 예약제로 운영되니 네이버예약을 이용해주시면 된답니다 예약금은 만원으로 주문 시 결제금액에서 차감한다고 하네요 이용시간은 한시간 삼십분으로 정시 입장 및 퇴장하는 시스템입니다 좌석 지정은 안된다는 점 오신 순서대로 빈자리 중 원하시는 자리 선택가능하다는 점 알고계세요 🤍 ⭐️ 다들 주목 ⭐️ 예약은 매달 마지막 주 수요일 오전 10시에 다음 한달의 예약을 오픈한다고 합니다❗️ 저희는 5시로 예약했는데 거의 정각이 되어야 들어갈 수 있더라구요 예약한 손님들이 우르르 다같이 내부로 들어왔습니다 자리를 잡고 입구에서 주문해주시면 됩니다 메뉴판 참고로 봐주시구요 저희는 2인 차빙세트 (차1 + 다식1 + 빙수1)로 시켰습니다 차는 노마드차 오리지널로 다식은 계절의 화과자로 빙수는 말차로 초이스했답니다 🤍 카페 전체적인 분위기가 따뜻하고 고즈넉하고 괜히 차분해지고 ㅋㅋㅋㅋㅋㅋㅋ 근데 이런 분위기 넘 조아요 🤍 저희는 요 이인석에 앉았어요 밖에 비가 오고있어서 빗소리도 듣고싶었고 창밖보는 것도 좋아해서 이 자리로 픽했습니다 티노마드 카페는 공예작업 공간과 차를 마시는 공간이 어우러져있는 복합공간으로 다양한 볼거리들도 많이 있더라구요 그래서 메뉴를 기다리면서 이리저리 둘러보았어요 직접 판매도 하고있더라구요 ˃̵ᴗ˂̵ 그리고 무엇보다 카페내부에서 잔잔하면서 깊고 좋은 향이 났는데 라벤더 에센셜 오일이었어요 무슨 마사지샵에 온 줄 알았다는 ⺣◡⺣ 이렇게 구경하는동안 저희가 시켰던 차빙세트가 나와주었구요 아까 구경하던 찻잔에 주시더라구요 😊 잔잔한 음악과 함께 차위에 떠다니는 꽃잎을 보는데 왜이렇게 숙연해지는지 ㅋㅋㅋㅋㅋ 진짜 힐링하러오기 딱인 곳같았어요 차도 향긋하고 부담스럽지 않아서 좋았어요 왼쪽 아니요 오른쪽 맞아요 차 거름망인데 처음에 뭣도 모르고 받침대로 썼지뭐예요 ㅋㅋㅋㅋ 다 마시고는 주전자에 따뜻한 물을 더 넣어 우려 마셔주었습니다 ๑‵ᴗ′๑ 그리고 말차빙수 진짜 맛있었어요 🩵 추 천 추 천 🩵 씁쓸한 맛이 심하게나지 않고 달달하더라구요 웃긴게 빙수먹다 차먹다 빙수먹다 차먹다하니 입안이 차가워졌다가 따뜻해졌다가 이게 모야 ㅋㅋㅋㅋㅋㅋ 찻집이라서 사실 빙수는 그닥 기대하지 않았는데 예상외로 너무 맛있어서 놀랐어요 비오는 날에 예약해서 다녀왔는데 날씨랑 너무 잘어울리는 카페였어요 다들 커피만 마시잖아요 저도 아아 중독인데 정말 간만에 차를 제대로 마셔보는 것 같았어요 차에 관심 없는 분들이더라도 한번 경험해보는 것도 강추드려요 😝 아차차차 카페 이용시간동안 리뷰 작성 완료하시면 백색유잔 주신다고하니 참고해주세요 저희는 나중에 알게돼서 못받아서 다음 기회에 ⺣◡⺣
망원동 티노마드 모리 스키야키는 이곳에서 즐겨보세요,"안녕하세요! 제가 이번 주 주말에 맛있는 식당을 다녀와서 알려드리게 위해 찾아왔습니다! 저번에는 포스팅은 김치찜! 한식을 소개해 드렸는데요! 이번에 소개해 드릴 곳은! 일식이에요! 날이 추워지면 뜨끈한 국물이 생각나잖아요??? 그래서 일식에 대표 전골요리! 스키야키를 먹고 왔습니다! 그곳이 어디 인지 궁금하시죠!? 바로! 망원동에 위치한 티노마드 모리를 소개해 드리겠습니다! 외관부터 인테리어를 잘하셔서 마치 일본에 온 것 같은 느낌을 연출하셨어요! 사진으로만 봤을 때는 일본 같지만 사실 요기는 한국이랍니다! 간판부터 감성적이지 않나요? 다른 곳은 간판을 엄청 크게 해서 홍보효과를 노리지만 티노마드 모리는 역발상인가요?? 멀리서 보면 간판 같지 않지만 가까이서 보면 식당 이름이 써져있어요! 간판이 딱 심플하게 포인트를 주셔서 좋은 거 같아요! 자 이제 내부로 들어가서 자세히 보여드리겠습니다! 위치와 기본정보 50m © NAVER Corp. 티노마드 모리 서울특별시 마포구 망원로2길 19 비동 1, 2층 예약 주소 마포구 망원로 2길 19 비동 (망원동 417-14) 영업시간 13 : 00 ~ 20 : 30 브레이크 타임 15 : 30 ~ 17 : 00 주차장 주차장은 아쉽게도 마련되어 있지 않습니다..... 공용주차장을 이용하셔야 하는데 근처에 많지가 않더라고요. 모두의 주차장, 카카오T 앱을 이용하셔서 근처 주차장을 찾으셔야 합니다! 예약방법 티노마드 모리는 웨이팅이 있는 식당이 아리나 100% 예약제로 운영해요! 예약을 안 하시고 가시면 헛걸음하시니 예약을 꼭 하셔야 합니다! 네이버 예약 :: 티노마드 모리 (식당) 예약 티노마드 모리(식당)입니다.저희는 한시간 삼십분동안 이용하실 수 있는 예약제로 운영되고 있습니다. 원하시는 예약날짜와 시간,인원을 선택해 주세요. m.booking.naver.com 예약방법은 네이버 예약으로 하시면 됩니다! 내부모습 제가 오후 5시에 예약을 해서 해가 지고 있어서 내부가 조금 어둡습니다. 사진상으로 조금 어둡게 보이는 겁니다. 실제로는 분위기도 좋고 마치 일본에 와 있는 기분이에요! 예약을 하시고 와도 자리는 예약이 안되어서 안쪽 분위기 좋은 자리는 조금 일찍 오셔서 기다리셔야 앉을 수 있습니다. 저는 4시 30분부터 기다리고 있어서 들어오자마자 안쪽 자리에 앉았어요! 인테리어 소품도 잘 꾸미시고 이런 인테리어를 좀 배워야겠어요..... 식당에 들어와 있는 것만으로 힐링이 됩니다!! 자! 이제 메뉴를 보면서 주문을 해야겠죠!? 메뉴판 메뉴판은 간단하게 만드셨는데요! 이게 조금 오래되다 보니깐 글씨가 살짝 지워는 거 같아요! 메뉴는 대표메뉴가 하나이니까! 2인 관동식 스키야키 B세트를 시켰습니다! 명란마요 오니기리 맛있다고 하니 포기할 수 없죠! 맛보기! 메뉴를 주문하면 찻잔을 가져다주시는데 뒤에 보이는 주전자??라고 해야 하나 그걸로 차를 타 먹는 거예요! 차를 따라보겠습니다! 따뜻한 물에 차를 넣어주시면 돼요! 음... 차는 그냥 식전에 먹는 차?? 느낌? 특별한 맛은 아니었습니다! 식전에 위를 따뜻하게 해주는 거 같았어요! 차를 마시고 있으면 금방 메인메뉴를 가져다주십니다! 짠! 저희가 주문한 스키야키 입니다! 와~ 엄청 이쁘게 나와서 먹기가 미안할 정도예요... 사진만 엄청 찍었어요... 그래도 먹어봐야죠! 육수는 간장베이스 육수라 약간 검은색이에요! 짠! 이것은 명란마요 오니기리 입니다! 우선 스키야키가 끓어야 하니깐 이것부터 먹어보겠습니다! 음!! 이 맛은!!!? 익숙하면서도 익숙하지 않은 맛이에요! 명란마요 하면 딱 떠오르는 맛이긴 한데! 이게 조금 달라요! 맛이 좀 더 깊다고 해야 하나!!? 이게 설명이 힘듭니다..... 사람들이 왜 이걸 꼭 먹어야 된다고 말하는지 알거 같았습니다! 오니기리를 먹는 동안 스키야키가 끓어오르고 있어요! 이제 먹을 준비를 해봐야죠!? 소고기도 넣어주고! 먹어보겠습니다! 세팅되어 있는 그릇에 계란을 풀어서 하나씩 찍어 먹어 볼게요! 육수가 간장베이스다 보니 그냥 먹게 되면 짜다고 느끼실 수 있는데 이렇게 계란을 찍어서 드시면 중화가 되면서 간이 적당해져요! 이거 너무 맛있는데요.... 사람들이 왜 좋아하는지 알 거 같습니다.. 분위기도 좋고 음식도 맛있고... 완벽해요! 정신없이 먹다 보니 사진도 못 찍었어요... 어느새... 다 먹고 이제 우동을 넣어 줘야 합니다! 짠 우동면을 넣어주고 잘 풀어주세요! 보글보글 끓고 익을 때까지 기다려줍니다! 짠! 우동이 완성됐어요! 우동도 맛있어 보이지 않나요? 분명 어제 먹고 왔는데.... 지금 포스팅하면서도 군침이 돌아요... 우동도 약간 짜다고 생각하시면 계란에 찍어드시면 더욱 맛있어요! 저는 계란에 찍어 먹었답니다! 후~ 이제 우동도 다 먹었으니 마지막 후식을 즐겨봐야죠!? 귀여운 아이스크림이 나왔습니다! 사장님의 센스! 곰돌이 과자 귀엽지 않나요?? 호지차 아이스크림인데.. 으음... 제 입맛에는 그냥 녹차 아이스크림? 같은데. 찾아보니까 녹차의 한 종류라고 나와있어요! 일본에서 나오는 차라고 합니다! 근데 제 입에는 그냥 녹차에요! 평가 개인적으로 완벽한 저녁식사였다고 생각합니다! 실내 인테리어도 분위기 있고 좋았고! 무엇보다 음식이 맛있었습니다! 망원동에서 왜 스키야키로 유명한지 알겠더라고요! 지금까지 제가 먹었던 스키야키 중에 최고였습니다! 한 가지 아쉬운 게 있다면.... 위치와 주차장입니다! 망원역에서도 멀고 근처에 주차장이 거의 없더라고요... 자동차를 끌고 오시는 것보다 망원역에서 걸어오시는 걸 추천드리겠습니다! 티모나드 모리 정말 완벽한 식사였습니다! 그럼 이만 리뷰를 마치겠습니다!"
"[서울 망원동] 카페 티노마드, 서울 빙수 맛집 추천(a.k.a 일본식 찻집)","올라! 여름 하면 생각나는 디저트 중 하나인 빙수. 망원동에 빙수 맛집이 있다고 해서 찾아왔는데요? 알고 보니 찻집이더라고요?! 도쿄빙수 아님ㅎㅎ 티노마드 카페, 디저트 주소 서울 마포구 포은로 112, 2층 영업시간 13:00-20:30 정기휴무일 매주 목요일 예약 네이버 예약 필수 아이동반유무 노키즈존 카카오맵에 ‘티노마드’를 검색했더니 ‘티노마드 파티세리’ 위치를 알려주더라고요? 제가 간 티노마드는 파티세리가 아닙니다 여러분. 하마터면 잘못 찾아갈 뻔, 휴~ 네이버는 티노마드의 정확한 위치를 알고 있으니 네이버 예약 후 네이버 지도를 보고 찾아가세요. 티노마드는 망원역 2번 출구에서 망리단길과 망원시장을 지나 10분 정도 걸어가면 ‘원더마마’라는 옷 가게 건물 2층에 위치해 있었어요. 카카오맵으로 찍고 오실 분들은 ‘원더마마’로 검색해서 찾아오시면 됩니다ㅎㅎ 원더마마 오른쪽 골목으로 들어오시면 건물 2층으로 올라가는 입구와 티노마드 안내판이 보이실 거예요. 저는 처음에 2층인 줄 모르고 어디 있나 계속 주위를 둘러보았다는^^ 안내판을 큰 길로 옮기시는 게..? 건물 2층으로 올라가면 오픈 전 잠깐 앉아서 기다릴 수 있는 의자와 티노마드 문이 보입니다ㅎㅎ 티노마드는 예약제로 운영하고 있어서 저희는 13시 첫 타임에 예약을 미리 했어요. 정말 딱 오후 1시에 문을 열어주시더라고요ㅋㅋㅋ 도착한 순서대로 입장을 하고 자리를 맡는 시스템이고요. 저는 금요일 오후 1시 예약이었는데 저희 외에도 3팀이 더 있었어요. 평일은 예약이 수월한 것 같죠?ㅎㅎ 들어가자마자 일본에 온 듯한 느낌이 들었는데요. 카페 내부의 조명이나 소품이 너무 잘 어우러져있더라고요. 실제로 도자기도 직접 만드시는 것 같았어요. 예쁜 찻잔들이 많았고요. 저희는 이렇게 좌식으로 앉을 수 있는 자리 중에 제일 안쪽 자리를 맡았답니다. 럭키걸~ 더 안쪽으로는 다양한 도자기들을 구경할 수 있는 공간도 마련되어 있었는데요. 마음에 드시면 구매도 가능! 티노마드는 찻집이지만 저희는 빙수가 목적이었기 때문에 2인 차빙세트를 주문했어요ㅋㅋㅋㅋ 찻집이다 보니 빙수만 먹을 수 있는 곳은 아니어서 차를 시킨 후 빙수를 추가해서 먹거나 저희처럼 차빙세트를 주문하셔서 빙수를 드셔야 해요. 2인 차빙세트는 차1+다식1+빙수1 로 이루어진 세트 메뉴로 저희는 노마드차 오리지널과 계절 화과자, 그리고 호지차 빙수를 주문했어요. 주문하고 내부를 좀 더 둘러보니 정중앙에 있는 항아리에서 물이 끓고 있었는데요?! 가운데 저 항아리가 찻주전자라고 하더라고요. 차를 마시다가 부족하면 다도판 위에 각자 주전자를 올리고 왼쪽에 있는 국자로 물을 떠서 채워가면 된다고 해요. 티노마드에 있으니 정말 걸어서 일본 속으로 온듯한 느낌이었는데요. 고즈넉하고 조용한 분위기가 정말 힐링 그 자체였어요. 요즘같이 비 오는 날 방문해서 빗소리 들으면 시간을 보내는 것도 너무 좋을 것 같은 공간 그리고 조금 기다리니 도착한 차빙세트 한상차림. 보자마자 이건 찍어서 인스타 각이다! 이런 생각이 들 정도로 보기에 너무 예뻤는데요. 차 드시는 법도 잘 적혀있으니 한 번씩 읽어보시는 걸 추천드려요ㅎㅎ 너무 예뻐서 먹기 아까울 정도🥹 그래도 역시 녹을 것 같은 빙수를 제일 먼저 먹는게..?ㅋㅋㅋㅋ 말차 빙수는 다른 빙수집에서도 많이 볼 수 있어서 티노마드에서는 호지차 빙수를 주문했는데요. 처음에는 고소하다가 먹으면 먹을수록 달달한 것이 친구랑 저랑 초코 들어간 거 아니냐며ㅋㅋㅋㅋ 너무 맛있었습니다(궁서체) 서울 빙수 맛집으로 인정🩵 노마드차는 오리지널과 블루, 두 종류가 있고요. 차이는 색상 차이라고 하더라고요. 저희는 오리지널이어서 노란빛 꽃차였는데요. 차 맛은 호지차 빙수에 비해 그렇게 특색 있다고 느끼지는 못했어요. 차 향이 좀 약한 느낌..? 빙수랑 같이 먹어서 그런 것 같기도 하고ㅋㅋㅋ 다음에 방문한다면 호지차를 한번 트라이해보겠어요. 도쿄 미슐랭 맛집에 납품되는 호지차라고 하니 궁금! 그리고 저희가 고른 다식, 화과자! 생김새와 빛깔이 너무 예쁜 꽃잎 같지 않나요? 사실 화과자를 좋아하는 편은 아니지만 찻집에 왔으니 예쁜 화과자를 먹어보자! 하고 주문한 건데 생각보다 맛이 있어서 놀랐더라는ㅋㅋㅋ 이런 화과자라면 대환영~ 그 외에도 고구마, 인절미 모찌와 말차 초콜릿(?) 차랑 같이 먹기 아주 좋은 짝꿍들이었어요. 양갱도 있었는데 사진을 따로 못 찍었네요? 히힛 [서울 망원동] 카페 티노마드, 서울 빙수 맛집 추천(a.k.a 일본식 재생 6 좋아요 0  접기/펴기 [서울 망원동] 카페 티노마드, 서울 빙수 맛집 추천(a.k.a 일본식 저희는 차를 마시다 보니 좀 부족해서 따뜻한 물을 한번 리필해서 먹었는데요. 요고 요고~ 아주 재밌고 신선하더라고요ㅋㅋㅋㅋ 다들 한 번씩 꼭 리필해서 드셔보세요! 이용 시간이 1시간 30분으로 정해져 있긴 하지만 시간에 쫓기거나 하는 느낌은 못 받았고요. 서울 빙수 맛집으로 찾아간 건데 분위기 맛집이어서 더 좋았던 티노마드! 망원동 힐링 데이트로 완전 추천드려요👍 50m © NAVER Corp. 티노마드 서울특별시 마포구 포은로 112 2층 예약"
