title,content
망원동 레터링케이크 '위켄드케이크'에서 곰돌이케이크 구매 후기,"안녕하세요 초초입니다! 얼마전 친구 생일이라 무슨 케이크를 줄지 고민하다가 회사언니 추천으로 가게 된 망원동 위켄드케이크에서 곰돌이 케이크 구매 후기 보여드리려고해요 (ღ˘⌣˘ღ) Instagram의 위켄드 케이크 wee kend it🙃(@weekend__cake)님 프로필 • 게시물 309개 팔로워 2,741명, 팔로잉 56명, 게시물 309개 - 위켄드 케이크 wee kend it🙃(@weekend__cake)님의 Instagram 사진 및 동영상 보기 www.instagram.com 위켄드케이크 망원동에 위치한 맛있는데 귀여운 케이크- 가게 입니다 pf.kakao.com 저는 인스타그램에서 케이크 디자인을 골라서 카카오톡 채널로 주문을 했어요! 채널 소식에 케이크 가격, 주문 방법 등 자세하게 적혀있으니 참고 부탁드려요! 인스타를 보니 당일 케이크도 있더라구요. 케이크를 급하게 준비해야하는 분들도 유용하게 구입하실 수 있을 것 같아요!ᕕʕ •ₒ• ʔ୨ 위켄드케이크 서울특별시 마포구 망원로2길 106 1층 위켄드케이크는 망리단길 근처에 위치하고있는 작은 케이크집이에요 픽업시간에 맞춰서 케이크집에 방문했어요. 외관도 노랑노랑 너무 귀엽죠ෆ.̮ෆ 주문케이크 전문점이기 때문에 가게는 아담했어요 안에도 넘 아기자기했던 공간 많은 종류의 케이크들이 픽업을 기다리고있더라구요! 레터링케이크 주문하면 큰사이즈는 항상 먹다가 남는데 미니사이즈는 딱 좋은 것 같아요! 머리띠, 초 등 다양한 파티용품도 판매하시더라구요 사장님이 초 하나는 서비스로 주셨어요 저는 사과모양 초를 골랐어요(ღ˘⌣˘ღ) 다른 냉장고에도 케이크가 진열되어있었는데 픽업시간에 맞춰서 포장 완료된 케이크들이 이 냉장고에 들어가있는 것 같더라구요! 박스포장도 너무 귀여웠던 위켄드케이크( . ̫ .)💗 틈사이로 보이는 나뭇잎 졸귀탱..🐻💚 너무 너무 귀여운 곰돌이케이크! 친구가 입체케이크를 받고싶어했는데 위켄드케이크는 사이즈도 가격도 괜찮더라구요 더위 속에서 계속 들고다녔더니 케이크가 조금 녹아서 멍든 것 같은 곰돌이가 됐어요ㅋㅋㅋ 사진에서는 안보이지만 하판에 레터링도 추가할 수 있어서 좋았어요! 저는 초코시트+발로나 초코크림 조합으로 주문했는데 친구가 엄청 맛있었다고해요! 귀부분은 쫀득쫀득한 설탕(?)이였다고 하더라구요 ♡ʕ´•ᴥ•`ʔ♡ 같은 날 주문했던 회사언니도 레터링 케이크 많이 주문해봤는데 여기가 제일 맛있었다고 하더라구요 망원동에서 레터링케이크/입체케이크 주문하실 분은 '위켄드케이크' 완전 추천드려요!💗 #망원동케이크 #망원레터링케이크 #망원주문케이크 #망원입체케이크 #망원동물케이크 #망원곰돌이케이크 #서울곰돌이케이크 #서울입체케이크 #서울레터링케이크 #위켄드케이크 #망원위켄드케이크 #서이추 #서이추환영"
"망원동 케이크 위켄드케이크, 귀염한 레터링케이크","결혼하고 입맛이 좀 바뀌어서 이제는 달달한 게 냉장고에 없으면 아쉬워하는 엥꽁님을 위해서 가끔씩 홀케이크를 하나씩 주문하곤 하는데 이번에는 마침 연애한 지 2천 일이 다 됐길래 망원동 케이크 전문점 중에서 레터링케이크로 유명한 위켄드케이크에서 주문해서 먹어보기로 했다. 망원역 2번 출구에서 도보로 10분 정도 걸으면 마포한강아이파크 아파트 바로 근처에 위치하는데 요즘은 그래도 저녁에 좀 덜 더워서 걸을 만했던 거리. 흰색 건물에 초록색 간판도 눈에 들어왔는데 요렇게 노란 입간판도 눈에 쏙 들어왔던 위켄드 케이크. 주말이 아니더라도 맛있는 망원동 케이크와 함께 주말의 기분을 즐기라는 의미인지 모르겠지만 우리는 마침 금욜에 주문한 거라 더 주말 느낌으로 ㅋㅋ 평일에는 8시까지 운영을 하는데 픽업을 기다리는 케이크는 요렇게 냉장 보관이 되어 있었는데 마침 다른 분도 픽업을 오셨길래 기다리면서 구경. 스몰, 미디움, 라지 요렇게 세 가지 사이즈로 케이크를 판매하는데 디자인을 고려했을 때 가격도 합리적인 편이라 주문해볼 만한 듯했다. 전체적으로 화이트톤과 초록초록한 분위기의 인테리어 때문인지 요즘처럼 무더운 여름에는 좀더 시원한 느낌도 들었던 망원동 케이크 위켄드케이크. 다양한 사이즈의 케이크 상자가 준비돼 있었는데 요즘은 홀케이크도 작은 사이즈로 나오니까 둘이서 간단히 기념일 챙기거나 기분 내기도 좋을 것 같다. 망원동 케이크 전문점답게 달력도 요렇게 케이크가 그려져 있었는데 하나하나 너무 예쁘고 맛있어 보인. 확실히 케이크는 맛도 맛이지만 눈으로 즐기는 재미도 포기를 못하는데 그런 면에서 좋은 듯했다. 매장 자체는 그렇게 크지 않았는데 곳곳에 이렇게 아기자기하게 소품들을 갖춰둬서 구경하기 좋았던. 머리띠나 안경 등의 소품도 준비되어 있어서 파티용으로도 좋을 것 같았는데 사진찍기도 좋을 듯. 디자인 양초도 정말 다양하게 준비돼 있었는데 케이크 예약 주문하면 하나 서비스로 주신다고 해서 고르려고 보니까 넘 귀염귀염한 게 많아서 고민되던. 평범한 숫자 초가 아니라 더 포인트 주기 좋았던. 이동 시간이 1시간 정도 걸린다고 했더니 아이스팩도 넉넉하게 주셔서 큰 문제 없이 가져왔는데 엥꽁님이 퇴근하기 전이라 냉장고에 살짝 넣어뒀다가 개시. 내가 고른 초는 겉에 붙여주셔서 뭔가 더 선물 느낌. 망원동 케이크 위켄드케이크는 케이크 디자인 외에 요렇게 디테일한 부분도 귀여웠는데 내가 주문한 레터링 케이크 외에 곰돌이 케이크 같은 디자인의 케이크도 판매되던데 인스타 디자인 보고서 원하는 디자인으로 주문해도 좋을 것 같았다. 기본적으로 망원동 케이크 전문점 위켄드케이크는 매장에서 직접 구운 100퍼센트 수제 바닐라 제누아즈에 하루 동안 숙성시킨 풍미 가득한 동물성 생크림으로 샌딩되고 겉 크림은 꼬수하고 달콤하게 블랜딩된 필라델피아 크림치즈가 올라가는 구성인데 추가금을 내면 초코시트로 변경이 가능한 시스템이었다. 크림치즈 특성상 생크림처럼 매끈한 아이싱은 아니라고 안내돼 있었는데 그래도 이 정도면 충분히 매끈한 게 아닌가 싶었던 디자인의 케이크. 2000일 기념이라 심플하게 메시지를 케이크에 올린. 디자인에 따라서 가격이 좀 달라질 수도 있으나 하트 케이크도 있고 유화 스타일, 그림이 들어간 디자인 케이크 등도 가능하고 맨 위에 초코가 듬뿍 올라간 케이크 디자인도 고를 수 있었다. 케이크 레터링은 영문 20자, 한글 15자 무료인데 요렇게 포인트로 넣어주면 깔끔하니 괜찮은 것 같다. 2천 일이라서 하트하트 초로 골랐더니 넘 귀엽던. 하트하트, 진주알 같은 포인트도 올라가 있어서 포인트가 좋았는데 예약 주문도 가능하지만 당일에 케이크 주문도 가능하기 때문에 당일이라도 홀케이크 필요한 분들이 있다면 카톡으로 문의해봐도 좋을 듯. 우리는 초코시트로 변경해서 주문을 했는데 초코 시트도 프랑스 초콜릿 브랜드인 발로나로 만든다고 하는데 고급진 단맛을 즐길 수 있으면서도 시트도 촉촉하니 굳. 초코 시트라고 해서 엄청 단 건 아니고 은근하게 진한 맛이 있어서 부담없이 즐길 수 있었던 구성. 망원동 케이크 전문점 위켄드케이크는 디자인도 물론 포인트가 있지만 맛도 괜찮아서 역시 싶었다. 위쪽에는 크림치즈가 올라가서 살짝 묵직한 느낌인데 그러면서도 아래 초코시트와 생크림이 부드러워서 부담스럽지 않게 즐길 수 있었던 맛있는 케이크. 인스타그램에 보니까 정말 다양한 디자인으로 레터링 케이크 제작하고 계시던데 작지만 야무진, 예쁘지만 맛있는 망원동 케이크 전문점이다 싶었던. 다음에는 입체 곰돌이 케이크 같은 것도 주문해서 맛있게 즐겨봐야지 싶었던 위켄드케이크 추천! Instagram의 위켄드 케이크 wee kend it🙃(@weekend__cake)님 프로필 • 게시물 263개 팔로워 2,180명, 팔로잉 65명, 게시물 263개 - 위켄드 케이크 wee kend it🙃(@weekend__cake)님의 Instagram 사진 및 동영상 보기 www.instagram.com 위켄드케이크 서울특별시 마포구 망원로2길 106 1층"
에이치 하아아이- 망원동 위켄드케이크 그랜드오픈!,5월 말 망원동에 세상에서 가장 맛있는 수제 케이크 가게가 오픈해요. (떨리고 긴장되서 달달달 하고있으니 오셔서 제가 너모 떨고있어도 놀라지 마세용) 구) 한강 익스프레스 자리에요. 요 공간이 이제는 케이크 익스프레스!! 위켄드 케이크로 변신!! 가오픈 기간에 홀케이크 주문하시는 모든 고객님께 너모너모 기여운 위켄드 굿즈를 증정해드려요. 50m © NAVER Corp. 한강익스프레스 서울특별시 마포구 망원로2길 106 100% 동물성 생크림 필라델피아 크림치즈 ( 크림 함유량 높은 1.36버전) 와 꼬-습한 버터크림의 환상 조화로 만들어지는 수제 케이크입니다. 주문 제작도 위켄드! (최소 3일 전에는 주문해주세요) 당일 케이크도 판매하고 예정입니다. 레터링은 당근 서비스겠죠? 예쁜 초랑 파티 용품도 한가득 이니 특별하고 소중한 날 꼭 들려주세요 : ) 예쁜 유화 스타일 케이 키! 너무 가고 싶은 휴양지가 떠오르는 특별한 케이크! 주인공을 빛내줄 예쁜 케이크들이 엄청 엄청 많아요 캐야호!! 인스타그램 @weekend__cake
당일 커스텀케익이 가능한 망원동 위켄드케이크!,"망원동에 너무 귀욤귀욤한 케이크집이 생겼다. 인테리어부터 모든 것이 귀욤뽀짝!!! 외관부터 취향저격인 케이크가게! 귀여운 소품도 촤르륵 ! 언뜻보면 소품샵인 줄 알 정도로 다양한 초 들과 소품이 많다 쇼케이스에는 예약된 케이크와 당일케이크가 가능한 케이크들이 기다리고 있다! 집에 가져갈 케이크가 필요해서 나는 만수무강, 친구는 본인 이름을 부탁드렸다. 당일 레터링 가능한 곳이 진짜 거의 없는데, 이 곳은 예약은 물론, 당일케이크+레터링이 가능하니 진짜 너무 좋다 인스타그램에서 유명한 곳은 예약을 몇주 전에 해야하는데, 여기는 운좋으면 바로 당일 가능!! 그리고 커피 원두 완전 제 스타일이요. 라떼 완전 꼬숩구요 완전 제스타일입니다요. 케이크 맛집, 커피맛집 다 하세용 집에가서 부모님과 먹었는데, 부모님이 너무 맛있어 하셔서 금방 다 먹었다..ㅎㅎ 시트가 너무 부드럽고 맛있다고 하셨는데 사장님이 시트도 직접 굽고, 시럽도 직접 만드신다고 하셨는데.. 진짜 시트부터 맛이 다른거 같다.!! 엄마가 몽슈슈처럼 부드러운 시트를 좋아하시는데 여기 케이크는 레알 순삭으로 드심 ㅎㅎ 그래서 남자친구 생일에 한번 더 케이크를 예약했다. 귀욤귀욤해 :) 기분좋게 남자친구랑 같이 축하파티를 했다! 분당이라 케이크샵을 자주 가지는 못하지만, 망원동쪽에 갈 일이 있을 때 다시 한번 가야겠다! 가격도 다른 커스텀케이크보다 저렴하고 사이즈도 미니부터 다양해서 2명이 먹기에 좋다! 또 사장님 인스타 보니까 최근에 더현대 여의도 점에서 강의도 하시고 , 연예인 케이크도 많이 만드시던데 역시 입소문이 금방 나는 곳 인가보다! 근처에 한강도 있으니 한강공원에서 산책 도 할 겸 좋은 추억을 남기시고 싶으신 분들은 가시면 좋을 거 같다 인스타에 다양한 케이크가 있으니 한 번 보고 예약해도 좋을듯! 위켄드케이크 서울특별시 마포구 망원로2길 106 1층 인스타주소 https://www.instagram.com/weekend__cake/ Instagram의 위켄드 케이크 wee kend it🙃(@weekend__cake)님 프로필 • 게시물 342개 팔로워 3,095명, 팔로잉 56명, 게시물 342개 - 위켄드 케이크 wee kend it🙃(@weekend__cake)님의 Instagram 사진 및 동영상 보기 www.instagram.com"
망원동 케이크 : 귀염뽀짝 맛있는 위켄드케이크,망원동 가는 길에 언니 생일 케이크를 사려고 주변 케이크 맛집을 검색해보았다 우연히 발견한 망원동 케이크집 당일 케이크도 판매하고 있어서 바로 문의 드렸음 후후후 나이스~ 위켄드케이크 합정에서 버스타고 편하게 갔다 정류장과 가까이 있어서 잘 찾아감 스몰케이크는 사장님이 귀여운거로 픽해주신다며 레터링 문구만 알려달라고 하셨다(무료) 레터링 기대 안했는데 야호! 스몰케이크 가격 16000원 초가 종류별로 많이 있다 사장님이 기본초를 주셨는데 이때는 그걸 모르고 초를 한 개 골랐더니 사장님께서 멀리 가신다며 서비스로 주셨다 감동ㅠㅠㅠ 박스에 담겨져있는게 내 케이크 완존 졸귀탱이자나ㅠㅠ 귀여워 곰돌스 상자도 리본으로 예쁘게 묶어주셨네 케이스 넘 예쁘쟈냐 오픈기념 이벤트로 에코백을 받았다 악어 스웩 너 내 장바구니가 되어라. 서비스로 받은 하트 초와 유리창에 적혀진 레터링서비스 졸맛탱이군 인스타용이 아닌 맛까지 있는 케이크다 겉은 크림 치즈인데 엄청 달지도 않고 은은하게 달달하며 고소한 맛? 아빠는 시트가 맛있다하고 난 겉이 더 맛있다하고 서로 맛있다며 이상한 싸움ㅋㅋㅋㅋ 엄마랑 언니 왈 둘다 맛있어 종결. 동물성 생크림을 사용해서 그런지 확실히 크림 맛이 다름 나는 생크림 안 좋아하는 사람. but 저 생크림은 맛있었음. 우리집은 케이크를 많이 안 먹기에 스몰케이크가 딱 적당했다 4조각 나눠서 바로 해치웠음ㅎㅎ 다음 생일 케이크도 위켄드에서 주문해야지! 망원동에서 귀엽고 맛있는 케이크 집을 찾을 때 추천하는 위켄드 케이크 위켄드케이크 서울특별시 마포구 망원로2길 106 1층
망원동 제작 레터링케이크 : 위켄드케이크,"형부의 생일을 맞이하여 레터링케이크를 제작!! (물론 언니돈..ㅋㅋ) 합정에 살 때 언니랑 산책하다 레터링케이크를 제작해주는 가게가 있는것을 발견! 위켄드케이크 라는 곳인데 시그니처 곰돌이 케이크가 유명하더라구요...-_-* 인스타 후기사진 마구 보다가 이 곳으로 결정했습니다. 망원동... 계속해서 예쁜 가게가 많아지고 있어서 산책하는거 정말 좋아했는데 이런 보물같은 가게도 있을줄이야 ㅎㅎ 위켄드케이크는 망원역에서 은근 걸어야 합니다... 지도앱 찍고가는것을 추천드려요.. ㅎㅎ 위켄드케이크 서울특별시 마포구 망원로2길 106 1층 워낙 인기가 많아서.. 당일 구매는 방문 전에 위켄드케이크 공식 SNS 꼭 알아보시고 가시길 추천드려요! 망원동 답게 내부 인테리어도 갬성 갬성 ♥ 촛불, 머리띠 등 파티에 있으면 좋은 소품들도 다양하게 팔고 있어요 ㅎㅎ 착한 가격이라 더 죠음.... 주인 기다리고 있는 예쁜 케이크들♡ 다음번에 주문한다면 곰돌이 케이크 살끄에요. ㅎ 그리고 언니가 주문한 형부 생일케이크! 둑은둑은... 진짜 존예... ♡ 너무 열어보고 싶었어요. (내꺼 아님ㅠ) 옆에서도 언니 사진찍는중 ㅋㅋㅋ 언니 열심히 찍는 동안 저는 내부 구경좀 했습니다. 후후 역시 케이크는 밥 먹고 언박싱해야쥬.... ♡ 색감도 퀄리티도 최상이었습니다. 이..이걸 아까워서 어케 먹냐며.. ㅠ 형부 생일 축하해요 ☆... 선물은 전 주에 미리 드렸음...ㅎㅎ 케이크 언박싱은 밥 먹고 하고, 먹는거는 집에 돌아와서 고고링~ ㅎ 캔들은 위켄드케이크에서 파는거 사고, 바로 촛불 붙이고 노래하고 소원빌기 ♪ 형부 그리고 언니네 부부가 계속 행복하길 바랍니다! 케이크 단면은 이렇습니다~ 치즈크림 + 생크림의 꿀조합이었어요. 예전에 수제+감성 케이크에 심하게 배신당한적이 있어서 기대를 안했는데.. 왠걸 엄청 맛있습니다. ㅠㅠㅠㅠ 갠적으로 특별한날 또 먹고싶을 만큼... 한조각씩 념념하고 다시 냉장고로.... ☆ 치즈케이크는 역시 사랑입니다. 날만 밝았어도 아메리카노랑 같이 먹는데 아쉽습니당. 레터링 케이크는 처음 해보는데 특별하고 신기한(?) 경험이었습니다. 저는 언젠가 애인 생기면 제작해보는걸로. 젠장 ㅋㅋ #일상 #데일리 #언니돈 #니돈니산 #케이크 #위켄드케이크 #망원동케이크 #레터링케이크 #형부생일 #생일축하해요 #HBD"
망원동 당일 레터링케이크 가능한 위켄드케이크,"사진은 22/5월 기준 위켄드 케이크 사진입니닷 .. 지금은 망원동 #크레타마켓 3층으로 이전하심 ! 위켄드케이크 서울특별시 마포구 망원로2길 69 3F 서울 마포구 망원로2길 69 3F 망원동 398-35 망원동에 케이크 주문제작 좋아하는 곳 있는데 ! 이번엔 급하게 예약하느라 망원동 당일 레터링 케이크 가능한 곳 찾다 발견한 위켄드케이크 ! 근데 여기도 거의 월, 화 휴무라 월요일 화요일 케이크 픽업은 안되는.. ㅠ.ㅠ 내가 방문했을 때 기준 당일 스몰 케이크 16,000원 였고 카톡 채널로 연락드렸고 선입금 해서 예약했음! 현금영수증 발급도 해주셨다 ! 지금은 18,000원 으로 올랐 .. ( ᵒ̴̶̷̥́ _ᵒ̴̶̷̣̥̀ ) .... 여기 귀여운 케이크 엄청 많은 것 같더라구요? 저는 무조건 100% 동물성 생크림 사용하는 곳으로 케이크 예약하는 편인데 위켄드케이크도 100% 동물성생크림 필라델피아 크림치즈 앵커버터로 만든다고 하심! 그리고 귀여운 선글라스나 케이크 초도 팔고 있어서 망원동에서 케이크 픽업하면서 같이 구매하기도 좋을 듯 ㅎ.ㅎ 2022 넘 귀엽 ㅋㅋㅋㅋㅋㅋㅋㅋㅋ 저 달력 2021 버전인가효 .. 귀여운 거울도 있는 위켄드 케이크 지금은 매장 이전 하셔서 분위기 또 다른 것 같더라구요? 저는 미니케이크 원형 했고 노란색 계열 가능하면 .. 부탁드렸는데 아무래도 당일케이크라 .. 없었나봐요 .. 그리고 꼭 .. 레터링 확인 꼼꼼하게 하세요 ! (사장님이 확인할 시간 주심) 난.. 당연히 .. 이런 적 없어서 대충 봤을 때 맞는 것 같아서 (상자 안 열고 봤음.. ;; ) (본인이 꼼꼼한 성격 아니기도 한데 .. ) 레터링 잘못 적혀있어서 ㅋㅋㅋ 내가 수습했다 .. ;; 땀났다 진짜 ........ 그리고 고정하는 핀 없다고 하셨나? 조심히 들고가라고 하셨당 ! 초 하나랑 .. 포크 챙겨주심 아마 성냥.. 도 있었을.. 걸요..? 커스텀 케이크와 조각 케이크 .. ? 도 하시는 듯 해요? 사장님이 귀여운거 좋아하시는 듯.. 매장도 아기자기 외부도 아기자기 ㅋㅋㅋㅋㅋㅋㅋㅋㅋ 고친거 티나나요? ㅋㅋ ㅋㅋㅋㅋㅋㅋㅋㅋㅋㅋㅋ 후 ;; 망원동에서 급하게 레터링 케이크 필요할 때 당일케이크 필요할 때 위켄드케이크 추천드려요! 저는 진짜 급할 때? 만 갈 것 같아요 .. ㅎ 선물한 거라 .. 맛은 모르겠지만 ... 미리미리 예약하자 .. ^^.. ㅋㅋㅋㅋㅋㅋㅋㅋㅋ Instagram의 위켄드 케이크 wee kend it🙃(@weekend__cake)님 프로필 • 게시물 601개 팔로워 7,311명, 팔로잉 20명, 게시물 601개 - 위켄드 케이크 wee kend it🙃(@weekend__cake)님의 Instagram 사진 및 동영상 보기 instagram.com"
망원동레터링케이크 위켄드케이크 / 예약없이 당일케이크 주문 내돈내산 후기,"레터링케이크에 진심인 뜌니펭.... 100일 기념으로 레터링케이크를 할까말까? 수천번을 고민했다 짝꿍이 단걸 안 좋아해서 어차피 주문하면 나 혼자 먹을게 분명한데... '돈써야할까?' VS '하지만 케이크는 하고싶어' 무한고민고민x100끝에 결국 하자!로 결론 급하게 2일전에 예약없이 당일케이크 주문이 가능한 망원동레터링케이크 🍰 위켄드케이크를 인스타에서 찾았다 (취향저격) 당일케이크의 경우 디자인은 랜덤! 랜덤디자인외 곰돌이케이크도 있어서 귀여운 곰돌이케이크로 예약하고 레터링도 미리 말씀드려서 초랑 함께 구매했습니다 :) (사장님이 초는 서비스로 💕) 예약당일날 망원동레터링케이크를 찾으러 위켄드케이크 도착! 외관부터 아기자기한 모습 노란색 입간판이 딱! 보여서 멀리서도 찾기 쉬웠어요 아담한매장크기와 귀여운색감이 돋보이는 망원동레터링케이크 위켄드케이크 사실은 사진 여러장 찍고싶었는데 전날 에버랜드 조지고와서 체력도 없없고 나름 서프라이즈로 준비한거여서 짝꿍은 빵사는줄알고 간거여서 후다닥 찍고 매장안에 들어가서 케이크 받아왔어요...ㅎㅎㅎ 위켄드케이크 매장안에서는 귀여운 소품들과 다양한 초들도 준비되어있어서 현장에서 추가구매도 가능합니다 :) 사장님께 예약자 이름을 말하고 케이크를 받았는데 기대했던만큼 너무 귀여운 곰돌이 케이크 🐻🎂 수평으로 기울어지지않게 잘 가져가라고 주의사항도 안내하주시고 미리 예약한대로 레터링문구도 이쁘게 기재되어있어서 만족 :) 옆에서 ""뭐야? 이거 언제준비했어?"" 뜌니펭은 다 계획이 있다구 ^____^ . . . . . . . . 방전된 체력을 가진 몸뚱이를 끌고 숙소로 컴백....! 숙소에 들어와서 꺼낸 귀염귀염 위켄드케이크 당일케이크♥ 위켄드케이크는 100%동물성생크림과 신선한 버터, 필라델피아크림치즈로 만들어져지고 별도보존제가 안들어가서 냉장보관은 필수!!! 냉장보관시 최대 3일까지는 보관가능합니다 :) 위켄드케이크의 귀여운 곰돌이케이크 경우 귀부분은 이쑤시개로 고정되어있어서 드시기전 귀부분에 있는 이쑤시개는 꼭! 제거하시고 드셔주세요 :) 곰돌이 얼굴도 귀여운데 귀부분에 꽃삔꽂은듯한 모습도 너무 귀엽지않나요? ㅠㅠ ♥ HAPPY 100 DAY ♥ 문구도 글씨도 아기자기해서 너무 귀여워요 나름 100일기념 서프라이즈로 준비한 망원동레터링케이크였는데 짝꿍이 좋아해줘서 다행이였어요ㅎㅎㅎ 친절하신 사장님께서 서비스로 챙겨주신 스마일꼬깔콘 :) 모자도 씌워주고 찰칵- 너무 귀엽워요 ㅠㅠ 이맛에 레터링케이크하는거죠! 일반 케이크에서는 느낄수없는 이 귀여움♥ 뭐야 초점 왜이래 우유랑 함께 위켄드케이크 조져조져! 숙소에서 빔프로젝트로 다다다! 보면서 먹는데 너무 행복했어요 ㅎㅎㅎ (동년배들...다다다! 알죠? 우주야! 예나야!) 귀부분 이쑤시개를 제거하고 초코시트+바닐라크림으로 구성된 위켄드케이크를 먹어봤는데 JMT!!! 단거 별로 안좋아하는 짝꿍도 평소보다 더 많이 먹더라구요 :) 우유랑 같이 먹으니 더 고소하고 달달하니 맛있었어요 근데 아무래도 곰돌이 모양이여서 먹다보니 잔인.....ㅠㅠ 레터링케이크를 많이 주문해봤는데 2일전에 예약해도 받아주는 당일케이크는 찾기힘들뿐더러 가격도 2.5로 저렴한편에 귀여운퀄리티 그리고 맛까지 보장된 레터링케이크를 찾기는 더더욱 힘든데 이게 가능하다니....! 맛+가격+퀄리티, 3박자가 완벽한 망원동레터링케이크 🍰 위켄드케이크 거리만 집에서 가까웠다면 더 자주 이용할거같아요 :) 평일 12:00 -19:00 월,화 휴무 (인스타 참고) 포장/반려동물동반/국민지원금 가능 서울 마포구 망원로2길 106, 1층 망원역 2번출구에서 가까워요 위켄드케이크 서울특별시 마포구 망원로2길 106 1층"
