title,content
[찻집] 티노마드 - 망원동,"안녕하세요? 에듀힐러 정입니다. 오늘은 결혼 기념일에 두번째 코스로 갔었던 망원동 분위기 장난아닌 찻집 티노마드 소개드리려 합니다. 위치는 50m © NAVER Corp. 티노마드 서울특별시 마포구 포은로 112 2층 예약 망원동 망원시장 근처에요^^ 지도에서 티노마드 찍고 검색해서 가다가 근처다 싶으시면 골목을 잘 보셔야 합니다. 요런 간판 하나가 덩그러니 놓여있는 곳이 티노마드 건물. 2층으로 고오! 티노마드는 100퍼센트 예약제로 운영합니다. 하루에 4회 오후 1시, 3시, 5시, 7시 로 예약 가능하며 이용시간은 1시간 30분이에요. 예약금은 10,000원! 저희는 3시에 예약했고 2시 55분쯤 도착했는데 기다려야 했답니다. 2층 벽면~ 3시가 되어 입장! 자리는 원하는 곳에 앉으면 됩니다. 저희가 앉은 자리는 창가. 정갈하지요? 창가 자리에서 바라본 찻집 내부의 모습입니다. 사진안에는 주황색 불빛이 잘 잡히지 않아 실제 감성을 잘 보여드리지 못하는 것 같아요. 실제 가보시면 진짜 교토 감성의 찻집이랍니다. 좌석은 입식도 있었고, 신발벗고 앉는 좌식도 있으니 원하는 대로 선택하시면 되어요. 자리에 놓여 있었던 안내장이에요. 중요사항 티노마드 이용시간은 1시간 30분 (연장 안됨) 리뷰이벤트 있음 (상품 : 백색유잔) 메뉴입니다. 총 두 페이지인데요 앞 페이지에서 먼저 메뉴를 고르고 두번째 페이지에서 세부적인 것들을 선택해 주는 방식이에요. 저희는 진짜 엄청 고민했답니다. 원래 빙수가 포함된 세트를 먹으려고 했는데 제가 데이트 전날부터 몸이 갑자기 좋지 않아져서…ㅠㅠ 이 날도 겨우겨우 나온거라 아쉽지만 2인 차세트로 결정했어요. 2인 차세트 결정한 후에는 1 .차종류로 말차와 호지차를, 2.다식은 화과자를 선택했어요. 계산은 차 메뉴판을 들고 카운터로 가서 하고 오면 되요. 기다리는 동안 찻집 내부 구경! 다양한 다기, 다구, 차를 살 수 있었어요. 그리고 요런 작은 연못도 있었답니다. 꺄! 혹시 이웃님들 제주도에 ‘토템오어’ 라는 찻집 아세요? 지금은 없어졌는데 몇 년전에 제주여행 갔다가 완전 반한 찻집인데요, 그 찻집의 느낌이 물씬 나는 모습이었어요. 그리고 찻집 내부로 들어가는 중간 쯤에 있는 찬장. 디스플레이도 참 예쁘게 해 놓으셨죠~? 찻집의 제일 깊숙한 곳에는 쇼룸이 있습니다. 일부는 구매할 수도 있으니 관심있으신 분은 찬찬히 보셔요^^ 티노마드 재생 1 좋아요 0  접기/펴기 티노마드 주문한 차가 나와 다시 자리에 앉았습니다. 이 사진은 불빛이 잘 담겼네요^^ 2인 차세트입니다. 제가 디저트로 주문한 건 화과자! 나머지 3개(양갱, 떡, 케이크) 는 기본으로 나오는 디저트였어요. 기본 디저트 3개도 다 맛났답니다. 양갱은 달달했고 떡은 몰랑몰랑하며 쫀득했구요, 케잌은 말차치즈케잌 같은 느낌이었어요. 메인 메뉴인 말차. 말차는 가루차로 사진에 보이는 빗자루 같은 다구인 ‘차선’으로 저어서 가루를 물에 풀어주며 먹는 차입니다. 저희는 올해초 교토에 있는 잇포도 찻집에서 말차를 먹어보았는데 그 곳 말차는 진짜 너무 엄청 많이 진했었어요. 그런데 티노마드의 말차는 그보다는 연한편이어서 오히려 먹기에는 좋았답니다. 그리고 또 다른 메인 메뉴인 호지차. 그런데 이 호지차는 뚜껑을 덮은 후, 나뭇잎 모양의 거름망에 걸러 마셔야 한다는 사실! 저희는 먹는 중에 알게 되서 그냥 먹었는데 나뭇잎 모양의 거름망이 물빠짐도 잘 되고 미세한 가루도 잘 걸러 줘서 좋더라구요. 저희는 그 나뭇잎 모양 거름망이 거름망이라 생각도 못하고 받침이라고 생각, 찻잔 아래에 깔아 놓았었답니다 하하하;;;; 1주년을 기념하며 한 컷. 너무 마음에 드는 사진이라 현재 카카오톡 프로필로 저장해 두었답니다. 그리고 티노마드에서 정말 괜찮다고 생각했던 부분! 찻집 중앙에 위와 같은 항아리가 있었는데요. 김이 펄펄나는 것이 보이시나요? 요기 따뜻한 물이 있었어요. 이 물을~ 요 국자로 길어올려서 차호에 부어주면 된답니다. 안그래도 차를 어떻게 더 우려먹지 했는데 다른 분들이 이렇게 하시더라구요. 항아리 주변에 있던 예쁜 새 정말 소품 하나하나가 취향저격이라 이 찻집을 그대로 집으로 옮겨 놓고 싶었어요. (집 크기가 카페 크기 보다 작을 것 같다는 건 비밀 ㅋㅋㅋ) 다 마시고 보니 처음에 받았던 안내문에 차 거름망의 쓰임과 따뜻한 물 추가 방법이 쓰여져 있었더라구요^^;;; 이 날은 이런 걸 볼 정신이 없었기에 ㅋㅋㅋ 정말 100 퍼센트 만족했던 찻집 티노마드 티.노마드(@t.nomad_kr) • Instagram 사진 및 동영상 팔로워 17K명, 팔로잉 2명, 게시물 739개 - 티.노마드(@t.nomad_kr)님의 Instagram 사진 및 동영상 보기 instagram.com 차를 좋아하시는 분들도 찻집의 분위기를 좋아하시는 분들도 모두를 만족 시킬 수 있는 공간이라고 자신합니다. 참!! 그리고 저 리뷰이벤트 참여해서 백색 유잔 받았어요!! 담날에 가방에서 꺼내서 꾸깃꾸깃. 요것이 백색유잔! 잔 가장자리가 좀 두꺼운편이고 꽃잎을 연상시키는 찻잔이 참 예뻤어요. 요즘 차 담아 마시는 중이랍니다^^ 오늘의 소개는 여기서 마칠게요~ 이웃님들 남은 주말도 건강하고 편안하게 보내시고 11월의 마지막 주도 화이팅해 보자구요^^!"
"망원동 맛집 티노마드 모리, 파티세리","내돈내산 인증 방문 티노마드모리 서울특별시 마포구 망원동 417-14 비동 1, 2층 (티노마드모리) 스키야키 예약 2023.10.방문 망원동 맛집으로 유명한 티노마드! 티노마드 모리일 때 방문했었는데 지금은 이름이 파티세리로 바뀌었더라고요..? 메뉴는 동일하게 스키야키였지만 비주얼이 조금 달라졌어요 분위기와 맛은 역시나 훌륭했다~ (근데 포스팅하는 지금은 또 티노마드 모리임......) 망원동 맛집 - 티노마드 모리 참고로 티노마드 카페(=찻집)와 티노마드 모리(=파티세리)는 다른 매장이에요 둘 다 망원에 위치해 있어서 잘못 찾을 수 있다는 점...!! 안 그래도 따로 온 친구가 티노마드 카페에서 기다리고 있었거든요! 헷갈릴 수 있으니 미리 상호 체크하고 방문하시길~ 이 외관이 티노마드 모리랍니다 저는 티노마드 찻집과 모리 둘 다 방문했던 사람이라 쉽게 찾아왔어요 12시 30분으로 예약하고 15분쯤 도착했는데 20분에 안내해 주셨어요 들어가는 입구도 감성적이랍니다 일단 분위기가 훌륭한 망원동 맛집이에요 티노마드 모리 내부 가장 입구에 위치해 있는 다다미룸 신발을 벗고 착석하는 자리이고 4명까지 착석이 가능합니다 3인 이상일 경우에 이용이 가능하기 때문에 3명으로 예약한 우리는 여기로 안내받았어요 개인적으로 안쪽 자리 분위기가 훨씬 더 예뻤어요 파티세리 예약도 여기 자리인 것 같더라고요~ 근데 지금은 또 파티세리 예약이 사라진 상태,, 어떻게 운영되는지 인스타 참고하셔야 할 것 같아요ㅠ 티.노마드(@t.nomad_kr) • Instagram 사진 및 동영상 팔로워 17K명, 팔로잉 2명, 게시물 730개 - 티.노마드(@t.nomad_kr)님의 Instagram 사진 및 동영상 보기 instagram.com 암튼 티노마드 모리 자리 분위기~ 화장실 분위기도 참 예뻤습니다 우리는 다다미룸 착석! 짐 보관 가능했지만 살짝 좁은 느낌이었어요 세팅은 미리 되어 있습니다 메뉴는 스키야키 하나기 때문에 이용방법만 큐알 찍어서 확인하면 됐어요 찻잎(호지차)을 주전자에 넣고 우리는 게 1번이길래 바로 따라 해 줍니다 감성 최고..♡ 요즘 날씨에 잘 어울리는 망원동 맛집이에요 차는 뜨겁지 않고 미지근해서 무난하게 마셨어요 차 마시며 기다리는 메뉴~~ 세팅되는 게 보여서 더 기대가 됩니다 먹는 방법은 자세하게 그림으로 설명되어 있어서 참고하기 좋습니다 왼쪽 스키야키가 2인분이고 오른쪽 스키야키가 1인분이에요 가격은 1인분에 29,000원입니다 위에 올라간 구름은 뭔지 궁금했는데 솜사탕이에요! 달고나 냄새가 솔솔 납니다 육수가 끓으면 솜사탕을 넣어주세요~ 솜사탕은 단 맛 담당인 것 같습니다 지난번 티노마드 모리 때는 주먹밥을 선택해서 먹었는데 이번에는 선택사항 없이 밥으로 나왔습니다 흰쌀밥이라 스키야키랑 잘 어울립니다 스키야키에 들어 있는 우동부터 건져먹고 건더기 차례대로 먹어줬어요 스키야키는 간이 센 편이라 노른자 소스로 중화시켜 먹어줍니다 고기랑 야채는 더 준비되어 있으니 양은 충분합니다! 고기 질 대박 좋음 추가로 넣고 만족스럽게 먹었습니다 조금 짜지만 노른자 소스와 함께라면 문제없어요! 식사가 끝나면 준비해 주시는 후식~ 말차가 진하고 맛있습니다 쿠키는 랜덤이에요ㅎㅎㅎ #망원동맛집 #티노마드모리 #스키야키맛집 네이버 예약자 리뷰 작성하면 백색유잔 증정해 주시니까 꼭 리뷰도 남겨주세요 따로 구매하는 가격은 6,800원이에요 저는 티노마드 찻집에서 하나 받은 게 있어서 이번에 또 받고 세트로 마련했습니당 종이봉투에 담아주셔서 소중하게 들고 왔어요>< #내돈내산 벌써 두 번째 방문인 망원동 맛집인데 이번에도 만족하고 갑니다 070-8691-3969 서울 마포구 망원로2길 19 비동 1, 2층 매일 13:00~20:30 19:50 라스트오더 매주 화요일, 목요일 휴무 50m © NAVER Corp. 티노마드모리 서울특별시 마포구 망원로2길 19 비동 1, 2층 예약"
망원동 가볼만한곳 망원시장 놀거리 I 혼자가기좋은 서울찻집 한옥티카페 티노마드,"I 망원동 가볼만한곳 망원시장 놀거리 I 혼자가기좋은 서울찻집 한옥티카페 티노마드 I 서울핫플여행 I 나리꽃 ' 여행담다' I 찻집 좋아하는 분들 사이에선 이미 유명한 티카페를 다녀왔다. 대학생 때부터 와보고 싶었던 곳인데 100% 예약제이기도 하고 망원동까지는 거리가 꽤 멀어서 미루고 미루다가 드디어 가보았다 ㅎㅎ 혼자가기좋은 사색하기좋은 망원동 가볼만한곳 망원시장 놀거리 서울찻집 한옥티카페 티노마드 서울 마포구 포은로 112 2층 매일 13:00 - 20:30 (매주 목요일 정기휴무) 02-545-5084 단체석, 포장, 예약, 무선 인터넷, 제로페이 가능 망원동 가볼만한곳 망원시장 놀거리 서울찻집 한옥티카페 티노마드 네이버예약 망원동 티노마드 카페는 네이버 예약이 필수다 ! 선결제로 10,000원을 내고 차액은 매장 이용시 내면 된다 ~ 참고로 예약 후 이용자 만족도가 높아 네이버 예약 어워즈에도 선정되었다. Next image 티노마드 서울특별시 마포구 포은로 112 2층 예약 망원역 2번출구에서 내려 도보 10분 안쪽으로 도착 가능하다. 망원시장을 지나 뒷골목으로 들어오면 건물 2층에 있는 카페를 만나볼 수 있다. 낡은 다세대 주택에 위치하고 있어 어떤 곳일지 더욱 궁금해졌다 ㅎㅎ 주말 오후 1시 첫 타임으로 예약했고 생각보다 일찍 와서 여유롭게 사진찍고 있었는데.. ! 알고보니 같은 시간대 예약자들 미리 와서 이미 내부로 들어가 있더라는 사실.. ㅋㅋ 먼저 오는 순서대로 자리를 잡을 수 있어서 적당히 여유있게 미리 들어가는게 좋다. 원하는 자리 못 앉아서 살짝 아쉬웠다.. 주말 오픈 시간부터 인기가 참 많았다. 예약제인지 모르고 방문했다가 그냥 돌아가는 분들도 몇 팀 있었다 ㅠㅠ 외국인들한테도 유명해졌는지 카페로 들어가는 모습을 종종 보았다. 사진만 찍기엔 아쉬워서 영상으로도 남겨보기 ~ 많은 메스컴에도 소개가 될 만큼 티노마드 만의 매력이 확실해 보였다. 고즈넉한 감성 좋아하시는 분들께 꼭 추천드리고픈 카페다 ~ 남는 자리가 있으면 당일 예약도 가능하다고 하는데 가능성이 낮으므로 미리 예약하며 날짜 기다리는게 맘 편할 수도 있다. 여기가 한국이 맞나..? 싶을 정도로 잔잔하고 고급진 일본풍 분위기가 느껴졌다. 공간도 꽤 넓고 자리도 많은 편이었다. 공방에 놀러온 것 같기도 하고 ㅎㅎ 은은하게 빛나는 노란 불빛이 숨겨진 감성을 자극하는 것 같다. 서울 유명 찻집 티카페 답게 여러 기념품도 만나볼 수 있다 ~ 차와 찻잔, 1회용 차까지 차 좋아하는 분들껜 천국이 아닐까싶다.. 하나하나 둘러보는 재미가 있는 망원동 티노마드 ! 카페 내부 구경을 하다가 우선 주문부터 하기로 했다. 여긴 또 왜 이렇게 예쁜지.. 흩날리는 나무 영상이 음악과 어울려 몽환적 풍경을 나타내줬다 ㅎㅎ "" 쿠리킨톤, 계절의꽃, 모리의숲, 노마드군 카스테라. 티노마드 크림모찌 "" 작고 귀여운 디저트들도 보였다. 이름도 어쩜 뽀짝한지 ㅋㅋ 정서와 수면 활동에 좋다는 라벤더 오일도 만나볼 수 있었다. 개인 소장이나 선물용으로 괜찮아 보인다. 카페 내부 안쪽으로 들어오면 공방같이 생긴 아늑한 소품샵 ..? 굿즈샵..? 을 볼 수 있다 ! 영화 속 한 장면인 것처럼 몽환적인 천장 인테리어가 신기했다. 나에겐 너무나 특별하게 느껴졌는데 생각보다 여기 구경하는 분들이 많이 없었던 것 같다.. ㅎㅎ 구입도 할 수 있는 것 같은데 자세한 사항은 카페 직원분께 문의해보는게 젤 좋을 것 같다 ~ 자리에 앉으면 메뉴판과 이용안내가 적힌 종이를 주신다 ! 이용시간은 1시간 30분으로 제한되어있고 리뷰 이벤트를 작성하면 백색유잔을 선물로 준다고 한다. Next image 1인 차세트 (차1+다식1) 2인 차빙세트 (차1+ㄷㅏ식1+빙수1) 2인 차세트 (차2+다ㅣ식1) 차 종류로는 "" 노마드 차, 호지차, 말차라떼, 호지차라떼, 말차, 겐마이차, 말차 칵테일 "" 다식으로는 "" 계절의 화과자, 노마드군 카스테라, 티노마드 모찌떡 "" 빙수는 "" 말차, 호지차 "" 가 있다. 나는 겐마이차 화과자를 선택했다 ! 15분 정도 기다렸나..? ㅎㅎ 이리저리 천천히 구경하다보니 금방 차세트 한상을 차려주셨다. 너무나도 예쁜 비주얼에 한참 사진이랑 영상만 계속 찍었다. 어디서나 포토존 가득한 찻집이다.. 망원동 가볼만한곳 망원시장 놀거리💛 서울찻집 한옥티카페 티노마드🍵 재생 6 좋아요 0  접기/펴기 망원동 가볼만한곳 망원시장 놀거리💛 서울찻집 한옥티카페 티노마드🍵 수채화로 그려낸듯 다채로우면서 앙증맞고 귀여운 1인 차세트다. 양이 많으면 어쩌지 고민했는데 1인이 먹기 딱 알맞는 세트였다. 계절의 화과자 계절의꽃이라고 불리는 이 화과자는 부드러운 앙금 안에 유자향이 가득한 네리키리 화과자라고 한다. 한 입 베어먹는 순간 달달하고 상큼한 딱 화과자 그대로의 맛이었다 ! 디저트 중에 젤 맛있었다 .. ㅎㅎ 티노마드 크림치즈 고구마 모찌 안에 고구마 크림치즈가 들어간 말랑말랑 모찌였다 ㅋㅋ 맛은 그냥 예상가는 맛이었는데 언제나 고구마나 절대 맛없없이다 .. 말차브라우니 팥양갱 양이 딱 한입 두입이면 끝날 크기라 부담없이 먹기 좋았다 ㅎㅎ 특별한 맛은 잘 모르겠고 .. 차와 함께 기분내며 먹기 좋았다 ~ 겐마이차란 ? 국산 현미와 녹차잎으로 구수하고 깔끔한 맛이 느껴지는 건강차다. 평소에 고소한 할미 입맛인 나에게 잘 어울리는 차인 것 같아서 골랐다. 차 따라는 영상을 릴스로 제작하여 인스타그램에 올려봤는데 .. ! ㅎㅎ 생각보다 반응이 좋아서 놀랐다. 망원동 가볼만한곳 망원시장 놀거리💛 서울찻집 한옥티카페 티노마드🍵 재생 16 좋아요 0  접기/펴기 망원동 가볼만한곳 망원시장 놀거리💛 서울찻집 한옥티카페 티노마드🍵 답답한 일상에서 벗어나 혼자만의 힐링 시간을 보내고 싶다면 망원동 티노마드 한옥티카페를 추천한다. 다음엔 친한 친구와 또 오고싶다 ~ 1일 1포스팅 국내 핫한 여행 소식을 전달하는, 크리에이터이자 여행 인플루언서 나리꽃입니다. 네이버에서 @나리꽃 검색하고 팬하기 눌러주시면, 트렌디한 정보를 빠르게 만나보실 수 있습니다."
"[카페] 티노마드파티세리 _ 망원동의 작은 일본 (메뉴, 맛설명, 예약, 사진스팟)","너무너무 내 취향일 것 같았던 카페 한 달쯤 전인가? 윰이 먼저 가보겠다고 했는데 어쩌다보니 나와 함께 가게 되었다 나 대신 예약까지 해준 덕분에 편히 다녀왔다 히히 감삼다🫶🏻 (스압주의) #망원동 #망원동카페 #티노마드파티세리 티노마드파티세리 - 메뉴 : 아마이말차, 겐마이차(H), 룬(말차,럼레이즌) - 가격 : 8,000/6,000/5,500-5,800 - 재방문의사 🍵🍵🍵🍵🍵🍵🍵🍵🍵 100%예약제라 워크인은 불가능! 예약한 정각부터 입장이 가능하다 들어가자마자 보이는 포토스팟들 이미 입구에서 일본 분위기 끝장남 야외 좌석으로 가는 길에 있는 소품들 일부는 구매도 가능한 모양이다 차선도 보인다! 저걸로 말차가루 열심히 풀어서 먹은 적도 있었는데 지금은 그릇장 구석에 박혀있다 한번 꺼내봐야하나… 그리고 옆쪽 선반에도 다양한 소품들이 분위기를 더한다 전반적으로 어두운 분위기의 카페에 따뜻하고 딥한 우드톤이 너무 잘 어울렸던! 곰 아저씨도 발견🐻 우리는 운 좋게도 외부 좌석에 앉았는데, 외부라고 해서 덥지는 않았다! 냉방이 잘 되어있었기 때문에 시원하게 머물면서 디저트를 즐길 수 있었음 외부가 찐 사진스팟이니, 밖에서 입장시간을 기다릴 때에는 문 근처에 서성이기를(?)추천한다! 외부는 딱 2자리 뿐이라고요 소리가 너무 예뻤던 풍경과 탈탈탈 돌아가는 옥색 선풍기 토토로에 나올 것 같지 않나요 여기가 내 원픽 일본 사진스팟 제가 전철을 탔는지 비행기를 탔는지 모르겠네요 아 일본 가고싶다악 아래에는 요로코롬 등이 있다 진짜 저거 토토로같애 이때 소나기가 내렸었는데 천장을 막은 저 비닐 덕분에 빗소리가 잘 들려서 훨씬 운치있었다고 합니다 ☔️ 메뉴판! 큐알로 이미지도 볼 수 있다 개인적으로 이미지 볼 수 있는게 좋았음 그리고 나온 우리의 메뉴들 🫖겐마이차 현미녹차같은 맛이었던 겐마이차! 비주얼 절대 포기 못하는 우리 둘은 더운 날씨임에도 불구하고 따뜻한걸 주문했다 카페가 시원해서 마시면서 덥지는 않았기 때문에 맛은 제대로 즐길 수 있었다 고소한 차가 룬의 달달함을 싸악 내려줬다! 작고 귀여운 잔이 함께 서빙되는데 따라두고 잠깐 기다리면 먹기 좋은 온도가 된다 잔이 작아서 빠르게 적당한 온도가 되는 듯 했던! 🍵아마이말차 일본어 능통자인 윰이 아마이=달다 라고 알려줬다 말 그대로 ‘ 단 말차’ 살짝 달면서도 입에 남지 않아서 윰 피셜 - 한 모금 마시고 잔을 내려두면 이미 단 맛이 사라진다 고 할 정도로 깔끔했다! 마셔보면 알아요 저게 무슨 말인지🤷🏻‍♀️ 차는 차끼리 한번 더 찍어주시고➿ 🌝룬 룬은 버터크림 샌드의 이름이다! 우리는 말차와 럼레이즌을 주문해보았다 럼레이즌은 건포도 몇 알이 들어있고 럼 향이 입혀진 버터크림이 얇고 바삭한 쿠키에 샌딩되어있었다 말차보단 부드러운 크림에 바삭한 쿠키가 잘 어울렸당 럼 향도 진하지 않고 건포도도 그리 많이 들어있지는 않았기 때문에 무난했던 메뉴! 말차는 진한 말차 버터크림이 마찬가지로 얇은 쿠키에 샌딩되어있었다 색깔만 봐도 말차의 진함이 잘 보였기 때문에 말차 처돌이인 나는 너무 좋았다고 합니다💚 꾸덕한 말차크림에도 바삭한 쿠키가 잘 어울렸음! 버터크림인 만큼 두 메뉴 모두 한 입 먹으면 약간 미끄덩해서 호불호가 갈리겠지만 그래도 많이 느끼하지 않아서 나쁘지 않았다 단면도 찍었지롱 저기 보이는 복숭아모양 도자기 그릇을 열면 물티슈도 나오고 복도 나온다 아무 생각 없이 ‘이건 뭐지?’하고 열었다가 기분이 너무 좋아졌던…😇 다들 복 받고 가세요➿ 복! 그리고 내부 테이블은 요렇게 사각형인데 한쪽은 찻물을 뜰 수 있는 자리이고, 나머지 부분은 세 팀이 착석할 수 있는 자리이다 저 밝은 색깔의 돌 위에 찻잔을 두고 나무국자(?)로 찻물을 뜨면 된당 우리도 한 번 리필해서 마셨는데 생각보다 뜨거워서 좋았다 마녀가 요상한 스프 끓일 것 처럼 생겼어 네이버 예약자 리뷰를 남기면 예쁜 백색유잔을 주시니까 잊어버리지 말고 꼭 챙깁시다! 같이간 윰이 차를 굉장히 좋아했기 때문에 윰한테 쓰고 받아가라고 당부했다 챙겨가는 표정이 행복해보여서 나도 좋았음🌝 계산대 옆에도 찻물 주전자와 차선이 있었다 진짜 저걸로 만들어주시는 건 아닌 것 같지만요 보기만해도 뭔가 여기는 찐이다! 이런 느낌이었달까 1시간30분이 순삭되고 다음 예약자를 위해 자리를 비워주려 나가는 길에 만난 멈무 덕분에 카페에서 나서는 길이 한층 즐거워졌다! 사소한 부분 하나하나 꼼꼼히 닿아있는 사장님의 손길이 느껴져서 더욱 기분좋게 머물다 올 수 있었던 망원동 티노마드파티세리! 망원동에는 그냥 티노마드 라는 카페도 있으니 예약하고 헷갈리지 않도록 주의합시다 왜냐 나도 헷갈릴 뻔 했고 내 앞사람들도 헷갈려서 돌아갔기 때문에… 네이버 예약 :: 티노마드파티세리 예약 안녕하세요 티노마드파티세리입니다. 말차 파르페와 버터크림산도등 차와 디저트를 즐길수 있는 공간입니다. 저희는 한시간 삼십분동안 이용하실 수 있는 예약제로 운영되며 당일예약 가능합니다. (예약시간보다 일찍 오시면 자리안내가 어렵습니다.양해바랍니다) *원하시는 예약날짜와 시간,인원을 선택해 주세요. *노쇼 방지를 위해 예약금 만원을 선결제 부탁드리며,현장에서 결제시 예약금은 차감됩니다 *시간변경이나 취소에 관한 영업시간중 전화응대가 어려운 점 참고해 주셔서 신중한 예약 부탁드립니다. (당일예약 전날까지는 네이버에서 직접 취소해주시면 됩... m.booking.naver.com 50m © NAVER Corp. 티노마드파티세리 서울특별시 마포구 망원로2길 19 비동 1, 2층 예약 티노마드 파티세리(@t.nomad_patisserie) • Instagram 사진 및 동영상 팔로워 1,031명, 팔로잉 2명, 게시물 33개 - 티노마드 파티세리(@t.nomad_patisserie)님의 Instagram 사진 및 동영상 보기 instagram.com"
