title,content
망원동 신상카페 온리디스 베이커리 커피맛집 밥먹고 먹어도 맛있는 디저트,"망원동 신상카페 온리디스 베이커리 커피맛집 메이님과 코칭준비로 상의할 것이 있어서 토요일 오후에 망원역에서 만났어요. 톡톡홍쌤님의 따님이 베이커리 카페 오픈하셨다고 해서, 응원 차, 이모들이 돈쭐내주러 망원역 온리디스 베이커리 카페로 향했습니다. 온리디스베이커리 서울특별시 마포구 희우정로20길 70 102호 망원역에서 망원시장까지 도보로 5분~10분 정도 걸리고요. 망원동 카페거리가 핫해서, 주변 구경하면서 걸어가면 금방! 망원동 온리디스 베이커리 카페에 도착해요. 매장위치 : 망원역 2번출구 680m, 도보 10분거리 영업시간 매일 오전11시~ 오후 20시 망원동 커피맛집 온리디스 베이커리 Only this bakery 포장해가시는 손님들도 많았고요. 아담하더라도 내부에 테이블도 있고, 밖에 계단에서도 앉아서 먹을 수 있게 자리가 있어요. 커피마시고 싶을 때, 동네 카페에는 자리가 없어서 못들어가는 곳이 있을 때도 있는데요. 망원동 온리디스 베이커리는 자리걱정없이 편한게 커피마시고, 디저트 먹고, 즐길 수 있겠더라구요. 자리걱정 마시고 가세요!! 야외 계단자리에서는 단체도 쌉가능! 야외 계단에 자리잡고 커피 마셔도, 미니 테이블이 있어서 편리하게 커피와 디저트를 이용할 수 있어요. 원목으로 된 원형 미니 테이블, 귀엽죠? 망원동 카페가 많지만, 이렇게 많은 종류의 휘낭시에와 베이커리를 판매하는 곳은 온리디스 베이커리가 유일한 것 같아요. 사장님이 직접 매장에서 만드는 거라고 하니. 더 믿음이가고요. 그래서, 망원동 작은 카페지만 베이커리 종류가 많은거구나! 젊은 사장님이 야무지게 이 많은 베이커리를 다 만들다니!!! 장사하는 모습을 보는 저희들이 다 뿌듯! 쇼케이스 보자마자 마음속으로 픽! 했던 바스크치즈케익. 커피마실 때 꼭 같이 먹어줘야 디저트의 완성이에요! 오늘 제가 갔던 날은 가오픈이라고 해서 메뉴판이 심플했는데요. 무엇보다 커피 가격이 넘나 착해요! 요즘 카페라떼가 4천원인 곳이 어디있나요?? 다음번에 온리디스 베이커리의 시그니쳐 커피가 출시된다고 해요. 카페가 아담하고, 곳곳에 사장님의 취향이 느껴지는 감각적인 인테리어가 돋보여요. 개업 축하 화분도 온리디스 베이커리 카페 분위기와 맞게 소담스럽고요. 망원동 온리디스 베이커리에서 먹은 바스크치즈케익과 휘낭시에, 커피 저는 커피전문가는 아니지만, 한모금 마시면, 원두의 품질은 조큼 알아봐요. ㅎ 워낙 회사에서, 미팅에서 커피를 많이 마시니까요. 온리디스베이커리는 베이커리 맛집인데, 커피도 참 고소하고 풍미가 깊어서 ""맛있다!"" 라는 소리가 나와요. 아이스 아메리카도, 아이스 카페라떼, 둘다 맛있어요!! 크림과 블루베리가 올라간 바스크치즈케익, 이거 처음먹어보는데, 아이스아메리카노와 넘 잘어울려요! 밥먹고 먹어도 맛있는 맛! 대파치즈 휘낭시에와 솔트캬라멜 휘낭시에 이거슨 단짠단짠의 완성이에요. 무심코 먹었다가 휘낭시에 맛을 발견한 맛! 망원동 베이커리 카페 온리디스, 화장실도 깨끗하고 좋다! 전 개인적으로 어딜가든 화장실이 중요한 사람이에요 ㅎ 특히, 음식점이나 카페는 화장실의 청결상태를 주방의 청결상태와 비슷하게 생각하셔도 됩니다. 신상카페라 당연히 화장실도 깨끗하겠지만. 화장실을 관리하는 관리력을 보면, 사장님의 센스가 보여요. 거울, 수납장, 선반이 같은 원목재질로 통일되어있고요. 디퓨저를 세팅했으니 감성과 향기까지 잡았습니다. 좌측 벽면에 콘센트 돼지코까지 막아두는 걸보면, 하나하나 디테일하게 관리하고 있슴이 보여요. 사진은 없는데, 화장실의 휴지통마저 예뻐요 ㅎㅎ 아이들간식으로도 좋은 망원동 온리디스 베이커리 휘낭시에 세트 집에서 기다리고 있을 아이를 위해 메이님이 휘낭시에를 사주셨어요. 포장하면 온리디스 로고이미지가 들어간 예쁜 키링도 선물로 담아주시더라구요. 여러개를 세트로 사가시는 손님들이 많아 오후시간에 솔드아웃 되기전에 방문하는게 좋을 것 같아요. 집에 오자마자 제 손에 들려있는 휘낭시에 포장 봉투를 받아들고, 순삭해버리기 전에 사진먼저 찍었어요. 저 휘낭시에가 10분만에 없어져버렸.......... 맨 왼쪽에 있는 발로나초코 피낭시에는 저희 아들의 원픽이었어요! 초등취향까지 저격한, 온리디스 베이커리 휘낭시에 결론 : 망원동 신상카페 온리디스 베이커리 커피 맛집, 휘낭시에도 맛있다! 망원역에서 맛있는 디저트 커피맛집 찾으시면, 온리디스베이커리 고고!!"
망원동 빵집 온리디스베이커리: 소금빵 휘낭시에 음료 다 맛있음,"안녕하세요. 오늘은 빵집 포스팅입니다. 포메리(포스트 전자책 메신저 리더되기) 번개가 있었어요. 합정에서 만날까 했는데, 망원동이 요즘 핫하다길래~~ (역시 핫한 포메리얼!!) 망원동 빵집 온리디스베이커리 하얀달님과 제일 먼저 도착했는데.. 연 곳이 읎어... ㅜㅜ 그러다 딱~! 발견한 온리디스베이커리 망원동 빵집이에요. 망원동 빵집 11시에 만나기로 했는데, 우리 10시 30분 도착. 이곳 저곳 열었나 싶어서 돌아댕기던 중에~ 온리디스사장님 오픈 준비하시는데 저희랑 눈이 딱 마주침. 저... 혹시 들어가도 될까요? 저희 오픈할 때 주문할께요. 아직 일행이 안와서요... 젊은 사장님께서 흔쾌히 들어오라고 해주셨어요. 그래서!! 온리디스 베이커리! 오늘 내가 포스팅 제대로 해 주겠다! 마음 먹었지요. ㅎㅎ 맛 없으면 안 했을텐데..ㅋ 사장님도 친절하고~ 동네 맛집인 것 같아요. 망원동 빵집으로 인정합니다. 바로 포스팅 들어가요! 온리디스베이커리 서울특별시 마포구 희우정로20길 70 102호 망원동 빵집 _ 온리디스베이커리 망원시장 근처 화장실 있음 주차 공간 (한대 가능한 듯_ 멤버 한 분이 차를 가져오셨는데, 매장 앞에 세웠어요) 소금빵, 휘낭시에, 마들렌 맛집 커피, 에이드, 오미자 차 등 음료도 훌륭함 망원동 빵집 온리디스베이커리 망원동 빵집 온리디스베이커리 요즘은 빵집도 감성 스물 스물~~ 비틀즈~ 안녕하세요~!! 망원동 빵집 온리디스베이커리 망원동 빵집 온리디스 베이커리 매장이 그리 크지 않았는데, 화장실이 있었어요. 엄청 깨끗합니다. 핸드크림도 있더라구요. (디테일 끝내줍니다) 11시 땡하자 커피부터 시켰어요. 저희 6명 정도 갔는데.. 커피고 빵이고... 밥 처럼 먹었네요. (넘 맛있었어요) 메뉴입니다. 망원동 빵집 온리디스베이커리 메뉴 망원동 빵집 온리디스베이커리 (음료도 맛있어요) 커피는 진합니다. 한 분은 약하게 해 달라고 하니까 알아서 조절해주시더라구요. 중간에 음료 추천부탁드렸더니, 직접 담근 오미자와 청귤 에이드 추천해주셨어요. 커피 만큼 너무 맛있었어요. 망원동 빵집 온리디스베이커리 진짜 이 음료들~ 꼭 드셔보세요. 상콤하니 비타민이 몸에 퍼지는 느낌입니다. 수제라 그런지~ 맛이 다르더라구요. (젊은 사장님인데- 정말 하나 하나 신경 많이 쓴 느낌이 나더라구요) 빵집이니.. 빵 보실께요. (침샘 폭발 주의) 사과 먼저 드립니다. 참으로 많이도 먹었네... ㅋㅋ 저의 최애는 소금빵! 커피와 함께 먹으니- 정말 순삭이에요. 다들 블로그를 하니까.. 경쟁하듯이 사진 찍고 경쟁하듯 다 먹었네요. 혼자있었으면, 먹기 전/ 먹은 후 만 찍었을텐데.. (분위기때문에 막~ 블로그를 하게 된다는~~ㅎ) 망원동 빵집 온리디스베이커리 소금빵하고 오미자 때문에 멀어도 다시 방문하고 싶을 정도~ 또 먹고 싶다아~~ 개인적으로 소금빵이 최고로 맛있었지만.. 그렇다고 다른 빵들도 무시 못할 맛! 휘낭시에 전문점인가봐요. 휘낭시에 종류가 정말 많더이다. 같이 간 포메리얼 덕분에 정말 하나씩 다 시켜서 다 맛봤어요. 개인적으로 대파치즈, 무화과, 솔티카라멜, 레몬... .... 에스프레소... (뭐냐~ 다 맛있는 걸로~!!) 포장해왔는데 쪼코나무숲 마들렌! 그것도 맛있었어요. 다음엔 레몬도 먹어보리라~ 포장도 가능합니다. 망원동 빵집 온리디스베이커리 맛있어서 아이들 주려고 포장했더니. 제 이름을 턱 하니 써서 쇼케이스에 보관해주셨어요. 사장님 ! 센스쟁이. 소금빵 에어프라이기에 1~2분 돌렸더니- 매장에서 먹었던 그 맛! 진짜 소금빵 엄지척입니다!! 음... 쌍따봉으로 바꿀께요. 블로그 및 sns 선생님이신 깐꼼님이 알려준 동영상 찍기 기술로 영상 찍어봤어요. 오~~ 좀 다른가요? 기포가 살아있죠? 정말 맛있었습니다. 포메리하면서.. 정말 온라인 전문가들과 지인이라는 것이 너무나 신기하고 즐거워요. 오늘은 이렇게 마무리 하고 싶군요. Have a nice dessert!! See you again ""only this bakery"" (스펠링이 맞나? ㅋㅋ)"
망원동카페 온리디스베이커리 만남하기 좋은 곳,만남이 그리울 때 온리디스베이커리 요즘은 분위기 있는 카페나 베이커리가 주변에 많아지면 기분이 좋아요 오늘은 오래간만에 소개로 돌아왔습니다 망원동에 위치한 분위기있는 그곳 따스한 커피감성이 살아있어서 여러분들에게 소개해 드려요 감성을 담은 그곳 망원동카페 온리디스베이커리 망원동거리를 걷다보면 문득 여긴 어디일까 싶은 그런 공간이 나올 때가 있어요 저녁 8시까지 열리는 숨은 공간이 바로 요 온리디스베이커리랍니다 공간을 살펴볼 때에는 제일 먼저 분위기를 보는데 이곳은 참 다양한 색감과 분위기가 존재하고 있어요 산뜻한 봄날씨 같다가도 중후하고 멋진 매력이 있죠 깔끔한 화장실에선 은은한 향기가 나를 리프레시 해줘요 분위기가 있는 공간 같은 공간을 점유하면서도 이왕 있는 곳이라면 기분까지 좋아지면 좋잖아요 커피 한잔의 여유를 느끼고 싶은 분이라면 가볍게 찾을 수 있는 동네커피점을 찾으시는데요 저 또한 마찬가지랍니다 멀지 않은 곳에 있어서 자주 들려보고 싶은 그런 느낌 베이커리카페라서 빵 맛을 포기할 수 없죠 저는 개인적으로 솔티애정자 소금빵도 요즘은 핫하죠 가볍게 선택하면서도 따스한 커피 한 잔과 함께 먹을 수 있는 든든한 빵이 감성에 목마르고 배고픈 저에게 딱인듯 싶네요 유럽의 고급 디저트들도 한 눈에 만나볼 수 있는데요 마들렌은 물론이고 휘낭시에도 있어서 본인의 입맛에 맞는 것을 선택해보는 것도 추천드립니다 커피 한 잔에 담긴 감성 그리고 시간을 공유하는 기쁨 좋은 사람과 함께라면 좋은 곳으로 데려다 주세요 망원동카페 고민중이라면 온리디스베이커리 추천드립니다. 온리디스베이커리 서울특별시 마포구 희우정로20길 70 102호 경제적 댓가를 받지 않은 순수 추천 글입니다.
오랜만에 서울 나들이:) 망원시장 휘낭시에 맛있는 카페 - 온리디스 베이커리,"만남이 그리운 계절, 가을이네요. 좋은 일이 생길 때 얼른 달려가서 응원해 주는 사람, 힘든 일이 있을 때 제일 먼저 생각나는 사람, 어떤 말을 해도 다 괜찮을 것 같은 사람, 여러분도 있으시죠? 온라인 활동을 하면서 갖게된 가장 큰 행복이자 혜택은 그런 사람들이 많아진다는 거에요. 자주 만나지 못하지만 (1년에 1-2번) 만날 때마다 더 더 깊어지고 만나지 않아도 늘 같이 응원하는 것 같은 사람 출장도 가고 속마음도 깊이 나누는 고마운 사람, 오랜만에 찐 인연을 만나러 서울로 향했어요. 인천 구석, 송도에 사는 저는 서울 한 번 갈라면 여행길입니다 ㅎㅎㅎ 날이 맑아 신나게 룰루랄라 여행하는 기분으로 다녀왔어요. 망원동에서 만났는데 한강다리 건너는데 막 사진찍고 싶고 오랜만에 진짜 여행가는 기분이었다니까요. 망원시장을 지나는데 과일이 정말 싱싱하고 값이 싼거에요. 와, 물가가 다르네 이렇게 감탄하며 지나갔어요 ㅎㅎ 사진 클래스에 가서 휘낭시에를 먹었던 적이 있어요. 당일 직접 생산했다는 휘낭시에를 먹는데 완전 놀랐잖아요. 좋은 재료를 듬뿍 넣어 만든 진짜 맛, 와 다른데서 먹는 거랑 완전 다른거에요. 그맛을 잊지 못하고 한 걸음에 달려갔어요. 망원동 맛있는 베이커리 카페 온리디스 베이커리에요. 입구 앞에 계단 완전 좋아하는 스타일이에요. 아아 테이크 아웃해서 앉아서 이야기 하며 마시고 싶은 딱 그런 분위기:) 너무 아늑하고 좋은거 있죠. 귀여운 우리 클레오님 사진찍는 모습 도촬:) 온라인 친구들 만나면 완전 열심히 같이 찍어서 더 더 신이나요 ㅋㅋㅋ 들어가는 계단 입구에 큭큭 이렇게 사진찍으라고 거울도 있네요. 감성 완전 마음에 들어요. 곳곳에 얼마나 신경을 썼는지 느껴졌어요. 꼭 갖고 싶던 느낌의 특별한 카페 너무 예쁘고 깨___끗 합니다. 어머 지난 번에 먹어봤던 그 휘낭시에 멀리서 왔으니 아쉬움 없게 다 먹어볼래요. 한 개씩 다 주세요 ㅋㅋㅋ (욕심 냅니다 - 아니에요 브런치에요 ㅋ) 원두향도 정말 좋고 커피도 완전 맛있어요. 저는 청귤 에이드를 마셨지만 너무 궁금해서 커피도 한 모금 빼앗아 마셔봤는데 완전 진하고 좋아하는 스타일, 바빠서 커피 한 잔 추가로 못마시고 온게 아직도 아쉽네요. 다음에 또 갈게요! 앉자마자 도란도란 폭풍수다 우아한 길 작가님이 읽어주신 시에서 또 눈시울 붉히고:) (참 따스하고 깊고 대단한 사람) 그 사이 드디어 주문한 음료와 휘낭시에가 도착했어요. 사진 클래스 배웠거든요. 하면서 마구 찍었는데 아,,, 쉽지 않네요 ㅋㅋㅋ 요정도면 어때요? 분위기 괜찮나요? ㅎㅎ 커피는 참 신기해요. 만나는 사람과 함께 하는 온도까지 품고 행복하게 해주는 마약같다니까요. 사진 찍으며 하하호호 일단 너무 신이났어요. 오래 오래 여러컷 찍어도 뭐라는 사람없이 다 찍고 저도 보내줘요 !!! (가족들이랑 가면 또 찍어??? 하며 눈치주잖아요 ) 자, 이제 본격적인 수다타임 나눠볼까요? 막 구운 소금빵은 진짜 감동! 착한 가격은 보너스 오랜만에 만나도 어제 만난 사이처럼 가깝고 고마운 사람들, 잠깐 봤어도 고속충전하듯 힘을 나게 해주는 사람들, 짧고 굵게 데이트 잘 했습니다. 클레오님, 톡톡홍쌤님, 길작가님, 우리 이날 진짜 행복했죠? ㅎㅎ 사장님, 죄송한데요. 사진 한 장만 찍어주세요 !!!! 우앗 우리 너무 행복해보이게 잘 나왔네요. 감사합니다. 맛있는 베이커리 만드는 사장님은 사진도 잘찍으시는 진짜 금손이시네요. 다음에 또 충전하러 갈게요. 번창하세요. 100% 내돈 내산 행복한 서울 나들이 저장! 온리디스베이커리 서울특별시 마포구 희우정로20길 70 102호 망원역 6번 출구 짧은 도보 조용하고 한적한 카페 맛있고 포근한 곳 또 가고 싶은 커피와 베이커리 맛집 아, 이밤에 배고프네요. #망원시장 #망원카페 #휘낭시에잘하는곳 #커피맛집 #서울카페 #마포카페 #망원동카페 #망원동빵집 #망원역베이커리 #데이크장소 #데이트코스 #온라인친구 #오프라인모임"
[망원] 온리디스베이커리,"안녕하세요. 솔카입니다. 오늘은 망원동의 휘낭시에 맛집을 소개하려고 합니다. 온리디스베이커리 서울특별시 마포구 희우정로20길 70 102호 위치는 제가 방문했던 락떼스피릿 바로 앞에 있어요! 영업시간 화~일 11:00 -20:00 매주 월요일 휴무 주차장 없음 앞에 빵 ! 이렇게 적혀있는게 넘 귀여웠어요 ㅋㅋㅋㅋㅋ ㅠㅠ 매장 앞에 매일의 라인업이 적혀있는 것 같아요~! 매장에 들어갔더니 버터의 고소한 향이 가득 하더라구요 ㅎㅎ 다양한 구움과자의 종류들이 있었지만 휘낭시에 종류들이 많았어요!! 그래서 휘낭시에 맛집이라고 스스로 판단하고 휘낭시에만 포장했답니댜,,, (나의 실수 ,,, 더 살걸 ,,,) 한쪽에는 소품들과 LP들이 가득했어요 ㅎㅎ 시계도 귀여운 🫢 포장 기다리면서 귀여운거 가득 봤어요 ㅠㅠ 온리디스 베이커리의 매장 안은 조금 협소한 편이에요! 두 테이블 정도 있었어요~ 귀여운 초도 판매중이었어요! 집에 와서 다음날 먹어서 발뮤다에 살짝 구웠어요 ㅎㅎ 위에서부터 에스프레소 대파치즈 무화과 크림치즈입니당~! 세부적인 맛 설명 전에 전체적인 휘낭시에 느낌은 겉과 속이 촉촉한 느낌이었어요! (전 하루가 지나 먹어서 바로 먹었을때와 차이가 있을 수 있습니다 : ) 무화과 크림치즈! 보통 이런 메뉴에서 무화과가 많이 달아서 휘낭시에 느낌이 잘 안났던 디저트를 많이 경험했는데 온리디스는 무화과의 당도와 크림치즈가 딱 잘 어울렸어요~! 이건 휘낭시에 느낌보다 빵 느낌이 강했오요 !!! 겉에 치즈가 바삭하고 적당히 구워져서 고소함이 가득하더라구요 ㅠㅠㅠ 이것도 합격 ,,, 마지막으로 에스프레소! 전 이게 가장 맛있었어요 ㅎㅎㅎ 뭔가 겉에 에스프레소 칩이 얇게 있는 느낌? 커피 좋아하시면 좋아하실 것 같아요~! 역시 디저트는 커피랑 먹는게 맛있는거 아시죠? 망원동 가시면 온리디스 베이커리 들려보세요 ㅎㅎ 전 다음에 가면 다른 종류도 구매해보려구요!"
