title,content
"때로는 우아하게 : 서울 Tea Room 비교(망원동 티노마드, 블루보틀 삼청한옥, 맥파이앤타이거 신사티룸, 연희도 다도레)","우아하고 고상한 하루를 보내고 싶을때, 고급스러운 Tea를 즐기자. - 로지랜드 - Tea-Room 1. 망원동 티노마드 티노마드 서울특별시 마포구 포은로 112 2층 ♩ 서울특별시 마포구 포은로 112 2층 ♪ 영업시간 : 13:00 ~ 20:30 (월, 화 휴무) ♬ 02-545-5084 ▶ 예약방법 : 네이버 예약에서 매달 마지막주 수요일 오전에 다음달 예약창이 열림. ▶ 카페 이용시간 90분(1시간 30분), 예약 시 1만원 선결제. 카페 이용시 1만원 차감. 예약이 치열해서 두번 밖에 이용 못한 티노마드. 빌라 같은 건물 2층에 있는데, 생각보다 찾기 힘들다 티노마드 내부. 조용하고 차분한 느낌의 공간. 가운데에 따뜻한 물을 길어다가 자리에서 계속 우려서 마실 수 있다. (좌) 가운데 따뜻한 물 뜨는 곳 (우) 차 관련 용품도 판매한다 메뉴판과 차마시는법이 설명되어 있다. 첫번째 방문때 먹었던 말차빙수(단품)과 호지차1인 세트. 1인 차 세트에는 다식이 포함되어 있는데 아주 맛있고 예쁘다. 2번째 방문때 마셨던 티세트와 말차빙수. 빙수는 한국에서 먹어본 최고의 맛이다. 처음 먹었을때 깜짝 놀랐을 정도. 내 기준, 호텔빙수보다 훨씬 맛있다. Tea는 끝맛까지 고급지고 여운이 남아서 나올때 꼭 소포장된거 하나씩 사게 된다. Tea-Room 2. 블루보틀 삼청 한옥 블루보틀 삼청 한옥 서울특별시 종로구 삼청로2길 40-3 ♩ 서울특별시 종로구 삼청로2길 40-3 ♪ 영업시간 : 매일 12:00 ~19:30 (구정, 추석 당일 휴무) ♬ 1533-6906 ▶ 100% 예약제, 90분 이용. 1인당 28,000원. 블루보틀 삼청점으로 가서 카운터에 삼청 한옥점 왔다고 하면 직원이 뒷 골목에 있는 단독주택들 사이에 있는 삼청한옥점으로 데려다 준다. 이런 마크를 보고 들어가면 되는데 우리는 눈이 온 날 방문했어서 운치있고 좋았다. 가운데 마당이 있고 통창으로 되어 있던 단독주택. 멋스럽다. Tea는 이미 정해져있는 같은걸로 제공받고 곁들여먹는 food는 내가 고를 수 있다. 친구랑 나랑 서로 다른걸 먹었는데 너무 예뻐서 먹기 아까웠다. 직원들이 하나씩 설명을 해주고 천천히 serving 된다. Tea라떼가 맛있었고 Food는 예쁜거에 비해 맛은 so, so. 개인적으로 Tea 맛도, 구성도 내 스타일은 아니었고 금액 대비 재방문 의사 없어지는 곳.. Tea-Room 3. 맥파이앤타이거 신사티룸 맥파이앤타이거 신사티룸 서울특별시 강남구 논현로153길 44 클레어스서울 2F 맥파이앤타이거 신사티룸 ♩ 서울특별시 강남구 논현로153길 44 클레어스서울 2층 맥파이앤타이거 신사티룸 ♪ 영업시간 : 13:00 ~ 20:30 (매주 월, 화 휴무) ♬ 0507-1352-4023 ▶ 네이버 예약이용 100% 예약제, 90분이용, 예약금 10000원. 티룸 이용후 자동 환불됨. 선배 결혼식 끝나고 방문한 티룸. 로지는 색이 말차가 쥬스가 섞인 음료를 선택. 특이한 맛이었는데 꽤 괜찮았다. 생각보다 달지 않아 좋았다. 다식은 따로 주문. 여기도 tea가 워낙 맛있어서 나올때 꼭 사게 되는 곳. 재방문 의사 100% 최근 성수동에도 생겼다. Tea-Room 4. 연희동 다도레 다도레 서울특별시 서대문구 증가로 13-9 3층 ♩ 서울특별시 서대문구 증가로 13-9 3층 ♪ 영업시간 : 12:00 ~ 19:00 (매주 월요일 휴무, 예약제 티코스와 티클래스는 운영시간 상이함. 연희동 다도레 : 네이버 통합검색 (naver.com) 참고) ♬ 0507-1490-0706 ▶ Tea 코스와 Tea클래스 예약제로 운영 중이나 로지는 Tea룸 방문. 장소가 생각보다 협소하다. 통창이라서 밖이 훤히 보이는 것은 좋은데 의자 등받이가 없고 티클래스 듣는 한팀 외에 티룸도 한팀밖에 이용 못할 정도로 장소가 매우매우 조그맣다. 로지가 주문한 유자알갱이차. 대박대박. 이건 무조건 사야한다!! 다도레에서만 파는 Tea인데 ice나 hot 둘다 어울리는 차. 상콤하고 맛있다. 다식은 따로 주문. 친구가 주문한 말차. 다도레에서 파는 차는 하동에서 티 재배지를 직접 선택해서 가져온 것들이라고 한다. 그래서 확실히 맛있고 그릇들도 센스있고 잘 어울린다. 재방문보다는 유자알갱이나 다른 티를 주문해서 먹는걸 추천. 다도레 (dadore.co.kr) 사이트 참조. 나처럼 Tea를 좋아하는 이웃에게 도움이 되었길 바라며~ 오늘도 모두 좋은 하루!♡"
[망원동 티노마드 모리] / 망원동 스키야키 맛집 / 분위기 좋은 일식당 메뉴 / 메뉴판 / 꿀팁 놓치지마세요! / 명란 오니기리 / 예약제 운영 / 데이트하기좋은식당 / 특별한날,"티노마드 모리 서울특별시 마포구 망원로2길 19 비동 1, 2층 망원동 티노마드 모리에 갔다왔어요! 인기 있는 식당에, 예약제에, 2022년에만 스키야키를 판매한대서 와 이건 가야해 !! 라는 마음으로 가게 되었습니다 근데 1월까지 연장한다고 하니 참고하시길 바랄게요:) https://naver.me/FLHzEzoB 티노마드 모리 : 네이버 방문자리뷰 974 · 블로그리뷰 247 naver.me 예약 정보는 티노마드 모리 인스타그램과 위 링크 확인하시는게 제일 빠르고 좋습니다!! 티노마드 모리의 외관입니다! 외관도 되게 예쁜 ,, 제가 다른 분들보다 늦게가서 그런건지 자리가 정해져있었던 건지 모르겠는데 자리는 남아있는 자리로 앉게 되었습니다! 근데 모르는 분들과 같이 앉는 자리여서 불편했지만 눈 내리는 거 구경하면서 먹을 수 있어서 좋았던 거 같아요! 메뉴판입니다! 1인 스키야키(공깃밥)이 28,000원인데 2인이 스키야키가 48,000원이라 여기다가 명란마요 오리기리 추가해서 먹어보자! 해서 2인 스키야키(공깃밥)(48,000원)과 + 명란마요 오니기리 1개(5,500원)를 먹어보았습니당 저기서 호지차 떠서 먼저 먹고! 먼저 우린 다음에 찻잔에다가 옮겨서 먹으면 되는데 재밌는 .. ? ㅎㅎ 구성은 이렇습니다! 요 뚜껑 밑에 모가 있을까 굉장히 궁금했는데 아주 조금의 단무지가 .. ! 그리고 저 우동 사리는 나중에 볶아먹으라고 하셨는데 저런 디테일 제 기준 후식이 넘 좋았습니다 ㅎㅎ ㅋㅋㅋㅋㅋㅋㅋㅋㅋ 계란 인당 하나씩 열심히 까주고~ 저는 사실 비릴까봐 걱정 많이 했는데 별로 안 비리더라구요! 그래서 좋았어요 ㅎㅎ 그리고 계란 본인이 깨는 건데 손에 묻는 거 찝찝해서 싫어하시면 물티슈 챙겨가시는 거 추천 드립니다 (그건 사실 나..) ㅋㅋㅋㅋ 밥 그릇은 정말 굉장히 무거워서 들고 먹기는 힘든 무게였고 .. 밥 양은 탄수화물 러버에 대식가로서 좀 아쉬웠습니당 .. 하지만 저에겐 명란 오니기리가 있었습니다 맛은 !! 짱 맛있었어요! 특히 저 새우가 진짜 존맛탱구리 .... 근데 뭐랑 먹어서 그런지는 모르겠는데 독자적으로 먹으면 안 비린데 무언갈 먹고 먹었을 때 궁합이 안맞아서 굉장히 비리게 느껴지더라구요! 그래서 좀 아쉬웠지만 안 먹었으면 후회할 거 같은 맛 .. ! 이런 감성샷이 너무 예쁜 .. 진짜 넘 예뻐서 사진 왕창 남기게 되는 그런 곳 .. 다 먹고 완전 까먹고 있었는데 호지차 아이스크림이 나왔다! 저 개인가 .. ? 동물 모양의 쿠키가 정말 왕 귀여웠어요 ... 아이스크림은 사실 제 입맛에는 안 맞았는데 ㅋㅋㅋ ㅠㅠ 근데 입가심으로 좋은 맛 ?! 못 먹을 맛은 아니어서 싹싹 비우고 왔습니다. 위에 풍경 소리랑 눈 내리는 장면이랑 넘 예뻐서 정말 넋놓고 바라보게 되는 :) 내부에 자잘자잘한 소품들이 있었고 이런 좌식도 있는데 전 이런데가 더 맘에 들어요 ㅋㅋㅋㅋㅋ 그래서 다음에 한 번 또 가보고 싶은 !!! 여기는 문 바로 옆에 자리인데 낮에 가면 햇살 들어와서 엄청 예쁜 자리인 거 같더라구요! 그리고 티노마드 모리에서 이런걸 받았는데요 ㅎㅎ 메뉴판에서 보신 분들도 있겠지만 메뉴판 젤 밑에 예약자 포토리뷰를 남겨주시면 티노마드 꽃잔을 선물로 증정합니다! 라고 쓰여있어요 ㅎㅎ 다 먹고 예약자 리뷰 쓰고 결제할 때 보여드렸더니 주셨습니당! 굉장히 예쁘죠 ,, 찻잔이 아니더라도 소주 넣어 먹어도 좋을 거 같은 ㅎㅎ ㅋㅋㅋㅋㅋㅋㅋㅋ 아주 만족스러운 사은품이네요 >< 사장인지 직원분이 굉장히 친절하셨고! 분위기도 넘 좋았고 맛도 맛있었고 찻잔도 받고 장소가 주는 특별함이 굉장히 컸던 거 같아요! 근데 겨울 옷 보관하는 곳이 있는데 두 명 넣기에는 좀 좁았고 의자가 등받이가 없어 불편했던 ?! 제 기준 양이 적어서 아쉬운?! 그래도 다음에 또 가고 싶은 곳입니다 .. 망원동 분위기 좋은 맛집 찾고 계신다면 티노마드 모리 적극 추천해드립니다!"
망원동 맛집 / 티노마드 모리,"망원동 맛집 / 티노마드모리 ※ 예약제로 운영 티노마드 모리 : 네이버 방문자리뷰 990 · 블로그리뷰 246 naver.me 12월까지였으나 한 달 연장하여 23.01. 말까지 운영한다고 함 이미 1월 예약 오픈되었고, 취소 석을 노려보시길,, 자리 선택은 선착순이라 미리 도착하기 ! 앞에서 대기하니 예약 15분 전쯤 입장 도와주셨다! 아싸 일등✌ 주문하면 금방 나오는지 일행 도착 전 주문해달라고 하셔서 자리 먼저 잡고 구경부터 하기 이날 조금 흐려서 걱정했는데, 걱정 왜 한 거람 예쁘기만 하네 예약제라 예약시간 다가오니 정말 순식간에 만석이었는데 일찍 도착한 터라 요렇게 사진도 마음껏 담을 수 있었다🤎 진짜 분위기 미쳤쬬?ㅠ_ㅠ 예약한 나 자신 칭찬해 예쁘니까 한 장 더 이번엔 가로로 보세요 근데 이제 영상도 꼭 봐야 해요.. 풍경소리랑 눈 오는 영상이랑 모든 게 완벽해 🤍 이 사진이랑 영상 보여줬더니 어디냐, 예쁘다며 보내달라는 사람이 여럿이라 기분 좋았다구~ 그렇게 여러 명의 프사 배경이 되고,, (뿌듯) 티노마드모리 메뉴 메뉴는 스키야키 + 공기밥이냐 오니기리냐의 차이일 뿐 국물엔 흰쌀밥이지,, 밥순이는 공깃밥으로,, 티노마드모리 주문하고 금방 나온 스키야키 접시 하나하나 예쁘고, 플레이팅 정갈해서 기분 좋아짐ㅎㅎ 티노마드모리 달걀 풀어서 고기랑 채소 푹 담가 먹으면 맛있다..!! 짜다는 후기를 많이 봤는데? 반영하신 건지? 짜다고 느껴지지 않았고 나중에 많이 졸아서 우동 넣어 먹을 때쯤 추가로 육수 부탁해서 먹으니 딱 좋았다 솔직히 특별히 맛있는 것 까진 모르겠고, 채소나 고기 상태가 너무 좋고, 건강하게 맛있는 맛? 이었음! 그렇다고 슴슴한 건 아님 ! 후식으론 귀여운 곰돌이🧸 호지차 아이스크림🍦 🤎 적당히 달고 차향이 은은히 나서 맛있었다 티.노마드 모리 森(@t.nomad_mori) • Instagram 사진 및 동영상 팔로워 5,142명, 팔로잉 1명, 게시물 27개 - 티.노마드 모리 森(@t.nomad_mori)님의 Instagram 사진 및 동영상 보기 www.instagram.com 시즌 1이라고 적혀있던데 시즌 2는 무엇일지 기대되는,, 🤍 티노마드 모리 서울특별시 마포구 망원로2길 19 비동 1, 2층"
[8/18] 망원동 / 카페 올웨이즈어거스트 / 필름카메라 / 영아카이브 / 티노마드 / 이자카야 해치,"구름이 예쁜 한 여름의 금요일! 기다리고 기다리던 약속 가는 날 오랜만에 망원동으로 발걸음을 향했다. 역삼에서 출발했는데, 역시 망원이나 홍대는 넘 멀게 느껴져.. 1시간 넘게 걸려 도착한 #망원 ! 귀여운 피카츄가 나를 반겼다. 지인들 먼저 만나고 있다는 #올웨이즈어거스트 카페로 향했다. 겉에서 뿜어져 나오는 바이브가 너무 내 스타일인 카페였음! 역시는 역시. 내부 인테리어 미친거야? 넘나 내 스타일이자나.. 나 여기 한번 더 올랭.. 사진을 좋아하는 사람들 모임답게 카메라들 잔뜩 가지고 모인..! 카메라 모임에 가면 무조건 찍어오는 카메라 떼샷 3명이 만났는데 카메라는 4대! 키키 잠깐 땀을 식히고 원래 일정대로 이동하기로 했다. 우리 일정 중 첫 장소였던 #영아카이브 요즘 여기가 그렇게 핫하다며..? 나도 늙긴 했나봄.. 트렌드 따라잡기 벅차다 벅차~ 다른 네컷사진 부스들과는 다르게 감성 넘치는 소품들이 반겨주더라! 나는 까만 뿔테안경 겟하고, 야무지게 사진 건져옴! 프레임도 넘 귀엽고 감성도 넘쳐서 나중에 한번 더 방문하고 싶다. 사진 야무지게 찍고 다음 장소로 이동 다음 장소는 #티노마드 라는 티 전문점이었다. 2층에 위치한 카페였는데, 입구 찾기가 조금 어려웠다. 아주 약-간 헤맴ㅋ 건물을 마주보고 있다는 가정하에 건물 우측으로 들어가면 요렇게 티노마드로 들어갈 수 있는 입구가 나온다. 입간판이 건물 입구 바로 앞에만 있는 것이 약간 흠인 듯 2층으로 올라가면 입구에서부터 뿜어져 나오는 일본 감성.. 이번 만남의 컨셉은 서울 속에서 일본을 느끼는 것이었는데 진짜 컨셉에 충실한 공간이었다. 들어가자마자 귀여운 디저트들이 반겨줌! 특히 저 바보 같은 노마드군 카스테라가 넘 귀여웠다.. 그냥 카스테라인데 저런 얼굴을 하고 있으니까 당장 먹어버리고 싶잖아(?) 티노마드는 1시간 30분까지만 이용이 가능한 공간이다. 사진 촬영도 무음으로 해야하는 곳..! 자리에 가면 메뉴판을 놔주시는데, 메뉴를 고르고 카운터로 가서 주문을 하는 시스템이다! 3명이서 방문했는데, 빙수도 먹고 싶었던터라 어떤 메뉴를 골라야할지 엄청 고민했다. 고민 끝에 2인 차빙세트 + 차를 하나 더 추가하기로! 주문을 야무지게 하곤 내부를 본격적으로 구경하기 시작했다. 곳곳에 빈티지함과 일본스러움이 가득해서 어딜 담아와도 넘 예쁘더라 카페 한 켠에는 소품들을 구경할 수 있는 공간도 마련되어 있음! 여기서 소품을 구매할 수도 있다. 야무진 다기들이 많았는데, 나는 쓸 일이 없어서 아이쇼핑만 잔뜩했다. 구경하고 있으니 나온 우리의 메뉴 2인 차빙세트 (차1+다식1+빙수1) 28,000원 2인 차빙세트에는 차, 다식, 빙수맛을 선택해주면 되는데 우리는 2인 차빙세트에 차1, 다과 1을 더 추가해줬다. 겐마이차와 호지차 계절의 화과자와 티노마드 모찌떡 그리고 말차빙수를 선택! 이렇게 선택해주니 셋이서도 나름 배부르게(?) 먹을 수 있던 것 같다. 갱장히 행복했는지 찐웃음 이자카야 해치 카페 먼저 야무지게 뿌시고 저녁 식사하러 이자카야 해치 방문 해치의 메인 메뉴는 스키야키와 샤브샤브! 아직 생기지 얼마 되지 않은 곳이라 사람이 많이 없어서 좋았다. 주택가에 위치한 이자카야여서 그런지 정숙을 요하는 문구도..! 주위가 좀 많이 조용하긴 하더라! 공간이 많이 넓지 않은 곳이라 오히려 도란도란 더 좋았다. 내부 인테리어는 군더더기 없이 깔끔한 편 메인 메뉴로 스키야키를 시키고, 사이드를 야무지게 시켰다. 우리가 주문한 메뉴 스키야키 28,000원 (+ 고기 추가 10,000원) 해치카츠 12,000원 감자사라다 9,000원 메뉴를 시키니 먼저 스키야키 소스와 반찬 등을 가져다주셨다. 그리고 휴지 위엔 귀여운 사탕(?)도 준비되어 있었음ㅋㅋㅋㅋㅋㅋㅋㅋ 기다리고 있으니 가장 먼저 나온 해치카츠! 수비드 목살 튀김이라는데 참을 수 있겠냐구.. 나는 절대 못 참아.. 두툼하고 촉촉하니 넘 맛있었다. 거기에 양배추랑 겨자 곁들이니 입맛에 딱 메인 메뉴인 스키야키 등장! 스키야키에도 고기는 수비드 고기.. 수비드 돼지 목살 원래 이렇게 맛있나 채소도 가득 들어있어서 넘 맛있드라 그래서 고기 추가해서 더 먹었음>< 입이 조금 심심해서 감자사라다도 같이 주문! 오이랑 햄, 당근이 버무러져있는 감자사라다~ 거기에 크래커도 같이 주셔서 사라다 가득 올려서 베어 먹으니 그렇게 맛도리더라 생각나! 식사 거의 다 한 것 같아 보였는지 서비스로 바닐라 아이스크림에 올리브유 싹 둘러서 가져다주셨다. 센스 대박이자나~! 맛있는 음식들과 좋은 사람들, 그리고 예쁜 사진까지! 행복한 금요일이었다. 올웨이즈어거스트로스터스 서울특별시 마포구 망원로6길 19 1층 일부 해치 서울특별시 마포구 월드컵로23길 92-3 1층"
[망원동 카페] 티노마드_여유를 즐길 수 있는 일본식 티카페 방문기,"망원동 티카페: 티노마드 친구가 적극 추천했던 망원동에 있는 티카페. 여긴 무조건 예약만 받는 곳이여서 2주전에 미리 예약해둬서 방문해보았다 :) 망원동 골목길에서 발견한 티노마드 간판! 2층으로 올라가면 됩니다~~ 들어가자마자 고즈넉한 분위기에 저절로 탄성이 나왔다~! 뭔가 차분해지는 느낌? 그릇이랑 주전자, 찻잔 등등 일본 교토에서 직접 구매해오신 물건들을 판매하고 있는거 같았다. 일본 여행 간지 오래됬는데 뭔가 여행온거 같은 기분이라 좋았다:) 우리가 앉은 자리! 후기들 찾아보고 갔었는데 아빠다리 불편해도 꼭 여기 앉아야지 생각했었다 ㅎㅎ 2인 차세트 + 녹차빙수로 선택했다. 녹차빙수 정말 지금까지 먹어봤던것 중에 제일 맛있었다 ㅠㅜ 정말 찐한 녹차맛!!! 티노마드 티인데 생각보다 향도 그렇고 맛도 진하지 않고 은은한 느낌. 디저트랑 딱 잘 어울렸다! '노마드군 카스테라' 사실 이건 그냥 평범한 카스테라 맛이였던 ...ㅎㅎ 차를 다 마시고 나면 중앙에 물을 리필할 수 있는 공간이 있어서 이렇게 국자로 뜨거운 물을 떠서 주전자에 따르면 된다~! 분위기도 넘 좋고 오랜만에 따뜻한 차를 마시면서 두런두런 이야기 나눌 수 있는 시간이여서 참 좋았던 공간 이였다. 다음에 또 기회가 된다면 다시 방문할 생각이다. 이곳을 추천해준 친구에게 감사해 하며,,,"
"망원동 맛집 | 티노마드 모리 (관동식 스키야키) 예약필수, 내돈내산 후기 🫧","티노마드 모리 망원동에서 맛보는 관동식 스키야키 최근에 스키야키를 처음 맛본 사람 나야나 🙋🏻‍♀️ 회사 근처에서 첨 먹어보고 맛있어서 맛집 찾아서 또 먹으러 갔당 외관이 너무나 일본스러움 신기한게 망원동 빌라 많은 골목 걷다보면 급 이런 매장이 띠용 🙄 티노마드 모리 영업시간 12:00 - 20:30 (15:30 - 17:00 브레이크타임) 티노마드 모리 서울특별시 마포구 망원로2길 19 비동 1, 2층 [티노마드 모리 예약 방법] 1. 인스타 예약안내 확인 2. 예약안내 일자에 원하는 날짜 확인 후 네이버 예약 진행 예약시, 예약금 1만원 결제함 (추후 식사 결제에서 예약금 차감 후 결제) 티.노마드 모리 森(@t.nomad_mori) • Instagram 사진 및 동영상 팔로워 5,105명, 팔로잉 1명, 게시물 21개 - 티.노마드 모리 森(@t.nomad_mori)님의 Instagram 사진 및 동영상 보기 instagram.com 내가 예약한 건 아니고 남자친구가 해줬는데 인스타로 매번 예약가능 일자 확인하고 원하는 날짜에 바로 예약했다고 한다 (고맙 🥹🥹) 매장 내부도 완전 일본스럽게 잠깐 여행다녀온 기분 😌 이런 분위기 아주 맘에든다🍵 뭔가 차분해지는 기분 그리고 첨에 이 나무국자는 뭐야? 했는데 차 우려 마실 때 물 뜨는 것이었당 앞접시와 물잔도 너무 옙뻐 🤎 호지차였나..? 🫖 어쨋든 저기에 물 담아서 우려 먹으면 된당 살짝 체험하는 기분도 들공 🏷 티노마드모리 메뉴판 우리는 2인 관동식 스키야키 A세트로 주문했다 보니까 A세트와 B세트 차이는 공기밥이냐 명란마요 오니기리냐 차이다 스키야키 자체가 짭짤할 것 같아서 그냥 공기밥인 A세트로 😅 그냥 여기저기 다 갬성으루 가져다대고 찍어봄 ㅎ 먹기 전에, 스키야키 먹는 방법 쭈욱 읽어보고 ! 관동식 스키야키란 각종 재료를 넣고 육수 자작하게해서 전골처럼 끓여 먹는 음식 🥘 육수 없이 먹는 샤브샤브 같은 느낌? 드디어 나온 스키야키 🙃 저 버섯덕에 비주얼은 좋다 하지만 양은 적음 저렇게 나온게 2인의 양이다 양 많은 사람이 가면 좀 아쉬울 수 있음 날계란과 튀김 같은 것 그리고 단무지 공기밥도 나왔고~ 🍚 네모난 통(?)을 주셔서 뭔가 했더니 집게랑 가위 그리고 수저 익기만을 기다리는 중 희희 😋 솔직히 야채는 좀 더 주시죠 회사 근처에서 먹었던 스키야키는 야채 계속 리필해주셔서 좋았는데 🥲 요기는 그런건 없는듯 그래도 맛있어보이는 비주얼 다시보니 군침이 도는데.. 먹다보면 주고가시는 우동사리 여윽시 면도 먹어줘야,, 배가 좀 찬다고 😇 맛은 약간 짭짤해서 날계란 풀어둔걸 찍어 먹으니 딱 좋다 -! 그리고 흰밥이랑 먹어도 아주 좋음 면에 간 베어야 되니까 미리 넣어두고 살살 끓인다 면도 맛있고 스키야키도 맛있고 나중에 집에서 직접 만들어 먹어보고 싶당 내부는 사람이 꽉 차서 찍기가 좀 어렵다 문 바로 옆 팀 나가서 한 컷 찍어봄 약간 어둡에 나왔지만 사진첨부해봄 다 먹고나서 후식타임 🍨 첨에 벨 누르고 후식 달라고 말씀 드렸는데 아무리 기다려도 안주셨다 홀을 직원 혼자 보다보니 바빠서 잊으신듯 한참 기다렸다가 또 달라고하니 그제서야 가져다주셨당 아이스크림은 금방 나오는거였어,, 😭 호지차맛의 아이스크림이고 달달한듯 아닌듯 먹을만했다 곰돌이쿠키가 졸귀탱이야~ 🧸🧸 다 먹고 계산하러 갔는데 비어있던 안쪽 자리! 예약을 했어도 오는 순서대로 원하는 자리에 앉기때문에 예약시간 딱 맞춰서 오기보다는 5-10분 정도 일찍 와도 될 것 같다 안 쪽 자리가 더 분위기 좋다 근데 안쪽은 좌식임 총평 일본식 분위기 나는 곳에서 스키야키 먹어보고싶으면 가도 됨 (단, 예약필수) 하지만 그냥 일반 스키야키 집으로 가도 될듯 맛은 비슷하나 여기가 비용이 더 나감 값이 나가는 것 치고는 생각보다 별로인듯 서비스도 쏘쏘 갠적으로는 분위기맛집으로 와볼만한 곳 하지만 나는 재방문은 하지 않는 것으로.. 🧚🏻💨 아! 네이버 후기 작성하면 이런 잔을 서비스로 주신당 🫖 일단 받아오긴 했으나 차를 마셔야 하나 .. 🙄ㅎㅎ"
