title,content
"[비 오는 날 망원동] _ 코랏, 위켄드케이크, 레스피레, 리인, 미스타교자","5 / 27 토요일 날씨: 비 다들 갓 생 살기 바빠 만나기 힘들었는데 마침 토요일이 부처님 오시는 날. 빨간 날이라 드디어 만났다 ㅜ (토요일에 근무하는 나는 매우 중요…) 맨날 만나도 성수 강남이라 이번엔 안 가 본 곳 가보자 해서 맛집 많은 망원동 가보기로 했다. 망원동 하면 시장 생각나는데 식당 카페들이 엄청 많았다. 먹보인 우리들에겐 오히려 좋아.. 돈만 많았으면 여기가 천국 에일리 헤븐이다. 버스 타는 사람이 많아 놓치는 바람에 어영부영 우산 들고 축 처진 앞머리가 눈을 가린 채 지하철 탔다. 아오 6월 1일이 미연이 생일이라 이번에 만나는 김에 생파 할까 해서 전날까지 미영이랑 어떤 거 줄까 고민 엄청 했는데 ㅋㅋ 백화점 가서 선물 사줄까 하다 이미 갈 시간은 없고 귀여운 케이크랑 꽃다발 선물이 좋을 거 같아서 검색하다 당일 케이크 예약 가능하다는 곳 찾았다... ! 위켄드케이크 너무 귀여어워...!!! 💛 만나러 가면서 미영이랑 폭풍 카톡. 사장님한테 예약 가능한지 물어보고 가능하다 해서 당일 가능한 케이크 사진 보내주셨다. 다 귀여운데 어떻게 먹으라고 ㅜㅜ😭 상의 끝에 뒷줄에 갈색 귀 강아지로 픽! 일단 케이크는 해결했고 이제 식당만 가면 된다. 미영이랑 미연이가 먼저 도착해서 주문하고 난 얼레벌레 내 기준 빠른 걸음으로 호다닥 걸어갔다 ㅎ ㅎ 비오는데 넘어지면 우쨔~~~ 코랏 평소 웨이팅 있는 식당인데 비가 와서 그런지 바로 들어가서 주문했다고 한다. 음식이 나왔을 때 딱 마침 식당에 도착해서 너무 배고팠기에 사진 찍을새도 없이 바로 흡입해서 사진이 없... 3인 세트로 주문했고 뿌팟퐁 커리, 갈비 쌀국수, 똠얌 누들, 텃만꿍에 밀크티까지 다 맛있었음.!! 은근 양도 많았다!! 추천 밥 다 먹었으면 당연히 디저트 먹어야지 필수가 아닌 원래 밥이랑 빵 묶음 세트 아닌가?? 레스피레 소금 빵으로 유명한 카페 아이스 소금 빵(7.5)🥐 과 난 블루베리 라벤더 티 에이드🫐 먹었는데 에이드 맛있었다. 복숭아, 레몬처럼 흔한 맛이 아니라 더 좋았음 당시 갔을 때 웨이팅은 없었지만 손님들이 계속 들어오긴 했다. 아마 1시간 30분 정도 있을 수 있고 그 후 웨이팅이 있을 경우 자리를 비켜줘야 한다. 오랜만에 만나서 이런저런(회사 욕) 하니 1시간 반 후딱 지나갔고 웨이팅이 있어 자리를 비웠다. 아직 시간도 이르고 아쉽기도 해서 다른 카페 가기로 함 다시 우산을 쓰고 어디 들어갈지 보다가 귀요미에 홀려서 우리도 모르게 발걸음이 멈췄고 ""여기 들어갈까? 들어가자"" - 미친.. 그래 너무 좋아.. 해서 들어간 곳이 카페 리인 리인 lee in 반려동물 동반 가능한 카페 입구에 저 하얀 솜뭉치가 누워서 손님들 반겨주는데 진짜 너무너~어무 천사다. 🤍🖤 쓰다듬어도 누워서 눈만 깜빡거리는데 하... 미쳤다 ! ! 이 녀석 인형인가? 이름이 목동이라는데 이름마저 초 카와이 ~~💖 메뉴 보고 먹고 싶었던 음료가 있었지만 솔드아웃이라 차를 시켰다. 근데 이름이 기억이 안 난다.. 긁적 (머쓱🤥) 눈이 어쩜 댕청해? (칭찬이야) 억울상으로 밖에 지나가는 사람들 구경하는데 이걸 보고 어떻게 안 들어오냐고!! 목동: 세모 눈 처음 봐? 주문한 차🍵 나와서 폭풍 촬영하던 거 멈추고 드디어 자리에 앉았다. 귀요미 때문에 엉덩이가 너무 가벼워져서 앉아있질 않았네 이런저런 얘기 하다 보면 목동이가 누워있다 일어나서 손님들 앉아있는 곳 스윽- 돌면서 잘 있나 확인하고 다시 눕는다.ㅋㅋㅋ 그러다 카페 사장님한테 가서 눈인사도 한다. 하 ㅜㅜ 화장실 가려고 입구 쪽으로 가보니 문턱에 기대서 비켜주질 않는 대형 솜뭉치.. 비에 젖으면 녹아내릴 거 같은데 결국 위로 건너서 밖에 나가 사진 찰칵 🐶 📸 건너다 혹시라도 너 밟을까 봐 얼마나 긴장했는데... 내 맘 아냐고 흐엉 🥲 작아진 세모눈으로 ""어 인간... 가는 거야? 멀리 안 나가~""라는 표정으로 쳐다보는 ㅋㅋㅋㅋ 화장실 갔다 왔을 때도 이러고 있길래 또 긴장하면서 건너 들어갔네 휴....... 미영이와 대화한 카톡 내용 아침에 예약했던 케이크 몰래 픽업하러 가야 돼서 카톡 하는데 앜ㅋㅋㅋ "" 나 화장실 갔다 올게"" 말하면서 눈 마주쳤는데 나도 모르게 입꼬리 씰룩거리고 간신히 참았다.... 픽업 간 사이에 다시 목동이 포토타임 시작 📷 거울에 비친 뽀찌 샷 마지막까지 사진첩을 솜사탕으로 꽉 채우고 갔다고 한다. 카페 후기인지 강아지 후기인지 아마 강아지인듯함 미스타교자 (본점) 명물 야끼교자(5.0), 야끼소바(9.0), 레몬크림새우(8.0)와 유자 하이볼(8.0) 주문했다. 야끼교자는 평범한 맛이었고 좀 짰다. 하지만 교자와 크림새우, 하이볼은 존맛..! 👍🏻 양은 적은 편이라 순식간에 눈앞에 사라져서 아쉬웠음 물론 여기도 사람들이 많아서 거의 만석이었지만 오늘 운이 좋아 그런지 날씨 때문인지 지금까지 다 웨이팅 없이 들어갔다. 비 오는 날에 웨이팅까지 있었으면 최악이었을 듯.... 두 번째 미션으로 꽃집 픽업 가야 했는데 내가 미리 알아봤던 곳 예약하고 좀 더 빨리 가도 되냐 물어봤는데 꽃이 다 나가서 예약을 취소해야 될 거 같다고 죄송하다 하심🥹 어쩔 수 없이 또 급하게 미연이 눈치 보면서 폭풍 검색ㅋㅋㅋ 다행히 6분 거리에 바로 가능하다는 곳이 있어서 다 먹고 인생 네 컷 찍으러 가자 하면서 꽃집으로 빙- 돌아감 도착해서 미연이한테 🌸핑크 꽃다발🌸 짠! 선사했다. 날씨 때문에 뭔가 짐 됐을 거 같았는데 좋아해 줘서 다행이야ㅜ 받고 나서 인생 네 컷 있는 곳이랑 반대로 가길래 물음표🤔? 였다고 ㅋㅋㅋㅋ 이제 진짜로 인생 네 컷 가는 길 반대로 온 만큼 다시 걸어가야 된다는.... 걸어가면서 초반에는 하하 호호 했는데 10분쯤 걸었을 때 다들 말 없어진 게 너무 웃김ㅋㅋㅋㅋ 사실 난 대화 단절된 줄도 몰랐는데 미영이가 ""그거 알아? 우리 말 없어진 거?"" 말해서 알았음 아 내가 말 안 했구나 ㅋㅋㅋ 갈 때 비가 너무 와서 물웅덩이 피해야지 케이크는 또 흔들릴까 집중하고 봐야지 가방도 챙겨야지 해서 말 없었는지도 몰랐었나 보다 한 15~18분 걸어 도착해 거울 보니까 다들 바지, 신발 양말 다 젖고 앞머리는 안 그래도 없는 햇빛 가려주는 암막 커튼이 되어있고 가방은 샤워했고 실내 들어온 게 너무 행복했음 😮‍💨💦 다시 나갈 생각하니까 너무 지옥이다... 사진 찍고 부랴부랴 나와 다시 비로 샤워하고 도착해 미욘이 생파 준비하는데 강얼쥐 코랑 귀가 녹았다...! 어디 찌그러지진 않아서 다행이었지만 약간 아숩다. 망원동 철인3종경기 하느라... 케이크 맛도 너무 맛있었고 디자인 완벽에 크기도 적당! 급하게 하느라 당일 케이크로 했지만 맞춤으로 해도 괜찮을듯하다. 농.협.은.행 미연쓰 어디가 어떤 게 뭐가 꽃인지 모르겠음? 👀? 소박했지만 보람찬 생파 성공 비만 안 왔으면 한강 가서 해주려 했는데 힝 나랑 미영이 둘은 미연이랑은 지하철 반대 방향이라 헤어졌는데 미영이가 ""반대편 우리 앞에 미연이 타면 웃기겠다"" 해서 에이 설마... 그 많은 탑승구에 심지어 출구 계단 쪽 바로 앞도 아니고 살짝 옆인데? 했지만 웬걸ㅋㅋㅋ 반대편에서 미연이 탔음🫢 - 아니 저거 미연이 아니야? - 응? 맞는디? ㅋㅋㅋㅋ 마지막까지 찰칵 찰칵 찰칵"
서울 망원동 생일 레터링케이크 주문제작 추천 위켄드케이크,"안녕하세요 입술이 달빛입니다 지난주가 언니 생일이여서 망원동에서 레터링케이크 주문제작 했습니다🤗 위켄드케이크 📍주소: 서울 마포구 망원로2길 69 3F ⏰영업시간 수~일: 11:30~20:00 매주 월, 화 정기휴무 👇🏻위켄드 케이크 인스타그램👇🏻 위켄드 케이크 wee kend it🙃 망원동케이크(@weekend__cake) • Instagram 사진 및 동영상 팔로워 12K명, 팔로잉 25명, 게시물 726개 - 위켄드 케이크 wee kend it🙃 망원동케이크(@weekend__cake)님의 Instagram 사진 및 동영상 보기 instagram.com 주문방법 망원동에는 레터링케이크 샵이 꽤 많은 편인데요! 위켄드케이크 인스타 보니 아이돌 선물로 팬분들이 많이 찾는 곳이더라구요~ 출처: 위켄드케이크 인스타그램 파스텔톤 색감도 맘에 들고 귀여운 캐릭터도 많아보였어요! 출처: 위켄드케이크 인스타그램 주문방법은 위켄드케이크 카카오 채널을 추가하고 채팅창으로 주문하시면 됩니다! 소식란을 보시면 자세한 안내가 나와있어서 참고하시면 좋아요 디자인 주문 케이크 미니: 21,000원 당일 랜덤 디자인은 18,000원인데 저는 레터링 넣을거여서 주문 케이크로 했어요! 저는 인스타에서 이 디자인 보고 캡쳐해서 주문할 때 첨부했어요! 케이크 시트와 크림도 선택 가능합니다 🍒시트종류: 바닐라/초코 🍒시트크림: 위켄드 시크릿 바닐라크림 발로나 초코크림/라즈베리 퓨레/복숭아 퓨레 저는 시트는 초코 크림은 바닐라 제누와즈로 했습니다👍🏻 이 조합 추천해요!!! 케이크 픽업 저는 이틀전에 주문했고 망원동 위켄드 케이크 매장으로 픽업 시간에 맞춰 방문했어요~ 망원시장에서도 훨씬 안쪽으로 들어가야해요! 건물 3층으로 올라가면 있습니다 위켄드케이크 서울특별시 마포구 망원로2길 69 3F 매장은 픽업용이여서 귀엽고 아담한 편이였어요! 귀여운 캐릭터 케이크😍 동글동글 넘 귀여워요! 귀여운 초와 파티용품도 판매합니다 짜~잔! 핑크 초도 무료로 1개 붙여주시더라구요 일반 도시락케이크랑 가격 동일한데 포장은 훨씬 퀄리티 있죠?ㅎㅎ 케이크 높이도 도시락 케이크보다 더 높은 편입니다 본가에서 찍어서 예쁜샷을 못 담았지만…핑꾸핑꾸하니 화사했어요 자정 지나서 촛불 불고 언니랑 한 조각만 맛보자고 해놓고 넘 맛있어서 절반을 다 먹었어요ㅋㅋㅋ 안에 초코 시트 진짜 촉촉하고 크림치즈가 미쳤어요ㄷㄷ 제가 최근 먹어본 케이크 중에 가장 맛있었답니다👍🏻 귀여운 캐릭터 좋아하는 언니가 어버이날 케이크 같다고 아쉬워했지만🥹 (듣고보니 그런거 같기도) 넘 맛있게 먹어서 만족스러웠어요👍🏻 앞으로 지인 케이크 주문은 위켄드케이크로 정착해야겠어요 #위켄드케이크 #망원동케이크 #망원동레터링케이크 #망원동도시락케이크 #망원동생일케이크"
귀엽고 예쁜 레터링케이크 당일 구매 가능한 망원동 '위켄드케이크',"위켄드케이크 서울특별시 마포구 망원로2길 69 3F · 위치 : 서울 마포구 망원로2길 69 3F · 영업시간 : 목-일 11:30 - 20:00 / 매주 월화 정기휴무 · 전화번호 : 0507-1491-1322 · 기타 사항 : 포장, 반려동물 동반 가능 · 인스타그램 : 위켄드 케이크 wee kend it🙃 망원동케이크(@weekend__cake) • Instagram 사진 및 동영상 팔로워 11K명, 팔로잉 27명, 게시물 699개 - 위켄드 케이크 wee kend it🙃 망원동케이크(@weekend__cake)님의 Instagram 사진 및 동영상 보기 www.instagram.com 안녕하세요. 소르디에요 ( •͈ᴗ-)ᓂ-ෆ 남자친구 생일이라 케이크를 사야 했는데 이왕 사는 거 특별하고 귀여운 케이크였으면 해서 주문 제작 및 당일 케이크 구매 가능한 망원동 '위켄드케이크' 다녀왔어요 망원파출소와 웅파이가게 사이 골목 쪽으로 들어가면 보이는 건물 3층입니다 건물 앞에는 노란 입간판이 있어요 계단 올라가는 길에 붙여져있는 위켄드케이크 포스터 졸귀탱 (๑￫ܫ￩) 입구에는 영업시간이 안내되어 있어요 11:30 - 19:30 / 월화 휴무 들어가자마자 보이는 냉장고에는 예쁜 케이크가 되길 기다리는 하얀 케이크와 손님들이 주문한 케이크들이 있었어요 초 종류도 엄청 많았고 뒤쪽에는 파티 용품들도 팔고 있었어요 출처 : 업체 등록 사진 위켄드케이크는 레터링 케이크부터 귀여운 동물모양케이크까지 다양하게 주문 제작 가능한 케이크가게예요 출처 : 업체 등록 사진 주문 제작 문의는 카카오톡 플러스친구 : 위켄드케이크 으로 하시면 됩니다! 주문방법 및 가격 등등 자세하게 나와있어요 출처 : 위켄드케이크 카카오톡 플러스친구 당일 방문 시 구매할 수 있는 케이크도 판매하고 있는데 한정수량이라 전화하고 방문하시는 게 좋을 것 같아요! 사이즈도 미니 사이즈부터 큰 사이즈까지 선택의 폭이 다양합니다 출처 : 업체 등록 사진 저는 금요일 저녁시간대 동료 추천받고 전화도 없이 간 거라 남아있는 수량이 별로 없었지 다행히 귀여운 케이크가 있어 바로 구매했습니다 당일 케이크는 사전예약 없이도 디자인 선택부터 레터링도 가능합니다 레터링 문구 올려주실 동안 매장 구경했어요 케이크만큼 매장도 되게 아기자기하고 귀여웠어요 안쪽 냉장고에 보이는 귀여운 동물모양 케이크들 나중에 좀 일찍 와서 동물케이크 구매하고 싶어요 강아지도 있어요.... ♥ 진짜 너무 귀여워요 사교성이 좋다고 하는데 이날은 아쉽게 보지 못했어요 귀여운 소품들도 엄청 많아요 사장님이 엄청 친절하셔서 기분 좋게 케이크 구매했답니다 깨알 귀여운 포스터 역시 귀여우면다다주의 요렇게 귀여운 박스에 넣어주세요 저는 강아지가 그려져있는 핑크시트의 케이크를 골랐어요 초 하나는 서비스로 넣어주셨어요 미니 사이즈로 18,000원에 구매했습니다 케이크를 좋아하는 편은 아니라 너무 큰 홀케이크는 부담이었는데 미니 사이즈가 저희한텐 딱 적당했어요 초 켜니까 더 귀엽지 않나요? 신선한 재료 수제 제누와즈, 키리쉬를 이요한 수제 시럽, 100% 동물성 생크림, 필라델피아 크림치즈와 앵커버터로 만드신다고 해요 사실 잘 모르겠는데 존맛탱이라 이 말 이건 예전에 동료가 당일 가서 산 귀여운 동물 케이크 출처 : 업체 등록 사진 인스타그램에서 주문제작한 케이크들 구경하시면 깜짝 놀라실거에요. 엄청난 고퀄입니다 당일 케이크에 레터링 올려주시는데 가격도 아주 착해요 (˘･ᴗ･˘) 특별한 날 부담 없이 구매하기 좋은 기념 케이크 '위켄드케이크'였습니다 (내돈내산)"
가성비 당일 레터링 케이크 망원동 <위켄드케이크>,"이번엔 애용하는 레터링케이크집을 소개해 드리려구요!! 친구들 생일케이크 여러번 이용했는데! 이번엔 사진도 예쁘게 찍구 이제는 남겨야겠다 싶어서 남겨요~🎂 먼저 요즘은 인스타에 새로운 소식이 자주 올라오니까 인스타부터 소개할게요~!! 위켄드 케이크 wee kend it🙃 망원동케이크(@weekend__cake) • Instagram 사진 및 동영상 팔로워 10K명, 팔로잉 25명, 게시물 683개 - 위켄드 케이크 wee kend it🙃 망원동케이크(@weekend__cake)님의 Instagram 사진 및 동영상 보기 instagram.com 출처:위켄드 케이크 인스타그램 당일 케이쿠는 대체적으로 요런 디자인이에요! (참고용) 너무 귀엽지 않나요 ㅠㅠ 아래 판 때문에 사진으로 좀 커보이는데 실제론 손바닥만한?? 크기에용~ 근데 저는 거의 추카용 한입용으로 케이쿠 많이 사니까 이 크기 딱 적당하구 좋드라구요~ 입체 당일 동물케이크는 25,000원! 합리적이죠?? 😉 아니 요즘 케이쿠제작이 5~6만원 훌쩍이던데.. 허허... 저는 가성비충이면서 이런거 챙기는건 또 좋아해서 ㅋㅋ 아주 적합합니다~!! 주문방법 🍒Weekend cake 주문 방법🍒 안녕하세요 Weekend cake 를 찾아줘서 고마워요🧸 문의는 댓글 말구 채팅으로 주세요:) 🍒가격안내 # 당일 랜덤 디자인 ( ⭐️주문케이크랑 가격달라요⭐️) 당일케이크는 매일 다른 디자인으로 만들어져요 : ) 미리 예약 하시게 되면 랜덤 디자인으로 골라드려요 1. 미니 18000원 지름 10cm - 일반 도시락케이크보다 높아용 - 도시락 펄프케이스 아닌 미니박스에 포장됩니다 : ) 2. 1호 ... pf.kakao.com 카카오톡에 주문방법 상세히 올리와있구요~! 당일에 카톡으로 디자인 여쭤보면 출처 : 위켄드케이크 이러케 보내주세요 ㅎㅎ 저는 이중에!! 부농🐰, 노랑🐥, 🐶, 🐱 다~~ 귀여웠지만!! 중앙에 떡하니 보이는 쿼카가 넘모 귀여워서 쿼카로 픽햇어요!! 뒤에 병아리와 강아지가 시강이긴한데 ㅋㅋ 쿼카 넘 귀엽죠 ㅠㅠㅠ🤎 13:30으로 예약하고 입금하고 신나서 픽업갑니당~~ 위켄드케이크 서울특별시 마포구 망원로2길 69 3F 위치는 여긴데 걸어가기엔 살짝 애매해서 합정역에서 마을버스 탔어요!! 위켄드케이크는 이 건물 3F에 있구요 요기 문으로 올라가면 돼요!! 살짝 비친 저는 신난 발걸음 ㅋㅋㅋ 올라가는 길에도 귀여운 포스터!! 픽업 open 11:30 ~ close 19:30 카카오톡 문의 11:00 ~20:00 도착하면 이렇게 귀여운 케이쿠들이 진열되어있어요 ㅎㅎ 아마 이게 남은 당일 케이크일 것 같아요!! 위에 아주 귀요운 초들도 있구요!! (주문하면 일반 초 1개는 그냥 주세요) 뒤로는 이렇게 열심히 케이쿠 만들고 계시더라구요~ 아마 다른 제작케이크들도 있으니 바쁘신 것 같았어요!! 다양한 소품들도 있으니 구경하고 같이사면 좋을 것 같아요!! ㅎㅎ🧡 픽업 완료!!! 기대기대💕 문구만 빠르게 확인하고 픽업해서 케이크를 정확히 보진 못햇어요ㅠㅠ 이 날 에어비앤비로 방 빌려서 친구들이랑 놀기로 한 날이었는데 깜짝 서프라이즈로 짐 정리하는척 하면서 케이쿠를 꺼냈죠!! 하핳ㅎㅎ 칭구가 넘 좋아해서 저도 넘 뿌듯!!🤍 3년차부터 그만두고싶어하더니 10년이나 고생한 친구도 대단하고 ㅋㅋ 꼭 축하해주고 싶었는데 마침 놀러가는날이라 준비했어요~ 🎂🎉 이마에 꽂아버린 초가 좀 무섭긴하지만 ㅋㅋㅋ 이마에 꽂으면서 또 신나하고 신나서 사진찍고 좋아하는 칭구보니까 저도 뿌듯!!! 크흐~~~ 크게 케이쿠만 보면 더귀여움 🤎 앞으로도 기념일에 계속 위켄드 케이크는 애용하려구요~!! 넘모 인기많앚이면 예약하기 힘두니까 적당히 인기많아지길 ㅋㅋㅋㅋㅋㅋㅋㅋㅋㅋㅋ #내돈내산"
직장인의 하루-22.3.3> 망원동 데이트-위켄드케이크 곰돌이미니케이크 당일예약&해진뒤 술안주 오마카세,"직장인의 하루-22.3.3> 망원동 데이트-위켄드케이크 곰돌이미니케이크 당일예약&해진뒤 술안주 오마카세 오늘 아침도 채식당 컵밥~ 간단하게 챙겨먹기 딱 좋다! 간식은 애플토마토~~ 안달다ㅠ아쉽.. 점심은 퀴즈노스 샌드위치~ 런치세트로 이탈리안샌드위치 주문~ 비주얼은 예쁘네~ 근데 이탈리안샌드위치는 내스타일이 아니였다ㅠ 햄이 별로였어!!!! 매우!!! 동생이 준 쿠크다스 케이크도 먹고~~ 오늘 엄마 생일이라서 급하게 케이크 예약했다! 망원동 웨켄드케이크 방문! 위켄드케이크 서울특별시 마포구 망원로2길 106 1층 수-일 12:00 - 19:00 월,화 휴무 0507-1491-1322 픽업 11:30-7:30 카카오톡으로 케이크 당일예약 가능한지 확인후 예약하고 찾으러왔쥐~ 위켄드케이크 사장님 혼자 운영하는듯! 가게가 참 귀엽구나~ 파티, 케이크 소품들도 판매중! 가게가 참 아기자기~ 곰돌이 거울 졸귀탱구리~ 귀여운 곰돌이!! 위켄드케이크 미니곰돌이케익 픽업 완료! 표정봐ㅠ졸귀탱ㅠ 포장도 귀엽! 위켄드케이크 보관법 읽어주고~ 저 귀여운 미니 곰돌이 케이크에 레터링은 무료! 25,000원! 단면은 이렇게! 귀부분은 설탕? 뭔가 단단하고 이쑤시개로 고정되어있으니 조심조심! 망원동 위켄드케이크 먹을 만했다! 암튼 케이크 픽업하고 오빠랑 저녁먹으러 해진뒤방문! 한식오마카세로 유명한 망원동 해진뒤! 두근두근 기대중! 망원동 맛집 해진뒤는 식당이아닌 주점이라서 1인 1주류는 필수다! 그래서 술샘오미자랑 황금보리 주문! 하지만 난 술이아닌 밥을 먹으러왔지~ 옥수수타락죽! 존맛.. 진짜 신경써서 만들었다고 느껴지는 맛ㅠ 프로슈토 감자! 이건 쏘쏘~ 뭔지 잘 모르겠음~ 배추말이전! 이런 전은 첨이라 신기방기! 오늘의 회~ 한식 오마카세 너무 좋다! 다양한 음식 코스로 즐길수있다!! 망원역 맛집 해진뒤 시그니처메뉴인 한돈 떡갈비 버거! 2인 1버거라서 아쉬울뿐ㅠ 에멘탈치즈 미쳤어~~ 단면도 너무 예뻐ㅠ 대삼치구이는 짭짤했다~ 제일 맛있었던 불고기 솥밥! 솥밥이 진짜 젤 맛있었다ㅠ 그래서 한번 더 리필해먹음^^ 추가로 주문한 짜계치! 짜계치는 별로였다~ 뭔가 자극적이지도않고~내스타일아님~ 디저트 등장이요~ 크림치즈 곶감말이에 곶감은 맛있는데 크림치즈가 약간 저렴한 느낌? 아쉽! 오미자는 존맛탱구리~리필하고싶었다! 해진뒤에서 배터지게 먹고 집가려는데 뭐야 과일 진짜싸!!! 망원시장 중간에 있는 과일가게 막퍼주는집! 딸기 2팩에 7,000원인데 진짜 싱싱하고 크다! 딸기 2팩 샀지롱~~ 집가기 너무 피곤해서 택시타고감.. 춥기도 했고 너~~~~~~~~~~무 피곤피곤했다... 오랜만에 한 퇴근 후 데이트 참 재미져~~ 하지만 내 몸뚱이 힘들어하쥐~ 짠한 하루 끝ㅠ"
[망원ㅣ위켄드케이크] 망원동 Weekend Cake 커스텀케이크 전문점,"망원 위켄드케이크(Weekend Cake) 망원동에 있는 케이크전문점 어버이날을 맞아 ㄱㄱ! 위켄드케이크 서울특별시 마포구 망원로2길 69 3F 위치는 망원파출소 바로 옆! 이 노란색 입간판이 보이는 건물로 들어가면 된다 건물 문에도 Weekend Cake라고 써있다 3층임!! 1층 옆에 있는 카페랑 헷갈리지 마시길 가게앞에 붙어있는 귀요미 포스터 가게 내부 모습 아기자기한 초들도 많다 문열고 들어가면 얘네부터 보인다 진짜 너무 깜찍2들,,,,, 사이즈가 작아서 더 귀여움 동물얼굴 케이크는 종류 되게 많다 맛도 다다름! 뭐는 초코, 뭐는 바닐라생크림 등등 미리 주문할때 시트랑 크림 다 고를수 있는듯 원래는 당일 커스텀 주문도 가능한데 어버이날 전날에는 너무나 불간흥 했던것,,ㅠㅜ 큰사이즈는 이미 예약이 다 되어 있어서 남은 쪼꼬미들 중에 골라야 했음 결국 곰돌이로 pick 가격은 25,000원! 급하게 고른 레터링 문구,,ㅋㅋㅋㅋ 불효녀를 용서하소서ㅠㅋ (그래도 어버이날 챙기긴 하니까 불효녀는 아니야,,) 자칫하면 어버이날이 아니라 어린이날 케이크로 착각할만한 케이크^^;이지만 카네이션이 5개나 있으니 누가뭐래도 어버이날을 위한 케이크다!ㅎㅋ 케이크 상자도 귀여움 귀여운게 최고 얘는 사장님 갱얼쥐 나나 나나 졸귀ㅠ 뽈뽈뽈뽈 나와서 반겨준다,, 완전 얌전하고 너무너무 ㅜ기요미 여기엔 귀여운게 너무 많아,,!(좋다는 뜻) 가게앞 복도에 이런 거울도 있길래 나가는길에 한컷 찍어봄ㅎ 망원동 Weekend Cake 후기 커스텀케이크 하는데 중 내기준 제일 귀여운거 잘하는 곳이다ㅎㅎ 사장님 친절하심 나나 너무 귀여워서 나나보러 또 가고싶음 당일커스텀 주문된다는게 큰 장점 https://www.instagram.com/weekend__cake/ 위켄드 케이크 wee kend it🙃 망원동케이크(@weekend__cake) • Instagram 사진 및 동영상 팔로워 10K명, 팔로잉 24명, 게시물 688개 - 위켄드 케이크 wee kend it🙃 망원동케이크(@weekend__cake)님의 Instagram 사진 및 동영상 보기 www.instagram.com 인스타에서 나나 근황 확인 ㄱㄴ 사장님께서 디엠은 확인 못하신다고 하시고 카톡으로 주문할 수 있다! 깜찍한 케이크 말고도 주문제작 가능하니 왕추천 !"
