title,content
망원동 위켄드케이크에서 주문제작한 귀여운 동물생일케이크 후기,"친구님 생일기념으로 부랴부랴 찾아보고 주문제작 맞춘 레터링케이크에요!!!! 우연히 인스타보다가 동물모양으로 된 케이크가 너무 귀여워서 알아보고 가격이랑 일정 등 여러가지 문의해보고 확정해서 받은 케이크후기 포스팅해볼게요 >3< 저기 곰돌이가 생일모자를 쓰고있는 모습이 세상졸귀라서 진짜 보자마자 홀딱 반해버렸어요......☆ 왜이렇게 귀여운거냐쿠우우ㅠㅠㅠ 알아보니까 동물케이크는 25,000원이고 이것도 사이즈마다 가격이 달랐어요! 사진에 보이는건 미니사이즈고 실제로 직접가서 보니까 작긴 작은데 딱 파티때 한끼먹고 치우기 딱 좋은 사이즈라서 저는 만족했어요!!!!! 요즘 레터링케이크들 가격이 워후~~ 아주 만만치않더라구요^^ 너무 비쌌는데 여기는 그래도 디자인+맛+후기+가격 다 좋아서 바로 고고! 위켄드케이크 전화 0507-1491-1322 주소 서울 마포구 망원로 2길 106 1층 (망원역 2번출구) 위켄드케이크 서울특별시 마포구 망원로2길 106 1층 망원역에서 10분정도 걸으면 나오는 위켄드케이크에요! 저는 미리 원하는 글씨와 모양으로 주문을 해놓은 상태라서 찾으러 가는길이였습니당 ㅎㅎㅎ 이것저것 요청사항을 많이 적었던지라 뭔가 어떻게 나올까 너무 기대되었어요 처음에 본 동물케이크로 주문하려다가 자꾸보니까 귀여운 디자인이 계속 업로드되가지고 저도 마음이 계속 바뀌더라구요 ㅋㅋㅋ 그래서 저 케이크를 기준으로 원하는 요청사항을 추가추가해가면서 제가 원하는 모양으로 맞춰나갔어요!!! ++요청사항++ - 하트모양시트 - 동물 2마리 올라가고 작은케이크까지 -글씨는 알록달록으로 (동물이랑 케이크때문에 글씨 쓸 자리가 많이 없어서 저는 간단하게 HBD로 했어요) 저기 보이는 사진은 제가 포토샵으로 예상디자인을 만들어 본 건데 ㅋㅋㅋ진짜 저대로 또오옥같이 나왔다는 사실 실제사진은 스크롤 마지막에 있으니까 쪼매만 더 기다려주세요 헤헿 사장님이랑 상담하면서 원하는걸 맞춰나갔는데 답변도 빠르시고 설명도 친절하게 잘 해주셔서 너무 좋았어요 짜잔!!!!!! 어때요??? 제가 포토샵으로 만들어 본 케이크랑 완전 똑같죵???? ㅋㅋㅋㅋㅋㅋ 꺄아아아~~~~ 진짜 실물은 너무 이뻐요 동물도 오리+고양이로 해달라고 했는데 너무 귀엽고 ㅠㅠㅠㅠ흐엉엉 귀여움폭발 가까이서 한 번 더 찰-칵!!! 초도 그래서 작은걸로 잘라서 꽂았는데 케이크사진만 엄청 찍었어요 저의 인스타에도 업로드 된 사진 이날 생일파티는 아주 성공적이였고 친구도 엄청 좋아하더라구요!!! 제가 노랑색을 좋하하기도하고 이제 곧 봄이라서 화사하게 컬러를 노랑으로 요청했는데 원하는걸로 잘 나와서 뿌듯했어요 친구의 극찬을 받은 최고의 생일케이크 글씨도 간단히 저렇게 들어가는게 나중에보니까 깔끔하니 더 이쁜 것 같았어요 맛도 부드럽고 크림도 느끼하지 않았어요 그리고 크기가 도시락케이크는 좀 작다는 느낌이 있는데 이건 일반케이크보다는 작지만 도시락보다는 크고 파티분위기도 나는데 가격은 저렴하구!!!!! 다음에도 저는 또 이용할 것 같아요 행복한 생일을 마쳤습니당 사장님 이쁘게 만들어주셔서 너무 감사했구..... 친구도 진짜 진짜 엄청 좋아했어요!!! 곧 내 생일인데 친구님에게 저는 어떤 케이크를 받을지 기대가 됩니다 ㅋㅋㅋㅋ 과연 두구두구두구~~ 나 기대해도 되징??ㅎㅎㅎ"
망원동 위켄드케이크 맛집 수제케이크 제작케이크 곰돌이케이크,"위켄드케이크 서울특별시 마포구 망원로2길 106 1층 망원동 위켄드케이크 주소: 서울 마포구 망원로2길 106, 1층 영업시간: 11:30 - 19:30 주말은 쏠드아웃이 많이 발생하니다~^^ 매주 월요일,화요일은 휴무입니다 자 우리 강우 생일준비 제일 좋아하는 카봇으로 케이크를 만들려고 합니다 과연,,, 할 수 있을런지 기대 반 걱정 반 망원동에서 제일 제일 핫한 곳 위켄드케이크 수제 맞춤 제작 가능한 케이크 집~!!!! 곰돌이 케이크가 많이 보이네요~ 귀욤뽕짝 하고만요 초도 다양한 초가 보이네요~ 신기한 거 대박 많아요~~ 엘사 왕관은 공주들 꺼 ㅋㅋ 냉장고에 맞춤 제작된 케이크 멍멍이, 고양이, 호랑인가~? 사람 얼굴도 보이네요~~ 당당하게 자신 있게 카봇 케이크 만들어 주세요~ 제발요 두고 두구 두구 일단 선물 먼저 투척~! 옜다~ 카봇이다~ 이거만 있음 행복한 거지 그래도 케이크도 봐주겠니~? 짜잔~!!! 감동 감동 케이크 너무 이뻐요~~ 카봇 로봇은 케이크가 아니고 진짜 장난감이에요ㅋ 먼저 장난감을 드리고 만들어 주신 거예요ᄏᄏ 정말 정말 멋지게 정성스럽게 만들어주셨어요 감동 감동 위켄드케이크 짱짱 생일 축하해요~ 위켄드 사장님 고맙습니다 너무너무 케이크 이쁘게 만들어주셔서 분위기가 한층 더 업그레이드됐어요~^^ 다음에도 제작 주문 하겠습니다~^^ 내 돈 내산 리뷰였습니다~ ^^ #망원동 #위켄드케이크 #수제케이크 #맞춤제작케이크 #망리단길 #케익 #수제케익 #카봇케이크 #카봇케익 #망원 #마포 #홍대 #홍대케이크 #합정케이크"
망원동 당일 픽업 가능한 레터링케이크 위켄드케이크,"생일을 잘 챙겨주지 못해 미안했던 친구가 집으로 방문하기로 한 날!! 늦었지만 작은 케이크로 성의 표시라도 하기로 하고 급하게 동네 케이크 집을 찾았다 게다가 부지런히 주문했어야 받을 수 있었는데 하루 전 날에서야 케이크를 생각한 에필이네는 주문을 할 수가 없었고 제일 작은 사이즈도 최소 5만원이 넘는다 그렇게 뭘 사야하나 고민하던 찰나 자주 지나가던 동네에 당일 픽업이 가능한 레터링 케이크가 있다고하여 바로 방문 📞010-4816-1204 🏠서울 마포구 망원로2길 69 3F ⏰11:30 - 20:00/매주 월,화 휴무 에필이네가 애정하는 아뜰리에 크레타 건물 3층에 있는 #위켄드케이크 쉴새 없이 베이킹을 하시는 것 같았다 다양한 종류의 초도 판매중인데 너무너무 귀엽더라는 이 나이가 되어도 귀여운 거 좋아해 당일 픽업 케이크는 수량이 한정 되어 있어서 방문 전에 꼭 전화로 확인해 보시는 것을 권해 드린다 오픈하자마자 찾아서 그런지 아직 준비되어 있는 케이크가 많지는 않았음 파티 용품도 다양했고 케이크 박스도 귀욤귀욤 오늘의 케이크고요 사이즈는 크지 않지만 2인 가구가 많은 요즘 케이크도 집에 가지고 가면 짐이라 생각하기 때문에 작은 사이즈를 오히려 선호하는 편이다 ㅎㅎ 케이크 가격 에필이네는 요 귀가 달린 강아지로 주문했고 가격은 25,000원이다 레터링을 기대하고 가면 좀 실망할 수도 있겠지만 케이크 가격 자체가 그렇게 부담스럽지 않아서 한 번 쯤은 사볼만 한 것 같다 생일파티만 하고 안주들 먹느랴 배가 불러 친구 집에 들려 보내 맛은 모르겠다만 케이크를 받은 친구가 행복해 하는 걸 보니 참으로 잘 준비했다는 생각이 들었다 ㅎㅎ"
망원동 레터링 케이크 전문점 위켄드케이크에서 친구 케이크 후기,"위켄드케이크 Adress: 서울 마포구 망원로2길 36 3F Tel:0507-1491-1322 카카오톡 ok Time:12:00~19:00 Parking: 불가 Day off: 월,화 Point: 수제시럽사용, 100% 동물성생크림 친구생일때문에 저는 1주일전에 카카오톡으로 예약한후 방문을했습니다. 원래보통레터링케이크 주문은 무통장입금을 해야 주문이완료되는데 월급이 늦게나와서 나중에입금드린다고했는데 그러면 현장 결제해도 된다고하셔서 감사했습니다! 친구가 잔망루피를 닮아서 카카오톡으로 이미지를 보내서 가능한지 여쭤봤고 가능하다고 하셔서 실행했습니다. 픽업날짜가 되서 1시에 픽업하기로했는데 차가 막히는 바람에 1시간 늦게 픽업했는데 괜찮다고 말해주셔서 감사했습니다! 입구로들어가기전에 이렇게 귀여운것들이 반겨줍니다. 왼쪽에 보이는 곰같은게 이 가게의 시그니처 캐릭터인거같은데 너무귀엽네요 매장에 들어가니까 3분이 반갑게 맞아주셨고 이름말하고 주문케이크를 찾았습니다. 그리고나서 결제한후에 귀부분에는 이쑤시게로 고정되어있으니 조심히먹으라는 말과함께 집도착시간을 물어보시고는 얼음팩도 같이 넣어주셔서 감사했지요 그리고나서 숙소에 도착해서 케이크를 열어봤는데 제가 생각한건 평면으로된 잔망루피를 생각햇는데 입체적으로 만드셨더라구요 분명 제가 평면으로된 이미지를 보냈는데.. 알고보니 이업체는 입체적으로 만드는 케이크전문점인가봐요... 제가 잘알아보지못한 제잘못이죠 ㅠㅠ 그래서입체로 되어있어서 비슷하게 나오진않아서 조금아쉬웠습니다. 이런식으로 케이크를 만들어주셨고 꼬깔모자는 사지않았는데 올려주셔서 귀엽네요. ㅎㅎ 아그리고 초를 사지않아도 1개는 무료로 주시니까 필요하신분들은 참고하시고 가겨은 25000원 미니사이즈였고 빵시트 맛고를수있어서 저는 초코를 선택했어요 약간은 비싼감이 없지않아 있어요 숙소가서 친구랑 초불고 맛보니까 분홍색시트의 맛은 약간 인공적인딸기맛? 느낌이있어서 저는 그냥 그랬는데 친구는 맛있다고 해주면서 다먹었고 안에는 초코시트와 딸기쨈이 있어서 맛있었습니다. 기념일이나 특별한일있을때는 간간히 들리면 좋을것같다고 생각했습니다! 그럼저의 리뷰는 이만~ 지금까지 내돈내산리뷰였습니다 좋은하루되세요! 위켄드케이크 서울특별시 마포구 망원로2길 69 3F"
"위켄드케이크 | 망원동 레터링케이크, 당일 주문 가능한 케이크집","기념일에는 기본케이크를 사는것보단 이왕이면 레터링케이크를 사게되더라구요. 이번에는 망원동에 위켄드케이크에서 케이크를 주문해보았어요 ! 위켄드케이크 주소 | 서울 마포구 망원로2길 106 1층 전화 | 0507-1491-1322 영업시간 | 수,목,금,토,일 11:30~19:30 (월,화 휴무) 메뉴 | 당일랜덤디자인 (미니 16,000 / 1호 35,000 / 2호 55,000 ) 주문케이크 (당일케이크가격 + 기본 5,000) 빈티지 레이스케이크 (미니 25,000 / 1호 45,000 / 2호 65,000) 주문방법 | 카카오채널을 통해 주문 >> https://pf.kakao.com/_CxkQxls 인스타그램 | https://instagram.com/weekend__cake?igshid=NDA1YzNhOGU= 가게 전경 열려있어요 들어오세요 멍뭉이 친구가 있었어요 한참 바깥 구경을 하고 있더라구요 너무 귀여웠어요 ㅠㅠ 벽면에는 이렇게 귀여운 포스터도 있었어요. 보니까 위켄드케이크 마스코트 같아요 :) 정면 쇼케이스에는 당일케이크가 준비 되어있었고, 벽면에는 다양한 머리띠가 있었어요 파티할때 준비 못했다면 위켄드케이크에서 사도 좋을 것 같아요. 마치 전부터 준비했던것처럼 ~~ 당일케이크는 생각보다 다양한 종류가 있었고 다들 너무 귀여웠어요 벽면에는 오늘 픽업하는 케익들이 있었는데 완성도가 진짜 높았어요. 다음엔 더 귀여운 케이크 주문해보고싶은 마음이 들어요. 안에는 작업하는 공간이 있었어요. 픽업케익중에 하나였는데 너무 귀여워서 찍었어요 위에 뚱뚱이 동물들과 케이크 ㅠㅠㅠ 짱귀 음료도 주문 가능했어요 조그맣게 메뉴판이 있어서 찍어보았답니다. 다른 레터링 케이크샵에서는 도시락케이크 가격에 미니케이크를 받으니 가격이 저렴한 느낌 ?? 하트초는 서비스로 챙겨주셨어요!! 초도 하나 사려면 1000원정도인데 깜짝 선물받은 기분 ! 깔끔한 배경에 꽃이 통통하게 피었습니다 ㅎㅎ 서른번째 생일 축하 케이크에요. 하트초로 귀엽게 완성된 케이크 !! 위켄드 케이크 재주문의사 완전 있어요 위켄드케이크 서울특별시 마포구 망원로2길 106 1층"
망원동 개성있는 주문제작 케이크 _ 위켄드케이크 가격 & 맛,"5월은 제 생일이 있는 달이에요! 저의 가장 친한 친구도 5월에 생일이라서 올해는 합동 생일파티를 하기로 했어요. 에어비앤비로 공간도 대여하고, 풍선도 구입하고, 생일에 입을 옷까지 정했는데 케이크가 빠질 수 없겠죠?! 친구가 애정하는 케이크집에서 주문제작을 했답니다♥ 위켄드 케이크 망원역 근처 주문제작 가능한 케이크샵 매주 월, 화 휴무 수-일 11:30 ~ 19:30 픽업 가능 위켄드케이크 : 네이버 방문자리뷰 38 · 블로그리뷰 74 naver.me 망원역 근처에 위치한 위켄드케이크는 제가 그 동안 주문해 본 다른 주문제작 케이크에 비해 합리적인 가격으로 제공하고 있어요. 요즘은 케이크 기성품을 구매하려고 해도 3-4만원은 금방 넘어가고, 원하는 디자인으로 주문제작하려면 5만원 이상도 훌쩍이잖아요? 제가 이번에 주문한 케이크는 화려한 디테일의 미니사이즈이고, 26000원에 구입했습니다. 위켄드케이크 망원동에 위치한 귀엽고 맛있는 케이크- 가게 입니다 pf.kakao.com 주문은 카카오톡 '위켄드케이크' 채널에서 상담 후에 하면 되고, Instagram의 위켄드 케이크 wee kend it🙃(@weekend__cake)님 프로필 • 게시물 577개 팔로워 6,698명, 팔로잉 65명, 게시물 577개 - 위켄드 케이크 wee kend it🙃(@weekend__cake)님의 Instagram 사진 및 동영상 보기 instagram.com 케이크 디자인은 인스타그램에서 볼 수 있어요. 위켄드케이크 인스타그램 타 제작 케이크와 다르게 위켄드 케이크만의 개성을 꼽는다면 위 두 가지 디자인이에요! 좌) 케이크 위 뚱뚱이 동물 + 미니 크림케이크 우) 입체 곰돌이 디자인 (다른 동물로 변경 시 추가요금) 가격 정보 자세한 가격은 카카오톡 채널 ' 소식' 란에서 볼 수 있지만 간단히 정리해볼게요! 미니사이즈(지름 10cm) 1호 / 미듐 사이즈(지름 15cm) 2호 / 라지 사이즈(지름 18cm) 당일케이크 16000 35000 55000 주문케이크 25000 45000 65000 입체 곰돌이 (다른 동물 +5000) 25000 45000 65000 포토케이크 25000 45000 65000 당일 케이크는 디자인을 선택할 수 없고, 주문 케이크 외에 당일에 생산되는 케이크를 구매하실 수 있습니다. 예약도 가능하지만 생산된 케이크 중에서 랜덤으로 배정해주신다고 해요! 주문 케이크는 기본적으로 당일케이크 금액 + 기본디자인 기준 추가금액 5000이에요. 크게 4가지 종류가 있는데 아래와 같고, 기본 비용은 동일합니다. 1. 빈티지 레이스 케이크 : 위아래 + 옆면 데코 2. 케이크 위 뚱뚱이 동물 + 미니 케이크 디자인 (미니사이즈 최대 2마리, 미듐이상 최대 4마리) 3. 입체 곰돌이 케이크 4. 포토케이크 미니사이즈는 지름이 도시락케이크와 비슷하지만 높이가 두 배 가량 높아요. 포장도 펄프 케이스가 아니라 종이 상자에 예쁘게 담아줍니다. 저는 오후 4시쯤 픽업하러 갔더니 당일 구매 가능한 케이크가 이만큼 남아있었어요. 맛 종류 주문제작 케이크의 작은 사이즈를 구매하면 맛 선택지가 별로 없는 경우가 많았는데 (바닐라시트+딸기쨈 고정인 경우,,,) 위켄드케이크는 시트와 크림을 케이크 사이즈와 관계없이 다양하게 조합해서 주문할 수 있어요. 겉크림 : 버터+크림치즈 (고정) 시트 종류: 바닐라/ 초코 시트크림 : 시크릿바닐라크림/ 발로나 초코크림/ 라즈베리퓨레/ 복숭아 퓨레 ※베스트 조합 : 바닐라 제누와즈 +바닐라 크림 / 초코 제누와즈 +바닐라크림 덕분에 저는 가장 작은 미니사이즈를 구매했지만 저희 취향대로 초코 제누와즈 + 바닐라크림으로 주문했습니다. 초코크림이 발로나라고 해서 바닐라 시트+초코 크림이랑 엄청 고민했어요ㅜㅜ 케이크 수령 친구가 처음부터 뚱뚱이동물+미니케이크 디자인을 하고 싶어했고 저는 빈티지 케이크를 하고 싶었어서 두 조합을 합쳐서 요청드렸어요. 별거 아닌 디테일 추가해도 추가요금 왕창 받는 케이크집도 있어서 스트레스였는데 위켄드 케이크는 이 조합에도 체리만 추가요금 1000원 더 붙었네요! 친구도 저도 선택을 어려워하는 터라 ㅋㅋㅋ 직접 일러스트레이터로 원하는 디테일+색 조합해서 재능낭비 후 결정 요렇게 5가지 시안이 있었는데 아랫줄 중간 디자인으로 요청드렸어요. 색깔이나 디테일에 대해 더 자세히 설명드릴수록 원하던 디자인과 가까워집니다! 물론 저만큼 재능낭비하지 않으셔도 사장님은 찰떡같이 알아들으시겠지만요 케이크 수령일에 방문한 위켄드 케이크의 외관이에요. 깔끔하고 아기자기하게 꾸며진 외관! 내부에는 당일 케이크가 쇼케이스에 진열되어있고, 각종 초, 머리띠, 선글라스 등 파티 용품도 판매하고 있어요. 저는 하트 초 하나만 다른데에 쓰려고 추가구매했는데 1000원이었어요. 초 하나에 보통 1000-1500원정도더라구요. 출입문 바로 우측에 위치한 커다란 냉장고에는 주문제작 케이크 진열중! 위켄드케이크 진짜 인기 많은거 같더라구요. 주말 늦은 오후 방문이었는데도 아직 가득가득한 다른 분들의 케이크들. 저희의 케이크도 수령해서 사진을 찍어줍니다. 기본초 하나는 포함된 가격이었어요. 근데 케이크 위의 미니케이크 속 초도 진짜 초여서 기본초는 사용하지 않았답니다! 도시락 케이크처럼 펄프 케이스 아니고 투명창 있는 종이상자에 넣어주셨어요. 그리고 숙소에 도착하자마자 열어 본 케이크 ♥ 정말 제가 그린 이미지랑 똑같이 만들어주셨어요 미니케이크의 초에다가 불을 붙여도 과연 괜찮은건가 걱정했는데 초가 녹아내리기 전에 호다닥 사진찍고 노래부르고 소원빌고 안전하게 후~ 완료 위켄드케이크 미니사이즈 높이 참고하세요! 먹기 진짜진짜 아까웠지만 맛있더라구요 디저트류 맛잘알인 제 친구가 인정한 맛이었어요. 초코시트-바닐라크림 - 초코시트 - 바닐라크림이 여러 겹 레이어링 되어있고 많이 달지 않은 맛이었어요! 케이크를 소품으로 사진도 백만장 찍고 깨끗하게 다 먹었어요. 완전히 만족했던 주문제작 케이크 리뷰를 마칩니다!"
"망원동 레터링케이크, 위켄드케이크 후기 (당일 구매 가능)","망원동 레터링케이크 위켄드케이크 #망원동케이크 #망리단길케이크 🏷 글/사진 - 혜트리 ⓒ 2022. 혜트리 hyetree All rights reserved. 망원동 레터링케이크 구매후기 ✔ 인스타그램으로 휴무일 확인 필요 ✔ 당일 케이크 구매 가능 (레터링 올려주심) ✔ 위치 : 망원로 2길 69 3층 안녕하세요, 망원주민 여행하는 혜트리입니다. 친구 생일 축하해주려고 케이크샵 알아보다가 망원동에 꽤나 유명한 곳이 있어서 처음 주문해보고 만족스러워서 포스팅하는 내돈내산 후기입니다 💛 망리단길 너머 망원 한강지구 가까운 곳에 위치한 망원동 레터링케이크샵 '위켄드케이크' 소개할게요! 출처 : 위켄드케이크 인스타그램 @weekend__cake 위켄드케이크 인스타 피드를 구경해보니 세상에나 마상에나 송민호님 윤두준님도 먹어본 케이크 🍰 위켄드케이크의 위상을 실감하며 케이크 디자인을 고르고 친구에게 생색낼 생각에 (야 여기 연옌들도 먹는 곳이야😙) 주문 전부터 기뻤던 혜트리입니다요 🫶🏻 원래 망리단길 어디쯤에서 망원동 레터링케이크 전문으로 한다는 위켄드케이크 간판을 봤던 기억이 있는데 아마도 장소 이전을 한거 같아요! 건물 3층으로 올라가면 귀여운 소품들과 깨끗해보이는 오픈 키친이 한 눈에 보여요 :) 제가 픽업하러 방문했을 때 작업자 두 분이 또 다른 케이크들을 작업하고 계셨는데 정말 신기했어요 😃 예술의 경지에 도달한 케이크를 직관한 나...! 조각케이크 /5,500원 스몰 케이크 /18,000 미디움 케이크 /35,000원 라지 케이크 /45,000원 *커스텀케이크에 따라 추가금 있음 망원동 레터링케이크 위켄드케이크 가격 망원동 레터링케이크 추천 때때로 급하게 케이크 준비해야 하는데 흔한 케이크 말고 특별한거 원할 때 있잖아요! 망원동 레터링케이크 '위켄드케이크'에서는 당일에 방문하면 남아있는 케이크 디자인에서 간단한 레터링만 바로 올려준다고 하더라고요 🤩 미리미리 준비해서 커스텀케이크를 만드는게 베스트이지만 간혹 필요할때는 위켄드케이크 이용하면 가성비 좋을듯 - ✔ 당일 구입 시, 스몰사이즈 케이크 /18,000원 다만, 디자인은 매장에 있는 것들 중 선택해야 해요! 귀여운 초들도 여러가지 판매하고 있고 생일 축하 썬글라스나 꼬깔모자도 있었어요. 저는 케이크디자인에 엄청 신경을 썼기 때문에 기본초로 충분해서 추가 구입은 하지 않았답니다 🥰 게다가 기본 초도 예쁜걸로 제공해주셨어요! 그녀에게 가는 길.... 💓 꽃을 같이 사가자는 친구의 꿀 아이디어로 생일자 울릴 준비 완 ! 대성통곡 했으면 ! 😏 ㅋㅋㅋㅋㅋㅋㅋㅋㅋㅋㅋ 케이크는 안전상의 문제로 따로 고정핀이 없으니 수평맞춰서 조심히 들고 가라고 하셔서 살금살금...! 약속장소 가는데 시간이 1시간 걸린다고 하니 보냉팩도 하나 넣어주셔서 더 맛있게 먹을 수 있었어요 너~~~무 이쁘죠 ヾ(•ω•`)o 내가 골랐지만 정말 완벽한 케이크였다 ! 친구가 좋아하는 취향만 골라골라 담아 💛 "" HJ HBD "" 생축 돕이 뿌뿌 - 생일자가 매우만족 하시어 갱장히 뿌듯했던 날 :) 친구가 말하길 취향저격해서 거의 뚜드려 패는 수준이라고 ㅋㅋㅋㅋㅋㅋㅋㅋㅋ 이렇게 커스텀케이크가 좋은겁니다! 눈치 없는 내 아이폰 11 프로... 프로답지 못하게 분위기 조흔 바에서 후레시 터뜨려버린.... 촤하 ^_^~ 을지로 와인바, bar420 을지로 와인바에서 직원분께 허락받고서 쪼꼬미 기요미 케이크 조심히 초불고 커팅도 하고 또 착한 내친구는 직원분께 케이크 나눔도 하고 나는 큰거 나 달라고 욕심부리고 ヽ(✿ﾟ▽ﾟ)ノ 왜냐면 케이크가 진짜 맛있었어요 !!!!! - 초코시트에 라즈베리시럽 - 바닐라시트에 바닐라시럽 두 가지 조합을 추천하셨는데 친구 취향 맞춰서 바닐라로 했더니 초코도 당장 먹어보고 싶은 jmt였다고 함! 우리도 케이크 한입만..💗 우리도 케이크 한입만.. 달라고 했는데 케이크 4등분해서 나눠준 천사같은 내친구 🤠 케이크 레터링 문구 고민되신다면 요 문구 추천드려요 ㅋㅋㅋㅋㅋㅋㅋㅋ 저는 진심을 담은 문구였지만요 😂💙 이상 망원동 레터링케이크 전문점 위켄드케이크에서 생일케이크 구매한 내돈내산 후기였습니다 :) 위켄드 케이크 wee kend it🙃(@weekend__Cake) • Instagram 사진 및 동영상 팔로워 8,364명, 팔로잉 25명, 게시물 649개 - 위켄드 케이크 wee kend it🙃(@weekend__Cake)님의 Instagram 사진 및 동영상 보기 instargram.com #망원동레터링케이크 #합정레터링케이크 #마포레터링케이크 #홍대레터링케이크 #레터링케이크문구 #레터링케이크문구추천 📸 Instargram @hyetree_ 🎬 Youtube [혜트리 hyetree] 유튜브 검색창에 '혜트리' 🔎"
