title,content
망원동카페 온리디스베이커리 휘낭시에 구움과자 소금빵 피낭시에 당일생산판매,"망원동카페 온리디스베이커리 휘낭시에 구움과자 소금빵 피낭시에 당일생산판매 망원동카페 온리디스베이커리 휘낭시에 구움과자 소금빵 피낭시에 안녕하세요, 깐꼼입니다. 얼마만에 맛집포스팅인지.설레이는군요~ 지난 토요일, 8시간의 강의를 마치고 한국체육대학교가 있는 강동쪽에서 한시간정도 지하철을 타고 한걸음에 달려온 곳, 바로 망원시장근처에 있는 신상 디저트카페, 망원동카페 온리디스베이커리에요. 제가 애정하는 톡톡홍쌤의 따님이 사장님으로 온가족이 동원해서 오픈한 곳이죠. 처음 고민할때부터 스토리를 모두 알기에 몸도 힘들고 목도 아프고 배도 고팠지만 ㅎㅎㅎ 주저하지않고 갔죠. 카페인수혈과 달달한 휘낭시에가 필요했기에~! 망원역에 내려 일부러 시장구경하면서 갔는데 시장엔 사고싶은게 왜 이렇게 많은거죠 ?^^ 온리디스베이커리 메뉴 ( 임시 ) 망원동카페 온리디스베이커리 오픈 8/12 도착했더니 오픈날이라 그런지 손님이 북적북적, 바쁜게 좋아보였습니다 ~ 이미 다녀가신 분들이 많아서 쇼케이스안에 휘낭시에가 얼마 안남았더라고요. 일단 포장부터 챙기고 먹을거리 주문했어요. 새로 들어온 장비들이라 그런지 전문가필 팍팍 나면서 웬지 커피가 더 깨끗하게 맛있는 느낌이에요. 메뉴는 아래와 같아요, 휘낭시에 6종+마들렌 2종 +구움쿠키 3종+치즈케이크+소금빵 커피/에이드 피낭시에 초당옥수수 / 발로나초코 /솔티캬라멜 대파치즈 / 쏘시지 / 당근크림치즈 마들렌 레몬 / 당근크림치즈 쿠키 클래식초코 / 꾸덕황치즈 / 얼먹티라미슈 바스크치즈케이크 소금빵 생각보다 베이커리 메뉴가 많아서 놀랬어요. 먹을때야 두세입이면 뚝딱 먹는 디저트지만 만들때에는 보통 손이 가는 것들이 아니잖아요. 혼자 저 많은 종류를 다 만들어내다니 야무진 손놀림에 여간 부지런한게 아니면 힘들죠. 너무 대견한 젊은 사장님~! 게다가 그거 아세요 ? 당일생산 당일판매 저녁에 남는건 모두 처분. 젊은 사장님의 맛에 대한 진심이 대단하더라고요. 방부제가 안들어서이기도 하겠지만 그래도 하루 이틀은 더 팔만도 한데, 그쵸 ? 우리집에 데려온 휘낭시에, 포장도 이렇게 깔끔해요 포장케이스에 5개 들어가는데요, 그 시간에 남은 것 5 개로 구성해서 채웠어요. 대파휘낭시에를 2개 담았는데 와우. 탁월한 선택 ~! 빵 잘 안먹는 우리집 남자1호도 이게 머야 ? 맛있네 ? 소리를 하더라고요. 파송송 보이시나요 ? 저게 대파치즈휘낭시에. 간단 선물하기에도 좋겠더라고요. 다양한 맛에 패키지도 적당한 사이즈. 답례품하면 좋겠다~ 막 이런 생각이. ( 스마트스토어 사장이라 이런거 보면 그런게 떠올라요 ㅎㅎ ) 또 먹고싶은 대파휘낭시에 주문한게 나왔어요. 고급스러원 원목 트레이에 이쁘게 셋팅되어 담겨져 왔습니다. 비쥬얼 너무나 좋죠 ? 커피 양도 넉넉한것이 맘에 들어요. 맛은 뭐.. 말모말모. 바스크치즈케이크와 아메리카노, 함께 간 꿈달코치님은 라떼를 드셨어요 디저트 땡기는 시간인 이유도 있지만 눈으로도 맛있고 입으로는 더 맛있는 맛. 피낭시에도 여유분이 있었으면 종류별로 다 먹었을 듯요 ㅋㅋㅋ 전 피낭시에는 직접 만들고 케익은 외주로 사오는건가했는데 웬일 ~!! 다 직접 새벽부터 만들었다고 하셨어요. 케익이 꾸덕꾸덕, 달지 않아서 더 맛있어요. 모래성놀이를 하듯이 함께 간 꿈달코치님과 너한입, 나한입하며 잘라먹었죠 ^^ 아이스아메리카노 / 아이스라떼 바스크치즈케이크 음식이 담겨져 온 원목트레이도 모두 제작한 것이라고해요. 흔하지 않은 트레이가 함께 나온 음료와 케익을 더 돋보이게 해줍니다. 망원동 디저트카페 온리디스베이커리 - 바스크치즈케이크 Only This Bakery 매장 곳곳에서 볼 수 있는 카페이름이 들어가있는 소품들이 눈에 들어옵니다. 준비하면서 이런 디테일까지 다 꼼꼼히 챙기는게 이뻐 보였어요. 개인취향이겠지만 전 카페에 가면 이런게 그렇게 눈에 들어오더라고요. 내부 공간이 아주 넓지는 않아요. 동시입장해서 앉을 수 있는 인원은 7 명. 먼저 차지한다면 더 없이 좋은 시간을 보낼 수 있다는 말이기도 하겠죠 ? ^^ 보통 요 정도의 공간은 화장실가려면 바깥으로 나가야하는 경우가 많은데 온리디스베이커리는 내부에 화장실이 있답니다. 너무 좋죠 ~ 두명이 앉으면 이야기가 술술 나오는 자리, 제가 요 자리에 앉았었어요. 요즘 강의가 잡히며 생기는 고민들, 궁금거리들을 꿈달코치님이 많이 들어주시고 좋은 말도 많이 해주었어요. 감사해요, 꿈달코치님. 당일생산판매인데 매일 매일 이렇게 재고없이 다 팔리면 좋겠어요. 근처 지나가시는 분들, 서두르세요 ~ 구움과자 소금빵 피낭시에 당일생산판매 귀여운 소품들이에요 카페에서 음향 안좋으면 거슬리는데 마샬 스피커, 굿~! 역시 젊은 사장님의 갬성은 남다르군요. 카페에 좋은 음악은 포기 못하쥬~ 망원동카페 온리디스베이커리는 화이트 + 초록초록 + 원목 이 세가지로 꾸며져있어요. 그래서 더 편안한 느낌이 드는 듯 합니다. 앗, 사장님 도촬 .. ㅎㅎㅎㅎ 집에서 거리가 좀 가깝다면 오며가며 자주 가고 싶은 곳이더라고요. 조만간 망원동의 핫플 카페로 뜨지 않을까 조심스레 예상을.. ^^ 아래 사진은 오늘 온리디스베이커리의 인스타에서 본 사진인데요. 오픈날은 소금빵을 못만들었다고해요. 그런데 지금은 이렇게 잘 나오고 있군요. 빵 나오는 시간에 가고파~~ 겉바속촉으로 아주 맛있어 보입니다. 주방에서 오븐 3대가 부지런히 돌아가며 맛있게 구워내는 것들, 정성이 들어가서 더 맛있나바요 ~ 구움과자 소금빵 피낭시에 당일생산판매 날씨 좋은 가을에는 위에 보이는 계단에도 자리를 마련하신다고 해요. 굿~! 온디베 / 온리디스베이커리 저녁도 함께 먹고 이야기도 하면서 밤에 다시 집으로 출발했어요. 누군가 새출발을 하는 첫날에 축하해 줄 수 있어서 기뻤던 날입니다. 좋아하는 분들도 만나고요. 앞으로를 더 응원드립니다 ~ 망원동카페 온리디스베이커리 휘낭시에 구움과자 소금빵 온리디스베이커리 서울특별시 마포구 희우정로20길 70 102호 온리디스(@onlythis_bakery) • Instagram 사진 및 동영상 팔로워 60명, 팔로잉 2명, 게시물 5개 - 온리디스(@onlythis_bakery)님의 Instagram 사진 및 동영상 보기 instagram.com"
망원동 베이커리 카페 온리디스베이커리 : 소금빵 휘낭시에 다 맛있어요!,"안녕하세요 해피스완입니다. 망원동 베이커리 카페가 생겼다고해서 주말에 댕겨왔어요. 망원동 카페 이름은 바로 '온리디스베이커리' 온리디스베이커리 서울특별시 마포구 희우정로20길 70 102호 망원시장과 가까이 있는 베이커리 카페이고, 온리디스베이커리 사장님이 매일 새벽 직접 베이커리를 굽는다고합니다. 보통 사서 판매하는 곳도 많을텐데 사장님의 열정이 대단하다고 느꼈어요. 망원동 베이커리 카페, 온리디스베이커의 외관입니다. 망원시장과 100걸음도 떨어져있지 않아요. 밤이 되니 더 이쁜 외관 제가 먹고 반한 오미자에이드에요. 요거도 직접 만드신거래요. 커리가 지루하신 분들은 오미자에이드도 추천 드려요. 무엇보다 이뻐서 더 맘에 듬 ㅋㅋ 망원동 카페 온리디스베이커리의 내부 인테리어에요. 우드톤의 멋진 인테리어! 온리디스베이커리에서 비가 오는 날 앉아서 창밖을 보면 참 좋겠다는 생각을 해봤어요. 망원동 카페 온리디스베이커리의 장점 하나는 매장안에 화장실이 있다는거. 게다가 반짝반짝 요래 이솝으로 세팅해두셨어요. 호텔 화장실 저리가라 이거 하나만 봐도 주방이나 베이커리를 만드는 환경이 얼마나 깨끗할지 짐작이 가더군요. 온리디스베이커리의 쇼케이스에요. 소금빵은 따뜻할 때 먹어야 맛있다는데 요건 식어도 맛있던 소금빵 단짝 매력이 지대로인 솔티카라멜 은근 매력적이었던 대파치즈!! 갠적으로 대파 들어간 베이커리는 처음 먹어봤는데 은은한 풍미가 느껴지면서 저의 원픽 중 하나였어요. 망원동 카페 온리디스베이커리의 라인업은 매일 조금씩 바뀐다고해요. 그런데 공통점은 다 맛있다는거. 최대한 좋은 재료 (특히 버터)를 사용하고 당일 오전에 만들어서 소진하는 방식이라서 신선해요. 그래서 저녁에 가면 빵이 없기도 하대요. 여튼 망원시장 인근을 오가는 빵순이들이 분들이 온리디스베이커리를 꼭 알기를 바랄 뿐입니다. 넘 맛있어서 아들 생각도 나고해서 몇개 포장해서 왔는데요. 세상에 요렇게 친절하게 코멘트를 적어주시다니요... 사장님의 꼼꼼함에 한번더 감동했어요. 덕분에 맛있게 소진할 수 있었습니다. 이상 망원동 베이커리 카페 온리디스베이커리의 리뷰를 마칩니다. 저는 조만간 또 갈 예정이에요. 곧 개시할 청귤에이드도 궁금하고 특히 소금빵을 비롯한 다른 베이커리가 너므 생각나서요. ㅋㅋ 그럼 이만!"
[서울 마포구] 소금빵과 휘낭시에가 맛있는 망원동 카페: 카페 온리 디스 베이커리,"안녕하세요. 미니혜움입니다. 2023년 11월 10일에 다녀온 늦은 기록입니다. 톡톡 홍쌤의 작은 아이가 카페를 오픈했다는 소식에 궁금해 방문한 카페, 온리 디스 베이커리. 온리 디스 베이커리 카페가 오늘 소개할 카페입니다! 온리디스베이커리 서울특별시 마포구 희우정로20길 70 102호 <영업시간> 화 - 일요일: 오전 11시 - 오후 8시 정기 휴무일: 매주 월요일 듬직한 진블리 이경님과 일정 맞추어 함께 다녀왔습니다. 조용한 골목 안에 있는 온리 디스 베이커리 카페. 망원시장에서 걸어온 모습입니다. 그리 멀지 않은 곳에 위치하고 있어요. 듬직한 짐블리 이경님과 도란도란 이야기 나누다 보니 어느새 도착해 있었던 온리 디스 베이커리 카페. 제가 방문한 날의 망원동 온리 디스 베이커리 카페의 빵 메뉴입니다. 카페 온리 디스 베이커리는 매일 나오는 빵들을 인스타그램을 통해 공지하고 있다고 하니 확인하고 방문해 보시는 것도 좋을 것 같아요! 아래에 카페 온리 디스 베이커리 인스타그램 링크를 첨부해 둘 테니 참고하실 분들은 참고하셔요! 온리디스(@onlythis_bakery) • Instagram 사진 및 동영상 팔로워 144명, 팔로잉 12명, 게시물 68개 - 온리디스(@onlythis_bakery)님의 Instagram 사진 및 동영상 보기 instagram.com 디스 온리 베이커리 카페의 음료수 메뉴가 궁금하신 분들은 아래의 사진을 참고해 주세요! 따뜻한 분위기의 카페 온리 디스 베이커리. 제가 간 날은 소금빵과 오리지널 대파 치즈, 발로나 초코, 에스프레소, 솔티 카라멜, 레몬 글레ㅣ즈, 무화 크림치즈 휘낭시에 7종이 있었습니다. 온리 디스 베이커리 카페의 빵들은 매일 새벽 사장님이 직접 만든 빵들로 당일 생산과 당일 판매가 원칙이라고 해요. 그래서였을까요? 촉촉한 소금빵과 휘낭시에를 만나볼 수 있었습니다. 주문한 커피와 빵이 나오기 전까지 살포시 디스 온리 베이커리 카페를 둘러보았어요. 아기자기 귀여운 소품들이 있었었던 디스 온리 베이커리 카페. 저 문 뒤로 화장실이 있습니다. 사장님의 마음인 담긴 핸드로션도 있네요. 커피가 맛있어 두 잔씩 마셨다는 사실은 안 비밀입니다. 커피 향이 어찌나 향기롭던지. 사장님께 어떤 원두를 쓰시는지 물어볼 것을 그랬나 봐요. 톡톡홍쌤이 직접 담근 오미자청으로 만든 오미자차. 새콤달콤하니 따뜻했습니다. 사진을 보니 다시 먹고 싶어지네요. 지금의 나를 있게 해 준 것들 : 라이크북 [라이크북] [대량주문 문의 가능] ［군부대발송불가］책도많고 배송도빠른 라이크북입니다^^ smartstore.naver.com 이번에 톡톡 홍샘이 책을 출간하셨어요!! 다시 한번 더 축하드려요 톡톡 홍샘. 챙겨간 톡톡 홍샘 책에 얼른 사인을 받았습니다. 톡톡홍쌤이 공저 책에 사인하는 모습이라지요. 꾹꾹 눌러쓴 편지글과 사인 감사히 잘 받아왔습니다. 사장님이 찍어주신 우리와 우리가 찍은 우리. 제가 간 날이 빼빼로데이 전날이라 주문이 많더라고요. 빵이 너무 맛있어 집에 올 때 소금빵과 휘낭시에를 사려고 했는데 모두 판매되어 소금 빵만 사 왔답니다. 다음 기회에 다시 방문해 봐야겠어요! 집에 온 온리 디스 소금빵과 휘낭시에 휘낭시에를 구매하지 못해 아쉬웠는데 헤어지기 전에 이경님이 맛보라고 나누어주셨어요. 이경님께도 다시 한번 감사의 인사를 드리며 오늘의 일기를 여기서 마치겠습니다. 오늘도 저의 글을 읽어주셔서 감사합니다."
망원동 디저트 카페 온리디스 베이커리 신선한재료로 당일생산 당일판매하는 베이커리맛집,뜨거운 여름이 언제 지나갈까... 했던거 같은데 간간히 불어오는 바람이 선선한 기운이 드는느낌이 아마도 가을이 다가오고 있나봅니다. 오늘은 마포구 망원동 에 있는 작고 예쁜 빵이 맛있는 카페 포스팅할까 합니다^^ 사실 다녀온건 지난주인데 뭐가 그리 바쁜지 이제야 올려봅니다. 그래도 그느낌은 아직도 따끈따끈 남아 있어요 위치로 보자면 연예인들이 자주 출몰하고 ㅎ 인간미 넘치는 그 망원시장 근처에 있는데요 망원역 2번 출구로 나와서 설렁설렁 걸어가면서 망리단길 구경도 하고 맛난거 천지인 망원시장 구경하면서 가다보면 어렵지 않게 찾을수 있어요 온리디스 베이커리는요~ 매일 새벽부터 좋은 재료들로 정성껏 구워 당일만든 베이커리는 당일 판매를 기본으로 늘 신선한 빵을 맛볼수 있답니다. 입구에 보이는 간판에도 보이듯이 빵에 부심이 보이시죠?^^ 요렇게 매일 손글씨로 그날그날 판매할 메뉴들을 한눈에 볼수 있게 정겨운 손글씨로 입구 간판에 적어 놓는답니다^^ 저는 다른일정으로 커피를 마시고 가던차라 메뉴 추천을 부탁드렸더니 수제 오미자차를 권해주셨어요^^ 세상에! 보이시죠 빨간 차위에 올라앉은 데코들..🤞 신선한 허브잎과 블루베리 그리고 하나하나 틀을떠 만든 앙증맞은 배..😍 거기에 오픈 기념으로 서비스로 주시는 피낭시에~ 차한잔 시켰을 뿐인데 아주아주 귀한 손님 대접받는 느낌이었어요. 맛은 말해 뭐하게요~~ 매일매일 당일 빵은 만들어 판다는 자부심처럼 진짜 맛있었는데요 차한잔 하면서 간단하게 먹을수 있는 작고 소중한 그리고 맛있는 디저트 빵 빛깔또한 얼마나 먹음직 스러워보이던지^^ 매일매일 욕심 내지않고 꾸준히 가게 현황에 맞게 만들어내는 그 용기도 대단하고 특히 좋은재료를 사용해 만들었다는데에 앞으로가 많이많이 기대되는 순간입니다. 카페내부 잠깐 구경해 볼까요^^ 쥔장은 주문 제품 만들고 계시고 입구쪽에는 커다란 거울과 앞길이 쭉쭉 펼쳐질듯이 시원스런 화분 작고귀여운 빈티지느낌의 의자 앗! 그사이 또 주문받는중이시고 ㅎㅎ 제가 앉아있는곳은 구석자리 벽면이었는데 왼쪽너머에 보이는 공간이 엣지있어 보이더라구요 요렇게 빈티지느낌 물씬나게 꾸며져 있었어요^^ 군더더기없이 갈끔하게 만들어진 화장실입구 공간 사실 어느공간을 가던 화장실이 내부에 있는게 편하고 좋잖아요^^ 대형카페도 돌고돌아 화장실 다녀오는게 불편한데 이곳은 내부에 화장실이 있다는게 더욱 좋아요.👍 그리고 쥔장의 세심한 배려에 더욱 감동받은곳은 바로 화장실내부 세면대 위에요^^ 저는 사계절 내내 핸드크림을 달고 사는데 어쩜! 보이시나요? 핸 드 크 림 ! 마음씀씀이가 최곱니다 그리고 포장한 치즈케잌 신선함이 보이시죠? 맛도 최고일것입니다! 사실 집에 도착에 냉장고 넣어두었는데 아침에 보니 빈 상자만 덩그러니 식탁에 있더구만요 ㅎㅎ 새출발하는 카페 쥔장에게 보내는 저의 마음 날마다 행복하기를 💕 다음엔 부드러운 라테한잔하러 가볼까요~ 온리디스베이커리 서울특별시 마포구 희우정로20길 70 102호 #망원동온리디스베이커리 #망원역베이커리카페 #매일신선한수제베이커리카페 #당일생산판매하는베이커리카페 #망원시장근처피낭시에맛집
망원동카페 온리디스 베이커리 휘낭시에 소금빵 당일생산판매,안녕하세요 세상에서 가장쉬운 영상편집을 알려드리는 허지영 강사입니다. 오늘은 제가 가장 좋아하는 카페를 소개해드리려 합니다. 망원시장 근처에 있는 신상 디저트 카페 망원동 온리디스베이커리 입니다. 망원동 온리디스 베이커리 망원동 온리디스 베이커리 당일 구운빵만 판매합니다. 저는 선물할 곳이 있어서 휘낭시에와 마들렌7상자를 미리 포장 주문 했습니다. 온리디스베이커리 메뉴 휘낭시에 6종+마들렌 2종 +구움쿠키 3종 +치즈케이크+소금빵 피낭시에 초당 옥수수/발로나 초코/솔티캬라멜 대파치즈/쏘시지/당근크림 치즈 마들렌 레몬/당근크림치즈 쿠키 클래식초코/꾸덕황치즈 바스크치즈케이크 소금빵이이렇게 되어있습니다. 20대 젊은 사장님 20대 젊은 사장님이신데요. 당일생산 당일판매 저녁에 남는건 모두처분합니다. 젊은 사장님께서 맛에 대해 진심이시고 열정이 대단하세요. 재료하나하나 손질하시고 새벽에 나오셔서 빵을 구우신다고 하시더라구요. 그래서인지 정말 너무너무 맛있어요. 강추합니다. 제가 좋아하는 달달한 커피와 오미자 에이드 고급스러운 그자체입니다! 시댁에 어머님친구분들 나눠드리려고 주문했어요! 우리 아림이도 주려구요! 강의끝나고 온리디스 베이커리 들려서 어머님댁으로 다녀왔어요. 어머님댁이 공덕동이라 가까워서 망원동에 들려서 지하철로4정거장!! 어머님이 엄청 좋아하셨어요!! 방금구운 소금빵인데요. 정말..이거이거 요물이에요.. 방금구워서 주셨는데 입안에서 사르르 녹는 맛이에요. 치즈가 들어가서 고소하기도했구요 제가 소금빵을 집에서 포장해왔었는데요. 전자레인지에 살짝 돌려서 먹어도 정말 맛있어요!! 저는 집에서 소금빵을 이렇게 해먹을때도 있어요! 소금빵에 베이컨이랑 치즈 양상추 피망 오이 계란까지 넣어서 먹으면 진짜!!! 환상의 짝궁! 매장곳곳이 작은 소품까지 사장님의 손길이 들어가 있습니다. 추석때는 이렇게 정성스러운 포장도해주세요 저는 이번에 관악평생교육원에서 강의가 끝나고 감사한 마음으로 수강생선생님들께 이렇게 선물해드렸어요. 다들 너무 좋아하셨습니다. 집에서 조금 가까우면 매일 가고싶은 온리디스베이커리입니다. 갓구운 빵을 커피와 드시고 싶으시다면 망원동 온리디스베이커리를 추천드립니다. 온리디스베이커리 서울특별시 마포구 희우정로20길 70 102호
