title,content
망원동카페 리벌티 망원 망리단길 분위기 좋은 카페,"망리단길 분위기 좋은 카페 찾으신다면 여기에요. 망원시장 감성 카페 리벌티 망원! 시크하지만 멋있는 블랙 인테리어에 망원동카페만의 시그니처 메뉴 커피와 디저트가 특별한 리벌티 망원입니다. 망원동카페 리벌티 망원 망리단길 분위기 좋은 카페 리벌티 망원 서울특별시 마포구 포은로 108 1층 주 소 : 서울 마포구 망원동 414-18 1층 전화 : 0507-1361-3877 영업시간 : 평일 11:00 ~ 22:00 망원시장쪽에서 보면 망리단길 초입에 위치해있는 망리단길 분위기 좋은 카페 리벌티 망원! 외관부터가 멋찜 뿜뿜이었는데.. 안으로 들어가면 블랙의 인테리어..블랙테이블에 투명의자 철제 프레임덕분에 어둠거나 칙칙한 느낌보다는 뭔가 분위기 있고.. 의자 넘 탐나네요. 테이블 손님도 계시고 테이크아웃 하는 손님도 계시고 애견동반 손님도 계시고..이미 망원 커피 맛집.. 계속 손님이 계셔서 없는 틈에 사진 찍기. 제주느낌나는 돌맹이 소품이 망원동카페 리벌티 망원을 더 망리단길 분위기 좋은 카페로 만들어 주는 느낌이더라고요. 망원동 커피 맛집 답게 리벌티 망원 만의 원두! 구입이 가능해요. Black Sugar Rose Seasonal Berry 원두 선택이 가능하고 디카페인도 있답니다. 망원동 디저트 맛집 리벌티 망원! 스모어 쿠키 3종 르뱅쿠키 3종 수제쿠키도 맛볼 수 있어요. 리벌티 망원 메뉴. 커피, 라떼 시그니처, 에이드, 차, 쿠키, 디저트.. 요즘 아인슈페너 자주 마시는데 시그니처에 핑크솔트 아인슈페너가 눈에 쏙 들어오더라고요. 핑크솔트 아인슈페너 7,500원 오레오 크림치즈 브리오슈 7,000원 브리오슈는 오레오/로투스/딸기/블루베리 중 고민하다 블랙엔 블랙으로 가자 싶어서 오레오 크림치즈 브리오슈로 선택! 식빵위에 크림치즈, 오레오와 크럼블.. 비쥬얼 장난 아니더라고요. 같이 나온 포크, 나이프도 아주 갬성돋고.. 버터 풍피 가득한 식팡과 진하고 부드러운 크림치즈..크럼블은 고소고소해서 아주 잘 어울리고.. 제입에 아주 맛있었어요. 순삭느낌! 👍 👍 👍 👍 👍 브리오슈는 주문하면 바로 만들어주셔서인지 요 오레오 하나 눅눅함없어서 너무 좋더라고요. 원두를 선택할 수 있어서 커피를 마실까도 고민했는데 리벌티 망원의 시그니처 오늘 안먹음 후회할 듯 하더라고요. 시그니처 중 핑크솔트 아인슈페너! 어디에도 없는 리벌티 망원만의 메뉴. 크림 자체에도 솔트가 믹스돼어 있는것 같기도 한데 자세히보면 크리위에도 솔트가 솔솔~~ 부드럽고 짭짤.. 요거 너무 내스탈이 이네요. 젓지않고 크림과 밑에 커피와 한입에 넣어 먹었는데..입속에서 부드러운 크림과 진한 커피가 너무 좋네요. 망원동카페 망리단길 분위기 좋은 카페 찾는다면 리벌티 망원 추천드려봅니다. 시그니처커피와 브리오슈로 망원커피맛집에서 망리단길데이트도 좋아요. #망원동카페 #망원동디저트 #망원동커피 #망리단길카페 #망리단길디저트 #망리단길커피망원동맛집 #망리단길맛집 #망리단길분위기좋은카페 #망리단길데이트 #망원시장감성카페 #망원커피맛집 #망원데이트코스"
[서울/망원동/망원역 카페] 리벌티 망원 Liberty Mangwon :: 망리단길 분위기 좋은 카페,"리벌티 망원 서울 마포구 포은로 108 1층 매일 11:00 - 23:00 반려동물 동반 리벌티 망원 서울특별시 마포구 포은로 108 1층 안녕하세요 또또욘입니당 망리단길에 왔어요~~ 두번째 옴ㅎ 카페 어디갈까 겁나고민하다가 아무곳이나 들어감 ㅎ 하하 리벌티망원! 들어가시쥬 색이 예쁘넴 ㅎㅎ 내부는 이래요! 모던느낌 느낌이 어둡고 블랙이라 더 마음에 들었다 ㅎ 요즘 어느카페를 가나.. 마샬 스피커는 다 있는듯 ! 개인적으로 카페 중간에 이렇게 되어있는게 예뻤음.. 스모어쿠키다!!!! 말차 먹어볼까하다가 배불러서 PASS 리벌티망원 메뉴&가격 리벌티 아메리카노-로제 (4,800) 디카페인 아인슈페너 (7,800) 주문 리벌티 망원에서 아메리카노 리필 원하면 +2,500 디카페인은 +300 돈 더내면 가능!-! 아메리카노 원두는 총 3가지 블랙슈가/ 로제/ 시즈널베리 또또욘은 시그니처 음료를 시켰다고한당 ㅎㅎ 핑크솔트도 땡겼는디 ㅎ 짜잔~ 위에서도 한컷 ㅎ 커피컵 숟가락? 우리 할머니댁에서 가져온듯한 느낌.. 근데 은근 고급진 느낌이랄까,,ㅋㅋㅋㅋ 아메리카노 - 로제 산미가 살짝있는 아메리카노임!!!! 원두는 본인 선택 가능하니 원하는걸로 드시면 됩니다요 디카페인 아인슈페너 디카페인 있을때만 시키는 아인슈페너 ㅎㅎ 크림이 좋다!!! 달달구리 위에 국화가 있어서 향이 올라오더라 나는 괜찮았음!!! 달콤 씁쓸 고소 느낌의 아인슈페너 ㅎㅎ 낫베드! 카페 야무지게 드링킹하고.. 망원동에서 여의도 한강공원까지 걸어간거 안비밀^^.. ㅋㅋㅋㅋㅋㅋㅋ재밌었다링 이상 또또욘의 리벌티망원 솔직후기 끝 . . . . . #망원역카페 #망리단길카페 #망리단길핫플 #리벌티망원 #libertymangwon #리벌티망원메뉴추천 #리벌티망원아인슈페너 #망원동카페 #망리단길디카페인카페 #망원동디카페인카페 #내돈내산 #내돈내먹 #망원동핫플 #망원카페 #일상 #일상이야기 #일상공유 #일상블로그 #일상생활 #일상소통 #소통 #찐소통 #소통환영 #소통해요 #서이추 #서로이웃추가 #서이추환영 #이웃추가 #이웃추가환영"
망원동카페 망원카페 로투스크림라떼가 있는 리벌티망원,"#망원동카페 #리벌티망원 #망원리벌티망원 #망원카페 #망원역카페 #망리단길카페 #망리단길 #동교초카페 #로투스크림라떼 리벌티망원 리벌티 망원 서울특별시 마포구 포은로 108 1층 원래 가려던 카페가 있었는데 만석이라 다시 다른 카페 가려는데 왔던길을 완전 되돌아가야하는 거임 ㅠㅠㅠ 더운데 넘 지쳐가지고 ㅠㅠㅠ 마침 널널해보이는 카페가 보이길래.. 걍 들어갔던 망원동카페 리벌티망원.. 망원동카페 리벌티망원 외관 사진 ~~ 망원동카페 리벌티망원 메뉴판 ~~ 시그니처메뉴 중 로투스크림라떼 7800원 하나랑 카페인 없는 리벌티블루베리라떼 6500원 하나! 이렇게 총 14300원 주문 ~~ 리벌티망원은 핫, 아이스 가격이 동일해서 보기좋았음 그러나 대체적으로 다른 망원카페보다 조금 가격대 있는 편인 듯... 음료가격대만 조금 낮춰도 만만하게 와볼텐데... 지금보니 다소 아쉽...! 그리고 디저트진열대 ~~~ 먹음직스런 쿠기가 다양하게 진열되어있던! 우리는 이날 소금빵 여러개 조진터라... 리벌티망원에서는 디저트 패스하기로... 리벌티망원 내부분위기 ~~~ 완전 블랙블랙... 무난하게 맛있었던....! 블루베리라떼도 양이 왕많아서 좋았음 이렇게 채광좋을 때 건질 수 있는 갬성사진도 가넝...! 직접 사먹은 후기입니다"
리벌티 망원 /망원동카페 망원시장카페,"망원동 핫하고 인스타캠성 카페 추천!!! 리벌티망원이다 !! 위치는 서울 마포구 포은로 108 1층 영업시간은 매일 11:00-23:00까지 이다 인테리어 너무 ~~ 예쁜데 좀 좁다 .. 아 이집의 맛집은 쿠키이다 !!! 저건 오레오 스모어쿠키이고 오레오맛에 안에 녹은 마시멜로우의 조합이 예술 쿠키를 포장을 하는 분들도 많았으며 , 우리도 방문 이후에 망원 한강공원에서 먹기위해서 루투스,흑임자,더블초코,마카다미아 다 구매를 해서 먹어봤는데 난 역시 오레오 맛이 젤 맛있었다 !!! #리벌티망원"
[망원동 카페] 리벌티 망원,망원시장 근처 카페 추천 리벌티 망원 [네이버 지도] 리벌티 망원 서울 마포구 포은로 108 http://naver.me/5zJTH56K 네이버 지도 리벌티 망원 naver.me 산미있는 커피 좋아하시는 분들 아메리카노 원두는 '로제'로 주문해서 드셔보시길 적당한 산미에 아주 부드러운 부담스럽지 않은 맛 날이 더워서 그런지 더 맛있었던 아이스 아메리카노😎 밧뜨 그러나 사람이 꽉차서 그런지 좀 시끄러운편.. 아니 사람이 많아서라기보다 약간 구조상 옆사람 대화가 다 들리는..? ㅎ 그건 좀 아쉽다 하지만 인테리어도 예쁘고 커피도 맛있어서 나름 좋았다 망원시장 근처에서 급하게 커피 수혈이 필요하신 분들께.. 추천-!
망원동카페 망리단길카페 리벌티 망원,"망원동카페 망리단길카페 리벌티 망원 다녀왔어요 리벌티 망원은 이미 망리단길분위기좋은카페 치면 바로 나올만큼 건물 외관부터 너무 이뻤답니다 저는 망원동카페 망리단길카페 리벌티 망원을 평일 6시에 방문했는데 제가 방문했을땐 저녁식사시간이라 2팀 정도 계셨어요 그치만 저녁식사 끝나면 사람들이 몰려오기 시작한답니다 리벌티망원은 음료도 많고 쿠키, 디저트도 많아요 아무래도 망원시장감성카페 답게 브리오슈나 스모어쿠키같은 눈과입이 함께 즐거울수있는 디저트류가 많더라구요 망원동디저트 망원동커피 리벌티망원은 오레오, 루토스, 말차 등등 스모어 쿠키부터 르뱅쿠키까지 다양하게있어요 알록달록 너무 이쁘고 리벌티망원 분위기자체가 블랙으로 고급진데 인테리어랑 쿠키랑 잘어울리더라구요 리벌티 망원은 매장가운데 이렇게 멋지게 자갈돌위에 불멍을 해놨는데 불멍하고 있으면 메뉴를 갖다준답니다 짜잔- 이날은 이미 커피를 마시고 온날이라 차로 주문했어요 친구는 뱅쇼 저는 크림카라멜로 주문했답니다 그리고 망원동카페 망리단길카페 리벌티 망원오면 브리오슈 꼭 먹어보고 싶어서 루토스 브리오슈도 주문했어요 망리단길커피 망원동맛집 리벌티망원 크림카라멜 컵이 지방시였는데 너무 이쁘더라구요 언제 지방시 컵에 차를 마셔보겠어요ㅋㅋㅋ 저는 루토스 브리오슈와 오레오 스모어쿠키 주문했는데 둘다 너무 맛있었답니다 브리오슈는 식빵위에 크림치즈가 올라간 디저트인데 크림치즈가 너무 맛있어서 호다닥 먹어버렸어요 망리단길커피 망원동카페 리벌티망원은 매장분위기도 고급진데 식기류도 고급져서 이건 정말 인스타각이다!!! 이날 너무 추웠는데 따뜻한 뱅쇼가 진짜 맛있었어요 망원동카페 망리단길카페 리벌티망원오시면 뱅쇼한번 드셔보세요 진짜 맛있어요!!! 빵은부드럽고 크림치즈는 고소해서 너무 잘어울렸던 망리단길카페 망원시장감성카페 리벌티 망원!!!! 망원데이트코스로 정말 딱이랍니다 망리단길분위기좋은카페 리벌티 망원에서 망리단길데이트로 브리오슈랑 뱅쇼 강추 드려요!!! 리벌티 망원 서울특별시 마포구 포은로 108 1층 #망원동카페 #망원동디저트 #망원동커피 #망리단길카페 #망리단길디저트 #망리단길커피 #망원동맛집 #망리단길맛집 #망리단길분위기좋은카페 #망리단길데이트 #망원시장감성카페 #망원커피맛집 #망원데이트코스 #리벌티망원"
망원동카페 :: 리벌티 망원 카페 _ 디저트맛집,망원우동이 먹고 싶어서 망원동에 방문했다. 우동 맛있게 먹고 카페갈만한 곳을 찾다가 눈에 들어온 리벌티 망원 망원동카페 :: 리벌티 망원 카페 _ 디저트맛집 망원동카페추천 입구부터 깔끔해서 지나가다가 오 여기다 싶었다. 완전 인스타 감성의 카페 사진을 진짜 못 찍는 나도 대충 찍어도 인스타 느낌의 사진을 건질 수 있었다. 우리가 주문한 메뉴들 커피도 진짜 이쁘게 나온다. 망원동카페 :: 리벌티 망원 카페 _ 디저트맛집 망원동카페추천 디저트도 비쥬얼 굿 메뉴이름은 기억나지 않지만 맛있어보여서 시킨 디저트 주중에 방문해서 그런지 사람이 북적거리는 분위기는 아니어서 좋았다. 나도 맛있게 찍어보겠다고 카페에서 사진이렇게 열심히 찍어보기는 또 처음 비쥬얼이 예뻐서 계속 카메라를 들게 된다 난 단거를 좋아해서 맛도 좋았다. 망원가면 또 방문하고 싶은 의사 가득! 망원동카페 :: 리벌티 망원 카페 _ 디저트맛집 망원동카페추천 겨울에 다녀온 후기 끗 리벌티 망원 서울특별시 마포구 포은로 108 1층 망원동카페 :: 리벌티 망원 카페 _ 디저트맛집 망원동카페추천
망원동 카페 | 리벌티 망원 Liberty Mangwon,"망원동 걸어다니다가 나온 리벌티망원 망원동 카페 '리벌티망원' 리벌티 망원 서울특별시 마포구 포은로 108 1층 주소 : 서울특별시 마포구 포은로 108 영업시간 : 11:00 ~ 23:00 리벌티 망원(@liberty_mangwon) • Instagram 사진 및 동영상 팔로워 1,851명, 팔로잉 543명, 게시물 93개 - 리벌티 망원(@liberty_mangwon)님의 Instagram 사진 및 동영상 보기 www.instagram.com 메뉴도 다양했고 쿠키도 팔았다. 요즘 쿠키 도장깨기 중이라 쿠키 보일 때마다 하나씩 먹어보는 중이기에 쿠키도 하나 시켜봄 자리도 꽤 있었고 중간에 돌있는데 거기 밟는 분들 많았다. 물론 나도 밟음... 거기에 돌로 인테리어 해놨을 거라는 생각을 못했지... 오트라떼랑 무슨 르뱅쿠키였는데 이름이 생각 안나네.. 신맛 안나는 원두를 좋아하는 나로썬 저 원두가 마음에 들었다. 원두 종류도 다양한 거같았는데 선택 가능한지는 안물어봐서 모르겠네 요즘 쿠키들의 특징은 뭔가 굽다만 것 같은 느낌인데 (그게 르뱅인 건 앎) 나는 그냥 빠짝굽는거 선호함... 르뱅 좋아하면 좋아할만한 쿠키맛"
망원동 리벌티 다녀왔어요♥,"안녕하세요. 민지닝입니당 망원동 망리단길! 늦은 시간까지 영업하는 카페 다녀왔는데 보여드릴게요 내돈내산 ❤️ 리벌티 망원 ❤️ 🎈주소: 서울 마포구 포은로 108 1층 ⏰️ 영업시간 ⏰️ 매일 10:30 ~ 23:00 무려 밤 11시까지 운영하고 있어요! 카페 외관 모습은~ 밤에 찍으려니 어둡게 나오더라고요 실제로 보면! 노란빛 간판 조명도 예쁘고 분위기도 고급스러워요! 저희도 지나가다가 분위기가 맘에 들어 냉큼 들어온 카페입니다! 카페 안은 이런 느낌! 전체적으로 블랙이라 깔끔하고! 분위기가 어둡고 세련된 느낌이 들었어요 벽 쪽에는 둘이 앉을 수 있는 소파 자리도 있어 데이트하러 오기에도 좋을 것 같아용 인스타 감성 카페 분위기가 느껴지죠! 여기는!! 카운터이고요 메뉴판 볼까요 시그니처 메뉴부터 커피, 차, 에이드, 음료까지 종류도 많았어요! 카운터 바로 앞에는!! 먹음직스러운 수제쿠키랑 소금빵도 있어요!! 너무너무 먹고 싶었지만 맛있는 거 먹으러 갈 거라 꾹 참았어요 🫶 아이스 아메리카노 4.800원 🫶아이스 카페 라떼 5.500원 주문한 커피는 직접 가져다주셨어요 라떼가 아주 고소하고 진한게 커피 맛 정말 굿굿❤️ 너무 맛있었어요!! 남편도 커피 맛이 좋았다고 했어요! 저녁에도 커피 잘 마시는 부부 여기이찌요 다음에는!!! 디저트도 같이 먹으러 오려고요 분위기도 좋고 커피 맛도 좋은 ❤️ 리벌티 카페 ❤️ 망원동 오시면 한번 방문해 보세요 리벌티 망원 서울특별시 마포구 포은로 108 1층 https://m.blog.naver.com/kangjl78/223103778965 망원동 꼬치전문점 구운 다녀왔어요♥ 안녕하세요. 민지닝입니당 주말에 망리단길 가서 가볍게 꼬치구이 먹고 왔는데 보여드릴게요 ❤️ 구운 ❤... m.blog.naver.com"
"[마포/망원동] 리벌티 카페 :: 분위기, 인테리어 너무 세련되었는데 커피까지 맛도리인 카페 내돈내산리뷰","안녕하세요 재리입니다!! 카페 러버 커피 러버로서 또 너무너무 좋은 망원동카페 찾아서 소개드리려고 해요 리벌티 망원 서울특별시 마포구 망원로7길 65 1층 장소는 여기입니다!! 마포구청역과 망원역 사이에요! 망원은 진짜 예쁜 카페 성지라 너무 행복 ㅎㅎ 외관입니다! 통요리라서 탁 트인 느낌이라 좋아요! 리벌티 망원이라고 적혀있는 간판 있어서 찾기도 쉽습니다! 내부가 일단 그레이톤으로 깔끔하고 세련된 느낌이라 너무 취향저격... 뭔가 하트시그널 김현우 느낌임 ㅋㅋㅋㅋㅋㅋㅋㅋ 남자들도 편하게 가기 좋은 카페인 것 같아요! 그리고 소품이 무엇보다 너무 깔끔하고 미니멀해서 좋았어요 소품이 많은 것도 귀엽고 좋긴 한데 전 이렇게 깔끔한 게 더 제 취향에 맞더라구요 거울도 크게 2개나 있어서 셀카 찍어서 인스타 올리기 좋은 카페임 ㅋㅋㅋㅋㅋㅋㅋ 다음에 좀 꾸미고 와서 사진 찍어야겠어요 커피 용품들도 많아서 커피 전문점 느낌이 확 나더라구요! 그리고 무엇보다 테이블 간 간격이 넓어서 쾌적한 게 제일 큰 장점! 테이블 자체도 넓고 의자도 종류가 다양한데 다 테이블이랑 의자 높낮이가 딱 맞아서 허리도 안 아픔 인스타 감성 카페 가면 허리 부서질 것 같은 높낮이의 테이블, 의자 많아서 킹받았는데 망원 카페 리벌티 오고 편-안 간단한 쿠키류도 판매하는 것 같아요!! 다음에 와서 먹어야지 망원 카페 리벌티 메뉴판 가격표 가격표입니다! 저는 아이스 라떼로 주무했어요!5000원이었습니다! 요즘 카페들이 가격이 하도 올라서ㅠㅠ 전 이정도면 망원 분위기 좋은 카페 중에서는 가성비 나쁘지 않은 편이라 생각해요 왜냐면 커피가 진심 개맛있어서... 맛있으면 비싸도 안 아까움 리벌티 카페 내부 통유리라서 그런지 안에서 진짜 탁 트인 느낌이 들어서 기분전환 제대로 돼요ㅠㅠ 그리고 창가 바로 앞에는 나란히 앉을 수 있는 소파도 있어서 커플들 오기 좋은 카페인듯 짠 제가 시킨 라떼입니다! 너무 좋은 게 사장님이 직접 가져다주셔서 굳이 가지러 가지 않아도 된다는거!! 테이블마다 스탠드 조명도 있어서 사진도 쨍하게 잘 나옴 ㅠㅠ 커피 마셨는데 진짜 맛있어서 박수침... BGM 노래도 괜찮고 사장님도 친절하시고 화장실도 깨끗한 편이에요!! 연남동 사람 개많고 인테리어 애매한 카페보다 500배 나아요 진심"
서울 망원동 - 카페 리벌티망원,리벌티 망원 서울특별시 마포구 망원로7길 65 1층 가려던 카페에 자리가 없어서 리버티 망원 여기 위치 바뀐 건가 ..? 위치 등록이 잘못된 건가 .. 카페 안에 있을 때 밖에 지나가는 사람들마다 간판을 찍고 가신다 예쁘긴 해 .. 카페 도착하자마자 탕구리를 준다 ..? 오늘 끝났다 .. 꽃도 준다 ..? 이 자식아 ㅠㅠ (?) 커피전문 카페라서 달달한 라떼 시켰는데 원두도 다양하고 바리스타 친구는 만족 바리바리스타 나도 만족 머들러도 느낌 있잖아 ~ 로투스쿠키까지 냠 ~
"망원동,망리단길 카페☕️:: 분위기 좋은 리벌티망원Liberty","리벌티 망원 서울특별시 마포구 포은로 108 1층 ✔️11:00-22:00 ✔️마포구 망원동 414-18 1층 리벌티 망원(@liberty_mangwon) • Instagram 사진 및 동영상 팔로워 1,859명, 팔로잉 544명, 게시물 93개 - 리벌티 망원(@liberty_mangwon)님의 Instagram 사진 및 동영상 보기 instagram.com 망원동 분위기 좋은 카페 리벌티 망원이에요! 저는 저녁때 방문한 리벌티 망원이에요! 저녁때 방문해서 그런지 분위기가 더 좋더라구요🥺 메뉴는 클릭해서 봐주세요! 쿠키들…🍪🍪 테이블은 많지 않아요! 카페 중간에 있는 인테리어가 너무 독특해서 포인트가 되는거같아요🔥 전체적인 분위기! 컵이 지방시였던거 보고 너무 고급스러워서 놀랬어요☕️ 커피맛도 맛있었고 , 분위기도 좋아 방문해보시길 추천드려요🥺☕️ (리벌티망원 인스타 참조) (리벌티망원 인스트 참조) 이곳이 브리오슈도 유명하다고 하더라구요!! 다음엔 꼭 브리오슈도 먹어봐야겠어요ㅎㅎ"
[리벌티 망원] 망원동 망리단길 카페,"밥을 먹고 나와서 망리단길을 따라 걷다가 우연히 발견한 분위기 좋은 카페 리벌티 망원(Liverty Mangwon) 낮에 가보지 못 했지만 리벌티 망원 카페는 밤에 갔을 때 더 좋은 곳이 확실하다. 밤의 분위기와 너무나 잘 어울리는 인테리어 모던한 인테리어가 완전 취저! 원두도 취향에 따라 선택할 수 있어서 좋았다. 요즘처럼 산책하기 좋은 날씨의 계절에 저녁 먹고 망리단길 따라 산책하다가 이런 분위기 좋은 카페까지 만나면 그날의 데이트는 완.벽.! 리벌티 망원(Liverty Mangwon) 주소 : 서울 마포구 포은로 108 1층(주차불가능, 주변 공영주차장 이용 권장) 리벌티 망원 서울특별시 마포구 포은로 108 1층"
"[일상] 올해도 글렀나봄 2023 | 더현대 치플레 | 망원동 데이트 (리벌티, 당도)","4월 셋째 주 일요일 _ 여의도 한강공원 올해 날씨 풀리고 간 한강은 처음 이날 ‘올해도 글렀나봄‘ 콘서트 하는 날이었다. 콘서트 보러 간 거라 드레스코드 블랙으로 입고 갔음🖤 너무 덥고 이미 자리 다 차지해서 겨우 어디 낑겨 앉아서 미노이만 봤다. 노래 감미롭구🎶 미노이 너무 좋아 🖤 다음 가수 나올 때쯤 배고파서 더 현대로 갔다. 더현대 치플레 우연히 발견한 치플레 집에 디저트 사놓으면 하루 만에 다 먹어서 안 사려고 하는데 제주 하멜이 그리워서 사봤다. sns에선 치플레 줄이 그렇게 길다는데 생각보다 없길래 샀는데 브륄레 맛이 없어서 그런 거였음 ,, 그래도 하멜만큼 맛있어서 합격 #치플레 #더현대식품관 마츠노하나 두 번째 방문 예전에 여기서 아나고텐동 먹었는데 나쁘지 않았다. 요즘 매일 일식 먹는 거 같아서 질린다 질려 헤라에서 쿠션 사고 IFC몰 넘어와서 차 한잔하기 다음날 _ 망원 행지의 추천으로 가게 된 ‘당도’ 당도 원래 토끼 모양이라던데 왜 난 토끼 안 해줘요? 맛있는데 너무 달아서 다 먹기 힘들었다 .. 밥 먹고 걷다가 들어간 카페 외관이 너무 예쁘다 리벌티 망원 메뉴 달달한 거 먹으려다가 더 이상 단거 못 먹겠어서 아아 주문 행지가 내 아아 뺏어 먹는다고 해서 나도 행지 아인슈페너 뺏어 먹기로 함. 너무 배부른데 소금빵 못 참아서 결국 시킴 행지 사진 잘 찍어서 좋음 ㅎㅎ 여기 소금빵 또 먹고 싶다. #망원동 #소금빵맛집 #루토스아인슈페너 행지가 인생샷 건져줌 사실 포토샵 진짜 많이 함 히히 #망원동데이트 #망원동카페 #망원동빵집 #더현대맛집 #더현대일식 #더현대텐동 #더현대데이트 #여의도데이트 #여의도한강공원"
