title,content
망원동 카페 slab 슬라브 무조건 추천!!,슬라브 서울특별시 마포구 포은로 87 지하 1층 슬라브 매일 12:00-20:00 (화요일 휴무) 망리단길 분위기 갑 카페 독특한 작업실 분위기 같으면서 조명부터 인테리어 소품까지 눈에 띄는 카페입니다 와인이나 위스키도 판매하고 있어 카페 분위기보다 분위기 좋은 술집 분위기입니다 입구는 간판이 없어서 잘 찾아야 찾을 수 있어요^^ 지하 1층에 위치하고 있습니다 커피를 내리는 모습을 직접 볼 수 있어서 기다리는데 지루하지 않고 오히려 재밌었어요 책상은 전부 이어져있어서 신박했어요 소소한 아이템들이 많이 판매하고 있어 벽 쪽에 인테리어처럼 전시가 되어 있어서 보는 재미도 있었어요 메뉴판은 드링크 차 디저트를 판매하고 있습니다 저희는 아메리카노와 도미노 시스템을 주문하였습니다 작업실 분위기 같으면서도 미술관 같기도 하고 어쨌든 분위기는 좋았어요! 커피나 디저트 그리고 와인과 위스키까지 즐길 수 있는 분위기 좋은 망리단길 카페였습니다 망원동이 인테리어 샵도 많고 이런 분위기 좋은 카페도 많아서 너무 좋았어요
망원동카페 슬라브 여유롭게 좋은 시간 보내기 좋은 곳~,50m © NAVER Corp. 슬라브 서울특별시 마포구 포은로 87 지하 1층 예약전화: 026-013-1250 영업시간: 12:00-20:00 춥지만 날씨가 좋았던 망원동에서 아주 괜찮은 분위기 좋은 카페를 갔습니다 ~! 망리단길에 있는 카페 슬라브를 갔는데여 ~!! 그전부터 봐뒀던 곳인데 드뎌 가게 되었구 슬라브는 특이하게 지하에 위치해있습니다. 오오.. 추워서 그런가 아직 한가하네요.... 그래서 더 좋은 것 같기두.. 사람 많은거 안좋아하는 편이라... ㅎㅎㅎ 근데 여기는 사람 많아도 정신 없을 느낌은 아니예요. 부뉘기 되게 골져스함.. 감각적인 카페에서 여유롭게 커피한잔 때렸습니다. 역시 음료는 아이스지.... 시간보내기 아주 좋은 장소인듯.. 또오고싶은 생각나는 카페 망리단길 오시면 슬라브 꼭 와보세여 ! 데이트하기 넘나 좋은 곳
"4 week, FEB, 2022 / 다시 시작한 그림 그리기 / 망원동 산책 / 슬라브 / 제로스페이스 / 귀여운 수제젤리 고체 / 우이락 고추튀김 / 만보 걷기로 끝난 한 주","monday 애정하는 신전 로제떡볶이 우체국 온 김에 포장 냠냠 tuesday 오랜만에 공유오피스 출근 코로나 확진자가 많아져서 재택만 했더니 나태해지는 것 같다. 미대생이지만 디자인과 출신이라 입시 미술 이후 제대로 그림을 그리질 않았다. 다시 잘 그려보고 싶은 마음에 호미화방에 들렸다. 드로잉부터 차근차근 시작해야지! thursday 오랜만에 망원동 산책 카페투어 커피보다 술이 생각나는 분위기 제로퍼제로 글라스컵 살까 말까 오조억 고민하다 말았는데 집에 오니 계속 눈앞에서 아른거림 조만간 데리러 갈게~~~ 귀여운 고체 수제젤리 패션후르츠 젤리 강추! 적당히 새콤달콤하고 오도독 씹히는 씨앗이 너무 맛있다. 망원시장 우이락 고추튀김 3개 8,000원 고추튀김은 매운맛이 1도 없어서 양념장에 청양고추를 팍팍 썰어 추가해 맛있게 먹었다. sunday 아기자기 예쁘게 꾸며진 산책로 요즘 주 3회 만보 걷기 실천 중이라 열심히 걷고 있다."
"[망원동] COFFEE & DESSERT ""슬라브 SLAB""","망원동신상카페 인디살롱의 첫번째 실험작 프로젝트-Slab(공간의 바닥을 이루는 구조물) 슬라브 pre-opne 2021.07.26-2021.07.30 전화번호 02-6013-1250 주소 도로명 : 서울 마포구 포은로 87 지하 1층 지번 : 서울 마포구 망원동 399-36 지하 1층 영업시간 수-일요일 12:00 - 20:00 월, 화 휴무 주차불가 slab_seoul SLAB(@slab_seoul) • Instagram 사진 및 동영상 팔로워 387명, 팔로잉 0명, 게시물 2개 - SLAB(@slab_seoul)님의 Instagram 사진 및 동영상 보기 www.instagram.com INDIESALON INDIESALON(@indiesalon_official) • Instagram 사진 및 동영상 팔로워 1,544명, 팔로잉 7명, 게시물 133개 - INDIESALON(@indiesalon_official)님의 Instagram 사진 및 동영상 보기 www.instagram.com indiesalon / 장석준 소장 장석준 소장님이 Instagram을 사용 중입니다 • 장석준 소장님 프로필의 게시물 1,407개 팔로워 5,036명, 팔로잉 2,734명, 게시물 1,407개 - 장석준 소장(@indiesalon)님의 Instagram 사진 및 동영상 보기 www.instagram.com 인디살롱 공간 디자인 스튜디오 INDIESALON SPACE DESIGN STUDIO 인디살롱은 창작성과 자율성 토대의 ‘인디 정신'과 문화 토론의 장이었던 ‘살롱'에서 착안되었으며, 자유로운 사고와 커뮤니케이션을 통한 공간의 이해 및 구현,나아가 다양한 문화를 함께 공유하고자 만들어졌습니다. @인디살롱 망원동 티라미슈가 있는 건물 지하에 새로 생긴 #망원동신상카페 #슬라브 #SLAB UNDEFINED PLACE SLAB 조형의 이미지가 인상적이다 . 지하로 내려가본다. 내려가는 곳에 의미심장하게 붙여진 조형이미지의 스티커 내부로 들어가면 조형이미지의 근원을 알수 있다 . 입구에는 빈티지 가구와 조명이 공간에서 반긴다 . coffee & Dssert 공간의 바닥을 이루는 구조물 "" 슬라브' 지나가는 꿈처럼 언젠가는 우리만의 공간을 만들어 모두에게 인디살롱을 만나게 해주고 싶었다. 공간에 대한 생각, 즐겨듣는 음악, 좋아하는 커피, 공간을 채우는 향, 모든걸 건축과 연관짓고 싶은 마음, 마음껏 펼쳐놓고 작업할 수 있는 테이블, 프로젝트의 파편들, 흐트러질 수 있는 무드, 진지함과 위트. 때로는 진행되고 있는 작업들의 과정이 보여지기도 하고, 좋아하는 작품과 오브제들이 전시되는 우리의 생각들과 함께 흐르는 공간. 영원히 마감되지 않을 첫번째 프로젝트를 공개합니다. @인디살롱 건축, 인테리어, 공간 등의 모든 디자인 작업을 다루는 '인디살롱'이 언젠가는 그들만의 공간을 실현해보고 싶다고 했었는데 드디어 그들의 꿈의 빛을 발하는 공간이 슬라브 로 표현되어 망원동에 낮은 조명으로 다가왔다 . 내부를 들어서는 순간, 숨소리조차 들리지 않을 듯한 고요함속에는 몇몇의 손님들이 공간을 즐기고 있었고 , 낮은 조도의 조명으로만 공간의 숨이 보였다 . 조형이미지의 굴곡있는 테이블엔 슬라브 로고가 새겨진 테이프와 감각적인 향 브랜드인 sutomeapothecary 와 함께 슬라브의 특별한 향을 콜라보한 향수도 선보이고 있어서 이곳을 찾는 손님들에게 들어오는 순간 이곳만의 특별한 향으로 이끈다. sutomeapothecary SUTOME APOTHECARY(@sutomeapothecary)님의 Instagram 프로필 • 사진 및 동영상 568개 팔로워 6,470명, 팔로잉 75명, 게시물 568개 - SUTOME APOTHECARY(@sutomeapothecary)님의 Instagram 사진 및 동영상 보기 www.instagram.com Coffee & Dessert in SLAB @INDIESALON 슬라브의 메뉴 이곳 슬라브에서는 일반적인 커피가 아닌 드립커피를 제공하고 있기에 가격은 좀 있다. 그리고 눈에 띄는 메뉴 디지털피규어 실험적인 디저트 Dessert Motivation Dom into Stystem 이곳 시그니처 메뉴 건축의 핵심요소인 도미노인투시스템 형상화한 디저트 사과조림 , 쿠키조각을 시나몬소스와 함께 버무린 크런치 쿠키를 베이스로 한 후 비스켓과 치즈큐브로 도미노시스템 건축물을 형상화 한 실험적인 디저트 100분의 1 크기의 공간을 시각적으로 향유할 수 있으며, 입체적인 형태의 맛 , 텍스쳐를 경험할 수 있다니 디저트의 새로운 시도와 도전인 듯하다. 오늘은 잠시 머물다 갑니다. 다음엔 정식적으로 차와 디저트를 인디살롱의 새로운 실험적인공간인 #슬라브 에서 향유를 즐겨보도록 할께요~ 50m © NAVER Corp. 슬라브 서울특별시 마포구 포은로 87 지하 1층 #망원동신상카페 #망원동가오픈카페 #슬라브 #망원동슬라브 #인디살롱 #스튜디오인디살롱 #INDIESALON #DomintoStystem #SLAB #망원동티라미슈"
망원동 분위기 좋은 카페 추천 [슬라브],"망원동에 분위기 좋은 카페! 슬라브에 다녀왔어요 @@ 50m © NAVER Corp. 슬라브 서울특별시 마포구 포은로 87 지하 1층 지하로 내려가면 우드톤의 인테리어와 예쁜 조명 가득한 카페가 등장해요! 약간 재즈바에 온 듯한 느낌이랄까 흔하지 않은 카페 분위기라 좋았어요>< 드립커피 마셨는데 짱맛 ,,, 그리고 여기 시그니쳐 도미노시스템 !(건축모형물? 모티브로 제작한 디저트였나,,) 별건 없지만,,그래도 뭔가 창의적이어서 가격은 눈 감아 줄게요.... 건축 관련된거라고 설명해주시는데 기억이 잘 안나넵... 뿌셔서 먹는거에요 뿌실 때 스트레스 해소 분위기 좋아서 담에 가까우면 또 오고 싶을 정두??? 망원동에 조용하고 아늑한 카페 찾으시는 분들에게 추천해드려요 ♥"
[망원] 망원동 카페 '슬라브_SLAB',망원동 기록... 언니랑 아로가서 점심먹고 2차로 어디갈지 고민하다가 갔다 망원동 카페 슬라브 Opening Hours 월-목 12:00~20:00 금-일 12:00~22:00 건물의 지하에 있다 여기가 맞나? 눈치보며 들어가면 맞다 엄청난 기대를 한 것 치고는 그렇게 독특한 곳은 아니었으나 묘하게도 편한 기분이 들었다 아무래도 전체적으로 밝기가 다운되어 있어 그런것 같다 메뉴랑 가격 메뉴가 간단한 편 고를게 많이 없어 편하긴 한데 이곳의 시그니처인 도미노시스템 가격보고 놀랬다 물론 시키지도 않았음 슬라브 블렌드 핸드드립 아이스 + 따뜻한 카페오레로 주문했다 핸드드립은 다크하지만 엄청 무겁게 느껴지지 않아서 적당한 바디감을 충분히 즐기며 마실 수 있었다 라떼로 마신 s언니도 맛있다고 했다! 맛이나 분위기는 꽤 괜찮았지만 가격은 그렇게 괜찮아 보이지 않음 ㅠ 이 근방의 다른 카페들보다 조금 가격이 있는편이다 도전 정신+총알 장전한 사람들은 디저트 도전해보세요 50m © NAVER Corp. 슬라브 서울특별시 마포구 포은로 87 지하 1층
[서울 망원동] 슬라브,"50m © NAVER Corp. 슬라브 서울특별시 마포구 포은로 87 지하 1층 서울 마포구 망원동 399-36 지하 1층 월 - 목 12시 - 20시, 금 - 일 11시 - 22시 SLAB 슬라브(@slab_seoul) • Instagram 사진 및 동영상 팔로워 993명, 팔로잉 4명, 게시물 22개 - SLAB 슬라브(@slab_seoul)님의 Instagram 사진 및 동영상 보기 instagram.com 간판 없는. 지하에 있는. 어두운. #슬라브 도착. 커피가 아니라 와인 한 잔 하고 싶은 분위기. 커피 주문해야 되는데 자꾸 눈이 가는 주류 메뉴판. 정신차리고 음료 주문하려는데 가격이 꽤 있는 편. 디저트는 내가 좋아하는 스콘도 휘낭시에도 있었는데 시그니처인 도미노를 먹어야 할 것 같았다. 메뉴판 위에 있던 귀여운 달력. 이런 건 꼭 가격은 안 귀엽더라. 슬라브 굿즈. 그림자가 예쁘잖아? 손님이 많아 테이블 사진은 못 찍었지만 곳곳에 사진으로 담고 싶은 곳이 많아 좋았다. 지하라 분위기도 차분하고 그래서인지 다들 대화도 조용조용하게 하셨다. 테이블에 다 다른 조명들이 있는데 다들 몸값이 엄청나 보였다. 도미노 세팅. #카페오레(7.5). 빨대는 따로 없고 스틱으로 저어 마시면 된다. 양은 많은 편이 아니고 원두는 산미가 있는 편이라 내 스타일은 아니었다. #차(6.0). #PacksOfPeach 였는데 향도 끝맛도 달달하고 진했다. 복숭아의 달달함을 느끼고 싶다면 추천! 도미노는 시간이 조금 걸린다. 그래서 셀카도 조금 찍었고요. 드디어 도착한 #도미노시스템(16.0). 크럼블 위에 밀푀유가 올려져 나온다. 작은 피규어들은 우리가 원하는 곳에 놓을 수 있다. 최소한의 기둥으로 모서리를 지지하는 것이 도미노 이론의 핵심이라고 설명되어 있는데, 그래서 자세히 보면 마스카포네 큐브가 세개 뿐이다. 밀푀유는 조금 눅눅한 편이고 크럼블은 살짝 덜 구웠으면 더 좋았을 것 같았다. 밀푀유와 크럼블, 치즈, 사과는 맛있는 조합이지만 전체적으로 봤을 때 맛은 조금 부족했던 것 같다. 그래도 마스카포네 치즈는 진하고 부드러운데다 차가워서 좋았고, 무튼 어디서도 본 적 없는 새로운 스타일의 디저트를 맛 본 것에 충분히 만족했던 것 같다. 조금 남기긴 했지만, 공간도, 도전적인 디저트(?)도 마음에 들었던. 새로운 슬라브만의 느낌의 디저트가 나온다면 그때 또 방문할 것 같다!"
망원동 신상카페 슬라브[SLAB] 이색 디저트 도미노 시스템_ 망리단길,"망원동 인디살롱 '슬라브' 많은 사람들이 망원동을 애정하는 이유는 아이덴티티가 확실한 감성적인 공간들이 옹기종기 모여있어서가 아닐까? 란 생각이 들게 했던 이곳! 이번에도 망원동에 놀러 갔다가 아주 감각적인 공간을 발견했어요. 이곳은 망리단길에 위치한 망원동 신상카페 슬라브 인데요. 전체적으로 어두운 조도와 전시장에 작품처럼 놓여 있는 무드등, 사진에서도 느껴지는 멋스러운 공간 분위기에 홀려 방문하게 되었습니다. 슬라브(SLAB) coffee & dessert every day 12:00 -20:00 주차시설 x 도보 5분 거리 망원 1동 주민센터 공용주차장이 있음 슬라브 서울특별시 마포구 포은로 87 지하 1층 카페 공간을 가득 채운 커다란 테이블은 기하학적인 곡선으로 이루어져 시각적으로 재밌게 풀어놓은 거 같아요. 카페 공간 안으로 들어가다 보면 문을 사이에 두고 작업장처럼 보이는 공간이 있고 건축과 관련된 슬라브만의 이야기를 보여주는 듯했습니다. 이런 스토리가 있는 공간은 더욱 매력적으로 다가오는 거 같아요. 세상엔 아이디어 뱅크인 분들이 참 많구나.. 도미노 시스템 16,000 콜드브루 6,000 까페오레 7,500 디저트 치곤 가격대가 꽤 있는 편이지만 슬리브의 시그니처 메뉴를 한 번쯤 맛보고 싶어서 고민 없이 주문했습니다. 작업용 커팅 매트를 트레이처럼 사용하던데 공간 분위기랑 잘 어울리고 너무 예뻐요. 전 사실 커피만 마시면 울렁증이 심해지는데 카페오레를 주문했어요. ☕ (다행히 울렁거림 없이 맛있게 즐겼다고 한다. 선택적 울렁증인 건가; ) 뽀작한 사람들 도미노 시스템은 요러케 파사삭 부셔서 먹어야 제맛이라네요? 사과가 씹히는 애플파이와 시나몬, 아이스크림의 조화는 긴 말이 필요 없이 맛있어요. 맛이 없을 수 없는 조합이긴 한데 정말 괜찮았어요. (시나몬 마니마니 좋아함) 그리고 미니미한 사람 모양의 조형물을 직접 데코 할 수 있게 한 점도 아주 굿-! 공간의 분위기와 독특한 디저트를 맛있게 즐길 수 있어서 비용이 전혀 아깝지 않았습니다. 최애 동네에 매력적인 공간들이 계속 생겨나서 자주 가도 매번 새롭네요. ㅎㅎ 이색 디저트를 맛보고 싶다면 망원동 슬라브를 방문해보세요. :)"
[망원동 카페] 슬라브카페_분위기 묵직한...건축학도가 주인장인듯..,"망원동 알맹상점에 볼일이 있어서 나갔다가 동생이가 가보고 싶은 #망원동카페 가 있다길래 무브무브~ 망원 티라미수 건물 지하에 있는 카페였는데 간판도 없고... 진짜 알 사람만 갈 수 있는 카페였다. 뭐가 있는지도 모를 지하 입구...아무 정보도 없이 따라 나섰던 나는 살짝 망설여짐이 있었다. ㅋㅋㅋ 지하 1층의 그다지 크지도 작지도 않은 공간이었다. 천고가 높은 것도 아니어서 아담한 느낌을 받기도 했다. 입구 한켠에는 의자와 작품이 하나 세워져 있었다. 알록달록한 컬러가 이곳의 분위기와는 어울리지 않는 듯한 느낌이 있었지만 유일한 컬러 포인트 존이라서...낫배드~ㅎㅎㅎ 자리가 없다고 대기 이름을 올려놓고 가면 전화를 주겠다고 해서 연락처를 적어놓고 올라와서 주변을 걸어볼까? 하는데... 바로 연락이 왔다. 자리가 나왔다고...^^;;;; 다시 내려갔다. 운동도 되고 관절에도 안좋고 좋았지 뭐. ㅎㅎㅎ 눈이 침침해 지는 내게 너무 작은 글씨..ㅋㅋㅋ 카페인데 술도 마실 수 있는 카페라서 좋은 것 같다. 다음에 가게 되면 그때는 술 한잔 해보면 좋을 것 같다. 어울리는 안주가 있었던가?? 치즈관련 메뉴가 있었다. 실내 건축을 공부하던 나의 젊은 시절이 있었다. 그때 이런 작업 참 많이 했었는데... 뭐...미니어처 작업 때문에 불과 3~4년 전에는 모델링을 하기도 했으니...이런 것들을 보는 시선이 남다를 수 밖에 없겠지? 입구에 가까운 쪽에 커피는 내리는 공간과 디저트를 만드는 공간이 있다. 이 부분이 차지하는 공간도 꽤 큰편이라 사람들이 앉을 수 있는 공간이 더 없는 것 같은? ㅎㅎㅎ 코로나 때문인지 좀 간격이 넓게 떨어져 앉은 사람들. 그렇게 안내를 해주고 있는 것 같았다. 의자도 적게 놓여 있고. 코로나가 끝나도...이렇게 여유있게 자리 배치가 운영되었으면 하는 바람이다. 핸드드립으로만 제공되고 있어서 기다림의 미학이 있었다. 그리고 우리가 앉은 자리 바로 앞이 만드는 공간이라서 만드는 모습을 볼수 있어 재미있었다. 위에 대기명단 작성하러 들어왔을 때 대강 찍었던 느낌이랑 좀 다른가?? 이건 자리에 앉아서 찍은 사진. 가깝게 서서 찍은 사진과는 느낌이 사뭇 다르기도 해서... 독특하고 멋있는 조명이 많았다. 동생이도 모델링작업을 알아보더라는... 집에서도 과제를 했던 터라 집에 잔뜩 쌓여있던 흔적들이었다. 새삼스레 그때의 기억을 떠올리며 살짝 추억에 들어갔다 나왔다. 안쪽의 장식장에는 여백의 미를 살려 다양한 소품들이 놓여있었다. 안쪽에서 바라 본 입구쪽 모습 안쪽 장식장들 사이로 유리창이 있는데 그 창 넘어에 있는 공간이다. 건축을 하는 사람들이다~~!!! 라는 걸 알려주고 싶은 듯. 작업실인 듯, 창고인듯, 이런 공간을 보여지게 했다. 우드락으로 만드는 저런 작업...등고선 작업은 건축과는 하고 실내 건축과는 하지 않았던 것 같다. 난 하지 않았었거든...ㅎㅎㅎ 토끼같은 의자. 그림자까지 귀엽고 재미있어서 담아봤다. 책에서 읽었을 때...도미노가 아니라 돔이노라고 하던데...흠... 르코르뷔지에는 이 시스템과 모뒬로르라는 규칙을 활용했다. 이것들은 지금의 건축에서도 완전 많이 쓰이고 있고, 필로티 구조를 생각하면 쉽겠다. 포크에 안착시켜본 모델링 소품 도미노 시스템이라는 디저트가 나왔다. 16000원의 금액으로 상당히 비싼 편. ㅎㅎㅎ 돔이노 시스템이 기둥을 중심으로 하는 시스템이라고 알고 있는데 그 걸 활용해서 무게중심을 보태어 만든 디저트같다. 주문시 제공되는 작은 모형 소품을 이렇게 저렇게 놓아보며 놀다가... 이렇게 아작을 내어 부셔먹으면 되는 디저트다. 설명을 해주실 때는 이렇게 먹는 모습이 건축하는 학생들의 모습같다고 하셨던 것 같은데.... 음... 글쎄....ㅋㅋㅋ 아이스 아메리카노 산미가 없는 걸 말씀드렸는데 맞게 내어주신 커피였다. 그리고 작은 컵에 커피를 더 내어주는데 부족할 때 부어서 마시라고 내어주는 것이었다. 마시다 줄어들면 붓고~ 또 붓고~ 그렇게 셀프 리필을 하면서 마셨다. 요건 동생이가 주문한 건데 오레그랏세라는 음료였다. 뭔가...아인슈페너 같은 느낌?? 위에 달달한 크림이랑 같이 호로록 마셔주면 달콤하니 맛있었다. 독특한 분위기에서 즐겁게 우리끼리 낄낄거리며 재미있는 시간이었다. 디저트를 부셔서 먹으면서도 뭐가 그렇게 재미있었는지 모르겠다. ㅎㅎㅎ 커피도 맛있었고 분위기도 좋았고, 다음에는 다른 것들을 경험해보고 싶은 생각이 들었다. so good~ 50m © NAVER Corp. 슬라브 서울특별시 마포구 포은로 87 지하 1층"
