title,content
망원동카페 | 리벌티 망원,"오늘은 #망원동카페 소개할거다🤓 오늘 갓 다녀온 따끈따끈한 후기 기대하시라요 리벌티 망원 서울특별시 마포구 포은로 108 1층 오늘은 #혼카페 여행이다 33도를 보고 집에만 있을 수 없었음 이렇게 화창한 날 가만히 있을 수 없기 때무네 망원동을 찾아왔따! 망원동하면 #감성카페 지 웨이팅을 위한 좌석 겸 포토존 겸 인테리어 ..? 1석3조인 의자군 길을 걷다보면 딱 튀는 빨간벽돌 카페가 있다 입구부터 모던함과 감성 두마리 토끼 다 잡은 느낌 뭔지 알지 이 붉은 블럭이 볕 받으면 정말 예쁜데 오늘이 딱 그런 날이다 사진으로 안담기는게 안타까울 뿐- Feat. 볕과 함께하는 #망원리벌티 #망리단길카페 외관으로 일단 성공조짐이 상승하고 있다 내부 좌석들은 2인좌석부터 4인까지 함께 할 수 있었다 생각보다 좌석은 낙낙한 듯 ! 무엇보다 높이가 너무 낮지 않아서 좋다ㅠ 요즘 카페들 책상 어떻게 앉아야 할지 모르겠을 정도로 낮을 때도 있기에 .. 사람 덜 할 때는 작업하기에도 좋을 듯 #망원동노트북 #망원동작업하기좋은카페 좌석들 중앙으로 이런 공간이 바닥에 있는데 이게 분위기에 한 몫 하는 듯 #모던카페 의 정석+@ 인 느낌 입구 옆에 있는 선반도 모던의 끝판왕 음악 사운드는 작지 않은 편이기는 한데 대화에 지장 없을 정도로 딱 분위기와 어우러지는 느낌 알지 옆테이블 대화소리 들리지 않는 적당한 시끄러움 정도? 메뉴판 왼쪽이 음료 오른쪽이 디저트 옆에는 시그니쳐 메뉴들이 슬라이드로 보여지고 있어서 선택하기에 더 용이해보였음 !! 저 #브리오슈 에 마음을 빼앗긴 나,, #자몽크림치즈브리오슈 #아이스아메리카노 원두는 살짝 산미 있는 ROSE 로 동생 생각나서 #더블초코피칸쿠키 도 하나 포장했다 (착한누나 ㅇㅈ?) 요기가 쿠키 떼샷 종류는 총 6가지! 뚠뚠이 #스모어 아니면 #르뱅쿠키 들이다 클로즈업해서 아리땁게 찍고 싶었디만 마음만이라도 전달 되었길..(?) 사진은 이게 더 예쁘다^^! 쿠키가 계속 구워져 나오고 있었는데 쿠키 시키면 따땃하게 데워서 주시는건지 후기들 보니 다 마시멜로가 쮹쮹 늘어나고 있었음 이것저것 다양한 결제수단을 사용할 수 있음을 온 색깔로 표현 중ㅋㅋㅎㅋ 와이파이 정보도 빼 놓을 수 없지 여기저기 틈새 갬성 챙기기 명함인가 싶었는데 스티커 (!!) 나도 냅다 챙겼다 포장은 요로코롬 해주신다 완전 고급져서 #디저트선물 하기에도 딱 좋아보이는 ! 전체적으로 고급진 느낌을 주려는 듯했다 가운데 있었던 감성 부스터 인테리어들 하나하나 배치들 신경쓰신게 보이더라 잡지 페이지까지도..! 효과는 엄청났다 원두도 따로 판매하시는 것 같구 마샬 스피커 ,, 말 다했쥬 ? 밤에도 낮에도 좋을 것 같은 통창 오늘은 볕이 좋아서 햇볕이 낙낙하게 들어왔다 한쪽 면에는 거울과 네온사인 밖에서 보면 저 네온사인이 은은하게 보이는게 매력적이다 리벌티만이 줄 수 있는 분위기 #망리단길분위기좋은카페 하면 생각날 것 같다 딱 들어와서 보이는 사장님의 작업공간 조금 기다리다보면 자리로 가져다주신다! 흑색이 많은 인테리어에 컬러감이 쨍한 쟁반 색감 조합 너무 예뻤다 원두 설명도 함께 놓아주시고 브리오슈 위에 크림치즈 두께 실환가 ???? 빵 두께만큼 크림치즈가 올라가있다 그 위에 자몽💞 달달한 크림치즈에 쌉쌀한 자몽이 잘 어울릴 것 같아서 픽했는데 역시는 역시 올바른 픽이었다🏆 #자몽디저트 흔하지 않은데 굿조합이었음 !! 엄청 쌉쌀하지는 않았는데 적당하게 달고 쌉싸름한 맛이라 디저트로 먹기에 적당한 정도? #망원동디저트 #망리단길디저트 동생 주려고 쿠키는 하나 포장했다 히히 달달한거에 환장한 놈이니(?) 더블초코로 픽 역시 포장이 고급져서 기부니가 좋아유 칼이랑 포크도 완전 고급지고 썰 맛 난다(?) 저 벌이 엄청 고급진거라고 했는데 메이커가 기억이 안ㄴㅏ..주륵 아메리카노 양도 너무 적지 않아서 좋았다! 낙낙하니 브리오슈랑 먹기 딱 좋았다🥰👍🏻 #망원동커피 #망리단길커피 #망원동맛집 #반갈샷 #영롱 #브리오슈 빵은 뭐 쓰시는걸까 문득 궁금해진다 반갈영상도 포기 못하디 그리고 두근두근한 한 입 !!!!!! 왕 #망리단길맛집 네 있었는데 없었네요 ㅎ_ㅎ 브리오슈 잘 몰랐는데 이런거라면 몇번이고 먹어주겠어(?) 이거 반쪽이 뭐라고 은근 배가 찼다 #망원시장감성카페 풀샷 한 2-3시쯤 되니 진짜 모든 좌석이 다 찼다 #망원동핫플 임이 분명훼 ,, 그렇게 시간을 잘 즐기다가 나와따 ! 이건 동생한테 줘야지 희희 오늘도 좋은 곳을 하나 발견했으니 성공한 하루일세다☀️ 다음엔 친구랑 수다떨러 와야겠다 다들 리벌티망원 하세효 〰️"
"1분기서울//망원동_ 망원시장, 솜솜뜨개 , 캔들 Mood, 카페 리벌티 망원",망원시장 구경 시작 점심을 해결 하려고 했는데 1인으로 사먹기에 마땅한 게 없었다 만약 동생이랑 2명이었다면 사먹고 싶은거 많았는데 말이쥬 제일 끝집 에서 핫바 하나 사머곡 중간쯤으로 돌아와서 김밥 사먹었다 된장대파김밥은 대파 알싸한 맛 좋아하는 사람이라면 추천 생 대파 쌈장발라서 끼워넣은 맛이라서 맛은 있었는데 먹으면서 속이 아리는 느낌 이었다 몇년전에 동생이랑 망원동 구경왔을때에도 여기 향 너무 좋아서 몇개 샀던 것 같은데 아직도 있어서 반가웠다! 향이 넘 좋아서 내꺼도 사고 싶었지만 친구 집 방문 기념 선물만 하나 사서 나왔다 여기 진짜 향 좋고 색 예쁜데 추천...! 작년에 망원동 구경왔다가 가고 싶었던 카페에 방문 *카페 리벌티 망원 리버티 라고 검색하면 네이버에 안나온다!! 다른 카페들이 나옴 ㅋㅋ 꼭 리벌티라고 검색 하세요 전체적으로 어두운 톤의 인테리어였고 사람들이 많아서 사진은 따로 안찍었다 카페 가운데에 요렇게 파란색 아크릴로 카페 이름이 적혀있는데 색이 잘 어울린다고 느꼈음 아메리카노 마시고 싶었는데 시그니처 음료 한번 먹어봤다 아인슈페너 크림이 달달하고 맛있었다 컵도 예쁨 솜솜뜨개 가기 전에 책 읽었다 크레마 가지고 올라가길 정말 잘했어 서울 올때마다 가는 것 같은 솜솜뜨개 작년 10월에 방문했을 때 마감시간 거의 다돼서 도착해가지구 제대로 못보고 와서 아쉬웠는데 이번엔 거의 오픈시간 맞춰서 갔다 훨씬 넓어지고 쾌적하고 넘 좋쟈나ㅏㅏㅏ 정면에서 바라보는 오른쪽은 가을겨울 실이었다 여기는 솜솜뜨개에서 유명한 실들이 많았다 색 별로 되어있으니까 마음이 초ㅑ리리 해지면서 기분 좋아ㅏㅏ 그런데 종류가 섞여있어서 실 종류별로 보기엔 불편할수도? 정면에서 바라보는 왼쪽은 여름실들이었다. 여기는 종류별로 모여있었다 어푸 실이 품절이라서 온라인으로 구매 못했었는데 여기에는 보라색 계열로 몇개 남아있어서 실물을 볼 수는 있었다! 다행! 어푸 실이랑 다쿠아즈랑 고민 했는데 어푸보다 다쿠아즈가 좀 더 빳빳?한 느낌?? 결국 나는 고민하다가 어푸도 다쿠아즈도 아닌 실을 샀고요 ㅎㅎ 코멜리 실이 여름옷 뜨기 좋아보여서 요거로 샀다 색감이 다쿠아즈보다 내 취향이었음 친구한테 2개 찍어서 보내줬는데 보라색 옷은 있지 않아? 라고 해서 민트색 삼 민트색도 안에 파란콕콕이 노란콕콕이가 있어서 넘 예뻤다 ㅠㅠㅠ 보라색으로 노프릴즈스웨터를 거의 1년쯤 뜨고 있다보니 나한테 민트보다 보라색이 더 잘어울리는 거 같기도 하고 보라색 가디건이 딱 1개 있기도 해서 일단은 패스ㅋㅋㅋ + 아 그리고 매장에서 사니까 10프로 할인해주셨다 !!!! 오예 이건 색감이 예뻐서 사진 찍어둔 거 여름실코너 맞은편에는 스너기앤울리 손염색실도 있었다 넘 예쁘잖아ㅠㅠㅠㅠㅠ 아직 타래실 손염색실 쓸 엄두가 안나서 시작은 못했지만 요즘 사람들이 모헤어 합사해서 뜨거나 흰실이랑 합사해서 뜨는거 보면 그렇게 예쁠수가없다.. 올해나 내년의 목표로 해봐야겠어 매년 이렇게 뜨개 목표 세우는데 발전하는 나자신이 기쁘다구 걸려있는거 보니까 나도 진짜 파워뜨개 해서 얼른 완성하고 싶었다ㅠㅠㅠㅠ 내 손 왜케 느려요??? (그것은 내가 너무 바쁜 인생을 살고 있기 때문이라고 다들 그러더라고요) 김뜨개 코바늘 가디건도 있어서 몸에 대어봤는데 요건 젤라비 2합으로 뜬 거라고 하시더라구 하늘색 줄무늬도 넘 귀여워서 여쭤보니까 프라이데이티라고 했다 이렇게 또 사고 싶은 도안이 생겨버리네요 ^^ ㅎㅎㅎㅎ 매장에서 실 구매하고 2층 올라가서 뜨개 할 수 있었다 자유 뜨개 공간 화장실도 있고 냉장고에 물도 먹어도 된다고 하셨다 친구들이랑 와서 실 하나씩 사들고 올라와서 뜨개 모임하면 좋겠다 5호 바늘이랑 6호 바늘로 게이지 한번 내보기 김뜨개 코바늘 원작실인 아사태사도 구경해보고 여름 실도 함량에 따라 다른 느낌 나니까 비교해볼수 있어서 넘 좋았다 실 고민 한참 하느라고 데이지 단추 사서 나오려고 했는데 까먹음 ^^ 어떤 실이 이 도안 뜨기에 좋은지 여쭤봤는데 친절하게 안내해주시고 도안 궁금한것도 물어보니까 바로 찾아주시고 진짜 좋았음 작년에 갔을때도 느꼈지만 넘 친절하셔서 자주 가고싶다ㅠㅠㅠㅠㅠㅠ 인스타에 태그 했었는데 이번에도 울산에서 오셨던거냐며 인사해주셔서 감동탱....!!!! 이번 서울나들이에 망원동도 솜솜뜨개 때문에 오게 된 거였는데 아주 만족 50m © NAVER Corp. 솜솜뜨개 서울특별시 마포구 잔다리로9길 4-2 단독주택 무드 서울특별시 마포구 포은로8길 16 리벌티 망원 서울특별시 마포구 포은로 108 1층
디저트도 맛있는 망원동카페 리벌티 망원,"#망원동카페 #망원동디저트 #망원동커피 #망리단길카페 정말 좋고 맛있는 원두를 사다가 매일 집에서 핸드드립으로 내려 마시는 요즘 동네 카페를 가는 일이 정말 드물어졌다. 그래도 이번에는 비교적 텀이 짧아서 2~3개월 만에 카페 다시 간 것 같은데 ㅎㅎ 나 원참 이런 시국이 올 줄이야! 망원 연남 상수 광흥창 등 크게 다 돌고 오는 동네 산책에서 발견한 망원동카페 리벌티 망원 디저트도 맛있는 망원동카페 리벌티 망원 글과 사진_ 사려깊은 고양이 망원동카페 망리단길카페 리벌티 망원 차분하고 감각적인 카페 분위기 한 2주 정도 산책 하면서 봤는데 주말에는 대부분 사람이 많은 것 같아서 평일 저녁 조용한 시간에 다녀왔다. (뭐 요즘 어디나 주말엔 사람이 많지) 망리단길분위기좋은카페 리벌티 망원 메뉴 및 가격 우리가 주문한 것은 핑크솔트 아인슈패너 / 7,500원 애플망고 에이드 / 6,000원 딸기 크림치즈 브리오슈 / 8,000원 원두 선택할 수 있고, 구매도 할 수 있고 아메리카노 리필 되지만 (1,500원) 핸드드립은 안 하신다. 괜찮아, 나와서는 핸드드립 안 마시니까 ㅋ_ㅋ 쿠키는 옆에 진열된 것을 보고 고르면 되고 다른 메뉴들은 메뉴판 옆 탭을 터치해서 확인할 수 있다. 실제 메뉴 사진을 보고 고를 수 있는 곳이라 얼마나 좋던지! 요즘 주변에서 계속 확진자 발생하고 있어서 자리에 앉기 전 손소독은 필수! (다행히 나는 오늘자 병원 신속항원검사까지는 음성이다) 이걸 찍은 이유는 카페 아이템들이 상당히 괜찮아서임. 실내 분위기도 그렇고 사장님 쫌 감각 있으신 것 같음. 기다리는 동안 요런 동영상도 찍어보고요? 핸드폰 바꾸고 나서 동영상 촬영 시 손떨림 보정이 좀 되니까 찍을 맛이 난다. ^^ 좌우에 사람 없었으면 좀 더 폭넓게 담았을텐데 나 혼자 전세낸 거 아니니까ㅎㅎ 커피머신은 씨메 쓰시는구나 우리가 주문한 것들이 나왔다. 리벌티 망원 핑크솔트 아인슈패너 아마도 식용일 장미가 올려져 있다. 차마 먹지는 못했는데 식집사라서 그런 건 아님ㅋㅋ 직접 만드신다는 생짠생짠의 크림 취저! 좀 퍼먹다가 커피랑 마셔야지 했는데 커피랑 마시다가 다시 크림만 퍼먹은 1인 ^^ 우리집 히말라야 솔트는 그저 고기에만 뿌려지는데 망원카페 리벌티 망원에서는 출세해서 커피에도 다 뿌려지고ㅎㅎㅎ 리벌티 망원 핑크솔트 애플망고 에이드 완전히 섞이지는 않도록 살살 해질무렵 노을처럼 섞어주기 (마실 때는 다 섞었다고 한다) 애플망고와는 상관 없지만 망고를 올리기는 어려우니 앱쁠ㅎㅎ 리벌티 망원 딸기 크림치즈 브리오슈 다녀오신 분들의 상당수가 이게 맛있다고 해서 시켜봤는데 역시 맛있다. 동행인은 크림이 묵직해서 취향 아니라고 했는데 그 크림 내가 거의 다 먹은 듯ㅎㅎ 아인슈패너 크림 다 퍼먹고 브리오슈 크림치즈 다 퍼먹고 안 느끼하냐고 물어보는데 난 안 느끼해, 더 먹을 수도 있어! 보통 카페나 레스토랑에서 예쁘고 자그마한 식기류는 많이 도둑맞는 편이어서 유명한 곳 아니면 대부분 기본 커트러리 쓰시는데 장네론 라귀올 커트러리 :) 아, 꿀벌 나오게 찍었어야지 왜 뒤집어놓고 찍었냐, 과거의 나야? 매미 아님 주의 모양이 좀 그래도 나름 꿀벌이라고ㅋㅋㅋ 아니 근데 매미라는 사람도 많아서 이젠 나도 헷갈림. (사실 이것도 탐났다) (회사에서 쓸 거 필요한데 이거 예뻤) 안쪽에 반죽기가 있던데 브리오슈도 직접 만드시나... 에이 설마, 쿠키 정도만 만드시겠지? 대놓고 숨어있는 딸기잼과 딸기 이번 달엔 피오니케이크부터 딸기브리오슈까지 과일 생딸기 빼고 디저트로만 먹는 중ㅎㅎ 퇴근길에 들러 사람 거의 없는 거 보고 잠깐 들어가서 앉아 있었는데 우리 들어오고 한 30분 지나니까 자리가 다 찬 것 같아서 일찌감치 일어났다. (망원시장 들러서 먹을 것도 사야 하고) 모처럼의 카페방문이지만 요즘 주변에서 슬슬 확진자 나오고 있어서 사실 밖에 다니기 쵸큼 무서움ㅎㅎ 이번 달에 한 번 갔으니 또 한동안 참아야지 이 날의 득템식물 모초진에서 다들 스벅 로즈마리를 키우길래 나도 로즈마리는 데려와서 물꼬 중이고 식용장미는 버려두고 왔다. 키우기까지 성공하면 잘라서 사장님 드려야지ㅋㅋ Liberty 망원(@liberty_mangwon) • Instagram 사진 및 동영상 팔로워 1,827명, 팔로잉 531명, 게시물 84개 - Liberty 망원(@liberty_mangwon)님의 Instagram 사진 및 동영상 보기 instagram.com 리벌티 망원 서울특별시 마포구 포은로 108 1층 리벌티 망원 인스타그램 https://instagram.com/liberty_mangwon 주소 : 서울 마포구 포은로 108 전화번호 : 0507-1361-3877 영업시간 : 매일 11~23시 + 분위기 굳, 디저트와 커피 굳 :) 일부금액만 제공 받고 나머지는 #내돈내산"
"망원동카페, 망원데이트코스로 좋은 디저트 맛집 '리벌티 망원'","친구 생일겸 중간쯤에서 만나 놀기로 했어요~ 날이 너무너무 좋아서 공원을 가자!! 라고 해서 인천사는 친구와 중간인 망원으로 고고 커피 한 잔 마시구 공원가기로❣️ 예전에 망원에 잠깐 살았어서 또 아는 동네같구 그르네영!? ㅎㅎ 망리단길도 한창 핫했었는데 요샌 성수죠..? 유행이 확확 바뀌는 것두 신기하구요 ㅎㅎ (저번 포스팅에 분명 반말한다고 했는데... 너무 어색하네 하하) 망리단길도 예쁜 카페가 많은데 제가 간 곳은 생긴지 오래되지 않은 갬성 넘치는 곳이었어요 제가 다녀온 곳은 '리벌티 망원'이에요 친구랑 오랜만에 만나니까 아아 말고 라떼말고 뭔가 특별하고 비쥬얼 좋은 거 먹고싶다 해서 고른 곳이에요 고고 리벌티 망원 Time) 월 11:00 - 23:00 Call)070-8860-3877 리벌티 망원 서울특별시 마포구 포은로 108 1층 망원시장 밖으로 나와서 .. 옆 길쪽에 있어용 망원은 골목골목 맛집이 있어서 뭐라고 설명을..!! 망원시장에서 멀지 않은 곳에 위치해 있습니닷 망원동 카페답게 입구부터 갬성 뿜뿜 건물도 새 건물이라 전반적으로 세련되고 깔끔한 느낌 건너편에 보이는 맛집 줄~~ 하지만 궁금해하지 않았다고 한다~~ 내부샷 왜케 나 공장처럼 찍어둔거징 ㅋㅋ 내부 벽이 한 쪽은 어둡고 한 쪽은 벽돌이라 대비되면서 넘 무겁거나 차갑게 느껴지지 않았어요 가운데 설치미술 같은 느낌의 공간..? 사실 무얼 표현하고 싶은 건진 정확히 모르겠으나..! 중간에 사람들이 몇몇 못보고 밟는 듯 했음 ㅎㅎ 🤣😳🤣😳🤣 쿠키 비쥬얼... ㄷㄷ 쿠키비쥬얼에 이끌려 메뉴판 앞으로 저런 뚱땡이 쿠키들이 요새 많은 거 같아요 엄청난 칼로리를 자랑 할 것 같아서 안먹었었는데 부산 친구가 선물해준 뒤로 세상이 이렇게 맛있는 것이..!! 하면서 칼로리고뭐고 잘 먹고 있다눈거🤭 메뉴판 커피종류와 시그니처라떼 차, 에이드와 뱅쇼싸지 하나하나 다 맛있어 보이는 메뉴들 그 중 시그니처가 넘 눈에 띄어서 둘다 시그니처라떼로 주문! 비쥬얼에 끌려 쿠키를 먹으려 했는데 메뉴판 옆의 패드 사진 보고.. 디저트로 맘을 바꿨어요 ㅎㅎ 블루베리 크림치즈 브리오슈! 이 비쥬얼보고 안 시킬 수 있겠냐구요 ! ㅎㅎ 티슈 놓는 것도 갬성 세련된 갬성 나한테 없는 갬성 🦦 ㅎㅎㅎㅎ어떤 커피를 시키든 원두를 선택할 수 있어요 저희는 둘다 고소함이 강한 원두를 선택했어요 이제 옆 테이블에 자리를 잡아봅니다 사장님들이 남자분들이었는데 블랙블랙한 갬성이신 거 같아요 ㅋㅋ 망리단길 카페에 왠지 하나쯤 있을 법한 어머 사장님 잘생겼대!! 이런 카페 ㅋㅋ 사실 사장님 얼굴 못봄... 얼굴 기억 못하는 st ㅎㅎ 원두도 판매중이엇구요 우산꽂이마저 느낌있~네 망원동카페 올만하죵..? 요새 성수만 있었더니 망원카페 오니까 또 새롭네요 ㅎㅎ 다 쓴 디퓨저. 디퓨저 채워주세요! 예쁜 달력도 함께 WOW 나옴 나옴 와 비쥬얼 어쩔.. 컵도 이뻐요 리벌티 망원이라고 찍힌.. 근데 왜케 갬성적이야 약간 그 딥티크 같기두 하구요 제가 주문한 건 로투스 크림라떼 / 7,500 요런 라떼는 첨 먹어봤는데 너무 달까봐 걱정햇는데 크림이 정말 너무너무 고소해요! 무슨 크림인건지 그냥 생크림이 아닌고 같은데.. 빈속으로 왓었는데 든든한 느낌이구요 땅콩라떼 같은 고소한 느낌 :) 헐 맛있오!! 이렇게 말하게 되는 라떼 맛이에요 망원동 디저트 맛집 할만하네요 저는 양도 맘에 들었어요. 컵이 아주 작은 편은 아니어서 한... 400ml는 되는 것같은 용량 스벅 그란데 사이즈는 될 것 같아요 ㅎㅎ 친구가 주문한 메뉴는 핑크솔트 아인슈페너 / 7,500 기본 아인슈페너에 예쁘게 생긴 핑크색 크림과 솔트가 올라가서 단짠단짠 ! 친구두 맛있다고 ~ 컵도 넉넉해서 좋았어요 ㅎㅎ 스푼의 끝이 귀여워서 한 컷 여러분 이거보세요 망원동디저트 맛집. 뉴 맛집 당첨이요 망리단길 데이트하시러 오시는 분들 요거 맛있어서 지나치면 안대유 블루베리 크림치즈 브리오슈 / 8,000 사실 베이커리류는 맛있다 or 맛없다 정도만 알지 브리오슈는 어떻게 만들고 이런거 크게 관심이 없어서 ㅎㅎㅎ 그냥 모 빵위에 크림 얹어주는 아는 맛이겠지~ 기대 1도 없었는뎅 뭐여 이거 왜 맛있어 ㅎㅎㅎ 물론 촉촉한 브레드 + 크림치즈 + 쨈 + 블루베리까지 절대 맛없을 수 없는 조합이겠지만 먹는 끝까지, 많이 느끼하지도 않고 블루베리 하나씩 올려먹으니 상큼하기도 하구 맛있었어요 와구오구- 지금 봐도 침 나오는 비쥬얼.. 크림치즈는 모 사랑이쥬 :) 친구랑 정말 시간가는 줄 모르고 떠들다가 나왔어요 ㅎㅎ 저희가 일찍 도착해서 들어갈 땐 두팀이었는데 수다를 멈추고 돌아보니 들어올 팀이 기다리더라구요 언능 정리하구 나왔어용 망원동데이트코스로 망원카페 찾아서 많이 오시는 거 같은데 새건물에~ 망원동에 힙한 분위기좋은 카페 찾으시는 분들 리벌티 망원가서 드셔보세용 친구 왜 목석이야 왜 뻣뻣해 ㅎㅎㅎ 바람이 불었지만 날이 너무너무 좋았던날 :) 저희는 망원시장에서 먹을 걸 사고 맥주도사서 망원한강공원으로 향했답니다~ #망원동카페 #망원동디저트 #망원동커피 #망리단길카페 #망리단길디저트 #망리단길커피 #망원동맛집 #망리단길맛집 #망리단길분위기좋은카페 #망리단길데이트 #망원시장감성카페 #망원커피맛집 #망원데이트코스"
