title,content
망원동 마이멜로디와 쿠로미 만나러 카페하모니,"오늘은 광복절이에요 외출은 하지만 아이와 함께 광복절에 대해 알아보았어요 며칠 전 첫째가 광복절에 대해 물어보더라고요 아이의 생각을 묻고 남편이 답을 이야기해 주고 책을 찾아보았어요 그리고 작년에 태극기를 구매했으니 태극기 다는 날에 태극기를 달아야겠죠?! 어릴 적 아빠와 함께 공휴일에 태극기를 달았는데 이제 제 아이와 함께하네요 ~ 아이도 크면 저처럼 달겠죠?! 태극기 달면서 잠깐이지만 뜻깊은 시간을 보냈어요 폭풍 검색을 하는 뚜벅이 J 엄마는 작년 첫째 친구들의 언니들이 있어서 산리오 대해 관심을 갖고 산리오 카페를 알아보다가 잠시 잊고 있었죠 그러다가 지난달 망원동에 생겼다는 소식을 늦게 접하고 방학 때 가려고 알아보니 예약제에 빈자리 예약 잡기가 어렵더라고요... ㅠㅠ 7월 빈자리 예약 잡기를 포기하고 8월 예약을 리버스 클럽과 카페하모니 예약을 했는데 맙소사... 가는 날이 장날이라고... 태풍 때여서 아쉽지만 포기하고 그때 예약하면서 15일 것도 예약을 해놓은 상태라 취소 안 하길 잘했다면서 오늘 뚜벅이는 출발했어요 예약 방법 카페하모니 예약은 카페하모니 인스타그램에 올라와서 확인 후 캐치테이블 앱이나 웹사이트에서 하면 돼요 카페하모니 앱에서 예약 날짜, 인원, 시간을 선택하고 예약하면 끝! 급 가고 싶을 때 확인하면 종종 예약 빈자리가 있기도 해요 1인 1매 (인원수 1인 ~ 4인 선택 가능) 5인 이상 이용 시, 일행분의 다른 ID 계정으로 추가 예약하면 돼요 주차는 불가합니다 (주변 공영주차장을 이용해 주세요) 동네 골목이다 보니 주차 공간이 없긴 해요 ㅠㅠ 카페하모니 서울 마포구 동교로 9길 12 지층~1층 카페하모니 매일 11:00 - 20:00 (19:00 라스트오더) 0507-1391-9025 외부 1층 외부에 뜨거운 햇빛을 잠시 잊고 곳곳에 사진을 찍었어요 내부 1층 1층은 예약 없이 자유롭게 이용 가능 2층 카페는 사전 예약 후 이용 가능 먼저 1층에 카운터에서 대기표를 교환해요 신분증 확인과 캐치테이블 예약 화면을 보여주면 대기표를 받아요 전 무조건 첫 타임 오픈런입니다 ㅎㅎ 작년에 몇 번 오후에 갔다가 저랑 안 맞더라고요 일단 오픈런하고 집에 와서 쉬자인데 어느 날은 오픈런하고 늦게까지 놀기도 하는 오류도 생긴답니다 ^^::: 1층 왼쪽에는 베이커리 모형과 소품들이 있는데 아기자기하고 너무 귀엽고 예뻤어요 ㅎㅎㅎ 1층 오른쪽에는 MD 스토어가 있어요 다양한 마이멜로디와 쿠로미 상품들만 있어요 사고 싶은 것들이 있었지만 꾸~욱 참고 아이들은 인형을 골랐는데 집에 인형을 산 건 한두 개인데 왜 넘쳐나는 인형들인지.. 그래서 패스했어요 내부 2층 5분 전 대기표와 함께 입장했어요 계단으로 올라가면 키오스크가 있어요 자리를 맡아야 한다는 앞 분의 이야기를 듣고 일단 입장했어요 가정집 같은 분위기에 거실? 엔 단체 손님이 앉을 수 있는 자리가 있으며 방은 총 3개 있어요 방마다 분위기가 다르고 의자도 달라요 저흰 마이멜로디 방에 앉았어요 번호표와 함께 받은 거예요 키오스크는 입구에도 있고 거실 쪽에도 있어요 카카오페이 바코드 결제는 입구 쪽에 가서 해야 해요 시원한 얼음 물도 있어요 가격이 착하지는 않아요 마이멜로디 쿠키를 2개 골라서 쿠로미 쿠키를 하려다가 마이멜로디 샌드로 결정했어요 딸기라떼 8,200원 마이멜로디 쿠키 4,000원 마이멜로디 쿠키샌드 5,000원 딸기라떼 위에 마이멜로디 귀 2개 쿠키는 눅눅했고 생크림인지 무스가 있는데 첫째는 싫어하고 둘째는 좋아했으며 쿠키는 그저 그랬고 쿠키샌드는 쿠키보다 천원 비싸기만하고 작고 맛... 이 없었어요 딸기라떼 시켰으면서 얼음 물 달라는 아이들이였어요 ㅠㅠ"" 자주 카페를 안 다녀서 그런건지 카페를 싫어하는건지.... 알 수 없는 아이들이에요 아이들이 장소가 작고 맛이 그저 그렇다고 했어요 공간이 넓지 않아서 소곤소곤 이야기했어요 음식들이 비싼데 이용 시간이 너무 짧아서 아쉬웠어요 캐릭터 값이고 아기자기 소품 구경했답니다 한 번쯤 가볼 만한 곳이에요 두 번은 아니에요 카페하모니 서울특별시 마포구 동교로9길 12 지층~1층 카페하모니"
카페하모니 망원동 산리오카페 내돈내산 후기 뭐랄까,"카페하모니 망원동 산리오카페 내돈내산 후기 뭐랄까 안녕하세요 7살, 5살, 4살 삼남매를 육아하고있는 홀릭이에요:-) 큰딸아이가 산리오덕후여서 이번 여름방학에 산리오 러버스 클럽을 데려다주려했는데 어찌 여긴 예약불가.. . ;; 또르르... 운좋게 이모찬스로 카페하모니 산리오카페 예약은 무사히 성공! 둘만의 데이트였는데 갑작스런 저의 일정취소로 삼남매 다함께 동행하게 되었어요ㅎㅎ  카페하모니 다녀왔어요 주차정보 결론은 주차장 없습니다.❌️❌️ 망원역에서 도보로 약 10분정도 골목사이로 들어가면 보이는 카페하모니. 주차장이 없어서 얼마나 고생을 했던지ㅠ 갑자기 소나기도 내리고 평일임에도 인근 주차장 자리도 없다는게 함정. 서울까지 한시간을 운전해서 왔는데 아이셋을 데리고 빗속을 걸어가려니 시간도 늦고 정말 시작부터 하~하는 순간이었어요ㅠㅠ 시간예약을 하고 와야하는데 캐치테이블 통해 예약했구요 4시타임이었는데 20분이나 지각ㅠ 4시~5시 딱 한시간이용제이기 때문에 이용시간이 줄어드는 것뿐.. 늦으면 손해예요.. 예약은 2층 카페이용만 해당되고 1층 굿즈샵은 예약없이도 방문이 가능해요 1층 소품샵 들어서기전에 입구에서부터 마이멜로디와 쿠로미가 반겨줘요 아이들 사진한장씩 찍어주고 첫째는 바쁘게 이모랑 2층카페로~ 당일예약은 안되구 두 아이들은 소품샵에서 사진찍으며 고작 30분인데도 살짝 무료하게 기다렸어요 굿즈샵 둘러보는건 10분내외면 끝. 이 날 소나기가 내려서ㅠㅠ 바깥의자 이용도 안되구 아쉬웠어요!! 1층 굿즈샵을 들어서면 중앙카운터를 기준으로 오른쪽과 왼쪽공간으로 나뉘는데 오른쪽은 굿즈공간. 왼쪽은 아직 오픈하지않은 베이커리공간이예요.  카페하모니 굿즈샵 큰딸아이가 보면 탐낼만한 굿즈들이 많이있어요 가격은 그야말로 정말 사악했어요ㅠㅠ 그래..!;;; 돈 쓰러온거니까...ㅎㅎㅎㅎㅎ 4살 막내딸은 그저 해맑음 아직 산리오까진 흥미가 없어서 다행이라고 해야하나..? 싶었던ㅋㅋㅋ 한켠에서 나는 공주~ 빙글돌고 정말이지 자유로운 O형의 피가 좔좔ㅎㅎ  망원동 카페하모니 산리오 베이커리 반대쪽 베이커리공간으로 들어서면 작지만 너무 예쁘고 아기자기한 소품들이 준비되어있어요 너무 예쁘죠 여긴 딱 애미취향ㅎㅎㅎ 개인적인 취향에 삼남매의 최고의 포토존이 되어주었던 공간이었어요~ 엄마와 우리 삼남매, 너무 예쁘죵❤️ 벽마저도 귀욤이 뚝뚝. 굿즈샵에서 큰딸래미 사준 펜12.0 가방 25.0 총 37,000원 굿즈 3만원이상 구.매시 랜덤코스터 증정! 여자 아이들에게 산리오란..❤️ ㅎㅎㅎ 2층 카페로 가볼까요 1층에서 예약확인후 번호표 순서대로 입장인데 이때 신분증 필요합니다. ( 사전예약자는 테이블매트를 선물로 줘요 ) 카페하모니 2층 총 50분 카페이용인데 비맞고 20분에 겨우 도착한 딸아이도 부랴부랴 입장완료. 입장제한이 있어서 남은 30분만 이용해야하는건 어쩔수 없다나봐요ㅠㅠ 딸아이가 올라가자마자 보고 너무 좋아했던 산리오카페. 조카바라기 이모가 짱이다!! 주택을 개조한 카페이고 방3개와 거실로 이루어져있어요. 아이들이 좋아할 인테리어보단 엔틱한 느낌이 강한곳에 캐릭터들이 있는 느낌!? 장소는 그닥 넓거나 하진않아서 돌아가면서 바쁘게 사진찍어주시느라 분주한 부모님들...ㅋㅋ 첫번째로.할 일. 주문보다 < 자리잡기 부터 하시길!!!! 올라가자마자 보이는 키오스크덕분에 자리안잡고 우물쭈물 주문줄 서있기 일쑤래요 일행이 있다면 나눠서 자리잡기 - 주문하기로 똑똑하게!^^ 1인 1음료 주문이 원칙이고 키오스크에서 주문가능해요 딸기라떼 8,200원 쿠로미 케이크 15,000원 ㅎㅎㅎㅎ 곳곳에서 사진 포즈 제대로인 울 큰딸^^ 마지막까지 아쉬워 사진에 담기. 아이가 행복해하는 모습보니 다사다난했지만 이모뿌듯 맘뿌듯ㅎㅎㅎ 산리오 러버스클럽 꼭 예약해주겠어! 그땐 더 제대로 만끽해보자!❤️❤️❤️ 이상 내돈내산? 카페하모니 마이멜로디x쿠로미 와 함께했어요. 50m © NAVER Corp. 카페하모니 서울특별시 마포구 동교로9길 12 지층~1층 카페하모니"
"망원동 카페하모니 쿠로미 마이멜로디, 예약방문","망원동에 있는 #쿠로미 #마이멜로디 카페에 방문해보았다. 위치는 망원역 근처에 있는 #카페하모니 요즘 산리오캐릭터에 빠져있다 1층은 굿즈샵 2층은 카페인데 카페이용은 예약하고 방문할 수 있다 카페 하모니 쿠로미와 마이멜로디가 환상의 케미를 선보이며 준비한 F&B와 두 친구의 사랑스러움만 가득 담긴 GOODS까지! app.catchtable.co.kr 예약은 캐치테이블 통해서 한 아이디당 4명까지 예약 할 수 있어서 친구들이나 아이들 데리고 방문하기 좋다. 이렇게 마이멜로디, 쿠로미 캐릭터가 카페 곳곳에 있어서 전체가 다 포토존이고 너무 귀엽다~~~ 가정집을 개조해서 만든 카페라서 2층은 왠지 옛날집같은 빈티지한 느낌도 들고 방, 거실 등으로 자리가 나눠져 있어서 예쁜자리에 앉고싶으면 빨리 가서 줄서는게 좋다 흑임자라떼 8,200원 딸기라떼 8,200원 까눌레 8,500원 푸딩 9,000원 여기 가격이 전체적으로 많이 비싼편이다 우리는 골고루 먹어보고 싶어서 주문했고 남기기 아까워서 다먹고 나서 배가 너무 불렀다. 사진찍으려고 작은쿠로미 인형도 챙겨갔다 곳곳에 포토존이 많아서 사진찍기 좋고 소품들 구경하기도 좋다 망원동 데이트, 아이들 데리고 놀러가거나 캐릭터 좋아하는 친구들끼리 가기 좋다 자리마다 사람들이 앉아 있어서 주변 장식을 찍기 쉽지 않은데 퇴징하기전에 빠르게 찍고 나왔다. 내부는 조금 어두운 편이고 옛날 다방 같은 느낌도 난다 벽지도 멀리서보면 약간 촌스러운데 가까이서보면 쿠로미, 마이멜로디 무늬였다 1충 내려와서 굿즈샵 구경. 굿즈도 다양하게 인형이나 문구 용품 등등 있었는데 가격이 너무 비싸서 그냥 구경만 했다 여기 아이들 데려가면 사달라고 떼쓸지도 모르겠다 ㅎㅎ 딱히 필요한 건 없어서 이렇게 귀여운게 있구나 구경만 했다 1층에도 포토존처럼 꾸며진 곳이 있고 다 모형인데 맛있어보였다 기념으로 포토카드 뽑았다 뒷면 도안은 4가지 랜덤으로 나오고, 앞면 프레임은 선택할 수 있고 원하는 사진을 엏을 수 있다 야외에도 사진찍을 공간이 많아서 날씨 맑을때 가면 사진에도 이쁘게 나온다 쿠로미, 마이멜로디 모양 꽃이 이뻤다 멀리서보면 이렇게 생겼고 다른 캐릭터들도 조금씩 있어서 전체적으로 귀여운 구경거리가 많았다 카페하모니 서울특별시 마포구 동교로9길 12 지층~1층 카페하모니 CAFE HARMONY 카페 하모니(@cafeharmony_official) • Instagram 사진 및 동영상 팔로워 9,154명, 팔로잉 2명, 게시물 62개 - CAFE HARMONY 카페 하모니(@cafeharmony_official)님의 Instagram 사진 및 동영상 보기 www.instagram.com"
망원동 카페하모니,망원동은 카페천국이다. 수많은 카페가 생기고 없어지고를 반복한다. 오래오래 맛있는커피를 내리는곳도 있고 맛있는커피를 피치못할사정으로 폐업해서 마시지 못하는 카페도 많다. 카페하모니 서울특별시 마포구 동교로9길 12 지층~1층 카페하모니 가다 걸렸다. 망원동역 뒷편을 걸어가다가 마이멜로디 입간판이 보이는데.... 새로 생긴 카페하모니라는 곳이였다 카페는 크다. 예전에 여기 주택이였던거같은데 주택을 트고 카페를 만든거 같다. 마당엔 사진찍을수 있게 거울도 있고 마이멜로디 쿠로미친구들포토존이 양옆으로 있다. 딸이 쿠로미 정말 좋아하는데 이쁘다이쁘다 노래를 부른다. 1층은 쿠로미 마이멜로디 소품샵이있고 2층은 카페다. 쿠로미와 마이멜로디 소품이 정말 많다. 문방구에서 보는것보다 종류도 많고 상품도 다양했다. 하지만 가격은 쫌 비싼편이였다. 여기는 1층베이커리샵인데 아직 빵은 안보이고 모조품으로 전시되어 있었다. 우측 계단으로 올라가면 2층이 나오는데 전체적인 인테리어는 우드로 되어있으며 쿠로미와 마멜친구들이 반기고 있다. 키오스크로 주문하면된다. 포토존이 정말 많다. 집에서 보이는 물품도 있었고 ㅋㅋㅋ 좌석도 은근많았다. 일요일이라 사람들이 많을거라 생각했었는데 사람들이 생각보다 적었다. 신상카페라서 소문이 안났나 생각했는데 얼마전까지만해도 예약이 필수였다고한다. 지금은 예약없이 바로 방문이 가능하다. 이미 카페를 다녀온후라 음료는 안마시고 구경만했지만 음료는 약간 비싼느낌이 들었다. 주차는 공영주차장에 해야되고 예약은 따로 필요없다. 지하철이나 버스를 타면 큰도로변 바로 뒷편에 있어 편할거 같다. 이상 카페하모니 다녀온후기이다.
망원동 카페하모니 주말에 딸과 데이트하기 좋아요,망원동 카페하모니에 주말 찬스로 딸과 둘이 데이트하러 왔어요 근처에서 밥 먹고 카페하모니가 망원동에 있다는 소식에 찾아갔는데요 이렇게 좋아할 줄 알았으면 진작 왔을걸 미안한 마음이 들더라고요 위치 서울 마포구 동교로 9길 12 지층~1층 카페하모니 망원역 2번 출구 영업시간 월 ~ 일 / 11시 ~ 20시 19시 라스트 오더 예약 가능 카페하모니 서울특별시 마포구 동교로9길 12 지층~1층 카페하모니 입구에서 사진 한 방 찍어줘야죠 딸이 좋아하는 쿠루미와 한번 찍더니 옆에 있던 멜로디가 섭섭할까 봐 찍어야 된다며 아직은 순진한 딸입니다 손에 들고 있는 건 아래쪽에서 알려 드릴 테지만 도착하자마자 입구 열고 들어가서 이미 손에 쥐고 있던 쿠루미 열쇠고리예요 망원동 카페하모니는 입구 마당이 포토존처럼 잘 꾸며져 있어 아이들이 안전하게 촬영할 수 있게 되어있어요 표정은 아름답지 않지만 쿠루미만큼 개구진 딸의 모습은 귀엽게 봐주세요 ㅎㅎ 아직은 한가해서 둘러보고 나오기 좋았지만 시간이 지나니 식사하고 예약한 분들이 아이들과 함께 혹은 친구들과 입장하기 시작하시더라고요 그래서 웨이팅 의자가 많았던가 싶어요 QR코드로 사진을 넣고 꾸민 후 포토카드를 뽑는 자판기도 있고 일본에 있는 산리오 매장이 온듯한 느낌이에요 드디어 딸의 최애 존 그녀의 물욕이 샘솟는 악세라리 산리오팬시가 있는 기념품 코너입니다 정말 엄청 많은 산리오 인형이 손짓을 하는데 어른인 제가 봐도 이쁜데 아이들은 얼마나 갖고 싶을까 싶어요 그녀의 갈등이 시작되는 곳이죠 그런데 의외로 인형은 싫고 작고 소중한 사이즈의 피규어를 좋아하는 딸이라 중간중간 미끼처럼 진열되어 있는 쿠루미키홀더를 찾고 있더라고요 마이멜로디부터 쿠루미가 많았고 시나모롤도 중간중간 보였어요 망원동 카페하모니는 아마 멜로디와 쿠루미가 주 메인 캐릭터인 것 같아요 시나모롤을 좋아하는 아이라면 조금 실망할 수도 있으니 충분히 검색해 보시고 가시면 좋으실듯해요 이렇게나 이쁜 인형을 뒤로하고 저 작은 쿠루미키걸이에 꽂힌 딸에게 감사 인사를 전하고 싶어요 고맙구나~ 인형들은 비용이 만만치 않고 다 아시는 헉 소리 나오는 그런 수입인형 금액이예요 오히려 엔화가 떨어져서 직접 가서 구입하면 이것보단 조금 저렴하지 않을까? 하는 생각을 잠시 해봤어요 아... 가고 싶다 1층에 넓다면 넓게 산리오에 관한 여러 가지 팬시용품들과 소품이 많아 어른들도 아이들도 구경거리가 많아요 예약을 하지 않고도 카페말고 소품샵은 언제든 편하게 구경할 수 있다 하니 참고해서 방문해 보시면 좋으실 거예요 카페는 예약을 하시고 오시는 것 같았어요 아이와 망원동 하모니카페를 검색중이신 부모님들께 작은 도움이되길 바라며 이만 글을 마무리 하겠습니다
카페하모니 예약 및 후기 / 망원동 아이와 가볼만한곳,"카페하모니 예약 및 후기 / 망원동 아이와 가볼만한곳 지난달에 다녀왔던 망원동! 나들이! 아이와 가볼만한곳이 많더라고요. 매번 홍대랑 용산만 다녔는데 망원동 망원시장을 넘 가고싶어서 알아보다가 알게된 #망원동아이와가볼만한곳 지금부터 시작합니다! 아동연극 / 하땅세극장 : 고래바위에서 기다려 솔직후기 울 신쒸꼬꼬마들이 여름방학 했자나요~ 다음주면 ...개학!! 얏호! 워킹맘 엄마라 평소에도 평일엔 함께하기... blog.naver.com 이건 망원동 나들이 가기 전 공연을 보러갔을 때예요. 2시 공연보고 망원동으로 넘어가서 즐기던 신쒸꼬꼬마들 산리오 러버스 클럽 예약 홍대 아이와 가볼만한곳 산리오 러버스 클럽 예약 및 솔직후기 탱글이가 너무너무 좋아하는 산리오 몇달전 탱글이가 산리오카페에 ... blog.naver.com 홍대 시나모롤 카페 / 시나모롤 스위트카페 다녀왔어요. 울 탱글이가 좋아하고, 엄마도 좋아하는 산리오 엄마는 마이멜로디가 좋은데 울 탱글이는 다~ 좋다고 하다... blog.naver.com 첫 시작은 산리오를 좋아하는 울 탱글! 홍대에 산리오 카페가 있다며 산리오 러버스 클럽을 시작으로 시나모롤 카ㅔ에도 다녀왔쥬 그러다 망원동에 카페하모니가 생겼다는 정보를 입수! 이왕가보는거 다~ 가봐야지! 카페하모니는 홍대가 아닌 망원동! 마포에 있습니다. 주차장은 없으니 망원시장에 주차비 내고 이용하셔도 되지만 대중교통이 제일 좋을 것 같아요. 망원시장도 대박! 이었어요. 주차대란 ㅋㅋㅋ 카페하모니 예약 및 후기 / 망원동 아이와 가볼만한곳 카페하모니는 실외에 사진촬영을 할 수 있는 포토존이 많았어요. 2층은 예약하는 카페라 시간이 아직 남아서 1층 실외와 실내 기프트샵에서 시간을 보냈습니다. 카페하모니 예약 및 후기 / 망원동 아이와 가볼만한곳 1층 매장 오른쪽에 보면 2층 카페 올라가는 곳이 보이고, 의자도 있네요. 비가 오다 안오다 해서 실외에선 있을 수 없어서 비올땐 실내로 들어가 있었는데 너무 좁아서...기다리기가 좀 어려웠어요. 대부분 시간 맞춰서 온다는 직원말에...좀..속땅 ㅋㅋㅋㅋ 그래도 기다릴 수 있는 의자 몇 개 가져다 두면 좋을텐데 ㅋ 비도오고 카페 예약한 시간도 남아서 기념품샵에 들어왔어요. 생각보다 작더라고요. 그래도 아이들은 마냥 좋은 기념품 샵 여기 갔다가 망원시장도 가야해서 큰건 못사주고 ㅎ 문구류 하나씩 골라서 샀어요. 포토존인지 뭔 방인지는 모르겠지만 베이커리....가 잔뜩 모형으로 있는 방이예요. 비를 피하기 딱 좋은 장소 였ㄷ고나 할까 ㅎㅎㅎ 테이블리인가 예약하니 편하긴합니다. 시나모롤은 가서 해야해서 무진장 오래 기다렸는데 ^^;; 암튼, 성함이랑 신분증 확인하고 테이블매트랑 번호표를 줍니다. 그리고 예약한 시간 10분전 카페 입구에서 번호대로 줄을 서시오~ 우린 1번이라서 젤 앞에서서 입장 카페하모니 카페는 2층에 있었어요. 자리에 앉을때에도 고민고민 사람이 많으니 ㅋㅋㅋ 6인석은 따로 없었어요. 4인이 최대였고, 보조의자는 있었습니다. 메뉴주문은 키오스크로 스스로 해야합니다. 와우, 역시나 금액이...호달달 그래도 1인 1음료 및 디저트류라 주문을 해 보았습니다. 생각보다 맛있지는 않았던...카페하모니 예약 및 후기 남겨봅니다. 망원동 아이와 가볼만한곳으로 한번정도 와 볼만 했구요. 넘 아까워서...맛은..별루였지만 다 먹었어요. 카페하모니 예약 및 후기 / 망원동 아이와 가볼만한곳 계산서가 매우 사악하쥬? 요즘 카페가 다 이렇긴 합니다만...맛은 좀 더 있었으면 합니다. ㅋ 한번 와봤으니 ....이제...숙제 끝!? ㅋㅋㅋㅋ 산리오 다온거다! 망원동 아이와 가볼만한곳 중에 망원시장도 있으니 우리는 시장으로 고고! 걸어서 갈 수 있더라고요. 다음 포스팅에선 요즘 TV에 많이 나와서 궁금했던 망원시장 직접 다녀온 후기 보여드릴께요~"
"망원동은 신기해(카페하모니, 헤키)","망원동에 종종 갈 일이 생기고 있다. 아직도 좀 어디가 어딘지 모르겠는 기분이고 골목마다 늘어선 식당들이 다 장사가 되는 것도 신기한 동네. 얼마전엔 없었던 거 같은데 망원역 근처에 꽤 큰 규모로 쿠로미랑 마이멜로디 카페가 생겨서 구경했다. 카페 하모니,, 마멜이랑 쿠로미랑 하-모니를 보여주네 외관부터 완전 귀여움 들어가보고 싶게 생겼다. 들어가려면 줄 서야될줄 알았는데 그냥 들어가도 됨. 밥 먹을 거 아니었으면 카페 음료도 시켜보고 싶었지만… 굿즈샵 구경만 하고왔다. 포카 짱귀. 아이돌 사진을 들고 밥 먹을 때 사진찍는걸 요즘 MZ들은 예절이라구 하던데 아무튼 너무 귀엽다. 나도 좋아하는 아이돌이 있으면 사진 현상 한장쯤 하고 싶었다. 가격은 삼천원. 바가지 같기도.. 혜자같기도. 뭐 카페에서 즐거운 시간 보내고 아래에 내려와서 뀨~ 하는 사진 하나 갖고 있음 즐거울 거 같기두 하구. 다들 찍는 인생네컷처럼. 신기한 거는 이 물건들이 일본에서 만든 게 아니고 한국에서 라이센스 계약으로 만들어서 ㅋㅋ 디자인도 한국에서 하니까 일본에서는 못 산다는 거였다. 산리오가 라이센스 킹갓엠퍼러긴하지만 일본에서는 못 산다고 하니 새삼 재미나기도 하고. 일본 걸들도 한국에서 카와이! 하면서 사갈 수도 있다는 것이 재밌게 느껴지는 부분. 산리오 코리아 일 잘하넹 여기서.. 버려뒀지만 경제가 컨셉인 블로그니까 잠시 산리오에 대해서 알아보고 가면 산리오 산리오는 당연히 캐릭터 사업과 라이센스 사업이 주요. 시총 5조 4500억 정도(6257억 JPY) 매출 2022년 3월 4591억 -> 2023년 3월 6320억 순이익 2022년 3월 430억 -> 2023년 3월 1156억 영업이익(놀라움) 2022년 3월 38억 -> 1117억 Per 2023.3월 기준 64.12 주가도 퀀텀점프했다…. 2022.3월 2400엔 -> 23.3월 6200엔 -> 현재 11월 7023엔… 수많은 산리오 콜라보를 보면서.. 나는 왜 산리오 주식을 살 생각을 하지 않았는가 원통하다 흑흑 산리오코리아 검색해보니.. 더욱 놀랍다. 절대금액이 큰 건 아니지만 성장이… 직원들 인센 많이 챙겨주셨나요… 이래서 주변에서 뭘 좋아하고 뭘하고 다니는지를 잘 보는 것도 중요하지만 ’실천‘ 하는 게 중요하다. 아는 걸 잘하자. 그리고 밥 먹으러 헤키 갔다. 헤키 서울특별시 마포구 동교로9길 33 1층 헤키 인근 돈카츠 집 중에서 제일 핫한듯. 평일에도 대기가 있지만 회전율은 좀 빠른 편인 거 같다. 히레카츠가 주 메뉴같음. 나는 히레카츠보다는 기름진 로스 쪽이라 좀 선호도가 떨어지지만 튀김옷이 바삭하고 고기가 부드러움. 다만 살코기 맛이 좀 많이 나는데 뭐랄까.. 약간 고기향? 피맛? 이런 느낌이 난다는 점은 호불호가 갈릴 부분 같다. 양은 적은 거 같음. 물론 기준은 나… 고기 선도가 좋아보이는 예쁜 핑크빛 오랜만의 일기는 얼레벌레 끝나는 것이 정상이다 #망원동 #카페하모니 #망원동헤키 #헤키"
