title,content
망원동 카페) 망리단길 카페 소설원 망원,"망원동 카페) 망리단길 카페 소설원 망원 재생 128 좋아요 1 00:00 00:39  망원동 카페) 망리단길 카페 소설원 망원 망원동 카페) 망리단길 카페 소설원 망원 재생 46 좋아요 1 00:00 00:34  망원동 카페) 망리단길 카페 소설원 망원 - 2022년 10월 방문 기록 - 이번에 다녀온 카페는 망리단길 카페 소설원 망원 홍제동 소설원은 오픈하자마자 다녀왔고 8월에 망원점이 생겼다는 얘기를 듣고 궁금한 마음에 다녀온 거였다. 작은 눈이 내린 정원이라는 뜻의 소설원(小雪園) 망원은 주택을 개조한 4층짜리 카페였는데 홍제동보다 규모는 작은 느낌이었지만 역시 분위기는 꽤 좋은 곳이었다. https://blog.naver.com/dssa1020/222681233594 홍제동 카페) 작은 눈이 내린 정원 신상 카페 소설원(小雪園) - 2022년 3월 방문 기록 - 홍제동에 새로 생긴 카페 소설원(小雪園) 작은 눈이 내린 정원이라는 뜻의 신상 ... blog.naver.com 망원역 2번 출구에서 153m 거리에 위치한 소설원 망원 50m © NAVER Corp. 소설원 망원 서울특별시 마포구 월드컵로13길 22-3 메뉴 : 흑빵 아인슈페너 5,500원 주소 : 서울시 마포구 월드컵로 13길 22-3 전화 : 0507-1484-5565 영업시간 : 11:00 ~ 21:00 라스트 오더 20:30 할로윈이 다가오니 입구부터 할로윈 분위기인 소설원 망원 소설원 망원은 1층은 주방과 카운터 2층과 3층은 카페 라운지 4층은 루프탑 구조로 되어 있는데 주문을 위해 1층 안쪽으로 들어가면 된다. 망원동 카페 소설원 망원의 커피바와 안쪽의 주방 그리고 작은 정원 분위기가 느껴지는 곳 소설원 망원의 메뉴판 홍제동 소설원을 다녀온 게 3월이었는데 그때에 비해 메뉴가 굉장히 많아진 느낌이다. 메뉴판 앞에 진열되어 있는 세 가지 푸딩과 휘낭시에 그리고 네 가지 종류의 카스텔라 메뉴가 너무 많아져서 디저트는 어떤 걸 골라야 할지 한참 고민했다 ㅋ 주문을 하고 외부 계단을 통해 2층으로 올라갔다. 일본 교토 감성이 물씬 풍기는 소설원 망원의 2층 모습 주택을 개조한 소설원 망원은 공간 공간이 룸 형식으로 분리되어 있는데 2층은 사진처럼 대부분 좌식 형태로 되어 있었다. 둥근 창으로 보이는 좌식 테이블이 참 예쁘네. 그런데 평일 오픈 시간대에 방문했는데도 이미 두 테이블의 손님들이 2층에 자리를 잡고 있어서 다른 공간은 사진을 찍을 수가 없었다. 역시 홍제동보다는 망원동이 핫플인 거지 ㅋㅋ 사람 없는 곳을 좋아하는 1인이라 3층으로 올라가 보기로 한다. 3층도 2층과 분위기는 거의 비슷한데 3층은 좌식이 아닌 테이블석으로 되어 있었고 거실로 보이는 중앙 공간에는 이런 소품들이 진열되어 있었다. 3층 입구의 왼쪽 공간을 먼저 들어가 보면 둥근 창밖으로 보이는 뷰는 망원동 골목이라 그렇게 예쁘지는 않군요 ㅋㅋ 격자무늬 병풍이 있는 이 자리가 가장 마음에 들기는 했다. 내가 자리를 잡았던 공간 4인용 테이블 2개와 2인용 테이블이 하나 있었는데 테이블 간 간격이 꽤 넓은 편이라 좋았다. 3층의 다른 공간 두 곳도 아기자기하니 분위기가 좋다. 3층의 셀프 테이블도 조금 멋지군요 ㅎㅎ 화장실도 분위기 있었던 소설원 망원 루프탑을 보기 위해 4층으로 올라오니 여기도 양쪽으로 좌식 공간이 나온다. 망리단길 카페 소설원 망원의 대나무가 멋진 루프탑 내가 주문한 디저트와 음료를 들고 올라와 인증샷도 남겼고 홍제동 소설원은 루프탑에서 인왕산이 보였는데 망원점은 루프탑 뷰는 조금 아쉽다. 망원동 카페 소설원 망원의 주문 진동벨 복숭아 요거트생크림 카스텔라 쌀가루 카스텔라에 복숭아, 요거트생크림을 채워 차갑게 즐길 수 있는 상콤달콤한 카스텔라 복숭아 카스텔라와 옥수수 술빵 카스텔라 중 상콤한 게 먹고 싶어서 이걸 주문한 거였는데 부드러운 카스텔라도 상콤한 복숭아와 요거트생크림도 너무 맛있었다. 말차 푸딩 진한 말차와 우유의 풍미를 함께 느낄 수 있는 부드러운 식감의 푸딩 홍제동 소설원에서는 우유 푸딩을 먹어봐서 이번에는 말차 푸딩을 주문한 거였는데 역시 너무 부드럽고 맛있어서 조금 반했다 ㅎㅎ 소설 휘낭시에 세트도 조금 궁금했는데 홍제동에서 먹어봤기에 이번에는 주문하지 않았다. 초밥 도시락처럼 세팅되는 휘낭시에는 겉은 바삭바삭하고 속은 촉촉해 되게 맛있는 휘낭시에였다. 일본 교토 감성의 카페 분위기도 너무 좋고 정갈하고 동양적인 플레이팅의 디저트를 만날 수 있는 망리단길 카페 소설원 망원"
망원동 디저트 망원 소설원 비 오는 날 데이트,"망원동 디저트 망원 소설원 비 오는 날 데이트 비 오는 날 동양풍 감성 카페 소설원 망원 어제는 하루 종일 비가 내렸다. 오랜만에 동생 부부랑 카페를 다녀오기로 했는데, 어디 갈까 알아보다가 예쁜 동양풍 감성의 카페 소설원 망원에 다녀왔다. 여긴 동양풍 느낌의 카페고 망원동 디저트 맛집이라 함께 다녀오고 싶었다. 여기서 파는 디저트 중 우리 조카도 먹을 수 있는 맛있는 디저트가 있어 다 함께 다녀왔다. 그럼 망원동 디저트 카페 소설원 소개해야겠다. 동양풍 감성 카페, 이 카페는 동양풍 느낌이 카페라고 했다. 어떤 사람들은 도쿄 감성이라고도 하는데 카페 입구부터 느낌이 다르다. 우리는 비 오는 날 방문했는데 느낌이 더 감성적이었다. 비 오는 날 도쿄의 느낌은 이럴까? 조카가 있어 차를 가지고 이동했다. 카페 앞엔 주차할 수 없어 근처 공용주차장을 이용하면 된다. 비가 오는 날이라 카페 앞에서 내리고 제부가 주차하고 왔다. 메뉴를 보기 전 일단 우리는 자리부터 확인해 보기로 했다. 조카랑 함께 오게 된 게 다다미 방이 있어 아직 의자에 못 앉는 어린 조카도 함께 할 수 있어 다녀오게 됐다. 이 건물은 4층짜리 건물인데 전체가 카페 건물이다. 우리는 4층으로 올라갔다. 4층 다다미 공간이 2곳 있었는데 한쪽은 2팀-3팀 앉을 수 있는 공간이었고 한 곳은 1팀이 딱 맞게 앉을 수 있었다. 우리는 넓은 공간에서 다른 팀과 함께 앉았다. 어제는 비가 와서 그런지 루프탑 공간은 나가볼 수 없었다. 날씨 좋을 땐 루프탑 공간도 좋겠다. 제부가 오고 동생이랑 둘이 1층으로 내려가 주문을 했다. 여기가 한국 맞아? 소설원 망원 망원동 디저트 동생이랑 1층으로 내려가 주문하는데 여기 맛보고 싶은 디저트가 많았다. 어떤 디저트를 골라볼까 하다가 유명한 게 술빵 같아서 주문해 보기로 했다. 이제 조카도 첫돌이 지나 그런지 빵도 먹고 다른 간식도 먹을 수 있대서 동생한테 물어보고 푸딩도 하나 주문해 보기로 했다. 다른 푸딩보단 우유 들어간 푸딩은 괜찮아 보였다. 망원동 디저트 카페 소설원 술빵 카스텔라는 수제 단팥, 수제 생크림 막걸리를 이용해 24시간 숙성하여 고소하고 달콤한 맛이 일품인 쌀가루 카스텔라다. 순수 우유푸딩은 연유 시럽 진한 원유의 고소한 풍미를 즐길 수 있는 부드러운 식감의 푸딩이다. 어제 조카가 먹어보고 맛있어서 혼자 하나를 다 먹었다, 올 때 하나 더 사주고 싶었는데 오래 기다려야 해서 포기하고 나올 때 많이 아쉬웠다. 머물기 좋은 곳, 4층까지 오르는 건 사실 쉽지 않았다. 그래도 이런 공간이 있어 이렇게 함께 카페를 이용할 수 있어 좋았다. 작은 공간에서 함께 모여 이야기도 나눴다. 비가 와서 그런지 이 카페 분위기 너무 좋다. 창가로 보이는 운치 있는 풍경도 좋고. 물론 앞엔 공사 중이지만 그래도 분위기가 좋은 걸. 비가 오는 날에도 꾸준히 손님들이 들어왔고, 각층마다 꽉 채워진 자리로 주문하기 전 자리부터 확인해야 했던 카페 소설원. 우리는 조금 일찍 도착해 여유 있게 자리를 잡을 수 있었다. 사람은 많았지만 전체적으로 시끄럽지 않았다. 이런 분위기 좋다. 1층부터 곳곳에 꾸며진 식물이나 물 흘러내리는 모습에 어린 조카도 신기해하고 좋아했다. 이런 분위기의 카페라면 편안하게 앉아 함께 온 지인들과 이야기하기 좋을듯했다. 카페 분위기 때문일까 시끄럽지 않게 모두 이야기를 나누며 카페에서 시간을 보냈다. 그리고 정말 끊임없이 손님이 들어왔다. 우리도 1시간 좀 넘게 카페에서 놀다가 나왔다. 어느덧 조카가 첫돌이 지나 이렇게 멀리 카페도 함께 나올 수 있다니 신기했다. 그리고 여기선 조카가 먹을 수 있는 맛있는 디저트가 있어서 더 마음에 들었다. 망원동 데이트, 정말 오랜만에 동생이랑 망원동을 방문했고, 동생 부부랑 조카까지 함께한 망원동 데이트는 어제가 처음이었다. 조카가 자라나는 만큼 활동할 수 있는 거리가 늘어나고 함께 먹을 수 있는 것도 생긴다는 게 신기하다. 어제 방문했던 소설원 망원에서는 조카가 맛있게 먹었던 푸딩도 좋았고, 우리가 먹었던 술빵은 진짜 부드러웠다. 푸딩에 나온 연유를 조카가 먹을 수 없어 우리가 술빵에 함께 먹었는데 연유랑 먹어도 좋고, 생크림이나 팥을 올려 먹어도 좋다. 근데 먹으면서 생각해 보니 결국 그냥 먹은 횟수가 더 많았네? 술빵은 그냥 자체로도 부드럽고 맛있었다. 망원동 데이트하다가 카페 어디 갈까 고민될 때 동양풍의 감성 카페 소설원 망원을 다녀와도 좋겠다. 우리에게 좋은 추억을 남겨준 카페였다. 소설원 망원 0507 - 1484 - 5565 망원역 2번 출구 출구에서 우측 골목으로 들어온 뒤 월드공인중개사 골목으로 들어오면 된다. 50m © NAVER Corp. 소설원 망원 서울특별시 마포구 월드컵로13길 22-3 예약"
망원동 핫플 카페 고즈넉한 일본여행느낌 | 소설원 망원,"🤍 제가 요즘에 계속 답방을 못 가고 있어요 ㅠㅠ 다음주부터 달릴수 있을것같아요 그럼에도 불구하고 와주셔서 감사드려요 한분한분 기억하고 있습니다앙 🤍 날씨도 추워지고 가을가을하니 뭔가 가을을 느낄수 있는 카페에 가고 싶었다. 고즈넉한, 분위기 좋은 망원 핫플 카페가 있다고해서 냉큼 다녀왔다. 소 설 원 망 원 50m © NAVER Corp. 소설원 망원 서울특별시 마포구 월드컵로13길 22-3 예약 🎋 위치 서울 마포구 월드컵로13길 22-3 (망원역 2번 출구에서 153m) 🎋 영업시간 매일 11:00 - 21:00 (20:30 라스트 오더) 🎋 문의 0507-1484-5565 🎋 인스타그램 소설원 망원(@soseolwon_mangwon) • Instagram 사진 및 동영상 팔로워 1,034명, 팔로잉 13명, 게시물 149개 - 소설원 망원(@soseolwon_mangwon)님의 Instagram 사진 및 동영상 보기 www.instagram.com 망원역 2번 출구로 나오면 바로 옆에 시장같은 골목이 나오는데 그길로 쭉 들어가면 된다. 오른쪽에 두번째 골목으로 들어가면 초입에 아래와 같은 입구가 보인다. 소설원망원은 1층부터 4층까지 있다 계단아래 옆 좁은 통로를 들어가면 1층에 이런 공간이 나타나는데 초입 분위기부터 대만이나 일본에 여행 간 느낌이었다. 분위기가 좋다 입구부터 대나무에 물이 흐르는 소리가 들려서 대만이나 일본 맛집에 온듯한 느낌이 든다. 저기에서 빵이 만들어지나보다. 하나하나 분위기가 마음에 든다. 🍃 들어가자마자 이렇게 맛있는 디저트들을 만나 볼 수 있다. 소설원망원의 디저트 종류로는 크게3가지가 있다. < 술빵 카스테라, 푸딩, 휘낭시에 > 소설원 망원 디저트는 한국식 디저트로 수제로 직접 만들어 방부제 화학첨가물이 들어가지 않은 건강한 디저트라고 한다. 술빵 카스텔라는 막걸리를 이용해 24시간 숙성시켜 만든 빵이다. 카스테라 종류 (3가지) 술빵 카스텔라 9,400원 쑥 술빵 카스텔라 10,500원 밤 크림 카스텔라 13,000원 휘낭시에는 독특해서 깜놀 5개세트는 저렇게 초밥처럼 나온다 세상에 ㅋㅋㅋㅋㅋ 하나하나 다 예쁘다. 소설원망원의 휘낭시에는 아몬드 가루와 헤이즐넛 버터를 사용하여 겉은 바삭하고 속은 쫀득하게 구워냈다고 한다. 휘낭시에 종류 (5가지) 솔티 , 흑임자 , 앙버터 , 말차 , 무화과 1ea 3,200원 5ea 14,200원 푸딩도 동양느낌이 물씬난다. 한국식 디저트를 이렇게 만드시다니 개인적으로 바닐라는 요런 느낌의 디저트는 처음이라 너무 좋았음 :) 푸딩의 종류 3가지 순우유(연유시럽) , 말차(말차연유시럽) 밀크티(흑당시럽) 가격 순우유만 5,000원이고 나머지는 5,300원씩 주문한 메뉴 쑥 술빵 소설반상 13,900원 흑임자 아인슈페너 6,700원 녹차 라떼 6,900원 바닐라는 세트 메뉴를 주문했다. 쑥 술빵 소설반상은 우유푸딩에 술빵이 함께 나오는 세트 메뉴이다. * 그런데 포스팅하다가 알게 된 사실인데 단팥버터와 수제 생크림이 없음 .. 하핳 ㅋㅋㅋㅋㅋ * 1 층 1층에는 주문과 픽업 반납 하는 곳이다. 1층은 주로 직원분들이 쓰는 곳 같았고 우리는 픽업해서 2층부터 이용할 수 있다. 2층 동양풍의 인테리어가 고즈넉하니 분위기가 참 좋았다. 테이블도 곳곳에 있었고 이 날 사람이 많아서 다 찍지는 못했는데 방마다 좌식으로 되어 있는데 가림판으로 가려져 있어 편하게 있을 수 있어서 좋았다. * 2층에 남자 화장실만 있어요 * 이렇게 넓은 자리도 있어서 6명정도 모임도 거뜬히 올 수 있다. 창문마다 대나무가 보여서 뭔가 더 일본감성이 느껴지는듯 하다. 일본스러우면서 동양적인 느낌 아주 좋다 :) 3층 2층에는 사람들이 많아 자리가 거의 없어서 3층으로 올라갔는데 한결 조용하고 자리도 넉넉했다. 그리고 개인적으로 3층 인테리어가 더 예뻤다 :) 아무래도 음료와 디저트를 3층까지 들고 올라오기 힘드니까 2층으로 많이 가는듯 하다. * 3층에 여자화장실 있음 * 카페가 이렇게 고급스러울 일인가요 🤍 무슨 동양풍 전시회나 미술관에 간 듯한 느낌이었다. 갤러리에도 이런식으로 많이 해두지않나 사진 찍을 맛이 났던 😀 4층 테라스 테라스에도 사람이 있어서 다 찍지는 못했는데 선선할때 앉아있기 좋아보였다. 대나무 사이 중간중간 테이블이 있다. 층별로 구경하고 있을동안 주문한 메뉴가 나왔다 빵때문에 그런지 10분정도 오래걸린다고 하셨는데 미리 언지해주셔서 마음 놓고 기다렸다 카스테라 주문시에 넉넉하게 기다리기 :) 일본식 인테리어에 한국의 퓨전이랄까 너무 예쁘다 그나저나 왜 허전한걸 몰랐을까 어쩐지 카스테라에 발라먹는게 없는지 의아했지만 안 온게 있는지는 정말 몰랐다 ㅋㅋㅋㅋ 팥&버터, 그리고 수제 생크림이 빠져 있다 🤣🤣 하나같이 비주얼이 예뻐서 사진으로 담을맛이 났다. 바닐라는 아이스 흑임자 아이슈페너 동생은 따뜻한 녹차라떼 :) 녹차라떼가 생각보다 가격이 쎄서 왜 그랬나 했더니 이제까지 먹었던 녹차 라떼와 확실히 다른 맛 이었다. 녹차향 자체가 독특했고 씁쓸한게 더 강했고 달지 않았다. 달짝 지근한 빵이랑 잘 어울렸다 :) 흑임자 아인슈페너다. 위에 거품이 달달하면서 쫀뜩하고 가득했다. 맨 아래 흑임자가 잔뜩 깔려있아서 흑임자 러버는 완전 만족 :) 크림이랑 커피랑 같이 한입하다가 커피랑 흑임자랑 섞어서 같이 먹고 또 세가지를 다 섞어서 먹으니 각각 다른 느낌으로 먹을 수 있어서 좋았다. 이렇게 보니까 정말 뭔가 빠진거 같네 ㅋㅋ 더 맛있게 먹을 수 있었나 생각도 들었지만 충분히 만족하고 와서 살짝만 아쉬운 정도 ? ㅋㅋㅋㅋㅋ 순우유 푸딩 진한 원유의 고소한 풍미를 즐길 수 있는 부드러운 식감의 푸딩이다 달달하고 부드러우니 맛있었다. 노란색 꽃잎과 푸른 꽃잔이 참 마음에 든다 영상에서도 알 수 있듯이 카스테라가 정말 포슬포슬하다. 거의 우리는 빵만 먹고 왔는데 .. 살짝이 아니라 많이 아쉽네? 왜 눈치를 못했니 ㅋㅋㅋㅋㅋㅋㅋㅋ 나 .... 뒤끝있네 ....ㅋㅋㅋ 빵의 질감 보여드립니다 ~~~ 빵만 먹다가 살짝 아쉬워서 시럽을 뿌려먹었는데 ㅋㅋㅋㅋㅋㅋㅋ 시럽이 빵용도가 아니라 푸딩에 뿌려먹는거였음 아놔 ㅋㅋㅋㅋㅋㅋㅋㅋ 푸딩을 놔두고 어디다가 뿌리니 ㅋㅋㅋㅋㅋ 시럽 덕분에 한결 더 촉촉해진 카스테라입니다 :) 그런데 충분히 맛있게 잘 먹고 왔고 소설원망원이 핫플이라 그런지 평일 낮임에도 불구하고 사람이 많았다. 바쁘셔서 깜빡하신것같은데 완전 충분히 이해함 :) 내가 먹는건데 내가 챙겼어야지!!! 마치 일본여행간 느낌으로 도심속에서 색다른 분위기를 느낄 수 있는 곳 한국식의 독특한 디저트에 플레이팅이 너무 예뻐서 인스타용으로도 딱이다. 자리마다 다양한 분위기의 인테리어로 각자 다른 매력을 느낄 수 있다. 망원동 카페에 이런곳이 있다니 망원동핫플로 완전완전 추천합니다✨🍃 ❌ 사진의 무단 도용을 금합니다 ❌"
망원동 카페 망리단길 소설원 망원 여행 기분 나는 특별한 카페,"안녕하세요. 버터홍차입니다. 요즘 저의 소소한 기쁨은 두고두고 다시 찾고 싶은 그런 카페를 발견하는 것인데요. 망리단길에서 찾은 보석 같은 카페, 소설원 망원을 소개해드릴게요. 소설원 망원도 저만 알고 싶은 그런 곳이에요. 운치 있는 곳이어서 봄, 여름, 가을, 겨울 4계절이 궁금한 곳이지요. 망원동 카페 소설원 망원 그저 카페에 들어섰을 뿐인데 여권 없이 여행한 곳 망원역 2번 출구에서 150미터 정도? 망리단길 초입에 위치하고 있어요. 매일 영업이며, 11:00~21:00, 라스트 오더는 20:30분입니다. 50m © NAVER Corp. 소설원 망원 서울특별시 마포구 월드컵로13길 22-3 지상으로 3층 반지하까지 총 4개 층을 단독으로 사용하고 반지하 1층에서 주문을 하게 되어 있어요. 손님이 많은 때는 위층에 올라가서 자리를 먼저 확보하고 주문을 하면 되겠어요. 저희는 첫 손님이어서 주문하고 올라가서 자리를 잡았습니다. 입구에서부터 대나무 인테리어가 범상치 않은 곳이죠? 일식처럼 플레이팅 된 디저트 망리단길 카페 소설원 망원은 일본풍 인테리어에 동양풍 디저트들이 준비된 아늑한 공간입니다. 여러 가지 술빵과 휘낭시에가 주를 이루고 있는데 이 디저트들을 일식처럼 플레이팅 한 것이 인상적이었어요. 술빵은 단품으로 주문을 하면 벤또처럼 준비해 주시고 휘낭시에는 스시처럼 준비해 준답니다. 단팥 버터, 황 치즈, 솔트 바닐라, 얼그레이 무화과, 들깨, 말차, 맛 휘낭시에는 총 6가지가 있고, 술빵과 카스텔라 푸딩이 있습니다. 푸딩은 마치 일식 계란찜처럼 나오는데 하나하나 구경하는 재미가 쏠쏠했지요. 다다미가 깔린 카페. 여기가 망원동인지 일본인지? 주문을 하고 올라가서 자리를 잡았어요. 2,3, 루프탑까지 모두 올라가 봤는데 공간이 너무 멋졌습니다. 어느 한 곳 정성스럽게 준비되지 않은 곳이 없더라고요. 첫 손님이라 층층이 여유롭게 구경하며 자리를 고를 수 있었어요. 여긴 정말 너무 특색이 있어서 다 보여드리고 싶어요. 손님이 없어서 원 없이 찍어볼 수 있었어요. 조금만 늦었어도 이렇게 찍지 못했을 거예요. 망원동카페 소설원망원 재생 31 좋아요 0 00:00 00:43  접기/펴기 망리단길 카페 소설원 망원 층층이 그리고 테이블마다 적당한 간격과 공간 분리로 옆 테이블과 서로 방해되지 않도록 자리가 구성되어 있는 곳입니다. 여기는 비가 오는 날, 눈이 오는 날 다시 오고 싶은 곳입니다. 사계절 다 보고 싶은 곳, 저는 정말 맘에 드는 곳을 발견하면 사계절을 모두 보고 싶어지더라고요. 이곳 소설원 망원에서 차를 마시면서 창밖에 비 내리는 풍경 함박눈이 내리는 풍경을 보고 있으면 정말 힐링 될 것 같아요. 저는 일본 여행을 안 가봤는데 여기가 일본이지 싶더라고요. 일부러 다다미 자리를 선택했는데 안락한 쿠션도 많이 있어서 편안하게 앉아서 쉬었어요. 진동벨이 울리고 준비된 음료와 디저트를 가지고 올라왔어요. 쑥 술빵 소설 반상 + 휘낭시에 5종세트 이곳 망원동 카페 소설원 망원의 휘낭시에는 6종인데 5종 세트를 위해 한 종류를 선택하지 않으려니 선택 장애가 와서 혼났네요. 저희는 솔트 바닐라 빼고 5가지를 골랐어요. 술빵 소설 반상에는 밀크 푸딩과 음료 2종이 포함되는데 음료는 아메리카노, 캐머마일, 녹차, 우롱, 페퍼민트 중에 선택 가능해요. 쑥 술빵 반상에는 밀크 푸딩과 곁들일 연유, 그리고 술빵에 곁들여 먹을 단팥과 버터크림이 함께 곁들여 나옵니다. 술빵 밑에 잎사귀 깔아주는 게 너무 고급스러워 보이지요? 계란찜을 연상하는 푸딩은 꽃잎까지 올려서 보이는 하나하나에 디테일을 더하는 일본식 디저트의 역할을 톡톡히 했습니다. 스시를 연상시키는 휘낭시에 세트입니다. 세상에 와사비 간장처럼 시럽게 말차 크림까지. 정말 센스 있죠? 휘낭시에 겉바속촉인데 하나하나 그 맛이 특색이 있고, 시럽에 찍어 먹으면 촉촉 달콤 맛있어요. 들깨 좋아하시는 분들 들깨 휘낭시에 강추!! 저는 들깨 강정 좋아하는데 들깨 휘낭시에 위에 토핑으로 올려진 크림이 정말 예술입니다. 여기 모두가 특별했지만 그중에 가장 특별했던 것은 밀크 푸딩입니다. 분명히 엄청 탱글탱글했는데 스푼으로 떠서 입에 넣는 순간 액체 우유처럼 사라져버려요. 일행 언니가 말하길 없어진다고, 맞아요. 입에 들어가는 순간 없어지는 푸딩이었어요. 어떻게 이러죠? 너무너무 신기해서 계속 입에 넣는데 입에 넣으면 자꾸 사라져요. 함께 주신 연유를 부어서 먹으면 또 다른 달콤함. 저는 밀크 푸딩이 먹고 싶어서 재방문하고 싶어요 ㅎㅎ 촉촉 부들부들 달지 않아 계속 들어가는 술빵 쑥 술빵입니다. 주문하면 쪄줘서 따끈하게 나오는 술빵은 부들부들 속이 촉촉해요. 달지 않아 앉은 자리에서 다 먹어치울 수 있는 술빵입니다. 여기 카페에서 직접 만들었을법한 단팥과 크림 버터까지 술빵에 올려서 먹으면 또 다른 꿀맛을 볼 수 있답니다. 손이 바빠요 바빠. 동그란 창 넘어 창 넘어 또 다른 방. 이곳은 눈 돌리는 모든 곳이 감상 포인트예요. 반대편은 통창 넘어 대나무가 있는데 바람에 살랑이는 대나무 잎을 보고 있으니 마음이 편안해지더라고요. 언니의 우롱차에는 티백 외에 찻잎 하나 띄워 주셨는데 이런 디테일함 이건 정말 이 부분에 진심이어야 가능하죠. 사장님 센스 짱입니다. 일상에서 잠시 벗어나고 싶으신 분들이시라면 망리단길 카페 소설원 망원에 들러보세요. 잠시 현실은 잊고 여행 온 기분 만끽할 수 있답니다."
