title,content
망원동 디저트 카페 오후 달콤한 수제 디저트 맛집,"망원역은 시장이 있어서 한 번씩 나가보는데요! 망원동에 맛집이 은근히 있어서 알아두면 시장도 구경하고 주변 먹거리도 즐기고 오기에 딱 좋은데요! 얼마 전에 새로 오픈해서 알게 된 망원동 수제 디저트 맛집 카페 오후 다녀왔어요. #망원동디저트 맛집 찾던 분들은 관심 가져보세요! 제가 맛본 디저트와 음료를 만나본 카페 오후 망원동 디저트 맛집 커피 맛집 카페 오후 카페 오후 서울 마포구 망원로 55 1층 망원역 2번 출구에서 765 마을버스 정류장에 위치해 있어서 찾기도 쉽더라고요. 영업시간은 평일 오전 10:00~20:00 주말은 11:00부터 영업하네요. 모든 메뉴 포장과 예약 가능하고요. 아기자기한 화분들이 있는 벤치들이 눈에 띄어서 금방 찾았는데요. 카페 오후를 소개할 수 있는 아이템들이 밖에 있다 보니깐 아기자기한 매력에 바깥 풍경도 오래 쳐다보게 되더라고요. 정면에서도 만나본 카페 오후 #망원동디저트 카페 타르트와 스콘, 커피, 다양한 음료를 만나볼 수 있어요. 요즘은 브랜드보다는 수제 디저트 찾는 분들이 많잖아요! 망원역에서 찾는다면 카페 오후의 타르트 만나볼 필요가 있겠더라고요. 매장이 크지 않지만 아기자기하게 꾸며진 소품들과 테이블로 만나봐요. 오픈한지 얼마 되지 않아서 깔끔하고 안락한 느낌을 주는 인테리어를 갖고 있어요. 망원동 카페에서 수제 디저트를 만나볼 수 있는데요. 매장 내부를 둘러보고서 타르트도 봐야겠죠! #망원동디저트 맛집 망원동 카페 오후 냉장고에 진열되어 있는 타르트 모습과 상단에 진열되어 있는 쿠키를 보면서 어떤 걸 먹을까 고민되더라고요. 딸기 타르트와 청포도 타르트가 진열되어 있는 걸 볼 수 있었는데요. 매일 수제로 만나는 디저트 맛집이기 때문에 조금씩 구성은 달라질 수도 있어서 방문할 때 있는 메뉴를 먹을 수도 있다는 걸 알 수 있는 카페 오후에요. 오픈 이벤트도 안내되어 있으니깐 참여해서 혜택을 받아도 좋겠죠! 예약 안내도 되어 있어요. 디저트 단체 주문도 가능하니깐 방문, 전화, 네이버 예약, 인스타로도 주문이 가능하답니다. 자몽에이드와 아이스 아메리카노 청포도 타르트와 로투스 스콘으로 주문해 보았답니다. 맛보고 싶은 메뉴들을 선택해서 테이블에 올려놓으니깐 너무 이쁜 조합으로 만나보게 되었는데요. 자연광도 들어오고 테이블도 깨끗한 흰색이라 음료와 디저트가 더욱 맛있어 보이네요! #망원동디저트 타르트 맛볼 수 있는 카페 오후에서 신선한 과일 타르트를 만나보는데요. 싱싱한 청포도의 모습을 볼 수 있어요. 청포도의 모습을 살리면서 슈거파우더가 한쪽에 뿌려져 있으니 더 이쁘죠. 직접 다 만든 타르트라 신선도도 좋고 비주얼도 이쁘죠! 과일도 신선하고 중간에 있는 크림이 정말 맛있었어요! 크림의 흘러내리지 않죠! 옆으로 돌려봐도 청포도가 딱 붙어 있을 정도로 부드럽고 쫀쫀한 타르트의 크림까지! 확인해 볼 수 있는 망원동 카페 수제 타르트의 매력 이렇게 확인해 볼 수 있답니다. 밑엔 바삭한 식감과 중간에 부드러운 크림 싱싱한 청포도로 만나는 청포도 타르트 그리고 로투스스콘 함께 또 확인해 볼게요. 달콤하게 바삭한 겉면에 로투스가 올려져 있고, 속은 담백한 스콘의 조합 로투스 쿠키 좋아하는 분들은 바로 선택할 스콘이죠! 안에서 먹으면서 바깥 풍경도 한 번씩 보니 마을버스에서 내리는 분들도 보면서 테이크아웃하기 좋겠다 하는 느낌도 받게 되더라고요. 자몽에이드도 달지 않고 청이랑 탄산수의 비율이 적절해서 시원하게 마시기 좋고요. 아메리카노도 뒷맛이 텁텁하거나 쓰지 않아 깔끔하게 마시기 좋아요. 맛있는 수제 디저트 #망원동디저트 카페 찾던 분들은 타르트 맛보러 꼭 방문해 보세요. 작은 개인 카페지만 조용하게 이야기 나누면서 디저트와 음료를 즐기기에 좋은 곳이거든요. 아기자기한 인테리어와 오픈 이벤트가 진행 중일 때 이용해 보시면서 찐 단골이 되어보세요! 카페 오후 방문해 보시면 더욱 맛있는 디저트들을 만나볼 수 있답니다. <Cafe 오후> Coffee & Desert (수제디저트 맛집)(@cafe_p.m) • Instagram 사진 및 동영상 팔로워 37명, 팔로잉 0명, 게시물 66개 - <Cafe 오후> Coffee & Desert (수제디저트 맛집)(@cafe_p.m)님의 Instagram 사진 및 동영상 보기 www.instagram.com 카페오후 서울특별시 마포구 망원로 55 1층 cafe 오후 #디저트맛집 #망원동디저트 #망원동수제타르트 #망원동카페 #망원동커피 #망원동카페추천 #망원역디저트맛집 #망원역카페 #망원역디저트카페 #망원동카페오후 #카페오후 #망원동수제케이크 #카페오후망원동 #망원동타르트맛집 리뷰노트를 통해 업체에서 제공받아 작성된 글입니다."
[서울 마포구] 망원동 디저트 맛집 모든 디저트를 직접 만드는 카페오후,"망원시장에서 떡볶이를 먹고 크림치즈가 듬뿍 들어간 수제타르트로 유명한 망원동 카페를 다녀와봤어요 친절한 사장님을 만나뵐 수 있었고 타르트와 스콘을 먹었는데 진짜 존맛..👍 매일 아침 망원시장에서 사오는 싱싱한 과일로 만드는 타르트 맛집을 소개할게요🌿 망원동 디저트 망원동타르트 망원동 카페 카페오후 카페오후 : 네이버 방문자리뷰 15 · 블로그리뷰 4 m.place.naver.com 망원동디저트 망원동타르트 망원동케이크 카페오후 외관 망원역 1번 출구 앞에 있는 마을버스 정류장에서 09번 버스를 타고 동교초등학교 정류장에 내리면 정면에 위치한 카페오후 망원시장에서 먹고 후식으로 오몀 좋을 것 같은 카페 오후 타르트, 스콘, 쿠키, 케이크 등 직접 다 만드시는 거래요!! 귀여운 개업 화분들이 나열 되어 있고 <Cafe 오후> Coffee & Desert (수제디저트 맛집)(@cafe_p.m) • Instagram 사진 및 동영상 팔로워 30명, 팔로잉 0명, 게시물 44개 - <Cafe 오후> Coffee & Desert (수제디저트 맛집)(@cafe_p.m)님의 Instagram 사진 및 동영상 보기 instagram.com 오픈 이벤트로 ✔️인스타 팔로우 및 태그 or 네이버 리뷰 작성 시 <오후의 쿠키> 증정 ✔️타르트 2조각 이상 구매 시 아메리카노 1잔 무료 이벤트에 모두 참여해봅시다 타르트는 그날 그날 상태가 좋은 과일을 구매해 사용하기 때문에 타르트의 종류는 매일 달라질 수 있는데 저는 딸기와 청포도 타르트를 만날 수 있었어요 망원동디저트 망원동타르트 망원동케이크 카페오후 메뉴판 커피 라떼 티 에이드 스무디 다양한 음료들이 있는데 커피를 못 마시는 저는 레몬에이드로 픽!! 망원동디저트 망원동타르트 망원동케이크 카페오후 내부 아담하면서 깔끔하고 약 10명을 수용할 수 있는 테이블이 있어요 과일들이 어쩜 싱싱한 지 딸기, 청포도 타르트와 로투스, 티라미수 타르트가 있었어요 딸기가 제일 잘 나간다고 해서 딸기 타르트 하나 고르고~~ 홀타르트는 최소 2일 전에 < 방문/전화/네이버 예약/DM > 으로 예약해주면 돼요 부담 없게 미니 홀타르트도 있어서 선물용으로도 제격👍 르뱅쿠키 3,600원 레몬 케이크, 얼그레이 케이크 2,400원 생크림 케이크 3,200원 ㅎㅎ 귀여운 곰돌이 거울 여기서 사진 한 장 남겨주고~~ 뚝딱 나온 제가 주문한 딸기 타르트, 생크림 스콘, 레몬 에이드가 나왔어요 분명.. 밥을 먹고 왔는데 역시 디저트 배는 따로 있어요 브이로그 갬성으로 찍어본 영상이지만.. 망했음.. 푸하하 아침에 망원시장에서 사온 딸기라 그런지 진짜 싱싱하고 달고 완전 존맛탱..!!! 싱싱한 과일이라 그런지 생과일 그 자체였어요 크림치즈도 듬뿍에 달콤하고 부드럽고 완전 상큼..😍 달달한 디저트에 커피가 어울리겠지만 레몬에이드도 잘 어울리네요😊😊 생크림 스콘에 딸기잼을 뿌려 먹었지만 먹어보니 그냥 먹어도 담백하고 뻑뻑하지 않아서 일단 그냥 한 입 먹어보시는 걸 추천드려요 사장님께서 모든 디저트를 직접 만드셔서 그런지 속도 편안하고 맛있었어요 망원시장에 들리면 시원하게 음료 한잔과 디저트를 한 입 어떠신가요?! 카페오후 서울특별시 마포구 망원로 55 1층 cafe 오후 주소 서울 마포구 망원로 55 1층 cafe 오후 망원역 2번 출구에서765m 영업시간 평일 10:00~22:00 주말 11:00~22:00 화요일 정기휴무 전화번호 0507-1308-8366 #망원동디저트 #망원동타르트 #망원동카페 #카페오후 #망원동스콘 #망원시장디저트 #망원시장카페 본 포스팅은 해당 업체로부터 무상으로 제품을 제공받아 솔직하게 작성된 글 입니다."
망원동 디저트 맛집 카페오후 인생 수제과일타르트 맛집,"주말 내내 비가와서 계속 뒹굴거리다 급 달달한게 땡겨 발견한 망원동 수제 디저트카페 카페 오후로 달려갔어요 망원동 카페 Cafe오후는 망리단길에 생긴지 얼마안된 디저트카페인데 과일타르트가 존맛으로 유명하더라구요 <Cafe 오후> Coffee & Desert (수제디저트 맛집)(@cafe_p.m) • Instagram 사진 및 동영상 팔로워 37명, 팔로잉 0명, 게시물 67개 - <Cafe 오후> Coffee & Desert (수제디저트 맛집)(@cafe_p.m)님의 Instagram 사진 및 동영상 보기 instagram.com 카페오후 : 네이버 방문자리뷰 26 · 블로그리뷰 11 m.place.naver.com 달다구리 땡겨서 달려나왔으니 와구와구 먹어줘야지 망원동 디저트 Cafe오후의 귀엽고 예쁜 화분들ㅎㅎ 망원동 커피 맛집 카페 오후는 소박하면서 정겨운 느낌의 카페였어요 망원동 디저트 맛집 Cafe오후 매장에 들어가자마자 보이는 귀여운 곰돌이 인형! 너무 귀여워서 계속 사진찍게 되더라구요 곰돌이 옆으로 바 테이블이 있어서 혼자 방문해도 커피랑 디저트 먹으면서 바깥 구경하기 좋겠더라구요 귀여운건 한번 더 🐻🐻 망원동 카페 Cafe오후 아담하지만 테이블이 꽤 많았어요! 한적하게 앉아서 시간 보내기에도 좋아보이구 무엇보다 화이트와 파스텔톤의 가구들이 망원동 디저트카페 Cafe오후의 분위기를 환하게 해주더라구요~ 망원동 디저트카페 Cafe오후의 포토존! 거울샷 찍을 수 있는 포토존인데 곰돌이모양이에요 넘나 귀여움>.< 망원동 카페 Cafe 오후의 메뉴들! 커피 뿐만 아니라 다양한 음료들이 있어서 넘 좋더라구요 친구랑 저는 아이스아메리카노와 상큼한 청포도에이드로! 망원동 수제타르트 맛집 카페 오후 사진 망원동 수제타르트 맛집 카페 오후는 모든 디저트를 직접 만든다고 하시더라구요~ 타르트 비주얼 좀 보세요! 직접 만들어서 그런지 과일 잔뜩 올려져있는 타르트 완전 영롱 그 잡채 망원동 디저트 카페 오후 확실히 수제로 직접 만드는 디저트들이라 벌써 입소문이 났는지 디저트들이 이미 많이 팔렸더라구요! 우리도 딸기타르트랑 로투스 스콘도 같이 주문! 달다구리가 땡겨서 갔으니까 많이 먹어야지 디저트 주문하다가 발견한 망원동 카페 Cafe 오후의 귀여운 쿠키>.< 애기들한테 선물하면 인기터질듯 쨘! 주문한 망원동 디저트 맛집 Cafe 오후의 딸기타르트, 로투스 스콘, 청포도에이드, 아아 등장 망원동 커피 맛집 카페 오후 딸기타르트 진짜 맛있어요! 직접 만든 수제타르트라 과일이 잔뜩 올라간 것도 넘 맘에 드는데 저 크림치즈가 진짜 대쟌맛이에요 망원동 카페 카페오후 딸기타르트 크림이 완전 쫀득해요 다른 타르트랑은 다르게 크림치즈가 쫀득하고 타르트지가 부드러워서 너무 맛있더라구요! 아메리카노랑 완전 찰떡 같이 주문한 로투스 스콘도 너무 맛있었어요! 마냥 달지 않고 적당히 달달해서 계속 먹게되더라구요 이렇게 맛있는 디저트를 직접 만들다니! 망원동 디저트맛집으로 입소문 날 만 하더라구요~! 망원동 카페 Cafe 오후 청포도에이드가 인기 음료라고 추천해주셔서 주문해봤는데 완전 상큼달달했어요>.< 적당히 달달해서 타르트랑 스콘이랑 함께 먹는데 과하지않고 맛있더라구요! 더운 날씨에 마시면 더 상큼하고 맛있을 것 같은 청포도에이드였어요 💚 망원동 수제디저트 카페 Cafe 오후에서 쟌맛탱 타르트랑 스콘먹구 친구랑 한바탕 수다떠니 행복🫶🏻🫶🏻 망원동 카페 Cafe 오후의 수제타르트랑 수제디저트들 안먹어본 사람 없게해주세요!!!! 존맛 디저트 찾으시는 분들 망원동 카페 오후 꼭!! 들러보세용 완전 추천!!!!! 카페 오후 영업시간 : 월수목금 10:00-22:00 화(정기휴무)/ 토일 11:00-22:00 위치 : 서울 마포구 망원로 55 1층 연락처 : 0507-1308-8366 카페오후 서울특별시 마포구 망원로 55 1층 cafe 오후 “이글은 리뷰노트를 통하여 본 업체에서 제품 또는 서비스를 제공받아 작성된 글 입니다“ #망원동카페 #망리단길카페 #망원동카페추천 #망원동디저트 #망원동디저트카페 #망원동타르트 #망원동스콘맛집 #망원동디저트맛집 #망리단길스콘 #서울수제타르트 #망원동수제타르트 #망리단길디저트 #망원동디저트선물 #망원동데이트"
망원동 타르트 맛집 카페 오후,"카페오후 서울특별시 마포구 망원로 55 1층 cafe 오후 [영업시간]월수목금 10:00-22:00 화(정기휴무)/ 토일 11:00-22:00 위치 : 서울 마포구 망원로 55 1층 연락처 : 0507-1308-8366 망원시장 근처에 타르트가 너무 맛있는 집이 있다고 해서 방문해보았는데요, 저 멀리서 봐도 한 눈에 딱 들어오는 입간판 덕분에 단번에 찾을 수 있었습니다. 동교초등학교 비로 앞에 위치해 있어서 찾기 쉬웠습니다. 매장내부는 넓진 않지만 공간 활용을 잘 한 느낌이었구요, 저 곰돌이 너무 귀여웠어요. 이제 망원동 디저트 맛집의 쇼케이스를 구경해봅니다 망원동 타르트 맛집답게 비쥬얼이 장난아니었습니다. 새로 오픈한 키페라서 그런지 에스프레소 기계에도 눈길이 가네요. 커피가 왠지 맛있을것 같은 느낌적인 느낌!! 르뱅쿠키등 다양한 쿠키와 생크림 스콘도 준비되어 있었습니다. 인스타 후기를 쓰면 쿠키 종류를 선물로 주시는 것 같았어요. 대혜자 시스템 카페 오후였습니다. 망원동 디저트 카페답게 다양한 타르트가 준비되어있습니다 거기에다 모든 디저트는 사장님이 직접 만드신다고 합니다! 메뉴판입니다. 커피 / 라떼 /티 /에이드 / 스무디,쉐이크 등등이 준비되어 있었습니다. 보통 이런 타르트에 올라가는 과일들은 금방 딸기가 엄청 신선했어요. 망원시장이 바로 옆이니 제일 신선한 과일로 공수해오시는걸까요? ㅎㅎ 아래의 크림도 크림치즈 느낌이라 많이 달지않고 맛있었습니다."
[망원동 디저트 카페/cafe오후] 타르트가 맛있는 디저트맛집 카페오후,"카페오후 영업시간 : 월수목금 10:00-22:00 화(정기휴무)/ 토일 11:00-22:00 위치 : 서울 마포구 망원로 55 1층 연락처 : 0507-1308-8366 50m © NAVER Corp. 카페오후 서울특별시 마포구 망원로 55 1층 cafe 오후 예약 안녕하세요:) 요즘 또 달다구리가 너무 땡겨서 망원동 디저트 맛집인 cafe오후를 방문했어요! 생긴지 얼마 안된 카페인데 타르트가 유명하다고 하더라구요 매장은 작고 아담하지만 그림같이 이쁜 외관이 인상적이었어요! 망원동 카페 오픈이벤트로 인스타과 네이버리뷰이벤트/ 타르트2개 구매시 아메리카노 증정도 하고 있다네요! 매장 너무 깔끔하고 이쁘지 않나요..? 대왕곰돌이 졸귀🧸 망원동 디저트 카페답게 유명한 타르트 말고도 다양한 디저트가 있더라구요! 모든 디저트는 사장님께서 직접 만드신다고 합니다👀 하트모양딸기타르트(7,500원) 청포도타르트(5,900원) 자몽에이드(5,000원) 아이스아메리카노(3,500원) 디저트도 그렇고 음료 가격도 엄청 저렴하더라구요 아메리카노도 개인카페치곤 굉장히 저렴한 편이었습니다! 주문한 음료와 타르트가 나왔어요! 보통 이런 타르트에 올라가는 과일들은 금방 메마르거나 하는데 여기 타르트는 과일도 신선하고 올라가는 크림도 부드럽고 맛있었어요 밑에 파이부분은 살짝은 바삭한 식감이었고 고급 디저트카페 못지않게 비쥬얼이며 맛이며 둘다 만족스러웠습니다! 앞으로 망원동 디저트는 여기인걸로🫶🏻 청포도타르트도 올라가는 청포도가 당도가 높고 크림은 크림치즈베이스였는데 크림치즈맛이 너무 강하지않고 과일의 당도와 어우러져 맛있었습니다 개인적으로 크림치즈보다는 일반 생크림을 더 좋아하는데 여기 타르트에 올라간 크림치즈는 맛있더라구요! 자몽에이드도 많이 달지않고 청이랑 탄산수의 비율이 적절한 맛있는 자몽에이드였어요! 아메리카노도 가격이 저렴한데 좋은 원두를 쓰는지 맛이 좋았어요 개인적으로 디저트는 아메리카노와 같이 먹길 좋아하는데 디저트맛집인데 아메리카노도 저렴해서 근처에 있었음 자주 테이크아웃해서 먹었을거 같아요! 나오는길에 전신거울에서 사진도 한컷 찍어줬어요! 카페오후 : 네이버 방문자리뷰 13 · 블로그리뷰 1 naver.me <Cafe 오후> Coffee & Desert (수제디저트 맛집)(@cafe_p.m) • Instagram 사진 및 동영상 팔로워 32명, 팔로잉 0명, 게시물 41개 - <Cafe 오후> Coffee & Desert (수제디저트 맛집)(@cafe_p.m)님의 Instagram 사진 및 동영상 보기 instagram.com -총평- 디저트가 맛있고 가격도 저렴해서 좋았어요 매장은 작지만 테이크아웃하거나 혼자 조용히 시간보내기에도 좋은 곳인거 같습니다 인테리어도 이쁘고 오픈이벤트도 하고 있어서 근처에서 타르트맛집 찾으시면 방문해보시길 추천드려요! 이 글은 리뷰노트를 통하여 본 업체에서 제품 또는 서비스를 제공받아 솔직하게 작성한 글 입니다."
"망원동 디저트 카페 추천, 타르트가 맛있는 카페 오후","망원동 디저트 카페 추천 망원동 커피 맛집 타르트맛집 카페 오후 언제가도 재밌는 망원동 나들이~ 마침 이번 주말 망원 방울방울 축제기간이더라구요. 날씨도 너무 좋아서 축제 즐기기에 딱이었어요. 추억이 방울방울~ 이번 주말 딱 이틀간만 하니 가보세용 ㅎㅎ 카페오후 서울특별시 마포구 망원로 55 1층 cafe 오후 저는 토욜일 오후 혼자만의 시간을 보내기 위해 조용한 망원동 카페를 찾았습니다. 타르트와 스콘, 쿠키를 판매하고 있는 망원동 디저트 카페랍니다. 오픈한지 얼마 안된 듯 한 카페 오후! 평일은 오전 10시부터, 주말은 오전 11시부터 운영되는 곳입니다. 와 보기만해도 맛있어보이는 타르트! 딸기타르트, 청포도타르트, 자몽타르트가있어요. 맛도리 과일들밖에없어서 고민하다가 타르트는 역시 딸기지 ! 하고 딸기타르트로 골랐답니다. 타르트만 먹으면 아쉬우니 오리지널 르뱅쿠키도 하나 주문~ 타르트와 꿀 조합인 아이스 아메리카노까짛ㅎ 타르트 3종 외에도 쿠키와 스콘도 있어요. 스콘은 생크림스콘과 로투스 스콘 두가지 종류랍니다. 종류가 많은건 아니지만 맛도리들만 있네요 ㅎㅎ 현재 오픈 이벤트로 타르트2조각 이상 구매시 아메리카노 1잔이 무료네요. 와우 파격이벤트 ㅋㅋㅋㅋㅋ 네이버 리뷰 작성시 쿠키 증정도 있다고 하니 꼭꼭 참여하시길!!! 내부는 좁은 편이에요. 테이블 3개와 바테이블 하나 있어서 3~4팀 정도 수용가능하답니다. 저는 혼자간거라서 편한 자리에 앉았어요. 조용하니 좋더라구요 ㅎㅎ 외롭지 않게 함께 해주는 곰탱이 ㅋㅋㅋㅋㅋㅋㅋㅋㅋㅋㅋㅋㅋㅋ졸귀탱 ㅠ_ㅠ 과일타르트는 특히 과일이 중요한데 일단 딸기가 너무 신선해 보여서 좋았어요. 요즘 딸기철이아닌데도 불구하고 딸기가 엄청 싱싱하더라구요. 당도도 높아서 진짜 맛있었습니다 ㅠㅠ 다음엔 청포도타르트랑 자몽타르트도 먹어봐야지!!! 깨알 블로그홍보? ㅋㅋㅋㅋㅋㅋㅋㅋㅋㅋㅋㅋㅋㅋㅋㅋㅋ 혼자가면 심심하니까 아이패드 챙겨서~ 아메리카노도 산미없이 고소한 맛이랍니다. 저는 고소한 원두파라서 좋았어요!!! 커피 가격도 엄청 착한편!! 혼자먹기에 타르트가 좀 크다고 느껴졌는데 너무 맛있어서 혼자서 다 먹었네요 ㅋㅋㅋㅋㅋㅋㅋㅋㅋㅋㅋㅋㅋㅋ순삭! 타르트지가 뻑뻑하지 않고 적당해서 더 술술 먹게 됐답니다. 타르트 위에 치즈도 적당한 산미가 느껴져서 조합이 정말 좋았어요. 역시 타르트는 딸기타르트가 최고! ㅎㅎ 망원동 디저트 카페로 인정합니다.!!! 르뱅쿠키는 집에서 먹었는데 안에 견과 등 재료가 꽉차서 넘맛있었어요. 가격도 저렴한데, 결코 저렴한 맛이 아닌 고급진 맛이라서 더 좋았답니다. 사장님도 너무 친절하심!!!!!ㅎㅎ 이런 곳은 더 더 소문나서 잘됐으면 좋겠다요 ♥ 타르트 좋아하시는 분들은 가보세요^-^"
