title,content
"망원동 카페하모니 예약방법 주차 등 꿀팁, 아이랑 쿠로미&마이멜로디 산리오카페","산리오카페 망원동 카페하모니 주소 : 서울 마포구 동교로9길 12 지층~1층 카페하모니 영업시간 : 매일 오전 11시~오후 8시(라스트오더 오후 7시) 주차 : 주차 공간 없음, 근처 망원시장 주차장 이용함 지난주 토요일에 다녀온 카페하모니! 일명 마이멜로디&쿠로미 카페기도 하죠. 요즘 산리오 캐릭터들이 인기가 많은데 서울 곳곳에 산리오러버스클럽 등 카페가 생기고 예약제로 받는데 상당히 인기가 많더라구요. 카페하모니는 그 중에서 가장 최근에 생긴 곳인데 2달 전에 시나모롤스위트카페 갔을 때 아이가 좋아했어서 이번에는 빨리 예약했어요ㅎㅎ 예약방법은 기존 카페들과 다르게 네이버예약이 아니라 캐치테이블 어플 예약이고 인스타그램 추가하고 예약일 확인하세요^^ 망원동 2층 주택을 개조해서 꾸며논 모습인데요. 요즘 여자 아이들이 좋아하는 마이멜로디와 쿠로미 캐릭터로 꾸며져 있는데요. 전체적인 느낌은 사랑스러우면서도 엔틱했어요. 1층은 굿즈샵, 2층이 카페인데 1층은 예약 없이 방문 가능하고 2층은 예약해야지만 들어갈 수 있어요. 카페하모니 주차는 망원동 주택가라 어려워서 망원시장 노상 주차장 이용했어요. 여러 곳이 나오는데 대부분 도보 10분이라 아이 데리고 가기에도 괜찮았어요. 2층 주택이기 때문에 외부 공간도 꾸며져 있어서 간단하게 마련된 포토존에서 예쁘게 사진을 남길 수 있답니다. 근데 여름이라 너무 더웠어..요..ㅋㅋㅋ 진짜 여자 아이들이 너무 좋아할 느낌!ㅎㅎ 개인적으로 시나모롤스위트카페 보다는 인테리어도 맛도 살짝 더 마음에 들었어요ㅎㅎ 예약은 캐치테이블 어플을 통해 날짜, 요일, 시간을 선택하여 예약하는데요. 저희는 토요일 오후 12시로 선택했어요. 캐치테이블 어플은 선택 후 7분 유예시간이 있어서 네이버예약 보다는 예약이 좀 수월한 느낌이었어요. 전 예약한 12시 되면 그 시간대 사람들이 슬슬 줄 서서 입장하는지 알았더니 미리 가서 번호표 받고 그 순서대로 입장하는 거였; 전 일찍 갔는데도 그거 모르고 굿즈샵 구매하다 11시 55분에 직원 분한테 갔더니 이미 8번ㅠㅠ 조금 일찍 가셔서 여기 서있는 직원 분께 캐치테이블 예약 내용이랑 신분증 보여주심 되고 번호표랑 인원수대로 주는 부채 받으세요! 번호표 받으면 예약한 시간 5분 전 부터 그 번호표 순서대로 들여보내 주더라구요. 우선 1층은 굿즈샵이라 밑에서 보여드리고 2층 카페부터 소개해 드릴게요! 번호표 순서대로 입장해서 계단을 오르는데요. 2층 주택을 개조해서 엔틱한 느낌이에요. 계단을 오르면 바로 앞에 이런 포토존이 있구요. 2층 카페의 입구 모습이에요. 키오스크로 주문 후 들어가셔도 되고 입장해서 자리 맡은 후 주문하셔도 되는데 아무래도 마음에 드는 자리 앉으시려면 후주문ㅎㅎ 여기는 주문부터 반납까지 모두 셀프인데요. 카페 메뉴도 비싼데 다 셀프라뇨^^^^ㅎㅎㅎ 이곳의 가장 베스트 포토존이랄까ㅎㅎ 쿠로미와 마이멜로디와의 티타임 공간이에요. 사랑스러우면서 엔틱한 느낌 뭔지 아시겠죠?ㅎㅎ 오래된 주택의 기존 느낌은 살리면서 여기저기 캐릭터들을 심어 놓았더라구요. 인기 없어서 아무도 안 앉던 자리ㅋㅋㅋ 여기는 그냥 심플한 공용공간 같은 느낌이라 다들 캐릭터로 꾸며진 방으로 가시더라구요. 2층 입구에도 키오스크가 있지만 주방 가까운 내부에도 키오스크가 있기 때문에 밖에서 주문하지 마시고 들어오셔서 하세요. 우선 자리부터 잡는 게 우선임ㅎㅎ 주택으로 치면 거실에는 이런식으로 캐릭터들로 아기자기하게 꾸며놓았구요. 방들은 각 테마별로 꾸미고 테이블들을 배치했어요. 우선 방으로 들어가기 전에 베스트 포토존에서 한 컷 안 찍을 수 없겠죠?ㅎㅎ 주택을 개조했기 때문에 방 형식으로 되어 있는데요. 저희는 마이멜로디 방으로 자리 잡았어요. 여기는 마이멜로디의 방! 그래서 분홍빛으로 꾸며져 있는데요. 식탁이랑 의자가 엔틱한 느낌이라 마음에 들었어요. 일반 의자가 아니라 캐릭터를 잘 살린 느낌이랄까ㅎ 사실 소품들은 막 특별하지 않은데 가구가 예뻐요. 어떤 느낌인지 감이 오시죠?ㅎㅎ 여기는 쿠로미의 방! 여기가 가장 인기 있는지 먼저 찼어요ㅎㅎ 아이가 벽 보고 앉아 있는 여기 자리가 잘 꾸며져 있어서 커피 사진 찍음 잘 나올 느낌ㅎㅎ 여기는 나머지 방인데 사람들이 있어서 사진은 일부분만 찍었는데 제일 평범했어요. 공용공간 쪽에 이 자리도 하나 있는데 발코니 쪽이 예쁘게 꾸며져 있어서 이 쪽 자리도 괜찮은 거 같아요. Next image 2층 카페 공간을 구경했으니 이제 메뉴판을 봐야겠죠?ㅎㅎ 카페 이용은 50분, 1인 1메뉴 주문인데 가격도 비싼데 이용 시간이 너무 짧은 거 같아요^^ 캐릭터빨 너무 심하다..ㅋㅋㅋㅋ 주문은 키오스크로 하고 나오면 카톡 알림이 와요. 저희가 굿즈샵에서 구매한 것들 저 츄파춥스 마이멜로디가 거의 4만원..ㅠㅠ 1층 굿즈샵과 구매와 2층 카페 예약으로 받은 것들인데요. 굿즈샵에서는 3만원 당 카드 1개를 주고 카페에서는 예약 인원수대로 부채랑 종이를 줘요. 저희는 굿즈샵에서 부채도 받은 듯ㅋㅋ 너무 많이 받아서 잘 모르겠ㅋㅋㅋㅋㅋㅋ 저희가 주문한 메뉴가 나왔습니다. 딸기라떼 8,200원 복숭아에이드 5,800원 아이스아메리카노 5,500원 쿠로미쿠키 4,000원 예쁘기는 한데 솔직히 맛에 비해 너무 비싸요~ 특히 딸기라떼랑 흑임자라떼가 비싼 거 같아요. 다른 디저트는 공장에서 가져오는 거라 비싼데 맛이 그저 그렇다는 평을 봐서 안 시켰어요. 음료들 맛은 괜찮긴 한데 가격에 비함 글쎄요ㅎㅎ 예쁘고 사진 남기는 맛에 간 거니 뭐..ㅎㅎㅎ 그래도 개인적으로 시나모롤카페 보단 맛났움ㅋㅋ 2층 카페를 소개해 드렸으니 이제 1층 굿즈샵인데요. 2층은 예약해야 이용 가능하지만 1층은 아무나 이용할 수 있어서인지 사람이 많았어요. 1층 들어가면 왼쪽이 베이커리샵, 오른쪽이 MD샵, 기념품샵이랍니다. 여기가 1층 MD샵인데 사람 많죠? 인형부터 다양하게 있는데 일본 직수입 제품들이 비싸고 나머지는 그에 비해서는 저렴해요. 여기는 1층 베이커리샵인데요. 저는 여기가 베이커리샵이래서 캐릭터 빵 같은 거 파는 지 알았는데 그냥 베이커리샵 컨셉으로 꾸며놓은 공간이에요. 2층 카페에 못 가서 아쉬우신 분들은 여기서 인증샷 찍으셔도 괜찮을 거 같아요^^ 쿠로미&마이멜로디 산리오카페 카페하모니! 망원동카페로 사랑스러우면서 엔틱한 인테리어로 전체적인 느낌은 너무 마음에 들었는데요. 카페 공간은 예뻤는데 넓지 않아서인지 포토존은 살짝 부족하다는 느낌이 들었어요. 넓지 않아서 대부분 공간에 테이블들이 다 있다 보니 사람이 있어서 사진 찍기가 어려웠거든요. 그래도 인테리어가 여자들 취저라 예뻤어요^^ 개인적으로는 시나모롤스위트카페 보다 예뻤음ㅎㅎ 다만 모든 산리오카페들이 그렇긴 하지만 여기 역시 음식들이 퀄리티에 비해 비싼데 이용 시간이 너무 짧아서 아쉬웠어요ㅠ 주문하고 사진 몇 장 찍으니 30분은 금세인데.. 그래서 먹고 분위기 즐길 시간이 너무 부족했어요ㅠ 산리오 캐릭터 좋아하거나 인스타 감성샷 찍기에 좋아요ㅎㅎ 카페하모니 서울특별시 마포구 동교로9길 12 지층~1층 카페하모니 #카페하모니 #산리오카페 #쿠로미카페 #마이멜로디카페 #쿠로미마이멜로디카페 #마이멜로디쿠로미카페 #산리오캐릭터카페 #캐릭터카페 #망원산리오카페 #산리오카페예약 #카페하모니예약 #카페하모니주차 #망원동카페 #망원카페 #마포카페 #아이랑갈만한곳 #아이랑가볼만한곳 #서울아이랑 #마포아이랑 #망원아이랑"
마이멜로디X쿠로미🎀 망원동 카페하모니 CAFE HARMONY,"완전 귀여운 장소 다녀왔어요 !! 산리오 러버스 클럽, 헬로키티 문방구에 이어 마이멜로디X쿠로미가 가득한 곳 Cafe Harmony 망원동 카페하모니 카페하모니 서울특별시 마포구 동교로9길 12 지층~1층 카페하모니 예약방법 네이버 ‘카페하모니’ 검색 후 상세페이지의 캐치테이블 링크 접속 로그인 후 원하는 시간대 예약 2주에 한 번, 금요일마다 예약 오픈 주말은 예약이 빡세니 오픈하는 날 기다려서 예약하시는 것 추천!! 예약하면 이러케 친절하게 알림톡이 날아온답니다 (벌써 다녀온지 한 달 지난 거 뽀록남) 카페하모니 이용 팁 몇 가지도 알려드릴테니 끝까지 따라와주세요 카페하모니 입장은 번호표 배부 후 줄 서서 이루어집니다 번호표 배부는 입장 시간 1시간 전부터 시작되는데 이런 형태의 카페는 포토존을 사수하는 게 중요하기 때문에 일찍 입장하고 싶으신 분들은 1시간 전 도착해서 번호표 미리 받아가시는 거 추천 !! 저는 한 30분? 전에 와서 받았더니 7번이네요 ! 한 20팀 정도 입장하는 걸로 압니당ㅎㅎ 포스터 같은 특이한 굿즈도 인원수대로 증정하네요 남은 시간은 떠돌지 말고 1층 굿즈샵 구경하다가 입장하면 조아요 !! 굿즈샵은 예약하지 않아도 구경 가능 텐바이텐에서 구매할 수 있는 굿즈들도 많았고 일본에서 막 수입해온듯한 비싼 몸값의 인형들도 굉장히 많음 !!!! 인형엔 많이 관심없는데 요 두 아이는 딱 봐도 손이 많이 간 것이.. 예쁘더라구요 얼마더라.. 너무 비싸서 기억에서 지움 뭘 기대하든 상상 그 이상일겁니다 ㅎㅅㅎ 로이체 상품도 많아요 로이체 산리오 콜라보제품은 인터넷에서도 쉽게 구매할 수 있으니 정가주고 여기서 구매하는 건 급하지 않은 이상 굳이? 싶습니다 제가 원하는 건 카페하모니 시그니처 굿즈 ... 여기 안 오면 못 구하는 굿즈 사는 게 제일 현명하잖아요 ? 마우스패드 살까 하다가 집에 이런식으로 산 패드가 너무 많아서 그냥 L파일 구매함.. 소박 ... 포토카드도 역시나 있습니다 !!! 한 장 3,000원 여긴 기계 여러 대라도 디자인 같더라고요 한 장 뽑아봤는데 맨 아래에서 공개하게씁니닷 3시 입장이기때문에 2시 55분에 직원분들께서 3시입장 고객 모두 밖으로 나와달라고 불러주십니다 여기도 카페는 2층에 만들어놨어요 번호대로 줄 옹기종기 서기 ㅎㅎ 마이멜로디 방 일단 제가 선택한 자리는 창가 바로 앞 요자리이구요! (좀 더웠음) 귀여운 벽지와 오브제가 맞이해주는 가장 인기있는 방이었습니당ㅎㅎㅎ 의자랑 테이블이 편해요 •• 다른 자리도 구경하자면 입구 공간 여기가 제일 컨셉이 없어서 텅텅입니다^^.. 움짤 보시면 옆에 마멜방도 살짝 보이죠 쿠로미 방 조명이 좀 어둡지만 마멜쿠로미와 마주보고 먹을 수 있는 귀여운 바테이블도 있어요 작은 방 굉장히 작아서 몇 명 못 들어간 방ㅋㅋㅋ 그래도 뽀짝한 분위기 메뉴 주문은 선불! 자리에 메뉴판이 놓여있구요 이게 답니다 케이크 가격 후덜덜 ^^;;; 딸기라떼 8,200 블루소다 6,800 마들렌 5,000 주문함 !! 아아를 먹고싶어하는 지의 의견 묵살하고 여기서 아메를요?????;; 라고 하며 강제로 블루소다 주문함 깔깔 아까 준 굿즈는 이거네요 이.. 용도가 뭐지 진짜 포스터인가 포스터면 왜 접을 수 있지 영화포스터 보관파일에 넣어야겠어요 ... +추가 : 테이블매트 였다고합니다 크 블루소다 시키길 잘했다 근데 웃긴게 주변에 싹다 메뉴 조합이 블루소다랑 딸기라떼임 이전 테마카페보다는 좀더 빈티지한 느낌의 플레이팅이네요 ••• 포크도 그렇고 실내인테리어도 블루소다 아이스크림 맛있어용 마들렌도 은근 맛남 딸기라떼는 예상가능하지만 맛있는 맛 ㅎㅎ 귀는 과잔데 그냥 푸석해요^^ 햇살 조치요 여기도 메뉴 주문하면 코스터를 증정하네용 마멜이랑 쿠로미 비서같은 애 나옴 보라색 화나있는 애 생각보다 50분 시간이 잘 가서 사진찍고 잠깐 떠드니 쫓겨남 쩝 화장실 화장실은 입구만 찍어봤어요 내부는 아마 꾸며져있진 않을 듯 여태 그랬듯.. 여기 나갈때 2층 입구에서 사진 찍고 가세요 급히 찍고 쫓겨나느라(?) 사람 없는 사진이 없어서 모자이킄 ㅋㅋㅋㅋ 나갈 때 이 랜덤키링 판매의 존재를 알아서 아놔 L파일 말고 이거 살걸 하면서 안절부절 못하고 있으니까 지가 그냥 사쥼... 헤헤..마멜금쪽이 1층 계산대 옆에 있으니 랜뽑 좋아하시면 돈 폴겟잇 헤헤 마멜 나옴 마멜쿠로미 같이있는거면 좋았을텐데 그래도 두마리라 가성비좋구나 .(?) 이제 대망의 포카 결과 공개 헤헤 트둥이랑 포차코잡이였는데 드디어 첫 쿠로미포카 !!!! 나름.. 만족합니도 나갈 때 여기도 포토존 잊지마세요 총평 산리오 러버스 클럽보다 덜 화려하지만 마멜과 쿠로미파라면 충분히 갈 가치 있는 공간이다. #맛집리뷰 #카페 #카페리뷰 #여늘리뷰 #카페하모니 #산리오러버스클럽 #산리오 #산리오카페 #소품샵 #망원동카페 #망원동 #마이멜로디 #쿠로미"
아이와 망원동 카페하모니 귀여운 산리오카페,"아이와 망원동 카페하모니 귀여운 산리오카페 홍대 아이와 가볼만한곳 시나모롤 스위트카페 홍대 아이와 가볼만한곳 시나모롤 스위트카페 아이와 홍대 나들이를 다녀왔어요♡ 저희 아이가 산리오 캐릭... m.blog.naver.com 홍대 산리오 러버스 클럽 시즌2 해피스쿨 아이와 방문 후기 홍대 산리오 러버스 클럽 시즌2 해피스쿨 아이와 방문 후기 아이와 홍대 가볼만한곳 산리오 러버스 클럽은 ... m.blog.naver.com 초등 저희 아이가 너무 좋아하는 산리오 친구들 ♡ 홍대에 있는 산리오 러버스 클럽도 다녀오고 시나모롤 스위트 카페도 다녀왔었는데 망원동에 쿠로미 산리오 카페가 오픈했다고 해서 지난 주말에 방문해 본 망원동 카페하모니 포스팅을 올려볼게요~~!! 카페하모니 서울특별시 마포구 동교로9길 12 지층~1층 카페하모니 망원동 카페하모니 산리오 캐릭터 카페 <영업시간> 매일 11:00~20:00 라스트 오더 19:00 2층 카페는 사전예약제로 이용 가능 1층 기프트 숍은 예약 없이도 방문 가능 망원동 카페 하모니도 산리오 러버스 클럽처럼 예약제로 방문이 가능한 곳이랍니다. ↓↓↓↓↓↓ (예약 링크) 카페 하모니 쿠로미와 마이멜로디가 환상의 케미를 선보이며 준비한 F&B와 두 친구의 사랑스러움만 가득 담긴 GOODS까지! app.catchtable.co.kr 카페하모니 산리오 카페는 따로 주차공간이 없어요!! 그래서 저희는 망원시장 공영주차장 망원 1-2 공영주차장을 이용했답니다. 좀 찾아보니 주말에는 주차가 힘들다고 하던데 여유 있게 방문했더니 조금 기다리긴 했지만 생각보다 빨리 주차를 했어요. 오전 시간대가 지나면 특히 주말은 주차가 많이 힘들다고 하니 근처 다른 주차장을 이용하시거나 대중교통을 이용해서 오시면 더 편하게 이용할 수 있는 망원동 카페 하모니에요. 망원역 2번 출구에서 204m, 망원 1-2 공영주차장에서 카페 하모니까지는 약 8분 정도 거리로 걸어갈 수 있는데 너무 더웠던 날이라 아이가 조금 힘들어하긴 하더라고요. 날씨만 좋으면 가볍게 걸을만한 거리였답니다. 그리고 망원 1-2 공영주차장은 망원시장 바로 옆 주차장이라 카페에 들렸다가 시장 구경하기도 좋더라고요. 핫하다고 하는 망원시장이 궁금했었는데 데이트 코스로도 유명해서 그런지 젊은 연인들이 많이 보였던 망원시장이었어요!! 망원시장 1-2 공영주차장 주차요금 5분당 주차요금 200원 시장에서 구매한 영수증이 있으면 전통시장 할인 30% 가능< 최대 2시간 > 시간이 초과되면 할인 적용받을 수 없어요!! 주택을 개조해서 만든 산리오 카페 카페하모니~ 2층은 카페로 이용할 수 있는 공간이고 1층은 베이커리 숍과 기프트 숍이 있는데 1층은 예약 없이도 방문할 수 있는 곳이에요. 카페하모니 오른쪽 편으로 대기공간이 있는데 여기서 대기를 하고 2층으로 올라간답니다. 테이블링 앱에서 예약을 하셨다면 MD 숍에서 번호표를 수령해 주세요!! 예약자 본인 확인을 위해 신분증이 필요해요. 번호표 순서대로 입장하기 때문에 원하는 자리가 있으시면 빠르게 번호표를 받아주세요!! 5분 전 대기공간에서 번호 순서대로 입장합니다. 빨간색 포인트로 카페 외관이 예쁘게 꾸며져 있던 카페 하모니에요. 곳곳에 포토존들이 많아서 사진 찍기도 좋은 공간들이 많더라고요♡ 카페 오른쪽 편으로 기프트 숍이 있어요. 쿠로미 마이멜로디 카페이다 보니 다른 캐릭터들은 따로 없었고 쿠로미와 마이멜로디 굿즈들만 판매하고 있어요. 저희 아이가 쿠로미를 좋아하는데 이 많은 것들 중에 인형? 을 골랐다는.. ㅋㅋ 딱 하나만 사고 끝!! ㅋ 그렇게 크진 않았지만 구경하는 재미가 있었던 기프트 숍이에요. 카페 왼쪽으로는 베이커리 숍이 있답니다. 저희가 갔을 때는 아직 오픈하지 않은 거 같았는데 베이커리 소품들로 너무 귀엽고 예쁘게 꾸며져 있던 공간이라 저는 2층 카페보다 여기 공간이 너무 예쁘고 좋더라고요♡ 1층에서 구경을 하다가 예약 시간이 다 돼서 2층 카페로 올라갔답니다. 입구 앞으로 키오스크가 있고 바로 옆으로 포토존이 있지만 먼저 자리를 잡아야 하기 때문에 테이블 쪽으로 가서 자리를 빨리 잡으셔야 해요!! 창가 쪽 산리오 정원이 보이는 4인 테이블 석이 하나 있었는데 이미 테이블에 자리를 잡아 놓으셔서 못 앉았어요. 여기가 밝고 예쁘더라고요. 후기들을 좀 찾아보니 룸으로 된 테이블이 제일 낫다고 해서 저희는 그쪽으로 들어가 자리를 잡았답니다. 저기 커튼이 쳐져 있는 룸이 그나마 제일 밝아서 앉긴 앉았으나 한번 둘러보니 테이블 자리가 다 비슷한 느낌이라 다른 테이블과 겹쳐진 자리만 아니면 사진찍었을때 느낌은 다 비슷할 거 같더라고요. 저희가 앉았던 룸 자리에요. 다들 여기를 많이 추천해 주시더라고요. 전체적으로 클래식한 분위기지만 뭔가 그렇게 인테리어가 막 예쁘다는 느낌은 안 들었어요. 아이는 너무 좋아했지만 ㅋ 곳곳에 소품들이 아기자기하게 전시되어 있어 구경하는 재미가 있긴 했답니다. 아이가 여기 자리에도 앉고 싶어 했는데 너무 어두워서.. 사진으로 밝기를 조절해서 올렸는데 세상 어두웠어요. 조명 밝기만 조절되면 더 예쁘고 귀여울 거 같은데.. 쿠로미방에 있는 이 테이블도 인기가 많더라고요. 바 테이블로 되어있어 나란히 앉아서 음료를 즐길 수 있는 자리에요. 여기는 다른 룸인데 4인 테이블이 제일 괜찮았고 다른 2인 테이블은 방향이 벽 쪽으로 되어 있어 사진 찍기가 살짝 애매할 거 같기도 했어요. 카페하모니 이용 안내와 메뉴판이에요. 카페 이용 시간은 50분이며 4인 테이블은 3~4인만 착석 가능. 1인 1메뉴 주문 커피와 에이드, 티 세트, 마들렌, 쿠키 등을 주문할 수 있으며 디저트 종류는 다양하지 않은 편이에요. 저희는 아이스 아메리카노/ 복숭아 에이드/쿠로미 마들렌을 주문했어요. 저 쿠로미 마들렌이 5천 원이라는.. ㅋ 산리오 캐릭터가 워낙 인기다 보니 저희처럼 아이 동반 손님들도 있었지만... 연인들도 많이 오셨더라고요! 어른도 아이들에게도 인기 많은 산리오 친구들 ♡ 사실, 저도 좋아합니다 ㅋㅋ 기대를 많이 하고 가서 그런가 살짝 아쉬운 점도 있었지만 산리오 친구들을 만나볼 수 있는 이색적인 카페라 한 번쯤 방문해 보기는 좋았던 거 같아요. 예쁜 사진도 많이 찍고 아이도 좋아했던 망원동 카페하모니 산리오 카페~ 카페를 방문하고 망원시장 구경도 하고 왔는데 핫플레이스라 그런지 사람들도 많고 다양한 먹거리들도 많아서 간식도 사 먹고 구경하는 재미가 있더라구요. 바로 집에 가기가 아쉬워 망원시장도 구경하고 왔는데 아이와 함께 망원시장까지 구경하는 코스로 다녀오면 좋을 거 같아요~ 사랑스러운 쿠로미와 마이멜로디를 만나볼 수 있는 이색적인 카페/망원동 카페하모니 아이와 주말 나들이로 방문해 본 솔직 후기였습니다~!!"
