title,content
"망원동 마포구청 카페 누운 NUUN 커피와 위스키, 분위기까지 모든게 만족스러운 카페바","연차를 내고 뒹굴거리다 날씨가 너무 좋아보여서 책들고 마포구청역 근처에 가보려고 저장해두었던 카페 겸 바 누운 NUUN 으로! 망원동 마포구청역 카페 누운 NUUN 생긴지 얼마안된 신상 카페인데 분위기가 너무 좋아서 저장해둔 곳 눈, 누운(@cafe.nuun) • Instagram 사진 및 동영상 팔로워 769명, 팔로잉 1명, 게시물 54개 - 눈, 누운(@cafe.nuun)님의 Instagram 사진 및 동영상 보기 instagram.com 망원동 마포구청역 카페 누운 NUUN은 고즈넉한 분위기의 우드 인테리어가 진짜 취향 저격 마포구청역 카페 누운 NUUN은 공간이 소박하면서도 차분하고 고즈넉한 공간이라는 느낌을 받았는데 또 마냥 적막하지만은 않은 분위기였어요 자리마다 콘센트가 있어서 작업하기도 좋을 것 같아요 망원동 카페 누운 NUUN 채광이 좋아 낮에는 밝고 환해서 더 좋았는데 창문을 활짝 열고 커피 마시면서 턴테이블에서 흘러나오는 음악을 듣고 있으니 너무 좋았어요 준비된 LP 중에 원하는 음악이 있으면 틀어주신대요, 사장님 너무 친절 망원동 카페 누운 NUUN에서는 커피와 차음료 외에도 위스키를 팔아요, 하이볼로도 주문가능해서 낮에는 커피마시면서 작업하고 저녁에는 친구랑 간단하게 술한잔 혹은 혼술하기 딱 좋겠더라구요 저는 일단 대낮에 갔으니 라떼랑 크림브륄레 주문 위스키는 낮에도 주문 가능해요 마포구청역 카페 누운 심플하면서도 정갈한 우드인테리어 너무 맘에 들어 위스키를 팔아서 혼술하기에 좋은 바 테이블도 있어요 망원동 카페 누운의 위스키 라인업 진짜 날씨 좋을때 카페 누운에서 낮에 커피 한잔 마시고 해지면 또 다른 분위기에서 하이볼 한잔하면 딱일듯 분위기가 너무 좋아서 아지트 삼을려구요 마포구청역 카페 누운 벽에 걸린 화분 마저도 취향저격 박쥐란 집에서 키워보고 싶었는데 벽에 걸어야해서 실패 망원동 카페 누운 카페 소품과 인테리어 하나하나 디테일이 살아있어서 보는 재미가 있어요 사장님 센스와 감각이 대단하신듯 망원동 카페 누운은 커피 한잔을 주문해도 이렇게 트레이에 정갈하게 세팅해서 직접 가져다주시는데 되게 대접받는다는 느낌이 들더라구요 커피 한 잔이라도 손님을 배려해서 정갈한 세팅으로 가져다주시니까 기분이 되게되게 좋았어요! 한켠에 셀프바도 있는데 커피와 물 한잔을 세팅해서 미리 가져다주시는 사장님의 센스와 배려 최고 라떼 폼도 엄청 쫀쫀하고 아트 예술 커피 맛도 너무 고소하고 맛있었어요! 저는 산미가 강한 커피를 좋아하지 않는데 카페 누운 커피는 산미가 강하지 않고 고소하더라구요 도중에 디저트가 생각나서 크림브륄레 추가 망원동 카페 누운 크림브륄레 비주얼 영롱 카페 누운 가셨으면 크림브륄레는 꼭 드셔보세요 마포구청역 카페 누운 크림브륄레 너무 맛있어요 주문하면 직접 그 자리에서 토치로 만들어주시는데 겉은 바삭하고 달달한 식감에 부드러운 크림이 완벽 전 과하게 달지 않아서 더 좋더라구요 마포구청역 카페 누운 한적한 골목에 있어서 너무 붐비지않고 조용히 시간 보내다 올 수 있어서 좋았어요 다음엔 요 바테이블에 앉아서 하이볼이나 마셔야지 망원동에서 분위기 좋은 카페나 위스키바 찾으시는 분들 꼭! 마포구청역 카페 누운 안가본 사람 없게 해주세요 커피와 위스키 그리고 분위기에 사장님 친절함까지 완전 만족! 단골해야지 카페 누운 NUUN (커피와 위스키) 주소 : 서울 마포구 망원동 433-2 운영시간 : 12:00 - 22:00 / 매주 화요일 휴무 주차 공간 없음, 애견 동반 가능 누운 서울특별시 마포구 방울내로 60 1층 nuun #망원동카페 #마포구청역카페 #망리단길카페 #망원동신상카페 #카페누운 #NUUN #망원동위스키바 #망원동카페바 #망원동데이트 #망원동카페추천 #망원동핫플 #망원동작업하기좋은카페"
[망원] 분위기 좋은 망원동 카페 ‘누운’,"누운 서울특별시 마포구 방울내로 60 1층 nuun ⏰ 12:00-22:00 🏝️ 휴무일 : 수요일 🚘 주차 불가 오늘은 새로운 카페 ‘누운’에 가봤어요! 커피, 커피 외 음료, 디저트 뿐 아니라 주류도 있네요!! 그래서 영업 시간도 10시까지인가봐요:) 좌석도 여유있고 분위기도 좋아요! 저는 오늘 이미 커피을 마셔서 마차 라떼를 시켰는데 많이 달지 않고 맛있었어요. 따뜻한 물수건도 주셔서 대접받는 느낌이었어요🥰 주차 공간은 없지만 근처 공영 주차장에 대시면 되니까 큰 문제는 없을 것 같아요! #망원동 #망원동카페 #망원카페 #카페누운"
"[누운 nuun] 늦게까지 여는 마포 망원동 카페, 커피와 위스키 그리고 반려동물 대환영!","망원동에서 저녁을 해결하고 밤산책 중, 커피가 마시고 싶은데,, 맛있는 커피가 먹고 싶은데,, 하던 중에 찾아버린 카페 누운!!!! 이렇게 지나가다가 발견해부렀다!! 벽에 살짜쿵 양각으로 나와있는 카페 로고. 큰 간판이 없어 그냥 지나치기 쉽다. 이미 누운 카페를 경험해본 사람으로서 드러내려고 하지 않는 외관 디자인이 카페의 감성과 잘 어우러진다고 생각했다. 오트밀크 변경도 가능하다! 집가서 작업할거였기에 아이스라떼를 테이크 아웃으로 주문했다. 덤으로 좋아하는 디저트인 크림브륄레도 주문했다. 카페 누운 와이파이 정보 cafenuun11* 우린 금방 나갈꺼라서 만만한 창가 자리 찜 테이크아웃 잔이지만, 먹고 가도 된다고 하셨다 >< 로고 다시 봐도 너무 귀엽다. 라떼도 무난하니 맛있었던 기억:D 그냥 크림브륄레가 아닌 버번 크림브륄레여서 위스키향이 아주 사알짝 날 듯 말 듯 하다. 그게 여기 크림브륄레의 매력이고, 중독적이고, 자꾸 생각나고, 그래서 다시 갈 거다 ㅎㅅㅎ 늦은 저녁, 고요하면서 새벽감성 bgm이 흐르는 것이 묘한 느낌이 들게 하는 공간이다. 조금만 더 가까웠으면 진짜 내 아지트인데 말이다. 밤산책 겸, 여름에는 좀 더 자주 가야겠다. 잘 먹었습니다 - ! 4.0 ♥︎♥︎♥︎♥︎ 동네 카페로서 진짜 좋은 점수주고 싶다. 분위기, 서비스, 맛 다 만족스럽다. 다만 낮에 방문해 본게 아니라 사람이 많으면 어떤 분위기일지 모르겠다. 다음번엔 위스키 음료마시러 가볼거다. 크림브륄레는 꼭 먹을거다. 누운 서울특별시 마포구 방울내로 60 1층 nuun"
[망원동 카페] 누운(nuun) - 제주도 감성을 담고 있는 고즈넉한 카페,"안녕하세요, 망원동청년회장입니다. 오늘은 망원2동에 사는 동네친구가 넘 예쁜 카페에서 커피 한 잔 하고 있다길래 바로 달려갔습니다. 마침 가오픈 첫날이었는데요. 들어간 순간부터 카페의 고느적한 분위기에 바로 몰입되는 듯 했습니다. 마치 제주도 작은 골목 어딘가에 있을 법한 느낌을 주는 곳입니다. 망원동 속 작은 제주도를 느낄 수 있는 곳. 바로, 망원동 신상 카페 누운입니다. 망원동 카페 - 누운(nuun) 망원동 카페 누운 망원동 카페 누운 망원동 카페 누운 커피와 차 그리고 위스키와 칵테일도 즐길 수 있습니다. 정갈하게 놓여진 찻잔이 마음을 차분하게 해주는 듯 합니다. 망원동 카페 누운 망원동 카페 누운 따뜻한 햇살을 맞이할 수 있는 통창으로 되어 있어서 낮 시간을 충만하게 느낄 수 있습니다. 망원동 카페 누운 망원동 카페 누운 카페 누운은 '제주도 작은 골목 어딘가에 있을 법한 느낌' 이라고 소개드렸는데요. 전체적인 인테리어의 색감과 구조가 그 분위기를 만들어 주고 있는 것 같네요. 신기하게도 방문한 순간부터 ‘제주도에 온 것 같다’ 라는 생각을 했는데, 카페 누운을 오픈하기 전에 마포구 성산동에서 ‘일출봉’이라는 카페를 하셨다고 해요. 이곳도 ‘제주도’라는 지역의 영감이 이어지고 있는 게 아닐까? 하는 조심스러운 예상을 해봅니다. 인테리어로 마치 다른 지역에 와있는 것 같은 감정을 불러일으킨다는 게 참 신기하고, 매력적인 것 같습니다. 카페 누운에서 흘러나오는 음악은 이 공간에서 보내는 시간을 더욱 만족스럽게 만들어줍니다. 카페 분위기와 찰떡 같이 어울리는 음악이 흘러나옵니다. 크고 예쁜 스피커에서요. 이렇게 멋진 공간에서는 어떤 메뉴를 준비하는지도 보시죠. 카페 누운 메뉴 카페 누운 메뉴 저는 아이스 호지차를 주문했습니다. 정성스럽게 놓여진 물티슈도 괜히 기분이 좋아지네요. 다음에는 밤에 방문해서 칵테일도 마셔보려고 합니다. 밤 시간에 이 공간이 주는 느낌은 또 어떨지 매우 기대가 되네요. 자리마다 하나씩 콘센트가 마련되어 있습니다. 이것도 카페 누운의 큰 장점이자 세심한 배려네요. 망원동 카페 누운 열심히 사진 찍는다고 친구가 찍어준 제 뒷모습입니다. 귀엽게 잘나왔네요^^…ㅋㅋㅋㅋ 저는 요즘 스트레스 지수가 살짝 높아져 있는 상태였는데, 이렇게 멋진 공간에서 예쁨을 눈에 담으며 평온한 분위기 속에 있으니 기분이 한결 좋아졌습니다. 새로운 공간에 방문해서 신선한 자극을 받는 게 하나의 스트레스 해소법이 되고 있는 것 같아요. 여러분도 카페 누운(nuun)에 방문하셔서 평온하고 즐거운 시간을 보내시기를 추천드립니다. 망원동 신상카페 누운 포스팅은 여기서 마치겠습니다. 감사합니다. *운영 시간 : 매일 12:00 ~ 22:00 누운 서울특별시 마포구 방울내로 60 1층 nuun"
망원동 누운 카페,"망원동에거 5년정도 산것 같다 . 망원동에는 카페가 많이 생겨서 새로생긴 카페에 가는 재미가 있다 . 오랜만에 새로운 카페가 생겼다길래 주말에 방문해보았다 . 나름 분위기도 좋았고 , 테이블간 동선 간격도 근처 카페에 비해서 넓어서 대화하기 좋았다 . 그저 커피와 디저트를 조용히 먹고 , 기분좋게 주말을 마무리 하기 좋았던 카페였다 . 인스타에 디져트와 커피를 올렸는데 가격대비 퀼리티가 좋다고 , 어느 카페인지 물어보는 지인이 있었다 . 디저트 퀼리티 , 커피 퀼리티 둘다 만족 스러웠다 ☺️ 가장 만족스러웠던건 , 따뜻한 물티슈를 주시는 것 . 호텔 카페 서비스 같았다는 👍 누운 서울특별시 마포구 방울내로 60 1층 nuun #망원동카페 #서울투어 #데이트 #서울데이트코스 #카페누운 #누운 #마포구청카페 #카페 #망원동투어"
[망원동] ‘누운’ 제주도감성 카페 | 망원동카페 추천 | 커피맛 좋은 카페,생긴지 한달두달? 정도 된거같은 카페 밖에서 보면 간판이고뭐고 없어서 그냥 지나칠수도 있을듯 첨에는 카페이름이 옆에있는 바버샵인줄 알았다ㅋㅋㅋㅋ 메뉴판이다 테이크아웃 할인 있음!! 천원이었나 라떼는 테이크아웃하면 4000원! 전체적으로 명도채도가 낮은 우드톤 인테리어 근데약간 풀을 곁들인 찾아보니까 제주도에서 이전하신 카페라고 하는데 알고보니까 약간 제주도느낌이 나는거 같기도 하다 칵테일도 파시는거 같았다 사람이 막 붐비는 위치에 있는 카페는 아니라서 아직은 사람이 막 몰리지는 않는 것 같다 노트북 가져와서 작업 하시는 분들도 많이 보였음 하지만 나는 테이크아웃을 했지 여기 커피 엄청 맛있어요 추천!!ㅋㅋㅋㅋ 담에 먹고갈일이 있으면 다시 후기 올려보도록 하겠슴
망원동 넷이 누운 집 업로드,요즘 세상에... 감각을 믿어보겠다는 멋진 말이 있었다.
망원동 치과 혹시 너 자고 있니? 누운 사랑니 뽑아서 깨워줘야 됩니다.,"반갑습니다. 연세파미에 망원동 치과 입니다. 사랑니 혹은 제3대구치. 이것은 치아 중에 맨 마지막에 맹출되는 것으로 평균 고등학생~대학생 즈음에 찾아볼 수 있습니다. 물론 사람마다 나타나는 때가 다르기 때문에 정확한 시기를 알아맞추는 것은 불가능합니다. 어쨌든 이것을 찾게 되었을때 다들 고민에 빠지실 겁니다. 발치해야되나 말아야 되나 두가지 선택지에서 말이죠. 근데 대체로 올곧게 나오는 형태는 아니기에 발치를 하는 경우가 많습니다. 그리고 누운 사랑니 또한 예외없이 뽑아야 되는데요. 오늘 연세파미에 망원동 치과 와 같이 이를 빼야되는 이유를 살펴보겠습니다. 혹시 너 자니? 이런 형태가 나타나는 이유는 무엇일까요? 그 이유는 인간의 성장 과정에 있습니다. 저 먼 옛날 오스트랄로피테쿠스였을 시절, 이를 32개 사용하고 있었습니다. 그런데 점점 문명이 발전됨에 따라 질기고 딱딱한 음식을 익혀 먹을 수 있게 되었습니다. 점점 턱운동을 과하게 할 필요성이 없어졌으며 그로 인한 퇴화로 턱뼈가 점점 협소해진 겁니다. 협소한 공간에 이가 나오려해도 올곧게 나올 자리가 없는데 올바르게 나올 수 있을까요? 그리고 본래 배열되어있는 치열에서 모자란 공간을 비집고 맹출되는 것으로 이처럼 옆으로 기울어 누운 형태로 맹출되는 겁니다. 여러 모로 구강 건강을 해칠 가능성이 높아 망원동 치과 는 이를 뽑아버릴 것은 권장드리고 있습니다. 어떤 악영향을 끼칠까? 모습을 보면 답이 나옵니다. 비집고 틀어 나오기에 틈새가 생성될 수 밖에 없습니다. 이런 구조에서 식사를 진행한다면 음식이 잘 끼어있겠죠? 남아있는 찌꺼기에 침과 세균이 결합하게 되어 치태(플라크)를 형성하며 점점 굳어져 치석을 형성합니다. 충치와 치주 질환을 일으키는 사유가 되어 치아와 잇몸이 악화될 수 있습니다. 그래서 망원동 치과 는 그런 일을 겪지 않도록 신속히 정밀진단 후 치료 계획을 수립하여 이를 뽑습니다. 어떻게 뽑을까? 아무래도 누운 사랑니는 확실히 드러나지 않기에 망원동 치과 는 파노라마(X-ray)와 CT 촬영으로 정확한 형태와 위치를 파악합니다. 정확한 진단을 통해 계획을 수립하여 이를 뽑아내는데요. 준비되었다면 발치 부위에 마취를 진행합니다. 마취가 잘 되었다면 잇몸을 절개 후 이를 확인합니다. 올곧은 케이스라면 이렇게 할 필요없이 쏙 뽑아낼 수 있으나, 누워있는 것으로 뽑아내는 것이 어렵습니다. 그래서 조그맣게 쪼갠 뒤에 조각 조각 떼어내줍니다. 이런 과정을 통해 사랑니를 처리합니다. 발치 후? 그럼 이를 뽑은 뒤에 어떻게 해야 될까요? 회복이 우선이겠죠? 망원동 치과 는 해당 부위에 거즈를 물려드립니다. 출혈이 나는 곳에 지혈함으로써 피를 멎게 해야 되기 때문이죠. 대략 2~3시간 뒤에 피가 어느 정도 멎었다면 빼내셔도 괜찮습니다. 물론 거즈를 없애서 피가 안나는 것이 아닙니다. 조금씩 나오는데 이것을 그대로 삼켜줍니다. 뱉어내면 오히려 더 자극을 줘서 피를 멎게할 수 없습니다. 또, 식사는 영양죽, 스프, 으깬 감자나 고구마 종류를 드시면 됩니다. 뜨겁고 짜고 매운 것은 해당 부위에 자극을 줘서 회복을 더디게 만들어버립니다. 그리고 그 후 청결한 환경을 유지할 수 있도록 양치질을 해야 되겠죠? 되도록 칫솔질은 덧나게 만들 수 있으니 식염수 또는 전용 가글로 가볍게 헹궈내는 것이 좋습니다. 담배와 술은 실밥을 풀고 다 회복되기 전에는 금연 및 금주를 행하도록 합니다. 운동도 마찬가지로 발치 후 3일 뒤에 가벼운 조깅으로 가볍게 운동하기 바랍니다. 혈액 순환으로 피가 빨리 돌수록 지혈을 방해할 수 있기 때문입니다. 누운 사랑니. 왜 뽑아야 되는지 오늘 포스팅을 통해 알아보았으며 여러분들께 도움이 되셨기를 바랍니다. 궁금하거나 문의할 사항이 있을때, 언제든 연세파미에 망원동 치과 에 연락 부탁드립니다. 연세파미에치과의원 서울특별시 마포구 양화로 151 4층 신촌 치과 사랑니 발치 부작용없이 깔끔히 뽑으세요. 안녕하세요. 신촌 연세파미에 치과 입니다. 영구치 맹출 후 또 다른 이가 자라나는 것을 알고 있으십니까? ... blog.naver.com 합정역 치과 올해는 스케일링 까먹지 말고 꼭 받으러 오셔요~ 식사를 끝마친 뒤에 양치질을 하십니까? 대체로 밥 먹은 후 칫솔로 이를 깨끗하게 닦으실 겁니다. 그런데 ... blog.naver.com © Pixel_perfect, 출처 Pixabay"
