title,content
#망원동카페 #망원동디저트 #망원동커피 #리벌티 망원 #딸기크림치즈브리오슈 #핑크솔트아인슈페너 #로투스크림라떼 #말차캐슈넛 스모어쿠키,"안녕하쎄요오오오 씬이나입니당! 히히 오늘은 이쁜 동기녀석과 다녀왔던 망리단길 분위기 좋은 카페면서 디저트도 너무 맛있었던 망원동카페 망원동디저트 망원동커피 리벌티 망원을 포스팅하려고 해요! 와.... 진짜 여기는 카페 분위기도 너무 좋은데! 커피랑 디저트 비주얼도 너무 좋더라구요! 심지어 존맛탱구리!!!>_< 인스타감성 사진도 너무 잘 찍혀서 인생샷 여러개 건질 수 있는 이곳으로 오세요~~~ 망원동카페 망원동디저트 망원동커피 리벌티망원 리벌티 망원 서울특별시 마포구 포은로 108 1층 매일 11:00 - 23:00 0507-1361-3877 위치는 여기! 들어가기 전에 차르르르칵칵 오늘 눈이 엄청 왔잖아요!! 그래서 엄~~청 추웠답니다 ㅜ^ㅜ 엄청난 추위를 뚫고 갔는데 와.. 진짜 안왔으면 엄청 후회할 뻔했어요!! 진짜 너무 좋다긔!!>_< 디저트로는 이런 귀여운 쿠키들이 있었는데욘 ㅠ 흐미~~~ 너무 귀엽고 소중해~~~ 종류는 6개 마카다미아 르벵 쿠키, 더블초코 피칸 르벵 쿠키, 흑임자 아몬드 르벵 쿠키, 말차 캐슈넛 스모어 쿠키, 로투스 스모어 쿠키, 오레오 스모어 쿠키가 있었는데요! 저희는 말차 캐슈넛 스모어 쿠키로 주문했어욘! 히히 메뉴판이구요! 저는 핑크솔트 아인슈페너 7.500원으로 주문했고, 이쁜 동기녀석은 로투스 크림라떼 7.500원으로 주문했답니당 히히 그리고!!! 망원동카페 망원동디저트 망원동커피 리벌티 망원에 간다면 꼭!! 먹어야 할 디저트인! 딸기 크림치즈 브리오슈/8.000원/를 주문했어요~~~ 망원동카페 망원동디저트 망원동커피 리벌티 망원의 카페 내부 모습인데욘 카페 중앙에 저런 에탄올 램프랑 잡지들로 인테리어 해둔게 너무 인상적이더라구요~ 가운데 있는 불 계속 보게 돼여 ㅋㅋㅋㅋㅋ 인스타갬성 뿜뿜 ㅋㅋㅋㅋㅋㅋㅋ 작은 소품들 하나하나 너무 귀엽고 소중했답니당 히히 그리고 저희가 주문했던 음료랑 디저트가 나왔어요! 쿠ㅜㅜㅜㅜ 아니.... 진짜 ㅜㅜㅜ 너무 이쁘죠.... 커피가 맛있으면 그만이지 이렇게까지 이쁠 필요가 있나요!? ㅜ^ㅜ 너무 이뻐요~~~ 어케 먹는담.. 키키 여자들이 정말 좋아할 것 같은 비주얼이구요! 디저트들도 하나같이 다 너무 이쁘고 맛있어보인다능!! 사장님이 혼자 카페 운영하시는 것 같던데 디저트랑 커피에 디테일이 살아있고! 엄~청 신경쓴게 느껴져요!! 음료랑 디저트는 직접 자리까지 가져다주신답니다! 그리고 다 먹으면 두고 가시면 돼요! 직접 치워주세욘!! 제가 다 먹고 치우려고 쟁반 가지러 가니 그냥 두고 가시라구..... 흐어어업/// 이건 이쁜 동기녀석이 주문했던 로투스 크림라떼인데여 오우! 역시 로투스과자가 통째로 한개 들어가 있었답니당 키키 그리고 루토스과자 가루가 크림 위에 뿌려져있는 디테일 좀 보세요 ㅠ 사장님 센스쟁이~~~~>_< 그리고 여기 컵이 너무 이뻐요!! ㅋㅋㅋㅋㅋㅋ 제가 컵 욕심이 좀 있는데 소장 욕구 뿜뿜이랍니당! 로투스 크림라떼라는 이름에 걸맞게 크림에서 진짜 로투스 맛이 나요! ㅋㅋㅋㅋㅋㅋㅋ 어쩜 크림도 저렇게 많이도 주시고!! 크림이 엄청 쫀쫀하거든요~~~~~ 로투스맛이 나는게 넘넘 신기했네욘 키키 근데 로투스과자가 너무 길쭉하고 커서 이쁜 동기녀석이랑 우리가 아는 로투스 맞냐고 ㅋㅋㅋㅋㅋ 엄청 웃었어요 키키 이런 사소한 거에 즐거워하는 저희 둘. 히히 이건 제가 주문한 핑크솔트 아인슈페너인데욘! 원래 돌체라떼 먹고 싶었거든요 ㅋㅋㅋㅋㅋ 근데 ㅠ 핑크솔트 아인슈페너가 망원동카페 망원동디저트 망원동커피 리벌티 망원의 시그니처 메뉴인 것 같고! 어디가서 또 못먹을 것 같은! 아주 끌리는 비주얼이자나여..!? 그래서 ㅠ 이거 시켰는데 ㅠ 진심 넘넘 잘한 선택이었답니당>_< 핑크솔트 크림이라서 그런지 크림색이 저렇게 핑쿠핑쿠 했구요! 위에는 식용장미꽃이 올라가 있어요! 장미꽃 때문인지 커피를 한입한입 마실 때마다 장미향이 은은하게 나서 너무 좋더라구요! 과연 내가 마시고 있는 이것이 핑크솔트 아인슈페너인가 장미 커피인가! 키키 크림 양도 엄~~청 많이 주시고! 크림도 엄청 쫀쫀하고! 솔트라서 그런지 크림이 달면서 짜더라구요 ㅋㅋㅋㅋ 이것이야말로 단짠!? 키키 망원동카페 망원동디저트 망원동커피 리벌티 망원의 시그니처 메뉴인 것 같았던 딸기 크림치즈 브리오슈! 사실 저는 이날 브리오슈를 처음 먹어봤는데요! 오우! ㅠ 이걸 왜 이제야 먹게 된 걸까요? ㅜ^ㅜ 존맛탱구리... 제가 요즘 딸기 케이크에 빠져있는데 ㅠ 어쩜 딸기쨈도 달달구리하고 맛있고! 크림치즈도 맛있구! 빵이랑 조합이 넘넘 좋더라구요~~~~ 먹기 좋게 ㅋㅋㅋㅋㅋㅋ 다 잘라줬어요 ㅋㅋㅋㅋㅋㅋ 비주얼은 좀 그렇지만 맛있기만 하면 되자나여!? 안그래여!? 키키 위에 올라간 생딸기랑 같이 냠냠쩝쩝 먹어주면 ㅠ 을매나 맛있게요!? 딱 제가 좋아하는 그런 디저트라서 후식으로 먹기 너~~무 잘했다고 생각했답니다! 혹시나 방문하실 잇님들이 계시다면 딸기 크림치즈 브리오슈 추천이요! 이쁜 동기녀석이 추가로 골랐던 말차 캐슈넛 스모어 쿠키 위에 녹차맛 웨하스인가요!? 색이 왜 초록색이지!? 근데 ㅋㅋㅋㅋㅋ 생각해보니 저 웨하스를 이쁜 동기녀석이 먹었나 봐요 ㅋㅋㅋㅋㅋ 제가 안 먹었거든요 ㅋㅋㅋㅋㅋㅋㅋㅋ 그래서 웨하스 맛은 어땠니? 동기녀석아!? 키키 쿠키는 말차맛이 굉장히 진해서 좋았고! 안에 가 엄청 꾸덕꾸덕하더라구요! 딱 제가 좋아하는 꾸덕함! 히히 그리고 캐슈넛이 들어있어서 고소하고 씹는 식감도 좋았답니다! 망원동에 분위기 있는 카페를 찾으신다면! 망원동에 후식으로 먹을 디저트 맛집을 찾으신다면! 망원동에서 디테일이 살아있는 커피를 찾으신다면! 망원동카페 망원동디저트 망원동커피 리벌티 망원 정말 추천하고 싶어요~ 커피랑 디저트가 너무 이쁘고! 사진 찍기도 너무 좋았던 곳이랍니다>_< 오늘의 일기 끄읏~!"
"[망원동 카페] 자갈과 블랙, 쇠인테리어(?)로 유니크한 갬성카페 ‘리벌티 망원(Liberty mangwon)’","리벌티 망원 서울특별시 마포구 포은로 108 1층 영업 시간 매일 11:00 - 23:00 연락처 0507-1361-3877 안녕하세요 떵이입니다 ~ 오늘은 망원동에 유니크한 갬성카페 #리벌티망원 소개해드릴게요! 외관에 따뜻한 벽돌감성으로 시선을 사로잡은 #리벌티망원 내부도 기대를 저버리지 않고 평범하지않음을 빛냈는데요~ 블랙인테리어에 쇠가구(?)를 배치해 차분하면서도 유니크함이 느껴졌습니다. 그리고 중앙에 화룡점정 블루 투명 아크릴판으로 리벌티망원 로고가 뙇! 자갈위에 있어서 더 돋보였어요. 뭔가 예술작품 같음 ㅎㅎ 인더스트리얼 디자인의 빈티지한 벽질감이었는데 그 위에 붙은 포스터가 조화로운 것이 너무 예뻐서 찍었습니다 ㅎㅎ 여기도 좋았던 구역!! 2인쇼파가 많은데 편해보였어요~ 나도 남자친구랑 같이 이런데서 도란도란 얘기할 수 있는뎅... 음료제조 및 주문받는곳 입니다~ 거기서 눈에 띄었던 것 ㅎㅎ 좀 힙하다는 카페만 있는 맥 메뉴판 ㅋㅋㅋㅋ 맥을 메뉴판으로 쓰고 있는 이 브루주아급 애플 갬성,, 스크린 메뉴 특성상 메뉴 바뀔 때마다 편집이 편해서 좋을 것 같긴 해요 ㅋㅋㅋ 먹음직스러운 스모어 쿠키들 휴지고정대도 예술작품 같았어요 ㅋㅋ 바닐라빈 라떼 5,800원 컵도 예쁘고 뚜껑도 예쁘고 맛은 최고!! 커피향이 진한 것이 깊이가 느껴졌고 무엇보다 너무 맛있었어요! 커피 잘 안먹는 제가 밀크티처럼 들이킨 것을 보면 진짜 맛있었던 것임... 하하 한 주의 시작, 월요일 힘차게 잘 시작하셨나요!? 모두 으쌰으쌰 힘내시고 소확생 즐기면서 갓생 살아보자고요~~ 화이탱"
망원동 카페 망리단길 분위기 좋은 카페 - 리벌티 망원,"연남동이 핫플이라 사람이 늘 북적대지만 난 연남동보단 망원동을 더 선호한다 망원동 만이 갖고 있는 분위기가 있다 많이 북적이지 않고 그렇다고 너무 조용하지 않은 너무 핫하지도 않고 그렇다고 촌스럽지 않은... 그래.. 편안함 나에게 망원동은 마음이 편안해지는 곳이다 살고 싶어지는 동네 그런 동네에 분위기가 좋은 카페 바로 리벌티 망원 리벌티 망원 : 네이버 방문자리뷰 198 · 블로그리뷰 161 naver.me 위치 및 주차 정보 서울 마포구 포은로 108 1층 / 망원역 6번 출구에서 600m 망원시장 근처에 있어 찾기 쉽다 특히 망원1동 주민센터 앞 공영주차장을 이용하면 되니 주차도 편리하다 영업시간 매일 11:00 ~ 23:00 통유리로 되어있는 망원동 카페 리벌티 내부 인테리어 밖에선 안이 잘 안 보이는데 안에서는 밖이 잘 보이는 특수 유리로 되어 있는 듯 신기신기 중간에 돌무더기(?) 같은 게 있는 신기한 인테리어다 특이해서 사진 찍기엔 좋은데 잘 못하다간 넘어질 것 같다;; 조심조심 다녀야 할 듯~ 사람이 없을 때 찍긴 했지만 분위기가 조용해서 그런지 혼자 와서 공부하거나 책 읽는 손님들이 많았다 그만큼 분위기가 좋은 곳!! 원두를 직접 볶으시는지 한쪽엔 원두도 따로 팔고 있다 ""The anomaly in the rules"" 예외적인 규칙이란 뜻인가... 무슨 뜻인지 궁금하다 메뉴 망원동 커피 맛집답게 커피 메뉴도 다양하고 원하는 원두를 고를 수 있다는 장점이 있는 곳! 그리고 2000원이면 아메리카노 리필도 해준단다! 이래서 공부하는 학생들이 많았군요!! 합리적인 곳입니다 수제 쿠키들 쿠키는 못 참지... 하나하나 다 맛보고 싶어지는 비주얼이다 고민 끝에 우리가 시킨 메뉴는 오렌지 비앙코 라테 아인슈페너 마카다미아 르뱅쿠키 요즘 오렌지 시럽 들어간 커피가 유명이라면서요?? 궁금한 건 못 참는 ISFJ... 바닥에 있는 오렌지 시럽을 잘 섞어서 먹어줘야 함 음? 생각보다 맛있다 커피에 오렌지 주스 탄 맛이 나면 어쩌지 살짝 걱정했는데 생각보다 오렌지 향이 강하지 않음 커피와 오렌지의 조합이라니 새로운 조합~!! 나같이 새로운 조합에 도전하길 좋아하는 사람들에게 꼭 추천~!! 아인슈페너는 맛이 없을 수 없는 비주얼 크림 한 입 얻어먹었는데 크~~달달하니 맛있다! 근데 저 꽃 장식은 민들레가 맞을까... 마지막으로 마카다미아 쿠키 여기 쿠키 맛집이었음 커피만 맛있는 게 아니었음... 여기 쿠키 꼭 드세요~! 속까지 쏙쏙 박힌 마카다미아의 고소함과 초콜릿의 달달함 르뱅쿠키의 촉촉함 아~~표현이 안되는 맛 ㅠㅠ 많이 달지도 않고 진짜 맛있다 망원동 디저트 맛집 맞았음... 망원동에서 조용하고 분위기 좋은 카페에서 맛있는 커피와 디저트를 맛보고 싶은 사람들에게 추천!! 리벌티 망원 서울특별시 마포구 포은로 108 1층"
"[망원동] '리벌티망원' 모던 깔끔한, 블랙시크 인테리어카페 | 커피맛도 좋은 카페 추천 | 망원동 힙한 카페추천","리벌티 망원 서울특별시 마포구 포은로 108 1층 https://www.instagram.com/liberty_mangwon/ Liberty 망원(@liberty_mangwon) • Instagram 사진 및 동영상 팔로워 1,858명, 팔로잉 544명, 게시물 93개 - Liberty 망원(@liberty_mangwon)님의 Instagram 사진 및 동영상 보기 www.instagram.com 이번에 가본 카페는 그 주변에 다른 카페 왔다갔다 하다가 못보던 카페가 생겼길래 예전부터 눈도장 찍어놨던 곳이다 문틈으로 살짝살짝식 보이는 내부가 되게 깔끔하고 좋아보였음ㅎ 외부에서부터 느껴지는 힙함.ㅋㅋ 저 까만 벤치에앉아서 사진도 많이 찍으시더라구요 난 거지꼴이엇으므로 다음기회에 들어오자마자 바닥에 보이는 범상치않은 인테리어 근데이거 못보고 밟을뻔한분들 많더라구요 조심하세여 몬가약간 전체적인 느낌이 딥디크 쇼룸같은 느낌...? 메뉴판 참고하세영 저희는 라떼랑 애플망고에이드, 딸기크림치즈 브리오슈 시켰어요 커피는 원두도 고를수 있었어요 산미없는 블랙슈가, 밸런스잡힌 로제, 산미있는 시즈널 베리 중에 고르면 돼요 우린 안시켰지만 쿠키도 인기메뉴인거같았어여 쿠키도 하나 먹어볼걸,,ㅠ 기다리면서 찍은 인테리어 갠적으로 넘 깔끔해서 좋았어요 창가쪽은 은근 해도들고! 유일한 단점이라면 덜컹거리는 테이블ㅋㅋ 거울샷 전용좌석ㅋㅋㅋㅋ 메뉴는 기다리니까 자리로 갖다주셨어요!! 테이블이랑 트레이랑 컵, 식기류들까지 넘 센스있고 잘어울림ㅠㅠ 언젠가 내 집이 생긴다면 이렇게 꾸미고 살고싶음ㅠ 딸기 크림치즈 브리오슈!! 브리오슈라는 디저트는 첨먹어봤는데 나쁘지않았어요 밑에깔려있는건 식빵이었음! 그리고 대망의 커피 제가고른원두는 블랙슈가라는 원두였는데 커피 진심으로 맛있었어요 그냥 라떼였는데도 향때문인지 되게 달고 고소하게느껴졌어요 ㅠㅠ 애플망고에이드 먹은친구도 맛있었대요 -브리오슈 조지는중- 다 조짐ㅎ 커피진짜 짱맛 담에 커피만 테잌아웃하러 한번더 와야겠어여 리벌티 망원! 커피 디저트 둘다 존맛인 카페로 추천할게요..!!ㅋㅋㅋㅋ 재방문의사 100% +) 브이로그 업로드 했어요!! https://youtu.be/ROFe9aMZQlQ"
서울 망원동 ‘리벌티 망원’,베리와 망원동 데튜~ 소금빵 맛집인 리벌티 망원점 방문했다! 리벌티 망원 매장 중간엔 이렇게 갬성 한 가득인 바닥이 있음 리벌티 메뉴판과 디저트 쿠키와 뒷편에 소금빵 저때가 아마 할로윈 전 쯤이라 인테리어가 할로윈으로 꾸며져있었다. 전체적으로는 까만 인테리어. 깔끔 그 자체 나의 아메리카노와 베리의 딸기에이드와 소금빵 소금빵...존맛..... 베리가 소금빵 맛이 좋다했는데 인정합니다. 소금빵 먹고 싶은 사람 리벌티 망원 방문해보셔요 리벌티 망원 서울특별시 마포구 포은로 108 1층 영업시간 매일 09 : 00 - 23 : 00 주차장 따로 없음
"[서울 나들이] 책방 ‘로우북스’, 망원동 카페 ‘리벌티 망원’","언니가 나 서울 오면 구경시켜준다고 데려간 망원동 망원동 많이 들어는 봤는데 사실 어떤 곳인지는 나는 잘 모른다 (나는야 촌사람) 따라가보니 사람들이 별로 없고 한적한데 길목마다 귀엽고 이쁜 소품샵도 있고 다양한 카페들도 있었다. 이날 꽤나 사람이 없어서 좋았음 뭔가 옛날 벽돌로 만들어진 옛날 건물 그리고 그런 거리에서 한국만의 느낌의 느낄 수 있는 동네라는 생각이 들었다. 뭔가 여기 사시는 분들은 주말에 사람이 많이 없다면 여기서 커피 마시면서 그만의 매력을 한껏 느낄 수 있지 않을까 싶었다. 처음 도착해서 들린 '로우북스' 언니랑 책 이야기하고 있으니까 사장님께서 오셔서 책 설명해 주고 내가 좋아하는 작가들 이름 듣고 책도 추천해 주셨다! 추천해 주셨던 책 중에서 작가 김청귤의 '재와 물거품'을 샀다. 두꺼운 책이기보다는 가벼운 책으로 나온 거라서 10,000원에 구매하였다. 그렇게 또 언니랑 돌아다니다 이쁜 소품샵이 나오길래 들린 곳 언니가 여기에 신기한 게 많다고 해서 한 번 들어가 보게 되었다. 저 창문에 보이는 귀여운 지브리 캐릭터들ㅋㅋㅋㅋ 정말 아기자기한 소품들이 많고 요즘 문구샵에서 볼 수 있는 제품들도 있었지만(지브리 같은 거) 그렇지 않은 것이 더 많아서 볼거리가 많았던 소품샵 뭐 산 건 없지만 언니랑 재밌게 잘 보고 나왔다. 언니랑 돌아다니다가 커피를 좀 마셔야 될 거 같아서 들린 카페 '리벌티 망원' 리벌티 망원 서울특별시 마포구 망원로7길 65 1층 ⏰ 월화수목 11:00 ~ 20:30 영업 금토일 11:00 ~ 21:00 영업 📞전화번호 0507-1361-3877 리벌티 망원(@liberty_mangwon) • Instagram 사진 및 동영상 팔로워 2,002명, 팔로잉 530명, 게시물 124개 - 리벌티 망원(@liberty_mangwon)님의 Instagram 사진 및 동영상 보기 instagram.com 안이 많이 넓진 않았지만 다행히 자리가 있어서 언니랑 앉을 수 있었다. 꽤나 인기가 있는 카페인지 손님들이 많이 계셨다. 언니랑 시킨 바닐라빈 라떼, 리벌티 에이드, 리벌티 르뱅 쿠키(말차 캐슈넛 르뱅 쿠키) 커피도 맛있긴 했지만 개인적으로 쿠키가 정말 쫀득하니 맛있었다. 원래 쿠키 같은 거 조금 텁텁하고 그런 게 싫어서 잘 안 먹는데 이거는 부드럽고 쫀득해서 더 사 먹고 싶은 마음이 들 정도였다. 여기서 언니랑 푹 쉬다가 또 여기저기 돌아다님ㅋㅋㅋ 이날 귀여운 소품샵이랑 문구샵도 많이 갔었는데 사진 찍는 걸 깜빡했닼ㅋㅋㅋㅋㅋㅋ 이런 핑계로 나중에 망원동에 또 한 번 더 놀러 갈 생각"
[cafe] 리벌티 망원_ 크림라떼가 맛있는 망원동카페,"리벌티 망원 매일 11:00 - 23:00 망원역 2번 출구에서 5분거리 평일 연차를 즐기러 망원동에 다녀왔다 망원동 골목골목은 언제가도 새로워*_* 이날은 크림라떼 맛집이라는 리벌티 망원에 방문! 카페 앞에 포토존이 있어서 다소곳하게 사진 찍었다.. (유리창으로 지나가는 차들이 비쳐서 타이밍 잘맞춰야함) 이유리가 참 예뿌더라구요…? 카페 안에서는 밖이 보이는데, 밖에서는 안이 안보이는 특이한 구조 신박해 리벌티망원의 메뉴🖤 아이패드로 보이는 사진 속 디저트들이 넘 맛있어 보였다ㅠ ㅠ 디저트 뿐만 아니라 시그니처 커피메뉴들도 같이 볼수 있었다:) 이거랑 로투스 크림라떼랑 많은 고민을 했다지 요새 카페에 방문하면 시그니쳐 메뉴를 먹어보는 습관이 생겼다 카페가 추구하는 맛과 분위기가 무엇인지 잘 느낄수 있달까…?🤔 쿠키도 있었다..🫠♥️ 쿠키러버인 나로써 정말 지나치기 싫었지만 이날 저녁을 폭식(?) 할 예정이었기 때문에 눈 꾹 감고 안시켰다. 지금 포스팅 쓰는데 또 먹고싶긴해… 특히 저 말차 스모어 쿠키@ 고민고민하다 메뉴를 시키고 - 카페 곳곳을 둘러보았다 평일 오후 시간인데도 꽤 손님이 많아서 테이블은 못찍었다🥲 벽이 콘크리트로 되어있어서 더 감각적인 느낌이! 한켠에는 포토존도 있었는데 바로앞에 손님이 앉아계셔서 거울샷은 패쓰..ㅜㅜ 가게 곳곳 돌멩이 친구들이.. 카운터 조차 갬성 그득 카페 분위기 전체가 어둑어둑했다 카페 한가운데 있었던 인테리어 지나다니실때 조심하셔요 ㅎㅎ 드디어 나온메뉴! 영롱하다 로투스 크림라떼 7.8 (가격은 좀 사악하긴 하더라..) 그릇 주변에 뿌려진거도 로투스 가루!ㅋㅋ 센스 있으셔 쫀득한 크림은 아니었고- 적당히 크리미한 느낌? 예상했던 로투스 맛 그잡채~ 로투스를 크림에 찍어먹으면 얼마나 맛있게요~ 크림 자체는 달달했지만 에스프레소는 다른 집들보다 조금더 진한 기분이었다 ! 그래서 그런지 전체적으로 막 달달하지는 않았다 셀카도 은근 잘나온댜 *_* 넘 밝지 않아서 오히려 더 좋았던-! 다음에 가면 디저트를 꼭 먹어보고 싶은 리벌티 망원 주말에는 웨이팅 있을 것 같은 기분.. 망원동 분위기 맛집 찾으신다면 요 카페 추천드립니동 ↓↓위치는 요기↓↓ 리벌티 망원 서울특별시 마포구 포은로 108 1층"
리벌티 망원(Liberty Mangwon) :: 망원동 힙한 카페! 분위기 굿!,"리벌티 망원(Liberty Mangwon) 망원역 2번 출구 도보 9분 안녕하세요! 똥글똥글한 일상을 보내고 있는 똥그리입니다:)! 망원동에 놀러갔다가 힙한 카페를 발견해서 소개해드리려고 해요! 망원동 힙한 카페 리벌티 망원이에요! 개인적으로는 이 간판이 심플하니 마음에 들었어요ㅎㅎ 안으로 들어가보실까용~? 망원동 힙한 카페 리벌티 망원 매장 내부에요!! 블랙 디자인 내부가 힙해보입니다ㅎㅎㅎㅎ 리벌티 망원 메뉴판이에용! 쭉 스캔해봅니당~~ 리벌티 망원은 원하는 원두로 고를 수 있어서 좋은 것 같아요! 디저트가 눈을 사로잡습니다... 너무 맛있겠자나~~~!!!!!!! 밥을 먹고 와서.... 배가 너무 불러서..... 욕심 안부리고 한 개만 주문했어요.. 한 개만... 왜 그랬어 나 자신...... 아이스 아메리카노(Black sugar), 오레오 크림 라떼, 로투스 스모어 쿠키 주문..! 목이 말라서 물을 먼저 받았는데 컵은 또 왜케 제 스타일인가여...? get하고 싶은 욕구 충만!!!!! 물 한모금하고 매장 내부를 더 둘러보았어요! 매장 가운데에 있는 이 인테리어마저 너무 힙하네요..!! 사장님 인테리어에 진심이신 것 같아요ㅎㅎㅎ 정성이 느껴집니다!! 이로 인해 분위기 더 멋지다 멋져~~~ 여기에 힙한 노래까지 더해주고요~~~ 리벌티 망원 로고 마저 내 스타일~~~~~~~~~~~~ 원두도 판매하고 있어요!! 커피 드셔보시고 맛있으면 구매 고고! 드디어 주문한 커퓌가 나왔어요!! 무심한 듯 있는 벽면과 함께 찍어주니 힙함이 더해집니다>.< 시그니처로 있을 법한 맛! 오레오 크림 라떼 너무 맛있쟈나~~~~~~~ 달달한 오레오 크림에 라떼까지 스윽 마셔주면 굿굿~~~! 사촌언니가 아메리카노도 맛있대용!! 로투스 스모어 쿠키 쪼개 먹기!!! 달달구리 한게 너~무 맛있었다구요~~~~ 인테리어, 분위기, 노래마저 다 힙했던 리벌티 망원!! 또 방문하게 되면 다른 시그니처 커피랑 다양한 디저트를 먹어봐야겠어요!!!!!! 리벌티 망원 서울특별시 마포구 포은로 108 1층"
망원동카페-리벌티 망원/망리단길 카페,"#망원동카페 #망리단길카페 #망원동데이트코스 #망원동힙한카페 #리벌티망원 리벌티 망원 서울특별시 마포구 포은로 108 1층 망원동 돌아다니기 2탄으로 갔다 온 우연히 발견한 힙한 카페예요. 근처를 돌아다니다가 발견하고는 외관도 예쁘고 후기도 좋아서 바로 친구랑 들어갔어요. 안에 들어가니 역시나 분위기랑 인테리어가 너무 예뻤어요. 힙한 분위기도 있고 마침 손님도 없어 조용하니 좋았어요. 그 후 저희가 손님을 몰고 왔나 좌석이 꽉 차더라고요. 화장실은 건물 2층에 위치해있어서 엘리베이터를 타고 가시거나 계단으로 올라가야 했어요. 저는 역시나 오늘도 아이스 아메리카노를 시켰어요. 원두는 로제, 블랙슈가, 시즈널베리, 디카페인 이렇게 4종류 중에 선택할 수 있었는데 저는 고소한 맛의 블랙슈가를 선택해 마셨어요. 다른 손님들을 보니 차를 마시는 분들도 많이 있더라고요. 그리고 여기는 디저트로 쿠키랑 소금빵이 그렇게 맛있다고 하던데 배가 부른 나머지 먹고 오지 못한 게 아쉽더라고요 ㅠㅠ 다음에 방문하게 된다면 디저트와 차도 한번 섭렵해 보고 싶어요. 망리단길 힙한 카페를 원하신다면 한번 꼭 가보세요~ 망원동카페-리벌티 망원 내돈내산 후기"
