title,content
리벌티 망원 세련된 분위기의 망원동 카페,"새로 오픈한 망원동 카페 리벌티 망원. 시크한 인테리어에 따뜻한 햇살이 들어와 대비되는 분위기가 매력적인 망원동카페에요. 카페의 기본, 디저트와 커피 모두 맛있었던 밤에는 멋지고 낮에는 매력적인 망원동 카페 꼼꼼하게 소개해드릴게요 :-) 리벌티 망원 서울특별시 마포구 포은로 108 1층 * 위치: 망원역 2번출구에서 도보 10분 * 영업시간: 매일 11:00 - 23:00 * 전화문의: 0507-1361-3877 * 메뉴: 아메리카노 4.8, 크림치즈 브리오슈 7.0 * 재방문의사 ★★★★★ + 모던한 분위기의 햇살 맛집 + 커피, 디저트 맛집, 친절함 + 신축 건물의 깨끗한 화장실 망원시장 근처 새로 생긴 붉은 벽돌의 건물! 깔끔한 외관과 인테리어에 화장실도 깨끗해 망원동카페로 추천드려요 :) 카페 앞에는 간이 의자가 있는데 이 자리가 햇살 대박이에요!!!! 오전~낮 시간대에 망원동 카페에서 광합성 하려는 분들은 꼭 가세요~~ 깔끔한 블랙톤의 인테리어! 블랙 인테리어에 밝은 햇살이 들어오니 요즘 날씨에 딱 잘어울리는 분위기! 밤에는 멋있고 낮에는 세련된 분위기에요. 요즘은 돌테리어가 대세인 듯 해요! 바닥에 정원처럼 돌이 깔려있는 곳이 많은데 여기도 돌 위에 소품들이 나뒹굴 , , ♥ 다만 입구에서 돌바닥이 가까이 위치해있어 들어오실때 걸리지 않도록 조심하셔야 해요. 시크한 블랙과 메탈 인테리어 한쪽엔 돌로 꾸며진 화분 정원과 옛스러운 벽돌로 정겨운 느낌까지 나는 리벌티 망원. 요 카페 인테리어와 분위기 참 맘에 드네요! 테이블과 의자도 특이하고 차원이 다르게 푹하고 도톰한 방석도 있어요! 리벌티망원 메뉴 깔끔한 리벌티 망원 메뉴들. 원두는 세 가지 종류 중 선택 가능하고 주문시 원두에 대해 꼼꼼히 설명해주셨어요. 아메리카노는 1,500원에 리필 가능하고 디카페인은 300원만 추가하면 변경 가능! 망원동 디저트 카페 리벌티 망원 네이버 검색시 메뉴에서 이미지가 나와 있어 좋아요~ 주문할때 테블릿으로 확인도 가능하구요. 주문후 테이블로 가져다주십니다. [디리디림채의 주문내역] - 블루베리 크림치즈 브리오슈 8.0 - 아인슈페너 아이스 7.2 - 카페라떼 5.0 아인슈페너 7,200원 커피 가격은 은근 비싼 편인데 양도 꽤 많고 커피 맛도 좋았어요. 크림의 당도와 농도도 알맞았던 아인슈페너! 특히 국화향 나는 커피는 또 처음이라 리벌티 망원 오시면 아인슈페너 추천드려요. 카페라떼 5,000원 고소한 로제 원두로 나온 카페라떼는 진하진 않아도 은은하니 부드러웠고 무엇보다 컵과 컵받침이 넘 예뻤어요. 보기 좋은 떡이 먹기도 좋다죠 ㅎㅎㅎ 재방문의사 100% 망원동 카페입니다. 커피 맛을 제대로 즐길 수 있도록 선택한 원두에 대한 설명도 함께 주세요. 블루베리 크림치즈 브리오슈 8,000원 계란과 버터가 많이 들어가 부드럽고 고소한 브리오슈 위 과일과 크림치즈가 올라간 블루베리 크림치즈 브리오슈 디저트에요. 부드러운 브리오슈 식빵에 진득한 크림치즈, 상큼한 블루베리의 조합! 재료만 봐도 맛있을거 상상가시죠 :-) 은은히 퍼지는 로즈마리 향도 참 좋습니다. 포크와 나이프도 고급스러워 좋았어요. 따뜻한 햇살 들어오는 세련된 망리단길카페 리벌티 망원 추천드립니다 :-)"
[서울/망원] 망원동 아인슈페너맛집: 리벌티 망원,"서울포스팅 진짜 마지막 아인슈페너가 맛있었던 #망원동카페 #아인슈페너맛집 #리벌티망원 사실 처음에 가려 했던 카페는 #락떼스피릿 하지만 #웨이팅 망원동 웬만한 인기 카페는 웨이팅 실화인가요ㅠ 기다리기 애매해 근처 커피집 찾다가 운 좋게 바로 들어갔지만 너무 만족했던 곳💖 리벌티 망원 서울특별시 마포구 포은로 108 매일 11:00-23:00 리벌티 망원 서울특별시 마포구 포은로 108 1층 #외관 #메뉴판 카운터에는 메뉴를 볼 수 있는 태플릿도 있으니, 태플릿으로 메뉴 사진 보고 주문하면 됩니덩~~ 저희의 주문 아인슈페너 (￦ 7,500원) 핑크솔트 아인슈페너 (￦ 7,500원) 로투스 크림라떼 (￦ 7,500원) 카운터 옆에 쿠키도 팝니다. 스모어쿠키가 눈에 띄네요(✿◡‿◡) (저는 배불러서 PASS) #내부 핫한 카페 테이블 6-7개 정도 되는데 자리 생기면 바로바로 찹니다👀 #거울샷 안 찍을 수 없쥬~~ #로고 Liberty가 자유라는 뜻인데 이름이 맘에 드네요:D 오늘만큼은 자유롭게 가보자고 #주문한 메뉴 (사진 제공: 뚜뚜) 사진 잘 찍는 친구한테 겟겟 아인슈페너 맛집답게 여러 종류의 아인슈페너st 커피가 팝니다. #감성샷 저는 핑크솔트 아인슈페너를 먹었는데, 커피는 부드럽고 위에 크림은 진짜 신의 한수 진짜 맛있었요!!!! 꼭 핑크솔트 드셔주세요!!!! #커피맛집 인정👍 (다른 메뉴 먹은 친구들도 다 맛있다 함) 커피 먹고 친구들 꼬셔서 #하루필름 드뎌 나도 찍었다…! 유행에 아주 느린 MZ력 30점 아지매영ㅋ 하루 필름이 제일 잘 나온다는데 진짜 뽀샤시하게 이쁘게 나옴😙 이쁘니들 곧 보자:) 이상 #내돈내산 #솔직후기 끝!"
ː망원동 카페ː 보는 즐거움이 있는 리벌티 망원(Liberty Mangwon),"망원동 'Liberty Mangwon' 화려한 비주얼의 커피와 디저트가 있는 곳 날씨 좋은 9월 3일 토요일에 결혼기념일을 맞아 서울로 나들이를 다녀왔어요-! 벌써 결혼 6주년이라니 세월..! ㅋㅋㅋㅋㅋㅋ 기념일인 만큼 좋은 곳에서 맛있는 것만 먹고 놀고 하기 위해 미리 이곳저곳 알아보고 출발했어요! 제일 먼저 커피를 마시기 위해 간 곳은 서울 망원동 망리단길에 있는 카페 '리벌티 망원(Liberty Mangwon)' 입니다. 와~~ 건물 외관부터 시선을 확 사로잡죠~? 리벌티 망원은 건물 1층에 자리 잡고 있어요-! 빨간 벽돌 외관에 블랙톤 인테리어의 내부가 주는 분위기가 너무 좋더라구요ㅎㅎ 어수선한 바깥에서 안으로 들어가자마자 어둡게 정돈된 차분함이 느껴져서 편안하게 커피를 즐기기 더 좋을 것 같아요☕️🤎 자리를 잡고 주문하러!(•̀ᴗ•́)و ̑̑ 리벌티 망원은 음료와 디저트 종류가 많은 편이에요-! 요즘 대부분의 카페들은 메뉴를 최대한 줄이는 추세인데, 많은 메뉴를 제공하는 곳을 오랜만에 봐서 반갑고 좋았어요😃💛 특히 이곳은 음료와 디저트 비주얼도 굉장히 신경 써서 제공해 주고 에이드도 수제라니..! 다 너무 먹어보고 싶어서 고르는데 정말 고민이 많이 되더라고요ㅠㅎㅎ 맛있어 보이는 다양한 스모어 쿠키와 르뱅 쿠키들🍪 개인적으로 카페의 머신들 구경하는 거 굉장히 좋아합니다..ㅋㅋㅋㅋ(잘 알지도 못하면서^^) 주문을 하고 구경을 하는데 독특한 포인트들이 곳곳에 있어요ㅎㅎ 마치 향수나 바디용품을 판매할 것 같은 느낌ㅋㅋ 카페 로고도 향수 브랜드 딥티크가 연상되기도 해서 고급스러움이 있구요ㅎㅎ 매장이 너무 어둡기만 해도 좀..그렇잖아요~? 그래서 그런지 매장 조명들을 노란빛으로 두고 따뜻한 느낌을 살리신 것 같아요💛 리벌티 망원에서는 원두도 판매하고 있어요-! 가격이 괜찮네요👍🏻 음료는 직접 서빙해 주십니다-! 귀여운 노랑 트레이와 티스푼이 먼저 보이네요😆💛 주문한 음료 *̷̷̷ 아인슈페너 7,500 로투스 크림 라떼 7,800 로투스 크림 라떼라는 이름에 맞게 로투스 과자가 올려져 있어요ㅎㅎ 먼저 로투스 과자로 위의 크림을 떠먹다가, 나머지 크림과 아래 베이스를 같이 호로록 마시면 돼요👌🏻 그나저나 이 컵!!!! 리벌티 망원만의 감성이 들어간 이 컵!! 너무 예쁘지 않나요~?🥺💓 톤 다운된 파랑이 커피 음료랑 이렇게 잘 어울릴 줄 몰랐어요ㅋㅋ 음료 비주얼도 어떤 메뉴를 주문하던 다 이렇게 예쁘게 나오더라고요~ 리벌티 망원은 아인슈페너는 아메리카노 베이스에 크림이 올라간 방식이에요-! 크림과 베이스를 한 번에 넘겨 마셨을 때 부드러우면서도 깔끔한 마무리가 좋았어요👏🏻 요즘에 왜 이렇게 크림커피가 땡기는지..ㅋㅋ 아인슈페너 위에 올려진 국화꽃과?의 드라이플라워🌼 마시기도 전에 보는 맛이 좋았어요👏🏻 음료마다 이렇게 정성을 다해 제공해 주세요~ 대충 후루룩 마시고 가는 곳이 아닌, 눈이 즐겁고 입이 만족할 만큼 충분히 머물다 갈 수 있는 카페라는 게 리벌티 망원으로 오게 된 이유 중 하나예요!🤍 사람이 많았지만 정말 편하게 먹고 쉬다 나왔습니당ㅎㅎ 망원동 속의 많은 카페들 중에서 이렇게 괜찮은 카페를 발견하게 되면 참 기뻐요😆 다음에는 오레오 크림 커피 마시러 갈려구요!! 색다른 크림 커피를 마셔보고 싶으신 분들은 망원동 카페 리벌티 망원(Liberty Mangwon) 으로 가보시는 것 어떨까요💙 리벌티 망원 서울특별시 마포구 포은로 108 1층 리벌티 망원(Liberty Mangwon) 월-일 11:00 ~ 23:00 무휴 (추석 연휴 정상 영업) 인스타그램 공식 계정⤸ 리벌티 망원(@liberty_mangwon) • Instagram 사진 및 동영상 instagram.com ♡♡♡ 내돈내산 솔직 후기입니다~! ♡♡♡"
망원역 카페 - 리벌티 망원 (망원동 카페/명리단길 커피/망원시장 카페/커피 맛집/망원동 데이트/수제쿠키),"망원역 카페 - 리벌티 망원 주소: 서울 마포구 포은로 108 1층 전화번호: 0507-1361-1387 영업시간:매일 11:00 ~23:00 휴무: 별도 공지 주차: 없음 대중교통: 망원역 2번출구에서 600m (6호선) 망원역 카페 - 리벌티 망원 메뉴 카페라떼 5,300원 리벌티 아메리카노 4,800원 그외 메뉴는 하단 사진을 참고하세요 합정역에서 저녁을 먹고 망원시장을 들리기 위해 망원동으로 이동을 했습니다 망원시장에서 떡갈비 구입 양가 식구들거까지 5팩 구매 짐도 있고해서 바로 근처 가페로 가기로 했습니다 명리단길 주변에는 카페가 워낙 많으니까 아무곳이나 들어가면 되겠거니 했는데 많으니까 또 고민이 됩니다 ~ 대충 둘러봐도 8~9개는 되는거 같은데 그중에 리벌티 망원이라는 카페로 결정했습니다 아내가 어디를 가야 할지 고민하며 결정장애가 있을때는 제가 빠르게 결정해 주는걸 아내도 좋아합니다 종종 본인이 결정을 해놓고도 묻는경우가 있긴 합니다 리벌티 망원의 메뉴판입니다 저는 카페라떼 아내는 아메리카노~ 여긴 얼음이 들어가도 가격이 같은점 마음에 듭니다 아메리카노 뿐 아니라 카페라떼도 원두를 고르더라구요 아내는 산미가 있는걸 저는 고소한 원두로 결정 망원역카페 리벌티 망원이 수제쿠키 맛집으로도 유명한듯합니다 그때는 식사를 한진 얼마 안되서 디저트에 눈이 안갔는데 지금 사진으로 보니 쿠키가 참 맛있게 보이네요 가신다면 커피와 함께 꼭 쿠키도 드셔보세요 저는 카페든 식당이든 검색을 할때 보는것중 하나가 실내 분위기 입니다 손님들 모습이 나오면 블러처리를 꼭 합니다 ^^ 망원동 카페 리벌티망원의 실내 모습입니다 입구 창가쪽으로 오른쪽으로도 자리가 좀더 있습니다 저의 카페라떼와 아내의 아메리카노가 나왔습니다 3가지 원두중에 고소함이 특징인 원두를 골랐는데 맛이 좋습니다 아내의 아메리카노 산미 단맛 고소함 바디감 다 적당히 조화를 이룬 원두네요 요 커피도 맛이 좋았습니다 망원역 카페 리벌티 망원은 커피와음료를 직접 가져다 주고 또 다 마신후에도 자리에 두고 나오면 됩니다 이런 서비스 아내는 무척 좋아합니다 물론 저도 좋아요 바닥의 인테리어? 공간활용이...아...... 테이블간 간격도 넓고 좋은거 같습니다 ^^ 망원역 카페 - 리벌티 망원 원두도 판매하고 있어요~~ 원두 설명도 되어있어서 선택하기에도 좋을듯 합니다 망원역 카페 리벌티 망원 메뉴판 입니다 다움에 가게된다면 쿠키를 먹어봐야겠네요 리벌티 망원 서울특별시 마포구 포은로 108 1층 리벌티 망원이 잘 소개되어 있어요 참고하세요 리벌티 망원(@liberty_mangwon) • Instagram 사진 및 동영상 리벌티 망원 Cafe ⠀⠀⠀⠀⠀⠀⠀⠀⠀⠀⠀  서울특별시 마포구 포은로 108, 1층 (리벌티망원) ※수제쿠키⠀⠀⠀⠀⠀⠀⠀⠀⠀⠀⠀  Dessert Actor Cafe  무휴• am11:00~pm11:00  반려동물 사랑•쿠키포장주문 가능  Parking : 망원1동 주민센터 주차장 m.smartstore.naver.com/libertymangwon www.instagram.com"
[서울/카페]분위기 좋은 망원동 카페 리벌티망원,"리벌티 망원 월~목 10:30~21:00 금~일 10:30~22:00 리벌티 망원 서울특별시 마포구 망원로7길 65 1층 멀리서도 보이는 리벌티 망원 팻말 리벌티망원은 들어가면 앞에 크리스마스 트리가 있어요:) 여기 스콘 맛집이라고 헤서 딱 1개 남은 스콘을 먹어봤어요ㅋㅋㅋ 오렌지색의 쟁반은 감성을 더 해주는것 같네요 음악도 너무 좋고 한쪽 벽면에는 빔 프로젝터를 이용해서 감성 넘치는 영상을 계속 틀어주셨답니다 감성 가득한 리벌티 망원 노래, 조명, 감성 까지 모두 완벽 그 자체였던.."
"[서울망원동] 망리단길 카페, 리벌티망원","[서울망원동] 리벌티망원 망리단길 카페 저번주 친구와 망원동 갔던 날 밥먹고 집가기 아수우니까 카페 가야쥬 지나가다 발견한 #리벌티망원 빨간 벽돌이 멀리서도 눈에 딱 들어와 바로 발길이 향했다 -!! 망원동 가끔 오는데 새로운 가게가 많이 생겨서 올때마다 놀란다ㅋㅋㅋㅋㅋㅋ 고로 가보고 싶은 곳이 많아졌다 문을 열고 들어오면 가운데에 이렇게 돌을 깔아 에탄올 난로가 있었다 - 신기한 구조였음 매장은 그렇게 넓은 편은 아니었는데 분위기와 인테리어도 좋았다 :) 쿠키 맛집인거 같았으나 우리는 밥 먹고 바로왔기도 했고 나는 그닥 쿠기를 좋아하지않아 음료만 주문했다! 커피도 저녁 먹으면서 아아를 때렸기 때문에 나는 #애플망고에이드 (6,500) 친구는 #딸기에이드 (6,500) 주문!! 왼쪽이 딸기 에이드, 오른쪽이 애플망고 에이드 색감이 너무 예뻤음 ❤💛❤💛 시럽이 아니고 직접 만든 청인거 같았고 먹을때마다 과일이 씹혀서 좋았다 -!! 그렇다고 막 우와!!!!!!!!!!!! 할 맛은 아니었음 다시 검색해보니 리벌티 망원은 음료보다는 커피가 더 유명했었다 커피를 먹을까 고민했었는데 에이드 고른 내가 원망스러움ㅋㅋㅋㅋㅋㅋㅋㅋ 가운데 에탄올 난로때문에 분위기가 좋았고 친구랑 대화하다가도 저기보며 나도 모르게 불멍 때림ㅋㅋㅋㅋㅋㅋㅋㅋㅋㅋㅋㅋㅋ 다음엔 커피를 마시러 다시 방문하고 싶다! 영업시간 매일 11:00 - 23:00 리벌티 망원 서울특별시 마포구 포은로 108 1층"
서울 망원동 카페 • 리벌티 망원 (망리단길 감성 카페),"안녕하세요 지히에용 오늘 소개 해드릴 곳은 서울 망원동에 있는 감성 카페 ❝ 리벌티 망원 ❞ 이랍니다 리벌티 망원 서울 마포구 포은로 108 1층 - 매일 11:00-23:00 - 전화번호 : 0507-1361-3877 Liberty 망원(@liberty_mangwon) • Instagram 사진 및 동영상 팔로워 1,867명, 팔로잉 534명, 게시물 87개 - Liberty 망원(@liberty_mangwon)님의 Instagram 사진 및 동영상 보기 www.instagram.com - 망원1동 주민센터 주차장 - 포장 O 1, 2월 다 서울로 여행갔다 왔으면서 망원동은 이번이 처음인... 카페가 블랙+스톤 느낌으로 꾸며져 있더라구요 컵도 굉장히 갬성쓰 >_< 리벌티 망원의 메뉴에요 저희가 주문한 메뉴는 핑크솔트 아인슈페너 7,500₩ 애플망고 에이드 6,000₩ 말차 캐슈넛 스모어 쿠키 3,800₩ 이렇게 주문 했어요 :) 오랜만에 먹는 디저트랄까,, (과연) 리벌티 망원의 내부에요 완전 블랙감성이죠? 처음에 갔을 땐 손님들이 많이 계셔서 못찍었는데 자리가 빌때마다 가서 찍어왔어요 ㅎㅎ 어딜가나 있는 마쉘 스피커 탐난다 정말루 저희가 주문한 음료와 디저트가 나왔어요 컵이 너무 이뻐서 하나 가져오고 싶을정도.. 욕심만 많아서는 ㅎ.. 차례대로 핑크솔트 아인슈페너와 애플망고 에이드, 말차 캐슈넛 스모어 쿠키에요 원래 카페에서 디저트를 잘 안먹는 편인데 요 쿠키는 왠지 먹어줘야할것 같아서 주문! 제가 마신 핑크솔트 아인슈페너는 처음에 주문할 때 호불호가 갈릴 수도 있다고 하셨는데 도전해보고 싶어서 주문한 커피에요 맛은 산미가 있는 커피에 단맛이 많이 없는 크림이였답니다 ! 역시 쓴걸 못먹는 저는.. 실패를 했고 범조는 괜찮다고 했어요 애플망고 에이드는 상콤달달 맛있었고 말차 캐슈넛 스모어 쿠키도 맛있었어요! 중간에 씹히는 캐슈넛의 식감도 좋았답니당 망원동에서 분위기 맛집 카페를 찾으신다면 리벌티 망원 가보시길 추천드려요 ᰔ 리벌티 망원 서울특별시 마포구 포은로 108 1층 지희(@zeeh.zo)님이 Instagram을 사용 중입니다 팔로워 3,482명, 팔로잉 84명, 게시물 246개 - 지희(@zeeh.zo)님의 Instagram 사진 및 동영상 보기 www.instagram.com 지콩범콩 https://m.blog.naver.com/bjh971113 인스타그램 : zeeh.zo www.youtube.com"
"망리단길/망원동 카페 “리벌티 망원” : 로투스 크림치즈 브리오슈, 오레오 스모어 쿠키 완전 디저트 맛집이잖아!","안녕하세요. 혜인입니다 :) 저번주에 다녀왔던 망원동, 망리단길로 시장도 있고 카페거리로 엄청 유명하죠? 이 중에 저는 디저트도 퀄리티 있으면서 커피도 맛있는 집을 이곳 저곳 검색 및 후기를 통해 찾아보다가 “리벌티 망원”을 찾게 되어 방문하게 되었어요. 이 곳은 망원동 큰거리 사이에 있는 좁은 거리에 몇걸음 걷다보면 있는 카페예요. 갈색 벽돌 건물이 돋보이고 무드있는 블랙 통창이 마치 제 스타일의 카페라는 걸 감지하고 후딱 달려갔습니다 히히 지금부터 망원동/망리단길 감성 및 디저트 카페인 리벌티 소개할게요~ 리벌티 망원 50m © NAVER Corp. 리벌티 망원 서울특별시 마포구 포은로 108 1층 📍 찾아오시는 길 서울 마포구 포은로 108 1층 [지번] 서울 마포구 망원동 414-18 1층 📍 영업시간 매일 11:00 - 23:00 워낙 카페가 많은 망원동이다보니 사실 헷갈리기 망정인데 여기 진짜 자리 최고더라구요. 확~ 한눈에 들어온달까 그리고 저도 뭔 건물인지 궁금해서 쳐다보게 되는 곳! 사실 그거 아니여도 여긴 워낙 건물에서 나오는 아우라가 있다보니 발길이 자동으로 향해서 가더라구요 :) 작지만 인테리어가 잘되어 있어요. 진짜 유명한 가구들..저거 선반도 유명한건데 전등인가 저거도요!! 저도 요즘 가구에 눈이 띄여서 가격이 있는데도 보게 되더라구요. 그리고 차라리 화사하고 밝은 분위기보다는 눈을 편하게 하는 이런 분위기가 차라리 낫다는 생각도 들게하는 카페예요 🖤 카페 중간에 제주도에서 볼 수 있는 제주 현무암석으로 펼쳐둔 뒤 잡지나, 유명한 향초캔들까지🤍 여기 너무 인테리어 완벽쓰..🖤 남자의 정석을 보여주는 카페랄까 ㅎㅎㅎ(사장님이 남자분!? 이신 것 같아요!) 저도 다음에 어딜 인테리어 하게된다면 이렇게 하고 싶어요! 오밀조밀 사소한 부분까지 세심하게 잘 되어 있어서 나름의 포토존도 많은 편이예요 :) 메뉴는 다양하지만, 아메리카노[블랙슈가] 2잔 쿠키_오레오 스모어 브리오슈_로투스 크림치즈 이렇게 주문했어요! 브리오슈 만드는데 대략 5-10분 걸린다고 미리 알려주셨어용! 정말 친절하세요☺️ 그리고 여기는 워낙 쿠키나 브리오슈가 유명하다보니 테이크아웃 손님도 진짜 많더라구요. 메뉴 기다리면서 정말 짧은 시간이지만, 5팀 정도 본 것 같아요!! Next image 쿠키도 도톰하고, 내용물도 꽉 채운 퀄리티가 있는 쿠키들이였어요! 정말 마음 같아서는 6가지 모두 먹어보고 리뷰하고 싶었지만, 이미 밥을 먹고 왔기에 아쉽게도.. 다음 기회로!!ㅎㅎ 친구들과 파티하거나 그럴 때 포장도 하러 와야겠어요! 시그니처 라떼 중 하나인 로투스 크림라떼☕️ 사실 카페를 가면 라떼 종류를 요즘 안보게 되는 것 같았는데 이건 사진으로 미리 보니까 먹어보고 싶어지더라구요. 하지만 ㅠㅠ 이미 시켜버려서 이것도 다음에 먹어보기로 했어요. 이로써 다음에 방문할 면목이 2가지 이유가 생겨써여!! 쿠키도 쿠키지만, 크림치즈 브리오슈 크림치즈 양 실화? 완전 빵 위에 생크림 올리듯이 많이 올려줘요..🤍 리벌티 망원 이즈 뭔들. 블랙슈가는 기본 중 기본이지만 산미가 없고 깔끔한 편에 속하는 아메리카노 같아요 :) 그래서인지 디저트와 무척이나 잘 어울렸어용 Next image 크림치즈 진짜 비싼데.. 이렇게 많이 올려주리면 정말 감자합니다(〃ω〃) 항상 먹으면 크림을 다 먹어버리고 빵쪼가리만 남는데 여기는 크림치즈가 남아도는 희귀한 현상이 벌어져요! 그 남은 거로 쿠키에도 찍어 먹었어용 친구갘ㅋㅋㅋㅋㅋㅋㅋ”역시 너는 먹는 거에 진심이야!!”이럼.. 맞아..ㅎㅎ;; 먹을 때가 행복해야 살 맛나지 않겠어여..?ㅋㅋㅋㅋ 쿸히(들숨날숨) 이거 줭뫌뤄 맛쒸이따아ㅠㅠㅠ🤍 이.거. 완전 제 스타일🥺 친구는 디저트를 별로 안먹는 편이라서 제가 다 먹어버륌~!~!~! 살 뭐~ 다시 빼면 되는거즤이~~!~!~ 쿠키 안에 초코 알맹이랑 마시멜로우 촉촉한 거랑 같이 있으니까 넘 잘 어울리고 밋밋할 수 있는 쿠키에 숨을 불어 넣어줬어용..🖤 이거 먹고 양심 상 아메 1입. “리벌티 망원” 외국인도 길 가다가 앉아서 일하고,(외국인 줄 알아써여) 옷 잘 입는 언니 오빠들도 앉아서 애쁠 노트북 쓰시구 정말 정말 은근슬쩍 핫한데 아는 사람만 아는 곳! 다들 리벌티 망원 가셔서 꼭..쿠키랑 브리오슈 드시고 오세요..🤍 저 정말 디저트에 진심인 편이라 메뉴 고르는데 5분 소요. 이것 저것 다 먹어보고 싶고 심지어 쿠키 6개가 다들 자기 먹어달라고 외치는데.정말.. 아무튼 담에 또 올 거예요 🥺 망원동/망리단길 핫플은 리벌티 망원!! 다들 들려보세요:) 후회 없는 카페! 디저트 맛집! 제 포스팅이 유익하고 재미있으셨다면 댓글과 공감 부탁드려요☺️🤍 #리벌티망원 #망원동카페 #망원동디저트 #망원동커피 #망리단길카페 #망리단길디저트 #망리단길커피망원동맛집 #망리단길맛집 #망리단길분위기좋은카페 #망리단길데이트 #망원시장감성카페 #망원커피맛집 #망원데이트코스"
