title,content
"연남동 망원동 - 공중도시 , 슬라브","을지로에 있던 공중도시가 연남동으로 옮겼다구 해서 가오픈 기간에 꼭 가보고 싶어 다녀온 후기 역시나.. 너무 맛있고 올 해 생일 케이크는 얼마가 되었든 공중도시랑 달리파이에서 맞추겠다고 다짐 또 다짐하는 여성... 오픈시간에 딱 맞춰서 도착 했는데 앞에 2팀 있었고 저희 바로 뒤에 1팀 있었어요! 가오픈 기간 과 시간은 여기 사진에~ 공중도시 메뉴판 입니다! 맛있는거 너무너무 많아.... 주문하는 곳 옆쪽에도 이렇게 귀엽고 멋지게 꾸며두시구,,, 너무 좋아요.... 초도 많고 굿즈도 을지로에서 있던거 그대로! 좌석이 생각보다 넓어져서 가는 길목에 이렇게 귀엽구 깜찍한 키티들....잔뜩... 귀여버~@ Next image 수족관과 포토존~ 저기 의자에 앉아서 사진 많이 찍으시더라고요! 귀여운 티비와 테이블... 을지로보다 넓어진 것 같아요! 음료 시키면 사장님이 직접 자리로 가져다 주십니다 반대편 좌석~ 여기도 금붕어친구들이..! 사람이 많아서 다른 좌석은 아쉽게 못찍은.... Next image 드디어! 디저트와 음료~ 저는 라즈베리 케이크랑 레몬소다 메론 소다 시켰어요! 아름다운 ... 모습... 헤헤... 제 사진은 이거 두장이 끝.... 플래쉬 터트려서 사진 찍으면 잘 나오는데 이제 너무 많이 찍으면 실례이니까 우리모두 적당히 합시다.. 공중도시는 ... 짱이니까요.... 더 할 말이 없구 그래요... 최고다.... 그리고 점심 먹고 망원동으로 열심히 걸어가 다른 카페에 갔어요! 이름은 슬라브! 슬라브 메뉴판 입니다! 와인, 위스키도 함께 있더라고요? 머신은 없고 드립만 하시는데... 여기 너무너무 다정하시고 친절하시고 좋아서 후기 안남길 수가 없었다고 합니다.. Next image 공간이 엄청 아름답다고 생각되었고.. 사람이 제법 많았는데 딱 타이밍이 좋아서 웨이팅 없이 앉을 수 있었어요 좌석이 되게 좋더라고요! 전체적으로 둘러앉는 테이블 하나인데 다른 손님들이 많아서 최선을 다해 찍은 것이 이것뿐.. Next image 주문 한 메뉴는 드립 아이스 슬라브 블랜드와 아인슈페너 입니다~ 어찌나 다정하시냐면 여쭙는 질문에 너무 친절하게 대답 해 주시고, 설명도 잘 해 주시고, 음료가 얼음에 너무많이 희석되면 맛이 없다고 따로 나누어 주신 것도 너무.. 감동이었어요. 그리고 아인슈페너는 크림이 모자르면 더 주신다고 말씀 하라고 하셨구.... 진짜 처음 느껴보는 다정함...에 정신을 못차리고 먹었습니다 슬라브블렌드 맛이 너무 제 스타일이라 무조건... 또 갈거에요.... 카페오레도 마셔보고 싶구 .... 아무튼 짱입니다. 그럼 후기 끝! 다음에 또 멋진 카페 후기 쓰러 올게요!"
"[망원동카페] ""슬라브"" 공간의 아름다움.","린쭈따라 카페투어 망원동카페 ""슬라브"" 오늘은 망원동 투어에 앞서 너무 좋았던 카페를 소개해드릴까 합니다 망원동카페 슬라브를 소개합니다. 월,수-일 : 12:00-20:00 50m © NAVER Corp. 슬라브 서울특별시 마포구 포은로 87 지하 1층 망리단길에 위치한 슬라브 카페입니다. 독특하게도 지하로 들어가는 카페입니다. 지하로 내려가시다보면 어둑해지는 느낌의 카페가 나옵니다. 들어서자마자 어둑하면서도 벽에 기대어 있는 작품들. 정말 어두운데 느낌이 너무 좋아요. 우선 인테리어를 구경하기 전에 메뉴를 주문해봅시다. 와인과 위스키도 판매중이고요. 저희는 방문했던날 조금은 쌀쌀했어서 따뜻한 핸드드립으로 에티오피아 예가체프 1 슬라브 블렌드 1 주문했습니다. 그리고 디저트로 도미노 시스템을 주문했습니다! 인스타에도 많이 보이던 메뉴인데요 너무 궁금합니다. 진짜 독특하면서도 너무 이쁜 인테리어입니다. 어둑어둑하면서 바깥으로 위치한 할로겐등으로 작품들을 비춤으로써 작품에 눈이가고 테이블도 길고 큰 테이블인데 이걸 어떻게 지하로 들어왔을지 너무 신기하네요. 많은 그림들이 있는데 그림을 좋아하는 저희 부부에게는 너무 힐링되는 카페투어였어요 오브제도 있고 도자기도 판매중이신거같아요. 옆으로는 작업공간같은 곳도 따로 있으시네요 ㅎㅎ 슬라브라는 카페명답게 건축모형이 보이네요. 너무 독특하고 이쁜 망원동카페에요. 저희의 따뜻한 핸드드립 메뉴가 나왔습니다. 예가체프와 슬라브블랜드를 맞봄으로 서로 맛도 비교해보고 너무 맛있는 드립이엿어요 ㅎㅎㅎ 도미노 시스템 디저트가 나왔습니다. 건축과 공간설계 계획을 디저트에 형상화함으로써 입체적인 느낌으로 즐거운 경험을 할수있게해주고 사람모형의 피규어?를 꾸며봄으로써 사진 찍는 재미를 줬습니다. 도미노 시스템에 자세한 설명과 디저트 즐기는법에대한 설명에 종이가 같이 나오니깐 읽어보시면서 즐기기 너무 좋네요 ㅎㅎㅎ 디저트와 카페 분위기를 찍어가며 즐기기 너무 좋아요 ㅎㅎㅎ 여러각도로도 사진을 찍어보고요. 이제 맛봐바야죠 ㅎㅎㅎ 커피도 맛있었는데 디저트도 최고였어요!! 너무 신기한 경험이기도 했고. 커피와 디저트 말고도 작품과 분위기를 즐길수있으니 너무 좋았어요!! 여기 정말 또 오고싶다라고 생각이 들정도로 독특하면서도 맛도 좋은 카페였던거같아요 👍"
조용한 분위기 속에서 즐기는 커피 망원동카페 <슬라브>,이제 정말 한겨울이다 보니 보고싶던 눈을 실컷 보게 되네요 ㅎㅎ 쉬는날 이렇게 걷다보니 명소도 한번 가보고 싶고 여러가지 해보고 싶었어요 ㅎㅎ 망원동 명소하면 역시 뭐니뭐니해도 분위기가 좋은걸로 유명한 카페 '슬라브' 가 있죠! ㅎㅎ 50m © NAVER Corp. 슬라브 서울특별시 마포구 포은로 87 지하 1층 눈 오늘 거리 걷기 좋다~~ 이렇게 쭉 직진하다보면.. 바로 슬라브 입구 도착 ㅎ 신기하게 보통 기본 1층에 2 3층 위로 올라가는 구조인 보통의 카페완 다르게 지하 1층으로 되어있는게 참 신기해요 ㅎㅎ 그렇지만 이런 심플한 입구 나쁘지 않아 ㅎㅎ 바로 들어가볼까요? 사진으로 보면 되게 어둑어둑한 분위기로만 느껴질 수 있는데 그렇지 않더라구요 ㅋㅋㅋ 되게 고요하고 분위기도 뭔가 아늑해서 좋아요 ㅎㅎ 저는 개인적으로 이런 인테리어 되게 좋아서 들어가자마자 취향저격이었음 ㅎㅎ 저는 드립커피를 주문했는데 처음에 잔 주실때 음..? 내가 바를 들어왔나..? 싶을 정도로 ㅋㅋㅋㅋㅋㅋ 아니 잔도 그렇고 색 때문에 위스키랑 헷갈렸어요 ㅋㅋㅋㅋㅋ 그치만 잔 너무 이쁨 ㅎㅎ 맛도 좋음 최고! 스프레이도 판매하길래 하나 샀어요 아 몸에 뿌리는 향수용은 아니고 ㅎㅎ 옷이나 방에 뿌리는 용도로 나왔다고 해요 음..향은 뭐랄까 약간 진하고 살짝 스파이시해서 나쁘지 않았어요 굿~! 오늘 처음 와봤는데 분위기가 기대 이상으로 너무 좋아서 다음에 또 와보려고 해요 ㅎㅎ
망원동 슬라브 : 분위기 좋은 카페 추천,"망원동 분위기 좋은 카페 슬라브 망원동에는 여러 카페가 있는데 오늘은 망원동을 찾는 사람들은 잘 모르는 숨겨진 카페를 소개하려고 한다 바로 망원동 티라미수 건물 지하에 위치한 카페 슬라브! coffee, dessert 문구만이 카페가 있음을 알려주는데 입구에 있는 술병들을 보면 알 수 있듯이 바 겸 카페로 운영하는 곳 이다 내부로 들어가면 엄청 큰 테이블이 놓여있는데 카페 공간의 절반을 차지할 정도! 여기에 카페의 모든 손님이 다 앉을 정도! 슬라브는 아주 극단적인(?) 원테이블 카페이다 ㅋㅋㅋ 메뉴는 와인&위스키&커피 논커피는 티밖에 없어서 아인슈페너를 주문했는데 역시 크림 덕분에 쓰지않다 휘핑크림 칼로리를 걱정하게 되지만 ☕️ 커알못에게는 달달구리한게 최고야 산미있는 원두는 아니였던지 카페라떼는 고소하다 사실 이런 분위기(?)인 줄 모르고 노트북 가져갔는데 그냥 커피만 즐기다 왔다 ㅋㅋㅋㅋㅋ 카페보다는 bar 같았던 카페 슬라브 밤에 오면 분위기 더 좋을 듯! 50m © NAVER Corp. 슬라브 서울특별시 마포구 포은로 87 지하 1층"
망원동 이색 디저트 카페 [슬라브] 시그니처 도미노 시스템 :: 카페&와인바,"#망원동슬라브 #슬라브 #망원동이색카페 아그작 맛집 일기 입니다ㅎ 오늘 리뷰는 망원동에 위치한 이색 디저트 카페 슬라브 포스팅 입니다 !!! 오늘도 내돈 내산 솔직 후기 입니다 ‼️ 50m © NAVER Corp. 슬라브 서울특별시 마포구 포은로 87 지하 1층 ⏰영업시간 매주 화요일 정기휴무 월,수-일 12:00 - 20:00 SNS에서 보자마자 궁금해서 달려간 카페 독특한 컨셉의 디저트를 먹기 위해 망원동을 갔다왔습니다ㅎㅎㅎ 지하철 이용 시 망원역 2번출구가 가장 가까워요! 카페는 지하 1층에 있어요 입구 찾기가 조금 어려웠지만 이것또한 갬성 저는 이 시그니처 디저트인 도미노 시스템을 먹기 위해 왔기 때문에ㅋㅋㅋㅋㅋ 고민 없이 바로 주문 주문!! 정말 놀라왔던게 제가 주문하는데 정신 없어 내부 사진을 못찍었지만 인테리어가 엄청 분위기 있어요 제가 본 카페 중 분위기 최고..‼️ 카페 &와인바 라고 하던데 저녁에 조용히 다녀와도 좋을 것 같다는 생각이 들었어요 진짜 비쥬얼 장난 아닌ㅠㅠㅠ 전체적으로 부순 후에 먹으면 된다고 하시더라구요!! 부스는게 아까웠지만 먹어야하니ㅎㅎ 이 사람 모형을 건축물 위에 배치해보라고 주셨어요!! 이렇게 배치ㅎㅎ 건축물 모양도 이쁘고 재밌는 포인트들도 있는 디저트 디저트는 시나몬 향이 느껴지는 절임사과를 비스켓과 치즈와 함께 먹는 디저트 입니다!! 커피와 잘 어울리더라구요ㅎㅎ 너무나도 즐거웠던 망원동 이색카페 이런 분위기 카페는 정말 오랜만에 방문했는데 디저트도 분위기도 너무 기억에 남았네요ㅎㅎ 정말 즐거웠습니다 #망원동카페추천#망리단길카페 #망원카페 #망원동데이트 #망원동와인바 #마포구카페 #마포구이색카페 #슬라브후기 #도미노시스템 #건축물디저트 #카페블로거 #망원동맛집 #서이추환영 #서이추 #서울이색디저트 #맛집블로거"
"지은이랑 망원동 데이트😻:망원동 추천 쌀국수 맛집 - 프롬 하노이, 카페 - 슬라브 , 망원시장 👻👻","여기는 망원동에 위치한 프롬하노이 ! 베트남 음식 전문 레스토랑 원래 조금 협소한 공간이였는데 이전 했나봐요!!! 넓고 쾌적해서 좋아요 저는 웨이팅이 너모 싫어서 2시20분에 도착 !ㅋㅋㅋㅋ 아무도 없어서 짱이였어요 여행온 느낌 ~,~ 메뉴판!! 저는 퍼보(쌀국수) 기본, 반쎄오, 짜조 이렇게 주문 2명에서 먹을거에요!! 쌀국수&반쎄오 저기 6피스인 짜조 반쎄오는 라이스페이퍼에 싸먹어요 저는 반쎄오 먹으러 여기 옵니다 !! 50m © NAVER Corp. 프롬하노이 서울특별시 마포구 월드컵로13길 55-5 1층 프롬하노이 카페를 찾아봤어요 새로운 카페! #슬라브 지하에 있어요! 이표시가 보인다면 맞아요! 안으로 들어오자마자 보이는 저 곰돌이 조명 너무 귀여워요 내부가 널찍하고 모든 좌석이 다 연결되어 있어요 너무 예뻐요 , 핸드드립커피 원두를 선택할 수 있고 고소한맛으루 선택 그리고 카페오레 (라떼) 한잔 주문했어요! 핸드드립이 나왔어요 다마시면 얼음잔에 다시 부어 마시라고 더 주셨어요 ! 이건 라떼!! 고소하고 맛있었어요 여기 커피 맛집이네요.! 친구 찍어주는중 ㅋㅋㅋ 제가찍은 지은이>< 넘 예쁘게 나왔 근처 소품샵에서 구경했던 미니 다육이들 넘 귀여워 ㅠㅠ 귀여운 하리보핀 겟! ㅋㅋ 집으로 돌아오는길에 수박 반통 사구 어깨에 질끈 매고 돌아왔아요>< 망원동은 데이트하기 좋은것 같아요 #망원동맛집 #망원동데이트#망원동카페 #프롬하노이 #슬라브 #카페추천 #망원동"
분위기 좋은 망원동 슬라브 카페 다녀왔어요,"안녕하세요~! 주말에 망원동에 있는 슬라브 카페를 갔다 왔습니다 지하에 있더라고요! 진짜 숨은 카페를 발견한 느낌 이였어요 ㅎㅎ 이 스티커가 무슨 의미인지는 모르겠지만.. 주문할 때 카운터에도 있더라고요 딱 들어가면 이런 분위기입니다! 되게 어둡죠!! 저는 막 흰색에 밝은 카페보다 살짝 좀 어두운 걸 좋아하는데 여기는 진짜! 어두웠어요! ㅋㅋㅋㅋㅋㅋ 입구 쪽에 주문하는 곳이 있어요 저희는 아인슈페너랑 콜드브루랑 도미노시스템을 시켰어요 도미노시스템이.. 디저트 인데.. 가격이 너무 사악해서 그냥 포기하자고 했더니.. 그래도 먹어보고 싶다고 해서.. 시켜봤어요,, 어두워서 메뉴판이 잘 안 보이길래 가져왔어요! 옆에는 도미노시스템에 대한 설명이 있어요! (읽어보지는 않음) ㅎㅎ 벽쪽에 그림이 많았어요! 되게 분위기 있죠 뭔가 이런 분위기에 카페는 처음이라서 동굴(?) 느낌도 나고 신기했어요!! 큰 원 테이블에 조명이 여러 개 있어요 드디어 메뉴가 나왔어요! 조형물도 같이 주시는데 원하는 위치에 놓고 사진 찍으면 된대요ㅎㅎ 신기하긴 하죠? 귀엽고 뭔가 갬성있긴 해요 과감하게 뿌셔서 사과크럼블이랑 치즈랑 같이 먹으면 된대요! 한순간.. 가격이 넘나 사악하지만.. 맛은 괜찮았어요..!! 그리고 나가는데 보니까 여기에도 조형물이 있더라고요 되게 귀엽다 작고 귀엽다 한 번쯤은 와볼만한 카페인 거 같습니다! 분위기가 좋았어요!! 50m © NAVER Corp. 슬라브 서울특별시 마포구 포은로 87 지하 1층"
"망원동 카페, 슬라브💡","몇일전부터 가보고싶었던 카페! 가보고싶은곳 왜이리많은지~ 슬라브 서울특별시 마포구 포은로 87 지하 1층 망원동에 생긴 슬라브 머 붙었나?생각했는뎈ㅋㅋㅋㅋㅋㅋ 귀여웡😁 와보고 싶었던 이유는 건축가의 공간!이라는 냄새가 났기때문에 다녀와서 이것저것 찾아봤는데, 인디살롱이라는 공간디자인스튜디오의 공간이라고! 슬라브(공간의 바닥을 이루는 구조물)로, 넓지않은 공간에 한판으로 연결된 넓은 테이블 들어오지마자, 웅장하면서도 아늑한 느낌! 그리고 의자들이 너무 예뻤당.. 테이블 곳곳에 건축모형이 귀엽게.. 엄청 시끄러운 분위기는 아니어서, 저녁때는 와인을 마셔도 좋을것 같당 나는 요즘 술좀 줄이는중..ㅋㅋㅋㅋ 사람모형보니 학교다닐때 생각도 나고,, 요즘 나는 왜이렇게 무기력 + 무기력한지 커피기다리는 민쵸리,, 천정 낮은것도 어울리고 멋지닷 뜬금없이 나는 아이스크림을 주문했는데, 플레이팅 너무 귀엽웡.. 바닐라아이스크림에 올리브유랑 후추? ㅋㅋㅋㅋㅋㅋㅋㅋㅋㅋㅋㅋㅋㅋㅋㅋㅋ 핸드드립커피,, 공간구경하고 싶어서 온 카페라서 커피는 기대안했는데, 진짜 맛있음 역시! 민쵸리까 뺏어서 홀짝홀짝 두개다 내꺼^^ 익숙한 콩자갈샘플 슬라브카페에서 코스터가 됬넹 커피마시면서 우리가 앉은곳에서 보인 자리들,, 공간이 참 조용하고, 진짜 좋다. 크리스마스시즌이라서 트리, 조용히 반짝거린당 그리고 나오는 음악들도 전부 좋았다! 테이블위 조명들도 전부 예뻤다. 귀여운 모자쓴 민쵸리 요즘 자꾸 멋부리는 내친구 민쵸링 몇일동안 내가 승질부려서 쪼끔 늙은고같네? ㅋㅋㅋㅋ이제 다시 착한 나로 돌아갈게^^ ㅋㅋㅋ마지막 지갑자랑,, 지갑유목민이어서 무인양품명함케이스에 불쌍하게 넣어다니다가 맘에드는 지갑발견해서 삼 이거 너무이뻐서 따로 포스팅해야지^^ 몇일동안 가고싶었던만큼 만족만족 멋진공간! 🕰"
독특하고 예쁜 조명이 많은 망원동 카페 '슬라브',"주소: 서울 마포구 포은로 87 지하 1층(망원동) 예약전화: 026-013-1250 영업시간: 12:00-20:00 50m © NAVER Corp. 슬라브 서울특별시 마포구 포은로 87 지하 1층 오늘은 전부터 너무 가고 싶었던 망원동에 있는 슬라브라는 카페에 가기로 했어요! arffy라는 빈티스 스토어의 제품이 전시 되어있어서 겸사겸사! 카페 위치는 망리단길 가운데 쯤에 있고 망원동 티라미슈 본점 건물에 같이 위치하고 있다~ 지하 1층에 있어서 망원동 티라미슈 옆 입구로 들어가면 된다는:) 보고 싶었던 조명들이 한 곳에 쫙~ 있어서 저렴한 가격도 아닌데 사고 싶은 욕구가 막! 차올랐다는...ㅠㅠㅠ 그래도 이렇게라도 봤다는 점에 너무 만족하면서 다시 한 번 꼼꼼하고 세심하게 구경한 다음 사진도 여러장 찍었다!ㅎㅎ 그리고 고민없이 살 뻔한 너무나 귀여운 곰돌이 조명! 약간 하리보 젤리 같기도 하고 너무 귀여워서 사고 싶었지만 돈이 없어서 눈물을 머금고 다음을 기약했다,,, 돈 벌면 꼭 데리러 올게... 곰돌이 조명아..! 슬픈 마음을 달래기 위해서 차가운 케페오레를 마시면서 마음을 가라 앉혔다... 텁텁하지 않고 부드러워서 너무 맛있게 마셨다! 조명이 팔리면 바뀐다고 해서 보러 오는 재미도 있고~ 다른 굿즈들도 판매하고 있어서 소소하게 구경을 하면서 시간을 보내기 좋았던 망원동 카페 슬라브! 다음에는 지갑에 돈을 꽉... 채워서 와야할 거 같다는 예감이 드는 그런 카페다ㅎㅎ 기다려... 곰돌아.... ! 조만간 데리러 갈게~!!!"
"편하게 즐기는 망원동 카페, 슬라브","안녕하세요~~~~ 벌써 연말이 찾아왔네요 ㅠㅠ 한 살 더 먹는다니,,, 연말이라 연락 닿은 사람도 많고 만나야할 사람도 많은데 코로나 때문에 밖에 편하게 다닐 수가 없어서 속상해요 ㅠㅠ 밥만 빨리 먹고 들어오게 되는,, 그래도 코로나가 이렇게 심해지기 전에는 친구들이랑 많이 놀러다니고 카페도 많이 다녔었어요 오늘은 추억팔이 겸,,, 그때 방문했던 카페 하나를 소개해드리려고 해요! <슬라브> 라는 유니크 한 곳이랍니다! 50m © NAVER Corp. 슬라브 서울특별시 마포구 포은로 87 지하 1층 예약전화 026-013-1250 영업시간 12:00 - 20:00 새로 생긴 카페였을 때 다녀왔는데 사장님 말씀으론 오픈한지 4개월쯤 된다고 하셨어용 너무 일찍 갔더니 첫손님이라 조용함,, 메뉴판~ 음료수 가격도 적당한 것 같고 디저트가 정말 독특하고 신기해용 제가 시킨건 도미노시스템 과 하겐다즈 윗 오일! 도미노시스템은 건물처럼 생겼는데 르꼬끄뷔지에라는 건축가가 만든 건축 시스템...? 이름이래요 저 하얀 사람 모양 올려놓고 사진찍기 재밌어요 ㅋㅋㅋㅋㅋ 귀여웡,, 음료는 드립커피랑 카페오레 친구랑 하나씩 시킴! 제가 카페오레 근데 나눠먹어서 둘다 시식해봄 ㅋㅋㅋㅋ 커피머신이 없고 모두 필터로 내려주신대요 깔끔한 맛이라 저는 필터가 쫌 더 취향 ㅎㅎ 그냥 새로 생겼길래 한번 방문해본거였는데 커피도 맛있고 분위기도 좋고 결정적으로 디저트가 넘 신선해서 막 우와우와 하면서 사진찍었던 기억이 있어요 ㅋㅋㅋㅋㅋ 친구랑 조용히 이야기 하기도 좋았고 편하게 잘 있다갑니다! 여러분도 망원동 카페 슬라브 에서 소중한 사람과 모임 가져보세요!!"
망원동 카페 슬라브 특색있는 디저트가 맛있고 매력있는 곳,"망원동 슬라브 !!! 친구가 인스타에 올린거 봤는데 되게 특색있는 디저트가 있다고 해서 방문하게 되었어요 ! 또 궁금한건 못참는 성격.....^^ 50m © NAVER Corp. 슬라브 서울특별시 마포구 포은로 87 지하 1층 입체적인 형태와 맛, 텍스쳐를 느낄수 있다고 하네요 ! 기대기대........ 디저트 이름은 도미노 시스템! 신기하다! 디저트가 나오면 직원께서 간단한 설명을 해주셔요. 기술이 발전하면서 유명한 건축가가 만들었다나??? 주신 종이에도 적혀있어서 읽어 보면 도움이 될 듯!!!! 맛은 !!!! 밑에 깔린것이 사과 콩포드와 크럼블, 비스켓과 사이에 있는것이 치즈인데 4가지의 조화가 잘 이루어지는 것 같아요. 새콤달콤한 사과, 바삭하고 살짝의 단맛을 내는 크럼블, 고소하고 크럼블과 다른 바삭함의 비스켓, 치즈의 부드러움과 풍부한 맛, 치즈에 요거트 맛도? 나는 것 같았습니다. 모두 맛과 텍스쳐가 다 달라 함께 먹었을 때 많은 맛과 향, 식감을 느낄수 있어서 아주아주 색달랐음.............. 참고로 사람 모형은 먹는거 아니에여 저도 먹는줄 알았는디.... 근데 진짜 먹기 아깝게 생겼어요. 그래도 잘먹었어요 ㅎㅎㅎㅎ 다음에 생각나면 또 방문 예정!!!!!! 데이트장소로 정말 추천 ~~!"
특색있고 유니크한 망원동 카페 '슬라브' 추천해요!,"안녕하세요! 여러분 이번 주도 활기차게 시작하셨나요 >< 전 어제 술을 넘 많이먹어서 머리가 지끈지끈 아프네요,,, 그래도 기운차게 ! 출근해봅니다 ㅎㅎ 오늘 점심시간에는 망원동 슬라브라는 카페에 다녀왔어요 분위기도 좋을 뿐만 아니라 오랜만에 보는 독특하고 재미있는 컨셉의 카페라서 오늘 소개해드리고 싶어요 ㅎㅎ 50m © NAVER Corp. 슬라브 서울특별시 마포구 포은로 87 지하 1층 예약전화 026-013-1250 영업시간 12:00 - 20:00 블랙 & 화이트로 정갈하고 깔끔한 인테리어가 마음에 드는 곳이었어요 ! 디저트 중에 '도미노시스템' 이라는 메뉴가 건축물처럼 생겨서 사람 모형이 이리저리 올라가 있는 케이크였는데 정말 독특했던 것 같아요 쿠키도 몇 개 시켜봤는데 따뜻한 드립커피 & 쿠키 조합은 맛없없... ㅠ 수제로 만든 쿠키라 고급스럽고 부드러워서 왕만족 ! 쿠폰도 주셨는데 검은 애벌레(??) 모양이 테이블 사람 그림은 도장으로 찍어주시는 거에요 통통 튀는 색다른 디자인인데다 넘 귀엽기까지 한 !!! ㅠㅠㅠ 특색있고 재미있는 슬라브 카페 알아보았습니다! 공간디자인 스튜디오에서 운영하는 곳이라 그런지 곳곳에 건축물도 보이고 디저트 모양도 독특하고 컨셉있게 운영되는 것 같아요 ㅎㅎ 재미있고 신기한 거 좋아하는 저한테는 완전 취저인 카페 ! 잇님들도 색다른 감성 느껴보고 싶다면 망원동 카페 슬라브 한번 방문해보셔도 좋을 것 같아요 ><"
