title,content
서울에서 일본 여행 가능한 예쁜 망원동 카페 추천_소설원 망원,""" 소설원 망원 "" 요새 망리단길에 예쁜 카페가 많아서 핫하다는 얘기를 들은 적이 있었어요! 핫한 곳은 또 가줘야한다면서 예쁜 망원동 카페 알아보다가 일본의 고즈넉한 감성 가득한 카페를 발견했습니다 ♬ 데이트하기도 좋을 것 같고 가족 부모님 모시고 가기도 고즈넉하고 친구들이랑 오순도순 얘기하기도 좋을 것 같아요 ♥ #망원동카페 소설원 망원 서울특별시 마포구 월드컵로13길 22-3 예약 외관 입구부터 감성 넘치는 곳이라는 게 느껴졌어요 ! 아 제대로 찾았구나 싶더라구여 :) 주문은 1층에서 주문하면 진동벨 받고 자리 잡았습니다 ! 평일 저녁이라 한가해서 따로 자리 다 구경하고 나서 골라서 앉을 수 있었어요 ♬ 소설원 디저트는 포장도 되게 예쁘게 되는 것 같아서 디저트 선물하기도 좋을 것 같아요 :D 메뉴판 디저트 메뉴가 정말 다양하면서도 동양풍으로 이색적인 부분도 있어서 좋았어요 ! 흔하게 볼 수 있는 비쥬얼이 아니라서 새롭게 체험할 수 있는 곳 같아요 :D 음료는 아이스바닐라라떼, 우롱차 이렇게 주문했어요 :) 오랜만에 남자친구랑 데이트하러 간 거라서 예쁜 디저트도 먹고 싶어서 술빵 소설 반상도 같이 주문했어요 ! 술빵 카스텔라 비쥬얼이 너무 맛있어보이지 않나요? 옆에서 직접 쪄주시는 거라서 따뜻하게 먹을 수 있다고 해서 더 맛있을 것 같았어요 ! 휘낭시에도 구경하다가 맛있어보여서 두 개 (단팥버터, 솔트바닐라) 더 골라서 추가했습니다 :D 구석구석 인테리어가 너무 예뻐서 예쁜 망원동 디저트 카페 찾으시는 분들께 적극 추천드리고 싶어요 ♬ 층별 자리 안내 홍대, 합정, 상수, 망원 쪽에는 원래 큰 대형 카페가 잘 없었는데 여기는 4층 건물이라서 테이블도 많아서 좋았어요! 주말에도 자리가 많아서 이용하기 좋을 것 같았어요 :D 다다미석, 테이블석 골고루 있었고 4층에는 루프탑도 있어서 취향 저격하는 자리 찾아서 앉으시면 될 것 같아요 ♬ 2층 내부 저는 2층 다다미석에 앉았는데 여기 동그란 창문이랑 바깥 뷰가 너무 예뻐서 여기로 자리 잡았어요 :D 3층 내부 3층은 이렇게 가운데 멋있는 조형물도 있고 테이블석이 많았어요 ! 4층 내부 4층에는 다다미석과 루프탑 테라스 자리가 둘 다 있었어요! 전체적으로 조용하고 아늑한 분위기가 너무 좋았어요 :D 날이 이제 저녁에도 그렇게 쌀쌀하지 않아서 야외 자리도 너무 좋을 것 같아요 ♬ 너무 예쁜 망원동 카페를 발견해서 바로 인스타 스토리에도 도배했어요 ㅋㅋㅋ 망리단길에 예쁜 카페가 많다더니 정말이네요 :D 맛있게 먹고 난 후에 컵, 접시, 트레이 반납은 카운터 1층으로 하면 된다고 적혀있었어요 ! 술빵 소설 반상 + 아바라 + 우롱차 + 휘낭시에 추가 짜 - 잔 주문한 음료랑 디저트를 트레이에 예쁘게 담아주셨어요! 이렇게 예쁜 동양풍의 디저트를 먹어본 적이 사실 처음이라서 너무 신선하고 좋았어요 ♬ 예쁘고 아기자기한 거 엄청 좋아하는데 완전 감성 충만하지 않나요 ♥ 일본에 되게 유명한 오래된 카페 놀러온 것 같은 여행 온 것같은 느낌이 들어서 너무 좋았어요 :D 디저트도 생각보다 너무 다 맛있고 음료도 잘 어울려서 차 종류도 추천드려요 ! 일단 카스테라 술빵은 우리가 아는 그 술떡 맛보다는 카스테라 맛이 더 나면서 폭신한 빵이 너무 맛있었어요! 옆에 생크림이랑 단팥, 버터도 챙겨주셔서 같이 곁들어 먹기 좋았어요 :D 휘낭시에 너무 맛있다고 디저트 잘 안먹는 남자친구도 되게 잘 먹었어요! 디저트가 다 맛있어서 뭘 먹어도 실패는 없을 것 같네요 ♥ 우롱차도 너무 맛있게 먹었어요! 머그컵이 생각보다 큰 편이라서 많이 마실 수 있어서 좋았어요 ♬ "" 총 평 "" 데이트하기도 너무 좋고 맛있는 디저트도 많아서 좋았어요! 동양풍 감성 가득한 예쁜 카페 추천드려요 ♬ 사진도 예쁘게 찍을 수도 있고 분위기도 너무 조용하고 아늑해서 오순도순 대화하면서 즐거운 시간 보낼 수 있었어요 :D #소설원 #망리단길카페 #망원역카페 망원 예쁜 일본풍 카페 추천 소설원 재생 0 좋아요 0 00:00 00:00  접기/펴기 망원 예쁜 일본풍 카페 추천 소설원 50m © NAVER Corp. 소설원 망원 서울특별시 마포구 월드컵로13길 22-3 예약 #망원카페추천 #망원동디저트카페 #합정역카페 #합정카페 #상수카페 #상수역카페 #상수동카페 #대형카페 #망원놀거리 #망원데이트 #감성카페 #서이추환영 #서로이웃환영 #답방가요 #망원예쁜카페 #서울데이트 #서울예쁜카페 #일본감성"
망원동카페 소설원 망원일본풍경물씬나는 소설원망원카페푸딩맛집,망원동핫플 소설원망원카페를 방문했답니다! 오랜만에 서울투어~ 언제가도 즐거운거 저뿐인가요 이웃님들?👀 옛날 빌라를 리모델링해서 만든 소설원망원 입니다! ㅎㅎ 너무 정겨웠던 곳 외관이에요! 우리가 아는 빌라 형식~ 계단도 그대로 3층까지 있지만 계단으로 오르락내리락 해야하는 단점이 있어요! 주문은 지하 라고 하기에는 조금 그렇지만 1층에서 주문하면 된답니다! 안쪽으로 들어가면 주문하는 장소👍 여름에 더워요~?! 더위피하기 좋은 시원한 곳 간판 귀여워🤣 조그만해서 못찾을 뻔 ^^👋🏻 오자마자 메뉴 주문하러 출동 근데 자리를 먼저 잡아야겠지? 주문전에 자리잡으러 출동 3층은 탁자 형식이 많았어요! 2층에는 방으로된 곳도 있어서 편하게 쉴 수 있겠더라구요? 신발 벗기 편한걸 신었다면 추천추천 남자친구분들 눈치챙기기 여자친구 신발 먼저 확인필수✔️ 저희는 2층에 자리를 잡았어요. 푸릇푸릇한 나무들! 그래서 더 좋았던 자리입니다. 3층 생각보다 이쁘잖아!! 우드톤 ~ 갈색! 너무 좋아요!!😍 야외테이블 진짜 너무 이쁨 그자체 서울에 이런곳이? 생각하지도 못한 모습이었어요!! 날씨가 선선하면 올라가서 힐링 하세요! ㅎㅎ 한여름은 너무 더울 거 같거든요💛 3층의 모습~ ㅎㅎ 휘낭시에 내가 제일 됴아하는 디저트~ 겉바속촉쫀! 3가지가 잘 어울려야 뿅 간다고!!!! 근데 휘낭시에 조금 더 두껍게 만들어주세요🤤 히흐히흐히흐히 욤미찌랑 함께🧡 나의 힐링 서울타임 웃다가 마무리🎧 기분이 좋아요 좋아! 메뉴 제일 중요하죠?? 저희는 반상으로 선택했어요! 우리가 선택한 것은 휘낭시에 소설 반상 만족한 메뉴선택 ㅎㅎ 다음에 가면 카스텔라 먹으러 가야지 종류별로 다 먹어버릴테야!! 미친거지 ㅜㅜ 디저트는 미친거지! 이제 당분간 줄여야하는데 할 수 있겠냐고! 옥수수 고소하니 맛있을 거 같은데 내가 아는 그 맛일까? 푸딩 푸딩 맛집:) 그냥 호로록하면 없어지는 마법이? 미쳤다 말차 좋아하는데 다음에는 말차 먹어야지 🎵 네에~ 휘낭시에 말해뭐합니까! 포장도 이쁘게 해주시던데요~?! 선물하기도 좋은 거 같아요!! 참고들하세요😀 맛있는건 한번더! 소설원망원 휘낭시에는 만족 그리고 푸딩은 무조건 먹어주기🐶 50m © NAVER Corp. 소설원 망원 서울특별시 마포구 월드컵로13길 22-3 예약 #휘낭시에#망원동카페#소설원망원#소설원#소설원카페#망원동놀거리
[서울카페] 망원동 카페 추천 소설원 망원(푸딩/카스테라/휘낭시에/디저트맛집),"요즘 서울의 핫플레이스는 모두 글로우서울에서 브랜딩하는 곳이란 사실을 최근에 알게됐다! 지난번 청수당 공명에 이어 이번에 다녀온 글로우서울 카페는 망원역 도보 2분 거리에 있는 소설원 망원🍵 달콤쌉싸름한 말차푸딩과 부드러운 술빵이 맛있는 소설원 망원 레츠살펴보자🎋 #망리단길 #망원디저트카페 #푸딩맛집 #카페투어 🗺️ 위치: 서울 마포구 월드컵로13길 22-3 1층 🕖 영업시간: 매일 11:00 ~ 21:00 🚇 망원역 2번 출구 도보 2분 단독주택을 개조한 건물에 동양적인 인테리어와 물이 흐르는 청아한 소리가 어우러져 멋진 분위기를 내는 곳 4층 건물로 1층에 주문하는 곳이 있는데 우선 자리를 잡고 난 뒤에 주문 할 수 있다! ✅ #소설원망원메뉴 커피랑 음료 그리고 특별하게 세팅되는 디저트까지 다양하게 준비되어 있다. 화려한 비주얼에 기분 완전 쵝오 여기서 꿀팁! 원하시는 디저트가 있을 경우 가능한 일찍 가는 걸 추천! 저녁에 방문했는데 먹고 싶었던 순우유푸딩이랑 휘낭시에 등 품절된 게 있었다.😭 다음에 또 갈 이유가 생겨서 좋기도 함☺️ 2층 테이블 / 다다미석 3층 테이블 4층 루프탑 소설원망원에 가장 큰 매력은 주택의 형태를 그대로 살려두어서 가정집 분위기와 동양화 갤러리 느낌을 동시에 준다는 것이다. 특히 옛날 집 현관문을 그대로 살려둔게 너무 좋았다. ☕️아이스아메리카노 4.5 🍫초코라테 6.5 🍑복숭아아이스티 5.3 🍶술빵카스테라 9.4 🍮말차푸딩 5.3 👑휘낭시에(앙버터/치즈/흑임자) 각 3.2 동양적인 미가 돋보이는 푸딩 그릇🍵 뚜껑을 여니 연초록의 몰캉몰캉한 푸딩이 있었고 그 위에 같이 나온 말차를 부어서 먹으면 된다😋 연초록에서 찐초록이 됐다. 식감은 몰캉몰캉하고 부드러운 식감과 말차가 만나 달콤하면서도 쌉싸름했다. 말차푸딩 먹으니까 순우유푸딩 더 궁금해짐🥛🍮 술빵카스테라 료칸에서 본 것같은 독특한 트레이 위에 면보 그리고 바나나잎(?) 위에 올려 나온다. 술빵카스테라는 이름 답게 예전에 추억의 옥수수 술빵향이 은은하게 나서 군침이 확 돌았다.🤤 주문 즉시 쪄서 나오기 때문에 따듯하고 폭신폭신한 식감이였고 한국인의 디저트 평가 국룰멘트 안달아서 좋다~☺️가 저절로 나오는 부드럽고 담백한 맛이였다. 술빵 카스테라는 같이 나오는 버터와 팥 그리고 생크림을 취향대로 발라서 더 맛있게 먹을 수 있다. ☺️ 카스테라 종류 기본 술빵, 쑥술빵, 옥수수술빵이 있었는데 각자 다 각기의 매력대로 넘나 맛있을 것 같은 너낌적인 너낌 완전 강추 👍 #소설원망원메뉴추천 #소설원꼭먹어야하는메뉴 커피도 산미가 없는 원두여서 내 입맛에 찰떡이였고 초코라테도 아주 찐한데 막 미치게 단게 아니라 적당히 달고 찐해서 소설원 망원 추천 음료🍫 휘낭시에는 간혹 딱딱한 곳이 많던데 여기는 부드러우면서 쫀듯한 식감이였고 의외로 기대가 별로 없었던 치즈 휘낭시에가 내 원픽🧀 짭쪼름하고 치즈의 풍미가 확 느껴졌다. 대나무와 조명이 곳곳에 설치되어 있어 동양적인 분위기를 물씬나는 망리단길 분위기 좋은 카페 소설원 망원 강추합니다.🎋 소설원 망원 재생 4 좋아요 1  접기/펴기 소설원 망원 #망원카페투어 #망원데이트 #망리단길카페 #망원동디저트카페 #망원동카페추천 #망원한강공원 #망원맛집 #마포카페 #마포디저트맛집 #분좋카 50m © NAVER Corp. 소설원 망원 서울특별시 마포구 월드컵로13길 22-3 예약"
소설원 망원 / 망원동 망리단길 일본분위기 카페 디저트 맛집,#망원동카페 #망리단길카페 를 검색했을 때 제일 많이 검색되고 #인스타맛집 에서도 많이 보이던 #소설원망원 망원동까지 잘 안 오기 때문에 온 김에 방문했어요 4층 주택을 개조한 카페로 입구에서부터 인스타 갬성이 뿜뿜하는 곳이에요 입구 계단 말고 오른쪽으로 가셔야 주문하는 곳이 나와요 인스타에서 그렇게 봤던 바로 그 모습 옥수수 크림 카스텔라 먹고 싶었는데 솔드아웃... #술빵카스텔라 와 #휘낭시에 중 한참 고민하다가 #술빵소설반상 을 쑥 술빵으로 변경하여 주문했어요 주문했으니까 층별 구경하기로 해요 인기가 많은 곳이지만 평일이라 다행히 한산했어요 2층 다다미석 / 테이블석 / 남자화장실 3층 테이블석 / 여자화장실 4층 다다미석 / 루프탑 다다미석이 예쁘긴 하지만 오래 앉아있으면 불편하기 때문에 저는 3층 테이블석으로 갔어요 분위기 있게 루프탑을 갈까도 했으나 살짝 더운 날씨라서 구경하는 것만으로 만족하고 내려왔습니다 음료는 흑임자 아인슈페너와 아메리카노를 시켰는데 무난한 커피 맛이었어요 오랜만에 인스타 감성 잔뜩 있는 카페에 와서 기분이 좋았는데 직원이 계속 옆에서 쿠션 먼지를 털더라구요... 그런 건 손님이 없을 때 하거나 양해를 구하고 해야 하는데 그냥 퍽퍽... 직원 교육이 좀 필요한 부분이 아닌가 생각이 되네요 뭔가 아쉬움을 남기게 만드는 카페 후기였습니다 50m © NAVER Corp. 소설원 망원 서울특별시 마포구 월드컵로13길 22-3 예약
"망원동 카페 소설원 망원 : 푸딩, 카스테라, 휘낭시에 전부 먹어 봄","망원동 디저트 카페 소설원망원 인테리어가 예뻐서 갔는데 의외로 디저트가 탄탄했던 곳. 특히 푸딩과 카스테라가 맛있었다 :) 휴무 없음 11:00-21:00 주차는 근처 공영주차장에 소설원 망원(@soseolwon_mangwon) • Instagram 사진 및 동영상 팔로워 955명, 팔로잉 8명, 게시물 133개 - 소설원 망원(@soseolwon_mangwon)님의 Instagram 사진 및 동영상 보기 instagram.com #망원동카페 #망원동디저트 #망원휘낭시에 #망원푸딩 [망원동 카페 소설원망원 외부] 망원동 2번 출구와 이어진 복작복작한 골목에서 카페가 있는 골목으로 조금만 들어오면 외관부터 일본 감성 뿜뿜하는 소설원망원이 딱 보인다. [망원동 카페 소설원망원 디저트 메뉴] #소설원망원 디저트는 카스테라 / 푸딩 / 휘낭시에 이렇게 세 종류! 디저트도 전부 일본일본함〰️ [망원동 카페 소설원망원 음료 메뉴] 커피나 음료보다는 디저트를 더 내세우는 곳인 것 같음 :) 이날 체감상 2만 보 찍었던 날이라 발 뻗고 누워있고 싶었는데 마침 다다미석이 있어서 너무 좋았다😂😆 [망원동 카페 소설원망원 내부] 안으로 들어오면 정말 일본 여행 온 것 같은 기분이 든다. 료칸에서 운영하는 카페 같은 너낌😳 아늑해서 편하게 쉬기 좋았던 다다미석. 망원동 카페 소설원망원 우롱차 4.5 유자에이드 7.3 복숭아 요거트 생크림 카스테라 13.0 말차 푸딩 5.3 단팥 버터, 말차, 얼그레이 무화과 휘낭시에 각 3.2 망원 푸딩 카페 소설원망원 말차 푸딩 5.3 푸딩 맛있었음!😍 깔끔하고 달지 않아서 입이 텁텁하지 않아 좋았다. 엄청 곱게 잘 만든 계란찜 같았던 🍮 가볍고 호로록 할 수 있는 식감임. 같이 나오는 말차 소스를 넣어 먹어도 많이 달지 않아서 맛있었는데, 개인적으로는 매끈하고 호로록하는 질감이 잘 느껴져서(?) 단독으로 먹는 게 더 좋았다😋 망원 카스테라 카페 소설원망원 복숭아 요거트 생크림 카스테라 13.0 막걸리로 만든 술빵이다. 디저트 중에 제일 맛있었던✨ 과일 들어간 빵도 안 좋아하고 상달파도 아닌데 맛있어서 신기했음😆 완전 상큼한 맛 아니고 적당히 달콤한 크림에 상큼함이 살짝 더해진 맛이라 더 좋았다. 모든 디저트와 궁합이 좋았던 우롱차🍵 근데 향이 너무너무 은은해서 조금만 더 진하게 내어주셨으면ㅎㅎ 망원 휘낭시에 카페 소설원망원 단팥 버터 / 말차 / 얼그레이 무화과 휘낭시에 각 3.2 여기 휘낭시에는 겉바속쫀촉한 일반적인 식감이 아닌 촉촉한 파운드 같은 식감이다. 평소 좋아하는 식감이 아닌데도 의외로 맛있었다😳 셋 중에 제일 맛있었던 건 이거! 근데 일본풍 카페인데 왜 앙버터라고 안 하고 단팥버터라고 했을까?🤔 말차 휘낭시에는 말차 가루 때문인지 단팥 버터보다 수분감이 적어서 말차 파운드 같았다. 씁쓸하지 않으면서 말차맛은 적당히 잘 났다. 남은 말차 소스를 뿌려먹으면 촉촉해지면서 더 맛있음〰️ 디저트도 맛있었고 공간도 편하게 쉬기 좋아서 전체적으로 만족스러웠던 곳➰ 50m © NAVER Corp. 소설원 망원 서울특별시 마포구 월드컵로13길 22-3 예약 서비스를 제공받고 솔직하게 작성된 후기입니다."
[마포] 카페 추천 소설원 망원 술빵 카스테라 / 인스타 망원동 핫플,"망원동에 인스타 갬성으로 인테리어가 정말 예쁜 카페에 다녀왔어요! 망원동은 원래 예쁜 카페가 많긴 하지만, 이런 인테리어인 곳도 있었구나! 싶었던 곳! 소설원 망원 연락처 : 0507-1484-5565 운영시간 : 11:00~21:00 주차 불가 / 공영주차장 이용 소설원 카페는 원래는 홍제동에도 있더라구요! 운영시간은 연중무휴. 위치는 망원역 2번출구에서 도보로 10분도 안걸리는 거리에요. 입구부터 인테리어 미쳤... 너무 예쁘지 않나요...!??!? 무슨 일본 여행 온 줄!!! (일본 안가본 사람...) 참고로 주차는 불가해요! 소설원 망원 인스타 들어가보니 공영 주차장 안내가 되어있는데 차로 방문하시는 분들은 참고! 50m © NAVER Corp. 소설원 망원 서울특별시 마포구 월드컵로13길 22-3 예약 바로 옆은 일반 주택이라 주민들은 조금 시끄럽겠다 걱정스럽긴 했어요. ㅠ_ㅠ 1층 안으로 깊숙히 바로 들어가면 바닥은 돌바닥, 옆으론 대나무가 심어져 있는데 진짜 일본 여행 가면 이런 너낌일까요? 인테리어 갬성 무엇...!! 주문은 1층에서 하면 되는데 자리가 없을 수 있으니 미리 자리 먼저 잡고! 주문하러 내려오세요! 근데 내부가 연결되어있지 않고 외부 계단을 이용해야 해서 조금 불편했고... (아니 많이...) 비 오는날이나 겨울은 완전 죽음이겠구나 싶었어요...ㅋㅋ 주문은 1층에서! 1층엔 이렇게 큰 카운터가 있는데 여기서 주문을 하고! 위층 올라가면 됩니다! 엘베 없음 내부 연결 계단 없음 ㅋㅋㅋㅋㅋㅋㅋㅋ 2층에 앉으면 그나마 낫겠지만 높은 층에 자리를 잡으면 올라갔다 내려갔다 엄청 귀찮을 것 같아요. 그래서 저희는 여기서 주문하고 기다렸다가 받아갔습니다! 소설원은 술빵 카스테라가 유명한지 모형도 디피 되어 있어서 어떤 느낌인지 미리 알 수 있어 좋았어요. 저희는 디저트를 필수로 먹는 서타일이기 때문에 ^^ 음료와 함께 주문했습니다. 인테리어 갬성 무엇...! 일반 다가구 주택을 리모델링한 곳인데 인테리어가 진짜 너무 예뻤어요! 우드 천장, 바닥, 중문, 창문 그대로 다 살려서 인테리어 했는데 고즈넉한 분위기도 느껴지고 딱 인스타 갬성! 다만 사람이 정말정말 많았고 거의 다 만석이라서...! 내부 사진을 하나하나 찍을 수 없었어요. 일반 카페처럼 탁 틔여있는 공간이 아니라 각 방마다 테이블이 몇개씩 있는거라 그 방 다 들려서 사진을 찍을 수가 없었.... 메뉴 리뷰 / 술빵 카스테라, 아메리카노, 흑당밀크티 우리가 주문한 메뉴 술빵 카스테라 아메리카토 흑당 밀크티 밥 먹고 디저트 꼭 먹어야 하는 우리... 음료+디저트 국룰... 디저트 배 밥 배 따로 있자나요... 아니 근데 술빵도 너무 예쁘게 담겨와서 갬동...! 예쁜 대나무 통에 면포와 나뭇잎 깔고 그 위에 술빵이 올려져 있었는데 갬성 진짜 무엇 인스타 하시는 분들 여기로 오세요 ㅋㅋㅋㅋㅋㅋ 술빵 카스테라 - 9,400원 아메리카노 - 4,800원 흑당밀크티 - 6,300원 소설원 방문한지 좀 된 상태에서 포스팅 하는건데... 그 몇개월 사이 지금 확인해보니 가격이 올랐네요...!헉.. 술빵 카스테라가 원래 8천원대였는데 9천원대로 올랐고 음료도 몇백원씩 올랐어요. 그 몇개월 사이에...물가 실화야...? 원래 가격이면 그냥저냥 나쁘지 않다 정도였는데 오른 가격은 좀 후덜덜 하네요 ㅠㅠ 술빵 카스테라는 생크림이랑 팥 버터도 같이 나왔어요. 술빵에 발라먹으면 됨! 맛은 음 막 엄청 오!!! 여기 진짜 엄청나다!! 이런 느낌으로 특출나게 맛있어서 꼭 먹으러 와야한다!! 이정도까진 아니었어요. 근처에 산다면 충분히 인테리어 보고 와볼 만 하지만? 카스테라 먹으려고 올 정도는 아님! 그래도 맛있게 먹긴 했습니다! 흑당 밀크니는 소올~~직히 별로였어요. 진짜 별로... 공차가 더 맛있음... 일단 인테리어가 정말 독특해서 8할은 먹고 들어가는 것 같아요. 그리고 테이블 간격도 너무 가깝지 않아서 이것도 좋긴 했는데 문제는 거의 만석이라...ㅜㅜ 주말이라면 자리 잡기가 조금 힘들지 않을까 싶네요! 저흰 운 좋게 한두좌석 있어서 앉을 수 있었는데 그 뒤로는 만석이었어요! 망원동 갈 일 있다면 인테리어가 너무 예뻐서 추천하는 카페입니다!!"
