title,content
[망원동 카페하모니] 영혼갈아서 귀여운거 모아놓음 / 2층 카페(캐치테이블 예약) - 비싸지만..한번쯤..,"망원동 카페하모니 방문기 망원시장가는길에 카페하모니가 이 근처인듯해서 얼렁뚱땅 카페하모니를 먼저 즐겨봐따! 카페하모니 주차는 불가능 - 근처 망원시장 공영주차장 이용하자 건물밖에서부터 사진을 안 찍을수 없는 비쥬얼 테마파크에같은 느낌까지 드는 귀염뽀짝한 카페!! ㅋㅋ 여기서부터 사진 미친듯이 찍기 시작함! 세계관 완전 붕괴되는 #카페하모니 아이들이 부모님과 함께 온 가족단위 손님도 많고 산리오가방메고 온 어른도 보이고ㅋ 세계관 진짜 붕괴되지만 모두모두 귀여운거보고 행복한 공간. 카페하모니! 카페하모니 1층은 누구나 방문 가능하다. 산리오 캐릭터 관련된 상품 파는곳! 수많은 귀여운 물건들이 나를 마구마구마구 유혹한다. 돈버는 으른이라 너무 행복하네ㅋㅋ 쓸모없지만 귀엽고 사랑스러운 물건들 마구마구 사도 되는 으른이라 행복하다!! ㅋㅋㅋㅋㅋㅋㅋㅋㅋㅋㅋㅋㅋㅋㅋ 작고 하찮지만 하찮지않은 가격의 산리오 찍찍이 지갑이 왜 탐나는걸까?! 잠깐 고민해따가 포기ㅋㅋㅋ 이렇게 고민하다가 포기하는 수많은 순간들을 느끼며 즐겼음ㅋㅋ 키보드도 넘 귀엽고..... 지갑부터 키보드. 인형까지 진짜 다양하디 다양한 산리오물건이 그득그득! 디자인은 귀엽지만 가격은 절대 귀엽지않다는거! 정신 똑바로 차려야한다!!! 자녀분들과 함께온 부모님들은... 인형 하나만골라도...와.... 장난아닌거같던데?!??! ㅋ 1층 왼쪽에있는 무슨 베이커리?라는 이름을 달고 있는 공간. 뭘 파는곳은 아니고 2층 카페에서 파는 디저트 샘플이랑 산리오 관련된 귀여운거 죄다 모아놓은곳! 진짜 여기서 영혼갈아서 산리오제품이랑 귀여운걸로 그득그득 꾸민게 느껴짐 카페하모니 2층 카페에서 파는 디저트샘플이랑 나머지는 산리오 물건들이 많이보이는데 산리오 그릇이나 접시등은 따로 판매하지 않는듯. 아쉽ㅋㅋㅋㅋ 카페 하모니 쿠로미와 마이멜로디가 환상의 케미를 선보이며 준비한 F&B와 두 친구의 사랑스러움만 가득 담긴 GOODS까지! app.catchtable.co.kr #캐치테이블 카페하모니 예약 카페하모니 2층 카페는 예약을 해야지만 이용이 가능하다. 주말은 완전 박터지는 예약으로 힘드니까 마음의 준비를 해야한다. 의식의 흐름대로 흘러가던 나와 친구는 기왕 온김에 2층 카페가면 좋겠다 싶어서 척척박사가 캐치테이블 예약현황 미련넘치게 마구마구 확인하던중에 진짜 정말 운명처럼!!!! 누가 취소했는지 1시 2인예약을 1시 15분전에 성공해따ㅋㅋㅋ 진짜 너무 웃겼음ㅋㅋㅋㅋㅋ 이러면 이건 2층가서 돈쓰라는 운명이지ㅋㅋ 2층 카페하모니 입장시간이되면 직원분들이 안내해 준다. 예약한거 확인하고 인원수에 맞춰서 테이블 매트주면 2층으로 올라가면 된다!!!! 어디서든 열심히 사진 찍는 1인 옛날 구옥을 산리오 카페 컨셉에 맞춰서 이쁘장한걸로 마구 때려 받은 카페. 진짜 영혼 갈아서 만든듯. 여기저기 사진 찍느라 정신없음. 카페 공간은 거실같은 곳을 포함해서 총 4개의 공간으로 구성되어있음. 모두들 이쁘장한 테이블에 앉으려고 바쁘다요!! 우린 창이 크고 밝았던 방에 테이블을 잡아따. 카페산리오는 이용시간이 총 50분이다. 50분!!!!!!!!!!!! 촉박하다!!!! 정신 똑바로 차리고 카페 사진찍고 주문하고 음료랑 디저트 즐기고 가야한다!!! 뭔가 다양한듯 귀여운 음료와 디저트가 다양하다. 뭐랄까 달달구리 음료는 안땡겨서 처음엔 티세트 9,500원 그리고 쿠키샌드 5,000원 X 2개 이렇게 단촐하게만 시켰다가....후회함... 다른 사람들이 시킨 디저트 넘 귀여워... 빵이랑 마들렌이랑... 저 딸기머시기도 귀여워보이고... 티랑 쿠키만 시켰던 우리는 결국... 15,000원까지 케이크 하나 추가로 시킴ㅋ 그렇게 결국 우리는 티세트 쿠키샌드 그리고 케이크까지 놓여지니까 드디어 우리가 원하는 비쥬얼 완성!.ㅋ. 귀여운거 잔뜩시키고 사진찍고 만족! ㅋㅋㅋㅋㅋㅋㅋㅋㅋㅋㅋㅋㅋㅋㅋㅋㅋ 진짜 너무 귀여워!!! 큼지막하고 핑크핑크한 산리오 케이크 하나로 아주아주 만족스러운 티세트가 완성됨!! 산리오 케이크 담겨온 이 접시가 너무 탐났는데... 따로 안 판다고 해서 넘나 아쉽 ㅠ 다른 분들이... 카페 하모니 방문하신다면.. 그냥...여러명이가서 이것저것 후회없이 왕창 시키시길.ㅋ 어짜피 가격은 적당히 비싸고 맛은 특별하진 않지만 적당하고 이용시간도 50분밖에 안되지만.. 귀여운거 잔뜩보고 사진찍으러가는거니까 기왕가는거 이것저것 잔뜩시켜서 사진 왕창 찍고 먹고 노시길!ㅋㅋㅋ 그렇게 우리는 후회없이 열심히 사진찍고 귀여운거 찍고 놀고 그렇게 50분을 아주 촉박하고 알차게 즐기고 나왔다는거! 음료시키고 기다리는동안 내 애착인형들고 여기저기 돌아댕기면서 인증사진 마구마구 찍느라 바빴음! 진짜 모든 공간이 전부 너무 귀엽! 이렇게 귀여운 소품은 다 어디서 구했나!!! 이쁜것들로 채워진 이쁜 카페에서 기분좋게 힐링하면서 한참을 친구랑 꺄르르르 거렸다! ㅋㅋㅋㅋㅋㅋㅋㅋㅋㅋㅋㅋㅋㅋㅋ 카페하모니 서울특별시 마포구 동교로9길 12 지층~1층 카페하모니"
망원동 산리오 마이멜로디 쿠로미 예약방법 카페하모니 방문후기,"안녕하세요? 카페를 좋아하는 뷰뤼언니입니다 동생이 하모니를 너무 좋아해서 캐치테이블로 예약한 아기자기한 카페하모니에 다녀왔습니다! 지하철 6호선 망원역에서 걸어가시면 나와요 카페 하모니 -Reservation- 카페 하모니 (catchtable.co.kr) 100% 예약제이며 캐치테이블에서 예약 가능합니다 카페 하모니 쿠로미와 마이멜로디가 환상의 케미를 선보이며 준비한 F&B와 두 친구의 사랑스러움만 가득 담긴 GOODS까지! app.catchtable.co.kr -Open- 11:00 - 20:00 Last Order 19:00 -View- 이렇게 생겼는데요 멀리서 봐도 딱 알 수 있겠죠, 와 저기는 귀여운 카페다! 아이들이 정말 많이 왔어요 엄마와 함께 손잡고 온 초등학생 친구들 정말 귀여웠습니다 1층에는 가게가 있고 2층에 카페가 있습니다 예약한 시간에 맞춰서, 아니, 보다 더 여유롭게 도착하셔서 기다리시는 걸 추천드려요 밖에는 이렇게 사진 찍을 수 있는 포토존이 있습니다 정말 귀엽지 않나요? 멜로디와 쿠로미 기다리는 공간이 정말 다양하고 많았어요 이날 굉장히 더워서 기다리는데 조금 힘들긴 했지만 곧 입장한다는 생각에 마음이 들떠있었어요 -Inside- 드! 디! 어! 저희 차례가 되어 저희도 입장했는데요 입장 전 캐치테이블로 예약한 내역을 확인 후 입장 가능했습니다 그만큼 사람들이 정말 많이 오기도 하는데 예약한 손님이 입장하는지 확인하는 제도가 좋았습니다 입장부터 정말 아기자기한 귀여운 소품들로 여기저기 다 진열되어 있었는데요 어릴 적 좋아했던 캐릭터를 이렇게 카페로 보다니 신기하고 소녀감성이 확 살아나는 기분이었습니다 안에서 본 창가 view 귀여운 정원을 잘 꾸며놓은 것 같아요 오후 티 파티를 즐기는 친구들과 함께 저희도 저녁 전 오후 티타임을 즐기러 이렇게 테이블 가득한 방 안으로 들어갔습니다 생각보다 자리가 꽤 있었어요! 그리고 동시에 입장하신 손님들 모두 함께 이 공간을 즐겼으며 3시간 후 나가야 했습니다 다음 예약 손님들을 받아야 하기 때문이죠! -Our Pick- 저희는 이렇게 주문했습니다 1. 블랙레몬에이드 2. 딸기라떼 3. 까눌레 4. 쿠키 처음엔 여기 자리도 너무 예쁘길래 여기 앉아서 먹을까 고민했지만 아늑한 방 안으로 들어갔어요 저희 자매가 주문한 메뉴 저는 딸기라떼를 주문했는데요 정말 상큼하면서도 고소한 크림맛도 나고 생딸기가 들어간 건 아니지만 맛도 괜찮았답니다 그리고 동생은 블랙레몬에이드를 주문했는데요 생각보다 탄산이 강하지 않아서 살짝 아쉽긴 했어요......! 쿠니는 그냥 쏘 쏘 꼭 시켜 먹을 필요는 없는데 사진 용으로 딱 좋긴 합니다 여기서 먹은 까눌레 귀여운 비주얼에 맛도 좋았어요 딸기맛 그리고 포도맛 초콜렛과 함께 먹기 딱 좋았습니다 핑크 까눌레만 처음에 시켰다가 보라색도 궁금해서 주문했습니다 까눌레는 정말 겉바속촉으로 먹는 재미가 있죠! 카페 안에서 즐거운 시간을 보낸 후 1층으로 내려가보았습니다 과연 무엇이 우리를 기다리고 있을까요? -Shopping- 1층에 내려가서 오른쪽으로 들어가시면 이렇게 수많은 인형들과 굿즈들이 있답니다! 정말 다양하죠? 키체인에 인형도 다양한 크기에 동생이 멜로디 쿠로미를 정말 좋아하기에 눈이 돌아가더라구용ㅋㅋㅋㅋ 학생들은 이러한 포스트잇 굿즈를 좋아할 것 같아요 저도 어렸을 때 이런거 보면 환장했으니까요! 왼쪽에는 편지지도 있고 오른쪽에는 다양한 크기의 포스트잇 피규어도 있고 다양한 파우치도 있습니다 마우스 패드도 있네요 이쯤 되니 이 캐릭터들의 배경이 궁금해졌어요 마이멜로디 1975년에 데뷔했고 솔직하고 밝은 성격의 소유자 취미는 어머니와 쿠기 굽기 장래희망은 과자 가게 주인이 되는 것 출처: 나무위키 와 정말 귀엽네요 핑크핑크한 마이멜로디는 정말 생각보다 나이가 많군요 ㅋㅋㅋㅋㅋ 그러면 이번엔 쿠로미를 볼까요? 쿠로미 2005년에 데뷔했고 난폭해 보일 때도 있지만 사실은 엄청 여성스러운 성격??!!! 취미는 일기 쓰기, 연애소설 읽기 좋아하는 색은 검은색 출처: 나무위키 귀여운 캐릭터들 이네요 저는 아래 컵이 그나마 제일 잘 활용하지 않을까 싶었어요 이걸 뭐라고 해야되나요? 피규어? 이렇게 세 가지가 있었어요 다양한 키체인들도 있었습니다 문제는 가격인데요 네, 생각보다 정말 비싸서 굳이굳이 사겠다는 동생을 말려보았습니다 -Bakery- 제가 갔을 당시에는 이렇게 베이커리 굿즈가 있었는데요 살짝 공사하는 느낌이 들었기에 지금은 어떻게 변했을지 저도 궁금합니다! 진짜 케익 같지 않나요? 하지만 저것은 피규어 케익 입니다 이렇게 인형으로 보니 더 귀여운 맛이 있네요 눈이 초롱초롱 -Outside- 다 구경 후 그냥 가기엔 아쉽죠! 마지막으로 또 사진 찍고 저희는 산책 하다가 저녁을 먹으러 갔어요 -Map- 서울 마포구 동교로9길 12 지하철 6호선 망원역에서 걸어가시면 나옵니다 카페하모니 서울특별시 마포구 동교로9길 12 지층~1층 카페하모니 -Gift- 여름이라고 이렇게 부채를 나눠줬는데요 이번 여름 내내 정말 잘 활용했습니다 가벼워서 좋고 가방 안에 쏙 들어가서 좋아요 -Final- 귀염뽀짝한 공간에서 마이멜로디와 쿠로미를 좋아하는 사람들이라면 행복한 시간을 보낼 수 있습니다 디저트도 생각보다 정말 맛있고 오랜 시간 앉아 있지 못한다는 점을 고려했을 때 짧게 집중해서 즐거운 시간 보내기 좋은 카페같았어요 여기는 딸 아이와 같이 데이트 하러 가기 좋은 공간 같아요 친구들이랑 같이 가도 좋고 아니면 저처럼 동생이랑 데이트하기도 좋아요 꼭 예약하셔서 방문해보세요 여기는 어디다? 바로바로바로 카페 하모니 -The End-"
<망원동카페>카페하모니 신상산리오카페-2,"카페하모니 방문기 1탄 <망원동카페>카페하모니 신상산리오카페-1 카페 하모니 마이멜로디,쿠로미 카페 글,사진 동글핑 이번엔 신상 산리오카페라고 할 수 있는 '카페 ... blog.naver.com 카페 내부 인테리어 사진이 많은 관계로 음식 사진만 따로 나뉘어 올리게 되었어요. 자리에 잡은 저희는 테이블마다 준비되어 있던 메뉴판 책을 보며 먹고싶은 메뉴를 고르기 시작했어요. 사진으로만 봤던 귀여운 딸기라떼 (그런데 품절이였어요 ㅜㅜ) 비싸긴하지만 커피 종류별로 있구요. 귀여운 음료들과 디저트들... 산리오카페들은 모두 메뉴가 달라서 가는 곳마다 다 먹고싶어지네요 2층 카페 가운데쯤에 이렇게 키오스크가 있구요. 요렇게 메뉴를 주문하고 결제하면 키오스크 뒤에 있는 주방에 직원분들께서 바삐 움직여 음식을 준비해주신답니다. 생각보다 빨리 나온 저희가 시킨 메뉴들 메론소다 (\6,800) 바나나우유(\7,000) 푸딩(\9,000) 쿠키(\4,000) 귀여운 쿠로미가 올려져있는 푸딩은 생각하시는 그 카라멜푸딩 맛이였어요. 정작 시킨 아이는 별로라 하고 저는 맛있어서 싹싹 긁어먹었... 커피가 먹고싶었지만, 그래도 여기서만 먹을 수 있는 귀여운 음료가 먹고싶어 시킨 메론소다 ! 맛있는 바닐라아이스크림이 한스쿱 들어간 맛있는 메론 소다였어요. 사실 메론소다 자체가 흔히 먹을 수 없는 음료라 가끔 먹으면 맛있더라구요. 그리고 바나나 우유와 쿠키는 일반적인 그 맛! (가격 무엇 ㅜㅜ) 그리고 1인당 한개씩 주신 코스터 ! 산리오카페를 방문할 때마다 그곳만의 오리지널 코스터를 선물로 꼭 주시는데 모으는 재미가 솔솔해요. (요기 카페하모니 코스터가 젤 얇아요 소근소근) 50m © NAVER Corp. 카페하모니 서울특별시 마포구 동교로9길 12 지층~1층 카페하모니"
망원동 카페하모니 산리오 카페 + 예약꿀팁,"망원동에 새로 생긴 산리오 카페! 마이멜로디와 쿠로미를 컨셉으로 한 카페에요 산리오를 좋아하는 사람들 조심하세요.. 들어가면 너무 귀여워서 숨을 못 쉴 수도 있거든요~쿄쿄 예약이 조큼 어려웠지만 쩡며는 성공을 했G~~~ 카페하모니 ⏰ 11:00 ~ 20:00 📞 0507-1391-9025 📍 망원역 2번 출구에서 204m 50m © NAVER Corp. 카페하모니 서울특별시 마포구 동교로9길 12 지층~1층 카페하모니 카페하모니 예약 방법 예약은 캐치테이블 어플에서 가능해요! 월말에 다음 달 1일~15일 당월 중순에 16일~말일 미리 예약 일자 확인해서 알람을 맞추고 가능한 당일에 캐치테이블 어플로 예약하면 됩니다 ⭐️ 자리가 없더라도 방문할 날짜에 들어가 계속 초기화를 해줍니다 ⭐️ 손과 팔목이 아프지만 10분.. 15분..쯤 하다 보면 빈자리가 생겨요 그때 바로 클릭을 해주면 성공!! 빈자리 알림을 맞추고 알림이 와서 들어가 보면 이미 늦더라고요ᅲ 그래서 계속 초기화를 하면서 기다리는 게 더 빠른 것 같아요! 카페하모니 외부 & 포토존 흡ㅠ 입구를 보자마자 너무 귀여워서 숨을 못 쉬겠어,,, 진짜 산리오들 왜 이렇게 귀여운거야ㅠㅜ 1층은 포토존들과 기념품샵 / 2층은 카페로 건물은 총 2층으로 운영됩니당 ⭐️오후5시 예약이면 오후4시부터 대기표를 줍니다 대기표를 받고 4:55부터 순서대로 입장-! 저희는 4시쯤 도착해서 대기표 1번을 받고 기념품샵을 구경했어요 모든 게 완벽해 :D 카페하모니 1층 기념품 샵 1층 기념품 샵에는 다양한 마이멜로디&쿠로미 용품들을 판매합니다 아주 귀여워!! 그리고 시원해,, 이제 여름인데 실내 좋아요ఇ 휴대용 선풍기, 방향제, 키링, 필통, 파우치, 마우스, 마우스패드, 에코백, 등등 아주 다양한 제품들이 있어요! 이곳에서 제가 산 제품은...!! 요 뽀짝이 마이멜로디 디퓨저!! 진짜 보자마자 내꺼다 싶었던,,ෆ⃛ ෆ⃛ 카페하모니 2층 카페 내부 2층 카페로 올라가는 길~ 1등 좋아~ 룰루랄라 🎶 1층 외부와 포토존들도 귀엽게 잘 꾸며놨다고 생각했는데 2층으로 들어서는 순.간. 저 꽃동산에 있는 산리오들을 본 순.간. 너무 예뻐서 사진을 막 찍었어요 (1장 건짐~) 2층 카페는 거실과 방 3개, 화장실이 있었어요 편해 보이는 소파 자리로 픽-! 50분의 시간제한이 있어서 호다닥 사진 찍고 얼른 주문을 했답니다 ㅎ.ㅎ 카페하모니 메뉴 카페 내부가 핑크 핑크 해서 그런지 사진들이 핑크 핑크 해요 :) 메뉴가 많지 않아서 금방 고를 수 있었어요 (오히려 좋아) 복숭아 에이드 5,800원 푸딩 9,000원 사실 이 푸딩에 반해서 온 이유도 있어요 :D 몽실몽실 퐁퐁한 이 느낌 보이시나요?! 푸딩은 부드럽고 촉촉하고 아주 맛있었지만 푸딩 아래에 깔린 시럽이 좀 많이 달았어요,, 복숭아 에이드는 새콤달콤하고 복숭아가 씹혔어요 이것도 새콤보다는 달콤한 맛이 더 납니당 날씨는 아주 더웠지만 그냥 가기에는 아쉬워 포토존에서 찍은 사진들,, 더웠지만 사진은 만족해~ 역시 산리오는 귀여워. 다들 예약 성공해서 필히 다녀오세요. 마지막으로 우리 집에 데려온 마이멜로디 디퓨저~ 집에 있는 뽀짝이 인형들과 인증샷으로 마무리 향도 너무 좋고 그냥 귀여워!!!!!"
망원동 카페하모니 | 마이멜로디 쿠로미 산리오 카페 | 피탓토 쿠로미 인형 | MD SHOP | 마멜 쿠로미 포토카드 | 서울 데이트 추천,"안녕하세요!😄 저는 산리오 덕후입니다 망원역 근처에 있는 마이멜로디, 쿠로미 테마의 카페 하모니에 다녀왔는데요 음료 주문 마감시간인 7시에 도착해서 손님도 별로 없었고 대기도 없어서 좋았습니다 ㅎㅎ 망원동 카페하모니 포토존입니다 너무 이쁘죠.. 낮에 갔으면 더 이쁜 사진 많이 찍었을 것 같아요 ㅎㅎ😄 카페 내부 사진입니다 감상하실게요~ 넘나 귀여운 내부 인테리어 또 가고싶어요 👍 카페 전경도 예뻐요 저는 원래 온리 헬로키티만 좋아했었는데 요즘따라 포차코 마이멜로디 쿠로미.. 일러스트에 따라 시나모롤도 귀여워서 다 좋아지기 시작한 것 같아요 저는 스윗피아노도 좋아합니다 피아노를 좋아하기도 하고 캐릭터도 좋아하고 그래서 여유 생기며 성인 피아노 학원 등록할 생각이에요 ㅋㅋ 요거 중고로 3만원에 파는 사람있는데 갖고싶어요 월급들어오면 살 것 같기도 하네요 한교동도 매력있어요 하지만 바츠마루랑. 바쿠는. 제 스타일이 아닙니다 마감시간에 부랴부랴 입장해서 겨우 주문한 아이스아메리카노, 딸기라떼 입니다 남친이 아아는 탄맛이 좀 난다고 했고 딸기라떼는 크림이 미쳤어요 !!! 추천합니다 존맛탱👍 요기는 화장실 앞 거울이에요 😆 코스터 이벤트 바쿠주셔서 버렸습니다. 싫어요. 부장님같고. 저 주름살 싫어요. 2층 카페 앞에 있는 거울입니다 키 커보여서 좋네요 저는 168이 워너비였는데 잘 안됐어요 원래 비율과 외모는 운이잖아요?? ㅠㅠ🥲 이곳은 1층 굿즈샵의 베이커리존??입니다 너무 귀엽죠 저도 제 방 이렇게 귀엽게 꾸미고 싶어요 ㅎㅎ 산리오 코스터 이렇게 귀여운거 많은데 왜 바쿠 주셨어요? (불만가득) 장난이에요 ^^ 만지는거 아님 같이 있으니까 더 귀여운 인형세트 하나만 있으면 좀 그렇구 이렇게 둘이 같이 있으면 더 귀여운 것 같아서 다음에 재방문하면 세트로 구매할까 생각중이에요 바로 이곳 1층 md shop 매장에서 말이죠~ 넘 귀여워서 샀어요 디스플레이 되어있는 쿠로미랑 마이멜로디 제품중에 쿠로미가 마이멜로디 옷 입고 있는 제품이 제일 시선이 가고 귀엽고 그래서 가격이 좀 있지만 그래도 샀어요 피탓토 쿠로미 인형 : 37,400원 마이멜로디 옷 : 25,500원 넘 뿌듯합니다 후회는 없어요 저의 핑쿠핑쿠 공주 방이랑 잘 어울려서요 🩷 구경 끝 💟2층 카페 - 7시 라스트오더 8시까지 - 이용시간 50분 캐치테이블로 예약해야하지만 저는 늦게가서 자리가 있었어요 💟1층 MD SHOP 매장 - 7시 55분까지 운영 저보다 더 예쁜 사진 찍으세용 🩷 저는 이사진이 제일 맘에 들어서 카톡프사 했습니다 ㅎㅎ 3만원 이상 구매시 증정하는 포토카드! 9월 산리오 포토카드 3탄 쿠로미는 판매완료 마이멜로디는 판매중입니다 번개장터에서 판매중이에요 망원동 카페하모니 망원역에서 가까우니까 서울 데이트 코스로도 좋아요 다음엔 산리오러버스클럽도 가보고싶어요 ㅎㅎ 산리오 투어 추천합니다 💟💟💟💟💟💟💟💟💟💟💟 행복한 추석연휴 보내세요 ~ 🩷 💟💟💟💟💟💟💟💟💟💟💟 #산리오카페 #카페하모니 #망원동카페 #카페추천 #마이멜로디 #쿠로미 #산리오인형 #산리오포토카드 #산리오포카 #마이멜로디포카 #쿠로미포카 #마멜 #쿠로미포카 #쿠로미인형 #산리오굿즈샵 #카페하모니후기 #산리오카페추천 #망원동카페추천 #서울데이트 #서울 #서울가볼만한곳 #망원동데이트 #홍대 #망원 #카페 #산리오 #쿠로미"
