title,content
망리단길 감성 카페 | 망원동 “슬라브(SLAB)”,"오랜만에 길동이의 감성 카페 포스팅 입니다 :) 길동이는 노포 식당만큼이나 감성 카페를 좋아해요 Slab : 공간의 바닥을 이루는 구조물이라는 의미 공간 디자인 스튜디오인 ‘인디살롱’의 첫번째 프로젝트 공간과 건축에 대한 생각을 여러가지 방식으로 표현하는 공간 오늘 소개 할 곳은 망원동 카페 “슬라브”입니다 “슬라브” 서울 마포구 포은로 87 지하 1층 망원시장 골목 끝자락에 위치한 공간 슬라브 건물 지하 1층에 위치한 카페에요 지하로 내려가면 마치 비밀 아지트같은 공간이.. 낮은 천고와 조도 입구에서 부터 나는 은은한 우디한 향 조명, 인테리어, 오브제, 향 전체적으로 차분한 분위기의 공간이였어요 진열된 그림들을 보니 마치 전시회장에 온 느낌도 들었는데 아니나 다를까 굿즈, 조명, 빈티지 제품들은 매장에서 판매 중이라고 해요 :) 저기 보이는 흰색 의자는 일본의 가구 브랜드 마루니에서 건축가 SANAA와 함께 디자인하고 제작한 의자라고 해요 일명 토끼의자라 불리는 SANAA 체어도 전시 및 판매 중이니 참고 하세요-! 티셔츠도 구입 할 수 있습니다 독특하게 이곳은 원테이블이에요 중앙에 단 하나의 긴 물결 모양 오아이스 테이블이 놓여져 있어요 공간과 어우려지는 멋스러운 테이블 테이블 위에 전시된 오브제들은 슬라브의 아이덴티티가 느껴지는 또 하나의 포인트 공간이 주는 느낌이 좋아서 손님들이 빠진 후 사진을 얼마나 찍었는지.. 오랜만에 마음에 드는 감성카페를 찾았어요 :) 전체적으로 조도가 낮은 만큼 각기 다른 모양의 독특한 조명들이 빛을 발하고 있어요 20세기 중후반 제품들로 시간이 지나도 변하지 않는 가치를 탐구하고 세월의 흐름 속에서 더욱 빛을 발하는 빈티지 제품들을 공유하는 조명이라고 합니다 영업시간 월요일, 수요일, 목요일, 금요일, 토요일, 일요일 12:00 - 20:00 매주 화요일 정기 휴무 📞 02-6013-1250 제로페이, 네이버페이, 무선 인터넷, 남/녀 화장실 구분 50m © NAVER Corp. 슬라브 서울특별시 마포구 포은로 87 지하 1층 여유롭게 커피 마시며 음악을 즐기기에 좋은 공간 분위기 맛집 뿐만 아니라 BGM 맛집이에요 사장님 플레이리스트 칭찬해 :) 서랍장에 진열된 호롱들은 세라미스트분이 물레를 사용하지 않고 손으로 직접 빚은 정교하고 차분한 도예품이라고 해요 슬라브에 온다면 곳곳에 놓인 오브제들 하나하나 구경해보세요 물, 냅킨, 물티슈는 입구에 구비되어 있어요 < 메뉴 > 커피와 디저트 그리고 술이랑 안주가 있는 카페겸 펍이에요 - 커피 - 핸드드립 원두 두가지 / 카페오레 / 아인슈페너 / 콜드브루 - 디저트 - 도미노 시스템 / 아이스크림 / 쿠키 - 술 - 칵테일 / 맥주 / 위스키 - 안주 - 슬라브 플래터 이 날 품절이라 주문 못 했지만.. 이 곳의 시그니처 디저트인 도미노 시스템 슬라브 블렌드 핸드드립 5500원 콜드브루 5000원 길동pick ✔️ 주말 오후라 손님이 많아서 입구 카운터 쪽 테이블에 자리 잡았는데 하필 앞에 술이 진열된 자리... 술쟁이 길동이 눈 돌아갑니다... 세가지 칵테일 위스키는 글렌모란지와 야마자키 맥주는 독일 맥주인 아잉거 브로바이스와 하와이 맥주인 빅웨이브 커피 대신 가볍게 술 한잔 하기도 좋을 것 같아요 :) 기다림의 미학 :) 이 곳의 커피는 핸드드립뿐이에요 칼리타 츠바메 드리퍼를 사용하여 커피를 내려 주셔서 깔끔한 맛을 느낄 수 있다고 해요 슬라브 블랜드 핸드드립 / 콜드브루 주문한 음료는 자리로 직접 가져다 주세요 독특하게 코스터는 타일..이것도 컨셉이겠지? 슬라브 블랜드 핸드드립 (5500원) 다크 초코향과 아몬드의 고소함 그리고 부드러운 바디감이 좋은 커피에요 커피 맛은 무난하니 좋았어요 . . . 잘 쉬다 갑니다 :) 망리단길 감성 카페 찾는다면 이 곳은 어떠세요? SLAB 공간과 건축에 대항 생각을 여러가지 방식으로 표현하는 공간 망원동 카페 “슬라브” #망원동감성카페 #망원동카페 #망원동카페추천 #망원동슬라브 #카페슬라브 #슬라브 #망리단길카페 #망리단길데이트코스 #망리단길감성카페 #망원역카페 #망원역카페슬라브"
[망원동] 슬라브 - 건축을 디저트로 풀어낸 카페,"인스타그램에서 비주얼 보고 이끌려서 가게 된 망원동 '슬라브' UNDEFINED SLAB_SEOUL 지하1층에 위치한 슬라브 You live the surprise (그 다음 글씨를 모르겠어요) of old plans 내부에 작업실도 있어요 자리가 없는 편은 아닌데 손님이 꽤 있더라구요 슬라브 메뉴 도장도 정말 힙한 슬라브 화장실이 좋은 편은 아니니 참고하세요 Tea (5000) 1920년대 주거 건축은 철과 콘크리트, 유리 등 재료의 발전으로 슬라브와 기둥으로 벽없이도 자유로운 평면 구성이 가능해지도록 진화했다. 모든 집을 벽돌과 돌을 쌓아서 짓던 과거와 다르게 건축가 르 코르뷔지에(Le Corbusier)는 원하는대로 공간을 구획할 수 있다는 이론과 원칙을 Dom-ino system으로 구축했고, 현재는 현대 건축과 공간 설계 계획의 원칙이 되었다. 최소한의 기둥이 모서시를 지지하고 평면의 한쪽에는 각 층으로 갈 수 있게 계단을 만드는 개방적 구조가 도미노 이론의 핵심이라 할 수 있다. 건축 구조를 지면에서 들어 올려 움직임과 순환을 만들고 자연스러운 공간 창출, 수평적인 구조 장치들을 활용한 시각적, 합리적 변화를 만들 수 있다. 도미노 시스템(16000) 디저트가 예술작품이라 계속 찍게 되더라구요 함께 나온 3D 프린팅된 피규어는 저희가 여기저기 얹을 수 있도록 주셨답니다 매우매우 인스타그래머블한 디저트 가격이 사악한 편이지만 맛은 좋았답니다 :) 밀푀유, 크럼블, 애플 콩포트, 마스카포네 치즈 큐브, 시나몬 가루의 조합 분위기가 참 좋았던 곳 :) 힙한 망원동 가게들 https://www.instagram.com/slab_seoul/ SLAB 슬라브(@slab_seoul) • Instagram 사진 및 동영상 www.instagram.com 그럼 뿅!! 50m © NAVER Corp. 슬라브 서울특별시 마포구 포은로 87 지하 1층 서울 마포구 포은로 87 지하 1층 영업시간 12:00 - 20:00 (매주 화요일 휴무) 주차 불가 *추석 9/9, 9/10 휴무"
[망원동] 카페 슬라브 SLAB :: 분위기 좋은 원테이블 카페&와인바,"/ 오랜만에 #망원동 나들이 #망원동카페 찾아 삼만리였어요 정말로 카페가 그렇게 많은데 사람도 많다 / / 50m © NAVER Corp. 루아르커피바 망원 서울특별시 마포구 월드컵로11길 7 1차 #루아르커피바 그래도 날씨가 너무 좋고 하늘이 진짜 맑아서 하루종일 돌아다녀도 기분이 좋았어요 / 50m © NAVER Corp. 콘웰 서울특별시 마포구 월드컵로15길 40 2층 콘웰커피 2차 #콘웰 / 두 개 퇴짜맞고 떠돌아다니다가 사람 터지는 #망원시장 도 구경가고요 여전히 닭강정집은 줄이 어마어마하더라구요 예쁜 핑크색 빌라랑 그 아래 주차된 노랑색 학원차 그리고 파랑색 하늘까지 정말 예쁜 날씨다 / 50m © NAVER Corp. 슬라브 서울특별시 마포구 포은로 87 지하 1층 세 번째 도전만에 드디어 망원동 카페 입성 성공 슬라브 지하로 내려가면 됩니다 망원동 카페 슬라브는 지하인데다가 메인 카페 거리도 아니라서 굉장히 조용했는데요 저는 다행이었는데.. 사장님이 괜찮으실지는 모르겠네요 음료나 디저트만 먹는 카페로도, 간단하게 와인이나 위스키도 곁들일 수 있는 와인바로도 운영되고 있는 곳이에요 슬라브메뉴 왼쪽이 와인&위스키 메뉴, 오른쪽이 카페메뉴예요 망원동 카페 #슬라브 의 커다란 원테이블 모양 스티커도 있어요 이렇게 모두가 한 테이블을 공유하게 되어있어요 그래서 다른 손님들이랑, 직원분들이랑 다같이 앉아있어야하는데 테이블이 엄청 커서 막 불편하거나 그러지는 않았습니다 그리고 저절로 조용히 말하게 됨 귀여운 버섯돌이 조명 벽을 따라서는 아트 갤러리처럼 액자들이 놓여있었구요 여기는 약간 생각의자인가? 테이블 한가운데에 벽 대신 놓여있던 와인들 내부가 어두운 편이라서 사진들이 죄다 나이트모드로 찍힌거있죠? 근데 제대로 안들고있어서 흔들림 아이스 아메리카노(5,500원) 주문하면 한 사람당 잔이 두개가 나오는데요 드립커피라서 얼음잔에 채워진 거 다 먹으면 셀프 리필해서 드시면 됩니다 어차피 한 잔일텐데 두 잔 같은 느낌 조와 버섯 조명 사진이 마음에 들었나봐요 여러장이 있군.. 하지만 아마 이건 저 드립커피 찍을려고 한 것 같아요 직접 한잔 한잔 내려주십니다 쿠키는 종류가 두 개라서 두 개 다 하나씩 주문했어요 단 것이 필요했거든요 슬라브가 프린팅 된 예쁜 접시에 하나씩 올려주시는 쿠키 포크도 함께 주시는데 포크로 먹기에는 조금 딱딱했어요 또 흔들린 초콜릿쿠키 이건 오트밀쿠키예요 일부러 건포도를 안 먹은 건 아닌데 먹다 만 것 처럼 잘렸네요 전체적으로 굉장히 조용하고 차분한 분위기예요 공간이 엄청 넓은데 인테리어도 그렇고 색감도 블랙&우드, 커피까지 갈색이라 정말 갈색세상 같았답니다🤎 오늘도 인스타 감성샷 실패 쿠키 두 접시 먹어치웠고요 오늘도 습관적 V 브이 V 나 눈가 주름 어떡하냐 요즘 제가 화장하면 동생이 옆에서 자꾸 구경을 하거든요 (심지어 남자애임 왜그러는거야) 이 날도 어김없이 심심한지 옆에서 얘기하다가 생각해보니 내 나이때 우리 엄마는 우리 둘을 키우고 있었다며.. 조금 눈물이 나려고 하네요 엄마 사랑해 나는 좀 더 철 없을게 50m © NAVER Corp. 어글리베이커리 서울특별시 마포구 월드컵로13길 73 1층 어글리 베이커리 망원동 슬라브에서 나와서 바로 근처에 #어글리베이커리 가 있길래 맘모스빵을 사볼까했는데 말이죠? 역시나 빵 다 팔리고 텅텅 비어있었습니다 갈 때마다 즐거운 #망원동나들이 일기 끝 안녕!"
"커피와 건축의 만남, 망원동 슬라브 Slab , 내 두번째 미니쿠퍼, 미니 컨트리맨(세이지그린) , 민통선 넘어 강화도 나들이","카키도 아니고 회색도 아닌 오묘한 컬러 네애… 이로써 두번째 미니를 갖게되었읍미다..🚙 #미니컨트리맨 #세이지그린 반도체 문제 속에서 원하는 색상과 모델을 언제 받을 수 있게될지 몰랐는데 운좋게 원했던 모델을 받게되어 좋아유 뭐 지금은 오빠랑 같이 타고다녀서 첫차의 신나고 짜릿한 느낌은 안나지만…🥲 미니 성지 #말자동차 도 처음으로 가보고 미키마우스 키랑 스벅곰돌이 키링 주렁주렁 컨트리맨 관련 후기는 영상으로 준비중인데 궁금하신분은 다음에 한번 봐주시라며.. #미니서초전시장 #정한조딜러 님 감사해용🎉 #미니쿠퍼 엄마가 보내준 새조개+쭈꾸미+조개들 세트로 보글보글 샤브샤브 해묵은날 엄마가 최고야.. 2차전 낮술 하고 싶다고 뒷좌석에서 캔맥 까고있는 조퍼비 태우고 (앞전 차가 정말 무쓸모 2인승이었어서 뒷좌석 체험하시는중) 망원동 가는중 조퍼비 시뻘개진 얼굴 가릴 수 있는 어둑한 공간 오랜만에 또 너어무 맘에드는 공간을 찾았고요 중간중간 빈티지 조명들과 유려하게 생긴 큰 원테이블이 주는 느낌이 남다르다 건축과 커피의 공간 #망원동슬라브 #슬라브 여기 참 셀카맛집이네 요망한 브이라인 턱은 3년전쯤 맞은 필러인데 (심지어 디자인도 안해주었던 기억) 점점 아래로 내려오는게 느껴져서 오늘 녹이고왔다 사진도 그득그득 찍고 내려주시는 드립도 맛있구여 슬라브 서울특별시 마포구 포은로 87 지하 1층 쌩뚱 오늘은 퍼비가 세워놓은 계획대로 움직여보는날 어디가는지 설명은 안해주고 계속 신분증은 꼭 챙기라네 월북하는줄 강화도 왓써여 신기함 민통선 이라니 강화도 교동 대룡시장에 왔써여 여기서 황해도식 냉면으로 유명한 대풍식당 가려고 하니 줄이 장난아니라 다른 식당 찾아 다녔는데 소금이 출입되는데가 없어서 오빠랑 교대로 밥먹고옴;; (소금이 데리고가서 못들어갔을수도 … 계획 흐린 P커플의 최후) 백년가게에서 고기 사올걸 그랬다 으구 귀여워 여기는 #강만장 오토바이행님들의 종착지인듯 가죽에서 풍기는 퀘한 땀내가 나던 남자덜의 공간 (언냐들도 있음) 카페는 물론 오토바이용품부터 각종 소품들이 있던곳이고 소금이와 함께 들어갈 수 있었다 진정한 수캐.jpg 페로몬뿜뿜.jpg 나도모르게 점점 쩍벌이가 되는 곳이었다 강만장 인천광역시 강화군 교동면 대룡안길54번길 24 대룡리517 대룡시장 다시 가서 순무로 만든 깍두기에 방앗간에서 산 떡국떡 사서 나온 뼈주부 안아달라고~~ 지 좀 봐달라고~~ 뒤에서 삑삑이 인형 소리내는 소금 니 자리 만들어줬잖니 얌전히 있거라 (뭔가 요구할땐 짖지 않고 삑삑 소리를 낸다) 망원 시장에서 부식가게 다녀온거 왜 빼먹음 나는야 뼈주부 잭슨피자 포장해와서 우리집 홈룰 피자+라면 햄버거+라면 인데 피자 사왔으니 신라면 팔팔 끓인다 이 조합 보통아이거든예.. 우크라이나 전쟁이 벌써 1개월째라니 이념은 개인간, 국가간에 차이가 있기마련이지만 그 이념에다 몹쓸 신념이 덮어져 올바르고 나쁘고를 가리는데 흐린눈을 만드는 것에 나는 어떠한 표현을 할 수 있을까 답답하다. 이유없이 대책없이 죽어나가는 아이들 그 와중에 자기 애인과 아이들을 스위스로 대피시키는 악마의 마음을 이해 하고 싶지도 않고 가늠 할 수 없다 뭐먹지, 뭐입지, 뭐하지 오늘은 뭘 하고 내일은 뭘 할지 생각하는 지금의 작은 일상이 감사할 뿐 하루 빨리 생사람 생명 빼앗는 짓을 멈추었으면 푸틴 ㅅㅂㄴ.."
[망원동 카페] 슬라브 SLAB 독특한 컨셉의 시그니처 디저트 도미노시스템,"슬라브 SLAB @slab_seoul 망원동에 있는 독특한 컨셉의 카페 슬라브를 소개합니다 ☕️ SLAB 슬라브(@slab_seoul) • Instagram 사진 및 동영상 팔로워 1,441명, 팔로잉 6명, 게시물 104개 - SLAB 슬라브(@slab_seoul)님의 Instagram 사진 및 동영상 보기 instagram.com 📍마포구 포은로 87 (망원동 399-36) B1F 6호선 망원역 2번 출구 도보 505m 위치 매일 오후 12:00-20:00 | 매주 화요일 정기휴무 🏷 슬라브 SLAB 인스타그램 @slab_seoul 안녕하세요. 하늘연달입니다 :) 3일동안의 행복한 휴일이 시작되었네요 💛 오늘은 얼마 전에 포스팅했던 망원동 맛집과 소품샵에 이어서 요즘 망원동에서 아주 핫한 카페 슬라브 SLAB를 소개해드리려고 합니다. 그동안 소개해드렸던 카페들과는 다르게 컨셉과 내부 인테리어들이 조금 특이한 곳이었어요 ! 슬라브에 가면 꼭 먹고 와야 하는 시그니처 디저트인 도미노시스템에 대한 설명과 디저트 즐기는 법도 아주 자세하게 적혀있습니다 :) 낮에는 커피와 디저트가 있지만 저녁이 되면 슬라브에서 와인과 위스키를 먹을 수 있어요 🍷 내부는 굉장히 어둑한 편이에요. 분위기 좋은 데이트 장소를 찾으시는 분들에게는 좋지만, 혼자 책 읽기 좋은 카페 찾으신다면 비추해요 🥲 내부 중간 중간에 놓여져 있는 조명들도 다 너무 예쁘고 잔잔한 재즈 음악이 흘러나오던 슬라브 🖤 시그니처 디저트인 도미노시스템을 주문하면 작은 사람 모양의 조형물을 먼저 가져다 주시는데, 얘네는 나중에 디저트에 직접 데코하면 됩니다 ! 보통 작업할 때 쓰는 커팅 매트를 트레이 대신에 사용하는데 컨셉이나 공간과 아주 잘 어울렸어요. 그동안 가봤던 수많은 카페들 중에서 단 한 번도 보지 못한 아주 독특하고 신기한 비주얼의 디저트 슬라브만의 시그니처 디저트인 도미노시스템은 100분의 1 크기의 공간을 시각적으로 구현하였고, 기둥은 마스카포네와 그릭요거트, 바닐라빈, 라임즙, 생크림을 이용한 상큼하고 고소한 치즈 기둥입니다. 커피는 원래 콜드브루로 주문하려고 했는데, 주문이 어렵다고 해서 콜드브루 대신에 슬라브 블렌드 핸드드립으로 두 잔 주문했어요. 핸드드립 커피는 두 잔으로 나눠서 주셨고, 필요하면 얼음도 더 주신다고 하시더라구요 🧊 비싼 디저트 먹기 전에 와르르 무너뜨려주기 ! 이런 거 시키면 동영상 찍는 건 국룰이잖아요 🧡 우선 아래에는 애플시나몬과 크럼블이 깔려 있고, 디저트 평면은 파이였어요. 물론 아예 맛이 없지는 않았지만 그래도 생각보다 비싼 가격 때문에 굳이 이거를 다시 먹고자 또 방문하지는 않을 것 같은 맛 ? 50m © NAVER Corp. 슬라브 서울특별시 마포구 포은로 87 지하 1층 디저트의 맛을 조금 더 이해하기 쉽게 설명하자면 애플파이를 부셔서 먹는 맛이랄까요. 많이 비싸지만 다른 카페에서는 보기 힘든 비주얼이라서 한 번쯤 색다른 디저트 먹으러 가기에 괜찮을 것 같아요 :) 아래에는 저번에 소개해드린 망원동 맛집과 소품샵 포스팅도 함께 남겨둘게요. 망원동 놀러가시기 전에 읽어보시면 훨씬 더 알찬 하루를 보낼 수 있어요 🖤 [망원동 맛집] 놀토에도 나온 줄 서서 먹는 소바 맛집 : 소바식당 솔직후기 망원동 소바 맛집 소바식당 🍽 @sobasikdang 안녕하세요 하늘연달입니다 ! 어제의 망원동 소품샵 포스팅... m.blog.naver.com [망원동 소품샵] 몽글몽글 아기자기한 만물상 귀여운 선물가게 망원동 귀여운 소품샵 몽글몽글 🧸 @shop_mongle2 소품샵 몽글몽글 📍마포구 월드컵로 11길 71 (망원동... m.blog.naver.com"
[망원동] 슬라브 카페,망리단길에 굉장히 독특한 분위기의 카페를 발견했다 사장님이 건축가? 건축 디자이너? 건축쪽 전문가!라서 전공을 적극 반영한 카페도 운영중이라고 실제로 슬라브는 건축용어로 ‘슬라브 탄다’는 ‘천장 바닥을 공사한다’라는 뜻이라 함 카페 로고 지하에 위치해있는 슬라브 카페 특이한게 이게 카페 로고라 함! 계단 따라 내려오면 보이는 로고 카페 내부 전경 앉을 수 있는 자리는 모두 곡선 아일랜드 테이블 하나로 이어져있다 층고도 굉장히 낮아 어둑한 분위기와 더해 매우 차분하고 조용한 분위기 그치만 공간 자체는 넓어서 답답하진 않다 오히려 여백의 미 낭낭한 느낌이라 현악기 안에 있는듯한 느낌도 들고? 층고 낮은건 카페 이름을 봤을때 의도하신거겠지?! 메뉴 준비하는 주방은 마치 가정집 부엌처럼 한켠에 등지고 준비하는 구조 분위기 어둑어둑해서 좋지만 대신 메뉴판이 잘 안보인다는 단점이! 우리가 시킨 메뉴는: 핸드드립 에티오피아 예가체프 hot (7.0) 핸드드립 슬라브 블렌드 (5.5) 카페오레 (6.0) 도미노시스템 (16.0) 망원동 카페 슬라브 재생 0 좋아요 0 00:00 00:00  접기/펴기 망원동 카페 슬라브 커피는 사진 없음 ㅠㅠ 머그잔 밑에 티코스터 컵받침이 타일이라 챙챙 맑은 소리가 난다 이어서 나온 도미노시스템 디저트 앗 도미노 시스템도 서빙 직후 사진이 없네 ㅠ.ㅠ 디저트 포크 나이프와 함께 피규어를 주신다 먹기 전 세워서 노는 소소한 놀이용 먹는거 아님 주의 쁘이하는듯한 앉은뱅이 피규어 뭔가 영화 포스터 같지 않나욯ㅎㅎ? 본격 철거 시작 뿌샤뿌샤 접시에 흩어져있는 크럼블과 애플컴포트가 더 철거 공사 현장 느낌을 자아내는듯하다 밀페유 파이에 애플콤포트 크럼블 마스카포네 치즈 큐브 조금씩 올려 먹음댄다 솔직히 맛만으로는 또잉 이 가격에? 싶은데 머 사장님의 건축적인 예술 경험값(?)인가 싶다 여기는 음식세가 아니라 자릿세 느낌 다녀오니 문화생활 하고 온 기부니가 들어따 망원에서 독특한 카페 찾는다면 추천! 혼카페 또는 도란도란 조용히 이야기 나누기 좋은곳 50m © NAVER Corp. 슬라브 서울특별시 마포구 포은로 87 지하 1층 #망원동 #망리단길 #망원동카페 #슬라브
망원동 카페 겸 바 슬라브 SLAB 딥한 분위기,가보고 싶었던 #망원동슬라브 카페로도 운영되고 바로도 운영되는 망원동의 숨은 카페앤바! 아주 보물같은 곳이랍니다 이렇게 지하로 내려가면 #망원동카페 #슬라브 를 만나볼 수 있다. 요즘 뭐 우드톤의 어둑한 분위기의 공간이 많다고 하지만 헉.. 지하에 이렇게 아름다운 공간이 숨어있다니 싶었던 #슬라브 우선 메인으로 크게 차지한 우아한 곡선 모양의 큰 테이블이 저 조그마한 입구로 어떻게 들어왔나 싶은 의문을 불러일으킨다 셰어테이블이지만 자리도 여유있고 생각보다 공간도 커서 반해버렸다는 메뉴판 커피와 디저트 그리고 술이 있는 망원동 카페 슬라브 사실 2차커피까지 마시려고 온거긴 한데.. 이런 분위기에서 술을 안마시면 섭하죠? 럼코크와 진토닉 주문 지금 생각해보면 디저트도 시킬걸 그랬어.. 감각적인 공간 망원동에 이런 카페앤바가 있다니 파티있을때 대관해도 좋을것 같다. 다양한 액자들이 쫙 길대로 진열되어 있는 모습도 인상적 조명과 오브제도 독특하고 무드있었다. 이런 조명들 다 어떻게 수집하신걸까? 사장님은 아마 인테리어쪽에 연고가 있으신 분이 아닐까 새삼스럽게 추측해본다. 굿즈와 오브제도 판매하고 있고 비밀스럽고 분위기에 한껏 취하게 되는 망원동 카페 슬라브 취향저격 제대로당했어.. 여기 썸남이랑 오면 분위기 제대로일듯 합니다 망원동 카페 겸 바 슬라브 재생 1 좋아요 0  망원동 카페 겸 바 슬라브 디제잉 부스도 있다 저녁엔 디제잉도 하나보다 하면 또 색다를것 같은! 테이블에 조명들과 건축목업들이 눈에 띈다. BGM도 좋았고~ 무엇보다 은은한 조명에 이미 마음이 편안해지는 럼코크 럼 콜라 라임이 들어가는 #럼코크 칵테일 조명덕에 칵테일 사진도 예술로 나오죠..? 잔술 마시며 옆에서 도란도란 대화 나누기 좋았다 맘같아선 다음번엔 바틀 있으면 주문하고파.. 진토닉 진토닉은 진리 몽환적인 분위기에 덩달아 취기 오르고 즐거웠던 망원 슬라브 사장님이신지 알바이신지 기본적인 친절이 장착되어 있어보이시지는 않았지만 공간 그 자체로 아주 매력있는 망원동 숨은카페 #슬라브 50m © NAVER Corp. 슬라브 서울특별시 마포구 포은로 87 지하 1층
