title,content
망원동 디저트까페 망리단길 까페 소설원 망원,"소설원 망원 친구와 인근에서 만나 식사 후 분위기 있는 디저트 까페를 찾다 가게된 소설원 망원 주소: 서울 마포구 월드컵로 13길 22-3 망원역 2번 출구서 153m 영업: 11:00~21:00(라스트오더 20:30) 연락처: 0507.1484.5565 제로페이,포장 50m © NAVER Corp. 소설원 망원 서울특별시 마포구 월드컵로13길 22-3 입구 디저트들이 분주히 만들어지고 있더라구요~ 메뉴 다양한 음료 음료가격도 착한편이라 좋더라는- 둘이 오면 세트구성(디저트와 음료구성)도 괜찮겠어요 모든메뉴 포장&배달 가능~ (포장시 1000원 추가) 휘낭시에 푸딩 크림 카스텔라와 술빵 카스텔라 이곳만의 특색있는 디저트들이 눈길을 사로잡더라는~ 1층서 주문하고 위층으로 올라가 자리를 잡는 시스템이예요 휘낭시에 소설 반상 / 15000원 옥수수 크림 카스텔라 / 11900원 휘낭시에 5ea / 12900원 주문하고 올라가 보았어요~~ 2층 곳곳에 좌식자리도 있어요 쿠션까지 있어 너무 편해보이죠 3층 주택을 개조한 곳이라 옛날 주택의 모습이 고스란히 남아있어요 3층에 여자화장실이 있어 와봤는데 루프탑까지 구경하기ㅎㅎ 옛 주택의 모습을 살려 공간이 분리되어 있다는 점이 좋았어요 테이블 간 간격도 넓어 조용하게 이야기 나누기에 좋아요 전체적으로 동양적이고 일본느낌의 차분한 분위기- 루프탑 야외 분위기도 좋고 날좋은 봄,가을에 이용하기 좋을듯 해요 진동벨이 울리면 1층에서 픽업해오기~ 휘낭시에 5ea 휘낭시에는 스시처럼 도마에 올려 나오는데 아이디어가 너무 귀엽 ㅎㅎ 간장 종지까지 메이플 시럽과 녹차크림으로 구색을 맞춘~ 골고루 맛보기 좋죠ㅎ 순우유 푸딩은 옆에 원유가 같이 나오니 살살 부어준다음 떠먹기~ 식감이 넘 부드러우면서 탱글탱글~~ 찐우유의 풍미! 맛나요 휘낭시에 소설 반상 우유푸딩 + 솔트바닐라 &들깨 휘낭시에 +음료 2잔 (아아 2개로 주문) 옥수수 크림 카스텔라 막걸리로 직접 24시간 숙성시켜 만든 쌀가루 카스텔라 모두 아는 기본 술빵맛에 옥수수의 고소한 크림과 알갱이가 더해져 달달~고소 식감은 폭신폭신 부드러운~ 창밖으로는 대나무의 푸릇함 조명이 분위기를 감성적으로 만들어주더라구요 사진찍기도 좋았네요 휘낭시에는 겉바속쫀^^ 쫀득하니 맛있어요 솔트바닐라는 단짠의 매력 들깨는 찐고소함이 매력 전체적으로 달달하니 아아와 찰떡이였네요 망원동에서 특색있는 분위기의 디저트 까페 아늑하고 차분한 곳을 찾으신다면 소설원 망원 추천♡ 친구와의 만남 데이트 장소로도 손색 없어요~ #망원동디저트까페 #망원역까페 #망원까페 #망리단길까페 #소설원망원"
[망원동 카페] 교토에 온 듯 힐링카페 '소설원 망원',"망원시장 가는 길에 자리한 '소설원 망원'입니다. 입구부터 참 독특한 일본식 찻집 같은 힐링카페입니다. 구옥 빌라 하나를 통으로 카페로 개조한 곳인데, 짙은 오크색 가구들이 고딕한 분위기를 풍깁니다. 군데군데 있는 둥그런 창들이 별 것 아닌 듯 싶지만 교토 느낌도 나고 상당히 멋스럽습니다. 층별로 구석구석 신경 쓴 흔적이 역력한데 편안하면서도 정성스럽습니다. 1층은 카운터, 2~3층은 테이블과 다다미가 어우러져 있습니다. 다다미 테이블마다 누워있는 손님들이 가득합니다. 다다미 자리잡기는 하늘의 별따기네요^^ 4층은 루프탑입니다. 화이트샌드 비치같은 느낌이죠? 날씨가 갑자기 더워져서 텅 비어 있었지만 봄가을에는 좋을 것 같습니다. 디저트 샘플입니다. 디저트 메뉴를 직접 눈으로 보고 고를 수 있게 카운터에 진열해 놓은 게 좋았습니다. 덕분에 고민없이 손쉽게 골랐네요. 플레이팅이 쏙 맘에 듭니다. 과하지 않게 단정합니다. 술빵 카스테라입니다. (9,400원) 모든 손님들이 하나씩 먹고 있다고 해도 과언이 아닌 간판 디저트입니다. 수제 단팥, 버터, 생크림이 함께 나오는데, 생크림은 느끼하지 않고 단팥은 달지 않아 전반전으로 속 편안한 디저트입니다. 흑당 밀크티입니다. (6,300원) 흑설탕 맛이 강하게 혀를 때립니다. 홍차 맛과 흑당 맛이 조화롭게 잘 살아있고 당 충전도 완벽하게 됩니다."
"[망원동 소설원] 카스텔라, 푸딩, 휘낭시에 맛집 망원시장 분위기 좋은 주택 개조 카페","오늘도 행복하세요! 망원동 망원시장 근처 카페 분위기 좋은 소설원 망원 이미 너무 유명한 망원 소설원 힐링하러 출발합니다!! 50m © NAVER Corp. 소설원 망원 서울특별시 마포구 월드컵로13길 22-3 소설원 영업시간 매일 11:00 ~ 21:00 라스트 오더 20:30 다다미 방이 있는 편한 카페 일본풍의 분위기 좋은 카페! 자세한 문의는 0507-1484-5565 망원역 2번 출구로 나와서 2분 안쪽으로 있는 망원동 카페 소설원 티 안 나기 힘든 외관을 보여줍니다. 아무리 봐도 티가 안날 수 없는 도심 속 대나무 숲이 있는 곳! 들어가는 입구에도 대나무가 한가득! 1층은 주문을 위한 공간입니다. 매장 입구에서부터 숲길을 걷는 느낌. 옆에는 졸졸 흐르는 물소리가 백색소음처럼 마음을 편하게 해줍니다. 1층뿐만 아니라 다른 층 남은 공간에도 알차게 들어차있는 대나무 덕분에 진짜 분위기가 다른 세상인듯!!ㅋㅋ 큰 유리창 덕분에 채광도 좋고 밖에서 들여다보기에도 좋아요. 일하는 입장에서는 너무 쳐다보면 부담스럽기도 하지만? 보는 재미도 있는 건 맞죠 ㅋㅋ 카스텔라와 휘낭시에, 푸딩 3가지 디저트가 준비되어 있고, 특히 원산지 표기에 들어가는 재료들을 세세하게 전부 표기해두셨네요. ( 맥주도 있네요!?! ) 예쁘게 진열된 메뉴들은 모형이 아니라고 하니까 만지지 말고 눈으로만 구경하기 ㅋㅋ 정말 하나같이 너무 맛있어 보였어요. 카스텔라가 너무 맛있어 보이네요.ㅠ 이것도 먹을 걸 그랬네.... 옥수수 크림 카스텔라 너무 궁금쓰! 이제 계단으로 올라가게 되면 층별 안내도가 있어요. 2층 / 다다미 석, 테이블, 남자 화장실 3층 / 테이블, 여자 화장실 4층 / 다다미 석, 루프탑 자리가 꽤 많은 망원 카페 소설원입니다. 먼저 루프탑!!! 하얀 자갈로 덮여있는 분위기 날 좋을 때 분위기 엄청 좋을 것 같아요. 그리고 앉는 건 어렵겠지만 눈이 많이 온 날은 진짜...ㅋㅋㅋ 정종 한잔하고 싶은 분위기일 듯?? 루프탑 바로 옆에는 다다미방이 있는데, 빈백 소파도 같이 있어서 낮잠 한 타임 가지고 싶은 기분ㅋㅋㅋ 한 명 커피 마시면서 핸드폰하고 놀면, 한 명 누워서 자고ㅋㅋㅋ 좋겠네요. 이렇게 다다미 방이 있습니다. 다다미 방은 2층과 4층 두 군데!! 3층은 영상으로 보시다시피 테이블 좌석들만 있었어요! 망원동 분위기 카페 소설원 망원 재생 0 좋아요 0 00:00 00:19  접기/펴기 망원동 분위기 카페 소설원 망원 주택을 통으로 개조해서 카페로 만든 카페라서 그런지 편안한 분위기예요. 이렇게도 인테리어 할 수 있구나~ 하는 감탄이 좀 추가되었어요 ㅋㅋ 전반적으로 따뜻한 조명과 분위기가 데이트하기에도 좋지만? 개인적으로는 꿀같은 낮잠 분위기? 라고 해야 되나??ㅋㅋㅋ 특히, 다다미 방!!!ㅋㅋㅋㅋ 휘낭시에 5개 세트 - 12,900원 녹차 - 3,900원 녹차에는 로즈마리 잎도 퐁당~ 5가지 맛의 휘낭시에가 이미 플레이팅부터 끝나버렸...ㅋㅋ 왼쪽부터 황 치즈 휘낭시에 솔트 바닐라 휘낭시에 말차 휘낭시에 단팥 버터 휘낭시에 얼그레이 무화과 휘낭시에 개당 2,900원이고 5개 세트는 총 1,600원 저렴하네요! 밝은 햇살이 쏟아져 들어오는 시간에 다다미 방에서 즐기는 티타임? 쉬어가기 너무 좋은 카페입니다. 젓가락 받침이 땅콩입니다.ㅋㅋㅋㅋ 귀여워 죽겠네..ㅋㅋㅋㅋㅋ 망원동 카페 소설원 휘낭시에 재생 2 좋아요 0 00:00 00:25  접기/펴기 망원동 카페 소설원 휘낭시에 뭔가 초밥 느낌이야 ㅋㅋㅋ 일식집을 연상케 하는 플레이팅에 아~주 귀여운 신의 한수 ㅋㅋㅋ 시럽과 말차 크림을 보이는 것 같이 간장에 와사비 모양으로 주네요. 커엽...ㅋㅋㅋㅋ 햇빛도 좋아서 몇 장 더 찍어봅니다. 사실 사람이 없었기 때문에 부담 없이 셔터를 땡겨댑니다.ㅋㅋㅋㅋ 개인적인 입맛으로 순위를 주자면 주자면....흠..... 얼그레이 무화과 1등! 그리고 다른 친구들 2등. 각자의 맛을 잘 살려서 맛있었어요! 혹시라도 휘낭시에 간이 안 맞는다 싶으면, 옆에 준비해 주신 간장과 와사비로 간을 맞춰서 드시면 될 것 같아요!ㅋㅋㅋ 망원동 예쁜 카페 소설원 망원 맛있는 디저트도 높은 점수를 주지만, 편안한 분위기가 고득점!! 어느 카페나 주말이고 피크에는 사람이 많은 건 당연하겠지만? 정말 빈백에 파묻혀서 20분 정도 자고 싶다는 충동이 들 정도로 너무 편안한 분위기였습니다. 빨리 남자친구 손잡고 끌고 가세요. 사진 찍기 좋은 곳이 너무 많아요! 여자친구 데리고 가보세요. 달달한 디저트 입에 넣어주면 금방 행복해질 거예요 ㅋㅋㅋ 난 원래 혼자 자주 다녀요 이상 맛있는 분위기 소설원 망원 포스팅 마무리!!ㅋㅋㅋ"
[서울 마포구] 망원동 카페/일본 가옥 감성 카페 '소설원 망원',"얼마 전 서울 놀러갔다가 홍제동에 있는 소설원 카페의 2호점인 ""소설원 망원""을 방문하였어요~~~~ 소설원 망원 매일 11:00~21:00/L.O 20:30 T.0507-1484-5565 50m © NAVER Corp. 소설원 망원 서울특별시 마포구 월드컵로13길 22-3 망원역 2번출구에서 우측골목으로 들어온 뒤 월드공인중개사 골목으로 들어오면 돼요 :) 주차장은 따로 없어요-! 입구부터 일본갬성 느낌💗 주택을 개조한 카페로 외관부터 눈에 띄더라구요! 점심먹고 1시반쯤 방문했는데 운좋게 좌식 자리를 맡게되었어욬ㅋㅋ 작은 눈덮인 정원이라는 뜻의 소설원 카페 망원동에 대형카페가 잘 없는 것 같던데 대형카페에다가 좌식도 있어 인기가 많은 것 같았어요! 자리에 짐을 놔두고 1층에 주문하러 ㄱㄱ 디저트 메뉴 휘낭시에, 카스테라, 푸딩 등 다양한 디저트 메뉴가 많아 뭘 시켜야 될지 모르겠더라구요... 다 맛있어 보여!! 음료메뉴는 못찍었지만 커피, 차, 반상 세트메뉴까지 있어 다양하게 맛볼 수 있습니다>_< 아이스 아메리카노 4,100 아이스 바닐라 라떼 5,500 옥수수 크림 카스테라 11,900 어떤 분 블로그 후기에 옥수수 크림 카스테라가 맛있다고 하여 옥수수 카스테라를 주문!! 주문 후 진동벨을 받아갑니다~~~~~ 소설원 카페는 1층은 주문하는 카운터가 있는 곳이고, 2~4층은 좌석과 루프탑이 있어요! 저희는 2층 다다미방 좌석에 자리를 잡았어요ʕتʔ 2층 창가자리 소설원 망원 2층 개인적으로 이 자리가 제일 이쁜 것 같아요♡ 대나무 뷰만 보면 정말 일본에 와있는 듯한 느낌을 주는 자리에요ㅋㅋ 옆 공간에는 다다미방이 있었는데 온돌이라 따듯해서 좋았어요 ! (사람들이 앉아계셔서 사진을 찍지는못했..ㅠ_ㅠ) 3층으로 올라가봅니다 소설원 망원 3층 2층보다 조금 더 차분한 분위기였던 3층 공간 대형카페이지만 공간이 분리되어있어 더 좋은 듯 해요! 층마다 같은듯하지만 다른 느낌의 인테리어 구성이라 어떤 자리에 앉으셔도 좋으실 것 같아요 ㅎ_ㅎ 4층에는 다다미방과 루프탑이 함께 있습니당~~~~ 루프탑 날씨가 따듯하면 인기가 많을 듯한 루프탑! 자연과 하나될 수 있을 것 같은 루프탑 전경입니다👍 소설원 망원 루프탑 재생 0 좋아요 0  접기/펴기 소설원 망원 루프탑 전체적인 분위기 감상해보실게여~~~ 꺄ㅑㅑㅑ 푸짐한 한상입니다! 커다란 잎으로 쌓여있던 옥수수 카스테라 카스테라가 담겨있는 쟁반도 일본느낌뿜뿜 ㅎㅎ 카스테라 위에 올려진 옥수수가 포인트 옥수수 크림이 한가득 들어있고, 옥수수 알맹이도 들어있어 씹히는 맛이 났던 옥수수 크림 카스테라 빵도 촉촉하고 부드럽더라구요~~~ 온돌 좌식에서 먹어서 그런지 등따숩고 편하더라구요 ㅎㅎ 다다미에 있는 다른분들보니 누워계시는 분들도 계셨던.. 입구부터 매장 내부까지 포토존이 가득한 소설원 망원! 다음에는 다른 디저트도 먹어보고 싶네요~~~~"
"망원동 프롬하노이, 어글리 베이커리, 소설원 망원","프롬하노이 우삼겹 쌀국수, 반쎄오 내가 망원동을 가는 이유....... is #프롬하노이 프롬하노이는 쌀국수도 쌀국수지만 반쎄오가 진짜 존맛이다 지인들 데려가면 다들 쌀국수 한번 먹어보고 음~~ 맛있네 #반쎄오 먹어보고 😮😮😮😮😮😮 존맛이야!! 뿌듯쀼듯 다른 쌀국수집 반쎄오도 먹어봤지만 여기가 젤 맛난다 요러케 밥을 먹었으믄 다음 코스는 #포토이즘 에서 사진 한번 찍어주고!!! 가는 길에 #어글리베이커리 들러서 어글리 베이커리 빵이 짱 많아서 고르기가 어려워뜸... 나 들어갈 땐 앞에 한 팀밖에 없었는데 빵 고르고 계산하려고 보니까 뒤에 사람이 바글바글🙄🙄 인증샷✌️ 요러케 세 개만 삼 크림이 가득가득!!! 맛이따 맛이따~~~~ 고구마, 옥수수, 쑥.. 난 참 토속적인 것을 좋아하는 사람이야 깔깔 난 원래 쑥돌이인데..... 쑥 좋아하는 사람들.... 꼭 사세요... 쥰맛탱임... 망원시장 좀 구경하고오오 소설원 망원 #소설원 망원 초밥 가튼 휘낭시에...... 요렇게 좌식 자리도 있다 우리는 여기를 앉았찌 설정샷이고요...... 아 배경은 예뿐디 모델이 문제야 사람이 많이 없어서 요기조기 자리 찍어봄 휘낭시에 맛은.. ⭐️⭐️⭐️⭐️⭐️ 별 다섯개입니다 겉바속촉넉힘,....(휘알못임) 요러케 오늘 나의 망원동 구경은 끝 #망원동 #쌀국수 #쌀국수맛집 #망원동카페 #망원동맛집 #망원동프롬하노이 #망원동어글리베이커리 #망원동소설원 #프롬하노이 #어글리베이커리 #소설원"
[망원동 신상 카페] 소설원망원,"#마포구 #망원동 #신상 #카페 #자갈길 #대나무 #다다미방 #술빵 #카스테라 #휘낭시에 #푸딩 #동양 #분위기 #대학생 #커플 #데이트 소설원망원 형거니가 가보자고 한 망원동😎 (형거니가 어디 갈지 다 찾아보고 가자고한 게 너무 기특했당~💛) 그래서 형거니가 정한 카페는 망원동 신상 카페 소설원망원이당!! 홍제동에 있는 소설원이 1호점이고 홍제점처럼 자갈길과 대나무, 다다미 방 인테리어로 되어 아늑한 동양풍의 분위기로 구성되었다고 한다~ 외관 카운터는 외관 오른쪽으로 가면 있당 들어가는 입구~ 매장은 1층 카운터와 2~4층으로 이루어져 있다 2층과 3층은 다다미방(좌식)과 입식으로 앉을수 있는 곳이 마련되어 있고 4층은 다다미방과 테라스?가 있당 옥상 이곳에 시그니처 메뉴는 술빵 카스테라와 휘낭시에, 푸딩 등이다 우리가 먹은 것은 술빵 카스테라와 블랙베리에이드 그리고 아아!! 술빵 카스테라는 주문후 즉시 바로 쪄주시는거 같다. 편안한 분위기의 카페를 원한다면~ 이색적인 느낌의 카페를 원한다면~ 가보는 것을 추천한당💙 50m © NAVER Corp. 소설원 망원 서울특별시 마포구 월드컵로13길 22-3"
[망원동] 카페투어☕ ️이이알티- 망티 본점- 베리빈- 콘웰- 소설원 망원,"2023.1.24.(화) 이이알티 매일 12:00-22:00 50m © NAVER Corp. 이이알티 망원 서울특별시 마포구 포은로 105-1 1층, 2층 입구부터 인스타 갬성.. 여기가 핫플인가🤎 나무로 만들어진 카페라서ㅋㅋㅋ 뭔가 갬성 돋는다🤎 1층엔 사람이 꽉 차있어서 2층으로 왔는데.. 2층은 무슨 공사장 느낌😂😂 정리 된 느낌은 없고 시멘트 바닥에서 먹는 느낌이었다ㅋㅋㅋ 요즘 #유튜브 뜨는 영상 중에서 2033년도 인스타 갬성카페는 공사장 분위기라던데ㅋㅋㅋㅋㅋ 딱 그생각이 나면서 웃겼다🤣 이건 모지.. 드디어 디저트 박스가 나왔다!! 근데 나무 상자라서.. 물로 설거지 하진 않을테고🤔 위생에 의문이 들었다 쨋든 디저트만 맛있으면 됐지!하고 먹었는데 생각보다 실망스러웠다 ㅠㅠ 글케 맛있지는 않았다 별 2개⭐️⭐️ 망원동 티라미수 매일 11:00-21:00 50m © NAVER Corp. 망원동티라미수 본점 서울특별시 마포구 포은로 87 원래 망원동 티라미수에서 티라미수 먹을 예정은 없었는데 골목을 걷다가 여기가 그 유명한 망티!!구나👏👏 이럼서 홀린듯 들어가 샀다😂 녹차맛 티라미수 먹어보고 싶었는데 매진됐다고 한다ㅠㅠ 내가 산 맛은 ✔️오리지널 ✔️옥수수맛 ✔️딸기맛 세개 다 맛있음👍🏻👍🏻 티라미수 산 기념으로 찰칵📸 콘웰 매일 12:00-22:00 50m © NAVER Corp. 콘웰 서울특별시 마포구 월드컵로15길 40 2층 콘웰커피 여기도 내가 꼭 와보고 싶었던 카페 중 하나!! 바로 이 크로플 때문에!! 딸기크림 크로플이 넘 먹고싶어서 왔다🎂🍰 사진이 넘 이쁨ㅠㅠ 그림 같다🖼️🖼️ 이뻐서 먹기 아깝다… 딸기랑 바닐라아이스크림의 조화는 대박적🍓🍓 크로플도 바삭하고 너무 맛있었다ㅠㅠ 감동의 맛😝 순삭!! 맛있어서 마셔버렸네🥰 베리빈 매일 10:00-22:00 50m © NAVER Corp. 베리빈 서울특별시 마포구 망원로3길 7 베리빈베이커리 여기는 외관이 맘에 들었다ㅎㅎ 골목 안에 성 같은 카페가 있다니🏰🏰 베이커리 답게 맛있는 빵이 가득🥰🥰 여기도 추천👍🏻 소설원 망원 매일 11:00-21:00 50m © NAVER Corp. 소설원 망원 서울특별시 마포구 월드컵로13길 22-3 원래 주인공은 맨 마지막이라구요~ 오늘 갔던 망원동 카페 중에서 가장 추천해주고 싶은 카페다👏👏 입구가 완전 내스탈!!! 일본의 조용한 찻집 느낌이다!!! 메뉴판이랑 모형도 넘나 이쁜거 아니냐고요오~~~ 계단 올라가는 길인데 넘모 이뻐서 한컷🥰 착석!! 뚜껑 오픈😄😄 푸딩 퀄리티 모야.. 노랑색 꽃잎 넘 이쁘다👍🏻 대박적💛💛 잘먹겠습니다😃 와앙!!!🤍🤍🤍 사실 카페투어를 너무 많이해서 배불러서 푸딩만 시켰다🤣🤣 다음에는 여기서 커피도 마셔봐야겠다 #망원동#망원역카페#망원동티라미수#망티#망원동카페#카페추천#소설원망원#이이알티#베리빈#콘웰#콘웰망원#내돈내산"
