title,content
성수동 케이크 버니타운,"토끼 덕후에게 천국인 성수동 케이크 맛집 버니타운 성수동 케이크 맛집 버니타운을 찾아간 건 딸기 생크림 케이크가 땡겨서였다. 디저트 중에 가장 맘에드는 딸기 생크림 케이크! 성수동 케이크 가게들을 뒤적거리다가 귀여운 토끼데코 케이크도 보이던 버니타운을 가게 됐다. 이것도 벌써 다녀온지 1년은 된 듯하다. 동화 속 마을같은 버니타운 외관부터 귀여워서 벽을 부숴버리고 싶은 성수동 케이크 맛집 버니타운 성수동 케이크 맛집 버니타운은 외관부터 들어가는 입구까지 예쁜 것과 토끼 덕후인 나를 매우 설레게 만들기에 충분했다. 너무 아기자기한 것이 내 스타일이라 들어가는 내내 감탄사 연발한 듯하다. 들어서니 아늑한 어느 가정집에 초대받은 느낌이 들었다. 동화 속 마을에 온 것 같은 느낌도 들었다. 겨울이라 크리스마스 장식들도 엄청 해놨는데 진짜 귀여운 포인트들이 너무나도 많았던 버니타운 엔틱 소품들도 많고 완전 내 스타일의 가게였다. 귀여운 양초들도 판매중이다. 작은 토끼마을 성수동 케이크 맛집 버니타운이 동화 속 마을같은 느낌이 든 건 케이크 진열장 때문이었던 것 같다. 케이크 진열장에는 다양한 종류의 케이크가 있었고, 토끼 데코가 많았다. 진짜 진짜 예뻐서 먹기 아까울 비주얼이다. 진열장을 들여다보고 있으면 작은 토끼 마을에 온 것만 같다. 행복해진다. 음료 메뉴도 다양했는데 하도 다녀온지 꽤 돼서 하단의 그 외 기타 정보 링크를 참고하는 것이 나을 것 같다. 주문한 음식딸기 생크림 케이크 성수동 케이크 맛집 버니타운에서 나는 먹고 싶었던 딸기 생크림 케이크를 포장해 왔다. 포장도 되게 귀엽다. 비닐에 직접 그림을 그려두셨던 것 같다. 크리스마스에 맞춰 데코도 이렇게 예쁘게 되어있다. 버니타운은 조각케익 종류도 굉장히 많고, 디자인도 다 예뻐서 정말 좋다. 고르는 즐거움과 눈의 즐거움까지 선사하는 버니타운...!! 버니타운에서 만드는 케이크는 쌀케이크인 것으로 알고 있다. 맛은 보통이었다. 성수동 케이크 버니타운 재생 0 좋아요 0 00:00 00:16  성수동 케이크 버니타운 와아아아아아 엄청 맛있다 이건 아니었는데 아무튼 보는 내내 행복해지는 곳이어서 대만족이었다. 버니타운 정보 운영시간 월, 화 정기휴무 수~일 12:00-21:00 라스트오더 20:30 위치 서울 성동구 서울숲2길 15-12 1.5층 50m © NAVER Corp. 버니타운 서울특별시 성동구 서울숲2길 15-12 1.5층 연락처 0507-1377-5731 기타 정보 버니타운 : 네이버 방문자리뷰 440 · 블로그리뷰 283 naver.me"
성수동 서울숲 카페 버니타운,"아룡하세요잇~! 수로뽕입니당 이번엔 지난 토요일에 방문했던 성수동 카페를 소개해볼게여 당연히 내돈내산입니데이 렛츠고~잇! (새로운 컨셉이에요 초보블로거는 뭐든 도전하죠 거북해도 잠시 참으세용) 위치는 이곳이구요! 서울숲 근처입니다 ㅎㅎ 웨이팅은 없었어요! 50m © NAVER Corp. 버니타운 서울특별시 성동구 서울숲2길 15-12 1.5층 입구부터 좀 심상치않죠? 굉장히 아기자기하고 이쁩니다 이 문으로 입장하세요 하하 저라는 사람을 모자이크 해볼게요ㅎ 약간 이상한 나라의 앨리스 컨셉이에여 그래서 버니타운 인가봐요~ 들어가자마자 보이는 좌석입니다 뷰는 그냥 주택뷰이지만,,, 너무 이쁘지않나여 저 조명도,,,,🥹 글구 여기는 학습금지 카페예요!!! 양해부탁드립니다~🙏 이래야 할 것 같은 ㅎ (근데 사실..카페오는분들도 다 놀러오시는 분들이라 이런 곳에서 공부를 한다는게,, 불가능할 것 같아요!) 이렇게 좌석이 있습니다! 햇빛이 많이 들어와서 자리를 옮겼어요 !! 사진에는 없지만 이 옆에는 4인석도 있어요!! 여기는 카운터 앞이구요 대부분 2인석이었습니당 좌석 간 간격은 좁은편이에요! 가게 인테리어 하나하나가 너무 정성스럽고 이쁘지않나여????? ㅠㅠ사장님이 테이블 치울때 잠깐 봤는데.. 꽃도 엄청 섬세하게 위치를 손보시더라구요 좀 꼼꼼하신 성격인건지.. 가게를 둘러보면 그게 느껴져요 여기는 사람들 다 나갔을 때 찍었어요 엄청 이쁘져 창가쪽에 자리가 2개인데 2인 좌식좌석이랑 3인석이 있어요 개인적으루 저 2인석 너무 아이디어 좋고 이쁜것 같아요 너무 이뻐서 여러장 ㅎ 친구한테 찍으라고 협박한 샷.. 여기가 카운터임당 오우 너무 .. 인테리어만 주구장창 보여드린 것 같네여 이제 슬슬 주문하겠습니다 카운터,,, 이쁘다;;; 메뉴입니다 1인 1음료 라네요!! 메뉴판이 있는데 영어 밑에 한글로 써있어서 좋았어요 ㅎㅎ 가격대는 좀 있었어요! 커피가 아닌 음료가 많더라구요 하지만 전 아아를 시켰습미다 메뉴 확대샷… 귀여운 인형 ㅎ 생일초 종류도 엄청나요 진짜 긔여운애들 투성이…. 곰돌초까지 완벽 이건 그냥 보너스,, 드디어 케이크입니다!!! 복숭아 9.8 샤인머스켓 요거트 9.5 티라미수 8.9 바스크 치즈(블루베리) 7.5 오레오초코 8.9 입니다! 가격은 저희는 복숭아 케이크를 주문했어요 ㅎ 위에 사진엔 없어요! 없어서 아쉬워하면서 그냥 주문하려는데 저 케이크를 마침 새로 꺼내주셔서 다행히 먹을 수 있었어요 ㅎㅎ 옆에도 작은 냉장고에 케이크가 또 있어요! 체리쥬빌레 말차 쇼콜라 9.2 황치즈 초코 7.5 제가 시킨게 요거!!!!!! 요건 그냥 귀여운 인테리어 ㅎㅎ 화장실도 내부에 있어요~~ 깨끗해요! ㅎㅎ 복숭아 케이크예요 영롱한 자태 구경하구 가세용 진짜 맛있어요… 은은한 복숭아향 폭신한 시트 담백한 생크림 달달상큼 복숭아.. 너무 달지않아서 더 맛난 그런맛이었어요 아아 두잔이랑,, 저건 기억이 안나요 죄송함다 엠지샷 ,,,입니당 성수 놀러갈일 있으면 갈 것 같긴한데 좀 비싸긴 했어요~~ 이상 내돈내산 리뷰였슴당~~"
오랜만에 전시회 갔다!! 아트 오브 뱅크시 전시회 관람/성수동 제제/성수동 버니타운,"오랜만에 전시회가 가고 싶어서 찾은 곳! 이왕 가는 거 유명한 사람 전시회 가야징 <HELLO 2022년> 머시기 해가지고 이벤트로 티켓을 할인해서 샀당 뱅크시가 이름이 알려진 예술가다 보니 사람이 많을 것을 대비해 아침 일찍 출발했다. 더 서울라이티움 50m © NAVER Corp. 더서울라이티움 서울특별시 성동구 서울숲2길 32-14 갤러리아포레 지2층 전시회 찾기 힘드넹... 아파트 단지 근처에 있어서 길을 헤맸다 ㅠ 갤러리아포레라는 상가 건물의 지하 2층에 위치해있다. 오픈 시간인 11시 가까이에 도착했는데도 안에는 사람들이 꽤 있었다. 우리가 일등일 줄 알았는데..!! 뱅크시가 동료 아티스트들과 협력해서 만든 테마공원인 디즈멀랜드에 관한 영상이 비친다 디즈니랜드의 분위기와는 반대로 우울한 테마파크 버전이다. 디즈니랜드와 달러가 불에 타고 있는 중ㅋㅋㅋㅋ 이 양반은 자본주의를 깨부수는 걸 좋아하네 ㅋㅋ 뱅크시가 영국 출생이라서 엘리자베스 여왕을 모티브로 한 작품도 많았다. 힙하고 멋지구만! 품격 있고 고급스러운 여왕의 얼굴에 롹앤롤! 할거 같은 페이스페인팅이 그려져 있는 게 재밌다 ㅋㅋㅋ 이건 성형을 풍자하는 듯?? 이건 유명한 그림이라서 찍어봤다. 유명하면 찍어봐야쟤~ 기존에 있던 명화에 우주선을 그려 넣은 듯하다. 우주선에서 쏜 빔에 놀라서 달아나는 사람들 너무 사실적으로 놀란 모습이어서 넘 웃겨 ㅋㅋㅋㅋ 얼마나 웃겼으면 제가 확대해서 사진까지 찍었겠습니까ㅋㅋㅋㅋㅋㅋ 이건 설명 봐도 모르겠음 설명해 주실 분 구함 최루탄으로 시위하는 모습을 고전적인 조각상으로 표현했다. 뱅크시 분께서는 고전적인 작품에 현대적인 느낌을 넣는 걸 좋아하는 듯하다. 그래비티 작품을 실제로 가져올 수 없어서 가품이 많다고 들었다. 영국 왕실 근위병들을 우스꽝스럽게 그린 작품 저 오줌 줄기는 가짜인 건 알겠는데.. 넘 진짜 같아서 비위 상한다 ㅋㅋㅋㅋㅋ 이건 넘 슬픈 그림이다... 자신의 직업 행동에 따라 그래피티를 덧칠해서 지워버릴 것인가 사회에 억압받는 동료들을 위해 지우지 말 것인가 고민하는 모습이다. 이런 거 내 눈물 버튼... 크흡.... 전시회에 출구 근처에는 기프트샵도 있어서 여러 굿즈를 살 수 있었다. 하지만 내 감성과는 맞지 않아서 패쓰! 기프트샵 안에는 조그맣게 체험공간도 있었다. 나 ISFJ.. 소심해서 이런 거 체험 못 함 ㅋㅋㅋㅋㅋㅋㅋㅋㅋㅋㅋㅋㅋ 뱅크시가 사회문제에 관심이 많고 그 문제를 풍자하는 작품들도 많다는 걸 이번 전시회를 통해 알게 되었다. 전쟁, 환경, 사회구조 등 다양한 분야에 관심을 갖는 게 쉽지 않은데 참 대단한 듯하다. 전시회는 재미있었지만 작품이 가품 티가 많이 나고 비슷한 작품이 많은 점이 아쉬웠다ㅠ 다음번엔 다양한 작품으로 만나보고 싶다!! 제제 50m © NAVER Corp. 제제 서울특별시 성동구 서울숲길 46-1 1층 전시회 오기 전에 서울숲 맛집을 서치해 봤는데 맛있다고 말한 곳들은 다 웨이팅 있다고 써져있었다. 빡쳐부려서 그냥 맛집 찾기를 포기하고 길 가다가 사람 없는 가게에 들어가기로 했다. 한참을 떠돌아다니다가 사람이 많지 않아 보여서 들어간 곳이 제제 맛집이라는 글을 많이 봐서 웨이팅 많을까 봐 기대하지도 않았는데 어쩌다 들어온 곳이 여기라니;; 우리가 운이 좋구만!! 따란- 음식이 꽤 빨리 나왔다. 앉은지 10분 만에 나온 듯? 역시 웨이팅이 있는 가게이다 보니까 주방장분들의 만드는 속도가 숙달됐나 보다 ㅋㅋㅋ 가격 대비 나오는 음식의 양이 쏘 큐트하다. 서울 물가에 아주 정신을 못 차리겠다. 새우 완탕면 ￦12,000 추우니까 국물 음식 필수!! 완탕에 새우가 가득 들어있는 게 맛있드아🥰 국물도 깔끔하니 좋구나 근데 면은 덜 익었나 보다ㅠ 파스타 알단테 수준의 식감이다....ㅋㅋ 좀 더 익혀서 나왔으면 좋겠다😂 관자소스를 곁들인 복건식 볶음밥 ￦12,000 복건식?? 중국의 복건성 지역을 말하는 것 같다. 관자 볶음밥 아니고 관자 소스임 명심! 관자 소스라서 그런지 소스에서 해물맛이 나고 새우와 야채가 소스에 같이 곁들여져 있다. 밥은 날아가는 밥이다. 맛은 나쁘지 않군 어향가지 ￦16,000 티비로 많이 본 어향가지!! 한번 먹어보고 싶어서 주문했당 ㅎㅎ 근데 나는 어향가지 튀겨서 탕수육처럼 먹는 줄 알았는데 아니구낭 ㅠ 뚝배기 그릇에 보글보글 거리면서 나온다 ㅋㅋㅋ 엄마는 이 뚝배기 그릇을 탐내하신다 ㅋㅋㅋ 불 맛도 많이 나고 가지가 푹 익어서 맛있당 같이 주문한 볶음밥과 먹으니 간이 딱 맞다! 어향가지 하나만 먹기에는 간이 좀 세다 😅 버니타운 50m © NAVER Corp. 버니타운 서울특별시 성동구 서울숲2길 15-12 1.5층 카페도 웬만한 곳은 다 사람이 많아서 돌아다니다가 괜찮아 보이는 곳에 들어갔다. 버니타운은 주택처럼 생긴 건물에 위치해있다. 지하가 아닌 계단을 올라가야 버니타운이다! OMG 너무 이뻐서 육성으로 소리 지름 ㅋㅋㅋㅋ 케이크 장식된 거 너무 이쁘고 ㅠㅠㅠㅠ 이렇게 예쁜 케이크 첨 봅니다..... 암생각없이 들어왔는데 눈 호강하네 ㅋㅋㅋㅋ 옆에 쇼케이스에도 케이크가 있다. 나 꽃에 미치는데... 꽃으로 장식된 거 보세요!!!! 마음을 다잡고 주문한 디저트 핫아메리카노 ￦4,500 아이스아메리카노 ￦5,000 블루베리 바스크치즈케이크 ￦7,500 초코오레오케이크 ￦8,000 남의 집 창문 뷰 자리가 넓지 않아 창가 쪽에 앉았더니 다른 집의 창문을 마주 보고 앉게 되었다 ㅋㅋㅋㅋ 맛있을 거란 기대는 하지 않았는데 이게 웬걸? 생각보다 넘 맛있었다! 보기에도 이쁘고 맛도 좋고 눈과 입이 모두 행복한 카페였다! 몸이 이끄는 데로 들어간 음식점 모두 성공! 나름 성공적인 전시회, 맛집 투어였다! -끝-"
뚝섬 서울숲 버니타운 : 예쁜 디저트로 여심저격 ! 성수동 갈만한곳,"크리스마스 느낌 가득한 유럽감성 동화속 분위기의 디저트 맛집 안녕하세요 굥이입니다 오늘의 포스팅은 서울숲과 뚝섬사이에 위치한 밀가루가 아닌 국내산 쌀로 디저트 만드는 곳으로 유명한 ' 버니타운 ' 입니다! 버니타운/bunny town(@bunny_town12) • Instagram 사진 및 동영상 팔로워 950명, 팔로잉 121명, 게시물 715개 - 버니타운/bunny town(@bunny_town12)님의 Instagram 사진 및 동영상 보기 www.instagram.com 케이크 종류도 굉장히 다양하고 카페 분위기도 여성분들이 좋아할만한 감성이 가득한 곳이였어요! 버니타운은 뚝섬역 8번출구에서 가깝고 서울숲공원까지도 걸어서 5분이면 갈 수 있는 곳에 위치해 있어요! 저희는 저녁 늦게 도착을 했는데 확실히 낮에 방문을 하시는게 아래층에 소품샵도 구경할 수 있어서 좋을 것 같더라구요! 뚝섬역 카페 버니타운은 외관에서부터 굉장히 귀여운 토끼그림과 느낌이 가득했어요! 저녁 조명 불빛의 감성도 이쁘죠? 버니타운은 따듯한 봄의 감성도 있지만 추운 겨울의 감성도 느낄 수 있었어요 포스팅을 읽다보면 느끼실 수 있을거라 생각됩니다! 뚝섬역 맛집 버니타운의 메뉴판입니다! 나무판과 종이재질, 글씨의 궁합이 굿!! 매장 이용시 1인 1음료라는 인형팻말이 메뉴판과도 정말 잘어울리죠? 원두도 원하는 맛으로 선택 할 수 있는데 저희는 이날 커피를 먹지 않았어요! 다른 걸 도전해보고 싶었습니다..❤️ 📌초코렛 라떼 (6,500원) 청귤 에이드 (7,500원) 무화과케이크 (9,000원) 에이드에 들어가는 청은 직접 담그셔서 어떤맛이 날지 궁금했어요! 홀케이크도 주문제작이 된다고 합니다~ 케이크 종류는 옆 쇼케이스에 있었는데 비주얼도 너무 이쁘고 종류도 다양했어요! 무엇을 선택할까 진지하게 고민... 쌀로 만들어진 케이크인데다가 비주얼까지 이쁘면 반칙!!! 메뉴를 주문했으니 매장을 구경해볼까나~ 분위기와 인테리어는 진짜 유럽 가정집의 느낌이 가득한 빈티지 인테리어였어요! 여자분들이 좋아하는 요소가 많았고 인테리어 하나하나 신경쓰신게 느껴져요ㅎㅎ 다양한 소품도 많았고 포토존도 많아서 사진찍기 넘 바빴는데요! 생각보다 늦게 도착해서 마지막팀..이 된건 신의 한수..? 빅피쳐..? 냅킨과 물티슈는 벽면 한쪽에 놓여져 있어서 자유롭게 가져가세요! 이런 작은 부분에도 세심하게 신경쓴 디테일! 매장내부는 엄청 크지는 않지만 의자와 테이블이 적지는 않아서 좋았고 전체적으로 인스타 감성이 뿜뿜해요 제가 앉았던 창가쪽 다락방 느낌의 좌석! 여기는 낮에 오면 완전 핫플일듯해요 그리고 곳곳에 크리스마스 소품도 보여서 몇개월 미리 크리스마스 분위기를 내서 굿❤️ 요로코롬 틈새 사진 투척! 거울에도 반짝반짝 겨울장신구가 딱! (크리스마스야 빨리 와라~) 아시는 분들은 아시겠지만 저는 거울샷을 굉장히 좋아하는데 버니타운은 거울이 많더라구요! 주문한 메뉴가 나왔습니다! 음료부터 케이크까지 사장님이 정말 신경 써주셨어요! 초코라떼는 잘 섞어서 드시라는 멘트까지! (사장님 친절하시고 스윗하세요~~❤️) 이쁜건 확대도 해보고 여기저기 찍고 어떻게 찍어도 잘나오는 비주얼ㅠㅠ 이걸 어떻게 먹어야 하지!!! 이러고 진짜 마시다시피 잘먹은 1인... 뚝섬역 카페로 유명한 버니타운은 정말로!! 디저트를 맛있게 만드시는 것 같아요 생화꽃도 콕콕 박혀있었고 무화과가 굉장히 신선하고 시럽도 살짝 올려져 있어요! 크림은 식물성 크림맛이 느껴졌고 마냥 달지 않아서 좋았습니다! 그리고 시트 사이사이에 무화과가 있어요❤️ 진짜 무화과 좋아하시는 분들은 강추! 청귤에이드는 빨대로 아래를 잘 섞어서 주시면 탄산이랑 잘 섞여서 한번 먹으니 진짜 소화 되는 맛이였습니다! 청을 직접 담그셔서 그런지 진짜 맛있어요! 초코라떼는 아래부터 가득한 초코를 빨대로 잘 섞어서 먹으니 꺅 당충전 완료! 너무 싱겁지 않아서 좋았어요❤️ 버니타운 내부 재생 0 좋아요 0 00:00 00:00  버니타운 내부 버니타운의 매장내부를 영상으로 담았어요! 굉장히 따스한 감성과 추운계절 감성을 같이 느낄 수 있어서 좋았는데 어떠세요? 전체적으로 인스타 감성이 뿜뿜 넘치는 버니타운은 성수동 갈만한곳 찾으시는 분들에게 추천드리고 싶은 이쁜 카페입니다! 디저트 종류도 굉장히 다양했고 밀가루가 아닌 쌀로 만든 케이크라서 더욱 버니타운만의 장점이 돋보였어요! 친구들과 인생샷 찍을 수 있고 연인과는 더욱 행복하고 달달한 시간을 보낼 수 있는 뚝섬역 카페 ! ' 버니타운 ' 이였습니다! 주소:서울 성동구 서울숲2길 15-12 1.5층 수~일 12:00~21:00 (매주 월화 정기휴무) ☎ 0507-1377-5731 주차 X 50m © NAVER Corp. 버니타운 서울특별시 성동구 서울숲2길 15-12 1.5층"
