title,content
성수동 디저트 특히 타르트 맛집 발렁스,"성수동 디저트 맛집 특히 타르트가 맛있는 'BALANCE (발렁스)' 새롭게 발견한 성수동 디저트 맛집 특히 성수동 타르트 맛집으로 제가 자신있게 소개합니다. 'BALANCE (발렁스)' 라는 곳이예요. 아담한 크기의 가게이고 디저트들도 다양하지는 않지만 타르트와 마들렌, 그리고 커피맛에 집중해 무엇을 골라도 실패가 없는 곳이예요. 심플한 내부 인테리어. 발렁스 라는 이름은 불어로 저울 혹은 균형을 뜻하는데 그래서인지 금빛 저울 소품이 있더라구요. 심플하지만 포인트가 있어 좋았어요 :) 점심쯤 가니 세가지 타르트가 있네요. 께흐 누아는 조금 이따 나온다고 하셨어요. 하지만 아쉬운 것 보단 전시되어 있있던 세가지의 타르트들을 다 먹어보고 싶어서 고르느랴 힘들었답니다 ;_; 시그니쳐 같았던 바닐라 통카, 용과 패션 그리고 새롭게 출시되었다는 마도카 백도와 께흐 누아. 특히 마도카 백도는 복숭아 제철인 지금 시기에만 나오는 것 같더라구요. 그리고 예상외의 복병이 있었어요. 성수동 디저트 맛집 발렁스에서 야심차게 선보이는 네가지 맛의 마들렌! 기본 외에도 쇼콜라, 유자라임, 말차 땅콩 이렇게 네가지 맛이 있었는데요 이것도 다 맛보고 싶은걸 애써 한가지 고르느랴 힘들었네요 ㅠ (다음에 다시 와서 다 먹어주게쓰...!) 음료는 아메리카노, 라떼, 바닐라 라떼, 카페 모카, 패션후르츠 에이드, 라즈베리 에이드가 준비되어 있어요. 아메리카노가 3.5인데 생각보다 저렴하네요. 원두는 프릳츠를 사용하나 보더라구요. 마크가 딱 박혀있었어요. 커피 맛은 어느정도 보장된 셈이죠! 커피를 내리는 사장님의 위로 디플로마가 있어서 읽어보니 르노트르 제과 디플로마더라구요. 프랑스에서도 제과학교로 인정받는 르노트르 제과학교라고 하니 맛이 더 기대가 되었어요 :) 창밖으로 비가 보슬보슬 내리는 중. 나무 트레이와 예쁜 접시에 담겨져 나와요. 저희가 고른 타르는 바닐라 통카와 마도카 백도예요. 시그니쳐와 시즌메뉴를 모두 골라봤어요. 커피는 라떼와 아메리카노를 골랐어요. 추가로 골랐던 유자라임 마들렌도 나왔네요. 너무 예뻐서 저랑 함께간 동생이랑 신나서 찰칵찰칵 사진 삼매경 ㅎㅎ 가게 인테리어가 깔끔해서 그런지 디저트 사진도 너무 잘나오더라는..! (흡족) 그럼 본격적으로 맛볼 차례. 성수동 타르트 맛집의 시그니쳐는 과연 어떤 맛일지! 두구두구!! 바닐라 통카를 반으로 자르니 바삭한 타르트지와 카라멜 그리고 바닐라빈이 그대로 보이는 바닐라 크림까지 한 눈에 보이네요! 한 입 먹자마자 달콤함이 입안 가득~ 그럼에도 바닐라 크림의 부드러움에 계속해서 먹게 되는 맛이예요. 역시 시그니쳐는 시그니쳐죠! (엄지척!) 하지만 개인적으로 원픽은 이 마도카백도! 제가 좋아하는 잘 익은 딱딱이 복숭아가 타르트 위에도 가득 올라가 있고 안에도 복숭아가 잼 형태로 들어가 있어 달달하면서도 복숭아의 과일 맛이 잘 살아있는 훌륭한 맛이었어요. 여기가 왜 성수동 타르트 맛집인지 단번에 인정하게 되는 맛이었죠. 요고 먹으러 꼭 다시 올거예요. 상콤한 디저트를 좋아하는지라 네가지의 마들렌중에 제가 고른건 유자라임 마들렌 이었어요. 한 입 베어물자마자 새콤달콤하게 유자라임맛이 딱 느껴져서 넘나 만족스러웠던 마들렌이네요. 너무 순삭이라서 아쉬웠지만 그래도 행복한 맛이었어요 ㅠ_ㅠ 커피도 역시 맛있었어요. 디저트들과 함께 먹기 좋은 맛! 성수동 디저트 타르트 맛집 발렁스 재생 0 좋아요 0 00:00 00:00  접기/펴기 성수동 디저트 타르트 맛집 발렁스 메뉴들 성수동 디저트 맛집으로 제 마음속에 저장된 발렁스! 친구들 데리구 타르트 뿌시러 꼭 다시 오겠습니다 :) 50m © NAVER Corp. 발렁스 서울특별시 성동구 성수일로4길 49 1층 발렁스 ＃ 발렁스 ＃ 서울 성동구 성수일로4길 49 1층 ＃ 010-2510-7228 ＃ 매일 11:00~19:00 ＃월요일 휴무"
"성수동 파티셰리 발렁스 & 온더, 카페 카모플라쥬","300m © NAVER Corp. 발렁스 서울특별시 성동구 성수일로4길 49 1층 발렁스 온더 서울특별시 성동구 왕십리로14길 23 1층 camouflage coffee 서울특별시 성동구 아차산로1길 9 록시땅스테이 가기 전 디저트 먹으러 들른 성수동 파티셰리 발렁스. 음료메뉴판 및 가격 사진 참고 평일 오후 5시 이전에 갔더니 피스타시에 바닐라통카 하나씩 남아있던 날. 나는 인스타DM으로 전날부터 예약했지롱 룰루 아마 곧 시즌아웃될거라 더 치열한듯. 성수동 발렁스의 복숭아 타르트 마도카백도(￦8,500) 백도 복숭아 마스카폰 크림 백도 꽁뽀뜨 백도 아몬드크림 빠뜨 사블레 발렁스 인스타그램 참고 내 뒤에 오신 분들이 마도카백도 없네..이러면서 아쉬워하길래 PO오지랖WER 발현해서 아...저는 어제 예약하고 왔는데 좀 드릴까요 할까 했던 거 존나 반성함 혼자 먹기도 바빠;;; 특히 저 얇게 썰려 들어간 복숭아 존재가 대박임 회로 치면 마쓰카와한 돔 껍질같은 포인트 식감을 담당한다. 다른 생과도 마찬가지이겠지만 특히 복숭아는 어떻게 해도 맛있는 재료이긴 해서 디저트로 담아낼 때 고민이 많을 것 같긴 하다. 그런 의미로(이걸로 두 개밖에 맛 못봤지만..) 아직까지의 임팩트는 전에 먹어본 께흐블랑 원탑! https://instagram.com/balance_patisserie 팔로워 4,143명, 팔로잉 14명, 게시물 160개 - 발렁스(@balance_patisserie)님의 Instagram 사진 및 동영상 보기 instagram.com 그리고 뒤이어 온더. 같은 성수동이라 묶어가면 되겠지 했는데 도보 20분 거리더라...^^... 헉헉 요기도 전날 dm으로 예약 요청 드렸는데 답이 없으셔서 아 인스타로는 안받는구나 해서 당일에 전화로 예약하고 18시 전에 픽업 다녀옴. 으아니???? 평일 5시가 넘은 시각인데도 디저트가 이렇게나 많이 남아있다니 깜놀 놓칠수 없어(?) 궁금하던 청포도랑 새로나온 흑임자 마들렌도 같이 포장ㅜㅜ 위스키에 이어 디저트까지 보태보태병 오져... 그래서 외부반입 음식 허용한다는 카페로 들고갔지만 너-무 배부르고 해서 사진만 찍고 고이 넣어두었다. 그런데 이날 계획과 다르게 넘나 늦게 집에 들어가는 바람에 비주얼 똥망+컨디션 바닥인 상태로 맛볼수밖에 없었다는 게 상당히 아쉬움ㅜㅜ 특히 바닐라 브리오쉬는 밤새 냉장고에 있던 거 꺼내 먹으니까 슈크림의 달달하고 고소함, 바닥 페이스트리면의 캐러멜라이징보다도 흰밀가루 특유의 질리는 느낌이 바로 와닿아서 슬펐다. 샤인머스캣 꿀리에 적신 피스타치오 다쿠아즈 애플민트 프로마쥬 블랑 샹티이 모스카토 와인 젤리 디스크 샤인머스캣 샤인머스켓(￦8,500) 피스타치오 크럼블 시칠리아 피스타치오 가나슈 꿀물에 적신 비스퀴 조콩드 아카시아 향을 입힌 바바루아 무스 아카시아(￦8,400) 기존엔 아예 피스타치오아카시아 라고 판매하시다가 형태와 조합을 조금 바꿔서 쭉 판매하고 있는듯. <속보> 온더 갸또 다다음날 냉장고에서 처참한 상태로 발견돼... 맨 위 글라세 종이에 달라붙어있곸ㅋㅋㅋㅋ 엌ㅋㅋㅋㅋ ㅋㅋㅋㅋㅋㅋㅋㅋㅋㅋ 하.. 참담... 온더랑 나는 타이밍이 좀 안맞는 것 같다. 말잇못... 후기 생략... 흑임자마들렌은 진짜 맛있었다. 글라세가 예술이어요 https://instagram.com/on.the____ 온더(@on.the____) • Instagram 사진 및 동영상 팔로워 8,970명, 팔로잉 23명, 게시물 264개 - 온더(@on.the____)님의 Instagram 사진 및 동영상 보기 instagram.com 사실 여기 카페 카모플라쥬 커피는 위에 적은 목적으로 먹잘알 이웃님께서 알려주신대로 온건데 으아니..???? 공간도 주인장님도 커피맛도 깔끔하니 내 취향 저격. 벽면 그래피티부터 원두 패키지, 가구나 심지어 티슈 누르는 소품까지 하나하나 고심해 고른듯한 흔적과 애정이 묻어나는 느낌이 인상적이었다. 롱블랙 아이스 가격 4,500원 신선한 원두 향미가 넘 좋았다 성수동 파티셰리 발렁스 & 온더, 카페 카모플라쥬 재생 1 좋아요 0  접기/펴기 성수동 파티셰리 발렁스 & 온더, 카페 카모플라쥬 내내 펑키한 음악 나오고 로스팅 기기 작동하는 거 보면서 원두 볶아지는 거까지 보는데 뻥튀기 트럭 지나는 느낌ㅋㅋㅋ 꼬소한 향 너무 좋더라..♡ 흐흐 이날의 셀프데이트도 아아주 성공적! https://instagram.com/camouflageswimminginthedarksea 카모플라쥬 / CAMOUFLAGE(@camouflageswimminginthedarksea) • Instagram 사진 및 동영상 팔로워 2,533명, 팔로잉 2명, 게시물 112개 - 카모플라쥬 / CAMOUFLAGE(@camouflageswimminginthedarksea)님의 Instagram 사진 및 동영상 보기 instagram.com"
"성수동 디저트 맛집, 발렁스","발렁스 월,화 휴무 수요일~일요일 : 12:00~19:00 선물할 일이 생겨 급 들러본 발렁스! 성수동에선 워낙 유명하기도 하고 카카오 지도 평점도 너무 높은 이곳!! 가보고싶었던지라 이번 기회를 통해 한번 들러봅니다! 제가 갔을 시점은 오픈하고 한시간 반쯤 지난 시간, 1시 반쯤 방문했습니다 비도오고 날도 춥고 점심시간인 시간에 발렁스를 방문하니 아직 케이크가 많이 있더라구요! 많은 후기에서 디저트가 몇개 없어서 아쉬웠다는 글들을 볼 수 있어서 호다닥 서둘러 다녀왔는데 너무 잘한 선택!!ㅎㅎ 마들렌과 귀여운 구움과자들도 있어요 그렇지만 저는 오늘 타르트를 삽니다! 이렇게 포장 패키지도 있어요! 여러개를 사면 포장을 예쁘게 해주시기때문에 선물용으로 아주 좋은 것 같습니다 메뉴판이 있어요! 글씨가 너무 작아 안보이시는 분들을 위해 메뉴를 카카오 지도에서 다시 캡쳐:) 보시는 안내와 같이 타르트 4구 상자는 타르트 3개 이상 구입시 무료로 제공되고 있으니 포장하실분들은 참고하세요! 발렁스의 메뉴들! 타르트는 종류가 바뀌기도 하고 시즌템들이 나오다보니 따로 등록이 안되어있는듯 합니다 저의 타르트 4종을 예쁘게 포장해주시는 쉐프님!! 선물받는 분이 예쁜 발렁스 타르트 받고 좋아하시면 좋겠다.!.!ㅎㅎ 발렁스는 Balance의 프랑스식 발음인가봐요 발란스인데 발렁스?_?하고 띠용 잠시 생각했는데 쉐프님께서 프랑스에서 유학을 하신 것 같더라구요ㅎㅎ 내부 공간은 생각보다 넓진 않아요! 작지만 아늑하구 예쁜 공간! 그리고 발렁스라는 이름에 맞게 저울을 로고에서 매장에서 찾아볼 수 있답니다!! 맛도 너무 좋고 선물용으로는 더할나위 없이 좋은 발렁스!!! 선물한 분께 너무 예뻐서 먹기 아까웠다는 말까지 듣고 맛도 더할나위 없이 좋았다는 말을 들으니 너무 뿌듯하구 기분이 좋습니다🥰 선물할 일이 있거나 달달구리 맛있는 디저트가 땡길때는 성수 발렁스로 고고!! 50m © NAVER Corp. 발렁스 서울특별시 성동구 성수일로4길 49 1층 발렁스"
성수동 | 발렁스 : 자두와 코코넛,"격리중에는 가고싶은 파티스리를 메모장에 적어보고 지우고를 반복했다. 가게 이름이 간결하고 직관적인 발렁스는 블로그 이웃ㄹ님의 포스팅으로 몇차례 보면서 개중에서도 가장 고대해왔던 곳이었는데, 인스타나 블로그로 찾아보니 코코 플럼이라는 갸또가 자두와 코코넛의 조합이라 그냥 지나칠 수 없었음. 열두시 반정도에 가게에 도착했고 모든 갸또가 준비돼 있어서 원하던 갸또들을 전부 살 수 있었다. 처음 와보는 성수역..개찰구 근처가 색감이 귀엽다. 성수역 4번 출구에서 맨 처음 골목으로 들어와서 5분 정도 걷다보면 발렁스에 도착..파티스리보다는 액세서리 가게같네 쇼케이스는 요렇게..다행스럽게 전종류 남아있었음. 디자인이 모두 귀엽지만 피스타시에랑 백도 타르트는 각별히 더 귀엽다. 포장마저 쥬얼리 가게 같네요 (기절) 마도카 백도 8500원 상단의 물복숭아와 안에 들어간 복숭아 콤포트, 반달모양 딱딱복숭아로 나뉜 세가지 형태의 복숭아 과육이 들어가서, 어떤 부차적인 맛도 방해하지 않는 딱 깔끔하게 복숭아만을 위한 타르트라는 인상. 복숭아 콤포트와 아몬드 크림이 굉장히 달다. 중간에 들어간 딱복 레이어의 도드라지는 탄력있는 식감이 재미있다. 크리미한 요소는 상단의 마스카포네 크림이 전부인지라 우유 느낌보다 과즙이 더 부각되는 느낌. 손으로 들어올렸을때 손가락 자국이 남을만큼 빠뜨가 물러서 놀랐는데, 아마 살짝 포장해오는 길에 햇볓에 살짝 녹아서 빠뜨에 수분기가 들어가버린 것 같다. 코코 플럼 8000원 어쩌자고 이렇게 매력적인지?.?상단의 코코넛 마스카포네 크림부터 은은한 코코넛 향과 고소한 우유맛이 진해서 감동 받았는데 본체의 코코넛 무스와 내부의 자두 콤포트도 모두 각기 완벽한 존재감을 뿜어낸다..코코넛이 녹진하고 기름진 맛이라, 산미 강하고 풀향 도는 자두와 잘 어우러진다. 바닥에 갈린 아주 얇은 사브레는 로투스 맛을 떠오르게 함.. 피스타시에 8600원 일본에서 파티스리들을 돌아다닐때 쇼케이스에 피스타치오를 사용한 갸또가 보이면 거두절미 않고 제일 먼저 골라, 이집저집의 피스타치오 갸또를 많이 먹어왔다. 그래서 머릿속에 피스타치오 디저트 아카이빙이 충실하게 돼있는데 그중에서 발렁스의 피스타시에만큼 견과류 그대로의 피스타치오의 존재감을 살린 갸또는 맛본적 없는 것 같다. 사블레위에 녹진한 피스타치오 가나슈와 함께 들어간 카라멜라이즈드 된 피스타치오가 역시 무엇보다 맛있다. 가나슈와 빠뜨와 견과류의 조화라 가장 위胃가 느끼해지는 디저트이기도..(그런거 좋아함) 50m © NAVER Corp. 발렁스 서울특별시 성동구 성수일로4길 49 1층 발렁스 성수역 4번 출구에서 도보로 5분 영업시간 12:00 - 19:00(월, 화 휴무) 코코플럼 또 먹고싶네🥲"
서울숲 카페 추천 성수동 발렁스의 수제 타르트 디저트 맛집,#서울숲카페추천 #디저트맛집 #발렁스 서울숲 카페 추천 성수동 발렁스는 수제 타르트 디저트와 마들렌까지 다양한 디저트들이 다양한데요♡ 깔끔한 디자인의 서울숲 카페 추천 발렁스는 테이블은 2개가 있고 달콤한 디저트가 가득있는데요♡ 성수동 카페 발렁스의 수제 타르트 디저트에 커피를 곁들여서 먹으면 아주 좋아요 50m © NAVER Corp. 발렁스 서울특별시 성동구 성수일로4길 49 1층 발렁스 성수 카페 추천 발렁스는 이쁜 소품들도 깔끔하고 이쁜 카페인데요♡ 서울숲 카페 추천 성수동 발렁스의 수제 타르트 디저트 너무 이쁘고 맛있어 보여요~ 다 먹고싶게 생긴 디저트들은 선물을 해줘도 다들 좋아할것같아요♡♡ 27 서울숲 카페 추천 성수동 발렁스의 수제 타르트 디저트 맛집 재생 0 좋아요 0  접기/펴기 27 서울숲 카페 추천 성수동 발렁스의 수제 타르트 디저트 맛집 서울숲 카페 추천 성수동 발렁스의 수제 타르트 디저트로 당 떨어질때 동료들과함께 먹으면 당충전도하고 좋은데요♡♡ 성수동 카페 추천 발렁스의 수제 타르트 디저트에는 마들렌들도 종류별로 있어요♡ 너무 귀엽지 않나용? 음료도 종류별로 다양하게 있는데요 저희는 업무 중간 쉬는겸 잠시 커피타임을 가지기위해 디저트와 커피를 다양하게 주문해서 테이크아웃해왔어요♡♡ 짠♡♡♡ 고된 업무시간 중간에 따뜻한 커피와 달콤한 디저트를 즐기니 정말 힐링이되네요^^ #성수디저트카페 친절한 사장님과 맛있는 디저트 덕분에 단골 예약!!!! 아기자기 귀여운 디저트들과 달콤한 커피한 잔 서울숲 카페 발렁스에서 힐링타임을 가져보세요 매장도 아기자기 이쁘고 깔끔해요♡
선물하기 좋은 타르트 카페 성수동 발렁스 (BALANCE),"안녕하세요 향긋라이프입니다^^ 금요일이네요. 왠지 엉덩이가 들썩이는 ^^ 마침 비도 안오니 동생과 엄마와 세모녀 나들이 하러 나왔어요. 참, 저의 셋찌도 함께요~ 성수동에는 베이커리 카페가 정말 많은데요. 오늘은 성수역 근처에 있는 발렁스(BALANCE)라는 타르트 카페입니다. 11시 오픈시간에 맞춰서 입장! 맛의 밸런스를 찾는다는 뜻일까요? 저울이 인상 깊었어요. 저울 실물 ㅎㅎ 군더더기 없이 고급진 내부 인테리어. 마들렌 4종류 (클래식, 유자라임, 쇼콜라, 말차 땅콩) ( 2,500~3,300 ) 타르트 3종류 바닐라 통카, 마도카백도, 용과패션 ( 7,400~ 8,200 ) 고급진 비주얼에 1차 흥분하고요. 가격대는 좀 있지요? ^^ 마들렌 선물용 상자는 2천원에 구입해야 하네요. 타르트 4구 상자는 3개이상 구매시 무료라고 해요. 뭔가 정직할 것만 같은 사장님 뒷모습. 커튼 안쪽이 주방인 듯 하고요. 발렁스의 음료메뉴에요. 커피가 의외로 저렴하더라고요. 달달한 타르트와 함께니 아메리카노로 주문해요. 조명과 저울이 조화로왔어요. 먼저 바닐라 통카와 아메리카노가 나왔답니다. 바닐라 통카의 은은한 바닐라 향에 기분이 좋아지고요. 가까이 보니 가격이 비싸지 않게 느껴집니다. ㅎㅎ 사진만 연신 찍어대고. 나왔는데 먹질 못하니! 마노카 백도와 쇼콜라 마들렌을 보니 2차 숨멎! 이쁜건 마도카 백도 타르트가 1등.. 금가루까지 얹어진 타르트와 쇼콜라 마들렌 사진 찍는 손을 멈출 수가 없었네요 ㅋㅋ.. 성수동 발렁스 마도카백도 재생 6 좋아요 0 00:00 00:14  접기/펴기 고급진 타르트 발렁스 마도카 백도 타르느는 마스카포 치즈크림이 얹어져 있어요. 바닐라 통카 안쪽에는 카라멜이 들어있어요. 세가지 다 쨍한 단맛이 아닌 은은하고 부드러운 단맛이었어요. 여태 먹은 건 마들렌이 아니었구나..ㅋ 보자마자 선물하고 싶다는 생각이 들더라고요. 선물상자에 들어가면 얼마나 예쁠지. 받는 분도 좋아하시겠죠! 동생이 추천해서 가본 곳인데 너무 만족스러웠습니다. 50m © NAVER Corp. 발렁스 서울특별시 성동구 성수일로4길 49 1층 발렁스 위치는 성수역 3번에서 멀지않고요. 소문난 감자탕에서 몇 발자국 거리입니다~! #발렁스 #성수동타르트 #타르트카페 #고급선물 #고급디저트 #성수카페거리"
성수동 신상 디저트 카페 발렁스,"성수동에 새롭게 오픈한 신상 디저트 카페 발렁스 영어 표기를 보니 BALANCE 밸런스의 불어식 발음인 것 같다 ㅎㅎ 전체적으로 상아색톤의 인테리어로 따뜻한 느낌 뿜뿜이었던 ㅎㅎ 사실 그냥 지나칠 법도 했지만 새로 오픈한 것 같은 모습에 궁금해서 기억해뒀다 바로 찾아왔다 작지만 제대로 만든 디저트로 승부하는 성수동 신상 카페 발렁스 테이블은 사진에 보이는 것과 같이 세개 남짓밖에 없지만 자리가 쇼파 자리로 편안해서 여유롭게 앉아 쉬다 가기엔 좋았다 나름 포토존으로 잘 꾸며진 매장 내부도 좋았음 ㅎㅎ 성수동 신상 디저트 카페 발렁스를 검색해 보며 봤던 타르트들 비쥬얼이 딱 봐도 너무 맛있는 애들이어서 기대를 안고 방문하게 됐는데 원래는 네 종류가 준비되어있어야 할 쇼케이스에 이미 솔드아웃으로 인해 두 종류밖에 남지 않았다 벌써 이렇게나 알고 다들 찾으신다구요 ,, 아쉬운대로 남아있던 바닐라통카와 용과 패션 타르트 두개를 모두 시켰고 타르트 말고도 마들렌이 네 종류나 더 있었는데 쇼콜라 마들렌을 추가로 주문했다 ㅎㅎ 여기 고급스러운 포장 패키지 협소한 매장 특성탓인지 포장 손님이 유독 많았는데 우리가 있는 동안에도 포장 손님들이 많이 들렀다 가셨다 아, 그리고 디저트는 킵이 되는건지 예약한걸로 보이는 손님도 계셨는데 정확하진 않으니 예약 가능 여부는 직접 매장에 문의를 해야될 것 같다 그리고 벽면에 붙어있던 에꼴 르노뜨르 수료 인증서대충 따라 만드는 곳이 아니라 정말 전문 과정을 수료한 상태로 프랑스 디저트를 만드는 찐 느낌의 집이었던 것이다 그리고 커피 원두는 프릳츠를 쓰나 봄 우리가 주문한 메뉴들 그러고보니 음료 메뉴를 깜빡했네 ㅎㅎ; 뭐 아메리카노, 라떼 이런 커피 종류들은 다 있었고 에이드는 내가 주문한 라즈베리 에이드와 패션후르츠 에이드가 있었는데 패션후르츠 용과 타르트를 주문해서 에이드는 라즈베리 에이드로 주문했다 ㅎㅎ 비쥬얼 너무 예쁘죠 ㅎㅎㅎ 사실 디저트만 봐도 맛있어보여서 좋았는데 매장 자체도 예뻐서 더 마음에 들었던 사진을 이렇게나 많이 건졌다구요 ㅎㅎㅎㅎ 흐흐 커다란 공장들을 개조해 만들거나 건물을 통으로 쓰는 큰 규모의 매장들이 많은 동네인데 매장이 큰 만큼 사람도 많아서 오히려 여유는 없고 복작복작한 시장통 느낌만 나서 좀 그랬는데 여기는 매장 자체는 협소해도 차분한 분위기어서 조금 더 마음이 가는 것 같네요 ㅎㅎ 성수동 신상 카페 발렁스에서 주문한 바닐라 통카, 용과 패션 그리고 쇼콜라 마들렌 거기에 라즈베리 에이드까지! 친구랑 저랑 둘 다 커피를 너무 마셔서 여기서는 커피를 패스하고 에이드로 마셨어요 ㅎㅎ 넘 맛있어보이는 두 타르트 다음번엔 더 일찍 와서 나머지 두 타르트도 꼭 먹어보고 싶을 정도로 맛있었던 곳이에요 모양이 정말 제대로였던 쇼콜라 마들렌까지! 진하고 묵직한 마들렌에 초코코팅이 정말 반듯하게 바닐라 통카는 제가 제일 먹고싶었던 종류 중 하나인데 얘가 없었더라면 정말 아쉬웠을거에요 ㅋㅋㅋ 타르트지 역할로 아몬드 빠뜨 사블레, 그 위로 통카 카라멜과 사이에 헤이즐넛버터 비스퀴를 채워주었고 그 위로 바닐라 샹티 크림이 올라가는 비쥬얼도 비쥬얼인데 맛이 조화가 진짜 최고였던 !! 제대로 된 프랑스 식의 고급 타르트가 먹고싶다면 여기 정말 추천드리고 싶네요 ㅎㅎㅎ 그리고 패션후르츠 앙글레즈 크림 가득한 위로 용과가 올라가 상큼한 맛이 굉장히 강했던 용과 패션까지도 굉장히 고급스러웠던 맛 새롭게 오픈했지만 정말 제대로 만들어진 디저트들로 인기를 끌 것 같은 성수동 신상 카페 발렁스 ! 저는 꼭 재방문해서 다른 타르트들까지 다 먹어 볼 생각입니다 히히 50m © NAVER Corp. 발렁스 서울특별시 성동구 성수동2가 310-17"
