title,content
성수동 디저트 카페 마를리 / 발렁스 / 자연도소금빵 / 코끼리베이글 후기,"성수역 디저트 카페 추천 케이크 : 마를리, 발렁스 빵 : 코끼리베이글, 자연도소금빵, 씨장 커피 : 스탠드업 플리즈 바이턴온 100% 내돈내산 리얼 솔직 후기 100m © NAVER Corp. 마를리 서울특별시 성동구 연무장길 47 홍원빌딩 발렁스 서울특별시 성동구 성수일로4길 49 1층 발렁스 자연도소금빵in 성수 서울특별시 성동구 연무장길 56-1 1층 코끼리베이글 성수 서울특별시 성동구 성수이로26길 17 (성수동2가) 1층 스탠드업플리즈바이턴온 서울특별시 성동구 연무장3길 14 1층2호 ★마를리 (성수 케이크 카페 ) 서울 성동구 연무장길 47 1층 성수동2가 315-55 오전 9시 ~ 저녁 11시 ★발렁스 (성수 케이크 카페 ) 서울 성동구 성수일로4길 49 1층 성수동2가 310-17 월, 화 휴무 오후 12시 - 저녁 7시 ★자연도소금빵 in 성수 (성수 소금빵 ) 서울 성동구 연무장길 56-1 1층 성수동2가 321-74 오전 9시 ~ 저녁 10시 ★코끼리베이글 성수 (성수 베이글 ) 서울 성동구 성수이로26길 17 1층 성수동2가 278-53 오전 8시30분 ~ 저녁 9시 ★스탠드업 플리즈 바이턴온 (에스프레소바 ) 서울 성동구 연무장3길 14 1층 성수동2가 302-24 오전 9시 ~ 오후 6시 ★씨장 (성수 바게트 샌드위치 ) 서울 성동구 성덕정길 92 1층 성수동2가 532-38 오전 10시30분 ~ 저녁 9시 ★LCDC SEOUL 카페 이페메라 서울 성동구 연무장17길 10 1층 성수동2가 275-28 오전 11시 ~ 저녁 8시 ★테디스오븐 (성수 베이커리 카페 ) 서울 성동구 상원6나길 7 1층 성수동1가 13-428 오전 11시 ~ 저녁 10시 서울숲역 유럽풍 신상카페 테디스오븐 키슈맛집 서울숲 유럽풍 카페 테디스오븐 키슈 완전 맛있어요!! 서울 성동구 서울숲2길 43 1층 성수동1가 668-50 (뚝... blog.naver.com ★얼스케이크베이크샵 (성수 베이커리 카페 ) 서울 성동구 상원6나길 7 1층 성수동1가 13-428 오전 10시 ~ 저녁 8시 뚝섬역 카페 얼스케이크베이크샵 포카치아 빵 맛있다~! 뚝섬역 성수 빵 맛집 얼스케이크베이크샵 포카치아 빵 쫄깃해요~ 서울 성동구 상원6나길 7 1층 성수동1가 1... blog.naver.com 성수 크레이프 케이크 카페, 마를리 2022년 10월 방문 성수동 케이크 맛있는 카페, 마를리에요~ 작년에 다녀오긴 했지만 여전히 생각나는 곳이죠~ 부드러운 크레이프 생과일 케이크나 생과일 생크림 케익을 만날 수 있어요 크레이프 안에 과일이 콕콕 박혀 있기도 하고 생크림 케이크도 아주 존맛탱 ! 디카페인 커피도 있고 커피 이외에 보틀 밀크티도 굿굿 ! 케이크는 홀케이크로도 주문이 가능한가봐요~ 성수 케이크 카페, 빈티지 컨셉도 좋아요 ! 근처 인.생.네.컷 포토존에서 사진도 남기고~ 크으~~~ 공간도 넓고 케이크 디저트도 있어서 친구들이랑 가 본 카페였는데 케이크 너무 맛있어서 속으로 울었잖아요ㅋㅋ 케이크 2개 또 먹고 나중에 2개 또 시킴 !! 여기 어떤 케이크든 다 맛있단 말이에요 !! 2023년 10월 팝업 스토어 _ 마를리 카페 올해 10월에는 무슨 팝업 스토어도 해요? 마를리 케이크 사러 갔다가 멘붕 왔었죠ㅋㅋㅋ 얼른 팝업 끝나랏 !! 성수 고급 케이크 카페, 발렁스 2022년 6월 방문 성수 케이크집 중에서도 고오급 타르트집에 속하는 카페에요~ 차분한 분위기가 한 몫 하는 곳이에요 딱 점심시간 오후 12시부터 오픈해요 케이크 가격이 8~9천원대긴 하지만 고급스러운 단 맛 잊지 못 해~ 성수동 디저트 카페, 발렁스, 고급진 타르트 케이크 맛 !! 재생 23 좋아요 0 00:00 00:21  성수동 디저트 카페, 발렁스, 고급진 타르트 케이크 맛 !! 발렁스 케이크 포장해서 먹긔~ 타르트 재질쓰 영상으로 고고~ 포장만 할 수 있는 곳일 줄 알았는데, 두 세 테이블 먹고 갈 수 있는 공간도 있어요 구움과자나 음료도 판매중이에요 오후 12시 땡 ! 오픈하자마자 가니까 케이크 쇼윈도우에 가지런히 놓인 디저트들 중에 뭘 고를 지 정말 한참 고민했네요 케이크도 한 개 당 박스 1개 포장해줬어요 집에 조심조심히 들고와서 냉장고 잠깐 넣어놨다가 먹기 !! 피스타치오 좋아하는 분들이라면 피스타시에 타르트 진짜 눈물나게 맛있어요 !! 부드럽게 잘리는 재질 한 번 보고 가세요~ 피스타치오 견과류가 어쩜 이리 고소해요~ 바닐라 무스 케이크, 바닐라통카 무난하게 맛있는 고급스러운 맛인데 제 입맛에는 피스타치오 타르트가 승!! 성수 소금빵 맛집, 자연도소금빵 2023년 10월 방문 얼마 전에 다녀온, 자연도소금빵이에요 오전에 가니까 사람들이 별로 없나? 했더니만 제가 산 이후로 제 뒤에 줄이 엄청 길게 섰어요 소금빵만 파는데도 사람들 웨이팅이 있는 소금빵 맛집이에요 키오스크에서 주문하고 교환권으로 소금빵 봉지를 교환하는 방식이죠 성수 소금빵 베이커리 카페, 자연도소금빵 진짜 맛있음 !! 재생 30 좋아요 0 00:00 00:18  성수 소금빵 베이커리 카페, 자연도소금빵 진짜 맛있음 !! 크으~~ 집에 가자마자 먹어봤는데 4개 한 세트 소금빵 한 번에 순삭할 뻔 !! 조만간 또 사러가야즤~~ 교환권을 주면 소금빵 한 세트를 ( 1세트 소금빵 4개 12,000원 ) 정성껏 포장해서 주어요 근데, 라인을 어디 서야 할 지, 친절하게 알려주면 좋았을 걸~ 말투가 조금 짜증스러워서 당황쓰... 아침부터 안 좋은 일 있으신건가봉가~_~ 어찌됐든 소금빵 한 세트 포장 완료 ! 캐나다산 최고급 밀 100%만 사용하고 프랑스 최고 버터 100%만 사용하고 프랑스 천일염 100%를 사용한 재료부터 남다른 소금빵이에요~ 생긴건 그냥 퐁실퐁실하게 생겼는데 소금빵에 버터가 바삭바삭하고 엄청 부드럽고 사고 바로 먹어도 맛있고 상온 보관해뒀다가 식은채로(?) 먹어도 살살 녹는 소금빵 재질이었어요~ 빵의 쫀득함마저 살아있는 소금빵 !! 서울에 여럿 소금빵 먹어봤지만 여기 소금빵 사러가기도 가깝고 맛도 맛있고 포장도 센스 굿굿 !! 성수 베이글 카페, 코끼리베이글 포장 2023년 10월 방문 코끼리베이글이 그렇게 유명한가? 라는 생각으로 가까운 성수점으로 가봤어요 아니, 무슨 오전 시간대인데도 테라스며, 2층이며, 옥상 테이블에도 사람들이 바글바글했어요 베이글 샌드위치도 판매하고 있었고 베이글과 음료를 같이 먹고갈까 말까 엄청 고민하다가 그냥 포장해왔죠~ 포장 손님이 약 70~80% 되는 듯!! 베이글 종류도 많고~ 베이글 토스트나 스튜같은 메뉴도 있네요 베이글을 화덕에서 계속 계속 구워요~ 코끼리 베이글 종류에는 어니언 마요, 갈릭 퐁당(마늘빵같은), 크림치즈 생크림 베이글, 부추 베이글 등등 올리브 치즈 베이글, 트리플 치즈, 먹물 베이글, 쏠티초코, 호두 크랜베리, 바질, 플레인 등 다양했고요 그 외, 단팥이 넘사로 올려진 베이글, 버터쏠트, 햄 샌드위치, 무화과콩포트 등등 성수 베이글 카페, 코끼리베이글 한 번쯤은 먹을만 하다~! 재생 19 좋아요 0 00:00 00:37  성수 베이글 카페, 코끼리베이글 한 번쯤은 먹을만 하다~! 코끼리 베이글 포장해서 먹방 베이글 단면도 참고하려면 영상으로 고고~ 베이글 구매 방식은 카운터에 얘기하면 알아서 포장하거나 직원이 골라서 주는 시스템이었어요 대개 우리나라 카페같은 경우는 직접 쟁반에 골라서 계산하는 편인데 여기는 무언가 미쿡 스타일같았네요~ 진짜 결제하자마자 포장해서 나온 코끼리 베이글 포장 비쥬얼이에요~ 베이글 포장하고 눈누난나 집에 오자마자 브런치 겸 먹었어요~ 생크림이 냉장 된 상태였다면 나이프로도 잘 잘렸을텐데 갖고 오면서 좀 녹았는지, 크림 따로, 빵 따로 먹는데도 엄청 쫄깃쫄깃했네요 와~ 크림치즈 생크림이 이렇게 맛있는거였나? 무화과를 좋아하는 사람이라면 입에 참 잘 맞았겠지만 저는 한 입 먹고, 이건 아니다 싶어서 바로 음쓰행... 크으~ 마늘빵 좋아하는 사람이라면 역시나 좋아할 갈릭 베이글이었어요 !! 워낙 짭잘해서 나중에 갈증을 부르는 맛이지만 쫀득한 베이글이랑 참 잘 어울렸어요~ 생각보다 더 괜찮았던 부추 베이글 이 베이글도 꽤나 짭짤한 편이었는데 코끼리 베이글 빵 자체가 쫀득쫀득하니 맛있어서 굿굿 ! 코끼리 베이글 종류가 많아서 좋았지만 한 번 가봤다에 의의를 두기로 했어요~ 성수 에스프레소바, 스탠드업 플리즈 바이턴온 2022년 10월 2번 방문 성수동에서 일하는 전 직장 선임이 알려준 성수 에스프레소바 스탠드업플리즈바이턴온이에요 모르고 지나가면 안 보이는 곳이고 알고 지나가면, 여기 맛있지 하는 곳이에요~ 에스프레소 메뉴는 사진과 같아요~ 대개 2천원대이고요 일반 커피는 테이크 아웃만 가능했어요 조명과 각 종 그릇 분위기가 한 몫 하는 곳 !! 무엇보다도 에스프레소 종류도 많고 커피가 맛있는 카페에요~ 성수동 나들이할 때 또 친구들 데리고 갔어요~ 작년 10월 때라, 할로윈 디스플레이가 돼 있어요 골동품점 같기도 하면서도 어느 곳을 사진 찍어도 잘 나오는 에스프레소바 비쥬얼쓰~ 각 자 마음에 드는 에스프레소 한 잔 씩 하고 컵 쌓아주는 센스 !! 성수 바게트 샌드위치, 씨장 2023년 5월 방문 성수동 뚝도시장 근처에 위치한 성수 바게트 샌드위치 카페, 씨장이에요 바게트 샌드위치 맛있는 곳은 진짜 맛있잖아요~ 꼭 가보고 싶었어요~ 바게트 샌드위치 이외에 파스타나 샐러드, 스프 등 각 종 브런치 메뉴도 판매하고 있네요 바질 토마토 바게트, 새우 바게트, 베이컨 버섯 바게트, 피스타치오 바게트, 카프레제 샌드위치 바게트 등 바게트 종류가 다양했죠 먹고 갈 수 있는 공간도 유럽풍 인테리어로 잘 꾸며져 있었어요 바게트 샌드위치 종류가 이렇게나 많을 일인가 엄청 고민했네요~ 루꼴라 바게트 샌드위치와 카프레제 바게트 샌드위치 포장하기로~ 커피는 마시고 왔어서 ABC쥬스나 OCA쥬스 마셔야지~해서 오렌지 캐롯 애플 생과일 주스 포장 ! 크으~ 얼마나 신선하고 과일의 자연스러운 단맛이 굿굿 ! 씨장 바게트 샌드위치 포장 비쥬얼 바게트를 먹기 좋게 한 입 크기씩 잘라줬어요 카프레제 샌드위치가 더 맛있을 줄 알았는데 루꼴라 샌드위치에 들어간 크림치즈가 아주 입에 착착 달라붙었어요! 씨장도 한 번 쯤 가볼만 했네요~ 성수 분위기 좋은 카페, LCDC SEOUL 이페메라 2022년 4월 방문 성수동은 워낙 팝업이 많은 곳이라 팝업 스토어 갔다가 카페를 들리는 편인데, 아늑하고 공간이 넓어서 좋았던 LCDC SEOUL 이페메라 카페였어요 자리도 다양하게 많아서 노트북 및 공부하는 손님이나 인근 회사 업체 사람들이 회의하거나 만나서 얘기하는 장소같더라구요 무난한 케이크 타르트도 판매하고 있어서 커피랑 잘 어울리기도 했고요 햇살이 들어와 더 따뜻한 느낌을 주는 카페 분위기에요~ 무슨 뚱쿠키도 있었어요 아이스라떼와 치즈케이크 비쥬얼이 잘 어울렸던 쉬기 좋았던 카페~ 여기까지 성수동 카페 투어 후기 끝! #LCDCSEOUL #마를리 #발렁스 #성수동카페 #성수디저트 #성수디저트맛집 #성수디저트카페 #성수바게트 #성수베이글 #성수소금빵 #성수에스프레소바 #성수역카페 #성수카페 #성수케이크 #성수케이크맛집 #에스프레소바 #자연도소금빵 #코끼리베이글"
성수동 최애 디저트 전문점 발렁스 (balance),"디저트 격전지 성수동 정말 많은 디저트 전문점과 카페가 생기고 또 사라지고 하는 와중에도- 변하지 않는 내 마음 속 1위가 있었으니(성수동 기준) 그건 바로 발렁스다. 비쥬얼은 물론 맛 역시 도라방스 그 자체 종류가 엄청 많다고 볼 수는 없는데 하나하나 개성이 특출나고 계절마다 또 바뀌는 라인업이 재밌어서 갈 때마다 만족하고 돌아온다. 성수역에서 그리 멀지 않은 곳에 위치한 성수동 디저트 맛집 발렁스 . 그 성수 감자탕 사거리에서 밑으로 좀 내려오시면 됩니다. 화이트 톤의 깔끔한 실내에는 먹고갈 수 있는 테이블도 있는데 딱 3개 뿐이라 타이밍을 잘 맞춰야 한다. 웨이팅 하거나 되돌아 가시는 경우도 엄청 많이 봄 발렁스라는 이름답게 저울로 갬성 더해주시고요. 거울이 있어 좁은 실내를 살짝이 시원스럽게 만들어 준다. 2023년 4월 기준 성수동 디저트 발렁스 갸또 라인업 금다래와 딸기가 들어간 프레지에, 피스타시에와 투몬, 디아망이 있었다. 이 중에 최애는 피스타시에. 피스타치오 덕후라 관련 디저트라면 보이는 족족 사 먹는 편인데 - 아직은 이게 원탑이다 구움과자도 다양한 이 곳. 마들렌과 휘낭시에, 쿠키와 크림 브륄레, 캬라멜 뵈흐 살레를 파는데 인기가 어찌나 좋은지 마들렌 품절 크리.. 쿠키는 글루텐 프리라고 해서 디저트 선물하실 분들께도 엄청 좋을 것 같다. 어… 음료 메뉴판을 제가.. 찍으려고 했는데…. 죄송ㅎ 커피 3종류와 에이드, 홍차가 있고 가격은 4,500원 ~6,500원이다. 일반적인 성수 카페 가격대라 생각하심 됩니다요 주문한 메뉴는 자리로 직접 가져다 주시는데, 플레이트 하나하나 아름답다. 이날은 디아망과 피스타치오 휘낭시에, 따뜻한 아메리카노와 블랙티를 골랐다. 내 기준 신메뉴 디아망! 함께 한 친구에게 피스타시에를 맛보여 주고 싶어서 엄청 고민했는데 ㅋㅋㅋ 사랑스러운 그녀가 나 안 먹어본 거 먹자 그래서 냉큼 디아망을 선택했다. 가격은 8,500원! 위에서 보면 이런 자태. 선물하면 상자 열자마자 사랑에 빠질 것 같은 비주얼이다. 얘는 뭔가 다른 갸또보다 작은 것 같아 손 떨리긴 했는데 진짜 디테일보면 납득이 감. 사장님의 표현을 빌리자면, 광물과도 같은 거친 표면과 고운 모래알처럼 파스스 부서지는 빠뜨 띠아망의 조화라는 디저트. 그 안에 담긴 건 아이리쉬 크림 리큐르와 커피가 어우러진 카페 베일리스 가나슈, 피칸 캬라멜 리제이다. 맨 위에는 뽀오얀 바닐라 샹티 크림으로 마무리 ! 개인적으로 뭔가 하나씩 포인트가 들어가 있거나 예상치 못한 반전이 숨어있는 디저트를 참 사랑하는데- 역시 믿고 먹는 발렁스. 까슬한 첫 입에 이어지는 부드러운 크림과 녹진쫀득한 가나슈, 바삭하게 씹히는 피칸의 식감이,, 쉐프님 어디 계시죠 제 절을 받으세요 진하게 올라오는 커피향과 가나슈의 달콤함이 향긋하면서도 꽤 어른스러운 느낌이라 우아한 초코 디저트 먹고 싶은 날 완전 강추. 아무리 생각해도 발렁스는 정말 견과류 디저트 맛집인 것 같음 달달한 입안을 잠재워주고 정신을 일깨워줄 커피와 홍차! 둘 다 뜨거운 음료만 마시는 사람들이라 ㅋㅋㅋㅋㅋㅋㅋㅋ 이런 hot 두 잔 사진 오랜만이다. 역시 마이 핫걸 ㅠ+ㅠ 커피는 산미가 약하고 굉장히 구수 쌉쌀한 편이라 달달이와 잘 어울린다. 블랙티는 다만 프레르 제품으로, 뭐 다만프레르는 언제 마셔도 맛있지.. 티 전문가 수준의 친구라 애매한 거면 어쩌나 걱정했는데 아주 만족스럽게 마심 ㅎㅅㅎ 하나만 먹으면 어쩐지 아쉬우니까 휘낭시에도 하나 먹어본다. 간만에 마들렌 먹으려 했는데 품절크리라 피스타치오 휘낭시에로 골라봄. 이것도 발렁스에서 정말 많이 먹은 메뉴 중 하나. 피스타치오 귀신이라 항상 먹는 것 같다. 겉이 마냥 빠작하진 않고 전체적으로 소프트한 느낌의 휘낭시에라 개인적인 취향에는 조금 더 바삭한 식감이어도 좋겠다 싶은데, 이게 발렁스의 색감일 수도 있으니 ㅎㅅㅎ 단면도 보고 가세용 피스타치오 들어가 살짝 초록빛을 띄는 휘낭시에는 포근한 케이크 같으면서도 겉에 피스타치오 분태가 붙어 있어 고소하고 오독오독하다. 가볍게 먹기 좋은 티푸드 :) 다양한 재료를 사용했지만 뭐 하나 튀거나 도드라지지 않고 어우러짐이 참 좋은 발렁스. 성수동 디저트 맛있는 곳 찾는 분들께 강추드려요 :) 50m © NAVER Corp. 발렁스 서울특별시 성동구 성수일로4길 49 1층 발렁스 서울시 성동구 성수일로4길 49 12시 - 저녁 7시 (라스트 오더 5:30) 매주 월, 화 휴무 02-652-4596"
성수동 성수역 수제 케이크 디저트 맛집은 여기! 발렁스,"케이크랑 빵 디저트 너무 좋아해서 주말마다 찾아다니던 때도 있었는데.. 덮어놓고 먹다 보면 체중관리가 어려워져서 요즘엔 찾아다니지 않아요.. 오랜만에 성수동 디저트 케이크 맛집 수제 케이크가 있는 발렁스 들렀답니다. 성수역 케이크 디저트 맛집 발렁스 수 - 일 12:00 - 19:00 월,화 휴무 디저트 러버들은 성수역에 가면 무조건 간다는 성수동 디저트 케이크 맛집 발렁스. 성수역 4번출구에서 서울숲힐스테이트 쪽으로 쭉 내려오면 발렁스를 만날 수 있어요. 처음에는 가게 이름이 작게 쓰여있어서 차분한 분위기에 그냥 지나칠 뻔하다가 다시 자세히 보니 이곳이 카페였어요. 커피 세종류 에이드 두종류 티 세종류. 성수역 케이크 디저트 맛집 발렁스의 카페메뉴는 단출하면서도 디저트랑 함께 마시기 좋은 종류들로만 알차게 구성되어 있어요. 발렁스 이용 시간은 1시간인데 공간이 작은데 인기가 많은 곳이라 충분히 이해되어요. 대표메뉴 피스타시에 무화과, 몽블랑 타르트 케이크부터 마들렌, 휘낭시에, 쿠키, 크림브륄레 갈레트 등등 생각보다 디저트 종류가 꽤 다양! 지금보니 마들렌은 포장이라도 해올걸 아쉬움이.. 배가 불러서 그냥 갈까 하다가 발렁스 디저트 맛이 너무 궁금해서 들렀는데요. 요즘 괜히 눈치 보이는 카페들이 많아서.. 살짝 사장님한테 케이크 하나 주문해서 앉아서 먹고 가도 되겠냐고 물었는데 괜찮다고 친절히 말씀해 주셔서 감사했어요. 테이블이 많지는 않지만 잠시 이용하기엔 불편함은 없었답니다. 성수동 디저트 카페 발렁스의 좁은 공간을 최대한 활용하고자 양 벽쪽에 붙은 테이블과 의자가 배치되어 있어요. 어떤 테이블은 두분이서 타르트 케이크 네종류나 드시고 계시던데 그걸 보고 여기 맛집이구나.. 제대로 찾아왔구나 확신했답니다! 성수역 케이크 디저트 맛집 발렁스는 사람이 많다면 웨이팅을 걸어두어야 하지만 다행히도 이날은 아직 웨이팅이 없었던지라 운 좋게 바로 앉아서 먹을 수 있었어요. 대표메뉴인 피스타시에 주문! 9,600원. 피스타시에랑 얼음물 한잔까지 함께 챙겨서 예쁘게 세팅해서 나왔답니다. 손바닥 보다 살짝 작은 사이즈인데요. 비주얼이 너무 예뻐서 이걸 먹어야 하나.. 1초 짧게 고민했지만? 단면을 보기 위해 바로 잘랐어요! 타르트 아래에 견과류와 크림, 상단엔 하얀크림. 피스타치오 땅콩 견과류가 오독오독 씹히는데 이 견과류들도 따로 처리를 하시는 거겠죠? 굉장히 맛있더라고요. 견과류만 먹어도 엄청 맛있게 먹을 수 있을 것 같아요. 성수역 케이크 디저트 맛집 발렁스 피스타시에를 먹어보기 전에 예상은 피스타치오 맛이 강한 살짝은 느끼한 케이크가 아닐까 생각했었는데.. 먹어보니 크림이 깔끔하고 신선한 맛이 나요. 두종류 다른 크림이 어우러지면 더 맛있음! 피스타치오인데도 신기하게 전혀 느끼하지가 않고.. 너무 맛있어서 배가 부르지만 않았어도 분명 다른 종류도 더 주문해 먹어봤을 거예요. 성수동 가게되면 발렁스 또 들르려고요~ 성수동 디저트 케이크 맛집은 무조건 발렁스! 50m © NAVER Corp. 발렁스 서울특별시 성동구 성수일로4길 49 1층 발렁스"
성수동 디저트 카페 발렁스 BALANCE patisserie,성수동 디저트 카페 발렁스 BALANCE patisserie 출국하기 전에 너무나 다녀가고 싶었던 맛집인 성수동 디저트 카페 발렁스 @ 이제 슬슬 카페투어도 시동을 걸어볼까해요(!) 물론 잠시 있다가 다시 출국할 예정이긴 하지만ㅎ_ㅎ 뭐 여튼! 인터넷이 빠른 국가인 우리나라에서 열심히 블로그 포스팅 올리고 슝 다시 가보는걸로 해야겠어요..(?) 50m © NAVER Corp. 발렁스 서울특별시 성동구 성수일로4길 49 1층 발렁스 성수동 디저트 카페 발렁스 BALANCE patisserie 위치 * 운영시간 수요일 ~ 일요일 12:00 ~ 19:00 17:30 라스트오더 제품 소진 시 마감 :-) 제가 갔을땐 다행히도 (!) 모든 디저트가 다 있어서 선택권이 많았던터라 좋았어요ㅎㅎㅎ 여름에 다녀간거라 마도카라는 복숭아가 올라간 디저트가 있는점 참고해주세요 @ 이번 겨울에도 한 번 가줘야 하는데.. 왜냐하면 제가 피스타시에를 사놓고 식당에다가 놓고온 바람에^...^ 먹질 못했거든요 ㅠㅠㅠ흑흑 마들렌과 휘낭시에 그리고 통카 크림브륄레도 있었어요! 저희는 이 중에서 마도카랑 피스타치오 휘낭시에를 먹기로 결정합니다@ 마들렌이랑 휘낭시에 중에 고민하다가 휘낭시에로 골랐던걸로 기억해요 *_* 여름되면 다시 마도카를 맛볼 수 있겠죠? ^_^ 우리나라에서만 맛볼 수 있는 ! 그런 타르트라고 생각이 들었어요 :D 그리고 우리나라나 일본의 디저트가 좀 더 섬세하고 예쁘고 더 비싼게 함정이지만요...^_^;;;;;; 뭐 여튼! 발렁스에서 제대로 디저트를 맛본 날 - 너무너무 행복했었어요❤️ 테이블은 3개 뿐인 - 작은 매장이다 보니까 안에서 먹으려면 웨이팅을 할 수 밖에 없다는게 단점이라 하면 단점일까요? 그래서 대부분 들어오면 포장을 많이해서 가시더라구요~ 복숭아 맛을 제대로 느낄 수 있었던 - 여름의 상큼함과 달콤함을 담아냈던 성수동 발렁스의 마도카 :) 복숭아 마스카포네 샹티 크림과 백도 콩포트 더하기 백도 아몬드크림까지 이것저것 들어갔으니 맛이 없을리가 없죠 :) 크림의 부드러움에 버터뤼하고 맛있는 타르트지도 너무 좋았던 마도카 ! 피스타치오 휘낭시에는 꼬소하고 겉단단 속촉촉한 식감이 좋았어요! 하지만 전 이날 바닐라통카가 너무 좋아서 ㅠㅠㅠㅠㅠㅠㅠㅠㅠ 잊지 못하고 있어요 ㅠ_ㅠ 역시 제 최애 타르트는 바닐라 타르트인가봐요ㅋㅋㅋ 어느 디저트 카페를 가던 바닐라 타르트는 제가 잊지 못하겠더라구요?ㅠㅠ 통카 바닐라 맛이 입안에 확 퍼지면서 이게 진짜 바닐라구나 싶을 정도로 너무너무 맛있었던 발렁스의 바닐라 통카💙 요즘 바닐라빈과 버터 등등 가격이 오르면서 이 가격에서 더 얼마나 올랐을진 모르겠지만요..? 한국 물가 정말 어마무시 해졌단걸 유제품에서 많이 느끼고 있습니다 뚀륵 ㅠ_ㅠ 여튼! 성수동에서 맛있는 프렌치 스타일의 디저트를 즐기고 싶으시다면 - 성수동 디저트 카페 발렁스로 한 번 가보셔요! 가기 전에 인스타그램으로 DM예약하는걸 추천드립니다 :-) 살짝 늦게만 가셔도 디저트가 없을 수 있으니까요!
