title,content
"성수동 숨은 찐감성카페 '어퍼룸' 디저트, 음료, 분위기 맛집!","나만 알고 싶은 아지트같은 성수동 카페 음료에 정성이 느껴짐 어퍼룸 서울 성동구 성수일로12길 21 1층 https://naver.me/FIp45rD8 어퍼룸 : 네이버 방문자리뷰 139 · 블로그리뷰 89 naver.me 입구 감성 인테리어에 홀려서 자연스럽게 들어가게 되는 #upperroom 카페 성수역 1번출구에서 500미터 정도 걸어가면 되는데, 가는길 골목골목 맛집과 숨은 카페가 많아서 구경하는 재미가 쏠쏠하다. 주문하는 카운터에 메뉴판이 있다. 왼쪽은 음료메뉴, 오른쪽은 디저트 메뉴 디저트로 체코 국민 디저트인 #말렌카 6,000원 을 주문했고, 음료로는 #바질토마토에이드 6,800원과 시그니처 메뉴인 #어퍼룸밀크 6,500원을 주문했다. 기다리는 사이 카페의 감성 인테리어를 즐겼다. 평일 늦은 저녁이라 손님들이 거의 없어서 넘 좋았다. 아지트 같은 느낌의 좌식 좌석 벽면 포스터와 크리스마스 느낌의 인테리어와 화분도 너무 이쁘다. 깨알 산타 슬리퍼♥ 벽면의 다른 좌석들도 조명과 갬성이 베리굿. 데이트 하면 조용하게 사랑이 싹틀것 같은♥ 내가 앉은 자리에서 바라보는 정면이 너무 이뻐서 한컷 찰칵 포스터와 아카시아 나무도 넘 이쁘다. 말렌카 레몬맛과 바질토마토에이드, 어퍼룸밀크 바질토마토에이드 진심.. 넘 맛있다. 바질토마토를 그대로 음료로 담은 느낌!! 어퍼룸밀크도 맛나고 말렌카도 촉촉하게 맛있다. 촉촉 푹신 말렌카 케잌 알고보니, 말렌카라는 체코 회사 이름인데 이 케이크를 오랫동안 팔아서 말렌카케익이라 불리는거 같다. 즉 브랜드명이 빵 이름이된 ㅋㅋ 우리의 미원과 같다 ㅋㅋ 인터넷에서 말렌카 케익 살수 있다. 성수역 어퍼룸(upperroom) :: 1. 아지트 느낌의 나만 알고싶은 카페 2. 인테리어, 메뉴, 서비스 모두 뭐하나 빠지지 않음 3. 재방문의사 100% 4. 주차는 가게 앞에 차가 없다면 잠깐 델 수 있음 #성수역카페 #성수어퍼룸 #어퍼룸 #어퍼룸카페 #어퍼룸주차 #성수역주차카페 #성수감성카페 #말렌카꿀케이크 #성수말렌카 #성수분위기카페 #성수카페추천 #성수동카페추천 #upperroom #나만알고싶은카페"
[뚝섬/성수_어퍼룸] 인테리어 예쁜 아늑한 공간 뚝섬역 성수동 카페 어퍼룸,"저번에 회사근처에서 점심먹고 산책할 겸 걷다가 인테리어도 예쁘고 커피도 맛있는 카페를 발견해서 포스팅해요 :) upper room 어퍼룸 50m © NAVER Corp. 어퍼룸 서울특별시 성동구 성수일로12길 21 1층 늘 회사 주변만 걷다가 좀 더 멀리까지 걸어보자 하고 걷는데 베이지톤 건물에 식물들이 놓여져있고 큰 통유리창으로 사람들이 앉아있는 모습이 편안해 보여서 들어갔습니다. 유리문을 열고 들어가면 깔끔한 자갈길이 실내로 이어져 있습니다. 실내는 우드톤으로 인테리어를 해놓으셨더라구요 카페 내부는 생각보다 넓은데 그 이유가 유리로 된 가벽으로 뒷공간을 외부외 차단시켜 좀 더 아늑한 느낌이 들도록 인테리어를 하신 것 같아요. 이게 바로 코지무드♡ 저 라탄 조명들 너무 예쁘지 않나요?? 갖고 싶지만 우리집과는 어울리지 않는 ㅠ 사이드벽에도 아담하게 테이블이 있는데 이런자리 개인적으로 너무 좋아요 ㅎㅎ 카페 곳곳에는 작은 포스터들이 붙여져 있어서 그것마저도 귀여웠어요 완전 취향저격 카페 메뉴를 보니 다소 가격이 있는 듯한 커피 ㅠㅠ 헤이즐넛을 워낙 좋아해서 헤이즐넛라떼 시켰다가 시그니처 커피에서 인절미베이스가 딱!! 눈에 띄어서 어퍼룸 밀크로 변경했습니다 누룽지, 인절미 이런거 좋아하는 늙... 큼큼 자리는 통창으로 외부가 잘보이는 곳에 가서 후다닥 앉았어요 자리에 앉자마자 사람들이 엄청 오더라구요 인기많은 카페인데 나만 몰랐나바... 메뉴가 나와서 받으러 갔는데 시그니처 메뉴들은 마시는 방법을 적어놓은 종이를 같이 주시면서 참고하셔서 마시면 더 좋다고 말씀해주시더라구요 센스있는 사장님이십니다 엄지척! 👍 너무 맛있어 보이는 시그니처 어퍼룸 밀크 마시는 법을 읽고 그대로 맛보는데 진짜 추천드리고 싶은 메뉴에요 달달한 인절미커피 같은게 아니라 콩가루로 고소한 맛이 풍부한 크림이었어요!! 크림자체가 엄청 달지 않아서 가능한 것 같은 느낌 다른 시그니처 메뉴인 어퍼룸 라떼도 맛있다고 하더라구요 아메리카노 살짝 마셔보니 원두자체가 진짜 고소한 향 폭발 산미가 없어서 더욱더 제 취향인 커피맛집입니다. #성수동카페 #카페어퍼룸 #성수어퍼룸 #뚝섬역어퍼룸 #뚝섬역카페 #뚝섬역카페추천 #성수카페추천 #성수동커피맛집 #뚝섬역커피맛집 #인테리어예쁜카페 #예쁜카페 #예쁜카페추천 #맛있는카페추천 #커피맛있는카페 #산미없는커피 #고소한커피"
차분한 분위기의 성수동 조용한카페 어퍼룸,"성수동 카페에서 또 하나의 후보군으로 있었던 성수 어퍼룸에도 다녀와보았는데요 요기도 연무장길 라인이 아닌 1번출구 안쪽에서 주택가라인에 위치해 있었습니다 어퍼룸 서울특별시 성동구 성수일로12길 21 1층 그래서 근처 살지 않는이상 일부러 찾아가지 않는다면 성수에 왔다가 들르기 좋은 위치는 아니었어요 어퍼룸 카페 양옆이나 주변으로도 번화가 느낌의 골목이라기 보다 예전 주택가나 상가느낌에다가 멀리서도 눈에 띄는 간판 등이 있는게 아니라서 길을 잘 보고 찾아가시는게 좋을 것 같아요 성수동 카페찾으면서 사진이나 이미지볼때에는 뭔가 더 깔금한 느낌이었던 것 같은데 ㅠ 제 사진실력이나 구도가 문제인 것인지 생각보다 입구는 약간 가정집 느낌도 났고요 그래서 들어갈까 말까 고민했는데 이 입구를 넘어서면서부터 또 다른 분위기가 펼쳐지는 것 같더라구요 입구부터 또다른 공간에 온것처럼 자갈같은 돌이 깔려져 있고, 조명과 푸릇푸릇한 인테리어에 징검다리같은 돌 발판까지 감성돋는 카페였어요 매장자체는 크지 않았지만 인테리어나 좌석들이 전체적으로 통일감이 느껴지면서 원목위주로 사용되서 뭔가 편안하고 아늑한 느낌이 들었습니다 그리고 완전 원목만 있으면 자칫 올드한 느낌이 들었을 수도 있는데 원목과 화이트 조합에, 따뜻한 조명들이 더해져 좀 더 세련되면서 따뜻한 느낌으로 다가왔던것 같습니다. 요렇게 귀여운 특색있는 자리도 있었는데요 동생이 치마를 입고 온데다 요기가 너무 다른좌석 들이 바라보게 되는 약간 무대같은 공간이라서 앉기에는 조금 부담이 될 수도 있어보였어요 그런데 귀여운매트와 방석, 디테일한 슬리퍼까지! 포토존으로라도 잠깐 앉아보고 싶게 만들어져 있더라구요 성수동카페하면 전체적으로 사람많고 시끄럽고, 북적북적한게 특성인데 성수어퍼룸은 조용하게 대화나누기에 좋은 성수동카페인 것 같아요! https://blog.naver.com/eblovebr0915/222683890039 나무아지트가 포인트인 대형카페 성수 할아버지공장 성수 대형카페 가운데, 대림창고와 마찬가지로 인지도가 있는 카페 중에 하나인 성수 할아버지공장에도 다... blog.naver.com https://blog.naver.com/eblovebr0915/222671628233 성수 대림창고 분위기 좋은 대형카페 성수 데이트나 특색있는 카페하면 많이 언급되는 대림창고인데요. 이번에야 처음 가보게 되었어요! 사실 그... blog.naver.com https://blog.naver.com/eblovebr0915/223026521527 성수동카페 텅 성수 스페이스 깜찍한 이모지케이크와 라떼 성수동카페를 찾다가 오랜만에 텅플래닛에 가려고 했는데, 오랜만에 오니 그새 이름이 바뀌었더라구요! 성... blog.naver.com #성수동카페 #성수카페 #성수역카페 #성수어퍼룸 #어퍼룸 #어퍼룸카페 #성수조용한카페 #성수감성카페 #성수예쁜카페"
"성수동 카페, 전신거울이 있는 신상카페 어퍼룸","안녕하세요. 꾸준히 포스팅을 써보려는 바이요미예요 :) 제 인스타 아시는 분들은 #요미카페투어 해시태그를 많이 보셨을거에요! 앞으로 예쁜 카페 많이 많이 소개해드릴게요! (협찬 없는 내돈내산 카페투어 ㅋㅋ) 성수동에 #바이요미 사무실이 있어서 #성수동카페 를 자주 찾고 자주가는데 사무실 근처에 신상카페가 생겼더라구요! 전 무조건 거울존, 전신거울이 있는곳을 너무 사랑하는데 근처에 생겨버렸!!!! 택배보내로 바로 카페로 달려갑니다 어퍼룸 주소 : 서울시 성동구 성수일로 12길 21 1층 오픈시간 : 11시 ~ 22시 (일요일은 정기휴무) 성수동카페들은 거의 골목 골목에 있어서 찾기가 힘든 곳들이 많았는데 #어퍼룸 은 금방찾으실 수 있을거에요! 유리에 비친 내모습.. 그리고 성수동 카페는 갬성!!!! 입구부터 갬성 넘치는 로고 사진은 뭐니뭐니해도 여백의 미가 중요하쥬?ㅋㅋ 이게 뭐라고 전 찍었.. 어퍼룸 메뉴판 검색했을때 어퍼룸밀크를 너무 먹고 싶었지만.. 다이어트인 관계로 아이스 아메리카노를 주문하고 휘낭시에를 주문했어요! 빵순이는 빵떼기를 지나가지 못하고 멍하니 보다가 동영상까지 찍기 바쁩니다 ㅋㅋ 성수동 카페, 전신거울이 있는 신상카페 어퍼룸 (1) 재생 0 좋아요 0 00:00 00:00  성수동 카페, 전신거울이 있는 신상카페 어퍼룸 (1) 전 평일 오전에와서 사람이 별로 없었어요! 성수동은 주말에 사람이 너무 많지만 평일엔 한가해서 좋아요 :) 성수동 카페, 전신거울이 있는 신상카페 어퍼룸 (2) 재생 0 좋아요 0  접기/펴기 성수동 카페, 전신거울이 있는 신상카페 어퍼룸 (2) 인테리어가 너무 고급스럽고 소품 하나하나 너무 ㅇㅖ쁨.. 그리고 머무는 동안 편안함을 느꼈어요! 전신거울에서는 못찍었지만 아쉬운 마음에 화장실에서 찰칵!!! 사진찍는 동안 커피와 휘낭시에가 나왔어요! 전 무화과 휘낭시에 시켰는데 이거 진짜 맛있어요 ㅠㅠ 겉ㅂㅏ속촉!!!!! 3가지 맛이 있었는데 다음에 다른맛도 꼭 시켜먹어봐야겠어요!!!! 진짜 완전 추천!!! 편안하게 커피한잔하기에 좋았던 곳 어퍼룸"
"[성수동] 조용한 성수 카페, 어퍼룸 UPPERROOM","오랜만에 엄마랑 외출을 했다. 성수동에 예쁜 카페가 생겼다 ~! 어퍼룸 카페 UPPERROOM CAFE 성수동 어퍼룸 서울특별시 성동구 성수일로12길 21 1층 안녕하세요, UPPERROOM 입니다. 빠르게 흘러가는 시대와 그에 맞추어 적응해가는 우리들은 조금의 여유도 느끼지 못할 때가 많습니다. 일상에서의 쉼과 여유와 편안함이 필요한 공간, 그곳을 우리는 UPPERROOM, 다락방 이라고 부르게 되었습니다. 소개 글이 참 예쁜 것 같다. 인테리어부터 뭔가 소개글과 딱 맞는 다락방 같은 분위기 .. 겉으로 봐도 너무 예뻤던 어퍼룸 외부. 빈티지한 분위기가 맘에 들었당 입구가 정원에 들어가는 느낌이 든다🪴 <영업시간> 월,화,수,목,토 11:00 - 22:00 21:30 라스트오더 금 11:00 - 20:00 19:30 라스트오더 정기휴무 (매주 일요일) Next image 메뉴판 (음료 -> 디저트) 카운터에서 주문을 하는데 옆에 컵 선반이 확 눈에 띄었다. 디저트들도 너무 먹음직스러웠다,, 🤤 널찍한 내부 안에도 자리가 더 있다. 여기가 너무 마음에 들었던 이유 중 하나가, 바로 이 의자와 테이블들이었다. 테이블 간격이 너무 붙어있지 않아서 같이 온 사람과 편안하게 얘기를 나눌 수 있었고 전체적으로 조용한 분위기가 좋았다! 우리가 주문한 월넛파이(얼그레이 맛) + 어퍼룸 밀크, 자몽에이드 종이를 보면 라떼 마시는 법이 적혀있당 우왕 UPPERROOM 밀크 후,, 어퍼룸 대표 메뉴라고 하는데 정말 맛있었다. 위에 크림이 진짜,, 부드럽고 촉촉하고 커피랑 너무 잘어울렸다. 인절미 베이스라고 했는데 달콤한 커피맛이 났다. 자몽에이드 엄마가 주문한 자몽에이드 겉으로 봐도 생자몽이 가득가득 시원하고 맛있었다 [성수동] 조용한 성수 카페 어퍼룸 UPPERROOM 재생 0 좋아요 0  접기/펴기 [성수동] 조용한 성수 카페 어퍼룸 UPPERROOM 얼그레이 월넛파이 대망의 월넛파이 살면서 호두파이를 제대로 먹어본 적이 없는거 같은데 .. 정말 맛있었음 위에 호두와 견과류가 잔~뜩 올라가있다. 빵도 전체적으로 촉촉한데 살짝 딱딱한? 식감이 좋았다. 얼그레이 맛 강추 👍 남은 크림은 빨대로 저어서 마셨는데 꾸덕한 커피가 됐다 크림이 정말 많다. 넘 맛있어 냠냠 입구가 너무 예뻐서 또 찍었다 ..ㅋㅋㅋ 엄마랑 오랜만에 카페에서 수다도 떨고 힐링하고 왔다 🍑 포포몬을 통해 서비스를 제공받아 작성된 글입니다. #UPPERROOM#포포몬#포포몬협찬#성수카페#맛집추천 #데이트 #성수동"
어퍼룸 / 코지한 분위기의 성수동 카페,#내돈내산 까페리뷰 성수동은 갈 때마다 바뀌는 곳! @_@ 성수동 안에서도 핫한 스팟들이 약간씩 이동하는 것 같아요 최근에는 서울숲 근처에 갔는데 멋진 사람들도 많고 처음보는 가게들도 엄청 많이 생겼더라고요! 가려고 했던 카페는 대기를 해야한다고 해서 줄서서 기다리는 타입은 아닌 우린 가다가 끌리는 곳 가지 뭐 하면서 재빠르게 계획 변경 그렇게 걷다가 분위기가 좋아보여서 들어가게 된 카페 #어퍼룸 입니다 저는 카페나 레스토랑에 #식물인테리어 가 예쁘고 맘에 들면 대개 만족하는 사람입니다 ㅎㅎ 어퍼룸 입구의 쇼위도를 아주 작은 정원으로 꾸며놓았는데 제가 좋아하는 식물의 모양이라 사진을 찍었어요 북적북적한 스팟과는 약간 떨어져 있는 곳이라고 생각되는데 오히려 조용하고 좋았던 것 같아요! 코지한 분위기의 #어퍼룸 추천 합니다 카페 인테리어 엽서 / 판매하는 건지는 모르겠어요! 입구 따로 떨어진 자리 / 독립적인데 주목받는 자리 올리브 화분 / 코지한 의자 아! 휘낭시에의 작은 크기도 좋았음 #성수동카페 #성수카페
성수동 도장깨기: upperroom(어퍼룸),성수동 뉴페이스 인사드립니다~~ 오늘은 어퍼룸이라는 카페에 가봤어요 ㅎㅎ 매일 11시-22시/ 라스트 오더는 21:30 너무 힐링되는 외관이에요 원래는 교회였던 건물을 카페로 만들었다고 알고 있습니다 뭔가 투박한 거리랑 거리감이 있지 않고 잘 어울리는 느낌이에요 쇼룸을 들어가는 듯 했던... *어퍼룸 크리스마스 버전* 알바분과 사장님이 친절하세요 !! upperroom의 메뉴판인데요 시그니처랑 월넛파이가 유명하더라구요... 저는 카페라떼와 휘낭시에를 시켰습니다... 뭔가 처음부터 시그니처 먹고 싶지 않았어요 이상한 자존심이 발동!! 으악 너무 귀여워... 내가 절대 안 앉을 자리..^^ 내가 절대 안 앉을 자리 2 ^^... 여기는 너무 조명도 집중 돼서 왠지 드라마 한 편 찍어야 될 것 같은... 전체적으로 노란 조명에 아늑한 느낌을 주는 가구로 배치했어요 힐링하러 오거나 책을 읽으러 오는 등 뭔가 여유로운 날에 오면 너무 좋을 것 같아요 제가 그랬거든요 ㅎㅎ 카페라떼는 무난했고요 (뭔가 풍미가 더 좋았으면 좋겠어요... 뭔가 5% 부족한 느낌) 무화과 크림치즈 휘낭시에는 1800원이라 시켰는데 그 이유가 있었어요 ㅋㅋ (사이즈) 뭔가 크림치즈의 맛이 덜해서 그냥 무화과 휘낭시에라고 해도 될 것 같아요 사이즈가 작아 먹기 아까워서 잘라 먹었는데 한 입에 다 넣어야 맛있을 것 같아요... 혼자 chilling 하고 싶을 때 자주 들려야겠어요!!! 추가 : 어퍼룸 라떼 + 기본 버터바 라떼가 너무 단 것 같아요.. 🥲 시그니처이지만 우와! 이런 느낌이 아니라서 조금 실망했어여 버터바는 맛있어요!! 전체적으로 커피에 대한 아쉬움이 큽니다.. 귀여운 산타 받침대 🫠 50m © NAVER Corp. 어퍼룸 서울특별시 성동구 성수일로12길 21 1층
성수동 조용한 감성 디저트 카페 ‘어퍼룸 upperroom’ 추천 !,"어퍼룸 upperroom 📌 주소 서울 성동구 성수일로12길 21 1층 📌 영업시간 월-토 11:00-22:00 일요일 13:00-22:00 라스트오더 21:30 어퍼룸 인스타그램🔽 https://instagram.com/upperroom_coffee_?igshid=NTc4MTIwNjQ2YQ== 어퍼룸(UPPERROOM) | 성수동카페 성수카페(@upperroom_coffee_) • Instagram 사진 및 동영상 팔로워 1,755명, 팔로잉 3명, 게시물 286개 - 어퍼룸(UPPERROOM) | 성수동카페 성수카페(@upperroom_coffee_)님의 Instagram 사진 및 동영상 보기 instagram.com 가봐야지 저장만 해뒀다가 드디어 다녀온 #어퍼룸 성수 살짝 외곽이라 동네가 한적한 느낌 밖에서 봐도 라탄+따뜻한 분위기 입구쪽을 특이하게 꾸며두셨다 약간 어디 동남아 놀러온 느낌 한 구석에 있던 귀여운 오리가족 ... 🐣 🍀 어퍼룸 메뉴판 뭐 먹을지 고민하다가 시그니처 먹어보기 어퍼룸라떼랑 서리태라떼 선택 ! 옆 패드에 메뉴 사진들도 나와 있어서 모르겠으면 사진 참고하기 귀여운 초들이랑 어퍼룸 로고가 담긴 컵들도 판매 중이신듯 자리는 꽤 다양한 편이고 감성카페인데 의자가 푹신한 거라서 너무 좋다 주말인데 사람도 별로 없어서 조용+아늑하니 넘 좋은 ,,, 여기 저기 다양한 식물들이 있는데 카페 분위기랑 너무 잘 어울린다 컵이랑 빨대 외에도 다양한 제품들도 함께 판매 중이었다 모두 카페 분위기랑 찰떡인 것들 우리가 앉은 가장 구석자리 이런 의자 편한데 예쁜 카페 넘 오랜만 ... ✨ 성수 외곽에 있어서 사람이 적었지만 성수 중간에 있었으면 완전 핫플이었을 것 같어 라탄 조명들도 너무 예쁘고 깔끔하고 아늑하게 잘 꾸며진 어퍼룸 왜 여길 건대 떠나기 전에 처음 왔을까 예전에 와봤으면 성수 갈 때마다 갔을 것 같은 카페 카페로고 휴지 사진 모으기 갑자기 헷갈리는데 어퍼룸밀크 아니고 서리태라떼 맞겠지 구경하면서 기다리고 있으니 금방 나온 음료들 카페 이름 달고 있는 음료는 꼭 먹어봐야지 어퍼룸라떼는 얼음이 안들어가는 음료! 그래서 막 차갑지는 않고 시원미지근? 어퍼룸라떼는 젓지 말고 쭉 들이키란다 진한 에스프레소에 우유를 넣어서 커피맛이 세면서도 부드러운 맛 요건 서리태라떼 크림이 생각보다 많이 얹어졌는데 꼬숩긴한데 크림에 약한 사람이라 내입에는 어퍼룸라떼가 더 맛있었다 이건 내가 어퍼룸 오기전에 천원으로 뽑은 귀여운 키링 괜히 커피랑 한 번 담아주고 여기저기 벽에 붙인 포스터들이나 가구, 조명 등 과하지 않게 넘 잘꾸며두셨다 밖이 어두워지니 카페 안 따뜻한 분위기가 더 강조돼서 예쁜 어퍼룸 성수 쪽에는 어느 카페를 가도 너무 붐벼서 정신이 없는데 성수 외곽이라 조용하고 아늑한 분위기가 너무 좋았던 어퍼룸 ! 주말에 방문했는데 자리도 많고 생각보다 사람은 별로 없었다 시그니처 커피인 어퍼룸라떼는 얼음이 안들어가는 커피인 점 참고 시그니처커피들은 양은 적은 편이지만, 편한 의자인데 분위기가 좋아서 수다 떨면서 시간 보내기 너무 좋은 곳 성수쪽에서 조용한 카페 찾는다면 강추 ! 50m © NAVER Corp. 어퍼룸 서울특별시 성동구 성수일로12길 21 1층 #성수카페 #성수카페추천 #성수어퍼룸 #성수라떼맛집 #성수동카페 #성수감성카페 #성수동감성카페 #성수조용한카페 #성수디저트카페 #upperroom #서울조용한카페"
[성수카페] 어퍼룸 분위기 있고 조용한 성수동 카페,"7월 어느 날씨 좋은 날이네요~ 이번에 회사 근처 성수역에서 한산한 카페 한 곳을 찾았어요!! [성수카페] 한적한 곳에 숨어있는 카페 어커_accur 안녕하세요. 민미리민입니다. 오랜만에 성수 나들이! 이번엔 핫한 연무장길이 아닌 한적한 성수동 주택가에... m.blog.naver.com 지난번 어커보다 찾기 쉬운 위치에 있어서 더운데 고생하기 싫으신 분들 여기 추천드려요! /위치 50m © NAVER Corp. 어퍼룸 서울특별시 성동구 성수일로12길 21 1층 지도상으로는 굉장히 멀게 느껴지지만 전혀 그렇지 않습니다.:) 밖에서만 보면 식물이 많아서 꽃집으로 오해할 수도 있어요. 하지만 이곳은 엄연히 카페입니다!! /메뉴 들어가자마자 우측으로 주문하는 곳이 있고 아래 메뉴판이 붙어있어요. 텀블러 할인과 포장 주문이면 500원 할인 있으니 한번 누려보세요~! 저도 텀블러 갖고 가서 500원 할인받았습니다~ 주문하는 곳 바로 옆에 베이커리도 준비가 되어있어요. 저희는 아이스 아메리카노와 우지 말차 밀크 주문한 뒤에 베이커리를 유심히 보는 저를 보더니 같이 간 대리님이 휘낭시에 사주심 포인트 적립도 되니 단골 관리도 잘 될 거 같아요. 저도 신규로 등록해서 이제 여기 갈 때마다 적립할거에용. 음료 준비 중 찍어본 매장 내부 안쪽까지 공간이 많이 있고, 소파 좌석뿐이 아니라 테이블 좌석도 있었어요. 제일 신기했던 건 전시공간같이 보이는 저 좌석. 진짜 앉아도 되는 건가 싶긴 했는데 저기 앉아서 차 마시면 되게 기분 묘할거같아요.ㅋㅋ 저 옆에 있는 집신도 나중엔 신어볼 테야. 안쪽으로 콘센트 좌석도 있어서 앉아서 충전하실 분들은 충전도 가능! 요새 인스타감성 카페는 의자도 불편하던데 어퍼룸카페는 불편해 보이지도 않고 푹신한 쿠션도 있어서 좋아 보였어요. 통창으로 되어있는 곳의 장점인 자연광을 받으려고 저희는 창가 좌석으로 가서 앉았어요. 핸드폰같이 생긴 어퍼룸 진동벨 이거 하나하나 엄청 비싼 가격이라고 들었는데 이런 건 도대체 누가 훔쳐 간대요.... 드디어 나온 아이스 아메리카노와 우지 말차 밀크 그리고 휘낭시에 삼총사 말차 밀크만 따로 빼서 찍어봤는데 친환경 컵홀더도 귀엽고 폼 위로 뿅뿅뿅 올라간 크림이 너무 귀엽데요. 휘낭시에도 너무 귀여웠어요. 한 개에 1800원이어서 가격은 좀 나가긴 하는 거 같지만, 딱 한 입 크기로 나와서 좋더라고요. 특히 휘낭시에 바삭 부분을 제일 좋아하는데 여기 휘낭시에 낮고 작아서 다 바삭 부분! 점심마다 예쁜 카페 찾아다니는데 싱나네용."
