title,content
버터바 추천 성수동핫플 성수카페 | 어퍼룸,"어퍼룸 영업시간 | 월, 수-토 11:00~22:00 화, 일 11:00~18:00 주소 | 서울 성동구 성수일로12길 21 1층 제로페이, 네이버페이, 카카오페이, 페이북 단체석, 와이파이 AHM-BIGDATA-STORAGE :) 외부모습 평일 일찍 놀러 온 성수동. 그럼에도 사람이 많더라. 오늘 방문한 성수동핫플 카페도 사람이 없을 걸 기대하며 갔건만 웬걸? 다들 왜 여기 계시는지? 그래도 내가 앉을 자리는 있어 다행이었다ㅋㅋㅋ 그래서 오늘 리뷰할 곳은 버터바가 맛있는 성수카페 어퍼룸이다. 성수카페 어퍼룸은 외관 디자인부터 깔끔하면서도 차분한 색감이 분위기가 좋은 곳이었다. 밖에도 의자가 있었는데 그건 이미 다른 분이 쓰고 계셔서 찍지 못해 아숩. 문을 열고 들어가면 작고 깜찍한 돌길이 나옴ㅋㅋㅋ 여길 지나면 본격적인 성수카페 어퍼룸 내부가 나온다. 내부모습 내부가 생각보다 널찍하고 테이블 간격이 넓어 좋았는데 그게 사진으로 표가 나는지 모르겠다. 웜화이트한 조명이 주를 이루는데 그래서 살짝 톤이 낮으면서 편안한 분위기를 주었다. 그리고 독특한 게 공간 중간에 이렇게 좌식형 공간이 있더라ㅋㅋㅋ 뭔가 사진 찍기에도 괜찮아 보이는 독특한 구성이었다. 셀프바도 그렇고, 곳곳들을 비지 않게 꼼꼼히 꾸며놓으신 태가 났다. 이렇게 한편에 무언가를 전시한 공간도 있었는데, 굿즈를 파시나?해서 가보니 물론 굿즈도 있지만 독특하게 친환경 제품들도 판매하시고 계시더라. 친환경 제품에 관심이 있지만 어디서 사야 할 지 모르는 분들이 사기 좋아 보였다. 우리는 왼쪽 사진에 구석자리에 앉음 ㅎㅎ 성수카페 어퍼룸은 화장실도 내부에 있었는데 친구 말로는 깔끔하고 괜찮았다고 한다. 메뉴판 어퍼룸 메뉴판. 이날 더워서 아이스아메리카노 한 잔과 시그니처 메뉴 중 서리테라떼를 시켰고, 디저트는 플레인 버터바를 시켜봤다. 패드를 통해 음료 모습을 확인할 수 있어 더 쉽게 고를 수 있었던 거 같다. 카카오페이, 네이버페이, 페이북 결제도 가능해서 편해 보이더라. AHM-BIGDATA-STORAGE :) 아이스 아메리카노 | 4,600원 서리테 라떼 | 6,700원 플레인 버터바 | 5,200원 AHM-BIGDATA-STORAGE :) 메뉴후기 짠 메뉴 나옴. 세팅도 딱 정갈한 느낌으로 나왔다. 독특하게 빨대 길이가 다르더라. 알고 보니 서리테라떼 컵 높이가 낮아서 빨대를 잘라서 주셨다. 티스푼도 서리테라떼 용인 거 같았다. 딱히 니꺼내꺼 없이 셰어해서 먹는 편이라 조합을 딱 좋게 시킨 거 같다. 서리테가 약간 텁텁할 수 있는 데 그걸 아메리카노가 중화시켜주는 듯. 서리테라떼는 순전히 어떤 맛일까 궁금해서 시켜본 음료였다. 마셔본 바로는 일단 밑에 베이스는 흑임자라떼 같은 건 줄 알았는데 묘하게 달랐다. 엄청나게 고소한 느낌인데 이게 서리테콩맛이구나 싶었음. 친구는 콩국수 국물 맛이 난다고 했다. 좋은 의미임. 근데 이게 위에 크림이랑 같이 먹으니 조합이 좋더라. 크림이 엄청 되직하고 응집력이 좋다고 그러나. 그래서 입에 몽글하게 들어오고 구멍도 잘나서 음료랑 같이 마시기 편했다. 친구는 크림에서 유가사탕, 말랑카우 맛이 난다는데 크림에 연유를 섞으셨나? 아무튼 미숫가루 같은 곡물라떼 좋아하시면 맛있게 드실 듯싶다. 아메리카노는 진하고 고소하니 맛있었다. 신맛 없는 아메리카노 좋아하시면 추천. 더워서 아이스 아메리카노가 더 맛있게 느껴지기도 하고ㅋㅋㅋ 서리테라떼의 텁텁함을 풀어주기도 해서 좋았다. 마지막으로 버터바. 버터바는 친구도 나도 처음 먹어봤다. 어쩌다 보니 성수동핫플 어퍼룸이 우리의 버터바 기준점이 되어버림. 버터바 추천 성수동핫플 성수카페 어퍼룸 재생 5 좋아요 0 00:00 00:26  접기/펴기 버터바 자르는 중 버터바라고 해서 부드럽고 눅눅한 재질일까? 했는데 아니었다. 딱딱하고 단단한 느낌. 그래서 칼로 썰 때 퍽퍽 썰게 됨ㅋㅋㅋ 네모네모. 버터바 처음 먹어봤는데 아 이런 맛이구나~ 싶었다. 뭔가 소보로 제일 맛있는 부분만 모아둔 느낌? 바작바작한 식감이 좋았다. 친구는 되게 맛있는 타르트지 맛이 난다는데 그 얘기 듣고 맞다 싶었다ㅋㅋㅋ진짜 타르트지 맛이 남. 이름만 듣고 느끼할 거 같아 그동안 굳이 찾아먹지 않았는데 편견이었다는 결론. 맛있었다. AHM-BIGDATA-STORAGE :) 정리하자면, 성수동핫플 어퍼룸은 차분한 분위기에 시끄럽지 않은 카페를 찾으신다면 추천한다. 좌석들도 많고 간격도 넓은 편이라 편하게 쉬다 갈 수 있는 느낌이라 좋았다. 이미 나 말고도 다들 아시는 집 같지만ㅋㅋㅋ 어쨌든 추천추천. 그럼 오늘 어퍼룸 리뷰 끝! 안녕! 50m © NAVER Corp. 어퍼룸 서울특별시 성동구 성수일로12길 21 1층 #성수카페 #성수디저트 #성수디저트카페 #성수커피 #성수맛집 #성수카페추천 #성수디저트맛집 #성수감성카페 #성수버터바 #성수동핫플"
성수 카페 어퍼룸 : 아늑한 성수동카페 추천,"성수 카페 어퍼룸 성수동 카페 추천 오늘 소개해드릴 곳은 다락방처럼 아늑한 분위기를 가지고 있는 어퍼룸 (Upper Room) 이에요. 성수 카페 매장은 성수역 1번출구에서 도보 8분 이내 거리에 위치해 있어요 🚶🏻‍♂️ 친구와 저녁을 먹기 위해서 만났는데, 마침 브레이크타임에 걸려서 기다릴 겸 커피 한잔하러 찾아오게 되었어요 ! 성수동카페 영업시간 오전 11시부터 오후 10시까지 휴무없이 매일 운영하고 있어요. 라스트오더 9시 30분 이전까지 방문하면 언제든 맛있는 커피와 디저트를 먹을 수 있답니다. 흰색 벽돌 건물 1층에 있는 어퍼룸은 골목의 분위기와 잘 어울리는 깔끔한 외관을 가지고 있었어요. 간판은 따로 없고 매장 앞에 작은 입간판이 하나 세워져있어요. 안으로 들어오면 입구에 자갈과 돌길이 깔려있어서 도심 속 휴양지로 들어서는 느낌이 들기도 했어요 대형 거울도 놓여있어서 포토존으로 이용하시는 손님이 많이 계시더라구요 입구 왼쪽에는 통창을 통해 밝은 햇살이 들어오는 채광 좋은 자리가 있었어요 곳곳에 화분도 놓여져 있고 라탄 소재 소품도 놓여있어서 사장님의 취향을 오롯이 반영한 감성적인 분위기의 성수 카페였어요 성수동카페는 천장도 높고 공간도 넓어서 쾌적했어요 우드톤 테이블과 아늑한 조명 덕분에 따뜻함이 잘 느껴지는 공간이었어요 성수동카페 의자는 푹신푹신한 방석이 있어서 기대어 편하게 쉴 수 있는 점이 좋았어요 오래 앉아있어도 불편하지 않아서 좋더라구요 매장이 넓은 만큼 공간 하나하나 다양하게 꾸며져 있는 모습을 볼 수 있었는데요 더 안쪽으로 들어가면 큰 테이블이 있어서 여러명이서 와도 넉넉하게 앉을 수 있어요 테이블이 전체적으로 낮은 편이라 작업하기는 힘들겠다고 생각했는데 둘러보니 구석에 노트북 할 수 있는 좌석이 딱 하나 있었어요 다락방이라는 이름에 걸맞게 좌식 테이블도 있더라구요 감각적인 인테리어로 꾸며져 있어서 공간을 둘러보기만해도 즐거웠어요 손님들이 많아서 안쪽에 자리를 잡고 주문하러 카운터로 슝슝 달려갔답니다 카운터 주변에도 어퍼룸 상호가 적힌 엽서나 소품이 많이 배치되어 있어서 이곳만의 정체성을 더욱 확고하게 나타내주고 있었어요 ㅎㅎ 성수 카페 메뉴는 커피와 수제청 에이드, 논커피, 시그니처 메뉴로 구성되어 있어요 메뉴판 옆에 베스트라고 적혀있어서 인기메뉴를 먹어보기로 결정했어요 ~ 월넛파이와 휘낭시에가 맛있다는 후기가 많아서 기대했었는데요 애매한 시간에 방문해서 그런지 디저트 메뉴는 솔드아웃이 많았어요 어떤 메뉴를 먹을지 고민된다면 메뉴판 옆에 태블릿이 있으니 사진을 참고해서 주문하셔도 돼요 잠시 뒤 주문한 메뉴들이 나왔어요 꺄 너무 예쁘지 않나요 !! 노란색 쟁반에 올려져있는 메뉴들이 너무 먹음직스러워보여서 인증샷을 찰칵 찍었답니다 UPPERROM 밀크 (6,700원) 어퍼룸의 대표메뉴 중 하나로, 위에 쫀쫀한 크림이 올라가 있는 인절미 베이스의 고소한 라떼에요 먼저 섞지 않고 그대로 한입 마셔봤는데 달달하고 부드러운 크림이 먼저 느껴졌어요 이어서 컵을 좀 더 기울여 커피를 마셨는데요 에스프레소 샷이 들어간 고소한 라떼였어요 산미 없는 원두라 딱 깔끔하더라구요 저는 우유맛 많이 나는 라떼를 좋아해서 저에게는 좀 진하게 다가왔어요 ㅎㅎ 찐한 라떼 좋아하신다면 맘에 드실거에요 ! 게다가 인절미 베이스라서 콩고물 특유의 고소함이 같이 느껴졌어요 위에 있는 크림도 느끼하지 않고 커피와 잘 어울려서 맛있게 먹었답니다 곳곳에 놓여있는 화분과 잘 어울리는 싱그러운 비주얼을 가지고 있었던 바질토마토에이드 (6,800원) 사실 이건 요즘 핫한 카페에 하나씩 있는 대중적인 메뉴로 겉보기만 예쁜 음료라고 생각했거든요.. 근데 어퍼룸 바질토마토에이드는 이런 편견을 와장창 깨트려주었어요 한입 마셔보고 너무 맛있어서 우와!!! 감탄하면서 눈이 땡그래졌어요 바질의 향과 반건조 토마토의 상큼함, 시원한 청량함까지 가득 담은 아주 맛있는 성수 카페 에이드였어요 그동안 카페 많이 다녀봤는데 여기 바질에이드는 진짜 제대로에요 꼭 꼭 드셔보셨으면 좋겠어요 바질도 가득 들어있어서 진한 허브향이 느껴졌고 같이 제공해주시는 수저로 토마토를 퍼 먹으면 입안 가득 달달하고 청량한 기운이 가득 차요 토마토는 촉촉하면서 쫀득쫀득 식감인데 정말 맛있었어요.. 취향저격 말란카 (6,000원) 마치 떡같은 식감으로 푹신푹신하게 즐길 수 있는 꿀케이크 디저트에요 코코아, 레몬 두가지 맛이 있는데 저는 상큼한 걸 좋아해서 레몬으로 pick ! 나이프로 쓱싹쓱싹 잘라보니 겹겹이 쌓여있는 단면이 보였어요 사이사이 꿀이 레이어드되어있어서 쫀득함과 달달함 두가지를 동시 맛볼 수 있는 디저트에요 ! 말란카 좋아하는데 오랜만에 먹으니 더욱 맛있어서 흡입했답니다 ㅎㅎ 아늑하면서도 쾌적한 분위기 속에서 정말 맛있는 바질토마토에이드를 즐길 수 있었던 성수 카페 어퍼룸 ! 바쁜 일상속에서 커피 한잔의 여유가 필요하신 분들에게 성수동카페 추천 드리고 싶어요 ☕️ 성수 카페 주소 : 서울 성동구 성수일로1길 21 / 1층 전화번호 : 0507-1329-1726 단체석, 포장, 와이파이 성수 카페 어퍼룸 : 아늑한 성수동카페 추천 재생 9 좋아요 0 00:00 00:15  접기/펴기 성수 카페 어퍼룸 : 아늑한 성수동카페 추천 50m © NAVER Corp. 어퍼룸 서울특별시 성동구 성수일로12길 21 1층"
"성수동 성수역 서리태 라떼가 이색적인 카페 추천, 어퍼룸 (UPPER ROOM)","안녕하세요, 비쥬입니다! 요새 날씨가 정말 무덥죠ㅠㅠ 집에 있으려니 너무 덥고 마침 성수동 근처에서 약속도 있던터라 근처 카페에서 시간을 보내면서 책도 읽고 아늑한 시간을 보냈어요!! '어퍼룸'은 자주 가보지 않았던 골목쪽에 있지만 조용하고 인테리어가 너무 예뻐서 뭔가 자주 가게 될것 같은 곳이네에요💛 #어퍼룸 #성수어퍼룸 #어퍼룸서리태라떼 #성수휘낭시에맛집 #성수디저트추천 <위치정보> 50m © NAVER Corp. 어퍼룸 서울특별시 성동구 성수일로12길 21 1층 매일 11:00 - 22:00 / 21:30 라스트오더 출처: 네이버 업체정보 성수 어퍼룸의 외관이에요ㅎㅎ 카페 외관이 통창으로 되어 있고 내부의 노란 조명이 뭔가 더 갬성적인 분위기를 내는듯하네용! 오기전에 먼저 찾아봤었는데, 사진으로 봤던것 보다 실제로 보니까 훨 예뻤어요 성수역 1번 출구에서 500m 정도 떨어져있고 도보로는 5분정도 걸린것 같아요ㅎㅎ 저는 동네여서,,,택시를 타고 이동했는데 날씨 선선해지면 꼭 택시비 아끼렵니다ㅠㅠ 가게 앞에 초록초록한 식물들도 잔뜩 놓여있어서 보기만해도 덩달아 기분이 좋아지는 것 같네요💚 문을 열고 내부로 들어가면 외부의 식물들이랑 더욱 잘어울리는 초입구가 나옵니당ㅎㅎ 흐흐 저는 자연 너무 좋아 사람으로서 카페 첫인상부터 이러면,,, 단골 각이잖아요💛 자갈로 되어 있어서 더욱 자연자연한 분위기가 연출되는것 같아요ㅎㅎ 자갈 밟을때 나는 소리도 너무 힐링되고 좋더라구요 바로 왼편에 음료 주문할 수 있는 곳이 있어요! 우드톤의 인테리어가 가게 내부 분위기랑 너무 잘어울리는 듯 해요 왼쪽에 격자무늬의 장이 있었는데 어퍼룸이 적혀있는 컵들이 있었구용! 판매하시는 컵인듯 했어요ㅎㅎ 나중에 집을 꾸미게 된다면 저렇게 컵을 두고 싶네요 뭔가 세련된 느낌이랄까요? 각종 디저트도 팔고 있어서 축하초도 있었어요! 귀여운 하트초랑 스마일초ㅠㅠ 저런 초로 생일 축하 받으면 넘 기분 좋을것 같아요 어퍼룸의 로고가 있는 스티커도 깨알로 있었어용ㅎㅎ 저도 다이어리에 붙이기 위해 하나 챙겼답니당 색도 두가지여서 더더더 좋네요! 가끔씩 카페에 가면,,뭔가 글로는 음료를 이해하기가 힘들때가 있잖아요! 저도 서리태 라떼가 어떤건지 너무 궁금했었는데 옆에 태블릿으로 음료의 사진을 직접 보여주시니 너무 좋더라구요!! 직원분도 친절하게 대해주셔서 제 입맛에 딱 맞는 음료를 고를 수 있었어요😊 제로페이 카카오페이 네이버페이등 각종 온라인 결제도 가능하니 두손 편하게 지갑 없이 와도 되겠어요!! 포인트 적립도 가능한데, 심지어 5%라니요! 단골이 된다면 포인트 모으는 재미가 쏠쏠하겠는걸요?ㅎㅎ 저는 저의 할미 입맛을 저격한 서리태라떼랑 월넛파이가 유명하다고 해서 시켜보았습니당ㅎㅎ 여긴 휘낭시에도 굉장히 유명한편인데 화목토 3일만 나오니 참고 부탁드려요! 내부 자리는 좌석간 간격이 넓어서 굉장히 쾌적했구요! 특히! 저 통창으로 밖이 보이는 자리 너무 탐나더라구요ㅎㅎ 다른 자리 앉았다가 비는 틈을 타 자리 옮긴것은 안비밀입니다😎 한옥을 연상시키는 좌식 테이블도 있구요! 뭔가 차를 마셔야할것 같은 분위기에요ㅎㅎ 음료를 기다리면서 카페를 구경하는데, 이렇게 굿즈?를 파는 공간도 있더라구요! 팟 브러쉬와 고체향수 등등 주방 용품과 향 관련 물품들을 주로 파시는듯 했고 저 팔로산토는 처음보는데 천연 인센스라니,,,너무 궁금했어요!! 들고 있기는 뭐해서,,,집갈때 사려고 했는데 까먹어 버린 저,,,, 또한번 갈 명분이 생겼습니다ㅋㅋㅋㅋㅋ 오리진 멀티밤도 굉장히 유명한데 팔고 있더라구용ㅎㅎ 저 쓰는 멀티밤 다 쓰면 하나 업어와야겠어요! 친환경적인 요소들도 굉장히 많았는데요! 다회용 빨대랑 세척솔도 있었고 근데 가격도 2천원, 1천원으로 굉장히 저렴해요 카페이지만 눈이 돌아가네용ㅎㅎ 흐흐 이렇게 소소한 소품 구경 하는 맛도 있어요! 좌식 좌석 앞으로 이렇게 푹신한 의자의 테이블들이 놓여있어서 저는 여기 앉았어요!! 테이블의 높이가 노트툭하기에는 낮은 편이지만 의자가 푹신해서 좋더라구요 바로 옆에 노트북 하기 좋은 테이블도 따로 있으니 여기서 조용하게 재택이나 공부하기도 너무 안성맞춤인것 같네요!! 카페의 분위기가 굉장히 조용하고 bgm도 잔잔한 노래로 나오는 편이였어요 서리태 라떼랑 월넛파이, 저의 달달함을 달래줄 녹차까지 같이 나왔어요! 티백이 오래 우러나면 떫어질 수 있기 때문에 뺄 수 있는 그릇을 따로 주신것도 너무 좋네요ㅎㅎ 제 최애 픽,,, 진짜 할미 입맛의 취향을 딱 저격한 서리태 라뗴 소개드려요ㅎㅎ 위에는 부드러운 크림에 아래는 굉장히 고급진 서리태 우유에 고소하고 부드러운 샷을 합친 맛이랄까요? 흑흑 진짜 백번의 말보다 한입이라고 어퍼룸 혹시 방문하신다면 서리태 라떼 완전 강추입니다👍👍 월넛 파이는 녹차 초코 얼그레이 플레인등 여러가지 맛이 있는데 저는 그중에서도 얼그레이를 골랐어요! 약간 호두파이 식감도 나는게 아래의 파이지 부분에 얼그레이 향이 은은하게 나고 또 그냥 호두파이보다는 덜 딱딱하고 부드러워서 정말 커피랑 찰떡 궁합인 메뉴였습니다ㅎㅎ <총평> 💛💛💛💛💛 (하트5개) 성수동은 와도와도 질리지가 않는게 골목에 이런 숨겨진 카페나 맛집들이 너무나도 많아서 그런것 같아요ㅎㅎ 요새 뭔가 맘에 확 들만한 카페를 못찾곤 했는데 성수하면 어퍼룸,,! 단골 등록입니다 다음에는 휘낭시에 나오는 요일을 노려서 휘낭시에에 아아메 한잔 하고 와야겠어요! 남자친구도 거의 끝나갈때쯤에 잠시 들렸었는데, 가게 분위기가 너무 좋다고 다음에 꼭 같이 오자고 하더라구요ㅎㅎ 오늘도 행복 가득한 하루 되세요❤ 감사합니다."
성수동 성수역 1번 출구 디저트 케이크 맛집 감성카페 @어퍼룸 upperroom,"Next image 성수동 성수역 1번 출구 디저트 케이크 맛집 감성카페 어퍼룸 upperroom 맛있는 여행 블로거 효크입니다. 성수역 감성카페 어퍼룸에 다녀왔어요. 지하철역을 오가며 '언젠가 가봐야지'를 10번은 넘게 말한 거 같은데 드디어 방문하게 되었네요 ㅎㅎ 어퍼룸은 분위기 좋은 카페인 건 알고 있었는데 직접 들어가보니 생각했던 것보다 훨씬 깔끔하고 따뜻한 분위기의 카페였어요. 인테리어 못지 않게 음료와 디저트도 정말 맛있었구요. 이건 비밀인데 앉은 자리가 너무 편해서 움직이지 않고 더글로리 2편이나 봤네요^^ 그럼 각설하고, 오늘의 주인공 어퍼룸. 바로 소개해드리겠습니다. 어퍼룸 upperroom 주 소: 서울 성동구 성수일로12길 21 1층 전화번호: 0507-1329-1726 영업시간: 월 - 토: 11:00 - 22:00 (라스트오더: 21:30) 일요일: 13:00 - 22:00 (라스트오더: 21:30) 50m © NAVER Corp. 어퍼룸 서울특별시 성동구 성수일로12길 21 1층 웨이팅 / 대기명단 카페 입구에 대기자 명단이 있었어요. 다행히 제가 갔을 때는 자리가 있어서 기다림없이 들어갈 수 있었네요. 유동인구가 그렇게 많은 골목이 아니라 손님이 별로 없을 줄 알았는데 웨이팅까지 할 정도인 거 보면 인기가 많은 곳인 거 같네요. 코 앞에 유명한 곳을 왜 이제서야 오게 된 걸까요 ㅎㅎ 테이블 매장 안쪽 자리는 사람들이 많아서 입구쪽에 자리를 잡았어요. 4인석 기준 자리인데 사장님께서 앉아도 된다하셔서 매장에서 제일 편안하고 쾌적한 자리에 앉게되었네요 ㅎㅎ 사장님 덕분에 정말 편안하게 쉬다가 간 거 같아요. 감사합니다 ^^ 메뉴판 카운터 앞쪽으로 심플한 메뉴판이 놓여져있어요. 디저트류는 테블릿 pc에 사진이 따로 있었는데 깜빡하고 사진을 못 남겼네요. 어쩔 수 없죠. 다음에 방문할 때 사진 찍어서 포스팅 수정해야겠어요 ㅠㅠ <Order> 아이스 아메리카노 (4.6) 바질토마토 에이드 (6.8) 말렌카 코코아 케이크 (6.0) 음료는 베스트메뉴라고 적혀있는 바질토마토 에이드와 시원한 아메리카노를 주문했어요. 디저트는 커피를 마시다 보니 배가 살짝 출출해서 뒤늦게 주문했어요 ^^ 진동벨 주문을하면 귀여운 진동벨을 주신답니다. 기분 좋게 진동벨 번호가 1번이네요. 진짜 TMI지만 제가 2번째로 좋아하는 숫자가 1이에요. 제일 좋아하는 숫자는 3 ㅎㅎ 안 궁금하셔도 알아주세요 ^^ Next image 내부 (카페주방) 주문한 메뉴를 기다리며 어퍼룸 내부를 구경했어요. 카페 주방은 힙하면서도 조명과 햇살 때문인지 따뜻해보였어요. 보고만 있어도 마음이 편해지는 느낌? ㅎㅎ Next image 내부 (카페 인테리어) 매장 안쪽은 힙한 주방과 다르게 엄청 차분한 느낌? 테이블 간격도 넓어서 답답해보이지 않았어요. 그리고 전반적으로 인테리어가 제가 좋아하는 우드톤이라 너무 맘에 들더라구요. 평일 오후나 주말 한적한 시간에 여기서 커피마시면서 책 읽으면 힐링 제대로 될 거 같네요 ^^ 좌식 테이블 한쪽에는 좌식테이블도 있었어요. 자리가 비어있었어서 앉아도 되는 곳인지는 모르겠네요. 아마 여기 앉으시면 손님들의 시선을 한몸에 받을 수 있을 거 같네요. 저는 그냥 사진만 찍고 지나가겠습니다 ㅎㅎ 소품 매장 곳곳에 감성이 느껴지는 소품들도 놓여져있었어요. 조명과 잔 그리고 카드만으로도 이런 따뜻한 분위기를 낼 수 있다는게 놀랍네요 ㅎㅎ 아이스 아메리카노 / 바질토마토 에이드 말렌카 코코아 케이크 주문한 음료가 나왔어요. 아쉽게도 디저트 케이크는 뒤늦게 시켜서 음료와 같이 찍은 사진이 없네요. 트레이 색감 너무 이뻤는데 제가 실물을 잘 못 담은 거 같아 속상하네요 ㅠㅠ 그럼 이제 메뉴 하나하나 살펴볼까요? 아이스 아메리카노 (4.6) 제가 주문한 아이스 아메리카노는 평범한 맛이었어요. 저한테는 좀 연하게 느껴졌어요. 살짝 더 찐했으면 좋았을 거 같지만, 산미가 거의 없고 고소한 풍미가 잘 느껴져서 맛있게 먹었어요. 바질토마토 에이드 (6.8) 바질토마토 에이드는 베스트 메뉴인 이유가 있었어요. 뭔가 중독되는 맛이 있더라구요. 토마토의 달달함이 느껴지면서 은은하게 바질향도 잘 느껴지고 ㅎㅎ 굳이 흠을 잡자면 탄산이 저한텐 좀 약하게 느껴지더라구요. 탄산이 좀만 더 강했으면 완벽했을 거 같아요 ^^ Next image 말렌카 코코아 케이크 (6.0) 이웃님들 '말렌카 케이크' 들어보셨나요? 테블릿 pc에 있는 사진을 보고 처음에 시루떡인줄 알았어요 ㅎㅎ 근데 알고보니 겹겹이 쌓인 케이크더라구요. 무튼 말렌카 코코아 케이크는 주문 안했으면 큰일날 뻔 했어요. 최근 맛본 디저트 중에 제일 맛있었어요. 빵 자체가 엄청 쫀득하더라구요. 크림도 자극적이지 않아서 질리지 않더라구요. 솔직히 혼자 2개는 거뜬하게 먹을 수 있을 거 같아요. 혹시나 어퍼룸 방문 계획있으신 분들은 말렌카 꼭 드셔보세요 ^^ 효크의 친절한 한마디) 말렌카 코코아 강추. 효크의 러프한 한마디) 남자 화장실이 밖에 있음. 성수에 있는 웬만한 카페는 다 가봤는데 디저트 케이크는 여기가 제 입맛에는 제일 잘 맞았던 거 같아요. 분위기도 차분하고 전반적으로 거슬리는 거 하나 없는 곳이었어서 앞으로 자주 방문할 거 같아 회원가입도 하고 왔어요 ㅎㅎ 이웃님들도 성수에 놀러오셨을 때 어퍼룸에서 맛있는 디저트와 음료 드시고 가세요 ^^ 이상으로 효크의 성수동 성수역 1번 출구 디저트 케이크 맛집 감성카페 어퍼룸 upperroom 방문후기 마치겠습니다. 감사합니다. 성수동 성수역 1번 출구 디저트 케이크 맛집 감성카페 어퍼룸 재생 0 좋아요 0 00:00 00:00  접기/펴기 성수동 성수역 1번 출구 디저트 케이크 맛집 감성카페 어퍼룸"
