title,content
"[카페 추천] 성수동 카페 버니타운 : 뚝섬역 카페, 서울숲 카페, 성수동 디저트 맛집, 성수동 갈만한곳","버니타운 서울 성동구 서울숲2길 15-12 1.5층 50m © NAVER Corp. 버니타운 서울특별시 성동구 서울숲2길 15-12 1.5층 서울숲 카페거리에 위치한 카페 버니타운에 다녀왔어요 서울숲역, 뚝섬역에서 3분거리에 있었어요 요즘 이쪽골목에 예쁜 카페들이 정말 많더라구요 이곳은 건물 2층에 위치해있는데 저 아기자기한 외관의 토끼그림과 주황천막이 있는 곳이 바로 버니타운이랍니다! 계단을 통해 2층으로 올라오시면 이렇게 문이 있어요! 크리스마스 시즌이라 그런지 크리스마스느낌의 소품들로 꾸며져있네요 이런거 보면 정말 연말이구나 실감하게되는😇 입구엔 트리도 있었는데 예쁘더라구요 그리고 트리와함께 전신거울도 있는데 포토존인듯했어요 내부는 약 10팀정도 들어갈수있을정도로 생각보다 컸는데 한켠엔 좌식자리도 있었고 일반 테이블도 있고 신기한 구조였어요 좌식자리엔 다른분들이 앉아계셔서 찍진않았답니다 내부에도 조명과 꽃 캔들 인형 등등 다양한 소품들 활용해서 꾸며두셨어요 빈티지스러우면서도 아늑해서 따뜻한느낌! 소품배치 잘하는사람들 신기해요 저는 어째 이리놔도 저리놔도 맘에 안들어서 망하는ㅋㅋㅋㅋㅋ 이거보니 겨울맞이 인테리어 하고싶네요 저희는 평일에 방문해서 착석할 자리는 바로 있었어요 메뉴 버니타운의 메뉴입니다 이곳은 쌀가루로 만든 디저트를 비롯한 다양한 케이크를 판매하고있었어요 케이크가 아기자기하고 넘나 예뿐,,🧡 그리고 음료도 다른 카페들에 비해 논커피 메뉴가 진짜 다양해서 좋더라구요 커피 잘 못드시는분들은 이곳에서 다양한 에이드와 밀크티, 티들 드셔도 좋을것같아요 사장님이 메뉴개발을 열심히하시는 너낌 케익을 판매해서 그런지 이렇게 한켠에는 다양한 초들도 판매하고있었어요 요즘 정말 예쁜초가 많은것같아요ㅎㅎ 이곳 케이크 먹어보았는데 너무 맛있었어서 지인들 생일때 홀케이크 주문해도 좋겠더라구요 케이크 주문하면서 예쁜초도 겟하려고요 저희는 아메리카노와 히비스커스에이드 그리고 샤인머스켓케이크를 주문했습니다 음료도 전반적으로 맛있었는데 케이크가 진짜!! 넘 맛있었어요 ㅋㅋㅋ 한입먹고 띠용.. 아니 쌀케이크래서 건강한맛(이라고 말하고 밀가루보다 맛없는?)일줄알았는데 존맛탱이던데요? 생크림도 우유맛나는 신선한 크림이고 중간에 들어간 샤인머스켓도 일반청포도 아니고 찐샤인머스켓인것같더라고요 음료도 비쥬얼 예쁘죠 😆 빨대도 센스있게 하트빨대를 주셨는데 귀여웠어요 사소한 디테일들이 예쁘고 귀여웠던 버니타운 후기였습니다 크리스마스 케이크 구매해도 좋을것같은 디저트 맛집이고 성수동, 서울숲 카페 찾으시는 분들께도 추천드려요! 휴무일이나 케이크 주문 관련 문의는 버니타운 인스타 참고하셔요! 버니타운/bunny town(@bunny_town12) • Instagram 사진 및 동영상 팔로워 395명, 팔로잉 92명, 게시물 430개 - 버니타운/bunny town(@bunny_town12)님의 Instagram 사진 및 동영상 보기 instagram.com #성수동카페 #성수역카페 #성수카페 #성수카페추천 #카페추천 #신상카페 #뚝섬역카페 #성수버니타운 #서울숲카페 #뚝섬역케이크 #서울숲케이크 #크리스마스케이크 #성수디저트 #디저트맛집"
"[뚝섬역카페]버니타운, 뚝섬역 카페,성수동 갈 만한 곳(유기농쌀로만든 수제케이크 맛집)","#뚝섬역맛집 #뚝섬역카페 #성수동갈만한곳 #성수동 #뚝섬역 #카페 #카페추천 #성수동카페 [뚝섬역카페]버니타운, 뚝섬역 카페,성수동 갈 만한 곳(유기농쌀로만든 수제케이크 맛집) 뚝섬역카페 버니타운에 다녀왔어요. 버니타운이라는 이름이 왜 버니타운인가 했는데 아니 버니그림이 눈에 딱 띄더라구요. 입구부터 버니 그림에 눈이 사로잡혀 버렸답니다. 카페여서 특별하게 기대를 하고 가지 않았는데, 입구부터 보이는 생화들로 정말 황홀 그 자체였어요~ 성수 버니타운 영업시간 12:00~21:00 매주 월,화 휴무 전화번호 0507-1377-5731 위치 서울 성동구 서울숲2길 15-12 1.5층 50m © NAVER Corp. 버니타운 서울특별시 성동구 서울숲2길 15-12 1.5층 케익이 들어 있는 쇼케이스에 생화로 장식 된 것이 너무 너무 예쁘더라구요~ 매장이용시 1인 1음료 주문 입니다. 생망고 케이크고 눈을 사로잡았어요. 생망고가 가득 들어 있고 그 위에 꽃장식도 너무 예뻤답니다. 저는 바닐라 라떼 따듯한것과, 복숭아 살구 에이드를 먹었어요.ㅎㅎ 보통 복숭아살구 에이드는 잘 판매 하지 않는데, 이 곳에는 특별한 메뉴가 있더라구요. 그래서 냉큼 시켰답니다. 그리고 케이크도 하나 주문했는데요, 티라미수를 주문했어요. 켜켜이 쌓여 있어서 달달하니 맛있었어요. 그 외에도 수제청 베이스로 한 에이드류도 눈에 띄었어요. 자몽,패션후르츠,히비스커스,망고,블루레몬,핑크레몬,애플레몬 다 제가 좋아하는 논커피류 에이드에요 ㅠㅠ 그리고 여기 메뉴판은 손글씨로 되어 있는데요, 글씨가 넘넘 예쁘셔서 다른 메뉴판이 따로 필요 없더라구요. 다양한 초들이 티비되어 있고 티 코스터도 만든것을 팔고 있더라구요. 귀여운 소품들이 많아서 너무 갖고 싶었습니다..ㅠㅠ 커피에 라떼 아트도 어쩜 이렇게 이쁘게 해 주셨는지. 하트가 도대체 몇개죠~ ㅎㅎ 복숭아 살구 에이드에 꽂혀있는 빨대는 하트모양 빨대였어요 ~ 너무 귀여워가지고 사진도 한번 찍어보았죠 ㅎㅎ 버니타운에서는 밀가루가 아닌 쌀로만 만든 수제케이크, 글루텐 프리인 케이크를 판매중이었어요. 국내산 쌀, 유기농으로 만든 케이크라서 정말 부드럽고, 좋았어요. 요즘 제가 건강한 음식에 꽂혔는데요 밀가루 보다는 통밀, 통밀보다는 쌀. 현미 이런거로 대체해서 먹으려고 노력중이거든요. 그런데 이런 곳에서 만난 글루텐프리 음식이라 반갑고 너무 좋았습니다. 건강하게 살자구요~!!!!!! 분위기도 좋고, 맛있는 수제 디저트, 케익과 음료가 있는 아기자기한 버니타운에서 즐거운 시간 가져보세요~ :) 버니 재생 0 좋아요 0  버니"
성수동 갈만한곳 서울숲 카페거리 버니타운 재방문후기,"서울숲 카페거리 성수동카페 버니타운에서 친구와 만났어요 종강 후 오랜만에 보는 대학 동기라서 너무너무 기대되고,, 얘기할 거리 잔뜩 보통 학교 근처에 있는 친구들이랑 저희 집 위치 딱 중간이 왕십리거든요 왕십리카페는 너무 많이 가서 요번에는 서울숲카페 갔다가 뚝섬역맛집 가기로! 서울숲역과 뚝섬역의 딱 중간에 위치해 있어요 저희는 뚝섬역 8번출구에서 만나서 10분정도 걸어왔더니 도착했답니당 ""버니"" 타운이어서 그런지 곳곳이 토끼로 꾸며졌어요 뚝섬역카페 버니타운 내부로 들어오니 아기자기한 인스타 감성이 많이 느껴졌어요 전체적으로 노란색 조명이 있어서 셀카도 잘나오구 아기자기해서 딱 인스타에 올리기 좋은 느낌 ㅎ.ㅎ 실제로 인스타에 올리니까 여기 어디냐고 많이들 물어보셨어요! 버니타운은 케이크가 맛있는 뚝섬역맛집이에요 전 카페에 방문해서 먹기 전에 친구 생일케이크를 주문제작해서 픽업한 적이 있었는데요! 그때 먹었던 케이크가 아주 맛있어서 꼭 다시 와서 먹어야겠다고 다짐했거든요 ㅎ.ㅎ 디피도 아주 예쁘게 되어있죠 티라미수케이크, 블루베리 바스크 치즈케이크, 망고생크림케이크, 당근케이크 등등 보기만 해도 맛있는 케이크들이 예쁘게 진열되어 있었어요! 귀여운 인형도 있구 글씨체가 딱! 인스타감성카페 아닌가요..ㅎ 서울숲카페거리에 있는 카페 중 가장 아기자기하고, 귀여운 카페 같아요 저희는 애플레몬에이드 7.0 아쌈달고나밀크티 6.0 (위에 얹은 달고나 빼고!) 그리고 티라미수 케이크 6.5 이렇게 주문했어요 ~_~ 생일 초도 있어서 생일케이크 하시는 분들 초도 추가로 사가시면 좋을 것 같아요 :) 성수동 갈만한곳 서울숲 카페거리 버니타운 재방문후기 재생 0 좋아요 0  접기/펴기 성수동 갈만한곳 서울숲 카페거리 버니타운 재방문후기 뚝섬역카페 전체적인 분위기입니다 조명도 노란색이어서 여성분들 셀카도 예쁘게 잘나오구(요거 되게 중요..) 테이블이랑 의자도 너무 낮지 않아서 앉아서 얘기하기에 좋았어요 버니타운 재생 0 좋아요 0  버니타운 드디어 나온 음료와 케이크! 전체적인 영상이고 맛도 천천히 소개해 드릴게요 제가 주문했던 애플망고 레몬에이드는 달달한 레몬맛 에이드에, 작은 사과랑 말린 딸기가 들어있었어요 목마를때 잘 넘어가고 뒷맛이 텁텁하지 않고 상큼한 맛이에요 친구가 먹었던 아쌈달고나 밀크티도 달달하니 맛있는 밀크티 맛이었어요 알고 있는 그 맛있는 맛.. 그 맛이 맞아요.. ㅎ.ㅎ 밀크티가 굉장히 진하고, 친구가 달고나를 좋아하지 않아서 달고나는 빼달라고 부탁드렸는데 달고나 있는 그대로 먹으면 더 달달할 것 같아요! 저희 둘다 아주 단 걸 싫어해가지고 요정도 단 것.. 딱이었답니당 케이크는 티라미수케이크를 먹었는데요 케이크가 포슬포슬하니 잘 넘어갔어요 식감도 아주 좋고 에스프레소의 향이 느껴졌답니다 위에 있는 블루베리가 진짜 맛있는 블루베리 였어요.. 완존 달달 재료 하나하나 아끼지 않으시고 좋은 재료를 쓰는 게 느껴진 뚝섬역맛집 전체적으로 셀카찍기 좋고, 매장 내부가 굉장히 아기자기해요 그리고 창가 자리로 빛도 잘 들어오고, 소품 하나하나 신경쓰시면서 꾸민 애정하는 가게라는 게 느껴졌어요 연인분들 서울숲데이트코스 로 올 때 방문하기에 딱 좋을 것 같은 느낌! 저도 짝꿍이랑 다시 오고싶어요 ㅎ.ㅎ 곳곳에 뚝섬역카페 포토존도 예쁘게 잘 되어 있어가지구 사진도 아주많이 건지고 갔습니당ㅎ.ㅎ 특히 같이 간 친구가 젤 좋아하드라구용 서울숲데이트코스로 좋으니 꼭 방문해보세요! 50m © NAVER Corp. 버니타운 서울특별시 성동구 서울숲2길 15-12 1.5층 위치는 뚝섬역과 서울숲역 중간에 있습니다"
쉐라톤웨딩/회현카페/레레플레이/송도우스페이스/신당디핀/유니페어/샤넬오픈런/샤넬woc/스몰스파이시올리브/태극당/성수동버니타운,"2021년, 가을 또또 오랜만에 포스팅 뜬금없이 #송도쉐라톤웨딩 쇼케이스 갔다온날 핸드폰바꾸기 전이라 자체 뿌연필터;; 간김에 견적도 받고 선물도 받고 좋긴 하다만,, 인천엔 정녕 결혼할만한곳이 여기밖에 없는 것인가ㅠ 신당 #레레플레이 으아니, 이런곳에 카페가•_• 몇번을 갔는데 갈때마다 들어가는길을 지나침🧐 스콘도 맛있듭니다 노밀가루 선언1일차에 들어갔다가 바로 스콘 냠냠^^ 여튼 나도 핫플가봤다아 마카롱여사님의 아롱사태전골♥ 이거 다이어어트 식품이쟈나여 여주 아울렛 나들이 슬쩍 호호리 코트 입어보았다 이런걸 놈코어라고 하나요? 깔깔 도촬이 취미 복이랑 다여니랑 녹사평 데이트🥰 실은 마포조박집에서 1차하고 2차로^^ 길에서먹기 딱좋았던 날씨♥ 커피도마시고, 집으로,,,,, 안가고 ㅋㅋㅋㅋ 3차로 투다리까지 간 우리, 대단해🤗 나는 마음에 들었는데 손톱에 때꼈다고 세번 들었던 네일 흑 김실장님 동네 마곡으로 놀러간 날♬ #스몰스파이시올리브 맛도 좋구 분위기도 좋구 지하철 타고온 나만 와인 한잔 스을쩍~ 싹 비운그릇이 맛있음을 증명해주는군 ㅎㅎ 바로 옆에있던카페로 와인한잔 먹었다고 온몸이 다 빨개진 나;; 곤난하다 곤난해ㅡㅡ 호호리 생일선물사러 오랑만에 #유니페어 예쁘게 신어 나는 당분간은 삼각김밥만 먹고 지낼예정이야 커피드럽게 맛없는 키츠네도 들렸구요, 샤넬 오픈런 그런거 왜하냐고!!! 맹비난하던 나와 엄마 11월의 어느날 롯데백화점 본점에 줄을 서고 마는데,,,, #샤넬보이지갑 처음엔 가벼운 마음으로 언니 생일선물 사려고 갔다가 줄만서고 못산것에 오기가 생겼음 다음날 엄마랑 다시갔고 아침부터 줄선것이 아까웠던 오마니는 계획에 없던 woc를 구매. 어휴 두번은 못할 짓이다. 번호표받고 기다릴겸 #10꼬르소꼬모 내가꾸민 우리언니 돌잔치 내가 피땀으로 구매한 지갑이다 잊지마 (찡긋) 백년만년만에 스노브 케이크 어느날의 엄마와 브런치, 태극당 태극당에선 모나카 꼭먹어주기 별표다섯개 쨔쟈잔 호호리 생일파티 하는날 1.우스페이스에서 야무지게 점심 먹구요,, 2.성수동에 들려 케이크도 픽업하구요 #버니타운 aka. 저세상화질 밖에서 차대고 기다리든지 말든지 나는 내 셀피를 찍고간드아 3.신당집에 잠깐들려 선물증정식과 케이크 컷팅도 하구요 물론 케익은 내가 먹고 싶은걸로+_+ 행복하늬? 4.디핀에서 야식과 와인으로 마무리 했습니다 휴,, 나 같은 여친 없다 진짜 (걱정안해도되,,, 당분간 간장계란밥만 먹으면되^^) 언니가 우리얘기 아니냐고 보내준거 ㅋㅋㅋ 나에게 나름 큰 이벤트였던 이날// 호호리 부모님 처음 뵙던날 꽃정도는 해가야 센스 아임니까 (안떨리는척) 생각보다 유쾌했던 식사자리 ㅎㅎ 설마 또 나만 신난거 아니지? 나의 소울메이트와 데이트♥ 회현식당 예약 맨날 실패해서 결국 회현카페로,,, 냠냠 맛있는데, 먹다보면 초큼 물리는 느낌// 조만간 회현식당도 꼭 가고 말갔어"
성수동 데이트 :haru&oneday/육하나이/히포캠퍼스/이오로 비스트로/버니타운,"오랜만에 친구랑 만나서 어디갈까 고민하다 성수동을 한번도 안가봐서 가보기로 했다🙂🙂 <haru& oneday> 매일 : 07:30~ 23:00 50m © NAVER Corp. haru&oneday 서울특별시 성동구 아차산로 92 광명타워 친구 기다리다 우연히 들어간 카페 하루앤 원데이 지하철역이랑 가까워서 들어갔는데 매장 안이 시끄럽지도 않고 넓고 쾌적했다😊 내가 주문한 아몬드 바닐라 밀크 처음 봐서 궁금해서 시켜봤는데 너무 맛있었다!! 알고보니 여기 카페에서 유명한 메뉴인것 같았다ㅎ 여기 방문한다면 한번쯤 시켜보는걸 추천한다👍🏻👍🏻 갈대가 진짜 같다,,여기가 포토존인것같다ㅎ이뿌💕 <육하나이> 영업시간 : 11:00~ 21:00 (월요일 정기휴무) 50m © NAVER Corp. 육하나이 서울특별시 성동구 광나루로2길 34-17 1층 친구랑 향수공방 가기전에 마실 음료를 테이크아웃 하기위해 카페를 찾다가 우연히 발견한 카페 카페에서 판매하고 있던 인센스 스틱과 받침대 요즘 유행하는 컵홀더,,특이해ㅋ 나는 얼그레이티 친구는 잉글리쉬 브랙퍼스트티☕️ <히포 캠퍼스> 매일 : 13:00~ 20:00 50m © NAVER Corp. 히포캠퍼스 서울특별시 성동구 성수일로12길 19-1 B1층 예약 우리는 가기 며칠전에 네이버로 예약을 하고 방문했다 가격은 1인 47,000원 지하에 있던 히포캠퍼스 건물 밖에 따로 간판이 없어서 앞에서 헤매다 들어갔다😅😅 히포 뉴이얼~귀여웡🧡 깔끔하고 단정한 느낌으로 전시된 제품들 여기있는 것들은 판매하는 제품인것같다 드디어 향수 만들기 시작!! 본인이 좋아하는 향기를 기본 베이스로 먼저 선택하고 그 후에 앞에 놓인 수십개의 단품향료 중 5가지를 선택하면 된다 나는 바닐라 베이스로 선택!!😆😊 사진은 깜빡하고 못찍었지만😭😭 본인이 선택한 향료들의 비율을 달리해보면서 총 4번의 샘플을 만들어보고 그 중에서 가장 맘에 드는 비율로 본품을 만들면 끝!! 다 만들어서 쌤이 포장해주신 친구와 나의 향수🖤 완성된 향수는 2주 뒤부터 사용할수 있다고 한다😆😆 인스타 감성샷,,⭐️ 시간 가는줄 모르고 너무 재밌었던 향수만들기 체험 친구나 연인들 데이트코스로 완전 추천!!👍🏻👍🏻 < 이오로 비스트로 > 영업시간 : 11:00~21:30 브레이크타임 : 15:00~ 17:00 라스트오더 : 20:30 50m © NAVER Corp. 이오로비스트로 서울특별시 성동구 연무장5길 18 1층 이날 친구랑 나 둘다 하루종일 아무것도 못먹어서 너무 배고픈 나머지 바로 눈 앞에 보이는 식당으로 직진~ 다행히 여긴 웨이팅이 없었어서 바로 들어갈수 있었다🙂 1인 1파스타 + 참치노리마끼😆😆 친구는 야끼대창파스타 나는 매콤명란파스타 우와,,너무 맛있었다🤤🤤 레몬 하이볼도!!🍻🍻 첫끼여서 더 맛있었나??ㅋㅋ 친구랑 나랑 하나도 남긴거 없이 다 먹음ㅎ <버니타운> 영업시간 12:00~21:00 (월요일 정기휴무) 50m © NAVER Corp. 버니타운 서울특별시 성동구 서울숲2길 15-12 1.5층 밥 먹고 인터넷으로 알아본 카페에 왔다ㅋㅋ 먹는 거에 진심인 우리,,😋😋 들어가는 입구부터 너무 이뿌다ㅠㅠ 아기자기한 매장 내부💕 너무 너무 이쁜 케이크 쇼케이스🎀 케이크 비주얼도 미쳤따,,✨ 여기에도 있다ㅎ 친구는 딸기 생크림케이크🍓 나는 블루베리 바스크치즈케이크🫐 케이크 실물이 더 이쁜데 사진에 잘 안담겼다😢😢 친구가 찍어준 내 사진💙 곳곳이 포토존이었던 셀카맛집📸 크리스마스 같았던 분위기🎄🎄 케이크도 맛있고 분위기도 좋았던 버니타운🐰 다음에 또 가야지~~ 친구랑 너무 재밌고 알차게 보냈던 하루였다!! 빨리 2주가 지나서 향수 써볼수 있으면 좋겠다🙏🏻🙏🏻 너무 궁금하다아ㅠㅠ #성수동 #카페추천 #맛집추천 #공방추천 #하루앤원데이 #육하나이 #히포캠퍼스 #이오로비스트로 #버니타운"
성수동에 쌀케이크 맛집이 있다고? 서울숲 뚝섬 디저트 카페 글루텐프리 케익맛집 버니타운 추천,"#성수동 에 우후죽순 생겨버린 카페 대다수가 인스타 갬성빨만 오지는 곳들 맛과 가격 가성비를 중시하는 직장인은 기본에 충실한 곳을 찾아헤멤 하지만 인스타 갬성 + 맛 둘 다 경험할 수 있는 카페를 소개함 #서울숲역디저트카페 #뚝섬역디저트카페 #버니타운 서울시 성동구 #서울숲 2길 15-12 지하철 #뚝섬역 8번 출구에서 577m 수인분당선 서울숲역에서도 가까움 화,수: 휴무 목-월: 낮 12시 - 저녁 9시 50m © NAVER Corp. 버니타운 서울특별시 성동구 서울숲2길 15-12 1.5층 외관은 이렇게 생김 1층은 캐릭터샵 2층은 버니타운 카페 약간 일본 하라주쿠 같기도하고 2층 문으로 들어가봄 외관부터 인테리어에 신경을 많이 쓰신 듯 들어가니 별천지 사장님 갬성 소녀소녀 쇼케이스 안의 조각 케익들 밀가루가 아닌 #유기농 쌀로 만들어 #글루텐프리 라고 함 #쌀케이크 오랜만 조각케익 가격은 대략 7,500원~9,000원 선 시즌별로 다른 과일토핑 여름에 갔는데 #망고케익 JMT였음 여성 고객 취저의 인테리어 포토 존으로 굿 사장님 레이스 공주풍 좋아하시나봄 앤틱 분위기 사방 팔방 레이스 천지 ㅋㅋㅋ 블루베리 #바스크치즈케익 커피는 기억에 안남는 걸로 보아... 케익은 망고케익이 더 맛있었음 카운터에 진열된 컵케익 모양의 초들 사도 아까워서 못쓸 듯 너무 귀염뽀짝한 초들 보는 재미 맛 다 사로잡은 버니타운 서울숲 성수동 뚝섬 #카페 추천 카페에서 한 층 더 올라가면! 서울숲 수제 핫도그 전문점이라고? 에디슨바이댄 작년에 생긴 에디슨바이댄 가봄 서울숲길 끝쪽에 위치 이 계단을 올라가면 오른편 나무로 된 문이 보임 왼... m.blog.naver.com 🔽 서울숲 뚝섬 성수동 빵지순례 가성비 빵맛집 🔽 서울숲 뚝섬역 빵지순례 가성비 빵집 빵의정석 가격 정보 솔직후기 #성수동 엔 식당도, 카페도, #베이커리 도 많다 근데 #인스타 갬성충만한 곳이 더 많다 '맛'에 ... m.blog.naver.com"
성수동 버니타운 🍰☕️ 케이크와 커피 한 잔,50m © NAVER Corp. 버니타운 서울특별시 성동구 서울숲2길 15-12 1.5층 성수동 버니타운 서울숲길 걷다가 아무 곳이나 들어가자 해서 간 곳. 뭣도 모르고 들어가서 케이크랑 밀크티 시킴 케이크가 쌀로 만들어졌다고 써 있었다. 케이크도 되게 예쁨 조각 케이크 가격 8500~9500원 선ㅋ 밀크티도 맛있고 케이크도 맛있었는데 밀크티는 양이 적었다^^ 컵 2/3도 안 채워준 느낌? 사진 속 밀크티가 받자마자 찍은 거~~~ ㅎㅎ 꽉 채워줬으면.... 잘 몰랐는데 먹다 보니까 주위에 손님 연령대가 매우 어렸다 10대 후반~20대 초반쯤? 추측 아줌마.. 잘 먹지? 이 소리가 절로 나왔다ㅋㅋㅋㅋㅋㅋㅋㅋㅋㅋㅋㅋㅋㅋㅋㅋ 분위기가 남여 커플이나 남남끼리 오기는 좀 그랬다 케이크 한판 구매하면 좋을 거 같았다 맛도 좋고 예뻐서
