title,content
"인생 디저트 카페 성수동 발렁스 프레지에 (휴무일, 영업시간)","성수동 발렁스에 다녀왔습니다. 정말 우연히 들어갔는데 성수동 발렁스였다면? 하느님이 보우하사 ㅋㅋㅋㅋㅋ 이날 찐짜 솥뚜껑갔다 (진짜❌️ 찐짜⭕️) 식후땡 커피 한잔하기 위해 눈앞에 있는 카페 갔는데 그게 성수 발렁스 ! 제 먹을 복이 이 정도입니다 😎 복덩이 같으니라고 ❤️ 인생 디저트 카페 성수동 발렁스 내부입니다. 작은 원형 테이블이 3개 마련된 작은 가게로 식후땡 시간에 가시면 만석일 때가 많아요. 그래도 포기 마시고 디저트 포장하시길요. 그럴 가치가 있습니다 👍👀👍 50m © NAVER Corp. 발렁스 서울특별시 성동구 성수일로4길 49 1층 발렁스 위치는 성수역 4번 출구에서 300m, 5분 거리! 소문난 성수 감자탕과 찐짜 솥뚜껑 갈비의 사이에 있어요. 언급한 두 식당 중 어딜 가도 흡족한 식사 후 (찐짜에선 부대찌개를 드셔야 합니다!) 디저트 카페 발렁스에 들리시길요. 아주 완벽한 코스 보장합니다 ❤️ 자리 맡아두고 카운터로 가서 바로 주문해요. 2022.04 라인업입니다. 유자 라임, 바닐라 마들렌과 겉바속촉 휘낭시에가 준비되어 있었고요. 프레지에, 파스타지에, 바닐라 통가, 깨흐블랑 끝으로 크림 브륄레까지 거기서 저흰 프레지에와 유자 라임 마들렌과 아아 2잔 주문했고요. 금방 나왔어요 ❤️ 프레지에 (10.0) 유자 라임 마들렌 (2.8) 아이스 아메리카노 (4.0) 먼저 유자 라임 마들렌 컷팅하는 순간부터 유자향이 훅 ! 상큼 새콤달콤한 유자 맛이 기분 좋게 올라오는 겉바속촉한 마들렌 👍 ✨️ 그리고 오늘의 주인공 프레지에 (10.0) 목련화 꽃잎 금실 딸기 꽁뽀드 금실 딸기 티히티바닐라 무슬린 크림 비스키 뵈흐 누아젯 키르쉬 펀치 한 포크 떠먹고 언니랑 휘둥그레진 눈으로 마주합니다. ❤️ 띠용 ❤️ 패스트리부띠끄 딸기 쇼트보다 르빵 딸케보다 맛있어! 나 방금 계탐! 인생 디저트 만나버림 👀❤️ 와.. 콕콕 박힌 바닐라 빈이 보이시나요. 바닐라 크림이 대박 👏👏👏❤️ 혀에 유막 잔여감이 없어요. 그렇다고 가볍게 스치듯 안녕하는 맛은 아니거든요. 여운이 길어요. 바닐라아아아 ~ 음 🎶 그리고 딸기 나무라는 뜻의 프레지에답게 적당한 단맛의 꽁보드 금실 딸기에서 아주 싱싱한 딸기향이 납니다. 풀향과 더해진 상큼한 딸기향 🍓🍓🍓 토독토독 딸기씨가 씹히면서 바닐라 크림이 혀를 감싸는데 스르르 절로 눈이 감겨요. 음 🍓🎶 순삭 프레지에 🍓 행복했다 🍓 그날 언니의 인스타 스토리 : 먹어본 케이크 중에 최고! 나의 인스타 스토리 : you're my number one 와.. 여기 뭐야? 정체가? 하면서 두리번거리다 발견 👀✨️ 네, 그러셨군요. 프랑스 에꼴 르노뜨르 🇫🇷 다르구나, 달라. 멋있다 👏👏👏❤️ 그리고 커피 원두는 프릳츠꺼 쓰시나 봐요. 진짜 프릳츠 이제 중견기업 된 것 같아요. 용산 오츠도 프릳츠 콜라보던데.. 요즘 어딜가나 보이는 프릳츠 물개 🦭 팔로워 6,398명, 팔로잉 12명, 게시물 194개 - 발렁스(@balance_patisserie)님의 Instagram 사진 및 동영상 보기 instagram.com 잊지 못할 맛이었습니다 👏👏👏❤️ 바로 인스타 팔로우하고 계절 디저트 라인업 체크합니다 ❤️ 인스타로 보다 보니 원래 유명한 곳이었더라고요. 이미 많은 분들의 인생 디저트 카페 이사 후 근 몇 년간 빵순이의 본분을 잊었더니 이런 곳을 몰랐네요. 하느님이 보우하사, 이제라도 알게 되었으니 수시로 달려갈 예정입니다♥️ 동의합니다. 발렁스 파티셰님 천재! 저도 곧 언니들이랑 우르르 가서 전 메뉴 다 시켜 먹어볼 거예요. 힛 ♥️ 참 메뉴판 사진 ... 🤦‍♀️죄송함다. 그러니까 이 사진의 정체는 성수 발렁스 음료 메뉴판입니다. 발로 찍었뜨아 😱 발렁스에서 음료는 커피, 티, 에이드 종류별로 취급하고 계셨고요. 가격은 4.0 ~ 6.0까지 분포되어 있었어요. 커피 맛은 쏘쏘..♥️ 하지만 여기 디저트 맛집이라는 거! 저의 인생 딸기 디저트였던 성수 발렁스의 프레지에는 5월 초까지 준비해 주신다 해요. 부지런히 👉👉👉 참, 성수동 발렁스의 영업시간은 12:00 ~ 19:00 휴무일은 월, 화입니다 ❤️ 드셔보시면 이웃님들의 인생 디저트가 될 것이라 예상해 봅니다. 그럼 봄꽃처럼 지나갈 프레지에. 성수 발렁스에서 인생 디저트로 만나시길요. 🍓❤️🍓❤️🍓❤️🍓 #성수발렁스 #성수동발렁스 #발렁스 #성수동디저트카페 #프레지에 #성수디저트카페"
"양파 모양 몽블랑, 수제 디저트 카페 성수동 '발렁스' 후기","50m © NAVER Corp. 발렁스 서울특별시 성동구 성수일로4길 49 1층 발렁스 성수역 2호선 서울특별시 성동구 아차산로 100 📍월,화 정기휴무 수~일 12:00~19:00 2호선 성수역 4번출구에서 약 300m 내부가 협소해서 애초부터 포장하려고 방문 주말에는 12시 이전에 좌석이 모두 만석이 되니 일찍 가야할듯! 사람이 많았으나 우리의 갤럭시 AI지우개로 지워버림 요런 분위기이고 만석이라 좌석은 못찍었다 아숩 디저트류는 이렇게 있고 늦게 가면 품절이라고 하니 맛보고 싶다면 오픈 직후, 이른 방문이 필수일듯 음료 메뉴판 이렇게 포장해주시고, 와서 보니 테이프 같은걸로 고정시켜서 주셨다 그래서 집 와서도 안 망가지고 멀쩡히 옴 양파 같이 생겼지만 맛은 양파와 무관 🧅🧅🧅🧅 디저트도 젓가락으로 먹는 찐한국인😂 맨 아래는 머랭쿠키인듯 바삭했다 개인적으로는 솔직히 다시 가서 맛보고 싶을 맛은 아니었다 하지만 이색 디저트라 한번쯤 궁금하다면 방문해볼만은 한듯 *.* 이상 독특한 몽블랑, 수제 디저트 카페 성수동 '발렁스' 후기 끝"
성수동 파티세리 디저트 맛집 [발렁스],"50m © NAVER Corp. 발렁스 서울특별시 성동구 성수일로4길 49 1층 발렁스 성수에선 딱히 괜찮은 파티세리가 없는 줄 알았는데 망고 평점이 되게 높길래 찾아가 봤어요. 투몬과 피스타시에는 주력으로 하는 메뉴같고 복숭아 샤를로뜨는 계절메뉴인듯 합니다0.0 우선 피스타시에와 투몬은 레이어가 단순하면서도 직관적이어서 먹는 사람으로 하여금 첫입에 ‘아 맛있다’ 라는 인상을 심어주고 투몬은 조금 달았는데 전 단 걸 좋아해서 만족스러웠답니다>< 그리고 복숭아를 엄청 좋아하진 않지만 정말 맛있게 먹었던 복숭아 샤를로뜨,,,그냥 복숭아를 엄청 맛있는 걸 쓰신 듯 해요 디저트에 과일을 쓸 땐 확실히 과일을 좋은 걸 쓰는게 맛을 결정하는 듯 합니다••• 그리고 무화과와 몽블랑의 계절이 와서 다시 방문한 발렁스 가을이라 복숭아가 사라지고 무화과와 몽블랑이 들어왔길래 먹어보았습니다. 몽블랑은 제가 먹어본 몽블랑 중에 가장 담백하고 누구나 좋아할 것 같은 맛이었어요. 달지 않고 부드럽게 넘어가며 안에 보늬밤? 같은 것이 진한 밤맛을 더해주며 마무리하는 담백한 맛 제 취향은 파리 앙젤리나에서 먹은 더 자극적인 몽블랑에 가깝지만 여기 몽블랑이 호불호에서 더 안전할 것 같아요. 무화과 타르트도 기본적으로 과일을 좋은 걸 쓰시는지 입에 넣었을 때의 향기로움이 정말 미쳤다는,,,같이 간 사람이 러쉬 맛이라고 표현했는데 뭔가 웃기긴 하지만 입에 입욕제를 풀어놓은 것만 같은 향기로움이 너무 매력적이었습니다. 가을시즌에 무화과는 꼭 드셔보시기를••• 총평은 무난히 맛있어 호불호가 없고, 특히 과일을 사용한 메뉴들이 유독 빛나는 파티세리! 입니다. 성수동 방문할 때마다 갈 것 같아요. #성수동 #발렁스 #파티세리 #디저트 #무화과"
성수동 디저트 맛집) 발렁스,"서울 성동구 성수일로4길 49 1층 발렁스 월화 정기휴무 12:00 - 19:00 제품 소진 시 마감 02-652-4596 인스타그램 DM 예약가능 발렁스(@balance_patisserie) • Instagram 사진 및 동영상 팔로워 7,509명, 팔로잉 12명, 게시물 215개 - 발렁스(@balance_patisserie)님의 Instagram 사진 및 동영상 보기 www.instagram.com 프랑스어 시험을 2주 남겨두고 2박3일로 오게 된 서울 시골쥐는 알차게 돌아다닙니다 C’est parti ! 일요일 오후 3시 쯤 가게된 발렁스 균형 이란 의미로 천칭이 브랜드 로고 인듯 하다 좌석은 협소하고 웨이팅도 있어서 먹는 건 포기했다 갔더니 디저트가 2개만 남아있는 줄 알고 굉장히 아쉬운 상황! 인줄 알았으나 다행히 키친 쪽에 여유분이 있는 듯 했다 커피 가격은 저렴한 편은 아니다 일단 라떼2잔 바닐라 라떼 1잔 몽블랑1개 피스타치오타르트 1개 주문 구움과자 들도 있다 생각보다 포장 손님이 활발했다 디저트 포장은 금방 됐으나 음료가 아무래도 오래 걸리는 듯 했다 예쁜 천칭 오브제 매장 전경을 담아보려 했으나 사람이 많아서 결국 편집 2-3좌석이 있다 지도 어플을 켜 대충 근처 근린공원에 걸어가 먹었다 예쁘게도 담아주셨다 파리 앙젤리나에서 먹은 몽블랑을 그리워 하며 한입 남녀노소 누구나 좋아할 맛이었다 가을엔 몽블랑! 여기도 럼향이 은은하게 느껴졌다 다만 디피 되어있던 제품이 아니라서 그런지 살짝 얼어있었는데 그 또한 나쁘지 않았다 무스 본연의 부드러움을 느끼고 싶으면 아쉬웠겠지만 나름 아이스크림 같은 식감이었다 우측은 피스타치오 타르트 피스타치오 덕후로써 아래에 로스팅된 피스타치오가 수북하게 깔려있었다 그래서 좋았음 약간 로즈향도 나는 것 같았는데 정확하진 않다 저 작은 타르트에 저런 디테일한 파이핑을 보며 만들기 힘들겠다 생각하는… 순수하지 못한 직업병😭 내년에 파리에 가면 또 이렇게 벤치에 앉아 노상디저트를 즐기겠지 나이프와 포크를 들고 다니는 분도 있던데 참고해서 많은 것을 먹고 기록해야지 여담) 프랑스언어교환어플로 알게된 친구가 내 인스타를 보고 발렁스에 간 거 봤다며 제과학교 동기라고 했다 그 친구가 말하길 Le monde est petit 라고 맞다 세상은 좁다 특히 한 분야로 파고 들면 더 좁은 것 같다 착하게 살고 볼 일이다 #쁘띠갸또 #성수발렁스 #발렁스 #성수동데이트 #성수동디저트 #성수카페 #뚝섬카페"
성수동 발렁스,"7월에 성수에 갔을 적 일이다. 디저트는 어디로 먹으러 가야되나 고민하다가 예전에 저장해둔 발렁스가 떠올라서 그 곳으로 갔다. 소문난 성수감자탕에서 직진하면 작은 가게가 하나 나온다. 가게 규모가 작아서 테이블링을 해야된다. 금요일 오후에 방문했고, 대기는 30분 정도 했다. 주말엔 더 많을 것으로 생각한다. 음료 두 잔과 포레누아를 주문했다. 음료는 무난했다. 포레누아 체리랑 초콜릿이 잘 조화된 쁘띠갸또이다. 디자인이 예뻐서 마음에 들었다. 내부 구성은 다음과 같다. 카카오 샹티크림(발로나 과나하 70%) 체리 콩포트 키르쉬-타히티 가나슈 파트사블레 오 쇼콜라 발렁스 인스타그램 내부 좀 더 깔끔하게 자르고 싶다. 어리틀케틀 때도 단면 구조를 올리고 싶었지만 마음에 들지 않아서 업로드하지 않았다. 맛은 다크 초콜릿맛이 강하게 느껴지는데, 쓴맛보다는 다크 초콜릿의 진한 맛 중심으로 느껴진다. 그리고 내부에는 화이트 가나슈가 있어서 부드럽다. 체리도 적당히 달고 상큼해서 좋았다. 50m © NAVER Corp. 발렁스 서울특별시 성동구 성수일로4길 49 1층 발렁스 발렁스(@balance_patisserie) • Instagram 사진 및 동영상 팔로워 9,958명, 팔로잉 15명, 게시물 256개 - 발렁스(@balance_patisserie)님의 Instagram 사진 및 동영상 보기 instagram.com #성수동 #성수 #파티셰리 #포레누아 #초콜릿 #체리 #발렁스 #디저트 #카페"
"주말 성수동, 마르쉐와 서울숲 그리고 발렁스","문득 자다깨서 씻지도 않고 길을 나섰다. 성수동에서 열리는 마르쉐는 파아프랩에서 열릴땐 '작은시장' 이라는 부제로 열리는데 평소의 마르쉐보다 훨씬 작은 규모로 열린다. 딱히 손이 가는 것이 없어서 산 건 없었지만 그래도 기껏 왔으니 한 컷. 아마 다음부터 작은시장엔 오지 않을 것 같다. 부지런히 또복또복 걸어서 오랜만에 서울숲. 할 수 있는 운동이 심각하게 제한되다보니 기껏 운동이라고 할 수 있는 건 천천히 느릿느릿 걷는 일이었다. 이태원에서 사온 주말 뭐해 팀복과 서랍에서 오랜만에 꺼낸 러닝팬츠에, 모자, 운동화까지 천년만의 나이키 걸 부활. 서울숲을 걷는 일은 항상 좋다. 걷고 뛸 때 항상 제일 기분 좋은 곳. 오랜만에 사슴 구경도 했다. 주간일기에 하나 선택된 것은 주말의 나이키 걸. 낄낄낄. 다시 또 먼 길을 느리게 걸어 여름 휴가 전날의 발렁스에 갔었다. 호기롭게 '여기 있는거 다 주세요' 이런 걸 한번쯤 시전하고 싶지만 어차피 다 못먹을 것이므로 도시여자답게 두개만 샀다. 발렁스의 디저트는 가만 들여다보면 손바닥만한게 품이 많이 들게 생겼다. 한 입 먹어보면 그 맛에서 느껴지는 수고로움은 더할 것 없고. 생각해 보니 이 주말에는 한 끼를 먹었다. 요새는 냉장고 속에 있는 재료를 소진하는데 열심인데 방울토마토와 코스트코표 냉동새우, 다진 양파와 마늘, 수지스 닭가슴살을 넣고 카펠리니 파스타를 썼다. 카펠리니는 이런 토마토 소스 파스타엔 안 어울리는 걸 배웠지만 내가 만든 음식에는 관대하니까 배부르게 먹었다. 그리고 한참을 굴러다니다가 청량리 청과물 시장엘 갔었는데 난 사실 마르쉐보다 여길 걷는게 훨씬 재밌다. 과일이 엄청나게 산처럼 쌓여있어서 보는 재미가 만땅. 이 날의 과일 정리. 라임과 살구, 자두를 한 바가지 사왔는데 그 뒤로 신나게 먹는 중이다. 주간일기에 올리지 못한 발렁스의 또다른 디저트 코코플럼. 코코넛 무스와 크림 안에 대석 자두를 졸여 만든 콩포트가 있다. 코코넛과 자두가 어울리지 않을 거라고 생각하면서 반신반의했는데 걱정이 무색하게 상큼한 자두 맛과 코코넛의 크리미함이 잘 어울렸다. 사촌동생이 집에 놀러온 날 호기롭게 집에 있던 라임과 민트를 넣어 무알콜 모히또를 만들어 내놨다. 별 것 아니지만 여름이 느껴지는 사진이라 좋았다."
"성수동 [발렁스] / 타르트, 갸또, 인생맛집","성수 디저트순례 다녀온 엠보 지난 옹근달, 감도에 이은 3탄! [발렁스]입니다 :) 발렁스는 사실 이번에 다녀온 성수 디저트샵 세군데 중 가장 심플하지만, 가장 맛의 조화 및 텍스쳐가 뛰어난 곳이었어요 배불러도 가야하는곳…! 발렁스 갸또 발렁스는 시즌 인,아웃 하면서 항상 4가지쯤의 갸또를 진열중이예요 제가 방문했을때는 11월이었는데 이렇게 진열되어 있었어요! 크리스마스 시즌에는 홀케이크도 판매하던데, 궁금하네요 :) 발렁스 구움과자류 간단한 구움과자들도 준비돼어있어요 피스타치오 휘낭시에도 맛있겠네요 🤤 발렁스 음료메뉴 음료는 디저트에 곁들일만큼 최소한의 음료로 이뤄져있어요 디저트의 맛을 방해하지 않을만큼의 음료만 갖춰진듯~ 발렁스에는 테이블이 딱 두개밖에 없는데, 운좋게 손님 없는 시간대를 잘 찾아가서 앉아서 먹을 수 있었어요! 발렁스(밸런스)라는 이름과 딱 맞는 오브제를 가져다 두셔서 심플하면서도 보기 좋은 디자인이었어요! 사실 이날 카페를 너무 많이 간 날이라서 발렁스에서는 음료를 시키지 않았었는데, 물 주시는 센스 보이시나요... 저 약간 감동머금 이런 사소한 센스에서 감동받는 Na..☆★ 타르트는 손으로 들고 먹어야 제맛이쥬..히히 바닐라통카 타르트예요! 바닐라빈이 정말정말 많이 들어있어서 씹을때마다 톡톡 터지고 통카빈의 은은한 향이 느끼하지 않게 잡아줘요 바닐라+통카=ෆ 발렁스 타르트 맛집이예여.. 굵직하게 들어간 통 피스타치오에 피스타치오 가나슈, 그리고 크림까지 완벽한 밸런스를 가진 아이예오 😢 성수에대한 좋은 기억을 남겨주는 발렁스 사실 집에서 먼데도 불구하고 다시오고싶어지는 맛이예요…💙 매 시즌마다 살짝씩 메뉴 리뉴얼이 되는데 그때 다시 방문예정 :)"
[발렁스] 성수동 파티세리 디저트 카페,"코튼언니와 성수동 나들이 2차 성수동 디저트 카페는 무조건 발렁스라며 적극 추천한 나!! 거의 오픈 직후에 가서 꽉 차 있던 쇼케이스 꽉 찬 쇼케이스 효과 :: 가슴이 벅차오르고 설렘 여름 신메뉴인 복숭아 샤를로뜨 나의 발렁스 최애 투몬 (원래 바타가 일등인데 이제 안 나온다고,,,ㅠ) 복숭아 샤를로뜨 비스퀴, 바닐라 바바루아즈 복숭아 콩포트, 복숭아 무스 복숭아 과육 비스퀴가 아주 퐁신하니 가벼운 식감 복숭아 무스와 콩포트가 상큼 달달 부드러운 바닐라크림 세가지 조합이 너무 좋았다 입에 넣자마자 사르르 녹는 식감 샤를로뜨는 자주 먹는 편이 아닌데 정말 맛있게 잘 먹었다!! 말이 필요없는 투몬 마카다미아랑 바닐라 좋아하는 사람이면 완전 추천!! 다즐링 가나슈로 은은한 향긋함이 느껴짐 킥은 캐러멜라이징 된 마카다미아 발렁스 최애 디저트 ♡ 코튼언니랑 이것저것 얘기하다보니 시간 순삭 ㅋㅋ 선선할 때 한남동에서 보자구요~~ 50m © NAVER Corp. 발렁스 서울특별시 성동구 성수일로4길 49 1층 발렁스"
성수동 디저트 : 발렁스 (Balance),"출처 : 발렁스 인스타 성수동 대존맛 디저트 맛집.......................... 섬세한 맛의 타르트들이 미쳤고요... 구움과자도 맛있고요... 이제는 넘나 유명해져서 먹기가 더 힘들어졌다 위치 & 영업시간 발렁스 서울특별시 성동구 성수일로4길 49 1층 발렁스 일단 소개를 하기 전에... 요오오즘 맛집들이 대체로 그렇듯 이곳의 영업시간과 인스타를 숙지해야 헛걸음을 방지할 수 있다는 것부터 말씀드리고 싶다. 재고 소진시 마감이기 때문에 시시때때로 일찍 문이 닫혀 있다... 조기 마감 정보는 인스타에 올라오니까 방문 전 인스타를 필히 확인하자 전화 문의나 예약은 안받고 인스타 DM 으로만 예약 및 문의가 가능하다. 조기 마감일까 다 소진이라 없으면 어떡하나 불안해하며 가는 것보단 인스타로 예약 걸어놓거나 문의하는게 속 편할듯 (근데 난 안해봄) 수, 목, 금, 토, 일 12:00 ~ 19:00 월, 화 정기 휴무 인스타 링크 ▼ https://www.instagram.com/balance_patisserie/ 메뉴, 가격 & 내부 말모말모 추천메뉴랄 것이 없이 그냥 다 맛있다 재료 뭐 들어갔나 보고 취향에 맞춰서 아무거나 고르면 다 성공할 수 있는 곳 메뉴도 시즌마다 계속 바뀌어서 인스타를 필히 확인해야 한다. 가격대는 꽤 높은 편인데 8천원 후반대까지 가서 하나에 거의 9천원꼴 :)... 이지만..! 가격이 납득 가능하게! 맛있다는거! 출처 : 발렁스 인스타 인테리어도 정말 예쁜데 테이블이 한갠가 두개다 앉을 수 있을거라는 생각은 버리고 가야함.. 아니면 길고도 기약 없는 웨이팅을 기다리거나 고로 포장만 가능하다고 보면 될 것 같고 혹시라도 자리가 있다면 대럭키인거니까 앉아서 드시고 오십셔 포장해와서 집에서 즐기는 홈카페 디저트 포장해주는 패키지도 고급스럽고 예쁘다 버리기 좀 아까워쑴 주차 출처 : 네이버 거리뷰 캡쳐 주차 불가 성수동에서 주차가.. 될리가 없겠죵..? 차 잠깐 대고 타르트 후딱 사서 휘리릭 떠나는 것이 좋슴다 #성수발렁스 #성수동디저트 #성수동디저트맛집 #타르트맛집 #발렁스"
"<성수 발렁스> 성수동 디저트카페 발렁스 (balance), 벌써 올해 세 번째 방문","성수 발렁스 바닐라통카 / 께흐블랑 작년 한 해 나의 최애 디저트샵이기도 했던 성수동 발렁스. 2022년이 이제 한 달 지났는데 올 해만 벌써 세 번째 방문이다. 왜냐면.. 저번에 직장 동료와 발렁스에 갔는데 그 동료가 발렁스 마들렌을 먹어보더니 눈이 번쩍 뜨이면서 이제는 틈만 나면 발렁스 가자고 하기 때문..ㅋㅋㅋ 발렁스 맛있지..매일 가도 좋은 발렁스. 마침 성수동 발렁스의 최애 케이크인 께흐블랑도 나와서 오랜만에(?) 께흐 블랑 먹으러 방문했다. 몽블랑이 시즌아웃 되고 요즘 라인업은 금실딸기, 피스타시에, 바닐라통카, 께흐블랑이다. 피스타시에와 바닐라통카는 성수동 발렁스의 스테디&베스트 셀러로 굳어가는듯? 둘 다 완성도 높은 디저트라서 발렁스에 처음 간 사람에겐 이 두 가지 디저트를 추천하는 편이다. 동료들이랑 점심시간에 발렁스 가서 하나씩 포장해 와서는 냉장고에 넣어두기 ㅋㅋ 쪼르르 넣어둔게 귀여워서 한 장 찍었다. 집에 가져가서 먹을 줄 알았는데 일 하다가 당 떨어지는 타이밍에 나와서 휴게 공간에서 먹었다. 회사에서 눈치 보며 발렁스 케이크 먹기.. 성수동 발렁스 케이크 다 아는 맛인데 언제 먹어도 맛있고 짜릿해! 동료랑 반씩 나눠 먹었다. 께흐블랑은 쁘띠 사이즈로는 약 9개월만이고, 홀케이크로는 사실 한 달도 안 됐네.. 최애 of 최애 케이크라 쁘띠 사이즈로 나왔다고 안 먹을 수 없다. 이미 아는 맛이고 살면서 가장 많이 먹은 케이크인데도 안 먹을 수 없다.. 성수동 발렁스의 께흐 블랑은 그런 케이크다. 동료가 고른 (내가 추천한) 바닐라 통카. 바닐라 통카는 성수동 발렁스에서 처음 케이크를 사는 사람에게 꼭 추천하는 제품인데, 바닐라의 꽃향과 묵직하면서도 부드러운 향이 아주 강하게 나는 디저트다. 이토록 바닐라가 바닐라할 수 있다니,,! 라는 느낌이 드는 강렬한 바닐라 향에 통카의 날카로운 향이 잘 어우러진 디저트이다. 한 조각 먹으면 입김에서도 콧김에서도 향긋한 바닐라향이 날 것 같은, 향기로움 MAX인 디저트. 향이 강하기 때문에 또 향이 강한 술과도 잘 어울릴 것 같은 맛이다. 같은 바닐라 베이스의 무스이지만 또 다른 매력이 있는 께흐블랑. 바닐라향이 강하면서 텍스처는 부드러운 바닐라 무스에 바질의 향이 은은하게 나는 바질 크림, 딸기 콩포트가 들어가고 바닥에는 다쿠와즈가 깔려있다. 언제 먹어도 맛있고 고급스럽고 완벽한 디저트. 올해 첫 께흐블랑도 참 맛있었다. 처음 께흐블랑을 먹었을 땐 이 조합의 신선함에 깜짝 놀라고, 바질과 딸기의 향이 생각보다 잘 어울린다는 걸 알게 되었다. 바질을 디저트에 쓰는 걸 썩 좋아하지 않는 편인데 께흐블랑 덕분에 편견이 사라짐. 하지만 아직 다른 곳에서 딸기 바질 조합 디저트를 먹어보진 않았음...ㅎ 올해는 발렁스 디저트를 모두 먹어볼 것이다! 50m © NAVER Corp. 발렁스 서울특별시 성동구 성수일로4길 49 1층 발렁스 #발렁스 #성수동발렁스 #성수발렁스 #성수동카페 #성수카페 #성수동디저트 #성수디저트 #디저트카페 #디저트맛집"
