title,content
"성수동 카페, 어퍼룸(upperroom)",성수동 요즘 너무 자주 가지 않냐고? 나도 그렇게 생각한다. 아무튼 이 카페는 다크 그린의 받침대와 목조 분위기가 내 취향이어서 찾아갔다. 화장실이 카페 내부에 있다는 정보도 미리 알아봄! 평일 낮 기준 조용하고 분위기도 좋고 맘에 쏙 들었어 참고로 디저트는 케이크류는 없는 것 같았다 저기 아주 귀여운 사이즈의 휘낭시에인데 휘낭시에는 딱히 이거다 싶지 않았음. 커피는 부드러운 맛이었다고 기억해… (마시지 말았어야 했는데 라며 주문) 여하간 나는 공간이 주는 느낌이 더 중요하고 그게 정말 좋았으니까~~~ 화장실도 깨끗했으니까~~~ 좋았어~~~~ 1. 화장실은 남녀분리인데 여자화장실만 카페 내부에 있고 남자화장실은 바깥에 있다 2. 물비누 있다 3. 페이퍼타올 있다 4. 단칸인데 깨끗하게 관리되고 있다 Ailee 만나는 날. Day of small talk with Ailee! 그래서 진주귀걸이를 함 이건 진주귀걸이 기념사진😇 나는 라탄이 주는 동남아 너낌 등 좋고 다크그린과 다크우드 좋아하고 점토 같은 걸로 꾸며둔 것이나 디피해둔 엽서가 주는 분위기도 마음에 들어서 이곳 여러모로 취향에 맞았다. 창가쪽도 예뻤는데 사람이 있어서 사진 찍지 않았음. 새삼 아래 디저트 그릇도 진짜 예쁘네. 근데 테두리 색이 그린이라서 예쁜듯ㅋㅋㅋㅋ 그리고 내가 물 따르다가 아주 물통 콸쾅코라코타콸 쏟았는데 정말 친절하게 대응해 주셔서 감사했어요… 무척이나 감사합니다… 50m © NAVER Corp. 어퍼룸 서울특별시 성동구 성수일로12길 21 1층
[성수동 카페] 포근한 분위기의 “어퍼룸”,"✔️이름:어퍼룸 ✔️위치:서울 성수동 성수일로12길 21 1층 ✔️영업시간:화-토 11:00-22:00 (21:30 라스트오더) 일: 13:00-22:00 (21:30 라스트오더) ✔️단체석, 포장, 무선 인터넷, 남/녀 화장실 구분 어퍼룸 서울특별시 성동구 성수일로12길 21 1층 오늘 성수동에 위치한 어퍼룸에 다녀왔음 요즘 현대식으로 약간 모던한 느낌의 카페가 많고 인기가 많은데 저는 따뜻한 분위기의 카페를 더 선호해요 좀 덜 질리고 이야기하기에도 편안해서? 아무튼 그런 부분에서 어퍼룸 너무 좋았어요 생긴지 얼마 안돼서 그런지 아직 손님들이 엄청 많지 않아서 더 편안하게 즐기고왔어요 저희가 시킨 음료는 토마토바질에이드-6800 어퍼룸라떼-6000 음료가격은 조금 있는편...! 맛은 쏘쏘였어요 근데 카페 안도 사장님 느낌대로 너무 잘 꾸며놓으셔서 좋았어요 안에 식물도 많고 햇살이 차라락 들어오는게 근사했습니다 성수카페추천 성수동카페거리 커피추천 카페추천 성수동맛집"
"성수역, 여유와 편안함이 느껴지는 성수동 카페_어퍼룸",📍어퍼룸 🏷️서울 성동구 성수일로12길 21 1층 안녕하세요 !! 성수동에 새로 생긴 카페가 있어 다녀왔어요 핫플 골목이 아니여서인지 사람도 별로 없어서 조용하고 분위기는 정말 좋아서 포스팅하려고 합니다! #성수카페 #성수동카페 #성수동가볼만한곳 #성수어퍼룸 #어퍼룸 #어퍼룸카페 어퍼룸 카페에 들어서면 이런 격자무늬 투명창이 있어요 격자 타일 같은 창 예쁜 것 같아요.. 내 취향..♡ 화이트 & 우드 스타일이라 모던하고 깔끔하고 너무 예쁘더라구요 :) 좌식 처럼 앉아서 먹는 공간도 있는데 그 공간 마저도 인스타 감성 낭낭 ꈍ◡ꈍ 예쁜건 한번 더 ! 크 .. ൱ 말 다했죠 뭐~ 저는 저녁 7시쯤 갔는데 사람 저희 말고 딱 한테이블 더 있었어요 그래서 사진도 열심히 찍을 수 있었답니다 !! 금요일은 저녁 8시까지라고 하니 참고하세요 :) 사진 찍다보니 음료가 나왔어요 !! 어퍼룸 카페의 시그니처메뉴 #어퍼룸밀크 커피에요 먹는 법이 적혀있는 종이를 함께 주시는데 맛있으니 다들 한번 씩 드셔보세요~❤︎ 50m © NAVER Corp. 어퍼룸 서울특별시 성동구 성수일로12길 21 1층
"[일상 #06] 성수동 나들이 (우리마키, 폴라앳홈, 어퍼룸, 와인한잔)","결혼 후 친구랑 성수동 나들이~~ 새벽 5시에 일어나서 준비하고 서울 출발! 아침부터 두피케어 받구 친구 구까 만나서 데이투~ 우리마키에서 밥 먹구~ 대낮부터 생맥 조지고~~ 짠🍻 구까는 그릇, 나는 수저젓가락 세트 구입! 다음에는 식기세트 구매해야지~ 지금은 돈 없어 앙대~ 카페 어퍼룸 가서 먹은 밀크라떼?? 크림 진짜 미쳤다... 미숫가루 크림인데 역대 내가 먹어본 라떼 top3 안에 든다 근데 귀찮은 나레기는 카페 사진 안 찍어버림 하지만 ㅜ 진짜 진짜 맛있었어 너어.. 마지막으로 와인에 하몽멜론까지~ 오늘 집에가는 버스안 꿀잠 잘 수 있겠어~ 대만족 #일상 #성수 #맛집 #어퍼룸 #우리마키 #폴라앳홈 #와인한잔 #이웃 #이웃해요 #서이추 #서이추환영"
성수동 직장인의 점심시간 카페 :: 혼커타임하기 좋은 ‘어퍼룸’,50m © NAVER Corp. 어퍼룸 서울특별시 성동구 성수일로12길 21 1층 흐어어어 점심시간을 잘 활용하는 편인 성수동 직장인 나야나 점심시간에 조용히 나만의 시간을 가지기위해 성수동 직장인의 특권인!! 넘쳐나는 카페 하나하나씩 도장깨기중 성수동 카페 ‘어퍼룸’ 버터바로 유명한 카페인데 커피도 맛있어서 종종 생각날 때 방문하는 편 카페 한 켠에는 친환경적인 아이템들도 팔고 있다. 성수동에서 또 소품샵이 붐업중인데 어퍼룸에도 소품샵이 있음 생크래프트 고체 향수 샴푸바 생크래프트 샴푸바 어퍼룸에서 직접 만들었나부다 빨대집과 빨대 그리고 빨대 세척툴도 팔고 있음 팔로산토 (천연 인센스 스틱) 나무나무해서 태우면 좋은 향이 날 것만 같은. 한번 가볍게 사보기 좋은 가격대들의 아이템들! 전반적으로 따뜻한 톤의 우드톤 인테리어 카페 화장실 가는 길에 있는 벽도 예쁜 편 좌식 테이블도 있는데 오래 앉아있으면 다리 저리겠다..라고 생각하는 나 (엠비티아이 entj..) 고요..평안… 달달한 커피가 땡길 땐 역시 바닐라라떼 우유거품도 적당하고 적당히 달달한 라떼라서 넘 맛있다! 어퍼룸에 앉아있다가 회사로 다시 복귀하면 마음이 차분해진 느낌. 다음엔 버터바 먹으러 또 와야겠다 :) 성수동에서 조용한 감성 카페를 찾으신다면 ‘어퍼룸’ 추천합니다! 버터바 일짱 카페이니 버터바도 꼭 먹어보세요 -직접 사먹고 작성한 내돈내산 포스팅입니다-
성수동카페 - 분위기 좋은 북성수 카페 어퍼룸,"최근까지는 아니지만 생긴지 오래되지 않은 성수동카페 어퍼룸에 다녀왔어요 “성수동카페 - 어퍼룸” 요새 유럽에서는 교회매물?들이 많이져서 교회를 개조한 엔터테인먼트 공간이 늘어나고 있다고 하는데요 여기는 그런 공간은 아니고 교회 건물 1층에 새로 생긴 카페에요 위에 있는 충원교회에서 운영하는 카페일까 그래서 어퍼룸 위에는 교회가 있다는 의미일까 궁금해서 찾아보니 “빠르게 흘러가는 시대와 그에 맞추어 적응해가는 … 여유도 느끼지 못할 때가 많습니다. 일상의 쉼과 여유와 편안함이 필요한 공간 그곳을 우리는 upper room 다락방이라고 부르게 되었습니다.” 전혀 관계가 없었습니다. 편안한 다락방을 모티브로 만든 카페였어요 편안함과 쉼이 주요 모티브여서 그런지 따뜻한 조명과 플랜트 인테리어에요 아이스아메리카노 4,600원 카페라떼 4,800원 발로나초코밀크 6,300원 보통의 성수동 카페와 비슷한 수준이에요 간단한 파이나 베이글도 판매하고 있어요 작은 파운드케익처럼 생겼는데 이름은 버터바에요 특이하고 먹기 편할 것 같아요 다락방 느낌이 나는 짙은 계열의 가구들과 따뜻한 조명이 주를 이루고 있어요 어퍼룸 성수동카페 재생 0 좋아요 0 00:00 00:00  어퍼룸 성수동카페 특히 재미난 공간은 왼쪽에 얼핏 쪼금 나온 곳인데요 신발을 벗고 올라가는 찐 다락방 느낌의 테이블이 두개있어요 아이스아메리카노 4,600원 마시자마자 엄청난 풍미와 향으로 기억에 남는 아메리카노는 아니지만 분위기와 잘 어울리는 향이 좋은 커피에요 북성수에 있는 조용한 카페 바로 앞에는 성동안심상가가 있어서 주차하기도 편한 곳이고 헬로우뮤지엄에 방문했을 때도 오기 좋을 것 같아요"
성수동 분위기 좋은 카페 발견! 어퍼룸 UpperRoom,"성수동에서 점심을 먹고 카페를 어디로 갈까~ 하는데 어라? 분위기가 엄청 좋은데 사람은 없는 카페를 발견! 한번 가봤습니다. 전체적으로 새거 느낌이 팍팍나는게 아직 입소문이 안나서 조용한 것 같고 아마 조만간 사람 늘어날 것 같은 느낌이었답니다... 50m © NAVER Corp. 어퍼룸 서울특별시 성동구 성수일로12길 21 1층 성수역과 뚝섬역 사이에 있는 어퍼룸 UpperRoom 이라는 카페인데요. 카페 내부에 자리가 많은건 아니지만 분위기가 좋고 아직 새 카페라서 사람이 많지는 않아서 충분히 앉을 수 있었습니다. 커피와 차, 에이드 등등 다양하게 판매해서 카페인을 못드시는 분들도 부담없이 오실 수 있고 거기다 디저트류도 꽤나 다양해서 좋았습니다. 물론 배불러서 안먹었지만요! 전체적으로 테이블은 8개? 정도 있었던 것 같아요. 대부분 4인석이라 여러명이 와도 편하게 있을 수 있는 분위기였어요. 소파 자리도 있었고요. 가장 편해보였던 자리입니다. 물론 등받이 없는 한 쪽에 앉는 분은..네.. 화이팅.. 카페를 분위기 좋게 잘 꾸며둔 것 같아서 성수동에 가게되면 또 들러도 좋겠다 싶었어요. 사실 요즘 분위기 좀만 좋으면 금방 소문나서 조용한 곳 찾기 힘든데 참 좋은 시간이었습니다. ㅋㅋ 여기는 뭔가.. 앉아서 먹기는 좀 많이 부담스러울 것 같고 포토존으로 컨셉잡고 앉아서 사진찍으면 좋겠다 싶었습니다. 성수동에 가면서 조용하지만 분위기있는 카페를 찾는다면 추천합니다!! 그런데 막상 음료나오고는 바로 마셔서 음료 사진은 없는게 함정.... 참고로 #내돈내산 맞습니다!! #성수동 #카페 #분위기좋은카페 #성수역 #뚝섬역 #어퍼룸 #upperroom #성수개인카페 #성수동개인카페 #성수카페추천 #성수조용한카페 #성수어퍼룸 #성수동어퍼룸 #성수역어퍼룸 #성수역개인카페 #성수역개인카페추천"
[성수동 성수역 카페] 어퍼룸 / UPPERROOM,#어퍼룸 성수 우드 톤의 따뜻한 분위기 + 어딘가 모르게 화장실 감성 (?) 넓지도 작지도 않은 공간인데 테이블 간격이 좁지 않아 좋았다. 커피와 음료 외에 디저트 종류도 조금 있었다. 버터바 파는 곳 흔하지 않은데 어떤 맛일지 궁금. 한창 난리였던 트와이닝.. 나도 자주 먹었었는데.. 어쨌거나 어퍼룸은 TWG 브랜드를 사용한다고 한다. #발로나초코밀크 아이스 초코를 마셨는데 무난한 맛이었다. 음료보다는 위에 올라가는 크림이 맛있었다. 어퍼룸은 성수 카페거리 반대편에 위치한 곳인데 아무래도 번화가 쪽은 아니라 그런지 사람이 적었고 개인적으로는 너무 북적이지 않아 평화로워서 좋았다. 50m © NAVER Corp. 어퍼룸 서울특별시 성동구 성수일로12길 21 1층 어퍼룸 영업시간 11:00 ~ 22:00 금요일 11:00 ~ 20:00
<노운 noun> 23fw 프리뷰 정보 및 할인 혜택 (from. 성수동 카페 어퍼룸),안녕하세요 승하이입니다😄 오늘은 노운 브랜드의 23fw 프리뷰 소식을 전달해 드리려고 합니다😄 노운은 중성적인 실루엣과 부드러운 무드를 기반으로 매 시즌 새로운 컨셉트를 제시하는 브랜드입니다. 부드러운 소재와 따뜻한 색감의 원단을 주로 사용하며 독특하지만 과하지 않은 패턴과 디자인으로 항상 새로운 시도를 하고 있습니다!! 노운 23fw 프리뷰 정보 노운(noun) 23fw 프리뷰 행사 📌 장소 - 서울특별시 성동구 성수일로 12길 21 1층(카페 어퍼룸) 50m © NAVER Corp. 어퍼룸 서울특별시 성동구 성수일로12길 21 1층 📌 날짜 : 9월 22일 - 9월 24일(금-일) 📌시간 22일(금) 14:00 - 20:00 23일(토) 11:00 - 20:00 24일(일) 11:00 - 18:00 현장 구매 혜택 1️⃣ 신상 일부 상품 20% 할인 -> 후디드 자켓. 데님 팬츠. 셔츠 니트. 티셔츠. 치노 팬츠(브라운. 네이비). 멀티 팬츠(코듀로이). 페몬트 협업 제품 ✅️ 페몬트 협업 제품은 265. 290 사이즈만 디피되어 있고 현장 수령이 불가능하며 추석 전 배송으로 판매가 진행됩니다. (재고가 한정되어 있기 때문에 품절 시 구매가 불가능합니다) 2️⃣ 이월 재고 일주 산품 50% 할인 -> 바지 위주 제품 3️⃣ 구매하신 분들께 드리는 혜택 - 랜덤 적립금 쿠폰 발금(1000원 ~ 20000원) - 결제 금액 기준 20만원 이상 구매 시 23fw 티셔츠 증정(배색 쭉티) 4️⃣ 방문하신 모든 분들께 드리는 혜택 - 신상 할인 쿠폰 5%(23fw 상품만 적용되며 중복사용가능) - 아이스 아메리카노 1인 1잔 ⚠️ 추가정보 - 신상품과 페몬트 협업 제품은 한정된 수량만 판매 검정컬러만 200족 선 구매 가능 - 23fw는 9월 27일부터 3차수로 나누어 발매예정 노운(noun) 23fw 프리뷰 행사가 성수동에서 열린다고 하니 관심이 있으신 분들은 방문해서 신제품을 미리 보고 경험하시면 좋을 것 같습니다! 신상품 일부 20%할인과 이월상품 일부 50%할인까지 혜택을 받아서 득템을 하시길 바라겠습니다😆 그럼 이만 노운 브랜드 프리뷰 행사 소식을 마무리하겠습니다👋 #노운 #noun #가을옷추천 #겨울옷추천 #남자옷추천 #성수동 #프리뷰행사 #어퍼룸
"[일상] 8월에 다닌 성수동(서울앵무새,호랑이초밥성수,슈슈베어,어퍼룸,섬세이테라리움,보다버거,성수찜닭,녹마이,어커,오롯,포어플랜,크레이프커피,소문난성수감자탕,플디 성수)","서울앵무새 서울특별시 성동구 서울숲9길 3 B1~2F 오빠랑 간 서울앵무새 여긴 왜 또 유명한 걸까 하면서 가보게 되었다. 웨이팅은 없었지만 평일 저녁이었는데도 사람이 바글바글 했음 굿즈 귀욥 알고보니 이 카페에선 베이커리류를 시켜서 같이 나오는 접시에 낙서를 하는 것이 유명한 것이었당,, ㅋㅋㅋ 그것도 모르고 커피만 시켜먹었지 모얌 왜이리 낙서가 많은가 했네 호랑이 초밥 서울특별시 성동구 아차산로7길 14 점심에 먹으러 간 호랑이초밥 가격도 괜찮고 구성도 좋고 맛도 있당 슈슈베어 서울특별시 성동구 성수일로10길 9 1층 슈슈베어 밥먹고 지나가는 길에 오픈했길래 들어가본 소품샵 슈슈베어 ㅋㅋㅋㅋ 존귀 ㅠㅠ 스프레이병이 못생기고 귀여운데다 쓸모있어 보여서 당장 데려왔당 ㅎㅎ Next image 트롤 실물 약간 무섭 ;; 어퍼룸 서울특별시 성동구 성수일로12길 21 1층 두번 가본 어퍼룸 카페 어퍼룸라떼 짱맛 토마토바질에이드 짱짱맛 ㅠㅠ 가격은 조금 사악하다 어퍼룸라떼는 테일러커피 블루지와 맛이 걍 똑같은거 같음 섬세이 테라리움 서울특별시 성동구 서울숲2길 44-1 섬세이 테라리움 (지하1층) 예약 자연체험 전시 섬세이 테라리움 암흑속에 들어가 오로라도 보고 물도 느끼고 바람도 느끼고 전시는 한타임에 두 팀씩 예약이 가능 한 듯 한데, 충분히 공간을 느낄 수 있도록 텀을 두고 출발 시켜 주신당 그렇지만 음료 먹는 곳에서 다 만남 ㅋㅋㅋ 되게 대충 만든 티가 나는 음료인데 나름 맛있었다 ㅋㅋㅋ 공포체험 아님 ㅠ 귀엽당 시골 놀러간 애들 같아 타이밍 잘 맞춰야함 그나저나 가장 기억에 남는 건 바로 저 슬리퍼.. 슬리퍼 왜케 편해요 어디서 구해요 슬리퍼.. bd버거 성수 서울특별시 성동구 성수이로14길 7 예약 오빠가 맛난다고 해서 가게 된 보다버거 맛은 있는데요 사이드는 가지튀김 게걸스럽게 먹게 된다는 단점이 있다 새우패티도 되게 까슬해서 입천장 다 긁어 ㅠ 결국 다 분해해서 먹음 성수찜닭 서울특별시 성동구 아차산로7길 28 1층 성수찜닭 점심에 갔다온 성수 찜닭 맛있다.. 닭볶음탕은 더 맛있다 녹마이 서울특별시 성동구 왕십리로14길 18 예약 째끄만데 늘 웨이팅이 있는 녹마이 같이 간 동료는 똠양꿍 나는 쌀국수 그리고 쏨땀과 가라아게를 같이 먹었당 아주 만족스런 조합 끄덕 어커 서울특별시 성동구 광나루로4길 12 Accur 여기도 점심에 간 카페 만족만족 카페 오롯 서울특별시 성동구 상원6나길 7 1층 카페오롯 오렌지에이드 맛집 오롯 테이블 간격도 넓고 공간도 여러개로 나눠져있고 쾌적하다 회사에서 가까운 카페 중에선 제일 마음에 들어 🥹 포어플랜 서울특별시 성동구 왕십리로14길 30-11 1층 오픈한지 얼마 안 된 신상 카페&바 낮엔 카페 저녁엔 바로 운영된다고 한다 넘나 감각적인 공간 ㅠㅠㅠ 마냥 있고 싶게 만든다 토마토바질에이드와 요거트스무디 그리고.. 대존맛 케익 말렌카 레몬 제발 포어플랜에서 말렌카 레몬 드세요 하 나 저녁에 딤섬 먹어야돼 ㅠㅠ 하면서 포크질이 멈추지 않았다고 한다 토마토바질에이드가 맛없단 동료에게 다시 먹어보라고 강요(?)해서 엇 맛있네! 라는 반응을 끌어내었다 만족 예쁘기 까지 해 크레이트커피 서울특별시 성동구 성수일로12가길 10 지나가다 눈으로 찜해둔 크레이트커피 비가 왔던 날이라 아무도 없었당 ㅎㅎㅎ 날이 좋았을땐 꽉 차 있었는데 ! 비밀 공간 처럼 생긴 자리도 있었다 크레이트커피 가면 퀸아망... 너무 맛있음 여기 다른디저트도 다 맛있을거야.. 먹을거야.. 또 갈거야.. 소문난성수감자탕 서울특별시 성동구 연무장길 45 점심에 성수감자탕에 도전해보기로 했다 부지런히 걸어갔지만 예상대로 웨이팅이 ㅠㅠㅠ 지난번에 30분 기다려서 들어간 줄이랑 비슷한 길이였다. 차선책이 없어서 자포자기로 기다려 보기로 했는데 이게 왠걸! 줄을 모두 끌고 별관으로 들어감 ㅋㅋㅋㅋㅋㅋㅋㅋㅋㅋㅋㅋㅋ 무슨 단체 관광객 마냥 한꺼번에 앉아서 주문을 넣고 감자탕 공장 처럼 순식간에 뼈해장국이 나왔당 저 소스.. 저거 먹어본 사람들만 아는 저 맛 회사동료는 지난번에 먹은 감자탕 보다 뼈해장국이 더 맛있다고 한당 난 둘다 맛있오 플디 성수점 서울특별시 성동구 상원길 44 2층 케익 맛집 플디 성수 딸기케익이 유명한데 시즌이 아니라서 없었다 겨울에 다시 올게욧 복숭아 케익 휴.. 숙제 끝 ^^"
성수동 분기위 좋은 카페 '어퍼룸',"추석에 성수동에 있는 카페를 다녀왔어요. 연휴인 만큼 추석 오전에 오픈한 카페가 많이 없었어요!!! 너무 카페를 가고 싶어서 동네를 돌아다니다 온화한 분위기의 카페를 발견! 통 유리창 + 라타의 조화 분위기가 너무 좋은데 차만 잠시 마시느라 인테리어 사진을 못 찍었어요! 네이버에 있는 사진을 잠시 가져올게요!! 분위기가 너무 따뜻하달까... https://map.naver.com/p/search/%EC%96%B4%ED%8D%BC%EB%A3%B8/place/1964635228?c=14.56,0,0,0,dh&placePath=%2Fphoto%3Fentry%253Dpll 저희는 차 3잔을 시켰어요! 블랙티, 겐마이차, 아메리카노!! 이쁜 찻잔과 깔끔한 맛 찻잔 너무 이쁘죠!!! 잔도 너무 이쁜데 심지어 뜨겁지 않은 적당한 뜨거움... 온천에 온 것 같은 기분이었어요. 블랙티 강추해요!!! 그리고 아메리카노는 진짜... 원두를 어떻게 로스팅한지는 몰라도 프렌차이즈 카페랑은 달라요... 깊은 맛인데 굉장히 끝맛이 좋다랄까... 따뜻하게 마시는걸 강추합니다!! 케이크는 단호박케이크인데 신메뉴 만드셨다고 서비스로 주셨어요!!! 크림 조금 묻혀서 먹어보니깐 달콤하면서도 꼬소하니 정말 맛있었어요. 위치가 번화가랑 좀 거리가 있지만, 맛과 분위기를 생각하면 꼭 한 번 가보시는걸 추천드려요!! 50m © NAVER Corp. 어퍼룸 서울특별시 성동구 성수일로12길 21 1층"
"[성수동 카페] 조용하고 감성 있는 우리만의 공간, 크리스마스 카페 추천, 성수동 어퍼룸 카페",성수역에 워낙 이쁘고 좋은 카페가 많아서 어딜 갈지 늘 고민인데요.. 오늘은 뭔가 북적이는 느낌이 싫어 조용한 공간을 찾고 있던 와중 보물 같은 공간을 찾았어요 그러니 이건 꼭 블로그에 기록해야 해😛 성수동 카페 어퍼룸 성수역 1번 출구에서 나와 도보 10분 거리에 위치한 이곳 입구부터 따뜻한 감성이 뿜뿜합니당.. 아기자기한 분위기 Next image 크리스마스 분위기까지.. 감성 어떻게 하죠? ㅠㅠ 이뿐 친구는 코피 주문 중 크리스마스 분위기에 맞추어 꽃도 샀어요 저희가 앉았던 구석자리는 이렇게 감성이 충만.. 마지막으로 전신거울에서 감성샷도 잊지않아용 카페 앞에서 찰칵찰칵 오랜만에 사람 많은 성수동에서 이렇게 조용하고 이쁜 카페를 알게 돼서 진짜 너무 감동.. 담에 또 올꺼에용
[성수동 카페] 성수동 버터바 맛집은 여기! ‘어퍼룸’,"버터바에 꽂힌 요즘 집 근처 카페에서 우연히 버터바를 맛봤다가 꾸덕함+확 올라오는 버터맛에 반해서 버터바 맛집을 찾아다니기 시작..!!! 성수동 출근러로서 성수동에 버터바 파는 곳 다 가볼 생각으로 도장깨기를 시작했고, 첫 스타트로 어퍼룸에 가봄! 우드톤의 깔끔한 내부 좌식 타입의 귀여운 자리도 있다 우드톤 취향저격 어퍼룸 노리고 갔던 메뉴, 버터바 그리고 달달한 디저트엔 아아 어퍼룸 버터바는 굉장~~히 꾸덕해서 포크로 잘 안잘릴 정도! 그리고 스카치캔디가 떠오르는 달달한 버터맛이 난다 작지만 굉장히 농축된 꾸덕한 버터바 적당히 산미가 느껴지는 커피랑 넘 잘어울려 성수동 버터바 맛집으로 인정-! 어퍼룸이 슬세권인게 좋다 ㅎㅎ 성수동 슬리퍼족의 버터바 맛집 탐방은 계속된다~!! 50m © NAVER Corp. 어퍼룸 서울특별시 성동구 성수일로12길 21 1층"
"[서울/성수동카페]어퍼룸,분위기좋은카페,성수동카페","성수동 갔다가 잠깐 들렀던 성수동 어퍼룸- 간판은 귀엽게 써있음ㅋ 밖에서 보면 여기 카페 맞나?하는 카페들이 모여있다 요즘 카페감성인가... 앞에도 예쁘게 해놈 50m © NAVER Corp. 어퍼룸 서울특별시 성동구 성수일로12길 21 1층 카운터도 깔끔- 12월이라 크리스마스 분위기로 꾸며 놓으셨다. 여기 귀여워서 앉을까 했는데 좌식 귀찮...ㅋㅋ 눈으로 보는걸로 만족하기로- 대체로 아늑한 분위기의 매장이다. 근데 저 조명갓이 커서 다들 머리 한번씩 부딪히심ㅋㅋ 물론 나도...ㅋㅋ 뭔가 균형이 맞는 자리라 보기가 편안한 자리 ㅋㅋ 인스타갬성인가,,아닌가,, 머스캣주스랑 따뜻한 레몬차 시켰다. 달달하니 좋다."
성수동 조용하고 분위기 좋은 카페 -어퍼룸,오랜만에 핫한 동네 ‘성수’에 다녀왔어요 점심 먹고 조용한데 분위기 좋은 곳을 친구가 알고 있다고 하여 ㅎㅎ따라갔어요 통창이라 밖에서도 안에서도 시원시원🩵 다양한 음료와 디저트가 준비 되어있어요 공간이 무지 넓으면서 다양한 테이블과 의자가 있어요 저기 신발 벗도 앉는 곳도 있네요 ㅎㅎ 전체적인 분위기가 조명이 따뜻하고 나무로 된 가구여서 마음이 편안해 지는 느낌을 받았어요 여기엔 팔로산토 인센스를 낱개로도 판매하는데 제가 원래 좋아하던 향이라고 친구한테 말했더니 두세개 구매를 하더라구요 라떼와 디카페인 아이스아메리카노 저건 이름은 기억 안나는데 레몬 맛이 났어요 적당히 달달하고 식감도 좋더라구여 #성수카페 #성수동데이트 #성수역카페 #뚝섬역카페 #뚝섬역 데이트 #성수동커피 #뚝섬역커피 #성수역커피 #성수역디저트 #성수동조용한카페 #뚝섬역조용한카페 총평: 별 5개 분위기: BGM도 재즈라서 굿❤️ 시끄럽지 않고 조용해서 친구랑 즐겁게 이야기 나눌수 있었어요 아쉬운 점: 딱히 없어요 맛: 음료와 디저트 모두 좋아요
