title,content
2023 소녀시대 서현 생일 카페 - 아이오쓰리 성수사거리점,"지난 6월 25일의 간단한 수도권 출사입니다. 성수역 3번 출구로 나옵니다. 3번출구로 나와서 뚝섬역 방향으로 걸어갑니다. 아이오쓰리 성수사거리점 지난 윤아 생카에 이어 한달만에 다시 왔습니다. 아이오쓰리 성수사거리점 이번에는 소녀시대 막내 서현의 생일카페가 있기 때문입니다. 0628. 원래는 이번 생일이 33번째 생일이겠지만, 서현의 생일 당일에 대한민국에 만 나이가 도입되었기 때문에 만 나이로 32번째 생일이 되었습니다. 작년 포에버원 음악방송 때 서현의 모습. 여름 햇살 그리고 너 서현의 생카로 꾸며진 아이오쓰리 성수사거리점 내부로 들어갑니다. 여신 분위기의 서현 2018년 드라마 시간 때 앞머리 있었던 모습 같습니다. 2018년 드라마 시간의 주인공 설지현 역을 맡았을 때 모습입니다. THE SEOHYUN 서현 화보 0628 청량한 서현의 모습 작년 드라마 징크스의 연인 때 모습 작년 포에버원 음악방송 때 모습 소시탐탐 때 라디오 관련해서 파자마 옷차림 했을때인가봅니다. 포에버원 음악방송 때 모습 바닷물을 보니 동해바다인 듯 하네요. 동해바다를 배경으로 한 날개 조형물 서현 인스타에 나왔던, 제주시 성수동 카페. 이거 보자마자 저도 그 카페로 당장 갔던 기억이 납니다 크리스마스~ 서현의 모습 최근 하와이 때 사진 14주년 때 유퀴즈 촬영했을 때 모습 아이오쓰리 성수사거리점 내부 서현의 모습 빨간맛 다이어트 광고모델 당시 모습. 시상식에서의 화이트 드레스 서현 하와이에서 빛나는 서현! 서현의 소속사 나무액터스 시즌그리팅 아이오쓰리 성수사거리점 서현의 사진들 하와이에서의 화보! 서현 하와이 화보 서현의 귀여운 모습 제주시 성수동 카페에서의 서현 모습! 서현의 다양한 모습 연습실에서의 모습 아이오쓰리 성수사거리점 메뉴 서현 생카 나눔 존 서현 생카 특전 메뉴 아이오쓰리 성수사거리점 메뉴판 2023 서현 생카 컵에 나타난 서현 모습 포스팅한 날짜 기준으로 최근에 태연의 콘서트 투어 관련 대우 관련하여 트럭시위가 있다고 하여, 혹시나 해서 SM 사옥에 트럭시위가 있나 해서 와봤습니다. 샤이니 팬미팅 보이콧을 시작으로, 이번에 태연의 부당한 대우 관련하여 트럭시위가 또 있고, 요즘 SM 사옥 주변에 그룹별로 다양하게 부당한 대우 때문인지 트럭시위가 잦아지고 있네요 하지만 제가 방문했을 당시엔 트럭시위 모습이 없었습니다. 광야 전광판에 나타난 소녀시대 표시 SM 사옥 1층 전광판의 SMCU PALACE 태연, 효연 모습 그리고 전광판에 샤이니 15주년 관련하여, 8집에서 선공개한 The Feeling 이라는 노래가 있는데, 오키나와에서의 청량한 모습과 노래 멜로디가 마치 바다 여행을 하는 듯한 기분이었고, 바닷속에서 뛰고 싶은 심정이었습니다! 또 샤이니가 콘서트를 열었을때, 서현이 콘서트를 관람했습니다. 샤이니에 91년생 동갑이 두 명이 있고 친분이 두텁기 때문이지요. 대학로에서 철도 관련된 뮤지컬 안내 서울숲역 대합실 전광판에 3월 공개됐던 다시만난세계 오케스트라 버젼이 나타나고 있습니다. 소녀시대 데뷔 당시 모습, 10대 소녀들의 꿈, 15주년 팬미팅 때 모습이 번갈아가면서 나와서 인상깊었습니다. 서울숲역의 유노윤호 솔로 데뷔 4주년 축하 광고판. 오는 8월 7일 유노윤호가 세 번째 미니엘범으로 컴백이 예정되어 있습니다. 이번 출사는 2023년 06월 25일에 다녀왔습니다. 50m © NAVER Corp. 아이오쓰리 성수사거리점 서울특별시 성동구 성수이로20길 60 1층"
[성수]아이오쓰리 성수사거리점 카페 보아생카,"아이오쓰리 성수사거리점 서울특별시 성동구 성수이로20길 60 1층 아이오쓰리 성수사거리점 ☑️ 서울 성동구 성수이로20길 60 1층 ✅ 평일 08:00~19:30 / 토,일 11:00~19:30 ☎️ 0507-1305-1961 11월 2일부터 11월 5일까지 진행됐던 #보아생일카페 #아이오쓰리 성수사거리점에 방문했습니다!! 점핑보아라면 다들 가봤겠죠? ㅎㅎ 생일 당일 특전은 못받았지만 첫 날 오전에 방문해서 특전은 받을 수 있었어요 그럼 저의 행복했던 보아생카 리뷰 보시죠! 외부 건대역 6번 출구로 나와서 쭉 걸어오시면 금방 도착해요 ㅎㅎ 외관부터 보아 포스터가 붙어있어서 한 눈에 여기군아! 알 수 있을 정도예요 너무 이쁜 포스터 속 보아 >< 파란색이 컨셉인거 같아서 저도 파란색 셔츠를 입고 갔습니다 ㅎㅎ 반대편 카페 외관은 이렇게 생겼어요 포토 부스라고 써있는데 이 안쪽에서 생일기념 인생네컷도 찍을 수 있더라고요!! 내부 기념으로 찰칵 V（。＾▽＾）V 한 쪽 벽면에도 1105 보아 생일날로 꾸며져 있어요 ㅎㅎ 여기 앞에서 무조건 인증샷 찍어줍니다 인생네컷 기계도 있어서 기념으로 사진도 찍었어요! 한 번에 2매씩 나오는 줄 몰라서 사진을 4장 찍었습니다 ^^;; 카페가 온통 보아로 꾸며져 있어서 구경하느라 정신이 없습니다! 카페 자체도 전체적으로 화이트 톤에 아담해서 커피 마시고 사진찍기 좋았어요 BTI 투표도 해주고 너무나 이쁜 보아 콘서트 영상! 나도 저 날 저기 있었는데 😭 엉엉 또 해줘요 콘서트.. 메뉴판 아이오쓰리 카페의 기본 메뉴는 이렇게 있어요 개인 텀블러를 이용하면 가격도 할인 받을 수 있다고하네요! 커피 원두는 2가지 중에 고를 수 있습니다 전 당연히 보아 특전세트를 주문했어요! 거기에 디저트로 쿠키를 1개 더 추가로 시켰습니다 해피 보아데이 스페셜메뉴 23,200원 더(보아뮤지컬리)치 커피*2개 르벵쿠키 피넛버터 -4,800원 르벵쿠키 레드벨벳 -4,800원 더치커피는 깜찍한 통에 담겨져서 나오네요! 함께 주문한 레드벨벳 쿠키랑 먹었는데 쿠키 넘 맛있고 잘 어울립니다 ㅎㅎ 쿠키 하나는 함께 성수까지 와준 김상추씨에게 드렸습니다! 고마워 친구야!😚 77ㅑ하! 너무 귀엽고 푸짐한 특전 😍🧡 화장실 여자 화장실은 카페 카운터 옆으로 들어가면 있어요! 가게 내부에 있어서 이용하기 편하고 깨끗했습니다"
분위기 좋고 커피 맛있는 카페 - io3 아이오쓰리 성수사거리점 (대관가능),"촬영 출장 가기전에 잠깐 들린 카페! io3 성수사거리점 오전에 갔더니 사람이 한명도 없었다! 통창으로 되어있어서 시원시원해보인다. 영업시간 월 ~ 금 : 8am - 7:30pm 토,일 : 11am - 7:30pm 채광이 좋아서 햇빛도 잘들고 촬영만 아니었으면 한참 앉아서 쉬다가 가고싶은 인테리어 ㅠ 보니까 대관이 가능하다. 아이돌 팬미팅? 이라고 해야하나 굿즈같은거 만들어서 가지고갈 수 있게 만드는 행사를 많이 할수 있게끔 인테리어 해놨다. Next image 카페안에 인생네컷이 있다..?! 공짜인줄알았는데 1500원 내야된다고해서 그냥 안함 ㅠ ㅋㅋㅋㅋㅋㅋㅋㅋㅋㅋㅋㅋㅋㅋ 큼지막한 메뉴판 조아조아 메뉴가 많다 담에는 다른 메뉴좀 먹으러 가봐야겠다! 여기 블로그해야겠다라는 생각이 든이유가 MD들을 파는데 이 MD들이 너무 내스타일이다 ㅠ 너무 너무 귀엽고 사랑스럽다 예전에는 테이크아웃하면 일회용잔이아니라 저기 바틀에 담아서줬다고하는데 지금은 500원 추가하면 바틀에 준다고한다. 바틀 갖고싶었는데 이미 일회용컵에 나와버려서 그냥 나옴 ㅠ 화장실도 매우깔끔깔끔! 포토존있어서 한컷 뀨 커피 홀더도 이쁘다..! 여기 진짜 감성적으로 가기 좋은것같다 성수동이라서 한번쯤 들리기 좋은 카페 추천! 50m © NAVER Corp. 아이오쓰리 성수사거리점 서울특별시 성동구 성수이로20길 60 1층 #아이오쓰리 #io3 #io3성수 #성수카페 #성수카페추천 #성수인스타카페 #인스타감성카페성수 #아이오쓰리대관 #성수카페대관"
20230808 시백우 생일카페 - 아이오쓰리 성수사거리점,"한 두달 전인가 보위 생일을 검색하다가 보위 생일카페가 올해 열린다는 걸 알게된 1인 한국에서 보위 생일카페가 열린다니!!!! 지난 3년간 보위 생일을 축하하면서 이런 일은 한번도 없었는데 정말 감격이었다,, 그래서 8월 8일날 보위 생일카페에 갔다옴!! 물론 내가 간건 아니고 언니가 대신 가줌ㅋㅋㅋㅋ 지방러는 웁니다ㅠㅠㅠ 언니가 사진을 잘 찍는 편인데 대신 간게 다행인것 같기도 하구,, 근데 언니가 찍어준 사진 보니까 못 간게 너무 슬펐음ㅠㅠㅠㅠ 진짜 예쁘게 잘 꾸며놨는데ㅠㅠㅠㅠ 다들 후기 포스팅 많이 올릴줄 알았는데 생일 지난 오늘까지 하나도 안 올라와서 괜히 맴 아파짐 그래서 제가 써봅니다요! 저처럼 보위 생일카페 못 가신 분들 대리만족 하시길 바라며 열심히 써보겠습니당!! *사실 보위 생일은 8월 9일인데 언니가 8월 8일만 시간된다고 해서 미리 갔다왔슴다 *원래는 이 포스팅에 다 쓰려고 했는데 너무 길어져서 파티세리 로그 생일카페는 다음 포스팅에서 쓸게요:) 시백우 생일카페 - 아이오쓰리 성수사거리점 아이오쓰리 성수사거리점 생일카페 기간과 특전은 이렇게있다! 상견니 카페도 진행했었는데 그땐 가진 못했음ㅠㅠ 나는 전체특전과 세트특전을 받았다! PS. 특전 사진은 포스팅 맨 밑에 있습니다! 시백우 생일카페 - 아이오쓰리 성수사거리점 먼저 아이오쓰리 성수점을 방문함! 도착하면 이렇게 보위 생일카페라는 걸 알 수 있는 보드가 있었다 한국에서 施柏宇 生日快樂 를 보게 되다니! 진짜 감격 그 잡채다ㅠㅠ 시백우 생일카페 - 아이오쓰리 성수사거리점 한국 왔을때 찍힌 사진도 있었음! 시백우 생일카페 - 아이오쓰리 성수사거리점 아이오쓰리 성수 시백우 생일카페 컨셉은 '그해여름 1996'이다! 아니 이 많은 사진들을 언제 다 인화해서 준비하신건지ㅠㅠㅠ 정말 감사합니다 진짜 개인소장하고 싶은 사진들이 너무 많았다 나도 인화해볼까? Next image 시백우 생일카페 - 아이오쓰리 성수사거리점 보위가 한국 와서 인터뷰한 잡지도 전시돼있었음 그리고 보위의 모든 순간이 담긴 사진들이 테이블 위에 이리저리 놓여 있었다 쓰면서 다시 느끼는 거지만 엉엉엉 내가 갔어야했어ㅠㅠㅠ Next image 시백우 생일카페 - 아이오쓰리 성수사거리점 좋은건 조금 더 자세하게 봅시당! 보위가 인스타에 올린 사진도 인화돼서 꾸며져 있었어여ㅠㅠㅠ 난 왜 그동안 인화할 생각을 못했던 것인가 사진정리해서 인화해야지 진짜 시백우 생일카페 - 아이오쓰리 성수사거리점 나 저 학생증 가지고 싶다 증말루 어디 파는데 아시는분 알려주세요 지갑에 넣고 다니게 그러고보니 보위 상견니에서 81년생이었네 와우ㅋㅋㅋㅋ 시백우 생일카페 - 아이오쓰리 성수사거리점 그해 여름:1996 밑에는 중국어로 '다들 준비됐어?'라고 적혀있는데 당근이지!! 보위의 27번째 생일을 진심으로 축하해:) 시백우 생일카페 - 아이오쓰리 성수사거리점 아이오쓰리에서만 파는 굿즈 선반에도 붙여져 있던 보위 생일카페 포스터 내가 보위는 그렇게 인기 안 많아서 가도 사람 많지 않을거라고 했는데 언니가 오픈하자마자 가본 결과 사람이 꽤 있었다고 한다 보위 더더 유명해져ㅠㅠ 시백우 생일카페 - 아이오쓰리 성수사거리점 메뉴는 이렇게 있었습니다 췐탕웨이빙 너무 궁금했는데 언니는 커피를 선택했음 역시 상견니를 안 본 자는 췐탕웨이빙을 모르는구만! 내가 세트특전 받아달라고 해서 '내 마음이 보위니 set'를 사먹었음 근데 세트이름 잘 지었다ㅋㅋㅋㅋ 내 마음이 보위니라니ㅋㅋㅋㅋ 시백우 생일카페 - 아이오쓰리 성수사거리점 이렇게 본인이 좋아하는 보위의 만두 모먼트에 스티커를 붙이는 곳도 있었다 진짜 정성들여 준비하신 느낌이 팍팍 들었음 보위하면 무조건 물만두인디! 언니는 보위를 몰라서 그냥 잘 나온 사진에 한표 찍었다고 함ㅋㅋㅋ 터진만두 사진 진짜 잘 나오긴 했음 시백우 생일카페 - 아이오쓰리 성수사거리점 이렇게 사진 찍는 스팟도 있었다 ㅠㅠㅠㅠㅠㅠㅠㅠㅠㅠㅠㅠ 내가 가서 사진을 마구마구 찍고 왔어야 했는데 엉엉어엉어엉 진짜 꼭 서울 다시 간다,, 시백우 생일카페 - 아이오쓰리 성수사거리점 이렇게 나눔 존도 있었다 눼?! 이 모든 사진을 다 나눔하신다니 진짜 천사시다,, 그래서 언니도 보위사진 몇개 겟해옴 감사합니다:) 시백우 생일카페 - 아이오쓰리 성수사거리점 보위가 가가연씨랑 Good boy 춘 영상도 계속 틀어놔줬다고 한다 그리고 그 밑에 또 엄청나게 있는 보위 사진! 나는 보위 사진 중에 특히 저 오른쪽에 손을 눈쪽에 둔 사진을 좋아한다:) 시백우 생일카페 - 아이오쓰리 성수사거리점 이렇게 흑백사진으로 꾸며진 거울도 있었습니다 내가 갔으면 여기서 바로 몇컷 찍었음ㅠㅠㅠ 그러고보니 저 왼쪽 밑에 세번째에 있는 사진! 한동안 내 잠금화면 배경이었다ㅠㅠㅠ 수트 보위 못 잃어,, 시백우 생일카페 - 아이오쓰리 성수사거리점 갬성적으로 꾸며진 보위 생일카페,, 이거 준비하신 분 진짜 대단하시당ㅠㅠㅠ 덕분에 한국 파이바오들은 행복합니다 Next image 시백우 생일카페 - 아이오쓰리 성수사거리점 벽에도 사진을 잔뜩 붙여놨다! Next image 시백우 생일카페 - 아이오쓰리 성수사거리점 보위 한국 왔을때 사진도 붙여져 있었음ㅠㅠㅠㅠ 보위가 한국 왔다 간지 벌써 7개월이 지났다니ㅠㅠㅠ 난 한 1년 지난줄 알았자나,, 왜이리 길게 느껴지는거야 보위야 다른 작품 또 찍어서 한국 또 와줘 감격적인 모먼트는 저 수트와 청자켓 입었을때! 내가 보위를 보러 시사회에 갔다는 것이다 역시 서울에 살아야해ㅠㅠ 시백우 생일카페 - 아이오쓰리 성수사거리점 이거는 선착특전이었다 보위 탄생석 팔찌를 3분한테 드리는 행사였는데 우리 언니는 못 받음 하지만 옆에 앉아 계신 분이 받으셔서 언니가 나 보여준다고 양해를 구하고 사진을 찍어왔다 진짜 이런 언니 없습니다,, 너무 고마워 그리고 탄생석 팔찌! 너무 예뻤음 진짜 갖고 시프다 나도 하나 제작할까 싶음 시백우 생일카페 - 아이오쓰리 성수사거리점 전체특전+세트특전은 이렇습니다! 와 너무 마음에 드는데요 특히 저 내한했을때 무대인사 사진들이랑 한국 처음 입국했을때 찍은 사진 넘 커아이~~~ 진짜 아까워서 다 어떻게 써ㅠㅠㅠㅠ라고 하지만 열심히 쓰겠습니다 ㅋㅋㅋㅋㅋㅋㅋ 시백우 생일카페 - 아이오쓰리 성수사거리점 영수증에 이런 글귀도 써져있었다고 하더라구여ㅠㅠㅠ 이런 디테일함 너무 좋아 보위 생일카페라 카페에 상견니 ost가 나왔다고 한다 엉엉엉엉ㅠㅠㅠㅠㅠㅠ 한국 카페에서 상견니 ost를 듣다니ㅠㅠㅠ 살다보니 이런 날도 오는구나ㅠㅠㅠㅠ 감동 그 잡채였다 진짜"
NCT DREAM 런쥔 2023 생일카페 이벤트 공지 :: 성수 아이오쓰리 1호점 (성수사거리점) 엔시티드림 런쥔 생카,"NCT DREAM RENJUN BIRTHDAY CAFE EVENT 1 성수 아이오쓰리 (성수사거리점) 23.03.18 ~ 23.03.23 서울 런쥔 생일카페 이벤트, 성수 생카 공지 2023 엔시티 드림 런쥔 생일 카페 이벤트 공지 입니다. 지성이 생일카페가 끝나고 한달만에 돌아온 새로운 이벤트인데요. 올해 런쥔 생카 이벤트 컨셉은 두가지로 성수 아이오쓰리에서 첫번째 이벤트가 오픈합니다!! 푸르른 봄과 어울리는 컨셉으로 디자인 제작 했어요. 기본특전, 디저트특전, 선착특전 종류 및 공지문 내용 안내 <PLACE> 아이오쓰리 1호점 (성수사거리점) 서울시 성동구 성수이로20길 60 1층 1호점에서 이벤트를 여는건 처음인데요. 성수역과 건대역 사이에 위치해있는 1호점은 드프 시즈니들이라면 조금 익숙한 위치에 카페가 있답니다. 22년 엔시티드림 팝업스토어가 열렸던 위치 바로 근처에 있기 때문이에요. <DATE> 23.03.18 ~ 03.23 <TIME> 평일 08:00 ~ 19:30 주말 11:00 ~ 19:30 이벤트 기간 및 영업시간 꼭 확인해주세요! 아이오쓰리에서 진행하는 런쥔이 생카 첫번째 이벤트는 생일 전주 주말인 18일부터 진행합니다.(두번째 이벤트는 다른 장소에서 23일부터 그 다음주 주말까지 진행예정) 평일은 오픈시간이 8시로 다른 카페에 비해 빨리 시작되니 참고해주세요. <EVENT> # 런쥔이의_스물넷_곁엔_우리가_있잖아 해시태그와 함께 트위터에 후기를 남겨주시면 추첨을 통해 선착특전 3가지 중 랜덤으로 선물을 보내드립니다. 특전 종류도 공개합니다! 기본특전 종이컵 + 리유저블 보틀 + 런쥔네컷 + 양면엽서 지정 음료 메뉴 주문시 기본특전 4종 (종이컵/리유저블 보틀/런쥔네컷/양면엽서) 이 제공됩니다. 음료는 아이스티와 초코라떼 중 택 1 가능합니다. 음료는 두가지 종류로 진행하는데 가장 무난하게 할 수 있는 메뉴가 아이스티와 초코라떼더라구요. 커피를 못드시는 분들도 있고 우유종류를 못드시는 분들도 있어서 여러 이벤트들을 진행해본 결과 정착한 메뉴랍니다..ㅎ(TMI) 포스터 사진 속의 런쥔이의 모습을 선을 따서 보틀 디자인에 넣었습니다. 아무래도 런쥔이가 중국인이다보니 다른 멤버들 굿즈에 비해 중국어와 한자를 많이 사용하게되네요. 청춘시간 / 황인준 글자를 한자로 적어서 굿즈로 만들어보았습니다. 두번째 특전은 캔디컨셉의 런쥔네컷 입니다. 런쥔이의 캔디 착장과 함께 사진 컬러에 맞춰서 오렌지색으로 프레임을 제작해보았어요. 엽서와 종이컵 디자인은 포스터 디자인과 동일합니다!! 디저트특전 귀여운 에코컵 디저트특전은 음료 + 디저트 마카롱 세트로 주문시 기본특전과 함께 추가로 제공되는 굿즈 입니다. 이번에는 에코컵 1종이 추가로 제공되어요. 귀여운 위영 런쥔이 캐릭터 컨셉에 맞춰서 시원한 스카이블루 색상으로 제작해보았습니다. 손등의 하트는 런쥔이의 손등점을 표현한거랍니다! 시즈니들의 염원 청량 컨셉을 가장 잘 충족시켜줬었던 위영....! 다시 한번만 해줬으면 하네요. 선착특전 지퍼필통파우치/티코스터/그립톡 이번 이벤트는 총 6일동안 진행하는데요. 그래서 2일씩 3가지 종류로 선착특전 종류가 다릅니다. 다양하게 준비했어요~ 선착특전은 카페에서 개별로 구매도 가능합니다(카페 트위터 계정으로 연락해서 온라인 배송주문도 가능) 3월 18일, 19일 선착특전으로 제공되는 파우치 입니다. 필통으로도 사용할 수 있는 넉넉한 크기이구요. 18일, 19일 각각 3명씩 총 6개를 제작했습니다. 이번에 새롭게 제작한 굿즈 종류인 티코스터 입니다. 3월 20일, 21일 제공되는 특전이구요. 매일 2명씩 총 4개를 제작했습니다. 베스트프렌드에버 사진으로 굿즈 만들어보고 싶었는데 이번에 원형 컵받침으로 만들었네요. 넘넘 귀여운 마지막 선착특전인 그립톡!! 개인적으로 그립톡이 넘 귀엽게 잘 나와서 생일 당일 특전으로 정했답니다. 3월 22일과 23일 매일 5명씩 총 10명에게 제공합니다. 수량도 가장 많아요! 런쥔 이벤트 프레임 아이오쓰리 전 지점에는 포토부스가 설치되어 있어서 이벤트기간 한정 프레임으로 촬영이 가능합니다. 포토프레임은 트위터 공지에 추가해두겠습니다. 두가지 도안으로 진행할 예정이에요~~ 하단 링크는 작년에 제노생카 이벤트때 방문했었던 성수사거리점 후기입니다. 내부 모습 확인 가능해요! 엔시티드림 제노서울생카투어 :: 아이오쓰리 성수사거리점 NCT DREAM 제노생카 안녕하세요, 나만의 일상을 기록하는 블로거 권송송입니다. 이번 후기는 다시 서울제노생카투어랍니다~ 글... m.blog.naver.com 벌써 다음주가 런쥔이 생일이라니 시간이 진짜 빠르네요. 아이오쓰리는 이번 주말부터구요! 저는 엔시티 전시회 3차 예매를 해서 전시회 보러간김에 아이오쓰리 들려도 좋겠더라구요. 이번 3차 전시회 보러가시는 분들 성수 투어 같이 해보셔도 좋을 것 같습니다!"
"원위 강현 생일카페, 아이오쓰리 성수사거리점💜","11월 24일은 우리 현구 생일날!!! 이번에 생카들이 대부분이 생일 이후 주말까지 하는 곳이 많아서 좋았다 물론... 제가 다 못갔습니다ㅜㅜ 난 내가 부지런한 줄 알았어요 가봅시다 현구 생카! 50m © NAVER Corp. 아이오쓰리 성수사거리점 서울특별시 성동구 성수이로20길 60 1층 📍아이오쓰리 성수사거리점 ✔주소 : 서울 성동구 성수이로20길 60 1층 ✔영업시간 : 월~금 08:00 - 19:30(라스트오더 19:00) / 토, 일, 공휴일 11:00 - 19:30(라스트오더 19:00) 현구야아아아아아앙 입구에 있어서 알아보기 좋았어ㅜㅜ 우리 현구 넘 이뻐 진짜 현구랑 기타는 최고지 페벌.. 또 가고싶다ㅜㅜㅜㅜㅜ 저 행복해요ㅜㅜㅜㅜㅜㅜ 커피 못 먹어서 초코라떼시켰고 디저트류는 고민하다가 마카롱 하나 주문했습니당 우주에 진심인 밴드 우주밴드ㅜㅜ 야행성 들어보세요 소행성 들어보세요 너의 우주는 들어보세요 천체 들어보세요 궤도 들어보세요 ...우주는 아니지만 베로니카의 섬 들어주세요 보고싶다 진용훈 보고싶다 강현구 마카롱이랑 음료 하나 주문했는데 특전 컵도 오고 플라스틱컵도 오고 보틀도 오고ㅜㅜㅜ 이거 맛있어서 벌컥벌컥 너무 귀여워ㅜㅜㅜㅜㅜㅜㅜㅜㅜㅜㅜㅜ 마카롱 뚱카롱 아니고 적당해서 맛있었어ㅜㅜ 그리고 럭드 해봅니다 1차 5개 4등 하나 5등 4개 감튀 젤리가 4등인데.....감튀젤리가 마무리로 케찹맛이 나는 거 같지 왜... 그리고 이 사람.. 포기 못했습니다 왜냐면 1등이 액자(혹은 담요) 2등이 키링 3등이 마테.... 2차 5개 또 합니다 그래도 2등이라도 걸렸어!!! 짱 귀엽져!!!!!! 더 하고 싶었는데, 키링 뽑았으니까 참았어여ㅋㅋㅋㅋㅋㅋㅋㅋ 원위 노래 계속 나오고 사진은 다 못찍었지만, 작은 탭?거기에 현구 영상도 계속 나와서 너무너무 행복했던 현구 생카!!! 현구야 올해도 생일 축하해💜 사랑행성💜🪐"
아이오쓰리 성수사거리점 슈퍼주니어 희철 830710생일 카페,몇 주 전에는 령구 생카하던 아이오쓰리 성수사거리점에서 슈퍼주니어 희철 생일카페도 열어서 잠깐 들렸다가 왔습니다!! 2호선 정반대라 좀 멀긴했지만ㅎㅎ 희님의 40도 응원하기 위해서 들려서 음료사고 특전받고 사진찍고 바로 나옴! 희님 싸인이 유일하게 저에게 없는 사인인데! 갖고 가고 싶었던 폴라와 싸인ㅋㅋ 그래도 참았음ㅋㅋㅋ 이쁜 특전을 대신 받아왔습니다! 얼죽아의 새로운 뜻 희님 얼굴이 죽을것같이 아름답다ㅋㅋㅋ 찌라시 넘 참신해요!!! 고양이 스티커도 귀엽습니다! 다이어리 꾸밀 때 쓰면 참 좋을거 같아요!! 블로그 포스팅이 점점 짧아지는거 같은건 점점 시간이 사라지는 중ㅜㅜ +규현이 벤허 뮤지컬 소식에도 인스타 #hography_ 에 올라온 슈주 사진보고 나노 단위로 보면서 이쁨에 감탄해야하는데 귀여운 임티로 빠르게 제 마음 대체 시험이 30일 정도 밖에 남지 않았다.. 덕질도 했으니 이제 집가서 공부할 예정 #슈주 #슈퍼주니어 #희철 #김희철 #생카 #생일카페 #아이오쓰리 #성수사거리점
