title,content
📝 / 성수동 가볼만한 곳 / 포인트오브뷰 / 버니타운 / 서울숲 카페 / 성수 맛집 / 칼 / 쿠시범 / 일상블로스,"일단! 새해복 많이 받으세요🐰🙇🏻‍♀️!!다들 떡국은 드셨을지,, 설연휴가 제법 길어서 다들 어떻게 보내실지 궁금한데 저는 이사준비하느라 이번엔 본가에 안내려갔거든요💭 안부전화만 돌렸어요 히히 모쪼록 모두 행복한 설연휴가 되었으면 좋겠어요🫶🏻떡국먹고 좋은 말만 가득 들으시기〰️ 사실 이 글을 수요일에 올리려고 했는데 자꾸 미뤄져서 이제야 올리긴 하는데•• 2월초까지는 바쁠 것 같아서💦 조금 느리더라도 열심히 올려볼게요..! 근데 또 블로그 쓰려고 보니까 근래에 제가 연남성수만 다녔나 싶긴 하다더라구요💭 갈 일이 있기도 했고 약속 장소로 하기도 편하기도 하구.. 무튼 그래서 포오뷰 다시 간 날 들고옴🔥 칼 서울특별시 성동구 성수이로 126 성수실업 1층 예약 점심으로 칼국수랑 수제비 먹으러 왔음〰️ 뭔가 확실히 한식으로 점심먹으면 하루종일 속이 편함😉 (그렇지만 허구한 날 파스타 먹는 사람💭) 수제비, 칼국수 그리고 감자전까지 하나씩 시켰어요! 가격도 통일.. 메뉴도 뭐 없는 게 뭔가 좋다(?) 차례대로 나온 음식들🤤개인적으로 감자전은 그냥저냥 칼국수보다 수제비가 더 맛있어요!😋조개도 해감이 잘되어있어서 먹기 좋았구 수제비 식감 좋아..🫶🏻 개인적으로도 원래 칼국수보다 수제비 더 좋아해요〰️ 첫끼로 속편하게 잘먹었다👍🏻✨ 같이 나오는 공기밥은 무생채가 올라가있는데 테이블에 구비되어있는 고추장이랑 참기름 넣어서 싹싹 비비면🤤 사실 보리밥에 생채얹어서 비벼먹는 걸 어릴 땐 자주 먹었던 것 같은데 안먹은지 몇년이 지나서 오랜만에 먹어서 더 좋았던 것 같아요😉진짜 특별한 맛도 아닌데 꼭 집밖에서 먹으면 뭔가 특별한 것 같단 말이지💭 무튼 다음에 가면 수제비로 시킬 것 같아요〰️ POINT of VIEW SEOUL 서울특별시 성동구 연무장길 18 1,2,3층 여긴 저번에 1층만 잠깐 구경했던 포인트오브뷰❕ 2층이랑 3층이 궁금해서 다시 와봤는데 뭔가 공간자체는 크고 구경할거리는 많지만 딱히 살만한게 보이진 않았어요..! 다만 완구류에 관심이 있으시면 정말 구경하기 좋을 듯✨ 확실히 1층이 실질적으로 살만한 게 많은 것 같아요〰️ 저번에 찜해둔 볼펜들도 하나씩 고르고🖊️ (⚠️여긴 곳곳에 테스트해볼 종이가 마련되어있어서 직접 써보고 구매할 수 있어서 좋아요..! 또 테스터용으로 따로 빼둬서 더 좋음☺️은근 테스터용없는 곳들은 구매하면서도 이 펜도 막 테스터한 사람들이 있지 않을까..?하는 생각이 종종 있어서 이렇게 테스터용으로 빼둔 곳들이 좋다..💓) 다이어리랑 노트들도 구경했어요✨ 하지만 이미 다이어리가 두개인 사람은 참기로 함💭 꽤나 종류도 다양하고 다이어리에 쓰기 좋은 일단 볼펜부터 만년필같은 종류들도 있어서 구경하기 좋다..🥺💕💕 그리고 저번에 구경했을 때 종종 생각나서 들린 도장코너❕ 스탬프 종류도 다양하고 잉크도 따로 팔아서 편함👍🏻 고른 스탬프는 이건데 편지 잔뜩 써서 하나쯤 갖고 있으면 좋겠다 싶더라구요☺️사실 저 색상의 잉크도 갖고 싶었는데 직원분도 확실하진 않지만 이 색일 것 같다구 주신 잉크로 구매했는데 아니라서•• 다시 들러서 또 구매했는데••그 색도 아니라섴ㅋㅋㅋㅋㅋㅋ 그냥 포기하고 나중에 따로 찾아봐야겠 더라구요^.^ ((결국은 상관없는 색 두개 산 사람)) 무튼 언니 편지써줄 엽서도 골라서 바리바리 결제했다..! 헤헤 진짜 나같은 사람은 내내 구경하느라 정신없었구 사람도 정말 많아서 종종 웨이팅 줄이 서기도 하니까 혹여 성수 가실 일이 있으면 한번 들러보시길 추천드려요⸝⸝ʚ̴̶̷̆ᴗʚ̴̶̷̆⸝⸝ 버니타운 서울특별시 성동구 서울숲2길 15-12 1.5층 여기는 서울숲에 위치한 버니타운이라는 카페예요! 무슨 카페를 서울숲까지 가서 가냐고 묻는다면••• 성수에 가볼만한 카페는 다 가봐서 뭔가 새로운 곳이 가보고싶었단 얘기😉전부터 유명해서 한번 가봐야지 했던 곳이라 온 것두 있구요^.^헤헤 근데 웨이팅걸림😅 여긴 테이블링도 대기명단도 따로 없어서 그저 문앞에서 기다리는 수 밖에 없어요..! 그래서 다른 곳 가자 싶어서 여기저기 갔다가 끌리는 곳이 없어서 다시 와봤는데 마침 자리 하나 생겨서 호다닥 앉음❕완전 럭키🍀 라떼하나랑 아메리카노 하나씩 시키구 생크림 딸기케이크도 하나 시켰다..케이크 좋아🍰💖 여기 케이크 맛있대서 전부터 궁금했거든요 히히🥺 귀여운 초들도 파는 곳 호감..💓 생각보다 카페가 좁고 사람도 와글와글해서 내부사진은 못찍었구.. 무척 아담하고 포근한 분위기라 좋았어요💓 그리고 케이크.. 달달구리하고 크림도 딸기크림이라 더 마음에 들었다💕꽤나 맛있어서 다 먹었어요😋 서울숲 카페들 사실 만족스러운 곳이 많지는 않은데 오랜만에 괜찮은 곳 추가한 것 같아서 기분좋다☺️ (테이블링이 있으면 좋겠다 제발••) 카페에서 편지도 쓰고 얘기나누다 보니까 벌써 저녁🌓 반달이 꽤나 선명에서 찍었지만 역시 아이폰은😃 페이퍼돌메이트 아틀리에 서울숲점 서울특별시 성동구 서울숲2길 45-1 103호 가는 길에 잠깐 들린 곳에서 언니가 랜덤 스탬프 사줌🫶🏻 짱구랑 산리오랑 고민하고 있으니까 둘다 하나씩 고르라구.. 헤헤 언니가 최고야..💓💓잉크 색이 안맞아서 조금 기분이 다운됐는데 다시 붐업함 푸하하😆😆 요거 사들고 저녁에 가기로 했던 곳이 성수라 천천히 성수까지 다시 걸어감✨얼른 가서 까보고 싶었음😉 쿠시범 서울특별시 성동구 성수이로14길 14 성수연방 1층 여기는 언니가 괜찮았다고 했던 쿠시범❕ 언니픽은 믿으니까 호다닥 왔어요😆 4인석 많고 테이블 큰 것도 마음에 들고 따로 다찌자리도 있어서 혼자나 둘이와도 괜찮을 것 같아요〰️ 테이블마다 주문할 수 있는 테블릿이 있어서 편함✨ 안주는 꼬치 6종이랑 치킨 가라아게로 시키고 나는 레몬사와 언니는 진저였나 시나몬하이볼 시켰다〰️ 뭐 안주는 먹다가 부족하면 또 시키면 되니까☺️ 그리고 뽑은 짱구랑 산리오 랜덤 스탬프❕❕ 나는 액션가면 짱구랑 마멜 나오고 언니는 쿠로미✨ 근데 언니는 한교동을 원했던거라 쿠로미도 나 줬음🫶🏻 마멜보단 쿠로미가 더 좋은 사람은 행복하다💕💕 그리고 액션가면이나 초코비 짱구 나오길 바랬는데 액션가면 나와서 완전 신났잖아😆👍🏻히히 잘쓸게💖 그리고 서로 편지도 교환했다! 나중에 새해에 읽어봤구 말했던 것 같은데 항상 고맙구 올해도 잘부탁한단 말🫶🏻 사와랑 하이볼 먼저 나오고 꼬치랑 가라아게까지😋 사실 꼬치는 엄청 맛있다! 이런건 아니고 그냥 뭐 무난〰️ 가라아게가 의외로 양도 많고 가성비 괜찮은 것 같아요! 먹다가 뭔가 탕이 먹고 싶어서 조개탕이랑 두부튀김도 시켰는데 조개탕도 좋았고 저 두부튀김이 신기하게 손이 가더라구요💭뭔가 신기하게 생겨서 그런가••? 그래도 역시 조개탕이 좋아😋 둘의•• 흔적😚…언니랑 오랜만에 소맥마신 듯..? 요근래 맨날 칵테일바나 하이볼, 생맥주마시러 다녀서 그런지 소맥 말아먹은 게 엄청 오랜만인 것 같았음😉 무튼 안주들이 가격도 맛도 무난해서 괜찮았고 자리도 꽤 많아서 다른 곳에 웨이팅때문에 무작정 갈 곳이 없다면 또 올만한 것 같아요❕역시 언니따라가면 다 좋다니까 무튼 이날도 재밌게 잘놀았다!!! 끝❤️‍🔥 저번주 일상조각글🍀 일상조각글💭/ 일상블로그 요즘 날씨가 정말 오락가락인 것 같아요••• 그저께는 낮에 더워서 겉옷 벗고 싶었는데 어치이제오늘은 ... m.blog.naver.com 모두 설연휴 안전하고 행복하게 보내세요🫶🏻"
[뚝섬역카페추천ㅣ버니타운]비주얼까지 예쁜 쌀케이크가 있는 곳 :: 성수동카페 서울숲카페,"안뇽하세요 로쉐입니다♡♡♡ 성수동 하면 감성 감성 하면 성수동(?) 오늘은 성수동(뚝섬역/서울숲역)에 위치해있는 감성카페 버니타운을 소개해 드릴게요~~ 50m © NAVER Corp. 버니타운 서울특별시 성동구 서울숲2길 15-12 1.5층 [버니타운] 월,화 휴무 12시~21시 이상한 나라의 앨리스가 생각나는 귀여운 입구♡ 골목에 있어서 지도를 보며 이리저리 찾아다녔는데 ""BUNNY""큰 글자로 반겨주었어용ㅎㅎ 입구에 너무 예쁜 거울이있길래ㅋㅋ 거울샷 못참지๑´ڡ`๑ 들어가자마자 케이크 더미!!! 종류도 많고 뭣보다 디자인이 너무 예뻐서ㅠㅠ 한참 고민했어요>< [사진출저-버니타운] 음료는 가격대가 있는 편이에요ㅠㅜ 아기자기한 인테리어♡ 규모가 큰 카페는 아니지만 소품들로 감성을 꽉 채운 공간이에요(◍•ᴗ•◍)♡ 제 취향 저격이었숩니다ㅎㅎ 꺅 넘귀!!!!>< 저는 초코케이크와 단호박 케이크를 시켰는데요 버니타운 컨셉답게 케이크위에 기여운 버니들이!!! 버니타운의 케이크들은 쌀케이크로 만들어졌다고 해요 느끼하지 않고 부드러워서 쑥덕쑥덕 들어갔어요:) 싸악 먹어치웠지만 죄책감이 덜했답니다ㅋㅋㅋㅋㅋㅋ 아기자기한 소품가득 예쁜카페를 찾고계신다면~~ 귀여운 쌀케이크 디저트를 찾고 계신다면~~ 성수동카페 버니타운 추천드려요♡♡ ~뚝섬역카페 성수동카페 서울숲카페 [버니타운] 쌀케이크~ #뚝섬역카페 #서울숲카페 #성수동카페 #성수동감성카페 #예카 #예쁜카페 #감성카페 #쌀케이크 #케이크 #디저트 #뚝섬역디저트카페 #서울숲디저트카페 #성수동디저트카페 #뚝섬역디저트 #서울숲디저트 #성수동디저트 #성수카페 #성수맛집 #컨셉카페 #이상한나라의앨리스 #서울숲카페거리 #버니타운 #성수동데이트"
[서울숲 카페]버니타운 디저트가 맛있는 성수동 카페 내돈내산,"안녕하세요☺️ 친구들이랑 서울숲 근처에 괜찮은 카페를 알아보던중 케이크가 맛있는곳이 있다길래 다녀와봤어요 ㅎㅎ 버니타운/bunny town(@bunny_town12) • Instagram 사진 및 동영상 팔로워 550명, 팔로잉 111명, 게시물 597개 - 버니타운/bunny town(@bunny_town12)님의 Instagram 사진 및 동영상 보기 instagram.com 서울 성동구 서울숲2길 15-12 1.5층 12:00-21:00 매주 월요일 정기휴무 주차X 외관부터 너무 예뻐서 사진을 마구마구 찍어뎄네요 ㅎㅎ 벽에 거울도 있어서 거울셀카찍기 딱 좋은거같아요‼️ 카페 올라가는길에~ 지하에 소품샵인거 같은데 ㅎㅎ 올라가는길에 한번 찍어봐써용 ❤️ 넘 아기자기한 내부••• 제가 딱 좋아하는 스타일 ㅎㅎ 들어가자마자 사장님께서 반갑게 맞이해주시더라구요☺️ Next image 케이크 종류도 많고 비주얼이 미쳤더라구요... 마음같아선 다 먹어보고 싶었어요 ㅎㅎ 친구들끼리 메뉴 고르고있는데 케이크만 포장해가시는분들도 많더라구요‼️ 그만큼 케잌 맛집이라는거~ ㅎㅎ 저희는 버니자몽라떼, 자몽에이드 딸리케잌, 콘 크림케이크를 시켰어요! 버니자몽라떼는 정말 제 스타일이 아니였다는... 친구들도 별로라고 했었네요ㅜㅜ 딸기케이크는 하나도 안달고 너무 맛있었는데 콘크림 케이크는 생각했던 맛이 아니여서 남겼네요,, 빛이 제일 잘 들어오는 자리에서 사진을 왕창 찍었어요 ㅎㅎ 저희 찍고 나니깐 옆자리분들도 이자리에서 찍으시더라구요 ㅋㅋㅋ 서울숲 근처에 디저트 맛집을 찾고 계시다면 버니타운 추천드려요☺️ 50m © NAVER Corp. 버니타운 서울특별시 성동구 서울숲2길 15-12 1.5층"
[카페] 성수동의 아기자기한 연말 분위기로 가득한 버니타운 (Bunny_town),"50m © NAVER Corp. 버니타운 서울특별시 성동구 서울숲2길 15-12 1.5층 연말분위기로 가득한 성수동의 카페 버니타운에 다녀왔습니다! 크리스마스가 더 빨리 찾아온 듯한 이곳은 따뜻한 연말장식으로 가득합니다. 비비드한 컬러감이 있는 카페는 이국적인 느낌으로 가득했어요 케이크에 꼽는 귀여운 초, 니트재질의 따뜻한 티코스터는 카페만의 감성을 더욱 살려주네요 따뜻한 햇살이 들어오는 낮에도 매력적이지만 조명의 색감이 살아나는 저녁에도 매력적인 공간이에요! 메뉴&케이크 샤인머스켓 케이크와 황치즈 케이크를 먹었어요! 아기자기하고 동화같은 비주얼의 케이크는 맛을 따라잡기 힘든 경우가 많은데 여기 버니타운의 케이크는 맛도 괜찮았어요! / 특히 황치즈 케이크가 꾸덕하고 치즈의 맛이 살아있어서 또 먹으러가고 싶더라구요! 내부에는 창가테이블, 다락형 공간, 일반테이블까지 다양하게 10좌석정도 마련되어있는데, 공간에 비해 좌석 간 거리가 가깝다는 아쉬움은 있었어요 그래도 내부에 있으면 소리가 울리지 않고 노랫소리가 좋아서 편안하게 공간을 즐길 수 있습니다. 반짝반짝 트리가 겨울이 다가왔다고 노래하는 버니타운이었습니다. #버니타운 #성수동 #성수동가볼만한곳 #성수동카페"
서울숲카페 버니타운 / 성수동 귀여운카페,"서울숲에 아기자기하고 귀여운 카페가 있다고 해서 다녀왔어요! 보고 갔던 사진보다 더 귀엽고 예뻤던 버니타운이라는 카페에요 그리고 밀가루가 아닌 국내산 쌀로만 만든 케이크를 판다고 해서 바로 달려가 봤어요 ""서울숲카페 버니타운"" 이로케..에이드도 예쁘고 카페 분위기도 넘 예뻐요!! 입구부터 기욤기욤한 토끼가 반겨줍니다 청포도에이드 6,500원 복숭아에이드 7,000원 라즈베리 생크림케이크 7,500원을 주문했어요 주문하고 나서야 황치즈 케이크를 봤는데 황치즈케이크 너무 먹고 싶네요,,! 이런 글루텐프리 디저트 카페 좋아요 ㅎㅎ 에이드 넘 영롱하고 예쁘죠! 수제청으로 만드는 에이드라고 하네요 에이드는 달달하고 정말 맛있었는데 라즈베리케이크는 사진 용이였어요 ㅎㅎ 같이 간 친구도 저도.. 원래 케이크는 어딜 가나 반 이상은 먹었는데 이 케이크는 남겨도 미련이 남지 않더라고요 평일 저녁시간대에 갔는데 사람도 없고 한적하고 조용하고 깔끔한 카페였어요 딱 인스타용카페에 인생 샷까지 건질 수 있는 분위기예요 공간들이 너무 아기자기하고 예뻤네요 서울숲카페 / 성수동카페 / 뚝섬역카페 찾는 분들에게 아기자기한카페 버니타운 추천해드릴게요 #버니타운 #뚝섬역카페 #서울숲카페 #성수카페 #성수동카페 #성수버니타운 #성수쌀케이크 #서울숲디저트 #성수동디저트 #글루텐프리카페 #서울카페 #분위기좋은카페 #감성카페 #성수감성카페 #조용한카페 #디저트맛집 #일상 #내돈내산카페"
성수가볼만한곳 성수동핫플 딸기케이크가 맛있는 성수동카페 버니타운,"안녕하세요 뭉망뭉입니다 오늘은 성수동데이트를 나온김에 성수동카페거리가 유명하다고 해서 맛있는 디저트를 파는 성수동카페를 찾다가 알게된 50m © NAVER Corp. 버니타운 서울특별시 성동구 서울숲2길 15-12 1.5층 ""버니타운""이 오늘의 주인공입니다. 성수가볼만한곳으로 유명한 곳입니다. 버니타운의 상징인 토끼와 케이크 문양이 보입니다 딸기케이크로 유명한 성수동카페다 보니 일단 메뉴판을 보지는 않았어도 케이크하나는 무조건 먹으려고 합니다. 들어가는 입구에 감성샷을 찍을만한 포토존이 존재합니다 오늘은 패스.. 가게 내부는 아늑하면서도 뭔가 편안한 분위기입니다 늦은 시간에 방문했어도 사람이 많은걸보니 역시나 성수동핫플이 맞는거 같습니다. 성수가볼만한곳의 클라쓰 벌써부터 크리스마스 분위기가 나는걸로 보아 설레면서도 한편으로는 직업 특성상 제일 바쁜 기말이 다가오고 있습니다 winter is coming... 뭔가 숨은 공간같은 곳이 있어서 자리를 여기로 선정했습니다. 뭔가 아기자기한 인테리어가 맘에 들어서 이곳저곳 사진을 찍어봅니다 분위기 좋은 성수동카페 찾는 분들에게 추천 그리고 사진 찍으면서 너무나 이뻐서 가장 좋았던 소품으로 나중에 제 집에 이런 소품으로 집을 꾸며놓고 싶어졌습니다. 케이크와 소품들이 벌써부터 크리스마스 분위기라 잠시 들떴습니다 이제 메뉴를 확인하러 가보겠습니다. 버니타운의 메뉴판입니다 성수동핫플의 가격치고는 5~7천원 정도로 생각보다 저렴한 가격인데요 여기는 정말 먹기는 아까울 정도로 이쁜 비주얼을 가진 디저트가 많습니다 저같이 손재주 없는 사람들이 보면 상당히 부럽습니다 이곳도 너무 이뻐서 사진 찍었습니다 메뉴가 나오기전에 이렇게 많은 인테리어와 소품 사진을 찍은적이 있나 싶네요 확실히 성수동카페만의 특색이 있네요 오늘의 메인이 등장했습니다 여기는 다른것보다 딸기케이크가 진짜 맛있습니다 딸기케이크 좋아하는 분들이라면 한번은 가보셔야 할 집ㅋㅋ 크리스마스 분위기와 함께 커피 한잔 마시는것도 낭만있네요 성수동핫플만의 여유로움!? 부드럽고 달콤하한 딸기케이크의 매력이 입속으로 쏘옥 들어!올때 느껴지는 만족감이라니 너무나 만족스러웠던 성수동 카페 버니타운 맛있는 성수동 핫플하나 리스트업 완료! 성수가볼만한곳 찾는 분들에게 추천드려요! #성수동카페 #성수카페 #성수동카페거리 #버니타운 #성수핫플 #성수동핫플 #성수동가볼만한곳 #성수가볼만한곳"
서울숲카페/성수동카페 : 디저트가 맛있는 버니타운,"안녕하세요. 나짱아입니다. 얼마 전에 다녀왔던 성수동 카페, 서울숲카페를 검색하다가 귀엽고 이쁜 카페가 있길래 방문했어요. 외관부터 아기자기한 느낌이 가득!! 서울숲 카페 버니타운 문 앞에서 사진을 찍어도 인생샷이 나올 것 같은 느낌이었어요. 평일에 방문했더니 매장이 조용해서 너무 좋았어요. 주말에는 인기가 많을 듯한 서울숲카페 버니타운, 평일이기 때문에 여유롭게 자리를 골라서 앉을 수 있었어요. 포토존이 많았던 카페 버니타운, 다시 보니 또 가고 싶어져요. 서울숲카페 대부분 가격대가... 솔직히 비싼편인듯 해요. 성수동카페, 버니타운 케이크는 밀가루가 아닌 쌀로 만든 수제케이크라고 해요. 케이크도 종류가 다양했어요. 그래서 주문한 메뉴는 버니 자몽라떼 6.8 , 청포도에이드 6.5 블루베리바스크치즈케이크 7.5 창가가 너무 이뻐서 사진을 찍었는데 앉아 있기는 눈이 부시니 자리를 옮겨서 앉았어요. 버니 자몽라떼와 청포도에이드 무난무난했고 블루베리바스크치즈케이크는 치즈가 진하고 맛있었어요. 평일에 방문하니 여유로워서 너무 좋았던 카페 버니타운, 다음에도 서울숲 카페를 찾아보고 또 이쁜 카페를 가봐야겠어요!! 50m © NAVER Corp. 버니타운 서울특별시 성동구 서울숲2길 15-12 1.5층 . . #서울숲카페 #성수동카페 #성동구카페 #서울숲카페추천 #서울숲분위기좋은카페 #버니타운 . ."
성수동 귀여운 디저트카페 버니타운,요즘 성수동 예쁜 카페를 찾아다니고 있어요! 오브젝트 성수점에 갔다가 카페 검색하다가 가까운곳에 '버니타운' 이라는 너무 예쁜 카페가 있더라구요! 주택처럼 생겼죠?! 입구부터 귀여운 토끼가 반겨주는데 너무 귀여웠어요! 카페 앞에서 이렇게 사진 많이 찍은건 처음인 듯 ㅋ 성수동 카페 #버니타운 의 내부도 아기자기하고 너무 귀여웠어요! 따뜻한 느낌의 조명때문에 더 좋더라구요~ 테이블도 많구요! 너무 귀엽게 공간을 자 꾸며놓으셨더라구요! 평일 낮시간대라서 한산하고 평화로운 분위기 너무 좋았어요. 인스타용으로 예쁜 사진도 찍을수 있는 너무 예쁜 인테리어에요! 소품 하나하나 신경 쓴 느낌이에요! 버니타운이라 여기저기 토끼들이 보입니다 ㅎ 성수동 디저트카페 버니타운 메뉴. 디저트 카페니깐 케이크도 고르구요! 아이스라떼 (5500) 복숭아에이드 (7000) 애플레몬에이드 (6000) 복숭아케이크 (8500) 저희가 주문한 메뉴에요! 가격대가 조금 있죠? ㅎ 음료 따위가 왜 이렇게 예쁜건데 ㅋㅋ 버니타운은 쌀로 만든 케이크와 수제청으로 에이드를 만든다고 하네요! 복숭아 케이크!! 보기만해도 맛있어 보이죠? 네. 엄청 맛있습니다!! 먹으면서 하나 더 시켜야하나 고민했는데 좀 있음 저녁 시간이라 ㅠ_ㅠ 서울숲이나 성수동에 방문하시면 케이크도 맛있고 분위기도 좋은 버니타운 추천드려요! 50m © NAVER Corp. 버니타운 서울특별시 성동구 서울숲2길 15-12 1.5층 #감성카페 #성수카페 #성수디저트카페 #예쁜카페 #감성카페 #케이크맛집 #분위기좋은카페 #성수데이트 #뚝섬카페 #서울숲카페 #카페추천 #디저트카페 #사진찍기좋은곳 #조용한카페 #분위기좋은카페 #성수핫플
