title,content
성수역 카페 데이트하기 좋은 성수동 디저트 카페 발렁스,"성수역 카페 데이트하기 좋은 성수동 디저트 카페 발렁스 안녕하세요~ 오늘은 이렇게 코시국이 심해지기 전 남편과 데이트겸 다녀왔던 성수역 카페가 있어서 소개해드리려고해요 ㅎㅎ 진짜 다녀오고나서 성수동 디저트 카페 중에 이렇게 괜찮은 카페가 있었나?하는 마음으로 막 주변분들에게도 홍보했던 성수역 카페 발렁스를 소개해드릴게요 ㅎㅎ 성수역카페 매장입구 BALANCE라고 쓰여있고 발렁스로 읽는 이 예쁘고 아담한 성수동 디저트 카페. 밖에서 볼때도 너무 온화하고 심플한 디자인이 마음에 들더라구요. 그래서 이끌리듯 들어가게 되는 데이트하기 좋은 성수역 카페에요. 성수역카페 매장내부 성수역 카페의 매장 내부 느낌이 너무 좋더라구요. 진짜 편안하게 휴식하고 쉬어갈 수 있는 느낌이었어요. 좌석이 많지 않아서 오히려 거리두기도 제대로 가능한 곳이었어요. 성수역 카페 매장 내부에는 이렇게 편안한 긴 쇼파와 심플한 나무 원목테이블 두개가 놓여있더라구요. 소개팅할 때 잠시 들러 이야기 나누기도 좋을 것 같아요. 혼자 시간을 보내고 싶을 때 와도 참 좋은 곳이겠더라구요. 결혼하고 나서는 남편이랑 이렇게 도란도란 얘기하며 데이트한게 참 오랜만인 거 같았어요 ㅎㅎ 성수동 디저트 카페 마들렌 이 성수동 디저트카페에서 제 눈을 사로잡은건 바로 마들렌이었어요! 마들렌 종류가 정말 다양하더라구요. 클래식 마들렌, 쇼콜라 마들렌, 더블치즈 마들렌, 유자라임 마들렌. 사실 저는 클래식마들렌만 먹어봐서 다른 종류의 마들렌들이 너무 궁금했어요. 특히 저의 사랑 쇼콜라마들렌!! 보는순간 반해버렸죠 ㅎㅎ 오빠도 안먹어본 음식들에 대해 호기심이 있기때문에 마들렌을 종류별로 먹어보기로 했어요 ㅎㅎ 그리고 사실 확인해보니 이 성수동 디저트카페에서 유명한건 다양한 케익종류인데 다 예쁘고 맛있어 보이더라구요. 그런데 저희는 오후에 가서 케익이 많이 빠진 상태였어요 ㅠㅠ 남아있는 호두쉭세 케익을 골랐어요! 성수역 카페 메뉴 짠~ 주문한 메뉴가 나왔어요. 아메리카노아이스와 저는 라즈베리에이드를 주문했어요. 그리고 마들렌을 종류별로 고르고 호두쉭세까지! 너무 완벽한 성수동디저트카페에서의 한상이죠? ㅎㅎ 이 나무트레이 너무 예뻐서 어디서 사셨는지 여쭤보고싶었어요 ㅠㅠ 요즘 이런 아이템들이 눈에 들어오더라구요 ㅎㅎ 진짜 마들렌은 하나 하나의 특색이 느껴지는데요. 쇼콜라마들렌에는 초콜릿커버에 초코칩이 박혀있고, 클래식 마들렌은 마들렌 그대로의 느낌이지만 뭔가 사이즈도 더 크고 먹음직스러웠어요 ㅎㅎ 더블치즈 마들렌은 치즈가루도 뿌려져있고 확실히 치즈맛이 고소하더라구요~ 발렁스 카페 인스타그램에 보면 더 디저트에 대한 안내가 잘 되어 있는데, 이 치즈마들렌에는 이태리와 네덜란드의 고품질 치즈를 아낌없이 넣으셨다고 해요!! 어쩐지 고소하더라!! 그리고 유자라임 마들렌은 제가 젤로 마음에 들었던 마들렌인데 상큼하면서 맛있었어요. 베리굿!!! 라즈베리에이드는 쉐킷쉐킷~! 너무 상큼하고 맛있더라구요. 뭔가 이날따라 상큼한 에이드가 땡겼는데 취향 제대로 저격한 성수역카페 라즈베리에이드에요! 과일 에이드 좋아하시는 분들께는 강추강추입니다! 그리고 호두쉭세는 제가 처음 먹어보는 느낌의 디저트였어요 ㅎㅎ 성수역카페 인스타그램에서 소개해주신걸 보았는데, 쉭세는 마카롱과 같은 머랭베이스의 당도가 높은 과자라고 하더라구요. 딱 먹는데 그런 느낌이 들었어요 머랭쿠키 ㅎㅎ 요 윗부분이 쉭세였더라구요. 진짜 이런 디테일이 살아있는 디저트는 아마 여기 성수동디저트카페에서만 드실 수 있을 것 같아요. 안의 호두식감도 살아있으면서 위의 쉭세가 달달한게 딱 제 입맛에 맞더라구요 ㅎㅎ 남편도 단걸 좋아하지 않는데 이건 너무 잘먹더라구요 ㅎㅎ 나중에 알고보니 이곳은 바닐라통카타르트가 매우 유명하더라구요. 다음에 또 와서 그땐 꼭 바닐라통카타르트를 먹고 말겠어요!! 제 맘에 쏙 들어왔던 유자라임 마들렌은 향미와 당도가 뛰어난 고흥유자를 사용하셨다고 해요. 어쩐지 유자향이 장난이 아니더라구요~!!! 진짜 사장님의 인별그램을 보니 정말 디저트를 얼마나 정성껏 만드시는지 알겠더라구요. 다음엔 미리 인별로 예약하고 와야겠어요 ㅎㅎ 디저트도 너무 맛있었던 성수역카페에서 오랜만에 즐긴 데이트! 11월에 다녀왔는데 이제야 올려버렸네요 ㅠㅠ 어서 코시국이가서 또 방문하고 싶어요! 진짜 재방문의사 10000%!! 다음엔 일찍가서 타르트도 먹고 다른 메뉴들도 먹어볼래요 ㅎㅎ 놓치지 않을거에요!! 50m © NAVER Corp. 발렁스 서울특별시 성동구 성수일로4길 49 1층 발렁스 데이트하기 좋은 카페 발렁스 위치는 위의 지도를 참고하세요~! 오픈은 12:00하시고 19:00까지 운영시간이지만 소진시 마감하신다고 합니다. 월요일은 쉬는날이니 참고하시구요 만약 디저트를 예약하시고 싶으면 인스타그램 발렁스 DM으로 예약 가능하다고 하니 참고하세요~!! 어서 마음껏 나갈 수 있는날이 오기를.. 방콕하며 괴로운1인 ㅠㅠ 오늘도 긴 글 읽어주셔서 감사합니다"
성수동 디저트 카페 발렁스 BALANCE,이번에 찾아간 카페는 성수동에 있는 발랑스! 처음 카페 이름을 들었을 때 머릿속에 딱 들어오지 않았다. 영어에 익숙해져 있는 우리는 BALANCE를 보면 밸런스 라고 읽지 발렁스 라고 읽지 않기 때문일거같은데.. 발렁스는 불어라고 한다. 매주 월요일은 휴무일이고 제품소진시 마감하신다고 한다! 그래서 일찍 찾아가보았다. 저울 모양으로 발렁스를 해석 하신 듯! 내가 갔을 땐 4가지 디저트(냉장)가 있었다. 바닐라통카는 내가 먹고싶었던 타르트이고 다른 하나는 뭘 먹어볼까 고민 하다가 역시 딸기가 제철인 겨울이여서 금실딸기를 주문했다. 그 외에 께흐 블랑과 카카오타르트가 있었다. 마들렌도 4종이 있었고 휘낭시에도 2~3가지가 있었던 걸로 기억. 마들렌도 종류별로 포장해서 집에서 먹었는데 꽤 맛있게 먹었다. 촉촉함이 그대로 남아있었다. 거울보며 찰칵~~ㅎㅎ 이제는 지겨워질대로 지겨워진 코로나가 낳은.. 풍경 프릳츠 원두를 사용하신다. 기라델리 소스 사용하시네 요기늖ㅎㅎㅎ 음료는 아이스 라떼와 백향과에이드. 백향과 에이드는 지난해부터 정말 많이 나온 음료다. 우리나라는 유행이 너무 빨라! 1~2년새에 어느카페에서 찾아 볼 수 있는 음료가 되었다. 바닐라통카 단면. 전체적인 맛을 기억해본다면 맛있게 먹었다. 특히 바닐라의 맛이 진하게 남아있어서 깊은 맛이 있었다. 근데 사람들이 바닐라크림 생김새로 호불호가 있다고 한다ㅋㅋ 곤이 혹은 뇌.. 비슷하게 생겨서 그런거겠지..ㅎㅎ 나도 첨엔 그렇게 생각했었으니까 근데 맛은 좋다는거! 찰칵찰칵 귀여운 신발도 찰칵찰칵 나도 새로운 옷 사구 찰칵찰칵 너무 맘에 드는 옷 색감도 딱 좋다. 주차는 주변에 공영주차장이나 유료주차장에 알아서 해야한다. 요기 사장님이 디저트 참 맛나게 잘 만드시는것 같다. 다음에 다시 가보고 싶은 디저트카페 발렁스~
"[성수동] 디저트 카페 발렁스(메뉴,가격,재방문의사,내돈내산)","BALANCE patisserie 성수 디저트카페 친구랑 앤드밀에서 밥먹고 돌아다니다가 방문한 발렁스! 디저트가 예뻐서 한번 방문해 보고 싶었던 곳 발렁스의 외관. 생각보다 작다고 생각했다 디저트가 유명하다길래 규모있고 테이블도 여러개 있을 줄 알았는데 아니었움 동네 작은 카페같은느낌 발렁스의 로고가 문 옆에 새겨져있 발렁스라는 이름에 걸맞는 로고 매장은 전반적으로 화이톤으로 되어있었고 인테리어 자체에 특별한 점은 없었다 딱 심플하게 되어있었고 공간이 다양하지 않고 규모도 작은 편이라 그런 것 같다 요즘의 인스타 갬성 카페는 아니었다 매장을 들어서면 보이는 디저트 쇼케이스 커피머신 그리고 베이킹하는 공간있듯한 곳에 쳐져있는 베이지톤의 커튼 커피 머신 위에는 에꼴 르노뜨르 수료증? 같아 보이는게 있었다 인터넷에 보니까 졸업하신 분이라고 나와있는거 같던데🤔🤔 자세히는 모르겠다 국내에도 에꼴 르노뜨르 클래스가 있는 걸러 아는데 어마무시하게 비싸다고,,, 암튼 디저트가 기대되는 수료증,,,!! 음료 메뉴는 요러하고 가격은 평범하다 나는 테이크아웃 할거라 패스 짜안- 쇼케이스에 타르트류 디저트가 있었는데 오매 눈돌아가,,,,!!! 디저트를 이렇게 예쁘게 만들다니요,,,!! 가까이서 자세히 보고 싶은 비주얼 디저트의 가격은 쇼케이스 안에 각 제품 앞에 적혀있다 디저트 가격은 역시 비싸다,,,🥲 구움과자는 휘낭시에,마들렌이 있었고 다양한 맛이 있다 근데 이렇게 꺼내져있는 것도 판매하는건 아니겠지,,,? 가까이서 보니까 모형아니고 진짜 같던데 브륄레도 팔고 구움과자나 브륄레는 비싸지 않은 편이다 너무 예뻐서 고르기가 쉽지 않았다 일단은 예뻤던 피스타시에(₩8,600)하나 고르고 바닐라통카(₩8,800)랑 코코플럼(₩8,000)이랑 고민하다가 코코플럼으로 결정! 성수주민이 추석선물로 사줬당 거마엉🤤🤤🤤 포장해주신다고 뒤로 들어가신동안 후다닥 매장사진을 찍어봤다 테이블은 한 개인가 두 개 밖에 없었다 주로 포장위주인가보다 그리고 역시나 한 켠에는 발렁스의 상징 천칭이 있었다 포장해서 집가는 길에 한 컷 다시 한번 성수주민 감사링🙏 집 가서 가족들과 함께 먹으려고 무려 아이스박스에 포장해갔으나 두둥- 무너졌다,,,𖤐 날이 너무 뜨거웠나ㅠ 그래도 다행히 피스타시에는 살아남았다 엄마도 비쥬얼보고 놀란 피스타시에 누가봐도 고급진 디저트같아 보인다 그리고 포장할때 상자 한 쪽 벽면에 작은 아이스팩을 붙여준다 센스👍 키야 일단 눈이 즐거워요 하나씩 봐볼까나 일단 코코플럼(₩8,000) 이름도 아주 찰떡같이 지었는데 코코넛 마스카폰 샹티크림, 코코넛무스, 자도 꽁뽀뜨, 코코넛다쿠아즈 이보다 정확한 설명은 없다,,,!! 만든 그대로 한층한층 설명이 돼있다 처음 먹었을때 코코넛 향이 타악 느껴지면사 자두가 씹히고 쌍콤하다가 코코넛 다쿠아즈 아래 비스킷같은게 무스랑 같이 합쳐져서 부드러우면서도 약간의 식감이 느껴진달까 ㅎ..ㅎ 뭐하나가 엄청 강하지 않고 조화가 잘이루어진 디저트 보시다시피 코코넛 다쿠아즈는 엄청 잘깨진다 하나하나 맛보면 모든 곳에서 코코넛 맛이 나는데 코코넛이 너무 강하지가 않다 다음은 피스타시에(₩8,600) 오렌지꽃 피스타치오 샹티크림, 피스타치오 가나슈, 캬라멜라이즈드 피스타치오, 피스타치오 빠뜨사블레 요렇게 구성돼있다고 한다 사실 요건 비주얼만 보고 바로픽한거라 내스타일 아니어도 그러려니 해야지했는데 으아니,,,,,!! 먹자마자 화아아ㅏ아악 오렌지꽃향이 빡! 피스타치오 디저트에서 전혀 맡아볼 수 없었던 특이한 조합이었다 엄마는 강한 향을 싫어해서 별로라그랬지만 나는 너무너무 좋았다 그렇다고 피스타치오말이 묻히는 것도 아니다 씹을수록 피스타치오의 고소한 맛이 나고 캐러멜라이즈해서 더 맛있는듯! 피스타치오 무스와 피스타치오가 어우러져 식감도 좋고 늠나 맛있자나!! 타르트지도 그냥 밀가루가아니라 피스타치오 사블레인것도 티안나게 한 몫한다 요건 언니와 나의 원픽 요건 엄마의 원픽 (엄마가 한 입에 넣어버리고 싶다고 했다) 가격대가 있긴하지만 가게 이름처럼 재료들의 밸런스가 아주 잘맞는 조화가 잘 이루어진 고급진 맛을 내는 발렁스 재방문의사 아주아주 있어요👍 노광고 친구돈친구산"
성수동디저트카페 <발렁스> 분위기 좋은 신상 타르트 맛집♡,"성수동에 분위기 좋고 핫한 디저트 카페가 생겼다고 해서 바로 다녀왔다. 타르트로 유명한 <발렁스>라는 곳인데 아늑하고 깔끔한 분위기에서 달콤한 디저트를 맛볼 수 있는 곳이다. 발렁스 주소 : 서울 성동구 성수일로4길 49 1층 발렁스 전화번호 : 050713377228 영업시간 : 매일 11:00 - 19:00 월요일 휴무 발렁스(@balance_patisserie) • Instagram 사진 및 동영상 팔로워 541명, 팔로잉 9명, 게시물 40개 - 발렁스(@balance_patisserie)님의 Instagram 사진 및 동영상 보기 www.instagram.com 발렁스 인스타그램을 보니 요즘 감성으로 예쁘게 찍은 사진이 눈에 띄었다. 특히 과일이 듬뿍 올라간 타르트가 비주얼도 좋고 맛있어보인다. 성수역에서 도보로 4분 정도 걸리는 곳에 있어서 접근성도 좋다. BALANCE라고 쓰여 있는 간판을 보니 아주 잘 찾아온것 같다. 처음에는 발렁스라는 이름이 특이하다고 생각했는데 알고보니 BALANCE 라는 친숙한 이름이었다. 내부는 깔끔한 화이트 톤으로 되어있어 환한 동시에 목재 테이블과 의자로 아늑한 느낌도 드는 곳이다. 개인적으로 제일 좋아하는 인테리어인데 깔끔하면서도 고급스러운 느낌이 들어서 좋았다. 오픈한지 얼마 안된것 같던데 쾌적하고 깔끔 그 자체였다 평일 오픈 시간에 갔더니 여유롭게 디저트를 먹고 올 수 있었다. 발렁스는 직접 만드는 수제 타르트로 유명한 디저트 카페이기도 하다. 다크초콜릿과 라즈베리, 다쿠아즈, 아몬드가 들어간 깨흐누아 / 땅콩 프랄리네, 아몬드, 돌세 샹트크림 등이 들어간 땅콩둘세 / 바닐라생크림, 헤즐넛버터, 통카 카레멜 등이 들어간 바닐라 퉁카 / 용과, 패션 앙글레즈 크림 , 아몬드 등이 들어간 용과 패션 타르트까지!! 정성이 가득 들어간 비주얼에 한번, 고급스러운 맛에 두번 감동했던 타르트라 엄청 맛있게 먹고 왔다. 타르트 가격은 7천원~8천원 정도이며 아이스아메리카노와도 아주 잘 어울린다. 발렁스의 또다른 시그니처 디저트인 마들렌도 다양한 종류가 있다. 쇼콜라 마들렌 유자라임 마들렌 클래식 마들렌 말차 땅콩 마들렌 아메리카노 카페라떼 바닐라라떼 카페모카 패션후르츠 에이드 라즈베리 에이드 아메리카노가 3500원인데 부담없이 마시기 좋은 가격이다. 요즘 개인 카페의 음료가격이 기본 5천원부터 시작하는것을 생각하면 굉장히 합리적인 가격이라고 생각된다. 논카페 음료로는 패션후르츠 에이드와 라즈베리 에이드가 있는데 두가지 음료 모두 비주얼이 대박일것 같은 느낌이다. 테이블은 3~4개 정도 있었으며 푹신한 쇼파에 앉을 수 있어서 좋았다. 어디에서 사진을 찍든 바로 인생샷을 건질 수 있는 곳이다. 모던하고 깔끔한 느낌이 나는 인테리어라 요즘 가장 핫하고 예쁜 디자인이 아닐까 싶다. BALANCE라는 이름에 어울리는 소품이 한쪽에 자리잡고 있다. 인테리어 소품 하나하나에도 세련된 감성이 묻어나있다. 아이스 아메리카노 바닐라 라떼 바닐라 통카 쇼콜라 마들렌 유자라임 마들렌 말차 땅콩 마들렌 발렁스 (1) 재생 9 좋아요 0 00:00 00:19  (1) 카페에서 나오는 노래까지 마음에 들어서 영상으로 남겨봤다. 노래가 카페 분위기를 더욱 고급스럽게 만들어주는 것 같은 느낌이다. 깔끔하고 정갈하게 플레이팅 되어 나와서 인스타 갬성이 뿜뿜한다. 인테리어가 워낙 예뻐서 어디에서 어떤 구도로 찍어도 사진이 잘 나온다. 따뜻한 느낌의 나무 쟁반과 테이블이 분위기를 한층 더 고급스럽고 아늑한 느낌을 만들어준다. 그릇과 쟁반, 디저트 비주얼까지 마음에 쏙 들어서 바로 먹지 못하고 사진을 거의 백장 넘게 찍고 나서야 먹을 수 있었다. 카페를 하루에 한번씩은 꼭 갈 정도로 카페투어를 좋아하는데 여기는 찐 분위기 + 디저트 맛집이었다. 사진도 예쁘게 나오고 예쁜 사진만큼이나 맛도 좋아서 요즘 여기저기 추천하고 다니는 카페가 됐다. 아이스 아메리카노 향긋한 풍미와 적당한 산도가 느껴지면서 깔끔한 맛이 나는 아이스 아메리카노다. 가격이 3500원이라 전혀 부담이 없고 특히 향과 맛이 좋았다. 아이스아메리카노는 어느 카페에 가던 항상 시키는 메뉴인데, 여기 아이스아메키라노는 유독 추천하고 싶다. 신선하고 향긋한 원두를 사용하는것 같던데 뒷맛이 깔끔하고 목넘김도 좋다. 바닐라라떼 달달하고 부드러운 맛이 일품인 아이스 바닐라라떼도 맛이 좋다. 너무 달지도 않고 쓰지도 않아서 누구나 좋아할것 같은 달콤한 맛이다. 여기 커피는 다 맛있는것 같은데 양도 넉넉하고 맛도 좋아서 추천하고 싶은 메뉴다. 바닐라 통카 바닐라 통카는 인스타그램에서 보고 꼭 먹어보고 싶던 타르트였다. 바닐라 샹티크림 헤즐넛버터 비스퀴 통카 카라멜 아몬드 빠뜨 샤블레 이름을 들어도 어떤 재료인지 잘 모르겠지만 일단 맛있어보임!! 반으로 갈라보니 위에는 달콤한 크림이 가득하고 아래는 바삭바삭하고 담백한 타르트가 있었다. 위에 금가루도 살짝 뿌려져 있어서 고급스러운 느낌도 들었다. 한입 먹는 순간 입안 가득 달콤함이 퍼지면서 사르르 녹는 맛이었다. 바닐라 샹티크림이 넉넉하게 들어가있었는데 너무 달지도 않고 아주 부드러웠다. 발렁스의 시그니처 타르트 중 하나라고 하던데 역시 유명한데는 그 이유가 있었다. 타르트가 워낙 맛있어서 다른 종류의 타르트도 포장해가고 싶을 정도였다. 특히 용과가 가득 올라가있는 용과 패션 타르트도 맛있어보였는데 직원분의 추천 메뉴중 하나였다. 마들렌은 4가지 종류 중에서 3개를 주문해봤다. 유자라임 마들렌 향긋하고 상큼한 맛이 나는 유자마들렌이다. 향이 워낙 좋아서 입안 가득 향긋함이 감돌아서 기분이 좋아진다. 적당히 달달하면서 부드러운 맛이라 호불호 없이 누구나 좋아할것 같다. 마들렌도 여기서 직접 만드는것 같은데 역시 수제로 만드는 디저트라 그런지 훨씬 맛있는 기분이다. 말차 땅콩 마들렌 고소한 맛의 땅콩과 쌉싸름한 녹차맛이 나는 말차 땅콩 마들렌이다. 말차와 땅콩의 만남은 기대 이상으로 맛있었다. 말차의 쌉싸름하면서도 달콤한 맛이 땅콩의 고소함과 만나 중독성이 강한 맛이 났다. 마들렌은 한개씩 시켜서 둘이 나눠먹었는데 몇개씩 시켜서 먹고 싶은 기분이다. 쇼콜라 마들렌 달콤한 맛의 절정인 쇼콜라 마들렌이다. 초콜릿을 워낙 좋아해서 주문했는데 역시 맛있었다. 초코가 한번 코팅되어 있어서 더욱 달콤하고 부드러운 맛이다. 성수동에는 분위기 좋은 디저트 카페가 많은데 그중에서도 맛있는 디저트와 감성넘치는 분위기로 마음에 쏙 들었던 카페 발렁스였다. 사장님도 엄청 친절하고 달콤한 디저트도 마음에 들었다. 성수동 카페투어하러 갈때 다시 찾아가봐야겠다. #성수동신상카페 #성수동디저트카페 #성수카페 #발렁스 #성수발렁스 #성동구카페 #성수맛집 #성수디저트 #성수케이크 #성수마들렌 #BALANCE카페"
성수동 디저트 카페 발렁스 BALANCE,"잇님들 안녕하세요:) 7월인데도 불구하고 아침 저녁으로 일교차가 많이 크네요. 건강 관리 잘하시길 바랄게요:) 오늘 포스팅은 성수동 신상 카페 발렁스에 다녀온 것에 대해 써 보려고 합니다. 발렁스 *서울 성동구 성수일로4길 49 1층 *성수역 4번 출구에서 282m *매일 11:00 ~ 19:00 발렁스 서울특별시 성동구 성수일로4길 49 1층 발렁스 성수동 수제화 골목, 그리고 카페가 많이 밀집 된 곳에 위치하고 있어서 찾기 어렵지 않아요:) 그래도 성수동 신상카페이니만큼 걷다가 보면 이렇게 눈에 띄게 예쁜 하얀 색 인테리어가 되어 있는 곳을 딱 알아 보실 수 있으실거에요. 제가 방문한 시간은 피크타임이 지난 어중간한 시간이었는데요. 그 때 방문을 했는데도 타르트가 벌써 매진된 것들이 많아서ㅠㅠ 정말 인기가 많은 곳이나를 느낄 수 있었네요. 인스타 사진 보고 찾아오는 손님도 많다고 들었는데, 비주얼을 보니 정말 군침이 돌더라구요.ㅎㅎ 디저트 진열대 안에는 용과 패션 타르트(7.4) 땅콩둘세 타르트(7.6) 이렇게만 남아 있었어요. 인기 대박! 발렁스는 마들렌도 맛있다는 후기를 많이 봐서 그냥 보고만 있어도 므흣!ㅎㅎ 쇼콜라 마들렌(3.0)/ 유자라임 마들렌(3.0) 이렇게 진열되어 있었구요. 말차 마들렌(3.3)/ 클래식 마들렌(2.7) 이렇게 진열되어 있었어요. 음료 메뉴도 있어서 사진으로 담아와 봤습니다. 저는 바로 다음 약속이 카페라 음료는 주문하지 않았어요. 저는 유자라임 마들렌(3.0), 말차 마들렌(3.3), 쇼콜라 마들렌(3.0) 바닐라통카 타르트(8.2), 용과패션 타르트(7.4) 이렇게 주문을 했어요.:) 원래는 자색고구마 타르트(7.2)도 메뉴에 있는데 이날은 품절이었어요.ㅎㅎ 발렁스는 성수동 디저트 카페 답게, 테이블과 쇼파도 인스타 갬성 나듯 너무 이뻐서 사진도 잘 나오더라구요. 바닐라통카 타르트(8.2)/ 용과패션 타르트(7.4) 바닐라통카는 어떤 맛일까 궁금했는데 하얀색상 부분이 바닐라 맛이 나고, 겹겹히 쌓여서 촉감도 굉장히 좋았어요. 아래쪽은 카라멜이 묻혀진 타르트 밑부분이라 달콤함과 함께 너무 조화로운 맛이 들더라구요. 자세히 보여드리려고 가까이에서도 한번 찍어보았는데요. 한쪽에 금가루? 뿌려져 있는데, 이게 또 데코가 이쁘게 보이도록 하는데 한몫 하는 것 같다고 느껴졌어요. 용과 패션타르트도 완전 신선한 느낌 그대로 올려져 있고, 아래쪽은 크림브릘레 같은 느낌의 커스터드 느낌과 함께 잘 어울려서 특별한 타르트라고 느껴졌어요! 카페 한쪽 벽면이 이렇게 예쁘게 인테리어가 되어 있었는데 너무 이쁘지 않나요?ㅎㅎ 원래 있던 손님들이 자리를 떠나셔서, 그쪽 방향 테이블도 찍어봤습니다.:) 요즘 성수동 신상 디저트카페로 핫한 이유를 알 것 같았어요. 성수동 갈 일 있으면 한번 가보시면 좋을 것 같습니다."
