title,content
성수동 핫플 스타벅스 서울숲역점 방문 후기,"스타벅스 서울숲역점 서울특별시 성동구 왕십리로 50 매일 07:00 - 22:00 1522-3232 스타벅스 서울숲역점 서울특별시 성동구 왕십리로 50 서울숲 건너편에는 스타벅스 서울숲역점이 있다. 나는 동네여서 매일 그앞을 지난다. 이 건물은 메가박스 본사로 지하1층에서 7층까지 여러 매장으로 되어 있다. 최근에는 게임회사 크래프톤에 매각 진행된다고 한다. 지하에는 여러병원과 미용실, 키즈파크가 있어서 예약 시간을 기다릴 때도 커피 한잔 하고 기다리기 좋다. 오늘은 병원진료가 있어서 진료시간 기다리며 잠깐 앉아 있었다. 빈속에 오라고 하여 음료를 시키지 못하고 앉아 있었는데 여기는 음료를 시키지 않아도 앉아 있기 부담스럽지 않고 화장실도 근처에 있어서 이용이 편하다. 요즘은1인 1음료를 강요하는 카페들이 많은데, 음료보다 케익과 빵을 좋아하는 나는 1인 1음료를 주장하지 않는 스타벅스를 선호한다. 내가 제일 좋아하는 메뉴는 디카페인 아메리카노와 부드러운 생크림 카스텔라 이다. 카페인에 예민한 내가 편하게 마실수 있는 디카페인 메뉴를 팔아서 정말 좋다. 따뜻한 디캎 아메리카노와 달달하고 촉촉한 부드러운 생크림 카스텔라는 생각만해도 입안에 군침이 돈다. 크리스마스 시즌을 맞아 다양한 스타벅스 크리스마스 굿즈를 팔고 있다. 다 사고 싶은데 가장 마음에 드는것은 초록색과 빨간색이 조화된 크리스마스 티포트와 호박 무늬로 디자인된 빨간색 머그컵이다. 스타벅스 서울숲역점은 두면이 큰 통창으로 되어 있고 층고가 높아 쾌적하다. 매장이 넓고 편안한 쇼파가 곳곳에 놓여 있어 햇빛을 받으며 책을 읽거나 노트북 하고 사색하기 좋은 공간이다. 후문도 통창으로 넓게 되어 있는데 건물 내부와 연결되어 있어서 화장실을 가기 편하다. 나가서 엘레베이터를 지나 왼쪽 코너로 돌아가면 화장실이다. 스타벅스는 오래 앉아 있거나 지나가다 잠깐 들려 앉아서 쉬었다 가도 전혀 부담을 주지 않는다. 또한 화장실을 시민들에게 무료개방하는 방침은 요즘처럼 화장실이 드문 한국에서 칭찬할 일이다. 동네에 이런 편안한 공간이 있어 스타벅스에 감사한다."
말로만 듣던 딸기 아사이 레몬에이드 성수동 - 스타벅스 서울숲역점,"안녕하세요 산도입니다 :) 이번에 간 곳은 잠시.. 쉬기위해 들렀던 성수동에있는 스타벅스 서울숲역점 스타벅스 서울숲역점 서울특별시 성동구 왕십리로 50 영업시간 : 월~목 : 7:00~22:00 금 , 토 , 일 : 7:30~22:00 주차가능 스타벅스서울숲역점 입구 그렇게 도착한 스타벅스서울숲역점입구 입구부터 북적북적 스타벅스서울숲역점 실내 들어가서 본 실내.. 자리를 먼저 찾아야할 거 같아서 봤는데 세상 사람이 엄청 많네요 하하하 스타벅스서울숲역점 실내 좌석도 되게 많았는데 다들 노트북은 필수로 챙기셨더라구요 바쁘시군 스타벅스서울숲역점 퇴식구 퇴식구도 이렇게 준비되어있구 스타벅스서울숲역점 상품 여러상품들.. 스타벅스가 확실히 좋았던게 선물로 무난한게 스벅 기프티콘인지라.. 그것들로도 살 수 있어서 좋은 거 같아요 스타벅스서울숲역점 쇼케이스 다른 음료들도 쇼케이스에있구 디저트도 보였던 스타벅스서울숲역점 디저트 어플로도 주문할 수 있었는데 저희는 기프티콘을 쓰기위해.. 줄을섰습니다 하하하 저희는 말로만듣던 딸기아사이레모네이드 , 아아 ,바스크치즈케이크 이렇게 주문했어요 듣기론 딸기저거는 외국에서만 판매했다고하는데 이번에 들어왔다구 늦었지만.. 지금이라도 후후후 스타벅스서울숲역점 카드 충전형.. 카드.. 인가 처음보는데.. 이것두 괜찮을 거 같아요 물론 기프티콘이 훨씬 편할듯 스타벅스서울숲역점 음료 그렇게 금방나온 음료와 디저트 음.. 네 딸기아사이레모네이드는... 그냥 불량식품맛?? 같았어요 다소 아쉬웠는데 다른 지인들께 물어보니까 다른곳 한번 먹어보라구 치케는 역시나 맛있지뭐야 전국적으로 많이 있어서 기프티콘도 쓰기 좋았구 쉬어가기도 좋았어요 다들 친절하셨던 그럼 저는 20000 :)"
일하기 좋은 스타벅스 서울숲역점(ft. 성수동 대형카페),"안녕하세요, 새벽방긋입니다. 오늘은 성수동 서울숲 대형카페로 유명한 스타벅스 서울숲역점에 다녀와서 후기 작성하려고 합니다. 제가 사는곳은 서울숲 근처라서 스타벅스 서울숲역점에 자주 가는데요. 특히나 지난 주말에는 회사 업무가 많아서 오후 내내 스타벅스에 있었습니다. 일하다 보니 문 닫을 시간까지 있게 되었는데요. 넓고 쾌적해서 굉장히 편하게 일할 수 있었어요. 그래서 소개해 드리려고 합니다. 그럼 서울숲 대형카페 스타벅스 서울숲역점 저랑 같이 가보실까요? 성수동 대형카페 스타벅스 서울숲역점 내외부 인테리어 성수동 대형카페답게 스타벅스 서울숲역점은 굉장히 넓고 쾌적한 느낌이에요. 테이블 종류도 여러가지가 있는데요. 쇼파가 준비되어 있는 곳도 있고요. 저처럼 일하는 사람들이 앉아 있기 좋은 콘센트를 꽂을 수 있는 노트북형 테이블도 있습니다. 저는 이 자리에서 오랜시간동안 앉아있었네요. 1인석부터 다인석까지 다양하게 마련되어 있어서 누구랑 와도 편하게 머물다 갈 수 있는 스타벅스 서울숲역점입니다. 포스팅 할 생각이 전혀 없었는데 지난 주말에 스타벅스 서울숲역점에서 오래 있다 보니 사람이 많았음에도 불구하고 전혀 불편하지 않음을 느끼고 포스팅 하기로 마음 먹었습니다. 클로징 시간이 다 되어서 손님이 거의 없어서 사진도 조금 찍을 수 있었어요. 호호. 스타벅스 서울숲역점 내부 구경 하고 가세여~ 일하기도 공부하기도 좋은 스타벅스 서울숲역점 추천합니다. 성수동 대형카페 스타벅스 서울숲역점 메뉴 우선 죄송합니다. 끝나갈 때쯤 사진을 찍어서 메뉴가 거의 없는 상태였어요, 이해해 주세요. 하핫. 메뉴는 스타벅스 앱에서 참고해 주시고요~~~ 스타벅스 서울숲역점에 있는 굿즈들은 위 사진을 참고해 주세요. 성수동 대형카페 스타벅스 서울숲역점 운영시간 22:30 [운영시간] 월 - 금 07:00 ~ 23:00 토 07:30 ~ 22:30 일 07:30 ~ 22:00 스타벅스는 일찍 오픈해서 참 좋은 것 같아요. 스타벅스 서울숲역점도 7시부터 오픈 하니까 참고해 주세요~ 성수동 대형카페 스타벅스 서울숲역점 위치 스타벅스 서울숲역점 서울특별시 성동구 왕십리로 50 스타벅스 서울숲역점에서 숲 역에서 5분 이내 거리에 위치해 있습니다. 메가박스 건물 1층에 있어요. 이번 주말에 서울숲으로 나들이 오셔서 벚꽃 구경 하시고, 스타벅스 서울숲역점에서 커피 한잔 하시는 건 어떠실까요? 일하기도 좋고, 공부하기도 좋은, 성수동 대형 카페 스타벅스 서울숲역점 추천 드립니다. 저의 포스팅이 도움이 되셨기를 바라며, 오늘도 빛나는 하루 되세요! #성수동대형카페 #일하기좋은카페 #공부하기좋은카페 #스타벅스서울숲역점"
성수동[스타벅스 서울숲역점],"스타벅스 서울숲역점 오늘 남의 동네(성수동)에서 산책하고 구경하고 커피 마셨습니다. 성수동은 서울 한복판이면서도 답답함과 차가움보다는 뭔가 따뜻하고 여유가 느껴지는 곳이라 좋아하는 곳입니다. 옛날의 모습과 현대의 모습이 잘 어우러지는곳이라서 그런것 같아요 아아 매니아! 나름 얼죽아였는데 요즘은 자꾸 따뜻한게 좋아져요 시원함은 포기할 수 없어서 얼음물 한잔을 부탁해서 받았습니다. https://blog.naver.com/hanarani7/222907516776 성수동[10월 주말나들이! 서울숲 마켓에이핏] 10월23일 일요일까지 성수동에서 제3회 마켓에이피가 열립니다. 오늘 가보니 세일하는 제품도 많고, 디자이... blog.naver.com 10월이 가기전에 즐거운 나들이 하세요"
서울숲요가 추천 :: 내 마음에 쏙 드는 성수동필라테스 아리아 요가&필라테스 서울숲역점,"서울숲요가 추천 :: 내 마음에 쏙 드는 성수동필라테스 아리아 요가&필라테스 서울숲역점 서울 성동구 왕십리로 50 지하 1층 인사이드요가 서울숲역점 (성수동1가, 메가박스 스퀘어) 문의번호 02-2297-2025 copyright ⓒ 2021 by 하라쇼 서울숲역 2번출구에서 걸어나오면 스타벅스&메가박스건물을 볼 수 있는데요 이곳 지하 1층에 위치한 아리아 요가&필라테스 서울숲역점입니다. 이렇게 에스컬레이터로 내려오면 바로 정면에 위치하고 있어요 통유리로 되어 있던 아리아 요가&필라테스 서울숲역점 무엇보다 새로생긴지 얼마되지 않기도 하고, 꼼꼼하게 관리되어 있어서 정말 깨끗하더라구요 아리아 요가&필라테스 서울숲역점은 국내 최대 요가 브랜드인 타우요가와 아리아요가의 콜라보레이션 프로젝트를 통해 신규 런칭하게 된 스튜디오라고 하더라구요 무엇보다 제가 아리아 요가&필라테스 서울숲역점이 마음에 들었던 점은 저는 필라테스나 요가에 대해서 굉장히 시작하기 어려운 운동이라고 생각했었는데 그걸 많이 깨주시더라구요 상담선생님께서 정말 친절하게 설명도 해주시고, 무엇보다 저는 운동할때 입는 옷이나 제가 날씬한 몸이 아니기에 더욱 더 시작하기 어려운 운동이라고 생각했는데요 선생님께서 반팔과 반바지를 입고 해도 상관없는 운동이라고 이야기해주시더라구요 특히 요가의 경우 수업에 들어가면 아무리 많은 사람들이 있어도 나와 선생님과의 1:1대화이기 때문에 다른 사람의 시선이 아닌 나 자신에게 집중하는 운동이기때문에 저한테 너무 걱정하지 말라고 하시더라구요 따뜻한 조명과, 편안한 느낌이 나서 너무 좋더라구요 들어가서 신발장에 신발을 넣고, 실내화로 갈아신고 입장해요 방역수칙 준수하에 정상수업을 진행하기 때문에 손소독과 QR 인증 후 안으로 입장하면 되요 상담의 경우 전화상담은 12:00-21:00 방문상담은 13:00-21:00에 진행하고 있기 때문에 02-2297-2025로 연락하시면 됩니다. 가운데에는 앉을 수 있는 긴 테이블과 한쪽에는 이렇게 차와 아로마들도 놓여져있더라구요 시간표 <필라테스 시간표> 필라테스는 시간대가 정말 다양하게 있었구요 50분 수업으로 진행됩니다. <요가 시간표> 요가는 정말 다양한 난이도에 수업이 었는데 선생님께서 한번도 요가를 경험하지 못했거나 정말 쉬운 단계를 들업보고 싶다면 테라피가 들어간 코어테라피, 볼테라피, 척추테라피같은 수업들을 들으면 정말 쉽게 할 수 있다고 하셨어요 저는 코어테라피를 첫 수업으로 선택했는데 폼을 가지고 수업을 해서 정말 시원하기도 하고 간단해서 집에 가서도 응용해서 뭉친 근육들을 풀어줄 수 있다고 하더라구요 두번째단계는 반야사, 플라잉 그라운드를 추천해주시더라구요 반야사는 정말 많이 들어본 단어였는데 반야사는 가장 요가의 전통적인 방식이라고 해요 그래서 반야사를 통해서 기본을 다질 수 있다고 추천해주셨어요 그리고 플라잉 그라운드는 플라잉 에어를 하기 전에 돋움닫기 단계라고 생각하면 된다고 하시더라구요 플라잉 에어는 허리 위까지 해먹이 올라가는데 플라잉 그라운드는 10-20CM 정도밖에 안올라가서 조금 더 편안하게 요가를 즐길 수 있다고 하더라구요 그리고 세번째는 인사이드가 붙은 요가들은 어느정도 수준을 요구하는 요가라고 해요 인사이드 플로우, 인사이드 요가, 인사이드 반야사 등 어느정도 요가로 수련을 하신 분들이라면 강도 있는 요가를 즐기실 수 있다고 하더라구요 이렇게 신체교정, 다이어트, 명상, 필라테스 4가지 효과를 통해 표시도 되어 있으니 본인에게 필요한 부분이 속하는 요가를 선택할 수 있어서 정말 좋더라구요 무엇보다 인사이드 서울숲역점은 수강신청이 편안한데요 수강생들만 들어갈 수 있는 홈페이지에 들어가 수강신청을 하면 되는데 진짜 대박인게 직장을 다니답보면 갑자기 야근이 생기거나 어떤 변수가 생길 지 몰라 운동을 꾸준히 하기 어려운데요 이곳은 그냥 수업 시간 전까지만 수강신청을 하면 되서 에스컬레이터를 내려오면서 신청해도 된다는 사실 심지어 취소도 수업 전까지만 취소하면 아무 불이익이 없다는 것 횟수차감 없이 그냥 수업전까지만 취소하면 되요 진짜 신청, 취소가 자유로우니까 제 상황에 맞춰 운동하면 되서 너무 좋더라구요 주 2일, 주 3일 수업을 정할 수 있는데 무조건 주 2일, 3일을 듣지 않아도 되구요 한달에 들을 수 있는 횟수 안에서만 다 들으면 되니까 한주는 4일 갔다가 한주는 쉬다가 할 수 있어서 정말 좋더라구요 그래서 자유롭게 내 시간에 맞춰 수업을 들을 수 있다는 점이 엄청난 강점이더라구요 당장 내일 하루도 일정이 어떻게 될 지 모르는 불안의 연속인데 이렇게 배려해주시니까 정말 부담없이 수업을 올 수 있다는 게 정말 좋았어요 필라테스 PILATES 필라테스룸은 5개의 기구들이 놓여져 있었고 1:5로 그룹수업이 진행되고 1:1 PT도 가능하다고 해요 저는 필라테스가 요가보다 더 어려운 운동이라고 생각했는데요 필라테스는 기구를 사용하는 운동이기 때문에 요가보다 좀 더 쉽다고 하시더라구요 그리고 필라테스의 경우 횟수로 차감이 되는데요 가장 좋은 운동시간은 1시간 50분 정도가 적당하다고 이야기해주시더라구요 저는 오히려 기구여서 더 어렵고 힘들거라고 생각했는데 초심자반도 있기 때문에 수업을 들어보면 정말 쉽게 할 수 있다고 하시더라구요 필라테스 역시 복장은 정말 자유롭게 입으셔도 된다고 해요 예쁜 언니들이 입는 필라테스운동복을 꼭 입어야하는게 반팔에 반바지도 오케이라고 힙니다. 그리고 아리아 요가&필라테스 서울숲역점이 좋은 점은 개장한지 얼마 안되기 때문에 1:5수업도 2-3명으로 그룹수업이 진행되기 때문에 조금 다른 곳보다 더 여유있게 하실 수 있다는거 (소근소근) 가격이 저렴한 필라테스도 찾아가보기도 하고 상담은 정말 많이 받아봤는데 저는 이곳만큼 마음에 쏙 드는 공간이 없었던 것 같아요 여러분 지금이 기회입니다. 공간도 너무 깨끗하고 밝고, 1:5 그룹수업을 1:1 PT처럼 받을 수 있는 기회! 저는 이건 소문나기 전에 무조건 얼른 다녀야겠다고 생각했어요 요가 YOGA 플라잉 에어를 할 수 있는 기구들도 있구요 이것은..... 비...비싼 그 스피커 로봇 청소기도 열일을 하고 있더라구요 아로마들도 있었고 청결에 청결을 더한 느낌이랄까요 먼지 한톨도 없더라구요 정말 관리를 너무 잘 해 놓으셔서 너무 안심하고 다닐 수 있겠다는 생각을 했어요 요가의 경우 횟수로 차감되는 게 아닐 일로 차감이 되는데요 하루종일 수업을 들어도 한회로 처리가 된다고 하더라구요 그래서 요가 수업을 하루에 2-3개 들어도 한번으로 치기때문에 자신의 상태에 맞춰 수업을 더 들을 수 있으니까 이것도 너무 매력있더라구요 탈의실 11월부터 샤워실도 중단이 풀렸다고 하는데요 캐비넷도 넉넉하게 있고 수건도 넉넉하게 있고 스타킹이나, 양말 신기 불편아니까 이렇게 앉을 곳도 있고 그냥 세면만 해도 되고 샤워실은 4개정도 있어서 편안하게 씻을 수 있겠더라구요 다만 샴푸나 비누는 개별적으로 가져와서 씻으면 됩니다. 규조도가 아니라 특이하게 수건을 한무더기 깔아두셨는데 혹시라도 규조도가 세균이 많을까봐 수건을 대신 깔아두셨다고 해요 한사람이 쓰면 바로 밟은 수건을 바로 수건놓는 곳에 놓아주면 되더라구요 센스있게 머리끈도 놓여져 있었어요 PT PT 공간도 따로 마련되어 있는데요 필라테스 기구부터 플라잉 요가를 할 수 있는 기구들도 달려있더라구요 공간이 정말 쾌적하게 유지되고 있었고 청결해서 정말 너무 좋더라구요 그밖에도 한바퀴 아리아 요가&필라테스 서울숲역점을 둘러봤는데 보면 볼수록 지갑이 저절로 나오더라구요 진짜 여러분 꼭 다니세요 제가 많은 곳을 둘러보고 일일클래스도 들어봤는데 여긴 이제 유목민으로 이곳저곳 안 다니고 이제 아리아 요가&필라테스 서울숲역점에 정착하려고 해요 복잡하지 않고 넓은 공간인것도 너무 좋았고 선생님들도 3분이서 같은 시간에 가면 항상 그 선생님께 수업을 들을 수 있어서 정말 좋더라구요 그리고 전문적인 선생님분들이셔서 더욱 신뢰가 가고, 의지하면서 수업을 받을 수 있어서 정말 좋았어요 인사이드요가 서울숲역점 서울특별시 성동구 왕십리로 50 지하 1층 인사이드요가 서울숲역점"
최애 스타벅스 서울숲역점,"스타벅스서울숲역점이 생기기 전부터 이 앞을 걸어 다녔다. 그러니까 메가박스 스퀘어 건물이 새워지기 전 낡은 공장 건물이었을 때부터 이곳을 지나다녔다. 공사 펜스가 걷히더니, 메가박스 본사가 들어왔다. 그리고 1층엔 스타벅스서울숲역점이 자리 잡았다. 스타벅스 서울숲역점 서울특별시 성동구 왕십리로 50 상호: 스타벅스서울숲역점 위치: 서울 특별시 성동구 왕십리로 50 영업시간 : 평일: 7:00~22:00 토: 7:30~22:30 / 일:7:30~22:00 전화: 1522-3232 주차: 1만원 이상 구매시 30분 무료, 이후 10분당 천원 주차요금정산방법: 파트너에게 요청 이곳은 서울숲 공원으로 들어가는 큰 입구 중 하나다. 서울숲역과도 2분 거리라 찾기도 쉽다. 서울숲으로 놀러 온 사람들이 보통 여기서 커피를 사 간다. 그리고 서울숲에서 산책을 하다가 목마르면 들어오는 곳이기도 하다. 사람도 많고 주문하는 줄도 긴 곳인데, 오늘은 줄이 많이 짧다. 날씨가 뜨거워질수록 빈자리가 없다. 테이블에 앉아 천천히 커피를 마시고 싶어도 빈 테이블이 없어서 테이크아웃해야 하는 스타벅스다. 일찍 오지 않으면 테이블 잡기 힘든데 오늘은 운 좋게 자리를 잡았다. 점심을 일찍 먹어서 그렇다. 날씨도 좋은데 집에 들어가 있는 것보다는 밖에 앉아 있고 싶었다. 기왕 여유 있을 때 온 김에 좀 더 오래 앉아 있고 싶어서 천천히 둘러봤다. 빈자리 중 앉을 자리를 물색했다. 햇빛이 잘 드는 자리도 좋은 데, 노트북을 써야 하므로 충전 코드가 있는 벽 자리로 골랐다. 앉고 보니 여기가 명당이다. 한눈에 스타벅스 매장 밀도가 보인다. 오른쪽으로 시선을 돌리면 서울숲의 초록 나무도 보인다. 스타벅스서울숲역점은 남향과 서향 통창이 뚫어있는데, 햇빛이 직접 들어오지는 않으니 노트북 쓰기가 좋다. 내 옆을 보니, 남자 2분이 에여 팟을 끼고 노트북으로 무언가를 코딩 중이다. 내가 앉은 라인이 오래 머물 사람들에겐 괜찮은 자리라는 것이다. 시원한 걸 먹고 싶어서 돌체 아이스라떼를 시켰다. 기왕 눌러 앉은 김에 읽어야 할 책도 꺼냈다. 책을 너무 못 읽었다. 스타벅스서울숲역점을 검색하다가 보니, '성수 메가박스 스퀘어의 새 주인을 찾는다'라는 기사를 봤다. 메가박스 본사 건물인데, 왜 팔지란 생각이 든다. 영화관 산업이 힘들긴 한가보다. 이번에 CJ CGV가 CJ 망하게 하네 마네 하는 것을 보면. OTT 문화가 생기면서 기존의 영화관 문화가 죽는 것이 자연스러운 거다. 스타벅스서울숲역점 터가 좁은 공장 터였는데, 지금은 빈자리가 없는 스타벅스인 것처럼. 그러고 보니 서울숲 공원은 위용은 견고하다. 그때도 사람 많았고, 지금은 더 많다. 코로나 때도 마스크 쓰고 사람들이 몰려왔고 지금은 마스크 쓴 사람이 1도 없다. #스타벅스서울숲역점 #서울숲 #서울숲스타벅스"
스타벅스 서울숲역점 만다린 버베나 피지오 후기 스타벅스 신메뉴 후기 주차정보,"안녕하세요. popo입니다:) 다시 돌아온 스타벅스 신메뉴! 사실 7월에 나온 신메뉴라 지금은 없지만 다시 나올 수도 있으니 그냥 포스팅하려고요 ㅎㅎ 스타벅스 서울숲역점 월~금 07:00-22:00 토 07:30-22:30 일 07:30-22:00 📞1522-3232 주차 서울숲 가기 전 들리기 좋은 위치에 있어서 피크닉 음료 사러 가기도 좋아요 ㅎㅎ 또 다른 신메뉴가 붙어있어요. 담에 서울 지역 메뉴 먹어보려고요😏 7월 신메뉴로 나온 만다린 바베나 피지오! 내부 스타벅스 서울숲역점은 내부가 꽤 넓은 편이었어요. . 1층으로 되어있고 화장실은 스타벅스 외부 건물 화장실을 사용해요. 주차정보 -입점 건물 지하 2~5층 사용 가능 *주차 조건: 1만 원 이상 구매 시 30분 무료, 이후 10분당 천원 *주차요금 정산 방법:파트너에게 요청 텀블러도 꽤 다양하게 있었어요 ㅎㅎ 달의 신메뉴가 붙어있는 메뉴판! 라즈베리 팝 쉐이큰 티도 궁금했지만 솔드 아웃이라 다음 기회에. 언제나 그렇듯 사이렌 오더로 주문하고 기다렸어요😏 픽업 받고 바로 서울숲에 피크닉 하러 출발!! 색감이 너무 예쁘더라고요 ㅎㅎ 초록 초록한 서울숲과도 엄청 잘 어울렸어요🤍 맛은 상큼한 게 너무 제 스타일이라 나중에 나오면 또 시켜 먹을 거 같아요 💓 제 스타일의 스벅 음료는 자허블, 쿨라임 피지오입니다:) 저와 비슷한 스타일의 음료를 드신다면 꼭 추천드려요🥹✨ (저는 8월 26일에 먹었는데 지금은 들어간 거 같아요ㅠ) 📍스타벅스 서울숲역점 스타벅스 서울숲역점 서울특별시 성동구 왕십리로 50"
[스타벅스 서울숲역점] 안내,"여유로운 쉼터의 공간 스타벅스 서울숲역점입니다. 서울특별시 성동구 왕십리로 50 (성수동1가) 1층 서울특별시 성동구 성수동1가 656-335 메가박스 스퀘어 1층 1. 주차가능 2. 주차장 위치 - 입점 건물 지하 2~5층 3. 주차가능대수 - 100대이상 4. 주차조건 - 1만원 이상 구매시 30분 무료, 이후10분당 천원 5.주차요금정산방법 - 파트너에게 요청 분당선 서울숲역 2번 출구 100미터 메가박스 성수점 1층 #스벅 #스타벅스어플 #스타벅스주소 #스타벅스주차 #스타벅스위치 #스타벅스전화번호 #스타벅스고객센터 #스타벅스이벤트 #스타벅스다이어리 #스타벅스프리퀀시 #스타벅스환불 #스타벅스사이렌오더 #스타벅스달력 #스타벅스매장 #스타벅스신규 #스타벅스논란 #스타벅스알바직원파트너 #스타벅스취소 #스타벅스설날구정 #스타벅스추석 #스타벅스쉬는날 #스타벅스휴무일빨간날 #스타벅스리유저블컵 #스타벅스콘센트 #스타벅스충전 #스타벅스화장실비밀번호"
